13:20:27.138891 IP 10.0.2.15.42642 > 151.101.117.164.443: Flags [P.], seq 811961575:811962092, ack 75776002, win 64240, length 517
13:20:27.139484 IP 151.101.117.164.443 > 10.0.2.15.42642: Flags [.], ack 517, win 65535, length 0
13:20:27.157736 IP 151.101.117.164.443 > 10.0.2.15.42642: Flags [.], seq 1:2921, ack 517, win 65535, length 2920
13:20:27.157761 IP 10.0.2.15.42642 > 151.101.117.164.443: Flags [.], ack 2921, win 62780, length 0
13:20:27.158277 IP 151.101.117.164.443 > 10.0.2.15.42642: Flags [P.], seq 2921:5497, ack 517, win 65535, length 2576
13:20:27.158294 IP 10.0.2.15.42642 > 151.101.117.164.443: Flags [.], ack 5497, win 62780, length 0
13:20:27.159613 IP 151.101.117.164.443 > 10.0.2.15.42642: Flags [P.], seq 5497:5607, ack 517, win 65535, length 110
13:20:27.159636 IP 10.0.2.15.42642 > 151.101.117.164.443: Flags [.], ack 5607, win 62780, length 0
13:20:27.161184 IP 10.0.2.15.42642 > 151.101.117.164.443: Flags [P.], seq 517:610, ack 5607, win 62780, length 93
13:20:27.161529 IP 151.101.117.164.443 > 10.0.2.15.42642: Flags [.], ack 610, win 65535, length 0
13:20:27.177176 IP 151.101.117.164.443 > 10.0.2.15.42642: Flags [P.], seq 5607:5658, ack 610, win 65535, length 51
13:20:27.177203 IP 10.0.2.15.42642 > 151.101.117.164.443: Flags [.], ack 5658, win 62780, length 0
13:20:27.177795 IP 10.0.2.15.42642 > 151.101.117.164.443: Flags [P.], seq 610:663, ack 5658, win 62780, length 53
13:20:27.177848 IP 10.0.2.15.42642 > 151.101.117.164.443: Flags [P.], seq 663:719, ack 5658, win 62780, length 56
13:20:27.178068 IP 10.0.2.15.42642 > 151.101.117.164.443: Flags [P.], seq 719:761, ack 5658, win 62780, length 42
13:20:27.178130 IP 10.0.2.15.42642 > 151.101.117.164.443: Flags [P.], seq 761:830, ack 5658, win 62780, length 69
13:20:27.178770 IP 151.101.117.164.443 > 10.0.2.15.42642: Flags [.], ack 663, win 65535, length 0
13:20:27.178773 IP 151.101.117.164.443 > 10.0.2.15.42642: Flags [.], ack 719, win 65535, length 0
13:20:27.178774 IP 151.101.117.164.443 > 10.0.2.15.42642: Flags [.], ack 761, win 65535, length 0
13:20:27.178775 IP 151.101.117.164.443 > 10.0.2.15.42642: Flags [.], ack 830, win 65535, length 0
13:20:27.192197 IP 151.101.117.164.443 > 10.0.2.15.42642: Flags [P.], seq 5658:5753, ack 830, win 65535, length 95
13:20:27.192216 IP 10.0.2.15.42642 > 151.101.117.164.443: Flags [.], ack 5753, win 62780, length 0
13:20:27.192430 IP 10.0.2.15.42642 > 151.101.117.164.443: Flags [P.], seq 830:868, ack 5753, win 62780, length 38
13:20:27.192913 IP 151.101.117.164.443 > 10.0.2.15.42642: Flags [.], ack 868, win 65535, length 0
13:20:27.197747 IP 151.101.117.164.443 > 10.0.2.15.42642: Flags [P.], seq 5753:12623, ack 868, win 65535, length 6870
13:20:27.198011 IP 10.0.2.15.42642 > 151.101.117.164.443: Flags [.], ack 12623, win 59860, length 0
13:20:27.198620 IP 151.101.117.164.443 > 10.0.2.15.42642: Flags [P.], seq 12623:16745, ack 868, win 65535, length 4122
13:20:27.198639 IP 10.0.2.15.42642 > 151.101.117.164.443: Flags [.], ack 16745, win 61320, length 0
13:20:27.199836 IP 151.101.117.164.443 > 10.0.2.15.42642: Flags [P.], seq 16745:20867, ack 868, win 65535, length 4122
13:20:27.200013 IP 10.0.2.15.42642 > 151.101.117.164.443: Flags [.], ack 20867, win 61320, length 0
13:20:27.200685 IP 151.101.117.164.443 > 10.0.2.15.42642: Flags [P.], seq 20867:26363, ack 868, win 65535, length 5496
13:20:27.200707 IP 10.0.2.15.42642 > 151.101.117.164.443: Flags [.], ack 26363, win 61320, length 0
13:20:27.202010 IP 151.101.117.164.443 > 10.0.2.15.42642: Flags [P.], seq 26363:33233, ack 868, win 65535, length 6870
13:20:27.202115 IP 10.0.2.15.42642 > 151.101.117.164.443: Flags [.], ack 33233, win 59860, length 0
13:20:27.202941 IP 151.101.117.164.443 > 10.0.2.15.42642: Flags [P.], seq 33233:37355, ack 868, win 65535, length 4122
13:20:27.202956 IP 10.0.2.15.42642 > 151.101.117.164.443: Flags [.], ack 37355, win 61320, length 0
13:20:27.204106 IP 151.101.117.164.443 > 10.0.2.15.42642: Flags [P.], seq 37355:42851, ack 868, win 65535, length 5496
13:20:27.204123 IP 10.0.2.15.42642 > 151.101.117.164.443: Flags [.], ack 42851, win 61320, length 0
13:20:27.204851 IP 151.101.117.164.443 > 10.0.2.15.42642: Flags [P.], seq 42851:45599, ack 868, win 65535, length 2748
13:20:27.204866 IP 10.0.2.15.42642 > 151.101.117.164.443: Flags [.], ack 45599, win 62780, length 0
13:20:27.205961 IP 151.101.117.164.443 > 10.0.2.15.42642: Flags [P.], seq 45599:51095, ack 868, win 65535, length 5496
13:20:27.206030 IP 10.0.2.15.42642 > 151.101.117.164.443: Flags [.], ack 51095, win 61320, length 0
13:20:27.206727 IP 151.101.117.164.443 > 10.0.2.15.42642: Flags [P.], seq 51095:56591, ack 868, win 65535, length 5496
13:20:27.206740 IP 10.0.2.15.42642 > 151.101.117.164.443: Flags [.], ack 56591, win 61320, length 0
13:20:27.208790 IP 151.101.117.164.443 > 10.0.2.15.42642: Flags [P.], seq 56591:57965, ack 868, win 65535, length 1374
13:20:27.209972 IP 151.101.117.164.443 > 10.0.2.15.42642: Flags [P.], seq 57965:60713, ack 868, win 65535, length 2748
13:20:27.209987 IP 10.0.2.15.42642 > 151.101.117.164.443: Flags [.], ack 60713, win 62780, length 0
13:20:27.211586 IP 151.101.117.164.443 > 10.0.2.15.42642: Flags [P.], seq 60713:64835, ack 868, win 65535, length 4122
13:20:27.211754 IP 10.0.2.15.42642 > 151.101.117.164.443: Flags [.], ack 64835, win 61320, length 0
13:20:27.212184 IP 151.101.117.164.443 > 10.0.2.15.42642: Flags [P.], seq 64835:68957, ack 868, win 65535, length 4122
13:20:27.212196 IP 10.0.2.15.42642 > 151.101.117.164.443: Flags [.], ack 68957, win 61320, length 0
13:20:27.213463 IP 151.101.117.164.443 > 10.0.2.15.42642: Flags [P.], seq 68957:74453, ack 868, win 65535, length 5496
13:20:27.213478 IP 10.0.2.15.42642 > 151.101.117.164.443: Flags [.], ack 74453, win 65535, length 0
13:20:27.213740 IP 151.101.117.164.443 > 10.0.2.15.42642: Flags [P.], seq 74453:77201, ack 868, win 65535, length 2748
13:20:27.213752 IP 10.0.2.15.42642 > 151.101.117.164.443: Flags [.], ack 77201, win 65535, length 0
13:20:27.214222 IP 151.101.117.164.443 > 10.0.2.15.42642: Flags [P.], seq 77201:81323, ack 868, win 65535, length 4122
13:20:27.214234 IP 10.0.2.15.42642 > 151.101.117.164.443: Flags [.], ack 81323, win 65535, length 0
13:20:27.215160 IP 151.101.117.164.443 > 10.0.2.15.42642: Flags [P.], seq 81323:85445, ack 868, win 65535, length 4122
13:20:27.215174 IP 10.0.2.15.42642 > 151.101.117.164.443: Flags [.], ack 85445, win 65535, length 0
13:20:27.216360 IP 151.101.117.164.443 > 10.0.2.15.42642: Flags [P.], seq 85445:90941, ack 868, win 65535, length 5496
13:20:27.216375 IP 10.0.2.15.42642 > 151.101.117.164.443: Flags [.], ack 90941, win 65535, length 0
13:20:27.217390 IP 151.101.117.164.443 > 10.0.2.15.42642: Flags [P.], seq 90941:97811, ack 868, win 65535, length 6870
13:20:27.217406 IP 10.0.2.15.42642 > 151.101.117.164.443: Flags [.], ack 97811, win 65535, length 0
13:20:27.218593 IP 151.101.117.164.443 > 10.0.2.15.42642: Flags [P.], seq 97811:101933, ack 868, win 65535, length 4122
13:20:27.218607 IP 10.0.2.15.42642 > 151.101.117.164.443: Flags [.], ack 101933, win 65535, length 0
13:20:27.221965 IP 151.101.117.164.443 > 10.0.2.15.42642: Flags [P.], seq 101933:115673, ack 868, win 65535, length 13740
13:20:27.221982 IP 10.0.2.15.42642 > 151.101.117.164.443: Flags [.], ack 115673, win 65535, length 0
13:20:27.222189 IP 151.101.117.164.443 > 10.0.2.15.42642: Flags [P.], seq 115673:122543, ack 868, win 65535, length 6870
13:20:27.222201 IP 10.0.2.15.42642 > 151.101.117.164.443: Flags [.], ack 122543, win 65535, length 0
13:20:27.223796 IP 151.101.117.164.443 > 10.0.2.15.42642: Flags [P.], seq 122543:126665, ack 868, win 65535, length 4122
13:20:27.223814 IP 10.0.2.15.42642 > 151.101.117.164.443: Flags [.], ack 126665, win 65535, length 0
13:20:27.224179 IP 151.101.117.164.443 > 10.0.2.15.42642: Flags [P.], seq 126665:132161, ack 868, win 65535, length 5496
13:20:27.224181 IP 151.101.117.164.443 > 10.0.2.15.42642: Flags [.], seq 132161:133621, ack 868, win 65535, length 1460
13:20:27.224197 IP 10.0.2.15.42642 > 151.101.117.164.443: Flags [.], ack 132161, win 65535, length 0
13:20:27.224351 IP 151.101.117.164.443 > 10.0.2.15.42642: Flags [P.], seq 133621:140405, ack 868, win 65535, length 6784
13:20:27.224359 IP 10.0.2.15.42642 > 151.101.117.164.443: Flags [.], ack 140405, win 65535, length 0
13:20:27.225844 IP 151.101.117.164.443 > 10.0.2.15.42642: Flags [P.], seq 140405:147275, ack 868, win 65535, length 6870
13:20:27.225907 IP 10.0.2.15.42642 > 151.101.117.164.443: Flags [.], ack 147275, win 65535, length 0
13:20:27.226076 IP 151.101.117.164.443 > 10.0.2.15.42642: Flags [P.], seq 147275:151397, ack 868, win 65535, length 4122
13:20:27.226087 IP 10.0.2.15.42642 > 151.101.117.164.443: Flags [.], ack 151397, win 65535, length 0
13:20:27.226347 IP 151.101.117.164.443 > 10.0.2.15.42642: Flags [P.], seq 151397:156893, ack 868, win 65535, length 5496
13:20:27.226356 IP 10.0.2.15.42642 > 151.101.117.164.443: Flags [.], ack 156893, win 65535, length 0
13:20:27.228854 IP 151.101.117.164.443 > 10.0.2.15.42642: Flags [P.], seq 156893:167885, ack 868, win 65535, length 10992
13:20:27.228910 IP 10.0.2.15.42642 > 151.101.117.164.443: Flags [.], ack 167885, win 65535, length 0
13:20:27.229154 IP 151.101.117.164.443 > 10.0.2.15.42642: Flags [.], seq 167885:169345, ack 868, win 65535, length 1460
13:20:27.229327 IP 151.101.117.164.443 > 10.0.2.15.42642: Flags [P.], seq 169345:173381, ack 868, win 65535, length 4036
13:20:27.229338 IP 10.0.2.15.42642 > 151.101.117.164.443: Flags [.], ack 173381, win 65535, length 0
13:20:27.229947 IP 151.101.117.164.443 > 10.0.2.15.42642: Flags [P.], seq 173381:184373, ack 868, win 65535, length 10992
13:20:27.229966 IP 10.0.2.15.42642 > 151.101.117.164.443: Flags [.], ack 184373, win 65535, length 0
13:20:27.230140 IP 151.101.117.164.443 > 10.0.2.15.42642: Flags [P.], seq 184373:189869, ack 868, win 65535, length 5496
13:20:27.230150 IP 10.0.2.15.42642 > 151.101.117.164.443: Flags [.], ack 189869, win 65535, length 0
13:20:27.232674 IP 151.101.117.164.443 > 10.0.2.15.42642: Flags [P.], seq 189869:195365, ack 868, win 65535, length 5496
13:20:27.232733 IP 10.0.2.15.42642 > 151.101.117.164.443: Flags [.], ack 195365, win 65535, length 0
13:20:27.232982 IP 151.101.117.164.443 > 10.0.2.15.42642: Flags [P.], seq 195365:203609, ack 868, win 65535, length 8244
13:20:27.232991 IP 10.0.2.15.42642 > 151.101.117.164.443: Flags [.], ack 203609, win 65535, length 0
13:20:27.235156 IP 151.101.117.164.443 > 10.0.2.15.42642: Flags [P.], seq 203609:214601, ack 868, win 65535, length 10992
13:20:27.235173 IP 10.0.2.15.42642 > 151.101.117.164.443: Flags [.], ack 214601, win 65535, length 0
13:20:27.235256 IP 151.101.117.164.443 > 10.0.2.15.42642: Flags [.], seq 214601:218981, ack 868, win 65535, length 4380
13:20:27.235264 IP 10.0.2.15.42642 > 151.101.117.164.443: Flags [.], ack 218981, win 65535, length 0
13:20:27.235392 IP 151.101.117.164.443 > 10.0.2.15.42642: Flags [P.], seq 218981:222845, ack 868, win 65535, length 3864
13:20:27.235398 IP 10.0.2.15.42642 > 151.101.117.164.443: Flags [.], ack 222845, win 65535, length 0
13:20:27.235733 IP 151.101.117.164.443 > 10.0.2.15.42642: Flags [P.], seq 222845:229715, ack 868, win 65535, length 6870
13:20:27.235744 IP 10.0.2.15.42642 > 151.101.117.164.443: Flags [.], ack 229715, win 65535, length 0
13:20:27.236235 IP 151.101.117.164.443 > 10.0.2.15.42642: Flags [P.], seq 229715:235211, ack 868, win 65535, length 5496
13:20:27.236247 IP 10.0.2.15.42642 > 151.101.117.164.443: Flags [.], ack 235211, win 65535, length 0
13:20:27.236565 IP 151.101.117.164.443 > 10.0.2.15.42642: Flags [P.], seq 235211:236585, ack 868, win 65535, length 1374
13:20:27.237521 IP 151.101.117.164.443 > 10.0.2.15.42642: Flags [P.], seq 236585:247577, ack 868, win 65535, length 10992
13:20:27.237538 IP 10.0.2.15.42642 > 151.101.117.164.443: Flags [.], ack 247577, win 65535, length 0
13:20:27.238044 IP 151.101.117.164.443 > 10.0.2.15.42642: Flags [P.], seq 247577:255821, ack 868, win 65535, length 8244
13:20:27.238065 IP 10.0.2.15.42642 > 151.101.117.164.443: Flags [.], ack 255821, win 65535, length 0
13:20:27.238235 IP 151.101.117.164.443 > 10.0.2.15.42642: Flags [P.], seq 255821:259943, ack 868, win 65535, length 4122
13:20:27.238246 IP 10.0.2.15.42642 > 151.101.117.164.443: Flags [.], ack 259943, win 65535, length 0
13:20:27.239161 IP 151.101.117.164.443 > 10.0.2.15.42642: Flags [P.], seq 259943:270935, ack 868, win 65535, length 10992
13:20:27.239177 IP 10.0.2.15.42642 > 151.101.117.164.443: Flags [.], ack 270935, win 65535, length 0
13:20:27.239474 IP 151.101.117.164.443 > 10.0.2.15.42642: Flags [P.], seq 270935:276431, ack 868, win 65535, length 5496
13:20:27.239483 IP 10.0.2.15.42642 > 151.101.117.164.443: Flags [.], ack 276431, win 65535, length 0
13:20:27.243035 IP 151.101.117.164.443 > 10.0.2.15.42642: Flags [P.], seq 276431:284675, ack 868, win 65535, length 8244
13:20:27.243053 IP 10.0.2.15.42642 > 151.101.117.164.443: Flags [.], ack 284675, win 65535, length 0
13:20:27.243362 IP 151.101.117.164.443 > 10.0.2.15.42642: Flags [.], seq 284675:296355, ack 868, win 65535, length 11680
13:20:27.243375 IP 10.0.2.15.42642 > 151.101.117.164.443: Flags [.], ack 296355, win 65535, length 0
13:20:27.243507 IP 151.101.117.164.443 > 10.0.2.15.42642: Flags [P.], seq 296355:297041, ack 868, win 65535, length 686
13:20:27.243734 IP 151.101.117.164.443 > 10.0.2.15.42642: Flags [P.], seq 297041:302537, ack 868, win 65535, length 5496
13:20:27.243745 IP 10.0.2.15.42642 > 151.101.117.164.443: Flags [.], ack 302537, win 65535, length 0
13:20:27.244109 IP 151.101.117.164.443 > 10.0.2.15.42642: Flags [P.], seq 302537:312155, ack 868, win 65535, length 9618
13:20:27.244122 IP 10.0.2.15.42642 > 151.101.117.164.443: Flags [.], ack 312155, win 65535, length 0
13:20:27.244620 IP 151.101.117.164.443 > 10.0.2.15.42642: Flags [P.], seq 312155:320399, ack 868, win 65535, length 8244
13:20:27.244633 IP 10.0.2.15.42642 > 151.101.117.164.443: Flags [.], ack 320399, win 65535, length 0
13:20:27.244922 IP 151.101.117.164.443 > 10.0.2.15.42642: Flags [P.], seq 320399:323147, ack 868, win 65535, length 2748
13:20:27.244933 IP 10.0.2.15.42642 > 151.101.117.164.443: Flags [.], ack 323147, win 65535, length 0
13:20:27.249833 IP 151.101.117.164.443 > 10.0.2.15.42642: Flags [P.], seq 323147:327269, ack 868, win 65535, length 4122
13:20:27.249853 IP 10.0.2.15.42642 > 151.101.117.164.443: Flags [.], ack 327269, win 65535, length 0
13:20:27.250318 IP 151.101.117.164.443 > 10.0.2.15.42642: Flags [P.], seq 327269:339635, ack 868, win 65535, length 12366
13:20:27.250336 IP 10.0.2.15.42642 > 151.101.117.164.443: Flags [.], ack 339635, win 65535, length 0
13:20:27.250376 IP 151.101.117.164.443 > 10.0.2.15.42642: Flags [.], seq 339635:342555, ack 868, win 65535, length 2920
13:20:27.250383 IP 10.0.2.15.42642 > 151.101.117.164.443: Flags [.], ack 342555, win 65535, length 0
13:20:27.250888 IP 151.101.117.164.443 > 10.0.2.15.42642: Flags [P.], seq 342555:347879, ack 868, win 65535, length 5324
13:20:27.250890 IP 151.101.117.164.443 > 10.0.2.15.42642: Flags [P.], seq 347879:357497, ack 868, win 65535, length 9618
13:20:27.250904 IP 10.0.2.15.42642 > 151.101.117.164.443: Flags [.], ack 347879, win 65535, length 0
13:20:27.250926 IP 10.0.2.15.42642 > 151.101.117.164.443: Flags [.], ack 357497, win 65535, length 0
13:20:27.251357 IP 151.101.117.164.443 > 10.0.2.15.42642: Flags [P.], seq 357497:365741, ack 868, win 65535, length 8244
13:20:27.251407 IP 10.0.2.15.42642 > 151.101.117.164.443: Flags [.], ack 365741, win 65535, length 0
13:20:27.251944 IP 151.101.117.164.443 > 10.0.2.15.42642: Flags [P.], seq 365741:375359, ack 868, win 65535, length 9618
13:20:27.251959 IP 10.0.2.15.42642 > 151.101.117.164.443: Flags [.], ack 375359, win 65535, length 0
13:20:27.252174 IP 151.101.117.164.443 > 10.0.2.15.42642: Flags [P.], seq 375359:384977, ack 868, win 65535, length 9618
13:20:27.252182 IP 10.0.2.15.42642 > 151.101.117.164.443: Flags [.], ack 384977, win 65535, length 0
13:20:27.252434 IP 151.101.117.164.443 > 10.0.2.15.42642: Flags [P.], seq 384977:390473, ack 868, win 65535, length 5496
13:20:27.252443 IP 10.0.2.15.42642 > 151.101.117.164.443: Flags [.], ack 390473, win 65535, length 0
13:20:27.252846 IP 151.101.117.164.443 > 10.0.2.15.42642: Flags [P.], seq 390473:400091, ack 868, win 65535, length 9618
13:20:27.252903 IP 10.0.2.15.42642 > 151.101.117.164.443: Flags [.], ack 400091, win 65535, length 0
13:20:27.253187 IP 151.101.117.164.443 > 10.0.2.15.42642: Flags [P.], seq 400091:405587, ack 868, win 65535, length 5496
13:20:27.253199 IP 10.0.2.15.42642 > 151.101.117.164.443: Flags [.], ack 405587, win 65535, length 0
13:20:27.254929 IP 151.101.117.164.443 > 10.0.2.15.42642: Flags [P.], seq 405587:417097, ack 868, win 65535, length 11510
13:20:27.255001 IP 10.0.2.15.42642 > 151.101.117.164.443: Flags [.], ack 417097, win 65535, length 0
13:20:27.255065 IP 151.101.117.164.443 > 10.0.2.15.42642: Flags [P.], seq 417097:425341, ack 868, win 65535, length 8244
13:20:27.255074 IP 10.0.2.15.42642 > 151.101.117.164.443: Flags [.], ack 425341, win 65535, length 0
13:20:27.255527 IP 151.101.117.164.443 > 10.0.2.15.42642: Flags [P.], seq 425341:433585, ack 868, win 65535, length 8244
13:20:27.255539 IP 10.0.2.15.42642 > 151.101.117.164.443: Flags [.], ack 433585, win 65535, length 0
13:20:27.256290 IP 151.101.117.164.443 > 10.0.2.15.42642: Flags [P.], seq 433585:447325, ack 868, win 65535, length 13740
13:20:27.256304 IP 10.0.2.15.42642 > 151.101.117.164.443: Flags [.], ack 447325, win 65535, length 0
13:20:27.256733 IP 151.101.117.164.443 > 10.0.2.15.42642: Flags [P.], seq 447325:452821, ack 868, win 65535, length 5496
13:20:27.256748 IP 10.0.2.15.42642 > 151.101.117.164.443: Flags [.], ack 452821, win 65535, length 0
13:20:27.257349 IP 151.101.117.164.443 > 10.0.2.15.42642: Flags [P.], seq 452821:462439, ack 868, win 65535, length 9618
13:20:27.257365 IP 10.0.2.15.42642 > 151.101.117.164.443: Flags [.], ack 462439, win 65535, length 0
13:20:27.257918 IP 151.101.117.164.443 > 10.0.2.15.42642: Flags [P.], seq 462439:475661, ack 868, win 65535, length 13222
13:20:27.257934 IP 10.0.2.15.42642 > 151.101.117.164.443: Flags [.], ack 475661, win 65535, length 0
13:20:27.257966 IP 151.101.117.164.443 > 10.0.2.15.42642: Flags [P.], seq 475661:483905, ack 868, win 65535, length 8244
13:20:27.257971 IP 10.0.2.15.42642 > 151.101.117.164.443: Flags [.], ack 483905, win 65535, length 0
13:20:27.258639 IP 151.101.117.164.443 > 10.0.2.15.42642: Flags [P.], seq 483905:494897, ack 868, win 65535, length 10992
13:20:27.258654 IP 10.0.2.15.42642 > 151.101.117.164.443: Flags [.], ack 494897, win 65535, length 0
13:20:27.258797 IP 151.101.117.164.443 > 10.0.2.15.42642: Flags [P.], seq 494897:503141, ack 868, win 65535, length 8244
13:20:27.258805 IP 10.0.2.15.42642 > 151.101.117.164.443: Flags [.], ack 503141, win 65535, length 0
13:20:27.259015 IP 151.101.117.164.443 > 10.0.2.15.42642: Flags [P.], seq 503141:510011, ack 868, win 65535, length 6870
13:20:27.259028 IP 10.0.2.15.42642 > 151.101.117.164.443: Flags [.], ack 510011, win 65535, length 0
13:20:27.259380 IP 151.101.117.164.443 > 10.0.2.15.42642: Flags [P.], seq 510011:516881, ack 868, win 65535, length 6870
13:20:27.259390 IP 10.0.2.15.42642 > 151.101.117.164.443: Flags [.], ack 516881, win 65535, length 0
13:20:27.259632 IP 151.101.117.164.443 > 10.0.2.15.42642: Flags [.], seq 516881:518341, ack 868, win 65535, length 1460
13:20:27.259941 IP 151.101.117.164.443 > 10.0.2.15.42642: Flags [P.], seq 518341:521003, ack 868, win 65535, length 2662
13:20:27.259953 IP 10.0.2.15.42642 > 151.101.117.164.443: Flags [.], ack 521003, win 65535, length 0
13:20:27.261159 IP 151.101.117.164.443 > 10.0.2.15.42642: Flags [P.], seq 521003:527873, ack 868, win 65535, length 6870
13:20:27.261163 IP 151.101.117.164.443 > 10.0.2.15.42642: Flags [P.], seq 527873:542987, ack 868, win 65535, length 15114
13:20:27.261569 IP 151.101.117.164.443 > 10.0.2.15.42642: Flags [P.], seq 542987:555353, ack 868, win 65535, length 12366
13:20:27.261703 IP 10.0.2.15.42642 > 151.101.117.164.443: Flags [.], ack 542987, win 65535, length 0
13:20:27.261721 IP 10.0.2.15.42642 > 151.101.117.164.443: Flags [.], ack 555353, win 65535, length 0
13:20:27.262423 IP 151.101.117.164.443 > 10.0.2.15.42642: Flags [P.], seq 555353:558101, ack 868, win 65535, length 2748
13:20:27.262435 IP 10.0.2.15.42642 > 151.101.117.164.443: Flags [.], ack 558101, win 65535, length 0
13:20:27.265051 IP 151.101.117.164.443 > 10.0.2.15.42642: Flags [P.], seq 558101:563597, ack 868, win 65535, length 5496
13:20:27.265069 IP 10.0.2.15.42642 > 151.101.117.164.443: Flags [.], ack 563597, win 65535, length 0
13:20:27.265338 IP 151.101.117.164.443 > 10.0.2.15.42642: Flags [P.], seq 563597:574589, ack 868, win 65535, length 10992
13:20:27.265350 IP 10.0.2.15.42642 > 151.101.117.164.443: Flags [.], ack 574589, win 65535, length 0
13:20:27.265689 IP 151.101.117.164.443 > 10.0.2.15.42642: Flags [P.], seq 574589:582833, ack 868, win 65535, length 8244
13:20:27.265738 IP 10.0.2.15.42642 > 151.101.117.164.443: Flags [.], ack 582833, win 65535, length 0
13:20:27.266276 IP 151.101.117.164.443 > 10.0.2.15.42642: Flags [P.], seq 582833:592451, ack 868, win 65535, length 9618
13:20:27.266310 IP 10.0.2.15.42642 > 151.101.117.164.443: Flags [.], ack 592451, win 65535, length 0
13:20:27.266690 IP 151.101.117.164.443 > 10.0.2.15.42642: Flags [P.], seq 592451:606191, ack 868, win 65535, length 13740
13:20:27.266703 IP 10.0.2.15.42642 > 151.101.117.164.443: Flags [.], ack 606191, win 65535, length 0
13:20:27.267193 IP 151.101.117.164.443 > 10.0.2.15.42642: Flags [P.], seq 606191:615809, ack 868, win 65535, length 9618
13:20:27.267263 IP 10.0.2.15.42642 > 151.101.117.164.443: Flags [.], ack 615809, win 65535, length 0
13:20:27.267832 IP 151.101.117.164.443 > 10.0.2.15.42642: Flags [P.], seq 615809:628175, ack 868, win 65535, length 12366
13:20:27.267886 IP 10.0.2.15.42642 > 151.101.117.164.443: Flags [.], ack 628175, win 65535, length 0
13:20:27.268126 IP 151.101.117.164.443 > 10.0.2.15.42642: Flags [.], seq 628175:636935, ack 868, win 65535, length 8760
13:20:27.268146 IP 10.0.2.15.42642 > 151.101.117.164.443: Flags [.], ack 636935, win 65535, length 0
13:20:27.268321 IP 151.101.117.164.443 > 10.0.2.15.42642: Flags [P.], seq 636935:637793, ack 868, win 65535, length 858
13:20:27.269245 IP 151.101.117.164.443 > 10.0.2.15.42642: Flags [P.], seq 637793:648785, ack 868, win 65535, length 10992
13:20:27.269351 IP 10.0.2.15.42642 > 151.101.117.164.443: Flags [.], ack 648785, win 65535, length 0
13:20:27.269552 IP 151.101.117.164.443 > 10.0.2.15.42642: Flags [P.], seq 648785:657029, ack 868, win 65535, length 8244
13:20:27.269641 IP 10.0.2.15.42642 > 151.101.117.164.443: Flags [.], ack 657029, win 65535, length 0
13:20:27.269848 IP 151.101.117.164.443 > 10.0.2.15.42642: Flags [P.], seq 657029:663899, ack 868, win 65535, length 6870
13:20:27.269857 IP 10.0.2.15.42642 > 151.101.117.164.443: Flags [.], ack 663899, win 65535, length 0
13:20:27.270917 IP 151.101.117.164.443 > 10.0.2.15.42642: Flags [P.], seq 663899:674891, ack 868, win 65535, length 10992
13:20:27.270933 IP 10.0.2.15.42642 > 151.101.117.164.443: Flags [.], ack 674891, win 65535, length 0
13:20:27.271137 IP 151.101.117.164.443 > 10.0.2.15.42642: Flags [P.], seq 674891:681761, ack 868, win 65535, length 6870
13:20:27.271147 IP 10.0.2.15.42642 > 151.101.117.164.443: Flags [.], ack 681761, win 65535, length 0
13:20:27.271641 IP 151.101.117.164.443 > 10.0.2.15.42642: Flags [P.], seq 681761:690005, ack 868, win 65535, length 8244
13:20:27.271655 IP 10.0.2.15.42642 > 151.101.117.164.443: Flags [.], ack 690005, win 65535, length 0
13:20:27.272103 IP 151.101.117.164.443 > 10.0.2.15.42642: Flags [P.], seq 690005:698249, ack 868, win 65535, length 8244
13:20:27.272119 IP 10.0.2.15.42642 > 151.101.117.164.443: Flags [.], ack 698249, win 65535, length 0
13:20:27.272408 IP 151.101.117.164.443 > 10.0.2.15.42642: Flags [P.], seq 698249:703745, ack 868, win 65535, length 5496
13:20:27.272544 IP 10.0.2.15.42642 > 151.101.117.164.443: Flags [.], ack 703745, win 65535, length 0
13:20:27.272896 IP 151.101.117.164.443 > 10.0.2.15.42642: Flags [P.], seq 703745:711989, ack 868, win 65535, length 8244
13:20:27.272919 IP 10.0.2.15.42642 > 151.101.117.164.443: Flags [.], ack 711989, win 65535, length 0
13:20:27.273336 IP 151.101.117.164.443 > 10.0.2.15.42642: Flags [P.], seq 711989:721607, ack 868, win 65535, length 9618
13:20:27.273347 IP 10.0.2.15.42642 > 151.101.117.164.443: Flags [.], ack 721607, win 65535, length 0
13:20:27.273523 IP 151.101.117.164.443 > 10.0.2.15.42642: Flags [P.], seq 721607:728477, ack 868, win 65535, length 6870
13:20:27.273530 IP 10.0.2.15.42642 > 151.101.117.164.443: Flags [.], ack 728477, win 65535, length 0
13:20:27.274027 IP 151.101.117.164.443 > 10.0.2.15.42642: Flags [P.], seq 728477:738095, ack 868, win 65535, length 9618
13:20:27.274040 IP 10.0.2.15.42642 > 151.101.117.164.443: Flags [.], ack 738095, win 65535, length 0
13:20:27.274378 IP 151.101.117.164.443 > 10.0.2.15.42642: Flags [P.], seq 738095:746339, ack 868, win 65535, length 8244
13:20:27.274392 IP 10.0.2.15.42642 > 151.101.117.164.443: Flags [.], ack 746339, win 65535, length 0
13:20:27.274744 IP 151.101.117.164.443 > 10.0.2.15.42642: Flags [P.], seq 746339:753209, ack 868, win 65535, length 6870
13:20:27.274756 IP 10.0.2.15.42642 > 151.101.117.164.443: Flags [.], ack 753209, win 65535, length 0
13:20:27.275104 IP 151.101.117.164.443 > 10.0.2.15.42642: Flags [P.], seq 753209:764201, ack 868, win 65535, length 10992
13:20:27.275269 IP 10.0.2.15.42642 > 151.101.117.164.443: Flags [.], ack 764201, win 65535, length 0
13:20:27.275646 IP 151.101.117.164.443 > 10.0.2.15.42642: Flags [P.], seq 764201:772445, ack 868, win 65535, length 8244
13:20:27.275658 IP 10.0.2.15.42642 > 151.101.117.164.443: Flags [.], ack 772445, win 65535, length 0
13:20:27.276043 IP 151.101.117.164.443 > 10.0.2.15.42642: Flags [P.], seq 772445:779315, ack 868, win 65535, length 6870
13:20:27.276099 IP 10.0.2.15.42642 > 151.101.117.164.443: Flags [.], ack 779315, win 65535, length 0
13:20:27.276457 IP 151.101.117.164.443 > 10.0.2.15.42642: Flags [P.], seq 779315:783437, ack 868, win 65535, length 4122
13:20:27.276472 IP 10.0.2.15.42642 > 151.101.117.164.443: Flags [.], ack 783437, win 65535, length 0
13:20:27.277170 IP 151.101.117.164.443 > 10.0.2.15.42642: Flags [P.], seq 783437:797177, ack 868, win 65535, length 13740
13:20:27.277192 IP 10.0.2.15.42642 > 151.101.117.164.443: Flags [.], ack 797177, win 65535, length 0
13:20:27.277722 IP 151.101.117.164.443 > 10.0.2.15.42642: Flags [P.], seq 797177:809543, ack 868, win 65535, length 12366
13:20:27.277739 IP 10.0.2.15.42642 > 151.101.117.164.443: Flags [.], ack 809543, win 65535, length 0
13:20:27.278214 IP 151.101.117.164.443 > 10.0.2.15.42642: Flags [P.], seq 809543:821909, ack 868, win 65535, length 12366
13:20:27.278234 IP 10.0.2.15.42642 > 151.101.117.164.443: Flags [.], ack 821909, win 65535, length 0
13:20:27.278611 IP 151.101.117.164.443 > 10.0.2.15.42642: Flags [P.], seq 821909:823283, ack 868, win 65535, length 1374
13:20:27.279596 IP 151.101.117.164.443 > 10.0.2.15.42642: Flags [P.], seq 823283:837023, ack 868, win 65535, length 13740
13:20:27.279613 IP 10.0.2.15.42642 > 151.101.117.164.443: Flags [.], ack 837023, win 65535, length 0
13:20:27.280123 IP 151.101.117.164.443 > 10.0.2.15.42642: Flags [P.], seq 837023:845267, ack 868, win 65535, length 8244
13:20:27.280176 IP 10.0.2.15.42642 > 151.101.117.164.443: Flags [.], ack 845267, win 65535, length 0
13:20:27.280332 IP 151.101.117.164.443 > 10.0.2.15.42642: Flags [P.], seq 845267:854885, ack 868, win 65535, length 9618
13:20:27.280350 IP 10.0.2.15.42642 > 151.101.117.164.443: Flags [.], ack 854885, win 65535, length 0
13:20:27.280715 IP 151.101.117.164.443 > 10.0.2.15.42642: Flags [P.], seq 854885:861755, ack 868, win 65535, length 6870
13:20:27.280727 IP 10.0.2.15.42642 > 151.101.117.164.443: Flags [.], ack 861755, win 65535, length 0
13:20:27.281148 IP 151.101.117.164.443 > 10.0.2.15.42642: Flags [P.], seq 861755:863129, ack 868, win 65535, length 1374
13:20:27.281546 IP 151.101.117.164.443 > 10.0.2.15.42642: Flags [P.], seq 863129:872747, ack 868, win 65535, length 9618
13:20:27.281559 IP 10.0.2.15.42642 > 151.101.117.164.443: Flags [.], ack 872747, win 65535, length 0
13:20:27.282036 IP 151.101.117.164.443 > 10.0.2.15.42642: Flags [.], seq 872747:881507, ack 868, win 65535, length 8760
13:20:27.282048 IP 10.0.2.15.42642 > 151.101.117.164.443: Flags [.], ack 881507, win 65535, length 0
13:20:27.282132 IP 151.101.117.164.443 > 10.0.2.15.42642: Flags [P.], seq 881507:883739, ack 868, win 65535, length 2232
13:20:27.282137 IP 10.0.2.15.42642 > 151.101.117.164.443: Flags [.], ack 883739, win 65535, length 0
13:20:27.282359 IP 151.101.117.164.443 > 10.0.2.15.42642: Flags [P.], seq 883739:894731, ack 868, win 65535, length 10992
13:20:27.282369 IP 10.0.2.15.42642 > 151.101.117.164.443: Flags [.], ack 894731, win 65535, length 0
13:20:27.282736 IP 151.101.117.164.443 > 10.0.2.15.42642: Flags [P.], seq 894731:900227, ack 868, win 65535, length 5496
13:20:27.282749 IP 10.0.2.15.42642 > 151.101.117.164.443: Flags [.], ack 900227, win 65535, length 0
13:20:27.283136 IP 151.101.117.164.443 > 10.0.2.15.42642: Flags [P.], seq 900227:902975, ack 868, win 65535, length 2748
13:20:27.283150 IP 10.0.2.15.42642 > 151.101.117.164.443: Flags [.], ack 902975, win 65535, length 0
13:20:27.283633 IP 151.101.117.164.443 > 10.0.2.15.42642: Flags [P.], seq 902975:909845, ack 868, win 65535, length 6870
13:20:27.283649 IP 10.0.2.15.42642 > 151.101.117.164.443: Flags [.], ack 909845, win 65535, length 0
13:20:27.284127 IP 151.101.117.164.443 > 10.0.2.15.42642: Flags [P.], seq 909845:916715, ack 868, win 65535, length 6870
13:20:27.284142 IP 10.0.2.15.42642 > 151.101.117.164.443: Flags [.], ack 916715, win 65535, length 0
13:20:27.284410 IP 151.101.117.164.443 > 10.0.2.15.42642: Flags [P.], seq 916715:929081, ack 868, win 65535, length 12366
13:20:27.284574 IP 10.0.2.15.42642 > 151.101.117.164.443: Flags [.], ack 929081, win 65535, length 0
13:20:27.284913 IP 151.101.117.164.443 > 10.0.2.15.42642: Flags [P.], seq 929081:938699, ack 868, win 65535, length 9618
13:20:27.284967 IP 10.0.2.15.42642 > 151.101.117.164.443: Flags [.], ack 938699, win 65535, length 0
13:20:27.285105 IP 151.101.117.164.443 > 10.0.2.15.42642: Flags [P.], seq 938699:942821, ack 868, win 65535, length 4122
13:20:27.285112 IP 10.0.2.15.42642 > 151.101.117.164.443: Flags [.], ack 942821, win 65535, length 0
13:20:27.285946 IP 151.101.117.164.443 > 10.0.2.15.42642: Flags [P.], seq 942821:951065, ack 868, win 65535, length 8244
13:20:27.286010 IP 10.0.2.15.42642 > 151.101.117.164.443: Flags [.], ack 951065, win 65535, length 0
13:20:27.286138 IP 151.101.117.164.443 > 10.0.2.15.42642: Flags [P.], seq 951065:956561, ack 868, win 65535, length 5496
13:20:27.286177 IP 10.0.2.15.42642 > 151.101.117.164.443: Flags [.], ack 956561, win 65535, length 0
13:20:27.286818 IP 151.101.117.164.443 > 10.0.2.15.42642: Flags [P.], seq 956561:966179, ack 868, win 65535, length 9618
13:20:27.286910 IP 10.0.2.15.42642 > 151.101.117.164.443: Flags [.], ack 966179, win 65535, length 0
13:20:27.287182 IP 151.101.117.164.443 > 10.0.2.15.42642: Flags [P.], seq 966179:977171, ack 868, win 65535, length 10992
13:20:27.287249 IP 10.0.2.15.42642 > 151.101.117.164.443: Flags [.], ack 977171, win 65535, length 0
13:20:27.287631 IP 151.101.117.164.443 > 10.0.2.15.42642: Flags [P.], seq 977171:982667, ack 868, win 65535, length 5496
13:20:27.287644 IP 10.0.2.15.42642 > 151.101.117.164.443: Flags [.], ack 982667, win 65535, length 0
13:20:27.288062 IP 151.101.117.164.443 > 10.0.2.15.42642: Flags [P.], seq 982667:989537, ack 868, win 65535, length 6870
13:20:27.288370 IP 151.101.117.164.443 > 10.0.2.15.42642: Flags [.], seq 989537:999757, ack 868, win 65535, length 10220
13:20:27.288544 IP 151.101.117.164.443 > 10.0.2.15.42642: Flags [P.], seq 999757:1001903, ack 868, win 65535, length 2146
13:20:27.288822 IP 151.101.117.164.443 > 10.0.2.15.42642: Flags [P.], seq 1001903:1011521, ack 868, win 65535, length 9618
13:20:27.288976 IP 10.0.2.15.42642 > 151.101.117.164.443: Flags [.], ack 1011521, win 65535, length 0
13:20:27.289081 IP 151.101.117.164.443 > 10.0.2.15.42642: Flags [P.], seq 1011521:1017017, ack 868, win 65535, length 5496
13:20:27.289145 IP 10.0.2.15.42642 > 151.101.117.164.443: Flags [.], ack 1017017, win 65535, length 0
13:20:27.289756 IP 151.101.117.164.443 > 10.0.2.15.42642: Flags [P.], seq 1017017:1022513, ack 868, win 65535, length 5496
13:20:27.289769 IP 10.0.2.15.42642 > 151.101.117.164.443: Flags [.], ack 1022513, win 65535, length 0
13:20:27.290409 IP 151.101.117.164.443 > 10.0.2.15.42642: Flags [P.], seq 1022513:1029383, ack 868, win 65535, length 6870
13:20:27.290575 IP 10.0.2.15.42642 > 151.101.117.164.443: Flags [.], ack 1029383, win 65535, length 0
13:20:27.290826 IP 151.101.117.164.443 > 10.0.2.15.42642: Flags [P.], seq 1029383:1040375, ack 868, win 65535, length 10992
13:20:27.290919 IP 10.0.2.15.42642 > 151.101.117.164.443: Flags [.], ack 1040375, win 65535, length 0
13:20:27.291088 IP 151.101.117.164.443 > 10.0.2.15.42642: Flags [.], seq 1040375:1043295, ack 868, win 65535, length 2920
13:20:27.291101 IP 10.0.2.15.42642 > 151.101.117.164.443: Flags [.], ack 1043295, win 65535, length 0
13:20:27.291276 IP 151.101.117.164.443 > 10.0.2.15.42642: Flags [P.], seq 1043295:1051367, ack 868, win 65535, length 8072
13:20:27.291366 IP 10.0.2.15.42642 > 151.101.117.164.443: Flags [.], ack 1051367, win 65535, length 0
13:20:27.291952 IP 151.101.117.164.443 > 10.0.2.15.42642: Flags [.], seq 1051367:1055747, ack 868, win 65535, length 4380
13:20:27.292023 IP 10.0.2.15.42642 > 151.101.117.164.443: Flags [.], ack 1055747, win 65535, length 0
13:20:27.292331 IP 151.101.117.164.443 > 10.0.2.15.42642: Flags [P.], seq 1055747:1059611, ack 868, win 65535, length 3864
13:20:27.292335 IP 151.101.117.164.443 > 10.0.2.15.42642: Flags [P.], seq 1059611:1066481, ack 868, win 65535, length 6870
13:20:27.292351 IP 151.101.117.164.443 > 10.0.2.15.42642: Flags [P.], seq 1066481:1077473, ack 868, win 65535, length 10992
13:20:27.292517 IP 10.0.2.15.42642 > 151.101.117.164.443: Flags [.], ack 1077473, win 65535, length 0
13:20:27.292730 IP 151.101.117.164.443 > 10.0.2.15.42642: Flags [.], seq 1077473:1081853, ack 868, win 65535, length 4380
13:20:27.292805 IP 151.101.117.164.443 > 10.0.2.15.42642: Flags [P.], seq 1081853:1084343, ack 868, win 65535, length 2490
13:20:27.292896 IP 10.0.2.15.42642 > 151.101.117.164.443: Flags [.], ack 1084343, win 65535, length 0
13:20:27.293093 IP 151.101.117.164.443 > 10.0.2.15.42642: Flags [P.], seq 1084343:1091213, ack 868, win 65535, length 6870
13:20:27.293141 IP 10.0.2.15.42642 > 151.101.117.164.443: Flags [.], ack 1091213, win 65535, length 0
13:20:27.293423 IP 151.101.117.164.443 > 10.0.2.15.42642: Flags [P.], seq 1091213:1102205, ack 868, win 65535, length 10992
13:20:27.293582 IP 10.0.2.15.42642 > 151.101.117.164.443: Flags [.], ack 1102205, win 65535, length 0
13:20:27.293798 IP 151.101.117.164.443 > 10.0.2.15.42642: Flags [P.], seq 1102205:1110449, ack 868, win 65535, length 8244
13:20:27.293829 IP 10.0.2.15.42642 > 151.101.117.164.443: Flags [.], ack 1110449, win 65535, length 0
13:20:27.294728 IP 151.101.117.164.443 > 10.0.2.15.42642: Flags [P.], seq 1110449:1114571, ack 868, win 65535, length 4122
13:20:27.294842 IP 10.0.2.15.42642 > 151.101.117.164.443: Flags [.], ack 1114571, win 65535, length 0
13:20:27.295322 IP 151.101.117.164.443 > 10.0.2.15.42642: Flags [P.], seq 1114571:1124189, ack 868, win 65535, length 9618
13:20:27.295523 IP 151.101.117.164.443 > 10.0.2.15.42642: Flags [P.], seq 1124189:1132433, ack 868, win 65535, length 8244
13:20:27.295558 IP 10.0.2.15.42642 > 151.101.117.164.443: Flags [.], ack 1132433, win 65535, length 0
13:20:27.295853 IP 151.101.117.164.443 > 10.0.2.15.42642: Flags [P.], seq 1132433:1144799, ack 868, win 65535, length 12366
13:20:27.295928 IP 10.0.2.15.42642 > 151.101.117.164.443: Flags [.], ack 1144799, win 65535, length 0
13:20:27.296251 IP 151.101.117.164.443 > 10.0.2.15.42642: Flags [P.], seq 1144799:1151669, ack 868, win 65535, length 6870
13:20:27.296298 IP 10.0.2.15.42642 > 151.101.117.164.443: Flags [.], ack 1151669, win 65535, length 0
13:20:27.296674 IP 151.101.117.164.443 > 10.0.2.15.42642: Flags [P.], seq 1151669:1159913, ack 868, win 65535, length 8244
13:20:27.296722 IP 10.0.2.15.42642 > 151.101.117.164.443: Flags [.], ack 1159913, win 65535, length 0
13:20:27.296965 IP 151.101.117.164.443 > 10.0.2.15.42642: Flags [P.], seq 1159913:1164035, ack 868, win 65535, length 4122
13:20:27.296975 IP 10.0.2.15.42642 > 151.101.117.164.443: Flags [.], ack 1164035, win 65535, length 0
13:20:27.297451 IP 151.101.117.164.443 > 10.0.2.15.42642: Flags [P.], seq 1164035:1177775, ack 868, win 65535, length 13740
13:20:27.297520 IP 10.0.2.15.42642 > 151.101.117.164.443: Flags [.], ack 1177775, win 65535, length 0
13:20:27.297844 IP 151.101.117.164.443 > 10.0.2.15.42642: Flags [P.], seq 1177775:1180523, ack 868, win 65535, length 2748
13:20:27.297856 IP 10.0.2.15.42642 > 151.101.117.164.443: Flags [.], ack 1180523, win 65535, length 0
13:20:27.298402 IP 151.101.117.164.443 > 10.0.2.15.42642: Flags [.], seq 1180523:1189283, ack 868, win 65535, length 8760
13:20:27.298580 IP 151.101.117.164.443 > 10.0.2.15.42642: Flags [P.], seq 1189283:1190141, ack 868, win 65535, length 858
13:20:27.298719 IP 10.0.2.15.42642 > 151.101.117.164.443: Flags [.], ack 1190141, win 65535, length 0
13:20:27.298788 IP 151.101.117.164.443 > 10.0.2.15.42642: Flags [P.], seq 1190141:1199759, ack 868, win 65535, length 9618
13:20:27.298855 IP 10.0.2.15.42642 > 151.101.117.164.443: Flags [.], ack 1199759, win 65535, length 0
13:20:27.299248 IP 151.101.117.164.443 > 10.0.2.15.42642: Flags [P.], seq 1199759:1205255, ack 868, win 65535, length 5496
13:20:27.299260 IP 10.0.2.15.42642 > 151.101.117.164.443: Flags [.], ack 1205255, win 65535, length 0
13:20:27.299668 IP 151.101.117.164.443 > 10.0.2.15.42642: Flags [P.], seq 1205255:1214873, ack 868, win 65535, length 9618
13:20:27.299724 IP 10.0.2.15.42642 > 151.101.117.164.443: Flags [.], ack 1214873, win 65535, length 0
13:20:27.300048 IP 151.101.117.164.443 > 10.0.2.15.42642: Flags [P.], seq 1214873:1224491, ack 868, win 65535, length 9618
13:20:27.300181 IP 10.0.2.15.42642 > 151.101.117.164.443: Flags [.], ack 1224491, win 65535, length 0

