13:20:24.970388 IP 151.101.117.164.443 > 10.0.2.15.42630: Flags [S.], seq 75136001, ack 2335845718, win 65535, options [mss 1460], length 0
13:20:24.970423 IP 10.0.2.15.42630 > 151.101.117.164.443: Flags [.], ack 1, win 64240, length 0
13:20:24.977193 IP 10.0.2.15.42630 > 151.101.117.164.443: Flags [P.], seq 1:518, ack 1, win 64240, length 517
13:20:24.977817 IP 151.101.117.164.443 > 10.0.2.15.42630: Flags [.], ack 518, win 65535, length 0
13:20:24.996260 IP 151.101.117.164.443 > 10.0.2.15.42630: Flags [.], seq 1:2921, ack 518, win 65535, length 2920
13:20:24.996286 IP 10.0.2.15.42630 > 151.101.117.164.443: Flags [.], ack 2921, win 62780, length 0
13:20:24.996737 IP 151.101.117.164.443 > 10.0.2.15.42630: Flags [P.], seq 2921:5497, ack 518, win 65535, length 2576
13:20:24.996754 IP 10.0.2.15.42630 > 151.101.117.164.443: Flags [.], ack 5497, win 61320, length 0
13:20:24.998032 IP 151.101.117.164.443 > 10.0.2.15.42630: Flags [P.], seq 5497:5607, ack 518, win 65535, length 110
13:20:24.998067 IP 10.0.2.15.42630 > 151.101.117.164.443: Flags [.], ack 5607, win 61210, length 0
13:20:24.999040 IP 10.0.2.15.42630 > 151.101.117.164.443: Flags [P.], seq 518:611, ack 5607, win 62780, length 93
13:20:24.999694 IP 151.101.117.164.443 > 10.0.2.15.42630: Flags [.], ack 611, win 65535, length 0
13:20:25.013348 IP 151.101.117.164.443 > 10.0.2.15.42630: Flags [P.], seq 5607:5658, ack 611, win 65535, length 51
13:20:25.013370 IP 10.0.2.15.42630 > 151.101.117.164.443: Flags [.], ack 5658, win 62780, length 0
13:20:25.013826 IP 10.0.2.15.42630 > 151.101.117.164.443: Flags [P.], seq 611:664, ack 5658, win 62780, length 53
13:20:25.013871 IP 10.0.2.15.42630 > 151.101.117.164.443: Flags [P.], seq 664:720, ack 5658, win 62780, length 56
13:20:25.014050 IP 10.0.2.15.42630 > 151.101.117.164.443: Flags [P.], seq 720:762, ack 5658, win 62780, length 42
13:20:25.014096 IP 10.0.2.15.42630 > 151.101.117.164.443: Flags [P.], seq 762:831, ack 5658, win 62780, length 69
13:20:25.014240 IP 151.101.117.164.443 > 10.0.2.15.42630: Flags [.], ack 664, win 65535, length 0
13:20:25.014356 IP 151.101.117.164.443 > 10.0.2.15.42630: Flags [.], ack 720, win 65535, length 0
13:20:25.014358 IP 151.101.117.164.443 > 10.0.2.15.42630: Flags [.], ack 762, win 65535, length 0
13:20:25.014358 IP 151.101.117.164.443 > 10.0.2.15.42630: Flags [.], ack 831, win 65535, length 0
13:20:25.028468 IP 151.101.117.164.443 > 10.0.2.15.42630: Flags [P.], seq 5658:5753, ack 831, win 65535, length 95
13:20:25.028494 IP 10.0.2.15.42630 > 151.101.117.164.443: Flags [.], ack 5753, win 62780, length 0
13:20:25.028806 IP 10.0.2.15.42630 > 151.101.117.164.443: Flags [P.], seq 831:869, ack 5753, win 62780, length 38
13:20:25.029616 IP 151.101.117.164.443 > 10.0.2.15.42630: Flags [.], ack 869, win 65535, length 0
13:20:25.034752 IP 151.101.117.164.443 > 10.0.2.15.42630: Flags [P.], seq 5753:12623, ack 869, win 65535, length 6870
13:20:25.035012 IP 10.0.2.15.42630 > 151.101.117.164.443: Flags [.], ack 12623, win 59860, length 0
13:20:25.036007 IP 151.101.117.164.443 > 10.0.2.15.42630: Flags [P.], seq 12623:16745, ack 869, win 65535, length 4122
13:20:25.036029 IP 10.0.2.15.42630 > 151.101.117.164.443: Flags [.], ack 16745, win 61320, length 0
13:20:25.036742 IP 151.101.117.164.443 > 10.0.2.15.42630: Flags [P.], seq 16745:24989, ack 869, win 65535, length 8244
13:20:25.037046 IP 10.0.2.15.42630 > 151.101.117.164.443: Flags [.], ack 24989, win 55480, length 0
13:20:25.038384 IP 151.101.117.164.443 > 10.0.2.15.42630: Flags [P.], seq 24989:29111, ack 869, win 65535, length 4122
13:20:25.038407 IP 10.0.2.15.42630 > 151.101.117.164.443: Flags [.], ack 29111, win 61320, length 0
13:20:25.039266 IP 151.101.117.164.443 > 10.0.2.15.42630: Flags [P.], seq 29111:34607, ack 869, win 65535, length 5496
13:20:25.039286 IP 10.0.2.15.42630 > 151.101.117.164.443: Flags [.], ack 34607, win 61320, length 0
13:20:25.040077 IP 151.101.117.164.443 > 10.0.2.15.42630: Flags [P.], seq 34607:37355, ack 869, win 65535, length 2748
13:20:25.040132 IP 10.0.2.15.42630 > 151.101.117.164.443: Flags [.], ack 37355, win 58572, length 0
13:20:25.041077 IP 151.101.117.164.443 > 10.0.2.15.42630: Flags [P.], seq 37355:42851, ack 869, win 65535, length 5496
13:20:25.041094 IP 10.0.2.15.42630 > 151.101.117.164.443: Flags [.], ack 42851, win 61320, length 0
13:20:25.042259 IP 151.101.117.164.443 > 10.0.2.15.42630: Flags [P.], seq 42851:51095, ack 869, win 65535, length 8244
13:20:25.042333 IP 10.0.2.15.42630 > 151.101.117.164.443: Flags [.], ack 51095, win 58400, length 0
13:20:25.042655 IP 151.101.117.164.443 > 10.0.2.15.42630: Flags [P.], seq 51095:53843, ack 869, win 65535, length 2748
13:20:25.042702 IP 10.0.2.15.42630 > 151.101.117.164.443: Flags [.], ack 53843, win 56940, length 0
13:20:25.043477 IP 151.101.117.164.443 > 10.0.2.15.42630: Flags [P.], seq 53843:56591, ack 869, win 65535, length 2748
13:20:25.043490 IP 10.0.2.15.42630 > 151.101.117.164.443: Flags [.], ack 56591, win 62780, length 0
13:20:25.044206 IP 151.101.117.164.443 > 10.0.2.15.42630: Flags [P.], seq 56591:57965, ack 869, win 65535, length 1374
13:20:25.047355 IP 151.101.117.164.443 > 10.0.2.15.42630: Flags [P.], seq 57965:60713, ack 869, win 65535, length 2748
13:20:25.047370 IP 10.0.2.15.42630 > 151.101.117.164.443: Flags [.], ack 60713, win 62780, length 0
13:20:25.048444 IP 151.101.117.164.443 > 10.0.2.15.42630: Flags [P.], seq 60713:66209, ack 869, win 65535, length 5496
13:20:25.048523 IP 10.0.2.15.42630 > 151.101.117.164.443: Flags [.], ack 66209, win 61320, length 0
13:20:25.049898 IP 151.101.117.164.443 > 10.0.2.15.42630: Flags [P.], seq 66209:73079, ack 869, win 65535, length 6870
13:20:25.049970 IP 10.0.2.15.42630 > 151.101.117.164.443: Flags [.], ack 73079, win 62780, length 0
13:20:25.051078 IP 151.101.117.164.443 > 10.0.2.15.42630: Flags [P.], seq 73079:77201, ack 869, win 65535, length 4122
13:20:25.051093 IP 10.0.2.15.42630 > 151.101.117.164.443: Flags [.], ack 77201, win 65535, length 0
13:20:25.051936 IP 151.101.117.164.443 > 10.0.2.15.42630: Flags [P.], seq 77201:85445, ack 869, win 65535, length 8244
13:20:25.051956 IP 10.0.2.15.42630 > 151.101.117.164.443: Flags [.], ack 85445, win 65535, length 0
13:20:25.053655 IP 151.101.117.164.443 > 10.0.2.15.42630: Flags [P.], seq 85445:89567, ack 869, win 65535, length 4122
13:20:25.053676 IP 10.0.2.15.42630 > 151.101.117.164.443: Flags [.], ack 89567, win 65535, length 0
13:20:25.053898 IP 151.101.117.164.443 > 10.0.2.15.42630: Flags [.], seq 89567:91027, ack 869, win 65535, length 1460
13:20:25.054097 IP 151.101.117.164.443 > 10.0.2.15.42630: Flags [P.], seq 91027:93689, ack 869, win 65535, length 2662
13:20:25.054109 IP 10.0.2.15.42630 > 151.101.117.164.443: Flags [.], ack 93689, win 65535, length 0
13:20:25.055300 IP 151.101.117.164.443 > 10.0.2.15.42630: Flags [P.], seq 93689:101933, ack 869, win 65535, length 8244
13:20:25.055316 IP 10.0.2.15.42630 > 151.101.117.164.443: Flags [.], ack 101933, win 65535, length 0
13:20:25.056338 IP 151.101.117.164.443 > 10.0.2.15.42630: Flags [P.], seq 101933:107429, ack 869, win 65535, length 5496
13:20:25.056353 IP 10.0.2.15.42630 > 151.101.117.164.443: Flags [.], ack 107429, win 65535, length 0
13:20:25.057471 IP 151.101.117.164.443 > 10.0.2.15.42630: Flags [P.], seq 107429:114299, ack 869, win 65535, length 6870
13:20:25.057486 IP 10.0.2.15.42630 > 151.101.117.164.443: Flags [.], ack 114299, win 65535, length 0
13:20:25.058648 IP 151.101.117.164.443 > 10.0.2.15.42630: Flags [P.], seq 114299:122543, ack 869, win 65535, length 8244
13:20:25.058663 IP 10.0.2.15.42630 > 151.101.117.164.443: Flags [.], ack 122543, win 65535, length 0
13:20:25.059018 IP 151.101.117.164.443 > 10.0.2.15.42630: Flags [P.], seq 122543:123917, ack 869, win 65535, length 1374
13:20:25.059826 IP 151.101.117.164.443 > 10.0.2.15.42630: Flags [P.], seq 123917:132161, ack 869, win 65535, length 8244
13:20:25.060057 IP 10.0.2.15.42630 > 151.101.117.164.443: Flags [.], ack 132161, win 65535, length 0
13:20:25.060214 IP 151.101.117.164.443 > 10.0.2.15.42630: Flags [P.], seq 132161:139031, ack 869, win 65535, length 6870
13:20:25.060225 IP 10.0.2.15.42630 > 151.101.117.164.443: Flags [.], ack 139031, win 65535, length 0
13:20:25.062188 IP 151.101.117.164.443 > 10.0.2.15.42630: Flags [P.], seq 139031:150023, ack 869, win 65535, length 10992
13:20:25.062206 IP 10.0.2.15.42630 > 151.101.117.164.443: Flags [.], ack 150023, win 65535, length 0
13:20:25.062834 IP 151.101.117.164.443 > 10.0.2.15.42630: Flags [P.], seq 150023:151397, ack 869, win 65535, length 1374
13:20:25.063972 IP 151.101.117.164.443 > 10.0.2.15.42630: Flags [P.], seq 151397:162389, ack 869, win 65535, length 10992
13:20:25.063989 IP 10.0.2.15.42630 > 151.101.117.164.443: Flags [.], ack 162389, win 65535, length 0
13:20:25.064231 IP 151.101.117.164.443 > 10.0.2.15.42630: Flags [P.], seq 162389:170633, ack 869, win 65535, length 8244
13:20:25.064246 IP 10.0.2.15.42630 > 151.101.117.164.443: Flags [.], ack 170633, win 65535, length 0
13:20:25.065252 IP 151.101.117.164.443 > 10.0.2.15.42630: Flags [P.], seq 170633:178877, ack 869, win 65535, length 8244
13:20:25.065357 IP 10.0.2.15.42630 > 151.101.117.164.443: Flags [.], ack 178877, win 65535, length 0
13:20:25.066480 IP 151.101.117.164.443 > 10.0.2.15.42630: Flags [P.], seq 178877:185747, ack 869, win 65535, length 6870
13:20:25.066497 IP 10.0.2.15.42630 > 151.101.117.164.443: Flags [.], ack 185747, win 65535, length 0
13:20:25.066753 IP 151.101.117.164.443 > 10.0.2.15.42630: Flags [P.], seq 185747:189869, ack 869, win 65535, length 4122
13:20:25.066763 IP 10.0.2.15.42630 > 151.101.117.164.443: Flags [.], ack 189869, win 65535, length 0
13:20:25.067504 IP 151.101.117.164.443 > 10.0.2.15.42630: Flags [P.], seq 189869:196739, ack 869, win 65535, length 6870
13:20:25.067520 IP 10.0.2.15.42630 > 151.101.117.164.443: Flags [.], ack 196739, win 65535, length 0
13:20:25.069022 IP 151.101.117.164.443 > 10.0.2.15.42630: Flags [P.], seq 196739:217349, ack 869, win 65535, length 20610
13:20:25.069038 IP 10.0.2.15.42630 > 151.101.117.164.443: Flags [.], ack 217349, win 65535, length 0
13:20:25.069312 IP 151.101.117.164.443 > 10.0.2.15.42630: Flags [P.], seq 217349:221471, ack 869, win 65535, length 4122
13:20:25.069322 IP 10.0.2.15.42630 > 151.101.117.164.443: Flags [.], ack 221471, win 65535, length 0
13:20:25.070752 IP 151.101.117.164.443 > 10.0.2.15.42630: Flags [P.], seq 221471:233837, ack 869, win 65535, length 12366
13:20:25.070769 IP 10.0.2.15.42630 > 151.101.117.164.443: Flags [.], ack 233837, win 65535, length 0
13:20:25.070906 IP 151.101.117.164.443 > 10.0.2.15.42630: Flags [P.], seq 233837:237959, ack 869, win 65535, length 4122
13:20:25.070916 IP 10.0.2.15.42630 > 151.101.117.164.443: Flags [.], ack 237959, win 65535, length 0
13:20:25.071905 IP 151.101.117.164.443 > 10.0.2.15.42630: Flags [P.], seq 237959:240707, ack 869, win 65535, length 2748
13:20:25.071923 IP 10.0.2.15.42630 > 151.101.117.164.443: Flags [.], ack 240707, win 65535, length 0
13:20:25.073375 IP 151.101.117.164.443 > 10.0.2.15.42630: Flags [P.], seq 240707:264065, ack 869, win 65535, length 23358
13:20:25.073395 IP 10.0.2.15.42630 > 151.101.117.164.443: Flags [.], ack 264065, win 65535, length 0
13:20:25.073443 IP 151.101.117.164.443 > 10.0.2.15.42630: Flags [P.], seq 264065:272309, ack 869, win 65535, length 8244
13:20:25.073451 IP 10.0.2.15.42630 > 151.101.117.164.443: Flags [.], ack 272309, win 65535, length 0
13:20:25.074516 IP 151.101.117.164.443 > 10.0.2.15.42630: Flags [P.], seq 272309:279179, ack 869, win 65535, length 6870
13:20:25.074602 IP 10.0.2.15.42630 > 151.101.117.164.443: Flags [.], ack 279179, win 65535, length 0
13:20:25.074880 IP 151.101.117.164.443 > 10.0.2.15.42630: Flags [P.], seq 279179:288797, ack 869, win 65535, length 9618
13:20:25.074895 IP 10.0.2.15.42630 > 151.101.117.164.443: Flags [.], ack 288797, win 65535, length 0
13:20:25.075818 IP 151.101.117.164.443 > 10.0.2.15.42630: Flags [P.], seq 288797:298415, ack 869, win 65535, length 9618
13:20:25.075841 IP 10.0.2.15.42630 > 151.101.117.164.443: Flags [.], ack 298415, win 65535, length 0
13:20:25.076002 IP 151.101.117.164.443 > 10.0.2.15.42630: Flags [P.], seq 298415:303911, ack 869, win 65535, length 5496
13:20:25.076010 IP 10.0.2.15.42630 > 151.101.117.164.443: Flags [.], ack 303911, win 65535, length 0
13:20:25.076793 IP 151.101.117.164.443 > 10.0.2.15.42630: Flags [P.], seq 303911:308033, ack 869, win 65535, length 4122
13:20:25.076856 IP 10.0.2.15.42630 > 151.101.117.164.443: Flags [.], ack 308033, win 65535, length 0
13:20:25.077264 IP 151.101.117.164.443 > 10.0.2.15.42630: Flags [P.], seq 308033:317651, ack 869, win 65535, length 9618
13:20:25.077277 IP 10.0.2.15.42630 > 151.101.117.164.443: Flags [.], ack 317651, win 65535, length 0
13:20:25.078183 IP 151.101.117.164.443 > 10.0.2.15.42630: Flags [P.], seq 317651:330017, ack 869, win 65535, length 12366
13:20:25.078200 IP 10.0.2.15.42630 > 151.101.117.164.443: Flags [.], ack 330017, win 65535, length 0
13:20:25.078435 IP 151.101.117.164.443 > 10.0.2.15.42630: Flags [P.], seq 330017:335513, ack 869, win 65535, length 5496
13:20:25.078444 IP 10.0.2.15.42630 > 151.101.117.164.443: Flags [.], ack 335513, win 65535, length 0
13:20:25.078703 IP 151.101.117.164.443 > 10.0.2.15.42630: Flags [P.], seq 335513:336887, ack 869, win 65535, length 1374
13:20:25.079645 IP 151.101.117.164.443 > 10.0.2.15.42630: Flags [P.], seq 336887:347879, ack 869, win 65535, length 10992
13:20:25.079716 IP 10.0.2.15.42630 > 151.101.117.164.443: Flags [.], ack 347879, win 65535, length 0
13:20:25.079778 IP 151.101.117.164.443 > 10.0.2.15.42630: Flags [P.], seq 347879:356123, ack 869, win 65535, length 8244
13:20:25.079786 IP 10.0.2.15.42630 > 151.101.117.164.443: Flags [.], ack 356123, win 65535, length 0
13:20:25.080090 IP 151.101.117.164.443 > 10.0.2.15.42630: Flags [P.], seq 356123:362993, ack 869, win 65535, length 6870
13:20:25.080100 IP 10.0.2.15.42630 > 151.101.117.164.443: Flags [.], ack 362993, win 65535, length 0
13:20:25.081217 IP 151.101.117.164.443 > 10.0.2.15.42630: Flags [P.], seq 362993:373985, ack 869, win 65535, length 10992
13:20:25.081232 IP 10.0.2.15.42630 > 151.101.117.164.443: Flags [.], ack 373985, win 65535, length 0
13:20:25.081445 IP 151.101.117.164.443 > 10.0.2.15.42630: Flags [P.], seq 373985:376733, ack 869, win 65535, length 2748
13:20:25.081457 IP 10.0.2.15.42630 > 151.101.117.164.443: Flags [.], ack 376733, win 65535, length 0
13:20:25.082022 IP 151.101.117.164.443 > 10.0.2.15.42630: Flags [P.], seq 376733:379983, ack 869, win 65535, length 3250
13:20:25.082041 IP 10.0.2.15.42630 > 151.101.117.164.443: Flags [.], ack 379983, win 65535, length 0
13:20:25.082924 IP 151.101.117.164.443 > 10.0.2.15.42630: Flags [P.], seq 379983:388227, ack 869, win 65535, length 8244
13:20:25.083017 IP 10.0.2.15.42630 > 151.101.117.164.443: Flags [.], ack 388227, win 65535, length 0
13:20:25.084121 IP 151.101.117.164.443 > 10.0.2.15.42630: Flags [P.], seq 388227:397845, ack 869, win 65535, length 9618
13:20:25.084123 IP 151.101.117.164.443 > 10.0.2.15.42630: Flags [P.], seq 397845:401967, ack 869, win 65535, length 4122
13:20:25.084141 IP 10.0.2.15.42630 > 151.101.117.164.443: Flags [.], ack 397845, win 65535, length 0
13:20:25.084162 IP 10.0.2.15.42630 > 151.101.117.164.443: Flags [.], ack 401967, win 65535, length 0
13:20:25.085148 IP 151.101.117.164.443 > 10.0.2.15.42630: Flags [P.], seq 401967:404715, ack 869, win 65535, length 2748
13:20:25.085164 IP 10.0.2.15.42630 > 151.101.117.164.443: Flags [.], ack 404715, win 65535, length 0
13:20:25.086937 IP 151.101.117.164.443 > 10.0.2.15.42630: Flags [P.], seq 404715:430821, ack 869, win 65535, length 26106
13:20:25.086958 IP 10.0.2.15.42630 > 151.101.117.164.443: Flags [.], ack 430821, win 65535, length 0
13:20:25.087000 IP 151.101.117.164.443 > 10.0.2.15.42630: Flags [P.], seq 430821:443187, ack 869, win 65535, length 12366
13:20:25.087006 IP 10.0.2.15.42630 > 151.101.117.164.443: Flags [.], ack 443187, win 65535, length 0
13:20:25.087724 IP 151.101.117.164.443 > 10.0.2.15.42630: Flags [P.], seq 443187:447309, ack 869, win 65535, length 4122
13:20:25.087741 IP 10.0.2.15.42630 > 151.101.117.164.443: Flags [.], ack 447309, win 65535, length 0
13:20:25.088219 IP 151.101.117.164.443 > 10.0.2.15.42630: Flags [P.], seq 447309:454179, ack 869, win 65535, length 6870
13:20:25.088235 IP 10.0.2.15.42630 > 151.101.117.164.443: Flags [.], ack 454179, win 65535, length 0
13:20:25.088696 IP 151.101.117.164.443 > 10.0.2.15.42630: Flags [P.], seq 454179:466545, ack 869, win 65535, length 12366
13:20:25.088709 IP 10.0.2.15.42630 > 151.101.117.164.443: Flags [.], ack 466545, win 65535, length 0
13:20:25.089214 IP 151.101.117.164.443 > 10.0.2.15.42630: Flags [P.], seq 466545:473415, ack 869, win 65535, length 6870
13:20:25.089219 IP 151.101.117.164.443 > 10.0.2.15.42630: Flags [P.], seq 473415:482531, ack 869, win 65535, length 9116
13:20:25.089284 IP 10.0.2.15.42630 > 151.101.117.164.443: Flags [.], ack 473415, win 65535, length 0
13:20:25.089359 IP 10.0.2.15.42630 > 151.101.117.164.443: Flags [.], ack 482531, win 65535, length 0
13:20:25.089565 IP 151.101.117.164.443 > 10.0.2.15.42630: Flags [P.], seq 482531:486653, ack 869, win 65535, length 4122
13:20:25.089573 IP 10.0.2.15.42630 > 151.101.117.164.443: Flags [.], ack 486653, win 65535, length 0
13:20:25.090740 IP 151.101.117.164.443 > 10.0.2.15.42630: Flags [P.], seq 486653:496271, ack 869, win 65535, length 9618
13:20:25.090755 IP 10.0.2.15.42630 > 151.101.117.164.443: Flags [.], ack 496271, win 65535, length 0
13:20:25.091349 IP 151.101.117.164.443 > 10.0.2.15.42630: Flags [P.], seq 496271:503141, ack 869, win 65535, length 6870
13:20:25.091366 IP 10.0.2.15.42630 > 151.101.117.164.443: Flags [.], ack 503141, win 65535, length 0
13:20:25.091650 IP 151.101.117.164.443 > 10.0.2.15.42630: Flags [P.], seq 503141:507263, ack 869, win 65535, length 4122
13:20:25.091659 IP 10.0.2.15.42630 > 151.101.117.164.443: Flags [.], ack 507263, win 65535, length 0
13:20:25.093556 IP 151.101.117.164.443 > 10.0.2.15.42630: Flags [P.], seq 507263:536117, ack 869, win 65535, length 28854
13:20:25.093578 IP 10.0.2.15.42630 > 151.101.117.164.443: Flags [.], ack 536117, win 65535, length 0
13:20:25.093791 IP 151.101.117.164.443 > 10.0.2.15.42630: Flags [P.], seq 536117:545735, ack 869, win 65535, length 9618
13:20:25.093812 IP 10.0.2.15.42630 > 151.101.117.164.443: Flags [.], ack 545735, win 65535, length 0
13:20:25.094174 IP 151.101.117.164.443 > 10.0.2.15.42630: Flags [P.], seq 545735:552605, ack 869, win 65535, length 6870
13:20:25.094189 IP 10.0.2.15.42630 > 151.101.117.164.443: Flags [.], ack 552605, win 65535, length 0
13:20:25.094579 IP 151.101.117.164.443 > 10.0.2.15.42630: Flags [P.], seq 552605:562223, ack 869, win 65535, length 9618
13:20:25.094592 IP 10.0.2.15.42630 > 151.101.117.164.443: Flags [.], ack 562223, win 65535, length 0
13:20:25.095086 IP 151.101.117.164.443 > 10.0.2.15.42630: Flags [P.], seq 562223:571841, ack 869, win 65535, length 9618
13:20:25.095100 IP 10.0.2.15.42630 > 151.101.117.164.443: Flags [.], ack 571841, win 65535, length 0
13:20:25.095411 IP 151.101.117.164.443 > 10.0.2.15.42630: Flags [P.], seq 571841:575963, ack 869, win 65535, length 4122
13:20:25.095422 IP 10.0.2.15.42630 > 151.101.117.164.443: Flags [.], ack 575963, win 65535, length 0
13:20:25.096388 IP 151.101.117.164.443 > 10.0.2.15.42630: Flags [P.], seq 575963:585581, ack 869, win 65535, length 9618
13:20:25.096451 IP 10.0.2.15.42630 > 151.101.117.164.443: Flags [.], ack 585581, win 65535, length 0
13:20:25.096892 IP 151.101.117.164.443 > 10.0.2.15.42630: Flags [P.], seq 585581:593825, ack 869, win 65535, length 8244
13:20:25.096895 IP 151.101.117.164.443 > 10.0.2.15.42630: Flags [P.], seq 593825:600695, ack 869, win 65535, length 6870
13:20:25.096912 IP 10.0.2.15.42630 > 151.101.117.164.443: Flags [.], ack 593825, win 65535, length 0
13:20:25.096974 IP 10.0.2.15.42630 > 151.101.117.164.443: Flags [.], ack 600695, win 65535, length 0
13:20:25.097297 IP 151.101.117.164.443 > 10.0.2.15.42630: Flags [P.], seq 600695:611687, ack 869, win 65535, length 10992
13:20:25.097365 IP 10.0.2.15.42630 > 151.101.117.164.443: Flags [.], ack 611687, win 65535, length 0
13:20:25.097557 IP 151.101.117.164.443 > 10.0.2.15.42630: Flags [P.], seq 611687:615809, ack 869, win 65535, length 4122
13:20:25.097567 IP 10.0.2.15.42630 > 151.101.117.164.443: Flags [.], ack 615809, win 65535, length 0
13:20:25.098555 IP 151.101.117.164.443 > 10.0.2.15.42630: Flags [P.], seq 615809:626801, ack 869, win 65535, length 10992
13:20:25.098573 IP 10.0.2.15.42630 > 151.101.117.164.443: Flags [.], ack 626801, win 65535, length 0
13:20:25.098782 IP 151.101.117.164.443 > 10.0.2.15.42630: Flags [P.], seq 626801:632297, ack 869, win 65535, length 5496
13:20:25.098791 IP 10.0.2.15.42630 > 151.101.117.164.443: Flags [.], ack 632297, win 65535, length 0
13:20:25.099372 IP 151.101.117.164.443 > 10.0.2.15.42630: Flags [P.], seq 632297:641915, ack 869, win 65535, length 9618
13:20:25.099392 IP 10.0.2.15.42630 > 151.101.117.164.443: Flags [.], ack 641915, win 65535, length 0
13:20:25.100072 IP 151.101.117.164.443 > 10.0.2.15.42630: Flags [P.], seq 641915:651533, ack 869, win 65535, length 9618
13:20:25.100075 IP 151.101.117.164.443 > 10.0.2.15.42630: Flags [P.], seq 651533:655655, ack 869, win 65535, length 4122
13:20:25.100095 IP 10.0.2.15.42630 > 151.101.117.164.443: Flags [.], ack 651533, win 65535, length 0
13:20:25.100125 IP 10.0.2.15.42630 > 151.101.117.164.443: Flags [.], ack 655655, win 65535, length 0
13:20:25.101024 IP 151.101.117.164.443 > 10.0.2.15.42630: Flags [P.], seq 655655:666647, ack 869, win 65535, length 10992
13:20:25.101088 IP 10.0.2.15.42630 > 151.101.117.164.443: Flags [.], ack 666647, win 65535, length 0
13:20:25.101130 IP 151.101.117.164.443 > 10.0.2.15.42630: Flags [P.], seq 666647:673517, ack 869, win 65535, length 6870
13:20:25.101134 IP 10.0.2.15.42630 > 151.101.117.164.443: Flags [.], ack 673517, win 65535, length 0
13:20:25.101513 IP 151.101.117.164.443 > 10.0.2.15.42630: Flags [P.], seq 673517:679013, ack 869, win 65535, length 5496
13:20:25.101526 IP 10.0.2.15.42630 > 151.101.117.164.443: Flags [.], ack 679013, win 65535, length 0
13:20:25.101990 IP 151.101.117.164.443 > 10.0.2.15.42630: Flags [P.], seq 679013:690005, ack 869, win 65535, length 10992
13:20:25.102003 IP 10.0.2.15.42630 > 151.101.117.164.443: Flags [.], ack 690005, win 65535, length 0
13:20:25.102431 IP 151.101.117.164.443 > 10.0.2.15.42630: Flags [P.], seq 690005:695501, ack 869, win 65535, length 5496
13:20:25.102445 IP 10.0.2.15.42630 > 151.101.117.164.443: Flags [.], ack 695501, win 65535, length 0
13:20:25.103155 IP 151.101.117.164.443 > 10.0.2.15.42630: Flags [P.], seq 695501:706493, ack 869, win 65535, length 10992
13:20:25.103170 IP 10.0.2.15.42630 > 151.101.117.164.443: Flags [.], ack 706493, win 65535, length 0
13:20:25.103979 IP 151.101.117.164.443 > 10.0.2.15.42630: Flags [P.], seq 706493:714737, ack 869, win 65535, length 8244
13:20:25.103983 IP 151.101.117.164.443 > 10.0.2.15.42630: Flags [P.], seq 714737:724355, ack 869, win 65535, length 9618
13:20:25.104368 IP 151.101.117.164.443 > 10.0.2.15.42630: Flags [.], seq 724355:731655, ack 869, win 65535, length 7300
13:20:25.104493 IP 10.0.2.15.42630 > 151.101.117.164.443: Flags [.], ack 731655, win 65535, length 0
13:20:25.104520 IP 151.101.117.164.443 > 10.0.2.15.42630: Flags [P.], seq 731655:733973, ack 869, win 65535, length 2318
13:20:25.104595 IP 10.0.2.15.42630 > 151.101.117.164.443: Flags [.], ack 733973, win 65535, length 0
13:20:25.104783 IP 151.101.117.164.443 > 10.0.2.15.42630: Flags [P.], seq 733973:742217, ack 869, win 65535, length 8244
13:20:25.105100 IP 151.101.117.164.443 > 10.0.2.15.42630: Flags [P.], seq 742217:751835, ack 869, win 65535, length 9618
13:20:25.105280 IP 10.0.2.15.42630 > 151.101.117.164.443: Flags [.], ack 751835, win 65535, length 0
13:20:25.105608 IP 151.101.117.164.443 > 10.0.2.15.42630: Flags [P.], seq 751835:757331, ack 869, win 65535, length 5496
13:20:25.105861 IP 151.101.117.164.443 > 10.0.2.15.42630: Flags [P.], seq 757331:764201, ack 869, win 65535, length 6870
13:20:25.106281 IP 151.101.117.164.443 > 10.0.2.15.42630: Flags [P.], seq 764201:775193, ack 869, win 65535, length 10992
13:20:25.106474 IP 10.0.2.15.42630 > 151.101.117.164.443: Flags [.], ack 775193, win 65535, length 0
13:20:25.107432 IP 151.101.117.164.443 > 10.0.2.15.42630: Flags [P.], seq 775193:786185, ack 869, win 65535, length 10992
13:20:25.107601 IP 10.0.2.15.42630 > 151.101.117.164.443: Flags [.], ack 786185, win 65535, length 0
13:20:25.107656 IP 151.101.117.164.443 > 10.0.2.15.42630: Flags [P.], seq 786185:794429, ack 869, win 65535, length 8244
13:20:25.107722 IP 10.0.2.15.42630 > 151.101.117.164.443: Flags [.], ack 794429, win 65535, length 0
13:20:25.107957 IP 151.101.117.164.443 > 10.0.2.15.42630: Flags [P.], seq 794429:805421, ack 869, win 65535, length 10992
13:20:25.108089 IP 10.0.2.15.42630 > 151.101.117.164.443: Flags [.], ack 805421, win 65535, length 0
13:20:25.108511 IP 151.101.117.164.443 > 10.0.2.15.42630: Flags [.], seq 805421:808341, ack 869, win 65535, length 2920
13:20:25.108557 IP 10.0.2.15.42630 > 151.101.117.164.443: Flags [.], ack 808341, win 65535, length 0
13:20:25.108692 IP 151.101.117.164.443 > 10.0.2.15.42630: Flags [P.], seq 808341:815039, ack 869, win 65535, length 6698
13:20:25.108700 IP 10.0.2.15.42630 > 151.101.117.164.443: Flags [.], ack 815039, win 65535, length 0
13:20:25.109043 IP 151.101.117.164.443 > 10.0.2.15.42630: Flags [P.], seq 815039:826031, ack 869, win 65535, length 10992
13:20:25.109116 IP 10.0.2.15.42630 > 151.101.117.164.443: Flags [.], ack 826031, win 65535, length 0
13:20:25.109515 IP 151.101.117.164.443 > 10.0.2.15.42630: Flags [P.], seq 826031:832901, ack 869, win 65535, length 6870
13:20:25.109530 IP 10.0.2.15.42630 > 151.101.117.164.443: Flags [.], ack 832901, win 65535, length 0
13:20:25.109849 IP 151.101.117.164.443 > 10.0.2.15.42630: Flags [P.], seq 832901:846641, ack 869, win 65535, length 13740
13:20:25.110075 IP 10.0.2.15.42630 > 151.101.117.164.443: Flags [.], ack 846641, win 65535, length 0
13:20:25.110261 IP 151.101.117.164.443 > 10.0.2.15.42630: Flags [P.], seq 846641:852137, ack 869, win 65535, length 5496
13:20:25.110294 IP 10.0.2.15.42630 > 151.101.117.164.443: Flags [.], ack 852137, win 65535, length 0
13:20:25.110508 IP 151.101.117.164.443 > 10.0.2.15.42630: Flags [P.], seq 852137:854885, ack 869, win 65535, length 2748
13:20:25.110537 IP 10.0.2.15.42630 > 151.101.117.164.443: Flags [.], ack 854885, win 65535, length 0
13:20:25.111257 IP 151.101.117.164.443 > 10.0.2.15.42630: Flags [P.], seq 854885:863129, ack 869, win 65535, length 8244
13:20:25.111371 IP 10.0.2.15.42630 > 151.101.117.164.443: Flags [.], ack 863129, win 65535, length 0
13:20:25.111604 IP 151.101.117.164.443 > 10.0.2.15.42630: Flags [P.], seq 863129:871373, ack 869, win 65535, length 8244
13:20:25.111632 IP 10.0.2.15.42630 > 151.101.117.164.443: Flags [.], ack 871373, win 65535, length 0
13:20:25.112107 IP 151.101.117.164.443 > 10.0.2.15.42630: Flags [P.], seq 871373:880991, ack 869, win 65535, length 9618
13:20:25.112120 IP 10.0.2.15.42630 > 151.101.117.164.443: Flags [.], ack 880991, win 65535, length 0
13:20:25.112446 IP 151.101.117.164.443 > 10.0.2.15.42630: Flags [P.], seq 880991:889235, ack 869, win 65535, length 8244
13:20:25.112485 IP 10.0.2.15.42630 > 151.101.117.164.443: Flags [.], ack 889235, win 65535, length 0
13:20:25.112694 IP 151.101.117.164.443 > 10.0.2.15.42630: Flags [P.], seq 889235:897479, ack 869, win 65535, length 8244
13:20:25.112754 IP 10.0.2.15.42630 > 151.101.117.164.443: Flags [.], ack 897479, win 65535, length 0
13:20:25.113157 IP 151.101.117.164.443 > 10.0.2.15.42630: Flags [P.], seq 897479:905723, ack 869, win 65535, length 8244
13:20:25.113169 IP 10.0.2.15.42630 > 151.101.117.164.443: Flags [.], ack 905723, win 65535, length 0
13:20:25.113406 IP 151.101.117.164.443 > 10.0.2.15.42630: Flags [.], seq 905723:907183, ack 869, win 65535, length 1460
13:20:25.113679 IP 151.101.117.164.443 > 10.0.2.15.42630: Flags [P.], seq 907183:913967, ack 869, win 65535, length 6784
13:20:25.113802 IP 10.0.2.15.42630 > 151.101.117.164.443: Flags [.], ack 913967, win 65535, length 0
13:20:25.113984 IP 151.101.117.164.443 > 10.0.2.15.42630: Flags [P.], seq 913967:923585, ack 869, win 65535, length 9618
13:20:25.114104 IP 10.0.2.15.42630 > 151.101.117.164.443: Flags [.], ack 923585, win 65535, length 0
13:20:25.114304 IP 151.101.117.164.443 > 10.0.2.15.42630: Flags [P.], seq 923585:931829, ack 869, win 65535, length 8244
13:20:25.114315 IP 10.0.2.15.42630 > 151.101.117.164.443: Flags [.], ack 931829, win 65535, length 0
13:20:25.114832 IP 151.101.117.164.443 > 10.0.2.15.42630: Flags [P.], seq 931829:934577, ack 869, win 65535, length 2748
13:20:25.114848 IP 10.0.2.15.42630 > 151.101.117.164.443: Flags [.], ack 934577, win 65535, length 0
13:20:25.115508 IP 151.101.117.164.443 > 10.0.2.15.42630: Flags [P.], seq 934577:941447, ack 869, win 65535, length 6870
13:20:25.115646 IP 10.0.2.15.42630 > 151.101.117.164.443: Flags [.], ack 941447, win 65535, length 0
13:20:25.115869 IP 151.101.117.164.443 > 10.0.2.15.42630: Flags [P.], seq 941447:951065, ack 869, win 65535, length 9618
13:20:25.115929 IP 10.0.2.15.42630 > 151.101.117.164.443: Flags [.], ack 951065, win 65535, length 0
13:20:25.116237 IP 151.101.117.164.443 > 10.0.2.15.42630: Flags [P.], seq 951065:960683, ack 869, win 65535, length 9618
13:20:25.116247 IP 10.0.2.15.42630 > 151.101.117.164.443: Flags [.], ack 960683, win 65535, length 0
13:20:25.116651 IP 151.101.117.164.443 > 10.0.2.15.42630: Flags [P.], seq 960683:967553, ack 869, win 65535, length 6870
13:20:25.116664 IP 10.0.2.15.42630 > 151.101.117.164.443: Flags [.], ack 967553, win 65535, length 0
13:20:25.116878 IP 151.101.117.164.443 > 10.0.2.15.42630: Flags [P.], seq 967553:977171, ack 869, win 65535, length 9618
13:20:25.116903 IP 10.0.2.15.42630 > 151.101.117.164.443: Flags [.], ack 977171, win 65535, length 0
13:20:25.117204 IP 151.101.117.164.443 > 10.0.2.15.42630: Flags [P.], seq 977171:984041, ack 869, win 65535, length 6870
13:20:25.117216 IP 10.0.2.15.42630 > 151.101.117.164.443: Flags [.], ack 984041, win 65535, length 0
13:20:25.117621 IP 151.101.117.164.443 > 10.0.2.15.42630: Flags [P.], seq 984041:992285, ack 869, win 65535, length 8244
13:20:25.117636 IP 10.0.2.15.42630 > 151.101.117.164.443: Flags [.], ack 992285, win 65535, length 0
13:20:25.117883 IP 151.101.117.164.443 > 10.0.2.15.42630: Flags [P.], seq 992285:999155, ack 869, win 65535, length 6870
13:20:25.118240 IP 151.101.117.164.443 > 10.0.2.15.42630: Flags [P.], seq 999155:1006025, ack 869, win 65535, length 6870
13:20:25.118501 IP 151.101.117.164.443 > 10.0.2.15.42630: Flags [P.], seq 1006025:1012039, ack 869, win 65535, length 6014
13:20:25.118777 IP 151.101.117.164.443 > 10.0.2.15.42630: Flags [P.], seq 1012039:1013413, ack 869, win 65535, length 1374
13:20:25.118937 IP 10.0.2.15.42630 > 151.101.117.164.443: Flags [.], ack 1013413, win 65535, length 0
13:20:25.119420 IP 151.101.117.164.443 > 10.0.2.15.42630: Flags [P.], seq 1013413:1017535, ack 869, win 65535, length 4122
13:20:25.119516 IP 10.0.2.15.42630 > 151.101.117.164.443: Flags [.], ack 1017535, win 65535, length 0
13:20:25.119631 IP 151.101.117.164.443 > 10.0.2.15.42630: Flags [P.], seq 1017535:1025779, ack 869, win 65535, length 8244
13:20:25.119664 IP 10.0.2.15.42630 > 151.101.117.164.443: Flags [.], ack 1025779, win 65535, length 0
13:20:25.120032 IP 151.101.117.164.443 > 10.0.2.15.42630: Flags [P.], seq 1025779:1034023, ack 869, win 65535, length 8244
13:20:25.120044 IP 10.0.2.15.42630 > 151.101.117.164.443: Flags [.], ack 1034023, win 65535, length 0
13:20:25.120330 IP 151.101.117.164.443 > 10.0.2.15.42630: Flags [P.], seq 1034023:1042267, ack 869, win 65535, length 8244
13:20:25.120340 IP 10.0.2.15.42630 > 151.101.117.164.443: Flags [.], ack 1042267, win 65535, length 0
13:20:25.120767 IP 151.101.117.164.443 > 10.0.2.15.42630: Flags [P.], seq 1042267:1047763, ack 869, win 65535, length 5496
13:20:25.120781 IP 10.0.2.15.42630 > 151.101.117.164.443: Flags [.], ack 1047763, win 65535, length 0
13:20:25.121363 IP 151.101.117.164.443 > 10.0.2.15.42630: Flags [P.], seq 1047763:1059611, ack 869, win 65535, length 11848
13:20:25.121669 IP 151.101.117.164.443 > 10.0.2.15.42630: Flags [P.], seq 1059611:1067855, ack 869, win 65535, length 8244
13:20:25.121717 IP 10.0.2.15.42630 > 151.101.117.164.443: Flags [.], ack 1067855, win 65535, length 0
13:20:25.122068 IP 151.101.117.164.443 > 10.0.2.15.42630: Flags [P.], seq 1067855:1078847, ack 869, win 65535, length 10992
13:20:25.122085 IP 10.0.2.15.42630 > 151.101.117.164.443: Flags [.], ack 1078847, win 65535, length 0
13:20:25.122433 IP 151.101.117.164.443 > 10.0.2.15.42630: Flags [P.], seq 1078847:1086235, ack 869, win 65535, length 7388
13:20:25.122447 IP 10.0.2.15.42630 > 151.101.117.164.443: Flags [.], ack 1086235, win 65535, length 0
13:20:25.122760 IP 151.101.117.164.443 > 10.0.2.15.42630: Flags [P.], seq 1086235:1093105, ack 869, win 65535, length 6870
13:20:25.122772 IP 10.0.2.15.42630 > 151.101.117.164.443: Flags [.], ack 1093105, win 65535, length 0
13:20:25.123980 IP 151.101.117.164.443 > 10.0.2.15.42630: Flags [P.], seq 1093105:1097227, ack 869, win 65535, length 4122
13:20:25.123995 IP 10.0.2.15.42630 > 151.101.117.164.443: Flags [.], ack 1097227, win 65535, length 0
13:20:25.128372 IP 151.101.117.164.443 > 10.0.2.15.42630: Flags [.], seq 1097227:1158547, ack 869, win 65535, length 61320
13:20:25.128455 IP 10.0.2.15.42630 > 151.101.117.164.443: Flags [.], ack 1158547, win 65535, length 0
13:20:25.128587 IP 151.101.117.164.443 > 10.0.2.15.42630: Flags [.], seq 1158547:1161467, ack 869, win 65535, length 2920
13:20:25.128735 IP 151.101.117.164.443 > 10.0.2.15.42630: Flags [P.], seq 1161467:1162927, ack 869, win 65535, length 1460
13:20:25.129189 IP 151.101.117.164.443 > 10.0.2.15.42630: Flags [P.], seq 1162927:1195637, ack 869, win 65535, length 32710
13:20:25.129244 IP 10.0.2.15.42630 > 151.101.117.164.443: Flags [.], ack 1195637, win 65535, length 0
13:20:25.129948 IP 151.101.117.164.443 > 10.0.2.15.42630: Flags [P.], seq 1195637:1212643, ack 869, win 65535, length 17006
13:20:25.129962 IP 10.0.2.15.42630 > 151.101.117.164.443: Flags [.], ack 1212643, win 65535, length 0
13:20:25.130148 IP 151.101.117.164.443 > 10.0.2.15.42630: Flags [P.], seq 1212643:1218139, ack 869, win 65535, length 5496
13:20:25.130215 IP 10.0.2.15.42630 > 151.101.117.164.443: Flags [.], ack 1218139, win 65535, length 0
13:20:25.130594 IP 151.101.117.164.443 > 10.0.2.15.42630: Flags [P.], seq 1218139:1227757, ack 869, win 65535, length 9618
13:20:25.130608 IP 10.0.2.15.42630 > 151.101.117.164.443: Flags [.], ack 1227757, win 65535, length 0
13:20:25.130936 IP 151.101.117.164.443 > 10.0.2.15.42630: Flags [P.], seq 1227757:1236001, ack 869, win 65535, length 8244
13:20:25.131023 IP 10.0.2.15.42630 > 151.101.117.164.443: Flags [.], ack 1236001, win 65535, length 0

