20:00:11.921765 IP 10.0.2.15.52642 > 140.233.253.2.53: 15211+ A? www.nytimes.com. (33)
20:00:11.921808 IP 10.0.2.15.52642 > 140.233.253.2.53: 3180+ AAAA? www.nytimes.com. (33)
20:00:11.926468 IP 140.233.253.2.53 > 10.0.2.15.52642: 3180 2/1/0 CNAME www.prd.map.nytimes.com., CNAME nytimes.map.fastly.net. (153)
20:00:11.940202 IP 140.233.253.2.53 > 10.0.2.15.52642: 15211 3/0/0 CNAME www.prd.map.nytimes.com., CNAME nytimes.map.fastly.net., A 151.101.117.164 (111)
20:00:11.940441 IP 10.0.2.15.44174 > 151.101.117.164.443: Flags [S], seq 3697533981, win 64240, options [mss 1460,sackOK,TS val 917815023 ecr 0,nop,wscale 6], length 0
20:00:11.958657 IP 151.101.117.164.443 > 10.0.2.15.44174: Flags [S.], seq 214912001, ack 3697533982, win 65535, options [mss 1460], length 0
20:00:11.958713 IP 10.0.2.15.44174 > 151.101.117.164.443: Flags [.], ack 1, win 64240, length 0
20:00:11.967726 IP 10.0.2.15.44174 > 151.101.117.164.443: Flags [P.], seq 1:518, ack 1, win 64240, length 517
20:00:11.968078 IP 151.101.117.164.443 > 10.0.2.15.44174: Flags [.], ack 518, win 65535, length 0
20:00:11.987207 IP 151.101.117.164.443 > 10.0.2.15.44174: Flags [.], seq 1:2921, ack 518, win 65535, length 2920
20:00:11.987234 IP 10.0.2.15.44174 > 151.101.117.164.443: Flags [.], ack 2921, win 62780, length 0
20:00:11.987455 IP 151.101.117.164.443 > 10.0.2.15.44174: Flags [P.], seq 2921:5497, ack 518, win 65535, length 2576
20:00:11.987469 IP 10.0.2.15.44174 > 151.101.117.164.443: Flags [.], ack 5497, win 61320, length 0
20:00:11.987959 IP 151.101.117.164.443 > 10.0.2.15.44174: Flags [P.], seq 5497:5607, ack 518, win 65535, length 110
20:00:11.987986 IP 10.0.2.15.44174 > 151.101.117.164.443: Flags [.], ack 5607, win 61210, length 0
20:00:11.989466 IP 10.0.2.15.44174 > 151.101.117.164.443: Flags [P.], seq 518:611, ack 5607, win 62780, length 93
20:00:11.989972 IP 151.101.117.164.443 > 10.0.2.15.44174: Flags [.], ack 611, win 65535, length 0
20:00:12.004952 IP 151.101.117.164.443 > 10.0.2.15.44174: Flags [P.], seq 5607:5658, ack 611, win 65535, length 51
20:00:12.004970 IP 10.0.2.15.44174 > 151.101.117.164.443: Flags [.], ack 5658, win 62780, length 0
20:00:12.005582 IP 10.0.2.15.44174 > 151.101.117.164.443: Flags [P.], seq 611:664, ack 5658, win 62780, length 53
20:00:12.005617 IP 10.0.2.15.44174 > 151.101.117.164.443: Flags [P.], seq 664:720, ack 5658, win 62780, length 56
20:00:12.005838 IP 10.0.2.15.44174 > 151.101.117.164.443: Flags [P.], seq 720:831, ack 5658, win 62780, length 111
20:00:12.005957 IP 151.101.117.164.443 > 10.0.2.15.44174: Flags [.], ack 664, win 65535, length 0
20:00:12.006063 IP 151.101.117.164.443 > 10.0.2.15.44174: Flags [.], ack 720, win 65535, length 0
20:00:12.006279 IP 151.101.117.164.443 > 10.0.2.15.44174: Flags [.], ack 831, win 65535, length 0
20:00:12.018958 IP 151.101.117.164.443 > 10.0.2.15.44174: Flags [P.], seq 5658:5753, ack 831, win 65535, length 95
20:00:12.018976 IP 10.0.2.15.44174 > 151.101.117.164.443: Flags [.], ack 5753, win 62780, length 0
20:00:12.019280 IP 10.0.2.15.44174 > 151.101.117.164.443: Flags [P.], seq 831:869, ack 5753, win 62780, length 38
20:00:12.019627 IP 151.101.117.164.443 > 10.0.2.15.44174: Flags [.], ack 869, win 65535, length 0
20:00:12.025484 IP 151.101.117.164.443 > 10.0.2.15.44174: Flags [P.], seq 5753:7127, ack 869, win 65535, length 1374
20:00:12.026774 IP 151.101.117.164.443 > 10.0.2.15.44174: Flags [P.], seq 7127:12623, ack 869, win 65535, length 5496
20:00:12.026953 IP 10.0.2.15.44174 > 151.101.117.164.443: Flags [.], ack 12623, win 61320, length 0
20:00:12.027694 IP 151.101.117.164.443 > 10.0.2.15.44174: Flags [P.], seq 12623:15371, ack 869, win 65535, length 2748
20:00:12.027706 IP 10.0.2.15.44174 > 151.101.117.164.443: Flags [.], ack 15371, win 62780, length 0
20:00:12.028673 IP 151.101.117.164.443 > 10.0.2.15.44174: Flags [P.], seq 15371:19493, ack 869, win 65535, length 4122
20:00:12.028738 IP 10.0.2.15.44174 > 151.101.117.164.443: Flags [.], ack 19493, win 61320, length 0
20:00:12.030140 IP 151.101.117.164.443 > 10.0.2.15.44174: Flags [P.], seq 19493:23615, ack 869, win 65535, length 4122
20:00:12.030254 IP 10.0.2.15.44174 > 151.101.117.164.443: Flags [.], ack 23615, win 61320, length 0
20:00:12.030964 IP 151.101.117.164.443 > 10.0.2.15.44174: Flags [P.], seq 23615:26363, ack 869, win 65535, length 2748
20:00:12.030984 IP 10.0.2.15.44174 > 151.101.117.164.443: Flags [.], ack 26363, win 62780, length 0
20:00:12.032287 IP 151.101.117.164.443 > 10.0.2.15.44174: Flags [P.], seq 26363:33233, ack 869, win 65535, length 6870
20:00:12.032367 IP 10.0.2.15.44174 > 151.101.117.164.443: Flags [.], ack 33233, win 59860, length 0
20:00:12.033770 IP 151.101.117.164.443 > 10.0.2.15.44174: Flags [P.], seq 33233:34607, ack 869, win 65535, length 1374
20:00:12.034532 IP 151.101.117.164.443 > 10.0.2.15.44174: Flags [P.], seq 34607:40103, ack 869, win 65535, length 5496
20:00:12.034551 IP 10.0.2.15.44174 > 151.101.117.164.443: Flags [.], ack 40103, win 61320, length 0
20:00:12.035438 IP 151.101.117.164.443 > 10.0.2.15.44174: Flags [P.], seq 40103:45599, ack 869, win 65535, length 5496
20:00:12.035450 IP 10.0.2.15.44174 > 151.101.117.164.443: Flags [.], ack 45599, win 61320, length 0
20:00:12.036854 IP 151.101.117.164.443 > 10.0.2.15.44174: Flags [P.], seq 45599:48347, ack 869, win 65535, length 2748
20:00:12.036875 IP 10.0.2.15.44174 > 151.101.117.164.443: Flags [.], ack 48347, win 62780, length 0
20:00:12.039276 IP 151.101.117.164.443 > 10.0.2.15.44174: Flags [P.], seq 48347:55217, ack 869, win 65535, length 6870
20:00:12.039386 IP 10.0.2.15.44174 > 151.101.117.164.443: Flags [.], ack 55217, win 59860, length 0
20:00:12.040038 IP 151.101.117.164.443 > 10.0.2.15.44174: Flags [P.], seq 55217:59339, ack 869, win 65535, length 4122
20:00:12.040041 IP 151.101.117.164.443 > 10.0.2.15.44174: Flags [P.], seq 59339:60713, ack 869, win 65535, length 1374
20:00:12.040090 IP 10.0.2.15.44174 > 151.101.117.164.443: Flags [.], ack 59339, win 61320, length 0
20:00:12.041743 IP 151.101.117.164.443 > 10.0.2.15.44174: Flags [P.], seq 60713:70331, ack 869, win 65535, length 9618
20:00:12.041814 IP 10.0.2.15.44174 > 151.101.117.164.443: Flags [.], ack 70331, win 62780, length 0
20:00:12.042907 IP 151.101.117.164.443 > 10.0.2.15.44174: Flags [P.], seq 70331:75827, ack 869, win 65535, length 5496
20:00:12.042924 IP 10.0.2.15.44174 > 151.101.117.164.443: Flags [.], ack 75827, win 65535, length 0
20:00:12.043775 IP 151.101.117.164.443 > 10.0.2.15.44174: Flags [P.], seq 75827:81323, ack 869, win 65535, length 5496
20:00:12.043791 IP 10.0.2.15.44174 > 151.101.117.164.443: Flags [.], ack 81323, win 65535, length 0
20:00:12.044422 IP 151.101.117.164.443 > 10.0.2.15.44174: Flags [P.], seq 81323:85445, ack 869, win 65535, length 4122
20:00:12.044433 IP 151.101.117.164.443 > 10.0.2.15.44174: Flags [P.], seq 85445:88193, ack 869, win 65535, length 2748
20:00:12.044459 IP 10.0.2.15.44174 > 151.101.117.164.443: Flags [.], ack 85445, win 65535, length 0
20:00:12.044480 IP 10.0.2.15.44174 > 151.101.117.164.443: Flags [.], ack 88193, win 65535, length 0
20:00:12.044832 IP 151.101.117.164.443 > 10.0.2.15.44174: Flags [P.], seq 88193:90941, ack 869, win 65535, length 2748
20:00:12.044847 IP 10.0.2.15.44174 > 151.101.117.164.443: Flags [.], ack 90941, win 65535, length 0
20:00:12.045393 IP 151.101.117.164.443 > 10.0.2.15.44174: Flags [P.], seq 90941:97811, ack 869, win 65535, length 6870
20:00:12.045415 IP 10.0.2.15.44174 > 151.101.117.164.443: Flags [.], ack 97811, win 65535, length 0
20:00:12.047468 IP 151.101.117.164.443 > 10.0.2.15.44174: Flags [P.], seq 97811:106055, ack 869, win 65535, length 8244
20:00:12.047471 IP 151.101.117.164.443 > 10.0.2.15.44174: Flags [P.], seq 106055:111551, ack 869, win 65535, length 5496
20:00:12.047491 IP 10.0.2.15.44174 > 151.101.117.164.443: Flags [.], ack 106055, win 65535, length 0
20:00:12.047517 IP 10.0.2.15.44174 > 151.101.117.164.443: Flags [.], ack 111551, win 65535, length 0
20:00:12.047535 IP 151.101.117.164.443 > 10.0.2.15.44174: Flags [P.], seq 111551:114299, ack 869, win 65535, length 2748
20:00:12.047535 IP 151.101.117.164.443 > 10.0.2.15.44174: Flags [P.], seq 114299:115673, ack 869, win 65535, length 1374
20:00:12.047539 IP 10.0.2.15.44174 > 151.101.117.164.443: Flags [.], ack 114299, win 65535, length 0
20:00:12.049154 IP 151.101.117.164.443 > 10.0.2.15.44174: Flags [P.], seq 115673:123917, ack 869, win 65535, length 8244
20:00:12.049174 IP 10.0.2.15.44174 > 151.101.117.164.443: Flags [.], ack 123917, win 65535, length 0
20:00:12.049592 IP 151.101.117.164.443 > 10.0.2.15.44174: Flags [P.], seq 123917:126665, ack 869, win 65535, length 2748
20:00:12.049602 IP 10.0.2.15.44174 > 151.101.117.164.443: Flags [.], ack 126665, win 65535, length 0
20:00:12.050374 IP 151.101.117.164.443 > 10.0.2.15.44174: Flags [P.], seq 126665:128039, ack 869, win 65535, length 1374
20:00:12.051281 IP 151.101.117.164.443 > 10.0.2.15.44174: Flags [P.], seq 128039:132161, ack 869, win 65535, length 4122
20:00:12.051298 IP 10.0.2.15.44174 > 151.101.117.164.443: Flags [.], ack 132161, win 65535, length 0
20:00:12.052049 IP 151.101.117.164.443 > 10.0.2.15.44174: Flags [P.], seq 132161:137657, ack 869, win 65535, length 5496
20:00:12.052063 IP 10.0.2.15.44174 > 151.101.117.164.443: Flags [.], ack 137657, win 65535, length 0
20:00:12.052430 IP 151.101.117.164.443 > 10.0.2.15.44174: Flags [P.], seq 137657:139031, ack 869, win 65535, length 1374
20:00:12.054850 IP 151.101.117.164.443 > 10.0.2.15.44174: Flags [P.], seq 139031:147275, ack 869, win 65535, length 8244
20:00:12.054854 IP 151.101.117.164.443 > 10.0.2.15.44174: Flags [P.], seq 147275:151397, ack 869, win 65535, length 4122
20:00:12.054994 IP 10.0.2.15.44174 > 151.101.117.164.443: Flags [.], ack 147275, win 65535, length 0
20:00:12.055054 IP 10.0.2.15.44174 > 151.101.117.164.443: Flags [.], ack 151397, win 65535, length 0
20:00:12.055094 IP 151.101.117.164.443 > 10.0.2.15.44174: Flags [P.], seq 151397:152771, ack 869, win 65535, length 1374
20:00:12.055159 IP 151.101.117.164.443 > 10.0.2.15.44174: Flags [P.], seq 152771:155519, ack 869, win 65535, length 2748
20:00:12.055183 IP 10.0.2.15.44174 > 151.101.117.164.443: Flags [.], ack 155519, win 65535, length 0
20:00:12.055822 IP 151.101.117.164.443 > 10.0.2.15.44174: Flags [P.], seq 155519:158267, ack 869, win 65535, length 2748
20:00:12.055823 IP 151.101.117.164.443 > 10.0.2.15.44174: Flags [P.], seq 158267:159641, ack 869, win 65535, length 1374
20:00:12.055824 IP 151.101.117.164.443 > 10.0.2.15.44174: Flags [P.], seq 159641:162389, ack 869, win 65535, length 2748
20:00:12.055835 IP 10.0.2.15.44174 > 151.101.117.164.443: Flags [.], ack 158267, win 65535, length 0
20:00:12.055856 IP 10.0.2.15.44174 > 151.101.117.164.443: Flags [.], ack 162389, win 65535, length 0
20:00:12.057381 IP 151.101.117.164.443 > 10.0.2.15.44174: Flags [P.], seq 162389:170633, ack 869, win 65535, length 8244
20:00:12.057385 IP 151.101.117.164.443 > 10.0.2.15.44174: Flags [P.], seq 170633:174755, ack 869, win 65535, length 4122
20:00:12.057405 IP 10.0.2.15.44174 > 151.101.117.164.443: Flags [.], ack 170633, win 65535, length 0
20:00:12.057442 IP 10.0.2.15.44174 > 151.101.117.164.443: Flags [.], ack 174755, win 65535, length 0
20:00:12.057473 IP 151.101.117.164.443 > 10.0.2.15.44174: Flags [P.], seq 174755:177503, ack 869, win 65535, length 2748
20:00:12.057474 IP 151.101.117.164.443 > 10.0.2.15.44174: Flags [P.], seq 177503:178877, ack 869, win 65535, length 1374
20:00:12.057481 IP 10.0.2.15.44174 > 151.101.117.164.443: Flags [.], ack 177503, win 65535, length 0
20:00:12.059100 IP 151.101.117.164.443 > 10.0.2.15.44174: Flags [P.], seq 178877:187121, ack 869, win 65535, length 8244
20:00:12.059103 IP 151.101.117.164.443 > 10.0.2.15.44174: Flags [P.], seq 187121:189869, ack 869, win 65535, length 2748
20:00:12.059126 IP 10.0.2.15.44174 > 151.101.117.164.443: Flags [.], ack 187121, win 65535, length 0
20:00:12.059166 IP 10.0.2.15.44174 > 151.101.117.164.443: Flags [.], ack 189869, win 65535, length 0
20:00:12.059191 IP 151.101.117.164.443 > 10.0.2.15.44174: Flags [P.], seq 189869:191243, ack 869, win 65535, length 1374
20:00:12.059437 IP 151.101.117.164.443 > 10.0.2.15.44174: Flags [P.], seq 191243:193991, ack 869, win 65535, length 2748
20:00:12.059448 IP 10.0.2.15.44174 > 151.101.117.164.443: Flags [.], ack 193991, win 65535, length 0
20:00:12.059773 IP 151.101.117.164.443 > 10.0.2.15.44174: Flags [P.], seq 193991:198113, ack 869, win 65535, length 4122
20:00:12.059775 IP 151.101.117.164.443 > 10.0.2.15.44174: Flags [P.], seq 198113:199487, ack 869, win 65535, length 1374
20:00:12.059788 IP 10.0.2.15.44174 > 151.101.117.164.443: Flags [.], ack 198113, win 65535, length 0
20:00:12.060075 IP 151.101.117.164.443 > 10.0.2.15.44174: Flags [P.], seq 199487:202235, ack 869, win 65535, length 2748
20:00:12.060076 IP 151.101.117.164.443 > 10.0.2.15.44174: Flags [P.], seq 202235:206357, ack 869, win 65535, length 4122
20:00:12.060083 IP 10.0.2.15.44174 > 151.101.117.164.443: Flags [.], ack 202235, win 65535, length 0
20:00:12.060100 IP 10.0.2.15.44174 > 151.101.117.164.443: Flags [.], ack 206357, win 65535, length 0
20:00:12.060274 IP 151.101.117.164.443 > 10.0.2.15.44174: Flags [P.], seq 206357:209105, ack 869, win 65535, length 2748
20:00:12.060275 IP 151.101.117.164.443 > 10.0.2.15.44174: Flags [P.], seq 209105:211853, ack 869, win 65535, length 2748
20:00:12.060282 IP 10.0.2.15.44174 > 151.101.117.164.443: Flags [.], ack 209105, win 65535, length 0
20:00:12.060296 IP 10.0.2.15.44174 > 151.101.117.164.443: Flags [.], ack 211853, win 65535, length 0
20:00:12.060638 IP 151.101.117.164.443 > 10.0.2.15.44174: Flags [P.], seq 211853:213227, ack 869, win 65535, length 1374
20:00:12.062669 IP 151.101.117.164.443 > 10.0.2.15.44174: Flags [P.], seq 213227:222845, ack 869, win 65535, length 9618
20:00:12.062671 IP 151.101.117.164.443 > 10.0.2.15.44174: Flags [P.], seq 222845:225593, ack 869, win 65535, length 2748
20:00:12.062694 IP 10.0.2.15.44174 > 151.101.117.164.443: Flags [.], ack 222845, win 65535, length 0
20:00:12.062741 IP 10.0.2.15.44174 > 151.101.117.164.443: Flags [.], ack 225593, win 65535, length 0
20:00:12.064120 IP 151.101.117.164.443 > 10.0.2.15.44174: Flags [P.], seq 225593:232463, ack 869, win 65535, length 6870
20:00:12.064122 IP 151.101.117.164.443 > 10.0.2.15.44174: Flags [P.], seq 232463:236585, ack 869, win 65535, length 4122
20:00:12.064140 IP 10.0.2.15.44174 > 151.101.117.164.443: Flags [.], ack 232463, win 65535, length 0
20:00:12.064171 IP 10.0.2.15.44174 > 151.101.117.164.443: Flags [.], ack 236585, win 65535, length 0
20:00:12.064648 IP 151.101.117.164.443 > 10.0.2.15.44174: Flags [P.], seq 236585:240707, ack 869, win 65535, length 4122
20:00:12.064650 IP 151.101.117.164.443 > 10.0.2.15.44174: Flags [P.], seq 240707:244829, ack 869, win 65535, length 4122
20:00:12.064650 IP 151.101.117.164.443 > 10.0.2.15.44174: Flags [P.], seq 244829:247577, ack 869, win 65535, length 2748
20:00:12.064663 IP 10.0.2.15.44174 > 151.101.117.164.443: Flags [.], ack 240707, win 65535, length 0
20:00:12.064683 IP 10.0.2.15.44174 > 151.101.117.164.443: Flags [.], ack 244829, win 65535, length 0
20:00:12.064732 IP 10.0.2.15.44174 > 151.101.117.164.443: Flags [.], ack 247577, win 65535, length 0
20:00:12.064771 IP 151.101.117.164.443 > 10.0.2.15.44174: Flags [P.], seq 247577:251699, ack 869, win 65535, length 4122
20:00:12.064777 IP 10.0.2.15.44174 > 151.101.117.164.443: Flags [.], ack 251699, win 65535, length 0
20:00:12.065012 IP 151.101.117.164.443 > 10.0.2.15.44174: Flags [P.], seq 251699:254447, ack 869, win 65535, length 2748
20:00:12.065021 IP 10.0.2.15.44174 > 151.101.117.164.443: Flags [.], ack 254447, win 65535, length 0
20:00:12.065108 IP 151.101.117.164.443 > 10.0.2.15.44174: Flags [P.], seq 254447:255821, ack 869, win 65535, length 1374
20:00:12.065707 IP 151.101.117.164.443 > 10.0.2.15.44174: Flags [P.], seq 255821:259943, ack 869, win 65535, length 4122
20:00:12.065709 IP 151.101.117.164.443 > 10.0.2.15.44174: Flags [P.], seq 259943:262691, ack 869, win 65535, length 2748
20:00:12.065728 IP 10.0.2.15.44174 > 151.101.117.164.443: Flags [.], ack 259943, win 65535, length 0
20:00:12.065797 IP 10.0.2.15.44174 > 151.101.117.164.443: Flags [.], ack 262691, win 65535, length 0
20:00:12.065956 IP 151.101.117.164.443 > 10.0.2.15.44174: Flags [P.], seq 262691:264065, ack 869, win 65535, length 1374
20:00:12.065958 IP 151.101.117.164.443 > 10.0.2.15.44174: Flags [P.], seq 264065:266813, ack 869, win 65535, length 2748
20:00:12.065969 IP 10.0.2.15.44174 > 151.101.117.164.443: Flags [.], ack 266813, win 65535, length 0
20:00:12.066859 IP 151.101.117.164.443 > 10.0.2.15.44174: Flags [P.], seq 266813:269561, ack 869, win 65535, length 2748
20:00:12.066860 IP 151.101.117.164.443 > 10.0.2.15.44174: Flags [P.], seq 269561:272309, ack 869, win 65535, length 2748
20:00:12.066861 IP 151.101.117.164.443 > 10.0.2.15.44174: Flags [P.], seq 272309:275057, ack 869, win 65535, length 2748
20:00:12.066862 IP 151.101.117.164.443 > 10.0.2.15.44174: Flags [P.], seq 275057:277805, ack 869, win 65535, length 2748
20:00:12.066874 IP 10.0.2.15.44174 > 151.101.117.164.443: Flags [.], ack 269561, win 65535, length 0
20:00:12.066890 IP 10.0.2.15.44174 > 151.101.117.164.443: Flags [.], ack 272309, win 65535, length 0
20:00:12.066897 IP 10.0.2.15.44174 > 151.101.117.164.443: Flags [.], ack 275057, win 65535, length 0
20:00:12.066952 IP 10.0.2.15.44174 > 151.101.117.164.443: Flags [.], ack 277805, win 65535, length 0
20:00:12.066986 IP 151.101.117.164.443 > 10.0.2.15.44174: Flags [P.], seq 277805:280553, ack 869, win 65535, length 2748
20:00:12.066987 IP 151.101.117.164.443 > 10.0.2.15.44174: Flags [P.], seq 280553:283301, ack 869, win 65535, length 2748
20:00:12.066988 IP 151.101.117.164.443 > 10.0.2.15.44174: Flags [P.], seq 283301:284675, ack 869, win 65535, length 1374
20:00:12.066995 IP 10.0.2.15.44174 > 151.101.117.164.443: Flags [.], ack 280553, win 65535, length 0
20:00:12.067007 IP 10.0.2.15.44174 > 151.101.117.164.443: Flags [.], ack 283301, win 65535, length 0
20:00:12.067247 IP 151.101.117.164.443 > 10.0.2.15.44174: Flags [P.], seq 284675:286049, ack 869, win 65535, length 1374
20:00:12.067258 IP 10.0.2.15.44174 > 151.101.117.164.443: Flags [.], ack 286049, win 65535, length 0
20:00:12.068234 IP 151.101.117.164.443 > 10.0.2.15.44174: Flags [P.], seq 286049:292919, ack 869, win 65535, length 6870
20:00:12.068236 IP 151.101.117.164.443 > 10.0.2.15.44174: Flags [P.], seq 292919:294293, ack 869, win 65535, length 1374
20:00:12.068237 IP 151.101.117.164.443 > 10.0.2.15.44174: Flags [P.], seq 294293:298415, ack 869, win 65535, length 4122
20:00:12.068260 IP 10.0.2.15.44174 > 151.101.117.164.443: Flags [.], ack 292919, win 65535, length 0
20:00:12.068291 IP 10.0.2.15.44174 > 151.101.117.164.443: Flags [.], ack 298415, win 65535, length 0
20:00:12.068489 IP 151.101.117.164.443 > 10.0.2.15.44174: Flags [P.], seq 298415:301163, ack 869, win 65535, length 2748
20:00:12.068498 IP 10.0.2.15.44174 > 151.101.117.164.443: Flags [.], ack 301163, win 65535, length 0
20:00:12.068606 IP 151.101.117.164.443 > 10.0.2.15.44174: Flags [P.], seq 301163:302537, ack 869, win 65535, length 1374
20:00:12.071785 IP 151.101.117.164.443 > 10.0.2.15.44174: Flags [P.], seq 302537:310781, ack 869, win 65535, length 8244
20:00:12.071788 IP 151.101.117.164.443 > 10.0.2.15.44174: Flags [.], seq 310781:312241, ack 869, win 65535, length 1460
20:00:12.071813 IP 10.0.2.15.44174 > 151.101.117.164.443: Flags [.], ack 310781, win 65535, length 0
20:00:12.071969 IP 151.101.117.164.443 > 10.0.2.15.44174: Flags [P.], seq 312241:316277, ack 869, win 65535, length 4036
20:00:12.071971 IP 151.101.117.164.443 > 10.0.2.15.44174: Flags [P.], seq 316277:317651, ack 869, win 65535, length 1374
20:00:12.071980 IP 10.0.2.15.44174 > 151.101.117.164.443: Flags [.], ack 316277, win 65535, length 0
20:00:12.072394 IP 151.101.117.164.443 > 10.0.2.15.44174: Flags [P.], seq 317651:320399, ack 869, win 65535, length 2748
20:00:12.072396 IP 151.101.117.164.443 > 10.0.2.15.44174: Flags [P.], seq 320399:323147, ack 869, win 65535, length 2748
20:00:12.072397 IP 151.101.117.164.443 > 10.0.2.15.44174: Flags [P.], seq 323147:324521, ack 869, win 65535, length 1374
20:00:12.072412 IP 10.0.2.15.44174 > 151.101.117.164.443: Flags [.], ack 320399, win 65535, length 0
20:00:12.072484 IP 10.0.2.15.44174 > 151.101.117.164.443: Flags [.], ack 323147, win 65535, length 0
20:00:12.072958 IP 151.101.117.164.443 > 10.0.2.15.44174: Flags [P.], seq 324521:330017, ack 869, win 65535, length 5496
20:00:12.072960 IP 151.101.117.164.443 > 10.0.2.15.44174: Flags [P.], seq 330017:334139, ack 869, win 65535, length 4122
20:00:12.072972 IP 10.0.2.15.44174 > 151.101.117.164.443: Flags [.], ack 330017, win 65535, length 0
20:00:12.072991 IP 10.0.2.15.44174 > 151.101.117.164.443: Flags [.], ack 334139, win 65535, length 0
20:00:12.073230 IP 151.101.117.164.443 > 10.0.2.15.44174: Flags [P.], seq 334139:335513, ack 869, win 65535, length 1374
20:00:12.073231 IP 151.101.117.164.443 > 10.0.2.15.44174: Flags [P.], seq 335513:336887, ack 869, win 65535, length 1374
20:00:12.073239 IP 10.0.2.15.44174 > 151.101.117.164.443: Flags [.], ack 336887, win 65535, length 0
20:00:12.073977 IP 151.101.117.164.443 > 10.0.2.15.44174: Flags [P.], seq 336887:342383, ack 869, win 65535, length 5496
20:00:12.073989 IP 10.0.2.15.44174 > 151.101.117.164.443: Flags [.], ack 342383, win 65535, length 0
20:00:12.074245 IP 151.101.117.164.443 > 10.0.2.15.44174: Flags [P.], seq 342383:343757, ack 869, win 65535, length 1374
20:00:12.074384 IP 151.101.117.164.443 > 10.0.2.15.44174: Flags [P.], seq 343757:347879, ack 869, win 65535, length 4122
20:00:12.074404 IP 10.0.2.15.44174 > 151.101.117.164.443: Flags [.], ack 347879, win 65535, length 0
20:00:12.074626 IP 151.101.117.164.443 > 10.0.2.15.44174: Flags [P.], seq 347879:350627, ack 869, win 65535, length 2748
20:00:12.074862 IP 10.0.2.15.44174 > 151.101.117.164.443: Flags [.], ack 350627, win 65535, length 0
20:00:12.074993 IP 151.101.117.164.443 > 10.0.2.15.44174: Flags [P.], seq 350627:354749, ack 869, win 65535, length 4122
20:00:12.074995 IP 151.101.117.164.443 > 10.0.2.15.44174: Flags [P.], seq 354749:360245, ack 869, win 65535, length 5496
20:00:12.075007 IP 10.0.2.15.44174 > 151.101.117.164.443: Flags [.], ack 354749, win 65535, length 0
20:00:12.075024 IP 10.0.2.15.44174 > 151.101.117.164.443: Flags [.], ack 360245, win 65535, length 0
20:00:12.075179 IP 151.101.117.164.443 > 10.0.2.15.44174: Flags [P.], seq 360245:361619, ack 869, win 65535, length 1374
20:00:12.075314 IP 151.101.117.164.443 > 10.0.2.15.44174: Flags [P.], seq 361619:364367, ack 869, win 65535, length 2748
20:00:12.075323 IP 10.0.2.15.44174 > 151.101.117.164.443: Flags [.], ack 364367, win 65535, length 0
20:00:12.075589 IP 151.101.117.164.443 > 10.0.2.15.44174: Flags [P.], seq 364367:367115, ack 869, win 65535, length 2748
20:00:12.075731 IP 10.0.2.15.44174 > 151.101.117.164.443: Flags [.], ack 367115, win 65535, length 0
20:00:12.075869 IP 151.101.117.164.443 > 10.0.2.15.44174: Flags [P.], seq 367115:368489, ack 869, win 65535, length 1374
20:00:12.075871 IP 151.101.117.164.443 > 10.0.2.15.44174: Flags [P.], seq 368489:369863, ack 869, win 65535, length 1374
20:00:12.075888 IP 10.0.2.15.44174 > 151.101.117.164.443: Flags [.], ack 369863, win 65535, length 0
20:00:12.076982 IP 151.101.117.164.443 > 10.0.2.15.44174: Flags [P.], seq 369863:375359, ack 869, win 65535, length 5496
20:00:12.076984 IP 151.101.117.164.443 > 10.0.2.15.44174: Flags [P.], seq 375359:380855, ack 869, win 65535, length 5496
20:00:12.077002 IP 10.0.2.15.44174 > 151.101.117.164.443: Flags [.], ack 375359, win 65535, length 0
20:00:12.077112 IP 10.0.2.15.44174 > 151.101.117.164.443: Flags [.], ack 380855, win 65535, length 0
20:00:12.077178 IP 151.101.117.164.443 > 10.0.2.15.44174: Flags [P.], seq 380855:382229, ack 869, win 65535, length 1374
20:00:12.077380 IP 151.101.117.164.443 > 10.0.2.15.44174: Flags [P.], seq 382229:386351, ack 869, win 65535, length 4122
20:00:12.077382 IP 151.101.117.164.443 > 10.0.2.15.44174: Flags [P.], seq 386351:387725, ack 869, win 65535, length 1374
20:00:12.077382 IP 151.101.117.164.443 > 10.0.2.15.44174: Flags [P.], seq 387725:389099, ack 869, win 65535, length 1374
20:00:12.077436 IP 10.0.2.15.44174 > 151.101.117.164.443: Flags [.], ack 386351, win 65535, length 0
20:00:12.077453 IP 10.0.2.15.44174 > 151.101.117.164.443: Flags [.], ack 389099, win 65535, length 0
20:00:12.077582 IP 151.101.117.164.443 > 10.0.2.15.44174: Flags [P.], seq 389099:391847, ack 869, win 65535, length 2748
20:00:12.077588 IP 10.0.2.15.44174 > 151.101.117.164.443: Flags [.], ack 391847, win 65535, length 0
20:00:12.077697 IP 151.101.117.164.443 > 10.0.2.15.44174: Flags [P.], seq 391847:394595, ack 869, win 65535, length 2748
20:00:12.077704 IP 10.0.2.15.44174 > 151.101.117.164.443: Flags [.], ack 394595, win 65535, length 0
20:00:12.077878 IP 151.101.117.164.443 > 10.0.2.15.44174: Flags [P.], seq 394595:397343, ack 869, win 65535, length 2748
20:00:12.077890 IP 10.0.2.15.44174 > 151.101.117.164.443: Flags [.], ack 397343, win 65535, length 0
20:00:12.078104 IP 151.101.117.164.443 > 10.0.2.15.44174: Flags [P.], seq 397343:398717, ack 869, win 65535, length 1374
20:00:12.078323 IP 151.101.117.164.443 > 10.0.2.15.44174: Flags [P.], seq 398717:400091, ack 869, win 65535, length 1374
20:00:12.078334 IP 10.0.2.15.44174 > 151.101.117.164.443: Flags [.], ack 400091, win 65535, length 0
20:00:12.079281 IP 151.101.117.164.443 > 10.0.2.15.44174: Flags [P.], seq 400091:405587, ack 869, win 65535, length 5496
20:00:12.079284 IP 151.101.117.164.443 > 10.0.2.15.44174: Flags [P.], seq 405587:411083, ack 869, win 65535, length 5496
20:00:12.079306 IP 10.0.2.15.44174 > 151.101.117.164.443: Flags [.], ack 405587, win 65535, length 0
20:00:12.079346 IP 10.0.2.15.44174 > 151.101.117.164.443: Flags [.], ack 411083, win 65535, length 0
20:00:12.079423 IP 151.101.117.164.443 > 10.0.2.15.44174: Flags [P.], seq 411083:412457, ack 869, win 65535, length 1374
20:00:12.079585 IP 151.101.117.164.443 > 10.0.2.15.44174: Flags [P.], seq 412457:415205, ack 869, win 65535, length 2748
20:00:12.079593 IP 10.0.2.15.44174 > 151.101.117.164.443: Flags [.], ack 415205, win 65535, length 0
20:00:12.079937 IP 151.101.117.164.443 > 10.0.2.15.44174: Flags [P.], seq 415205:420701, ack 869, win 65535, length 5496
20:00:12.079939 IP 151.101.117.164.443 > 10.0.2.15.44174: Flags [.], seq 420701:422161, ack 869, win 65535, length 1460
20:00:12.079959 IP 10.0.2.15.44174 > 151.101.117.164.443: Flags [.], ack 420701, win 65535, length 0
20:00:12.080070 IP 151.101.117.164.443 > 10.0.2.15.44174: Flags [P.], seq 422161:423449, ack 869, win 65535, length 1288
20:00:12.080071 IP 151.101.117.164.443 > 10.0.2.15.44174: Flags [P.], seq 423449:424823, ack 869, win 65535, length 1374
20:00:12.080077 IP 10.0.2.15.44174 > 151.101.117.164.443: Flags [.], ack 423449, win 65535, length 0
20:00:12.080263 IP 151.101.117.164.443 > 10.0.2.15.44174: Flags [P.], seq 424823:428945, ack 869, win 65535, length 4122
20:00:12.080303 IP 10.0.2.15.44174 > 151.101.117.164.443: Flags [.], ack 428945, win 65535, length 0
20:00:12.080421 IP 151.101.117.164.443 > 10.0.2.15.44174: Flags [P.], seq 428945:430319, ack 869, win 65535, length 1374
20:00:12.080608 IP 151.101.117.164.443 > 10.0.2.15.44174: Flags [P.], seq 430319:433067, ack 869, win 65535, length 2748
20:00:12.080614 IP 10.0.2.15.44174 > 151.101.117.164.443: Flags [.], ack 433067, win 65535, length 0
20:00:12.080993 IP 151.101.117.164.443 > 10.0.2.15.44174: Flags [P.], seq 433067:435815, ack 869, win 65535, length 2748
20:00:12.080995 IP 151.101.117.164.443 > 10.0.2.15.44174: Flags [P.], seq 435815:437189, ack 869, win 65535, length 1374
20:00:12.081008 IP 10.0.2.15.44174 > 151.101.117.164.443: Flags [.], ack 435815, win 65535, length 0
20:00:12.081102 IP 151.101.117.164.443 > 10.0.2.15.44174: Flags [P.], seq 437189:441311, ack 869, win 65535, length 4122
20:00:12.081108 IP 10.0.2.15.44174 > 151.101.117.164.443: Flags [.], ack 441311, win 65535, length 0
20:00:12.081288 IP 151.101.117.164.443 > 10.0.2.15.44174: Flags [P.], seq 441311:444059, ack 869, win 65535, length 2748
20:00:12.081307 IP 10.0.2.15.44174 > 151.101.117.164.443: Flags [.], ack 444059, win 65535, length 0
20:00:12.081443 IP 151.101.117.164.443 > 10.0.2.15.44174: Flags [P.], seq 444059:446807, ack 869, win 65535, length 2748
20:00:12.081467 IP 10.0.2.15.44174 > 151.101.117.164.443: Flags [.], ack 446807, win 65535, length 0
20:00:12.081940 IP 151.101.117.164.443 > 10.0.2.15.44174: Flags [P.], seq 446807:450929, ack 869, win 65535, length 4122
20:00:12.081953 IP 10.0.2.15.44174 > 151.101.117.164.443: Flags [.], ack 450929, win 65535, length 0
20:00:12.082385 IP 151.101.117.164.443 > 10.0.2.15.44174: Flags [P.], seq 450929:453677, ack 869, win 65535, length 2748
20:00:12.082386 IP 151.101.117.164.443 > 10.0.2.15.44174: Flags [P.], seq 453677:456425, ack 869, win 65535, length 2748
20:00:12.082387 IP 151.101.117.164.443 > 10.0.2.15.44174: Flags [P.], seq 456425:459173, ack 869, win 65535, length 2748
20:00:12.082387 IP 151.101.117.164.443 > 10.0.2.15.44174: Flags [P.], seq 459173:460547, ack 869, win 65535, length 1374
20:00:12.082399 IP 10.0.2.15.44174 > 151.101.117.164.443: Flags [.], ack 453677, win 65535, length 0
20:00:12.082413 IP 10.0.2.15.44174 > 151.101.117.164.443: Flags [.], ack 456425, win 65535, length 0
20:00:12.082425 IP 10.0.2.15.44174 > 151.101.117.164.443: Flags [.], ack 459173, win 65535, length 0
20:00:12.083204 IP 151.101.117.164.443 > 10.0.2.15.44174: Flags [P.], seq 460547:466043, ack 869, win 65535, length 5496
20:00:12.083216 IP 10.0.2.15.44174 > 151.101.117.164.443: Flags [.], ack 466043, win 65535, length 0
20:00:12.083589 IP 151.101.117.164.443 > 10.0.2.15.44174: Flags [P.], seq 466043:470165, ack 869, win 65535, length 4122
20:00:12.083602 IP 10.0.2.15.44174 > 151.101.117.164.443: Flags [.], ack 470165, win 65535, length 0
20:00:12.083889 IP 151.101.117.164.443 > 10.0.2.15.44174: Flags [P.], seq 470165:474287, ack 869, win 65535, length 4122
20:00:12.083892 IP 151.101.117.164.443 > 10.0.2.15.44174: Flags [P.], seq 474287:475661, ack 869, win 65535, length 1374
20:00:12.084281 IP 151.101.117.164.443 > 10.0.2.15.44174: Flags [P.], seq 475661:477035, ack 869, win 65535, length 1374
20:00:12.084283 IP 151.101.117.164.443 > 10.0.2.15.44174: Flags [P.], seq 477035:479783, ack 869, win 65535, length 2748
20:00:12.084493 IP 151.101.117.164.443 > 10.0.2.15.44174: Flags [P.], seq 479783:488027, ack 869, win 65535, length 8244
20:00:12.084516 IP 10.0.2.15.44174 > 151.101.117.164.443: Flags [.], ack 479783, win 65535, length 0
20:00:12.084630 IP 151.101.117.164.443 > 10.0.2.15.44174: Flags [P.], seq 488027:489401, ack 869, win 65535, length 1374
20:00:12.084647 IP 10.0.2.15.44174 > 151.101.117.164.443: Flags [.], ack 489401, win 65535, length 0
20:00:12.084752 IP 151.101.117.164.443 > 10.0.2.15.44174: Flags [P.], seq 489401:492149, ack 869, win 65535, length 2748
20:00:12.084763 IP 10.0.2.15.44174 > 151.101.117.164.443: Flags [.], ack 492149, win 65535, length 0
20:00:12.084952 IP 151.101.117.164.443 > 10.0.2.15.44174: Flags [P.], seq 492149:494897, ack 869, win 65535, length 2748
20:00:12.084961 IP 10.0.2.15.44174 > 151.101.117.164.443: Flags [.], ack 494897, win 65535, length 0
20:00:12.085183 IP 151.101.117.164.443 > 10.0.2.15.44174: Flags [P.], seq 494897:497645, ack 869, win 65535, length 2748
20:00:12.085184 IP 151.101.117.164.443 > 10.0.2.15.44174: Flags [P.], seq 497645:500393, ack 869, win 65535, length 2748
20:00:12.085390 IP 151.101.117.164.443 > 10.0.2.15.44174: Flags [P.], seq 500393:503141, ack 869, win 65535, length 2748
20:00:12.085578 IP 10.0.2.15.44174 > 151.101.117.164.443: Flags [.], ack 503141, win 65535, length 0
20:00:12.086645 IP 151.101.117.164.443 > 10.0.2.15.44174: Flags [P.], seq 503141:510011, ack 869, win 65535, length 6870
20:00:12.086647 IP 151.101.117.164.443 > 10.0.2.15.44174: Flags [P.], seq 510011:512759, ack 869, win 65535, length 2748
20:00:12.086666 IP 10.0.2.15.44174 > 151.101.117.164.443: Flags [.], ack 510011, win 65535, length 0
20:00:12.086687 IP 10.0.2.15.44174 > 151.101.117.164.443: Flags [.], ack 512759, win 65535, length 0
20:00:12.087694 IP 151.101.117.164.443 > 10.0.2.15.44174: Flags [P.], seq 512759:518255, ack 869, win 65535, length 5496
20:00:12.087696 IP 151.101.117.164.443 > 10.0.2.15.44174: Flags [P.], seq 518255:522377, ack 869, win 65535, length 4122
20:00:12.087713 IP 10.0.2.15.44174 > 151.101.117.164.443: Flags [.], ack 518255, win 65535, length 0
20:00:12.087946 IP 151.101.117.164.443 > 10.0.2.15.44174: Flags [P.], seq 522377:525125, ack 869, win 65535, length 2748
20:00:12.087947 IP 151.101.117.164.443 > 10.0.2.15.44174: Flags [P.], seq 525125:527873, ack 869, win 65535, length 2748
20:00:12.088313 IP 151.101.117.164.443 > 10.0.2.15.44174: Flags [P.], seq 527873:533369, ack 869, win 65535, length 5496
20:00:12.088315 IP 151.101.117.164.443 > 10.0.2.15.44174: Flags [P.], seq 533369:534743, ack 869, win 65535, length 1374
20:00:12.088476 IP 151.101.117.164.443 > 10.0.2.15.44174: Flags [P.], seq 534743:538865, ack 869, win 65535, length 4122
20:00:12.088477 IP 151.101.117.164.443 > 10.0.2.15.44174: Flags [P.], seq 538865:540239, ack 869, win 65535, length 1374
20:00:12.088841 IP 151.101.117.164.443 > 10.0.2.15.44174: Flags [P.], seq 540239:544361, ack 869, win 65535, length 4122
20:00:12.088996 IP 151.101.117.164.443 > 10.0.2.15.44174: Flags [P.], seq 544361:548483, ack 869, win 65535, length 4122
20:00:12.089116 IP 10.0.2.15.44174 > 151.101.117.164.443: Flags [.], ack 548483, win 65535, length 0
20:00:12.089297 IP 151.101.117.164.443 > 10.0.2.15.44174: Flags [P.], seq 548483:549857, ack 869, win 65535, length 1374
20:00:12.090029 IP 151.101.117.164.443 > 10.0.2.15.44174: Flags [P.], seq 549857:555353, ack 869, win 65535, length 5496
20:00:12.090032 IP 151.101.117.164.443 > 10.0.2.15.44174: Flags [P.], seq 555353:560849, ack 869, win 65535, length 5496
20:00:12.090158 IP 10.0.2.15.44174 > 151.101.117.164.443: Flags [.], ack 555353, win 65535, length 0
20:00:12.090203 IP 151.101.117.164.443 > 10.0.2.15.44174: Flags [P.], seq 560849:562223, ack 869, win 65535, length 1374
20:00:12.090341 IP 10.0.2.15.44174 > 151.101.117.164.443: Flags [.], ack 562223, win 65535, length 0
20:00:12.090681 IP 151.101.117.164.443 > 10.0.2.15.44174: Flags [P.], seq 562223:567719, ack 869, win 65535, length 5496
20:00:12.090683 IP 151.101.117.164.443 > 10.0.2.15.44174: Flags [P.], seq 567719:569093, ack 869, win 65535, length 1374
20:00:12.090833 IP 151.101.117.164.443 > 10.0.2.15.44174: Flags [P.], seq 569093:573215, ack 869, win 65535, length 4122
20:00:12.090879 IP 10.0.2.15.44174 > 151.101.117.164.443: Flags [.], ack 573215, win 65535, length 0
20:00:12.091092 IP 151.101.117.164.443 > 10.0.2.15.44174: Flags [P.], seq 573215:575963, ack 869, win 65535, length 2748
20:00:12.091175 IP 10.0.2.15.44174 > 151.101.117.164.443: Flags [.], ack 575963, win 65535, length 0
20:00:12.091370 IP 151.101.117.164.443 > 10.0.2.15.44174: Flags [P.], seq 575963:578711, ack 869, win 65535, length 2748
20:00:12.091372 IP 151.101.117.164.443 > 10.0.2.15.44174: Flags [P.], seq 578711:582833, ack 869, win 65535, length 4122
20:00:12.091448 IP 10.0.2.15.44174 > 151.101.117.164.443: Flags [.], ack 578711, win 65535, length 0
20:00:12.091671 IP 151.101.117.164.443 > 10.0.2.15.44174: Flags [P.], seq 582833:585581, ack 869, win 65535, length 2748
20:00:12.091672 IP 151.101.117.164.443 > 10.0.2.15.44174: Flags [P.], seq 585581:588329, ack 869, win 65535, length 2748
20:00:12.091821 IP 151.101.117.164.443 > 10.0.2.15.44174: Flags [P.], seq 588329:591077, ack 869, win 65535, length 2748
20:00:12.091846 IP 10.0.2.15.44174 > 151.101.117.164.443: Flags [.], ack 591077, win 65535, length 0
20:00:12.092038 IP 151.101.117.164.443 > 10.0.2.15.44174: Flags [.], seq 591077:592537, ack 869, win 65535, length 1460
20:00:12.092284 IP 151.101.117.164.443 > 10.0.2.15.44174: Flags [P.], seq 592537:595199, ack 869, win 65535, length 2662
20:00:12.092285 IP 151.101.117.164.443 > 10.0.2.15.44174: Flags [P.], seq 595199:597947, ack 869, win 65535, length 2748
20:00:12.092296 IP 10.0.2.15.44174 > 151.101.117.164.443: Flags [.], ack 595199, win 65535, length 0
20:00:12.092371 IP 10.0.2.15.44174 > 151.101.117.164.443: Flags [.], ack 597947, win 65535, length 0
20:00:12.093194 IP 151.101.117.164.443 > 10.0.2.15.44174: Flags [P.], seq 597947:604817, ack 869, win 65535, length 6870
20:00:12.093883 IP 151.101.117.164.443 > 10.0.2.15.44174: Flags [P.], seq 604817:608939, ack 869, win 65535, length 4122
20:00:12.093885 IP 151.101.117.164.443 > 10.0.2.15.44174: Flags [P.], seq 608939:611687, ack 869, win 65535, length 2748
20:00:12.093886 IP 151.101.117.164.443 > 10.0.2.15.44174: Flags [P.], seq 611687:615809, ack 869, win 65535, length 4122
20:00:12.094070 IP 151.101.117.164.443 > 10.0.2.15.44174: Flags [P.], seq 615809:621305, ack 869, win 65535, length 5496
20:00:12.094072 IP 151.101.117.164.443 > 10.0.2.15.44174: Flags [P.], seq 621305:624053, ack 869, win 65535, length 2748
20:00:12.094072 IP 151.101.117.164.443 > 10.0.2.15.44174: Flags [.], seq 624053:625513, ack 869, win 65535, length 1460
20:00:12.094147 IP 151.101.117.164.443 > 10.0.2.15.44174: Flags [P.], seq 625513:626801, ack 869, win 65535, length 1288
20:00:12.094246 IP 151.101.117.164.443 > 10.0.2.15.44174: Flags [P.], seq 626801:629549, ack 869, win 65535, length 2748
20:00:12.094321 IP 10.0.2.15.44174 > 151.101.117.164.443: Flags [.], ack 629549, win 65535, length 0
20:00:12.094436 IP 151.101.117.164.443 > 10.0.2.15.44174: Flags [P.], seq 629549:633671, ack 869, win 65535, length 4122
20:00:12.094463 IP 10.0.2.15.44174 > 151.101.117.164.443: Flags [.], ack 633671, win 65535, length 0
20:00:12.095592 IP 151.101.117.164.443 > 10.0.2.15.44174: Flags [P.], seq 633671:640541, ack 869, win 65535, length 6870
20:00:12.095594 IP 151.101.117.164.443 > 10.0.2.15.44174: Flags [P.], seq 640541:643289, ack 869, win 65535, length 2748
20:00:12.095667 IP 10.0.2.15.44174 > 151.101.117.164.443: Flags [.], ack 640541, win 65535, length 0
20:00:12.095869 IP 10.0.2.15.44174 > 151.101.117.164.443: Flags [.], ack 643289, win 65535, length 0
20:00:12.096086 IP 151.101.117.164.443 > 10.0.2.15.44174: Flags [P.], seq 643289:647411, ack 869, win 65535, length 4122
20:00:12.096088 IP 151.101.117.164.443 > 10.0.2.15.44174: Flags [P.], seq 647411:651533, ack 869, win 65535, length 4122
20:00:12.096089 IP 151.101.117.164.443 > 10.0.2.15.44174: Flags [P.], seq 651533:657029, ack 869, win 65535, length 5496
20:00:12.096140 IP 10.0.2.15.44174 > 151.101.117.164.443: Flags [.], ack 657029, win 65535, length 0
20:00:12.096342 IP 151.101.117.164.443 > 10.0.2.15.44174: Flags [P.], seq 657029:659777, ack 869, win 65535, length 2748
20:00:12.096454 IP 151.101.117.164.443 > 10.0.2.15.44174: Flags [P.], seq 659777:661151, ack 869, win 65535, length 1374
20:00:12.096492 IP 10.0.2.15.44174 > 151.101.117.164.443: Flags [.], ack 661151, win 65535, length 0
20:00:12.096550 IP 151.101.117.164.443 > 10.0.2.15.44174: Flags [P.], seq 661151:666647, ack 869, win 65535, length 5496
20:00:12.096577 IP 10.0.2.15.44174 > 151.101.117.164.443: Flags [.], ack 666647, win 65535, length 0
20:00:12.096888 IP 151.101.117.164.443 > 10.0.2.15.44174: Flags [P.], seq 666647:669395, ack 869, win 65535, length 2748
20:00:12.096896 IP 10.0.2.15.44174 > 151.101.117.164.443: Flags [.], ack 669395, win 65535, length 0
20:00:12.098225 IP 151.101.117.164.443 > 10.0.2.15.44174: Flags [P.], seq 669395:677639, ack 869, win 65535, length 8244
20:00:12.098229 IP 151.101.117.164.443 > 10.0.2.15.44174: Flags [P.], seq 677639:681761, ack 869, win 65535, length 4122
20:00:12.098271 IP 151.101.117.164.443 > 10.0.2.15.44174: Flags [P.], seq 681761:687257, ack 869, win 65535, length 5496
20:00:12.098383 IP 10.0.2.15.44174 > 151.101.117.164.443: Flags [.], ack 687257, win 65535, length 0
20:00:12.098500 IP 151.101.117.164.443 > 10.0.2.15.44174: Flags [P.], seq 687257:692753, ack 869, win 65535, length 5496
20:00:12.098684 IP 151.101.117.164.443 > 10.0.2.15.44174: Flags [P.], seq 692753:694127, ack 869, win 65535, length 1374
20:00:12.098771 IP 10.0.2.15.44174 > 151.101.117.164.443: Flags [.], ack 694127, win 65535, length 0
20:00:12.098891 IP 151.101.117.164.443 > 10.0.2.15.44174: Flags [P.], seq 694127:699623, ack 869, win 65535, length 5496
20:00:12.098928 IP 10.0.2.15.44174 > 151.101.117.164.443: Flags [.], ack 699623, win 65535, length 0
20:00:12.099312 IP 151.101.117.164.443 > 10.0.2.15.44174: Flags [P.], seq 699623:703745, ack 869, win 65535, length 4122
20:00:12.099314 IP 151.101.117.164.443 > 10.0.2.15.44174: Flags [P.], seq 703745:709241, ack 869, win 65535, length 5496
20:00:12.099314 IP 151.101.117.164.443 > 10.0.2.15.44174: Flags [P.], seq 709241:710615, ack 869, win 65535, length 1374
20:00:12.099480 IP 151.101.117.164.443 > 10.0.2.15.44174: Flags [P.], seq 710615:713363, ack 869, win 65535, length 2748
20:00:12.100374 IP 151.101.117.164.443 > 10.0.2.15.44174: Flags [P.], seq 713363:714737, ack 869, win 65535, length 1374
20:00:12.100377 IP 151.101.117.164.443 > 10.0.2.15.44174: Flags [P.], seq 714737:720233, ack 869, win 65535, length 5496
20:00:12.100378 IP 151.101.117.164.443 > 10.0.2.15.44174: Flags [P.], seq 720233:725729, ack 869, win 65535, length 5496
20:00:12.100534 IP 151.101.117.164.443 > 10.0.2.15.44174: Flags [P.], seq 725729:728477, ack 869, win 65535, length 2748
20:00:12.100667 IP 151.101.117.164.443 > 10.0.2.15.44174: Flags [P.], seq 728477:732599, ack 869, win 65535, length 4122
20:00:12.100877 IP 10.0.2.15.44174 > 151.101.117.164.443: Flags [.], ack 732599, win 65535, length 0
20:00:12.101220 IP 151.101.117.164.443 > 10.0.2.15.44174: Flags [P.], seq 732599:740843, ack 869, win 65535, length 8244
20:00:12.101865 IP 151.101.117.164.443 > 10.0.2.15.44174: Flags [P.], seq 740843:744965, ack 869, win 65535, length 4122
20:00:12.101867 IP 151.101.117.164.443 > 10.0.2.15.44174: Flags [P.], seq 744965:749087, ack 869, win 65535, length 4122
20:00:12.102317 IP 151.101.117.164.443 > 10.0.2.15.44174: Flags [P.], seq 749087:750461, ack 869, win 65535, length 1374
20:00:12.102320 IP 151.101.117.164.443 > 10.0.2.15.44174: Flags [P.], seq 750461:753209, ack 869, win 65535, length 2748
20:00:12.102539 IP 151.101.117.164.443 > 10.0.2.15.44174: Flags [P.], seq 753209:757331, ack 869, win 65535, length 4122
20:00:12.102541 IP 151.101.117.164.443 > 10.0.2.15.44174: Flags [P.], seq 757331:760079, ack 869, win 65535, length 2748
20:00:12.102541 IP 151.101.117.164.443 > 10.0.2.15.44174: Flags [P.], seq 760079:762827, ack 869, win 65535, length 2748
20:00:12.102542 IP 151.101.117.164.443 > 10.0.2.15.44174: Flags [P.], seq 762827:764201, ack 869, win 65535, length 1374
20:00:12.102786 IP 151.101.117.164.443 > 10.0.2.15.44174: Flags [P.], seq 764201:766949, ack 869, win 65535, length 2748
20:00:12.104183 IP 10.0.2.15.44174 > 151.101.117.164.443: Flags [.], ack 766949, win 65535, length 0
20:00:12.105138 IP 151.101.117.164.443 > 10.0.2.15.44174: Flags [P.], seq 766949:801299, ack 869, win 65535, length 34350
20:00:12.105153 IP 10.0.2.15.44174 > 151.101.117.164.443: Flags [.], ack 801299, win 65535, length 0
20:00:12.105389 IP 151.101.117.164.443 > 10.0.2.15.44174: Flags [.], seq 801299:808599, ack 869, win 65535, length 7300
20:00:12.105421 IP 10.0.2.15.44174 > 151.101.117.164.443: Flags [.], ack 808599, win 65535, length 0
20:00:12.105636 IP 151.101.117.164.443 > 10.0.2.15.44174: Flags [P.], seq 808599:812291, ack 869, win 65535, length 3692
20:00:12.105646 IP 10.0.2.15.44174 > 151.101.117.164.443: Flags [.], ack 812291, win 65535, length 0
20:00:12.105940 IP 151.101.117.164.443 > 10.0.2.15.44174: Flags [P.], seq 812291:819161, ack 869, win 65535, length 6870
20:00:12.106072 IP 151.101.117.164.443 > 10.0.2.15.44174: Flags [P.], seq 819161:821909, ack 869, win 65535, length 2748
20:00:12.106094 IP 10.0.2.15.44174 > 151.101.117.164.443: Flags [.], ack 821909, win 65535, length 0
20:00:12.106174 IP 151.101.117.164.443 > 10.0.2.15.44174: Flags [.], seq 821909:823369, ack 869, win 65535, length 1460
20:00:12.106347 IP 151.101.117.164.443 > 10.0.2.15.44174: Flags [P.], seq 823369:824657, ack 869, win 65535, length 1288
20:00:12.106349 IP 151.101.117.164.443 > 10.0.2.15.44174: Flags [P.], seq 824657:827405, ack 869, win 65535, length 2748
20:00:12.106541 IP 151.101.117.164.443 > 10.0.2.15.44174: Flags [P.], seq 827405:830153, ack 869, win 65535, length 2748
20:00:12.106610 IP 10.0.2.15.44174 > 151.101.117.164.443: Flags [.], ack 830153, win 65535, length 0
20:00:12.106878 IP 151.101.117.164.443 > 10.0.2.15.44174: Flags [P.], seq 830153:834275, ack 869, win 65535, length 4122
20:00:12.106880 IP 151.101.117.164.443 > 10.0.2.15.44174: Flags [P.], seq 834275:837023, ack 869, win 65535, length 2748
20:00:12.106881 IP 151.101.117.164.443 > 10.0.2.15.44174: Flags [P.], seq 837023:838397, ack 869, win 65535, length 1374
20:00:12.106893 IP 10.0.2.15.44174 > 151.101.117.164.443: Flags [.], ack 834275, win 65535, length 0
20:00:12.107233 IP 151.101.117.164.443 > 10.0.2.15.44174: Flags [P.], seq 838397:842519, ack 869, win 65535, length 4122
20:00:12.107416 IP 10.0.2.15.44174 > 151.101.117.164.443: Flags [.], ack 842519, win 65535, length 0
20:00:12.107440 IP 151.101.117.164.443 > 10.0.2.15.44174: Flags [P.], seq 842519:846641, ack 869, win 65535, length 4122
20:00:12.107526 IP 10.0.2.15.44174 > 151.101.117.164.443: Flags [.], ack 846641, win 65535, length 0
20:00:12.107674 IP 151.101.117.164.443 > 10.0.2.15.44174: Flags [P.], seq 846641:849389, ack 869, win 65535, length 2748
20:00:12.107676 IP 151.101.117.164.443 > 10.0.2.15.44174: Flags [P.], seq 849389:853511, ack 869, win 65535, length 4122
20:00:12.107677 IP 151.101.117.164.443 > 10.0.2.15.44174: Flags [P.], seq 853511:854885, ack 869, win 65535, length 1374
20:00:12.107752 IP 10.0.2.15.44174 > 151.101.117.164.443: Flags [.], ack 854885, win 65535, length 0
20:00:12.107890 IP 151.101.117.164.443 > 10.0.2.15.44174: Flags [P.], seq 854885:857633, ack 869, win 65535, length 2748
20:00:12.107898 IP 10.0.2.15.44174 > 151.101.117.164.443: Flags [.], ack 857633, win 65535, length 0
20:00:12.108120 IP 151.101.117.164.443 > 10.0.2.15.44174: Flags [P.], seq 857633:863129, ack 869, win 65535, length 5496
20:00:12.108153 IP 10.0.2.15.44174 > 151.101.117.164.443: Flags [.], ack 863129, win 65535, length 0
20:00:12.108481 IP 151.101.117.164.443 > 10.0.2.15.44174: Flags [P.], seq 863129:869999, ack 869, win 65535, length 6870
20:00:12.108529 IP 10.0.2.15.44174 > 151.101.117.164.443: Flags [.], ack 869999, win 65535, length 0
20:00:12.108872 IP 151.101.117.164.443 > 10.0.2.15.44174: Flags [P.], seq 869999:874121, ack 869, win 65535, length 4122
20:00:12.108874 IP 151.101.117.164.443 > 10.0.2.15.44174: Flags [P.], seq 874121:875495, ack 869, win 65535, length 1374
20:00:12.108986 IP 151.101.117.164.443 > 10.0.2.15.44174: Flags [P.], seq 875495:878243, ack 869, win 65535, length 2748
20:00:12.109030 IP 10.0.2.15.44174 > 151.101.117.164.443: Flags [.], ack 878243, win 65535, length 0
20:00:12.109254 IP 151.101.117.164.443 > 10.0.2.15.44174: Flags [P.], seq 878243:883739, ack 869, win 65535, length 5496
20:00:12.109312 IP 10.0.2.15.44174 > 151.101.117.164.443: Flags [.], ack 883739, win 65535, length 0
20:00:12.110259 IP 151.101.117.164.443 > 10.0.2.15.44174: Flags [P.], seq 883739:890609, ack 869, win 65535, length 6870
20:00:12.110262 IP 151.101.117.164.443 > 10.0.2.15.44174: Flags [P.], seq 890609:896105, ack 869, win 65535, length 5496
20:00:12.110326 IP 10.0.2.15.44174 > 151.101.117.164.443: Flags [.], ack 890609, win 65535, length 0
20:00:12.110455 IP 151.101.117.164.443 > 10.0.2.15.44174: Flags [P.], seq 896105:901601, ack 869, win 65535, length 5496
20:00:12.110719 IP 151.101.117.164.443 > 10.0.2.15.44174: Flags [P.], seq 901601:904349, ack 869, win 65535, length 2748
20:00:12.110741 IP 151.101.117.164.443 > 10.0.2.15.44174: Flags [P.], seq 904349:907097, ack 869, win 65535, length 2748
20:00:12.110742 IP 151.101.117.164.443 > 10.0.2.15.44174: Flags [P.], seq 907097:909845, ack 869, win 65535, length 2748
20:00:12.110742 IP 151.101.117.164.443 > 10.0.2.15.44174: Flags [P.], seq 909845:911219, ack 869, win 65535, length 1374
20:00:12.110945 IP 151.101.117.164.443 > 10.0.2.15.44174: Flags [P.], seq 911219:915341, ack 869, win 65535, length 4122
20:00:12.110980 IP 10.0.2.15.44174 > 151.101.117.164.443: Flags [.], ack 915341, win 65535, length 0
20:00:12.111212 IP 151.101.117.164.443 > 10.0.2.15.44174: Flags [P.], seq 915341:916715, ack 869, win 65535, length 1374
20:00:12.111214 IP 151.101.117.164.443 > 10.0.2.15.44174: Flags [P.], seq 916715:920837, ack 869, win 65535, length 4122
20:00:12.111336 IP 151.101.117.164.443 > 10.0.2.15.44174: Flags [P.], seq 920837:922211, ack 869, win 65535, length 1374
20:00:12.111620 IP 10.0.2.15.44174 > 151.101.117.164.443: Flags [.], ack 922211, win 65535, length 0
20:00:12.111734 IP 151.101.117.164.443 > 10.0.2.15.44174: Flags [P.], seq 922211:924959, ack 869, win 65535, length 2748
20:00:12.111768 IP 10.0.2.15.44174 > 151.101.117.164.443: Flags [.], ack 924959, win 65535, length 0
20:00:12.112260 IP 151.101.117.164.443 > 10.0.2.15.44174: Flags [P.], seq 924959:930455, ack 869, win 65535, length 5496
20:00:12.112262 IP 151.101.117.164.443 > 10.0.2.15.44174: Flags [P.], seq 930455:935951, ack 869, win 65535, length 5496
20:00:12.112321 IP 151.101.117.164.443 > 10.0.2.15.44174: Flags [P.], seq 935951:938699, ack 869, win 65535, length 2748
20:00:12.112322 IP 151.101.117.164.443 > 10.0.2.15.44174: Flags [P.], seq 938699:941447, ack 869, win 65535, length 2748
20:00:12.112434 IP 151.101.117.164.443 > 10.0.2.15.44174: Flags [P.], seq 941447:945569, ack 869, win 65535, length 4122
20:00:12.112454 IP 10.0.2.15.44174 > 151.101.117.164.443: Flags [.], ack 941447, win 65535, length 0
20:00:12.112477 IP 10.0.2.15.44174 > 151.101.117.164.443: Flags [.], ack 945569, win 65535, length 0
20:00:12.112882 IP 151.101.117.164.443 > 10.0.2.15.44174: Flags [P.], seq 945569:946943, ack 869, win 65535, length 1374
20:00:12.112884 IP 151.101.117.164.443 > 10.0.2.15.44174: Flags [P.], seq 946943:951065, ack 869, win 65535, length 4122
20:00:12.112885 IP 151.101.117.164.443 > 10.0.2.15.44174: Flags [P.], seq 951065:953813, ack 869, win 65535, length 2748
20:00:12.112944 IP 10.0.2.15.44174 > 151.101.117.164.443: Flags [.], ack 953813, win 65535, length 0
20:00:12.113055 IP 151.101.117.164.443 > 10.0.2.15.44174: Flags [P.], seq 953813:955187, ack 869, win 65535, length 1374
20:00:12.114041 IP 151.101.117.164.443 > 10.0.2.15.44174: Flags [P.], seq 955187:957935, ack 869, win 65535, length 2748
20:00:12.114043 IP 151.101.117.164.443 > 10.0.2.15.44174: Flags [P.], seq 957935:963431, ack 869, win 65535, length 5496
20:00:12.114058 IP 10.0.2.15.44174 > 151.101.117.164.443: Flags [.], ack 957935, win 65535, length 0
20:00:12.114280 IP 151.101.117.164.443 > 10.0.2.15.44174: Flags [P.], seq 963431:968927, ack 869, win 65535, length 5496
20:00:12.114313 IP 10.0.2.15.44174 > 151.101.117.164.443: Flags [.], ack 968927, win 65535, length 0
20:00:12.114384 IP 151.101.117.164.443 > 10.0.2.15.44174: Flags [P.], seq 968927:971675, ack 869, win 65535, length 2748
20:00:12.114385 IP 151.101.117.164.443 > 10.0.2.15.44174: Flags [P.], seq 971675:973049, ack 869, win 65535, length 1374
20:00:12.114407 IP 10.0.2.15.44174 > 151.101.117.164.443: Flags [.], ack 973049, win 65535, length 0
20:00:12.114559 IP 151.101.117.164.443 > 10.0.2.15.44174: Flags [P.], seq 973049:977171, ack 869, win 65535, length 4122
20:00:12.114566 IP 10.0.2.15.44174 > 151.101.117.164.443: Flags [.], ack 977171, win 65535, length 0
20:00:12.114775 IP 151.101.117.164.443 > 10.0.2.15.44174: Flags [P.], seq 977171:979919, ack 869, win 65535, length 2748
20:00:12.114784 IP 10.0.2.15.44174 > 151.101.117.164.443: Flags [.], ack 979919, win 65535, length 0
20:00:12.115005 IP 151.101.117.164.443 > 10.0.2.15.44174: Flags [P.], seq 979919:981293, ack 869, win 65535, length 1374
20:00:12.115236 IP 151.101.117.164.443 > 10.0.2.15.44174: Flags [P.], seq 981293:986789, ack 869, win 65535, length 5496
20:00:12.115257 IP 10.0.2.15.44174 > 151.101.117.164.443: Flags [.], ack 986789, win 65535, length 0
20:00:12.115501 IP 151.101.117.164.443 > 10.0.2.15.44174: Flags [P.], seq 986789:992285, ack 869, win 65535, length 5496
20:00:12.115511 IP 10.0.2.15.44174 > 151.101.117.164.443: Flags [.], ack 992285, win 65535, length 0
20:00:12.116195 IP 151.101.117.164.443 > 10.0.2.15.44174: Flags [P.], seq 992285:997781, ack 869, win 65535, length 5496
20:00:12.116196 IP 151.101.117.164.443 > 10.0.2.15.44174: Flags [P.], seq 997781:1000529, ack 869, win 65535, length 2748
20:00:12.116197 IP 151.101.117.164.443 > 10.0.2.15.44174: Flags [P.], seq 1000529:1003277, ack 869, win 65535, length 2748
20:00:12.116324 IP 10.0.2.15.44174 > 151.101.117.164.443: Flags [.], ack 997781, win 65535, length 0
20:00:12.116350 IP 10.0.2.15.44174 > 151.101.117.164.443: Flags [.], ack 1000529, win 65535, length 0
20:00:12.116362 IP 10.0.2.15.44174 > 151.101.117.164.443: Flags [.], ack 1003277, win 65535, length 0
20:00:12.116502 IP 151.101.117.164.443 > 10.0.2.15.44174: Flags [P.], seq 1003277:1007399, ack 869, win 65535, length 4122
20:00:12.116514 IP 151.101.117.164.443 > 10.0.2.15.44174: Flags [P.], seq 1007399:1008773, ack 869, win 65535, length 1374
20:00:12.116515 IP 151.101.117.164.443 > 10.0.2.15.44174: Flags [P.], seq 1008773:1012895, ack 869, win 65535, length 4122
20:00:12.116523 IP 10.0.2.15.44174 > 151.101.117.164.443: Flags [.], ack 1007399, win 65535, length 0
20:00:12.116538 IP 10.0.2.15.44174 > 151.101.117.164.443: Flags [.], ack 1012895, win 65535, length 0
20:00:12.116703 IP 151.101.117.164.443 > 10.0.2.15.44174: Flags [P.], seq 1012895:1017017, ack 869, win 65535, length 4122
20:00:12.116880 IP 10.0.2.15.44174 > 151.101.117.164.443: Flags [.], ack 1017017, win 65535, length 0
20:00:12.117050 IP 151.101.117.164.443 > 10.0.2.15.44174: Flags [P.], seq 1017017:1022513, ack 869, win 65535, length 5496
20:00:12.117051 IP 151.101.117.164.443 > 10.0.2.15.44174: Flags [.], seq 1022513:1023973, ack 869, win 65535, length 1460
20:00:12.117062 IP 10.0.2.15.44174 > 151.101.117.164.443: Flags [.], ack 1022513, win 65535, length 0
20:00:12.117164 IP 151.101.117.164.443 > 10.0.2.15.44174: Flags [P.], seq 1023973:1026635, ack 869, win 65535, length 2662
20:00:12.117170 IP 10.0.2.15.44174 > 151.101.117.164.443: Flags [.], ack 1026635, win 65535, length 0
20:00:12.118161 IP 151.101.117.164.443 > 10.0.2.15.44174: Flags [P.], seq 1026635:1032131, ack 869, win 65535, length 5496
20:00:12.118177 IP 10.0.2.15.44174 > 151.101.117.164.443: Flags [.], ack 1032131, win 65535, length 0
20:00:12.118543 IP 151.101.117.164.443 > 10.0.2.15.44174: Flags [P.], seq 1032131:1034879, ack 869, win 65535, length 2748
20:00:12.118545 IP 151.101.117.164.443 > 10.0.2.15.44174: Flags [P.], seq 1034879:1040375, ack 869, win 65535, length 5496
20:00:12.118593 IP 10.0.2.15.44174 > 151.101.117.164.443: Flags [.], ack 1034879, win 65535, length 0
20:00:12.118663 IP 10.0.2.15.44174 > 151.101.117.164.443: Flags [.], ack 1040375, win 65535, length 0
20:00:12.118779 IP 151.101.117.164.443 > 10.0.2.15.44174: Flags [P.], seq 1040375:1045871, ack 869, win 65535, length 5496
20:00:12.118787 IP 10.0.2.15.44174 > 151.101.117.164.443: Flags [.], ack 1045871, win 65535, length 0
20:00:12.118900 IP 151.101.117.164.443 > 10.0.2.15.44174: Flags [P.], seq 1045871:1048619, ack 869, win 65535, length 2748
20:00:12.118909 IP 10.0.2.15.44174 > 151.101.117.164.443: Flags [.], ack 1048619, win 65535, length 0
20:00:12.119090 IP 151.101.117.164.443 > 10.0.2.15.44174: Flags [P.], seq 1048619:1051367, ack 869, win 65535, length 2748
20:00:12.119097 IP 10.0.2.15.44174 > 151.101.117.164.443: Flags [.], ack 1051367, win 65535, length 0
20:00:12.119216 IP 151.101.117.164.443 > 10.0.2.15.44174: Flags [P.], seq 1051367:1052741, ack 869, win 65535, length 1374
20:00:12.119626 IP 151.101.117.164.443 > 10.0.2.15.44174: Flags [P.], seq 1052741:1055489, ack 869, win 65535, length 2748
20:00:12.119629 IP 151.101.117.164.443 > 10.0.2.15.44174: Flags [P.], seq 1055489:1059611, ack 869, win 65535, length 4122
20:00:12.119734 IP 10.0.2.15.44174 > 151.101.117.164.443: Flags [.], ack 1055489, win 65535, length 0
20:00:12.119792 IP 10.0.2.15.44174 > 151.101.117.164.443: Flags [.], ack 1059611, win 65535, length 0
20:00:12.120033 IP 151.101.117.164.443 > 10.0.2.15.44174: Flags [P.], seq 1059611:1062359, ack 869, win 65535, length 2748
20:00:12.120036 IP 151.101.117.164.443 > 10.0.2.15.44174: Flags [P.], seq 1062359:1065107, ack 869, win 65535, length 2748
20:00:12.120037 IP 151.101.117.164.443 > 10.0.2.15.44174: Flags [P.], seq 1065107:1067855, ack 869, win 65535, length 2748
20:00:12.120056 IP 10.0.2.15.44174 > 151.101.117.164.443: Flags [.], ack 1062359, win 65535, length 0
20:00:12.120105 IP 10.0.2.15.44174 > 151.101.117.164.443: Flags [.], ack 1065107, win 65535, length 0
20:00:12.120252 IP 10.0.2.15.44174 > 151.101.117.164.443: Flags [.], ack 1067855, win 65535, length 0
20:00:12.121562 IP 151.101.117.164.443 > 10.0.2.15.44174: Flags [P.], seq 1067855:1070603, ack 869, win 65535, length 2748
20:00:12.121609 IP 151.101.117.164.443 > 10.0.2.15.44174: Flags [P.], seq 1070603:1073351, ack 869, win 65535, length 2748
20:00:12.121611 IP 151.101.117.164.443 > 10.0.2.15.44174: Flags [P.], seq 1073351:1076099, ack 869, win 65535, length 2748
20:00:12.121612 IP 151.101.117.164.443 > 10.0.2.15.44174: Flags [P.], seq 1076099:1078847, ack 869, win 65535, length 2748
20:00:12.121636 IP 10.0.2.15.44174 > 151.101.117.164.443: Flags [.], ack 1070603, win 65535, length 0
20:00:12.121685 IP 10.0.2.15.44174 > 151.101.117.164.443: Flags [.], ack 1073351, win 65535, length 0
20:00:12.121694 IP 10.0.2.15.44174 > 151.101.117.164.443: Flags [.], ack 1076099, win 65535, length 0
20:00:12.121701 IP 10.0.2.15.44174 > 151.101.117.164.443: Flags [.], ack 1078847, win 65535, length 0
20:00:12.121778 IP 151.101.117.164.443 > 10.0.2.15.44174: Flags [P.], seq 1078847:1082969, ack 869, win 65535, length 4122
20:00:12.121780 IP 151.101.117.164.443 > 10.0.2.15.44174: Flags [P.], seq 1082969:1087091, ack 869, win 65535, length 4122
20:00:12.121781 IP 151.101.117.164.443 > 10.0.2.15.44174: Flags [P.], seq 1087091:1088465, ack 869, win 65535, length 1374
20:00:12.121782 IP 151.101.117.164.443 > 10.0.2.15.44174: Flags [P.], seq 1088465:1093961, ack 869, win 65535, length 5496
20:00:12.121794 IP 10.0.2.15.44174 > 151.101.117.164.443: Flags [.], ack 1082969, win 65535, length 0
20:00:12.121808 IP 10.0.2.15.44174 > 151.101.117.164.443: Flags [.], ack 1087091, win 65535, length 0
20:00:12.121831 IP 151.101.117.164.443 > 10.0.2.15.44174: Flags [P.], seq 1093961:1098083, ack 869, win 65535, length 4122
20:00:12.121832 IP 151.101.117.164.443 > 10.0.2.15.44174: Flags [P.], seq 1098083:1100831, ack 869, win 65535, length 2748
20:00:12.121833 IP 151.101.117.164.443 > 10.0.2.15.44174: Flags [P.], seq 1100831:1104953, ack 869, win 65535, length 4122
20:00:12.122414 IP 10.0.2.15.44174 > 151.101.117.164.443: Flags [.], ack 1104953, win 65535, length 0
20:00:12.124574 IP 151.101.117.164.443 > 10.0.2.15.44174: Flags [P.], seq 1104953:1111823, ack 869, win 65535, length 6870
20:00:12.124679 IP 151.101.117.164.443 > 10.0.2.15.44174: Flags [P.], seq 1111823:1115945, ack 869, win 65535, length 4122
20:00:12.124777 IP 10.0.2.15.44174 > 151.101.117.164.443: Flags [.], ack 1111823, win 65535, length 0
20:00:12.124967 IP 10.0.2.15.44174 > 151.101.117.164.443: Flags [.], ack 1115945, win 65535, length 0
20:00:12.125346 IP 151.101.117.164.443 > 10.0.2.15.44174: Flags [P.], seq 1115945:1121441, ack 869, win 65535, length 5496
20:00:12.125348 IP 151.101.117.164.443 > 10.0.2.15.44174: Flags [P.], seq 1121441:1124189, ack 869, win 65535, length 2748
20:00:12.125350 IP 151.101.117.164.443 > 10.0.2.15.44174: Flags [P.], seq 1124189:1128311, ack 869, win 65535, length 4122
20:00:12.125484 IP 10.0.2.15.44174 > 151.101.117.164.443: Flags [.], ack 1121441, win 65535, length 0
20:00:12.125574 IP 10.0.2.15.44174 > 151.101.117.164.443: Flags [.], ack 1124189, win 65535, length 0
20:00:12.125595 IP 10.0.2.15.44174 > 151.101.117.164.443: Flags [.], ack 1128311, win 65535, length 0
20:00:12.125613 IP 151.101.117.164.443 > 10.0.2.15.44174: Flags [P.], seq 1128311:1132433, ack 869, win 65535, length 4122
20:00:12.125615 IP 151.101.117.164.443 > 10.0.2.15.44174: Flags [P.], seq 1132433:1137929, ack 869, win 65535, length 5496
20:00:12.125615 IP 151.101.117.164.443 > 10.0.2.15.44174: Flags [P.], seq 1137929:1142051, ack 869, win 65535, length 4122
20:00:12.125622 IP 10.0.2.15.44174 > 151.101.117.164.443: Flags [.], ack 1132433, win 65535, length 0
20:00:12.125663 IP 151.101.117.164.443 > 10.0.2.15.44174: Flags [P.], seq 1142051:1150295, ack 869, win 65535, length 8244
20:00:12.125950 IP 151.101.117.164.443 > 10.0.2.15.44174: Flags [P.], seq 1150295:1155791, ack 869, win 65535, length 5496
20:00:12.125952 IP 151.101.117.164.443 > 10.0.2.15.44174: Flags [P.], seq 1155791:1158539, ack 869, win 65535, length 2748
20:00:12.126285 IP 151.101.117.164.443 > 10.0.2.15.44174: Flags [P.], seq 1158539:1161287, ack 869, win 65535, length 2748
20:00:12.126333 IP 151.101.117.164.443 > 10.0.2.15.44174: Flags [P.], seq 1161287:1166783, ack 869, win 65535, length 5496
20:00:12.126505 IP 10.0.2.15.44174 > 151.101.117.164.443: Flags [.], ack 1166783, win 65535, length 0
20:00:12.126718 IP 151.101.117.164.443 > 10.0.2.15.44174: Flags [P.], seq 1166783:1175027, ack 869, win 65535, length 8244
20:00:12.127158 IP 151.101.117.164.443 > 10.0.2.15.44174: Flags [P.], seq 1175027:1180523, ack 869, win 65535, length 5496
20:00:12.127160 IP 151.101.117.164.443 > 10.0.2.15.44174: Flags [P.], seq 1180523:1183271, ack 869, win 65535, length 2748
20:00:12.127331 IP 151.101.117.164.443 > 10.0.2.15.44174: Flags [P.], seq 1183271:1186019, ack 869, win 65535, length 2748
20:00:12.127353 IP 10.0.2.15.44174 > 151.101.117.164.443: Flags [.], ack 1175027, win 65535, length 0
20:00:12.127521 IP 10.0.2.15.44174 > 151.101.117.164.443: Flags [.], ack 1186019, win 65535, length 0
20:00:12.132560 IP 151.101.117.164.443 > 10.0.2.15.44174: Flags [.], seq 1186019:1248799, ack 869, win 65535, length 62780
20:00:12.132599 IP 10.0.2.15.44174 > 151.101.117.164.443: Flags [.], ack 1248799, win 65535, length 0
20:00:12.132702 IP 151.101.117.164.443 > 10.0.2.15.44174: Flags [P.], seq 1248799:1251719, ack 869, win 65535, length 2920
20:00:12.132938 IP 151.101.117.164.443 > 10.0.2.15.44174: Flags [.], seq 1251719:1264859, ack 869, win 65535, length 13140
20:00:12.133024 IP 151.101.117.164.443 > 10.0.2.15.44174: Flags [P.], seq 1264859:1273955, ack 869, win 65535, length 9096
20:00:12.133522 IP 10.0.2.15.44174 > 151.101.117.164.443: Flags [.], ack 1273955, win 65535, length 0
20:00:12.133591 IP 151.101.117.164.443 > 10.0.2.15.44174: Flags [P.], seq 1273955:1280825, ack 869, win 65535, length 6870
20:00:12.133592 IP 151.101.117.164.443 > 10.0.2.15.44174: Flags [P.], seq 1280825:1284947, ack 869, win 65535, length 4122
20:00:12.133716 IP 151.101.117.164.443 > 10.0.2.15.44174: Flags [P.], seq 1284947:1287695, ack 869, win 65535, length 2748
20:00:12.133970 IP 151.101.117.164.443 > 10.0.2.15.44174: Flags [P.], seq 1287695:1290443, ack 869, win 65535, length 2748
20:00:12.133972 IP 151.101.117.164.443 > 10.0.2.15.44174: Flags [.], seq 1290443:1291903, ack 869, win 65535, length 1460
20:00:12.134433 IP 151.101.117.164.443 > 10.0.2.15.44174: Flags [P.], seq 1291903:1293191, ack 869, win 65535, length 1288
20:00:12.134435 IP 151.101.117.164.443 > 10.0.2.15.44174: Flags [P.], seq 1293191:1297313, ack 869, win 65535, length 4122
20:00:12.134768 IP 151.101.117.164.443 > 10.0.2.15.44174: Flags [P.], seq 1297313:1302809, ack 869, win 65535, length 5496
20:00:12.134959 IP 151.101.117.164.443 > 10.0.2.15.44174: Flags [P.], seq 1302809:1308305, ack 869, win 65535, length 5496
20:00:12.135641 IP 10.0.2.15.44174 > 151.101.117.164.443: Flags [.], ack 1308305, win 65535, length 0
20:00:12.136169 IP 151.101.117.164.443 > 10.0.2.15.44174: Flags [P.], seq 1308305:1328915, ack 869, win 65535, length 20610
20:00:12.136210 IP 151.101.117.164.443 > 10.0.2.15.44174: Flags [P.], seq 1328915:1333037, ack 869, win 65535, length 4122
20:00:12.136210 IP 151.101.117.164.443 > 10.0.2.15.44174: Flags [P.], seq 1333037:1335785, ack 869, win 65535, length 2748
20:00:12.136356 IP 151.101.117.164.443 > 10.0.2.15.44174: Flags [P.], seq 1335785:1339907, ack 869, win 65535, length 4122
20:00:12.136512 IP 151.101.117.164.443 > 10.0.2.15.44174: Flags [P.], seq 1339907:1342655, ack 869, win 65535, length 2748
20:00:12.136616 IP 10.0.2.15.44174 > 151.101.117.164.443: Flags [.], ack 1342655, win 65535, length 0
20:00:12.137468 IP 151.101.117.164.443 > 10.0.2.15.44174: Flags [P.], seq 1342655:1348151, ack 869, win 65535, length 5496
20:00:12.137470 IP 151.101.117.164.443 > 10.0.2.15.44174: Flags [.], seq 1348151:1349611, ack 869, win 65535, length 1460
20:00:12.137738 IP 151.101.117.164.443 > 10.0.2.15.44174: Flags [P.], seq 1349611:1352273, ack 869, win 65535, length 2662
20:00:12.138396 IP 151.101.117.164.443 > 10.0.2.15.44174: Flags [P.], seq 1352273:1359143, ack 869, win 65535, length 6870
20:00:12.138398 IP 151.101.117.164.443 > 10.0.2.15.44174: Flags [P.], seq 1359143:1363265, ack 869, win 65535, length 4122
20:00:12.138433 IP 151.101.117.164.443 > 10.0.2.15.44174: Flags [P.], seq 1363265:1368761, ack 869, win 65535, length 5496
20:00:12.138434 IP 151.101.117.164.443 > 10.0.2.15.44174: Flags [P.], seq 1368761:1370135, ack 869, win 65535, length 1374
20:00:12.138529 IP 151.101.117.164.443 > 10.0.2.15.44174: Flags [P.], seq 1370135:1374257, ack 869, win 65535, length 4122
20:00:12.138573 IP 10.0.2.15.44174 > 151.101.117.164.443: Flags [.], ack 1374257, win 65535, length 0
20:00:12.138751 IP 151.101.117.164.443 > 10.0.2.15.44174: Flags [P.], seq 1374257:1375631, ack 869, win 65535, length 1374
20:00:12.138940 IP 151.101.117.164.443 > 10.0.2.15.44174: Flags [P.], seq 1375631:1379753, ack 869, win 65535, length 4122
20:00:12.138941 IP 151.101.117.164.443 > 10.0.2.15.44174: Flags [P.], seq 1379753:1382501, ack 869, win 65535, length 2748
20:00:12.139069 IP 10.0.2.15.44174 > 151.101.117.164.443: Flags [.], ack 1382501, win 65535, length 0
20:00:12.139441 IP 151.101.117.164.443 > 10.0.2.15.44174: Flags [P.], seq 1382501:1386623, ack 869, win 65535, length 4122
20:00:12.139442 IP 151.101.117.164.443 > 10.0.2.15.44174: Flags [P.], seq 1386623:1390745, ack 869, win 65535, length 4122
20:00:12.139484 IP 10.0.2.15.44174 > 151.101.117.164.443: Flags [.], ack 1390745, win 65535, length 0
20:00:12.140326 IP 151.101.117.164.443 > 10.0.2.15.44174: Flags [P.], seq 1390745:1394867, ack 869, win 65535, length 4122
20:00:12.140328 IP 151.101.117.164.443 > 10.0.2.15.44174: Flags [P.], seq 1394867:1397615, ack 869, win 65535, length 2748
20:00:12.140342 IP 10.0.2.15.44174 > 151.101.117.164.443: Flags [.], ack 1394867, win 65535, length 0
20:00:12.140388 IP 10.0.2.15.44174 > 151.101.117.164.443: Flags [.], ack 1397615, win 65535, length 0
20:00:12.140521 IP 151.101.117.164.443 > 10.0.2.15.44174: Flags [.], seq 1397615:1401995, ack 869, win 65535, length 4380
20:00:12.140556 IP 10.0.2.15.44174 > 151.101.117.164.443: Flags [.], ack 1401995, win 65535, length 0
20:00:12.140779 IP 151.101.117.164.443 > 10.0.2.15.44174: Flags [P.], seq 1401995:1403111, ack 869, win 65535, length 1116
20:00:12.140780 IP 151.101.117.164.443 > 10.0.2.15.44174: Flags [P.], seq 1403111:1404485, ack 869, win 65535, length 1374
20:00:12.140781 IP 151.101.117.164.443 > 10.0.2.15.44174: Flags [P.], seq 1404485:1407233, ack 869, win 65535, length 2748
20:00:12.140847 IP 10.0.2.15.44174 > 151.101.117.164.443: Flags [.], ack 1407233, win 65535, length 0
20:00:12.140970 IP 151.101.117.164.443 > 10.0.2.15.44174: Flags [P.], seq 1407233:1411355, ack 869, win 65535, length 4122
20:00:12.141006 IP 151.101.117.164.443 > 10.0.2.15.44174: Flags [P.], seq 1411355:1412729, ack 869, win 65535, length 1374
20:00:12.141024 IP 10.0.2.15.44174 > 151.101.117.164.443: Flags [.], ack 1412729, win 65535, length 0
20:00:12.141297 IP 151.101.117.164.443 > 10.0.2.15.44174: Flags [P.], seq 1412729:1415477, ack 869, win 65535, length 2748
20:00:12.141349 IP 10.0.2.15.44174 > 151.101.117.164.443: Flags [.], ack 1415477, win 65535, length 0
20:00:12.141600 IP 151.101.117.164.443 > 10.0.2.15.44174: Flags [P.], seq 1415477:1422347, ack 869, win 65535, length 6870
20:00:12.141608 IP 10.0.2.15.44174 > 151.101.117.164.443: Flags [.], ack 1422347, win 65535, length 0
20:00:12.141836 IP 151.101.117.164.443 > 10.0.2.15.44174: Flags [P.], seq 1422347:1425095, ack 869, win 65535, length 2748
20:00:12.141838 IP 151.101.117.164.443 > 10.0.2.15.44174: Flags [P.], seq 1425095:1426469, ack 869, win 65535, length 1374
20:00:12.142042 IP 151.101.117.164.443 > 10.0.2.15.44174: Flags [P.], seq 1426469:1433339, ack 869, win 65535, length 6870
20:00:12.142061 IP 10.0.2.15.44174 > 151.101.117.164.443: Flags [.], ack 1426469, win 65535, length 0
20:00:12.142090 IP 10.0.2.15.44174 > 151.101.117.164.443: Flags [.], ack 1433339, win 65535, length 0
20:00:12.142314 IP 151.101.117.164.443 > 10.0.2.15.44174: Flags [P.], seq 1433339:1436087, ack 869, win 65535, length 2748
20:00:12.142332 IP 10.0.2.15.44174 > 151.101.117.164.443: Flags [.], ack 1436087, win 65535, length 0
20:00:12.142887 IP 151.101.117.164.443 > 10.0.2.15.44174: Flags [P.], seq 1436087:1440209, ack 869, win 65535, length 4122
20:00:12.142889 IP 151.101.117.164.443 > 10.0.2.15.44174: Flags [P.], seq 1440209:1444331, ack 869, win 65535, length 4122
20:00:12.142891 IP 151.101.117.164.443 > 10.0.2.15.44174: Flags [P.], seq 1444331:1449827, ack 869, win 65535, length 5496
20:00:12.142905 IP 10.0.2.15.44174 > 151.101.117.164.443: Flags [.], ack 1440209, win 65535, length 0
20:00:12.143062 IP 151.101.117.164.443 > 10.0.2.15.44174: Flags [P.], seq 1449827:1453949, ack 869, win 65535, length 4122
20:00:12.143484 IP 151.101.117.164.443 > 10.0.2.15.44174: Flags [P.], seq 1453949:1460819, ack 869, win 65535, length 6870
20:00:12.143569 IP 151.101.117.164.443 > 10.0.2.15.44174: Flags [P.], seq 1460819:1462193, ack 869, win 65535, length 1374
20:00:12.143799 IP 10.0.2.15.44174 > 151.101.117.164.443: Flags [.], ack 1462193, win 65535, length 0
20:00:12.144472 IP 151.101.117.164.443 > 10.0.2.15.44174: Flags [P.], seq 1462193:1469063, ack 869, win 65535, length 6870
20:00:12.144682 IP 151.101.117.164.443 > 10.0.2.15.44174: Flags [P.], seq 1469063:1473185, ack 869, win 65535, length 4122
20:00:12.144915 IP 151.101.117.164.443 > 10.0.2.15.44174: Flags [P.], seq 1473185:1475933, ack 869, win 65535, length 2748
20:00:12.145295 IP 151.101.117.164.443 > 10.0.2.15.44174: Flags [P.], seq 1475933:1478681, ack 869, win 65535, length 2748
20:00:12.145297 IP 151.101.117.164.443 > 10.0.2.15.44174: Flags [P.], seq 1478681:1480055, ack 869, win 65535, length 1374
20:00:12.145887 IP 151.101.117.164.443 > 10.0.2.15.44174: Flags [P.], seq 1480055:1485551, ack 869, win 65535, length 5496
20:00:12.145890 IP 151.101.117.164.443 > 10.0.2.15.44174: Flags [P.], seq 1485551:1491047, ack 869, win 65535, length 5496
20:00:12.145923 IP 151.101.117.164.443 > 10.0.2.15.44174: Flags [P.], seq 1491047:1493795, ack 869, win 65535, length 2748
20:00:12.145924 IP 151.101.117.164.443 > 10.0.2.15.44174: Flags [P.], seq 1493795:1496543, ack 869, win 65535, length 2748
20:00:12.145993 IP 10.0.2.15.44174 > 151.101.117.164.443: Flags [.], ack 1496543, win 65535, length 0
20:00:12.147403 IP 151.101.117.164.443 > 10.0.2.15.44174: Flags [P.], seq 1496543:1510283, ack 869, win 65535, length 13740
20:00:12.147548 IP 10.0.2.15.44174 > 151.101.117.164.443: Flags [.], ack 1510283, win 65535, length 0
20:00:12.148286 IP 151.101.117.164.443 > 10.0.2.15.44174: Flags [P.], seq 1510283:1513031, ack 869, win 65535, length 2748
20:00:12.148290 IP 151.101.117.164.443 > 10.0.2.15.44174: Flags [P.], seq 1513031:1518527, ack 869, win 65535, length 5496
20:00:12.148291 IP 151.101.117.164.443 > 10.0.2.15.44174: Flags [P.], seq 1518527:1521275, ack 869, win 65535, length 2748
20:00:12.148478 IP 151.101.117.164.443 > 10.0.2.15.44174: Flags [P.], seq 1521275:1528145, ack 869, win 65535, length 6870
20:00:12.148480 IP 151.101.117.164.443 > 10.0.2.15.44174: Flags [P.], seq 1528145:1532267, ack 869, win 65535, length 4122
20:00:12.148755 IP 151.101.117.164.443 > 10.0.2.15.44174: Flags [P.], seq 1532267:1533641, ack 869, win 65535, length 1374
20:00:12.148757 IP 151.101.117.164.443 > 10.0.2.15.44174: Flags [P.], seq 1533641:1537763, ack 869, win 65535, length 4122
20:00:12.148757 IP 151.101.117.164.443 > 10.0.2.15.44174: Flags [P.], seq 1537763:1540511, ack 869, win 65535, length 2748
20:00:12.149210 IP 10.0.2.15.44174 > 151.101.117.164.443: Flags [.], ack 1540511, win 65535, length 0
20:00:12.149351 IP 151.101.117.164.443 > 10.0.2.15.44174: Flags [P.], seq 1540511:1543259, ack 869, win 65535, length 2748
20:00:12.150116 IP 151.101.117.164.443 > 10.0.2.15.44174: Flags [P.], seq 1543259:1554251, ack 869, win 65535, length 10992
20:00:12.150206 IP 151.101.117.164.443 > 10.0.2.15.44174: Flags [.], seq 1554251:1555711, ack 869, win 65535, length 1460
20:00:12.150566 IP 151.101.117.164.443 > 10.0.2.15.44174: Flags [P.], seq 1555711:1561121, ack 869, win 65535, length 5410
20:00:12.150568 IP 151.101.117.164.443 > 10.0.2.15.44174: Flags [P.], seq 1561121:1566617, ack 869, win 65535, length 5496
20:00:12.150594 IP 151.101.117.164.443 > 10.0.2.15.44174: Flags [P.], seq 1566617:1569365, ack 869, win 65535, length 2748
20:00:12.150660 IP 10.0.2.15.44174 > 151.101.117.164.443: Flags [.], ack 1569365, win 65535, length 0
20:00:12.151742 IP 151.101.117.164.443 > 10.0.2.15.44174: Flags [P.], seq 1569365:1574861, ack 869, win 65535, length 5496
20:00:12.151745 IP 151.101.117.164.443 > 10.0.2.15.44174: Flags [P.], seq 1574861:1577609, ack 869, win 65535, length 2748
20:00:12.151807 IP 10.0.2.15.44174 > 151.101.117.164.443: Flags [.], ack 1577609, win 65535, length 0
20:00:12.152047 IP 151.101.117.164.443 > 10.0.2.15.44174: Flags [P.], seq 1577609:1583105, ack 869, win 65535, length 5496
20:00:12.152049 IP 151.101.117.164.443 > 10.0.2.15.44174: Flags [P.], seq 1583105:1587227, ack 869, win 65535, length 4122
20:00:12.152050 IP 151.101.117.164.443 > 10.0.2.15.44174: Flags [P.], seq 1587227:1588601, ack 869, win 65535, length 1374
20:00:12.152081 IP 151.101.117.164.443 > 10.0.2.15.44174: Flags [P.], seq 1588601:1591349, ack 869, win 65535, length 2748
20:00:12.152082 IP 151.101.117.164.443 > 10.0.2.15.44174: Flags [P.], seq 1591349:1594097, ack 869, win 65535, length 2748
20:00:12.152187 IP 10.0.2.15.44174 > 151.101.117.164.443: Flags [.], ack 1594097, win 65535, length 0
20:00:12.152827 IP 151.101.117.164.443 > 10.0.2.15.44174: Flags [P.], seq 1594097:1598219, ack 869, win 65535, length 4122
20:00:12.152847 IP 10.0.2.15.44174 > 151.101.117.164.443: Flags [.], ack 1598219, win 65535, length 0
20:00:12.153263 IP 151.101.117.164.443 > 10.0.2.15.44174: Flags [P.], seq 1598219:1600967, ack 869, win 65535, length 2748
20:00:12.153267 IP 151.101.117.164.443 > 10.0.2.15.44174: Flags [P.], seq 1600967:1603715, ack 869, win 65535, length 2748
20:00:12.153269 IP 151.101.117.164.443 > 10.0.2.15.44174: Flags [P.], seq 1603715:1609211, ack 869, win 65535, length 5496
20:00:12.153349 IP 151.101.117.164.443 > 10.0.2.15.44174: Flags [P.], seq 1609211:1611959, ack 869, win 65535, length 2748
20:00:12.153351 IP 151.101.117.164.443 > 10.0.2.15.44174: Flags [P.], seq 1611959:1614707, ack 869, win 65535, length 2748
20:00:12.153352 IP 151.101.117.164.443 > 10.0.2.15.44174: Flags [P.], seq 1614707:1617455, ack 869, win 65535, length 2748
20:00:12.153353 IP 151.101.117.164.443 > 10.0.2.15.44174: Flags [P.], seq 1617455:1620203, ack 869, win 65535, length 2748
20:00:12.153562 IP 151.101.117.164.443 > 10.0.2.15.44174: Flags [P.], seq 1620203:1625699, ack 869, win 65535, length 5496
20:00:12.153841 IP 151.101.117.164.443 > 10.0.2.15.44174: Flags [P.], seq 1625699:1628447, ack 869, win 65535, length 2748
20:00:12.153941 IP 10.0.2.15.44174 > 151.101.117.164.443: Flags [.], ack 1628447, win 65535, length 0
20:00:12.154091 IP 151.101.117.164.443 > 10.0.2.15.44174: Flags [P.], seq 1628447:1631195, ack 869, win 65535, length 2748
20:00:12.154349 IP 151.101.117.164.443 > 10.0.2.15.44174: Flags [P.], seq 1631195:1639439, ack 869, win 65535, length 8244
20:00:12.154351 IP 151.101.117.164.443 > 10.0.2.15.44174: Flags [P.], seq 1639439:1640813, ack 869, win 65535, length 1374
20:00:12.154393 IP 10.0.2.15.44174 > 151.101.117.164.443: Flags [.], ack 1640813, win 65535, length 0
20:00:12.154902 IP 151.101.117.164.443 > 10.0.2.15.44174: Flags [P.], seq 1640813:1647683, ack 869, win 65535, length 6870
20:00:12.154917 IP 10.0.2.15.44174 > 151.101.117.164.443: Flags [.], ack 1647683, win 65535, length 0
20:00:12.155208 IP 151.101.117.164.443 > 10.0.2.15.44174: Flags [P.], seq 1647683:1650431, ack 869, win 65535, length 2748
20:00:12.155256 IP 10.0.2.15.44174 > 151.101.117.164.443: Flags [.], ack 1650431, win 65535, length 0
20:00:12.155474 IP 151.101.117.164.443 > 10.0.2.15.44174: Flags [P.], seq 1650431:1653179, ack 869, win 65535, length 2748
20:00:12.155476 IP 151.101.117.164.443 > 10.0.2.15.44174: Flags [P.], seq 1653179:1657301, ack 869, win 65535, length 4122
20:00:12.155570 IP 151.101.117.164.443 > 10.0.2.15.44174: Flags [P.], seq 1657301:1661423, ack 869, win 65535, length 4122
20:00:12.155629 IP 10.0.2.15.44174 > 151.101.117.164.443: Flags [.], ack 1661423, win 65535, length 0
20:00:12.155836 IP 151.101.117.164.443 > 10.0.2.15.44174: Flags [P.], seq 1661423:1664171, ack 869, win 65535, length 2748
20:00:12.155925 IP 10.0.2.15.44174 > 151.101.117.164.443: Flags [.], ack 1664171, win 65535, length 0
20:00:12.156077 IP 151.101.117.164.443 > 10.0.2.15.44174: Flags [P.], seq 1664171:1666919, ack 869, win 65535, length 2748
20:00:12.156079 IP 151.101.117.164.443 > 10.0.2.15.44174: Flags [P.], seq 1666919:1669667, ack 869, win 65535, length 2748
20:00:12.156110 IP 10.0.2.15.44174 > 151.101.117.164.443: Flags [.], ack 1669667, win 65535, length 0
20:00:12.156725 IP 151.101.117.164.443 > 10.0.2.15.44174: Flags [P.], seq 1669667:1673789, ack 869, win 65535, length 4122
20:00:12.156728 IP 151.101.117.164.443 > 10.0.2.15.44174: Flags [P.], seq 1673789:1679285, ack 869, win 65535, length 5496
20:00:12.156729 IP 151.101.117.164.443 > 10.0.2.15.44174: Flags [P.], seq 1679285:1682033, ack 869, win 65535, length 2748
20:00:12.156744 IP 10.0.2.15.44174 > 151.101.117.164.443: Flags [.], ack 1673789, win 65535, length 0
20:00:12.156867 IP 151.101.117.164.443 > 10.0.2.15.44174: Flags [P.], seq 1682033:1684781, ack 869, win 65535, length 2748
20:00:12.157081 IP 151.101.117.164.443 > 10.0.2.15.44174: Flags [P.], seq 1684781:1686155, ack 869, win 65535, length 1374

