19:57:42.009447 IP 10.0.2.15.34494 > 140.233.253.2.53: 53249+ A? www.nytimes.com. (33)
19:57:42.009490 IP 10.0.2.15.34494 > 140.233.253.2.53: 26943+ AAAA? www.nytimes.com. (33)
19:57:42.017169 IP 140.233.253.2.53 > 10.0.2.15.34494: 26943 2/1/0 CNAME www.prd.map.nytimes.com., CNAME nytimes.map.fastly.net. (153)
19:57:42.017171 IP 140.233.253.2.53 > 10.0.2.15.34494: 53249 3/0/0 CNAME www.prd.map.nytimes.com., CNAME nytimes.map.fastly.net., A 151.101.117.164 (111)
19:57:42.017508 IP 10.0.2.15.44120 > 151.101.117.164.443: Flags [S], seq 912406974, win 64240, options [mss 1460,sackOK,TS val 917665100 ecr 0,nop,wscale 6], length 0
19:57:42.032107 IP 151.101.117.164.443 > 10.0.2.15.44120: Flags [S.], seq 210112001, ack 912406975, win 65535, options [mss 1460], length 0
19:57:42.032226 IP 10.0.2.15.44120 > 151.101.117.164.443: Flags [.], ack 1, win 64240, length 0
19:57:42.040371 IP 10.0.2.15.44120 > 151.101.117.164.443: Flags [P.], seq 1:518, ack 1, win 64240, length 517
19:57:42.040684 IP 151.101.117.164.443 > 10.0.2.15.44120: Flags [.], ack 518, win 65535, length 0
19:57:42.059930 IP 151.101.117.164.443 > 10.0.2.15.44120: Flags [.], seq 1:2921, ack 518, win 65535, length 2920
19:57:42.059958 IP 10.0.2.15.44120 > 151.101.117.164.443: Flags [.], ack 2921, win 62780, length 0
19:57:42.060370 IP 151.101.117.164.443 > 10.0.2.15.44120: Flags [P.], seq 2921:5607, ack 518, win 65535, length 2686
19:57:42.060386 IP 10.0.2.15.44120 > 151.101.117.164.443: Flags [.], ack 5607, win 61320, length 0
19:57:42.062085 IP 10.0.2.15.44120 > 151.101.117.164.443: Flags [P.], seq 518:611, ack 5607, win 62780, length 93
19:57:42.062420 IP 151.101.117.164.443 > 10.0.2.15.44120: Flags [.], ack 611, win 65535, length 0
19:57:42.076906 IP 151.101.117.164.443 > 10.0.2.15.44120: Flags [P.], seq 5607:5658, ack 611, win 65535, length 51
19:57:42.076931 IP 10.0.2.15.44120 > 151.101.117.164.443: Flags [.], ack 5658, win 62780, length 0
19:57:42.077538 IP 10.0.2.15.44120 > 151.101.117.164.443: Flags [P.], seq 611:664, ack 5658, win 62780, length 53
19:57:42.077584 IP 10.0.2.15.44120 > 151.101.117.164.443: Flags [P.], seq 664:720, ack 5658, win 62780, length 56
19:57:42.077884 IP 10.0.2.15.44120 > 151.101.117.164.443: Flags [P.], seq 720:831, ack 5658, win 62780, length 111
19:57:42.077959 IP 151.101.117.164.443 > 10.0.2.15.44120: Flags [.], ack 664, win 65535, length 0
19:57:42.078117 IP 151.101.117.164.443 > 10.0.2.15.44120: Flags [.], ack 720, win 65535, length 0
19:57:42.078118 IP 151.101.117.164.443 > 10.0.2.15.44120: Flags [.], ack 831, win 65535, length 0
19:57:42.091821 IP 151.101.117.164.443 > 10.0.2.15.44120: Flags [P.], seq 5658:5753, ack 831, win 65535, length 95
19:57:42.091848 IP 10.0.2.15.44120 > 151.101.117.164.443: Flags [.], ack 5753, win 62780, length 0
19:57:42.092330 IP 10.0.2.15.44120 > 151.101.117.164.443: Flags [P.], seq 831:869, ack 5753, win 62780, length 38
19:57:42.092701 IP 151.101.117.164.443 > 10.0.2.15.44120: Flags [.], ack 869, win 65535, length 0
19:57:42.122368 IP 151.101.117.164.443 > 10.0.2.15.44120: Flags [P.], seq 5753:11249, ack 869, win 65535, length 5496
19:57:42.122371 IP 151.101.117.164.443 > 10.0.2.15.44120: Flags [P.], seq 11249:13997, ack 869, win 65535, length 2748
19:57:42.122682 IP 10.0.2.15.44120 > 151.101.117.164.443: Flags [.], ack 13997, win 58400, length 0
19:57:42.122831 IP 151.101.117.164.443 > 10.0.2.15.44120: Flags [P.], seq 13997:16745, ack 869, win 65535, length 2748
19:57:42.123090 IP 10.0.2.15.44120 > 151.101.117.164.443: Flags [.], ack 16745, win 56940, length 0
19:57:42.124214 IP 151.101.117.164.443 > 10.0.2.15.44120: Flags [P.], seq 16745:22241, ack 869, win 65535, length 5496
19:57:42.124238 IP 10.0.2.15.44120 > 151.101.117.164.443: Flags [.], ack 22241, win 61320, length 0
19:57:42.124797 IP 151.101.117.164.443 > 10.0.2.15.44120: Flags [P.], seq 22241:24989, ack 869, win 65535, length 2748
19:57:42.124849 IP 10.0.2.15.44120 > 151.101.117.164.443: Flags [.], ack 24989, win 58572, length 0
19:57:42.125946 IP 151.101.117.164.443 > 10.0.2.15.44120: Flags [P.], seq 24989:30485, ack 869, win 65535, length 5496
19:57:42.125964 IP 10.0.2.15.44120 > 151.101.117.164.443: Flags [.], ack 30485, win 61320, length 0
19:57:42.127001 IP 151.101.117.164.443 > 10.0.2.15.44120: Flags [P.], seq 30485:33233, ack 869, win 65535, length 2748
19:57:42.127081 IP 10.0.2.15.44120 > 151.101.117.164.443: Flags [.], ack 33233, win 62780, length 0
19:57:42.128106 IP 151.101.117.164.443 > 10.0.2.15.44120: Flags [P.], seq 33233:38729, ack 869, win 65535, length 5496
19:57:42.128180 IP 10.0.2.15.44120 > 151.101.117.164.443: Flags [.], ack 38729, win 61320, length 0
19:57:42.130421 IP 151.101.117.164.443 > 10.0.2.15.44120: Flags [P.], seq 38729:44225, ack 869, win 65535, length 5496
19:57:42.130428 IP 151.101.117.164.443 > 10.0.2.15.44120: Flags [P.], seq 44225:46973, ack 869, win 65535, length 2748
19:57:42.130454 IP 10.0.2.15.44120 > 151.101.117.164.443: Flags [.], ack 44225, win 61320, length 0
19:57:42.131082 IP 10.0.2.15.44120 > 151.101.117.164.443: Flags [.], ack 46973, win 58572, length 0
19:57:42.136277 IP 151.101.117.164.443 > 10.0.2.15.44120: Flags [P.], seq 46973:53843, ack 869, win 65535, length 6870
19:57:42.136302 IP 10.0.2.15.44120 > 151.101.117.164.443: Flags [.], ack 53843, win 59860, length 0
19:57:42.137198 IP 151.101.117.164.443 > 10.0.2.15.44120: Flags [P.], seq 53843:57965, ack 869, win 65535, length 4122
19:57:42.137219 IP 10.0.2.15.44120 > 151.101.117.164.443: Flags [.], ack 57965, win 61320, length 0
19:57:42.137402 IP 151.101.117.164.443 > 10.0.2.15.44120: Flags [P.], seq 57965:62087, ack 869, win 65535, length 4122
19:57:42.137437 IP 10.0.2.15.44120 > 151.101.117.164.443: Flags [.], ack 62087, win 58400, length 0
19:57:42.138440 IP 151.101.117.164.443 > 10.0.2.15.44120: Flags [P.], seq 62087:67583, ack 869, win 65535, length 5496
19:57:42.138464 IP 10.0.2.15.44120 > 151.101.117.164.443: Flags [.], ack 67583, win 61320, length 0
19:57:42.139650 IP 151.101.117.164.443 > 10.0.2.15.44120: Flags [P.], seq 67583:74453, ack 869, win 65535, length 6870
19:57:42.139674 IP 10.0.2.15.44120 > 151.101.117.164.443: Flags [.], ack 74453, win 65535, length 0
19:57:42.140453 IP 151.101.117.164.443 > 10.0.2.15.44120: Flags [P.], seq 74453:78575, ack 869, win 65535, length 4122
19:57:42.140472 IP 10.0.2.15.44120 > 151.101.117.164.443: Flags [.], ack 78575, win 65535, length 0
19:57:42.141684 IP 151.101.117.164.443 > 10.0.2.15.44120: Flags [P.], seq 78575:85445, ack 869, win 65535, length 6870
19:57:42.141686 IP 151.101.117.164.443 > 10.0.2.15.44120: Flags [P.], seq 85445:88193, ack 869, win 65535, length 2748
19:57:42.141703 IP 10.0.2.15.44120 > 151.101.117.164.443: Flags [.], ack 85445, win 65535, length 0
19:57:42.141730 IP 10.0.2.15.44120 > 151.101.117.164.443: Flags [.], ack 88193, win 65535, length 0
19:57:42.141949 IP 151.101.117.164.443 > 10.0.2.15.44120: Flags [P.], seq 88193:89567, ack 869, win 65535, length 1374
19:57:42.143748 IP 151.101.117.164.443 > 10.0.2.15.44120: Flags [P.], seq 89567:96437, ack 869, win 65535, length 6870
19:57:42.143752 IP 151.101.117.164.443 > 10.0.2.15.44120: Flags [P.], seq 96437:99185, ack 869, win 65535, length 2748
19:57:42.143753 IP 151.101.117.164.443 > 10.0.2.15.44120: Flags [P.], seq 99185:101933, ack 869, win 65535, length 2748
19:57:42.143775 IP 10.0.2.15.44120 > 151.101.117.164.443: Flags [.], ack 96437, win 65535, length 0
19:57:42.143816 IP 10.0.2.15.44120 > 151.101.117.164.443: Flags [.], ack 99185, win 65535, length 0
19:57:42.143834 IP 10.0.2.15.44120 > 151.101.117.164.443: Flags [.], ack 101933, win 65535, length 0
19:57:42.143857 IP 151.101.117.164.443 > 10.0.2.15.44120: Flags [P.], seq 101933:103307, ack 869, win 65535, length 1374
19:57:42.144180 IP 151.101.117.164.443 > 10.0.2.15.44120: Flags [P.], seq 103307:106055, ack 869, win 65535, length 2748
19:57:42.144196 IP 10.0.2.15.44120 > 151.101.117.164.443: Flags [.], ack 106055, win 65535, length 0
19:57:42.144513 IP 151.101.117.164.443 > 10.0.2.15.44120: Flags [P.], seq 106055:110177, ack 869, win 65535, length 4122
19:57:42.144514 IP 151.101.117.164.443 > 10.0.2.15.44120: Flags [P.], seq 110177:111551, ack 869, win 65535, length 1374
19:57:42.144552 IP 10.0.2.15.44120 > 151.101.117.164.443: Flags [.], ack 111551, win 65535, length 0
19:57:42.145976 IP 151.101.117.164.443 > 10.0.2.15.44120: Flags [P.], seq 111551:118421, ack 869, win 65535, length 6870
19:57:42.145978 IP 151.101.117.164.443 > 10.0.2.15.44120: Flags [P.], seq 118421:119795, ack 869, win 65535, length 1374
19:57:42.145998 IP 10.0.2.15.44120 > 151.101.117.164.443: Flags [.], ack 118421, win 65535, length 0
19:57:42.146218 IP 151.101.117.164.443 > 10.0.2.15.44120: Flags [P.], seq 119795:122543, ack 869, win 65535, length 2748
19:57:42.146229 IP 10.0.2.15.44120 > 151.101.117.164.443: Flags [.], ack 122543, win 65535, length 0
19:57:42.146363 IP 151.101.117.164.443 > 10.0.2.15.44120: Flags [P.], seq 122543:125291, ack 869, win 65535, length 2748
19:57:42.146364 IP 151.101.117.164.443 > 10.0.2.15.44120: Flags [P.], seq 125291:126665, ack 869, win 65535, length 1374
19:57:42.146375 IP 10.0.2.15.44120 > 151.101.117.164.443: Flags [.], ack 125291, win 65535, length 0
19:57:42.146511 IP 151.101.117.164.443 > 10.0.2.15.44120: Flags [P.], seq 126665:128039, ack 869, win 65535, length 1374
19:57:42.146517 IP 10.0.2.15.44120 > 151.101.117.164.443: Flags [.], ack 128039, win 65535, length 0
19:57:42.147722 IP 151.101.117.164.443 > 10.0.2.15.44120: Flags [P.], seq 128039:129413, ack 869, win 65535, length 1374
19:57:42.150313 IP 151.101.117.164.443 > 10.0.2.15.44120: Flags [P.], seq 129413:136283, ack 869, win 65535, length 6870
19:57:42.150315 IP 151.101.117.164.443 > 10.0.2.15.44120: Flags [P.], seq 136283:139031, ack 869, win 65535, length 2748
19:57:42.150316 IP 151.101.117.164.443 > 10.0.2.15.44120: Flags [P.], seq 139031:141779, ack 869, win 65535, length 2748
19:57:42.150376 IP 10.0.2.15.44120 > 151.101.117.164.443: Flags [.], ack 136283, win 65535, length 0
19:57:42.150416 IP 10.0.2.15.44120 > 151.101.117.164.443: Flags [.], ack 139031, win 65535, length 0
19:57:42.150427 IP 10.0.2.15.44120 > 151.101.117.164.443: Flags [.], ack 141779, win 65535, length 0
19:57:42.151276 IP 151.101.117.164.443 > 10.0.2.15.44120: Flags [P.], seq 141779:148649, ack 869, win 65535, length 6870
19:57:42.151298 IP 10.0.2.15.44120 > 151.101.117.164.443: Flags [.], ack 148649, win 65535, length 0
19:57:42.151749 IP 151.101.117.164.443 > 10.0.2.15.44120: Flags [P.], seq 148649:150023, ack 869, win 65535, length 1374
19:57:42.151752 IP 151.101.117.164.443 > 10.0.2.15.44120: Flags [P.], seq 150023:152771, ack 869, win 65535, length 2748
19:57:42.151753 IP 151.101.117.164.443 > 10.0.2.15.44120: Flags [P.], seq 152771:155519, ack 869, win 65535, length 2748
19:57:42.151754 IP 151.101.117.164.443 > 10.0.2.15.44120: Flags [P.], seq 155519:158267, ack 869, win 65535, length 2748
19:57:42.151776 IP 10.0.2.15.44120 > 151.101.117.164.443: Flags [.], ack 152771, win 65535, length 0
19:57:42.151798 IP 10.0.2.15.44120 > 151.101.117.164.443: Flags [.], ack 155519, win 65535, length 0
19:57:42.151812 IP 10.0.2.15.44120 > 151.101.117.164.443: Flags [.], ack 158267, win 65535, length 0
19:57:42.151951 IP 151.101.117.164.443 > 10.0.2.15.44120: Flags [P.], seq 158267:159641, ack 869, win 65535, length 1374
19:57:42.153331 IP 151.101.117.164.443 > 10.0.2.15.44120: Flags [P.], seq 159641:163763, ack 869, win 65535, length 4122
19:57:42.153334 IP 151.101.117.164.443 > 10.0.2.15.44120: Flags [P.], seq 163763:166511, ack 869, win 65535, length 2748
19:57:42.153356 IP 10.0.2.15.44120 > 151.101.117.164.443: Flags [.], ack 163763, win 65535, length 0
19:57:42.153545 IP 10.0.2.15.44120 > 151.101.117.164.443: Flags [.], ack 166511, win 65535, length 0
19:57:42.153727 IP 151.101.117.164.443 > 10.0.2.15.44120: Flags [P.], seq 166511:167885, ack 869, win 65535, length 1374
19:57:42.153729 IP 151.101.117.164.443 > 10.0.2.15.44120: Flags [P.], seq 167885:170633, ack 869, win 65535, length 2748
19:57:42.153744 IP 10.0.2.15.44120 > 151.101.117.164.443: Flags [.], ack 170633, win 65535, length 0
19:57:42.153853 IP 151.101.117.164.443 > 10.0.2.15.44120: Flags [P.], seq 170633:172007, ack 869, win 65535, length 1374
19:57:42.154568 IP 151.101.117.164.443 > 10.0.2.15.44120: Flags [P.], seq 172007:176129, ack 869, win 65535, length 4122
19:57:42.154570 IP 151.101.117.164.443 > 10.0.2.15.44120: Flags [P.], seq 176129:178877, ack 869, win 65535, length 2748
19:57:42.154637 IP 10.0.2.15.44120 > 151.101.117.164.443: Flags [.], ack 176129, win 65535, length 0
19:57:42.154751 IP 10.0.2.15.44120 > 151.101.117.164.443: Flags [.], ack 178877, win 65535, length 0
19:57:42.154950 IP 151.101.117.164.443 > 10.0.2.15.44120: Flags [P.], seq 178877:180251, ack 869, win 65535, length 1374
19:57:42.154952 IP 151.101.117.164.443 > 10.0.2.15.44120: Flags [P.], seq 180251:182999, ack 869, win 65535, length 2748
19:57:42.154953 IP 151.101.117.164.443 > 10.0.2.15.44120: Flags [P.], seq 182999:184373, ack 869, win 65535, length 1374
19:57:42.154968 IP 10.0.2.15.44120 > 151.101.117.164.443: Flags [.], ack 182999, win 65535, length 0
19:57:42.155096 IP 151.101.117.164.443 > 10.0.2.15.44120: Flags [.], seq 184373:185833, ack 869, win 65535, length 1460
19:57:42.155104 IP 10.0.2.15.44120 > 151.101.117.164.443: Flags [.], ack 185833, win 65535, length 0
19:57:42.155270 IP 151.101.117.164.443 > 10.0.2.15.44120: Flags [P.], seq 185833:187121, ack 869, win 65535, length 1288
19:57:42.156652 IP 151.101.117.164.443 > 10.0.2.15.44120: Flags [P.], seq 187121:191243, ack 869, win 65535, length 4122
19:57:42.156655 IP 151.101.117.164.443 > 10.0.2.15.44120: Flags [P.], seq 191243:193991, ack 869, win 65535, length 2748
19:57:42.156655 IP 151.101.117.164.443 > 10.0.2.15.44120: Flags [P.], seq 193991:195365, ack 869, win 65535, length 1374
19:57:42.156676 IP 10.0.2.15.44120 > 151.101.117.164.443: Flags [.], ack 191243, win 65535, length 0
19:57:42.156706 IP 10.0.2.15.44120 > 151.101.117.164.443: Flags [.], ack 193991, win 65535, length 0
19:57:42.157188 IP 151.101.117.164.443 > 10.0.2.15.44120: Flags [P.], seq 195365:198113, ack 869, win 65535, length 2748
19:57:42.157191 IP 151.101.117.164.443 > 10.0.2.15.44120: Flags [P.], seq 198113:203609, ack 869, win 65535, length 5496
19:57:42.157191 IP 151.101.117.164.443 > 10.0.2.15.44120: Flags [P.], seq 203609:204983, ack 869, win 65535, length 1374
19:57:42.157210 IP 10.0.2.15.44120 > 151.101.117.164.443: Flags [.], ack 198113, win 65535, length 0
19:57:42.157240 IP 10.0.2.15.44120 > 151.101.117.164.443: Flags [.], ack 203609, win 65535, length 0
19:57:42.157394 IP 151.101.117.164.443 > 10.0.2.15.44120: Flags [P.], seq 204983:207731, ack 869, win 65535, length 2748
19:57:42.157401 IP 10.0.2.15.44120 > 151.101.117.164.443: Flags [.], ack 207731, win 65535, length 0
19:57:42.157654 IP 151.101.117.164.443 > 10.0.2.15.44120: Flags [P.], seq 207731:210479, ack 869, win 65535, length 2748
19:57:42.157667 IP 10.0.2.15.44120 > 151.101.117.164.443: Flags [.], ack 210479, win 65535, length 0
19:57:42.158948 IP 151.101.117.164.443 > 10.0.2.15.44120: Flags [P.], seq 210479:214601, ack 869, win 65535, length 4122
19:57:42.158969 IP 10.0.2.15.44120 > 151.101.117.164.443: Flags [.], ack 214601, win 65535, length 0
19:57:42.159392 IP 151.101.117.164.443 > 10.0.2.15.44120: Flags [P.], seq 214601:217349, ack 869, win 65535, length 2748
19:57:42.159394 IP 151.101.117.164.443 > 10.0.2.15.44120: Flags [P.], seq 217349:218723, ack 869, win 65535, length 1374
19:57:42.159395 IP 151.101.117.164.443 > 10.0.2.15.44120: Flags [P.], seq 218723:221471, ack 869, win 65535, length 2748
19:57:42.159415 IP 10.0.2.15.44120 > 151.101.117.164.443: Flags [.], ack 217349, win 65535, length 0
19:57:42.159451 IP 10.0.2.15.44120 > 151.101.117.164.443: Flags [.], ack 221471, win 65535, length 0
19:57:42.159594 IP 151.101.117.164.443 > 10.0.2.15.44120: Flags [P.], seq 221471:226967, ack 869, win 65535, length 5496
19:57:42.159603 IP 10.0.2.15.44120 > 151.101.117.164.443: Flags [.], ack 226967, win 65535, length 0
19:57:42.159696 IP 151.101.117.164.443 > 10.0.2.15.44120: Flags [P.], seq 226967:229715, ack 869, win 65535, length 2748
19:57:42.159703 IP 10.0.2.15.44120 > 151.101.117.164.443: Flags [.], ack 229715, win 65535, length 0
19:57:42.159915 IP 151.101.117.164.443 > 10.0.2.15.44120: Flags [P.], seq 229715:232463, ack 869, win 65535, length 2748
19:57:42.159917 IP 151.101.117.164.443 > 10.0.2.15.44120: Flags [P.], seq 232463:233837, ack 869, win 65535, length 1374
19:57:42.159932 IP 10.0.2.15.44120 > 151.101.117.164.443: Flags [.], ack 232463, win 65535, length 0
19:57:42.161000 IP 151.101.117.164.443 > 10.0.2.15.44120: Flags [P.], seq 233837:237959, ack 869, win 65535, length 4122
19:57:42.161002 IP 151.101.117.164.443 > 10.0.2.15.44120: Flags [P.], seq 237959:239333, ack 869, win 65535, length 1374
19:57:42.161028 IP 10.0.2.15.44120 > 151.101.117.164.443: Flags [.], ack 237959, win 65535, length 0
19:57:42.161668 IP 151.101.117.164.443 > 10.0.2.15.44120: Flags [P.], seq 239333:243455, ack 869, win 65535, length 4122
19:57:42.161670 IP 151.101.117.164.443 > 10.0.2.15.44120: Flags [.], seq 243455:244915, ack 869, win 65535, length 1460
19:57:42.161691 IP 10.0.2.15.44120 > 151.101.117.164.443: Flags [.], ack 243455, win 65535, length 0
19:57:42.162017 IP 151.101.117.164.443 > 10.0.2.15.44120: Flags [P.], seq 244915:246203, ack 869, win 65535, length 1288
19:57:42.162019 IP 151.101.117.164.443 > 10.0.2.15.44120: Flags [P.], seq 246203:247577, ack 869, win 65535, length 1374
19:57:42.162028 IP 151.101.117.164.443 > 10.0.2.15.44120: Flags [P.], seq 247577:250325, ack 869, win 65535, length 2748
19:57:42.162044 IP 10.0.2.15.44120 > 151.101.117.164.443: Flags [.], ack 246203, win 65535, length 0
19:57:42.162069 IP 10.0.2.15.44120 > 151.101.117.164.443: Flags [.], ack 250325, win 65535, length 0
19:57:42.162699 IP 151.101.117.164.443 > 10.0.2.15.44120: Flags [P.], seq 250325:254447, ack 869, win 65535, length 4122
19:57:42.162702 IP 151.101.117.164.443 > 10.0.2.15.44120: Flags [P.], seq 254447:257195, ack 869, win 65535, length 2748
19:57:42.162703 IP 151.101.117.164.443 > 10.0.2.15.44120: Flags [P.], seq 257195:261317, ack 869, win 65535, length 4122
19:57:42.162724 IP 10.0.2.15.44120 > 151.101.117.164.443: Flags [.], ack 254447, win 65535, length 0
19:57:42.162755 IP 10.0.2.15.44120 > 151.101.117.164.443: Flags [.], ack 257195, win 65535, length 0
19:57:42.162770 IP 10.0.2.15.44120 > 151.101.117.164.443: Flags [.], ack 261317, win 65535, length 0
19:57:42.162790 IP 151.101.117.164.443 > 10.0.2.15.44120: Flags [P.], seq 261317:264065, ack 869, win 65535, length 2748
19:57:42.162795 IP 10.0.2.15.44120 > 151.101.117.164.443: Flags [.], ack 264065, win 65535, length 0
19:57:42.163802 IP 151.101.117.164.443 > 10.0.2.15.44120: Flags [P.], seq 264065:269561, ack 869, win 65535, length 5496
19:57:42.163805 IP 151.101.117.164.443 > 10.0.2.15.44120: Flags [P.], seq 269561:272309, ack 869, win 65535, length 2748
19:57:42.163872 IP 10.0.2.15.44120 > 151.101.117.164.443: Flags [.], ack 269561, win 65535, length 0
19:57:42.164002 IP 10.0.2.15.44120 > 151.101.117.164.443: Flags [.], ack 272309, win 65535, length 0
19:57:42.164172 IP 151.101.117.164.443 > 10.0.2.15.44120: Flags [P.], seq 272309:275057, ack 869, win 65535, length 2748
19:57:42.164219 IP 151.101.117.164.443 > 10.0.2.15.44120: Flags [P.], seq 275057:277805, ack 869, win 65535, length 2748
19:57:42.164236 IP 10.0.2.15.44120 > 151.101.117.164.443: Flags [.], ack 275057, win 65535, length 0
19:57:42.164326 IP 10.0.2.15.44120 > 151.101.117.164.443: Flags [.], ack 277805, win 65535, length 0
19:57:42.164692 IP 151.101.117.164.443 > 10.0.2.15.44120: Flags [P.], seq 277805:280553, ack 869, win 65535, length 2748
19:57:42.164694 IP 151.101.117.164.443 > 10.0.2.15.44120: Flags [P.], seq 280553:284675, ack 869, win 65535, length 4122
19:57:42.164694 IP 151.101.117.164.443 > 10.0.2.15.44120: Flags [P.], seq 284675:286049, ack 869, win 65535, length 1374
19:57:42.164714 IP 10.0.2.15.44120 > 151.101.117.164.443: Flags [.], ack 280553, win 65535, length 0
19:57:42.164735 IP 10.0.2.15.44120 > 151.101.117.164.443: Flags [.], ack 284675, win 65535, length 0
19:57:42.165508 IP 151.101.117.164.443 > 10.0.2.15.44120: Flags [P.], seq 286049:292919, ack 869, win 65535, length 6870
19:57:42.165649 IP 10.0.2.15.44120 > 151.101.117.164.443: Flags [.], ack 292919, win 65535, length 0
19:57:42.166230 IP 151.101.117.164.443 > 10.0.2.15.44120: Flags [P.], seq 292919:297041, ack 869, win 65535, length 4122
19:57:42.166232 IP 151.101.117.164.443 > 10.0.2.15.44120: Flags [P.], seq 297041:298415, ack 869, win 65535, length 1374
19:57:42.166234 IP 151.101.117.164.443 > 10.0.2.15.44120: Flags [P.], seq 298415:305285, ack 869, win 65535, length 6870
19:57:42.166252 IP 10.0.2.15.44120 > 151.101.117.164.443: Flags [.], ack 297041, win 65535, length 0
19:57:42.166281 IP 10.0.2.15.44120 > 151.101.117.164.443: Flags [.], ack 305285, win 65535, length 0
19:57:42.166302 IP 151.101.117.164.443 > 10.0.2.15.44120: Flags [P.], seq 305285:310781, ack 869, win 65535, length 5496
19:57:42.166308 IP 10.0.2.15.44120 > 151.101.117.164.443: Flags [.], ack 310781, win 65535, length 0
19:57:42.167589 IP 151.101.117.164.443 > 10.0.2.15.44120: Flags [P.], seq 310781:316277, ack 869, win 65535, length 5496
19:57:42.167592 IP 151.101.117.164.443 > 10.0.2.15.44120: Flags [P.], seq 316277:319025, ack 869, win 65535, length 2748
19:57:42.167593 IP 151.101.117.164.443 > 10.0.2.15.44120: Flags [P.], seq 319025:321773, ack 869, win 65535, length 2748
19:57:42.167623 IP 10.0.2.15.44120 > 151.101.117.164.443: Flags [.], ack 316277, win 65535, length 0
19:57:42.167646 IP 10.0.2.15.44120 > 151.101.117.164.443: Flags [.], ack 319025, win 65535, length 0
19:57:42.167662 IP 10.0.2.15.44120 > 151.101.117.164.443: Flags [.], ack 321773, win 65535, length 0
19:57:42.167686 IP 151.101.117.164.443 > 10.0.2.15.44120: Flags [P.], seq 321773:325895, ack 869, win 65535, length 4122
19:57:42.167691 IP 10.0.2.15.44120 > 151.101.117.164.443: Flags [.], ack 325895, win 65535, length 0
19:57:42.168003 IP 151.101.117.164.443 > 10.0.2.15.44120: Flags [P.], seq 325895:328643, ack 869, win 65535, length 2748
19:57:42.168015 IP 10.0.2.15.44120 > 151.101.117.164.443: Flags [.], ack 328643, win 65535, length 0
19:57:42.168755 IP 151.101.117.164.443 > 10.0.2.15.44120: Flags [P.], seq 328643:331391, ack 869, win 65535, length 2748
19:57:42.168757 IP 151.101.117.164.443 > 10.0.2.15.44120: Flags [P.], seq 331391:335513, ack 869, win 65535, length 4122
19:57:42.168758 IP 151.101.117.164.443 > 10.0.2.15.44120: Flags [P.], seq 335513:338261, ack 869, win 65535, length 2748
19:57:42.168759 IP 151.101.117.164.443 > 10.0.2.15.44120: Flags [P.], seq 338261:341009, ack 869, win 65535, length 2748
19:57:42.168880 IP 10.0.2.15.44120 > 151.101.117.164.443: Flags [.], ack 331391, win 65535, length 0
19:57:42.168906 IP 10.0.2.15.44120 > 151.101.117.164.443: Flags [.], ack 335513, win 65535, length 0
19:57:42.168919 IP 10.0.2.15.44120 > 151.101.117.164.443: Flags [.], ack 338261, win 65535, length 0
19:57:42.168930 IP 10.0.2.15.44120 > 151.101.117.164.443: Flags [.], ack 341009, win 65535, length 0
19:57:42.169501 IP 151.101.117.164.443 > 10.0.2.15.44120: Flags [P.], seq 341009:346505, ack 869, win 65535, length 5496
19:57:42.169503 IP 151.101.117.164.443 > 10.0.2.15.44120: Flags [P.], seq 346505:347879, ack 869, win 65535, length 1374
19:57:42.169558 IP 10.0.2.15.44120 > 151.101.117.164.443: Flags [.], ack 346505, win 65535, length 0
19:57:42.169802 IP 151.101.117.164.443 > 10.0.2.15.44120: Flags [P.], seq 347879:350627, ack 869, win 65535, length 2748
19:57:42.169861 IP 10.0.2.15.44120 > 151.101.117.164.443: Flags [.], ack 350627, win 65535, length 0
19:57:42.169968 IP 151.101.117.164.443 > 10.0.2.15.44120: Flags [P.], seq 350627:353375, ack 869, win 65535, length 2748
19:57:42.169977 IP 10.0.2.15.44120 > 151.101.117.164.443: Flags [.], ack 353375, win 65535, length 0
19:57:42.170117 IP 151.101.117.164.443 > 10.0.2.15.44120: Flags [P.], seq 353375:354749, ack 869, win 65535, length 1374
19:57:42.170446 IP 151.101.117.164.443 > 10.0.2.15.44120: Flags [P.], seq 354749:357497, ack 869, win 65535, length 2748
19:57:42.170447 IP 151.101.117.164.443 > 10.0.2.15.44120: Flags [P.], seq 357497:360245, ack 869, win 65535, length 2748
19:57:42.170448 IP 151.101.117.164.443 > 10.0.2.15.44120: Flags [P.], seq 360245:361619, ack 869, win 65535, length 1374
19:57:42.170467 IP 10.0.2.15.44120 > 151.101.117.164.443: Flags [.], ack 357497, win 65535, length 0
19:57:42.170489 IP 10.0.2.15.44120 > 151.101.117.164.443: Flags [.], ack 360245, win 65535, length 0
19:57:42.170671 IP 151.101.117.164.443 > 10.0.2.15.44120: Flags [P.], seq 361619:364367, ack 869, win 65535, length 2748
19:57:42.170672 IP 151.101.117.164.443 > 10.0.2.15.44120: Flags [P.], seq 364367:365741, ack 869, win 65535, length 1374
19:57:42.170683 IP 10.0.2.15.44120 > 151.101.117.164.443: Flags [.], ack 364367, win 65535, length 0
19:57:42.171655 IP 151.101.117.164.443 > 10.0.2.15.44120: Flags [P.], seq 365741:369863, ack 869, win 65535, length 4122
19:57:42.171657 IP 151.101.117.164.443 > 10.0.2.15.44120: Flags [P.], seq 369863:372611, ack 869, win 65535, length 2748
19:57:42.171679 IP 10.0.2.15.44120 > 151.101.117.164.443: Flags [.], ack 369863, win 65535, length 0
19:57:42.171829 IP 10.0.2.15.44120 > 151.101.117.164.443: Flags [.], ack 372611, win 65535, length 0
19:57:42.172046 IP 151.101.117.164.443 > 10.0.2.15.44120: Flags [P.], seq 372611:373985, ack 869, win 65535, length 1374
19:57:42.172049 IP 151.101.117.164.443 > 10.0.2.15.44120: Flags [P.], seq 373985:378107, ack 869, win 65535, length 4122
19:57:42.172063 IP 10.0.2.15.44120 > 151.101.117.164.443: Flags [.], ack 378107, win 65535, length 0
19:57:42.173086 IP 151.101.117.164.443 > 10.0.2.15.44120: Flags [P.], seq 378107:380855, ack 869, win 65535, length 2748
19:57:42.173089 IP 151.101.117.164.443 > 10.0.2.15.44120: Flags [P.], seq 380855:384977, ack 869, win 65535, length 4122
19:57:42.173091 IP 151.101.117.164.443 > 10.0.2.15.44120: Flags [P.], seq 384977:390473, ack 869, win 65535, length 5496
19:57:42.173113 IP 10.0.2.15.44120 > 151.101.117.164.443: Flags [.], ack 380855, win 65535, length 0
19:57:42.173138 IP 10.0.2.15.44120 > 151.101.117.164.443: Flags [.], ack 384977, win 65535, length 0
19:57:42.173149 IP 10.0.2.15.44120 > 151.101.117.164.443: Flags [.], ack 390473, win 65535, length 0
19:57:42.173176 IP 151.101.117.164.443 > 10.0.2.15.44120: Flags [P.], seq 390473:393221, ack 869, win 65535, length 2748
19:57:42.173178 IP 151.101.117.164.443 > 10.0.2.15.44120: Flags [P.], seq 393221:395969, ack 869, win 65535, length 2748
19:57:42.173185 IP 10.0.2.15.44120 > 151.101.117.164.443: Flags [.], ack 393221, win 65535, length 0
19:57:42.173200 IP 10.0.2.15.44120 > 151.101.117.164.443: Flags [.], ack 395969, win 65535, length 0
19:57:42.173988 IP 151.101.117.164.443 > 10.0.2.15.44120: Flags [P.], seq 395969:402839, ack 869, win 65535, length 6870
19:57:42.173990 IP 151.101.117.164.443 > 10.0.2.15.44120: Flags [P.], seq 402839:404213, ack 869, win 65535, length 1374
19:57:42.174008 IP 10.0.2.15.44120 > 151.101.117.164.443: Flags [.], ack 402839, win 65535, length 0
19:57:42.174230 IP 151.101.117.164.443 > 10.0.2.15.44120: Flags [P.], seq 404213:406961, ack 869, win 65535, length 2748
19:57:42.174335 IP 10.0.2.15.44120 > 151.101.117.164.443: Flags [.], ack 406961, win 65535, length 0
19:57:42.174642 IP 151.101.117.164.443 > 10.0.2.15.44120: Flags [P.], seq 406961:409709, ack 869, win 65535, length 2748
19:57:42.174644 IP 151.101.117.164.443 > 10.0.2.15.44120: Flags [P.], seq 409709:411083, ack 869, win 65535, length 1374
19:57:42.174745 IP 151.101.117.164.443 > 10.0.2.15.44120: Flags [P.], seq 411083:415205, ack 869, win 65535, length 4122
19:57:42.174761 IP 10.0.2.15.44120 > 151.101.117.164.443: Flags [.], ack 409709, win 65535, length 0
19:57:42.174787 IP 10.0.2.15.44120 > 151.101.117.164.443: Flags [.], ack 415205, win 65535, length 0
19:57:42.175032 IP 151.101.117.164.443 > 10.0.2.15.44120: Flags [P.], seq 415205:417953, ack 869, win 65535, length 2748
19:57:42.175033 IP 151.101.117.164.443 > 10.0.2.15.44120: Flags [P.], seq 417953:419327, ack 869, win 65535, length 1374
19:57:42.175034 IP 151.101.117.164.443 > 10.0.2.15.44120: Flags [P.], seq 419327:422075, ack 869, win 65535, length 2748
19:57:42.175044 IP 10.0.2.15.44120 > 151.101.117.164.443: Flags [.], ack 417953, win 65535, length 0
19:57:42.175124 IP 10.0.2.15.44120 > 151.101.117.164.443: Flags [.], ack 422075, win 65535, length 0
19:57:42.175733 IP 151.101.117.164.443 > 10.0.2.15.44120: Flags [P.], seq 422075:424823, ack 869, win 65535, length 2748
19:57:42.175735 IP 151.101.117.164.443 > 10.0.2.15.44120: Flags [P.], seq 424823:426197, ack 869, win 65535, length 1374
19:57:42.175736 IP 151.101.117.164.443 > 10.0.2.15.44120: Flags [.], seq 426197:427657, ack 869, win 65535, length 1460
19:57:42.175748 IP 10.0.2.15.44120 > 151.101.117.164.443: Flags [.], ack 424823, win 65535, length 0
19:57:42.175769 IP 10.0.2.15.44120 > 151.101.117.164.443: Flags [.], ack 427657, win 65535, length 0
19:57:42.176026 IP 151.101.117.164.443 > 10.0.2.15.44120: Flags [P.], seq 427657:431693, ack 869, win 65535, length 4036
19:57:42.176116 IP 10.0.2.15.44120 > 151.101.117.164.443: Flags [.], ack 431693, win 65535, length 0
19:57:42.176454 IP 151.101.117.164.443 > 10.0.2.15.44120: Flags [P.], seq 431693:437189, ack 869, win 65535, length 5496
19:57:42.176457 IP 151.101.117.164.443 > 10.0.2.15.44120: Flags [P.], seq 437189:441311, ack 869, win 65535, length 4122
19:57:42.176457 IP 151.101.117.164.443 > 10.0.2.15.44120: Flags [P.], seq 441311:442685, ack 869, win 65535, length 1374
19:57:42.176472 IP 10.0.2.15.44120 > 151.101.117.164.443: Flags [.], ack 437189, win 65535, length 0
19:57:42.176522 IP 10.0.2.15.44120 > 151.101.117.164.443: Flags [.], ack 441311, win 65535, length 0
19:57:42.176668 IP 151.101.117.164.443 > 10.0.2.15.44120: Flags [P.], seq 442685:445433, ack 869, win 65535, length 2748
19:57:42.176673 IP 10.0.2.15.44120 > 151.101.117.164.443: Flags [.], ack 445433, win 65535, length 0
19:57:42.176903 IP 151.101.117.164.443 > 10.0.2.15.44120: Flags [P.], seq 445433:448181, ack 869, win 65535, length 2748
19:57:42.176905 IP 151.101.117.164.443 > 10.0.2.15.44120: Flags [P.], seq 448181:449555, ack 869, win 65535, length 1374
19:57:42.176918 IP 10.0.2.15.44120 > 151.101.117.164.443: Flags [.], ack 448181, win 65535, length 0
19:57:42.177347 IP 151.101.117.164.443 > 10.0.2.15.44120: Flags [P.], seq 449555:453677, ack 869, win 65535, length 4122
19:57:42.177355 IP 10.0.2.15.44120 > 151.101.117.164.443: Flags [.], ack 453677, win 65535, length 0
19:57:42.177459 IP 151.101.117.164.443 > 10.0.2.15.44120: Flags [P.], seq 453677:456425, ack 869, win 65535, length 2748
19:57:42.177516 IP 10.0.2.15.44120 > 151.101.117.164.443: Flags [.], ack 456425, win 65535, length 0
19:57:42.178588 IP 151.101.117.164.443 > 10.0.2.15.44120: Flags [P.], seq 456425:463295, ack 869, win 65535, length 6870
19:57:42.178590 IP 151.101.117.164.443 > 10.0.2.15.44120: Flags [P.], seq 463295:466043, ack 869, win 65535, length 2748
19:57:42.178590 IP 151.101.117.164.443 > 10.0.2.15.44120: Flags [P.], seq 466043:468791, ack 869, win 65535, length 2748
19:57:42.178652 IP 10.0.2.15.44120 > 151.101.117.164.443: Flags [.], ack 463295, win 65535, length 0
19:57:42.178773 IP 10.0.2.15.44120 > 151.101.117.164.443: Flags [.], ack 466043, win 65535, length 0
19:57:42.178793 IP 10.0.2.15.44120 > 151.101.117.164.443: Flags [.], ack 468791, win 65535, length 0
19:57:42.178863 IP 151.101.117.164.443 > 10.0.2.15.44120: Flags [P.], seq 468791:474287, ack 869, win 65535, length 5496
19:57:42.178873 IP 10.0.2.15.44120 > 151.101.117.164.443: Flags [.], ack 474287, win 65535, length 0
19:57:42.179191 IP 151.101.117.164.443 > 10.0.2.15.44120: Flags [P.], seq 474287:475661, ack 869, win 65535, length 1374
19:57:42.179244 IP 151.101.117.164.443 > 10.0.2.15.44120: Flags [P.], seq 475661:478409, ack 869, win 65535, length 2748
19:57:42.179257 IP 10.0.2.15.44120 > 151.101.117.164.443: Flags [.], ack 478409, win 65535, length 0
19:57:42.179491 IP 151.101.117.164.443 > 10.0.2.15.44120: Flags [P.], seq 478409:482531, ack 869, win 65535, length 4122
19:57:42.179594 IP 10.0.2.15.44120 > 151.101.117.164.443: Flags [.], ack 482531, win 65535, length 0
19:57:42.179687 IP 151.101.117.164.443 > 10.0.2.15.44120: Flags [P.], seq 482531:486653, ack 869, win 65535, length 4122
19:57:42.179693 IP 10.0.2.15.44120 > 151.101.117.164.443: Flags [.], ack 486653, win 65535, length 0
19:57:42.180575 IP 151.101.117.164.443 > 10.0.2.15.44120: Flags [P.], seq 486653:489401, ack 869, win 65535, length 2748
19:57:42.180590 IP 10.0.2.15.44120 > 151.101.117.164.443: Flags [.], ack 489401, win 65535, length 0
19:57:42.180956 IP 151.101.117.164.443 > 10.0.2.15.44120: Flags [P.], seq 489401:494897, ack 869, win 65535, length 5496
19:57:42.180958 IP 151.101.117.164.443 > 10.0.2.15.44120: Flags [P.], seq 494897:496271, ack 869, win 65535, length 1374
19:57:42.180959 IP 151.101.117.164.443 > 10.0.2.15.44120: Flags [P.], seq 496271:499019, ack 869, win 65535, length 2748
19:57:42.181017 IP 10.0.2.15.44120 > 151.101.117.164.443: Flags [.], ack 494897, win 65535, length 0
19:57:42.181042 IP 10.0.2.15.44120 > 151.101.117.164.443: Flags [.], ack 499019, win 65535, length 0
19:57:42.181251 IP 151.101.117.164.443 > 10.0.2.15.44120: Flags [P.], seq 499019:501767, ack 869, win 65535, length 2748
19:57:42.181253 IP 151.101.117.164.443 > 10.0.2.15.44120: Flags [P.], seq 501767:503141, ack 869, win 65535, length 1374
19:57:42.181261 IP 10.0.2.15.44120 > 151.101.117.164.443: Flags [.], ack 501767, win 65535, length 0
19:57:42.185032 IP 151.101.117.164.443 > 10.0.2.15.44120: Flags [P.], seq 503141:511385, ack 869, win 65535, length 8244
19:57:42.185035 IP 151.101.117.164.443 > 10.0.2.15.44120: Flags [P.], seq 511385:516881, ack 869, win 65535, length 5496
19:57:42.185064 IP 10.0.2.15.44120 > 151.101.117.164.443: Flags [.], ack 511385, win 65535, length 0
19:57:42.185333 IP 10.0.2.15.44120 > 151.101.117.164.443: Flags [.], ack 516881, win 65535, length 0
19:57:42.185378 IP 151.101.117.164.443 > 10.0.2.15.44120: Flags [P.], seq 516881:521003, ack 869, win 65535, length 4122
19:57:42.185379 IP 151.101.117.164.443 > 10.0.2.15.44120: Flags [P.], seq 521003:523751, ack 869, win 65535, length 2748
19:57:42.185389 IP 10.0.2.15.44120 > 151.101.117.164.443: Flags [.], ack 521003, win 65535, length 0
19:57:42.185401 IP 10.0.2.15.44120 > 151.101.117.164.443: Flags [.], ack 523751, win 65535, length 0
19:57:42.185708 IP 151.101.117.164.443 > 10.0.2.15.44120: Flags [P.], seq 523751:527873, ack 869, win 65535, length 4122
19:57:42.185710 IP 151.101.117.164.443 > 10.0.2.15.44120: Flags [P.], seq 527873:531995, ack 869, win 65535, length 4122
19:57:42.185721 IP 10.0.2.15.44120 > 151.101.117.164.443: Flags [.], ack 527873, win 65535, length 0
19:57:42.185769 IP 10.0.2.15.44120 > 151.101.117.164.443: Flags [.], ack 531995, win 65535, length 0
19:57:42.185898 IP 151.101.117.164.443 > 10.0.2.15.44120: Flags [P.], seq 531995:533369, ack 869, win 65535, length 1374
19:57:42.186194 IP 151.101.117.164.443 > 10.0.2.15.44120: Flags [P.], seq 533369:536117, ack 869, win 65535, length 2748
19:57:42.186196 IP 151.101.117.164.443 > 10.0.2.15.44120: Flags [P.], seq 536117:538865, ack 869, win 65535, length 2748
19:57:42.186196 IP 151.101.117.164.443 > 10.0.2.15.44120: Flags [P.], seq 538865:540239, ack 869, win 65535, length 1374
19:57:42.186263 IP 10.0.2.15.44120 > 151.101.117.164.443: Flags [.], ack 540239, win 65535, length 0
19:57:42.186428 IP 151.101.117.164.443 > 10.0.2.15.44120: Flags [P.], seq 540239:542987, ack 869, win 65535, length 2748
19:57:42.186438 IP 10.0.2.15.44120 > 151.101.117.164.443: Flags [.], ack 542987, win 65535, length 0
19:57:42.186597 IP 151.101.117.164.443 > 10.0.2.15.44120: Flags [P.], seq 542987:545735, ack 869, win 65535, length 2748
19:57:42.186607 IP 10.0.2.15.44120 > 151.101.117.164.443: Flags [.], ack 545735, win 65535, length 0
19:57:42.187035 IP 151.101.117.164.443 > 10.0.2.15.44120: Flags [P.], seq 545735:547109, ack 869, win 65535, length 1374
19:57:42.187037 IP 151.101.117.164.443 > 10.0.2.15.44120: Flags [P.], seq 547109:549857, ack 869, win 65535, length 2748
19:57:42.187052 IP 10.0.2.15.44120 > 151.101.117.164.443: Flags [.], ack 549857, win 65535, length 0
19:57:42.187236 IP 151.101.117.164.443 > 10.0.2.15.44120: Flags [P.], seq 549857:553979, ack 869, win 65535, length 4122
19:57:42.187237 IP 151.101.117.164.443 > 10.0.2.15.44120: Flags [.], seq 553979:555439, ack 869, win 65535, length 1460
19:57:42.187273 IP 10.0.2.15.44120 > 151.101.117.164.443: Flags [.], ack 553979, win 65535, length 0
19:57:42.187361 IP 151.101.117.164.443 > 10.0.2.15.44120: Flags [P.], seq 555439:558101, ack 869, win 65535, length 2662
19:57:42.187366 IP 10.0.2.15.44120 > 151.101.117.164.443: Flags [.], ack 558101, win 65535, length 0
19:57:42.187703 IP 151.101.117.164.443 > 10.0.2.15.44120: Flags [P.], seq 558101:560849, ack 869, win 65535, length 2748
19:57:42.187713 IP 10.0.2.15.44120 > 151.101.117.164.443: Flags [.], ack 560849, win 65535, length 0
19:57:42.187831 IP 151.101.117.164.443 > 10.0.2.15.44120: Flags [P.], seq 560849:563597, ack 869, win 65535, length 2748
19:57:42.187836 IP 10.0.2.15.44120 > 151.101.117.164.443: Flags [.], ack 563597, win 65535, length 0
19:57:42.188444 IP 151.101.117.164.443 > 10.0.2.15.44120: Flags [P.], seq 563597:566345, ack 869, win 65535, length 2748
19:57:42.188455 IP 10.0.2.15.44120 > 151.101.117.164.443: Flags [.], ack 566345, win 65535, length 0
19:57:42.188891 IP 151.101.117.164.443 > 10.0.2.15.44120: Flags [P.], seq 566345:570467, ack 869, win 65535, length 4122
19:57:42.188892 IP 151.101.117.164.443 > 10.0.2.15.44120: Flags [P.], seq 570467:571841, ack 869, win 65535, length 1374
19:57:42.188893 IP 151.101.117.164.443 > 10.0.2.15.44120: Flags [P.], seq 571841:573215, ack 869, win 65535, length 1374
19:57:42.188894 IP 151.101.117.164.443 > 10.0.2.15.44120: Flags [P.], seq 573215:578711, ack 869, win 65535, length 5496
19:57:42.188909 IP 10.0.2.15.44120 > 151.101.117.164.443: Flags [.], ack 570467, win 65535, length 0
19:57:42.188933 IP 10.0.2.15.44120 > 151.101.117.164.443: Flags [.], ack 573215, win 65535, length 0
19:57:42.188947 IP 10.0.2.15.44120 > 151.101.117.164.443: Flags [.], ack 578711, win 65535, length 0
19:57:42.189120 IP 151.101.117.164.443 > 10.0.2.15.44120: Flags [P.], seq 578711:580085, ack 869, win 65535, length 1374
19:57:42.189372 IP 151.101.117.164.443 > 10.0.2.15.44120: Flags [P.], seq 580085:584207, ack 869, win 65535, length 4122
19:57:42.189382 IP 10.0.2.15.44120 > 151.101.117.164.443: Flags [.], ack 584207, win 65535, length 0
19:57:42.189790 IP 151.101.117.164.443 > 10.0.2.15.44120: Flags [P.], seq 584207:589703, ack 869, win 65535, length 5496
19:57:42.189819 IP 10.0.2.15.44120 > 151.101.117.164.443: Flags [.], ack 589703, win 65535, length 0
19:57:42.189940 IP 151.101.117.164.443 > 10.0.2.15.44120: Flags [P.], seq 589703:591077, ack 869, win 65535, length 1374
19:57:42.189941 IP 151.101.117.164.443 > 10.0.2.15.44120: Flags [P.], seq 591077:595199, ack 869, win 65535, length 4122
19:57:42.189963 IP 10.0.2.15.44120 > 151.101.117.164.443: Flags [.], ack 595199, win 65535, length 0
19:57:42.190055 IP 151.101.117.164.443 > 10.0.2.15.44120: Flags [P.], seq 595199:596573, ack 869, win 65535, length 1374
19:57:42.191710 IP 151.101.117.164.443 > 10.0.2.15.44120: Flags [P.], seq 596573:604817, ack 869, win 65535, length 8244
19:57:42.191713 IP 151.101.117.164.443 > 10.0.2.15.44120: Flags [P.], seq 604817:608939, ack 869, win 65535, length 4122
19:57:42.191736 IP 10.0.2.15.44120 > 151.101.117.164.443: Flags [.], ack 604817, win 65535, length 0
19:57:42.191857 IP 10.0.2.15.44120 > 151.101.117.164.443: Flags [.], ack 608939, win 65535, length 0
19:57:42.192429 IP 151.101.117.164.443 > 10.0.2.15.44120: Flags [P.], seq 608939:613061, ack 869, win 65535, length 4122
19:57:42.192432 IP 151.101.117.164.443 > 10.0.2.15.44120: Flags [P.], seq 613061:618557, ack 869, win 65535, length 5496
19:57:42.192432 IP 151.101.117.164.443 > 10.0.2.15.44120: Flags [P.], seq 618557:619931, ack 869, win 65535, length 1374
19:57:42.192445 IP 10.0.2.15.44120 > 151.101.117.164.443: Flags [.], ack 613061, win 65535, length 0
19:57:42.192487 IP 151.101.117.164.443 > 10.0.2.15.44120: Flags [P.], seq 619931:622679, ack 869, win 65535, length 2748
19:57:42.192635 IP 151.101.117.164.443 > 10.0.2.15.44120: Flags [P.], seq 622679:625427, ack 869, win 65535, length 2748
19:57:42.192741 IP 10.0.2.15.44120 > 151.101.117.164.443: Flags [.], ack 625427, win 65535, length 0
19:57:42.192757 IP 151.101.117.164.443 > 10.0.2.15.44120: Flags [P.], seq 625427:626801, ack 869, win 65535, length 1374
19:57:42.192897 IP 151.101.117.164.443 > 10.0.2.15.44120: Flags [P.], seq 626801:629549, ack 869, win 65535, length 2748
19:57:42.193114 IP 151.101.117.164.443 > 10.0.2.15.44120: Flags [P.], seq 629549:632297, ack 869, win 65535, length 2748
19:57:42.193303 IP 151.101.117.164.443 > 10.0.2.15.44120: Flags [P.], seq 632297:633671, ack 869, win 65535, length 1374
19:57:42.193340 IP 10.0.2.15.44120 > 151.101.117.164.443: Flags [.], ack 633671, win 65535, length 0
19:57:42.193665 IP 151.101.117.164.443 > 10.0.2.15.44120: Flags [P.], seq 633671:636419, ack 869, win 65535, length 2748
19:57:42.193666 IP 151.101.117.164.443 > 10.0.2.15.44120: Flags [P.], seq 636419:639167, ack 869, win 65535, length 2748
19:57:42.193667 IP 151.101.117.164.443 > 10.0.2.15.44120: Flags [P.], seq 639167:643289, ack 869, win 65535, length 4122
19:57:42.193707 IP 10.0.2.15.44120 > 151.101.117.164.443: Flags [.], ack 643289, win 65535, length 0
19:57:42.194041 IP 151.101.117.164.443 > 10.0.2.15.44120: Flags [P.], seq 643289:644663, ack 869, win 65535, length 1374
19:57:42.194043 IP 151.101.117.164.443 > 10.0.2.15.44120: Flags [P.], seq 644663:647411, ack 869, win 65535, length 2748
19:57:42.194140 IP 10.0.2.15.44120 > 151.101.117.164.443: Flags [.], ack 647411, win 65535, length 0
19:57:42.194417 IP 151.101.117.164.443 > 10.0.2.15.44120: Flags [P.], seq 647411:650159, ack 869, win 65535, length 2748
19:57:42.194418 IP 151.101.117.164.443 > 10.0.2.15.44120: Flags [P.], seq 650159:652907, ack 869, win 65535, length 2748
19:57:42.194529 IP 151.101.117.164.443 > 10.0.2.15.44120: Flags [P.], seq 652907:655655, ack 869, win 65535, length 2748
19:57:42.194576 IP 10.0.2.15.44120 > 151.101.117.164.443: Flags [.], ack 655655, win 65535, length 0
19:57:42.194801 IP 151.101.117.164.443 > 10.0.2.15.44120: Flags [P.], seq 655655:658403, ack 869, win 65535, length 2748
19:57:42.194894 IP 10.0.2.15.44120 > 151.101.117.164.443: Flags [.], ack 658403, win 65535, length 0
19:57:42.195033 IP 151.101.117.164.443 > 10.0.2.15.44120: Flags [P.], seq 658403:661151, ack 869, win 65535, length 2748
19:57:42.195034 IP 151.101.117.164.443 > 10.0.2.15.44120: Flags [P.], seq 661151:662525, ack 869, win 65535, length 1374
19:57:42.195044 IP 10.0.2.15.44120 > 151.101.117.164.443: Flags [.], ack 661151, win 65535, length 0
19:57:42.195988 IP 151.101.117.164.443 > 10.0.2.15.44120: Flags [P.], seq 662525:668021, ack 869, win 65535, length 5496
19:57:42.196002 IP 10.0.2.15.44120 > 151.101.117.164.443: Flags [.], ack 668021, win 65535, length 0
19:57:42.196170 IP 151.101.117.164.443 > 10.0.2.15.44120: Flags [P.], seq 668021:672143, ack 869, win 65535, length 4122
19:57:42.196273 IP 151.101.117.164.443 > 10.0.2.15.44120: Flags [P.], seq 672143:673517, ack 869, win 65535, length 1374
19:57:42.196301 IP 10.0.2.15.44120 > 151.101.117.164.443: Flags [.], ack 673517, win 65535, length 0
19:57:42.196439 IP 151.101.117.164.443 > 10.0.2.15.44120: Flags [P.], seq 673517:677639, ack 869, win 65535, length 4122
19:57:42.196479 IP 10.0.2.15.44120 > 151.101.117.164.443: Flags [.], ack 677639, win 65535, length 0
19:57:42.196919 IP 151.101.117.164.443 > 10.0.2.15.44120: Flags [P.], seq 677639:680387, ack 869, win 65535, length 2748
19:57:42.196922 IP 151.101.117.164.443 > 10.0.2.15.44120: Flags [P.], seq 680387:685883, ack 869, win 65535, length 5496
19:57:42.196938 IP 10.0.2.15.44120 > 151.101.117.164.443: Flags [.], ack 680387, win 65535, length 0
19:57:42.197208 IP 151.101.117.164.443 > 10.0.2.15.44120: Flags [P.], seq 685883:687257, ack 869, win 65535, length 1374
19:57:42.197210 IP 151.101.117.164.443 > 10.0.2.15.44120: Flags [P.], seq 687257:690005, ack 869, win 65535, length 2748
19:57:42.197478 IP 151.101.117.164.443 > 10.0.2.15.44120: Flags [P.], seq 690005:692753, ack 869, win 65535, length 2748
19:57:42.197666 IP 151.101.117.164.443 > 10.0.2.15.44120: Flags [P.], seq 692753:696875, ack 869, win 65535, length 4122
19:57:42.197855 IP 151.101.117.164.443 > 10.0.2.15.44120: Flags [P.], seq 696875:698249, ack 869, win 65535, length 1374
19:57:42.197857 IP 151.101.117.164.443 > 10.0.2.15.44120: Flags [P.], seq 698249:700997, ack 869, win 65535, length 2748
19:57:42.197883 IP 10.0.2.15.44120 > 151.101.117.164.443: Flags [.], ack 692753, win 65535, length 0
19:57:42.198110 IP 151.101.117.164.443 > 10.0.2.15.44120: Flags [.], seq 700997:702457, ack 869, win 65535, length 1460
19:57:42.198253 IP 151.101.117.164.443 > 10.0.2.15.44120: Flags [P.], seq 702457:703745, ack 869, win 65535, length 1288
19:57:42.198255 IP 151.101.117.164.443 > 10.0.2.15.44120: Flags [P.], seq 703745:707867, ack 869, win 65535, length 4122
19:57:42.198288 IP 10.0.2.15.44120 > 151.101.117.164.443: Flags [.], ack 707867, win 65535, length 0
19:57:42.198420 IP 151.101.117.164.443 > 10.0.2.15.44120: Flags [P.], seq 707867:709241, ack 869, win 65535, length 1374
19:57:42.198656 IP 151.101.117.164.443 > 10.0.2.15.44120: Flags [P.], seq 709241:711989, ack 869, win 65535, length 2748
19:57:42.198667 IP 10.0.2.15.44120 > 151.101.117.164.443: Flags [.], ack 711989, win 65535, length 0
19:57:42.198798 IP 151.101.117.164.443 > 10.0.2.15.44120: Flags [P.], seq 711989:714737, ack 869, win 65535, length 2748
19:57:42.198839 IP 10.0.2.15.44120 > 151.101.117.164.443: Flags [.], ack 714737, win 65535, length 0
19:57:42.200321 IP 151.101.117.164.443 > 10.0.2.15.44120: Flags [P.], seq 714737:718859, ack 869, win 65535, length 4122
19:57:42.200323 IP 151.101.117.164.443 > 10.0.2.15.44120: Flags [P.], seq 718859:720233, ack 869, win 65535, length 1374
19:57:42.200323 IP 151.101.117.164.443 > 10.0.2.15.44120: Flags [P.], seq 720233:722981, ack 869, win 65535, length 2748
19:57:42.200324 IP 151.101.117.164.443 > 10.0.2.15.44120: Flags [P.], seq 722981:727103, ack 869, win 65535, length 4122
19:57:42.200353 IP 151.101.117.164.443 > 10.0.2.15.44120: Flags [P.], seq 727103:728477, ack 869, win 65535, length 1374
19:57:42.200392 IP 10.0.2.15.44120 > 151.101.117.164.443: Flags [.], ack 728477, win 65535, length 0
19:57:42.201872 IP 151.101.117.164.443 > 10.0.2.15.44120: Flags [P.], seq 728477:735347, ack 869, win 65535, length 6870
19:57:42.201875 IP 151.101.117.164.443 > 10.0.2.15.44120: Flags [P.], seq 735347:738095, ack 869, win 65535, length 2748
19:57:42.201897 IP 10.0.2.15.44120 > 151.101.117.164.443: Flags [.], ack 735347, win 65535, length 0
19:57:42.202051 IP 151.101.117.164.443 > 10.0.2.15.44120: Flags [P.], seq 738095:743591, ack 869, win 65535, length 5496
19:57:42.202181 IP 151.101.117.164.443 > 10.0.2.15.44120: Flags [P.], seq 743591:744965, ack 869, win 65535, length 1374
19:57:42.202308 IP 151.101.117.164.443 > 10.0.2.15.44120: Flags [P.], seq 744965:747713, ack 869, win 65535, length 2748
19:57:42.202491 IP 151.101.117.164.443 > 10.0.2.15.44120: Flags [P.], seq 747713:750461, ack 869, win 65535, length 2748
19:57:42.202622 IP 151.101.117.164.443 > 10.0.2.15.44120: Flags [P.], seq 750461:751835, ack 869, win 65535, length 1374
19:57:42.202715 IP 151.101.117.164.443 > 10.0.2.15.44120: Flags [P.], seq 751835:754583, ack 869, win 65535, length 2748
19:57:42.202985 IP 151.101.117.164.443 > 10.0.2.15.44120: Flags [P.], seq 754583:757331, ack 869, win 65535, length 2748
19:57:42.202986 IP 151.101.117.164.443 > 10.0.2.15.44120: Flags [P.], seq 757331:758705, ack 869, win 65535, length 1374
19:57:42.203231 IP 151.101.117.164.443 > 10.0.2.15.44120: Flags [P.], seq 758705:761453, ack 869, win 65535, length 2748
19:57:42.203458 IP 151.101.117.164.443 > 10.0.2.15.44120: Flags [P.], seq 761453:765575, ack 869, win 65535, length 4122
19:57:42.203757 IP 151.101.117.164.443 > 10.0.2.15.44120: Flags [P.], seq 765575:768323, ack 869, win 65535, length 2748
19:57:42.205013 IP 10.0.2.15.44120 > 151.101.117.164.443: Flags [.], ack 768323, win 65535, length 0
19:57:42.205928 IP 151.101.117.164.443 > 10.0.2.15.44120: Flags [P.], seq 768323:794429, ack 869, win 65535, length 26106
19:57:42.205941 IP 10.0.2.15.44120 > 151.101.117.164.443: Flags [.], ack 794429, win 65535, length 0
19:57:42.211240 IP 151.101.117.164.443 > 10.0.2.15.44120: Flags [P.], seq 794429:802673, ack 869, win 65535, length 8244
19:57:42.211244 IP 151.101.117.164.443 > 10.0.2.15.44120: Flags [P.], seq 802673:806795, ack 869, win 65535, length 4122
19:57:42.211273 IP 10.0.2.15.44120 > 151.101.117.164.443: Flags [.], ack 802673, win 65535, length 0
19:57:42.211363 IP 151.101.117.164.443 > 10.0.2.15.44120: Flags [P.], seq 806795:809543, ack 869, win 65535, length 2748
19:57:42.211365 IP 151.101.117.164.443 > 10.0.2.15.44120: Flags [P.], seq 809543:815039, ack 869, win 65535, length 5496
19:57:42.211366 IP 151.101.117.164.443 > 10.0.2.15.44120: Flags [P.], seq 815039:819161, ack 869, win 65535, length 4122
19:57:42.212105 IP 151.101.117.164.443 > 10.0.2.15.44120: Flags [P.], seq 819161:824657, ack 869, win 65535, length 5496
19:57:42.212109 IP 151.101.117.164.443 > 10.0.2.15.44120: Flags [P.], seq 824657:828779, ack 869, win 65535, length 4122
19:57:42.212273 IP 10.0.2.15.44120 > 151.101.117.164.443: Flags [.], ack 828779, win 65535, length 0
19:57:42.212374 IP 151.101.117.164.443 > 10.0.2.15.44120: Flags [P.], seq 828779:831527, ack 869, win 65535, length 2748
19:57:42.212376 IP 151.101.117.164.443 > 10.0.2.15.44120: Flags [P.], seq 831527:835649, ack 869, win 65535, length 4122
19:57:42.212730 IP 151.101.117.164.443 > 10.0.2.15.44120: Flags [P.], seq 835649:841145, ack 869, win 65535, length 5496
19:57:42.212732 IP 151.101.117.164.443 > 10.0.2.15.44120: Flags [P.], seq 841145:842519, ack 869, win 65535, length 1374
19:57:42.212734 IP 151.101.117.164.443 > 10.0.2.15.44120: Flags [P.], seq 842519:845267, ack 869, win 65535, length 2748
19:57:42.212978 IP 151.101.117.164.443 > 10.0.2.15.44120: Flags [P.], seq 845267:848015, ack 869, win 65535, length 2748
19:57:42.213253 IP 151.101.117.164.443 > 10.0.2.15.44120: Flags [P.], seq 848015:852137, ack 869, win 65535, length 4122
19:57:42.213287 IP 10.0.2.15.44120 > 151.101.117.164.443: Flags [.], ack 852137, win 65535, length 0
19:57:42.213736 IP 151.101.117.164.443 > 10.0.2.15.44120: Flags [P.], seq 852137:854885, ack 869, win 65535, length 2748
19:57:42.213738 IP 151.101.117.164.443 > 10.0.2.15.44120: Flags [P.], seq 854885:860381, ack 869, win 65535, length 5496
19:57:42.214049 IP 10.0.2.15.44120 > 151.101.117.164.443: Flags [.], ack 860381, win 65535, length 0
19:57:42.214475 IP 151.101.117.164.443 > 10.0.2.15.44120: Flags [P.], seq 860381:865877, ack 869, win 65535, length 5496
19:57:42.214490 IP 10.0.2.15.44120 > 151.101.117.164.443: Flags [.], ack 865877, win 65535, length 0
19:57:42.214584 IP 151.101.117.164.443 > 10.0.2.15.44120: Flags [P.], seq 865877:867251, ack 869, win 65535, length 1374
19:57:42.214762 IP 151.101.117.164.443 > 10.0.2.15.44120: Flags [P.], seq 867251:869999, ack 869, win 65535, length 2748
19:57:42.214763 IP 151.101.117.164.443 > 10.0.2.15.44120: Flags [P.], seq 869999:871373, ack 869, win 65535, length 1374
19:57:42.214772 IP 10.0.2.15.44120 > 151.101.117.164.443: Flags [.], ack 869999, win 65535, length 0
19:57:42.215140 IP 151.101.117.164.443 > 10.0.2.15.44120: Flags [P.], seq 871373:874121, ack 869, win 65535, length 2748
19:57:42.215190 IP 10.0.2.15.44120 > 151.101.117.164.443: Flags [.], ack 874121, win 65535, length 0
19:57:42.215319 IP 151.101.117.164.443 > 10.0.2.15.44120: Flags [P.], seq 874121:876869, ack 869, win 65535, length 2748
19:57:42.215320 IP 151.101.117.164.443 > 10.0.2.15.44120: Flags [P.], seq 876869:879617, ack 869, win 65535, length 2748
19:57:42.215372 IP 10.0.2.15.44120 > 151.101.117.164.443: Flags [.], ack 879617, win 65535, length 0
19:57:42.215557 IP 151.101.117.164.443 > 10.0.2.15.44120: Flags [P.], seq 879617:882365, ack 869, win 65535, length 2748
19:57:42.215564 IP 10.0.2.15.44120 > 151.101.117.164.443: Flags [.], ack 882365, win 65535, length 0
19:57:42.215965 IP 151.101.117.164.443 > 10.0.2.15.44120: Flags [P.], seq 882365:886487, ack 869, win 65535, length 4122
19:57:42.215967 IP 151.101.117.164.443 > 10.0.2.15.44120: Flags [P.], seq 886487:887861, ack 869, win 65535, length 1374
19:57:42.215967 IP 151.101.117.164.443 > 10.0.2.15.44120: Flags [P.], seq 887861:890609, ack 869, win 65535, length 2748
19:57:42.216123 IP 151.101.117.164.443 > 10.0.2.15.44120: Flags [P.], seq 890609:893357, ack 869, win 65535, length 2748
19:57:42.216164 IP 10.0.2.15.44120 > 151.101.117.164.443: Flags [.], ack 893357, win 65535, length 0
19:57:42.216300 IP 151.101.117.164.443 > 10.0.2.15.44120: Flags [P.], seq 893357:894731, ack 869, win 65535, length 1374
19:57:42.216519 IP 151.101.117.164.443 > 10.0.2.15.44120: Flags [P.], seq 894731:897479, ack 869, win 65535, length 2748
19:57:42.216520 IP 151.101.117.164.443 > 10.0.2.15.44120: Flags [P.], seq 897479:900227, ack 869, win 65535, length 2748
19:57:42.216532 IP 10.0.2.15.44120 > 151.101.117.164.443: Flags [.], ack 897479, win 65535, length 0
19:57:42.216779 IP 151.101.117.164.443 > 10.0.2.15.44120: Flags [P.], seq 900227:902975, ack 869, win 65535, length 2748
19:57:42.216780 IP 151.101.117.164.443 > 10.0.2.15.44120: Flags [P.], seq 902975:904349, ack 869, win 65535, length 1374
19:57:42.217070 IP 151.101.117.164.443 > 10.0.2.15.44120: Flags [P.], seq 904349:907097, ack 869, win 65535, length 2748
19:57:42.217492 IP 151.101.117.164.443 > 10.0.2.15.44120: Flags [P.], seq 907097:909845, ack 869, win 65535, length 2748
19:57:42.217493 IP 151.101.117.164.443 > 10.0.2.15.44120: Flags [P.], seq 909845:911219, ack 869, win 65535, length 1374
19:57:42.217533 IP 151.101.117.164.443 > 10.0.2.15.44120: Flags [P.], seq 911219:915341, ack 869, win 65535, length 4122
19:57:42.217644 IP 10.0.2.15.44120 > 151.101.117.164.443: Flags [.], ack 915341, win 65535, length 0
19:57:42.217933 IP 151.101.117.164.443 > 10.0.2.15.44120: Flags [P.], seq 915341:918089, ack 869, win 65535, length 2748
19:57:42.217935 IP 151.101.117.164.443 > 10.0.2.15.44120: Flags [.], seq 918089:922469, ack 869, win 65535, length 4380
19:57:42.218037 IP 10.0.2.15.44120 > 151.101.117.164.443: Flags [.], ack 922469, win 65535, length 0
19:57:42.218164 IP 151.101.117.164.443 > 10.0.2.15.44120: Flags [P.], seq 922469:923585, ack 869, win 65535, length 1116
19:57:42.218166 IP 151.101.117.164.443 > 10.0.2.15.44120: Flags [P.], seq 923585:924959, ack 869, win 65535, length 1374
19:57:42.218267 IP 10.0.2.15.44120 > 151.101.117.164.443: Flags [.], ack 924959, win 65535, length 0
19:57:42.218411 IP 151.101.117.164.443 > 10.0.2.15.44120: Flags [P.], seq 924959:926333, ack 869, win 65535, length 1374
19:57:42.220845 IP 151.101.117.164.443 > 10.0.2.15.44120: Flags [P.], seq 926333:931829, ack 869, win 65535, length 5496
19:57:42.220848 IP 151.101.117.164.443 > 10.0.2.15.44120: Flags [P.], seq 931829:937325, ack 869, win 65535, length 5496
19:57:42.220870 IP 10.0.2.15.44120 > 151.101.117.164.443: Flags [.], ack 931829, win 65535, length 0
19:57:42.221044 IP 151.101.117.164.443 > 10.0.2.15.44120: Flags [P.], seq 937325:940073, ack 869, win 65535, length 2748
19:57:42.221046 IP 151.101.117.164.443 > 10.0.2.15.44120: Flags [P.], seq 940073:945569, ack 869, win 65535, length 5496
19:57:42.221047 IP 151.101.117.164.443 > 10.0.2.15.44120: Flags [P.], seq 945569:949691, ack 869, win 65535, length 4122
19:57:42.221062 IP 151.101.117.164.443 > 10.0.2.15.44120: Flags [P.], seq 949691:952439, ack 869, win 65535, length 2748
19:57:42.221063 IP 151.101.117.164.443 > 10.0.2.15.44120: Flags [P.], seq 952439:957935, ack 869, win 65535, length 5496
19:57:42.221129 IP 10.0.2.15.44120 > 151.101.117.164.443: Flags [.], ack 957935, win 65535, length 0
19:57:42.221467 IP 151.101.117.164.443 > 10.0.2.15.44120: Flags [.], seq 957935:960855, ack 869, win 65535, length 2920
19:57:42.221640 IP 151.101.117.164.443 > 10.0.2.15.44120: Flags [P.], seq 960855:966179, ack 869, win 65535, length 5324
19:57:42.221641 IP 151.101.117.164.443 > 10.0.2.15.44120: Flags [P.], seq 966179:970301, ack 869, win 65535, length 4122
19:57:42.221642 IP 151.101.117.164.443 > 10.0.2.15.44120: Flags [P.], seq 970301:973049, ack 869, win 65535, length 2748
19:57:42.221662 IP 151.101.117.164.443 > 10.0.2.15.44120: Flags [P.], seq 973049:975797, ack 869, win 65535, length 2748
19:57:42.221783 IP 151.101.117.164.443 > 10.0.2.15.44120: Flags [P.], seq 975797:977171, ack 869, win 65535, length 1374
19:57:42.221802 IP 10.0.2.15.44120 > 151.101.117.164.443: Flags [.], ack 975797, win 65535, length 0
19:57:42.221986 IP 151.101.117.164.443 > 10.0.2.15.44120: Flags [P.], seq 977171:979919, ack 869, win 65535, length 2748
19:57:42.221993 IP 10.0.2.15.44120 > 151.101.117.164.443: Flags [.], ack 979919, win 65535, length 0
19:57:42.222110 IP 151.101.117.164.443 > 10.0.2.15.44120: Flags [P.], seq 979919:981293, ack 869, win 65535, length 1374
19:57:42.222194 IP 151.101.117.164.443 > 10.0.2.15.44120: Flags [P.], seq 981293:984041, ack 869, win 65535, length 2748
19:57:42.222343 IP 151.101.117.164.443 > 10.0.2.15.44120: Flags [P.], seq 984041:986789, ack 869, win 65535, length 2748
19:57:42.222452 IP 151.101.117.164.443 > 10.0.2.15.44120: Flags [P.], seq 986789:988163, ack 869, win 65535, length 1374
19:57:42.222600 IP 10.0.2.15.44120 > 151.101.117.164.443: Flags [.], ack 988163, win 65535, length 0
19:57:42.222807 IP 151.101.117.164.443 > 10.0.2.15.44120: Flags [P.], seq 988163:990911, ack 869, win 65535, length 2748
19:57:42.222808 IP 151.101.117.164.443 > 10.0.2.15.44120: Flags [P.], seq 990911:992285, ack 869, win 65535, length 1374
19:57:42.223310 IP 10.0.2.15.44120 > 151.101.117.164.443: Flags [.], ack 992285, win 65535, length 0
19:57:42.224022 IP 151.101.117.164.443 > 10.0.2.15.44120: Flags [P.], seq 992285:996407, ack 869, win 65535, length 4122
19:57:42.224024 IP 151.101.117.164.443 > 10.0.2.15.44120: Flags [P.], seq 996407:999155, ack 869, win 65535, length 2748
19:57:42.224151 IP 151.101.117.164.443 > 10.0.2.15.44120: Flags [P.], seq 999155:1001903, ack 869, win 65535, length 2748
19:57:42.224152 IP 151.101.117.164.443 > 10.0.2.15.44120: Flags [P.], seq 1001903:1004651, ack 869, win 65535, length 2748
19:57:42.224153 IP 151.101.117.164.443 > 10.0.2.15.44120: Flags [P.], seq 1004651:1007399, ack 869, win 65535, length 2748
19:57:42.224340 IP 151.101.117.164.443 > 10.0.2.15.44120: Flags [P.], seq 1007399:1008773, ack 869, win 65535, length 1374
19:57:42.224481 IP 151.101.117.164.443 > 10.0.2.15.44120: Flags [P.], seq 1008773:1011521, ack 869, win 65535, length 2748
19:57:42.224482 IP 151.101.117.164.443 > 10.0.2.15.44120: Flags [P.], seq 1011521:1012895, ack 869, win 65535, length 1374
19:57:42.224610 IP 151.101.117.164.443 > 10.0.2.15.44120: Flags [P.], seq 1012895:1014269, ack 869, win 65535, length 1374
19:57:42.224745 IP 151.101.117.164.443 > 10.0.2.15.44120: Flags [P.], seq 1014269:1017017, ack 869, win 65535, length 2748
19:57:42.224855 IP 10.0.2.15.44120 > 151.101.117.164.443: Flags [.], ack 1017017, win 65535, length 0
19:57:42.225051 IP 151.101.117.164.443 > 10.0.2.15.44120: Flags [P.], seq 1017017:1019765, ack 869, win 65535, length 2748
19:57:42.225053 IP 151.101.117.164.443 > 10.0.2.15.44120: Flags [P.], seq 1019765:1022513, ack 869, win 65535, length 2748
19:57:42.225108 IP 10.0.2.15.44120 > 151.101.117.164.443: Flags [.], ack 1022513, win 65535, length 0
19:57:42.225182 IP 151.101.117.164.443 > 10.0.2.15.44120: Flags [P.], seq 1022513:1023887, ack 869, win 65535, length 1374
19:57:42.225308 IP 151.101.117.164.443 > 10.0.2.15.44120: Flags [P.], seq 1023887:1025261, ack 869, win 65535, length 1374
19:57:42.225317 IP 10.0.2.15.44120 > 151.101.117.164.443: Flags [.], ack 1025261, win 65535, length 0
19:57:42.225444 IP 151.101.117.164.443 > 10.0.2.15.44120: Flags [P.], seq 1025261:1028009, ack 869, win 65535, length 2748
19:57:42.225513 IP 10.0.2.15.44120 > 151.101.117.164.443: Flags [.], ack 1028009, win 65535, length 0
19:57:42.225902 IP 151.101.117.164.443 > 10.0.2.15.44120: Flags [P.], seq 1028009:1030757, ack 869, win 65535, length 2748
19:57:42.225903 IP 151.101.117.164.443 > 10.0.2.15.44120: Flags [P.], seq 1030757:1033505, ack 869, win 65535, length 2748
19:57:42.225903 IP 151.101.117.164.443 > 10.0.2.15.44120: Flags [P.], seq 1033505:1034879, ack 869, win 65535, length 1374
19:57:42.226282 IP 151.101.117.164.443 > 10.0.2.15.44120: Flags [P.], seq 1034879:1037627, ack 869, win 65535, length 2748
19:57:42.226480 IP 151.101.117.164.443 > 10.0.2.15.44120: Flags [P.], seq 1037627:1040375, ack 869, win 65535, length 2748
19:57:42.226482 IP 151.101.117.164.443 > 10.0.2.15.44120: Flags [P.], seq 1040375:1043123, ack 869, win 65535, length 2748
19:57:42.226907 IP 151.101.117.164.443 > 10.0.2.15.44120: Flags [P.], seq 1043123:1045871, ack 869, win 65535, length 2748
19:57:42.226908 IP 151.101.117.164.443 > 10.0.2.15.44120: Flags [P.], seq 1045871:1048619, ack 869, win 65535, length 2748
19:57:42.226909 IP 151.101.117.164.443 > 10.0.2.15.44120: Flags [P.], seq 1048619:1054115, ack 869, win 65535, length 5496
19:57:42.227250 IP 151.101.117.164.443 > 10.0.2.15.44120: Flags [P.], seq 1054115:1055489, ack 869, win 65535, length 1374
19:57:42.227252 IP 151.101.117.164.443 > 10.0.2.15.44120: Flags [P.], seq 1055489:1058237, ack 869, win 65535, length 2748
19:57:42.227329 IP 10.0.2.15.44120 > 151.101.117.164.443: Flags [.], ack 1058237, win 65535, length 0
19:57:42.228296 IP 151.101.117.164.443 > 10.0.2.15.44120: Flags [P.], seq 1058237:1062359, ack 869, win 65535, length 4122
19:57:42.228298 IP 151.101.117.164.443 > 10.0.2.15.44120: Flags [P.], seq 1062359:1065107, ack 869, win 65535, length 2748
19:57:42.228447 IP 10.0.2.15.44120 > 151.101.117.164.443: Flags [.], ack 1062359, win 65535, length 0
19:57:42.228632 IP 151.101.117.164.443 > 10.0.2.15.44120: Flags [P.], seq 1065107:1070603, ack 869, win 65535, length 5496
19:57:42.228872 IP 151.101.117.164.443 > 10.0.2.15.44120: Flags [P.], seq 1070603:1073351, ack 869, win 65535, length 2748
19:57:42.228995 IP 151.101.117.164.443 > 10.0.2.15.44120: Flags [P.], seq 1073351:1074725, ack 869, win 65535, length 1374
19:57:42.229358 IP 151.101.117.164.443 > 10.0.2.15.44120: Flags [P.], seq 1074725:1077473, ack 869, win 65535, length 2748
19:57:42.229359 IP 151.101.117.164.443 > 10.0.2.15.44120: Flags [P.], seq 1077473:1080221, ack 869, win 65535, length 2748
19:57:42.229360 IP 151.101.117.164.443 > 10.0.2.15.44120: Flags [P.], seq 1080221:1082969, ack 869, win 65535, length 2748
19:57:42.229717 IP 151.101.117.164.443 > 10.0.2.15.44120: Flags [P.], seq 1082969:1084343, ack 869, win 65535, length 1374
19:57:42.229737 IP 151.101.117.164.443 > 10.0.2.15.44120: Flags [P.], seq 1084343:1087091, ack 869, win 65535, length 2748
19:57:42.229759 IP 10.0.2.15.44120 > 151.101.117.164.443: Flags [.], ack 1074725, win 65535, length 0
19:57:42.229895 IP 151.101.117.164.443 > 10.0.2.15.44120: Flags [.], seq 1087091:1088551, ack 869, win 65535, length 1460
19:57:42.230059 IP 151.101.117.164.443 > 10.0.2.15.44120: Flags [P.], seq 1088551:1092587, ack 869, win 65535, length 4036
19:57:42.230061 IP 151.101.117.164.443 > 10.0.2.15.44120: Flags [P.], seq 1092587:1093961, ack 869, win 65535, length 1374
19:57:42.230340 IP 151.101.117.164.443 > 10.0.2.15.44120: Flags [P.], seq 1093961:1098083, ack 869, win 65535, length 4122
19:57:42.230341 IP 151.101.117.164.443 > 10.0.2.15.44120: Flags [P.], seq 1098083:1099457, ack 869, win 65535, length 1374
19:57:42.230378 IP 10.0.2.15.44120 > 151.101.117.164.443: Flags [.], ack 1099457, win 65535, length 0
19:57:42.230482 IP 151.101.117.164.443 > 10.0.2.15.44120: Flags [P.], seq 1099457:1100831, ack 869, win 65535, length 1374
19:57:42.230551 IP 151.101.117.164.443 > 10.0.2.15.44120: Flags [P.], seq 1100831:1103579, ack 869, win 65535, length 2748
19:57:42.230589 IP 10.0.2.15.44120 > 151.101.117.164.443: Flags [.], ack 1103579, win 65535, length 0
19:57:42.230849 IP 151.101.117.164.443 > 10.0.2.15.44120: Flags [P.], seq 1103579:1106327, ack 869, win 65535, length 2748
19:57:42.230888 IP 10.0.2.15.44120 > 151.101.117.164.443: Flags [.], ack 1106327, win 65535, length 0
19:57:42.231004 IP 151.101.117.164.443 > 10.0.2.15.44120: Flags [P.], seq 1106327:1110449, ack 869, win 65535, length 4122
19:57:42.231062 IP 10.0.2.15.44120 > 151.101.117.164.443: Flags [.], ack 1110449, win 65535, length 0
19:57:42.231245 IP 151.101.117.164.443 > 10.0.2.15.44120: Flags [P.], seq 1110449:1111823, ack 869, win 65535, length 1374
19:57:42.231380 IP 151.101.117.164.443 > 10.0.2.15.44120: Flags [P.], seq 1111823:1115945, ack 869, win 65535, length 4122
19:57:42.231395 IP 10.0.2.15.44120 > 151.101.117.164.443: Flags [.], ack 1115945, win 65535, length 0
19:57:42.231544 IP 151.101.117.164.443 > 10.0.2.15.44120: Flags [P.], seq 1115945:1118693, ack 869, win 65535, length 2748
19:57:42.231552 IP 10.0.2.15.44120 > 151.101.117.164.443: Flags [.], ack 1118693, win 65535, length 0
19:57:42.231805 IP 151.101.117.164.443 > 10.0.2.15.44120: Flags [P.], seq 1118693:1124189, ack 869, win 65535, length 5496
19:57:42.231877 IP 10.0.2.15.44120 > 151.101.117.164.443: Flags [.], ack 1124189, win 65535, length 0
19:57:42.233074 IP 151.101.117.164.443 > 10.0.2.15.44120: Flags [P.], seq 1124189:1131059, ack 869, win 65535, length 6870
19:57:42.233090 IP 10.0.2.15.44120 > 151.101.117.164.443: Flags [.], ack 1131059, win 65535, length 0
19:57:42.233370 IP 151.101.117.164.443 > 10.0.2.15.44120: Flags [P.], seq 1131059:1136555, ack 869, win 65535, length 5496
19:57:42.233371 IP 151.101.117.164.443 > 10.0.2.15.44120: Flags [P.], seq 1136555:1137929, ack 869, win 65535, length 1374
19:57:42.233743 IP 151.101.117.164.443 > 10.0.2.15.44120: Flags [P.], seq 1137929:1140677, ack 869, win 65535, length 2748
19:57:42.233745 IP 151.101.117.164.443 > 10.0.2.15.44120: Flags [P.], seq 1140677:1143425, ack 869, win 65535, length 2748
19:57:42.233746 IP 151.101.117.164.443 > 10.0.2.15.44120: Flags [P.], seq 1143425:1144799, ack 869, win 65535, length 1374
19:57:42.233846 IP 10.0.2.15.44120 > 151.101.117.164.443: Flags [.], ack 1144799, win 65535, length 0
19:57:42.233940 IP 151.101.117.164.443 > 10.0.2.15.44120: Flags [P.], seq 1144799:1148921, ack 869, win 65535, length 4122
19:57:42.234038 IP 10.0.2.15.44120 > 151.101.117.164.443: Flags [.], ack 1148921, win 65535, length 0
19:57:42.234254 IP 151.101.117.164.443 > 10.0.2.15.44120: Flags [P.], seq 1148921:1151669, ack 869, win 65535, length 2748
19:57:42.234298 IP 10.0.2.15.44120 > 151.101.117.164.443: Flags [.], ack 1151669, win 65535, length 0
19:57:42.234529 IP 151.101.117.164.443 > 10.0.2.15.44120: Flags [P.], seq 1151669:1154417, ack 869, win 65535, length 2748
19:57:42.234669 IP 151.101.117.164.443 > 10.0.2.15.44120: Flags [P.], seq 1154417:1157165, ack 869, win 65535, length 2748
19:57:42.234670 IP 151.101.117.164.443 > 10.0.2.15.44120: Flags [P.], seq 1157165:1159913, ack 869, win 65535, length 2748
19:57:42.234695 IP 10.0.2.15.44120 > 151.101.117.164.443: Flags [.], ack 1159913, win 65535, length 0
19:57:42.234765 IP 151.101.117.164.443 > 10.0.2.15.44120: Flags [P.], seq 1159913:1161287, ack 869, win 65535, length 1374
19:57:42.234902 IP 151.101.117.164.443 > 10.0.2.15.44120: Flags [P.], seq 1161287:1164035, ack 869, win 65535, length 2748
19:57:42.235046 IP 10.0.2.15.44120 > 151.101.117.164.443: Flags [.], ack 1164035, win 65535, length 0
19:57:42.235220 IP 151.101.117.164.443 > 10.0.2.15.44120: Flags [P.], seq 1164035:1168157, ack 869, win 65535, length 4122
19:57:42.235308 IP 10.0.2.15.44120 > 151.101.117.164.443: Flags [.], ack 1168157, win 65535, length 0
19:57:42.235448 IP 151.101.117.164.443 > 10.0.2.15.44120: Flags [P.], seq 1168157:1170905, ack 869, win 65535, length 2748
19:57:42.235449 IP 151.101.117.164.443 > 10.0.2.15.44120: Flags [.], seq 1170905:1173825, ack 869, win 65535, length 2920
19:57:42.235460 IP 10.0.2.15.44120 > 151.101.117.164.443: Flags [.], ack 1170905, win 65535, length 0
19:57:42.235508 IP 10.0.2.15.44120 > 151.101.117.164.443: Flags [.], ack 1173825, win 65535, length 0
19:57:42.235575 IP 151.101.117.164.443 > 10.0.2.15.44120: Flags [P.], seq 1173825:1175027, ack 869, win 65535, length 1202
19:57:42.235843 IP 151.101.117.164.443 > 10.0.2.15.44120: Flags [P.], seq 1175027:1180523, ack 869, win 65535, length 5496
19:57:42.235852 IP 10.0.2.15.44120 > 151.101.117.164.443: Flags [.], ack 1180523, win 65535, length 0
19:57:42.235940 IP 151.101.117.164.443 > 10.0.2.15.44120: Flags [P.], seq 1180523:1181897, ack 869, win 65535, length 1374
19:57:42.236048 IP 151.101.117.164.443 > 10.0.2.15.44120: Flags [P.], seq 1181897:1184645, ack 869, win 65535, length 2748
19:57:42.236055 IP 10.0.2.15.44120 > 151.101.117.164.443: Flags [.], ack 1184645, win 65535, length 0
19:57:42.236452 IP 151.101.117.164.443 > 10.0.2.15.44120: Flags [P.], seq 1184645:1187393, ack 869, win 65535, length 2748
19:57:42.236453 IP 151.101.117.164.443 > 10.0.2.15.44120: Flags [P.], seq 1187393:1190141, ack 869, win 65535, length 2748
19:57:42.236465 IP 10.0.2.15.44120 > 151.101.117.164.443: Flags [.], ack 1187393, win 65535, length 0
19:57:42.236593 IP 10.0.2.15.44120 > 151.101.117.164.443: Flags [.], ack 1190141, win 65535, length 0
19:57:42.237440 IP 151.101.117.164.443 > 10.0.2.15.44120: Flags [P.], seq 1190141:1195637, ack 869, win 65535, length 5496
19:57:42.237452 IP 10.0.2.15.44120 > 151.101.117.164.443: Flags [.], ack 1195637, win 65535, length 0
19:57:42.237865 IP 151.101.117.164.443 > 10.0.2.15.44120: Flags [P.], seq 1195637:1199759, ack 869, win 65535, length 4122
19:57:42.237867 IP 151.101.117.164.443 > 10.0.2.15.44120: Flags [P.], seq 1199759:1201133, ack 869, win 65535, length 1374
19:57:42.237868 IP 151.101.117.164.443 > 10.0.2.15.44120: Flags [P.], seq 1201133:1205255, ack 869, win 65535, length 4122
19:57:42.238022 IP 10.0.2.15.44120 > 151.101.117.164.443: Flags [.], ack 1205255, win 65535, length 0
19:57:42.238430 IP 151.101.117.164.443 > 10.0.2.15.44120: Flags [P.], seq 1205255:1208003, ack 869, win 65535, length 2748
19:57:42.238432 IP 151.101.117.164.443 > 10.0.2.15.44120: Flags [P.], seq 1208003:1212125, ack 869, win 65535, length 4122
19:57:42.238498 IP 10.0.2.15.44120 > 151.101.117.164.443: Flags [.], ack 1212125, win 65535, length 0
19:57:42.239224 IP 151.101.117.164.443 > 10.0.2.15.44120: Flags [P.], seq 1212125:1217621, ack 869, win 65535, length 5496
19:57:42.239226 IP 151.101.117.164.443 > 10.0.2.15.44120: Flags [P.], seq 1217621:1220369, ack 869, win 65535, length 2748
19:57:42.239238 IP 151.101.117.164.443 > 10.0.2.15.44120: Flags [P.], seq 1220369:1223117, ack 869, win 65535, length 2748
19:57:42.239270 IP 151.101.117.164.443 > 10.0.2.15.44120: Flags [P.], seq 1223117:1225865, ack 869, win 65535, length 2748
19:57:42.239408 IP 151.101.117.164.443 > 10.0.2.15.44120: Flags [P.], seq 1225865:1229987, ack 869, win 65535, length 4122
19:57:42.239409 IP 151.101.117.164.443 > 10.0.2.15.44120: Flags [P.], seq 1229987:1231361, ack 869, win 65535, length 1374
19:57:42.239770 IP 151.101.117.164.443 > 10.0.2.15.44120: Flags [P.], seq 1231361:1232735, ack 869, win 65535, length 1374
19:57:42.239772 IP 151.101.117.164.443 > 10.0.2.15.44120: Flags [.], seq 1232735:1234195, ack 869, win 65535, length 1460
19:57:42.240026 IP 151.101.117.164.443 > 10.0.2.15.44120: Flags [P.], seq 1234195:1235483, ack 869, win 65535, length 1288
19:57:42.240028 IP 151.101.117.164.443 > 10.0.2.15.44120: Flags [P.], seq 1235483:1239605, ack 869, win 65535, length 4122
19:57:42.240242 IP 151.101.117.164.443 > 10.0.2.15.44120: Flags [P.], seq 1239605:1242353, ack 869, win 65535, length 2748
19:57:42.240243 IP 151.101.117.164.443 > 10.0.2.15.44120: Flags [.], seq 1242353:1243813, ack 869, win 65535, length 1460
19:57:42.240528 IP 151.101.117.164.443 > 10.0.2.15.44120: Flags [P.], seq 1243813:1245101, ack 869, win 65535, length 1288
19:57:42.241354 IP 10.0.2.15.44120 > 151.101.117.164.443: Flags [.], ack 1245101, win 65535, length 0
19:57:42.241813 IP 151.101.117.164.443 > 10.0.2.15.44120: Flags [P.], seq 1245101:1256093, ack 869, win 65535, length 10992
19:57:42.242088 IP 151.101.117.164.443 > 10.0.2.15.44120: Flags [P.], seq 1256093:1262963, ack 869, win 65535, length 6870
19:57:42.242267 IP 151.101.117.164.443 > 10.0.2.15.44120: Flags [P.], seq 1262963:1264337, ack 869, win 65535, length 1374
19:57:42.242316 IP 151.101.117.164.443 > 10.0.2.15.44120: Flags [P.], seq 1264337:1267085, ack 869, win 65535, length 2748
19:57:42.242418 IP 151.101.117.164.443 > 10.0.2.15.44120: Flags [P.], seq 1267085:1269833, ack 869, win 65535, length 2748
19:57:42.242468 IP 10.0.2.15.44120 > 151.101.117.164.443: Flags [.], ack 1269833, win 65535, length 0
19:57:42.242514 IP 151.101.117.164.443 > 10.0.2.15.44120: Flags [P.], seq 1269833:1271207, ack 869, win 65535, length 1374
19:57:42.242717 IP 151.101.117.164.443 > 10.0.2.15.44120: Flags [P.], seq 1271207:1273955, ack 869, win 65535, length 2748
19:57:42.242724 IP 10.0.2.15.44120 > 151.101.117.164.443: Flags [.], ack 1273955, win 65535, length 0
19:57:42.242881 IP 151.101.117.164.443 > 10.0.2.15.44120: Flags [P.], seq 1273955:1276703, ack 869, win 65535, length 2748
19:57:42.242891 IP 10.0.2.15.44120 > 151.101.117.164.443: Flags [.], ack 1276703, win 65535, length 0
19:57:42.243131 IP 151.101.117.164.443 > 10.0.2.15.44120: Flags [P.], seq 1276703:1279451, ack 869, win 65535, length 2748
19:57:42.243132 IP 151.101.117.164.443 > 10.0.2.15.44120: Flags [P.], seq 1279451:1280825, ack 869, win 65535, length 1374
19:57:42.243133 IP 151.101.117.164.443 > 10.0.2.15.44120: Flags [P.], seq 1280825:1282199, ack 869, win 65535, length 1374
19:57:42.243145 IP 10.0.2.15.44120 > 151.101.117.164.443: Flags [.], ack 1279451, win 65535, length 0
19:57:42.243336 IP 151.101.117.164.443 > 10.0.2.15.44120: Flags [.], seq 1282199:1283659, ack 869, win 65535, length 1460
19:57:42.243532 IP 151.101.117.164.443 > 10.0.2.15.44120: Flags [P.], seq 1283659:1284947, ack 869, win 65535, length 1288
19:57:42.243533 IP 151.101.117.164.443 > 10.0.2.15.44120: Flags [P.], seq 1284947:1289069, ack 869, win 65535, length 4122
19:57:42.243584 IP 10.0.2.15.44120 > 151.101.117.164.443: Flags [.], ack 1289069, win 65535, length 0
19:57:42.243996 IP 151.101.117.164.443 > 10.0.2.15.44120: Flags [P.], seq 1289069:1291817, ack 869, win 65535, length 2748
19:57:42.243998 IP 151.101.117.164.443 > 10.0.2.15.44120: Flags [P.], seq 1291817:1295939, ack 869, win 65535, length 4122
19:57:42.244013 IP 10.0.2.15.44120 > 151.101.117.164.443: Flags [.], ack 1291817, win 65535, length 0
19:57:42.244203 IP 151.101.117.164.443 > 10.0.2.15.44120: Flags [P.], seq 1295939:1298687, ack 869, win 65535, length 2748
19:57:42.244259 IP 10.0.2.15.44120 > 151.101.117.164.443: Flags [.], ack 1298687, win 65535, length 0
19:57:42.244401 IP 151.101.117.164.443 > 10.0.2.15.44120: Flags [P.], seq 1298687:1301435, ack 869, win 65535, length 2748
19:57:42.244494 IP 10.0.2.15.44120 > 151.101.117.164.443: Flags [.], ack 1301435, win 65535, length 0
19:57:42.244721 IP 151.101.117.164.443 > 10.0.2.15.44120: Flags [P.], seq 1301435:1305557, ack 869, win 65535, length 4122
19:57:42.244948 IP 151.101.117.164.443 > 10.0.2.15.44120: Flags [P.], seq 1305557:1311053, ack 869, win 65535, length 5496
19:57:42.244991 IP 10.0.2.15.44120 > 151.101.117.164.443: Flags [.], ack 1311053, win 65535, length 0
19:57:42.245153 IP 151.101.117.164.443 > 10.0.2.15.44120: Flags [P.], seq 1311053:1313801, ack 869, win 65535, length 2748
19:57:42.245216 IP 10.0.2.15.44120 > 151.101.117.164.443: Flags [.], ack 1313801, win 65535, length 0
19:57:42.245366 IP 151.101.117.164.443 > 10.0.2.15.44120: Flags [P.], seq 1313801:1316549, ack 869, win 65535, length 2748
19:57:42.245375 IP 10.0.2.15.44120 > 151.101.117.164.443: Flags [.], ack 1316549, win 65535, length 0
19:57:42.245564 IP 151.101.117.164.443 > 10.0.2.15.44120: Flags [P.], seq 1316549:1319297, ack 869, win 65535, length 2748
19:57:42.245630 IP 151.101.117.164.443 > 10.0.2.15.44120: Flags [P.], seq 1319297:1322045, ack 869, win 65535, length 2748
19:57:42.245665 IP 10.0.2.15.44120 > 151.101.117.164.443: Flags [.], ack 1322045, win 65535, length 0
19:57:42.246774 IP 151.101.117.164.443 > 10.0.2.15.44120: Flags [P.], seq 1322045:1327541, ack 869, win 65535, length 5496
19:57:42.246776 IP 151.101.117.164.443 > 10.0.2.15.44120: Flags [P.], seq 1327541:1333037, ack 869, win 65535, length 5496
19:57:42.246854 IP 10.0.2.15.44120 > 151.101.117.164.443: Flags [.], ack 1327541, win 65535, length 0
19:57:42.247155 IP 151.101.117.164.443 > 10.0.2.15.44120: Flags [P.], seq 1333037:1335785, ack 869, win 65535, length 2748
19:57:42.247156 IP 151.101.117.164.443 > 10.0.2.15.44120: Flags [P.], seq 1335785:1338533, ack 869, win 65535, length 2748
19:57:42.247358 IP 151.101.117.164.443 > 10.0.2.15.44120: Flags [P.], seq 1338533:1339907, ack 869, win 65535, length 1374
19:57:42.247360 IP 151.101.117.164.443 > 10.0.2.15.44120: Flags [P.], seq 1339907:1341281, ack 869, win 65535, length 1374
19:57:42.247476 IP 10.0.2.15.44120 > 151.101.117.164.443: Flags [.], ack 1341281, win 65535, length 0
19:57:42.247663 IP 151.101.117.164.443 > 10.0.2.15.44120: Flags [P.], seq 1341281:1345403, ack 869, win 65535, length 4122
19:57:42.247672 IP 10.0.2.15.44120 > 151.101.117.164.443: Flags [.], ack 1345403, win 65535, length 0
19:57:42.247823 IP 151.101.117.164.443 > 10.0.2.15.44120: Flags [P.], seq 1345403:1348151, ack 869, win 65535, length 2748
19:57:42.248082 IP 151.101.117.164.443 > 10.0.2.15.44120: Flags [P.], seq 1348151:1350899, ack 869, win 65535, length 2748
19:57:42.248083 IP 151.101.117.164.443 > 10.0.2.15.44120: Flags [P.], seq 1350899:1355021, ack 869, win 65535, length 4122
19:57:42.248137 IP 10.0.2.15.44120 > 151.101.117.164.443: Flags [.], ack 1355021, win 65535, length 0
19:57:42.248498 IP 151.101.117.164.443 > 10.0.2.15.44120: Flags [P.], seq 1355021:1360517, ack 869, win 65535, length 5496
19:57:42.248510 IP 10.0.2.15.44120 > 151.101.117.164.443: Flags [.], ack 1360517, win 65535, length 0
19:57:42.248644 IP 151.101.117.164.443 > 10.0.2.15.44120: Flags [P.], seq 1360517:1364639, ack 869, win 65535, length 4122
19:57:42.248911 IP 151.101.117.164.443 > 10.0.2.15.44120: Flags [P.], seq 1364639:1366013, ack 869, win 65535, length 1374
19:57:42.249668 IP 151.101.117.164.443 > 10.0.2.15.44120: Flags [P.], seq 1366013:1368761, ack 869, win 65535, length 2748
19:57:42.249671 IP 151.101.117.164.443 > 10.0.2.15.44120: Flags [P.], seq 1368761:1372883, ack 869, win 65535, length 4122
19:57:42.249727 IP 10.0.2.15.44120 > 151.101.117.164.443: Flags [.], ack 1366013, win 65535, length 0
19:57:42.249773 IP 10.0.2.15.44120 > 151.101.117.164.443: Flags [.], ack 1372883, win 65535, length 0
19:57:42.249937 IP 151.101.117.164.443 > 10.0.2.15.44120: Flags [P.], seq 1372883:1378379, ack 869, win 65535, length 5496
19:57:42.249939 IP 151.101.117.164.443 > 10.0.2.15.44120: Flags [P.], seq 1378379:1382501, ack 869, win 65535, length 4122
19:57:42.249940 IP 151.101.117.164.443 > 10.0.2.15.44120: Flags [P.], seq 1382501:1383875, ack 869, win 65535, length 1374
19:57:42.250047 IP 10.0.2.15.44120 > 151.101.117.164.443: Flags [.], ack 1383875, win 65535, length 0
19:57:42.250392 IP 151.101.117.164.443 > 10.0.2.15.44120: Flags [P.], seq 1383875:1386623, ack 869, win 65535, length 2748
19:57:42.250448 IP 10.0.2.15.44120 > 151.101.117.164.443: Flags [.], ack 1386623, win 65535, length 0
19:57:42.250637 IP 151.101.117.164.443 > 10.0.2.15.44120: Flags [P.], seq 1386623:1387997, ack 869, win 65535, length 1374
19:57:42.252107 IP 151.101.117.164.443 > 10.0.2.15.44120: Flags [P.], seq 1387997:1393493, ack 869, win 65535, length 5496
19:57:42.252110 IP 151.101.117.164.443 > 10.0.2.15.44120: Flags [P.], seq 1393493:1396241, ack 869, win 65535, length 2748
19:57:42.252111 IP 151.101.117.164.443 > 10.0.2.15.44120: Flags [P.], seq 1396241:1400363, ack 869, win 65535, length 4122
19:57:42.252187 IP 10.0.2.15.44120 > 151.101.117.164.443: Flags [.], ack 1393493, win 65535, length 0
19:57:42.252404 IP 151.101.117.164.443 > 10.0.2.15.44120: Flags [P.], seq 1400363:1404485, ack 869, win 65535, length 4122
19:57:42.252407 IP 151.101.117.164.443 > 10.0.2.15.44120: Flags [P.], seq 1404485:1407233, ack 869, win 65535, length 2748
19:57:42.252408 IP 151.101.117.164.443 > 10.0.2.15.44120: Flags [P.], seq 1407233:1409981, ack 869, win 65535, length 2748
19:57:42.252409 IP 151.101.117.164.443 > 10.0.2.15.44120: Flags [P.], seq 1409981:1412729, ack 869, win 65535, length 2748
19:57:42.252436 IP 151.101.117.164.443 > 10.0.2.15.44120: Flags [P.], seq 1412729:1415477, ack 869, win 65535, length 2748
19:57:42.252592 IP 10.0.2.15.44120 > 151.101.117.164.443: Flags [.], ack 1415477, win 65535, length 0
19:57:42.252637 IP 151.101.117.164.443 > 10.0.2.15.44120: Flags [P.], seq 1415477:1419599, ack 869, win 65535, length 4122
19:57:42.252711 IP 10.0.2.15.44120 > 151.101.117.164.443: Flags [.], ack 1419599, win 65535, length 0
19:57:42.252866 IP 151.101.117.164.443 > 10.0.2.15.44120: Flags [P.], seq 1419599:1422347, ack 869, win 65535, length 2748
19:57:42.252874 IP 10.0.2.15.44120 > 151.101.117.164.443: Flags [.], ack 1422347, win 65535, length 0
19:57:42.253034 IP 151.101.117.164.443 > 10.0.2.15.44120: Flags [P.], seq 1422347:1425095, ack 869, win 65535, length 2748
19:57:42.253040 IP 10.0.2.15.44120 > 151.101.117.164.443: Flags [.], ack 1425095, win 65535, length 0
19:57:42.253197 IP 151.101.117.164.443 > 10.0.2.15.44120: Flags [P.], seq 1425095:1427843, ack 869, win 65535, length 2748
19:57:42.253203 IP 10.0.2.15.44120 > 151.101.117.164.443: Flags [.], ack 1427843, win 65535, length 0
19:57:42.253322 IP 151.101.117.164.443 > 10.0.2.15.44120: Flags [P.], seq 1427843:1429217, ack 869, win 65535, length 1374
19:57:42.253516 IP 151.101.117.164.443 > 10.0.2.15.44120: Flags [P.], seq 1429217:1431965, ack 869, win 65535, length 2748
19:57:42.253522 IP 10.0.2.15.44120 > 151.101.117.164.443: Flags [.], ack 1431965, win 65535, length 0
19:57:42.253716 IP 151.101.117.164.443 > 10.0.2.15.44120: Flags [P.], seq 1431965:1434713, ack 869, win 65535, length 2748
19:57:42.253717 IP 151.101.117.164.443 > 10.0.2.15.44120: Flags [P.], seq 1434713:1436087, ack 869, win 65535, length 1374
19:57:42.253758 IP 10.0.2.15.44120 > 151.101.117.164.443: Flags [.], ack 1436087, win 65535, length 0
19:57:42.253811 IP 151.101.117.164.443 > 10.0.2.15.44120: Flags [P.], seq 1436087:1438835, ack 869, win 65535, length 2748
19:57:42.253973 IP 151.101.117.164.443 > 10.0.2.15.44120: Flags [P.], seq 1438835:1441583, ack 869, win 65535, length 2748
19:57:42.254077 IP 151.101.117.164.443 > 10.0.2.15.44120: Flags [P.], seq 1441583:1442957, ack 869, win 65535, length 1374
19:57:42.254089 IP 10.0.2.15.44120 > 151.101.117.164.443: Flags [.], ack 1441583, win 65535, length 0
19:57:42.254273 IP 151.101.117.164.443 > 10.0.2.15.44120: Flags [P.], seq 1442957:1445705, ack 869, win 65535, length 2748
19:57:42.254278 IP 10.0.2.15.44120 > 151.101.117.164.443: Flags [.], ack 1445705, win 65535, length 0
19:57:42.254438 IP 151.101.117.164.443 > 10.0.2.15.44120: Flags [P.], seq 1445705:1448453, ack 869, win 65535, length 2748
19:57:42.254672 IP 151.101.117.164.443 > 10.0.2.15.44120: Flags [P.], seq 1448453:1449827, ack 869, win 65535, length 1374
19:57:42.254867 IP 151.101.117.164.443 > 10.0.2.15.44120: Flags [P.], seq 1449827:1452575, ack 869, win 65535, length 2748
19:57:42.254868 IP 151.101.117.164.443 > 10.0.2.15.44120: Flags [P.], seq 1452575:1453949, ack 869, win 65535, length 1374
19:57:42.254917 IP 10.0.2.15.44120 > 151.101.117.164.443: Flags [.], ack 1453949, win 65535, length 0
19:57:42.255768 IP 151.101.117.164.443 > 10.0.2.15.44120: Flags [P.], seq 1453949:1459445, ack 869, win 65535, length 5496
19:57:42.255898 IP 10.0.2.15.44120 > 151.101.117.164.443: Flags [.], ack 1459445, win 65535, length 0
19:57:42.256131 IP 151.101.117.164.443 > 10.0.2.15.44120: Flags [P.], seq 1459445:1462193, ack 869, win 65535, length 2748
19:57:42.256138 IP 151.101.117.164.443 > 10.0.2.15.44120: Flags [P.], seq 1462193:1466315, ack 869, win 65535, length 4122
19:57:42.256257 IP 151.101.117.164.443 > 10.0.2.15.44120: Flags [P.], seq 1466315:1469063, ack 869, win 65535, length 2748
19:57:42.256523 IP 151.101.117.164.443 > 10.0.2.15.44120: Flags [P.], seq 1469063:1471811, ack 869, win 65535, length 2748
19:57:42.256681 IP 151.101.117.164.443 > 10.0.2.15.44120: Flags [P.], seq 1471811:1475933, ack 869, win 65535, length 4122
19:57:42.257279 IP 151.101.117.164.443 > 10.0.2.15.44120: Flags [P.], seq 1475933:1481429, ack 869, win 65535, length 5496
19:57:42.257281 IP 151.101.117.164.443 > 10.0.2.15.44120: Flags [P.], seq 1481429:1482803, ack 869, win 65535, length 1374
19:57:42.257282 IP 151.101.117.164.443 > 10.0.2.15.44120: Flags [.], seq 1482803:1484263, ack 869, win 65535, length 1460
19:57:42.257397 IP 151.101.117.164.443 > 10.0.2.15.44120: Flags [P.], seq 1484263:1486925, ack 869, win 65535, length 2662
19:57:42.257558 IP 151.101.117.164.443 > 10.0.2.15.44120: Flags [P.], seq 1486925:1489673, ack 869, win 65535, length 2748
19:57:42.257559 IP 151.101.117.164.443 > 10.0.2.15.44120: Flags [P.], seq 1489673:1492421, ack 869, win 65535, length 2748
19:57:42.257905 IP 10.0.2.15.44120 > 151.101.117.164.443: Flags [.], ack 1492421, win 65535, length 0
19:57:42.258420 IP 151.101.117.164.443 > 10.0.2.15.44120: Flags [P.], seq 1492421:1497917, ack 869, win 65535, length 5496
19:57:42.258695 IP 151.101.117.164.443 > 10.0.2.15.44120: Flags [P.], seq 1497917:1502039, ack 869, win 65535, length 4122
19:57:42.258698 IP 151.101.117.164.443 > 10.0.2.15.44120: Flags [P.], seq 1502039:1507535, ack 869, win 65535, length 5496
19:57:42.259164 IP 151.101.117.164.443 > 10.0.2.15.44120: Flags [P.], seq 1507535:1510283, ack 869, win 65535, length 2748
19:57:42.259166 IP 151.101.117.164.443 > 10.0.2.15.44120: Flags [P.], seq 1510283:1513031, ack 869, win 65535, length 2748
19:57:42.259167 IP 151.101.117.164.443 > 10.0.2.15.44120: Flags [P.], seq 1513031:1515779, ack 869, win 65535, length 2748
19:57:42.259269 IP 151.101.117.164.443 > 10.0.2.15.44120: Flags [P.], seq 1515779:1518527, ack 869, win 65535, length 2748
19:57:42.259297 IP 151.101.117.164.443 > 10.0.2.15.44120: Flags [P.], seq 1518527:1519901, ack 869, win 65535, length 1374
19:57:42.259923 IP 10.0.2.15.44120 > 151.101.117.164.443: Flags [.], ack 1519901, win 65535, length 0
19:57:42.260403 IP 151.101.117.164.443 > 10.0.2.15.44120: Flags [P.], seq 1519901:1522649, ack 869, win 65535, length 2748
19:57:42.260405 IP 151.101.117.164.443 > 10.0.2.15.44120: Flags [P.], seq 1522649:1526771, ack 869, win 65535, length 4122
19:57:42.260583 IP 151.101.117.164.443 > 10.0.2.15.44120: Flags [P.], seq 1526771:1529519, ack 869, win 65535, length 2748
19:57:42.260661 IP 151.101.117.164.443 > 10.0.2.15.44120: Flags [P.], seq 1529519:1532267, ack 869, win 65535, length 2748
19:57:42.260902 IP 151.101.117.164.443 > 10.0.2.15.44120: Flags [P.], seq 1532267:1536389, ack 869, win 65535, length 4122
19:57:42.261003 IP 10.0.2.15.44120 > 151.101.117.164.443: Flags [.], ack 1536389, win 65535, length 0
19:57:42.261342 IP 151.101.117.164.443 > 10.0.2.15.44120: Flags [P.], seq 1536389:1539137, ack 869, win 65535, length 2748
19:57:42.261344 IP 151.101.117.164.443 > 10.0.2.15.44120: Flags [P.], seq 1539137:1541885, ack 869, win 65535, length 2748
19:57:42.261634 IP 151.101.117.164.443 > 10.0.2.15.44120: Flags [P.], seq 1541885:1544633, ack 869, win 65535, length 2748
19:57:42.261667 IP 10.0.2.15.44120 > 151.101.117.164.443: Flags [.], ack 1544633, win 65535, length 0
19:57:42.261779 IP 151.101.117.164.443 > 10.0.2.15.44120: Flags [P.], seq 1544633:1548755, ack 869, win 65535, length 4122
19:57:42.261780 IP 151.101.117.164.443 > 10.0.2.15.44120: Flags [P.], seq 1548755:1550129, ack 869, win 65535, length 1374
19:57:42.261908 IP 151.101.117.164.443 > 10.0.2.15.44120: Flags [P.], seq 1550129:1552877, ack 869, win 65535, length 2748
19:57:42.261923 IP 10.0.2.15.44120 > 151.101.117.164.443: Flags [.], ack 1550129, win 65535, length 0
19:57:42.262052 IP 151.101.117.164.443 > 10.0.2.15.44120: Flags [P.], seq 1552877:1555625, ack 869, win 65535, length 2748
19:57:42.262163 IP 151.101.117.164.443 > 10.0.2.15.44120: Flags [P.], seq 1555625:1556999, ack 869, win 65535, length 1374
19:57:42.262261 IP 10.0.2.15.44120 > 151.101.117.164.443: Flags [.], ack 1556999, win 65535, length 0
19:57:42.262457 IP 151.101.117.164.443 > 10.0.2.15.44120: Flags [P.], seq 1556999:1559747, ack 869, win 65535, length 2748
19:57:42.262469 IP 10.0.2.15.44120 > 151.101.117.164.443: Flags [.], ack 1559747, win 65535, length 0
19:57:42.262603 IP 151.101.117.164.443 > 10.0.2.15.44120: Flags [P.], seq 1559747:1563869, ack 869, win 65535, length 4122
19:57:42.262630 IP 10.0.2.15.44120 > 151.101.117.164.443: Flags [.], ack 1563869, win 65535, length 0
19:57:42.262794 IP 151.101.117.164.443 > 10.0.2.15.44120: Flags [P.], seq 1563869:1566617, ack 869, win 65535, length 2748
19:57:42.262802 IP 10.0.2.15.44120 > 151.101.117.164.443: Flags [.], ack 1566617, win 65535, length 0
19:57:42.263236 IP 151.101.117.164.443 > 10.0.2.15.44120: Flags [P.], seq 1566617:1570739, ack 869, win 65535, length 4122
19:57:42.263238 IP 151.101.117.164.443 > 10.0.2.15.44120: Flags [P.], seq 1570739:1573487, ack 869, win 65535, length 2748
19:57:42.263383 IP 151.101.117.164.443 > 10.0.2.15.44120: Flags [P.], seq 1573487:1576235, ack 869, win 65535, length 2748
19:57:42.263509 IP 10.0.2.15.44120 > 151.101.117.164.443: Flags [.], ack 1576235, win 65535, length 0
19:57:42.263960 IP 151.101.117.164.443 > 10.0.2.15.44120: Flags [P.], seq 1576235:1580357, ack 869, win 65535, length 4122
19:57:42.263962 IP 151.101.117.164.443 > 10.0.2.15.44120: Flags [P.], seq 1580357:1581731, ack 869, win 65535, length 1374
19:57:42.264068 IP 151.101.117.164.443 > 10.0.2.15.44120: Flags [P.], seq 1581731:1585853, ack 869, win 65535, length 4122
19:57:42.264107 IP 10.0.2.15.44120 > 151.101.117.164.443: Flags [.], ack 1585853, win 65535, length 0
19:57:42.264833 IP 151.101.117.164.443 > 10.0.2.15.44120: Flags [P.], seq 1585853:1589975, ack 869, win 65535, length 4122
19:57:42.264834 IP 151.101.117.164.443 > 10.0.2.15.44120: Flags [P.], seq 1589975:1591349, ack 869, win 65535, length 1374
19:57:42.264848 IP 10.0.2.15.44120 > 151.101.117.164.443: Flags [.], ack 1589975, win 65535, length 0
19:57:42.265045 IP 151.101.117.164.443 > 10.0.2.15.44120: Flags [P.], seq 1591349:1594097, ack 869, win 65535, length 2748
19:57:42.265046 IP 151.101.117.164.443 > 10.0.2.15.44120: Flags [P.], seq 1594097:1595471, ack 869, win 65535, length 1374
19:57:42.265248 IP 10.0.2.15.44120 > 151.101.117.164.443: Flags [.], ack 1595471, win 65535, length 0
19:57:42.265315 IP 151.101.117.164.443 > 10.0.2.15.44120: Flags [P.], seq 1595471:1598219, ack 869, win 65535, length 2748
19:57:42.265406 IP 151.101.117.164.443 > 10.0.2.15.44120: Flags [P.], seq 1598219:1599593, ack 869, win 65535, length 1374
19:57:42.265821 IP 151.101.117.164.443 > 10.0.2.15.44120: Flags [P.], seq 1599593:1602341, ack 869, win 65535, length 2748
19:57:42.265920 IP 151.101.117.164.443 > 10.0.2.15.44120: Flags [P.], seq 1602341:1605089, ack 869, win 65535, length 2748
19:57:42.265921 IP 151.101.117.164.443 > 10.0.2.15.44120: Flags [P.], seq 1605089:1610585, ack 869, win 65535, length 5496
19:57:42.265945 IP 10.0.2.15.44120 > 151.101.117.164.443: Flags [.], ack 1610585, win 65535, length 0
19:57:42.266116 IP 151.101.117.164.443 > 10.0.2.15.44120: Flags [P.], seq 1610585:1611959, ack 869, win 65535, length 1374
19:57:42.266223 IP 151.101.117.164.443 > 10.0.2.15.44120: Flags [P.], seq 1611959:1614707, ack 869, win 65535, length 2748
19:57:42.266266 IP 10.0.2.15.44120 > 151.101.117.164.443: Flags [.], ack 1614707, win 65535, length 0
19:57:42.266528 IP 151.101.117.164.443 > 10.0.2.15.44120: Flags [P.], seq 1614707:1620203, ack 869, win 65535, length 5496
19:57:42.266536 IP 10.0.2.15.44120 > 151.101.117.164.443: Flags [.], ack 1620203, win 65535, length 0
19:57:42.267060 IP 151.101.117.164.443 > 10.0.2.15.44120: Flags [P.], seq 1620203:1621577, ack 869, win 65535, length 1374
19:57:42.267062 IP 151.101.117.164.443 > 10.0.2.15.44120: Flags [P.], seq 1621577:1624325, ack 869, win 65535, length 2748
19:57:42.267064 IP 151.101.117.164.443 > 10.0.2.15.44120: Flags [P.], seq 1624325:1628447, ack 869, win 65535, length 4122
19:57:42.267536 IP 151.101.117.164.443 > 10.0.2.15.44120: Flags [P.], seq 1628447:1631195, ack 869, win 65535, length 2748
19:57:42.267538 IP 151.101.117.164.443 > 10.0.2.15.44120: Flags [P.], seq 1631195:1636691, ack 869, win 65535, length 5496
19:57:42.267609 IP 10.0.2.15.44120 > 151.101.117.164.443: Flags [.], ack 1636691, win 65535, length 0
19:57:42.268017 IP 151.101.117.164.443 > 10.0.2.15.44120: Flags [P.], seq 1636691:1640813, ack 869, win 65535, length 4122
19:57:42.268233 IP 151.101.117.164.443 > 10.0.2.15.44120: Flags [P.], seq 1640813:1642187, ack 869, win 65535, length 1374
19:57:42.268235 IP 151.101.117.164.443 > 10.0.2.15.44120: Flags [P.], seq 1642187:1646309, ack 869, win 65535, length 4122
19:57:42.268362 IP 151.101.117.164.443 > 10.0.2.15.44120: Flags [P.], seq 1646309:1649057, ack 869, win 65535, length 2748
19:57:42.268455 IP 151.101.117.164.443 > 10.0.2.15.44120: Flags [P.], seq 1649057:1651805, ack 869, win 65535, length 2748
19:57:42.268538 IP 10.0.2.15.44120 > 151.101.117.164.443: Flags [.], ack 1651805, win 65535, length 0
19:57:42.269679 IP 151.101.117.164.443 > 10.0.2.15.44120: Flags [P.], seq 1651805:1658675, ack 869, win 65535, length 6870
19:57:42.269684 IP 151.101.117.164.443 > 10.0.2.15.44120: Flags [P.], seq 1658675:1660049, ack 869, win 65535, length 1374
19:57:42.269754 IP 10.0.2.15.44120 > 151.101.117.164.443: Flags [.], ack 1658675, win 65535, length 0
19:57:42.270319 IP 151.101.117.164.443 > 10.0.2.15.44120: Flags [P.], seq 1660049:1662797, ack 869, win 65535, length 2748
19:57:42.270321 IP 151.101.117.164.443 > 10.0.2.15.44120: Flags [P.], seq 1662797:1665545, ack 869, win 65535, length 2748
19:57:42.270322 IP 151.101.117.164.443 > 10.0.2.15.44120: Flags [P.], seq 1665545:1671041, ack 869, win 65535, length 5496
19:57:42.270358 IP 151.101.117.164.443 > 10.0.2.15.44120: Flags [P.], seq 1671041:1672415, ack 869, win 65535, length 1374
19:57:42.270635 IP 151.101.117.164.443 > 10.0.2.15.44120: Flags [P.], seq 1672415:1675163, ack 869, win 65535, length 2748
19:57:42.270850 IP 151.101.117.164.443 > 10.0.2.15.44120: Flags [P.], seq 1675163:1677911, ack 869, win 65535, length 2748
19:57:42.270905 IP 151.101.117.164.443 > 10.0.2.15.44120: Flags [P.], seq 1677911:1680659, ack 869, win 65535, length 2748
19:57:42.270906 IP 151.101.117.164.443 > 10.0.2.15.44120: Flags [P.], seq 1680659:1682033, ack 869, win 65535, length 1374
19:57:42.271134 IP 151.101.117.164.443 > 10.0.2.15.44120: Flags [P.], seq 1682033:1684781, ack 869, win 65535, length 2748
19:57:42.271307 IP 151.101.117.164.443 > 10.0.2.15.44120: Flags [P.], seq 1684781:1687529, ack 869, win 65535, length 2748
19:57:42.271310 IP 151.101.117.164.443 > 10.0.2.15.44120: Flags [P.], seq 1687529:1688903, ack 869, win 65535, length 1374
19:57:42.271347 IP 10.0.2.15.44120 > 151.101.117.164.443: Flags [.], ack 1682033, win 65535, length 0
19:57:42.271522 IP 151.101.117.164.443 > 10.0.2.15.44120: Flags [P.], seq 1688903:1691651, ack 869, win 65535, length 2748
19:57:42.271842 IP 151.101.117.164.443 > 10.0.2.15.44120: Flags [P.], seq 1691651:1694399, ack 869, win 65535, length 2748
19:57:42.271844 IP 151.101.117.164.443 > 10.0.2.15.44120: Flags [P.], seq 1694399:1698521, ack 869, win 65535, length 4122
19:57:42.271932 IP 10.0.2.15.44120 > 151.101.117.164.443: Flags [.], ack 1698521, win 65535, length 0
19:57:42.272218 IP 151.101.117.164.443 > 10.0.2.15.44120: Flags [P.], seq 1698521:1702643, ack 869, win 65535, length 4122
19:57:42.272231 IP 10.0.2.15.44120 > 151.101.117.164.443: Flags [.], ack 1702643, win 65535, length 0
19:57:42.272372 IP 151.101.117.164.443 > 10.0.2.15.44120: Flags [P.], seq 1702643:1706765, ack 869, win 65535, length 4122
19:57:42.272479 IP 10.0.2.15.44120 > 151.101.117.164.443: Flags [.], ack 1706765, win 65535, length 0
19:57:42.272675 IP 151.101.117.164.443 > 10.0.2.15.44120: Flags [P.], seq 1706765:1708139, ack 869, win 65535, length 1374

