13:20:28.201345 IP 151.101.117.164.443 > 10.0.2.15.42648: Flags [S.], seq 76096001, ack 3596002795, win 65535, options [mss 1460], length 0
13:20:28.201403 IP 10.0.2.15.42648 > 151.101.117.164.443: Flags [.], ack 1, win 64240, length 0
13:20:28.213317 IP 10.0.2.15.42648 > 151.101.117.164.443: Flags [P.], seq 1:518, ack 1, win 64240, length 517
13:20:28.214044 IP 151.101.117.164.443 > 10.0.2.15.42648: Flags [.], ack 518, win 65535, length 0
13:20:28.232392 IP 151.101.117.164.443 > 10.0.2.15.42648: Flags [.], seq 1:2921, ack 518, win 65535, length 2920
13:20:28.232414 IP 10.0.2.15.42648 > 151.101.117.164.443: Flags [.], ack 2921, win 62780, length 0
13:20:28.232776 IP 151.101.117.164.443 > 10.0.2.15.42648: Flags [P.], seq 2921:5497, ack 518, win 65535, length 2576
13:20:28.232788 IP 10.0.2.15.42648 > 151.101.117.164.443: Flags [.], ack 5497, win 62780, length 0
13:20:28.234240 IP 151.101.117.164.443 > 10.0.2.15.42648: Flags [P.], seq 5497:5607, ack 518, win 65535, length 110
13:20:28.234272 IP 10.0.2.15.42648 > 151.101.117.164.443: Flags [.], ack 5607, win 62780, length 0
13:20:28.235408 IP 10.0.2.15.42648 > 151.101.117.164.443: Flags [P.], seq 518:611, ack 5607, win 62780, length 93
13:20:28.236081 IP 151.101.117.164.443 > 10.0.2.15.42648: Flags [.], ack 611, win 65535, length 0
13:20:28.251727 IP 151.101.117.164.443 > 10.0.2.15.42648: Flags [P.], seq 5607:5658, ack 611, win 65535, length 51
13:20:28.251751 IP 10.0.2.15.42648 > 151.101.117.164.443: Flags [.], ack 5658, win 62780, length 0
13:20:28.252275 IP 10.0.2.15.42648 > 151.101.117.164.443: Flags [P.], seq 611:664, ack 5658, win 62780, length 53
13:20:28.252436 IP 10.0.2.15.42648 > 151.101.117.164.443: Flags [P.], seq 664:720, ack 5658, win 62780, length 56
13:20:28.252669 IP 151.101.117.164.443 > 10.0.2.15.42648: Flags [.], ack 664, win 65535, length 0
13:20:28.252670 IP 151.101.117.164.443 > 10.0.2.15.42648: Flags [.], ack 720, win 65535, length 0
13:20:28.252691 IP 10.0.2.15.42648 > 151.101.117.164.443: Flags [P.], seq 720:831, ack 5658, win 62780, length 111
13:20:28.252861 IP 151.101.117.164.443 > 10.0.2.15.42648: Flags [.], ack 831, win 65535, length 0
13:20:28.266925 IP 151.101.117.164.443 > 10.0.2.15.42648: Flags [P.], seq 5658:5753, ack 831, win 65535, length 95
13:20:28.266954 IP 10.0.2.15.42648 > 151.101.117.164.443: Flags [.], ack 5753, win 62780, length 0
13:20:28.267308 IP 10.0.2.15.42648 > 151.101.117.164.443: Flags [P.], seq 831:869, ack 5753, win 62780, length 38
13:20:28.267923 IP 151.101.117.164.443 > 10.0.2.15.42648: Flags [.], ack 869, win 65535, length 0
13:20:28.272059 IP 151.101.117.164.443 > 10.0.2.15.42648: Flags [P.], seq 5753:7127, ack 869, win 65535, length 1374
13:20:28.272738 IP 151.101.117.164.443 > 10.0.2.15.42648: Flags [P.], seq 7127:11249, ack 869, win 65535, length 4122
13:20:28.272824 IP 10.0.2.15.42648 > 151.101.117.164.443: Flags [.], ack 11249, win 61320, length 0
13:20:28.273939 IP 151.101.117.164.443 > 10.0.2.15.42648: Flags [P.], seq 11249:12623, ack 869, win 65535, length 1374
13:20:28.274931 IP 151.101.117.164.443 > 10.0.2.15.42648: Flags [P.], seq 12623:18119, ack 869, win 65535, length 5496
13:20:28.274950 IP 10.0.2.15.42648 > 151.101.117.164.443: Flags [.], ack 18119, win 61320, length 0
13:20:28.275925 IP 151.101.117.164.443 > 10.0.2.15.42648: Flags [P.], seq 18119:20867, ack 869, win 65535, length 2748
13:20:28.275941 IP 10.0.2.15.42648 > 151.101.117.164.443: Flags [.], ack 20867, win 62780, length 0
13:20:28.276862 IP 151.101.117.164.443 > 10.0.2.15.42648: Flags [P.], seq 20867:24989, ack 869, win 65535, length 4122
13:20:28.276950 IP 10.0.2.15.42648 > 151.101.117.164.443: Flags [.], ack 24989, win 61320, length 0
13:20:28.277976 IP 151.101.117.164.443 > 10.0.2.15.42648: Flags [P.], seq 24989:29111, ack 869, win 65535, length 4122
13:20:28.277997 IP 10.0.2.15.42648 > 151.101.117.164.443: Flags [.], ack 29111, win 61320, length 0
13:20:28.279590 IP 151.101.117.164.443 > 10.0.2.15.42648: Flags [P.], seq 29111:31859, ack 869, win 65535, length 2748
13:20:28.279610 IP 10.0.2.15.42648 > 151.101.117.164.443: Flags [.], ack 31859, win 62780, length 0
13:20:28.279946 IP 151.101.117.164.443 > 10.0.2.15.42648: Flags [P.], seq 31859:34607, ack 869, win 65535, length 2748
13:20:28.279991 IP 10.0.2.15.42648 > 151.101.117.164.443: Flags [.], ack 34607, win 61320, length 0
13:20:28.281600 IP 151.101.117.164.443 > 10.0.2.15.42648: Flags [P.], seq 34607:40103, ack 869, win 65535, length 5496
13:20:28.281637 IP 10.0.2.15.42648 > 151.101.117.164.443: Flags [.], ack 40103, win 61320, length 0
13:20:28.282602 IP 151.101.117.164.443 > 10.0.2.15.42648: Flags [P.], seq 40103:45599, ack 869, win 65535, length 5496
13:20:28.282628 IP 10.0.2.15.42648 > 151.101.117.164.443: Flags [.], ack 45599, win 61320, length 0
13:20:28.283466 IP 151.101.117.164.443 > 10.0.2.15.42648: Flags [P.], seq 45599:48347, ack 869, win 65535, length 2748
13:20:28.283484 IP 10.0.2.15.42648 > 151.101.117.164.443: Flags [.], ack 48347, win 62780, length 0
13:20:28.284689 IP 151.101.117.164.443 > 10.0.2.15.42648: Flags [P.], seq 48347:49721, ack 869, win 65535, length 1374
13:20:28.287296 IP 151.101.117.164.443 > 10.0.2.15.42648: Flags [P.], seq 49721:60713, ack 869, win 65535, length 10992
13:20:28.287486 IP 10.0.2.15.42648 > 151.101.117.164.443: Flags [.], ack 60713, win 56940, length 0
13:20:28.287714 IP 151.101.117.164.443 > 10.0.2.15.42648: Flags [P.], seq 60713:66209, ack 869, win 65535, length 5496
13:20:28.287778 IP 10.0.2.15.42648 > 151.101.117.164.443: Flags [.], ack 66209, win 52560, length 0
13:20:28.288849 IP 151.101.117.164.443 > 10.0.2.15.42648: Flags [P.], seq 66209:73079, ack 869, win 65535, length 6870
13:20:28.288864 IP 10.0.2.15.42648 > 151.101.117.164.443: Flags [.], ack 73079, win 59860, length 0
13:20:28.289876 IP 151.101.117.164.443 > 10.0.2.15.42648: Flags [P.], seq 73079:79949, ack 869, win 65535, length 6870
13:20:28.289892 IP 10.0.2.15.42648 > 151.101.117.164.443: Flags [.], ack 79949, win 65535, length 0
13:20:28.291214 IP 151.101.117.164.443 > 10.0.2.15.42648: Flags [P.], seq 79949:88193, ack 869, win 65535, length 8244
13:20:28.291229 IP 10.0.2.15.42648 > 151.101.117.164.443: Flags [.], ack 88193, win 65535, length 0
13:20:28.292120 IP 151.101.117.164.443 > 10.0.2.15.42648: Flags [P.], seq 88193:93689, ack 869, win 65535, length 5496
13:20:28.292140 IP 10.0.2.15.42648 > 151.101.117.164.443: Flags [.], ack 93689, win 65535, length 0
13:20:28.293800 IP 151.101.117.164.443 > 10.0.2.15.42648: Flags [P.], seq 93689:103307, ack 869, win 65535, length 9618
13:20:28.293822 IP 10.0.2.15.42648 > 151.101.117.164.443: Flags [.], ack 103307, win 65535, length 0
13:20:28.294955 IP 151.101.117.164.443 > 10.0.2.15.42648: Flags [P.], seq 103307:107429, ack 869, win 65535, length 4122
13:20:28.294971 IP 10.0.2.15.42648 > 151.101.117.164.443: Flags [.], ack 107429, win 65535, length 0
13:20:28.295285 IP 151.101.117.164.443 > 10.0.2.15.42648: Flags [P.], seq 107429:114299, ack 869, win 65535, length 6870
13:20:28.295295 IP 10.0.2.15.42648 > 151.101.117.164.443: Flags [.], ack 114299, win 65535, length 0
13:20:28.296726 IP 151.101.117.164.443 > 10.0.2.15.42648: Flags [P.], seq 114299:128039, ack 869, win 65535, length 13740
13:20:28.296741 IP 10.0.2.15.42648 > 151.101.117.164.443: Flags [.], ack 128039, win 65535, length 0
13:20:28.296782 IP 151.101.117.164.443 > 10.0.2.15.42648: Flags [P.], seq 128039:132161, ack 869, win 65535, length 4122
13:20:28.296792 IP 10.0.2.15.42648 > 151.101.117.164.443: Flags [.], ack 132161, win 65535, length 0
13:20:28.298231 IP 151.101.117.164.443 > 10.0.2.15.42648: Flags [P.], seq 132161:133535, ack 869, win 65535, length 1374
13:20:28.299469 IP 151.101.117.164.443 > 10.0.2.15.42648: Flags [P.], seq 133535:137657, ack 869, win 65535, length 4122
13:20:28.299486 IP 10.0.2.15.42648 > 151.101.117.164.443: Flags [.], ack 137657, win 65535, length 0
13:20:28.299813 IP 151.101.117.164.443 > 10.0.2.15.42648: Flags [P.], seq 137657:148649, ack 869, win 65535, length 10992
13:20:28.299846 IP 10.0.2.15.42648 > 151.101.117.164.443: Flags [.], ack 148649, win 65535, length 0
13:20:28.300967 IP 151.101.117.164.443 > 10.0.2.15.42648: Flags [P.], seq 148649:159641, ack 869, win 65535, length 10992
13:20:28.300986 IP 10.0.2.15.42648 > 151.101.117.164.443: Flags [.], ack 159641, win 65535, length 0
13:20:28.302194 IP 151.101.117.164.443 > 10.0.2.15.42648: Flags [P.], seq 159641:173381, ack 869, win 65535, length 13740
13:20:28.302210 IP 10.0.2.15.42648 > 151.101.117.164.443: Flags [.], ack 173381, win 65535, length 0
13:20:28.302521 IP 151.101.117.164.443 > 10.0.2.15.42648: Flags [P.], seq 173381:174755, ack 869, win 65535, length 1374
13:20:28.303855 IP 151.101.117.164.443 > 10.0.2.15.42648: Flags [P.], seq 174755:182999, ack 869, win 65535, length 8244
13:20:28.303871 IP 10.0.2.15.42648 > 151.101.117.164.443: Flags [.], ack 182999, win 65535, length 0
13:20:28.304239 IP 151.101.117.164.443 > 10.0.2.15.42648: Flags [P.], seq 182999:192617, ack 869, win 65535, length 9618
13:20:28.304253 IP 10.0.2.15.42648 > 151.101.117.164.443: Flags [.], ack 192617, win 65535, length 0
13:20:28.304486 IP 151.101.117.164.443 > 10.0.2.15.42648: Flags [P.], seq 192617:198113, ack 869, win 65535, length 5496
13:20:28.304496 IP 10.0.2.15.42648 > 151.101.117.164.443: Flags [.], ack 198113, win 65535, length 0
13:20:28.305484 IP 151.101.117.164.443 > 10.0.2.15.42648: Flags [P.], seq 198113:204983, ack 869, win 65535, length 6870
13:20:28.305592 IP 10.0.2.15.42648 > 151.101.117.164.443: Flags [.], ack 204983, win 65535, length 0
13:20:28.305840 IP 151.101.117.164.443 > 10.0.2.15.42648: Flags [P.], seq 204983:214601, ack 869, win 65535, length 9618
13:20:28.305852 IP 10.0.2.15.42648 > 151.101.117.164.443: Flags [.], ack 214601, win 65535, length 0
13:20:28.306007 IP 151.101.117.164.443 > 10.0.2.15.42648: Flags [P.], seq 214601:221471, ack 869, win 65535, length 6870
13:20:28.306018 IP 10.0.2.15.42648 > 151.101.117.164.443: Flags [.], ack 221471, win 65535, length 0
13:20:28.307748 IP 151.101.117.164.443 > 10.0.2.15.42648: Flags [P.], seq 221471:228341, ack 869, win 65535, length 6870
13:20:28.307764 IP 10.0.2.15.42648 > 151.101.117.164.443: Flags [.], ack 228341, win 65535, length 0
13:20:28.308367 IP 151.101.117.164.443 > 10.0.2.15.42648: Flags [P.], seq 228341:237959, ack 869, win 65535, length 9618
13:20:28.308532 IP 10.0.2.15.42648 > 151.101.117.164.443: Flags [.], ack 237959, win 65535, length 0
13:20:28.308656 IP 151.101.117.164.443 > 10.0.2.15.42648: Flags [P.], seq 237959:246203, ack 869, win 65535, length 8244
13:20:28.308663 IP 10.0.2.15.42648 > 151.101.117.164.443: Flags [.], ack 246203, win 65535, length 0
13:20:28.309730 IP 151.101.117.164.443 > 10.0.2.15.42648: Flags [P.], seq 246203:258569, ack 869, win 65535, length 12366
13:20:28.309745 IP 10.0.2.15.42648 > 151.101.117.164.443: Flags [.], ack 258569, win 65535, length 0
13:20:28.311425 IP 151.101.117.164.443 > 10.0.2.15.42648: Flags [P.], seq 258569:268187, ack 869, win 65535, length 9618
13:20:28.311452 IP 10.0.2.15.42648 > 151.101.117.164.443: Flags [.], ack 268187, win 65535, length 0
13:20:28.312190 IP 151.101.117.164.443 > 10.0.2.15.42648: Flags [P.], seq 268187:269561, ack 869, win 65535, length 1374
13:20:28.313233 IP 151.101.117.164.443 > 10.0.2.15.42648: Flags [P.], seq 269561:275057, ack 869, win 65535, length 5496
13:20:28.313249 IP 10.0.2.15.42648 > 151.101.117.164.443: Flags [.], ack 275057, win 65535, length 0
13:20:28.313644 IP 151.101.117.164.443 > 10.0.2.15.42648: Flags [P.], seq 275057:286049, ack 869, win 65535, length 10992
13:20:28.313658 IP 10.0.2.15.42648 > 151.101.117.164.443: Flags [.], ack 286049, win 65535, length 0
13:20:28.313908 IP 151.101.117.164.443 > 10.0.2.15.42648: Flags [P.], seq 286049:288797, ack 869, win 65535, length 2748
13:20:28.313919 IP 10.0.2.15.42648 > 151.101.117.164.443: Flags [.], ack 288797, win 65535, length 0
13:20:28.315112 IP 151.101.117.164.443 > 10.0.2.15.42648: Flags [P.], seq 288797:294293, ack 869, win 65535, length 5496
13:20:28.315128 IP 10.0.2.15.42648 > 151.101.117.164.443: Flags [.], ack 294293, win 65535, length 0
13:20:28.315702 IP 151.101.117.164.443 > 10.0.2.15.42648: Flags [P.], seq 294293:302537, ack 869, win 65535, length 8244
13:20:28.315715 IP 10.0.2.15.42648 > 151.101.117.164.443: Flags [.], ack 302537, win 65535, length 0
13:20:28.315824 IP 151.101.117.164.443 > 10.0.2.15.42648: Flags [P.], seq 302537:310781, ack 869, win 65535, length 8244
13:20:28.315830 IP 10.0.2.15.42648 > 151.101.117.164.443: Flags [.], ack 310781, win 65535, length 0
13:20:28.317262 IP 151.101.117.164.443 > 10.0.2.15.42648: Flags [P.], seq 310781:316277, ack 869, win 65535, length 5496
13:20:28.317281 IP 10.0.2.15.42648 > 151.101.117.164.443: Flags [.], ack 316277, win 65535, length 0
13:20:28.317514 IP 151.101.117.164.443 > 10.0.2.15.42648: Flags [P.], seq 316277:323147, ack 869, win 65535, length 6870
13:20:28.317526 IP 10.0.2.15.42648 > 151.101.117.164.443: Flags [.], ack 323147, win 65535, length 0
13:20:28.318825 IP 151.101.117.164.443 > 10.0.2.15.42648: Flags [P.], seq 323147:332765, ack 869, win 65535, length 9618
13:20:28.318842 IP 10.0.2.15.42648 > 151.101.117.164.443: Flags [.], ack 332765, win 65535, length 0
13:20:28.319760 IP 151.101.117.164.443 > 10.0.2.15.42648: Flags [P.], seq 332765:343757, ack 869, win 65535, length 10992
13:20:28.319775 IP 10.0.2.15.42648 > 151.101.117.164.443: Flags [.], ack 343757, win 65535, length 0
13:20:28.320203 IP 151.101.117.164.443 > 10.0.2.15.42648: Flags [P.], seq 343757:352001, ack 869, win 65535, length 8244
13:20:28.320216 IP 10.0.2.15.42648 > 151.101.117.164.443: Flags [.], ack 352001, win 65535, length 0
13:20:28.320494 IP 151.101.117.164.443 > 10.0.2.15.42648: Flags [P.], seq 352001:354749, ack 869, win 65535, length 2748
13:20:28.320521 IP 10.0.2.15.42648 > 151.101.117.164.443: Flags [.], ack 354749, win 65535, length 0
13:20:28.321832 IP 151.101.117.164.443 > 10.0.2.15.42648: Flags [P.], seq 354749:364367, ack 869, win 65535, length 9618
13:20:28.321849 IP 10.0.2.15.42648 > 151.101.117.164.443: Flags [.], ack 364367, win 65535, length 0
13:20:28.322273 IP 151.101.117.164.443 > 10.0.2.15.42648: Flags [P.], seq 364367:371237, ack 869, win 65535, length 6870
13:20:28.322276 IP 151.101.117.164.443 > 10.0.2.15.42648: Flags [P.], seq 371237:376733, ack 869, win 65535, length 5496
13:20:28.322332 IP 10.0.2.15.42648 > 151.101.117.164.443: Flags [.], ack 371237, win 65535, length 0
13:20:28.322359 IP 10.0.2.15.42648 > 151.101.117.164.443: Flags [.], ack 376733, win 65535, length 0
13:20:28.323869 IP 151.101.117.164.443 > 10.0.2.15.42648: Flags [P.], seq 376733:384977, ack 869, win 65535, length 8244
13:20:28.323888 IP 10.0.2.15.42648 > 151.101.117.164.443: Flags [.], ack 384977, win 65535, length 0
13:20:28.324247 IP 151.101.117.164.443 > 10.0.2.15.42648: Flags [P.], seq 384977:397343, ack 869, win 65535, length 12366
13:20:28.324273 IP 10.0.2.15.42648 > 151.101.117.164.443: Flags [.], ack 397343, win 65535, length 0
13:20:28.324604 IP 151.101.117.164.443 > 10.0.2.15.42648: Flags [P.], seq 397343:401465, ack 869, win 65535, length 4122
13:20:28.324616 IP 10.0.2.15.42648 > 151.101.117.164.443: Flags [.], ack 401465, win 65535, length 0
13:20:28.325791 IP 151.101.117.164.443 > 10.0.2.15.42648: Flags [P.], seq 401465:405587, ack 869, win 65535, length 4122
13:20:28.325846 IP 10.0.2.15.42648 > 151.101.117.164.443: Flags [.], ack 405587, win 65535, length 0
13:20:28.326303 IP 151.101.117.164.443 > 10.0.2.15.42648: Flags [P.], seq 405587:415205, ack 869, win 65535, length 9618
13:20:28.326305 IP 151.101.117.164.443 > 10.0.2.15.42648: Flags [P.], seq 415205:419327, ack 869, win 65535, length 4122
13:20:28.326319 IP 10.0.2.15.42648 > 151.101.117.164.443: Flags [.], ack 415205, win 65535, length 0
13:20:28.326375 IP 10.0.2.15.42648 > 151.101.117.164.443: Flags [.], ack 419327, win 65535, length 0
13:20:28.327937 IP 151.101.117.164.443 > 10.0.2.15.42648: Flags [P.], seq 419327:427571, ack 869, win 65535, length 8244
13:20:28.327939 IP 151.101.117.164.443 > 10.0.2.15.42648: Flags [P.], seq 427571:430319, ack 869, win 65535, length 2748
13:20:28.327996 IP 10.0.2.15.42648 > 151.101.117.164.443: Flags [.], ack 427571, win 65535, length 0
13:20:28.328025 IP 10.0.2.15.42648 > 151.101.117.164.443: Flags [.], ack 430319, win 65535, length 0
13:20:28.329187 IP 151.101.117.164.443 > 10.0.2.15.42648: Flags [P.], seq 430319:441311, ack 869, win 65535, length 10992
13:20:28.329207 IP 10.0.2.15.42648 > 151.101.117.164.443: Flags [.], ack 441311, win 65535, length 0
13:20:28.329490 IP 151.101.117.164.443 > 10.0.2.15.42648: Flags [P.], seq 441311:446807, ack 869, win 65535, length 5496
13:20:28.329506 IP 10.0.2.15.42648 > 151.101.117.164.443: Flags [.], ack 446807, win 65535, length 0
13:20:28.329992 IP 151.101.117.164.443 > 10.0.2.15.42648: Flags [P.], seq 446807:453677, ack 869, win 65535, length 6870
13:20:28.330005 IP 10.0.2.15.42648 > 151.101.117.164.443: Flags [.], ack 453677, win 65535, length 0
13:20:28.331822 IP 151.101.117.164.443 > 10.0.2.15.42648: Flags [P.], seq 453677:467417, ack 869, win 65535, length 13740
13:20:28.331839 IP 10.0.2.15.42648 > 151.101.117.164.443: Flags [.], ack 467417, win 65535, length 0
13:20:28.331886 IP 151.101.117.164.443 > 10.0.2.15.42648: Flags [P.], seq 467417:475661, ack 869, win 65535, length 8244
13:20:28.331892 IP 10.0.2.15.42648 > 151.101.117.164.443: Flags [.], ack 475661, win 65535, length 0
13:20:28.333399 IP 151.101.117.164.443 > 10.0.2.15.42648: Flags [P.], seq 475661:479783, ack 869, win 65535, length 4122
13:20:28.333417 IP 10.0.2.15.42648 > 151.101.117.164.443: Flags [.], ack 479783, win 65535, length 0
13:20:28.333732 IP 151.101.117.164.443 > 10.0.2.15.42648: Flags [P.], seq 479783:489401, ack 869, win 65535, length 9618
13:20:28.333743 IP 10.0.2.15.42648 > 151.101.117.164.443: Flags [.], ack 489401, win 65535, length 0
13:20:28.334294 IP 151.101.117.164.443 > 10.0.2.15.42648: Flags [P.], seq 489401:503141, ack 869, win 65535, length 13740
13:20:28.334311 IP 10.0.2.15.42648 > 151.101.117.164.443: Flags [.], ack 503141, win 65535, length 0
13:20:28.334716 IP 151.101.117.164.443 > 10.0.2.15.42648: Flags [P.], seq 503141:507263, ack 869, win 65535, length 4122
13:20:28.334731 IP 10.0.2.15.42648 > 151.101.117.164.443: Flags [.], ack 507263, win 65535, length 0
13:20:28.336230 IP 151.101.117.164.443 > 10.0.2.15.42648: Flags [P.], seq 507263:519629, ack 869, win 65535, length 12366
13:20:28.336247 IP 10.0.2.15.42648 > 151.101.117.164.443: Flags [.], ack 519629, win 65535, length 0
13:20:28.336376 IP 151.101.117.164.443 > 10.0.2.15.42648: Flags [P.], seq 519629:521003, ack 869, win 65535, length 1374
13:20:28.337871 IP 151.101.117.164.443 > 10.0.2.15.42648: Flags [P.], seq 521003:525125, ack 869, win 65535, length 4122
13:20:28.337889 IP 10.0.2.15.42648 > 151.101.117.164.443: Flags [.], ack 525125, win 65535, length 0
13:20:28.340459 IP 151.101.117.164.443 > 10.0.2.15.42648: Flags [P.], seq 525125:533369, ack 869, win 65535, length 8244
13:20:28.340475 IP 10.0.2.15.42648 > 151.101.117.164.443: Flags [.], ack 533369, win 65535, length 0
13:20:28.342309 IP 151.101.117.164.443 > 10.0.2.15.42648: Flags [P.], seq 533369:551231, ack 869, win 65535, length 17862
13:20:28.342475 IP 10.0.2.15.42648 > 151.101.117.164.443: Flags [.], ack 551231, win 65535, length 0
13:20:28.342680 IP 151.101.117.164.443 > 10.0.2.15.42648: Flags [P.], seq 551231:562223, ack 869, win 65535, length 10992
13:20:28.342693 IP 10.0.2.15.42648 > 151.101.117.164.443: Flags [.], ack 562223, win 65535, length 0
13:20:28.342860 IP 151.101.117.164.443 > 10.0.2.15.42648: Flags [.], seq 562223:570983, ack 869, win 65535, length 8760
13:20:28.342871 IP 10.0.2.15.42648 > 151.101.117.164.443: Flags [.], ack 570983, win 65535, length 0
13:20:28.343057 IP 151.101.117.164.443 > 10.0.2.15.42648: Flags [P.], seq 570983:571841, ack 869, win 65535, length 858
13:20:28.343433 IP 151.101.117.164.443 > 10.0.2.15.42648: Flags [P.], seq 571841:581459, ack 869, win 65535, length 9618
13:20:28.343446 IP 10.0.2.15.42648 > 151.101.117.164.443: Flags [.], ack 581459, win 65535, length 0
13:20:28.343759 IP 151.101.117.164.443 > 10.0.2.15.42648: Flags [P.], seq 581459:585581, ack 869, win 65535, length 4122
13:20:28.343769 IP 10.0.2.15.42648 > 151.101.117.164.443: Flags [.], ack 585581, win 65535, length 0
13:20:28.344590 IP 151.101.117.164.443 > 10.0.2.15.42648: Flags [P.], seq 585581:593825, ack 869, win 65535, length 8244
13:20:28.344605 IP 10.0.2.15.42648 > 151.101.117.164.443: Flags [.], ack 593825, win 65535, length 0
13:20:28.344906 IP 151.101.117.164.443 > 10.0.2.15.42648: Flags [P.], seq 593825:604817, ack 869, win 65535, length 10992
13:20:28.344919 IP 10.0.2.15.42648 > 151.101.117.164.443: Flags [.], ack 604817, win 65535, length 0
13:20:28.345241 IP 151.101.117.164.443 > 10.0.2.15.42648: Flags [P.], seq 604817:608939, ack 869, win 65535, length 4122
13:20:28.345255 IP 10.0.2.15.42648 > 151.101.117.164.443: Flags [.], ack 608939, win 65535, length 0
13:20:28.346191 IP 151.101.117.164.443 > 10.0.2.15.42648: Flags [P.], seq 608939:617183, ack 869, win 65535, length 8244
13:20:28.346270 IP 10.0.2.15.42648 > 151.101.117.164.443: Flags [.], ack 617183, win 65535, length 0
13:20:28.346424 IP 151.101.117.164.443 > 10.0.2.15.42648: Flags [.], seq 617183:618643, ack 869, win 65535, length 1460
13:20:28.346682 IP 151.101.117.164.443 > 10.0.2.15.42648: Flags [P.], seq 618643:625427, ack 869, win 65535, length 6784
13:20:28.346692 IP 10.0.2.15.42648 > 151.101.117.164.443: Flags [.], ack 625427, win 65535, length 0
13:20:28.347475 IP 151.101.117.164.443 > 10.0.2.15.42648: Flags [P.], seq 625427:636419, ack 869, win 65535, length 10992
13:20:28.347492 IP 10.0.2.15.42648 > 151.101.117.164.443: Flags [.], ack 636419, win 65535, length 0
13:20:28.348684 IP 151.101.117.164.443 > 10.0.2.15.42648: Flags [P.], seq 636419:647411, ack 869, win 65535, length 10992
13:20:28.348702 IP 10.0.2.15.42648 > 151.101.117.164.443: Flags [.], ack 647411, win 65535, length 0
13:20:28.348909 IP 151.101.117.164.443 > 10.0.2.15.42648: Flags [P.], seq 647411:655655, ack 869, win 65535, length 8244
13:20:28.348918 IP 10.0.2.15.42648 > 151.101.117.164.443: Flags [.], ack 655655, win 65535, length 0
13:20:28.349187 IP 151.101.117.164.443 > 10.0.2.15.42648: Flags [P.], seq 655655:661151, ack 869, win 65535, length 5496
13:20:28.349195 IP 10.0.2.15.42648 > 151.101.117.164.443: Flags [.], ack 661151, win 65535, length 0
13:20:28.350698 IP 151.101.117.164.443 > 10.0.2.15.42648: Flags [P.], seq 661151:672143, ack 869, win 65535, length 10992
13:20:28.350763 IP 10.0.2.15.42648 > 151.101.117.164.443: Flags [.], ack 672143, win 65535, length 0
13:20:28.350986 IP 151.101.117.164.443 > 10.0.2.15.42648: Flags [P.], seq 672143:677639, ack 869, win 65535, length 5496
13:20:28.350995 IP 10.0.2.15.42648 > 151.101.117.164.443: Flags [.], ack 677639, win 65535, length 0
13:20:28.353704 IP 151.101.117.164.443 > 10.0.2.15.42648: Flags [P.], seq 677639:684509, ack 869, win 65535, length 6870
13:20:28.353720 IP 10.0.2.15.42648 > 151.101.117.164.443: Flags [.], ack 684509, win 65535, length 0
13:20:28.353981 IP 151.101.117.164.443 > 10.0.2.15.42648: Flags [P.], seq 684509:685883, ack 869, win 65535, length 1374
13:20:28.354916 IP 151.101.117.164.443 > 10.0.2.15.42648: Flags [P.], seq 685883:687257, ack 869, win 65535, length 1374
13:20:28.354930 IP 10.0.2.15.42648 > 151.101.117.164.443: Flags [.], ack 687257, win 65535, length 0
13:20:28.357005 IP 151.101.117.164.443 > 10.0.2.15.42648: Flags [P.], seq 687257:691379, ack 869, win 65535, length 4122
13:20:28.357025 IP 10.0.2.15.42648 > 151.101.117.164.443: Flags [.], ack 691379, win 65535, length 0
13:20:28.357401 IP 151.101.117.164.443 > 10.0.2.15.42648: Flags [P.], seq 691379:702371, ack 869, win 65535, length 10992
13:20:28.357422 IP 10.0.2.15.42648 > 151.101.117.164.443: Flags [.], ack 702371, win 65535, length 0
13:20:28.357718 IP 151.101.117.164.443 > 10.0.2.15.42648: Flags [P.], seq 702371:707867, ack 869, win 65535, length 5496
13:20:28.357756 IP 10.0.2.15.42648 > 151.101.117.164.443: Flags [.], ack 707867, win 65535, length 0
13:20:28.358182 IP 151.101.117.164.443 > 10.0.2.15.42648: Flags [P.], seq 707867:710615, ack 869, win 65535, length 2748
13:20:28.358199 IP 10.0.2.15.42648 > 151.101.117.164.443: Flags [.], ack 710615, win 65535, length 0
13:20:28.359247 IP 151.101.117.164.443 > 10.0.2.15.42648: Flags [P.], seq 710615:721607, ack 869, win 65535, length 10992
13:20:28.359321 IP 10.0.2.15.42648 > 151.101.117.164.443: Flags [.], ack 721607, win 65535, length 0
13:20:28.359510 IP 151.101.117.164.443 > 10.0.2.15.42648: Flags [P.], seq 721607:729851, ack 869, win 65535, length 8244
13:20:28.359539 IP 10.0.2.15.42648 > 151.101.117.164.443: Flags [.], ack 729851, win 65535, length 0
13:20:28.360062 IP 151.101.117.164.443 > 10.0.2.15.42648: Flags [P.], seq 729851:732599, ack 869, win 65535, length 2748
13:20:28.360077 IP 10.0.2.15.42648 > 151.101.117.164.443: Flags [.], ack 732599, win 65535, length 0
13:20:28.361037 IP 151.101.117.164.443 > 10.0.2.15.42648: Flags [P.], seq 732599:742217, ack 869, win 65535, length 9618
13:20:28.361186 IP 151.101.117.164.443 > 10.0.2.15.42648: Flags [P.], seq 742217:749087, ack 869, win 65535, length 6870
13:20:28.361772 IP 151.101.117.164.443 > 10.0.2.15.42648: Flags [P.], seq 749087:751835, ack 869, win 65535, length 2748
13:20:28.361775 IP 151.101.117.164.443 > 10.0.2.15.42648: Flags [P.], seq 751835:760079, ack 869, win 65535, length 8244
13:20:28.362162 IP 151.101.117.164.443 > 10.0.2.15.42648: Flags [P.], seq 760079:762827, ack 869, win 65535, length 2748
13:20:28.362586 IP 10.0.2.15.42648 > 151.101.117.164.443: Flags [.], ack 762827, win 65535, length 0
13:20:28.363605 IP 151.101.117.164.443 > 10.0.2.15.42648: Flags [P.], seq 762827:773819, ack 869, win 65535, length 10992
13:20:28.363671 IP 10.0.2.15.42648 > 151.101.117.164.443: Flags [.], ack 773819, win 65535, length 0
13:20:28.363955 IP 151.101.117.164.443 > 10.0.2.15.42648: Flags [P.], seq 773819:782063, ack 869, win 65535, length 8244
13:20:28.364018 IP 10.0.2.15.42648 > 151.101.117.164.443: Flags [.], ack 782063, win 65535, length 0
13:20:28.364560 IP 151.101.117.164.443 > 10.0.2.15.42648: Flags [P.], seq 782063:784811, ack 869, win 65535, length 2748
13:20:28.364572 IP 10.0.2.15.42648 > 151.101.117.164.443: Flags [.], ack 784811, win 65535, length 0
13:20:28.366998 IP 151.101.117.164.443 > 10.0.2.15.42648: Flags [P.], seq 784811:793055, ack 869, win 65535, length 8244
13:20:28.367094 IP 10.0.2.15.42648 > 151.101.117.164.443: Flags [.], ack 793055, win 65535, length 0
13:20:28.367532 IP 151.101.117.164.443 > 10.0.2.15.42648: Flags [P.], seq 793055:804047, ack 869, win 65535, length 10992
13:20:28.368053 IP 151.101.117.164.443 > 10.0.2.15.42648: Flags [P.], seq 804047:812291, ack 869, win 65535, length 8244
13:20:28.368196 IP 10.0.2.15.42648 > 151.101.117.164.443: Flags [.], ack 812291, win 65535, length 0
13:20:28.368525 IP 151.101.117.164.443 > 10.0.2.15.42648: Flags [.], seq 812291:822511, ack 869, win 65535, length 10220
13:20:28.368619 IP 10.0.2.15.42648 > 151.101.117.164.443: Flags [.], ack 822511, win 65535, length 0
13:20:28.370994 IP 151.101.117.164.443 > 10.0.2.15.42648: Flags [P.], seq 822511:823283, ack 869, win 65535, length 772
13:20:28.371279 IP 151.101.117.164.443 > 10.0.2.15.42648: Flags [P.], seq 823283:831527, ack 869, win 65535, length 8244
13:20:28.371285 IP 151.101.117.164.443 > 10.0.2.15.42648: Flags [P.], seq 831527:856259, ack 869, win 65535, length 24732
13:20:28.371305 IP 10.0.2.15.42648 > 151.101.117.164.443: Flags [.], ack 831527, win 65535, length 0
13:20:28.371409 IP 10.0.2.15.42648 > 151.101.117.164.443: Flags [.], ack 856259, win 65535, length 0
13:20:28.372458 IP 151.101.117.164.443 > 10.0.2.15.42648: Flags [P.], seq 856259:869999, ack 869, win 65535, length 13740
13:20:28.372473 IP 10.0.2.15.42648 > 151.101.117.164.443: Flags [.], ack 869999, win 65535, length 0
13:20:28.372672 IP 151.101.117.164.443 > 10.0.2.15.42648: Flags [P.], seq 869999:871373, ack 869, win 65535, length 1374
13:20:28.373428 IP 151.101.117.164.443 > 10.0.2.15.42648: Flags [P.], seq 871373:882365, ack 869, win 65535, length 10992
13:20:28.373524 IP 10.0.2.15.42648 > 151.101.117.164.443: Flags [.], ack 882365, win 65535, length 0
13:20:28.373694 IP 151.101.117.164.443 > 10.0.2.15.42648: Flags [P.], seq 882365:887861, ack 869, win 65535, length 5496
13:20:28.373753 IP 10.0.2.15.42648 > 151.101.117.164.443: Flags [.], ack 887861, win 65535, length 0
13:20:28.375640 IP 151.101.117.164.443 > 10.0.2.15.42648: Flags [P.], seq 887861:902975, ack 869, win 65535, length 15114
13:20:28.375654 IP 10.0.2.15.42648 > 151.101.117.164.443: Flags [.], ack 902975, win 65535, length 0
13:20:28.375859 IP 151.101.117.164.443 > 10.0.2.15.42648: Flags [P.], seq 902975:909845, ack 869, win 65535, length 6870
13:20:28.375919 IP 10.0.2.15.42648 > 151.101.117.164.443: Flags [.], ack 909845, win 65535, length 0
13:20:28.376260 IP 151.101.117.164.443 > 10.0.2.15.42648: Flags [P.], seq 909845:920837, ack 869, win 65535, length 10992
13:20:28.376311 IP 10.0.2.15.42648 > 151.101.117.164.443: Flags [.], ack 920837, win 65535, length 0
13:20:28.376689 IP 151.101.117.164.443 > 10.0.2.15.42648: Flags [P.], seq 920837:923585, ack 869, win 65535, length 2748
13:20:28.376738 IP 10.0.2.15.42648 > 151.101.117.164.443: Flags [.], ack 923585, win 65535, length 0
13:20:28.378160 IP 151.101.117.164.443 > 10.0.2.15.42648: Flags [P.], seq 923585:935951, ack 869, win 65535, length 12366
13:20:28.378539 IP 151.101.117.164.443 > 10.0.2.15.42648: Flags [P.], seq 935951:940073, ack 869, win 65535, length 4122
13:20:28.378601 IP 10.0.2.15.42648 > 151.101.117.164.443: Flags [.], ack 940073, win 65535, length 0
13:20:28.380621 IP 151.101.117.164.443 > 10.0.2.15.42648: Flags [P.], seq 940073:948317, ack 869, win 65535, length 8244
13:20:28.380636 IP 10.0.2.15.42648 > 151.101.117.164.443: Flags [.], ack 948317, win 65535, length 0
13:20:28.380809 IP 151.101.117.164.443 > 10.0.2.15.42648: Flags [P.], seq 948317:949691, ack 869, win 65535, length 1374
13:20:28.383392 IP 151.101.117.164.443 > 10.0.2.15.42648: Flags [P.], seq 949691:953813, ack 869, win 65535, length 4122
13:20:28.383527 IP 10.0.2.15.42648 > 151.101.117.164.443: Flags [.], ack 953813, win 65535, length 0
13:20:28.383768 IP 151.101.117.164.443 > 10.0.2.15.42648: Flags [P.], seq 953813:957935, ack 869, win 65535, length 4122
13:20:28.383902 IP 10.0.2.15.42648 > 151.101.117.164.443: Flags [.], ack 957935, win 65535, length 0
13:20:28.387693 IP 151.101.117.164.443 > 10.0.2.15.42648: Flags [P.], seq 957935:988163, ack 869, win 65535, length 30228
13:20:28.388525 IP 151.101.117.164.443 > 10.0.2.15.42648: Flags [P.], seq 988163:999155, ack 869, win 65535, length 10992
13:20:28.389559 IP 10.0.2.15.42648 > 151.101.117.164.443: Flags [.], ack 999155, win 65535, length 0
13:20:28.390357 IP 151.101.117.164.443 > 10.0.2.15.42648: Flags [P.], seq 999155:1032131, ack 869, win 65535, length 32976
13:20:28.390423 IP 10.0.2.15.42648 > 151.101.117.164.443: Flags [.], ack 1032131, win 65535, length 0
13:20:28.391127 IP 151.101.117.164.443 > 10.0.2.15.42648: Flags [P.], seq 1032131:1044497, ack 869, win 65535, length 12366
13:20:28.391176 IP 10.0.2.15.42648 > 151.101.117.164.443: Flags [.], ack 1044497, win 65535, length 0
13:20:28.391420 IP 151.101.117.164.443 > 10.0.2.15.42648: Flags [P.], seq 1044497:1051367, ack 869, win 65535, length 6870
13:20:28.391452 IP 10.0.2.15.42648 > 151.101.117.164.443: Flags [.], ack 1051367, win 65535, length 0
13:20:28.392688 IP 151.101.117.164.443 > 10.0.2.15.42648: Flags [P.], seq 1051367:1059611, ack 869, win 65535, length 8244
13:20:28.392703 IP 10.0.2.15.42648 > 151.101.117.164.443: Flags [.], ack 1059611, win 65535, length 0
13:20:28.393445 IP 151.101.117.164.443 > 10.0.2.15.42648: Flags [P.], seq 1059611:1069229, ack 869, win 65535, length 9618
13:20:28.393448 IP 151.101.117.164.443 > 10.0.2.15.42648: Flags [P.], seq 1069229:1074725, ack 869, win 65535, length 5496
13:20:28.393474 IP 151.101.117.164.443 > 10.0.2.15.42648: Flags [P.], seq 1074725:1076099, ack 869, win 65535, length 1374
13:20:28.393547 IP 10.0.2.15.42648 > 151.101.117.164.443: Flags [.], ack 1076099, win 65535, length 0
13:20:28.394483 IP 151.101.117.164.443 > 10.0.2.15.42648: Flags [P.], seq 1076099:1087091, ack 869, win 65535, length 10992
13:20:28.394502 IP 10.0.2.15.42648 > 151.101.117.164.443: Flags [.], ack 1087091, win 65535, length 0
13:20:28.394753 IP 151.101.117.164.443 > 10.0.2.15.42648: Flags [.], seq 1087091:1091471, ack 869, win 65535, length 4380
13:20:28.394766 IP 10.0.2.15.42648 > 151.101.117.164.443: Flags [.], ack 1091471, win 65535, length 0
13:20:28.394879 IP 151.101.117.164.443 > 10.0.2.15.42648: Flags [P.], seq 1091471:1095335, ack 869, win 65535, length 3864
13:20:28.394928 IP 10.0.2.15.42648 > 151.101.117.164.443: Flags [.], ack 1095335, win 65535, length 0
13:20:28.395406 IP 151.101.117.164.443 > 10.0.2.15.42648: Flags [P.], seq 1095335:1098083, ack 869, win 65535, length 2748
13:20:28.395420 IP 10.0.2.15.42648 > 151.101.117.164.443: Flags [.], ack 1098083, win 65535, length 0
13:20:28.395763 IP 151.101.117.164.443 > 10.0.2.15.42648: Flags [P.], seq 1098083:1104953, ack 869, win 65535, length 6870
13:20:28.395822 IP 10.0.2.15.42648 > 151.101.117.164.443: Flags [.], ack 1104953, win 65535, length 0
13:20:28.396194 IP 151.101.117.164.443 > 10.0.2.15.42648: Flags [P.], seq 1104953:1118693, ack 869, win 65535, length 13740
13:20:28.396254 IP 10.0.2.15.42648 > 151.101.117.164.443: Flags [.], ack 1118693, win 65535, length 0
13:20:28.396600 IP 151.101.117.164.443 > 10.0.2.15.42648: Flags [P.], seq 1118693:1122815, ack 869, win 65535, length 4122
13:20:28.396612 IP 10.0.2.15.42648 > 151.101.117.164.443: Flags [.], ack 1122815, win 65535, length 0
13:20:28.396921 IP 151.101.117.164.443 > 10.0.2.15.42648: Flags [P.], seq 1122815:1128311, ack 869, win 65535, length 5496
13:20:28.396979 IP 10.0.2.15.42648 > 151.101.117.164.443: Flags [.], ack 1128311, win 65535, length 0
13:20:28.397692 IP 151.101.117.164.443 > 10.0.2.15.42648: Flags [P.], seq 1128311:1129685, ack 869, win 65535, length 1374
13:20:28.400358 IP 151.101.117.164.443 > 10.0.2.15.42648: Flags [P.], seq 1129685:1137929, ack 869, win 65535, length 8244
13:20:28.400363 IP 151.101.117.164.443 > 10.0.2.15.42648: Flags [P.], seq 1137929:1148921, ack 869, win 65535, length 10992
13:20:28.400592 IP 10.0.2.15.42648 > 151.101.117.164.443: Flags [.], ack 1148921, win 65535, length 0
13:20:28.400706 IP 151.101.117.164.443 > 10.0.2.15.42648: Flags [P.], seq 1148921:1155791, ack 869, win 65535, length 6870
13:20:28.400753 IP 10.0.2.15.42648 > 151.101.117.164.443: Flags [.], ack 1155791, win 65535, length 0
13:20:28.402519 IP 151.101.117.164.443 > 10.0.2.15.42648: Flags [P.], seq 1155791:1161287, ack 869, win 65535, length 5496
13:20:28.402534 IP 10.0.2.15.42648 > 151.101.117.164.443: Flags [.], ack 1161287, win 65535, length 0
13:20:28.404634 IP 151.101.117.164.443 > 10.0.2.15.42648: Flags [P.], seq 1161287:1175027, ack 869, win 65535, length 13740
13:20:28.404762 IP 10.0.2.15.42648 > 151.101.117.164.443: Flags [.], ack 1175027, win 65535, length 0
13:20:28.405042 IP 151.101.117.164.443 > 10.0.2.15.42648: Flags [P.], seq 1175027:1183271, ack 869, win 65535, length 8244
13:20:28.405090 IP 10.0.2.15.42648 > 151.101.117.164.443: Flags [.], ack 1183271, win 65535, length 0
13:20:28.406003 IP 151.101.117.164.443 > 10.0.2.15.42648: Flags [P.], seq 1183271:1191515, ack 869, win 65535, length 8244
13:20:28.406025 IP 10.0.2.15.42648 > 151.101.117.164.443: Flags [.], ack 1191515, win 65535, length 0
13:20:28.406331 IP 151.101.117.164.443 > 10.0.2.15.42648: Flags [P.], seq 1191515:1201133, ack 869, win 65535, length 9618
13:20:28.406384 IP 10.0.2.15.42648 > 151.101.117.164.443: Flags [.], ack 1201133, win 65535, length 0
13:20:28.407010 IP 151.101.117.164.443 > 10.0.2.15.42648: Flags [P.], seq 1201133:1208003, ack 869, win 65535, length 6870
13:20:28.407026 IP 10.0.2.15.42648 > 151.101.117.164.443: Flags [.], ack 1208003, win 65535, length 0

