00:14:17.962570 IP 10.0.2.15.43988 > 151.101.117.164.443: Flags [P.], seq 3380009144:3380009661, ack 72448002, win 64240, length 517
00:14:17.964070 IP 151.101.117.164.443 > 10.0.2.15.43988: Flags [.], ack 517, win 65535, length 0
00:14:17.982198 IP 151.101.117.164.443 > 10.0.2.15.43988: Flags [.], seq 1:2921, ack 517, win 65535, length 2920
00:14:17.982217 IP 10.0.2.15.43988 > 151.101.117.164.443: Flags [.], ack 2921, win 62780, length 0
00:14:17.982641 IP 151.101.117.164.443 > 10.0.2.15.43988: Flags [P.], seq 2921:5607, ack 517, win 65535, length 2686
00:14:17.982679 IP 10.0.2.15.43988 > 151.101.117.164.443: Flags [.], ack 5607, win 61320, length 0
00:14:18.003985 IP 10.0.2.15.43988 > 151.101.117.164.443: Flags [P.], seq 517:610, ack 5607, win 62780, length 93
00:14:18.005295 IP 151.101.117.164.443 > 10.0.2.15.43988: Flags [.], ack 610, win 65535, length 0
00:14:18.023592 IP 151.101.117.164.443 > 10.0.2.15.43988: Flags [P.], seq 5607:5658, ack 610, win 65535, length 51
00:14:18.023620 IP 10.0.2.15.43988 > 151.101.117.164.443: Flags [.], ack 5658, win 62780, length 0
00:14:18.028817 IP 10.0.2.15.43988 > 151.101.117.164.443: Flags [P.], seq 610:663, ack 5658, win 62780, length 53
00:14:18.029023 IP 10.0.2.15.43988 > 151.101.117.164.443: Flags [P.], seq 663:719, ack 5658, win 62780, length 56
00:14:18.029364 IP 151.101.117.164.443 > 10.0.2.15.43988: Flags [.], ack 663, win 65535, length 0
00:14:18.029365 IP 151.101.117.164.443 > 10.0.2.15.43988: Flags [.], ack 719, win 65535, length 0
00:14:18.030522 IP 10.0.2.15.43988 > 151.101.117.164.443: Flags [P.], seq 719:761, ack 5658, win 62780, length 42
00:14:18.030733 IP 10.0.2.15.43988 > 151.101.117.164.443: Flags [P.], seq 761:830, ack 5658, win 62780, length 69
00:14:18.030870 IP 151.101.117.164.443 > 10.0.2.15.43988: Flags [.], ack 761, win 65535, length 0
00:14:18.031521 IP 151.101.117.164.443 > 10.0.2.15.43988: Flags [.], ack 830, win 65535, length 0
00:14:18.049121 IP 151.101.117.164.443 > 10.0.2.15.43988: Flags [P.], seq 5658:5724, ack 830, win 65535, length 66
00:14:18.049148 IP 10.0.2.15.43988 > 151.101.117.164.443: Flags [.], ack 5724, win 62780, length 0
00:14:18.051015 IP 10.0.2.15.43988 > 151.101.117.164.443: Flags [P.], seq 830:868, ack 5724, win 62780, length 38
00:14:18.057390 IP 151.101.117.164.443 > 10.0.2.15.43988: Flags [.], ack 868, win 65535, length 0
00:14:18.057395 IP 151.101.117.164.443 > 10.0.2.15.43988: Flags [P.], seq 5724:11220, ack 868, win 65535, length 5496
00:14:18.058256 IP 10.0.2.15.43988 > 151.101.117.164.443: Flags [.], ack 11220, win 61320, length 0
00:14:18.066802 IP 151.101.117.164.443 > 10.0.2.15.43988: Flags [P.], seq 11220:13968, ack 868, win 65535, length 2748
00:14:18.066828 IP 10.0.2.15.43988 > 151.101.117.164.443: Flags [.], ack 13968, win 62780, length 0
00:14:18.074466 IP 151.101.117.164.443 > 10.0.2.15.43988: Flags [P.], seq 13968:16716, ack 868, win 65535, length 2748
00:14:18.074494 IP 10.0.2.15.43988 > 151.101.117.164.443: Flags [.], ack 16716, win 62780, length 0
00:14:18.081195 IP 151.101.117.164.443 > 10.0.2.15.43988: Flags [P.], seq 16716:19464, ack 868, win 65535, length 2748
00:14:18.081217 IP 10.0.2.15.43988 > 151.101.117.164.443: Flags [.], ack 19464, win 62780, length 0
00:14:18.089087 IP 151.101.117.164.443 > 10.0.2.15.43988: Flags [P.], seq 19464:22212, ack 868, win 65535, length 2748
00:14:18.089115 IP 10.0.2.15.43988 > 151.101.117.164.443: Flags [.], ack 22212, win 62780, length 0
00:14:18.095977 IP 151.101.117.164.443 > 10.0.2.15.43988: Flags [P.], seq 22212:24960, ack 868, win 65535, length 2748
00:14:18.096006 IP 10.0.2.15.43988 > 151.101.117.164.443: Flags [.], ack 24960, win 62780, length 0
00:14:18.102463 IP 151.101.117.164.443 > 10.0.2.15.43988: Flags [P.], seq 24960:27708, ack 868, win 65535, length 2748
00:14:18.102487 IP 10.0.2.15.43988 > 151.101.117.164.443: Flags [.], ack 27708, win 62780, length 0
00:14:18.106971 IP 151.101.117.164.443 > 10.0.2.15.43988: Flags [P.], seq 27708:30456, ack 868, win 65535, length 2748
00:14:18.107000 IP 10.0.2.15.43988 > 151.101.117.164.443: Flags [.], ack 30456, win 62780, length 0
00:14:18.112958 IP 151.101.117.164.443 > 10.0.2.15.43988: Flags [P.], seq 30456:33204, ack 868, win 65535, length 2748
00:14:18.113018 IP 10.0.2.15.43988 > 151.101.117.164.443: Flags [.], ack 33204, win 62780, length 0
00:14:18.115722 IP 151.101.117.164.443 > 10.0.2.15.43988: Flags [P.], seq 33204:35952, ack 868, win 65535, length 2748
00:14:18.115747 IP 10.0.2.15.43988 > 151.101.117.164.443: Flags [.], ack 35952, win 62780, length 0
00:14:18.118917 IP 151.101.117.164.443 > 10.0.2.15.43988: Flags [P.], seq 35952:38700, ack 868, win 65535, length 2748
00:14:18.118943 IP 10.0.2.15.43988 > 151.101.117.164.443: Flags [.], ack 38700, win 62780, length 0
00:14:18.122181 IP 151.101.117.164.443 > 10.0.2.15.43988: Flags [P.], seq 38700:41448, ack 868, win 65535, length 2748
00:14:18.122206 IP 10.0.2.15.43988 > 151.101.117.164.443: Flags [.], ack 41448, win 62780, length 0
00:14:18.125456 IP 151.101.117.164.443 > 10.0.2.15.43988: Flags [P.], seq 41448:44196, ack 868, win 65535, length 2748
00:14:18.125481 IP 10.0.2.15.43988 > 151.101.117.164.443: Flags [.], ack 44196, win 62780, length 0
00:14:18.127816 IP 151.101.117.164.443 > 10.0.2.15.43988: Flags [P.], seq 44196:46944, ack 868, win 65535, length 2748
00:14:18.127839 IP 10.0.2.15.43988 > 151.101.117.164.443: Flags [.], ack 46944, win 62780, length 0
00:14:18.130346 IP 151.101.117.164.443 > 10.0.2.15.43988: Flags [P.], seq 46944:48318, ack 868, win 65535, length 1374
00:14:18.132569 IP 151.101.117.164.443 > 10.0.2.15.43988: Flags [P.], seq 48318:51066, ack 868, win 65535, length 2748
00:14:18.132604 IP 10.0.2.15.43988 > 151.101.117.164.443: Flags [.], ack 51066, win 62780, length 0
00:14:18.136017 IP 151.101.117.164.443 > 10.0.2.15.43988: Flags [P.], seq 51066:53814, ack 868, win 65535, length 2748
00:14:18.136074 IP 151.101.117.164.443 > 10.0.2.15.43988: Flags [P.], seq 53814:56562, ack 868, win 65535, length 2748
00:14:18.136100 IP 10.0.2.15.43988 > 151.101.117.164.443: Flags [.], ack 53814, win 62780, length 0
00:14:18.136305 IP 10.0.2.15.43988 > 151.101.117.164.443: Flags [.], ack 56562, win 61320, length 0
00:14:18.136872 IP 151.101.117.164.443 > 10.0.2.15.43988: Flags [P.], seq 56562:59310, ack 868, win 65535, length 2748
00:14:18.136891 IP 10.0.2.15.43988 > 151.101.117.164.443: Flags [.], ack 59310, win 62780, length 0
00:14:18.139539 IP 151.101.117.164.443 > 10.0.2.15.43988: Flags [P.], seq 59310:62058, ack 868, win 65535, length 2748
00:14:18.139607 IP 10.0.2.15.43988 > 151.101.117.164.443: Flags [.], ack 62058, win 62780, length 0
00:14:18.143016 IP 151.101.117.164.443 > 10.0.2.15.43988: Flags [P.], seq 62058:64806, ack 868, win 65535, length 2748
00:14:18.143021 IP 151.101.117.164.443 > 10.0.2.15.43988: Flags [P.], seq 64806:67554, ack 868, win 65535, length 2748
00:14:18.143053 IP 10.0.2.15.43988 > 151.101.117.164.443: Flags [.], ack 64806, win 62780, length 0
00:14:18.145641 IP 10.0.2.15.43988 > 151.101.117.164.443: Flags [.], ack 67554, win 62780, length 0
00:14:18.145817 IP 151.101.117.164.443 > 10.0.2.15.43988: Flags [P.], seq 67554:70302, ack 868, win 65535, length 2748
00:14:18.145819 IP 151.101.117.164.443 > 10.0.2.15.43988: Flags [P.], seq 70302:73050, ack 868, win 65535, length 2748
00:14:18.145834 IP 10.0.2.15.43988 > 151.101.117.164.443: Flags [.], ack 70302, win 65535, length 0
00:14:18.145856 IP 10.0.2.15.43988 > 151.101.117.164.443: Flags [.], ack 73050, win 65535, length 0
00:14:18.147215 IP 151.101.117.164.443 > 10.0.2.15.43988: Flags [P.], seq 73050:77172, ack 868, win 65535, length 4122
00:14:18.147219 IP 151.101.117.164.443 > 10.0.2.15.43988: Flags [P.], seq 77172:78546, ack 868, win 65535, length 1374
00:14:18.147245 IP 10.0.2.15.43988 > 151.101.117.164.443: Flags [.], ack 77172, win 65535, length 0
00:14:18.149514 IP 151.101.117.164.443 > 10.0.2.15.43988: Flags [P.], seq 78546:79920, ack 868, win 65535, length 1374
00:14:18.149692 IP 10.0.2.15.43988 > 151.101.117.164.443: Flags [.], ack 79920, win 65535, length 0
00:14:18.153527 IP 151.101.117.164.443 > 10.0.2.15.43988: Flags [P.], seq 79920:85416, ack 868, win 65535, length 5496
00:14:18.153531 IP 151.101.117.164.443 > 10.0.2.15.43988: Flags [P.], seq 85416:88164, ack 868, win 65535, length 2748
00:14:18.153566 IP 151.101.117.164.443 > 10.0.2.15.43988: Flags [P.], seq 88164:93660, ack 868, win 65535, length 5496
00:14:18.153595 IP 10.0.2.15.43988 > 151.101.117.164.443: Flags [.], ack 85416, win 65535, length 0
00:14:18.153884 IP 10.0.2.15.43988 > 151.101.117.164.443: Flags [.], ack 88164, win 65535, length 0
00:14:18.153921 IP 10.0.2.15.43988 > 151.101.117.164.443: Flags [.], ack 93660, win 65535, length 0
00:14:18.154050 IP 151.101.117.164.443 > 10.0.2.15.43988: Flags [P.], seq 93660:96408, ack 868, win 65535, length 2748
00:14:18.154055 IP 151.101.117.164.443 > 10.0.2.15.43988: Flags [P.], seq 96408:97782, ack 868, win 65535, length 1374
00:14:18.154123 IP 10.0.2.15.43988 > 151.101.117.164.443: Flags [.], ack 96408, win 65535, length 0
00:14:18.156537 IP 151.101.117.164.443 > 10.0.2.15.43988: Flags [P.], seq 97782:101904, ack 868, win 65535, length 4122
00:14:18.156539 IP 151.101.117.164.443 > 10.0.2.15.43988: Flags [P.], seq 101904:107400, ack 868, win 65535, length 5496
00:14:18.156540 IP 151.101.117.164.443 > 10.0.2.15.43988: Flags [P.], seq 107400:110148, ack 868, win 65535, length 2748
00:14:18.156569 IP 10.0.2.15.43988 > 151.101.117.164.443: Flags [.], ack 101904, win 65535, length 0
00:14:18.156668 IP 10.0.2.15.43988 > 151.101.117.164.443: Flags [.], ack 107400, win 65535, length 0
00:14:18.156805 IP 10.0.2.15.43988 > 151.101.117.164.443: Flags [.], ack 110148, win 65535, length 0
00:14:18.156929 IP 151.101.117.164.443 > 10.0.2.15.43988: Flags [P.], seq 110148:112896, ack 868, win 65535, length 2748
00:14:18.156930 IP 151.101.117.164.443 > 10.0.2.15.43988: Flags [P.], seq 112896:114270, ack 868, win 65535, length 1374
00:14:18.157096 IP 10.0.2.15.43988 > 151.101.117.164.443: Flags [.], ack 112896, win 65535, length 0
00:14:18.158241 IP 151.101.117.164.443 > 10.0.2.15.43988: Flags [P.], seq 114270:117018, ack 868, win 65535, length 2748
00:14:18.158244 IP 151.101.117.164.443 > 10.0.2.15.43988: Flags [P.], seq 117018:118392, ack 868, win 65535, length 1374
00:14:18.158323 IP 10.0.2.15.43988 > 151.101.117.164.443: Flags [.], ack 117018, win 65535, length 0
00:14:18.159264 IP 151.101.117.164.443 > 10.0.2.15.43988: Flags [P.], seq 118392:123888, ack 868, win 65535, length 5496
00:14:18.159267 IP 151.101.117.164.443 > 10.0.2.15.43988: Flags [P.], seq 123888:128010, ack 868, win 65535, length 4122
00:14:18.159296 IP 10.0.2.15.43988 > 151.101.117.164.443: Flags [.], ack 123888, win 65535, length 0
00:14:18.159632 IP 10.0.2.15.43988 > 151.101.117.164.443: Flags [.], ack 128010, win 65535, length 0
00:14:18.160155 IP 151.101.117.164.443 > 10.0.2.15.43988: Flags [P.], seq 128010:133506, ack 868, win 65535, length 5496
00:14:18.160178 IP 10.0.2.15.43988 > 151.101.117.164.443: Flags [.], ack 133506, win 65535, length 0
00:14:18.160702 IP 151.101.117.164.443 > 10.0.2.15.43988: Flags [P.], seq 133506:139002, ack 868, win 65535, length 5496
00:14:18.160766 IP 10.0.2.15.43988 > 151.101.117.164.443: Flags [.], ack 139002, win 65535, length 0
00:14:18.162501 IP 151.101.117.164.443 > 10.0.2.15.43988: Flags [P.], seq 139002:144498, ack 868, win 65535, length 5496
00:14:18.163045 IP 10.0.2.15.43988 > 151.101.117.164.443: Flags [.], ack 144498, win 65535, length 0
00:14:18.163461 IP 151.101.117.164.443 > 10.0.2.15.43988: Flags [P.], seq 144498:149994, ack 868, win 65535, length 5496
00:14:18.163465 IP 151.101.117.164.443 > 10.0.2.15.43988: Flags [P.], seq 149994:156864, ack 868, win 65535, length 6870
00:14:18.163484 IP 10.0.2.15.43988 > 151.101.117.164.443: Flags [.], ack 149994, win 65535, length 0
00:14:18.163507 IP 10.0.2.15.43988 > 151.101.117.164.443: Flags [.], ack 156864, win 65535, length 0
00:14:18.172164 IP 151.101.117.164.443 > 10.0.2.15.43988: Flags [P.], seq 156864:160986, ack 868, win 65535, length 4122
00:14:18.172418 IP 151.101.117.164.443 > 10.0.2.15.43988: Flags [P.], seq 160986:166482, ack 868, win 65535, length 5496
00:14:18.172421 IP 151.101.117.164.443 > 10.0.2.15.43988: Flags [P.], seq 166482:170604, ack 868, win 65535, length 4122
00:14:18.172450 IP 10.0.2.15.43988 > 151.101.117.164.443: Flags [.], ack 160986, win 65535, length 0
00:14:18.172534 IP 10.0.2.15.43988 > 151.101.117.164.443: Flags [.], ack 166482, win 65535, length 0
00:14:18.172553 IP 10.0.2.15.43988 > 151.101.117.164.443: Flags [.], ack 170604, win 65535, length 0
00:14:18.172664 IP 151.101.117.164.443 > 10.0.2.15.43988: Flags [P.], seq 170604:173352, ack 868, win 65535, length 2748
00:14:18.172666 IP 151.101.117.164.443 > 10.0.2.15.43988: Flags [P.], seq 173352:174726, ack 868, win 65535, length 1374
00:14:18.172668 IP 151.101.117.164.443 > 10.0.2.15.43988: Flags [P.], seq 174726:180222, ack 868, win 65535, length 5496
00:14:18.172670 IP 151.101.117.164.443 > 10.0.2.15.43988: Flags [P.], seq 180222:185718, ack 868, win 65535, length 5496
00:14:18.172684 IP 10.0.2.15.43988 > 151.101.117.164.443: Flags [.], ack 173352, win 65535, length 0
00:14:18.172707 IP 10.0.2.15.43988 > 151.101.117.164.443: Flags [.], ack 180222, win 65535, length 0
00:14:18.172722 IP 10.0.2.15.43988 > 151.101.117.164.443: Flags [.], ack 185718, win 65535, length 0
00:14:18.172749 IP 151.101.117.164.443 > 10.0.2.15.43988: Flags [P.], seq 185718:200832, ack 868, win 65535, length 15114
00:14:18.172753 IP 10.0.2.15.43988 > 151.101.117.164.443: Flags [.], ack 200832, win 65535, length 0
00:14:18.189402 IP 151.101.117.164.443 > 10.0.2.15.43988: Flags [P.], seq 200832:232434, ack 868, win 65535, length 31602
00:14:18.189630 IP 10.0.2.15.43988 > 151.101.117.164.443: Flags [.], ack 232434, win 65535, length 0
00:14:18.203055 IP 151.101.117.164.443 > 10.0.2.15.43988: Flags [P.], seq 232434:240678, ack 868, win 65535, length 8244
00:14:18.203091 IP 151.101.117.164.443 > 10.0.2.15.43988: Flags [.], seq 240678:293238, ack 868, win 65535, length 52560
00:14:18.203119 IP 10.0.2.15.43988 > 151.101.117.164.443: Flags [.], ack 240678, win 65535, length 0
00:14:18.203149 IP 10.0.2.15.43988 > 151.101.117.164.443: Flags [.], ack 293238, win 65535, length 0
00:14:18.203737 IP 151.101.117.164.443 > 10.0.2.15.43988: Flags [P.], seq 293238:297618, ack 868, win 65535, length 4380
00:14:18.203750 IP 10.0.2.15.43988 > 151.101.117.164.443: Flags [.], ack 297618, win 65535, length 0
00:14:18.208649 IP 151.101.117.164.443 > 10.0.2.15.43988: Flags [.], seq 297618:361858, ack 868, win 65535, length 64240
00:14:18.208678 IP 10.0.2.15.43988 > 151.101.117.164.443: Flags [.], ack 361858, win 65535, length 0
00:14:18.221349 IP 151.101.117.164.443 > 10.0.2.15.43988: Flags [P.], seq 361858:363318, ack 868, win 65535, length 1460
00:14:18.221369 IP 151.101.117.164.443 > 10.0.2.15.43988: Flags [.], seq 363318:426098, ack 868, win 65535, length 62780
00:14:18.221454 IP 10.0.2.15.43988 > 151.101.117.164.443: Flags [.], ack 426098, win 65535, length 0
00:14:18.223703 IP 151.101.117.164.443 > 10.0.2.15.43988: Flags [P.], seq 426098:427558, ack 868, win 65535, length 1460
00:14:18.223724 IP 151.101.117.164.443 > 10.0.2.15.43988: Flags [.], seq 427558:490338, ack 868, win 65535, length 62780
00:14:18.223769 IP 10.0.2.15.43988 > 151.101.117.164.443: Flags [.], ack 490338, win 65535, length 0
00:14:18.231958 IP 151.101.117.164.443 > 10.0.2.15.43988: Flags [P.], seq 490338:491798, ack 868, win 65535, length 1460
00:14:18.231983 IP 151.101.117.164.443 > 10.0.2.15.43988: Flags [.], seq 491798:554578, ack 868, win 65535, length 62780
00:14:18.232016 IP 10.0.2.15.43988 > 151.101.117.164.443: Flags [.], ack 554578, win 65535, length 0
00:14:18.240427 IP 151.101.117.164.443 > 10.0.2.15.43988: Flags [P.], seq 554578:556038, ack 868, win 65535, length 1460
00:14:18.240452 IP 151.101.117.164.443 > 10.0.2.15.43988: Flags [.], seq 556038:618818, ack 868, win 65535, length 62780
00:14:18.240508 IP 10.0.2.15.43988 > 151.101.117.164.443: Flags [.], ack 618818, win 65535, length 0
00:14:18.241586 IP 151.101.117.164.443 > 10.0.2.15.43988: Flags [P.], seq 618818:620278, ack 868, win 65535, length 1460
00:14:18.241601 IP 151.101.117.164.443 > 10.0.2.15.43988: Flags [.], seq 620278:683058, ack 868, win 65535, length 62780
00:14:18.241630 IP 10.0.2.15.43988 > 151.101.117.164.443: Flags [.], ack 683058, win 65535, length 0
00:14:18.246403 IP 151.101.117.164.443 > 10.0.2.15.43988: Flags [P.], seq 683058:684518, ack 868, win 65535, length 1460
00:14:18.288105 IP 151.101.117.164.443 > 10.0.2.15.43988: Flags [.], seq 684518:747298, ack 868, win 65535, length 62780
00:14:18.288415 IP 10.0.2.15.43988 > 151.101.117.164.443: Flags [.], ack 747298, win 65535, length 0
00:14:18.299339 IP 151.101.117.164.443 > 10.0.2.15.43988: Flags [P.], seq 747298:748758, ack 868, win 65535, length 1460
00:14:18.299437 IP 151.101.117.164.443 > 10.0.2.15.43988: Flags [.], seq 748758:811538, ack 868, win 65535, length 62780
00:14:18.299467 IP 10.0.2.15.43988 > 151.101.117.164.443: Flags [.], ack 811538, win 65535, length 0
00:14:18.314844 IP 151.101.117.164.443 > 10.0.2.15.43988: Flags [P.], seq 811538:812998, ack 868, win 65535, length 1460
00:14:18.314864 IP 151.101.117.164.443 > 10.0.2.15.43988: Flags [.], seq 812998:875778, ack 868, win 65535, length 62780
00:14:18.317136 IP 10.0.2.15.43988 > 151.101.117.164.443: Flags [.], ack 875778, win 65535, length 0
00:14:18.327962 IP 151.101.117.164.443 > 10.0.2.15.43988: Flags [P.], seq 875778:877238, ack 868, win 65535, length 1460
00:14:18.327983 IP 151.101.117.164.443 > 10.0.2.15.43988: Flags [.], seq 877238:940018, ack 868, win 65535, length 62780
00:14:18.328021 IP 10.0.2.15.43988 > 151.101.117.164.443: Flags [.], ack 940018, win 65535, length 0
00:14:18.330208 IP 151.101.117.164.443 > 10.0.2.15.43988: Flags [P.], seq 940018:941478, ack 868, win 65535, length 1460
00:14:18.330211 IP 151.101.117.164.443 > 10.0.2.15.43988: Flags [.], seq 941478:948778, ack 868, win 65535, length 7300
00:14:18.330239 IP 10.0.2.15.43988 > 151.101.117.164.443: Flags [.], ack 948778, win 65535, length 0
00:14:18.330620 IP 151.101.117.164.443 > 10.0.2.15.43988: Flags [.], seq 948778:950238, ack 868, win 65535, length 1460
00:14:18.331371 IP 151.101.117.164.443 > 10.0.2.15.43988: Flags [.], seq 950238:951698, ack 868, win 65535, length 1460
00:14:18.331388 IP 10.0.2.15.43988 > 151.101.117.164.443: Flags [.], ack 951698, win 65535, length 0
00:14:18.336491 IP 151.101.117.164.443 > 10.0.2.15.43988: Flags [.], seq 951698:953158, ack 868, win 65535, length 1460
00:14:18.337339 IP 151.101.117.164.443 > 10.0.2.15.43988: Flags [.], seq 953158:954618, ack 868, win 65535, length 1460
00:14:18.337361 IP 10.0.2.15.43988 > 151.101.117.164.443: Flags [.], ack 954618, win 65535, length 0
00:14:18.338398 IP 151.101.117.164.443 > 10.0.2.15.43988: Flags [.], seq 954618:956078, ack 868, win 65535, length 1460
00:14:18.339985 IP 151.101.117.164.443 > 10.0.2.15.43988: Flags [.], seq 956078:960458, ack 868, win 65535, length 4380
00:14:18.340011 IP 10.0.2.15.43988 > 151.101.117.164.443: Flags [.], ack 960458, win 65535, length 0
00:14:18.343234 IP 151.101.117.164.443 > 10.0.2.15.43988: Flags [.], seq 960458:963378, ack 868, win 65535, length 2920
00:14:18.343314 IP 10.0.2.15.43988 > 151.101.117.164.443: Flags [.], ack 963378, win 65535, length 0
00:14:18.345872 IP 151.101.117.164.443 > 10.0.2.15.43988: Flags [.], seq 963378:964838, ack 868, win 65535, length 1460
00:14:18.347910 IP 151.101.117.164.443 > 10.0.2.15.43988: Flags [.], seq 964838:966298, ack 868, win 65535, length 1460
00:14:18.347935 IP 10.0.2.15.43988 > 151.101.117.164.443: Flags [.], ack 966298, win 65535, length 0
00:14:18.350292 IP 151.101.117.164.443 > 10.0.2.15.43988: Flags [.], seq 966298:967758, ack 868, win 65535, length 1460
00:14:18.362113 IP 151.101.117.164.443 > 10.0.2.15.43988: Flags [.], seq 967758:969218, ack 868, win 65535, length 1460
00:14:18.362135 IP 10.0.2.15.43988 > 151.101.117.164.443: Flags [.], ack 969218, win 65535, length 0
00:14:18.363499 IP 151.101.117.164.443 > 10.0.2.15.43988: Flags [.], seq 969218:970678, ack 868, win 65535, length 1460
00:14:18.364422 IP 151.101.117.164.443 > 10.0.2.15.43988: Flags [P.], seq 970678:1005718, ack 868, win 65535, length 35040
00:14:18.364732 IP 10.0.2.15.43988 > 151.101.117.164.443: Flags [.], ack 1005718, win 65535, length 0
00:14:18.366616 IP 151.101.117.164.443 > 10.0.2.15.43988: Flags [.], seq 1005718:1018858, ack 868, win 65535, length 13140
00:14:18.366974 IP 10.0.2.15.43988 > 151.101.117.164.443: Flags [.], ack 1018858, win 65535, length 0
00:14:18.369255 IP 151.101.117.164.443 > 10.0.2.15.43988: Flags [.], seq 1018858:1020318, ack 868, win 65535, length 1460
00:14:18.369966 IP 151.101.117.164.443 > 10.0.2.15.43988: Flags [.], seq 1020318:1021778, ack 868, win 65535, length 1460
00:14:18.369989 IP 10.0.2.15.43988 > 151.101.117.164.443: Flags [.], ack 1021778, win 65535, length 0
00:14:18.381323 IP 151.101.117.164.443 > 10.0.2.15.43988: Flags [.], seq 1021778:1023238, ack 868, win 65535, length 1460
00:14:18.383813 IP 151.101.117.164.443 > 10.0.2.15.43988: Flags [.], seq 1023238:1024698, ack 868, win 65535, length 1460
00:14:18.383839 IP 10.0.2.15.43988 > 151.101.117.164.443: Flags [.], ack 1024698, win 65535, length 0
00:14:18.390045 IP 151.101.117.164.443 > 10.0.2.15.43988: Flags [P.], seq 1024698:1071418, ack 868, win 65535, length 46720
00:14:18.391753 IP 10.0.2.15.43988 > 151.101.117.164.443: Flags [.], ack 1071418, win 65535, length 0
00:14:18.393553 IP 151.101.117.164.443 > 10.0.2.15.43988: Flags [.], seq 1071418:1135658, ack 868, win 65535, length 64240
00:14:18.393690 IP 10.0.2.15.43988 > 151.101.117.164.443: Flags [.], ack 1135658, win 65535, length 0
00:14:18.396924 IP 151.101.117.164.443 > 10.0.2.15.43988: Flags [P.], seq 1135658:1137118, ack 868, win 65535, length 1460
00:14:18.396940 IP 151.101.117.164.443 > 10.0.2.15.43988: Flags [.], seq 1137118:1199898, ack 868, win 65535, length 62780
00:14:18.398003 IP 10.0.2.15.43988 > 151.101.117.164.443: Flags [.], ack 1199898, win 65535, length 0
00:14:18.399582 IP 151.101.117.164.443 > 10.0.2.15.43988: Flags [P.], seq 1199898:1201358, ack 868, win 65535, length 1460
00:14:18.399603 IP 151.101.117.164.443 > 10.0.2.15.43988: Flags [.], seq 1201358:1264138, ack 868, win 65535, length 62780
00:14:18.399735 IP 10.0.2.15.43988 > 151.101.117.164.443: Flags [.], ack 1264138, win 65535, length 0

