19:59:29.692941 IP 10.0.2.15.33573 > 140.233.253.2.53: 59296+ A? www.nytimes.com. (33)
19:59:29.692981 IP 10.0.2.15.33573 > 140.233.253.2.53: 20893+ AAAA? www.nytimes.com. (33)
19:59:29.697862 IP 140.233.253.2.53 > 10.0.2.15.33573: 59296 3/0/0 CNAME www.prd.map.nytimes.com., CNAME nytimes.map.fastly.net., A 151.101.117.164 (111)
19:59:29.711215 IP 140.233.253.2.53 > 10.0.2.15.33573: 20893 2/1/0 CNAME www.prd.map.nytimes.com., CNAME nytimes.map.fastly.net. (153)
19:59:29.711702 IP 10.0.2.15.44158 > 151.101.117.164.443: Flags [S], seq 358101666, win 64240, options [mss 1460,sackOK,TS val 917772794 ecr 0,nop,wscale 6], length 0
19:59:29.726762 IP 151.101.117.164.443 > 10.0.2.15.44158: Flags [S.], seq 213504001, ack 358101667, win 65535, options [mss 1460], length 0
19:59:29.726878 IP 10.0.2.15.44158 > 151.101.117.164.443: Flags [.], ack 1, win 64240, length 0
19:59:29.736238 IP 10.0.2.15.44158 > 151.101.117.164.443: Flags [P.], seq 1:518, ack 1, win 64240, length 517
19:59:29.736631 IP 151.101.117.164.443 > 10.0.2.15.44158: Flags [.], ack 518, win 65535, length 0
19:59:29.759059 IP 151.101.117.164.443 > 10.0.2.15.44158: Flags [.], seq 1:2921, ack 518, win 65535, length 2920
19:59:29.759084 IP 10.0.2.15.44158 > 151.101.117.164.443: Flags [.], ack 2921, win 62780, length 0
19:59:29.759346 IP 151.101.117.164.443 > 10.0.2.15.44158: Flags [P.], seq 2921:5607, ack 518, win 65535, length 2686
19:59:29.759369 IP 10.0.2.15.44158 > 151.101.117.164.443: Flags [.], ack 5607, win 61320, length 0
19:59:29.761988 IP 10.0.2.15.44158 > 151.101.117.164.443: Flags [P.], seq 518:611, ack 5607, win 62780, length 93
19:59:29.762365 IP 151.101.117.164.443 > 10.0.2.15.44158: Flags [.], ack 611, win 65535, length 0
19:59:29.778359 IP 151.101.117.164.443 > 10.0.2.15.44158: Flags [P.], seq 5607:5658, ack 611, win 65535, length 51
19:59:29.778381 IP 10.0.2.15.44158 > 151.101.117.164.443: Flags [.], ack 5658, win 62780, length 0
19:59:29.779065 IP 10.0.2.15.44158 > 151.101.117.164.443: Flags [P.], seq 611:664, ack 5658, win 62780, length 53
19:59:29.779109 IP 10.0.2.15.44158 > 151.101.117.164.443: Flags [P.], seq 664:720, ack 5658, win 62780, length 56
19:59:29.779565 IP 151.101.117.164.443 > 10.0.2.15.44158: Flags [.], ack 664, win 65535, length 0
19:59:29.779567 IP 151.101.117.164.443 > 10.0.2.15.44158: Flags [.], ack 720, win 65535, length 0
19:59:29.779596 IP 10.0.2.15.44158 > 151.101.117.164.443: Flags [P.], seq 720:831, ack 5658, win 62780, length 111
19:59:29.780021 IP 151.101.117.164.443 > 10.0.2.15.44158: Flags [.], ack 831, win 65535, length 0
19:59:29.793456 IP 151.101.117.164.443 > 10.0.2.15.44158: Flags [P.], seq 5658:5753, ack 831, win 65535, length 95
19:59:29.793478 IP 10.0.2.15.44158 > 151.101.117.164.443: Flags [.], ack 5753, win 62780, length 0
19:59:29.793955 IP 10.0.2.15.44158 > 151.101.117.164.443: Flags [P.], seq 831:869, ack 5753, win 62780, length 38
19:59:29.794342 IP 151.101.117.164.443 > 10.0.2.15.44158: Flags [.], ack 869, win 65535, length 0
19:59:30.992799 IP 151.101.117.164.443 > 10.0.2.15.44158: Flags [.], seq 5753:14513, ack 869, win 65535, length 8760
19:59:30.993069 IP 10.0.2.15.44158 > 151.101.117.164.443: Flags [.], ack 14513, win 58400, length 0
19:59:30.993784 IP 151.101.117.164.443 > 10.0.2.15.44158: Flags [.], seq 14513:24733, ack 869, win 65535, length 10220
19:59:30.994369 IP 10.0.2.15.44158 > 151.101.117.164.443: Flags [.], ack 24733, win 52560, length 0
19:59:30.994629 IP 151.101.117.164.443 > 10.0.2.15.44158: Flags [.], seq 24733:36413, ack 869, win 65535, length 11680
19:59:30.994671 IP 10.0.2.15.44158 > 151.101.117.164.443: Flags [.], ack 36413, win 43800, length 0
19:59:30.994826 IP 151.101.117.164.443 > 10.0.2.15.44158: Flags [P.], seq 36413:46973, ack 869, win 65535, length 10560
19:59:30.994863 IP 10.0.2.15.44158 > 151.101.117.164.443: Flags [.], ack 46973, win 36500, length 0
19:59:31.008692 IP 151.101.117.164.443 > 10.0.2.15.44158: Flags [P.], seq 46973:53843, ack 869, win 65535, length 6870
19:59:31.008716 IP 10.0.2.15.44158 > 151.101.117.164.443: Flags [.], ack 53843, win 59860, length 0
19:59:31.008915 IP 151.101.117.164.443 > 10.0.2.15.44158: Flags [P.], seq 53843:57965, ack 869, win 65535, length 4122
19:59:31.008998 IP 10.0.2.15.44158 > 151.101.117.164.443: Flags [.], ack 57965, win 56940, length 0
19:59:31.011644 IP 151.101.117.164.443 > 10.0.2.15.44158: Flags [P.], seq 57965:63461, ack 869, win 65535, length 5496
19:59:31.011663 IP 10.0.2.15.44158 > 151.101.117.164.443: Flags [.], ack 63461, win 61320, length 0
19:59:31.012020 IP 151.101.117.164.443 > 10.0.2.15.44158: Flags [P.], seq 63461:68957, ack 869, win 65535, length 5496
19:59:31.012250 IP 10.0.2.15.44158 > 151.101.117.164.443: Flags [.], ack 68957, win 62780, length 0
19:59:31.014912 IP 151.101.117.164.443 > 10.0.2.15.44158: Flags [P.], seq 68957:77201, ack 869, win 65535, length 8244
19:59:31.015014 IP 10.0.2.15.44158 > 151.101.117.164.443: Flags [.], ack 77201, win 65535, length 0
19:59:31.017149 IP 151.101.117.164.443 > 10.0.2.15.44158: Flags [P.], seq 77201:81323, ack 869, win 65535, length 4122
19:59:31.017170 IP 10.0.2.15.44158 > 151.101.117.164.443: Flags [.], ack 81323, win 65535, length 0
19:59:31.019447 IP 151.101.117.164.443 > 10.0.2.15.44158: Flags [P.], seq 81323:90941, ack 869, win 65535, length 9618
19:59:31.019516 IP 10.0.2.15.44158 > 151.101.117.164.443: Flags [.], ack 90941, win 65535, length 0
19:59:31.020327 IP 151.101.117.164.443 > 10.0.2.15.44158: Flags [P.], seq 90941:93689, ack 869, win 65535, length 2748
19:59:31.020341 IP 10.0.2.15.44158 > 151.101.117.164.443: Flags [.], ack 93689, win 65535, length 0
19:59:31.022691 IP 151.101.117.164.443 > 10.0.2.15.44158: Flags [P.], seq 93689:101933, ack 869, win 65535, length 8244
19:59:31.022716 IP 10.0.2.15.44158 > 151.101.117.164.443: Flags [.], ack 101933, win 65535, length 0
19:59:31.023341 IP 151.101.117.164.443 > 10.0.2.15.44158: Flags [P.], seq 101933:104681, ack 869, win 65535, length 2748
19:59:31.023352 IP 10.0.2.15.44158 > 151.101.117.164.443: Flags [.], ack 104681, win 65535, length 0
19:59:31.025660 IP 151.101.117.164.443 > 10.0.2.15.44158: Flags [P.], seq 104681:112925, ack 869, win 65535, length 8244
19:59:31.025687 IP 10.0.2.15.44158 > 151.101.117.164.443: Flags [.], ack 112925, win 65535, length 0
19:59:31.026148 IP 151.101.117.164.443 > 10.0.2.15.44158: Flags [.], seq 112925:114385, ack 869, win 65535, length 1460
19:59:31.026561 IP 151.101.117.164.443 > 10.0.2.15.44158: Flags [P.], seq 114385:115673, ack 869, win 65535, length 1288
19:59:31.026577 IP 10.0.2.15.44158 > 151.101.117.164.443: Flags [.], ack 115673, win 65535, length 0
19:59:31.028801 IP 151.101.117.164.443 > 10.0.2.15.44158: Flags [P.], seq 115673:125291, ack 869, win 65535, length 9618
19:59:31.028804 IP 151.101.117.164.443 > 10.0.2.15.44158: Flags [P.], seq 125291:126665, ack 869, win 65535, length 1374
19:59:31.028824 IP 10.0.2.15.44158 > 151.101.117.164.443: Flags [.], ack 125291, win 65535, length 0
19:59:31.030779 IP 151.101.117.164.443 > 10.0.2.15.44158: Flags [P.], seq 126665:133535, ack 869, win 65535, length 6870
19:59:31.030802 IP 10.0.2.15.44158 > 151.101.117.164.443: Flags [.], ack 133535, win 65535, length 0
19:59:31.031542 IP 151.101.117.164.443 > 10.0.2.15.44158: Flags [P.], seq 133535:137657, ack 869, win 65535, length 4122
19:59:31.031544 IP 151.101.117.164.443 > 10.0.2.15.44158: Flags [P.], seq 137657:139031, ack 869, win 65535, length 1374
19:59:31.031566 IP 10.0.2.15.44158 > 151.101.117.164.443: Flags [.], ack 137657, win 65535, length 0
19:59:31.034379 IP 151.101.117.164.443 > 10.0.2.15.44158: Flags [P.], seq 139031:144527, ack 869, win 65535, length 5496
19:59:31.034382 IP 151.101.117.164.443 > 10.0.2.15.44158: Flags [P.], seq 144527:150023, ack 869, win 65535, length 5496
19:59:31.034404 IP 10.0.2.15.44158 > 151.101.117.164.443: Flags [.], ack 144527, win 65535, length 0
19:59:31.034444 IP 10.0.2.15.44158 > 151.101.117.164.443: Flags [.], ack 150023, win 65535, length 0
19:59:31.034813 IP 151.101.117.164.443 > 10.0.2.15.44158: Flags [P.], seq 150023:151397, ack 869, win 65535, length 1374
19:59:31.036875 IP 151.101.117.164.443 > 10.0.2.15.44158: Flags [P.], seq 151397:161015, ack 869, win 65535, length 9618
19:59:31.036896 IP 10.0.2.15.44158 > 151.101.117.164.443: Flags [.], ack 161015, win 65535, length 0
19:59:31.037394 IP 151.101.117.164.443 > 10.0.2.15.44158: Flags [P.], seq 161015:165137, ack 869, win 65535, length 4122
19:59:31.037408 IP 10.0.2.15.44158 > 151.101.117.164.443: Flags [.], ack 165137, win 65535, length 0
19:59:31.041690 IP 151.101.117.164.443 > 10.0.2.15.44158: Flags [.], seq 165137:166597, ack 869, win 65535, length 1460
19:59:31.041904 IP 151.101.117.164.443 > 10.0.2.15.44158: Flags [P.], seq 166597:177503, ack 869, win 65535, length 10906
19:59:31.041925 IP 10.0.2.15.44158 > 151.101.117.164.443: Flags [.], ack 177503, win 65535, length 0
19:59:31.041975 IP 151.101.117.164.443 > 10.0.2.15.44158: Flags [P.], seq 177503:182999, ack 869, win 65535, length 5496
19:59:31.041983 IP 10.0.2.15.44158 > 151.101.117.164.443: Flags [.], ack 182999, win 65535, length 0
19:59:31.043065 IP 151.101.117.164.443 > 10.0.2.15.44158: Flags [P.], seq 182999:189869, ack 869, win 65535, length 6870
19:59:31.043117 IP 10.0.2.15.44158 > 151.101.117.164.443: Flags [.], ack 189869, win 65535, length 0
19:59:31.043380 IP 151.101.117.164.443 > 10.0.2.15.44158: Flags [P.], seq 189869:193991, ack 869, win 65535, length 4122
19:59:31.043382 IP 151.101.117.164.443 > 10.0.2.15.44158: Flags [P.], seq 193991:195365, ack 869, win 65535, length 1374
19:59:31.043395 IP 10.0.2.15.44158 > 151.101.117.164.443: Flags [.], ack 193991, win 65535, length 0
19:59:31.045437 IP 151.101.117.164.443 > 10.0.2.15.44158: Flags [P.], seq 195365:203609, ack 869, win 65535, length 8244
19:59:31.045458 IP 10.0.2.15.44158 > 151.101.117.164.443: Flags [.], ack 203609, win 65535, length 0
19:59:31.045793 IP 151.101.117.164.443 > 10.0.2.15.44158: Flags [.], seq 203609:205069, ack 869, win 65535, length 1460
19:59:31.045889 IP 151.101.117.164.443 > 10.0.2.15.44158: Flags [P.], seq 205069:207731, ack 869, win 65535, length 2662
19:59:31.045900 IP 10.0.2.15.44158 > 151.101.117.164.443: Flags [.], ack 207731, win 65535, length 0
19:59:31.048774 IP 151.101.117.164.443 > 10.0.2.15.44158: Flags [P.], seq 207731:215975, ack 869, win 65535, length 8244
19:59:31.048777 IP 151.101.117.164.443 > 10.0.2.15.44158: Flags [P.], seq 215975:220097, ack 869, win 65535, length 4122
19:59:31.048838 IP 10.0.2.15.44158 > 151.101.117.164.443: Flags [.], ack 215975, win 65535, length 0
19:59:31.048879 IP 10.0.2.15.44158 > 151.101.117.164.443: Flags [.], ack 220097, win 65535, length 0
19:59:31.048905 IP 151.101.117.164.443 > 10.0.2.15.44158: Flags [P.], seq 220097:221471, ack 869, win 65535, length 1374
19:59:31.050729 IP 151.101.117.164.443 > 10.0.2.15.44158: Flags [P.], seq 221471:231089, ack 869, win 65535, length 9618
19:59:31.050747 IP 10.0.2.15.44158 > 151.101.117.164.443: Flags [.], ack 231089, win 65535, length 0
19:59:31.054592 IP 151.101.117.164.443 > 10.0.2.15.44158: Flags [P.], seq 231089:236585, ack 869, win 65535, length 5496
19:59:31.054653 IP 151.101.117.164.443 > 10.0.2.15.44158: Flags [P.], seq 236585:240707, ack 869, win 65535, length 4122
19:59:31.054655 IP 151.101.117.164.443 > 10.0.2.15.44158: Flags [P.], seq 240707:243455, ack 869, win 65535, length 2748
19:59:31.054678 IP 10.0.2.15.44158 > 151.101.117.164.443: Flags [.], ack 236585, win 65535, length 0
19:59:31.054726 IP 10.0.2.15.44158 > 151.101.117.164.443: Flags [.], ack 240707, win 65535, length 0
19:59:31.054745 IP 10.0.2.15.44158 > 151.101.117.164.443: Flags [.], ack 243455, win 65535, length 0
19:59:31.057471 IP 151.101.117.164.443 > 10.0.2.15.44158: Flags [P.], seq 243455:254447, ack 869, win 65535, length 10992
19:59:31.057490 IP 10.0.2.15.44158 > 151.101.117.164.443: Flags [.], ack 254447, win 65535, length 0
19:59:31.057542 IP 151.101.117.164.443 > 10.0.2.15.44158: Flags [P.], seq 254447:255821, ack 869, win 65535, length 1374
19:59:31.057549 IP 151.101.117.164.443 > 10.0.2.15.44158: Flags [P.], seq 255821:258569, ack 869, win 65535, length 2748
19:59:31.057565 IP 10.0.2.15.44158 > 151.101.117.164.443: Flags [.], ack 258569, win 65535, length 0
19:59:31.060440 IP 151.101.117.164.443 > 10.0.2.15.44158: Flags [P.], seq 258569:269561, ack 869, win 65535, length 10992
19:59:31.060468 IP 10.0.2.15.44158 > 151.101.117.164.443: Flags [.], ack 269561, win 65535, length 0
19:59:31.061178 IP 151.101.117.164.443 > 10.0.2.15.44158: Flags [P.], seq 269561:276431, ack 869, win 65535, length 6870
19:59:31.061181 IP 151.101.117.164.443 > 10.0.2.15.44158: Flags [P.], seq 276431:280553, ack 869, win 65535, length 4122
19:59:31.061205 IP 10.0.2.15.44158 > 151.101.117.164.443: Flags [.], ack 276431, win 65535, length 0
19:59:31.061240 IP 10.0.2.15.44158 > 151.101.117.164.443: Flags [.], ack 280553, win 65535, length 0
19:59:31.063974 IP 151.101.117.164.443 > 10.0.2.15.44158: Flags [P.], seq 280553:291545, ack 869, win 65535, length 10992
19:59:31.064005 IP 10.0.2.15.44158 > 151.101.117.164.443: Flags [.], ack 291545, win 65535, length 0
19:59:31.064082 IP 151.101.117.164.443 > 10.0.2.15.44158: Flags [P.], seq 291545:295667, ack 869, win 65535, length 4122
19:59:31.064089 IP 10.0.2.15.44158 > 151.101.117.164.443: Flags [.], ack 295667, win 65535, length 0
19:59:31.066968 IP 151.101.117.164.443 > 10.0.2.15.44158: Flags [P.], seq 295667:305285, ack 869, win 65535, length 9618
19:59:31.066971 IP 151.101.117.164.443 > 10.0.2.15.44158: Flags [P.], seq 305285:308033, ack 869, win 65535, length 2748
19:59:31.066999 IP 10.0.2.15.44158 > 151.101.117.164.443: Flags [.], ack 305285, win 65535, length 0
19:59:31.067047 IP 10.0.2.15.44158 > 151.101.117.164.443: Flags [.], ack 308033, win 65535, length 0
19:59:31.067943 IP 151.101.117.164.443 > 10.0.2.15.44158: Flags [P.], seq 308033:313529, ack 869, win 65535, length 5496
19:59:31.067958 IP 10.0.2.15.44158 > 151.101.117.164.443: Flags [.], ack 313529, win 65535, length 0
19:59:31.070448 IP 151.101.117.164.443 > 10.0.2.15.44158: Flags [P.], seq 313529:319025, ack 869, win 65535, length 5496
19:59:31.070452 IP 151.101.117.164.443 > 10.0.2.15.44158: Flags [.], seq 319025:320485, ack 869, win 65535, length 1460
19:59:31.070529 IP 10.0.2.15.44158 > 151.101.117.164.443: Flags [.], ack 319025, win 65535, length 0
19:59:31.070824 IP 151.101.117.164.443 > 10.0.2.15.44158: Flags [P.], seq 320485:325895, ack 869, win 65535, length 5410
19:59:31.070836 IP 10.0.2.15.44158 > 151.101.117.164.443: Flags [.], ack 325895, win 65535, length 0
19:59:31.074242 IP 151.101.117.164.443 > 10.0.2.15.44158: Flags [P.], seq 325895:335513, ack 869, win 65535, length 9618
19:59:31.074246 IP 151.101.117.164.443 > 10.0.2.15.44158: Flags [P.], seq 335513:343757, ack 869, win 65535, length 8244
19:59:31.074461 IP 10.0.2.15.44158 > 151.101.117.164.443: Flags [.], ack 335513, win 65535, length 0
19:59:31.074507 IP 10.0.2.15.44158 > 151.101.117.164.443: Flags [.], ack 343757, win 65535, length 0
19:59:31.077164 IP 151.101.117.164.443 > 10.0.2.15.44158: Flags [P.], seq 343757:356123, ack 869, win 65535, length 12366
19:59:31.077187 IP 10.0.2.15.44158 > 151.101.117.164.443: Flags [.], ack 356123, win 65535, length 0
19:59:31.077737 IP 151.101.117.164.443 > 10.0.2.15.44158: Flags [P.], seq 356123:360245, ack 869, win 65535, length 4122
19:59:31.077761 IP 10.0.2.15.44158 > 151.101.117.164.443: Flags [.], ack 360245, win 65535, length 0
19:59:31.081238 IP 151.101.117.164.443 > 10.0.2.15.44158: Flags [P.], seq 360245:368489, ack 869, win 65535, length 8244
19:59:31.081241 IP 151.101.117.164.443 > 10.0.2.15.44158: Flags [P.], seq 368489:376733, ack 869, win 65535, length 8244
19:59:31.081264 IP 10.0.2.15.44158 > 151.101.117.164.443: Flags [.], ack 368489, win 65535, length 0
19:59:31.081298 IP 10.0.2.15.44158 > 151.101.117.164.443: Flags [.], ack 376733, win 65535, length 0
19:59:31.081336 IP 151.101.117.164.443 > 10.0.2.15.44158: Flags [P.], seq 376733:379481, ack 869, win 65535, length 2748
19:59:31.081337 IP 151.101.117.164.443 > 10.0.2.15.44158: Flags [P.], seq 379481:382229, ack 869, win 65535, length 2748
19:59:31.081345 IP 10.0.2.15.44158 > 151.101.117.164.443: Flags [.], ack 379481, win 65535, length 0
19:59:31.081361 IP 10.0.2.15.44158 > 151.101.117.164.443: Flags [.], ack 382229, win 65535, length 0
19:59:31.082202 IP 151.101.117.164.443 > 10.0.2.15.44158: Flags [P.], seq 382229:389099, ack 869, win 65535, length 6870
19:59:31.082221 IP 10.0.2.15.44158 > 151.101.117.164.443: Flags [.], ack 389099, win 65535, length 0
19:59:31.082571 IP 151.101.117.164.443 > 10.0.2.15.44158: Flags [P.], seq 389099:393221, ack 869, win 65535, length 4122
19:59:31.082586 IP 10.0.2.15.44158 > 151.101.117.164.443: Flags [.], ack 393221, win 65535, length 0
19:59:31.083587 IP 151.101.117.164.443 > 10.0.2.15.44158: Flags [P.], seq 393221:397343, ack 869, win 65535, length 4122
19:59:31.083615 IP 10.0.2.15.44158 > 151.101.117.164.443: Flags [.], ack 397343, win 65535, length 0
19:59:31.085570 IP 151.101.117.164.443 > 10.0.2.15.44158: Flags [P.], seq 397343:404213, ack 869, win 65535, length 6870
19:59:31.085590 IP 10.0.2.15.44158 > 151.101.117.164.443: Flags [.], ack 404213, win 65535, length 0
19:59:31.089287 IP 151.101.117.164.443 > 10.0.2.15.44158: Flags [P.], seq 404213:419327, ack 869, win 65535, length 15114
19:59:31.089310 IP 10.0.2.15.44158 > 151.101.117.164.443: Flags [.], ack 419327, win 65535, length 0
19:59:31.091066 IP 151.101.117.164.443 > 10.0.2.15.44158: Flags [P.], seq 419327:428945, ack 869, win 65535, length 9618
19:59:31.091251 IP 10.0.2.15.44158 > 151.101.117.164.443: Flags [.], ack 428945, win 65535, length 0
19:59:31.091956 IP 151.101.117.164.443 > 10.0.2.15.44158: Flags [P.], seq 428945:433067, ack 869, win 65535, length 4122
19:59:31.091958 IP 151.101.117.164.443 > 10.0.2.15.44158: Flags [P.], seq 433067:435815, ack 869, win 65535, length 2748
19:59:31.091973 IP 10.0.2.15.44158 > 151.101.117.164.443: Flags [.], ack 433067, win 65535, length 0
19:59:31.091998 IP 10.0.2.15.44158 > 151.101.117.164.443: Flags [.], ack 435815, win 65535, length 0
19:59:31.092931 IP 151.101.117.164.443 > 10.0.2.15.44158: Flags [P.], seq 435815:441311, ack 869, win 65535, length 5496
19:59:31.092947 IP 10.0.2.15.44158 > 151.101.117.164.443: Flags [.], ack 441311, win 65535, length 0
19:59:31.093571 IP 151.101.117.164.443 > 10.0.2.15.44158: Flags [P.], seq 441311:442685, ack 869, win 65535, length 1374
19:59:31.096888 IP 151.101.117.164.443 > 10.0.2.15.44158: Flags [P.], seq 442685:452303, ack 869, win 65535, length 9618
19:59:31.096892 IP 151.101.117.164.443 > 10.0.2.15.44158: Flags [P.], seq 452303:455051, ack 869, win 65535, length 2748
19:59:31.096921 IP 10.0.2.15.44158 > 151.101.117.164.443: Flags [.], ack 452303, win 65535, length 0
19:59:31.097043 IP 10.0.2.15.44158 > 151.101.117.164.443: Flags [.], ack 455051, win 65535, length 0
19:59:31.097145 IP 151.101.117.164.443 > 10.0.2.15.44158: Flags [P.], seq 455051:457799, ack 869, win 65535, length 2748
19:59:31.097613 IP 151.101.117.164.443 > 10.0.2.15.44158: Flags [P.], seq 457799:460547, ack 869, win 65535, length 2748
19:59:31.097616 IP 151.101.117.164.443 > 10.0.2.15.44158: Flags [P.], seq 460547:463295, ack 869, win 65535, length 2748
19:59:31.097636 IP 10.0.2.15.44158 > 151.101.117.164.443: Flags [.], ack 457799, win 65535, length 0
19:59:31.097668 IP 10.0.2.15.44158 > 151.101.117.164.443: Flags [.], ack 460547, win 65535, length 0
19:59:31.097682 IP 10.0.2.15.44158 > 151.101.117.164.443: Flags [.], ack 463295, win 65535, length 0
19:59:31.098462 IP 151.101.117.164.443 > 10.0.2.15.44158: Flags [P.], seq 463295:471539, ack 869, win 65535, length 8244
19:59:31.098464 IP 151.101.117.164.443 > 10.0.2.15.44158: Flags [P.], seq 471539:472913, ack 869, win 65535, length 1374
19:59:31.098465 IP 151.101.117.164.443 > 10.0.2.15.44158: Flags [P.], seq 472913:477035, ack 869, win 65535, length 4122
19:59:31.098482 IP 10.0.2.15.44158 > 151.101.117.164.443: Flags [.], ack 471539, win 65535, length 0
19:59:31.098567 IP 10.0.2.15.44158 > 151.101.117.164.443: Flags [.], ack 477035, win 65535, length 0
19:59:31.098596 IP 151.101.117.164.443 > 10.0.2.15.44158: Flags [P.], seq 477035:479783, ack 869, win 65535, length 2748
19:59:31.098601 IP 10.0.2.15.44158 > 151.101.117.164.443: Flags [.], ack 479783, win 65535, length 0
19:59:31.100660 IP 151.101.117.164.443 > 10.0.2.15.44158: Flags [P.], seq 479783:488027, ack 869, win 65535, length 8244
19:59:31.100680 IP 10.0.2.15.44158 > 151.101.117.164.443: Flags [.], ack 488027, win 65535, length 0
19:59:31.104659 IP 151.101.117.164.443 > 10.0.2.15.44158: Flags [.], seq 488027:489487, ack 869, win 65535, length 1460
19:59:31.104997 IP 151.101.117.164.443 > 10.0.2.15.44158: Flags [P.], seq 489487:500393, ack 869, win 65535, length 10906
19:59:31.105017 IP 10.0.2.15.44158 > 151.101.117.164.443: Flags [.], ack 500393, win 65535, length 0
19:59:31.105229 IP 151.101.117.164.443 > 10.0.2.15.44158: Flags [P.], seq 500393:501767, ack 869, win 65535, length 1374
19:59:31.108484 IP 151.101.117.164.443 > 10.0.2.15.44158: Flags [P.], seq 501767:510011, ack 869, win 65535, length 8244
19:59:31.108489 IP 151.101.117.164.443 > 10.0.2.15.44158: Flags [P.], seq 510011:523751, ack 869, win 65535, length 13740
19:59:31.108508 IP 10.0.2.15.44158 > 151.101.117.164.443: Flags [.], ack 510011, win 65535, length 0
19:59:31.108534 IP 10.0.2.15.44158 > 151.101.117.164.443: Flags [.], ack 523751, win 65535, length 0
19:59:31.110224 IP 151.101.117.164.443 > 10.0.2.15.44158: Flags [P.], seq 523751:529247, ack 869, win 65535, length 5496
19:59:31.110226 IP 151.101.117.164.443 > 10.0.2.15.44158: Flags [P.], seq 529247:533369, ack 869, win 65535, length 4122
19:59:31.110228 IP 151.101.117.164.443 > 10.0.2.15.44158: Flags [P.], seq 533369:536117, ack 869, win 65535, length 2748
19:59:31.110247 IP 10.0.2.15.44158 > 151.101.117.164.443: Flags [.], ack 529247, win 65535, length 0
19:59:31.110280 IP 10.0.2.15.44158 > 151.101.117.164.443: Flags [.], ack 533369, win 65535, length 0
19:59:31.110293 IP 10.0.2.15.44158 > 151.101.117.164.443: Flags [.], ack 536117, win 65535, length 0
19:59:31.110316 IP 151.101.117.164.443 > 10.0.2.15.44158: Flags [P.], seq 536117:538865, ack 869, win 65535, length 2748
19:59:31.110322 IP 10.0.2.15.44158 > 151.101.117.164.443: Flags [.], ack 538865, win 65535, length 0
19:59:31.113923 IP 151.101.117.164.443 > 10.0.2.15.44158: Flags [P.], seq 538865:551231, ack 869, win 65535, length 12366
19:59:31.113949 IP 10.0.2.15.44158 > 151.101.117.164.443: Flags [.], ack 551231, win 65535, length 0
19:59:31.114012 IP 151.101.117.164.443 > 10.0.2.15.44158: Flags [P.], seq 551231:556727, ack 869, win 65535, length 5496
19:59:31.114013 IP 151.101.117.164.443 > 10.0.2.15.44158: Flags [P.], seq 556727:560849, ack 869, win 65535, length 4122
19:59:31.114213 IP 10.0.2.15.44158 > 151.101.117.164.443: Flags [.], ack 560849, win 65535, length 0
19:59:31.115496 IP 151.101.117.164.443 > 10.0.2.15.44158: Flags [P.], seq 560849:569093, ack 869, win 65535, length 8244
19:59:31.115518 IP 10.0.2.15.44158 > 151.101.117.164.443: Flags [.], ack 569093, win 65535, length 0
19:59:31.115647 IP 151.101.117.164.443 > 10.0.2.15.44158: Flags [P.], seq 569093:574589, ack 869, win 65535, length 5496
19:59:31.115717 IP 10.0.2.15.44158 > 151.101.117.164.443: Flags [.], ack 574589, win 65535, length 0
19:59:31.117900 IP 151.101.117.164.443 > 10.0.2.15.44158: Flags [P.], seq 574589:582833, ack 869, win 65535, length 8244
19:59:31.117905 IP 151.101.117.164.443 > 10.0.2.15.44158: Flags [P.], seq 582833:584207, ack 869, win 65535, length 1374
19:59:31.117906 IP 151.101.117.164.443 > 10.0.2.15.44158: Flags [P.], seq 584207:586955, ack 869, win 65535, length 2748
19:59:31.117932 IP 10.0.2.15.44158 > 151.101.117.164.443: Flags [.], ack 582833, win 65535, length 0
19:59:31.118098 IP 10.0.2.15.44158 > 151.101.117.164.443: Flags [.], ack 586955, win 65535, length 0
19:59:31.120745 IP 151.101.117.164.443 > 10.0.2.15.44158: Flags [P.], seq 586955:595199, ack 869, win 65535, length 8244
19:59:31.120747 IP 151.101.117.164.443 > 10.0.2.15.44158: Flags [P.], seq 595199:596573, ack 869, win 65535, length 1374
19:59:31.120769 IP 10.0.2.15.44158 > 151.101.117.164.443: Flags [.], ack 595199, win 65535, length 0
19:59:31.121664 IP 151.101.117.164.443 > 10.0.2.15.44158: Flags [P.], seq 596573:603443, ack 869, win 65535, length 6870
19:59:31.121680 IP 10.0.2.15.44158 > 151.101.117.164.443: Flags [.], ack 603443, win 65535, length 0
19:59:31.124298 IP 151.101.117.164.443 > 10.0.2.15.44158: Flags [.], seq 603443:610743, ack 869, win 65535, length 7300
19:59:31.124321 IP 10.0.2.15.44158 > 151.101.117.164.443: Flags [.], ack 610743, win 65535, length 0
19:59:31.124779 IP 151.101.117.164.443 > 10.0.2.15.44158: Flags [P.], seq 610743:613061, ack 869, win 65535, length 2318
19:59:31.124782 IP 151.101.117.164.443 > 10.0.2.15.44158: Flags [P.], seq 613061:618557, ack 869, win 65535, length 5496
19:59:31.124783 IP 151.101.117.164.443 > 10.0.2.15.44158: Flags [P.], seq 618557:621305, ack 869, win 65535, length 2748
19:59:31.124815 IP 151.101.117.164.443 > 10.0.2.15.44158: Flags [P.], seq 621305:624053, ack 869, win 65535, length 2748
19:59:31.124884 IP 10.0.2.15.44158 > 151.101.117.164.443: Flags [.], ack 624053, win 65535, length 0
19:59:31.127524 IP 151.101.117.164.443 > 10.0.2.15.44158: Flags [P.], seq 624053:633671, ack 869, win 65535, length 9618
19:59:31.127525 IP 151.101.117.164.443 > 10.0.2.15.44158: Flags [.], seq 633671:635131, ack 869, win 65535, length 1460
19:59:31.127576 IP 10.0.2.15.44158 > 151.101.117.164.443: Flags [.], ack 633671, win 65535, length 0
19:59:31.127936 IP 151.101.117.164.443 > 10.0.2.15.44158: Flags [P.], seq 635131:636419, ack 869, win 65535, length 1288
19:59:31.127939 IP 151.101.117.164.443 > 10.0.2.15.44158: Flags [P.], seq 636419:644663, ack 869, win 65535, length 8244
19:59:31.127949 IP 10.0.2.15.44158 > 151.101.117.164.443: Flags [.], ack 636419, win 65535, length 0
19:59:31.128002 IP 10.0.2.15.44158 > 151.101.117.164.443: Flags [.], ack 644663, win 65535, length 0
19:59:31.129851 IP 151.101.117.164.443 > 10.0.2.15.44158: Flags [P.], seq 644663:654281, ack 869, win 65535, length 9618
19:59:31.129854 IP 151.101.117.164.443 > 10.0.2.15.44158: Flags [P.], seq 654281:658403, ack 869, win 65535, length 4122
19:59:31.129991 IP 10.0.2.15.44158 > 151.101.117.164.443: Flags [.], ack 658403, win 65535, length 0
19:59:31.132033 IP 151.101.117.164.443 > 10.0.2.15.44158: Flags [P.], seq 658403:668021, ack 869, win 65535, length 9618
19:59:31.132036 IP 151.101.117.164.443 > 10.0.2.15.44158: Flags [P.], seq 668021:672143, ack 869, win 65535, length 4122
19:59:31.132057 IP 10.0.2.15.44158 > 151.101.117.164.443: Flags [.], ack 668021, win 65535, length 0
19:59:31.132349 IP 151.101.117.164.443 > 10.0.2.15.44158: Flags [P.], seq 672143:674891, ack 869, win 65535, length 2748
19:59:31.132485 IP 10.0.2.15.44158 > 151.101.117.164.443: Flags [.], ack 674891, win 65535, length 0
19:59:31.134975 IP 151.101.117.164.443 > 10.0.2.15.44158: Flags [P.], seq 674891:677639, ack 869, win 65535, length 2748
19:59:31.134998 IP 10.0.2.15.44158 > 151.101.117.164.443: Flags [.], ack 677639, win 65535, length 0
19:59:31.135159 IP 151.101.117.164.443 > 10.0.2.15.44158: Flags [P.], seq 677639:684509, ack 869, win 65535, length 6870
19:59:31.135347 IP 151.101.117.164.443 > 10.0.2.15.44158: Flags [P.], seq 684509:687257, ack 869, win 65535, length 2748
19:59:31.135524 IP 151.101.117.164.443 > 10.0.2.15.44158: Flags [P.], seq 687257:690005, ack 869, win 65535, length 2748
19:59:31.135726 IP 151.101.117.164.443 > 10.0.2.15.44158: Flags [P.], seq 690005:695501, ack 869, win 65535, length 5496
19:59:31.135773 IP 10.0.2.15.44158 > 151.101.117.164.443: Flags [.], ack 695501, win 65535, length 0
19:59:31.138240 IP 151.101.117.164.443 > 10.0.2.15.44158: Flags [P.], seq 695501:696875, ack 869, win 65535, length 1374
19:59:31.138243 IP 151.101.117.164.443 > 10.0.2.15.44158: Flags [P.], seq 696875:703745, ack 869, win 65535, length 6870
19:59:31.138429 IP 10.0.2.15.44158 > 151.101.117.164.443: Flags [.], ack 703745, win 65535, length 0
19:59:31.141448 IP 151.101.117.164.443 > 10.0.2.15.44158: Flags [P.], seq 703745:711989, ack 869, win 65535, length 8244
19:59:31.141451 IP 151.101.117.164.443 > 10.0.2.15.44158: Flags [P.], seq 711989:718859, ack 869, win 65535, length 6870
19:59:31.141528 IP 10.0.2.15.44158 > 151.101.117.164.443: Flags [.], ack 711989, win 65535, length 0
19:59:31.141709 IP 151.101.117.164.443 > 10.0.2.15.44158: Flags [P.], seq 718859:720233, ack 869, win 65535, length 1374
19:59:31.141711 IP 151.101.117.164.443 > 10.0.2.15.44158: Flags [P.], seq 720233:722981, ack 869, win 65535, length 2748
19:59:31.141931 IP 10.0.2.15.44158 > 151.101.117.164.443: Flags [.], ack 722981, win 65535, length 0
19:59:31.142053 IP 151.101.117.164.443 > 10.0.2.15.44158: Flags [P.], seq 722981:725729, ack 869, win 65535, length 2748
19:59:31.142120 IP 10.0.2.15.44158 > 151.101.117.164.443: Flags [.], ack 725729, win 65535, length 0
19:59:31.143789 IP 151.101.117.164.443 > 10.0.2.15.44158: Flags [P.], seq 725729:736721, ack 869, win 65535, length 10992
19:59:31.143806 IP 10.0.2.15.44158 > 151.101.117.164.443: Flags [.], ack 736721, win 65535, length 0
19:59:31.143846 IP 151.101.117.164.443 > 10.0.2.15.44158: Flags [P.], seq 736721:740843, ack 869, win 65535, length 4122
19:59:31.143847 IP 151.101.117.164.443 > 10.0.2.15.44158: Flags [P.], seq 740843:743591, ack 869, win 65535, length 2748
19:59:31.143847 IP 151.101.117.164.443 > 10.0.2.15.44158: Flags [P.], seq 743591:746339, ack 869, win 65535, length 2748
19:59:31.143909 IP 10.0.2.15.44158 > 151.101.117.164.443: Flags [.], ack 746339, win 65535, length 0
19:59:31.145686 IP 151.101.117.164.443 > 10.0.2.15.44158: Flags [P.], seq 746339:755957, ack 869, win 65535, length 9618
19:59:31.145689 IP 151.101.117.164.443 > 10.0.2.15.44158: Flags [P.], seq 755957:760079, ack 869, win 65535, length 4122
19:59:31.145711 IP 10.0.2.15.44158 > 151.101.117.164.443: Flags [.], ack 755957, win 65535, length 0
19:59:31.146262 IP 10.0.2.15.44158 > 151.101.117.164.443: Flags [.], ack 760079, win 65535, length 0
19:59:31.147987 IP 151.101.117.164.443 > 10.0.2.15.44158: Flags [P.], seq 760079:768323, ack 869, win 65535, length 8244
19:59:31.147990 IP 151.101.117.164.443 > 10.0.2.15.44158: Flags [.], seq 768323:769783, ack 869, win 65535, length 1460
19:59:31.148048 IP 10.0.2.15.44158 > 151.101.117.164.443: Flags [.], ack 768323, win 65535, length 0
19:59:31.148214 IP 151.101.117.164.443 > 10.0.2.15.44158: Flags [P.], seq 769783:773819, ack 869, win 65535, length 4036
19:59:31.148251 IP 10.0.2.15.44158 > 151.101.117.164.443: Flags [.], ack 773819, win 65535, length 0
19:59:31.151258 IP 151.101.117.164.443 > 10.0.2.15.44158: Flags [P.], seq 773819:779315, ack 869, win 65535, length 5496
19:59:31.151262 IP 151.101.117.164.443 > 10.0.2.15.44158: Flags [P.], seq 779315:786185, ack 869, win 65535, length 6870
19:59:31.151427 IP 10.0.2.15.44158 > 151.101.117.164.443: Flags [.], ack 779315, win 65535, length 0
19:59:31.151652 IP 151.101.117.164.443 > 10.0.2.15.44158: Flags [P.], seq 786185:791681, ack 869, win 65535, length 5496
19:59:31.151784 IP 151.101.117.164.443 > 10.0.2.15.44158: Flags [P.], seq 791681:795803, ack 869, win 65535, length 4122
19:59:31.151909 IP 10.0.2.15.44158 > 151.101.117.164.443: Flags [.], ack 795803, win 65535, length 0
19:59:31.152984 IP 151.101.117.164.443 > 10.0.2.15.44158: Flags [P.], seq 795803:797177, ack 869, win 65535, length 1374
19:59:31.154397 IP 151.101.117.164.443 > 10.0.2.15.44158: Flags [P.], seq 797177:804047, ack 869, win 65535, length 6870
19:59:31.154399 IP 151.101.117.164.443 > 10.0.2.15.44158: Flags [P.], seq 804047:805421, ack 869, win 65535, length 1374
19:59:31.154421 IP 10.0.2.15.44158 > 151.101.117.164.443: Flags [.], ack 804047, win 65535, length 0
19:59:31.155332 IP 151.101.117.164.443 > 10.0.2.15.44158: Flags [P.], seq 805421:810917, ack 869, win 65535, length 5496
19:59:31.155355 IP 10.0.2.15.44158 > 151.101.117.164.443: Flags [.], ack 810917, win 65535, length 0
19:59:31.156079 IP 151.101.117.164.443 > 10.0.2.15.44158: Flags [P.], seq 810917:817787, ack 869, win 65535, length 6870
19:59:31.156206 IP 10.0.2.15.44158 > 151.101.117.164.443: Flags [.], ack 817787, win 65535, length 0
19:59:31.159044 IP 151.101.117.164.443 > 10.0.2.15.44158: Flags [P.], seq 817787:830153, ack 869, win 65535, length 12366
19:59:31.159066 IP 10.0.2.15.44158 > 151.101.117.164.443: Flags [.], ack 830153, win 65535, length 0
19:59:31.159117 IP 151.101.117.164.443 > 10.0.2.15.44158: Flags [P.], seq 830153:832901, ack 869, win 65535, length 2748
19:59:31.159118 IP 151.101.117.164.443 > 10.0.2.15.44158: Flags [P.], seq 832901:835649, ack 869, win 65535, length 2748
19:59:31.159119 IP 151.101.117.164.443 > 10.0.2.15.44158: Flags [P.], seq 835649:838397, ack 869, win 65535, length 2748
19:59:31.159200 IP 10.0.2.15.44158 > 151.101.117.164.443: Flags [.], ack 838397, win 65535, length 0
19:59:31.160860 IP 151.101.117.164.443 > 10.0.2.15.44158: Flags [P.], seq 838397:845267, ack 869, win 65535, length 6870
19:59:31.160967 IP 10.0.2.15.44158 > 151.101.117.164.443: Flags [.], ack 845267, win 65535, length 0
19:59:31.161490 IP 151.101.117.164.443 > 10.0.2.15.44158: Flags [P.], seq 845267:852137, ack 869, win 65535, length 6870
19:59:31.161493 IP 151.101.117.164.443 > 10.0.2.15.44158: Flags [.], seq 852137:856517, ack 869, win 65535, length 4380
19:59:31.161592 IP 10.0.2.15.44158 > 151.101.117.164.443: Flags [.], ack 856517, win 65535, length 0
19:59:31.162199 IP 151.101.117.164.443 > 10.0.2.15.44158: Flags [P.], seq 856517:857633, ack 869, win 65535, length 1116
19:59:31.162202 IP 151.101.117.164.443 > 10.0.2.15.44158: Flags [.], seq 857633:860553, ack 869, win 65535, length 2920
19:59:31.162335 IP 10.0.2.15.44158 > 151.101.117.164.443: Flags [.], ack 860553, win 65535, length 0
19:59:31.162492 IP 151.101.117.164.443 > 10.0.2.15.44158: Flags [P.], seq 860553:863129, ack 869, win 65535, length 2576
19:59:31.162498 IP 10.0.2.15.44158 > 151.101.117.164.443: Flags [.], ack 863129, win 65535, length 0
19:59:31.164124 IP 151.101.117.164.443 > 10.0.2.15.44158: Flags [P.], seq 863129:872747, ack 869, win 65535, length 9618
19:59:31.164213 IP 10.0.2.15.44158 > 151.101.117.164.443: Flags [.], ack 872747, win 65535, length 0
19:59:31.164532 IP 151.101.117.164.443 > 10.0.2.15.44158: Flags [P.], seq 872747:878243, ack 869, win 65535, length 5496
19:59:31.164541 IP 10.0.2.15.44158 > 151.101.117.164.443: Flags [.], ack 878243, win 65535, length 0
19:59:31.167817 IP 151.101.117.164.443 > 10.0.2.15.44158: Flags [P.], seq 878243:891983, ack 869, win 65535, length 13740
19:59:31.167870 IP 151.101.117.164.443 > 10.0.2.15.44158: Flags [P.], seq 891983:894731, ack 869, win 65535, length 2748
19:59:31.167872 IP 151.101.117.164.443 > 10.0.2.15.44158: Flags [P.], seq 894731:896105, ack 869, win 65535, length 1374
19:59:31.168023 IP 151.101.117.164.443 > 10.0.2.15.44158: Flags [P.], seq 896105:901601, ack 869, win 65535, length 5496
19:59:31.168240 IP 10.0.2.15.44158 > 151.101.117.164.443: Flags [.], ack 901601, win 65535, length 0
19:59:31.168593 IP 151.101.117.164.443 > 10.0.2.15.44158: Flags [P.], seq 901601:907097, ack 869, win 65535, length 5496
19:59:31.168638 IP 10.0.2.15.44158 > 151.101.117.164.443: Flags [.], ack 907097, win 65535, length 0
19:59:31.168950 IP 151.101.117.164.443 > 10.0.2.15.44158: Flags [.], seq 907097:910017, ack 869, win 65535, length 2920
19:59:31.168961 IP 10.0.2.15.44158 > 151.101.117.164.443: Flags [.], ack 910017, win 65535, length 0
19:59:31.169289 IP 151.101.117.164.443 > 10.0.2.15.44158: Flags [P.], seq 910017:912593, ack 869, win 65535, length 2576
19:59:31.169290 IP 151.101.117.164.443 > 10.0.2.15.44158: Flags [P.], seq 912593:913967, ack 869, win 65535, length 1374
19:59:31.169303 IP 10.0.2.15.44158 > 151.101.117.164.443: Flags [.], ack 912593, win 65535, length 0
19:59:31.171717 IP 151.101.117.164.443 > 10.0.2.15.44158: Flags [P.], seq 913967:920837, ack 869, win 65535, length 6870
19:59:31.171813 IP 10.0.2.15.44158 > 151.101.117.164.443: Flags [.], ack 920837, win 65535, length 0
19:59:31.172353 IP 151.101.117.164.443 > 10.0.2.15.44158: Flags [P.], seq 920837:926333, ack 869, win 65535, length 5496
19:59:31.172354 IP 151.101.117.164.443 > 10.0.2.15.44158: Flags [P.], seq 926333:927707, ack 869, win 65535, length 1374
19:59:31.172370 IP 10.0.2.15.44158 > 151.101.117.164.443: Flags [.], ack 926333, win 65535, length 0
19:59:31.174817 IP 151.101.117.164.443 > 10.0.2.15.44158: Flags [P.], seq 927707:937325, ack 869, win 65535, length 9618
19:59:31.174821 IP 151.101.117.164.443 > 10.0.2.15.44158: Flags [P.], seq 937325:942821, ack 869, win 65535, length 5496
19:59:31.174854 IP 151.101.117.164.443 > 10.0.2.15.44158: Flags [P.], seq 942821:944195, ack 869, win 65535, length 1374
19:59:31.174915 IP 10.0.2.15.44158 > 151.101.117.164.443: Flags [.], ack 944195, win 65535, length 0
19:59:31.176792 IP 151.101.117.164.443 > 10.0.2.15.44158: Flags [P.], seq 944195:952439, ack 869, win 65535, length 8244
19:59:31.176811 IP 10.0.2.15.44158 > 151.101.117.164.443: Flags [.], ack 952439, win 65535, length 0
19:59:31.177375 IP 151.101.117.164.443 > 10.0.2.15.44158: Flags [P.], seq 952439:960683, ack 869, win 65535, length 8244
19:59:31.177832 IP 151.101.117.164.443 > 10.0.2.15.44158: Flags [P.], seq 960683:963431, ack 869, win 65535, length 2748
19:59:31.177835 IP 151.101.117.164.443 > 10.0.2.15.44158: Flags [P.], seq 963431:968927, ack 869, win 65535, length 5496
19:59:31.177911 IP 10.0.2.15.44158 > 151.101.117.164.443: Flags [.], ack 968927, win 65535, length 0
19:59:31.178686 IP 151.101.117.164.443 > 10.0.2.15.44158: Flags [P.], seq 968927:975797, ack 869, win 65535, length 6870
19:59:31.178703 IP 10.0.2.15.44158 > 151.101.117.164.443: Flags [.], ack 975797, win 65535, length 0
19:59:31.178800 IP 151.101.117.164.443 > 10.0.2.15.44158: Flags [P.], seq 975797:977171, ack 869, win 65535, length 1374
19:59:31.179980 IP 151.101.117.164.443 > 10.0.2.15.44158: Flags [P.], seq 977171:985415, ack 869, win 65535, length 8244
19:59:31.180079 IP 10.0.2.15.44158 > 151.101.117.164.443: Flags [.], ack 985415, win 65535, length 0
19:59:31.183734 IP 151.101.117.164.443 > 10.0.2.15.44158: Flags [P.], seq 985415:997781, ack 869, win 65535, length 12366
19:59:31.183772 IP 151.101.117.164.443 > 10.0.2.15.44158: Flags [P.], seq 997781:1000529, ack 869, win 65535, length 2748
19:59:31.184168 IP 10.0.2.15.44158 > 151.101.117.164.443: Flags [.], ack 1000529, win 65535, length 0
19:59:31.185245 IP 151.101.117.164.443 > 10.0.2.15.44158: Flags [P.], seq 1000529:1008773, ack 869, win 65535, length 8244
19:59:31.185435 IP 10.0.2.15.44158 > 151.101.117.164.443: Flags [.], ack 1008773, win 65535, length 0
19:59:31.186520 IP 151.101.117.164.443 > 10.0.2.15.44158: Flags [P.], seq 1008773:1017017, ack 869, win 65535, length 8244
19:59:31.186522 IP 151.101.117.164.443 > 10.0.2.15.44158: Flags [P.], seq 1017017:1021139, ack 869, win 65535, length 4122
19:59:31.186544 IP 10.0.2.15.44158 > 151.101.117.164.443: Flags [.], ack 1017017, win 65535, length 0
19:59:31.186729 IP 151.101.117.164.443 > 10.0.2.15.44158: Flags [P.], seq 1021139:1023887, ack 869, win 65535, length 2748
19:59:31.187022 IP 10.0.2.15.44158 > 151.101.117.164.443: Flags [.], ack 1023887, win 65535, length 0
19:59:31.188725 IP 151.101.117.164.443 > 10.0.2.15.44158: Flags [P.], seq 1023887:1033505, ack 869, win 65535, length 9618
19:59:31.188751 IP 10.0.2.15.44158 > 151.101.117.164.443: Flags [.], ack 1033505, win 65535, length 0
19:59:31.189892 IP 151.101.117.164.443 > 10.0.2.15.44158: Flags [P.], seq 1033505:1041749, ack 869, win 65535, length 8244
19:59:31.189913 IP 10.0.2.15.44158 > 151.101.117.164.443: Flags [.], ack 1041749, win 65535, length 0
19:59:31.190298 IP 151.101.117.164.443 > 10.0.2.15.44158: Flags [P.], seq 1041749:1048619, ack 869, win 65535, length 6870
19:59:31.190363 IP 10.0.2.15.44158 > 151.101.117.164.443: Flags [.], ack 1048619, win 65535, length 0
19:59:31.191736 IP 151.101.117.164.443 > 10.0.2.15.44158: Flags [P.], seq 1048619:1049993, ack 869, win 65535, length 1374
19:59:31.193045 IP 151.101.117.164.443 > 10.0.2.15.44158: Flags [P.], seq 1049993:1062359, ack 869, win 65535, length 12366
19:59:31.193064 IP 10.0.2.15.44158 > 151.101.117.164.443: Flags [.], ack 1062359, win 65535, length 0
19:59:31.193108 IP 151.101.117.164.443 > 10.0.2.15.44158: Flags [P.], seq 1062359:1065107, ack 869, win 65535, length 2748
19:59:31.193175 IP 10.0.2.15.44158 > 151.101.117.164.443: Flags [.], ack 1065107, win 65535, length 0
19:59:31.195176 IP 151.101.117.164.443 > 10.0.2.15.44158: Flags [P.], seq 1065107:1073351, ack 869, win 65535, length 8244
19:59:31.195195 IP 10.0.2.15.44158 > 151.101.117.164.443: Flags [.], ack 1073351, win 65535, length 0
19:59:31.196035 IP 151.101.117.164.443 > 10.0.2.15.44158: Flags [P.], seq 1073351:1078847, ack 869, win 65535, length 5496
19:59:31.196037 IP 151.101.117.164.443 > 10.0.2.15.44158: Flags [.], seq 1078847:1080307, ack 869, win 65535, length 1460
19:59:31.196052 IP 10.0.2.15.44158 > 151.101.117.164.443: Flags [.], ack 1078847, win 65535, length 0
19:59:31.196154 IP 151.101.117.164.443 > 10.0.2.15.44158: Flags [P.], seq 1080307:1081595, ack 869, win 65535, length 1288
19:59:31.196203 IP 10.0.2.15.44158 > 151.101.117.164.443: Flags [.], ack 1081595, win 65535, length 0
19:59:31.197613 IP 151.101.117.164.443 > 10.0.2.15.44158: Flags [P.], seq 1081595:1093961, ack 869, win 65535, length 12366
19:59:31.197668 IP 151.101.117.164.443 > 10.0.2.15.44158: Flags [.], seq 1093961:1095421, ack 869, win 65535, length 1460
19:59:31.197835 IP 151.101.117.164.443 > 10.0.2.15.44158: Flags [P.], seq 1095421:1098083, ack 869, win 65535, length 2662
19:59:31.197836 IP 151.101.117.164.443 > 10.0.2.15.44158: Flags [P.], seq 1098083:1099457, ack 869, win 65535, length 1374
19:59:31.197924 IP 10.0.2.15.44158 > 151.101.117.164.443: Flags [.], ack 1099457, win 65535, length 0
19:59:31.199095 IP 151.101.117.164.443 > 10.0.2.15.44158: Flags [P.], seq 1099457:1107701, ack 869, win 65535, length 8244
19:59:31.199098 IP 151.101.117.164.443 > 10.0.2.15.44158: Flags [.], seq 1107701:1110621, ack 869, win 65535, length 2920
19:59:31.199119 IP 10.0.2.15.44158 > 151.101.117.164.443: Flags [.], ack 1107701, win 65535, length 0
19:59:31.199217 IP 10.0.2.15.44158 > 151.101.117.164.443: Flags [.], ack 1110621, win 65535, length 0
19:59:31.199579 IP 151.101.117.164.443 > 10.0.2.15.44158: Flags [P.], seq 1110621:1113197, ack 869, win 65535, length 2576
19:59:31.199581 IP 151.101.117.164.443 > 10.0.2.15.44158: Flags [P.], seq 1113197:1118693, ack 869, win 65535, length 5496
19:59:31.199672 IP 151.101.117.164.443 > 10.0.2.15.44158: Flags [P.], seq 1118693:1121441, ack 869, win 65535, length 2748
19:59:31.199728 IP 10.0.2.15.44158 > 151.101.117.164.443: Flags [.], ack 1121441, win 65535, length 0
19:59:31.201699 IP 151.101.117.164.443 > 10.0.2.15.44158: Flags [P.], seq 1121441:1129685, ack 869, win 65535, length 8244
19:59:31.201702 IP 151.101.117.164.443 > 10.0.2.15.44158: Flags [P.], seq 1129685:1135181, ack 869, win 65535, length 5496
19:59:31.201724 IP 10.0.2.15.44158 > 151.101.117.164.443: Flags [.], ack 1129685, win 65535, length 0
19:59:31.201778 IP 151.101.117.164.443 > 10.0.2.15.44158: Flags [P.], seq 1135181:1136555, ack 869, win 65535, length 1374
19:59:31.201876 IP 10.0.2.15.44158 > 151.101.117.164.443: Flags [.], ack 1136555, win 65535, length 0
19:59:31.203442 IP 151.101.117.164.443 > 10.0.2.15.44158: Flags [P.], seq 1136555:1142051, ack 869, win 65535, length 5496
19:59:31.203459 IP 10.0.2.15.44158 > 151.101.117.164.443: Flags [.], ack 1142051, win 65535, length 0
19:59:31.204285 IP 151.101.117.164.443 > 10.0.2.15.44158: Flags [P.], seq 1142051:1148921, ack 869, win 65535, length 6870
19:59:31.204287 IP 151.101.117.164.443 > 10.0.2.15.44158: Flags [P.], seq 1148921:1151669, ack 869, win 65535, length 2748
19:59:31.204288 IP 151.101.117.164.443 > 10.0.2.15.44158: Flags [P.], seq 1151669:1155791, ack 869, win 65535, length 4122
19:59:31.204310 IP 151.101.117.164.443 > 10.0.2.15.44158: Flags [P.], seq 1155791:1157165, ack 869, win 65535, length 1374
19:59:31.204853 IP 151.101.117.164.443 > 10.0.2.15.44158: Flags [P.], seq 1157165:1159913, ack 869, win 65535, length 2748
19:59:31.204855 IP 151.101.117.164.443 > 10.0.2.15.44158: Flags [P.], seq 1159913:1162661, ack 869, win 65535, length 2748
19:59:31.205042 IP 10.0.2.15.44158 > 151.101.117.164.443: Flags [.], ack 1157165, win 65535, length 0
19:59:31.205203 IP 10.0.2.15.44158 > 151.101.117.164.443: Flags [.], ack 1162661, win 65535, length 0
19:59:31.207182 IP 151.101.117.164.443 > 10.0.2.15.44158: Flags [P.], seq 1162661:1172279, ack 869, win 65535, length 9618
19:59:31.207184 IP 151.101.117.164.443 > 10.0.2.15.44158: Flags [P.], seq 1172279:1176401, ack 869, win 65535, length 4122
19:59:31.207205 IP 10.0.2.15.44158 > 151.101.117.164.443: Flags [.], ack 1172279, win 65535, length 0
19:59:31.207247 IP 151.101.117.164.443 > 10.0.2.15.44158: Flags [P.], seq 1176401:1177775, ack 869, win 65535, length 1374
19:59:31.207315 IP 10.0.2.15.44158 > 151.101.117.164.443: Flags [.], ack 1177775, win 65535, length 0
19:59:31.209237 IP 151.101.117.164.443 > 10.0.2.15.44158: Flags [P.], seq 1177775:1179149, ack 869, win 65535, length 1374
19:59:31.209240 IP 151.101.117.164.443 > 10.0.2.15.44158: Flags [P.], seq 1179149:1184645, ack 869, win 65535, length 5496
19:59:31.209303 IP 151.101.117.164.443 > 10.0.2.15.44158: Flags [P.], seq 1184645:1187393, ack 869, win 65535, length 2748
19:59:31.209306 IP 151.101.117.164.443 > 10.0.2.15.44158: Flags [P.], seq 1187393:1190141, ack 869, win 65535, length 2748
19:59:31.209563 IP 151.101.117.164.443 > 10.0.2.15.44158: Flags [P.], seq 1190141:1194263, ack 869, win 65535, length 4122
19:59:31.209597 IP 10.0.2.15.44158 > 151.101.117.164.443: Flags [.], ack 1194263, win 65535, length 0
19:59:31.212487 IP 151.101.117.164.443 > 10.0.2.15.44158: Flags [P.], seq 1194263:1203881, ack 869, win 65535, length 9618
19:59:31.212490 IP 151.101.117.164.443 > 10.0.2.15.44158: Flags [P.], seq 1203881:1206629, ack 869, win 65535, length 2748
19:59:31.212514 IP 10.0.2.15.44158 > 151.101.117.164.443: Flags [.], ack 1203881, win 65535, length 0
19:59:31.212567 IP 151.101.117.164.443 > 10.0.2.15.44158: Flags [P.], seq 1206629:1209377, ack 869, win 65535, length 2748
19:59:31.212633 IP 10.0.2.15.44158 > 151.101.117.164.443: Flags [.], ack 1209377, win 65535, length 0
19:59:31.214264 IP 151.101.117.164.443 > 10.0.2.15.44158: Flags [P.], seq 1209377:1218995, ack 869, win 65535, length 9618
19:59:31.214283 IP 10.0.2.15.44158 > 151.101.117.164.443: Flags [.], ack 1218995, win 65535, length 0
19:59:31.215878 IP 151.101.117.164.443 > 10.0.2.15.44158: Flags [P.], seq 1218995:1228613, ack 869, win 65535, length 9618
19:59:31.215879 IP 151.101.117.164.443 > 10.0.2.15.44158: Flags [P.], seq 1228613:1231361, ack 869, win 65535, length 2748
19:59:31.215898 IP 10.0.2.15.44158 > 151.101.117.164.443: Flags [.], ack 1228613, win 65535, length 0
19:59:31.215937 IP 151.101.117.164.443 > 10.0.2.15.44158: Flags [P.], seq 1231361:1234109, ack 869, win 65535, length 2748
19:59:31.216085 IP 10.0.2.15.44158 > 151.101.117.164.443: Flags [.], ack 1234109, win 65535, length 0
19:59:31.217526 IP 151.101.117.164.443 > 10.0.2.15.44158: Flags [P.], seq 1234109:1243727, ack 869, win 65535, length 9618
19:59:31.217545 IP 10.0.2.15.44158 > 151.101.117.164.443: Flags [.], ack 1243727, win 65535, length 0
19:59:31.217720 IP 151.101.117.164.443 > 10.0.2.15.44158: Flags [P.], seq 1243727:1247849, ack 869, win 65535, length 4122
19:59:31.218003 IP 10.0.2.15.44158 > 151.101.117.164.443: Flags [.], ack 1247849, win 65535, length 0
19:59:31.218470 IP 151.101.117.164.443 > 10.0.2.15.44158: Flags [P.], seq 1247849:1254719, ack 869, win 65535, length 6870
19:59:31.218684 IP 151.101.117.164.443 > 10.0.2.15.44158: Flags [P.], seq 1254719:1260215, ack 869, win 65535, length 5496
19:59:31.218841 IP 151.101.117.164.443 > 10.0.2.15.44158: Flags [P.], seq 1260215:1262963, ack 869, win 65535, length 2748
19:59:31.219250 IP 10.0.2.15.44158 > 151.101.117.164.443: Flags [.], ack 1262963, win 65535, length 0
19:59:31.220623 IP 151.101.117.164.443 > 10.0.2.15.44158: Flags [P.], seq 1262963:1268459, ack 869, win 65535, length 5496
19:59:31.220643 IP 10.0.2.15.44158 > 151.101.117.164.443: Flags [.], ack 1268459, win 65535, length 0
19:59:31.222380 IP 151.101.117.164.443 > 10.0.2.15.44158: Flags [P.], seq 1268459:1278077, ack 869, win 65535, length 9618
19:59:31.222383 IP 151.101.117.164.443 > 10.0.2.15.44158: Flags [P.], seq 1278077:1283573, ack 869, win 65535, length 5496
19:59:31.222497 IP 10.0.2.15.44158 > 151.101.117.164.443: Flags [.], ack 1283573, win 65535, length 0
19:59:31.223175 IP 151.101.117.164.443 > 10.0.2.15.44158: Flags [P.], seq 1283573:1290443, ack 869, win 65535, length 6870
19:59:31.223189 IP 10.0.2.15.44158 > 151.101.117.164.443: Flags [.], ack 1290443, win 65535, length 0
19:59:31.223691 IP 151.101.117.164.443 > 10.0.2.15.44158: Flags [P.], seq 1290443:1293191, ack 869, win 65535, length 2748
19:59:31.223693 IP 151.101.117.164.443 > 10.0.2.15.44158: Flags [P.], seq 1293191:1294565, ack 869, win 65535, length 1374
19:59:31.223694 IP 151.101.117.164.443 > 10.0.2.15.44158: Flags [P.], seq 1294565:1297313, ack 869, win 65535, length 2748
19:59:31.223695 IP 151.101.117.164.443 > 10.0.2.15.44158: Flags [P.], seq 1297313:1300061, ack 869, win 65535, length 2748
19:59:31.223807 IP 10.0.2.15.44158 > 151.101.117.164.443: Flags [.], ack 1300061, win 65535, length 0
19:59:31.224364 IP 151.101.117.164.443 > 10.0.2.15.44158: Flags [P.], seq 1300061:1306931, ack 869, win 65535, length 6870
19:59:31.224377 IP 10.0.2.15.44158 > 151.101.117.164.443: Flags [.], ack 1306931, win 65535, length 0
19:59:31.224488 IP 151.101.117.164.443 > 10.0.2.15.44158: Flags [P.], seq 1306931:1309679, ack 869, win 65535, length 2748
19:59:31.224620 IP 151.101.117.164.443 > 10.0.2.15.44158: Flags [P.], seq 1309679:1312427, ack 869, win 65535, length 2748
19:59:31.224651 IP 10.0.2.15.44158 > 151.101.117.164.443: Flags [.], ack 1312427, win 65535, length 0
19:59:31.224813 IP 151.101.117.164.443 > 10.0.2.15.44158: Flags [P.], seq 1312427:1315175, ack 869, win 65535, length 2748
19:59:31.224820 IP 10.0.2.15.44158 > 151.101.117.164.443: Flags [.], ack 1315175, win 65535, length 0
19:59:31.225144 IP 151.101.117.164.443 > 10.0.2.15.44158: Flags [P.], seq 1315175:1316549, ack 869, win 65535, length 1374
19:59:31.225848 IP 151.101.117.164.443 > 10.0.2.15.44158: Flags [P.], seq 1316549:1317923, ack 869, win 65535, length 1374
19:59:31.225861 IP 10.0.2.15.44158 > 151.101.117.164.443: Flags [.], ack 1317923, win 65535, length 0
19:59:31.227256 IP 151.101.117.164.443 > 10.0.2.15.44158: Flags [P.], seq 1317923:1330289, ack 869, win 65535, length 12366
19:59:31.227429 IP 151.101.117.164.443 > 10.0.2.15.44158: Flags [P.], seq 1330289:1333037, ack 869, win 65535, length 2748
19:59:31.227451 IP 10.0.2.15.44158 > 151.101.117.164.443: Flags [.], ack 1330289, win 65535, length 0
19:59:31.227633 IP 10.0.2.15.44158 > 151.101.117.164.443: Flags [.], ack 1333037, win 65535, length 0
19:59:31.229237 IP 151.101.117.164.443 > 10.0.2.15.44158: Flags [P.], seq 1333037:1337159, ack 869, win 65535, length 4122
19:59:31.229255 IP 10.0.2.15.44158 > 151.101.117.164.443: Flags [.], ack 1337159, win 65535, length 0
19:59:31.230474 IP 151.101.117.164.443 > 10.0.2.15.44158: Flags [P.], seq 1337159:1345403, ack 869, win 65535, length 8244
19:59:31.230478 IP 151.101.117.164.443 > 10.0.2.15.44158: Flags [P.], seq 1345403:1352273, ack 869, win 65535, length 6870
19:59:31.230532 IP 151.101.117.164.443 > 10.0.2.15.44158: Flags [P.], seq 1352273:1353647, ack 869, win 65535, length 1374
19:59:31.230681 IP 151.101.117.164.443 > 10.0.2.15.44158: Flags [P.], seq 1353647:1355021, ack 869, win 65535, length 1374
19:59:31.230709 IP 10.0.2.15.44158 > 151.101.117.164.443: Flags [.], ack 1353647, win 65535, length 0
19:59:31.232696 IP 151.101.117.164.443 > 10.0.2.15.44158: Flags [P.], seq 1355021:1364639, ack 869, win 65535, length 9618
19:59:31.232698 IP 151.101.117.164.443 > 10.0.2.15.44158: Flags [P.], seq 1364639:1368761, ack 869, win 65535, length 4122
19:59:31.232720 IP 10.0.2.15.44158 > 151.101.117.164.443: Flags [.], ack 1364639, win 65535, length 0
19:59:31.232765 IP 151.101.117.164.443 > 10.0.2.15.44158: Flags [P.], seq 1368761:1370135, ack 869, win 65535, length 1374
19:59:31.232962 IP 10.0.2.15.44158 > 151.101.117.164.443: Flags [.], ack 1370135, win 65535, length 0
19:59:31.234628 IP 151.101.117.164.443 > 10.0.2.15.44158: Flags [P.], seq 1370135:1381127, ack 869, win 65535, length 10992
19:59:31.234651 IP 10.0.2.15.44158 > 151.101.117.164.443: Flags [.], ack 1381127, win 65535, length 0
19:59:31.234947 IP 151.101.117.164.443 > 10.0.2.15.44158: Flags [P.], seq 1381127:1382501, ack 869, win 65535, length 1374
19:59:31.235551 IP 151.101.117.164.443 > 10.0.2.15.44158: Flags [P.], seq 1382501:1390745, ack 869, win 65535, length 8244
19:59:31.235554 IP 151.101.117.164.443 > 10.0.2.15.44158: Flags [P.], seq 1390745:1394867, ack 869, win 65535, length 4122
19:59:31.235793 IP 10.0.2.15.44158 > 151.101.117.164.443: Flags [.], ack 1394867, win 65535, length 0
19:59:31.235881 IP 151.101.117.164.443 > 10.0.2.15.44158: Flags [P.], seq 1394867:1397615, ack 869, win 65535, length 2748
19:59:31.235937 IP 10.0.2.15.44158 > 151.101.117.164.443: Flags [.], ack 1397615, win 65535, length 0
19:59:31.237510 IP 151.101.117.164.443 > 10.0.2.15.44158: Flags [P.], seq 1397615:1407233, ack 869, win 65535, length 9618
19:59:31.237529 IP 10.0.2.15.44158 > 151.101.117.164.443: Flags [.], ack 1407233, win 65535, length 0
19:59:31.238682 IP 151.101.117.164.443 > 10.0.2.15.44158: Flags [P.], seq 1407233:1412729, ack 869, win 65535, length 5496
19:59:31.238684 IP 151.101.117.164.443 > 10.0.2.15.44158: Flags [P.], seq 1412729:1415477, ack 869, win 65535, length 2748
19:59:31.238702 IP 10.0.2.15.44158 > 151.101.117.164.443: Flags [.], ack 1412729, win 65535, length 0
19:59:31.238924 IP 10.0.2.15.44158 > 151.101.117.164.443: Flags [.], ack 1415477, win 65535, length 0
19:59:31.238956 IP 151.101.117.164.443 > 10.0.2.15.44158: Flags [P.], seq 1415477:1418225, ack 869, win 65535, length 2748
19:59:31.238957 IP 151.101.117.164.443 > 10.0.2.15.44158: Flags [P.], seq 1418225:1419599, ack 869, win 65535, length 1374
19:59:31.239008 IP 10.0.2.15.44158 > 151.101.117.164.443: Flags [.], ack 1419599, win 65535, length 0
19:59:31.240075 IP 151.101.117.164.443 > 10.0.2.15.44158: Flags [P.], seq 1419599:1427843, ack 869, win 65535, length 8244
19:59:31.240077 IP 151.101.117.164.443 > 10.0.2.15.44158: Flags [P.], seq 1427843:1433339, ack 869, win 65535, length 5496
19:59:31.240322 IP 10.0.2.15.44158 > 151.101.117.164.443: Flags [.], ack 1427843, win 65535, length 0
19:59:31.240511 IP 151.101.117.164.443 > 10.0.2.15.44158: Flags [P.], seq 1433339:1436087, ack 869, win 65535, length 2748
19:59:31.240512 IP 151.101.117.164.443 > 10.0.2.15.44158: Flags [P.], seq 1436087:1438835, ack 869, win 65535, length 2748
19:59:31.240705 IP 151.101.117.164.443 > 10.0.2.15.44158: Flags [P.], seq 1438835:1445705, ack 869, win 65535, length 6870
19:59:31.240762 IP 10.0.2.15.44158 > 151.101.117.164.443: Flags [.], ack 1445705, win 65535, length 0
19:59:31.242417 IP 151.101.117.164.443 > 10.0.2.15.44158: Flags [P.], seq 1445705:1455323, ack 869, win 65535, length 9618
19:59:31.242439 IP 10.0.2.15.44158 > 151.101.117.164.443: Flags [.], ack 1455323, win 65535, length 0
19:59:31.243522 IP 151.101.117.164.443 > 10.0.2.15.44158: Flags [P.], seq 1455323:1460819, ack 869, win 65535, length 5496
19:59:31.243523 IP 151.101.117.164.443 > 10.0.2.15.44158: Flags [P.], seq 1460819:1466315, ack 869, win 65535, length 5496
19:59:31.243538 IP 10.0.2.15.44158 > 151.101.117.164.443: Flags [.], ack 1460819, win 65535, length 0
19:59:31.243733 IP 10.0.2.15.44158 > 151.101.117.164.443: Flags [.], ack 1466315, win 65535, length 0
19:59:31.244853 IP 151.101.117.164.443 > 10.0.2.15.44158: Flags [P.], seq 1466315:1474559, ack 869, win 65535, length 8244
19:59:31.244855 IP 151.101.117.164.443 > 10.0.2.15.44158: Flags [P.], seq 1474559:1477307, ack 869, win 65535, length 2748
19:59:31.244874 IP 10.0.2.15.44158 > 151.101.117.164.443: Flags [.], ack 1474559, win 65535, length 0
19:59:31.244920 IP 151.101.117.164.443 > 10.0.2.15.44158: Flags [P.], seq 1477307:1481429, ack 869, win 65535, length 4122
19:59:31.245037 IP 10.0.2.15.44158 > 151.101.117.164.443: Flags [.], ack 1481429, win 65535, length 0
19:59:31.246771 IP 151.101.117.164.443 > 10.0.2.15.44158: Flags [P.], seq 1481429:1484177, ack 869, win 65535, length 2748
19:59:31.246793 IP 10.0.2.15.44158 > 151.101.117.164.443: Flags [.], ack 1484177, win 65535, length 0
19:59:31.248082 IP 151.101.117.164.443 > 10.0.2.15.44158: Flags [P.], seq 1484177:1491047, ack 869, win 65535, length 6870
19:59:31.248085 IP 151.101.117.164.443 > 10.0.2.15.44158: Flags [P.], seq 1491047:1496543, ack 869, win 65535, length 5496
19:59:31.248125 IP 151.101.117.164.443 > 10.0.2.15.44158: Flags [P.], seq 1496543:1499291, ack 869, win 65535, length 2748
19:59:31.248399 IP 151.101.117.164.443 > 10.0.2.15.44158: Flags [P.], seq 1499291:1500665, ack 869, win 65535, length 1374
19:59:31.249649 IP 151.101.117.164.443 > 10.0.2.15.44158: Flags [P.], seq 1500665:1507535, ack 869, win 65535, length 6870
19:59:31.249912 IP 151.101.117.164.443 > 10.0.2.15.44158: Flags [P.], seq 1507535:1510283, ack 869, win 65535, length 2748
19:59:31.249913 IP 151.101.117.164.443 > 10.0.2.15.44158: Flags [P.], seq 1510283:1511657, ack 869, win 65535, length 1374
19:59:31.250340 IP 10.0.2.15.44158 > 151.101.117.164.443: Flags [.], ack 1500665, win 65535, length 0
19:59:31.250497 IP 10.0.2.15.44158 > 151.101.117.164.443: Flags [.], ack 1511657, win 65535, length 0
19:59:31.251119 IP 151.101.117.164.443 > 10.0.2.15.44158: Flags [P.], seq 1511657:1518527, ack 869, win 65535, length 6870
19:59:31.251121 IP 151.101.117.164.443 > 10.0.2.15.44158: Flags [P.], seq 1518527:1521275, ack 869, win 65535, length 2748
19:59:31.251137 IP 10.0.2.15.44158 > 151.101.117.164.443: Flags [.], ack 1518527, win 65535, length 0
19:59:31.251277 IP 151.101.117.164.443 > 10.0.2.15.44158: Flags [P.], seq 1521275:1524023, ack 869, win 65535, length 2748
19:59:31.251279 IP 151.101.117.164.443 > 10.0.2.15.44158: Flags [P.], seq 1524023:1526771, ack 869, win 65535, length 2748
19:59:31.251329 IP 10.0.2.15.44158 > 151.101.117.164.443: Flags [.], ack 1526771, win 65535, length 0
19:59:31.251538 IP 151.101.117.164.443 > 10.0.2.15.44158: Flags [P.], seq 1526771:1528145, ack 869, win 65535, length 1374
19:59:31.253153 IP 151.101.117.164.443 > 10.0.2.15.44158: Flags [P.], seq 1528145:1539137, ack 869, win 65535, length 10992
19:59:31.253169 IP 10.0.2.15.44158 > 151.101.117.164.443: Flags [.], ack 1539137, win 65535, length 0
19:59:31.254111 IP 151.101.117.164.443 > 10.0.2.15.44158: Flags [P.], seq 1539137:1544633, ack 869, win 65535, length 5496
19:59:31.254126 IP 10.0.2.15.44158 > 151.101.117.164.443: Flags [.], ack 1544633, win 65535, length 0
19:59:31.254323 IP 151.101.117.164.443 > 10.0.2.15.44158: Flags [P.], seq 1544633:1548755, ack 869, win 65535, length 4122
19:59:31.254324 IP 151.101.117.164.443 > 10.0.2.15.44158: Flags [P.], seq 1548755:1551503, ack 869, win 65535, length 2748
19:59:31.254430 IP 10.0.2.15.44158 > 151.101.117.164.443: Flags [.], ack 1551503, win 65535, length 0
19:59:31.254513 IP 151.101.117.164.443 > 10.0.2.15.44158: Flags [P.], seq 1551503:1554251, ack 869, win 65535, length 2748
19:59:31.254600 IP 151.101.117.164.443 > 10.0.2.15.44158: Flags [P.], seq 1554251:1555625, ack 869, win 65535, length 1374
19:59:31.254632 IP 10.0.2.15.44158 > 151.101.117.164.443: Flags [.], ack 1555625, win 65535, length 0
19:59:31.256384 IP 151.101.117.164.443 > 10.0.2.15.44158: Flags [P.], seq 1555625:1563869, ack 869, win 65535, length 8244
19:59:31.256402 IP 10.0.2.15.44158 > 151.101.117.164.443: Flags [.], ack 1563869, win 65535, length 0
19:59:31.257263 IP 151.101.117.164.443 > 10.0.2.15.44158: Flags [P.], seq 1563869:1570739, ack 869, win 65535, length 6870
19:59:31.257275 IP 10.0.2.15.44158 > 151.101.117.164.443: Flags [.], ack 1570739, win 65535, length 0
19:59:31.257484 IP 151.101.117.164.443 > 10.0.2.15.44158: Flags [P.], seq 1570739:1576235, ack 869, win 65535, length 5496
19:59:31.257491 IP 10.0.2.15.44158 > 151.101.117.164.443: Flags [.], ack 1576235, win 65535, length 0
19:59:31.257698 IP 151.101.117.164.443 > 10.0.2.15.44158: Flags [P.], seq 1576235:1580357, ack 869, win 65535, length 4122
19:59:31.257704 IP 10.0.2.15.44158 > 151.101.117.164.443: Flags [.], ack 1580357, win 65535, length 0
19:59:31.259544 IP 151.101.117.164.443 > 10.0.2.15.44158: Flags [P.], seq 1580357:1589975, ack 869, win 65535, length 9618
19:59:31.259646 IP 10.0.2.15.44158 > 151.101.117.164.443: Flags [.], ack 1589975, win 65535, length 0
19:59:31.259713 IP 151.101.117.164.443 > 10.0.2.15.44158: Flags [P.], seq 1589975:1594097, ack 869, win 65535, length 4122
19:59:31.259738 IP 10.0.2.15.44158 > 151.101.117.164.443: Flags [.], ack 1594097, win 65535, length 0
19:59:31.261156 IP 151.101.117.164.443 > 10.0.2.15.44158: Flags [P.], seq 1594097:1602341, ack 869, win 65535, length 8244
19:59:31.261259 IP 10.0.2.15.44158 > 151.101.117.164.443: Flags [.], ack 1602341, win 65535, length 0
19:59:31.261584 IP 151.101.117.164.443 > 10.0.2.15.44158: Flags [.], seq 1602341:1603801, ack 869, win 65535, length 1460
19:59:31.261887 IP 151.101.117.164.443 > 10.0.2.15.44158: Flags [P.], seq 1603801:1605089, ack 869, win 65535, length 1288
19:59:31.261889 IP 151.101.117.164.443 > 10.0.2.15.44158: Flags [P.], seq 1605089:1610585, ack 869, win 65535, length 5496
19:59:31.261949 IP 10.0.2.15.44158 > 151.101.117.164.443: Flags [.], ack 1610585, win 65535, length 0
19:59:31.262447 IP 151.101.117.164.443 > 10.0.2.15.44158: Flags [P.], seq 1610585:1617455, ack 869, win 65535, length 6870
19:59:31.262458 IP 10.0.2.15.44158 > 151.101.117.164.443: Flags [.], ack 1617455, win 65535, length 0
19:59:31.262568 IP 151.101.117.164.443 > 10.0.2.15.44158: Flags [P.], seq 1617455:1621577, ack 869, win 65535, length 4122
19:59:31.262721 IP 151.101.117.164.443 > 10.0.2.15.44158: Flags [P.], seq 1621577:1622951, ack 869, win 65535, length 1374
19:59:31.262772 IP 10.0.2.15.44158 > 151.101.117.164.443: Flags [.], ack 1622951, win 65535, length 0
19:59:31.264152 IP 151.101.117.164.443 > 10.0.2.15.44158: Flags [P.], seq 1622951:1632569, ack 869, win 65535, length 9618
19:59:31.264154 IP 151.101.117.164.443 > 10.0.2.15.44158: Flags [P.], seq 1632569:1635317, ack 869, win 65535, length 2748
19:59:31.264178 IP 10.0.2.15.44158 > 151.101.117.164.443: Flags [.], ack 1632569, win 65535, length 0
19:59:31.264236 IP 151.101.117.164.443 > 10.0.2.15.44158: Flags [P.], seq 1635317:1638065, ack 869, win 65535, length 2748
19:59:31.264412 IP 151.101.117.164.443 > 10.0.2.15.44158: Flags [P.], seq 1638065:1639439, ack 869, win 65535, length 1374
19:59:31.264438 IP 10.0.2.15.44158 > 151.101.117.164.443: Flags [.], ack 1639439, win 65535, length 0
19:59:31.266558 IP 151.101.117.164.443 > 10.0.2.15.44158: Flags [P.], seq 1639439:1646309, ack 869, win 65535, length 6870
19:59:31.266560 IP 151.101.117.164.443 > 10.0.2.15.44158: Flags [P.], seq 1646309:1649057, ack 869, win 65535, length 2748
19:59:31.266561 IP 151.101.117.164.443 > 10.0.2.15.44158: Flags [P.], seq 1649057:1650431, ack 869, win 65535, length 1374
19:59:31.266582 IP 10.0.2.15.44158 > 151.101.117.164.443: Flags [.], ack 1646309, win 65535, length 0
19:59:31.266696 IP 10.0.2.15.44158 > 151.101.117.164.443: Flags [.], ack 1650431, win 65535, length 0
19:59:31.286000 IP 151.101.117.164.443 > 10.0.2.15.44158: Flags [P.], seq 1650431:1657301, ack 869, win 65535, length 6870
19:59:31.286027 IP 10.0.2.15.44158 > 151.101.117.164.443: Flags [.], ack 1657301, win 65535, length 0
19:59:31.286353 IP 151.101.117.164.443 > 10.0.2.15.44158: Flags [P.], seq 1657301:1662797, ack 869, win 65535, length 5496
19:59:31.286355 IP 151.101.117.164.443 > 10.0.2.15.44158: Flags [P.], seq 1662797:1664171, ack 869, win 65535, length 1374
19:59:31.286458 IP 10.0.2.15.44158 > 151.101.117.164.443: Flags [.], ack 1664171, win 65535, length 0
19:59:31.288654 IP 151.101.117.164.443 > 10.0.2.15.44158: Flags [P.], seq 1664171:1668293, ack 869, win 65535, length 4122
19:59:31.288676 IP 10.0.2.15.44158 > 151.101.117.164.443: Flags [.], ack 1668293, win 65535, length 0
19:59:31.292212 IP 151.101.117.164.443 > 10.0.2.15.44158: Flags [.], seq 1668293:1710633, ack 869, win 65535, length 42340
19:59:31.292363 IP 151.101.117.164.443 > 10.0.2.15.44158: Flags [.], seq 1710633:1732533, ack 869, win 65535, length 21900
19:59:31.292433 IP 10.0.2.15.44158 > 151.101.117.164.443: Flags [.], ack 1732533, win 65535, length 0
19:59:31.292891 IP 151.101.117.164.443 > 10.0.2.15.44158: Flags [P.], seq 1732533:1733993, ack 869, win 65535, length 1460

