00:14:35.766724 IP 151.101.117.164.443 > 10.0.2.15.44034: Flags [.], seq 75776002:75778922, ack 2789757826, win 65535, length 2920
00:14:35.766751 IP 10.0.2.15.44034 > 151.101.117.164.443: Flags [.], ack 2920, win 62780, length 0
00:14:35.767090 IP 151.101.117.164.443 > 10.0.2.15.44034: Flags [P.], seq 2920:5606, ack 1, win 65535, length 2686
00:14:35.767112 IP 10.0.2.15.44034 > 151.101.117.164.443: Flags [.], ack 5606, win 61320, length 0
00:14:35.768376 IP 10.0.2.15.44034 > 151.101.117.164.443: Flags [P.], seq 1:94, ack 5606, win 62780, length 93
00:14:35.768876 IP 151.101.117.164.443 > 10.0.2.15.44034: Flags [.], ack 94, win 65535, length 0
00:14:35.782504 IP 151.101.117.164.443 > 10.0.2.15.44034: Flags [P.], seq 5606:5657, ack 94, win 65535, length 51
00:14:35.782527 IP 10.0.2.15.44034 > 151.101.117.164.443: Flags [.], ack 5657, win 62780, length 0
00:14:35.783199 IP 10.0.2.15.44034 > 151.101.117.164.443: Flags [P.], seq 94:147, ack 5657, win 62780, length 53
00:14:35.783244 IP 10.0.2.15.44034 > 151.101.117.164.443: Flags [P.], seq 147:203, ack 5657, win 62780, length 56
00:14:35.783430 IP 10.0.2.15.44034 > 151.101.117.164.443: Flags [P.], seq 203:245, ack 5657, win 62780, length 42
00:14:35.783636 IP 10.0.2.15.44034 > 151.101.117.164.443: Flags [P.], seq 245:314, ack 5657, win 62780, length 69
00:14:35.783990 IP 151.101.117.164.443 > 10.0.2.15.44034: Flags [.], ack 147, win 65535, length 0
00:14:35.783991 IP 151.101.117.164.443 > 10.0.2.15.44034: Flags [.], ack 203, win 65535, length 0
00:14:35.784435 IP 151.101.117.164.443 > 10.0.2.15.44034: Flags [.], ack 245, win 65535, length 0
00:14:35.784437 IP 151.101.117.164.443 > 10.0.2.15.44034: Flags [.], ack 314, win 65535, length 0
00:14:35.796458 IP 151.101.117.164.443 > 10.0.2.15.44034: Flags [P.], seq 5657:5752, ack 314, win 65535, length 95
00:14:35.796477 IP 10.0.2.15.44034 > 151.101.117.164.443: Flags [.], ack 5752, win 62780, length 0
00:14:35.796751 IP 10.0.2.15.44034 > 151.101.117.164.443: Flags [P.], seq 314:352, ack 5752, win 62780, length 38
00:14:35.797101 IP 151.101.117.164.443 > 10.0.2.15.44034: Flags [.], ack 352, win 65535, length 0
00:14:35.803212 IP 151.101.117.164.443 > 10.0.2.15.44034: Flags [P.], seq 5752:9874, ack 352, win 65535, length 4122
00:14:35.803217 IP 151.101.117.164.443 > 10.0.2.15.44034: Flags [P.], seq 9874:11248, ack 352, win 65535, length 1374
00:14:35.803406 IP 10.0.2.15.44034 > 151.101.117.164.443: Flags [.], ack 11248, win 61320, length 0
00:14:35.804312 IP 151.101.117.164.443 > 10.0.2.15.44034: Flags [P.], seq 11248:13996, ack 352, win 65535, length 2748
00:14:35.804335 IP 10.0.2.15.44034 > 151.101.117.164.443: Flags [.], ack 13996, win 62780, length 0
00:14:35.805083 IP 151.101.117.164.443 > 10.0.2.15.44034: Flags [P.], seq 13996:16744, ack 352, win 65535, length 2748
00:14:35.805098 IP 10.0.2.15.44034 > 151.101.117.164.443: Flags [.], ack 16744, win 62780, length 0
00:14:35.806447 IP 151.101.117.164.443 > 10.0.2.15.44034: Flags [P.], seq 16744:22240, ack 352, win 65535, length 5496
00:14:35.806530 IP 10.0.2.15.44034 > 151.101.117.164.443: Flags [.], ack 22240, win 61320, length 0
00:14:35.807437 IP 151.101.117.164.443 > 10.0.2.15.44034: Flags [P.], seq 22240:24988, ack 352, win 65535, length 2748
00:14:35.807455 IP 10.0.2.15.44034 > 151.101.117.164.443: Flags [.], ack 24988, win 62780, length 0
00:14:35.808564 IP 151.101.117.164.443 > 10.0.2.15.44034: Flags [P.], seq 24988:29110, ack 352, win 65535, length 4122
00:14:35.808567 IP 151.101.117.164.443 > 10.0.2.15.44034: Flags [P.], seq 29110:30484, ack 352, win 65535, length 1374
00:14:35.808660 IP 10.0.2.15.44034 > 151.101.117.164.443: Flags [.], ack 30484, win 61320, length 0
00:14:35.809846 IP 151.101.117.164.443 > 10.0.2.15.44034: Flags [P.], seq 30484:33232, ack 352, win 65535, length 2748
00:14:35.809867 IP 10.0.2.15.44034 > 151.101.117.164.443: Flags [.], ack 33232, win 62780, length 0
00:14:35.811124 IP 151.101.117.164.443 > 10.0.2.15.44034: Flags [P.], seq 33232:37354, ack 352, win 65535, length 4122
00:14:35.811353 IP 151.101.117.164.443 > 10.0.2.15.44034: Flags [P.], seq 37354:38728, ack 352, win 65535, length 1374
00:14:35.811427 IP 10.0.2.15.44034 > 151.101.117.164.443: Flags [.], ack 38728, win 61320, length 0
00:14:35.812253 IP 151.101.117.164.443 > 10.0.2.15.44034: Flags [P.], seq 38728:41476, ack 352, win 65535, length 2748
00:14:35.812271 IP 10.0.2.15.44034 > 151.101.117.164.443: Flags [.], ack 41476, win 62780, length 0
00:14:35.812489 IP 151.101.117.164.443 > 10.0.2.15.44034: Flags [P.], seq 41476:44224, ack 352, win 65535, length 2748
00:14:35.812536 IP 10.0.2.15.44034 > 151.101.117.164.443: Flags [.], ack 44224, win 61320, length 0
00:14:35.813411 IP 151.101.117.164.443 > 10.0.2.15.44034: Flags [P.], seq 44224:46972, ack 352, win 65535, length 2748
00:14:35.813429 IP 10.0.2.15.44034 > 151.101.117.164.443: Flags [.], ack 46972, win 62780, length 0
00:14:35.814678 IP 151.101.117.164.443 > 10.0.2.15.44034: Flags [P.], seq 46972:49720, ack 352, win 65535, length 2748
00:14:35.814698 IP 10.0.2.15.44034 > 151.101.117.164.443: Flags [.], ack 49720, win 62780, length 0
00:14:35.815616 IP 151.101.117.164.443 > 10.0.2.15.44034: Flags [P.], seq 49720:53842, ack 352, win 65535, length 4122
00:14:35.815767 IP 10.0.2.15.44034 > 151.101.117.164.443: Flags [.], ack 53842, win 61320, length 0
00:14:35.816570 IP 151.101.117.164.443 > 10.0.2.15.44034: Flags [P.], seq 53842:57964, ack 352, win 65535, length 4122
00:14:35.816589 IP 10.0.2.15.44034 > 151.101.117.164.443: Flags [.], ack 57964, win 61320, length 0
00:14:35.817920 IP 151.101.117.164.443 > 10.0.2.15.44034: Flags [P.], seq 57964:60712, ack 352, win 65535, length 2748
00:14:35.817923 IP 151.101.117.164.443 > 10.0.2.15.44034: Flags [P.], seq 60712:64834, ack 352, win 65535, length 4122
00:14:35.817951 IP 10.0.2.15.44034 > 151.101.117.164.443: Flags [.], ack 60712, win 62780, length 0
00:14:35.818134 IP 151.101.117.164.443 > 10.0.2.15.44034: Flags [P.], seq 64834:68956, ack 352, win 65535, length 4122
00:14:35.818182 IP 10.0.2.15.44034 > 151.101.117.164.443: Flags [.], ack 68956, win 62780, length 0
00:14:35.818891 IP 151.101.117.164.443 > 10.0.2.15.44034: Flags [P.], seq 68956:73078, ack 352, win 65535, length 4122
00:14:35.818893 IP 151.101.117.164.443 > 10.0.2.15.44034: Flags [P.], seq 73078:74452, ack 352, win 65535, length 1374
00:14:35.818915 IP 10.0.2.15.44034 > 151.101.117.164.443: Flags [.], ack 73078, win 65535, length 0
00:14:35.821119 IP 151.101.117.164.443 > 10.0.2.15.44034: Flags [P.], seq 74452:78574, ack 352, win 65535, length 4122
00:14:35.821122 IP 151.101.117.164.443 > 10.0.2.15.44034: Flags [P.], seq 78574:82696, ack 352, win 65535, length 4122
00:14:35.821123 IP 151.101.117.164.443 > 10.0.2.15.44034: Flags [P.], seq 82696:86818, ack 352, win 65535, length 4122
00:14:35.821148 IP 10.0.2.15.44034 > 151.101.117.164.443: Flags [.], ack 78574, win 65535, length 0
00:14:35.821182 IP 10.0.2.15.44034 > 151.101.117.164.443: Flags [.], ack 82696, win 65535, length 0
00:14:35.821199 IP 10.0.2.15.44034 > 151.101.117.164.443: Flags [.], ack 86818, win 65535, length 0
00:14:35.821223 IP 151.101.117.164.443 > 10.0.2.15.44034: Flags [P.], seq 86818:88192, ack 352, win 65535, length 1374
00:14:35.822541 IP 151.101.117.164.443 > 10.0.2.15.44034: Flags [P.], seq 88192:93688, ack 352, win 65535, length 5496
00:14:35.822620 IP 10.0.2.15.44034 > 151.101.117.164.443: Flags [.], ack 93688, win 65535, length 0
00:14:35.822825 IP 151.101.117.164.443 > 10.0.2.15.44034: Flags [P.], seq 93688:96436, ack 352, win 65535, length 2748
00:14:35.822835 IP 10.0.2.15.44034 > 151.101.117.164.443: Flags [.], ack 96436, win 65535, length 0
00:14:35.823693 IP 151.101.117.164.443 > 10.0.2.15.44034: Flags [P.], seq 96436:100558, ack 352, win 65535, length 4122
00:14:35.823695 IP 151.101.117.164.443 > 10.0.2.15.44034: Flags [P.], seq 100558:103306, ack 352, win 65535, length 2748
00:14:35.823696 IP 151.101.117.164.443 > 10.0.2.15.44034: Flags [P.], seq 103306:104680, ack 352, win 65535, length 1374
00:14:35.823712 IP 10.0.2.15.44034 > 151.101.117.164.443: Flags [.], ack 100558, win 65535, length 0
00:14:35.823729 IP 10.0.2.15.44034 > 151.101.117.164.443: Flags [.], ack 103306, win 65535, length 0
00:14:35.825260 IP 151.101.117.164.443 > 10.0.2.15.44034: Flags [P.], seq 104680:110176, ack 352, win 65535, length 5496
00:14:35.825264 IP 151.101.117.164.443 > 10.0.2.15.44034: Flags [P.], seq 110176:112924, ack 352, win 65535, length 2748
00:14:35.825265 IP 151.101.117.164.443 > 10.0.2.15.44034: Flags [P.], seq 112924:114298, ack 352, win 65535, length 1374
00:14:35.825287 IP 10.0.2.15.44034 > 151.101.117.164.443: Flags [.], ack 110176, win 65535, length 0
00:14:35.825318 IP 10.0.2.15.44034 > 151.101.117.164.443: Flags [.], ack 112924, win 65535, length 0
00:14:35.826082 IP 151.101.117.164.443 > 10.0.2.15.44034: Flags [P.], seq 114298:117046, ack 352, win 65535, length 2748
00:14:35.826086 IP 151.101.117.164.443 > 10.0.2.15.44034: Flags [P.], seq 117046:121168, ack 352, win 65535, length 4122
00:14:35.826106 IP 10.0.2.15.44034 > 151.101.117.164.443: Flags [.], ack 117046, win 65535, length 0
00:14:35.826267 IP 10.0.2.15.44034 > 151.101.117.164.443: Flags [.], ack 121168, win 65535, length 0
00:14:35.826434 IP 151.101.117.164.443 > 10.0.2.15.44034: Flags [P.], seq 121168:123916, ack 352, win 65535, length 2748
00:14:35.826435 IP 151.101.117.164.443 > 10.0.2.15.44034: Flags [P.], seq 123916:125290, ack 352, win 65535, length 1374
00:14:35.826444 IP 10.0.2.15.44034 > 151.101.117.164.443: Flags [.], ack 123916, win 65535, length 0
00:14:35.827473 IP 151.101.117.164.443 > 10.0.2.15.44034: Flags [P.], seq 125290:132160, ack 352, win 65535, length 6870
00:14:35.827492 IP 10.0.2.15.44034 > 151.101.117.164.443: Flags [.], ack 132160, win 65535, length 0
00:14:35.827995 IP 151.101.117.164.443 > 10.0.2.15.44034: Flags [P.], seq 132160:136282, ack 352, win 65535, length 4122
00:14:35.828007 IP 10.0.2.15.44034 > 151.101.117.164.443: Flags [.], ack 136282, win 65535, length 0
00:14:35.830137 IP 151.101.117.164.443 > 10.0.2.15.44034: Flags [P.], seq 136282:141778, ack 352, win 65535, length 5496
00:14:35.830141 IP 151.101.117.164.443 > 10.0.2.15.44034: Flags [P.], seq 141778:145900, ack 352, win 65535, length 4122
00:14:35.830168 IP 10.0.2.15.44034 > 151.101.117.164.443: Flags [.], ack 141778, win 65535, length 0
00:14:35.830204 IP 10.0.2.15.44034 > 151.101.117.164.443: Flags [.], ack 145900, win 65535, length 0
00:14:35.830390 IP 151.101.117.164.443 > 10.0.2.15.44034: Flags [P.], seq 145900:148648, ack 352, win 65535, length 2748
00:14:35.830402 IP 10.0.2.15.44034 > 151.101.117.164.443: Flags [.], ack 148648, win 65535, length 0
00:14:35.831361 IP 151.101.117.164.443 > 10.0.2.15.44034: Flags [P.], seq 148648:151396, ack 352, win 65535, length 2748
00:14:35.831365 IP 151.101.117.164.443 > 10.0.2.15.44034: Flags [P.], seq 151396:156892, ack 352, win 65535, length 5496
00:14:35.831386 IP 10.0.2.15.44034 > 151.101.117.164.443: Flags [.], ack 151396, win 65535, length 0
00:14:35.831423 IP 10.0.2.15.44034 > 151.101.117.164.443: Flags [.], ack 156892, win 65535, length 0
00:14:35.831559 IP 151.101.117.164.443 > 10.0.2.15.44034: Flags [P.], seq 156892:158266, ack 352, win 65535, length 1374
00:14:35.831940 IP 151.101.117.164.443 > 10.0.2.15.44034: Flags [P.], seq 158266:159640, ack 352, win 65535, length 1374
00:14:35.831957 IP 10.0.2.15.44034 > 151.101.117.164.443: Flags [.], ack 159640, win 65535, length 0
00:14:35.832863 IP 151.101.117.164.443 > 10.0.2.15.44034: Flags [P.], seq 159640:163762, ack 352, win 65535, length 4122
00:14:35.832866 IP 151.101.117.164.443 > 10.0.2.15.44034: Flags [P.], seq 163762:167884, ack 352, win 65535, length 4122
00:14:35.832944 IP 10.0.2.15.44034 > 151.101.117.164.443: Flags [.], ack 163762, win 65535, length 0
00:14:35.832983 IP 10.0.2.15.44034 > 151.101.117.164.443: Flags [.], ack 167884, win 65535, length 0
00:14:35.833276 IP 151.101.117.164.443 > 10.0.2.15.44034: Flags [P.], seq 167884:169258, ack 352, win 65535, length 1374
00:14:35.833279 IP 151.101.117.164.443 > 10.0.2.15.44034: Flags [P.], seq 169258:173380, ack 352, win 65535, length 4122
00:14:35.833280 IP 151.101.117.164.443 > 10.0.2.15.44034: Flags [P.], seq 173380:174754, ack 352, win 65535, length 1374
00:14:35.833299 IP 10.0.2.15.44034 > 151.101.117.164.443: Flags [.], ack 173380, win 65535, length 0
00:14:35.834298 IP 151.101.117.164.443 > 10.0.2.15.44034: Flags [P.], seq 174754:180250, ack 352, win 65535, length 5496
00:14:35.834321 IP 10.0.2.15.44034 > 151.101.117.164.443: Flags [.], ack 180250, win 65535, length 0
00:14:35.834714 IP 151.101.117.164.443 > 10.0.2.15.44034: Flags [P.], seq 180250:181624, ack 352, win 65535, length 1374
00:14:35.834717 IP 151.101.117.164.443 > 10.0.2.15.44034: Flags [P.], seq 181624:184372, ack 352, win 65535, length 2748
00:14:35.834718 IP 151.101.117.164.443 > 10.0.2.15.44034: Flags [.], seq 184372:185832, ack 352, win 65535, length 1460
00:14:35.834743 IP 10.0.2.15.44034 > 151.101.117.164.443: Flags [.], ack 184372, win 65535, length 0
00:14:35.835068 IP 151.101.117.164.443 > 10.0.2.15.44034: Flags [P.], seq 185832:188494, ack 352, win 65535, length 2662
00:14:35.835070 IP 151.101.117.164.443 > 10.0.2.15.44034: Flags [P.], seq 188494:192616, ack 352, win 65535, length 4122
00:14:35.835080 IP 10.0.2.15.44034 > 151.101.117.164.443: Flags [.], ack 188494, win 65535, length 0
00:14:35.835100 IP 10.0.2.15.44034 > 151.101.117.164.443: Flags [.], ack 192616, win 65535, length 0
00:14:35.835620 IP 151.101.117.164.443 > 10.0.2.15.44034: Flags [P.], seq 192616:195364, ack 352, win 65535, length 2748
00:14:35.835622 IP 151.101.117.164.443 > 10.0.2.15.44034: Flags [P.], seq 195364:198112, ack 352, win 65535, length 2748
00:14:35.835637 IP 10.0.2.15.44034 > 151.101.117.164.443: Flags [.], ack 195364, win 65535, length 0
00:14:35.835700 IP 10.0.2.15.44034 > 151.101.117.164.443: Flags [.], ack 198112, win 65535, length 0
00:14:35.835920 IP 151.101.117.164.443 > 10.0.2.15.44034: Flags [P.], seq 198112:200860, ack 352, win 65535, length 2748
00:14:35.835930 IP 10.0.2.15.44034 > 151.101.117.164.443: Flags [.], ack 200860, win 65535, length 0
00:14:35.837066 IP 151.101.117.164.443 > 10.0.2.15.44034: Flags [P.], seq 200860:203608, ack 352, win 65535, length 2748
00:14:35.837137 IP 10.0.2.15.44034 > 151.101.117.164.443: Flags [.], ack 203608, win 65535, length 0
00:14:35.837383 IP 151.101.117.164.443 > 10.0.2.15.44034: Flags [P.], seq 203608:207730, ack 352, win 65535, length 4122
00:14:35.837385 IP 151.101.117.164.443 > 10.0.2.15.44034: Flags [P.], seq 207730:210478, ack 352, win 65535, length 2748
00:14:35.837403 IP 10.0.2.15.44034 > 151.101.117.164.443: Flags [.], ack 207730, win 65535, length 0
00:14:35.837568 IP 10.0.2.15.44034 > 151.101.117.164.443: Flags [.], ack 210478, win 65535, length 0
00:14:35.837792 IP 151.101.117.164.443 > 10.0.2.15.44034: Flags [P.], seq 210478:213226, ack 352, win 65535, length 2748
00:14:35.837793 IP 151.101.117.164.443 > 10.0.2.15.44034: Flags [P.], seq 213226:217348, ack 352, win 65535, length 4122
00:14:35.837804 IP 10.0.2.15.44034 > 151.101.117.164.443: Flags [.], ack 213226, win 65535, length 0
00:14:35.837869 IP 10.0.2.15.44034 > 151.101.117.164.443: Flags [.], ack 217348, win 65535, length 0
00:14:35.837997 IP 151.101.117.164.443 > 10.0.2.15.44034: Flags [P.], seq 217348:219226, ack 352, win 65535, length 1878
00:14:35.838004 IP 10.0.2.15.44034 > 151.101.117.164.443: Flags [.], ack 219226, win 65535, length 0
00:14:35.838541 IP 151.101.117.164.443 > 10.0.2.15.44034: Flags [P.], seq 219226:221974, ack 352, win 65535, length 2748
00:14:35.838543 IP 151.101.117.164.443 > 10.0.2.15.44034: Flags [P.], seq 221974:225592, ack 352, win 65535, length 3618
00:14:35.838561 IP 10.0.2.15.44034 > 151.101.117.164.443: Flags [.], ack 221974, win 65535, length 0
00:14:35.838587 IP 10.0.2.15.44034 > 151.101.117.164.443: Flags [.], ack 225592, win 65535, length 0
00:14:35.839676 IP 151.101.117.164.443 > 10.0.2.15.44034: Flags [P.], seq 225592:231088, ack 352, win 65535, length 5496
00:14:35.839679 IP 151.101.117.164.443 > 10.0.2.15.44034: Flags [P.], seq 231088:232462, ack 352, win 65535, length 1374
00:14:35.839680 IP 151.101.117.164.443 > 10.0.2.15.44034: Flags [P.], seq 232462:236584, ack 352, win 65535, length 4122
00:14:35.839700 IP 10.0.2.15.44034 > 151.101.117.164.443: Flags [.], ack 231088, win 65535, length 0
00:14:35.839848 IP 10.0.2.15.44034 > 151.101.117.164.443: Flags [.], ack 236584, win 65535, length 0
00:14:35.839889 IP 151.101.117.164.443 > 10.0.2.15.44034: Flags [P.], seq 236584:240706, ack 352, win 65535, length 4122
00:14:35.839900 IP 10.0.2.15.44034 > 151.101.117.164.443: Flags [.], ack 240706, win 65535, length 0
00:14:35.840159 IP 151.101.117.164.443 > 10.0.2.15.44034: Flags [P.], seq 240706:242080, ack 352, win 65535, length 1374
00:14:35.840400 IP 151.101.117.164.443 > 10.0.2.15.44034: Flags [P.], seq 242080:244828, ack 352, win 65535, length 2748
00:14:35.840413 IP 10.0.2.15.44034 > 151.101.117.164.443: Flags [.], ack 244828, win 65535, length 0
00:14:35.840616 IP 151.101.117.164.443 > 10.0.2.15.44034: Flags [P.], seq 244828:246202, ack 352, win 65535, length 1374
00:14:35.841423 IP 151.101.117.164.443 > 10.0.2.15.44034: Flags [P.], seq 246202:251698, ack 352, win 65535, length 5496
00:14:35.842297 IP 151.101.117.164.443 > 10.0.2.15.44034: Flags [P.], seq 251698:254446, ack 352, win 65535, length 2748
00:14:35.842304 IP 151.101.117.164.443 > 10.0.2.15.44034: Flags [P.], seq 254446:261316, ack 352, win 65535, length 6870
00:14:35.842588 IP 151.101.117.164.443 > 10.0.2.15.44034: Flags [P.], seq 261316:264064, ack 352, win 65535, length 2748
00:14:35.842592 IP 151.101.117.164.443 > 10.0.2.15.44034: Flags [P.], seq 264064:269560, ack 352, win 65535, length 5496
00:14:35.842847 IP 10.0.2.15.44034 > 151.101.117.164.443: Flags [.], ack 269560, win 65535, length 0
00:14:35.843520 IP 151.101.117.164.443 > 10.0.2.15.44034: Flags [P.], seq 269560:272308, ack 352, win 65535, length 2748
00:14:35.843522 IP 151.101.117.164.443 > 10.0.2.15.44034: Flags [P.], seq 272308:275056, ack 352, win 65535, length 2748
00:14:35.843934 IP 151.101.117.164.443 > 10.0.2.15.44034: Flags [P.], seq 275056:276430, ack 352, win 65535, length 1374
00:14:35.843937 IP 151.101.117.164.443 > 10.0.2.15.44034: Flags [P.], seq 276430:280552, ack 352, win 65535, length 4122
00:14:35.844822 IP 151.101.117.164.443 > 10.0.2.15.44034: Flags [P.], seq 280552:283300, ack 352, win 65535, length 2748
00:14:35.845026 IP 151.101.117.164.443 > 10.0.2.15.44034: Flags [P.], seq 283300:286048, ack 352, win 65535, length 2748
00:14:35.845181 IP 151.101.117.164.443 > 10.0.2.15.44034: Flags [P.], seq 286048:290170, ack 352, win 65535, length 4122
00:14:35.845563 IP 10.0.2.15.44034 > 151.101.117.164.443: Flags [.], ack 290170, win 65535, length 0
00:14:35.846098 IP 151.101.117.164.443 > 10.0.2.15.44034: Flags [P.], seq 290170:294292, ack 352, win 65535, length 4122
00:14:35.846179 IP 10.0.2.15.44034 > 151.101.117.164.443: Flags [.], ack 294292, win 65535, length 0
00:14:35.846444 IP 151.101.117.164.443 > 10.0.2.15.44034: Flags [P.], seq 294292:298414, ack 352, win 65535, length 4122
00:14:35.846460 IP 10.0.2.15.44034 > 151.101.117.164.443: Flags [.], ack 298414, win 65535, length 0
00:14:35.846754 IP 151.101.117.164.443 > 10.0.2.15.44034: Flags [P.], seq 298414:299788, ack 352, win 65535, length 1374
00:14:35.848743 IP 151.101.117.164.443 > 10.0.2.15.44034: Flags [P.], seq 299788:302536, ack 352, win 65535, length 2748
00:14:35.848767 IP 10.0.2.15.44034 > 151.101.117.164.443: Flags [.], ack 302536, win 65535, length 0
00:14:35.849098 IP 151.101.117.164.443 > 10.0.2.15.44034: Flags [P.], seq 302536:308032, ack 352, win 65535, length 5496
00:14:35.849109 IP 10.0.2.15.44034 > 151.101.117.164.443: Flags [.], ack 308032, win 65535, length 0
00:14:35.850026 IP 151.101.117.164.443 > 10.0.2.15.44034: Flags [P.], seq 308032:313528, ack 352, win 65535, length 5496
00:14:35.850049 IP 10.0.2.15.44034 > 151.101.117.164.443: Flags [.], ack 313528, win 65535, length 0
00:14:35.850635 IP 151.101.117.164.443 > 10.0.2.15.44034: Flags [P.], seq 313528:316276, ack 352, win 65535, length 2748
00:14:35.850639 IP 151.101.117.164.443 > 10.0.2.15.44034: Flags [P.], seq 316276:317650, ack 352, win 65535, length 1374
00:14:35.850640 IP 151.101.117.164.443 > 10.0.2.15.44034: Flags [P.], seq 317650:320398, ack 352, win 65535, length 2748
00:14:35.850641 IP 151.101.117.164.443 > 10.0.2.15.44034: Flags [P.], seq 320398:323146, ack 352, win 65535, length 2748
00:14:35.850714 IP 10.0.2.15.44034 > 151.101.117.164.443: Flags [.], ack 316276, win 65535, length 0
00:14:35.850753 IP 10.0.2.15.44034 > 151.101.117.164.443: Flags [.], ack 320398, win 65535, length 0
00:14:35.851091 IP 10.0.2.15.44034 > 151.101.117.164.443: Flags [.], ack 323146, win 65535, length 0
00:14:35.851326 IP 151.101.117.164.443 > 10.0.2.15.44034: Flags [P.], seq 323146:325894, ack 352, win 65535, length 2748
00:14:35.851327 IP 151.101.117.164.443 > 10.0.2.15.44034: Flags [P.], seq 325894:327268, ack 352, win 65535, length 1374
00:14:35.851328 IP 151.101.117.164.443 > 10.0.2.15.44034: Flags [P.], seq 327268:330016, ack 352, win 65535, length 2748
00:14:35.851341 IP 10.0.2.15.44034 > 151.101.117.164.443: Flags [.], ack 325894, win 65535, length 0
00:14:35.851357 IP 10.0.2.15.44034 > 151.101.117.164.443: Flags [.], ack 330016, win 65535, length 0
00:14:35.852018 IP 151.101.117.164.443 > 10.0.2.15.44034: Flags [P.], seq 330016:332764, ack 352, win 65535, length 2748
00:14:35.852034 IP 10.0.2.15.44034 > 151.101.117.164.443: Flags [.], ack 332764, win 65535, length 0
00:14:35.852363 IP 151.101.117.164.443 > 10.0.2.15.44034: Flags [P.], seq 332764:338260, ack 352, win 65535, length 5496
00:14:35.852365 IP 151.101.117.164.443 > 10.0.2.15.44034: Flags [P.], seq 338260:341008, ack 352, win 65535, length 2748
00:14:35.852411 IP 10.0.2.15.44034 > 151.101.117.164.443: Flags [.], ack 338260, win 65535, length 0
00:14:35.852430 IP 10.0.2.15.44034 > 151.101.117.164.443: Flags [.], ack 341008, win 65535, length 0
00:14:35.852687 IP 151.101.117.164.443 > 10.0.2.15.44034: Flags [P.], seq 341008:343756, ack 352, win 65535, length 2748
00:14:35.852772 IP 10.0.2.15.44034 > 151.101.117.164.443: Flags [.], ack 343756, win 65535, length 0
00:14:35.852992 IP 151.101.117.164.443 > 10.0.2.15.44034: Flags [P.], seq 343756:346504, ack 352, win 65535, length 2748
00:14:35.853000 IP 10.0.2.15.44034 > 151.101.117.164.443: Flags [.], ack 346504, win 65535, length 0
00:14:35.853306 IP 151.101.117.164.443 > 10.0.2.15.44034: Flags [P.], seq 346504:350626, ack 352, win 65535, length 4122
00:14:35.853319 IP 10.0.2.15.44034 > 151.101.117.164.443: Flags [.], ack 350626, win 65535, length 0
00:14:35.854636 IP 151.101.117.164.443 > 10.0.2.15.44034: Flags [P.], seq 350626:353374, ack 352, win 65535, length 2748
00:14:35.854784 IP 10.0.2.15.44034 > 151.101.117.164.443: Flags [.], ack 353374, win 65535, length 0
00:14:35.855000 IP 151.101.117.164.443 > 10.0.2.15.44034: Flags [P.], seq 353374:358870, ack 352, win 65535, length 5496
00:14:35.855205 IP 10.0.2.15.44034 > 151.101.117.164.443: Flags [.], ack 358870, win 65535, length 0
00:14:35.855538 IP 151.101.117.164.443 > 10.0.2.15.44034: Flags [P.], seq 358870:362992, ack 352, win 65535, length 4122
00:14:35.855542 IP 151.101.117.164.443 > 10.0.2.15.44034: Flags [P.], seq 362992:368488, ack 352, win 65535, length 5496
00:14:35.855563 IP 10.0.2.15.44034 > 151.101.117.164.443: Flags [.], ack 362992, win 65535, length 0
00:14:35.855651 IP 10.0.2.15.44034 > 151.101.117.164.443: Flags [.], ack 368488, win 65535, length 0
00:14:35.855947 IP 151.101.117.164.443 > 10.0.2.15.44034: Flags [P.], seq 368488:371236, ack 352, win 65535, length 2748
00:14:35.855949 IP 151.101.117.164.443 > 10.0.2.15.44034: Flags [P.], seq 371236:373984, ack 352, win 65535, length 2748
00:14:35.855965 IP 10.0.2.15.44034 > 151.101.117.164.443: Flags [.], ack 371236, win 65535, length 0
00:14:35.855979 IP 10.0.2.15.44034 > 151.101.117.164.443: Flags [.], ack 373984, win 65535, length 0
00:14:35.856734 IP 151.101.117.164.443 > 10.0.2.15.44034: Flags [P.], seq 373984:378106, ack 352, win 65535, length 4122
00:14:35.856737 IP 151.101.117.164.443 > 10.0.2.15.44034: Flags [P.], seq 378106:379480, ack 352, win 65535, length 1374
00:14:35.856755 IP 10.0.2.15.44034 > 151.101.117.164.443: Flags [.], ack 378106, win 65535, length 0
00:14:35.857396 IP 151.101.117.164.443 > 10.0.2.15.44034: Flags [P.], seq 379480:382228, ack 352, win 65535, length 2748
00:14:35.857400 IP 151.101.117.164.443 > 10.0.2.15.44034: Flags [P.], seq 382228:384976, ack 352, win 65535, length 2748
00:14:35.857400 IP 151.101.117.164.443 > 10.0.2.15.44034: Flags [P.], seq 384976:387724, ack 352, win 65535, length 2748
00:14:35.857464 IP 10.0.2.15.44034 > 151.101.117.164.443: Flags [.], ack 382228, win 65535, length 0
00:14:35.857550 IP 10.0.2.15.44034 > 151.101.117.164.443: Flags [.], ack 384976, win 65535, length 0
00:14:35.857561 IP 10.0.2.15.44034 > 151.101.117.164.443: Flags [.], ack 387724, win 65535, length 0
00:14:35.857663 IP 151.101.117.164.443 > 10.0.2.15.44034: Flags [P.], seq 387724:390472, ack 352, win 65535, length 2748
00:14:35.857723 IP 10.0.2.15.44034 > 151.101.117.164.443: Flags [.], ack 390472, win 65535, length 0
00:14:35.857880 IP 151.101.117.164.443 > 10.0.2.15.44034: Flags [P.], seq 390472:393220, ack 352, win 65535, length 2748
00:14:35.857922 IP 10.0.2.15.44034 > 151.101.117.164.443: Flags [.], ack 393220, win 65535, length 0
00:14:35.863397 IP 151.101.117.164.443 > 10.0.2.15.44034: Flags [P.], seq 393220:434440, ack 352, win 65535, length 41220
00:14:35.863423 IP 10.0.2.15.44034 > 151.101.117.164.443: Flags [.], ack 434440, win 65535, length 0
00:14:35.866367 IP 151.101.117.164.443 > 10.0.2.15.44034: Flags [P.], seq 434440:439936, ack 352, win 65535, length 5496
00:14:35.866371 IP 151.101.117.164.443 > 10.0.2.15.44034: Flags [P.], seq 439936:452302, ack 352, win 65535, length 12366
00:14:35.866455 IP 10.0.2.15.44034 > 151.101.117.164.443: Flags [.], ack 439936, win 65535, length 0
00:14:35.866575 IP 10.0.2.15.44034 > 151.101.117.164.443: Flags [.], ack 452302, win 65535, length 0
00:14:35.866613 IP 151.101.117.164.443 > 10.0.2.15.44034: Flags [P.], seq 452302:456424, ack 352, win 65535, length 4122
00:14:35.866619 IP 10.0.2.15.44034 > 151.101.117.164.443: Flags [.], ack 456424, win 65535, length 0
00:14:35.867897 IP 151.101.117.164.443 > 10.0.2.15.44034: Flags [P.], seq 456424:460546, ack 352, win 65535, length 4122
00:14:35.867900 IP 151.101.117.164.443 > 10.0.2.15.44034: Flags [P.], seq 460546:461920, ack 352, win 65535, length 1374
00:14:35.867927 IP 10.0.2.15.44034 > 151.101.117.164.443: Flags [.], ack 460546, win 65535, length 0
00:14:35.868365 IP 151.101.117.164.443 > 10.0.2.15.44034: Flags [P.], seq 461920:470164, ack 352, win 65535, length 8244
00:14:35.868367 IP 151.101.117.164.443 > 10.0.2.15.44034: Flags [.], seq 470164:471624, ack 352, win 65535, length 1460
00:14:35.868383 IP 10.0.2.15.44034 > 151.101.117.164.443: Flags [.], ack 470164, win 65535, length 0
00:14:35.868897 IP 151.101.117.164.443 > 10.0.2.15.44034: Flags [P.], seq 471624:474286, ack 352, win 65535, length 2662
00:14:35.868918 IP 10.0.2.15.44034 > 151.101.117.164.443: Flags [.], ack 474286, win 65535, length 0
00:14:35.869353 IP 151.101.117.164.443 > 10.0.2.15.44034: Flags [P.], seq 474286:475660, ack 352, win 65535, length 1374
00:14:35.869357 IP 151.101.117.164.443 > 10.0.2.15.44034: Flags [P.], seq 475660:483904, ack 352, win 65535, length 8244
00:14:35.869555 IP 10.0.2.15.44034 > 151.101.117.164.443: Flags [.], ack 483904, win 65535, length 0
00:14:35.871163 IP 151.101.117.164.443 > 10.0.2.15.44034: Flags [P.], seq 483904:489400, ack 352, win 65535, length 5496
00:14:35.871168 IP 151.101.117.164.443 > 10.0.2.15.44034: Flags [P.], seq 489400:492148, ack 352, win 65535, length 2748
00:14:35.871171 IP 151.101.117.164.443 > 10.0.2.15.44034: Flags [P.], seq 492148:500392, ack 352, win 65535, length 8244
00:14:35.871200 IP 10.0.2.15.44034 > 151.101.117.164.443: Flags [.], ack 489400, win 65535, length 0
00:14:35.871316 IP 10.0.2.15.44034 > 151.101.117.164.443: Flags [.], ack 492148, win 65535, length 0
00:14:35.871337 IP 10.0.2.15.44034 > 151.101.117.164.443: Flags [.], ack 500392, win 65535, length 0
00:14:35.871368 IP 151.101.117.164.443 > 10.0.2.15.44034: Flags [P.], seq 500392:505888, ack 352, win 65535, length 5496
00:14:35.871374 IP 10.0.2.15.44034 > 151.101.117.164.443: Flags [.], ack 505888, win 65535, length 0
00:14:35.881789 IP 151.101.117.164.443 > 10.0.2.15.44034: Flags [P.], seq 505888:544360, ack 352, win 65535, length 38472
00:14:35.881815 IP 10.0.2.15.44034 > 151.101.117.164.443: Flags [.], ack 544360, win 65535, length 0
00:14:35.887965 IP 151.101.117.164.443 > 10.0.2.15.44034: Flags [.], seq 544360:608600, ack 352, win 65535, length 64240
00:14:35.889263 IP 10.0.2.15.44034 > 151.101.117.164.443: Flags [.], ack 608600, win 65535, length 0
00:14:35.890726 IP 151.101.117.164.443 > 10.0.2.15.44034: Flags [P.], seq 608600:610060, ack 352, win 65535, length 1460
00:14:35.890730 IP 151.101.117.164.443 > 10.0.2.15.44034: Flags [.], seq 610060:612980, ack 352, win 65535, length 2920
00:14:35.890965 IP 10.0.2.15.44034 > 151.101.117.164.443: Flags [.], ack 612980, win 65535, length 0
00:14:35.891462 IP 151.101.117.164.443 > 10.0.2.15.44034: Flags [P.], seq 612980:674300, ack 352, win 65535, length 61320
00:14:35.891565 IP 10.0.2.15.44034 > 151.101.117.164.443: Flags [.], ack 674300, win 65535, length 0
00:14:35.893011 IP 151.101.117.164.443 > 10.0.2.15.44034: Flags [.], seq 674300:684520, ack 352, win 65535, length 10220
00:14:35.893102 IP 10.0.2.15.44034 > 151.101.117.164.443: Flags [.], ack 684520, win 65535, length 0
00:14:35.893442 IP 151.101.117.164.443 > 10.0.2.15.44034: Flags [P.], seq 684520:696874, ack 352, win 65535, length 12354
00:14:35.893505 IP 151.101.117.164.443 > 10.0.2.15.44034: Flags [P.], seq 696874:700996, ack 352, win 65535, length 4122
00:14:35.893506 IP 151.101.117.164.443 > 10.0.2.15.44034: Flags [P.], seq 700996:703744, ack 352, win 65535, length 2748
00:14:35.893507 IP 151.101.117.164.443 > 10.0.2.15.44034: Flags [P.], seq 703744:706492, ack 352, win 65535, length 2748
00:14:35.893593 IP 10.0.2.15.44034 > 151.101.117.164.443: Flags [.], ack 706492, win 65535, length 0
00:14:35.902010 IP 151.101.117.164.443 > 10.0.2.15.44034: Flags [P.], seq 706492:710614, ack 352, win 65535, length 4122
00:14:35.902013 IP 151.101.117.164.443 > 10.0.2.15.44034: Flags [P.], seq 710614:714736, ack 352, win 65535, length 4122
00:14:35.902098 IP 10.0.2.15.44034 > 151.101.117.164.443: Flags [.], ack 710614, win 65535, length 0
00:14:35.902331 IP 151.101.117.164.443 > 10.0.2.15.44034: Flags [P.], seq 714736:716110, ack 352, win 65535, length 1374
00:14:35.902423 IP 10.0.2.15.44034 > 151.101.117.164.443: Flags [.], ack 716110, win 65535, length 0
00:14:35.903337 IP 151.101.117.164.443 > 10.0.2.15.44034: Flags [P.], seq 716110:721606, ack 352, win 65535, length 5496
00:14:35.903355 IP 10.0.2.15.44034 > 151.101.117.164.443: Flags [.], ack 721606, win 65535, length 0
00:14:35.903540 IP 151.101.117.164.443 > 10.0.2.15.44034: Flags [P.], seq 721606:722980, ack 352, win 65535, length 1374
00:14:35.903704 IP 151.101.117.164.443 > 10.0.2.15.44034: Flags [P.], seq 722980:727102, ack 352, win 65535, length 4122
00:14:35.903855 IP 151.101.117.164.443 > 10.0.2.15.44034: Flags [P.], seq 727102:729850, ack 352, win 65535, length 2748
00:14:35.903934 IP 10.0.2.15.44034 > 151.101.117.164.443: Flags [.], ack 729850, win 65535, length 0
00:14:35.904074 IP 151.101.117.164.443 > 10.0.2.15.44034: Flags [P.], seq 729850:732598, ack 352, win 65535, length 2748
00:14:35.904125 IP 10.0.2.15.44034 > 151.101.117.164.443: Flags [.], ack 732598, win 65535, length 0
00:14:35.904265 IP 151.101.117.164.443 > 10.0.2.15.44034: Flags [P.], seq 732598:733972, ack 352, win 65535, length 1374
00:14:35.904371 IP 151.101.117.164.443 > 10.0.2.15.44034: Flags [P.], seq 733972:735346, ack 352, win 65535, length 1374
00:14:35.904377 IP 10.0.2.15.44034 > 151.101.117.164.443: Flags [.], ack 735346, win 65535, length 0
00:14:35.905275 IP 151.101.117.164.443 > 10.0.2.15.44034: Flags [P.], seq 735346:739468, ack 352, win 65535, length 4122
00:14:35.905359 IP 151.101.117.164.443 > 10.0.2.15.44034: Flags [P.], seq 739468:742216, ack 352, win 65535, length 2748
00:14:35.906092 IP 151.101.117.164.443 > 10.0.2.15.44034: Flags [P.], seq 742216:743590, ack 352, win 65535, length 1374
00:14:35.906095 IP 151.101.117.164.443 > 10.0.2.15.44034: Flags [P.], seq 743590:747712, ack 352, win 65535, length 4122
00:14:35.906096 IP 151.101.117.164.443 > 10.0.2.15.44034: Flags [P.], seq 747712:749086, ack 352, win 65535, length 1374
00:14:35.906097 IP 151.101.117.164.443 > 10.0.2.15.44034: Flags [P.], seq 749086:751834, ack 352, win 65535, length 2748
00:14:35.906563 IP 10.0.2.15.44034 > 151.101.117.164.443: Flags [.], ack 751834, win 65535, length 0
00:14:35.907402 IP 151.101.117.164.443 > 10.0.2.15.44034: Flags [P.], seq 751834:757330, ack 352, win 65535, length 5496
00:14:35.907416 IP 10.0.2.15.44034 > 151.101.117.164.443: Flags [.], ack 757330, win 65535, length 0
00:14:35.907586 IP 151.101.117.164.443 > 10.0.2.15.44034: Flags [P.], seq 757330:760078, ack 352, win 65535, length 2748
00:14:35.907648 IP 10.0.2.15.44034 > 151.101.117.164.443: Flags [.], ack 760078, win 65535, length 0
00:14:35.907901 IP 151.101.117.164.443 > 10.0.2.15.44034: Flags [P.], seq 760078:762826, ack 352, win 65535, length 2748
00:14:35.908117 IP 151.101.117.164.443 > 10.0.2.15.44034: Flags [P.], seq 762826:766948, ack 352, win 65535, length 4122
00:14:35.908141 IP 10.0.2.15.44034 > 151.101.117.164.443: Flags [.], ack 762826, win 65535, length 0
00:14:35.908421 IP 151.101.117.164.443 > 10.0.2.15.44034: Flags [P.], seq 766948:771070, ack 352, win 65535, length 4122
00:14:35.908556 IP 151.101.117.164.443 > 10.0.2.15.44034: Flags [P.], seq 771070:772444, ack 352, win 65535, length 1374
00:14:35.908626 IP 10.0.2.15.44034 > 151.101.117.164.443: Flags [.], ack 772444, win 65535, length 0
00:14:35.908856 IP 151.101.117.164.443 > 10.0.2.15.44034: Flags [P.], seq 772444:775192, ack 352, win 65535, length 2748
00:14:35.908893 IP 10.0.2.15.44034 > 151.101.117.164.443: Flags [.], ack 775192, win 65535, length 0
00:14:35.909061 IP 151.101.117.164.443 > 10.0.2.15.44034: Flags [P.], seq 775192:777940, ack 352, win 65535, length 2748
00:14:35.909112 IP 10.0.2.15.44034 > 151.101.117.164.443: Flags [.], ack 777940, win 65535, length 0
00:14:35.909948 IP 151.101.117.164.443 > 10.0.2.15.44034: Flags [P.], seq 777940:783436, ack 352, win 65535, length 5496
00:14:35.910007 IP 10.0.2.15.44034 > 151.101.117.164.443: Flags [.], ack 783436, win 65535, length 0
00:14:35.910253 IP 151.101.117.164.443 > 10.0.2.15.44034: Flags [P.], seq 783436:788932, ack 352, win 65535, length 5496
00:14:35.910341 IP 151.101.117.164.443 > 10.0.2.15.44034: Flags [P.], seq 788932:790306, ack 352, win 65535, length 1374
00:14:35.910459 IP 10.0.2.15.44034 > 151.101.117.164.443: Flags [.], ack 790306, win 65535, length 0
00:14:35.910479 IP 151.101.117.164.443 > 10.0.2.15.44034: Flags [P.], seq 790306:791680, ack 352, win 65535, length 1374
00:14:35.910742 IP 151.101.117.164.443 > 10.0.2.15.44034: Flags [P.], seq 791680:793054, ack 352, win 65535, length 1374
00:14:35.910744 IP 151.101.117.164.443 > 10.0.2.15.44034: Flags [P.], seq 793054:795802, ack 352, win 65535, length 2748
00:14:35.910755 IP 10.0.2.15.44034 > 151.101.117.164.443: Flags [.], ack 793054, win 65535, length 0
00:14:35.910853 IP 10.0.2.15.44034 > 151.101.117.164.443: Flags [.], ack 795802, win 65535, length 0
00:14:35.910923 IP 151.101.117.164.443 > 10.0.2.15.44034: Flags [P.], seq 795802:797176, ack 352, win 65535, length 1374
00:14:35.911034 IP 151.101.117.164.443 > 10.0.2.15.44034: Flags [P.], seq 797176:798550, ack 352, win 65535, length 1374
00:14:35.911040 IP 10.0.2.15.44034 > 151.101.117.164.443: Flags [.], ack 798550, win 65535, length 0
00:14:35.913104 IP 151.101.117.164.443 > 10.0.2.15.44034: Flags [P.], seq 798550:802672, ack 352, win 65535, length 4122
00:14:35.913108 IP 151.101.117.164.443 > 10.0.2.15.44034: Flags [P.], seq 802672:808168, ack 352, win 65535, length 5496
00:14:35.913109 IP 151.101.117.164.443 > 10.0.2.15.44034: Flags [P.], seq 808168:810916, ack 352, win 65535, length 2748
00:14:35.913998 IP 151.101.117.164.443 > 10.0.2.15.44034: Flags [P.], seq 810916:815038, ack 352, win 65535, length 4122
00:14:35.914066 IP 10.0.2.15.44034 > 151.101.117.164.443: Flags [.], ack 815038, win 65535, length 0
00:14:35.914219 IP 151.101.117.164.443 > 10.0.2.15.44034: Flags [P.], seq 815038:819160, ack 352, win 65535, length 4122
00:14:35.914221 IP 151.101.117.164.443 > 10.0.2.15.44034: Flags [P.], seq 819160:824656, ack 352, win 65535, length 5496
00:14:35.914231 IP 10.0.2.15.44034 > 151.101.117.164.443: Flags [.], ack 819160, win 65535, length 0
00:14:35.914312 IP 10.0.2.15.44034 > 151.101.117.164.443: Flags [.], ack 824656, win 65535, length 0
00:14:35.915265 IP 151.101.117.164.443 > 10.0.2.15.44034: Flags [P.], seq 824656:828778, ack 352, win 65535, length 4122
00:14:35.915378 IP 151.101.117.164.443 > 10.0.2.15.44034: Flags [P.], seq 828778:830152, ack 352, win 65535, length 1374
00:14:35.915612 IP 151.101.117.164.443 > 10.0.2.15.44034: Flags [P.], seq 830152:832900, ack 352, win 65535, length 2748
00:14:35.916221 IP 151.101.117.164.443 > 10.0.2.15.44034: Flags [P.], seq 832900:837022, ack 352, win 65535, length 4122
00:14:35.916223 IP 151.101.117.164.443 > 10.0.2.15.44034: Flags [P.], seq 837022:841144, ack 352, win 65535, length 4122
00:14:35.916360 IP 151.101.117.164.443 > 10.0.2.15.44034: Flags [P.], seq 841144:845266, ack 352, win 65535, length 4122
00:14:35.916402 IP 10.0.2.15.44034 > 151.101.117.164.443: Flags [.], ack 845266, win 65535, length 0
00:14:35.916615 IP 151.101.117.164.443 > 10.0.2.15.44034: Flags [P.], seq 845266:846640, ack 352, win 65535, length 1374
00:14:35.916730 IP 151.101.117.164.443 > 10.0.2.15.44034: Flags [P.], seq 846640:849388, ack 352, win 65535, length 2748
00:14:35.916750 IP 10.0.2.15.44034 > 151.101.117.164.443: Flags [.], ack 849388, win 65535, length 0
00:14:35.917806 IP 151.101.117.164.443 > 10.0.2.15.44034: Flags [P.], seq 849388:853510, ack 352, win 65535, length 4122
00:14:35.917809 IP 151.101.117.164.443 > 10.0.2.15.44034: Flags [.], seq 853510:854970, ack 352, win 65535, length 1460
00:14:35.917975 IP 151.101.117.164.443 > 10.0.2.15.44034: Flags [P.], seq 854970:857632, ack 352, win 65535, length 2662
00:14:35.918035 IP 10.0.2.15.44034 > 151.101.117.164.443: Flags [.], ack 857632, win 65535, length 0
00:14:35.918206 IP 151.101.117.164.443 > 10.0.2.15.44034: Flags [P.], seq 857632:861754, ack 352, win 65535, length 4122
00:14:35.918239 IP 10.0.2.15.44034 > 151.101.117.164.443: Flags [.], ack 861754, win 65535, length 0
00:14:35.918577 IP 151.101.117.164.443 > 10.0.2.15.44034: Flags [P.], seq 861754:864502, ack 352, win 65535, length 2748
00:14:35.918703 IP 151.101.117.164.443 > 10.0.2.15.44034: Flags [P.], seq 864502:869998, ack 352, win 65535, length 5496
00:14:35.918827 IP 151.101.117.164.443 > 10.0.2.15.44034: Flags [P.], seq 869998:871372, ack 352, win 65535, length 1374
00:14:35.918861 IP 10.0.2.15.44034 > 151.101.117.164.443: Flags [.], ack 871372, win 65535, length 0
00:14:35.919000 IP 151.101.117.164.443 > 10.0.2.15.44034: Flags [P.], seq 871372:874120, ack 352, win 65535, length 2748
00:14:35.919006 IP 10.0.2.15.44034 > 151.101.117.164.443: Flags [.], ack 874120, win 65535, length 0
00:14:35.919937 IP 151.101.117.164.443 > 10.0.2.15.44034: Flags [P.], seq 874120:876868, ack 352, win 65535, length 2748
00:14:35.920006 IP 10.0.2.15.44034 > 151.101.117.164.443: Flags [.], ack 876868, win 65535, length 0
00:14:35.920268 IP 151.101.117.164.443 > 10.0.2.15.44034: Flags [P.], seq 876868:882364, ack 352, win 65535, length 5496
00:14:35.920269 IP 151.101.117.164.443 > 10.0.2.15.44034: Flags [P.], seq 882364:883738, ack 352, win 65535, length 1374
00:14:35.920509 IP 151.101.117.164.443 > 10.0.2.15.44034: Flags [P.], seq 883738:886486, ack 352, win 65535, length 2748
00:14:35.920511 IP 151.101.117.164.443 > 10.0.2.15.44034: Flags [P.], seq 886486:887860, ack 352, win 65535, length 1374
00:14:35.920560 IP 10.0.2.15.44034 > 151.101.117.164.443: Flags [.], ack 887860, win 65535, length 0
00:14:35.920689 IP 151.101.117.164.443 > 10.0.2.15.44034: Flags [P.], seq 887860:889234, ack 352, win 65535, length 1374
00:14:35.921350 IP 151.101.117.164.443 > 10.0.2.15.44034: Flags [P.], seq 889234:891982, ack 352, win 65535, length 2748
00:14:35.921352 IP 151.101.117.164.443 > 10.0.2.15.44034: Flags [P.], seq 891982:893356, ack 352, win 65535, length 1374
00:14:35.921353 IP 151.101.117.164.443 > 10.0.2.15.44034: Flags [P.], seq 893356:896104, ack 352, win 65535, length 2748
00:14:35.921353 IP 151.101.117.164.443 > 10.0.2.15.44034: Flags [P.], seq 896104:897478, ack 352, win 65535, length 1374
00:14:35.921459 IP 151.101.117.164.443 > 10.0.2.15.44034: Flags [P.], seq 897478:900226, ack 352, win 65535, length 2748
00:14:35.921491 IP 10.0.2.15.44034 > 151.101.117.164.443: Flags [.], ack 900226, win 65535, length 0
00:14:35.925046 IP 151.101.117.164.443 > 10.0.2.15.44034: Flags [P.], seq 900226:922210, ack 352, win 65535, length 21984
00:14:35.925170 IP 10.0.2.15.44034 > 151.101.117.164.443: Flags [.], ack 922210, win 65535, length 0
00:14:35.925250 IP 151.101.117.164.443 > 10.0.2.15.44034: Flags [P.], seq 922210:929080, ack 352, win 65535, length 6870
00:14:35.925252 IP 151.101.117.164.443 > 10.0.2.15.44034: Flags [P.], seq 929080:933202, ack 352, win 65535, length 4122
00:14:35.925545 IP 151.101.117.164.443 > 10.0.2.15.44034: Flags [P.], seq 933202:938698, ack 352, win 65535, length 5496
00:14:35.925568 IP 10.0.2.15.44034 > 151.101.117.164.443: Flags [.], ack 933202, win 65535, length 0
00:14:35.925621 IP 151.101.117.164.443 > 10.0.2.15.44034: Flags [P.], seq 938698:941446, ack 352, win 65535, length 2748
00:14:35.925699 IP 10.0.2.15.44034 > 151.101.117.164.443: Flags [.], ack 941446, win 65535, length 0
00:14:35.925828 IP 151.101.117.164.443 > 10.0.2.15.44034: Flags [P.], seq 941446:944194, ack 352, win 65535, length 2748
00:14:35.925837 IP 10.0.2.15.44034 > 151.101.117.164.443: Flags [.], ack 944194, win 65535, length 0
00:14:35.926127 IP 151.101.117.164.443 > 10.0.2.15.44034: Flags [P.], seq 944194:945568, ack 352, win 65535, length 1374
00:14:35.926128 IP 151.101.117.164.443 > 10.0.2.15.44034: Flags [P.], seq 945568:946942, ack 352, win 65535, length 1374
00:14:35.926252 IP 10.0.2.15.44034 > 151.101.117.164.443: Flags [.], ack 946942, win 65535, length 0
00:14:35.926998 IP 151.101.117.164.443 > 10.0.2.15.44034: Flags [P.], seq 946942:951064, ack 352, win 65535, length 4122
00:14:35.927009 IP 10.0.2.15.44034 > 151.101.117.164.443: Flags [.], ack 951064, win 65535, length 0
00:14:35.927198 IP 151.101.117.164.443 > 10.0.2.15.44034: Flags [P.], seq 951064:953812, ack 352, win 65535, length 2748
00:14:35.927365 IP 151.101.117.164.443 > 10.0.2.15.44034: Flags [P.], seq 953812:956560, ack 352, win 65535, length 2748
00:14:35.927456 IP 10.0.2.15.44034 > 151.101.117.164.443: Flags [.], ack 956560, win 65535, length 0
00:14:35.927543 IP 151.101.117.164.443 > 10.0.2.15.44034: Flags [P.], seq 956560:959308, ack 352, win 65535, length 2748
00:14:35.927645 IP 10.0.2.15.44034 > 151.101.117.164.443: Flags [.], ack 959308, win 65535, length 0
00:14:35.927768 IP 151.101.117.164.443 > 10.0.2.15.44034: Flags [P.], seq 959308:960682, ack 352, win 65535, length 1374
00:14:35.927878 IP 151.101.117.164.443 > 10.0.2.15.44034: Flags [P.], seq 960682:964804, ack 352, win 65535, length 4122
00:14:35.927909 IP 10.0.2.15.44034 > 151.101.117.164.443: Flags [.], ack 964804, win 65535, length 0
00:14:35.928908 IP 151.101.117.164.443 > 10.0.2.15.44034: Flags [P.], seq 964804:968926, ack 352, win 65535, length 4122
00:14:35.928909 IP 151.101.117.164.443 > 10.0.2.15.44034: Flags [P.], seq 968926:971674, ack 352, win 65535, length 2748
00:14:35.929082 IP 151.101.117.164.443 > 10.0.2.15.44034: Flags [P.], seq 971674:974422, ack 352, win 65535, length 2748
00:14:35.929143 IP 10.0.2.15.44034 > 151.101.117.164.443: Flags [.], ack 974422, win 65535, length 0
00:14:35.929754 IP 151.101.117.164.443 > 10.0.2.15.44034: Flags [P.], seq 974422:977170, ack 352, win 65535, length 2748
00:14:35.929983 IP 151.101.117.164.443 > 10.0.2.15.44034: Flags [P.], seq 977170:981292, ack 352, win 65535, length 4122
00:14:35.929984 IP 151.101.117.164.443 > 10.0.2.15.44034: Flags [P.], seq 981292:985414, ack 352, win 65535, length 4122
00:14:35.930062 IP 10.0.2.15.44034 > 151.101.117.164.443: Flags [.], ack 985414, win 65535, length 0
00:14:35.930200 IP 151.101.117.164.443 > 10.0.2.15.44034: Flags [P.], seq 985414:988162, ack 352, win 65535, length 2748
00:14:35.930280 IP 151.101.117.164.443 > 10.0.2.15.44034: Flags [P.], seq 988162:990910, ack 352, win 65535, length 2748
00:14:35.930418 IP 151.101.117.164.443 > 10.0.2.15.44034: Flags [P.], seq 990910:992284, ack 352, win 65535, length 1374
00:14:35.930507 IP 151.101.117.164.443 > 10.0.2.15.44034: Flags [P.], seq 992284:993658, ack 352, win 65535, length 1374
00:14:35.930622 IP 10.0.2.15.44034 > 151.101.117.164.443: Flags [.], ack 993658, win 65535, length 0
00:14:35.932461 IP 151.101.117.164.443 > 10.0.2.15.44034: Flags [P.], seq 993658:1001902, ack 352, win 65535, length 8244
00:14:35.932477 IP 10.0.2.15.44034 > 151.101.117.164.443: Flags [.], ack 1001902, win 65535, length 0
00:14:35.932769 IP 151.101.117.164.443 > 10.0.2.15.44034: Flags [P.], seq 1001902:1006024, ack 352, win 65535, length 4122
00:14:35.932770 IP 151.101.117.164.443 > 10.0.2.15.44034: Flags [P.], seq 1006024:1007398, ack 352, win 65535, length 1374
00:14:35.932781 IP 10.0.2.15.44034 > 151.101.117.164.443: Flags [.], ack 1006024, win 65535, length 0
00:14:35.933102 IP 151.101.117.164.443 > 10.0.2.15.44034: Flags [P.], seq 1007398:1010146, ack 352, win 65535, length 2748
00:14:35.933104 IP 151.101.117.164.443 > 10.0.2.15.44034: Flags [P.], seq 1010146:1011520, ack 352, win 65535, length 1374
00:14:35.933118 IP 10.0.2.15.44034 > 151.101.117.164.443: Flags [.], ack 1010146, win 65535, length 0
00:14:35.934207 IP 151.101.117.164.443 > 10.0.2.15.44034: Flags [P.], seq 1011520:1015642, ack 352, win 65535, length 4122
00:14:35.934280 IP 10.0.2.15.44034 > 151.101.117.164.443: Flags [.], ack 1015642, win 65535, length 0
00:14:35.934415 IP 151.101.117.164.443 > 10.0.2.15.44034: Flags [P.], seq 1015642:1019764, ack 352, win 65535, length 4122
00:14:35.934466 IP 10.0.2.15.44034 > 151.101.117.164.443: Flags [.], ack 1019764, win 65535, length 0
00:14:35.934693 IP 151.101.117.164.443 > 10.0.2.15.44034: Flags [P.], seq 1019764:1023886, ack 352, win 65535, length 4122
00:14:35.934745 IP 10.0.2.15.44034 > 151.101.117.164.443: Flags [.], ack 1023886, win 65535, length 0
00:14:35.934861 IP 151.101.117.164.443 > 10.0.2.15.44034: Flags [P.], seq 1023886:1026634, ack 352, win 65535, length 2748
00:14:35.934900 IP 10.0.2.15.44034 > 151.101.117.164.443: Flags [.], ack 1026634, win 65535, length 0
00:14:35.935013 IP 151.101.117.164.443 > 10.0.2.15.44034: Flags [P.], seq 1026634:1028008, ack 352, win 65535, length 1374
00:14:35.936473 IP 151.101.117.164.443 > 10.0.2.15.44034: Flags [P.], seq 1028008:1033504, ack 352, win 65535, length 5496
00:14:35.936671 IP 151.101.117.164.443 > 10.0.2.15.44034: Flags [P.], seq 1033504:1036252, ack 352, win 65535, length 2748
00:14:35.936702 IP 10.0.2.15.44034 > 151.101.117.164.443: Flags [.], ack 1036252, win 65535, length 0
00:14:35.936851 IP 151.101.117.164.443 > 10.0.2.15.44034: Flags [P.], seq 1036252:1039000, ack 352, win 65535, length 2748
00:14:35.936966 IP 151.101.117.164.443 > 10.0.2.15.44034: Flags [P.], seq 1039000:1041748, ack 352, win 65535, length 2748
00:14:35.937059 IP 10.0.2.15.44034 > 151.101.117.164.443: Flags [.], ack 1041748, win 65535, length 0
00:14:35.937223 IP 151.101.117.164.443 > 10.0.2.15.44034: Flags [P.], seq 1041748:1045870, ack 352, win 65535, length 4122
00:14:35.937230 IP 10.0.2.15.44034 > 151.101.117.164.443: Flags [.], ack 1045870, win 65535, length 0
00:14:35.937337 IP 151.101.117.164.443 > 10.0.2.15.44034: Flags [P.], seq 1045870:1047244, ack 352, win 65535, length 1374
00:14:35.938370 IP 151.101.117.164.443 > 10.0.2.15.44034: Flags [P.], seq 1047244:1051366, ack 352, win 65535, length 4122
00:14:35.938633 IP 10.0.2.15.44034 > 151.101.117.164.443: Flags [.], ack 1051366, win 65535, length 0
00:14:35.938899 IP 151.101.117.164.443 > 10.0.2.15.44034: Flags [P.], seq 1051366:1055488, ack 352, win 65535, length 4122
00:14:35.938901 IP 151.101.117.164.443 > 10.0.2.15.44034: Flags [P.], seq 1055488:1058236, ack 352, win 65535, length 2748
00:14:35.938902 IP 151.101.117.164.443 > 10.0.2.15.44034: Flags [P.], seq 1058236:1060984, ack 352, win 65535, length 2748
00:14:35.939017 IP 10.0.2.15.44034 > 151.101.117.164.443: Flags [.], ack 1060984, win 65535, length 0
00:14:35.939155 IP 151.101.117.164.443 > 10.0.2.15.44034: Flags [P.], seq 1060984:1062358, ack 352, win 65535, length 1374
00:14:35.939156 IP 151.101.117.164.443 > 10.0.2.15.44034: Flags [P.], seq 1062358:1065106, ack 352, win 65535, length 2748
00:14:35.939197 IP 10.0.2.15.44034 > 151.101.117.164.443: Flags [.], ack 1065106, win 65535, length 0
00:14:35.939545 IP 151.101.117.164.443 > 10.0.2.15.44034: Flags [P.], seq 1065106:1066480, ack 352, win 65535, length 1374
00:14:35.939547 IP 151.101.117.164.443 > 10.0.2.15.44034: Flags [P.], seq 1066480:1067854, ack 352, win 65535, length 1374
00:14:35.939548 IP 151.101.117.164.443 > 10.0.2.15.44034: Flags [P.], seq 1067854:1069228, ack 352, win 65535, length 1374
00:14:35.939610 IP 10.0.2.15.44034 > 151.101.117.164.443: Flags [.], ack 1067854, win 65535, length 0
00:14:35.939813 IP 151.101.117.164.443 > 10.0.2.15.44034: Flags [P.], seq 1069228:1071976, ack 352, win 65535, length 2748
00:14:35.939814 IP 151.101.117.164.443 > 10.0.2.15.44034: Flags [P.], seq 1071976:1073350, ack 352, win 65535, length 1374
00:14:35.940032 IP 151.101.117.164.443 > 10.0.2.15.44034: Flags [P.], seq 1073350:1074724, ack 352, win 65535, length 1374
00:14:35.940086 IP 10.0.2.15.44034 > 151.101.117.164.443: Flags [.], ack 1074724, win 65535, length 0
00:14:35.940801 IP 151.101.117.164.443 > 10.0.2.15.44034: Flags [P.], seq 1074724:1078846, ack 352, win 65535, length 4122
00:14:35.940856 IP 10.0.2.15.44034 > 151.101.117.164.443: Flags [.], ack 1078846, win 65535, length 0
00:14:35.941157 IP 151.101.117.164.443 > 10.0.2.15.44034: Flags [P.], seq 1078846:1084342, ack 352, win 65535, length 5496
00:14:35.941158 IP 151.101.117.164.443 > 10.0.2.15.44034: Flags [P.], seq 1084342:1085716, ack 352, win 65535, length 1374
00:14:35.941205 IP 10.0.2.15.44034 > 151.101.117.164.443: Flags [.], ack 1084342, win 65535, length 0
00:14:35.941426 IP 151.101.117.164.443 > 10.0.2.15.44034: Flags [P.], seq 1085716:1088464, ack 352, win 65535, length 2748
00:14:35.941435 IP 10.0.2.15.44034 > 151.101.117.164.443: Flags [.], ack 1088464, win 65535, length 0
00:14:35.941688 IP 151.101.117.164.443 > 10.0.2.15.44034: Flags [P.], seq 1088464:1092586, ack 352, win 65535, length 4122
00:14:35.941811 IP 151.101.117.164.443 > 10.0.2.15.44034: Flags [P.], seq 1092586:1093960, ack 352, win 65535, length 1374
00:14:35.941853 IP 10.0.2.15.44034 > 151.101.117.164.443: Flags [.], ack 1093960, win 65535, length 0
00:14:35.942917 IP 151.101.117.164.443 > 10.0.2.15.44034: Flags [P.], seq 1093960:1098082, ack 352, win 65535, length 4122
00:14:35.942920 IP 151.101.117.164.443 > 10.0.2.15.44034: Flags [P.], seq 1098082:1099456, ack 352, win 65535, length 1374
00:14:35.942935 IP 10.0.2.15.44034 > 151.101.117.164.443: Flags [.], ack 1098082, win 65535, length 0
00:14:35.943107 IP 151.101.117.164.443 > 10.0.2.15.44034: Flags [P.], seq 1099456:1102204, ack 352, win 65535, length 2748
00:14:35.943161 IP 10.0.2.15.44034 > 151.101.117.164.443: Flags [.], ack 1102204, win 65535, length 0
00:14:35.943315 IP 151.101.117.164.443 > 10.0.2.15.44034: Flags [P.], seq 1102204:1104952, ack 352, win 65535, length 2748
00:14:35.943424 IP 10.0.2.15.44034 > 151.101.117.164.443: Flags [.], ack 1104952, win 65535, length 0
00:14:35.943638 IP 151.101.117.164.443 > 10.0.2.15.44034: Flags [P.], seq 1104952:1107700, ack 352, win 65535, length 2748
00:14:35.943642 IP 151.101.117.164.443 > 10.0.2.15.44034: Flags [P.], seq 1107700:1109074, ack 352, win 65535, length 1374
00:14:35.943813 IP 151.101.117.164.443 > 10.0.2.15.44034: Flags [P.], seq 1109074:1111822, ack 352, win 65535, length 2748
00:14:35.943903 IP 151.101.117.164.443 > 10.0.2.15.44034: Flags [P.], seq 1111822:1113196, ack 352, win 65535, length 1374
00:14:35.943984 IP 10.0.2.15.44034 > 151.101.117.164.443: Flags [.], ack 1113196, win 65535, length 0
00:14:35.944131 IP 151.101.117.164.443 > 10.0.2.15.44034: Flags [P.], seq 1113196:1115944, ack 352, win 65535, length 2748
00:14:35.944181 IP 10.0.2.15.44034 > 151.101.117.164.443: Flags [.], ack 1115944, win 65535, length 0
00:14:35.944363 IP 151.101.117.164.443 > 10.0.2.15.44034: Flags [P.], seq 1115944:1118692, ack 352, win 65535, length 2748
00:14:35.944412 IP 10.0.2.15.44034 > 151.101.117.164.443: Flags [.], ack 1118692, win 65535, length 0
00:14:35.944660 IP 151.101.117.164.443 > 10.0.2.15.44034: Flags [P.], seq 1118692:1121440, ack 352, win 65535, length 2748
00:14:35.944684 IP 10.0.2.15.44034 > 151.101.117.164.443: Flags [.], ack 1121440, win 65535, length 0
00:14:35.945255 IP 151.101.117.164.443 > 10.0.2.15.44034: Flags [P.], seq 1121440:1124188, ack 352, win 65535, length 2748
00:14:35.945310 IP 10.0.2.15.44034 > 151.101.117.164.443: Flags [.], ack 1124188, win 65535, length 0
00:14:35.945425 IP 151.101.117.164.443 > 10.0.2.15.44034: Flags [P.], seq 1124188:1128310, ack 352, win 65535, length 4122
00:14:35.945625 IP 151.101.117.164.443 > 10.0.2.15.44034: Flags [P.], seq 1128310:1129684, ack 352, win 65535, length 1374
00:14:35.945685 IP 10.0.2.15.44034 > 151.101.117.164.443: Flags [.], ack 1129684, win 65535, length 0
00:14:35.948430 IP 151.101.117.164.443 > 10.0.2.15.44034: Flags [P.], seq 1129684:1136554, ack 352, win 65535, length 6870
00:14:35.948433 IP 151.101.117.164.443 > 10.0.2.15.44034: Flags [P.], seq 1136554:1140676, ack 352, win 65535, length 4122
00:14:35.948459 IP 10.0.2.15.44034 > 151.101.117.164.443: Flags [.], ack 1136554, win 65535, length 0
00:14:35.948561 IP 151.101.117.164.443 > 10.0.2.15.44034: Flags [P.], seq 1140676:1143424, ack 352, win 65535, length 2748
00:14:35.948648 IP 10.0.2.15.44034 > 151.101.117.164.443: Flags [.], ack 1143424, win 65535, length 0
00:14:35.948818 IP 151.101.117.164.443 > 10.0.2.15.44034: Flags [P.], seq 1143424:1144798, ack 352, win 65535, length 1374
00:14:35.950291 IP 151.101.117.164.443 > 10.0.2.15.44034: Flags [P.], seq 1144798:1151668, ack 352, win 65535, length 6870
00:14:35.950311 IP 10.0.2.15.44034 > 151.101.117.164.443: Flags [.], ack 1151668, win 65535, length 0
00:14:35.950761 IP 151.101.117.164.443 > 10.0.2.15.44034: Flags [P.], seq 1151668:1153042, ack 352, win 65535, length 1374
00:14:35.950764 IP 151.101.117.164.443 > 10.0.2.15.44034: Flags [P.], seq 1153042:1155790, ack 352, win 65535, length 2748
00:14:35.950765 IP 151.101.117.164.443 > 10.0.2.15.44034: Flags [P.], seq 1155790:1158538, ack 352, win 65535, length 2748
00:14:35.950786 IP 10.0.2.15.44034 > 151.101.117.164.443: Flags [.], ack 1155790, win 65535, length 0
00:14:35.950928 IP 151.101.117.164.443 > 10.0.2.15.44034: Flags [P.], seq 1158538:1161286, ack 352, win 65535, length 2748
00:14:35.951091 IP 151.101.117.164.443 > 10.0.2.15.44034: Flags [P.], seq 1161286:1162660, ack 352, win 65535, length 1374
00:14:35.951113 IP 10.0.2.15.44034 > 151.101.117.164.443: Flags [.], ack 1162660, win 65535, length 0
00:14:35.951231 IP 151.101.117.164.443 > 10.0.2.15.44034: Flags [P.], seq 1162660:1164034, ack 352, win 65535, length 1374
00:14:35.952543 IP 151.101.117.164.443 > 10.0.2.15.44034: Flags [P.], seq 1164034:1168156, ack 352, win 65535, length 4122
00:14:35.952545 IP 151.101.117.164.443 > 10.0.2.15.44034: Flags [P.], seq 1168156:1170904, ack 352, win 65535, length 2748
00:14:35.952564 IP 10.0.2.15.44034 > 151.101.117.164.443: Flags [.], ack 1168156, win 65535, length 0
00:14:35.953083 IP 151.101.117.164.443 > 10.0.2.15.44034: Flags [P.], seq 1170904:1175026, ack 352, win 65535, length 4122
00:14:35.953086 IP 151.101.117.164.443 > 10.0.2.15.44034: Flags [P.], seq 1175026:1179148, ack 352, win 65535, length 4122
00:14:35.953210 IP 10.0.2.15.44034 > 151.101.117.164.443: Flags [.], ack 1179148, win 65535, length 0
00:14:35.953555 IP 151.101.117.164.443 > 10.0.2.15.44034: Flags [P.], seq 1179148:1181896, ack 352, win 65535, length 2748
00:14:35.953557 IP 151.101.117.164.443 > 10.0.2.15.44034: Flags [P.], seq 1181896:1184644, ack 352, win 65535, length 2748
00:14:35.953617 IP 10.0.2.15.44034 > 151.101.117.164.443: Flags [.], ack 1184644, win 65535, length 0
00:14:35.953842 IP 151.101.117.164.443 > 10.0.2.15.44034: Flags [P.], seq 1184644:1187392, ack 352, win 65535, length 2748
00:14:35.953852 IP 10.0.2.15.44034 > 151.101.117.164.443: Flags [.], ack 1187392, win 65535, length 0
00:14:35.954650 IP 151.101.117.164.443 > 10.0.2.15.44034: Flags [P.], seq 1187392:1190140, ack 352, win 65535, length 2748
00:14:35.954663 IP 10.0.2.15.44034 > 151.101.117.164.443: Flags [.], ack 1190140, win 65535, length 0
00:14:35.954900 IP 151.101.117.164.443 > 10.0.2.15.44034: Flags [P.], seq 1190140:1194262, ack 352, win 65535, length 4122
00:14:35.954902 IP 151.101.117.164.443 > 10.0.2.15.44034: Flags [P.], seq 1194262:1195636, ack 352, win 65535, length 1374
00:14:35.954954 IP 10.0.2.15.44034 > 151.101.117.164.443: Flags [.], ack 1195636, win 65535, length 0
00:14:35.955025 IP 151.101.117.164.443 > 10.0.2.15.44034: Flags [P.], seq 1195636:1197010, ack 352, win 65535, length 1374
00:14:35.955157 IP 151.101.117.164.443 > 10.0.2.15.44034: Flags [P.], seq 1197010:1199758, ack 352, win 65535, length 2748
00:14:35.955247 IP 151.101.117.164.443 > 10.0.2.15.44034: Flags [P.], seq 1199758:1201132, ack 352, win 65535, length 1374
00:14:35.955263 IP 10.0.2.15.44034 > 151.101.117.164.443: Flags [.], ack 1199758, win 65535, length 0
00:14:35.955383 IP 151.101.117.164.443 > 10.0.2.15.44034: Flags [P.], seq 1201132:1203880, ack 352, win 65535, length 2748
00:14:35.955594 IP 10.0.2.15.44034 > 151.101.117.164.443: Flags [.], ack 1203880, win 65535, length 0
00:14:35.955704 IP 151.101.117.164.443 > 10.0.2.15.44034: Flags [P.], seq 1203880:1205254, ack 352, win 65535, length 1374
00:14:35.956265 IP 151.101.117.164.443 > 10.0.2.15.44034: Flags [P.], seq 1205254:1209376, ack 352, win 65535, length 4122
00:14:35.956267 IP 151.101.117.164.443 > 10.0.2.15.44034: Flags [P.], seq 1209376:1210750, ack 352, win 65535, length 1374
00:14:35.956308 IP 10.0.2.15.44034 > 151.101.117.164.443: Flags [.], ack 1210750, win 65535, length 0
00:14:35.960119 IP 151.101.117.164.443 > 10.0.2.15.44034: Flags [P.], seq 1210750:1220368, ack 352, win 65535, length 9618
00:14:35.960123 IP 151.101.117.164.443 > 10.0.2.15.44034: Flags [P.], seq 1220368:1227238, ack 352, win 65535, length 6870

