19:59:03.292202 IP 10.0.2.15.46032 > 140.233.253.2.53: 13648+ A? www.nytimes.com. (33)
19:59:03.292258 IP 10.0.2.15.46032 > 140.233.253.2.53: 64852+ AAAA? www.nytimes.com. (33)
19:59:03.298335 IP 140.233.253.2.53 > 10.0.2.15.46032: 13648 3/0/0 CNAME www.prd.map.nytimes.com., CNAME nytimes.map.fastly.net., A 151.101.117.164 (111)
19:59:03.298523 IP 140.233.253.2.53 > 10.0.2.15.46032: 64852 2/1/0 CNAME www.prd.map.nytimes.com., CNAME nytimes.map.fastly.net. (153)
19:59:03.298737 IP 10.0.2.15.44150 > 151.101.117.164.443: Flags [S], seq 4260471006, win 64240, options [mss 1460,sackOK,TS val 917746381 ecr 0,nop,wscale 6], length 0
19:59:03.322107 IP 151.101.117.164.443 > 10.0.2.15.44150: Flags [S.], seq 212480001, ack 4260471007, win 65535, options [mss 1460], length 0
19:59:03.322157 IP 10.0.2.15.44150 > 151.101.117.164.443: Flags [.], ack 1, win 64240, length 0
19:59:03.338571 IP 10.0.2.15.44150 > 151.101.117.164.443: Flags [P.], seq 1:518, ack 1, win 64240, length 517
19:59:03.338911 IP 151.101.117.164.443 > 10.0.2.15.44150: Flags [.], ack 518, win 65535, length 0
19:59:03.357372 IP 151.101.117.164.443 > 10.0.2.15.44150: Flags [.], seq 1:2921, ack 518, win 65535, length 2920
19:59:03.357390 IP 10.0.2.15.44150 > 151.101.117.164.443: Flags [.], ack 2921, win 62780, length 0
19:59:03.357520 IP 151.101.117.164.443 > 10.0.2.15.44150: Flags [P.], seq 2921:5497, ack 518, win 65535, length 2576
19:59:03.357535 IP 10.0.2.15.44150 > 151.101.117.164.443: Flags [.], ack 5497, win 61320, length 0
19:59:03.358260 IP 151.101.117.164.443 > 10.0.2.15.44150: Flags [P.], seq 5497:5607, ack 518, win 65535, length 110
19:59:03.358275 IP 10.0.2.15.44150 > 151.101.117.164.443: Flags [.], ack 5607, win 61210, length 0
19:59:03.359077 IP 10.0.2.15.44150 > 151.101.117.164.443: Flags [P.], seq 518:611, ack 5607, win 62780, length 93
19:59:03.359308 IP 151.101.117.164.443 > 10.0.2.15.44150: Flags [.], ack 611, win 65535, length 0
19:59:03.372711 IP 151.101.117.164.443 > 10.0.2.15.44150: Flags [P.], seq 5607:5658, ack 611, win 65535, length 51
19:59:03.372733 IP 10.0.2.15.44150 > 151.101.117.164.443: Flags [.], ack 5658, win 62780, length 0
19:59:03.373421 IP 10.0.2.15.44150 > 151.101.117.164.443: Flags [P.], seq 611:664, ack 5658, win 62780, length 53
19:59:03.373580 IP 10.0.2.15.44150 > 151.101.117.164.443: Flags [P.], seq 664:720, ack 5658, win 62780, length 56
19:59:03.373700 IP 10.0.2.15.44150 > 151.101.117.164.443: Flags [P.], seq 720:762, ack 5658, win 62780, length 42
19:59:03.373829 IP 10.0.2.15.44150 > 151.101.117.164.443: Flags [P.], seq 762:831, ack 5658, win 62780, length 69
19:59:03.374663 IP 151.101.117.164.443 > 10.0.2.15.44150: Flags [.], ack 664, win 65535, length 0
19:59:03.374665 IP 151.101.117.164.443 > 10.0.2.15.44150: Flags [.], ack 720, win 65535, length 0
19:59:03.374665 IP 151.101.117.164.443 > 10.0.2.15.44150: Flags [.], ack 762, win 65535, length 0
19:59:03.374666 IP 151.101.117.164.443 > 10.0.2.15.44150: Flags [.], ack 831, win 65535, length 0
19:59:03.394908 IP 151.101.117.164.443 > 10.0.2.15.44150: Flags [P.], seq 5658:5753, ack 831, win 65535, length 95
19:59:03.395601 IP 10.0.2.15.44150 > 151.101.117.164.443: Flags [.], ack 5753, win 62780, length 0
19:59:03.396084 IP 10.0.2.15.44150 > 151.101.117.164.443: Flags [P.], seq 831:869, ack 5753, win 62780, length 38
19:59:03.396360 IP 151.101.117.164.443 > 10.0.2.15.44150: Flags [.], ack 869, win 65535, length 0
19:59:04.564977 IP 151.101.117.164.443 > 10.0.2.15.44150: Flags [P.], seq 5753:15371, ack 869, win 65535, length 9618
19:59:04.565717 IP 10.0.2.15.44150 > 151.101.117.164.443: Flags [.], ack 15371, win 58400, length 0
19:59:04.566343 IP 151.101.117.164.443 > 10.0.2.15.44150: Flags [.], seq 15371:27051, ack 869, win 65535, length 11680
19:59:04.566996 IP 10.0.2.15.44150 > 151.101.117.164.443: Flags [.], ack 27051, win 49640, length 0
19:59:04.567243 IP 151.101.117.164.443 > 10.0.2.15.44150: Flags [.], seq 27051:34351, ack 869, win 65535, length 7300
19:59:04.567305 IP 10.0.2.15.44150 > 151.101.117.164.443: Flags [.], ack 34351, win 45260, length 0
19:59:04.567447 IP 151.101.117.164.443 > 10.0.2.15.44150: Flags [.], seq 34351:43111, ack 869, win 65535, length 8760
19:59:04.567477 IP 10.0.2.15.44150 > 151.101.117.164.443: Flags [.], ack 43111, win 39420, length 0
19:59:04.567608 IP 151.101.117.164.443 > 10.0.2.15.44150: Flags [P.], seq 43111:48347, ack 869, win 65535, length 5236
19:59:04.567629 IP 10.0.2.15.44150 > 151.101.117.164.443: Flags [.], ack 48347, win 46720, length 0
19:59:04.577653 IP 151.101.117.164.443 > 10.0.2.15.44150: Flags [P.], seq 48347:51095, ack 869, win 65535, length 2748
19:59:04.577676 IP 10.0.2.15.44150 > 151.101.117.164.443: Flags [.], ack 51095, win 62780, length 0
19:59:04.578587 IP 151.101.117.164.443 > 10.0.2.15.44150: Flags [P.], seq 51095:52469, ack 869, win 65535, length 1374
19:59:04.579813 IP 151.101.117.164.443 > 10.0.2.15.44150: Flags [P.], seq 52469:56591, ack 869, win 65535, length 4122
19:59:04.579911 IP 10.0.2.15.44150 > 151.101.117.164.443: Flags [.], ack 56591, win 61320, length 0
19:59:04.580545 IP 151.101.117.164.443 > 10.0.2.15.44150: Flags [P.], seq 56591:57965, ack 869, win 65535, length 1374
19:59:04.581996 IP 151.101.117.164.443 > 10.0.2.15.44150: Flags [P.], seq 57965:62087, ack 869, win 65535, length 4122
19:59:04.582019 IP 10.0.2.15.44150 > 151.101.117.164.443: Flags [.], ack 62087, win 61320, length 0
19:59:04.583794 IP 151.101.117.164.443 > 10.0.2.15.44150: Flags [P.], seq 62087:63461, ack 869, win 65535, length 1374
19:59:04.586176 IP 151.101.117.164.443 > 10.0.2.15.44150: Flags [P.], seq 63461:64835, ack 869, win 65535, length 1374
19:59:04.586195 IP 10.0.2.15.44150 > 151.101.117.164.443: Flags [.], ack 64835, win 63204, length 0
19:59:04.586981 IP 151.101.117.164.443 > 10.0.2.15.44150: Flags [P.], seq 64835:67583, ack 869, win 65535, length 2748
19:59:04.587006 IP 10.0.2.15.44150 > 151.101.117.164.443: Flags [.], ack 67583, win 63204, length 0
19:59:04.590875 IP 151.101.117.164.443 > 10.0.2.15.44150: Flags [P.], seq 67583:70331, ack 869, win 65535, length 2748
19:59:04.591265 IP 10.0.2.15.44150 > 151.101.117.164.443: Flags [.], ack 70331, win 65535, length 0
19:59:04.591451 IP 151.101.117.164.443 > 10.0.2.15.44150: Flags [P.], seq 70331:71705, ack 869, win 65535, length 1374
19:59:04.594279 IP 151.101.117.164.443 > 10.0.2.15.44150: Flags [P.], seq 71705:73079, ack 869, win 65535, length 1374
19:59:04.594302 IP 10.0.2.15.44150 > 151.101.117.164.443: Flags [.], ack 73079, win 65535, length 0
19:59:04.594655 IP 151.101.117.164.443 > 10.0.2.15.44150: Flags [P.], seq 73079:74453, ack 869, win 65535, length 1374
19:59:04.603456 IP 151.101.117.164.443 > 10.0.2.15.44150: Flags [P.], seq 74453:75827, ack 869, win 65535, length 1374
19:59:04.603459 IP 151.101.117.164.443 > 10.0.2.15.44150: Flags [P.], seq 75827:81323, ack 869, win 65535, length 5496
19:59:04.603482 IP 10.0.2.15.44150 > 151.101.117.164.443: Flags [.], ack 75827, win 65535, length 0
19:59:04.604272 IP 10.0.2.15.44150 > 151.101.117.164.443: Flags [.], ack 81323, win 65535, length 0
19:59:04.649344 IP 151.101.117.164.443 > 10.0.2.15.44150: Flags [P.], seq 81323:86819, ack 869, win 65535, length 5496
19:59:04.649356 IP 151.101.117.164.443 > 10.0.2.15.44150: Flags [.], seq 86819:111639, ack 869, win 65535, length 24820
19:59:04.649393 IP 10.0.2.15.44150 > 151.101.117.164.443: Flags [.], ack 86819, win 65535, length 0
19:59:04.649599 IP 10.0.2.15.44150 > 151.101.117.164.443: Flags [.], ack 111639, win 65535, length 0
19:59:04.656201 IP 151.101.117.164.443 > 10.0.2.15.44150: Flags [P.], seq 111639:137919, ack 869, win 65535, length 26280
19:59:04.656225 IP 10.0.2.15.44150 > 151.101.117.164.443: Flags [.], ack 137919, win 65535, length 0
19:59:04.656604 IP 151.101.117.164.443 > 10.0.2.15.44150: Flags [.], seq 137919:145219, ack 869, win 65535, length 7300
19:59:04.656620 IP 10.0.2.15.44150 > 151.101.117.164.443: Flags [.], ack 145219, win 65535, length 0
19:59:04.659684 IP 151.101.117.164.443 > 10.0.2.15.44150: Flags [P.], seq 145219:177339, ack 869, win 65535, length 32120
19:59:04.659706 IP 10.0.2.15.44150 > 151.101.117.164.443: Flags [.], ack 177339, win 65535, length 0
19:59:04.659837 IP 151.101.117.164.443 > 10.0.2.15.44150: Flags [.], seq 177339:181719, ack 869, win 65535, length 4380
19:59:04.659849 IP 10.0.2.15.44150 > 151.101.117.164.443: Flags [.], ack 181719, win 65535, length 0
19:59:04.660996 IP 151.101.117.164.443 > 10.0.2.15.44150: Flags [.], seq 181719:193399, ack 869, win 65535, length 11680
19:59:04.661103 IP 10.0.2.15.44150 > 151.101.117.164.443: Flags [.], ack 193399, win 65535, length 0
19:59:04.664937 IP 151.101.117.164.443 > 10.0.2.15.44150: Flags [P.], seq 193399:210919, ack 869, win 65535, length 17520
19:59:04.664970 IP 10.0.2.15.44150 > 151.101.117.164.443: Flags [.], ack 210919, win 65535, length 0
19:59:04.666091 IP 151.101.117.164.443 > 10.0.2.15.44150: Flags [.], seq 210919:221139, ack 869, win 65535, length 10220
19:59:04.666117 IP 10.0.2.15.44150 > 151.101.117.164.443: Flags [.], ack 221139, win 65535, length 0
19:59:04.666631 IP 151.101.117.164.443 > 10.0.2.15.44150: Flags [.], seq 221139:224059, ack 869, win 65535, length 2920
19:59:04.666651 IP 10.0.2.15.44150 > 151.101.117.164.443: Flags [.], ack 224059, win 65535, length 0
19:59:04.667412 IP 151.101.117.164.443 > 10.0.2.15.44150: Flags [.], seq 224059:234279, ack 869, win 65535, length 10220
19:59:04.667432 IP 10.0.2.15.44150 > 151.101.117.164.443: Flags [.], ack 234279, win 65535, length 0
19:59:04.671780 IP 151.101.117.164.443 > 10.0.2.15.44150: Flags [P.], seq 234279:247419, ack 869, win 65535, length 13140
19:59:04.671930 IP 10.0.2.15.44150 > 151.101.117.164.443: Flags [.], ack 247419, win 65535, length 0
19:59:04.672786 IP 151.101.117.164.443 > 10.0.2.15.44150: Flags [.], seq 247419:280999, ack 869, win 65535, length 33580
19:59:04.672889 IP 10.0.2.15.44150 > 151.101.117.164.443: Flags [.], ack 280999, win 65535, length 0
19:59:04.674788 IP 151.101.117.164.443 > 10.0.2.15.44150: Flags [P.], seq 280999:289759, ack 869, win 65535, length 8760
19:59:04.674819 IP 10.0.2.15.44150 > 151.101.117.164.443: Flags [.], ack 289759, win 65535, length 0
19:59:04.675043 IP 151.101.117.164.443 > 10.0.2.15.44150: Flags [.], seq 289759:302899, ack 869, win 65535, length 13140
19:59:04.675064 IP 10.0.2.15.44150 > 151.101.117.164.443: Flags [.], ack 302899, win 65535, length 0
19:59:04.675542 IP 151.101.117.164.443 > 10.0.2.15.44150: Flags [.], seq 302899:323339, ack 869, win 65535, length 20440
19:59:04.675565 IP 10.0.2.15.44150 > 151.101.117.164.443: Flags [.], ack 323339, win 65535, length 0
19:59:04.675765 IP 151.101.117.164.443 > 10.0.2.15.44150: Flags [P.], seq 323339:346699, ack 869, win 65535, length 23360
19:59:04.675833 IP 10.0.2.15.44150 > 151.101.117.164.443: Flags [.], ack 346699, win 65535, length 0
19:59:04.675871 IP 151.101.117.164.443 > 10.0.2.15.44150: Flags [P.], seq 346699:356123, ack 869, win 65535, length 9424
19:59:04.675880 IP 10.0.2.15.44150 > 151.101.117.164.443: Flags [.], ack 356123, win 65535, length 0
19:59:04.695281 IP 151.101.117.164.443 > 10.0.2.15.44150: Flags [P.], seq 356123:391847, ack 869, win 65535, length 35724
19:59:04.695358 IP 10.0.2.15.44150 > 151.101.117.164.443: Flags [.], ack 391847, win 65535, length 0
19:59:04.696287 IP 151.101.117.164.443 > 10.0.2.15.44150: Flags [.], seq 391847:450247, ack 869, win 65535, length 58400
19:59:04.696350 IP 10.0.2.15.44150 > 151.101.117.164.443: Flags [.], ack 450247, win 65535, length 0
19:59:04.696720 IP 151.101.117.164.443 > 10.0.2.15.44150: Flags [P.], seq 450247:457547, ack 869, win 65535, length 7300
19:59:04.696734 IP 10.0.2.15.44150 > 151.101.117.164.443: Flags [.], ack 457547, win 65535, length 0
19:59:04.697348 IP 151.101.117.164.443 > 10.0.2.15.44150: Flags [.], seq 457547:476527, ack 869, win 65535, length 18980
19:59:04.697367 IP 10.0.2.15.44150 > 151.101.117.164.443: Flags [.], ack 476527, win 65535, length 0
19:59:04.697906 IP 151.101.117.164.443 > 10.0.2.15.44150: Flags [P.], seq 476527:493523, ack 869, win 65535, length 16996
19:59:04.697930 IP 10.0.2.15.44150 > 151.101.117.164.443: Flags [.], ack 493523, win 65535, length 0
19:59:04.697976 IP 151.101.117.164.443 > 10.0.2.15.44150: Flags [P.], seq 493523:499019, ack 869, win 65535, length 5496
19:59:04.697984 IP 10.0.2.15.44150 > 151.101.117.164.443: Flags [.], ack 499019, win 65535, length 0
19:59:04.700830 IP 151.101.117.164.443 > 10.0.2.15.44150: Flags [P.], seq 499019:500393, ack 869, win 65535, length 1374
19:59:04.701581 IP 151.101.117.164.443 > 10.0.2.15.44150: Flags [P.], seq 500393:512759, ack 869, win 65535, length 12366
19:59:04.701616 IP 151.101.117.164.443 > 10.0.2.15.44150: Flags [P.], seq 512759:519629, ack 869, win 65535, length 6870
19:59:04.702117 IP 10.0.2.15.44150 > 151.101.117.164.443: Flags [.], ack 519629, win 65535, length 0
19:59:04.706171 IP 151.101.117.164.443 > 10.0.2.15.44150: Flags [P.], seq 519629:526499, ack 869, win 65535, length 6870
19:59:04.706174 IP 151.101.117.164.443 > 10.0.2.15.44150: Flags [P.], seq 526499:530621, ack 869, win 65535, length 4122
19:59:04.706249 IP 151.101.117.164.443 > 10.0.2.15.44150: Flags [P.], seq 530621:536117, ack 869, win 65535, length 5496
19:59:04.706251 IP 151.101.117.164.443 > 10.0.2.15.44150: Flags [P.], seq 536117:542987, ack 869, win 65535, length 6870
19:59:04.706262 IP 151.101.117.164.443 > 10.0.2.15.44150: Flags [P.], seq 542987:544361, ack 869, win 65535, length 1374
19:59:04.706415 IP 10.0.2.15.44150 > 151.101.117.164.443: Flags [.], ack 544361, win 65535, length 0
19:59:04.708526 IP 151.101.117.164.443 > 10.0.2.15.44150: Flags [P.], seq 544361:551231, ack 869, win 65535, length 6870
19:59:04.708547 IP 10.0.2.15.44150 > 151.101.117.164.443: Flags [.], ack 551231, win 65535, length 0
19:59:04.709584 IP 151.101.117.164.443 > 10.0.2.15.44150: Flags [.], seq 551231:552691, ack 869, win 65535, length 1460
19:59:04.709913 IP 151.101.117.164.443 > 10.0.2.15.44150: Flags [P.], seq 552691:556727, ack 869, win 65535, length 4036
19:59:04.709933 IP 10.0.2.15.44150 > 151.101.117.164.443: Flags [.], ack 556727, win 65535, length 0
19:59:04.710964 IP 151.101.117.164.443 > 10.0.2.15.44150: Flags [P.], seq 556727:569093, ack 869, win 65535, length 12366
19:59:04.710988 IP 10.0.2.15.44150 > 151.101.117.164.443: Flags [.], ack 569093, win 65535, length 0
19:59:04.711160 IP 151.101.117.164.443 > 10.0.2.15.44150: Flags [P.], seq 569093:570467, ack 869, win 65535, length 1374
19:59:04.712838 IP 151.101.117.164.443 > 10.0.2.15.44150: Flags [P.], seq 570467:577337, ack 869, win 65535, length 6870
19:59:04.712861 IP 10.0.2.15.44150 > 151.101.117.164.443: Flags [.], ack 577337, win 65535, length 0
19:59:04.713305 IP 151.101.117.164.443 > 10.0.2.15.44150: Flags [P.], seq 577337:584207, ack 869, win 65535, length 6870
19:59:04.713323 IP 10.0.2.15.44150 > 151.101.117.164.443: Flags [.], ack 584207, win 65535, length 0
19:59:04.713872 IP 151.101.117.164.443 > 10.0.2.15.44150: Flags [P.], seq 584207:591077, ack 869, win 65535, length 6870
19:59:04.713891 IP 10.0.2.15.44150 > 151.101.117.164.443: Flags [.], ack 591077, win 65535, length 0
19:59:04.715664 IP 151.101.117.164.443 > 10.0.2.15.44150: Flags [P.], seq 591077:600695, ack 869, win 65535, length 9618
19:59:04.715692 IP 10.0.2.15.44150 > 151.101.117.164.443: Flags [.], ack 600695, win 65535, length 0
19:59:04.718904 IP 151.101.117.164.443 > 10.0.2.15.44150: Flags [P.], seq 600695:611687, ack 869, win 65535, length 10992
19:59:04.718930 IP 10.0.2.15.44150 > 151.101.117.164.443: Flags [.], ack 611687, win 65535, length 0
19:59:04.721108 IP 151.101.117.164.443 > 10.0.2.15.44150: Flags [P.], seq 611687:618557, ack 869, win 65535, length 6870
19:59:04.721111 IP 151.101.117.164.443 > 10.0.2.15.44150: Flags [P.], seq 618557:621305, ack 869, win 65535, length 2748
19:59:04.721113 IP 151.101.117.164.443 > 10.0.2.15.44150: Flags [P.], seq 621305:629549, ack 869, win 65535, length 8244
19:59:04.721194 IP 10.0.2.15.44150 > 151.101.117.164.443: Flags [.], ack 618557, win 65535, length 0
19:59:04.721273 IP 10.0.2.15.44150 > 151.101.117.164.443: Flags [.], ack 621305, win 65535, length 0
19:59:04.721290 IP 10.0.2.15.44150 > 151.101.117.164.443: Flags [.], ack 629549, win 65535, length 0
19:59:04.721441 IP 151.101.117.164.443 > 10.0.2.15.44150: Flags [P.], seq 629549:639167, ack 869, win 65535, length 9618
19:59:04.721443 IP 151.101.117.164.443 > 10.0.2.15.44150: Flags [P.], seq 639167:643289, ack 869, win 65535, length 4122
19:59:04.721456 IP 10.0.2.15.44150 > 151.101.117.164.443: Flags [.], ack 639167, win 65535, length 0
19:59:04.721477 IP 10.0.2.15.44150 > 151.101.117.164.443: Flags [.], ack 643289, win 65535, length 0
19:59:04.724864 IP 151.101.117.164.443 > 10.0.2.15.44150: Flags [P.], seq 643289:658403, ack 869, win 65535, length 15114
19:59:04.724886 IP 10.0.2.15.44150 > 151.101.117.164.443: Flags [.], ack 658403, win 65535, length 0
19:59:04.724941 IP 151.101.117.164.443 > 10.0.2.15.44150: Flags [P.], seq 658403:665273, ack 869, win 65535, length 6870
19:59:04.724948 IP 10.0.2.15.44150 > 151.101.117.164.443: Flags [.], ack 665273, win 65535, length 0
19:59:04.726896 IP 151.101.117.164.443 > 10.0.2.15.44150: Flags [P.], seq 665273:672143, ack 869, win 65535, length 6870
19:59:04.726921 IP 10.0.2.15.44150 > 151.101.117.164.443: Flags [.], ack 672143, win 65535, length 0
19:59:04.727955 IP 151.101.117.164.443 > 10.0.2.15.44150: Flags [P.], seq 672143:679013, ack 869, win 65535, length 6870
19:59:04.727957 IP 151.101.117.164.443 > 10.0.2.15.44150: Flags [P.], seq 679013:681761, ack 869, win 65535, length 2748
19:59:04.728016 IP 10.0.2.15.44150 > 151.101.117.164.443: Flags [.], ack 679013, win 65535, length 0
19:59:04.728046 IP 10.0.2.15.44150 > 151.101.117.164.443: Flags [.], ack 681761, win 65535, length 0
19:59:04.728235 IP 151.101.117.164.443 > 10.0.2.15.44150: Flags [P.], seq 681761:685883, ack 869, win 65535, length 4122
19:59:04.728255 IP 10.0.2.15.44150 > 151.101.117.164.443: Flags [.], ack 685883, win 65535, length 0
19:59:04.728360 IP 151.101.117.164.443 > 10.0.2.15.44150: Flags [P.], seq 685883:687257, ack 869, win 65535, length 1374
19:59:04.729865 IP 151.101.117.164.443 > 10.0.2.15.44150: Flags [P.], seq 687257:694127, ack 869, win 65535, length 6870
19:59:04.729867 IP 151.101.117.164.443 > 10.0.2.15.44150: Flags [P.], seq 694127:696875, ack 869, win 65535, length 2748
19:59:04.729867 IP 151.101.117.164.443 > 10.0.2.15.44150: Flags [P.], seq 696875:699623, ack 869, win 65535, length 2748
19:59:04.729937 IP 10.0.2.15.44150 > 151.101.117.164.443: Flags [.], ack 694127, win 65535, length 0
19:59:04.729974 IP 10.0.2.15.44150 > 151.101.117.164.443: Flags [.], ack 696875, win 65535, length 0
19:59:04.729988 IP 10.0.2.15.44150 > 151.101.117.164.443: Flags [.], ack 699623, win 65535, length 0
19:59:04.730010 IP 151.101.117.164.443 > 10.0.2.15.44150: Flags [P.], seq 699623:700997, ack 869, win 65535, length 1374
19:59:04.730559 IP 151.101.117.164.443 > 10.0.2.15.44150: Flags [P.], seq 700997:707867, ack 869, win 65535, length 6870
19:59:04.730571 IP 10.0.2.15.44150 > 151.101.117.164.443: Flags [.], ack 707867, win 65535, length 0
19:59:04.730808 IP 151.101.117.164.443 > 10.0.2.15.44150: Flags [P.], seq 707867:710615, ack 869, win 65535, length 2748
19:59:04.730818 IP 10.0.2.15.44150 > 151.101.117.164.443: Flags [.], ack 710615, win 65535, length 0
19:59:04.730979 IP 151.101.117.164.443 > 10.0.2.15.44150: Flags [P.], seq 710615:713363, ack 869, win 65535, length 2748
19:59:04.731010 IP 10.0.2.15.44150 > 151.101.117.164.443: Flags [.], ack 713363, win 65535, length 0
19:59:04.731902 IP 151.101.117.164.443 > 10.0.2.15.44150: Flags [P.], seq 713363:722981, ack 869, win 65535, length 9618
19:59:04.731924 IP 10.0.2.15.44150 > 151.101.117.164.443: Flags [.], ack 722981, win 65535, length 0
19:59:04.733483 IP 151.101.117.164.443 > 10.0.2.15.44150: Flags [P.], seq 722981:731225, ack 869, win 65535, length 8244
19:59:04.733534 IP 10.0.2.15.44150 > 151.101.117.164.443: Flags [.], ack 731225, win 65535, length 0
19:59:04.734005 IP 151.101.117.164.443 > 10.0.2.15.44150: Flags [P.], seq 731225:738095, ack 869, win 65535, length 6870
19:59:04.734019 IP 10.0.2.15.44150 > 151.101.117.164.443: Flags [.], ack 738095, win 65535, length 0
19:59:04.734106 IP 151.101.117.164.443 > 10.0.2.15.44150: Flags [P.], seq 738095:739469, ack 869, win 65535, length 1374
19:59:04.735653 IP 151.101.117.164.443 > 10.0.2.15.44150: Flags [P.], seq 739469:743591, ack 869, win 65535, length 4122
19:59:04.735656 IP 151.101.117.164.443 > 10.0.2.15.44150: Flags [P.], seq 743591:747713, ack 869, win 65535, length 4122
19:59:04.735679 IP 10.0.2.15.44150 > 151.101.117.164.443: Flags [.], ack 743591, win 65535, length 0
19:59:04.735714 IP 10.0.2.15.44150 > 151.101.117.164.443: Flags [.], ack 747713, win 65535, length 0
19:59:04.737242 IP 151.101.117.164.443 > 10.0.2.15.44150: Flags [P.], seq 747713:755957, ack 869, win 65535, length 8244
19:59:04.737263 IP 10.0.2.15.44150 > 151.101.117.164.443: Flags [.], ack 755957, win 65535, length 0
19:59:04.737730 IP 151.101.117.164.443 > 10.0.2.15.44150: Flags [P.], seq 755957:762827, ack 869, win 65535, length 6870
19:59:04.737732 IP 151.101.117.164.443 > 10.0.2.15.44150: Flags [P.], seq 762827:765575, ack 869, win 65535, length 2748
19:59:04.737747 IP 10.0.2.15.44150 > 151.101.117.164.443: Flags [.], ack 762827, win 65535, length 0
19:59:04.737764 IP 10.0.2.15.44150 > 151.101.117.164.443: Flags [.], ack 765575, win 65535, length 0
19:59:04.740486 IP 151.101.117.164.443 > 10.0.2.15.44150: Flags [P.], seq 765575:773819, ack 869, win 65535, length 8244
19:59:04.740507 IP 10.0.2.15.44150 > 151.101.117.164.443: Flags [.], ack 773819, win 65535, length 0
19:59:04.741536 IP 151.101.117.164.443 > 10.0.2.15.44150: Flags [P.], seq 773819:783437, ack 869, win 65535, length 9618
19:59:04.741556 IP 10.0.2.15.44150 > 151.101.117.164.443: Flags [.], ack 783437, win 65535, length 0
19:59:04.742899 IP 151.101.117.164.443 > 10.0.2.15.44150: Flags [.], seq 783437:784897, ack 869, win 65535, length 1460
19:59:04.743129 IP 151.101.117.164.443 > 10.0.2.15.44150: Flags [.], seq 784897:786357, ack 869, win 65535, length 1460
19:59:04.743145 IP 10.0.2.15.44150 > 151.101.117.164.443: Flags [.], ack 786357, win 65535, length 0
19:59:04.743801 IP 151.101.117.164.443 > 10.0.2.15.44150: Flags [P.], seq 786357:788933, ack 869, win 65535, length 2576
19:59:04.743976 IP 10.0.2.15.44150 > 151.101.117.164.443: Flags [.], ack 788933, win 65535, length 0
19:59:04.744116 IP 151.101.117.164.443 > 10.0.2.15.44150: Flags [P.], seq 788933:795803, ack 869, win 65535, length 6870
19:59:04.744128 IP 10.0.2.15.44150 > 151.101.117.164.443: Flags [.], ack 795803, win 65535, length 0
19:59:04.745189 IP 151.101.117.164.443 > 10.0.2.15.44150: Flags [P.], seq 795803:805421, ack 869, win 65535, length 9618
19:59:04.745210 IP 10.0.2.15.44150 > 151.101.117.164.443: Flags [.], ack 805421, win 65535, length 0
19:59:04.747032 IP 151.101.117.164.443 > 10.0.2.15.44150: Flags [P.], seq 805421:815039, ack 869, win 65535, length 9618
19:59:04.747053 IP 10.0.2.15.44150 > 151.101.117.164.443: Flags [.], ack 815039, win 65535, length 0
19:59:04.747341 IP 151.101.117.164.443 > 10.0.2.15.44150: Flags [P.], seq 815039:821909, ack 869, win 65535, length 6870
19:59:04.747343 IP 151.101.117.164.443 > 10.0.2.15.44150: Flags [P.], seq 821909:824657, ack 869, win 65535, length 2748
19:59:04.747356 IP 10.0.2.15.44150 > 151.101.117.164.443: Flags [.], ack 821909, win 65535, length 0
19:59:04.747372 IP 10.0.2.15.44150 > 151.101.117.164.443: Flags [.], ack 824657, win 65535, length 0
19:59:04.747962 IP 151.101.117.164.443 > 10.0.2.15.44150: Flags [P.], seq 824657:832901, ack 869, win 65535, length 8244
19:59:04.747964 IP 151.101.117.164.443 > 10.0.2.15.44150: Flags [P.], seq 832901:834275, ack 869, win 65535, length 1374
19:59:04.747979 IP 10.0.2.15.44150 > 151.101.117.164.443: Flags [.], ack 832901, win 65535, length 0
19:59:04.749160 IP 151.101.117.164.443 > 10.0.2.15.44150: Flags [P.], seq 834275:843893, ack 869, win 65535, length 9618
19:59:04.749180 IP 10.0.2.15.44150 > 151.101.117.164.443: Flags [.], ack 843893, win 65535, length 0
19:59:04.750513 IP 151.101.117.164.443 > 10.0.2.15.44150: Flags [P.], seq 843893:852137, ack 869, win 65535, length 8244
19:59:04.750540 IP 10.0.2.15.44150 > 151.101.117.164.443: Flags [.], ack 852137, win 65535, length 0
19:59:04.751516 IP 151.101.117.164.443 > 10.0.2.15.44150: Flags [P.], seq 852137:861755, ack 869, win 65535, length 9618
19:59:04.751536 IP 10.0.2.15.44150 > 151.101.117.164.443: Flags [.], ack 861755, win 65535, length 0
19:59:04.752367 IP 151.101.117.164.443 > 10.0.2.15.44150: Flags [P.], seq 861755:865877, ack 869, win 65535, length 4122
19:59:04.752368 IP 151.101.117.164.443 > 10.0.2.15.44150: Flags [P.], seq 865877:869999, ack 869, win 65535, length 4122
19:59:04.752383 IP 10.0.2.15.44150 > 151.101.117.164.443: Flags [.], ack 865877, win 65535, length 0
19:59:04.752404 IP 10.0.2.15.44150 > 151.101.117.164.443: Flags [.], ack 869999, win 65535, length 0
19:59:04.752473 IP 151.101.117.164.443 > 10.0.2.15.44150: Flags [P.], seq 869999:871373, ack 869, win 65535, length 1374
19:59:04.753783 IP 151.101.117.164.443 > 10.0.2.15.44150: Flags [P.], seq 871373:880991, ack 869, win 65535, length 9618
19:59:04.753804 IP 10.0.2.15.44150 > 151.101.117.164.443: Flags [.], ack 880991, win 65535, length 0
19:59:04.754608 IP 151.101.117.164.443 > 10.0.2.15.44150: Flags [P.], seq 880991:887861, ack 869, win 65535, length 6870
19:59:04.754622 IP 10.0.2.15.44150 > 151.101.117.164.443: Flags [.], ack 887861, win 65535, length 0
19:59:04.754822 IP 151.101.117.164.443 > 10.0.2.15.44150: Flags [P.], seq 887861:890609, ack 869, win 65535, length 2748
19:59:04.754830 IP 10.0.2.15.44150 > 151.101.117.164.443: Flags [.], ack 890609, win 65535, length 0
19:59:04.755801 IP 151.101.117.164.443 > 10.0.2.15.44150: Flags [P.], seq 890609:894731, ack 869, win 65535, length 4122
19:59:04.755816 IP 10.0.2.15.44150 > 151.101.117.164.443: Flags [.], ack 894731, win 65535, length 0
19:59:04.756861 IP 151.101.117.164.443 > 10.0.2.15.44150: Flags [P.], seq 894731:901601, ack 869, win 65535, length 6870
19:59:04.756875 IP 10.0.2.15.44150 > 151.101.117.164.443: Flags [.], ack 901601, win 65535, length 0
19:59:04.758060 IP 151.101.117.164.443 > 10.0.2.15.44150: Flags [P.], seq 901601:907097, ack 869, win 65535, length 5496
19:59:04.758115 IP 10.0.2.15.44150 > 151.101.117.164.443: Flags [.], ack 907097, win 65535, length 0
19:59:04.758245 IP 151.101.117.164.443 > 10.0.2.15.44150: Flags [P.], seq 907097:909845, ack 869, win 65535, length 2748
19:59:04.758253 IP 10.0.2.15.44150 > 151.101.117.164.443: Flags [.], ack 909845, win 65535, length 0
19:59:04.759259 IP 151.101.117.164.443 > 10.0.2.15.44150: Flags [P.], seq 909845:911219, ack 869, win 65535, length 1374
19:59:04.760718 IP 151.101.117.164.443 > 10.0.2.15.44150: Flags [P.], seq 911219:920837, ack 869, win 65535, length 9618
19:59:04.760739 IP 10.0.2.15.44150 > 151.101.117.164.443: Flags [.], ack 920837, win 65535, length 0
19:59:04.761015 IP 151.101.117.164.443 > 10.0.2.15.44150: Flags [P.], seq 920837:924959, ack 869, win 65535, length 4122
19:59:04.761026 IP 10.0.2.15.44150 > 151.101.117.164.443: Flags [.], ack 924959, win 65535, length 0
19:59:04.761129 IP 151.101.117.164.443 > 10.0.2.15.44150: Flags [P.], seq 924959:931829, ack 869, win 65535, length 6870
19:59:04.761137 IP 10.0.2.15.44150 > 151.101.117.164.443: Flags [.], ack 931829, win 65535, length 0
19:59:04.761425 IP 151.101.117.164.443 > 10.0.2.15.44150: Flags [P.], seq 931829:934577, ack 869, win 65535, length 2748
19:59:04.761438 IP 10.0.2.15.44150 > 151.101.117.164.443: Flags [.], ack 934577, win 65535, length 0
19:59:04.762738 IP 151.101.117.164.443 > 10.0.2.15.44150: Flags [P.], seq 934577:935951, ack 869, win 65535, length 1374
19:59:04.764462 IP 151.101.117.164.443 > 10.0.2.15.44150: Flags [P.], seq 935951:948317, ack 869, win 65535, length 12366
19:59:04.764489 IP 10.0.2.15.44150 > 151.101.117.164.443: Flags [.], ack 948317, win 65535, length 0
19:59:04.764608 IP 151.101.117.164.443 > 10.0.2.15.44150: Flags [P.], seq 948317:951065, ack 869, win 65535, length 2748
19:59:04.764626 IP 10.0.2.15.44150 > 151.101.117.164.443: Flags [.], ack 951065, win 65535, length 0
19:59:04.765516 IP 151.101.117.164.443 > 10.0.2.15.44150: Flags [P.], seq 951065:956561, ack 869, win 65535, length 5496
19:59:04.765520 IP 151.101.117.164.443 > 10.0.2.15.44150: Flags [P.], seq 956561:964805, ack 869, win 65535, length 8244
19:59:04.765722 IP 10.0.2.15.44150 > 151.101.117.164.443: Flags [.], ack 964805, win 65535, length 0
19:59:04.765882 IP 151.101.117.164.443 > 10.0.2.15.44150: Flags [P.], seq 964805:967553, ack 869, win 65535, length 2748
19:59:04.765932 IP 10.0.2.15.44150 > 151.101.117.164.443: Flags [.], ack 967553, win 65535, length 0
19:59:04.766225 IP 151.101.117.164.443 > 10.0.2.15.44150: Flags [P.], seq 967553:973049, ack 869, win 65535, length 5496
19:59:04.766235 IP 10.0.2.15.44150 > 151.101.117.164.443: Flags [.], ack 973049, win 65535, length 0
19:59:04.766322 IP 151.101.117.164.443 > 10.0.2.15.44150: Flags [P.], seq 973049:975797, ack 869, win 65535, length 2748
19:59:04.766359 IP 10.0.2.15.44150 > 151.101.117.164.443: Flags [.], ack 975797, win 65535, length 0
19:59:04.768916 IP 151.101.117.164.443 > 10.0.2.15.44150: Flags [P.], seq 975797:985415, ack 869, win 65535, length 9618
19:59:04.768920 IP 151.101.117.164.443 > 10.0.2.15.44150: Flags [P.], seq 985415:990911, ack 869, win 65535, length 5496
19:59:04.768974 IP 151.101.117.164.443 > 10.0.2.15.44150: Flags [P.], seq 990911:996407, ack 869, win 65535, length 5496
19:59:04.769062 IP 10.0.2.15.44150 > 151.101.117.164.443: Flags [.], ack 996407, win 65535, length 0
19:59:04.769220 IP 151.101.117.164.443 > 10.0.2.15.44150: Flags [P.], seq 996407:999155, ack 869, win 65535, length 2748
19:59:04.769594 IP 10.0.2.15.44150 > 151.101.117.164.443: Flags [.], ack 999155, win 65535, length 0
19:59:04.769975 IP 151.101.117.164.443 > 10.0.2.15.44150: Flags [P.], seq 999155:1006025, ack 869, win 65535, length 6870
19:59:04.770092 IP 151.101.117.164.443 > 10.0.2.15.44150: Flags [P.], seq 1006025:1008773, ack 869, win 65535, length 2748
19:59:04.770735 IP 10.0.2.15.44150 > 151.101.117.164.443: Flags [.], ack 1008773, win 65535, length 0
19:59:04.771030 IP 151.101.117.164.443 > 10.0.2.15.44150: Flags [P.], seq 1008773:1014269, ack 869, win 65535, length 5496
19:59:04.771070 IP 10.0.2.15.44150 > 151.101.117.164.443: Flags [.], ack 1014269, win 65535, length 0
19:59:04.771242 IP 151.101.117.164.443 > 10.0.2.15.44150: Flags [P.], seq 1014269:1019765, ack 869, win 65535, length 5496
19:59:04.771249 IP 10.0.2.15.44150 > 151.101.117.164.443: Flags [.], ack 1019765, win 65535, length 0
19:59:04.775010 IP 151.101.117.164.443 > 10.0.2.15.44150: Flags [P.], seq 1019765:1029383, ack 869, win 65535, length 9618
19:59:04.775013 IP 151.101.117.164.443 > 10.0.2.15.44150: Flags [P.], seq 1029383:1036253, ack 869, win 65535, length 6870
19:59:04.775152 IP 10.0.2.15.44150 > 151.101.117.164.443: Flags [.], ack 1036253, win 65535, length 0
19:59:04.775370 IP 151.101.117.164.443 > 10.0.2.15.44150: Flags [P.], seq 1036253:1039001, ack 869, win 65535, length 2748
19:59:04.775384 IP 10.0.2.15.44150 > 151.101.117.164.443: Flags [.], ack 1039001, win 65535, length 0
19:59:04.776050 IP 151.101.117.164.443 > 10.0.2.15.44150: Flags [P.], seq 1039001:1045871, ack 869, win 65535, length 6870
19:59:04.776258 IP 10.0.2.15.44150 > 151.101.117.164.443: Flags [.], ack 1045871, win 65535, length 0
19:59:04.777210 IP 151.101.117.164.443 > 10.0.2.15.44150: Flags [P.], seq 1045871:1052741, ack 869, win 65535, length 6870
19:59:04.777213 IP 151.101.117.164.443 > 10.0.2.15.44150: Flags [P.], seq 1052741:1056863, ack 869, win 65535, length 4122
19:59:04.777230 IP 10.0.2.15.44150 > 151.101.117.164.443: Flags [.], ack 1052741, win 65535, length 0
19:59:04.777486 IP 10.0.2.15.44150 > 151.101.117.164.443: Flags [.], ack 1056863, win 65535, length 0
19:59:04.778019 IP 151.101.117.164.443 > 10.0.2.15.44150: Flags [P.], seq 1056863:1062359, ack 869, win 65535, length 5496
19:59:04.778161 IP 151.101.117.164.443 > 10.0.2.15.44150: Flags [P.], seq 1062359:1065107, ack 869, win 65535, length 2748
19:59:04.778265 IP 10.0.2.15.44150 > 151.101.117.164.443: Flags [.], ack 1065107, win 65535, length 0
19:59:04.779249 IP 151.101.117.164.443 > 10.0.2.15.44150: Flags [P.], seq 1065107:1066481, ack 869, win 65535, length 1374
19:59:04.780152 IP 151.101.117.164.443 > 10.0.2.15.44150: Flags [P.], seq 1066481:1071977, ack 869, win 65535, length 5496
19:59:04.780173 IP 10.0.2.15.44150 > 151.101.117.164.443: Flags [.], ack 1071977, win 65535, length 0
19:59:04.780600 IP 151.101.117.164.443 > 10.0.2.15.44150: Flags [P.], seq 1071977:1074725, ack 869, win 65535, length 2748
19:59:04.780602 IP 151.101.117.164.443 > 10.0.2.15.44150: Flags [P.], seq 1074725:1077473, ack 869, win 65535, length 2748
19:59:04.780710 IP 10.0.2.15.44150 > 151.101.117.164.443: Flags [.], ack 1077473, win 65535, length 0
19:59:04.782093 IP 151.101.117.164.443 > 10.0.2.15.44150: Flags [P.], seq 1077473:1082969, ack 869, win 65535, length 5496
19:59:04.782117 IP 10.0.2.15.44150 > 151.101.117.164.443: Flags [.], ack 1082969, win 65535, length 0
19:59:04.782560 IP 151.101.117.164.443 > 10.0.2.15.44150: Flags [P.], seq 1082969:1089839, ack 869, win 65535, length 6870
19:59:04.782571 IP 10.0.2.15.44150 > 151.101.117.164.443: Flags [.], ack 1089839, win 65535, length 0
19:59:04.783298 IP 151.101.117.164.443 > 10.0.2.15.44150: Flags [P.], seq 1089839:1098083, ack 869, win 65535, length 8244
19:59:04.783300 IP 151.101.117.164.443 > 10.0.2.15.44150: Flags [P.], seq 1098083:1099457, ack 869, win 65535, length 1374
19:59:04.783449 IP 10.0.2.15.44150 > 151.101.117.164.443: Flags [.], ack 1099457, win 65535, length 0
19:59:04.783639 IP 151.101.117.164.443 > 10.0.2.15.44150: Flags [P.], seq 1099457:1100831, ack 869, win 65535, length 1374
19:59:04.784609 IP 151.101.117.164.443 > 10.0.2.15.44150: Flags [P.], seq 1100831:1111823, ack 869, win 65535, length 10992
19:59:04.784691 IP 10.0.2.15.44150 > 151.101.117.164.443: Flags [.], ack 1111823, win 65535, length 0
19:59:04.785698 IP 151.101.117.164.443 > 10.0.2.15.44150: Flags [P.], seq 1111823:1121441, ack 869, win 65535, length 9618
19:59:04.785700 IP 151.101.117.164.443 > 10.0.2.15.44150: Flags [P.], seq 1121441:1122815, ack 869, win 65535, length 1374
19:59:04.785722 IP 10.0.2.15.44150 > 151.101.117.164.443: Flags [.], ack 1121441, win 65535, length 0
19:59:04.786541 IP 151.101.117.164.443 > 10.0.2.15.44150: Flags [P.], seq 1122815:1129685, ack 869, win 65535, length 6870
19:59:04.786555 IP 10.0.2.15.44150 > 151.101.117.164.443: Flags [.], ack 1129685, win 65535, length 0
19:59:04.786868 IP 151.101.117.164.443 > 10.0.2.15.44150: Flags [P.], seq 1129685:1133807, ack 869, win 65535, length 4122
19:59:04.786870 IP 151.101.117.164.443 > 10.0.2.15.44150: Flags [P.], seq 1133807:1136555, ack 869, win 65535, length 2748
19:59:04.786883 IP 10.0.2.15.44150 > 151.101.117.164.443: Flags [.], ack 1133807, win 65535, length 0
19:59:04.787033 IP 10.0.2.15.44150 > 151.101.117.164.443: Flags [.], ack 1136555, win 65535, length 0
19:59:04.788317 IP 151.101.117.164.443 > 10.0.2.15.44150: Flags [P.], seq 1136555:1143425, ack 869, win 65535, length 6870
19:59:04.788496 IP 10.0.2.15.44150 > 151.101.117.164.443: Flags [.], ack 1143425, win 65535, length 0
19:59:04.788819 IP 151.101.117.164.443 > 10.0.2.15.44150: Flags [P.], seq 1143425:1150295, ack 869, win 65535, length 6870
19:59:04.788821 IP 151.101.117.164.443 > 10.0.2.15.44150: Flags [.], seq 1150295:1151755, ack 869, win 65535, length 1460
19:59:04.788835 IP 10.0.2.15.44150 > 151.101.117.164.443: Flags [.], ack 1150295, win 65535, length 0
19:59:04.789282 IP 151.101.117.164.443 > 10.0.2.15.44150: Flags [P.], seq 1151755:1153043, ack 869, win 65535, length 1288
19:59:04.789283 IP 151.101.117.164.443 > 10.0.2.15.44150: Flags [P.], seq 1153043:1154417, ack 869, win 65535, length 1374
19:59:04.789294 IP 10.0.2.15.44150 > 151.101.117.164.443: Flags [.], ack 1153043, win 65535, length 0
19:59:04.790403 IP 151.101.117.164.443 > 10.0.2.15.44150: Flags [P.], seq 1154417:1162661, ack 869, win 65535, length 8244
19:59:04.790480 IP 10.0.2.15.44150 > 151.101.117.164.443: Flags [.], ack 1162661, win 65535, length 0
19:59:04.790934 IP 151.101.117.164.443 > 10.0.2.15.44150: Flags [P.], seq 1162661:1172279, ack 869, win 65535, length 9618
19:59:04.790991 IP 10.0.2.15.44150 > 151.101.117.164.443: Flags [.], ack 1172279, win 65535, length 0
19:59:04.791139 IP 151.101.117.164.443 > 10.0.2.15.44150: Flags [P.], seq 1172279:1173653, ack 869, win 65535, length 1374
19:59:04.791140 IP 151.101.117.164.443 > 10.0.2.15.44150: Flags [P.], seq 1173653:1175027, ack 869, win 65535, length 1374
19:59:04.791154 IP 10.0.2.15.44150 > 151.101.117.164.443: Flags [.], ack 1175027, win 65535, length 0
19:59:04.793379 IP 151.101.117.164.443 > 10.0.2.15.44150: Flags [P.], seq 1175027:1186019, ack 869, win 65535, length 10992
19:59:04.793532 IP 151.101.117.164.443 > 10.0.2.15.44150: Flags [P.], seq 1186019:1191515, ack 869, win 65535, length 5496
19:59:04.793705 IP 151.101.117.164.443 > 10.0.2.15.44150: Flags [P.], seq 1191515:1194263, ack 869, win 65535, length 2748
19:59:04.793780 IP 10.0.2.15.44150 > 151.101.117.164.443: Flags [.], ack 1194263, win 65535, length 0
19:59:04.796221 IP 151.101.117.164.443 > 10.0.2.15.44150: Flags [P.], seq 1194263:1205255, ack 869, win 65535, length 10992
19:59:04.796240 IP 10.0.2.15.44150 > 151.101.117.164.443: Flags [.], ack 1205255, win 65535, length 0
19:59:04.796910 IP 151.101.117.164.443 > 10.0.2.15.44150: Flags [P.], seq 1205255:1212125, ack 869, win 65535, length 6870
19:59:04.797073 IP 151.101.117.164.443 > 10.0.2.15.44150: Flags [P.], seq 1212125:1214873, ack 869, win 65535, length 2748
19:59:04.797120 IP 10.0.2.15.44150 > 151.101.117.164.443: Flags [.], ack 1214873, win 65535, length 0
19:59:04.798295 IP 151.101.117.164.443 > 10.0.2.15.44150: Flags [P.], seq 1214873:1220369, ack 869, win 65535, length 5496
19:59:04.798299 IP 151.101.117.164.443 > 10.0.2.15.44150: Flags [P.], seq 1220369:1225865, ack 869, win 65535, length 5496
19:59:04.798464 IP 10.0.2.15.44150 > 151.101.117.164.443: Flags [.], ack 1225865, win 65535, length 0
19:59:04.799528 IP 151.101.117.164.443 > 10.0.2.15.44150: Flags [P.], seq 1225865:1234109, ack 869, win 65535, length 8244
19:59:04.799531 IP 151.101.117.164.443 > 10.0.2.15.44150: Flags [P.], seq 1234109:1236857, ack 869, win 65535, length 2748
19:59:04.799555 IP 10.0.2.15.44150 > 151.101.117.164.443: Flags [.], ack 1234109, win 65535, length 0
19:59:04.799725 IP 151.101.117.164.443 > 10.0.2.15.44150: Flags [P.], seq 1236857:1239605, ack 869, win 65535, length 2748
19:59:04.800328 IP 10.0.2.15.44150 > 151.101.117.164.443: Flags [.], ack 1239605, win 65535, length 0
19:59:04.801136 IP 151.101.117.164.443 > 10.0.2.15.44150: Flags [.], seq 1239605:1242525, ack 869, win 65535, length 2920
19:59:04.801326 IP 151.101.117.164.443 > 10.0.2.15.44150: Flags [.], seq 1242525:1248365, ack 869, win 65535, length 5840
19:59:04.802011 IP 151.101.117.164.443 > 10.0.2.15.44150: Flags [P.], seq 1248365:1260215, ack 869, win 65535, length 11850
19:59:04.802040 IP 151.101.117.164.443 > 10.0.2.15.44150: Flags [P.], seq 1260215:1269833, ack 869, win 65535, length 9618
19:59:04.802040 IP 151.101.117.164.443 > 10.0.2.15.44150: Flags [P.], seq 1269833:1271207, ack 869, win 65535, length 1374
19:59:04.802705 IP 10.0.2.15.44150 > 151.101.117.164.443: Flags [.], ack 1271207, win 65535, length 0
19:59:04.803192 IP 151.101.117.164.443 > 10.0.2.15.44150: Flags [P.], seq 1271207:1278077, ack 869, win 65535, length 6870
19:59:04.803205 IP 10.0.2.15.44150 > 151.101.117.164.443: Flags [.], ack 1278077, win 65535, length 0
19:59:04.803348 IP 151.101.117.164.443 > 10.0.2.15.44150: Flags [P.], seq 1278077:1279451, ack 869, win 65535, length 1374
19:59:04.804709 IP 151.101.117.164.443 > 10.0.2.15.44150: Flags [P.], seq 1279451:1289069, ack 869, win 65535, length 9618
19:59:04.804712 IP 151.101.117.164.443 > 10.0.2.15.44150: Flags [P.], seq 1289069:1291817, ack 869, win 65535, length 2748
19:59:04.804734 IP 10.0.2.15.44150 > 151.101.117.164.443: Flags [.], ack 1289069, win 65535, length 0
19:59:04.804965 IP 10.0.2.15.44150 > 151.101.117.164.443: Flags [.], ack 1291817, win 65535, length 0
19:59:04.805904 IP 151.101.117.164.443 > 10.0.2.15.44150: Flags [P.], seq 1291817:1297313, ack 869, win 65535, length 5496
19:59:04.805928 IP 10.0.2.15.44150 > 151.101.117.164.443: Flags [.], ack 1297313, win 65535, length 0
19:59:04.806456 IP 151.101.117.164.443 > 10.0.2.15.44150: Flags [P.], seq 1297313:1304183, ack 869, win 65535, length 6870
19:59:04.806458 IP 151.101.117.164.443 > 10.0.2.15.44150: Flags [P.], seq 1304183:1309679, ack 869, win 65535, length 5496
19:59:04.806475 IP 10.0.2.15.44150 > 151.101.117.164.443: Flags [.], ack 1304183, win 65535, length 0
19:59:04.806653 IP 151.101.117.164.443 > 10.0.2.15.44150: Flags [P.], seq 1309679:1312427, ack 869, win 65535, length 2748
19:59:04.806766 IP 151.101.117.164.443 > 10.0.2.15.44150: Flags [P.], seq 1312427:1313801, ack 869, win 65535, length 1374
19:59:04.807037 IP 10.0.2.15.44150 > 151.101.117.164.443: Flags [.], ack 1313801, win 65535, length 0
19:59:04.808997 IP 151.101.117.164.443 > 10.0.2.15.44150: Flags [P.], seq 1313801:1315175, ack 869, win 65535, length 1374
19:59:04.810369 IP 151.101.117.164.443 > 10.0.2.15.44150: Flags [P.], seq 1315175:1327541, ack 869, win 65535, length 12366
19:59:04.810392 IP 10.0.2.15.44150 > 151.101.117.164.443: Flags [.], ack 1327541, win 65535, length 0
19:59:04.811182 IP 151.101.117.164.443 > 10.0.2.15.44150: Flags [P.], seq 1327541:1334411, ack 869, win 65535, length 6870
19:59:04.811198 IP 10.0.2.15.44150 > 151.101.117.164.443: Flags [.], ack 1334411, win 65535, length 0
19:59:04.811394 IP 151.101.117.164.443 > 10.0.2.15.44150: Flags [P.], seq 1334411:1339907, ack 869, win 65535, length 5496
19:59:04.811437 IP 10.0.2.15.44150 > 151.101.117.164.443: Flags [.], ack 1339907, win 65535, length 0
19:59:04.811544 IP 151.101.117.164.443 > 10.0.2.15.44150: Flags [P.], seq 1339907:1342655, ack 869, win 65535, length 2748
19:59:04.811579 IP 10.0.2.15.44150 > 151.101.117.164.443: Flags [.], ack 1342655, win 65535, length 0
19:59:04.812922 IP 151.101.117.164.443 > 10.0.2.15.44150: Flags [P.], seq 1342655:1353647, ack 869, win 65535, length 10992
19:59:04.813018 IP 10.0.2.15.44150 > 151.101.117.164.443: Flags [.], ack 1353647, win 65535, length 0
19:59:04.813742 IP 151.101.117.164.443 > 10.0.2.15.44150: Flags [P.], seq 1353647:1361891, ack 869, win 65535, length 8244
19:59:04.813802 IP 10.0.2.15.44150 > 151.101.117.164.443: Flags [.], ack 1361891, win 65535, length 0
19:59:04.814909 IP 151.101.117.164.443 > 10.0.2.15.44150: Flags [P.], seq 1361891:1368761, ack 869, win 65535, length 6870
19:59:04.814926 IP 10.0.2.15.44150 > 151.101.117.164.443: Flags [.], ack 1368761, win 65535, length 0
19:59:04.815356 IP 151.101.117.164.443 > 10.0.2.15.44150: Flags [P.], seq 1368761:1375631, ack 869, win 65535, length 6870
19:59:04.815390 IP 10.0.2.15.44150 > 151.101.117.164.443: Flags [.], ack 1375631, win 65535, length 0
19:59:04.815690 IP 151.101.117.164.443 > 10.0.2.15.44150: Flags [P.], seq 1375631:1381127, ack 869, win 65535, length 5496
19:59:04.815755 IP 10.0.2.15.44150 > 151.101.117.164.443: Flags [.], ack 1381127, win 65535, length 0
19:59:04.817102 IP 151.101.117.164.443 > 10.0.2.15.44150: Flags [P.], seq 1381127:1390745, ack 869, win 65535, length 9618
19:59:04.817104 IP 151.101.117.164.443 > 10.0.2.15.44150: Flags [P.], seq 1390745:1393493, ack 869, win 65535, length 2748
19:59:04.817190 IP 10.0.2.15.44150 > 151.101.117.164.443: Flags [.], ack 1393493, win 65535, length 0
19:59:04.818403 IP 151.101.117.164.443 > 10.0.2.15.44150: Flags [P.], seq 1393493:1400363, ack 869, win 65535, length 6870
19:59:04.818406 IP 151.101.117.164.443 > 10.0.2.15.44150: Flags [P.], seq 1400363:1405859, ack 869, win 65535, length 5496
19:59:04.818427 IP 10.0.2.15.44150 > 151.101.117.164.443: Flags [.], ack 1400363, win 65535, length 0
19:59:04.818536 IP 10.0.2.15.44150 > 151.101.117.164.443: Flags [.], ack 1405859, win 65535, length 0
19:59:04.819244 IP 151.101.117.164.443 > 10.0.2.15.44150: Flags [P.], seq 1405859:1412729, ack 869, win 65535, length 6870
19:59:04.819261 IP 10.0.2.15.44150 > 151.101.117.164.443: Flags [.], ack 1412729, win 65535, length 0
19:59:04.819532 IP 151.101.117.164.443 > 10.0.2.15.44150: Flags [P.], seq 1412729:1415477, ack 869, win 65535, length 2748
19:59:04.819534 IP 151.101.117.164.443 > 10.0.2.15.44150: Flags [P.], seq 1415477:1418225, ack 869, win 65535, length 2748
19:59:04.819601 IP 10.0.2.15.44150 > 151.101.117.164.443: Flags [.], ack 1418225, win 65535, length 0
19:59:04.820823 IP 151.101.117.164.443 > 10.0.2.15.44150: Flags [P.], seq 1418225:1426469, ack 869, win 65535, length 8244
19:59:04.820826 IP 151.101.117.164.443 > 10.0.2.15.44150: Flags [P.], seq 1426469:1431965, ack 869, win 65535, length 5496
19:59:04.820853 IP 10.0.2.15.44150 > 151.101.117.164.443: Flags [.], ack 1426469, win 65535, length 0
19:59:04.821073 IP 151.101.117.164.443 > 10.0.2.15.44150: Flags [P.], seq 1431965:1433339, ack 869, win 65535, length 1374
19:59:04.821116 IP 10.0.2.15.44150 > 151.101.117.164.443: Flags [.], ack 1433339, win 65535, length 0
19:59:04.822124 IP 151.101.117.164.443 > 10.0.2.15.44150: Flags [P.], seq 1433339:1440209, ack 869, win 65535, length 6870
19:59:04.822126 IP 151.101.117.164.443 > 10.0.2.15.44150: Flags [P.], seq 1440209:1445705, ack 869, win 65535, length 5496
19:59:04.822208 IP 10.0.2.15.44150 > 151.101.117.164.443: Flags [.], ack 1445705, win 65535, length 0
19:59:04.823656 IP 151.101.117.164.443 > 10.0.2.15.44150: Flags [P.], seq 1445705:1455323, ack 869, win 65535, length 9618
19:59:04.823675 IP 10.0.2.15.44150 > 151.101.117.164.443: Flags [.], ack 1455323, win 65535, length 0
19:59:04.824860 IP 151.101.117.164.443 > 10.0.2.15.44150: Flags [P.], seq 1455323:1460819, ack 869, win 65535, length 5496
19:59:04.824863 IP 151.101.117.164.443 > 10.0.2.15.44150: Flags [P.], seq 1460819:1466315, ack 869, win 65535, length 5496
19:59:04.824888 IP 10.0.2.15.44150 > 151.101.117.164.443: Flags [.], ack 1460819, win 65535, length 0
19:59:04.825638 IP 10.0.2.15.44150 > 151.101.117.164.443: Flags [.], ack 1466315, win 65535, length 0
19:59:04.825935 IP 151.101.117.164.443 > 10.0.2.15.44150: Flags [.], seq 1466315:1473615, ack 869, win 65535, length 7300
19:59:04.825998 IP 10.0.2.15.44150 > 151.101.117.164.443: Flags [.], ack 1473615, win 65535, length 0
19:59:04.826356 IP 151.101.117.164.443 > 10.0.2.15.44150: Flags [P.], seq 1473615:1474559, ack 869, win 65535, length 944
19:59:04.826358 IP 151.101.117.164.443 > 10.0.2.15.44150: Flags [P.], seq 1474559:1478681, ack 869, win 65535, length 4122
19:59:04.826372 IP 10.0.2.15.44150 > 151.101.117.164.443: Flags [.], ack 1478681, win 65535, length 0
19:59:04.826690 IP 151.101.117.164.443 > 10.0.2.15.44150: Flags [P.], seq 1478681:1485551, ack 869, win 65535, length 6870
19:59:04.826701 IP 10.0.2.15.44150 > 151.101.117.164.443: Flags [.], ack 1485551, win 65535, length 0
19:59:04.826956 IP 151.101.117.164.443 > 10.0.2.15.44150: Flags [P.], seq 1485551:1489673, ack 869, win 65535, length 4122
19:59:04.826957 IP 151.101.117.164.443 > 10.0.2.15.44150: Flags [P.], seq 1489673:1491047, ack 869, win 65535, length 1374
19:59:04.827015 IP 10.0.2.15.44150 > 151.101.117.164.443: Flags [.], ack 1491047, win 65535, length 0
19:59:04.827743 IP 151.101.117.164.443 > 10.0.2.15.44150: Flags [P.], seq 1491047:1497917, ack 869, win 65535, length 6870
19:59:04.827800 IP 10.0.2.15.44150 > 151.101.117.164.443: Flags [.], ack 1497917, win 65535, length 0
19:59:04.827917 IP 151.101.117.164.443 > 10.0.2.15.44150: Flags [P.], seq 1497917:1499291, ack 869, win 65535, length 1374
19:59:04.828586 IP 151.101.117.164.443 > 10.0.2.15.44150: Flags [P.], seq 1499291:1504787, ack 869, win 65535, length 5496
19:59:04.829012 IP 10.0.2.15.44150 > 151.101.117.164.443: Flags [.], ack 1504787, win 65535, length 0
19:59:04.829874 IP 151.101.117.164.443 > 10.0.2.15.44150: Flags [P.], seq 1504787:1511657, ack 869, win 65535, length 6870
19:59:04.829939 IP 10.0.2.15.44150 > 151.101.117.164.443: Flags [.], ack 1511657, win 65535, length 0
19:59:04.830125 IP 151.101.117.164.443 > 10.0.2.15.44150: Flags [P.], seq 1511657:1517153, ack 869, win 65535, length 5496
19:59:04.830172 IP 10.0.2.15.44150 > 151.101.117.164.443: Flags [.], ack 1517153, win 65535, length 0
19:59:04.830810 IP 151.101.117.164.443 > 10.0.2.15.44150: Flags [P.], seq 1517153:1524023, ack 869, win 65535, length 6870
19:59:04.830823 IP 10.0.2.15.44150 > 151.101.117.164.443: Flags [.], ack 1524023, win 65535, length 0
19:59:04.831786 IP 151.101.117.164.443 > 10.0.2.15.44150: Flags [P.], seq 1524023:1529519, ack 869, win 65535, length 5496
19:59:04.831798 IP 151.101.117.164.443 > 10.0.2.15.44150: Flags [P.], seq 1529519:1536389, ack 869, win 65535, length 6870
19:59:04.832009 IP 10.0.2.15.44150 > 151.101.117.164.443: Flags [.], ack 1536389, win 65535, length 0
19:59:04.832076 IP 151.101.117.164.443 > 10.0.2.15.44150: Flags [P.], seq 1536389:1541885, ack 869, win 65535, length 5496
19:59:04.832146 IP 10.0.2.15.44150 > 151.101.117.164.443: Flags [.], ack 1541885, win 65535, length 0
19:59:04.833571 IP 151.101.117.164.443 > 10.0.2.15.44150: Flags [P.], seq 1541885:1550129, ack 869, win 65535, length 8244
19:59:04.833766 IP 10.0.2.15.44150 > 151.101.117.164.443: Flags [.], ack 1550129, win 65535, length 0
19:59:04.834003 IP 151.101.117.164.443 > 10.0.2.15.44150: Flags [P.], seq 1550129:1558373, ack 869, win 65535, length 8244
19:59:04.834005 IP 151.101.117.164.443 > 10.0.2.15.44150: Flags [P.], seq 1558373:1561121, ack 869, win 65535, length 2748
19:59:04.834087 IP 10.0.2.15.44150 > 151.101.117.164.443: Flags [.], ack 1561121, win 65535, length 0
19:59:04.834228 IP 151.101.117.164.443 > 10.0.2.15.44150: Flags [P.], seq 1561121:1562495, ack 869, win 65535, length 1374
19:59:04.835396 IP 151.101.117.164.443 > 10.0.2.15.44150: Flags [P.], seq 1562495:1574861, ack 869, win 65535, length 12366
19:59:04.835414 IP 10.0.2.15.44150 > 151.101.117.164.443: Flags [.], ack 1574861, win 65535, length 0
19:59:04.836672 IP 151.101.117.164.443 > 10.0.2.15.44150: Flags [P.], seq 1574861:1583105, ack 869, win 65535, length 8244
19:59:04.836674 IP 151.101.117.164.443 > 10.0.2.15.44150: Flags [P.], seq 1583105:1587227, ack 869, win 65535, length 4122
19:59:04.836695 IP 10.0.2.15.44150 > 151.101.117.164.443: Flags [.], ack 1583105, win 65535, length 0
19:59:04.836948 IP 151.101.117.164.443 > 10.0.2.15.44150: Flags [P.], seq 1587227:1589975, ack 869, win 65535, length 2748
19:59:04.837104 IP 10.0.2.15.44150 > 151.101.117.164.443: Flags [.], ack 1589975, win 65535, length 0
19:59:04.838370 IP 151.101.117.164.443 > 10.0.2.15.44150: Flags [P.], seq 1589975:1595471, ack 869, win 65535, length 5496
19:59:04.838388 IP 10.0.2.15.44150 > 151.101.117.164.443: Flags [.], ack 1595471, win 65535, length 0
19:59:04.838626 IP 151.101.117.164.443 > 10.0.2.15.44150: Flags [P.], seq 1595471:1602341, ack 869, win 65535, length 6870
19:59:04.838627 IP 151.101.117.164.443 > 10.0.2.15.44150: Flags [P.], seq 1602341:1605089, ack 869, win 65535, length 2748
19:59:04.838627 IP 151.101.117.164.443 > 10.0.2.15.44150: Flags [P.], seq 1605089:1607837, ack 869, win 65535, length 2748
19:59:04.838637 IP 10.0.2.15.44150 > 151.101.117.164.443: Flags [.], ack 1602341, win 65535, length 0
19:59:04.838701 IP 10.0.2.15.44150 > 151.101.117.164.443: Flags [.], ack 1607837, win 65535, length 0
19:59:04.840059 IP 151.101.117.164.443 > 10.0.2.15.44150: Flags [P.], seq 1607837:1614707, ack 869, win 65535, length 6870
19:59:04.840061 IP 151.101.117.164.443 > 10.0.2.15.44150: Flags [P.], seq 1614707:1618829, ack 869, win 65535, length 4122
19:59:04.840081 IP 10.0.2.15.44150 > 151.101.117.164.443: Flags [.], ack 1614707, win 65535, length 0
19:59:04.840355 IP 10.0.2.15.44150 > 151.101.117.164.443: Flags [.], ack 1618829, win 65535, length 0
19:59:04.840919 IP 151.101.117.164.443 > 10.0.2.15.44150: Flags [P.], seq 1618829:1627073, ack 869, win 65535, length 8244
19:59:04.840930 IP 10.0.2.15.44150 > 151.101.117.164.443: Flags [.], ack 1627073, win 65535, length 0
19:59:04.841811 IP 151.101.117.164.443 > 10.0.2.15.44150: Flags [P.], seq 1627073:1632569, ack 869, win 65535, length 5496
19:59:04.841828 IP 10.0.2.15.44150 > 151.101.117.164.443: Flags [.], ack 1632569, win 65535, length 0
19:59:04.842077 IP 151.101.117.164.443 > 10.0.2.15.44150: Flags [P.], seq 1632569:1638065, ack 869, win 65535, length 5496
19:59:04.842149 IP 10.0.2.15.44150 > 151.101.117.164.443: Flags [.], ack 1638065, win 65535, length 0
19:59:04.843204 IP 151.101.117.164.443 > 10.0.2.15.44150: Flags [P.], seq 1638065:1646309, ack 869, win 65535, length 8244
19:59:04.843222 IP 10.0.2.15.44150 > 151.101.117.164.443: Flags [.], ack 1646309, win 65535, length 0
19:59:04.843606 IP 151.101.117.164.443 > 10.0.2.15.44150: Flags [P.], seq 1646309:1650431, ack 869, win 65535, length 4122
19:59:04.843670 IP 10.0.2.15.44150 > 151.101.117.164.443: Flags [.], ack 1650431, win 65535, length 0
19:59:04.844365 IP 151.101.117.164.443 > 10.0.2.15.44150: Flags [P.], seq 1650431:1657301, ack 869, win 65535, length 6870
19:59:04.844366 IP 151.101.117.164.443 > 10.0.2.15.44150: Flags [P.], seq 1657301:1660049, ack 869, win 65535, length 2748
19:59:04.844381 IP 10.0.2.15.44150 > 151.101.117.164.443: Flags [.], ack 1657301, win 65535, length 0
19:59:04.844568 IP 10.0.2.15.44150 > 151.101.117.164.443: Flags [.], ack 1660049, win 65535, length 0
19:59:04.844975 IP 151.101.117.164.443 > 10.0.2.15.44150: Flags [P.], seq 1660049:1665545, ack 869, win 65535, length 5496
19:59:04.844976 IP 151.101.117.164.443 > 10.0.2.15.44150: Flags [.], seq 1665545:1667005, ack 869, win 65535, length 1460
19:59:04.845186 IP 10.0.2.15.44150 > 151.101.117.164.443: Flags [.], ack 1667005, win 65535, length 0
19:59:04.845385 IP 151.101.117.164.443 > 10.0.2.15.44150: Flags [P.], seq 1667005:1668293, ack 869, win 65535, length 1288
19:59:04.845388 IP 151.101.117.164.443 > 10.0.2.15.44150: Flags [P.], seq 1668293:1675163, ack 869, win 65535, length 6870
19:59:04.845646 IP 151.101.117.164.443 > 10.0.2.15.44150: Flags [P.], seq 1675163:1676537, ack 869, win 65535, length 1374
19:59:04.845693 IP 10.0.2.15.44150 > 151.101.117.164.443: Flags [.], ack 1676537, win 65535, length 0
19:59:04.846260 IP 151.101.117.164.443 > 10.0.2.15.44150: Flags [P.], seq 1676537:1682033, ack 869, win 65535, length 5496
19:59:04.846273 IP 10.0.2.15.44150 > 151.101.117.164.443: Flags [.], ack 1682033, win 65535, length 0
19:59:04.847079 IP 151.101.117.164.443 > 10.0.2.15.44150: Flags [P.], seq 1682033:1690277, ack 869, win 65535, length 8244
19:59:04.847284 IP 10.0.2.15.44150 > 151.101.117.164.443: Flags [.], ack 1690277, win 65535, length 0
19:59:04.847380 IP 151.101.117.164.443 > 10.0.2.15.44150: Flags [P.], seq 1690277:1693025, ack 869, win 65535, length 2748
19:59:04.847381 IP 151.101.117.164.443 > 10.0.2.15.44150: Flags [P.], seq 1693025:1694399, ack 869, win 65535, length 1374
19:59:04.847390 IP 10.0.2.15.44150 > 151.101.117.164.443: Flags [.], ack 1693025, win 65535, length 0
19:59:04.848849 IP 151.101.117.164.443 > 10.0.2.15.44150: Flags [P.], seq 1694399:1702643, ack 869, win 65535, length 8244
19:59:04.848851 IP 151.101.117.164.443 > 10.0.2.15.44150: Flags [P.], seq 1702643:1706765, ack 869, win 65535, length 4122
19:59:04.848959 IP 10.0.2.15.44150 > 151.101.117.164.443: Flags [.], ack 1706765, win 65535, length 0
19:59:04.850290 IP 151.101.117.164.443 > 10.0.2.15.44150: Flags [P.], seq 1706765:1716383, ack 869, win 65535, length 9618
19:59:04.850293 IP 151.101.117.164.443 > 10.0.2.15.44150: Flags [P.], seq 1716383:1721879, ack 869, win 65535, length 5496
19:59:04.850312 IP 10.0.2.15.44150 > 151.101.117.164.443: Flags [.], ack 1716383, win 65535, length 0
19:59:04.850347 IP 151.101.117.164.443 > 10.0.2.15.44150: Flags [P.], seq 1721879:1724627, ack 869, win 65535, length 2748
19:59:04.850468 IP 10.0.2.15.44150 > 151.101.117.164.443: Flags [.], ack 1724627, win 65535, length 0
19:59:04.850952 IP 151.101.117.164.443 > 10.0.2.15.44150: Flags [P.], seq 1724627:1731497, ack 869, win 65535, length 6870
19:59:04.851032 IP 10.0.2.15.44150 > 151.101.117.164.443: Flags [.], ack 1731497, win 65535, length 0
19:59:04.851320 IP 151.101.117.164.443 > 10.0.2.15.44150: Flags [P.], seq 1731497:1734245, ack 869, win 65535, length 2748
19:59:04.851359 IP 151.101.117.164.443 > 10.0.2.15.44150: Flags [P.], seq 1734245:1736993, ack 869, win 65535, length 2748
19:59:04.851447 IP 10.0.2.15.44150 > 151.101.117.164.443: Flags [.], ack 1736993, win 65535, length 0
19:59:04.851544 IP 151.101.117.164.443 > 10.0.2.15.44150: Flags [P.], seq 1736993:1739741, ack 869, win 65535, length 2748

