13:20:21.626710 IP 10.0.2.15.42626 > 151.101.117.164.443: Flags [P.], seq 2674191665:2674192182, ack 74688002, win 64240, length 517
13:20:21.627749 IP 151.101.117.164.443 > 10.0.2.15.42626: Flags [.], ack 517, win 65535, length 0
13:20:21.644198 IP 151.101.117.164.443 > 10.0.2.15.42626: Flags [.], seq 1:2921, ack 517, win 65535, length 2920
13:20:21.644217 IP 10.0.2.15.42626 > 151.101.117.164.443: Flags [.], ack 2921, win 62780, length 0
13:20:21.644480 IP 151.101.117.164.443 > 10.0.2.15.42626: Flags [P.], seq 2921:4123, ack 517, win 65535, length 1202
13:20:21.644493 IP 10.0.2.15.42626 > 151.101.117.164.443: Flags [.], ack 4123, win 61578, length 0
13:20:21.645412 IP 151.101.117.164.443 > 10.0.2.15.42626: Flags [P.], seq 4123:5607, ack 517, win 65535, length 1484
13:20:21.645427 IP 10.0.2.15.42626 > 151.101.117.164.443: Flags [.], ack 5607, win 62780, length 0
13:20:21.646840 IP 10.0.2.15.42626 > 151.101.117.164.443: Flags [P.], seq 517:610, ack 5607, win 62780, length 93
13:20:21.647437 IP 151.101.117.164.443 > 10.0.2.15.42626: Flags [.], ack 610, win 65535, length 0
13:20:21.662378 IP 151.101.117.164.443 > 10.0.2.15.42626: Flags [P.], seq 5607:5658, ack 610, win 65535, length 51
13:20:21.662399 IP 10.0.2.15.42626 > 151.101.117.164.443: Flags [.], ack 5658, win 62780, length 0
13:20:21.662979 IP 10.0.2.15.42626 > 151.101.117.164.443: Flags [P.], seq 610:663, ack 5658, win 62780, length 53
13:20:21.663535 IP 151.101.117.164.443 > 10.0.2.15.42626: Flags [.], ack 663, win 65535, length 0
13:20:21.663566 IP 10.0.2.15.42626 > 151.101.117.164.443: Flags [P.], seq 663:719, ack 5658, win 62780, length 56
13:20:21.663903 IP 10.0.2.15.42626 > 151.101.117.164.443: Flags [P.], seq 719:761, ack 5658, win 62780, length 42
13:20:21.664052 IP 10.0.2.15.42626 > 151.101.117.164.443: Flags [P.], seq 761:830, ack 5658, win 62780, length 69
13:20:21.664080 IP 151.101.117.164.443 > 10.0.2.15.42626: Flags [.], ack 719, win 65535, length 0
13:20:21.664081 IP 151.101.117.164.443 > 10.0.2.15.42626: Flags [.], ack 761, win 65535, length 0
13:20:21.664749 IP 151.101.117.164.443 > 10.0.2.15.42626: Flags [.], ack 830, win 65535, length 0
13:20:21.677429 IP 151.101.117.164.443 > 10.0.2.15.42626: Flags [P.], seq 5658:5753, ack 830, win 65535, length 95
13:20:21.677446 IP 10.0.2.15.42626 > 151.101.117.164.443: Flags [.], ack 5753, win 62780, length 0
13:20:21.677619 IP 10.0.2.15.42626 > 151.101.117.164.443: Flags [P.], seq 830:868, ack 5753, win 62780, length 38
13:20:21.678101 IP 151.101.117.164.443 > 10.0.2.15.42626: Flags [.], ack 868, win 65535, length 0
13:20:23.117801 IP 151.101.117.164.443 > 10.0.2.15.42626: Flags [.], seq 5753:15973, ack 868, win 65535, length 10220
13:20:23.118333 IP 10.0.2.15.42626 > 151.101.117.164.443: Flags [.], ack 15973, win 58400, length 0
13:20:23.118635 IP 151.101.117.164.443 > 10.0.2.15.42626: Flags [.], seq 15973:18893, ack 868, win 65535, length 2920
13:20:23.118784 IP 10.0.2.15.42626 > 151.101.117.164.443: Flags [.], ack 18893, win 55480, length 0
13:20:23.118997 IP 151.101.117.164.443 > 10.0.2.15.42626: Flags [.], seq 18893:27653, ack 868, win 65535, length 8760
13:20:23.119042 IP 10.0.2.15.42626 > 151.101.117.164.443: Flags [.], ack 27653, win 49640, length 0
13:20:23.119251 IP 151.101.117.164.443 > 10.0.2.15.42626: Flags [.], seq 27653:39333, ack 868, win 65535, length 11680
13:20:23.119262 IP 10.0.2.15.42626 > 151.101.117.164.443: Flags [.], ack 39333, win 56940, length 0
13:20:23.119427 IP 151.101.117.164.443 > 10.0.2.15.42626: Flags [.], seq 39333:42253, ack 868, win 65535, length 2920
13:20:23.119469 IP 10.0.2.15.42626 > 151.101.117.164.443: Flags [.], ack 42253, win 55480, length 0
13:20:23.119705 IP 151.101.117.164.443 > 10.0.2.15.42626: Flags [P.], seq 42253:48347, ack 868, win 65535, length 6094
13:20:23.119745 IP 10.0.2.15.42626 > 151.101.117.164.443: Flags [.], ack 48347, win 49640, length 0
13:20:23.131730 IP 151.101.117.164.443 > 10.0.2.15.42626: Flags [P.], seq 48347:49721, ack 868, win 65535, length 1374
13:20:23.132551 IP 151.101.117.164.443 > 10.0.2.15.42626: Flags [P.], seq 49721:55217, ack 868, win 65535, length 5496
13:20:23.132569 IP 10.0.2.15.42626 > 151.101.117.164.443: Flags [.], ack 55217, win 61320, length 0
13:20:23.133619 IP 151.101.117.164.443 > 10.0.2.15.42626: Flags [P.], seq 55217:59339, ack 868, win 65535, length 4122
13:20:23.133634 IP 10.0.2.15.42626 > 151.101.117.164.443: Flags [.], ack 59339, win 61320, length 0
13:20:23.134591 IP 151.101.117.164.443 > 10.0.2.15.42626: Flags [P.], seq 59339:60713, ack 868, win 65535, length 1374
13:20:23.135801 IP 151.101.117.164.443 > 10.0.2.15.42626: Flags [P.], seq 60713:62087, ack 868, win 65535, length 1374
13:20:23.135820 IP 10.0.2.15.42626 > 151.101.117.164.443: Flags [.], ack 62087, win 63204, length 0
13:20:23.138067 IP 151.101.117.164.443 > 10.0.2.15.42626: Flags [P.], seq 62087:64835, ack 868, win 65535, length 2748
13:20:23.138140 IP 10.0.2.15.42626 > 151.101.117.164.443: Flags [.], ack 64835, win 63204, length 0
13:20:23.140082 IP 151.101.117.164.443 > 10.0.2.15.42626: Flags [P.], seq 64835:66209, ack 868, win 65535, length 1374
13:20:23.142239 IP 151.101.117.164.443 > 10.0.2.15.42626: Flags [P.], seq 66209:67583, ack 868, win 65535, length 1374
13:20:23.142258 IP 10.0.2.15.42626 > 151.101.117.164.443: Flags [.], ack 67583, win 63204, length 0
13:20:23.143284 IP 151.101.117.164.443 > 10.0.2.15.42626: Flags [P.], seq 67583:70331, ack 868, win 65535, length 2748
13:20:23.143301 IP 10.0.2.15.42626 > 151.101.117.164.443: Flags [.], ack 70331, win 65535, length 0
13:20:23.145583 IP 151.101.117.164.443 > 10.0.2.15.42626: Flags [P.], seq 70331:73079, ack 868, win 65535, length 2748
13:20:23.145658 IP 10.0.2.15.42626 > 151.101.117.164.443: Flags [.], ack 73079, win 65535, length 0
13:20:23.148602 IP 151.101.117.164.443 > 10.0.2.15.42626: Flags [P.], seq 73079:74453, ack 868, win 65535, length 1374
13:20:23.149495 IP 151.101.117.164.443 > 10.0.2.15.42626: Flags [P.], seq 74453:75827, ack 868, win 65535, length 1374
13:20:23.149511 IP 10.0.2.15.42626 > 151.101.117.164.443: Flags [.], ack 75827, win 65535, length 0
13:20:23.150416 IP 151.101.117.164.443 > 10.0.2.15.42626: Flags [P.], seq 75827:77201, ack 868, win 65535, length 1374
13:20:23.151869 IP 151.101.117.164.443 > 10.0.2.15.42626: Flags [P.], seq 77201:78575, ack 868, win 65535, length 1374
13:20:23.151887 IP 10.0.2.15.42626 > 151.101.117.164.443: Flags [.], ack 78575, win 65535, length 0
13:20:23.152715 IP 151.101.117.164.443 > 10.0.2.15.42626: Flags [P.], seq 78575:79949, ack 868, win 65535, length 1374
13:20:23.153877 IP 151.101.117.164.443 > 10.0.2.15.42626: Flags [P.], seq 79949:81323, ack 868, win 65535, length 1374
13:20:23.153896 IP 10.0.2.15.42626 > 151.101.117.164.443: Flags [.], ack 81323, win 65535, length 0
13:20:23.154812 IP 151.101.117.164.443 > 10.0.2.15.42626: Flags [P.], seq 81323:84071, ack 868, win 65535, length 2748
13:20:23.154825 IP 10.0.2.15.42626 > 151.101.117.164.443: Flags [.], ack 84071, win 65535, length 0
13:20:23.155837 IP 151.101.117.164.443 > 10.0.2.15.42626: Flags [P.], seq 84071:85445, ack 868, win 65535, length 1374
13:20:23.157005 IP 151.101.117.164.443 > 10.0.2.15.42626: Flags [P.], seq 85445:86819, ack 868, win 65535, length 1374
13:20:23.157026 IP 10.0.2.15.42626 > 151.101.117.164.443: Flags [.], ack 86819, win 65535, length 0
13:20:23.157992 IP 151.101.117.164.443 > 10.0.2.15.42626: Flags [P.], seq 86819:88193, ack 868, win 65535, length 1374
13:20:23.159296 IP 151.101.117.164.443 > 10.0.2.15.42626: Flags [P.], seq 88193:90941, ack 868, win 65535, length 2748
13:20:23.159311 IP 10.0.2.15.42626 > 151.101.117.164.443: Flags [.], ack 90941, win 65535, length 0
13:20:23.160118 IP 151.101.117.164.443 > 10.0.2.15.42626: Flags [P.], seq 90941:93689, ack 868, win 65535, length 2748
13:20:23.160135 IP 10.0.2.15.42626 > 151.101.117.164.443: Flags [.], ack 93689, win 65535, length 0
13:20:23.161200 IP 151.101.117.164.443 > 10.0.2.15.42626: Flags [P.], seq 93689:95063, ack 868, win 65535, length 1374
13:20:23.162235 IP 151.101.117.164.443 > 10.0.2.15.42626: Flags [P.], seq 95063:96437, ack 868, win 65535, length 1374
13:20:23.162249 IP 10.0.2.15.42626 > 151.101.117.164.443: Flags [.], ack 96437, win 65535, length 0
13:20:23.163358 IP 151.101.117.164.443 > 10.0.2.15.42626: Flags [P.], seq 96437:100559, ack 868, win 65535, length 4122
13:20:23.163372 IP 10.0.2.15.42626 > 151.101.117.164.443: Flags [.], ack 100559, win 65535, length 0
13:20:23.164332 IP 151.101.117.164.443 > 10.0.2.15.42626: Flags [P.], seq 100559:101933, ack 868, win 65535, length 1374
13:20:23.165557 IP 151.101.117.164.443 > 10.0.2.15.42626: Flags [P.], seq 101933:104681, ack 868, win 65535, length 2748
13:20:23.165571 IP 10.0.2.15.42626 > 151.101.117.164.443: Flags [.], ack 104681, win 65535, length 0
13:20:23.166418 IP 151.101.117.164.443 > 10.0.2.15.42626: Flags [P.], seq 104681:107429, ack 868, win 65535, length 2748
13:20:23.166429 IP 10.0.2.15.42626 > 151.101.117.164.443: Flags [.], ack 107429, win 65535, length 0
13:20:23.167579 IP 151.101.117.164.443 > 10.0.2.15.42626: Flags [P.], seq 107429:110177, ack 868, win 65535, length 2748
13:20:23.167593 IP 10.0.2.15.42626 > 151.101.117.164.443: Flags [.], ack 110177, win 65535, length 0
13:20:23.168881 IP 151.101.117.164.443 > 10.0.2.15.42626: Flags [P.], seq 110177:114299, ack 868, win 65535, length 4122
13:20:23.168967 IP 10.0.2.15.42626 > 151.101.117.164.443: Flags [.], ack 114299, win 65535, length 0
13:20:23.169840 IP 151.101.117.164.443 > 10.0.2.15.42626: Flags [P.], seq 114299:118421, ack 868, win 65535, length 4122
13:20:23.169857 IP 10.0.2.15.42626 > 151.101.117.164.443: Flags [.], ack 118421, win 65535, length 0
13:20:23.170989 IP 151.101.117.164.443 > 10.0.2.15.42626: Flags [P.], seq 118421:121169, ack 868, win 65535, length 2748
13:20:23.171003 IP 10.0.2.15.42626 > 151.101.117.164.443: Flags [.], ack 121169, win 65535, length 0
13:20:23.171928 IP 151.101.117.164.443 > 10.0.2.15.42626: Flags [P.], seq 121169:123917, ack 868, win 65535, length 2748
13:20:23.171942 IP 10.0.2.15.42626 > 151.101.117.164.443: Flags [.], ack 123917, win 65535, length 0
13:20:23.172910 IP 151.101.117.164.443 > 10.0.2.15.42626: Flags [P.], seq 123917:129413, ack 868, win 65535, length 5496
13:20:23.172925 IP 10.0.2.15.42626 > 151.101.117.164.443: Flags [.], ack 129413, win 65535, length 0
13:20:23.173971 IP 151.101.117.164.443 > 10.0.2.15.42626: Flags [P.], seq 129413:132161, ack 868, win 65535, length 2748
13:20:23.173986 IP 10.0.2.15.42626 > 151.101.117.164.443: Flags [.], ack 132161, win 65535, length 0
13:20:23.175023 IP 151.101.117.164.443 > 10.0.2.15.42626: Flags [P.], seq 132161:137657, ack 868, win 65535, length 5496
13:20:23.175089 IP 10.0.2.15.42626 > 151.101.117.164.443: Flags [.], ack 137657, win 65535, length 0
13:20:23.176362 IP 151.101.117.164.443 > 10.0.2.15.42626: Flags [P.], seq 137657:141779, ack 868, win 65535, length 4122
13:20:23.176380 IP 10.0.2.15.42626 > 151.101.117.164.443: Flags [.], ack 141779, win 65535, length 0
13:20:23.177497 IP 151.101.117.164.443 > 10.0.2.15.42626: Flags [P.], seq 141779:145901, ack 868, win 65535, length 4122
13:20:23.177511 IP 10.0.2.15.42626 > 151.101.117.164.443: Flags [.], ack 145901, win 65535, length 0
13:20:23.178679 IP 151.101.117.164.443 > 10.0.2.15.42626: Flags [P.], seq 145901:154145, ack 868, win 65535, length 8244
13:20:23.178694 IP 10.0.2.15.42626 > 151.101.117.164.443: Flags [.], ack 154145, win 65535, length 0
13:20:23.180598 IP 151.101.117.164.443 > 10.0.2.15.42626: Flags [P.], seq 154145:161015, ack 868, win 65535, length 6870
13:20:23.180617 IP 10.0.2.15.42626 > 151.101.117.164.443: Flags [.], ack 161015, win 65535, length 0
13:20:23.181237 IP 151.101.117.164.443 > 10.0.2.15.42626: Flags [P.], seq 161015:163763, ack 868, win 65535, length 2748
13:20:23.181263 IP 10.0.2.15.42626 > 151.101.117.164.443: Flags [.], ack 163763, win 65535, length 0
13:20:23.181734 IP 151.101.117.164.443 > 10.0.2.15.42626: Flags [P.], seq 163763:166511, ack 868, win 65535, length 2748
13:20:23.181759 IP 10.0.2.15.42626 > 151.101.117.164.443: Flags [.], ack 166511, win 65535, length 0
13:20:23.182839 IP 151.101.117.164.443 > 10.0.2.15.42626: Flags [P.], seq 166511:174755, ack 868, win 65535, length 8244
13:20:23.182863 IP 10.0.2.15.42626 > 151.101.117.164.443: Flags [.], ack 174755, win 65535, length 0
13:20:23.183852 IP 151.101.117.164.443 > 10.0.2.15.42626: Flags [P.], seq 174755:178877, ack 868, win 65535, length 4122
13:20:23.183876 IP 10.0.2.15.42626 > 151.101.117.164.443: Flags [.], ack 178877, win 65535, length 0
13:20:23.184711 IP 151.101.117.164.443 > 10.0.2.15.42626: Flags [P.], seq 178877:182999, ack 868, win 65535, length 4122
13:20:23.184733 IP 10.0.2.15.42626 > 151.101.117.164.443: Flags [.], ack 182999, win 65535, length 0
13:20:23.187056 IP 151.101.117.164.443 > 10.0.2.15.42626: Flags [P.], seq 182999:191243, ack 868, win 65535, length 8244
13:20:23.187063 IP 151.101.117.164.443 > 10.0.2.15.42626: Flags [P.], seq 191243:195365, ack 868, win 65535, length 4122
13:20:23.187117 IP 10.0.2.15.42626 > 151.101.117.164.443: Flags [.], ack 191243, win 65535, length 0
13:20:23.187199 IP 10.0.2.15.42626 > 151.101.117.164.443: Flags [.], ack 195365, win 65535, length 0
13:20:23.188142 IP 151.101.117.164.443 > 10.0.2.15.42626: Flags [P.], seq 195365:200861, ack 868, win 65535, length 5496
13:20:23.188163 IP 10.0.2.15.42626 > 151.101.117.164.443: Flags [.], ack 200861, win 65535, length 0
13:20:23.189195 IP 151.101.117.164.443 > 10.0.2.15.42626: Flags [P.], seq 200861:206357, ack 868, win 65535, length 5496
13:20:23.189229 IP 10.0.2.15.42626 > 151.101.117.164.443: Flags [.], ack 206357, win 65535, length 0
13:20:23.190411 IP 151.101.117.164.443 > 10.0.2.15.42626: Flags [P.], seq 206357:215975, ack 868, win 65535, length 9618
13:20:23.190428 IP 10.0.2.15.42626 > 151.101.117.164.443: Flags [.], ack 215975, win 65535, length 0
13:20:23.191723 IP 151.101.117.164.443 > 10.0.2.15.42626: Flags [P.], seq 215975:220097, ack 868, win 65535, length 4122
13:20:23.191738 IP 10.0.2.15.42626 > 151.101.117.164.443: Flags [.], ack 220097, win 65535, length 0
13:20:23.192358 IP 151.101.117.164.443 > 10.0.2.15.42626: Flags [P.], seq 220097:226967, ack 868, win 65535, length 6870
13:20:23.192371 IP 10.0.2.15.42626 > 151.101.117.164.443: Flags [.], ack 226967, win 65535, length 0
13:20:23.193551 IP 151.101.117.164.443 > 10.0.2.15.42626: Flags [P.], seq 226967:231089, ack 868, win 65535, length 4122
13:20:23.193567 IP 10.0.2.15.42626 > 151.101.117.164.443: Flags [.], ack 231089, win 65535, length 0
13:20:23.195618 IP 151.101.117.164.443 > 10.0.2.15.42626: Flags [P.], seq 231089:242081, ack 868, win 65535, length 10992
13:20:23.195634 IP 10.0.2.15.42626 > 151.101.117.164.443: Flags [.], ack 242081, win 65535, length 0
13:20:23.196664 IP 151.101.117.164.443 > 10.0.2.15.42626: Flags [P.], seq 242081:248951, ack 868, win 65535, length 6870
13:20:23.196680 IP 10.0.2.15.42626 > 151.101.117.164.443: Flags [.], ack 248951, win 65535, length 0
13:20:23.196999 IP 151.101.117.164.443 > 10.0.2.15.42626: Flags [P.], seq 248951:253073, ack 868, win 65535, length 4122
13:20:23.197010 IP 10.0.2.15.42626 > 151.101.117.164.443: Flags [.], ack 253073, win 65535, length 0
13:20:23.198690 IP 151.101.117.164.443 > 10.0.2.15.42626: Flags [P.], seq 253073:255821, ack 868, win 65535, length 2748
13:20:23.198713 IP 10.0.2.15.42626 > 151.101.117.164.443: Flags [.], ack 255821, win 65535, length 0
13:20:23.199667 IP 151.101.117.164.443 > 10.0.2.15.42626: Flags [P.], seq 255821:264065, ack 868, win 65535, length 8244
13:20:23.199681 IP 10.0.2.15.42626 > 151.101.117.164.443: Flags [.], ack 264065, win 65535, length 0
13:20:23.200010 IP 151.101.117.164.443 > 10.0.2.15.42626: Flags [P.], seq 264065:265439, ack 868, win 65535, length 1374
13:20:23.200974 IP 151.101.117.164.443 > 10.0.2.15.42626: Flags [P.], seq 265439:269561, ack 868, win 65535, length 4122
13:20:23.200990 IP 10.0.2.15.42626 > 151.101.117.164.443: Flags [.], ack 269561, win 65535, length 0
13:20:23.201923 IP 151.101.117.164.443 > 10.0.2.15.42626: Flags [P.], seq 269561:277805, ack 868, win 65535, length 8244
13:20:23.201937 IP 10.0.2.15.42626 > 151.101.117.164.443: Flags [.], ack 277805, win 65535, length 0
13:20:23.202176 IP 151.101.117.164.443 > 10.0.2.15.42626: Flags [P.], seq 277805:280553, ack 868, win 65535, length 2748
13:20:23.202185 IP 10.0.2.15.42626 > 151.101.117.164.443: Flags [.], ack 280553, win 65535, length 0
13:20:23.203783 IP 151.101.117.164.443 > 10.0.2.15.42626: Flags [P.], seq 280553:284675, ack 868, win 65535, length 4122
13:20:23.203799 IP 10.0.2.15.42626 > 151.101.117.164.443: Flags [.], ack 284675, win 65535, length 0
13:20:23.207172 IP 151.101.117.164.443 > 10.0.2.15.42626: Flags [P.], seq 284675:294293, ack 868, win 65535, length 9618
13:20:23.207193 IP 10.0.2.15.42626 > 151.101.117.164.443: Flags [.], ack 294293, win 65535, length 0
13:20:23.207631 IP 151.101.117.164.443 > 10.0.2.15.42626: Flags [P.], seq 294293:301163, ack 868, win 65535, length 6870
13:20:23.207644 IP 10.0.2.15.42626 > 151.101.117.164.443: Flags [.], ack 301163, win 65535, length 0
13:20:23.208043 IP 151.101.117.164.443 > 10.0.2.15.42626: Flags [.], seq 301163:305543, ack 868, win 65535, length 4380
13:20:23.208099 IP 10.0.2.15.42626 > 151.101.117.164.443: Flags [.], ack 305543, win 65535, length 0
13:20:23.208370 IP 151.101.117.164.443 > 10.0.2.15.42626: Flags [P.], seq 305543:306659, ack 868, win 65535, length 1116
13:20:23.208710 IP 151.101.117.164.443 > 10.0.2.15.42626: Flags [P.], seq 306659:314903, ack 868, win 65535, length 8244
13:20:23.208722 IP 10.0.2.15.42626 > 151.101.117.164.443: Flags [.], ack 314903, win 65535, length 0
13:20:23.210084 IP 151.101.117.164.443 > 10.0.2.15.42626: Flags [P.], seq 314903:319025, ack 868, win 65535, length 4122
13:20:23.210175 IP 10.0.2.15.42626 > 151.101.117.164.443: Flags [.], ack 319025, win 65535, length 0
13:20:23.210314 IP 151.101.117.164.443 > 10.0.2.15.42626: Flags [P.], seq 319025:324521, ack 868, win 65535, length 5496
13:20:23.210321 IP 10.0.2.15.42626 > 151.101.117.164.443: Flags [.], ack 324521, win 65535, length 0
13:20:23.211329 IP 151.101.117.164.443 > 10.0.2.15.42626: Flags [P.], seq 324521:330017, ack 868, win 65535, length 5496
13:20:23.211345 IP 10.0.2.15.42626 > 151.101.117.164.443: Flags [.], ack 330017, win 65535, length 0
13:20:23.212029 IP 151.101.117.164.443 > 10.0.2.15.42626: Flags [P.], seq 330017:335513, ack 868, win 65535, length 5496
13:20:23.212042 IP 10.0.2.15.42626 > 151.101.117.164.443: Flags [.], ack 335513, win 65535, length 0
13:20:23.214110 IP 151.101.117.164.443 > 10.0.2.15.42626: Flags [P.], seq 335513:343757, ack 868, win 65535, length 8244
13:20:23.214168 IP 10.0.2.15.42626 > 151.101.117.164.443: Flags [.], ack 343757, win 65535, length 0
13:20:23.214337 IP 151.101.117.164.443 > 10.0.2.15.42626: Flags [P.], seq 343757:345131, ack 868, win 65535, length 1374
13:20:23.215696 IP 151.101.117.164.443 > 10.0.2.15.42626: Flags [P.], seq 345131:352001, ack 868, win 65535, length 6870
13:20:23.215712 IP 10.0.2.15.42626 > 151.101.117.164.443: Flags [.], ack 352001, win 65535, length 0
13:20:23.215929 IP 151.101.117.164.443 > 10.0.2.15.42626: Flags [P.], seq 352001:356123, ack 868, win 65535, length 4122
13:20:23.216004 IP 10.0.2.15.42626 > 151.101.117.164.443: Flags [.], ack 356123, win 65535, length 0
13:20:23.217720 IP 151.101.117.164.443 > 10.0.2.15.42626: Flags [P.], seq 356123:360245, ack 868, win 65535, length 4122
13:20:23.217735 IP 10.0.2.15.42626 > 151.101.117.164.443: Flags [.], ack 360245, win 65535, length 0
13:20:23.218927 IP 151.101.117.164.443 > 10.0.2.15.42626: Flags [P.], seq 360245:361619, ack 868, win 65535, length 1374
13:20:23.220488 IP 151.101.117.164.443 > 10.0.2.15.42626: Flags [P.], seq 361619:365741, ack 868, win 65535, length 4122
13:20:23.220504 IP 10.0.2.15.42626 > 151.101.117.164.443: Flags [.], ack 365741, win 65535, length 0
13:20:23.221238 IP 151.101.117.164.443 > 10.0.2.15.42626: Flags [P.], seq 365741:376733, ack 868, win 65535, length 10992
13:20:23.221252 IP 10.0.2.15.42626 > 151.101.117.164.443: Flags [.], ack 376733, win 65535, length 0
13:20:23.221413 IP 151.101.117.164.443 > 10.0.2.15.42626: Flags [P.], seq 376733:378107, ack 868, win 65535, length 1374
13:20:23.222903 IP 151.101.117.164.443 > 10.0.2.15.42626: Flags [P.], seq 378107:382229, ack 868, win 65535, length 4122
13:20:23.222918 IP 10.0.2.15.42626 > 151.101.117.164.443: Flags [.], ack 382229, win 65535, length 0
13:20:23.223712 IP 151.101.117.164.443 > 10.0.2.15.42626: Flags [P.], seq 382229:389099, ack 868, win 65535, length 6870
13:20:23.223727 IP 10.0.2.15.42626 > 151.101.117.164.443: Flags [.], ack 389099, win 65535, length 0
13:20:23.224624 IP 151.101.117.164.443 > 10.0.2.15.42626: Flags [P.], seq 389099:393221, ack 868, win 65535, length 4122
13:20:23.224639 IP 10.0.2.15.42626 > 151.101.117.164.443: Flags [.], ack 393221, win 65535, length 0
13:20:23.224822 IP 151.101.117.164.443 > 10.0.2.15.42626: Flags [P.], seq 393221:398717, ack 868, win 65535, length 5496
13:20:23.224835 IP 10.0.2.15.42626 > 151.101.117.164.443: Flags [.], ack 398717, win 65535, length 0
13:20:23.226067 IP 151.101.117.164.443 > 10.0.2.15.42626: Flags [P.], seq 398717:402839, ack 868, win 65535, length 4122
13:20:23.226080 IP 10.0.2.15.42626 > 151.101.117.164.443: Flags [.], ack 402839, win 65535, length 0
13:20:23.226353 IP 151.101.117.164.443 > 10.0.2.15.42626: Flags [P.], seq 402839:409709, ack 868, win 65535, length 6870
13:20:23.226415 IP 10.0.2.15.42626 > 151.101.117.164.443: Flags [.], ack 409709, win 65535, length 0
13:20:23.226788 IP 151.101.117.164.443 > 10.0.2.15.42626: Flags [P.], seq 409709:413831, ack 868, win 65535, length 4122
13:20:23.226798 IP 10.0.2.15.42626 > 151.101.117.164.443: Flags [.], ack 413831, win 65535, length 0
13:20:23.227916 IP 151.101.117.164.443 > 10.0.2.15.42626: Flags [P.], seq 413831:419327, ack 868, win 65535, length 5496
13:20:23.227932 IP 10.0.2.15.42626 > 151.101.117.164.443: Flags [.], ack 419327, win 65535, length 0
13:20:23.229255 IP 151.101.117.164.443 > 10.0.2.15.42626: Flags [P.], seq 419327:424823, ack 868, win 65535, length 5496
13:20:23.229323 IP 10.0.2.15.42626 > 151.101.117.164.443: Flags [.], ack 424823, win 65535, length 0
13:20:23.229719 IP 151.101.117.164.443 > 10.0.2.15.42626: Flags [.], seq 424823:429203, ack 868, win 65535, length 4380
13:20:23.229734 IP 10.0.2.15.42626 > 151.101.117.164.443: Flags [.], ack 429203, win 65535, length 0
13:20:23.229992 IP 151.101.117.164.443 > 10.0.2.15.42626: Flags [P.], seq 429203:431693, ack 868, win 65535, length 2490
13:20:23.230001 IP 10.0.2.15.42626 > 151.101.117.164.443: Flags [.], ack 431693, win 65535, length 0
13:20:23.230238 IP 151.101.117.164.443 > 10.0.2.15.42626: Flags [P.], seq 431693:434441, ack 868, win 65535, length 2748
13:20:23.230287 IP 10.0.2.15.42626 > 151.101.117.164.443: Flags [.], ack 434441, win 65535, length 0
13:20:23.231525 IP 151.101.117.164.443 > 10.0.2.15.42626: Flags [P.], seq 434441:439937, ack 868, win 65535, length 5496
13:20:23.231543 IP 10.0.2.15.42626 > 151.101.117.164.443: Flags [.], ack 439937, win 65535, length 0
13:20:23.231804 IP 151.101.117.164.443 > 10.0.2.15.42626: Flags [P.], seq 439937:442685, ack 868, win 65535, length 2748
13:20:23.231812 IP 10.0.2.15.42626 > 151.101.117.164.443: Flags [.], ack 442685, win 65535, length 0
13:20:23.235232 IP 151.101.117.164.443 > 10.0.2.15.42626: Flags [P.], seq 442685:449555, ack 868, win 65535, length 6870
13:20:23.235252 IP 10.0.2.15.42626 > 151.101.117.164.443: Flags [.], ack 449555, win 65535, length 0
13:20:23.236863 IP 151.101.117.164.443 > 10.0.2.15.42626: Flags [P.], seq 449555:457799, ack 868, win 65535, length 8244
13:20:23.236880 IP 10.0.2.15.42626 > 151.101.117.164.443: Flags [.], ack 457799, win 65535, length 0
13:20:23.237684 IP 151.101.117.164.443 > 10.0.2.15.42626: Flags [P.], seq 457799:467417, ack 868, win 65535, length 9618
13:20:23.237699 IP 10.0.2.15.42626 > 151.101.117.164.443: Flags [.], ack 467417, win 65535, length 0
13:20:23.239426 IP 151.101.117.164.443 > 10.0.2.15.42626: Flags [P.], seq 467417:475661, ack 868, win 65535, length 8244
13:20:23.239444 IP 10.0.2.15.42626 > 151.101.117.164.443: Flags [.], ack 475661, win 65535, length 0
13:20:23.239690 IP 151.101.117.164.443 > 10.0.2.15.42626: Flags [P.], seq 475661:477035, ack 868, win 65535, length 1374
13:20:23.240194 IP 151.101.117.164.443 > 10.0.2.15.42626: Flags [P.], seq 477035:488027, ack 868, win 65535, length 10992
13:20:23.240211 IP 10.0.2.15.42626 > 151.101.117.164.443: Flags [.], ack 488027, win 65535, length 0
13:20:23.241477 IP 151.101.117.164.443 > 10.0.2.15.42626: Flags [P.], seq 488027:496271, ack 868, win 65535, length 8244
13:20:23.241494 IP 10.0.2.15.42626 > 151.101.117.164.443: Flags [.], ack 496271, win 65535, length 0
13:20:23.242568 IP 151.101.117.164.443 > 10.0.2.15.42626: Flags [P.], seq 496271:501767, ack 868, win 65535, length 5496
13:20:23.242583 IP 10.0.2.15.42626 > 151.101.117.164.443: Flags [.], ack 501767, win 65535, length 0
13:20:23.243591 IP 151.101.117.164.443 > 10.0.2.15.42626: Flags [P.], seq 501767:510011, ack 868, win 65535, length 8244
13:20:23.243717 IP 10.0.2.15.42626 > 151.101.117.164.443: Flags [.], ack 510011, win 65535, length 0
13:20:23.244741 IP 151.101.117.164.443 > 10.0.2.15.42626: Flags [P.], seq 510011:519629, ack 868, win 65535, length 9618
13:20:23.244759 IP 10.0.2.15.42626 > 151.101.117.164.443: Flags [.], ack 519629, win 65535, length 0
13:20:23.245479 IP 151.101.117.164.443 > 10.0.2.15.42626: Flags [P.], seq 519629:529247, ack 868, win 65535, length 9618
13:20:23.245493 IP 10.0.2.15.42626 > 151.101.117.164.443: Flags [.], ack 529247, win 65535, length 0
13:20:23.246563 IP 151.101.117.164.443 > 10.0.2.15.42626: Flags [P.], seq 529247:530621, ack 868, win 65535, length 1374
13:20:23.249760 IP 151.101.117.164.443 > 10.0.2.15.42626: Flags [P.], seq 530621:531995, ack 868, win 65535, length 1374
13:20:23.249774 IP 10.0.2.15.42626 > 151.101.117.164.443: Flags [.], ack 531995, win 65535, length 0
13:20:23.250993 IP 151.101.117.164.443 > 10.0.2.15.42626: Flags [P.], seq 531995:540239, ack 868, win 65535, length 8244
13:20:23.251012 IP 10.0.2.15.42626 > 151.101.117.164.443: Flags [.], ack 540239, win 65535, length 0
13:20:23.252101 IP 151.101.117.164.443 > 10.0.2.15.42626: Flags [P.], seq 540239:549857, ack 868, win 65535, length 9618
13:20:23.252120 IP 10.0.2.15.42626 > 151.101.117.164.443: Flags [.], ack 549857, win 65535, length 0
13:20:23.252879 IP 151.101.117.164.443 > 10.0.2.15.42626: Flags [P.], seq 549857:559475, ack 868, win 65535, length 9618
13:20:23.252895 IP 10.0.2.15.42626 > 151.101.117.164.443: Flags [.], ack 559475, win 65535, length 0
13:20:23.254185 IP 151.101.117.164.443 > 10.0.2.15.42626: Flags [P.], seq 559475:566345, ack 868, win 65535, length 6870
13:20:23.254201 IP 10.0.2.15.42626 > 151.101.117.164.443: Flags [.], ack 566345, win 65535, length 0
13:20:23.255288 IP 151.101.117.164.443 > 10.0.2.15.42626: Flags [P.], seq 566345:573215, ack 868, win 65535, length 6870
13:20:23.255305 IP 10.0.2.15.42626 > 151.101.117.164.443: Flags [.], ack 573215, win 65535, length 0
13:20:23.256420 IP 151.101.117.164.443 > 10.0.2.15.42626: Flags [P.], seq 573215:577337, ack 868, win 65535, length 4122
13:20:23.256436 IP 10.0.2.15.42626 > 151.101.117.164.443: Flags [.], ack 577337, win 65535, length 0
13:20:23.256737 IP 151.101.117.164.443 > 10.0.2.15.42626: Flags [P.], seq 577337:580085, ack 868, win 65535, length 2748
13:20:23.256746 IP 10.0.2.15.42626 > 151.101.117.164.443: Flags [.], ack 580085, win 65535, length 0
13:20:23.257541 IP 151.101.117.164.443 > 10.0.2.15.42626: Flags [P.], seq 580085:586955, ack 868, win 65535, length 6870
13:20:23.257559 IP 10.0.2.15.42626 > 151.101.117.164.443: Flags [.], ack 586955, win 65535, length 0
13:20:23.257703 IP 151.101.117.164.443 > 10.0.2.15.42626: Flags [P.], seq 586955:589703, ack 868, win 65535, length 2748
13:20:23.257710 IP 10.0.2.15.42626 > 151.101.117.164.443: Flags [.], ack 589703, win 65535, length 0
13:20:23.258760 IP 151.101.117.164.443 > 10.0.2.15.42626: Flags [P.], seq 589703:599321, ack 868, win 65535, length 9618
13:20:23.258778 IP 10.0.2.15.42626 > 151.101.117.164.443: Flags [.], ack 599321, win 65535, length 0
13:20:23.259722 IP 151.101.117.164.443 > 10.0.2.15.42626: Flags [P.], seq 599321:607565, ack 868, win 65535, length 8244
13:20:23.259738 IP 10.0.2.15.42626 > 151.101.117.164.443: Flags [.], ack 607565, win 65535, length 0
13:20:23.261116 IP 151.101.117.164.443 > 10.0.2.15.42626: Flags [P.], seq 607565:615809, ack 868, win 65535, length 8244
13:20:23.261133 IP 10.0.2.15.42626 > 151.101.117.164.443: Flags [.], ack 615809, win 65535, length 0
13:20:23.261354 IP 151.101.117.164.443 > 10.0.2.15.42626: Flags [P.], seq 615809:617183, ack 868, win 65535, length 1374
13:20:23.263069 IP 151.101.117.164.443 > 10.0.2.15.42626: Flags [P.], seq 617183:618557, ack 868, win 65535, length 1374
13:20:23.263084 IP 10.0.2.15.42626 > 151.101.117.164.443: Flags [.], ack 618557, win 65535, length 0
13:20:23.263780 IP 151.101.117.164.443 > 10.0.2.15.42626: Flags [P.], seq 618557:626801, ack 868, win 65535, length 8244
13:20:23.263796 IP 10.0.2.15.42626 > 151.101.117.164.443: Flags [.], ack 626801, win 65535, length 0
13:20:23.264579 IP 151.101.117.164.443 > 10.0.2.15.42626: Flags [P.], seq 626801:632297, ack 868, win 65535, length 5496
13:20:23.264595 IP 10.0.2.15.42626 > 151.101.117.164.443: Flags [.], ack 632297, win 65535, length 0
13:20:23.266578 IP 151.101.117.164.443 > 10.0.2.15.42626: Flags [P.], seq 632297:643289, ack 868, win 65535, length 10992
13:20:23.266596 IP 10.0.2.15.42626 > 151.101.117.164.443: Flags [.], ack 643289, win 65535, length 0
13:20:23.266819 IP 151.101.117.164.443 > 10.0.2.15.42626: Flags [P.], seq 643289:647411, ack 868, win 65535, length 4122
13:20:23.266831 IP 10.0.2.15.42626 > 151.101.117.164.443: Flags [.], ack 647411, win 65535, length 0
13:20:23.267835 IP 151.101.117.164.443 > 10.0.2.15.42626: Flags [P.], seq 647411:654281, ack 868, win 65535, length 6870
13:20:23.267850 IP 10.0.2.15.42626 > 151.101.117.164.443: Flags [.], ack 654281, win 65535, length 0
13:20:23.268081 IP 151.101.117.164.443 > 10.0.2.15.42626: Flags [P.], seq 654281:658403, ack 868, win 65535, length 4122
13:20:23.268089 IP 10.0.2.15.42626 > 151.101.117.164.443: Flags [.], ack 658403, win 65535, length 0
13:20:23.268962 IP 151.101.117.164.443 > 10.0.2.15.42626: Flags [P.], seq 658403:665273, ack 868, win 65535, length 6870
13:20:23.268976 IP 10.0.2.15.42626 > 151.101.117.164.443: Flags [.], ack 665273, win 65535, length 0
13:20:23.269825 IP 151.101.117.164.443 > 10.0.2.15.42626: Flags [P.], seq 665273:673517, ack 868, win 65535, length 8244
13:20:23.269849 IP 10.0.2.15.42626 > 151.101.117.164.443: Flags [.], ack 673517, win 65535, length 0
13:20:23.271028 IP 151.101.117.164.443 > 10.0.2.15.42626: Flags [.], seq 673517:674977, ack 868, win 65535, length 1460
13:20:23.271750 IP 151.101.117.164.443 > 10.0.2.15.42626: Flags [P.], seq 674977:681761, ack 868, win 65535, length 6784
13:20:23.271845 IP 10.0.2.15.42626 > 151.101.117.164.443: Flags [.], ack 681761, win 65535, length 0
13:20:23.272171 IP 151.101.117.164.443 > 10.0.2.15.42626: Flags [P.], seq 681761:688631, ack 868, win 65535, length 6870
13:20:23.272184 IP 10.0.2.15.42626 > 151.101.117.164.443: Flags [.], ack 688631, win 65535, length 0
13:20:23.272410 IP 151.101.117.164.443 > 10.0.2.15.42626: Flags [P.], seq 688631:690005, ack 868, win 65535, length 1374
13:20:23.273434 IP 151.101.117.164.443 > 10.0.2.15.42626: Flags [P.], seq 690005:695501, ack 868, win 65535, length 5496
13:20:23.273448 IP 10.0.2.15.42626 > 151.101.117.164.443: Flags [.], ack 695501, win 65535, length 0
13:20:23.273579 IP 151.101.117.164.443 > 10.0.2.15.42626: Flags [P.], seq 695501:698249, ack 868, win 65535, length 2748
13:20:23.273586 IP 10.0.2.15.42626 > 151.101.117.164.443: Flags [.], ack 698249, win 65535, length 0
13:20:23.274999 IP 151.101.117.164.443 > 10.0.2.15.42626: Flags [P.], seq 698249:703745, ack 868, win 65535, length 5496
13:20:23.275017 IP 10.0.2.15.42626 > 151.101.117.164.443: Flags [.], ack 703745, win 65535, length 0
13:20:23.275957 IP 151.101.117.164.443 > 10.0.2.15.42626: Flags [P.], seq 703745:709241, ack 868, win 65535, length 5496
13:20:23.275974 IP 10.0.2.15.42626 > 151.101.117.164.443: Flags [.], ack 709241, win 65535, length 0
13:20:23.276518 IP 151.101.117.164.443 > 10.0.2.15.42626: Flags [P.], seq 709241:713363, ack 868, win 65535, length 4122
13:20:23.276534 IP 10.0.2.15.42626 > 151.101.117.164.443: Flags [.], ack 713363, win 65535, length 0
13:20:23.277073 IP 151.101.117.164.443 > 10.0.2.15.42626: Flags [P.], seq 713363:721607, ack 868, win 65535, length 8244
13:20:23.277118 IP 10.0.2.15.42626 > 151.101.117.164.443: Flags [.], ack 721607, win 65535, length 0
13:20:23.277814 IP 151.101.117.164.443 > 10.0.2.15.42626: Flags [P.], seq 721607:722981, ack 868, win 65535, length 1374
13:20:23.278574 IP 151.101.117.164.443 > 10.0.2.15.42626: Flags [P.], seq 722981:727103, ack 868, win 65535, length 4122
13:20:23.278588 IP 10.0.2.15.42626 > 151.101.117.164.443: Flags [.], ack 727103, win 65535, length 0
13:20:23.279730 IP 151.101.117.164.443 > 10.0.2.15.42626: Flags [P.], seq 727103:733973, ack 868, win 65535, length 6870
13:20:23.280028 IP 151.101.117.164.443 > 10.0.2.15.42626: Flags [P.], seq 733973:738095, ack 868, win 65535, length 4122
13:20:23.280081 IP 10.0.2.15.42626 > 151.101.117.164.443: Flags [.], ack 738095, win 65535, length 0
13:20:23.280201 IP 151.101.117.164.443 > 10.0.2.15.42626: Flags [P.], seq 738095:742217, ack 868, win 65535, length 4122
13:20:23.280300 IP 10.0.2.15.42626 > 151.101.117.164.443: Flags [.], ack 742217, win 65535, length 0
13:20:23.280840 IP 151.101.117.164.443 > 10.0.2.15.42626: Flags [P.], seq 742217:750461, ack 868, win 65535, length 8244
13:20:23.280854 IP 10.0.2.15.42626 > 151.101.117.164.443: Flags [.], ack 750461, win 65535, length 0
13:20:23.282058 IP 151.101.117.164.443 > 10.0.2.15.42626: Flags [P.], seq 750461:757331, ack 868, win 65535, length 6870
13:20:23.282081 IP 10.0.2.15.42626 > 151.101.117.164.443: Flags [.], ack 757331, win 65535, length 0
13:20:23.284858 IP 151.101.117.164.443 > 10.0.2.15.42626: Flags [P.], seq 757331:764201, ack 868, win 65535, length 6870
13:20:23.284861 IP 151.101.117.164.443 > 10.0.2.15.42626: Flags [P.], seq 764201:771071, ack 868, win 65535, length 6870
13:20:23.285335 IP 10.0.2.15.42626 > 151.101.117.164.443: Flags [.], ack 771071, win 65535, length 0
13:20:23.285609 IP 151.101.117.164.443 > 10.0.2.15.42626: Flags [P.], seq 771071:783437, ack 868, win 65535, length 12366
13:20:23.285720 IP 10.0.2.15.42626 > 151.101.117.164.443: Flags [.], ack 783437, win 65535, length 0
13:20:23.285956 IP 151.101.117.164.443 > 10.0.2.15.42626: Flags [P.], seq 783437:790307, ack 868, win 65535, length 6870
13:20:23.285965 IP 10.0.2.15.42626 > 151.101.117.164.443: Flags [.], ack 790307, win 65535, length 0
13:20:23.286815 IP 151.101.117.164.443 > 10.0.2.15.42626: Flags [P.], seq 790307:798551, ack 868, win 65535, length 8244
13:20:23.286829 IP 10.0.2.15.42626 > 151.101.117.164.443: Flags [.], ack 798551, win 65535, length 0
13:20:23.287748 IP 151.101.117.164.443 > 10.0.2.15.42626: Flags [P.], seq 798551:804047, ack 868, win 65535, length 5496
13:20:23.287761 IP 10.0.2.15.42626 > 151.101.117.164.443: Flags [.], ack 804047, win 65535, length 0
13:20:23.287839 IP 151.101.117.164.443 > 10.0.2.15.42626: Flags [P.], seq 804047:805421, ack 868, win 65535, length 1374
13:20:23.289058 IP 151.101.117.164.443 > 10.0.2.15.42626: Flags [P.], seq 805421:812291, ack 868, win 65535, length 6870
13:20:23.289126 IP 10.0.2.15.42626 > 151.101.117.164.443: Flags [.], ack 812291, win 65535, length 0
13:20:23.290393 IP 151.101.117.164.443 > 10.0.2.15.42626: Flags [P.], seq 812291:816413, ack 868, win 65535, length 4122
13:20:23.290460 IP 10.0.2.15.42626 > 151.101.117.164.443: Flags [.], ack 816413, win 65535, length 0
13:20:23.291000 IP 151.101.117.164.443 > 10.0.2.15.42626: Flags [P.], seq 816413:823283, ack 868, win 65535, length 6870
13:20:23.291058 IP 10.0.2.15.42626 > 151.101.117.164.443: Flags [.], ack 823283, win 65535, length 0
13:20:23.292805 IP 151.101.117.164.443 > 10.0.2.15.42626: Flags [P.], seq 823283:824657, ack 868, win 65535, length 1374
13:20:23.293053 IP 151.101.117.164.443 > 10.0.2.15.42626: Flags [P.], seq 824657:831527, ack 868, win 65535, length 6870
13:20:23.293071 IP 10.0.2.15.42626 > 151.101.117.164.443: Flags [.], ack 831527, win 65535, length 0
13:20:23.293682 IP 151.101.117.164.443 > 10.0.2.15.42626: Flags [P.], seq 831527:838397, ack 868, win 65535, length 6870
13:20:23.293695 IP 10.0.2.15.42626 > 151.101.117.164.443: Flags [.], ack 838397, win 65535, length 0
13:20:23.293910 IP 151.101.117.164.443 > 10.0.2.15.42626: Flags [P.], seq 838397:841145, ack 868, win 65535, length 2748
13:20:23.293978 IP 10.0.2.15.42626 > 151.101.117.164.443: Flags [.], ack 841145, win 65535, length 0
13:20:23.294491 IP 151.101.117.164.443 > 10.0.2.15.42626: Flags [P.], seq 841145:848015, ack 868, win 65535, length 6870
13:20:23.294506 IP 10.0.2.15.42626 > 151.101.117.164.443: Flags [.], ack 848015, win 65535, length 0
13:20:23.295090 IP 151.101.117.164.443 > 10.0.2.15.42626: Flags [P.], seq 848015:852137, ack 868, win 65535, length 4122
13:20:23.295103 IP 10.0.2.15.42626 > 151.101.117.164.443: Flags [.], ack 852137, win 65535, length 0
13:20:23.295432 IP 151.101.117.164.443 > 10.0.2.15.42626: Flags [P.], seq 852137:854885, ack 868, win 65535, length 2748
13:20:23.295442 IP 10.0.2.15.42626 > 151.101.117.164.443: Flags [.], ack 854885, win 65535, length 0
13:20:23.295851 IP 151.101.117.164.443 > 10.0.2.15.42626: Flags [P.], seq 854885:856259, ack 868, win 65535, length 1374
13:20:23.297307 IP 151.101.117.164.443 > 10.0.2.15.42626: Flags [P.], seq 856259:863129, ack 868, win 65535, length 6870
13:20:23.297385 IP 10.0.2.15.42626 > 151.101.117.164.443: Flags [.], ack 863129, win 65535, length 0
13:20:23.298767 IP 151.101.117.164.443 > 10.0.2.15.42626: Flags [P.], seq 863129:869999, ack 868, win 65535, length 6870
13:20:23.298850 IP 10.0.2.15.42626 > 151.101.117.164.443: Flags [.], ack 869999, win 65535, length 0
13:20:23.299161 IP 151.101.117.164.443 > 10.0.2.15.42626: Flags [P.], seq 869999:879617, ack 868, win 65535, length 9618
13:20:23.299208 IP 10.0.2.15.42626 > 151.101.117.164.443: Flags [.], ack 879617, win 65535, length 0
13:20:23.300248 IP 151.101.117.164.443 > 10.0.2.15.42626: Flags [P.], seq 879617:886487, ack 868, win 65535, length 6870
13:20:23.300264 IP 10.0.2.15.42626 > 151.101.117.164.443: Flags [.], ack 886487, win 65535, length 0
13:20:23.300600 IP 151.101.117.164.443 > 10.0.2.15.42626: Flags [P.], seq 886487:889235, ack 868, win 65535, length 2748
13:20:23.300612 IP 10.0.2.15.42626 > 151.101.117.164.443: Flags [.], ack 889235, win 65535, length 0
13:20:23.301489 IP 151.101.117.164.443 > 10.0.2.15.42626: Flags [P.], seq 889235:900227, ack 868, win 65535, length 10992
13:20:23.301567 IP 10.0.2.15.42626 > 151.101.117.164.443: Flags [.], ack 900227, win 65535, length 0
13:20:23.301826 IP 151.101.117.164.443 > 10.0.2.15.42626: Flags [P.], seq 900227:902975, ack 868, win 65535, length 2748
13:20:23.301837 IP 10.0.2.15.42626 > 151.101.117.164.443: Flags [.], ack 902975, win 65535, length 0
13:20:23.303057 IP 151.101.117.164.443 > 10.0.2.15.42626: Flags [P.], seq 902975:911219, ack 868, win 65535, length 8244
13:20:23.303172 IP 151.101.117.164.443 > 10.0.2.15.42626: Flags [P.], seq 911219:912593, ack 868, win 65535, length 1374
13:20:23.303339 IP 10.0.2.15.42626 > 151.101.117.164.443: Flags [.], ack 912593, win 65535, length 0
13:20:23.303885 IP 151.101.117.164.443 > 10.0.2.15.42626: Flags [P.], seq 912593:918089, ack 868, win 65535, length 5496
13:20:23.303948 IP 10.0.2.15.42626 > 151.101.117.164.443: Flags [.], ack 918089, win 65535, length 0
13:20:23.304321 IP 151.101.117.164.443 > 10.0.2.15.42626: Flags [P.], seq 918089:920837, ack 868, win 65535, length 2748
13:20:23.304335 IP 10.0.2.15.42626 > 151.101.117.164.443: Flags [.], ack 920837, win 65535, length 0
13:20:23.305050 IP 151.101.117.164.443 > 10.0.2.15.42626: Flags [P.], seq 920837:927707, ack 868, win 65535, length 6870
13:20:23.305111 IP 10.0.2.15.42626 > 151.101.117.164.443: Flags [.], ack 927707, win 65535, length 0
13:20:23.306227 IP 151.101.117.164.443 > 10.0.2.15.42626: Flags [P.], seq 927707:929081, ack 868, win 65535, length 1374
13:20:23.307332 IP 151.101.117.164.443 > 10.0.2.15.42626: Flags [P.], seq 929081:937325, ack 868, win 65535, length 8244
13:20:23.307349 IP 10.0.2.15.42626 > 151.101.117.164.443: Flags [.], ack 937325, win 65535, length 0
13:20:23.307585 IP 151.101.117.164.443 > 10.0.2.15.42626: Flags [P.], seq 937325:945569, ack 868, win 65535, length 8244
13:20:23.307593 IP 10.0.2.15.42626 > 151.101.117.164.443: Flags [.], ack 945569, win 65535, length 0
13:20:23.308495 IP 151.101.117.164.443 > 10.0.2.15.42626: Flags [P.], seq 945569:952439, ack 868, win 65535, length 6870
13:20:23.308509 IP 10.0.2.15.42626 > 151.101.117.164.443: Flags [.], ack 952439, win 65535, length 0
13:20:23.309674 IP 151.101.117.164.443 > 10.0.2.15.42626: Flags [P.], seq 952439:960683, ack 868, win 65535, length 8244
13:20:23.309690 IP 10.0.2.15.42626 > 151.101.117.164.443: Flags [.], ack 960683, win 65535, length 0
13:20:23.309988 IP 151.101.117.164.443 > 10.0.2.15.42626: Flags [P.], seq 960683:962057, ack 868, win 65535, length 1374
13:20:23.312263 IP 151.101.117.164.443 > 10.0.2.15.42626: Flags [P.], seq 962057:970301, ack 868, win 65535, length 8244
13:20:23.312282 IP 10.0.2.15.42626 > 151.101.117.164.443: Flags [.], ack 970301, win 65535, length 0
13:20:23.312569 IP 151.101.117.164.443 > 10.0.2.15.42626: Flags [P.], seq 970301:977171, ack 868, win 65535, length 6870
13:20:23.312580 IP 10.0.2.15.42626 > 151.101.117.164.443: Flags [.], ack 977171, win 65535, length 0
13:20:23.314300 IP 151.101.117.164.443 > 10.0.2.15.42626: Flags [P.], seq 977171:985415, ack 868, win 65535, length 8244
13:20:23.314356 IP 10.0.2.15.42626 > 151.101.117.164.443: Flags [.], ack 985415, win 65535, length 0
13:20:23.314781 IP 151.101.117.164.443 > 10.0.2.15.42626: Flags [P.], seq 985415:993659, ack 868, win 65535, length 8244
13:20:23.314838 IP 10.0.2.15.42626 > 151.101.117.164.443: Flags [.], ack 993659, win 65535, length 0
13:20:23.315020 IP 151.101.117.164.443 > 10.0.2.15.42626: Flags [P.], seq 993659:1000529, ack 868, win 65535, length 6870
13:20:23.315619 IP 10.0.2.15.42626 > 151.101.117.164.443: Flags [.], ack 1000529, win 65535, length 0
13:20:23.315808 IP 151.101.117.164.443 > 10.0.2.15.42626: Flags [P.], seq 1000529:1008773, ack 868, win 65535, length 8244
13:20:23.316663 IP 151.101.117.164.443 > 10.0.2.15.42626: Flags [P.], seq 1008773:1017017, ack 868, win 65535, length 8244
13:20:23.316942 IP 10.0.2.15.42626 > 151.101.117.164.443: Flags [.], ack 1017017, win 65535, length 0
13:20:23.317818 IP 151.101.117.164.443 > 10.0.2.15.42626: Flags [P.], seq 1017017:1025261, ack 868, win 65535, length 8244
13:20:23.317837 IP 10.0.2.15.42626 > 151.101.117.164.443: Flags [.], ack 1025261, win 65535, length 0
13:20:23.318105 IP 151.101.117.164.443 > 10.0.2.15.42626: Flags [P.], seq 1025261:1033505, ack 868, win 65535, length 8244
13:20:23.318132 IP 10.0.2.15.42626 > 151.101.117.164.443: Flags [.], ack 1033505, win 65535, length 0
13:20:23.320065 IP 151.101.117.164.443 > 10.0.2.15.42626: Flags [P.], seq 1033505:1037627, ack 868, win 65535, length 4122
13:20:23.320080 IP 10.0.2.15.42626 > 151.101.117.164.443: Flags [.], ack 1037627, win 65535, length 0
13:20:23.320236 IP 151.101.117.164.443 > 10.0.2.15.42626: Flags [P.], seq 1037627:1041749, ack 868, win 65535, length 4122
13:20:23.320280 IP 10.0.2.15.42626 > 151.101.117.164.443: Flags [.], ack 1041749, win 65535, length 0
13:20:23.323590 IP 151.101.117.164.443 > 10.0.2.15.42626: Flags [P.], seq 1041749:1060985, ack 868, win 65535, length 19236
13:20:23.323757 IP 10.0.2.15.42626 > 151.101.117.164.443: Flags [.], ack 1060985, win 65535, length 0
13:20:23.323971 IP 151.101.117.164.443 > 10.0.2.15.42626: Flags [P.], seq 1060985:1067855, ack 868, win 65535, length 6870
13:20:23.324033 IP 10.0.2.15.42626 > 151.101.117.164.443: Flags [.], ack 1067855, win 65535, length 0
13:20:23.324205 IP 151.101.117.164.443 > 10.0.2.15.42626: Flags [P.], seq 1067855:1069229, ack 868, win 65535, length 1374
13:20:23.325591 IP 151.101.117.164.443 > 10.0.2.15.42626: Flags [P.], seq 1069229:1080221, ack 868, win 65535, length 10992
13:20:23.325608 IP 10.0.2.15.42626 > 151.101.117.164.443: Flags [.], ack 1080221, win 65535, length 0
13:20:23.326034 IP 151.101.117.164.443 > 10.0.2.15.42626: Flags [P.], seq 1080221:1085717, ack 868, win 65535, length 5496
13:20:23.326091 IP 10.0.2.15.42626 > 151.101.117.164.443: Flags [.], ack 1085717, win 65535, length 0
13:20:23.326217 IP 151.101.117.164.443 > 10.0.2.15.42626: Flags [P.], seq 1085717:1087091, ack 868, win 65535, length 1374
13:20:23.327852 IP 151.101.117.164.443 > 10.0.2.15.42626: Flags [P.], seq 1087091:1100831, ack 868, win 65535, length 13740
13:20:23.327952 IP 10.0.2.15.42626 > 151.101.117.164.443: Flags [.], ack 1100831, win 65535, length 0
13:20:23.328085 IP 151.101.117.164.443 > 10.0.2.15.42626: Flags [P.], seq 1100831:1106327, ack 868, win 65535, length 5496
13:20:23.328150 IP 10.0.2.15.42626 > 151.101.117.164.443: Flags [.], ack 1106327, win 65535, length 0
13:20:23.329216 IP 151.101.117.164.443 > 10.0.2.15.42626: Flags [P.], seq 1106327:1111823, ack 868, win 65535, length 5496
13:20:23.329230 IP 10.0.2.15.42626 > 151.101.117.164.443: Flags [.], ack 1111823, win 65535, length 0
13:20:23.329638 IP 151.101.117.164.443 > 10.0.2.15.42626: Flags [P.], seq 1111823:1114571, ack 868, win 65535, length 2748
13:20:23.329693 IP 10.0.2.15.42626 > 151.101.117.164.443: Flags [.], ack 1114571, win 65535, length 0
13:20:23.330150 IP 151.101.117.164.443 > 10.0.2.15.42626: Flags [P.], seq 1114571:1122815, ack 868, win 65535, length 8244
13:20:23.330210 IP 10.0.2.15.42626 > 151.101.117.164.443: Flags [.], ack 1122815, win 65535, length 0
13:20:23.334041 IP 151.101.117.164.443 > 10.0.2.15.42626: Flags [P.], seq 1122815:1142051, ack 868, win 65535, length 19236
13:20:23.334147 IP 10.0.2.15.42626 > 151.101.117.164.443: Flags [.], ack 1142051, win 65535, length 0
13:20:23.334341 IP 151.101.117.164.443 > 10.0.2.15.42626: Flags [P.], seq 1142051:1151669, ack 868, win 65535, length 9618
13:20:23.334372 IP 10.0.2.15.42626 > 151.101.117.164.443: Flags [.], ack 1151669, win 65535, length 0
13:20:23.335375 IP 151.101.117.164.443 > 10.0.2.15.42626: Flags [P.], seq 1151669:1153043, ack 868, win 65535, length 1374
13:20:23.336498 IP 151.101.117.164.443 > 10.0.2.15.42626: Flags [P.], seq 1153043:1161287, ack 868, win 65535, length 8244
13:20:23.336634 IP 10.0.2.15.42626 > 151.101.117.164.443: Flags [.], ack 1161287, win 65535, length 0
13:20:23.337316 IP 151.101.117.164.443 > 10.0.2.15.42626: Flags [P.], seq 1161287:1170905, ack 868, win 65535, length 9618
13:20:23.337436 IP 10.0.2.15.42626 > 151.101.117.164.443: Flags [.], ack 1170905, win 65535, length 0
13:20:23.337811 IP 151.101.117.164.443 > 10.0.2.15.42626: Flags [P.], seq 1170905:1177775, ack 868, win 65535, length 6870
13:20:23.337883 IP 10.0.2.15.42626 > 151.101.117.164.443: Flags [.], ack 1177775, win 65535, length 0
13:20:23.338412 IP 151.101.117.164.443 > 10.0.2.15.42626: Flags [P.], seq 1177775:1187393, ack 868, win 65535, length 9618
13:20:23.338427 IP 10.0.2.15.42626 > 151.101.117.164.443: Flags [.], ack 1187393, win 65535, length 0
13:20:23.339091 IP 151.101.117.164.443 > 10.0.2.15.42626: Flags [P.], seq 1187393:1194263, ack 868, win 65535, length 6870
13:20:23.339104 IP 10.0.2.15.42626 > 151.101.117.164.443: Flags [.], ack 1194263, win 65535, length 0
13:20:23.339265 IP 151.101.117.164.443 > 10.0.2.15.42626: Flags [.], seq 1194263:1197183, ack 868, win 65535, length 2920
13:20:23.339291 IP 10.0.2.15.42626 > 151.101.117.164.443: Flags [.], ack 1197183, win 65535, length 0
13:20:23.339400 IP 151.101.117.164.443 > 10.0.2.15.42626: Flags [P.], seq 1197183:1198385, ack 868, win 65535, length 1202
13:20:23.341354 IP 151.101.117.164.443 > 10.0.2.15.42626: Flags [P.], seq 1198385:1205255, ack 868, win 65535, length 6870
13:20:23.341377 IP 10.0.2.15.42626 > 151.101.117.164.443: Flags [.], ack 1205255, win 65535, length 0
13:20:23.341744 IP 151.101.117.164.443 > 10.0.2.15.42626: Flags [P.], seq 1205255:1212125, ack 868, win 65535, length 6870
13:20:23.341755 IP 10.0.2.15.42626 > 151.101.117.164.443: Flags [.], ack 1212125, win 65535, length 0
13:20:23.342024 IP 151.101.117.164.443 > 10.0.2.15.42626: Flags [.], seq 1212125:1215045, ack 868, win 65535, length 2920
13:20:23.342036 IP 10.0.2.15.42626 > 151.101.117.164.443: Flags [.], ack 1215045, win 65535, length 0
13:20:23.342125 IP 151.101.117.164.443 > 10.0.2.15.42626: Flags [P.], seq 1215045:1216247, ack 868, win 65535, length 1202
13:20:23.342952 IP 151.101.117.164.443 > 10.0.2.15.42626: Flags [P.], seq 1216247:1225865, ack 868, win 65535, length 9618
13:20:23.343013 IP 10.0.2.15.42626 > 151.101.117.164.443: Flags [.], ack 1225865, win 65535, length 0
13:20:23.344010 IP 151.101.117.164.443 > 10.0.2.15.42626: Flags [P.], seq 1225865:1231361, ack 868, win 65535, length 5496
13:20:23.344082 IP 10.0.2.15.42626 > 151.101.117.164.443: Flags [.], ack 1231361, win 65535, length 0

