19:58:05.023560 IP 10.0.2.15.55710 > 140.233.253.2.53: 45945+ A? www.nytimes.com. (33)
19:58:05.023591 IP 10.0.2.15.55710 > 140.233.253.2.53: 27260+ AAAA? www.nytimes.com. (33)
19:58:05.030664 IP 140.233.253.2.53 > 10.0.2.15.55710: 45945 3/0/0 CNAME www.prd.map.nytimes.com., CNAME nytimes.map.fastly.net., A 151.101.117.164 (111)
19:58:05.032514 IP 140.233.253.2.53 > 10.0.2.15.55710: 27260 2/1/0 CNAME www.prd.map.nytimes.com., CNAME nytimes.map.fastly.net. (153)
19:58:05.032775 IP 10.0.2.15.44130 > 151.101.117.164.443: Flags [S], seq 603480609, win 64240, options [mss 1460,sackOK,TS val 917688115 ecr 0,nop,wscale 6], length 0
19:58:05.057869 IP 151.101.117.164.443 > 10.0.2.15.44130: Flags [S.], seq 210752001, ack 603480610, win 65535, options [mss 1460], length 0
19:58:05.057913 IP 10.0.2.15.44130 > 151.101.117.164.443: Flags [.], ack 1, win 64240, length 0
19:58:05.069556 IP 10.0.2.15.44130 > 151.101.117.164.443: Flags [P.], seq 1:518, ack 1, win 64240, length 517
19:58:05.069886 IP 151.101.117.164.443 > 10.0.2.15.44130: Flags [.], ack 518, win 65535, length 0
19:58:05.087866 IP 151.101.117.164.443 > 10.0.2.15.44130: Flags [.], seq 1:2921, ack 518, win 65535, length 2920
19:58:05.087893 IP 10.0.2.15.44130 > 151.101.117.164.443: Flags [.], ack 2921, win 62780, length 0
19:58:05.088591 IP 151.101.117.164.443 > 10.0.2.15.44130: Flags [P.], seq 2921:4123, ack 518, win 65535, length 1202
19:58:05.088620 IP 10.0.2.15.44130 > 151.101.117.164.443: Flags [.], ack 4123, win 61578, length 0
19:58:05.088862 IP 151.101.117.164.443 > 10.0.2.15.44130: Flags [P.], seq 4123:5497, ack 518, win 65535, length 1374
19:58:05.088902 IP 10.0.2.15.44130 > 151.101.117.164.443: Flags [.], ack 5497, win 62780, length 0
19:58:05.089727 IP 151.101.117.164.443 > 10.0.2.15.44130: Flags [P.], seq 5497:5607, ack 518, win 65535, length 110
19:58:05.089751 IP 10.0.2.15.44130 > 151.101.117.164.443: Flags [.], ack 5607, win 62780, length 0
19:58:05.091212 IP 10.0.2.15.44130 > 151.101.117.164.443: Flags [P.], seq 518:611, ack 5607, win 62780, length 93
19:58:05.091697 IP 151.101.117.164.443 > 10.0.2.15.44130: Flags [.], ack 611, win 65535, length 0
19:58:05.107276 IP 151.101.117.164.443 > 10.0.2.15.44130: Flags [P.], seq 5607:5658, ack 611, win 65535, length 51
19:58:05.107297 IP 10.0.2.15.44130 > 151.101.117.164.443: Flags [.], ack 5658, win 62780, length 0
19:58:05.107776 IP 10.0.2.15.44130 > 151.101.117.164.443: Flags [P.], seq 611:664, ack 5658, win 62780, length 53
19:58:05.107814 IP 10.0.2.15.44130 > 151.101.117.164.443: Flags [P.], seq 664:720, ack 5658, win 62780, length 56
19:58:05.108074 IP 151.101.117.164.443 > 10.0.2.15.44130: Flags [.], ack 664, win 65535, length 0
19:58:05.108094 IP 10.0.2.15.44130 > 151.101.117.164.443: Flags [P.], seq 720:831, ack 5658, win 62780, length 111
19:58:05.108255 IP 151.101.117.164.443 > 10.0.2.15.44130: Flags [.], ack 720, win 65535, length 0
19:58:05.108256 IP 151.101.117.164.443 > 10.0.2.15.44130: Flags [.], ack 831, win 65535, length 0
19:58:05.122758 IP 151.101.117.164.443 > 10.0.2.15.44130: Flags [P.], seq 5658:5724, ack 831, win 65535, length 66
19:58:05.122779 IP 10.0.2.15.44130 > 151.101.117.164.443: Flags [.], ack 5724, win 62780, length 0
19:58:05.123102 IP 10.0.2.15.44130 > 151.101.117.164.443: Flags [P.], seq 831:869, ack 5724, win 62780, length 38
19:58:05.123357 IP 151.101.117.164.443 > 10.0.2.15.44130: Flags [.], ack 869, win 65535, length 0
19:58:05.151210 IP 151.101.117.164.443 > 10.0.2.15.44130: Flags [P.], seq 5724:9846, ack 869, win 65535, length 4122
19:58:05.151321 IP 10.0.2.15.44130 > 151.101.117.164.443: Flags [.], ack 9846, win 61320, length 0
19:58:05.152445 IP 151.101.117.164.443 > 10.0.2.15.44130: Flags [P.], seq 9846:15342, ack 869, win 65535, length 5496
19:58:05.152464 IP 10.0.2.15.44130 > 151.101.117.164.443: Flags [.], ack 15342, win 61320, length 0
19:58:05.153693 IP 151.101.117.164.443 > 10.0.2.15.44130: Flags [P.], seq 15342:18090, ack 869, win 65535, length 2748
19:58:05.153712 IP 10.0.2.15.44130 > 151.101.117.164.443: Flags [.], ack 18090, win 62780, length 0
19:58:05.154155 IP 151.101.117.164.443 > 10.0.2.15.44130: Flags [P.], seq 18090:20838, ack 869, win 65535, length 2748
19:58:05.154209 IP 10.0.2.15.44130 > 151.101.117.164.443: Flags [.], ack 20838, win 61320, length 0
19:58:05.155478 IP 151.101.117.164.443 > 10.0.2.15.44130: Flags [P.], seq 20838:23586, ack 869, win 65535, length 2748
19:58:05.155577 IP 10.0.2.15.44130 > 151.101.117.164.443: Flags [.], ack 23586, win 62780, length 0
19:58:05.156569 IP 151.101.117.164.443 > 10.0.2.15.44130: Flags [P.], seq 23586:27708, ack 869, win 65535, length 4122
19:58:05.156654 IP 10.0.2.15.44130 > 151.101.117.164.443: Flags [.], ack 27708, win 61320, length 0
19:58:05.157680 IP 151.101.117.164.443 > 10.0.2.15.44130: Flags [P.], seq 27708:31830, ack 869, win 65535, length 4122
19:58:05.157833 IP 10.0.2.15.44130 > 151.101.117.164.443: Flags [.], ack 31830, win 61320, length 0
19:58:05.158679 IP 151.101.117.164.443 > 10.0.2.15.44130: Flags [P.], seq 31830:34578, ack 869, win 65535, length 2748
19:58:05.158713 IP 10.0.2.15.44130 > 151.101.117.164.443: Flags [.], ack 34578, win 62780, length 0
19:58:05.160092 IP 151.101.117.164.443 > 10.0.2.15.44130: Flags [P.], seq 34578:38700, ack 869, win 65535, length 4122
19:58:05.160273 IP 10.0.2.15.44130 > 151.101.117.164.443: Flags [.], ack 38700, win 61320, length 0
19:58:05.160811 IP 151.101.117.164.443 > 10.0.2.15.44130: Flags [P.], seq 38700:40074, ack 869, win 65535, length 1374
19:58:05.161936 IP 151.101.117.164.443 > 10.0.2.15.44130: Flags [P.], seq 40074:45570, ack 869, win 65535, length 5496
19:58:05.161956 IP 10.0.2.15.44130 > 151.101.117.164.443: Flags [.], ack 45570, win 61320, length 0
19:58:05.162903 IP 151.101.117.164.443 > 10.0.2.15.44130: Flags [P.], seq 45570:48318, ack 869, win 65535, length 2748
19:58:05.162917 IP 10.0.2.15.44130 > 151.101.117.164.443: Flags [.], ack 48318, win 62780, length 0
19:58:05.164155 IP 151.101.117.164.443 > 10.0.2.15.44130: Flags [P.], seq 48318:52440, ack 869, win 65535, length 4122
19:58:05.164373 IP 10.0.2.15.44130 > 151.101.117.164.443: Flags [.], ack 52440, win 61320, length 0
19:58:05.165106 IP 151.101.117.164.443 > 10.0.2.15.44130: Flags [P.], seq 52440:53814, ack 869, win 65535, length 1374
19:58:05.167077 IP 151.101.117.164.443 > 10.0.2.15.44130: Flags [P.], seq 53814:57936, ack 869, win 65535, length 4122
19:58:05.167099 IP 10.0.2.15.44130 > 151.101.117.164.443: Flags [.], ack 57936, win 61320, length 0
19:58:05.167366 IP 151.101.117.164.443 > 10.0.2.15.44130: Flags [P.], seq 57936:60684, ack 869, win 65535, length 2748
19:58:05.167439 IP 10.0.2.15.44130 > 151.101.117.164.443: Flags [.], ack 60684, win 59860, length 0
19:58:05.168177 IP 151.101.117.164.443 > 10.0.2.15.44130: Flags [P.], seq 60684:66180, ack 869, win 65535, length 5496
19:58:05.168188 IP 10.0.2.15.44130 > 151.101.117.164.443: Flags [.], ack 66180, win 61320, length 0
19:58:05.169404 IP 151.101.117.164.443 > 10.0.2.15.44130: Flags [P.], seq 66180:68928, ack 869, win 65535, length 2748
19:58:05.169421 IP 10.0.2.15.44130 > 151.101.117.164.443: Flags [.], ack 68928, win 62780, length 0
19:58:05.170466 IP 151.101.117.164.443 > 10.0.2.15.44130: Flags [P.], seq 68928:71676, ack 869, win 65535, length 2748
19:58:05.170482 IP 10.0.2.15.44130 > 151.101.117.164.443: Flags [.], ack 71676, win 65535, length 0
19:58:05.171475 IP 151.101.117.164.443 > 10.0.2.15.44130: Flags [P.], seq 71676:75798, ack 869, win 65535, length 4122
19:58:05.171490 IP 10.0.2.15.44130 > 151.101.117.164.443: Flags [.], ack 75798, win 65535, length 0
19:58:05.172532 IP 151.101.117.164.443 > 10.0.2.15.44130: Flags [P.], seq 75798:79920, ack 869, win 65535, length 4122
19:58:05.172548 IP 10.0.2.15.44130 > 151.101.117.164.443: Flags [.], ack 79920, win 65535, length 0
19:58:05.173660 IP 151.101.117.164.443 > 10.0.2.15.44130: Flags [P.], seq 79920:84042, ack 869, win 65535, length 4122
19:58:05.173684 IP 10.0.2.15.44130 > 151.101.117.164.443: Flags [.], ack 84042, win 65535, length 0
19:58:05.174529 IP 151.101.117.164.443 > 10.0.2.15.44130: Flags [P.], seq 84042:89538, ack 869, win 65535, length 5496
19:58:05.174540 IP 10.0.2.15.44130 > 151.101.117.164.443: Flags [.], ack 89538, win 65535, length 0
19:58:05.175430 IP 151.101.117.164.443 > 10.0.2.15.44130: Flags [P.], seq 89538:93660, ack 869, win 65535, length 4122
19:58:05.175444 IP 10.0.2.15.44130 > 151.101.117.164.443: Flags [.], ack 93660, win 65535, length 0
19:58:05.176610 IP 151.101.117.164.443 > 10.0.2.15.44130: Flags [P.], seq 93660:97782, ack 869, win 65535, length 4122
19:58:05.176625 IP 10.0.2.15.44130 > 151.101.117.164.443: Flags [.], ack 97782, win 65535, length 0
19:58:05.177701 IP 151.101.117.164.443 > 10.0.2.15.44130: Flags [P.], seq 97782:101904, ack 869, win 65535, length 4122
19:58:05.177714 IP 10.0.2.15.44130 > 151.101.117.164.443: Flags [.], ack 101904, win 65535, length 0
19:58:05.178799 IP 151.101.117.164.443 > 10.0.2.15.44130: Flags [P.], seq 101904:106026, ack 869, win 65535, length 4122
19:58:05.178818 IP 10.0.2.15.44130 > 151.101.117.164.443: Flags [.], ack 106026, win 65535, length 0
19:58:05.179861 IP 151.101.117.164.443 > 10.0.2.15.44130: Flags [P.], seq 106026:111522, ack 869, win 65535, length 5496
19:58:05.179880 IP 10.0.2.15.44130 > 151.101.117.164.443: Flags [.], ack 111522, win 65535, length 0
19:58:05.180886 IP 151.101.117.164.443 > 10.0.2.15.44130: Flags [P.], seq 111522:117018, ack 869, win 65535, length 5496
19:58:05.180888 IP 151.101.117.164.443 > 10.0.2.15.44130: Flags [P.], seq 117018:118392, ack 869, win 65535, length 1374
19:58:05.180905 IP 10.0.2.15.44130 > 151.101.117.164.443: Flags [.], ack 117018, win 65535, length 0
19:58:05.182305 IP 151.101.117.164.443 > 10.0.2.15.44130: Flags [P.], seq 118392:126636, ack 869, win 65535, length 8244
19:58:05.182306 IP 151.101.117.164.443 > 10.0.2.15.44130: Flags [P.], seq 126636:128010, ack 869, win 65535, length 1374
19:58:05.182307 IP 151.101.117.164.443 > 10.0.2.15.44130: Flags [P.], seq 128010:132132, ack 869, win 65535, length 4122
19:58:05.182320 IP 10.0.2.15.44130 > 151.101.117.164.443: Flags [.], ack 126636, win 65535, length 0
19:58:05.182351 IP 10.0.2.15.44130 > 151.101.117.164.443: Flags [.], ack 132132, win 65535, length 0
19:58:05.182534 IP 151.101.117.164.443 > 10.0.2.15.44130: Flags [P.], seq 132132:133506, ack 869, win 65535, length 1374
19:58:05.184186 IP 151.101.117.164.443 > 10.0.2.15.44130: Flags [P.], seq 133506:140376, ack 869, win 65535, length 6870
19:58:05.184189 IP 151.101.117.164.443 > 10.0.2.15.44130: Flags [P.], seq 140376:141750, ack 869, win 65535, length 1374
19:58:05.184210 IP 10.0.2.15.44130 > 151.101.117.164.443: Flags [.], ack 140376, win 65535, length 0
19:58:05.184520 IP 151.101.117.164.443 > 10.0.2.15.44130: Flags [P.], seq 141750:144498, ack 869, win 65535, length 2748
19:58:05.184522 IP 151.101.117.164.443 > 10.0.2.15.44130: Flags [P.], seq 144498:147246, ack 869, win 65535, length 2748
19:58:05.184523 IP 151.101.117.164.443 > 10.0.2.15.44130: Flags [P.], seq 147246:148620, ack 869, win 65535, length 1374
19:58:05.184541 IP 10.0.2.15.44130 > 151.101.117.164.443: Flags [.], ack 144498, win 65535, length 0
19:58:05.184669 IP 10.0.2.15.44130 > 151.101.117.164.443: Flags [.], ack 147246, win 65535, length 0
19:58:05.184878 IP 151.101.117.164.443 > 10.0.2.15.44130: Flags [P.], seq 148620:152742, ack 869, win 65535, length 4122
19:58:05.184891 IP 10.0.2.15.44130 > 151.101.117.164.443: Flags [.], ack 152742, win 65535, length 0
19:58:05.186400 IP 151.101.117.164.443 > 10.0.2.15.44130: Flags [P.], seq 152742:159612, ack 869, win 65535, length 6870
19:58:05.186403 IP 151.101.117.164.443 > 10.0.2.15.44130: Flags [P.], seq 159612:163734, ack 869, win 65535, length 4122
19:58:05.186422 IP 10.0.2.15.44130 > 151.101.117.164.443: Flags [.], ack 159612, win 65535, length 0
19:58:05.186532 IP 10.0.2.15.44130 > 151.101.117.164.443: Flags [.], ack 163734, win 65535, length 0
19:58:05.187003 IP 151.101.117.164.443 > 10.0.2.15.44130: Flags [P.], seq 163734:167856, ack 869, win 65535, length 4122
19:58:05.187005 IP 151.101.117.164.443 > 10.0.2.15.44130: Flags [P.], seq 167856:169230, ack 869, win 65535, length 1374
19:58:05.187138 IP 10.0.2.15.44130 > 151.101.117.164.443: Flags [.], ack 169230, win 65535, length 0
19:58:05.189026 IP 151.101.117.164.443 > 10.0.2.15.44130: Flags [P.], seq 169230:177474, ack 869, win 65535, length 8244
19:58:05.189028 IP 151.101.117.164.443 > 10.0.2.15.44130: Flags [P.], seq 177474:180222, ack 869, win 65535, length 2748
19:58:05.189053 IP 10.0.2.15.44130 > 151.101.117.164.443: Flags [.], ack 177474, win 65535, length 0
19:58:05.189093 IP 10.0.2.15.44130 > 151.101.117.164.443: Flags [.], ack 180222, win 65535, length 0
19:58:05.189127 IP 151.101.117.164.443 > 10.0.2.15.44130: Flags [P.], seq 180222:182970, ack 869, win 65535, length 2748
19:58:05.189129 IP 151.101.117.164.443 > 10.0.2.15.44130: Flags [P.], seq 182970:185718, ack 869, win 65535, length 2748
19:58:05.189129 IP 151.101.117.164.443 > 10.0.2.15.44130: Flags [P.], seq 185718:187092, ack 869, win 65535, length 1374
19:58:05.189130 IP 151.101.117.164.443 > 10.0.2.15.44130: Flags [P.], seq 187092:188466, ack 869, win 65535, length 1374
19:58:05.189140 IP 10.0.2.15.44130 > 151.101.117.164.443: Flags [.], ack 182970, win 65535, length 0
19:58:05.189156 IP 10.0.2.15.44130 > 151.101.117.164.443: Flags [.], ack 185718, win 65535, length 0
19:58:05.189170 IP 10.0.2.15.44130 > 151.101.117.164.443: Flags [.], ack 188466, win 65535, length 0
19:58:05.190846 IP 151.101.117.164.443 > 10.0.2.15.44130: Flags [P.], seq 188466:196710, ack 869, win 65535, length 8244
19:58:05.190849 IP 151.101.117.164.443 > 10.0.2.15.44130: Flags [P.], seq 196710:202206, ack 869, win 65535, length 5496
19:58:05.190869 IP 10.0.2.15.44130 > 151.101.117.164.443: Flags [.], ack 196710, win 65535, length 0
19:58:05.190900 IP 10.0.2.15.44130 > 151.101.117.164.443: Flags [.], ack 202206, win 65535, length 0
19:58:05.191151 IP 151.101.117.164.443 > 10.0.2.15.44130: Flags [P.], seq 202206:203580, ack 869, win 65535, length 1374
19:58:05.191153 IP 151.101.117.164.443 > 10.0.2.15.44130: Flags [P.], seq 203580:207702, ack 869, win 65535, length 4122
19:58:05.191164 IP 10.0.2.15.44130 > 151.101.117.164.443: Flags [.], ack 207702, win 65535, length 0
19:58:05.191259 IP 151.101.117.164.443 > 10.0.2.15.44130: Flags [P.], seq 207702:209076, ack 869, win 65535, length 1374
19:58:05.193029 IP 151.101.117.164.443 > 10.0.2.15.44130: Flags [P.], seq 209076:215946, ack 869, win 65535, length 6870
19:58:05.193032 IP 151.101.117.164.443 > 10.0.2.15.44130: Flags [P.], seq 215946:220068, ack 869, win 65535, length 4122
19:58:05.193085 IP 10.0.2.15.44130 > 151.101.117.164.443: Flags [.], ack 215946, win 65535, length 0
19:58:05.193285 IP 10.0.2.15.44130 > 151.101.117.164.443: Flags [.], ack 220068, win 65535, length 0
19:58:05.193375 IP 151.101.117.164.443 > 10.0.2.15.44130: Flags [P.], seq 220068:222816, ack 869, win 65535, length 2748
19:58:05.193377 IP 151.101.117.164.443 > 10.0.2.15.44130: Flags [P.], seq 222816:225564, ack 869, win 65535, length 2748
19:58:05.193389 IP 10.0.2.15.44130 > 151.101.117.164.443: Flags [.], ack 222816, win 65535, length 0
19:58:05.193409 IP 10.0.2.15.44130 > 151.101.117.164.443: Flags [.], ack 225564, win 65535, length 0
19:58:05.193798 IP 151.101.117.164.443 > 10.0.2.15.44130: Flags [P.], seq 225564:226938, ack 869, win 65535, length 1374
19:58:05.193800 IP 151.101.117.164.443 > 10.0.2.15.44130: Flags [P.], seq 226938:229686, ack 869, win 65535, length 2748
19:58:05.193816 IP 10.0.2.15.44130 > 151.101.117.164.443: Flags [.], ack 229686, win 65535, length 0
19:58:05.195708 IP 151.101.117.164.443 > 10.0.2.15.44130: Flags [P.], seq 229686:237930, ack 869, win 65535, length 8244
19:58:05.195711 IP 151.101.117.164.443 > 10.0.2.15.44130: Flags [P.], seq 237930:240678, ack 869, win 65535, length 2748
19:58:05.195768 IP 10.0.2.15.44130 > 151.101.117.164.443: Flags [.], ack 237930, win 65535, length 0
19:58:05.195835 IP 10.0.2.15.44130 > 151.101.117.164.443: Flags [.], ack 240678, win 65535, length 0
19:58:05.196030 IP 151.101.117.164.443 > 10.0.2.15.44130: Flags [P.], seq 240678:243426, ack 869, win 65535, length 2748
19:58:05.196031 IP 151.101.117.164.443 > 10.0.2.15.44130: Flags [P.], seq 243426:247548, ack 869, win 65535, length 4122
19:58:05.196040 IP 151.101.117.164.443 > 10.0.2.15.44130: Flags [P.], seq 247548:250296, ack 869, win 65535, length 2748
19:58:05.196052 IP 10.0.2.15.44130 > 151.101.117.164.443: Flags [.], ack 243426, win 65535, length 0
19:58:05.196071 IP 10.0.2.15.44130 > 151.101.117.164.443: Flags [.], ack 247548, win 65535, length 0
19:58:05.196082 IP 10.0.2.15.44130 > 151.101.117.164.443: Flags [.], ack 250296, win 65535, length 0
19:58:05.196389 IP 151.101.117.164.443 > 10.0.2.15.44130: Flags [P.], seq 250296:253044, ack 869, win 65535, length 2748
19:58:05.196390 IP 151.101.117.164.443 > 10.0.2.15.44130: Flags [P.], seq 253044:255792, ack 869, win 65535, length 2748
19:58:05.196405 IP 10.0.2.15.44130 > 151.101.117.164.443: Flags [.], ack 253044, win 65535, length 0
19:58:05.196563 IP 10.0.2.15.44130 > 151.101.117.164.443: Flags [.], ack 255792, win 65535, length 0
19:58:05.197006 IP 151.101.117.164.443 > 10.0.2.15.44130: Flags [P.], seq 255792:262662, ack 869, win 65535, length 6870
19:58:05.197023 IP 10.0.2.15.44130 > 151.101.117.164.443: Flags [.], ack 262662, win 65535, length 0
19:58:05.197510 IP 151.101.117.164.443 > 10.0.2.15.44130: Flags [P.], seq 262662:269532, ack 869, win 65535, length 6870
19:58:05.197512 IP 151.101.117.164.443 > 10.0.2.15.44130: Flags [P.], seq 269532:270906, ack 869, win 65535, length 1374
19:58:05.197538 IP 10.0.2.15.44130 > 151.101.117.164.443: Flags [.], ack 269532, win 65535, length 0
19:58:05.198233 IP 151.101.117.164.443 > 10.0.2.15.44130: Flags [P.], seq 270906:275028, ack 869, win 65535, length 4122
19:58:05.198254 IP 10.0.2.15.44130 > 151.101.117.164.443: Flags [.], ack 275028, win 65535, length 0
19:58:05.199280 IP 151.101.117.164.443 > 10.0.2.15.44130: Flags [P.], seq 275028:280524, ack 869, win 65535, length 5496
19:58:05.199308 IP 151.101.117.164.443 > 10.0.2.15.44130: Flags [P.], seq 280524:283272, ack 869, win 65535, length 2748
19:58:05.199309 IP 151.101.117.164.443 > 10.0.2.15.44130: Flags [P.], seq 283272:284646, ack 869, win 65535, length 1374
19:58:05.199333 IP 10.0.2.15.44130 > 151.101.117.164.443: Flags [.], ack 280524, win 65535, length 0
19:58:05.199386 IP 10.0.2.15.44130 > 151.101.117.164.443: Flags [.], ack 283272, win 65535, length 0
19:58:05.199571 IP 151.101.117.164.443 > 10.0.2.15.44130: Flags [P.], seq 284646:287394, ack 869, win 65535, length 2748
19:58:05.199572 IP 151.101.117.164.443 > 10.0.2.15.44130: Flags [P.], seq 287394:288768, ack 869, win 65535, length 1374
19:58:05.199583 IP 10.0.2.15.44130 > 151.101.117.164.443: Flags [.], ack 287394, win 65535, length 0
19:58:05.199859 IP 151.101.117.164.443 > 10.0.2.15.44130: Flags [P.], seq 288768:291516, ack 869, win 65535, length 2748
19:58:05.199861 IP 151.101.117.164.443 > 10.0.2.15.44130: Flags [P.], seq 291516:295638, ack 869, win 65535, length 4122
19:58:05.199874 IP 10.0.2.15.44130 > 151.101.117.164.443: Flags [.], ack 291516, win 65535, length 0
19:58:05.199944 IP 10.0.2.15.44130 > 151.101.117.164.443: Flags [.], ack 295638, win 65535, length 0
19:58:05.200105 IP 151.101.117.164.443 > 10.0.2.15.44130: Flags [P.], seq 295638:297012, ack 869, win 65535, length 1374
19:58:05.200573 IP 151.101.117.164.443 > 10.0.2.15.44130: Flags [P.], seq 297012:299760, ack 869, win 65535, length 2748
19:58:05.200574 IP 151.101.117.164.443 > 10.0.2.15.44130: Flags [P.], seq 299760:301134, ack 869, win 65535, length 1374
19:58:05.200575 IP 151.101.117.164.443 > 10.0.2.15.44130: Flags [P.], seq 301134:303882, ack 869, win 65535, length 2748
19:58:05.200575 IP 151.101.117.164.443 > 10.0.2.15.44130: Flags [P.], seq 303882:305256, ack 869, win 65535, length 1374
19:58:05.200590 IP 10.0.2.15.44130 > 151.101.117.164.443: Flags [.], ack 299760, win 65535, length 0
19:58:05.200609 IP 10.0.2.15.44130 > 151.101.117.164.443: Flags [.], ack 303882, win 65535, length 0
19:58:05.201820 IP 151.101.117.164.443 > 10.0.2.15.44130: Flags [P.], seq 305256:310752, ack 869, win 65535, length 5496
19:58:05.201822 IP 151.101.117.164.443 > 10.0.2.15.44130: Flags [P.], seq 310752:313500, ack 869, win 65535, length 2748
19:58:05.201823 IP 151.101.117.164.443 > 10.0.2.15.44130: Flags [P.], seq 313500:316248, ack 869, win 65535, length 2748
19:58:05.201839 IP 10.0.2.15.44130 > 151.101.117.164.443: Flags [.], ack 310752, win 65535, length 0
19:58:05.201868 IP 10.0.2.15.44130 > 151.101.117.164.443: Flags [.], ack 313500, win 65535, length 0
19:58:05.201883 IP 10.0.2.15.44130 > 151.101.117.164.443: Flags [.], ack 316248, win 65535, length 0
19:58:05.201906 IP 151.101.117.164.443 > 10.0.2.15.44130: Flags [.], seq 316248:319168, ack 869, win 65535, length 2920
19:58:05.201910 IP 10.0.2.15.44130 > 151.101.117.164.443: Flags [.], ack 319168, win 65535, length 0
19:58:05.202024 IP 151.101.117.164.443 > 10.0.2.15.44130: Flags [P.], seq 319168:320370, ack 869, win 65535, length 1202
19:58:05.202145 IP 151.101.117.164.443 > 10.0.2.15.44130: Flags [P.], seq 320370:323118, ack 869, win 65535, length 2748
19:58:05.202151 IP 10.0.2.15.44130 > 151.101.117.164.443: Flags [.], ack 323118, win 65535, length 0
19:58:05.202533 IP 151.101.117.164.443 > 10.0.2.15.44130: Flags [P.], seq 323118:325866, ack 869, win 65535, length 2748
19:58:05.202535 IP 151.101.117.164.443 > 10.0.2.15.44130: Flags [P.], seq 325866:329988, ack 869, win 65535, length 4122
19:58:05.202551 IP 10.0.2.15.44130 > 151.101.117.164.443: Flags [.], ack 325866, win 65535, length 0
19:58:05.202577 IP 10.0.2.15.44130 > 151.101.117.164.443: Flags [.], ack 329988, win 65535, length 0
19:58:05.202967 IP 151.101.117.164.443 > 10.0.2.15.44130: Flags [P.], seq 329988:332736, ack 869, win 65535, length 2748
19:58:05.202969 IP 151.101.117.164.443 > 10.0.2.15.44130: Flags [P.], seq 332736:335484, ack 869, win 65535, length 2748
19:58:05.202984 IP 10.0.2.15.44130 > 151.101.117.164.443: Flags [.], ack 332736, win 65535, length 0
19:58:05.203003 IP 10.0.2.15.44130 > 151.101.117.164.443: Flags [.], ack 335484, win 65535, length 0
19:58:05.203533 IP 151.101.117.164.443 > 10.0.2.15.44130: Flags [P.], seq 335484:340980, ack 869, win 65535, length 5496
19:58:05.203549 IP 10.0.2.15.44130 > 151.101.117.164.443: Flags [.], ack 340980, win 65535, length 0
19:58:05.203830 IP 151.101.117.164.443 > 10.0.2.15.44130: Flags [P.], seq 340980:343728, ack 869, win 65535, length 2748
19:58:05.203832 IP 151.101.117.164.443 > 10.0.2.15.44130: Flags [P.], seq 343728:346476, ack 869, win 65535, length 2748
19:58:05.203912 IP 10.0.2.15.44130 > 151.101.117.164.443: Flags [.], ack 343728, win 65535, length 0
19:58:05.204029 IP 10.0.2.15.44130 > 151.101.117.164.443: Flags [.], ack 346476, win 65535, length 0
19:58:05.204154 IP 151.101.117.164.443 > 10.0.2.15.44130: Flags [P.], seq 346476:349224, ack 869, win 65535, length 2748
19:58:05.204155 IP 151.101.117.164.443 > 10.0.2.15.44130: Flags [P.], seq 349224:351972, ack 869, win 65535, length 2748
19:58:05.204164 IP 10.0.2.15.44130 > 151.101.117.164.443: Flags [.], ack 349224, win 65535, length 0
19:58:05.204175 IP 10.0.2.15.44130 > 151.101.117.164.443: Flags [.], ack 351972, win 65535, length 0
19:58:05.205011 IP 151.101.117.164.443 > 10.0.2.15.44130: Flags [P.], seq 351972:354720, ack 869, win 65535, length 2748
19:58:05.205014 IP 151.101.117.164.443 > 10.0.2.15.44130: Flags [P.], seq 354720:358842, ack 869, win 65535, length 4122
19:58:05.205033 IP 10.0.2.15.44130 > 151.101.117.164.443: Flags [.], ack 354720, win 65535, length 0
19:58:05.205062 IP 10.0.2.15.44130 > 151.101.117.164.443: Flags [.], ack 358842, win 65535, length 0
19:58:05.205250 IP 151.101.117.164.443 > 10.0.2.15.44130: Flags [P.], seq 358842:361590, ack 869, win 65535, length 2748
19:58:05.205259 IP 10.0.2.15.44130 > 151.101.117.164.443: Flags [.], ack 361590, win 65535, length 0
19:58:05.205623 IP 151.101.117.164.443 > 10.0.2.15.44130: Flags [P.], seq 361590:365712, ack 869, win 65535, length 4122
19:58:05.205637 IP 10.0.2.15.44130 > 151.101.117.164.443: Flags [.], ack 365712, win 65535, length 0
19:58:05.205749 IP 151.101.117.164.443 > 10.0.2.15.44130: Flags [P.], seq 365712:371208, ack 869, win 65535, length 5496
19:58:05.205750 IP 151.101.117.164.443 > 10.0.2.15.44130: Flags [P.], seq 371208:372582, ack 869, win 65535, length 1374
19:58:05.205760 IP 10.0.2.15.44130 > 151.101.117.164.443: Flags [.], ack 371208, win 65535, length 0
19:58:05.206050 IP 151.101.117.164.443 > 10.0.2.15.44130: Flags [P.], seq 372582:375330, ack 869, win 65535, length 2748
19:58:05.206062 IP 10.0.2.15.44130 > 151.101.117.164.443: Flags [.], ack 375330, win 65535, length 0
19:58:05.206235 IP 151.101.117.164.443 > 10.0.2.15.44130: Flags [.], seq 375330:376790, ack 869, win 65535, length 1460
19:58:05.206554 IP 151.101.117.164.443 > 10.0.2.15.44130: Flags [P.], seq 376790:379452, ack 869, win 65535, length 2662
19:58:05.206556 IP 151.101.117.164.443 > 10.0.2.15.44130: Flags [P.], seq 379452:382200, ack 869, win 65535, length 2748
19:58:05.206592 IP 10.0.2.15.44130 > 151.101.117.164.443: Flags [.], ack 382200, win 65535, length 0
19:58:05.207068 IP 151.101.117.164.443 > 10.0.2.15.44130: Flags [P.], seq 382200:386322, ack 869, win 65535, length 4122
19:58:05.207070 IP 151.101.117.164.443 > 10.0.2.15.44130: Flags [P.], seq 386322:389070, ack 869, win 65535, length 2748
19:58:05.207089 IP 10.0.2.15.44130 > 151.101.117.164.443: Flags [.], ack 386322, win 65535, length 0
19:58:05.207168 IP 10.0.2.15.44130 > 151.101.117.164.443: Flags [.], ack 389070, win 65535, length 0
19:58:05.207393 IP 151.101.117.164.443 > 10.0.2.15.44130: Flags [P.], seq 389070:390444, ack 869, win 65535, length 1374
19:58:05.207396 IP 151.101.117.164.443 > 10.0.2.15.44130: Flags [.], seq 390444:394824, ack 869, win 65535, length 4380
19:58:05.207414 IP 10.0.2.15.44130 > 151.101.117.164.443: Flags [.], ack 394824, win 65535, length 0
19:58:05.207591 IP 151.101.117.164.443 > 10.0.2.15.44130: Flags [P.], seq 394824:395940, ack 869, win 65535, length 1116
19:58:05.207593 IP 151.101.117.164.443 > 10.0.2.15.44130: Flags [P.], seq 395940:397314, ack 869, win 65535, length 1374
19:58:05.207623 IP 10.0.2.15.44130 > 151.101.117.164.443: Flags [.], ack 397314, win 65535, length 0
19:58:05.207670 IP 151.101.117.164.443 > 10.0.2.15.44130: Flags [P.], seq 397314:398688, ack 869, win 65535, length 1374
19:58:05.208853 IP 151.101.117.164.443 > 10.0.2.15.44130: Flags [P.], seq 398688:403338, ack 869, win 65535, length 4650
19:58:05.208873 IP 10.0.2.15.44130 > 151.101.117.164.443: Flags [.], ack 403338, win 65535, length 0
19:58:05.209144 IP 151.101.117.164.443 > 10.0.2.15.44130: Flags [P.], seq 403338:406932, ack 869, win 65535, length 3594
19:58:05.209146 IP 151.101.117.164.443 > 10.0.2.15.44130: Flags [P.], seq 406932:408306, ack 869, win 65535, length 1374
19:58:05.209146 IP 151.101.117.164.443 > 10.0.2.15.44130: Flags [.], seq 408306:409766, ack 869, win 65535, length 1460
19:58:05.209161 IP 10.0.2.15.44130 > 151.101.117.164.443: Flags [.], ack 406932, win 65535, length 0
19:58:05.209180 IP 10.0.2.15.44130 > 151.101.117.164.443: Flags [.], ack 409766, win 65535, length 0
19:58:05.209288 IP 151.101.117.164.443 > 10.0.2.15.44130: Flags [P.], seq 409766:412428, ack 869, win 65535, length 2662
19:58:05.209292 IP 10.0.2.15.44130 > 151.101.117.164.443: Flags [.], ack 412428, win 65535, length 0
19:58:05.209399 IP 151.101.117.164.443 > 10.0.2.15.44130: Flags [P.], seq 412428:415176, ack 869, win 65535, length 2748
19:58:05.209405 IP 10.0.2.15.44130 > 151.101.117.164.443: Flags [.], ack 415176, win 65535, length 0
19:58:05.209622 IP 151.101.117.164.443 > 10.0.2.15.44130: Flags [P.], seq 415176:417924, ack 869, win 65535, length 2748
19:58:05.209631 IP 10.0.2.15.44130 > 151.101.117.164.443: Flags [.], ack 417924, win 65535, length 0
19:58:05.209826 IP 151.101.117.164.443 > 10.0.2.15.44130: Flags [P.], seq 417924:420672, ack 869, win 65535, length 2748
19:58:05.209833 IP 10.0.2.15.44130 > 151.101.117.164.443: Flags [.], ack 420672, win 65535, length 0
19:58:05.210626 IP 151.101.117.164.443 > 10.0.2.15.44130: Flags [P.], seq 420672:425318, ack 869, win 65535, length 4646
19:58:05.210641 IP 10.0.2.15.44130 > 151.101.117.164.443: Flags [.], ack 425318, win 65535, length 0
19:58:05.211428 IP 151.101.117.164.443 > 10.0.2.15.44130: Flags [P.], seq 425318:429414, ack 869, win 65535, length 4096
19:58:05.211430 IP 151.101.117.164.443 > 10.0.2.15.44130: Flags [P.], seq 429414:432162, ack 869, win 65535, length 2748
19:58:05.211431 IP 151.101.117.164.443 > 10.0.2.15.44130: Flags [P.], seq 432162:433536, ack 869, win 65535, length 1374
19:58:05.211432 IP 151.101.117.164.443 > 10.0.2.15.44130: Flags [P.], seq 433536:434910, ack 869, win 65535, length 1374
19:58:05.211432 IP 151.101.117.164.443 > 10.0.2.15.44130: Flags [P.], seq 434910:437658, ack 869, win 65535, length 2748
19:58:05.211497 IP 10.0.2.15.44130 > 151.101.117.164.443: Flags [.], ack 429414, win 65535, length 0
19:58:05.211596 IP 10.0.2.15.44130 > 151.101.117.164.443: Flags [.], ack 432162, win 65535, length 0
19:58:05.211622 IP 10.0.2.15.44130 > 151.101.117.164.443: Flags [.], ack 434910, win 65535, length 0
19:58:05.211682 IP 10.0.2.15.44130 > 151.101.117.164.443: Flags [.], ack 437658, win 65535, length 0
19:58:05.211751 IP 151.101.117.164.443 > 10.0.2.15.44130: Flags [P.], seq 437658:440406, ack 869, win 65535, length 2748
19:58:05.211752 IP 151.101.117.164.443 > 10.0.2.15.44130: Flags [P.], seq 440406:443154, ack 869, win 65535, length 2748
19:58:05.211753 IP 151.101.117.164.443 > 10.0.2.15.44130: Flags [P.], seq 443154:444528, ack 869, win 65535, length 1374
19:58:05.211753 IP 151.101.117.164.443 > 10.0.2.15.44130: Flags [P.], seq 444528:445902, ack 869, win 65535, length 1374
19:58:05.211761 IP 10.0.2.15.44130 > 151.101.117.164.443: Flags [.], ack 440406, win 65535, length 0
19:58:05.211776 IP 10.0.2.15.44130 > 151.101.117.164.443: Flags [.], ack 443154, win 65535, length 0
19:58:05.211789 IP 10.0.2.15.44130 > 151.101.117.164.443: Flags [.], ack 445902, win 65535, length 0
19:58:05.212015 IP 151.101.117.164.443 > 10.0.2.15.44130: Flags [P.], seq 445902:448650, ack 869, win 65535, length 2748
19:58:05.212025 IP 10.0.2.15.44130 > 151.101.117.164.443: Flags [.], ack 448650, win 65535, length 0
19:58:05.212416 IP 151.101.117.164.443 > 10.0.2.15.44130: Flags [P.], seq 448650:450024, ack 869, win 65535, length 1374
19:58:05.213633 IP 151.101.117.164.443 > 10.0.2.15.44130: Flags [P.], seq 450024:455520, ack 869, win 65535, length 5496
19:58:05.213635 IP 151.101.117.164.443 > 10.0.2.15.44130: Flags [P.], seq 455520:461016, ack 869, win 65535, length 5496
19:58:05.213653 IP 10.0.2.15.44130 > 151.101.117.164.443: Flags [.], ack 455520, win 65535, length 0
19:58:05.213687 IP 10.0.2.15.44130 > 151.101.117.164.443: Flags [.], ack 461016, win 65535, length 0
19:58:05.213710 IP 151.101.117.164.443 > 10.0.2.15.44130: Flags [P.], seq 461016:465138, ack 869, win 65535, length 4122
19:58:05.213711 IP 151.101.117.164.443 > 10.0.2.15.44130: Flags [P.], seq 465138:466512, ack 869, win 65535, length 1374
19:58:05.213717 IP 10.0.2.15.44130 > 151.101.117.164.443: Flags [.], ack 465138, win 65535, length 0
19:58:05.215318 IP 151.101.117.164.443 > 10.0.2.15.44130: Flags [P.], seq 466512:474258, ack 869, win 65535, length 7746
19:58:05.215341 IP 10.0.2.15.44130 > 151.101.117.164.443: Flags [.], ack 474258, win 65535, length 0
19:58:05.215833 IP 151.101.117.164.443 > 10.0.2.15.44130: Flags [P.], seq 474258:479754, ack 869, win 65535, length 5496
19:58:05.215835 IP 151.101.117.164.443 > 10.0.2.15.44130: Flags [P.], seq 479754:481128, ack 869, win 65535, length 1374
19:58:05.215836 IP 151.101.117.164.443 > 10.0.2.15.44130: Flags [P.], seq 481128:486624, ack 869, win 65535, length 5496
19:58:05.215849 IP 10.0.2.15.44130 > 151.101.117.164.443: Flags [.], ack 479754, win 65535, length 0
19:58:05.215895 IP 10.0.2.15.44130 > 151.101.117.164.443: Flags [.], ack 486624, win 65535, length 0
19:58:05.216201 IP 151.101.117.164.443 > 10.0.2.15.44130: Flags [P.], seq 486624:487998, ack 869, win 65535, length 1374
19:58:05.216214 IP 151.101.117.164.443 > 10.0.2.15.44130: Flags [P.], seq 487998:492120, ack 869, win 65535, length 4122
19:58:05.216215 IP 151.101.117.164.443 > 10.0.2.15.44130: Flags [P.], seq 492120:496242, ack 869, win 65535, length 4122
19:58:05.216228 IP 10.0.2.15.44130 > 151.101.117.164.443: Flags [.], ack 492120, win 65535, length 0
19:58:05.216242 IP 10.0.2.15.44130 > 151.101.117.164.443: Flags [.], ack 496242, win 65535, length 0
19:58:05.216974 IP 151.101.117.164.443 > 10.0.2.15.44130: Flags [P.], seq 496242:503112, ack 869, win 65535, length 6870
19:58:05.217050 IP 10.0.2.15.44130 > 151.101.117.164.443: Flags [.], ack 503112, win 65535, length 0
19:58:05.217219 IP 151.101.117.164.443 > 10.0.2.15.44130: Flags [P.], seq 503112:504486, ack 869, win 65535, length 1374
19:58:05.217220 IP 151.101.117.164.443 > 10.0.2.15.44130: Flags [P.], seq 504486:507234, ack 869, win 65535, length 2748
19:58:05.217233 IP 10.0.2.15.44130 > 151.101.117.164.443: Flags [.], ack 507234, win 65535, length 0
19:58:05.217546 IP 151.101.117.164.443 > 10.0.2.15.44130: Flags [P.], seq 507234:508608, ack 869, win 65535, length 1374
19:58:05.217547 IP 151.101.117.164.443 > 10.0.2.15.44130: Flags [P.], seq 508608:511356, ack 869, win 65535, length 2748
19:58:05.217562 IP 10.0.2.15.44130 > 151.101.117.164.443: Flags [.], ack 511356, win 65535, length 0
19:58:05.217691 IP 151.101.117.164.443 > 10.0.2.15.44130: Flags [P.], seq 511356:514104, ack 869, win 65535, length 2748
19:58:05.217700 IP 10.0.2.15.44130 > 151.101.117.164.443: Flags [.], ack 514104, win 65535, length 0
19:58:05.217873 IP 151.101.117.164.443 > 10.0.2.15.44130: Flags [P.], seq 514104:516852, ack 869, win 65535, length 2748
19:58:05.217874 IP 151.101.117.164.443 > 10.0.2.15.44130: Flags [P.], seq 516852:518226, ack 869, win 65535, length 1374
19:58:05.217883 IP 10.0.2.15.44130 > 151.101.117.164.443: Flags [.], ack 516852, win 65535, length 0
19:58:05.218009 IP 151.101.117.164.443 > 10.0.2.15.44130: Flags [P.], seq 518226:519600, ack 869, win 65535, length 1374
19:58:05.218014 IP 10.0.2.15.44130 > 151.101.117.164.443: Flags [.], ack 519600, win 65535, length 0
19:58:05.218210 IP 151.101.117.164.443 > 10.0.2.15.44130: Flags [P.], seq 519600:522348, ack 869, win 65535, length 2748
19:58:05.218211 IP 151.101.117.164.443 > 10.0.2.15.44130: Flags [.], seq 522348:523808, ack 869, win 65535, length 1460
19:58:05.218222 IP 10.0.2.15.44130 > 151.101.117.164.443: Flags [.], ack 522348, win 65535, length 0
19:58:05.218318 IP 151.101.117.164.443 > 10.0.2.15.44130: Flags [P.], seq 523808:525096, ack 869, win 65535, length 1288
19:58:05.218319 IP 151.101.117.164.443 > 10.0.2.15.44130: Flags [P.], seq 525096:526470, ack 869, win 65535, length 1374
19:58:05.218325 IP 10.0.2.15.44130 > 151.101.117.164.443: Flags [.], ack 525096, win 65535, length 0
19:58:05.219257 IP 151.101.117.164.443 > 10.0.2.15.44130: Flags [P.], seq 526470:531966, ack 869, win 65535, length 5496
19:58:05.219272 IP 10.0.2.15.44130 > 151.101.117.164.443: Flags [.], ack 531966, win 65535, length 0
19:58:05.220086 IP 151.101.117.164.443 > 10.0.2.15.44130: Flags [P.], seq 531966:537462, ack 869, win 65535, length 5496
19:58:05.220377 IP 151.101.117.164.443 > 10.0.2.15.44130: Flags [P.], seq 537462:540210, ack 869, win 65535, length 2748
19:58:05.220436 IP 151.101.117.164.443 > 10.0.2.15.44130: Flags [P.], seq 540210:544332, ack 869, win 65535, length 4122
19:58:05.220581 IP 151.101.117.164.443 > 10.0.2.15.44130: Flags [P.], seq 544332:547080, ack 869, win 65535, length 2748
19:58:05.220796 IP 151.101.117.164.443 > 10.0.2.15.44130: Flags [P.], seq 547080:551202, ack 869, win 65535, length 4122
19:58:05.220989 IP 151.101.117.164.443 > 10.0.2.15.44130: Flags [P.], seq 551202:553950, ack 869, win 65535, length 2748
19:58:05.221031 IP 10.0.2.15.44130 > 151.101.117.164.443: Flags [.], ack 553950, win 65535, length 0
19:58:05.221393 IP 151.101.117.164.443 > 10.0.2.15.44130: Flags [P.], seq 553950:556698, ack 869, win 65535, length 2748
19:58:05.221471 IP 151.101.117.164.443 > 10.0.2.15.44130: Flags [P.], seq 556698:560820, ack 869, win 65535, length 4122
19:58:05.221561 IP 151.101.117.164.443 > 10.0.2.15.44130: Flags [P.], seq 560820:563568, ack 869, win 65535, length 2748
19:58:05.221580 IP 10.0.2.15.44130 > 151.101.117.164.443: Flags [.], ack 563568, win 65535, length 0
19:58:05.221713 IP 151.101.117.164.443 > 10.0.2.15.44130: Flags [P.], seq 563568:566316, ack 869, win 65535, length 2748
19:58:05.221720 IP 10.0.2.15.44130 > 151.101.117.164.443: Flags [.], ack 566316, win 65535, length 0
19:58:05.221889 IP 151.101.117.164.443 > 10.0.2.15.44130: Flags [P.], seq 566316:569064, ack 869, win 65535, length 2748
19:58:05.221896 IP 10.0.2.15.44130 > 151.101.117.164.443: Flags [.], ack 569064, win 65535, length 0
19:58:05.222137 IP 151.101.117.164.443 > 10.0.2.15.44130: Flags [P.], seq 569064:570438, ack 869, win 65535, length 1374
19:58:05.222138 IP 151.101.117.164.443 > 10.0.2.15.44130: Flags [P.], seq 570438:573186, ack 869, win 65535, length 2748
19:58:05.222154 IP 10.0.2.15.44130 > 151.101.117.164.443: Flags [.], ack 573186, win 65535, length 0
19:58:05.222458 IP 151.101.117.164.443 > 10.0.2.15.44130: Flags [P.], seq 573186:575934, ack 869, win 65535, length 2748
19:58:05.222470 IP 10.0.2.15.44130 > 151.101.117.164.443: Flags [.], ack 575934, win 65535, length 0
19:58:05.222668 IP 151.101.117.164.443 > 10.0.2.15.44130: Flags [P.], seq 575934:580056, ack 869, win 65535, length 4122
19:58:05.222668 IP 151.101.117.164.443 > 10.0.2.15.44130: Flags [P.], seq 580056:581430, ack 869, win 65535, length 1374
19:58:05.222678 IP 10.0.2.15.44130 > 151.101.117.164.443: Flags [.], ack 580056, win 65535, length 0
19:58:05.222941 IP 151.101.117.164.443 > 10.0.2.15.44130: Flags [P.], seq 581430:584178, ack 869, win 65535, length 2748
19:58:05.222951 IP 10.0.2.15.44130 > 151.101.117.164.443: Flags [.], ack 584178, win 65535, length 0
19:58:05.223091 IP 151.101.117.164.443 > 10.0.2.15.44130: Flags [P.], seq 584178:588300, ack 869, win 65535, length 4122
19:58:05.223098 IP 10.0.2.15.44130 > 151.101.117.164.443: Flags [.], ack 588300, win 65535, length 0
19:58:05.223346 IP 151.101.117.164.443 > 10.0.2.15.44130: Flags [P.], seq 588300:592422, ack 869, win 65535, length 4122
19:58:05.223354 IP 10.0.2.15.44130 > 151.101.117.164.443: Flags [.], ack 592422, win 65535, length 0
19:58:05.223586 IP 151.101.117.164.443 > 10.0.2.15.44130: Flags [P.], seq 592422:595170, ack 869, win 65535, length 2748
19:58:05.223588 IP 151.101.117.164.443 > 10.0.2.15.44130: Flags [P.], seq 595170:596544, ack 869, win 65535, length 1374
19:58:05.223747 IP 10.0.2.15.44130 > 151.101.117.164.443: Flags [.], ack 595170, win 65535, length 0
19:58:05.223840 IP 151.101.117.164.443 > 10.0.2.15.44130: Flags [P.], seq 596544:597918, ack 869, win 65535, length 1374
19:58:05.223845 IP 10.0.2.15.44130 > 151.101.117.164.443: Flags [.], ack 597918, win 65535, length 0
19:58:05.225480 IP 151.101.117.164.443 > 10.0.2.15.44130: Flags [P.], seq 597918:602040, ack 869, win 65535, length 4122
19:58:05.225483 IP 151.101.117.164.443 > 10.0.2.15.44130: Flags [P.], seq 602040:607536, ack 869, win 65535, length 5496
19:58:05.225483 IP 151.101.117.164.443 > 10.0.2.15.44130: Flags [P.], seq 607536:610284, ack 869, win 65535, length 2748
19:58:05.225504 IP 10.0.2.15.44130 > 151.101.117.164.443: Flags [.], ack 602040, win 65535, length 0
19:58:05.225615 IP 10.0.2.15.44130 > 151.101.117.164.443: Flags [.], ack 607536, win 65535, length 0
19:58:05.225692 IP 10.0.2.15.44130 > 151.101.117.164.443: Flags [.], ack 610284, win 65535, length 0
19:58:05.225727 IP 151.101.117.164.443 > 10.0.2.15.44130: Flags [P.], seq 610284:613032, ack 869, win 65535, length 2748
19:58:05.225759 IP 151.101.117.164.443 > 10.0.2.15.44130: Flags [P.], seq 613032:615780, ack 869, win 65535, length 2748
19:58:05.225770 IP 10.0.2.15.44130 > 151.101.117.164.443: Flags [.], ack 613032, win 65535, length 0
19:58:05.225881 IP 10.0.2.15.44130 > 151.101.117.164.443: Flags [.], ack 615780, win 65535, length 0
19:58:05.226368 IP 151.101.117.164.443 > 10.0.2.15.44130: Flags [P.], seq 615780:617154, ack 869, win 65535, length 1374
19:58:05.226370 IP 151.101.117.164.443 > 10.0.2.15.44130: Flags [P.], seq 617154:619902, ack 869, win 65535, length 2748
19:58:05.226371 IP 151.101.117.164.443 > 10.0.2.15.44130: Flags [P.], seq 619902:624024, ack 869, win 65535, length 4122
19:58:05.226390 IP 10.0.2.15.44130 > 151.101.117.164.443: Flags [.], ack 619902, win 65535, length 0
19:58:05.226408 IP 10.0.2.15.44130 > 151.101.117.164.443: Flags [.], ack 624024, win 65535, length 0
19:58:05.269326 IP 151.101.117.164.443 > 10.0.2.15.44130: Flags [P.], seq 624024:658374, ack 869, win 65535, length 34350
19:58:05.269350 IP 10.0.2.15.44130 > 151.101.117.164.443: Flags [.], ack 658374, win 65535, length 0
19:58:05.269763 IP 151.101.117.164.443 > 10.0.2.15.44130: Flags [P.], seq 658374:659748, ack 869, win 65535, length 1374
19:58:05.275084 IP 151.101.117.164.443 > 10.0.2.15.44130: Flags [P.], seq 659748:683106, ack 869, win 65535, length 23358
19:58:05.275281 IP 10.0.2.15.44130 > 151.101.117.164.443: Flags [.], ack 683106, win 65535, length 0
19:58:05.275381 IP 151.101.117.164.443 > 10.0.2.15.44130: Flags [P.], seq 683106:685854, ack 869, win 65535, length 2748
19:58:05.275389 IP 151.101.117.164.443 > 10.0.2.15.44130: Flags [P.], seq 685854:723814, ack 869, win 65535, length 37960
19:58:05.275402 IP 10.0.2.15.44130 > 151.101.117.164.443: Flags [.], ack 685854, win 65535, length 0
19:58:05.275896 IP 10.0.2.15.44130 > 151.101.117.164.443: Flags [.], ack 723814, win 65535, length 0
19:58:05.276649 IP 151.101.117.164.443 > 10.0.2.15.44130: Flags [.], seq 723814:785134, ack 869, win 65535, length 61320
19:58:05.277107 IP 151.101.117.164.443 > 10.0.2.15.44130: Flags [.], seq 785134:788054, ack 869, win 65535, length 2920
19:58:05.277482 IP 10.0.2.15.44130 > 151.101.117.164.443: Flags [.], ack 788054, win 65535, length 0
19:58:05.277895 IP 151.101.117.164.443 > 10.0.2.15.44130: Flags [P.], seq 788054:789514, ack 869, win 65535, length 1460
19:58:05.277896 IP 151.101.117.164.443 > 10.0.2.15.44130: Flags [.], seq 789514:792434, ack 869, win 65535, length 2920
19:58:05.278122 IP 151.101.117.164.443 > 10.0.2.15.44130: Flags [.], seq 792434:828934, ack 869, win 65535, length 36500
19:58:05.278205 IP 151.101.117.164.443 > 10.0.2.15.44130: Flags [.], seq 828934:852294, ack 869, win 65535, length 23360
19:58:05.278929 IP 10.0.2.15.44130 > 151.101.117.164.443: Flags [.], ack 852294, win 65535, length 0
19:58:05.279060 IP 151.101.117.164.443 > 10.0.2.15.44130: Flags [P.], seq 852294:853754, ack 869, win 65535, length 1460
19:58:05.279615 IP 151.101.117.164.443 > 10.0.2.15.44130: Flags [.], seq 853754:890254, ack 869, win 65535, length 36500
19:58:05.279628 IP 10.0.2.15.44130 > 151.101.117.164.443: Flags [.], ack 890254, win 65535, length 0
19:58:05.279841 IP 151.101.117.164.443 > 10.0.2.15.44130: Flags [.], seq 890254:910694, ack 869, win 65535, length 20440
19:58:05.280270 IP 151.101.117.164.443 > 10.0.2.15.44130: Flags [P.], seq 910694:917994, ack 869, win 65535, length 7300
19:58:05.280277 IP 151.101.117.164.443 > 10.0.2.15.44130: Flags [.], seq 917994:951574, ack 869, win 65535, length 33580
19:58:05.280452 IP 151.101.117.164.443 > 10.0.2.15.44130: Flags [.], seq 951574:954494, ack 869, win 65535, length 2920
19:58:05.280665 IP 10.0.2.15.44130 > 151.101.117.164.443: Flags [.], ack 954494, win 65535, length 0
19:58:05.280921 IP 151.101.117.164.443 > 10.0.2.15.44130: Flags [P.], seq 954494:955954, ack 869, win 65535, length 1460
19:58:05.281154 IP 151.101.117.164.443 > 10.0.2.15.44130: Flags [.], seq 955954:988074, ack 869, win 65535, length 32120
19:58:05.281262 IP 151.101.117.164.443 > 10.0.2.15.44130: Flags [.], seq 988074:1018734, ack 869, win 65535, length 30660
19:58:05.281438 IP 10.0.2.15.44130 > 151.101.117.164.443: Flags [.], ack 1018734, win 65535, length 0
19:58:05.281547 IP 151.101.117.164.443 > 10.0.2.15.44130: Flags [P.], seq 1018734:1020194, ack 869, win 65535, length 1460
19:58:05.281741 IP 151.101.117.164.443 > 10.0.2.15.44130: Flags [.], seq 1020194:1040634, ack 869, win 65535, length 20440
19:58:05.281751 IP 10.0.2.15.44130 > 151.101.117.164.443: Flags [.], ack 1040634, win 65535, length 0
19:58:05.282153 IP 151.101.117.164.443 > 10.0.2.15.44130: Flags [P.], seq 1040634:1084434, ack 869, win 65535, length 43800
19:58:05.282204 IP 10.0.2.15.44130 > 151.101.117.164.443: Flags [.], ack 1084434, win 65535, length 0
19:58:05.282452 IP 151.101.117.164.443 > 10.0.2.15.44130: Flags [.], seq 1084434:1101954, ack 869, win 65535, length 17520
19:58:05.282461 IP 10.0.2.15.44130 > 151.101.117.164.443: Flags [.], ack 1101954, win 65535, length 0
19:58:05.282581 IP 151.101.117.164.443 > 10.0.2.15.44130: Flags [.], seq 1101954:1139914, ack 869, win 65535, length 37960
19:58:05.282642 IP 151.101.117.164.443 > 10.0.2.15.44130: Flags [P.], seq 1139914:1150134, ack 869, win 65535, length 10220
19:58:05.282672 IP 10.0.2.15.44130 > 151.101.117.164.443: Flags [.], ack 1150134, win 65535, length 0
19:58:05.282892 IP 151.101.117.164.443 > 10.0.2.15.44130: Flags [.], seq 1150134:1167654, ack 869, win 65535, length 17520
19:58:05.282899 IP 10.0.2.15.44130 > 151.101.117.164.443: Flags [.], ack 1167654, win 65535, length 0
19:58:05.283002 IP 151.101.117.164.443 > 10.0.2.15.44130: Flags [.], seq 1167654:1188094, ack 869, win 65535, length 20440
19:58:05.283008 IP 10.0.2.15.44130 > 151.101.117.164.443: Flags [.], ack 1188094, win 65535, length 0
19:58:05.283127 IP 151.101.117.164.443 > 10.0.2.15.44130: Flags [P.], seq 1188094:1215834, ack 869, win 65535, length 27740
19:58:05.283132 IP 10.0.2.15.44130 > 151.101.117.164.443: Flags [.], ack 1215834, win 65535, length 0
19:58:05.283198 IP 151.101.117.164.443 > 10.0.2.15.44130: Flags [.], seq 1215834:1220214, ack 869, win 65535, length 4380
19:58:05.283204 IP 10.0.2.15.44130 > 151.101.117.164.443: Flags [.], ack 1220214, win 65535, length 0
19:58:05.283614 IP 151.101.117.164.443 > 10.0.2.15.44130: Flags [P.], seq 1220214:1235454, ack 869, win 65535, length 15240
19:58:05.283627 IP 10.0.2.15.44130 > 151.101.117.164.443: Flags [.], ack 1235454, win 65535, length 0
19:58:05.291153 IP 151.101.117.164.443 > 10.0.2.15.44130: Flags [P.], seq 1235454:1276674, ack 869, win 65535, length 41220
19:58:05.291171 IP 10.0.2.15.44130 > 151.101.117.164.443: Flags [.], ack 1276674, win 65535, length 0
19:58:05.291374 IP 151.101.117.164.443 > 10.0.2.15.44130: Flags [.], seq 1276674:1279594, ack 869, win 65535, length 2920
19:58:05.291388 IP 10.0.2.15.44130 > 151.101.117.164.443: Flags [.], ack 1279594, win 65535, length 0
19:58:05.291743 IP 151.101.117.164.443 > 10.0.2.15.44130: Flags [P.], seq 1279594:1293162, ack 869, win 65535, length 13568
19:58:05.291754 IP 10.0.2.15.44130 > 151.101.117.164.443: Flags [.], ack 1293162, win 65535, length 0
19:58:05.291790 IP 151.101.117.164.443 > 10.0.2.15.44130: Flags [P.], seq 1293162:1295910, ack 869, win 65535, length 2748
19:58:05.291791 IP 151.101.117.164.443 > 10.0.2.15.44130: Flags [P.], seq 1295910:1297284, ack 869, win 65535, length 1374
19:58:05.291792 IP 151.101.117.164.443 > 10.0.2.15.44130: Flags [P.], seq 1297284:1300032, ack 869, win 65535, length 2748
19:58:05.291801 IP 10.0.2.15.44130 > 151.101.117.164.443: Flags [.], ack 1295910, win 65535, length 0
19:58:05.291899 IP 10.0.2.15.44130 > 151.101.117.164.443: Flags [.], ack 1300032, win 65535, length 0
19:58:05.291983 IP 151.101.117.164.443 > 10.0.2.15.44130: Flags [P.], seq 1300032:1304154, ack 869, win 65535, length 4122
19:58:05.292046 IP 10.0.2.15.44130 > 151.101.117.164.443: Flags [.], ack 1304154, win 65535, length 0
19:58:05.292230 IP 151.101.117.164.443 > 10.0.2.15.44130: Flags [P.], seq 1304154:1306902, ack 869, win 65535, length 2748
19:58:05.292308 IP 10.0.2.15.44130 > 151.101.117.164.443: Flags [.], ack 1306902, win 65535, length 0
19:58:05.292531 IP 151.101.117.164.443 > 10.0.2.15.44130: Flags [P.], seq 1306902:1309650, ack 869, win 65535, length 2748
19:58:05.292533 IP 151.101.117.164.443 > 10.0.2.15.44130: Flags [P.], seq 1309650:1312398, ack 869, win 65535, length 2748
19:58:05.292670 IP 151.101.117.164.443 > 10.0.2.15.44130: Flags [P.], seq 1312398:1315146, ack 869, win 65535, length 2748
19:58:05.292774 IP 151.101.117.164.443 > 10.0.2.15.44130: Flags [P.], seq 1315146:1316520, ack 869, win 65535, length 1374
19:58:05.292804 IP 10.0.2.15.44130 > 151.101.117.164.443: Flags [.], ack 1316520, win 65535, length 0
19:58:05.293041 IP 151.101.117.164.443 > 10.0.2.15.44130: Flags [P.], seq 1316520:1319268, ack 869, win 65535, length 2748
19:58:05.293066 IP 10.0.2.15.44130 > 151.101.117.164.443: Flags [.], ack 1319268, win 65535, length 0
19:58:05.293225 IP 151.101.117.164.443 > 10.0.2.15.44130: Flags [P.], seq 1319268:1323390, ack 869, win 65535, length 4122
19:58:05.293241 IP 10.0.2.15.44130 > 151.101.117.164.443: Flags [.], ack 1323390, win 65535, length 0
19:58:05.293788 IP 151.101.117.164.443 > 10.0.2.15.44130: Flags [P.], seq 1323390:1327512, ack 869, win 65535, length 4122
19:58:05.293844 IP 10.0.2.15.44130 > 151.101.117.164.443: Flags [.], ack 1327512, win 65535, length 0
19:58:05.294063 IP 151.101.117.164.443 > 10.0.2.15.44130: Flags [P.], seq 1327512:1330260, ack 869, win 65535, length 2748
19:58:05.294065 IP 151.101.117.164.443 > 10.0.2.15.44130: Flags [P.], seq 1330260:1333008, ack 869, win 65535, length 2748
19:58:05.294066 IP 151.101.117.164.443 > 10.0.2.15.44130: Flags [P.], seq 1333008:1334382, ack 869, win 65535, length 1374
19:58:05.294115 IP 10.0.2.15.44130 > 151.101.117.164.443: Flags [.], ack 1330260, win 65535, length 0
19:58:05.294184 IP 10.0.2.15.44130 > 151.101.117.164.443: Flags [.], ack 1333008, win 65535, length 0
19:58:05.294486 IP 151.101.117.164.443 > 10.0.2.15.44130: Flags [P.], seq 1334382:1337130, ack 869, win 65535, length 2748
19:58:05.294487 IP 151.101.117.164.443 > 10.0.2.15.44130: Flags [P.], seq 1337130:1339878, ack 869, win 65535, length 2748
19:58:05.294488 IP 151.101.117.164.443 > 10.0.2.15.44130: Flags [P.], seq 1339878:1341252, ack 869, win 65535, length 1374
19:58:05.294500 IP 10.0.2.15.44130 > 151.101.117.164.443: Flags [.], ack 1337130, win 65535, length 0
19:58:05.294692 IP 151.101.117.164.443 > 10.0.2.15.44130: Flags [P.], seq 1341252:1345374, ack 869, win 65535, length 4122
19:58:05.294714 IP 10.0.2.15.44130 > 151.101.117.164.443: Flags [.], ack 1345374, win 65535, length 0
19:58:05.294931 IP 151.101.117.164.443 > 10.0.2.15.44130: Flags [P.], seq 1345374:1348122, ack 869, win 65535, length 2748
19:58:05.295012 IP 151.101.117.164.443 > 10.0.2.15.44130: Flags [P.], seq 1348122:1350870, ack 869, win 65535, length 2748
19:58:05.295175 IP 10.0.2.15.44130 > 151.101.117.164.443: Flags [.], ack 1350870, win 65535, length 0
19:58:05.295287 IP 151.101.117.164.443 > 10.0.2.15.44130: Flags [P.], seq 1350870:1353618, ack 869, win 65535, length 2748
19:58:05.295328 IP 10.0.2.15.44130 > 151.101.117.164.443: Flags [.], ack 1353618, win 65535, length 0
19:58:05.295490 IP 151.101.117.164.443 > 10.0.2.15.44130: Flags [P.], seq 1353618:1356366, ack 869, win 65535, length 2748
19:58:05.295622 IP 151.101.117.164.443 > 10.0.2.15.44130: Flags [P.], seq 1356366:1357740, ack 869, win 65535, length 1374
19:58:05.295696 IP 10.0.2.15.44130 > 151.101.117.164.443: Flags [.], ack 1357740, win 65535, length 0
19:58:05.298905 IP 151.101.117.164.443 > 10.0.2.15.44130: Flags [P.], seq 1357740:1389342, ack 869, win 65535, length 31602
19:58:05.299338 IP 10.0.2.15.44130 > 151.101.117.164.443: Flags [.], ack 1389342, win 65535, length 0
19:58:05.309780 IP 151.101.117.164.443 > 10.0.2.15.44130: Flags [P.], seq 1389342:1400334, ack 869, win 65535, length 10992
19:58:05.309801 IP 10.0.2.15.44130 > 151.101.117.164.443: Flags [.], ack 1400334, win 65535, length 0
19:58:05.309893 IP 151.101.117.164.443 > 10.0.2.15.44130: Flags [P.], seq 1400334:1422318, ack 869, win 65535, length 21984
19:58:05.310386 IP 151.101.117.164.443 > 10.0.2.15.44130: Flags [P.], seq 1422318:1464658, ack 869, win 65535, length 42340
19:58:05.312464 IP 10.0.2.15.44130 > 151.101.117.164.443: Flags [.], ack 1464658, win 65535, length 0
19:58:05.312934 IP 151.101.117.164.443 > 10.0.2.15.44130: Flags [.], seq 1464658:1501158, ack 869, win 65535, length 36500
19:58:05.313033 IP 151.101.117.164.443 > 10.0.2.15.44130: Flags [P.], seq 1501158:1506132, ack 869, win 65535, length 4974
19:58:05.313087 IP 10.0.2.15.44130 > 151.101.117.164.443: Flags [.], ack 1506132, win 65535, length 0
19:58:05.313349 IP 151.101.117.164.443 > 10.0.2.15.44130: Flags [P.], seq 1506132:1515750, ack 869, win 65535, length 9618
19:58:05.313360 IP 10.0.2.15.44130 > 151.101.117.164.443: Flags [.], ack 1515750, win 65535, length 0
19:58:05.313593 IP 151.101.117.164.443 > 10.0.2.15.44130: Flags [P.], seq 1515750:1518498, ack 869, win 65535, length 2748
19:58:05.313594 IP 151.101.117.164.443 > 10.0.2.15.44130: Flags [P.], seq 1518498:1519872, ack 869, win 65535, length 1374
19:58:05.313605 IP 10.0.2.15.44130 > 151.101.117.164.443: Flags [.], ack 1518498, win 65535, length 0
19:58:05.313727 IP 151.101.117.164.443 > 10.0.2.15.44130: Flags [P.], seq 1519872:1521246, ack 869, win 65535, length 1374
19:58:05.313962 IP 151.101.117.164.443 > 10.0.2.15.44130: Flags [P.], seq 1521246:1523994, ack 869, win 65535, length 2748
19:58:05.314022 IP 10.0.2.15.44130 > 151.101.117.164.443: Flags [.], ack 1523994, win 65535, length 0
19:58:05.314241 IP 151.101.117.164.443 > 10.0.2.15.44130: Flags [P.], seq 1523994:1525368, ack 869, win 65535, length 1374
19:58:05.314242 IP 151.101.117.164.443 > 10.0.2.15.44130: Flags [P.], seq 1525368:1528116, ack 869, win 65535, length 2748
19:58:05.314280 IP 10.0.2.15.44130 > 151.101.117.164.443: Flags [.], ack 1528116, win 65535, length 0
19:58:05.314386 IP 151.101.117.164.443 > 10.0.2.15.44130: Flags [P.], seq 1528116:1529490, ack 869, win 65535, length 1374
19:58:05.315515 IP 151.101.117.164.443 > 10.0.2.15.44130: Flags [P.], seq 1529490:1533612, ack 869, win 65535, length 4122
19:58:05.315532 IP 10.0.2.15.44130 > 151.101.117.164.443: Flags [.], ack 1533612, win 65535, length 0
19:58:05.315780 IP 151.101.117.164.443 > 10.0.2.15.44130: Flags [P.], seq 1533612:1536360, ack 869, win 65535, length 2748
19:58:05.315782 IP 151.101.117.164.443 > 10.0.2.15.44130: Flags [P.], seq 1536360:1540482, ack 869, win 65535, length 4122
19:58:05.315895 IP 10.0.2.15.44130 > 151.101.117.164.443: Flags [.], ack 1540482, win 65535, length 0
19:58:05.315946 IP 151.101.117.164.443 > 10.0.2.15.44130: Flags [P.], seq 1540482:1541856, ack 869, win 65535, length 1374
19:58:05.316126 IP 151.101.117.164.443 > 10.0.2.15.44130: Flags [P.], seq 1541856:1544604, ack 869, win 65535, length 2748
19:58:05.316185 IP 10.0.2.15.44130 > 151.101.117.164.443: Flags [.], ack 1544604, win 65535, length 0
19:58:05.316788 IP 151.101.117.164.443 > 10.0.2.15.44130: Flags [P.], seq 1544604:1547352, ack 869, win 65535, length 2748
19:58:05.316790 IP 151.101.117.164.443 > 10.0.2.15.44130: Flags [P.], seq 1547352:1550100, ack 869, win 65535, length 2748
19:58:05.316791 IP 151.101.117.164.443 > 10.0.2.15.44130: Flags [P.], seq 1550100:1552848, ack 869, win 65535, length 2748
19:58:05.316854 IP 10.0.2.15.44130 > 151.101.117.164.443: Flags [.], ack 1547352, win 65535, length 0
19:58:05.317054 IP 151.101.117.164.443 > 10.0.2.15.44130: Flags [P.], seq 1552848:1555596, ack 869, win 65535, length 2748
19:58:05.317153 IP 151.101.117.164.443 > 10.0.2.15.44130: Flags [P.], seq 1555596:1559718, ack 869, win 65535, length 4122
19:58:05.317169 IP 10.0.2.15.44130 > 151.101.117.164.443: Flags [.], ack 1555596, win 65535, length 0
19:58:05.317228 IP 10.0.2.15.44130 > 151.101.117.164.443: Flags [.], ack 1559718, win 65535, length 0
19:58:05.317493 IP 151.101.117.164.443 > 10.0.2.15.44130: Flags [P.], seq 1559718:1562466, ack 869, win 65535, length 2748
19:58:05.317495 IP 151.101.117.164.443 > 10.0.2.15.44130: Flags [P.], seq 1562466:1563840, ack 869, win 65535, length 1374
19:58:05.317507 IP 10.0.2.15.44130 > 151.101.117.164.443: Flags [.], ack 1562466, win 65535, length 0
19:58:05.317684 IP 151.101.117.164.443 > 10.0.2.15.44130: Flags [P.], seq 1563840:1566588, ack 869, win 65535, length 2748
19:58:05.317775 IP 10.0.2.15.44130 > 151.101.117.164.443: Flags [.], ack 1566588, win 65535, length 0
19:58:05.317825 IP 151.101.117.164.443 > 10.0.2.15.44130: Flags [P.], seq 1566588:1569336, ack 869, win 65535, length 2748
19:58:05.317874 IP 10.0.2.15.44130 > 151.101.117.164.443: Flags [.], ack 1569336, win 65535, length 0
19:58:05.318183 IP 151.101.117.164.443 > 10.0.2.15.44130: Flags [P.], seq 1569336:1573458, ack 869, win 65535, length 4122
19:58:05.318192 IP 10.0.2.15.44130 > 151.101.117.164.443: Flags [.], ack 1573458, win 65535, length 0
19:58:05.319030 IP 151.101.117.164.443 > 10.0.2.15.44130: Flags [P.], seq 1573458:1574832, ack 869, win 65535, length 1374
19:58:05.319031 IP 151.101.117.164.443 > 10.0.2.15.44130: Flags [P.], seq 1574832:1577580, ack 869, win 65535, length 2748
19:58:05.319032 IP 151.101.117.164.443 > 10.0.2.15.44130: Flags [P.], seq 1577580:1580328, ack 869, win 65535, length 2748
19:58:05.319032 IP 151.101.117.164.443 > 10.0.2.15.44130: Flags [P.], seq 1580328:1581702, ack 869, win 65535, length 1374
19:58:05.319053 IP 10.0.2.15.44130 > 151.101.117.164.443: Flags [.], ack 1577580, win 65535, length 0
19:58:05.319168 IP 10.0.2.15.44130 > 151.101.117.164.443: Flags [.], ack 1581702, win 65535, length 0
19:58:05.319700 IP 151.101.117.164.443 > 10.0.2.15.44130: Flags [P.], seq 1581702:1584450, ack 869, win 65535, length 2748
19:58:05.319784 IP 10.0.2.15.44130 > 151.101.117.164.443: Flags [.], ack 1584450, win 65535, length 0
19:58:05.320006 IP 151.101.117.164.443 > 10.0.2.15.44130: Flags [P.], seq 1584450:1588572, ack 869, win 65535, length 4122
19:58:05.320018 IP 10.0.2.15.44130 > 151.101.117.164.443: Flags [.], ack 1588572, win 65535, length 0
19:58:05.320231 IP 151.101.117.164.443 > 10.0.2.15.44130: Flags [P.], seq 1588572:1592694, ack 869, win 65535, length 4122
19:58:05.320232 IP 151.101.117.164.443 > 10.0.2.15.44130: Flags [P.], seq 1592694:1594068, ack 869, win 65535, length 1374
19:58:05.320288 IP 10.0.2.15.44130 > 151.101.117.164.443: Flags [.], ack 1594068, win 65535, length 0
19:58:05.320428 IP 151.101.117.164.443 > 10.0.2.15.44130: Flags [P.], seq 1594068:1596816, ack 869, win 65535, length 2748
19:58:05.320487 IP 10.0.2.15.44130 > 151.101.117.164.443: Flags [.], ack 1596816, win 65535, length 0
19:58:05.320529 IP 151.101.117.164.443 > 10.0.2.15.44130: Flags [P.], seq 1596816:1598190, ack 869, win 65535, length 1374
19:58:05.320663 IP 151.101.117.164.443 > 10.0.2.15.44130: Flags [P.], seq 1598190:1599564, ack 869, win 65535, length 1374
19:58:05.320770 IP 10.0.2.15.44130 > 151.101.117.164.443: Flags [.], ack 1599564, win 65535, length 0
19:58:05.320970 IP 151.101.117.164.443 > 10.0.2.15.44130: Flags [P.], seq 1599564:1602312, ack 869, win 65535, length 2748
19:58:05.320971 IP 151.101.117.164.443 > 10.0.2.15.44130: Flags [P.], seq 1602312:1603686, ack 869, win 65535, length 1374
19:58:05.321012 IP 10.0.2.15.44130 > 151.101.117.164.443: Flags [.], ack 1603686, win 65535, length 0
19:58:05.321141 IP 151.101.117.164.443 > 10.0.2.15.44130: Flags [P.], seq 1603686:1606434, ack 869, win 65535, length 2748
19:58:05.321164 IP 10.0.2.15.44130 > 151.101.117.164.443: Flags [.], ack 1606434, win 65535, length 0
19:58:05.321262 IP 151.101.117.164.443 > 10.0.2.15.44130: Flags [P.], seq 1606434:1607808, ack 869, win 65535, length 1374
19:58:05.321552 IP 151.101.117.164.443 > 10.0.2.15.44130: Flags [P.], seq 1607808:1610556, ack 869, win 65535, length 2748
19:58:05.321617 IP 151.101.117.164.443 > 10.0.2.15.44130: Flags [P.], seq 1610556:1613304, ack 869, win 65535, length 2748
19:58:05.321673 IP 10.0.2.15.44130 > 151.101.117.164.443: Flags [.], ack 1613304, win 65535, length 0
19:58:05.322022 IP 151.101.117.164.443 > 10.0.2.15.44130: Flags [P.], seq 1613304:1617426, ack 869, win 65535, length 4122
19:58:05.322286 IP 151.101.117.164.443 > 10.0.2.15.44130: Flags [P.], seq 1617426:1620174, ack 869, win 65535, length 2748
19:58:05.322287 IP 151.101.117.164.443 > 10.0.2.15.44130: Flags [.], seq 1620174:1621634, ack 869, win 65535, length 1460
19:58:05.322342 IP 10.0.2.15.44130 > 151.101.117.164.443: Flags [.], ack 1621634, win 65535, length 0
19:58:05.322470 IP 151.101.117.164.443 > 10.0.2.15.44130: Flags [P.], seq 1621634:1622922, ack 869, win 65535, length 1288
19:58:05.322471 IP 151.101.117.164.443 > 10.0.2.15.44130: Flags [P.], seq 1622922:1624296, ack 869, win 65535, length 1374
19:58:05.322503 IP 10.0.2.15.44130 > 151.101.117.164.443: Flags [.], ack 1624296, win 65535, length 0
19:58:05.322591 IP 151.101.117.164.443 > 10.0.2.15.44130: Flags [P.], seq 1624296:1625670, ack 869, win 65535, length 1374
19:58:05.322736 IP 151.101.117.164.443 > 10.0.2.15.44130: Flags [P.], seq 1625670:1628418, ack 869, win 65535, length 2748
19:58:05.322743 IP 10.0.2.15.44130 > 151.101.117.164.443: Flags [.], ack 1628418, win 65535, length 0
19:58:05.322962 IP 151.101.117.164.443 > 10.0.2.15.44130: Flags [P.], seq 1628418:1629792, ack 869, win 65535, length 1374
19:58:05.323094 IP 151.101.117.164.443 > 10.0.2.15.44130: Flags [P.], seq 1629792:1632540, ack 869, win 65535, length 2748
19:58:05.323101 IP 10.0.2.15.44130 > 151.101.117.164.443: Flags [.], ack 1632540, win 65535, length 0
19:58:05.323244 IP 151.101.117.164.443 > 10.0.2.15.44130: Flags [P.], seq 1632540:1633914, ack 869, win 65535, length 1374
19:58:05.324944 IP 151.101.117.164.443 > 10.0.2.15.44130: Flags [P.], seq 1633914:1638036, ack 869, win 65535, length 4122
19:58:05.324946 IP 151.101.117.164.443 > 10.0.2.15.44130: Flags [P.], seq 1638036:1640784, ack 869, win 65535, length 2748
19:58:05.324947 IP 151.101.117.164.443 > 10.0.2.15.44130: Flags [P.], seq 1640784:1642158, ack 869, win 65535, length 1374
19:58:05.325079 IP 10.0.2.15.44130 > 151.101.117.164.443: Flags [.], ack 1638036, win 65535, length 0
19:58:05.325476 IP 151.101.117.164.443 > 10.0.2.15.44130: Flags [P.], seq 1642158:1643532, ack 869, win 65535, length 1374
19:58:05.325478 IP 151.101.117.164.443 > 10.0.2.15.44130: Flags [P.], seq 1643532:1646280, ack 869, win 65535, length 2748
19:58:05.325480 IP 151.101.117.164.443 > 10.0.2.15.44130: Flags [P.], seq 1646280:1650402, ack 869, win 65535, length 4122
19:58:05.325555 IP 10.0.2.15.44130 > 151.101.117.164.443: Flags [.], ack 1650402, win 65535, length 0
19:58:05.325729 IP 151.101.117.164.443 > 10.0.2.15.44130: Flags [P.], seq 1650402:1651776, ack 869, win 65535, length 1374
19:58:05.325954 IP 151.101.117.164.443 > 10.0.2.15.44130: Flags [P.], seq 1651776:1654524, ack 869, win 65535, length 2748
19:58:05.325955 IP 151.101.117.164.443 > 10.0.2.15.44130: Flags [P.], seq 1654524:1655898, ack 869, win 65535, length 1374
19:58:05.326007 IP 10.0.2.15.44130 > 151.101.117.164.443: Flags [.], ack 1655898, win 65535, length 0
19:58:05.326108 IP 151.101.117.164.443 > 10.0.2.15.44130: Flags [P.], seq 1655898:1658646, ack 869, win 65535, length 2748
19:58:05.326127 IP 10.0.2.15.44130 > 151.101.117.164.443: Flags [.], ack 1658646, win 65535, length 0
19:58:05.326270 IP 151.101.117.164.443 > 10.0.2.15.44130: Flags [P.], seq 1658646:1660020, ack 869, win 65535, length 1374
19:58:05.326404 IP 151.101.117.164.443 > 10.0.2.15.44130: Flags [P.], seq 1660020:1662768, ack 869, win 65535, length 2748
19:58:05.326456 IP 10.0.2.15.44130 > 151.101.117.164.443: Flags [.], ack 1662768, win 65535, length 0
19:58:05.326550 IP 151.101.117.164.443 > 10.0.2.15.44130: Flags [P.], seq 1662768:1665516, ack 869, win 65535, length 2748
19:58:05.326572 IP 10.0.2.15.44130 > 151.101.117.164.443: Flags [.], ack 1665516, win 65535, length 0
19:58:05.326912 IP 151.101.117.164.443 > 10.0.2.15.44130: Flags [P.], seq 1665516:1668264, ack 869, win 65535, length 2748

