19:58:56.198731 IP 10.0.2.15.51870 > 140.233.253.2.53: 17050+ A? www.nytimes.com. (33)
19:58:56.198773 IP 10.0.2.15.51870 > 140.233.253.2.53: 27815+ AAAA? www.nytimes.com. (33)
19:58:56.205329 IP 140.233.253.2.53 > 10.0.2.15.51870: 17050 3/0/0 CNAME www.prd.map.nytimes.com., CNAME nytimes.map.fastly.net., A 151.101.117.164 (111)
19:58:56.217001 IP 140.233.253.2.53 > 10.0.2.15.51870: 27815 2/1/0 CNAME www.prd.map.nytimes.com., CNAME nytimes.map.fastly.net. (153)
19:58:56.217292 IP 10.0.2.15.44148 > 151.101.117.164.443: Flags [S], seq 1472325639, win 64240, options [mss 1460,sackOK,TS val 917739300 ecr 0,nop,wscale 6], length 0
19:58:56.232199 IP 151.101.117.164.443 > 10.0.2.15.44148: Flags [S.], seq 212160001, ack 1472325640, win 65535, options [mss 1460], length 0
19:58:56.232246 IP 10.0.2.15.44148 > 151.101.117.164.443: Flags [.], ack 1, win 64240, length 0
19:58:56.243742 IP 10.0.2.15.44148 > 151.101.117.164.443: Flags [P.], seq 1:518, ack 1, win 64240, length 517
19:58:56.244170 IP 151.101.117.164.443 > 10.0.2.15.44148: Flags [.], ack 518, win 65535, length 0
19:58:56.262185 IP 151.101.117.164.443 > 10.0.2.15.44148: Flags [.], seq 1:2921, ack 518, win 65535, length 2920
19:58:56.262209 IP 10.0.2.15.44148 > 151.101.117.164.443: Flags [.], ack 2921, win 62780, length 0
19:58:56.262701 IP 151.101.117.164.443 > 10.0.2.15.44148: Flags [P.], seq 2921:5497, ack 518, win 65535, length 2576
19:58:56.262727 IP 10.0.2.15.44148 > 151.101.117.164.443: Flags [.], ack 5497, win 61320, length 0
19:58:56.262915 IP 151.101.117.164.443 > 10.0.2.15.44148: Flags [P.], seq 5497:5607, ack 518, win 65535, length 110
19:58:56.262925 IP 10.0.2.15.44148 > 151.101.117.164.443: Flags [.], ack 5607, win 61210, length 0
19:58:56.264784 IP 10.0.2.15.44148 > 151.101.117.164.443: Flags [P.], seq 518:611, ack 5607, win 62780, length 93
19:58:56.265209 IP 151.101.117.164.443 > 10.0.2.15.44148: Flags [.], ack 611, win 65535, length 0
19:58:56.279404 IP 151.101.117.164.443 > 10.0.2.15.44148: Flags [P.], seq 5607:5658, ack 611, win 65535, length 51
19:58:56.279425 IP 10.0.2.15.44148 > 151.101.117.164.443: Flags [.], ack 5658, win 62780, length 0
19:58:56.280023 IP 10.0.2.15.44148 > 151.101.117.164.443: Flags [P.], seq 611:664, ack 5658, win 62780, length 53
19:58:56.280061 IP 10.0.2.15.44148 > 151.101.117.164.443: Flags [P.], seq 664:720, ack 5658, win 62780, length 56
19:58:56.280331 IP 151.101.117.164.443 > 10.0.2.15.44148: Flags [.], ack 664, win 65535, length 0
19:58:56.280351 IP 10.0.2.15.44148 > 151.101.117.164.443: Flags [P.], seq 720:831, ack 5658, win 62780, length 111
19:58:56.280542 IP 151.101.117.164.443 > 10.0.2.15.44148: Flags [.], ack 720, win 65535, length 0
19:58:56.280543 IP 151.101.117.164.443 > 10.0.2.15.44148: Flags [.], ack 831, win 65535, length 0
19:58:56.293336 IP 151.101.117.164.443 > 10.0.2.15.44148: Flags [P.], seq 5658:5715, ack 831, win 65535, length 57
19:58:56.293436 IP 10.0.2.15.44148 > 151.101.117.164.443: Flags [.], ack 5715, win 62780, length 0
19:58:56.294158 IP 151.101.117.164.443 > 10.0.2.15.44148: Flags [P.], seq 5715:5753, ack 831, win 65535, length 38
19:58:56.294184 IP 10.0.2.15.44148 > 151.101.117.164.443: Flags [.], ack 5753, win 62780, length 0
19:58:56.294640 IP 10.0.2.15.44148 > 151.101.117.164.443: Flags [P.], seq 831:869, ack 5753, win 62780, length 38
19:58:56.296281 IP 151.101.117.164.443 > 10.0.2.15.44148: Flags [.], ack 869, win 65535, length 0
19:58:57.697104 IP 151.101.117.164.443 > 10.0.2.15.44148: Flags [.], seq 5753:17433, ack 869, win 65535, length 11680
19:58:57.697425 IP 10.0.2.15.44148 > 151.101.117.164.443: Flags [.], ack 17433, win 56940, length 0
19:58:57.697676 IP 151.101.117.164.443 > 10.0.2.15.44148: Flags [.], seq 17433:30573, ack 869, win 65535, length 13140
19:58:57.697801 IP 10.0.2.15.44148 > 151.101.117.164.443: Flags [.], ack 30573, win 48180, length 0
19:58:57.698143 IP 151.101.117.164.443 > 10.0.2.15.44148: Flags [.], seq 30573:45173, ack 869, win 65535, length 14600
19:58:57.698195 IP 10.0.2.15.44148 > 151.101.117.164.443: Flags [.], ack 45173, win 37960, length 0
19:58:57.698347 IP 151.101.117.164.443 > 10.0.2.15.44148: Flags [P.], seq 45173:46973, ack 869, win 65535, length 1800
19:58:57.698371 IP 10.0.2.15.44148 > 151.101.117.164.443: Flags [.], ack 46973, win 36500, length 0
19:58:57.710578 IP 151.101.117.164.443 > 10.0.2.15.44148: Flags [P.], seq 46973:49721, ack 869, win 65535, length 2748
19:58:57.710603 IP 10.0.2.15.44148 > 151.101.117.164.443: Flags [.], ack 49721, win 62780, length 0
19:58:57.712949 IP 151.101.117.164.443 > 10.0.2.15.44148: Flags [P.], seq 49721:59339, ack 869, win 65535, length 9618
19:58:57.713055 IP 10.0.2.15.44148 > 151.101.117.164.443: Flags [.], ack 59339, win 58400, length 0
19:58:57.713668 IP 151.101.117.164.443 > 10.0.2.15.44148: Flags [P.], seq 59339:60713, ack 869, win 65535, length 1374
19:58:57.715223 IP 151.101.117.164.443 > 10.0.2.15.44148: Flags [P.], seq 60713:63461, ack 869, win 65535, length 2748
19:58:57.715250 IP 10.0.2.15.44148 > 151.101.117.164.443: Flags [.], ack 63461, win 62780, length 0
19:58:57.715980 IP 151.101.117.164.443 > 10.0.2.15.44148: Flags [P.], seq 63461:64835, ack 869, win 65535, length 1374
19:58:57.717353 IP 151.101.117.164.443 > 10.0.2.15.44148: Flags [P.], seq 64835:68957, ack 869, win 65535, length 4122
19:58:57.717423 IP 10.0.2.15.44148 > 151.101.117.164.443: Flags [.], ack 68957, win 62780, length 0
19:58:57.718055 IP 151.101.117.164.443 > 10.0.2.15.44148: Flags [P.], seq 68957:70331, ack 869, win 65535, length 1374
19:58:57.719225 IP 151.101.117.164.443 > 10.0.2.15.44148: Flags [P.], seq 70331:71705, ack 869, win 65535, length 1374
19:58:57.719247 IP 10.0.2.15.44148 > 151.101.117.164.443: Flags [.], ack 71705, win 65535, length 0
19:58:57.720416 IP 151.101.117.164.443 > 10.0.2.15.44148: Flags [P.], seq 71705:73079, ack 869, win 65535, length 1374
19:58:57.721610 IP 151.101.117.164.443 > 10.0.2.15.44148: Flags [P.], seq 73079:77201, ack 869, win 65535, length 4122
19:58:57.721630 IP 10.0.2.15.44148 > 151.101.117.164.443: Flags [.], ack 77201, win 65535, length 0
19:58:57.722893 IP 151.101.117.164.443 > 10.0.2.15.44148: Flags [P.], seq 77201:81323, ack 869, win 65535, length 4122
19:58:57.722912 IP 10.0.2.15.44148 > 151.101.117.164.443: Flags [.], ack 81323, win 65535, length 0
19:58:57.725108 IP 151.101.117.164.443 > 10.0.2.15.44148: Flags [P.], seq 81323:84071, ack 869, win 65535, length 2748
19:58:57.725128 IP 10.0.2.15.44148 > 151.101.117.164.443: Flags [.], ack 84071, win 65535, length 0
19:58:57.726024 IP 151.101.117.164.443 > 10.0.2.15.44148: Flags [P.], seq 84071:85445, ack 869, win 65535, length 1374
19:58:57.727216 IP 151.101.117.164.443 > 10.0.2.15.44148: Flags [P.], seq 85445:88193, ack 869, win 65535, length 2748
19:58:57.727238 IP 10.0.2.15.44148 > 151.101.117.164.443: Flags [.], ack 88193, win 65535, length 0
19:58:57.728117 IP 151.101.117.164.443 > 10.0.2.15.44148: Flags [P.], seq 88193:90941, ack 869, win 65535, length 2748
19:58:57.728132 IP 10.0.2.15.44148 > 151.101.117.164.443: Flags [.], ack 90941, win 65535, length 0
19:58:57.729220 IP 151.101.117.164.443 > 10.0.2.15.44148: Flags [P.], seq 90941:93689, ack 869, win 65535, length 2748
19:58:57.729240 IP 10.0.2.15.44148 > 151.101.117.164.443: Flags [.], ack 93689, win 65535, length 0
19:58:57.730449 IP 151.101.117.164.443 > 10.0.2.15.44148: Flags [P.], seq 93689:96437, ack 869, win 65535, length 2748
19:58:57.730475 IP 10.0.2.15.44148 > 151.101.117.164.443: Flags [.], ack 96437, win 65535, length 0
19:58:57.731452 IP 151.101.117.164.443 > 10.0.2.15.44148: Flags [P.], seq 96437:99185, ack 869, win 65535, length 2748
19:58:57.731470 IP 10.0.2.15.44148 > 151.101.117.164.443: Flags [.], ack 99185, win 65535, length 0
19:58:57.732307 IP 151.101.117.164.443 > 10.0.2.15.44148: Flags [P.], seq 99185:101933, ack 869, win 65535, length 2748
19:58:57.732321 IP 10.0.2.15.44148 > 151.101.117.164.443: Flags [.], ack 101933, win 65535, length 0
19:58:57.733887 IP 151.101.117.164.443 > 10.0.2.15.44148: Flags [P.], seq 101933:107429, ack 869, win 65535, length 5496
19:58:57.733911 IP 10.0.2.15.44148 > 151.101.117.164.443: Flags [.], ack 107429, win 65535, length 0
19:58:57.734714 IP 151.101.117.164.443 > 10.0.2.15.44148: Flags [P.], seq 107429:110177, ack 869, win 65535, length 2748
19:58:57.734762 IP 10.0.2.15.44148 > 151.101.117.164.443: Flags [.], ack 110177, win 65535, length 0
19:58:57.736078 IP 151.101.117.164.443 > 10.0.2.15.44148: Flags [P.], seq 110177:112925, ack 869, win 65535, length 2748
19:58:57.736097 IP 10.0.2.15.44148 > 151.101.117.164.443: Flags [.], ack 112925, win 65535, length 0
19:58:57.737056 IP 151.101.117.164.443 > 10.0.2.15.44148: Flags [P.], seq 112925:117047, ack 869, win 65535, length 4122
19:58:57.737068 IP 10.0.2.15.44148 > 151.101.117.164.443: Flags [.], ack 117047, win 65535, length 0
19:58:57.738205 IP 151.101.117.164.443 > 10.0.2.15.44148: Flags [P.], seq 117047:121169, ack 869, win 65535, length 4122
19:58:57.738263 IP 10.0.2.15.44148 > 151.101.117.164.443: Flags [.], ack 121169, win 65535, length 0
19:58:57.739145 IP 151.101.117.164.443 > 10.0.2.15.44148: Flags [P.], seq 121169:123917, ack 869, win 65535, length 2748
19:58:57.739156 IP 10.0.2.15.44148 > 151.101.117.164.443: Flags [.], ack 123917, win 65535, length 0
19:58:57.740215 IP 151.101.117.164.443 > 10.0.2.15.44148: Flags [P.], seq 123917:129413, ack 869, win 65535, length 5496
19:58:57.740296 IP 10.0.2.15.44148 > 151.101.117.164.443: Flags [.], ack 129413, win 65535, length 0
19:58:57.741030 IP 151.101.117.164.443 > 10.0.2.15.44148: Flags [P.], seq 129413:134909, ack 869, win 65535, length 5496
19:58:57.741041 IP 10.0.2.15.44148 > 151.101.117.164.443: Flags [.], ack 134909, win 65535, length 0
19:58:57.742430 IP 151.101.117.164.443 > 10.0.2.15.44148: Flags [P.], seq 134909:139031, ack 869, win 65535, length 4122
19:58:57.742446 IP 10.0.2.15.44148 > 151.101.117.164.443: Flags [.], ack 139031, win 65535, length 0
19:58:57.743178 IP 151.101.117.164.443 > 10.0.2.15.44148: Flags [P.], seq 139031:141779, ack 869, win 65535, length 2748
19:58:57.743192 IP 10.0.2.15.44148 > 151.101.117.164.443: Flags [.], ack 141779, win 65535, length 0
19:58:57.744244 IP 151.101.117.164.443 > 10.0.2.15.44148: Flags [P.], seq 141779:148649, ack 869, win 65535, length 6870
19:58:57.744265 IP 10.0.2.15.44148 > 151.101.117.164.443: Flags [.], ack 148649, win 65535, length 0
19:58:57.744400 IP 151.101.117.164.443 > 10.0.2.15.44148: Flags [P.], seq 148649:150023, ack 869, win 65535, length 1374
19:58:57.745646 IP 151.101.117.164.443 > 10.0.2.15.44148: Flags [P.], seq 150023:154145, ack 869, win 65535, length 4122
19:58:57.745659 IP 10.0.2.15.44148 > 151.101.117.164.443: Flags [.], ack 154145, win 65535, length 0
19:58:57.746555 IP 151.101.117.164.443 > 10.0.2.15.44148: Flags [P.], seq 154145:158267, ack 869, win 65535, length 4122
19:58:57.746566 IP 10.0.2.15.44148 > 151.101.117.164.443: Flags [.], ack 158267, win 65535, length 0
19:58:57.747594 IP 151.101.117.164.443 > 10.0.2.15.44148: Flags [P.], seq 158267:162389, ack 869, win 65535, length 4122
19:58:57.747615 IP 10.0.2.15.44148 > 151.101.117.164.443: Flags [.], ack 162389, win 65535, length 0
19:58:57.748805 IP 151.101.117.164.443 > 10.0.2.15.44148: Flags [P.], seq 162389:169259, ack 869, win 65535, length 6870
19:58:57.748807 IP 151.101.117.164.443 > 10.0.2.15.44148: Flags [P.], seq 169259:170633, ack 869, win 65535, length 1374
19:58:57.748823 IP 10.0.2.15.44148 > 151.101.117.164.443: Flags [.], ack 169259, win 65535, length 0
19:58:57.749950 IP 151.101.117.164.443 > 10.0.2.15.44148: Flags [P.], seq 170633:174755, ack 869, win 65535, length 4122
19:58:57.749962 IP 10.0.2.15.44148 > 151.101.117.164.443: Flags [.], ack 174755, win 65535, length 0
19:58:57.750984 IP 151.101.117.164.443 > 10.0.2.15.44148: Flags [P.], seq 174755:180251, ack 869, win 65535, length 5496
19:58:57.751001 IP 10.0.2.15.44148 > 151.101.117.164.443: Flags [.], ack 180251, win 65535, length 0
19:58:57.752063 IP 151.101.117.164.443 > 10.0.2.15.44148: Flags [P.], seq 180251:188495, ack 869, win 65535, length 8244
19:58:57.752079 IP 10.0.2.15.44148 > 151.101.117.164.443: Flags [.], ack 188495, win 65535, length 0
19:58:57.753621 IP 151.101.117.164.443 > 10.0.2.15.44148: Flags [P.], seq 188495:193991, ack 869, win 65535, length 5496
19:58:57.753636 IP 10.0.2.15.44148 > 151.101.117.164.443: Flags [.], ack 193991, win 65535, length 0
19:58:57.754515 IP 151.101.117.164.443 > 10.0.2.15.44148: Flags [P.], seq 193991:202235, ack 869, win 65535, length 8244
19:58:57.754529 IP 10.0.2.15.44148 > 151.101.117.164.443: Flags [.], ack 202235, win 65535, length 0
19:58:57.755535 IP 151.101.117.164.443 > 10.0.2.15.44148: Flags [P.], seq 202235:206357, ack 869, win 65535, length 4122
19:58:57.755547 IP 10.0.2.15.44148 > 151.101.117.164.443: Flags [.], ack 206357, win 65535, length 0
19:58:57.756409 IP 151.101.117.164.443 > 10.0.2.15.44148: Flags [P.], seq 206357:213227, ack 869, win 65535, length 6870
19:58:57.756421 IP 10.0.2.15.44148 > 151.101.117.164.443: Flags [.], ack 213227, win 65535, length 0
19:58:57.757411 IP 151.101.117.164.443 > 10.0.2.15.44148: Flags [P.], seq 213227:217349, ack 869, win 65535, length 4122
19:58:57.757422 IP 10.0.2.15.44148 > 151.101.117.164.443: Flags [.], ack 217349, win 65535, length 0
19:58:57.758700 IP 151.101.117.164.443 > 10.0.2.15.44148: Flags [.], seq 217349:218809, ack 869, win 65535, length 1460
19:58:57.758891 IP 151.101.117.164.443 > 10.0.2.15.44148: Flags [P.], seq 218809:222845, ack 869, win 65535, length 4036
19:58:57.758900 IP 10.0.2.15.44148 > 151.101.117.164.443: Flags [.], ack 222845, win 65535, length 0
19:58:57.759915 IP 151.101.117.164.443 > 10.0.2.15.44148: Flags [P.], seq 222845:231089, ack 869, win 65535, length 8244
19:58:57.759931 IP 10.0.2.15.44148 > 151.101.117.164.443: Flags [.], ack 231089, win 65535, length 0
19:58:57.761042 IP 151.101.117.164.443 > 10.0.2.15.44148: Flags [P.], seq 231089:233837, ack 869, win 65535, length 2748
19:58:57.761101 IP 10.0.2.15.44148 > 151.101.117.164.443: Flags [.], ack 233837, win 65535, length 0
19:58:57.762080 IP 151.101.117.164.443 > 10.0.2.15.44148: Flags [P.], seq 233837:240707, ack 869, win 65535, length 6870
19:58:57.762092 IP 10.0.2.15.44148 > 151.101.117.164.443: Flags [.], ack 240707, win 65535, length 0
19:58:57.763153 IP 151.101.117.164.443 > 10.0.2.15.44148: Flags [P.], seq 240707:244829, ack 869, win 65535, length 4122
19:58:57.763168 IP 10.0.2.15.44148 > 151.101.117.164.443: Flags [.], ack 244829, win 65535, length 0
19:58:57.764216 IP 151.101.117.164.443 > 10.0.2.15.44148: Flags [P.], seq 244829:251699, ack 869, win 65535, length 6870
19:58:57.764234 IP 10.0.2.15.44148 > 151.101.117.164.443: Flags [.], ack 251699, win 65535, length 0
19:58:57.765188 IP 151.101.117.164.443 > 10.0.2.15.44148: Flags [P.], seq 251699:258569, ack 869, win 65535, length 6870
19:58:57.765201 IP 10.0.2.15.44148 > 151.101.117.164.443: Flags [.], ack 258569, win 65535, length 0
19:58:57.766462 IP 151.101.117.164.443 > 10.0.2.15.44148: Flags [P.], seq 258569:266813, ack 869, win 65535, length 8244
19:58:57.766478 IP 10.0.2.15.44148 > 151.101.117.164.443: Flags [.], ack 266813, win 65535, length 0
19:58:57.767595 IP 151.101.117.164.443 > 10.0.2.15.44148: Flags [.], seq 266813:272653, ack 869, win 65535, length 5840
19:58:57.767655 IP 10.0.2.15.44148 > 151.101.117.164.443: Flags [.], ack 272653, win 65535, length 0
19:58:57.768080 IP 151.101.117.164.443 > 10.0.2.15.44148: Flags [P.], seq 272653:275057, ack 869, win 65535, length 2404
19:58:57.768081 IP 151.101.117.164.443 > 10.0.2.15.44148: Flags [P.], seq 275057:277805, ack 869, win 65535, length 2748
19:58:57.768093 IP 10.0.2.15.44148 > 151.101.117.164.443: Flags [.], ack 275057, win 65535, length 0
19:58:57.768107 IP 10.0.2.15.44148 > 151.101.117.164.443: Flags [.], ack 277805, win 65535, length 0
19:58:57.769899 IP 151.101.117.164.443 > 10.0.2.15.44148: Flags [P.], seq 277805:287423, ack 869, win 65535, length 9618
19:58:57.769901 IP 151.101.117.164.443 > 10.0.2.15.44148: Flags [P.], seq 287423:288797, ack 869, win 65535, length 1374
19:58:57.769923 IP 10.0.2.15.44148 > 151.101.117.164.443: Flags [.], ack 287423, win 65535, length 0
19:58:57.771740 IP 151.101.117.164.443 > 10.0.2.15.44148: Flags [P.], seq 288797:292919, ack 869, win 65535, length 4122
19:58:57.771743 IP 151.101.117.164.443 > 10.0.2.15.44148: Flags [P.], seq 292919:299789, ack 869, win 65535, length 6870
19:58:57.771765 IP 10.0.2.15.44148 > 151.101.117.164.443: Flags [.], ack 292919, win 65535, length 0
19:58:57.771874 IP 10.0.2.15.44148 > 151.101.117.164.443: Flags [.], ack 299789, win 65535, length 0
19:58:57.773451 IP 151.101.117.164.443 > 10.0.2.15.44148: Flags [P.], seq 299789:303911, ack 869, win 65535, length 4122
19:58:57.773543 IP 10.0.2.15.44148 > 151.101.117.164.443: Flags [.], ack 303911, win 65535, length 0
19:58:57.774307 IP 151.101.117.164.443 > 10.0.2.15.44148: Flags [P.], seq 303911:309407, ack 869, win 65535, length 5496
19:58:57.774323 IP 10.0.2.15.44148 > 151.101.117.164.443: Flags [.], ack 309407, win 65535, length 0
19:58:57.775685 IP 151.101.117.164.443 > 10.0.2.15.44148: Flags [P.], seq 309407:314903, ack 869, win 65535, length 5496
19:58:57.775705 IP 10.0.2.15.44148 > 151.101.117.164.443: Flags [.], ack 314903, win 65535, length 0
19:58:57.776475 IP 151.101.117.164.443 > 10.0.2.15.44148: Flags [P.], seq 314903:320399, ack 869, win 65535, length 5496
19:58:57.776488 IP 10.0.2.15.44148 > 151.101.117.164.443: Flags [.], ack 320399, win 65535, length 0
19:58:57.777851 IP 151.101.117.164.443 > 10.0.2.15.44148: Flags [P.], seq 320399:325895, ack 869, win 65535, length 5496
19:58:57.777869 IP 10.0.2.15.44148 > 151.101.117.164.443: Flags [.], ack 325895, win 65535, length 0
19:58:57.778675 IP 151.101.117.164.443 > 10.0.2.15.44148: Flags [P.], seq 325895:334139, ack 869, win 65535, length 8244
19:58:57.778677 IP 151.101.117.164.443 > 10.0.2.15.44148: Flags [P.], seq 334139:335513, ack 869, win 65535, length 1374
19:58:57.778692 IP 10.0.2.15.44148 > 151.101.117.164.443: Flags [.], ack 334139, win 65535, length 0
19:58:57.780189 IP 151.101.117.164.443 > 10.0.2.15.44148: Flags [P.], seq 335513:342383, ack 869, win 65535, length 6870
19:58:57.780207 IP 10.0.2.15.44148 > 151.101.117.164.443: Flags [.], ack 342383, win 65535, length 0
19:58:57.782097 IP 151.101.117.164.443 > 10.0.2.15.44148: Flags [P.], seq 342383:350627, ack 869, win 65535, length 8244
19:58:57.782114 IP 10.0.2.15.44148 > 151.101.117.164.443: Flags [.], ack 350627, win 65535, length 0
19:58:57.782273 IP 151.101.117.164.443 > 10.0.2.15.44148: Flags [P.], seq 350627:354749, ack 869, win 65535, length 4122
19:58:57.782295 IP 10.0.2.15.44148 > 151.101.117.164.443: Flags [.], ack 354749, win 65535, length 0
19:58:57.783201 IP 151.101.117.164.443 > 10.0.2.15.44148: Flags [P.], seq 354749:362993, ack 869, win 65535, length 8244
19:58:57.783203 IP 151.101.117.164.443 > 10.0.2.15.44148: Flags [P.], seq 362993:365741, ack 869, win 65535, length 2748
19:58:57.783219 IP 10.0.2.15.44148 > 151.101.117.164.443: Flags [.], ack 362993, win 65535, length 0
19:58:57.783251 IP 10.0.2.15.44148 > 151.101.117.164.443: Flags [.], ack 365741, win 65535, length 0
19:58:57.783448 IP 151.101.117.164.443 > 10.0.2.15.44148: Flags [P.], seq 365741:367115, ack 869, win 65535, length 1374
19:58:57.785540 IP 151.101.117.164.443 > 10.0.2.15.44148: Flags [P.], seq 367115:375359, ack 869, win 65535, length 8244
19:58:57.785649 IP 10.0.2.15.44148 > 151.101.117.164.443: Flags [.], ack 375359, win 65535, length 0
19:58:57.786511 IP 151.101.117.164.443 > 10.0.2.15.44148: Flags [P.], seq 375359:380855, ack 869, win 65535, length 5496
19:58:57.786534 IP 10.0.2.15.44148 > 151.101.117.164.443: Flags [.], ack 380855, win 65535, length 0
19:58:57.787573 IP 151.101.117.164.443 > 10.0.2.15.44148: Flags [P.], seq 380855:387725, ack 869, win 65535, length 6870
19:58:57.787575 IP 151.101.117.164.443 > 10.0.2.15.44148: Flags [P.], seq 387725:389099, ack 869, win 65535, length 1374
19:58:57.787596 IP 10.0.2.15.44148 > 151.101.117.164.443: Flags [.], ack 387725, win 65535, length 0
19:58:57.788466 IP 151.101.117.164.443 > 10.0.2.15.44148: Flags [P.], seq 389099:394595, ack 869, win 65535, length 5496
19:58:57.788478 IP 10.0.2.15.44148 > 151.101.117.164.443: Flags [.], ack 394595, win 65535, length 0
19:58:57.792260 IP 151.101.117.164.443 > 10.0.2.15.44148: Flags [P.], seq 394595:404213, ack 869, win 65535, length 9618
19:58:57.792263 IP 151.101.117.164.443 > 10.0.2.15.44148: Flags [P.], seq 404213:411083, ack 869, win 65535, length 6870
19:58:57.792285 IP 10.0.2.15.44148 > 151.101.117.164.443: Flags [.], ack 404213, win 65535, length 0
19:58:57.792324 IP 10.0.2.15.44148 > 151.101.117.164.443: Flags [.], ack 411083, win 65535, length 0
19:58:57.792357 IP 151.101.117.164.443 > 10.0.2.15.44148: Flags [P.], seq 411083:413831, ack 869, win 65535, length 2748
19:58:57.792363 IP 10.0.2.15.44148 > 151.101.117.164.443: Flags [.], ack 413831, win 65535, length 0
19:58:57.794011 IP 151.101.117.164.443 > 10.0.2.15.44148: Flags [P.], seq 413831:419327, ack 869, win 65535, length 5496
19:58:57.794032 IP 10.0.2.15.44148 > 151.101.117.164.443: Flags [.], ack 419327, win 65535, length 0
19:58:57.795368 IP 151.101.117.164.443 > 10.0.2.15.44148: Flags [P.], seq 419327:428945, ack 869, win 65535, length 9618
19:58:57.795389 IP 10.0.2.15.44148 > 151.101.117.164.443: Flags [.], ack 428945, win 65535, length 0
19:58:57.798861 IP 151.101.117.164.443 > 10.0.2.15.44148: Flags [P.], seq 428945:431693, ack 869, win 65535, length 2748
19:58:57.798867 IP 151.101.117.164.443 > 10.0.2.15.44148: Flags [.], seq 431693:434613, ack 869, win 65535, length 2920
19:58:57.799162 IP 10.0.2.15.44148 > 151.101.117.164.443: Flags [.], ack 431693, win 65535, length 0
19:58:57.799215 IP 10.0.2.15.44148 > 151.101.117.164.443: Flags [.], ack 434613, win 65535, length 0
19:58:57.800698 IP 151.101.117.164.443 > 10.0.2.15.44148: Flags [P.], seq 434613:441311, ack 869, win 65535, length 6698
19:58:57.800701 IP 151.101.117.164.443 > 10.0.2.15.44148: Flags [P.], seq 441311:449555, ack 869, win 65535, length 8244
19:58:57.800724 IP 10.0.2.15.44148 > 151.101.117.164.443: Flags [.], ack 441311, win 65535, length 0
19:58:57.800748 IP 10.0.2.15.44148 > 151.101.117.164.443: Flags [.], ack 449555, win 65535, length 0
19:58:57.800860 IP 151.101.117.164.443 > 10.0.2.15.44148: Flags [P.], seq 449555:457799, ack 869, win 65535, length 8244
19:58:57.800861 IP 151.101.117.164.443 > 10.0.2.15.44148: Flags [P.], seq 457799:460547, ack 869, win 65535, length 2748
19:58:57.800874 IP 10.0.2.15.44148 > 151.101.117.164.443: Flags [.], ack 457799, win 65535, length 0
19:58:57.800984 IP 10.0.2.15.44148 > 151.101.117.164.443: Flags [.], ack 460547, win 65535, length 0
19:58:57.801229 IP 151.101.117.164.443 > 10.0.2.15.44148: Flags [P.], seq 460547:470165, ack 869, win 65535, length 9618
19:58:57.801255 IP 10.0.2.15.44148 > 151.101.117.164.443: Flags [.], ack 470165, win 65535, length 0
19:58:57.801514 IP 151.101.117.164.443 > 10.0.2.15.44148: Flags [P.], seq 470165:472913, ack 869, win 65535, length 2748
19:58:57.801523 IP 10.0.2.15.44148 > 151.101.117.164.443: Flags [.], ack 472913, win 65535, length 0
19:58:57.802734 IP 151.101.117.164.443 > 10.0.2.15.44148: Flags [P.], seq 472913:478409, ack 869, win 65535, length 5496
19:58:57.802754 IP 10.0.2.15.44148 > 151.101.117.164.443: Flags [.], ack 478409, win 65535, length 0
19:58:57.803691 IP 151.101.117.164.443 > 10.0.2.15.44148: Flags [P.], seq 478409:479783, ack 869, win 65535, length 1374
19:58:57.805117 IP 151.101.117.164.443 > 10.0.2.15.44148: Flags [P.], seq 479783:489401, ack 869, win 65535, length 9618
19:58:57.805137 IP 10.0.2.15.44148 > 151.101.117.164.443: Flags [.], ack 489401, win 65535, length 0
19:58:57.806482 IP 151.101.117.164.443 > 10.0.2.15.44148: Flags [P.], seq 489401:492149, ack 869, win 65535, length 2748
19:58:57.806553 IP 10.0.2.15.44148 > 151.101.117.164.443: Flags [.], ack 492149, win 65535, length 0
19:58:57.806947 IP 151.101.117.164.443 > 10.0.2.15.44148: Flags [P.], seq 492149:496271, ack 869, win 65535, length 4122
19:58:57.806988 IP 151.101.117.164.443 > 10.0.2.15.44148: Flags [P.], seq 496271:500393, ack 869, win 65535, length 4122
19:58:57.807001 IP 10.0.2.15.44148 > 151.101.117.164.443: Flags [.], ack 496271, win 65535, length 0
19:58:57.807023 IP 10.0.2.15.44148 > 151.101.117.164.443: Flags [.], ack 500393, win 65535, length 0
19:58:57.807847 IP 151.101.117.164.443 > 10.0.2.15.44148: Flags [P.], seq 500393:505889, ack 869, win 65535, length 5496
19:58:57.807849 IP 151.101.117.164.443 > 10.0.2.15.44148: Flags [P.], seq 505889:510011, ack 869, win 65535, length 4122
19:58:57.807863 IP 10.0.2.15.44148 > 151.101.117.164.443: Flags [.], ack 505889, win 65535, length 0
19:58:57.807884 IP 10.0.2.15.44148 > 151.101.117.164.443: Flags [.], ack 510011, win 65535, length 0
19:58:57.809195 IP 151.101.117.164.443 > 10.0.2.15.44148: Flags [P.], seq 510011:514133, ack 869, win 65535, length 4122
19:58:57.809212 IP 10.0.2.15.44148 > 151.101.117.164.443: Flags [.], ack 514133, win 65535, length 0
19:58:57.810490 IP 151.101.117.164.443 > 10.0.2.15.44148: Flags [P.], seq 514133:518255, ack 869, win 65535, length 4122
19:58:57.810512 IP 10.0.2.15.44148 > 151.101.117.164.443: Flags [.], ack 518255, win 65535, length 0
19:58:57.811329 IP 151.101.117.164.443 > 10.0.2.15.44148: Flags [P.], seq 518255:519629, ack 869, win 65535, length 1374
19:58:57.812076 IP 151.101.117.164.443 > 10.0.2.15.44148: Flags [P.], seq 519629:531995, ack 869, win 65535, length 12366
19:58:57.812093 IP 10.0.2.15.44148 > 151.101.117.164.443: Flags [.], ack 531995, win 65535, length 0
19:58:57.813233 IP 151.101.117.164.443 > 10.0.2.15.44148: Flags [P.], seq 531995:540239, ack 869, win 65535, length 8244
19:58:57.813234 IP 151.101.117.164.443 > 10.0.2.15.44148: Flags [P.], seq 540239:541613, ack 869, win 65535, length 1374
19:58:57.813251 IP 10.0.2.15.44148 > 151.101.117.164.443: Flags [.], ack 540239, win 65535, length 0
19:58:57.814345 IP 151.101.117.164.443 > 10.0.2.15.44148: Flags [P.], seq 541613:548483, ack 869, win 65535, length 6870
19:58:57.814363 IP 10.0.2.15.44148 > 151.101.117.164.443: Flags [.], ack 548483, win 65535, length 0
19:58:57.814475 IP 151.101.117.164.443 > 10.0.2.15.44148: Flags [P.], seq 548483:551231, ack 869, win 65535, length 2748
19:58:57.814482 IP 10.0.2.15.44148 > 151.101.117.164.443: Flags [.], ack 551231, win 65535, length 0
19:58:57.815746 IP 151.101.117.164.443 > 10.0.2.15.44148: Flags [P.], seq 551231:556727, ack 869, win 65535, length 5496
19:58:57.815763 IP 10.0.2.15.44148 > 151.101.117.164.443: Flags [.], ack 556727, win 65535, length 0
19:58:57.817079 IP 151.101.117.164.443 > 10.0.2.15.44148: Flags [P.], seq 556727:564971, ack 869, win 65535, length 8244
19:58:57.817103 IP 10.0.2.15.44148 > 151.101.117.164.443: Flags [.], ack 564971, win 65535, length 0
19:58:57.817961 IP 151.101.117.164.443 > 10.0.2.15.44148: Flags [P.], seq 564971:570467, ack 869, win 65535, length 5496
19:58:57.817973 IP 10.0.2.15.44148 > 151.101.117.164.443: Flags [.], ack 570467, win 65535, length 0
19:58:57.819487 IP 151.101.117.164.443 > 10.0.2.15.44148: Flags [P.], seq 570467:578711, ack 869, win 65535, length 8244
19:58:57.819505 IP 10.0.2.15.44148 > 151.101.117.164.443: Flags [.], ack 578711, win 65535, length 0
19:58:57.820826 IP 151.101.117.164.443 > 10.0.2.15.44148: Flags [P.], seq 578711:586955, ack 869, win 65535, length 8244
19:58:57.820828 IP 151.101.117.164.443 > 10.0.2.15.44148: Flags [P.], seq 586955:588329, ack 869, win 65535, length 1374
19:58:57.820851 IP 10.0.2.15.44148 > 151.101.117.164.443: Flags [.], ack 586955, win 65535, length 0
19:58:57.822197 IP 151.101.117.164.443 > 10.0.2.15.44148: Flags [P.], seq 588329:593825, ack 869, win 65535, length 5496
19:58:57.822217 IP 10.0.2.15.44148 > 151.101.117.164.443: Flags [.], ack 593825, win 65535, length 0
19:58:57.823117 IP 151.101.117.164.443 > 10.0.2.15.44148: Flags [P.], seq 593825:602069, ack 869, win 65535, length 8244
19:58:57.823119 IP 151.101.117.164.443 > 10.0.2.15.44148: Flags [P.], seq 602069:603443, ack 869, win 65535, length 1374
19:58:57.823140 IP 10.0.2.15.44148 > 151.101.117.164.443: Flags [.], ack 602069, win 65535, length 0
19:58:57.824920 IP 151.101.117.164.443 > 10.0.2.15.44148: Flags [P.], seq 603443:608939, ack 869, win 65535, length 5496
19:58:57.825034 IP 10.0.2.15.44148 > 151.101.117.164.443: Flags [.], ack 608939, win 65535, length 0
19:58:57.825454 IP 151.101.117.164.443 > 10.0.2.15.44148: Flags [P.], seq 608939:613061, ack 869, win 65535, length 4122
19:58:57.825456 IP 151.101.117.164.443 > 10.0.2.15.44148: Flags [P.], seq 613061:618557, ack 869, win 65535, length 5496
19:58:57.825471 IP 10.0.2.15.44148 > 151.101.117.164.443: Flags [.], ack 613061, win 65535, length 0
19:58:57.825490 IP 10.0.2.15.44148 > 151.101.117.164.443: Flags [.], ack 618557, win 65535, length 0
19:58:57.826103 IP 151.101.117.164.443 > 10.0.2.15.44148: Flags [P.], seq 618557:626801, ack 869, win 65535, length 8244
19:58:57.826105 IP 151.101.117.164.443 > 10.0.2.15.44148: Flags [P.], seq 626801:628175, ack 869, win 65535, length 1374
19:58:57.826119 IP 10.0.2.15.44148 > 151.101.117.164.443: Flags [.], ack 626801, win 65535, length 0
19:58:57.827795 IP 151.101.117.164.443 > 10.0.2.15.44148: Flags [P.], seq 628175:633671, ack 869, win 65535, length 5496
19:58:57.827819 IP 10.0.2.15.44148 > 151.101.117.164.443: Flags [.], ack 633671, win 65535, length 0
19:58:57.828135 IP 151.101.117.164.443 > 10.0.2.15.44148: Flags [P.], seq 633671:637793, ack 869, win 65535, length 4122
19:58:57.828147 IP 10.0.2.15.44148 > 151.101.117.164.443: Flags [.], ack 637793, win 65535, length 0
19:58:57.828489 IP 151.101.117.164.443 > 10.0.2.15.44148: Flags [P.], seq 637793:643289, ack 869, win 65535, length 5496
19:58:57.828496 IP 10.0.2.15.44148 > 151.101.117.164.443: Flags [.], ack 643289, win 65535, length 0
19:58:57.828983 IP 151.101.117.164.443 > 10.0.2.15.44148: Flags [P.], seq 643289:648785, ack 869, win 65535, length 5496
19:58:57.828994 IP 10.0.2.15.44148 > 151.101.117.164.443: Flags [.], ack 648785, win 65535, length 0
19:58:57.830509 IP 151.101.117.164.443 > 10.0.2.15.44148: Flags [P.], seq 648785:655655, ack 869, win 65535, length 6870
19:58:57.830527 IP 10.0.2.15.44148 > 151.101.117.164.443: Flags [.], ack 655655, win 65535, length 0
19:58:57.831384 IP 151.101.117.164.443 > 10.0.2.15.44148: Flags [P.], seq 655655:658403, ack 869, win 65535, length 2748
19:58:57.831403 IP 10.0.2.15.44148 > 151.101.117.164.443: Flags [.], ack 658403, win 65535, length 0
19:58:57.833552 IP 151.101.117.164.443 > 10.0.2.15.44148: Flags [P.], seq 658403:674891, ack 869, win 65535, length 16488
19:58:57.833572 IP 10.0.2.15.44148 > 151.101.117.164.443: Flags [.], ack 674891, win 65535, length 0
19:58:57.834919 IP 151.101.117.164.443 > 10.0.2.15.44148: Flags [P.], seq 674891:680387, ack 869, win 65535, length 5496
19:58:57.834938 IP 10.0.2.15.44148 > 151.101.117.164.443: Flags [.], ack 680387, win 65535, length 0
19:58:57.835780 IP 151.101.117.164.443 > 10.0.2.15.44148: Flags [P.], seq 680387:685883, ack 869, win 65535, length 5496
19:58:57.835782 IP 151.101.117.164.443 > 10.0.2.15.44148: Flags [P.], seq 685883:687257, ack 869, win 65535, length 1374
19:58:57.835849 IP 10.0.2.15.44148 > 151.101.117.164.443: Flags [.], ack 685883, win 65535, length 0
19:58:57.836104 IP 151.101.117.164.443 > 10.0.2.15.44148: Flags [P.], seq 687257:691379, ack 869, win 65535, length 4122
19:58:57.836114 IP 10.0.2.15.44148 > 151.101.117.164.443: Flags [.], ack 691379, win 65535, length 0
19:58:57.836233 IP 151.101.117.164.443 > 10.0.2.15.44148: Flags [P.], seq 691379:696875, ack 869, win 65535, length 5496
19:58:57.836270 IP 10.0.2.15.44148 > 151.101.117.164.443: Flags [.], ack 696875, win 65535, length 0
19:58:57.838169 IP 151.101.117.164.443 > 10.0.2.15.44148: Flags [P.], seq 696875:705119, ack 869, win 65535, length 8244
19:58:57.838189 IP 10.0.2.15.44148 > 151.101.117.164.443: Flags [.], ack 705119, win 65535, length 0
19:58:57.839218 IP 151.101.117.164.443 > 10.0.2.15.44148: Flags [P.], seq 705119:711989, ack 869, win 65535, length 6870
19:58:57.839237 IP 10.0.2.15.44148 > 151.101.117.164.443: Flags [.], ack 711989, win 65535, length 0
19:58:57.841045 IP 151.101.117.164.443 > 10.0.2.15.44148: Flags [P.], seq 711989:721607, ack 869, win 65535, length 9618
19:58:57.841182 IP 10.0.2.15.44148 > 151.101.117.164.443: Flags [.], ack 721607, win 65535, length 0
19:58:57.842472 IP 151.101.117.164.443 > 10.0.2.15.44148: Flags [P.], seq 721607:731225, ack 869, win 65535, length 9618
19:58:57.842492 IP 10.0.2.15.44148 > 151.101.117.164.443: Flags [.], ack 731225, win 65535, length 0
19:58:57.843577 IP 151.101.117.164.443 > 10.0.2.15.44148: Flags [P.], seq 731225:740843, ack 869, win 65535, length 9618
19:58:57.843597 IP 10.0.2.15.44148 > 151.101.117.164.443: Flags [.], ack 740843, win 65535, length 0
19:58:57.845040 IP 151.101.117.164.443 > 10.0.2.15.44148: Flags [P.], seq 740843:751835, ack 869, win 65535, length 10992
19:58:57.845066 IP 151.101.117.164.443 > 10.0.2.15.44148: Flags [P.], seq 751835:755957, ack 869, win 65535, length 4122
19:58:57.845321 IP 10.0.2.15.44148 > 151.101.117.164.443: Flags [.], ack 755957, win 65535, length 0
19:58:57.845909 IP 151.101.117.164.443 > 10.0.2.15.44148: Flags [P.], seq 755957:757331, ack 869, win 65535, length 1374
19:58:57.846628 IP 151.101.117.164.443 > 10.0.2.15.44148: Flags [P.], seq 757331:764201, ack 869, win 65535, length 6870
19:58:57.846647 IP 10.0.2.15.44148 > 151.101.117.164.443: Flags [.], ack 764201, win 65535, length 0
19:58:57.847110 IP 151.101.117.164.443 > 10.0.2.15.44148: Flags [P.], seq 764201:769697, ack 869, win 65535, length 5496
19:58:57.847457 IP 10.0.2.15.44148 > 151.101.117.164.443: Flags [.], ack 769697, win 65535, length 0
19:58:57.847899 IP 151.101.117.164.443 > 10.0.2.15.44148: Flags [P.], seq 769697:773819, ack 869, win 65535, length 4122
19:58:57.847966 IP 10.0.2.15.44148 > 151.101.117.164.443: Flags [.], ack 773819, win 65535, length 0
19:58:57.849483 IP 151.101.117.164.443 > 10.0.2.15.44148: Flags [P.], seq 773819:780689, ack 869, win 65535, length 6870
19:58:57.849503 IP 10.0.2.15.44148 > 151.101.117.164.443: Flags [.], ack 780689, win 65535, length 0
19:58:57.850307 IP 151.101.117.164.443 > 10.0.2.15.44148: Flags [P.], seq 780689:788933, ack 869, win 65535, length 8244
19:58:57.850308 IP 151.101.117.164.443 > 10.0.2.15.44148: Flags [P.], seq 788933:790307, ack 869, win 65535, length 1374
19:58:57.850322 IP 10.0.2.15.44148 > 151.101.117.164.443: Flags [.], ack 788933, win 65535, length 0
19:58:57.851540 IP 151.101.117.164.443 > 10.0.2.15.44148: Flags [P.], seq 790307:799925, ack 869, win 65535, length 9618
19:58:57.851705 IP 10.0.2.15.44148 > 151.101.117.164.443: Flags [.], ack 799925, win 65535, length 0
19:58:57.852328 IP 151.101.117.164.443 > 10.0.2.15.44148: Flags [P.], seq 799925:805421, ack 869, win 65535, length 5496
19:58:57.852331 IP 151.101.117.164.443 > 10.0.2.15.44148: Flags [P.], seq 805421:809543, ack 869, win 65535, length 4122
19:58:57.852397 IP 10.0.2.15.44148 > 151.101.117.164.443: Flags [.], ack 809543, win 65535, length 0
19:58:57.853857 IP 151.101.117.164.443 > 10.0.2.15.44148: Flags [P.], seq 809543:815039, ack 869, win 65535, length 5496
19:58:57.853877 IP 10.0.2.15.44148 > 151.101.117.164.443: Flags [.], ack 815039, win 65535, length 0
19:58:57.854783 IP 151.101.117.164.443 > 10.0.2.15.44148: Flags [P.], seq 815039:820535, ack 869, win 65535, length 5496
19:58:57.854799 IP 10.0.2.15.44148 > 151.101.117.164.443: Flags [.], ack 820535, win 65535, length 0
19:58:57.856309 IP 151.101.117.164.443 > 10.0.2.15.44148: Flags [P.], seq 820535:830153, ack 869, win 65535, length 9618
19:58:57.856401 IP 10.0.2.15.44148 > 151.101.117.164.443: Flags [.], ack 830153, win 65535, length 0
19:58:57.857006 IP 151.101.117.164.443 > 10.0.2.15.44148: Flags [P.], seq 830153:837023, ack 869, win 65535, length 6870
19:58:57.857109 IP 10.0.2.15.44148 > 151.101.117.164.443: Flags [.], ack 837023, win 65535, length 0
19:58:57.858468 IP 151.101.117.164.443 > 10.0.2.15.44148: Flags [P.], seq 837023:845267, ack 869, win 65535, length 8244
19:58:57.858489 IP 10.0.2.15.44148 > 151.101.117.164.443: Flags [.], ack 845267, win 65535, length 0
19:58:57.859329 IP 151.101.117.164.443 > 10.0.2.15.44148: Flags [P.], seq 845267:853511, ack 869, win 65535, length 8244
19:58:57.859343 IP 10.0.2.15.44148 > 151.101.117.164.443: Flags [.], ack 853511, win 65535, length 0
19:58:57.860546 IP 151.101.117.164.443 > 10.0.2.15.44148: Flags [P.], seq 853511:863129, ack 869, win 65535, length 9618
19:58:57.860653 IP 10.0.2.15.44148 > 151.101.117.164.443: Flags [.], ack 863129, win 65535, length 0
19:58:57.861914 IP 151.101.117.164.443 > 10.0.2.15.44148: Flags [P.], seq 863129:871373, ack 869, win 65535, length 8244
19:58:57.861917 IP 151.101.117.164.443 > 10.0.2.15.44148: Flags [P.], seq 871373:874121, ack 869, win 65535, length 2748
19:58:57.861948 IP 151.101.117.164.443 > 10.0.2.15.44148: Flags [P.], seq 874121:878243, ack 869, win 65535, length 4122
19:58:57.862010 IP 10.0.2.15.44148 > 151.101.117.164.443: Flags [.], ack 878243, win 65535, length 0
19:58:57.863697 IP 151.101.117.164.443 > 10.0.2.15.44148: Flags [P.], seq 878243:886487, ack 869, win 65535, length 8244
19:58:57.863715 IP 10.0.2.15.44148 > 151.101.117.164.443: Flags [.], ack 886487, win 65535, length 0
19:58:57.865242 IP 151.101.117.164.443 > 10.0.2.15.44148: Flags [P.], seq 886487:896105, ack 869, win 65535, length 9618
19:58:57.865245 IP 151.101.117.164.443 > 10.0.2.15.44148: Flags [P.], seq 896105:898853, ack 869, win 65535, length 2748
19:58:57.865316 IP 151.101.117.164.443 > 10.0.2.15.44148: Flags [P.], seq 898853:901601, ack 869, win 65535, length 2748
19:58:57.865432 IP 10.0.2.15.44148 > 151.101.117.164.443: Flags [.], ack 901601, win 65535, length 0
19:58:57.867395 IP 151.101.117.164.443 > 10.0.2.15.44148: Flags [P.], seq 901601:907097, ack 869, win 65535, length 5496
19:58:57.867418 IP 10.0.2.15.44148 > 151.101.117.164.443: Flags [.], ack 907097, win 65535, length 0
19:58:57.867795 IP 151.101.117.164.443 > 10.0.2.15.44148: Flags [P.], seq 907097:913967, ack 869, win 65535, length 6870
19:58:57.867874 IP 10.0.2.15.44148 > 151.101.117.164.443: Flags [.], ack 913967, win 65535, length 0
19:58:57.868164 IP 151.101.117.164.443 > 10.0.2.15.44148: Flags [P.], seq 913967:916715, ack 869, win 65535, length 2748
19:58:57.868178 IP 10.0.2.15.44148 > 151.101.117.164.443: Flags [.], ack 916715, win 65535, length 0
19:58:57.868361 IP 151.101.117.164.443 > 10.0.2.15.44148: Flags [P.], seq 916715:922211, ack 869, win 65535, length 5496
19:58:57.868362 IP 151.101.117.164.443 > 10.0.2.15.44148: Flags [P.], seq 922211:926333, ack 869, win 65535, length 4122
19:58:57.868415 IP 10.0.2.15.44148 > 151.101.117.164.443: Flags [.], ack 926333, win 65535, length 0
19:58:57.870273 IP 151.101.117.164.443 > 10.0.2.15.44148: Flags [P.], seq 926333:933203, ack 869, win 65535, length 6870
19:58:57.870275 IP 151.101.117.164.443 > 10.0.2.15.44148: Flags [P.], seq 933203:935951, ack 869, win 65535, length 2748
19:58:57.870276 IP 151.101.117.164.443 > 10.0.2.15.44148: Flags [P.], seq 935951:938699, ack 869, win 65535, length 2748
19:58:57.870297 IP 10.0.2.15.44148 > 151.101.117.164.443: Flags [.], ack 933203, win 65535, length 0
19:58:57.870343 IP 151.101.117.164.443 > 10.0.2.15.44148: Flags [P.], seq 938699:941447, ack 869, win 65535, length 2748
19:58:57.870604 IP 10.0.2.15.44148 > 151.101.117.164.443: Flags [.], ack 941447, win 65535, length 0
19:58:57.871114 IP 151.101.117.164.443 > 10.0.2.15.44148: Flags [P.], seq 941447:946943, ack 869, win 65535, length 5496
19:58:57.871124 IP 10.0.2.15.44148 > 151.101.117.164.443: Flags [.], ack 946943, win 65535, length 0
19:58:57.871299 IP 151.101.117.164.443 > 10.0.2.15.44148: Flags [P.], seq 946943:949691, ack 869, win 65535, length 2748
19:58:57.871306 IP 10.0.2.15.44148 > 151.101.117.164.443: Flags [.], ack 949691, win 65535, length 0
19:58:57.872125 IP 151.101.117.164.443 > 10.0.2.15.44148: Flags [P.], seq 949691:957935, ack 869, win 65535, length 8244
19:58:57.872185 IP 10.0.2.15.44148 > 151.101.117.164.443: Flags [.], ack 957935, win 65535, length 0
19:58:57.873773 IP 151.101.117.164.443 > 10.0.2.15.44148: Flags [P.], seq 957935:967553, ack 869, win 65535, length 9618
19:58:57.873859 IP 10.0.2.15.44148 > 151.101.117.164.443: Flags [.], ack 967553, win 65535, length 0
19:58:57.875726 IP 151.101.117.164.443 > 10.0.2.15.44148: Flags [P.], seq 967553:979919, ack 869, win 65535, length 12366
19:58:57.875762 IP 151.101.117.164.443 > 10.0.2.15.44148: Flags [P.], seq 979919:981293, ack 869, win 65535, length 1374
19:58:57.875835 IP 10.0.2.15.44148 > 151.101.117.164.443: Flags [.], ack 981293, win 65535, length 0
19:58:57.876520 IP 151.101.117.164.443 > 10.0.2.15.44148: Flags [P.], seq 981293:988163, ack 869, win 65535, length 6870
19:58:57.876531 IP 10.0.2.15.44148 > 151.101.117.164.443: Flags [.], ack 988163, win 65535, length 0
19:58:57.876761 IP 151.101.117.164.443 > 10.0.2.15.44148: Flags [P.], seq 988163:989537, ack 869, win 65535, length 1374
19:58:57.877680 IP 151.101.117.164.443 > 10.0.2.15.44148: Flags [P.], seq 989537:990911, ack 869, win 65535, length 1374
19:58:57.877704 IP 10.0.2.15.44148 > 151.101.117.164.443: Flags [.], ack 990911, win 65535, length 0
19:58:57.879045 IP 151.101.117.164.443 > 10.0.2.15.44148: Flags [P.], seq 990911:1000529, ack 869, win 65535, length 9618
19:58:57.879047 IP 151.101.117.164.443 > 10.0.2.15.44148: Flags [.], seq 1000529:1003449, ack 869, win 65535, length 2920
19:58:57.879333 IP 151.101.117.164.443 > 10.0.2.15.44148: Flags [P.], seq 1003449:1006025, ack 869, win 65535, length 2576
19:58:57.879627 IP 10.0.2.15.44148 > 151.101.117.164.443: Flags [.], ack 1006025, win 65535, length 0
19:58:57.880653 IP 151.101.117.164.443 > 10.0.2.15.44148: Flags [P.], seq 1006025:1007399, ack 869, win 65535, length 1374
19:58:57.881612 IP 151.101.117.164.443 > 10.0.2.15.44148: Flags [P.], seq 1007399:1014269, ack 869, win 65535, length 6870
19:58:57.881626 IP 10.0.2.15.44148 > 151.101.117.164.443: Flags [.], ack 1014269, win 65535, length 0
19:58:57.882214 IP 151.101.117.164.443 > 10.0.2.15.44148: Flags [P.], seq 1014269:1018391, ack 869, win 65535, length 4122
19:58:57.882216 IP 151.101.117.164.443 > 10.0.2.15.44148: Flags [P.], seq 1018391:1022513, ack 869, win 65535, length 4122
19:58:57.882270 IP 10.0.2.15.44148 > 151.101.117.164.443: Flags [.], ack 1022513, win 65535, length 0
19:58:57.883212 IP 151.101.117.164.443 > 10.0.2.15.44148: Flags [P.], seq 1022513:1029383, ack 869, win 65535, length 6870
19:58:57.883223 IP 10.0.2.15.44148 > 151.101.117.164.443: Flags [.], ack 1029383, win 65535, length 0
19:58:57.883344 IP 151.101.117.164.443 > 10.0.2.15.44148: Flags [P.], seq 1029383:1030757, ack 869, win 65535, length 1374
19:58:57.884236 IP 151.101.117.164.443 > 10.0.2.15.44148: Flags [P.], seq 1030757:1039001, ack 869, win 65535, length 8244
19:58:57.884251 IP 10.0.2.15.44148 > 151.101.117.164.443: Flags [.], ack 1039001, win 65535, length 0
19:58:57.885139 IP 151.101.117.164.443 > 10.0.2.15.44148: Flags [P.], seq 1039001:1045871, ack 869, win 65535, length 6870
19:58:57.885141 IP 151.101.117.164.443 > 10.0.2.15.44148: Flags [.], seq 1045871:1047331, ack 869, win 65535, length 1460
19:58:57.885159 IP 10.0.2.15.44148 > 151.101.117.164.443: Flags [.], ack 1045871, win 65535, length 0
19:58:57.885441 IP 151.101.117.164.443 > 10.0.2.15.44148: Flags [P.], seq 1047331:1049993, ack 869, win 65535, length 2662
19:58:57.885442 IP 151.101.117.164.443 > 10.0.2.15.44148: Flags [P.], seq 1049993:1052741, ack 869, win 65535, length 2748
19:58:57.885443 IP 151.101.117.164.443 > 10.0.2.15.44148: Flags [P.], seq 1052741:1054115, ack 869, win 65535, length 1374
19:58:57.885480 IP 10.0.2.15.44148 > 151.101.117.164.443: Flags [.], ack 1054115, win 65535, length 0
19:58:57.887355 IP 151.101.117.164.443 > 10.0.2.15.44148: Flags [P.], seq 1054115:1063733, ack 869, win 65535, length 9618
19:58:57.887357 IP 151.101.117.164.443 > 10.0.2.15.44148: Flags [P.], seq 1063733:1066481, ack 869, win 65535, length 2748
19:58:57.887402 IP 10.0.2.15.44148 > 151.101.117.164.443: Flags [.], ack 1063733, win 65535, length 0
19:58:57.887505 IP 151.101.117.164.443 > 10.0.2.15.44148: Flags [P.], seq 1066481:1067855, ack 869, win 65535, length 1374
19:58:57.887506 IP 151.101.117.164.443 > 10.0.2.15.44148: Flags [P.], seq 1067855:1070603, ack 869, win 65535, length 2748
19:58:57.887507 IP 151.101.117.164.443 > 10.0.2.15.44148: Flags [P.], seq 1070603:1071977, ack 869, win 65535, length 1374
19:58:57.887575 IP 10.0.2.15.44148 > 151.101.117.164.443: Flags [.], ack 1071977, win 65535, length 0
19:58:57.888762 IP 151.101.117.164.443 > 10.0.2.15.44148: Flags [P.], seq 1071977:1078847, ack 869, win 65535, length 6870
19:58:57.888765 IP 151.101.117.164.443 > 10.0.2.15.44148: Flags [P.], seq 1078847:1082969, ack 869, win 65535, length 4122
19:58:57.888798 IP 10.0.2.15.44148 > 151.101.117.164.443: Flags [.], ack 1078847, win 65535, length 0
19:58:57.889144 IP 10.0.2.15.44148 > 151.101.117.164.443: Flags [.], ack 1082969, win 65535, length 0
19:58:57.889178 IP 151.101.117.164.443 > 10.0.2.15.44148: Flags [P.], seq 1082969:1088465, ack 869, win 65535, length 5496
19:58:57.889214 IP 10.0.2.15.44148 > 151.101.117.164.443: Flags [.], ack 1088465, win 65535, length 0
19:58:57.889398 IP 151.101.117.164.443 > 10.0.2.15.44148: Flags [P.], seq 1088465:1091213, ack 869, win 65535, length 2748
19:58:57.889506 IP 151.101.117.164.443 > 10.0.2.15.44148: Flags [P.], seq 1091213:1095335, ack 869, win 65535, length 4122
19:58:57.889538 IP 10.0.2.15.44148 > 151.101.117.164.443: Flags [.], ack 1095335, win 65535, length 0
19:58:57.889785 IP 151.101.117.164.443 > 10.0.2.15.44148: Flags [P.], seq 1095335:1096709, ack 869, win 65535, length 1374
19:58:57.891652 IP 151.101.117.164.443 > 10.0.2.15.44148: Flags [P.], seq 1096709:1106327, ack 869, win 65535, length 9618
19:58:57.891670 IP 10.0.2.15.44148 > 151.101.117.164.443: Flags [.], ack 1106327, win 65535, length 0
19:58:57.892944 IP 151.101.117.164.443 > 10.0.2.15.44148: Flags [P.], seq 1106327:1114571, ack 869, win 65535, length 8244
19:58:57.892946 IP 151.101.117.164.443 > 10.0.2.15.44148: Flags [P.], seq 1114571:1121441, ack 869, win 65535, length 6870
19:58:57.892962 IP 10.0.2.15.44148 > 151.101.117.164.443: Flags [.], ack 1114571, win 65535, length 0
19:58:57.893053 IP 10.0.2.15.44148 > 151.101.117.164.443: Flags [.], ack 1121441, win 65535, length 0
19:58:57.895133 IP 151.101.117.164.443 > 10.0.2.15.44148: Flags [P.], seq 1121441:1129685, ack 869, win 65535, length 8244
19:58:57.895153 IP 10.0.2.15.44148 > 151.101.117.164.443: Flags [.], ack 1129685, win 65535, length 0
19:58:57.896043 IP 151.101.117.164.443 > 10.0.2.15.44148: Flags [P.], seq 1129685:1139303, ack 869, win 65535, length 9618
19:58:57.896280 IP 10.0.2.15.44148 > 151.101.117.164.443: Flags [.], ack 1139303, win 65535, length 0
19:58:57.897295 IP 151.101.117.164.443 > 10.0.2.15.44148: Flags [P.], seq 1139303:1144799, ack 869, win 65535, length 5496
19:58:57.897298 IP 151.101.117.164.443 > 10.0.2.15.44148: Flags [P.], seq 1144799:1148921, ack 869, win 65535, length 4122
19:58:57.897382 IP 10.0.2.15.44148 > 151.101.117.164.443: Flags [.], ack 1144799, win 65535, length 0
19:58:57.897559 IP 10.0.2.15.44148 > 151.101.117.164.443: Flags [.], ack 1148921, win 65535, length 0
19:58:57.898381 IP 151.101.117.164.443 > 10.0.2.15.44148: Flags [P.], seq 1148921:1155791, ack 869, win 65535, length 6870
19:58:57.898528 IP 151.101.117.164.443 > 10.0.2.15.44148: Flags [P.], seq 1155791:1159913, ack 869, win 65535, length 4122
19:58:57.898566 IP 10.0.2.15.44148 > 151.101.117.164.443: Flags [.], ack 1159913, win 65535, length 0
19:58:57.900258 IP 151.101.117.164.443 > 10.0.2.15.44148: Flags [P.], seq 1159913:1168157, ack 869, win 65535, length 8244
19:58:57.900309 IP 10.0.2.15.44148 > 151.101.117.164.443: Flags [.], ack 1168157, win 65535, length 0
19:58:57.902049 IP 151.101.117.164.443 > 10.0.2.15.44148: Flags [P.], seq 1168157:1177775, ack 869, win 65535, length 9618
19:58:57.902053 IP 151.101.117.164.443 > 10.0.2.15.44148: Flags [P.], seq 1177775:1181897, ack 869, win 65535, length 4122
19:58:57.902281 IP 151.101.117.164.443 > 10.0.2.15.44148: Flags [P.], seq 1181897:1184645, ack 869, win 65535, length 2748
19:58:57.902380 IP 10.0.2.15.44148 > 151.101.117.164.443: Flags [.], ack 1184645, win 65535, length 0
19:58:57.904854 IP 151.101.117.164.443 > 10.0.2.15.44148: Flags [P.], seq 1184645:1192889, ack 869, win 65535, length 8244
19:58:57.904859 IP 151.101.117.164.443 > 10.0.2.15.44148: Flags [P.], seq 1192889:1206629, ack 869, win 65535, length 13740
19:58:57.904918 IP 10.0.2.15.44148 > 151.101.117.164.443: Flags [.], ack 1192889, win 65535, length 0
19:58:57.905184 IP 151.101.117.164.443 > 10.0.2.15.44148: Flags [P.], seq 1206629:1212125, ack 869, win 65535, length 5496
19:58:57.905315 IP 151.101.117.164.443 > 10.0.2.15.44148: Flags [P.], seq 1212125:1214873, ack 869, win 65535, length 2748
19:58:57.905512 IP 151.101.117.164.443 > 10.0.2.15.44148: Flags [P.], seq 1214873:1218995, ack 869, win 65535, length 4122
19:58:57.905564 IP 10.0.2.15.44148 > 151.101.117.164.443: Flags [.], ack 1214873, win 65535, length 0
19:58:57.905662 IP 151.101.117.164.443 > 10.0.2.15.44148: Flags [P.], seq 1218995:1223117, ack 869, win 65535, length 4122
19:58:57.905710 IP 10.0.2.15.44148 > 151.101.117.164.443: Flags [.], ack 1223117, win 65535, length 0
19:58:57.907371 IP 151.101.117.164.443 > 10.0.2.15.44148: Flags [P.], seq 1223117:1228613, ack 869, win 65535, length 5496
19:58:57.907373 IP 151.101.117.164.443 > 10.0.2.15.44148: Flags [P.], seq 1228613:1229987, ack 869, win 65535, length 1374
19:58:57.907394 IP 10.0.2.15.44148 > 151.101.117.164.443: Flags [.], ack 1228613, win 65535, length 0
19:58:57.909602 IP 151.101.117.164.443 > 10.0.2.15.44148: Flags [P.], seq 1229987:1247849, ack 869, win 65535, length 17862
19:58:57.909634 IP 151.101.117.164.443 > 10.0.2.15.44148: Flags [P.], seq 1247849:1254719, ack 869, win 65535, length 6870
19:58:57.909635 IP 151.101.117.164.443 > 10.0.2.15.44148: Flags [P.], seq 1254719:1257467, ack 869, win 65535, length 2748
19:58:57.909636 IP 151.101.117.164.443 > 10.0.2.15.44148: Flags [P.], seq 1257467:1258841, ack 869, win 65535, length 1374
19:58:57.910049 IP 10.0.2.15.44148 > 151.101.117.164.443: Flags [.], ack 1258841, win 65535, length 0
19:58:57.911097 IP 151.101.117.164.443 > 10.0.2.15.44148: Flags [P.], seq 1258841:1265711, ack 869, win 65535, length 6870
19:58:57.911099 IP 151.101.117.164.443 > 10.0.2.15.44148: Flags [P.], seq 1265711:1269833, ack 869, win 65535, length 4122
19:58:57.911537 IP 10.0.2.15.44148 > 151.101.117.164.443: Flags [.], ack 1269833, win 65535, length 0
19:58:57.914281 IP 151.101.117.164.443 > 10.0.2.15.44148: Flags [P.], seq 1269833:1280825, ack 869, win 65535, length 10992
19:58:57.914300 IP 10.0.2.15.44148 > 151.101.117.164.443: Flags [.], ack 1280825, win 65535, length 0
19:58:57.914354 IP 151.101.117.164.443 > 10.0.2.15.44148: Flags [P.], seq 1280825:1286321, ack 869, win 65535, length 5496
19:58:57.914355 IP 151.101.117.164.443 > 10.0.2.15.44148: Flags [P.], seq 1286321:1287695, ack 869, win 65535, length 1374
19:58:57.914435 IP 10.0.2.15.44148 > 151.101.117.164.443: Flags [.], ack 1287695, win 65535, length 0
19:58:57.916386 IP 151.101.117.164.443 > 10.0.2.15.44148: Flags [P.], seq 1287695:1298687, ack 869, win 65535, length 10992
19:58:57.916407 IP 10.0.2.15.44148 > 151.101.117.164.443: Flags [.], ack 1298687, win 65535, length 0
19:58:57.916465 IP 151.101.117.164.443 > 10.0.2.15.44148: Flags [P.], seq 1298687:1302809, ack 869, win 65535, length 4122
19:58:57.916465 IP 151.101.117.164.443 > 10.0.2.15.44148: Flags [P.], seq 1302809:1304183, ack 869, win 65535, length 1374
19:58:57.916540 IP 10.0.2.15.44148 > 151.101.117.164.443: Flags [.], ack 1304183, win 65535, length 0
19:58:57.917327 IP 151.101.117.164.443 > 10.0.2.15.44148: Flags [P.], seq 1304183:1309679, ack 869, win 65535, length 5496
19:58:57.917330 IP 151.101.117.164.443 > 10.0.2.15.44148: Flags [P.], seq 1309679:1311053, ack 869, win 65535, length 1374
19:58:57.917331 IP 151.101.117.164.443 > 10.0.2.15.44148: Flags [P.], seq 1311053:1313801, ack 869, win 65535, length 2748
19:58:57.917343 IP 10.0.2.15.44148 > 151.101.117.164.443: Flags [.], ack 1309679, win 65535, length 0
19:58:57.917454 IP 151.101.117.164.443 > 10.0.2.15.44148: Flags [P.], seq 1313801:1317923, ack 869, win 65535, length 4122
19:58:57.917499 IP 10.0.2.15.44148 > 151.101.117.164.443: Flags [.], ack 1317923, win 65535, length 0
19:58:57.918705 IP 151.101.117.164.443 > 10.0.2.15.44148: Flags [P.], seq 1317923:1324793, ack 869, win 65535, length 6870
19:58:57.918708 IP 151.101.117.164.443 > 10.0.2.15.44148: Flags [P.], seq 1324793:1327541, ack 869, win 65535, length 2748
19:58:57.918709 IP 151.101.117.164.443 > 10.0.2.15.44148: Flags [P.], seq 1327541:1330289, ack 869, win 65535, length 2748
19:58:57.918812 IP 10.0.2.15.44148 > 151.101.117.164.443: Flags [.], ack 1324793, win 65535, length 0
19:58:57.918971 IP 10.0.2.15.44148 > 151.101.117.164.443: Flags [.], ack 1330289, win 65535, length 0
19:58:57.920087 IP 151.101.117.164.443 > 10.0.2.15.44148: Flags [P.], seq 1330289:1342655, ack 869, win 65535, length 12366
19:58:57.920428 IP 10.0.2.15.44148 > 151.101.117.164.443: Flags [.], ack 1342655, win 65535, length 0
19:58:57.922390 IP 151.101.117.164.443 > 10.0.2.15.44148: Flags [P.], seq 1342655:1352273, ack 869, win 65535, length 9618
19:58:57.922393 IP 151.101.117.164.443 > 10.0.2.15.44148: Flags [P.], seq 1352273:1353647, ack 869, win 65535, length 1374
19:58:57.922418 IP 10.0.2.15.44148 > 151.101.117.164.443: Flags [.], ack 1352273, win 65535, length 0
19:58:57.923381 IP 151.101.117.164.443 > 10.0.2.15.44148: Flags [P.], seq 1353647:1361891, ack 869, win 65535, length 8244
19:58:57.923383 IP 151.101.117.164.443 > 10.0.2.15.44148: Flags [.], seq 1361891:1364811, ack 869, win 65535, length 2920
19:58:57.923401 IP 10.0.2.15.44148 > 151.101.117.164.443: Flags [.], ack 1361891, win 65535, length 0
19:58:57.923875 IP 151.101.117.164.443 > 10.0.2.15.44148: Flags [P.], seq 1364811:1366013, ack 869, win 65535, length 1202
19:58:57.923876 IP 151.101.117.164.443 > 10.0.2.15.44148: Flags [P.], seq 1366013:1367387, ack 869, win 65535, length 1374
19:58:57.923935 IP 10.0.2.15.44148 > 151.101.117.164.443: Flags [.], ack 1367387, win 65535, length 0
19:58:57.924624 IP 151.101.117.164.443 > 10.0.2.15.44148: Flags [P.], seq 1367387:1375631, ack 869, win 65535, length 8244
19:58:57.924625 IP 151.101.117.164.443 > 10.0.2.15.44148: Flags [P.], seq 1375631:1377005, ack 869, win 65535, length 1374
19:58:57.924642 IP 10.0.2.15.44148 > 151.101.117.164.443: Flags [.], ack 1375631, win 65535, length 0
19:58:57.924868 IP 151.101.117.164.443 > 10.0.2.15.44148: Flags [P.], seq 1377005:1378379, ack 869, win 65535, length 1374
19:58:57.924869 IP 151.101.117.164.443 > 10.0.2.15.44148: Flags [P.], seq 1378379:1382501, ack 869, win 65535, length 4122
19:58:57.924878 IP 10.0.2.15.44148 > 151.101.117.164.443: Flags [.], ack 1378379, win 65535, length 0
19:58:57.924968 IP 151.101.117.164.443 > 10.0.2.15.44148: Flags [P.], seq 1382501:1383875, ack 869, win 65535, length 1374
19:58:57.924999 IP 10.0.2.15.44148 > 151.101.117.164.443: Flags [.], ack 1383875, win 65535, length 0
19:58:57.926710 IP 151.101.117.164.443 > 10.0.2.15.44148: Flags [P.], seq 1383875:1393493, ack 869, win 65535, length 9618
19:58:57.926712 IP 151.101.117.164.443 > 10.0.2.15.44148: Flags [P.], seq 1393493:1398989, ack 869, win 65535, length 5496
19:58:57.926944 IP 10.0.2.15.44148 > 151.101.117.164.443: Flags [.], ack 1398989, win 65535, length 0
19:58:57.928633 IP 151.101.117.164.443 > 10.0.2.15.44148: Flags [P.], seq 1398989:1408607, ack 869, win 65535, length 9618
19:58:57.928651 IP 10.0.2.15.44148 > 151.101.117.164.443: Flags [.], ack 1408607, win 65535, length 0
19:58:57.931075 IP 151.101.117.164.443 > 10.0.2.15.44148: Flags [P.], seq 1408607:1420973, ack 869, win 65535, length 12366
19:58:57.931243 IP 151.101.117.164.443 > 10.0.2.15.44148: Flags [P.], seq 1420973:1426469, ack 869, win 65535, length 5496
19:58:57.931384 IP 10.0.2.15.44148 > 151.101.117.164.443: Flags [.], ack 1426469, win 65535, length 0
19:58:57.931677 IP 151.101.117.164.443 > 10.0.2.15.44148: Flags [P.], seq 1426469:1427843, ack 869, win 65535, length 1374
19:58:57.931679 IP 151.101.117.164.443 > 10.0.2.15.44148: Flags [P.], seq 1427843:1431965, ack 869, win 65535, length 4122
19:58:57.931680 IP 151.101.117.164.443 > 10.0.2.15.44148: Flags [P.], seq 1431965:1433339, ack 869, win 65535, length 1374
19:58:57.931761 IP 10.0.2.15.44148 > 151.101.117.164.443: Flags [.], ack 1433339, win 65535, length 0
19:58:57.932423 IP 151.101.117.164.443 > 10.0.2.15.44148: Flags [P.], seq 1433339:1440209, ack 869, win 65535, length 6870
19:58:57.932425 IP 151.101.117.164.443 > 10.0.2.15.44148: Flags [P.], seq 1440209:1444331, ack 869, win 65535, length 4122
19:58:57.932439 IP 10.0.2.15.44148 > 151.101.117.164.443: Flags [.], ack 1440209, win 65535, length 0
19:58:57.932839 IP 151.101.117.164.443 > 10.0.2.15.44148: Flags [P.], seq 1444331:1447079, ack 869, win 65535, length 2748
19:58:57.932841 IP 151.101.117.164.443 > 10.0.2.15.44148: Flags [P.], seq 1447079:1452575, ack 869, win 65535, length 5496
19:58:57.933285 IP 151.101.117.164.443 > 10.0.2.15.44148: Flags [P.], seq 1452575:1453949, ack 869, win 65535, length 1374
19:58:57.933433 IP 10.0.2.15.44148 > 151.101.117.164.443: Flags [.], ack 1452575, win 65535, length 0
19:58:57.937141 IP 151.101.117.164.443 > 10.0.2.15.44148: Flags [P.], seq 1453949:1492421, ack 869, win 65535, length 38472
19:58:57.937429 IP 10.0.2.15.44148 > 151.101.117.164.443: Flags [.], ack 1492421, win 65535, length 0
19:58:57.937840 IP 151.101.117.164.443 > 10.0.2.15.44148: Flags [P.], seq 1492421:1497917, ack 869, win 65535, length 5496
19:58:57.937841 IP 151.101.117.164.443 > 10.0.2.15.44148: Flags [.], seq 1497917:1499377, ack 869, win 65535, length 1460
19:58:57.938223 IP 151.101.117.164.443 > 10.0.2.15.44148: Flags [P.], seq 1499377:1503413, ack 869, win 65535, length 4036
19:58:57.938444 IP 10.0.2.15.44148 > 151.101.117.164.443: Flags [.], ack 1503413, win 65535, length 0
19:58:57.939225 IP 151.101.117.164.443 > 10.0.2.15.44148: Flags [P.], seq 1503413:1508909, ack 869, win 65535, length 5496
19:58:57.939237 IP 10.0.2.15.44148 > 151.101.117.164.443: Flags [.], ack 1508909, win 65535, length 0
19:58:57.939590 IP 151.101.117.164.443 > 10.0.2.15.44148: Flags [P.], seq 1508909:1515779, ack 869, win 65535, length 6870
19:58:57.939630 IP 10.0.2.15.44148 > 151.101.117.164.443: Flags [.], ack 1515779, win 65535, length 0
19:58:57.939772 IP 151.101.117.164.443 > 10.0.2.15.44148: Flags [P.], seq 1515779:1518527, ack 869, win 65535, length 2748
19:58:57.939951 IP 151.101.117.164.443 > 10.0.2.15.44148: Flags [P.], seq 1518527:1521275, ack 869, win 65535, length 2748
19:58:57.940103 IP 151.101.117.164.443 > 10.0.2.15.44148: Flags [P.], seq 1521275:1524023, ack 869, win 65535, length 2748
19:58:57.940264 IP 151.101.117.164.443 > 10.0.2.15.44148: Flags [P.], seq 1524023:1525397, ack 869, win 65535, length 1374
19:58:57.940317 IP 10.0.2.15.44148 > 151.101.117.164.443: Flags [.], ack 1525397, win 65535, length 0
19:58:57.941214 IP 151.101.117.164.443 > 10.0.2.15.44148: Flags [P.], seq 1525397:1530893, ack 869, win 65535, length 5496
19:58:57.941234 IP 10.0.2.15.44148 > 151.101.117.164.443: Flags [.], ack 1530893, win 65535, length 0
19:58:57.942469 IP 151.101.117.164.443 > 10.0.2.15.44148: Flags [P.], seq 1530893:1540511, ack 869, win 65535, length 9618
19:58:57.942471 IP 151.101.117.164.443 > 10.0.2.15.44148: Flags [P.], seq 1540511:1541885, ack 869, win 65535, length 1374
19:58:57.942577 IP 10.0.2.15.44148 > 151.101.117.164.443: Flags [.], ack 1541885, win 65535, length 0
19:58:57.943569 IP 151.101.117.164.443 > 10.0.2.15.44148: Flags [P.], seq 1541885:1543259, ack 869, win 65535, length 1374
19:58:57.944623 IP 151.101.117.164.443 > 10.0.2.15.44148: Flags [P.], seq 1543259:1550129, ack 869, win 65535, length 6870
19:58:57.944647 IP 151.101.117.164.443 > 10.0.2.15.44148: Flags [P.], seq 1550129:1555625, ack 869, win 65535, length 5496
19:58:57.944770 IP 10.0.2.15.44148 > 151.101.117.164.443: Flags [.], ack 1555625, win 65535, length 0
19:58:57.944973 IP 151.101.117.164.443 > 10.0.2.15.44148: Flags [P.], seq 1555625:1559747, ack 869, win 65535, length 4122
19:58:57.945000 IP 10.0.2.15.44148 > 151.101.117.164.443: Flags [.], ack 1559747, win 65535, length 0
19:58:57.946923 IP 151.101.117.164.443 > 10.0.2.15.44148: Flags [P.], seq 1559747:1563869, ack 869, win 65535, length 4122
19:58:57.946939 IP 10.0.2.15.44148 > 151.101.117.164.443: Flags [.], ack 1563869, win 65535, length 0
19:58:57.950414 IP 151.101.117.164.443 > 10.0.2.15.44148: Flags [P.], seq 1563869:1572113, ack 869, win 65535, length 8244
19:58:57.950537 IP 10.0.2.15.44148 > 151.101.117.164.443: Flags [.], ack 1572113, win 65535, length 0
19:58:57.954210 IP 151.101.117.164.443 > 10.0.2.15.44148: Flags [P.], seq 1572113:1583105, ack 869, win 65535, length 10992
19:58:57.954678 IP 151.101.117.164.443 > 10.0.2.15.44148: Flags [P.], seq 1583105:1596845, ack 869, win 65535, length 13740
19:58:57.954844 IP 151.101.117.164.443 > 10.0.2.15.44148: Flags [P.], seq 1596845:1609211, ack 869, win 65535, length 12366
19:58:57.955211 IP 10.0.2.15.44148 > 151.101.117.164.443: Flags [.], ack 1609211, win 65535, length 0
19:58:57.955626 IP 151.101.117.164.443 > 10.0.2.15.44148: Flags [P.], seq 1609211:1620203, ack 869, win 65535, length 10992
19:58:57.955638 IP 10.0.2.15.44148 > 151.101.117.164.443: Flags [.], ack 1620203, win 65535, length 0
19:58:57.956321 IP 151.101.117.164.443 > 10.0.2.15.44148: Flags [P.], seq 1620203:1625699, ack 869, win 65535, length 5496
19:58:57.956323 IP 151.101.117.164.443 > 10.0.2.15.44148: Flags [P.], seq 1625699:1628447, ack 869, win 65535, length 2748
19:58:57.956324 IP 151.101.117.164.443 > 10.0.2.15.44148: Flags [P.], seq 1628447:1631195, ack 869, win 65535, length 2748
19:58:57.956418 IP 10.0.2.15.44148 > 151.101.117.164.443: Flags [.], ack 1625699, win 65535, length 0
19:58:57.956577 IP 151.101.117.164.443 > 10.0.2.15.44148: Flags [P.], seq 1631195:1633943, ack 869, win 65535, length 2748
19:58:57.956687 IP 10.0.2.15.44148 > 151.101.117.164.443: Flags [.], ack 1633943, win 65535, length 0
19:58:57.957327 IP 151.101.117.164.443 > 10.0.2.15.44148: Flags [P.], seq 1633943:1639439, ack 869, win 65535, length 5496
19:58:57.957329 IP 151.101.117.164.443 > 10.0.2.15.44148: Flags [P.], seq 1639439:1642187, ack 869, win 65535, length 2748
19:58:57.957341 IP 10.0.2.15.44148 > 151.101.117.164.443: Flags [.], ack 1639439, win 65535, length 0
19:58:57.957753 IP 151.101.117.164.443 > 10.0.2.15.44148: Flags [P.], seq 1642187:1647683, ack 869, win 65535, length 5496
19:58:57.957798 IP 10.0.2.15.44148 > 151.101.117.164.443: Flags [.], ack 1647683, win 65535, length 0
19:58:57.958600 IP 151.101.117.164.443 > 10.0.2.15.44148: Flags [P.], seq 1647683:1654553, ack 869, win 65535, length 6870
19:58:57.958922 IP 10.0.2.15.44148 > 151.101.117.164.443: Flags [.], ack 1654553, win 65535, length 0
19:58:57.959369 IP 151.101.117.164.443 > 10.0.2.15.44148: Flags [P.], seq 1654553:1657301, ack 869, win 65535, length 2748
19:58:57.959371 IP 151.101.117.164.443 > 10.0.2.15.44148: Flags [P.], seq 1657301:1664171, ack 869, win 65535, length 6870
19:58:57.959372 IP 151.101.117.164.443 > 10.0.2.15.44148: Flags [P.], seq 1664171:1665545, ack 869, win 65535, length 1374
19:58:57.959447 IP 10.0.2.15.44148 > 151.101.117.164.443: Flags [.], ack 1665545, win 65535, length 0
19:58:57.960111 IP 151.101.117.164.443 > 10.0.2.15.44148: Flags [P.], seq 1665545:1672415, ack 869, win 65535, length 6870
19:58:57.960124 IP 10.0.2.15.44148 > 151.101.117.164.443: Flags [.], ack 1672415, win 65535, length 0
19:58:57.960376 IP 151.101.117.164.443 > 10.0.2.15.44148: Flags [P.], seq 1672415:1676537, ack 869, win 65535, length 4122
19:58:57.960437 IP 10.0.2.15.44148 > 151.101.117.164.443: Flags [.], ack 1676537, win 65535, length 0
19:58:57.961189 IP 151.101.117.164.443 > 10.0.2.15.44148: Flags [P.], seq 1676537:1683407, ack 869, win 65535, length 6870
19:58:57.961191 IP 151.101.117.164.443 > 10.0.2.15.44148: Flags [P.], seq 1683407:1687529, ack 869, win 65535, length 4122
19:58:57.961331 IP 151.101.117.164.443 > 10.0.2.15.44148: Flags [P.], seq 1687529:1688903, ack 869, win 65535, length 1374
19:58:57.961493 IP 151.101.117.164.443 > 10.0.2.15.44148: Flags [P.], seq 1688903:1691651, ack 869, win 65535, length 2748
19:58:57.961513 IP 10.0.2.15.44148 > 151.101.117.164.443: Flags [.], ack 1688903, win 65535, length 0
19:58:57.961557 IP 151.101.117.164.443 > 10.0.2.15.44148: Flags [P.], seq 1691651:1693025, ack 869, win 65535, length 1374
19:58:57.961619 IP 10.0.2.15.44148 > 151.101.117.164.443: Flags [.], ack 1693025, win 65535, length 0
19:58:57.962430 IP 151.101.117.164.443 > 10.0.2.15.44148: Flags [P.], seq 1693025:1699895, ack 869, win 65535, length 6870
19:58:57.962444 IP 10.0.2.15.44148 > 151.101.117.164.443: Flags [.], ack 1699895, win 65535, length 0
19:58:57.962780 IP 151.101.117.164.443 > 10.0.2.15.44148: Flags [P.], seq 1699895:1704017, ack 869, win 65535, length 4122
19:58:57.962781 IP 151.101.117.164.443 > 10.0.2.15.44148: Flags [P.], seq 1704017:1705391, ack 869, win 65535, length 1374
19:58:57.962792 IP 10.0.2.15.44148 > 151.101.117.164.443: Flags [.], ack 1704017, win 65535, length 0

