19:56:56.599698 IP 10.0.2.15.38613 > 140.233.253.2.53: 59475+ A? www.nytimes.com. (33)
19:56:56.599742 IP 10.0.2.15.38613 > 140.233.253.2.53: 23149+ AAAA? www.nytimes.com. (33)
19:56:56.605011 IP 140.233.253.2.53 > 10.0.2.15.38613: 59475 3/0/0 CNAME www.prd.map.nytimes.com., CNAME nytimes.map.fastly.net., A 151.101.117.164 (111)
19:56:56.605013 IP 140.233.253.2.53 > 10.0.2.15.38613: 23149 2/1/0 CNAME www.prd.map.nytimes.com., CNAME nytimes.map.fastly.net. (153)
19:56:56.605320 IP 10.0.2.15.44102 > 151.101.117.164.443: Flags [S], seq 871108218, win 64240, options [mss 1460,sackOK,TS val 917619688 ecr 0,nop,wscale 6], length 0
19:56:56.620558 IP 151.101.117.164.443 > 10.0.2.15.44102: Flags [S.], seq 208896001, ack 871108219, win 65535, options [mss 1460], length 0
19:56:56.620697 IP 10.0.2.15.44102 > 151.101.117.164.443: Flags [.], ack 1, win 64240, length 0
19:56:56.629640 IP 10.0.2.15.44102 > 151.101.117.164.443: Flags [P.], seq 1:518, ack 1, win 64240, length 517
19:56:56.630023 IP 151.101.117.164.443 > 10.0.2.15.44102: Flags [.], ack 518, win 65535, length 0
19:56:56.648499 IP 151.101.117.164.443 > 10.0.2.15.44102: Flags [.], seq 1:2921, ack 518, win 65535, length 2920
19:56:56.648553 IP 10.0.2.15.44102 > 151.101.117.164.443: Flags [.], ack 2921, win 62780, length 0
19:56:56.648936 IP 151.101.117.164.443 > 10.0.2.15.44102: Flags [P.], seq 2921:4123, ack 518, win 65535, length 1202
19:56:56.648952 IP 10.0.2.15.44102 > 151.101.117.164.443: Flags [.], ack 4123, win 61578, length 0
19:56:56.651764 IP 151.101.117.164.443 > 10.0.2.15.44102: Flags [P.], seq 4123:5607, ack 518, win 65535, length 1484
19:56:56.651782 IP 10.0.2.15.44102 > 151.101.117.164.443: Flags [.], ack 5607, win 62780, length 0
19:56:56.653095 IP 10.0.2.15.44102 > 151.101.117.164.443: Flags [P.], seq 518:611, ack 5607, win 62780, length 93
19:56:56.653411 IP 151.101.117.164.443 > 10.0.2.15.44102: Flags [.], ack 611, win 65535, length 0
19:56:56.685946 IP 151.101.117.164.443 > 10.0.2.15.44102: Flags [P.], seq 5607:5658, ack 611, win 65535, length 51
19:56:56.686148 IP 10.0.2.15.44102 > 151.101.117.164.443: Flags [.], ack 5658, win 62780, length 0
19:56:56.688873 IP 10.0.2.15.44102 > 151.101.117.164.443: Flags [P.], seq 611:664, ack 5658, win 62780, length 53
19:56:56.688926 IP 10.0.2.15.44102 > 151.101.117.164.443: Flags [P.], seq 664:720, ack 5658, win 62780, length 56
19:56:56.689556 IP 151.101.117.164.443 > 10.0.2.15.44102: Flags [.], ack 664, win 65535, length 0
19:56:56.689579 IP 10.0.2.15.44102 > 151.101.117.164.443: Flags [P.], seq 720:831, ack 5658, win 62780, length 111
19:56:56.689701 IP 151.101.117.164.443 > 10.0.2.15.44102: Flags [.], ack 720, win 65535, length 0
19:56:56.690520 IP 151.101.117.164.443 > 10.0.2.15.44102: Flags [.], ack 831, win 65535, length 0
19:56:56.703073 IP 151.101.117.164.443 > 10.0.2.15.44102: Flags [P.], seq 5658:5753, ack 831, win 65535, length 95
19:56:56.703095 IP 10.0.2.15.44102 > 151.101.117.164.443: Flags [.], ack 5753, win 62780, length 0
19:56:56.703390 IP 10.0.2.15.44102 > 151.101.117.164.443: Flags [P.], seq 831:869, ack 5753, win 62780, length 38
19:56:56.703654 IP 151.101.117.164.443 > 10.0.2.15.44102: Flags [.], ack 869, win 65535, length 0
19:56:58.141801 IP 151.101.117.164.443 > 10.0.2.15.44102: Flags [P.], seq 5753:15371, ack 869, win 65535, length 9618
19:56:58.142205 IP 10.0.2.15.44102 > 151.101.117.164.443: Flags [.], ack 15371, win 58400, length 0
19:56:58.142677 IP 151.101.117.164.443 > 10.0.2.15.44102: Flags [.], seq 15371:27051, ack 869, win 65535, length 11680
19:56:58.142841 IP 10.0.2.15.44102 > 151.101.117.164.443: Flags [.], ack 27051, win 49640, length 0
19:56:58.143044 IP 151.101.117.164.443 > 10.0.2.15.44102: Flags [.], seq 27051:40191, ack 869, win 65535, length 13140
19:56:58.143073 IP 10.0.2.15.44102 > 151.101.117.164.443: Flags [.], ack 40191, win 40880, length 0
19:56:58.143330 IP 151.101.117.164.443 > 10.0.2.15.44102: Flags [P.], seq 40191:46973, ack 869, win 65535, length 6782
19:56:58.143354 IP 10.0.2.15.44102 > 151.101.117.164.443: Flags [.], ack 46973, win 36500, length 0
19:56:58.155836 IP 151.101.117.164.443 > 10.0.2.15.44102: Flags [P.], seq 46973:51095, ack 869, win 65535, length 4122
19:56:58.155862 IP 10.0.2.15.44102 > 151.101.117.164.443: Flags [.], ack 51095, win 61320, length 0
19:56:58.156758 IP 151.101.117.164.443 > 10.0.2.15.44102: Flags [P.], seq 51095:56591, ack 869, win 65535, length 5496
19:56:58.156773 IP 10.0.2.15.44102 > 151.101.117.164.443: Flags [.], ack 56591, win 61320, length 0
19:56:58.157771 IP 151.101.117.164.443 > 10.0.2.15.44102: Flags [P.], seq 56591:59339, ack 869, win 65535, length 2748
19:56:58.157787 IP 10.0.2.15.44102 > 151.101.117.164.443: Flags [.], ack 59339, win 62780, length 0
19:56:58.159268 IP 151.101.117.164.443 > 10.0.2.15.44102: Flags [P.], seq 59339:62087, ack 869, win 65535, length 2748
19:56:58.159287 IP 10.0.2.15.44102 > 151.101.117.164.443: Flags [.], ack 62087, win 62780, length 0
19:56:58.159812 IP 151.101.117.164.443 > 10.0.2.15.44102: Flags [P.], seq 62087:63461, ack 869, win 65535, length 1374
19:56:58.163752 IP 151.101.117.164.443 > 10.0.2.15.44102: Flags [P.], seq 63461:70331, ack 869, win 65535, length 6870
19:56:58.163854 IP 10.0.2.15.44102 > 151.101.117.164.443: Flags [.], ack 70331, win 62780, length 0
19:56:58.164549 IP 151.101.117.164.443 > 10.0.2.15.44102: Flags [P.], seq 70331:71705, ack 869, win 65535, length 1374
19:56:58.165702 IP 151.101.117.164.443 > 10.0.2.15.44102: Flags [P.], seq 71705:73079, ack 869, win 65535, length 1374
19:56:58.165724 IP 10.0.2.15.44102 > 151.101.117.164.443: Flags [.], ack 73079, win 65535, length 0
19:56:58.166325 IP 151.101.117.164.443 > 10.0.2.15.44102: Flags [P.], seq 73079:75827, ack 869, win 65535, length 2748
19:56:58.166337 IP 10.0.2.15.44102 > 151.101.117.164.443: Flags [.], ack 75827, win 65535, length 0
19:56:58.167731 IP 151.101.117.164.443 > 10.0.2.15.44102: Flags [P.], seq 75827:78575, ack 869, win 65535, length 2748
19:56:58.167748 IP 10.0.2.15.44102 > 151.101.117.164.443: Flags [.], ack 78575, win 65535, length 0
19:56:58.168556 IP 151.101.117.164.443 > 10.0.2.15.44102: Flags [P.], seq 78575:79949, ack 869, win 65535, length 1374
19:56:58.170723 IP 151.101.117.164.443 > 10.0.2.15.44102: Flags [P.], seq 79949:82697, ack 869, win 65535, length 2748
19:56:58.170743 IP 10.0.2.15.44102 > 151.101.117.164.443: Flags [.], ack 82697, win 65535, length 0
19:56:58.171999 IP 151.101.117.164.443 > 10.0.2.15.44102: Flags [P.], seq 82697:85445, ack 869, win 65535, length 2748
19:56:58.172019 IP 10.0.2.15.44102 > 151.101.117.164.443: Flags [.], ack 85445, win 65535, length 0
19:56:58.173143 IP 151.101.117.164.443 > 10.0.2.15.44102: Flags [P.], seq 85445:88193, ack 869, win 65535, length 2748
19:56:58.173164 IP 10.0.2.15.44102 > 151.101.117.164.443: Flags [.], ack 88193, win 65535, length 0
19:56:58.174535 IP 151.101.117.164.443 > 10.0.2.15.44102: Flags [P.], seq 88193:90941, ack 869, win 65535, length 2748
19:56:58.174555 IP 10.0.2.15.44102 > 151.101.117.164.443: Flags [.], ack 90941, win 65535, length 0
19:56:58.175282 IP 151.101.117.164.443 > 10.0.2.15.44102: Flags [P.], seq 90941:93689, ack 869, win 65535, length 2748
19:56:58.175296 IP 10.0.2.15.44102 > 151.101.117.164.443: Flags [.], ack 93689, win 65535, length 0
19:56:58.176353 IP 151.101.117.164.443 > 10.0.2.15.44102: Flags [P.], seq 93689:96437, ack 869, win 65535, length 2748
19:56:58.176364 IP 10.0.2.15.44102 > 151.101.117.164.443: Flags [.], ack 96437, win 65535, length 0
19:56:58.177403 IP 151.101.117.164.443 > 10.0.2.15.44102: Flags [P.], seq 96437:99185, ack 869, win 65535, length 2748
19:56:58.177415 IP 10.0.2.15.44102 > 151.101.117.164.443: Flags [.], ack 99185, win 65535, length 0
19:56:58.178508 IP 151.101.117.164.443 > 10.0.2.15.44102: Flags [P.], seq 99185:101933, ack 869, win 65535, length 2748
19:56:58.178521 IP 10.0.2.15.44102 > 151.101.117.164.443: Flags [.], ack 101933, win 65535, length 0
19:56:58.179357 IP 151.101.117.164.443 > 10.0.2.15.44102: Flags [P.], seq 101933:104681, ack 869, win 65535, length 2748
19:56:58.179367 IP 10.0.2.15.44102 > 151.101.117.164.443: Flags [.], ack 104681, win 65535, length 0
19:56:58.180266 IP 151.101.117.164.443 > 10.0.2.15.44102: Flags [P.], seq 104681:107429, ack 869, win 65535, length 2748
19:56:58.180277 IP 10.0.2.15.44102 > 151.101.117.164.443: Flags [.], ack 107429, win 65535, length 0
19:56:58.181433 IP 151.101.117.164.443 > 10.0.2.15.44102: Flags [P.], seq 107429:112925, ack 869, win 65535, length 5496
19:56:58.181446 IP 10.0.2.15.44102 > 151.101.117.164.443: Flags [.], ack 112925, win 65535, length 0
19:56:58.182500 IP 151.101.117.164.443 > 10.0.2.15.44102: Flags [P.], seq 112925:115673, ack 869, win 65535, length 2748
19:56:58.182511 IP 10.0.2.15.44102 > 151.101.117.164.443: Flags [.], ack 115673, win 65535, length 0
19:56:58.183567 IP 151.101.117.164.443 > 10.0.2.15.44102: Flags [P.], seq 115673:122543, ack 869, win 65535, length 6870
19:56:58.183580 IP 10.0.2.15.44102 > 151.101.117.164.443: Flags [.], ack 122543, win 65535, length 0
19:56:58.184581 IP 151.101.117.164.443 > 10.0.2.15.44102: Flags [P.], seq 122543:123917, ack 869, win 65535, length 1374
19:56:58.185723 IP 151.101.117.164.443 > 10.0.2.15.44102: Flags [P.], seq 123917:130787, ack 869, win 65535, length 6870
19:56:58.185739 IP 10.0.2.15.44102 > 151.101.117.164.443: Flags [.], ack 130787, win 65535, length 0
19:56:58.187031 IP 151.101.117.164.443 > 10.0.2.15.44102: Flags [P.], seq 130787:136283, ack 869, win 65535, length 5496
19:56:58.187049 IP 10.0.2.15.44102 > 151.101.117.164.443: Flags [.], ack 136283, win 65535, length 0
19:56:58.189069 IP 151.101.117.164.443 > 10.0.2.15.44102: Flags [P.], seq 136283:143153, ack 869, win 65535, length 6870
19:56:58.189071 IP 151.101.117.164.443 > 10.0.2.15.44102: Flags [P.], seq 143153:144527, ack 869, win 65535, length 1374
19:56:58.189092 IP 10.0.2.15.44102 > 151.101.117.164.443: Flags [.], ack 143153, win 65535, length 0
19:56:58.190017 IP 151.101.117.164.443 > 10.0.2.15.44102: Flags [P.], seq 144527:148649, ack 869, win 65535, length 4122
19:56:58.190030 IP 10.0.2.15.44102 > 151.101.117.164.443: Flags [.], ack 148649, win 65535, length 0
19:56:58.191029 IP 151.101.117.164.443 > 10.0.2.15.44102: Flags [P.], seq 148649:152771, ack 869, win 65535, length 4122
19:56:58.191045 IP 10.0.2.15.44102 > 151.101.117.164.443: Flags [.], ack 152771, win 65535, length 0
19:56:58.192120 IP 151.101.117.164.443 > 10.0.2.15.44102: Flags [P.], seq 152771:159641, ack 869, win 65535, length 6870
19:56:58.192121 IP 151.101.117.164.443 > 10.0.2.15.44102: Flags [P.], seq 159641:161015, ack 869, win 65535, length 1374
19:56:58.192138 IP 10.0.2.15.44102 > 151.101.117.164.443: Flags [.], ack 159641, win 65535, length 0
19:56:58.193232 IP 151.101.117.164.443 > 10.0.2.15.44102: Flags [P.], seq 161015:165137, ack 869, win 65535, length 4122
19:56:58.193246 IP 10.0.2.15.44102 > 151.101.117.164.443: Flags [.], ack 165137, win 65535, length 0
19:56:58.194153 IP 151.101.117.164.443 > 10.0.2.15.44102: Flags [P.], seq 165137:169259, ack 869, win 65535, length 4122
19:56:58.194167 IP 10.0.2.15.44102 > 151.101.117.164.443: Flags [.], ack 169259, win 65535, length 0
19:56:58.195362 IP 151.101.117.164.443 > 10.0.2.15.44102: Flags [P.], seq 169259:174755, ack 869, win 65535, length 5496
19:56:58.195374 IP 10.0.2.15.44102 > 151.101.117.164.443: Flags [.], ack 174755, win 65535, length 0
19:56:58.195598 IP 151.101.117.164.443 > 10.0.2.15.44102: Flags [P.], seq 174755:178877, ack 869, win 65535, length 4122
19:56:58.195608 IP 10.0.2.15.44102 > 151.101.117.164.443: Flags [.], ack 178877, win 65535, length 0
19:56:58.196537 IP 151.101.117.164.443 > 10.0.2.15.44102: Flags [P.], seq 178877:181625, ack 869, win 65535, length 2748
19:56:58.196559 IP 10.0.2.15.44102 > 151.101.117.164.443: Flags [.], ack 181625, win 65535, length 0
19:56:58.197640 IP 151.101.117.164.443 > 10.0.2.15.44102: Flags [P.], seq 181625:187121, ack 869, win 65535, length 5496
19:56:58.197653 IP 10.0.2.15.44102 > 151.101.117.164.443: Flags [.], ack 187121, win 65535, length 0
19:56:58.198686 IP 151.101.117.164.443 > 10.0.2.15.44102: Flags [P.], seq 187121:192617, ack 869, win 65535, length 5496
19:56:58.198689 IP 151.101.117.164.443 > 10.0.2.15.44102: Flags [.], seq 192617:194077, ack 869, win 65535, length 1460
19:56:58.198706 IP 10.0.2.15.44102 > 151.101.117.164.443: Flags [.], ack 192617, win 65535, length 0
19:56:58.198857 IP 151.101.117.164.443 > 10.0.2.15.44102: Flags [P.], seq 194077:196739, ack 869, win 65535, length 2662
19:56:58.198863 IP 10.0.2.15.44102 > 151.101.117.164.443: Flags [.], ack 196739, win 65535, length 0
19:56:58.199915 IP 151.101.117.164.443 > 10.0.2.15.44102: Flags [P.], seq 196739:202235, ack 869, win 65535, length 5496
19:56:58.199929 IP 10.0.2.15.44102 > 151.101.117.164.443: Flags [.], ack 202235, win 65535, length 0
19:56:58.201782 IP 151.101.117.164.443 > 10.0.2.15.44102: Flags [P.], seq 202235:209105, ack 869, win 65535, length 6870
19:56:58.201799 IP 10.0.2.15.44102 > 151.101.117.164.443: Flags [.], ack 209105, win 65535, length 0
19:56:58.202887 IP 151.101.117.164.443 > 10.0.2.15.44102: Flags [P.], seq 209105:214601, ack 869, win 65535, length 5496
19:56:58.202902 IP 10.0.2.15.44102 > 151.101.117.164.443: Flags [.], ack 214601, win 65535, length 0
19:56:58.203841 IP 151.101.117.164.443 > 10.0.2.15.44102: Flags [P.], seq 214601:220097, ack 869, win 65535, length 5496
19:56:58.203855 IP 10.0.2.15.44102 > 151.101.117.164.443: Flags [.], ack 220097, win 65535, length 0
19:56:58.204988 IP 151.101.117.164.443 > 10.0.2.15.44102: Flags [P.], seq 220097:225593, ack 869, win 65535, length 5496
19:56:58.205000 IP 10.0.2.15.44102 > 151.101.117.164.443: Flags [.], ack 225593, win 65535, length 0
19:56:58.205390 IP 151.101.117.164.443 > 10.0.2.15.44102: Flags [P.], seq 225593:226967, ack 869, win 65535, length 1374
19:56:58.206122 IP 151.101.117.164.443 > 10.0.2.15.44102: Flags [P.], seq 226967:231089, ack 869, win 65535, length 4122
19:56:58.206136 IP 10.0.2.15.44102 > 151.101.117.164.443: Flags [.], ack 231089, win 65535, length 0
19:56:58.207372 IP 151.101.117.164.443 > 10.0.2.15.44102: Flags [P.], seq 231089:237959, ack 869, win 65535, length 6870
19:56:58.207388 IP 10.0.2.15.44102 > 151.101.117.164.443: Flags [.], ack 237959, win 65535, length 0
19:56:58.208352 IP 151.101.117.164.443 > 10.0.2.15.44102: Flags [P.], seq 237959:244829, ack 869, win 65535, length 6870
19:56:58.208354 IP 151.101.117.164.443 > 10.0.2.15.44102: Flags [P.], seq 244829:246203, ack 869, win 65535, length 1374
19:56:58.208377 IP 10.0.2.15.44102 > 151.101.117.164.443: Flags [.], ack 244829, win 65535, length 0
19:56:58.209862 IP 151.101.117.164.443 > 10.0.2.15.44102: Flags [P.], seq 246203:247577, ack 869, win 65535, length 1374
19:56:58.209865 IP 151.101.117.164.443 > 10.0.2.15.44102: Flags [P.], seq 247577:248951, ack 869, win 65535, length 1374
19:56:58.209891 IP 10.0.2.15.44102 > 151.101.117.164.443: Flags [.], ack 247577, win 65535, length 0
19:56:58.210492 IP 151.101.117.164.443 > 10.0.2.15.44102: Flags [P.], seq 248951:257195, ack 869, win 65535, length 8244
19:56:58.210507 IP 10.0.2.15.44102 > 151.101.117.164.443: Flags [.], ack 257195, win 65535, length 0
19:56:58.211687 IP 151.101.117.164.443 > 10.0.2.15.44102: Flags [P.], seq 257195:264065, ack 869, win 65535, length 6870
19:56:58.211705 IP 10.0.2.15.44102 > 151.101.117.164.443: Flags [.], ack 264065, win 65535, length 0
19:56:58.212759 IP 151.101.117.164.443 > 10.0.2.15.44102: Flags [P.], seq 264065:269561, ack 869, win 65535, length 5496
19:56:58.212773 IP 10.0.2.15.44102 > 151.101.117.164.443: Flags [.], ack 269561, win 65535, length 0
19:56:58.213914 IP 151.101.117.164.443 > 10.0.2.15.44102: Flags [P.], seq 269561:273683, ack 869, win 65535, length 4122
19:56:58.213934 IP 10.0.2.15.44102 > 151.101.117.164.443: Flags [.], ack 273683, win 65535, length 0
19:56:58.215201 IP 151.101.117.164.443 > 10.0.2.15.44102: Flags [P.], seq 273683:279179, ack 869, win 65535, length 5496
19:56:58.215225 IP 10.0.2.15.44102 > 151.101.117.164.443: Flags [.], ack 279179, win 65535, length 0
19:56:58.215523 IP 151.101.117.164.443 > 10.0.2.15.44102: Flags [P.], seq 279179:284675, ack 869, win 65535, length 5496
19:56:58.215532 IP 10.0.2.15.44102 > 151.101.117.164.443: Flags [.], ack 284675, win 65535, length 0
19:56:58.216987 IP 151.101.117.164.443 > 10.0.2.15.44102: Flags [P.], seq 284675:290171, ack 869, win 65535, length 5496
19:56:58.216990 IP 151.101.117.164.443 > 10.0.2.15.44102: Flags [P.], seq 290171:291545, ack 869, win 65535, length 1374
19:56:58.217010 IP 10.0.2.15.44102 > 151.101.117.164.443: Flags [.], ack 290171, win 65535, length 0
19:56:58.218165 IP 151.101.117.164.443 > 10.0.2.15.44102: Flags [P.], seq 291545:295667, ack 869, win 65535, length 4122
19:56:58.218271 IP 10.0.2.15.44102 > 151.101.117.164.443: Flags [.], ack 295667, win 65535, length 0
19:56:58.218965 IP 151.101.117.164.443 > 10.0.2.15.44102: Flags [P.], seq 295667:299789, ack 869, win 65535, length 4122
19:56:58.218966 IP 151.101.117.164.443 > 10.0.2.15.44102: Flags [P.], seq 299789:302537, ack 869, win 65535, length 2748
19:56:58.218991 IP 10.0.2.15.44102 > 151.101.117.164.443: Flags [.], ack 299789, win 65535, length 0
19:56:58.219013 IP 10.0.2.15.44102 > 151.101.117.164.443: Flags [.], ack 302537, win 65535, length 0
19:56:58.220055 IP 151.101.117.164.443 > 10.0.2.15.44102: Flags [P.], seq 302537:306659, ack 869, win 65535, length 4122
19:56:58.220070 IP 10.0.2.15.44102 > 151.101.117.164.443: Flags [.], ack 306659, win 65535, length 0
19:56:58.221531 IP 151.101.117.164.443 > 10.0.2.15.44102: Flags [P.], seq 306659:313529, ack 869, win 65535, length 6870
19:56:58.221534 IP 151.101.117.164.443 > 10.0.2.15.44102: Flags [P.], seq 313529:317651, ack 869, win 65535, length 4122
19:56:58.221729 IP 10.0.2.15.44102 > 151.101.117.164.443: Flags [.], ack 313529, win 65535, length 0
19:56:58.221780 IP 10.0.2.15.44102 > 151.101.117.164.443: Flags [.], ack 317651, win 65535, length 0
19:56:58.223305 IP 151.101.117.164.443 > 10.0.2.15.44102: Flags [P.], seq 317651:323147, ack 869, win 65535, length 5496
19:56:58.223308 IP 151.101.117.164.443 > 10.0.2.15.44102: Flags [.], seq 323147:327527, ack 869, win 65535, length 4380
19:56:58.223325 IP 10.0.2.15.44102 > 151.101.117.164.443: Flags [.], ack 323147, win 65535, length 0
19:56:58.223358 IP 10.0.2.15.44102 > 151.101.117.164.443: Flags [.], ack 327527, win 65535, length 0
19:56:58.223565 IP 151.101.117.164.443 > 10.0.2.15.44102: Flags [P.], seq 327527:328643, ack 869, win 65535, length 1116
19:56:58.224687 IP 151.101.117.164.443 > 10.0.2.15.44102: Flags [P.], seq 328643:334139, ack 869, win 65535, length 5496
19:56:58.224708 IP 10.0.2.15.44102 > 151.101.117.164.443: Flags [.], ack 334139, win 65535, length 0
19:56:58.225930 IP 151.101.117.164.443 > 10.0.2.15.44102: Flags [P.], seq 334139:341009, ack 869, win 65535, length 6870
19:56:58.225932 IP 151.101.117.164.443 > 10.0.2.15.44102: Flags [P.], seq 341009:343757, ack 869, win 65535, length 2748
19:56:58.225950 IP 10.0.2.15.44102 > 151.101.117.164.443: Flags [.], ack 341009, win 65535, length 0
19:56:58.225979 IP 10.0.2.15.44102 > 151.101.117.164.443: Flags [.], ack 343757, win 65535, length 0
19:56:58.227548 IP 151.101.117.164.443 > 10.0.2.15.44102: Flags [P.], seq 343757:350627, ack 869, win 65535, length 6870
19:56:58.227570 IP 10.0.2.15.44102 > 151.101.117.164.443: Flags [.], ack 350627, win 65535, length 0
19:56:58.228765 IP 151.101.117.164.443 > 10.0.2.15.44102: Flags [P.], seq 350627:358871, ack 869, win 65535, length 8244
19:56:58.228767 IP 151.101.117.164.443 > 10.0.2.15.44102: Flags [P.], seq 358871:360245, ack 869, win 65535, length 1374
19:56:58.228788 IP 10.0.2.15.44102 > 151.101.117.164.443: Flags [.], ack 358871, win 65535, length 0
19:56:58.228993 IP 151.101.117.164.443 > 10.0.2.15.44102: Flags [P.], seq 360245:361619, ack 869, win 65535, length 1374
19:56:58.229000 IP 10.0.2.15.44102 > 151.101.117.164.443: Flags [.], ack 361619, win 65535, length 0
19:56:58.229802 IP 151.101.117.164.443 > 10.0.2.15.44102: Flags [P.], seq 361619:365741, ack 869, win 65535, length 4122
19:56:58.229815 IP 10.0.2.15.44102 > 151.101.117.164.443: Flags [.], ack 365741, win 65535, length 0
19:56:58.230753 IP 151.101.117.164.443 > 10.0.2.15.44102: Flags [P.], seq 365741:369863, ack 869, win 65535, length 4122
19:56:58.230766 IP 10.0.2.15.44102 > 151.101.117.164.443: Flags [.], ack 369863, win 65535, length 0
19:56:58.230857 IP 151.101.117.164.443 > 10.0.2.15.44102: Flags [P.], seq 369863:372611, ack 869, win 65535, length 2748
19:56:58.230864 IP 10.0.2.15.44102 > 151.101.117.164.443: Flags [.], ack 372611, win 65535, length 0
19:56:58.231873 IP 151.101.117.164.443 > 10.0.2.15.44102: Flags [P.], seq 372611:376733, ack 869, win 65535, length 4122
19:56:58.231883 IP 10.0.2.15.44102 > 151.101.117.164.443: Flags [.], ack 376733, win 65535, length 0
19:56:58.232985 IP 151.101.117.164.443 > 10.0.2.15.44102: Flags [P.], seq 376733:382229, ack 869, win 65535, length 5496
19:56:58.233000 IP 10.0.2.15.44102 > 151.101.117.164.443: Flags [.], ack 382229, win 65535, length 0
19:56:58.234087 IP 151.101.117.164.443 > 10.0.2.15.44102: Flags [P.], seq 382229:387725, ack 869, win 65535, length 5496
19:56:58.234099 IP 10.0.2.15.44102 > 151.101.117.164.443: Flags [.], ack 387725, win 65535, length 0
19:56:58.235293 IP 151.101.117.164.443 > 10.0.2.15.44102: Flags [P.], seq 387725:393221, ack 869, win 65535, length 5496
19:56:58.235295 IP 151.101.117.164.443 > 10.0.2.15.44102: Flags [P.], seq 393221:394595, ack 869, win 65535, length 1374
19:56:58.235314 IP 10.0.2.15.44102 > 151.101.117.164.443: Flags [.], ack 393221, win 65535, length 0
19:56:58.236238 IP 151.101.117.164.443 > 10.0.2.15.44102: Flags [P.], seq 394595:400091, ack 869, win 65535, length 5496
19:56:58.236253 IP 10.0.2.15.44102 > 151.101.117.164.443: Flags [.], ack 400091, win 65535, length 0
19:56:58.237411 IP 151.101.117.164.443 > 10.0.2.15.44102: Flags [P.], seq 400091:406961, ack 869, win 65535, length 6870
19:56:58.237426 IP 10.0.2.15.44102 > 151.101.117.164.443: Flags [.], ack 406961, win 65535, length 0
19:56:58.237542 IP 151.101.117.164.443 > 10.0.2.15.44102: Flags [P.], seq 406961:408335, ack 869, win 65535, length 1374
19:56:58.237543 IP 151.101.117.164.443 > 10.0.2.15.44102: Flags [P.], seq 408335:409709, ack 869, win 65535, length 1374
19:56:58.237555 IP 10.0.2.15.44102 > 151.101.117.164.443: Flags [.], ack 409709, win 65535, length 0
19:56:58.238993 IP 151.101.117.164.443 > 10.0.2.15.44102: Flags [P.], seq 409709:417953, ack 869, win 65535, length 8244
19:56:58.239006 IP 10.0.2.15.44102 > 151.101.117.164.443: Flags [.], ack 417953, win 65535, length 0
19:56:58.240727 IP 151.101.117.164.443 > 10.0.2.15.44102: Flags [P.], seq 417953:420701, ack 869, win 65535, length 2748
19:56:58.240746 IP 10.0.2.15.44102 > 151.101.117.164.443: Flags [.], ack 420701, win 65535, length 0
19:56:58.243446 IP 151.101.117.164.443 > 10.0.2.15.44102: Flags [P.], seq 420701:428945, ack 869, win 65535, length 8244
19:56:58.243594 IP 151.101.117.164.443 > 10.0.2.15.44102: Flags [P.], seq 428945:433067, ack 869, win 65535, length 4122
19:56:58.243697 IP 10.0.2.15.44102 > 151.101.117.164.443: Flags [.], ack 428945, win 65535, length 0
19:56:58.243785 IP 10.0.2.15.44102 > 151.101.117.164.443: Flags [.], ack 433067, win 65535, length 0
19:56:58.243826 IP 151.101.117.164.443 > 10.0.2.15.44102: Flags [P.], seq 433067:435815, ack 869, win 65535, length 2748
19:56:58.243917 IP 10.0.2.15.44102 > 151.101.117.164.443: Flags [.], ack 435815, win 65535, length 0
19:56:58.244475 IP 151.101.117.164.443 > 10.0.2.15.44102: Flags [P.], seq 435815:442685, ack 869, win 65535, length 6870
19:56:58.244489 IP 10.0.2.15.44102 > 151.101.117.164.443: Flags [.], ack 442685, win 65535, length 0
19:56:58.246509 IP 151.101.117.164.443 > 10.0.2.15.44102: Flags [P.], seq 442685:449555, ack 869, win 65535, length 6870
19:56:58.246513 IP 151.101.117.164.443 > 10.0.2.15.44102: Flags [P.], seq 449555:455051, ack 869, win 65535, length 5496
19:56:58.246538 IP 10.0.2.15.44102 > 151.101.117.164.443: Flags [.], ack 449555, win 65535, length 0
19:56:58.246574 IP 10.0.2.15.44102 > 151.101.117.164.443: Flags [.], ack 455051, win 65535, length 0
19:56:58.246603 IP 151.101.117.164.443 > 10.0.2.15.44102: Flags [P.], seq 455051:463295, ack 869, win 65535, length 8244
19:56:58.246608 IP 10.0.2.15.44102 > 151.101.117.164.443: Flags [.], ack 463295, win 65535, length 0
19:56:58.247031 IP 151.101.117.164.443 > 10.0.2.15.44102: Flags [P.], seq 463295:467417, ack 869, win 65535, length 4122
19:56:58.247041 IP 10.0.2.15.44102 > 151.101.117.164.443: Flags [.], ack 467417, win 65535, length 0
19:56:58.248463 IP 151.101.117.164.443 > 10.0.2.15.44102: Flags [P.], seq 467417:472913, ack 869, win 65535, length 5496
19:56:58.248465 IP 151.101.117.164.443 > 10.0.2.15.44102: Flags [P.], seq 472913:475661, ack 869, win 65535, length 2748
19:56:58.248484 IP 10.0.2.15.44102 > 151.101.117.164.443: Flags [.], ack 472913, win 65535, length 0
19:56:58.248510 IP 10.0.2.15.44102 > 151.101.117.164.443: Flags [.], ack 475661, win 65535, length 0
19:56:58.249477 IP 151.101.117.164.443 > 10.0.2.15.44102: Flags [P.], seq 475661:481157, ack 869, win 65535, length 5496
19:56:58.249503 IP 10.0.2.15.44102 > 151.101.117.164.443: Flags [.], ack 481157, win 65535, length 0
19:56:58.250704 IP 151.101.117.164.443 > 10.0.2.15.44102: Flags [P.], seq 481157:489401, ack 869, win 65535, length 8244
19:56:58.250725 IP 10.0.2.15.44102 > 151.101.117.164.443: Flags [.], ack 489401, win 65535, length 0
19:56:58.252073 IP 151.101.117.164.443 > 10.0.2.15.44102: Flags [P.], seq 489401:493523, ack 869, win 65535, length 4122
19:56:58.252185 IP 10.0.2.15.44102 > 151.101.117.164.443: Flags [.], ack 493523, win 65535, length 0
19:56:58.252404 IP 151.101.117.164.443 > 10.0.2.15.44102: Flags [P.], seq 493523:496271, ack 869, win 65535, length 2748
19:56:58.252412 IP 10.0.2.15.44102 > 151.101.117.164.443: Flags [.], ack 496271, win 65535, length 0
19:56:58.258368 IP 151.101.117.164.443 > 10.0.2.15.44102: Flags [P.], seq 496271:507263, ack 869, win 65535, length 10992
19:56:58.258390 IP 10.0.2.15.44102 > 151.101.117.164.443: Flags [.], ack 507263, win 65535, length 0
19:56:58.258445 IP 151.101.117.164.443 > 10.0.2.15.44102: Flags [P.], seq 507263:511385, ack 869, win 65535, length 4122
19:56:58.258446 IP 151.101.117.164.443 > 10.0.2.15.44102: Flags [P.], seq 511385:512759, ack 869, win 65535, length 1374
19:56:58.258458 IP 10.0.2.15.44102 > 151.101.117.164.443: Flags [.], ack 511385, win 65535, length 0
19:56:58.258597 IP 151.101.117.164.443 > 10.0.2.15.44102: Flags [P.], seq 512759:514133, ack 869, win 65535, length 1374
19:56:58.258605 IP 10.0.2.15.44102 > 151.101.117.164.443: Flags [.], ack 514133, win 65535, length 0
19:56:58.259875 IP 151.101.117.164.443 > 10.0.2.15.44102: Flags [P.], seq 514133:519629, ack 869, win 65535, length 5496
19:56:58.259879 IP 151.101.117.164.443 > 10.0.2.15.44102: Flags [P.], seq 519629:521003, ack 869, win 65535, length 1374
19:56:58.259907 IP 10.0.2.15.44102 > 151.101.117.164.443: Flags [.], ack 519629, win 65535, length 0
19:56:58.260392 IP 151.101.117.164.443 > 10.0.2.15.44102: Flags [P.], seq 521003:523751, ack 869, win 65535, length 2748
19:56:58.260395 IP 151.101.117.164.443 > 10.0.2.15.44102: Flags [P.], seq 523751:529247, ack 869, win 65535, length 5496
19:56:58.260395 IP 151.101.117.164.443 > 10.0.2.15.44102: Flags [P.], seq 529247:530621, ack 869, win 65535, length 1374
19:56:58.260412 IP 10.0.2.15.44102 > 151.101.117.164.443: Flags [.], ack 523751, win 65535, length 0
19:56:58.260480 IP 10.0.2.15.44102 > 151.101.117.164.443: Flags [.], ack 529247, win 65535, length 0
19:56:58.261446 IP 151.101.117.164.443 > 10.0.2.15.44102: Flags [P.], seq 530621:536117, ack 869, win 65535, length 5496
19:56:58.261449 IP 151.101.117.164.443 > 10.0.2.15.44102: Flags [P.], seq 536117:538865, ack 869, win 65535, length 2748
19:56:58.261467 IP 10.0.2.15.44102 > 151.101.117.164.443: Flags [.], ack 536117, win 65535, length 0
19:56:58.261489 IP 10.0.2.15.44102 > 151.101.117.164.443: Flags [.], ack 538865, win 65535, length 0
19:56:58.261595 IP 151.101.117.164.443 > 10.0.2.15.44102: Flags [P.], seq 538865:542987, ack 869, win 65535, length 4122
19:56:58.261603 IP 10.0.2.15.44102 > 151.101.117.164.443: Flags [.], ack 542987, win 65535, length 0
19:56:58.262853 IP 151.101.117.164.443 > 10.0.2.15.44102: Flags [P.], seq 542987:547109, ack 869, win 65535, length 4122
19:56:58.262855 IP 151.101.117.164.443 > 10.0.2.15.44102: Flags [P.], seq 547109:551231, ack 869, win 65535, length 4122
19:56:58.262872 IP 10.0.2.15.44102 > 151.101.117.164.443: Flags [.], ack 547109, win 65535, length 0
19:56:58.262932 IP 10.0.2.15.44102 > 151.101.117.164.443: Flags [.], ack 551231, win 65535, length 0
19:56:58.263724 IP 151.101.117.164.443 > 10.0.2.15.44102: Flags [P.], seq 551231:556727, ack 869, win 65535, length 5496
19:56:58.263738 IP 10.0.2.15.44102 > 151.101.117.164.443: Flags [.], ack 556727, win 65535, length 0
19:56:58.263855 IP 151.101.117.164.443 > 10.0.2.15.44102: Flags [P.], seq 556727:562223, ack 869, win 65535, length 5496
19:56:58.263861 IP 10.0.2.15.44102 > 151.101.117.164.443: Flags [.], ack 562223, win 65535, length 0
19:56:58.265015 IP 151.101.117.164.443 > 10.0.2.15.44102: Flags [P.], seq 562223:569093, ack 869, win 65535, length 6870
19:56:58.265017 IP 151.101.117.164.443 > 10.0.2.15.44102: Flags [P.], seq 569093:570467, ack 869, win 65535, length 1374
19:56:58.265037 IP 10.0.2.15.44102 > 151.101.117.164.443: Flags [.], ack 569093, win 65535, length 0
19:56:58.266226 IP 151.101.117.164.443 > 10.0.2.15.44102: Flags [P.], seq 570467:578711, ack 869, win 65535, length 8244
19:56:58.266245 IP 10.0.2.15.44102 > 151.101.117.164.443: Flags [.], ack 578711, win 65535, length 0
19:56:58.271927 IP 151.101.117.164.443 > 10.0.2.15.44102: Flags [P.], seq 578711:585581, ack 869, win 65535, length 6870
19:56:58.271950 IP 10.0.2.15.44102 > 151.101.117.164.443: Flags [.], ack 585581, win 65535, length 0
19:56:58.272760 IP 151.101.117.164.443 > 10.0.2.15.44102: Flags [P.], seq 585581:591077, ack 869, win 65535, length 5496
19:56:58.272781 IP 10.0.2.15.44102 > 151.101.117.164.443: Flags [.], ack 591077, win 65535, length 0
19:56:58.274525 IP 151.101.117.164.443 > 10.0.2.15.44102: Flags [P.], seq 591077:596573, ack 869, win 65535, length 5496
19:56:58.274529 IP 151.101.117.164.443 > 10.0.2.15.44102: Flags [P.], seq 596573:597947, ack 869, win 65535, length 1374
19:56:58.274561 IP 10.0.2.15.44102 > 151.101.117.164.443: Flags [.], ack 596573, win 65535, length 0
19:56:58.274980 IP 151.101.117.164.443 > 10.0.2.15.44102: Flags [P.], seq 597947:603443, ack 869, win 65535, length 5496
19:56:58.274994 IP 10.0.2.15.44102 > 151.101.117.164.443: Flags [.], ack 603443, win 65535, length 0
19:56:58.276112 IP 151.101.117.164.443 > 10.0.2.15.44102: Flags [P.], seq 603443:611687, ack 869, win 65535, length 8244
19:56:58.276114 IP 151.101.117.164.443 > 10.0.2.15.44102: Flags [P.], seq 611687:613061, ack 869, win 65535, length 1374
19:56:58.276133 IP 10.0.2.15.44102 > 151.101.117.164.443: Flags [.], ack 611687, win 65535, length 0
19:56:58.277674 IP 151.101.117.164.443 > 10.0.2.15.44102: Flags [P.], seq 613061:618557, ack 869, win 65535, length 5496
19:56:58.277755 IP 10.0.2.15.44102 > 151.101.117.164.443: Flags [.], ack 618557, win 65535, length 0
19:56:58.278062 IP 151.101.117.164.443 > 10.0.2.15.44102: Flags [P.], seq 618557:624053, ack 869, win 65535, length 5496
19:56:58.278063 IP 151.101.117.164.443 > 10.0.2.15.44102: Flags [P.], seq 624053:628175, ack 869, win 65535, length 4122
19:56:58.278064 IP 151.101.117.164.443 > 10.0.2.15.44102: Flags [P.], seq 628175:629549, ack 869, win 65535, length 1374
19:56:58.278076 IP 10.0.2.15.44102 > 151.101.117.164.443: Flags [.], ack 624053, win 65535, length 0
19:56:58.278093 IP 10.0.2.15.44102 > 151.101.117.164.443: Flags [.], ack 628175, win 65535, length 0
19:56:58.279370 IP 151.101.117.164.443 > 10.0.2.15.44102: Flags [P.], seq 629549:636419, ack 869, win 65535, length 6870
19:56:58.279372 IP 151.101.117.164.443 > 10.0.2.15.44102: Flags [P.], seq 636419:637793, ack 869, win 65535, length 1374
19:56:58.279403 IP 10.0.2.15.44102 > 151.101.117.164.443: Flags [.], ack 636419, win 65535, length 0
19:56:58.280198 IP 151.101.117.164.443 > 10.0.2.15.44102: Flags [P.], seq 637793:643289, ack 869, win 65535, length 5496
19:56:58.280218 IP 10.0.2.15.44102 > 151.101.117.164.443: Flags [.], ack 643289, win 65535, length 0
19:56:58.282079 IP 151.101.117.164.443 > 10.0.2.15.44102: Flags [P.], seq 643289:652907, ack 869, win 65535, length 9618
19:56:58.282102 IP 10.0.2.15.44102 > 151.101.117.164.443: Flags [.], ack 652907, win 65535, length 0
19:56:58.282925 IP 151.101.117.164.443 > 10.0.2.15.44102: Flags [P.], seq 652907:659777, ack 869, win 65535, length 6870
19:56:58.282927 IP 151.101.117.164.443 > 10.0.2.15.44102: Flags [P.], seq 659777:661151, ack 869, win 65535, length 1374
19:56:58.282950 IP 10.0.2.15.44102 > 151.101.117.164.443: Flags [.], ack 659777, win 65535, length 0
19:56:58.284260 IP 151.101.117.164.443 > 10.0.2.15.44102: Flags [.], seq 661151:662611, ack 869, win 65535, length 1460
19:56:58.284280 IP 10.0.2.15.44102 > 151.101.117.164.443: Flags [.], ack 662611, win 65535, length 0
19:56:58.284389 IP 151.101.117.164.443 > 10.0.2.15.44102: Flags [P.], seq 662611:668021, ack 869, win 65535, length 5410
19:56:58.284390 IP 151.101.117.164.443 > 10.0.2.15.44102: Flags [P.], seq 668021:670769, ack 869, win 65535, length 2748
19:56:58.284469 IP 10.0.2.15.44102 > 151.101.117.164.443: Flags [.], ack 670769, win 65535, length 0
19:56:58.285033 IP 151.101.117.164.443 > 10.0.2.15.44102: Flags [P.], seq 670769:674891, ack 869, win 65535, length 4122
19:56:58.285044 IP 10.0.2.15.44102 > 151.101.117.164.443: Flags [.], ack 674891, win 65535, length 0
19:56:58.286420 IP 151.101.117.164.443 > 10.0.2.15.44102: Flags [P.], seq 674891:683135, ack 869, win 65535, length 8244
19:56:58.286558 IP 10.0.2.15.44102 > 151.101.117.164.443: Flags [.], ack 683135, win 65535, length 0
19:56:58.287347 IP 151.101.117.164.443 > 10.0.2.15.44102: Flags [P.], seq 683135:690005, ack 869, win 65535, length 6870
19:56:58.287459 IP 10.0.2.15.44102 > 151.101.117.164.443: Flags [.], ack 690005, win 65535, length 0
19:56:58.288609 IP 151.101.117.164.443 > 10.0.2.15.44102: Flags [P.], seq 690005:695501, ack 869, win 65535, length 5496
19:56:58.288625 IP 10.0.2.15.44102 > 151.101.117.164.443: Flags [.], ack 695501, win 65535, length 0
19:56:58.289385 IP 151.101.117.164.443 > 10.0.2.15.44102: Flags [P.], seq 695501:702371, ack 869, win 65535, length 6870
19:56:58.289495 IP 151.101.117.164.443 > 10.0.2.15.44102: Flags [P.], seq 702371:703745, ack 869, win 65535, length 1374
19:56:58.289514 IP 10.0.2.15.44102 > 151.101.117.164.443: Flags [.], ack 702371, win 65535, length 0
19:56:58.290775 IP 151.101.117.164.443 > 10.0.2.15.44102: Flags [P.], seq 703745:709241, ack 869, win 65535, length 5496
19:56:58.291037 IP 10.0.2.15.44102 > 151.101.117.164.443: Flags [.], ack 709241, win 65535, length 0
19:56:58.291727 IP 151.101.117.164.443 > 10.0.2.15.44102: Flags [P.], seq 709241:714737, ack 869, win 65535, length 5496
19:56:58.291728 IP 151.101.117.164.443 > 10.0.2.15.44102: Flags [P.], seq 714737:716111, ack 869, win 65535, length 1374
19:56:58.291795 IP 10.0.2.15.44102 > 151.101.117.164.443: Flags [.], ack 716111, win 65535, length 0
19:56:58.293183 IP 151.101.117.164.443 > 10.0.2.15.44102: Flags [P.], seq 716111:724355, ack 869, win 65535, length 8244
19:56:58.293410 IP 151.101.117.164.443 > 10.0.2.15.44102: Flags [P.], seq 724355:728477, ack 869, win 65535, length 4122
19:56:58.293549 IP 10.0.2.15.44102 > 151.101.117.164.443: Flags [.], ack 728477, win 65535, length 0
19:56:58.293684 IP 151.101.117.164.443 > 10.0.2.15.44102: Flags [P.], seq 728477:732599, ack 869, win 65535, length 4122
19:56:58.293931 IP 10.0.2.15.44102 > 151.101.117.164.443: Flags [.], ack 732599, win 65535, length 0
19:56:58.295454 IP 151.101.117.164.443 > 10.0.2.15.44102: Flags [P.], seq 732599:740843, ack 869, win 65535, length 8244
19:56:58.295458 IP 151.101.117.164.443 > 10.0.2.15.44102: Flags [P.], seq 740843:744965, ack 869, win 65535, length 4122
19:56:58.295482 IP 10.0.2.15.44102 > 151.101.117.164.443: Flags [.], ack 740843, win 65535, length 0
19:56:58.295540 IP 151.101.117.164.443 > 10.0.2.15.44102: Flags [P.], seq 744965:747713, ack 869, win 65535, length 2748
19:56:58.295872 IP 151.101.117.164.443 > 10.0.2.15.44102: Flags [P.], seq 747713:749087, ack 869, win 65535, length 1374
19:56:58.296413 IP 151.101.117.164.443 > 10.0.2.15.44102: Flags [P.], seq 749087:754583, ack 869, win 65535, length 5496
19:56:58.296553 IP 151.101.117.164.443 > 10.0.2.15.44102: Flags [P.], seq 754583:757331, ack 869, win 65535, length 2748
19:56:58.296684 IP 10.0.2.15.44102 > 151.101.117.164.443: Flags [.], ack 757331, win 65535, length 0
19:56:58.297665 IP 151.101.117.164.443 > 10.0.2.15.44102: Flags [P.], seq 757331:764201, ack 869, win 65535, length 6870
19:56:58.297667 IP 151.101.117.164.443 > 10.0.2.15.44102: Flags [P.], seq 764201:765575, ack 869, win 65535, length 1374
19:56:58.297682 IP 10.0.2.15.44102 > 151.101.117.164.443: Flags [.], ack 764201, win 65535, length 0
19:56:58.298912 IP 151.101.117.164.443 > 10.0.2.15.44102: Flags [P.], seq 765575:773819, ack 869, win 65535, length 8244
19:56:58.298932 IP 10.0.2.15.44102 > 151.101.117.164.443: Flags [.], ack 773819, win 65535, length 0
19:56:58.299579 IP 151.101.117.164.443 > 10.0.2.15.44102: Flags [P.], seq 773819:779315, ack 869, win 65535, length 5496
19:56:58.299636 IP 10.0.2.15.44102 > 151.101.117.164.443: Flags [.], ack 779315, win 65535, length 0
19:56:58.299760 IP 151.101.117.164.443 > 10.0.2.15.44102: Flags [P.], seq 779315:782063, ack 869, win 65535, length 2748
19:56:58.299941 IP 10.0.2.15.44102 > 151.101.117.164.443: Flags [.], ack 782063, win 65535, length 0
19:56:58.300651 IP 151.101.117.164.443 > 10.0.2.15.44102: Flags [P.], seq 782063:787559, ack 869, win 65535, length 5496
19:56:58.300652 IP 151.101.117.164.443 > 10.0.2.15.44102: Flags [P.], seq 787559:790307, ack 869, win 65535, length 2748
19:56:58.300668 IP 10.0.2.15.44102 > 151.101.117.164.443: Flags [.], ack 787559, win 65535, length 0
19:56:58.300926 IP 10.0.2.15.44102 > 151.101.117.164.443: Flags [.], ack 790307, win 65535, length 0
19:56:58.301616 IP 151.101.117.164.443 > 10.0.2.15.44102: Flags [P.], seq 790307:791681, ack 869, win 65535, length 1374
19:56:58.302679 IP 151.101.117.164.443 > 10.0.2.15.44102: Flags [P.], seq 791681:798551, ack 869, win 65535, length 6870
19:56:58.302820 IP 10.0.2.15.44102 > 151.101.117.164.443: Flags [.], ack 798551, win 65535, length 0
19:56:58.303692 IP 151.101.117.164.443 > 10.0.2.15.44102: Flags [P.], seq 798551:805421, ack 869, win 65535, length 6870
19:56:58.303709 IP 10.0.2.15.44102 > 151.101.117.164.443: Flags [.], ack 805421, win 65535, length 0
19:56:58.303961 IP 151.101.117.164.443 > 10.0.2.15.44102: Flags [P.], seq 805421:806795, ack 869, win 65535, length 1374
19:56:58.305153 IP 151.101.117.164.443 > 10.0.2.15.44102: Flags [P.], seq 806795:808169, ack 869, win 65535, length 1374
19:56:58.305172 IP 10.0.2.15.44102 > 151.101.117.164.443: Flags [.], ack 808169, win 65535, length 0
19:56:58.306160 IP 151.101.117.164.443 > 10.0.2.15.44102: Flags [P.], seq 808169:815039, ack 869, win 65535, length 6870
19:56:58.306162 IP 151.101.117.164.443 > 10.0.2.15.44102: Flags [P.], seq 815039:816413, ack 869, win 65535, length 1374
19:56:58.306346 IP 10.0.2.15.44102 > 151.101.117.164.443: Flags [.], ack 816413, win 65535, length 0
19:56:58.307575 IP 151.101.117.164.443 > 10.0.2.15.44102: Flags [P.], seq 816413:824657, ack 869, win 65535, length 8244
19:56:58.307604 IP 10.0.2.15.44102 > 151.101.117.164.443: Flags [.], ack 824657, win 65535, length 0
19:56:58.310025 IP 151.101.117.164.443 > 10.0.2.15.44102: Flags [P.], seq 824657:834275, ack 869, win 65535, length 9618
19:56:58.310028 IP 151.101.117.164.443 > 10.0.2.15.44102: Flags [P.], seq 834275:835649, ack 869, win 65535, length 1374
19:56:58.310273 IP 151.101.117.164.443 > 10.0.2.15.44102: Flags [P.], seq 835649:839771, ack 869, win 65535, length 4122
19:56:58.310522 IP 151.101.117.164.443 > 10.0.2.15.44102: Flags [P.], seq 839771:841145, ack 869, win 65535, length 1374
19:56:58.310597 IP 10.0.2.15.44102 > 151.101.117.164.443: Flags [.], ack 841145, win 65535, length 0
19:56:58.311345 IP 151.101.117.164.443 > 10.0.2.15.44102: Flags [P.], seq 841145:848015, ack 869, win 65535, length 6870
19:56:58.311363 IP 10.0.2.15.44102 > 151.101.117.164.443: Flags [.], ack 848015, win 65535, length 0
19:56:58.311505 IP 151.101.117.164.443 > 10.0.2.15.44102: Flags [P.], seq 848015:852137, ack 869, win 65535, length 4122
19:56:58.311636 IP 151.101.117.164.443 > 10.0.2.15.44102: Flags [P.], seq 852137:854885, ack 869, win 65535, length 2748
19:56:58.311650 IP 10.0.2.15.44102 > 151.101.117.164.443: Flags [.], ack 852137, win 65535, length 0
19:56:58.311694 IP 10.0.2.15.44102 > 151.101.117.164.443: Flags [.], ack 854885, win 65535, length 0
19:56:58.313823 IP 151.101.117.164.443 > 10.0.2.15.44102: Flags [P.], seq 854885:863129, ack 869, win 65535, length 8244
19:56:58.313899 IP 10.0.2.15.44102 > 151.101.117.164.443: Flags [.], ack 863129, win 65535, length 0
19:56:58.314252 IP 151.101.117.164.443 > 10.0.2.15.44102: Flags [P.], seq 863129:867251, ack 869, win 65535, length 4122
19:56:58.314254 IP 151.101.117.164.443 > 10.0.2.15.44102: Flags [P.], seq 867251:869999, ack 869, win 65535, length 2748
19:56:58.314254 IP 151.101.117.164.443 > 10.0.2.15.44102: Flags [P.], seq 869999:872747, ack 869, win 65535, length 2748
19:56:58.314583 IP 151.101.117.164.443 > 10.0.2.15.44102: Flags [P.], seq 872747:875495, ack 869, win 65535, length 2748
19:56:58.314585 IP 151.101.117.164.443 > 10.0.2.15.44102: Flags [P.], seq 875495:876869, ack 869, win 65535, length 1374
19:56:58.314649 IP 10.0.2.15.44102 > 151.101.117.164.443: Flags [.], ack 876869, win 65535, length 0
19:56:58.314987 IP 151.101.117.164.443 > 10.0.2.15.44102: Flags [P.], seq 876869:879617, ack 869, win 65535, length 2748
19:56:58.315035 IP 10.0.2.15.44102 > 151.101.117.164.443: Flags [.], ack 879617, win 65535, length 0
19:56:58.315718 IP 151.101.117.164.443 > 10.0.2.15.44102: Flags [P.], seq 879617:885113, ack 869, win 65535, length 5496
19:56:58.315770 IP 10.0.2.15.44102 > 151.101.117.164.443: Flags [.], ack 885113, win 65535, length 0
19:56:58.316107 IP 151.101.117.164.443 > 10.0.2.15.44102: Flags [P.], seq 885113:891983, ack 869, win 65535, length 6870
19:56:58.316193 IP 151.101.117.164.443 > 10.0.2.15.44102: Flags [P.], seq 891983:896105, ack 869, win 65535, length 4122
19:56:58.316240 IP 10.0.2.15.44102 > 151.101.117.164.443: Flags [.], ack 896105, win 65535, length 0
19:56:58.316284 IP 151.101.117.164.443 > 10.0.2.15.44102: Flags [P.], seq 896105:897479, ack 869, win 65535, length 1374
19:56:58.316507 IP 151.101.117.164.443 > 10.0.2.15.44102: Flags [P.], seq 897479:900227, ack 869, win 65535, length 2748
19:56:58.316515 IP 10.0.2.15.44102 > 151.101.117.164.443: Flags [.], ack 900227, win 65535, length 0
19:56:58.318103 IP 151.101.117.164.443 > 10.0.2.15.44102: Flags [P.], seq 900227:904349, ack 869, win 65535, length 4122
19:56:58.318105 IP 151.101.117.164.443 > 10.0.2.15.44102: Flags [P.], seq 904349:905723, ack 869, win 65535, length 1374
19:56:58.318124 IP 10.0.2.15.44102 > 151.101.117.164.443: Flags [.], ack 904349, win 65535, length 0
19:56:58.318850 IP 151.101.117.164.443 > 10.0.2.15.44102: Flags [P.], seq 905723:909845, ack 869, win 65535, length 4122
19:56:58.318861 IP 10.0.2.15.44102 > 151.101.117.164.443: Flags [.], ack 909845, win 65535, length 0
19:56:58.319210 IP 151.101.117.164.443 > 10.0.2.15.44102: Flags [P.], seq 909845:912593, ack 869, win 65535, length 2748
19:56:58.319240 IP 10.0.2.15.44102 > 151.101.117.164.443: Flags [.], ack 912593, win 65535, length 0
19:56:58.320377 IP 151.101.117.164.443 > 10.0.2.15.44102: Flags [P.], seq 912593:919463, ack 869, win 65535, length 6870
19:56:58.320399 IP 10.0.2.15.44102 > 151.101.117.164.443: Flags [.], ack 919463, win 65535, length 0
19:56:58.321662 IP 151.101.117.164.443 > 10.0.2.15.44102: Flags [P.], seq 919463:929081, ack 869, win 65535, length 9618
19:56:58.321793 IP 10.0.2.15.44102 > 151.101.117.164.443: Flags [.], ack 929081, win 65535, length 0
19:56:58.323385 IP 151.101.117.164.443 > 10.0.2.15.44102: Flags [P.], seq 929081:934577, ack 869, win 65535, length 5496
19:56:58.323405 IP 10.0.2.15.44102 > 151.101.117.164.443: Flags [.], ack 934577, win 65535, length 0
19:56:58.324456 IP 151.101.117.164.443 > 10.0.2.15.44102: Flags [P.], seq 934577:935951, ack 869, win 65535, length 1374
19:56:58.327594 IP 151.101.117.164.443 > 10.0.2.15.44102: Flags [P.], seq 935951:937325, ack 869, win 65535, length 1374
19:56:58.327613 IP 10.0.2.15.44102 > 151.101.117.164.443: Flags [.], ack 937325, win 65535, length 0
19:56:58.328475 IP 151.101.117.164.443 > 10.0.2.15.44102: Flags [P.], seq 937325:938699, ack 869, win 65535, length 1374
19:56:58.330061 IP 151.101.117.164.443 > 10.0.2.15.44102: Flags [P.], seq 938699:945569, ack 869, win 65535, length 6870
19:56:58.330064 IP 151.101.117.164.443 > 10.0.2.15.44102: Flags [P.], seq 945569:951065, ack 869, win 65535, length 5496
19:56:58.330300 IP 10.0.2.15.44102 > 151.101.117.164.443: Flags [.], ack 951065, win 65535, length 0
19:56:58.331405 IP 151.101.117.164.443 > 10.0.2.15.44102: Flags [P.], seq 951065:956561, ack 869, win 65535, length 5496
19:56:58.331407 IP 151.101.117.164.443 > 10.0.2.15.44102: Flags [P.], seq 956561:957935, ack 869, win 65535, length 1374
19:56:58.331427 IP 10.0.2.15.44102 > 151.101.117.164.443: Flags [.], ack 956561, win 65535, length 0
19:56:58.332234 IP 151.101.117.164.443 > 10.0.2.15.44102: Flags [P.], seq 957935:963431, ack 869, win 65535, length 5496
19:56:58.332236 IP 151.101.117.164.443 > 10.0.2.15.44102: Flags [P.], seq 963431:964805, ack 869, win 65535, length 1374
19:56:58.332237 IP 151.101.117.164.443 > 10.0.2.15.44102: Flags [P.], seq 964805:966179, ack 869, win 65535, length 1374
19:56:58.332284 IP 10.0.2.15.44102 > 151.101.117.164.443: Flags [.], ack 963431, win 65535, length 0
19:56:58.332458 IP 10.0.2.15.44102 > 151.101.117.164.443: Flags [.], ack 966179, win 65535, length 0
19:56:58.333642 IP 151.101.117.164.443 > 10.0.2.15.44102: Flags [P.], seq 966179:971675, ack 869, win 65535, length 5496
19:56:58.333645 IP 151.101.117.164.443 > 10.0.2.15.44102: Flags [P.], seq 971675:974423, ack 869, win 65535, length 2748
19:56:58.333646 IP 151.101.117.164.443 > 10.0.2.15.44102: Flags [P.], seq 974423:977171, ack 869, win 65535, length 2748
19:56:58.333811 IP 10.0.2.15.44102 > 151.101.117.164.443: Flags [.], ack 977171, win 65535, length 0
19:56:58.334486 IP 151.101.117.164.443 > 10.0.2.15.44102: Flags [P.], seq 977171:981293, ack 869, win 65535, length 4122
19:56:58.334489 IP 151.101.117.164.443 > 10.0.2.15.44102: Flags [P.], seq 981293:984041, ack 869, win 65535, length 2748
19:56:58.334502 IP 10.0.2.15.44102 > 151.101.117.164.443: Flags [.], ack 981293, win 65535, length 0
19:56:58.334579 IP 10.0.2.15.44102 > 151.101.117.164.443: Flags [.], ack 984041, win 65535, length 0
19:56:58.334734 IP 151.101.117.164.443 > 10.0.2.15.44102: Flags [P.], seq 984041:985415, ack 869, win 65535, length 1374
19:56:58.334853 IP 151.101.117.164.443 > 10.0.2.15.44102: Flags [P.], seq 985415:988163, ack 869, win 65535, length 2748
19:56:58.334900 IP 10.0.2.15.44102 > 151.101.117.164.443: Flags [.], ack 988163, win 65535, length 0
19:56:58.336034 IP 151.101.117.164.443 > 10.0.2.15.44102: Flags [P.], seq 988163:997781, ack 869, win 65535, length 9618
19:56:58.336036 IP 151.101.117.164.443 > 10.0.2.15.44102: Flags [P.], seq 997781:999155, ack 869, win 65535, length 1374
19:56:58.336074 IP 151.101.117.164.443 > 10.0.2.15.44102: Flags [P.], seq 999155:1000529, ack 869, win 65535, length 1374
19:56:58.336743 IP 10.0.2.15.44102 > 151.101.117.164.443: Flags [.], ack 1000529, win 65535, length 0
19:56:58.337326 IP 151.101.117.164.443 > 10.0.2.15.44102: Flags [P.], seq 1000529:1007399, ack 869, win 65535, length 6870
19:56:58.337482 IP 151.101.117.164.443 > 10.0.2.15.44102: Flags [P.], seq 1007399:1010147, ack 869, win 65535, length 2748
19:56:58.337634 IP 151.101.117.164.443 > 10.0.2.15.44102: Flags [P.], seq 1010147:1011521, ack 869, win 65535, length 1374
19:56:58.338061 IP 151.101.117.164.443 > 10.0.2.15.44102: Flags [P.], seq 1011521:1015643, ack 869, win 65535, length 4122
19:56:58.338253 IP 151.101.117.164.443 > 10.0.2.15.44102: Flags [P.], seq 1015643:1018391, ack 869, win 65535, length 2748
19:56:58.338254 IP 151.101.117.164.443 > 10.0.2.15.44102: Flags [P.], seq 1018391:1019765, ack 869, win 65535, length 1374
19:56:58.338426 IP 10.0.2.15.44102 > 151.101.117.164.443: Flags [.], ack 1019765, win 65535, length 0
19:56:58.338790 IP 151.101.117.164.443 > 10.0.2.15.44102: Flags [P.], seq 1019765:1025261, ack 869, win 65535, length 5496
19:56:58.338826 IP 10.0.2.15.44102 > 151.101.117.164.443: Flags [.], ack 1025261, win 65535, length 0
19:56:58.339577 IP 151.101.117.164.443 > 10.0.2.15.44102: Flags [P.], seq 1025261:1032131, ack 869, win 65535, length 6870
19:56:58.339579 IP 151.101.117.164.443 > 10.0.2.15.44102: Flags [P.], seq 1032131:1033505, ack 869, win 65535, length 1374
19:56:58.339593 IP 10.0.2.15.44102 > 151.101.117.164.443: Flags [.], ack 1032131, win 65535, length 0
19:56:58.341026 IP 151.101.117.164.443 > 10.0.2.15.44102: Flags [P.], seq 1033505:1040375, ack 869, win 65535, length 6870
19:56:58.341028 IP 151.101.117.164.443 > 10.0.2.15.44102: Flags [P.], seq 1040375:1041749, ack 869, win 65535, length 1374
19:56:58.341046 IP 10.0.2.15.44102 > 151.101.117.164.443: Flags [.], ack 1040375, win 65535, length 0
19:56:58.342585 IP 151.101.117.164.443 > 10.0.2.15.44102: Flags [P.], seq 1041749:1047245, ack 869, win 65535, length 5496
19:56:58.342588 IP 151.101.117.164.443 > 10.0.2.15.44102: Flags [P.], seq 1047245:1049993, ack 869, win 65535, length 2748
19:56:58.342615 IP 10.0.2.15.44102 > 151.101.117.164.443: Flags [.], ack 1047245, win 65535, length 0
19:56:58.342781 IP 151.101.117.164.443 > 10.0.2.15.44102: Flags [P.], seq 1049993:1052741, ack 869, win 65535, length 2748
19:56:58.342869 IP 10.0.2.15.44102 > 151.101.117.164.443: Flags [.], ack 1052741, win 65535, length 0
19:56:58.345862 IP 151.101.117.164.443 > 10.0.2.15.44102: Flags [P.], seq 1052741:1062359, ack 869, win 65535, length 9618
19:56:58.345865 IP 151.101.117.164.443 > 10.0.2.15.44102: Flags [P.], seq 1062359:1063733, ack 869, win 65535, length 1374
19:56:58.345890 IP 10.0.2.15.44102 > 151.101.117.164.443: Flags [.], ack 1062359, win 65535, length 0
19:56:58.346376 IP 151.101.117.164.443 > 10.0.2.15.44102: Flags [P.], seq 1063733:1067855, ack 869, win 65535, length 4122
19:56:58.346378 IP 151.101.117.164.443 > 10.0.2.15.44102: Flags [P.], seq 1067855:1073351, ack 869, win 65535, length 5496
19:56:58.346451 IP 10.0.2.15.44102 > 151.101.117.164.443: Flags [.], ack 1073351, win 65535, length 0
19:56:58.347313 IP 151.101.117.164.443 > 10.0.2.15.44102: Flags [P.], seq 1073351:1077473, ack 869, win 65535, length 4122
19:56:58.347326 IP 10.0.2.15.44102 > 151.101.117.164.443: Flags [.], ack 1077473, win 65535, length 0
19:56:58.347546 IP 151.101.117.164.443 > 10.0.2.15.44102: Flags [P.], seq 1077473:1081595, ack 869, win 65535, length 4122
19:56:58.347554 IP 10.0.2.15.44102 > 151.101.117.164.443: Flags [.], ack 1081595, win 65535, length 0
19:56:58.348438 IP 151.101.117.164.443 > 10.0.2.15.44102: Flags [P.], seq 1081595:1082969, ack 869, win 65535, length 1374
19:56:58.348769 IP 151.101.117.164.443 > 10.0.2.15.44102: Flags [P.], seq 1082969:1088465, ack 869, win 65535, length 5496
19:56:58.348771 IP 151.101.117.164.443 > 10.0.2.15.44102: Flags [P.], seq 1088465:1091213, ack 869, win 65535, length 2748
19:56:58.348885 IP 10.0.2.15.44102 > 151.101.117.164.443: Flags [.], ack 1091213, win 65535, length 0
19:56:58.349176 IP 151.101.117.164.443 > 10.0.2.15.44102: Flags [P.], seq 1091213:1093961, ack 869, win 65535, length 2748
19:56:58.349212 IP 10.0.2.15.44102 > 151.101.117.164.443: Flags [.], ack 1093961, win 65535, length 0
19:56:58.349675 IP 151.101.117.164.443 > 10.0.2.15.44102: Flags [P.], seq 1093961:1099457, ack 869, win 65535, length 5496
19:56:58.349856 IP 151.101.117.164.443 > 10.0.2.15.44102: Flags [P.], seq 1099457:1103579, ack 869, win 65535, length 4122
19:56:58.349910 IP 10.0.2.15.44102 > 151.101.117.164.443: Flags [.], ack 1099457, win 65535, length 0
19:56:58.350105 IP 151.101.117.164.443 > 10.0.2.15.44102: Flags [P.], seq 1103579:1106327, ack 869, win 65535, length 2748
19:56:58.350223 IP 10.0.2.15.44102 > 151.101.117.164.443: Flags [.], ack 1106327, win 65535, length 0
19:56:58.352242 IP 151.101.117.164.443 > 10.0.2.15.44102: Flags [P.], seq 1106327:1113197, ack 869, win 65535, length 6870
19:56:58.352245 IP 151.101.117.164.443 > 10.0.2.15.44102: Flags [P.], seq 1113197:1115945, ack 869, win 65535, length 2748
19:56:58.352246 IP 151.101.117.164.443 > 10.0.2.15.44102: Flags [P.], seq 1115945:1121441, ack 869, win 65535, length 5496
19:56:58.352268 IP 10.0.2.15.44102 > 151.101.117.164.443: Flags [.], ack 1113197, win 65535, length 0
19:56:58.352529 IP 151.101.117.164.443 > 10.0.2.15.44102: Flags [P.], seq 1121441:1124189, ack 869, win 65535, length 2748
19:56:58.352531 IP 151.101.117.164.443 > 10.0.2.15.44102: Flags [P.], seq 1124189:1125563, ack 869, win 65535, length 1374
19:56:58.352597 IP 10.0.2.15.44102 > 151.101.117.164.443: Flags [.], ack 1125563, win 65535, length 0
19:56:58.353920 IP 151.101.117.164.443 > 10.0.2.15.44102: Flags [P.], seq 1125563:1132433, ack 869, win 65535, length 6870
19:56:58.353922 IP 151.101.117.164.443 > 10.0.2.15.44102: Flags [P.], seq 1132433:1135181, ack 869, win 65535, length 2748
19:56:58.353922 IP 151.101.117.164.443 > 10.0.2.15.44102: Flags [P.], seq 1135181:1136555, ack 869, win 65535, length 1374
19:56:58.353941 IP 10.0.2.15.44102 > 151.101.117.164.443: Flags [.], ack 1132433, win 65535, length 0
19:56:58.354008 IP 151.101.117.164.443 > 10.0.2.15.44102: Flags [P.], seq 1136555:1137929, ack 869, win 65535, length 1374
19:56:58.354067 IP 10.0.2.15.44102 > 151.101.117.164.443: Flags [.], ack 1137929, win 65535, length 0
19:56:58.355125 IP 151.101.117.164.443 > 10.0.2.15.44102: Flags [P.], seq 1137929:1143425, ack 869, win 65535, length 5496
19:56:58.355127 IP 151.101.117.164.443 > 10.0.2.15.44102: Flags [.], seq 1143425:1144885, ack 869, win 65535, length 1460
19:56:58.355147 IP 10.0.2.15.44102 > 151.101.117.164.443: Flags [.], ack 1143425, win 65535, length 0
19:56:58.355568 IP 151.101.117.164.443 > 10.0.2.15.44102: Flags [P.], seq 1144885:1147547, ack 869, win 65535, length 2662
19:56:58.355570 IP 151.101.117.164.443 > 10.0.2.15.44102: Flags [P.], seq 1147547:1150295, ack 869, win 65535, length 2748
19:56:58.355571 IP 151.101.117.164.443 > 10.0.2.15.44102: Flags [P.], seq 1150295:1153043, ack 869, win 65535, length 2748
19:56:58.355572 IP 151.101.117.164.443 > 10.0.2.15.44102: Flags [P.], seq 1153043:1155791, ack 869, win 65535, length 2748
19:56:58.355805 IP 10.0.2.15.44102 > 151.101.117.164.443: Flags [.], ack 1155791, win 65535, length 0
19:56:58.357570 IP 151.101.117.164.443 > 10.0.2.15.44102: Flags [.], seq 1155791:1157251, ack 869, win 65535, length 1460
19:56:58.358056 IP 151.101.117.164.443 > 10.0.2.15.44102: Flags [P.], seq 1157251:1162661, ack 869, win 65535, length 5410
19:56:58.358073 IP 10.0.2.15.44102 > 151.101.117.164.443: Flags [.], ack 1162661, win 65535, length 0
19:56:58.358210 IP 151.101.117.164.443 > 10.0.2.15.44102: Flags [P.], seq 1162661:1164035, ack 869, win 65535, length 1374
19:56:58.359519 IP 151.101.117.164.443 > 10.0.2.15.44102: Flags [P.], seq 1164035:1169531, ack 869, win 65535, length 5496
19:56:58.359539 IP 10.0.2.15.44102 > 151.101.117.164.443: Flags [.], ack 1169531, win 65535, length 0
19:56:58.360287 IP 151.101.117.164.443 > 10.0.2.15.44102: Flags [P.], seq 1169531:1176401, ack 869, win 65535, length 6870
19:56:58.360289 IP 151.101.117.164.443 > 10.0.2.15.44102: Flags [P.], seq 1176401:1177775, ack 869, win 65535, length 1374
19:56:58.360290 IP 151.101.117.164.443 > 10.0.2.15.44102: Flags [P.], seq 1177775:1180523, ack 869, win 65535, length 2748
19:56:58.360319 IP 151.101.117.164.443 > 10.0.2.15.44102: Flags [P.], seq 1180523:1181897, ack 869, win 65535, length 1374
19:56:58.360439 IP 10.0.2.15.44102 > 151.101.117.164.443: Flags [.], ack 1181897, win 65535, length 0
19:56:58.366218 IP 151.101.117.164.443 > 10.0.2.15.44102: Flags [P.], seq 1181897:1197011, ack 869, win 65535, length 15114
19:56:58.366248 IP 10.0.2.15.44102 > 151.101.117.164.443: Flags [.], ack 1197011, win 65535, length 0
19:56:58.366445 IP 151.101.117.164.443 > 10.0.2.15.44102: Flags [P.], seq 1197011:1201133, ack 869, win 65535, length 4122
19:56:58.366448 IP 151.101.117.164.443 > 10.0.2.15.44102: Flags [P.], seq 1201133:1206629, ack 869, win 65535, length 5496
19:56:58.366621 IP 10.0.2.15.44102 > 151.101.117.164.443: Flags [.], ack 1206629, win 65535, length 0
19:56:58.366889 IP 151.101.117.164.443 > 10.0.2.15.44102: Flags [P.], seq 1206629:1208003, ack 869, win 65535, length 1374
19:56:58.370478 IP 151.101.117.164.443 > 10.0.2.15.44102: Flags [P.], seq 1208003:1220369, ack 869, win 65535, length 12366
19:56:58.370504 IP 10.0.2.15.44102 > 151.101.117.164.443: Flags [.], ack 1220369, win 65535, length 0
19:56:58.370682 IP 151.101.117.164.443 > 10.0.2.15.44102: Flags [P.], seq 1220369:1225865, ack 869, win 65535, length 5496
19:56:58.370685 IP 151.101.117.164.443 > 10.0.2.15.44102: Flags [P.], seq 1225865:1231361, ack 869, win 65535, length 5496
19:56:58.370798 IP 10.0.2.15.44102 > 151.101.117.164.443: Flags [.], ack 1231361, win 65535, length 0
19:56:58.370937 IP 151.101.117.164.443 > 10.0.2.15.44102: Flags [P.], seq 1231361:1232735, ack 869, win 65535, length 1374
19:56:58.373863 IP 151.101.117.164.443 > 10.0.2.15.44102: Flags [P.], seq 1232735:1235483, ack 869, win 65535, length 2748
19:56:58.373879 IP 151.101.117.164.443 > 10.0.2.15.44102: Flags [P.], seq 1235483:1242353, ack 869, win 65535, length 6870
19:56:58.373881 IP 151.101.117.164.443 > 10.0.2.15.44102: Flags [P.], seq 1242353:1243727, ack 869, win 65535, length 1374
19:56:58.373912 IP 10.0.2.15.44102 > 151.101.117.164.443: Flags [.], ack 1235483, win 65535, length 0
19:56:58.373979 IP 151.101.117.164.443 > 10.0.2.15.44102: Flags [P.], seq 1243727:1247849, ack 869, win 65535, length 4122
19:56:58.374668 IP 151.101.117.164.443 > 10.0.2.15.44102: Flags [P.], seq 1247849:1249223, ack 869, win 65535, length 1374
19:56:58.374673 IP 151.101.117.164.443 > 10.0.2.15.44102: Flags [P.], seq 1249223:1254719, ack 869, win 65535, length 5496
19:56:58.374882 IP 151.101.117.164.443 > 10.0.2.15.44102: Flags [P.], seq 1254719:1260215, ack 869, win 65535, length 5496
19:56:58.375046 IP 151.101.117.164.443 > 10.0.2.15.44102: Flags [P.], seq 1260215:1264337, ack 869, win 65535, length 4122
19:56:58.375180 IP 151.101.117.164.443 > 10.0.2.15.44102: Flags [P.], seq 1264337:1265711, ack 869, win 65535, length 1374
19:56:58.375422 IP 151.101.117.164.443 > 10.0.2.15.44102: Flags [P.], seq 1265711:1268459, ack 869, win 65535, length 2748
19:56:58.377360 IP 10.0.2.15.44102 > 151.101.117.164.443: Flags [.], ack 1268459, win 65535, length 0
19:56:58.378095 IP 151.101.117.164.443 > 10.0.2.15.44102: Flags [P.], seq 1268459:1297313, ack 869, win 65535, length 28854
19:56:58.378114 IP 10.0.2.15.44102 > 151.101.117.164.443: Flags [.], ack 1297313, win 65535, length 0
19:56:58.378153 IP 151.101.117.164.443 > 10.0.2.15.44102: Flags [P.], seq 1297313:1298687, ack 869, win 65535, length 1374
19:56:58.382000 IP 151.101.117.164.443 > 10.0.2.15.44102: Flags [P.], seq 1298687:1308305, ack 869, win 65535, length 9618
19:56:58.382021 IP 10.0.2.15.44102 > 151.101.117.164.443: Flags [.], ack 1308305, win 65535, length 0
19:56:58.382225 IP 151.101.117.164.443 > 10.0.2.15.44102: Flags [P.], seq 1308305:1309679, ack 869, win 65535, length 1374
19:56:58.382934 IP 151.101.117.164.443 > 10.0.2.15.44102: Flags [P.], seq 1309679:1315175, ack 869, win 65535, length 5496
19:56:58.382949 IP 10.0.2.15.44102 > 151.101.117.164.443: Flags [.], ack 1315175, win 65535, length 0
19:56:58.383296 IP 151.101.117.164.443 > 10.0.2.15.44102: Flags [P.], seq 1315175:1316549, ack 869, win 65535, length 1374
19:56:58.385135 IP 151.101.117.164.443 > 10.0.2.15.44102: Flags [P.], seq 1316549:1320671, ack 869, win 65535, length 4122
19:56:58.385195 IP 10.0.2.15.44102 > 151.101.117.164.443: Flags [.], ack 1320671, win 65535, length 0
19:56:58.386100 IP 151.101.117.164.443 > 10.0.2.15.44102: Flags [.], seq 1320671:1325051, ack 869, win 65535, length 4380
19:56:58.386120 IP 10.0.2.15.44102 > 151.101.117.164.443: Flags [.], ack 1325051, win 65535, length 0
19:56:58.387331 IP 151.101.117.164.443 > 10.0.2.15.44102: Flags [P.], seq 1325051:1326167, ack 869, win 65535, length 1116
19:56:58.387334 IP 151.101.117.164.443 > 10.0.2.15.44102: Flags [P.], seq 1326167:1331663, ack 869, win 65535, length 5496
19:56:58.387335 IP 151.101.117.164.443 > 10.0.2.15.44102: Flags [P.], seq 1331663:1335785, ack 869, win 65535, length 4122
19:56:58.387485 IP 151.101.117.164.443 > 10.0.2.15.44102: Flags [P.], seq 1335785:1338533, ack 869, win 65535, length 2748
19:56:58.387559 IP 10.0.2.15.44102 > 151.101.117.164.443: Flags [.], ack 1338533, win 65535, length 0
19:56:58.387682 IP 151.101.117.164.443 > 10.0.2.15.44102: Flags [P.], seq 1338533:1341281, ack 869, win 65535, length 2748
19:56:58.387704 IP 10.0.2.15.44102 > 151.101.117.164.443: Flags [.], ack 1341281, win 65535, length 0
19:56:58.389533 IP 151.101.117.164.443 > 10.0.2.15.44102: Flags [P.], seq 1341281:1348151, ack 869, win 65535, length 6870
19:56:58.389536 IP 151.101.117.164.443 > 10.0.2.15.44102: Flags [P.], seq 1348151:1350899, ack 869, win 65535, length 2748
19:56:58.389536 IP 151.101.117.164.443 > 10.0.2.15.44102: Flags [P.], seq 1350899:1352273, ack 869, win 65535, length 1374
19:56:58.389559 IP 10.0.2.15.44102 > 151.101.117.164.443: Flags [.], ack 1348151, win 65535, length 0
19:56:58.389719 IP 151.101.117.164.443 > 10.0.2.15.44102: Flags [P.], seq 1352273:1355021, ack 869, win 65535, length 2748
19:56:58.389857 IP 10.0.2.15.44102 > 151.101.117.164.443: Flags [.], ack 1355021, win 65535, length 0
19:56:58.391671 IP 151.101.117.164.443 > 10.0.2.15.44102: Flags [P.], seq 1355021:1360517, ack 869, win 65535, length 5496
19:56:58.391674 IP 151.101.117.164.443 > 10.0.2.15.44102: Flags [P.], seq 1360517:1364639, ack 869, win 65535, length 4122
19:56:58.391696 IP 10.0.2.15.44102 > 151.101.117.164.443: Flags [.], ack 1360517, win 65535, length 0
19:56:58.391921 IP 10.0.2.15.44102 > 151.101.117.164.443: Flags [.], ack 1364639, win 65535, length 0
19:56:58.392086 IP 151.101.117.164.443 > 10.0.2.15.44102: Flags [P.], seq 1364639:1366013, ack 869, win 65535, length 1374
19:56:58.392897 IP 151.101.117.164.443 > 10.0.2.15.44102: Flags [P.], seq 1366013:1374257, ack 869, win 65535, length 8244
19:56:58.392913 IP 10.0.2.15.44102 > 151.101.117.164.443: Flags [.], ack 1374257, win 65535, length 0
19:56:58.393188 IP 151.101.117.164.443 > 10.0.2.15.44102: Flags [P.], seq 1374257:1378379, ack 869, win 65535, length 4122
19:56:58.393232 IP 10.0.2.15.44102 > 151.101.117.164.443: Flags [.], ack 1378379, win 65535, length 0
19:56:58.394595 IP 151.101.117.164.443 > 10.0.2.15.44102: Flags [P.], seq 1378379:1383875, ack 869, win 65535, length 5496
19:56:58.394774 IP 10.0.2.15.44102 > 151.101.117.164.443: Flags [.], ack 1383875, win 65535, length 0
19:56:58.395020 IP 151.101.117.164.443 > 10.0.2.15.44102: Flags [P.], seq 1383875:1389371, ack 869, win 65535, length 5496
19:56:58.395437 IP 151.101.117.164.443 > 10.0.2.15.44102: Flags [P.], seq 1389371:1394867, ack 869, win 65535, length 5496
19:56:58.395499 IP 10.0.2.15.44102 > 151.101.117.164.443: Flags [.], ack 1394867, win 65535, length 0
19:56:58.395742 IP 151.101.117.164.443 > 10.0.2.15.44102: Flags [P.], seq 1394867:1398989, ack 869, win 65535, length 4122
19:56:58.395751 IP 10.0.2.15.44102 > 151.101.117.164.443: Flags [.], ack 1398989, win 65535, length 0
19:56:58.397342 IP 151.101.117.164.443 > 10.0.2.15.44102: Flags [P.], seq 1398989:1407233, ack 869, win 65535, length 8244
19:56:58.397439 IP 10.0.2.15.44102 > 151.101.117.164.443: Flags [.], ack 1407233, win 65535, length 0
19:56:58.398218 IP 151.101.117.164.443 > 10.0.2.15.44102: Flags [P.], seq 1407233:1412729, ack 869, win 65535, length 5496
19:56:58.398220 IP 151.101.117.164.443 > 10.0.2.15.44102: Flags [P.], seq 1412729:1414103, ack 869, win 65535, length 1374
19:56:58.398316 IP 10.0.2.15.44102 > 151.101.117.164.443: Flags [.], ack 1414103, win 65535, length 0
19:56:58.400052 IP 151.101.117.164.443 > 10.0.2.15.44102: Flags [.], seq 1414103:1415563, ack 869, win 65535, length 1460
19:56:58.400523 IP 151.101.117.164.443 > 10.0.2.15.44102: Flags [P.], seq 1415563:1416851, ack 869, win 65535, length 1288
19:56:58.400526 IP 151.101.117.164.443 > 10.0.2.15.44102: Flags [P.], seq 1416851:1422347, ack 869, win 65535, length 5496
19:56:58.400527 IP 151.101.117.164.443 > 10.0.2.15.44102: Flags [P.], seq 1422347:1426469, ack 869, win 65535, length 4122
19:56:58.400548 IP 10.0.2.15.44102 > 151.101.117.164.443: Flags [.], ack 1416851, win 65535, length 0
19:56:58.400727 IP 151.101.117.164.443 > 10.0.2.15.44102: Flags [P.], seq 1426469:1427843, ack 869, win 65535, length 1374
19:56:58.400791 IP 10.0.2.15.44102 > 151.101.117.164.443: Flags [.], ack 1427843, win 65535, length 0
19:56:58.400930 IP 151.101.117.164.443 > 10.0.2.15.44102: Flags [P.], seq 1427843:1436087, ack 869, win 65535, length 8244
19:56:58.401209 IP 151.101.117.164.443 > 10.0.2.15.44102: Flags [P.], seq 1436087:1438835, ack 869, win 65535, length 2748
19:56:58.401211 IP 151.101.117.164.443 > 10.0.2.15.44102: Flags [P.], seq 1438835:1442957, ack 869, win 65535, length 4122
19:56:58.401254 IP 10.0.2.15.44102 > 151.101.117.164.443: Flags [.], ack 1442957, win 65535, length 0
19:56:58.401607 IP 151.101.117.164.443 > 10.0.2.15.44102: Flags [P.], seq 1442957:1444331, ack 869, win 65535, length 1374
19:56:58.402785 IP 151.101.117.164.443 > 10.0.2.15.44102: Flags [P.], seq 1444331:1451201, ack 869, win 65535, length 6870
19:56:58.402788 IP 151.101.117.164.443 > 10.0.2.15.44102: Flags [P.], seq 1451201:1452575, ack 869, win 65535, length 1374
19:56:58.402810 IP 10.0.2.15.44102 > 151.101.117.164.443: Flags [.], ack 1451201, win 65535, length 0
19:56:58.403342 IP 151.101.117.164.443 > 10.0.2.15.44102: Flags [P.], seq 1452575:1456697, ack 869, win 65535, length 4122
19:56:58.403450 IP 10.0.2.15.44102 > 151.101.117.164.443: Flags [.], ack 1456697, win 65535, length 0
19:56:58.403670 IP 151.101.117.164.443 > 10.0.2.15.44102: Flags [P.], seq 1456697:1460819, ack 869, win 65535, length 4122
19:56:58.403671 IP 151.101.117.164.443 > 10.0.2.15.44102: Flags [P.], seq 1460819:1463567, ack 869, win 65535, length 2748
19:56:58.403683 IP 10.0.2.15.44102 > 151.101.117.164.443: Flags [.], ack 1460819, win 65535, length 0
19:56:58.403941 IP 151.101.117.164.443 > 10.0.2.15.44102: Flags [P.], seq 1463567:1466315, ack 869, win 65535, length 2748
19:56:58.403990 IP 10.0.2.15.44102 > 151.101.117.164.443: Flags [.], ack 1466315, win 65535, length 0
19:56:58.406562 IP 151.101.117.164.443 > 10.0.2.15.44102: Flags [P.], seq 1466315:1474559, ack 869, win 65535, length 8244
19:56:58.406565 IP 151.101.117.164.443 > 10.0.2.15.44102: Flags [P.], seq 1474559:1478681, ack 869, win 65535, length 4122
19:56:58.406656 IP 151.101.117.164.443 > 10.0.2.15.44102: Flags [P.], seq 1478681:1482803, ack 869, win 65535, length 4122
19:56:58.406944 IP 151.101.117.164.443 > 10.0.2.15.44102: Flags [P.], seq 1482803:1486925, ack 869, win 65535, length 4122
19:56:58.406945 IP 151.101.117.164.443 > 10.0.2.15.44102: Flags [P.], seq 1486925:1488299, ack 869, win 65535, length 1374
19:56:58.407105 IP 151.101.117.164.443 > 10.0.2.15.44102: Flags [P.], seq 1488299:1489673, ack 869, win 65535, length 1374
19:56:58.407286 IP 10.0.2.15.44102 > 151.101.117.164.443: Flags [.], ack 1489673, win 65535, length 0
19:56:58.407934 IP 151.101.117.164.443 > 10.0.2.15.44102: Flags [P.], seq 1489673:1493795, ack 869, win 65535, length 4122
19:56:58.408221 IP 151.101.117.164.443 > 10.0.2.15.44102: Flags [P.], seq 1493795:1502039, ack 869, win 65535, length 8244
19:56:58.408222 IP 151.101.117.164.443 > 10.0.2.15.44102: Flags [P.], seq 1502039:1503413, ack 869, win 65535, length 1374
19:56:58.408734 IP 10.0.2.15.44102 > 151.101.117.164.443: Flags [.], ack 1503413, win 65535, length 0
19:56:58.409161 IP 151.101.117.164.443 > 10.0.2.15.44102: Flags [P.], seq 1503413:1508909, ack 869, win 65535, length 5496
19:56:58.409178 IP 10.0.2.15.44102 > 151.101.117.164.443: Flags [.], ack 1508909, win 65535, length 0
19:56:58.409279 IP 151.101.117.164.443 > 10.0.2.15.44102: Flags [P.], seq 1508909:1511657, ack 869, win 65535, length 2748
19:56:58.409329 IP 10.0.2.15.44102 > 151.101.117.164.443: Flags [.], ack 1511657, win 65535, length 0
19:56:58.409541 IP 151.101.117.164.443 > 10.0.2.15.44102: Flags [P.], seq 1511657:1514405, ack 869, win 65535, length 2748
19:56:58.409543 IP 151.101.117.164.443 > 10.0.2.15.44102: Flags [P.], seq 1514405:1515779, ack 869, win 65535, length 1374
19:56:58.409703 IP 10.0.2.15.44102 > 151.101.117.164.443: Flags [.], ack 1515779, win 65535, length 0
19:56:58.409807 IP 151.101.117.164.443 > 10.0.2.15.44102: Flags [P.], seq 1515779:1518527, ack 869, win 65535, length 2748
19:56:58.409838 IP 10.0.2.15.44102 > 151.101.117.164.443: Flags [.], ack 1518527, win 65535, length 0
19:56:58.409882 IP 151.101.117.164.443 > 10.0.2.15.44102: Flags [P.], seq 1518527:1519901, ack 869, win 65535, length 1374
19:56:58.410537 IP 151.101.117.164.443 > 10.0.2.15.44102: Flags [P.], seq 1519901:1524023, ack 869, win 65535, length 4122
19:56:58.410540 IP 151.101.117.164.443 > 10.0.2.15.44102: Flags [P.], seq 1524023:1526771, ack 869, win 65535, length 2748
19:56:58.410671 IP 10.0.2.15.44102 > 151.101.117.164.443: Flags [.], ack 1524023, win 65535, length 0
19:56:58.410837 IP 151.101.117.164.443 > 10.0.2.15.44102: Flags [P.], seq 1526771:1529519, ack 869, win 65535, length 2748
19:56:58.410838 IP 151.101.117.164.443 > 10.0.2.15.44102: Flags [P.], seq 1529519:1530893, ack 869, win 65535, length 1374
19:56:58.410936 IP 151.101.117.164.443 > 10.0.2.15.44102: Flags [P.], seq 1530893:1536389, ack 869, win 65535, length 5496
19:56:58.410993 IP 10.0.2.15.44102 > 151.101.117.164.443: Flags [.], ack 1536389, win 65535, length 0
19:56:58.411088 IP 151.101.117.164.443 > 10.0.2.15.44102: Flags [P.], seq 1536389:1537763, ack 869, win 65535, length 1374
19:56:58.411298 IP 151.101.117.164.443 > 10.0.2.15.44102: Flags [P.], seq 1537763:1540511, ack 869, win 65535, length 2748
19:56:58.411306 IP 10.0.2.15.44102 > 151.101.117.164.443: Flags [.], ack 1540511, win 65535, length 0
19:56:58.412910 IP 151.101.117.164.443 > 10.0.2.15.44102: Flags [P.], seq 1540511:1547381, ack 869, win 65535, length 6870
19:56:58.413036 IP 151.101.117.164.443 > 10.0.2.15.44102: Flags [P.], seq 1547381:1548755, ack 869, win 65535, length 1374
19:56:58.413080 IP 10.0.2.15.44102 > 151.101.117.164.443: Flags [.], ack 1548755, win 65535, length 0
19:56:58.413813 IP 151.101.117.164.443 > 10.0.2.15.44102: Flags [P.], seq 1548755:1555625, ack 869, win 65535, length 6870
19:56:58.414166 IP 151.101.117.164.443 > 10.0.2.15.44102: Flags [P.], seq 1555625:1561121, ack 869, win 65535, length 5496
19:56:58.414201 IP 10.0.2.15.44102 > 151.101.117.164.443: Flags [.], ack 1561121, win 65535, length 0
19:56:58.414347 IP 151.101.117.164.443 > 10.0.2.15.44102: Flags [P.], seq 1561121:1562495, ack 869, win 65535, length 1374
19:56:58.415714 IP 151.101.117.164.443 > 10.0.2.15.44102: Flags [P.], seq 1562495:1570739, ack 869, win 65535, length 8244
19:56:58.415717 IP 151.101.117.164.443 > 10.0.2.15.44102: Flags [P.], seq 1570739:1576235, ack 869, win 65535, length 5496
19:56:58.415737 IP 10.0.2.15.44102 > 151.101.117.164.443: Flags [.], ack 1570739, win 65535, length 0
19:56:58.415852 IP 10.0.2.15.44102 > 151.101.117.164.443: Flags [.], ack 1576235, win 65535, length 0
19:56:58.417221 IP 151.101.117.164.443 > 10.0.2.15.44102: Flags [P.], seq 1576235:1581731, ack 869, win 65535, length 5496
19:56:58.417238 IP 10.0.2.15.44102 > 151.101.117.164.443: Flags [.], ack 1581731, win 65535, length 0
19:56:58.418264 IP 151.101.117.164.443 > 10.0.2.15.44102: Flags [P.], seq 1581731:1588601, ack 869, win 65535, length 6870
19:56:58.418348 IP 10.0.2.15.44102 > 151.101.117.164.443: Flags [.], ack 1588601, win 65535, length 0
19:56:58.419342 IP 151.101.117.164.443 > 10.0.2.15.44102: Flags [P.], seq 1588601:1594097, ack 869, win 65535, length 5496
19:56:58.419344 IP 151.101.117.164.443 > 10.0.2.15.44102: Flags [P.], seq 1594097:1596845, ack 869, win 65535, length 2748
19:56:58.419362 IP 10.0.2.15.44102 > 151.101.117.164.443: Flags [.], ack 1594097, win 65535, length 0
19:56:58.419454 IP 10.0.2.15.44102 > 151.101.117.164.443: Flags [.], ack 1596845, win 65535, length 0
19:56:58.420779 IP 151.101.117.164.443 > 10.0.2.15.44102: Flags [P.], seq 1596845:1605089, ack 869, win 65535, length 8244
19:56:58.420867 IP 10.0.2.15.44102 > 151.101.117.164.443: Flags [.], ack 1605089, win 65535, length 0
19:56:58.421029 IP 151.101.117.164.443 > 10.0.2.15.44102: Flags [P.], seq 1605089:1606463, ack 869, win 65535, length 1374
19:56:58.422175 IP 151.101.117.164.443 > 10.0.2.15.44102: Flags [P.], seq 1606463:1613333, ack 869, win 65535, length 6870
19:56:58.422177 IP 151.101.117.164.443 > 10.0.2.15.44102: Flags [P.], seq 1613333:1616081, ack 869, win 65535, length 2748
19:56:58.422196 IP 10.0.2.15.44102 > 151.101.117.164.443: Flags [.], ack 1613333, win 65535, length 0
19:56:58.422487 IP 151.101.117.164.443 > 10.0.2.15.44102: Flags [P.], seq 1616081:1618829, ack 869, win 65535, length 2748
19:56:58.422862 IP 151.101.117.164.443 > 10.0.2.15.44102: Flags [P.], seq 1618829:1621577, ack 869, win 65535, length 2748
19:56:58.422864 IP 151.101.117.164.443 > 10.0.2.15.44102: Flags [P.], seq 1621577:1625699, ack 869, win 65535, length 4122
19:56:58.422922 IP 10.0.2.15.44102 > 151.101.117.164.443: Flags [.], ack 1625699, win 65535, length 0
19:56:58.424320 IP 151.101.117.164.443 > 10.0.2.15.44102: Flags [P.], seq 1625699:1631195, ack 869, win 65535, length 5496
19:56:58.424347 IP 10.0.2.15.44102 > 151.101.117.164.443: Flags [.], ack 1631195, win 65535, length 0
19:56:58.425208 IP 151.101.117.164.443 > 10.0.2.15.44102: Flags [P.], seq 1631195:1636691, ack 869, win 65535, length 5496
19:56:58.425210 IP 151.101.117.164.443 > 10.0.2.15.44102: Flags [.], seq 1636691:1638151, ack 869, win 65535, length 1460
19:56:58.425259 IP 10.0.2.15.44102 > 151.101.117.164.443: Flags [.], ack 1636691, win 65535, length 0
19:56:58.425797 IP 151.101.117.164.443 > 10.0.2.15.44102: Flags [P.], seq 1638151:1640813, ack 869, win 65535, length 2662
19:56:58.425798 IP 151.101.117.164.443 > 10.0.2.15.44102: Flags [P.], seq 1640813:1642187, ack 869, win 65535, length 1374
19:56:58.425799 IP 151.101.117.164.443 > 10.0.2.15.44102: Flags [P.], seq 1642187:1644935, ack 869, win 65535, length 2748
19:56:58.425799 IP 151.101.117.164.443 > 10.0.2.15.44102: Flags [P.], seq 1644935:1646309, ack 869, win 65535, length 1374
19:56:58.425800 IP 151.101.117.164.443 > 10.0.2.15.44102: Flags [P.], seq 1646309:1649057, ack 869, win 65535, length 2748
19:56:58.425890 IP 10.0.2.15.44102 > 151.101.117.164.443: Flags [.], ack 1649057, win 65535, length 0
19:56:58.427538 IP 151.101.117.164.443 > 10.0.2.15.44102: Flags [P.], seq 1649057:1655927, ack 869, win 65535, length 6870
19:56:58.427559 IP 10.0.2.15.44102 > 151.101.117.164.443: Flags [.], ack 1655927, win 65535, length 0
19:56:58.427780 IP 151.101.117.164.443 > 10.0.2.15.44102: Flags [P.], seq 1655927:1657301, ack 869, win 65535, length 1374
19:56:58.427781 IP 151.101.117.164.443 > 10.0.2.15.44102: Flags [P.], seq 1657301:1660049, ack 869, win 65535, length 2748
19:56:58.427781 IP 151.101.117.164.443 > 10.0.2.15.44102: Flags [.], seq 1660049:1661509, ack 869, win 65535, length 1460
19:56:58.427891 IP 151.101.117.164.443 > 10.0.2.15.44102: Flags [P.], seq 1661509:1664171, ack 869, win 65535, length 2662
19:56:58.428046 IP 151.101.117.164.443 > 10.0.2.15.44102: Flags [P.], seq 1664171:1665545, ack 869, win 65535, length 1374
19:56:58.428129 IP 10.0.2.15.44102 > 151.101.117.164.443: Flags [.], ack 1665545, win 65535, length 0
19:56:58.428257 IP 151.101.117.164.443 > 10.0.2.15.44102: Flags [P.], seq 1665545:1668293, ack 869, win 65535, length 2748
19:56:58.428404 IP 151.101.117.164.443 > 10.0.2.15.44102: Flags [P.], seq 1668293:1671041, ack 869, win 65535, length 2748
19:56:58.428450 IP 10.0.2.15.44102 > 151.101.117.164.443: Flags [.], ack 1671041, win 65535, length 0
19:56:58.428611 IP 151.101.117.164.443 > 10.0.2.15.44102: Flags [P.], seq 1671041:1673789, ack 869, win 65535, length 2748
19:56:58.428666 IP 151.101.117.164.443 > 10.0.2.15.44102: Flags [P.], seq 1673789:1677911, ack 869, win 65535, length 4122
19:56:58.428693 IP 10.0.2.15.44102 > 151.101.117.164.443: Flags [.], ack 1677911, win 65535, length 0
19:56:58.430306 IP 151.101.117.164.443 > 10.0.2.15.44102: Flags [P.], seq 1677911:1682033, ack 869, win 65535, length 4122
19:56:58.430308 IP 151.101.117.164.443 > 10.0.2.15.44102: Flags [P.], seq 1682033:1684781, ack 869, win 65535, length 2748
19:56:58.430309 IP 151.101.117.164.443 > 10.0.2.15.44102: Flags [P.], seq 1684781:1687529, ack 869, win 65535, length 2748
19:56:58.430351 IP 10.0.2.15.44102 > 151.101.117.164.443: Flags [.], ack 1682033, win 65535, length 0
19:56:58.430521 IP 151.101.117.164.443 > 10.0.2.15.44102: Flags [P.], seq 1687529:1690277, ack 869, win 65535, length 2748
19:56:58.430554 IP 151.101.117.164.443 > 10.0.2.15.44102: Flags [P.], seq 1690277:1691651, ack 869, win 65535, length 1374
19:56:58.430555 IP 151.101.117.164.443 > 10.0.2.15.44102: Flags [P.], seq 1691651:1694399, ack 869, win 65535, length 2748
19:56:58.430715 IP 151.101.117.164.443 > 10.0.2.15.44102: Flags [P.], seq 1694399:1697147, ack 869, win 65535, length 2748
19:56:58.430821 IP 151.101.117.164.443 > 10.0.2.15.44102: Flags [P.], seq 1697147:1698521, ack 869, win 65535, length 1374
19:56:58.430855 IP 10.0.2.15.44102 > 151.101.117.164.443: Flags [.], ack 1698521, win 65535, length 0
19:56:58.431018 IP 151.101.117.164.443 > 10.0.2.15.44102: Flags [P.], seq 1698521:1701269, ack 869, win 65535, length 2748
19:56:58.431190 IP 151.101.117.164.443 > 10.0.2.15.44102: Flags [P.], seq 1701269:1704017, ack 869, win 65535, length 2748
19:56:58.431245 IP 10.0.2.15.44102 > 151.101.117.164.443: Flags [.], ack 1704017, win 65535, length 0
19:56:58.431292 IP 151.101.117.164.443 > 10.0.2.15.44102: Flags [P.], seq 1704017:1705391, ack 869, win 65535, length 1374
19:56:58.432732 IP 151.101.117.164.443 > 10.0.2.15.44102: Flags [P.], seq 1705391:1715009, ack 869, win 65535, length 9618
19:56:58.432735 IP 151.101.117.164.443 > 10.0.2.15.44102: Flags [P.], seq 1715009:1720505, ack 869, win 65535, length 5496
19:56:58.432805 IP 10.0.2.15.44102 > 151.101.117.164.443: Flags [.], ack 1715009, win 65535, length 0
19:56:58.433148 IP 151.101.117.164.443 > 10.0.2.15.44102: Flags [P.], seq 1720505:1724627, ack 869, win 65535, length 4122
19:56:58.433220 IP 10.0.2.15.44102 > 151.101.117.164.443: Flags [.], ack 1724627, win 65535, length 0
19:56:58.434656 IP 151.101.117.164.443 > 10.0.2.15.44102: Flags [P.], seq 1724627:1730123, ack 869, win 65535, length 5496
19:56:58.434721 IP 10.0.2.15.44102 > 151.101.117.164.443: Flags [.], ack 1730123, win 65535, length 0

