19:57:47.499755 IP 10.0.2.15.50842 > 140.233.253.2.53: 18795+ A? www.nytimes.com. (33)
19:57:47.499797 IP 10.0.2.15.50842 > 140.233.253.2.53: 43117+ AAAA? www.nytimes.com. (33)
19:57:47.506123 IP 140.233.253.2.53 > 10.0.2.15.50842: 18795 3/0/0 CNAME www.prd.map.nytimes.com., CNAME nytimes.map.fastly.net., A 151.101.117.164 (111)
19:57:47.519006 IP 140.233.253.2.53 > 10.0.2.15.50842: 43117 2/1/0 CNAME www.prd.map.nytimes.com., CNAME nytimes.map.fastly.net. (153)
19:57:47.519293 IP 10.0.2.15.44122 > 151.101.117.164.443: Flags [S], seq 1325578454, win 64240, options [mss 1460,sackOK,TS val 917670602 ecr 0,nop,wscale 6], length 0
19:57:47.535175 IP 151.101.117.164.443 > 10.0.2.15.44122: Flags [S.], seq 210240001, ack 1325578455, win 65535, options [mss 1460], length 0
19:57:47.535221 IP 10.0.2.15.44122 > 151.101.117.164.443: Flags [.], ack 1, win 64240, length 0
19:57:47.543123 IP 10.0.2.15.44122 > 151.101.117.164.443: Flags [P.], seq 1:518, ack 1, win 64240, length 517
19:57:47.543514 IP 151.101.117.164.443 > 10.0.2.15.44122: Flags [.], ack 518, win 65535, length 0
19:57:47.562895 IP 151.101.117.164.443 > 10.0.2.15.44122: Flags [.], seq 1:2921, ack 518, win 65535, length 2920
19:57:47.562916 IP 10.0.2.15.44122 > 151.101.117.164.443: Flags [.], ack 2921, win 62780, length 0
19:57:47.563191 IP 151.101.117.164.443 > 10.0.2.15.44122: Flags [P.], seq 2921:5607, ack 518, win 65535, length 2686
19:57:47.563200 IP 10.0.2.15.44122 > 151.101.117.164.443: Flags [.], ack 5607, win 62780, length 0
19:57:47.564845 IP 10.0.2.15.44122 > 151.101.117.164.443: Flags [P.], seq 518:611, ack 5607, win 62780, length 93
19:57:47.565252 IP 151.101.117.164.443 > 10.0.2.15.44122: Flags [.], ack 611, win 65535, length 0
19:57:47.581070 IP 151.101.117.164.443 > 10.0.2.15.44122: Flags [P.], seq 5607:5658, ack 611, win 65535, length 51
19:57:47.581092 IP 10.0.2.15.44122 > 151.101.117.164.443: Flags [.], ack 5658, win 62780, length 0
19:57:47.581854 IP 10.0.2.15.44122 > 151.101.117.164.443: Flags [P.], seq 611:664, ack 5658, win 62780, length 53
19:57:47.581889 IP 10.0.2.15.44122 > 151.101.117.164.443: Flags [P.], seq 664:720, ack 5658, win 62780, length 56
19:57:47.582144 IP 151.101.117.164.443 > 10.0.2.15.44122: Flags [.], ack 664, win 65535, length 0
19:57:47.582145 IP 151.101.117.164.443 > 10.0.2.15.44122: Flags [.], ack 720, win 65535, length 0
19:57:47.582159 IP 10.0.2.15.44122 > 151.101.117.164.443: Flags [P.], seq 720:831, ack 5658, win 62780, length 111
19:57:47.582281 IP 151.101.117.164.443 > 10.0.2.15.44122: Flags [.], ack 831, win 65535, length 0
19:57:47.596222 IP 151.101.117.164.443 > 10.0.2.15.44122: Flags [P.], seq 5658:5753, ack 831, win 65535, length 95
19:57:47.596244 IP 10.0.2.15.44122 > 151.101.117.164.443: Flags [.], ack 5753, win 62780, length 0
19:57:47.596734 IP 10.0.2.15.44122 > 151.101.117.164.443: Flags [P.], seq 831:869, ack 5753, win 62780, length 38
19:57:47.597015 IP 151.101.117.164.443 > 10.0.2.15.44122: Flags [.], ack 869, win 65535, length 0
19:57:48.647393 IP 151.101.117.164.443 > 10.0.2.15.44122: Flags [P.], seq 5753:13997, ack 869, win 65535, length 8244
19:57:48.647861 IP 10.0.2.15.44122 > 151.101.117.164.443: Flags [.], ack 13997, win 58400, length 0
19:57:48.648325 IP 151.101.117.164.443 > 10.0.2.15.44122: Flags [.], seq 13997:24217, ack 869, win 65535, length 10220
19:57:48.648806 IP 10.0.2.15.44122 > 151.101.117.164.443: Flags [.], ack 24217, win 52560, length 0
19:57:48.649232 IP 151.101.117.164.443 > 10.0.2.15.44122: Flags [.], seq 24217:35897, ack 869, win 65535, length 11680
19:57:48.649262 IP 10.0.2.15.44122 > 151.101.117.164.443: Flags [.], ack 35897, win 43800, length 0
19:57:48.649710 IP 151.101.117.164.443 > 10.0.2.15.44122: Flags [.], seq 35897:46117, ack 869, win 65535, length 10220
19:57:48.649818 IP 10.0.2.15.44122 > 151.101.117.164.443: Flags [.], ack 46117, win 37960, length 0
19:57:48.649957 IP 151.101.117.164.443 > 10.0.2.15.44122: Flags [P.], seq 46117:46973, ack 869, win 65535, length 856
19:57:48.662224 IP 151.101.117.164.443 > 10.0.2.15.44122: Flags [P.], seq 46973:52469, ack 869, win 65535, length 5496
19:57:48.662247 IP 10.0.2.15.44122 > 151.101.117.164.443: Flags [.], ack 52469, win 61320, length 0
19:57:48.663165 IP 151.101.117.164.443 > 10.0.2.15.44122: Flags [P.], seq 52469:53843, ack 869, win 65535, length 1374
19:57:48.664154 IP 151.101.117.164.443 > 10.0.2.15.44122: Flags [P.], seq 53843:57965, ack 869, win 65535, length 4122
19:57:48.664171 IP 10.0.2.15.44122 > 151.101.117.164.443: Flags [.], ack 57965, win 61320, length 0
19:57:48.665964 IP 151.101.117.164.443 > 10.0.2.15.44122: Flags [P.], seq 57965:59339, ack 869, win 65535, length 1374
19:57:48.665967 IP 151.101.117.164.443 > 10.0.2.15.44122: Flags [P.], seq 59339:63461, ack 869, win 65535, length 4122
19:57:48.666001 IP 10.0.2.15.44122 > 151.101.117.164.443: Flags [.], ack 63461, win 61320, length 0
19:57:48.667160 IP 151.101.117.164.443 > 10.0.2.15.44122: Flags [P.], seq 63461:64835, ack 869, win 65535, length 1374
19:57:48.668415 IP 151.101.117.164.443 > 10.0.2.15.44122: Flags [P.], seq 64835:67583, ack 869, win 65535, length 2748
19:57:48.668434 IP 10.0.2.15.44122 > 151.101.117.164.443: Flags [.], ack 67583, win 62780, length 0
19:57:48.670444 IP 151.101.117.164.443 > 10.0.2.15.44122: Flags [P.], seq 67583:71705, ack 869, win 65535, length 4122
19:57:48.670468 IP 10.0.2.15.44122 > 151.101.117.164.443: Flags [.], ack 71705, win 65535, length 0
19:57:48.671436 IP 151.101.117.164.443 > 10.0.2.15.44122: Flags [P.], seq 71705:73079, ack 869, win 65535, length 1374
19:57:48.672636 IP 151.101.117.164.443 > 10.0.2.15.44122: Flags [P.], seq 73079:75827, ack 869, win 65535, length 2748
19:57:48.672663 IP 10.0.2.15.44122 > 151.101.117.164.443: Flags [.], ack 75827, win 65535, length 0
19:57:48.673428 IP 151.101.117.164.443 > 10.0.2.15.44122: Flags [P.], seq 75827:77201, ack 869, win 65535, length 1374
19:57:48.674434 IP 151.101.117.164.443 > 10.0.2.15.44122: Flags [P.], seq 77201:78575, ack 869, win 65535, length 1374
19:57:48.674447 IP 10.0.2.15.44122 > 151.101.117.164.443: Flags [.], ack 78575, win 65535, length 0
19:57:48.675664 IP 151.101.117.164.443 > 10.0.2.15.44122: Flags [P.], seq 78575:82697, ack 869, win 65535, length 4122
19:57:48.675675 IP 10.0.2.15.44122 > 151.101.117.164.443: Flags [.], ack 82697, win 65535, length 0
19:57:48.677729 IP 151.101.117.164.443 > 10.0.2.15.44122: Flags [P.], seq 82697:86819, ack 869, win 65535, length 4122
19:57:48.677742 IP 10.0.2.15.44122 > 151.101.117.164.443: Flags [.], ack 86819, win 65535, length 0
19:57:48.678714 IP 151.101.117.164.443 > 10.0.2.15.44122: Flags [P.], seq 86819:88193, ack 869, win 65535, length 1374
19:57:48.679966 IP 151.101.117.164.443 > 10.0.2.15.44122: Flags [P.], seq 88193:90941, ack 869, win 65535, length 2748
19:57:48.679980 IP 10.0.2.15.44122 > 151.101.117.164.443: Flags [.], ack 90941, win 65535, length 0
19:57:48.681012 IP 151.101.117.164.443 > 10.0.2.15.44122: Flags [P.], seq 90941:93689, ack 869, win 65535, length 2748
19:57:48.681026 IP 10.0.2.15.44122 > 151.101.117.164.443: Flags [.], ack 93689, win 65535, length 0
19:57:48.682253 IP 151.101.117.164.443 > 10.0.2.15.44122: Flags [P.], seq 93689:96437, ack 869, win 65535, length 2748
19:57:48.682269 IP 10.0.2.15.44122 > 151.101.117.164.443: Flags [.], ack 96437, win 65535, length 0
19:57:48.683164 IP 151.101.117.164.443 > 10.0.2.15.44122: Flags [P.], seq 96437:99185, ack 869, win 65535, length 2748
19:57:48.683181 IP 10.0.2.15.44122 > 151.101.117.164.443: Flags [.], ack 99185, win 65535, length 0
19:57:48.684574 IP 151.101.117.164.443 > 10.0.2.15.44122: Flags [P.], seq 99185:101933, ack 869, win 65535, length 2748
19:57:48.684595 IP 10.0.2.15.44122 > 151.101.117.164.443: Flags [.], ack 101933, win 65535, length 0
19:57:48.685070 IP 151.101.117.164.443 > 10.0.2.15.44122: Flags [P.], seq 101933:106055, ack 869, win 65535, length 4122
19:57:48.685082 IP 10.0.2.15.44122 > 151.101.117.164.443: Flags [.], ack 106055, win 65535, length 0
19:57:48.686329 IP 151.101.117.164.443 > 10.0.2.15.44122: Flags [P.], seq 106055:107429, ack 869, win 65535, length 1374
19:57:48.687316 IP 151.101.117.164.443 > 10.0.2.15.44122: Flags [P.], seq 107429:111551, ack 869, win 65535, length 4122
19:57:48.687332 IP 10.0.2.15.44122 > 151.101.117.164.443: Flags [.], ack 111551, win 65535, length 0
19:57:48.688437 IP 151.101.117.164.443 > 10.0.2.15.44122: Flags [P.], seq 111551:112925, ack 869, win 65535, length 1374
19:57:48.689584 IP 151.101.117.164.443 > 10.0.2.15.44122: Flags [P.], seq 112925:118421, ack 869, win 65535, length 5496
19:57:48.689601 IP 10.0.2.15.44122 > 151.101.117.164.443: Flags [.], ack 118421, win 65535, length 0
19:57:48.690626 IP 151.101.117.164.443 > 10.0.2.15.44122: Flags [P.], seq 118421:121169, ack 869, win 65535, length 2748
19:57:48.690640 IP 10.0.2.15.44122 > 151.101.117.164.443: Flags [.], ack 121169, win 65535, length 0
19:57:48.691639 IP 151.101.117.164.443 > 10.0.2.15.44122: Flags [P.], seq 121169:123917, ack 869, win 65535, length 2748
19:57:48.691651 IP 10.0.2.15.44122 > 151.101.117.164.443: Flags [.], ack 123917, win 65535, length 0
19:57:48.692711 IP 151.101.117.164.443 > 10.0.2.15.44122: Flags [P.], seq 123917:129413, ack 869, win 65535, length 5496
19:57:48.692758 IP 10.0.2.15.44122 > 151.101.117.164.443: Flags [.], ack 129413, win 65535, length 0
19:57:48.693650 IP 151.101.117.164.443 > 10.0.2.15.44122: Flags [P.], seq 129413:132161, ack 869, win 65535, length 2748
19:57:48.693681 IP 10.0.2.15.44122 > 151.101.117.164.443: Flags [.], ack 132161, win 65535, length 0
19:57:48.694875 IP 151.101.117.164.443 > 10.0.2.15.44122: Flags [P.], seq 132161:139031, ack 869, win 65535, length 6870
19:57:48.694953 IP 10.0.2.15.44122 > 151.101.117.164.443: Flags [.], ack 139031, win 65535, length 0
19:57:48.695880 IP 151.101.117.164.443 > 10.0.2.15.44122: Flags [P.], seq 139031:140405, ack 869, win 65535, length 1374
19:57:48.697060 IP 151.101.117.164.443 > 10.0.2.15.44122: Flags [P.], seq 140405:145901, ack 869, win 65535, length 5496
19:57:48.697082 IP 10.0.2.15.44122 > 151.101.117.164.443: Flags [.], ack 145901, win 65535, length 0
19:57:48.698160 IP 151.101.117.164.443 > 10.0.2.15.44122: Flags [P.], seq 145901:148649, ack 869, win 65535, length 2748
19:57:48.698176 IP 10.0.2.15.44122 > 151.101.117.164.443: Flags [.], ack 148649, win 65535, length 0
19:57:48.699291 IP 151.101.117.164.443 > 10.0.2.15.44122: Flags [P.], seq 148649:154145, ack 869, win 65535, length 5496
19:57:48.699308 IP 10.0.2.15.44122 > 151.101.117.164.443: Flags [.], ack 154145, win 65535, length 0
19:57:48.699525 IP 151.101.117.164.443 > 10.0.2.15.44122: Flags [P.], seq 154145:156893, ack 869, win 65535, length 2748
19:57:48.699536 IP 10.0.2.15.44122 > 151.101.117.164.443: Flags [.], ack 156893, win 65535, length 0
19:57:48.700587 IP 151.101.117.164.443 > 10.0.2.15.44122: Flags [P.], seq 156893:161015, ack 869, win 65535, length 4122
19:57:48.700602 IP 10.0.2.15.44122 > 151.101.117.164.443: Flags [.], ack 161015, win 65535, length 0
19:57:48.701769 IP 151.101.117.164.443 > 10.0.2.15.44122: Flags [P.], seq 161015:165137, ack 869, win 65535, length 4122
19:57:48.701784 IP 10.0.2.15.44122 > 151.101.117.164.443: Flags [.], ack 165137, win 65535, length 0
19:57:48.702237 IP 151.101.117.164.443 > 10.0.2.15.44122: Flags [P.], seq 165137:169259, ack 869, win 65535, length 4122
19:57:48.702251 IP 10.0.2.15.44122 > 151.101.117.164.443: Flags [.], ack 169259, win 65535, length 0
19:57:48.703400 IP 151.101.117.164.443 > 10.0.2.15.44122: Flags [P.], seq 169259:174755, ack 869, win 65535, length 5496
19:57:48.703415 IP 10.0.2.15.44122 > 151.101.117.164.443: Flags [.], ack 174755, win 65535, length 0
19:57:48.704471 IP 151.101.117.164.443 > 10.0.2.15.44122: Flags [P.], seq 174755:180251, ack 869, win 65535, length 5496
19:57:48.704489 IP 10.0.2.15.44122 > 151.101.117.164.443: Flags [.], ack 180251, win 65535, length 0
19:57:48.704718 IP 151.101.117.164.443 > 10.0.2.15.44122: Flags [P.], seq 180251:181625, ack 869, win 65535, length 1374
19:57:48.705870 IP 151.101.117.164.443 > 10.0.2.15.44122: Flags [P.], seq 181625:185747, ack 869, win 65535, length 4122
19:57:48.705894 IP 10.0.2.15.44122 > 151.101.117.164.443: Flags [.], ack 185747, win 65535, length 0
19:57:48.706872 IP 151.101.117.164.443 > 10.0.2.15.44122: Flags [P.], seq 185747:189869, ack 869, win 65535, length 4122
19:57:48.706958 IP 10.0.2.15.44122 > 151.101.117.164.443: Flags [.], ack 189869, win 65535, length 0
19:57:48.707961 IP 151.101.117.164.443 > 10.0.2.15.44122: Flags [P.], seq 189869:195365, ack 869, win 65535, length 5496
19:57:48.707963 IP 151.101.117.164.443 > 10.0.2.15.44122: Flags [.], seq 195365:196825, ack 869, win 65535, length 1460
19:57:48.707978 IP 10.0.2.15.44122 > 151.101.117.164.443: Flags [.], ack 195365, win 65535, length 0
19:57:48.708351 IP 151.101.117.164.443 > 10.0.2.15.44122: Flags [P.], seq 196825:198113, ack 869, win 65535, length 1288
19:57:48.708364 IP 10.0.2.15.44122 > 151.101.117.164.443: Flags [.], ack 198113, win 65535, length 0
19:57:48.709005 IP 151.101.117.164.443 > 10.0.2.15.44122: Flags [P.], seq 198113:203609, ack 869, win 65535, length 5496
19:57:48.709018 IP 10.0.2.15.44122 > 151.101.117.164.443: Flags [.], ack 203609, win 65535, length 0
19:57:48.709934 IP 151.101.117.164.443 > 10.0.2.15.44122: Flags [P.], seq 203609:206357, ack 869, win 65535, length 2748
19:57:48.709945 IP 10.0.2.15.44122 > 151.101.117.164.443: Flags [.], ack 206357, win 65535, length 0
19:57:48.711095 IP 151.101.117.164.443 > 10.0.2.15.44122: Flags [P.], seq 206357:211853, ack 869, win 65535, length 5496
19:57:48.711112 IP 10.0.2.15.44122 > 151.101.117.164.443: Flags [.], ack 211853, win 65535, length 0
19:57:48.711657 IP 151.101.117.164.443 > 10.0.2.15.44122: Flags [P.], seq 211853:215975, ack 869, win 65535, length 4122
19:57:48.711666 IP 10.0.2.15.44122 > 151.101.117.164.443: Flags [.], ack 215975, win 65535, length 0
19:57:48.713110 IP 151.101.117.164.443 > 10.0.2.15.44122: Flags [P.], seq 215975:222845, ack 869, win 65535, length 6870
19:57:48.713126 IP 10.0.2.15.44122 > 151.101.117.164.443: Flags [.], ack 222845, win 65535, length 0
19:57:48.713694 IP 151.101.117.164.443 > 10.0.2.15.44122: Flags [P.], seq 222845:224219, ack 869, win 65535, length 1374
19:57:48.713695 IP 151.101.117.164.443 > 10.0.2.15.44122: Flags [P.], seq 224219:226967, ack 869, win 65535, length 2748
19:57:48.713709 IP 10.0.2.15.44122 > 151.101.117.164.443: Flags [.], ack 226967, win 65535, length 0
19:57:48.715803 IP 151.101.117.164.443 > 10.0.2.15.44122: Flags [P.], seq 226967:232463, ack 869, win 65535, length 5496
19:57:48.715806 IP 151.101.117.164.443 > 10.0.2.15.44122: Flags [P.], seq 232463:236585, ack 869, win 65535, length 4122
19:57:48.715824 IP 10.0.2.15.44122 > 151.101.117.164.443: Flags [.], ack 232463, win 65535, length 0
19:57:48.715854 IP 10.0.2.15.44122 > 151.101.117.164.443: Flags [.], ack 236585, win 65535, length 0
19:57:48.716940 IP 151.101.117.164.443 > 10.0.2.15.44122: Flags [P.], seq 236585:243455, ack 869, win 65535, length 6870
19:57:48.716957 IP 10.0.2.15.44122 > 151.101.117.164.443: Flags [.], ack 243455, win 65535, length 0
19:57:48.717860 IP 151.101.117.164.443 > 10.0.2.15.44122: Flags [P.], seq 243455:247577, ack 869, win 65535, length 4122
19:57:48.717873 IP 10.0.2.15.44122 > 151.101.117.164.443: Flags [.], ack 247577, win 65535, length 0
19:57:48.718881 IP 151.101.117.164.443 > 10.0.2.15.44122: Flags [P.], seq 247577:253073, ack 869, win 65535, length 5496
19:57:48.718896 IP 10.0.2.15.44122 > 151.101.117.164.443: Flags [.], ack 253073, win 65535, length 0
19:57:48.719056 IP 151.101.117.164.443 > 10.0.2.15.44122: Flags [P.], seq 253073:254447, ack 869, win 65535, length 1374
19:57:48.720296 IP 151.101.117.164.443 > 10.0.2.15.44122: Flags [P.], seq 254447:258569, ack 869, win 65535, length 4122
19:57:48.720313 IP 10.0.2.15.44122 > 151.101.117.164.443: Flags [.], ack 258569, win 65535, length 0
19:57:48.721291 IP 151.101.117.164.443 > 10.0.2.15.44122: Flags [P.], seq 258569:264065, ack 869, win 65535, length 5496
19:57:48.721307 IP 10.0.2.15.44122 > 151.101.117.164.443: Flags [.], ack 264065, win 65535, length 0
19:57:48.722402 IP 151.101.117.164.443 > 10.0.2.15.44122: Flags [P.], seq 264065:269561, ack 869, win 65535, length 5496
19:57:48.722404 IP 151.101.117.164.443 > 10.0.2.15.44122: Flags [P.], seq 269561:273683, ack 869, win 65535, length 4122
19:57:48.722420 IP 10.0.2.15.44122 > 151.101.117.164.443: Flags [.], ack 269561, win 65535, length 0
19:57:48.722449 IP 10.0.2.15.44122 > 151.101.117.164.443: Flags [.], ack 273683, win 65535, length 0
19:57:48.723658 IP 151.101.117.164.443 > 10.0.2.15.44122: Flags [P.], seq 273683:275057, ack 869, win 65535, length 1374
19:57:48.724648 IP 151.101.117.164.443 > 10.0.2.15.44122: Flags [P.], seq 275057:280553, ack 869, win 65535, length 5496
19:57:48.724661 IP 10.0.2.15.44122 > 151.101.117.164.443: Flags [.], ack 280553, win 65535, length 0
19:57:48.725761 IP 151.101.117.164.443 > 10.0.2.15.44122: Flags [P.], seq 280553:284675, ack 869, win 65535, length 4122
19:57:48.725774 IP 10.0.2.15.44122 > 151.101.117.164.443: Flags [.], ack 284675, win 65535, length 0
19:57:48.727007 IP 151.101.117.164.443 > 10.0.2.15.44122: Flags [P.], seq 284675:290171, ack 869, win 65535, length 5496
19:57:48.727009 IP 151.101.117.164.443 > 10.0.2.15.44122: Flags [P.], seq 290171:295667, ack 869, win 65535, length 5496
19:57:48.727027 IP 10.0.2.15.44122 > 151.101.117.164.443: Flags [.], ack 290171, win 65535, length 0
19:57:48.727062 IP 10.0.2.15.44122 > 151.101.117.164.443: Flags [.], ack 295667, win 65535, length 0
19:57:48.729039 IP 151.101.117.164.443 > 10.0.2.15.44122: Flags [P.], seq 295667:302537, ack 869, win 65535, length 6870
19:57:48.729041 IP 151.101.117.164.443 > 10.0.2.15.44122: Flags [P.], seq 302537:303911, ack 869, win 65535, length 1374
19:57:48.729059 IP 10.0.2.15.44122 > 151.101.117.164.443: Flags [.], ack 302537, win 65535, length 0
19:57:48.729335 IP 151.101.117.164.443 > 10.0.2.15.44122: Flags [P.], seq 303911:306659, ack 869, win 65535, length 2748
19:57:48.729344 IP 10.0.2.15.44122 > 151.101.117.164.443: Flags [.], ack 306659, win 65535, length 0
19:57:48.730074 IP 151.101.117.164.443 > 10.0.2.15.44122: Flags [P.], seq 306659:312155, ack 869, win 65535, length 5496
19:57:48.730086 IP 10.0.2.15.44122 > 151.101.117.164.443: Flags [.], ack 312155, win 65535, length 0
19:57:48.731370 IP 151.101.117.164.443 > 10.0.2.15.44122: Flags [P.], seq 312155:317651, ack 869, win 65535, length 5496
19:57:48.731387 IP 10.0.2.15.44122 > 151.101.117.164.443: Flags [.], ack 317651, win 65535, length 0
19:57:48.732151 IP 151.101.117.164.443 > 10.0.2.15.44122: Flags [P.], seq 317651:323147, ack 869, win 65535, length 5496
19:57:48.732153 IP 151.101.117.164.443 > 10.0.2.15.44122: Flags [P.], seq 323147:325895, ack 869, win 65535, length 2748
19:57:48.732154 IP 151.101.117.164.443 > 10.0.2.15.44122: Flags [P.], seq 325895:327269, ack 869, win 65535, length 1374
19:57:48.732172 IP 10.0.2.15.44122 > 151.101.117.164.443: Flags [.], ack 323147, win 65535, length 0
19:57:48.732309 IP 10.0.2.15.44122 > 151.101.117.164.443: Flags [.], ack 325895, win 65535, length 0
19:57:48.732486 IP 151.101.117.164.443 > 10.0.2.15.44122: Flags [P.], seq 327269:328643, ack 869, win 65535, length 1374
19:57:48.732495 IP 10.0.2.15.44122 > 151.101.117.164.443: Flags [.], ack 328643, win 65535, length 0
19:57:48.733548 IP 151.101.117.164.443 > 10.0.2.15.44122: Flags [P.], seq 328643:330017, ack 869, win 65535, length 1374
19:57:48.734333 IP 151.101.117.164.443 > 10.0.2.15.44122: Flags [P.], seq 330017:335513, ack 869, win 65535, length 5496
19:57:48.734346 IP 10.0.2.15.44122 > 151.101.117.164.443: Flags [.], ack 335513, win 65535, length 0
19:57:48.734470 IP 151.101.117.164.443 > 10.0.2.15.44122: Flags [P.], seq 335513:336887, ack 869, win 65535, length 1374
19:57:48.734627 IP 151.101.117.164.443 > 10.0.2.15.44122: Flags [P.], seq 336887:338261, ack 869, win 65535, length 1374
19:57:48.734634 IP 10.0.2.15.44122 > 151.101.117.164.443: Flags [.], ack 338261, win 65535, length 0
19:57:48.735560 IP 151.101.117.164.443 > 10.0.2.15.44122: Flags [P.], seq 338261:343757, ack 869, win 65535, length 5496
19:57:48.735577 IP 10.0.2.15.44122 > 151.101.117.164.443: Flags [.], ack 343757, win 65535, length 0
19:57:48.736611 IP 151.101.117.164.443 > 10.0.2.15.44122: Flags [P.], seq 343757:349253, ack 869, win 65535, length 5496
19:57:48.736624 IP 10.0.2.15.44122 > 151.101.117.164.443: Flags [.], ack 349253, win 65535, length 0
19:57:48.737632 IP 151.101.117.164.443 > 10.0.2.15.44122: Flags [P.], seq 349253:354749, ack 869, win 65535, length 5496
19:57:48.737707 IP 10.0.2.15.44122 > 151.101.117.164.443: Flags [.], ack 354749, win 65535, length 0
19:57:48.738662 IP 151.101.117.164.443 > 10.0.2.15.44122: Flags [P.], seq 354749:360245, ack 869, win 65535, length 5496
19:57:48.738676 IP 10.0.2.15.44122 > 151.101.117.164.443: Flags [.], ack 360245, win 65535, length 0
19:57:48.739732 IP 151.101.117.164.443 > 10.0.2.15.44122: Flags [P.], seq 360245:365741, ack 869, win 65535, length 5496
19:57:48.739744 IP 10.0.2.15.44122 > 151.101.117.164.443: Flags [.], ack 365741, win 65535, length 0
19:57:48.740729 IP 151.101.117.164.443 > 10.0.2.15.44122: Flags [P.], seq 365741:371237, ack 869, win 65535, length 5496
19:57:48.740740 IP 10.0.2.15.44122 > 151.101.117.164.443: Flags [.], ack 371237, win 65535, length 0
19:57:48.741706 IP 151.101.117.164.443 > 10.0.2.15.44122: Flags [P.], seq 371237:378107, ack 869, win 65535, length 6870
19:57:48.741717 IP 10.0.2.15.44122 > 151.101.117.164.443: Flags [.], ack 378107, win 65535, length 0
19:57:48.742893 IP 151.101.117.164.443 > 10.0.2.15.44122: Flags [P.], seq 378107:382229, ack 869, win 65535, length 4122
19:57:48.742902 IP 10.0.2.15.44122 > 151.101.117.164.443: Flags [.], ack 382229, win 65535, length 0
19:57:48.743882 IP 151.101.117.164.443 > 10.0.2.15.44122: Flags [P.], seq 382229:389099, ack 869, win 65535, length 6870
19:57:48.743897 IP 10.0.2.15.44122 > 151.101.117.164.443: Flags [.], ack 389099, win 65535, length 0
19:57:48.745017 IP 151.101.117.164.443 > 10.0.2.15.44122: Flags [P.], seq 389099:393221, ack 869, win 65535, length 4122
19:57:48.745030 IP 10.0.2.15.44122 > 151.101.117.164.443: Flags [.], ack 393221, win 65535, length 0
19:57:48.746091 IP 151.101.117.164.443 > 10.0.2.15.44122: Flags [P.], seq 393221:400091, ack 869, win 65535, length 6870
19:57:48.746101 IP 10.0.2.15.44122 > 151.101.117.164.443: Flags [.], ack 400091, win 65535, length 0
19:57:48.746532 IP 151.101.117.164.443 > 10.0.2.15.44122: Flags [P.], seq 400091:401465, ack 869, win 65535, length 1374
19:57:48.747111 IP 151.101.117.164.443 > 10.0.2.15.44122: Flags [P.], seq 401465:404213, ack 869, win 65535, length 2748
19:57:48.747122 IP 10.0.2.15.44122 > 151.101.117.164.443: Flags [.], ack 404213, win 65535, length 0
19:57:48.748888 IP 151.101.117.164.443 > 10.0.2.15.44122: Flags [P.], seq 404213:413831, ack 869, win 65535, length 9618
19:57:48.748890 IP 151.101.117.164.443 > 10.0.2.15.44122: Flags [P.], seq 413831:415205, ack 869, win 65535, length 1374
19:57:48.748952 IP 10.0.2.15.44122 > 151.101.117.164.443: Flags [.], ack 413831, win 65535, length 0
19:57:48.748992 IP 151.101.117.164.443 > 10.0.2.15.44122: Flags [P.], seq 415205:417953, ack 869, win 65535, length 2748
19:57:48.748999 IP 10.0.2.15.44122 > 151.101.117.164.443: Flags [.], ack 417953, win 65535, length 0
19:57:48.749089 IP 151.101.117.164.443 > 10.0.2.15.44122: Flags [P.], seq 417953:419327, ack 869, win 65535, length 1374
19:57:48.749906 IP 151.101.117.164.443 > 10.0.2.15.44122: Flags [P.], seq 419327:426197, ack 869, win 65535, length 6870
19:57:48.749918 IP 10.0.2.15.44122 > 151.101.117.164.443: Flags [.], ack 426197, win 65535, length 0
19:57:48.751094 IP 151.101.117.164.443 > 10.0.2.15.44122: Flags [P.], seq 426197:433067, ack 869, win 65535, length 6870
19:57:48.751112 IP 10.0.2.15.44122 > 151.101.117.164.443: Flags [.], ack 433067, win 65535, length 0
19:57:48.752237 IP 151.101.117.164.443 > 10.0.2.15.44122: Flags [P.], seq 433067:439937, ack 869, win 65535, length 6870
19:57:48.752259 IP 10.0.2.15.44122 > 151.101.117.164.443: Flags [.], ack 439937, win 65535, length 0
19:57:48.753372 IP 151.101.117.164.443 > 10.0.2.15.44122: Flags [P.], seq 439937:446807, ack 869, win 65535, length 6870
19:57:48.753389 IP 10.0.2.15.44122 > 151.101.117.164.443: Flags [.], ack 446807, win 65535, length 0
19:57:48.754693 IP 151.101.117.164.443 > 10.0.2.15.44122: Flags [P.], seq 446807:452303, ack 869, win 65535, length 5496
19:57:48.754708 IP 10.0.2.15.44122 > 151.101.117.164.443: Flags [.], ack 452303, win 65535, length 0
19:57:48.758153 IP 151.101.117.164.443 > 10.0.2.15.44122: Flags [P.], seq 452303:460547, ack 869, win 65535, length 8244
19:57:48.758180 IP 10.0.2.15.44122 > 151.101.117.164.443: Flags [.], ack 460547, win 65535, length 0
19:57:48.759405 IP 151.101.117.164.443 > 10.0.2.15.44122: Flags [P.], seq 460547:472913, ack 869, win 65535, length 12366
19:57:48.759685 IP 10.0.2.15.44122 > 151.101.117.164.443: Flags [.], ack 472913, win 65535, length 0
19:57:48.760245 IP 151.101.117.164.443 > 10.0.2.15.44122: Flags [P.], seq 472913:474287, ack 869, win 65535, length 1374
19:57:48.760248 IP 151.101.117.164.443 > 10.0.2.15.44122: Flags [P.], seq 474287:481157, ack 869, win 65535, length 6870
19:57:48.760275 IP 10.0.2.15.44122 > 151.101.117.164.443: Flags [.], ack 481157, win 65535, length 0
19:57:48.760421 IP 151.101.117.164.443 > 10.0.2.15.44122: Flags [P.], seq 481157:482531, ack 869, win 65535, length 1374
19:57:48.761580 IP 151.101.117.164.443 > 10.0.2.15.44122: Flags [P.], seq 482531:485279, ack 869, win 65535, length 2748
19:57:48.761582 IP 151.101.117.164.443 > 10.0.2.15.44122: Flags [.], seq 485279:491119, ack 869, win 65535, length 5840
19:57:48.761602 IP 10.0.2.15.44122 > 151.101.117.164.443: Flags [.], ack 485279, win 65535, length 0
19:57:48.761676 IP 10.0.2.15.44122 > 151.101.117.164.443: Flags [.], ack 491119, win 65535, length 0
19:57:48.761808 IP 151.101.117.164.443 > 10.0.2.15.44122: Flags [P.], seq 491119:492149, ack 869, win 65535, length 1030
19:57:48.763290 IP 151.101.117.164.443 > 10.0.2.15.44122: Flags [P.], seq 492149:499019, ack 869, win 65535, length 6870
19:57:48.763312 IP 10.0.2.15.44122 > 151.101.117.164.443: Flags [.], ack 499019, win 65535, length 0
19:57:48.763437 IP 151.101.117.164.443 > 10.0.2.15.44122: Flags [P.], seq 499019:503141, ack 869, win 65535, length 4122
19:57:48.763438 IP 151.101.117.164.443 > 10.0.2.15.44122: Flags [P.], seq 503141:507263, ack 869, win 65535, length 4122
19:57:48.763449 IP 10.0.2.15.44122 > 151.101.117.164.443: Flags [.], ack 503141, win 65535, length 0
19:57:48.763464 IP 10.0.2.15.44122 > 151.101.117.164.443: Flags [.], ack 507263, win 65535, length 0
19:57:48.764210 IP 151.101.117.164.443 > 10.0.2.15.44122: Flags [P.], seq 507263:512759, ack 869, win 65535, length 5496
19:57:48.764226 IP 10.0.2.15.44122 > 151.101.117.164.443: Flags [.], ack 512759, win 65535, length 0
19:57:48.765067 IP 151.101.117.164.443 > 10.0.2.15.44122: Flags [P.], seq 512759:519629, ack 869, win 65535, length 6870
19:57:48.765081 IP 10.0.2.15.44122 > 151.101.117.164.443: Flags [.], ack 519629, win 65535, length 0
19:57:48.765980 IP 151.101.117.164.443 > 10.0.2.15.44122: Flags [P.], seq 519629:526499, ack 869, win 65535, length 6870
19:57:48.765995 IP 10.0.2.15.44122 > 151.101.117.164.443: Flags [.], ack 526499, win 65535, length 0
19:57:48.767569 IP 151.101.117.164.443 > 10.0.2.15.44122: Flags [P.], seq 526499:527873, ack 869, win 65535, length 1374
19:57:48.769005 IP 151.101.117.164.443 > 10.0.2.15.44122: Flags [P.], seq 527873:531995, ack 869, win 65535, length 4122
19:57:48.769008 IP 151.101.117.164.443 > 10.0.2.15.44122: Flags [.], seq 531995:536375, ack 869, win 65535, length 4380
19:57:48.769285 IP 10.0.2.15.44122 > 151.101.117.164.443: Flags [.], ack 531995, win 65535, length 0
19:57:48.769527 IP 10.0.2.15.44122 > 151.101.117.164.443: Flags [.], ack 536375, win 65535, length 0
19:57:48.769824 IP 151.101.117.164.443 > 10.0.2.15.44122: Flags [P.], seq 536375:538865, ack 869, win 65535, length 2490
19:57:48.769825 IP 151.101.117.164.443 > 10.0.2.15.44122: Flags [P.], seq 538865:540239, ack 869, win 65535, length 1374
19:57:48.769836 IP 10.0.2.15.44122 > 151.101.117.164.443: Flags [.], ack 538865, win 65535, length 0
19:57:48.770925 IP 151.101.117.164.443 > 10.0.2.15.44122: Flags [P.], seq 540239:545735, ack 869, win 65535, length 5496
19:57:48.770939 IP 10.0.2.15.44122 > 151.101.117.164.443: Flags [.], ack 545735, win 65535, length 0
19:57:48.771180 IP 151.101.117.164.443 > 10.0.2.15.44122: Flags [P.], seq 545735:548483, ack 869, win 65535, length 2748
19:57:48.771182 IP 151.101.117.164.443 > 10.0.2.15.44122: Flags [P.], seq 548483:552605, ack 869, win 65535, length 4122
19:57:48.771201 IP 10.0.2.15.44122 > 151.101.117.164.443: Flags [.], ack 548483, win 65535, length 0
19:57:48.771221 IP 10.0.2.15.44122 > 151.101.117.164.443: Flags [.], ack 552605, win 65535, length 0
19:57:48.772419 IP 151.101.117.164.443 > 10.0.2.15.44122: Flags [P.], seq 552605:559475, ack 869, win 65535, length 6870
19:57:48.772439 IP 10.0.2.15.44122 > 151.101.117.164.443: Flags [.], ack 559475, win 65535, length 0
19:57:48.774463 IP 151.101.117.164.443 > 10.0.2.15.44122: Flags [P.], seq 559475:567719, ack 869, win 65535, length 8244
19:57:48.774485 IP 10.0.2.15.44122 > 151.101.117.164.443: Flags [.], ack 567719, win 65535, length 0
19:57:48.774663 IP 151.101.117.164.443 > 10.0.2.15.44122: Flags [P.], seq 567719:571841, ack 869, win 65535, length 4122
19:57:48.774670 IP 10.0.2.15.44122 > 151.101.117.164.443: Flags [.], ack 571841, win 65535, length 0
19:57:48.776326 IP 151.101.117.164.443 > 10.0.2.15.44122: Flags [P.], seq 571841:574589, ack 869, win 65535, length 2748
19:57:48.776343 IP 10.0.2.15.44122 > 151.101.117.164.443: Flags [.], ack 574589, win 65535, length 0
19:57:48.777105 IP 151.101.117.164.443 > 10.0.2.15.44122: Flags [P.], seq 574589:581459, ack 869, win 65535, length 6870
19:57:48.777106 IP 151.101.117.164.443 > 10.0.2.15.44122: Flags [P.], seq 581459:582833, ack 869, win 65535, length 1374
19:57:48.777121 IP 10.0.2.15.44122 > 151.101.117.164.443: Flags [.], ack 581459, win 65535, length 0
19:57:48.779341 IP 151.101.117.164.443 > 10.0.2.15.44122: Flags [P.], seq 582833:596573, ack 869, win 65535, length 13740
19:57:48.779361 IP 10.0.2.15.44122 > 151.101.117.164.443: Flags [.], ack 596573, win 65535, length 0
19:57:48.779460 IP 151.101.117.164.443 > 10.0.2.15.44122: Flags [P.], seq 596573:603443, ack 869, win 65535, length 6870
19:57:48.779461 IP 151.101.117.164.443 > 10.0.2.15.44122: Flags [P.], seq 603443:604817, ack 869, win 65535, length 1374
19:57:48.779474 IP 10.0.2.15.44122 > 151.101.117.164.443: Flags [.], ack 603443, win 65535, length 0
19:57:48.781289 IP 151.101.117.164.443 > 10.0.2.15.44122: Flags [P.], seq 604817:611687, ack 869, win 65535, length 6870
19:57:48.781309 IP 10.0.2.15.44122 > 151.101.117.164.443: Flags [.], ack 611687, win 65535, length 0
19:57:48.782630 IP 151.101.117.164.443 > 10.0.2.15.44122: Flags [P.], seq 611687:618557, ack 869, win 65535, length 6870
19:57:48.782653 IP 10.0.2.15.44122 > 151.101.117.164.443: Flags [.], ack 618557, win 65535, length 0
19:57:48.783140 IP 151.101.117.164.443 > 10.0.2.15.44122: Flags [P.], seq 618557:624053, ack 869, win 65535, length 5496
19:57:48.783141 IP 151.101.117.164.443 > 10.0.2.15.44122: Flags [P.], seq 624053:625427, ack 869, win 65535, length 1374
19:57:48.783153 IP 10.0.2.15.44122 > 151.101.117.164.443: Flags [.], ack 624053, win 65535, length 0
19:57:48.784585 IP 151.101.117.164.443 > 10.0.2.15.44122: Flags [P.], seq 625427:630923, ack 869, win 65535, length 5496
19:57:48.784605 IP 10.0.2.15.44122 > 151.101.117.164.443: Flags [.], ack 630923, win 65535, length 0
19:57:48.786294 IP 151.101.117.164.443 > 10.0.2.15.44122: Flags [P.], seq 630923:639167, ack 869, win 65535, length 8244
19:57:48.786319 IP 10.0.2.15.44122 > 151.101.117.164.443: Flags [.], ack 639167, win 65535, length 0
19:57:48.786906 IP 151.101.117.164.443 > 10.0.2.15.44122: Flags [P.], seq 639167:646037, ack 869, win 65535, length 6870
19:57:48.786921 IP 10.0.2.15.44122 > 151.101.117.164.443: Flags [.], ack 646037, win 65535, length 0
19:57:48.788164 IP 151.101.117.164.443 > 10.0.2.15.44122: Flags [P.], seq 646037:648785, ack 869, win 65535, length 2748
19:57:48.788188 IP 10.0.2.15.44122 > 151.101.117.164.443: Flags [.], ack 648785, win 65535, length 0
19:57:48.789414 IP 151.101.117.164.443 > 10.0.2.15.44122: Flags [P.], seq 648785:658403, ack 869, win 65535, length 9618
19:57:48.789416 IP 151.101.117.164.443 > 10.0.2.15.44122: Flags [P.], seq 658403:661151, ack 869, win 65535, length 2748
19:57:48.789432 IP 10.0.2.15.44122 > 151.101.117.164.443: Flags [.], ack 658403, win 65535, length 0
19:57:48.789466 IP 10.0.2.15.44122 > 151.101.117.164.443: Flags [.], ack 661151, win 65535, length 0
19:57:48.791402 IP 151.101.117.164.443 > 10.0.2.15.44122: Flags [P.], seq 661151:662525, ack 869, win 65535, length 1374
19:57:48.791558 IP 151.101.117.164.443 > 10.0.2.15.44122: Flags [P.], seq 662525:668021, ack 869, win 65535, length 5496
19:57:48.791560 IP 151.101.117.164.443 > 10.0.2.15.44122: Flags [P.], seq 668021:670769, ack 869, win 65535, length 2748
19:57:48.791575 IP 10.0.2.15.44122 > 151.101.117.164.443: Flags [.], ack 668021, win 65535, length 0
19:57:48.791596 IP 10.0.2.15.44122 > 151.101.117.164.443: Flags [.], ack 670769, win 65535, length 0
19:57:48.791680 IP 151.101.117.164.443 > 10.0.2.15.44122: Flags [P.], seq 670769:672143, ack 869, win 65535, length 1374
19:57:48.792703 IP 151.101.117.164.443 > 10.0.2.15.44122: Flags [P.], seq 672143:674891, ack 869, win 65535, length 2748
19:57:48.792720 IP 10.0.2.15.44122 > 151.101.117.164.443: Flags [.], ack 674891, win 65535, length 0
19:57:48.793067 IP 151.101.117.164.443 > 10.0.2.15.44122: Flags [P.], seq 674891:679013, ack 869, win 65535, length 4122
19:57:48.793106 IP 10.0.2.15.44122 > 151.101.117.164.443: Flags [.], ack 679013, win 65535, length 0
19:57:48.795782 IP 151.101.117.164.443 > 10.0.2.15.44122: Flags [P.], seq 679013:688631, ack 869, win 65535, length 9618
19:57:48.795785 IP 151.101.117.164.443 > 10.0.2.15.44122: Flags [P.], seq 688631:692753, ack 869, win 65535, length 4122
19:57:48.795833 IP 151.101.117.164.443 > 10.0.2.15.44122: Flags [P.], seq 692753:696875, ack 869, win 65535, length 4122
19:57:48.795983 IP 10.0.2.15.44122 > 151.101.117.164.443: Flags [.], ack 696875, win 65535, length 0
19:57:48.797088 IP 151.101.117.164.443 > 10.0.2.15.44122: Flags [P.], seq 696875:703745, ack 869, win 65535, length 6870
19:57:48.797090 IP 151.101.117.164.443 > 10.0.2.15.44122: Flags [P.], seq 703745:705119, ack 869, win 65535, length 1374
19:57:48.797110 IP 10.0.2.15.44122 > 151.101.117.164.443: Flags [.], ack 703745, win 65535, length 0
19:57:48.797236 IP 151.101.117.164.443 > 10.0.2.15.44122: Flags [P.], seq 705119:707867, ack 869, win 65535, length 2748
19:57:48.797237 IP 151.101.117.164.443 > 10.0.2.15.44122: Flags [P.], seq 707867:710615, ack 869, win 65535, length 2748
19:57:48.797291 IP 10.0.2.15.44122 > 151.101.117.164.443: Flags [.], ack 710615, win 65535, length 0
19:57:48.797682 IP 151.101.117.164.443 > 10.0.2.15.44122: Flags [P.], seq 710615:717485, ack 869, win 65535, length 6870
19:57:48.797739 IP 10.0.2.15.44122 > 151.101.117.164.443: Flags [.], ack 717485, win 65535, length 0
19:57:48.797838 IP 151.101.117.164.443 > 10.0.2.15.44122: Flags [P.], seq 717485:720233, ack 869, win 65535, length 2748
19:57:48.797894 IP 10.0.2.15.44122 > 151.101.117.164.443: Flags [.], ack 720233, win 65535, length 0
19:57:48.798963 IP 151.101.117.164.443 > 10.0.2.15.44122: Flags [P.], seq 720233:725729, ack 869, win 65535, length 5496
19:57:48.798965 IP 151.101.117.164.443 > 10.0.2.15.44122: Flags [P.], seq 725729:728477, ack 869, win 65535, length 2748
19:57:48.798982 IP 10.0.2.15.44122 > 151.101.117.164.443: Flags [.], ack 725729, win 65535, length 0
19:57:48.799304 IP 10.0.2.15.44122 > 151.101.117.164.443: Flags [.], ack 728477, win 65535, length 0
19:57:48.799661 IP 151.101.117.164.443 > 10.0.2.15.44122: Flags [P.], seq 728477:729851, ack 869, win 65535, length 1374
19:57:48.801672 IP 151.101.117.164.443 > 10.0.2.15.44122: Flags [P.], seq 729851:740843, ack 869, win 65535, length 10992
19:57:48.801770 IP 10.0.2.15.44122 > 151.101.117.164.443: Flags [.], ack 740843, win 65535, length 0
19:57:48.802411 IP 151.101.117.164.443 > 10.0.2.15.44122: Flags [P.], seq 740843:746339, ack 869, win 65535, length 5496
19:57:48.803104 IP 10.0.2.15.44122 > 151.101.117.164.443: Flags [.], ack 746339, win 65535, length 0
19:57:48.804343 IP 151.101.117.164.443 > 10.0.2.15.44122: Flags [P.], seq 746339:754583, ack 869, win 65535, length 8244
19:57:48.804879 IP 10.0.2.15.44122 > 151.101.117.164.443: Flags [.], ack 754583, win 65535, length 0
19:57:48.805180 IP 151.101.117.164.443 > 10.0.2.15.44122: Flags [P.], seq 754583:760079, ack 869, win 65535, length 5496
19:57:48.805191 IP 10.0.2.15.44122 > 151.101.117.164.443: Flags [.], ack 760079, win 65535, length 0
19:57:48.806764 IP 151.101.117.164.443 > 10.0.2.15.44122: Flags [P.], seq 760079:765575, ack 869, win 65535, length 5496
19:57:48.806785 IP 10.0.2.15.44122 > 151.101.117.164.443: Flags [.], ack 765575, win 65535, length 0
19:57:48.808425 IP 151.101.117.164.443 > 10.0.2.15.44122: Flags [P.], seq 765575:776567, ack 869, win 65535, length 10992
19:57:48.808632 IP 10.0.2.15.44122 > 151.101.117.164.443: Flags [.], ack 776567, win 65535, length 0
19:57:48.808994 IP 151.101.117.164.443 > 10.0.2.15.44122: Flags [P.], seq 776567:783437, ack 869, win 65535, length 6870
19:57:48.808996 IP 151.101.117.164.443 > 10.0.2.15.44122: Flags [P.], seq 783437:784811, ack 869, win 65535, length 1374
19:57:48.809059 IP 10.0.2.15.44122 > 151.101.117.164.443: Flags [.], ack 784811, win 65535, length 0
19:57:48.810928 IP 151.101.117.164.443 > 10.0.2.15.44122: Flags [P.], seq 784811:790307, ack 869, win 65535, length 5496
19:57:48.810947 IP 10.0.2.15.44122 > 151.101.117.164.443: Flags [.], ack 790307, win 65535, length 0
19:57:48.812455 IP 151.101.117.164.443 > 10.0.2.15.44122: Flags [P.], seq 790307:799925, ack 869, win 65535, length 9618
19:57:48.812545 IP 10.0.2.15.44122 > 151.101.117.164.443: Flags [.], ack 799925, win 65535, length 0
19:57:48.813155 IP 151.101.117.164.443 > 10.0.2.15.44122: Flags [P.], seq 799925:806795, ack 869, win 65535, length 6870
19:57:48.813170 IP 10.0.2.15.44122 > 151.101.117.164.443: Flags [.], ack 806795, win 65535, length 0
19:57:48.815008 IP 151.101.117.164.443 > 10.0.2.15.44122: Flags [P.], seq 806795:815039, ack 869, win 65535, length 8244
19:57:48.815010 IP 151.101.117.164.443 > 10.0.2.15.44122: Flags [P.], seq 815039:819161, ack 869, win 65535, length 4122
19:57:48.815029 IP 10.0.2.15.44122 > 151.101.117.164.443: Flags [.], ack 815039, win 65535, length 0
19:57:48.815149 IP 10.0.2.15.44122 > 151.101.117.164.443: Flags [.], ack 819161, win 65535, length 0
19:57:48.815443 IP 151.101.117.164.443 > 10.0.2.15.44122: Flags [P.], seq 819161:826031, ack 869, win 65535, length 6870
19:57:48.815512 IP 10.0.2.15.44122 > 151.101.117.164.443: Flags [.], ack 826031, win 65535, length 0
19:57:48.816845 IP 151.101.117.164.443 > 10.0.2.15.44122: Flags [P.], seq 826031:832901, ack 869, win 65535, length 6870
19:57:48.816956 IP 10.0.2.15.44122 > 151.101.117.164.443: Flags [.], ack 832901, win 65535, length 0
19:57:48.817144 IP 151.101.117.164.443 > 10.0.2.15.44122: Flags [P.], seq 832901:839771, ack 869, win 65535, length 6870
19:57:48.817197 IP 10.0.2.15.44122 > 151.101.117.164.443: Flags [.], ack 839771, win 65535, length 0
19:57:48.819181 IP 151.101.117.164.443 > 10.0.2.15.44122: Flags [P.], seq 839771:849389, ack 869, win 65535, length 9618
19:57:48.819184 IP 151.101.117.164.443 > 10.0.2.15.44122: Flags [P.], seq 849389:852137, ack 869, win 65535, length 2748
19:57:48.819204 IP 10.0.2.15.44122 > 151.101.117.164.443: Flags [.], ack 849389, win 65535, length 0
19:57:48.819308 IP 10.0.2.15.44122 > 151.101.117.164.443: Flags [.], ack 852137, win 65535, length 0
19:57:48.822661 IP 151.101.117.164.443 > 10.0.2.15.44122: Flags [P.], seq 852137:863129, ack 869, win 65535, length 10992
19:57:48.822680 IP 10.0.2.15.44122 > 151.101.117.164.443: Flags [.], ack 863129, win 65535, length 0
19:57:48.822723 IP 151.101.117.164.443 > 10.0.2.15.44122: Flags [P.], seq 863129:864503, ack 869, win 65535, length 1374
19:57:48.822726 IP 151.101.117.164.443 > 10.0.2.15.44122: Flags [P.], seq 864503:868625, ack 869, win 65535, length 4122
19:57:48.822727 IP 151.101.117.164.443 > 10.0.2.15.44122: Flags [P.], seq 868625:871373, ack 869, win 65535, length 2748
19:57:48.822906 IP 10.0.2.15.44122 > 151.101.117.164.443: Flags [.], ack 871373, win 65535, length 0
19:57:48.823627 IP 151.101.117.164.443 > 10.0.2.15.44122: Flags [P.], seq 871373:876869, ack 869, win 65535, length 5496
19:57:48.823638 IP 10.0.2.15.44122 > 151.101.117.164.443: Flags [.], ack 876869, win 65535, length 0
19:57:48.824900 IP 151.101.117.164.443 > 10.0.2.15.44122: Flags [P.], seq 876869:882365, ack 869, win 65535, length 5496
19:57:48.824920 IP 10.0.2.15.44122 > 151.101.117.164.443: Flags [.], ack 882365, win 65535, length 0
19:57:48.825206 IP 151.101.117.164.443 > 10.0.2.15.44122: Flags [.], seq 882365:885285, ack 869, win 65535, length 2920
19:57:48.825353 IP 151.101.117.164.443 > 10.0.2.15.44122: Flags [P.], seq 885285:886487, ack 869, win 65535, length 1202
19:57:48.825355 IP 151.101.117.164.443 > 10.0.2.15.44122: Flags [P.], seq 886487:889235, ack 869, win 65535, length 2748
19:57:48.825478 IP 151.101.117.164.443 > 10.0.2.15.44122: Flags [P.], seq 889235:890609, ack 869, win 65535, length 1374
19:57:48.825494 IP 10.0.2.15.44122 > 151.101.117.164.443: Flags [.], ack 889235, win 65535, length 0
19:57:48.827067 IP 151.101.117.164.443 > 10.0.2.15.44122: Flags [P.], seq 890609:898853, ack 869, win 65535, length 8244
19:57:48.827251 IP 10.0.2.15.44122 > 151.101.117.164.443: Flags [.], ack 898853, win 65535, length 0
19:57:48.827936 IP 151.101.117.164.443 > 10.0.2.15.44122: Flags [P.], seq 898853:902975, ack 869, win 65535, length 4122
19:57:48.827956 IP 10.0.2.15.44122 > 151.101.117.164.443: Flags [.], ack 902975, win 65535, length 0
19:57:48.828683 IP 151.101.117.164.443 > 10.0.2.15.44122: Flags [P.], seq 902975:909845, ack 869, win 65535, length 6870
19:57:48.828685 IP 151.101.117.164.443 > 10.0.2.15.44122: Flags [P.], seq 909845:911219, ack 869, win 65535, length 1374
19:57:48.828887 IP 10.0.2.15.44122 > 151.101.117.164.443: Flags [.], ack 911219, win 65535, length 0
19:57:48.830273 IP 151.101.117.164.443 > 10.0.2.15.44122: Flags [P.], seq 911219:919463, ack 869, win 65535, length 8244
19:57:48.830294 IP 10.0.2.15.44122 > 151.101.117.164.443: Flags [.], ack 919463, win 65535, length 0
19:57:48.830495 IP 151.101.117.164.443 > 10.0.2.15.44122: Flags [P.], seq 919463:926333, ack 869, win 65535, length 6870
19:57:48.830615 IP 151.101.117.164.443 > 10.0.2.15.44122: Flags [P.], seq 926333:929081, ack 869, win 65535, length 2748
19:57:48.830637 IP 10.0.2.15.44122 > 151.101.117.164.443: Flags [.], ack 929081, win 65535, length 0
19:57:48.832088 IP 151.101.117.164.443 > 10.0.2.15.44122: Flags [P.], seq 929081:933203, ack 869, win 65535, length 4122
19:57:48.832091 IP 151.101.117.164.443 > 10.0.2.15.44122: Flags [.], seq 933203:934663, ack 869, win 65535, length 1460
19:57:48.832114 IP 10.0.2.15.44122 > 151.101.117.164.443: Flags [.], ack 933203, win 65535, length 0
19:57:48.832232 IP 151.101.117.164.443 > 10.0.2.15.44122: Flags [P.], seq 934663:937325, ack 869, win 65535, length 2662
19:57:48.832284 IP 10.0.2.15.44122 > 151.101.117.164.443: Flags [.], ack 937325, win 65535, length 0
19:57:48.834563 IP 151.101.117.164.443 > 10.0.2.15.44122: Flags [P.], seq 937325:946943, ack 869, win 65535, length 9618
19:57:48.834567 IP 151.101.117.164.443 > 10.0.2.15.44122: Flags [P.], seq 946943:952439, ack 869, win 65535, length 5496
19:57:48.834763 IP 151.101.117.164.443 > 10.0.2.15.44122: Flags [P.], seq 952439:953813, ack 869, win 65535, length 1374
19:57:48.834796 IP 10.0.2.15.44122 > 151.101.117.164.443: Flags [.], ack 953813, win 65535, length 0
19:57:48.835463 IP 151.101.117.164.443 > 10.0.2.15.44122: Flags [P.], seq 953813:957935, ack 869, win 65535, length 4122
19:57:48.835477 IP 10.0.2.15.44122 > 151.101.117.164.443: Flags [.], ack 957935, win 65535, length 0
19:57:48.835621 IP 151.101.117.164.443 > 10.0.2.15.44122: Flags [P.], seq 957935:960683, ack 869, win 65535, length 2748
19:57:48.835627 IP 10.0.2.15.44122 > 151.101.117.164.443: Flags [.], ack 960683, win 65535, length 0
19:57:48.837095 IP 151.101.117.164.443 > 10.0.2.15.44122: Flags [P.], seq 960683:966179, ack 869, win 65535, length 5496
19:57:48.837098 IP 151.101.117.164.443 > 10.0.2.15.44122: Flags [P.], seq 966179:968927, ack 869, win 65535, length 2748
19:57:48.837098 IP 151.101.117.164.443 > 10.0.2.15.44122: Flags [P.], seq 968927:971675, ack 869, win 65535, length 2748
19:57:48.837178 IP 151.101.117.164.443 > 10.0.2.15.44122: Flags [P.], seq 971675:973049, ack 869, win 65535, length 1374
19:57:48.837477 IP 151.101.117.164.443 > 10.0.2.15.44122: Flags [P.], seq 973049:977171, ack 869, win 65535, length 4122
19:57:48.837572 IP 10.0.2.15.44122 > 151.101.117.164.443: Flags [.], ack 977171, win 65535, length 0
19:57:48.839213 IP 151.101.117.164.443 > 10.0.2.15.44122: Flags [P.], seq 977171:986789, ack 869, win 65535, length 9618
19:57:48.839236 IP 10.0.2.15.44122 > 151.101.117.164.443: Flags [.], ack 986789, win 65535, length 0
19:57:48.839688 IP 151.101.117.164.443 > 10.0.2.15.44122: Flags [P.], seq 986789:992285, ack 869, win 65535, length 5496
19:57:48.839698 IP 10.0.2.15.44122 > 151.101.117.164.443: Flags [.], ack 992285, win 65535, length 0
19:57:48.840533 IP 151.101.117.164.443 > 10.0.2.15.44122: Flags [P.], seq 992285:997781, ack 869, win 65535, length 5496
19:57:48.840547 IP 10.0.2.15.44122 > 151.101.117.164.443: Flags [.], ack 997781, win 65535, length 0
19:57:48.840785 IP 151.101.117.164.443 > 10.0.2.15.44122: Flags [P.], seq 997781:1000529, ack 869, win 65535, length 2748
19:57:48.841278 IP 10.0.2.15.44122 > 151.101.117.164.443: Flags [.], ack 1000529, win 65535, length 0
19:57:48.842252 IP 151.101.117.164.443 > 10.0.2.15.44122: Flags [P.], seq 1000529:1006025, ack 869, win 65535, length 5496
19:57:48.842361 IP 10.0.2.15.44122 > 151.101.117.164.443: Flags [.], ack 1006025, win 65535, length 0
19:57:48.842484 IP 151.101.117.164.443 > 10.0.2.15.44122: Flags [P.], seq 1006025:1011521, ack 869, win 65535, length 5496
19:57:48.842485 IP 151.101.117.164.443 > 10.0.2.15.44122: Flags [P.], seq 1011521:1012895, ack 869, win 65535, length 1374
19:57:48.842532 IP 10.0.2.15.44122 > 151.101.117.164.443: Flags [.], ack 1012895, win 65535, length 0
19:57:48.842774 IP 151.101.117.164.443 > 10.0.2.15.44122: Flags [P.], seq 1012895:1017017, ack 869, win 65535, length 4122
19:57:48.842807 IP 10.0.2.15.44122 > 151.101.117.164.443: Flags [.], ack 1017017, win 65535, length 0
19:57:48.844434 IP 151.101.117.164.443 > 10.0.2.15.44122: Flags [P.], seq 1017017:1023887, ack 869, win 65535, length 6870
19:57:48.844435 IP 151.101.117.164.443 > 10.0.2.15.44122: Flags [P.], seq 1023887:1025261, ack 869, win 65535, length 1374
19:57:48.844855 IP 151.101.117.164.443 > 10.0.2.15.44122: Flags [P.], seq 1025261:1029383, ack 869, win 65535, length 4122
19:57:48.844857 IP 151.101.117.164.443 > 10.0.2.15.44122: Flags [P.], seq 1029383:1033505, ack 869, win 65535, length 4122
19:57:48.844921 IP 10.0.2.15.44122 > 151.101.117.164.443: Flags [.], ack 1033505, win 65535, length 0
19:57:48.846578 IP 151.101.117.164.443 > 10.0.2.15.44122: Flags [P.], seq 1033505:1034879, ack 869, win 65535, length 1374
19:57:48.847756 IP 151.101.117.164.443 > 10.0.2.15.44122: Flags [P.], seq 1034879:1040375, ack 869, win 65535, length 5496
19:57:48.847758 IP 151.101.117.164.443 > 10.0.2.15.44122: Flags [P.], seq 1040375:1041749, ack 869, win 65535, length 1374
19:57:48.847778 IP 10.0.2.15.44122 > 151.101.117.164.443: Flags [.], ack 1040375, win 65535, length 0
19:57:48.849000 IP 151.101.117.164.443 > 10.0.2.15.44122: Flags [P.], seq 1041749:1048619, ack 869, win 65535, length 6870
19:57:48.849003 IP 151.101.117.164.443 > 10.0.2.15.44122: Flags [.], seq 1048619:1050079, ack 869, win 65535, length 1460
19:57:48.849155 IP 151.101.117.164.443 > 10.0.2.15.44122: Flags [P.], seq 1050079:1052741, ack 869, win 65535, length 2662
19:57:48.849210 IP 10.0.2.15.44122 > 151.101.117.164.443: Flags [.], ack 1052741, win 65535, length 0
19:57:48.849260 IP 151.101.117.164.443 > 10.0.2.15.44122: Flags [P.], seq 1052741:1055489, ack 869, win 65535, length 2748
19:57:48.849282 IP 10.0.2.15.44122 > 151.101.117.164.443: Flags [.], ack 1055489, win 65535, length 0
19:57:48.851645 IP 151.101.117.164.443 > 10.0.2.15.44122: Flags [P.], seq 1055489:1059611, ack 869, win 65535, length 4122
19:57:48.851648 IP 151.101.117.164.443 > 10.0.2.15.44122: Flags [P.], seq 1059611:1063733, ack 869, win 65535, length 4122
19:57:48.851649 IP 151.101.117.164.443 > 10.0.2.15.44122: Flags [P.], seq 1063733:1065107, ack 869, win 65535, length 1374
19:57:48.851650 IP 151.101.117.164.443 > 10.0.2.15.44122: Flags [P.], seq 1065107:1069229, ack 869, win 65535, length 4122
19:57:48.851693 IP 151.101.117.164.443 > 10.0.2.15.44122: Flags [P.], seq 1069229:1070603, ack 869, win 65535, length 1374
19:57:48.851693 IP 151.101.117.164.443 > 10.0.2.15.44122: Flags [P.], seq 1070603:1073351, ack 869, win 65535, length 2748
19:57:48.851758 IP 10.0.2.15.44122 > 151.101.117.164.443: Flags [.], ack 1073351, win 65535, length 0
19:57:48.852846 IP 151.101.117.164.443 > 10.0.2.15.44122: Flags [.], seq 1073351:1076271, ack 869, win 65535, length 2920
19:57:48.852936 IP 10.0.2.15.44122 > 151.101.117.164.443: Flags [.], ack 1076271, win 65535, length 0
19:57:48.853131 IP 151.101.117.164.443 > 10.0.2.15.44122: Flags [P.], seq 1076271:1077473, ack 869, win 65535, length 1202
19:57:48.853133 IP 151.101.117.164.443 > 10.0.2.15.44122: Flags [P.], seq 1077473:1082969, ack 869, win 65535, length 5496
19:57:48.853134 IP 151.101.117.164.443 > 10.0.2.15.44122: Flags [P.], seq 1082969:1084343, ack 869, win 65535, length 1374
19:57:48.853324 IP 151.101.117.164.443 > 10.0.2.15.44122: Flags [P.], seq 1084343:1087091, ack 869, win 65535, length 2748
19:57:48.853388 IP 10.0.2.15.44122 > 151.101.117.164.443: Flags [.], ack 1087091, win 65535, length 0
19:57:48.853758 IP 151.101.117.164.443 > 10.0.2.15.44122: Flags [P.], seq 1087091:1089839, ack 869, win 65535, length 2748
19:57:48.853806 IP 10.0.2.15.44122 > 151.101.117.164.443: Flags [.], ack 1089839, win 65535, length 0
19:57:48.855269 IP 151.101.117.164.443 > 10.0.2.15.44122: Flags [P.], seq 1089839:1096709, ack 869, win 65535, length 6870
19:57:48.855273 IP 151.101.117.164.443 > 10.0.2.15.44122: Flags [P.], seq 1096709:1100831, ack 869, win 65535, length 4122
19:57:48.855317 IP 151.101.117.164.443 > 10.0.2.15.44122: Flags [P.], seq 1100831:1103579, ack 869, win 65535, length 2748
19:57:48.855596 IP 151.101.117.164.443 > 10.0.2.15.44122: Flags [P.], seq 1103579:1106327, ack 869, win 65535, length 2748
19:57:48.855629 IP 10.0.2.15.44122 > 151.101.117.164.443: Flags [.], ack 1106327, win 65535, length 0
19:57:48.857409 IP 151.101.117.164.443 > 10.0.2.15.44122: Flags [P.], seq 1106327:1114571, ack 869, win 65535, length 8244
19:57:48.857412 IP 151.101.117.164.443 > 10.0.2.15.44122: Flags [P.], seq 1114571:1118693, ack 869, win 65535, length 4122
19:57:48.857434 IP 10.0.2.15.44122 > 151.101.117.164.443: Flags [.], ack 1114571, win 65535, length 0
19:57:48.857556 IP 10.0.2.15.44122 > 151.101.117.164.443: Flags [.], ack 1118693, win 65535, length 0
19:57:48.859697 IP 151.101.117.164.443 > 10.0.2.15.44122: Flags [P.], seq 1118693:1122815, ack 869, win 65535, length 4122
19:57:48.859709 IP 10.0.2.15.44122 > 151.101.117.164.443: Flags [.], ack 1122815, win 65535, length 0
19:57:48.861961 IP 151.101.117.164.443 > 10.0.2.15.44122: Flags [P.], seq 1122815:1131059, ack 869, win 65535, length 8244
19:57:48.861964 IP 151.101.117.164.443 > 10.0.2.15.44122: Flags [P.], seq 1131059:1136555, ack 869, win 65535, length 5496
19:57:48.862067 IP 151.101.117.164.443 > 10.0.2.15.44122: Flags [P.], seq 1136555:1142051, ack 869, win 65535, length 5496
19:57:48.862257 IP 151.101.117.164.443 > 10.0.2.15.44122: Flags [P.], seq 1142051:1143425, ack 869, win 65535, length 1374
19:57:48.862292 IP 10.0.2.15.44122 > 151.101.117.164.443: Flags [.], ack 1143425, win 65535, length 0
19:57:48.862564 IP 151.101.117.164.443 > 10.0.2.15.44122: Flags [P.], seq 1143425:1146173, ack 869, win 65535, length 2748
19:57:48.862887 IP 151.101.117.164.443 > 10.0.2.15.44122: Flags [P.], seq 1146173:1148921, ack 869, win 65535, length 2748
19:57:48.862888 IP 151.101.117.164.443 > 10.0.2.15.44122: Flags [P.], seq 1148921:1150295, ack 869, win 65535, length 1374
19:57:48.862889 IP 151.101.117.164.443 > 10.0.2.15.44122: Flags [P.], seq 1150295:1153043, ack 869, win 65535, length 2748
19:57:48.862924 IP 10.0.2.15.44122 > 151.101.117.164.443: Flags [.], ack 1153043, win 65535, length 0
19:57:48.863044 IP 151.101.117.164.443 > 10.0.2.15.44122: Flags [P.], seq 1153043:1155791, ack 869, win 65535, length 2748
19:57:48.863077 IP 10.0.2.15.44122 > 151.101.117.164.443: Flags [.], ack 1155791, win 65535, length 0
19:57:48.865068 IP 151.101.117.164.443 > 10.0.2.15.44122: Flags [P.], seq 1155791:1164035, ack 869, win 65535, length 8244
19:57:48.865071 IP 151.101.117.164.443 > 10.0.2.15.44122: Flags [P.], seq 1164035:1168157, ack 869, win 65535, length 4122
19:57:48.865190 IP 10.0.2.15.44122 > 151.101.117.164.443: Flags [.], ack 1164035, win 65535, length 0
19:57:48.865256 IP 151.101.117.164.443 > 10.0.2.15.44122: Flags [P.], seq 1168157:1170905, ack 869, win 65535, length 2748
19:57:48.865258 IP 151.101.117.164.443 > 10.0.2.15.44122: Flags [P.], seq 1170905:1173653, ack 869, win 65535, length 2748
19:57:48.865489 IP 151.101.117.164.443 > 10.0.2.15.44122: Flags [P.], seq 1173653:1175027, ack 869, win 65535, length 1374
19:57:48.865490 IP 151.101.117.164.443 > 10.0.2.15.44122: Flags [P.], seq 1175027:1177775, ack 869, win 65535, length 2748
19:57:48.865521 IP 10.0.2.15.44122 > 151.101.117.164.443: Flags [.], ack 1173653, win 65535, length 0
19:57:48.865678 IP 10.0.2.15.44122 > 151.101.117.164.443: Flags [.], ack 1177775, win 65535, length 0
19:57:48.867261 IP 151.101.117.164.443 > 10.0.2.15.44122: Flags [P.], seq 1177775:1187393, ack 869, win 65535, length 9618
19:57:48.867263 IP 151.101.117.164.443 > 10.0.2.15.44122: Flags [P.], seq 1187393:1190141, ack 869, win 65535, length 2748
19:57:48.867286 IP 10.0.2.15.44122 > 151.101.117.164.443: Flags [.], ack 1187393, win 65535, length 0
19:57:48.867325 IP 151.101.117.164.443 > 10.0.2.15.44122: Flags [P.], seq 1190141:1194263, ack 869, win 65535, length 4122
19:57:48.867383 IP 10.0.2.15.44122 > 151.101.117.164.443: Flags [.], ack 1194263, win 65535, length 0
19:57:48.869066 IP 151.101.117.164.443 > 10.0.2.15.44122: Flags [P.], seq 1194263:1201133, ack 869, win 65535, length 6870
19:57:48.869068 IP 151.101.117.164.443 > 10.0.2.15.44122: Flags [P.], seq 1201133:1203881, ack 869, win 65535, length 2748
19:57:48.869175 IP 10.0.2.15.44122 > 151.101.117.164.443: Flags [.], ack 1201133, win 65535, length 0
19:57:48.869326 IP 151.101.117.164.443 > 10.0.2.15.44122: Flags [P.], seq 1203881:1206629, ack 869, win 65535, length 2748
19:57:48.869327 IP 151.101.117.164.443 > 10.0.2.15.44122: Flags [P.], seq 1206629:1209377, ack 869, win 65535, length 2748
19:57:48.869328 IP 151.101.117.164.443 > 10.0.2.15.44122: Flags [P.], seq 1209377:1210751, ack 869, win 65535, length 1374
19:57:48.869363 IP 10.0.2.15.44122 > 151.101.117.164.443: Flags [.], ack 1210751, win 65535, length 0
19:57:48.870242 IP 151.101.117.164.443 > 10.0.2.15.44122: Flags [P.], seq 1210751:1216247, ack 869, win 65535, length 5496
19:57:48.870244 IP 151.101.117.164.443 > 10.0.2.15.44122: Flags [P.], seq 1216247:1217621, ack 869, win 65535, length 1374
19:57:48.870262 IP 10.0.2.15.44122 > 151.101.117.164.443: Flags [.], ack 1216247, win 65535, length 0
19:57:48.870463 IP 151.101.117.164.443 > 10.0.2.15.44122: Flags [P.], seq 1217621:1220369, ack 869, win 65535, length 2748
19:57:48.870564 IP 10.0.2.15.44122 > 151.101.117.164.443: Flags [.], ack 1220369, win 65535, length 0
19:57:48.871986 IP 151.101.117.164.443 > 10.0.2.15.44122: Flags [P.], seq 1220369:1227239, ack 869, win 65535, length 6870
19:57:48.871988 IP 151.101.117.164.443 > 10.0.2.15.44122: Flags [P.], seq 1227239:1228613, ack 869, win 65535, length 1374
19:57:48.872097 IP 10.0.2.15.44122 > 151.101.117.164.443: Flags [.], ack 1228613, win 65535, length 0
19:57:48.874011 IP 151.101.117.164.443 > 10.0.2.15.44122: Flags [P.], seq 1228613:1235483, ack 869, win 65535, length 6870
19:57:48.874028 IP 10.0.2.15.44122 > 151.101.117.164.443: Flags [.], ack 1235483, win 65535, length 0
19:57:48.874863 IP 151.101.117.164.443 > 10.0.2.15.44122: Flags [P.], seq 1235483:1236857, ack 869, win 65535, length 1374
19:57:48.876393 IP 151.101.117.164.443 > 10.0.2.15.44122: Flags [P.], seq 1236857:1243727, ack 869, win 65535, length 6870
19:57:48.876396 IP 151.101.117.164.443 > 10.0.2.15.44122: Flags [P.], seq 1243727:1249223, ack 869, win 65535, length 5496
19:57:48.876509 IP 10.0.2.15.44122 > 151.101.117.164.443: Flags [.], ack 1243727, win 65535, length 0
19:57:48.876565 IP 151.101.117.164.443 > 10.0.2.15.44122: Flags [P.], seq 1249223:1250597, ack 869, win 65535, length 1374
19:57:48.876624 IP 10.0.2.15.44122 > 151.101.117.164.443: Flags [.], ack 1250597, win 65535, length 0
19:57:48.878715 IP 151.101.117.164.443 > 10.0.2.15.44122: Flags [P.], seq 1250597:1260215, ack 869, win 65535, length 9618
19:57:48.878736 IP 10.0.2.15.44122 > 151.101.117.164.443: Flags [.], ack 1260215, win 65535, length 0
19:57:48.879109 IP 151.101.117.164.443 > 10.0.2.15.44122: Flags [P.], seq 1260215:1264337, ack 869, win 65535, length 4122
19:57:48.879124 IP 10.0.2.15.44122 > 151.101.117.164.443: Flags [.], ack 1264337, win 65535, length 0
19:57:48.884008 IP 151.101.117.164.443 > 10.0.2.15.44122: Flags [P.], seq 1264337:1275329, ack 869, win 65535, length 10992
19:57:48.884476 IP 151.101.117.164.443 > 10.0.2.15.44122: Flags [P.], seq 1275329:1276703, ack 869, win 65535, length 1374
19:57:48.884479 IP 151.101.117.164.443 > 10.0.2.15.44122: Flags [P.], seq 1276703:1280825, ack 869, win 65535, length 4122
19:57:48.884480 IP 151.101.117.164.443 > 10.0.2.15.44122: Flags [P.], seq 1280825:1284947, ack 869, win 65535, length 4122
19:57:48.884629 IP 151.101.117.164.443 > 10.0.2.15.44122: Flags [P.], seq 1284947:1289069, ack 869, win 65535, length 4122
19:57:48.884877 IP 151.101.117.164.443 > 10.0.2.15.44122: Flags [P.], seq 1289069:1291817, ack 869, win 65535, length 2748
19:57:48.884960 IP 10.0.2.15.44122 > 151.101.117.164.443: Flags [.], ack 1291817, win 65535, length 0
19:57:48.885499 IP 151.101.117.164.443 > 10.0.2.15.44122: Flags [P.], seq 1291817:1295939, ack 869, win 65535, length 4122
19:57:48.885501 IP 151.101.117.164.443 > 10.0.2.15.44122: Flags [P.], seq 1295939:1301435, ack 869, win 65535, length 5496
19:57:48.885795 IP 151.101.117.164.443 > 10.0.2.15.44122: Flags [P.], seq 1301435:1305557, ack 869, win 65535, length 4122
19:57:48.885830 IP 10.0.2.15.44122 > 151.101.117.164.443: Flags [.], ack 1305557, win 65535, length 0
19:57:48.885979 IP 151.101.117.164.443 > 10.0.2.15.44122: Flags [P.], seq 1305557:1309679, ack 869, win 65535, length 4122
19:57:48.886016 IP 10.0.2.15.44122 > 151.101.117.164.443: Flags [.], ack 1309679, win 65535, length 0
19:57:48.886212 IP 151.101.117.164.443 > 10.0.2.15.44122: Flags [P.], seq 1309679:1311053, ack 869, win 65535, length 1374
19:57:48.887082 IP 151.101.117.164.443 > 10.0.2.15.44122: Flags [P.], seq 1311053:1317923, ack 869, win 65535, length 6870
19:57:48.887085 IP 151.101.117.164.443 > 10.0.2.15.44122: Flags [P.], seq 1317923:1322045, ack 869, win 65535, length 4122
19:57:48.887119 IP 151.101.117.164.443 > 10.0.2.15.44122: Flags [P.], seq 1322045:1323419, ack 869, win 65535, length 1374
19:57:48.887201 IP 10.0.2.15.44122 > 151.101.117.164.443: Flags [.], ack 1323419, win 65535, length 0
19:57:48.887806 IP 151.101.117.164.443 > 10.0.2.15.44122: Flags [.], seq 1323419:1324879, ack 869, win 65535, length 1460
19:57:48.888136 IP 151.101.117.164.443 > 10.0.2.15.44122: Flags [P.], seq 1324879:1327541, ack 869, win 65535, length 2662
19:57:48.888138 IP 151.101.117.164.443 > 10.0.2.15.44122: Flags [P.], seq 1327541:1330289, ack 869, win 65535, length 2748
19:57:48.888139 IP 151.101.117.164.443 > 10.0.2.15.44122: Flags [P.], seq 1330289:1334411, ack 869, win 65535, length 4122
19:57:48.888154 IP 10.0.2.15.44122 > 151.101.117.164.443: Flags [.], ack 1327541, win 65535, length 0
19:57:48.888303 IP 151.101.117.164.443 > 10.0.2.15.44122: Flags [P.], seq 1334411:1337159, ack 869, win 65535, length 2748
19:57:48.888404 IP 151.101.117.164.443 > 10.0.2.15.44122: Flags [P.], seq 1337159:1339907, ack 869, win 65535, length 2748
19:57:48.888425 IP 10.0.2.15.44122 > 151.101.117.164.443: Flags [.], ack 1334411, win 65535, length 0
19:57:48.888554 IP 151.101.117.164.443 > 10.0.2.15.44122: Flags [P.], seq 1339907:1341281, ack 869, win 65535, length 1374
19:57:48.888612 IP 10.0.2.15.44122 > 151.101.117.164.443: Flags [.], ack 1341281, win 65535, length 0
19:57:48.893822 IP 151.101.117.164.443 > 10.0.2.15.44122: Flags [P.], seq 1341281:1357769, ack 869, win 65535, length 16488
19:57:48.893934 IP 10.0.2.15.44122 > 151.101.117.164.443: Flags [.], ack 1357769, win 65535, length 0
19:57:48.894473 IP 151.101.117.164.443 > 10.0.2.15.44122: Flags [P.], seq 1357769:1361891, ack 869, win 65535, length 4122
19:57:48.894476 IP 151.101.117.164.443 > 10.0.2.15.44122: Flags [P.], seq 1361891:1364639, ack 869, win 65535, length 2748
19:57:48.894478 IP 151.101.117.164.443 > 10.0.2.15.44122: Flags [P.], seq 1364639:1370135, ack 869, win 65535, length 5496
19:57:48.894524 IP 151.101.117.164.443 > 10.0.2.15.44122: Flags [P.], seq 1370135:1371509, ack 869, win 65535, length 1374
19:57:48.894525 IP 151.101.117.164.443 > 10.0.2.15.44122: Flags [P.], seq 1371509:1377005, ack 869, win 65535, length 5496
19:57:48.894853 IP 10.0.2.15.44122 > 151.101.117.164.443: Flags [.], ack 1377005, win 65535, length 0
19:57:48.895118 IP 151.101.117.164.443 > 10.0.2.15.44122: Flags [P.], seq 1377005:1382501, ack 869, win 65535, length 5496
19:57:48.895133 IP 10.0.2.15.44122 > 151.101.117.164.443: Flags [.], ack 1382501, win 65535, length 0
19:57:48.900813 IP 151.101.117.164.443 > 10.0.2.15.44122: Flags [P.], seq 1382501:1390745, ack 869, win 65535, length 8244
19:57:48.900871 IP 10.0.2.15.44122 > 151.101.117.164.443: Flags [.], ack 1390745, win 65535, length 0
19:57:48.901414 IP 151.101.117.164.443 > 10.0.2.15.44122: Flags [P.], seq 1390745:1396241, ack 869, win 65535, length 5496
19:57:48.901416 IP 151.101.117.164.443 > 10.0.2.15.44122: Flags [P.], seq 1396241:1398989, ack 869, win 65535, length 2748
19:57:48.901416 IP 151.101.117.164.443 > 10.0.2.15.44122: Flags [P.], seq 1398989:1400363, ack 869, win 65535, length 1374
19:57:48.901600 IP 151.101.117.164.443 > 10.0.2.15.44122: Flags [P.], seq 1400363:1401737, ack 869, win 65535, length 1374
19:57:48.901660 IP 10.0.2.15.44122 > 151.101.117.164.443: Flags [.], ack 1401737, win 65535, length 0
19:57:48.903051 IP 151.101.117.164.443 > 10.0.2.15.44122: Flags [P.], seq 1401737:1404485, ack 869, win 65535, length 2748
19:57:48.903115 IP 151.101.117.164.443 > 10.0.2.15.44122: Flags [P.], seq 1404485:1408607, ack 869, win 65535, length 4122
19:57:48.903286 IP 10.0.2.15.44122 > 151.101.117.164.443: Flags [.], ack 1404485, win 65535, length 0
19:57:48.903563 IP 151.101.117.164.443 > 10.0.2.15.44122: Flags [P.], seq 1408607:1414103, ack 869, win 65535, length 5496
19:57:48.903564 IP 151.101.117.164.443 > 10.0.2.15.44122: Flags [P.], seq 1414103:1415477, ack 869, win 65535, length 1374
19:57:48.903604 IP 10.0.2.15.44122 > 151.101.117.164.443: Flags [.], ack 1415477, win 65535, length 0
19:57:48.905162 IP 151.101.117.164.443 > 10.0.2.15.44122: Flags [P.], seq 1415477:1422347, ack 869, win 65535, length 6870
19:57:48.905166 IP 151.101.117.164.443 > 10.0.2.15.44122: Flags [P.], seq 1422347:1423721, ack 869, win 65535, length 1374
19:57:48.905167 IP 151.101.117.164.443 > 10.0.2.15.44122: Flags [P.], seq 1423721:1427843, ack 869, win 65535, length 4122
19:57:48.905208 IP 151.101.117.164.443 > 10.0.2.15.44122: Flags [P.], seq 1427843:1429217, ack 869, win 65535, length 1374
19:57:48.905290 IP 10.0.2.15.44122 > 151.101.117.164.443: Flags [.], ack 1429217, win 65535, length 0
19:57:48.907269 IP 151.101.117.164.443 > 10.0.2.15.44122: Flags [P.], seq 1429217:1436087, ack 869, win 65535, length 6870
19:57:48.907272 IP 151.101.117.164.443 > 10.0.2.15.44122: Flags [P.], seq 1436087:1437461, ack 869, win 65535, length 1374
19:57:48.907273 IP 151.101.117.164.443 > 10.0.2.15.44122: Flags [P.], seq 1437461:1438835, ack 869, win 65535, length 1374
19:57:48.907274 IP 151.101.117.164.443 > 10.0.2.15.44122: Flags [P.], seq 1438835:1441583, ack 869, win 65535, length 2748
19:57:48.907300 IP 10.0.2.15.44122 > 151.101.117.164.443: Flags [.], ack 1436087, win 65535, length 0
19:57:48.907789 IP 151.101.117.164.443 > 10.0.2.15.44122: Flags [P.], seq 1441583:1445705, ack 869, win 65535, length 4122
19:57:48.907935 IP 10.0.2.15.44122 > 151.101.117.164.443: Flags [.], ack 1445705, win 65535, length 0
19:57:48.908036 IP 151.101.117.164.443 > 10.0.2.15.44122: Flags [P.], seq 1445705:1449827, ack 869, win 65535, length 4122
19:57:48.908102 IP 151.101.117.164.443 > 10.0.2.15.44122: Flags [P.], seq 1449827:1452575, ack 869, win 65535, length 2748
19:57:48.908160 IP 10.0.2.15.44122 > 151.101.117.164.443: Flags [.], ack 1452575, win 65535, length 0
19:57:48.909603 IP 151.101.117.164.443 > 10.0.2.15.44122: Flags [P.], seq 1452575:1459445, ack 869, win 65535, length 6870
19:57:48.909605 IP 151.101.117.164.443 > 10.0.2.15.44122: Flags [P.], seq 1459445:1462193, ack 869, win 65535, length 2748
19:57:48.909605 IP 151.101.117.164.443 > 10.0.2.15.44122: Flags [P.], seq 1462193:1463567, ack 869, win 65535, length 1374
19:57:48.909624 IP 10.0.2.15.44122 > 151.101.117.164.443: Flags [.], ack 1459445, win 65535, length 0
19:57:48.909670 IP 151.101.117.164.443 > 10.0.2.15.44122: Flags [P.], seq 1463567:1466315, ack 869, win 65535, length 2748
19:57:48.909671 IP 151.101.117.164.443 > 10.0.2.15.44122: Flags [P.], seq 1466315:1467689, ack 869, win 65535, length 1374
19:57:48.909737 IP 10.0.2.15.44122 > 151.101.117.164.443: Flags [.], ack 1467689, win 65535, length 0
19:57:48.911450 IP 151.101.117.164.443 > 10.0.2.15.44122: Flags [P.], seq 1467689:1473185, ack 869, win 65535, length 5496
19:57:48.911453 IP 151.101.117.164.443 > 10.0.2.15.44122: Flags [P.], seq 1473185:1477307, ack 869, win 65535, length 4122
19:57:48.911475 IP 10.0.2.15.44122 > 151.101.117.164.443: Flags [.], ack 1473185, win 65535, length 0
19:57:48.911747 IP 151.101.117.164.443 > 10.0.2.15.44122: Flags [P.], seq 1477307:1480055, ack 869, win 65535, length 2748
19:57:48.911749 IP 151.101.117.164.443 > 10.0.2.15.44122: Flags [P.], seq 1480055:1482803, ack 869, win 65535, length 2748
19:57:48.912202 IP 151.101.117.164.443 > 10.0.2.15.44122: Flags [P.], seq 1482803:1484177, ack 869, win 65535, length 1374
19:57:48.912518 IP 10.0.2.15.44122 > 151.101.117.164.443: Flags [.], ack 1484177, win 65535, length 0
19:57:48.913332 IP 151.101.117.164.443 > 10.0.2.15.44122: Flags [P.], seq 1484177:1488299, ack 869, win 65535, length 4122
19:57:48.913334 IP 151.101.117.164.443 > 10.0.2.15.44122: Flags [P.], seq 1488299:1489673, ack 869, win 65535, length 1374
19:57:48.913334 IP 151.101.117.164.443 > 10.0.2.15.44122: Flags [P.], seq 1489673:1492421, ack 869, win 65535, length 2748
19:57:48.913790 IP 151.101.117.164.443 > 10.0.2.15.44122: Flags [P.], seq 1492421:1493795, ack 869, win 65535, length 1374
19:57:48.913792 IP 151.101.117.164.443 > 10.0.2.15.44122: Flags [P.], seq 1493795:1496543, ack 869, win 65535, length 2748
19:57:48.913792 IP 151.101.117.164.443 > 10.0.2.15.44122: Flags [P.], seq 1496543:1499291, ack 869, win 65535, length 2748
19:57:48.913856 IP 151.101.117.164.443 > 10.0.2.15.44122: Flags [P.], seq 1499291:1500665, ack 869, win 65535, length 1374
19:57:48.914117 IP 151.101.117.164.443 > 10.0.2.15.44122: Flags [P.], seq 1500665:1502039, ack 869, win 65535, length 1374
19:57:48.914294 IP 10.0.2.15.44122 > 151.101.117.164.443: Flags [.], ack 1502039, win 65535, length 0
19:57:48.915877 IP 151.101.117.164.443 > 10.0.2.15.44122: Flags [P.], seq 1502039:1508909, ack 869, win 65535, length 6870
19:57:48.915879 IP 151.101.117.164.443 > 10.0.2.15.44122: Flags [P.], seq 1508909:1511657, ack 869, win 65535, length 2748
19:57:48.915900 IP 10.0.2.15.44122 > 151.101.117.164.443: Flags [.], ack 1508909, win 65535, length 0
19:57:48.916344 IP 151.101.117.164.443 > 10.0.2.15.44122: Flags [P.], seq 1511657:1514405, ack 869, win 65535, length 2748
19:57:48.916345 IP 151.101.117.164.443 > 10.0.2.15.44122: Flags [P.], seq 1514405:1517153, ack 869, win 65535, length 2748
19:57:48.916346 IP 151.101.117.164.443 > 10.0.2.15.44122: Flags [P.], seq 1517153:1518527, ack 869, win 65535, length 1374
19:57:48.916413 IP 10.0.2.15.44122 > 151.101.117.164.443: Flags [.], ack 1518527, win 65535, length 0
19:57:48.916491 IP 151.101.117.164.443 > 10.0.2.15.44122: Flags [P.], seq 1518527:1521275, ack 869, win 65535, length 2748
19:57:48.916593 IP 10.0.2.15.44122 > 151.101.117.164.443: Flags [.], ack 1521275, win 65535, length 0
19:57:48.916686 IP 151.101.117.164.443 > 10.0.2.15.44122: Flags [P.], seq 1521275:1524023, ack 869, win 65535, length 2748
19:57:48.916709 IP 10.0.2.15.44122 > 151.101.117.164.443: Flags [.], ack 1524023, win 65535, length 0
19:57:48.916884 IP 151.101.117.164.443 > 10.0.2.15.44122: Flags [P.], seq 1524023:1525397, ack 869, win 65535, length 1374
19:57:48.918361 IP 151.101.117.164.443 > 10.0.2.15.44122: Flags [P.], seq 1525397:1530893, ack 869, win 65535, length 5496
19:57:48.918363 IP 151.101.117.164.443 > 10.0.2.15.44122: Flags [P.], seq 1530893:1533641, ack 869, win 65535, length 2748
19:57:48.918382 IP 10.0.2.15.44122 > 151.101.117.164.443: Flags [.], ack 1530893, win 65535, length 0
19:57:48.918763 IP 151.101.117.164.443 > 10.0.2.15.44122: Flags [P.], seq 1533641:1537763, ack 869, win 65535, length 4122
19:57:48.918765 IP 151.101.117.164.443 > 10.0.2.15.44122: Flags [P.], seq 1537763:1539137, ack 869, win 65535, length 1374
19:57:48.918766 IP 151.101.117.164.443 > 10.0.2.15.44122: Flags [P.], seq 1539137:1540511, ack 869, win 65535, length 1374
19:57:48.918841 IP 10.0.2.15.44122 > 151.101.117.164.443: Flags [.], ack 1540511, win 65535, length 0
19:57:48.919101 IP 151.101.117.164.443 > 10.0.2.15.44122: Flags [P.], seq 1540511:1543259, ack 869, win 65535, length 2748
19:57:48.919103 IP 151.101.117.164.443 > 10.0.2.15.44122: Flags [P.], seq 1543259:1546007, ack 869, win 65535, length 2748
19:57:48.919103 IP 151.101.117.164.443 > 10.0.2.15.44122: Flags [P.], seq 1546007:1547381, ack 869, win 65535, length 1374
19:57:48.919261 IP 10.0.2.15.44122 > 151.101.117.164.443: Flags [.], ack 1547381, win 65535, length 0
19:57:48.919319 IP 151.101.117.164.443 > 10.0.2.15.44122: Flags [P.], seq 1547381:1548755, ack 869, win 65535, length 1374
19:57:48.919489 IP 151.101.117.164.443 > 10.0.2.15.44122: Flags [.], seq 1548755:1550215, ack 869, win 65535, length 1460
19:57:48.919499 IP 10.0.2.15.44122 > 151.101.117.164.443: Flags [.], ack 1550215, win 65535, length 0
19:57:48.919936 IP 151.101.117.164.443 > 10.0.2.15.44122: Flags [P.], seq 1550215:1551503, ack 869, win 65535, length 1288
19:57:48.921331 IP 151.101.117.164.443 > 10.0.2.15.44122: Flags [P.], seq 1551503:1558373, ack 869, win 65535, length 6870
19:57:48.921333 IP 151.101.117.164.443 > 10.0.2.15.44122: Flags [P.], seq 1558373:1559747, ack 869, win 65535, length 1374
19:57:48.921334 IP 151.101.117.164.443 > 10.0.2.15.44122: Flags [P.], seq 1559747:1562495, ack 869, win 65535, length 2748
19:57:48.921457 IP 10.0.2.15.44122 > 151.101.117.164.443: Flags [.], ack 1562495, win 65535, length 0
19:57:48.923274 IP 151.101.117.164.443 > 10.0.2.15.44122: Flags [P.], seq 1562495:1569365, ack 869, win 65535, length 6870
19:57:48.923277 IP 151.101.117.164.443 > 10.0.2.15.44122: Flags [P.], seq 1569365:1573487, ack 869, win 65535, length 4122
19:57:48.923377 IP 10.0.2.15.44122 > 151.101.117.164.443: Flags [.], ack 1569365, win 65535, length 0
19:57:48.923723 IP 151.101.117.164.443 > 10.0.2.15.44122: Flags [P.], seq 1573487:1574861, ack 869, win 65535, length 1374
19:57:48.923724 IP 151.101.117.164.443 > 10.0.2.15.44122: Flags [P.], seq 1574861:1576235, ack 869, win 65535, length 1374
19:57:48.923725 IP 151.101.117.164.443 > 10.0.2.15.44122: Flags [P.], seq 1576235:1578983, ack 869, win 65535, length 2748
19:57:48.923725 IP 151.101.117.164.443 > 10.0.2.15.44122: Flags [P.], seq 1578983:1581731, ack 869, win 65535, length 2748
19:57:48.923839 IP 151.101.117.164.443 > 10.0.2.15.44122: Flags [P.], seq 1581731:1583105, ack 869, win 65535, length 1374
19:57:48.924134 IP 151.101.117.164.443 > 10.0.2.15.44122: Flags [P.], seq 1583105:1584479, ack 869, win 65535, length 1374
19:57:48.924198 IP 10.0.2.15.44122 > 151.101.117.164.443: Flags [.], ack 1584479, win 65535, length 0
19:57:48.925354 IP 151.101.117.164.443 > 10.0.2.15.44122: Flags [P.], seq 1584479:1589975, ack 869, win 65535, length 5496
19:57:48.925429 IP 10.0.2.15.44122 > 151.101.117.164.443: Flags [.], ack 1589975, win 65535, length 0
19:57:48.925740 IP 151.101.117.164.443 > 10.0.2.15.44122: Flags [P.], seq 1589975:1592723, ack 869, win 65535, length 2748
19:57:48.925742 IP 151.101.117.164.443 > 10.0.2.15.44122: Flags [P.], seq 1592723:1596845, ack 869, win 65535, length 4122
19:57:48.925946 IP 151.101.117.164.443 > 10.0.2.15.44122: Flags [P.], seq 1596845:1600967, ack 869, win 65535, length 4122
19:57:48.925947 IP 151.101.117.164.443 > 10.0.2.15.44122: Flags [P.], seq 1600967:1602341, ack 869, win 65535, length 1374
19:57:48.926182 IP 151.101.117.164.443 > 10.0.2.15.44122: Flags [P.], seq 1602341:1603715, ack 869, win 65535, length 1374
19:57:48.926226 IP 10.0.2.15.44122 > 151.101.117.164.443: Flags [.], ack 1603715, win 65535, length 0
19:57:48.927223 IP 151.101.117.164.443 > 10.0.2.15.44122: Flags [P.], seq 1603715:1609211, ack 869, win 65535, length 5496
19:57:48.927244 IP 10.0.2.15.44122 > 151.101.117.164.443: Flags [.], ack 1609211, win 65535, length 0
19:57:48.927391 IP 151.101.117.164.443 > 10.0.2.15.44122: Flags [P.], seq 1609211:1611959, ack 869, win 65535, length 2748
19:57:48.927702 IP 151.101.117.164.443 > 10.0.2.15.44122: Flags [P.], seq 1611959:1616081, ack 869, win 65535, length 4122
19:57:48.927721 IP 10.0.2.15.44122 > 151.101.117.164.443: Flags [.], ack 1611959, win 65535, length 0
19:57:48.927748 IP 10.0.2.15.44122 > 151.101.117.164.443: Flags [.], ack 1616081, win 65535, length 0
19:57:48.927833 IP 151.101.117.164.443 > 10.0.2.15.44122: Flags [P.], seq 1616081:1618829, ack 869, win 65535, length 2748
19:57:48.927858 IP 10.0.2.15.44122 > 151.101.117.164.443: Flags [.], ack 1618829, win 65535, length 0
19:57:48.928220 IP 151.101.117.164.443 > 10.0.2.15.44122: Flags [P.], seq 1618829:1622951, ack 869, win 65535, length 4122
19:57:48.928278 IP 10.0.2.15.44122 > 151.101.117.164.443: Flags [.], ack 1622951, win 65535, length 0
19:57:48.929355 IP 151.101.117.164.443 > 10.0.2.15.44122: Flags [P.], seq 1622951:1627073, ack 869, win 65535, length 4122
19:57:48.929358 IP 151.101.117.164.443 > 10.0.2.15.44122: Flags [P.], seq 1627073:1631195, ack 869, win 65535, length 4122
19:57:48.929451 IP 10.0.2.15.44122 > 151.101.117.164.443: Flags [.], ack 1627073, win 65535, length 0
19:57:48.929666 IP 151.101.117.164.443 > 10.0.2.15.44122: Flags [P.], seq 1631195:1633943, ack 869, win 65535, length 2748
19:57:48.929723 IP 10.0.2.15.44122 > 151.101.117.164.443: Flags [.], ack 1633943, win 65535, length 0
19:57:48.930658 IP 151.101.117.164.443 > 10.0.2.15.44122: Flags [P.], seq 1633943:1638065, ack 869, win 65535, length 4122
19:57:48.930661 IP 151.101.117.164.443 > 10.0.2.15.44122: Flags [P.], seq 1638065:1640813, ack 869, win 65535, length 2748
19:57:48.930941 IP 151.101.117.164.443 > 10.0.2.15.44122: Flags [P.], seq 1640813:1642187, ack 869, win 65535, length 1374
19:57:48.930943 IP 151.101.117.164.443 > 10.0.2.15.44122: Flags [P.], seq 1642187:1643561, ack 869, win 65535, length 1374
19:57:48.931109 IP 151.101.117.164.443 > 10.0.2.15.44122: Flags [P.], seq 1643561:1646309, ack 869, win 65535, length 2748
19:57:48.931241 IP 151.101.117.164.443 > 10.0.2.15.44122: Flags [P.], seq 1646309:1647683, ack 869, win 65535, length 1374
19:57:48.931279 IP 10.0.2.15.44122 > 151.101.117.164.443: Flags [.], ack 1647683, win 65535, length 0
19:57:48.931385 IP 151.101.117.164.443 > 10.0.2.15.44122: Flags [P.], seq 1647683:1649057, ack 869, win 65535, length 1374
19:57:48.932824 IP 151.101.117.164.443 > 10.0.2.15.44122: Flags [P.], seq 1649057:1654553, ack 869, win 65535, length 5496
19:57:48.932844 IP 10.0.2.15.44122 > 151.101.117.164.443: Flags [.], ack 1654553, win 65535, length 0
19:57:48.933008 IP 151.101.117.164.443 > 10.0.2.15.44122: Flags [P.], seq 1654553:1657301, ack 869, win 65535, length 2748
19:57:48.933068 IP 10.0.2.15.44122 > 151.101.117.164.443: Flags [.], ack 1657301, win 65535, length 0
19:57:48.933149 IP 151.101.117.164.443 > 10.0.2.15.44122: Flags [P.], seq 1657301:1660049, ack 869, win 65535, length 2748
19:57:48.933151 IP 151.101.117.164.443 > 10.0.2.15.44122: Flags [P.], seq 1660049:1661423, ack 869, win 65535, length 1374
19:57:48.933214 IP 10.0.2.15.44122 > 151.101.117.164.443: Flags [.], ack 1661423, win 65535, length 0
19:57:48.933549 IP 151.101.117.164.443 > 10.0.2.15.44122: Flags [P.], seq 1661423:1662797, ack 869, win 65535, length 1374
19:57:48.933551 IP 151.101.117.164.443 > 10.0.2.15.44122: Flags [P.], seq 1662797:1665545, ack 869, win 65535, length 2748
19:57:48.933595 IP 10.0.2.15.44122 > 151.101.117.164.443: Flags [.], ack 1665545, win 65535, length 0
19:57:48.933686 IP 151.101.117.164.443 > 10.0.2.15.44122: Flags [P.], seq 1665545:1666919, ack 869, win 65535, length 1374
19:57:48.933879 IP 151.101.117.164.443 > 10.0.2.15.44122: Flags [P.], seq 1666919:1669667, ack 869, win 65535, length 2748
19:57:48.933933 IP 10.0.2.15.44122 > 151.101.117.164.443: Flags [.], ack 1669667, win 65535, length 0
19:57:48.934062 IP 151.101.117.164.443 > 10.0.2.15.44122: Flags [P.], seq 1669667:1671041, ack 869, win 65535, length 1374
19:57:48.935072 IP 151.101.117.164.443 > 10.0.2.15.44122: Flags [P.], seq 1671041:1676537, ack 869, win 65535, length 5496
19:57:48.935199 IP 10.0.2.15.44122 > 151.101.117.164.443: Flags [.], ack 1676537, win 65535, length 0
19:57:48.936699 IP 151.101.117.164.443 > 10.0.2.15.44122: Flags [P.], seq 1676537:1683407, ack 869, win 65535, length 6870
19:57:48.936702 IP 151.101.117.164.443 > 10.0.2.15.44122: Flags [P.], seq 1683407:1688903, ack 869, win 65535, length 5496
19:57:48.936758 IP 151.101.117.164.443 > 10.0.2.15.44122: Flags [P.], seq 1688903:1694399, ack 869, win 65535, length 5496
19:57:48.936928 IP 151.101.117.164.443 > 10.0.2.15.44122: Flags [P.], seq 1694399:1695773, ack 869, win 65535, length 1374
19:57:48.936990 IP 10.0.2.15.44122 > 151.101.117.164.443: Flags [.], ack 1695773, win 65535, length 0
19:57:48.938728 IP 151.101.117.164.443 > 10.0.2.15.44122: Flags [P.], seq 1695773:1705391, ack 869, win 65535, length 9618
19:57:48.938731 IP 151.101.117.164.443 > 10.0.2.15.44122: Flags [P.], seq 1705391:1709513, ack 869, win 65535, length 4122
19:57:48.938757 IP 10.0.2.15.44122 > 151.101.117.164.443: Flags [.], ack 1705391, win 65535, length 0
19:57:48.938823 IP 151.101.117.164.443 > 10.0.2.15.44122: Flags [P.], seq 1709513:1710887, ack 869, win 65535, length 1374
19:57:48.938824 IP 151.101.117.164.443 > 10.0.2.15.44122: Flags [P.], seq 1710887:1713635, ack 869, win 65535, length 2748
19:57:48.939020 IP 151.101.117.164.443 > 10.0.2.15.44122: Flags [P.], seq 1713635:1715009, ack 869, win 65535, length 1374
19:57:48.939071 IP 10.0.2.15.44122 > 151.101.117.164.443: Flags [.], ack 1715009, win 65535, length 0
19:57:48.939226 IP 151.101.117.164.443 > 10.0.2.15.44122: Flags [P.], seq 1715009:1717757, ack 869, win 65535, length 2748
19:57:48.939234 IP 10.0.2.15.44122 > 151.101.117.164.443: Flags [.], ack 1717757, win 65535, length 0

