20:08:45.816074 IP middlinux.37325 > hera-lan2.domain: 27512+ A? www.nytimes.com. (33)
20:08:45.816119 IP middlinux.37325 > hera-lan2.domain: 1862+ AAAA? www.nytimes.com. (33)
20:08:45.842166 IP hera-lan2.domain > middlinux.37325: 27512 3/0/0 CNAME www.prd.map.nytimes.com., CNAME nytimes.map.fastly.net., A 151.101.117.164 (111)
20:08:45.855807 IP hera-lan2.domain > middlinux.37325: 1862 2/1/0 CNAME www.prd.map.nytimes.com., CNAME nytimes.map.fastly.net. (153)
20:08:45.856025 IP middlinux.55194 > 151.101.117.164.https: Flags [S], seq 4012761542, win 64240, options [mss 1460,sackOK,TS val 526338639 ecr 0,nop,wscale 6], length 0
20:08:45.870925 IP 151.101.117.164.https > middlinux.55194: Flags [S.], seq 21696001, ack 4012761543, win 65535, options [mss 1460], length 0
20:08:45.870968 IP middlinux.55194 > 151.101.117.164.https: Flags [.], ack 1, win 64240, length 0
20:08:45.879039 IP middlinux.55194 > 151.101.117.164.https: Flags [P.], seq 1:518, ack 1, win 64240, length 517
20:08:45.879365 IP 151.101.117.164.https > middlinux.55194: Flags [.], ack 518, win 65535, length 0
20:08:45.898051 IP 151.101.117.164.https > middlinux.55194: Flags [.], seq 1:2921, ack 518, win 65535, length 2920
20:08:45.898071 IP middlinux.55194 > 151.101.117.164.https: Flags [.], ack 2921, win 62780, length 0
20:08:45.898541 IP 151.101.117.164.https > middlinux.55194: Flags [P.], seq 2921:5497, ack 518, win 65535, length 2576
20:08:45.898562 IP middlinux.55194 > 151.101.117.164.https: Flags [.], ack 5497, win 61320, length 0
20:08:45.898828 IP 151.101.117.164.https > middlinux.55194: Flags [P.], seq 5497:5607, ack 518, win 65535, length 110
20:08:45.898842 IP middlinux.55194 > 151.101.117.164.https: Flags [.], ack 5607, win 61210, length 0
20:08:45.900317 IP middlinux.53621 > hera-lan2.domain: 15658+ PTR? 2.253.233.140.in-addr.arpa. (44)
20:08:45.902099 IP middlinux.55194 > 151.101.117.164.https: Flags [P.], seq 518:611, ack 5607, win 62780, length 93
20:08:45.902424 IP 151.101.117.164.https > middlinux.55194: Flags [.], ack 611, win 65535, length 0
20:08:45.904387 IP hera-lan2.domain > middlinux.53621: 15658* 1/0/0 PTR hera-lan2.middlebury.edu. (82)
20:08:45.905144 IP middlinux.52066 > hera-lan2.domain: 22817+ PTR? 164.117.101.151.in-addr.arpa. (46)
20:08:45.916280 IP 151.101.117.164.https > middlinux.55194: Flags [P.], seq 5607:5658, ack 611, win 65535, length 51
20:08:45.916299 IP middlinux.55194 > 151.101.117.164.https: Flags [.], ack 5658, win 62780, length 0
20:08:45.916935 IP middlinux.55194 > 151.101.117.164.https: Flags [P.], seq 611:664, ack 5658, win 62780, length 53
20:08:45.916982 IP middlinux.55194 > 151.101.117.164.https: Flags [P.], seq 664:720, ack 5658, win 62780, length 56
20:08:45.917232 IP 151.101.117.164.https > middlinux.55194: Flags [.], ack 664, win 65535, length 0
20:08:45.917234 IP 151.101.117.164.https > middlinux.55194: Flags [.], ack 720, win 65535, length 0
20:08:45.917299 IP middlinux.55194 > 151.101.117.164.https: Flags [P.], seq 720:762, ack 5658, win 62780, length 42
20:08:45.917358 IP middlinux.55194 > 151.101.117.164.https: Flags [P.], seq 762:831, ack 5658, win 62780, length 69
20:08:45.917674 IP 151.101.117.164.https > middlinux.55194: Flags [.], ack 762, win 65535, length 0
20:08:45.917675 IP 151.101.117.164.https > middlinux.55194: Flags [.], ack 831, win 65535, length 0
20:08:45.930113 IP 151.101.117.164.https > middlinux.55194: Flags [P.], seq 5658:5753, ack 831, win 65535, length 95
20:08:45.930199 IP middlinux.55194 > 151.101.117.164.https: Flags [.], ack 5753, win 62780, length 0
20:08:45.930493 IP middlinux.55194 > 151.101.117.164.https: Flags [P.], seq 831:869, ack 5753, win 62780, length 38
20:08:45.930747 IP 151.101.117.164.https > middlinux.55194: Flags [.], ack 869, win 65535, length 0
20:08:45.935557 IP 151.101.117.164.https > middlinux.55194: Flags [P.], seq 5753:7127, ack 869, win 65535, length 1374
20:08:45.936586 IP 151.101.117.164.https > middlinux.55194: Flags [P.], seq 7127:11249, ack 869, win 65535, length 4122
20:08:45.936649 IP middlinux.55194 > 151.101.117.164.https: Flags [.], ack 11249, win 61320, length 0
20:08:45.937794 IP 151.101.117.164.https > middlinux.55194: Flags [P.], seq 11249:15371, ack 869, win 65535, length 4122
20:08:45.937797 IP 151.101.117.164.https > middlinux.55194: Flags [P.], seq 15371:18119, ack 869, win 65535, length 2748
20:08:45.937819 IP middlinux.55194 > 151.101.117.164.https: Flags [.], ack 15371, win 61320, length 0
20:08:45.938275 IP middlinux.55194 > 151.101.117.164.https: Flags [.], ack 18119, win 59860, length 0
20:08:45.939054 IP 151.101.117.164.https > middlinux.55194: Flags [P.], seq 18119:20867, ack 869, win 65535, length 2748
20:08:45.939078 IP middlinux.55194 > 151.101.117.164.https: Flags [.], ack 20867, win 62780, length 0
20:08:45.940270 IP 151.101.117.164.https > middlinux.55194: Flags [P.], seq 20867:24989, ack 869, win 65535, length 4122
20:08:45.940273 IP 151.101.117.164.https > middlinux.55194: Flags [P.], seq 24989:26363, ack 869, win 65535, length 1374
20:08:45.940528 IP middlinux.55194 > 151.101.117.164.https: Flags [.], ack 26363, win 61320, length 0
20:08:45.941682 IP 151.101.117.164.https > middlinux.55194: Flags [P.], seq 26363:33233, ack 869, win 65535, length 6870
20:08:45.941775 IP middlinux.55194 > 151.101.117.164.https: Flags [.], ack 33233, win 59860, length 0
20:08:45.942502 IP 151.101.117.164.https > middlinux.55194: Flags [P.], seq 33233:37355, ack 869, win 65535, length 4122
20:08:45.942517 IP middlinux.55194 > 151.101.117.164.https: Flags [.], ack 37355, win 61320, length 0
20:08:45.943901 IP 151.101.117.164.https > middlinux.55194: Flags [P.], seq 37355:41477, ack 869, win 65535, length 4122
20:08:45.943904 IP 151.101.117.164.https > middlinux.55194: Flags [P.], seq 41477:42851, ack 869, win 65535, length 1374
20:08:45.943925 IP middlinux.55194 > 151.101.117.164.https: Flags [.], ack 41477, win 61320, length 0
20:08:45.945458 IP 151.101.117.164.https > middlinux.55194: Flags [P.], seq 42851:48347, ack 869, win 65535, length 5496
20:08:45.945478 IP middlinux.55194 > 151.101.117.164.https: Flags [.], ack 48347, win 61320, length 0
20:08:45.947626 IP 151.101.117.164.https > middlinux.55194: Flags [P.], seq 48347:49721, ack 869, win 65535, length 1374
20:08:45.948916 IP 151.101.117.164.https > middlinux.55194: Flags [P.], seq 49721:51095, ack 869, win 65535, length 1374
20:08:45.948936 IP middlinux.55194 > 151.101.117.164.https: Flags [.], ack 51095, win 63204, length 0
20:08:45.949652 IP 151.101.117.164.https > middlinux.55194: Flags [P.], seq 51095:55217, ack 869, win 65535, length 4122
20:08:45.949941 IP 151.101.117.164.https > middlinux.55194: Flags [P.], seq 55217:57965, ack 869, win 65535, length 2748
20:08:45.950038 IP middlinux.55194 > 151.101.117.164.https: Flags [.], ack 57965, win 59860, length 0
20:08:45.951452 IP 151.101.117.164.https > middlinux.55194: Flags [P.], seq 57965:62087, ack 869, win 65535, length 4122
20:08:45.951458 IP 151.101.117.164.https > middlinux.55194: Flags [P.], seq 62087:67583, ack 869, win 65535, length 5496
20:08:45.951494 IP middlinux.55194 > 151.101.117.164.https: Flags [.], ack 62087, win 61320, length 0
20:08:45.951825 IP middlinux.55194 > 151.101.117.164.https: Flags [.], ack 67583, win 62780, length 0
20:08:45.953525 IP 151.101.117.164.https > middlinux.55194: Flags [.], seq 67583:70503, ack 869, win 65535, length 2920
20:08:45.953549 IP middlinux.55194 > 151.101.117.164.https: Flags [.], ack 70503, win 65535, length 0
20:08:45.953894 IP 151.101.117.164.https > middlinux.55194: Flags [P.], seq 70503:74453, ack 869, win 65535, length 3950
20:08:45.953897 IP 151.101.117.164.https > middlinux.55194: Flags [P.], seq 74453:75827, ack 869, win 65535, length 1374
20:08:45.953897 IP 151.101.117.164.https > middlinux.55194: Flags [P.], seq 75827:78575, ack 869, win 65535, length 2748
20:08:45.953898 IP 151.101.117.164.https > middlinux.55194: Flags [P.], seq 78575:79949, ack 869, win 65535, length 1374
20:08:45.953899 IP 151.101.117.164.https > middlinux.55194: Flags [P.], seq 79949:84071, ack 869, win 65535, length 4122
20:08:45.953920 IP middlinux.55194 > 151.101.117.164.https: Flags [.], ack 74453, win 65535, length 0
20:08:45.953957 IP middlinux.55194 > 151.101.117.164.https: Flags [.], ack 78575, win 65535, length 0
20:08:45.953974 IP middlinux.55194 > 151.101.117.164.https: Flags [.], ack 84071, win 65535, length 0
20:08:45.954296 IP 151.101.117.164.https > middlinux.55194: Flags [P.], seq 84071:88193, ack 869, win 65535, length 4122
20:08:45.954319 IP middlinux.55194 > 151.101.117.164.https: Flags [.], ack 88193, win 65535, length 0
20:08:45.958637 IP 151.101.117.164.https > middlinux.55194: Flags [P.], seq 88193:93689, ack 869, win 65535, length 5496
20:08:45.958650 IP 151.101.117.164.https > middlinux.55194: Flags [P.], seq 93689:104681, ack 869, win 65535, length 10992
20:08:45.958835 IP middlinux.55194 > 151.101.117.164.https: Flags [.], ack 93689, win 65535, length 0
20:08:45.958969 IP middlinux.55194 > 151.101.117.164.https: Flags [.], ack 104681, win 65535, length 0
20:08:45.959330 IP 151.101.117.164.https > middlinux.55194: Flags [P.], seq 104681:108803, ack 869, win 65535, length 4122
20:08:45.959331 IP 151.101.117.164.https > middlinux.55194: Flags [P.], seq 108803:111551, ack 869, win 65535, length 2748
20:08:45.959332 IP 151.101.117.164.https > middlinux.55194: Flags [P.], seq 111551:112925, ack 869, win 65535, length 1374
20:08:45.959332 IP 151.101.117.164.https > middlinux.55194: Flags [P.], seq 112925:115673, ack 869, win 65535, length 2748
20:08:45.959345 IP middlinux.55194 > 151.101.117.164.https: Flags [.], ack 108803, win 65535, length 0
20:08:45.959373 IP middlinux.55194 > 151.101.117.164.https: Flags [.], ack 111551, win 65535, length 0
20:08:45.959387 IP middlinux.55194 > 151.101.117.164.https: Flags [.], ack 115673, win 65535, length 0
20:08:45.959411 IP 151.101.117.164.https > middlinux.55194: Flags [P.], seq 115673:118421, ack 869, win 65535, length 2748
20:08:45.959412 IP 151.101.117.164.https > middlinux.55194: Flags [P.], seq 118421:121169, ack 869, win 65535, length 2748
20:08:45.959413 IP 151.101.117.164.https > middlinux.55194: Flags [P.], seq 121169:123917, ack 869, win 65535, length 2748
20:08:45.959418 IP middlinux.55194 > 151.101.117.164.https: Flags [.], ack 118421, win 65535, length 0
20:08:45.959425 IP middlinux.55194 > 151.101.117.164.https: Flags [.], ack 121169, win 65535, length 0
20:08:45.959432 IP middlinux.55194 > 151.101.117.164.https: Flags [.], ack 123917, win 65535, length 0
20:08:45.959760 IP 151.101.117.164.https > middlinux.55194: Flags [P.], seq 123917:125291, ack 869, win 65535, length 1374
20:08:45.962188 IP 151.101.117.164.https > middlinux.55194: Flags [P.], seq 125291:132161, ack 869, win 65535, length 6870
20:08:45.962192 IP 151.101.117.164.https > middlinux.55194: Flags [P.], seq 132161:134909, ack 869, win 65535, length 2748
20:08:45.962285 IP middlinux.55194 > 151.101.117.164.https: Flags [.], ack 132161, win 65535, length 0
20:08:45.962340 IP middlinux.55194 > 151.101.117.164.https: Flags [.], ack 134909, win 65535, length 0
20:08:45.962525 IP 151.101.117.164.https > middlinux.55194: Flags [P.], seq 134909:137657, ack 869, win 65535, length 2748
20:08:45.962527 IP 151.101.117.164.https > middlinux.55194: Flags [P.], seq 137657:140405, ack 869, win 65535, length 2748
20:08:45.962528 IP 151.101.117.164.https > middlinux.55194: Flags [P.], seq 140405:141779, ack 869, win 65535, length 1374
20:08:45.962542 IP middlinux.55194 > 151.101.117.164.https: Flags [.], ack 137657, win 65535, length 0
20:08:45.962561 IP middlinux.55194 > 151.101.117.164.https: Flags [.], ack 140405, win 65535, length 0
20:08:45.962660 IP 151.101.117.164.https > middlinux.55194: Flags [P.], seq 141779:144527, ack 869, win 65535, length 2748
20:08:45.962665 IP middlinux.55194 > 151.101.117.164.https: Flags [.], ack 144527, win 65535, length 0
20:08:45.964157 IP 151.101.117.164.https > middlinux.55194: Flags [P.], seq 144527:145901, ack 869, win 65535, length 1374
20:08:45.965217 IP 151.101.117.164.https > middlinux.55194: Flags [P.], seq 145901:151397, ack 869, win 65535, length 5496
20:08:45.965489 IP 151.101.117.164.https > middlinux.55194: Flags [P.], seq 151397:154145, ack 869, win 65535, length 2748
20:08:45.965514 IP middlinux.55194 > 151.101.117.164.https: Flags [.], ack 151397, win 65535, length 0
20:08:45.965718 IP middlinux.55194 > 151.101.117.164.https: Flags [.], ack 154145, win 65535, length 0
20:08:45.965942 IP 151.101.117.164.https > middlinux.55194: Flags [P.], seq 154145:158267, ack 869, win 65535, length 4122
20:08:45.966038 IP 151.101.117.164.https > middlinux.55194: Flags [P.], seq 158267:162389, ack 869, win 65535, length 4122
20:08:45.966039 IP 151.101.117.164.https > middlinux.55194: Flags [P.], seq 162389:166511, ack 869, win 65535, length 4122
20:08:45.966063 IP middlinux.55194 > 151.101.117.164.https: Flags [.], ack 158267, win 65535, length 0
20:08:45.966095 IP middlinux.55194 > 151.101.117.164.https: Flags [.], ack 162389, win 65535, length 0
20:08:45.966108 IP middlinux.55194 > 151.101.117.164.https: Flags [.], ack 166511, win 65535, length 0
20:08:45.966137 IP 151.101.117.164.https > middlinux.55194: Flags [P.], seq 166511:170633, ack 869, win 65535, length 4122
20:08:45.966143 IP middlinux.55194 > 151.101.117.164.https: Flags [.], ack 170633, win 65535, length 0
20:08:45.966533 IP 151.101.117.164.https > middlinux.55194: Flags [P.], seq 170633:173381, ack 869, win 65535, length 2748
20:08:45.966550 IP middlinux.55194 > 151.101.117.164.https: Flags [.], ack 173381, win 65535, length 0
20:08:45.967638 IP 151.101.117.164.https > middlinux.55194: Flags [P.], seq 173381:176129, ack 869, win 65535, length 2748
20:08:45.967642 IP 151.101.117.164.https > middlinux.55194: Flags [P.], seq 176129:182999, ack 869, win 65535, length 6870
20:08:45.967671 IP middlinux.55194 > 151.101.117.164.https: Flags [.], ack 176129, win 65535, length 0
20:08:45.967783 IP middlinux.55194 > 151.101.117.164.https: Flags [.], ack 182999, win 65535, length 0
20:08:45.968043 IP 151.101.117.164.https > middlinux.55194: Flags [P.], seq 182999:184373, ack 869, win 65535, length 1374
20:08:45.968045 IP 151.101.117.164.https > middlinux.55194: Flags [P.], seq 184373:187121, ack 869, win 65535, length 2748
20:08:45.968063 IP middlinux.55194 > 151.101.117.164.https: Flags [.], ack 187121, win 65535, length 0
20:08:45.968664 IP 151.101.117.164.https > middlinux.55194: Flags [P.], seq 187121:191243, ack 869, win 65535, length 4122
20:08:45.968666 IP 151.101.117.164.https > middlinux.55194: Flags [P.], seq 191243:192617, ack 869, win 65535, length 1374
20:08:45.968667 IP 151.101.117.164.https > middlinux.55194: Flags [P.], seq 192617:195365, ack 869, win 65535, length 2748
20:08:45.968668 IP 151.101.117.164.https > middlinux.55194: Flags [P.], seq 195365:196739, ack 869, win 65535, length 1374
20:08:45.968830 IP middlinux.55194 > 151.101.117.164.https: Flags [.], ack 191243, win 65535, length 0
20:08:45.968883 IP middlinux.55194 > 151.101.117.164.https: Flags [.], ack 195365, win 65535, length 0
20:08:45.969521 IP 151.101.117.164.https > middlinux.55194: Flags [P.], seq 196739:199487, ack 869, win 65535, length 2748
20:08:45.969525 IP 151.101.117.164.https > middlinux.55194: Flags [P.], seq 199487:203609, ack 869, win 65535, length 4122
20:08:45.969526 IP 151.101.117.164.https > middlinux.55194: Flags [P.], seq 203609:207731, ack 869, win 65535, length 4122
20:08:45.969544 IP middlinux.55194 > 151.101.117.164.https: Flags [.], ack 199487, win 65535, length 0
20:08:45.969707 IP middlinux.55194 > 151.101.117.164.https: Flags [.], ack 203609, win 65535, length 0
20:08:45.969762 IP middlinux.55194 > 151.101.117.164.https: Flags [.], ack 207731, win 65535, length 0
20:08:45.969782 IP 151.101.117.164.https > middlinux.55194: Flags [P.], seq 207731:209105, ack 869, win 65535, length 1374
20:08:45.971903 IP 151.101.117.164.https > middlinux.55194: Flags [P.], seq 209105:213227, ack 869, win 65535, length 4122
20:08:45.971921 IP 151.101.117.164.https > middlinux.55194: Flags [P.], seq 213227:218723, ack 869, win 65535, length 5496
20:08:45.972053 IP middlinux.55194 > 151.101.117.164.https: Flags [.], ack 213227, win 65535, length 0
20:08:45.973106 IP middlinux.55194 > 151.101.117.164.https: Flags [.], ack 218723, win 65535, length 0
20:08:45.974062 IP 151.101.117.164.https > middlinux.55194: Flags [P.], seq 218723:231089, ack 869, win 65535, length 12366
20:08:45.974160 IP middlinux.55194 > 151.101.117.164.https: Flags [.], ack 231089, win 65535, length 0
20:08:45.974255 IP 151.101.117.164.https > middlinux.55194: Flags [P.], seq 231089:247577, ack 869, win 65535, length 16488
20:08:45.974270 IP middlinux.55194 > 151.101.117.164.https: Flags [.], ack 247577, win 65535, length 0
20:08:45.974399 IP 151.101.117.164.https > middlinux.55194: Flags [P.], seq 247577:255821, ack 869, win 65535, length 8244
20:08:45.974412 IP middlinux.55194 > 151.101.117.164.https: Flags [.], ack 255821, win 65535, length 0
20:08:45.976823 IP 151.101.117.164.https > middlinux.55194: Flags [P.], seq 255821:259943, ack 869, win 65535, length 4122
20:08:45.976827 IP 151.101.117.164.https > middlinux.55194: Flags [P.], seq 259943:261317, ack 869, win 65535, length 1374
20:08:45.976829 IP 151.101.117.164.https > middlinux.55194: Flags [P.], seq 261317:269561, ack 869, win 65535, length 8244
20:08:45.976857 IP middlinux.55194 > 151.101.117.164.https: Flags [.], ack 259943, win 65535, length 0
20:08:45.976909 IP middlinux.55194 > 151.101.117.164.https: Flags [.], ack 269561, win 65535, length 0
20:08:45.977026 IP 151.101.117.164.https > middlinux.55194: Flags [P.], seq 269561:273683, ack 869, win 65535, length 4122
20:08:45.977029 IP 151.101.117.164.https > middlinux.55194: Flags [P.], seq 273683:275057, ack 869, win 65535, length 1374
20:08:45.977047 IP middlinux.55194 > 151.101.117.164.https: Flags [.], ack 273683, win 65535, length 0
20:08:45.977392 IP 151.101.117.164.https > middlinux.55194: Flags [P.], seq 275057:277805, ack 869, win 65535, length 2748
20:08:45.977394 IP 151.101.117.164.https > middlinux.55194: Flags [P.], seq 277805:279179, ack 869, win 65535, length 1374
20:08:45.977395 IP 151.101.117.164.https > middlinux.55194: Flags [P.], seq 279179:281927, ack 869, win 65535, length 2748
20:08:45.977396 IP 151.101.117.164.https > middlinux.55194: Flags [P.], seq 281927:284675, ack 869, win 65535, length 2748
20:08:45.977438 IP middlinux.55194 > 151.101.117.164.https: Flags [.], ack 277805, win 65535, length 0
20:08:45.977462 IP middlinux.55194 > 151.101.117.164.https: Flags [.], ack 281927, win 65535, length 0
20:08:45.977509 IP middlinux.55194 > 151.101.117.164.https: Flags [.], ack 284675, win 65535, length 0
20:08:45.977791 IP 151.101.117.164.https > middlinux.55194: Flags [P.], seq 284675:287423, ack 869, win 65535, length 2748
20:08:45.977792 IP 151.101.117.164.https > middlinux.55194: Flags [P.], seq 287423:288797, ack 869, win 65535, length 1374
20:08:45.977794 IP 151.101.117.164.https > middlinux.55194: Flags [P.], seq 288797:292919, ack 869, win 65535, length 4122
20:08:45.977806 IP middlinux.55194 > 151.101.117.164.https: Flags [.], ack 287423, win 65535, length 0
20:08:45.977825 IP middlinux.55194 > 151.101.117.164.https: Flags [.], ack 292919, win 65535, length 0
20:08:45.978010 IP 151.101.117.164.https > middlinux.55194: Flags [P.], seq 292919:295667, ack 869, win 65535, length 2748
20:08:45.978020 IP middlinux.55194 > 151.101.117.164.https: Flags [.], ack 295667, win 65535, length 0
20:08:45.978150 IP 151.101.117.164.https > middlinux.55194: Flags [P.], seq 295667:298415, ack 869, win 65535, length 2748
20:08:45.978173 IP middlinux.55194 > 151.101.117.164.https: Flags [.], ack 298415, win 65535, length 0
20:08:45.978295 IP 151.101.117.164.https > middlinux.55194: Flags [P.], seq 298415:301163, ack 869, win 65535, length 2748
20:08:45.978304 IP middlinux.55194 > 151.101.117.164.https: Flags [.], ack 301163, win 65535, length 0
20:08:45.978484 IP 151.101.117.164.https > middlinux.55194: Flags [P.], seq 301163:302537, ack 869, win 65535, length 1374
20:08:45.979114 IP 151.101.117.164.https > middlinux.55194: Flags [P.], seq 302537:305285, ack 869, win 65535, length 2748
20:08:45.979117 IP 151.101.117.164.https > middlinux.55194: Flags [P.], seq 305285:308033, ack 869, win 65535, length 2748
20:08:45.979182 IP middlinux.55194 > 151.101.117.164.https: Flags [.], ack 305285, win 65535, length 0
20:08:45.979250 IP middlinux.55194 > 151.101.117.164.https: Flags [.], ack 308033, win 65535, length 0
20:08:45.979460 IP 151.101.117.164.https > middlinux.55194: Flags [P.], seq 308033:310781, ack 869, win 65535, length 2748
20:08:45.979462 IP 151.101.117.164.https > middlinux.55194: Flags [P.], seq 310781:313529, ack 869, win 65535, length 2748
20:08:45.979475 IP middlinux.55194 > 151.101.117.164.https: Flags [.], ack 310781, win 65535, length 0
20:08:45.979494 IP middlinux.55194 > 151.101.117.164.https: Flags [.], ack 313529, win 65535, length 0
20:08:45.979601 IP 151.101.117.164.https > middlinux.55194: Flags [P.], seq 313529:314903, ack 869, win 65535, length 1374
20:08:45.979808 IP 151.101.117.164.https > middlinux.55194: Flags [P.], seq 314903:317651, ack 869, win 65535, length 2748
20:08:45.979809 IP 151.101.117.164.https > middlinux.55194: Flags [P.], seq 317651:320399, ack 869, win 65535, length 2748
20:08:45.979820 IP middlinux.55194 > 151.101.117.164.https: Flags [.], ack 317651, win 65535, length 0
20:08:45.979882 IP middlinux.55194 > 151.101.117.164.https: Flags [.], ack 320399, win 65535, length 0
20:08:45.980020 IP 151.101.117.164.https > middlinux.55194: Flags [P.], seq 320399:321773, ack 869, win 65535, length 1374
20:08:45.980711 IP 151.101.117.164.https > middlinux.55194: Flags [P.], seq 321773:324521, ack 869, win 65535, length 2748
20:08:45.980726 IP middlinux.55194 > 151.101.117.164.https: Flags [.], ack 324521, win 65535, length 0
20:08:45.981053 IP 151.101.117.164.https > middlinux.55194: Flags [P.], seq 324521:327269, ack 869, win 65535, length 2748
20:08:45.981056 IP 151.101.117.164.https > middlinux.55194: Flags [P.], seq 327269:330017, ack 869, win 65535, length 2748
20:08:45.981057 IP 151.101.117.164.https > middlinux.55194: Flags [.], seq 330017:331477, ack 869, win 65535, length 1460
20:08:45.981072 IP middlinux.55194 > 151.101.117.164.https: Flags [.], ack 327269, win 65535, length 0
20:08:45.981097 IP middlinux.55194 > 151.101.117.164.https: Flags [.], ack 330017, win 65535, length 0
20:08:45.981229 IP 151.101.117.164.https > middlinux.55194: Flags [P.], seq 331477:332765, ack 869, win 65535, length 1288
20:08:45.981232 IP 151.101.117.164.https > middlinux.55194: Flags [P.], seq 332765:334139, ack 869, win 65535, length 1374
20:08:45.981303 IP middlinux.55194 > 151.101.117.164.https: Flags [.], ack 334139, win 65535, length 0
20:08:45.981457 IP 151.101.117.164.https > middlinux.55194: Flags [P.], seq 334139:336887, ack 869, win 65535, length 2748
20:08:45.981465 IP middlinux.55194 > 151.101.117.164.https: Flags [.], ack 336887, win 65535, length 0
20:08:45.981710 IP 151.101.117.164.https > middlinux.55194: Flags [P.], seq 336887:341009, ack 869, win 65535, length 4122
20:08:45.981712 IP 151.101.117.164.https > middlinux.55194: Flags [P.], seq 341009:343757, ack 869, win 65535, length 2748
20:08:45.981725 IP middlinux.55194 > 151.101.117.164.https: Flags [.], ack 341009, win 65535, length 0
20:08:45.981781 IP middlinux.55194 > 151.101.117.164.https: Flags [.], ack 343757, win 65535, length 0
20:08:45.982147 IP 151.101.117.164.https > middlinux.55194: Flags [P.], seq 343757:346505, ack 869, win 65535, length 2748
20:08:45.982157 IP middlinux.55194 > 151.101.117.164.https: Flags [.], ack 346505, win 65535, length 0
20:08:45.982377 IP 151.101.117.164.https > middlinux.55194: Flags [P.], seq 346505:349253, ack 869, win 65535, length 2748
20:08:45.982387 IP middlinux.55194 > 151.101.117.164.https: Flags [.], ack 349253, win 65535, length 0
20:08:45.983811 IP 151.101.117.164.https > middlinux.55194: Flags [P.], seq 349253:356123, ack 869, win 65535, length 6870
20:08:45.983815 IP 151.101.117.164.https > middlinux.55194: Flags [P.], seq 356123:358871, ack 869, win 65535, length 2748
20:08:45.983894 IP middlinux.55194 > 151.101.117.164.https: Flags [.], ack 356123, win 65535, length 0
20:08:45.984389 IP middlinux.55194 > 151.101.117.164.https: Flags [.], ack 358871, win 65535, length 0
20:08:45.984682 IP 151.101.117.164.https > middlinux.55194: Flags [P.], seq 358871:373985, ack 869, win 65535, length 15114
20:08:45.984699 IP middlinux.55194 > 151.101.117.164.https: Flags [.], ack 373985, win 65535, length 0
20:08:45.984737 IP 151.101.117.164.https > middlinux.55194: Flags [P.], seq 373985:380855, ack 869, win 65535, length 6870
20:08:45.984739 IP 151.101.117.164.https > middlinux.55194: Flags [P.], seq 380855:382229, ack 869, win 65535, length 1374
20:08:45.984739 IP 151.101.117.164.https > middlinux.55194: Flags [P.], seq 382229:384977, ack 869, win 65535, length 2748
20:08:45.984751 IP middlinux.55194 > 151.101.117.164.https: Flags [.], ack 380855, win 65535, length 0
20:08:45.984767 IP middlinux.55194 > 151.101.117.164.https: Flags [.], ack 384977, win 65535, length 0
20:08:45.985487 IP 151.101.117.164.https > middlinux.55194: Flags [P.], seq 384977:391847, ack 869, win 65535, length 6870
20:08:45.985566 IP middlinux.55194 > 151.101.117.164.https: Flags [.], ack 391847, win 65535, length 0
20:08:45.985705 IP 151.101.117.164.https > middlinux.55194: Flags [P.], seq 391847:394595, ack 869, win 65535, length 2748
20:08:45.985717 IP middlinux.55194 > 151.101.117.164.https: Flags [.], ack 394595, win 65535, length 0
20:08:45.986157 IP 151.101.117.164.https > middlinux.55194: Flags [P.], seq 394595:397343, ack 869, win 65535, length 2748
20:08:45.986160 IP 151.101.117.164.https > middlinux.55194: Flags [P.], seq 397343:400091, ack 869, win 65535, length 2748
20:08:45.986161 IP 151.101.117.164.https > middlinux.55194: Flags [P.], seq 400091:402839, ack 869, win 65535, length 2748
20:08:45.986162 IP 151.101.117.164.https > middlinux.55194: Flags [P.], seq 402839:405587, ack 869, win 65535, length 2748
20:08:45.986182 IP middlinux.55194 > 151.101.117.164.https: Flags [.], ack 397343, win 65535, length 0
20:08:45.986208 IP middlinux.55194 > 151.101.117.164.https: Flags [.], ack 400091, win 65535, length 0
20:08:45.986219 IP middlinux.55194 > 151.101.117.164.https: Flags [.], ack 402839, win 65535, length 0
20:08:45.986227 IP middlinux.55194 > 151.101.117.164.https: Flags [.], ack 405587, win 65535, length 0
20:08:45.987757 IP 151.101.117.164.https > middlinux.55194: Flags [P.], seq 405587:408335, ack 869, win 65535, length 2748
20:08:45.987763 IP 151.101.117.164.https > middlinux.55194: Flags [.], seq 408335:420015, ack 869, win 65535, length 11680
20:08:45.987788 IP middlinux.55194 > 151.101.117.164.https: Flags [.], ack 408335, win 65535, length 0
20:08:45.987829 IP middlinux.55194 > 151.101.117.164.https: Flags [.], ack 420015, win 65535, length 0
20:08:45.988402 IP 151.101.117.164.https > middlinux.55194: Flags [P.], seq 420015:420701, ack 869, win 65535, length 686
20:08:45.988441 IP 151.101.117.164.https > middlinux.55194: Flags [P.], seq 420701:423449, ack 869, win 65535, length 2748
20:08:45.988510 IP middlinux.55194 > 151.101.117.164.https: Flags [.], ack 423449, win 65535, length 0
20:08:45.989326 IP 151.101.117.164.https > middlinux.55194: Flags [P.], seq 423449:428945, ack 869, win 65535, length 5496
20:08:45.989328 IP 151.101.117.164.https > middlinux.55194: Flags [P.], seq 428945:431693, ack 869, win 65535, length 2748
20:08:45.989329 IP 151.101.117.164.https > middlinux.55194: Flags [P.], seq 431693:433067, ack 869, win 65535, length 1374
20:08:45.989329 IP 151.101.117.164.https > middlinux.55194: Flags [P.], seq 433067:434441, ack 869, win 65535, length 1374
20:08:45.989345 IP middlinux.55194 > 151.101.117.164.https: Flags [.], ack 428945, win 65535, length 0
20:08:45.989685 IP middlinux.55194 > 151.101.117.164.https: Flags [.], ack 431693, win 65535, length 0
20:08:45.989916 IP middlinux.55194 > 151.101.117.164.https: Flags [.], ack 434441, win 65535, length 0
20:08:45.989955 IP 151.101.117.164.https > middlinux.55194: Flags [P.], seq 434441:438563, ack 869, win 65535, length 4122
20:08:45.989957 IP 151.101.117.164.https > middlinux.55194: Flags [P.], seq 438563:441311, ack 869, win 65535, length 2748
20:08:45.989958 IP 151.101.117.164.https > middlinux.55194: Flags [P.], seq 441311:444059, ack 869, win 65535, length 2748
20:08:45.989959 IP 151.101.117.164.https > middlinux.55194: Flags [P.], seq 444059:446807, ack 869, win 65535, length 2748
20:08:45.989967 IP middlinux.55194 > 151.101.117.164.https: Flags [.], ack 438563, win 65535, length 0
20:08:45.989983 IP middlinux.55194 > 151.101.117.164.https: Flags [.], ack 441311, win 65535, length 0
20:08:45.990179 IP middlinux.55194 > 151.101.117.164.https: Flags [.], ack 444059, win 65535, length 0
20:08:45.990614 IP middlinux.55194 > 151.101.117.164.https: Flags [.], ack 446807, win 65535, length 0
20:08:45.991166 IP 151.101.117.164.https > middlinux.55194: Flags [P.], seq 446807:448181, ack 869, win 65535, length 1374
20:08:45.991169 IP 151.101.117.164.https > middlinux.55194: Flags [P.], seq 448181:452303, ack 869, win 65535, length 4122
20:08:45.991170 IP 151.101.117.164.https > middlinux.55194: Flags [P.], seq 452303:453677, ack 869, win 65535, length 1374
20:08:45.991172 IP 151.101.117.164.https > middlinux.55194: Flags [P.], seq 453677:456425, ack 869, win 65535, length 2748
20:08:45.991173 IP 151.101.117.164.https > middlinux.55194: Flags [P.], seq 456425:460547, ack 869, win 65535, length 4122
20:08:45.991197 IP middlinux.55194 > 151.101.117.164.https: Flags [.], ack 452303, win 65535, length 0
20:08:45.991488 IP middlinux.55194 > 151.101.117.164.https: Flags [.], ack 456425, win 65535, length 0
20:08:45.991561 IP middlinux.55194 > 151.101.117.164.https: Flags [.], ack 460547, win 65535, length 0
20:08:45.992005 IP 151.101.117.164.https > middlinux.55194: Flags [P.], seq 460547:463295, ack 869, win 65535, length 2748
20:08:45.992008 IP 151.101.117.164.https > middlinux.55194: Flags [P.], seq 463295:466043, ack 869, win 65535, length 2748
20:08:45.992009 IP 151.101.117.164.https > middlinux.55194: Flags [P.], seq 466043:470165, ack 869, win 65535, length 4122
20:08:45.992010 IP 151.101.117.164.https > middlinux.55194: Flags [P.], seq 470165:472913, ack 869, win 65535, length 2748
20:08:45.992028 IP middlinux.55194 > 151.101.117.164.https: Flags [.], ack 463295, win 65535, length 0
20:08:45.992051 IP middlinux.55194 > 151.101.117.164.https: Flags [.], ack 466043, win 65535, length 0
20:08:45.992060 IP middlinux.55194 > 151.101.117.164.https: Flags [.], ack 470165, win 65535, length 0
20:08:45.992068 IP middlinux.55194 > 151.101.117.164.https: Flags [.], ack 472913, win 65535, length 0
20:08:45.992087 IP 151.101.117.164.https > middlinux.55194: Flags [P.], seq 472913:478409, ack 869, win 65535, length 5496
20:08:45.992088 IP 151.101.117.164.https > middlinux.55194: Flags [P.], seq 478409:481157, ack 869, win 65535, length 2748
20:08:45.992089 IP 151.101.117.164.https > middlinux.55194: Flags [P.], seq 481157:485279, ack 869, win 65535, length 4122
20:08:45.992099 IP middlinux.55194 > 151.101.117.164.https: Flags [.], ack 478409, win 65535, length 0
20:08:45.992114 IP middlinux.55194 > 151.101.117.164.https: Flags [.], ack 481157, win 65535, length 0
20:08:45.992191 IP middlinux.55194 > 151.101.117.164.https: Flags [.], ack 485279, win 65535, length 0
20:08:45.992278 IP 151.101.117.164.https > middlinux.55194: Flags [P.], seq 485279:488027, ack 869, win 65535, length 2748
20:08:45.992280 IP 151.101.117.164.https > middlinux.55194: Flags [P.], seq 488027:490775, ack 869, win 65535, length 2748
20:08:45.992281 IP 151.101.117.164.https > middlinux.55194: Flags [P.], seq 490775:492149, ack 869, win 65535, length 1374
20:08:45.992296 IP middlinux.55194 > 151.101.117.164.https: Flags [.], ack 488027, win 65535, length 0
20:08:45.992314 IP middlinux.55194 > 151.101.117.164.https: Flags [.], ack 490775, win 65535, length 0
20:08:45.993163 IP 151.101.117.164.https > middlinux.55194: Flags [P.], seq 492149:496271, ack 869, win 65535, length 4122
20:08:45.993164 IP 151.101.117.164.https > middlinux.55194: Flags [P.], seq 496271:499019, ack 869, win 65535, length 2748
20:08:45.993165 IP 151.101.117.164.https > middlinux.55194: Flags [P.], seq 499019:500393, ack 869, win 65535, length 1374
20:08:45.993166 IP 151.101.117.164.https > middlinux.55194: Flags [P.], seq 500393:503141, ack 869, win 65535, length 2748
20:08:45.993219 IP middlinux.55194 > 151.101.117.164.https: Flags [.], ack 496271, win 65535, length 0
20:08:45.993268 IP middlinux.55194 > 151.101.117.164.https: Flags [.], ack 499019, win 65535, length 0
20:08:45.993282 IP middlinux.55194 > 151.101.117.164.https: Flags [.], ack 503141, win 65535, length 0
20:08:45.993312 IP 151.101.117.164.https > middlinux.55194: Flags [P.], seq 503141:508637, ack 869, win 65535, length 5496
20:08:45.993363 IP middlinux.55194 > 151.101.117.164.https: Flags [.], ack 508637, win 65535, length 0
20:08:45.993841 IP 151.101.117.164.https > middlinux.55194: Flags [P.], seq 508637:511385, ack 869, win 65535, length 2748
20:08:45.993843 IP 151.101.117.164.https > middlinux.55194: Flags [P.], seq 511385:512759, ack 869, win 65535, length 1374
20:08:45.993845 IP 151.101.117.164.https > middlinux.55194: Flags [P.], seq 512759:516881, ack 869, win 65535, length 4122
20:08:45.993846 IP 151.101.117.164.https > middlinux.55194: Flags [P.], seq 516881:518255, ack 869, win 65535, length 1374
20:08:45.993870 IP middlinux.55194 > 151.101.117.164.https: Flags [.], ack 511385, win 65535, length 0
20:08:45.994098 IP middlinux.55194 > 151.101.117.164.https: Flags [.], ack 516881, win 65535, length 0
20:08:45.994396 IP 151.101.117.164.https > middlinux.55194: Flags [P.], seq 518255:521003, ack 869, win 65535, length 2748
20:08:45.994398 IP 151.101.117.164.https > middlinux.55194: Flags [P.], seq 521003:526499, ack 869, win 65535, length 5496
20:08:45.994400 IP 151.101.117.164.https > middlinux.55194: Flags [P.], seq 526499:527873, ack 869, win 65535, length 1374
20:08:45.994413 IP middlinux.55194 > 151.101.117.164.https: Flags [.], ack 521003, win 65535, length 0
20:08:45.994429 IP middlinux.55194 > 151.101.117.164.https: Flags [.], ack 526499, win 65535, length 0
20:08:45.995376 IP 151.101.117.164.https > middlinux.55194: Flags [P.], seq 527873:531995, ack 869, win 65535, length 4122
20:08:45.995379 IP 151.101.117.164.https > middlinux.55194: Flags [P.], seq 531995:533369, ack 869, win 65535, length 1374
20:08:45.995380 IP 151.101.117.164.https > middlinux.55194: Flags [P.], seq 533369:536117, ack 869, win 65535, length 2748
20:08:45.995381 IP 151.101.117.164.https > middlinux.55194: Flags [P.], seq 536117:538865, ack 869, win 65535, length 2748
20:08:45.995401 IP middlinux.55194 > 151.101.117.164.https: Flags [.], ack 531995, win 65535, length 0
20:08:45.995623 IP middlinux.55194 > 151.101.117.164.https: Flags [.], ack 536117, win 65535, length 0
20:08:45.995982 IP middlinux.55194 > 151.101.117.164.https: Flags [.], ack 538865, win 65535, length 0
20:08:45.998180 IP 151.101.117.164.https > middlinux.55194: Flags [P.], seq 538865:541613, ack 869, win 65535, length 2748
20:08:45.998184 IP 151.101.117.164.https > middlinux.55194: Flags [P.], seq 541613:544361, ack 869, win 65535, length 2748
20:08:45.998186 IP 151.101.117.164.https > middlinux.55194: Flags [P.], seq 544361:547109, ack 869, win 65535, length 2748
20:08:45.998187 IP 151.101.117.164.https > middlinux.55194: Flags [P.], seq 547109:552605, ack 869, win 65535, length 5496
20:08:45.998217 IP middlinux.55194 > 151.101.117.164.https: Flags [.], ack 541613, win 65535, length 0
20:08:45.998254 IP middlinux.55194 > 151.101.117.164.https: Flags [.], ack 544361, win 65535, length 0
20:08:45.998269 IP middlinux.55194 > 151.101.117.164.https: Flags [.], ack 547109, win 65535, length 0
20:08:45.998278 IP middlinux.55194 > 151.101.117.164.https: Flags [.], ack 552605, win 65535, length 0
20:08:45.998304 IP 151.101.117.164.https > middlinux.55194: Flags [P.], seq 552605:556727, ack 869, win 65535, length 4122
20:08:45.998305 IP 151.101.117.164.https > middlinux.55194: Flags [P.], seq 556727:559475, ack 869, win 65535, length 2748
20:08:45.998306 IP 151.101.117.164.https > middlinux.55194: Flags [P.], seq 559475:563597, ack 869, win 65535, length 4122
20:08:45.998349 IP middlinux.55194 > 151.101.117.164.https: Flags [.], ack 556727, win 65535, length 0
20:08:45.998641 IP middlinux.55194 > 151.101.117.164.https: Flags [.], ack 559475, win 65535, length 0
20:08:45.998683 IP middlinux.55194 > 151.101.117.164.https: Flags [.], ack 563597, win 65535, length 0
20:08:45.998763 IP 151.101.117.164.https > middlinux.55194: Flags [P.], seq 563597:570467, ack 869, win 65535, length 6870
20:08:45.998765 IP 151.101.117.164.https > middlinux.55194: Flags [P.], seq 570467:573215, ack 869, win 65535, length 2748
20:08:45.998768 IP 151.101.117.164.https > middlinux.55194: Flags [P.], seq 573215:585581, ack 869, win 65535, length 12366
20:08:45.998781 IP middlinux.55194 > 151.101.117.164.https: Flags [.], ack 570467, win 65535, length 0
20:08:45.998802 IP middlinux.55194 > 151.101.117.164.https: Flags [.], ack 573215, win 65535, length 0
20:08:45.998814 IP middlinux.55194 > 151.101.117.164.https: Flags [.], ack 585581, win 65535, length 0
20:08:45.999597 IP 151.101.117.164.https > middlinux.55194: Flags [P.], seq 585581:591077, ack 869, win 65535, length 5496
20:08:45.999618 IP middlinux.55194 > 151.101.117.164.https: Flags [.], ack 591077, win 65535, length 0
20:08:45.999969 IP 151.101.117.164.https > middlinux.55194: Flags [P.], seq 591077:595199, ack 869, win 65535, length 4122
20:08:45.999974 IP 151.101.117.164.https > middlinux.55194: Flags [P.], seq 595199:599321, ack 869, win 65535, length 4122
20:08:45.999976 IP 151.101.117.164.https > middlinux.55194: Flags [P.], seq 599321:604817, ack 869, win 65535, length 5496
20:08:45.999999 IP middlinux.55194 > 151.101.117.164.https: Flags [.], ack 595199, win 65535, length 0
20:08:46.000063 IP middlinux.55194 > 151.101.117.164.https: Flags [.], ack 599321, win 65535, length 0
20:08:46.000110 IP middlinux.55194 > 151.101.117.164.https: Flags [.], ack 604817, win 65535, length 0
20:08:46.000135 IP 151.101.117.164.https > middlinux.55194: Flags [P.], seq 604817:608939, ack 869, win 65535, length 4122
20:08:46.000140 IP middlinux.55194 > 151.101.117.164.https: Flags [.], ack 608939, win 65535, length 0
20:08:46.001450 IP 151.101.117.164.https > middlinux.55194: Flags [P.], seq 608939:611687, ack 869, win 65535, length 2748
20:08:46.001452 IP 151.101.117.164.https > middlinux.55194: Flags [P.], seq 611687:614435, ack 869, win 65535, length 2748
20:08:46.001452 IP 151.101.117.164.https > middlinux.55194: Flags [P.], seq 614435:617183, ack 869, win 65535, length 2748
20:08:46.001453 IP 151.101.117.164.https > middlinux.55194: Flags [P.], seq 617183:619931, ack 869, win 65535, length 2748
20:08:46.001470 IP middlinux.55194 > 151.101.117.164.https: Flags [.], ack 611687, win 65535, length 0
20:08:46.001500 IP middlinux.55194 > 151.101.117.164.https: Flags [.], ack 614435, win 65535, length 0
20:08:46.001516 IP middlinux.55194 > 151.101.117.164.https: Flags [.], ack 617183, win 65535, length 0
20:08:46.001528 IP middlinux.55194 > 151.101.117.164.https: Flags [.], ack 619931, win 65535, length 0
20:08:46.001546 IP 151.101.117.164.https > middlinux.55194: Flags [P.], seq 619931:622679, ack 869, win 65535, length 2748
20:08:46.001547 IP 151.101.117.164.https > middlinux.55194: Flags [P.], seq 622679:625427, ack 869, win 65535, length 2748
20:08:46.001548 IP 151.101.117.164.https > middlinux.55194: Flags [P.], seq 625427:628175, ack 869, win 65535, length 2748
20:08:46.001549 IP 151.101.117.164.https > middlinux.55194: Flags [P.], seq 628175:630923, ack 869, win 65535, length 2748
20:08:46.001556 IP middlinux.55194 > 151.101.117.164.https: Flags [.], ack 622679, win 65535, length 0
20:08:46.001569 IP middlinux.55194 > 151.101.117.164.https: Flags [.], ack 625427, win 65535, length 0
20:08:46.001648 IP middlinux.55194 > 151.101.117.164.https: Flags [.], ack 628175, win 65535, length 0
20:08:46.001709 IP middlinux.55194 > 151.101.117.164.https: Flags [.], ack 630923, win 65535, length 0
20:08:46.001820 IP 151.101.117.164.https > middlinux.55194: Flags [P.], seq 630923:635045, ack 869, win 65535, length 4122
20:08:46.001828 IP middlinux.55194 > 151.101.117.164.https: Flags [.], ack 635045, win 65535, length 0
20:08:46.002258 IP 151.101.117.164.https > middlinux.55194: Flags [P.], seq 635045:640541, ack 869, win 65535, length 5496
20:08:46.002261 IP 151.101.117.164.https > middlinux.55194: Flags [P.], seq 640541:643289, ack 869, win 65535, length 2748
20:08:46.002277 IP middlinux.55194 > 151.101.117.164.https: Flags [.], ack 640541, win 65535, length 0
20:08:46.002404 IP middlinux.55194 > 151.101.117.164.https: Flags [.], ack 643289, win 65535, length 0
20:08:46.002599 IP 151.101.117.164.https > middlinux.55194: Flags [P.], seq 643289:644663, ack 869, win 65535, length 1374
20:08:46.002601 IP 151.101.117.164.https > middlinux.55194: Flags [P.], seq 644663:648785, ack 869, win 65535, length 4122
20:08:46.002613 IP middlinux.55194 > 151.101.117.164.https: Flags [.], ack 648785, win 65535, length 0
20:08:46.007666 IP 151.101.117.164.https > middlinux.55194: Flags [P.], seq 648785:711989, ack 869, win 65535, length 63204
20:08:46.007686 IP middlinux.55194 > 151.101.117.164.https: Flags [.], ack 711989, win 65535, length 0
20:08:46.008025 IP 151.101.117.164.https > middlinux.55194: Flags [P.], seq 711989:736721, ack 869, win 65535, length 24732
20:08:46.008149 IP middlinux.55194 > 151.101.117.164.https: Flags [.], ack 736721, win 65535, length 0
20:08:46.008808 IP 151.101.117.164.https > middlinux.55194: Flags [P.], seq 736721:743591, ack 869, win 65535, length 6870
20:08:46.008823 IP middlinux.55194 > 151.101.117.164.https: Flags [.], ack 743591, win 65535, length 0
20:08:46.008946 IP 151.101.117.164.https > middlinux.55194: Flags [P.], seq 743591:746339, ack 869, win 65535, length 2748
20:08:46.008948 IP 151.101.117.164.https > middlinux.55194: Flags [P.], seq 746339:749087, ack 869, win 65535, length 2748
20:08:46.008960 IP middlinux.55194 > 151.101.117.164.https: Flags [.], ack 746339, win 65535, length 0
20:08:46.008975 IP middlinux.55194 > 151.101.117.164.https: Flags [.], ack 749087, win 65535, length 0
20:08:46.009651 IP 151.101.117.164.https > middlinux.55194: Flags [P.], seq 749087:751835, ack 869, win 65535, length 2748
20:08:46.009654 IP 151.101.117.164.https > middlinux.55194: Flags [P.], seq 751835:755957, ack 869, win 65535, length 4122
20:08:46.009655 IP 151.101.117.164.https > middlinux.55194: Flags [P.], seq 755957:757331, ack 869, win 65535, length 1374
20:08:46.009657 IP 151.101.117.164.https > middlinux.55194: Flags [P.], seq 757331:761453, ack 869, win 65535, length 4122
20:08:46.009679 IP middlinux.55194 > 151.101.117.164.https: Flags [.], ack 751835, win 65535, length 0
20:08:46.009781 IP middlinux.55194 > 151.101.117.164.https: Flags [.], ack 755957, win 65535, length 0
20:08:46.010102 IP middlinux.55194 > 151.101.117.164.https: Flags [.], ack 761453, win 65535, length 0
20:08:46.010232 IP 151.101.117.164.https > middlinux.55194: Flags [P.], seq 761453:765575, ack 869, win 65535, length 4122
20:08:46.010235 IP 151.101.117.164.https > middlinux.55194: Flags [P.], seq 765575:768323, ack 869, win 65535, length 2748
20:08:46.010236 IP 151.101.117.164.https > middlinux.55194: Flags [P.], seq 768323:771071, ack 869, win 65535, length 2748
20:08:46.010732 IP 151.101.117.164.https > middlinux.55194: Flags [P.], seq 771071:775193, ack 869, win 65535, length 4122
20:08:46.010734 IP 151.101.117.164.https > middlinux.55194: Flags [P.], seq 775193:776567, ack 869, win 65535, length 1374
20:08:46.010734 IP 151.101.117.164.https > middlinux.55194: Flags [P.], seq 776567:779315, ack 869, win 65535, length 2748
20:08:46.010735 IP 151.101.117.164.https > middlinux.55194: Flags [P.], seq 779315:782063, ack 869, win 65535, length 2748
20:08:46.010764 IP 151.101.117.164.https > middlinux.55194: Flags [P.], seq 782063:783437, ack 869, win 65535, length 1374
20:08:46.010906 IP middlinux.55194 > 151.101.117.164.https: Flags [.], ack 783437, win 65535, length 0
20:08:46.010991 IP 151.101.117.164.https > middlinux.55194: Flags [P.], seq 783437:786185, ack 869, win 65535, length 2748
20:08:46.011027 IP middlinux.55194 > 151.101.117.164.https: Flags [.], ack 786185, win 65535, length 0
20:08:46.011101 IP 151.101.117.164.https > middlinux.55194: Flags [P.], seq 786185:788933, ack 869, win 65535, length 2748
20:08:46.011157 IP middlinux.55194 > 151.101.117.164.https: Flags [.], ack 788933, win 65535, length 0
20:08:46.011431 IP 151.101.117.164.https > middlinux.55194: Flags [P.], seq 788933:791681, ack 869, win 65535, length 2748
20:08:46.011561 IP 151.101.117.164.https > middlinux.55194: Flags [P.], seq 791681:794429, ack 869, win 65535, length 2748
20:08:46.011562 IP 151.101.117.164.https > middlinux.55194: Flags [P.], seq 794429:797177, ack 869, win 65535, length 2748
20:08:46.011592 IP middlinux.55194 > 151.101.117.164.https: Flags [.], ack 797177, win 65535, length 0
20:08:46.011721 IP 151.101.117.164.https > middlinux.55194: Flags [P.], seq 797177:799925, ack 869, win 65535, length 2748
20:08:46.011873 IP 151.101.117.164.https > middlinux.55194: Flags [P.], seq 799925:804047, ack 869, win 65535, length 4122
20:08:46.011874 IP 151.101.117.164.https > middlinux.55194: Flags [P.], seq 804047:805421, ack 869, win 65535, length 1374
20:08:46.011900 IP middlinux.55194 > 151.101.117.164.https: Flags [.], ack 799925, win 65535, length 0
20:08:46.011918 IP middlinux.55194 > 151.101.117.164.https: Flags [.], ack 805421, win 65535, length 0
20:08:46.012245 IP 151.101.117.164.https > middlinux.55194: Flags [P.], seq 805421:808169, ack 869, win 65535, length 2748
20:08:46.012246 IP 151.101.117.164.https > middlinux.55194: Flags [P.], seq 808169:810917, ack 869, win 65535, length 2748
20:08:46.012257 IP middlinux.55194 > 151.101.117.164.https: Flags [.], ack 808169, win 65535, length 0
20:08:46.012376 IP 151.101.117.164.https > middlinux.55194: Flags [P.], seq 810917:812291, ack 869, win 65535, length 1374
20:08:46.012423 IP middlinux.55194 > 151.101.117.164.https: Flags [.], ack 812291, win 65535, length 0
20:08:46.013236 IP 151.101.117.164.https > middlinux.55194: Flags [P.], seq 812291:817787, ack 869, win 65535, length 5496
20:08:46.013360 IP 151.101.117.164.https > middlinux.55194: Flags [P.], seq 817787:821909, ack 869, win 65535, length 4122
20:08:46.013361 IP 151.101.117.164.https > middlinux.55194: Flags [P.], seq 821909:823283, ack 869, win 65535, length 1374
20:08:46.013386 IP middlinux.55194 > 151.101.117.164.https: Flags [.], ack 817787, win 65535, length 0
20:08:46.013653 IP 151.101.117.164.https > middlinux.55194: Flags [P.], seq 823283:826031, ack 869, win 65535, length 2748
20:08:46.013655 IP 151.101.117.164.https > middlinux.55194: Flags [.], seq 826031:827491, ack 869, win 65535, length 1460
20:08:46.013917 IP 151.101.117.164.https > middlinux.55194: Flags [P.], seq 827491:828779, ack 869, win 65535, length 1288
20:08:46.013920 IP 151.101.117.164.https > middlinux.55194: Flags [P.], seq 828779:831527, ack 869, win 65535, length 2748
20:08:46.014028 IP 151.101.117.164.https > middlinux.55194: Flags [P.], seq 831527:834275, ack 869, win 65535, length 2748
20:08:46.014056 IP middlinux.55194 > 151.101.117.164.https: Flags [.], ack 834275, win 65535, length 0
20:08:46.014435 IP 151.101.117.164.https > middlinux.55194: Flags [P.], seq 834275:835649, ack 869, win 65535, length 1374
20:08:46.014439 IP 151.101.117.164.https > middlinux.55194: Flags [P.], seq 835649:841145, ack 869, win 65535, length 5496
20:08:46.014440 IP 151.101.117.164.https > middlinux.55194: Flags [P.], seq 841145:843893, ack 869, win 65535, length 2748
20:08:46.014558 IP 151.101.117.164.https > middlinux.55194: Flags [P.], seq 843893:846641, ack 869, win 65535, length 2748
20:08:46.014592 IP middlinux.55194 > 151.101.117.164.https: Flags [.], ack 846641, win 65535, length 0
20:08:46.014838 IP 151.101.117.164.https > middlinux.55194: Flags [P.], seq 846641:849389, ack 869, win 65535, length 2748
20:08:46.015020 IP 151.101.117.164.https > middlinux.55194: Flags [P.], seq 849389:853511, ack 869, win 65535, length 4122
20:08:46.015021 IP 151.101.117.164.https > middlinux.55194: Flags [P.], seq 853511:854885, ack 869, win 65535, length 1374
20:08:46.015134 IP 151.101.117.164.https > middlinux.55194: Flags [P.], seq 854885:857633, ack 869, win 65535, length 2748
20:08:46.015156 IP middlinux.55194 > 151.101.117.164.https: Flags [.], ack 857633, win 65535, length 0
20:08:46.015554 IP 151.101.117.164.https > middlinux.55194: Flags [P.], seq 857633:859007, ack 869, win 65535, length 1374
20:08:46.015556 IP 151.101.117.164.https > middlinux.55194: Flags [P.], seq 859007:861755, ack 869, win 65535, length 2748
20:08:46.015557 IP 151.101.117.164.https > middlinux.55194: Flags [P.], seq 861755:865877, ack 869, win 65535, length 4122
20:08:46.015571 IP middlinux.55194 > 151.101.117.164.https: Flags [.], ack 861755, win 65535, length 0
20:08:46.015604 IP middlinux.55194 > 151.101.117.164.https: Flags [.], ack 865877, win 65535, length 0
20:08:46.015842 IP 151.101.117.164.https > middlinux.55194: Flags [P.], seq 865877:867251, ack 869, win 65535, length 1374
20:08:46.015903 IP 151.101.117.164.https > middlinux.55194: Flags [.], seq 867251:870171, ack 869, win 65535, length 2920
20:08:46.015986 IP middlinux.55194 > 151.101.117.164.https: Flags [.], ack 870171, win 65535, length 0
20:08:46.016094 IP 151.101.117.164.https > middlinux.55194: Flags [P.], seq 870171:871373, ack 869, win 65535, length 1202
20:08:46.016096 IP 151.101.117.164.https > middlinux.55194: Flags [P.], seq 871373:874121, ack 869, win 65535, length 2748
20:08:46.016096 IP 151.101.117.164.https > middlinux.55194: Flags [P.], seq 874121:875495, ack 869, win 65535, length 1374
20:08:46.016222 IP middlinux.55194 > 151.101.117.164.https: Flags [.], ack 875495, win 65535, length 0
20:08:46.016245 IP 151.101.117.164.https > middlinux.55194: Flags [P.], seq 875495:876869, ack 869, win 65535, length 1374
20:08:46.016499 IP 151.101.117.164.https > middlinux.55194: Flags [P.], seq 876869:880991, ack 869, win 65535, length 4122
20:08:46.016502 IP 151.101.117.164.https > middlinux.55194: Flags [P.], seq 880991:883739, ack 869, win 65535, length 2748
20:08:46.016551 IP middlinux.55194 > 151.101.117.164.https: Flags [.], ack 883739, win 65535, length 0
20:08:46.017321 IP 151.101.117.164.https > middlinux.55194: Flags [P.], seq 883739:885113, ack 869, win 65535, length 1374
20:08:46.017325 IP 151.101.117.164.https > middlinux.55194: Flags [P.], seq 885113:887861, ack 869, win 65535, length 2748
20:08:46.017419 IP middlinux.55194 > 151.101.117.164.https: Flags [.], ack 887861, win 65535, length 0
20:08:46.017715 IP 151.101.117.164.https > middlinux.55194: Flags [.], seq 887861:889321, ack 869, win 65535, length 1460
20:08:46.017868 IP 151.101.117.164.https > middlinux.55194: Flags [P.], seq 889321:890609, ack 869, win 65535, length 1288
20:08:46.017886 IP middlinux.55194 > 151.101.117.164.https: Flags [.], ack 890609, win 65535, length 0
20:08:46.019845 IP 151.101.117.164.https > middlinux.55194: Flags [P.], seq 890609:898853, ack 869, win 65535, length 8244
20:08:46.019848 IP 151.101.117.164.https > middlinux.55194: Flags [P.], seq 898853:902975, ack 869, win 65535, length 4122
20:08:46.019895 IP 151.101.117.164.https > middlinux.55194: Flags [P.], seq 902975:904349, ack 869, win 65535, length 1374
20:08:46.019897 IP 151.101.117.164.https > middlinux.55194: Flags [P.], seq 904349:907097, ack 869, win 65535, length 2748
20:08:46.019897 IP 151.101.117.164.https > middlinux.55194: Flags [P.], seq 907097:909845, ack 869, win 65535, length 2748
20:08:46.019898 IP 151.101.117.164.https > middlinux.55194: Flags [P.], seq 909845:911219, ack 869, win 65535, length 1374
20:08:46.020007 IP middlinux.55194 > 151.101.117.164.https: Flags [.], ack 911219, win 65535, length 0
20:08:46.023633 IP 151.101.117.164.https > middlinux.55194: Flags [.], seq 911219:914139, ack 869, win 65535, length 2920
20:08:46.023655 IP middlinux.55194 > 151.101.117.164.https: Flags [.], ack 914139, win 65535, length 0
20:08:46.024447 IP 151.101.117.164.https > middlinux.55194: Flags [P.], seq 914139:975797, ack 869, win 65535, length 61658
20:08:46.024626 IP middlinux.55194 > 151.101.117.164.https: Flags [.], ack 975797, win 65535, length 0
20:08:46.024868 IP 151.101.117.164.https > middlinux.55194: Flags [.], seq 975797:978717, ack 869, win 65535, length 2920
20:08:46.025011 IP middlinux.55194 > 151.101.117.164.https: Flags [.], ack 978717, win 65535, length 0
20:08:46.025128 IP 151.101.117.164.https > middlinux.55194: Flags [P.], seq 978717:999155, ack 869, win 65535, length 20438
20:08:46.025366 IP 151.101.117.164.https > middlinux.55194: Flags [P.], seq 999155:1004651, ack 869, win 65535, length 5496
20:08:46.025368 IP 151.101.117.164.https > middlinux.55194: Flags [P.], seq 1004651:1006025, ack 869, win 65535, length 1374
20:08:46.025369 IP 151.101.117.164.https > middlinux.55194: Flags [P.], seq 1006025:1010147, ack 869, win 65535, length 4122
20:08:46.025390 IP 151.101.117.164.https > middlinux.55194: Flags [P.], seq 1010147:1011521, ack 869, win 65535, length 1374
20:08:46.025428 IP middlinux.55194 > 151.101.117.164.https: Flags [.], ack 1011521, win 65535, length 0
20:08:46.025574 IP 151.101.117.164.https > middlinux.55194: Flags [P.], seq 1011521:1012895, ack 869, win 65535, length 1374
20:08:46.025775 IP 151.101.117.164.https > middlinux.55194: Flags [P.], seq 1012895:1015643, ack 869, win 65535, length 2748
20:08:46.025942 IP 151.101.117.164.https > middlinux.55194: Flags [P.], seq 1015643:1019765, ack 869, win 65535, length 4122
20:08:46.025945 IP 151.101.117.164.https > middlinux.55194: Flags [P.], seq 1019765:1021139, ack 869, win 65535, length 1374
20:08:46.026111 IP middlinux.55194 > 151.101.117.164.https: Flags [.], ack 1021139, win 65535, length 0
20:08:46.026356 IP 151.101.117.164.https > middlinux.55194: Flags [P.], seq 1021139:1022513, ack 869, win 65535, length 1374
20:08:46.026358 IP 151.101.117.164.https > middlinux.55194: Flags [P.], seq 1022513:1026635, ack 869, win 65535, length 4122
20:08:46.026359 IP 151.101.117.164.https > middlinux.55194: Flags [P.], seq 1026635:1028009, ack 869, win 65535, length 1374
20:08:46.026371 IP middlinux.55194 > 151.101.117.164.https: Flags [.], ack 1026635, win 65535, length 0
20:08:46.026520 IP 151.101.117.164.https > middlinux.55194: Flags [P.], seq 1028009:1032131, ack 869, win 65535, length 4122
20:08:46.026765 IP 151.101.117.164.https > middlinux.55194: Flags [P.], seq 1032131:1036253, ack 869, win 65535, length 4122
20:08:46.027408 IP 151.101.117.164.https > middlinux.55194: Flags [P.], seq 1036253:1039001, ack 869, win 65535, length 2748
20:08:46.027410 IP 151.101.117.164.https > middlinux.55194: Flags [P.], seq 1039001:1041749, ack 869, win 65535, length 2748
20:08:46.027411 IP 151.101.117.164.https > middlinux.55194: Flags [P.], seq 1041749:1043123, ack 869, win 65535, length 1374
20:08:46.027412 IP 151.101.117.164.https > middlinux.55194: Flags [P.], seq 1043123:1044497, ack 869, win 65535, length 1374
20:08:46.027569 IP 151.101.117.164.https > middlinux.55194: Flags [P.], seq 1044497:1047245, ack 869, win 65535, length 2748
20:08:46.027669 IP 151.101.117.164.https > middlinux.55194: Flags [P.], seq 1047245:1052741, ack 869, win 65535, length 5496
20:08:46.027788 IP 151.101.117.164.https > middlinux.55194: Flags [P.], seq 1052741:1055489, ack 869, win 65535, length 2748
20:08:46.027970 IP 151.101.117.164.https > middlinux.55194: Flags [P.], seq 1055489:1058237, ack 869, win 65535, length 2748
20:08:46.028386 IP 151.101.117.164.https > middlinux.55194: Flags [P.], seq 1058237:1062359, ack 869, win 65535, length 4122
20:08:46.028613 IP middlinux.55194 > 151.101.117.164.https: Flags [.], ack 1062359, win 65535, length 0
20:08:46.029004 IP 151.101.117.164.https > middlinux.55194: Flags [.], seq 1062359:1066739, ack 869, win 65535, length 4380
20:08:46.029016 IP middlinux.55194 > 151.101.117.164.https: Flags [.], ack 1066739, win 65535, length 0
20:08:46.029181 IP 151.101.117.164.https > middlinux.55194: Flags [P.], seq 1066739:1074725, ack 869, win 65535, length 7986
20:08:46.029189 IP middlinux.55194 > 151.101.117.164.https: Flags [.], ack 1074725, win 65535, length 0
20:08:46.029749 IP 151.101.117.164.https > middlinux.55194: Flags [P.], seq 1074725:1080221, ack 869, win 65535, length 5496
20:08:46.029763 IP middlinux.55194 > 151.101.117.164.https: Flags [.], ack 1080221, win 65535, length 0
20:08:46.029878 IP 151.101.117.164.https > middlinux.55194: Flags [P.], seq 1080221:1084343, ack 869, win 65535, length 4122
20:08:46.029880 IP 151.101.117.164.https > middlinux.55194: Flags [P.], seq 1084343:1085717, ack 869, win 65535, length 1374
20:08:46.029934 IP middlinux.55194 > 151.101.117.164.https: Flags [.], ack 1085717, win 65535, length 0
20:08:46.030303 IP 151.101.117.164.https > middlinux.55194: Flags [P.], seq 1085717:1088465, ack 869, win 65535, length 2748
20:08:46.030305 IP 151.101.117.164.https > middlinux.55194: Flags [P.], seq 1088465:1091213, ack 869, win 65535, length 2748
20:08:46.030572 IP 151.101.117.164.https > middlinux.55194: Flags [P.], seq 1091213:1093961, ack 869, win 65535, length 2748
20:08:46.030573 IP 151.101.117.164.https > middlinux.55194: Flags [P.], seq 1093961:1095335, ack 869, win 65535, length 1374
20:08:46.030574 IP 151.101.117.164.https > middlinux.55194: Flags [P.], seq 1095335:1098083, ack 869, win 65535, length 2748
20:08:46.030574 IP 151.101.117.164.https > middlinux.55194: Flags [P.], seq 1098083:1099457, ack 869, win 65535, length 1374
20:08:46.030813 IP middlinux.55194 > 151.101.117.164.https: Flags [.], ack 1099457, win 65535, length 0
20:08:46.031379 IP 151.101.117.164.https > middlinux.55194: Flags [P.], seq 1099457:1104953, ack 869, win 65535, length 5496
20:08:46.031381 IP 151.101.117.164.https > middlinux.55194: Flags [P.], seq 1104953:1110449, ack 869, win 65535, length 5496
20:08:46.031441 IP 151.101.117.164.https > middlinux.55194: Flags [P.], seq 1110449:1115945, ack 869, win 65535, length 5496
20:08:46.031587 IP middlinux.55194 > 151.101.117.164.https: Flags [.], ack 1115945, win 65535, length 0
20:08:46.031618 IP 151.101.117.164.https > middlinux.55194: Flags [P.], seq 1115945:1117319, ack 869, win 65535, length 1374
20:08:46.031747 IP 151.101.117.164.https > middlinux.55194: Flags [P.], seq 1117319:1120067, ack 869, win 65535, length 2748
20:08:46.032032 IP 151.101.117.164.https > middlinux.55194: Flags [P.], seq 1120067:1124189, ack 869, win 65535, length 4122
20:08:46.032102 IP middlinux.55194 > 151.101.117.164.https: Flags [.], ack 1124189, win 65535, length 0
20:08:46.032189 IP 151.101.117.164.https > middlinux.55194: Flags [P.], seq 1124189:1126937, ack 869, win 65535, length 2748
20:08:46.032191 IP 151.101.117.164.https > middlinux.55194: Flags [P.], seq 1126937:1128311, ack 869, win 65535, length 1374
20:08:46.032538 IP 151.101.117.164.https > middlinux.55194: Flags [P.], seq 1128311:1131059, ack 869, win 65535, length 2748
20:08:46.032540 IP 151.101.117.164.https > middlinux.55194: Flags [P.], seq 1131059:1133807, ack 869, win 65535, length 2748
20:08:46.032948 IP 151.101.117.164.https > middlinux.55194: Flags [P.], seq 1133807:1136555, ack 869, win 65535, length 2748
20:08:46.032950 IP 151.101.117.164.https > middlinux.55194: Flags [P.], seq 1136555:1142051, ack 869, win 65535, length 5496
20:08:46.032982 IP middlinux.55194 > 151.101.117.164.https: Flags [.], ack 1128311, win 65535, length 0
20:08:46.033023 IP middlinux.55194 > 151.101.117.164.https: Flags [.], ack 1142051, win 65535, length 0
20:08:46.033401 IP 151.101.117.164.https > middlinux.55194: Flags [P.], seq 1142051:1146173, ack 869, win 65535, length 4122
20:08:46.033403 IP 151.101.117.164.https > middlinux.55194: Flags [.], seq 1146173:1147633, ack 869, win 65535, length 1460
20:08:46.033478 IP middlinux.55194 > 151.101.117.164.https: Flags [.], ack 1147633, win 65535, length 0
20:08:46.033601 IP 151.101.117.164.https > middlinux.55194: Flags [P.], seq 1147633:1150295, ack 869, win 65535, length 2662
20:08:46.033610 IP middlinux.55194 > 151.101.117.164.https: Flags [.], ack 1150295, win 65535, length 0
20:08:46.034421 IP 151.101.117.164.https > middlinux.55194: Flags [P.], seq 1150295:1157165, ack 869, win 65535, length 6870
20:08:46.034747 IP 151.101.117.164.https > middlinux.55194: Flags [P.], seq 1157165:1159913, ack 869, win 65535, length 2748
20:08:46.034750 IP 151.101.117.164.https > middlinux.55194: Flags [P.], seq 1159913:1161287, ack 869, win 65535, length 1374
20:08:46.034751 IP 151.101.117.164.https > middlinux.55194: Flags [P.], seq 1161287:1164035, ack 869, win 65535, length 2748
20:08:46.034859 IP 151.101.117.164.https > middlinux.55194: Flags [P.], seq 1164035:1166783, ack 869, win 65535, length 2748
20:08:46.034984 IP middlinux.55194 > 151.101.117.164.https: Flags [.], ack 1166783, win 65535, length 0
20:08:46.035093 IP 151.101.117.164.https > middlinux.55194: Flags [P.], seq 1166783:1172279, ack 869, win 65535, length 5496
20:08:46.035094 IP 151.101.117.164.https > middlinux.55194: Flags [P.], seq 1172279:1173653, ack 869, win 65535, length 1374
20:08:46.035226 IP 151.101.117.164.https > middlinux.55194: Flags [P.], seq 1173653:1175027, ack 869, win 65535, length 1374
20:08:46.035272 IP middlinux.55194 > 151.101.117.164.https: Flags [.], ack 1175027, win 65535, length 0
20:08:46.035366 IP 151.101.117.164.https > middlinux.55194: Flags [P.], seq 1175027:1177775, ack 869, win 65535, length 2748
20:08:46.035394 IP middlinux.55194 > 151.101.117.164.https: Flags [.], ack 1177775, win 65535, length 0
20:08:46.035582 IP 151.101.117.164.https > middlinux.55194: Flags [P.], seq 1177775:1180523, ack 869, win 65535, length 2748
20:08:46.035639 IP middlinux.55194 > 151.101.117.164.https: Flags [.], ack 1180523, win 65535, length 0
20:08:46.036219 IP 151.101.117.164.https > middlinux.55194: Flags [P.], seq 1180523:1184645, ack 869, win 65535, length 4122
20:08:46.036221 IP 151.101.117.164.https > middlinux.55194: Flags [P.], seq 1184645:1186019, ack 869, win 65535, length 1374
20:08:46.036222 IP 151.101.117.164.https > middlinux.55194: Flags [P.], seq 1186019:1190141, ack 869, win 65535, length 4122
20:08:46.036223 IP 151.101.117.164.https > middlinux.55194: Flags [.], seq 1190141:1191601, ack 869, win 65535, length 1460
20:08:46.036240 IP middlinux.55194 > 151.101.117.164.https: Flags [.], ack 1184645, win 65535, length 0
20:08:46.036328 IP 151.101.117.164.https > middlinux.55194: Flags [P.], seq 1191601:1192889, ack 869, win 65535, length 1288
20:08:46.036329 IP 151.101.117.164.https > middlinux.55194: Flags [P.], seq 1192889:1194263, ack 869, win 65535, length 1374
20:08:46.036330 IP 151.101.117.164.https > middlinux.55194: Flags [P.], seq 1194263:1197011, ack 869, win 65535, length 2748
20:08:46.036378 IP middlinux.55194 > 151.101.117.164.https: Flags [.], ack 1197011, win 65535, length 0
20:08:46.036658 IP 151.101.117.164.https > middlinux.55194: Flags [P.], seq 1197011:1198385, ack 869, win 65535, length 1374
20:08:46.039158 IP 151.101.117.164.https > middlinux.55194: Flags [P.], seq 1198385:1209377, ack 869, win 65535, length 10992
20:08:46.039179 IP middlinux.55194 > 151.101.117.164.https: Flags [.], ack 1209377, win 65535, length 0
20:08:46.039467 IP 151.101.117.164.https > middlinux.55194: Flags [P.], seq 1209377:1210751, ack 869, win 65535, length 1374
20:08:46.040465 IP 151.101.117.164.https > middlinux.55194: Flags [P.], seq 1210751:1213499, ack 869, win 65535, length 2748
20:08:46.040468 IP 151.101.117.164.https > middlinux.55194: Flags [P.], seq 1213499:1216247, ack 869, win 65535, length 2748
20:08:46.040469 IP 151.101.117.164.https > middlinux.55194: Flags [P.], seq 1216247:1220369, ack 869, win 65535, length 4122
20:08:46.040470 IP 151.101.117.164.https > middlinux.55194: Flags [.], seq 1220369:1223289, ack 869, win 65535, length 2920
20:08:46.040493 IP middlinux.55194 > 151.101.117.164.https: Flags [.], ack 1213499, win 65535, length 0
20:08:46.041183 IP 151.101.117.164.https > middlinux.55194: Flags [P.], seq 1223289:1229987, ack 869, win 65535, length 6698
20:08:46.041186 IP 151.101.117.164.https > middlinux.55194: Flags [P.], seq 1229987:1235483, ack 869, win 65535, length 5496
20:08:46.041217 IP 151.101.117.164.https > middlinux.55194: Flags [P.], seq 1235483:1239605, ack 869, win 65535, length 4122
20:08:46.041219 IP 151.101.117.164.https > middlinux.55194: Flags [P.], seq 1239605:1246475, ack 869, win 65535, length 6870
20:08:46.041359 IP middlinux.55194 > 151.101.117.164.https: Flags [.], ack 1246475, win 65535, length 0
20:08:46.041587 IP 151.101.117.164.https > middlinux.55194: Flags [P.], seq 1246475:1260215, ack 869, win 65535, length 13740
20:08:46.041600 IP 151.101.117.164.https > middlinux.55194: Flags [P.], seq 1260215:1261589, ack 869, win 65535, length 1374
20:08:46.041623 IP middlinux.55194 > 151.101.117.164.https: Flags [.], ack 1261589, win 65535, length 0
20:08:46.041748 IP 151.101.117.164.https > middlinux.55194: Flags [.], seq 1261589:1263049, ack 869, win 65535, length 1460
20:08:46.041873 IP 151.101.117.164.https > middlinux.55194: Flags [P.], seq 1263049:1264337, ack 869, win 65535, length 1288
20:08:46.041879 IP middlinux.55194 > 151.101.117.164.https: Flags [.], ack 1264337, win 65535, length 0
20:08:46.042040 IP 151.101.117.164.https > middlinux.55194: Flags [P.], seq 1264337:1267085, ack 869, win 65535, length 2748
20:08:46.042266 IP 151.101.117.164.https > middlinux.55194: Flags [P.], seq 1267085:1269833, ack 869, win 65535, length 2748
20:08:46.042268 IP 151.101.117.164.https > middlinux.55194: Flags [P.], seq 1269833:1273955, ack 869, win 65535, length 4122
20:08:46.042313 IP middlinux.55194 > 151.101.117.164.https: Flags [.], ack 1273955, win 65535, length 0
20:08:46.043572 IP 151.101.117.164.https > middlinux.55194: Flags [P.], seq 1273955:1280825, ack 869, win 65535, length 6870
20:08:46.043574 IP 151.101.117.164.https > middlinux.55194: Flags [P.], seq 1280825:1282199, ack 869, win 65535, length 1374
20:08:46.043575 IP 151.101.117.164.https > middlinux.55194: Flags [P.], seq 1282199:1287695, ack 869, win 65535, length 5496
20:08:46.043781 IP 151.101.117.164.https > middlinux.55194: Flags [P.], seq 1287695:1290443, ack 869, win 65535, length 2748
20:08:46.043782 IP 151.101.117.164.https > middlinux.55194: Flags [P.], seq 1290443:1293191, ack 869, win 65535, length 2748
20:08:46.043930 IP 151.101.117.164.https > middlinux.55194: Flags [P.], seq 1293191:1294565, ack 869, win 65535, length 1374
20:08:46.043958 IP middlinux.55194 > 151.101.117.164.https: Flags [.], ack 1287695, win 65535, length 0
20:08:46.044136 IP 151.101.117.164.https > middlinux.55194: Flags [.], seq 1294565:1296025, ack 869, win 65535, length 1460
20:08:46.044173 IP middlinux.55194 > 151.101.117.164.https: Flags [.], ack 1296025, win 65535, length 0
20:08:46.044974 IP 151.101.117.164.https > middlinux.55194: Flags [P.], seq 1296025:1298687, ack 869, win 65535, length 2662
20:08:46.044976 IP 151.101.117.164.https > middlinux.55194: Flags [P.], seq 1298687:1300061, ack 869, win 65535, length 1374
20:08:46.045014 IP 151.101.117.164.https > middlinux.55194: Flags [P.], seq 1300061:1302809, ack 869, win 65535, length 2748
20:08:46.045017 IP 151.101.117.164.https > middlinux.55194: Flags [P.], seq 1302809:1305557, ack 869, win 65535, length 2748
20:08:46.045269 IP 151.101.117.164.https > middlinux.55194: Flags [P.], seq 1305557:1309679, ack 869, win 65535, length 4122
20:08:46.045270 IP 151.101.117.164.https > middlinux.55194: Flags [P.], seq 1309679:1311053, ack 869, win 65535, length 1374
20:08:46.045271 IP 151.101.117.164.https > middlinux.55194: Flags [P.], seq 1311053:1313801, ack 869, win 65535, length 2748
20:08:46.045272 IP 151.101.117.164.https > middlinux.55194: Flags [P.], seq 1313801:1316549, ack 869, win 65535, length 2748
20:08:46.045310 IP 151.101.117.164.https > middlinux.55194: Flags [P.], seq 1316549:1319297, ack 869, win 65535, length 2748
20:08:46.045310 IP 151.101.117.164.https > middlinux.55194: Flags [P.], seq 1319297:1320671, ack 869, win 65535, length 1374
20:08:46.045356 IP middlinux.55194 > 151.101.117.164.https: Flags [.], ack 1320671, win 65535, length 0
20:08:46.045563 IP 151.101.117.164.https > middlinux.55194: Flags [P.], seq 1320671:1326167, ack 869, win 65535, length 5496
20:08:46.045638 IP middlinux.55194 > 151.101.117.164.https: Flags [.], ack 1326167, win 65535, length 0
20:08:46.045727 IP 151.101.117.164.https > middlinux.55194: Flags [P.], seq 1326167:1327541, ack 869, win 65535, length 1374
20:08:46.045839 IP 151.101.117.164.https > middlinux.55194: Flags [P.], seq 1327541:1330289, ack 869, win 65535, length 2748
20:08:46.045845 IP middlinux.55194 > 151.101.117.164.https: Flags [.], ack 1330289, win 65535, length 0
20:08:46.046062 IP 151.101.117.164.https > middlinux.55194: Flags [P.], seq 1330289:1333037, ack 869, win 65535, length 2748
20:08:46.046143 IP 151.101.117.164.https > middlinux.55194: Flags [.], seq 1333037:1334497, ack 869, win 65535, length 1460
20:08:46.046367 IP 151.101.117.164.https > middlinux.55194: Flags [P.], seq 1334497:1335785, ack 869, win 65535, length 1288
20:08:46.046370 IP 151.101.117.164.https > middlinux.55194: Flags [P.], seq 1335785:1341281, ack 869, win 65535, length 5496
20:08:46.046486 IP middlinux.55194 > 151.101.117.164.https: Flags [.], ack 1341281, win 65535, length 0
20:08:46.046807 IP 151.101.117.164.https > middlinux.55194: Flags [P.], seq 1341281:1344029, ack 869, win 65535, length 2748
20:08:46.046809 IP 151.101.117.164.https > middlinux.55194: Flags [P.], seq 1344029:1346777, ack 869, win 65535, length 2748
20:08:46.046810 IP 151.101.117.164.https > middlinux.55194: Flags [P.], seq 1346777:1349525, ack 869, win 65535, length 2748
20:08:46.046820 IP middlinux.55194 > 151.101.117.164.https: Flags [.], ack 1344029, win 65535, length 0
20:08:46.046929 IP middlinux.55194 > 151.101.117.164.https: Flags [.], ack 1349525, win 65535, length 0
20:08:46.048198 IP 151.101.117.164.https > middlinux.55194: Flags [P.], seq 1349525:1352273, ack 869, win 65535, length 2748
20:08:46.048249 IP middlinux.55194 > 151.101.117.164.https: Flags [.], ack 1352273, win 65535, length 0
20:08:46.053227 IP 151.101.117.164.https > middlinux.55194: Flags [.], seq 1352273:1409213, ack 869, win 65535, length 56940
20:08:46.053309 IP middlinux.55194 > 151.101.117.164.https: Flags [.], ack 1409213, win 65535, length 0
20:08:46.053489 IP 151.101.117.164.https > middlinux.55194: Flags [P.], seq 1409213:1417973, ack 869, win 65535, length 8760
20:08:46.053532 IP middlinux.55194 > 151.101.117.164.https: Flags [.], ack 1417973, win 65535, length 0
20:08:46.053687 IP 151.101.117.164.https > middlinux.55194: Flags [P.], seq 1417973:1430591, ack 869, win 65535, length 12618
20:08:46.053761 IP middlinux.55194 > 151.101.117.164.https: Flags [.], ack 1430591, win 65535, length 0
20:08:46.054522 IP 151.101.117.164.https > middlinux.55194: Flags [P.], seq 1430591:1440038, ack 869, win 65535, length 9447
20:08:46.054536 IP middlinux.55194 > 151.101.117.164.https: Flags [.], ack 1440038, win 65535, length 0
20:08:46.056885 IP middlinux.55194 > 151.101.117.164.https: Flags [P.], seq 869:900, ack 1440038, win 65535, length 31
20:08:46.057314 IP 151.101.117.164.https > middlinux.55194: Flags [.], ack 900, win 65535, length 0
20:08:46.057870 IP middlinux.55194 > 151.101.117.164.https: Flags [F.], seq 900, ack 1440038, win 65535, length 0
20:08:46.058133 IP 151.101.117.164.https > middlinux.55194: Flags [.], ack 901, win 65535, length 0
20:08:46.072737 IP 151.101.117.164.https > middlinux.55194: Flags [P.], seq 1440038:1440069, ack 901, win 65535, length 31
20:08:46.072739 IP 151.101.117.164.https > middlinux.55194: Flags [F.], seq 1440069, ack 901, win 65535, length 0
20:08:46.072762 IP middlinux.55194 > 151.101.117.164.https: Flags [R], seq 4012762443, win 0, length 0
20:08:46.072786 IP middlinux.55194 > 151.101.117.164.https: Flags [R], seq 4012762443, win 0, length 0
20:08:46.072969 IP 151.101.117.164.https > middlinux.55194: Flags [R.], seq 4273271295, ack 901, win 0, length 0
20:08:46.450330 IP hera-lan2.domain > middlinux.52066: 22817 NXDomain 0/1/0 (106)

