13:05:19.737191 IP 10.0.2.15.42580 > 151.101.117.164.443: Flags [P.], seq 1112995899:1112996416, ack 21824002, win 64240, length 517
13:05:19.737846 IP 151.101.117.164.443 > 10.0.2.15.42580: Flags [.], ack 517, win 65535, length 0
13:05:19.756791 IP 151.101.117.164.443 > 10.0.2.15.42580: Flags [.], seq 1:2921, ack 517, win 65535, length 2920
13:05:19.756858 IP 10.0.2.15.42580 > 151.101.117.164.443: Flags [.], ack 2921, win 62780, length 0
13:05:19.757803 IP 151.101.117.164.443 > 10.0.2.15.42580: Flags [P.], seq 2921:5607, ack 517, win 65535, length 2686
13:05:19.757826 IP 10.0.2.15.42580 > 151.101.117.164.443: Flags [.], ack 5607, win 62780, length 0
13:05:19.759464 IP 10.0.2.15.42580 > 151.101.117.164.443: Flags [P.], seq 517:610, ack 5607, win 62780, length 93
13:05:19.760070 IP 151.101.117.164.443 > 10.0.2.15.42580: Flags [.], ack 610, win 65535, length 0
13:05:19.774431 IP 151.101.117.164.443 > 10.0.2.15.42580: Flags [P.], seq 5607:5658, ack 610, win 65535, length 51
13:05:19.774451 IP 10.0.2.15.42580 > 151.101.117.164.443: Flags [.], ack 5658, win 62780, length 0
13:05:19.774885 IP 10.0.2.15.42580 > 151.101.117.164.443: Flags [P.], seq 610:663, ack 5658, win 62780, length 53
13:05:19.774923 IP 10.0.2.15.42580 > 151.101.117.164.443: Flags [P.], seq 663:719, ack 5658, win 62780, length 56
13:05:19.775146 IP 10.0.2.15.42580 > 151.101.117.164.443: Flags [P.], seq 719:830, ack 5658, win 62780, length 111
13:05:19.775413 IP 151.101.117.164.443 > 10.0.2.15.42580: Flags [.], ack 663, win 65535, length 0
13:05:19.775414 IP 151.101.117.164.443 > 10.0.2.15.42580: Flags [.], ack 719, win 65535, length 0
13:05:19.775503 IP 151.101.117.164.443 > 10.0.2.15.42580: Flags [.], ack 830, win 65535, length 0
13:05:19.789864 IP 151.101.117.164.443 > 10.0.2.15.42580: Flags [P.], seq 5658:5753, ack 830, win 65535, length 95
13:05:19.790119 IP 10.0.2.15.42580 > 151.101.117.164.443: Flags [.], ack 5753, win 62780, length 0
13:05:19.790495 IP 10.0.2.15.42580 > 151.101.117.164.443: Flags [P.], seq 830:868, ack 5753, win 62780, length 38
13:05:19.791142 IP 151.101.117.164.443 > 10.0.2.15.42580: Flags [.], ack 868, win 65535, length 0
13:05:19.794963 IP 151.101.117.164.443 > 10.0.2.15.42580: Flags [P.], seq 5753:11249, ack 868, win 65535, length 5496
13:05:19.795102 IP 10.0.2.15.42580 > 151.101.117.164.443: Flags [.], ack 11249, win 61320, length 0
13:05:19.796258 IP 151.101.117.164.443 > 10.0.2.15.42580: Flags [P.], seq 11249:18119, ack 868, win 65535, length 6870
13:05:19.796398 IP 10.0.2.15.42580 > 151.101.117.164.443: Flags [.], ack 18119, win 59860, length 0
13:05:19.799051 IP 151.101.117.164.443 > 10.0.2.15.42580: Flags [P.], seq 18119:29111, ack 868, win 65535, length 10992
13:05:19.799178 IP 10.0.2.15.42580 > 151.101.117.164.443: Flags [.], ack 29111, win 56940, length 0
13:05:19.801145 IP 151.101.117.164.443 > 10.0.2.15.42580: Flags [P.], seq 29111:37355, ack 868, win 65535, length 8244
13:05:19.801162 IP 10.0.2.15.42580 > 151.101.117.164.443: Flags [.], ack 37355, win 58400, length 0
13:05:19.802146 IP 151.101.117.164.443 > 10.0.2.15.42580: Flags [P.], seq 37355:42851, ack 868, win 65535, length 5496
13:05:19.802160 IP 10.0.2.15.42580 > 151.101.117.164.443: Flags [.], ack 42851, win 61320, length 0
13:05:19.803163 IP 151.101.117.164.443 > 10.0.2.15.42580: Flags [P.], seq 42851:45599, ack 868, win 65535, length 2748
13:05:19.803182 IP 10.0.2.15.42580 > 151.101.117.164.443: Flags [.], ack 45599, win 62780, length 0
13:05:19.804320 IP 151.101.117.164.443 > 10.0.2.15.42580: Flags [P.], seq 45599:49721, ack 868, win 65535, length 4122
13:05:19.804450 IP 10.0.2.15.42580 > 151.101.117.164.443: Flags [.], ack 49721, win 61320, length 0
13:05:19.809424 IP 151.101.117.164.443 > 10.0.2.15.42580: Flags [P.], seq 49721:57965, ack 868, win 65535, length 8244
13:05:19.809516 IP 10.0.2.15.42580 > 151.101.117.164.443: Flags [.], ack 57965, win 58400, length 0
13:05:19.809725 IP 151.101.117.164.443 > 10.0.2.15.42580: Flags [.], seq 57965:62345, ack 868, win 65535, length 4380
13:05:19.809834 IP 151.101.117.164.443 > 10.0.2.15.42580: Flags [P.], seq 62345:66209, ack 868, win 65535, length 3864
13:05:19.809869 IP 10.0.2.15.42580 > 151.101.117.164.443: Flags [.], ack 66209, win 52560, length 0
13:05:19.810473 IP 151.101.117.164.443 > 10.0.2.15.42580: Flags [P.], seq 66209:70331, ack 868, win 65535, length 4122
13:05:19.810522 IP 10.0.2.15.42580 > 151.101.117.164.443: Flags [.], ack 70331, win 62780, length 0
13:05:19.812734 IP 151.101.117.164.443 > 10.0.2.15.42580: Flags [P.], seq 70331:81323, ack 868, win 65535, length 10992
13:05:19.812759 IP 10.0.2.15.42580 > 151.101.117.164.443: Flags [.], ack 81323, win 65535, length 0
13:05:19.812902 IP 151.101.117.164.443 > 10.0.2.15.42580: Flags [P.], seq 81323:84071, ack 868, win 65535, length 2748
13:05:19.812917 IP 10.0.2.15.42580 > 151.101.117.164.443: Flags [.], ack 84071, win 65535, length 0
13:05:19.814451 IP 151.101.117.164.443 > 10.0.2.15.42580: Flags [P.], seq 84071:90941, ack 868, win 65535, length 6870
13:05:19.814469 IP 10.0.2.15.42580 > 151.101.117.164.443: Flags [.], ack 90941, win 65535, length 0
13:05:19.815830 IP 151.101.117.164.443 > 10.0.2.15.42580: Flags [P.], seq 90941:97811, ack 868, win 65535, length 6870
13:05:19.815845 IP 10.0.2.15.42580 > 151.101.117.164.443: Flags [.], ack 97811, win 65535, length 0
13:05:19.817935 IP 151.101.117.164.443 > 10.0.2.15.42580: Flags [P.], seq 97811:107429, ack 868, win 65535, length 9618
13:05:19.817956 IP 10.0.2.15.42580 > 151.101.117.164.443: Flags [.], ack 107429, win 65535, length 0
13:05:19.818217 IP 151.101.117.164.443 > 10.0.2.15.42580: Flags [P.], seq 107429:129413, ack 868, win 65535, length 21984
13:05:19.818319 IP 10.0.2.15.42580 > 151.101.117.164.443: Flags [.], ack 129413, win 65535, length 0
13:05:19.823446 IP 151.101.117.164.443 > 10.0.2.15.42580: Flags [P.], seq 129413:139031, ack 868, win 65535, length 9618
13:05:19.823472 IP 10.0.2.15.42580 > 151.101.117.164.443: Flags [.], ack 139031, win 65535, length 0
13:05:19.825719 IP 151.101.117.164.443 > 10.0.2.15.42580: Flags [P.], seq 139031:166511, ack 868, win 65535, length 27480
13:05:19.825737 IP 10.0.2.15.42580 > 151.101.117.164.443: Flags [.], ack 166511, win 65535, length 0
13:05:19.825775 IP 151.101.117.164.443 > 10.0.2.15.42580: Flags [P.], seq 166511:172007, ack 868, win 65535, length 5496
13:05:19.825781 IP 10.0.2.15.42580 > 151.101.117.164.443: Flags [.], ack 172007, win 65535, length 0
13:05:19.827245 IP 151.101.117.164.443 > 10.0.2.15.42580: Flags [P.], seq 172007:177503, ack 868, win 65535, length 5496
13:05:19.827260 IP 10.0.2.15.42580 > 151.101.117.164.443: Flags [.], ack 177503, win 65535, length 0
13:05:19.829241 IP 151.101.117.164.443 > 10.0.2.15.42580: Flags [P.], seq 177503:178877, ack 868, win 65535, length 1374
13:05:19.831517 IP 151.101.117.164.443 > 10.0.2.15.42580: Flags [.], seq 178877:200777, ack 868, win 65535, length 21900
13:05:19.831539 IP 10.0.2.15.42580 > 151.101.117.164.443: Flags [.], ack 200777, win 65535, length 0
13:05:19.831746 IP 151.101.117.164.443 > 10.0.2.15.42580: Flags [.], seq 200777:215377, ack 868, win 65535, length 14600
13:05:19.831765 IP 10.0.2.15.42580 > 151.101.117.164.443: Flags [.], ack 215377, win 65535, length 0
13:05:19.831993 IP 151.101.117.164.443 > 10.0.2.15.42580: Flags [P.], seq 215377:231089, ack 868, win 65535, length 15712
13:05:19.832006 IP 10.0.2.15.42580 > 151.101.117.164.443: Flags [.], ack 231089, win 65535, length 0
13:05:19.832322 IP 151.101.117.164.443 > 10.0.2.15.42580: Flags [P.], seq 231089:232463, ack 868, win 65535, length 1374
13:05:19.834079 IP 151.101.117.164.443 > 10.0.2.15.42580: Flags [.], seq 232463:248523, ack 868, win 65535, length 16060
13:05:19.834106 IP 10.0.2.15.42580 > 151.101.117.164.443: Flags [.], ack 248523, win 65535, length 0
13:05:19.834409 IP 151.101.117.164.443 > 10.0.2.15.42580: Flags [P.], seq 248523:272309, ack 868, win 65535, length 23786
13:05:19.834428 IP 10.0.2.15.42580 > 151.101.117.164.443: Flags [.], ack 272309, win 65535, length 0
13:05:19.834930 IP 151.101.117.164.443 > 10.0.2.15.42580: Flags [P.], seq 272309:280553, ack 868, win 65535, length 8244
13:05:19.834945 IP 10.0.2.15.42580 > 151.101.117.164.443: Flags [.], ack 280553, win 65535, length 0
13:05:19.837214 IP 151.101.117.164.443 > 10.0.2.15.42580: Flags [P.], seq 280553:281927, ack 868, win 65535, length 1374
13:05:19.841746 IP 151.101.117.164.443 > 10.0.2.15.42580: Flags [P.], seq 281927:316277, ack 868, win 65535, length 34350
13:05:19.841764 IP 10.0.2.15.42580 > 151.101.117.164.443: Flags [.], ack 316277, win 65535, length 0
13:05:19.842521 IP 151.101.117.164.443 > 10.0.2.15.42580: Flags [P.], seq 316277:346505, ack 868, win 65535, length 30228
13:05:19.842537 IP 10.0.2.15.42580 > 151.101.117.164.443: Flags [.], ack 346505, win 65535, length 0
13:05:19.843565 IP 151.101.117.164.443 > 10.0.2.15.42580: Flags [P.], seq 346505:349253, ack 868, win 65535, length 2748
13:05:19.843581 IP 10.0.2.15.42580 > 151.101.117.164.443: Flags [.], ack 349253, win 65535, length 0
13:05:19.847423 IP 151.101.117.164.443 > 10.0.2.15.42580: Flags [P.], seq 349253:376733, ack 868, win 65535, length 27480
13:05:19.847445 IP 10.0.2.15.42580 > 151.101.117.164.443: Flags [.], ack 376733, win 65535, length 0
13:05:19.847513 IP 151.101.117.164.443 > 10.0.2.15.42580: Flags [P.], seq 376733:387725, ack 868, win 65535, length 10992
13:05:19.847571 IP 10.0.2.15.42580 > 151.101.117.164.443: Flags [.], ack 387725, win 65535, length 0
13:05:19.847967 IP 151.101.117.164.443 > 10.0.2.15.42580: Flags [.], seq 387725:406705, ack 868, win 65535, length 18980
13:05:19.847979 IP 10.0.2.15.42580 > 151.101.117.164.443: Flags [.], ack 406705, win 65535, length 0
13:05:19.848099 IP 151.101.117.164.443 > 10.0.2.15.42580: Flags [P.], seq 406705:409709, ack 868, win 65535, length 3004
13:05:19.848105 IP 10.0.2.15.42580 > 151.101.117.164.443: Flags [.], ack 409709, win 65535, length 0
13:05:19.848652 IP 151.101.117.164.443 > 10.0.2.15.42580: Flags [.], seq 409709:417009, ack 868, win 65535, length 7300
13:05:19.848667 IP 10.0.2.15.42580 > 151.101.117.164.443: Flags [.], ack 417009, win 65535, length 0
13:05:19.848881 IP 151.101.117.164.443 > 10.0.2.15.42580: Flags [P.], seq 417009:420701, ack 868, win 65535, length 3692
13:05:19.848895 IP 10.0.2.15.42580 > 151.101.117.164.443: Flags [.], ack 420701, win 65535, length 0
13:05:19.849093 IP 151.101.117.164.443 > 10.0.2.15.42580: Flags [P.], seq 420701:426197, ack 868, win 65535, length 5496
13:05:19.849102 IP 10.0.2.15.42580 > 151.101.117.164.443: Flags [.], ack 426197, win 65535, length 0
13:05:19.849498 IP 151.101.117.164.443 > 10.0.2.15.42580: Flags [P.], seq 426197:433067, ack 868, win 65535, length 6870
13:05:19.849558 IP 10.0.2.15.42580 > 151.101.117.164.443: Flags [.], ack 433067, win 65535, length 0
13:05:19.849688 IP 151.101.117.164.443 > 10.0.2.15.42580: Flags [P.], seq 433067:439937, ack 868, win 65535, length 6870
13:05:19.849697 IP 10.0.2.15.42580 > 151.101.117.164.443: Flags [.], ack 439937, win 65535, length 0
13:05:19.849825 IP 151.101.117.164.443 > 10.0.2.15.42580: Flags [P.], seq 439937:444059, ack 868, win 65535, length 4122
13:05:19.849833 IP 10.0.2.15.42580 > 151.101.117.164.443: Flags [.], ack 444059, win 65535, length 0
13:05:19.850261 IP 151.101.117.164.443 > 10.0.2.15.42580: Flags [P.], seq 444059:445433, ack 868, win 65535, length 1374
13:05:19.850926 IP 151.101.117.164.443 > 10.0.2.15.42580: Flags [P.], seq 445433:452303, ack 868, win 65535, length 6870
13:05:19.850999 IP 10.0.2.15.42580 > 151.101.117.164.443: Flags [.], ack 452303, win 65535, length 0
13:05:19.851251 IP 151.101.117.164.443 > 10.0.2.15.42580: Flags [P.], seq 452303:457799, ack 868, win 65535, length 5496
13:05:19.851313 IP 10.0.2.15.42580 > 151.101.117.164.443: Flags [.], ack 457799, win 65535, length 0
13:05:19.851799 IP 151.101.117.164.443 > 10.0.2.15.42580: Flags [P.], seq 457799:464669, ack 868, win 65535, length 6870
13:05:19.851802 IP 151.101.117.164.443 > 10.0.2.15.42580: Flags [P.], seq 464669:470165, ack 868, win 65535, length 5496
13:05:19.851816 IP 10.0.2.15.42580 > 151.101.117.164.443: Flags [.], ack 464669, win 65535, length 0
13:05:19.851835 IP 10.0.2.15.42580 > 151.101.117.164.443: Flags [.], ack 470165, win 65535, length 0
13:05:19.852021 IP 151.101.117.164.443 > 10.0.2.15.42580: Flags [P.], seq 470165:475661, ack 868, win 65535, length 5496
13:05:19.852031 IP 10.0.2.15.42580 > 151.101.117.164.443: Flags [.], ack 475661, win 65535, length 0
13:05:19.852239 IP 151.101.117.164.443 > 10.0.2.15.42580: Flags [P.], seq 475661:481157, ack 868, win 65535, length 5496
13:05:19.852245 IP 10.0.2.15.42580 > 151.101.117.164.443: Flags [.], ack 481157, win 65535, length 0
13:05:19.853116 IP 151.101.117.164.443 > 10.0.2.15.42580: Flags [P.], seq 481157:486653, ack 868, win 65535, length 5496
13:05:19.853131 IP 10.0.2.15.42580 > 151.101.117.164.443: Flags [.], ack 486653, win 65535, length 0
13:05:19.853458 IP 151.101.117.164.443 > 10.0.2.15.42580: Flags [P.], seq 486653:492149, ack 868, win 65535, length 5496
13:05:19.853531 IP 10.0.2.15.42580 > 151.101.117.164.443: Flags [.], ack 492149, win 65535, length 0
13:05:19.853823 IP 151.101.117.164.443 > 10.0.2.15.42580: Flags [P.], seq 492149:497645, ack 868, win 65535, length 5496
13:05:19.853832 IP 151.101.117.164.443 > 10.0.2.15.42580: Flags [P.], seq 497645:504515, ack 868, win 65535, length 6870
13:05:19.853844 IP 10.0.2.15.42580 > 151.101.117.164.443: Flags [.], ack 497645, win 65535, length 0
13:05:19.853864 IP 10.0.2.15.42580 > 151.101.117.164.443: Flags [.], ack 504515, win 65535, length 0
13:05:19.854078 IP 151.101.117.164.443 > 10.0.2.15.42580: Flags [P.], seq 504515:508637, ack 868, win 65535, length 4122
13:05:19.854163 IP 10.0.2.15.42580 > 151.101.117.164.443: Flags [.], ack 508637, win 65535, length 0
13:05:19.854454 IP 151.101.117.164.443 > 10.0.2.15.42580: Flags [P.], seq 508637:514133, ack 868, win 65535, length 5496
13:05:19.854466 IP 10.0.2.15.42580 > 151.101.117.164.443: Flags [.], ack 514133, win 65535, length 0
13:05:19.854630 IP 151.101.117.164.443 > 10.0.2.15.42580: Flags [P.], seq 514133:516881, ack 868, win 65535, length 2748
13:05:19.854636 IP 10.0.2.15.42580 > 151.101.117.164.443: Flags [.], ack 516881, win 65535, length 0
13:05:19.856116 IP 151.101.117.164.443 > 10.0.2.15.42580: Flags [P.], seq 516881:529247, ack 868, win 65535, length 12366
13:05:19.856136 IP 10.0.2.15.42580 > 151.101.117.164.443: Flags [.], ack 529247, win 65535, length 0
13:05:19.856238 IP 151.101.117.164.443 > 10.0.2.15.42580: Flags [P.], seq 529247:536117, ack 868, win 65535, length 6870
13:05:19.856247 IP 10.0.2.15.42580 > 151.101.117.164.443: Flags [.], ack 536117, win 65535, length 0
13:05:19.856801 IP 151.101.117.164.443 > 10.0.2.15.42580: Flags [P.], seq 536117:540239, ack 868, win 65535, length 4122
13:05:19.856803 IP 151.101.117.164.443 > 10.0.2.15.42580: Flags [P.], seq 540239:545735, ack 868, win 65535, length 5496
13:05:19.856820 IP 10.0.2.15.42580 > 151.101.117.164.443: Flags [.], ack 540239, win 65535, length 0
13:05:19.856840 IP 10.0.2.15.42580 > 151.101.117.164.443: Flags [.], ack 545735, win 65535, length 0
13:05:19.856980 IP 151.101.117.164.443 > 10.0.2.15.42580: Flags [P.], seq 545735:552605, ack 868, win 65535, length 6870
13:05:19.856985 IP 10.0.2.15.42580 > 151.101.117.164.443: Flags [.], ack 552605, win 65535, length 0
13:05:19.860671 IP 151.101.117.164.443 > 10.0.2.15.42580: Flags [P.], seq 552605:564971, ack 868, win 65535, length 12366
13:05:19.860689 IP 10.0.2.15.42580 > 151.101.117.164.443: Flags [.], ack 564971, win 65535, length 0
13:05:19.860931 IP 151.101.117.164.443 > 10.0.2.15.42580: Flags [P.], seq 564971:571841, ack 868, win 65535, length 6870
13:05:19.860942 IP 10.0.2.15.42580 > 151.101.117.164.443: Flags [.], ack 571841, win 65535, length 0
13:05:19.862383 IP 151.101.117.164.443 > 10.0.2.15.42580: Flags [P.], seq 571841:578711, ack 868, win 65535, length 6870
13:05:19.862385 IP 151.101.117.164.443 > 10.0.2.15.42580: Flags [P.], seq 578711:586955, ack 868, win 65535, length 8244
13:05:19.862449 IP 10.0.2.15.42580 > 151.101.117.164.443: Flags [.], ack 578711, win 65535, length 0
13:05:19.862484 IP 10.0.2.15.42580 > 151.101.117.164.443: Flags [.], ack 586955, win 65535, length 0
13:05:19.862573 IP 151.101.117.164.443 > 10.0.2.15.42580: Flags [P.], seq 586955:593825, ack 868, win 65535, length 6870
13:05:19.862575 IP 151.101.117.164.443 > 10.0.2.15.42580: Flags [P.], seq 593825:600695, ack 868, win 65535, length 6870
13:05:19.862588 IP 10.0.2.15.42580 > 151.101.117.164.443: Flags [.], ack 593825, win 65535, length 0
13:05:19.862611 IP 10.0.2.15.42580 > 151.101.117.164.443: Flags [.], ack 600695, win 65535, length 0
13:05:19.862627 IP 151.101.117.164.443 > 10.0.2.15.42580: Flags [P.], seq 600695:602069, ack 868, win 65535, length 1374
13:05:19.862628 IP 151.101.117.164.443 > 10.0.2.15.42580: Flags [P.], seq 602069:608939, ack 868, win 65535, length 6870
13:05:19.862634 IP 10.0.2.15.42580 > 151.101.117.164.443: Flags [.], ack 608939, win 65535, length 0
13:05:19.862846 IP 151.101.117.164.443 > 10.0.2.15.42580: Flags [P.], seq 608939:611687, ack 868, win 65535, length 2748
13:05:19.862854 IP 10.0.2.15.42580 > 151.101.117.164.443: Flags [.], ack 611687, win 65535, length 0
13:05:19.863119 IP 151.101.117.164.443 > 10.0.2.15.42580: Flags [P.], seq 611687:617183, ack 868, win 65535, length 5496
13:05:19.863130 IP 10.0.2.15.42580 > 151.101.117.164.443: Flags [.], ack 617183, win 65535, length 0
13:05:19.863379 IP 151.101.117.164.443 > 10.0.2.15.42580: Flags [P.], seq 617183:622679, ack 868, win 65535, length 5496
13:05:19.863634 IP 151.101.117.164.443 > 10.0.2.15.42580: Flags [P.], seq 622679:629549, ack 868, win 65535, length 6870
13:05:19.863660 IP 10.0.2.15.42580 > 151.101.117.164.443: Flags [.], ack 629549, win 65535, length 0
13:05:19.863821 IP 151.101.117.164.443 > 10.0.2.15.42580: Flags [P.], seq 629549:630923, ack 868, win 65535, length 1374
13:05:19.864973 IP 151.101.117.164.443 > 10.0.2.15.42580: Flags [P.], seq 630923:639167, ack 868, win 65535, length 8244
13:05:19.864992 IP 10.0.2.15.42580 > 151.101.117.164.443: Flags [.], ack 639167, win 65535, length 0
13:05:19.865321 IP 151.101.117.164.443 > 10.0.2.15.42580: Flags [P.], seq 639167:648785, ack 868, win 65535, length 9618
13:05:19.865373 IP 10.0.2.15.42580 > 151.101.117.164.443: Flags [.], ack 648785, win 65535, length 0
13:05:19.865657 IP 151.101.117.164.443 > 10.0.2.15.42580: Flags [P.], seq 648785:655655, ack 868, win 65535, length 6870
13:05:19.865671 IP 10.0.2.15.42580 > 151.101.117.164.443: Flags [.], ack 655655, win 65535, length 0
13:05:19.865907 IP 151.101.117.164.443 > 10.0.2.15.42580: Flags [P.], seq 655655:662525, ack 868, win 65535, length 6870
13:05:19.865918 IP 10.0.2.15.42580 > 151.101.117.164.443: Flags [.], ack 662525, win 65535, length 0
13:05:19.866193 IP 151.101.117.164.443 > 10.0.2.15.42580: Flags [P.], seq 662525:669395, ack 868, win 65535, length 6870
13:05:19.866202 IP 10.0.2.15.42580 > 151.101.117.164.443: Flags [.], ack 669395, win 65535, length 0
13:05:19.866440 IP 151.101.117.164.443 > 10.0.2.15.42580: Flags [.], seq 669395:670855, ack 868, win 65535, length 1460
13:05:19.866564 IP 151.101.117.164.443 > 10.0.2.15.42580: Flags [P.], seq 670855:672645, ack 868, win 65535, length 1790
13:05:19.866572 IP 10.0.2.15.42580 > 151.101.117.164.443: Flags [.], ack 672645, win 65535, length 0
13:05:19.868193 IP 151.101.117.164.443 > 10.0.2.15.42580: Flags [P.], seq 672645:680889, ack 868, win 65535, length 8244
13:05:19.868211 IP 10.0.2.15.42580 > 151.101.117.164.443: Flags [.], ack 680889, win 65535, length 0
13:05:19.868453 IP 151.101.117.164.443 > 10.0.2.15.42580: Flags [P.], seq 680889:686385, ack 868, win 65535, length 5496
13:05:19.868463 IP 10.0.2.15.42580 > 151.101.117.164.443: Flags [.], ack 686385, win 65535, length 0
13:05:19.868597 IP 151.101.117.164.443 > 10.0.2.15.42580: Flags [P.], seq 686385:691881, ack 868, win 65535, length 5496
13:05:19.868773 IP 151.101.117.164.443 > 10.0.2.15.42580: Flags [P.], seq 691881:693255, ack 868, win 65535, length 1374
13:05:19.869403 IP 151.101.117.164.443 > 10.0.2.15.42580: Flags [P.], seq 693255:700125, ack 868, win 65535, length 6870
13:05:19.869406 IP 151.101.117.164.443 > 10.0.2.15.42580: Flags [P.], seq 700125:704247, ack 868, win 65535, length 4122
13:05:19.869911 IP 151.101.117.164.443 > 10.0.2.15.42580: Flags [.], seq 704247:707167, ack 868, win 65535, length 2920
13:05:19.870287 IP 151.101.117.164.443 > 10.0.2.15.42580: Flags [P.], seq 707167:712491, ack 868, win 65535, length 5324
13:05:19.870290 IP 151.101.117.164.443 > 10.0.2.15.42580: Flags [P.], seq 712491:716613, ack 868, win 65535, length 4122
13:05:19.870291 IP 151.101.117.164.443 > 10.0.2.15.42580: Flags [P.], seq 716613:723483, ack 868, win 65535, length 6870
13:05:19.870450 IP 10.0.2.15.42580 > 151.101.117.164.443: Flags [.], ack 723483, win 65535, length 0
13:05:19.870971 IP 151.101.117.164.443 > 10.0.2.15.42580: Flags [P.], seq 723483:732599, ack 868, win 65535, length 9116
13:05:19.870984 IP 10.0.2.15.42580 > 151.101.117.164.443: Flags [.], ack 732599, win 65535, length 0
13:05:19.872176 IP 151.101.117.164.443 > 10.0.2.15.42580: Flags [P.], seq 732599:738095, ack 868, win 65535, length 5496
13:05:19.872191 IP 10.0.2.15.42580 > 151.101.117.164.443: Flags [.], ack 738095, win 65535, length 0
13:05:19.872730 IP 151.101.117.164.443 > 10.0.2.15.42580: Flags [P.], seq 738095:744965, ack 868, win 65535, length 6870
13:05:19.872806 IP 10.0.2.15.42580 > 151.101.117.164.443: Flags [.], ack 744965, win 65535, length 0
13:05:19.872913 IP 151.101.117.164.443 > 10.0.2.15.42580: Flags [P.], seq 744965:750461, ack 868, win 65535, length 5496
13:05:19.873498 IP 151.101.117.164.443 > 10.0.2.15.42580: Flags [P.], seq 750461:758705, ack 868, win 65535, length 8244
13:05:19.873501 IP 151.101.117.164.443 > 10.0.2.15.42580: Flags [P.], seq 758705:764201, ack 868, win 65535, length 5496
13:05:19.873765 IP 151.101.117.164.443 > 10.0.2.15.42580: Flags [P.], seq 764201:766949, ack 868, win 65535, length 2748
13:05:19.873967 IP 151.101.117.164.443 > 10.0.2.15.42580: Flags [P.], seq 766949:773819, ack 868, win 65535, length 6870
13:05:19.874285 IP 151.101.117.164.443 > 10.0.2.15.42580: Flags [P.], seq 773819:778443, ack 868, win 65535, length 4624
13:05:19.875019 IP 10.0.2.15.42580 > 151.101.117.164.443: Flags [.], ack 778443, win 65535, length 0
13:05:19.875630 IP 151.101.117.164.443 > 10.0.2.15.42580: Flags [.], seq 778443:797423, ack 868, win 65535, length 18980
13:05:19.875647 IP 10.0.2.15.42580 > 151.101.117.164.443: Flags [.], ack 797423, win 65535, length 0
13:05:19.875832 IP 151.101.117.164.443 > 10.0.2.15.42580: Flags [P.], seq 797423:802673, ack 868, win 65535, length 5250
13:05:19.875834 IP 151.101.117.164.443 > 10.0.2.15.42580: Flags [P.], seq 802673:808169, ack 868, win 65535, length 5496
13:05:19.876116 IP 151.101.117.164.443 > 10.0.2.15.42580: Flags [P.], seq 808169:813665, ack 868, win 65535, length 5496
13:05:19.876177 IP 10.0.2.15.42580 > 151.101.117.164.443: Flags [.], ack 813665, win 65535, length 0
13:05:19.876324 IP 151.101.117.164.443 > 10.0.2.15.42580: Flags [P.], seq 813665:816413, ack 868, win 65535, length 2748
13:05:19.876479 IP 10.0.2.15.42580 > 151.101.117.164.443: Flags [.], ack 816413, win 65535, length 0
13:05:19.877361 IP 151.101.117.164.443 > 10.0.2.15.42580: Flags [P.], seq 816413:823283, ack 868, win 65535, length 6870
13:05:19.877376 IP 10.0.2.15.42580 > 151.101.117.164.443: Flags [.], ack 823283, win 65535, length 0
13:05:19.877699 IP 151.101.117.164.443 > 10.0.2.15.42580: Flags [P.], seq 823283:832901, ack 868, win 65535, length 9618
13:05:19.877754 IP 10.0.2.15.42580 > 151.101.117.164.443: Flags [.], ack 832901, win 65535, length 0
13:05:19.877937 IP 151.101.117.164.443 > 10.0.2.15.42580: Flags [P.], seq 832901:839771, ack 868, win 65535, length 6870
13:05:19.878087 IP 151.101.117.164.443 > 10.0.2.15.42580: Flags [P.], seq 839771:842519, ack 868, win 65535, length 2748
13:05:19.878155 IP 10.0.2.15.42580 > 151.101.117.164.443: Flags [.], ack 842519, win 65535, length 0
13:05:19.878506 IP 151.101.117.164.443 > 10.0.2.15.42580: Flags [P.], seq 842519:848015, ack 868, win 65535, length 5496
13:05:19.878518 IP 10.0.2.15.42580 > 151.101.117.164.443: Flags [.], ack 848015, win 65535, length 0
13:05:19.879503 IP 151.101.117.164.443 > 10.0.2.15.42580: Flags [P.], seq 848015:856259, ack 868, win 65535, length 8244
13:05:19.879506 IP 151.101.117.164.443 > 10.0.2.15.42580: Flags [.], seq 856259:859179, ack 868, win 65535, length 2920
13:05:19.879602 IP 151.101.117.164.443 > 10.0.2.15.42580: Flags [P.], seq 859179:863129, ack 868, win 65535, length 3950
13:05:19.879604 IP 151.101.117.164.443 > 10.0.2.15.42580: Flags [P.], seq 863129:868625, ack 868, win 65535, length 5496
13:05:19.879605 IP 151.101.117.164.443 > 10.0.2.15.42580: Flags [P.], seq 868625:875495, ack 868, win 65535, length 6870
13:05:19.879677 IP 10.0.2.15.42580 > 151.101.117.164.443: Flags [.], ack 875495, win 65535, length 0
13:05:19.881694 IP 151.101.117.164.443 > 10.0.2.15.42580: Flags [P.], seq 875495:887861, ack 868, win 65535, length 12366
13:05:19.881855 IP 10.0.2.15.42580 > 151.101.117.164.443: Flags [.], ack 887861, win 65535, length 0
13:05:19.882073 IP 151.101.117.164.443 > 10.0.2.15.42580: Flags [P.], seq 887861:897479, ack 868, win 65535, length 9618
13:05:19.882492 IP 10.0.2.15.42580 > 151.101.117.164.443: Flags [.], ack 897479, win 65535, length 0
13:05:19.882525 IP 151.101.117.164.443 > 10.0.2.15.42580: Flags [P.], seq 897479:904349, ack 868, win 65535, length 6870
13:05:19.882527 IP 151.101.117.164.443 > 10.0.2.15.42580: Flags [P.], seq 904349:905723, ack 868, win 65535, length 1374
13:05:19.882701 IP 151.101.117.164.443 > 10.0.2.15.42580: Flags [P.], seq 905723:915341, ack 868, win 65535, length 9618
13:05:19.882768 IP 10.0.2.15.42580 > 151.101.117.164.443: Flags [.], ack 915341, win 65535, length 0
13:05:19.883085 IP 151.101.117.164.443 > 10.0.2.15.42580: Flags [.], seq 915341:916801, ack 868, win 65535, length 1460
13:05:19.883355 IP 151.101.117.164.443 > 10.0.2.15.42580: Flags [P.], seq 916801:920837, ack 868, win 65535, length 4036
13:05:19.883370 IP 10.0.2.15.42580 > 151.101.117.164.443: Flags [.], ack 920837, win 65535, length 0
13:05:19.883752 IP 151.101.117.164.443 > 10.0.2.15.42580: Flags [P.], seq 920837:929081, ack 868, win 65535, length 8244
13:05:19.883754 IP 151.101.117.164.443 > 10.0.2.15.42580: Flags [P.], seq 929081:935951, ack 868, win 65535, length 6870
13:05:19.883878 IP 10.0.2.15.42580 > 151.101.117.164.443: Flags [.], ack 935951, win 65535, length 0
13:05:19.884094 IP 151.101.117.164.443 > 10.0.2.15.42580: Flags [P.], seq 935951:941447, ack 868, win 65535, length 5496
13:05:19.884166 IP 10.0.2.15.42580 > 151.101.117.164.443: Flags [.], ack 941447, win 65535, length 0
13:05:19.884404 IP 151.101.117.164.443 > 10.0.2.15.42580: Flags [P.], seq 941447:945569, ack 868, win 65535, length 4122
13:05:19.884412 IP 10.0.2.15.42580 > 151.101.117.164.443: Flags [.], ack 945569, win 65535, length 0
13:05:19.884624 IP 151.101.117.164.443 > 10.0.2.15.42580: Flags [P.], seq 945569:951065, ack 868, win 65535, length 5496
13:05:19.884663 IP 10.0.2.15.42580 > 151.101.117.164.443: Flags [.], ack 951065, win 65535, length 0
13:05:19.884920 IP 151.101.117.164.443 > 10.0.2.15.42580: Flags [P.], seq 951065:953813, ack 868, win 65535, length 2748
13:05:19.884929 IP 10.0.2.15.42580 > 151.101.117.164.443: Flags [.], ack 953813, win 65535, length 0
13:05:19.886279 IP 151.101.117.164.443 > 10.0.2.15.42580: Flags [P.], seq 953813:960683, ack 868, win 65535, length 6870
13:05:19.886282 IP 151.101.117.164.443 > 10.0.2.15.42580: Flags [P.], seq 960683:967553, ack 868, win 65535, length 6870
13:05:19.886519 IP 151.101.117.164.443 > 10.0.2.15.42580: Flags [P.], seq 967553:974423, ack 868, win 65535, length 6870
13:05:19.886909 IP 151.101.117.164.443 > 10.0.2.15.42580: Flags [P.], seq 974423:978545, ack 868, win 65535, length 4122
13:05:19.886911 IP 151.101.117.164.443 > 10.0.2.15.42580: Flags [P.], seq 978545:985415, ack 868, win 65535, length 6870
13:05:19.886952 IP 10.0.2.15.42580 > 151.101.117.164.443: Flags [.], ack 985415, win 65535, length 0
13:05:19.887213 IP 151.101.117.164.443 > 10.0.2.15.42580: Flags [P.], seq 985415:986789, ack 868, win 65535, length 1374
13:05:19.887527 IP 151.101.117.164.443 > 10.0.2.15.42580: Flags [P.], seq 986789:992285, ack 868, win 65535, length 5496
13:05:19.887840 IP 151.101.117.164.443 > 10.0.2.15.42580: Flags [P.], seq 992285:1000529, ack 868, win 65535, length 8244
13:05:19.888041 IP 151.101.117.164.443 > 10.0.2.15.42580: Flags [P.], seq 1000529:1006025, ack 868, win 65535, length 5496
13:05:19.888377 IP 151.101.117.164.443 > 10.0.2.15.42580: Flags [P.], seq 1006025:1011521, ack 868, win 65535, length 5496
13:05:19.888673 IP 151.101.117.164.443 > 10.0.2.15.42580: Flags [P.], seq 1011521:1015643, ack 868, win 65535, length 4122
13:05:19.888881 IP 151.101.117.164.443 > 10.0.2.15.42580: Flags [P.], seq 1015643:1022513, ack 868, win 65535, length 6870
13:05:19.889046 IP 10.0.2.15.42580 > 151.101.117.164.443: Flags [.], ack 1022513, win 65535, length 0
13:05:19.889688 IP 151.101.117.164.443 > 10.0.2.15.42580: Flags [P.], seq 1022513:1032131, ack 868, win 65535, length 9618
13:05:19.889792 IP 10.0.2.15.42580 > 151.101.117.164.443: Flags [.], ack 1032131, win 65535, length 0
13:05:19.890555 IP 151.101.117.164.443 > 10.0.2.15.42580: Flags [P.], seq 1032131:1040375, ack 868, win 65535, length 8244
13:05:19.890558 IP 151.101.117.164.443 > 10.0.2.15.42580: Flags [P.], seq 1040375:1045871, ack 868, win 65535, length 5496
13:05:19.890699 IP 10.0.2.15.42580 > 151.101.117.164.443: Flags [.], ack 1040375, win 65535, length 0
13:05:19.890907 IP 151.101.117.164.443 > 10.0.2.15.42580: Flags [P.], seq 1045871:1051367, ack 868, win 65535, length 5496
13:05:19.891146 IP 151.101.117.164.443 > 10.0.2.15.42580: Flags [P.], seq 1051367:1058237, ack 868, win 65535, length 6870
13:05:19.891201 IP 10.0.2.15.42580 > 151.101.117.164.443: Flags [.], ack 1058237, win 65535, length 0
13:05:19.891420 IP 151.101.117.164.443 > 10.0.2.15.42580: Flags [P.], seq 1058237:1063733, ack 868, win 65535, length 5496
13:05:19.891453 IP 10.0.2.15.42580 > 151.101.117.164.443: Flags [.], ack 1063733, win 65535, length 0
13:05:19.891811 IP 151.101.117.164.443 > 10.0.2.15.42580: Flags [P.], seq 1063733:1069229, ack 868, win 65535, length 5496
13:05:19.891850 IP 10.0.2.15.42580 > 151.101.117.164.443: Flags [.], ack 1069229, win 65535, length 0
13:05:19.892061 IP 151.101.117.164.443 > 10.0.2.15.42580: Flags [P.], seq 1069229:1074725, ack 868, win 65535, length 5496
13:05:19.892262 IP 10.0.2.15.42580 > 151.101.117.164.443: Flags [.], ack 1074725, win 65535, length 0
13:05:19.892590 IP 151.101.117.164.443 > 10.0.2.15.42580: Flags [P.], seq 1074725:1081595, ack 868, win 65535, length 6870
13:05:19.892690 IP 151.101.117.164.443 > 10.0.2.15.42580: Flags [P.], seq 1081595:1089839, ack 868, win 65535, length 8244
13:05:19.892725 IP 10.0.2.15.42580 > 151.101.117.164.443: Flags [.], ack 1089839, win 65535, length 0
13:05:19.892898 IP 151.101.117.164.443 > 10.0.2.15.42580: Flags [P.], seq 1089839:1092587, ack 868, win 65535, length 2748
13:05:19.892909 IP 10.0.2.15.42580 > 151.101.117.164.443: Flags [.], ack 1092587, win 65535, length 0
13:05:19.893163 IP 151.101.117.164.443 > 10.0.2.15.42580: Flags [P.], seq 1092587:1098083, ack 868, win 65535, length 5496
13:05:19.893216 IP 10.0.2.15.42580 > 151.101.117.164.443: Flags [.], ack 1098083, win 65535, length 0
13:05:19.893445 IP 151.101.117.164.443 > 10.0.2.15.42580: Flags [P.], seq 1098083:1103579, ack 868, win 65535, length 5496
13:05:19.893625 IP 151.101.117.164.443 > 10.0.2.15.42580: Flags [.], seq 1103579:1106499, ack 868, win 65535, length 2920
13:05:19.893774 IP 151.101.117.164.443 > 10.0.2.15.42580: Flags [P.], seq 1106499:1109075, ack 868, win 65535, length 2576
13:05:19.893890 IP 10.0.2.15.42580 > 151.101.117.164.443: Flags [.], ack 1109075, win 65535, length 0
13:05:19.894086 IP 151.101.117.164.443 > 10.0.2.15.42580: Flags [P.], seq 1109075:1110449, ack 868, win 65535, length 1374
13:05:19.895252 IP 151.101.117.164.443 > 10.0.2.15.42580: Flags [P.], seq 1110449:1121441, ack 868, win 65535, length 10992
13:05:19.895266 IP 10.0.2.15.42580 > 151.101.117.164.443: Flags [.], ack 1121441, win 65535, length 0
13:05:19.895560 IP 151.101.117.164.443 > 10.0.2.15.42580: Flags [P.], seq 1121441:1125563, ack 868, win 65535, length 4122
13:05:19.895595 IP 10.0.2.15.42580 > 151.101.117.164.443: Flags [.], ack 1125563, win 65535, length 0
13:05:19.895888 IP 151.101.117.164.443 > 10.0.2.15.42580: Flags [P.], seq 1125563:1131059, ack 868, win 65535, length 5496
13:05:19.896080 IP 151.101.117.164.443 > 10.0.2.15.42580: Flags [P.], seq 1131059:1140677, ack 868, win 65535, length 9618
13:05:19.896175 IP 10.0.2.15.42580 > 151.101.117.164.443: Flags [.], ack 1140677, win 65535, length 0
13:05:19.896412 IP 151.101.117.164.443 > 10.0.2.15.42580: Flags [P.], seq 1140677:1144799, ack 868, win 65535, length 4122
13:05:19.896507 IP 10.0.2.15.42580 > 151.101.117.164.443: Flags [.], ack 1144799, win 65535, length 0
13:05:19.896747 IP 151.101.117.164.443 > 10.0.2.15.42580: Flags [P.], seq 1144799:1150295, ack 868, win 65535, length 5496
13:05:19.896814 IP 10.0.2.15.42580 > 151.101.117.164.443: Flags [.], ack 1150295, win 65535, length 0
13:05:19.896972 IP 151.101.117.164.443 > 10.0.2.15.42580: Flags [P.], seq 1150295:1155791, ack 868, win 65535, length 5496
13:05:19.897005 IP 10.0.2.15.42580 > 151.101.117.164.443: Flags [.], ack 1155791, win 65535, length 0
13:05:19.897374 IP 151.101.117.164.443 > 10.0.2.15.42580: Flags [P.], seq 1155791:1164035, ack 868, win 65535, length 8244
13:05:19.897490 IP 10.0.2.15.42580 > 151.101.117.164.443: Flags [.], ack 1164035, win 65535, length 0
13:05:19.897756 IP 151.101.117.164.443 > 10.0.2.15.42580: Flags [P.], seq 1164035:1166783, ack 868, win 65535, length 2748
13:05:19.897759 IP 151.101.117.164.443 > 10.0.2.15.42580: Flags [.], seq 1166783:1172623, ack 868, win 65535, length 5840
13:05:19.897774 IP 10.0.2.15.42580 > 151.101.117.164.443: Flags [.], ack 1166783, win 65535, length 0
13:05:19.897946 IP 151.101.117.164.443 > 10.0.2.15.42580: Flags [P.], seq 1172623:1173653, ack 868, win 65535, length 1030
13:05:19.897957 IP 10.0.2.15.42580 > 151.101.117.164.443: Flags [.], ack 1172623, win 65535, length 0
13:05:19.898117 IP 151.101.117.164.443 > 10.0.2.15.42580: Flags [.], seq 1173653:1179493, ack 868, win 65535, length 5840
13:05:19.898160 IP 10.0.2.15.42580 > 151.101.117.164.443: Flags [.], ack 1179493, win 65535, length 0
13:05:19.898283 IP 151.101.117.164.443 > 10.0.2.15.42580: Flags [P.], seq 1179493:1180523, ack 868, win 65535, length 1030
13:05:19.898472 IP 151.101.117.164.443 > 10.0.2.15.42580: Flags [P.], seq 1180523:1186019, ack 868, win 65535, length 5496
13:05:19.898480 IP 10.0.2.15.42580 > 151.101.117.164.443: Flags [.], ack 1186019, win 65535, length 0
13:05:19.898764 IP 151.101.117.164.443 > 10.0.2.15.42580: Flags [P.], seq 1186019:1188767, ack 868, win 65535, length 2748
13:05:19.898773 IP 10.0.2.15.42580 > 151.101.117.164.443: Flags [.], ack 1188767, win 65535, length 0
13:05:19.900033 IP 151.101.117.164.443 > 10.0.2.15.42580: Flags [P.], seq 1188767:1195637, ack 868, win 65535, length 6870
13:05:19.900038 IP 151.101.117.164.443 > 10.0.2.15.42580: Flags [P.], seq 1195637:1201133, ack 868, win 65535, length 5496
13:05:19.900415 IP 151.101.117.164.443 > 10.0.2.15.42580: Flags [P.], seq 1201133:1210751, ack 868, win 65535, length 9618
13:05:19.900669 IP 151.101.117.164.443 > 10.0.2.15.42580: Flags [P.], seq 1210751:1218995, ack 868, win 65535, length 8244
13:05:19.900740 IP 10.0.2.15.42580 > 151.101.117.164.443: Flags [.], ack 1218995, win 65535, length 0
13:05:19.901059 IP 151.101.117.164.443 > 10.0.2.15.42580: Flags [P.], seq 1218995:1223117, ack 868, win 65535, length 4122
13:05:19.901924 IP 151.101.117.164.443 > 10.0.2.15.42580: Flags [P.], seq 1223117:1228613, ack 868, win 65535, length 5496
13:05:19.901926 IP 151.101.117.164.443 > 10.0.2.15.42580: Flags [P.], seq 1228613:1235483, ack 868, win 65535, length 6870
13:05:19.901954 IP 151.101.117.164.443 > 10.0.2.15.42580: Flags [P.], seq 1235483:1240979, ack 868, win 65535, length 5496

