19:58:48.817584 IP 10.0.2.15.59333 > 140.233.253.2.53: 8712+ A? www.nytimes.com. (33)
19:58:48.817624 IP 10.0.2.15.59333 > 140.233.253.2.53: 47110+ AAAA? www.nytimes.com. (33)
19:58:48.823820 IP 140.233.253.2.53 > 10.0.2.15.59333: 8712 3/0/0 CNAME www.prd.map.nytimes.com., CNAME nytimes.map.fastly.net., A 151.101.117.164 (111)
19:58:48.823822 IP 140.233.253.2.53 > 10.0.2.15.59333: 47110 2/1/0 CNAME www.prd.map.nytimes.com., CNAME nytimes.map.fastly.net. (153)
19:58:48.824075 IP 10.0.2.15.44146 > 151.101.117.164.443: Flags [S], seq 2137051161, win 64240, options [mss 1460,sackOK,TS val 917731907 ecr 0,nop,wscale 6], length 0
19:58:48.838421 IP 151.101.117.164.443 > 10.0.2.15.44146: Flags [S.], seq 211776001, ack 2137051162, win 65535, options [mss 1460], length 0
19:58:48.838475 IP 10.0.2.15.44146 > 151.101.117.164.443: Flags [.], ack 1, win 64240, length 0
19:58:48.847970 IP 10.0.2.15.44146 > 151.101.117.164.443: Flags [P.], seq 1:518, ack 1, win 64240, length 517
19:58:48.848392 IP 151.101.117.164.443 > 10.0.2.15.44146: Flags [.], ack 518, win 65535, length 0
19:58:48.910986 IP 151.101.117.164.443 > 10.0.2.15.44146: Flags [.], seq 1:2921, ack 518, win 65535, length 2920
19:58:48.911008 IP 10.0.2.15.44146 > 151.101.117.164.443: Flags [.], ack 2921, win 62780, length 0
19:58:48.911222 IP 151.101.117.164.443 > 10.0.2.15.44146: Flags [P.], seq 2921:5497, ack 518, win 65535, length 2576
19:58:48.911237 IP 10.0.2.15.44146 > 151.101.117.164.443: Flags [.], ack 5497, win 61320, length 0
19:58:48.911885 IP 151.101.117.164.443 > 10.0.2.15.44146: Flags [P.], seq 5497:5607, ack 518, win 65535, length 110
19:58:48.911902 IP 10.0.2.15.44146 > 151.101.117.164.443: Flags [.], ack 5607, win 61210, length 0
19:58:48.913445 IP 10.0.2.15.44146 > 151.101.117.164.443: Flags [P.], seq 518:611, ack 5607, win 62780, length 93
19:58:48.913690 IP 151.101.117.164.443 > 10.0.2.15.44146: Flags [.], ack 611, win 65535, length 0
19:58:48.943832 IP 151.101.117.164.443 > 10.0.2.15.44146: Flags [P.], seq 5607:5658, ack 611, win 65535, length 51
19:58:48.943851 IP 10.0.2.15.44146 > 151.101.117.164.443: Flags [.], ack 5658, win 62780, length 0
19:58:48.944241 IP 10.0.2.15.44146 > 151.101.117.164.443: Flags [P.], seq 611:664, ack 5658, win 62780, length 53
19:58:48.944271 IP 10.0.2.15.44146 > 151.101.117.164.443: Flags [P.], seq 664:720, ack 5658, win 62780, length 56
19:58:48.944433 IP 10.0.2.15.44146 > 151.101.117.164.443: Flags [P.], seq 720:831, ack 5658, win 62780, length 111
19:58:48.944558 IP 151.101.117.164.443 > 10.0.2.15.44146: Flags [.], ack 664, win 65535, length 0
19:58:48.944559 IP 151.101.117.164.443 > 10.0.2.15.44146: Flags [.], ack 720, win 65535, length 0
19:58:48.944663 IP 151.101.117.164.443 > 10.0.2.15.44146: Flags [.], ack 831, win 65535, length 0
19:58:48.959119 IP 151.101.117.164.443 > 10.0.2.15.44146: Flags [P.], seq 5658:5724, ack 831, win 65535, length 66
19:58:48.959141 IP 10.0.2.15.44146 > 151.101.117.164.443: Flags [.], ack 5724, win 62780, length 0
19:58:48.959406 IP 10.0.2.15.44146 > 151.101.117.164.443: Flags [P.], seq 831:869, ack 5724, win 62780, length 38
19:58:48.959744 IP 151.101.117.164.443 > 10.0.2.15.44146: Flags [.], ack 869, win 65535, length 0
19:58:50.832051 IP 151.101.117.164.443 > 10.0.2.15.44146: Flags [.], seq 5724:7184, ack 869, win 65535, length 1460
19:58:50.873899 IP 10.0.2.15.44146 > 151.101.117.164.443: Flags [.], ack 7184, win 62780, length 0
19:58:50.874213 IP 151.101.117.164.443 > 10.0.2.15.44146: Flags [.], seq 7184:10104, ack 869, win 65535, length 2920
19:58:50.874229 IP 10.0.2.15.44146 > 151.101.117.164.443: Flags [.], ack 10104, win 62780, length 0
19:58:50.874650 IP 151.101.117.164.443 > 10.0.2.15.44146: Flags [.], seq 10104:14484, ack 869, win 65535, length 4380
19:58:50.874666 IP 10.0.2.15.44146 > 151.101.117.164.443: Flags [.], ack 14484, win 59860, length 0
19:58:50.874882 IP 151.101.117.164.443 > 10.0.2.15.44146: Flags [.], seq 14484:20324, ack 869, win 65535, length 5840
19:58:50.874895 IP 10.0.2.15.44146 > 151.101.117.164.443: Flags [.], ack 20324, win 55480, length 0
19:58:50.875269 IP 151.101.117.164.443 > 10.0.2.15.44146: Flags [.], seq 20324:27624, ack 869, win 65535, length 7300
19:58:50.875280 IP 10.0.2.15.44146 > 151.101.117.164.443: Flags [.], ack 27624, win 51100, length 0
19:58:50.875481 IP 151.101.117.164.443 > 10.0.2.15.44146: Flags [.], seq 27624:29084, ack 869, win 65535, length 1460
19:58:50.875492 IP 10.0.2.15.44146 > 151.101.117.164.443: Flags [.], ack 29084, win 49640, length 0
19:58:50.875628 IP 151.101.117.164.443 > 10.0.2.15.44146: Flags [.], seq 29084:39304, ack 869, win 65535, length 10220
19:58:50.875636 IP 10.0.2.15.44146 > 151.101.117.164.443: Flags [.], ack 39304, win 43800, length 0
19:58:50.875788 IP 151.101.117.164.443 > 10.0.2.15.44146: Flags [.], seq 39304:50984, ack 869, win 65535, length 11680
19:58:50.875796 IP 10.0.2.15.44146 > 151.101.117.164.443: Flags [.], ack 50984, win 35040, length 0
19:58:50.875949 IP 151.101.117.164.443 > 10.0.2.15.44146: Flags [.], seq 50984:64124, ack 869, win 65535, length 13140
19:58:50.876025 IP 10.0.2.15.44146 > 151.101.117.164.443: Flags [.], ack 64124, win 26280, length 0
19:58:50.876271 IP 151.101.117.164.443 > 10.0.2.15.44146: Flags [.], seq 64124:78724, ack 869, win 65535, length 14600
19:58:50.876294 IP 10.0.2.15.44146 > 151.101.117.164.443: Flags [.], ack 78724, win 62780, length 0
19:58:50.876459 IP 151.101.117.164.443 > 10.0.2.15.44146: Flags [.], seq 78724:86024, ack 869, win 65535, length 7300
19:58:50.876541 IP 151.101.117.164.443 > 10.0.2.15.44146: Flags [.], seq 86024:94784, ack 869, win 65535, length 8760
19:58:50.876556 IP 10.0.2.15.44146 > 151.101.117.164.443: Flags [.], ack 94784, win 65535, length 0
19:58:50.876675 IP 151.101.117.164.443 > 10.0.2.15.44146: Flags [.], seq 94784:105004, ack 869, win 65535, length 10220
19:58:50.876680 IP 10.0.2.15.44146 > 151.101.117.164.443: Flags [.], ack 105004, win 65535, length 0
19:58:50.876857 IP 151.101.117.164.443 > 10.0.2.15.44146: Flags [.], seq 105004:123984, ack 869, win 65535, length 18980
19:58:50.876869 IP 10.0.2.15.44146 > 151.101.117.164.443: Flags [.], ack 123984, win 65535, length 0
19:58:50.877440 IP 151.101.117.164.443 > 10.0.2.15.44146: Flags [.], seq 123984:135664, ack 869, win 65535, length 11680
19:58:50.877584 IP 151.101.117.164.443 > 10.0.2.15.44146: Flags [.], seq 135664:144424, ack 869, win 65535, length 8760
19:58:50.877658 IP 10.0.2.15.44146 > 151.101.117.164.443: Flags [.], ack 144424, win 65535, length 0
19:58:50.877799 IP 151.101.117.164.443 > 10.0.2.15.44146: Flags [.], seq 144424:157564, ack 869, win 65535, length 13140
19:58:50.877806 IP 10.0.2.15.44146 > 151.101.117.164.443: Flags [.], ack 157564, win 65535, length 0
19:58:50.877975 IP 151.101.117.164.443 > 10.0.2.15.44146: Flags [P.], seq 157564:159622, ack 869, win 65535, length 2058
19:58:50.877978 IP 151.101.117.164.443 > 10.0.2.15.44146: Flags [.], seq 159622:172762, ack 869, win 65535, length 13140
19:58:50.878004 IP 10.0.2.15.44146 > 151.101.117.164.443: Flags [.], ack 172762, win 65535, length 0
19:58:50.878189 IP 151.101.117.164.443 > 10.0.2.15.44146: Flags [.], seq 172762:187362, ack 869, win 65535, length 14600
19:58:50.878198 IP 10.0.2.15.44146 > 151.101.117.164.443: Flags [.], ack 187362, win 65535, length 0
19:58:50.878331 IP 151.101.117.164.443 > 10.0.2.15.44146: Flags [P.], seq 187362:198084, ack 869, win 65535, length 10722
19:58:50.878352 IP 10.0.2.15.44146 > 151.101.117.164.443: Flags [.], ack 198084, win 65535, length 0
19:58:50.880419 IP 151.101.117.164.443 > 10.0.2.15.44146: Flags [P.], seq 198084:203580, ack 869, win 65535, length 5496
19:58:50.880422 IP 151.101.117.164.443 > 10.0.2.15.44146: Flags [P.], seq 203580:210450, ack 869, win 65535, length 6870
19:58:50.880441 IP 10.0.2.15.44146 > 151.101.117.164.443: Flags [.], ack 203580, win 65535, length 0
19:58:50.880476 IP 10.0.2.15.44146 > 151.101.117.164.443: Flags [.], ack 210450, win 65535, length 0
19:58:50.880495 IP 151.101.117.164.443 > 10.0.2.15.44146: Flags [P.], seq 210450:213198, ack 869, win 65535, length 2748
19:58:50.880496 IP 151.101.117.164.443 > 10.0.2.15.44146: Flags [P.], seq 213198:215946, ack 869, win 65535, length 2748
19:58:50.880502 IP 10.0.2.15.44146 > 151.101.117.164.443: Flags [.], ack 213198, win 65535, length 0
19:58:50.880515 IP 10.0.2.15.44146 > 151.101.117.164.443: Flags [.], ack 215946, win 65535, length 0
19:58:50.880716 IP 151.101.117.164.443 > 10.0.2.15.44146: Flags [P.], seq 215946:218694, ack 869, win 65535, length 2748
19:58:50.880725 IP 10.0.2.15.44146 > 151.101.117.164.443: Flags [.], ack 218694, win 65535, length 0
19:58:50.880901 IP 151.101.117.164.443 > 10.0.2.15.44146: Flags [P.], seq 218694:221442, ack 869, win 65535, length 2748
19:58:50.880907 IP 10.0.2.15.44146 > 151.101.117.164.443: Flags [.], ack 221442, win 65535, length 0
19:58:50.882635 IP 151.101.117.164.443 > 10.0.2.15.44146: Flags [P.], seq 221442:231060, ack 869, win 65535, length 9618
19:58:50.882658 IP 10.0.2.15.44146 > 151.101.117.164.443: Flags [.], ack 231060, win 65535, length 0
19:58:50.883525 IP 151.101.117.164.443 > 10.0.2.15.44146: Flags [P.], seq 231060:239304, ack 869, win 65535, length 8244
19:58:50.883547 IP 10.0.2.15.44146 > 151.101.117.164.443: Flags [.], ack 239304, win 65535, length 0
19:58:50.884552 IP 151.101.117.164.443 > 10.0.2.15.44146: Flags [P.], seq 239304:239808, ack 869, win 65535, length 504
19:58:50.884569 IP 10.0.2.15.44146 > 151.101.117.164.443: Flags [.], ack 239808, win 65535, length 0
19:58:50.888726 IP 151.101.117.164.443 > 10.0.2.15.44146: Flags [P.], seq 239808:249426, ack 869, win 65535, length 9618
19:58:50.888729 IP 151.101.117.164.443 > 10.0.2.15.44146: Flags [P.], seq 249426:250800, ack 869, win 65535, length 1374
19:58:50.888756 IP 10.0.2.15.44146 > 151.101.117.164.443: Flags [.], ack 249426, win 65535, length 0
19:58:50.888802 IP 10.0.2.15.44146 > 151.101.117.164.443: Flags [.], ack 250800, win 65535, length 0
19:58:50.890038 IP 151.101.117.164.443 > 10.0.2.15.44146: Flags [P.], seq 250800:259044, ack 869, win 65535, length 8244
19:58:50.890062 IP 10.0.2.15.44146 > 151.101.117.164.443: Flags [.], ack 259044, win 65535, length 0
19:58:50.890704 IP 151.101.117.164.443 > 10.0.2.15.44146: Flags [P.], seq 259044:264540, ack 869, win 65535, length 5496
19:58:50.890709 IP 151.101.117.164.443 > 10.0.2.15.44146: Flags [P.], seq 264540:268662, ack 869, win 65535, length 4122
19:58:50.890711 IP 151.101.117.164.443 > 10.0.2.15.44146: Flags [P.], seq 268662:272784, ack 869, win 65535, length 4122
19:58:50.890736 IP 10.0.2.15.44146 > 151.101.117.164.443: Flags [.], ack 264540, win 65535, length 0
19:58:50.890770 IP 10.0.2.15.44146 > 151.101.117.164.443: Flags [.], ack 268662, win 65535, length 0
19:58:50.890789 IP 10.0.2.15.44146 > 151.101.117.164.443: Flags [.], ack 272784, win 65535, length 0
19:58:50.892005 IP 151.101.117.164.443 > 10.0.2.15.44146: Flags [P.], seq 272784:277776, ack 869, win 65535, length 4992
19:58:50.892008 IP 151.101.117.164.443 > 10.0.2.15.44146: Flags [P.], seq 277776:283272, ack 869, win 65535, length 5496
19:58:50.892029 IP 10.0.2.15.44146 > 151.101.117.164.443: Flags [.], ack 277776, win 65535, length 0
19:58:50.892054 IP 10.0.2.15.44146 > 151.101.117.164.443: Flags [.], ack 283272, win 65535, length 0
19:58:50.892469 IP 151.101.117.164.443 > 10.0.2.15.44146: Flags [.], seq 283272:287652, ack 869, win 65535, length 4380
19:58:50.893850 IP 10.0.2.15.44146 > 151.101.117.164.443: Flags [.], ack 287652, win 65535, length 0
19:58:50.894136 IP 151.101.117.164.443 > 10.0.2.15.44146: Flags [P.], seq 287652:288768, ack 869, win 65535, length 1116
19:58:50.894138 IP 151.101.117.164.443 > 10.0.2.15.44146: Flags [P.], seq 288768:291516, ack 869, win 65535, length 2748
19:58:50.894140 IP 151.101.117.164.443 > 10.0.2.15.44146: Flags [P.], seq 291516:297012, ack 869, win 65535, length 5496
19:58:50.894140 IP 151.101.117.164.443 > 10.0.2.15.44146: Flags [P.], seq 297012:299760, ack 869, win 65535, length 2748
19:58:50.894158 IP 10.0.2.15.44146 > 151.101.117.164.443: Flags [.], ack 288768, win 65535, length 0
19:58:50.894180 IP 10.0.2.15.44146 > 151.101.117.164.443: Flags [.], ack 291516, win 65535, length 0
19:58:50.894189 IP 10.0.2.15.44146 > 151.101.117.164.443: Flags [.], ack 297012, win 65535, length 0
19:58:50.894196 IP 10.0.2.15.44146 > 151.101.117.164.443: Flags [.], ack 299760, win 65535, length 0
19:58:50.894211 IP 151.101.117.164.443 > 10.0.2.15.44146: Flags [P.], seq 299760:302508, ack 869, win 65535, length 2748
19:58:50.894215 IP 10.0.2.15.44146 > 151.101.117.164.443: Flags [.], ack 302508, win 65535, length 0
19:58:50.897318 IP 151.101.117.164.443 > 10.0.2.15.44146: Flags [P.], seq 302508:323118, ack 869, win 65535, length 20610
19:58:50.897341 IP 10.0.2.15.44146 > 151.101.117.164.443: Flags [.], ack 323118, win 65535, length 0
19:58:50.897411 IP 151.101.117.164.443 > 10.0.2.15.44146: Flags [P.], seq 323118:329988, ack 869, win 65535, length 6870
19:58:50.897421 IP 10.0.2.15.44146 > 151.101.117.164.443: Flags [.], ack 329988, win 65535, length 0
19:58:50.897778 IP 151.101.117.164.443 > 10.0.2.15.44146: Flags [P.], seq 329988:334110, ack 869, win 65535, length 4122
19:58:50.897781 IP 151.101.117.164.443 > 10.0.2.15.44146: Flags [P.], seq 334110:335484, ack 869, win 65535, length 1374
19:58:50.897797 IP 10.0.2.15.44146 > 151.101.117.164.443: Flags [.], ack 334110, win 65535, length 0
19:58:50.897898 IP 10.0.2.15.44146 > 151.101.117.164.443: Flags [.], ack 335484, win 65535, length 0
19:58:50.898041 IP 151.101.117.164.443 > 10.0.2.15.44146: Flags [P.], seq 335484:340980, ack 869, win 65535, length 5496
19:58:50.898042 IP 151.101.117.164.443 > 10.0.2.15.44146: Flags [P.], seq 340980:342354, ack 869, win 65535, length 1374
19:58:50.898051 IP 10.0.2.15.44146 > 151.101.117.164.443: Flags [.], ack 340980, win 65535, length 0
19:58:50.898068 IP 10.0.2.15.44146 > 151.101.117.164.443: Flags [.], ack 342354, win 65535, length 0
19:58:50.898317 IP 151.101.117.164.443 > 10.0.2.15.44146: Flags [P.], seq 342354:345102, ack 869, win 65535, length 2748
19:58:50.898326 IP 10.0.2.15.44146 > 151.101.117.164.443: Flags [.], ack 345102, win 65535, length 0
19:58:50.898459 IP 151.101.117.164.443 > 10.0.2.15.44146: Flags [P.], seq 345102:347850, ack 869, win 65535, length 2748
19:58:50.898467 IP 10.0.2.15.44146 > 151.101.117.164.443: Flags [.], ack 347850, win 65535, length 0
19:58:50.903873 IP 151.101.117.164.443 > 10.0.2.15.44146: Flags [P.], seq 347850:358842, ack 869, win 65535, length 10992
19:58:50.903920 IP 10.0.2.15.44146 > 151.101.117.164.443: Flags [.], ack 358842, win 65535, length 0
19:58:50.904046 IP 151.101.117.164.443 > 10.0.2.15.44146: Flags [P.], seq 358842:375330, ack 869, win 65535, length 16488
19:58:50.904057 IP 10.0.2.15.44146 > 151.101.117.164.443: Flags [.], ack 375330, win 65535, length 0
19:58:50.904084 IP 151.101.117.164.443 > 10.0.2.15.44146: Flags [P.], seq 375330:378078, ack 869, win 65535, length 2748
19:58:50.904089 IP 10.0.2.15.44146 > 151.101.117.164.443: Flags [.], ack 378078, win 65535, length 0
19:58:50.904667 IP 151.101.117.164.443 > 10.0.2.15.44146: Flags [P.], seq 378078:380826, ack 869, win 65535, length 2748
19:58:50.904670 IP 151.101.117.164.443 > 10.0.2.15.44146: Flags [P.], seq 380826:386322, ack 869, win 65535, length 5496
19:58:50.904804 IP 10.0.2.15.44146 > 151.101.117.164.443: Flags [.], ack 380826, win 65535, length 0
19:58:50.904836 IP 10.0.2.15.44146 > 151.101.117.164.443: Flags [.], ack 386322, win 65535, length 0
19:58:50.905046 IP 151.101.117.164.443 > 10.0.2.15.44146: Flags [P.], seq 386322:391818, ack 869, win 65535, length 5496
19:58:50.905049 IP 151.101.117.164.443 > 10.0.2.15.44146: Flags [.], seq 391818:396198, ack 869, win 65535, length 4380
19:58:50.905067 IP 10.0.2.15.44146 > 151.101.117.164.443: Flags [.], ack 391818, win 65535, length 0
19:58:50.905091 IP 10.0.2.15.44146 > 151.101.117.164.443: Flags [.], ack 396198, win 65535, length 0
19:58:50.905337 IP 151.101.117.164.443 > 10.0.2.15.44146: Flags [P.], seq 396198:397314, ack 869, win 65535, length 1116
19:58:50.905339 IP 151.101.117.164.443 > 10.0.2.15.44146: Flags [P.], seq 397314:401436, ack 869, win 65535, length 4122
19:58:50.905350 IP 10.0.2.15.44146 > 151.101.117.164.443: Flags [.], ack 397314, win 65535, length 0
19:58:50.905370 IP 10.0.2.15.44146 > 151.101.117.164.443: Flags [.], ack 401436, win 65535, length 0
19:58:50.906298 IP 151.101.117.164.443 > 10.0.2.15.44146: Flags [P.], seq 401436:404184, ack 869, win 65535, length 2748
19:58:50.906300 IP 151.101.117.164.443 > 10.0.2.15.44146: Flags [P.], seq 404184:408306, ack 869, win 65535, length 4122
19:58:50.906301 IP 151.101.117.164.443 > 10.0.2.15.44146: Flags [P.], seq 408306:409680, ack 869, win 65535, length 1374
19:58:50.906301 IP 151.101.117.164.443 > 10.0.2.15.44146: Flags [P.], seq 409680:411054, ack 869, win 65535, length 1374
19:58:50.906302 IP 151.101.117.164.443 > 10.0.2.15.44146: Flags [P.], seq 411054:415176, ack 869, win 65535, length 4122
19:58:50.906344 IP 10.0.2.15.44146 > 151.101.117.164.443: Flags [.], ack 404184, win 65535, length 0
19:58:50.906360 IP 10.0.2.15.44146 > 151.101.117.164.443: Flags [.], ack 408306, win 65535, length 0
19:58:50.906372 IP 10.0.2.15.44146 > 151.101.117.164.443: Flags [.], ack 409680, win 65535, length 0
19:58:50.906383 IP 10.0.2.15.44146 > 151.101.117.164.443: Flags [.], ack 411054, win 65535, length 0
19:58:50.906392 IP 10.0.2.15.44146 > 151.101.117.164.443: Flags [.], ack 415176, win 65535, length 0
19:58:50.906414 IP 151.101.117.164.443 > 10.0.2.15.44146: Flags [P.], seq 415176:417924, ack 869, win 65535, length 2748
19:58:50.906415 IP 151.101.117.164.443 > 10.0.2.15.44146: Flags [P.], seq 417924:420672, ack 869, win 65535, length 2748
19:58:50.906421 IP 10.0.2.15.44146 > 151.101.117.164.443: Flags [.], ack 417924, win 65535, length 0
19:58:50.906433 IP 10.0.2.15.44146 > 151.101.117.164.443: Flags [.], ack 420672, win 65535, length 0
19:58:50.907383 IP 151.101.117.164.443 > 10.0.2.15.44146: Flags [P.], seq 420672:424794, ack 869, win 65535, length 4122
19:58:50.907386 IP 151.101.117.164.443 > 10.0.2.15.44146: Flags [P.], seq 424794:427542, ack 869, win 65535, length 2748
19:58:50.907387 IP 151.101.117.164.443 > 10.0.2.15.44146: Flags [P.], seq 427542:428916, ack 869, win 65535, length 1374
19:58:50.907408 IP 10.0.2.15.44146 > 151.101.117.164.443: Flags [.], ack 424794, win 65535, length 0
19:58:50.907439 IP 10.0.2.15.44146 > 151.101.117.164.443: Flags [.], ack 427542, win 65535, length 0
19:58:50.907452 IP 10.0.2.15.44146 > 151.101.117.164.443: Flags [.], ack 428916, win 65535, length 0
19:58:50.907617 IP 151.101.117.164.443 > 10.0.2.15.44146: Flags [P.], seq 428916:431664, ack 869, win 65535, length 2748
19:58:50.907626 IP 10.0.2.15.44146 > 151.101.117.164.443: Flags [.], ack 431664, win 65535, length 0
19:58:50.907750 IP 151.101.117.164.443 > 10.0.2.15.44146: Flags [P.], seq 431664:434412, ack 869, win 65535, length 2748
19:58:50.907751 IP 151.101.117.164.443 > 10.0.2.15.44146: Flags [P.], seq 434412:438534, ack 869, win 65535, length 4122
19:58:50.907759 IP 10.0.2.15.44146 > 151.101.117.164.443: Flags [.], ack 434412, win 65535, length 0
19:58:50.907774 IP 10.0.2.15.44146 > 151.101.117.164.443: Flags [.], ack 438534, win 65535, length 0
19:58:50.908570 IP 151.101.117.164.443 > 10.0.2.15.44146: Flags [P.], seq 438534:444030, ack 869, win 65535, length 5496
19:58:50.908584 IP 10.0.2.15.44146 > 151.101.117.164.443: Flags [.], ack 444030, win 65535, length 0
19:58:50.908781 IP 151.101.117.164.443 > 10.0.2.15.44146: Flags [P.], seq 444030:448152, ack 869, win 65535, length 4122
19:58:50.908782 IP 151.101.117.164.443 > 10.0.2.15.44146: Flags [P.], seq 448152:449526, ack 869, win 65535, length 1374
19:58:50.908792 IP 10.0.2.15.44146 > 151.101.117.164.443: Flags [.], ack 448152, win 65535, length 0
19:58:50.908810 IP 10.0.2.15.44146 > 151.101.117.164.443: Flags [.], ack 449526, win 65535, length 0
19:58:50.909138 IP 151.101.117.164.443 > 10.0.2.15.44146: Flags [P.], seq 449526:452274, ack 869, win 65535, length 2748
19:58:50.909140 IP 151.101.117.164.443 > 10.0.2.15.44146: Flags [P.], seq 452274:455022, ack 869, win 65535, length 2748
19:58:50.909264 IP 10.0.2.15.44146 > 151.101.117.164.443: Flags [.], ack 452274, win 65535, length 0
19:58:50.909398 IP 10.0.2.15.44146 > 151.101.117.164.443: Flags [.], ack 455022, win 65535, length 0
19:58:50.909597 IP 151.101.117.164.443 > 10.0.2.15.44146: Flags [P.], seq 455022:460518, ack 869, win 65535, length 5496
19:58:50.909599 IP 151.101.117.164.443 > 10.0.2.15.44146: Flags [P.], seq 460518:461892, ack 869, win 65535, length 1374
19:58:50.909611 IP 10.0.2.15.44146 > 151.101.117.164.443: Flags [.], ack 460518, win 65535, length 0
19:58:50.909772 IP 10.0.2.15.44146 > 151.101.117.164.443: Flags [.], ack 461892, win 65535, length 0
19:58:50.910520 IP 151.101.117.164.443 > 10.0.2.15.44146: Flags [P.], seq 461892:466014, ack 869, win 65535, length 4122
19:58:50.910522 IP 151.101.117.164.443 > 10.0.2.15.44146: Flags [P.], seq 466014:470136, ack 869, win 65535, length 4122
19:58:50.910522 IP 151.101.117.164.443 > 10.0.2.15.44146: Flags [P.], seq 470136:471510, ack 869, win 65535, length 1374
19:58:50.910523 IP 151.101.117.164.443 > 10.0.2.15.44146: Flags [P.], seq 471510:474258, ack 869, win 65535, length 2748
19:58:50.910537 IP 10.0.2.15.44146 > 151.101.117.164.443: Flags [.], ack 466014, win 65535, length 0
19:58:50.910596 IP 10.0.2.15.44146 > 151.101.117.164.443: Flags [.], ack 470136, win 65535, length 0
19:58:50.910610 IP 10.0.2.15.44146 > 151.101.117.164.443: Flags [.], ack 471510, win 65535, length 0
19:58:50.910622 IP 10.0.2.15.44146 > 151.101.117.164.443: Flags [.], ack 474258, win 65535, length 0
19:58:50.911823 IP 151.101.117.164.443 > 10.0.2.15.44146: Flags [P.], seq 474258:477006, ack 869, win 65535, length 2748
19:58:50.911825 IP 151.101.117.164.443 > 10.0.2.15.44146: Flags [P.], seq 477006:478380, ack 869, win 65535, length 1374
19:58:50.911840 IP 10.0.2.15.44146 > 151.101.117.164.443: Flags [.], ack 477006, win 65535, length 0
19:58:50.911860 IP 10.0.2.15.44146 > 151.101.117.164.443: Flags [.], ack 478380, win 65535, length 0
19:58:50.912025 IP 151.101.117.164.443 > 10.0.2.15.44146: Flags [P.], seq 478380:481128, ack 869, win 65535, length 2748
19:58:50.912026 IP 151.101.117.164.443 > 10.0.2.15.44146: Flags [P.], seq 481128:483876, ack 869, win 65535, length 2748
19:58:50.912027 IP 151.101.117.164.443 > 10.0.2.15.44146: Flags [P.], seq 483876:485250, ack 869, win 65535, length 1374
19:58:50.912028 IP 151.101.117.164.443 > 10.0.2.15.44146: Flags [P.], seq 485250:489372, ack 869, win 65535, length 4122
19:58:50.912097 IP 10.0.2.15.44146 > 151.101.117.164.443: Flags [.], ack 481128, win 65535, length 0
19:58:50.912183 IP 10.0.2.15.44146 > 151.101.117.164.443: Flags [.], ack 483876, win 65535, length 0
19:58:50.912219 IP 10.0.2.15.44146 > 151.101.117.164.443: Flags [.], ack 485250, win 65535, length 0
19:58:50.912248 IP 10.0.2.15.44146 > 151.101.117.164.443: Flags [.], ack 489372, win 65535, length 0
19:58:50.912272 IP 151.101.117.164.443 > 10.0.2.15.44146: Flags [P.], seq 489372:494868, ack 869, win 65535, length 5496
19:58:50.912282 IP 151.101.117.164.443 > 10.0.2.15.44146: Flags [P.], seq 494868:498990, ack 869, win 65535, length 4122
19:58:50.912286 IP 10.0.2.15.44146 > 151.101.117.164.443: Flags [.], ack 494868, win 65535, length 0
19:58:50.912338 IP 10.0.2.15.44146 > 151.101.117.164.443: Flags [.], ack 498990, win 65535, length 0
19:58:50.912686 IP 151.101.117.164.443 > 10.0.2.15.44146: Flags [P.], seq 498990:503112, ack 869, win 65535, length 4122
19:58:50.912863 IP 151.101.117.164.443 > 10.0.2.15.44146: Flags [P.], seq 503112:508608, ack 869, win 65535, length 5496
19:58:50.912864 IP 151.101.117.164.443 > 10.0.2.15.44146: Flags [P.], seq 508608:509982, ack 869, win 65535, length 1374
19:58:50.912877 IP 10.0.2.15.44146 > 151.101.117.164.443: Flags [.], ack 503112, win 65535, length 0
19:58:50.912925 IP 10.0.2.15.44146 > 151.101.117.164.443: Flags [.], ack 508608, win 65535, length 0
19:58:50.912982 IP 10.0.2.15.44146 > 151.101.117.164.443: Flags [.], ack 509982, win 65535, length 0
19:58:50.913007 IP 151.101.117.164.443 > 10.0.2.15.44146: Flags [P.], seq 509982:512730, ack 869, win 65535, length 2748
19:58:50.913012 IP 10.0.2.15.44146 > 151.101.117.164.443: Flags [.], ack 512730, win 65535, length 0
19:58:50.913259 IP 151.101.117.164.443 > 10.0.2.15.44146: Flags [P.], seq 512730:516852, ack 869, win 65535, length 4122
19:58:50.913260 IP 151.101.117.164.443 > 10.0.2.15.44146: Flags [P.], seq 516852:519600, ack 869, win 65535, length 2748
19:58:50.913270 IP 10.0.2.15.44146 > 151.101.117.164.443: Flags [.], ack 516852, win 65535, length 0
19:58:50.913285 IP 10.0.2.15.44146 > 151.101.117.164.443: Flags [.], ack 519600, win 65535, length 0
19:58:50.913435 IP 151.101.117.164.443 > 10.0.2.15.44146: Flags [P.], seq 519600:522348, ack 869, win 65535, length 2748
19:58:50.913441 IP 10.0.2.15.44146 > 151.101.117.164.443: Flags [.], ack 522348, win 65535, length 0
19:58:50.917418 IP 151.101.117.164.443 > 10.0.2.15.44146: Flags [P.], seq 522348:525096, ack 869, win 65535, length 2748
19:58:50.917420 IP 151.101.117.164.443 > 10.0.2.15.44146: Flags [P.], seq 525096:526470, ack 869, win 65535, length 1374
19:58:50.917421 IP 151.101.117.164.443 > 10.0.2.15.44146: Flags [P.], seq 526470:529218, ack 869, win 65535, length 2748
19:58:50.917421 IP 151.101.117.164.443 > 10.0.2.15.44146: Flags [P.], seq 529218:531966, ack 869, win 65535, length 2748
19:58:50.917421 IP 151.101.117.164.443 > 10.0.2.15.44146: Flags [P.], seq 531966:533340, ack 869, win 65535, length 1374
19:58:50.917454 IP 10.0.2.15.44146 > 151.101.117.164.443: Flags [.], ack 525096, win 65535, length 0
19:58:50.917627 IP 10.0.2.15.44146 > 151.101.117.164.443: Flags [.], ack 526470, win 65535, length 0
19:58:50.917639 IP 10.0.2.15.44146 > 151.101.117.164.443: Flags [.], ack 529218, win 65535, length 0
19:58:50.917644 IP 10.0.2.15.44146 > 151.101.117.164.443: Flags [.], ack 531966, win 65535, length 0
19:58:50.917649 IP 10.0.2.15.44146 > 151.101.117.164.443: Flags [.], ack 533340, win 65535, length 0
19:58:50.917672 IP 151.101.117.164.443 > 10.0.2.15.44146: Flags [P.], seq 533340:536088, ack 869, win 65535, length 2748
19:58:50.917673 IP 151.101.117.164.443 > 10.0.2.15.44146: Flags [P.], seq 536088:541584, ack 869, win 65535, length 5496
19:58:50.917674 IP 151.101.117.164.443 > 10.0.2.15.44146: Flags [P.], seq 541584:542958, ack 869, win 65535, length 1374
19:58:50.917674 IP 151.101.117.164.443 > 10.0.2.15.44146: Flags [P.], seq 542958:545706, ack 869, win 65535, length 2748
19:58:50.917680 IP 10.0.2.15.44146 > 151.101.117.164.443: Flags [.], ack 536088, win 65535, length 0
19:58:50.917688 IP 10.0.2.15.44146 > 151.101.117.164.443: Flags [.], ack 541584, win 65535, length 0
19:58:50.917873 IP 10.0.2.15.44146 > 151.101.117.164.443: Flags [.], ack 542958, win 65535, length 0
19:58:50.918017 IP 10.0.2.15.44146 > 151.101.117.164.443: Flags [.], ack 545706, win 65535, length 0
19:58:50.918055 IP 151.101.117.164.443 > 10.0.2.15.44146: Flags [P.], seq 545706:548454, ack 869, win 65535, length 2748
19:58:50.918056 IP 151.101.117.164.443 > 10.0.2.15.44146: Flags [P.], seq 548454:549828, ack 869, win 65535, length 1374
19:58:50.918057 IP 151.101.117.164.443 > 10.0.2.15.44146: Flags [P.], seq 549828:552576, ack 869, win 65535, length 2748
19:58:50.918058 IP 151.101.117.164.443 > 10.0.2.15.44146: Flags [P.], seq 552576:555324, ack 869, win 65535, length 2748
19:58:50.918060 IP 151.101.117.164.443 > 10.0.2.15.44146: Flags [.], seq 555324:567004, ack 869, win 65535, length 11680
19:58:50.918122 IP 10.0.2.15.44146 > 151.101.117.164.443: Flags [.], ack 548454, win 65535, length 0
19:58:50.918143 IP 10.0.2.15.44146 > 151.101.117.164.443: Flags [.], ack 549828, win 65535, length 0
19:58:50.918204 IP 10.0.2.15.44146 > 151.101.117.164.443: Flags [.], ack 552576, win 65535, length 0
19:58:50.918213 IP 10.0.2.15.44146 > 151.101.117.164.443: Flags [.], ack 555324, win 65535, length 0
19:58:50.918223 IP 10.0.2.15.44146 > 151.101.117.164.443: Flags [.], ack 567004, win 65535, length 0
19:58:50.918581 IP 151.101.117.164.443 > 10.0.2.15.44146: Flags [P.], seq 567004:581430, ack 869, win 65535, length 14426
19:58:50.918589 IP 10.0.2.15.44146 > 151.101.117.164.443: Flags [.], ack 581430, win 65535, length 0
19:58:50.918617 IP 151.101.117.164.443 > 10.0.2.15.44146: Flags [P.], seq 581430:592422, ack 869, win 65535, length 10992
19:58:50.918625 IP 10.0.2.15.44146 > 151.101.117.164.443: Flags [.], ack 592422, win 65535, length 0
19:58:50.918639 IP 151.101.117.164.443 > 10.0.2.15.44146: Flags [P.], seq 592422:593796, ack 869, win 65535, length 1374
19:58:50.918642 IP 10.0.2.15.44146 > 151.101.117.164.443: Flags [.], ack 593796, win 65535, length 0
19:58:50.919542 IP 151.101.117.164.443 > 10.0.2.15.44146: Flags [P.], seq 593796:597918, ack 869, win 65535, length 4122
19:58:50.919558 IP 10.0.2.15.44146 > 151.101.117.164.443: Flags [.], ack 597918, win 65535, length 0
19:58:50.919775 IP 151.101.117.164.443 > 10.0.2.15.44146: Flags [P.], seq 597918:603414, ack 869, win 65535, length 5496
19:58:50.919785 IP 10.0.2.15.44146 > 151.101.117.164.443: Flags [.], ack 603414, win 65535, length 0
19:58:50.919890 IP 151.101.117.164.443 > 10.0.2.15.44146: Flags [P.], seq 603414:604788, ack 869, win 65535, length 1374
19:58:50.919898 IP 10.0.2.15.44146 > 151.101.117.164.443: Flags [.], ack 604788, win 65535, length 0
19:58:50.920038 IP 151.101.117.164.443 > 10.0.2.15.44146: Flags [P.], seq 604788:607536, ack 869, win 65535, length 2748
19:58:50.920044 IP 10.0.2.15.44146 > 151.101.117.164.443: Flags [.], ack 607536, win 65535, length 0
19:58:50.920310 IP 151.101.117.164.443 > 10.0.2.15.44146: Flags [P.], seq 607536:610284, ack 869, win 65535, length 2748
19:58:50.920311 IP 151.101.117.164.443 > 10.0.2.15.44146: Flags [P.], seq 610284:611658, ack 869, win 65535, length 1374
19:58:50.920356 IP 10.0.2.15.44146 > 151.101.117.164.443: Flags [.], ack 610284, win 65535, length 0
19:58:50.920430 IP 10.0.2.15.44146 > 151.101.117.164.443: Flags [.], ack 611658, win 65535, length 0
19:58:50.920884 IP 151.101.117.164.443 > 10.0.2.15.44146: Flags [P.], seq 611658:614406, ack 869, win 65535, length 2748
19:58:50.920885 IP 151.101.117.164.443 > 10.0.2.15.44146: Flags [P.], seq 614406:617154, ack 869, win 65535, length 2748
19:58:50.920886 IP 151.101.117.164.443 > 10.0.2.15.44146: Flags [P.], seq 617154:618528, ack 869, win 65535, length 1374
19:58:50.920899 IP 10.0.2.15.44146 > 151.101.117.164.443: Flags [.], ack 614406, win 65535, length 0
19:58:50.920914 IP 10.0.2.15.44146 > 151.101.117.164.443: Flags [.], ack 617154, win 65535, length 0
19:58:50.920922 IP 10.0.2.15.44146 > 151.101.117.164.443: Flags [.], ack 618528, win 65535, length 0
19:58:50.921003 IP 151.101.117.164.443 > 10.0.2.15.44146: Flags [P.], seq 618528:624024, ack 869, win 65535, length 5496
19:58:50.921007 IP 10.0.2.15.44146 > 151.101.117.164.443: Flags [.], ack 624024, win 65535, length 0
19:58:50.921697 IP 151.101.117.164.443 > 10.0.2.15.44146: Flags [P.], seq 624024:628146, ack 869, win 65535, length 4122
19:58:50.921721 IP 10.0.2.15.44146 > 151.101.117.164.443: Flags [.], ack 628146, win 65535, length 0
19:58:50.921848 IP 151.101.117.164.443 > 10.0.2.15.44146: Flags [P.], seq 628146:633642, ack 869, win 65535, length 5496
19:58:50.921857 IP 10.0.2.15.44146 > 151.101.117.164.443: Flags [.], ack 633642, win 65535, length 0
19:58:50.922029 IP 151.101.117.164.443 > 10.0.2.15.44146: Flags [P.], seq 633642:636390, ack 869, win 65535, length 2748
19:58:50.922038 IP 10.0.2.15.44146 > 151.101.117.164.443: Flags [.], ack 636390, win 65535, length 0
19:58:50.922256 IP 151.101.117.164.443 > 10.0.2.15.44146: Flags [P.], seq 636390:639138, ack 869, win 65535, length 2748
19:58:50.922257 IP 151.101.117.164.443 > 10.0.2.15.44146: Flags [P.], seq 639138:640512, ack 869, win 65535, length 1374
19:58:50.922268 IP 10.0.2.15.44146 > 151.101.117.164.443: Flags [.], ack 639138, win 65535, length 0
19:58:50.922283 IP 10.0.2.15.44146 > 151.101.117.164.443: Flags [.], ack 640512, win 65535, length 0
19:58:50.924416 IP 151.101.117.164.443 > 10.0.2.15.44146: Flags [P.], seq 640512:646008, ack 869, win 65535, length 5496
19:58:50.924490 IP 151.101.117.164.443 > 10.0.2.15.44146: Flags [P.], seq 646008:648756, ack 869, win 65535, length 2748
19:58:50.924515 IP 10.0.2.15.44146 > 151.101.117.164.443: Flags [.], ack 646008, win 65535, length 0
19:58:50.924653 IP 10.0.2.15.44146 > 151.101.117.164.443: Flags [.], ack 648756, win 65535, length 0
19:58:50.924943 IP 151.101.117.164.443 > 10.0.2.15.44146: Flags [P.], seq 648756:650130, ack 869, win 65535, length 1374
19:58:50.924945 IP 151.101.117.164.443 > 10.0.2.15.44146: Flags [P.], seq 650130:652878, ack 869, win 65535, length 2748
19:58:50.924946 IP 151.101.117.164.443 > 10.0.2.15.44146: Flags [P.], seq 652878:657000, ack 869, win 65535, length 4122
19:58:50.924946 IP 151.101.117.164.443 > 10.0.2.15.44146: Flags [P.], seq 657000:659748, ack 869, win 65535, length 2748
19:58:50.924991 IP 10.0.2.15.44146 > 151.101.117.164.443: Flags [.], ack 650130, win 65535, length 0
19:58:50.925010 IP 10.0.2.15.44146 > 151.101.117.164.443: Flags [.], ack 652878, win 65535, length 0
19:58:50.925023 IP 10.0.2.15.44146 > 151.101.117.164.443: Flags [.], ack 657000, win 65535, length 0
19:58:50.925085 IP 10.0.2.15.44146 > 151.101.117.164.443: Flags [.], ack 659748, win 65535, length 0
19:58:50.925123 IP 151.101.117.164.443 > 10.0.2.15.44146: Flags [P.], seq 659748:661122, ack 869, win 65535, length 1374
19:58:50.925128 IP 10.0.2.15.44146 > 151.101.117.164.443: Flags [.], ack 661122, win 65535, length 0
19:58:50.925259 IP 151.101.117.164.443 > 10.0.2.15.44146: Flags [P.], seq 661122:663870, ack 869, win 65535, length 2748
19:58:50.925265 IP 10.0.2.15.44146 > 151.101.117.164.443: Flags [.], ack 663870, win 65535, length 0
19:58:50.925393 IP 151.101.117.164.443 > 10.0.2.15.44146: Flags [P.], seq 663870:666618, ack 869, win 65535, length 2748
19:58:50.925399 IP 10.0.2.15.44146 > 151.101.117.164.443: Flags [.], ack 666618, win 65535, length 0
19:58:50.925592 IP 151.101.117.164.443 > 10.0.2.15.44146: Flags [P.], seq 666618:669366, ack 869, win 65535, length 2748
19:58:50.925598 IP 10.0.2.15.44146 > 151.101.117.164.443: Flags [.], ack 669366, win 65535, length 0
19:58:50.926170 IP 151.101.117.164.443 > 10.0.2.15.44146: Flags [P.], seq 669366:672114, ack 869, win 65535, length 2748
19:58:50.926172 IP 151.101.117.164.443 > 10.0.2.15.44146: Flags [P.], seq 672114:674862, ack 869, win 65535, length 2748
19:58:50.926172 IP 151.101.117.164.443 > 10.0.2.15.44146: Flags [P.], seq 674862:677610, ack 869, win 65535, length 2748
19:58:50.926173 IP 151.101.117.164.443 > 10.0.2.15.44146: Flags [P.], seq 677610:680358, ack 869, win 65535, length 2748
19:58:50.926189 IP 10.0.2.15.44146 > 151.101.117.164.443: Flags [.], ack 672114, win 65535, length 0
19:58:50.926263 IP 10.0.2.15.44146 > 151.101.117.164.443: Flags [.], ack 674862, win 65535, length 0
19:58:50.926280 IP 10.0.2.15.44146 > 151.101.117.164.443: Flags [.], ack 677610, win 65535, length 0
19:58:50.926291 IP 10.0.2.15.44146 > 151.101.117.164.443: Flags [.], ack 680358, win 65535, length 0
19:58:50.926308 IP 151.101.117.164.443 > 10.0.2.15.44146: Flags [P.], seq 680358:681732, ack 869, win 65535, length 1374
19:58:50.926313 IP 10.0.2.15.44146 > 151.101.117.164.443: Flags [.], ack 681732, win 65535, length 0
19:58:50.929409 IP 151.101.117.164.443 > 10.0.2.15.44146: Flags [P.], seq 681732:695472, ack 869, win 65535, length 13740
19:58:50.929459 IP 10.0.2.15.44146 > 151.101.117.164.443: Flags [.], ack 695472, win 65535, length 0
19:58:50.929507 IP 151.101.117.164.443 > 10.0.2.15.44146: Flags [.], seq 695472:696932, ack 869, win 65535, length 1460
19:58:50.929566 IP 10.0.2.15.44146 > 151.101.117.164.443: Flags [.], ack 696932, win 65535, length 0
19:58:50.929743 IP 151.101.117.164.443 > 10.0.2.15.44146: Flags [P.], seq 696932:700968, ack 869, win 65535, length 4036
19:58:50.929743 IP 151.101.117.164.443 > 10.0.2.15.44146: Flags [P.], seq 700968:702342, ack 869, win 65535, length 1374
19:58:50.929753 IP 10.0.2.15.44146 > 151.101.117.164.443: Flags [.], ack 700968, win 65535, length 0
19:58:50.929824 IP 10.0.2.15.44146 > 151.101.117.164.443: Flags [.], ack 702342, win 65535, length 0
19:58:50.930258 IP 151.101.117.164.443 > 10.0.2.15.44146: Flags [P.], seq 702342:705090, ack 869, win 65535, length 2748
19:58:50.930260 IP 151.101.117.164.443 > 10.0.2.15.44146: Flags [P.], seq 705090:707838, ack 869, win 65535, length 2748
19:58:50.930260 IP 151.101.117.164.443 > 10.0.2.15.44146: Flags [P.], seq 707838:710586, ack 869, win 65535, length 2748
19:58:50.930261 IP 151.101.117.164.443 > 10.0.2.15.44146: Flags [P.], seq 710586:711960, ack 869, win 65535, length 1374
19:58:50.930273 IP 10.0.2.15.44146 > 151.101.117.164.443: Flags [.], ack 705090, win 65535, length 0
19:58:50.930380 IP 10.0.2.15.44146 > 151.101.117.164.443: Flags [.], ack 707838, win 65535, length 0
19:58:50.930398 IP 10.0.2.15.44146 > 151.101.117.164.443: Flags [.], ack 710586, win 65535, length 0
19:58:50.930412 IP 10.0.2.15.44146 > 151.101.117.164.443: Flags [.], ack 711960, win 65535, length 0
19:58:50.930573 IP 151.101.117.164.443 > 10.0.2.15.44146: Flags [P.], seq 711960:714708, ack 869, win 65535, length 2748
19:58:50.930574 IP 151.101.117.164.443 > 10.0.2.15.44146: Flags [P.], seq 714708:716082, ack 869, win 65535, length 1374
19:58:50.930581 IP 10.0.2.15.44146 > 151.101.117.164.443: Flags [.], ack 714708, win 65535, length 0
19:58:50.930615 IP 10.0.2.15.44146 > 151.101.117.164.443: Flags [.], ack 716082, win 65535, length 0
19:58:50.930718 IP 151.101.117.164.443 > 10.0.2.15.44146: Flags [P.], seq 716082:717456, ack 869, win 65535, length 1374
19:58:50.930737 IP 10.0.2.15.44146 > 151.101.117.164.443: Flags [.], ack 717456, win 65535, length 0
19:58:50.931851 IP 151.101.117.164.443 > 10.0.2.15.44146: Flags [P.], seq 717456:724326, ack 869, win 65535, length 6870
19:58:50.931869 IP 10.0.2.15.44146 > 151.101.117.164.443: Flags [.], ack 724326, win 65535, length 0
19:58:50.932104 IP 151.101.117.164.443 > 10.0.2.15.44146: Flags [P.], seq 724326:728448, ack 869, win 65535, length 4122
19:58:50.932105 IP 151.101.117.164.443 > 10.0.2.15.44146: Flags [P.], seq 728448:729822, ack 869, win 65535, length 1374
19:58:50.932106 IP 151.101.117.164.443 > 10.0.2.15.44146: Flags [P.], seq 729822:731196, ack 869, win 65535, length 1374
19:58:50.932118 IP 10.0.2.15.44146 > 151.101.117.164.443: Flags [.], ack 728448, win 65535, length 0
19:58:50.932137 IP 10.0.2.15.44146 > 151.101.117.164.443: Flags [.], ack 729822, win 65535, length 0
19:58:50.932150 IP 10.0.2.15.44146 > 151.101.117.164.443: Flags [.], ack 731196, win 65535, length 0
19:58:50.934222 IP 151.101.117.164.443 > 10.0.2.15.44146: Flags [P.], seq 731196:733944, ack 869, win 65535, length 2748
19:58:50.934269 IP 151.101.117.164.443 > 10.0.2.15.44146: Flags [P.], seq 733944:738066, ack 869, win 65535, length 4122
19:58:50.934272 IP 151.101.117.164.443 > 10.0.2.15.44146: Flags [P.], seq 738066:739440, ack 869, win 65535, length 1374
19:58:50.934273 IP 151.101.117.164.443 > 10.0.2.15.44146: Flags [P.], seq 739440:743562, ack 869, win 65535, length 4122
19:58:50.934493 IP 10.0.2.15.44146 > 151.101.117.164.443: Flags [.], ack 733944, win 65535, length 0
19:58:50.934534 IP 10.0.2.15.44146 > 151.101.117.164.443: Flags [.], ack 738066, win 65535, length 0
19:58:50.934551 IP 10.0.2.15.44146 > 151.101.117.164.443: Flags [.], ack 739440, win 65535, length 0
19:58:50.934561 IP 10.0.2.15.44146 > 151.101.117.164.443: Flags [.], ack 743562, win 65535, length 0
19:58:50.934589 IP 151.101.117.164.443 > 10.0.2.15.44146: Flags [P.], seq 743562:746310, ack 869, win 65535, length 2748
19:58:50.934590 IP 151.101.117.164.443 > 10.0.2.15.44146: Flags [P.], seq 746310:749058, ack 869, win 65535, length 2748
19:58:50.934591 IP 151.101.117.164.443 > 10.0.2.15.44146: Flags [P.], seq 749058:751806, ack 869, win 65535, length 2748
19:58:50.934592 IP 151.101.117.164.443 > 10.0.2.15.44146: Flags [P.], seq 751806:753180, ack 869, win 65535, length 1374
19:58:50.934599 IP 10.0.2.15.44146 > 151.101.117.164.443: Flags [.], ack 746310, win 65535, length 0
19:58:50.934612 IP 10.0.2.15.44146 > 151.101.117.164.443: Flags [.], ack 749058, win 65535, length 0
19:58:50.934624 IP 10.0.2.15.44146 > 151.101.117.164.443: Flags [.], ack 751806, win 65535, length 0
19:58:50.934633 IP 10.0.2.15.44146 > 151.101.117.164.443: Flags [.], ack 753180, win 65535, length 0
19:58:50.934976 IP 151.101.117.164.443 > 10.0.2.15.44146: Flags [P.], seq 753180:758676, ack 869, win 65535, length 5496
19:58:50.934987 IP 10.0.2.15.44146 > 151.101.117.164.443: Flags [.], ack 758676, win 65535, length 0
19:58:50.935108 IP 151.101.117.164.443 > 10.0.2.15.44146: Flags [P.], seq 758676:760050, ack 869, win 65535, length 1374
19:58:50.935114 IP 10.0.2.15.44146 > 151.101.117.164.443: Flags [.], ack 760050, win 65535, length 0
19:58:50.935374 IP 151.101.117.164.443 > 10.0.2.15.44146: Flags [P.], seq 760050:762798, ack 869, win 65535, length 2748
19:58:50.935386 IP 10.0.2.15.44146 > 151.101.117.164.443: Flags [.], ack 762798, win 65535, length 0
19:58:50.936140 IP 151.101.117.164.443 > 10.0.2.15.44146: Flags [P.], seq 762798:766920, ack 869, win 65535, length 4122
19:58:50.936142 IP 151.101.117.164.443 > 10.0.2.15.44146: Flags [P.], seq 766920:771042, ack 869, win 65535, length 4122
19:58:50.936142 IP 151.101.117.164.443 > 10.0.2.15.44146: Flags [P.], seq 771042:772416, ack 869, win 65535, length 1374
19:58:50.936142 IP 151.101.117.164.443 > 10.0.2.15.44146: Flags [P.], seq 772416:773790, ack 869, win 65535, length 1374
19:58:50.936157 IP 10.0.2.15.44146 > 151.101.117.164.443: Flags [.], ack 766920, win 65535, length 0
19:58:50.936176 IP 10.0.2.15.44146 > 151.101.117.164.443: Flags [.], ack 771042, win 65535, length 0
19:58:50.936188 IP 10.0.2.15.44146 > 151.101.117.164.443: Flags [.], ack 772416, win 65535, length 0
19:58:50.936199 IP 10.0.2.15.44146 > 151.101.117.164.443: Flags [.], ack 773790, win 65535, length 0
19:58:50.936216 IP 151.101.117.164.443 > 10.0.2.15.44146: Flags [P.], seq 773790:776538, ack 869, win 65535, length 2748
19:58:50.936217 IP 151.101.117.164.443 > 10.0.2.15.44146: Flags [P.], seq 776538:777912, ack 869, win 65535, length 1374
19:58:50.936222 IP 10.0.2.15.44146 > 151.101.117.164.443: Flags [.], ack 776538, win 65535, length 0
19:58:50.936234 IP 10.0.2.15.44146 > 151.101.117.164.443: Flags [.], ack 777912, win 65535, length 0
19:58:50.937169 IP 151.101.117.164.443 > 10.0.2.15.44146: Flags [P.], seq 777912:782034, ack 869, win 65535, length 4122
19:58:50.937261 IP 151.101.117.164.443 > 10.0.2.15.44146: Flags [P.], seq 782034:787530, ack 869, win 65535, length 5496
19:58:50.937262 IP 151.101.117.164.443 > 10.0.2.15.44146: Flags [P.], seq 787530:790278, ack 869, win 65535, length 2748
19:58:50.937279 IP 10.0.2.15.44146 > 151.101.117.164.443: Flags [.], ack 782034, win 65535, length 0
19:58:50.937333 IP 10.0.2.15.44146 > 151.101.117.164.443: Flags [.], ack 787530, win 65535, length 0
19:58:50.937346 IP 10.0.2.15.44146 > 151.101.117.164.443: Flags [.], ack 790278, win 65535, length 0
19:58:50.937368 IP 151.101.117.164.443 > 10.0.2.15.44146: Flags [.], seq 790278:791738, ack 869, win 65535, length 1460
19:58:50.937374 IP 10.0.2.15.44146 > 151.101.117.164.443: Flags [.], ack 791738, win 65535, length 0
19:58:50.937593 IP 151.101.117.164.443 > 10.0.2.15.44146: Flags [P.], seq 791738:795774, ack 869, win 65535, length 4036
19:58:50.937602 IP 10.0.2.15.44146 > 151.101.117.164.443: Flags [.], ack 795774, win 65535, length 0
19:58:50.937727 IP 151.101.117.164.443 > 10.0.2.15.44146: Flags [P.], seq 795774:799896, ack 869, win 65535, length 4122
19:58:50.937733 IP 10.0.2.15.44146 > 151.101.117.164.443: Flags [.], ack 799896, win 65535, length 0
19:58:50.938754 IP 151.101.117.164.443 > 10.0.2.15.44146: Flags [P.], seq 799896:804018, ack 869, win 65535, length 4122
19:58:50.938756 IP 151.101.117.164.443 > 10.0.2.15.44146: Flags [P.], seq 804018:805392, ack 869, win 65535, length 1374
19:58:50.938756 IP 151.101.117.164.443 > 10.0.2.15.44146: Flags [P.], seq 805392:808140, ack 869, win 65535, length 2748
19:58:50.938757 IP 151.101.117.164.443 > 10.0.2.15.44146: Flags [P.], seq 808140:813636, ack 869, win 65535, length 5496
19:58:50.938795 IP 10.0.2.15.44146 > 151.101.117.164.443: Flags [.], ack 804018, win 65535, length 0
19:58:50.938833 IP 10.0.2.15.44146 > 151.101.117.164.443: Flags [.], ack 805392, win 65535, length 0
19:58:50.939447 IP 10.0.2.15.44146 > 151.101.117.164.443: Flags [.], ack 808140, win 65535, length 0
19:58:50.939469 IP 10.0.2.15.44146 > 151.101.117.164.443: Flags [.], ack 813636, win 65535, length 0
19:58:50.939546 IP 151.101.117.164.443 > 10.0.2.15.44146: Flags [P.], seq 813636:816384, ack 869, win 65535, length 2748
19:58:50.939547 IP 151.101.117.164.443 > 10.0.2.15.44146: Flags [P.], seq 816384:819132, ack 869, win 65535, length 2748
19:58:50.939548 IP 151.101.117.164.443 > 10.0.2.15.44146: Flags [P.], seq 819132:821880, ack 869, win 65535, length 2748
19:58:50.939549 IP 151.101.117.164.443 > 10.0.2.15.44146: Flags [P.], seq 821880:824628, ack 869, win 65535, length 2748
19:58:50.939556 IP 10.0.2.15.44146 > 151.101.117.164.443: Flags [.], ack 816384, win 65535, length 0
19:58:50.939566 IP 10.0.2.15.44146 > 151.101.117.164.443: Flags [.], ack 819132, win 65535, length 0
19:58:50.939641 IP 10.0.2.15.44146 > 151.101.117.164.443: Flags [.], ack 821880, win 65535, length 0
19:58:50.939656 IP 10.0.2.15.44146 > 151.101.117.164.443: Flags [.], ack 824628, win 65535, length 0
19:58:50.939679 IP 151.101.117.164.443 > 10.0.2.15.44146: Flags [P.], seq 824628:826002, ack 869, win 65535, length 1374
19:58:50.939680 IP 151.101.117.164.443 > 10.0.2.15.44146: Flags [P.], seq 826002:828750, ack 869, win 65535, length 2748
19:58:50.939687 IP 10.0.2.15.44146 > 151.101.117.164.443: Flags [.], ack 826002, win 65535, length 0
19:58:50.939753 IP 10.0.2.15.44146 > 151.101.117.164.443: Flags [.], ack 828750, win 65535, length 0
19:58:50.939967 IP 151.101.117.164.443 > 10.0.2.15.44146: Flags [P.], seq 828750:832872, ack 869, win 65535, length 4122
19:58:50.939977 IP 10.0.2.15.44146 > 151.101.117.164.443: Flags [.], ack 832872, win 65535, length 0
19:58:50.940251 IP 151.101.117.164.443 > 10.0.2.15.44146: Flags [P.], seq 832872:838368, ack 869, win 65535, length 5496
19:58:50.940253 IP 151.101.117.164.443 > 10.0.2.15.44146: Flags [P.], seq 838368:839742, ack 869, win 65535, length 1374
19:58:50.940265 IP 10.0.2.15.44146 > 151.101.117.164.443: Flags [.], ack 838368, win 65535, length 0
19:58:50.940284 IP 10.0.2.15.44146 > 151.101.117.164.443: Flags [.], ack 839742, win 65535, length 0
19:58:50.940624 IP 151.101.117.164.443 > 10.0.2.15.44146: Flags [P.], seq 839742:842490, ack 869, win 65535, length 2748
19:58:50.940626 IP 151.101.117.164.443 > 10.0.2.15.44146: Flags [P.], seq 842490:845238, ack 869, win 65535, length 2748
19:58:50.940638 IP 10.0.2.15.44146 > 151.101.117.164.443: Flags [.], ack 842490, win 65535, length 0
19:58:50.940657 IP 10.0.2.15.44146 > 151.101.117.164.443: Flags [.], ack 845238, win 65535, length 0
19:58:50.940816 IP 151.101.117.164.443 > 10.0.2.15.44146: Flags [P.], seq 845238:847986, ack 869, win 65535, length 2748
19:58:50.940823 IP 10.0.2.15.44146 > 151.101.117.164.443: Flags [.], ack 847986, win 65535, length 0
19:58:50.940964 IP 151.101.117.164.443 > 10.0.2.15.44146: Flags [P.], seq 847986:849360, ack 869, win 65535, length 1374
19:58:50.941000 IP 10.0.2.15.44146 > 151.101.117.164.443: Flags [.], ack 849360, win 65535, length 0
19:58:50.941129 IP 151.101.117.164.443 > 10.0.2.15.44146: Flags [P.], seq 849360:852108, ack 869, win 65535, length 2748
19:58:50.941134 IP 10.0.2.15.44146 > 151.101.117.164.443: Flags [.], ack 852108, win 65535, length 0
19:58:50.941279 IP 151.101.117.164.443 > 10.0.2.15.44146: Flags [P.], seq 852108:854856, ack 869, win 65535, length 2748
19:58:50.941290 IP 10.0.2.15.44146 > 151.101.117.164.443: Flags [.], ack 854856, win 65535, length 0
19:58:50.941484 IP 151.101.117.164.443 > 10.0.2.15.44146: Flags [P.], seq 854856:857604, ack 869, win 65535, length 2748
19:58:50.941485 IP 151.101.117.164.443 > 10.0.2.15.44146: Flags [P.], seq 857604:858978, ack 869, win 65535, length 1374
19:58:50.941497 IP 10.0.2.15.44146 > 151.101.117.164.443: Flags [.], ack 857604, win 65535, length 0
19:58:50.941513 IP 10.0.2.15.44146 > 151.101.117.164.443: Flags [.], ack 858978, win 65535, length 0
19:58:50.942068 IP 151.101.117.164.443 > 10.0.2.15.44146: Flags [P.], seq 858978:861726, ack 869, win 65535, length 2748
19:58:50.942070 IP 151.101.117.164.443 > 10.0.2.15.44146: Flags [P.], seq 861726:864474, ack 869, win 65535, length 2748
19:58:50.942070 IP 151.101.117.164.443 > 10.0.2.15.44146: Flags [P.], seq 864474:865848, ack 869, win 65535, length 1374
19:58:50.942071 IP 151.101.117.164.443 > 10.0.2.15.44146: Flags [.], seq 865848:867308, ack 869, win 65535, length 1460
19:58:50.942083 IP 10.0.2.15.44146 > 151.101.117.164.443: Flags [.], ack 861726, win 65535, length 0
19:58:50.942096 IP 10.0.2.15.44146 > 151.101.117.164.443: Flags [.], ack 864474, win 65535, length 0
19:58:50.942106 IP 10.0.2.15.44146 > 151.101.117.164.443: Flags [.], ack 865848, win 65535, length 0
19:58:50.942113 IP 10.0.2.15.44146 > 151.101.117.164.443: Flags [.], ack 867308, win 65535, length 0
19:58:50.942221 IP 151.101.117.164.443 > 10.0.2.15.44146: Flags [P.], seq 867308:868596, ack 869, win 65535, length 1288
19:58:50.942226 IP 10.0.2.15.44146 > 151.101.117.164.443: Flags [.], ack 868596, win 65535, length 0
19:58:50.942880 IP 151.101.117.164.443 > 10.0.2.15.44146: Flags [P.], seq 868596:871344, ack 869, win 65535, length 2748
19:58:50.942896 IP 10.0.2.15.44146 > 151.101.117.164.443: Flags [.], ack 871344, win 65535, length 0
19:58:50.943265 IP 151.101.117.164.443 > 10.0.2.15.44146: Flags [P.], seq 871344:874092, ack 869, win 65535, length 2748
19:58:50.943267 IP 151.101.117.164.443 > 10.0.2.15.44146: Flags [P.], seq 874092:878214, ack 869, win 65535, length 4122
19:58:50.943280 IP 10.0.2.15.44146 > 151.101.117.164.443: Flags [.], ack 874092, win 65535, length 0
19:58:50.943423 IP 10.0.2.15.44146 > 151.101.117.164.443: Flags [.], ack 878214, win 65535, length 0
19:58:50.943612 IP 151.101.117.164.443 > 10.0.2.15.44146: Flags [P.], seq 878214:880962, ack 869, win 65535, length 2748
19:58:50.943614 IP 151.101.117.164.443 > 10.0.2.15.44146: Flags [P.], seq 880962:885084, ack 869, win 65535, length 4122
19:58:50.943626 IP 10.0.2.15.44146 > 151.101.117.164.443: Flags [.], ack 880962, win 65535, length 0
19:58:50.943674 IP 10.0.2.15.44146 > 151.101.117.164.443: Flags [.], ack 885084, win 65535, length 0
19:58:50.943944 IP 151.101.117.164.443 > 10.0.2.15.44146: Flags [P.], seq 885084:887832, ack 869, win 65535, length 2748
19:58:50.943945 IP 151.101.117.164.443 > 10.0.2.15.44146: Flags [P.], seq 887832:890580, ack 869, win 65535, length 2748
19:58:50.943958 IP 10.0.2.15.44146 > 151.101.117.164.443: Flags [.], ack 887832, win 65535, length 0
19:58:50.944010 IP 10.0.2.15.44146 > 151.101.117.164.443: Flags [.], ack 890580, win 65535, length 0
19:58:50.944161 IP 151.101.117.164.443 > 10.0.2.15.44146: Flags [P.], seq 890580:893328, ack 869, win 65535, length 2748
19:58:50.944162 IP 151.101.117.164.443 > 10.0.2.15.44146: Flags [P.], seq 893328:894702, ack 869, win 65535, length 1374
19:58:50.944169 IP 10.0.2.15.44146 > 151.101.117.164.443: Flags [.], ack 893328, win 65535, length 0
19:58:50.944180 IP 10.0.2.15.44146 > 151.101.117.164.443: Flags [.], ack 894702, win 65535, length 0
19:58:50.944870 IP 151.101.117.164.443 > 10.0.2.15.44146: Flags [P.], seq 894702:897450, ack 869, win 65535, length 2748
19:58:50.944872 IP 151.101.117.164.443 > 10.0.2.15.44146: Flags [P.], seq 897450:900198, ack 869, win 65535, length 2748
19:58:50.944873 IP 151.101.117.164.443 > 10.0.2.15.44146: Flags [P.], seq 900198:902946, ack 869, win 65535, length 2748
19:58:50.944874 IP 151.101.117.164.443 > 10.0.2.15.44146: Flags [P.], seq 902946:904320, ack 869, win 65535, length 1374
19:58:50.944875 IP 151.101.117.164.443 > 10.0.2.15.44146: Flags [P.], seq 904320:908442, ack 869, win 65535, length 4122
19:58:50.944887 IP 10.0.2.15.44146 > 151.101.117.164.443: Flags [.], ack 897450, win 65535, length 0
19:58:50.944911 IP 10.0.2.15.44146 > 151.101.117.164.443: Flags [.], ack 900198, win 65535, length 0
19:58:50.944923 IP 10.0.2.15.44146 > 151.101.117.164.443: Flags [.], ack 902946, win 65535, length 0
19:58:50.944933 IP 10.0.2.15.44146 > 151.101.117.164.443: Flags [.], ack 904320, win 65535, length 0
19:58:50.944944 IP 10.0.2.15.44146 > 151.101.117.164.443: Flags [.], ack 908442, win 65535, length 0
19:58:50.945215 IP 151.101.117.164.443 > 10.0.2.15.44146: Flags [P.], seq 908442:911190, ack 869, win 65535, length 2748
19:58:50.945217 IP 151.101.117.164.443 > 10.0.2.15.44146: Flags [P.], seq 911190:912564, ack 869, win 65535, length 1374
19:58:50.945253 IP 10.0.2.15.44146 > 151.101.117.164.443: Flags [.], ack 911190, win 65535, length 0
19:58:50.945271 IP 10.0.2.15.44146 > 151.101.117.164.443: Flags [.], ack 912564, win 65535, length 0
19:58:50.945449 IP 151.101.117.164.443 > 10.0.2.15.44146: Flags [P.], seq 912564:915312, ack 869, win 65535, length 2748
19:58:50.945452 IP 151.101.117.164.443 > 10.0.2.15.44146: Flags [P.], seq 915312:916686, ack 869, win 65535, length 1374
19:58:50.945512 IP 10.0.2.15.44146 > 151.101.117.164.443: Flags [.], ack 915312, win 65535, length 0
19:58:50.945550 IP 10.0.2.15.44146 > 151.101.117.164.443: Flags [.], ack 916686, win 65535, length 0
19:58:50.945727 IP 151.101.117.164.443 > 10.0.2.15.44146: Flags [P.], seq 916686:919434, ack 869, win 65535, length 2748
19:58:50.945727 IP 151.101.117.164.443 > 10.0.2.15.44146: Flags [P.], seq 919434:920808, ack 869, win 65535, length 1374
19:58:50.945734 IP 10.0.2.15.44146 > 151.101.117.164.443: Flags [.], ack 919434, win 65535, length 0
19:58:50.945747 IP 10.0.2.15.44146 > 151.101.117.164.443: Flags [.], ack 920808, win 65535, length 0
19:58:50.946046 IP 151.101.117.164.443 > 10.0.2.15.44146: Flags [P.], seq 920808:922182, ack 869, win 65535, length 1374
19:58:50.946048 IP 151.101.117.164.443 > 10.0.2.15.44146: Flags [P.], seq 922182:924930, ack 869, win 65535, length 2748
19:58:50.946049 IP 151.101.117.164.443 > 10.0.2.15.44146: Flags [P.], seq 924930:927678, ack 869, win 65535, length 2748
19:58:50.946062 IP 10.0.2.15.44146 > 151.101.117.164.443: Flags [.], ack 922182, win 65535, length 0
19:58:50.946118 IP 10.0.2.15.44146 > 151.101.117.164.443: Flags [.], ack 924930, win 65535, length 0
19:58:50.946127 IP 10.0.2.15.44146 > 151.101.117.164.443: Flags [.], ack 927678, win 65535, length 0
19:58:50.946239 IP 151.101.117.164.443 > 10.0.2.15.44146: Flags [P.], seq 927678:929052, ack 869, win 65535, length 1374
19:58:50.946245 IP 10.0.2.15.44146 > 151.101.117.164.443: Flags [.], ack 929052, win 65535, length 0
19:58:50.946855 IP 151.101.117.164.443 > 10.0.2.15.44146: Flags [P.], seq 929052:933174, ack 869, win 65535, length 4122
19:58:50.946857 IP 151.101.117.164.443 > 10.0.2.15.44146: Flags [P.], seq 933174:935922, ack 869, win 65535, length 2748
19:58:50.946871 IP 10.0.2.15.44146 > 151.101.117.164.443: Flags [.], ack 933174, win 65535, length 0
19:58:50.946890 IP 10.0.2.15.44146 > 151.101.117.164.443: Flags [.], ack 935922, win 65535, length 0
19:58:50.947086 IP 151.101.117.164.443 > 10.0.2.15.44146: Flags [P.], seq 935922:937296, ack 869, win 65535, length 1374
19:58:50.947095 IP 10.0.2.15.44146 > 151.101.117.164.443: Flags [.], ack 937296, win 65535, length 0
19:58:50.947399 IP 151.101.117.164.443 > 10.0.2.15.44146: Flags [P.], seq 937296:942792, ack 869, win 65535, length 5496
19:58:50.947401 IP 151.101.117.164.443 > 10.0.2.15.44146: Flags [P.], seq 942792:944166, ack 869, win 65535, length 1374
19:58:50.947412 IP 10.0.2.15.44146 > 151.101.117.164.443: Flags [.], ack 942792, win 65535, length 0
19:58:50.947453 IP 10.0.2.15.44146 > 151.101.117.164.443: Flags [.], ack 944166, win 65535, length 0
19:58:50.947631 IP 151.101.117.164.443 > 10.0.2.15.44146: Flags [P.], seq 944166:946914, ack 869, win 65535, length 2748
19:58:50.947639 IP 10.0.2.15.44146 > 151.101.117.164.443: Flags [.], ack 946914, win 65535, length 0
19:58:50.947771 IP 151.101.117.164.443 > 10.0.2.15.44146: Flags [P.], seq 946914:951036, ack 869, win 65535, length 4122
19:58:50.947778 IP 10.0.2.15.44146 > 151.101.117.164.443: Flags [.], ack 951036, win 65535, length 0
19:58:50.947892 IP 151.101.117.164.443 > 10.0.2.15.44146: Flags [P.], seq 951036:953784, ack 869, win 65535, length 2748
19:58:50.947902 IP 10.0.2.15.44146 > 151.101.117.164.443: Flags [.], ack 953784, win 65535, length 0
19:58:50.948135 IP 151.101.117.164.443 > 10.0.2.15.44146: Flags [P.], seq 953784:956532, ack 869, win 65535, length 2748
19:58:50.948142 IP 10.0.2.15.44146 > 151.101.117.164.443: Flags [.], ack 956532, win 65535, length 0
19:58:50.948608 IP 151.101.117.164.443 > 10.0.2.15.44146: Flags [P.], seq 956532:959280, ack 869, win 65535, length 2748
19:58:50.948610 IP 151.101.117.164.443 > 10.0.2.15.44146: Flags [P.], seq 959280:963402, ack 869, win 65535, length 4122
19:58:50.948611 IP 151.101.117.164.443 > 10.0.2.15.44146: Flags [P.], seq 963402:964776, ack 869, win 65535, length 1374
19:58:50.948628 IP 10.0.2.15.44146 > 151.101.117.164.443: Flags [.], ack 959280, win 65535, length 0
19:58:50.948710 IP 10.0.2.15.44146 > 151.101.117.164.443: Flags [.], ack 963402, win 65535, length 0
19:58:50.948731 IP 10.0.2.15.44146 > 151.101.117.164.443: Flags [.], ack 964776, win 65535, length 0
19:58:50.948853 IP 151.101.117.164.443 > 10.0.2.15.44146: Flags [P.], seq 964776:968898, ack 869, win 65535, length 4122
19:58:50.948995 IP 151.101.117.164.443 > 10.0.2.15.44146: Flags [P.], seq 968898:971646, ack 869, win 65535, length 2748
19:58:50.949122 IP 151.101.117.164.443 > 10.0.2.15.44146: Flags [P.], seq 971646:974394, ack 869, win 65535, length 2748
19:58:50.949357 IP 151.101.117.164.443 > 10.0.2.15.44146: Flags [P.], seq 974394:977142, ack 869, win 65535, length 2748
19:58:50.949358 IP 151.101.117.164.443 > 10.0.2.15.44146: Flags [P.], seq 977142:978516, ack 869, win 65535, length 1374
19:58:50.949551 IP 151.101.117.164.443 > 10.0.2.15.44146: Flags [P.], seq 978516:981264, ack 869, win 65535, length 2748
19:58:50.949797 IP 151.101.117.164.443 > 10.0.2.15.44146: Flags [P.], seq 981264:984012, ack 869, win 65535, length 2748
19:58:50.949798 IP 151.101.117.164.443 > 10.0.2.15.44146: Flags [P.], seq 984012:985386, ack 869, win 65535, length 1374
19:58:50.949998 IP 151.101.117.164.443 > 10.0.2.15.44146: Flags [P.], seq 985386:988134, ack 869, win 65535, length 2748
19:58:50.950217 IP 151.101.117.164.443 > 10.0.2.15.44146: Flags [P.], seq 988134:989508, ack 869, win 65535, length 1374
19:58:50.950338 IP 10.0.2.15.44146 > 151.101.117.164.443: Flags [.], ack 989508, win 65535, length 0
19:58:50.951143 IP 151.101.117.164.443 > 10.0.2.15.44146: Flags [P.], seq 989508:992256, ack 869, win 65535, length 2748
19:58:50.951158 IP 10.0.2.15.44146 > 151.101.117.164.443: Flags [.], ack 992256, win 65535, length 0
19:58:50.951525 IP 151.101.117.164.443 > 10.0.2.15.44146: Flags [P.], seq 992256:995004, ack 869, win 65535, length 2748
19:58:50.951526 IP 151.101.117.164.443 > 10.0.2.15.44146: Flags [P.], seq 995004:999126, ack 869, win 65535, length 4122
19:58:50.951661 IP 151.101.117.164.443 > 10.0.2.15.44146: Flags [P.], seq 999126:1004622, ack 869, win 65535, length 5496
19:58:50.951798 IP 151.101.117.164.443 > 10.0.2.15.44146: Flags [P.], seq 1004622:1005996, ack 869, win 65535, length 1374
19:58:50.952113 IP 151.101.117.164.443 > 10.0.2.15.44146: Flags [P.], seq 1005996:1008744, ack 869, win 65535, length 2748
19:58:50.952115 IP 151.101.117.164.443 > 10.0.2.15.44146: Flags [P.], seq 1008744:1011492, ack 869, win 65535, length 2748
19:58:50.952193 IP 151.101.117.164.443 > 10.0.2.15.44146: Flags [P.], seq 1011492:1012866, ack 869, win 65535, length 1374
19:58:50.952360 IP 151.101.117.164.443 > 10.0.2.15.44146: Flags [P.], seq 1012866:1015614, ack 869, win 65535, length 2748
19:58:50.952604 IP 151.101.117.164.443 > 10.0.2.15.44146: Flags [P.], seq 1015614:1018362, ack 869, win 65535, length 2748
19:58:50.952694 IP 151.101.117.164.443 > 10.0.2.15.44146: Flags [P.], seq 1018362:1021110, ack 869, win 65535, length 2748
19:58:50.952695 IP 151.101.117.164.443 > 10.0.2.15.44146: Flags [P.], seq 1021110:1022484, ack 869, win 65535, length 1374
19:58:50.952817 IP 10.0.2.15.44146 > 151.101.117.164.443: Flags [.], ack 1022484, win 65535, length 0
19:58:50.965119 IP 151.101.117.164.443 > 10.0.2.15.44146: Flags [P.], seq 1022484:1033476, ack 869, win 65535, length 10992
19:58:50.965204 IP 10.0.2.15.44146 > 151.101.117.164.443: Flags [.], ack 1033476, win 65535, length 0
19:58:50.965391 IP 151.101.117.164.443 > 10.0.2.15.44146: Flags [P.], seq 1033476:1037598, ack 869, win 65535, length 4122
19:58:50.965393 IP 151.101.117.164.443 > 10.0.2.15.44146: Flags [P.], seq 1037598:1038972, ack 869, win 65535, length 1374
19:58:50.965393 IP 151.101.117.164.443 > 10.0.2.15.44146: Flags [.], seq 1038972:1040432, ack 869, win 65535, length 1460
19:58:50.965411 IP 10.0.2.15.44146 > 151.101.117.164.443: Flags [.], ack 1037598, win 65535, length 0
19:58:50.965439 IP 10.0.2.15.44146 > 151.101.117.164.443: Flags [.], ack 1038972, win 65535, length 0
19:58:50.965453 IP 10.0.2.15.44146 > 151.101.117.164.443: Flags [.], ack 1040432, win 65535, length 0
19:58:50.965868 IP 151.101.117.164.443 > 10.0.2.15.44146: Flags [P.], seq 1040432:1041720, ack 869, win 65535, length 1288
19:58:50.965871 IP 151.101.117.164.443 > 10.0.2.15.44146: Flags [P.], seq 1041720:1047216, ack 869, win 65535, length 5496
19:58:50.965931 IP 151.101.117.164.443 > 10.0.2.15.44146: Flags [P.], seq 1047216:1051338, ack 869, win 65535, length 4122
19:58:50.965951 IP 10.0.2.15.44146 > 151.101.117.164.443: Flags [.], ack 1041720, win 65535, length 0
19:58:50.965980 IP 10.0.2.15.44146 > 151.101.117.164.443: Flags [.], ack 1047216, win 65535, length 0
19:58:50.965996 IP 10.0.2.15.44146 > 151.101.117.164.443: Flags [.], ack 1051338, win 65535, length 0
19:58:50.966122 IP 151.101.117.164.443 > 10.0.2.15.44146: Flags [P.], seq 1051338:1054086, ack 869, win 65535, length 2748
19:58:50.966136 IP 10.0.2.15.44146 > 151.101.117.164.443: Flags [.], ack 1054086, win 65535, length 0
19:58:50.966645 IP 151.101.117.164.443 > 10.0.2.15.44146: Flags [P.], seq 1054086:1056834, ack 869, win 65535, length 2748
19:58:50.966646 IP 151.101.117.164.443 > 10.0.2.15.44146: Flags [P.], seq 1056834:1058208, ack 869, win 65535, length 1374
19:58:50.966647 IP 151.101.117.164.443 > 10.0.2.15.44146: Flags [P.], seq 1058208:1060956, ack 869, win 65535, length 2748
19:58:50.966648 IP 151.101.117.164.443 > 10.0.2.15.44146: Flags [P.], seq 1060956:1066452, ack 869, win 65535, length 5496
19:58:50.966661 IP 10.0.2.15.44146 > 151.101.117.164.443: Flags [.], ack 1056834, win 65535, length 0
19:58:50.966683 IP 10.0.2.15.44146 > 151.101.117.164.443: Flags [.], ack 1058208, win 65535, length 0
19:58:50.966697 IP 10.0.2.15.44146 > 151.101.117.164.443: Flags [.], ack 1060956, win 65535, length 0
19:58:50.966773 IP 10.0.2.15.44146 > 151.101.117.164.443: Flags [.], ack 1066452, win 65535, length 0
19:58:50.967118 IP 151.101.117.164.443 > 10.0.2.15.44146: Flags [P.], seq 1066452:1067826, ack 869, win 65535, length 1374
19:58:50.967120 IP 151.101.117.164.443 > 10.0.2.15.44146: Flags [P.], seq 1067826:1070574, ack 869, win 65535, length 2748
19:58:50.967120 IP 151.101.117.164.443 > 10.0.2.15.44146: Flags [.], seq 1070574:1072034, ack 869, win 65535, length 1460
19:58:50.967196 IP 10.0.2.15.44146 > 151.101.117.164.443: Flags [.], ack 1067826, win 65535, length 0
19:58:50.967213 IP 10.0.2.15.44146 > 151.101.117.164.443: Flags [.], ack 1070574, win 65535, length 0
19:58:50.967312 IP 10.0.2.15.44146 > 151.101.117.164.443: Flags [.], ack 1072034, win 65535, length 0
19:58:50.967564 IP 151.101.117.164.443 > 10.0.2.15.44146: Flags [P.], seq 1072034:1076070, ack 869, win 65535, length 4036
19:58:50.967565 IP 151.101.117.164.443 > 10.0.2.15.44146: Flags [P.], seq 1076070:1077444, ack 869, win 65535, length 1374
19:58:50.967567 IP 151.101.117.164.443 > 10.0.2.15.44146: Flags [P.], seq 1077444:1081566, ack 869, win 65535, length 4122
19:58:50.967749 IP 10.0.2.15.44146 > 151.101.117.164.443: Flags [.], ack 1076070, win 65535, length 0
19:58:50.967770 IP 10.0.2.15.44146 > 151.101.117.164.443: Flags [.], ack 1077444, win 65535, length 0
19:58:50.967884 IP 151.101.117.164.443 > 10.0.2.15.44146: Flags [P.], seq 1081566:1084314, ack 869, win 65535, length 2748
19:58:50.967985 IP 151.101.117.164.443 > 10.0.2.15.44146: Flags [P.], seq 1084314:1089810, ack 869, win 65535, length 5496
19:58:50.968032 IP 10.0.2.15.44146 > 151.101.117.164.443: Flags [.], ack 1089810, win 65535, length 0
19:58:50.968118 IP 151.101.117.164.443 > 10.0.2.15.44146: Flags [P.], seq 1089810:1091184, ack 869, win 65535, length 1374
19:58:50.968242 IP 10.0.2.15.44146 > 151.101.117.164.443: Flags [.], ack 1091184, win 65535, length 0
19:58:50.969015 IP 151.101.117.164.443 > 10.0.2.15.44146: Flags [P.], seq 1091184:1098054, ack 869, win 65535, length 6870
19:58:50.969027 IP 10.0.2.15.44146 > 151.101.117.164.443: Flags [.], ack 1098054, win 65535, length 0
19:58:50.969148 IP 151.101.117.164.443 > 10.0.2.15.44146: Flags [P.], seq 1098054:1099428, ack 869, win 65535, length 1374
19:58:50.969154 IP 10.0.2.15.44146 > 151.101.117.164.443: Flags [.], ack 1099428, win 65535, length 0
19:58:50.969298 IP 151.101.117.164.443 > 10.0.2.15.44146: Flags [P.], seq 1099428:1102176, ack 869, win 65535, length 2748
19:58:50.969308 IP 10.0.2.15.44146 > 151.101.117.164.443: Flags [.], ack 1102176, win 65535, length 0
19:58:50.969506 IP 151.101.117.164.443 > 10.0.2.15.44146: Flags [P.], seq 1102176:1104924, ack 869, win 65535, length 2748
19:58:50.969507 IP 151.101.117.164.443 > 10.0.2.15.44146: Flags [P.], seq 1104924:1106298, ack 869, win 65535, length 1374
19:58:50.969519 IP 10.0.2.15.44146 > 151.101.117.164.443: Flags [.], ack 1104924, win 65535, length 0
19:58:50.969534 IP 10.0.2.15.44146 > 151.101.117.164.443: Flags [.], ack 1106298, win 65535, length 0
19:58:50.969667 IP 151.101.117.164.443 > 10.0.2.15.44146: Flags [P.], seq 1106298:1109046, ack 869, win 65535, length 2748
19:58:50.969691 IP 10.0.2.15.44146 > 151.101.117.164.443: Flags [.], ack 1109046, win 65535, length 0
19:58:50.969850 IP 151.101.117.164.443 > 10.0.2.15.44146: Flags [P.], seq 1109046:1111794, ack 869, win 65535, length 2748
19:58:50.970005 IP 151.101.117.164.443 > 10.0.2.15.44146: Flags [P.], seq 1111794:1114542, ack 869, win 65535, length 2748
19:58:50.970096 IP 151.101.117.164.443 > 10.0.2.15.44146: Flags [P.], seq 1114542:1115916, ack 869, win 65535, length 1374
19:58:50.970368 IP 151.101.117.164.443 > 10.0.2.15.44146: Flags [P.], seq 1115916:1118664, ack 869, win 65535, length 2748
19:58:50.970370 IP 151.101.117.164.443 > 10.0.2.15.44146: Flags [P.], seq 1118664:1121412, ack 869, win 65535, length 2748
19:58:50.970393 IP 10.0.2.15.44146 > 151.101.117.164.443: Flags [.], ack 1115916, win 65535, length 0
19:58:50.970431 IP 10.0.2.15.44146 > 151.101.117.164.443: Flags [.], ack 1121412, win 65535, length 0
19:58:50.970530 IP 151.101.117.164.443 > 10.0.2.15.44146: Flags [P.], seq 1121412:1122786, ack 869, win 65535, length 1374
19:58:50.970543 IP 10.0.2.15.44146 > 151.101.117.164.443: Flags [.], ack 1122786, win 65535, length 0
19:58:50.970759 IP 151.101.117.164.443 > 10.0.2.15.44146: Flags [P.], seq 1122786:1125534, ack 869, win 65535, length 2748
19:58:50.970807 IP 10.0.2.15.44146 > 151.101.117.164.443: Flags [.], ack 1125534, win 65535, length 0
19:58:50.970942 IP 151.101.117.164.443 > 10.0.2.15.44146: Flags [P.], seq 1125534:1128282, ack 869, win 65535, length 2748
19:58:50.970943 IP 151.101.117.164.443 > 10.0.2.15.44146: Flags [P.], seq 1128282:1131030, ack 869, win 65535, length 2748
19:58:50.971057 IP 151.101.117.164.443 > 10.0.2.15.44146: Flags [P.], seq 1131030:1133778, ack 869, win 65535, length 2748
19:58:50.971080 IP 10.0.2.15.44146 > 151.101.117.164.443: Flags [.], ack 1133778, win 65535, length 0
19:58:50.971386 IP 151.101.117.164.443 > 10.0.2.15.44146: Flags [P.], seq 1133778:1135152, ack 869, win 65535, length 1374
19:58:50.971388 IP 151.101.117.164.443 > 10.0.2.15.44146: Flags [P.], seq 1135152:1137900, ack 869, win 65535, length 2748
19:58:50.971428 IP 10.0.2.15.44146 > 151.101.117.164.443: Flags [.], ack 1135152, win 65535, length 0
19:58:50.971626 IP 151.101.117.164.443 > 10.0.2.15.44146: Flags [P.], seq 1137900:1139274, ack 869, win 65535, length 1374
19:58:50.971645 IP 10.0.2.15.44146 > 151.101.117.164.443: Flags [.], ack 1137900, win 65535, length 0
19:58:50.971746 IP 151.101.117.164.443 > 10.0.2.15.44146: Flags [P.], seq 1139274:1142022, ack 869, win 65535, length 2748
19:58:50.971774 IP 10.0.2.15.44146 > 151.101.117.164.443: Flags [.], ack 1142022, win 65535, length 0
19:58:50.971826 IP 151.101.117.164.443 > 10.0.2.15.44146: Flags [P.], seq 1142022:1146144, ack 869, win 65535, length 4122
19:58:50.971891 IP 10.0.2.15.44146 > 151.101.117.164.443: Flags [.], ack 1146144, win 65535, length 0
19:58:50.972027 IP 151.101.117.164.443 > 10.0.2.15.44146: Flags [P.], seq 1146144:1148892, ack 869, win 65535, length 2748
19:58:50.972057 IP 10.0.2.15.44146 > 151.101.117.164.443: Flags [.], ack 1148892, win 65535, length 0
19:58:50.972210 IP 151.101.117.164.443 > 10.0.2.15.44146: Flags [P.], seq 1148892:1151640, ack 869, win 65535, length 2748
19:58:50.972217 IP 10.0.2.15.44146 > 151.101.117.164.443: Flags [.], ack 1151640, win 65535, length 0
19:58:50.972477 IP 151.101.117.164.443 > 10.0.2.15.44146: Flags [P.], seq 1151640:1155762, ack 869, win 65535, length 4122
19:58:50.972568 IP 10.0.2.15.44146 > 151.101.117.164.443: Flags [.], ack 1155762, win 65535, length 0
19:58:50.972612 IP 151.101.117.164.443 > 10.0.2.15.44146: Flags [P.], seq 1155762:1157136, ack 869, win 65535, length 1374
19:58:50.972659 IP 10.0.2.15.44146 > 151.101.117.164.443: Flags [.], ack 1157136, win 65535, length 0
19:58:50.973666 IP 151.101.117.164.443 > 10.0.2.15.44146: Flags [P.], seq 1157136:1161258, ack 869, win 65535, length 4122
19:58:50.973669 IP 151.101.117.164.443 > 10.0.2.15.44146: Flags [P.], seq 1161258:1165380, ack 869, win 65535, length 4122
19:58:50.973669 IP 151.101.117.164.443 > 10.0.2.15.44146: Flags [P.], seq 1165380:1168128, ack 869, win 65535, length 2748
19:58:50.974136 IP 10.0.2.15.44146 > 151.101.117.164.443: Flags [.], ack 1168128, win 65535, length 0
19:58:50.974251 IP 151.101.117.164.443 > 10.0.2.15.44146: Flags [P.], seq 1168128:1170876, ack 869, win 65535, length 2748
19:58:50.974252 IP 151.101.117.164.443 > 10.0.2.15.44146: Flags [P.], seq 1170876:1173624, ack 869, win 65535, length 2748
19:58:50.974253 IP 151.101.117.164.443 > 10.0.2.15.44146: Flags [P.], seq 1173624:1177746, ack 869, win 65535, length 4122
19:58:50.974500 IP 151.101.117.164.443 > 10.0.2.15.44146: Flags [P.], seq 1177746:1179120, ack 869, win 65535, length 1374
19:58:50.974940 IP 151.101.117.164.443 > 10.0.2.15.44146: Flags [P.], seq 1179120:1181868, ack 869, win 65535, length 2748
19:58:50.974942 IP 151.101.117.164.443 > 10.0.2.15.44146: Flags [P.], seq 1181868:1185990, ack 869, win 65535, length 4122
19:58:50.974985 IP 10.0.2.15.44146 > 151.101.117.164.443: Flags [.], ack 1177746, win 65535, length 0
19:58:50.975071 IP 151.101.117.164.443 > 10.0.2.15.44146: Flags [P.], seq 1185990:1188738, ack 869, win 65535, length 2748
19:58:50.975233 IP 151.101.117.164.443 > 10.0.2.15.44146: Flags [P.], seq 1188738:1192860, ack 869, win 65535, length 4122
19:58:50.975260 IP 10.0.2.15.44146 > 151.101.117.164.443: Flags [.], ack 1192860, win 65535, length 0
19:58:50.975405 IP 151.101.117.164.443 > 10.0.2.15.44146: Flags [P.], seq 1192860:1195608, ack 869, win 65535, length 2748
19:58:50.975411 IP 10.0.2.15.44146 > 151.101.117.164.443: Flags [.], ack 1195608, win 65535, length 0
19:58:50.975530 IP 151.101.117.164.443 > 10.0.2.15.44146: Flags [P.], seq 1195608:1198356, ack 869, win 65535, length 2748
19:58:50.975568 IP 10.0.2.15.44146 > 151.101.117.164.443: Flags [.], ack 1198356, win 65535, length 0
19:58:50.975657 IP 151.101.117.164.443 > 10.0.2.15.44146: Flags [P.], seq 1198356:1201104, ack 869, win 65535, length 2748
19:58:50.975675 IP 10.0.2.15.44146 > 151.101.117.164.443: Flags [.], ack 1201104, win 65535, length 0
19:58:50.975780 IP 151.101.117.164.443 > 10.0.2.15.44146: Flags [P.], seq 1201104:1202478, ack 869, win 65535, length 1374
19:58:50.975816 IP 10.0.2.15.44146 > 151.101.117.164.443: Flags [.], ack 1202478, win 65535, length 0
19:58:50.976295 IP 151.101.117.164.443 > 10.0.2.15.44146: Flags [P.], seq 1202478:1205226, ack 869, win 65535, length 2748
19:58:50.976297 IP 151.101.117.164.443 > 10.0.2.15.44146: Flags [P.], seq 1205226:1207974, ack 869, win 65535, length 2748
19:58:50.976297 IP 151.101.117.164.443 > 10.0.2.15.44146: Flags [P.], seq 1207974:1209348, ack 869, win 65535, length 1374
19:58:50.976544 IP 10.0.2.15.44146 > 151.101.117.164.443: Flags [.], ack 1205226, win 65535, length 0
19:58:50.977442 IP 151.101.117.164.443 > 10.0.2.15.44146: Flags [P.], seq 1209348:1213470, ack 869, win 65535, length 4122
19:58:50.977444 IP 151.101.117.164.443 > 10.0.2.15.44146: Flags [P.], seq 1213470:1218966, ack 869, win 65535, length 5496
19:58:50.977444 IP 151.101.117.164.443 > 10.0.2.15.44146: Flags [P.], seq 1218966:1220340, ack 869, win 65535, length 1374
19:58:50.977471 IP 151.101.117.164.443 > 10.0.2.15.44146: Flags [P.], seq 1220340:1223088, ack 869, win 65535, length 2748
19:58:50.977754 IP 10.0.2.15.44146 > 151.101.117.164.443: Flags [.], ack 1223088, win 65535, length 0
19:58:50.978009 IP 151.101.117.164.443 > 10.0.2.15.44146: Flags [P.], seq 1223088:1228584, ack 869, win 65535, length 5496
19:58:50.978523 IP 151.101.117.164.443 > 10.0.2.15.44146: Flags [P.], seq 1228584:1234080, ack 869, win 65535, length 5496
19:58:50.978524 IP 151.101.117.164.443 > 10.0.2.15.44146: Flags [P.], seq 1234080:1236828, ack 869, win 65535, length 2748
19:58:50.978649 IP 151.101.117.164.443 > 10.0.2.15.44146: Flags [P.], seq 1236828:1238202, ack 869, win 65535, length 1374
19:58:50.978938 IP 151.101.117.164.443 > 10.0.2.15.44146: Flags [P.], seq 1238202:1242324, ack 869, win 65535, length 4122
19:58:50.978940 IP 151.101.117.164.443 > 10.0.2.15.44146: Flags [P.], seq 1242324:1243698, ack 869, win 65535, length 1374
19:58:50.979264 IP 151.101.117.164.443 > 10.0.2.15.44146: Flags [P.], seq 1243698:1249194, ack 869, win 65535, length 5496
19:58:50.979524 IP 151.101.117.164.443 > 10.0.2.15.44146: Flags [P.], seq 1249194:1251942, ack 869, win 65535, length 2748
19:58:50.979526 IP 151.101.117.164.443 > 10.0.2.15.44146: Flags [P.], seq 1251942:1256064, ack 869, win 65535, length 4122
19:58:50.979794 IP 10.0.2.15.44146 > 151.101.117.164.443: Flags [.], ack 1256064, win 65535, length 0
19:58:50.980235 IP 151.101.117.164.443 > 10.0.2.15.44146: Flags [P.], seq 1256064:1264308, ack 869, win 65535, length 8244
19:58:50.980237 IP 151.101.117.164.443 > 10.0.2.15.44146: Flags [P.], seq 1264308:1265682, ack 869, win 65535, length 1374
19:58:50.980389 IP 151.101.117.164.443 > 10.0.2.15.44146: Flags [P.], seq 1265682:1268430, ack 869, win 65535, length 2748
19:58:50.980561 IP 151.101.117.164.443 > 10.0.2.15.44146: Flags [P.], seq 1268430:1271178, ack 869, win 65535, length 2748
19:58:50.980634 IP 151.101.117.164.443 > 10.0.2.15.44146: Flags [P.], seq 1271178:1272552, ack 869, win 65535, length 1374
19:58:50.980785 IP 151.101.117.164.443 > 10.0.2.15.44146: Flags [P.], seq 1272552:1275300, ack 869, win 65535, length 2748
19:58:50.980969 IP 151.101.117.164.443 > 10.0.2.15.44146: Flags [P.], seq 1275300:1278048, ack 869, win 65535, length 2748
19:58:50.981049 IP 151.101.117.164.443 > 10.0.2.15.44146: Flags [P.], seq 1278048:1280796, ack 869, win 65535, length 2748
19:58:50.981256 IP 151.101.117.164.443 > 10.0.2.15.44146: Flags [P.], seq 1280796:1282170, ack 869, win 65535, length 1374
19:58:50.981661 IP 151.101.117.164.443 > 10.0.2.15.44146: Flags [P.], seq 1282170:1284918, ack 869, win 65535, length 2748
19:58:50.981662 IP 151.101.117.164.443 > 10.0.2.15.44146: Flags [P.], seq 1284918:1287666, ack 869, win 65535, length 2748
19:58:50.981663 IP 151.101.117.164.443 > 10.0.2.15.44146: Flags [P.], seq 1287666:1289040, ack 869, win 65535, length 1374
19:58:50.981884 IP 10.0.2.15.44146 > 151.101.117.164.443: Flags [.], ack 1289040, win 65535, length 0
19:58:50.987197 IP 151.101.117.164.443 > 10.0.2.15.44146: Flags [P.], seq 1289040:1294536, ack 869, win 65535, length 5496
19:58:50.987278 IP 10.0.2.15.44146 > 151.101.117.164.443: Flags [.], ack 1294536, win 65535, length 0
19:58:50.988129 IP 151.101.117.164.443 > 10.0.2.15.44146: Flags [P.], seq 1294536:1302780, ack 869, win 65535, length 8244
19:58:50.988132 IP 151.101.117.164.443 > 10.0.2.15.44146: Flags [P.], seq 1302780:1304154, ack 869, win 65535, length 1374
19:58:50.988133 IP 151.101.117.164.443 > 10.0.2.15.44146: Flags [P.], seq 1304154:1308276, ack 869, win 65535, length 4122
19:58:50.988166 IP 151.101.117.164.443 > 10.0.2.15.44146: Flags [P.], seq 1308276:1309650, ack 869, win 65535, length 1374
19:58:50.988254 IP 10.0.2.15.44146 > 151.101.117.164.443: Flags [.], ack 1309650, win 65535, length 0
19:58:50.992264 IP 151.101.117.164.443 > 10.0.2.15.44146: Flags [P.], seq 1309650:1316520, ack 869, win 65535, length 6870
19:58:50.992267 IP 151.101.117.164.443 > 10.0.2.15.44146: Flags [P.], seq 1316520:1320642, ack 869, win 65535, length 4122
19:58:50.992288 IP 10.0.2.15.44146 > 151.101.117.164.443: Flags [.], ack 1316520, win 65535, length 0
19:58:50.994270 IP 151.101.117.164.443 > 10.0.2.15.44146: Flags [P.], seq 1320642:1324764, ack 869, win 65535, length 4122
19:58:50.994274 IP 151.101.117.164.443 > 10.0.2.15.44146: Flags [P.], seq 1324764:1328886, ack 869, win 65535, length 4122
19:58:50.994274 IP 151.101.117.164.443 > 10.0.2.15.44146: Flags [P.], seq 1328886:1330260, ack 869, win 65535, length 1374
19:58:50.994572 IP 151.101.117.164.443 > 10.0.2.15.44146: Flags [P.], seq 1330260:1333008, ack 869, win 65535, length 2748
19:58:50.994574 IP 151.101.117.164.443 > 10.0.2.15.44146: Flags [P.], seq 1333008:1335756, ack 869, win 65535, length 2748
19:58:50.994578 IP 151.101.117.164.443 > 10.0.2.15.44146: Flags [P.], seq 1335756:1357740, ack 869, win 65535, length 21984
19:58:50.995040 IP 10.0.2.15.44146 > 151.101.117.164.443: Flags [.], ack 1357740, win 65535, length 0
19:58:50.995433 IP 151.101.117.164.443 > 10.0.2.15.44146: Flags [P.], seq 1357740:1375602, ack 869, win 65535, length 17862
19:58:50.995447 IP 10.0.2.15.44146 > 151.101.117.164.443: Flags [.], ack 1375602, win 65535, length 0
19:58:50.995928 IP 151.101.117.164.443 > 10.0.2.15.44146: Flags [P.], seq 1375602:1378350, ack 869, win 65535, length 2748
19:58:50.995941 IP 10.0.2.15.44146 > 151.101.117.164.443: Flags [.], ack 1378350, win 65535, length 0
19:58:50.996244 IP 151.101.117.164.443 > 10.0.2.15.44146: Flags [P.], seq 1378350:1382472, ack 869, win 65535, length 4122
19:58:50.996246 IP 151.101.117.164.443 > 10.0.2.15.44146: Flags [P.], seq 1382472:1383846, ack 869, win 65535, length 1374
19:58:50.996289 IP 10.0.2.15.44146 > 151.101.117.164.443: Flags [.], ack 1383846, win 65535, length 0
19:58:50.996633 IP 151.101.117.164.443 > 10.0.2.15.44146: Flags [P.], seq 1383846:1387968, ack 869, win 65535, length 4122
19:58:50.996634 IP 151.101.117.164.443 > 10.0.2.15.44146: Flags [.], seq 1387968:1389428, ack 869, win 65535, length 1460
19:58:50.996703 IP 10.0.2.15.44146 > 151.101.117.164.443: Flags [.], ack 1389428, win 65535, length 0
19:58:50.996938 IP 151.101.117.164.443 > 10.0.2.15.44146: Flags [P.], seq 1389428:1393464, ack 869, win 65535, length 4036
19:58:50.996939 IP 151.101.117.164.443 > 10.0.2.15.44146: Flags [P.], seq 1393464:1394838, ack 869, win 65535, length 1374
19:58:50.996950 IP 10.0.2.15.44146 > 151.101.117.164.443: Flags [.], ack 1393464, win 65535, length 0
19:58:50.997056 IP 151.101.117.164.443 > 10.0.2.15.44146: Flags [P.], seq 1394838:1398960, ack 869, win 65535, length 4122
19:58:50.997102 IP 10.0.2.15.44146 > 151.101.117.164.443: Flags [.], ack 1398960, win 65535, length 0
19:58:50.997195 IP 151.101.117.164.443 > 10.0.2.15.44146: Flags [P.], seq 1398960:1401708, ack 869, win 65535, length 2748
19:58:50.997216 IP 10.0.2.15.44146 > 151.101.117.164.443: Flags [.], ack 1401708, win 65535, length 0
19:58:50.997374 IP 151.101.117.164.443 > 10.0.2.15.44146: Flags [P.], seq 1401708:1404456, ack 869, win 65535, length 2748
19:58:50.997550 IP 151.101.117.164.443 > 10.0.2.15.44146: Flags [P.], seq 1404456:1407204, ack 869, win 65535, length 2748
19:58:50.997576 IP 10.0.2.15.44146 > 151.101.117.164.443: Flags [.], ack 1407204, win 65535, length 0
19:58:50.997906 IP 151.101.117.164.443 > 10.0.2.15.44146: Flags [P.], seq 1407204:1411326, ack 869, win 65535, length 4122
19:58:50.997907 IP 151.101.117.164.443 > 10.0.2.15.44146: Flags [P.], seq 1411326:1412700, ack 869, win 65535, length 1374
19:58:50.997918 IP 10.0.2.15.44146 > 151.101.117.164.443: Flags [.], ack 1411326, win 65535, length 0
19:58:50.998167 IP 151.101.117.164.443 > 10.0.2.15.44146: Flags [P.], seq 1412700:1415448, ack 869, win 65535, length 2748
19:58:50.998169 IP 151.101.117.164.443 > 10.0.2.15.44146: Flags [P.], seq 1415448:1419570, ack 869, win 65535, length 4122
19:58:50.998191 IP 10.0.2.15.44146 > 151.101.117.164.443: Flags [.], ack 1412700, win 65535, length 0
19:58:50.998263 IP 151.101.117.164.443 > 10.0.2.15.44146: Flags [P.], seq 1419570:1420944, ack 869, win 65535, length 1374
19:58:50.998287 IP 10.0.2.15.44146 > 151.101.117.164.443: Flags [.], ack 1420944, win 65535, length 0
19:58:50.998392 IP 151.101.117.164.443 > 10.0.2.15.44146: Flags [P.], seq 1420944:1422318, ack 869, win 65535, length 1374
19:58:50.998461 IP 10.0.2.15.44146 > 151.101.117.164.443: Flags [.], ack 1422318, win 65535, length 0
19:58:50.998727 IP 151.101.117.164.443 > 10.0.2.15.44146: Flags [P.], seq 1422318:1425066, ack 869, win 65535, length 2748
19:58:50.998748 IP 10.0.2.15.44146 > 151.101.117.164.443: Flags [.], ack 1425066, win 65535, length 0
19:58:50.999067 IP 151.101.117.164.443 > 10.0.2.15.44146: Flags [P.], seq 1425066:1427814, ack 869, win 65535, length 2748
19:58:50.999069 IP 151.101.117.164.443 > 10.0.2.15.44146: Flags [P.], seq 1427814:1429188, ack 869, win 65535, length 1374
19:58:50.999119 IP 10.0.2.15.44146 > 151.101.117.164.443: Flags [.], ack 1429188, win 65535, length 0
19:58:50.999546 IP 151.101.117.164.443 > 10.0.2.15.44146: Flags [P.], seq 1429188:1431936, ack 869, win 65535, length 2748
19:58:50.999549 IP 151.101.117.164.443 > 10.0.2.15.44146: Flags [P.], seq 1431936:1436058, ack 869, win 65535, length 4122
19:58:50.999549 IP 151.101.117.164.443 > 10.0.2.15.44146: Flags [P.], seq 1436058:1438806, ack 869, win 65535, length 2748
19:58:50.999550 IP 151.101.117.164.443 > 10.0.2.15.44146: Flags [P.], seq 1438806:1441554, ack 869, win 65535, length 2748
19:58:50.999561 IP 10.0.2.15.44146 > 151.101.117.164.443: Flags [.], ack 1431936, win 65535, length 0
19:58:50.999624 IP 10.0.2.15.44146 > 151.101.117.164.443: Flags [.], ack 1441554, win 65535, length 0
19:58:51.000765 IP 151.101.117.164.443 > 10.0.2.15.44146: Flags [P.], seq 1441554:1447050, ack 869, win 65535, length 5496
19:58:51.000787 IP 10.0.2.15.44146 > 151.101.117.164.443: Flags [.], ack 1447050, win 65535, length 0
19:58:51.000964 IP 151.101.117.164.443 > 10.0.2.15.44146: Flags [P.], seq 1447050:1452546, ack 869, win 65535, length 5496
19:58:51.000965 IP 151.101.117.164.443 > 10.0.2.15.44146: Flags [P.], seq 1452546:1455294, ack 869, win 65535, length 2748
19:58:51.000975 IP 10.0.2.15.44146 > 151.101.117.164.443: Flags [.], ack 1452546, win 65535, length 0
19:58:51.001118 IP 151.101.117.164.443 > 10.0.2.15.44146: Flags [P.], seq 1455294:1458042, ack 869, win 65535, length 2748
19:58:51.001193 IP 10.0.2.15.44146 > 151.101.117.164.443: Flags [.], ack 1458042, win 65535, length 0
19:58:51.001633 IP 151.101.117.164.443 > 10.0.2.15.44146: Flags [P.], seq 1458042:1460790, ack 869, win 65535, length 2748
19:58:51.001636 IP 151.101.117.164.443 > 10.0.2.15.44146: Flags [P.], seq 1460790:1466286, ack 869, win 65535, length 5496
19:58:51.001838 IP 151.101.117.164.443 > 10.0.2.15.44146: Flags [P.], seq 1466286:1467660, ack 869, win 65535, length 1374
19:58:51.002051 IP 151.101.117.164.443 > 10.0.2.15.44146: Flags [P.], seq 1467660:1473156, ack 869, win 65535, length 5496
19:58:51.002053 IP 151.101.117.164.443 > 10.0.2.15.44146: Flags [P.], seq 1473156:1474530, ack 869, win 65535, length 1374
19:58:51.002276 IP 151.101.117.164.443 > 10.0.2.15.44146: Flags [P.], seq 1474530:1477278, ack 869, win 65535, length 2748
19:58:51.002390 IP 151.101.117.164.443 > 10.0.2.15.44146: Flags [P.], seq 1477278:1480026, ack 869, win 65535, length 2748
19:58:51.002721 IP 151.101.117.164.443 > 10.0.2.15.44146: Flags [P.], seq 1480026:1481400, ack 869, win 65535, length 1374
19:58:51.002722 IP 151.101.117.164.443 > 10.0.2.15.44146: Flags [P.], seq 1481400:1484148, ack 869, win 65535, length 2748
19:58:51.002989 IP 151.101.117.164.443 > 10.0.2.15.44146: Flags [P.], seq 1484148:1486896, ack 869, win 65535, length 2748
19:58:51.003054 IP 151.101.117.164.443 > 10.0.2.15.44146: Flags [P.], seq 1486896:1489644, ack 869, win 65535, length 2748
19:58:51.003055 IP 151.101.117.164.443 > 10.0.2.15.44146: Flags [P.], seq 1489644:1491018, ack 869, win 65535, length 1374
19:58:51.004158 IP 10.0.2.15.44146 > 151.101.117.164.443: Flags [.], ack 1491018, win 65535, length 0
19:58:51.004767 IP 151.101.117.164.443 > 10.0.2.15.44146: Flags [.], seq 1491018:1505618, ack 869, win 65535, length 14600
19:58:51.004825 IP 10.0.2.15.44146 > 151.101.117.164.443: Flags [.], ack 1505618, win 65535, length 0
19:58:51.005135 IP 151.101.117.164.443 > 10.0.2.15.44146: Flags [P.], seq 1505618:1507506, ack 869, win 65535, length 1888
19:58:51.005137 IP 151.101.117.164.443 > 10.0.2.15.44146: Flags [P.], seq 1507506:1510254, ack 869, win 65535, length 2748
19:58:51.005138 IP 151.101.117.164.443 > 10.0.2.15.44146: Flags [.], seq 1510254:1511714, ack 869, win 65535, length 1460
19:58:51.005272 IP 10.0.2.15.44146 > 151.101.117.164.443: Flags [.], ack 1511714, win 65535, length 0
19:58:51.005457 IP 151.101.117.164.443 > 10.0.2.15.44146: Flags [P.], seq 1511714:1515750, ack 869, win 65535, length 4036
19:58:51.005459 IP 151.101.117.164.443 > 10.0.2.15.44146: Flags [P.], seq 1515750:1517124, ack 869, win 65535, length 1374
19:58:51.005472 IP 10.0.2.15.44146 > 151.101.117.164.443: Flags [.], ack 1515750, win 65535, length 0
19:58:51.006090 IP 151.101.117.164.443 > 10.0.2.15.44146: Flags [P.], seq 1517124:1522620, ack 869, win 65535, length 5496
19:58:51.006092 IP 151.101.117.164.443 > 10.0.2.15.44146: Flags [P.], seq 1522620:1526742, ack 869, win 65535, length 4122
19:58:51.006093 IP 151.101.117.164.443 > 10.0.2.15.44146: Flags [P.], seq 1526742:1529490, ack 869, win 65535, length 2748
19:58:51.006117 IP 151.101.117.164.443 > 10.0.2.15.44146: Flags [P.], seq 1529490:1530864, ack 869, win 65535, length 1374
19:58:51.006162 IP 10.0.2.15.44146 > 151.101.117.164.443: Flags [.], ack 1530864, win 65535, length 0
19:58:51.006273 IP 151.101.117.164.443 > 10.0.2.15.44146: Flags [P.], seq 1530864:1532238, ack 869, win 65535, length 1374
19:58:51.006351 IP 151.101.117.164.443 > 10.0.2.15.44146: Flags [P.], seq 1532238:1534986, ack 869, win 65535, length 2748
19:58:51.006358 IP 10.0.2.15.44146 > 151.101.117.164.443: Flags [.], ack 1534986, win 65535, length 0
19:58:51.006747 IP 151.101.117.164.443 > 10.0.2.15.44146: Flags [P.], seq 1534986:1537734, ack 869, win 65535, length 2748
19:58:51.006749 IP 151.101.117.164.443 > 10.0.2.15.44146: Flags [P.], seq 1537734:1540482, ack 869, win 65535, length 2748
19:58:51.006765 IP 10.0.2.15.44146 > 151.101.117.164.443: Flags [.], ack 1537734, win 65535, length 0
19:58:51.007128 IP 151.101.117.164.443 > 10.0.2.15.44146: Flags [P.], seq 1540482:1541856, ack 869, win 65535, length 1374
19:58:51.007130 IP 151.101.117.164.443 > 10.0.2.15.44146: Flags [P.], seq 1541856:1544604, ack 869, win 65535, length 2748
19:58:51.007131 IP 151.101.117.164.443 > 10.0.2.15.44146: Flags [P.], seq 1544604:1548726, ack 869, win 65535, length 4122
19:58:51.007364 IP 151.101.117.164.443 > 10.0.2.15.44146: Flags [P.], seq 1548726:1551474, ack 869, win 65535, length 2748
19:58:51.007542 IP 151.101.117.164.443 > 10.0.2.15.44146: Flags [P.], seq 1551474:1554222, ack 869, win 65535, length 2748
19:58:51.007653 IP 151.101.117.164.443 > 10.0.2.15.44146: Flags [P.], seq 1554222:1556970, ack 869, win 65535, length 2748
19:58:51.007776 IP 151.101.117.164.443 > 10.0.2.15.44146: Flags [P.], seq 1556970:1558344, ack 869, win 65535, length 1374
19:58:51.007788 IP 10.0.2.15.44146 > 151.101.117.164.443: Flags [.], ack 1556970, win 65535, length 0
19:58:51.007966 IP 151.101.117.164.443 > 10.0.2.15.44146: Flags [P.], seq 1558344:1561092, ack 869, win 65535, length 2748
19:58:51.007986 IP 10.0.2.15.44146 > 151.101.117.164.443: Flags [.], ack 1561092, win 65535, length 0
19:58:51.008118 IP 151.101.117.164.443 > 10.0.2.15.44146: Flags [P.], seq 1561092:1563840, ack 869, win 65535, length 2748
19:58:51.008205 IP 151.101.117.164.443 > 10.0.2.15.44146: Flags [P.], seq 1563840:1565214, ack 869, win 65535, length 1374
19:58:51.008259 IP 10.0.2.15.44146 > 151.101.117.164.443: Flags [.], ack 1565214, win 65535, length 0
19:58:51.008453 IP 151.101.117.164.443 > 10.0.2.15.44146: Flags [P.], seq 1565214:1567962, ack 869, win 65535, length 2748
19:58:51.008461 IP 10.0.2.15.44146 > 151.101.117.164.443: Flags [.], ack 1567962, win 65535, length 0
19:58:51.008645 IP 151.101.117.164.443 > 10.0.2.15.44146: Flags [P.], seq 1567962:1573458, ack 869, win 65535, length 5496
19:58:51.008719 IP 10.0.2.15.44146 > 151.101.117.164.443: Flags [.], ack 1573458, win 65535, length 0
19:58:51.009737 IP 151.101.117.164.443 > 10.0.2.15.44146: Flags [P.], seq 1573458:1580328, ack 869, win 65535, length 6870
19:58:51.009740 IP 151.101.117.164.443 > 10.0.2.15.44146: Flags [P.], seq 1580328:1581702, ack 869, win 65535, length 1374
19:58:51.009760 IP 10.0.2.15.44146 > 151.101.117.164.443: Flags [.], ack 1580328, win 65535, length 0
19:58:51.009940 IP 151.101.117.164.443 > 10.0.2.15.44146: Flags [P.], seq 1581702:1584450, ack 869, win 65535, length 2748
19:58:51.009966 IP 10.0.2.15.44146 > 151.101.117.164.443: Flags [.], ack 1581702, win 65535, length 0
19:58:51.009992 IP 10.0.2.15.44146 > 151.101.117.164.443: Flags [.], ack 1584450, win 65535, length 0
19:58:51.010329 IP 151.101.117.164.443 > 10.0.2.15.44146: Flags [P.], seq 1584450:1587198, ack 869, win 65535, length 2748
19:58:51.010331 IP 151.101.117.164.443 > 10.0.2.15.44146: Flags [P.], seq 1587198:1589946, ack 869, win 65535, length 2748
19:58:51.010332 IP 151.101.117.164.443 > 10.0.2.15.44146: Flags [P.], seq 1589946:1592694, ack 869, win 65535, length 2748
19:58:51.010344 IP 10.0.2.15.44146 > 151.101.117.164.443: Flags [.], ack 1587198, win 65535, length 0
19:58:51.010572 IP 151.101.117.164.443 > 10.0.2.15.44146: Flags [P.], seq 1592694:1595442, ack 869, win 65535, length 2748
19:58:51.010574 IP 151.101.117.164.443 > 10.0.2.15.44146: Flags [P.], seq 1595442:1596816, ack 869, win 65535, length 1374
19:58:51.010670 IP 10.0.2.15.44146 > 151.101.117.164.443: Flags [.], ack 1596816, win 65535, length 0
19:58:51.010846 IP 151.101.117.164.443 > 10.0.2.15.44146: Flags [P.], seq 1596816:1598190, ack 869, win 65535, length 1374
19:58:51.011279 IP 151.101.117.164.443 > 10.0.2.15.44146: Flags [P.], seq 1598190:1600938, ack 869, win 65535, length 2748
19:58:51.011280 IP 151.101.117.164.443 > 10.0.2.15.44146: Flags [P.], seq 1600938:1603686, ack 869, win 65535, length 2748
19:58:51.011281 IP 151.101.117.164.443 > 10.0.2.15.44146: Flags [P.], seq 1603686:1606434, ack 869, win 65535, length 2748
19:58:51.011398 IP 10.0.2.15.44146 > 151.101.117.164.443: Flags [.], ack 1606434, win 65535, length 0
19:58:51.011692 IP 151.101.117.164.443 > 10.0.2.15.44146: Flags [P.], seq 1606434:1610556, ack 869, win 65535, length 4122
19:58:51.011953 IP 151.101.117.164.443 > 10.0.2.15.44146: Flags [P.], seq 1610556:1613304, ack 869, win 65535, length 2748
19:58:51.011955 IP 151.101.117.164.443 > 10.0.2.15.44146: Flags [P.], seq 1613304:1617426, ack 869, win 65535, length 4122
19:58:51.012208 IP 151.101.117.164.443 > 10.0.2.15.44146: Flags [P.], seq 1617426:1618800, ack 869, win 65535, length 1374
19:58:51.012210 IP 151.101.117.164.443 > 10.0.2.15.44146: Flags [P.], seq 1618800:1621548, ack 869, win 65535, length 2748
19:58:51.012340 IP 151.101.117.164.443 > 10.0.2.15.44146: Flags [P.], seq 1621548:1625670, ack 869, win 65535, length 4122
19:58:51.012365 IP 10.0.2.15.44146 > 151.101.117.164.443: Flags [.], ack 1625670, win 65535, length 0
19:58:51.012649 IP 151.101.117.164.443 > 10.0.2.15.44146: Flags [P.], seq 1625670:1629792, ack 869, win 65535, length 4122
19:58:51.012741 IP 10.0.2.15.44146 > 151.101.117.164.443: Flags [.], ack 1629792, win 65535, length 0
19:58:51.012822 IP 151.101.117.164.443 > 10.0.2.15.44146: Flags [P.], seq 1629792:1633914, ack 869, win 65535, length 4122
19:58:51.012866 IP 10.0.2.15.44146 > 151.101.117.164.443: Flags [.], ack 1633914, win 65535, length 0
19:58:51.013237 IP 151.101.117.164.443 > 10.0.2.15.44146: Flags [P.], seq 1633914:1638036, ack 869, win 65535, length 4122
19:58:51.013289 IP 10.0.2.15.44146 > 151.101.117.164.443: Flags [.], ack 1638036, win 65535, length 0
19:58:51.013373 IP 151.101.117.164.443 > 10.0.2.15.44146: Flags [P.], seq 1638036:1639410, ack 869, win 65535, length 1374
19:58:51.013545 IP 10.0.2.15.44146 > 151.101.117.164.443: Flags [.], ack 1639410, win 65535, length 0
19:58:51.014549 IP 151.101.117.164.443 > 10.0.2.15.44146: Flags [P.], seq 1639410:1646280, ack 869, win 65535, length 6870
19:58:51.014551 IP 151.101.117.164.443 > 10.0.2.15.44146: Flags [P.], seq 1646280:1649028, ack 869, win 65535, length 2748
19:58:51.014709 IP 10.0.2.15.44146 > 151.101.117.164.443: Flags [.], ack 1649028, win 65535, length 0
19:58:51.014937 IP 151.101.117.164.443 > 10.0.2.15.44146: Flags [P.], seq 1649028:1651776, ack 869, win 65535, length 2748
19:58:51.014938 IP 151.101.117.164.443 > 10.0.2.15.44146: Flags [P.], seq 1651776:1654524, ack 869, win 65535, length 2748
19:58:51.014939 IP 151.101.117.164.443 > 10.0.2.15.44146: Flags [P.], seq 1654524:1658646, ack 869, win 65535, length 4122
19:58:51.014969 IP 10.0.2.15.44146 > 151.101.117.164.443: Flags [.], ack 1658646, win 65535, length 0
19:58:51.015387 IP 151.101.117.164.443 > 10.0.2.15.44146: Flags [P.], seq 1658646:1662768, ack 869, win 65535, length 4122
19:58:51.015408 IP 10.0.2.15.44146 > 151.101.117.164.443: Flags [.], ack 1662768, win 65535, length 0
19:58:51.015535 IP 151.101.117.164.443 > 10.0.2.15.44146: Flags [P.], seq 1662768:1666890, ack 869, win 65535, length 4122
19:58:51.015587 IP 10.0.2.15.44146 > 151.101.117.164.443: Flags [.], ack 1666890, win 65535, length 0
19:58:51.015731 IP 151.101.117.164.443 > 10.0.2.15.44146: Flags [P.], seq 1666890:1669638, ack 869, win 65535, length 2748
19:58:51.015740 IP 10.0.2.15.44146 > 151.101.117.164.443: Flags [.], ack 1669638, win 65535, length 0
19:58:51.015836 IP 151.101.117.164.443 > 10.0.2.15.44146: Flags [P.], seq 1669638:1672386, ack 869, win 65535, length 2748
19:58:51.015870 IP 10.0.2.15.44146 > 151.101.117.164.443: Flags [.], ack 1672386, win 65535, length 0
19:58:51.016102 IP 151.101.117.164.443 > 10.0.2.15.44146: Flags [P.], seq 1672386:1675134, ack 869, win 65535, length 2748
19:58:51.016104 IP 151.101.117.164.443 > 10.0.2.15.44146: Flags [P.], seq 1675134:1676508, ack 869, win 65535, length 1374
19:58:51.016118 IP 10.0.2.15.44146 > 151.101.117.164.443: Flags [.], ack 1675134, win 65535, length 0
19:58:51.016700 IP 151.101.117.164.443 > 10.0.2.15.44146: Flags [P.], seq 1676508:1680630, ack 869, win 65535, length 4122
19:58:51.016703 IP 151.101.117.164.443 > 10.0.2.15.44146: Flags [P.], seq 1680630:1684752, ack 869, win 65535, length 4122
19:58:51.016703 IP 151.101.117.164.443 > 10.0.2.15.44146: Flags [P.], seq 1684752:1686126, ack 869, win 65535, length 1374
19:58:51.016940 IP 151.101.117.164.443 > 10.0.2.15.44146: Flags [P.], seq 1686126:1691622, ack 869, win 65535, length 5496
19:58:51.017085 IP 10.0.2.15.44146 > 151.101.117.164.443: Flags [.], ack 1691622, win 65535, length 0
19:58:51.017350 IP 151.101.117.164.443 > 10.0.2.15.44146: Flags [P.], seq 1691622:1695744, ack 869, win 65535, length 4122
19:58:51.017351 IP 151.101.117.164.443 > 10.0.2.15.44146: Flags [P.], seq 1695744:1697118, ack 869, win 65535, length 1374
19:58:51.017423 IP 10.0.2.15.44146 > 151.101.117.164.443: Flags [.], ack 1697118, win 65535, length 0
19:58:51.017616 IP 151.101.117.164.443 > 10.0.2.15.44146: Flags [P.], seq 1697118:1699866, ack 869, win 65535, length 2748
19:58:51.017617 IP 151.101.117.164.443 > 10.0.2.15.44146: Flags [.], seq 1699866:1701326, ack 869, win 65535, length 1460
19:58:51.017652 IP 10.0.2.15.44146 > 151.101.117.164.443: Flags [.], ack 1701326, win 65535, length 0
19:58:51.017763 IP 151.101.117.164.443 > 10.0.2.15.44146: Flags [P.], seq 1701326:1703988, ack 869, win 65535, length 2662

