00:14:33.658269 IP 151.101.117.164.443 > 10.0.2.15.44022: Flags [.], seq 75200002:75202922, ack 1820799627, win 65535, length 2920
00:14:33.658293 IP 10.0.2.15.44022 > 151.101.117.164.443: Flags [.], ack 2920, win 62780, length 0
00:14:33.658732 IP 151.101.117.164.443 > 10.0.2.15.44022: Flags [P.], seq 2920:5606, ack 1, win 65535, length 2686
00:14:33.658801 IP 10.0.2.15.44022 > 151.101.117.164.443: Flags [.], ack 5606, win 61320, length 0
00:14:33.660150 IP 10.0.2.15.44022 > 151.101.117.164.443: Flags [P.], seq 1:94, ack 5606, win 62780, length 93
00:14:33.660581 IP 151.101.117.164.443 > 10.0.2.15.44022: Flags [.], ack 94, win 65535, length 0
00:14:33.675573 IP 151.101.117.164.443 > 10.0.2.15.44022: Flags [P.], seq 5606:5657, ack 94, win 65535, length 51
00:14:33.675595 IP 10.0.2.15.44022 > 151.101.117.164.443: Flags [.], ack 5657, win 62780, length 0
00:14:33.676623 IP 10.0.2.15.44022 > 151.101.117.164.443: Flags [P.], seq 94:147, ack 5657, win 62780, length 53
00:14:33.676660 IP 10.0.2.15.44022 > 151.101.117.164.443: Flags [P.], seq 147:203, ack 5657, win 62780, length 56
00:14:33.676787 IP 10.0.2.15.44022 > 151.101.117.164.443: Flags [P.], seq 203:245, ack 5657, win 62780, length 42
00:14:33.676815 IP 10.0.2.15.44022 > 151.101.117.164.443: Flags [P.], seq 245:314, ack 5657, win 62780, length 69
00:14:33.677234 IP 151.101.117.164.443 > 10.0.2.15.44022: Flags [.], ack 147, win 65535, length 0
00:14:33.677236 IP 151.101.117.164.443 > 10.0.2.15.44022: Flags [.], ack 203, win 65535, length 0
00:14:33.677236 IP 151.101.117.164.443 > 10.0.2.15.44022: Flags [.], ack 245, win 65535, length 0
00:14:33.677236 IP 151.101.117.164.443 > 10.0.2.15.44022: Flags [.], ack 314, win 65535, length 0
00:14:33.690292 IP 151.101.117.164.443 > 10.0.2.15.44022: Flags [P.], seq 5657:5752, ack 314, win 65535, length 95
00:14:33.690343 IP 10.0.2.15.44022 > 151.101.117.164.443: Flags [.], ack 5752, win 62780, length 0
00:14:33.690782 IP 10.0.2.15.44022 > 151.101.117.164.443: Flags [P.], seq 314:352, ack 5752, win 62780, length 38
00:14:33.691110 IP 151.101.117.164.443 > 10.0.2.15.44022: Flags [.], ack 352, win 65535, length 0
00:14:33.696877 IP 151.101.117.164.443 > 10.0.2.15.44022: Flags [P.], seq 5752:8500, ack 352, win 65535, length 2748
00:14:33.696901 IP 10.0.2.15.44022 > 151.101.117.164.443: Flags [.], ack 8500, win 62780, length 0
00:14:33.697868 IP 151.101.117.164.443 > 10.0.2.15.44022: Flags [P.], seq 8500:11248, ack 352, win 65535, length 2748
00:14:33.697890 IP 10.0.2.15.44022 > 151.101.117.164.443: Flags [.], ack 11248, win 62780, length 0
00:14:33.699233 IP 151.101.117.164.443 > 10.0.2.15.44022: Flags [P.], seq 11248:16744, ack 352, win 65535, length 5496
00:14:33.699550 IP 10.0.2.15.44022 > 151.101.117.164.443: Flags [.], ack 16744, win 61320, length 0
00:14:33.700247 IP 151.101.117.164.443 > 10.0.2.15.44022: Flags [P.], seq 16744:19492, ack 352, win 65535, length 2748
00:14:33.700265 IP 10.0.2.15.44022 > 151.101.117.164.443: Flags [.], ack 19492, win 62780, length 0
00:14:33.701460 IP 151.101.117.164.443 > 10.0.2.15.44022: Flags [P.], seq 19492:24988, ack 352, win 65535, length 5496
00:14:33.701537 IP 10.0.2.15.44022 > 151.101.117.164.443: Flags [.], ack 24988, win 61320, length 0
00:14:33.702804 IP 151.101.117.164.443 > 10.0.2.15.44022: Flags [P.], seq 24988:27736, ack 352, win 65535, length 2748
00:14:33.702824 IP 10.0.2.15.44022 > 151.101.117.164.443: Flags [.], ack 27736, win 62780, length 0
00:14:33.703907 IP 151.101.117.164.443 > 10.0.2.15.44022: Flags [P.], seq 27736:30484, ack 352, win 65535, length 2748
00:14:33.703924 IP 10.0.2.15.44022 > 151.101.117.164.443: Flags [.], ack 30484, win 62780, length 0
00:14:33.706452 IP 151.101.117.164.443 > 10.0.2.15.44022: Flags [P.], seq 30484:41476, ack 352, win 65535, length 10992
00:14:33.706633 IP 10.0.2.15.44022 > 151.101.117.164.443: Flags [.], ack 41476, win 56940, length 0
00:14:33.707486 IP 151.101.117.164.443 > 10.0.2.15.44022: Flags [P.], seq 41476:44224, ack 352, win 65535, length 2748
00:14:33.707510 IP 10.0.2.15.44022 > 151.101.117.164.443: Flags [.], ack 44224, win 62780, length 0
00:14:33.708340 IP 151.101.117.164.443 > 10.0.2.15.44022: Flags [P.], seq 44224:48346, ack 352, win 65535, length 4122
00:14:33.708342 IP 151.101.117.164.443 > 10.0.2.15.44022: Flags [P.], seq 48346:49720, ack 352, win 65535, length 1374
00:14:33.708513 IP 10.0.2.15.44022 > 151.101.117.164.443: Flags [.], ack 49720, win 61320, length 0
00:14:33.710762 IP 151.101.117.164.443 > 10.0.2.15.44022: Flags [P.], seq 49720:53842, ack 352, win 65535, length 4122
00:14:33.710786 IP 10.0.2.15.44022 > 151.101.117.164.443: Flags [.], ack 53842, win 61320, length 0
00:14:33.711517 IP 151.101.117.164.443 > 10.0.2.15.44022: Flags [P.], seq 53842:56590, ack 352, win 65535, length 2748
00:14:33.711538 IP 10.0.2.15.44022 > 151.101.117.164.443: Flags [.], ack 56590, win 62780, length 0
00:14:33.711724 IP 151.101.117.164.443 > 10.0.2.15.44022: Flags [P.], seq 56590:57964, ack 352, win 65535, length 1374
00:14:33.712940 IP 151.101.117.164.443 > 10.0.2.15.44022: Flags [P.], seq 57964:63460, ack 352, win 65535, length 5496
00:14:33.712942 IP 151.101.117.164.443 > 10.0.2.15.44022: Flags [P.], seq 63460:66208, ack 352, win 65535, length 2748
00:14:33.713030 IP 10.0.2.15.44022 > 151.101.117.164.443: Flags [.], ack 66208, win 58400, length 0
00:14:33.714887 IP 151.101.117.164.443 > 10.0.2.15.44022: Flags [P.], seq 66208:70330, ack 352, win 65535, length 4122
00:14:33.714890 IP 151.101.117.164.443 > 10.0.2.15.44022: Flags [P.], seq 70330:71704, ack 352, win 65535, length 1374
00:14:33.715034 IP 10.0.2.15.44022 > 151.101.117.164.443: Flags [.], ack 70330, win 61320, length 0
00:14:33.715424 IP 151.101.117.164.443 > 10.0.2.15.44022: Flags [P.], seq 71704:75826, ack 352, win 65535, length 4122
00:14:33.715426 IP 151.101.117.164.443 > 10.0.2.15.44022: Flags [P.], seq 75826:77200, ack 352, win 65535, length 1374
00:14:33.715444 IP 10.0.2.15.44022 > 151.101.117.164.443: Flags [.], ack 75826, win 65535, length 0
00:14:33.718777 IP 151.101.117.164.443 > 10.0.2.15.44022: Flags [P.], seq 77200:81322, ack 352, win 65535, length 4122
00:14:33.718780 IP 151.101.117.164.443 > 10.0.2.15.44022: Flags [P.], seq 81322:84070, ack 352, win 65535, length 2748
00:14:33.718809 IP 10.0.2.15.44022 > 151.101.117.164.443: Flags [.], ack 81322, win 65535, length 0
00:14:33.718893 IP 10.0.2.15.44022 > 151.101.117.164.443: Flags [.], ack 84070, win 65535, length 0
00:14:33.719704 IP 151.101.117.164.443 > 10.0.2.15.44022: Flags [P.], seq 84070:88192, ack 352, win 65535, length 4122
00:14:33.719706 IP 151.101.117.164.443 > 10.0.2.15.44022: Flags [P.], seq 88192:90940, ack 352, win 65535, length 2748
00:14:33.719708 IP 151.101.117.164.443 > 10.0.2.15.44022: Flags [P.], seq 90940:95062, ack 352, win 65535, length 4122
00:14:33.719735 IP 151.101.117.164.443 > 10.0.2.15.44022: Flags [P.], seq 95062:96436, ack 352, win 65535, length 1374
00:14:33.719826 IP 10.0.2.15.44022 > 151.101.117.164.443: Flags [.], ack 96436, win 65535, length 0
00:14:33.720521 IP 151.101.117.164.443 > 10.0.2.15.44022: Flags [P.], seq 96436:100558, ack 352, win 65535, length 4122
00:14:33.720523 IP 151.101.117.164.443 > 10.0.2.15.44022: Flags [P.], seq 100558:101932, ack 352, win 65535, length 1374
00:14:33.720540 IP 10.0.2.15.44022 > 151.101.117.164.443: Flags [.], ack 100558, win 65535, length 0
00:14:33.720862 IP 151.101.117.164.443 > 10.0.2.15.44022: Flags [P.], seq 101932:103306, ack 352, win 65535, length 1374
00:14:33.720864 IP 151.101.117.164.443 > 10.0.2.15.44022: Flags [P.], seq 103306:106054, ack 352, win 65535, length 2748
00:14:33.720878 IP 10.0.2.15.44022 > 151.101.117.164.443: Flags [.], ack 103306, win 65535, length 0
00:14:33.720965 IP 10.0.2.15.44022 > 151.101.117.164.443: Flags [.], ack 106054, win 65535, length 0
00:14:33.721144 IP 151.101.117.164.443 > 10.0.2.15.44022: Flags [P.], seq 106054:107428, ack 352, win 65535, length 1374
00:14:33.721146 IP 151.101.117.164.443 > 10.0.2.15.44022: Flags [P.], seq 107428:110176, ack 352, win 65535, length 2748
00:14:33.721159 IP 10.0.2.15.44022 > 151.101.117.164.443: Flags [.], ack 110176, win 65535, length 0
00:14:33.721389 IP 151.101.117.164.443 > 10.0.2.15.44022: Flags [P.], seq 110176:114298, ack 352, win 65535, length 4122
00:14:33.721399 IP 10.0.2.15.44022 > 151.101.117.164.443: Flags [.], ack 114298, win 65535, length 0
00:14:33.721716 IP 151.101.117.164.443 > 10.0.2.15.44022: Flags [P.], seq 114298:117046, ack 352, win 65535, length 2748
00:14:33.721727 IP 10.0.2.15.44022 > 151.101.117.164.443: Flags [.], ack 117046, win 65535, length 0
00:14:33.722050 IP 151.101.117.164.443 > 10.0.2.15.44022: Flags [P.], seq 117046:121168, ack 352, win 65535, length 4122
00:14:33.722062 IP 10.0.2.15.44022 > 151.101.117.164.443: Flags [.], ack 121168, win 65535, length 0
00:14:33.722212 IP 151.101.117.164.443 > 10.0.2.15.44022: Flags [P.], seq 121168:122542, ack 352, win 65535, length 1374
00:14:33.722775 IP 151.101.117.164.443 > 10.0.2.15.44022: Flags [P.], seq 122542:126664, ack 352, win 65535, length 4122
00:14:33.722777 IP 151.101.117.164.443 > 10.0.2.15.44022: Flags [P.], seq 126664:128038, ack 352, win 65535, length 1374
00:14:33.722794 IP 10.0.2.15.44022 > 151.101.117.164.443: Flags [.], ack 126664, win 65535, length 0
00:14:33.723125 IP 151.101.117.164.443 > 10.0.2.15.44022: Flags [P.], seq 128038:130786, ack 352, win 65535, length 2748
00:14:33.723134 IP 10.0.2.15.44022 > 151.101.117.164.443: Flags [.], ack 130786, win 65535, length 0
00:14:33.723704 IP 151.101.117.164.443 > 10.0.2.15.44022: Flags [P.], seq 130786:133534, ack 352, win 65535, length 2748
00:14:33.723723 IP 10.0.2.15.44022 > 151.101.117.164.443: Flags [.], ack 133534, win 65535, length 0
00:14:33.724254 IP 151.101.117.164.443 > 10.0.2.15.44022: Flags [P.], seq 133534:137656, ack 352, win 65535, length 4122
00:14:33.724268 IP 10.0.2.15.44022 > 151.101.117.164.443: Flags [.], ack 137656, win 65535, length 0
00:14:33.724546 IP 151.101.117.164.443 > 10.0.2.15.44022: Flags [P.], seq 137656:143152, ack 352, win 65535, length 5496
00:14:33.724548 IP 151.101.117.164.443 > 10.0.2.15.44022: Flags [P.], seq 143152:144526, ack 352, win 65535, length 1374
00:14:33.724565 IP 10.0.2.15.44022 > 151.101.117.164.443: Flags [.], ack 143152, win 65535, length 0
00:14:33.725023 IP 151.101.117.164.443 > 10.0.2.15.44022: Flags [P.], seq 144526:148648, ack 352, win 65535, length 4122
00:14:33.725036 IP 10.0.2.15.44022 > 151.101.117.164.443: Flags [.], ack 148648, win 65535, length 0
00:14:33.725327 IP 151.101.117.164.443 > 10.0.2.15.44022: Flags [P.], seq 148648:151396, ack 352, win 65535, length 2748
00:14:33.725337 IP 10.0.2.15.44022 > 151.101.117.164.443: Flags [.], ack 151396, win 65535, length 0
00:14:33.725496 IP 151.101.117.164.443 > 10.0.2.15.44022: Flags [P.], seq 151396:152770, ack 352, win 65535, length 1374
00:14:33.726680 IP 151.101.117.164.443 > 10.0.2.15.44022: Flags [P.], seq 152770:158266, ack 352, win 65535, length 5496
00:14:33.726683 IP 151.101.117.164.443 > 10.0.2.15.44022: Flags [P.], seq 158266:161014, ack 352, win 65535, length 2748
00:14:33.726705 IP 10.0.2.15.44022 > 151.101.117.164.443: Flags [.], ack 158266, win 65535, length 0
00:14:33.726776 IP 10.0.2.15.44022 > 151.101.117.164.443: Flags [.], ack 161014, win 65535, length 0
00:14:33.727035 IP 151.101.117.164.443 > 10.0.2.15.44022: Flags [P.], seq 161014:165136, ack 352, win 65535, length 4122
00:14:33.727046 IP 10.0.2.15.44022 > 151.101.117.164.443: Flags [.], ack 165136, win 65535, length 0
00:14:33.741060 IP 151.101.117.164.443 > 10.0.2.15.44022: Flags [P.], seq 165136:170632, ack 352, win 65535, length 5496
00:14:33.741064 IP 151.101.117.164.443 > 10.0.2.15.44022: Flags [P.], seq 170632:174754, ack 352, win 65535, length 4122
00:14:33.741065 IP 151.101.117.164.443 > 10.0.2.15.44022: Flags [.], seq 174754:176214, ack 352, win 65535, length 1460
00:14:33.741088 IP 10.0.2.15.44022 > 151.101.117.164.443: Flags [.], ack 170632, win 65535, length 0
00:14:33.741124 IP 10.0.2.15.44022 > 151.101.117.164.443: Flags [.], ack 174754, win 65535, length 0
00:14:33.741227 IP 151.101.117.164.443 > 10.0.2.15.44022: Flags [P.], seq 176214:177502, ack 352, win 65535, length 1288
00:14:33.741234 IP 10.0.2.15.44022 > 151.101.117.164.443: Flags [.], ack 177502, win 65535, length 0
00:14:33.742309 IP 151.101.117.164.443 > 10.0.2.15.44022: Flags [P.], seq 177502:180250, ack 352, win 65535, length 2748
00:14:33.742312 IP 151.101.117.164.443 > 10.0.2.15.44022: Flags [.], seq 180250:181710, ack 352, win 65535, length 1460
00:14:33.742335 IP 10.0.2.15.44022 > 151.101.117.164.443: Flags [.], ack 180250, win 65535, length 0
00:14:33.742587 IP 151.101.117.164.443 > 10.0.2.15.44022: Flags [P.], seq 181710:182998, ack 352, win 65535, length 1288
00:14:33.742589 IP 151.101.117.164.443 > 10.0.2.15.44022: Flags [P.], seq 182998:185746, ack 352, win 65535, length 2748
00:14:33.742590 IP 151.101.117.164.443 > 10.0.2.15.44022: Flags [P.], seq 185746:188494, ack 352, win 65535, length 2748
00:14:33.742675 IP 10.0.2.15.44022 > 151.101.117.164.443: Flags [.], ack 182998, win 65535, length 0
00:14:33.742797 IP 10.0.2.15.44022 > 151.101.117.164.443: Flags [.], ack 185746, win 65535, length 0
00:14:33.742814 IP 10.0.2.15.44022 > 151.101.117.164.443: Flags [.], ack 188494, win 65535, length 0
00:14:33.742962 IP 151.101.117.164.443 > 10.0.2.15.44022: Flags [P.], seq 188494:191242, ack 352, win 65535, length 2748
00:14:33.742970 IP 10.0.2.15.44022 > 151.101.117.164.443: Flags [.], ack 191242, win 65535, length 0
00:14:33.743279 IP 151.101.117.164.443 > 10.0.2.15.44022: Flags [P.], seq 191242:195364, ack 352, win 65535, length 4122
00:14:33.743296 IP 10.0.2.15.44022 > 151.101.117.164.443: Flags [.], ack 195364, win 65535, length 0
00:14:33.743510 IP 151.101.117.164.443 > 10.0.2.15.44022: Flags [P.], seq 195364:198112, ack 352, win 65535, length 2748
00:14:33.743512 IP 151.101.117.164.443 > 10.0.2.15.44022: Flags [P.], seq 198112:199486, ack 352, win 65535, length 1374
00:14:33.743556 IP 10.0.2.15.44022 > 151.101.117.164.443: Flags [.], ack 198112, win 65535, length 0
00:14:33.744006 IP 151.101.117.164.443 > 10.0.2.15.44022: Flags [P.], seq 199486:202234, ack 352, win 65535, length 2748
00:14:33.744008 IP 151.101.117.164.443 > 10.0.2.15.44022: Flags [P.], seq 202234:203608, ack 352, win 65535, length 1374
00:14:33.744025 IP 10.0.2.15.44022 > 151.101.117.164.443: Flags [.], ack 202234, win 65535, length 0
00:14:33.747828 IP 151.101.117.164.443 > 10.0.2.15.44022: Flags [P.], seq 203608:229714, ack 352, win 65535, length 26106
00:14:33.747879 IP 10.0.2.15.44022 > 151.101.117.164.443: Flags [.], ack 229714, win 65535, length 0
00:14:33.747980 IP 151.101.117.164.443 > 10.0.2.15.44022: Flags [P.], seq 229714:232462, ack 352, win 65535, length 2748
00:14:33.747981 IP 151.101.117.164.443 > 10.0.2.15.44022: Flags [P.], seq 232462:235210, ack 352, win 65535, length 2748
00:14:33.747997 IP 10.0.2.15.44022 > 151.101.117.164.443: Flags [.], ack 232462, win 65535, length 0
00:14:33.748018 IP 10.0.2.15.44022 > 151.101.117.164.443: Flags [.], ack 235210, win 65535, length 0
00:14:33.748404 IP 151.101.117.164.443 > 10.0.2.15.44022: Flags [P.], seq 235210:243454, ack 352, win 65535, length 8244
00:14:33.748425 IP 10.0.2.15.44022 > 151.101.117.164.443: Flags [.], ack 243454, win 65535, length 0
00:14:33.748629 IP 151.101.117.164.443 > 10.0.2.15.44022: Flags [P.], seq 243454:246202, ack 352, win 65535, length 2748
00:14:33.748643 IP 10.0.2.15.44022 > 151.101.117.164.443: Flags [.], ack 246202, win 65535, length 0
00:14:33.748829 IP 151.101.117.164.443 > 10.0.2.15.44022: Flags [P.], seq 246202:247576, ack 352, win 65535, length 1374
00:14:33.749360 IP 151.101.117.164.443 > 10.0.2.15.44022: Flags [P.], seq 247576:250324, ack 352, win 65535, length 2748
00:14:33.749437 IP 10.0.2.15.44022 > 151.101.117.164.443: Flags [.], ack 250324, win 65535, length 0
00:14:33.750076 IP 151.101.117.164.443 > 10.0.2.15.44022: Flags [P.], seq 250324:253072, ack 352, win 65535, length 2748
00:14:33.750094 IP 10.0.2.15.44022 > 151.101.117.164.443: Flags [.], ack 253072, win 65535, length 0
00:14:33.750354 IP 151.101.117.164.443 > 10.0.2.15.44022: Flags [P.], seq 253072:257194, ack 352, win 65535, length 4122
00:14:33.750365 IP 10.0.2.15.44022 > 151.101.117.164.443: Flags [.], ack 257194, win 65535, length 0
00:14:33.750730 IP 151.101.117.164.443 > 10.0.2.15.44022: Flags [P.], seq 257194:258568, ack 352, win 65535, length 1374
00:14:33.750733 IP 151.101.117.164.443 > 10.0.2.15.44022: Flags [P.], seq 258568:262690, ack 352, win 65535, length 4122
00:14:33.750753 IP 10.0.2.15.44022 > 151.101.117.164.443: Flags [.], ack 262690, win 65535, length 0
00:14:33.750999 IP 151.101.117.164.443 > 10.0.2.15.44022: Flags [P.], seq 262690:265438, ack 352, win 65535, length 2748
00:14:33.751001 IP 151.101.117.164.443 > 10.0.2.15.44022: Flags [P.], seq 265438:268186, ack 352, win 65535, length 2748
00:14:33.751015 IP 10.0.2.15.44022 > 151.101.117.164.443: Flags [.], ack 265438, win 65535, length 0
00:14:33.751034 IP 10.0.2.15.44022 > 151.101.117.164.443: Flags [.], ack 268186, win 65535, length 0
00:14:33.751641 IP 151.101.117.164.443 > 10.0.2.15.44022: Flags [P.], seq 268186:270934, ack 352, win 65535, length 2748
00:14:33.751643 IP 151.101.117.164.443 > 10.0.2.15.44022: Flags [P.], seq 270934:275056, ack 352, win 65535, length 4122
00:14:33.751693 IP 10.0.2.15.44022 > 151.101.117.164.443: Flags [.], ack 270934, win 65535, length 0
00:14:33.751714 IP 10.0.2.15.44022 > 151.101.117.164.443: Flags [.], ack 275056, win 65535, length 0
00:14:33.751832 IP 151.101.117.164.443 > 10.0.2.15.44022: Flags [P.], seq 275056:276430, ack 352, win 65535, length 1374
00:14:33.753024 IP 151.101.117.164.443 > 10.0.2.15.44022: Flags [P.], seq 276430:280552, ack 352, win 65535, length 4122
00:14:33.753030 IP 151.101.117.164.443 > 10.0.2.15.44022: Flags [P.], seq 280552:284674, ack 352, win 65535, length 4122
00:14:33.753032 IP 151.101.117.164.443 > 10.0.2.15.44022: Flags [P.], seq 284674:288796, ack 352, win 65535, length 4122
00:14:33.753069 IP 10.0.2.15.44022 > 151.101.117.164.443: Flags [.], ack 280552, win 65535, length 0
00:14:33.753101 IP 10.0.2.15.44022 > 151.101.117.164.443: Flags [.], ack 284674, win 65535, length 0
00:14:33.753181 IP 10.0.2.15.44022 > 151.101.117.164.443: Flags [.], ack 288796, win 65535, length 0
00:14:33.753843 IP 151.101.117.164.443 > 10.0.2.15.44022: Flags [P.], seq 288796:291544, ack 352, win 65535, length 2748
00:14:33.753846 IP 151.101.117.164.443 > 10.0.2.15.44022: Flags [P.], seq 291544:297040, ack 352, win 65535, length 5496
00:14:33.753873 IP 10.0.2.15.44022 > 151.101.117.164.443: Flags [.], ack 291544, win 65535, length 0
00:14:33.753893 IP 10.0.2.15.44022 > 151.101.117.164.443: Flags [.], ack 297040, win 65535, length 0
00:14:33.754709 IP 151.101.117.164.443 > 10.0.2.15.44022: Flags [P.], seq 297040:302536, ack 352, win 65535, length 5496
00:14:33.754737 IP 10.0.2.15.44022 > 151.101.117.164.443: Flags [.], ack 302536, win 65535, length 0
00:14:33.755184 IP 151.101.117.164.443 > 10.0.2.15.44022: Flags [P.], seq 302536:305284, ack 352, win 65535, length 2748
00:14:33.755187 IP 151.101.117.164.443 > 10.0.2.15.44022: Flags [P.], seq 305284:308032, ack 352, win 65535, length 2748
00:14:33.755188 IP 151.101.117.164.443 > 10.0.2.15.44022: Flags [P.], seq 308032:310780, ack 352, win 65535, length 2748
00:14:33.755188 IP 151.101.117.164.443 > 10.0.2.15.44022: Flags [P.], seq 310780:312154, ack 352, win 65535, length 1374
00:14:33.755245 IP 10.0.2.15.44022 > 151.101.117.164.443: Flags [.], ack 305284, win 65535, length 0
00:14:33.755320 IP 10.0.2.15.44022 > 151.101.117.164.443: Flags [.], ack 308032, win 65535, length 0
00:14:33.755364 IP 10.0.2.15.44022 > 151.101.117.164.443: Flags [.], ack 310780, win 65535, length 0
00:14:33.755643 IP 151.101.117.164.443 > 10.0.2.15.44022: Flags [P.], seq 312154:314902, ack 352, win 65535, length 2748
00:14:33.755645 IP 151.101.117.164.443 > 10.0.2.15.44022: Flags [P.], seq 314902:316276, ack 352, win 65535, length 1374
00:14:33.755691 IP 10.0.2.15.44022 > 151.101.117.164.443: Flags [.], ack 314902, win 65535, length 0
00:14:33.755857 IP 151.101.117.164.443 > 10.0.2.15.44022: Flags [P.], seq 316276:319024, ack 352, win 65535, length 2748
00:14:33.755858 IP 151.101.117.164.443 > 10.0.2.15.44022: Flags [P.], seq 319024:320398, ack 352, win 65535, length 1374
00:14:33.755869 IP 10.0.2.15.44022 > 151.101.117.164.443: Flags [.], ack 319024, win 65535, length 0
00:14:33.755988 IP 151.101.117.164.443 > 10.0.2.15.44022: Flags [.], seq 320398:321858, ack 352, win 65535, length 1460
00:14:33.755994 IP 10.0.2.15.44022 > 151.101.117.164.443: Flags [.], ack 321858, win 65535, length 0
00:14:33.756154 IP 151.101.117.164.443 > 10.0.2.15.44022: Flags [P.], seq 321858:323146, ack 352, win 65535, length 1288
00:14:33.762491 IP 151.101.117.164.443 > 10.0.2.15.44022: Flags [P.], seq 323146:343756, ack 352, win 65535, length 20610
00:14:33.762519 IP 10.0.2.15.44022 > 151.101.117.164.443: Flags [.], ack 343756, win 65535, length 0
00:14:33.762601 IP 151.101.117.164.443 > 10.0.2.15.44022: Flags [P.], seq 343756:346504, ack 352, win 65535, length 2748
00:14:33.762603 IP 151.101.117.164.443 > 10.0.2.15.44022: Flags [P.], seq 346504:350626, ack 352, win 65535, length 4122
00:14:33.762658 IP 151.101.117.164.443 > 10.0.2.15.44022: Flags [P.], seq 350626:361618, ack 352, win 65535, length 10992
00:14:33.762755 IP 10.0.2.15.44022 > 151.101.117.164.443: Flags [.], ack 346504, win 65535, length 0
00:14:33.762824 IP 10.0.2.15.44022 > 151.101.117.164.443: Flags [.], ack 350626, win 65535, length 0
00:14:33.762849 IP 10.0.2.15.44022 > 151.101.117.164.443: Flags [.], ack 361618, win 65535, length 0
00:14:33.762885 IP 151.101.117.164.443 > 10.0.2.15.44022: Flags [P.], seq 361618:368488, ack 352, win 65535, length 6870
00:14:33.762890 IP 10.0.2.15.44022 > 151.101.117.164.443: Flags [.], ack 368488, win 65535, length 0
00:14:33.763748 IP 151.101.117.164.443 > 10.0.2.15.44022: Flags [P.], seq 368488:369862, ack 352, win 65535, length 1374
00:14:33.764182 IP 151.101.117.164.443 > 10.0.2.15.44022: Flags [P.], seq 369862:372610, ack 352, win 65535, length 2748
00:14:33.764195 IP 10.0.2.15.44022 > 151.101.117.164.443: Flags [.], ack 372610, win 65535, length 0
00:14:33.764617 IP 151.101.117.164.443 > 10.0.2.15.44022: Flags [P.], seq 372610:378106, ack 352, win 65535, length 5496
00:14:33.764619 IP 151.101.117.164.443 > 10.0.2.15.44022: Flags [P.], seq 378106:379480, ack 352, win 65535, length 1374
00:14:33.764635 IP 10.0.2.15.44022 > 151.101.117.164.443: Flags [.], ack 378106, win 65535, length 0
00:14:33.764792 IP 151.101.117.164.443 > 10.0.2.15.44022: Flags [P.], seq 379480:382228, ack 352, win 65535, length 2748
00:14:33.764806 IP 10.0.2.15.44022 > 151.101.117.164.443: Flags [.], ack 382228, win 65535, length 0
00:14:33.765118 IP 151.101.117.164.443 > 10.0.2.15.44022: Flags [P.], seq 382228:386350, ack 352, win 65535, length 4122
00:14:33.765128 IP 10.0.2.15.44022 > 151.101.117.164.443: Flags [.], ack 386350, win 65535, length 0
00:14:33.765242 IP 151.101.117.164.443 > 10.0.2.15.44022: Flags [P.], seq 386350:387724, ack 352, win 65535, length 1374
00:14:33.765365 IP 151.101.117.164.443 > 10.0.2.15.44022: Flags [P.], seq 387724:390472, ack 352, win 65535, length 2748
00:14:33.765375 IP 10.0.2.15.44022 > 151.101.117.164.443: Flags [.], ack 390472, win 65535, length 0
00:14:33.765788 IP 151.101.117.164.443 > 10.0.2.15.44022: Flags [P.], seq 390472:393220, ack 352, win 65535, length 2748
00:14:33.765801 IP 10.0.2.15.44022 > 151.101.117.164.443: Flags [.], ack 393220, win 65535, length 0
00:14:33.766319 IP 151.101.117.164.443 > 10.0.2.15.44022: Flags [P.], seq 393220:395968, ack 352, win 65535, length 2748
00:14:33.766332 IP 10.0.2.15.44022 > 151.101.117.164.443: Flags [.], ack 395968, win 65535, length 0
00:14:33.769527 IP 151.101.117.164.443 > 10.0.2.15.44022: Flags [P.], seq 395968:422074, ack 352, win 65535, length 26106
00:14:33.769545 IP 10.0.2.15.44022 > 151.101.117.164.443: Flags [.], ack 422074, win 65535, length 0
00:14:33.769586 IP 151.101.117.164.443 > 10.0.2.15.44022: Flags [P.], seq 422074:424822, ack 352, win 65535, length 2748
00:14:33.769592 IP 10.0.2.15.44022 > 151.101.117.164.443: Flags [.], ack 424822, win 65535, length 0
00:14:33.770336 IP 151.101.117.164.443 > 10.0.2.15.44022: Flags [P.], seq 424822:428944, ack 352, win 65535, length 4122
00:14:33.770338 IP 151.101.117.164.443 > 10.0.2.15.44022: Flags [P.], seq 428944:433066, ack 352, win 65535, length 4122
00:14:33.770352 IP 10.0.2.15.44022 > 151.101.117.164.443: Flags [.], ack 428944, win 65535, length 0
00:14:33.770425 IP 10.0.2.15.44022 > 151.101.117.164.443: Flags [.], ack 433066, win 65535, length 0
00:14:33.770676 IP 151.101.117.164.443 > 10.0.2.15.44022: Flags [P.], seq 433066:438562, ack 352, win 65535, length 5496
00:14:33.770678 IP 151.101.117.164.443 > 10.0.2.15.44022: Flags [P.], seq 438562:441310, ack 352, win 65535, length 2748
00:14:33.770688 IP 10.0.2.15.44022 > 151.101.117.164.443: Flags [.], ack 438562, win 65535, length 0
00:14:33.770704 IP 10.0.2.15.44022 > 151.101.117.164.443: Flags [.], ack 441310, win 65535, length 0
00:14:33.771823 IP 151.101.117.164.443 > 10.0.2.15.44022: Flags [P.], seq 441310:445432, ack 352, win 65535, length 4122
00:14:33.771826 IP 151.101.117.164.443 > 10.0.2.15.44022: Flags [P.], seq 445432:446806, ack 352, win 65535, length 1374
00:14:33.771826 IP 151.101.117.164.443 > 10.0.2.15.44022: Flags [P.], seq 446806:449554, ack 352, win 65535, length 2748
00:14:33.771843 IP 10.0.2.15.44022 > 151.101.117.164.443: Flags [.], ack 445432, win 65535, length 0
00:14:33.771875 IP 10.0.2.15.44022 > 151.101.117.164.443: Flags [.], ack 449554, win 65535, length 0
00:14:33.772169 IP 151.101.117.164.443 > 10.0.2.15.44022: Flags [P.], seq 449554:452302, ack 352, win 65535, length 2748
00:14:33.772178 IP 10.0.2.15.44022 > 151.101.117.164.443: Flags [.], ack 452302, win 65535, length 0
00:14:33.773061 IP 151.101.117.164.443 > 10.0.2.15.44022: Flags [P.], seq 452302:456424, ack 352, win 65535, length 4122
00:14:33.773063 IP 151.101.117.164.443 > 10.0.2.15.44022: Flags [P.], seq 456424:459172, ack 352, win 65535, length 2748
00:14:33.773065 IP 151.101.117.164.443 > 10.0.2.15.44022: Flags [P.], seq 459172:463294, ack 352, win 65535, length 4122
00:14:33.773085 IP 10.0.2.15.44022 > 151.101.117.164.443: Flags [.], ack 456424, win 65535, length 0
00:14:33.773178 IP 10.0.2.15.44022 > 151.101.117.164.443: Flags [.], ack 459172, win 65535, length 0
00:14:33.773195 IP 10.0.2.15.44022 > 151.101.117.164.443: Flags [.], ack 463294, win 65535, length 0
00:14:33.773214 IP 151.101.117.164.443 > 10.0.2.15.44022: Flags [P.], seq 463294:464668, ack 352, win 65535, length 1374
00:14:33.774114 IP 151.101.117.164.443 > 10.0.2.15.44022: Flags [P.], seq 464668:468790, ack 352, win 65535, length 4122
00:14:33.774117 IP 151.101.117.164.443 > 10.0.2.15.44022: Flags [P.], seq 468790:472912, ack 352, win 65535, length 4122
00:14:33.774137 IP 10.0.2.15.44022 > 151.101.117.164.443: Flags [.], ack 468790, win 65535, length 0
00:14:33.774365 IP 10.0.2.15.44022 > 151.101.117.164.443: Flags [.], ack 472912, win 65535, length 0
00:14:33.774573 IP 151.101.117.164.443 > 10.0.2.15.44022: Flags [P.], seq 472912:475660, ack 352, win 65535, length 2748
00:14:33.774575 IP 151.101.117.164.443 > 10.0.2.15.44022: Flags [P.], seq 475660:478408, ack 352, win 65535, length 2748
00:14:33.774589 IP 10.0.2.15.44022 > 151.101.117.164.443: Flags [.], ack 475660, win 65535, length 0
00:14:33.774659 IP 10.0.2.15.44022 > 151.101.117.164.443: Flags [.], ack 478408, win 65535, length 0
00:14:33.774975 IP 151.101.117.164.443 > 10.0.2.15.44022: Flags [P.], seq 478408:481156, ack 352, win 65535, length 2748
00:14:33.774977 IP 151.101.117.164.443 > 10.0.2.15.44022: Flags [P.], seq 481156:483904, ack 352, win 65535, length 2748
00:14:33.774991 IP 10.0.2.15.44022 > 151.101.117.164.443: Flags [.], ack 481156, win 65535, length 0
00:14:33.775008 IP 10.0.2.15.44022 > 151.101.117.164.443: Flags [.], ack 483904, win 65535, length 0
00:14:33.775532 IP 151.101.117.164.443 > 10.0.2.15.44022: Flags [P.], seq 483904:486652, ack 352, win 65535, length 2748
00:14:33.775533 IP 151.101.117.164.443 > 10.0.2.15.44022: Flags [P.], seq 486652:488026, ack 352, win 65535, length 1374
00:14:33.775545 IP 10.0.2.15.44022 > 151.101.117.164.443: Flags [.], ack 486652, win 65535, length 0
00:14:33.776844 IP 151.101.117.164.443 > 10.0.2.15.44022: Flags [P.], seq 488026:490774, ack 352, win 65535, length 2748
00:14:33.776847 IP 151.101.117.164.443 > 10.0.2.15.44022: Flags [P.], seq 490774:494896, ack 352, win 65535, length 4122
00:14:33.776848 IP 151.101.117.164.443 > 10.0.2.15.44022: Flags [P.], seq 494896:500392, ack 352, win 65535, length 5496
00:14:33.776868 IP 10.0.2.15.44022 > 151.101.117.164.443: Flags [.], ack 490774, win 65535, length 0
00:14:33.776902 IP 10.0.2.15.44022 > 151.101.117.164.443: Flags [.], ack 494896, win 65535, length 0
00:14:33.776917 IP 10.0.2.15.44022 > 151.101.117.164.443: Flags [.], ack 500392, win 65535, length 0
00:14:33.776945 IP 151.101.117.164.443 > 10.0.2.15.44022: Flags [P.], seq 500392:504514, ack 352, win 65535, length 4122
00:14:33.776950 IP 10.0.2.15.44022 > 151.101.117.164.443: Flags [.], ack 504514, win 65535, length 0
00:14:33.777362 IP 151.101.117.164.443 > 10.0.2.15.44022: Flags [P.], seq 504514:507262, ack 352, win 65535, length 2748
00:14:33.777375 IP 151.101.117.164.443 > 10.0.2.15.44022: Flags [P.], seq 507262:510010, ack 352, win 65535, length 2748
00:14:33.777391 IP 10.0.2.15.44022 > 151.101.117.164.443: Flags [.], ack 507262, win 65535, length 0
00:14:33.777411 IP 10.0.2.15.44022 > 151.101.117.164.443: Flags [.], ack 510010, win 65535, length 0
00:14:33.777717 IP 151.101.117.164.443 > 10.0.2.15.44022: Flags [P.], seq 510010:511384, ack 352, win 65535, length 1374
00:14:33.780512 IP 151.101.117.164.443 > 10.0.2.15.44022: Flags [P.], seq 511384:515506, ack 352, win 65535, length 4122
00:14:33.780516 IP 151.101.117.164.443 > 10.0.2.15.44022: Flags [P.], seq 515506:518254, ack 352, win 65535, length 2748
00:14:33.780537 IP 10.0.2.15.44022 > 151.101.117.164.443: Flags [.], ack 515506, win 65535, length 0
00:14:33.780570 IP 10.0.2.15.44022 > 151.101.117.164.443: Flags [.], ack 518254, win 65535, length 0
00:14:33.780868 IP 151.101.117.164.443 > 10.0.2.15.44022: Flags [P.], seq 518254:522376, ack 352, win 65535, length 4122
00:14:33.780880 IP 10.0.2.15.44022 > 151.101.117.164.443: Flags [.], ack 522376, win 65535, length 0
00:14:33.781048 IP 151.101.117.164.443 > 10.0.2.15.44022: Flags [P.], seq 522376:525124, ack 352, win 65535, length 2748
00:14:33.781057 IP 10.0.2.15.44022 > 151.101.117.164.443: Flags [.], ack 525124, win 65535, length 0
00:14:33.781201 IP 151.101.117.164.443 > 10.0.2.15.44022: Flags [P.], seq 525124:527872, ack 352, win 65535, length 2748
00:14:33.781210 IP 10.0.2.15.44022 > 151.101.117.164.443: Flags [.], ack 527872, win 65535, length 0
00:14:33.781459 IP 151.101.117.164.443 > 10.0.2.15.44022: Flags [P.], seq 527872:529246, ack 352, win 65535, length 1374
00:14:33.781460 IP 151.101.117.164.443 > 10.0.2.15.44022: Flags [P.], seq 529246:530620, ack 352, win 65535, length 1374
00:14:33.781481 IP 10.0.2.15.44022 > 151.101.117.164.443: Flags [.], ack 530620, win 65535, length 0
00:14:33.781608 IP 151.101.117.164.443 > 10.0.2.15.44022: Flags [P.], seq 530620:533368, ack 352, win 65535, length 2748
00:14:33.781625 IP 10.0.2.15.44022 > 151.101.117.164.443: Flags [.], ack 533368, win 65535, length 0
00:14:33.781745 IP 151.101.117.164.443 > 10.0.2.15.44022: Flags [P.], seq 533368:534742, ack 352, win 65535, length 1374
00:14:33.781887 IP 151.101.117.164.443 > 10.0.2.15.44022: Flags [P.], seq 534742:537490, ack 352, win 65535, length 2748
00:14:33.781894 IP 10.0.2.15.44022 > 151.101.117.164.443: Flags [.], ack 537490, win 65535, length 0
00:14:33.782030 IP 151.101.117.164.443 > 10.0.2.15.44022: Flags [P.], seq 537490:538864, ack 352, win 65535, length 1374
00:14:33.782167 IP 151.101.117.164.443 > 10.0.2.15.44022: Flags [P.], seq 538864:541612, ack 352, win 65535, length 2748
00:14:33.782175 IP 10.0.2.15.44022 > 151.101.117.164.443: Flags [.], ack 541612, win 65535, length 0
00:14:33.782289 IP 151.101.117.164.443 > 10.0.2.15.44022: Flags [P.], seq 541612:542986, ack 352, win 65535, length 1374
00:14:33.782408 IP 151.101.117.164.443 > 10.0.2.15.44022: Flags [P.], seq 542986:545734, ack 352, win 65535, length 2748
00:14:33.782414 IP 10.0.2.15.44022 > 151.101.117.164.443: Flags [.], ack 545734, win 65535, length 0
00:14:33.782797 IP 151.101.117.164.443 > 10.0.2.15.44022: Flags [P.], seq 545734:547108, ack 352, win 65535, length 1374
00:14:33.783009 IP 151.101.117.164.443 > 10.0.2.15.44022: Flags [P.], seq 547108:548482, ack 352, win 65535, length 1374
00:14:33.783019 IP 10.0.2.15.44022 > 151.101.117.164.443: Flags [.], ack 548482, win 65535, length 0
00:14:33.783779 IP 151.101.117.164.443 > 10.0.2.15.44022: Flags [P.], seq 548482:552604, ack 352, win 65535, length 4122
00:14:33.783793 IP 10.0.2.15.44022 > 151.101.117.164.443: Flags [.], ack 552604, win 65535, length 0
00:14:33.783885 IP 151.101.117.164.443 > 10.0.2.15.44022: Flags [P.], seq 552604:555352, ack 352, win 65535, length 2748
00:14:33.783891 IP 10.0.2.15.44022 > 151.101.117.164.443: Flags [.], ack 555352, win 65535, length 0
00:14:33.784155 IP 151.101.117.164.443 > 10.0.2.15.44022: Flags [P.], seq 555352:556726, ack 352, win 65535, length 1374
00:14:33.786189 IP 151.101.117.164.443 > 10.0.2.15.44022: Flags [P.], seq 556726:570466, ack 352, win 65535, length 13740
00:14:33.786207 IP 10.0.2.15.44022 > 151.101.117.164.443: Flags [.], ack 570466, win 65535, length 0
00:14:33.786732 IP 151.101.117.164.443 > 10.0.2.15.44022: Flags [P.], seq 570466:573214, ack 352, win 65535, length 2748
00:14:33.786734 IP 151.101.117.164.443 > 10.0.2.15.44022: Flags [P.], seq 573214:575962, ack 352, win 65535, length 2748
00:14:33.786748 IP 10.0.2.15.44022 > 151.101.117.164.443: Flags [.], ack 573214, win 65535, length 0
00:14:33.786807 IP 10.0.2.15.44022 > 151.101.117.164.443: Flags [.], ack 575962, win 65535, length 0
00:14:33.787049 IP 151.101.117.164.443 > 10.0.2.15.44022: Flags [P.], seq 575962:577336, ack 352, win 65535, length 1374
00:14:33.787051 IP 151.101.117.164.443 > 10.0.2.15.44022: Flags [.], seq 577336:580256, ack 352, win 65535, length 2920
00:14:33.787064 IP 10.0.2.15.44022 > 151.101.117.164.443: Flags [.], ack 580256, win 65535, length 0
00:14:33.787308 IP 151.101.117.164.443 > 10.0.2.15.44022: Flags [P.], seq 580256:581458, ack 352, win 65535, length 1202
00:14:33.787309 IP 151.101.117.164.443 > 10.0.2.15.44022: Flags [P.], seq 581458:584206, ack 352, win 65535, length 2748
00:14:33.787321 IP 10.0.2.15.44022 > 151.101.117.164.443: Flags [.], ack 584206, win 65535, length 0
00:14:33.787754 IP 151.101.117.164.443 > 10.0.2.15.44022: Flags [P.], seq 584206:588328, ack 352, win 65535, length 4122
00:14:33.787766 IP 10.0.2.15.44022 > 151.101.117.164.443: Flags [.], ack 588328, win 65535, length 0
00:14:33.788014 IP 151.101.117.164.443 > 10.0.2.15.44022: Flags [P.], seq 588328:592450, ack 352, win 65535, length 4122
00:14:33.788024 IP 10.0.2.15.44022 > 151.101.117.164.443: Flags [.], ack 592450, win 65535, length 0
00:14:33.788392 IP 151.101.117.164.443 > 10.0.2.15.44022: Flags [P.], seq 592450:596572, ack 352, win 65535, length 4122
00:14:33.788401 IP 10.0.2.15.44022 > 151.101.117.164.443: Flags [.], ack 596572, win 65535, length 0
00:14:33.789740 IP 151.101.117.164.443 > 10.0.2.15.44022: Flags [P.], seq 596572:602068, ack 352, win 65535, length 5496
00:14:33.789754 IP 10.0.2.15.44022 > 151.101.117.164.443: Flags [.], ack 602068, win 65535, length 0
00:14:33.790051 IP 151.101.117.164.443 > 10.0.2.15.44022: Flags [P.], seq 602068:606190, ack 352, win 65535, length 4122
00:14:33.790063 IP 10.0.2.15.44022 > 151.101.117.164.443: Flags [.], ack 606190, win 65535, length 0
00:14:33.790353 IP 151.101.117.164.443 > 10.0.2.15.44022: Flags [P.], seq 606190:607564, ack 352, win 65535, length 1374
00:14:33.790506 IP 151.101.117.164.443 > 10.0.2.15.44022: Flags [P.], seq 607564:611686, ack 352, win 65535, length 4122
00:14:33.790514 IP 10.0.2.15.44022 > 151.101.117.164.443: Flags [.], ack 611686, win 65535, length 0
00:14:33.791457 IP 151.101.117.164.443 > 10.0.2.15.44022: Flags [P.], seq 611686:615808, ack 352, win 65535, length 4122
00:14:33.791459 IP 151.101.117.164.443 > 10.0.2.15.44022: Flags [P.], seq 615808:618556, ack 352, win 65535, length 2748
00:14:33.791475 IP 10.0.2.15.44022 > 151.101.117.164.443: Flags [.], ack 615808, win 65535, length 0
00:14:33.791503 IP 10.0.2.15.44022 > 151.101.117.164.443: Flags [.], ack 618556, win 65535, length 0
00:14:33.791729 IP 151.101.117.164.443 > 10.0.2.15.44022: Flags [P.], seq 618556:619930, ack 352, win 65535, length 1374
00:14:33.791916 IP 151.101.117.164.443 > 10.0.2.15.44022: Flags [P.], seq 619930:624052, ack 352, win 65535, length 4122
00:14:33.791924 IP 10.0.2.15.44022 > 151.101.117.164.443: Flags [.], ack 624052, win 65535, length 0
00:14:33.792231 IP 151.101.117.164.443 > 10.0.2.15.44022: Flags [P.], seq 624052:626800, ack 352, win 65535, length 2748
00:14:33.792232 IP 151.101.117.164.443 > 10.0.2.15.44022: Flags [P.], seq 626800:629548, ack 352, win 65535, length 2748
00:14:33.792243 IP 10.0.2.15.44022 > 151.101.117.164.443: Flags [.], ack 626800, win 65535, length 0
00:14:33.792266 IP 10.0.2.15.44022 > 151.101.117.164.443: Flags [.], ack 629548, win 65535, length 0
00:14:33.792541 IP 151.101.117.164.443 > 10.0.2.15.44022: Flags [.], seq 629548:631008, ack 352, win 65535, length 1460
00:14:33.793238 IP 151.101.117.164.443 > 10.0.2.15.44022: Flags [P.], seq 631008:632296, ack 352, win 65535, length 1288
00:14:33.793240 IP 151.101.117.164.443 > 10.0.2.15.44022: Flags [P.], seq 632296:636418, ack 352, win 65535, length 4122
00:14:33.793240 IP 151.101.117.164.443 > 10.0.2.15.44022: Flags [P.], seq 636418:637792, ack 352, win 65535, length 1374
00:14:33.793259 IP 10.0.2.15.44022 > 151.101.117.164.443: Flags [.], ack 632296, win 65535, length 0
00:14:33.793361 IP 10.0.2.15.44022 > 151.101.117.164.443: Flags [.], ack 636418, win 65535, length 0
00:14:33.799910 IP 151.101.117.164.443 > 10.0.2.15.44022: Flags [P.], seq 637792:646036, ack 352, win 65535, length 8244
00:14:33.799914 IP 151.101.117.164.443 > 10.0.2.15.44022: Flags [P.], seq 646036:650158, ack 352, win 65535, length 4122
00:14:33.799945 IP 10.0.2.15.44022 > 151.101.117.164.443: Flags [.], ack 646036, win 65535, length 0
00:14:33.800062 IP 10.0.2.15.44022 > 151.101.117.164.443: Flags [.], ack 650158, win 65535, length 0
00:14:33.800106 IP 151.101.117.164.443 > 10.0.2.15.44022: Flags [P.], seq 650158:652906, ack 352, win 65535, length 2748
00:14:33.800113 IP 10.0.2.15.44022 > 151.101.117.164.443: Flags [.], ack 652906, win 65535, length 0
00:14:33.800259 IP 151.101.117.164.443 > 10.0.2.15.44022: Flags [P.], seq 652906:657028, ack 352, win 65535, length 4122
00:14:33.800267 IP 10.0.2.15.44022 > 151.101.117.164.443: Flags [.], ack 657028, win 65535, length 0
00:14:33.801901 IP 151.101.117.164.443 > 10.0.2.15.44022: Flags [P.], seq 657028:661150, ack 352, win 65535, length 4122
00:14:33.802001 IP 151.101.117.164.443 > 10.0.2.15.44022: Flags [P.], seq 661150:665272, ack 352, win 65535, length 4122
00:14:33.802022 IP 10.0.2.15.44022 > 151.101.117.164.443: Flags [.], ack 661150, win 65535, length 0
00:14:33.802056 IP 10.0.2.15.44022 > 151.101.117.164.443: Flags [.], ack 665272, win 65535, length 0
00:14:33.802280 IP 151.101.117.164.443 > 10.0.2.15.44022: Flags [P.], seq 665272:668020, ack 352, win 65535, length 2748
00:14:33.802281 IP 151.101.117.164.443 > 10.0.2.15.44022: Flags [P.], seq 668020:669394, ack 352, win 65535, length 1374
00:14:33.802290 IP 10.0.2.15.44022 > 151.101.117.164.443: Flags [.], ack 668020, win 65535, length 0
00:14:33.803663 IP 151.101.117.164.443 > 10.0.2.15.44022: Flags [P.], seq 669394:673516, ack 352, win 65535, length 4122
00:14:33.803665 IP 151.101.117.164.443 > 10.0.2.15.44022: Flags [P.], seq 673516:679012, ack 352, win 65535, length 5496
00:14:33.803682 IP 10.0.2.15.44022 > 151.101.117.164.443: Flags [.], ack 673516, win 65535, length 0
00:14:33.803714 IP 10.0.2.15.44022 > 151.101.117.164.443: Flags [.], ack 679012, win 65535, length 0
00:14:33.804092 IP 151.101.117.164.443 > 10.0.2.15.44022: Flags [P.], seq 679012:680386, ack 352, win 65535, length 1374
00:14:33.804096 IP 151.101.117.164.443 > 10.0.2.15.44022: Flags [P.], seq 680386:684508, ack 352, win 65535, length 4122
00:14:33.804114 IP 10.0.2.15.44022 > 151.101.117.164.443: Flags [.], ack 684508, win 65535, length 0
00:14:33.804253 IP 151.101.117.164.443 > 10.0.2.15.44022: Flags [P.], seq 684508:685882, ack 352, win 65535, length 1374
00:14:33.804255 IP 151.101.117.164.443 > 10.0.2.15.44022: Flags [P.], seq 685882:687256, ack 352, win 65535, length 1374
00:14:33.804268 IP 10.0.2.15.44022 > 151.101.117.164.443: Flags [.], ack 687256, win 65535, length 0
00:14:33.804435 IP 151.101.117.164.443 > 10.0.2.15.44022: Flags [P.], seq 687256:690004, ack 352, win 65535, length 2748
00:14:33.804443 IP 10.0.2.15.44022 > 151.101.117.164.443: Flags [.], ack 690004, win 65535, length 0
00:14:33.804567 IP 151.101.117.164.443 > 10.0.2.15.44022: Flags [P.], seq 690004:691378, ack 352, win 65535, length 1374
00:14:33.804701 IP 151.101.117.164.443 > 10.0.2.15.44022: Flags [P.], seq 691378:694126, ack 352, win 65535, length 2748
00:14:33.804716 IP 10.0.2.15.44022 > 151.101.117.164.443: Flags [.], ack 694126, win 65535, length 0
00:14:33.806095 IP 151.101.117.164.443 > 10.0.2.15.44022: Flags [P.], seq 694126:698248, ack 352, win 65535, length 4122
00:14:33.806097 IP 151.101.117.164.443 > 10.0.2.15.44022: Flags [P.], seq 698248:700996, ack 352, win 65535, length 2748
00:14:33.806114 IP 10.0.2.15.44022 > 151.101.117.164.443: Flags [.], ack 698248, win 65535, length 0
00:14:33.806141 IP 10.0.2.15.44022 > 151.101.117.164.443: Flags [.], ack 700996, win 65535, length 0
00:14:33.806259 IP 151.101.117.164.443 > 10.0.2.15.44022: Flags [P.], seq 700996:702370, ack 352, win 65535, length 1374
00:14:33.806612 IP 151.101.117.164.443 > 10.0.2.15.44022: Flags [P.], seq 702370:707866, ack 352, win 65535, length 5496
00:14:33.806625 IP 10.0.2.15.44022 > 151.101.117.164.443: Flags [.], ack 707866, win 65535, length 0
00:14:33.806733 IP 151.101.117.164.443 > 10.0.2.15.44022: Flags [P.], seq 707866:709240, ack 352, win 65535, length 1374
00:14:33.806889 IP 151.101.117.164.443 > 10.0.2.15.44022: Flags [P.], seq 709240:711988, ack 352, win 65535, length 2748
00:14:33.806941 IP 10.0.2.15.44022 > 151.101.117.164.443: Flags [.], ack 711988, win 65535, length 0
00:14:33.807167 IP 151.101.117.164.443 > 10.0.2.15.44022: Flags [P.], seq 711988:713362, ack 352, win 65535, length 1374
00:14:33.807897 IP 151.101.117.164.443 > 10.0.2.15.44022: Flags [P.], seq 713362:716110, ack 352, win 65535, length 2748
00:14:33.807898 IP 151.101.117.164.443 > 10.0.2.15.44022: Flags [P.], seq 716110:718858, ack 352, win 65535, length 2748
00:14:33.807914 IP 10.0.2.15.44022 > 151.101.117.164.443: Flags [.], ack 716110, win 65535, length 0
00:14:33.808075 IP 151.101.117.164.443 > 10.0.2.15.44022: Flags [P.], seq 718858:720232, ack 352, win 65535, length 1374
00:14:33.808127 IP 10.0.2.15.44022 > 151.101.117.164.443: Flags [.], ack 720232, win 65535, length 0
00:14:33.808322 IP 151.101.117.164.443 > 10.0.2.15.44022: Flags [P.], seq 720232:722980, ack 352, win 65535, length 2748
00:14:33.808727 IP 151.101.117.164.443 > 10.0.2.15.44022: Flags [P.], seq 722980:727102, ack 352, win 65535, length 4122
00:14:33.808730 IP 151.101.117.164.443 > 10.0.2.15.44022: Flags [P.], seq 727102:731224, ack 352, win 65535, length 4122
00:14:33.808962 IP 151.101.117.164.443 > 10.0.2.15.44022: Flags [P.], seq 731224:733972, ack 352, win 65535, length 2748
00:14:33.809344 IP 151.101.117.164.443 > 10.0.2.15.44022: Flags [P.], seq 733972:736720, ack 352, win 65535, length 2748
00:14:33.809620 IP 151.101.117.164.443 > 10.0.2.15.44022: Flags [P.], seq 736720:738094, ack 352, win 65535, length 1374
00:14:33.810003 IP 10.0.2.15.44022 > 151.101.117.164.443: Flags [.], ack 738094, win 65535, length 0
00:14:33.810387 IP 151.101.117.164.443 > 10.0.2.15.44022: Flags [P.], seq 738094:740842, ack 352, win 65535, length 2748
00:14:33.810858 IP 10.0.2.15.44022 > 151.101.117.164.443: Flags [.], ack 740842, win 65535, length 0
00:14:33.811139 IP 151.101.117.164.443 > 10.0.2.15.44022: Flags [P.], seq 740842:746338, ack 352, win 65535, length 5496
00:14:33.811140 IP 151.101.117.164.443 > 10.0.2.15.44022: Flags [P.], seq 746338:749086, ack 352, win 65535, length 2748
00:14:33.811361 IP 151.101.117.164.443 > 10.0.2.15.44022: Flags [P.], seq 749086:753208, ack 352, win 65535, length 4122
00:14:33.811946 IP 151.101.117.164.443 > 10.0.2.15.44022: Flags [P.], seq 753208:755956, ack 352, win 65535, length 2748
00:14:33.811947 IP 151.101.117.164.443 > 10.0.2.15.44022: Flags [P.], seq 755956:758704, ack 352, win 65535, length 2748
00:14:33.812174 IP 151.101.117.164.443 > 10.0.2.15.44022: Flags [P.], seq 758704:761452, ack 352, win 65535, length 2748
00:14:33.812331 IP 151.101.117.164.443 > 10.0.2.15.44022: Flags [P.], seq 761452:765574, ack 352, win 65535, length 4122
00:14:33.812384 IP 10.0.2.15.44022 > 151.101.117.164.443: Flags [.], ack 765574, win 65535, length 0
00:14:33.812632 IP 151.101.117.164.443 > 10.0.2.15.44022: Flags [P.], seq 765574:768322, ack 352, win 65535, length 2748
00:14:33.812640 IP 10.0.2.15.44022 > 151.101.117.164.443: Flags [.], ack 768322, win 65535, length 0
00:14:33.812876 IP 151.101.117.164.443 > 10.0.2.15.44022: Flags [P.], seq 768322:769696, ack 352, win 65535, length 1374
00:14:33.813565 IP 151.101.117.164.443 > 10.0.2.15.44022: Flags [P.], seq 769696:773818, ack 352, win 65535, length 4122
00:14:33.813567 IP 151.101.117.164.443 > 10.0.2.15.44022: Flags [P.], seq 773818:776566, ack 352, win 65535, length 2748
00:14:33.813657 IP 10.0.2.15.44022 > 151.101.117.164.443: Flags [.], ack 773818, win 65535, length 0
00:14:33.813792 IP 151.101.117.164.443 > 10.0.2.15.44022: Flags [P.], seq 776566:777940, ack 352, win 65535, length 1374
00:14:33.813845 IP 10.0.2.15.44022 > 151.101.117.164.443: Flags [.], ack 777940, win 65535, length 0
00:14:33.814009 IP 151.101.117.164.443 > 10.0.2.15.44022: Flags [P.], seq 777940:780688, ack 352, win 65535, length 2748
00:14:33.814042 IP 10.0.2.15.44022 > 151.101.117.164.443: Flags [.], ack 780688, win 65535, length 0
00:14:33.814165 IP 151.101.117.164.443 > 10.0.2.15.44022: Flags [P.], seq 780688:784810, ack 352, win 65535, length 4122
00:14:33.814201 IP 10.0.2.15.44022 > 151.101.117.164.443: Flags [.], ack 784810, win 65535, length 0
00:14:33.814633 IP 151.101.117.164.443 > 10.0.2.15.44022: Flags [P.], seq 784810:787558, ack 352, win 65535, length 2748
00:14:33.814690 IP 10.0.2.15.44022 > 151.101.117.164.443: Flags [.], ack 787558, win 65535, length 0
00:14:33.815408 IP 151.101.117.164.443 > 10.0.2.15.44022: Flags [P.], seq 787558:790306, ack 352, win 65535, length 2748
00:14:33.815422 IP 10.0.2.15.44022 > 151.101.117.164.443: Flags [.], ack 790306, win 65535, length 0
00:14:33.815607 IP 151.101.117.164.443 > 10.0.2.15.44022: Flags [P.], seq 790306:795802, ack 352, win 65535, length 5496
00:14:33.815638 IP 10.0.2.15.44022 > 151.101.117.164.443: Flags [.], ack 795802, win 65535, length 0
00:14:33.817134 IP 151.101.117.164.443 > 10.0.2.15.44022: Flags [P.], seq 795802:801298, ack 352, win 65535, length 5496
00:14:33.817282 IP 151.101.117.164.443 > 10.0.2.15.44022: Flags [P.], seq 801298:805420, ack 352, win 65535, length 4122
00:14:33.817343 IP 151.101.117.164.443 > 10.0.2.15.44022: Flags [P.], seq 805420:809542, ack 352, win 65535, length 4122
00:14:33.817412 IP 10.0.2.15.44022 > 151.101.117.164.443: Flags [.], ack 809542, win 65535, length 0
00:14:33.818046 IP 151.101.117.164.443 > 10.0.2.15.44022: Flags [P.], seq 809542:810916, ack 352, win 65535, length 1374
00:14:33.818048 IP 151.101.117.164.443 > 10.0.2.15.44022: Flags [P.], seq 810916:813664, ack 352, win 65535, length 2748
00:14:33.818074 IP 10.0.2.15.44022 > 151.101.117.164.443: Flags [.], ack 813664, win 65535, length 0
00:14:33.818479 IP 151.101.117.164.443 > 10.0.2.15.44022: Flags [P.], seq 813664:819160, ack 352, win 65535, length 5496
00:14:33.818480 IP 151.101.117.164.443 > 10.0.2.15.44022: Flags [P.], seq 819160:820534, ack 352, win 65535, length 1374
00:14:33.818481 IP 151.101.117.164.443 > 10.0.2.15.44022: Flags [P.], seq 820534:824656, ack 352, win 65535, length 4122
00:14:33.818641 IP 10.0.2.15.44022 > 151.101.117.164.443: Flags [.], ack 824656, win 65535, length 0
00:14:33.818806 IP 151.101.117.164.443 > 10.0.2.15.44022: Flags [P.], seq 824656:827404, ack 352, win 65535, length 2748
00:14:33.818944 IP 151.101.117.164.443 > 10.0.2.15.44022: Flags [P.], seq 827404:830152, ack 352, win 65535, length 2748
00:14:33.819181 IP 151.101.117.164.443 > 10.0.2.15.44022: Flags [P.], seq 830152:831526, ack 352, win 65535, length 1374
00:14:33.819245 IP 10.0.2.15.44022 > 151.101.117.164.443: Flags [.], ack 831526, win 65535, length 0
00:14:33.819413 IP 151.101.117.164.443 > 10.0.2.15.44022: Flags [P.], seq 831526:834274, ack 352, win 65535, length 2748
00:14:33.819414 IP 151.101.117.164.443 > 10.0.2.15.44022: Flags [P.], seq 834274:837022, ack 352, win 65535, length 2748
00:14:33.819537 IP 10.0.2.15.44022 > 151.101.117.164.443: Flags [.], ack 837022, win 65535, length 0
00:14:33.819705 IP 151.101.117.164.443 > 10.0.2.15.44022: Flags [P.], seq 837022:839770, ack 352, win 65535, length 2748
00:14:33.819714 IP 10.0.2.15.44022 > 151.101.117.164.443: Flags [.], ack 839770, win 65535, length 0
00:14:33.819896 IP 151.101.117.164.443 > 10.0.2.15.44022: Flags [P.], seq 839770:842518, ack 352, win 65535, length 2748
00:14:33.819919 IP 10.0.2.15.44022 > 151.101.117.164.443: Flags [.], ack 842518, win 65535, length 0
00:14:33.820700 IP 151.101.117.164.443 > 10.0.2.15.44022: Flags [P.], seq 842518:843892, ack 352, win 65535, length 1374
00:14:33.821662 IP 151.101.117.164.443 > 10.0.2.15.44022: Flags [P.], seq 843892:848014, ack 352, win 65535, length 4122
00:14:33.821665 IP 151.101.117.164.443 > 10.0.2.15.44022: Flags [P.], seq 848014:850762, ack 352, win 65535, length 2748
00:14:33.821766 IP 151.101.117.164.443 > 10.0.2.15.44022: Flags [P.], seq 850762:852136, ack 352, win 65535, length 1374
00:14:33.821828 IP 151.101.117.164.443 > 10.0.2.15.44022: Flags [P.], seq 852136:854884, ack 352, win 65535, length 2748
00:14:33.821922 IP 10.0.2.15.44022 > 151.101.117.164.443: Flags [.], ack 854884, win 65535, length 0
00:14:33.822089 IP 151.101.117.164.443 > 10.0.2.15.44022: Flags [P.], seq 854884:856258, ack 352, win 65535, length 1374
00:14:33.822313 IP 151.101.117.164.443 > 10.0.2.15.44022: Flags [P.], seq 856258:859006, ack 352, win 65535, length 2748
00:14:33.822315 IP 151.101.117.164.443 > 10.0.2.15.44022: Flags [P.], seq 859006:860380, ack 352, win 65535, length 1374
00:14:33.822329 IP 10.0.2.15.44022 > 151.101.117.164.443: Flags [.], ack 859006, win 65535, length 0
00:14:33.822594 IP 151.101.117.164.443 > 10.0.2.15.44022: Flags [P.], seq 860380:863128, ack 352, win 65535, length 2748
00:14:33.822627 IP 10.0.2.15.44022 > 151.101.117.164.443: Flags [.], ack 863128, win 65535, length 0
00:14:33.822907 IP 151.101.117.164.443 > 10.0.2.15.44022: Flags [P.], seq 863128:864502, ack 352, win 65535, length 1374
00:14:33.822910 IP 151.101.117.164.443 > 10.0.2.15.44022: Flags [P.], seq 864502:868624, ack 352, win 65535, length 4122
00:14:33.823051 IP 151.101.117.164.443 > 10.0.2.15.44022: Flags [P.], seq 868624:869998, ack 352, win 65535, length 1374
00:14:33.823068 IP 10.0.2.15.44022 > 151.101.117.164.443: Flags [.], ack 868624, win 65535, length 0
00:14:33.823917 IP 151.101.117.164.443 > 10.0.2.15.44022: Flags [P.], seq 869998:874120, ack 352, win 65535, length 4122
00:14:33.823932 IP 10.0.2.15.44022 > 151.101.117.164.443: Flags [.], ack 874120, win 65535, length 0
00:14:33.824265 IP 151.101.117.164.443 > 10.0.2.15.44022: Flags [P.], seq 874120:879616, ack 352, win 65535, length 5496
00:14:33.824266 IP 151.101.117.164.443 > 10.0.2.15.44022: Flags [P.], seq 879616:880990, ack 352, win 65535, length 1374
00:14:33.824328 IP 10.0.2.15.44022 > 151.101.117.164.443: Flags [.], ack 880990, win 65535, length 0
00:14:33.824784 IP 151.101.117.164.443 > 10.0.2.15.44022: Flags [P.], seq 880990:883738, ack 352, win 65535, length 2748
00:14:33.824887 IP 151.101.117.164.443 > 10.0.2.15.44022: Flags [P.], seq 883738:889234, ack 352, win 65535, length 5496
00:14:33.824975 IP 10.0.2.15.44022 > 151.101.117.164.443: Flags [.], ack 889234, win 65535, length 0
00:14:33.825101 IP 151.101.117.164.443 > 10.0.2.15.44022: Flags [P.], seq 889234:890608, ack 352, win 65535, length 1374
00:14:33.826398 IP 151.101.117.164.443 > 10.0.2.15.44022: Flags [P.], seq 890608:894730, ack 352, win 65535, length 4122
00:14:33.826400 IP 151.101.117.164.443 > 10.0.2.15.44022: Flags [.], seq 894730:896190, ack 352, win 65535, length 1460
00:14:33.826419 IP 10.0.2.15.44022 > 151.101.117.164.443: Flags [.], ack 894730, win 65535, length 0
00:14:33.826737 IP 151.101.117.164.443 > 10.0.2.15.44022: Flags [P.], seq 896190:900226, ack 352, win 65535, length 4036
00:14:33.826738 IP 151.101.117.164.443 > 10.0.2.15.44022: Flags [P.], seq 900226:901600, ack 352, win 65535, length 1374
00:14:33.826739 IP 151.101.117.164.443 > 10.0.2.15.44022: Flags [P.], seq 901600:904348, ack 352, win 65535, length 2748
00:14:33.826780 IP 10.0.2.15.44022 > 151.101.117.164.443: Flags [.], ack 904348, win 65535, length 0
00:14:33.826989 IP 151.101.117.164.443 > 10.0.2.15.44022: Flags [P.], seq 904348:908470, ack 352, win 65535, length 4122
00:14:33.827044 IP 10.0.2.15.44022 > 151.101.117.164.443: Flags [.], ack 908470, win 65535, length 0
00:14:33.827737 IP 151.101.117.164.443 > 10.0.2.15.44022: Flags [P.], seq 908470:911218, ack 352, win 65535, length 2748
00:14:33.827792 IP 10.0.2.15.44022 > 151.101.117.164.443: Flags [.], ack 911218, win 65535, length 0
00:14:33.827888 IP 151.101.117.164.443 > 10.0.2.15.44022: Flags [P.], seq 911218:915340, ack 352, win 65535, length 4122
00:14:33.827889 IP 151.101.117.164.443 > 10.0.2.15.44022: Flags [P.], seq 915340:916714, ack 352, win 65535, length 1374
00:14:33.828190 IP 151.101.117.164.443 > 10.0.2.15.44022: Flags [P.], seq 916714:922210, ack 352, win 65535, length 5496
00:14:33.828282 IP 10.0.2.15.44022 > 151.101.117.164.443: Flags [.], ack 916714, win 65535, length 0
00:14:33.828503 IP 151.101.117.164.443 > 10.0.2.15.44022: Flags [P.], seq 922210:924958, ack 352, win 65535, length 2748
00:14:33.828505 IP 151.101.117.164.443 > 10.0.2.15.44022: Flags [P.], seq 924958:927706, ack 352, win 65535, length 2748
00:14:33.828542 IP 10.0.2.15.44022 > 151.101.117.164.443: Flags [.], ack 927706, win 65535, length 0
00:14:33.828818 IP 151.101.117.164.443 > 10.0.2.15.44022: Flags [P.], seq 927706:930454, ack 352, win 65535, length 2748
00:14:33.828827 IP 10.0.2.15.44022 > 151.101.117.164.443: Flags [.], ack 930454, win 65535, length 0
00:14:33.828987 IP 151.101.117.164.443 > 10.0.2.15.44022: Flags [P.], seq 930454:933202, ack 352, win 65535, length 2748
00:14:33.829096 IP 10.0.2.15.44022 > 151.101.117.164.443: Flags [.], ack 933202, win 65535, length 0
00:14:33.829263 IP 151.101.117.164.443 > 10.0.2.15.44022: Flags [P.], seq 933202:937324, ack 352, win 65535, length 4122
00:14:33.829482 IP 151.101.117.164.443 > 10.0.2.15.44022: Flags [P.], seq 937324:940072, ack 352, win 65535, length 2748
00:14:33.829527 IP 10.0.2.15.44022 > 151.101.117.164.443: Flags [.], ack 940072, win 65535, length 0
00:14:33.830361 IP 151.101.117.164.443 > 10.0.2.15.44022: Flags [P.], seq 940072:944194, ack 352, win 65535, length 4122
00:14:33.830363 IP 151.101.117.164.443 > 10.0.2.15.44022: Flags [P.], seq 944194:945568, ack 352, win 65535, length 1374
00:14:33.830379 IP 10.0.2.15.44022 > 151.101.117.164.443: Flags [.], ack 944194, win 65535, length 0
00:14:33.830941 IP 151.101.117.164.443 > 10.0.2.15.44022: Flags [P.], seq 945568:949690, ack 352, win 65535, length 4122
00:14:33.830943 IP 151.101.117.164.443 > 10.0.2.15.44022: Flags [P.], seq 949690:952438, ack 352, win 65535, length 2748
00:14:33.830959 IP 10.0.2.15.44022 > 151.101.117.164.443: Flags [.], ack 949690, win 65535, length 0
00:14:33.831204 IP 10.0.2.15.44022 > 151.101.117.164.443: Flags [.], ack 952438, win 65535, length 0
00:14:33.831326 IP 151.101.117.164.443 > 10.0.2.15.44022: Flags [P.], seq 952438:955186, ack 352, win 65535, length 2748
00:14:33.831327 IP 151.101.117.164.443 > 10.0.2.15.44022: Flags [P.], seq 955186:956560, ack 352, win 65535, length 1374
00:14:33.831346 IP 10.0.2.15.44022 > 151.101.117.164.443: Flags [.], ack 956560, win 65535, length 0
00:14:33.833860 IP 151.101.117.164.443 > 10.0.2.15.44022: Flags [P.], seq 956560:962056, ack 352, win 65535, length 5496
00:14:33.833938 IP 151.101.117.164.443 > 10.0.2.15.44022: Flags [P.], seq 962056:966178, ack 352, win 65535, length 4122
00:14:33.833940 IP 151.101.117.164.443 > 10.0.2.15.44022: Flags [P.], seq 966178:967552, ack 352, win 65535, length 1374
00:14:33.833966 IP 10.0.2.15.44022 > 151.101.117.164.443: Flags [.], ack 962056, win 65535, length 0
00:14:33.834027 IP 151.101.117.164.443 > 10.0.2.15.44022: Flags [P.], seq 967552:968926, ack 352, win 65535, length 1374
00:14:33.834495 IP 10.0.2.15.44022 > 151.101.117.164.443: Flags [.], ack 968926, win 65535, length 0
00:14:33.835377 IP 151.101.117.164.443 > 10.0.2.15.44022: Flags [P.], seq 968926:973048, ack 352, win 65535, length 4122
00:14:33.835515 IP 151.101.117.164.443 > 10.0.2.15.44022: Flags [P.], seq 973048:975796, ack 352, win 65535, length 2748
00:14:33.835758 IP 151.101.117.164.443 > 10.0.2.15.44022: Flags [P.], seq 975796:978544, ack 352, win 65535, length 2748
00:14:33.836131 IP 151.101.117.164.443 > 10.0.2.15.44022: Flags [P.], seq 978544:981292, ack 352, win 65535, length 2748
00:14:33.836488 IP 151.101.117.164.443 > 10.0.2.15.44022: Flags [P.], seq 981292:986788, ack 352, win 65535, length 5496
00:14:33.836489 IP 151.101.117.164.443 > 10.0.2.15.44022: Flags [P.], seq 986788:988162, ack 352, win 65535, length 1374
00:14:33.836605 IP 151.101.117.164.443 > 10.0.2.15.44022: Flags [P.], seq 988162:990910, ack 352, win 65535, length 2748
00:14:33.836756 IP 151.101.117.164.443 > 10.0.2.15.44022: Flags [P.], seq 990910:992284, ack 352, win 65535, length 1374
00:14:33.836944 IP 151.101.117.164.443 > 10.0.2.15.44022: Flags [P.], seq 992284:995032, ack 352, win 65535, length 2748
00:14:33.837109 IP 10.0.2.15.44022 > 151.101.117.164.443: Flags [.], ack 995032, win 65535, length 0
00:14:33.837889 IP 151.101.117.164.443 > 10.0.2.15.44022: Flags [P.], seq 995032:1000528, ack 352, win 65535, length 5496
00:14:33.837939 IP 10.0.2.15.44022 > 151.101.117.164.443: Flags [.], ack 1000528, win 65535, length 0
00:14:33.838041 IP 151.101.117.164.443 > 10.0.2.15.44022: Flags [P.], seq 1000528:1001902, ack 352, win 65535, length 1374
00:14:33.838161 IP 151.101.117.164.443 > 10.0.2.15.44022: Flags [P.], seq 1001902:1004650, ack 352, win 65535, length 2748
00:14:33.838212 IP 10.0.2.15.44022 > 151.101.117.164.443: Flags [.], ack 1004650, win 65535, length 0
00:14:33.838408 IP 151.101.117.164.443 > 10.0.2.15.44022: Flags [P.], seq 1004650:1006024, ack 352, win 65535, length 1374
00:14:33.838651 IP 151.101.117.164.443 > 10.0.2.15.44022: Flags [P.], seq 1006024:1010146, ack 352, win 65535, length 4122
00:14:33.838760 IP 151.101.117.164.443 > 10.0.2.15.44022: Flags [P.], seq 1010146:1011520, ack 352, win 65535, length 1374
00:14:33.838971 IP 151.101.117.164.443 > 10.0.2.15.44022: Flags [P.], seq 1011520:1014268, ack 352, win 65535, length 2748
00:14:33.838989 IP 10.0.2.15.44022 > 151.101.117.164.443: Flags [.], ack 1014268, win 65535, length 0
00:14:33.839294 IP 151.101.117.164.443 > 10.0.2.15.44022: Flags [P.], seq 1014268:1015642, ack 352, win 65535, length 1374
00:14:33.840113 IP 151.101.117.164.443 > 10.0.2.15.44022: Flags [P.], seq 1015642:1021138, ack 352, win 65535, length 5496
00:14:33.840133 IP 10.0.2.15.44022 > 151.101.117.164.443: Flags [.], ack 1021138, win 65535, length 0
00:14:33.841255 IP 151.101.117.164.443 > 10.0.2.15.44022: Flags [P.], seq 1021138:1026634, ack 352, win 65535, length 5496
00:14:33.841285 IP 10.0.2.15.44022 > 151.101.117.164.443: Flags [.], ack 1026634, win 65535, length 0
00:14:33.841635 IP 151.101.117.164.443 > 10.0.2.15.44022: Flags [P.], seq 1026634:1029382, ack 352, win 65535, length 2748
00:14:33.841658 IP 10.0.2.15.44022 > 151.101.117.164.443: Flags [.], ack 1029382, win 65535, length 0
00:14:33.842046 IP 151.101.117.164.443 > 10.0.2.15.44022: Flags [P.], seq 1029382:1033504, ack 352, win 65535, length 4122
00:14:33.842061 IP 10.0.2.15.44022 > 151.101.117.164.443: Flags [.], ack 1033504, win 65535, length 0
00:14:33.842184 IP 151.101.117.164.443 > 10.0.2.15.44022: Flags [P.], seq 1033504:1041748, ack 352, win 65535, length 8244
00:14:33.842238 IP 10.0.2.15.44022 > 151.101.117.164.443: Flags [.], ack 1041748, win 65535, length 0
00:14:33.842757 IP 151.101.117.164.443 > 10.0.2.15.44022: Flags [P.], seq 1041748:1044496, ack 352, win 65535, length 2748
00:14:33.842775 IP 10.0.2.15.44022 > 151.101.117.164.443: Flags [.], ack 1044496, win 65535, length 0
00:14:33.843148 IP 151.101.117.164.443 > 10.0.2.15.44022: Flags [P.], seq 1044496:1049992, ack 352, win 65535, length 5496
00:14:33.843150 IP 151.101.117.164.443 > 10.0.2.15.44022: Flags [P.], seq 1049992:1051366, ack 352, win 65535, length 1374
00:14:33.843212 IP 10.0.2.15.44022 > 151.101.117.164.443: Flags [.], ack 1051366, win 65535, length 0
00:14:33.843418 IP 151.101.117.164.443 > 10.0.2.15.44022: Flags [P.], seq 1051366:1055488, ack 352, win 65535, length 4122
00:14:33.843485 IP 10.0.2.15.44022 > 151.101.117.164.443: Flags [.], ack 1055488, win 65535, length 0
00:14:33.843941 IP 151.101.117.164.443 > 10.0.2.15.44022: Flags [P.], seq 1055488:1063732, ack 352, win 65535, length 8244
00:14:33.843996 IP 10.0.2.15.44022 > 151.101.117.164.443: Flags [.], ack 1063732, win 65535, length 0
00:14:33.844149 IP 151.101.117.164.443 > 10.0.2.15.44022: Flags [P.], seq 1063732:1065106, ack 352, win 65535, length 1374
00:14:33.845277 IP 151.101.117.164.443 > 10.0.2.15.44022: Flags [P.], seq 1065106:1069228, ack 352, win 65535, length 4122
00:14:33.845279 IP 151.101.117.164.443 > 10.0.2.15.44022: Flags [P.], seq 1069228:1071976, ack 352, win 65535, length 2748
00:14:33.845295 IP 10.0.2.15.44022 > 151.101.117.164.443: Flags [.], ack 1069228, win 65535, length 0
00:14:33.845565 IP 151.101.117.164.443 > 10.0.2.15.44022: Flags [P.], seq 1071976:1076098, ack 352, win 65535, length 4122
00:14:33.845567 IP 151.101.117.164.443 > 10.0.2.15.44022: Flags [.], seq 1076098:1077558, ack 352, win 65535, length 1460
00:14:33.845747 IP 151.101.117.164.443 > 10.0.2.15.44022: Flags [P.], seq 1077558:1078846, ack 352, win 65535, length 1288
00:14:33.845748 IP 151.101.117.164.443 > 10.0.2.15.44022: Flags [P.], seq 1078846:1081594, ack 352, win 65535, length 2748
00:14:33.845765 IP 10.0.2.15.44022 > 151.101.117.164.443: Flags [.], ack 1077558, win 65535, length 0
00:14:33.845852 IP 151.101.117.164.443 > 10.0.2.15.44022: Flags [P.], seq 1081594:1082968, ack 352, win 65535, length 1374
00:14:33.845910 IP 10.0.2.15.44022 > 151.101.117.164.443: Flags [.], ack 1082968, win 65535, length 0
00:14:33.846139 IP 151.101.117.164.443 > 10.0.2.15.44022: Flags [P.], seq 1082968:1085716, ack 352, win 65535, length 2748
00:14:33.846280 IP 151.101.117.164.443 > 10.0.2.15.44022: Flags [P.], seq 1085716:1087090, ack 352, win 65535, length 1374
00:14:33.846319 IP 10.0.2.15.44022 > 151.101.117.164.443: Flags [.], ack 1087090, win 65535, length 0
00:14:33.846548 IP 151.101.117.164.443 > 10.0.2.15.44022: Flags [P.], seq 1087090:1088464, ack 352, win 65535, length 1374
00:14:33.847326 IP 151.101.117.164.443 > 10.0.2.15.44022: Flags [P.], seq 1088464:1092586, ack 352, win 65535, length 4122
00:14:33.847328 IP 151.101.117.164.443 > 10.0.2.15.44022: Flags [P.], seq 1092586:1095334, ack 352, win 65535, length 2748
00:14:33.847341 IP 10.0.2.15.44022 > 151.101.117.164.443: Flags [.], ack 1092586, win 65535, length 0
00:14:33.847764 IP 151.101.117.164.443 > 10.0.2.15.44022: Flags [P.], seq 1095334:1099456, ack 352, win 65535, length 4122
00:14:33.847766 IP 151.101.117.164.443 > 10.0.2.15.44022: Flags [P.], seq 1099456:1102204, ack 352, win 65535, length 2748
00:14:33.847830 IP 10.0.2.15.44022 > 151.101.117.164.443: Flags [.], ack 1102204, win 65535, length 0
00:14:33.847919 IP 151.101.117.164.443 > 10.0.2.15.44022: Flags [P.], seq 1102204:1103578, ack 352, win 65535, length 1374
00:14:33.848148 IP 151.101.117.164.443 > 10.0.2.15.44022: Flags [P.], seq 1103578:1106326, ack 352, win 65535, length 2748
00:14:33.848150 IP 151.101.117.164.443 > 10.0.2.15.44022: Flags [P.], seq 1106326:1107700, ack 352, win 65535, length 1374
00:14:33.848262 IP 10.0.2.15.44022 > 151.101.117.164.443: Flags [.], ack 1107700, win 65535, length 0
00:14:33.848498 IP 151.101.117.164.443 > 10.0.2.15.44022: Flags [P.], seq 1107700:1110448, ack 352, win 65535, length 2748
00:14:33.848658 IP 151.101.117.164.443 > 10.0.2.15.44022: Flags [P.], seq 1110448:1114570, ack 352, win 65535, length 4122
00:14:33.848689 IP 10.0.2.15.44022 > 151.101.117.164.443: Flags [.], ack 1114570, win 65535, length 0
00:14:33.849853 IP 151.101.117.164.443 > 10.0.2.15.44022: Flags [P.], seq 1114570:1117318, ack 352, win 65535, length 2748
00:14:33.849930 IP 151.101.117.164.443 > 10.0.2.15.44022: Flags [P.], seq 1117318:1120066, ack 352, win 65535, length 2748
00:14:33.850013 IP 10.0.2.15.44022 > 151.101.117.164.443: Flags [.], ack 1117318, win 65535, length 0
00:14:33.850431 IP 151.101.117.164.443 > 10.0.2.15.44022: Flags [P.], seq 1120066:1125562, ack 352, win 65535, length 5496
00:14:33.850432 IP 151.101.117.164.443 > 10.0.2.15.44022: Flags [P.], seq 1125562:1128310, ack 352, win 65535, length 2748
00:14:33.850433 IP 151.101.117.164.443 > 10.0.2.15.44022: Flags [P.], seq 1128310:1131058, ack 352, win 65535, length 2748
00:14:33.850603 IP 151.101.117.164.443 > 10.0.2.15.44022: Flags [P.], seq 1131058:1133806, ack 352, win 65535, length 2748
00:14:33.850643 IP 10.0.2.15.44022 > 151.101.117.164.443: Flags [.], ack 1133806, win 65535, length 0
00:14:33.850703 IP 151.101.117.164.443 > 10.0.2.15.44022: Flags [P.], seq 1133806:1135180, ack 352, win 65535, length 1374
00:14:33.851552 IP 151.101.117.164.443 > 10.0.2.15.44022: Flags [P.], seq 1135180:1139302, ack 352, win 65535, length 4122
00:14:33.851565 IP 10.0.2.15.44022 > 151.101.117.164.443: Flags [.], ack 1139302, win 65535, length 0
00:14:33.851841 IP 151.101.117.164.443 > 10.0.2.15.44022: Flags [P.], seq 1139302:1144798, ack 352, win 65535, length 5496
00:14:33.851885 IP 10.0.2.15.44022 > 151.101.117.164.443: Flags [.], ack 1144798, win 65535, length 0
00:14:33.852106 IP 151.101.117.164.443 > 10.0.2.15.44022: Flags [P.], seq 1144798:1147546, ack 352, win 65535, length 2748
00:14:33.852161 IP 10.0.2.15.44022 > 151.101.117.164.443: Flags [.], ack 1147546, win 65535, length 0
00:14:33.852716 IP 151.101.117.164.443 > 10.0.2.15.44022: Flags [P.], seq 1147546:1151668, ack 352, win 65535, length 4122
00:14:33.852718 IP 151.101.117.164.443 > 10.0.2.15.44022: Flags [P.], seq 1151668:1157164, ack 352, win 65535, length 5496
00:14:33.853041 IP 151.101.117.164.443 > 10.0.2.15.44022: Flags [P.], seq 1157164:1158538, ack 352, win 65535, length 1374
00:14:33.853134 IP 151.101.117.164.443 > 10.0.2.15.44022: Flags [P.], seq 1158538:1161286, ack 352, win 65535, length 2748
00:14:33.853152 IP 10.0.2.15.44022 > 151.101.117.164.443: Flags [.], ack 1158538, win 65535, length 0
00:14:33.853338 IP 10.0.2.15.44022 > 151.101.117.164.443: Flags [.], ack 1161286, win 65535, length 0
00:14:33.854053 IP 151.101.117.164.443 > 10.0.2.15.44022: Flags [P.], seq 1161286:1166782, ack 352, win 65535, length 5496
00:14:33.854064 IP 10.0.2.15.44022 > 151.101.117.164.443: Flags [.], ack 1166782, win 65535, length 0
00:14:33.854775 IP 151.101.117.164.443 > 10.0.2.15.44022: Flags [P.], seq 1166782:1169530, ack 352, win 65535, length 2748
00:14:33.854810 IP 151.101.117.164.443 > 10.0.2.15.44022: Flags [P.], seq 1169530:1173652, ack 352, win 65535, length 4122
00:14:33.854970 IP 151.101.117.164.443 > 10.0.2.15.44022: Flags [P.], seq 1173652:1179148, ack 352, win 65535, length 5496
00:14:33.855023 IP 10.0.2.15.44022 > 151.101.117.164.443: Flags [.], ack 1179148, win 65535, length 0
00:14:33.855076 IP 151.101.117.164.443 > 10.0.2.15.44022: Flags [P.], seq 1179148:1181896, ack 352, win 65535, length 2748
00:14:33.855133 IP 10.0.2.15.44022 > 151.101.117.164.443: Flags [.], ack 1181896, win 65535, length 0
00:14:33.856244 IP 151.101.117.164.443 > 10.0.2.15.44022: Flags [P.], seq 1181896:1186018, ack 352, win 65535, length 4122
00:14:33.856247 IP 151.101.117.164.443 > 10.0.2.15.44022: Flags [P.], seq 1186018:1188766, ack 352, win 65535, length 2748
00:14:33.856266 IP 10.0.2.15.44022 > 151.101.117.164.443: Flags [.], ack 1186018, win 65535, length 0
00:14:33.856479 IP 151.101.117.164.443 > 10.0.2.15.44022: Flags [P.], seq 1188766:1191514, ack 352, win 65535, length 2748
00:14:33.856622 IP 151.101.117.164.443 > 10.0.2.15.44022: Flags [P.], seq 1191514:1194262, ack 352, win 65535, length 2748
00:14:33.856682 IP 10.0.2.15.44022 > 151.101.117.164.443: Flags [.], ack 1194262, win 65535, length 0
00:14:33.857315 IP 151.101.117.164.443 > 10.0.2.15.44022: Flags [P.], seq 1194262:1197010, ack 352, win 65535, length 2748
00:14:33.862528 IP 151.101.117.164.443 > 10.0.2.15.44022: Flags [P.], seq 1197010:1201132, ack 352, win 65535, length 4122
00:14:33.862532 IP 151.101.117.164.443 > 10.0.2.15.44022: Flags [P.], seq 1201132:1203880, ack 352, win 65535, length 2748
00:14:33.862533 IP 151.101.117.164.443 > 10.0.2.15.44022: Flags [P.], seq 1203880:1208002, ack 352, win 65535, length 4122

