13:20:25.668279 IP 151.101.117.164.443 > 10.0.2.15.42634: Flags [S.], seq 75392001, ack 3181758522, win 65535, options [mss 1460], length 0
13:20:25.668323 IP 10.0.2.15.42634 > 151.101.117.164.443: Flags [.], ack 1, win 64240, length 0
13:20:25.675541 IP 10.0.2.15.42634 > 151.101.117.164.443: Flags [P.], seq 1:518, ack 1, win 64240, length 517
13:20:25.676113 IP 151.101.117.164.443 > 10.0.2.15.42634: Flags [.], ack 518, win 65535, length 0
13:20:25.695072 IP 151.101.117.164.443 > 10.0.2.15.42634: Flags [.], seq 1:2921, ack 518, win 65535, length 2920
13:20:25.695091 IP 10.0.2.15.42634 > 151.101.117.164.443: Flags [.], ack 2921, win 62780, length 0
13:20:25.695246 IP 151.101.117.164.443 > 10.0.2.15.42634: Flags [.], seq 2921:4381, ack 518, win 65535, length 1460
13:20:25.695260 IP 10.0.2.15.42634 > 151.101.117.164.443: Flags [.], ack 4381, win 61320, length 0
13:20:25.695397 IP 151.101.117.164.443 > 10.0.2.15.42634: Flags [P.], seq 4381:5497, ack 518, win 65535, length 1116
13:20:25.695404 IP 10.0.2.15.42634 > 151.101.117.164.443: Flags [.], ack 5497, win 61320, length 0
13:20:25.696087 IP 151.101.117.164.443 > 10.0.2.15.42634: Flags [P.], seq 5497:5607, ack 518, win 65535, length 110
13:20:25.696103 IP 10.0.2.15.42634 > 151.101.117.164.443: Flags [.], ack 5607, win 61210, length 0
13:20:25.697086 IP 10.0.2.15.42634 > 151.101.117.164.443: Flags [P.], seq 518:611, ack 5607, win 62780, length 93
13:20:25.697595 IP 151.101.117.164.443 > 10.0.2.15.42634: Flags [.], ack 611, win 65535, length 0
13:20:25.713556 IP 151.101.117.164.443 > 10.0.2.15.42634: Flags [P.], seq 5607:5658, ack 611, win 65535, length 51
13:20:25.713577 IP 10.0.2.15.42634 > 151.101.117.164.443: Flags [.], ack 5658, win 62780, length 0
13:20:25.713936 IP 10.0.2.15.42634 > 151.101.117.164.443: Flags [P.], seq 611:664, ack 5658, win 62780, length 53
13:20:25.713971 IP 10.0.2.15.42634 > 151.101.117.164.443: Flags [P.], seq 664:720, ack 5658, win 62780, length 56
13:20:25.714025 IP 10.0.2.15.42634 > 151.101.117.164.443: Flags [P.], seq 720:762, ack 5658, win 62780, length 42
13:20:25.714065 IP 10.0.2.15.42634 > 151.101.117.164.443: Flags [P.], seq 762:831, ack 5658, win 62780, length 69
13:20:25.715063 IP 151.101.117.164.443 > 10.0.2.15.42634: Flags [.], ack 664, win 65535, length 0
13:20:25.715065 IP 151.101.117.164.443 > 10.0.2.15.42634: Flags [.], ack 720, win 65535, length 0
13:20:25.715066 IP 151.101.117.164.443 > 10.0.2.15.42634: Flags [.], ack 762, win 65535, length 0
13:20:25.715066 IP 151.101.117.164.443 > 10.0.2.15.42634: Flags [.], ack 831, win 65535, length 0
13:20:25.728380 IP 151.101.117.164.443 > 10.0.2.15.42634: Flags [P.], seq 5658:5724, ack 831, win 65535, length 66
13:20:25.728401 IP 10.0.2.15.42634 > 151.101.117.164.443: Flags [.], ack 5724, win 62780, length 0
13:20:25.728633 IP 10.0.2.15.42634 > 151.101.117.164.443: Flags [P.], seq 831:869, ack 5724, win 62780, length 38
13:20:25.729256 IP 151.101.117.164.443 > 10.0.2.15.42634: Flags [.], ack 869, win 65535, length 0
13:20:25.734468 IP 151.101.117.164.443 > 10.0.2.15.42634: Flags [P.], seq 5724:11220, ack 869, win 65535, length 5496
13:20:25.734556 IP 10.0.2.15.42634 > 151.101.117.164.443: Flags [.], ack 11220, win 61320, length 0
13:20:25.735553 IP 151.101.117.164.443 > 10.0.2.15.42634: Flags [P.], seq 11220:12594, ack 869, win 65535, length 1374
13:20:25.736338 IP 151.101.117.164.443 > 10.0.2.15.42634: Flags [P.], seq 12594:19464, ack 869, win 65535, length 6870
13:20:25.736404 IP 10.0.2.15.42634 > 151.101.117.164.443: Flags [.], ack 19464, win 59860, length 0
13:20:25.737648 IP 151.101.117.164.443 > 10.0.2.15.42634: Flags [P.], seq 19464:23586, ack 869, win 65535, length 4122
13:20:25.737662 IP 10.0.2.15.42634 > 151.101.117.164.443: Flags [.], ack 23586, win 61320, length 0
13:20:25.738696 IP 151.101.117.164.443 > 10.0.2.15.42634: Flags [P.], seq 23586:26334, ack 869, win 65535, length 2748
13:20:25.738709 IP 10.0.2.15.42634 > 151.101.117.164.443: Flags [.], ack 26334, win 62780, length 0
13:20:25.739837 IP 151.101.117.164.443 > 10.0.2.15.42634: Flags [P.], seq 26334:31830, ack 869, win 65535, length 5496
13:20:25.740022 IP 10.0.2.15.42634 > 151.101.117.164.443: Flags [.], ack 31830, win 61320, length 0
13:20:25.740771 IP 151.101.117.164.443 > 10.0.2.15.42634: Flags [P.], seq 31830:34578, ack 869, win 65535, length 2748
13:20:25.740788 IP 10.0.2.15.42634 > 151.101.117.164.443: Flags [.], ack 34578, win 62780, length 0
13:20:25.741840 IP 151.101.117.164.443 > 10.0.2.15.42634: Flags [P.], seq 34578:40074, ack 869, win 65535, length 5496
13:20:25.741906 IP 10.0.2.15.42634 > 151.101.117.164.443: Flags [.], ack 40074, win 61320, length 0
13:20:25.742759 IP 151.101.117.164.443 > 10.0.2.15.42634: Flags [P.], seq 40074:46944, ack 869, win 65535, length 6870
13:20:25.742908 IP 10.0.2.15.42634 > 151.101.117.164.443: Flags [.], ack 46944, win 59860, length 0
13:20:25.743904 IP 151.101.117.164.443 > 10.0.2.15.42634: Flags [P.], seq 46944:48318, ack 869, win 65535, length 1374
13:20:25.747278 IP 151.101.117.164.443 > 10.0.2.15.42634: Flags [P.], seq 48318:51066, ack 869, win 65535, length 2748
13:20:25.747300 IP 10.0.2.15.42634 > 151.101.117.164.443: Flags [.], ack 51066, win 62780, length 0
13:20:25.748248 IP 151.101.117.164.443 > 10.0.2.15.42634: Flags [P.], seq 51066:59310, ack 869, win 65535, length 8244
13:20:25.748342 IP 10.0.2.15.42634 > 151.101.117.164.443: Flags [.], ack 59310, win 58400, length 0
13:20:25.748634 IP 151.101.117.164.443 > 10.0.2.15.42634: Flags [P.], seq 59310:60684, ack 869, win 65535, length 1374
13:20:25.750025 IP 151.101.117.164.443 > 10.0.2.15.42634: Flags [P.], seq 60684:62058, ack 869, win 65535, length 1374
13:20:25.750041 IP 10.0.2.15.42634 > 151.101.117.164.443: Flags [.], ack 62058, win 63204, length 0
13:20:25.750546 IP 151.101.117.164.443 > 10.0.2.15.42634: Flags [P.], seq 62058:67554, ack 869, win 65535, length 5496
13:20:25.750641 IP 10.0.2.15.42634 > 151.101.117.164.443: Flags [.], ack 67554, win 63204, length 0
13:20:25.750911 IP 151.101.117.164.443 > 10.0.2.15.42634: Flags [P.], seq 67554:71676, ack 869, win 65535, length 4122
13:20:25.750966 IP 10.0.2.15.42634 > 151.101.117.164.443: Flags [.], ack 71676, win 65535, length 0
13:20:25.751805 IP 151.101.117.164.443 > 10.0.2.15.42634: Flags [P.], seq 71676:78546, ack 869, win 65535, length 6870
13:20:25.751859 IP 10.0.2.15.42634 > 151.101.117.164.443: Flags [.], ack 78546, win 65535, length 0
13:20:25.752799 IP 151.101.117.164.443 > 10.0.2.15.42634: Flags [P.], seq 78546:85416, ack 869, win 65535, length 6870
13:20:25.752814 IP 10.0.2.15.42634 > 151.101.117.164.443: Flags [.], ack 85416, win 65535, length 0
13:20:25.753119 IP 151.101.117.164.443 > 10.0.2.15.42634: Flags [P.], seq 85416:88164, ack 869, win 65535, length 2748
13:20:25.753128 IP 10.0.2.15.42634 > 151.101.117.164.443: Flags [.], ack 88164, win 65535, length 0
13:20:25.753788 IP 151.101.117.164.443 > 10.0.2.15.42634: Flags [P.], seq 88164:95034, ack 869, win 65535, length 6870
13:20:25.753845 IP 10.0.2.15.42634 > 151.101.117.164.443: Flags [.], ack 95034, win 65535, length 0
13:20:25.754034 IP 151.101.117.164.443 > 10.0.2.15.42634: Flags [P.], seq 95034:97782, ack 869, win 65535, length 2748
13:20:25.754045 IP 10.0.2.15.42634 > 151.101.117.164.443: Flags [.], ack 97782, win 65535, length 0
13:20:25.755339 IP 151.101.117.164.443 > 10.0.2.15.42634: Flags [P.], seq 97782:111522, ack 869, win 65535, length 13740
13:20:25.755364 IP 10.0.2.15.42634 > 151.101.117.164.443: Flags [.], ack 111522, win 65535, length 0
13:20:25.755541 IP 151.101.117.164.443 > 10.0.2.15.42634: Flags [P.], seq 111522:114270, ack 869, win 65535, length 2748
13:20:25.755551 IP 10.0.2.15.42634 > 151.101.117.164.443: Flags [.], ack 114270, win 65535, length 0
13:20:25.757357 IP 151.101.117.164.443 > 10.0.2.15.42634: Flags [P.], seq 114270:123888, ack 869, win 65535, length 9618
13:20:25.757374 IP 10.0.2.15.42634 > 151.101.117.164.443: Flags [.], ack 123888, win 65535, length 0
13:20:25.758471 IP 151.101.117.164.443 > 10.0.2.15.42634: Flags [P.], seq 123888:132132, ack 869, win 65535, length 8244
13:20:25.758485 IP 10.0.2.15.42634 > 151.101.117.164.443: Flags [.], ack 132132, win 65535, length 0
13:20:25.759585 IP 151.101.117.164.443 > 10.0.2.15.42634: Flags [P.], seq 132132:133506, ack 869, win 65535, length 1374
13:20:25.760798 IP 151.101.117.164.443 > 10.0.2.15.42634: Flags [P.], seq 133506:137628, ack 869, win 65535, length 4122
13:20:25.760817 IP 10.0.2.15.42634 > 151.101.117.164.443: Flags [.], ack 137628, win 65535, length 0
13:20:25.761793 IP 151.101.117.164.443 > 10.0.2.15.42634: Flags [P.], seq 137628:144498, ack 869, win 65535, length 6870
13:20:25.761810 IP 10.0.2.15.42634 > 151.101.117.164.443: Flags [.], ack 144498, win 65535, length 0
13:20:25.762044 IP 151.101.117.164.443 > 10.0.2.15.42634: Flags [P.], seq 144498:154116, ack 869, win 65535, length 9618
13:20:25.762055 IP 10.0.2.15.42634 > 151.101.117.164.443: Flags [.], ack 154116, win 65535, length 0
13:20:25.763944 IP 151.101.117.164.443 > 10.0.2.15.42634: Flags [P.], seq 154116:162360, ack 869, win 65535, length 8244
13:20:25.763960 IP 10.0.2.15.42634 > 151.101.117.164.443: Flags [.], ack 162360, win 65535, length 0
13:20:25.764134 IP 151.101.117.164.443 > 10.0.2.15.42634: Flags [P.], seq 162360:166482, ack 869, win 65535, length 4122
13:20:25.764162 IP 10.0.2.15.42634 > 151.101.117.164.443: Flags [.], ack 166482, win 65535, length 0
13:20:25.766864 IP 151.101.117.164.443 > 10.0.2.15.42634: Flags [P.], seq 166482:174726, ack 869, win 65535, length 8244
13:20:25.766866 IP 151.101.117.164.443 > 10.0.2.15.42634: Flags [P.], seq 174726:181596, ack 869, win 65535, length 6870
13:20:25.766884 IP 10.0.2.15.42634 > 151.101.117.164.443: Flags [.], ack 174726, win 65535, length 0
13:20:25.767089 IP 10.0.2.15.42634 > 151.101.117.164.443: Flags [.], ack 181596, win 65535, length 0
13:20:25.767917 IP 151.101.117.164.443 > 10.0.2.15.42634: Flags [.], seq 181596:187436, ack 869, win 65535, length 5840
13:20:25.767935 IP 10.0.2.15.42634 > 151.101.117.164.443: Flags [.], ack 187436, win 65535, length 0
13:20:25.768779 IP 151.101.117.164.443 > 10.0.2.15.42634: Flags [P.], seq 187436:199458, ack 869, win 65535, length 12022
13:20:25.768795 IP 10.0.2.15.42634 > 151.101.117.164.443: Flags [.], ack 199458, win 65535, length 0
13:20:25.768881 IP 151.101.117.164.443 > 10.0.2.15.42634: Flags [P.], seq 199458:210450, ack 869, win 65535, length 10992
13:20:25.768889 IP 10.0.2.15.42634 > 151.101.117.164.443: Flags [.], ack 210450, win 65535, length 0
13:20:25.768904 IP 151.101.117.164.443 > 10.0.2.15.42634: Flags [P.], seq 210450:213198, ack 869, win 65535, length 2748
13:20:25.768912 IP 10.0.2.15.42634 > 151.101.117.164.443: Flags [.], ack 213198, win 65535, length 0
13:20:25.770106 IP 151.101.117.164.443 > 10.0.2.15.42634: Flags [P.], seq 213198:218694, ack 869, win 65535, length 5496
13:20:25.770109 IP 151.101.117.164.443 > 10.0.2.15.42634: Flags [P.], seq 218694:228312, ack 869, win 65535, length 9618
13:20:25.770129 IP 10.0.2.15.42634 > 151.101.117.164.443: Flags [.], ack 218694, win 65535, length 0
13:20:25.770173 IP 10.0.2.15.42634 > 151.101.117.164.443: Flags [.], ack 228312, win 65535, length 0
13:20:25.771297 IP 151.101.117.164.443 > 10.0.2.15.42634: Flags [P.], seq 228312:239304, ack 869, win 65535, length 10992
13:20:25.771316 IP 10.0.2.15.42634 > 151.101.117.164.443: Flags [.], ack 239304, win 65535, length 0
13:20:25.771605 IP 151.101.117.164.443 > 10.0.2.15.42634: Flags [P.], seq 239304:246174, ack 869, win 65535, length 6870
13:20:25.771616 IP 10.0.2.15.42634 > 151.101.117.164.443: Flags [.], ack 246174, win 65535, length 0
13:20:25.773832 IP 151.101.117.164.443 > 10.0.2.15.42634: Flags [P.], seq 246174:258540, ack 869, win 65535, length 12366
13:20:25.773882 IP 10.0.2.15.42634 > 151.101.117.164.443: Flags [.], ack 258540, win 65535, length 0
13:20:25.774142 IP 151.101.117.164.443 > 10.0.2.15.42634: Flags [P.], seq 258540:268158, ack 869, win 65535, length 9618
13:20:25.774158 IP 10.0.2.15.42634 > 151.101.117.164.443: Flags [.], ack 268158, win 65535, length 0
13:20:25.774370 IP 151.101.117.164.443 > 10.0.2.15.42634: Flags [P.], seq 268158:272280, ack 869, win 65535, length 4122
13:20:25.774382 IP 10.0.2.15.42634 > 151.101.117.164.443: Flags [.], ack 272280, win 65535, length 0
13:20:25.774739 IP 151.101.117.164.443 > 10.0.2.15.42634: Flags [P.], seq 272280:284646, ack 869, win 65535, length 12366
13:20:25.774754 IP 10.0.2.15.42634 > 151.101.117.164.443: Flags [.], ack 284646, win 65535, length 0
13:20:25.775145 IP 151.101.117.164.443 > 10.0.2.15.42634: Flags [P.], seq 284646:292890, ack 869, win 65535, length 8244
13:20:25.775157 IP 10.0.2.15.42634 > 151.101.117.164.443: Flags [.], ack 292890, win 65535, length 0
13:20:25.776322 IP 151.101.117.164.443 > 10.0.2.15.42634: Flags [P.], seq 292890:303882, ack 869, win 65535, length 10992
13:20:25.776339 IP 10.0.2.15.42634 > 151.101.117.164.443: Flags [.], ack 303882, win 65535, length 0
13:20:25.777423 IP 151.101.117.164.443 > 10.0.2.15.42634: Flags [P.], seq 303882:316248, ack 869, win 65535, length 12366
13:20:25.777438 IP 10.0.2.15.42634 > 151.101.117.164.443: Flags [.], ack 316248, win 65535, length 0
13:20:25.777888 IP 151.101.117.164.443 > 10.0.2.15.42634: Flags [P.], seq 316248:320370, ack 869, win 65535, length 4122
13:20:25.777900 IP 10.0.2.15.42634 > 151.101.117.164.443: Flags [.], ack 320370, win 65535, length 0
13:20:25.779220 IP 151.101.117.164.443 > 10.0.2.15.42634: Flags [P.], seq 320370:331362, ack 869, win 65535, length 10992
13:20:25.779239 IP 10.0.2.15.42634 > 151.101.117.164.443: Flags [.], ack 331362, win 65535, length 0
13:20:25.779381 IP 151.101.117.164.443 > 10.0.2.15.42634: Flags [P.], seq 331362:334110, ack 869, win 65535, length 2748
13:20:25.779515 IP 10.0.2.15.42634 > 151.101.117.164.443: Flags [.], ack 334110, win 65535, length 0
13:20:25.779686 IP 151.101.117.164.443 > 10.0.2.15.42634: Flags [P.], seq 334110:339606, ack 869, win 65535, length 5496
13:20:25.779738 IP 10.0.2.15.42634 > 151.101.117.164.443: Flags [.], ack 339606, win 65535, length 0
13:20:25.781055 IP 151.101.117.164.443 > 10.0.2.15.42634: Flags [P.], seq 339606:347850, ack 869, win 65535, length 8244
13:20:25.781059 IP 151.101.117.164.443 > 10.0.2.15.42634: Flags [P.], seq 347850:358842, ack 869, win 65535, length 10992
13:20:25.781078 IP 10.0.2.15.42634 > 151.101.117.164.443: Flags [.], ack 347850, win 65535, length 0
13:20:25.781151 IP 10.0.2.15.42634 > 151.101.117.164.443: Flags [.], ack 358842, win 65535, length 0
13:20:25.781440 IP 151.101.117.164.443 > 10.0.2.15.42634: Flags [P.], seq 358842:367086, ack 869, win 65535, length 8244
13:20:25.781517 IP 10.0.2.15.42634 > 151.101.117.164.443: Flags [.], ack 367086, win 65535, length 0
13:20:25.782246 IP 151.101.117.164.443 > 10.0.2.15.42634: Flags [P.], seq 367086:376704, ack 869, win 65535, length 9618
13:20:25.782264 IP 10.0.2.15.42634 > 151.101.117.164.443: Flags [.], ack 376704, win 65535, length 0
13:20:25.782489 IP 151.101.117.164.443 > 10.0.2.15.42634: Flags [P.], seq 376704:382200, ack 869, win 65535, length 5496
13:20:25.782497 IP 10.0.2.15.42634 > 151.101.117.164.443: Flags [.], ack 382200, win 65535, length 0
13:20:25.783008 IP 151.101.117.164.443 > 10.0.2.15.42634: Flags [P.], seq 382200:386322, ack 869, win 65535, length 4122
13:20:25.783023 IP 10.0.2.15.42634 > 151.101.117.164.443: Flags [.], ack 386322, win 65535, length 0
13:20:25.783761 IP 151.101.117.164.443 > 10.0.2.15.42634: Flags [P.], seq 386322:397314, ack 869, win 65535, length 10992
13:20:25.783775 IP 10.0.2.15.42634 > 151.101.117.164.443: Flags [.], ack 397314, win 65535, length 0
13:20:25.783818 IP 151.101.117.164.443 > 10.0.2.15.42634: Flags [P.], seq 397314:406932, ack 869, win 65535, length 9618
13:20:25.783824 IP 10.0.2.15.42634 > 151.101.117.164.443: Flags [.], ack 406932, win 65535, length 0
13:20:25.784100 IP 151.101.117.164.443 > 10.0.2.15.42634: Flags [P.], seq 406932:415176, ack 869, win 65535, length 8244
13:20:25.784109 IP 10.0.2.15.42634 > 151.101.117.164.443: Flags [.], ack 415176, win 65535, length 0
13:20:25.784441 IP 151.101.117.164.443 > 10.0.2.15.42634: Flags [P.], seq 415176:420672, ack 869, win 65535, length 5496
13:20:25.784469 IP 10.0.2.15.42634 > 151.101.117.164.443: Flags [.], ack 420672, win 65535, length 0
13:20:25.784864 IP 151.101.117.164.443 > 10.0.2.15.42634: Flags [P.], seq 420672:426168, ack 869, win 65535, length 5496
13:20:25.784877 IP 10.0.2.15.42634 > 151.101.117.164.443: Flags [.], ack 426168, win 65535, length 0
13:20:25.785512 IP 151.101.117.164.443 > 10.0.2.15.42634: Flags [P.], seq 426168:437160, ack 869, win 65535, length 10992
13:20:25.785529 IP 10.0.2.15.42634 > 151.101.117.164.443: Flags [.], ack 437160, win 65535, length 0
13:20:25.785781 IP 151.101.117.164.443 > 10.0.2.15.42634: Flags [P.], seq 437160:445404, ack 869, win 65535, length 8244
13:20:25.785791 IP 10.0.2.15.42634 > 151.101.117.164.443: Flags [.], ack 445404, win 65535, length 0
13:20:25.786015 IP 151.101.117.164.443 > 10.0.2.15.42634: Flags [P.], seq 445404:448152, ack 869, win 65535, length 2748
13:20:25.786026 IP 10.0.2.15.42634 > 151.101.117.164.443: Flags [.], ack 448152, win 65535, length 0
13:20:25.786643 IP 151.101.117.164.443 > 10.0.2.15.42634: Flags [P.], seq 448152:459144, ack 869, win 65535, length 10992
13:20:25.786658 IP 10.0.2.15.42634 > 151.101.117.164.443: Flags [.], ack 459144, win 65535, length 0
13:20:25.786969 IP 151.101.117.164.443 > 10.0.2.15.42634: Flags [P.], seq 459144:466014, ack 869, win 65535, length 6870
13:20:25.786983 IP 10.0.2.15.42634 > 151.101.117.164.443: Flags [.], ack 466014, win 65535, length 0
13:20:25.787703 IP 151.101.117.164.443 > 10.0.2.15.42634: Flags [P.], seq 466014:477006, ack 869, win 65535, length 10992
13:20:25.787717 IP 10.0.2.15.42634 > 151.101.117.164.443: Flags [.], ack 477006, win 65535, length 0
13:20:25.788743 IP 151.101.117.164.443 > 10.0.2.15.42634: Flags [P.], seq 477006:487998, ack 869, win 65535, length 10992
13:20:25.788757 IP 10.0.2.15.42634 > 151.101.117.164.443: Flags [.], ack 487998, win 65535, length 0
13:20:25.789197 IP 151.101.117.164.443 > 10.0.2.15.42634: Flags [P.], seq 487998:496242, ack 869, win 65535, length 8244
13:20:25.789212 IP 10.0.2.15.42634 > 151.101.117.164.443: Flags [.], ack 496242, win 65535, length 0
13:20:25.789493 IP 151.101.117.164.443 > 10.0.2.15.42634: Flags [P.], seq 496242:504486, ack 869, win 65535, length 8244
13:20:25.789505 IP 10.0.2.15.42634 > 151.101.117.164.443: Flags [.], ack 504486, win 65535, length 0
13:20:25.791146 IP 151.101.117.164.443 > 10.0.2.15.42634: Flags [P.], seq 504486:518226, ack 869, win 65535, length 13740
13:20:25.791166 IP 10.0.2.15.42634 > 151.101.117.164.443: Flags [.], ack 518226, win 65535, length 0
13:20:25.791558 IP 151.101.117.164.443 > 10.0.2.15.42634: Flags [P.], seq 518226:523722, ack 869, win 65535, length 5496
13:20:25.791572 IP 10.0.2.15.42634 > 151.101.117.164.443: Flags [.], ack 523722, win 65535, length 0
13:20:25.792484 IP 151.101.117.164.443 > 10.0.2.15.42634: Flags [P.], seq 523722:529218, ack 869, win 65535, length 5496
13:20:25.792553 IP 10.0.2.15.42634 > 151.101.117.164.443: Flags [.], ack 529218, win 65535, length 0
13:20:25.792880 IP 151.101.117.164.443 > 10.0.2.15.42634: Flags [P.], seq 529218:537462, ack 869, win 65535, length 8244
13:20:25.792893 IP 10.0.2.15.42634 > 151.101.117.164.443: Flags [.], ack 537462, win 65535, length 0
13:20:25.793475 IP 151.101.117.164.443 > 10.0.2.15.42634: Flags [.], seq 537462:541842, ack 869, win 65535, length 4380
13:20:25.793493 IP 10.0.2.15.42634 > 151.101.117.164.443: Flags [.], ack 541842, win 65535, length 0
13:20:25.793656 IP 151.101.117.164.443 > 10.0.2.15.42634: Flags [P.], seq 541842:548454, ack 869, win 65535, length 6612
13:20:25.793669 IP 10.0.2.15.42634 > 151.101.117.164.443: Flags [.], ack 548454, win 65535, length 0
13:20:25.794304 IP 151.101.117.164.443 > 10.0.2.15.42634: Flags [P.], seq 548454:558072, ack 869, win 65535, length 9618
13:20:25.794319 IP 10.0.2.15.42634 > 151.101.117.164.443: Flags [.], ack 558072, win 65535, length 0
13:20:25.794621 IP 151.101.117.164.443 > 10.0.2.15.42634: Flags [P.], seq 558072:563568, ack 869, win 65535, length 5496
13:20:25.794635 IP 10.0.2.15.42634 > 151.101.117.164.443: Flags [.], ack 563568, win 65535, length 0
13:20:25.795486 IP 151.101.117.164.443 > 10.0.2.15.42634: Flags [P.], seq 563568:574560, ack 869, win 65535, length 10992
13:20:25.795504 IP 10.0.2.15.42634 > 151.101.117.164.443: Flags [.], ack 574560, win 65535, length 0
13:20:25.795750 IP 151.101.117.164.443 > 10.0.2.15.42634: Flags [P.], seq 574560:580056, ack 869, win 65535, length 5496
13:20:25.795837 IP 10.0.2.15.42634 > 151.101.117.164.443: Flags [.], ack 580056, win 65535, length 0
13:20:25.796310 IP 151.101.117.164.443 > 10.0.2.15.42634: Flags [P.], seq 580056:592422, ack 869, win 65535, length 12366
13:20:25.796324 IP 10.0.2.15.42634 > 151.101.117.164.443: Flags [.], ack 592422, win 65535, length 0
13:20:25.796703 IP 151.101.117.164.443 > 10.0.2.15.42634: Flags [P.], seq 592422:597918, ack 869, win 65535, length 5496
13:20:25.796715 IP 10.0.2.15.42634 > 151.101.117.164.443: Flags [.], ack 597918, win 65535, length 0
13:20:25.797081 IP 151.101.117.164.443 > 10.0.2.15.42634: Flags [P.], seq 597918:603414, ack 869, win 65535, length 5496
13:20:25.797092 IP 10.0.2.15.42634 > 151.101.117.164.443: Flags [.], ack 603414, win 65535, length 0
13:20:25.802044 IP 151.101.117.164.443 > 10.0.2.15.42634: Flags [P.], seq 603414:608910, ack 869, win 65535, length 5496
13:20:25.802070 IP 10.0.2.15.42634 > 151.101.117.164.443: Flags [.], ack 608910, win 65535, length 0
13:20:25.802316 IP 151.101.117.164.443 > 10.0.2.15.42634: Flags [P.], seq 608910:617154, ack 869, win 65535, length 8244
13:20:25.802395 IP 10.0.2.15.42634 > 151.101.117.164.443: Flags [.], ack 617154, win 65535, length 0
13:20:25.802817 IP 151.101.117.164.443 > 10.0.2.15.42634: Flags [P.], seq 617154:628146, ack 869, win 65535, length 10992
13:20:25.802833 IP 10.0.2.15.42634 > 151.101.117.164.443: Flags [.], ack 628146, win 65535, length 0
13:20:25.803307 IP 151.101.117.164.443 > 10.0.2.15.42634: Flags [P.], seq 628146:637764, ack 869, win 65535, length 9618
13:20:25.803376 IP 10.0.2.15.42634 > 151.101.117.164.443: Flags [.], ack 637764, win 65535, length 0
13:20:25.803824 IP 151.101.117.164.443 > 10.0.2.15.42634: Flags [P.], seq 637764:647382, ack 869, win 65535, length 9618
13:20:25.803837 IP 10.0.2.15.42634 > 151.101.117.164.443: Flags [.], ack 647382, win 65535, length 0
13:20:25.805072 IP 151.101.117.164.443 > 10.0.2.15.42634: Flags [P.], seq 647382:657000, ack 869, win 65535, length 9618
13:20:25.805075 IP 151.101.117.164.443 > 10.0.2.15.42634: Flags [P.], seq 657000:666618, ack 869, win 65535, length 9618
13:20:25.805204 IP 151.101.117.164.443 > 10.0.2.15.42634: Flags [P.], seq 666618:674862, ack 869, win 65535, length 8244
13:20:25.805206 IP 151.101.117.164.443 > 10.0.2.15.42634: Flags [P.], seq 674862:683106, ack 869, win 65535, length 8244
13:20:25.805405 IP 10.0.2.15.42634 > 151.101.117.164.443: Flags [.], ack 683106, win 65535, length 0
13:20:25.806000 IP 151.101.117.164.443 > 10.0.2.15.42634: Flags [P.], seq 683106:691350, ack 869, win 65535, length 8244
13:20:25.806013 IP 10.0.2.15.42634 > 151.101.117.164.443: Flags [.], ack 691350, win 65535, length 0
13:20:25.806258 IP 151.101.117.164.443 > 10.0.2.15.42634: Flags [P.], seq 691350:695472, ack 869, win 65535, length 4122
13:20:25.806268 IP 10.0.2.15.42634 > 151.101.117.164.443: Flags [.], ack 695472, win 65535, length 0
13:20:25.806790 IP 151.101.117.164.443 > 10.0.2.15.42634: Flags [P.], seq 695472:703716, ack 869, win 65535, length 8244
13:20:25.806856 IP 10.0.2.15.42634 > 151.101.117.164.443: Flags [.], ack 703716, win 65535, length 0
13:20:25.807029 IP 151.101.117.164.443 > 10.0.2.15.42634: Flags [P.], seq 703716:713334, ack 869, win 65535, length 9618
13:20:25.807175 IP 10.0.2.15.42634 > 151.101.117.164.443: Flags [.], ack 713334, win 65535, length 0
13:20:25.807604 IP 151.101.117.164.443 > 10.0.2.15.42634: Flags [P.], seq 713334:722952, ack 869, win 65535, length 9618
13:20:25.807702 IP 10.0.2.15.42634 > 151.101.117.164.443: Flags [.], ack 722952, win 65535, length 0
13:20:25.807819 IP 151.101.117.164.443 > 10.0.2.15.42634: Flags [.], seq 722952:725872, ack 869, win 65535, length 2920
13:20:25.807886 IP 151.101.117.164.443 > 10.0.2.15.42634: Flags [P.], seq 725872:732570, ack 869, win 65535, length 6698
13:20:25.807933 IP 10.0.2.15.42634 > 151.101.117.164.443: Flags [.], ack 732570, win 65535, length 0
13:20:25.808421 IP 151.101.117.164.443 > 10.0.2.15.42634: Flags [P.], seq 732570:743562, ack 869, win 65535, length 10992
13:20:25.808433 IP 10.0.2.15.42634 > 151.101.117.164.443: Flags [.], ack 743562, win 65535, length 0
13:20:25.808729 IP 151.101.117.164.443 > 10.0.2.15.42634: Flags [.], seq 743562:747942, ack 869, win 65535, length 4380
13:20:25.809034 IP 151.101.117.164.443 > 10.0.2.15.42634: Flags [P.], seq 747942:751806, ack 869, win 65535, length 3864
13:20:25.809628 IP 151.101.117.164.443 > 10.0.2.15.42634: Flags [P.], seq 751806:755928, ack 869, win 65535, length 4122
13:20:25.809840 IP 151.101.117.164.443 > 10.0.2.15.42634: Flags [P.], seq 755928:765546, ack 869, win 65535, length 9618
13:20:25.810439 IP 151.101.117.164.443 > 10.0.2.15.42634: Flags [P.], seq 765546:773790, ack 869, win 65535, length 8244
13:20:25.810835 IP 151.101.117.164.443 > 10.0.2.15.42634: Flags [P.], seq 773790:783408, ack 869, win 65535, length 9618
13:20:25.811262 IP 10.0.2.15.42634 > 151.101.117.164.443: Flags [.], ack 783408, win 65535, length 0
13:20:25.812228 IP 151.101.117.164.443 > 10.0.2.15.42634: Flags [.], seq 783408:806768, ack 869, win 65535, length 23360
13:20:25.812246 IP 10.0.2.15.42634 > 151.101.117.164.443: Flags [.], ack 806768, win 65535, length 0
13:20:25.812534 IP 151.101.117.164.443 > 10.0.2.15.42634: Flags [P.], seq 806768:809514, ack 869, win 65535, length 2746
13:20:25.812537 IP 151.101.117.164.443 > 10.0.2.15.42634: Flags [P.], seq 809514:820506, ack 869, win 65535, length 10992
13:20:25.812716 IP 10.0.2.15.42634 > 151.101.117.164.443: Flags [.], ack 820506, win 65535, length 0
13:20:25.813239 IP 151.101.117.164.443 > 10.0.2.15.42634: Flags [P.], seq 820506:835620, ack 869, win 65535, length 15114
13:20:25.813253 IP 10.0.2.15.42634 > 151.101.117.164.443: Flags [.], ack 835620, win 65535, length 0
13:20:25.813574 IP 151.101.117.164.443 > 10.0.2.15.42634: Flags [P.], seq 835620:839742, ack 869, win 65535, length 4122
13:20:25.813643 IP 10.0.2.15.42634 > 151.101.117.164.443: Flags [.], ack 839742, win 65535, length 0
13:20:25.814186 IP 151.101.117.164.443 > 10.0.2.15.42634: Flags [P.], seq 839742:846612, ack 869, win 65535, length 6870
13:20:25.814200 IP 10.0.2.15.42634 > 151.101.117.164.443: Flags [.], ack 846612, win 65535, length 0
13:20:25.814527 IP 151.101.117.164.443 > 10.0.2.15.42634: Flags [P.], seq 846612:858978, ack 869, win 65535, length 12366
13:20:25.814576 IP 10.0.2.15.42634 > 151.101.117.164.443: Flags [.], ack 858978, win 65535, length 0
13:20:25.814902 IP 151.101.117.164.443 > 10.0.2.15.42634: Flags [P.], seq 858978:863100, ack 869, win 65535, length 4122
13:20:25.814915 IP 10.0.2.15.42634 > 151.101.117.164.443: Flags [.], ack 863100, win 65535, length 0
13:20:25.815205 IP 151.101.117.164.443 > 10.0.2.15.42634: Flags [P.], seq 863100:872718, ack 869, win 65535, length 9618
13:20:25.815277 IP 10.0.2.15.42634 > 151.101.117.164.443: Flags [.], ack 872718, win 65535, length 0
13:20:25.815806 IP 151.101.117.164.443 > 10.0.2.15.42634: Flags [P.], seq 872718:883710, ack 869, win 65535, length 10992
13:20:25.815823 IP 10.0.2.15.42634 > 151.101.117.164.443: Flags [.], ack 883710, win 65535, length 0
13:20:25.816211 IP 151.101.117.164.443 > 10.0.2.15.42634: Flags [.], seq 883710:895390, ack 869, win 65535, length 11680
13:20:25.816419 IP 10.0.2.15.42634 > 151.101.117.164.443: Flags [.], ack 895390, win 65535, length 0
13:20:25.816686 IP 151.101.117.164.443 > 10.0.2.15.42634: Flags [P.], seq 895390:896076, ack 869, win 65535, length 686
13:20:25.816689 IP 151.101.117.164.443 > 10.0.2.15.42634: Flags [P.], seq 896076:902946, ack 869, win 65535, length 6870
13:20:25.816768 IP 10.0.2.15.42634 > 151.101.117.164.443: Flags [.], ack 902946, win 65535, length 0
13:20:25.818122 IP 151.101.117.164.443 > 10.0.2.15.42634: Flags [P.], seq 902946:912564, ack 869, win 65535, length 9618
13:20:25.818139 IP 10.0.2.15.42634 > 151.101.117.164.443: Flags [.], ack 912564, win 65535, length 0
13:20:25.818247 IP 151.101.117.164.443 > 10.0.2.15.42634: Flags [P.], seq 912564:920808, ack 869, win 65535, length 8244
13:20:25.818299 IP 10.0.2.15.42634 > 151.101.117.164.443: Flags [.], ack 920808, win 65535, length 0
13:20:25.818666 IP 151.101.117.164.443 > 10.0.2.15.42634: Flags [P.], seq 920808:926304, ack 869, win 65535, length 5496
13:20:25.818680 IP 10.0.2.15.42634 > 151.101.117.164.443: Flags [.], ack 926304, win 65535, length 0
13:20:25.819175 IP 151.101.117.164.443 > 10.0.2.15.42634: Flags [P.], seq 926304:937296, ack 869, win 65535, length 10992
13:20:25.819314 IP 10.0.2.15.42634 > 151.101.117.164.443: Flags [.], ack 937296, win 65535, length 0
13:20:25.819590 IP 151.101.117.164.443 > 10.0.2.15.42634: Flags [P.], seq 937296:949662, ack 869, win 65535, length 12366
13:20:25.819777 IP 10.0.2.15.42634 > 151.101.117.164.443: Flags [.], ack 949662, win 65535, length 0
13:20:25.820013 IP 151.101.117.164.443 > 10.0.2.15.42634: Flags [P.], seq 949662:960654, ack 869, win 65535, length 10992
13:20:25.820023 IP 10.0.2.15.42634 > 151.101.117.164.443: Flags [.], ack 960654, win 65535, length 0
13:20:25.820535 IP 151.101.117.164.443 > 10.0.2.15.42634: Flags [P.], seq 960654:968898, ack 869, win 65535, length 8244
13:20:25.820641 IP 10.0.2.15.42634 > 151.101.117.164.443: Flags [.], ack 968898, win 65535, length 0
13:20:25.821090 IP 151.101.117.164.443 > 10.0.2.15.42634: Flags [P.], seq 968898:978516, ack 869, win 65535, length 9618
13:20:25.821103 IP 10.0.2.15.42634 > 151.101.117.164.443: Flags [.], ack 978516, win 65535, length 0
13:20:25.821398 IP 151.101.117.164.443 > 10.0.2.15.42634: Flags [P.], seq 978516:990882, ack 869, win 65535, length 12366
13:20:25.821552 IP 10.0.2.15.42634 > 151.101.117.164.443: Flags [.], ack 990882, win 65535, length 0
13:20:25.822475 IP 151.101.117.164.443 > 10.0.2.15.42634: Flags [P.], seq 990882:999126, ack 869, win 65535, length 8244
13:20:25.822740 IP 10.0.2.15.42634 > 151.101.117.164.443: Flags [.], ack 999126, win 65535, length 0
13:20:25.822860 IP 151.101.117.164.443 > 10.0.2.15.42634: Flags [P.], seq 999126:1011492, ack 869, win 65535, length 12366
13:20:25.822900 IP 10.0.2.15.42634 > 151.101.117.164.443: Flags [.], ack 1011492, win 65535, length 0
13:20:25.823295 IP 151.101.117.164.443 > 10.0.2.15.42634: Flags [P.], seq 1011492:1018362, ack 869, win 65535, length 6870
13:20:25.823306 IP 10.0.2.15.42634 > 151.101.117.164.443: Flags [.], ack 1018362, win 65535, length 0
13:20:25.823501 IP 151.101.117.164.443 > 10.0.2.15.42634: Flags [P.], seq 1018362:1025232, ack 869, win 65535, length 6870
13:20:25.823527 IP 10.0.2.15.42634 > 151.101.117.164.443: Flags [.], ack 1025232, win 65535, length 0
13:20:25.824063 IP 151.101.117.164.443 > 10.0.2.15.42634: Flags [P.], seq 1025232:1034850, ack 869, win 65535, length 9618
13:20:25.824198 IP 10.0.2.15.42634 > 151.101.117.164.443: Flags [.], ack 1034850, win 65535, length 0
13:20:25.824415 IP 151.101.117.164.443 > 10.0.2.15.42634: Flags [P.], seq 1034850:1043094, ack 869, win 65535, length 8244
13:20:25.824450 IP 10.0.2.15.42634 > 151.101.117.164.443: Flags [.], ack 1043094, win 65535, length 0
13:20:25.824784 IP 151.101.117.164.443 > 10.0.2.15.42634: Flags [P.], seq 1043094:1052712, ack 869, win 65535, length 9618
13:20:25.824795 IP 10.0.2.15.42634 > 151.101.117.164.443: Flags [.], ack 1052712, win 65535, length 0
13:20:25.825115 IP 151.101.117.164.443 > 10.0.2.15.42634: Flags [P.], seq 1052712:1062330, ack 869, win 65535, length 9618
13:20:25.825125 IP 10.0.2.15.42634 > 151.101.117.164.443: Flags [.], ack 1062330, win 65535, length 0
13:20:25.825636 IP 151.101.117.164.443 > 10.0.2.15.42634: Flags [P.], seq 1062330:1071948, ack 869, win 65535, length 9618
13:20:25.825689 IP 10.0.2.15.42634 > 151.101.117.164.443: Flags [.], ack 1071948, win 65535, length 0
13:20:25.826036 IP 151.101.117.164.443 > 10.0.2.15.42634: Flags [P.], seq 1071948:1078818, ack 869, win 65535, length 6870
13:20:25.826048 IP 10.0.2.15.42634 > 151.101.117.164.443: Flags [.], ack 1078818, win 65535, length 0
13:20:25.827427 IP 151.101.117.164.443 > 10.0.2.15.42634: Flags [P.], seq 1078818:1089810, ack 869, win 65535, length 10992
13:20:25.827509 IP 151.101.117.164.443 > 10.0.2.15.42634: Flags [P.], seq 1089810:1096680, ack 869, win 65535, length 6870
13:20:25.827872 IP 151.101.117.164.443 > 10.0.2.15.42634: Flags [P.], seq 1096680:1104924, ack 869, win 65535, length 8244
13:20:25.828039 IP 151.101.117.164.443 > 10.0.2.15.42634: Flags [P.], seq 1104924:1114542, ack 869, win 65535, length 9618
13:20:25.828106 IP 10.0.2.15.42634 > 151.101.117.164.443: Flags [.], ack 1114542, win 65535, length 0
13:20:25.828866 IP 151.101.117.164.443 > 10.0.2.15.42634: Flags [P.], seq 1114542:1125534, ack 869, win 65535, length 10992
13:20:25.828929 IP 10.0.2.15.42634 > 151.101.117.164.443: Flags [.], ack 1125534, win 65535, length 0
13:20:25.828981 IP 151.101.117.164.443 > 10.0.2.15.42634: Flags [P.], seq 1125534:1135152, ack 869, win 65535, length 9618
13:20:25.829251 IP 10.0.2.15.42634 > 151.101.117.164.443: Flags [.], ack 1135152, win 65535, length 0
13:20:25.829556 IP 151.101.117.164.443 > 10.0.2.15.42634: Flags [P.], seq 1135152:1144770, ack 869, win 65535, length 9618
13:20:25.829567 IP 10.0.2.15.42634 > 151.101.117.164.443: Flags [.], ack 1144770, win 65535, length 0
13:20:25.829956 IP 151.101.117.164.443 > 10.0.2.15.42634: Flags [P.], seq 1144770:1155762, ack 869, win 65535, length 10992
13:20:25.829966 IP 10.0.2.15.42634 > 151.101.117.164.443: Flags [.], ack 1155762, win 65535, length 0
13:20:25.830306 IP 151.101.117.164.443 > 10.0.2.15.42634: Flags [P.], seq 1155762:1165380, ack 869, win 65535, length 9618
13:20:25.830347 IP 10.0.2.15.42634 > 151.101.117.164.443: Flags [.], ack 1165380, win 65535, length 0
13:20:25.830566 IP 151.101.117.164.443 > 10.0.2.15.42634: Flags [P.], seq 1165380:1166754, ack 869, win 65535, length 1374
13:20:25.831592 IP 151.101.117.164.443 > 10.0.2.15.42634: Flags [P.], seq 1166754:1170876, ack 869, win 65535, length 4122
13:20:25.831609 IP 10.0.2.15.42634 > 151.101.117.164.443: Flags [.], ack 1170876, win 65535, length 0
13:20:25.831918 IP 151.101.117.164.443 > 10.0.2.15.42634: Flags [P.], seq 1170876:1184616, ack 869, win 65535, length 13740
13:20:25.832115 IP 10.0.2.15.42634 > 151.101.117.164.443: Flags [.], ack 1184616, win 65535, length 0
13:20:25.832607 IP 151.101.117.164.443 > 10.0.2.15.42634: Flags [P.], seq 1184616:1194234, ack 869, win 65535, length 9618
13:20:25.832623 IP 10.0.2.15.42634 > 151.101.117.164.443: Flags [.], ack 1194234, win 65535, length 0
13:20:25.832826 IP 151.101.117.164.443 > 10.0.2.15.42634: Flags [P.], seq 1194234:1203852, ack 869, win 65535, length 9618
13:20:25.832882 IP 10.0.2.15.42634 > 151.101.117.164.443: Flags [.], ack 1203852, win 65535, length 0
13:20:25.833328 IP 151.101.117.164.443 > 10.0.2.15.42634: Flags [P.], seq 1203852:1214844, ack 869, win 65535, length 10992
13:20:25.833342 IP 10.0.2.15.42634 > 151.101.117.164.443: Flags [.], ack 1214844, win 65535, length 0
13:20:25.833703 IP 151.101.117.164.443 > 10.0.2.15.42634: Flags [P.], seq 1214844:1223088, ack 869, win 65535, length 8244
13:20:25.833770 IP 10.0.2.15.42634 > 151.101.117.164.443: Flags [.], ack 1223088, win 65535, length 0
13:20:25.834042 IP 151.101.117.164.443 > 10.0.2.15.42634: Flags [P.], seq 1223088:1232706, ack 869, win 65535, length 9618
13:20:25.834061 IP 10.0.2.15.42634 > 151.101.117.164.443: Flags [.], ack 1232706, win 65535, length 0

