19:56:51.149059 IP 10.0.2.15.35601 > 140.233.253.2.53: 31933+ A? www.nytimes.com. (33)
19:56:51.149103 IP 10.0.2.15.35601 > 140.233.253.2.53: 37823+ AAAA? www.nytimes.com. (33)
19:56:51.154854 IP 140.233.253.2.53 > 10.0.2.15.35601: 37823 2/1/0 CNAME www.prd.map.nytimes.com., CNAME nytimes.map.fastly.net. (153)
19:56:51.154856 IP 140.233.253.2.53 > 10.0.2.15.35601: 31933 3/0/0 CNAME www.prd.map.nytimes.com., CNAME nytimes.map.fastly.net., A 151.101.117.164 (111)
19:56:51.155102 IP 10.0.2.15.44100 > 151.101.117.164.443: Flags [S], seq 875640918, win 64240, options [mss 1460,sackOK,TS val 917614238 ecr 0,nop,wscale 6], length 0
19:56:51.169189 IP 151.101.117.164.443 > 10.0.2.15.44100: Flags [S.], seq 208768001, ack 875640919, win 65535, options [mss 1460], length 0
19:56:51.169238 IP 10.0.2.15.44100 > 151.101.117.164.443: Flags [.], ack 1, win 64240, length 0
19:56:51.178737 IP 10.0.2.15.44100 > 151.101.117.164.443: Flags [P.], seq 1:518, ack 1, win 64240, length 517
19:56:51.179112 IP 151.101.117.164.443 > 10.0.2.15.44100: Flags [.], ack 518, win 65535, length 0
19:56:51.198291 IP 151.101.117.164.443 > 10.0.2.15.44100: Flags [.], seq 1:2921, ack 518, win 65535, length 2920
19:56:51.198317 IP 10.0.2.15.44100 > 151.101.117.164.443: Flags [.], ack 2921, win 62780, length 0
19:56:51.198542 IP 151.101.117.164.443 > 10.0.2.15.44100: Flags [P.], seq 2921:5607, ack 518, win 65535, length 2686
19:56:51.198561 IP 10.0.2.15.44100 > 151.101.117.164.443: Flags [.], ack 5607, win 61320, length 0
19:56:51.200364 IP 10.0.2.15.44100 > 151.101.117.164.443: Flags [P.], seq 518:611, ack 5607, win 62780, length 93
19:56:51.200740 IP 151.101.117.164.443 > 10.0.2.15.44100: Flags [.], ack 611, win 65535, length 0
19:56:51.221734 IP 151.101.117.164.443 > 10.0.2.15.44100: Flags [P.], seq 5607:5658, ack 611, win 65535, length 51
19:56:51.221757 IP 10.0.2.15.44100 > 151.101.117.164.443: Flags [.], ack 5658, win 62780, length 0
19:56:51.222286 IP 10.0.2.15.44100 > 151.101.117.164.443: Flags [P.], seq 611:664, ack 5658, win 62780, length 53
19:56:51.222324 IP 10.0.2.15.44100 > 151.101.117.164.443: Flags [P.], seq 664:720, ack 5658, win 62780, length 56
19:56:51.222546 IP 151.101.117.164.443 > 10.0.2.15.44100: Flags [.], ack 664, win 65535, length 0
19:56:51.222564 IP 10.0.2.15.44100 > 151.101.117.164.443: Flags [P.], seq 720:831, ack 5658, win 62780, length 111
19:56:51.222749 IP 151.101.117.164.443 > 10.0.2.15.44100: Flags [.], ack 720, win 65535, length 0
19:56:51.222870 IP 151.101.117.164.443 > 10.0.2.15.44100: Flags [.], ack 831, win 65535, length 0
19:56:51.236593 IP 151.101.117.164.443 > 10.0.2.15.44100: Flags [P.], seq 5658:5753, ack 831, win 65535, length 95
19:56:51.236615 IP 10.0.2.15.44100 > 151.101.117.164.443: Flags [.], ack 5753, win 62780, length 0
19:56:51.237207 IP 10.0.2.15.44100 > 151.101.117.164.443: Flags [P.], seq 831:869, ack 5753, win 62780, length 38
19:56:51.237497 IP 151.101.117.164.443 > 10.0.2.15.44100: Flags [.], ack 869, win 65535, length 0
19:56:51.243739 IP 151.101.117.164.443 > 10.0.2.15.44100: Flags [P.], seq 5753:11249, ack 869, win 65535, length 5496
19:56:51.243838 IP 10.0.2.15.44100 > 151.101.117.164.443: Flags [.], ack 11249, win 61320, length 0
19:56:51.244851 IP 151.101.117.164.443 > 10.0.2.15.44100: Flags [P.], seq 11249:18119, ack 869, win 65535, length 6870
19:56:51.244934 IP 10.0.2.15.44100 > 151.101.117.164.443: Flags [.], ack 18119, win 59860, length 0
19:56:51.245811 IP 151.101.117.164.443 > 10.0.2.15.44100: Flags [P.], seq 18119:20867, ack 869, win 65535, length 2748
19:56:51.245950 IP 10.0.2.15.44100 > 151.101.117.164.443: Flags [.], ack 20867, win 62780, length 0
19:56:51.247034 IP 151.101.117.164.443 > 10.0.2.15.44100: Flags [P.], seq 20867:26363, ack 869, win 65535, length 5496
19:56:51.247269 IP 10.0.2.15.44100 > 151.101.117.164.443: Flags [.], ack 26363, win 61320, length 0
19:56:51.247865 IP 151.101.117.164.443 > 10.0.2.15.44100: Flags [P.], seq 26363:31859, ack 869, win 65535, length 5496
19:56:51.247867 IP 151.101.117.164.443 > 10.0.2.15.44100: Flags [P.], seq 31859:33233, ack 869, win 65535, length 1374
19:56:51.247882 IP 10.0.2.15.44100 > 151.101.117.164.443: Flags [.], ack 31859, win 61320, length 0
19:56:51.249186 IP 151.101.117.164.443 > 10.0.2.15.44100: Flags [P.], seq 33233:37355, ack 869, win 65535, length 4122
19:56:51.249200 IP 10.0.2.15.44100 > 151.101.117.164.443: Flags [.], ack 37355, win 61320, length 0
19:56:51.250629 IP 151.101.117.164.443 > 10.0.2.15.44100: Flags [P.], seq 37355:41477, ack 869, win 65535, length 4122
19:56:51.250652 IP 10.0.2.15.44100 > 151.101.117.164.443: Flags [.], ack 41477, win 61320, length 0
19:56:51.251520 IP 151.101.117.164.443 > 10.0.2.15.44100: Flags [P.], seq 41477:45599, ack 869, win 65535, length 4122
19:56:51.251532 IP 10.0.2.15.44100 > 151.101.117.164.443: Flags [.], ack 45599, win 61320, length 0
19:56:51.252523 IP 151.101.117.164.443 > 10.0.2.15.44100: Flags [P.], seq 45599:49721, ack 869, win 65535, length 4122
19:56:51.252525 IP 151.101.117.164.443 > 10.0.2.15.44100: Flags [P.], seq 49721:53843, ack 869, win 65535, length 4122
19:56:51.252543 IP 10.0.2.15.44100 > 151.101.117.164.443: Flags [.], ack 49721, win 61320, length 0
19:56:51.252859 IP 10.0.2.15.44100 > 151.101.117.164.443: Flags [.], ack 53843, win 58400, length 0
19:56:51.253991 IP 151.101.117.164.443 > 10.0.2.15.44100: Flags [P.], seq 53843:56591, ack 869, win 65535, length 2748
19:56:51.254012 IP 10.0.2.15.44100 > 151.101.117.164.443: Flags [.], ack 56591, win 62780, length 0
19:56:51.254126 IP 151.101.117.164.443 > 10.0.2.15.44100: Flags [P.], seq 56591:57965, ack 869, win 65535, length 1374
19:56:51.256580 IP 151.101.117.164.443 > 10.0.2.15.44100: Flags [P.], seq 57965:59339, ack 869, win 65535, length 1374
19:56:51.256601 IP 10.0.2.15.44100 > 151.101.117.164.443: Flags [.], ack 59339, win 62780, length 0
19:56:51.257597 IP 151.101.117.164.443 > 10.0.2.15.44100: Flags [P.], seq 59339:66209, ack 869, win 65535, length 6870
19:56:51.257599 IP 151.101.117.164.443 > 10.0.2.15.44100: Flags [P.], seq 66209:67583, ack 869, win 65535, length 1374
19:56:51.258789 IP 151.101.117.164.443 > 10.0.2.15.44100: Flags [P.], seq 67583:70331, ack 869, win 65535, length 2748
19:56:51.258899 IP 10.0.2.15.44100 > 151.101.117.164.443: Flags [.], ack 70331, win 62780, length 0
19:56:51.259764 IP 151.101.117.164.443 > 10.0.2.15.44100: Flags [P.], seq 70331:73079, ack 869, win 65535, length 2748
19:56:51.259777 IP 10.0.2.15.44100 > 151.101.117.164.443: Flags [.], ack 73079, win 65535, length 0
19:56:51.260856 IP 151.101.117.164.443 > 10.0.2.15.44100: Flags [P.], seq 73079:79949, ack 869, win 65535, length 6870
19:56:51.260857 IP 151.101.117.164.443 > 10.0.2.15.44100: Flags [P.], seq 79949:81323, ack 869, win 65535, length 1374
19:56:51.260874 IP 10.0.2.15.44100 > 151.101.117.164.443: Flags [.], ack 79949, win 65535, length 0
19:56:51.262144 IP 151.101.117.164.443 > 10.0.2.15.44100: Flags [P.], seq 81323:85445, ack 869, win 65535, length 4122
19:56:51.262165 IP 10.0.2.15.44100 > 151.101.117.164.443: Flags [.], ack 85445, win 65535, length 0
19:56:51.263188 IP 151.101.117.164.443 > 10.0.2.15.44100: Flags [P.], seq 85445:89567, ack 869, win 65535, length 4122
19:56:51.263209 IP 10.0.2.15.44100 > 151.101.117.164.443: Flags [.], ack 89567, win 65535, length 0
19:56:51.264275 IP 151.101.117.164.443 > 10.0.2.15.44100: Flags [P.], seq 89567:95063, ack 869, win 65535, length 5496
19:56:51.264292 IP 10.0.2.15.44100 > 151.101.117.164.443: Flags [.], ack 95063, win 65535, length 0
19:56:51.264478 IP 151.101.117.164.443 > 10.0.2.15.44100: Flags [P.], seq 95063:99185, ack 869, win 65535, length 4122
19:56:51.264488 IP 10.0.2.15.44100 > 151.101.117.164.443: Flags [.], ack 99185, win 65535, length 0
19:56:51.265735 IP 151.101.117.164.443 > 10.0.2.15.44100: Flags [P.], seq 99185:101933, ack 869, win 65535, length 2748
19:56:51.265753 IP 10.0.2.15.44100 > 151.101.117.164.443: Flags [.], ack 101933, win 65535, length 0
19:56:51.266732 IP 151.101.117.164.443 > 10.0.2.15.44100: Flags [P.], seq 101933:107429, ack 869, win 65535, length 5496
19:56:51.266747 IP 10.0.2.15.44100 > 151.101.117.164.443: Flags [.], ack 107429, win 65535, length 0
19:56:51.271048 IP 151.101.117.164.443 > 10.0.2.15.44100: Flags [P.], seq 107429:126665, ack 869, win 65535, length 19236
19:56:51.271091 IP 10.0.2.15.44100 > 151.101.117.164.443: Flags [.], ack 126665, win 65535, length 0
19:56:51.271318 IP 151.101.117.164.443 > 10.0.2.15.44100: Flags [P.], seq 126665:130787, ack 869, win 65535, length 4122
19:56:51.271321 IP 151.101.117.164.443 > 10.0.2.15.44100: Flags [P.], seq 130787:139031, ack 869, win 65535, length 8244
19:56:51.271340 IP 10.0.2.15.44100 > 151.101.117.164.443: Flags [.], ack 130787, win 65535, length 0
19:56:51.271369 IP 10.0.2.15.44100 > 151.101.117.164.443: Flags [.], ack 139031, win 65535, length 0
19:56:51.271391 IP 151.101.117.164.443 > 10.0.2.15.44100: Flags [P.], seq 139031:140405, ack 869, win 65535, length 1374
19:56:51.272647 IP 151.101.117.164.443 > 10.0.2.15.44100: Flags [P.], seq 140405:145901, ack 869, win 65535, length 5496
19:56:51.272686 IP 151.101.117.164.443 > 10.0.2.15.44100: Flags [P.], seq 145901:151397, ack 869, win 65535, length 5496
19:56:51.272705 IP 10.0.2.15.44100 > 151.101.117.164.443: Flags [.], ack 145901, win 65535, length 0
19:56:51.272722 IP 10.0.2.15.44100 > 151.101.117.164.443: Flags [.], ack 151397, win 65535, length 0
19:56:51.272751 IP 151.101.117.164.443 > 10.0.2.15.44100: Flags [P.], seq 151397:156893, ack 869, win 65535, length 5496
19:56:51.272752 IP 151.101.117.164.443 > 10.0.2.15.44100: Flags [P.], seq 156893:159641, ack 869, win 65535, length 2748
19:56:51.272759 IP 10.0.2.15.44100 > 151.101.117.164.443: Flags [.], ack 156893, win 65535, length 0
19:56:51.272772 IP 10.0.2.15.44100 > 151.101.117.164.443: Flags [.], ack 159641, win 65535, length 0
19:56:51.273210 IP 151.101.117.164.443 > 10.0.2.15.44100: Flags [P.], seq 159641:161015, ack 869, win 65535, length 1374
19:56:51.274477 IP 151.101.117.164.443 > 10.0.2.15.44100: Flags [P.], seq 161015:162389, ack 869, win 65535, length 1374
19:56:51.274497 IP 10.0.2.15.44100 > 151.101.117.164.443: Flags [.], ack 162389, win 65535, length 0
19:56:51.275680 IP 151.101.117.164.443 > 10.0.2.15.44100: Flags [P.], seq 162389:172007, ack 869, win 65535, length 9618
19:56:51.275683 IP 151.101.117.164.443 > 10.0.2.15.44100: Flags [P.], seq 172007:174755, ack 869, win 65535, length 2748
19:56:51.275701 IP 10.0.2.15.44100 > 151.101.117.164.443: Flags [.], ack 172007, win 65535, length 0
19:56:51.275731 IP 10.0.2.15.44100 > 151.101.117.164.443: Flags [.], ack 174755, win 65535, length 0
19:56:51.276062 IP 151.101.117.164.443 > 10.0.2.15.44100: Flags [P.], seq 174755:177503, ack 869, win 65535, length 2748
19:56:51.276063 IP 151.101.117.164.443 > 10.0.2.15.44100: Flags [P.], seq 177503:180251, ack 869, win 65535, length 2748
19:56:51.276064 IP 151.101.117.164.443 > 10.0.2.15.44100: Flags [P.], seq 180251:181625, ack 869, win 65535, length 1374
19:56:51.276072 IP 10.0.2.15.44100 > 151.101.117.164.443: Flags [.], ack 177503, win 65535, length 0
19:56:51.276085 IP 10.0.2.15.44100 > 151.101.117.164.443: Flags [.], ack 180251, win 65535, length 0
19:56:51.276925 IP 151.101.117.164.443 > 10.0.2.15.44100: Flags [P.], seq 181625:189869, ack 869, win 65535, length 8244
19:56:51.276929 IP 151.101.117.164.443 > 10.0.2.15.44100: Flags [P.], seq 189869:195365, ack 869, win 65535, length 5496
19:56:51.276945 IP 10.0.2.15.44100 > 151.101.117.164.443: Flags [.], ack 189869, win 65535, length 0
19:56:51.277001 IP 10.0.2.15.44100 > 151.101.117.164.443: Flags [.], ack 195365, win 65535, length 0
19:56:51.277069 IP 151.101.117.164.443 > 10.0.2.15.44100: Flags [P.], seq 195365:198113, ack 869, win 65535, length 2748
19:56:51.277074 IP 10.0.2.15.44100 > 151.101.117.164.443: Flags [.], ack 198113, win 65535, length 0
19:56:51.277223 IP 151.101.117.164.443 > 10.0.2.15.44100: Flags [P.], seq 198113:199487, ack 869, win 65535, length 1374
19:56:51.279391 IP 151.101.117.164.443 > 10.0.2.15.44100: Flags [P.], seq 199487:209105, ack 869, win 65535, length 9618
19:56:51.279395 IP 151.101.117.164.443 > 10.0.2.15.44100: Flags [P.], seq 209105:214601, ack 869, win 65535, length 5496
19:56:51.279419 IP 10.0.2.15.44100 > 151.101.117.164.443: Flags [.], ack 209105, win 65535, length 0
19:56:51.279573 IP 10.0.2.15.44100 > 151.101.117.164.443: Flags [.], ack 214601, win 65535, length 0
19:56:51.279606 IP 151.101.117.164.443 > 10.0.2.15.44100: Flags [P.], seq 214601:215975, ack 869, win 65535, length 1374
19:56:51.280511 IP 151.101.117.164.443 > 10.0.2.15.44100: Flags [P.], seq 215975:222845, ack 869, win 65535, length 6870
19:56:51.280514 IP 151.101.117.164.443 > 10.0.2.15.44100: Flags [.], seq 222845:227225, ack 869, win 65535, length 4380
19:56:51.280533 IP 10.0.2.15.44100 > 151.101.117.164.443: Flags [.], ack 222845, win 65535, length 0
19:56:51.280569 IP 10.0.2.15.44100 > 151.101.117.164.443: Flags [.], ack 227225, win 65535, length 0
19:56:51.280869 IP 151.101.117.164.443 > 10.0.2.15.44100: Flags [P.], seq 227225:231089, ack 869, win 65535, length 3864
19:56:51.280871 IP 151.101.117.164.443 > 10.0.2.15.44100: Flags [P.], seq 231089:233837, ack 869, win 65535, length 2748
19:56:51.280897 IP 151.101.117.164.443 > 10.0.2.15.44100: Flags [P.], seq 233837:235211, ack 869, win 65535, length 1374
19:56:51.280911 IP 10.0.2.15.44100 > 151.101.117.164.443: Flags [.], ack 231089, win 65535, length 0
19:56:51.280929 IP 10.0.2.15.44100 > 151.101.117.164.443: Flags [.], ack 233837, win 65535, length 0
19:56:51.283942 IP 151.101.117.164.443 > 10.0.2.15.44100: Flags [P.], seq 235211:243455, ack 869, win 65535, length 8244
19:56:51.283963 IP 10.0.2.15.44100 > 151.101.117.164.443: Flags [.], ack 243455, win 65535, length 0
19:56:51.285269 IP 151.101.117.164.443 > 10.0.2.15.44100: Flags [P.], seq 243455:253073, ack 869, win 65535, length 9618
19:56:51.285271 IP 151.101.117.164.443 > 10.0.2.15.44100: Flags [P.], seq 253073:255821, ack 869, win 65535, length 2748
19:56:51.285292 IP 10.0.2.15.44100 > 151.101.117.164.443: Flags [.], ack 253073, win 65535, length 0
19:56:51.285338 IP 10.0.2.15.44100 > 151.101.117.164.443: Flags [.], ack 255821, win 65535, length 0
19:56:51.285370 IP 151.101.117.164.443 > 10.0.2.15.44100: Flags [P.], seq 255821:258569, ack 869, win 65535, length 2748
19:56:51.285371 IP 151.101.117.164.443 > 10.0.2.15.44100: Flags [P.], seq 258569:259943, ack 869, win 65535, length 1374
19:56:51.285379 IP 10.0.2.15.44100 > 151.101.117.164.443: Flags [.], ack 258569, win 65535, length 0
19:56:51.287166 IP 151.101.117.164.443 > 10.0.2.15.44100: Flags [P.], seq 259943:269561, ack 869, win 65535, length 9618
19:56:51.287170 IP 151.101.117.164.443 > 10.0.2.15.44100: Flags [P.], seq 269561:277805, ack 869, win 65535, length 8244
19:56:51.287197 IP 10.0.2.15.44100 > 151.101.117.164.443: Flags [.], ack 269561, win 65535, length 0
19:56:51.287240 IP 10.0.2.15.44100 > 151.101.117.164.443: Flags [.], ack 277805, win 65535, length 0
19:56:51.287273 IP 151.101.117.164.443 > 10.0.2.15.44100: Flags [P.], seq 277805:279179, ack 869, win 65535, length 1374
19:56:51.288121 IP 151.101.117.164.443 > 10.0.2.15.44100: Flags [P.], seq 279179:286049, ack 869, win 65535, length 6870
19:56:51.288124 IP 151.101.117.164.443 > 10.0.2.15.44100: Flags [P.], seq 286049:288797, ack 869, win 65535, length 2748
19:56:51.288143 IP 10.0.2.15.44100 > 151.101.117.164.443: Flags [.], ack 286049, win 65535, length 0
19:56:51.288175 IP 10.0.2.15.44100 > 151.101.117.164.443: Flags [.], ack 288797, win 65535, length 0
19:56:51.288339 IP 151.101.117.164.443 > 10.0.2.15.44100: Flags [P.], seq 288797:291545, ack 869, win 65535, length 2748
19:56:51.288347 IP 10.0.2.15.44100 > 151.101.117.164.443: Flags [.], ack 291545, win 65535, length 0
19:56:51.288470 IP 151.101.117.164.443 > 10.0.2.15.44100: Flags [P.], seq 291545:294293, ack 869, win 65535, length 2748
19:56:51.288475 IP 10.0.2.15.44100 > 151.101.117.164.443: Flags [.], ack 294293, win 65535, length 0
19:56:51.288640 IP 151.101.117.164.443 > 10.0.2.15.44100: Flags [P.], seq 294293:297041, ack 869, win 65535, length 2748
19:56:51.288654 IP 10.0.2.15.44100 > 151.101.117.164.443: Flags [.], ack 297041, win 65535, length 0
19:56:51.290368 IP 151.101.117.164.443 > 10.0.2.15.44100: Flags [P.], seq 297041:306659, ack 869, win 65535, length 9618
19:56:51.290432 IP 151.101.117.164.443 > 10.0.2.15.44100: Flags [P.], seq 306659:312155, ack 869, win 65535, length 5496
19:56:51.290453 IP 10.0.2.15.44100 > 151.101.117.164.443: Flags [.], ack 306659, win 65535, length 0
19:56:51.290485 IP 10.0.2.15.44100 > 151.101.117.164.443: Flags [.], ack 312155, win 65535, length 0
19:56:51.290731 IP 151.101.117.164.443 > 10.0.2.15.44100: Flags [P.], seq 312155:314903, ack 869, win 65535, length 2748
19:56:51.290734 IP 151.101.117.164.443 > 10.0.2.15.44100: Flags [P.], seq 314903:319025, ack 869, win 65535, length 4122
19:56:51.290735 IP 151.101.117.164.443 > 10.0.2.15.44100: Flags [P.], seq 319025:323147, ack 869, win 65535, length 4122
19:56:51.290746 IP 10.0.2.15.44100 > 151.101.117.164.443: Flags [.], ack 314903, win 65535, length 0
19:56:51.290761 IP 10.0.2.15.44100 > 151.101.117.164.443: Flags [.], ack 319025, win 65535, length 0
19:56:51.290773 IP 10.0.2.15.44100 > 151.101.117.164.443: Flags [.], ack 323147, win 65535, length 0
19:56:51.291885 IP 151.101.117.164.443 > 10.0.2.15.44100: Flags [P.], seq 323147:330017, ack 869, win 65535, length 6870
19:56:51.291887 IP 151.101.117.164.443 > 10.0.2.15.44100: Flags [P.], seq 330017:332765, ack 869, win 65535, length 2748
19:56:51.291887 IP 151.101.117.164.443 > 10.0.2.15.44100: Flags [P.], seq 332765:335513, ack 869, win 65535, length 2748
19:56:51.291902 IP 10.0.2.15.44100 > 151.101.117.164.443: Flags [.], ack 330017, win 65535, length 0
19:56:51.291921 IP 10.0.2.15.44100 > 151.101.117.164.443: Flags [.], ack 332765, win 65535, length 0
19:56:51.291932 IP 10.0.2.15.44100 > 151.101.117.164.443: Flags [.], ack 335513, win 65535, length 0
19:56:51.292010 IP 151.101.117.164.443 > 10.0.2.15.44100: Flags [P.], seq 335513:338261, ack 869, win 65535, length 2748
19:56:51.292011 IP 151.101.117.164.443 > 10.0.2.15.44100: Flags [P.], seq 338261:341009, ack 869, win 65535, length 2748
19:56:51.292018 IP 10.0.2.15.44100 > 151.101.117.164.443: Flags [.], ack 338261, win 65535, length 0
19:56:51.292062 IP 10.0.2.15.44100 > 151.101.117.164.443: Flags [.], ack 341009, win 65535, length 0
19:56:51.292157 IP 151.101.117.164.443 > 10.0.2.15.44100: Flags [P.], seq 341009:343757, ack 869, win 65535, length 2748
19:56:51.292161 IP 10.0.2.15.44100 > 151.101.117.164.443: Flags [.], ack 343757, win 65535, length 0
19:56:51.292821 IP 151.101.117.164.443 > 10.0.2.15.44100: Flags [P.], seq 343757:349253, ack 869, win 65535, length 5496
19:56:51.292823 IP 151.101.117.164.443 > 10.0.2.15.44100: Flags [P.], seq 349253:350627, ack 869, win 65535, length 1374
19:56:51.292838 IP 10.0.2.15.44100 > 151.101.117.164.443: Flags [.], ack 349253, win 65535, length 0
19:56:51.292998 IP 151.101.117.164.443 > 10.0.2.15.44100: Flags [P.], seq 350627:353375, ack 869, win 65535, length 2748
19:56:51.293008 IP 10.0.2.15.44100 > 151.101.117.164.443: Flags [.], ack 353375, win 65535, length 0
19:56:51.293144 IP 151.101.117.164.443 > 10.0.2.15.44100: Flags [P.], seq 353375:356123, ack 869, win 65535, length 2748
19:56:51.293153 IP 10.0.2.15.44100 > 151.101.117.164.443: Flags [.], ack 356123, win 65535, length 0
19:56:51.293497 IP 151.101.117.164.443 > 10.0.2.15.44100: Flags [P.], seq 356123:360245, ack 869, win 65535, length 4122
19:56:51.293498 IP 151.101.117.164.443 > 10.0.2.15.44100: Flags [P.], seq 360245:362993, ack 869, win 65535, length 2748
19:56:51.293511 IP 10.0.2.15.44100 > 151.101.117.164.443: Flags [.], ack 360245, win 65535, length 0
19:56:51.293550 IP 10.0.2.15.44100 > 151.101.117.164.443: Flags [.], ack 362993, win 65535, length 0
19:56:51.294571 IP 151.101.117.164.443 > 10.0.2.15.44100: Flags [P.], seq 362993:368489, ack 869, win 65535, length 5496
19:56:51.294573 IP 151.101.117.164.443 > 10.0.2.15.44100: Flags [P.], seq 368489:369863, ack 869, win 65535, length 1374
19:56:51.294573 IP 151.101.117.164.443 > 10.0.2.15.44100: Flags [P.], seq 369863:373985, ack 869, win 65535, length 4122
19:56:51.294594 IP 10.0.2.15.44100 > 151.101.117.164.443: Flags [.], ack 368489, win 65535, length 0
19:56:51.294620 IP 10.0.2.15.44100 > 151.101.117.164.443: Flags [.], ack 373985, win 65535, length 0
19:56:51.294638 IP 151.101.117.164.443 > 10.0.2.15.44100: Flags [P.], seq 373985:375359, ack 869, win 65535, length 1374
19:56:51.294823 IP 151.101.117.164.443 > 10.0.2.15.44100: Flags [P.], seq 375359:380855, ack 869, win 65535, length 5496
19:56:51.294834 IP 10.0.2.15.44100 > 151.101.117.164.443: Flags [.], ack 380855, win 65535, length 0
19:56:51.295220 IP 151.101.117.164.443 > 10.0.2.15.44100: Flags [P.], seq 380855:387725, ack 869, win 65535, length 6870
19:56:51.295230 IP 10.0.2.15.44100 > 151.101.117.164.443: Flags [.], ack 387725, win 65535, length 0
19:56:51.295413 IP 151.101.117.164.443 > 10.0.2.15.44100: Flags [P.], seq 387725:389099, ack 869, win 65535, length 1374
19:56:51.295520 IP 151.101.117.164.443 > 10.0.2.15.44100: Flags [P.], seq 389099:390473, ack 869, win 65535, length 1374
19:56:51.295526 IP 10.0.2.15.44100 > 151.101.117.164.443: Flags [.], ack 390473, win 65535, length 0
19:56:51.297160 IP 151.101.117.164.443 > 10.0.2.15.44100: Flags [P.], seq 390473:400091, ack 869, win 65535, length 9618
19:56:51.297338 IP 10.0.2.15.44100 > 151.101.117.164.443: Flags [.], ack 400091, win 65535, length 0
19:56:51.297744 IP 151.101.117.164.443 > 10.0.2.15.44100: Flags [P.], seq 400091:405587, ack 869, win 65535, length 5496
19:56:51.297746 IP 151.101.117.164.443 > 10.0.2.15.44100: Flags [P.], seq 405587:409709, ack 869, win 65535, length 4122
19:56:51.297759 IP 10.0.2.15.44100 > 151.101.117.164.443: Flags [.], ack 405587, win 65535, length 0
19:56:51.297773 IP 10.0.2.15.44100 > 151.101.117.164.443: Flags [.], ack 409709, win 65535, length 0
19:56:51.302206 IP 151.101.117.164.443 > 10.0.2.15.44100: Flags [P.], seq 409709:422075, ack 869, win 65535, length 12366
19:56:51.302231 IP 10.0.2.15.44100 > 151.101.117.164.443: Flags [.], ack 422075, win 65535, length 0
19:56:51.302508 IP 151.101.117.164.443 > 10.0.2.15.44100: Flags [P.], seq 422075:427571, ack 869, win 65535, length 5496
19:56:51.302512 IP 151.101.117.164.443 > 10.0.2.15.44100: Flags [P.], seq 427571:433067, ack 869, win 65535, length 5496
19:56:51.302535 IP 10.0.2.15.44100 > 151.101.117.164.443: Flags [.], ack 427571, win 65535, length 0
19:56:51.302700 IP 10.0.2.15.44100 > 151.101.117.164.443: Flags [.], ack 433067, win 65535, length 0
19:56:51.302744 IP 151.101.117.164.443 > 10.0.2.15.44100: Flags [P.], seq 433067:438563, ack 869, win 65535, length 5496
19:56:51.302753 IP 10.0.2.15.44100 > 151.101.117.164.443: Flags [.], ack 438563, win 65535, length 0
19:56:51.303889 IP 151.101.117.164.443 > 10.0.2.15.44100: Flags [P.], seq 438563:442685, ack 869, win 65535, length 4122
19:56:51.303894 IP 151.101.117.164.443 > 10.0.2.15.44100: Flags [P.], seq 442685:448181, ack 869, win 65535, length 5496
19:56:51.303921 IP 10.0.2.15.44100 > 151.101.117.164.443: Flags [.], ack 442685, win 65535, length 0
19:56:51.304193 IP 10.0.2.15.44100 > 151.101.117.164.443: Flags [.], ack 448181, win 65535, length 0
19:56:51.304514 IP 151.101.117.164.443 > 10.0.2.15.44100: Flags [P.], seq 448181:450929, ack 869, win 65535, length 2748
19:56:51.304517 IP 151.101.117.164.443 > 10.0.2.15.44100: Flags [P.], seq 450929:456425, ack 869, win 65535, length 5496
19:56:51.304519 IP 151.101.117.164.443 > 10.0.2.15.44100: Flags [P.], seq 456425:464669, ack 869, win 65535, length 8244
19:56:51.304531 IP 10.0.2.15.44100 > 151.101.117.164.443: Flags [.], ack 450929, win 65535, length 0
19:56:51.304545 IP 10.0.2.15.44100 > 151.101.117.164.443: Flags [.], ack 456425, win 65535, length 0
19:56:51.304625 IP 10.0.2.15.44100 > 151.101.117.164.443: Flags [.], ack 464669, win 65535, length 0
19:56:51.304690 IP 151.101.117.164.443 > 10.0.2.15.44100: Flags [P.], seq 464669:470165, ack 869, win 65535, length 5496
19:56:51.304691 IP 151.101.117.164.443 > 10.0.2.15.44100: Flags [P.], seq 470165:472913, ack 869, win 65535, length 2748
19:56:51.304691 IP 151.101.117.164.443 > 10.0.2.15.44100: Flags [P.], seq 472913:475661, ack 869, win 65535, length 2748
19:56:51.304697 IP 10.0.2.15.44100 > 151.101.117.164.443: Flags [.], ack 470165, win 65535, length 0
19:56:51.304710 IP 10.0.2.15.44100 > 151.101.117.164.443: Flags [.], ack 472913, win 65535, length 0
19:56:51.304723 IP 10.0.2.15.44100 > 151.101.117.164.443: Flags [.], ack 475661, win 65535, length 0
19:56:51.304745 IP 151.101.117.164.443 > 10.0.2.15.44100: Flags [P.], seq 475661:481157, ack 869, win 65535, length 5496
19:56:51.304753 IP 10.0.2.15.44100 > 151.101.117.164.443: Flags [.], ack 481157, win 65535, length 0
19:56:51.304948 IP 151.101.117.164.443 > 10.0.2.15.44100: Flags [P.], seq 481157:483905, ack 869, win 65535, length 2748
19:56:51.304950 IP 151.101.117.164.443 > 10.0.2.15.44100: Flags [P.], seq 483905:485279, ack 869, win 65535, length 1374
19:56:51.304964 IP 10.0.2.15.44100 > 151.101.117.164.443: Flags [.], ack 483905, win 65535, length 0
19:56:51.305178 IP 151.101.117.164.443 > 10.0.2.15.44100: Flags [P.], seq 485279:488027, ack 869, win 65535, length 2748
19:56:51.305200 IP 10.0.2.15.44100 > 151.101.117.164.443: Flags [.], ack 488027, win 65535, length 0
19:56:51.305952 IP 151.101.117.164.443 > 10.0.2.15.44100: Flags [P.], seq 488027:493523, ack 869, win 65535, length 5496
19:56:51.305954 IP 151.101.117.164.443 > 10.0.2.15.44100: Flags [P.], seq 493523:494897, ack 869, win 65535, length 1374
19:56:51.305973 IP 10.0.2.15.44100 > 151.101.117.164.443: Flags [.], ack 493523, win 65535, length 0
19:56:51.306156 IP 151.101.117.164.443 > 10.0.2.15.44100: Flags [P.], seq 494897:500393, ack 869, win 65535, length 5496
19:56:51.306163 IP 10.0.2.15.44100 > 151.101.117.164.443: Flags [.], ack 500393, win 65535, length 0
19:56:51.306410 IP 151.101.117.164.443 > 10.0.2.15.44100: Flags [P.], seq 500393:505889, ack 869, win 65535, length 5496
19:56:51.306422 IP 10.0.2.15.44100 > 151.101.117.164.443: Flags [.], ack 505889, win 65535, length 0
19:56:51.306545 IP 151.101.117.164.443 > 10.0.2.15.44100: Flags [P.], seq 505889:508637, ack 869, win 65535, length 2748
19:56:51.306553 IP 10.0.2.15.44100 > 151.101.117.164.443: Flags [.], ack 508637, win 65535, length 0
19:56:51.306664 IP 151.101.117.164.443 > 10.0.2.15.44100: Flags [P.], seq 508637:511385, ack 869, win 65535, length 2748
19:56:51.306672 IP 10.0.2.15.44100 > 151.101.117.164.443: Flags [.], ack 511385, win 65535, length 0
19:56:51.306903 IP 151.101.117.164.443 > 10.0.2.15.44100: Flags [P.], seq 511385:512759, ack 869, win 65535, length 1374
19:56:51.306904 IP 151.101.117.164.443 > 10.0.2.15.44100: Flags [P.], seq 512759:516881, ack 869, win 65535, length 4122
19:56:51.306915 IP 10.0.2.15.44100 > 151.101.117.164.443: Flags [.], ack 516881, win 65535, length 0
19:56:51.307074 IP 151.101.117.164.443 > 10.0.2.15.44100: Flags [P.], seq 516881:518255, ack 869, win 65535, length 1374
19:56:51.307232 IP 151.101.117.164.443 > 10.0.2.15.44100: Flags [P.], seq 518255:522377, ack 869, win 65535, length 4122
19:56:51.307239 IP 10.0.2.15.44100 > 151.101.117.164.443: Flags [.], ack 522377, win 65535, length 0
19:56:51.307541 IP 151.101.117.164.443 > 10.0.2.15.44100: Flags [P.], seq 522377:525125, ack 869, win 65535, length 2748
19:56:51.307542 IP 151.101.117.164.443 > 10.0.2.15.44100: Flags [P.], seq 525125:526499, ack 869, win 65535, length 1374
19:56:51.307553 IP 10.0.2.15.44100 > 151.101.117.164.443: Flags [.], ack 525125, win 65535, length 0
19:56:51.307764 IP 151.101.117.164.443 > 10.0.2.15.44100: Flags [P.], seq 526499:530621, ack 869, win 65535, length 4122
19:56:51.307765 IP 151.101.117.164.443 > 10.0.2.15.44100: Flags [P.], seq 530621:531995, ack 869, win 65535, length 1374
19:56:51.307774 IP 10.0.2.15.44100 > 151.101.117.164.443: Flags [.], ack 530621, win 65535, length 0
19:56:51.308812 IP 151.101.117.164.443 > 10.0.2.15.44100: Flags [P.], seq 531995:538865, ack 869, win 65535, length 6870
19:56:51.308828 IP 10.0.2.15.44100 > 151.101.117.164.443: Flags [.], ack 538865, win 65535, length 0
19:56:51.309196 IP 151.101.117.164.443 > 10.0.2.15.44100: Flags [P.], seq 538865:542987, ack 869, win 65535, length 4122
19:56:51.309198 IP 151.101.117.164.443 > 10.0.2.15.44100: Flags [P.], seq 542987:547109, ack 869, win 65535, length 4122
19:56:51.309199 IP 151.101.117.164.443 > 10.0.2.15.44100: Flags [P.], seq 547109:549857, ack 869, win 65535, length 2748
19:56:51.309212 IP 10.0.2.15.44100 > 151.101.117.164.443: Flags [.], ack 542987, win 65535, length 0
19:56:51.309257 IP 10.0.2.15.44100 > 151.101.117.164.443: Flags [.], ack 547109, win 65535, length 0
19:56:51.309266 IP 10.0.2.15.44100 > 151.101.117.164.443: Flags [.], ack 549857, win 65535, length 0
19:56:51.309344 IP 151.101.117.164.443 > 10.0.2.15.44100: Flags [P.], seq 549857:553979, ack 869, win 65535, length 4122
19:56:51.309354 IP 10.0.2.15.44100 > 151.101.117.164.443: Flags [.], ack 553979, win 65535, length 0
19:56:51.309675 IP 151.101.117.164.443 > 10.0.2.15.44100: Flags [P.], seq 553979:556727, ack 869, win 65535, length 2748
19:56:51.309683 IP 10.0.2.15.44100 > 151.101.117.164.443: Flags [.], ack 556727, win 65535, length 0
19:56:51.309933 IP 151.101.117.164.443 > 10.0.2.15.44100: Flags [P.], seq 556727:558101, ack 869, win 65535, length 1374
19:56:51.309935 IP 151.101.117.164.443 > 10.0.2.15.44100: Flags [P.], seq 558101:562223, ack 869, win 65535, length 4122
19:56:51.309936 IP 151.101.117.164.443 > 10.0.2.15.44100: Flags [P.], seq 562223:564971, ack 869, win 65535, length 2748
19:56:51.310094 IP 10.0.2.15.44100 > 151.101.117.164.443: Flags [.], ack 562223, win 65535, length 0
19:56:51.310211 IP 10.0.2.15.44100 > 151.101.117.164.443: Flags [.], ack 564971, win 65535, length 0
19:56:51.310484 IP 151.101.117.164.443 > 10.0.2.15.44100: Flags [P.], seq 564971:567719, ack 869, win 65535, length 2748
19:56:51.310486 IP 151.101.117.164.443 > 10.0.2.15.44100: Flags [P.], seq 567719:569093, ack 869, win 65535, length 1374
19:56:51.310487 IP 151.101.117.164.443 > 10.0.2.15.44100: Flags [P.], seq 569093:573215, ack 869, win 65535, length 4122
19:56:51.310497 IP 10.0.2.15.44100 > 151.101.117.164.443: Flags [.], ack 567719, win 65535, length 0
19:56:51.310515 IP 10.0.2.15.44100 > 151.101.117.164.443: Flags [.], ack 573215, win 65535, length 0
19:56:51.310638 IP 151.101.117.164.443 > 10.0.2.15.44100: Flags [P.], seq 573215:578711, ack 869, win 65535, length 5496
19:56:51.310644 IP 10.0.2.15.44100 > 151.101.117.164.443: Flags [.], ack 578711, win 65535, length 0
19:56:51.310929 IP 151.101.117.164.443 > 10.0.2.15.44100: Flags [P.], seq 578711:581459, ack 869, win 65535, length 2748
19:56:51.310931 IP 151.101.117.164.443 > 10.0.2.15.44100: Flags [P.], seq 581459:584207, ack 869, win 65535, length 2748
19:56:51.310988 IP 10.0.2.15.44100 > 151.101.117.164.443: Flags [.], ack 581459, win 65535, length 0
19:56:51.311051 IP 10.0.2.15.44100 > 151.101.117.164.443: Flags [.], ack 584207, win 65535, length 0
19:56:51.311318 IP 151.101.117.164.443 > 10.0.2.15.44100: Flags [P.], seq 584207:586955, ack 869, win 65535, length 2748
19:56:51.311319 IP 151.101.117.164.443 > 10.0.2.15.44100: Flags [P.], seq 586955:589703, ack 869, win 65535, length 2748
19:56:51.311329 IP 10.0.2.15.44100 > 151.101.117.164.443: Flags [.], ack 586955, win 65535, length 0
19:56:51.311379 IP 10.0.2.15.44100 > 151.101.117.164.443: Flags [.], ack 589703, win 65535, length 0
19:56:51.311520 IP 151.101.117.164.443 > 10.0.2.15.44100: Flags [P.], seq 589703:592451, ack 869, win 65535, length 2748
19:56:51.311522 IP 151.101.117.164.443 > 10.0.2.15.44100: Flags [P.], seq 592451:595199, ack 869, win 65535, length 2748
19:56:51.311533 IP 10.0.2.15.44100 > 151.101.117.164.443: Flags [.], ack 592451, win 65535, length 0
19:56:51.311634 IP 10.0.2.15.44100 > 151.101.117.164.443: Flags [.], ack 595199, win 65535, length 0
19:56:51.311859 IP 151.101.117.164.443 > 10.0.2.15.44100: Flags [P.], seq 595199:597947, ack 869, win 65535, length 2748
19:56:51.311860 IP 151.101.117.164.443 > 10.0.2.15.44100: Flags [P.], seq 597947:600695, ack 869, win 65535, length 2748
19:56:51.311861 IP 151.101.117.164.443 > 10.0.2.15.44100: Flags [P.], seq 600695:603443, ack 869, win 65535, length 2748
19:56:51.311868 IP 10.0.2.15.44100 > 151.101.117.164.443: Flags [.], ack 597947, win 65535, length 0
19:56:51.311883 IP 10.0.2.15.44100 > 151.101.117.164.443: Flags [.], ack 600695, win 65535, length 0
19:56:51.311894 IP 10.0.2.15.44100 > 151.101.117.164.443: Flags [.], ack 603443, win 65535, length 0
19:56:51.312453 IP 151.101.117.164.443 > 10.0.2.15.44100: Flags [P.], seq 603443:608939, ack 869, win 65535, length 5496
19:56:51.312957 IP 10.0.2.15.44100 > 151.101.117.164.443: Flags [.], ack 608939, win 65535, length 0
19:56:51.313333 IP 151.101.117.164.443 > 10.0.2.15.44100: Flags [P.], seq 608939:615809, ack 869, win 65535, length 6870
19:56:51.313395 IP 10.0.2.15.44100 > 151.101.117.164.443: Flags [.], ack 615809, win 65535, length 0
19:56:51.313741 IP 151.101.117.164.443 > 10.0.2.15.44100: Flags [P.], seq 615809:618557, ack 869, win 65535, length 2748
19:56:51.313743 IP 151.101.117.164.443 > 10.0.2.15.44100: Flags [P.], seq 618557:621305, ack 869, win 65535, length 2748
19:56:51.313744 IP 151.101.117.164.443 > 10.0.2.15.44100: Flags [P.], seq 621305:624053, ack 869, win 65535, length 2748
19:56:51.313745 IP 151.101.117.164.443 > 10.0.2.15.44100: Flags [P.], seq 624053:628175, ack 869, win 65535, length 4122
19:56:51.313762 IP 10.0.2.15.44100 > 151.101.117.164.443: Flags [.], ack 618557, win 65535, length 0
19:56:51.313781 IP 10.0.2.15.44100 > 151.101.117.164.443: Flags [.], ack 621305, win 65535, length 0
19:56:51.313791 IP 10.0.2.15.44100 > 151.101.117.164.443: Flags [.], ack 624053, win 65535, length 0
19:56:51.313797 IP 10.0.2.15.44100 > 151.101.117.164.443: Flags [.], ack 628175, win 65535, length 0
19:56:51.314014 IP 151.101.117.164.443 > 10.0.2.15.44100: Flags [P.], seq 628175:630923, ack 869, win 65535, length 2748
19:56:51.314131 IP 151.101.117.164.443 > 10.0.2.15.44100: Flags [P.], seq 630923:636419, ack 869, win 65535, length 5496
19:56:51.314288 IP 151.101.117.164.443 > 10.0.2.15.44100: Flags [P.], seq 636419:639167, ack 869, win 65535, length 2748
19:56:51.314490 IP 151.101.117.164.443 > 10.0.2.15.44100: Flags [P.], seq 639167:641915, ack 869, win 65535, length 2748
19:56:51.314491 IP 151.101.117.164.443 > 10.0.2.15.44100: Flags [P.], seq 641915:644663, ack 869, win 65535, length 2748
19:56:51.314658 IP 151.101.117.164.443 > 10.0.2.15.44100: Flags [P.], seq 644663:648785, ack 869, win 65535, length 4122
19:56:51.315225 IP 151.101.117.164.443 > 10.0.2.15.44100: Flags [P.], seq 648785:651533, ack 869, win 65535, length 2748
19:56:51.315227 IP 151.101.117.164.443 > 10.0.2.15.44100: Flags [P.], seq 651533:655655, ack 869, win 65535, length 4122
19:56:51.315369 IP 151.101.117.164.443 > 10.0.2.15.44100: Flags [P.], seq 655655:659777, ack 869, win 65535, length 4122
19:56:51.315370 IP 151.101.117.164.443 > 10.0.2.15.44100: Flags [P.], seq 659777:662525, ack 869, win 65535, length 2748
19:56:51.315500 IP 10.0.2.15.44100 > 151.101.117.164.443: Flags [.], ack 662525, win 65535, length 0
19:56:51.316083 IP 151.101.117.164.443 > 10.0.2.15.44100: Flags [P.], seq 662525:672143, ack 869, win 65535, length 9618
19:56:51.316147 IP 151.101.117.164.443 > 10.0.2.15.44100: Flags [P.], seq 672143:674891, ack 869, win 65535, length 2748
19:56:51.316164 IP 10.0.2.15.44100 > 151.101.117.164.443: Flags [.], ack 672143, win 65535, length 0
19:56:51.316201 IP 151.101.117.164.443 > 10.0.2.15.44100: Flags [P.], seq 674891:679013, ack 869, win 65535, length 4122
19:56:51.316202 IP 151.101.117.164.443 > 10.0.2.15.44100: Flags [P.], seq 679013:683135, ack 869, win 65535, length 4122
19:56:51.316426 IP 151.101.117.164.443 > 10.0.2.15.44100: Flags [P.], seq 683135:685883, ack 869, win 65535, length 2748
19:56:51.316428 IP 151.101.117.164.443 > 10.0.2.15.44100: Flags [P.], seq 685883:687257, ack 869, win 65535, length 1374
19:56:51.316459 IP 10.0.2.15.44100 > 151.101.117.164.443: Flags [.], ack 683135, win 65535, length 0
19:56:51.316489 IP 10.0.2.15.44100 > 151.101.117.164.443: Flags [.], ack 687257, win 65535, length 0
19:56:51.316650 IP 151.101.117.164.443 > 10.0.2.15.44100: Flags [P.], seq 687257:691379, ack 869, win 65535, length 4122
19:56:51.316712 IP 10.0.2.15.44100 > 151.101.117.164.443: Flags [.], ack 691379, win 65535, length 0
19:56:51.316973 IP 151.101.117.164.443 > 10.0.2.15.44100: Flags [P.], seq 691379:694127, ack 869, win 65535, length 2748
19:56:51.316974 IP 151.101.117.164.443 > 10.0.2.15.44100: Flags [P.], seq 694127:695501, ack 869, win 65535, length 1374
19:56:51.316974 IP 151.101.117.164.443 > 10.0.2.15.44100: Flags [P.], seq 695501:696875, ack 869, win 65535, length 1374
19:56:51.317012 IP 10.0.2.15.44100 > 151.101.117.164.443: Flags [.], ack 696875, win 65535, length 0
19:56:51.317382 IP 151.101.117.164.443 > 10.0.2.15.44100: Flags [P.], seq 696875:700997, ack 869, win 65535, length 4122
19:56:51.317426 IP 10.0.2.15.44100 > 151.101.117.164.443: Flags [.], ack 700997, win 65535, length 0
19:56:51.317632 IP 151.101.117.164.443 > 10.0.2.15.44100: Flags [P.], seq 700997:705119, ack 869, win 65535, length 4122
19:56:51.317633 IP 151.101.117.164.443 > 10.0.2.15.44100: Flags [P.], seq 705119:706493, ack 869, win 65535, length 1374
19:56:51.317654 IP 10.0.2.15.44100 > 151.101.117.164.443: Flags [.], ack 706493, win 65535, length 0
19:56:51.317930 IP 151.101.117.164.443 > 10.0.2.15.44100: Flags [P.], seq 706493:710615, ack 869, win 65535, length 4122
19:56:51.317931 IP 151.101.117.164.443 > 10.0.2.15.44100: Flags [P.], seq 710615:713363, ack 869, win 65535, length 2748
19:56:51.318189 IP 151.101.117.164.443 > 10.0.2.15.44100: Flags [.], seq 713363:714823, ack 869, win 65535, length 1460
19:56:51.318542 IP 151.101.117.164.443 > 10.0.2.15.44100: Flags [P.], seq 714823:716111, ack 869, win 65535, length 1288
19:56:51.318545 IP 151.101.117.164.443 > 10.0.2.15.44100: Flags [P.], seq 716111:722981, ack 869, win 65535, length 6870
19:56:51.318564 IP 10.0.2.15.44100 > 151.101.117.164.443: Flags [.], ack 716111, win 65535, length 0
19:56:51.318821 IP 151.101.117.164.443 > 10.0.2.15.44100: Flags [P.], seq 722981:728477, ack 869, win 65535, length 5496
19:56:51.318822 IP 151.101.117.164.443 > 10.0.2.15.44100: Flags [P.], seq 728477:731225, ack 869, win 65535, length 2748
19:56:51.318823 IP 151.101.117.164.443 > 10.0.2.15.44100: Flags [P.], seq 731225:733973, ack 869, win 65535, length 2748
19:56:51.319057 IP 151.101.117.164.443 > 10.0.2.15.44100: Flags [P.], seq 733973:739469, ack 869, win 65535, length 5496
19:56:51.319088 IP 10.0.2.15.44100 > 151.101.117.164.443: Flags [.], ack 739469, win 65535, length 0
19:56:51.319480 IP 151.101.117.164.443 > 10.0.2.15.44100: Flags [P.], seq 739469:743591, ack 869, win 65535, length 4122
19:56:51.319482 IP 151.101.117.164.443 > 10.0.2.15.44100: Flags [P.], seq 743591:746339, ack 869, win 65535, length 2748
19:56:51.319535 IP 10.0.2.15.44100 > 151.101.117.164.443: Flags [.], ack 743591, win 65535, length 0
19:56:51.319559 IP 10.0.2.15.44100 > 151.101.117.164.443: Flags [.], ack 746339, win 65535, length 0
19:56:51.319949 IP 151.101.117.164.443 > 10.0.2.15.44100: Flags [P.], seq 746339:749087, ack 869, win 65535, length 2748
19:56:51.319951 IP 151.101.117.164.443 > 10.0.2.15.44100: Flags [P.], seq 749087:751835, ack 869, win 65535, length 2748
19:56:51.319952 IP 151.101.117.164.443 > 10.0.2.15.44100: Flags [P.], seq 751835:754583, ack 869, win 65535, length 2748
19:56:51.319953 IP 151.101.117.164.443 > 10.0.2.15.44100: Flags [P.], seq 754583:757331, ack 869, win 65535, length 2748
19:56:51.319968 IP 10.0.2.15.44100 > 151.101.117.164.443: Flags [.], ack 749087, win 65535, length 0
19:56:51.320338 IP 10.0.2.15.44100 > 151.101.117.164.443: Flags [.], ack 751835, win 65535, length 0
19:56:51.320411 IP 10.0.2.15.44100 > 151.101.117.164.443: Flags [.], ack 754583, win 65535, length 0
19:56:51.320588 IP 10.0.2.15.44100 > 151.101.117.164.443: Flags [.], ack 757331, win 65535, length 0
19:56:51.320705 IP 151.101.117.164.443 > 10.0.2.15.44100: Flags [P.], seq 757331:762827, ack 869, win 65535, length 5496
19:56:51.320707 IP 151.101.117.164.443 > 10.0.2.15.44100: Flags [P.], seq 762827:766949, ack 869, win 65535, length 4122
19:56:51.320707 IP 151.101.117.164.443 > 10.0.2.15.44100: Flags [P.], seq 766949:769697, ack 869, win 65535, length 2748
19:56:51.320717 IP 10.0.2.15.44100 > 151.101.117.164.443: Flags [.], ack 762827, win 65535, length 0
19:56:51.320732 IP 10.0.2.15.44100 > 151.101.117.164.443: Flags [.], ack 766949, win 65535, length 0
19:56:51.320792 IP 10.0.2.15.44100 > 151.101.117.164.443: Flags [.], ack 769697, win 65535, length 0
19:56:51.320816 IP 151.101.117.164.443 > 10.0.2.15.44100: Flags [P.], seq 769697:775193, ack 869, win 65535, length 5496
19:56:51.320817 IP 151.101.117.164.443 > 10.0.2.15.44100: Flags [.], seq 775193:778113, ack 869, win 65535, length 2920
19:56:51.320824 IP 10.0.2.15.44100 > 151.101.117.164.443: Flags [.], ack 775193, win 65535, length 0
19:56:51.320886 IP 10.0.2.15.44100 > 151.101.117.164.443: Flags [.], ack 778113, win 65535, length 0
19:56:51.321042 IP 151.101.117.164.443 > 10.0.2.15.44100: Flags [P.], seq 778113:779315, ack 869, win 65535, length 1202
19:56:51.321043 IP 151.101.117.164.443 > 10.0.2.15.44100: Flags [P.], seq 779315:782063, ack 869, win 65535, length 2748
19:56:51.321052 IP 10.0.2.15.44100 > 151.101.117.164.443: Flags [.], ack 782063, win 65535, length 0
19:56:51.326526 IP 151.101.117.164.443 > 10.0.2.15.44100: Flags [P.], seq 782063:793055, ack 869, win 65535, length 10992
19:56:51.326563 IP 10.0.2.15.44100 > 151.101.117.164.443: Flags [.], ack 793055, win 65535, length 0
19:56:51.327010 IP 151.101.117.164.443 > 10.0.2.15.44100: Flags [P.], seq 793055:799925, ack 869, win 65535, length 6870
19:56:51.327026 IP 10.0.2.15.44100 > 151.101.117.164.443: Flags [.], ack 799925, win 65535, length 0
19:56:51.328021 IP 151.101.117.164.443 > 10.0.2.15.44100: Flags [P.], seq 799925:858325, ack 869, win 65535, length 58400
19:56:51.328033 IP 10.0.2.15.44100 > 151.101.117.164.443: Flags [.], ack 858325, win 65535, length 0
19:56:51.328299 IP 151.101.117.164.443 > 10.0.2.15.44100: Flags [P.], seq 858325:869999, ack 869, win 65535, length 11674
19:56:51.328309 IP 10.0.2.15.44100 > 151.101.117.164.443: Flags [.], ack 869999, win 65535, length 0
19:56:51.331819 IP 151.101.117.164.443 > 10.0.2.15.44100: Flags [P.], seq 869999:883739, ack 869, win 65535, length 13740
19:56:51.331840 IP 10.0.2.15.44100 > 151.101.117.164.443: Flags [.], ack 883739, win 65535, length 0
19:56:51.332520 IP 151.101.117.164.443 > 10.0.2.15.44100: Flags [.], seq 883739:886659, ack 869, win 65535, length 2920
19:56:51.332684 IP 10.0.2.15.44100 > 151.101.117.164.443: Flags [.], ack 886659, win 65535, length 0
19:56:51.333067 IP 151.101.117.164.443 > 10.0.2.15.44100: Flags [P.], seq 886659:890609, ack 869, win 65535, length 3950
19:56:51.333098 IP 151.101.117.164.443 > 10.0.2.15.44100: Flags [P.], seq 890609:896105, ack 869, win 65535, length 5496
19:56:51.333099 IP 151.101.117.164.443 > 10.0.2.15.44100: Flags [P.], seq 896105:900227, ack 869, win 65535, length 4122
19:56:51.333114 IP 10.0.2.15.44100 > 151.101.117.164.443: Flags [.], ack 890609, win 65535, length 0
19:56:51.333155 IP 10.0.2.15.44100 > 151.101.117.164.443: Flags [.], ack 896105, win 65535, length 0
19:56:51.333289 IP 10.0.2.15.44100 > 151.101.117.164.443: Flags [.], ack 900227, win 65535, length 0
19:56:51.333351 IP 151.101.117.164.443 > 10.0.2.15.44100: Flags [P.], seq 900227:901601, ack 869, win 65535, length 1374
19:56:51.333353 IP 151.101.117.164.443 > 10.0.2.15.44100: Flags [P.], seq 901601:907097, ack 869, win 65535, length 5496
19:56:51.333354 IP 151.101.117.164.443 > 10.0.2.15.44100: Flags [P.], seq 907097:913967, ack 869, win 65535, length 6870
19:56:51.333412 IP 10.0.2.15.44100 > 151.101.117.164.443: Flags [.], ack 907097, win 65535, length 0
19:56:51.333429 IP 10.0.2.15.44100 > 151.101.117.164.443: Flags [.], ack 913967, win 65535, length 0
19:56:51.333567 IP 151.101.117.164.443 > 10.0.2.15.44100: Flags [P.], seq 913967:919463, ack 869, win 65535, length 5496
19:56:51.333569 IP 151.101.117.164.443 > 10.0.2.15.44100: Flags [P.], seq 919463:923585, ack 869, win 65535, length 4122
19:56:51.333569 IP 151.101.117.164.443 > 10.0.2.15.44100: Flags [P.], seq 923585:926333, ack 869, win 65535, length 2748
19:56:51.333580 IP 10.0.2.15.44100 > 151.101.117.164.443: Flags [.], ack 919463, win 65535, length 0
19:56:51.333635 IP 10.0.2.15.44100 > 151.101.117.164.443: Flags [.], ack 923585, win 65535, length 0
19:56:51.333703 IP 10.0.2.15.44100 > 151.101.117.164.443: Flags [.], ack 926333, win 65535, length 0
19:56:51.334588 IP 151.101.117.164.443 > 10.0.2.15.44100: Flags [P.], seq 926333:929081, ack 869, win 65535, length 2748
19:56:51.334601 IP 10.0.2.15.44100 > 151.101.117.164.443: Flags [.], ack 929081, win 65535, length 0
19:56:51.335279 IP 151.101.117.164.443 > 10.0.2.15.44100: Flags [P.], seq 929081:931829, ack 869, win 65535, length 2748
19:56:51.335281 IP 151.101.117.164.443 > 10.0.2.15.44100: Flags [P.], seq 931829:935951, ack 869, win 65535, length 4122
19:56:51.335281 IP 151.101.117.164.443 > 10.0.2.15.44100: Flags [P.], seq 935951:938699, ack 869, win 65535, length 2748
19:56:51.335282 IP 151.101.117.164.443 > 10.0.2.15.44100: Flags [P.], seq 938699:942821, ack 869, win 65535, length 4122
19:56:51.335295 IP 10.0.2.15.44100 > 151.101.117.164.443: Flags [.], ack 931829, win 65535, length 0
19:56:51.335314 IP 10.0.2.15.44100 > 151.101.117.164.443: Flags [.], ack 935951, win 65535, length 0
19:56:51.335324 IP 10.0.2.15.44100 > 151.101.117.164.443: Flags [.], ack 938699, win 65535, length 0
19:56:51.335329 IP 10.0.2.15.44100 > 151.101.117.164.443: Flags [.], ack 942821, win 65535, length 0
19:56:51.335349 IP 151.101.117.164.443 > 10.0.2.15.44100: Flags [P.], seq 942821:944195, ack 869, win 65535, length 1374
19:56:51.335350 IP 151.101.117.164.443 > 10.0.2.15.44100: Flags [P.], seq 944195:946943, ack 869, win 65535, length 2748
19:56:51.335350 IP 151.101.117.164.443 > 10.0.2.15.44100: Flags [P.], seq 946943:950193, ack 869, win 65535, length 3250
19:56:51.335351 IP 151.101.117.164.443 > 10.0.2.15.44100: Flags [P.], seq 950193:954315, ack 869, win 65535, length 4122
19:56:51.335361 IP 151.101.117.164.443 > 10.0.2.15.44100: Flags [P.], seq 954315:957063, ack 869, win 65535, length 2748
19:56:51.335419 IP 10.0.2.15.44100 > 151.101.117.164.443: Flags [.], ack 957063, win 65535, length 0
19:56:51.335896 IP 151.101.117.164.443 > 10.0.2.15.44100: Flags [P.], seq 957063:963933, ack 869, win 65535, length 6870
19:56:51.335908 IP 10.0.2.15.44100 > 151.101.117.164.443: Flags [.], ack 963933, win 65535, length 0
19:56:51.336121 IP 151.101.117.164.443 > 10.0.2.15.44100: Flags [P.], seq 963933:968055, ack 869, win 65535, length 4122
19:56:51.336122 IP 151.101.117.164.443 > 10.0.2.15.44100: Flags [P.], seq 968055:970803, ack 869, win 65535, length 2748
19:56:51.336181 IP 10.0.2.15.44100 > 151.101.117.164.443: Flags [.], ack 968055, win 65535, length 0
19:56:51.336196 IP 10.0.2.15.44100 > 151.101.117.164.443: Flags [.], ack 970803, win 65535, length 0
19:56:51.336318 IP 151.101.117.164.443 > 10.0.2.15.44100: Flags [P.], seq 970803:974925, ack 869, win 65535, length 4122
19:56:51.336327 IP 10.0.2.15.44100 > 151.101.117.164.443: Flags [.], ack 974925, win 65535, length 0
19:56:51.336535 IP 151.101.117.164.443 > 10.0.2.15.44100: Flags [P.], seq 974925:977673, ack 869, win 65535, length 2748
19:56:51.336545 IP 10.0.2.15.44100 > 151.101.117.164.443: Flags [.], ack 977673, win 65535, length 0
19:56:51.336656 IP 151.101.117.164.443 > 10.0.2.15.44100: Flags [P.], seq 977673:983169, ack 869, win 65535, length 5496
19:56:51.336786 IP 10.0.2.15.44100 > 151.101.117.164.443: Flags [.], ack 983169, win 65535, length 0
19:56:51.337164 IP 151.101.117.164.443 > 10.0.2.15.44100: Flags [P.], seq 983169:987291, ack 869, win 65535, length 4122
19:56:51.337206 IP 151.101.117.164.443 > 10.0.2.15.44100: Flags [P.], seq 987291:990039, ack 869, win 65535, length 2748
19:56:51.337208 IP 151.101.117.164.443 > 10.0.2.15.44100: Flags [P.], seq 990039:995033, ack 869, win 65535, length 4994
19:56:51.337371 IP 10.0.2.15.44100 > 151.101.117.164.443: Flags [.], ack 995033, win 65535, length 0
19:56:51.337542 IP 151.101.117.164.443 > 10.0.2.15.44100: Flags [P.], seq 995033:996407, ack 869, win 65535, length 1374
19:56:51.338074 IP 151.101.117.164.443 > 10.0.2.15.44100: Flags [P.], seq 996407:1000529, ack 869, win 65535, length 4122
19:56:51.338136 IP 10.0.2.15.44100 > 151.101.117.164.443: Flags [.], ack 1000529, win 65535, length 0
19:56:51.338324 IP 151.101.117.164.443 > 10.0.2.15.44100: Flags [P.], seq 1000529:1006025, ack 869, win 65535, length 5496
19:56:51.338334 IP 10.0.2.15.44100 > 151.101.117.164.443: Flags [.], ack 1006025, win 65535, length 0
19:56:51.338458 IP 151.101.117.164.443 > 10.0.2.15.44100: Flags [P.], seq 1006025:1010147, ack 869, win 65535, length 4122
19:56:51.338514 IP 10.0.2.15.44100 > 151.101.117.164.443: Flags [.], ack 1010147, win 65535, length 0
19:56:51.338719 IP 151.101.117.164.443 > 10.0.2.15.44100: Flags [P.], seq 1010147:1012895, ack 869, win 65535, length 2748
19:56:51.338721 IP 151.101.117.164.443 > 10.0.2.15.44100: Flags [P.], seq 1012895:1017017, ack 869, win 65535, length 4122
19:56:51.338788 IP 151.101.117.164.443 > 10.0.2.15.44100: Flags [P.], seq 1017017:1019765, ack 869, win 65535, length 2748
19:56:51.338846 IP 10.0.2.15.44100 > 151.101.117.164.443: Flags [.], ack 1019765, win 65535, length 0
19:56:51.341601 IP 151.101.117.164.443 > 10.0.2.15.44100: Flags [P.], seq 1019765:1026635, ack 869, win 65535, length 6870
19:56:51.341605 IP 151.101.117.164.443 > 10.0.2.15.44100: Flags [P.], seq 1026635:1033505, ack 869, win 65535, length 6870
19:56:51.341630 IP 10.0.2.15.44100 > 151.101.117.164.443: Flags [.], ack 1026635, win 65535, length 0
19:56:51.341779 IP 151.101.117.164.443 > 10.0.2.15.44100: Flags [P.], seq 1033505:1037627, ack 869, win 65535, length 4122
19:56:51.341781 IP 151.101.117.164.443 > 10.0.2.15.44100: Flags [P.], seq 1037627:1041749, ack 869, win 65535, length 4122
19:56:51.341821 IP 151.101.117.164.443 > 10.0.2.15.44100: Flags [P.], seq 1041749:1059611, ack 869, win 65535, length 17862
19:56:51.342915 IP 10.0.2.15.44100 > 151.101.117.164.443: Flags [.], ack 1059611, win 65535, length 0
19:56:51.343475 IP 151.101.117.164.443 > 10.0.2.15.44100: Flags [P.], seq 1059611:1093089, ack 869, win 65535, length 33478
19:56:51.343814 IP 10.0.2.15.44100 > 151.101.117.164.443: Flags [.], ack 1093089, win 65535, length 0
19:56:51.344099 IP 151.101.117.164.443 > 10.0.2.15.44100: Flags [P.], seq 1093089:1098585, ack 869, win 65535, length 5496
19:56:51.344111 IP 10.0.2.15.44100 > 151.101.117.164.443: Flags [.], ack 1098585, win 65535, length 0
19:56:51.344482 IP 151.101.117.164.443 > 10.0.2.15.44100: Flags [P.], seq 1098585:1105455, ack 869, win 65535, length 6870
19:56:51.344492 IP 10.0.2.15.44100 > 151.101.117.164.443: Flags [.], ack 1105455, win 65535, length 0
19:56:51.344737 IP 151.101.117.164.443 > 10.0.2.15.44100: Flags [P.], seq 1105455:1110951, ack 869, win 65535, length 5496
19:56:51.344795 IP 10.0.2.15.44100 > 151.101.117.164.443: Flags [.], ack 1110951, win 65535, length 0
19:56:51.345083 IP 151.101.117.164.443 > 10.0.2.15.44100: Flags [P.], seq 1110951:1115073, ack 869, win 65535, length 4122
19:56:51.345084 IP 151.101.117.164.443 > 10.0.2.15.44100: Flags [P.], seq 1115073:1117821, ack 869, win 65535, length 2748
19:56:51.345085 IP 151.101.117.164.443 > 10.0.2.15.44100: Flags [P.], seq 1117821:1120067, ack 869, win 65535, length 2246
19:56:51.345165 IP 151.101.117.164.443 > 10.0.2.15.44100: Flags [P.], seq 1120067:1122815, ack 869, win 65535, length 2748
19:56:51.345329 IP 151.101.117.164.443 > 10.0.2.15.44100: Flags [P.], seq 1122815:1126937, ack 869, win 65535, length 4122
19:56:51.345409 IP 151.101.117.164.443 > 10.0.2.15.44100: Flags [P.], seq 1126937:1128311, ack 869, win 65535, length 1374
19:56:51.345443 IP 10.0.2.15.44100 > 151.101.117.164.443: Flags [.], ack 1128311, win 65535, length 0
19:56:51.345679 IP 151.101.117.164.443 > 10.0.2.15.44100: Flags [P.], seq 1128311:1132433, ack 869, win 65535, length 4122
19:56:51.345692 IP 10.0.2.15.44100 > 151.101.117.164.443: Flags [.], ack 1132433, win 65535, length 0
19:56:51.346100 IP 151.101.117.164.443 > 10.0.2.15.44100: Flags [P.], seq 1132433:1136555, ack 869, win 65535, length 4122
19:56:51.346102 IP 151.101.117.164.443 > 10.0.2.15.44100: Flags [P.], seq 1136555:1137929, ack 869, win 65535, length 1374
19:56:51.346113 IP 10.0.2.15.44100 > 151.101.117.164.443: Flags [.], ack 1136555, win 65535, length 0
19:56:51.346577 IP 151.101.117.164.443 > 10.0.2.15.44100: Flags [P.], seq 1137929:1142051, ack 869, win 65535, length 4122
19:56:51.346587 IP 10.0.2.15.44100 > 151.101.117.164.443: Flags [.], ack 1142051, win 65535, length 0
19:56:51.346906 IP 151.101.117.164.443 > 10.0.2.15.44100: Flags [P.], seq 1142051:1147547, ack 869, win 65535, length 5496
19:56:51.346909 IP 151.101.117.164.443 > 10.0.2.15.44100: Flags [P.], seq 1147547:1151669, ack 869, win 65535, length 4122
19:56:51.347331 IP 151.101.117.164.443 > 10.0.2.15.44100: Flags [P.], seq 1151669:1157165, ack 869, win 65535, length 5496
19:56:51.347333 IP 151.101.117.164.443 > 10.0.2.15.44100: Flags [P.], seq 1157165:1162661, ack 869, win 65535, length 5496
19:56:51.347426 IP 151.101.117.164.443 > 10.0.2.15.44100: Flags [P.], seq 1162661:1165409, ack 869, win 65535, length 2748
19:56:51.347578 IP 151.101.117.164.443 > 10.0.2.15.44100: Flags [.], seq 1165409:1166869, ack 869, win 65535, length 1460
19:56:51.347653 IP 151.101.117.164.443 > 10.0.2.15.44100: Flags [P.], seq 1166869:1169531, ack 869, win 65535, length 2662
19:56:51.347833 IP 151.101.117.164.443 > 10.0.2.15.44100: Flags [P.], seq 1169531:1172279, ack 869, win 65535, length 2748
19:56:51.347894 IP 10.0.2.15.44100 > 151.101.117.164.443: Flags [.], ack 1172279, win 65535, length 0
19:56:51.348225 IP 151.101.117.164.443 > 10.0.2.15.44100: Flags [P.], seq 1172279:1177775, ack 869, win 65535, length 5496
19:56:51.348227 IP 151.101.117.164.443 > 10.0.2.15.44100: Flags [P.], seq 1177775:1183271, ack 869, win 65535, length 5496
19:56:51.348294 IP 10.0.2.15.44100 > 151.101.117.164.443: Flags [.], ack 1183271, win 65535, length 0
19:56:51.348662 IP 151.101.117.164.443 > 10.0.2.15.44100: Flags [P.], seq 1183271:1186019, ack 869, win 65535, length 2748
19:56:51.348665 IP 151.101.117.164.443 > 10.0.2.15.44100: Flags [P.], seq 1186019:1191515, ack 869, win 65535, length 5496
19:56:51.349062 IP 151.101.117.164.443 > 10.0.2.15.44100: Flags [P.], seq 1191515:1195637, ack 869, win 65535, length 4122
19:56:51.349063 IP 151.101.117.164.443 > 10.0.2.15.44100: Flags [P.], seq 1195637:1198385, ack 869, win 65535, length 2748
19:56:51.349233 IP 10.0.2.15.44100 > 151.101.117.164.443: Flags [.], ack 1198385, win 65535, length 0
19:56:51.349321 IP 151.101.117.164.443 > 10.0.2.15.44100: Flags [P.], seq 1198385:1205255, ack 869, win 65535, length 6870
19:56:51.349321 IP 151.101.117.164.443 > 10.0.2.15.44100: Flags [P.], seq 1205255:1206629, ack 869, win 65535, length 1374
19:56:51.349355 IP 10.0.2.15.44100 > 151.101.117.164.443: Flags [.], ack 1206629, win 65535, length 0
19:56:51.349476 IP 151.101.117.164.443 > 10.0.2.15.44100: Flags [P.], seq 1206629:1210751, ack 869, win 65535, length 4122
19:56:51.349640 IP 151.101.117.164.443 > 10.0.2.15.44100: Flags [P.], seq 1210751:1213499, ack 869, win 65535, length 2748
19:56:51.349663 IP 10.0.2.15.44100 > 151.101.117.164.443: Flags [.], ack 1213499, win 65535, length 0
19:56:51.349788 IP 151.101.117.164.443 > 10.0.2.15.44100: Flags [P.], seq 1213499:1216247, ack 869, win 65535, length 2748
19:56:51.349794 IP 10.0.2.15.44100 > 151.101.117.164.443: Flags [.], ack 1216247, win 65535, length 0
19:56:51.350288 IP 151.101.117.164.443 > 10.0.2.15.44100: Flags [P.], seq 1216247:1217621, ack 869, win 65535, length 1374
19:56:51.350731 IP 151.101.117.164.443 > 10.0.2.15.44100: Flags [P.], seq 1217621:1221743, ack 869, win 65535, length 4122
19:56:51.350733 IP 151.101.117.164.443 > 10.0.2.15.44100: Flags [P.], seq 1221743:1227239, ack 869, win 65535, length 5496
19:56:51.350749 IP 10.0.2.15.44100 > 151.101.117.164.443: Flags [.], ack 1221743, win 65535, length 0
19:56:51.350894 IP 151.101.117.164.443 > 10.0.2.15.44100: Flags [P.], seq 1227239:1231361, ack 869, win 65535, length 4122
19:56:51.350940 IP 10.0.2.15.44100 > 151.101.117.164.443: Flags [.], ack 1231361, win 65535, length 0
19:56:51.351022 IP 151.101.117.164.443 > 10.0.2.15.44100: Flags [P.], seq 1231361:1232735, ack 869, win 65535, length 1374
19:56:51.351191 IP 151.101.117.164.443 > 10.0.2.15.44100: Flags [P.], seq 1232735:1236857, ack 869, win 65535, length 4122
19:56:51.351200 IP 10.0.2.15.44100 > 151.101.117.164.443: Flags [.], ack 1236857, win 65535, length 0
19:56:51.351602 IP 151.101.117.164.443 > 10.0.2.15.44100: Flags [P.], seq 1236857:1239605, ack 869, win 65535, length 2748
19:56:51.351604 IP 151.101.117.164.443 > 10.0.2.15.44100: Flags [P.], seq 1239605:1243727, ack 869, win 65535, length 4122
19:56:51.351604 IP 151.101.117.164.443 > 10.0.2.15.44100: Flags [P.], seq 1243727:1246475, ack 869, win 65535, length 2748
19:56:51.351827 IP 10.0.2.15.44100 > 151.101.117.164.443: Flags [.], ack 1246475, win 65535, length 0
19:56:51.351865 IP 151.101.117.164.443 > 10.0.2.15.44100: Flags [P.], seq 1246475:1249223, ack 869, win 65535, length 2748
19:56:51.351866 IP 151.101.117.164.443 > 10.0.2.15.44100: Flags [P.], seq 1249223:1251971, ack 869, win 65535, length 2748
19:56:51.352164 IP 151.101.117.164.443 > 10.0.2.15.44100: Flags [P.], seq 1251971:1254719, ack 869, win 65535, length 2748
19:56:51.352166 IP 151.101.117.164.443 > 10.0.2.15.44100: Flags [P.], seq 1254719:1257467, ack 869, win 65535, length 2748
19:56:51.352184 IP 10.0.2.15.44100 > 151.101.117.164.443: Flags [.], ack 1251971, win 65535, length 0
19:56:51.352205 IP 10.0.2.15.44100 > 151.101.117.164.443: Flags [.], ack 1257467, win 65535, length 0
19:56:51.353202 IP 151.101.117.164.443 > 10.0.2.15.44100: Flags [P.], seq 1257467:1264337, ack 869, win 65535, length 6870
19:56:51.353214 IP 10.0.2.15.44100 > 151.101.117.164.443: Flags [.], ack 1264337, win 65535, length 0
19:56:51.353427 IP 151.101.117.164.443 > 10.0.2.15.44100: Flags [P.], seq 1264337:1268459, ack 869, win 65535, length 4122
19:56:51.353429 IP 151.101.117.164.443 > 10.0.2.15.44100: Flags [P.], seq 1268459:1271207, ack 869, win 65535, length 2748
19:56:51.353695 IP 151.101.117.164.443 > 10.0.2.15.44100: Flags [P.], seq 1271207:1273955, ack 869, win 65535, length 2748
19:56:51.353778 IP 10.0.2.15.44100 > 151.101.117.164.443: Flags [.], ack 1273955, win 65535, length 0
19:56:51.354067 IP 151.101.117.164.443 > 10.0.2.15.44100: Flags [P.], seq 1273955:1279451, ack 869, win 65535, length 5496
19:56:51.354069 IP 151.101.117.164.443 > 10.0.2.15.44100: Flags [P.], seq 1279451:1283573, ack 869, win 65535, length 4122
19:56:51.354070 IP 151.101.117.164.443 > 10.0.2.15.44100: Flags [.], seq 1283573:1285033, ack 869, win 65535, length 1460
19:56:51.354093 IP 10.0.2.15.44100 > 151.101.117.164.443: Flags [.], ack 1279451, win 65535, length 0
19:56:51.354324 IP 151.101.117.164.443 > 10.0.2.15.44100: Flags [P.], seq 1285033:1286321, ack 869, win 65535, length 1288
19:56:51.354326 IP 151.101.117.164.443 > 10.0.2.15.44100: Flags [P.], seq 1286321:1289069, ack 869, win 65535, length 2748
19:56:51.354327 IP 151.101.117.164.443 > 10.0.2.15.44100: Flags [P.], seq 1289069:1291817, ack 869, win 65535, length 2748
19:56:51.354594 IP 151.101.117.164.443 > 10.0.2.15.44100: Flags [P.], seq 1291817:1295939, ack 869, win 65535, length 4122
19:56:51.354790 IP 151.101.117.164.443 > 10.0.2.15.44100: Flags [P.], seq 1295939:1297313, ack 869, win 65535, length 1374
19:56:51.354792 IP 151.101.117.164.443 > 10.0.2.15.44100: Flags [P.], seq 1297313:1301435, ack 869, win 65535, length 4122
19:56:51.355020 IP 151.101.117.164.443 > 10.0.2.15.44100: Flags [P.], seq 1301435:1304183, ack 869, win 65535, length 2748
19:56:51.355021 IP 151.101.117.164.443 > 10.0.2.15.44100: Flags [P.], seq 1304183:1306931, ack 869, win 65535, length 2748
19:56:51.355269 IP 151.101.117.164.443 > 10.0.2.15.44100: Flags [P.], seq 1306931:1309679, ack 869, win 65535, length 2748
19:56:51.355271 IP 151.101.117.164.443 > 10.0.2.15.44100: Flags [P.], seq 1309679:1312427, ack 869, win 65535, length 2748
19:56:51.355516 IP 10.0.2.15.44100 > 151.101.117.164.443: Flags [.], ack 1291817, win 65535, length 0
19:56:51.355974 IP 151.101.117.164.443 > 10.0.2.15.44100: Flags [P.], seq 1312427:1323419, ack 869, win 65535, length 10992
19:56:51.356049 IP 151.101.117.164.443 > 10.0.2.15.44100: Flags [P.], seq 1323419:1328915, ack 869, win 65535, length 5496
19:56:51.357070 IP 10.0.2.15.44100 > 151.101.117.164.443: Flags [.], ack 1328915, win 65535, length 0
19:56:51.357355 IP 151.101.117.164.443 > 10.0.2.15.44100: Flags [.], seq 1328915:1344975, ack 869, win 65535, length 16060
19:56:51.357399 IP 10.0.2.15.44100 > 151.101.117.164.443: Flags [.], ack 1344975, win 65535, length 0
19:56:51.358283 IP 151.101.117.164.443 > 10.0.2.15.44100: Flags [P.], seq 1344975:1345403, ack 869, win 65535, length 428
19:56:51.358285 IP 151.101.117.164.443 > 10.0.2.15.44100: Flags [P.], seq 1345403:1349525, ack 869, win 65535, length 4122
19:56:51.358287 IP 151.101.117.164.443 > 10.0.2.15.44100: Flags [P.], seq 1349525:1353647, ack 869, win 65535, length 4122
19:56:51.358287 IP 151.101.117.164.443 > 10.0.2.15.44100: Flags [P.], seq 1353647:1355021, ack 869, win 65535, length 1374
19:56:51.358325 IP 151.101.117.164.443 > 10.0.2.15.44100: Flags [P.], seq 1355021:1359143, ack 869, win 65535, length 4122
19:56:51.358326 IP 151.101.117.164.443 > 10.0.2.15.44100: Flags [P.], seq 1359143:1361891, ack 869, win 65535, length 2748
19:56:51.358327 IP 151.101.117.164.443 > 10.0.2.15.44100: Flags [P.], seq 1361891:1364639, ack 869, win 65535, length 2748
19:56:51.358538 IP 151.101.117.164.443 > 10.0.2.15.44100: Flags [P.], seq 1364639:1368761, ack 869, win 65535, length 4122
19:56:51.358540 IP 151.101.117.164.443 > 10.0.2.15.44100: Flags [P.], seq 1368761:1371509, ack 869, win 65535, length 2748
19:56:51.358564 IP 10.0.2.15.44100 > 151.101.117.164.443: Flags [.], ack 1364639, win 65535, length 0
19:56:51.358896 IP 151.101.117.164.443 > 10.0.2.15.44100: Flags [P.], seq 1371509:1375631, ack 869, win 65535, length 4122
19:56:51.358897 IP 151.101.117.164.443 > 10.0.2.15.44100: Flags [P.], seq 1375631:1378379, ack 869, win 65535, length 2748
19:56:51.358999 IP 151.101.117.164.443 > 10.0.2.15.44100: Flags [P.], seq 1378379:1382501, ack 869, win 65535, length 4122
19:56:51.359078 IP 10.0.2.15.44100 > 151.101.117.164.443: Flags [.], ack 1382501, win 65535, length 0
19:56:51.359278 IP 151.101.117.164.443 > 10.0.2.15.44100: Flags [P.], seq 1382501:1386623, ack 869, win 65535, length 4122
19:56:51.359317 IP 10.0.2.15.44100 > 151.101.117.164.443: Flags [.], ack 1386623, win 65535, length 0
19:56:51.359473 IP 151.101.117.164.443 > 10.0.2.15.44100: Flags [P.], seq 1386623:1389371, ack 869, win 65535, length 2748
19:56:51.359584 IP 151.101.117.164.443 > 10.0.2.15.44100: Flags [P.], seq 1389371:1394867, ack 869, win 65535, length 5496
19:56:51.359716 IP 151.101.117.164.443 > 10.0.2.15.44100: Flags [P.], seq 1394867:1397615, ack 869, win 65535, length 2748
19:56:51.359816 IP 10.0.2.15.44100 > 151.101.117.164.443: Flags [.], ack 1397615, win 65535, length 0
19:56:51.360329 IP 151.101.117.164.443 > 10.0.2.15.44100: Flags [P.], seq 1397615:1403111, ack 869, win 65535, length 5496
19:56:51.360331 IP 151.101.117.164.443 > 10.0.2.15.44100: Flags [P.], seq 1403111:1407233, ack 869, win 65535, length 4122
19:56:51.360331 IP 151.101.117.164.443 > 10.0.2.15.44100: Flags [P.], seq 1407233:1408607, ack 869, win 65535, length 1374
19:56:51.360350 IP 151.101.117.164.443 > 10.0.2.15.44100: Flags [P.], seq 1408607:1412729, ack 869, win 65535, length 4122
19:56:51.360483 IP 151.101.117.164.443 > 10.0.2.15.44100: Flags [P.], seq 1412729:1415477, ack 869, win 65535, length 2748
19:56:51.360510 IP 10.0.2.15.44100 > 151.101.117.164.443: Flags [.], ack 1412729, win 65535, length 0
19:56:51.360553 IP 151.101.117.164.443 > 10.0.2.15.44100: Flags [P.], seq 1415477:1416851, ack 869, win 65535, length 1374
19:56:51.360614 IP 10.0.2.15.44100 > 151.101.117.164.443: Flags [.], ack 1416851, win 65535, length 0
19:56:51.361478 IP 151.101.117.164.443 > 10.0.2.15.44100: Flags [P.], seq 1416851:1423721, ack 869, win 65535, length 6870
19:56:51.361492 IP 10.0.2.15.44100 > 151.101.117.164.443: Flags [.], ack 1423721, win 65535, length 0
19:56:51.361788 IP 151.101.117.164.443 > 10.0.2.15.44100: Flags [P.], seq 1423721:1430591, ack 869, win 65535, length 6870
19:56:51.361798 IP 10.0.2.15.44100 > 151.101.117.164.443: Flags [.], ack 1430591, win 65535, length 0
19:56:51.361951 IP 151.101.117.164.443 > 10.0.2.15.44100: Flags [P.], seq 1430591:1434713, ack 869, win 65535, length 4122
19:56:51.361960 IP 10.0.2.15.44100 > 151.101.117.164.443: Flags [.], ack 1434713, win 65535, length 0
19:56:51.362164 IP 151.101.117.164.443 > 10.0.2.15.44100: Flags [P.], seq 1434713:1437461, ack 869, win 65535, length 2748
19:56:51.362231 IP 151.101.117.164.443 > 10.0.2.15.44100: Flags [P.], seq 1437461:1440209, ack 869, win 65535, length 2748
19:56:51.362277 IP 10.0.2.15.44100 > 151.101.117.164.443: Flags [.], ack 1440209, win 65535, length 0
19:56:51.362969 IP 151.101.117.164.443 > 10.0.2.15.44100: Flags [P.], seq 1440209:1441583, ack 869, win 65535, length 1374
19:56:51.362971 IP 151.101.117.164.443 > 10.0.2.15.44100: Flags [P.], seq 1441583:1445705, ack 869, win 65535, length 4122
19:56:51.362972 IP 151.101.117.164.443 > 10.0.2.15.44100: Flags [P.], seq 1445705:1451201, ack 869, win 65535, length 5496
19:56:51.363029 IP 151.101.117.164.443 > 10.0.2.15.44100: Flags [P.], seq 1451201:1456697, ack 869, win 65535, length 5496
19:56:51.363408 IP 151.101.117.164.443 > 10.0.2.15.44100: Flags [P.], seq 1456697:1460819, ack 869, win 65535, length 4122
19:56:51.363410 IP 151.101.117.164.443 > 10.0.2.15.44100: Flags [P.], seq 1460819:1466315, ack 869, win 65535, length 5496
19:56:51.363669 IP 151.101.117.164.443 > 10.0.2.15.44100: Flags [P.], seq 1466315:1469063, ack 869, win 65535, length 2748
19:56:51.363734 IP 10.0.2.15.44100 > 151.101.117.164.443: Flags [.], ack 1469063, win 65535, length 0
19:56:51.363980 IP 151.101.117.164.443 > 10.0.2.15.44100: Flags [P.], seq 1469063:1474559, ack 869, win 65535, length 5496
19:56:51.363983 IP 151.101.117.164.443 > 10.0.2.15.44100: Flags [P.], seq 1474559:1478681, ack 869, win 65535, length 4122
19:56:51.363998 IP 10.0.2.15.44100 > 151.101.117.164.443: Flags [.], ack 1474559, win 65535, length 0
19:56:51.364152 IP 151.101.117.164.443 > 10.0.2.15.44100: Flags [P.], seq 1478681:1480055, ack 869, win 65535, length 1374
19:56:51.364154 IP 151.101.117.164.443 > 10.0.2.15.44100: Flags [P.], seq 1480055:1484177, ack 869, win 65535, length 4122
19:56:51.364271 IP 151.101.117.164.443 > 10.0.2.15.44100: Flags [P.], seq 1484177:1485551, ack 869, win 65535, length 1374
19:56:51.364297 IP 10.0.2.15.44100 > 151.101.117.164.443: Flags [.], ack 1485551, win 65535, length 0
19:56:51.364595 IP 151.101.117.164.443 > 10.0.2.15.44100: Flags [P.], seq 1485551:1489673, ack 869, win 65535, length 4122
19:56:51.364596 IP 151.101.117.164.443 > 10.0.2.15.44100: Flags [P.], seq 1489673:1492421, ack 869, win 65535, length 2748
19:56:51.364638 IP 10.0.2.15.44100 > 151.101.117.164.443: Flags [.], ack 1492421, win 65535, length 0
19:56:51.364858 IP 151.101.117.164.443 > 10.0.2.15.44100: Flags [P.], seq 1492421:1495169, ack 869, win 65535, length 2748
19:56:51.364859 IP 151.101.117.164.443 > 10.0.2.15.44100: Flags [P.], seq 1495169:1497917, ack 869, win 65535, length 2748
19:56:51.364899 IP 10.0.2.15.44100 > 151.101.117.164.443: Flags [.], ack 1495169, win 65535, length 0
19:56:51.365074 IP 10.0.2.15.44100 > 151.101.117.164.443: Flags [.], ack 1497917, win 65535, length 0
19:56:51.365154 IP 151.101.117.164.443 > 10.0.2.15.44100: Flags [P.], seq 1497917:1500665, ack 869, win 65535, length 2748
19:56:51.365155 IP 151.101.117.164.443 > 10.0.2.15.44100: Flags [P.], seq 1500665:1504787, ack 869, win 65535, length 4122
19:56:51.365178 IP 10.0.2.15.44100 > 151.101.117.164.443: Flags [.], ack 1504787, win 65535, length 0
19:56:51.366107 IP 151.101.117.164.443 > 10.0.2.15.44100: Flags [P.], seq 1504787:1510283, ack 869, win 65535, length 5496
19:56:51.366122 IP 10.0.2.15.44100 > 151.101.117.164.443: Flags [.], ack 1510283, win 65535, length 0
19:56:51.366224 IP 151.101.117.164.443 > 10.0.2.15.44100: Flags [P.], seq 1510283:1515779, ack 869, win 65535, length 5496
19:56:51.366275 IP 10.0.2.15.44100 > 151.101.117.164.443: Flags [.], ack 1515779, win 65535, length 0
19:56:51.366431 IP 151.101.117.164.443 > 10.0.2.15.44100: Flags [P.], seq 1515779:1518527, ack 869, win 65535, length 2748
19:56:51.366548 IP 10.0.2.15.44100 > 151.101.117.164.443: Flags [.], ack 1518527, win 65535, length 0
19:56:51.366919 IP 151.101.117.164.443 > 10.0.2.15.44100: Flags [P.], seq 1518527:1522649, ack 869, win 65535, length 4122
19:56:51.366921 IP 151.101.117.164.443 > 10.0.2.15.44100: Flags [P.], seq 1522649:1525397, ack 869, win 65535, length 2748
19:56:51.366921 IP 151.101.117.164.443 > 10.0.2.15.44100: Flags [P.], seq 1525397:1528145, ack 869, win 65535, length 2748
19:56:51.367045 IP 151.101.117.164.443 > 10.0.2.15.44100: Flags [P.], seq 1528145:1530893, ack 869, win 65535, length 2748
19:56:51.367047 IP 151.101.117.164.443 > 10.0.2.15.44100: Flags [P.], seq 1530893:1533641, ack 869, win 65535, length 2748
19:56:51.367154 IP 151.101.117.164.443 > 10.0.2.15.44100: Flags [P.], seq 1533641:1536389, ack 869, win 65535, length 2748
19:56:51.367194 IP 10.0.2.15.44100 > 151.101.117.164.443: Flags [.], ack 1536389, win 65535, length 0
19:56:51.367332 IP 151.101.117.164.443 > 10.0.2.15.44100: Flags [P.], seq 1536389:1539137, ack 869, win 65535, length 2748
19:56:51.367334 IP 151.101.117.164.443 > 10.0.2.15.44100: Flags [P.], seq 1539137:1540511, ack 869, win 65535, length 1374

