00:14:32.642367 IP 151.101.117.164.443 > 10.0.2.15.44018: Flags [.], seq 74944002:74946922, ack 2931865689, win 65535, length 2920
00:14:32.642389 IP 10.0.2.15.44018 > 151.101.117.164.443: Flags [.], ack 2920, win 62780, length 0
00:14:32.642621 IP 151.101.117.164.443 > 10.0.2.15.44018: Flags [P.], seq 2920:5606, ack 1, win 65535, length 2686
00:14:32.642636 IP 10.0.2.15.44018 > 151.101.117.164.443: Flags [.], ack 5606, win 61320, length 0
00:14:32.643794 IP 10.0.2.15.44018 > 151.101.117.164.443: Flags [P.], seq 1:94, ack 5606, win 62780, length 93
00:14:32.644250 IP 151.101.117.164.443 > 10.0.2.15.44018: Flags [.], ack 94, win 65535, length 0
00:14:32.661308 IP 151.101.117.164.443 > 10.0.2.15.44018: Flags [P.], seq 5606:5657, ack 94, win 65535, length 51
00:14:32.661325 IP 10.0.2.15.44018 > 151.101.117.164.443: Flags [.], ack 5657, win 62780, length 0
00:14:32.661639 IP 10.0.2.15.44018 > 151.101.117.164.443: Flags [P.], seq 94:147, ack 5657, win 62780, length 53
00:14:32.661668 IP 10.0.2.15.44018 > 151.101.117.164.443: Flags [P.], seq 147:203, ack 5657, win 62780, length 56
00:14:32.661893 IP 151.101.117.164.443 > 10.0.2.15.44018: Flags [.], ack 147, win 65535, length 0
00:14:32.661894 IP 151.101.117.164.443 > 10.0.2.15.44018: Flags [.], ack 203, win 65535, length 0
00:14:32.661915 IP 10.0.2.15.44018 > 151.101.117.164.443: Flags [P.], seq 203:245, ack 5657, win 62780, length 42
00:14:32.662265 IP 10.0.2.15.44018 > 151.101.117.164.443: Flags [P.], seq 245:314, ack 5657, win 62780, length 69
00:14:32.662386 IP 151.101.117.164.443 > 10.0.2.15.44018: Flags [.], ack 245, win 65535, length 0
00:14:32.662573 IP 151.101.117.164.443 > 10.0.2.15.44018: Flags [.], ack 314, win 65535, length 0
00:14:32.675204 IP 151.101.117.164.443 > 10.0.2.15.44018: Flags [P.], seq 5657:5752, ack 314, win 65535, length 95
00:14:32.675226 IP 10.0.2.15.44018 > 151.101.117.164.443: Flags [.], ack 5752, win 62780, length 0
00:14:32.675593 IP 10.0.2.15.44018 > 151.101.117.164.443: Flags [P.], seq 314:352, ack 5752, win 62780, length 38
00:14:32.676273 IP 151.101.117.164.443 > 10.0.2.15.44018: Flags [.], ack 352, win 65535, length 0
00:14:32.682917 IP 151.101.117.164.443 > 10.0.2.15.44018: Flags [P.], seq 5752:11248, ack 352, win 65535, length 5496
00:14:32.683018 IP 10.0.2.15.44018 > 151.101.117.164.443: Flags [.], ack 11248, win 61320, length 0
00:14:32.684166 IP 151.101.117.164.443 > 10.0.2.15.44018: Flags [P.], seq 11248:13996, ack 352, win 65535, length 2748
00:14:32.684188 IP 10.0.2.15.44018 > 151.101.117.164.443: Flags [.], ack 13996, win 62780, length 0
00:14:32.685589 IP 151.101.117.164.443 > 10.0.2.15.44018: Flags [P.], seq 13996:18118, ack 352, win 65535, length 4122
00:14:32.685597 IP 151.101.117.164.443 > 10.0.2.15.44018: Flags [P.], seq 18118:19492, ack 352, win 65535, length 1374
00:14:32.685708 IP 10.0.2.15.44018 > 151.101.117.164.443: Flags [.], ack 19492, win 61320, length 0
00:14:32.686770 IP 151.101.117.164.443 > 10.0.2.15.44018: Flags [P.], seq 19492:24988, ack 352, win 65535, length 5496
00:14:32.686791 IP 10.0.2.15.44018 > 151.101.117.164.443: Flags [.], ack 24988, win 61320, length 0
00:14:32.687783 IP 151.101.117.164.443 > 10.0.2.15.44018: Flags [P.], seq 24988:27736, ack 352, win 65535, length 2748
00:14:32.687805 IP 10.0.2.15.44018 > 151.101.117.164.443: Flags [.], ack 27736, win 62780, length 0
00:14:32.688900 IP 151.101.117.164.443 > 10.0.2.15.44018: Flags [P.], seq 27736:30484, ack 352, win 65535, length 2748
00:14:32.688923 IP 10.0.2.15.44018 > 151.101.117.164.443: Flags [.], ack 30484, win 62780, length 0
00:14:32.692331 IP 151.101.117.164.443 > 10.0.2.15.44018: Flags [P.], seq 30484:42850, ack 352, win 65535, length 12366
00:14:32.692391 IP 151.101.117.164.443 > 10.0.2.15.44018: Flags [.], seq 42850:47230, ack 352, win 65535, length 4380
00:14:32.692490 IP 10.0.2.15.44018 > 151.101.117.164.443: Flags [.], ack 47230, win 52560, length 0
00:14:32.693653 IP 151.101.117.164.443 > 10.0.2.15.44018: Flags [P.], seq 47230:49720, ack 352, win 65535, length 2490
00:14:32.693675 IP 10.0.2.15.44018 > 151.101.117.164.443: Flags [.], ack 49720, win 62780, length 0
00:14:32.695664 IP 151.101.117.164.443 > 10.0.2.15.44018: Flags [P.], seq 49720:53842, ack 352, win 65535, length 4122
00:14:32.695781 IP 10.0.2.15.44018 > 151.101.117.164.443: Flags [.], ack 53842, win 61320, length 0
00:14:32.696868 IP 151.101.117.164.443 > 10.0.2.15.44018: Flags [P.], seq 53842:57964, ack 352, win 65535, length 4122
00:14:32.696892 IP 10.0.2.15.44018 > 151.101.117.164.443: Flags [.], ack 57964, win 61320, length 0
00:14:32.697591 IP 151.101.117.164.443 > 10.0.2.15.44018: Flags [P.], seq 57964:64834, ack 352, win 65535, length 6870
00:14:32.697638 IP 10.0.2.15.44018 > 151.101.117.164.443: Flags [.], ack 64834, win 59860, length 0
00:14:32.697953 IP 151.101.117.164.443 > 10.0.2.15.44018: Flags [P.], seq 64834:66208, ack 352, win 65535, length 1374
00:14:32.698873 IP 151.101.117.164.443 > 10.0.2.15.44018: Flags [P.], seq 66208:68956, ack 352, win 65535, length 2748
00:14:32.698895 IP 10.0.2.15.44018 > 151.101.117.164.443: Flags [.], ack 68956, win 62780, length 0
00:14:32.699049 IP 151.101.117.164.443 > 10.0.2.15.44018: Flags [P.], seq 68956:71704, ack 352, win 65535, length 2748
00:14:32.699124 IP 10.0.2.15.44018 > 151.101.117.164.443: Flags [.], ack 71704, win 62780, length 0
00:14:32.700501 IP 151.101.117.164.443 > 10.0.2.15.44018: Flags [P.], seq 71704:77200, ack 352, win 65535, length 5496
00:14:32.700505 IP 151.101.117.164.443 > 10.0.2.15.44018: Flags [P.], seq 77200:79948, ack 352, win 65535, length 2748
00:14:32.700531 IP 10.0.2.15.44018 > 151.101.117.164.443: Flags [.], ack 77200, win 65535, length 0
00:14:32.700611 IP 10.0.2.15.44018 > 151.101.117.164.443: Flags [.], ack 79948, win 65535, length 0
00:14:32.704678 IP 151.101.117.164.443 > 10.0.2.15.44018: Flags [P.], seq 79948:81322, ack 352, win 65535, length 1374
00:14:32.705180 IP 151.101.117.164.443 > 10.0.2.15.44018: Flags [P.], seq 81322:88192, ack 352, win 65535, length 6870
00:14:32.705184 IP 151.101.117.164.443 > 10.0.2.15.44018: Flags [P.], seq 88192:95062, ack 352, win 65535, length 6870
00:14:32.705207 IP 10.0.2.15.44018 > 151.101.117.164.443: Flags [.], ack 88192, win 65535, length 0
00:14:32.705232 IP 10.0.2.15.44018 > 151.101.117.164.443: Flags [.], ack 95062, win 65535, length 0
00:14:32.705252 IP 151.101.117.164.443 > 10.0.2.15.44018: Flags [.], seq 95062:99442, ack 352, win 65535, length 4380
00:14:32.705256 IP 10.0.2.15.44018 > 151.101.117.164.443: Flags [.], ack 99442, win 65535, length 0
00:14:32.707593 IP 151.101.117.164.443 > 10.0.2.15.44018: Flags [P.], seq 99442:100558, ack 352, win 65535, length 1116
00:14:32.707597 IP 151.101.117.164.443 > 10.0.2.15.44018: Flags [P.], seq 100558:104680, ack 352, win 65535, length 4122
00:14:32.707598 IP 151.101.117.164.443 > 10.0.2.15.44018: Flags [P.], seq 104680:108802, ack 352, win 65535, length 4122
00:14:32.707599 IP 151.101.117.164.443 > 10.0.2.15.44018: Flags [P.], seq 108802:111550, ack 352, win 65535, length 2748
00:14:32.707640 IP 10.0.2.15.44018 > 151.101.117.164.443: Flags [.], ack 104680, win 65535, length 0
00:14:32.707668 IP 10.0.2.15.44018 > 151.101.117.164.443: Flags [.], ack 108802, win 65535, length 0
00:14:32.707682 IP 10.0.2.15.44018 > 151.101.117.164.443: Flags [.], ack 111550, win 65535, length 0
00:14:32.707803 IP 151.101.117.164.443 > 10.0.2.15.44018: Flags [P.], seq 111550:114298, ack 352, win 65535, length 2748
00:14:32.707807 IP 151.101.117.164.443 > 10.0.2.15.44018: Flags [P.], seq 114298:119794, ack 352, win 65535, length 5496
00:14:32.707808 IP 151.101.117.164.443 > 10.0.2.15.44018: Flags [P.], seq 119794:122542, ack 352, win 65535, length 2748
00:14:32.707867 IP 10.0.2.15.44018 > 151.101.117.164.443: Flags [.], ack 114298, win 65535, length 0
00:14:32.708036 IP 10.0.2.15.44018 > 151.101.117.164.443: Flags [.], ack 119794, win 65535, length 0
00:14:32.708125 IP 10.0.2.15.44018 > 151.101.117.164.443: Flags [.], ack 122542, win 65535, length 0
00:14:32.708323 IP 151.101.117.164.443 > 10.0.2.15.44018: Flags [P.], seq 122542:123916, ack 352, win 65535, length 1374
00:14:32.708380 IP 151.101.117.164.443 > 10.0.2.15.44018: Flags [P.], seq 123916:128038, ack 352, win 65535, length 4122
00:14:32.708404 IP 10.0.2.15.44018 > 151.101.117.164.443: Flags [.], ack 128038, win 65535, length 0
00:14:32.708848 IP 151.101.117.164.443 > 10.0.2.15.44018: Flags [P.], seq 128038:129412, ack 352, win 65535, length 1374
00:14:32.708851 IP 151.101.117.164.443 > 10.0.2.15.44018: Flags [P.], seq 129412:133534, ack 352, win 65535, length 4122
00:14:32.708852 IP 151.101.117.164.443 > 10.0.2.15.44018: Flags [P.], seq 133534:136282, ack 352, win 65535, length 2748
00:14:32.708853 IP 151.101.117.164.443 > 10.0.2.15.44018: Flags [P.], seq 136282:139030, ack 352, win 65535, length 2748
00:14:32.708876 IP 10.0.2.15.44018 > 151.101.117.164.443: Flags [.], ack 133534, win 65535, length 0
00:14:32.708988 IP 10.0.2.15.44018 > 151.101.117.164.443: Flags [.], ack 136282, win 65535, length 0
00:14:32.709010 IP 10.0.2.15.44018 > 151.101.117.164.443: Flags [.], ack 139030, win 65535, length 0
00:14:32.709922 IP 151.101.117.164.443 > 10.0.2.15.44018: Flags [P.], seq 139030:143152, ack 352, win 65535, length 4122
00:14:32.709925 IP 151.101.117.164.443 > 10.0.2.15.44018: Flags [P.], seq 143152:145900, ack 352, win 65535, length 2748
00:14:32.709952 IP 10.0.2.15.44018 > 151.101.117.164.443: Flags [.], ack 143152, win 65535, length 0
00:14:32.709971 IP 10.0.2.15.44018 > 151.101.117.164.443: Flags [.], ack 145900, win 65535, length 0
00:14:32.711105 IP 151.101.117.164.443 > 10.0.2.15.44018: Flags [P.], seq 145900:151396, ack 352, win 65535, length 5496
00:14:32.711109 IP 151.101.117.164.443 > 10.0.2.15.44018: Flags [P.], seq 151396:154144, ack 352, win 65535, length 2748
00:14:32.711131 IP 10.0.2.15.44018 > 151.101.117.164.443: Flags [.], ack 151396, win 65535, length 0
00:14:32.711196 IP 10.0.2.15.44018 > 151.101.117.164.443: Flags [.], ack 154144, win 65535, length 0
00:14:32.711478 IP 151.101.117.164.443 > 10.0.2.15.44018: Flags [P.], seq 154144:156892, ack 352, win 65535, length 2748
00:14:32.711480 IP 151.101.117.164.443 > 10.0.2.15.44018: Flags [P.], seq 156892:159640, ack 352, win 65535, length 2748
00:14:32.711500 IP 10.0.2.15.44018 > 151.101.117.164.443: Flags [.], ack 156892, win 65535, length 0
00:14:32.711573 IP 10.0.2.15.44018 > 151.101.117.164.443: Flags [.], ack 159640, win 65535, length 0
00:14:32.711879 IP 151.101.117.164.443 > 10.0.2.15.44018: Flags [P.], seq 159640:162388, ack 352, win 65535, length 2748
00:14:32.711891 IP 10.0.2.15.44018 > 151.101.117.164.443: Flags [.], ack 162388, win 65535, length 0
00:14:32.713152 IP 151.101.117.164.443 > 10.0.2.15.44018: Flags [P.], seq 162388:165136, ack 352, win 65535, length 2748
00:14:32.713155 IP 151.101.117.164.443 > 10.0.2.15.44018: Flags [P.], seq 165136:167884, ack 352, win 65535, length 2748
00:14:32.713156 IP 151.101.117.164.443 > 10.0.2.15.44018: Flags [P.], seq 167884:172006, ack 352, win 65535, length 4122
00:14:32.713225 IP 10.0.2.15.44018 > 151.101.117.164.443: Flags [.], ack 165136, win 65535, length 0
00:14:32.713395 IP 10.0.2.15.44018 > 151.101.117.164.443: Flags [.], ack 167884, win 65535, length 0
00:14:32.713413 IP 10.0.2.15.44018 > 151.101.117.164.443: Flags [.], ack 172006, win 65535, length 0
00:14:32.713552 IP 151.101.117.164.443 > 10.0.2.15.44018: Flags [P.], seq 172006:176128, ack 352, win 65535, length 4122
00:14:32.713559 IP 10.0.2.15.44018 > 151.101.117.164.443: Flags [.], ack 176128, win 65535, length 0
00:14:32.713669 IP 151.101.117.164.443 > 10.0.2.15.44018: Flags [P.], seq 176128:177502, ack 352, win 65535, length 1374
00:14:32.714645 IP 151.101.117.164.443 > 10.0.2.15.44018: Flags [P.], seq 177502:181624, ack 352, win 65535, length 4122
00:14:32.714649 IP 151.101.117.164.443 > 10.0.2.15.44018: Flags [P.], seq 181624:184372, ack 352, win 65535, length 2748
00:14:32.714733 IP 10.0.2.15.44018 > 151.101.117.164.443: Flags [.], ack 181624, win 65535, length 0
00:14:32.714775 IP 10.0.2.15.44018 > 151.101.117.164.443: Flags [.], ack 184372, win 65535, length 0
00:14:32.715156 IP 151.101.117.164.443 > 10.0.2.15.44018: Flags [P.], seq 184372:189868, ack 352, win 65535, length 5496
00:14:32.715159 IP 151.101.117.164.443 > 10.0.2.15.44018: Flags [P.], seq 189868:192616, ack 352, win 65535, length 2748
00:14:32.715283 IP 10.0.2.15.44018 > 151.101.117.164.443: Flags [.], ack 189868, win 65535, length 0
00:14:32.715760 IP 10.0.2.15.44018 > 151.101.117.164.443: Flags [.], ack 192616, win 65535, length 0
00:14:32.716463 IP 151.101.117.164.443 > 10.0.2.15.44018: Flags [P.], seq 192616:193990, ack 352, win 65535, length 1374
00:14:32.716465 IP 151.101.117.164.443 > 10.0.2.15.44018: Flags [P.], seq 193990:195364, ack 352, win 65535, length 1374
00:14:32.716466 IP 151.101.117.164.443 > 10.0.2.15.44018: Flags [P.], seq 195364:198112, ack 352, win 65535, length 2748
00:14:32.716467 IP 151.101.117.164.443 > 10.0.2.15.44018: Flags [P.], seq 198112:199486, ack 352, win 65535, length 1374
00:14:32.716468 IP 151.101.117.164.443 > 10.0.2.15.44018: Flags [P.], seq 199486:200860, ack 352, win 65535, length 1374
00:14:32.716493 IP 10.0.2.15.44018 > 151.101.117.164.443: Flags [.], ack 195364, win 65535, length 0
00:14:32.716517 IP 10.0.2.15.44018 > 151.101.117.164.443: Flags [.], ack 198112, win 65535, length 0
00:14:32.716531 IP 10.0.2.15.44018 > 151.101.117.164.443: Flags [.], ack 200860, win 65535, length 0
00:14:32.718692 IP 151.101.117.164.443 > 10.0.2.15.44018: Flags [P.], seq 200860:215974, ack 352, win 65535, length 15114
00:14:32.718718 IP 10.0.2.15.44018 > 151.101.117.164.443: Flags [.], ack 215974, win 65535, length 0
00:14:32.718861 IP 151.101.117.164.443 > 10.0.2.15.44018: Flags [P.], seq 215974:217348, ack 352, win 65535, length 1374
00:14:32.721915 IP 151.101.117.164.443 > 10.0.2.15.44018: Flags [P.], seq 217348:224218, ack 352, win 65535, length 6870
00:14:32.721919 IP 151.101.117.164.443 > 10.0.2.15.44018: Flags [P.], seq 224218:229714, ack 352, win 65535, length 5496
00:14:32.721951 IP 10.0.2.15.44018 > 151.101.117.164.443: Flags [.], ack 224218, win 65535, length 0
00:14:32.723372 IP 10.0.2.15.44018 > 151.101.117.164.443: Flags [.], ack 229714, win 65535, length 0
00:14:32.723495 IP 151.101.117.164.443 > 10.0.2.15.44018: Flags [P.], seq 229714:239332, ack 352, win 65535, length 9618
00:14:32.723512 IP 151.101.117.164.443 > 10.0.2.15.44018: Flags [.], seq 239332:243712, ack 352, win 65535, length 4380
00:14:32.723532 IP 10.0.2.15.44018 > 151.101.117.164.443: Flags [.], ack 239332, win 65535, length 0
00:14:32.723550 IP 10.0.2.15.44018 > 151.101.117.164.443: Flags [.], ack 243712, win 65535, length 0
00:14:32.723875 IP 151.101.117.164.443 > 10.0.2.15.44018: Flags [P.], seq 243712:246202, ack 352, win 65535, length 2490
00:14:32.723877 IP 151.101.117.164.443 > 10.0.2.15.44018: Flags [.], seq 246202:247662, ack 352, win 65535, length 1460
00:14:32.723893 IP 10.0.2.15.44018 > 151.101.117.164.443: Flags [.], ack 246202, win 65535, length 0
00:14:32.724697 IP 151.101.117.164.443 > 10.0.2.15.44018: Flags [P.], seq 247662:254446, ack 352, win 65535, length 6784
00:14:32.724718 IP 10.0.2.15.44018 > 151.101.117.164.443: Flags [.], ack 254446, win 65535, length 0
00:14:32.725251 IP 151.101.117.164.443 > 10.0.2.15.44018: Flags [.], seq 254446:258826, ack 352, win 65535, length 4380
00:14:32.725270 IP 10.0.2.15.44018 > 151.101.117.164.443: Flags [.], ack 258826, win 65535, length 0
00:14:32.726273 IP 151.101.117.164.443 > 10.0.2.15.44018: Flags [P.], seq 258826:264064, ack 352, win 65535, length 5238
00:14:32.726296 IP 10.0.2.15.44018 > 151.101.117.164.443: Flags [.], ack 264064, win 65535, length 0
00:14:32.728752 IP 151.101.117.164.443 > 10.0.2.15.44018: Flags [.], seq 264064:265524, ack 352, win 65535, length 1460
00:14:32.728927 IP 151.101.117.164.443 > 10.0.2.15.44018: Flags [.], seq 265524:269904, ack 352, win 65535, length 4380
00:14:32.728947 IP 10.0.2.15.44018 > 151.101.117.164.443: Flags [.], ack 269904, win 65535, length 0
00:14:32.729859 IP 151.101.117.164.443 > 10.0.2.15.44018: Flags [.], seq 269904:272824, ack 352, win 65535, length 2920
00:14:32.729884 IP 10.0.2.15.44018 > 151.101.117.164.443: Flags [.], ack 272824, win 65535, length 0
00:14:32.730188 IP 151.101.117.164.443 > 10.0.2.15.44018: Flags [P.], seq 272824:294292, ack 352, win 65535, length 21468
00:14:32.730206 IP 10.0.2.15.44018 > 151.101.117.164.443: Flags [.], ack 294292, win 65535, length 0
00:14:32.730446 IP 151.101.117.164.443 > 10.0.2.15.44018: Flags [P.], seq 294292:309406, ack 352, win 65535, length 15114
00:14:32.730464 IP 10.0.2.15.44018 > 151.101.117.164.443: Flags [.], ack 309406, win 65535, length 0
00:14:32.730882 IP 151.101.117.164.443 > 10.0.2.15.44018: Flags [P.], seq 309406:321772, ack 352, win 65535, length 12366
00:14:32.730903 IP 10.0.2.15.44018 > 151.101.117.164.443: Flags [.], ack 321772, win 65535, length 0
00:14:32.731503 IP 151.101.117.164.443 > 10.0.2.15.44018: Flags [.], seq 321772:323232, ack 352, win 65535, length 1460
00:14:32.732132 IP 151.101.117.164.443 > 10.0.2.15.44018: Flags [P.], seq 323232:332764, ack 352, win 65535, length 9532
00:14:32.732136 IP 151.101.117.164.443 > 10.0.2.15.44018: Flags [P.], seq 332764:341008, ack 352, win 65535, length 8244
00:14:32.732162 IP 10.0.2.15.44018 > 151.101.117.164.443: Flags [.], ack 332764, win 65535, length 0
00:14:32.732276 IP 10.0.2.15.44018 > 151.101.117.164.443: Flags [.], ack 341008, win 65535, length 0
00:14:32.733547 IP 151.101.117.164.443 > 10.0.2.15.44018: Flags [P.], seq 341008:350626, ack 352, win 65535, length 9618
00:14:32.733813 IP 151.101.117.164.443 > 10.0.2.15.44018: Flags [P.], seq 350626:353374, ack 352, win 65535, length 2748
00:14:32.733843 IP 10.0.2.15.44018 > 151.101.117.164.443: Flags [.], ack 350626, win 65535, length 0
00:14:32.734118 IP 10.0.2.15.44018 > 151.101.117.164.443: Flags [.], ack 353374, win 65535, length 0
00:14:32.734167 IP 151.101.117.164.443 > 10.0.2.15.44018: Flags [P.], seq 353374:356122, ack 352, win 65535, length 2748
00:14:32.734168 IP 151.101.117.164.443 > 10.0.2.15.44018: Flags [.], seq 356122:360502, ack 352, win 65535, length 4380
00:14:32.734180 IP 10.0.2.15.44018 > 151.101.117.164.443: Flags [.], ack 356122, win 65535, length 0
00:14:32.734372 IP 10.0.2.15.44018 > 151.101.117.164.443: Flags [.], ack 360502, win 65535, length 0
00:14:32.734747 IP 151.101.117.164.443 > 10.0.2.15.44018: Flags [P.], seq 360502:364366, ack 352, win 65535, length 3864
00:14:32.734761 IP 10.0.2.15.44018 > 151.101.117.164.443: Flags [.], ack 364366, win 65535, length 0
00:14:32.735782 IP 151.101.117.164.443 > 10.0.2.15.44018: Flags [P.], seq 364366:376732, ack 352, win 65535, length 12366
00:14:32.735801 IP 10.0.2.15.44018 > 151.101.117.164.443: Flags [.], ack 376732, win 65535, length 0
00:14:32.735834 IP 151.101.117.164.443 > 10.0.2.15.44018: Flags [P.], seq 376732:380854, ack 352, win 65535, length 4122
00:14:32.735835 IP 151.101.117.164.443 > 10.0.2.15.44018: Flags [P.], seq 380854:382228, ack 352, win 65535, length 1374
00:14:32.735845 IP 10.0.2.15.44018 > 151.101.117.164.443: Flags [.], ack 380854, win 65535, length 0
00:14:32.736773 IP 151.101.117.164.443 > 10.0.2.15.44018: Flags [P.], seq 382228:389098, ack 352, win 65535, length 6870
00:14:32.736776 IP 151.101.117.164.443 > 10.0.2.15.44018: Flags [P.], seq 389098:390472, ack 352, win 65535, length 1374
00:14:32.736799 IP 10.0.2.15.44018 > 151.101.117.164.443: Flags [.], ack 389098, win 65535, length 0
00:14:32.737171 IP 151.101.117.164.443 > 10.0.2.15.44018: Flags [.], seq 390472:391932, ack 352, win 65535, length 1460
00:14:32.737189 IP 10.0.2.15.44018 > 151.101.117.164.443: Flags [.], ack 391932, win 65535, length 0
00:14:32.737301 IP 151.101.117.164.443 > 10.0.2.15.44018: Flags [P.], seq 391932:397342, ack 352, win 65535, length 5410
00:14:32.737308 IP 10.0.2.15.44018 > 151.101.117.164.443: Flags [.], ack 397342, win 65535, length 0
00:14:32.737596 IP 151.101.117.164.443 > 10.0.2.15.44018: Flags [P.], seq 397342:404212, ack 352, win 65535, length 6870
00:14:32.737629 IP 10.0.2.15.44018 > 151.101.117.164.443: Flags [.], ack 404212, win 65535, length 0
00:14:32.738234 IP 151.101.117.164.443 > 10.0.2.15.44018: Flags [P.], seq 404212:408334, ack 352, win 65535, length 4122
00:14:32.738237 IP 151.101.117.164.443 > 10.0.2.15.44018: Flags [P.], seq 408334:411082, ack 352, win 65535, length 2748
00:14:32.738260 IP 10.0.2.15.44018 > 151.101.117.164.443: Flags [.], ack 408334, win 65535, length 0
00:14:32.738294 IP 10.0.2.15.44018 > 151.101.117.164.443: Flags [.], ack 411082, win 65535, length 0
00:14:32.738936 IP 151.101.117.164.443 > 10.0.2.15.44018: Flags [.], seq 411082:415462, ack 352, win 65535, length 4380
00:14:32.738955 IP 10.0.2.15.44018 > 151.101.117.164.443: Flags [.], ack 415462, win 65535, length 0
00:14:32.739956 IP 151.101.117.164.443 > 10.0.2.15.44018: Flags [P.], seq 415462:419326, ack 352, win 65535, length 3864
00:14:32.739960 IP 151.101.117.164.443 > 10.0.2.15.44018: Flags [P.], seq 419326:426196, ack 352, win 65535, length 6870
00:14:32.739986 IP 10.0.2.15.44018 > 151.101.117.164.443: Flags [.], ack 419326, win 65535, length 0
00:14:32.740206 IP 10.0.2.15.44018 > 151.101.117.164.443: Flags [.], ack 426196, win 65535, length 0
00:14:32.742237 IP 151.101.117.164.443 > 10.0.2.15.44018: Flags [P.], seq 426196:428944, ack 352, win 65535, length 2748
00:14:32.742262 IP 10.0.2.15.44018 > 151.101.117.164.443: Flags [.], ack 428944, win 65535, length 0
00:14:32.754906 IP 151.101.117.164.443 > 10.0.2.15.44018: Flags [P.], seq 428944:434440, ack 352, win 65535, length 5496
00:14:32.754917 IP 151.101.117.164.443 > 10.0.2.15.44018: Flags [P.], seq 434440:460546, ack 352, win 65535, length 26106
00:14:32.754949 IP 10.0.2.15.44018 > 151.101.117.164.443: Flags [.], ack 434440, win 65535, length 0
00:14:32.754982 IP 10.0.2.15.44018 > 151.101.117.164.443: Flags [.], ack 460546, win 65535, length 0
00:14:32.755033 IP 151.101.117.164.443 > 10.0.2.15.44018: Flags [P.], seq 460546:494126, ack 352, win 65535, length 33580
00:14:32.755039 IP 10.0.2.15.44018 > 151.101.117.164.443: Flags [.], ack 494126, win 65535, length 0
00:14:32.755685 IP 151.101.117.164.443 > 10.0.2.15.44018: Flags [.], seq 494126:495586, ack 352, win 65535, length 1460
00:14:32.764085 IP 151.101.117.164.443 > 10.0.2.15.44018: Flags [.], seq 495586:558366, ack 352, win 65535, length 62780
00:14:32.764383 IP 10.0.2.15.44018 > 151.101.117.164.443: Flags [.], ack 558366, win 65535, length 0
00:14:32.767210 IP 151.101.117.164.443 > 10.0.2.15.44018: Flags [P.], seq 558366:559826, ack 352, win 65535, length 1460
00:14:32.767232 IP 151.101.117.164.443 > 10.0.2.15.44018: Flags [.], seq 559826:622606, ack 352, win 65535, length 62780
00:14:32.767638 IP 10.0.2.15.44018 > 151.101.117.164.443: Flags [.], ack 622606, win 65535, length 0
00:14:32.770635 IP 151.101.117.164.443 > 10.0.2.15.44018: Flags [P.], seq 622606:624066, ack 352, win 65535, length 1460
00:14:32.770639 IP 151.101.117.164.443 > 10.0.2.15.44018: Flags [.], seq 624066:629906, ack 352, win 65535, length 5840
00:14:32.770665 IP 10.0.2.15.44018 > 151.101.117.164.443: Flags [.], ack 629906, win 65535, length 0
00:14:32.771103 IP 151.101.117.164.443 > 10.0.2.15.44018: Flags [.], seq 629906:645966, ack 352, win 65535, length 16060
00:14:32.771121 IP 10.0.2.15.44018 > 151.101.117.164.443: Flags [.], ack 645966, win 65535, length 0
00:14:32.771679 IP 151.101.117.164.443 > 10.0.2.15.44018: Flags [P.], seq 645966:688306, ack 352, win 65535, length 42340
00:14:32.771769 IP 10.0.2.15.44018 > 151.101.117.164.443: Flags [.], ack 688306, win 65535, length 0
00:14:32.772920 IP 151.101.117.164.443 > 10.0.2.15.44018: Flags [.], seq 688306:752546, ack 352, win 65535, length 64240
00:14:32.772942 IP 10.0.2.15.44018 > 151.101.117.164.443: Flags [.], ack 752546, win 65535, length 0
00:14:32.774447 IP 151.101.117.164.443 > 10.0.2.15.44018: Flags [P.], seq 752546:754006, ack 352, win 65535, length 1460
00:14:32.774461 IP 151.101.117.164.443 > 10.0.2.15.44018: Flags [P.], seq 754006:799924, ack 352, win 65535, length 45918
00:14:32.787214 IP 10.0.2.15.44018 > 151.101.117.164.443: Flags [.], ack 799924, win 65535, length 0
00:14:32.787657 IP 151.101.117.164.443 > 10.0.2.15.44018: Flags [.], seq 799924:804304, ack 352, win 65535, length 4380
00:14:32.787798 IP 151.101.117.164.443 > 10.0.2.15.44018: Flags [.], seq 804304:824744, ack 352, win 65535, length 20440
00:14:32.787928 IP 151.101.117.164.443 > 10.0.2.15.44018: Flags [.], seq 824744:858324, ack 352, win 65535, length 33580
00:14:32.788271 IP 151.101.117.164.443 > 10.0.2.15.44018: Flags [.], seq 858324:864164, ack 352, win 65535, length 5840
00:14:32.788716 IP 10.0.2.15.44018 > 151.101.117.164.443: Flags [.], ack 864164, win 65535, length 0
00:14:32.788913 IP 151.101.117.164.443 > 10.0.2.15.44018: Flags [P.], seq 864164:865624, ack 352, win 65535, length 1460
00:14:32.789249 IP 151.101.117.164.443 > 10.0.2.15.44018: Flags [.], seq 865624:877304, ack 352, win 65535, length 11680
00:14:32.789270 IP 10.0.2.15.44018 > 151.101.117.164.443: Flags [.], ack 877304, win 65535, length 0
00:14:32.789511 IP 151.101.117.164.443 > 10.0.2.15.44018: Flags [.], seq 877304:884604, ack 352, win 65535, length 7300
00:14:32.789639 IP 151.101.117.164.443 > 10.0.2.15.44018: Flags [.], seq 884604:888984, ack 352, win 65535, length 4380
00:14:32.789703 IP 10.0.2.15.44018 > 151.101.117.164.443: Flags [.], ack 888984, win 65535, length 0
00:14:32.802787 IP 151.101.117.164.443 > 10.0.2.15.44018: Flags [.], seq 888984:891904, ack 352, win 65535, length 2920
00:14:32.802810 IP 10.0.2.15.44018 > 151.101.117.164.443: Flags [.], ack 891904, win 65535, length 0
00:14:32.805294 IP 151.101.117.164.443 > 10.0.2.15.44018: Flags [.], seq 891904:893364, ack 352, win 65535, length 1460
00:14:32.805543 IP 151.101.117.164.443 > 10.0.2.15.44018: Flags [.], seq 893364:924024, ack 352, win 65535, length 30660
00:14:32.805558 IP 10.0.2.15.44018 > 151.101.117.164.443: Flags [.], ack 924024, win 65535, length 0
00:14:32.805839 IP 151.101.117.164.443 > 10.0.2.15.44018: Flags [P.], seq 924024:929864, ack 352, win 65535, length 5840
00:14:32.807391 IP 151.101.117.164.443 > 10.0.2.15.44018: Flags [.], seq 929864:988264, ack 352, win 65535, length 58400
00:14:32.807648 IP 10.0.2.15.44018 > 151.101.117.164.443: Flags [.], ack 929864, win 65535, length 0
00:14:32.808392 IP 151.101.117.164.443 > 10.0.2.15.44018: Flags [P.], seq 988264:989724, ack 352, win 65535, length 1460
00:14:32.809099 IP 10.0.2.15.44018 > 151.101.117.164.443: Flags [.], ack 989724, win 65535, length 0
00:14:32.810892 IP 151.101.117.164.443 > 10.0.2.15.44018: Flags [.], seq 989724:991184, ack 352, win 65535, length 1460
00:14:32.811527 IP 151.101.117.164.443 > 10.0.2.15.44018: Flags [.], seq 991184:992644, ack 352, win 65535, length 1460
00:14:32.811552 IP 10.0.2.15.44018 > 151.101.117.164.443: Flags [.], ack 992644, win 65535, length 0
00:14:32.811891 IP 151.101.117.164.443 > 10.0.2.15.44018: Flags [.], seq 992644:1007244, ack 352, win 65535, length 14600
00:14:32.811916 IP 10.0.2.15.44018 > 151.101.117.164.443: Flags [.], ack 1007244, win 65535, length 0
00:14:32.812134 IP 151.101.117.164.443 > 10.0.2.15.44018: Flags [.], seq 1007244:1008704, ack 352, win 65535, length 1460
00:14:32.812577 IP 151.101.117.164.443 > 10.0.2.15.44018: Flags [.], seq 1008704:1010164, ack 352, win 65535, length 1460
00:14:32.812599 IP 10.0.2.15.44018 > 151.101.117.164.443: Flags [.], ack 1010164, win 65535, length 0
00:14:32.813284 IP 151.101.117.164.443 > 10.0.2.15.44018: Flags [.], seq 1010164:1011624, ack 352, win 65535, length 1460
00:14:32.813683 IP 151.101.117.164.443 > 10.0.2.15.44018: Flags [.], seq 1011624:1013084, ack 352, win 65535, length 1460
00:14:32.813712 IP 10.0.2.15.44018 > 151.101.117.164.443: Flags [.], ack 1013084, win 65535, length 0
00:14:32.819163 IP 151.101.117.164.443 > 10.0.2.15.44018: Flags [.], seq 1013084:1014544, ack 352, win 65535, length 1460
00:14:32.819607 IP 151.101.117.164.443 > 10.0.2.15.44018: Flags [.], seq 1014544:1017464, ack 352, win 65535, length 2920
00:14:32.819685 IP 151.101.117.164.443 > 10.0.2.15.44018: Flags [.], seq 1017464:1018924, ack 352, win 65535, length 1460
00:14:32.819822 IP 151.101.117.164.443 > 10.0.2.15.44018: Flags [.], seq 1018924:1023304, ack 352, win 65535, length 4380
00:14:32.819841 IP 10.0.2.15.44018 > 151.101.117.164.443: Flags [.], ack 1018924, win 65535, length 0
00:14:32.819932 IP 151.101.117.164.443 > 10.0.2.15.44018: Flags [.], seq 1023304:1024764, ack 352, win 65535, length 1460
00:14:32.819965 IP 10.0.2.15.44018 > 151.101.117.164.443: Flags [.], ack 1024764, win 65535, length 0
00:14:32.820006 IP 151.101.117.164.443 > 10.0.2.15.44018: Flags [.], seq 1024764:1026224, ack 352, win 65535, length 1460
00:14:32.820529 IP 151.101.117.164.443 > 10.0.2.15.44018: Flags [.], seq 1026224:1027684, ack 352, win 65535, length 1460
00:14:32.820549 IP 10.0.2.15.44018 > 151.101.117.164.443: Flags [.], ack 1027684, win 65535, length 0
00:14:32.820902 IP 151.101.117.164.443 > 10.0.2.15.44018: Flags [.], seq 1027684:1029144, ack 352, win 65535, length 1460
00:14:32.822139 IP 151.101.117.164.443 > 10.0.2.15.44018: Flags [.], seq 1029144:1049584, ack 352, win 65535, length 20440
00:14:32.822668 IP 10.0.2.15.44018 > 151.101.117.164.443: Flags [.], ack 1049584, win 65535, length 0
00:14:32.824605 IP 151.101.117.164.443 > 10.0.2.15.44018: Flags [.], seq 1049584:1052504, ack 352, win 65535, length 2920
00:14:32.824759 IP 10.0.2.15.44018 > 151.101.117.164.443: Flags [.], ack 1052504, win 65535, length 0
00:14:32.831088 IP 151.101.117.164.443 > 10.0.2.15.44018: Flags [.], seq 1052504:1053964, ack 352, win 65535, length 1460
00:14:32.833678 IP 151.101.117.164.443 > 10.0.2.15.44018: Flags [P.], seq 1053964:1055424, ack 352, win 65535, length 1460
00:14:32.833704 IP 10.0.2.15.44018 > 151.101.117.164.443: Flags [.], ack 1055424, win 65535, length 0
00:14:32.834361 IP 151.101.117.164.443 > 10.0.2.15.44018: Flags [.], seq 1055424:1056884, ack 352, win 65535, length 1460
00:14:32.834967 IP 151.101.117.164.443 > 10.0.2.15.44018: Flags [.], seq 1056884:1058344, ack 352, win 65535, length 1460
00:14:32.834992 IP 10.0.2.15.44018 > 151.101.117.164.443: Flags [.], ack 1058344, win 65535, length 0
00:14:32.835606 IP 151.101.117.164.443 > 10.0.2.15.44018: Flags [.], seq 1058344:1059804, ack 352, win 65535, length 1460
00:14:32.837904 IP 151.101.117.164.443 > 10.0.2.15.44018: Flags [P.], seq 1059804:1093384, ack 352, win 65535, length 33580
00:14:32.838121 IP 10.0.2.15.44018 > 151.101.117.164.443: Flags [.], ack 1093384, win 65535, length 0
00:14:32.839359 IP 151.101.117.164.443 > 10.0.2.15.44018: Flags [.], seq 1093384:1157624, ack 352, win 65535, length 64240
00:14:32.844361 IP 10.0.2.15.44018 > 151.101.117.164.443: Flags [.], ack 1157624, win 65535, length 0
00:14:32.847848 IP 151.101.117.164.443 > 10.0.2.15.44018: Flags [P.], seq 1157624:1159084, ack 352, win 65535, length 1460

