22:06:45.707204 IP 10.0.2.15.45097 > 140.233.253.2.53: 35378+ A? www.imdb.com. (30)
22:06:45.707247 IP 10.0.2.15.45097 > 140.233.253.2.53: 49469+ AAAA? www.imdb.com. (30)
22:06:45.712676 IP 140.233.253.2.53 > 10.0.2.15.45097: 35378 3/0/0 CNAME tp.391b988c0-frontier.imdb.com., CNAME d2bytcopxu066p.cloudfront.net., A 13.224.208.10 (125)
22:06:45.712678 IP 140.233.253.2.53 > 10.0.2.15.45097: 49469 2/1/0 CNAME tp.391b988c0-frontier.imdb.com., CNAME d2bytcopxu066p.cloudfront.net. (191)
22:06:45.713076 IP 10.0.2.15.57380 > 13.224.208.10.443: Flags [S], seq 4064381730, win 64240, options [mss 1460,sackOK,TS val 3642824303 ecr 0,nop,wscale 6], length 0
22:06:45.729522 IP 13.224.208.10.443 > 10.0.2.15.57380: Flags [S.], seq 300544001, ack 4064381731, win 65535, options [mss 1460], length 0
22:06:45.729665 IP 10.0.2.15.57380 > 13.224.208.10.443: Flags [.], ack 1, win 64240, length 0
22:06:45.763708 IP 10.0.2.15.57380 > 13.224.208.10.443: Flags [P.], seq 1:518, ack 1, win 64240, length 517
22:06:45.764546 IP 13.224.208.10.443 > 10.0.2.15.57380: Flags [.], ack 518, win 65535, length 0
22:06:45.785631 IP 13.224.208.10.443 > 10.0.2.15.57380: Flags [.], seq 1:2921, ack 518, win 65535, length 2920
22:06:45.785653 IP 10.0.2.15.57380 > 13.224.208.10.443: Flags [.], ack 2921, win 62780, length 0
22:06:45.785801 IP 13.224.208.10.443 > 10.0.2.15.57380: Flags [P.], seq 2921:4123, ack 518, win 65535, length 1202
22:06:45.785814 IP 10.0.2.15.57380 > 13.224.208.10.443: Flags [.], ack 4123, win 61578, length 0
22:06:45.795567 IP 13.224.208.10.443 > 10.0.2.15.57380: Flags [P.], seq 4123:5509, ack 518, win 65535, length 1386
22:06:45.795584 IP 10.0.2.15.57380 > 13.224.208.10.443: Flags [.], ack 5509, win 62780, length 0
22:06:45.796369 IP 10.0.2.15.57380 > 13.224.208.10.443: Flags [P.], seq 518:582, ack 5509, win 62780, length 64
22:06:45.796584 IP 13.224.208.10.443 > 10.0.2.15.57380: Flags [.], ack 582, win 65535, length 0
22:06:45.796678 IP 10.0.2.15.57380 > 13.224.208.10.443: Flags [P.], seq 582:628, ack 5509, win 62780, length 46
22:06:45.796703 IP 10.0.2.15.57380 > 13.224.208.10.443: Flags [P.], seq 628:677, ack 5509, win 62780, length 49
22:06:45.796827 IP 10.0.2.15.57380 > 13.224.208.10.443: Flags [P.], seq 677:712, ack 5509, win 62780, length 35
22:06:45.796992 IP 13.224.208.10.443 > 10.0.2.15.57380: Flags [.], ack 628, win 65535, length 0
22:06:45.796993 IP 13.224.208.10.443 > 10.0.2.15.57380: Flags [.], ack 677, win 65535, length 0
22:06:45.797076 IP 10.0.2.15.57380 > 13.224.208.10.443: Flags [P.], seq 712:772, ack 5509, win 62780, length 60
22:06:45.797242 IP 13.224.208.10.443 > 10.0.2.15.57380: Flags [.], ack 712, win 65535, length 0
22:06:45.797242 IP 13.224.208.10.443 > 10.0.2.15.57380: Flags [.], ack 772, win 65535, length 0
22:06:45.811782 IP 13.224.208.10.443 > 10.0.2.15.57380: Flags [P.], seq 5509:5580, ack 772, win 65535, length 71
22:06:45.811800 IP 10.0.2.15.57380 > 13.224.208.10.443: Flags [.], ack 5580, win 62780, length 0
22:06:45.812082 IP 10.0.2.15.57380 > 13.224.208.10.443: Flags [P.], seq 772:803, ack 5580, win 62780, length 31
22:06:45.812530 IP 13.224.208.10.443 > 10.0.2.15.57380: Flags [.], ack 803, win 65535, length 0
22:06:46.293992 IP 13.224.208.10.443 > 10.0.2.15.57380: Flags [.], seq 5580:14340, ack 803, win 65535, length 8760
22:06:46.294119 IP 10.0.2.15.57380 > 13.224.208.10.443: Flags [.], ack 14340, win 58400, length 0
22:06:46.294720 IP 13.224.208.10.443 > 10.0.2.15.57380: Flags [.], seq 14340:20180, ack 803, win 65535, length 5840
22:06:46.294749 IP 10.0.2.15.57380 > 13.224.208.10.443: Flags [.], ack 20180, win 55480, length 0
22:06:46.295029 IP 13.224.208.10.443 > 10.0.2.15.57380: Flags [.], seq 20180:30400, ack 803, win 65535, length 10220
22:06:46.295108 IP 10.0.2.15.57380 > 13.224.208.10.443: Flags [.], ack 30400, win 48180, length 0
22:06:46.295710 IP 13.224.208.10.443 > 10.0.2.15.57380: Flags [.], seq 30400:43540, ack 803, win 65535, length 13140
22:06:46.295732 IP 10.0.2.15.57380 > 13.224.208.10.443: Flags [.], ack 43540, win 39420, length 0
22:06:46.295979 IP 13.224.208.10.443 > 10.0.2.15.57380: Flags [P.], seq 43540:49195, ack 803, win 65535, length 5655
22:06:46.295997 IP 10.0.2.15.57380 > 13.224.208.10.443: Flags [.], ack 49195, win 35040, length 0
22:06:46.312037 IP 13.224.208.10.443 > 10.0.2.15.57380: Flags [.], seq 49195:65255, ack 803, win 65535, length 16060
22:06:46.312058 IP 10.0.2.15.57380 > 13.224.208.10.443: Flags [.], ack 65255, win 54020, length 0
22:06:46.312587 IP 13.224.208.10.443 > 10.0.2.15.57380: Flags [P.], seq 65255:79423, ack 803, win 65535, length 14168
22:06:46.312599 IP 10.0.2.15.57380 > 13.224.208.10.443: Flags [.], ack 79423, win 43800, length 0
22:06:46.313571 IP 13.224.208.10.443 > 10.0.2.15.57380: Flags [P.], seq 79423:86293, ack 803, win 65535, length 6870
22:06:46.313574 IP 13.224.208.10.443 > 10.0.2.15.57380: Flags [P.], seq 86293:89041, ack 803, win 65535, length 2748
22:06:46.313575 IP 13.224.208.10.443 > 10.0.2.15.57380: Flags [P.], seq 89041:90415, ack 803, win 65535, length 1374
22:06:46.313599 IP 10.0.2.15.57380 > 13.224.208.10.443: Flags [.], ack 86293, win 65535, length 0
22:06:46.313636 IP 10.0.2.15.57380 > 13.224.208.10.443: Flags [.], ack 89041, win 65535, length 0
22:06:46.313649 IP 10.0.2.15.57380 > 13.224.208.10.443: Flags [.], ack 90415, win 65535, length 0
22:06:46.315113 IP 13.224.208.10.443 > 10.0.2.15.57380: Flags [P.], seq 90415:91789, ack 803, win 65535, length 1374
22:06:46.315137 IP 10.0.2.15.57380 > 13.224.208.10.443: Flags [.], ack 91789, win 65535, length 0
22:06:46.327886 IP 13.224.208.10.443 > 10.0.2.15.57380: Flags [P.], seq 91789:98659, ack 803, win 65535, length 6870
22:06:46.327895 IP 13.224.208.10.443 > 10.0.2.15.57380: Flags [P.], seq 98659:101407, ack 803, win 65535, length 2748
22:06:46.327965 IP 10.0.2.15.57380 > 13.224.208.10.443: Flags [.], ack 98659, win 65535, length 0
22:06:46.329655 IP 10.0.2.15.57380 > 13.224.208.10.443: Flags [.], ack 101407, win 65535, length 0
22:06:46.336225 IP 13.224.208.10.443 > 10.0.2.15.57380: Flags [P.], seq 101407:108277, ack 803, win 65535, length 6870
22:06:46.336230 IP 13.224.208.10.443 > 10.0.2.15.57380: Flags [.], seq 108277:124337, ack 803, win 65535, length 16060
22:06:46.336252 IP 10.0.2.15.57380 > 13.224.208.10.443: Flags [.], ack 108277, win 65535, length 0
22:06:46.336476 IP 10.0.2.15.57380 > 13.224.208.10.443: Flags [.], ack 124337, win 65535, length 0
22:06:46.337516 IP 13.224.208.10.443 > 10.0.2.15.57380: Flags [.], seq 124337:128717, ack 803, win 65535, length 4380
22:06:46.337543 IP 10.0.2.15.57380 > 13.224.208.10.443: Flags [.], ack 128717, win 65535, length 0
22:06:46.341315 IP 13.224.208.10.443 > 10.0.2.15.57380: Flags [P.], seq 128717:134383, ack 803, win 65535, length 5666
22:06:46.341337 IP 10.0.2.15.57380 > 13.224.208.10.443: Flags [.], ack 134383, win 65535, length 0
22:06:46.351682 IP 13.224.208.10.443 > 10.0.2.15.57380: Flags [P.], seq 134383:145375, ack 803, win 65535, length 10992
22:06:46.351705 IP 10.0.2.15.57380 > 13.224.208.10.443: Flags [.], ack 145375, win 65535, length 0
22:06:46.359073 IP 13.224.208.10.443 > 10.0.2.15.57380: Flags [.], seq 145375:167275, ack 803, win 65535, length 21900
22:06:46.359095 IP 10.0.2.15.57380 > 13.224.208.10.443: Flags [.], ack 167275, win 65535, length 0
22:06:46.363167 IP 13.224.208.10.443 > 10.0.2.15.57380: Flags [P.], seq 167275:193555, ack 803, win 65535, length 26280
22:06:46.363193 IP 10.0.2.15.57380 > 13.224.208.10.443: Flags [.], ack 193555, win 65535, length 0
22:06:46.365362 IP 13.224.208.10.443 > 10.0.2.15.57380: Flags [.], seq 193555:203775, ack 803, win 65535, length 10220
22:06:46.365388 IP 10.0.2.15.57380 > 13.224.208.10.443: Flags [.], ack 203775, win 65535, length 0
22:06:46.386897 IP 13.224.208.10.443 > 10.0.2.15.57380: Flags [P.], seq 203775:232975, ack 803, win 65535, length 29200
22:06:46.386925 IP 10.0.2.15.57380 > 13.224.208.10.443: Flags [.], ack 232975, win 65535, length 0
22:06:46.386981 IP 13.224.208.10.443 > 10.0.2.15.57380: Flags [.], seq 232975:243195, ack 803, win 65535, length 10220
22:06:46.386989 IP 10.0.2.15.57380 > 13.224.208.10.443: Flags [.], ack 243195, win 65535, length 0
22:06:46.389015 IP 13.224.208.10.443 > 10.0.2.15.57380: Flags [P.], seq 243195:269475, ack 803, win 65535, length 26280
22:06:46.389043 IP 10.0.2.15.57380 > 13.224.208.10.443: Flags [.], ack 269475, win 65535, length 0
22:06:46.389164 IP 13.224.208.10.443 > 10.0.2.15.57380: Flags [.], seq 269475:285535, ack 803, win 65535, length 16060
22:06:46.389178 IP 10.0.2.15.57380 > 13.224.208.10.443: Flags [.], ack 285535, win 65535, length 0
22:06:46.402852 IP 13.224.208.10.443 > 10.0.2.15.57380: Flags [P.], seq 285535:308895, ack 803, win 65535, length 23360
22:06:46.402879 IP 10.0.2.15.57380 > 13.224.208.10.443: Flags [.], ack 308895, win 65535, length 0
22:06:46.403454 IP 13.224.208.10.443 > 10.0.2.15.57380: Flags [.], seq 308895:330795, ack 803, win 65535, length 21900
22:06:46.403480 IP 10.0.2.15.57380 > 13.224.208.10.443: Flags [.], ack 330795, win 65535, length 0
22:06:46.407023 IP 13.224.208.10.443 > 10.0.2.15.57380: Flags [.], seq 330795:332255, ack 803, win 65535, length 1460
22:06:46.407053 IP 10.0.2.15.57380 > 13.224.208.10.443: Flags [.], ack 332255, win 65535, length 0
22:06:46.407884 IP 13.224.208.10.443 > 10.0.2.15.57380: Flags [P.], seq 332255:351235, ack 803, win 65535, length 18980
22:06:46.407912 IP 10.0.2.15.57380 > 13.224.208.10.443: Flags [.], ack 351235, win 65535, length 0
22:06:46.408691 IP 13.224.208.10.443 > 10.0.2.15.57380: Flags [.], seq 351235:381895, ack 803, win 65535, length 30660
22:06:46.408720 IP 10.0.2.15.57380 > 13.224.208.10.443: Flags [.], ack 381895, win 65535, length 0
22:06:46.408941 IP 13.224.208.10.443 > 10.0.2.15.57380: Flags [P.], seq 381895:396495, ack 803, win 65535, length 14600
22:06:46.408955 IP 10.0.2.15.57380 > 13.224.208.10.443: Flags [.], ack 396495, win 65535, length 0
22:06:46.408997 IP 13.224.208.10.443 > 10.0.2.15.57380: Flags [.], seq 396495:406715, ack 803, win 65535, length 10220
22:06:46.409004 IP 10.0.2.15.57380 > 13.224.208.10.443: Flags [.], ack 406715, win 65535, length 0
22:06:46.413294 IP 13.224.208.10.443 > 10.0.2.15.57380: Flags [.], seq 406715:408175, ack 803, win 65535, length 1460
22:06:46.413322 IP 10.0.2.15.57380 > 13.224.208.10.443: Flags [.], ack 408175, win 65535, length 0
22:06:46.426051 IP 13.224.208.10.443 > 10.0.2.15.57380: Flags [.], seq 408175:409635, ack 803, win 65535, length 1460
22:06:46.426074 IP 10.0.2.15.57380 > 13.224.208.10.443: Flags [.], ack 409635, win 65535, length 0
22:06:46.428851 IP 13.224.208.10.443 > 10.0.2.15.57380: Flags [.], seq 409635:411095, ack 803, win 65535, length 1460
22:06:46.428875 IP 10.0.2.15.57380 > 13.224.208.10.443: Flags [.], ack 411095, win 65535, length 0
22:06:46.434020 IP 13.224.208.10.443 > 10.0.2.15.57380: Flags [.], seq 411095:416935, ack 803, win 65535, length 5840
22:06:46.434043 IP 10.0.2.15.57380 > 13.224.208.10.443: Flags [.], ack 416935, win 65535, length 0
22:06:46.434348 IP 13.224.208.10.443 > 10.0.2.15.57380: Flags [.], seq 416935:421315, ack 803, win 65535, length 4380
22:06:46.434366 IP 10.0.2.15.57380 > 13.224.208.10.443: Flags [.], ack 421315, win 65535, length 0
22:06:46.435777 IP 13.224.208.10.443 > 10.0.2.15.57380: Flags [P.], seq 421315:447595, ack 803, win 65535, length 26280
22:06:46.435803 IP 10.0.2.15.57380 > 13.224.208.10.443: Flags [.], ack 447595, win 65535, length 0
22:06:46.435862 IP 13.224.208.10.443 > 10.0.2.15.57380: Flags [.], seq 447595:457815, ack 803, win 65535, length 10220
22:06:46.435921 IP 10.0.2.15.57380 > 13.224.208.10.443: Flags [.], ack 457815, win 65535, length 0
22:06:46.436101 IP 13.224.208.10.443 > 10.0.2.15.57380: Flags [.], seq 457815:460735, ack 803, win 65535, length 2920
22:06:46.436111 IP 10.0.2.15.57380 > 13.224.208.10.443: Flags [.], ack 460735, win 65535, length 0
22:06:46.436572 IP 13.224.208.10.443 > 10.0.2.15.57380: Flags [.], seq 460735:463655, ack 803, win 65535, length 2920
22:06:46.436679 IP 10.0.2.15.57380 > 13.224.208.10.443: Flags [.], ack 463655, win 65535, length 0
22:06:46.437367 IP 13.224.208.10.443 > 10.0.2.15.57380: Flags [.], seq 463655:465115, ack 803, win 65535, length 1460
22:06:46.437391 IP 10.0.2.15.57380 > 13.224.208.10.443: Flags [.], ack 465115, win 65535, length 0
22:06:46.437575 IP 13.224.208.10.443 > 10.0.2.15.57380: Flags [.], seq 465115:468035, ack 803, win 65535, length 2920
22:06:46.437604 IP 10.0.2.15.57380 > 13.224.208.10.443: Flags [.], ack 468035, win 65535, length 0
22:06:46.437719 IP 13.224.208.10.443 > 10.0.2.15.57380: Flags [.], seq 468035:472415, ack 803, win 65535, length 4380
22:06:46.437728 IP 10.0.2.15.57380 > 13.224.208.10.443: Flags [.], ack 472415, win 65535, length 0
22:06:46.438200 IP 13.224.208.10.443 > 10.0.2.15.57380: Flags [.], seq 472415:475335, ack 803, win 65535, length 2920
22:06:46.438220 IP 10.0.2.15.57380 > 13.224.208.10.443: Flags [.], ack 475335, win 65535, length 0
22:06:46.449547 IP 13.224.208.10.443 > 10.0.2.15.57380: Flags [.], seq 475335:476795, ack 803, win 65535, length 1460
22:06:46.449650 IP 10.0.2.15.57380 > 13.224.208.10.443: Flags [.], ack 476795, win 65535, length 0
22:06:46.452224 IP 13.224.208.10.443 > 10.0.2.15.57380: Flags [.], seq 476795:478255, ack 803, win 65535, length 1460
22:06:46.452247 IP 10.0.2.15.57380 > 13.224.208.10.443: Flags [.], ack 478255, win 65535, length 0
22:06:46.458809 IP 13.224.208.10.443 > 10.0.2.15.57380: Flags [.], seq 478255:479715, ack 803, win 65535, length 1460
22:06:46.458835 IP 10.0.2.15.57380 > 13.224.208.10.443: Flags [.], ack 479715, win 65535, length 0
22:06:46.459884 IP 13.224.208.10.443 > 10.0.2.15.57380: Flags [.], seq 479715:481175, ack 803, win 65535, length 1460
22:06:46.459904 IP 10.0.2.15.57380 > 13.224.208.10.443: Flags [.], ack 481175, win 65535, length 0
22:06:46.472519 IP 13.224.208.10.443 > 10.0.2.15.57380: Flags [P.], seq 481175:482635, ack 803, win 65535, length 1460
22:06:46.472543 IP 10.0.2.15.57380 > 13.224.208.10.443: Flags [.], ack 482635, win 65535, length 0

