22:02:30.732008 IP 10.0.2.15.35338 > 140.233.253.2.53: 14798+ A? www.imdb.com. (30)
22:02:30.732050 IP 10.0.2.15.35338 > 140.233.253.2.53: 55858+ AAAA? www.imdb.com. (30)
22:02:30.738430 IP 140.233.253.2.53 > 10.0.2.15.35338: 14798 3/0/0 CNAME tp.391b988c0-frontier.imdb.com., CNAME d2bytcopxu066p.cloudfront.net., A 13.224.208.10 (125)
22:02:30.738432 IP 140.233.253.2.53 > 10.0.2.15.35338: 55858 2/1/0 CNAME tp.391b988c0-frontier.imdb.com., CNAME d2bytcopxu066p.cloudfront.net. (191)
22:02:30.738837 IP 10.0.2.15.57300 > 13.224.208.10.443: Flags [S], seq 1407804648, win 64240, options [mss 1460,sackOK,TS val 3642569329 ecr 0,nop,wscale 6], length 0
22:02:30.754282 IP 13.224.208.10.443 > 10.0.2.15.57300: Flags [S.], seq 291328001, ack 1407804649, win 65535, options [mss 1460], length 0
22:02:30.754340 IP 10.0.2.15.57300 > 13.224.208.10.443: Flags [.], ack 1, win 64240, length 0
22:02:30.763638 IP 10.0.2.15.57300 > 13.224.208.10.443: Flags [P.], seq 1:518, ack 1, win 64240, length 517
22:02:30.764685 IP 13.224.208.10.443 > 10.0.2.15.57300: Flags [.], ack 518, win 65535, length 0
22:02:30.780955 IP 13.224.208.10.443 > 10.0.2.15.57300: Flags [P.], seq 1:2749, ack 518, win 65535, length 2748
22:02:30.780978 IP 10.0.2.15.57300 > 13.224.208.10.443: Flags [.], ack 2749, win 62780, length 0
22:02:30.783381 IP 13.224.208.10.443 > 10.0.2.15.57300: Flags [P.], seq 2749:5509, ack 518, win 65535, length 2760
22:02:30.783400 IP 10.0.2.15.57300 > 13.224.208.10.443: Flags [.], ack 5509, win 62780, length 0
22:02:30.784439 IP 10.0.2.15.57300 > 13.224.208.10.443: Flags [P.], seq 518:582, ack 5509, win 62780, length 64
22:02:30.784754 IP 13.224.208.10.443 > 10.0.2.15.57300: Flags [.], ack 582, win 65535, length 0
22:02:30.784804 IP 10.0.2.15.57300 > 13.224.208.10.443: Flags [P.], seq 582:628, ack 5509, win 62780, length 46
22:02:30.784837 IP 10.0.2.15.57300 > 13.224.208.10.443: Flags [P.], seq 628:677, ack 5509, win 62780, length 49
22:02:30.785109 IP 13.224.208.10.443 > 10.0.2.15.57300: Flags [.], ack 628, win 65535, length 0
22:02:30.785110 IP 13.224.208.10.443 > 10.0.2.15.57300: Flags [.], ack 677, win 65535, length 0
22:02:30.785448 IP 10.0.2.15.57300 > 13.224.208.10.443: Flags [P.], seq 677:772, ack 5509, win 62780, length 95
22:02:30.785783 IP 13.224.208.10.443 > 10.0.2.15.57300: Flags [.], ack 772, win 65535, length 0
22:02:30.798996 IP 13.224.208.10.443 > 10.0.2.15.57300: Flags [P.], seq 5509:5571, ack 772, win 65535, length 62
22:02:30.799016 IP 10.0.2.15.57300 > 13.224.208.10.443: Flags [.], ack 5571, win 62780, length 0
22:02:30.799322 IP 10.0.2.15.57300 > 13.224.208.10.443: Flags [P.], seq 772:803, ack 5571, win 62780, length 31
22:02:30.799818 IP 13.224.208.10.443 > 10.0.2.15.57300: Flags [.], ack 803, win 65535, length 0
22:02:30.800001 IP 13.224.208.10.443 > 10.0.2.15.57300: Flags [P.], seq 5571:5602, ack 803, win 65535, length 31
22:02:30.800010 IP 10.0.2.15.57300 > 13.224.208.10.443: Flags [.], ack 5602, win 62780, length 0
22:02:31.326957 IP 13.224.208.10.443 > 10.0.2.15.57300: Flags [P.], seq 5602:13846, ack 803, win 65535, length 8244
22:02:31.326994 IP 10.0.2.15.57300 > 13.224.208.10.443: Flags [.], ack 13846, win 58400, length 0
22:02:31.327550 IP 13.224.208.10.443 > 10.0.2.15.57300: Flags [.], seq 13846:19686, ack 803, win 65535, length 5840
22:02:31.327575 IP 10.0.2.15.57300 > 13.224.208.10.443: Flags [.], ack 19686, win 55480, length 0
22:02:31.328189 IP 13.224.208.10.443 > 10.0.2.15.57300: Flags [.], seq 19686:24066, ack 803, win 65535, length 4380
22:02:31.328324 IP 13.224.208.10.443 > 10.0.2.15.57300: Flags [.], seq 24066:31366, ack 803, win 65535, length 7300
22:02:31.328389 IP 10.0.2.15.57300 > 13.224.208.10.443: Flags [.], ack 31366, win 49640, length 0
22:02:31.328744 IP 13.224.208.10.443 > 10.0.2.15.57300: Flags [.], seq 31366:44506, ack 803, win 65535, length 13140
22:02:31.328772 IP 10.0.2.15.57300 > 13.224.208.10.443: Flags [.], ack 44506, win 36500, length 0
22:02:31.329104 IP 13.224.208.10.443 > 10.0.2.15.57300: Flags [P.], seq 44506:49216, ack 803, win 65535, length 4710
22:02:31.329117 IP 10.0.2.15.57300 > 13.224.208.10.443: Flags [.], ack 49216, win 43800, length 0
22:02:31.340963 IP 13.224.208.10.443 > 10.0.2.15.57300: Flags [P.], seq 49216:50590, ack 803, win 65535, length 1374
22:02:31.340981 IP 10.0.2.15.57300 > 13.224.208.10.443: Flags [.], ack 50590, win 62780, length 0
22:02:31.342169 IP 13.224.208.10.443 > 10.0.2.15.57300: Flags [P.], seq 50590:54712, ack 803, win 65535, length 4122
22:02:31.342187 IP 10.0.2.15.57300 > 13.224.208.10.443: Flags [.], ack 54712, win 61320, length 0
22:02:31.343400 IP 13.224.208.10.443 > 10.0.2.15.57300: Flags [P.], seq 54712:56086, ack 803, win 65535, length 1374
22:02:31.343418 IP 10.0.2.15.57300 > 13.224.208.10.443: Flags [.], ack 56086, win 62780, length 0
22:02:31.345550 IP 13.224.208.10.443 > 10.0.2.15.57300: Flags [P.], seq 56086:65704, ack 803, win 65535, length 9618
22:02:31.345574 IP 10.0.2.15.57300 > 13.224.208.10.443: Flags [.], ack 65704, win 58400, length 0
22:02:31.346695 IP 13.224.208.10.443 > 10.0.2.15.57300: Flags [P.], seq 65704:71200, ack 803, win 65535, length 5496
22:02:31.346715 IP 10.0.2.15.57300 > 13.224.208.10.443: Flags [.], ack 71200, win 61320, length 0
22:02:31.347631 IP 13.224.208.10.443 > 10.0.2.15.57300: Flags [P.], seq 71200:79444, ack 803, win 65535, length 8244
22:02:31.347633 IP 13.224.208.10.443 > 10.0.2.15.57300: Flags [P.], seq 79444:80818, ack 803, win 65535, length 1374
22:02:31.347634 IP 13.224.208.10.443 > 10.0.2.15.57300: Flags [P.], seq 80818:82192, ack 803, win 65535, length 1374
22:02:31.347658 IP 10.0.2.15.57300 > 13.224.208.10.443: Flags [.], ack 79444, win 65535, length 0
22:02:31.347696 IP 10.0.2.15.57300 > 13.224.208.10.443: Flags [.], ack 80818, win 65535, length 0
22:02:31.347711 IP 10.0.2.15.57300 > 13.224.208.10.443: Flags [.], ack 82192, win 65535, length 0
22:02:31.348787 IP 13.224.208.10.443 > 10.0.2.15.57300: Flags [.], seq 82192:83652, ack 803, win 65535, length 1460
22:02:31.348809 IP 10.0.2.15.57300 > 13.224.208.10.443: Flags [.], ack 83652, win 65535, length 0
22:02:31.349164 IP 13.224.208.10.443 > 10.0.2.15.57300: Flags [P.], seq 83652:87688, ack 803, win 65535, length 4036
22:02:31.349174 IP 10.0.2.15.57300 > 13.224.208.10.443: Flags [.], ack 87688, win 65535, length 0
22:02:31.349839 IP 13.224.208.10.443 > 10.0.2.15.57300: Flags [P.], seq 87688:91810, ack 803, win 65535, length 4122
22:02:31.349851 IP 10.0.2.15.57300 > 13.224.208.10.443: Flags [.], ack 91810, win 65535, length 0
22:02:31.352094 IP 13.224.208.10.443 > 10.0.2.15.57300: Flags [P.], seq 91810:93184, ack 803, win 65535, length 1374
22:02:31.352116 IP 10.0.2.15.57300 > 13.224.208.10.443: Flags [.], ack 93184, win 65535, length 0
22:02:31.356245 IP 13.224.208.10.443 > 10.0.2.15.57300: Flags [P.], seq 93184:97306, ack 803, win 65535, length 4122
22:02:31.356265 IP 10.0.2.15.57300 > 13.224.208.10.443: Flags [.], ack 97306, win 65535, length 0
22:02:31.357404 IP 13.224.208.10.443 > 10.0.2.15.57300: Flags [P.], seq 97306:98680, ack 803, win 65535, length 1374
22:02:31.357424 IP 10.0.2.15.57300 > 13.224.208.10.443: Flags [.], ack 98680, win 65535, length 0
22:02:31.359822 IP 13.224.208.10.443 > 10.0.2.15.57300: Flags [P.], seq 98680:108298, ack 803, win 65535, length 9618
22:02:31.359844 IP 10.0.2.15.57300 > 13.224.208.10.443: Flags [.], ack 108298, win 65535, length 0
22:02:31.361224 IP 13.224.208.10.443 > 10.0.2.15.57300: Flags [P.], seq 108298:115168, ack 803, win 65535, length 6870
22:02:31.361245 IP 10.0.2.15.57300 > 13.224.208.10.443: Flags [.], ack 115168, win 65535, length 0
22:02:31.364555 IP 13.224.208.10.443 > 10.0.2.15.57300: Flags [P.], seq 115168:122038, ack 803, win 65535, length 6870
22:02:31.364557 IP 13.224.208.10.443 > 10.0.2.15.57300: Flags [P.], seq 122038:123412, ack 803, win 65535, length 1374
22:02:31.364579 IP 10.0.2.15.57300 > 13.224.208.10.443: Flags [.], ack 122038, win 65535, length 0
22:02:31.364616 IP 10.0.2.15.57300 > 13.224.208.10.443: Flags [.], ack 123412, win 65535, length 0
22:02:31.365537 IP 13.224.208.10.443 > 10.0.2.15.57300: Flags [.], seq 123412:130712, ack 803, win 65535, length 7300
22:02:31.365556 IP 10.0.2.15.57300 > 13.224.208.10.443: Flags [.], ack 130712, win 65535, length 0
22:02:31.365725 IP 13.224.208.10.443 > 10.0.2.15.57300: Flags [P.], seq 130712:133030, ack 803, win 65535, length 2318
22:02:31.365734 IP 10.0.2.15.57300 > 13.224.208.10.443: Flags [.], ack 133030, win 65535, length 0
22:02:31.366255 IP 13.224.208.10.443 > 10.0.2.15.57300: Flags [P.], seq 133030:134404, ack 803, win 65535, length 1374
22:02:31.366273 IP 10.0.2.15.57300 > 13.224.208.10.443: Flags [.], ack 134404, win 65535, length 0
22:02:31.367531 IP 13.224.208.10.443 > 10.0.2.15.57300: Flags [P.], seq 134404:137152, ack 803, win 65535, length 2748
22:02:31.367554 IP 10.0.2.15.57300 > 13.224.208.10.443: Flags [.], ack 137152, win 65535, length 0
22:02:31.371162 IP 13.224.208.10.443 > 10.0.2.15.57300: Flags [P.], seq 137152:139900, ack 803, win 65535, length 2748
22:02:31.371166 IP 13.224.208.10.443 > 10.0.2.15.57300: Flags [P.], seq 139900:145396, ack 803, win 65535, length 5496
22:02:31.371194 IP 10.0.2.15.57300 > 13.224.208.10.443: Flags [.], ack 139900, win 65535, length 0
22:02:31.371241 IP 10.0.2.15.57300 > 13.224.208.10.443: Flags [.], ack 145396, win 65535, length 0
22:02:31.373333 IP 13.224.208.10.443 > 10.0.2.15.57300: Flags [P.], seq 145396:152266, ack 803, win 65535, length 6870
22:02:31.373353 IP 10.0.2.15.57300 > 13.224.208.10.443: Flags [.], ack 152266, win 65535, length 0
22:02:31.374528 IP 13.224.208.10.443 > 10.0.2.15.57300: Flags [P.], seq 152266:161884, ack 803, win 65535, length 9618
22:02:31.374550 IP 10.0.2.15.57300 > 13.224.208.10.443: Flags [.], ack 161884, win 65535, length 0
22:02:31.376808 IP 13.224.208.10.443 > 10.0.2.15.57300: Flags [P.], seq 161884:171502, ack 803, win 65535, length 9618
22:02:31.376811 IP 13.224.208.10.443 > 10.0.2.15.57300: Flags [P.], seq 171502:175624, ack 803, win 65535, length 4122
22:02:31.376834 IP 10.0.2.15.57300 > 13.224.208.10.443: Flags [.], ack 171502, win 65535, length 0
22:02:31.376878 IP 10.0.2.15.57300 > 13.224.208.10.443: Flags [.], ack 175624, win 65535, length 0
22:02:31.379642 IP 13.224.208.10.443 > 10.0.2.15.57300: Flags [.], seq 175624:180004, ack 803, win 65535, length 4380
22:02:31.379664 IP 10.0.2.15.57300 > 13.224.208.10.443: Flags [.], ack 180004, win 65535, length 0
22:02:31.379820 IP 13.224.208.10.443 > 10.0.2.15.57300: Flags [P.], seq 180004:183868, ack 803, win 65535, length 3864
22:02:31.379821 IP 13.224.208.10.443 > 10.0.2.15.57300: Flags [P.], seq 183868:185242, ack 803, win 65535, length 1374
22:02:31.379823 IP 13.224.208.10.443 > 10.0.2.15.57300: Flags [P.], seq 185242:192112, ack 803, win 65535, length 6870
22:02:31.379836 IP 10.0.2.15.57300 > 13.224.208.10.443: Flags [.], ack 183868, win 65535, length 0
22:02:31.379855 IP 10.0.2.15.57300 > 13.224.208.10.443: Flags [.], ack 185242, win 65535, length 0
22:02:31.379870 IP 10.0.2.15.57300 > 13.224.208.10.443: Flags [.], ack 192112, win 65535, length 0
22:02:31.379901 IP 13.224.208.10.443 > 10.0.2.15.57300: Flags [P.], seq 192112:194860, ack 803, win 65535, length 2748
22:02:31.379902 IP 13.224.208.10.443 > 10.0.2.15.57300: Flags [P.], seq 194860:197608, ack 803, win 65535, length 2748
22:02:31.379904 IP 13.224.208.10.443 > 10.0.2.15.57300: Flags [P.], seq 197608:203104, ack 803, win 65535, length 5496
22:02:31.379910 IP 10.0.2.15.57300 > 13.224.208.10.443: Flags [.], ack 194860, win 65535, length 0
22:02:31.379922 IP 10.0.2.15.57300 > 13.224.208.10.443: Flags [.], ack 197608, win 65535, length 0
22:02:31.379936 IP 10.0.2.15.57300 > 13.224.208.10.443: Flags [.], ack 203104, win 65535, length 0
22:02:31.380508 IP 13.224.208.10.443 > 10.0.2.15.57300: Flags [.], seq 203104:204564, ack 803, win 65535, length 1460
22:02:31.380527 IP 10.0.2.15.57300 > 13.224.208.10.443: Flags [.], ack 204564, win 65535, length 0
22:02:31.380784 IP 13.224.208.10.443 > 10.0.2.15.57300: Flags [P.], seq 204564:207226, ack 803, win 65535, length 2662
22:02:31.380801 IP 10.0.2.15.57300 > 13.224.208.10.443: Flags [.], ack 207226, win 65535, length 0
22:02:31.382012 IP 13.224.208.10.443 > 10.0.2.15.57300: Flags [P.], seq 207226:219592, ack 803, win 65535, length 12366
22:02:31.382082 IP 10.0.2.15.57300 > 13.224.208.10.443: Flags [.], ack 219592, win 65535, length 0
22:02:31.382895 IP 13.224.208.10.443 > 10.0.2.15.57300: Flags [P.], seq 219592:222340, ack 803, win 65535, length 2748
22:02:31.382912 IP 10.0.2.15.57300 > 13.224.208.10.443: Flags [.], ack 222340, win 65535, length 0
22:02:31.385407 IP 13.224.208.10.443 > 10.0.2.15.57300: Flags [P.], seq 222340:234706, ack 803, win 65535, length 12366
22:02:31.385426 IP 10.0.2.15.57300 > 13.224.208.10.443: Flags [.], ack 234706, win 65535, length 0
22:02:31.386068 IP 13.224.208.10.443 > 10.0.2.15.57300: Flags [P.], seq 234706:236080, ack 803, win 65535, length 1374
22:02:31.386082 IP 10.0.2.15.57300 > 13.224.208.10.443: Flags [.], ack 236080, win 65535, length 0
22:02:31.387432 IP 13.224.208.10.443 > 10.0.2.15.57300: Flags [P.], seq 236080:244324, ack 803, win 65535, length 8244
22:02:31.387436 IP 13.224.208.10.443 > 10.0.2.15.57300: Flags [P.], seq 244324:247072, ack 803, win 65535, length 2748
22:02:31.387465 IP 10.0.2.15.57300 > 13.224.208.10.443: Flags [.], ack 244324, win 65535, length 0
22:02:31.387519 IP 10.0.2.15.57300 > 13.224.208.10.443: Flags [.], ack 247072, win 65535, length 0
22:02:31.387547 IP 13.224.208.10.443 > 10.0.2.15.57300: Flags [P.], seq 247072:249820, ack 803, win 65535, length 2748
22:02:31.387554 IP 10.0.2.15.57300 > 13.224.208.10.443: Flags [.], ack 249820, win 65535, length 0
22:02:31.389664 IP 13.224.208.10.443 > 10.0.2.15.57300: Flags [P.], seq 249820:253942, ack 803, win 65535, length 4122
22:02:31.389737 IP 10.0.2.15.57300 > 13.224.208.10.443: Flags [.], ack 253942, win 65535, length 0
22:02:31.389948 IP 13.224.208.10.443 > 10.0.2.15.57300: Flags [P.], seq 253942:269056, ack 803, win 65535, length 15114
22:02:31.389961 IP 10.0.2.15.57300 > 13.224.208.10.443: Flags [.], ack 269056, win 65535, length 0
22:02:31.390625 IP 13.224.208.10.443 > 10.0.2.15.57300: Flags [P.], seq 269056:274552, ack 803, win 65535, length 5496
22:02:31.390627 IP 13.224.208.10.443 > 10.0.2.15.57300: Flags [P.], seq 274552:277300, ack 803, win 65535, length 2748
22:02:31.390695 IP 10.0.2.15.57300 > 13.224.208.10.443: Flags [.], ack 274552, win 65535, length 0
22:02:31.390722 IP 10.0.2.15.57300 > 13.224.208.10.443: Flags [.], ack 277300, win 65535, length 0
22:02:31.391133 IP 13.224.208.10.443 > 10.0.2.15.57300: Flags [P.], seq 277300:280048, ack 803, win 65535, length 2748
22:02:31.391134 IP 13.224.208.10.443 > 10.0.2.15.57300: Flags [P.], seq 280048:281422, ack 803, win 65535, length 1374
22:02:31.391145 IP 10.0.2.15.57300 > 13.224.208.10.443: Flags [.], ack 280048, win 65535, length 0
22:02:31.391167 IP 10.0.2.15.57300 > 13.224.208.10.443: Flags [.], ack 281422, win 65535, length 0
22:02:31.392106 IP 13.224.208.10.443 > 10.0.2.15.57300: Flags [P.], seq 281422:288292, ack 803, win 65535, length 6870
22:02:31.392108 IP 13.224.208.10.443 > 10.0.2.15.57300: Flags [P.], seq 288292:289666, ack 803, win 65535, length 1374
22:02:31.392127 IP 10.0.2.15.57300 > 13.224.208.10.443: Flags [.], ack 288292, win 65535, length 0
22:02:31.392150 IP 10.0.2.15.57300 > 13.224.208.10.443: Flags [.], ack 289666, win 65535, length 0
22:02:31.393130 IP 13.224.208.10.443 > 10.0.2.15.57300: Flags [P.], seq 289666:297910, ack 803, win 65535, length 8244
22:02:31.393151 IP 10.0.2.15.57300 > 13.224.208.10.443: Flags [.], ack 297910, win 65535, length 0
22:02:31.393525 IP 13.224.208.10.443 > 10.0.2.15.57300: Flags [P.], seq 297910:303406, ack 803, win 65535, length 5496
22:02:31.393527 IP 13.224.208.10.443 > 10.0.2.15.57300: Flags [P.], seq 303406:306154, ack 803, win 65535, length 2748
22:02:31.393541 IP 10.0.2.15.57300 > 13.224.208.10.443: Flags [.], ack 303406, win 65535, length 0
22:02:31.393561 IP 10.0.2.15.57300 > 13.224.208.10.443: Flags [.], ack 306154, win 65535, length 0
22:02:31.394561 IP 13.224.208.10.443 > 10.0.2.15.57300: Flags [P.], seq 306154:313024, ack 803, win 65535, length 6870
22:02:31.394576 IP 10.0.2.15.57300 > 13.224.208.10.443: Flags [.], ack 313024, win 65535, length 0
22:02:31.394797 IP 13.224.208.10.443 > 10.0.2.15.57300: Flags [P.], seq 313024:318520, ack 803, win 65535, length 5496
22:02:31.394818 IP 10.0.2.15.57300 > 13.224.208.10.443: Flags [.], ack 318520, win 65535, length 0
22:02:31.396055 IP 13.224.208.10.443 > 10.0.2.15.57300: Flags [P.], seq 318520:326764, ack 803, win 65535, length 8244
22:02:31.396057 IP 13.224.208.10.443 > 10.0.2.15.57300: Flags [P.], seq 326764:329512, ack 803, win 65535, length 2748
22:02:31.396120 IP 10.0.2.15.57300 > 13.224.208.10.443: Flags [.], ack 326764, win 65535, length 0
22:02:31.396191 IP 10.0.2.15.57300 > 13.224.208.10.443: Flags [.], ack 329512, win 65535, length 0
22:02:31.396226 IP 13.224.208.10.443 > 10.0.2.15.57300: Flags [P.], seq 329512:330886, ack 803, win 65535, length 1374
22:02:31.396227 IP 13.224.208.10.443 > 10.0.2.15.57300: Flags [.], seq 330886:332346, ack 803, win 65535, length 1460
22:02:31.396234 IP 10.0.2.15.57300 > 13.224.208.10.443: Flags [.], ack 330886, win 65535, length 0
22:02:31.396418 IP 10.0.2.15.57300 > 13.224.208.10.443: Flags [.], ack 332346, win 65535, length 0
22:02:31.396626 IP 13.224.208.10.443 > 10.0.2.15.57300: Flags [P.], seq 332346:335008, ack 803, win 65535, length 2662
22:02:31.396627 IP 13.224.208.10.443 > 10.0.2.15.57300: Flags [P.], seq 335008:336382, ack 803, win 65535, length 1374
22:02:31.396628 IP 13.224.208.10.443 > 10.0.2.15.57300: Flags [P.], seq 336382:339130, ack 803, win 65535, length 2748
22:02:31.396628 IP 13.224.208.10.443 > 10.0.2.15.57300: Flags [P.], seq 339130:341878, ack 803, win 65535, length 2748
22:02:31.396639 IP 10.0.2.15.57300 > 13.224.208.10.443: Flags [.], ack 335008, win 65535, length 0
22:02:31.396654 IP 10.0.2.15.57300 > 13.224.208.10.443: Flags [.], ack 336382, win 65535, length 0
22:02:31.396666 IP 10.0.2.15.57300 > 13.224.208.10.443: Flags [.], ack 339130, win 65535, length 0
22:02:31.396676 IP 10.0.2.15.57300 > 13.224.208.10.443: Flags [.], ack 341878, win 65535, length 0
22:02:31.396783 IP 13.224.208.10.443 > 10.0.2.15.57300: Flags [P.], seq 341878:343252, ack 803, win 65535, length 1374
22:02:31.396800 IP 10.0.2.15.57300 > 13.224.208.10.443: Flags [.], ack 343252, win 65535, length 0
22:02:31.397744 IP 13.224.208.10.443 > 10.0.2.15.57300: Flags [P.], seq 343252:351496, ack 803, win 65535, length 8244
22:02:31.397745 IP 13.224.208.10.443 > 10.0.2.15.57300: Flags [P.], seq 351496:354244, ack 803, win 65535, length 2748
22:02:31.397759 IP 10.0.2.15.57300 > 13.224.208.10.443: Flags [.], ack 351496, win 65535, length 0
22:02:31.397784 IP 10.0.2.15.57300 > 13.224.208.10.443: Flags [.], ack 354244, win 65535, length 0
22:02:31.399803 IP 13.224.208.10.443 > 10.0.2.15.57300: Flags [.], seq 354244:361544, ack 803, win 65535, length 7300
22:02:31.399825 IP 10.0.2.15.57300 > 13.224.208.10.443: Flags [.], ack 361544, win 65535, length 0
22:02:31.400101 IP 13.224.208.10.443 > 10.0.2.15.57300: Flags [P.], seq 361544:374854, ack 803, win 65535, length 13310
22:02:31.400276 IP 10.0.2.15.57300 > 13.224.208.10.443: Flags [.], ack 374854, win 65535, length 0
22:02:31.400330 IP 13.224.208.10.443 > 10.0.2.15.57300: Flags [P.], seq 374854:380350, ack 803, win 65535, length 5496
22:02:31.400332 IP 13.224.208.10.443 > 10.0.2.15.57300: Flags [P.], seq 380350:384472, ack 803, win 65535, length 4122
22:02:31.400333 IP 13.224.208.10.443 > 10.0.2.15.57300: Flags [P.], seq 384472:387220, ack 803, win 65535, length 2748
22:02:31.400383 IP 10.0.2.15.57300 > 13.224.208.10.443: Flags [.], ack 380350, win 65535, length 0
22:02:31.400403 IP 10.0.2.15.57300 > 13.224.208.10.443: Flags [.], ack 384472, win 65535, length 0
22:02:31.400416 IP 10.0.2.15.57300 > 13.224.208.10.443: Flags [.], ack 387220, win 65535, length 0
22:02:31.400434 IP 13.224.208.10.443 > 10.0.2.15.57300: Flags [P.], seq 387220:389968, ack 803, win 65535, length 2748
22:02:31.400440 IP 10.0.2.15.57300 > 13.224.208.10.443: Flags [.], ack 389968, win 65535, length 0
22:02:31.401599 IP 13.224.208.10.443 > 10.0.2.15.57300: Flags [P.], seq 389968:396838, ack 803, win 65535, length 6870
22:02:31.401602 IP 13.224.208.10.443 > 10.0.2.15.57300: Flags [P.], seq 396838:400960, ack 803, win 65535, length 4122
22:02:31.401647 IP 10.0.2.15.57300 > 13.224.208.10.443: Flags [.], ack 396838, win 65535, length 0
22:02:31.401726 IP 10.0.2.15.57300 > 13.224.208.10.443: Flags [.], ack 400960, win 65535, length 0
22:02:31.401827 IP 13.224.208.10.443 > 10.0.2.15.57300: Flags [P.], seq 400960:403708, ack 803, win 65535, length 2748
22:02:31.401828 IP 13.224.208.10.443 > 10.0.2.15.57300: Flags [P.], seq 403708:405082, ack 803, win 65535, length 1374
22:02:31.401829 IP 13.224.208.10.443 > 10.0.2.15.57300: Flags [P.], seq 405082:409204, ack 803, win 65535, length 4122
22:02:31.401838 IP 10.0.2.15.57300 > 13.224.208.10.443: Flags [.], ack 403708, win 65535, length 0
22:02:31.402064 IP 10.0.2.15.57300 > 13.224.208.10.443: Flags [.], ack 405082, win 65535, length 0
22:02:31.402081 IP 10.0.2.15.57300 > 13.224.208.10.443: Flags [.], ack 409204, win 65535, length 0
22:02:31.402573 IP 13.224.208.10.443 > 10.0.2.15.57300: Flags [P.], seq 409204:413326, ack 803, win 65535, length 4122
22:02:31.402581 IP 10.0.2.15.57300 > 13.224.208.10.443: Flags [.], ack 413326, win 65535, length 0
22:02:31.403066 IP 13.224.208.10.443 > 10.0.2.15.57300: Flags [P.], seq 413326:420196, ack 803, win 65535, length 6870
22:02:31.403068 IP 13.224.208.10.443 > 10.0.2.15.57300: Flags [P.], seq 420196:424318, ack 803, win 65535, length 4122
22:02:31.403095 IP 10.0.2.15.57300 > 13.224.208.10.443: Flags [.], ack 420196, win 65535, length 0
22:02:31.403128 IP 10.0.2.15.57300 > 13.224.208.10.443: Flags [.], ack 424318, win 65535, length 0
22:02:31.403474 IP 13.224.208.10.443 > 10.0.2.15.57300: Flags [P.], seq 424318:429814, ack 803, win 65535, length 5496
22:02:31.403485 IP 10.0.2.15.57300 > 13.224.208.10.443: Flags [.], ack 429814, win 65535, length 0
22:02:31.403771 IP 13.224.208.10.443 > 10.0.2.15.57300: Flags [P.], seq 429814:435310, ack 803, win 65535, length 5496
22:02:31.403865 IP 10.0.2.15.57300 > 13.224.208.10.443: Flags [.], ack 435310, win 65535, length 0
22:02:31.403973 IP 13.224.208.10.443 > 10.0.2.15.57300: Flags [P.], seq 435310:436684, ack 803, win 65535, length 1374
22:02:31.403981 IP 10.0.2.15.57300 > 13.224.208.10.443: Flags [.], ack 436684, win 65535, length 0
22:02:31.407014 IP 13.224.208.10.443 > 10.0.2.15.57300: Flags [P.], seq 436684:465538, ack 803, win 65535, length 28854
22:02:31.407032 IP 10.0.2.15.57300 > 13.224.208.10.443: Flags [.], ack 465538, win 65535, length 0
22:02:31.407067 IP 13.224.208.10.443 > 10.0.2.15.57300: Flags [P.], seq 465538:469660, ack 803, win 65535, length 4122
22:02:31.407071 IP 10.0.2.15.57300 > 13.224.208.10.443: Flags [.], ack 469660, win 65535, length 0
22:02:31.407502 IP 13.224.208.10.443 > 10.0.2.15.57300: Flags [P.], seq 469660:483400, ack 803, win 65535, length 13740
22:02:31.407516 IP 10.0.2.15.57300 > 13.224.208.10.443: Flags [.], ack 483400, win 65535, length 0
22:02:31.407551 IP 13.224.208.10.443 > 10.0.2.15.57300: Flags [P.], seq 483400:490270, ack 803, win 65535, length 6870
22:02:31.407552 IP 13.224.208.10.443 > 10.0.2.15.57300: Flags [P.], seq 490270:491644, ack 803, win 65535, length 1374
22:02:31.407559 IP 10.0.2.15.57300 > 13.224.208.10.443: Flags [.], ack 490270, win 65535, length 0
22:02:31.407567 IP 10.0.2.15.57300 > 13.224.208.10.443: Flags [.], ack 491644, win 65535, length 0

