22:07:30.169008 IP 10.0.2.15.55777 > 140.233.253.2.53: 33266+ A? www.imdb.com. (30)
22:07:30.169057 IP 10.0.2.15.55777 > 140.233.253.2.53: 18677+ AAAA? www.imdb.com. (30)
22:07:30.173781 IP 140.233.253.2.53 > 10.0.2.15.55777: 33266 3/0/0 CNAME tp.391b988c0-frontier.imdb.com., CNAME d2bytcopxu066p.cloudfront.net., A 13.224.208.10 (125)
22:07:30.173783 IP 140.233.253.2.53 > 10.0.2.15.55777: 18677 2/1/0 CNAME tp.391b988c0-frontier.imdb.com., CNAME d2bytcopxu066p.cloudfront.net. (191)
22:07:30.174060 IP 10.0.2.15.57400 > 13.224.208.10.443: Flags [S], seq 3670029343, win 64240, options [mss 1460,sackOK,TS val 3642868764 ecr 0,nop,wscale 6], length 0
22:07:30.190365 IP 13.224.208.10.443 > 10.0.2.15.57400: Flags [S.], seq 302080001, ack 3670029344, win 65535, options [mss 1460], length 0
22:07:30.190417 IP 10.0.2.15.57400 > 13.224.208.10.443: Flags [.], ack 1, win 64240, length 0
22:07:30.226864 IP 10.0.2.15.57400 > 13.224.208.10.443: Flags [P.], seq 1:518, ack 1, win 64240, length 517
22:07:30.227264 IP 13.224.208.10.443 > 10.0.2.15.57400: Flags [.], ack 518, win 65535, length 0
22:07:30.245018 IP 13.224.208.10.443 > 10.0.2.15.57400: Flags [.], seq 1:2921, ack 518, win 65535, length 2920
22:07:30.245047 IP 10.0.2.15.57400 > 13.224.208.10.443: Flags [.], ack 2921, win 62780, length 0
22:07:30.245368 IP 13.224.208.10.443 > 10.0.2.15.57400: Flags [P.], seq 2921:4123, ack 518, win 65535, length 1202
22:07:30.245383 IP 10.0.2.15.57400 > 13.224.208.10.443: Flags [.], ack 4123, win 61578, length 0
22:07:30.245775 IP 13.224.208.10.443 > 10.0.2.15.57400: Flags [P.], seq 4123:5497, ack 518, win 65535, length 1374
22:07:30.245829 IP 10.0.2.15.57400 > 13.224.208.10.443: Flags [.], ack 5497, win 61320, length 0
22:07:30.246862 IP 13.224.208.10.443 > 10.0.2.15.57400: Flags [P.], seq 5497:5509, ack 518, win 65535, length 12
22:07:30.246883 IP 10.0.2.15.57400 > 13.224.208.10.443: Flags [.], ack 5509, win 61308, length 0
22:07:30.247857 IP 10.0.2.15.57400 > 13.224.208.10.443: Flags [P.], seq 518:582, ack 5509, win 62780, length 64
22:07:30.248193 IP 13.224.208.10.443 > 10.0.2.15.57400: Flags [.], ack 582, win 65535, length 0
22:07:30.248495 IP 10.0.2.15.57400 > 13.224.208.10.443: Flags [P.], seq 582:628, ack 5509, win 62780, length 46
22:07:30.248848 IP 13.224.208.10.443 > 10.0.2.15.57400: Flags [.], ack 628, win 65535, length 0
22:07:30.248942 IP 10.0.2.15.57400 > 13.224.208.10.443: Flags [P.], seq 628:677, ack 5509, win 62780, length 49
22:07:30.249259 IP 13.224.208.10.443 > 10.0.2.15.57400: Flags [.], ack 677, win 65535, length 0
22:07:30.249269 IP 10.0.2.15.57400 > 13.224.208.10.443: Flags [P.], seq 677:712, ack 5509, win 62780, length 35
22:07:30.249302 IP 10.0.2.15.57400 > 13.224.208.10.443: Flags [P.], seq 712:772, ack 5509, win 62780, length 60
22:07:30.249498 IP 13.224.208.10.443 > 10.0.2.15.57400: Flags [.], ack 712, win 65535, length 0
22:07:30.249499 IP 13.224.208.10.443 > 10.0.2.15.57400: Flags [.], ack 772, win 65535, length 0
22:07:30.263131 IP 13.224.208.10.443 > 10.0.2.15.57400: Flags [P.], seq 5509:5602, ack 772, win 65535, length 93
22:07:30.263146 IP 10.0.2.15.57400 > 13.224.208.10.443: Flags [.], ack 5602, win 62780, length 0
22:07:30.263364 IP 10.0.2.15.57400 > 13.224.208.10.443: Flags [P.], seq 772:803, ack 5602, win 62780, length 31
22:07:30.263539 IP 13.224.208.10.443 > 10.0.2.15.57400: Flags [.], ack 803, win 65535, length 0
22:07:30.731553 IP 13.224.208.10.443 > 10.0.2.15.57400: Flags [P.], seq 5602:12472, ack 803, win 65535, length 6870
22:07:30.731557 IP 13.224.208.10.443 > 10.0.2.15.57400: Flags [.], seq 12472:15392, ack 803, win 65535, length 2920
22:07:30.731658 IP 10.0.2.15.57400 > 13.224.208.10.443: Flags [.], ack 12472, win 59860, length 0
22:07:30.731693 IP 10.0.2.15.57400 > 13.224.208.10.443: Flags [.], ack 15392, win 58400, length 0
22:07:30.732092 IP 13.224.208.10.443 > 10.0.2.15.57400: Flags [.], seq 15392:28532, ack 803, win 65535, length 13140
22:07:30.732109 IP 10.0.2.15.57400 > 13.224.208.10.443: Flags [.], ack 28532, win 49640, length 0
22:07:30.732381 IP 13.224.208.10.443 > 10.0.2.15.57400: Flags [P.], seq 28532:38578, ack 803, win 65535, length 10046
22:07:30.732383 IP 13.224.208.10.443 > 10.0.2.15.57400: Flags [.], seq 38578:42958, ack 803, win 65535, length 4380
22:07:30.732396 IP 10.0.2.15.57400 > 13.224.208.10.443: Flags [.], ack 38578, win 42340, length 0
22:07:30.732412 IP 10.0.2.15.57400 > 13.224.208.10.443: Flags [.], ack 42958, win 39420, length 0
22:07:30.732467 IP 13.224.208.10.443 > 10.0.2.15.57400: Flags [P.], seq 42958:48580, ack 803, win 65535, length 5622
22:07:30.732473 IP 10.0.2.15.57400 > 13.224.208.10.443: Flags [.], ack 48580, win 35040, length 0
22:07:30.746893 IP 13.224.208.10.443 > 10.0.2.15.57400: Flags [P.], seq 48580:54076, ack 803, win 65535, length 5496
22:07:30.746974 IP 10.0.2.15.57400 > 13.224.208.10.443: Flags [.], ack 54076, win 61320, length 0
22:07:30.748035 IP 13.224.208.10.443 > 10.0.2.15.57400: Flags [P.], seq 54076:62320, ack 803, win 65535, length 8244
22:07:30.748037 IP 13.224.208.10.443 > 10.0.2.15.57400: Flags [P.], seq 62320:63694, ack 803, win 65535, length 1374
22:07:30.748056 IP 10.0.2.15.57400 > 13.224.208.10.443: Flags [.], ack 62320, win 58400, length 0
22:07:30.748096 IP 10.0.2.15.57400 > 13.224.208.10.443: Flags [.], ack 63694, win 58400, length 0
22:07:30.749071 IP 13.224.208.10.443 > 10.0.2.15.57400: Flags [P.], seq 63694:65068, ack 803, win 65535, length 1374
22:07:30.749087 IP 10.0.2.15.57400 > 13.224.208.10.443: Flags [.], ack 65068, win 63204, length 0
22:07:30.749882 IP 13.224.208.10.443 > 10.0.2.15.57400: Flags [P.], seq 65068:70564, ack 803, win 65535, length 5496
22:07:30.749898 IP 10.0.2.15.57400 > 13.224.208.10.443: Flags [.], ack 70564, win 61320, length 0
22:07:30.751123 IP 13.224.208.10.443 > 10.0.2.15.57400: Flags [P.], seq 70564:84304, ack 803, win 65535, length 13740
22:07:30.751145 IP 10.0.2.15.57400 > 13.224.208.10.443: Flags [.], ack 84304, win 65535, length 0
22:07:30.751235 IP 13.224.208.10.443 > 10.0.2.15.57400: Flags [P.], seq 84304:85678, ack 803, win 65535, length 1374
22:07:30.751243 IP 10.0.2.15.57400 > 13.224.208.10.443: Flags [.], ack 85678, win 65535, length 0
22:07:30.752760 IP 13.224.208.10.443 > 10.0.2.15.57400: Flags [P.], seq 85678:91174, ack 803, win 65535, length 5496
22:07:30.752780 IP 10.0.2.15.57400 > 13.224.208.10.443: Flags [.], ack 91174, win 65535, length 0
22:07:30.753052 IP 13.224.208.10.443 > 10.0.2.15.57400: Flags [P.], seq 91174:98044, ack 803, win 65535, length 6870
22:07:30.753059 IP 10.0.2.15.57400 > 13.224.208.10.443: Flags [.], ack 98044, win 65535, length 0
22:07:30.754451 IP 13.224.208.10.443 > 10.0.2.15.57400: Flags [P.], seq 98044:107662, ack 803, win 65535, length 9618
22:07:30.754453 IP 13.224.208.10.443 > 10.0.2.15.57400: Flags [P.], seq 107662:109036, ack 803, win 65535, length 1374
22:07:30.754473 IP 10.0.2.15.57400 > 13.224.208.10.443: Flags [.], ack 107662, win 65535, length 0
22:07:30.754507 IP 10.0.2.15.57400 > 13.224.208.10.443: Flags [.], ack 109036, win 65535, length 0
22:07:30.761762 IP 13.224.208.10.443 > 10.0.2.15.57400: Flags [P.], seq 109036:117280, ack 803, win 65535, length 8244
22:07:30.761792 IP 10.0.2.15.57400 > 13.224.208.10.443: Flags [.], ack 117280, win 65535, length 0
22:07:30.762598 IP 13.224.208.10.443 > 10.0.2.15.57400: Flags [P.], seq 117280:121402, ack 803, win 65535, length 4122
22:07:30.762602 IP 13.224.208.10.443 > 10.0.2.15.57400: Flags [P.], seq 121402:126898, ack 803, win 65535, length 5496
22:07:30.762603 IP 13.224.208.10.443 > 10.0.2.15.57400: Flags [P.], seq 126898:129646, ack 803, win 65535, length 2748
22:07:30.762627 IP 10.0.2.15.57400 > 13.224.208.10.443: Flags [.], ack 121402, win 65535, length 0
22:07:30.762657 IP 10.0.2.15.57400 > 13.224.208.10.443: Flags [.], ack 126898, win 65535, length 0
22:07:30.762673 IP 10.0.2.15.57400 > 13.224.208.10.443: Flags [.], ack 129646, win 65535, length 0
22:07:30.764796 IP 13.224.208.10.443 > 10.0.2.15.57400: Flags [P.], seq 129646:131020, ack 803, win 65535, length 1374
22:07:30.764816 IP 10.0.2.15.57400 > 13.224.208.10.443: Flags [.], ack 131020, win 65535, length 0
22:07:30.768290 IP 13.224.208.10.443 > 10.0.2.15.57400: Flags [P.], seq 131020:140638, ack 803, win 65535, length 9618
22:07:30.768314 IP 10.0.2.15.57400 > 13.224.208.10.443: Flags [.], ack 140638, win 65535, length 0
22:07:30.769182 IP 13.224.208.10.443 > 10.0.2.15.57400: Flags [P.], seq 140638:146134, ack 803, win 65535, length 5496
22:07:30.769204 IP 10.0.2.15.57400 > 13.224.208.10.443: Flags [.], ack 146134, win 65535, length 0
22:07:30.770110 IP 13.224.208.10.443 > 10.0.2.15.57400: Flags [P.], seq 146134:153004, ack 803, win 65535, length 6870
22:07:30.770129 IP 10.0.2.15.57400 > 13.224.208.10.443: Flags [.], ack 153004, win 65535, length 0
22:07:30.771293 IP 13.224.208.10.443 > 10.0.2.15.57400: Flags [P.], seq 153004:157126, ack 803, win 65535, length 4122
22:07:30.771318 IP 10.0.2.15.57400 > 13.224.208.10.443: Flags [.], ack 157126, win 65535, length 0
22:07:30.772750 IP 13.224.208.10.443 > 10.0.2.15.57400: Flags [P.], seq 157126:163996, ack 803, win 65535, length 6870
22:07:30.772754 IP 13.224.208.10.443 > 10.0.2.15.57400: Flags [P.], seq 163996:168118, ack 803, win 65535, length 4122
22:07:30.772774 IP 10.0.2.15.57400 > 13.224.208.10.443: Flags [.], ack 163996, win 65535, length 0
22:07:30.772810 IP 10.0.2.15.57400 > 13.224.208.10.443: Flags [.], ack 168118, win 65535, length 0
22:07:30.773721 IP 13.224.208.10.443 > 10.0.2.15.57400: Flags [P.], seq 168118:173614, ack 803, win 65535, length 5496
22:07:30.773741 IP 10.0.2.15.57400 > 13.224.208.10.443: Flags [.], ack 173614, win 65535, length 0
22:07:30.774671 IP 13.224.208.10.443 > 10.0.2.15.57400: Flags [P.], seq 173614:181858, ack 803, win 65535, length 8244
22:07:30.774690 IP 10.0.2.15.57400 > 13.224.208.10.443: Flags [.], ack 181858, win 65535, length 0
22:07:30.775786 IP 13.224.208.10.443 > 10.0.2.15.57400: Flags [P.], seq 181858:183232, ack 803, win 65535, length 1374
22:07:30.775807 IP 10.0.2.15.57400 > 13.224.208.10.443: Flags [.], ack 183232, win 65535, length 0
22:07:30.776707 IP 13.224.208.10.443 > 10.0.2.15.57400: Flags [P.], seq 183232:191476, ack 803, win 65535, length 8244
22:07:30.776710 IP 13.224.208.10.443 > 10.0.2.15.57400: Flags [P.], seq 191476:194224, ack 803, win 65535, length 2748
22:07:30.776803 IP 10.0.2.15.57400 > 13.224.208.10.443: Flags [.], ack 191476, win 65535, length 0
22:07:30.776832 IP 10.0.2.15.57400 > 13.224.208.10.443: Flags [.], ack 194224, win 65535, length 0
22:07:30.776855 IP 13.224.208.10.443 > 10.0.2.15.57400: Flags [P.], seq 194224:199720, ack 803, win 65535, length 5496
22:07:30.776861 IP 10.0.2.15.57400 > 13.224.208.10.443: Flags [.], ack 199720, win 65535, length 0
22:07:30.778874 IP 13.224.208.10.443 > 10.0.2.15.57400: Flags [P.], seq 199720:209338, ack 803, win 65535, length 9618
22:07:30.778893 IP 10.0.2.15.57400 > 13.224.208.10.443: Flags [.], ack 209338, win 65535, length 0
22:07:30.780874 IP 13.224.208.10.443 > 10.0.2.15.57400: Flags [P.], seq 209338:225826, ack 803, win 65535, length 16488
22:07:30.780895 IP 10.0.2.15.57400 > 13.224.208.10.443: Flags [.], ack 225826, win 65535, length 0
22:07:30.781822 IP 13.224.208.10.443 > 10.0.2.15.57400: Flags [P.], seq 225826:231322, ack 803, win 65535, length 5496
22:07:30.781824 IP 13.224.208.10.443 > 10.0.2.15.57400: Flags [P.], seq 231322:234070, ack 803, win 65535, length 2748
22:07:30.781824 IP 13.224.208.10.443 > 10.0.2.15.57400: Flags [P.], seq 234070:236818, ack 803, win 65535, length 2748
22:07:30.781843 IP 10.0.2.15.57400 > 13.224.208.10.443: Flags [.], ack 231322, win 65535, length 0
22:07:30.781939 IP 10.0.2.15.57400 > 13.224.208.10.443: Flags [.], ack 234070, win 65535, length 0
22:07:30.781957 IP 10.0.2.15.57400 > 13.224.208.10.443: Flags [.], ack 236818, win 65535, length 0
22:07:30.781978 IP 13.224.208.10.443 > 10.0.2.15.57400: Flags [P.], seq 236818:240940, ack 803, win 65535, length 4122
22:07:30.781983 IP 10.0.2.15.57400 > 13.224.208.10.443: Flags [.], ack 240940, win 65535, length 0
22:07:30.783009 IP 13.224.208.10.443 > 10.0.2.15.57400: Flags [P.], seq 240940:246436, ack 803, win 65535, length 5496
22:07:30.783011 IP 13.224.208.10.443 > 10.0.2.15.57400: Flags [P.], seq 246436:249184, ack 803, win 65535, length 2748
22:07:30.783011 IP 13.224.208.10.443 > 10.0.2.15.57400: Flags [P.], seq 249184:253306, ack 803, win 65535, length 4122
22:07:30.783027 IP 10.0.2.15.57400 > 13.224.208.10.443: Flags [.], ack 246436, win 65535, length 0
22:07:30.783056 IP 10.0.2.15.57400 > 13.224.208.10.443: Flags [.], ack 249184, win 65535, length 0
22:07:30.783065 IP 10.0.2.15.57400 > 13.224.208.10.443: Flags [.], ack 253306, win 65535, length 0
22:07:30.783945 IP 13.224.208.10.443 > 10.0.2.15.57400: Flags [P.], seq 253306:258802, ack 803, win 65535, length 5496
22:07:30.783948 IP 13.224.208.10.443 > 10.0.2.15.57400: Flags [P.], seq 258802:261550, ack 803, win 65535, length 2748
22:07:30.784005 IP 10.0.2.15.57400 > 13.224.208.10.443: Flags [.], ack 258802, win 65535, length 0
22:07:30.784036 IP 10.0.2.15.57400 > 13.224.208.10.443: Flags [.], ack 261550, win 65535, length 0
22:07:30.784694 IP 13.224.208.10.443 > 10.0.2.15.57400: Flags [P.], seq 261550:265672, ack 803, win 65535, length 4122
22:07:30.784706 IP 10.0.2.15.57400 > 13.224.208.10.443: Flags [.], ack 265672, win 65535, length 0
22:07:30.786697 IP 13.224.208.10.443 > 10.0.2.15.57400: Flags [P.], seq 265672:275290, ack 803, win 65535, length 9618
22:07:30.786701 IP 13.224.208.10.443 > 10.0.2.15.57400: Flags [P.], seq 275290:278038, ack 803, win 65535, length 2748
22:07:30.786721 IP 10.0.2.15.57400 > 13.224.208.10.443: Flags [.], ack 275290, win 65535, length 0
22:07:30.786779 IP 10.0.2.15.57400 > 13.224.208.10.443: Flags [.], ack 278038, win 65535, length 0
22:07:30.786908 IP 13.224.208.10.443 > 10.0.2.15.57400: Flags [P.], seq 278038:280786, ack 803, win 65535, length 2748
22:07:30.786920 IP 10.0.2.15.57400 > 13.224.208.10.443: Flags [.], ack 280786, win 65535, length 0
22:07:30.787281 IP 13.224.208.10.443 > 10.0.2.15.57400: Flags [P.], seq 280786:289030, ack 803, win 65535, length 8244
22:07:30.787282 IP 13.224.208.10.443 > 10.0.2.15.57400: Flags [P.], seq 289030:290404, ack 803, win 65535, length 1374
22:07:30.787292 IP 10.0.2.15.57400 > 13.224.208.10.443: Flags [.], ack 289030, win 65535, length 0
22:07:30.787307 IP 10.0.2.15.57400 > 13.224.208.10.443: Flags [.], ack 290404, win 65535, length 0
22:07:30.789144 IP 13.224.208.10.443 > 10.0.2.15.57400: Flags [P.], seq 290404:298648, ack 803, win 65535, length 8244
22:07:30.789147 IP 13.224.208.10.443 > 10.0.2.15.57400: Flags [P.], seq 298648:304144, ack 803, win 65535, length 5496
22:07:30.789172 IP 10.0.2.15.57400 > 13.224.208.10.443: Flags [.], ack 298648, win 65535, length 0
22:07:30.789289 IP 10.0.2.15.57400 > 13.224.208.10.443: Flags [.], ack 304144, win 65535, length 0
22:07:30.789365 IP 13.224.208.10.443 > 10.0.2.15.57400: Flags [P.], seq 304144:309640, ack 803, win 65535, length 5496
22:07:30.789374 IP 10.0.2.15.57400 > 13.224.208.10.443: Flags [.], ack 309640, win 65535, length 0
22:07:30.789537 IP 13.224.208.10.443 > 10.0.2.15.57400: Flags [P.], seq 309640:312388, ack 803, win 65535, length 2748
22:07:30.789546 IP 10.0.2.15.57400 > 13.224.208.10.443: Flags [.], ack 312388, win 65535, length 0
22:07:30.789770 IP 13.224.208.10.443 > 10.0.2.15.57400: Flags [P.], seq 312388:313762, ack 803, win 65535, length 1374
22:07:30.789779 IP 10.0.2.15.57400 > 13.224.208.10.443: Flags [.], ack 313762, win 65535, length 0
22:07:30.790312 IP 13.224.208.10.443 > 10.0.2.15.57400: Flags [P.], seq 313762:319258, ack 803, win 65535, length 5496
22:07:30.790326 IP 10.0.2.15.57400 > 13.224.208.10.443: Flags [.], ack 319258, win 65535, length 0
22:07:30.790604 IP 13.224.208.10.443 > 10.0.2.15.57400: Flags [P.], seq 319258:322006, ack 803, win 65535, length 2748
22:07:30.790663 IP 10.0.2.15.57400 > 13.224.208.10.443: Flags [.], ack 322006, win 65535, length 0
22:07:30.791150 IP 13.224.208.10.443 > 10.0.2.15.57400: Flags [P.], seq 322006:326128, ack 803, win 65535, length 4122
22:07:30.791151 IP 13.224.208.10.443 > 10.0.2.15.57400: Flags [P.], seq 326128:330250, ack 803, win 65535, length 4122
22:07:30.791152 IP 13.224.208.10.443 > 10.0.2.15.57400: Flags [P.], seq 330250:335746, ack 803, win 65535, length 5496
22:07:30.791165 IP 10.0.2.15.57400 > 13.224.208.10.443: Flags [.], ack 326128, win 65535, length 0
22:07:30.791185 IP 10.0.2.15.57400 > 13.224.208.10.443: Flags [.], ack 330250, win 65535, length 0
22:07:30.791569 IP 10.0.2.15.57400 > 13.224.208.10.443: Flags [.], ack 335746, win 65535, length 0
22:07:30.791593 IP 13.224.208.10.443 > 10.0.2.15.57400: Flags [P.], seq 335746:338494, ack 803, win 65535, length 2748
22:07:30.791599 IP 10.0.2.15.57400 > 13.224.208.10.443: Flags [.], ack 338494, win 65535, length 0
22:07:30.791844 IP 13.224.208.10.443 > 10.0.2.15.57400: Flags [P.], seq 338494:342616, ack 803, win 65535, length 4122
22:07:30.791852 IP 10.0.2.15.57400 > 13.224.208.10.443: Flags [.], ack 342616, win 65535, length 0
22:07:30.792728 IP 13.224.208.10.443 > 10.0.2.15.57400: Flags [P.], seq 342616:349486, ack 803, win 65535, length 6870
22:07:30.792730 IP 13.224.208.10.443 > 10.0.2.15.57400: Flags [P.], seq 349486:353608, ack 803, win 65535, length 4122
22:07:30.792751 IP 10.0.2.15.57400 > 13.224.208.10.443: Flags [.], ack 349486, win 65535, length 0
22:07:30.792971 IP 10.0.2.15.57400 > 13.224.208.10.443: Flags [.], ack 353608, win 65535, length 0
22:07:30.793092 IP 13.224.208.10.443 > 10.0.2.15.57400: Flags [P.], seq 353608:356356, ack 803, win 65535, length 2748
22:07:30.793093 IP 13.224.208.10.443 > 10.0.2.15.57400: Flags [P.], seq 356356:359104, ack 803, win 65535, length 2748
22:07:30.793093 IP 13.224.208.10.443 > 10.0.2.15.57400: Flags [P.], seq 359104:360478, ack 803, win 65535, length 1374
22:07:30.793103 IP 10.0.2.15.57400 > 13.224.208.10.443: Flags [.], ack 356356, win 65535, length 0
22:07:30.793143 IP 10.0.2.15.57400 > 13.224.208.10.443: Flags [.], ack 359104, win 65535, length 0
22:07:30.793153 IP 10.0.2.15.57400 > 13.224.208.10.443: Flags [.], ack 360478, win 65535, length 0
22:07:30.793512 IP 13.224.208.10.443 > 10.0.2.15.57400: Flags [P.], seq 360478:364600, ack 803, win 65535, length 4122
22:07:30.793514 IP 13.224.208.10.443 > 10.0.2.15.57400: Flags [P.], seq 364600:367348, ack 803, win 65535, length 2748
22:07:30.793529 IP 10.0.2.15.57400 > 13.224.208.10.443: Flags [.], ack 364600, win 65535, length 0
22:07:30.793547 IP 10.0.2.15.57400 > 13.224.208.10.443: Flags [.], ack 367348, win 65535, length 0
22:07:30.793630 IP 13.224.208.10.443 > 10.0.2.15.57400: Flags [P.], seq 367348:368722, ack 803, win 65535, length 1374
22:07:30.793634 IP 10.0.2.15.57400 > 13.224.208.10.443: Flags [.], ack 368722, win 65535, length 0
22:07:30.794632 IP 13.224.208.10.443 > 10.0.2.15.57400: Flags [P.], seq 368722:374218, ack 803, win 65535, length 5496
22:07:30.794635 IP 13.224.208.10.443 > 10.0.2.15.57400: Flags [P.], seq 374218:379714, ack 803, win 65535, length 5496
22:07:30.794697 IP 10.0.2.15.57400 > 13.224.208.10.443: Flags [.], ack 374218, win 65535, length 0
22:07:30.794764 IP 10.0.2.15.57400 > 13.224.208.10.443: Flags [.], ack 379714, win 65535, length 0
22:07:30.794822 IP 13.224.208.10.443 > 10.0.2.15.57400: Flags [P.], seq 379714:382462, ack 803, win 65535, length 2748
22:07:30.794830 IP 10.0.2.15.57400 > 13.224.208.10.443: Flags [.], ack 382462, win 65535, length 0
22:07:30.795102 IP 13.224.208.10.443 > 10.0.2.15.57400: Flags [P.], seq 382462:383836, ack 803, win 65535, length 1374
22:07:30.795109 IP 10.0.2.15.57400 > 13.224.208.10.443: Flags [.], ack 383836, win 65535, length 0
22:07:30.796582 IP 13.224.208.10.443 > 10.0.2.15.57400: Flags [P.], seq 383836:385210, ack 803, win 65535, length 1374
22:07:30.796601 IP 10.0.2.15.57400 > 13.224.208.10.443: Flags [.], ack 385210, win 65535, length 0
22:07:30.797690 IP 13.224.208.10.443 > 10.0.2.15.57400: Flags [P.], seq 385210:393454, ack 803, win 65535, length 8244
22:07:30.797692 IP 13.224.208.10.443 > 10.0.2.15.57400: Flags [P.], seq 393454:396202, ack 803, win 65535, length 2748
22:07:30.797711 IP 10.0.2.15.57400 > 13.224.208.10.443: Flags [.], ack 393454, win 65535, length 0
22:07:30.797798 IP 10.0.2.15.57400 > 13.224.208.10.443: Flags [.], ack 396202, win 65535, length 0
22:07:30.798162 IP 13.224.208.10.443 > 10.0.2.15.57400: Flags [P.], seq 396202:398950, ack 803, win 65535, length 2748
22:07:30.798164 IP 13.224.208.10.443 > 10.0.2.15.57400: Flags [P.], seq 398950:404946, ack 803, win 65535, length 5996
22:07:30.798173 IP 10.0.2.15.57400 > 13.224.208.10.443: Flags [.], ack 398950, win 65535, length 0
22:07:30.798189 IP 10.0.2.15.57400 > 13.224.208.10.443: Flags [.], ack 404946, win 65535, length 0
22:07:30.798309 IP 13.224.208.10.443 > 10.0.2.15.57400: Flags [P.], seq 404946:407694, ack 803, win 65535, length 2748
22:07:30.798314 IP 10.0.2.15.57400 > 13.224.208.10.443: Flags [.], ack 407694, win 65535, length 0
22:07:30.799389 IP 13.224.208.10.443 > 10.0.2.15.57400: Flags [P.], seq 407694:415938, ack 803, win 65535, length 8244
22:07:30.799391 IP 13.224.208.10.443 > 10.0.2.15.57400: Flags [P.], seq 415938:418686, ack 803, win 65535, length 2748
22:07:30.799413 IP 10.0.2.15.57400 > 13.224.208.10.443: Flags [.], ack 415938, win 65535, length 0
22:07:30.799566 IP 10.0.2.15.57400 > 13.224.208.10.443: Flags [.], ack 418686, win 65535, length 0
22:07:30.799981 IP 13.224.208.10.443 > 10.0.2.15.57400: Flags [P.], seq 418686:421434, ack 803, win 65535, length 2748
22:07:30.799983 IP 13.224.208.10.443 > 10.0.2.15.57400: Flags [P.], seq 421434:424182, ack 803, win 65535, length 2748
22:07:30.799984 IP 13.224.208.10.443 > 10.0.2.15.57400: Flags [P.], seq 424182:429678, ack 803, win 65535, length 5496
22:07:30.799994 IP 10.0.2.15.57400 > 13.224.208.10.443: Flags [.], ack 421434, win 65535, length 0
22:07:30.800016 IP 10.0.2.15.57400 > 13.224.208.10.443: Flags [.], ack 424182, win 65535, length 0
22:07:30.800029 IP 10.0.2.15.57400 > 13.224.208.10.443: Flags [.], ack 429678, win 65535, length 0
22:07:30.800054 IP 13.224.208.10.443 > 10.0.2.15.57400: Flags [P.], seq 429678:431052, ack 803, win 65535, length 1374
22:07:30.800059 IP 10.0.2.15.57400 > 13.224.208.10.443: Flags [.], ack 431052, win 65535, length 0
22:07:30.802650 IP 13.224.208.10.443 > 10.0.2.15.57400: Flags [P.], seq 431052:437422, ack 803, win 65535, length 6370
22:07:30.802674 IP 10.0.2.15.57400 > 13.224.208.10.443: Flags [.], ack 437422, win 65535, length 0
22:07:30.804038 IP 13.224.208.10.443 > 10.0.2.15.57400: Flags [P.], seq 437422:446170, ack 803, win 65535, length 8748
22:07:30.804041 IP 13.224.208.10.443 > 10.0.2.15.57400: Flags [P.], seq 446170:454414, ack 803, win 65535, length 8244
22:07:30.804058 IP 10.0.2.15.57400 > 13.224.208.10.443: Flags [.], ack 446170, win 65535, length 0
22:07:30.804082 IP 10.0.2.15.57400 > 13.224.208.10.443: Flags [.], ack 454414, win 65535, length 0
22:07:30.804109 IP 13.224.208.10.443 > 10.0.2.15.57400: Flags [P.], seq 454414:458536, ack 803, win 65535, length 4122
22:07:30.804110 IP 13.224.208.10.443 > 10.0.2.15.57400: Flags [P.], seq 458536:459910, ack 803, win 65535, length 1374
22:07:30.804116 IP 10.0.2.15.57400 > 13.224.208.10.443: Flags [.], ack 458536, win 65535, length 0
22:07:30.804127 IP 10.0.2.15.57400 > 13.224.208.10.443: Flags [.], ack 459910, win 65535, length 0
22:07:30.804726 IP 13.224.208.10.443 > 10.0.2.15.57400: Flags [P.], seq 459910:461284, ack 803, win 65535, length 1374
22:07:30.804739 IP 10.0.2.15.57400 > 13.224.208.10.443: Flags [.], ack 461284, win 65535, length 0
22:07:30.804936 IP 13.224.208.10.443 > 10.0.2.15.57400: Flags [P.], seq 461284:461306, ack 803, win 65535, length 22
22:07:30.804943 IP 10.0.2.15.57400 > 13.224.208.10.443: Flags [.], ack 461306, win 65535, length 0
22:07:30.807703 IP 13.224.208.10.443 > 10.0.2.15.57400: Flags [P.], seq 461306:468176, ack 803, win 65535, length 6870
22:07:30.807729 IP 10.0.2.15.57400 > 13.224.208.10.443: Flags [.], ack 468176, win 65535, length 0
22:07:30.811289 IP 13.224.208.10.443 > 10.0.2.15.57400: Flags [P.], seq 468176:476394, ack 803, win 65535, length 8218
22:07:30.811313 IP 10.0.2.15.57400 > 13.224.208.10.443: Flags [.], ack 476394, win 65535, length 0
22:07:30.813322 IP 13.224.208.10.443 > 10.0.2.15.57400: Flags [P.], seq 476394:484668, ack 803, win 65535, length 8274
22:07:30.813344 IP 10.0.2.15.57400 > 13.224.208.10.443: Flags [.], ack 484668, win 65535, length 0

