22:05:11.908542 IP 10.0.2.15.45181 > 140.233.253.2.53: 4111+ A? www.imdb.com. (30)
22:05:11.908590 IP 10.0.2.15.45181 > 140.233.253.2.53: 44556+ AAAA? www.imdb.com. (30)
22:05:11.914125 IP 140.233.253.2.53 > 10.0.2.15.45181: 44556 2/1/0 CNAME tp.391b988c0-frontier.imdb.com., CNAME d2bytcopxu066p.cloudfront.net. (191)
22:05:11.914127 IP 140.233.253.2.53 > 10.0.2.15.45181: 4111 3/0/0 CNAME tp.391b988c0-frontier.imdb.com., CNAME d2bytcopxu066p.cloudfront.net., A 13.224.208.10 (125)
22:05:11.914404 IP 10.0.2.15.57350 > 13.224.208.10.443: Flags [S], seq 4293927012, win 64240, options [mss 1460,sackOK,TS val 3642730504 ecr 0,nop,wscale 6], length 0
22:05:11.930756 IP 13.224.208.10.443 > 10.0.2.15.57350: Flags [S.], seq 297408001, ack 4293927013, win 65535, options [mss 1460], length 0
22:05:11.930806 IP 10.0.2.15.57350 > 13.224.208.10.443: Flags [.], ack 1, win 64240, length 0
22:05:11.942268 IP 10.0.2.15.57350 > 13.224.208.10.443: Flags [P.], seq 1:518, ack 1, win 64240, length 517
22:05:11.942620 IP 13.224.208.10.443 > 10.0.2.15.57350: Flags [.], ack 518, win 65535, length 0
22:05:11.961746 IP 13.224.208.10.443 > 10.0.2.15.57350: Flags [P.], seq 1:1375, ack 518, win 65535, length 1374
22:05:11.961768 IP 10.0.2.15.57350 > 13.224.208.10.443: Flags [.], ack 1375, win 63204, length 0
22:05:11.962577 IP 13.224.208.10.443 > 10.0.2.15.57350: Flags [P.], seq 1375:2749, ack 518, win 65535, length 1374
22:05:11.962598 IP 10.0.2.15.57350 > 13.224.208.10.443: Flags [.], ack 2749, win 63204, length 0
22:05:11.964054 IP 13.224.208.10.443 > 10.0.2.15.57350: Flags [P.], seq 2749:5497, ack 518, win 65535, length 2748
22:05:11.964079 IP 10.0.2.15.57350 > 13.224.208.10.443: Flags [.], ack 5497, win 63204, length 0
22:05:11.965028 IP 13.224.208.10.443 > 10.0.2.15.57350: Flags [P.], seq 5497:5509, ack 518, win 65535, length 12
22:05:11.965095 IP 10.0.2.15.57350 > 13.224.208.10.443: Flags [.], ack 5509, win 63192, length 0
22:05:11.966086 IP 10.0.2.15.57350 > 13.224.208.10.443: Flags [P.], seq 518:582, ack 5509, win 63192, length 64
22:05:11.966507 IP 13.224.208.10.443 > 10.0.2.15.57350: Flags [.], ack 582, win 65535, length 0
22:05:11.966601 IP 10.0.2.15.57350 > 13.224.208.10.443: Flags [P.], seq 582:628, ack 5509, win 63192, length 46
22:05:11.966634 IP 10.0.2.15.57350 > 13.224.208.10.443: Flags [P.], seq 628:677, ack 5509, win 63192, length 49
22:05:11.967267 IP 13.224.208.10.443 > 10.0.2.15.57350: Flags [.], ack 628, win 65535, length 0
22:05:11.967268 IP 13.224.208.10.443 > 10.0.2.15.57350: Flags [.], ack 677, win 65535, length 0
22:05:11.967291 IP 10.0.2.15.57350 > 13.224.208.10.443: Flags [P.], seq 677:772, ack 5509, win 63192, length 95
22:05:11.967498 IP 13.224.208.10.443 > 10.0.2.15.57350: Flags [.], ack 772, win 65535, length 0
22:05:11.982591 IP 13.224.208.10.443 > 10.0.2.15.57350: Flags [P.], seq 5509:5580, ack 772, win 65535, length 71
22:05:11.982609 IP 10.0.2.15.57350 > 13.224.208.10.443: Flags [.], ack 5580, win 63192, length 0
22:05:11.982819 IP 10.0.2.15.57350 > 13.224.208.10.443: Flags [P.], seq 772:803, ack 5580, win 63192, length 31
22:05:11.983160 IP 13.224.208.10.443 > 10.0.2.15.57350: Flags [.], ack 803, win 65535, length 0
22:05:12.530076 IP 13.224.208.10.443 > 10.0.2.15.57350: Flags [P.], seq 5580:12450, ack 803, win 65535, length 6870
22:05:12.530079 IP 13.224.208.10.443 > 10.0.2.15.57350: Flags [.], seq 12450:15370, ack 803, win 65535, length 2920
22:05:12.530114 IP 10.0.2.15.57350 > 13.224.208.10.443: Flags [.], ack 12450, win 59860, length 0
22:05:12.530139 IP 10.0.2.15.57350 > 13.224.208.10.443: Flags [.], ack 15370, win 58400, length 0
22:05:12.530869 IP 13.224.208.10.443 > 10.0.2.15.57350: Flags [.], seq 15370:28510, ack 803, win 65535, length 13140
22:05:12.530892 IP 10.0.2.15.57350 > 13.224.208.10.443: Flags [.], ack 28510, win 49640, length 0
22:05:12.531338 IP 13.224.208.10.443 > 10.0.2.15.57350: Flags [.], seq 28510:35810, ack 803, win 65535, length 7300
22:05:12.531358 IP 10.0.2.15.57350 > 13.224.208.10.443: Flags [.], ack 35810, win 43800, length 0
22:05:12.531768 IP 13.224.208.10.443 > 10.0.2.15.57350: Flags [.], seq 35810:37270, ack 803, win 65535, length 1460
22:05:12.532242 IP 13.224.208.10.443 > 10.0.2.15.57350: Flags [.], seq 37270:43110, ack 803, win 65535, length 5840
22:05:12.532273 IP 10.0.2.15.57350 > 13.224.208.10.443: Flags [.], ack 37270, win 42340, length 0
22:05:12.532380 IP 13.224.208.10.443 > 10.0.2.15.57350: Flags [P.], seq 43110:47821, ack 803, win 65535, length 4711
22:05:12.532669 IP 10.0.2.15.57350 > 13.224.208.10.443: Flags [.], ack 47821, win 35040, length 0
22:05:12.550029 IP 13.224.208.10.443 > 10.0.2.15.57350: Flags [.], seq 47821:66801, ack 803, win 65535, length 18980
22:05:12.550055 IP 10.0.2.15.57350 > 13.224.208.10.443: Flags [.], ack 66801, win 52560, length 0
22:05:12.550301 IP 13.224.208.10.443 > 10.0.2.15.57350: Flags [.], seq 66801:78481, ack 803, win 65535, length 11680
22:05:12.550357 IP 10.0.2.15.57350 > 13.224.208.10.443: Flags [.], ack 78481, win 62780, length 0
22:05:12.550492 IP 13.224.208.10.443 > 10.0.2.15.57350: Flags [P.], seq 78481:79423, ack 803, win 65535, length 942
22:05:12.550504 IP 10.0.2.15.57350 > 13.224.208.10.443: Flags [.], ack 79423, win 65535, length 0
22:05:12.551645 IP 13.224.208.10.443 > 10.0.2.15.57350: Flags [P.], seq 79423:83545, ack 803, win 65535, length 4122
22:05:12.551648 IP 13.224.208.10.443 > 10.0.2.15.57350: Flags [P.], seq 83545:90415, ack 803, win 65535, length 6870
22:05:12.551674 IP 10.0.2.15.57350 > 13.224.208.10.443: Flags [.], ack 83545, win 65535, length 0
22:05:12.551709 IP 10.0.2.15.57350 > 13.224.208.10.443: Flags [.], ack 90415, win 65535, length 0
22:05:12.551790 IP 13.224.208.10.443 > 10.0.2.15.57350: Flags [P.], seq 90415:91789, ack 803, win 65535, length 1374
22:05:12.551798 IP 10.0.2.15.57350 > 13.224.208.10.443: Flags [.], ack 91789, win 65535, length 0
22:05:12.552403 IP 13.224.208.10.443 > 10.0.2.15.57350: Flags [P.], seq 91789:95911, ack 803, win 65535, length 4122
22:05:12.552423 IP 10.0.2.15.57350 > 13.224.208.10.443: Flags [.], ack 95911, win 65535, length 0
22:05:12.555736 IP 13.224.208.10.443 > 10.0.2.15.57350: Flags [P.], seq 95911:102781, ack 803, win 65535, length 6870
22:05:12.555817 IP 10.0.2.15.57350 > 13.224.208.10.443: Flags [.], ack 102781, win 65535, length 0
22:05:12.556193 IP 13.224.208.10.443 > 10.0.2.15.57350: Flags [P.], seq 102781:104155, ack 803, win 65535, length 1374
22:05:12.556214 IP 10.0.2.15.57350 > 13.224.208.10.443: Flags [.], ack 104155, win 65535, length 0
22:05:12.564248 IP 13.224.208.10.443 > 10.0.2.15.57350: Flags [P.], seq 104155:105529, ack 803, win 65535, length 1374
22:05:12.564272 IP 10.0.2.15.57350 > 13.224.208.10.443: Flags [.], ack 105529, win 65535, length 0
22:05:12.565501 IP 13.224.208.10.443 > 10.0.2.15.57350: Flags [P.], seq 105529:113773, ack 803, win 65535, length 8244
22:05:12.565503 IP 13.224.208.10.443 > 10.0.2.15.57350: Flags [P.], seq 113773:116521, ack 803, win 65535, length 2748
22:05:12.565523 IP 10.0.2.15.57350 > 13.224.208.10.443: Flags [.], ack 113773, win 65535, length 0
22:05:12.565569 IP 10.0.2.15.57350 > 13.224.208.10.443: Flags [.], ack 116521, win 65535, length 0
22:05:12.565602 IP 13.224.208.10.443 > 10.0.2.15.57350: Flags [P.], seq 116521:119269, ack 803, win 65535, length 2748
22:05:12.565638 IP 13.224.208.10.443 > 10.0.2.15.57350: Flags [P.], seq 119269:122017, ack 803, win 65535, length 2748
22:05:12.565646 IP 10.0.2.15.57350 > 13.224.208.10.443: Flags [.], ack 119269, win 65535, length 0
22:05:12.565660 IP 10.0.2.15.57350 > 13.224.208.10.443: Flags [.], ack 122017, win 65535, length 0
22:05:12.566304 IP 13.224.208.10.443 > 10.0.2.15.57350: Flags [P.], seq 122017:124765, ack 803, win 65535, length 2748
22:05:12.566323 IP 10.0.2.15.57350 > 13.224.208.10.443: Flags [.], ack 124765, win 65535, length 0
22:05:12.567528 IP 13.224.208.10.443 > 10.0.2.15.57350: Flags [P.], seq 124765:130261, ack 803, win 65535, length 5496
22:05:12.567551 IP 10.0.2.15.57350 > 13.224.208.10.443: Flags [.], ack 130261, win 65535, length 0
22:05:12.567819 IP 13.224.208.10.443 > 10.0.2.15.57350: Flags [P.], seq 130261:133009, ack 803, win 65535, length 2748
22:05:12.567833 IP 10.0.2.15.57350 > 13.224.208.10.443: Flags [.], ack 133009, win 65535, length 0
22:05:12.568860 IP 13.224.208.10.443 > 10.0.2.15.57350: Flags [.], seq 133009:137389, ack 803, win 65535, length 4380
22:05:12.568884 IP 10.0.2.15.57350 > 13.224.208.10.443: Flags [.], ack 137389, win 65535, length 0
22:05:12.569154 IP 13.224.208.10.443 > 10.0.2.15.57350: Flags [P.], seq 137389:139879, ack 803, win 65535, length 2490
22:05:12.569160 IP 13.224.208.10.443 > 10.0.2.15.57350: Flags [P.], seq 139879:142627, ack 803, win 65535, length 2748
22:05:12.569162 IP 13.224.208.10.443 > 10.0.2.15.57350: Flags [P.], seq 142627:144001, ack 803, win 65535, length 1374
22:05:12.570059 IP 10.0.2.15.57350 > 13.224.208.10.443: Flags [.], ack 139879, win 65535, length 0
22:05:12.570387 IP 10.0.2.15.57350 > 13.224.208.10.443: Flags [.], ack 142627, win 65535, length 0
22:05:12.570783 IP 10.0.2.15.57350 > 13.224.208.10.443: Flags [.], ack 144001, win 65535, length 0
22:05:12.572115 IP 13.224.208.10.443 > 10.0.2.15.57350: Flags [P.], seq 144001:149497, ack 803, win 65535, length 5496
22:05:12.572119 IP 13.224.208.10.443 > 10.0.2.15.57350: Flags [P.], seq 149497:156367, ack 803, win 65535, length 6870
22:05:12.572145 IP 10.0.2.15.57350 > 13.224.208.10.443: Flags [.], ack 149497, win 65535, length 0
22:05:12.572300 IP 10.0.2.15.57350 > 13.224.208.10.443: Flags [.], ack 156367, win 65535, length 0
22:05:12.573706 IP 13.224.208.10.443 > 10.0.2.15.57350: Flags [P.], seq 156367:165985, ack 803, win 65535, length 9618
22:05:12.573708 IP 13.224.208.10.443 > 10.0.2.15.57350: Flags [P.], seq 165985:167359, ack 803, win 65535, length 1374
22:05:12.573732 IP 10.0.2.15.57350 > 13.224.208.10.443: Flags [.], ack 165985, win 65535, length 0
22:05:12.573771 IP 10.0.2.15.57350 > 13.224.208.10.443: Flags [.], ack 167359, win 65535, length 0
22:05:12.577883 IP 13.224.208.10.443 > 10.0.2.15.57350: Flags [P.], seq 167359:172855, ack 803, win 65535, length 5496
22:05:12.578079 IP 10.0.2.15.57350 > 13.224.208.10.443: Flags [.], ack 172855, win 65535, length 0
22:05:12.578896 IP 13.224.208.10.443 > 10.0.2.15.57350: Flags [P.], seq 172855:174229, ack 803, win 65535, length 1374
22:05:12.578920 IP 10.0.2.15.57350 > 13.224.208.10.443: Flags [.], ack 174229, win 65535, length 0
22:05:12.580195 IP 13.224.208.10.443 > 10.0.2.15.57350: Flags [P.], seq 174229:183847, ack 803, win 65535, length 9618
22:05:12.580221 IP 10.0.2.15.57350 > 13.224.208.10.443: Flags [.], ack 183847, win 65535, length 0
22:05:12.580965 IP 13.224.208.10.443 > 10.0.2.15.57350: Flags [P.], seq 183847:190717, ack 803, win 65535, length 6870
22:05:12.580968 IP 13.224.208.10.443 > 10.0.2.15.57350: Flags [P.], seq 190717:193465, ack 803, win 65535, length 2748
22:05:12.581086 IP 10.0.2.15.57350 > 13.224.208.10.443: Flags [.], ack 190717, win 65535, length 0
22:05:12.581165 IP 10.0.2.15.57350 > 13.224.208.10.443: Flags [.], ack 193465, win 65535, length 0
22:05:12.582490 IP 13.224.208.10.443 > 10.0.2.15.57350: Flags [P.], seq 193465:200335, ack 803, win 65535, length 6870
22:05:12.582492 IP 13.224.208.10.443 > 10.0.2.15.57350: Flags [P.], seq 200335:203083, ack 803, win 65535, length 2748
22:05:12.582515 IP 10.0.2.15.57350 > 13.224.208.10.443: Flags [.], ack 200335, win 65535, length 0
22:05:12.582554 IP 10.0.2.15.57350 > 13.224.208.10.443: Flags [.], ack 203083, win 65535, length 0
22:05:12.582738 IP 13.224.208.10.443 > 10.0.2.15.57350: Flags [P.], seq 203083:208579, ack 803, win 65535, length 5496
22:05:12.582747 IP 10.0.2.15.57350 > 13.224.208.10.443: Flags [.], ack 208579, win 65535, length 0
22:05:12.583957 IP 13.224.208.10.443 > 10.0.2.15.57350: Flags [P.], seq 208579:214075, ack 803, win 65535, length 5496
22:05:12.583979 IP 10.0.2.15.57350 > 13.224.208.10.443: Flags [.], ack 214075, win 65535, length 0
22:05:12.584350 IP 13.224.208.10.443 > 10.0.2.15.57350: Flags [P.], seq 214075:220945, ack 803, win 65535, length 6870
22:05:12.584353 IP 13.224.208.10.443 > 10.0.2.15.57350: Flags [P.], seq 220945:223693, ack 803, win 65535, length 2748
22:05:12.584354 IP 13.224.208.10.443 > 10.0.2.15.57350: Flags [P.], seq 223693:225067, ack 803, win 65535, length 1374
22:05:12.584377 IP 10.0.2.15.57350 > 13.224.208.10.443: Flags [.], ack 220945, win 65535, length 0
22:05:12.584409 IP 10.0.2.15.57350 > 13.224.208.10.443: Flags [.], ack 223693, win 65535, length 0
22:05:12.584425 IP 10.0.2.15.57350 > 13.224.208.10.443: Flags [.], ack 225067, win 65535, length 0
22:05:12.585006 IP 13.224.208.10.443 > 10.0.2.15.57350: Flags [.], seq 225067:226527, ack 803, win 65535, length 1460
22:05:12.585025 IP 10.0.2.15.57350 > 13.224.208.10.443: Flags [.], ack 226527, win 65535, length 0
22:05:12.585148 IP 13.224.208.10.443 > 10.0.2.15.57350: Flags [P.], seq 226527:231937, ack 803, win 65535, length 5410
22:05:12.585149 IP 13.224.208.10.443 > 10.0.2.15.57350: Flags [P.], seq 231937:233311, ack 803, win 65535, length 1374
22:05:12.585163 IP 10.0.2.15.57350 > 13.224.208.10.443: Flags [.], ack 231937, win 65535, length 0
22:05:12.585275 IP 10.0.2.15.57350 > 13.224.208.10.443: Flags [.], ack 233311, win 65535, length 0
22:05:12.587799 IP 13.224.208.10.443 > 10.0.2.15.57350: Flags [P.], seq 233311:248425, ack 803, win 65535, length 15114
22:05:12.587825 IP 10.0.2.15.57350 > 13.224.208.10.443: Flags [.], ack 248425, win 65535, length 0
22:05:12.590641 IP 13.224.208.10.443 > 10.0.2.15.57350: Flags [P.], seq 248425:258043, ack 803, win 65535, length 9618
22:05:12.590645 IP 13.224.208.10.443 > 10.0.2.15.57350: Flags [P.], seq 258043:266287, ack 803, win 65535, length 8244
22:05:12.590671 IP 10.0.2.15.57350 > 13.224.208.10.443: Flags [.], ack 258043, win 65535, length 0
22:05:12.590800 IP 10.0.2.15.57350 > 13.224.208.10.443: Flags [.], ack 266287, win 65535, length 0
22:05:12.590844 IP 13.224.208.10.443 > 10.0.2.15.57350: Flags [P.], seq 266287:273157, ack 803, win 65535, length 6870
22:05:12.590851 IP 10.0.2.15.57350 > 13.224.208.10.443: Flags [.], ack 273157, win 65535, length 0
22:05:12.591854 IP 13.224.208.10.443 > 10.0.2.15.57350: Flags [P.], seq 273157:282775, ack 803, win 65535, length 9618
22:05:12.591859 IP 13.224.208.10.443 > 10.0.2.15.57350: Flags [P.], seq 282775:284149, ack 803, win 65535, length 1374
22:05:12.592261 IP 10.0.2.15.57350 > 13.224.208.10.443: Flags [.], ack 282775, win 65535, length 0
22:05:12.592511 IP 10.0.2.15.57350 > 13.224.208.10.443: Flags [.], ack 284149, win 65535, length 0
22:05:12.592710 IP 13.224.208.10.443 > 10.0.2.15.57350: Flags [P.], seq 284149:292393, ack 803, win 65535, length 8244
22:05:12.592713 IP 13.224.208.10.443 > 10.0.2.15.57350: Flags [P.], seq 292393:297889, ack 803, win 65535, length 5496
22:05:12.592732 IP 10.0.2.15.57350 > 13.224.208.10.443: Flags [.], ack 292393, win 65535, length 0
22:05:12.592758 IP 10.0.2.15.57350 > 13.224.208.10.443: Flags [.], ack 297889, win 65535, length 0
22:05:12.592783 IP 13.224.208.10.443 > 10.0.2.15.57350: Flags [P.], seq 297889:302011, ack 803, win 65535, length 4122
22:05:12.592785 IP 13.224.208.10.443 > 10.0.2.15.57350: Flags [P.], seq 302011:304759, ack 803, win 65535, length 2748
22:05:12.592792 IP 10.0.2.15.57350 > 13.224.208.10.443: Flags [.], ack 302011, win 65535, length 0
22:05:12.592802 IP 10.0.2.15.57350 > 13.224.208.10.443: Flags [.], ack 304759, win 65535, length 0
22:05:12.594967 IP 13.224.208.10.443 > 10.0.2.15.57350: Flags [P.], seq 304759:315751, ack 803, win 65535, length 10992
22:05:12.595109 IP 10.0.2.15.57350 > 13.224.208.10.443: Flags [.], ack 315751, win 65535, length 0
22:05:12.595161 IP 13.224.208.10.443 > 10.0.2.15.57350: Flags [P.], seq 315751:318499, ack 803, win 65535, length 2748
22:05:12.595170 IP 10.0.2.15.57350 > 13.224.208.10.443: Flags [.], ack 318499, win 65535, length 0
22:05:12.596542 IP 13.224.208.10.443 > 10.0.2.15.57350: Flags [P.], seq 318499:326743, ack 803, win 65535, length 8244
22:05:12.596673 IP 10.0.2.15.57350 > 13.224.208.10.443: Flags [.], ack 326743, win 65535, length 0
22:05:12.597010 IP 13.224.208.10.443 > 10.0.2.15.57350: Flags [P.], seq 326743:332239, ack 803, win 65535, length 5496
22:05:12.597015 IP 13.224.208.10.443 > 10.0.2.15.57350: Flags [P.], seq 332239:339109, ack 803, win 65535, length 6870
22:05:12.597051 IP 10.0.2.15.57350 > 13.224.208.10.443: Flags [.], ack 332239, win 65535, length 0
22:05:12.597082 IP 10.0.2.15.57350 > 13.224.208.10.443: Flags [.], ack 339109, win 65535, length 0
22:05:12.597103 IP 13.224.208.10.443 > 10.0.2.15.57350: Flags [P.], seq 339109:343231, ack 803, win 65535, length 4122
22:05:12.597108 IP 10.0.2.15.57350 > 13.224.208.10.443: Flags [.], ack 343231, win 65535, length 0
22:05:12.600691 IP 13.224.208.10.443 > 10.0.2.15.57350: Flags [P.], seq 343231:352849, ack 803, win 65535, length 9618
22:05:12.600693 IP 13.224.208.10.443 > 10.0.2.15.57350: Flags [P.], seq 352849:355597, ack 803, win 65535, length 2748
22:05:12.600788 IP 10.0.2.15.57350 > 13.224.208.10.443: Flags [.], ack 352849, win 65535, length 0
22:05:12.600837 IP 10.0.2.15.57350 > 13.224.208.10.443: Flags [.], ack 355597, win 65535, length 0
22:05:12.600878 IP 13.224.208.10.443 > 10.0.2.15.57350: Flags [P.], seq 355597:358345, ack 803, win 65535, length 2748
22:05:12.600879 IP 13.224.208.10.443 > 10.0.2.15.57350: Flags [P.], seq 358345:361093, ack 803, win 65535, length 2748
22:05:12.600880 IP 13.224.208.10.443 > 10.0.2.15.57350: Flags [P.], seq 361093:363841, ack 803, win 65535, length 2748
22:05:12.600889 IP 10.0.2.15.57350 > 13.224.208.10.443: Flags [.], ack 358345, win 65535, length 0
22:05:12.600905 IP 10.0.2.15.57350 > 13.224.208.10.443: Flags [.], ack 361093, win 65535, length 0
22:05:12.600923 IP 10.0.2.15.57350 > 13.224.208.10.443: Flags [.], ack 363841, win 65535, length 0
22:05:12.601231 IP 13.224.208.10.443 > 10.0.2.15.57350: Flags [P.], seq 363841:366589, ack 803, win 65535, length 2748
22:05:12.601243 IP 10.0.2.15.57350 > 13.224.208.10.443: Flags [.], ack 366589, win 65535, length 0
22:05:12.601389 IP 13.224.208.10.443 > 10.0.2.15.57350: Flags [P.], seq 366589:369337, ack 803, win 65535, length 2748
22:05:12.601522 IP 10.0.2.15.57350 > 13.224.208.10.443: Flags [.], ack 369337, win 65535, length 0
22:05:12.601789 IP 13.224.208.10.443 > 10.0.2.15.57350: Flags [P.], seq 369337:376207, ack 803, win 65535, length 6870
22:05:12.601800 IP 10.0.2.15.57350 > 13.224.208.10.443: Flags [.], ack 376207, win 65535, length 0
22:05:12.602519 IP 13.224.208.10.443 > 10.0.2.15.57350: Flags [P.], seq 376207:378955, ack 803, win 65535, length 2748
22:05:12.602521 IP 13.224.208.10.443 > 10.0.2.15.57350: Flags [P.], seq 378955:383569, ack 803, win 65535, length 4614
22:05:12.602522 IP 13.224.208.10.443 > 10.0.2.15.57350: Flags [P.], seq 383569:386317, ack 803, win 65535, length 2748
22:05:12.602596 IP 10.0.2.15.57350 > 13.224.208.10.443: Flags [.], ack 378955, win 65535, length 0
22:05:12.602736 IP 10.0.2.15.57350 > 13.224.208.10.443: Flags [.], ack 383569, win 65535, length 0
22:05:12.602762 IP 10.0.2.15.57350 > 13.224.208.10.443: Flags [.], ack 386317, win 65535, length 0
22:05:12.602781 IP 13.224.208.10.443 > 10.0.2.15.57350: Flags [P.], seq 386317:389065, ack 803, win 65535, length 2748
22:05:12.602782 IP 13.224.208.10.443 > 10.0.2.15.57350: Flags [P.], seq 389065:391813, ack 803, win 65535, length 2748
22:05:12.602783 IP 13.224.208.10.443 > 10.0.2.15.57350: Flags [P.], seq 391813:394561, ack 803, win 65535, length 2748
22:05:12.602784 IP 13.224.208.10.443 > 10.0.2.15.57350: Flags [P.], seq 394561:397309, ack 803, win 65535, length 2748
22:05:12.602853 IP 10.0.2.15.57350 > 13.224.208.10.443: Flags [.], ack 397309, win 65535, length 0
22:05:12.603798 IP 13.224.208.10.443 > 10.0.2.15.57350: Flags [P.], seq 397309:404179, ack 803, win 65535, length 6870
22:05:12.603816 IP 10.0.2.15.57350 > 13.224.208.10.443: Flags [.], ack 404179, win 65535, length 0
22:05:12.604103 IP 13.224.208.10.443 > 10.0.2.15.57350: Flags [P.], seq 404179:409675, ack 803, win 65535, length 5496
22:05:12.604105 IP 13.224.208.10.443 > 10.0.2.15.57350: Flags [P.], seq 409675:412423, ack 803, win 65535, length 2748
22:05:12.604117 IP 10.0.2.15.57350 > 13.224.208.10.443: Flags [.], ack 409675, win 65535, length 0
22:05:12.604222 IP 13.224.208.10.443 > 10.0.2.15.57350: Flags [P.], seq 412423:415171, ack 803, win 65535, length 2748
22:05:12.604241 IP 10.0.2.15.57350 > 13.224.208.10.443: Flags [.], ack 415171, win 65535, length 0
22:05:12.605187 IP 13.224.208.10.443 > 10.0.2.15.57350: Flags [P.], seq 415171:420667, ack 803, win 65535, length 5496
22:05:12.605203 IP 10.0.2.15.57350 > 13.224.208.10.443: Flags [.], ack 420667, win 65535, length 0
22:05:12.605373 IP 13.224.208.10.443 > 10.0.2.15.57350: Flags [P.], seq 420667:426171, ack 803, win 65535, length 5504
22:05:12.605436 IP 10.0.2.15.57350 > 13.224.208.10.443: Flags [.], ack 426171, win 65535, length 0
22:05:12.606234 IP 13.224.208.10.443 > 10.0.2.15.57350: Flags [P.], seq 426171:435289, ack 803, win 65535, length 9118
22:05:12.606248 IP 10.0.2.15.57350 > 13.224.208.10.443: Flags [.], ack 435289, win 65535, length 0
22:05:12.606998 IP 13.224.208.10.443 > 10.0.2.15.57350: Flags [P.], seq 435289:440785, ack 803, win 65535, length 5496
22:05:12.607013 IP 10.0.2.15.57350 > 13.224.208.10.443: Flags [.], ack 440785, win 65535, length 0
22:05:12.610452 IP 13.224.208.10.443 > 10.0.2.15.57350: Flags [P.], seq 440785:450403, ack 803, win 65535, length 9618
22:05:12.610996 IP 13.224.208.10.443 > 10.0.2.15.57350: Flags [P.], seq 450403:454525, ack 803, win 65535, length 4122
22:05:12.611000 IP 13.224.208.10.443 > 10.0.2.15.57350: Flags [P.], seq 454525:461395, ack 803, win 65535, length 6870
22:05:12.611121 IP 13.224.208.10.443 > 10.0.2.15.57350: Flags [P.], seq 461395:464143, ack 803, win 65535, length 2748
22:05:12.611123 IP 13.224.208.10.443 > 10.0.2.15.57350: Flags [P.], seq 464143:469639, ack 803, win 65535, length 5496
22:05:12.611125 IP 13.224.208.10.443 > 10.0.2.15.57350: Flags [P.], seq 469639:475135, ack 803, win 65535, length 5496
22:05:12.611389 IP 10.0.2.15.57350 > 13.224.208.10.443: Flags [.], ack 475135, win 65535, length 0
22:05:12.611782 IP 13.224.208.10.443 > 10.0.2.15.57350: Flags [.], seq 475135:492655, ack 803, win 65535, length 17520
22:05:12.611842 IP 10.0.2.15.57350 > 13.224.208.10.443: Flags [.], ack 492655, win 65535, length 0
22:05:12.612033 IP 13.224.208.10.443 > 10.0.2.15.57350: Flags [P.], seq 492655:495745, ack 803, win 65535, length 3090
22:05:12.612051 IP 10.0.2.15.57350 > 13.224.208.10.443: Flags [.], ack 495745, win 65535, length 0

