22:02:42.677207 IP 10.0.2.15.53938 > 140.233.253.2.53: 49625+ A? www.imdb.com. (30)
22:02:42.677254 IP 10.0.2.15.53938 > 140.233.253.2.53: 27098+ AAAA? www.imdb.com. (30)
22:02:42.683112 IP 140.233.253.2.53 > 10.0.2.15.53938: 49625 3/0/0 CNAME tp.391b988c0-frontier.imdb.com., CNAME d2bytcopxu066p.cloudfront.net., A 13.224.208.10 (125)
22:02:42.683114 IP 140.233.253.2.53 > 10.0.2.15.53938: 27098 2/1/0 CNAME tp.391b988c0-frontier.imdb.com., CNAME d2bytcopxu066p.cloudfront.net. (191)
22:02:42.683343 IP 10.0.2.15.57304 > 13.224.208.10.443: Flags [S], seq 597512487, win 64240, options [mss 1460,sackOK,TS val 3642581273 ecr 0,nop,wscale 6], length 0
22:02:42.698704 IP 13.224.208.10.443 > 10.0.2.15.57304: Flags [S.], seq 291712001, ack 597512488, win 65535, options [mss 1460], length 0
22:02:42.698748 IP 10.0.2.15.57304 > 13.224.208.10.443: Flags [.], ack 1, win 64240, length 0
22:02:42.710098 IP 10.0.2.15.57304 > 13.224.208.10.443: Flags [P.], seq 1:518, ack 1, win 64240, length 517
22:02:42.710365 IP 13.224.208.10.443 > 10.0.2.15.57304: Flags [.], ack 518, win 65535, length 0
22:02:42.728786 IP 13.224.208.10.443 > 10.0.2.15.57304: Flags [P.], seq 1:2749, ack 518, win 65535, length 2748
22:02:42.729104 IP 10.0.2.15.57304 > 13.224.208.10.443: Flags [.], ack 2749, win 62780, length 0
22:02:42.729479 IP 13.224.208.10.443 > 10.0.2.15.57304: Flags [P.], seq 2749:5497, ack 518, win 65535, length 2748
22:02:42.729507 IP 10.0.2.15.57304 > 13.224.208.10.443: Flags [.], ack 5497, win 61320, length 0
22:02:42.732317 IP 13.224.208.10.443 > 10.0.2.15.57304: Flags [P.], seq 5497:5509, ack 518, win 65535, length 12
22:02:42.732336 IP 10.0.2.15.57304 > 13.224.208.10.443: Flags [.], ack 5509, win 62780, length 0
22:02:42.732678 IP 10.0.2.15.57304 > 13.224.208.10.443: Flags [P.], seq 518:582, ack 5509, win 62780, length 64
22:02:42.732915 IP 10.0.2.15.57304 > 13.224.208.10.443: Flags [P.], seq 582:628, ack 5509, win 62780, length 46
22:02:42.732975 IP 13.224.208.10.443 > 10.0.2.15.57304: Flags [.], ack 582, win 65535, length 0
22:02:42.733014 IP 10.0.2.15.57304 > 13.224.208.10.443: Flags [P.], seq 628:677, ack 5509, win 62780, length 49
22:02:42.733268 IP 13.224.208.10.443 > 10.0.2.15.57304: Flags [.], ack 628, win 65535, length 0
22:02:42.733269 IP 13.224.208.10.443 > 10.0.2.15.57304: Flags [.], ack 677, win 65535, length 0
22:02:42.733284 IP 10.0.2.15.57304 > 13.224.208.10.443: Flags [P.], seq 677:712, ack 5509, win 62780, length 35
22:02:42.733470 IP 13.224.208.10.443 > 10.0.2.15.57304: Flags [.], ack 712, win 65535, length 0
22:02:42.733495 IP 10.0.2.15.57304 > 13.224.208.10.443: Flags [P.], seq 712:772, ack 5509, win 62780, length 60
22:02:42.733725 IP 13.224.208.10.443 > 10.0.2.15.57304: Flags [.], ack 772, win 65535, length 0
22:02:42.747360 IP 13.224.208.10.443 > 10.0.2.15.57304: Flags [P.], seq 5509:5571, ack 772, win 65535, length 62
22:02:42.747382 IP 10.0.2.15.57304 > 13.224.208.10.443: Flags [.], ack 5571, win 62780, length 0
22:02:42.747771 IP 10.0.2.15.57304 > 13.224.208.10.443: Flags [P.], seq 772:803, ack 5571, win 62780, length 31
22:02:42.748298 IP 13.224.208.10.443 > 10.0.2.15.57304: Flags [P.], seq 5571:5602, ack 772, win 65535, length 31
22:02:42.748300 IP 13.224.208.10.443 > 10.0.2.15.57304: Flags [.], ack 803, win 65535, length 0
22:02:42.748317 IP 10.0.2.15.57304 > 13.224.208.10.443: Flags [.], ack 5602, win 62780, length 0
22:02:43.372171 IP 13.224.208.10.443 > 10.0.2.15.57304: Flags [.], seq 5602:15822, ack 803, win 65535, length 10220
22:02:43.372272 IP 10.0.2.15.57304 > 13.224.208.10.443: Flags [.], ack 15822, win 58400, length 0
22:02:43.372474 IP 13.224.208.10.443 > 10.0.2.15.57304: Flags [.], seq 15822:23122, ack 803, win 65535, length 7300
22:02:43.372488 IP 10.0.2.15.57304 > 13.224.208.10.443: Flags [.], ack 23122, win 52560, length 0
22:02:43.372834 IP 13.224.208.10.443 > 10.0.2.15.57304: Flags [P.], seq 23122:33082, ack 803, win 65535, length 9960
22:02:43.372852 IP 10.0.2.15.57304 > 13.224.208.10.443: Flags [.], ack 33082, win 46720, length 0
22:02:43.374230 IP 13.224.208.10.443 > 10.0.2.15.57304: Flags [P.], seq 33082:41711, ack 803, win 65535, length 8629
22:02:43.374249 IP 10.0.2.15.57304 > 13.224.208.10.443: Flags [.], ack 41711, win 58400, length 0
22:02:43.374569 IP 13.224.208.10.443 > 10.0.2.15.57304: Flags [P.], seq 41711:48581, ack 803, win 65535, length 6870
22:02:43.374587 IP 10.0.2.15.57304 > 13.224.208.10.443: Flags [.], ack 48581, win 54020, length 0
22:02:43.381790 IP 13.224.208.10.443 > 10.0.2.15.57304: Flags [P.], seq 48581:49955, ack 803, win 65535, length 1374
22:02:43.381813 IP 10.0.2.15.57304 > 13.224.208.10.443: Flags [.], ack 49955, win 62780, length 0
22:02:43.387701 IP 13.224.208.10.443 > 10.0.2.15.57304: Flags [P.], seq 49955:54077, ack 803, win 65535, length 4122
22:02:43.387732 IP 10.0.2.15.57304 > 13.224.208.10.443: Flags [.], ack 54077, win 61320, length 0
22:02:43.388157 IP 13.224.208.10.443 > 10.0.2.15.57304: Flags [P.], seq 54077:59573, ack 803, win 65535, length 5496
22:02:43.388174 IP 10.0.2.15.57304 > 13.224.208.10.443: Flags [.], ack 59573, win 58400, length 0
22:02:43.389402 IP 13.224.208.10.443 > 10.0.2.15.57304: Flags [P.], seq 59573:67817, ack 803, win 65535, length 8244
22:02:43.389404 IP 13.224.208.10.443 > 10.0.2.15.57304: Flags [P.], seq 67817:71939, ack 803, win 65535, length 4122
22:02:43.389425 IP 10.0.2.15.57304 > 13.224.208.10.443: Flags [.], ack 67817, win 58400, length 0
22:02:43.389491 IP 10.0.2.15.57304 > 13.224.208.10.443: Flags [.], ack 71939, win 55480, length 0
22:02:43.390427 IP 13.224.208.10.443 > 10.0.2.15.57304: Flags [P.], seq 71939:76061, ack 803, win 65535, length 4122
22:02:43.390442 IP 10.0.2.15.57304 > 13.224.208.10.443: Flags [.], ack 76061, win 65535, length 0
22:02:43.391830 IP 13.224.208.10.443 > 10.0.2.15.57304: Flags [P.], seq 76061:85679, ack 803, win 65535, length 9618
22:02:43.391832 IP 13.224.208.10.443 > 10.0.2.15.57304: Flags [P.], seq 85679:87053, ack 803, win 65535, length 1374
22:02:43.391855 IP 10.0.2.15.57304 > 13.224.208.10.443: Flags [.], ack 85679, win 65535, length 0
22:02:43.391894 IP 10.0.2.15.57304 > 13.224.208.10.443: Flags [.], ack 87053, win 65535, length 0
22:02:43.392571 IP 13.224.208.10.443 > 10.0.2.15.57304: Flags [P.], seq 87053:91175, ack 803, win 65535, length 4122
22:02:43.392585 IP 10.0.2.15.57304 > 13.224.208.10.443: Flags [.], ack 91175, win 65535, length 0
22:02:43.393359 IP 13.224.208.10.443 > 10.0.2.15.57304: Flags [P.], seq 91175:92549, ack 803, win 65535, length 1374
22:02:43.393370 IP 10.0.2.15.57304 > 13.224.208.10.443: Flags [.], ack 92549, win 65535, length 0
22:02:43.401414 IP 13.224.208.10.443 > 10.0.2.15.57304: Flags [P.], seq 92549:98045, ack 803, win 65535, length 5496
22:02:43.401436 IP 10.0.2.15.57304 > 13.224.208.10.443: Flags [.], ack 98045, win 65535, length 0
22:02:43.402187 IP 13.224.208.10.443 > 10.0.2.15.57304: Flags [P.], seq 98045:102167, ack 803, win 65535, length 4122
22:02:43.402224 IP 10.0.2.15.57304 > 13.224.208.10.443: Flags [.], ack 102167, win 65535, length 0
22:02:43.403424 IP 13.224.208.10.443 > 10.0.2.15.57304: Flags [P.], seq 102167:110411, ack 803, win 65535, length 8244
22:02:43.403512 IP 10.0.2.15.57304 > 13.224.208.10.443: Flags [.], ack 110411, win 65535, length 0
22:02:43.404300 IP 13.224.208.10.443 > 10.0.2.15.57304: Flags [P.], seq 110411:117281, ack 803, win 65535, length 6870
22:02:43.404302 IP 13.224.208.10.443 > 10.0.2.15.57304: Flags [P.], seq 117281:118655, ack 803, win 65535, length 1374
22:02:43.404322 IP 10.0.2.15.57304 > 13.224.208.10.443: Flags [.], ack 117281, win 65535, length 0
22:02:43.404352 IP 10.0.2.15.57304 > 13.224.208.10.443: Flags [.], ack 118655, win 65535, length 0
22:02:43.405730 IP 13.224.208.10.443 > 10.0.2.15.57304: Flags [P.], seq 118655:124151, ack 803, win 65535, length 5496
22:02:43.405749 IP 10.0.2.15.57304 > 13.224.208.10.443: Flags [.], ack 124151, win 65535, length 0
22:02:43.406677 IP 13.224.208.10.443 > 10.0.2.15.57304: Flags [P.], seq 124151:131021, ack 803, win 65535, length 6870
22:02:43.406697 IP 10.0.2.15.57304 > 13.224.208.10.443: Flags [.], ack 131021, win 65535, length 0
22:02:43.407741 IP 13.224.208.10.443 > 10.0.2.15.57304: Flags [P.], seq 131021:136517, ack 803, win 65535, length 5496
22:02:43.407764 IP 10.0.2.15.57304 > 13.224.208.10.443: Flags [.], ack 136517, win 65535, length 0
22:02:43.415078 IP 13.224.208.10.443 > 10.0.2.15.57304: Flags [P.], seq 136517:144761, ack 803, win 65535, length 8244
22:02:43.415189 IP 10.0.2.15.57304 > 13.224.208.10.443: Flags [.], ack 144761, win 65535, length 0
22:02:43.416333 IP 13.224.208.10.443 > 10.0.2.15.57304: Flags [P.], seq 144761:151631, ack 803, win 65535, length 6870
22:02:43.416354 IP 10.0.2.15.57304 > 13.224.208.10.443: Flags [.], ack 151631, win 65535, length 0
22:02:43.416980 IP 13.224.208.10.443 > 10.0.2.15.57304: Flags [P.], seq 151631:158501, ack 803, win 65535, length 6870
22:02:43.416983 IP 13.224.208.10.443 > 10.0.2.15.57304: Flags [P.], seq 158501:161249, ack 803, win 65535, length 2748
22:02:43.417059 IP 10.0.2.15.57304 > 13.224.208.10.443: Flags [.], ack 158501, win 65535, length 0
22:02:43.417092 IP 10.0.2.15.57304 > 13.224.208.10.443: Flags [.], ack 161249, win 65535, length 0
22:02:43.417975 IP 13.224.208.10.443 > 10.0.2.15.57304: Flags [P.], seq 161249:162623, ack 803, win 65535, length 1374
22:02:43.417993 IP 10.0.2.15.57304 > 13.224.208.10.443: Flags [.], ack 162623, win 65535, length 0
22:02:43.418346 IP 13.224.208.10.443 > 10.0.2.15.57304: Flags [P.], seq 162623:173615, ack 803, win 65535, length 10992
22:02:43.418395 IP 10.0.2.15.57304 > 13.224.208.10.443: Flags [.], ack 173615, win 65535, length 0
22:02:43.420041 IP 13.224.208.10.443 > 10.0.2.15.57304: Flags [P.], seq 173615:176363, ack 803, win 65535, length 2748
22:02:43.420151 IP 10.0.2.15.57304 > 13.224.208.10.443: Flags [.], ack 176363, win 65535, length 0
22:02:43.420731 IP 13.224.208.10.443 > 10.0.2.15.57304: Flags [P.], seq 176363:184607, ack 803, win 65535, length 8244
22:02:43.420787 IP 10.0.2.15.57304 > 13.224.208.10.443: Flags [.], ack 184607, win 65535, length 0
22:02:43.421966 IP 13.224.208.10.443 > 10.0.2.15.57304: Flags [P.], seq 184607:192851, ack 803, win 65535, length 8244
22:02:43.421970 IP 13.224.208.10.443 > 10.0.2.15.57304: Flags [P.], seq 192851:201095, ack 803, win 65535, length 8244
22:02:43.421994 IP 10.0.2.15.57304 > 13.224.208.10.443: Flags [.], ack 192851, win 65535, length 0
22:02:43.422101 IP 10.0.2.15.57304 > 13.224.208.10.443: Flags [.], ack 201095, win 65535, length 0
22:02:43.423484 IP 13.224.208.10.443 > 10.0.2.15.57304: Flags [P.], seq 201095:209339, ack 803, win 65535, length 8244
22:02:43.423505 IP 10.0.2.15.57304 > 13.224.208.10.443: Flags [.], ack 209339, win 65535, length 0
22:02:43.425375 IP 13.224.208.10.443 > 10.0.2.15.57304: Flags [P.], seq 209339:217583, ack 803, win 65535, length 8244
22:02:43.425379 IP 13.224.208.10.443 > 10.0.2.15.57304: Flags [P.], seq 217583:223079, ack 803, win 65535, length 5496
22:02:43.425404 IP 10.0.2.15.57304 > 13.224.208.10.443: Flags [.], ack 217583, win 65535, length 0
22:02:43.425486 IP 10.0.2.15.57304 > 13.224.208.10.443: Flags [.], ack 223079, win 65535, length 0
22:02:43.425509 IP 13.224.208.10.443 > 10.0.2.15.57304: Flags [P.], seq 223079:224453, ack 803, win 65535, length 1374
22:02:43.425516 IP 10.0.2.15.57304 > 13.224.208.10.443: Flags [.], ack 224453, win 65535, length 0
22:02:43.428738 IP 13.224.208.10.443 > 10.0.2.15.57304: Flags [P.], seq 224453:231323, ack 803, win 65535, length 6870
22:02:43.428757 IP 10.0.2.15.57304 > 13.224.208.10.443: Flags [.], ack 231323, win 65535, length 0
22:02:43.429809 IP 13.224.208.10.443 > 10.0.2.15.57304: Flags [P.], seq 231323:236819, ack 803, win 65535, length 5496
22:02:43.429811 IP 13.224.208.10.443 > 10.0.2.15.57304: Flags [P.], seq 236819:239567, ack 803, win 65535, length 2748
22:02:43.429828 IP 10.0.2.15.57304 > 13.224.208.10.443: Flags [.], ack 236819, win 65535, length 0
22:02:43.429854 IP 10.0.2.15.57304 > 13.224.208.10.443: Flags [.], ack 239567, win 65535, length 0
22:02:43.430786 IP 13.224.208.10.443 > 10.0.2.15.57304: Flags [P.], seq 239567:249185, ack 803, win 65535, length 9618
22:02:43.430806 IP 10.0.2.15.57304 > 13.224.208.10.443: Flags [.], ack 249185, win 65535, length 0
22:02:43.433212 IP 13.224.208.10.443 > 10.0.2.15.57304: Flags [.], seq 249185:253565, ack 803, win 65535, length 4380
22:02:43.433235 IP 10.0.2.15.57304 > 13.224.208.10.443: Flags [.], ack 253565, win 65535, length 0
22:02:43.433547 IP 13.224.208.10.443 > 10.0.2.15.57304: Flags [P.], seq 253565:256055, ack 803, win 65535, length 2490
22:02:43.433551 IP 13.224.208.10.443 > 10.0.2.15.57304: Flags [P.], seq 256055:262925, ack 803, win 65535, length 6870
22:02:43.433552 IP 13.224.208.10.443 > 10.0.2.15.57304: Flags [P.], seq 262925:267047, ack 803, win 65535, length 4122
22:02:43.433572 IP 10.0.2.15.57304 > 13.224.208.10.443: Flags [.], ack 256055, win 65535, length 0
22:02:43.433895 IP 10.0.2.15.57304 > 13.224.208.10.443: Flags [.], ack 262925, win 65535, length 0
22:02:43.434188 IP 10.0.2.15.57304 > 13.224.208.10.443: Flags [.], ack 267047, win 65535, length 0
22:02:43.434231 IP 13.224.208.10.443 > 10.0.2.15.57304: Flags [P.], seq 267047:269795, ack 803, win 65535, length 2748
22:02:43.434242 IP 10.0.2.15.57304 > 13.224.208.10.443: Flags [.], ack 269795, win 65535, length 0
22:02:43.435739 IP 13.224.208.10.443 > 10.0.2.15.57304: Flags [P.], seq 269795:276665, ack 803, win 65535, length 6870
22:02:43.435743 IP 13.224.208.10.443 > 10.0.2.15.57304: Flags [P.], seq 276665:283535, ack 803, win 65535, length 6870
22:02:43.435766 IP 10.0.2.15.57304 > 13.224.208.10.443: Flags [.], ack 276665, win 65535, length 0
22:02:43.435787 IP 10.0.2.15.57304 > 13.224.208.10.443: Flags [.], ack 283535, win 65535, length 0
22:02:43.435812 IP 13.224.208.10.443 > 10.0.2.15.57304: Flags [P.], seq 283535:286283, ack 803, win 65535, length 2748
22:02:43.435817 IP 10.0.2.15.57304 > 13.224.208.10.443: Flags [.], ack 286283, win 65535, length 0
22:02:43.436312 IP 13.224.208.10.443 > 10.0.2.15.57304: Flags [P.], seq 286283:289031, ack 803, win 65535, length 2748
22:02:43.436314 IP 13.224.208.10.443 > 10.0.2.15.57304: Flags [P.], seq 289031:290405, ack 803, win 65535, length 1374
22:02:43.436316 IP 13.224.208.10.443 > 10.0.2.15.57304: Flags [P.], seq 290405:300023, ack 803, win 65535, length 9618
22:02:43.436338 IP 10.0.2.15.57304 > 13.224.208.10.443: Flags [.], ack 289031, win 65535, length 0
22:02:43.436361 IP 10.0.2.15.57304 > 13.224.208.10.443: Flags [.], ack 290405, win 65535, length 0
22:02:43.436374 IP 10.0.2.15.57304 > 13.224.208.10.443: Flags [.], ack 300023, win 65535, length 0
22:02:43.436401 IP 13.224.208.10.443 > 10.0.2.15.57304: Flags [P.], seq 300023:308267, ack 803, win 65535, length 8244
22:02:43.436410 IP 10.0.2.15.57304 > 13.224.208.10.443: Flags [.], ack 308267, win 65535, length 0
22:02:43.437404 IP 13.224.208.10.443 > 10.0.2.15.57304: Flags [P.], seq 308267:315137, ack 803, win 65535, length 6870
22:02:43.437407 IP 13.224.208.10.443 > 10.0.2.15.57304: Flags [P.], seq 315137:317885, ack 803, win 65535, length 2748
22:02:43.437440 IP 10.0.2.15.57304 > 13.224.208.10.443: Flags [.], ack 315137, win 65535, length 0
22:02:43.437469 IP 10.0.2.15.57304 > 13.224.208.10.443: Flags [.], ack 317885, win 65535, length 0
22:02:43.438768 IP 13.224.208.10.443 > 10.0.2.15.57304: Flags [P.], seq 317885:323381, ack 803, win 65535, length 5496
22:02:43.438771 IP 13.224.208.10.443 > 10.0.2.15.57304: Flags [P.], seq 323381:327503, ack 803, win 65535, length 4122
22:02:43.438798 IP 10.0.2.15.57304 > 13.224.208.10.443: Flags [.], ack 323381, win 65535, length 0
22:02:43.438820 IP 10.0.2.15.57304 > 13.224.208.10.443: Flags [.], ack 327503, win 65535, length 0
22:02:43.441680 IP 13.224.208.10.443 > 10.0.2.15.57304: Flags [P.], seq 327503:337121, ack 803, win 65535, length 9618
22:02:43.441684 IP 13.224.208.10.443 > 10.0.2.15.57304: Flags [P.], seq 337121:345365, ack 803, win 65535, length 8244
22:02:43.441710 IP 10.0.2.15.57304 > 13.224.208.10.443: Flags [.], ack 337121, win 65535, length 0
22:02:43.441742 IP 10.0.2.15.57304 > 13.224.208.10.443: Flags [.], ack 345365, win 65535, length 0
22:02:43.441774 IP 13.224.208.10.443 > 10.0.2.15.57304: Flags [P.], seq 345365:352235, ack 803, win 65535, length 6870
22:02:43.441776 IP 13.224.208.10.443 > 10.0.2.15.57304: Flags [P.], seq 352235:360479, ack 803, win 65535, length 8244
22:02:43.441782 IP 10.0.2.15.57304 > 13.224.208.10.443: Flags [.], ack 352235, win 65535, length 0
22:02:43.441794 IP 10.0.2.15.57304 > 13.224.208.10.443: Flags [.], ack 360479, win 65535, length 0
22:02:43.443706 IP 13.224.208.10.443 > 10.0.2.15.57304: Flags [P.], seq 360479:383837, ack 803, win 65535, length 23358
22:02:43.443797 IP 13.224.208.10.443 > 10.0.2.15.57304: Flags [P.], seq 383837:389333, ack 803, win 65535, length 5496
22:02:43.444418 IP 10.0.2.15.57304 > 13.224.208.10.443: Flags [.], ack 383837, win 65535, length 0
22:02:43.445355 IP 13.224.208.10.443 > 10.0.2.15.57304: Flags [P.], seq 389333:396203, ack 803, win 65535, length 6870
22:02:43.445360 IP 13.224.208.10.443 > 10.0.2.15.57304: Flags [P.], seq 396203:408569, ack 803, win 65535, length 12366
22:02:43.447618 IP 13.224.208.10.443 > 10.0.2.15.57304: Flags [.], seq 408569:410029, ack 803, win 65535, length 1460
22:02:43.447666 IP 10.0.2.15.57304 > 13.224.208.10.443: Flags [.], ack 389333, win 65535, length 0
22:02:43.447999 IP 10.0.2.15.57304 > 13.224.208.10.443: Flags [.], ack 410029, win 65535, length 0
22:02:43.448648 IP 13.224.208.10.443 > 10.0.2.15.57304: Flags [P.], seq 410029:412691, ack 803, win 65535, length 2662
22:02:43.448673 IP 13.224.208.10.443 > 10.0.2.15.57304: Flags [P.], seq 412691:418187, ack 803, win 65535, length 5496
22:02:43.448700 IP 10.0.2.15.57304 > 13.224.208.10.443: Flags [.], ack 412691, win 65535, length 0
22:02:43.448726 IP 10.0.2.15.57304 > 13.224.208.10.443: Flags [.], ack 418187, win 65535, length 0
22:02:43.450208 IP 13.224.208.10.443 > 10.0.2.15.57304: Flags [.], seq 418187:419647, ack 803, win 65535, length 1460
22:02:43.450421 IP 13.224.208.10.443 > 10.0.2.15.57304: Flags [P.], seq 419647:452537, ack 803, win 65535, length 32890
22:02:43.450469 IP 10.0.2.15.57304 > 13.224.208.10.443: Flags [.], ack 419647, win 65535, length 0
22:02:43.450598 IP 10.0.2.15.57304 > 13.224.208.10.443: Flags [.], ack 452537, win 65535, length 0
22:02:43.450893 IP 13.224.208.10.443 > 10.0.2.15.57304: Flags [.], seq 452537:456917, ack 803, win 65535, length 4380
22:02:43.450908 IP 10.0.2.15.57304 > 13.224.208.10.443: Flags [.], ack 456917, win 65535, length 0
22:02:43.451369 IP 13.224.208.10.443 > 10.0.2.15.57304: Flags [.], seq 456917:458377, ack 803, win 65535, length 1460
22:02:43.451389 IP 10.0.2.15.57304 > 13.224.208.10.443: Flags [.], ack 458377, win 65535, length 0
22:02:43.453188 IP 13.224.208.10.443 > 10.0.2.15.57304: Flags [.], seq 458377:467137, ack 803, win 65535, length 8760
22:02:43.453214 IP 10.0.2.15.57304 > 13.224.208.10.443: Flags [.], ack 467137, win 65535, length 0
22:02:43.454797 IP 13.224.208.10.443 > 10.0.2.15.57304: Flags [P.], seq 467137:488261, ack 803, win 65535, length 21124
22:02:43.454818 IP 10.0.2.15.57304 > 13.224.208.10.443: Flags [.], ack 488261, win 65535, length 0
22:02:43.455169 IP 13.224.208.10.443 > 10.0.2.15.57304: Flags [P.], seq 488261:496505, ack 803, win 65535, length 8244

