22:05:18.215867 IP 10.0.2.15.39517 > 140.233.253.2.53: 17839+ A? www.imdb.com. (30)
22:05:18.215908 IP 10.0.2.15.39517 > 140.233.253.2.53: 40105+ AAAA? www.imdb.com. (30)
22:05:18.221182 IP 140.233.253.2.53 > 10.0.2.15.39517: 17839 3/0/0 CNAME tp.391b988c0-frontier.imdb.com., CNAME d2bytcopxu066p.cloudfront.net., A 13.224.208.10 (125)
22:05:18.222706 IP 140.233.253.2.53 > 10.0.2.15.39517: 40105 2/1/0 CNAME tp.391b988c0-frontier.imdb.com., CNAME d2bytcopxu066p.cloudfront.net. (191)
22:05:18.222969 IP 10.0.2.15.57352 > 13.224.208.10.443: Flags [S], seq 1094783511, win 64240, options [mss 1460,sackOK,TS val 3642736813 ecr 0,nop,wscale 6], length 0
22:05:18.239142 IP 13.224.208.10.443 > 10.0.2.15.57352: Flags [S.], seq 297600001, ack 1094783512, win 65535, options [mss 1460], length 0
22:05:18.239188 IP 10.0.2.15.57352 > 13.224.208.10.443: Flags [.], ack 1, win 64240, length 0
22:05:18.248576 IP 10.0.2.15.57352 > 13.224.208.10.443: Flags [P.], seq 1:518, ack 1, win 64240, length 517
22:05:18.248989 IP 13.224.208.10.443 > 10.0.2.15.57352: Flags [.], ack 518, win 65535, length 0
22:05:18.265506 IP 13.224.208.10.443 > 10.0.2.15.57352: Flags [.], seq 1:2921, ack 518, win 65535, length 2920
22:05:18.265526 IP 10.0.2.15.57352 > 13.224.208.10.443: Flags [.], ack 2921, win 62780, length 0
22:05:18.265758 IP 13.224.208.10.443 > 10.0.2.15.57352: Flags [P.], seq 2921:4123, ack 518, win 65535, length 1202
22:05:18.265771 IP 10.0.2.15.57352 > 13.224.208.10.443: Flags [.], ack 4123, win 61578, length 0
22:05:18.271357 IP 13.224.208.10.443 > 10.0.2.15.57352: Flags [P.], seq 4123:5497, ack 518, win 65535, length 1374
22:05:18.271376 IP 10.0.2.15.57352 > 13.224.208.10.443: Flags [.], ack 5497, win 62780, length 0
22:05:18.271715 IP 13.224.208.10.443 > 10.0.2.15.57352: Flags [P.], seq 5497:5509, ack 518, win 65535, length 12
22:05:18.271728 IP 10.0.2.15.57352 > 13.224.208.10.443: Flags [.], ack 5509, win 62780, length 0
22:05:18.272790 IP 10.0.2.15.57352 > 13.224.208.10.443: Flags [P.], seq 518:582, ack 5509, win 62780, length 64
22:05:18.272979 IP 10.0.2.15.57352 > 13.224.208.10.443: Flags [P.], seq 582:628, ack 5509, win 62780, length 46
22:05:18.273080 IP 13.224.208.10.443 > 10.0.2.15.57352: Flags [.], ack 582, win 65535, length 0
22:05:18.273126 IP 10.0.2.15.57352 > 13.224.208.10.443: Flags [P.], seq 628:677, ack 5509, win 62780, length 49
22:05:18.273300 IP 10.0.2.15.57352 > 13.224.208.10.443: Flags [P.], seq 677:772, ack 5509, win 62780, length 95
22:05:18.273474 IP 13.224.208.10.443 > 10.0.2.15.57352: Flags [.], ack 628, win 65535, length 0
22:05:18.273575 IP 13.224.208.10.443 > 10.0.2.15.57352: Flags [.], ack 677, win 65535, length 0
22:05:18.273701 IP 13.224.208.10.443 > 10.0.2.15.57352: Flags [.], ack 772, win 65535, length 0
22:05:18.287284 IP 13.224.208.10.443 > 10.0.2.15.57352: Flags [P.], seq 5509:5571, ack 772, win 65535, length 62
22:05:18.287306 IP 10.0.2.15.57352 > 13.224.208.10.443: Flags [.], ack 5571, win 62780, length 0
22:05:18.287637 IP 10.0.2.15.57352 > 13.224.208.10.443: Flags [P.], seq 772:803, ack 5571, win 62780, length 31
22:05:18.288376 IP 13.224.208.10.443 > 10.0.2.15.57352: Flags [.], ack 803, win 65535, length 0
22:05:18.291632 IP 13.224.208.10.443 > 10.0.2.15.57352: Flags [P.], seq 5571:5602, ack 803, win 65535, length 31
22:05:18.291654 IP 10.0.2.15.57352 > 13.224.208.10.443: Flags [.], ack 5602, win 62780, length 0
22:05:18.827377 IP 13.224.208.10.443 > 10.0.2.15.57352: Flags [.], seq 5602:17282, ack 803, win 65535, length 11680
22:05:18.827408 IP 10.0.2.15.57352 > 13.224.208.10.443: Flags [.], ack 17282, win 56940, length 0
22:05:18.827578 IP 13.224.208.10.443 > 10.0.2.15.57352: Flags [.], seq 17282:18742, ack 803, win 65535, length 1460
22:05:18.827593 IP 10.0.2.15.57352 > 13.224.208.10.443: Flags [.], ack 18742, win 55480, length 0
22:05:18.827925 IP 13.224.208.10.443 > 10.0.2.15.57352: Flags [P.], seq 18742:26130, ack 803, win 65535, length 7388
22:05:18.827939 IP 10.0.2.15.57352 > 13.224.208.10.443: Flags [.], ack 26130, win 51100, length 0
22:05:18.829274 IP 13.224.208.10.443 > 10.0.2.15.57352: Flags [.], seq 26130:42190, ack 803, win 65535, length 16060
22:05:18.829291 IP 10.0.2.15.57352 > 13.224.208.10.443: Flags [.], ack 42190, win 54020, length 0
22:05:18.829555 IP 13.224.208.10.443 > 10.0.2.15.57352: Flags [P.], seq 42190:42618, ack 803, win 65535, length 428
22:05:18.829562 IP 10.0.2.15.57352 > 13.224.208.10.443: Flags [.], ack 42618, win 62780, length 0
22:05:18.830137 IP 13.224.208.10.443 > 10.0.2.15.57352: Flags [P.], seq 42618:43992, ack 803, win 65535, length 1374
22:05:18.830156 IP 10.0.2.15.57352 > 13.224.208.10.443: Flags [.], ack 43992, win 62780, length 0
22:05:18.831132 IP 13.224.208.10.443 > 10.0.2.15.57352: Flags [P.], seq 43992:49488, ack 803, win 65535, length 5496
22:05:18.831144 IP 10.0.2.15.57352 > 13.224.208.10.443: Flags [.], ack 49488, win 61320, length 0
22:05:18.842190 IP 13.224.208.10.443 > 10.0.2.15.57352: Flags [P.], seq 49488:57732, ack 803, win 65535, length 8244
22:05:18.842192 IP 13.224.208.10.443 > 10.0.2.15.57352: Flags [P.], seq 57732:60480, ack 803, win 65535, length 2748
22:05:18.842221 IP 10.0.2.15.57352 > 13.224.208.10.443: Flags [.], ack 57732, win 58400, length 0
22:05:18.842274 IP 10.0.2.15.57352 > 13.224.208.10.443: Flags [.], ack 60480, win 56940, length 0
22:05:18.842319 IP 13.224.208.10.443 > 10.0.2.15.57352: Flags [P.], seq 60480:64602, ack 803, win 65535, length 4122
22:05:18.842328 IP 10.0.2.15.57352 > 13.224.208.10.443: Flags [.], ack 64602, win 54020, length 0
22:05:18.843221 IP 13.224.208.10.443 > 10.0.2.15.57352: Flags [P.], seq 64602:70098, ack 803, win 65535, length 5496
22:05:18.843236 IP 10.0.2.15.57352 > 13.224.208.10.443: Flags [.], ack 70098, win 61320, length 0
22:05:18.844725 IP 13.224.208.10.443 > 10.0.2.15.57352: Flags [P.], seq 70098:76968, ack 803, win 65535, length 6870
22:05:18.844745 IP 10.0.2.15.57352 > 13.224.208.10.443: Flags [.], ack 76968, win 65535, length 0
22:05:18.848211 IP 13.224.208.10.443 > 10.0.2.15.57352: Flags [P.], seq 76968:86586, ack 803, win 65535, length 9618
22:05:18.848236 IP 10.0.2.15.57352 > 13.224.208.10.443: Flags [.], ack 86586, win 65535, length 0
22:05:18.850181 IP 13.224.208.10.443 > 10.0.2.15.57352: Flags [P.], seq 86586:98952, ack 803, win 65535, length 12366
22:05:18.850236 IP 10.0.2.15.57352 > 13.224.208.10.443: Flags [.], ack 98952, win 65535, length 0
22:05:18.850370 IP 13.224.208.10.443 > 10.0.2.15.57352: Flags [P.], seq 98952:103074, ack 803, win 65535, length 4122
22:05:18.850372 IP 13.224.208.10.443 > 10.0.2.15.57352: Flags [P.], seq 103074:105822, ack 803, win 65535, length 2748
22:05:18.850373 IP 13.224.208.10.443 > 10.0.2.15.57352: Flags [P.], seq 105822:111318, ack 803, win 65535, length 5496
22:05:18.850384 IP 10.0.2.15.57352 > 13.224.208.10.443: Flags [.], ack 103074, win 65535, length 0
22:05:18.850399 IP 10.0.2.15.57352 > 13.224.208.10.443: Flags [.], ack 105822, win 65535, length 0
22:05:18.850417 IP 10.0.2.15.57352 > 13.224.208.10.443: Flags [.], ack 111318, win 65535, length 0
22:05:18.850590 IP 13.224.208.10.443 > 10.0.2.15.57352: Flags [P.], seq 111318:114066, ack 803, win 65535, length 2748
22:05:18.850597 IP 10.0.2.15.57352 > 13.224.208.10.443: Flags [.], ack 114066, win 65535, length 0
22:05:18.852258 IP 13.224.208.10.443 > 10.0.2.15.57352: Flags [P.], seq 114066:123684, ack 803, win 65535, length 9618
22:05:18.852260 IP 13.224.208.10.443 > 10.0.2.15.57352: Flags [P.], seq 123684:129180, ack 803, win 65535, length 5496
22:05:18.852279 IP 10.0.2.15.57352 > 13.224.208.10.443: Flags [.], ack 123684, win 65535, length 0
22:05:18.852309 IP 10.0.2.15.57352 > 13.224.208.10.443: Flags [.], ack 129180, win 65535, length 0
22:05:18.853984 IP 13.224.208.10.443 > 10.0.2.15.57352: Flags [P.], seq 129180:136050, ack 803, win 65535, length 6870
22:05:18.854002 IP 10.0.2.15.57352 > 13.224.208.10.443: Flags [.], ack 136050, win 65535, length 0
22:05:18.856332 IP 13.224.208.10.443 > 10.0.2.15.57352: Flags [P.], seq 136050:141546, ack 803, win 65535, length 5496
22:05:18.856353 IP 10.0.2.15.57352 > 13.224.208.10.443: Flags [.], ack 141546, win 65535, length 0
22:05:18.858894 IP 13.224.208.10.443 > 10.0.2.15.57352: Flags [P.], seq 141546:152538, ack 803, win 65535, length 10992
22:05:18.858911 IP 10.0.2.15.57352 > 13.224.208.10.443: Flags [.], ack 152538, win 65535, length 0
22:05:18.860109 IP 13.224.208.10.443 > 10.0.2.15.57352: Flags [P.], seq 152538:162156, ack 803, win 65535, length 9618
22:05:18.860128 IP 10.0.2.15.57352 > 13.224.208.10.443: Flags [.], ack 162156, win 65535, length 0
22:05:18.860928 IP 13.224.208.10.443 > 10.0.2.15.57352: Flags [P.], seq 162156:167652, ack 803, win 65535, length 5496
22:05:18.860929 IP 13.224.208.10.443 > 10.0.2.15.57352: Flags [P.], seq 167652:169026, ack 803, win 65535, length 1374
22:05:18.860944 IP 10.0.2.15.57352 > 13.224.208.10.443: Flags [.], ack 167652, win 65535, length 0
22:05:18.860968 IP 10.0.2.15.57352 > 13.224.208.10.443: Flags [.], ack 169026, win 65535, length 0
22:05:18.863252 IP 13.224.208.10.443 > 10.0.2.15.57352: Flags [P.], seq 169026:178644, ack 803, win 65535, length 9618
22:05:18.863254 IP 13.224.208.10.443 > 10.0.2.15.57352: Flags [P.], seq 178644:184140, ack 803, win 65535, length 5496
22:05:18.863276 IP 10.0.2.15.57352 > 13.224.208.10.443: Flags [.], ack 178644, win 65535, length 0
22:05:18.863311 IP 10.0.2.15.57352 > 13.224.208.10.443: Flags [.], ack 184140, win 65535, length 0
22:05:18.864290 IP 13.224.208.10.443 > 10.0.2.15.57352: Flags [P.], seq 184140:191010, ack 803, win 65535, length 6870
22:05:18.864357 IP 10.0.2.15.57352 > 13.224.208.10.443: Flags [.], ack 191010, win 65535, length 0
22:05:18.864680 IP 13.224.208.10.443 > 10.0.2.15.57352: Flags [P.], seq 191010:192384, ack 803, win 65535, length 1374
22:05:18.864693 IP 10.0.2.15.57352 > 13.224.208.10.443: Flags [.], ack 192384, win 65535, length 0
22:05:18.865721 IP 13.224.208.10.443 > 10.0.2.15.57352: Flags [.], seq 192384:198224, ack 803, win 65535, length 5840
22:05:18.865741 IP 10.0.2.15.57352 > 13.224.208.10.443: Flags [.], ack 198224, win 65535, length 0
22:05:18.866064 IP 13.224.208.10.443 > 10.0.2.15.57352: Flags [P.], seq 198224:199254, ack 803, win 65535, length 1030
22:05:18.866107 IP 13.224.208.10.443 > 10.0.2.15.57352: Flags [P.], seq 199254:206124, ack 803, win 65535, length 6870
22:05:18.866124 IP 10.0.2.15.57352 > 13.224.208.10.443: Flags [.], ack 199254, win 65535, length 0
22:05:18.866155 IP 10.0.2.15.57352 > 13.224.208.10.443: Flags [.], ack 206124, win 65535, length 0
22:05:18.867693 IP 13.224.208.10.443 > 10.0.2.15.57352: Flags [P.], seq 206124:217116, ack 803, win 65535, length 10992
22:05:18.867715 IP 10.0.2.15.57352 > 13.224.208.10.443: Flags [.], ack 217116, win 65535, length 0
22:05:18.867764 IP 13.224.208.10.443 > 10.0.2.15.57352: Flags [P.], seq 217116:221238, ack 803, win 65535, length 4122
22:05:18.867771 IP 10.0.2.15.57352 > 13.224.208.10.443: Flags [.], ack 221238, win 65535, length 0
22:05:18.868036 IP 13.224.208.10.443 > 10.0.2.15.57352: Flags [P.], seq 221238:225360, ack 803, win 65535, length 4122
22:05:18.868050 IP 10.0.2.15.57352 > 13.224.208.10.443: Flags [.], ack 225360, win 65535, length 0
22:05:18.869920 IP 13.224.208.10.443 > 10.0.2.15.57352: Flags [P.], seq 225360:234978, ack 803, win 65535, length 9618
22:05:18.869922 IP 13.224.208.10.443 > 10.0.2.15.57352: Flags [P.], seq 234978:240474, ack 803, win 65535, length 5496
22:05:18.869942 IP 10.0.2.15.57352 > 13.224.208.10.443: Flags [.], ack 234978, win 65535, length 0
22:05:18.869970 IP 10.0.2.15.57352 > 13.224.208.10.443: Flags [.], ack 240474, win 65535, length 0
22:05:18.869995 IP 13.224.208.10.443 > 10.0.2.15.57352: Flags [P.], seq 240474:241848, ack 803, win 65535, length 1374
22:05:18.870001 IP 10.0.2.15.57352 > 13.224.208.10.443: Flags [.], ack 241848, win 65535, length 0
22:05:18.871062 IP 13.224.208.10.443 > 10.0.2.15.57352: Flags [P.], seq 241848:251466, ack 803, win 65535, length 9618
22:05:18.871075 IP 10.0.2.15.57352 > 13.224.208.10.443: Flags [.], ack 251466, win 65535, length 0
22:05:18.872222 IP 13.224.208.10.443 > 10.0.2.15.57352: Flags [P.], seq 251466:261084, ack 803, win 65535, length 9618
22:05:18.872225 IP 13.224.208.10.443 > 10.0.2.15.57352: Flags [P.], seq 261084:265206, ack 803, win 65535, length 4122
22:05:18.872247 IP 10.0.2.15.57352 > 13.224.208.10.443: Flags [.], ack 261084, win 65535, length 0
22:05:18.872277 IP 10.0.2.15.57352 > 13.224.208.10.443: Flags [.], ack 265206, win 65535, length 0
22:05:18.872569 IP 13.224.208.10.443 > 10.0.2.15.57352: Flags [P.], seq 265206:267954, ack 803, win 65535, length 2748
22:05:18.872570 IP 13.224.208.10.443 > 10.0.2.15.57352: Flags [P.], seq 267954:270702, ack 803, win 65535, length 2748
22:05:18.872579 IP 10.0.2.15.57352 > 13.224.208.10.443: Flags [.], ack 267954, win 65535, length 0
22:05:18.872593 IP 10.0.2.15.57352 > 13.224.208.10.443: Flags [.], ack 270702, win 65535, length 0
22:05:18.874205 IP 13.224.208.10.443 > 10.0.2.15.57352: Flags [P.], seq 270702:277572, ack 803, win 65535, length 6870
22:05:18.874208 IP 13.224.208.10.443 > 10.0.2.15.57352: Flags [P.], seq 277572:280320, ack 803, win 65535, length 2748
22:05:18.874208 IP 13.224.208.10.443 > 10.0.2.15.57352: Flags [P.], seq 280320:281694, ack 803, win 65535, length 1374
22:05:18.874381 IP 10.0.2.15.57352 > 13.224.208.10.443: Flags [.], ack 277572, win 65535, length 0
22:05:18.874736 IP 10.0.2.15.57352 > 13.224.208.10.443: Flags [.], ack 280320, win 65535, length 0
22:05:18.874793 IP 10.0.2.15.57352 > 13.224.208.10.443: Flags [.], ack 281694, win 65535, length 0
22:05:18.874819 IP 13.224.208.10.443 > 10.0.2.15.57352: Flags [P.], seq 281694:284442, ack 803, win 65535, length 2748
22:05:18.874821 IP 13.224.208.10.443 > 10.0.2.15.57352: Flags [P.], seq 284442:289938, ack 803, win 65535, length 5496
22:05:18.874822 IP 13.224.208.10.443 > 10.0.2.15.57352: Flags [P.], seq 289938:292686, ack 803, win 65535, length 2748
22:05:18.874832 IP 10.0.2.15.57352 > 13.224.208.10.443: Flags [.], ack 284442, win 65535, length 0
22:05:18.874881 IP 10.0.2.15.57352 > 13.224.208.10.443: Flags [.], ack 289938, win 65535, length 0
22:05:18.874896 IP 10.0.2.15.57352 > 13.224.208.10.443: Flags [.], ack 292686, win 65535, length 0
22:05:18.874997 IP 13.224.208.10.443 > 10.0.2.15.57352: Flags [P.], seq 292686:295434, ack 803, win 65535, length 2748
22:05:18.875007 IP 10.0.2.15.57352 > 13.224.208.10.443: Flags [.], ack 295434, win 65535, length 0
22:05:18.875180 IP 13.224.208.10.443 > 10.0.2.15.57352: Flags [P.], seq 295434:298182, ack 803, win 65535, length 2748
22:05:18.875188 IP 10.0.2.15.57352 > 13.224.208.10.443: Flags [.], ack 298182, win 65535, length 0
22:05:18.875984 IP 13.224.208.10.443 > 10.0.2.15.57352: Flags [P.], seq 298182:305052, ack 803, win 65535, length 6870
22:05:18.875999 IP 10.0.2.15.57352 > 13.224.208.10.443: Flags [.], ack 305052, win 65535, length 0
22:05:18.876347 IP 13.224.208.10.443 > 10.0.2.15.57352: Flags [P.], seq 305052:309174, ack 803, win 65535, length 4122
22:05:18.876348 IP 13.224.208.10.443 > 10.0.2.15.57352: Flags [P.], seq 309174:311922, ack 803, win 65535, length 2748
22:05:18.876349 IP 13.224.208.10.443 > 10.0.2.15.57352: Flags [P.], seq 311922:313296, ack 803, win 65535, length 1374
22:05:18.876378 IP 10.0.2.15.57352 > 13.224.208.10.443: Flags [.], ack 313296, win 65535, length 0
22:05:18.876645 IP 13.224.208.10.443 > 10.0.2.15.57352: Flags [P.], seq 313296:317418, ack 803, win 65535, length 4122
22:05:18.876653 IP 10.0.2.15.57352 > 13.224.208.10.443: Flags [.], ack 317418, win 65535, length 0
22:05:18.876929 IP 13.224.208.10.443 > 10.0.2.15.57352: Flags [P.], seq 317418:321540, ack 803, win 65535, length 4122
22:05:18.876931 IP 13.224.208.10.443 > 10.0.2.15.57352: Flags [P.], seq 321540:324288, ack 803, win 65535, length 2748
22:05:18.876931 IP 13.224.208.10.443 > 10.0.2.15.57352: Flags [P.], seq 324288:325662, ack 803, win 65535, length 1374
22:05:18.876980 IP 10.0.2.15.57352 > 13.224.208.10.443: Flags [.], ack 321540, win 65535, length 0
22:05:18.877131 IP 10.0.2.15.57352 > 13.224.208.10.443: Flags [.], ack 324288, win 65535, length 0
22:05:18.877149 IP 10.0.2.15.57352 > 13.224.208.10.443: Flags [.], ack 325662, win 65535, length 0
22:05:18.877399 IP 13.224.208.10.443 > 10.0.2.15.57352: Flags [P.], seq 325662:328410, ack 803, win 65535, length 2748
22:05:18.877406 IP 10.0.2.15.57352 > 13.224.208.10.443: Flags [.], ack 328410, win 65535, length 0
22:05:18.877948 IP 13.224.208.10.443 > 10.0.2.15.57352: Flags [P.], seq 328410:332532, ack 803, win 65535, length 4122
22:05:18.877949 IP 13.224.208.10.443 > 10.0.2.15.57352: Flags [P.], seq 332532:333906, ack 803, win 65535, length 1374
22:05:18.877962 IP 10.0.2.15.57352 > 13.224.208.10.443: Flags [.], ack 332532, win 65535, length 0
22:05:18.878007 IP 10.0.2.15.57352 > 13.224.208.10.443: Flags [.], ack 333906, win 65535, length 0
22:05:18.878923 IP 13.224.208.10.443 > 10.0.2.15.57352: Flags [P.], seq 333906:343524, ack 803, win 65535, length 9618
22:05:18.878925 IP 13.224.208.10.443 > 10.0.2.15.57352: Flags [P.], seq 343524:344898, ack 803, win 65535, length 1374
22:05:18.878974 IP 10.0.2.15.57352 > 13.224.208.10.443: Flags [.], ack 343524, win 65535, length 0
22:05:18.879008 IP 10.0.2.15.57352 > 13.224.208.10.443: Flags [.], ack 344898, win 65535, length 0
22:05:18.879098 IP 13.224.208.10.443 > 10.0.2.15.57352: Flags [P.], seq 344898:346272, ack 803, win 65535, length 1374
22:05:18.879110 IP 10.0.2.15.57352 > 13.224.208.10.443: Flags [.], ack 346272, win 65535, length 0
22:05:18.879412 IP 13.224.208.10.443 > 10.0.2.15.57352: Flags [P.], seq 346272:351768, ack 803, win 65535, length 5496
22:05:18.879414 IP 13.224.208.10.443 > 10.0.2.15.57352: Flags [P.], seq 351768:354516, ack 803, win 65535, length 2748
22:05:18.879414 IP 13.224.208.10.443 > 10.0.2.15.57352: Flags [P.], seq 354516:355890, ack 803, win 65535, length 1374
22:05:18.879427 IP 10.0.2.15.57352 > 13.224.208.10.443: Flags [.], ack 351768, win 65535, length 0
22:05:18.879451 IP 10.0.2.15.57352 > 13.224.208.10.443: Flags [.], ack 354516, win 65535, length 0
22:05:18.879464 IP 10.0.2.15.57352 > 13.224.208.10.443: Flags [.], ack 355890, win 65535, length 0
22:05:18.879977 IP 13.224.208.10.443 > 10.0.2.15.57352: Flags [P.], seq 355890:358638, ack 803, win 65535, length 2748
22:05:18.879979 IP 13.224.208.10.443 > 10.0.2.15.57352: Flags [P.], seq 358638:364134, ack 803, win 65535, length 5496
22:05:18.879980 IP 13.224.208.10.443 > 10.0.2.15.57352: Flags [.], seq 364134:365594, ack 803, win 65535, length 1460
22:05:18.879996 IP 10.0.2.15.57352 > 13.224.208.10.443: Flags [.], ack 358638, win 65535, length 0
22:05:18.880016 IP 10.0.2.15.57352 > 13.224.208.10.443: Flags [.], ack 364134, win 65535, length 0
22:05:18.880029 IP 10.0.2.15.57352 > 13.224.208.10.443: Flags [.], ack 365594, win 65535, length 0
22:05:18.880109 IP 13.224.208.10.443 > 10.0.2.15.57352: Flags [P.], seq 365594:366882, ack 803, win 65535, length 1288
22:05:18.880116 IP 10.0.2.15.57352 > 13.224.208.10.443: Flags [.], ack 366882, win 65535, length 0
22:05:18.880641 IP 13.224.208.10.443 > 10.0.2.15.57352: Flags [P.], seq 366882:369630, ack 803, win 65535, length 2748
22:05:18.880643 IP 13.224.208.10.443 > 10.0.2.15.57352: Flags [P.], seq 369630:373752, ack 803, win 65535, length 4122
22:05:18.880644 IP 13.224.208.10.443 > 10.0.2.15.57352: Flags [P.], seq 373752:375126, ack 803, win 65535, length 1374
22:05:18.880661 IP 10.0.2.15.57352 > 13.224.208.10.443: Flags [.], ack 369630, win 65535, length 0
22:05:18.880681 IP 10.0.2.15.57352 > 13.224.208.10.443: Flags [.], ack 373752, win 65535, length 0
22:05:18.880692 IP 10.0.2.15.57352 > 13.224.208.10.443: Flags [.], ack 375126, win 65535, length 0
22:05:18.881158 IP 13.224.208.10.443 > 10.0.2.15.57352: Flags [.], seq 375126:376586, ack 803, win 65535, length 1460
22:05:18.881174 IP 10.0.2.15.57352 > 13.224.208.10.443: Flags [.], ack 376586, win 65535, length 0
22:05:18.881514 IP 13.224.208.10.443 > 10.0.2.15.57352: Flags [P.], seq 376586:381996, ack 803, win 65535, length 5410
22:05:18.881587 IP 10.0.2.15.57352 > 13.224.208.10.443: Flags [.], ack 381996, win 65535, length 0
22:05:18.882390 IP 13.224.208.10.443 > 10.0.2.15.57352: Flags [P.], seq 381996:387492, ack 803, win 65535, length 5496
22:05:18.882393 IP 13.224.208.10.443 > 10.0.2.15.57352: Flags [P.], seq 387492:392988, ack 803, win 65535, length 5496
22:05:18.882410 IP 10.0.2.15.57352 > 13.224.208.10.443: Flags [.], ack 387492, win 65535, length 0
22:05:18.882749 IP 10.0.2.15.57352 > 13.224.208.10.443: Flags [.], ack 392988, win 65535, length 0
22:05:18.882877 IP 13.224.208.10.443 > 10.0.2.15.57352: Flags [P.], seq 392988:395736, ack 803, win 65535, length 2748
22:05:18.882878 IP 13.224.208.10.443 > 10.0.2.15.57352: Flags [P.], seq 395736:401232, ack 803, win 65535, length 5496
22:05:18.882880 IP 13.224.208.10.443 > 10.0.2.15.57352: Flags [P.], seq 401232:406728, ack 803, win 65535, length 5496
22:05:18.882891 IP 10.0.2.15.57352 > 13.224.208.10.443: Flags [.], ack 395736, win 65535, length 0
22:05:18.882910 IP 10.0.2.15.57352 > 13.224.208.10.443: Flags [.], ack 401232, win 65535, length 0
22:05:18.883075 IP 10.0.2.15.57352 > 13.224.208.10.443: Flags [.], ack 406728, win 65535, length 0
22:05:18.883097 IP 13.224.208.10.443 > 10.0.2.15.57352: Flags [P.], seq 406728:410850, ack 803, win 65535, length 4122
22:05:18.883103 IP 10.0.2.15.57352 > 13.224.208.10.443: Flags [.], ack 410850, win 65535, length 0
22:05:18.883261 IP 13.224.208.10.443 > 10.0.2.15.57352: Flags [P.], seq 410850:417720, ack 803, win 65535, length 6870
22:05:18.883269 IP 10.0.2.15.57352 > 13.224.208.10.443: Flags [.], ack 417720, win 65535, length 0
22:05:18.883461 IP 13.224.208.10.443 > 10.0.2.15.57352: Flags [P.], seq 417720:420468, ack 803, win 65535, length 2748
22:05:18.883468 IP 10.0.2.15.57352 > 13.224.208.10.443: Flags [.], ack 420468, win 65535, length 0
22:05:18.883699 IP 13.224.208.10.443 > 10.0.2.15.57352: Flags [P.], seq 420468:423216, ack 803, win 65535, length 2748
22:05:18.883706 IP 10.0.2.15.57352 > 13.224.208.10.443: Flags [.], ack 423216, win 65535, length 0
22:05:18.884561 IP 13.224.208.10.443 > 10.0.2.15.57352: Flags [P.], seq 423216:430086, ack 803, win 65535, length 6870
22:05:18.884574 IP 10.0.2.15.57352 > 13.224.208.10.443: Flags [.], ack 430086, win 65535, length 0
22:05:18.884713 IP 13.224.208.10.443 > 10.0.2.15.57352: Flags [.], seq 430086:433006, ack 803, win 65535, length 2920
22:05:18.884722 IP 10.0.2.15.57352 > 13.224.208.10.443: Flags [.], ack 433006, win 65535, length 0
22:05:18.884863 IP 13.224.208.10.443 > 10.0.2.15.57352: Flags [P.], seq 433006:436956, ack 803, win 65535, length 3950
22:05:18.884872 IP 10.0.2.15.57352 > 13.224.208.10.443: Flags [.], ack 436956, win 65535, length 0
22:05:18.885165 IP 13.224.208.10.443 > 10.0.2.15.57352: Flags [P.], seq 436956:442452, ack 803, win 65535, length 5496
22:05:18.885191 IP 10.0.2.15.57352 > 13.224.208.10.443: Flags [.], ack 442452, win 65535, length 0
22:05:18.885331 IP 13.224.208.10.443 > 10.0.2.15.57352: Flags [P.], seq 442452:443826, ack 803, win 65535, length 1374
22:05:18.885340 IP 10.0.2.15.57352 > 13.224.208.10.443: Flags [.], ack 443826, win 65535, length 0
22:05:18.885583 IP 13.224.208.10.443 > 10.0.2.15.57352: Flags [P.], seq 443826:449322, ack 803, win 65535, length 5496
22:05:18.885585 IP 13.224.208.10.443 > 10.0.2.15.57352: Flags [P.], seq 449322:452070, ack 803, win 65535, length 2748
22:05:18.885596 IP 10.0.2.15.57352 > 13.224.208.10.443: Flags [.], ack 449322, win 65535, length 0
22:05:18.885609 IP 10.0.2.15.57352 > 13.224.208.10.443: Flags [.], ack 452070, win 65535, length 0
22:05:18.886159 IP 13.224.208.10.443 > 10.0.2.15.57352: Flags [P.], seq 452070:458940, ack 803, win 65535, length 6870
22:05:18.886173 IP 10.0.2.15.57352 > 13.224.208.10.443: Flags [.], ack 458940, win 65535, length 0
22:05:18.886314 IP 13.224.208.10.443 > 10.0.2.15.57352: Flags [P.], seq 458940:461688, ack 803, win 65535, length 2748
22:05:18.886322 IP 10.0.2.15.57352 > 13.224.208.10.443: Flags [.], ack 461688, win 65535, length 0
22:05:18.886531 IP 13.224.208.10.443 > 10.0.2.15.57352: Flags [P.], seq 461688:464436, ack 803, win 65535, length 2748
22:05:18.886533 IP 13.224.208.10.443 > 10.0.2.15.57352: Flags [P.], seq 464436:467184, ack 803, win 65535, length 2748
22:05:18.886577 IP 10.0.2.15.57352 > 13.224.208.10.443: Flags [.], ack 464436, win 65535, length 0
22:05:18.886594 IP 10.0.2.15.57352 > 13.224.208.10.443: Flags [.], ack 467184, win 65535, length 0
22:05:18.886748 IP 13.224.208.10.443 > 10.0.2.15.57352: Flags [P.], seq 467184:468558, ack 803, win 65535, length 1374
22:05:18.886759 IP 10.0.2.15.57352 > 13.224.208.10.443: Flags [.], ack 468558, win 65535, length 0
22:05:18.886945 IP 13.224.208.10.443 > 10.0.2.15.57352: Flags [P.], seq 468558:474054, ack 803, win 65535, length 5496
22:05:18.886953 IP 10.0.2.15.57352 > 13.224.208.10.443: Flags [.], ack 474054, win 65535, length 0
22:05:18.887099 IP 13.224.208.10.443 > 10.0.2.15.57352: Flags [P.], seq 474054:479550, ack 803, win 65535, length 5496
22:05:18.887107 IP 10.0.2.15.57352 > 13.224.208.10.443: Flags [.], ack 479550, win 65535, length 0
22:05:18.887364 IP 13.224.208.10.443 > 10.0.2.15.57352: Flags [P.], seq 479550:483672, ack 803, win 65535, length 4122
22:05:18.887453 IP 10.0.2.15.57352 > 13.224.208.10.443: Flags [.], ack 483672, win 65535, length 0
22:05:18.887741 IP 13.224.208.10.443 > 10.0.2.15.57352: Flags [P.], seq 483672:486420, ack 803, win 65535, length 2748
22:05:18.887752 IP 10.0.2.15.57352 > 13.224.208.10.443: Flags [.], ack 486420, win 65535, length 0
22:05:18.888387 IP 13.224.208.10.443 > 10.0.2.15.57352: Flags [P.], seq 486420:493290, ack 803, win 65535, length 6870
22:05:18.888434 IP 10.0.2.15.57352 > 13.224.208.10.443: Flags [.], ack 493290, win 65535, length 0

