22:06:07.045768 IP 10.0.2.15.48709 > 140.233.253.2.53: 6407+ A? www.imdb.com. (30)
22:06:07.045814 IP 10.0.2.15.48709 > 140.233.253.2.53: 34816+ AAAA? www.imdb.com. (30)
22:06:07.070695 IP 140.233.253.2.53 > 10.0.2.15.48709: 34816 2/1/0 CNAME tp.391b988c0-frontier.imdb.com., CNAME d2bytcopxu066p.cloudfront.net. (191)
22:06:07.070886 IP 140.233.253.2.53 > 10.0.2.15.48709: 6407 3/0/0 CNAME tp.391b988c0-frontier.imdb.com., CNAME d2bytcopxu066p.cloudfront.net., A 13.224.208.10 (125)
22:06:07.071123 IP 10.0.2.15.57368 > 13.224.208.10.443: Flags [S], seq 240429, win 64240, options [mss 1460,sackOK,TS val 3642785661 ecr 0,nop,wscale 6], length 0
22:06:07.088354 IP 13.224.208.10.443 > 10.0.2.15.57368: Flags [S.], seq 299264001, ack 240430, win 65535, options [mss 1460], length 0
22:06:07.088392 IP 10.0.2.15.57368 > 13.224.208.10.443: Flags [.], ack 1, win 64240, length 0
22:06:07.098730 IP 10.0.2.15.57368 > 13.224.208.10.443: Flags [P.], seq 1:518, ack 1, win 64240, length 517
22:06:07.099062 IP 13.224.208.10.443 > 10.0.2.15.57368: Flags [.], ack 518, win 65535, length 0
22:06:07.123007 IP 13.224.208.10.443 > 10.0.2.15.57368: Flags [.], seq 1:2921, ack 518, win 65535, length 2920
22:06:07.123114 IP 10.0.2.15.57368 > 13.224.208.10.443: Flags [.], ack 2921, win 62780, length 0
22:06:07.123348 IP 13.224.208.10.443 > 10.0.2.15.57368: Flags [P.], seq 2921:5509, ack 518, win 65535, length 2588
22:06:07.123362 IP 10.0.2.15.57368 > 13.224.208.10.443: Flags [.], ack 5509, win 61320, length 0
22:06:07.124283 IP 10.0.2.15.57368 > 13.224.208.10.443: Flags [P.], seq 518:582, ack 5509, win 62780, length 64
22:06:07.124580 IP 13.224.208.10.443 > 10.0.2.15.57368: Flags [.], ack 582, win 65535, length 0
22:06:07.124729 IP 10.0.2.15.57368 > 13.224.208.10.443: Flags [P.], seq 582:628, ack 5509, win 62780, length 46
22:06:07.124758 IP 10.0.2.15.57368 > 13.224.208.10.443: Flags [P.], seq 628:677, ack 5509, win 62780, length 49
22:06:07.125001 IP 10.0.2.15.57368 > 13.224.208.10.443: Flags [P.], seq 677:712, ack 5509, win 62780, length 35
22:06:07.125091 IP 13.224.208.10.443 > 10.0.2.15.57368: Flags [.], ack 628, win 65535, length 0
22:06:07.125092 IP 13.224.208.10.443 > 10.0.2.15.57368: Flags [.], ack 677, win 65535, length 0
22:06:07.125337 IP 13.224.208.10.443 > 10.0.2.15.57368: Flags [.], ack 712, win 65535, length 0
22:06:07.125437 IP 10.0.2.15.57368 > 13.224.208.10.443: Flags [P.], seq 712:772, ack 5509, win 62780, length 60
22:06:07.125772 IP 13.224.208.10.443 > 10.0.2.15.57368: Flags [.], ack 772, win 65535, length 0
22:06:07.141146 IP 13.224.208.10.443 > 10.0.2.15.57368: Flags [P.], seq 5509:5580, ack 772, win 65535, length 71
22:06:07.141167 IP 10.0.2.15.57368 > 13.224.208.10.443: Flags [.], ack 5580, win 62780, length 0
22:06:07.141395 IP 10.0.2.15.57368 > 13.224.208.10.443: Flags [P.], seq 772:803, ack 5580, win 62780, length 31
22:06:07.142408 IP 13.224.208.10.443 > 10.0.2.15.57368: Flags [.], ack 803, win 65535, length 0
22:06:07.894481 IP 13.224.208.10.443 > 10.0.2.15.57368: Flags [.], seq 5580:12880, ack 803, win 65535, length 7300
22:06:07.894510 IP 10.0.2.15.57368 > 13.224.208.10.443: Flags [.], ack 12880, win 59860, length 0
22:06:07.895090 IP 13.224.208.10.443 > 10.0.2.15.57368: Flags [.], seq 12880:21640, ack 803, win 65535, length 8760
22:06:07.895176 IP 10.0.2.15.57368 > 13.224.208.10.443: Flags [.], ack 21640, win 54020, length 0
22:06:07.895499 IP 13.224.208.10.443 > 10.0.2.15.57368: Flags [.], seq 21640:31860, ack 803, win 65535, length 10220
22:06:07.895530 IP 10.0.2.15.57368 > 13.224.208.10.443: Flags [.], ack 31860, win 46720, length 0
22:06:07.895696 IP 13.224.208.10.443 > 10.0.2.15.57368: Flags [.], seq 31860:43540, ack 803, win 65535, length 11680
22:06:07.895706 IP 10.0.2.15.57368 > 13.224.208.10.443: Flags [.], ack 43540, win 39420, length 0
22:06:07.896093 IP 13.224.208.10.443 > 10.0.2.15.57368: Flags [P.], seq 43540:47854, ack 803, win 65535, length 4314
22:06:07.896209 IP 10.0.2.15.57368 > 13.224.208.10.443: Flags [.], ack 47854, win 36500, length 0
22:06:07.910751 IP 13.224.208.10.443 > 10.0.2.15.57368: Flags [P.], seq 47854:58846, ack 803, win 65535, length 10992
22:06:07.910777 IP 10.0.2.15.57368 > 13.224.208.10.443: Flags [.], ack 58846, win 56940, length 0
22:06:07.911729 IP 13.224.208.10.443 > 10.0.2.15.57368: Flags [P.], seq 58846:67090, ack 803, win 65535, length 8244
22:06:07.911731 IP 13.224.208.10.443 > 10.0.2.15.57368: Flags [P.], seq 67090:68464, ack 803, win 65535, length 1374
22:06:07.911750 IP 10.0.2.15.57368 > 13.224.208.10.443: Flags [.], ack 67090, win 51100, length 0
22:06:07.911786 IP 10.0.2.15.57368 > 13.224.208.10.443: Flags [.], ack 68464, win 49726, length 0
22:06:07.912519 IP 13.224.208.10.443 > 10.0.2.15.57368: Flags [P.], seq 68464:73960, ack 803, win 65535, length 5496
22:06:07.912538 IP 10.0.2.15.57368 > 13.224.208.10.443: Flags [.], ack 73960, win 65535, length 0
22:06:07.913935 IP 13.224.208.10.443 > 10.0.2.15.57368: Flags [P.], seq 73960:76708, ack 803, win 65535, length 2748
22:06:07.913959 IP 10.0.2.15.57368 > 13.224.208.10.443: Flags [.], ack 76708, win 65535, length 0
22:06:07.914947 IP 13.224.208.10.443 > 10.0.2.15.57368: Flags [P.], seq 76708:84952, ack 803, win 65535, length 8244
22:06:07.914972 IP 10.0.2.15.57368 > 13.224.208.10.443: Flags [.], ack 84952, win 65535, length 0
22:06:07.915900 IP 13.224.208.10.443 > 10.0.2.15.57368: Flags [P.], seq 84952:89074, ack 803, win 65535, length 4122
22:06:07.915917 IP 10.0.2.15.57368 > 13.224.208.10.443: Flags [.], ack 89074, win 65535, length 0
22:06:07.917065 IP 13.224.208.10.443 > 10.0.2.15.57368: Flags [P.], seq 89074:90448, ack 803, win 65535, length 1374
22:06:07.917085 IP 10.0.2.15.57368 > 13.224.208.10.443: Flags [.], ack 90448, win 65535, length 0
22:06:07.926222 IP 13.224.208.10.443 > 10.0.2.15.57368: Flags [P.], seq 90448:97318, ack 803, win 65535, length 6870
22:06:07.926258 IP 10.0.2.15.57368 > 13.224.208.10.443: Flags [.], ack 97318, win 65535, length 0
22:06:07.927181 IP 13.224.208.10.443 > 10.0.2.15.57368: Flags [P.], seq 97318:104188, ack 803, win 65535, length 6870
22:06:07.927208 IP 10.0.2.15.57368 > 13.224.208.10.443: Flags [.], ack 104188, win 65535, length 0
22:06:07.928264 IP 13.224.208.10.443 > 10.0.2.15.57368: Flags [P.], seq 104188:109684, ack 803, win 65535, length 5496
22:06:07.928409 IP 10.0.2.15.57368 > 13.224.208.10.443: Flags [.], ack 109684, win 65535, length 0
22:06:07.928717 IP 13.224.208.10.443 > 10.0.2.15.57368: Flags [P.], seq 109684:112432, ack 803, win 65535, length 2748
22:06:07.928730 IP 10.0.2.15.57368 > 13.224.208.10.443: Flags [.], ack 112432, win 65535, length 0
22:06:07.929811 IP 13.224.208.10.443 > 10.0.2.15.57368: Flags [P.], seq 112432:120676, ack 803, win 65535, length 8244
22:06:07.929814 IP 13.224.208.10.443 > 10.0.2.15.57368: Flags [P.], seq 120676:124798, ack 803, win 65535, length 4122
22:06:07.929836 IP 10.0.2.15.57368 > 13.224.208.10.443: Flags [.], ack 120676, win 65535, length 0
22:06:07.929879 IP 10.0.2.15.57368 > 13.224.208.10.443: Flags [.], ack 124798, win 65535, length 0
22:06:07.931147 IP 13.224.208.10.443 > 10.0.2.15.57368: Flags [P.], seq 124798:126172, ack 803, win 65535, length 1374
22:06:07.931169 IP 10.0.2.15.57368 > 13.224.208.10.443: Flags [.], ack 126172, win 65535, length 0
22:06:07.931737 IP 13.224.208.10.443 > 10.0.2.15.57368: Flags [P.], seq 126172:133042, ack 803, win 65535, length 6870
22:06:07.931756 IP 10.0.2.15.57368 > 13.224.208.10.443: Flags [.], ack 133042, win 65535, length 0
22:06:07.940161 IP 13.224.208.10.443 > 10.0.2.15.57368: Flags [P.], seq 133042:141286, ack 803, win 65535, length 8244
22:06:07.940166 IP 13.224.208.10.443 > 10.0.2.15.57368: Flags [P.], seq 141286:145408, ack 803, win 65535, length 4122
22:06:07.940201 IP 10.0.2.15.57368 > 13.224.208.10.443: Flags [.], ack 141286, win 65535, length 0
22:06:07.940329 IP 10.0.2.15.57368 > 13.224.208.10.443: Flags [.], ack 145408, win 65535, length 0
22:06:07.941048 IP 13.224.208.10.443 > 10.0.2.15.57368: Flags [.], seq 145408:151248, ack 803, win 65535, length 5840
22:06:07.941077 IP 10.0.2.15.57368 > 13.224.208.10.443: Flags [.], ack 151248, win 65535, length 0
22:06:07.942162 IP 13.224.208.10.443 > 10.0.2.15.57368: Flags [P.], seq 151248:157774, ack 803, win 65535, length 6526
22:06:07.942165 IP 13.224.208.10.443 > 10.0.2.15.57368: Flags [P.], seq 157774:164644, ack 803, win 65535, length 6870
22:06:07.942184 IP 10.0.2.15.57368 > 13.224.208.10.443: Flags [.], ack 157774, win 65535, length 0
22:06:07.942222 IP 10.0.2.15.57368 > 13.224.208.10.443: Flags [.], ack 164644, win 65535, length 0
22:06:07.943208 IP 13.224.208.10.443 > 10.0.2.15.57368: Flags [P.], seq 164644:166018, ack 803, win 65535, length 1374
22:06:07.943225 IP 10.0.2.15.57368 > 13.224.208.10.443: Flags [.], ack 166018, win 65535, length 0
22:06:07.944485 IP 13.224.208.10.443 > 10.0.2.15.57368: Flags [P.], seq 166018:174262, ack 803, win 65535, length 8244
22:06:07.944512 IP 10.0.2.15.57368 > 13.224.208.10.443: Flags [.], ack 174262, win 65535, length 0
22:06:07.945906 IP 13.224.208.10.443 > 10.0.2.15.57368: Flags [P.], seq 174262:185254, ack 803, win 65535, length 10992
22:06:07.945932 IP 10.0.2.15.57368 > 13.224.208.10.443: Flags [.], ack 185254, win 65535, length 0
22:06:07.946192 IP 13.224.208.10.443 > 10.0.2.15.57368: Flags [P.], seq 185254:188002, ack 803, win 65535, length 2748
22:06:07.946208 IP 10.0.2.15.57368 > 13.224.208.10.443: Flags [.], ack 188002, win 65535, length 0
22:06:07.947752 IP 13.224.208.10.443 > 10.0.2.15.57368: Flags [P.], seq 188002:196246, ack 803, win 65535, length 8244
22:06:07.947755 IP 13.224.208.10.443 > 10.0.2.15.57368: Flags [P.], seq 196246:198994, ack 803, win 65535, length 2748
22:06:07.947780 IP 10.0.2.15.57368 > 13.224.208.10.443: Flags [.], ack 196246, win 65535, length 0
22:06:07.947820 IP 10.0.2.15.57368 > 13.224.208.10.443: Flags [.], ack 198994, win 65535, length 0
22:06:07.947845 IP 13.224.208.10.443 > 10.0.2.15.57368: Flags [P.], seq 198994:201742, ack 803, win 65535, length 2748
22:06:07.947850 IP 10.0.2.15.57368 > 13.224.208.10.443: Flags [.], ack 201742, win 65535, length 0
22:06:07.948904 IP 13.224.208.10.443 > 10.0.2.15.57368: Flags [P.], seq 201742:208612, ack 803, win 65535, length 6870
22:06:07.948928 IP 10.0.2.15.57368 > 13.224.208.10.443: Flags [.], ack 208612, win 65535, length 0
22:06:07.949837 IP 13.224.208.10.443 > 10.0.2.15.57368: Flags [P.], seq 208612:216856, ack 803, win 65535, length 8244
22:06:07.949855 IP 10.0.2.15.57368 > 13.224.208.10.443: Flags [.], ack 216856, win 65535, length 0
22:06:07.952193 IP 13.224.208.10.443 > 10.0.2.15.57368: Flags [P.], seq 216856:218230, ack 803, win 65535, length 1374
22:06:07.952218 IP 10.0.2.15.57368 > 13.224.208.10.443: Flags [.], ack 218230, win 65535, length 0
22:06:07.954175 IP 13.224.208.10.443 > 10.0.2.15.57368: Flags [P.], seq 218230:223726, ack 803, win 65535, length 5496
22:06:07.954195 IP 10.0.2.15.57368 > 13.224.208.10.443: Flags [.], ack 223726, win 65535, length 0
22:06:07.956574 IP 13.224.208.10.443 > 10.0.2.15.57368: Flags [P.], seq 223726:244336, ack 803, win 65535, length 20610
22:06:07.956595 IP 10.0.2.15.57368 > 13.224.208.10.443: Flags [.], ack 244336, win 65535, length 0
22:06:07.956638 IP 13.224.208.10.443 > 10.0.2.15.57368: Flags [P.], seq 244336:247084, ack 803, win 65535, length 2748
22:06:07.956642 IP 10.0.2.15.57368 > 13.224.208.10.443: Flags [.], ack 247084, win 65535, length 0
22:06:07.957242 IP 13.224.208.10.443 > 10.0.2.15.57368: Flags [P.], seq 247084:253954, ack 803, win 65535, length 6870
22:06:07.957255 IP 13.224.208.10.443 > 10.0.2.15.57368: Flags [P.], seq 253954:256702, ack 803, win 65535, length 2748
22:06:07.957276 IP 10.0.2.15.57368 > 13.224.208.10.443: Flags [.], ack 253954, win 65535, length 0
22:06:07.957309 IP 10.0.2.15.57368 > 13.224.208.10.443: Flags [.], ack 256702, win 65535, length 0
22:06:07.958390 IP 13.224.208.10.443 > 10.0.2.15.57368: Flags [P.], seq 256702:263572, ack 803, win 65535, length 6870
22:06:07.958425 IP 10.0.2.15.57368 > 13.224.208.10.443: Flags [.], ack 263572, win 65535, length 0
22:06:07.958613 IP 13.224.208.10.443 > 10.0.2.15.57368: Flags [P.], seq 263572:264946, ack 803, win 65535, length 1374
22:06:07.958620 IP 10.0.2.15.57368 > 13.224.208.10.443: Flags [.], ack 264946, win 65535, length 0
22:06:07.959677 IP 13.224.208.10.443 > 10.0.2.15.57368: Flags [P.], seq 264946:273190, ack 803, win 65535, length 8244
22:06:07.959679 IP 13.224.208.10.443 > 10.0.2.15.57368: Flags [P.], seq 273190:277312, ack 803, win 65535, length 4122
22:06:07.959706 IP 10.0.2.15.57368 > 13.224.208.10.443: Flags [.], ack 273190, win 65535, length 0
22:06:07.959731 IP 10.0.2.15.57368 > 13.224.208.10.443: Flags [.], ack 277312, win 65535, length 0
22:06:07.959749 IP 13.224.208.10.443 > 10.0.2.15.57368: Flags [P.], seq 277312:280060, ack 803, win 65535, length 2748
22:06:07.959755 IP 10.0.2.15.57368 > 13.224.208.10.443: Flags [.], ack 280060, win 65535, length 0
22:06:07.959967 IP 13.224.208.10.443 > 10.0.2.15.57368: Flags [P.], seq 280060:281434, ack 803, win 65535, length 1374
22:06:07.959969 IP 13.224.208.10.443 > 10.0.2.15.57368: Flags [P.], seq 281434:284182, ack 803, win 65535, length 2748
22:06:07.959988 IP 10.0.2.15.57368 > 13.224.208.10.443: Flags [.], ack 281434, win 65535, length 0
22:06:07.960013 IP 10.0.2.15.57368 > 13.224.208.10.443: Flags [.], ack 284182, win 65535, length 0
22:06:07.962021 IP 13.224.208.10.443 > 10.0.2.15.57368: Flags [P.], seq 284182:293800, ack 803, win 65535, length 9618
22:06:07.962024 IP 13.224.208.10.443 > 10.0.2.15.57368: Flags [P.], seq 293800:300670, ack 803, win 65535, length 6870
22:06:07.962048 IP 10.0.2.15.57368 > 13.224.208.10.443: Flags [.], ack 293800, win 65535, length 0
22:06:07.962076 IP 10.0.2.15.57368 > 13.224.208.10.443: Flags [.], ack 300670, win 65535, length 0
22:06:07.962091 IP 13.224.208.10.443 > 10.0.2.15.57368: Flags [P.], seq 300670:302044, ack 803, win 65535, length 1374
22:06:07.962092 IP 13.224.208.10.443 > 10.0.2.15.57368: Flags [P.], seq 302044:303418, ack 803, win 65535, length 1374
22:06:07.962095 IP 10.0.2.15.57368 > 13.224.208.10.443: Flags [.], ack 302044, win 65535, length 0
22:06:07.962102 IP 10.0.2.15.57368 > 13.224.208.10.443: Flags [.], ack 303418, win 65535, length 0
22:06:07.963676 IP 13.224.208.10.443 > 10.0.2.15.57368: Flags [P.], seq 303418:311662, ack 803, win 65535, length 8244
22:06:07.963679 IP 13.224.208.10.443 > 10.0.2.15.57368: Flags [P.], seq 311662:314410, ack 803, win 65535, length 2748
22:06:07.963700 IP 10.0.2.15.57368 > 13.224.208.10.443: Flags [.], ack 311662, win 65535, length 0
22:06:07.963751 IP 10.0.2.15.57368 > 13.224.208.10.443: Flags [.], ack 314410, win 65535, length 0
22:06:07.963787 IP 13.224.208.10.443 > 10.0.2.15.57368: Flags [P.], seq 314410:319906, ack 803, win 65535, length 5496
22:06:07.963795 IP 10.0.2.15.57368 > 13.224.208.10.443: Flags [.], ack 319906, win 65535, length 0
22:06:07.964273 IP 13.224.208.10.443 > 10.0.2.15.57368: Flags [P.], seq 319906:325402, ack 803, win 65535, length 5496
22:06:07.964402 IP 10.0.2.15.57368 > 13.224.208.10.443: Flags [.], ack 325402, win 65535, length 0
22:06:07.964574 IP 13.224.208.10.443 > 10.0.2.15.57368: Flags [P.], seq 325402:329524, ack 803, win 65535, length 4122
22:06:07.964583 IP 10.0.2.15.57368 > 13.224.208.10.443: Flags [.], ack 329524, win 65535, length 0
22:06:07.965774 IP 13.224.208.10.443 > 10.0.2.15.57368: Flags [P.], seq 329524:337768, ack 803, win 65535, length 8244
22:06:07.965776 IP 13.224.208.10.443 > 10.0.2.15.57368: Flags [.], seq 337768:339228, ack 803, win 65535, length 1460
22:06:07.965794 IP 10.0.2.15.57368 > 13.224.208.10.443: Flags [.], ack 337768, win 65535, length 0
22:06:07.965845 IP 10.0.2.15.57368 > 13.224.208.10.443: Flags [.], ack 339228, win 65535, length 0
22:06:07.966266 IP 13.224.208.10.443 > 10.0.2.15.57368: Flags [P.], seq 339228:340516, ack 803, win 65535, length 1288
22:06:07.966268 IP 13.224.208.10.443 > 10.0.2.15.57368: Flags [P.], seq 340516:341890, ack 803, win 65535, length 1374
22:06:07.966269 IP 13.224.208.10.443 > 10.0.2.15.57368: Flags [P.], seq 341890:344638, ack 803, win 65535, length 2748
22:06:07.966270 IP 13.224.208.10.443 > 10.0.2.15.57368: Flags [P.], seq 344638:348760, ack 803, win 65535, length 4122
22:06:07.966284 IP 10.0.2.15.57368 > 13.224.208.10.443: Flags [.], ack 340516, win 65535, length 0
22:06:07.966299 IP 10.0.2.15.57368 > 13.224.208.10.443: Flags [.], ack 341890, win 65535, length 0
22:06:07.966305 IP 10.0.2.15.57368 > 13.224.208.10.443: Flags [.], ack 344638, win 65535, length 0
22:06:07.966312 IP 10.0.2.15.57368 > 13.224.208.10.443: Flags [.], ack 348760, win 65535, length 0
22:06:07.966385 IP 13.224.208.10.443 > 10.0.2.15.57368: Flags [P.], seq 348760:352882, ack 803, win 65535, length 4122
22:06:07.966389 IP 10.0.2.15.57368 > 13.224.208.10.443: Flags [.], ack 352882, win 65535, length 0
22:06:07.967299 IP 13.224.208.10.443 > 10.0.2.15.57368: Flags [P.], seq 352882:357004, ack 803, win 65535, length 4122
22:06:07.967300 IP 13.224.208.10.443 > 10.0.2.15.57368: Flags [P.], seq 357004:358378, ack 803, win 65535, length 1374
22:06:07.967301 IP 13.224.208.10.443 > 10.0.2.15.57368: Flags [.], seq 358378:359838, ack 803, win 65535, length 1460
22:06:07.967317 IP 10.0.2.15.57368 > 13.224.208.10.443: Flags [.], ack 357004, win 65535, length 0
22:06:07.967347 IP 10.0.2.15.57368 > 13.224.208.10.443: Flags [.], ack 358378, win 65535, length 0
22:06:07.967358 IP 10.0.2.15.57368 > 13.224.208.10.443: Flags [.], ack 359838, win 65535, length 0
22:06:07.967457 IP 13.224.208.10.443 > 10.0.2.15.57368: Flags [P.], seq 359838:363874, ack 803, win 65535, length 4036
22:06:07.967465 IP 10.0.2.15.57368 > 13.224.208.10.443: Flags [.], ack 363874, win 65535, length 0
22:06:07.967716 IP 13.224.208.10.443 > 10.0.2.15.57368: Flags [P.], seq 363874:367996, ack 803, win 65535, length 4122
22:06:07.967728 IP 10.0.2.15.57368 > 13.224.208.10.443: Flags [.], ack 367996, win 65535, length 0
22:06:07.968023 IP 13.224.208.10.443 > 10.0.2.15.57368: Flags [P.], seq 367996:372118, ack 803, win 65535, length 4122
22:06:07.968024 IP 13.224.208.10.443 > 10.0.2.15.57368: Flags [P.], seq 372118:376240, ack 803, win 65535, length 4122
22:06:07.968036 IP 10.0.2.15.57368 > 13.224.208.10.443: Flags [.], ack 372118, win 65535, length 0
22:06:07.968054 IP 10.0.2.15.57368 > 13.224.208.10.443: Flags [.], ack 376240, win 65535, length 0
22:06:07.968724 IP 13.224.208.10.443 > 10.0.2.15.57368: Flags [P.], seq 376240:381736, ack 803, win 65535, length 5496
22:06:07.968726 IP 13.224.208.10.443 > 10.0.2.15.57368: Flags [P.], seq 381736:384484, ack 803, win 65535, length 2748
22:06:07.968727 IP 13.224.208.10.443 > 10.0.2.15.57368: Flags [.], seq 384484:385944, ack 803, win 65535, length 1460
22:06:07.968741 IP 10.0.2.15.57368 > 13.224.208.10.443: Flags [.], ack 381736, win 65535, length 0
22:06:07.968866 IP 10.0.2.15.57368 > 13.224.208.10.443: Flags [.], ack 384484, win 65535, length 0
22:06:07.968890 IP 10.0.2.15.57368 > 13.224.208.10.443: Flags [.], ack 385944, win 65535, length 0
22:06:07.969142 IP 13.224.208.10.443 > 10.0.2.15.57368: Flags [P.], seq 385944:388606, ack 803, win 65535, length 2662
22:06:07.969144 IP 13.224.208.10.443 > 10.0.2.15.57368: Flags [P.], seq 388606:394102, ack 803, win 65535, length 5496
22:06:07.969195 IP 10.0.2.15.57368 > 13.224.208.10.443: Flags [.], ack 388606, win 65535, length 0
22:06:07.969277 IP 10.0.2.15.57368 > 13.224.208.10.443: Flags [.], ack 394102, win 65535, length 0
22:06:07.969625 IP 13.224.208.10.443 > 10.0.2.15.57368: Flags [P.], seq 394102:396850, ack 803, win 65535, length 2748
22:06:07.969627 IP 13.224.208.10.443 > 10.0.2.15.57368: Flags [P.], seq 396850:399598, ack 803, win 65535, length 2748
22:06:07.969640 IP 10.0.2.15.57368 > 13.224.208.10.443: Flags [.], ack 396850, win 65535, length 0
22:06:07.969657 IP 10.0.2.15.57368 > 13.224.208.10.443: Flags [.], ack 399598, win 65535, length 0
22:06:07.970502 IP 13.224.208.10.443 > 10.0.2.15.57368: Flags [P.], seq 399598:406468, ack 803, win 65535, length 6870
22:06:07.970517 IP 10.0.2.15.57368 > 13.224.208.10.443: Flags [.], ack 406468, win 65535, length 0
22:06:07.970862 IP 13.224.208.10.443 > 10.0.2.15.57368: Flags [P.], seq 406468:410590, ack 803, win 65535, length 4122
22:06:07.970864 IP 13.224.208.10.443 > 10.0.2.15.57368: Flags [P.], seq 410590:413338, ack 803, win 65535, length 2748
22:06:07.970865 IP 13.224.208.10.443 > 10.0.2.15.57368: Flags [P.], seq 413338:414712, ack 803, win 65535, length 1374
22:06:07.970879 IP 10.0.2.15.57368 > 13.224.208.10.443: Flags [.], ack 410590, win 65535, length 0
22:06:07.970898 IP 10.0.2.15.57368 > 13.224.208.10.443: Flags [.], ack 413338, win 65535, length 0
22:06:07.970926 IP 10.0.2.15.57368 > 13.224.208.10.443: Flags [.], ack 414712, win 65535, length 0
22:06:07.971757 IP 13.224.208.10.443 > 10.0.2.15.57368: Flags [P.], seq 414712:420208, ack 803, win 65535, length 5496
22:06:07.971759 IP 13.224.208.10.443 > 10.0.2.15.57368: Flags [P.], seq 420208:421582, ack 803, win 65535, length 1374
22:06:07.971761 IP 13.224.208.10.443 > 10.0.2.15.57368: Flags [P.], seq 421582:429826, ack 803, win 65535, length 8244
22:06:07.972212 IP 10.0.2.15.57368 > 13.224.208.10.443: Flags [.], ack 420208, win 65535, length 0
22:06:07.972328 IP 10.0.2.15.57368 > 13.224.208.10.443: Flags [.], ack 421582, win 65535, length 0
22:06:07.972352 IP 10.0.2.15.57368 > 13.224.208.10.443: Flags [.], ack 429826, win 65535, length 0
22:06:07.972385 IP 13.224.208.10.443 > 10.0.2.15.57368: Flags [P.], seq 429826:432574, ack 803, win 65535, length 2748
22:06:07.972386 IP 13.224.208.10.443 > 10.0.2.15.57368: Flags [P.], seq 432574:435322, ack 803, win 65535, length 2748
22:06:07.972387 IP 13.224.208.10.443 > 10.0.2.15.57368: Flags [P.], seq 435322:439444, ack 803, win 65535, length 4122
22:06:07.972388 IP 13.224.208.10.443 > 10.0.2.15.57368: Flags [P.], seq 439444:442192, ack 803, win 65535, length 2748
22:06:07.972396 IP 10.0.2.15.57368 > 13.224.208.10.443: Flags [.], ack 432574, win 65535, length 0
22:06:07.972410 IP 10.0.2.15.57368 > 13.224.208.10.443: Flags [.], ack 435322, win 65535, length 0
22:06:07.972419 IP 10.0.2.15.57368 > 13.224.208.10.443: Flags [.], ack 439444, win 65535, length 0
22:06:07.972486 IP 10.0.2.15.57368 > 13.224.208.10.443: Flags [.], ack 442192, win 65535, length 0
22:06:07.972516 IP 13.224.208.10.443 > 10.0.2.15.57368: Flags [P.], seq 442192:444940, ack 803, win 65535, length 2748
22:06:07.972523 IP 10.0.2.15.57368 > 13.224.208.10.443: Flags [.], ack 444940, win 65535, length 0
22:06:07.973203 IP 13.224.208.10.443 > 10.0.2.15.57368: Flags [P.], seq 444940:446314, ack 803, win 65535, length 1374
22:06:07.973214 IP 10.0.2.15.57368 > 13.224.208.10.443: Flags [.], ack 446314, win 65535, length 0
22:06:07.973369 IP 13.224.208.10.443 > 10.0.2.15.57368: Flags [P.], seq 446314:451810, ack 803, win 65535, length 5496
22:06:07.973380 IP 10.0.2.15.57368 > 13.224.208.10.443: Flags [.], ack 451810, win 65535, length 0
22:06:07.973663 IP 13.224.208.10.443 > 10.0.2.15.57368: Flags [P.], seq 451810:457306, ack 803, win 65535, length 5496
22:06:07.973673 IP 10.0.2.15.57368 > 13.224.208.10.443: Flags [.], ack 457306, win 65535, length 0
22:06:07.973937 IP 13.224.208.10.443 > 10.0.2.15.57368: Flags [P.], seq 457306:460054, ack 803, win 65535, length 2748
22:06:07.973939 IP 13.224.208.10.443 > 10.0.2.15.57368: Flags [P.], seq 460054:461428, ack 803, win 65535, length 1374
22:06:07.973949 IP 10.0.2.15.57368 > 13.224.208.10.443: Flags [.], ack 460054, win 65535, length 0
22:06:07.974021 IP 10.0.2.15.57368 > 13.224.208.10.443: Flags [.], ack 461428, win 65535, length 0
22:06:07.974356 IP 13.224.208.10.443 > 10.0.2.15.57368: Flags [P.], seq 461428:466924, ack 803, win 65535, length 5496
22:06:07.974358 IP 13.224.208.10.443 > 10.0.2.15.57368: Flags [P.], seq 466924:469672, ack 803, win 65535, length 2748
22:06:07.974373 IP 10.0.2.15.57368 > 13.224.208.10.443: Flags [.], ack 466924, win 65535, length 0
22:06:07.974392 IP 10.0.2.15.57368 > 13.224.208.10.443: Flags [.], ack 469672, win 65535, length 0
22:06:07.976278 IP 13.224.208.10.443 > 10.0.2.15.57368: Flags [P.], seq 469672:476542, ack 803, win 65535, length 6870
22:06:07.976281 IP 13.224.208.10.443 > 10.0.2.15.57368: Flags [.], seq 476542:478002, ack 803, win 65535, length 1460
22:06:07.976337 IP 10.0.2.15.57368 > 13.224.208.10.443: Flags [.], ack 476542, win 65535, length 0
22:06:07.977028 IP 10.0.2.15.57368 > 13.224.208.10.443: Flags [.], ack 478002, win 65535, length 0
22:06:07.979611 IP 13.224.208.10.443 > 10.0.2.15.57368: Flags [P.], seq 478002:482038, ack 803, win 65535, length 4036
22:06:07.979614 IP 13.224.208.10.443 > 10.0.2.15.57368: Flags [P.], seq 482038:486160, ack 803, win 65535, length 4122
22:06:07.979616 IP 13.224.208.10.443 > 10.0.2.15.57368: Flags [P.], seq 486160:493030, ack 803, win 65535, length 6870
22:06:07.979641 IP 10.0.2.15.57368 > 13.224.208.10.443: Flags [.], ack 482038, win 65535, length 0
22:06:07.979867 IP 10.0.2.15.57368 > 13.224.208.10.443: Flags [.], ack 486160, win 65535, length 0
22:06:07.980094 IP 10.0.2.15.57368 > 13.224.208.10.443: Flags [.], ack 493030, win 65535, length 0

