22:06:52.115120 IP 10.0.2.15.51674 > 140.233.253.2.53: 25344+ A? www.imdb.com. (30)
22:06:52.115167 IP 10.0.2.15.51674 > 140.233.253.2.53: 32773+ AAAA? www.imdb.com. (30)
22:06:52.121042 IP 140.233.253.2.53 > 10.0.2.15.51674: 25344 3/0/0 CNAME tp.391b988c0-frontier.imdb.com., CNAME d2bytcopxu066p.cloudfront.net., A 13.224.208.10 (125)
22:06:52.123640 IP 140.233.253.2.53 > 10.0.2.15.51674: 32773 2/1/0 CNAME tp.391b988c0-frontier.imdb.com., CNAME d2bytcopxu066p.cloudfront.net. (191)
22:06:52.123847 IP 10.0.2.15.57384 > 13.224.208.10.443: Flags [S], seq 488235711, win 64240, options [mss 1460,sackOK,TS val 3642830714 ecr 0,nop,wscale 6], length 0
22:06:52.141063 IP 13.224.208.10.443 > 10.0.2.15.57384: Flags [S.], seq 300736001, ack 488235712, win 65535, options [mss 1460], length 0
22:06:52.141202 IP 10.0.2.15.57384 > 13.224.208.10.443: Flags [.], ack 1, win 64240, length 0
22:06:52.152365 IP 10.0.2.15.57384 > 13.224.208.10.443: Flags [P.], seq 1:518, ack 1, win 64240, length 517
22:06:52.152904 IP 13.224.208.10.443 > 10.0.2.15.57384: Flags [.], ack 518, win 65535, length 0
22:06:52.183601 IP 13.224.208.10.443 > 10.0.2.15.57384: Flags [.], seq 1:2921, ack 518, win 65535, length 2920
22:06:52.183625 IP 10.0.2.15.57384 > 13.224.208.10.443: Flags [.], ack 2921, win 62780, length 0
22:06:52.186511 IP 13.224.208.10.443 > 10.0.2.15.57384: Flags [P.], seq 2921:5509, ack 518, win 65535, length 2588
22:06:52.186533 IP 10.0.2.15.57384 > 13.224.208.10.443: Flags [.], ack 5509, win 62780, length 0
22:06:52.188160 IP 10.0.2.15.57384 > 13.224.208.10.443: Flags [P.], seq 518:582, ack 5509, win 62780, length 64
22:06:52.188858 IP 13.224.208.10.443 > 10.0.2.15.57384: Flags [.], ack 582, win 65535, length 0
22:06:52.189112 IP 10.0.2.15.57384 > 13.224.208.10.443: Flags [P.], seq 582:628, ack 5509, win 62780, length 46
22:06:52.189395 IP 10.0.2.15.57384 > 13.224.208.10.443: Flags [P.], seq 628:677, ack 5509, win 62780, length 49
22:06:52.189504 IP 13.224.208.10.443 > 10.0.2.15.57384: Flags [.], ack 628, win 65535, length 0
22:06:52.189588 IP 10.0.2.15.57384 > 13.224.208.10.443: Flags [P.], seq 677:712, ack 5509, win 62780, length 35
22:06:52.189863 IP 10.0.2.15.57384 > 13.224.208.10.443: Flags [P.], seq 712:772, ack 5509, win 62780, length 60
22:06:52.189958 IP 13.224.208.10.443 > 10.0.2.15.57384: Flags [.], ack 677, win 65535, length 0
22:06:52.190406 IP 13.224.208.10.443 > 10.0.2.15.57384: Flags [.], ack 712, win 65535, length 0
22:06:52.190513 IP 13.224.208.10.443 > 10.0.2.15.57384: Flags [.], ack 772, win 65535, length 0
22:06:52.203416 IP 13.224.208.10.443 > 10.0.2.15.57384: Flags [P.], seq 5509:5571, ack 772, win 65535, length 62
22:06:52.203439 IP 10.0.2.15.57384 > 13.224.208.10.443: Flags [.], ack 5571, win 62780, length 0
22:06:52.203712 IP 10.0.2.15.57384 > 13.224.208.10.443: Flags [P.], seq 772:803, ack 5571, win 62780, length 31
22:06:52.204271 IP 13.224.208.10.443 > 10.0.2.15.57384: Flags [.], ack 803, win 65535, length 0
22:06:52.209664 IP 13.224.208.10.443 > 10.0.2.15.57384: Flags [P.], seq 5571:5602, ack 803, win 65535, length 31
22:06:52.209685 IP 10.0.2.15.57384 > 13.224.208.10.443: Flags [.], ack 5602, win 62780, length 0
22:06:52.630808 IP 13.224.208.10.443 > 10.0.2.15.57384: Flags [P.], seq 5602:12472, ack 803, win 65535, length 6870
22:06:52.630810 IP 13.224.208.10.443 > 10.0.2.15.57384: Flags [.], seq 12472:13932, ack 803, win 65535, length 1460
22:06:52.630844 IP 10.0.2.15.57384 > 13.224.208.10.443: Flags [.], ack 12472, win 59860, length 0
22:06:52.631160 IP 10.0.2.15.57384 > 13.224.208.10.443: Flags [.], ack 13932, win 58400, length 0
22:06:52.631626 IP 13.224.208.10.443 > 10.0.2.15.57384: Flags [P.], seq 13932:14792, ack 803, win 65535, length 860
22:06:52.631645 IP 10.0.2.15.57384 > 13.224.208.10.443: Flags [.], ack 14792, win 62780, length 0
22:06:52.639011 IP 13.224.208.10.443 > 10.0.2.15.57384: Flags [P.], seq 14792:18914, ack 803, win 65535, length 4122
22:06:52.639032 IP 10.0.2.15.57384 > 13.224.208.10.443: Flags [.], ack 18914, win 61320, length 0
22:06:52.640827 IP 13.224.208.10.443 > 10.0.2.15.57384: Flags [P.], seq 18914:31238, ack 803, win 65535, length 12324
22:06:52.640851 IP 10.0.2.15.57384 > 13.224.208.10.443: Flags [.], ack 31238, win 55480, length 0
22:06:52.640885 IP 13.224.208.10.443 > 10.0.2.15.57384: Flags [P.], seq 31238:32783, ack 803, win 65535, length 1545
22:06:52.640890 IP 10.0.2.15.57384 > 13.224.208.10.443: Flags [.], ack 32783, win 54020, length 0
22:06:52.642860 IP 13.224.208.10.443 > 10.0.2.15.57384: Flags [P.], seq 32783:38279, ack 803, win 65535, length 5496
22:06:52.642928 IP 10.0.2.15.57384 > 13.224.208.10.443: Flags [.], ack 38279, win 61320, length 0
22:06:52.643121 IP 13.224.208.10.443 > 10.0.2.15.57384: Flags [P.], seq 38279:42401, ack 803, win 65535, length 4122
22:06:52.643123 IP 13.224.208.10.443 > 10.0.2.15.57384: Flags [P.], seq 42401:43775, ack 803, win 65535, length 1374
22:06:52.643133 IP 10.0.2.15.57384 > 13.224.208.10.443: Flags [.], ack 42401, win 61320, length 0
22:06:52.643151 IP 10.0.2.15.57384 > 13.224.208.10.443: Flags [.], ack 43775, win 61320, length 0
22:06:52.645897 IP 13.224.208.10.443 > 10.0.2.15.57384: Flags [P.], seq 43775:54767, ack 803, win 65535, length 10992
22:06:52.645919 IP 10.0.2.15.57384 > 13.224.208.10.443: Flags [.], ack 54767, win 56940, length 0
22:06:52.646048 IP 13.224.208.10.443 > 10.0.2.15.57384: Flags [P.], seq 54767:56141, ack 803, win 65535, length 1374
22:06:52.646060 IP 10.0.2.15.57384 > 13.224.208.10.443: Flags [.], ack 56141, win 55566, length 0
22:06:52.646537 IP 13.224.208.10.443 > 10.0.2.15.57384: Flags [P.], seq 56141:57515, ack 803, win 65535, length 1374
22:06:52.646551 IP 10.0.2.15.57384 > 13.224.208.10.443: Flags [.], ack 57515, win 63204, length 0
22:06:52.652961 IP 13.224.208.10.443 > 10.0.2.15.57384: Flags [P.], seq 57515:60263, ack 803, win 65535, length 2748
22:06:52.652983 IP 10.0.2.15.57384 > 13.224.208.10.443: Flags [.], ack 60263, win 63204, length 0
22:06:52.655153 IP 13.224.208.10.443 > 10.0.2.15.57384: Flags [P.], seq 60263:69881, ack 803, win 65535, length 9618
22:06:52.655155 IP 13.224.208.10.443 > 10.0.2.15.57384: Flags [P.], seq 69881:71255, ack 803, win 65535, length 1374
22:06:52.655179 IP 10.0.2.15.57384 > 13.224.208.10.443: Flags [.], ack 69881, win 58400, length 0
22:06:52.655221 IP 10.0.2.15.57384 > 13.224.208.10.443: Flags [.], ack 71255, win 57026, length 0
22:06:52.656028 IP 13.224.208.10.443 > 10.0.2.15.57384: Flags [P.], seq 71255:78125, ack 803, win 65535, length 6870
22:06:52.656045 IP 10.0.2.15.57384 > 13.224.208.10.443: Flags [.], ack 78125, win 65535, length 0
22:06:52.657083 IP 13.224.208.10.443 > 10.0.2.15.57384: Flags [P.], seq 78125:82247, ack 803, win 65535, length 4122
22:06:52.657454 IP 10.0.2.15.57384 > 13.224.208.10.443: Flags [.], ack 82247, win 65535, length 0
22:06:52.658278 IP 13.224.208.10.443 > 10.0.2.15.57384: Flags [P.], seq 82247:87743, ack 803, win 65535, length 5496
22:06:52.658280 IP 13.224.208.10.443 > 10.0.2.15.57384: Flags [P.], seq 87743:89117, ack 803, win 65535, length 1374
22:06:52.658304 IP 10.0.2.15.57384 > 13.224.208.10.443: Flags [.], ack 87743, win 65535, length 0
22:06:52.658337 IP 10.0.2.15.57384 > 13.224.208.10.443: Flags [.], ack 89117, win 65535, length 0
22:06:52.662393 IP 13.224.208.10.443 > 10.0.2.15.57384: Flags [P.], seq 89117:108353, ack 803, win 65535, length 19236
22:06:52.662419 IP 10.0.2.15.57384 > 13.224.208.10.443: Flags [.], ack 108353, win 65535, length 0
22:06:52.663718 IP 13.224.208.10.443 > 10.0.2.15.57384: Flags [P.], seq 108353:117971, ack 803, win 65535, length 9618
22:06:52.663721 IP 13.224.208.10.443 > 10.0.2.15.57384: Flags [.], seq 117971:120891, ack 803, win 65535, length 2920
22:06:52.663744 IP 10.0.2.15.57384 > 13.224.208.10.443: Flags [.], ack 117971, win 65535, length 0
22:06:52.663777 IP 10.0.2.15.57384 > 13.224.208.10.443: Flags [.], ack 120891, win 65535, length 0
22:06:52.664240 IP 13.224.208.10.443 > 10.0.2.15.57384: Flags [P.], seq 120891:123467, ack 803, win 65535, length 2576
22:06:52.664243 IP 13.224.208.10.443 > 10.0.2.15.57384: Flags [P.], seq 123467:127589, ack 803, win 65535, length 4122
22:06:52.664437 IP 13.224.208.10.443 > 10.0.2.15.57384: Flags [P.], seq 127589:133085, ack 803, win 65535, length 5496
22:06:52.664439 IP 13.224.208.10.443 > 10.0.2.15.57384: Flags [P.], seq 133085:134459, ack 803, win 65535, length 1374
22:06:52.664471 IP 10.0.2.15.57384 > 13.224.208.10.443: Flags [.], ack 134459, win 65535, length 0
22:06:52.666840 IP 13.224.208.10.443 > 10.0.2.15.57384: Flags [P.], seq 134459:141329, ack 803, win 65535, length 6870
22:06:52.666866 IP 10.0.2.15.57384 > 13.224.208.10.443: Flags [.], ack 141329, win 65535, length 0
22:06:52.669349 IP 13.224.208.10.443 > 10.0.2.15.57384: Flags [P.], seq 141329:148199, ack 803, win 65535, length 6870
22:06:52.669374 IP 10.0.2.15.57384 > 13.224.208.10.443: Flags [.], ack 148199, win 65535, length 0
22:06:52.670076 IP 13.224.208.10.443 > 10.0.2.15.57384: Flags [P.], seq 148199:153695, ack 803, win 65535, length 5496
22:06:52.670079 IP 13.224.208.10.443 > 10.0.2.15.57384: Flags [P.], seq 153695:159191, ack 803, win 65535, length 5496
22:06:52.670170 IP 10.0.2.15.57384 > 13.224.208.10.443: Flags [.], ack 153695, win 65535, length 0
22:06:52.672174 IP 10.0.2.15.57384 > 13.224.208.10.443: Flags [.], ack 159191, win 65535, length 0
22:06:52.672231 IP 13.224.208.10.443 > 10.0.2.15.57384: Flags [P.], seq 159191:163313, ack 803, win 65535, length 4122
22:06:52.672245 IP 10.0.2.15.57384 > 13.224.208.10.443: Flags [.], ack 163313, win 65535, length 0
22:06:52.673424 IP 13.224.208.10.443 > 10.0.2.15.57384: Flags [.], seq 163313:169153, ack 803, win 65535, length 5840
22:06:52.673445 IP 10.0.2.15.57384 > 13.224.208.10.443: Flags [.], ack 169153, win 65535, length 0
22:06:52.673892 IP 13.224.208.10.443 > 10.0.2.15.57384: Flags [P.], seq 169153:177053, ack 803, win 65535, length 7900
22:06:52.673897 IP 13.224.208.10.443 > 10.0.2.15.57384: Flags [P.], seq 177053:185297, ack 803, win 65535, length 8244
22:06:52.674700 IP 10.0.2.15.57384 > 13.224.208.10.443: Flags [.], ack 177053, win 65535, length 0
22:06:52.674741 IP 10.0.2.15.57384 > 13.224.208.10.443: Flags [.], ack 185297, win 65535, length 0
22:06:52.675873 IP 13.224.208.10.443 > 10.0.2.15.57384: Flags [P.], seq 185297:192167, ack 803, win 65535, length 6870
22:06:52.675875 IP 13.224.208.10.443 > 10.0.2.15.57384: Flags [P.], seq 192167:193541, ack 803, win 65535, length 1374
22:06:52.675901 IP 10.0.2.15.57384 > 13.224.208.10.443: Flags [.], ack 192167, win 65535, length 0
22:06:52.676075 IP 10.0.2.15.57384 > 13.224.208.10.443: Flags [.], ack 193541, win 65535, length 0
22:06:52.676945 IP 13.224.208.10.443 > 10.0.2.15.57384: Flags [.], seq 193541:202301, ack 803, win 65535, length 8760
22:06:52.676967 IP 10.0.2.15.57384 > 13.224.208.10.443: Flags [.], ack 202301, win 65535, length 0
22:06:52.677123 IP 13.224.208.10.443 > 10.0.2.15.57384: Flags [P.], seq 202301:207281, ack 803, win 65535, length 4980
22:06:52.677125 IP 13.224.208.10.443 > 10.0.2.15.57384: Flags [P.], seq 207281:212777, ack 803, win 65535, length 5496
22:06:52.677149 IP 13.224.208.10.443 > 10.0.2.15.57384: Flags [P.], seq 212777:216899, ack 803, win 65535, length 4122
22:06:52.677178 IP 10.0.2.15.57384 > 13.224.208.10.443: Flags [.], ack 216899, win 65535, length 0
22:06:52.679978 IP 13.224.208.10.443 > 10.0.2.15.57384: Flags [P.], seq 216899:234761, ack 803, win 65535, length 17862
22:06:52.680002 IP 10.0.2.15.57384 > 13.224.208.10.443: Flags [.], ack 234761, win 65535, length 0
22:06:52.680068 IP 13.224.208.10.443 > 10.0.2.15.57384: Flags [P.], seq 234761:241631, ack 803, win 65535, length 6870
22:06:52.680070 IP 13.224.208.10.443 > 10.0.2.15.57384: Flags [P.], seq 241631:243005, ack 803, win 65535, length 1374
22:06:52.680082 IP 10.0.2.15.57384 > 13.224.208.10.443: Flags [.], ack 241631, win 65535, length 0
22:06:52.680271 IP 10.0.2.15.57384 > 13.224.208.10.443: Flags [.], ack 243005, win 65535, length 0
22:06:52.681769 IP 13.224.208.10.443 > 10.0.2.15.57384: Flags [P.], seq 243005:251249, ack 803, win 65535, length 8244
22:06:52.681776 IP 13.224.208.10.443 > 10.0.2.15.57384: Flags [P.], seq 251249:253997, ack 803, win 65535, length 2748
22:06:52.681805 IP 10.0.2.15.57384 > 13.224.208.10.443: Flags [.], ack 251249, win 65535, length 0
22:06:52.681857 IP 10.0.2.15.57384 > 13.224.208.10.443: Flags [.], ack 253997, win 65535, length 0
22:06:52.681904 IP 13.224.208.10.443 > 10.0.2.15.57384: Flags [P.], seq 253997:256745, ack 803, win 65535, length 2748
22:06:52.681907 IP 13.224.208.10.443 > 10.0.2.15.57384: Flags [P.], seq 256745:262241, ack 803, win 65535, length 5496
22:06:52.681917 IP 10.0.2.15.57384 > 13.224.208.10.443: Flags [.], ack 256745, win 65535, length 0
22:06:52.681932 IP 10.0.2.15.57384 > 13.224.208.10.443: Flags [.], ack 262241, win 65535, length 0
22:06:52.688364 IP 13.224.208.10.443 > 10.0.2.15.57384: Flags [P.], seq 262241:267737, ack 803, win 65535, length 5496
22:06:52.688366 IP 13.224.208.10.443 > 10.0.2.15.57384: Flags [P.], seq 267737:269111, ack 803, win 65535, length 1374
22:06:52.688373 IP 13.224.208.10.443 > 10.0.2.15.57384: Flags [P.], seq 269111:284225, ack 803, win 65535, length 15114
22:06:52.688407 IP 10.0.2.15.57384 > 13.224.208.10.443: Flags [.], ack 267737, win 65535, length 0
22:06:52.688884 IP 10.0.2.15.57384 > 13.224.208.10.443: Flags [.], ack 269111, win 65535, length 0
22:06:52.688909 IP 10.0.2.15.57384 > 13.224.208.10.443: Flags [.], ack 284225, win 65535, length 0
22:06:52.689053 IP 13.224.208.10.443 > 10.0.2.15.57384: Flags [P.], seq 284225:326565, ack 803, win 65535, length 42340
22:06:52.689067 IP 10.0.2.15.57384 > 13.224.208.10.443: Flags [.], ack 326565, win 65535, length 0
22:06:52.694196 IP 13.224.208.10.443 > 10.0.2.15.57384: Flags [P.], seq 326565:359795, ack 803, win 65535, length 33230
22:06:52.694218 IP 10.0.2.15.57384 > 13.224.208.10.443: Flags [.], ack 359795, win 65535, length 0
22:06:52.703616 IP 13.224.208.10.443 > 10.0.2.15.57384: Flags [.], seq 359795:424035, ack 803, win 65535, length 64240
22:06:52.703730 IP 10.0.2.15.57384 > 13.224.208.10.443: Flags [.], ack 424035, win 65535, length 0
22:06:52.705978 IP 13.224.208.10.443 > 10.0.2.15.57384: Flags [P.], seq 424035:425495, ack 803, win 65535, length 1460
22:06:52.705985 IP 13.224.208.10.443 > 10.0.2.15.57384: Flags [.], seq 425495:437175, ack 803, win 65535, length 11680
22:06:52.706057 IP 10.0.2.15.57384 > 13.224.208.10.443: Flags [.], ack 437175, win 65535, length 0
22:06:52.707979 IP 13.224.208.10.443 > 10.0.2.15.57384: Flags [.], seq 437175:488275, ack 803, win 65535, length 51100
22:06:52.708001 IP 10.0.2.15.57384 > 13.224.208.10.443: Flags [.], ack 488275, win 65535, length 0
22:06:52.709915 IP 13.224.208.10.443 > 10.0.2.15.57384: Flags [P.], seq 488275:489735, ack 803, win 65535, length 1460
22:06:52.709940 IP 10.0.2.15.57384 > 13.224.208.10.443: Flags [.], ack 489735, win 65535, length 0

