22:06:00.839302 IP 10.0.2.15.36311 > 140.233.253.2.53: 49952+ A? www.imdb.com. (30)
22:06:00.839334 IP 10.0.2.15.36311 > 140.233.253.2.53: 56365+ AAAA? www.imdb.com. (30)
22:06:00.844196 IP 140.233.253.2.53 > 10.0.2.15.36311: 49952 3/0/0 CNAME tp.391b988c0-frontier.imdb.com., CNAME d2bytcopxu066p.cloudfront.net., A 13.224.208.10 (125)
22:06:00.868023 IP 140.233.253.2.53 > 10.0.2.15.36311: 56365 2/1/0 CNAME tp.391b988c0-frontier.imdb.com., CNAME d2bytcopxu066p.cloudfront.net. (191)
22:06:00.868275 IP 10.0.2.15.57366 > 13.224.208.10.443: Flags [S], seq 2120028578, win 64240, options [mss 1460,sackOK,TS val 3642779458 ecr 0,nop,wscale 6], length 0
22:06:00.883091 IP 13.224.208.10.443 > 10.0.2.15.57366: Flags [S.], seq 299072001, ack 2120028579, win 65535, options [mss 1460], length 0
22:06:00.883188 IP 10.0.2.15.57366 > 13.224.208.10.443: Flags [.], ack 1, win 64240, length 0
22:06:00.892376 IP 10.0.2.15.57366 > 13.224.208.10.443: Flags [P.], seq 1:518, ack 1, win 64240, length 517
22:06:00.892696 IP 13.224.208.10.443 > 10.0.2.15.57366: Flags [.], ack 518, win 65535, length 0
22:06:00.911354 IP 13.224.208.10.443 > 10.0.2.15.57366: Flags [.], seq 1:2921, ack 518, win 65535, length 2920
22:06:00.911372 IP 10.0.2.15.57366 > 13.224.208.10.443: Flags [.], ack 2921, win 62780, length 0
22:06:00.911734 IP 13.224.208.10.443 > 10.0.2.15.57366: Flags [P.], seq 2921:4123, ack 518, win 65535, length 1202
22:06:00.911754 IP 10.0.2.15.57366 > 13.224.208.10.443: Flags [.], ack 4123, win 61578, length 0
22:06:00.912485 IP 13.224.208.10.443 > 10.0.2.15.57366: Flags [P.], seq 4123:5509, ack 518, win 65535, length 1386
22:06:00.912592 IP 10.0.2.15.57366 > 13.224.208.10.443: Flags [.], ack 5509, win 61320, length 0
22:06:00.914828 IP 10.0.2.15.57366 > 13.224.208.10.443: Flags [P.], seq 518:582, ack 5509, win 62780, length 64
22:06:00.915307 IP 13.224.208.10.443 > 10.0.2.15.57366: Flags [.], ack 582, win 65535, length 0
22:06:00.915644 IP 10.0.2.15.57366 > 13.224.208.10.443: Flags [P.], seq 582:628, ack 5509, win 62780, length 46
22:06:00.915687 IP 10.0.2.15.57366 > 13.224.208.10.443: Flags [P.], seq 628:677, ack 5509, win 62780, length 49
22:06:00.915963 IP 10.0.2.15.57366 > 13.224.208.10.443: Flags [P.], seq 677:712, ack 5509, win 62780, length 35
22:06:00.916089 IP 13.224.208.10.443 > 10.0.2.15.57366: Flags [.], ack 628, win 65535, length 0
22:06:00.916091 IP 13.224.208.10.443 > 10.0.2.15.57366: Flags [.], ack 677, win 65535, length 0
22:06:00.916208 IP 13.224.208.10.443 > 10.0.2.15.57366: Flags [.], ack 712, win 65535, length 0
22:06:00.916260 IP 10.0.2.15.57366 > 13.224.208.10.443: Flags [P.], seq 712:772, ack 5509, win 62780, length 60
22:06:00.916499 IP 13.224.208.10.443 > 10.0.2.15.57366: Flags [.], ack 772, win 65535, length 0
22:06:00.931184 IP 13.224.208.10.443 > 10.0.2.15.57366: Flags [P.], seq 5509:5602, ack 772, win 65535, length 93
22:06:00.931202 IP 10.0.2.15.57366 > 13.224.208.10.443: Flags [.], ack 5602, win 62780, length 0
22:06:00.931480 IP 10.0.2.15.57366 > 13.224.208.10.443: Flags [P.], seq 772:803, ack 5602, win 62780, length 31
22:06:00.932093 IP 13.224.208.10.443 > 10.0.2.15.57366: Flags [.], ack 803, win 65535, length 0
22:06:01.442614 IP 13.224.208.10.443 > 10.0.2.15.57366: Flags [.], seq 5602:14362, ack 803, win 65535, length 8760
22:06:01.442736 IP 10.0.2.15.57366 > 13.224.208.10.443: Flags [.], ack 14362, win 58400, length 0
22:06:01.444514 IP 13.224.208.10.443 > 10.0.2.15.57366: Flags [.], seq 14362:24582, ack 803, win 65535, length 10220
22:06:01.444540 IP 10.0.2.15.57366 > 13.224.208.10.443: Flags [.], ack 24582, win 58400, length 0
22:06:01.444699 IP 13.224.208.10.443 > 10.0.2.15.57366: Flags [.], seq 24582:26042, ack 803, win 65535, length 1460
22:06:01.444711 IP 10.0.2.15.57366 > 13.224.208.10.443: Flags [.], ack 26042, win 56940, length 0
22:06:01.444933 IP 13.224.208.10.443 > 10.0.2.15.57366: Flags [.], seq 26042:27502, ack 803, win 65535, length 1460
22:06:01.444947 IP 10.0.2.15.57366 > 13.224.208.10.443: Flags [.], ack 27502, win 55480, length 0
22:06:01.445081 IP 13.224.208.10.443 > 10.0.2.15.57366: Flags [.], seq 27502:30422, ack 803, win 65535, length 2920
22:06:01.445091 IP 10.0.2.15.57366 > 13.224.208.10.443: Flags [.], ack 30422, win 54020, length 0
22:06:01.445195 IP 13.224.208.10.443 > 10.0.2.15.57366: Flags [.], seq 30422:42102, ack 803, win 65535, length 11680
22:06:01.445210 IP 10.0.2.15.57366 > 13.224.208.10.443: Flags [.], ack 42102, win 46720, length 0
22:06:01.445721 IP 13.224.208.10.443 > 10.0.2.15.57366: Flags [P.], seq 42102:48590, ack 803, win 65535, length 6488
22:06:01.445996 IP 10.0.2.15.57366 > 13.224.208.10.443: Flags [.], ack 48590, win 40232, length 0
22:06:01.457713 IP 13.224.208.10.443 > 10.0.2.15.57366: Flags [P.], seq 48590:56834, ack 803, win 65535, length 8244
22:06:01.457715 IP 13.224.208.10.443 > 10.0.2.15.57366: Flags [P.], seq 56834:58208, ack 803, win 65535, length 1374
22:06:01.457739 IP 10.0.2.15.57366 > 13.224.208.10.443: Flags [.], ack 56834, win 58400, length 0
22:06:01.457815 IP 10.0.2.15.57366 > 13.224.208.10.443: Flags [.], ack 58208, win 58400, length 0
22:06:01.458668 IP 13.224.208.10.443 > 10.0.2.15.57366: Flags [P.], seq 58208:65078, ack 803, win 65535, length 6870
22:06:01.458689 IP 10.0.2.15.57366 > 13.224.208.10.443: Flags [.], ack 65078, win 59860, length 0
22:06:01.459971 IP 13.224.208.10.443 > 10.0.2.15.57366: Flags [P.], seq 65078:69200, ack 803, win 65535, length 4122
22:06:01.459973 IP 13.224.208.10.443 > 10.0.2.15.57366: Flags [P.], seq 69200:71948, ack 803, win 65535, length 2748
22:06:01.459995 IP 10.0.2.15.57366 > 13.224.208.10.443: Flags [.], ack 69200, win 61320, length 0
22:06:01.460028 IP 10.0.2.15.57366 > 13.224.208.10.443: Flags [.], ack 71948, win 59860, length 0
22:06:01.461413 IP 13.224.208.10.443 > 10.0.2.15.57366: Flags [P.], seq 71948:76070, ack 803, win 65535, length 4122
22:06:01.461416 IP 13.224.208.10.443 > 10.0.2.15.57366: Flags [P.], seq 76070:80192, ack 803, win 65535, length 4122
22:06:01.461438 IP 10.0.2.15.57366 > 13.224.208.10.443: Flags [.], ack 76070, win 65535, length 0
22:06:01.461469 IP 10.0.2.15.57366 > 13.224.208.10.443: Flags [.], ack 80192, win 65535, length 0
22:06:01.462328 IP 13.224.208.10.443 > 10.0.2.15.57366: Flags [P.], seq 80192:85688, ack 803, win 65535, length 5496
22:06:01.462349 IP 10.0.2.15.57366 > 13.224.208.10.443: Flags [.], ack 85688, win 65535, length 0
22:06:01.464870 IP 13.224.208.10.443 > 10.0.2.15.57366: Flags [P.], seq 85688:91184, ack 803, win 65535, length 5496
22:06:01.464875 IP 13.224.208.10.443 > 10.0.2.15.57366: Flags [P.], seq 91184:104924, ack 803, win 65535, length 13740
22:06:01.464901 IP 10.0.2.15.57366 > 13.224.208.10.443: Flags [.], ack 91184, win 65535, length 0
22:06:01.464992 IP 10.0.2.15.57366 > 13.224.208.10.443: Flags [.], ack 104924, win 65535, length 0
22:06:01.465025 IP 13.224.208.10.443 > 10.0.2.15.57366: Flags [P.], seq 104924:106298, ack 803, win 65535, length 1374
22:06:01.465032 IP 10.0.2.15.57366 > 13.224.208.10.443: Flags [.], ack 106298, win 65535, length 0
22:06:01.465736 IP 13.224.208.10.443 > 10.0.2.15.57366: Flags [P.], seq 106298:111794, ack 803, win 65535, length 5496
22:06:01.465805 IP 10.0.2.15.57366 > 13.224.208.10.443: Flags [.], ack 111794, win 65535, length 0
22:06:01.471445 IP 13.224.208.10.443 > 10.0.2.15.57366: Flags [P.], seq 111794:115916, ack 803, win 65535, length 4122
22:06:01.471467 IP 10.0.2.15.57366 > 13.224.208.10.443: Flags [.], ack 115916, win 65535, length 0
22:06:01.472376 IP 13.224.208.10.443 > 10.0.2.15.57366: Flags [P.], seq 115916:124160, ack 803, win 65535, length 8244
22:06:01.472377 IP 13.224.208.10.443 > 10.0.2.15.57366: Flags [P.], seq 124160:125534, ack 803, win 65535, length 1374
22:06:01.472397 IP 10.0.2.15.57366 > 13.224.208.10.443: Flags [.], ack 124160, win 65535, length 0
22:06:01.472431 IP 10.0.2.15.57366 > 13.224.208.10.443: Flags [.], ack 125534, win 65535, length 0
22:06:01.474768 IP 13.224.208.10.443 > 10.0.2.15.57366: Flags [P.], seq 125534:136526, ack 803, win 65535, length 10992
22:06:01.474793 IP 10.0.2.15.57366 > 13.224.208.10.443: Flags [.], ack 136526, win 65535, length 0
22:06:01.474963 IP 13.224.208.10.443 > 10.0.2.15.57366: Flags [P.], seq 136526:139274, ack 803, win 65535, length 2748
22:06:01.474976 IP 10.0.2.15.57366 > 13.224.208.10.443: Flags [.], ack 139274, win 65535, length 0
22:06:01.476708 IP 13.224.208.10.443 > 10.0.2.15.57366: Flags [P.], seq 139274:147518, ack 803, win 65535, length 8244
22:06:01.476711 IP 13.224.208.10.443 > 10.0.2.15.57366: Flags [P.], seq 147518:153014, ack 803, win 65535, length 5496
22:06:01.476734 IP 10.0.2.15.57366 > 13.224.208.10.443: Flags [.], ack 147518, win 65535, length 0
22:06:01.476851 IP 10.0.2.15.57366 > 13.224.208.10.443: Flags [.], ack 153014, win 65535, length 0
22:06:01.477416 IP 13.224.208.10.443 > 10.0.2.15.57366: Flags [P.], seq 153014:154388, ack 803, win 65535, length 1374
22:06:01.477433 IP 10.0.2.15.57366 > 13.224.208.10.443: Flags [.], ack 154388, win 65535, length 0
22:06:01.478805 IP 13.224.208.10.443 > 10.0.2.15.57366: Flags [P.], seq 154388:159884, ack 803, win 65535, length 5496
22:06:01.478823 IP 10.0.2.15.57366 > 13.224.208.10.443: Flags [.], ack 159884, win 65535, length 0
22:06:01.480157 IP 13.224.208.10.443 > 10.0.2.15.57366: Flags [P.], seq 159884:166754, ack 803, win 65535, length 6870
22:06:01.480160 IP 13.224.208.10.443 > 10.0.2.15.57366: Flags [P.], seq 166754:170876, ack 803, win 65535, length 4122
22:06:01.480185 IP 10.0.2.15.57366 > 13.224.208.10.443: Flags [.], ack 166754, win 65535, length 0
22:06:01.480226 IP 10.0.2.15.57366 > 13.224.208.10.443: Flags [.], ack 170876, win 65535, length 0
22:06:01.481188 IP 13.224.208.10.443 > 10.0.2.15.57366: Flags [P.], seq 170876:174998, ack 803, win 65535, length 4122
22:06:01.481394 IP 10.0.2.15.57366 > 13.224.208.10.443: Flags [.], ack 174998, win 65535, length 0
22:06:01.481620 IP 13.224.208.10.443 > 10.0.2.15.57366: Flags [P.], seq 174998:177746, ack 803, win 65535, length 2748
22:06:01.481623 IP 13.224.208.10.443 > 10.0.2.15.57366: Flags [P.], seq 177746:183242, ack 803, win 65535, length 5496
22:06:01.481636 IP 10.0.2.15.57366 > 13.224.208.10.443: Flags [.], ack 177746, win 65535, length 0
22:06:01.481653 IP 10.0.2.15.57366 > 13.224.208.10.443: Flags [.], ack 183242, win 65535, length 0
22:06:01.484272 IP 13.224.208.10.443 > 10.0.2.15.57366: Flags [.], seq 183242:184702, ack 803, win 65535, length 1460
22:06:01.484298 IP 10.0.2.15.57366 > 13.224.208.10.443: Flags [.], ack 184702, win 65535, length 0
22:06:01.484654 IP 13.224.208.10.443 > 10.0.2.15.57366: Flags [P.], seq 184702:196982, ack 803, win 65535, length 12280
22:06:01.484670 IP 10.0.2.15.57366 > 13.224.208.10.443: Flags [.], ack 196982, win 65535, length 0
22:06:01.484926 IP 13.224.208.10.443 > 10.0.2.15.57366: Flags [P.], seq 196982:198356, ack 803, win 65535, length 1374
22:06:01.484945 IP 10.0.2.15.57366 > 13.224.208.10.443: Flags [.], ack 198356, win 65535, length 0
22:06:01.485768 IP 13.224.208.10.443 > 10.0.2.15.57366: Flags [.], seq 198356:204196, ack 803, win 65535, length 5840
22:06:01.486256 IP 10.0.2.15.57366 > 13.224.208.10.443: Flags [.], ack 204196, win 65535, length 0
22:06:01.486351 IP 13.224.208.10.443 > 10.0.2.15.57366: Flags [P.], seq 204196:206600, ack 803, win 65535, length 2404
22:06:01.486352 IP 13.224.208.10.443 > 10.0.2.15.57366: Flags [P.], seq 206600:209348, ack 803, win 65535, length 2748
22:06:01.486558 IP 10.0.2.15.57366 > 13.224.208.10.443: Flags [.], ack 209348, win 65535, length 0
22:06:01.487017 IP 13.224.208.10.443 > 10.0.2.15.57366: Flags [P.], seq 209348:213470, ack 803, win 65535, length 4122
22:06:01.487035 IP 10.0.2.15.57366 > 13.224.208.10.443: Flags [.], ack 213470, win 65535, length 0
22:06:01.488096 IP 13.224.208.10.443 > 10.0.2.15.57366: Flags [P.], seq 213470:225836, ack 803, win 65535, length 12366
22:06:01.488124 IP 10.0.2.15.57366 > 13.224.208.10.443: Flags [.], ack 225836, win 65535, length 0
22:06:01.489250 IP 13.224.208.10.443 > 10.0.2.15.57366: Flags [P.], seq 225836:231332, ack 803, win 65535, length 5496
22:06:01.489253 IP 13.224.208.10.443 > 10.0.2.15.57366: Flags [P.], seq 231332:234080, ack 803, win 65535, length 2748
22:06:01.489272 IP 10.0.2.15.57366 > 13.224.208.10.443: Flags [.], ack 231332, win 65535, length 0
22:06:01.489495 IP 10.0.2.15.57366 > 13.224.208.10.443: Flags [.], ack 234080, win 65535, length 0
22:06:01.489799 IP 13.224.208.10.443 > 10.0.2.15.57366: Flags [P.], seq 234080:239576, ack 803, win 65535, length 5496
22:06:01.489802 IP 13.224.208.10.443 > 10.0.2.15.57366: Flags [P.], seq 239576:242324, ack 803, win 65535, length 2748
22:06:01.489816 IP 10.0.2.15.57366 > 13.224.208.10.443: Flags [.], ack 239576, win 65535, length 0
22:06:01.489831 IP 10.0.2.15.57366 > 13.224.208.10.443: Flags [.], ack 242324, win 65535, length 0
22:06:01.490312 IP 13.224.208.10.443 > 10.0.2.15.57366: Flags [P.], seq 242324:249194, ack 803, win 65535, length 6870
22:06:01.490315 IP 13.224.208.10.443 > 10.0.2.15.57366: Flags [P.], seq 249194:253316, ack 803, win 65535, length 4122
22:06:01.490334 IP 10.0.2.15.57366 > 13.224.208.10.443: Flags [.], ack 249194, win 65535, length 0
22:06:01.490610 IP 10.0.2.15.57366 > 13.224.208.10.443: Flags [.], ack 253316, win 65535, length 0
22:06:01.493001 IP 13.224.208.10.443 > 10.0.2.15.57366: Flags [P.], seq 253316:260186, ack 803, win 65535, length 6870
22:06:01.493005 IP 13.224.208.10.443 > 10.0.2.15.57366: Flags [P.], seq 260186:269804, ack 803, win 65535, length 9618
22:06:01.493029 IP 10.0.2.15.57366 > 13.224.208.10.443: Flags [.], ack 260186, win 65535, length 0
22:06:01.493132 IP 10.0.2.15.57366 > 13.224.208.10.443: Flags [.], ack 269804, win 65535, length 0
22:06:01.493169 IP 13.224.208.10.443 > 10.0.2.15.57366: Flags [P.], seq 269804:278048, ack 803, win 65535, length 8244
22:06:01.493175 IP 10.0.2.15.57366 > 13.224.208.10.443: Flags [.], ack 278048, win 65535, length 0
22:06:01.495267 IP 13.224.208.10.443 > 10.0.2.15.57366: Flags [P.], seq 278048:282170, ack 803, win 65535, length 4122
22:06:01.495270 IP 13.224.208.10.443 > 10.0.2.15.57366: Flags [P.], seq 282170:284918, ack 803, win 65535, length 2748
22:06:01.495282 IP 13.224.208.10.443 > 10.0.2.15.57366: Flags [P.], seq 284918:291788, ack 803, win 65535, length 6870
22:06:01.495305 IP 10.0.2.15.57366 > 13.224.208.10.443: Flags [.], ack 282170, win 65535, length 0
22:06:01.495332 IP 10.0.2.15.57366 > 13.224.208.10.443: Flags [.], ack 284918, win 65535, length 0
22:06:01.495361 IP 10.0.2.15.57366 > 13.224.208.10.443: Flags [.], ack 291788, win 65535, length 0
22:06:01.495405 IP 13.224.208.10.443 > 10.0.2.15.57366: Flags [P.], seq 291788:297284, ack 803, win 65535, length 5496
22:06:01.495407 IP 13.224.208.10.443 > 10.0.2.15.57366: Flags [P.], seq 297284:301406, ack 803, win 65535, length 4122
22:06:01.495408 IP 13.224.208.10.443 > 10.0.2.15.57366: Flags [P.], seq 301406:304154, ack 803, win 65535, length 2748
22:06:01.495416 IP 10.0.2.15.57366 > 13.224.208.10.443: Flags [.], ack 297284, win 65535, length 0
22:06:01.495433 IP 10.0.2.15.57366 > 13.224.208.10.443: Flags [.], ack 301406, win 65535, length 0
22:06:01.495447 IP 10.0.2.15.57366 > 13.224.208.10.443: Flags [.], ack 304154, win 65535, length 0
22:06:01.495474 IP 13.224.208.10.443 > 10.0.2.15.57366: Flags [P.], seq 304154:306902, ack 803, win 65535, length 2748
22:06:01.495528 IP 10.0.2.15.57366 > 13.224.208.10.443: Flags [.], ack 306902, win 65535, length 0
22:06:01.496697 IP 13.224.208.10.443 > 10.0.2.15.57366: Flags [P.], seq 306902:312398, ack 803, win 65535, length 5496
22:06:01.496714 IP 10.0.2.15.57366 > 13.224.208.10.443: Flags [.], ack 312398, win 65535, length 0
22:06:01.497042 IP 13.224.208.10.443 > 10.0.2.15.57366: Flags [P.], seq 312398:317894, ack 803, win 65535, length 5496
22:06:01.497053 IP 10.0.2.15.57366 > 13.224.208.10.443: Flags [.], ack 317894, win 65535, length 0
22:06:01.497213 IP 13.224.208.10.443 > 10.0.2.15.57366: Flags [P.], seq 317894:324764, ack 803, win 65535, length 6870
22:06:01.497215 IP 13.224.208.10.443 > 10.0.2.15.57366: Flags [.], seq 324764:326224, ack 803, win 65535, length 1460
22:06:01.497230 IP 10.0.2.15.57366 > 13.224.208.10.443: Flags [.], ack 324764, win 65535, length 0
22:06:01.497247 IP 10.0.2.15.57366 > 13.224.208.10.443: Flags [.], ack 326224, win 65535, length 0
22:06:01.497550 IP 13.224.208.10.443 > 10.0.2.15.57366: Flags [P.], seq 326224:327512, ack 803, win 65535, length 1288
22:06:01.497552 IP 13.224.208.10.443 > 10.0.2.15.57366: Flags [P.], seq 327512:331634, ack 803, win 65535, length 4122
22:06:01.497569 IP 10.0.2.15.57366 > 13.224.208.10.443: Flags [.], ack 327512, win 65535, length 0
22:06:01.497588 IP 10.0.2.15.57366 > 13.224.208.10.443: Flags [.], ack 331634, win 65535, length 0
22:06:01.500293 IP 13.224.208.10.443 > 10.0.2.15.57366: Flags [P.], seq 331634:338504, ack 803, win 65535, length 6870
22:06:01.500297 IP 13.224.208.10.443 > 10.0.2.15.57366: Flags [P.], seq 338504:344000, ack 803, win 65535, length 5496
22:06:01.500328 IP 10.0.2.15.57366 > 13.224.208.10.443: Flags [.], ack 338504, win 65535, length 0
22:06:01.500458 IP 10.0.2.15.57366 > 13.224.208.10.443: Flags [.], ack 344000, win 65535, length 0
22:06:01.502020 IP 13.224.208.10.443 > 10.0.2.15.57366: Flags [P.], seq 344000:357740, ack 803, win 65535, length 13740
22:06:01.502046 IP 10.0.2.15.57366 > 13.224.208.10.443: Flags [.], ack 357740, win 65535, length 0
22:06:01.502280 IP 13.224.208.10.443 > 10.0.2.15.57366: Flags [P.], seq 357740:364610, ack 803, win 65535, length 6870
22:06:01.502284 IP 13.224.208.10.443 > 10.0.2.15.57366: Flags [P.], seq 364610:371480, ack 803, win 65535, length 6870
22:06:01.502306 IP 10.0.2.15.57366 > 13.224.208.10.443: Flags [.], ack 364610, win 65535, length 0
22:06:01.502332 IP 10.0.2.15.57366 > 13.224.208.10.443: Flags [.], ack 371480, win 65535, length 0
22:06:01.502359 IP 13.224.208.10.443 > 10.0.2.15.57366: Flags [P.], seq 371480:378350, ack 803, win 65535, length 6870
22:06:01.502362 IP 13.224.208.10.443 > 10.0.2.15.57366: Flags [P.], seq 378350:387968, ack 803, win 65535, length 9618
22:06:01.502370 IP 10.0.2.15.57366 > 13.224.208.10.443: Flags [.], ack 378350, win 65535, length 0
22:06:01.502385 IP 10.0.2.15.57366 > 13.224.208.10.443: Flags [.], ack 387968, win 65535, length 0
22:06:01.503162 IP 13.224.208.10.443 > 10.0.2.15.57366: Flags [P.], seq 387968:389342, ack 803, win 65535, length 1374
22:06:01.503194 IP 10.0.2.15.57366 > 13.224.208.10.443: Flags [.], ack 389342, win 65535, length 0
22:06:01.504090 IP 13.224.208.10.443 > 10.0.2.15.57366: Flags [P.], seq 389342:398112, ack 803, win 65535, length 8770
22:06:01.504093 IP 13.224.208.10.443 > 10.0.2.15.57366: Flags [P.], seq 398112:402234, ack 803, win 65535, length 4122
22:06:01.504221 IP 10.0.2.15.57366 > 13.224.208.10.443: Flags [.], ack 398112, win 65535, length 0
22:06:01.504247 IP 10.0.2.15.57366 > 13.224.208.10.443: Flags [.], ack 402234, win 65535, length 0
22:06:01.507877 IP 13.224.208.10.443 > 10.0.2.15.57366: Flags [.], seq 402234:412454, ack 803, win 65535, length 10220
22:06:01.507900 IP 10.0.2.15.57366 > 13.224.208.10.443: Flags [.], ack 412454, win 65535, length 0
22:06:01.508179 IP 13.224.208.10.443 > 10.0.2.15.57366: Flags [P.], seq 412454:415974, ack 803, win 65535, length 3520
22:06:01.508182 IP 13.224.208.10.443 > 10.0.2.15.57366: Flags [P.], seq 415974:421470, ack 803, win 65535, length 5496
22:06:01.508184 IP 13.224.208.10.443 > 10.0.2.15.57366: Flags [P.], seq 421470:428340, ack 803, win 65535, length 6870
22:06:01.508200 IP 10.0.2.15.57366 > 13.224.208.10.443: Flags [.], ack 415974, win 65535, length 0
22:06:01.508220 IP 10.0.2.15.57366 > 13.224.208.10.443: Flags [.], ack 421470, win 65535, length 0
22:06:01.508231 IP 10.0.2.15.57366 > 13.224.208.10.443: Flags [.], ack 428340, win 65535, length 0
22:06:01.508258 IP 13.224.208.10.443 > 10.0.2.15.57366: Flags [P.], seq 428340:436058, ack 803, win 65535, length 7718
22:06:01.508262 IP 10.0.2.15.57366 > 13.224.208.10.443: Flags [.], ack 436058, win 65535, length 0
22:06:01.508922 IP 13.224.208.10.443 > 10.0.2.15.57366: Flags [P.], seq 436058:452546, ack 803, win 65535, length 16488
22:06:01.509007 IP 10.0.2.15.57366 > 13.224.208.10.443: Flags [.], ack 452546, win 65535, length 0
22:06:01.509200 IP 13.224.208.10.443 > 10.0.2.15.57366: Flags [P.], seq 452546:454458, ack 803, win 65535, length 1912
22:06:01.509318 IP 10.0.2.15.57366 > 13.224.208.10.443: Flags [.], ack 454458, win 65535, length 0
22:06:01.509713 IP 13.224.208.10.443 > 10.0.2.15.57366: Flags [P.], seq 454458:461298, ack 803, win 65535, length 6840
22:06:01.509717 IP 13.224.208.10.443 > 10.0.2.15.57366: Flags [P.], seq 461298:465420, ack 803, win 65535, length 4122
22:06:01.509735 IP 10.0.2.15.57366 > 13.224.208.10.443: Flags [.], ack 461298, win 65535, length 0
22:06:01.509970 IP 10.0.2.15.57366 > 13.224.208.10.443: Flags [.], ack 465420, win 65535, length 0
22:06:01.510090 IP 13.224.208.10.443 > 10.0.2.15.57366: Flags [P.], seq 465420:470916, ack 803, win 65535, length 5496
22:06:01.510092 IP 13.224.208.10.443 > 10.0.2.15.57366: Flags [P.], seq 470916:473664, ack 803, win 65535, length 2748
22:06:01.510093 IP 13.224.208.10.443 > 10.0.2.15.57366: Flags [P.], seq 473664:477786, ack 803, win 65535, length 4122
22:06:01.510109 IP 10.0.2.15.57366 > 13.224.208.10.443: Flags [.], ack 470916, win 65535, length 0
22:06:01.510128 IP 10.0.2.15.57366 > 13.224.208.10.443: Flags [.], ack 473664, win 65535, length 0
22:06:01.510138 IP 10.0.2.15.57366 > 13.224.208.10.443: Flags [.], ack 477786, win 65535, length 0
22:06:01.510155 IP 13.224.208.10.443 > 10.0.2.15.57366: Flags [P.], seq 477786:479160, ack 803, win 65535, length 1374
22:06:01.510160 IP 10.0.2.15.57366 > 13.224.208.10.443: Flags [.], ack 479160, win 65535, length 0
22:06:01.511726 IP 13.224.208.10.443 > 10.0.2.15.57366: Flags [P.], seq 479160:486030, ack 803, win 65535, length 6870
22:06:01.511729 IP 13.224.208.10.443 > 10.0.2.15.57366: Flags [P.], seq 486030:488782, ack 803, win 65535, length 2752
22:06:01.511752 IP 10.0.2.15.57366 > 13.224.208.10.443: Flags [.], ack 486030, win 65535, length 0
22:06:01.511895 IP 10.0.2.15.57366 > 13.224.208.10.443: Flags [.], ack 488782, win 65535, length 0
22:06:01.512737 IP 13.224.208.10.443 > 10.0.2.15.57366: Flags [P.], seq 488782:490156, ack 803, win 65535, length 1374
22:06:01.512753 IP 10.0.2.15.57366 > 13.224.208.10.443: Flags [.], ack 490156, win 65535, length 0
22:06:01.513715 IP 13.224.208.10.443 > 10.0.2.15.57366: Flags [P.], seq 490156:494278, ack 803, win 65535, length 4122
22:06:01.513733 IP 10.0.2.15.57366 > 13.224.208.10.443: Flags [.], ack 494278, win 65535, length 0
22:06:01.515488 IP 13.224.208.10.443 > 10.0.2.15.57366: Flags [P.], seq 494278:500636, ack 803, win 65535, length 6358

