22:04:09.950001 IP 10.0.2.15.37386 > 140.233.253.2.53: 27078+ A? www.imdb.com. (30)
22:04:09.950225 IP 10.0.2.15.37386 > 140.233.253.2.53: 14786+ AAAA? www.imdb.com. (30)
22:04:09.955045 IP 140.233.253.2.53 > 10.0.2.15.37386: 14786 2/1/0 CNAME tp.391b988c0-frontier.imdb.com., CNAME d2bytcopxu066p.cloudfront.net. (191)
22:04:09.955047 IP 140.233.253.2.53 > 10.0.2.15.37386: 27078 3/0/0 CNAME tp.391b988c0-frontier.imdb.com., CNAME d2bytcopxu066p.cloudfront.net., A 13.224.208.10 (125)
22:04:09.955568 IP 10.0.2.15.57328 > 13.224.208.10.443: Flags [S], seq 836288793, win 64240, options [mss 1460,sackOK,TS val 3642668545 ecr 0,nop,wscale 6], length 0
22:04:09.977371 IP 13.224.208.10.443 > 10.0.2.15.57328: Flags [S.], seq 295232001, ack 836288794, win 65535, options [mss 1460], length 0
22:04:09.977500 IP 10.0.2.15.57328 > 13.224.208.10.443: Flags [.], ack 1, win 64240, length 0
22:04:10.024171 IP 10.0.2.15.57328 > 13.224.208.10.443: Flags [P.], seq 1:518, ack 1, win 64240, length 517
22:04:10.025295 IP 13.224.208.10.443 > 10.0.2.15.57328: Flags [.], ack 518, win 65535, length 0
22:04:10.053470 IP 13.224.208.10.443 > 10.0.2.15.57328: Flags [.], seq 1:2921, ack 518, win 65535, length 2920
22:04:10.053497 IP 10.0.2.15.57328 > 13.224.208.10.443: Flags [.], ack 2921, win 62780, length 0
22:04:10.061851 IP 13.224.208.10.443 > 10.0.2.15.57328: Flags [.], seq 2921:4381, ack 518, win 65535, length 1460
22:04:10.061876 IP 10.0.2.15.57328 > 13.224.208.10.443: Flags [.], ack 4381, win 62780, length 0
22:04:10.062508 IP 13.224.208.10.443 > 10.0.2.15.57328: Flags [P.], seq 4381:5509, ack 518, win 65535, length 1128
22:04:10.062530 IP 10.0.2.15.57328 > 13.224.208.10.443: Flags [.], ack 5509, win 62780, length 0
22:04:10.068026 IP 10.0.2.15.57328 > 13.224.208.10.443: Flags [P.], seq 518:582, ack 5509, win 62780, length 64
22:04:10.068245 IP 10.0.2.15.57328 > 13.224.208.10.443: Flags [P.], seq 582:677, ack 5509, win 62780, length 95
22:04:10.068996 IP 10.0.2.15.57328 > 13.224.208.10.443: Flags [P.], seq 677:772, ack 5509, win 62780, length 95
22:04:10.077894 IP 13.224.208.10.443 > 10.0.2.15.57328: Flags [.], ack 582, win 65535, length 0
22:04:10.077897 IP 13.224.208.10.443 > 10.0.2.15.57328: Flags [.], ack 677, win 65535, length 0
22:04:10.077897 IP 13.224.208.10.443 > 10.0.2.15.57328: Flags [.], ack 772, win 65535, length 0
22:04:10.084739 IP 13.224.208.10.443 > 10.0.2.15.57328: Flags [P.], seq 5509:5580, ack 772, win 65535, length 71
22:04:10.084761 IP 10.0.2.15.57328 > 13.224.208.10.443: Flags [.], ack 5580, win 62780, length 0
22:04:10.085199 IP 10.0.2.15.57328 > 13.224.208.10.443: Flags [P.], seq 772:803, ack 5580, win 62780, length 31
22:04:10.085731 IP 13.224.208.10.443 > 10.0.2.15.57328: Flags [.], ack 803, win 65535, length 0
22:04:10.554887 IP 13.224.208.10.443 > 10.0.2.15.57328: Flags [P.], seq 5580:12450, ack 803, win 65535, length 6870
22:04:10.554890 IP 13.224.208.10.443 > 10.0.2.15.57328: Flags [.], seq 12450:13910, ack 803, win 65535, length 1460
22:04:10.554927 IP 10.0.2.15.57328 > 13.224.208.10.443: Flags [.], ack 12450, win 59860, length 0
22:04:10.555121 IP 10.0.2.15.57328 > 13.224.208.10.443: Flags [.], ack 13910, win 58400, length 0
22:04:10.555536 IP 13.224.208.10.443 > 10.0.2.15.57328: Flags [P.], seq 13910:24816, ack 803, win 65535, length 10906
22:04:10.555556 IP 10.0.2.15.57328 > 13.224.208.10.443: Flags [.], ack 24816, win 51100, length 0
22:04:10.556591 IP 13.224.208.10.443 > 10.0.2.15.57328: Flags [P.], seq 24816:32708, ack 803, win 65535, length 7892
22:04:10.556594 IP 13.224.208.10.443 > 10.0.2.15.57328: Flags [P.], seq 32708:36830, ack 803, win 65535, length 4122
22:04:10.556655 IP 10.0.2.15.57328 > 13.224.208.10.443: Flags [.], ack 32708, win 58400, length 0
22:04:10.556690 IP 10.0.2.15.57328 > 13.224.208.10.443: Flags [.], ack 36830, win 55480, length 0
22:04:10.557076 IP 13.224.208.10.443 > 10.0.2.15.57328: Flags [P.], seq 36830:38204, ack 803, win 65535, length 1374
22:04:10.557091 IP 10.0.2.15.57328 > 13.224.208.10.443: Flags [.], ack 38204, win 55480, length 0
22:04:10.558152 IP 13.224.208.10.443 > 10.0.2.15.57328: Flags [.], seq 38204:41124, ack 803, win 65535, length 2920
22:04:10.558172 IP 10.0.2.15.57328 > 13.224.208.10.443: Flags [.], ack 41124, win 62780, length 0
22:04:10.560335 IP 13.224.208.10.443 > 10.0.2.15.57328: Flags [P.], seq 41124:45074, ack 803, win 65535, length 3950
22:04:10.560338 IP 13.224.208.10.443 > 10.0.2.15.57328: Flags [P.], seq 45074:47822, ack 803, win 65535, length 2748
22:04:10.560359 IP 10.0.2.15.57328 > 13.224.208.10.443: Flags [.], ack 45074, win 59860, length 0
22:04:10.560380 IP 10.0.2.15.57328 > 13.224.208.10.443: Flags [.], ack 47822, win 58400, length 0
22:04:10.570057 IP 13.224.208.10.443 > 10.0.2.15.57328: Flags [P.], seq 47822:56066, ack 803, win 65535, length 8244
22:04:10.570083 IP 10.0.2.15.57328 > 13.224.208.10.443: Flags [.], ack 56066, win 58400, length 0
22:04:10.570542 IP 13.224.208.10.443 > 10.0.2.15.57328: Flags [P.], seq 56066:57440, ack 803, win 65535, length 1374
22:04:10.570561 IP 10.0.2.15.57328 > 13.224.208.10.443: Flags [.], ack 57440, win 58400, length 0
22:04:10.571229 IP 13.224.208.10.443 > 10.0.2.15.57328: Flags [P.], seq 57440:64310, ack 803, win 65535, length 6870
22:04:10.571249 IP 10.0.2.15.57328 > 13.224.208.10.443: Flags [.], ack 64310, win 59860, length 0
22:04:10.572161 IP 13.224.208.10.443 > 10.0.2.15.57328: Flags [P.], seq 64310:71180, ack 803, win 65535, length 6870
22:04:10.572164 IP 13.224.208.10.443 > 10.0.2.15.57328: Flags [P.], seq 71180:75302, ack 803, win 65535, length 4122
22:04:10.572188 IP 10.0.2.15.57328 > 13.224.208.10.443: Flags [.], ack 71180, win 55480, length 0
22:04:10.572265 IP 10.0.2.15.57328 > 13.224.208.10.443: Flags [.], ack 75302, win 52560, length 0
22:04:10.572609 IP 13.224.208.10.443 > 10.0.2.15.57328: Flags [P.], seq 75302:78050, ack 803, win 65535, length 2748
22:04:10.572624 IP 10.0.2.15.57328 > 13.224.208.10.443: Flags [.], ack 78050, win 49812, length 0
22:04:10.573238 IP 13.224.208.10.443 > 10.0.2.15.57328: Flags [.], seq 78050:79510, ack 803, win 65535, length 1460
22:04:10.573258 IP 10.0.2.15.57328 > 13.224.208.10.443: Flags [.], ack 79510, win 65535, length 0
22:04:10.573454 IP 13.224.208.10.443 > 10.0.2.15.57328: Flags [P.], seq 79510:82172, ack 803, win 65535, length 2662
22:04:10.573455 IP 13.224.208.10.443 > 10.0.2.15.57328: Flags [P.], seq 82172:86294, ack 803, win 65535, length 4122
22:04:10.573467 IP 10.0.2.15.57328 > 13.224.208.10.443: Flags [.], ack 82172, win 65535, length 0
22:04:10.573481 IP 10.0.2.15.57328 > 13.224.208.10.443: Flags [.], ack 86294, win 65535, length 0
22:04:10.574557 IP 13.224.208.10.443 > 10.0.2.15.57328: Flags [P.], seq 86294:90416, ack 803, win 65535, length 4122
22:04:10.574560 IP 13.224.208.10.443 > 10.0.2.15.57328: Flags [P.], seq 90416:95912, ack 803, win 65535, length 5496
22:04:10.574594 IP 10.0.2.15.57328 > 13.224.208.10.443: Flags [.], ack 90416, win 65535, length 0
22:04:10.574632 IP 10.0.2.15.57328 > 13.224.208.10.443: Flags [.], ack 95912, win 65535, length 0
22:04:10.576593 IP 13.224.208.10.443 > 10.0.2.15.57328: Flags [.], seq 95912:97372, ack 803, win 65535, length 1460
22:04:10.576617 IP 10.0.2.15.57328 > 13.224.208.10.443: Flags [.], ack 97372, win 65535, length 0
22:04:10.577256 IP 13.224.208.10.443 > 10.0.2.15.57328: Flags [P.], seq 97372:98660, ack 803, win 65535, length 1288
22:04:10.577454 IP 13.224.208.10.443 > 10.0.2.15.57328: Flags [P.], seq 98660:105530, ack 803, win 65535, length 6870
22:04:10.577459 IP 13.224.208.10.443 > 10.0.2.15.57328: Flags [P.], seq 105530:111026, ack 803, win 65535, length 5496
22:04:10.577486 IP 10.0.2.15.57328 > 13.224.208.10.443: Flags [.], ack 98660, win 65535, length 0
22:04:10.577730 IP 10.0.2.15.57328 > 13.224.208.10.443: Flags [.], ack 105530, win 65535, length 0
22:04:10.577750 IP 10.0.2.15.57328 > 13.224.208.10.443: Flags [.], ack 111026, win 65535, length 0
22:04:10.577838 IP 13.224.208.10.443 > 10.0.2.15.57328: Flags [P.], seq 111026:115148, ack 803, win 65535, length 4122
22:04:10.577840 IP 13.224.208.10.443 > 10.0.2.15.57328: Flags [P.], seq 115148:119270, ack 803, win 65535, length 4122
22:04:10.577851 IP 10.0.2.15.57328 > 13.224.208.10.443: Flags [.], ack 115148, win 65535, length 0
22:04:10.577870 IP 10.0.2.15.57328 > 13.224.208.10.443: Flags [.], ack 119270, win 65535, length 0
22:04:10.579550 IP 13.224.208.10.443 > 10.0.2.15.57328: Flags [.], seq 119270:120730, ack 803, win 65535, length 1460
22:04:10.579680 IP 10.0.2.15.57328 > 13.224.208.10.443: Flags [.], ack 120730, win 65535, length 0
22:04:10.580046 IP 13.224.208.10.443 > 10.0.2.15.57328: Flags [P.], seq 120730:124766, ack 803, win 65535, length 4036
22:04:10.580048 IP 13.224.208.10.443 > 10.0.2.15.57328: Flags [P.], seq 124766:126140, ack 803, win 65535, length 1374
22:04:10.580208 IP 10.0.2.15.57328 > 13.224.208.10.443: Flags [.], ack 124766, win 65535, length 0
22:04:10.580234 IP 10.0.2.15.57328 > 13.224.208.10.443: Flags [.], ack 126140, win 65535, length 0
22:04:10.586651 IP 13.224.208.10.443 > 10.0.2.15.57328: Flags [P.], seq 126140:137132, ack 803, win 65535, length 10992
22:04:10.586675 IP 10.0.2.15.57328 > 13.224.208.10.443: Flags [.], ack 137132, win 65535, length 0
22:04:10.586787 IP 13.224.208.10.443 > 10.0.2.15.57328: Flags [P.], seq 137132:138506, ack 803, win 65535, length 1374
22:04:10.586797 IP 10.0.2.15.57328 > 13.224.208.10.443: Flags [.], ack 138506, win 65535, length 0
22:04:10.588438 IP 13.224.208.10.443 > 10.0.2.15.57328: Flags [P.], seq 138506:152246, ack 803, win 65535, length 13740
22:04:10.588499 IP 10.0.2.15.57328 > 13.224.208.10.443: Flags [.], ack 152246, win 65535, length 0
22:04:10.588683 IP 13.224.208.10.443 > 10.0.2.15.57328: Flags [P.], seq 152246:160490, ack 803, win 65535, length 8244
22:04:10.588695 IP 10.0.2.15.57328 > 13.224.208.10.443: Flags [.], ack 160490, win 65535, length 0
22:04:10.590194 IP 13.224.208.10.443 > 10.0.2.15.57328: Flags [P.], seq 160490:172856, ack 803, win 65535, length 12366
22:04:10.590215 IP 10.0.2.15.57328 > 13.224.208.10.443: Flags [.], ack 172856, win 65535, length 0
22:04:10.590275 IP 13.224.208.10.443 > 10.0.2.15.57328: Flags [P.], seq 172856:179726, ack 803, win 65535, length 6870
22:04:10.590277 IP 13.224.208.10.443 > 10.0.2.15.57328: Flags [P.], seq 179726:183848, ack 803, win 65535, length 4122
22:04:10.590287 IP 10.0.2.15.57328 > 13.224.208.10.443: Flags [.], ack 179726, win 65535, length 0
22:04:10.590298 IP 10.0.2.15.57328 > 13.224.208.10.443: Flags [.], ack 183848, win 65535, length 0
22:04:10.594266 IP 13.224.208.10.443 > 10.0.2.15.57328: Flags [.], seq 183848:185308, ack 803, win 65535, length 1460
22:04:10.594288 IP 10.0.2.15.57328 > 13.224.208.10.443: Flags [.], ack 185308, win 65535, length 0
22:04:10.595759 IP 13.224.208.10.443 > 10.0.2.15.57328: Flags [.], seq 185308:188228, ack 803, win 65535, length 2920
22:04:10.595783 IP 10.0.2.15.57328 > 13.224.208.10.443: Flags [.], ack 188228, win 65535, length 0
22:04:10.597551 IP 13.224.208.10.443 > 10.0.2.15.57328: Flags [P.], seq 188228:189344, ack 803, win 65535, length 1116
22:04:10.597553 IP 13.224.208.10.443 > 10.0.2.15.57328: Flags [P.], seq 189344:192092, ack 803, win 65535, length 2748
22:04:10.597555 IP 13.224.208.10.443 > 10.0.2.15.57328: Flags [P.], seq 192092:200336, ack 803, win 65535, length 8244
22:04:10.597584 IP 10.0.2.15.57328 > 13.224.208.10.443: Flags [.], ack 189344, win 65535, length 0
22:04:10.597742 IP 10.0.2.15.57328 > 13.224.208.10.443: Flags [.], ack 192092, win 65535, length 0
22:04:10.597758 IP 10.0.2.15.57328 > 13.224.208.10.443: Flags [.], ack 200336, win 65535, length 0
22:04:10.597795 IP 13.224.208.10.443 > 10.0.2.15.57328: Flags [P.], seq 200336:209954, ack 803, win 65535, length 9618
22:04:10.597798 IP 13.224.208.10.443 > 10.0.2.15.57328: Flags [P.], seq 209954:220946, ack 803, win 65535, length 10992
22:04:10.597806 IP 10.0.2.15.57328 > 13.224.208.10.443: Flags [.], ack 209954, win 65535, length 0
22:04:10.597820 IP 10.0.2.15.57328 > 13.224.208.10.443: Flags [.], ack 220946, win 65535, length 0
22:04:10.598006 IP 13.224.208.10.443 > 10.0.2.15.57328: Flags [P.], seq 220946:240182, ack 803, win 65535, length 19236
22:04:10.598223 IP 10.0.2.15.57328 > 13.224.208.10.443: Flags [.], ack 240182, win 65535, length 0
22:04:10.601957 IP 13.224.208.10.443 > 10.0.2.15.57328: Flags [P.], seq 240182:278654, ack 803, win 65535, length 38472
22:04:10.601984 IP 10.0.2.15.57328 > 13.224.208.10.443: Flags [.], ack 278654, win 65535, length 0
22:04:10.603961 IP 13.224.208.10.443 > 10.0.2.15.57328: Flags [.], seq 278654:281574, ack 803, win 65535, length 2920
22:04:10.603985 IP 10.0.2.15.57328 > 13.224.208.10.443: Flags [.], ack 281574, win 65535, length 0
22:04:10.604720 IP 13.224.208.10.443 > 10.0.2.15.57328: Flags [P.], seq 281574:326744, ack 803, win 65535, length 45170
22:04:10.604884 IP 10.0.2.15.57328 > 13.224.208.10.443: Flags [.], ack 326744, win 65535, length 0
22:04:10.614394 IP 13.224.208.10.443 > 10.0.2.15.57328: Flags [P.], seq 326744:354224, ack 803, win 65535, length 27480
22:04:10.614423 IP 10.0.2.15.57328 > 13.224.208.10.443: Flags [.], ack 354224, win 65535, length 0
22:04:10.614753 IP 13.224.208.10.443 > 10.0.2.15.57328: Flags [P.], seq 354224:358346, ack 803, win 65535, length 4122
22:04:10.614767 IP 10.0.2.15.57328 > 13.224.208.10.443: Flags [.], ack 358346, win 65535, length 0
22:04:10.615174 IP 13.224.208.10.443 > 10.0.2.15.57328: Flags [P.], seq 358346:365216, ack 803, win 65535, length 6870
22:04:10.615192 IP 10.0.2.15.57328 > 13.224.208.10.443: Flags [.], ack 365216, win 65535, length 0
22:04:10.616672 IP 13.224.208.10.443 > 10.0.2.15.57328: Flags [.], seq 365216:410476, ack 803, win 65535, length 45260
22:04:10.616700 IP 10.0.2.15.57328 > 13.224.208.10.443: Flags [.], ack 410476, win 65535, length 0
22:04:10.617530 IP 13.224.208.10.443 > 10.0.2.15.57328: Flags [.], seq 410476:414856, ack 803, win 65535, length 4380
22:04:10.618189 IP 13.224.208.10.443 > 10.0.2.15.57328: Flags [P.], seq 414856:419236, ack 803, win 65535, length 4380
22:04:10.618201 IP 13.224.208.10.443 > 10.0.2.15.57328: Flags [.], seq 419236:474716, ack 803, win 65535, length 55480
22:04:10.618243 IP 10.0.2.15.57328 > 13.224.208.10.443: Flags [.], ack 419236, win 65535, length 0
22:04:10.618265 IP 10.0.2.15.57328 > 13.224.208.10.443: Flags [.], ack 474716, win 65535, length 0
22:04:10.618640 IP 13.224.208.10.443 > 10.0.2.15.57328: Flags [P.], seq 474716:476176, ack 803, win 65535, length 1460
22:04:10.618690 IP 10.0.2.15.57328 > 13.224.208.10.443: Flags [.], ack 476176, win 65535, length 0
22:04:10.618852 IP 13.224.208.10.443 > 10.0.2.15.57328: Flags [.], seq 476176:492236, ack 803, win 65535, length 16060
22:04:10.618863 IP 10.0.2.15.57328 > 13.224.208.10.443: Flags [.], ack 492236, win 65535, length 0
22:04:10.619139 IP 13.224.208.10.443 > 10.0.2.15.57328: Flags [.], seq 492236:493696, ack 803, win 65535, length 1460
22:04:10.619157 IP 10.0.2.15.57328 > 13.224.208.10.443: Flags [.], ack 493696, win 65535, length 0
22:04:10.619754 IP 13.224.208.10.443 > 10.0.2.15.57328: Flags [.], seq 493696:495156, ack 803, win 65535, length 1460
22:04:10.619770 IP 10.0.2.15.57328 > 13.224.208.10.443: Flags [.], ack 495156, win 65535, length 0
22:04:10.621428 IP 13.224.208.10.443 > 10.0.2.15.57328: Flags [.], seq 495156:496616, ack 803, win 65535, length 1460
22:04:10.621450 IP 10.0.2.15.57328 > 13.224.208.10.443: Flags [.], ack 496616, win 65535, length 0

