22:04:35.258018 IP 10.0.2.15.51698 > 140.233.253.2.53: 20518+ A? www.imdb.com. (30)
22:04:35.258050 IP 10.0.2.15.51698 > 140.233.253.2.53: 6186+ AAAA? www.imdb.com. (30)
22:04:35.264602 IP 140.233.253.2.53 > 10.0.2.15.51698: 6186 2/1/0 CNAME tp.391b988c0-frontier.imdb.com., CNAME d2bytcopxu066p.cloudfront.net. (191)
22:04:35.285291 IP 140.233.253.2.53 > 10.0.2.15.51698: 20518 3/0/0 CNAME tp.391b988c0-frontier.imdb.com., CNAME d2bytcopxu066p.cloudfront.net., A 13.224.208.10 (125)
22:04:35.285636 IP 10.0.2.15.57338 > 13.224.208.10.443: Flags [S], seq 4174097297, win 64240, options [mss 1460,sackOK,TS val 3642693875 ecr 0,nop,wscale 6], length 0
22:04:35.305120 IP 13.224.208.10.443 > 10.0.2.15.57338: Flags [S.], seq 296192001, ack 4174097298, win 65535, options [mss 1460], length 0
22:04:35.305296 IP 10.0.2.15.57338 > 13.224.208.10.443: Flags [.], ack 1, win 64240, length 0
22:04:35.313628 IP 10.0.2.15.57338 > 13.224.208.10.443: Flags [P.], seq 1:518, ack 1, win 64240, length 517
22:04:35.313969 IP 13.224.208.10.443 > 10.0.2.15.57338: Flags [.], ack 518, win 65535, length 0
22:04:35.332478 IP 13.224.208.10.443 > 10.0.2.15.57338: Flags [.], seq 1:2921, ack 518, win 65535, length 2920
22:04:35.332501 IP 10.0.2.15.57338 > 13.224.208.10.443: Flags [.], ack 2921, win 62780, length 0
22:04:35.332915 IP 13.224.208.10.443 > 10.0.2.15.57338: Flags [P.], seq 2921:4123, ack 518, win 65535, length 1202
22:04:35.332933 IP 10.0.2.15.57338 > 13.224.208.10.443: Flags [.], ack 4123, win 61578, length 0
22:04:35.333175 IP 13.224.208.10.443 > 10.0.2.15.57338: Flags [P.], seq 4123:5509, ack 518, win 65535, length 1386
22:04:35.333183 IP 10.0.2.15.57338 > 13.224.208.10.443: Flags [.], ack 5509, win 61320, length 0
22:04:35.334316 IP 10.0.2.15.57338 > 13.224.208.10.443: Flags [P.], seq 518:582, ack 5509, win 62780, length 64
22:04:35.334625 IP 13.224.208.10.443 > 10.0.2.15.57338: Flags [.], ack 582, win 65535, length 0
22:04:35.334644 IP 10.0.2.15.57338 > 13.224.208.10.443: Flags [P.], seq 582:628, ack 5509, win 62780, length 46
22:04:35.334678 IP 10.0.2.15.57338 > 13.224.208.10.443: Flags [P.], seq 628:677, ack 5509, win 62780, length 49
22:04:35.334940 IP 13.224.208.10.443 > 10.0.2.15.57338: Flags [.], ack 628, win 65535, length 0
22:04:35.334941 IP 13.224.208.10.443 > 10.0.2.15.57338: Flags [.], ack 677, win 65535, length 0
22:04:35.334995 IP 10.0.2.15.57338 > 13.224.208.10.443: Flags [P.], seq 677:772, ack 5509, win 62780, length 95
22:04:35.335153 IP 13.224.208.10.443 > 10.0.2.15.57338: Flags [.], ack 772, win 65535, length 0
22:04:35.350499 IP 13.224.208.10.443 > 10.0.2.15.57338: Flags [P.], seq 5509:5580, ack 772, win 65535, length 71
22:04:35.350518 IP 10.0.2.15.57338 > 13.224.208.10.443: Flags [.], ack 5580, win 62780, length 0
22:04:35.350731 IP 10.0.2.15.57338 > 13.224.208.10.443: Flags [P.], seq 772:803, ack 5580, win 62780, length 31
22:04:35.350955 IP 13.224.208.10.443 > 10.0.2.15.57338: Flags [.], ack 803, win 65535, length 0
22:04:35.840872 IP 13.224.208.10.443 > 10.0.2.15.57338: Flags [.], seq 5580:14340, ack 803, win 65535, length 8760
22:04:35.840973 IP 10.0.2.15.57338 > 13.224.208.10.443: Flags [.], ack 14340, win 58400, length 0
22:04:35.841446 IP 13.224.208.10.443 > 10.0.2.15.57338: Flags [.], seq 14340:24560, ack 803, win 65535, length 10220
22:04:35.841611 IP 10.0.2.15.57338 > 13.224.208.10.443: Flags [.], ack 24560, win 51100, length 0
22:04:35.842098 IP 13.224.208.10.443 > 10.0.2.15.57338: Flags [.], seq 24560:36240, ack 803, win 65535, length 11680
22:04:35.842110 IP 10.0.2.15.57338 > 13.224.208.10.443: Flags [.], ack 36240, win 49640, length 0
22:04:35.842458 IP 13.224.208.10.443 > 10.0.2.15.57338: Flags [P.], seq 36240:47185, ack 803, win 65535, length 10945
22:04:35.842470 IP 10.0.2.15.57338 > 13.224.208.10.443: Flags [.], ack 47185, win 42340, length 0
22:04:35.856709 IP 13.224.208.10.443 > 10.0.2.15.57338: Flags [P.], seq 47185:55429, ack 803, win 65535, length 8244
22:04:35.856714 IP 13.224.208.10.443 > 10.0.2.15.57338: Flags [P.], seq 55429:60925, ack 803, win 65535, length 5496
22:04:35.856842 IP 10.0.2.15.57338 > 13.224.208.10.443: Flags [.], ack 55429, win 58400, length 0
22:04:35.856903 IP 10.0.2.15.57338 > 13.224.208.10.443: Flags [.], ack 60925, win 55480, length 0
22:04:35.857587 IP 13.224.208.10.443 > 10.0.2.15.57338: Flags [P.], seq 60925:62299, ack 803, win 65535, length 1374
22:04:35.857777 IP 10.0.2.15.57338 > 13.224.208.10.443: Flags [.], ack 62299, win 54106, length 0
22:04:35.858479 IP 13.224.208.10.443 > 10.0.2.15.57338: Flags [P.], seq 62299:69169, ack 803, win 65535, length 6870
22:04:35.858775 IP 10.0.2.15.57338 > 13.224.208.10.443: Flags [.], ack 69169, win 55480, length 0
22:04:35.859144 IP 13.224.208.10.443 > 10.0.2.15.57338: Flags [P.], seq 69169:78787, ack 803, win 65535, length 9618
22:04:35.859184 IP 10.0.2.15.57338 > 13.224.208.10.443: Flags [.], ack 78787, win 45862, length 0
22:04:35.859523 IP 13.224.208.10.443 > 10.0.2.15.57338: Flags [P.], seq 78787:84283, ack 803, win 65535, length 5496
22:04:35.859535 IP 10.0.2.15.57338 > 13.224.208.10.443: Flags [.], ack 84283, win 65535, length 0
22:04:35.861073 IP 13.224.208.10.443 > 10.0.2.15.57338: Flags [P.], seq 84283:89779, ack 803, win 65535, length 5496
22:04:35.861095 IP 10.0.2.15.57338 > 13.224.208.10.443: Flags [.], ack 89779, win 65535, length 0
22:04:35.861852 IP 13.224.208.10.443 > 10.0.2.15.57338: Flags [P.], seq 89779:92527, ack 803, win 65535, length 2748
22:04:35.861915 IP 10.0.2.15.57338 > 13.224.208.10.443: Flags [.], ack 92527, win 65535, length 0
22:04:35.862955 IP 13.224.208.10.443 > 10.0.2.15.57338: Flags [P.], seq 92527:96649, ack 803, win 65535, length 4122
22:04:35.862974 IP 10.0.2.15.57338 > 13.224.208.10.443: Flags [.], ack 96649, win 65535, length 0
22:04:35.870709 IP 13.224.208.10.443 > 10.0.2.15.57338: Flags [P.], seq 96649:103519, ack 803, win 65535, length 6870
22:04:35.870737 IP 10.0.2.15.57338 > 13.224.208.10.443: Flags [.], ack 103519, win 65535, length 0
22:04:35.871850 IP 13.224.208.10.443 > 10.0.2.15.57338: Flags [P.], seq 103519:110389, ack 803, win 65535, length 6870
22:04:35.871868 IP 10.0.2.15.57338 > 13.224.208.10.443: Flags [.], ack 110389, win 65535, length 0
22:04:35.872614 IP 13.224.208.10.443 > 10.0.2.15.57338: Flags [P.], seq 110389:115885, ack 803, win 65535, length 5496
22:04:35.872633 IP 10.0.2.15.57338 > 13.224.208.10.443: Flags [.], ack 115885, win 65535, length 0
22:04:35.872785 IP 13.224.208.10.443 > 10.0.2.15.57338: Flags [P.], seq 115885:118633, ack 803, win 65535, length 2748
22:04:35.872792 IP 10.0.2.15.57338 > 13.224.208.10.443: Flags [.], ack 118633, win 65535, length 0
22:04:35.875564 IP 13.224.208.10.443 > 10.0.2.15.57338: Flags [P.], seq 118633:132373, ack 803, win 65535, length 13740
22:04:35.875585 IP 10.0.2.15.57338 > 13.224.208.10.443: Flags [.], ack 132373, win 65535, length 0
22:04:35.875629 IP 13.224.208.10.443 > 10.0.2.15.57338: Flags [P.], seq 132373:135121, ack 803, win 65535, length 2748
22:04:35.875634 IP 10.0.2.15.57338 > 13.224.208.10.443: Flags [.], ack 135121, win 65535, length 0
22:04:35.876755 IP 13.224.208.10.443 > 10.0.2.15.57338: Flags [P.], seq 135121:144739, ack 803, win 65535, length 9618
22:04:35.876773 IP 10.0.2.15.57338 > 13.224.208.10.443: Flags [.], ack 144739, win 65535, length 0
22:04:35.878528 IP 13.224.208.10.443 > 10.0.2.15.57338: Flags [P.], seq 144739:148861, ack 803, win 65535, length 4122
22:04:35.878553 IP 10.0.2.15.57338 > 13.224.208.10.443: Flags [.], ack 148861, win 65535, length 0
22:04:35.879243 IP 13.224.208.10.443 > 10.0.2.15.57338: Flags [P.], seq 148861:150235, ack 803, win 65535, length 1374
22:04:35.879258 IP 10.0.2.15.57338 > 13.224.208.10.443: Flags [.], ack 150235, win 65535, length 0
22:04:35.884349 IP 13.224.208.10.443 > 10.0.2.15.57338: Flags [P.], seq 150235:157105, ack 803, win 65535, length 6870
22:04:35.884413 IP 10.0.2.15.57338 > 13.224.208.10.443: Flags [.], ack 157105, win 65535, length 0
22:04:35.884741 IP 13.224.208.10.443 > 10.0.2.15.57338: Flags [P.], seq 157105:158479, ack 803, win 65535, length 1374
22:04:35.884756 IP 10.0.2.15.57338 > 13.224.208.10.443: Flags [.], ack 158479, win 65535, length 0
22:04:35.885997 IP 13.224.208.10.443 > 10.0.2.15.57338: Flags [P.], seq 158479:165349, ack 803, win 65535, length 6870
22:04:35.886019 IP 10.0.2.15.57338 > 13.224.208.10.443: Flags [.], ack 165349, win 65535, length 0
22:04:35.886411 IP 13.224.208.10.443 > 10.0.2.15.57338: Flags [P.], seq 165349:169471, ack 803, win 65535, length 4122
22:04:35.886413 IP 13.224.208.10.443 > 10.0.2.15.57338: Flags [P.], seq 169471:173593, ack 803, win 65535, length 4122
22:04:35.886426 IP 10.0.2.15.57338 > 13.224.208.10.443: Flags [.], ack 169471, win 65535, length 0
22:04:35.886440 IP 10.0.2.15.57338 > 13.224.208.10.443: Flags [.], ack 173593, win 65535, length 0
22:04:35.886910 IP 13.224.208.10.443 > 10.0.2.15.57338: Flags [P.], seq 173593:176341, ack 803, win 65535, length 2748
22:04:35.886922 IP 10.0.2.15.57338 > 13.224.208.10.443: Flags [.], ack 176341, win 65535, length 0
22:04:35.889529 IP 13.224.208.10.443 > 10.0.2.15.57338: Flags [P.], seq 176341:198325, ack 803, win 65535, length 21984
22:04:35.889545 IP 10.0.2.15.57338 > 13.224.208.10.443: Flags [.], ack 198325, win 65535, length 0
22:04:35.889581 IP 13.224.208.10.443 > 10.0.2.15.57338: Flags [P.], seq 198325:199699, ack 803, win 65535, length 1374
22:04:35.889585 IP 10.0.2.15.57338 > 13.224.208.10.443: Flags [.], ack 199699, win 65535, length 0
22:04:35.890766 IP 13.224.208.10.443 > 10.0.2.15.57338: Flags [P.], seq 199699:212065, ack 803, win 65535, length 12366
22:04:35.890785 IP 10.0.2.15.57338 > 13.224.208.10.443: Flags [.], ack 212065, win 65535, length 0
22:04:35.890834 IP 13.224.208.10.443 > 10.0.2.15.57338: Flags [P.], seq 212065:216187, ack 803, win 65535, length 4122
22:04:35.890835 IP 13.224.208.10.443 > 10.0.2.15.57338: Flags [P.], seq 216187:217561, ack 803, win 65535, length 1374
22:04:35.890844 IP 10.0.2.15.57338 > 13.224.208.10.443: Flags [.], ack 216187, win 65535, length 0
22:04:35.890860 IP 10.0.2.15.57338 > 13.224.208.10.443: Flags [.], ack 217561, win 65535, length 0
22:04:35.892697 IP 13.224.208.10.443 > 10.0.2.15.57338: Flags [P.], seq 217561:220309, ack 803, win 65535, length 2748
22:04:35.892714 IP 10.0.2.15.57338 > 13.224.208.10.443: Flags [.], ack 220309, win 65535, length 0
22:04:35.895511 IP 13.224.208.10.443 > 10.0.2.15.57338: Flags [P.], seq 220309:249163, ack 803, win 65535, length 28854
22:04:35.895542 IP 10.0.2.15.57338 > 13.224.208.10.443: Flags [.], ack 249163, win 65535, length 0
22:04:35.895683 IP 13.224.208.10.443 > 10.0.2.15.57338: Flags [P.], seq 249163:253285, ack 803, win 65535, length 4122
22:04:35.895727 IP 10.0.2.15.57338 > 13.224.208.10.443: Flags [.], ack 253285, win 65535, length 0
22:04:35.896210 IP 13.224.208.10.443 > 10.0.2.15.57338: Flags [P.], seq 253285:254659, ack 803, win 65535, length 1374
22:04:35.896229 IP 10.0.2.15.57338 > 13.224.208.10.443: Flags [.], ack 254659, win 65535, length 0
22:04:35.897301 IP 13.224.208.10.443 > 10.0.2.15.57338: Flags [P.], seq 254659:260155, ack 803, win 65535, length 5496
22:04:35.897320 IP 10.0.2.15.57338 > 13.224.208.10.443: Flags [.], ack 260155, win 65535, length 0
22:04:35.897414 IP 13.224.208.10.443 > 10.0.2.15.57338: Flags [P.], seq 260155:265651, ack 803, win 65535, length 5496
22:04:35.897420 IP 10.0.2.15.57338 > 13.224.208.10.443: Flags [.], ack 265651, win 65535, length 0
22:04:35.898889 IP 13.224.208.10.443 > 10.0.2.15.57338: Flags [P.], seq 265651:267025, ack 803, win 65535, length 1374
22:04:35.898909 IP 10.0.2.15.57338 > 13.224.208.10.443: Flags [.], ack 267025, win 65535, length 0
22:04:35.899490 IP 13.224.208.10.443 > 10.0.2.15.57338: Flags [P.], seq 267025:272521, ack 803, win 65535, length 5496
22:04:35.899493 IP 13.224.208.10.443 > 10.0.2.15.57338: Flags [P.], seq 272521:275269, ack 803, win 65535, length 2748
22:04:35.899509 IP 10.0.2.15.57338 > 13.224.208.10.443: Flags [.], ack 272521, win 65535, length 0
22:04:35.899538 IP 10.0.2.15.57338 > 13.224.208.10.443: Flags [.], ack 275269, win 65535, length 0
22:04:35.899702 IP 13.224.208.10.443 > 10.0.2.15.57338: Flags [P.], seq 275269:276643, ack 803, win 65535, length 1374
22:04:35.899712 IP 10.0.2.15.57338 > 13.224.208.10.443: Flags [.], ack 276643, win 65535, length 0
22:04:35.900838 IP 13.224.208.10.443 > 10.0.2.15.57338: Flags [P.], seq 276643:286261, ack 803, win 65535, length 9618
22:04:35.900841 IP 13.224.208.10.443 > 10.0.2.15.57338: Flags [P.], seq 286261:287635, ack 803, win 65535, length 1374
22:04:35.900862 IP 10.0.2.15.57338 > 13.224.208.10.443: Flags [.], ack 286261, win 65535, length 0
22:04:35.900903 IP 10.0.2.15.57338 > 13.224.208.10.443: Flags [.], ack 287635, win 65535, length 0
22:04:35.903609 IP 13.224.208.10.443 > 10.0.2.15.57338: Flags [P.], seq 287635:306871, ack 803, win 65535, length 19236
22:04:35.903629 IP 10.0.2.15.57338 > 13.224.208.10.443: Flags [.], ack 306871, win 65535, length 0
22:04:35.903684 IP 13.224.208.10.443 > 10.0.2.15.57338: Flags [P.], seq 306871:309619, ack 803, win 65535, length 2748
22:04:35.903685 IP 13.224.208.10.443 > 10.0.2.15.57338: Flags [P.], seq 309619:313741, ack 803, win 65535, length 4122
22:04:35.903686 IP 13.224.208.10.443 > 10.0.2.15.57338: Flags [P.], seq 313741:315115, ack 803, win 65535, length 1374
22:04:35.903696 IP 10.0.2.15.57338 > 13.224.208.10.443: Flags [.], ack 309619, win 65535, length 0
22:04:35.903751 IP 10.0.2.15.57338 > 13.224.208.10.443: Flags [.], ack 313741, win 65535, length 0
22:04:35.903773 IP 10.0.2.15.57338 > 13.224.208.10.443: Flags [.], ack 315115, win 65535, length 0
22:04:35.905022 IP 13.224.208.10.443 > 10.0.2.15.57338: Flags [P.], seq 315115:327481, ack 803, win 65535, length 12366
22:04:35.905039 IP 10.0.2.15.57338 > 13.224.208.10.443: Flags [.], ack 327481, win 65535, length 0
22:04:35.905829 IP 13.224.208.10.443 > 10.0.2.15.57338: Flags [P.], seq 327481:332977, ack 803, win 65535, length 5496
22:04:35.905831 IP 13.224.208.10.443 > 10.0.2.15.57338: Flags [P.], seq 332977:338473, ack 803, win 65535, length 5496
22:04:35.905846 IP 10.0.2.15.57338 > 13.224.208.10.443: Flags [.], ack 332977, win 65535, length 0
22:04:35.905895 IP 10.0.2.15.57338 > 13.224.208.10.443: Flags [.], ack 338473, win 65535, length 0
22:04:35.905920 IP 13.224.208.10.443 > 10.0.2.15.57338: Flags [P.], seq 338473:341221, ack 803, win 65535, length 2748
22:04:35.905926 IP 10.0.2.15.57338 > 13.224.208.10.443: Flags [.], ack 341221, win 65535, length 0
22:04:35.906360 IP 13.224.208.10.443 > 10.0.2.15.57338: Flags [P.], seq 341221:345343, ack 803, win 65535, length 4122
22:04:35.906404 IP 10.0.2.15.57338 > 13.224.208.10.443: Flags [.], ack 345343, win 65535, length 0
22:04:35.906705 IP 13.224.208.10.443 > 10.0.2.15.57338: Flags [P.], seq 345343:352213, ack 803, win 65535, length 6870
22:04:35.906707 IP 13.224.208.10.443 > 10.0.2.15.57338: Flags [P.], seq 352213:357709, ack 803, win 65535, length 5496
22:04:35.906719 IP 10.0.2.15.57338 > 13.224.208.10.443: Flags [.], ack 352213, win 65535, length 0
22:04:35.906738 IP 10.0.2.15.57338 > 13.224.208.10.443: Flags [.], ack 357709, win 65535, length 0
22:04:35.906937 IP 13.224.208.10.443 > 10.0.2.15.57338: Flags [P.], seq 357709:361831, ack 803, win 65535, length 4122
22:04:35.906949 IP 10.0.2.15.57338 > 13.224.208.10.443: Flags [.], ack 361831, win 65535, length 0
22:04:35.907683 IP 13.224.208.10.443 > 10.0.2.15.57338: Flags [P.], seq 361831:365953, ack 803, win 65535, length 4122
22:04:35.907739 IP 10.0.2.15.57338 > 13.224.208.10.443: Flags [.], ack 365953, win 65535, length 0
22:04:35.907950 IP 13.224.208.10.443 > 10.0.2.15.57338: Flags [P.], seq 365953:370075, ack 803, win 65535, length 4122
22:04:35.907984 IP 10.0.2.15.57338 > 13.224.208.10.443: Flags [.], ack 370075, win 65535, length 0
22:04:35.908494 IP 13.224.208.10.443 > 10.0.2.15.57338: Flags [.], seq 370075:374455, ack 803, win 65535, length 4380
22:04:35.909579 IP 13.224.208.10.443 > 10.0.2.15.57338: Flags [P.], seq 374455:378319, ack 803, win 65535, length 3864
22:04:35.909583 IP 13.224.208.10.443 > 10.0.2.15.57338: Flags [P.], seq 378319:383815, ack 803, win 65535, length 5496
22:04:35.909647 IP 10.0.2.15.57338 > 13.224.208.10.443: Flags [.], ack 383815, win 65535, length 0
22:04:35.910063 IP 13.224.208.10.443 > 10.0.2.15.57338: Flags [P.], seq 383815:385189, ack 803, win 65535, length 1374
22:04:35.910066 IP 13.224.208.10.443 > 10.0.2.15.57338: Flags [P.], seq 385189:389311, ack 803, win 65535, length 4122
22:04:35.910093 IP 10.0.2.15.57338 > 13.224.208.10.443: Flags [.], ack 389311, win 65535, length 0
22:04:35.913162 IP 13.224.208.10.443 > 10.0.2.15.57338: Flags [P.], seq 389311:409921, ack 803, win 65535, length 20610
22:04:35.913178 IP 10.0.2.15.57338 > 13.224.208.10.443: Flags [.], ack 409921, win 65535, length 0
22:04:35.913235 IP 13.224.208.10.443 > 10.0.2.15.57338: Flags [P.], seq 409921:415417, ack 803, win 65535, length 5496
22:04:35.913239 IP 10.0.2.15.57338 > 13.224.208.10.443: Flags [.], ack 415417, win 65535, length 0
22:04:35.915730 IP 13.224.208.10.443 > 10.0.2.15.57338: Flags [.], seq 415417:446077, ack 803, win 65535, length 30660
22:04:35.915751 IP 10.0.2.15.57338 > 13.224.208.10.443: Flags [.], ack 446077, win 65535, length 0
22:04:35.915862 IP 13.224.208.10.443 > 10.0.2.15.57338: Flags [P.], seq 446077:459385, ack 803, win 65535, length 13308
22:04:35.915870 IP 10.0.2.15.57338 > 13.224.208.10.443: Flags [.], ack 459385, win 65535, length 0
22:04:35.916044 IP 13.224.208.10.443 > 10.0.2.15.57338: Flags [P.], seq 459385:460759, ack 803, win 65535, length 1374
22:04:35.916051 IP 10.0.2.15.57338 > 13.224.208.10.443: Flags [.], ack 460759, win 65535, length 0
22:04:35.918124 IP 13.224.208.10.443 > 10.0.2.15.57338: Flags [P.], seq 460759:462133, ack 803, win 65535, length 1374
22:04:35.918127 IP 13.224.208.10.443 > 10.0.2.15.57338: Flags [P.], seq 462133:467629, ack 803, win 65535, length 5496
22:04:35.918128 IP 13.224.208.10.443 > 10.0.2.15.57338: Flags [P.], seq 467629:470377, ack 803, win 65535, length 2748
22:04:35.918151 IP 10.0.2.15.57338 > 13.224.208.10.443: Flags [.], ack 462133, win 65535, length 0
22:04:35.918222 IP 10.0.2.15.57338 > 13.224.208.10.443: Flags [.], ack 467629, win 65535, length 0
22:04:35.918237 IP 10.0.2.15.57338 > 13.224.208.10.443: Flags [.], ack 470377, win 65535, length 0
22:04:35.918430 IP 13.224.208.10.443 > 10.0.2.15.57338: Flags [.], seq 470377:477677, ack 803, win 65535, length 7300
22:04:35.918440 IP 10.0.2.15.57338 > 13.224.208.10.443: Flags [.], ack 477677, win 65535, length 0

