22:03:46.367805 IP 10.0.2.15.56506 > 140.233.253.2.53: 44193+ A? www.imdb.com. (30)
22:03:46.367835 IP 10.0.2.15.56506 > 140.233.253.2.53: 5029+ AAAA? www.imdb.com. (30)
22:03:51.372518 IP 10.0.2.15.37711 > 140.233.253.3.53: 44193+ A? www.imdb.com. (30)
22:03:51.372560 IP 10.0.2.15.37711 > 140.233.253.3.53: 5029+ AAAA? www.imdb.com. (30)
22:03:51.442965 IP 140.233.253.3.53 > 10.0.2.15.37711: 5029 2/1/0 CNAME tp.391b988c0-frontier.imdb.com., CNAME d2bytcopxu066p.cloudfront.net. (191)
22:03:51.442967 IP 140.233.253.3.53 > 10.0.2.15.37711: 44193 3/0/0 CNAME tp.391b988c0-frontier.imdb.com., CNAME d2bytcopxu066p.cloudfront.net., A 13.225.58.227 (125)
22:03:51.443501 IP 10.0.2.15.57482 > 13.225.58.227.443: Flags [S], seq 2671439607, win 64240, options [mss 1460,sackOK,TS val 936737142 ecr 0,nop,wscale 6], length 0
22:03:51.457716 IP 13.225.58.227.443 > 10.0.2.15.57482: Flags [S.], seq 294656001, ack 2671439608, win 65535, options [mss 1460], length 0
22:03:51.457769 IP 10.0.2.15.57482 > 13.225.58.227.443: Flags [.], ack 1, win 64240, length 0
22:03:51.475979 IP 10.0.2.15.57482 > 13.225.58.227.443: Flags [P.], seq 1:518, ack 1, win 64240, length 517
22:03:51.476434 IP 13.225.58.227.443 > 10.0.2.15.57482: Flags [.], ack 518, win 65535, length 0
22:03:51.491702 IP 13.225.58.227.443 > 10.0.2.15.57482: Flags [P.], seq 1:2749, ack 518, win 65535, length 2748
22:03:51.491728 IP 10.0.2.15.57482 > 13.225.58.227.443: Flags [.], ack 2749, win 62780, length 0
22:03:51.492502 IP 13.225.58.227.443 > 10.0.2.15.57482: Flags [P.], seq 2749:5509, ack 518, win 65535, length 2760
22:03:51.492530 IP 10.0.2.15.57482 > 13.225.58.227.443: Flags [.], ack 5509, win 61320, length 0
22:03:51.493804 IP 10.0.2.15.57482 > 13.225.58.227.443: Flags [P.], seq 518:582, ack 5509, win 62780, length 64
22:03:51.494211 IP 13.225.58.227.443 > 10.0.2.15.57482: Flags [.], ack 582, win 65535, length 0
22:03:51.494434 IP 10.0.2.15.57482 > 13.225.58.227.443: Flags [P.], seq 582:628, ack 5509, win 62780, length 46
22:03:51.494484 IP 10.0.2.15.57482 > 13.225.58.227.443: Flags [P.], seq 628:677, ack 5509, win 62780, length 49
22:03:51.494821 IP 10.0.2.15.57482 > 13.225.58.227.443: Flags [P.], seq 677:712, ack 5509, win 62780, length 35
22:03:51.494966 IP 13.225.58.227.443 > 10.0.2.15.57482: Flags [.], ack 628, win 65535, length 0
22:03:51.494967 IP 13.225.58.227.443 > 10.0.2.15.57482: Flags [.], ack 677, win 65535, length 0
22:03:51.495066 IP 10.0.2.15.57482 > 13.225.58.227.443: Flags [P.], seq 712:772, ack 5509, win 62780, length 60
22:03:51.495473 IP 13.225.58.227.443 > 10.0.2.15.57482: Flags [.], ack 712, win 65535, length 0
22:03:51.495518 IP 13.225.58.227.443 > 10.0.2.15.57482: Flags [.], ack 772, win 65535, length 0
22:03:51.506605 IP 13.225.58.227.443 > 10.0.2.15.57482: Flags [P.], seq 5509:5571, ack 772, win 65535, length 62
22:03:51.506627 IP 10.0.2.15.57482 > 13.225.58.227.443: Flags [.], ack 5571, win 62780, length 0
22:03:51.506886 IP 10.0.2.15.57482 > 13.225.58.227.443: Flags [P.], seq 772:803, ack 5571, win 62780, length 31
22:03:51.507226 IP 13.225.58.227.443 > 10.0.2.15.57482: Flags [.], ack 803, win 65535, length 0
22:03:51.507377 IP 13.225.58.227.443 > 10.0.2.15.57482: Flags [P.], seq 5571:5602, ack 803, win 65535, length 31
22:03:51.507389 IP 10.0.2.15.57482 > 13.225.58.227.443: Flags [.], ack 5602, win 62780, length 0
22:03:52.015063 IP 13.225.58.227.443 > 10.0.2.15.57482: Flags [.], seq 5602:14362, ack 803, win 65535, length 8760
22:03:52.015221 IP 10.0.2.15.57482 > 13.225.58.227.443: Flags [.], ack 14362, win 58400, length 0
22:03:52.015841 IP 13.225.58.227.443 > 10.0.2.15.57482: Flags [.], seq 14362:24582, ack 803, win 65535, length 10220
22:03:52.015864 IP 10.0.2.15.57482 > 13.225.58.227.443: Flags [.], ack 24582, win 52560, length 0
22:03:52.016061 IP 13.225.58.227.443 > 10.0.2.15.57482: Flags [.], seq 24582:36262, ack 803, win 65535, length 11680
22:03:52.016075 IP 10.0.2.15.57482 > 13.225.58.227.443: Flags [.], ack 36262, win 43800, length 0
22:03:52.016323 IP 13.225.58.227.443 > 10.0.2.15.57482: Flags [P.], seq 36262:49218, ack 803, win 65535, length 12956
22:03:52.016457 IP 10.0.2.15.57482 > 13.225.58.227.443: Flags [.], ack 49218, win 35040, length 0
22:03:52.019122 IP 13.225.58.227.443 > 10.0.2.15.57482: Flags [P.], seq 49218:50592, ack 803, win 65535, length 1374
22:03:52.019221 IP 10.0.2.15.57482 > 13.225.58.227.443: Flags [.], ack 50592, win 62780, length 0
22:03:52.032553 IP 13.225.58.227.443 > 10.0.2.15.57482: Flags [P.], seq 50592:54714, ack 803, win 65535, length 4122
22:03:52.032557 IP 13.225.58.227.443 > 10.0.2.15.57482: Flags [.], seq 54714:66394, ack 803, win 65535, length 11680
22:03:52.033161 IP 10.0.2.15.57482 > 13.225.58.227.443: Flags [.], ack 66394, win 54020, length 0
22:03:52.034411 IP 13.225.58.227.443 > 10.0.2.15.57482: Flags [.], seq 66394:83914, ack 803, win 65535, length 17520
22:03:52.034510 IP 10.0.2.15.57482 > 13.225.58.227.443: Flags [.], ack 83914, win 62780, length 0
22:03:52.035951 IP 13.225.58.227.443 > 10.0.2.15.57482: Flags [P.], seq 83914:93186, ack 803, win 65535, length 9272
22:03:52.035975 IP 10.0.2.15.57482 > 13.225.58.227.443: Flags [.], ack 93186, win 65535, length 0
22:03:52.041388 IP 13.225.58.227.443 > 10.0.2.15.57482: Flags [P.], seq 93186:97308, ack 803, win 65535, length 4122
22:03:52.041477 IP 10.0.2.15.57482 > 13.225.58.227.443: Flags [.], ack 97308, win 65535, length 0
22:03:52.042049 IP 13.225.58.227.443 > 10.0.2.15.57482: Flags [P.], seq 97308:104178, ack 803, win 65535, length 6870
22:03:52.042053 IP 13.225.58.227.443 > 10.0.2.15.57482: Flags [.], seq 104178:105638, ack 803, win 65535, length 1460
22:03:52.042076 IP 10.0.2.15.57482 > 13.225.58.227.443: Flags [.], ack 104178, win 65535, length 0
22:03:52.042132 IP 10.0.2.15.57482 > 13.225.58.227.443: Flags [.], ack 105638, win 65535, length 0
22:03:52.042887 IP 13.225.58.227.443 > 10.0.2.15.57482: Flags [P.], seq 105638:111048, ack 803, win 65535, length 5410
22:03:52.042912 IP 10.0.2.15.57482 > 13.225.58.227.443: Flags [.], ack 111048, win 65535, length 0
22:03:52.044448 IP 13.225.58.227.443 > 10.0.2.15.57482: Flags [P.], seq 111048:122040, ack 803, win 65535, length 10992
22:03:52.044512 IP 10.0.2.15.57482 > 13.225.58.227.443: Flags [.], ack 122040, win 65535, length 0
22:03:52.045238 IP 13.225.58.227.443 > 10.0.2.15.57482: Flags [P.], seq 122040:131658, ack 803, win 65535, length 9618
22:03:52.045241 IP 13.225.58.227.443 > 10.0.2.15.57482: Flags [P.], seq 131658:137154, ack 803, win 65535, length 5496
22:03:52.045367 IP 10.0.2.15.57482 > 13.225.58.227.443: Flags [.], ack 131658, win 65535, length 0
22:03:52.045400 IP 10.0.2.15.57482 > 13.225.58.227.443: Flags [.], ack 137154, win 65535, length 0
22:03:52.054593 IP 13.225.58.227.443 > 10.0.2.15.57482: Flags [P.], seq 137154:145398, ack 803, win 65535, length 8244
22:03:52.054598 IP 13.225.58.227.443 > 10.0.2.15.57482: Flags [P.], seq 145398:156390, ack 803, win 65535, length 10992
22:03:52.054626 IP 10.0.2.15.57482 > 13.225.58.227.443: Flags [.], ack 145398, win 65535, length 0
22:03:52.054675 IP 10.0.2.15.57482 > 13.225.58.227.443: Flags [.], ack 156390, win 65535, length 0
22:03:52.056047 IP 13.225.58.227.443 > 10.0.2.15.57482: Flags [P.], seq 156390:161886, ack 803, win 65535, length 5496
22:03:52.056049 IP 13.225.58.227.443 > 10.0.2.15.57482: Flags [P.], seq 161886:164634, ack 803, win 65535, length 2748
22:03:52.056136 IP 10.0.2.15.57482 > 13.225.58.227.443: Flags [.], ack 161886, win 65535, length 0
22:03:52.056163 IP 10.0.2.15.57482 > 13.225.58.227.443: Flags [.], ack 164634, win 65535, length 0
22:03:52.060701 IP 13.225.58.227.443 > 10.0.2.15.57482: Flags [P.], seq 164634:172878, ack 803, win 65535, length 8244
22:03:52.060707 IP 13.225.58.227.443 > 10.0.2.15.57482: Flags [P.], seq 172878:190740, ack 803, win 65535, length 17862
22:03:52.060734 IP 10.0.2.15.57482 > 13.225.58.227.443: Flags [.], ack 172878, win 65535, length 0
22:03:52.064609 IP 10.0.2.15.57482 > 13.225.58.227.443: Flags [.], ack 190740, win 65535, length 0
22:03:52.064972 IP 13.225.58.227.443 > 10.0.2.15.57482: Flags [P.], seq 190740:193488, ack 803, win 65535, length 2748
22:03:52.064975 IP 13.225.58.227.443 > 10.0.2.15.57482: Flags [P.], seq 193488:196236, ack 803, win 65535, length 2748
22:03:52.064979 IP 13.225.58.227.443 > 10.0.2.15.57482: Flags [.], seq 196236:210836, ack 803, win 65535, length 14600
22:03:52.064999 IP 10.0.2.15.57482 > 13.225.58.227.443: Flags [.], ack 193488, win 65535, length 0
22:03:52.065014 IP 10.0.2.15.57482 > 13.225.58.227.443: Flags [.], ack 196236, win 65535, length 0
22:03:52.065027 IP 10.0.2.15.57482 > 13.225.58.227.443: Flags [.], ack 210836, win 65535, length 0
22:03:52.068397 IP 13.225.58.227.443 > 10.0.2.15.57482: Flags [P.], seq 210836:216846, ack 803, win 65535, length 6010
22:03:52.068408 IP 13.225.58.227.443 > 10.0.2.15.57482: Flags [P.], seq 216846:251196, ack 803, win 65535, length 34350
22:03:52.068500 IP 10.0.2.15.57482 > 13.225.58.227.443: Flags [.], ack 216846, win 65535, length 0
22:03:52.068693 IP 10.0.2.15.57482 > 13.225.58.227.443: Flags [.], ack 251196, win 65535, length 0
22:03:52.070833 IP 13.225.58.227.443 > 10.0.2.15.57482: Flags [P.], seq 251196:267684, ack 803, win 65535, length 16488
22:03:52.071091 IP 10.0.2.15.57482 > 13.225.58.227.443: Flags [.], ack 267684, win 65535, length 0
22:03:52.071205 IP 13.225.58.227.443 > 10.0.2.15.57482: Flags [P.], seq 267684:271806, ack 803, win 65535, length 4122
22:03:52.071207 IP 13.225.58.227.443 > 10.0.2.15.57482: Flags [P.], seq 271806:278676, ack 803, win 65535, length 6870
22:03:52.071222 IP 10.0.2.15.57482 > 13.225.58.227.443: Flags [.], ack 271806, win 65535, length 0
22:03:52.071237 IP 10.0.2.15.57482 > 13.225.58.227.443: Flags [.], ack 278676, win 65535, length 0
22:03:52.071256 IP 13.225.58.227.443 > 10.0.2.15.57482: Flags [P.], seq 278676:282798, ack 803, win 65535, length 4122
22:03:52.071257 IP 13.225.58.227.443 > 10.0.2.15.57482: Flags [P.], seq 282798:286920, ack 803, win 65535, length 4122
22:03:52.071264 IP 10.0.2.15.57482 > 13.225.58.227.443: Flags [.], ack 282798, win 65535, length 0
22:03:52.071274 IP 10.0.2.15.57482 > 13.225.58.227.443: Flags [.], ack 286920, win 65535, length 0
22:03:52.071820 IP 13.225.58.227.443 > 10.0.2.15.57482: Flags [P.], seq 286920:293790, ack 803, win 65535, length 6870
22:03:52.071841 IP 10.0.2.15.57482 > 13.225.58.227.443: Flags [.], ack 293790, win 65535, length 0
22:03:52.076097 IP 13.225.58.227.443 > 10.0.2.15.57482: Flags [P.], seq 293790:328140, ack 803, win 65535, length 34350
22:03:52.076126 IP 10.0.2.15.57482 > 13.225.58.227.443: Flags [.], ack 328140, win 65535, length 0
22:03:52.076543 IP 13.225.58.227.443 > 10.0.2.15.57482: Flags [.], seq 328140:332520, ack 803, win 65535, length 4380
22:03:52.076563 IP 10.0.2.15.57482 > 13.225.58.227.443: Flags [.], ack 332520, win 65535, length 0
22:03:52.076713 IP 13.225.58.227.443 > 10.0.2.15.57482: Flags [.], seq 332520:351500, ack 803, win 65535, length 18980
22:03:52.076728 IP 10.0.2.15.57482 > 13.225.58.227.443: Flags [.], ack 351500, win 65535, length 0
22:03:52.076959 IP 13.225.58.227.443 > 10.0.2.15.57482: Flags [.], seq 351500:354420, ack 803, win 65535, length 2920
22:03:52.076973 IP 10.0.2.15.57482 > 13.225.58.227.443: Flags [.], ack 354420, win 65535, length 0
22:03:52.077145 IP 13.225.58.227.443 > 10.0.2.15.57482: Flags [P.], seq 354420:362490, ack 803, win 65535, length 8070
22:03:52.077147 IP 13.225.58.227.443 > 10.0.2.15.57482: Flags [P.], seq 362490:366612, ack 803, win 65535, length 4122
22:03:52.077162 IP 10.0.2.15.57482 > 13.225.58.227.443: Flags [.], ack 362490, win 65535, length 0
22:03:52.077216 IP 10.0.2.15.57482 > 13.225.58.227.443: Flags [.], ack 366612, win 65535, length 0
22:03:52.081060 IP 13.225.58.227.443 > 10.0.2.15.57482: Flags [P.], seq 366612:394092, ack 803, win 65535, length 27480
22:03:52.081087 IP 10.0.2.15.57482 > 13.225.58.227.443: Flags [.], ack 394092, win 65535, length 0
22:03:52.085023 IP 13.225.58.227.443 > 10.0.2.15.57482: Flags [P.], seq 394092:400962, ack 803, win 65535, length 6870
22:03:52.085033 IP 13.225.58.227.443 > 10.0.2.15.57482: Flags [P.], seq 400962:459362, ack 803, win 65535, length 58400
22:03:52.085054 IP 10.0.2.15.57482 > 13.225.58.227.443: Flags [.], ack 400962, win 65535, length 0
22:03:52.085072 IP 10.0.2.15.57482 > 13.225.58.227.443: Flags [.], ack 459362, win 65535, length 0
22:03:52.085287 IP 13.225.58.227.443 > 10.0.2.15.57482: Flags [.], seq 459362:479802, ack 803, win 65535, length 20440
22:03:52.085298 IP 10.0.2.15.57482 > 13.225.58.227.443: Flags [.], ack 479802, win 65535, length 0
22:03:52.085794 IP 13.225.58.227.443 > 10.0.2.15.57482: Flags [P.], seq 479802:493020, ack 803, win 65535, length 13218
22:03:52.085809 IP 10.0.2.15.57482 > 13.225.58.227.443: Flags [.], ack 493020, win 65535, length 0
22:03:52.087323 IP 13.225.58.227.443 > 10.0.2.15.57482: Flags [P.], seq 493020:498516, ack 803, win 65535, length 5496
22:03:52.087326 IP 13.225.58.227.443 > 10.0.2.15.57482: Flags [P.], seq 498516:501264, ack 803, win 65535, length 2748
22:03:52.087327 IP 13.225.58.227.443 > 10.0.2.15.57482: Flags [P.], seq 501264:505386, ack 803, win 65535, length 4122
22:03:52.087639 IP 10.0.2.15.57482 > 13.225.58.227.443: Flags [.], ack 498516, win 65535, length 0
22:03:52.087666 IP 10.0.2.15.57482 > 13.225.58.227.443: Flags [.], ack 501264, win 65535, length 0
22:03:52.087677 IP 10.0.2.15.57482 > 13.225.58.227.443: Flags [.], ack 505386, win 65535, length 0

