22:05:24.158501 IP 10.0.2.15.35573 > 140.233.253.2.53: 49129+ A? www.imdb.com. (30)
22:05:24.158538 IP 10.0.2.15.35573 > 140.233.253.2.53: 38636+ AAAA? www.imdb.com. (30)
22:05:24.164842 IP 140.233.253.2.53 > 10.0.2.15.35573: 49129 3/0/0 CNAME tp.391b988c0-frontier.imdb.com., CNAME d2bytcopxu066p.cloudfront.net., A 13.224.208.10 (125)
22:05:24.164844 IP 140.233.253.2.53 > 10.0.2.15.35573: 38636 2/1/0 CNAME tp.391b988c0-frontier.imdb.com., CNAME d2bytcopxu066p.cloudfront.net. (191)
22:05:24.165446 IP 10.0.2.15.57354 > 13.224.208.10.443: Flags [S], seq 2232218025, win 64240, options [mss 1460,sackOK,TS val 3642742755 ecr 0,nop,wscale 6], length 0
22:05:24.181430 IP 13.224.208.10.443 > 10.0.2.15.57354: Flags [S.], seq 297792001, ack 2232218026, win 65535, options [mss 1460], length 0
22:05:24.181548 IP 10.0.2.15.57354 > 13.224.208.10.443: Flags [.], ack 1, win 64240, length 0
22:05:24.190185 IP 10.0.2.15.57354 > 13.224.208.10.443: Flags [P.], seq 1:518, ack 1, win 64240, length 517
22:05:24.190591 IP 13.224.208.10.443 > 10.0.2.15.57354: Flags [.], ack 518, win 65535, length 0
22:05:24.207396 IP 13.224.208.10.443 > 10.0.2.15.57354: Flags [P.], seq 1:2749, ack 518, win 65535, length 2748
22:05:24.207419 IP 10.0.2.15.57354 > 13.224.208.10.443: Flags [.], ack 2749, win 62780, length 0
22:05:24.208456 IP 13.224.208.10.443 > 10.0.2.15.57354: Flags [P.], seq 2749:4123, ack 518, win 65535, length 1374
22:05:24.208542 IP 10.0.2.15.57354 > 13.224.208.10.443: Flags [.], ack 4123, win 61406, length 0
22:05:24.209536 IP 13.224.208.10.443 > 10.0.2.15.57354: Flags [P.], seq 4123:5497, ack 518, win 65535, length 1374
22:05:24.209555 IP 10.0.2.15.57354 > 13.224.208.10.443: Flags [.], ack 5497, win 61406, length 0
22:05:24.212082 IP 13.224.208.10.443 > 10.0.2.15.57354: Flags [P.], seq 5497:5509, ack 518, win 65535, length 12
22:05:24.212101 IP 10.0.2.15.57354 > 13.224.208.10.443: Flags [.], ack 5509, win 63204, length 0
22:05:24.212325 IP 10.0.2.15.57354 > 13.224.208.10.443: Flags [P.], seq 518:582, ack 5509, win 63204, length 64
22:05:24.212547 IP 13.224.208.10.443 > 10.0.2.15.57354: Flags [.], ack 582, win 65535, length 0
22:05:24.212579 IP 10.0.2.15.57354 > 13.224.208.10.443: Flags [P.], seq 582:628, ack 5509, win 63204, length 46
22:05:24.212599 IP 10.0.2.15.57354 > 13.224.208.10.443: Flags [P.], seq 628:677, ack 5509, win 63204, length 49
22:05:24.212732 IP 13.224.208.10.443 > 10.0.2.15.57354: Flags [.], ack 628, win 65535, length 0
22:05:24.212741 IP 10.0.2.15.57354 > 13.224.208.10.443: Flags [P.], seq 677:772, ack 5509, win 63204, length 95
22:05:24.213068 IP 13.224.208.10.443 > 10.0.2.15.57354: Flags [.], ack 677, win 65535, length 0
22:05:24.213069 IP 13.224.208.10.443 > 10.0.2.15.57354: Flags [.], ack 772, win 65535, length 0
22:05:24.227602 IP 13.224.208.10.443 > 10.0.2.15.57354: Flags [P.], seq 5509:5580, ack 772, win 65535, length 71
22:05:24.227623 IP 10.0.2.15.57354 > 13.224.208.10.443: Flags [.], ack 5580, win 63204, length 0
22:05:24.227980 IP 10.0.2.15.57354 > 13.224.208.10.443: Flags [P.], seq 772:803, ack 5580, win 63204, length 31
22:05:24.228272 IP 13.224.208.10.443 > 10.0.2.15.57354: Flags [.], ack 803, win 65535, length 0
22:05:24.656457 IP 13.224.208.10.443 > 10.0.2.15.57354: Flags [P.], seq 5580:12450, ack 803, win 65535, length 6870
22:05:24.656461 IP 13.224.208.10.443 > 10.0.2.15.57354: Flags [.], seq 12450:15370, ack 803, win 65535, length 2920
22:05:24.656504 IP 10.0.2.15.57354 > 13.224.208.10.443: Flags [.], ack 12450, win 59860, length 0
22:05:24.656616 IP 10.0.2.15.57354 > 13.224.208.10.443: Flags [.], ack 15370, win 58400, length 0
22:05:24.657645 IP 13.224.208.10.443 > 10.0.2.15.57354: Flags [.], seq 15370:18290, ack 803, win 65535, length 2920
22:05:24.657666 IP 10.0.2.15.57354 > 13.224.208.10.443: Flags [.], ack 18290, win 62780, length 0
22:05:24.657990 IP 13.224.208.10.443 > 10.0.2.15.57354: Flags [.], seq 18290:32890, ack 803, win 65535, length 14600
22:05:24.658012 IP 10.0.2.15.57354 > 13.224.208.10.443: Flags [.], ack 32890, win 55480, length 0
22:05:24.658221 IP 13.224.208.10.443 > 10.0.2.15.57354: Flags [P.], seq 32890:48054, ack 803, win 65535, length 15164
22:05:24.658286 IP 10.0.2.15.57354 > 13.224.208.10.443: Flags [.], ack 48054, win 40316, length 0
22:05:24.671569 IP 13.224.208.10.443 > 10.0.2.15.57354: Flags [P.], seq 48054:57672, ack 803, win 65535, length 9618
22:05:24.671596 IP 10.0.2.15.57354 > 13.224.208.10.443: Flags [.], ack 57672, win 58400, length 0
22:05:24.672630 IP 13.224.208.10.443 > 10.0.2.15.57354: Flags [P.], seq 57672:61794, ack 803, win 65535, length 4122
22:05:24.672633 IP 13.224.208.10.443 > 10.0.2.15.57354: Flags [P.], seq 61794:68664, ack 803, win 65535, length 6870
22:05:24.672656 IP 10.0.2.15.57354 > 13.224.208.10.443: Flags [.], ack 61794, win 61320, length 0
22:05:24.672693 IP 10.0.2.15.57354 > 13.224.208.10.443: Flags [.], ack 68664, win 56940, length 0
22:05:24.673856 IP 13.224.208.10.443 > 10.0.2.15.57354: Flags [P.], seq 68664:74160, ack 803, win 65535, length 5496
22:05:24.673876 IP 10.0.2.15.57354 > 13.224.208.10.443: Flags [.], ack 74160, win 52560, length 0
22:05:24.674252 IP 13.224.208.10.443 > 10.0.2.15.57354: Flags [.], seq 74160:78540, ack 803, win 65535, length 4380
22:05:24.674268 IP 10.0.2.15.57354 > 13.224.208.10.443: Flags [.], ack 78540, win 65535, length 0
22:05:24.674579 IP 13.224.208.10.443 > 10.0.2.15.57354: Flags [P.], seq 78540:79656, ack 803, win 65535, length 1116
22:05:24.674590 IP 10.0.2.15.57354 > 13.224.208.10.443: Flags [.], ack 79656, win 65535, length 0
22:05:24.675338 IP 13.224.208.10.443 > 10.0.2.15.57354: Flags [P.], seq 79656:82404, ack 803, win 65535, length 2748
22:05:24.675352 IP 10.0.2.15.57354 > 13.224.208.10.443: Flags [.], ack 82404, win 65535, length 0
22:05:24.676784 IP 13.224.208.10.443 > 10.0.2.15.57354: Flags [P.], seq 82404:90648, ack 803, win 65535, length 8244
22:05:24.676899 IP 10.0.2.15.57354 > 13.224.208.10.443: Flags [.], ack 90648, win 65535, length 0
22:05:24.677827 IP 13.224.208.10.443 > 10.0.2.15.57354: Flags [P.], seq 90648:100266, ack 803, win 65535, length 9618
22:05:24.677873 IP 13.224.208.10.443 > 10.0.2.15.57354: Flags [P.], seq 100266:101640, ack 803, win 65535, length 1374
22:05:24.677891 IP 10.0.2.15.57354 > 13.224.208.10.443: Flags [.], ack 100266, win 65535, length 0
22:05:24.677976 IP 10.0.2.15.57354 > 13.224.208.10.443: Flags [.], ack 101640, win 65535, length 0
22:05:24.678002 IP 13.224.208.10.443 > 10.0.2.15.57354: Flags [P.], seq 101640:103014, ack 803, win 65535, length 1374
22:05:24.678005 IP 10.0.2.15.57354 > 13.224.208.10.443: Flags [.], ack 103014, win 65535, length 0
22:05:24.679274 IP 13.224.208.10.443 > 10.0.2.15.57354: Flags [P.], seq 103014:111258, ack 803, win 65535, length 8244
22:05:24.679293 IP 10.0.2.15.57354 > 13.224.208.10.443: Flags [.], ack 111258, win 65535, length 0
22:05:24.681292 IP 13.224.208.10.443 > 10.0.2.15.57354: Flags [P.], seq 111258:118128, ack 803, win 65535, length 6870
22:05:24.681312 IP 10.0.2.15.57354 > 13.224.208.10.443: Flags [.], ack 118128, win 65535, length 0
22:05:24.682361 IP 13.224.208.10.443 > 10.0.2.15.57354: Flags [P.], seq 118128:119502, ack 803, win 65535, length 1374
22:05:24.682377 IP 10.0.2.15.57354 > 13.224.208.10.443: Flags [.], ack 119502, win 65535, length 0
22:05:24.685746 IP 13.224.208.10.443 > 10.0.2.15.57354: Flags [P.], seq 119502:130494, ack 803, win 65535, length 10992
22:05:24.685766 IP 10.0.2.15.57354 > 13.224.208.10.443: Flags [.], ack 130494, win 65535, length 0
22:05:24.686433 IP 13.224.208.10.443 > 10.0.2.15.57354: Flags [P.], seq 130494:134616, ack 803, win 65535, length 4122
22:05:24.686452 IP 10.0.2.15.57354 > 13.224.208.10.443: Flags [.], ack 134616, win 65535, length 0
22:05:24.689515 IP 13.224.208.10.443 > 10.0.2.15.57354: Flags [P.], seq 134616:144234, ack 803, win 65535, length 9618
22:05:24.689518 IP 13.224.208.10.443 > 10.0.2.15.57354: Flags [P.], seq 144234:149730, ack 803, win 65535, length 5496
22:05:24.689654 IP 10.0.2.15.57354 > 13.224.208.10.443: Flags [.], ack 144234, win 65535, length 0
22:05:24.689703 IP 10.0.2.15.57354 > 13.224.208.10.443: Flags [.], ack 149730, win 65535, length 0
22:05:24.689737 IP 13.224.208.10.443 > 10.0.2.15.57354: Flags [P.], seq 149730:156600, ack 803, win 65535, length 6870
22:05:24.689743 IP 10.0.2.15.57354 > 13.224.208.10.443: Flags [.], ack 156600, win 65535, length 0
22:05:24.690818 IP 13.224.208.10.443 > 10.0.2.15.57354: Flags [P.], seq 156600:157974, ack 803, win 65535, length 1374
22:05:24.690834 IP 10.0.2.15.57354 > 13.224.208.10.443: Flags [.], ack 157974, win 65535, length 0
22:05:24.692399 IP 13.224.208.10.443 > 10.0.2.15.57354: Flags [P.], seq 157974:173088, ack 803, win 65535, length 15114
22:05:24.692419 IP 10.0.2.15.57354 > 13.224.208.10.443: Flags [.], ack 173088, win 65535, length 0
22:05:24.692947 IP 13.224.208.10.443 > 10.0.2.15.57354: Flags [.], seq 173088:176008, ack 803, win 65535, length 2920
22:05:24.692963 IP 10.0.2.15.57354 > 13.224.208.10.443: Flags [.], ack 176008, win 65535, length 0
22:05:24.693252 IP 13.224.208.10.443 > 10.0.2.15.57354: Flags [P.], seq 176008:178584, ack 803, win 65535, length 2576
22:05:24.693254 IP 13.224.208.10.443 > 10.0.2.15.57354: Flags [P.], seq 178584:181332, ack 803, win 65535, length 2748
22:05:24.693255 IP 13.224.208.10.443 > 10.0.2.15.57354: Flags [P.], seq 181332:182706, ack 803, win 65535, length 1374
22:05:24.693269 IP 10.0.2.15.57354 > 13.224.208.10.443: Flags [.], ack 178584, win 65535, length 0
22:05:24.693291 IP 10.0.2.15.57354 > 13.224.208.10.443: Flags [.], ack 181332, win 65535, length 0
22:05:24.693303 IP 10.0.2.15.57354 > 13.224.208.10.443: Flags [.], ack 182706, win 65535, length 0
22:05:24.694461 IP 13.224.208.10.443 > 10.0.2.15.57354: Flags [P.], seq 182706:186828, ack 803, win 65535, length 4122
22:05:24.694481 IP 10.0.2.15.57354 > 13.224.208.10.443: Flags [.], ack 186828, win 65535, length 0
22:05:24.695600 IP 13.224.208.10.443 > 10.0.2.15.57354: Flags [P.], seq 186828:192324, ack 803, win 65535, length 5496
22:05:24.695603 IP 13.224.208.10.443 > 10.0.2.15.57354: Flags [P.], seq 192324:195072, ack 803, win 65535, length 2748
22:05:24.695661 IP 13.224.208.10.443 > 10.0.2.15.57354: Flags [P.], seq 195072:197820, ack 803, win 65535, length 2748
22:05:24.695684 IP 10.0.2.15.57354 > 13.224.208.10.443: Flags [.], ack 192324, win 65535, length 0
22:05:24.695724 IP 10.0.2.15.57354 > 13.224.208.10.443: Flags [.], ack 195072, win 65535, length 0
22:05:24.695735 IP 10.0.2.15.57354 > 13.224.208.10.443: Flags [.], ack 197820, win 65535, length 0
22:05:24.696891 IP 13.224.208.10.443 > 10.0.2.15.57354: Flags [P.], seq 197820:203316, ack 803, win 65535, length 5496
22:05:24.696912 IP 10.0.2.15.57354 > 13.224.208.10.443: Flags [.], ack 203316, win 65535, length 0
22:05:24.697919 IP 13.224.208.10.443 > 10.0.2.15.57354: Flags [P.], seq 203316:210186, ack 803, win 65535, length 6870
22:05:24.697945 IP 10.0.2.15.57354 > 13.224.208.10.443: Flags [.], ack 210186, win 65535, length 0
22:05:24.698833 IP 13.224.208.10.443 > 10.0.2.15.57354: Flags [P.], seq 210186:219804, ack 803, win 65535, length 9618
22:05:24.698835 IP 13.224.208.10.443 > 10.0.2.15.57354: Flags [P.], seq 219804:222552, ack 803, win 65535, length 2748
22:05:24.698858 IP 10.0.2.15.57354 > 13.224.208.10.443: Flags [.], ack 219804, win 65535, length 0
22:05:24.698887 IP 10.0.2.15.57354 > 13.224.208.10.443: Flags [.], ack 222552, win 65535, length 0
22:05:24.698913 IP 13.224.208.10.443 > 10.0.2.15.57354: Flags [P.], seq 222552:223926, ack 803, win 65535, length 1374
22:05:24.698919 IP 10.0.2.15.57354 > 13.224.208.10.443: Flags [.], ack 223926, win 65535, length 0
22:05:24.700114 IP 13.224.208.10.443 > 10.0.2.15.57354: Flags [P.], seq 223926:230796, ack 803, win 65535, length 6870
22:05:24.700136 IP 10.0.2.15.57354 > 13.224.208.10.443: Flags [.], ack 230796, win 65535, length 0
22:05:24.700986 IP 13.224.208.10.443 > 10.0.2.15.57354: Flags [P.], seq 230796:234918, ack 803, win 65535, length 4122
22:05:24.701001 IP 10.0.2.15.57354 > 13.224.208.10.443: Flags [.], ack 234918, win 65535, length 0
22:05:24.701119 IP 13.224.208.10.443 > 10.0.2.15.57354: Flags [P.], seq 234918:240414, ack 803, win 65535, length 5496
22:05:24.701120 IP 13.224.208.10.443 > 10.0.2.15.57354: Flags [P.], seq 240414:241788, ack 803, win 65535, length 1374
22:05:24.701131 IP 10.0.2.15.57354 > 13.224.208.10.443: Flags [.], ack 240414, win 65535, length 0
22:05:24.701143 IP 10.0.2.15.57354 > 13.224.208.10.443: Flags [.], ack 241788, win 65535, length 0
22:05:24.702298 IP 13.224.208.10.443 > 10.0.2.15.57354: Flags [P.], seq 241788:248658, ack 803, win 65535, length 6870
22:05:24.702350 IP 10.0.2.15.57354 > 13.224.208.10.443: Flags [.], ack 248658, win 65535, length 0
22:05:24.702516 IP 13.224.208.10.443 > 10.0.2.15.57354: Flags [P.], seq 248658:254154, ack 803, win 65535, length 5496
22:05:24.702523 IP 10.0.2.15.57354 > 13.224.208.10.443: Flags [.], ack 254154, win 65535, length 0
22:05:24.703828 IP 13.224.208.10.443 > 10.0.2.15.57354: Flags [P.], seq 254154:261024, ack 803, win 65535, length 6870
22:05:24.703833 IP 13.224.208.10.443 > 10.0.2.15.57354: Flags [P.], seq 261024:265146, ack 803, win 65535, length 4122
22:05:24.704313 IP 10.0.2.15.57354 > 13.224.208.10.443: Flags [.], ack 261024, win 65535, length 0
22:05:24.704453 IP 10.0.2.15.57354 > 13.224.208.10.443: Flags [.], ack 265146, win 65535, length 0
22:05:24.705163 IP 13.224.208.10.443 > 10.0.2.15.57354: Flags [P.], seq 265146:273390, ack 803, win 65535, length 8244
22:05:24.705166 IP 13.224.208.10.443 > 10.0.2.15.57354: Flags [P.], seq 273390:274764, ack 803, win 65535, length 1374
22:05:24.705435 IP 10.0.2.15.57354 > 13.224.208.10.443: Flags [.], ack 273390, win 65535, length 0
22:05:24.705552 IP 10.0.2.15.57354 > 13.224.208.10.443: Flags [.], ack 274764, win 65535, length 0
22:05:24.705824 IP 13.224.208.10.443 > 10.0.2.15.57354: Flags [P.], seq 274764:281634, ack 803, win 65535, length 6870
22:05:24.705827 IP 13.224.208.10.443 > 10.0.2.15.57354: Flags [P.], seq 281634:291252, ack 803, win 65535, length 9618
22:05:24.705842 IP 10.0.2.15.57354 > 13.224.208.10.443: Flags [.], ack 281634, win 65535, length 0
22:05:24.705863 IP 10.0.2.15.57354 > 13.224.208.10.443: Flags [.], ack 291252, win 65535, length 0
22:05:24.705891 IP 13.224.208.10.443 > 10.0.2.15.57354: Flags [P.], seq 291252:294000, ack 803, win 65535, length 2748
22:05:24.705892 IP 13.224.208.10.443 > 10.0.2.15.57354: Flags [P.], seq 294000:296748, ack 803, win 65535, length 2748
22:05:24.705897 IP 10.0.2.15.57354 > 13.224.208.10.443: Flags [.], ack 294000, win 65535, length 0
22:05:24.705909 IP 10.0.2.15.57354 > 13.224.208.10.443: Flags [.], ack 296748, win 65535, length 0
22:05:24.706188 IP 13.224.208.10.443 > 10.0.2.15.57354: Flags [P.], seq 296748:298122, ack 803, win 65535, length 1374
22:05:24.706206 IP 10.0.2.15.57354 > 13.224.208.10.443: Flags [.], ack 298122, win 65535, length 0
22:05:24.708057 IP 13.224.208.10.443 > 10.0.2.15.57354: Flags [P.], seq 298122:299496, ack 803, win 65535, length 1374
22:05:24.708801 IP 10.0.2.15.57354 > 13.224.208.10.443: Flags [.], ack 299496, win 65535, length 0
22:05:24.710406 IP 13.224.208.10.443 > 10.0.2.15.57354: Flags [P.], seq 299496:318732, ack 803, win 65535, length 19236
22:05:24.710430 IP 10.0.2.15.57354 > 13.224.208.10.443: Flags [.], ack 318732, win 65535, length 0
22:05:24.710541 IP 13.224.208.10.443 > 10.0.2.15.57354: Flags [P.], seq 318732:350334, ack 803, win 65535, length 31602
22:05:24.710560 IP 10.0.2.15.57354 > 13.224.208.10.443: Flags [.], ack 350334, win 65535, length 0
22:05:24.712357 IP 13.224.208.10.443 > 10.0.2.15.57354: Flags [P.], seq 350334:357204, ack 803, win 65535, length 6870
22:05:24.712361 IP 13.224.208.10.443 > 10.0.2.15.57354: Flags [P.], seq 357204:364074, ack 803, win 65535, length 6870
22:05:24.712388 IP 10.0.2.15.57354 > 13.224.208.10.443: Flags [.], ack 357204, win 65535, length 0
22:05:24.712426 IP 10.0.2.15.57354 > 13.224.208.10.443: Flags [.], ack 364074, win 65535, length 0
22:05:24.712701 IP 13.224.208.10.443 > 10.0.2.15.57354: Flags [P.], seq 364074:369570, ack 803, win 65535, length 5496
22:05:24.712705 IP 13.224.208.10.443 > 10.0.2.15.57354: Flags [P.], seq 369570:376440, ack 803, win 65535, length 6870
22:05:24.713015 IP 10.0.2.15.57354 > 13.224.208.10.443: Flags [.], ack 369570, win 65535, length 0
22:05:24.713050 IP 10.0.2.15.57354 > 13.224.208.10.443: Flags [.], ack 376440, win 65535, length 0
22:05:24.713082 IP 13.224.208.10.443 > 10.0.2.15.57354: Flags [P.], seq 376440:381936, ack 803, win 65535, length 5496
22:05:24.713084 IP 13.224.208.10.443 > 10.0.2.15.57354: Flags [P.], seq 381936:383310, ack 803, win 65535, length 1374
22:05:24.713093 IP 10.0.2.15.57354 > 13.224.208.10.443: Flags [.], ack 381936, win 65535, length 0
22:05:24.713106 IP 10.0.2.15.57354 > 13.224.208.10.443: Flags [.], ack 383310, win 65535, length 0
22:05:24.714818 IP 13.224.208.10.443 > 10.0.2.15.57354: Flags [P.], seq 383310:403920, ack 803, win 65535, length 20610
22:05:24.714844 IP 10.0.2.15.57354 > 13.224.208.10.443: Flags [.], ack 403920, win 65535, length 0
22:05:24.715649 IP 13.224.208.10.443 > 10.0.2.15.57354: Flags [.], seq 403920:409760, ack 803, win 65535, length 5840
22:05:24.715868 IP 10.0.2.15.57354 > 13.224.208.10.443: Flags [.], ack 409760, win 65535, length 0
22:05:24.716738 IP 13.224.208.10.443 > 10.0.2.15.57354: Flags [P.], seq 409760:425904, ack 803, win 65535, length 16144
22:05:24.716751 IP 10.0.2.15.57354 > 13.224.208.10.443: Flags [.], ack 425904, win 65535, length 0
22:05:24.716778 IP 13.224.208.10.443 > 10.0.2.15.57354: Flags [P.], seq 425904:431400, ack 803, win 65535, length 5496
22:05:24.716779 IP 13.224.208.10.443 > 10.0.2.15.57354: Flags [P.], seq 431400:434148, ack 803, win 65535, length 2748
22:05:24.716780 IP 13.224.208.10.443 > 10.0.2.15.57354: Flags [P.], seq 434148:439644, ack 803, win 65535, length 5496
22:05:24.716787 IP 10.0.2.15.57354 > 13.224.208.10.443: Flags [.], ack 431400, win 65535, length 0
22:05:24.716794 IP 10.0.2.15.57354 > 13.224.208.10.443: Flags [.], ack 434148, win 65535, length 0
22:05:24.716799 IP 10.0.2.15.57354 > 13.224.208.10.443: Flags [.], ack 439644, win 65535, length 0
22:05:24.716814 IP 13.224.208.10.443 > 10.0.2.15.57354: Flags [P.], seq 439644:443766, ack 803, win 65535, length 4122
22:05:24.716817 IP 10.0.2.15.57354 > 13.224.208.10.443: Flags [.], ack 443766, win 65535, length 0
22:05:24.717091 IP 13.224.208.10.443 > 10.0.2.15.57354: Flags [P.], seq 443766:450636, ack 803, win 65535, length 6870
22:05:24.717101 IP 10.0.2.15.57354 > 13.224.208.10.443: Flags [.], ack 450636, win 65535, length 0
22:05:24.717791 IP 13.224.208.10.443 > 10.0.2.15.57354: Flags [P.], seq 450636:458880, ack 803, win 65535, length 8244
22:05:24.717792 IP 13.224.208.10.443 > 10.0.2.15.57354: Flags [P.], seq 458880:460254, ack 803, win 65535, length 1374
22:05:24.717793 IP 13.224.208.10.443 > 10.0.2.15.57354: Flags [P.], seq 460254:464376, ack 803, win 65535, length 4122
22:05:24.717849 IP 10.0.2.15.57354 > 13.224.208.10.443: Flags [.], ack 458880, win 65535, length 0
22:05:24.717920 IP 10.0.2.15.57354 > 13.224.208.10.443: Flags [.], ack 460254, win 65535, length 0
22:05:24.717970 IP 10.0.2.15.57354 > 13.224.208.10.443: Flags [.], ack 464376, win 65535, length 0
22:05:24.717995 IP 13.224.208.10.443 > 10.0.2.15.57354: Flags [P.], seq 464376:468498, ack 803, win 65535, length 4122
22:05:24.718000 IP 10.0.2.15.57354 > 13.224.208.10.443: Flags [.], ack 468498, win 65535, length 0
22:05:24.718141 IP 13.224.208.10.443 > 10.0.2.15.57354: Flags [P.], seq 468498:472620, ack 803, win 65535, length 4122
22:05:24.718151 IP 10.0.2.15.57354 > 13.224.208.10.443: Flags [.], ack 472620, win 65535, length 0
22:05:24.722276 IP 13.224.208.10.443 > 10.0.2.15.57354: Flags [P.], seq 472620:500100, ack 803, win 65535, length 27480
22:05:24.722302 IP 10.0.2.15.57354 > 13.224.208.10.443: Flags [.], ack 500100, win 65535, length 0

