23:59:15.830388 IP 10.0.2.15.55284 > 140.233.253.2.53: 48070+ A? www.amazon.com. (32)
23:59:15.830427 IP 10.0.2.15.55284 > 140.233.253.2.53: 11995+ AAAA? www.amazon.com. (32)
23:59:15.835947 IP 140.233.253.2.53 > 10.0.2.15.55284: 11995 3/1/0 CNAME tp.47cf2c8c9-frontier.amazon.com., CNAME www.amazon.com.edgekey.net., CNAME e15316.a.akamaiedge.net. (200)
23:59:15.847942 IP 140.233.253.2.53 > 10.0.2.15.55284: 48070 4/0/0 CNAME tp.47cf2c8c9-frontier.amazon.com., CNAME www.amazon.com.edgekey.net., CNAME e15316.a.akamaiedge.net., A 23.33.241.108 (158)
23:59:15.848249 IP 10.0.2.15.55748 > 23.33.241.108.443: Flags [S], seq 3274743411, win 64240, options [mss 1460,sackOK,TS val 2496444076 ecr 0,nop,wscale 6], length 0
23:59:15.862788 IP 23.33.241.108.443 > 10.0.2.15.55748: Flags [S.], seq 35776001, ack 3274743412, win 65535, options [mss 1460], length 0
23:59:15.862835 IP 10.0.2.15.55748 > 23.33.241.108.443: Flags [.], ack 1, win 64240, length 0
23:59:15.871110 IP 10.0.2.15.55748 > 23.33.241.108.443: Flags [P.], seq 1:518, ack 1, win 64240, length 517
23:59:15.871476 IP 23.33.241.108.443 > 10.0.2.15.55748: Flags [.], ack 518, win 65535, length 0
23:59:15.888889 IP 23.33.241.108.443 > 10.0.2.15.55748: Flags [.], seq 1:2921, ack 518, win 65535, length 2920
23:59:15.888914 IP 10.0.2.15.55748 > 23.33.241.108.443: Flags [.], ack 2921, win 62780, length 0
23:59:15.889238 IP 23.33.241.108.443 > 10.0.2.15.55748: Flags [P.], seq 2921:4900, ack 518, win 65535, length 1979
23:59:15.889254 IP 10.0.2.15.55748 > 23.33.241.108.443: Flags [.], ack 4900, win 61320, length 0
23:59:15.890814 IP 10.0.2.15.55748 > 23.33.241.108.443: Flags [P.], seq 518:644, ack 4900, win 62780, length 126
23:59:15.891129 IP 23.33.241.108.443 > 10.0.2.15.55748: Flags [.], ack 644, win 65535, length 0
23:59:15.905117 IP 23.33.241.108.443 > 10.0.2.15.55748: Flags [P.], seq 4900:4951, ack 644, win 65535, length 51
23:59:15.905141 IP 10.0.2.15.55748 > 23.33.241.108.443: Flags [.], ack 4951, win 62780, length 0
23:59:15.905555 IP 10.0.2.15.55748 > 23.33.241.108.443: Flags [P.], seq 644:697, ack 4951, win 62780, length 53
23:59:15.905592 IP 10.0.2.15.55748 > 23.33.241.108.443: Flags [P.], seq 697:753, ack 4951, win 62780, length 56
23:59:15.905814 IP 23.33.241.108.443 > 10.0.2.15.55748: Flags [.], ack 697, win 65535, length 0
23:59:15.905891 IP 10.0.2.15.55748 > 23.33.241.108.443: Flags [P.], seq 753:1014, ack 4951, win 62780, length 261
23:59:15.906045 IP 23.33.241.108.443 > 10.0.2.15.55748: Flags [.], ack 753, win 65535, length 0
23:59:15.906214 IP 23.33.241.108.443 > 10.0.2.15.55748: Flags [.], ack 1014, win 65535, length 0

