23:59:26.390672 IP 10.0.2.15.41524 > 140.233.253.2.53: 33558+ A? www.amazon.com. (32)
23:59:26.390714 IP 10.0.2.15.41524 > 140.233.253.2.53: 60181+ AAAA? www.amazon.com. (32)
23:59:26.396815 IP 140.233.253.2.53 > 10.0.2.15.41524: 33558 4/0/0 CNAME tp.47cf2c8c9-frontier.amazon.com., CNAME www.amazon.com.edgekey.net., CNAME e15316.a.akamaiedge.net., A 23.33.241.108 (158)
23:59:26.396818 IP 140.233.253.2.53 > 10.0.2.15.41524: 60181 3/1/0 CNAME tp.47cf2c8c9-frontier.amazon.com., CNAME www.amazon.com.edgekey.net., CNAME e15316.a.akamaiedge.net. (200)
23:59:26.397103 IP 10.0.2.15.55752 > 23.33.241.108.443: Flags [S], seq 1264718352, win 64240, options [mss 1460,sackOK,TS val 2496454625 ecr 0,nop,wscale 6], length 0
23:59:26.412891 IP 23.33.241.108.443 > 10.0.2.15.55752: Flags [S.], seq 36032001, ack 1264718353, win 65535, options [mss 1460], length 0
23:59:26.412947 IP 10.0.2.15.55752 > 23.33.241.108.443: Flags [.], ack 1, win 64240, length 0
23:59:26.424990 IP 10.0.2.15.55752 > 23.33.241.108.443: Flags [P.], seq 1:518, ack 1, win 64240, length 517
23:59:26.425432 IP 23.33.241.108.443 > 10.0.2.15.55752: Flags [.], ack 518, win 65535, length 0
23:59:26.442016 IP 23.33.241.108.443 > 10.0.2.15.55752: Flags [.], seq 1:2921, ack 518, win 65535, length 2920
23:59:26.442044 IP 10.0.2.15.55752 > 23.33.241.108.443: Flags [.], ack 2921, win 62780, length 0
23:59:26.442346 IP 23.33.241.108.443 > 10.0.2.15.55752: Flags [P.], seq 2921:4900, ack 518, win 65535, length 1979
23:59:26.442364 IP 10.0.2.15.55752 > 23.33.241.108.443: Flags [.], ack 4900, win 61320, length 0
23:59:26.444036 IP 10.0.2.15.55752 > 23.33.241.108.443: Flags [P.], seq 518:644, ack 4900, win 62780, length 126
23:59:26.444517 IP 23.33.241.108.443 > 10.0.2.15.55752: Flags [.], ack 644, win 65535, length 0
23:59:26.458885 IP 23.33.241.108.443 > 10.0.2.15.55752: Flags [P.], seq 4900:4951, ack 644, win 65535, length 51
23:59:26.458908 IP 10.0.2.15.55752 > 23.33.241.108.443: Flags [.], ack 4951, win 62780, length 0
23:59:26.459422 IP 10.0.2.15.55752 > 23.33.241.108.443: Flags [P.], seq 644:697, ack 4951, win 62780, length 53
23:59:26.459463 IP 10.0.2.15.55752 > 23.33.241.108.443: Flags [P.], seq 697:753, ack 4951, win 62780, length 56
23:59:26.459778 IP 23.33.241.108.443 > 10.0.2.15.55752: Flags [.], ack 697, win 65535, length 0
23:59:26.459780 IP 23.33.241.108.443 > 10.0.2.15.55752: Flags [.], ack 753, win 65535, length 0
23:59:26.459801 IP 10.0.2.15.55752 > 23.33.241.108.443: Flags [P.], seq 753:795, ack 4951, win 62780, length 42
23:59:26.460618 IP 23.33.241.108.443 > 10.0.2.15.55752: Flags [.], ack 795, win 65535, length 0
23:59:26.460694 IP 10.0.2.15.55752 > 23.33.241.108.443: Flags [P.], seq 795:1014, ack 4951, win 62780, length 219
23:59:26.461134 IP 23.33.241.108.443 > 10.0.2.15.55752: Flags [.], ack 1014, win 65535, length 0
23:59:26.474059 IP 23.33.241.108.443 > 10.0.2.15.55752: Flags [P.], seq 4951:5028, ack 1014, win 65535, length 77
23:59:26.474079 IP 10.0.2.15.55752 > 23.33.241.108.443: Flags [.], ack 5028, win 62780, length 0
23:59:26.474341 IP 10.0.2.15.55752 > 23.33.241.108.443: Flags [P.], seq 1014:1052, ack 5028, win 62780, length 38
23:59:26.474807 IP 23.33.241.108.443 > 10.0.2.15.55752: Flags [.], ack 1052, win 65535, length 0

