23:59:52.766342 IP 10.0.2.15.37881 > 140.233.253.2.53: 8938+ A? www.amazon.com. (32)
23:59:52.766383 IP 10.0.2.15.37881 > 140.233.253.2.53: 9961+ AAAA? www.amazon.com. (32)
23:59:52.773350 IP 140.233.253.2.53 > 10.0.2.15.37881: 8938 4/0/0 CNAME tp.47cf2c8c9-frontier.amazon.com., CNAME www.amazon.com.edgekey.net., CNAME e15316.a.akamaiedge.net., A 23.33.241.108 (158)
23:59:52.773353 IP 140.233.253.2.53 > 10.0.2.15.37881: 9961 3/1/0 CNAME tp.47cf2c8c9-frontier.amazon.com., CNAME www.amazon.com.edgekey.net., CNAME e15316.a.akamaiedge.net. (200)
23:59:52.773683 IP 10.0.2.15.55762 > 23.33.241.108.443: Flags [S], seq 863157233, win 64240, options [mss 1460,sackOK,TS val 2496481002 ecr 0,nop,wscale 6], length 0
23:59:52.788519 IP 23.33.241.108.443 > 10.0.2.15.55762: Flags [S.], seq 36672001, ack 863157234, win 65535, options [mss 1460], length 0
23:59:52.788560 IP 10.0.2.15.55762 > 23.33.241.108.443: Flags [.], ack 1, win 64240, length 0
23:59:52.795935 IP 10.0.2.15.55762 > 23.33.241.108.443: Flags [P.], seq 1:518, ack 1, win 64240, length 517
23:59:52.796351 IP 23.33.241.108.443 > 10.0.2.15.55762: Flags [.], ack 518, win 65535, length 0
23:59:52.815879 IP 23.33.241.108.443 > 10.0.2.15.55762: Flags [.], seq 1:2921, ack 518, win 65535, length 2920
23:59:52.815906 IP 10.0.2.15.55762 > 23.33.241.108.443: Flags [.], ack 2921, win 62780, length 0
23:59:52.816245 IP 23.33.241.108.443 > 10.0.2.15.55762: Flags [P.], seq 2921:4900, ack 518, win 65535, length 1979
23:59:52.816261 IP 10.0.2.15.55762 > 23.33.241.108.443: Flags [.], ack 4900, win 61320, length 0
23:59:52.818047 IP 10.0.2.15.55762 > 23.33.241.108.443: Flags [P.], seq 518:644, ack 4900, win 62780, length 126
23:59:52.818466 IP 23.33.241.108.443 > 10.0.2.15.55762: Flags [.], ack 644, win 65535, length 0
23:59:52.832781 IP 23.33.241.108.443 > 10.0.2.15.55762: Flags [P.], seq 4900:4951, ack 644, win 65535, length 51
23:59:52.832804 IP 10.0.2.15.55762 > 23.33.241.108.443: Flags [.], ack 4951, win 62780, length 0
23:59:52.833324 IP 10.0.2.15.55762 > 23.33.241.108.443: Flags [P.], seq 644:697, ack 4951, win 62780, length 53
23:59:52.833374 IP 10.0.2.15.55762 > 23.33.241.108.443: Flags [P.], seq 697:753, ack 4951, win 62780, length 56
23:59:52.833737 IP 23.33.241.108.443 > 10.0.2.15.55762: Flags [.], ack 697, win 65535, length 0
23:59:52.833765 IP 10.0.2.15.55762 > 23.33.241.108.443: Flags [P.], seq 753:795, ack 4951, win 62780, length 42
23:59:52.834400 IP 23.33.241.108.443 > 10.0.2.15.55762: Flags [.], ack 753, win 65535, length 0
23:59:52.834401 IP 23.33.241.108.443 > 10.0.2.15.55762: Flags [.], ack 795, win 65535, length 0
23:59:52.834492 IP 10.0.2.15.55762 > 23.33.241.108.443: Flags [P.], seq 795:1014, ack 4951, win 62780, length 219
23:59:52.834832 IP 23.33.241.108.443 > 10.0.2.15.55762: Flags [.], ack 1014, win 65535, length 0
23:59:52.847852 IP 23.33.241.108.443 > 10.0.2.15.55762: Flags [P.], seq 4951:5028, ack 1014, win 65535, length 77
23:59:52.847878 IP 10.0.2.15.55762 > 23.33.241.108.443: Flags [.], ack 5028, win 62780, length 0
23:59:52.848485 IP 10.0.2.15.55762 > 23.33.241.108.443: Flags [P.], seq 1014:1052, ack 5028, win 62780, length 38
23:59:52.848821 IP 23.33.241.108.443 > 10.0.2.15.55762: Flags [.], ack 1052, win 65535, length 0

