19:38:27.032016 IP 10.0.2.15.39370 > 140.233.253.2.53: 29099+ A? www.amazon.com. (32)
19:38:27.032041 IP 10.0.2.15.39370 > 140.233.253.2.53: 37289+ AAAA? www.amazon.com. (32)
19:38:27.037512 IP 140.233.253.2.53 > 10.0.2.15.39370: 29099 3/0/0 CNAME tp.47cf2c8c9-frontier.amazon.com., CNAME d3ag4hukkh62yn.cloudfront.net., A 13.224.213.79 (127)
19:38:27.037514 IP 140.233.253.2.53 > 10.0.2.15.39370: 37289 2/1/0 CNAME tp.47cf2c8c9-frontier.amazon.com., CNAME d3ag4hukkh62yn.cloudfront.net. (182)
19:38:27.037763 IP 10.0.2.15.41844 > 13.224.213.79.443: Flags [S], seq 3345882746, win 64240, options [mss 1460,sackOK,TS val 1206330257 ecr 0,nop,wscale 6], length 0
19:38:27.054459 IP 13.224.213.79.443 > 10.0.2.15.41844: Flags [S.], seq 181248001, ack 3345882747, win 65535, options [mss 1460], length 0
19:38:27.054504 IP 10.0.2.15.41844 > 13.224.213.79.443: Flags [.], ack 1, win 64240, length 0
19:38:27.063018 IP 10.0.2.15.41844 > 13.224.213.79.443: Flags [P.], seq 1:518, ack 1, win 64240, length 517
19:38:27.063368 IP 13.224.213.79.443 > 10.0.2.15.41844: Flags [.], ack 518, win 65535, length 0
19:38:27.081744 IP 13.224.213.79.443 > 10.0.2.15.41844: Flags [.], seq 1:2921, ack 518, win 65535, length 2920
19:38:27.081794 IP 10.0.2.15.41844 > 13.224.213.79.443: Flags [.], ack 2921, win 62780, length 0
19:38:27.082114 IP 13.224.213.79.443 > 10.0.2.15.41844: Flags [P.], seq 2921:4123, ack 518, win 65535, length 1202
19:38:27.082136 IP 10.0.2.15.41844 > 13.224.213.79.443: Flags [.], ack 4123, win 61578, length 0
19:38:27.085263 IP 13.224.213.79.443 > 10.0.2.15.41844: Flags [P.], seq 4123:4939, ack 518, win 65535, length 816
19:38:27.085282 IP 10.0.2.15.41844 > 13.224.213.79.443: Flags [.], ack 4939, win 62780, length 0
19:38:27.086226 IP 10.0.2.15.41844 > 13.224.213.79.443: Flags [P.], seq 518:582, ack 4939, win 62780, length 64
19:38:27.086535 IP 13.224.213.79.443 > 10.0.2.15.41844: Flags [.], ack 582, win 65535, length 0
19:38:27.086569 IP 10.0.2.15.41844 > 13.224.213.79.443: Flags [P.], seq 582:628, ack 4939, win 62780, length 46
19:38:27.086596 IP 10.0.2.15.41844 > 13.224.213.79.443: Flags [P.], seq 628:677, ack 4939, win 62780, length 49
19:38:27.086798 IP 13.224.213.79.443 > 10.0.2.15.41844: Flags [.], ack 628, win 65535, length 0
19:38:27.086799 IP 13.224.213.79.443 > 10.0.2.15.41844: Flags [.], ack 677, win 65535, length 0
19:38:27.086840 IP 10.0.2.15.41844 > 13.224.213.79.443: Flags [P.], seq 677:774, ack 4939, win 62780, length 97
19:38:27.087059 IP 13.224.213.79.443 > 10.0.2.15.41844: Flags [.], ack 774, win 65535, length 0
19:38:27.103762 IP 13.224.213.79.443 > 10.0.2.15.41844: Flags [P.], seq 4939:5010, ack 774, win 65535, length 71
19:38:27.103783 IP 10.0.2.15.41844 > 13.224.213.79.443: Flags [.], ack 5010, win 62780, length 0
19:38:27.104160 IP 10.0.2.15.41844 > 13.224.213.79.443: Flags [P.], seq 774:805, ack 5010, win 62780, length 31
19:38:27.104509 IP 13.224.213.79.443 > 10.0.2.15.41844: Flags [.], ack 805, win 65535, length 0
19:38:27.117672 IP 13.224.213.79.443 > 10.0.2.15.41844: Flags [P.], seq 5010:7758, ack 805, win 65535, length 2748
19:38:27.117695 IP 10.0.2.15.41844 > 13.224.213.79.443: Flags [.], ack 7758, win 62780, length 0
19:38:27.118408 IP 13.224.213.79.443 > 10.0.2.15.41844: Flags [P.], seq 7758:8211, ack 805, win 65535, length 453
19:38:27.118423 IP 10.0.2.15.41844 > 13.224.213.79.443: Flags [.], ack 8211, win 62780, length 0
19:38:27.118975 IP 10.0.2.15.41844 > 13.224.213.79.443: Flags [P.], seq 805:829, ack 8211, win 62780, length 24
19:38:27.119335 IP 13.224.213.79.443 > 10.0.2.15.41844: Flags [.], ack 829, win 65535, length 0
19:38:27.120428 IP 10.0.2.15.41844 > 13.224.213.79.443: Flags [F.], seq 829, ack 8211, win 62780, length 0
19:38:27.120823 IP 13.224.213.79.443 > 10.0.2.15.41844: Flags [.], ack 830, win 65535, length 0

