19:40:08.392745 IP 10.0.2.15.51107 > 140.233.253.2.53: 36393+ A? www.amazon.com. (32)
19:40:08.392782 IP 10.0.2.15.51107 > 140.233.253.2.53: 48340+ AAAA? www.amazon.com. (32)
19:40:08.399881 IP 140.233.253.2.53 > 10.0.2.15.51107: 36393 3/0/0 CNAME tp.47cf2c8c9-frontier.amazon.com., CNAME d3ag4hukkh62yn.cloudfront.net., A 13.224.213.79 (127)
19:40:08.399883 IP 140.233.253.2.53 > 10.0.2.15.51107: 48340 2/1/0 CNAME tp.47cf2c8c9-frontier.amazon.com., CNAME d3ag4hukkh62yn.cloudfront.net. (182)
19:40:08.400258 IP 10.0.2.15.41862 > 13.224.213.79.443: Flags [S], seq 2846679882, win 64240, options [mss 1460,sackOK,TS val 1206431620 ecr 0,nop,wscale 6], length 0
19:40:08.415501 IP 13.224.213.79.443 > 10.0.2.15.41862: Flags [S.], seq 183744001, ack 2846679883, win 65535, options [mss 1460], length 0
19:40:08.415551 IP 10.0.2.15.41862 > 13.224.213.79.443: Flags [.], ack 1, win 64240, length 0
19:40:08.426862 IP 10.0.2.15.41862 > 13.224.213.79.443: Flags [P.], seq 1:518, ack 1, win 64240, length 517
19:40:08.427131 IP 13.224.213.79.443 > 10.0.2.15.41862: Flags [.], ack 518, win 65535, length 0
19:40:08.444489 IP 13.224.213.79.443 > 10.0.2.15.41862: Flags [.], seq 1:2921, ack 518, win 65535, length 2920
19:40:08.444513 IP 10.0.2.15.41862 > 13.224.213.79.443: Flags [.], ack 2921, win 62780, length 0
19:40:08.444667 IP 13.224.213.79.443 > 10.0.2.15.41862: Flags [P.], seq 2921:4123, ack 518, win 65535, length 1202
19:40:08.444679 IP 10.0.2.15.41862 > 13.224.213.79.443: Flags [.], ack 4123, win 61578, length 0
19:40:08.448706 IP 13.224.213.79.443 > 10.0.2.15.41862: Flags [P.], seq 4123:4939, ack 518, win 65535, length 816
19:40:08.448728 IP 10.0.2.15.41862 > 13.224.213.79.443: Flags [.], ack 4939, win 62780, length 0
19:40:08.449924 IP 10.0.2.15.41862 > 13.224.213.79.443: Flags [P.], seq 518:582, ack 4939, win 62780, length 64
19:40:08.450385 IP 13.224.213.79.443 > 10.0.2.15.41862: Flags [.], ack 582, win 65535, length 0
19:40:08.451008 IP 10.0.2.15.41862 > 13.224.213.79.443: Flags [P.], seq 582:628, ack 4939, win 62780, length 46
19:40:08.451077 IP 10.0.2.15.41862 > 13.224.213.79.443: Flags [P.], seq 628:677, ack 4939, win 62780, length 49
19:40:08.451469 IP 13.224.213.79.443 > 10.0.2.15.41862: Flags [.], ack 628, win 65535, length 0
19:40:08.451471 IP 13.224.213.79.443 > 10.0.2.15.41862: Flags [.], ack 677, win 65535, length 0
19:40:08.451496 IP 10.0.2.15.41862 > 13.224.213.79.443: Flags [P.], seq 677:712, ack 4939, win 62780, length 35
19:40:08.451686 IP 13.224.213.79.443 > 10.0.2.15.41862: Flags [.], ack 712, win 65535, length 0
19:40:08.451835 IP 10.0.2.15.41862 > 13.224.213.79.443: Flags [P.], seq 712:774, ack 4939, win 62780, length 62
19:40:08.452176 IP 13.224.213.79.443 > 10.0.2.15.41862: Flags [.], ack 774, win 65535, length 0
19:40:08.464843 IP 13.224.213.79.443 > 10.0.2.15.41862: Flags [P.], seq 4939:5001, ack 774, win 65535, length 62
19:40:08.464869 IP 10.0.2.15.41862 > 13.224.213.79.443: Flags [.], ack 5001, win 62780, length 0
19:40:08.465227 IP 10.0.2.15.41862 > 13.224.213.79.443: Flags [P.], seq 774:805, ack 5001, win 62780, length 31
19:40:08.465720 IP 13.224.213.79.443 > 10.0.2.15.41862: Flags [.], ack 805, win 65535, length 0
19:40:08.467209 IP 13.224.213.79.443 > 10.0.2.15.41862: Flags [P.], seq 5001:5032, ack 805, win 65535, length 31
19:40:08.467255 IP 10.0.2.15.41862 > 13.224.213.79.443: Flags [.], ack 5032, win 62780, length 0
19:40:08.481561 IP 13.224.213.79.443 > 10.0.2.15.41862: Flags [P.], seq 5032:8232, ack 805, win 65535, length 3200
19:40:08.481587 IP 10.0.2.15.41862 > 13.224.213.79.443: Flags [.], ack 8232, win 61320, length 0
19:40:08.482364 IP 10.0.2.15.41862 > 13.224.213.79.443: Flags [P.], seq 805:829, ack 8232, win 62780, length 24
19:40:08.482664 IP 13.224.213.79.443 > 10.0.2.15.41862: Flags [.], ack 829, win 65535, length 0
19:40:08.483400 IP 10.0.2.15.41862 > 13.224.213.79.443: Flags [F.], seq 829, ack 8232, win 62780, length 0
19:40:08.483630 IP 13.224.213.79.443 > 10.0.2.15.41862: Flags [.], ack 830, win 65535, length 0

