19:43:09.494412 IP 10.0.2.15.37978 > 140.233.253.2.53: 718+ A? www.amazon.com. (32)
19:43:09.494443 IP 10.0.2.15.37978 > 140.233.253.2.53: 4813+ AAAA? www.amazon.com. (32)
19:43:09.501166 IP 140.233.253.2.53 > 10.0.2.15.37978: 4813 3/1/0 CNAME tp.47cf2c8c9-frontier.amazon.com., CNAME www.amazon.com.edgekey.net., CNAME e15316.a.akamaiedge.net. (200)
19:43:09.501169 IP 140.233.253.2.53 > 10.0.2.15.37978: 718 4/0/0 CNAME tp.47cf2c8c9-frontier.amazon.com., CNAME www.amazon.com.edgekey.net., CNAME e15316.a.akamaiedge.net., A 23.33.241.108 (158)
19:43:09.501463 IP 10.0.2.15.56080 > 23.33.241.108.443: Flags [S], seq 750028676, win 64240, options [mss 1460,sackOK,TS val 2548627640 ecr 0,nop,wscale 6], length 0
19:43:09.516152 IP 23.33.241.108.443 > 10.0.2.15.56080: Flags [S.], seq 188224001, ack 750028677, win 65535, options [mss 1460], length 0
19:43:09.516204 IP 10.0.2.15.56080 > 23.33.241.108.443: Flags [.], ack 1, win 64240, length 0
19:43:09.527921 IP 10.0.2.15.56080 > 23.33.241.108.443: Flags [P.], seq 1:518, ack 1, win 64240, length 517
19:43:09.528384 IP 23.33.241.108.443 > 10.0.2.15.56080: Flags [.], ack 518, win 65535, length 0
19:43:09.544794 IP 23.33.241.108.443 > 10.0.2.15.56080: Flags [.], seq 1:2921, ack 518, win 65535, length 2920
19:43:09.544818 IP 10.0.2.15.56080 > 23.33.241.108.443: Flags [.], ack 2921, win 62780, length 0
19:43:09.545234 IP 23.33.241.108.443 > 10.0.2.15.56080: Flags [P.], seq 2921:4097, ack 518, win 65535, length 1176
19:43:09.545250 IP 10.0.2.15.56080 > 23.33.241.108.443: Flags [.], ack 4097, win 61604, length 0
19:43:09.547027 IP 23.33.241.108.443 > 10.0.2.15.56080: Flags [P.], seq 4097:4900, ack 518, win 65535, length 803
19:43:09.547050 IP 10.0.2.15.56080 > 23.33.241.108.443: Flags [.], ack 4900, win 62780, length 0
19:43:09.548697 IP 10.0.2.15.56080 > 23.33.241.108.443: Flags [P.], seq 518:644, ack 4900, win 62780, length 126
19:43:09.549094 IP 23.33.241.108.443 > 10.0.2.15.56080: Flags [.], ack 644, win 65535, length 0
19:43:09.563275 IP 23.33.241.108.443 > 10.0.2.15.56080: Flags [P.], seq 4900:4951, ack 644, win 65535, length 51
19:43:09.563293 IP 10.0.2.15.56080 > 23.33.241.108.443: Flags [.], ack 4951, win 62780, length 0
19:43:09.563645 IP 10.0.2.15.56080 > 23.33.241.108.443: Flags [P.], seq 644:697, ack 4951, win 62780, length 53
19:43:09.563676 IP 10.0.2.15.56080 > 23.33.241.108.443: Flags [P.], seq 697:753, ack 4951, win 62780, length 56
19:43:09.563905 IP 23.33.241.108.443 > 10.0.2.15.56080: Flags [.], ack 697, win 65535, length 0
19:43:09.563922 IP 10.0.2.15.56080 > 23.33.241.108.443: Flags [P.], seq 753:864, ack 4951, win 62780, length 111
19:43:09.564053 IP 23.33.241.108.443 > 10.0.2.15.56080: Flags [.], ack 753, win 65535, length 0
19:43:09.564054 IP 23.33.241.108.443 > 10.0.2.15.56080: Flags [.], ack 864, win 65535, length 0
19:43:09.578130 IP 23.33.241.108.443 > 10.0.2.15.56080: Flags [P.], seq 4951:5057, ack 864, win 65535, length 106
19:43:09.578155 IP 10.0.2.15.56080 > 23.33.241.108.443: Flags [.], ack 5057, win 62780, length 0
19:43:09.578606 IP 10.0.2.15.56080 > 23.33.241.108.443: Flags [P.], seq 864:902, ack 5057, win 62780, length 38
19:43:09.579119 IP 23.33.241.108.443 > 10.0.2.15.56080: Flags [.], ack 902, win 65535, length 0

