23:57:31.344058 IP 10.0.2.15.58579 > 140.233.253.2.53: 33700+ A? www.amazon.com. (32)
23:57:31.344101 IP 10.0.2.15.58579 > 140.233.253.2.53: 23459+ AAAA? www.amazon.com. (32)
23:57:31.349948 IP 140.233.253.2.53 > 10.0.2.15.58579: 23459 3/1/0 CNAME tp.47cf2c8c9-frontier.amazon.com., CNAME www.amazon.com.edgekey.net., CNAME e15316.a.akamaiedge.net. (200)
23:57:31.350827 IP 140.233.253.2.53 > 10.0.2.15.58579: 33700 4/0/0 CNAME tp.47cf2c8c9-frontier.amazon.com., CNAME www.amazon.com.edgekey.net., CNAME e15316.a.akamaiedge.net., A 23.33.241.108 (158)
23:57:31.351078 IP 10.0.2.15.55714 > 23.33.241.108.443: Flags [S], seq 4207151509, win 64240, options [mss 1460,sackOK,TS val 2496339579 ecr 0,nop,wscale 6], length 0
23:57:31.367341 IP 23.33.241.108.443 > 10.0.2.15.55714: Flags [S.], seq 33472001, ack 4207151510, win 65535, options [mss 1460], length 0
23:57:31.367392 IP 10.0.2.15.55714 > 23.33.241.108.443: Flags [.], ack 1, win 64240, length 0
23:57:31.375419 IP 10.0.2.15.55714 > 23.33.241.108.443: Flags [P.], seq 1:518, ack 1, win 64240, length 517
23:57:31.375860 IP 23.33.241.108.443 > 10.0.2.15.55714: Flags [.], ack 518, win 65535, length 0
23:57:31.394851 IP 23.33.241.108.443 > 10.0.2.15.55714: Flags [.], seq 1:2921, ack 518, win 65535, length 2920
23:57:31.394875 IP 10.0.2.15.55714 > 23.33.241.108.443: Flags [.], ack 2921, win 62780, length 0
23:57:31.395249 IP 23.33.241.108.443 > 10.0.2.15.55714: Flags [P.], seq 2921:4900, ack 518, win 65535, length 1979
23:57:31.395267 IP 10.0.2.15.55714 > 23.33.241.108.443: Flags [.], ack 4900, win 62780, length 0
23:57:31.396818 IP 10.0.2.15.55714 > 23.33.241.108.443: Flags [P.], seq 518:644, ack 4900, win 62780, length 126
23:57:31.397214 IP 23.33.241.108.443 > 10.0.2.15.55714: Flags [.], ack 644, win 65535, length 0
23:57:31.413601 IP 23.33.241.108.443 > 10.0.2.15.55714: Flags [P.], seq 4900:4951, ack 644, win 65535, length 51
23:57:31.413700 IP 10.0.2.15.55714 > 23.33.241.108.443: Flags [.], ack 4951, win 62780, length 0
23:57:31.413997 IP 10.0.2.15.55714 > 23.33.241.108.443: Flags [P.], seq 644:697, ack 4951, win 62780, length 53
23:57:31.414047 IP 10.0.2.15.55714 > 23.33.241.108.443: Flags [P.], seq 697:753, ack 4951, win 62780, length 56
23:57:31.414182 IP 10.0.2.15.55714 > 23.33.241.108.443: Flags [P.], seq 753:795, ack 4951, win 62780, length 42
23:57:31.414391 IP 23.33.241.108.443 > 10.0.2.15.55714: Flags [.], ack 697, win 65535, length 0
23:57:31.414392 IP 23.33.241.108.443 > 10.0.2.15.55714: Flags [.], ack 753, win 65535, length 0
23:57:31.414393 IP 23.33.241.108.443 > 10.0.2.15.55714: Flags [.], ack 795, win 65535, length 0
23:57:31.414457 IP 10.0.2.15.55714 > 23.33.241.108.443: Flags [P.], seq 795:1014, ack 4951, win 62780, length 219
23:57:31.414754 IP 23.33.241.108.443 > 10.0.2.15.55714: Flags [.], ack 1014, win 65535, length 0
23:57:31.428620 IP 23.33.241.108.443 > 10.0.2.15.55714: Flags [P.], seq 4951:5057, ack 1014, win 65535, length 106
23:57:31.428640 IP 10.0.2.15.55714 > 23.33.241.108.443: Flags [.], ack 5057, win 62780, length 0
23:57:31.428865 IP 10.0.2.15.55714 > 23.33.241.108.443: Flags [P.], seq 1014:1052, ack 5057, win 62780, length 38
23:57:31.429140 IP 23.33.241.108.443 > 10.0.2.15.55714: Flags [.], ack 1052, win 65535, length 0

