13:04:10.791841 IP 99.84.126.35.443 > 10.0.2.15.51158: Flags [S.], seq 3712001, ack 1690879975, win 65535, options [mss 1460], length 0
13:04:10.791881 IP 10.0.2.15.51158 > 99.84.126.35.443: Flags [.], ack 1, win 64240, length 0
13:04:10.801073 IP 10.0.2.15.51158 > 99.84.126.35.443: Flags [P.], seq 1:518, ack 1, win 64240, length 517
13:04:10.802313 IP 99.84.126.35.443 > 10.0.2.15.51158: Flags [.], ack 518, win 65535, length 0
13:04:10.816332 IP 99.84.126.35.443 > 10.0.2.15.51158: Flags [P.], seq 1:2749, ack 518, win 65535, length 2748
13:04:10.816458 IP 10.0.2.15.51158 > 99.84.126.35.443: Flags [.], ack 2749, win 62780, length 0
13:04:10.817671 IP 99.84.126.35.443 > 10.0.2.15.51158: Flags [P.], seq 2749:4123, ack 518, win 65535, length 1374
13:04:10.817699 IP 10.0.2.15.51158 > 99.84.126.35.443: Flags [.], ack 4123, win 62780, length 0
13:04:10.818622 IP 99.84.126.35.443 > 10.0.2.15.51158: Flags [P.], seq 4123:5824, ack 518, win 65535, length 1701
13:04:10.818640 IP 10.0.2.15.51158 > 99.84.126.35.443: Flags [.], ack 5824, win 62780, length 0
13:04:10.819608 IP 10.0.2.15.51158 > 99.84.126.35.443: Flags [P.], seq 518:582, ack 5824, win 62780, length 64
13:04:10.819864 IP 99.84.126.35.443 > 10.0.2.15.51158: Flags [.], ack 582, win 65535, length 0
13:04:10.819931 IP 10.0.2.15.51158 > 99.84.126.35.443: Flags [P.], seq 582:628, ack 5824, win 62780, length 46
13:04:10.819964 IP 10.0.2.15.51158 > 99.84.126.35.443: Flags [P.], seq 628:677, ack 5824, win 62780, length 49
13:04:10.820240 IP 99.84.126.35.443 > 10.0.2.15.51158: Flags [.], ack 628, win 65535, length 0
13:04:10.820242 IP 99.84.126.35.443 > 10.0.2.15.51158: Flags [.], ack 677, win 65535, length 0
13:04:10.820264 IP 10.0.2.15.51158 > 99.84.126.35.443: Flags [P.], seq 677:772, ack 5824, win 62780, length 95
13:04:10.820559 IP 99.84.126.35.443 > 10.0.2.15.51158: Flags [.], ack 772, win 65535, length 0
13:04:10.832951 IP 99.84.126.35.443 > 10.0.2.15.51158: Flags [P.], seq 5824:5886, ack 772, win 65535, length 62
13:04:10.833013 IP 10.0.2.15.51158 > 99.84.126.35.443: Flags [.], ack 5886, win 62780, length 0
13:04:10.833414 IP 99.84.126.35.443 > 10.0.2.15.51158: Flags [P.], seq 5886:5917, ack 772, win 65535, length 31
13:04:10.833428 IP 10.0.2.15.51158 > 99.84.126.35.443: Flags [.], ack 5917, win 62780, length 0
13:04:10.833677 IP 10.0.2.15.51158 > 99.84.126.35.443: Flags [P.], seq 772:803, ack 5917, win 62780, length 31
13:04:10.833916 IP 99.84.126.35.443 > 10.0.2.15.51158: Flags [.], ack 803, win 65535, length 0
13:04:10.853375 IP 99.84.126.35.443 > 10.0.2.15.51158: Flags [P.], seq 5917:8665, ack 803, win 65535, length 2748
13:04:10.853397 IP 10.0.2.15.51158 > 99.84.126.35.443: Flags [.], ack 8665, win 62780, length 0
13:04:10.854204 IP 99.84.126.35.443 > 10.0.2.15.51158: Flags [P.], seq 8665:15535, ack 803, win 65535, length 6870
13:04:10.854208 IP 99.84.126.35.443 > 10.0.2.15.51158: Flags [P.], seq 15535:19657, ack 803, win 65535, length 4122
13:04:10.854240 IP 10.0.2.15.51158 > 99.84.126.35.443: Flags [.], ack 15535, win 59860, length 0
13:04:10.854272 IP 10.0.2.15.51158 > 99.84.126.35.443: Flags [.], ack 19657, win 56940, length 0
13:04:10.854498 IP 99.84.126.35.443 > 10.0.2.15.51158: Flags [P.], seq 19657:26527, ack 803, win 65535, length 6870
13:04:10.854537 IP 10.0.2.15.51158 > 99.84.126.35.443: Flags [.], ack 26527, win 55480, length 0
13:04:10.855655 IP 99.84.126.35.443 > 10.0.2.15.51158: Flags [P.], seq 26527:32023, ack 803, win 65535, length 5496
13:04:10.855669 IP 10.0.2.15.51158 > 99.84.126.35.443: Flags [.], ack 32023, win 61320, length 0
13:04:10.856299 IP 99.84.126.35.443 > 10.0.2.15.51158: Flags [P.], seq 32023:37519, ack 803, win 65535, length 5496
13:04:10.856300 IP 99.84.126.35.443 > 10.0.2.15.51158: Flags [P.], seq 37519:38893, ack 803, win 65535, length 1374
13:04:10.856378 IP 10.0.2.15.51158 > 99.84.126.35.443: Flags [.], ack 37519, win 61320, length 0
13:04:10.856557 IP 10.0.2.15.51158 > 99.84.126.35.443: Flags [.], ack 38893, win 62780, length 0
13:04:10.857899 IP 99.84.126.35.443 > 10.0.2.15.51158: Flags [P.], seq 38893:48511, ack 803, win 65535, length 9618
13:04:10.857994 IP 10.0.2.15.51158 > 99.84.126.35.443: Flags [.], ack 48511, win 62780, length 0
13:04:10.859033 IP 99.84.126.35.443 > 10.0.2.15.51158: Flags [P.], seq 48511:49885, ack 803, win 65535, length 1374
13:04:10.859118 IP 10.0.2.15.51158 > 99.84.126.35.443: Flags [.], ack 49885, win 62780, length 0
13:04:10.866921 IP 99.84.126.35.443 > 10.0.2.15.51158: Flags [P.], seq 49885:52633, ack 803, win 65535, length 2748
13:04:10.866944 IP 10.0.2.15.51158 > 99.84.126.35.443: Flags [.], ack 52633, win 62780, length 0
13:04:10.869381 IP 99.84.126.35.443 > 10.0.2.15.51158: Flags [P.], seq 52633:70495, ack 803, win 65535, length 17862
13:04:10.869504 IP 10.0.2.15.51158 > 99.84.126.35.443: Flags [.], ack 70495, win 62780, length 0
13:04:10.870585 IP 99.84.126.35.443 > 10.0.2.15.51158: Flags [P.], seq 70495:75991, ack 803, win 65535, length 5496
13:04:10.870587 IP 99.84.126.35.443 > 10.0.2.15.51158: Flags [P.], seq 75991:78739, ack 803, win 65535, length 2748
13:04:10.870605 IP 10.0.2.15.51158 > 99.84.126.35.443: Flags [.], ack 75991, win 65535, length 0
13:04:10.870628 IP 10.0.2.15.51158 > 99.84.126.35.443: Flags [.], ack 78739, win 65535, length 0
13:04:10.871297 IP 99.84.126.35.443 > 10.0.2.15.51158: Flags [P.], seq 78739:84235, ack 803, win 65535, length 5496
13:04:10.871313 IP 10.0.2.15.51158 > 99.84.126.35.443: Flags [.], ack 84235, win 65535, length 0
13:04:10.872659 IP 99.84.126.35.443 > 10.0.2.15.51158: Flags [P.], seq 84235:89731, ack 803, win 65535, length 5496
13:04:10.872662 IP 99.84.126.35.443 > 10.0.2.15.51158: Flags [P.], seq 89731:92479, ack 803, win 65535, length 2748
13:04:10.872682 IP 10.0.2.15.51158 > 99.84.126.35.443: Flags [.], ack 89731, win 65535, length 0
13:04:10.872767 IP 10.0.2.15.51158 > 99.84.126.35.443: Flags [.], ack 92479, win 65535, length 0
13:04:10.874346 IP 99.84.126.35.443 > 10.0.2.15.51158: Flags [P.], seq 92479:102097, ack 803, win 65535, length 9618
13:04:10.874350 IP 99.84.126.35.443 > 10.0.2.15.51158: Flags [P.], seq 102097:106219, ack 803, win 65535, length 4122
13:04:10.874373 IP 10.0.2.15.51158 > 99.84.126.35.443: Flags [.], ack 102097, win 65535, length 0
13:04:10.874453 IP 10.0.2.15.51158 > 99.84.126.35.443: Flags [.], ack 106219, win 65535, length 0
13:04:10.875897 IP 99.84.126.35.443 > 10.0.2.15.51158: Flags [P.], seq 106219:108967, ack 803, win 65535, length 2748
13:04:10.875914 IP 10.0.2.15.51158 > 99.84.126.35.443: Flags [.], ack 108967, win 65535, length 0
13:04:10.876461 IP 99.84.126.35.443 > 10.0.2.15.51158: Flags [P.], seq 108967:122707, ack 803, win 65535, length 13740
13:04:10.876475 IP 10.0.2.15.51158 > 99.84.126.35.443: Flags [.], ack 122707, win 65535, length 0
13:04:10.876514 IP 99.84.126.35.443 > 10.0.2.15.51158: Flags [P.], seq 122707:125455, ack 803, win 65535, length 2748
13:04:10.876520 IP 10.0.2.15.51158 > 99.84.126.35.443: Flags [.], ack 125455, win 65535, length 0
13:04:10.876789 IP 99.84.126.35.443 > 10.0.2.15.51158: Flags [P.], seq 125455:126829, ack 803, win 65535, length 1374
13:04:10.876800 IP 10.0.2.15.51158 > 99.84.126.35.443: Flags [.], ack 126829, win 65535, length 0
13:04:10.877880 IP 99.84.126.35.443 > 10.0.2.15.51158: Flags [P.], seq 126829:128203, ack 803, win 65535, length 1374
13:04:10.877901 IP 10.0.2.15.51158 > 99.84.126.35.443: Flags [.], ack 128203, win 65535, length 0
13:04:10.878655 IP 99.84.126.35.443 > 10.0.2.15.51158: Flags [P.], seq 128203:132325, ack 803, win 65535, length 4122
13:04:10.878667 IP 10.0.2.15.51158 > 99.84.126.35.443: Flags [.], ack 132325, win 65535, length 0
13:04:10.879840 IP 99.84.126.35.443 > 10.0.2.15.51158: Flags [P.], seq 132325:133699, ack 803, win 65535, length 1374
13:04:10.879859 IP 10.0.2.15.51158 > 99.84.126.35.443: Flags [.], ack 133699, win 65535, length 0
13:04:10.882257 IP 99.84.126.35.443 > 10.0.2.15.51158: Flags [P.], seq 133699:144691, ack 803, win 65535, length 10992
13:04:10.882280 IP 10.0.2.15.51158 > 99.84.126.35.443: Flags [.], ack 144691, win 65535, length 0
13:04:10.882429 IP 99.84.126.35.443 > 10.0.2.15.51158: Flags [P.], seq 144691:146065, ack 803, win 65535, length 1374
13:04:10.882442 IP 10.0.2.15.51158 > 99.84.126.35.443: Flags [.], ack 146065, win 65535, length 0
13:04:10.883121 IP 99.84.126.35.443 > 10.0.2.15.51158: Flags [P.], seq 146065:151561, ack 803, win 65535, length 5496
13:04:10.883123 IP 99.84.126.35.443 > 10.0.2.15.51158: Flags [P.], seq 151561:154309, ack 803, win 65535, length 2748
13:04:10.883141 IP 10.0.2.15.51158 > 99.84.126.35.443: Flags [.], ack 151561, win 65535, length 0
13:04:10.883167 IP 10.0.2.15.51158 > 99.84.126.35.443: Flags [.], ack 154309, win 65535, length 0
13:04:10.884056 IP 99.84.126.35.443 > 10.0.2.15.51158: Flags [P.], seq 154309:159805, ack 803, win 65535, length 5496
13:04:10.884058 IP 99.84.126.35.443 > 10.0.2.15.51158: Flags [P.], seq 159805:162553, ack 803, win 65535, length 2748
13:04:10.884117 IP 10.0.2.15.51158 > 99.84.126.35.443: Flags [.], ack 159805, win 65535, length 0
13:04:10.884149 IP 10.0.2.15.51158 > 99.84.126.35.443: Flags [.], ack 162553, win 65535, length 0
13:04:10.884382 IP 99.84.126.35.443 > 10.0.2.15.51158: Flags [P.], seq 162553:163927, ack 803, win 65535, length 1374
13:04:10.884389 IP 10.0.2.15.51158 > 99.84.126.35.443: Flags [.], ack 163927, win 65535, length 0
13:04:10.885344 IP 99.84.126.35.443 > 10.0.2.15.51158: Flags [P.], seq 163927:170797, ack 803, win 65535, length 6870
13:04:10.885346 IP 99.84.126.35.443 > 10.0.2.15.51158: Flags [P.], seq 170797:177667, ack 803, win 65535, length 6870
13:04:10.885362 IP 10.0.2.15.51158 > 99.84.126.35.443: Flags [.], ack 170797, win 65535, length 0
13:04:10.885392 IP 10.0.2.15.51158 > 99.84.126.35.443: Flags [.], ack 177667, win 65535, length 0
13:04:10.886444 IP 99.84.126.35.443 > 10.0.2.15.51158: Flags [P.], seq 177667:185911, ack 803, win 65535, length 8244
13:04:10.886460 IP 10.0.2.15.51158 > 99.84.126.35.443: Flags [.], ack 185911, win 65535, length 0
13:04:10.888644 IP 99.84.126.35.443 > 10.0.2.15.51158: Flags [P.], seq 185911:192781, ack 803, win 65535, length 6870
13:04:10.888648 IP 99.84.126.35.443 > 10.0.2.15.51158: Flags [P.], seq 192781:198277, ack 803, win 65535, length 5496
13:04:10.888677 IP 10.0.2.15.51158 > 99.84.126.35.443: Flags [.], ack 192781, win 65535, length 0
13:04:10.888773 IP 10.0.2.15.51158 > 99.84.126.35.443: Flags [.], ack 198277, win 65535, length 0
13:04:10.888815 IP 99.84.126.35.443 > 10.0.2.15.51158: Flags [P.], seq 198277:203773, ack 803, win 65535, length 5496
13:04:10.888822 IP 10.0.2.15.51158 > 99.84.126.35.443: Flags [.], ack 203773, win 65535, length 0
13:04:10.892293 IP 99.84.126.35.443 > 10.0.2.15.51158: Flags [P.], seq 203773:213391, ack 803, win 65535, length 9618
13:04:10.892296 IP 99.84.126.35.443 > 10.0.2.15.51158: Flags [P.], seq 213391:217513, ack 803, win 65535, length 4122
13:04:10.892315 IP 10.0.2.15.51158 > 99.84.126.35.443: Flags [.], ack 213391, win 65535, length 0
13:04:10.892347 IP 10.0.2.15.51158 > 99.84.126.35.443: Flags [.], ack 217513, win 65535, length 0
13:04:10.892384 IP 99.84.126.35.443 > 10.0.2.15.51158: Flags [P.], seq 217513:235375, ack 803, win 65535, length 17862
13:04:10.892389 IP 10.0.2.15.51158 > 99.84.126.35.443: Flags [.], ack 235375, win 65535, length 0
13:04:10.893601 IP 99.84.126.35.443 > 10.0.2.15.51158: Flags [.], seq 235375:254355, ack 803, win 65535, length 18980
13:04:10.893621 IP 10.0.2.15.51158 > 99.84.126.35.443: Flags [.], ack 254355, win 65535, length 0
13:04:10.894164 IP 99.84.126.35.443 > 10.0.2.15.51158: Flags [P.], seq 254355:255985, ack 803, win 65535, length 1630
13:04:10.894167 IP 99.84.126.35.443 > 10.0.2.15.51158: Flags [.], seq 255985:261825, ack 803, win 65535, length 5840
13:04:10.894188 IP 10.0.2.15.51158 > 99.84.126.35.443: Flags [.], ack 255985, win 65535, length 0
13:04:10.894210 IP 10.0.2.15.51158 > 99.84.126.35.443: Flags [.], ack 261825, win 65535, length 0
13:04:10.894342 IP 99.84.126.35.443 > 10.0.2.15.51158: Flags [P.], seq 261825:264229, ack 803, win 65535, length 2404
13:04:10.894343 IP 99.84.126.35.443 > 10.0.2.15.51158: Flags [P.], seq 264229:265603, ack 803, win 65535, length 1374
13:04:10.894351 IP 10.0.2.15.51158 > 99.84.126.35.443: Flags [.], ack 264229, win 65535, length 0
13:04:10.894368 IP 10.0.2.15.51158 > 99.84.126.35.443: Flags [.], ack 265603, win 65535, length 0
13:04:10.895095 IP 99.84.126.35.443 > 10.0.2.15.51158: Flags [P.], seq 265603:272473, ack 803, win 65535, length 6870
13:04:10.895098 IP 99.84.126.35.443 > 10.0.2.15.51158: Flags [P.], seq 272473:279343, ack 803, win 65535, length 6870
13:04:10.895129 IP 10.0.2.15.51158 > 99.84.126.35.443: Flags [.], ack 272473, win 65535, length 0
13:04:10.895226 IP 10.0.2.15.51158 > 99.84.126.35.443: Flags [.], ack 279343, win 65535, length 0
13:04:10.895256 IP 99.84.126.35.443 > 10.0.2.15.51158: Flags [P.], seq 279343:282091, ack 803, win 65535, length 2748
13:04:10.895262 IP 10.0.2.15.51158 > 99.84.126.35.443: Flags [.], ack 282091, win 65535, length 0
13:04:10.895431 IP 99.84.126.35.443 > 10.0.2.15.51158: Flags [P.], seq 282091:283465, ack 803, win 65535, length 1374
13:04:10.895439 IP 10.0.2.15.51158 > 99.84.126.35.443: Flags [.], ack 283465, win 65535, length 0
13:04:10.897677 IP 99.84.126.35.443 > 10.0.2.15.51158: Flags [P.], seq 283465:290335, ack 803, win 65535, length 6870
13:04:10.897680 IP 99.84.126.35.443 > 10.0.2.15.51158: Flags [P.], seq 290335:298579, ack 803, win 65535, length 8244
13:04:10.897708 IP 10.0.2.15.51158 > 99.84.126.35.443: Flags [.], ack 290335, win 65535, length 0
13:04:10.897730 IP 10.0.2.15.51158 > 99.84.126.35.443: Flags [.], ack 298579, win 65535, length 0
13:04:10.897757 IP 99.84.126.35.443 > 10.0.2.15.51158: Flags [P.], seq 298579:313693, ack 803, win 65535, length 15114
13:04:10.897761 IP 10.0.2.15.51158 > 99.84.126.35.443: Flags [.], ack 313693, win 65535, length 0
13:04:10.899324 IP 99.84.126.35.443 > 10.0.2.15.51158: Flags [P.], seq 313693:319189, ack 803, win 65535, length 5496
13:04:10.899326 IP 99.84.126.35.443 > 10.0.2.15.51158: Flags [P.], seq 319189:321937, ack 803, win 65535, length 2748
13:04:10.899327 IP 99.84.126.35.443 > 10.0.2.15.51158: Flags [P.], seq 321937:324685, ack 803, win 65535, length 2748
13:04:10.899345 IP 10.0.2.15.51158 > 99.84.126.35.443: Flags [.], ack 319189, win 65535, length 0
13:04:10.899367 IP 10.0.2.15.51158 > 99.84.126.35.443: Flags [.], ack 321937, win 65535, length 0
13:04:10.899378 IP 10.0.2.15.51158 > 99.84.126.35.443: Flags [.], ack 324685, win 65535, length 0
13:04:10.899397 IP 99.84.126.35.443 > 10.0.2.15.51158: Flags [P.], seq 324685:328807, ack 803, win 65535, length 4122
13:04:10.899398 IP 99.84.126.35.443 > 10.0.2.15.51158: Flags [P.], seq 328807:330181, ack 803, win 65535, length 1374
13:04:10.899454 IP 10.0.2.15.51158 > 99.84.126.35.443: Flags [.], ack 328807, win 65535, length 0
13:04:10.899468 IP 10.0.2.15.51158 > 99.84.126.35.443: Flags [.], ack 330181, win 65535, length 0
13:04:10.899606 IP 99.84.126.35.443 > 10.0.2.15.51158: Flags [P.], seq 330181:334303, ack 803, win 65535, length 4122
13:04:10.899614 IP 10.0.2.15.51158 > 99.84.126.35.443: Flags [.], ack 334303, win 65535, length 0
13:04:10.899748 IP 99.84.126.35.443 > 10.0.2.15.51158: Flags [P.], seq 334303:337051, ack 803, win 65535, length 2748
13:04:10.899749 IP 99.84.126.35.443 > 10.0.2.15.51158: Flags [.], seq 337051:338511, ack 803, win 65535, length 1460
13:04:10.899756 IP 10.0.2.15.51158 > 99.84.126.35.443: Flags [.], ack 337051, win 65535, length 0
13:04:10.899790 IP 10.0.2.15.51158 > 99.84.126.35.443: Flags [.], ack 338511, win 65535, length 0
13:04:10.899872 IP 99.84.126.35.443 > 10.0.2.15.51158: Flags [P.], seq 338511:339799, ack 803, win 65535, length 1288
13:04:10.899919 IP 10.0.2.15.51158 > 99.84.126.35.443: Flags [.], ack 339799, win 65535, length 0
13:04:10.900118 IP 99.84.126.35.443 > 10.0.2.15.51158: Flags [P.], seq 339799:342547, ack 803, win 65535, length 2748
13:04:10.900119 IP 99.84.126.35.443 > 10.0.2.15.51158: Flags [P.], seq 342547:346669, ack 803, win 65535, length 4122
13:04:10.900129 IP 10.0.2.15.51158 > 99.84.126.35.443: Flags [.], ack 342547, win 65535, length 0
13:04:10.900143 IP 10.0.2.15.51158 > 99.84.126.35.443: Flags [.], ack 346669, win 65535, length 0
13:04:10.900269 IP 99.84.126.35.443 > 10.0.2.15.51158: Flags [P.], seq 346669:349417, ack 803, win 65535, length 2748
13:04:10.900277 IP 10.0.2.15.51158 > 99.84.126.35.443: Flags [.], ack 349417, win 65535, length 0
13:04:10.900527 IP 99.84.126.35.443 > 10.0.2.15.51158: Flags [P.], seq 349417:352165, ack 803, win 65535, length 2748
13:04:10.900529 IP 99.84.126.35.443 > 10.0.2.15.51158: Flags [P.], seq 352165:353539, ack 803, win 65535, length 1374
13:04:10.900543 IP 10.0.2.15.51158 > 99.84.126.35.443: Flags [.], ack 352165, win 65535, length 0
13:04:10.900558 IP 10.0.2.15.51158 > 99.84.126.35.443: Flags [.], ack 353539, win 65535, length 0
13:04:10.901191 IP 99.84.126.35.443 > 10.0.2.15.51158: Flags [P.], seq 353539:357661, ack 803, win 65535, length 4122
13:04:10.901207 IP 10.0.2.15.51158 > 99.84.126.35.443: Flags [.], ack 357661, win 65535, length 0
13:04:10.901330 IP 99.84.126.35.443 > 10.0.2.15.51158: Flags [P.], seq 357661:360409, ack 803, win 65535, length 2748
13:04:10.901338 IP 10.0.2.15.51158 > 99.84.126.35.443: Flags [.], ack 360409, win 65535, length 0
13:04:10.902203 IP 99.84.126.35.443 > 10.0.2.15.51158: Flags [P.], seq 360409:364531, ack 803, win 65535, length 4122
13:04:10.902206 IP 99.84.126.35.443 > 10.0.2.15.51158: Flags [.], seq 364531:365991, ack 803, win 65535, length 1460
13:04:10.902226 IP 10.0.2.15.51158 > 99.84.126.35.443: Flags [.], ack 364531, win 65535, length 0
13:04:10.902257 IP 10.0.2.15.51158 > 99.84.126.35.443: Flags [.], ack 365991, win 65535, length 0
13:04:10.902410 IP 99.84.126.35.443 > 10.0.2.15.51158: Flags [P.], seq 365991:370027, ack 803, win 65535, length 4036
13:04:10.902411 IP 99.84.126.35.443 > 10.0.2.15.51158: Flags [P.], seq 370027:374149, ack 803, win 65535, length 4122
13:04:10.902420 IP 10.0.2.15.51158 > 99.84.126.35.443: Flags [.], ack 370027, win 65535, length 0
13:04:10.902503 IP 10.0.2.15.51158 > 99.84.126.35.443: Flags [.], ack 374149, win 65535, length 0
13:04:10.902685 IP 99.84.126.35.443 > 10.0.2.15.51158: Flags [P.], seq 374149:379645, ack 803, win 65535, length 5496
13:04:10.902752 IP 10.0.2.15.51158 > 99.84.126.35.443: Flags [.], ack 379645, win 65535, length 0
13:04:10.903075 IP 99.84.126.35.443 > 10.0.2.15.51158: Flags [P.], seq 379645:382393, ack 803, win 65535, length 2748
13:04:10.903076 IP 99.84.126.35.443 > 10.0.2.15.51158: Flags [P.], seq 382393:385141, ack 803, win 65535, length 2748
13:04:10.903077 IP 99.84.126.35.443 > 10.0.2.15.51158: Flags [P.], seq 385141:386515, ack 803, win 65535, length 1374
13:04:10.903091 IP 10.0.2.15.51158 > 99.84.126.35.443: Flags [.], ack 382393, win 65535, length 0
13:04:10.903112 IP 10.0.2.15.51158 > 99.84.126.35.443: Flags [.], ack 385141, win 65535, length 0
13:04:10.903210 IP 10.0.2.15.51158 > 99.84.126.35.443: Flags [.], ack 386515, win 65535, length 0
13:04:10.903585 IP 99.84.126.35.443 > 10.0.2.15.51158: Flags [P.], seq 386515:390637, ack 803, win 65535, length 4122
13:04:10.903587 IP 99.84.126.35.443 > 10.0.2.15.51158: Flags [P.], seq 390637:393385, ack 803, win 65535, length 2748
13:04:10.903587 IP 99.84.126.35.443 > 10.0.2.15.51158: Flags [P.], seq 393385:396133, ack 803, win 65535, length 2748
13:04:10.903588 IP 99.84.126.35.443 > 10.0.2.15.51158: Flags [P.], seq 396133:398881, ack 803, win 65535, length 2748
13:04:10.903599 IP 10.0.2.15.51158 > 99.84.126.35.443: Flags [.], ack 390637, win 65535, length 0
13:04:10.903617 IP 10.0.2.15.51158 > 99.84.126.35.443: Flags [.], ack 393385, win 65535, length 0
13:04:10.903628 IP 10.0.2.15.51158 > 99.84.126.35.443: Flags [.], ack 396133, win 65535, length 0
13:04:10.903639 IP 10.0.2.15.51158 > 99.84.126.35.443: Flags [.], ack 398881, win 65535, length 0
13:04:10.903655 IP 99.84.126.35.443 > 10.0.2.15.51158: Flags [P.], seq 398881:400255, ack 803, win 65535, length 1374
13:04:10.903659 IP 10.0.2.15.51158 > 99.84.126.35.443: Flags [.], ack 400255, win 65535, length 0
13:04:10.904549 IP 99.84.126.35.443 > 10.0.2.15.51158: Flags [P.], seq 400255:408499, ack 803, win 65535, length 8244
13:04:10.904552 IP 99.84.126.35.443 > 10.0.2.15.51158: Flags [P.], seq 408499:411247, ack 803, win 65535, length 2748
13:04:10.904614 IP 10.0.2.15.51158 > 99.84.126.35.443: Flags [.], ack 408499, win 65535, length 0
13:04:10.904647 IP 10.0.2.15.51158 > 99.84.126.35.443: Flags [.], ack 411247, win 65535, length 0
13:04:10.904867 IP 99.84.126.35.443 > 10.0.2.15.51158: Flags [P.], seq 411247:413995, ack 803, win 65535, length 2748
13:04:10.904868 IP 99.84.126.35.443 > 10.0.2.15.51158: Flags [.], seq 413995:416915, ack 803, win 65535, length 2920
13:04:10.904879 IP 10.0.2.15.51158 > 99.84.126.35.443: Flags [.], ack 413995, win 65535, length 0
13:04:10.904927 IP 10.0.2.15.51158 > 99.84.126.35.443: Flags [.], ack 416915, win 65535, length 0
13:04:10.905011 IP 99.84.126.35.443 > 10.0.2.15.51158: Flags [P.], seq 416915:418117, ack 803, win 65535, length 1202
13:04:10.905012 IP 99.84.126.35.443 > 10.0.2.15.51158: Flags [P.], seq 418117:419491, ack 803, win 65535, length 1374
13:04:10.905017 IP 10.0.2.15.51158 > 99.84.126.35.443: Flags [.], ack 418117, win 65535, length 0
13:04:10.905088 IP 10.0.2.15.51158 > 99.84.126.35.443: Flags [.], ack 419491, win 65535, length 0
13:04:10.905985 IP 99.84.126.35.443 > 10.0.2.15.51158: Flags [P.], seq 419491:423613, ack 803, win 65535, length 4122
13:04:10.905987 IP 99.84.126.35.443 > 10.0.2.15.51158: Flags [P.], seq 423613:426361, ack 803, win 65535, length 2748
13:04:10.905987 IP 99.84.126.35.443 > 10.0.2.15.51158: Flags [P.], seq 426361:429109, ack 803, win 65535, length 2748
13:04:10.905989 IP 99.84.126.35.443 > 10.0.2.15.51158: Flags [P.], seq 429109:434605, ack 803, win 65535, length 5496
13:04:10.906005 IP 10.0.2.15.51158 > 99.84.126.35.443: Flags [.], ack 423613, win 65535, length 0
13:04:10.906068 IP 10.0.2.15.51158 > 99.84.126.35.443: Flags [.], ack 426361, win 65535, length 0
13:04:10.906191 IP 10.0.2.15.51158 > 99.84.126.35.443: Flags [.], ack 429109, win 65535, length 0
13:04:10.906571 IP 10.0.2.15.51158 > 99.84.126.35.443: Flags [.], ack 434605, win 65535, length 0
13:04:10.906599 IP 99.84.126.35.443 > 10.0.2.15.51158: Flags [P.], seq 434605:435979, ack 803, win 65535, length 1374
13:04:10.906647 IP 99.84.126.35.443 > 10.0.2.15.51158: Flags [P.], seq 435979:440101, ack 803, win 65535, length 4122
13:04:10.906648 IP 99.84.126.35.443 > 10.0.2.15.51158: Flags [P.], seq 440101:444223, ack 803, win 65535, length 4122
13:04:10.906649 IP 99.84.126.35.443 > 10.0.2.15.51158: Flags [P.], seq 444223:446971, ack 803, win 65535, length 2748
13:04:10.906658 IP 10.0.2.15.51158 > 99.84.126.35.443: Flags [.], ack 435979, win 65535, length 0
13:04:10.906676 IP 10.0.2.15.51158 > 99.84.126.35.443: Flags [.], ack 440101, win 65535, length 0
13:04:10.906687 IP 10.0.2.15.51158 > 99.84.126.35.443: Flags [.], ack 444223, win 65535, length 0
13:04:10.906700 IP 10.0.2.15.51158 > 99.84.126.35.443: Flags [.], ack 446971, win 65535, length 0
13:04:10.907499 IP 99.84.126.35.443 > 10.0.2.15.51158: Flags [P.], seq 446971:453841, ack 803, win 65535, length 6870
13:04:10.907514 IP 10.0.2.15.51158 > 99.84.126.35.443: Flags [.], ack 453841, win 65535, length 0
13:04:10.908004 IP 99.84.126.35.443 > 10.0.2.15.51158: Flags [P.], seq 453841:457963, ack 803, win 65535, length 4122
13:04:10.908005 IP 99.84.126.35.443 > 10.0.2.15.51158: Flags [P.], seq 457963:460711, ack 803, win 65535, length 2748
13:04:10.908006 IP 99.84.126.35.443 > 10.0.2.15.51158: Flags [P.], seq 460711:464833, ack 803, win 65535, length 4122
13:04:10.908018 IP 10.0.2.15.51158 > 99.84.126.35.443: Flags [.], ack 457963, win 65535, length 0
13:04:10.908035 IP 10.0.2.15.51158 > 99.84.126.35.443: Flags [.], ack 460711, win 65535, length 0
13:04:10.908048 IP 10.0.2.15.51158 > 99.84.126.35.443: Flags [.], ack 464833, win 65535, length 0
13:04:10.908067 IP 99.84.126.35.443 > 10.0.2.15.51158: Flags [P.], seq 464833:466207, ack 803, win 65535, length 1374
13:04:10.908072 IP 10.0.2.15.51158 > 99.84.126.35.443: Flags [.], ack 466207, win 65535, length 0
13:04:10.909273 IP 99.84.126.35.443 > 10.0.2.15.51158: Flags [P.], seq 466207:477199, ack 803, win 65535, length 10992
13:04:10.909294 IP 10.0.2.15.51158 > 99.84.126.35.443: Flags [.], ack 477199, win 65535, length 0

