13:19:21.761933 IP 99.84.126.121.443 > 10.0.2.15.45732: Flags [S.], seq 59328001, ack 602383550, win 65535, options [mss 1460], length 0
13:19:21.761968 IP 10.0.2.15.45732 > 99.84.126.121.443: Flags [.], ack 1, win 64240, length 0
13:19:21.770377 IP 10.0.2.15.45732 > 99.84.126.121.443: Flags [P.], seq 1:518, ack 1, win 64240, length 517
13:19:21.770955 IP 99.84.126.121.443 > 10.0.2.15.45732: Flags [.], ack 518, win 65535, length 0
13:19:21.788041 IP 99.84.126.121.443 > 10.0.2.15.45732: Flags [.], seq 1:2921, ack 518, win 65535, length 2920
13:19:21.788063 IP 10.0.2.15.45732 > 99.84.126.121.443: Flags [.], ack 2921, win 62780, length 0
13:19:21.788390 IP 99.84.126.121.443 > 10.0.2.15.45732: Flags [P.], seq 2921:5497, ack 518, win 65535, length 2576
13:19:21.788407 IP 10.0.2.15.45732 > 99.84.126.121.443: Flags [.], ack 5497, win 61320, length 0
13:19:21.790561 IP 99.84.126.121.443 > 10.0.2.15.45732: Flags [P.], seq 5497:5824, ack 518, win 65535, length 327
13:19:21.790582 IP 10.0.2.15.45732 > 99.84.126.121.443: Flags [.], ack 5824, win 62780, length 0
13:19:21.791105 IP 10.0.2.15.45732 > 99.84.126.121.443: Flags [P.], seq 518:582, ack 5824, win 62780, length 64
13:19:21.791352 IP 10.0.2.15.45732 > 99.84.126.121.443: Flags [P.], seq 582:628, ack 5824, win 62780, length 46
13:19:21.791602 IP 99.84.126.121.443 > 10.0.2.15.45732: Flags [.], ack 582, win 65535, length 0
13:19:21.791604 IP 99.84.126.121.443 > 10.0.2.15.45732: Flags [.], ack 628, win 65535, length 0
13:19:21.791637 IP 10.0.2.15.45732 > 99.84.126.121.443: Flags [P.], seq 628:677, ack 5824, win 62780, length 49
13:19:21.791802 IP 10.0.2.15.45732 > 99.84.126.121.443: Flags [P.], seq 677:712, ack 5824, win 62780, length 35
13:19:21.791975 IP 99.84.126.121.443 > 10.0.2.15.45732: Flags [.], ack 677, win 65535, length 0
13:19:21.791976 IP 99.84.126.121.443 > 10.0.2.15.45732: Flags [.], ack 712, win 65535, length 0
13:19:21.792043 IP 10.0.2.15.45732 > 99.84.126.121.443: Flags [P.], seq 712:772, ack 5824, win 62780, length 60
13:19:21.792524 IP 99.84.126.121.443 > 10.0.2.15.45732: Flags [.], ack 772, win 65535, length 0
13:19:21.806253 IP 99.84.126.121.443 > 10.0.2.15.45732: Flags [P.], seq 5824:5917, ack 772, win 65535, length 93
13:19:21.806271 IP 10.0.2.15.45732 > 99.84.126.121.443: Flags [.], ack 5917, win 62780, length 0
13:19:21.806551 IP 10.0.2.15.45732 > 99.84.126.121.443: Flags [P.], seq 772:803, ack 5917, win 62780, length 31
13:19:21.806902 IP 99.84.126.121.443 > 10.0.2.15.45732: Flags [.], ack 803, win 65535, length 0
13:19:21.886223 IP 99.84.126.121.443 > 10.0.2.15.45732: Flags [.], seq 5917:14677, ack 803, win 65535, length 8760
13:19:21.886261 IP 10.0.2.15.45732 > 99.84.126.121.443: Flags [.], ack 14677, win 58400, length 0
13:19:21.886635 IP 99.84.126.121.443 > 10.0.2.15.45732: Flags [P.], seq 14677:16909, ack 803, win 65535, length 2232
13:19:21.886649 IP 10.0.2.15.45732 > 99.84.126.121.443: Flags [.], ack 16909, win 56940, length 0
13:19:21.888949 IP 99.84.126.121.443 > 10.0.2.15.45732: Flags [.], seq 16909:28589, ack 803, win 65535, length 11680
13:19:21.888970 IP 10.0.2.15.45732 > 99.84.126.121.443: Flags [.], ack 28589, win 56940, length 0
13:19:21.889408 IP 99.84.126.121.443 > 10.0.2.15.45732: Flags [P.], seq 28589:37519, ack 803, win 65535, length 8930
13:19:21.889426 IP 10.0.2.15.45732 > 99.84.126.121.443: Flags [.], ack 37519, win 51100, length 0
13:19:21.891527 IP 99.84.126.121.443 > 10.0.2.15.45732: Flags [P.], seq 37519:44389, ack 803, win 65535, length 6870
13:19:21.891529 IP 99.84.126.121.443 > 10.0.2.15.45732: Flags [P.], seq 44389:49885, ack 803, win 65535, length 5496
13:19:21.891547 IP 10.0.2.15.45732 > 99.84.126.121.443: Flags [.], ack 44389, win 59860, length 0
13:19:21.891609 IP 10.0.2.15.45732 > 99.84.126.121.443: Flags [.], ack 49885, win 55480, length 0
13:19:21.899486 IP 99.84.126.121.443 > 10.0.2.15.45732: Flags [P.], seq 49885:60877, ack 803, win 65535, length 10992
13:19:21.899504 IP 10.0.2.15.45732 > 99.84.126.121.443: Flags [.], ack 60877, win 56940, length 0
13:19:21.903876 IP 99.84.126.121.443 > 10.0.2.15.45732: Flags [P.], seq 60877:73243, ack 803, win 65535, length 12366
13:19:21.904027 IP 10.0.2.15.45732 > 99.84.126.121.443: Flags [.], ack 73243, win 62780, length 0
13:19:21.904530 IP 99.84.126.121.443 > 10.0.2.15.45732: Flags [P.], seq 73243:81487, ack 803, win 65535, length 8244
13:19:21.904559 IP 10.0.2.15.45732 > 99.84.126.121.443: Flags [.], ack 81487, win 65535, length 0
13:19:21.906689 IP 99.84.126.121.443 > 10.0.2.15.45732: Flags [P.], seq 81487:95227, ack 803, win 65535, length 13740
13:19:21.906712 IP 10.0.2.15.45732 > 99.84.126.121.443: Flags [.], ack 95227, win 65535, length 0
13:19:21.906848 IP 99.84.126.121.443 > 10.0.2.15.45732: Flags [P.], seq 95227:100723, ack 803, win 65535, length 5496
13:19:21.906857 IP 10.0.2.15.45732 > 99.84.126.121.443: Flags [.], ack 100723, win 65535, length 0
13:19:21.907155 IP 99.84.126.121.443 > 10.0.2.15.45732: Flags [P.], seq 100723:103471, ack 803, win 65535, length 2748
13:19:21.907166 IP 10.0.2.15.45732 > 99.84.126.121.443: Flags [.], ack 103471, win 65535, length 0
13:19:21.908421 IP 99.84.126.121.443 > 10.0.2.15.45732: Flags [P.], seq 103471:108967, ack 803, win 65535, length 5496
13:19:21.908445 IP 10.0.2.15.45732 > 99.84.126.121.443: Flags [.], ack 108967, win 65535, length 0
13:19:21.908970 IP 99.84.126.121.443 > 10.0.2.15.45732: Flags [P.], seq 108967:118585, ack 803, win 65535, length 9618
13:19:21.908984 IP 10.0.2.15.45732 > 99.84.126.121.443: Flags [.], ack 118585, win 65535, length 0
13:19:21.911802 IP 99.84.126.121.443 > 10.0.2.15.45732: Flags [P.], seq 118585:125455, ack 803, win 65535, length 6870
13:19:21.911820 IP 10.0.2.15.45732 > 99.84.126.121.443: Flags [.], ack 125455, win 65535, length 0
13:19:21.912114 IP 99.84.126.121.443 > 10.0.2.15.45732: Flags [P.], seq 125455:132325, ack 803, win 65535, length 6870
13:19:21.912182 IP 10.0.2.15.45732 > 99.84.126.121.443: Flags [.], ack 132325, win 65535, length 0
13:19:21.912612 IP 99.84.126.121.443 > 10.0.2.15.45732: Flags [P.], seq 132325:137821, ack 803, win 65535, length 5496
13:19:21.912614 IP 99.84.126.121.443 > 10.0.2.15.45732: Flags [P.], seq 137821:140569, ack 803, win 65535, length 2748
13:19:21.912630 IP 10.0.2.15.45732 > 99.84.126.121.443: Flags [.], ack 137821, win 65535, length 0
13:19:21.912649 IP 10.0.2.15.45732 > 99.84.126.121.443: Flags [.], ack 140569, win 65535, length 0
13:19:21.914958 IP 99.84.126.121.443 > 10.0.2.15.45732: Flags [P.], seq 140569:150187, ack 803, win 65535, length 9618
13:19:21.914974 IP 10.0.2.15.45732 > 99.84.126.121.443: Flags [.], ack 150187, win 65535, length 0
13:19:21.916988 IP 99.84.126.121.443 > 10.0.2.15.45732: Flags [P.], seq 150187:155683, ack 803, win 65535, length 5496
13:19:21.917002 IP 10.0.2.15.45732 > 99.84.126.121.443: Flags [.], ack 155683, win 65535, length 0
13:19:21.918072 IP 99.84.126.121.443 > 10.0.2.15.45732: Flags [P.], seq 155683:162553, ack 803, win 65535, length 6870
13:19:21.918133 IP 10.0.2.15.45732 > 99.84.126.121.443: Flags [.], ack 162553, win 65535, length 0
13:19:21.918455 IP 99.84.126.121.443 > 10.0.2.15.45732: Flags [P.], seq 162553:169423, ack 803, win 65535, length 6870
13:19:21.918468 IP 10.0.2.15.45732 > 99.84.126.121.443: Flags [.], ack 169423, win 65535, length 0
13:19:21.918754 IP 99.84.126.121.443 > 10.0.2.15.45732: Flags [P.], seq 169423:177667, ack 803, win 65535, length 8244
13:19:21.918767 IP 10.0.2.15.45732 > 99.84.126.121.443: Flags [.], ack 177667, win 65535, length 0
13:19:21.918967 IP 99.84.126.121.443 > 10.0.2.15.45732: Flags [P.], seq 177667:181789, ack 803, win 65535, length 4122
13:19:21.918974 IP 10.0.2.15.45732 > 99.84.126.121.443: Flags [.], ack 181789, win 65535, length 0
13:19:21.920326 IP 99.84.126.121.443 > 10.0.2.15.45732: Flags [P.], seq 181789:190033, ack 803, win 65535, length 8244
13:19:21.920341 IP 10.0.2.15.45732 > 99.84.126.121.443: Flags [.], ack 190033, win 65535, length 0
13:19:21.920535 IP 99.84.126.121.443 > 10.0.2.15.45732: Flags [P.], seq 190033:191407, ack 803, win 65535, length 1374
13:19:21.920546 IP 10.0.2.15.45732 > 99.84.126.121.443: Flags [.], ack 191407, win 65535, length 0
13:19:21.921233 IP 99.84.126.121.443 > 10.0.2.15.45732: Flags [P.], seq 191407:198277, ack 803, win 65535, length 6870
13:19:21.921247 IP 10.0.2.15.45732 > 99.84.126.121.443: Flags [.], ack 198277, win 65535, length 0
13:19:21.923577 IP 99.84.126.121.443 > 10.0.2.15.45732: Flags [P.], seq 198277:205147, ack 803, win 65535, length 6870
13:19:21.923592 IP 10.0.2.15.45732 > 99.84.126.121.443: Flags [.], ack 205147, win 65535, length 0
13:19:21.923870 IP 99.84.126.121.443 > 10.0.2.15.45732: Flags [P.], seq 205147:210643, ack 803, win 65535, length 5496
13:19:21.923882 IP 10.0.2.15.45732 > 99.84.126.121.443: Flags [.], ack 210643, win 65535, length 0
13:19:21.924105 IP 99.84.126.121.443 > 10.0.2.15.45732: Flags [P.], seq 210643:220261, ack 803, win 65535, length 9618
13:19:21.924114 IP 10.0.2.15.45732 > 99.84.126.121.443: Flags [.], ack 220261, win 65535, length 0
13:19:21.924397 IP 99.84.126.121.443 > 10.0.2.15.45732: Flags [P.], seq 220261:223009, ack 803, win 65535, length 2748
13:19:21.924407 IP 10.0.2.15.45732 > 99.84.126.121.443: Flags [.], ack 223009, win 65535, length 0
13:19:21.924697 IP 99.84.126.121.443 > 10.0.2.15.45732: Flags [P.], seq 223009:228505, ack 803, win 65535, length 5496
13:19:21.924714 IP 10.0.2.15.45732 > 99.84.126.121.443: Flags [.], ack 228505, win 65535, length 0
13:19:21.926999 IP 99.84.126.121.443 > 10.0.2.15.45732: Flags [P.], seq 228505:239497, ack 803, win 65535, length 10992
13:19:21.927078 IP 10.0.2.15.45732 > 99.84.126.121.443: Flags [.], ack 239497, win 65535, length 0
13:19:21.927157 IP 99.84.126.121.443 > 10.0.2.15.45732: Flags [P.], seq 239497:244993, ack 803, win 65535, length 5496
13:19:21.927163 IP 10.0.2.15.45732 > 99.84.126.121.443: Flags [.], ack 244993, win 65535, length 0
13:19:21.927315 IP 99.84.126.121.443 > 10.0.2.15.45732: Flags [P.], seq 244993:249115, ack 803, win 65535, length 4122
13:19:21.927325 IP 10.0.2.15.45732 > 99.84.126.121.443: Flags [.], ack 249115, win 65535, length 0
13:19:21.927842 IP 99.84.126.121.443 > 10.0.2.15.45732: Flags [P.], seq 249115:260107, ack 803, win 65535, length 10992
13:19:21.928132 IP 10.0.2.15.45732 > 99.84.126.121.443: Flags [.], ack 260107, win 65535, length 0
13:19:21.928170 IP 99.84.126.121.443 > 10.0.2.15.45732: Flags [P.], seq 260107:264229, ack 803, win 65535, length 4122
13:19:21.928248 IP 10.0.2.15.45732 > 99.84.126.121.443: Flags [.], ack 264229, win 65535, length 0
13:19:21.929160 IP 99.84.126.121.443 > 10.0.2.15.45732: Flags [P.], seq 264229:268351, ack 803, win 65535, length 4122
13:19:21.929164 IP 99.84.126.121.443 > 10.0.2.15.45732: Flags [.], seq 268351:274191, ack 803, win 65535, length 5840
13:19:21.929190 IP 10.0.2.15.45732 > 99.84.126.121.443: Flags [.], ack 268351, win 65535, length 0
13:19:21.929210 IP 10.0.2.15.45732 > 99.84.126.121.443: Flags [.], ack 274191, win 65535, length 0
13:19:21.929338 IP 99.84.126.121.443 > 10.0.2.15.45732: Flags [P.], seq 274191:277969, ack 803, win 65535, length 3778
13:19:21.929347 IP 10.0.2.15.45732 > 99.84.126.121.443: Flags [.], ack 277969, win 65535, length 0
13:19:21.929478 IP 99.84.126.121.443 > 10.0.2.15.45732: Flags [P.], seq 277969:279343, ack 803, win 65535, length 1374
13:19:21.929486 IP 10.0.2.15.45732 > 99.84.126.121.443: Flags [.], ack 279343, win 65535, length 0
13:19:21.929648 IP 99.84.126.121.443 > 10.0.2.15.45732: Flags [P.], seq 279343:280717, ack 803, win 65535, length 1374
13:19:21.929655 IP 10.0.2.15.45732 > 99.84.126.121.443: Flags [.], ack 280717, win 65535, length 0
13:19:21.930324 IP 99.84.126.121.443 > 10.0.2.15.45732: Flags [P.], seq 280717:287587, ack 803, win 65535, length 6870
13:19:21.930349 IP 10.0.2.15.45732 > 99.84.126.121.443: Flags [.], ack 287587, win 65535, length 0
13:19:21.930630 IP 99.84.126.121.443 > 10.0.2.15.45732: Flags [P.], seq 287587:293083, ack 803, win 65535, length 5496
13:19:21.930645 IP 10.0.2.15.45732 > 99.84.126.121.443: Flags [.], ack 293083, win 65535, length 0
13:19:21.930811 IP 99.84.126.121.443 > 10.0.2.15.45732: Flags [P.], seq 293083:299953, ack 803, win 65535, length 6870
13:19:21.930823 IP 10.0.2.15.45732 > 99.84.126.121.443: Flags [.], ack 299953, win 65535, length 0
13:19:21.931159 IP 99.84.126.121.443 > 10.0.2.15.45732: Flags [P.], seq 299953:304075, ack 803, win 65535, length 4122
13:19:21.931209 IP 10.0.2.15.45732 > 99.84.126.121.443: Flags [.], ack 304075, win 65535, length 0
13:19:21.931324 IP 99.84.126.121.443 > 10.0.2.15.45732: Flags [.], seq 304075:306995, ack 803, win 65535, length 2920
13:19:21.931414 IP 10.0.2.15.45732 > 99.84.126.121.443: Flags [.], ack 306995, win 65535, length 0
13:19:21.931649 IP 99.84.126.121.443 > 10.0.2.15.45732: Flags [P.], seq 306995:310945, ack 803, win 65535, length 3950
13:19:21.931650 IP 99.84.126.121.443 > 10.0.2.15.45732: Flags [P.], seq 310945:316441, ack 803, win 65535, length 5496
13:19:21.931664 IP 10.0.2.15.45732 > 99.84.126.121.443: Flags [.], ack 310945, win 65535, length 0
13:19:21.931680 IP 10.0.2.15.45732 > 99.84.126.121.443: Flags [.], ack 316441, win 65535, length 0
13:19:21.932347 IP 99.84.126.121.443 > 10.0.2.15.45732: Flags [P.], seq 316441:324685, ack 803, win 65535, length 8244
13:19:21.932365 IP 10.0.2.15.45732 > 99.84.126.121.443: Flags [.], ack 324685, win 65535, length 0
13:19:21.932592 IP 99.84.126.121.443 > 10.0.2.15.45732: Flags [P.], seq 324685:330181, ack 803, win 65535, length 5496
13:19:21.932599 IP 10.0.2.15.45732 > 99.84.126.121.443: Flags [.], ack 330181, win 65535, length 0
13:19:21.932812 IP 99.84.126.121.443 > 10.0.2.15.45732: Flags [P.], seq 330181:331555, ack 803, win 65535, length 1374
13:19:21.932865 IP 10.0.2.15.45732 > 99.84.126.121.443: Flags [.], ack 331555, win 65535, length 0
13:19:21.933747 IP 99.84.126.121.443 > 10.0.2.15.45732: Flags [P.], seq 331555:341173, ack 803, win 65535, length 9618
13:19:21.933761 IP 10.0.2.15.45732 > 99.84.126.121.443: Flags [.], ack 341173, win 65535, length 0
13:19:21.934261 IP 99.84.126.121.443 > 10.0.2.15.45732: Flags [P.], seq 341173:346669, ack 803, win 65535, length 5496
13:19:21.934263 IP 99.84.126.121.443 > 10.0.2.15.45732: Flags [P.], seq 346669:354913, ack 803, win 65535, length 8244
13:19:21.934278 IP 10.0.2.15.45732 > 99.84.126.121.443: Flags [.], ack 346669, win 65535, length 0
13:19:21.934297 IP 10.0.2.15.45732 > 99.84.126.121.443: Flags [.], ack 354913, win 65535, length 0
13:19:21.934399 IP 99.84.126.121.443 > 10.0.2.15.45732: Flags [P.], seq 354913:357661, ack 803, win 65535, length 2748
13:19:21.934406 IP 10.0.2.15.45732 > 99.84.126.121.443: Flags [.], ack 357661, win 65535, length 0
13:19:21.934757 IP 99.84.126.121.443 > 10.0.2.15.45732: Flags [P.], seq 357661:363157, ack 803, win 65535, length 5496
13:19:21.934770 IP 10.0.2.15.45732 > 99.84.126.121.443: Flags [.], ack 363157, win 65535, length 0
13:19:21.935003 IP 99.84.126.121.443 > 10.0.2.15.45732: Flags [P.], seq 363157:367279, ack 803, win 65535, length 4122
13:19:21.935011 IP 10.0.2.15.45732 > 99.84.126.121.443: Flags [.], ack 367279, win 65535, length 0
13:19:21.935889 IP 99.84.126.121.443 > 10.0.2.15.45732: Flags [P.], seq 367279:374149, ack 803, win 65535, length 6870
13:19:21.935901 IP 10.0.2.15.45732 > 99.84.126.121.443: Flags [.], ack 374149, win 65535, length 0
13:19:21.936125 IP 99.84.126.121.443 > 10.0.2.15.45732: Flags [P.], seq 374149:378271, ack 803, win 65535, length 4122
13:19:21.936135 IP 10.0.2.15.45732 > 99.84.126.121.443: Flags [.], ack 378271, win 65535, length 0
13:19:21.936458 IP 99.84.126.121.443 > 10.0.2.15.45732: Flags [P.], seq 378271:385141, ack 803, win 65535, length 6870
13:19:21.936472 IP 10.0.2.15.45732 > 99.84.126.121.443: Flags [.], ack 385141, win 65535, length 0
13:19:21.939559 IP 99.84.126.121.443 > 10.0.2.15.45732: Flags [P.], seq 385141:394759, ack 803, win 65535, length 9618
13:19:21.939575 IP 10.0.2.15.45732 > 99.84.126.121.443: Flags [.], ack 394759, win 65535, length 0
13:19:21.939784 IP 99.84.126.121.443 > 10.0.2.15.45732: Flags [P.], seq 394759:403003, ack 803, win 65535, length 8244
13:19:21.939794 IP 10.0.2.15.45732 > 99.84.126.121.443: Flags [.], ack 403003, win 65535, length 0
13:19:21.939996 IP 99.84.126.121.443 > 10.0.2.15.45732: Flags [P.], seq 403003:409873, ack 803, win 65535, length 6870
13:19:21.940005 IP 10.0.2.15.45732 > 99.84.126.121.443: Flags [.], ack 409873, win 65535, length 0
13:19:21.940295 IP 99.84.126.121.443 > 10.0.2.15.45732: Flags [P.], seq 409873:415369, ack 803, win 65535, length 5496
13:19:21.940303 IP 10.0.2.15.45732 > 99.84.126.121.443: Flags [.], ack 415369, win 65535, length 0
13:19:21.941562 IP 99.84.126.121.443 > 10.0.2.15.45732: Flags [P.], seq 415369:422239, ack 803, win 65535, length 6870
13:19:21.941564 IP 99.84.126.121.443 > 10.0.2.15.45732: Flags [P.], seq 422239:427735, ack 803, win 65535, length 5496
13:19:21.941586 IP 10.0.2.15.45732 > 99.84.126.121.443: Flags [.], ack 422239, win 65535, length 0
13:19:21.941621 IP 10.0.2.15.45732 > 99.84.126.121.443: Flags [.], ack 427735, win 65535, length 0
13:19:21.941966 IP 99.84.126.121.443 > 10.0.2.15.45732: Flags [P.], seq 427735:433231, ack 803, win 65535, length 5496
13:19:21.941979 IP 10.0.2.15.45732 > 99.84.126.121.443: Flags [.], ack 433231, win 65535, length 0
13:19:21.942249 IP 99.84.126.121.443 > 10.0.2.15.45732: Flags [P.], seq 433231:441475, ack 803, win 65535, length 8244
13:19:21.942261 IP 10.0.2.15.45732 > 99.84.126.121.443: Flags [.], ack 441475, win 65535, length 0
13:19:21.942726 IP 99.84.126.121.443 > 10.0.2.15.45732: Flags [P.], seq 441475:451093, ack 803, win 65535, length 9618
13:19:21.942750 IP 10.0.2.15.45732 > 99.84.126.121.443: Flags [.], ack 451093, win 65535, length 0
13:19:21.943929 IP 99.84.126.121.443 > 10.0.2.15.45732: Flags [P.], seq 451093:456589, ack 803, win 65535, length 5496
13:19:21.943949 IP 10.0.2.15.45732 > 99.84.126.121.443: Flags [.], ack 456589, win 65535, length 0
13:19:21.944843 IP 99.84.126.121.443 > 10.0.2.15.45732: Flags [P.], seq 456589:468955, ack 803, win 65535, length 12366
13:19:21.944863 IP 10.0.2.15.45732 > 99.84.126.121.443: Flags [.], ack 468955, win 65535, length 0
13:19:21.945297 IP 99.84.126.121.443 > 10.0.2.15.45732: Flags [P.], seq 468955:481321, ack 803, win 65535, length 12366
13:19:21.945386 IP 10.0.2.15.45732 > 99.84.126.121.443: Flags [.], ack 481321, win 65535, length 0
13:19:21.945428 IP 99.84.126.121.443 > 10.0.2.15.45732: Flags [.], seq 481321:482781, ack 803, win 65535, length 1460
13:19:21.945436 IP 10.0.2.15.45732 > 99.84.126.121.443: Flags [.], ack 482781, win 65535, length 0
13:19:21.945940 IP 99.84.126.121.443 > 10.0.2.15.45732: Flags [P.], seq 482781:490939, ack 803, win 65535, length 8158

