19:37:00.389631 IP 10.0.2.15.52362 > 140.233.253.2.53: 46714+ A? www.espn.com. (30)
19:37:00.389674 IP 10.0.2.15.52362 > 140.233.253.2.53: 55428+ AAAA? www.espn.com. (30)
19:37:00.396105 IP 140.233.253.2.53 > 10.0.2.15.52362: 46714 4/0/0 A 13.224.212.45, A 13.224.212.47, A 13.224.212.80, A 13.224.212.128 (94)
19:37:00.396107 IP 140.233.253.2.53 > 10.0.2.15.52362: 55428 8/0/0 AAAA 2600:9000:20ed:400:e:fe33:5580:93a1, AAAA 2600:9000:20ed:ec00:e:fe33:5580:93a1, AAAA 2600:9000:20ed:6a00:e:fe33:5580:93a1, AAAA 2600:9000:20ed:5000:e:fe33:5580:93a1, AAAA 2600:9000:20ed:5200:e:fe33:5580:93a1, AAAA 2600:9000:20ed:5e00:e:fe33:5580:93a1, AAAA 2600:9000:20ed:e400:e:fe33:5580:93a1, AAAA 2600:9000:20ed:7400:e:fe33:5580:93a1 (254)
19:37:00.396572 IP 10.0.2.15.48092 > 13.224.212.45.443: Flags [S], seq 3739465775, win 64240, options [mss 1460,sackOK,TS val 2119344648 ecr 0,nop,wscale 6], length 0
19:37:00.412787 IP 13.224.212.45.443 > 10.0.2.15.48092: Flags [S.], seq 179136001, ack 3739465776, win 65535, options [mss 1460], length 0
19:37:00.412834 IP 10.0.2.15.48092 > 13.224.212.45.443: Flags [.], ack 1, win 64240, length 0
19:37:00.421727 IP 10.0.2.15.48092 > 13.224.212.45.443: Flags [P.], seq 1:518, ack 1, win 64240, length 517
19:37:00.422185 IP 13.224.212.45.443 > 10.0.2.15.48092: Flags [.], ack 518, win 65535, length 0
19:37:00.438537 IP 13.224.212.45.443 > 10.0.2.15.48092: Flags [P.], seq 1:2749, ack 518, win 65535, length 2748
19:37:00.438560 IP 10.0.2.15.48092 > 13.224.212.45.443: Flags [.], ack 2749, win 62780, length 0
19:37:00.439260 IP 13.224.212.45.443 > 10.0.2.15.48092: Flags [P.], seq 2749:4123, ack 518, win 65535, length 1374
19:37:00.439320 IP 10.0.2.15.48092 > 13.224.212.45.443: Flags [.], ack 4123, win 61406, length 0
19:37:00.440375 IP 13.224.212.45.443 > 10.0.2.15.48092: Flags [P.], seq 4123:5497, ack 518, win 65535, length 1374
19:37:00.440394 IP 10.0.2.15.48092 > 13.224.212.45.443: Flags [.], ack 5497, win 63204, length 0
19:37:00.441261 IP 13.224.212.45.443 > 10.0.2.15.48092: Flags [P.], seq 5497:5824, ack 518, win 65535, length 327
19:37:00.441277 IP 10.0.2.15.48092 > 13.224.212.45.443: Flags [.], ack 5824, win 63204, length 0
19:37:00.441852 IP 10.0.2.15.48092 > 13.224.212.45.443: Flags [P.], seq 518:582, ack 5824, win 63204, length 64
19:37:00.442136 IP 13.224.212.45.443 > 10.0.2.15.48092: Flags [.], ack 582, win 65535, length 0
19:37:00.442201 IP 10.0.2.15.48092 > 13.224.212.45.443: Flags [P.], seq 582:628, ack 5824, win 63204, length 46
19:37:00.442228 IP 10.0.2.15.48092 > 13.224.212.45.443: Flags [P.], seq 628:677, ack 5824, win 63204, length 49
19:37:00.442466 IP 13.224.212.45.443 > 10.0.2.15.48092: Flags [.], ack 628, win 65535, length 0
19:37:00.442467 IP 13.224.212.45.443 > 10.0.2.15.48092: Flags [.], ack 677, win 65535, length 0
19:37:00.442521 IP 10.0.2.15.48092 > 13.224.212.45.443: Flags [P.], seq 677:772, ack 5824, win 63204, length 95
19:37:00.442747 IP 13.224.212.45.443 > 10.0.2.15.48092: Flags [.], ack 772, win 65535, length 0
19:37:00.456691 IP 13.224.212.45.443 > 10.0.2.15.48092: Flags [P.], seq 5824:5886, ack 772, win 65535, length 62
19:37:00.456716 IP 10.0.2.15.48092 > 13.224.212.45.443: Flags [.], ack 5886, win 63204, length 0
19:37:00.457429 IP 13.224.212.45.443 > 10.0.2.15.48092: Flags [P.], seq 5886:5917, ack 772, win 65535, length 31
19:37:00.457443 IP 10.0.2.15.48092 > 13.224.212.45.443: Flags [.], ack 5917, win 63204, length 0
19:37:00.458039 IP 10.0.2.15.48092 > 13.224.212.45.443: Flags [P.], seq 772:803, ack 5917, win 63204, length 31
19:37:00.458335 IP 13.224.212.45.443 > 10.0.2.15.48092: Flags [.], ack 803, win 65535, length 0
19:37:00.471769 IP 13.224.212.45.443 > 10.0.2.15.48092: Flags [P.], seq 5917:12787, ack 803, win 65535, length 6870
19:37:00.471772 IP 13.224.212.45.443 > 10.0.2.15.48092: Flags [P.], seq 12787:15535, ack 803, win 65535, length 2748
19:37:00.471810 IP 10.0.2.15.48092 > 13.224.212.45.443: Flags [.], ack 12787, win 59860, length 0
19:37:00.471896 IP 10.0.2.15.48092 > 13.224.212.45.443: Flags [.], ack 15535, win 58400, length 0
19:37:00.472966 IP 13.224.212.45.443 > 10.0.2.15.48092: Flags [P.], seq 15535:20157, ack 803, win 65535, length 4622
19:37:00.472984 IP 10.0.2.15.48092 > 13.224.212.45.443: Flags [.], ack 20157, win 61320, length 0
19:37:00.474193 IP 13.224.212.45.443 > 10.0.2.15.48092: Flags [P.], seq 20157:25653, ack 803, win 65535, length 5496
19:37:00.474195 IP 13.224.212.45.443 > 10.0.2.15.48092: Flags [P.], seq 25653:27027, ack 803, win 65535, length 1374
19:37:00.474213 IP 10.0.2.15.48092 > 13.224.212.45.443: Flags [.], ack 25653, win 61320, length 0
19:37:00.474242 IP 10.0.2.15.48092 > 13.224.212.45.443: Flags [.], ack 27027, win 59946, length 0
19:37:00.474827 IP 13.224.212.45.443 > 10.0.2.15.48092: Flags [P.], seq 27027:32523, ack 803, win 65535, length 5496
19:37:00.474913 IP 10.0.2.15.48092 > 13.224.212.45.443: Flags [.], ack 32523, win 61320, length 0
19:37:00.475429 IP 13.224.212.45.443 > 10.0.2.15.48092: Flags [P.], seq 32523:35271, ack 803, win 65535, length 2748
19:37:00.475470 IP 10.0.2.15.48092 > 13.224.212.45.443: Flags [.], ack 35271, win 61320, length 0
19:37:00.475871 IP 13.224.212.45.443 > 10.0.2.15.48092: Flags [P.], seq 35271:40767, ack 803, win 65535, length 5496
19:37:00.475964 IP 10.0.2.15.48092 > 13.224.212.45.443: Flags [.], ack 40767, win 61320, length 0
19:37:00.476663 IP 13.224.212.45.443 > 10.0.2.15.48092: Flags [P.], seq 40767:47637, ack 803, win 65535, length 6870
19:37:00.476715 IP 10.0.2.15.48092 > 13.224.212.45.443: Flags [.], ack 47637, win 62780, length 0
19:37:00.478929 IP 13.224.212.45.443 > 10.0.2.15.48092: Flags [P.], seq 47637:49011, ack 803, win 65535, length 1374
19:37:00.479017 IP 10.0.2.15.48092 > 13.224.212.45.443: Flags [.], ack 49011, win 62780, length 0
19:37:00.485843 IP 13.224.212.45.443 > 10.0.2.15.48092: Flags [P.], seq 49011:53133, ack 803, win 65535, length 4122
19:37:00.486147 IP 10.0.2.15.48092 > 13.224.212.45.443: Flags [.], ack 53133, win 61320, length 0
19:37:00.486348 IP 13.224.212.45.443 > 10.0.2.15.48092: Flags [P.], seq 53133:58629, ack 803, win 65535, length 5496
19:37:00.486666 IP 13.224.212.45.443 > 10.0.2.15.48092: Flags [P.], seq 58629:60003, ack 803, win 65535, length 1374
19:37:00.486731 IP 10.0.2.15.48092 > 13.224.212.45.443: Flags [.], ack 60003, win 56940, length 0
19:37:00.487751 IP 13.224.212.45.443 > 10.0.2.15.48092: Flags [P.], seq 60003:66873, ack 803, win 65535, length 6870
19:37:00.487768 IP 10.0.2.15.48092 > 13.224.212.45.443: Flags [.], ack 66873, win 59860, length 0
19:37:00.487931 IP 13.224.212.45.443 > 10.0.2.15.48092: Flags [P.], seq 66873:69621, ack 803, win 65535, length 2748
19:37:00.487960 IP 10.0.2.15.48092 > 13.224.212.45.443: Flags [.], ack 69621, win 62780, length 0
19:37:00.488972 IP 13.224.212.45.443 > 10.0.2.15.48092: Flags [P.], seq 69621:75117, ack 803, win 65535, length 5496
19:37:00.488997 IP 10.0.2.15.48092 > 13.224.212.45.443: Flags [.], ack 75117, win 65535, length 0
19:37:00.489951 IP 13.224.212.45.443 > 10.0.2.15.48092: Flags [P.], seq 75117:81987, ack 803, win 65535, length 6870
19:37:00.489967 IP 10.0.2.15.48092 > 13.224.212.45.443: Flags [.], ack 81987, win 65535, length 0
19:37:00.490369 IP 13.224.212.45.443 > 10.0.2.15.48092: Flags [P.], seq 81987:86109, ack 803, win 65535, length 4122
19:37:00.490376 IP 10.0.2.15.48092 > 13.224.212.45.443: Flags [.], ack 86109, win 65535, length 0
19:37:00.490794 IP 13.224.212.45.443 > 10.0.2.15.48092: Flags [P.], seq 86109:91605, ack 803, win 65535, length 5496
19:37:00.490805 IP 10.0.2.15.48092 > 13.224.212.45.443: Flags [.], ack 91605, win 65535, length 0
19:37:00.492057 IP 13.224.212.45.443 > 10.0.2.15.48092: Flags [P.], seq 91605:98475, ack 803, win 65535, length 6870
19:37:00.492077 IP 10.0.2.15.48092 > 13.224.212.45.443: Flags [.], ack 98475, win 65535, length 0
19:37:00.493471 IP 13.224.212.45.443 > 10.0.2.15.48092: Flags [P.], seq 98475:102597, ack 803, win 65535, length 4122
19:37:00.493487 IP 10.0.2.15.48092 > 13.224.212.45.443: Flags [.], ack 102597, win 65535, length 0
19:37:00.494281 IP 13.224.212.45.443 > 10.0.2.15.48092: Flags [P.], seq 102597:110841, ack 803, win 65535, length 8244
19:37:00.494307 IP 13.224.212.45.443 > 10.0.2.15.48092: Flags [P.], seq 110841:112215, ack 803, win 65535, length 1374
19:37:00.494326 IP 10.0.2.15.48092 > 13.224.212.45.443: Flags [.], ack 110841, win 65535, length 0
19:37:00.494353 IP 10.0.2.15.48092 > 13.224.212.45.443: Flags [.], ack 112215, win 65535, length 0
19:37:00.495643 IP 13.224.212.45.443 > 10.0.2.15.48092: Flags [P.], seq 112215:117711, ack 803, win 65535, length 5496
19:37:00.495660 IP 10.0.2.15.48092 > 13.224.212.45.443: Flags [.], ack 117711, win 65535, length 0
19:37:00.496374 IP 13.224.212.45.443 > 10.0.2.15.48092: Flags [P.], seq 117711:124581, ack 803, win 65535, length 6870
19:37:00.496388 IP 10.0.2.15.48092 > 13.224.212.45.443: Flags [.], ack 124581, win 65535, length 0
19:37:00.499013 IP 13.224.212.45.443 > 10.0.2.15.48092: Flags [P.], seq 124581:131451, ack 803, win 65535, length 6870
19:37:00.499034 IP 10.0.2.15.48092 > 13.224.212.45.443: Flags [.], ack 131451, win 65535, length 0
19:37:00.499798 IP 13.224.212.45.443 > 10.0.2.15.48092: Flags [P.], seq 131451:136947, ack 803, win 65535, length 5496
19:37:00.499801 IP 13.224.212.45.443 > 10.0.2.15.48092: Flags [P.], seq 136947:139695, ack 803, win 65535, length 2748
19:37:00.499820 IP 10.0.2.15.48092 > 13.224.212.45.443: Flags [.], ack 136947, win 65535, length 0
19:37:00.499848 IP 10.0.2.15.48092 > 13.224.212.45.443: Flags [.], ack 139695, win 65535, length 0
19:37:00.500959 IP 13.224.212.45.443 > 10.0.2.15.48092: Flags [P.], seq 139695:145191, ack 803, win 65535, length 5496
19:37:00.500961 IP 13.224.212.45.443 > 10.0.2.15.48092: Flags [P.], seq 145191:147939, ack 803, win 65535, length 2748
19:37:00.500980 IP 10.0.2.15.48092 > 13.224.212.45.443: Flags [.], ack 145191, win 65535, length 0
19:37:00.501010 IP 10.0.2.15.48092 > 13.224.212.45.443: Flags [.], ack 147939, win 65535, length 0
19:37:00.501896 IP 13.224.212.45.443 > 10.0.2.15.48092: Flags [P.], seq 147939:154809, ack 803, win 65535, length 6870
19:37:00.501898 IP 13.224.212.45.443 > 10.0.2.15.48092: Flags [P.], seq 154809:158931, ack 803, win 65535, length 4122
19:37:00.501912 IP 10.0.2.15.48092 > 13.224.212.45.443: Flags [.], ack 154809, win 65535, length 0
19:37:00.501937 IP 10.0.2.15.48092 > 13.224.212.45.443: Flags [.], ack 158931, win 65535, length 0
19:37:00.503199 IP 13.224.212.45.443 > 10.0.2.15.48092: Flags [P.], seq 158931:164427, ack 803, win 65535, length 5496
19:37:00.503220 IP 10.0.2.15.48092 > 13.224.212.45.443: Flags [.], ack 164427, win 65535, length 0
19:37:00.504162 IP 13.224.212.45.443 > 10.0.2.15.48092: Flags [P.], seq 164427:171297, ack 803, win 65535, length 6870
19:37:00.504253 IP 10.0.2.15.48092 > 13.224.212.45.443: Flags [.], ack 171297, win 65535, length 0
19:37:00.504513 IP 13.224.212.45.443 > 10.0.2.15.48092: Flags [P.], seq 171297:176793, ack 803, win 65535, length 5496
19:37:00.504521 IP 10.0.2.15.48092 > 13.224.212.45.443: Flags [.], ack 176793, win 65535, length 0
19:37:00.504752 IP 13.224.212.45.443 > 10.0.2.15.48092: Flags [P.], seq 176793:178167, ack 803, win 65535, length 1374
19:37:00.504759 IP 10.0.2.15.48092 > 13.224.212.45.443: Flags [.], ack 178167, win 65535, length 0
19:37:00.505261 IP 13.224.212.45.443 > 10.0.2.15.48092: Flags [P.], seq 178167:186411, ack 803, win 65535, length 8244
19:37:00.505317 IP 10.0.2.15.48092 > 13.224.212.45.443: Flags [.], ack 186411, win 65535, length 0
19:37:00.505513 IP 13.224.212.45.443 > 10.0.2.15.48092: Flags [P.], seq 186411:190533, ack 803, win 65535, length 4122
19:37:00.505522 IP 10.0.2.15.48092 > 13.224.212.45.443: Flags [.], ack 190533, win 65535, length 0
19:37:00.506590 IP 13.224.212.45.443 > 10.0.2.15.48092: Flags [P.], seq 190533:197403, ack 803, win 65535, length 6870
19:37:00.506592 IP 13.224.212.45.443 > 10.0.2.15.48092: Flags [P.], seq 197403:202899, ack 803, win 65535, length 5496
19:37:00.506611 IP 10.0.2.15.48092 > 13.224.212.45.443: Flags [.], ack 197403, win 65535, length 0
19:37:00.506639 IP 10.0.2.15.48092 > 13.224.212.45.443: Flags [.], ack 202899, win 65535, length 0
19:37:00.507854 IP 13.224.212.45.443 > 10.0.2.15.48092: Flags [P.], seq 202899:209769, ack 803, win 65535, length 6870
19:37:00.507873 IP 10.0.2.15.48092 > 13.224.212.45.443: Flags [.], ack 209769, win 65535, length 0
19:37:00.507984 IP 13.224.212.45.443 > 10.0.2.15.48092: Flags [P.], seq 209769:215265, ack 803, win 65535, length 5496
19:37:00.507990 IP 10.0.2.15.48092 > 13.224.212.45.443: Flags [.], ack 215265, win 65535, length 0
19:37:00.509012 IP 13.224.212.45.443 > 10.0.2.15.48092: Flags [P.], seq 215265:222135, ack 803, win 65535, length 6870
19:37:00.509014 IP 13.224.212.45.443 > 10.0.2.15.48092: Flags [P.], seq 222135:224883, ack 803, win 65535, length 2748
19:37:00.509033 IP 10.0.2.15.48092 > 13.224.212.45.443: Flags [.], ack 222135, win 65535, length 0
19:37:00.509063 IP 10.0.2.15.48092 > 13.224.212.45.443: Flags [.], ack 224883, win 65535, length 0
19:37:00.511114 IP 13.224.212.45.443 > 10.0.2.15.48092: Flags [P.], seq 224883:230379, ack 803, win 65535, length 5496
19:37:00.511119 IP 13.224.212.45.443 > 10.0.2.15.48092: Flags [P.], seq 230379:241371, ack 803, win 65535, length 10992
19:37:00.511143 IP 10.0.2.15.48092 > 13.224.212.45.443: Flags [.], ack 230379, win 65535, length 0
19:37:00.511196 IP 10.0.2.15.48092 > 13.224.212.45.443: Flags [.], ack 241371, win 65535, length 0
19:37:00.511231 IP 13.224.212.45.443 > 10.0.2.15.48092: Flags [P.], seq 241371:245493, ack 803, win 65535, length 4122
19:37:00.511239 IP 10.0.2.15.48092 > 13.224.212.45.443: Flags [.], ack 245493, win 65535, length 0
19:37:00.512131 IP 13.224.212.45.443 > 10.0.2.15.48092: Flags [P.], seq 245493:252363, ack 803, win 65535, length 6870
19:37:00.512190 IP 10.0.2.15.48092 > 13.224.212.45.443: Flags [.], ack 252363, win 65535, length 0
19:37:00.512517 IP 13.224.212.45.443 > 10.0.2.15.48092: Flags [P.], seq 252363:256485, ack 803, win 65535, length 4122
19:37:00.512519 IP 13.224.212.45.443 > 10.0.2.15.48092: Flags [P.], seq 256485:260607, ack 803, win 65535, length 4122
19:37:00.512519 IP 13.224.212.45.443 > 10.0.2.15.48092: Flags [P.], seq 260607:261981, ack 803, win 65535, length 1374
19:37:00.512531 IP 10.0.2.15.48092 > 13.224.212.45.443: Flags [.], ack 256485, win 65535, length 0
19:37:00.512546 IP 10.0.2.15.48092 > 13.224.212.45.443: Flags [.], ack 260607, win 65535, length 0
19:37:00.512558 IP 10.0.2.15.48092 > 13.224.212.45.443: Flags [.], ack 261981, win 65535, length 0
19:37:00.513295 IP 13.224.212.45.443 > 10.0.2.15.48092: Flags [P.], seq 261981:267477, ack 803, win 65535, length 5496
19:37:00.513308 IP 10.0.2.15.48092 > 13.224.212.45.443: Flags [.], ack 267477, win 65535, length 0
19:37:00.513406 IP 13.224.212.45.443 > 10.0.2.15.48092: Flags [P.], seq 267477:272973, ack 803, win 65535, length 5496
19:37:00.513412 IP 10.0.2.15.48092 > 13.224.212.45.443: Flags [.], ack 272973, win 65535, length 0
19:37:00.513758 IP 13.224.212.45.443 > 10.0.2.15.48092: Flags [P.], seq 272973:279843, ack 803, win 65535, length 6870
19:37:00.513759 IP 13.224.212.45.443 > 10.0.2.15.48092: Flags [.], seq 279843:281303, ack 803, win 65535, length 1460
19:37:00.513770 IP 10.0.2.15.48092 > 13.224.212.45.443: Flags [.], ack 279843, win 65535, length 0
19:37:00.513787 IP 10.0.2.15.48092 > 13.224.212.45.443: Flags [.], ack 281303, win 65535, length 0
19:37:00.513957 IP 13.224.212.45.443 > 10.0.2.15.48092: Flags [P.], seq 281303:282591, ack 803, win 65535, length 1288
19:37:00.513965 IP 10.0.2.15.48092 > 13.224.212.45.443: Flags [.], ack 282591, win 65535, length 0
19:37:00.515285 IP 13.224.212.45.443 > 10.0.2.15.48092: Flags [P.], seq 282591:289461, ack 803, win 65535, length 6870
19:37:00.515288 IP 13.224.212.45.443 > 10.0.2.15.48092: Flags [P.], seq 289461:296331, ack 803, win 65535, length 6870
19:37:00.515399 IP 13.224.212.45.443 > 10.0.2.15.48092: Flags [P.], seq 296331:299079, ack 803, win 65535, length 2748
19:37:00.515401 IP 13.224.212.45.443 > 10.0.2.15.48092: Flags [P.], seq 299079:303201, ack 803, win 65535, length 4122
19:37:00.515518 IP 10.0.2.15.48092 > 13.224.212.45.443: Flags [.], ack 303201, win 65535, length 0
19:37:00.515988 IP 13.224.212.45.443 > 10.0.2.15.48092: Flags [P.], seq 303201:307323, ack 803, win 65535, length 4122
19:37:00.515990 IP 13.224.212.45.443 > 10.0.2.15.48092: Flags [P.], seq 307323:311445, ack 803, win 65535, length 4122
19:37:00.516004 IP 10.0.2.15.48092 > 13.224.212.45.443: Flags [.], ack 307323, win 65535, length 0
19:37:00.516030 IP 10.0.2.15.48092 > 13.224.212.45.443: Flags [.], ack 311445, win 65535, length 0
19:37:00.516151 IP 13.224.212.45.443 > 10.0.2.15.48092: Flags [P.], seq 311445:312819, ack 803, win 65535, length 1374
19:37:00.516158 IP 10.0.2.15.48092 > 13.224.212.45.443: Flags [.], ack 312819, win 65535, length 0
19:37:00.516480 IP 13.224.212.45.443 > 10.0.2.15.48092: Flags [P.], seq 312819:316941, ack 803, win 65535, length 4122
19:37:00.516482 IP 13.224.212.45.443 > 10.0.2.15.48092: Flags [P.], seq 316941:319689, ack 803, win 65535, length 2748
19:37:00.516567 IP 10.0.2.15.48092 > 13.224.212.45.443: Flags [.], ack 316941, win 65535, length 0
19:37:00.516663 IP 10.0.2.15.48092 > 13.224.212.45.443: Flags [.], ack 319689, win 65535, length 0
19:37:00.516831 IP 13.224.212.45.443 > 10.0.2.15.48092: Flags [P.], seq 319689:322437, ack 803, win 65535, length 2748
19:37:00.516833 IP 13.224.212.45.443 > 10.0.2.15.48092: Flags [P.], seq 322437:323811, ack 803, win 65535, length 1374
19:37:00.516842 IP 10.0.2.15.48092 > 13.224.212.45.443: Flags [.], ack 322437, win 65535, length 0
19:37:00.516858 IP 10.0.2.15.48092 > 13.224.212.45.443: Flags [.], ack 323811, win 65535, length 0
19:37:00.517265 IP 13.224.212.45.443 > 10.0.2.15.48092: Flags [P.], seq 323811:327933, ack 803, win 65535, length 4122
19:37:00.517276 IP 10.0.2.15.48092 > 13.224.212.45.443: Flags [.], ack 327933, win 65535, length 0
19:37:00.517551 IP 13.224.212.45.443 > 10.0.2.15.48092: Flags [P.], seq 327933:330681, ack 803, win 65535, length 2748
19:37:00.517553 IP 13.224.212.45.443 > 10.0.2.15.48092: Flags [P.], seq 330681:334803, ack 803, win 65535, length 4122
19:37:00.517554 IP 13.224.212.45.443 > 10.0.2.15.48092: Flags [.], seq 334803:336263, ack 803, win 65535, length 1460
19:37:00.517570 IP 10.0.2.15.48092 > 13.224.212.45.443: Flags [.], ack 330681, win 65535, length 0
19:37:00.517591 IP 10.0.2.15.48092 > 13.224.212.45.443: Flags [.], ack 334803, win 65535, length 0
19:37:00.517604 IP 10.0.2.15.48092 > 13.224.212.45.443: Flags [.], ack 336263, win 65535, length 0
19:37:00.517781 IP 13.224.212.45.443 > 10.0.2.15.48092: Flags [P.], seq 336263:337551, ack 803, win 65535, length 1288
19:37:00.517783 IP 13.224.212.45.443 > 10.0.2.15.48092: Flags [P.], seq 337551:340299, ack 803, win 65535, length 2748
19:37:00.517791 IP 10.0.2.15.48092 > 13.224.212.45.443: Flags [.], ack 337551, win 65535, length 0
19:37:00.517811 IP 10.0.2.15.48092 > 13.224.212.45.443: Flags [.], ack 340299, win 65535, length 0
19:37:00.518282 IP 13.224.212.45.443 > 10.0.2.15.48092: Flags [P.], seq 340299:343047, ack 803, win 65535, length 2748
19:37:00.518284 IP 13.224.212.45.443 > 10.0.2.15.48092: Flags [P.], seq 343047:347169, ack 803, win 65535, length 4122
19:37:00.518299 IP 10.0.2.15.48092 > 13.224.212.45.443: Flags [.], ack 343047, win 65535, length 0
19:37:00.518318 IP 10.0.2.15.48092 > 13.224.212.45.443: Flags [.], ack 347169, win 65535, length 0
19:37:00.519781 IP 13.224.212.45.443 > 10.0.2.15.48092: Flags [P.], seq 347169:349917, ack 803, win 65535, length 2748
19:37:00.519931 IP 10.0.2.15.48092 > 13.224.212.45.443: Flags [.], ack 349917, win 65535, length 0
19:37:00.520513 IP 13.224.212.45.443 > 10.0.2.15.48092: Flags [P.], seq 349917:356787, ack 803, win 65535, length 6870
19:37:00.520514 IP 13.224.212.45.443 > 10.0.2.15.48092: Flags [P.], seq 356787:360909, ack 803, win 65535, length 4122
19:37:00.520528 IP 10.0.2.15.48092 > 13.224.212.45.443: Flags [.], ack 356787, win 65535, length 0
19:37:00.520549 IP 10.0.2.15.48092 > 13.224.212.45.443: Flags [.], ack 360909, win 65535, length 0
19:37:00.520576 IP 13.224.212.45.443 > 10.0.2.15.48092: Flags [P.], seq 360909:363657, ack 803, win 65535, length 2748
19:37:00.520578 IP 13.224.212.45.443 > 10.0.2.15.48092: Flags [P.], seq 363657:369153, ack 803, win 65535, length 5496
19:37:00.520584 IP 10.0.2.15.48092 > 13.224.212.45.443: Flags [.], ack 363657, win 65535, length 0
19:37:00.520597 IP 10.0.2.15.48092 > 13.224.212.45.443: Flags [.], ack 369153, win 65535, length 0
19:37:00.521669 IP 13.224.212.45.443 > 10.0.2.15.48092: Flags [P.], seq 369153:376023, ack 803, win 65535, length 6870
19:37:00.521671 IP 13.224.212.45.443 > 10.0.2.15.48092: Flags [P.], seq 376023:380145, ack 803, win 65535, length 4122
19:37:00.521686 IP 10.0.2.15.48092 > 13.224.212.45.443: Flags [.], ack 376023, win 65535, length 0
19:37:00.521707 IP 10.0.2.15.48092 > 13.224.212.45.443: Flags [.], ack 380145, win 65535, length 0
19:37:00.521732 IP 13.224.212.45.443 > 10.0.2.15.48092: Flags [P.], seq 380145:381519, ack 803, win 65535, length 1374
19:37:00.521733 IP 13.224.212.45.443 > 10.0.2.15.48092: Flags [P.], seq 381519:385641, ack 803, win 65535, length 4122
19:37:00.521734 IP 13.224.212.45.443 > 10.0.2.15.48092: Flags [P.], seq 385641:388389, ack 803, win 65535, length 2748
19:37:00.521734 IP 13.224.212.45.443 > 10.0.2.15.48092: Flags [P.], seq 388389:389763, ack 803, win 65535, length 1374
19:37:00.521741 IP 10.0.2.15.48092 > 13.224.212.45.443: Flags [.], ack 381519, win 65535, length 0
19:37:00.521753 IP 10.0.2.15.48092 > 13.224.212.45.443: Flags [.], ack 385641, win 65535, length 0
19:37:00.521761 IP 10.0.2.15.48092 > 13.224.212.45.443: Flags [.], ack 388389, win 65535, length 0
19:37:00.521769 IP 10.0.2.15.48092 > 13.224.212.45.443: Flags [.], ack 389763, win 65535, length 0
19:37:00.522533 IP 13.224.212.45.443 > 10.0.2.15.48092: Flags [P.], seq 389763:395259, ack 803, win 65535, length 5496
19:37:00.522535 IP 13.224.212.45.443 > 10.0.2.15.48092: Flags [P.], seq 395259:400755, ack 803, win 65535, length 5496
19:37:00.522549 IP 10.0.2.15.48092 > 13.224.212.45.443: Flags [.], ack 395259, win 65535, length 0
19:37:00.522574 IP 10.0.2.15.48092 > 13.224.212.45.443: Flags [.], ack 400755, win 65535, length 0
19:37:00.523216 IP 13.224.212.45.443 > 10.0.2.15.48092: Flags [P.], seq 400755:403503, ack 803, win 65535, length 2748
19:37:00.523218 IP 13.224.212.45.443 > 10.0.2.15.48092: Flags [P.], seq 403503:406251, ack 803, win 65535, length 2748
19:37:00.523218 IP 13.224.212.45.443 > 10.0.2.15.48092: Flags [P.], seq 406251:408999, ack 803, win 65535, length 2748
19:37:00.523219 IP 13.224.212.45.443 > 10.0.2.15.48092: Flags [P.], seq 408999:411747, ack 803, win 65535, length 2748
19:37:00.523233 IP 10.0.2.15.48092 > 13.224.212.45.443: Flags [.], ack 403503, win 65535, length 0
19:37:00.523260 IP 10.0.2.15.48092 > 13.224.212.45.443: Flags [.], ack 406251, win 65535, length 0
19:37:00.523273 IP 10.0.2.15.48092 > 13.224.212.45.443: Flags [.], ack 408999, win 65535, length 0
19:37:00.523283 IP 10.0.2.15.48092 > 13.224.212.45.443: Flags [.], ack 411747, win 65535, length 0
19:37:00.523401 IP 13.224.212.45.443 > 10.0.2.15.48092: Flags [P.], seq 411747:415869, ack 803, win 65535, length 4122
19:37:00.523403 IP 13.224.212.45.443 > 10.0.2.15.48092: Flags [P.], seq 415869:417243, ack 803, win 65535, length 1374
19:37:00.523412 IP 10.0.2.15.48092 > 13.224.212.45.443: Flags [.], ack 415869, win 65535, length 0
19:37:00.523430 IP 10.0.2.15.48092 > 13.224.212.45.443: Flags [.], ack 417243, win 65535, length 0
19:37:00.523767 IP 13.224.212.45.443 > 10.0.2.15.48092: Flags [P.], seq 417243:419991, ack 803, win 65535, length 2748
19:37:00.523769 IP 13.224.212.45.443 > 10.0.2.15.48092: Flags [P.], seq 419991:422739, ack 803, win 65535, length 2748
19:37:00.523770 IP 13.224.212.45.443 > 10.0.2.15.48092: Flags [P.], seq 422739:425487, ack 803, win 65535, length 2748
19:37:00.523783 IP 10.0.2.15.48092 > 13.224.212.45.443: Flags [.], ack 419991, win 65535, length 0
19:37:00.523797 IP 10.0.2.15.48092 > 13.224.212.45.443: Flags [.], ack 422739, win 65535, length 0
19:37:00.523808 IP 10.0.2.15.48092 > 13.224.212.45.443: Flags [.], ack 425487, win 65535, length 0
19:37:00.524640 IP 13.224.212.45.443 > 10.0.2.15.48092: Flags [P.], seq 425487:429609, ack 803, win 65535, length 4122
19:37:00.524643 IP 13.224.212.45.443 > 10.0.2.15.48092: Flags [P.], seq 429609:435105, ack 803, win 65535, length 5496
19:37:00.524658 IP 10.0.2.15.48092 > 13.224.212.45.443: Flags [.], ack 429609, win 65535, length 0
19:37:00.524793 IP 10.0.2.15.48092 > 13.224.212.45.443: Flags [.], ack 435105, win 65535, length 0
19:37:00.524990 IP 13.224.212.45.443 > 10.0.2.15.48092: Flags [P.], seq 435105:439227, ack 803, win 65535, length 4122
19:37:00.524991 IP 13.224.212.45.443 > 10.0.2.15.48092: Flags [P.], seq 439227:441975, ack 803, win 65535, length 2748
19:37:00.525038 IP 10.0.2.15.48092 > 13.224.212.45.443: Flags [.], ack 439227, win 65535, length 0
19:37:00.525066 IP 10.0.2.15.48092 > 13.224.212.45.443: Flags [.], ack 441975, win 65535, length 0
19:37:00.525231 IP 13.224.212.45.443 > 10.0.2.15.48092: Flags [P.], seq 441975:444723, ack 803, win 65535, length 2748
19:37:00.525232 IP 13.224.212.45.443 > 10.0.2.15.48092: Flags [P.], seq 444723:447471, ack 803, win 65535, length 2748
19:37:00.525242 IP 10.0.2.15.48092 > 13.224.212.45.443: Flags [.], ack 444723, win 65535, length 0
19:37:00.525260 IP 10.0.2.15.48092 > 13.224.212.45.443: Flags [.], ack 447471, win 65535, length 0
19:37:00.525425 IP 13.224.212.45.443 > 10.0.2.15.48092: Flags [P.], seq 447471:452967, ack 803, win 65535, length 5496
19:37:00.525436 IP 10.0.2.15.48092 > 13.224.212.45.443: Flags [.], ack 452967, win 65535, length 0
19:37:00.525596 IP 13.224.212.45.443 > 10.0.2.15.48092: Flags [P.], seq 452967:455715, ack 803, win 65535, length 2748
19:37:00.525603 IP 10.0.2.15.48092 > 13.224.212.45.443: Flags [.], ack 455715, win 65535, length 0
19:37:00.526586 IP 13.224.212.45.443 > 10.0.2.15.48092: Flags [P.], seq 455715:461211, ack 803, win 65535, length 5496
19:37:00.526588 IP 13.224.212.45.443 > 10.0.2.15.48092: Flags [P.], seq 461211:462585, ack 803, win 65535, length 1374
19:37:00.526646 IP 10.0.2.15.48092 > 13.224.212.45.443: Flags [.], ack 461211, win 65535, length 0
19:37:00.526682 IP 10.0.2.15.48092 > 13.224.212.45.443: Flags [.], ack 462585, win 65535, length 0
19:37:00.526814 IP 13.224.212.45.443 > 10.0.2.15.48092: Flags [P.], seq 462585:470829, ack 803, win 65535, length 8244
19:37:00.526825 IP 10.0.2.15.48092 > 13.224.212.45.443: Flags [.], ack 470829, win 65535, length 0
19:37:00.526981 IP 13.224.212.45.443 > 10.0.2.15.48092: Flags [P.], seq 470829:472203, ack 803, win 65535, length 1374
19:37:00.526987 IP 10.0.2.15.48092 > 13.224.212.45.443: Flags [.], ack 472203, win 65535, length 0
19:37:00.528161 IP 13.224.212.45.443 > 10.0.2.15.48092: Flags [P.], seq 472203:480447, ack 803, win 65535, length 8244
19:37:00.528163 IP 13.224.212.45.443 > 10.0.2.15.48092: Flags [P.], seq 480447:483195, ack 803, win 65535, length 2748
19:37:00.528271 IP 10.0.2.15.48092 > 13.224.212.45.443: Flags [.], ack 480447, win 65535, length 0
19:37:00.528325 IP 10.0.2.15.48092 > 13.224.212.45.443: Flags [.], ack 483195, win 65535, length 0
19:37:00.528366 IP 13.224.212.45.443 > 10.0.2.15.48092: Flags [P.], seq 483195:490065, ack 803, win 65535, length 6870
19:37:00.528367 IP 13.224.212.45.443 > 10.0.2.15.48092: Flags [P.], seq 490065:492813, ack 803, win 65535, length 2748
19:37:00.528374 IP 13.224.212.45.443 > 10.0.2.15.48092: Flags [P.], seq 492813:496935, ack 803, win 65535, length 4122
19:37:00.528384 IP 10.0.2.15.48092 > 13.224.212.45.443: Flags [.], ack 490065, win 65535, length 0
19:37:00.528457 IP 10.0.2.15.48092 > 13.224.212.45.443: Flags [.], ack 492813, win 65535, length 0
19:37:00.528471 IP 10.0.2.15.48092 > 13.224.212.45.443: Flags [.], ack 496935, win 65535, length 0
19:37:00.528732 IP 13.224.212.45.443 > 10.0.2.15.48092: Flags [P.], seq 496935:502431, ack 803, win 65535, length 5496
19:37:00.528744 IP 10.0.2.15.48092 > 13.224.212.45.443: Flags [.], ack 502431, win 65535, length 0
19:37:00.529499 IP 13.224.212.45.443 > 10.0.2.15.48092: Flags [P.], seq 502431:507927, ack 803, win 65535, length 5496
19:37:00.529517 IP 10.0.2.15.48092 > 13.224.212.45.443: Flags [.], ack 507927, win 65535, length 0
19:37:00.529617 IP 13.224.212.45.443 > 10.0.2.15.48092: Flags [P.], seq 507927:514797, ack 803, win 65535, length 6870
19:37:00.529627 IP 10.0.2.15.48092 > 13.224.212.45.443: Flags [.], ack 514797, win 65535, length 0
19:37:00.529830 IP 13.224.212.45.443 > 10.0.2.15.48092: Flags [P.], seq 514797:517545, ack 803, win 65535, length 2748
19:37:00.529833 IP 13.224.212.45.443 > 10.0.2.15.48092: Flags [P.], seq 517545:521667, ack 803, win 65535, length 4122
19:37:00.529847 IP 10.0.2.15.48092 > 13.224.212.45.443: Flags [.], ack 517545, win 65535, length 0
19:37:00.529867 IP 10.0.2.15.48092 > 13.224.212.45.443: Flags [.], ack 521667, win 65535, length 0
19:37:00.530003 IP 13.224.212.45.443 > 10.0.2.15.48092: Flags [P.], seq 521667:523041, ack 803, win 65535, length 1374
19:37:00.530011 IP 10.0.2.15.48092 > 13.224.212.45.443: Flags [.], ack 523041, win 65535, length 0
19:37:00.535024 IP 13.224.212.45.443 > 10.0.2.15.48092: Flags [P.], seq 523041:534033, ack 803, win 65535, length 10992
19:37:00.535189 IP 10.0.2.15.48092 > 13.224.212.45.443: Flags [.], ack 534033, win 65535, length 0
19:37:00.535345 IP 13.224.212.45.443 > 10.0.2.15.48092: Flags [P.], seq 534033:540903, ack 803, win 65535, length 6870
19:37:00.535347 IP 13.224.212.45.443 > 10.0.2.15.48092: Flags [P.], seq 540903:546399, ack 803, win 65535, length 5496
19:37:00.535364 IP 10.0.2.15.48092 > 13.224.212.45.443: Flags [.], ack 540903, win 65535, length 0
19:37:00.535603 IP 10.0.2.15.48092 > 13.224.212.45.443: Flags [.], ack 546399, win 65535, length 0
19:37:00.535708 IP 13.224.212.45.443 > 10.0.2.15.48092: Flags [P.], seq 546399:549147, ack 803, win 65535, length 2748
19:37:00.535712 IP 13.224.212.45.443 > 10.0.2.15.48092: Flags [P.], seq 549147:556017, ack 803, win 65535, length 6870
19:37:00.535716 IP 13.224.212.45.443 > 10.0.2.15.48092: Flags [P.], seq 556017:568383, ack 803, win 65535, length 12366
19:37:00.535807 IP 10.0.2.15.48092 > 13.224.212.45.443: Flags [.], ack 549147, win 65535, length 0
19:37:00.535885 IP 10.0.2.15.48092 > 13.224.212.45.443: Flags [.], ack 556017, win 65535, length 0
19:37:00.535906 IP 10.0.2.15.48092 > 13.224.212.45.443: Flags [.], ack 568383, win 65535, length 0
19:37:00.535988 IP 13.224.212.45.443 > 10.0.2.15.48092: Flags [P.], seq 568383:573879, ack 803, win 65535, length 5496
19:37:00.535998 IP 10.0.2.15.48092 > 13.224.212.45.443: Flags [.], ack 573879, win 65535, length 0
19:37:00.536556 IP 13.224.212.45.443 > 10.0.2.15.48092: Flags [P.], seq 573879:580749, ack 803, win 65535, length 6870
19:37:00.536613 IP 10.0.2.15.48092 > 13.224.212.45.443: Flags [.], ack 580749, win 65535, length 0
19:37:00.536888 IP 13.224.212.45.443 > 10.0.2.15.48092: Flags [P.], seq 580749:584871, ack 803, win 65535, length 4122
19:37:00.536946 IP 10.0.2.15.48092 > 13.224.212.45.443: Flags [.], ack 584871, win 65535, length 0
19:37:00.538981 IP 13.224.212.45.443 > 10.0.2.15.48092: Flags [P.], seq 584871:593115, ack 803, win 65535, length 8244
19:37:00.538985 IP 13.224.212.45.443 > 10.0.2.15.48092: Flags [P.], seq 593115:598611, ack 803, win 65535, length 5496
19:37:00.539010 IP 10.0.2.15.48092 > 13.224.212.45.443: Flags [.], ack 593115, win 65535, length 0
19:37:00.539041 IP 10.0.2.15.48092 > 13.224.212.45.443: Flags [.], ack 598611, win 65535, length 0
19:37:00.539079 IP 13.224.212.45.443 > 10.0.2.15.48092: Flags [P.], seq 598611:605481, ack 803, win 65535, length 6870
19:37:00.539080 IP 13.224.212.45.443 > 10.0.2.15.48092: Flags [P.], seq 605481:608229, ack 803, win 65535, length 2748
19:37:00.539081 IP 13.224.212.45.443 > 10.0.2.15.48092: Flags [P.], seq 608229:612351, ack 803, win 65535, length 4122
19:37:00.539089 IP 10.0.2.15.48092 > 13.224.212.45.443: Flags [.], ack 605481, win 65535, length 0
19:37:00.539101 IP 10.0.2.15.48092 > 13.224.212.45.443: Flags [.], ack 608229, win 65535, length 0
19:37:00.539111 IP 10.0.2.15.48092 > 13.224.212.45.443: Flags [.], ack 612351, win 65535, length 0
19:37:00.539128 IP 13.224.212.45.443 > 10.0.2.15.48092: Flags [P.], seq 612351:615099, ack 803, win 65535, length 2748
19:37:00.539130 IP 13.224.212.45.443 > 10.0.2.15.48092: Flags [P.], seq 615099:619221, ack 803, win 65535, length 4122
19:37:00.539136 IP 10.0.2.15.48092 > 13.224.212.45.443: Flags [.], ack 615099, win 65535, length 0
19:37:00.539147 IP 10.0.2.15.48092 > 13.224.212.45.443: Flags [.], ack 619221, win 65535, length 0
19:37:00.539497 IP 13.224.212.45.443 > 10.0.2.15.48092: Flags [P.], seq 619221:624717, ack 803, win 65535, length 5496
19:37:00.539498 IP 13.224.212.45.443 > 10.0.2.15.48092: Flags [P.], seq 624717:631587, ack 803, win 65535, length 6870
19:37:00.539509 IP 10.0.2.15.48092 > 13.224.212.45.443: Flags [.], ack 624717, win 65535, length 0
19:37:00.539525 IP 10.0.2.15.48092 > 13.224.212.45.443: Flags [.], ack 631587, win 65535, length 0
19:37:00.539826 IP 13.224.212.45.443 > 10.0.2.15.48092: Flags [P.], seq 631587:637083, ack 803, win 65535, length 5496
19:37:00.539838 IP 10.0.2.15.48092 > 13.224.212.45.443: Flags [.], ack 637083, win 65535, length 0
19:37:00.539968 IP 13.224.212.45.443 > 10.0.2.15.48092: Flags [P.], seq 637083:641205, ack 803, win 65535, length 4122
19:37:00.539981 IP 10.0.2.15.48092 > 13.224.212.45.443: Flags [.], ack 641205, win 65535, length 0
19:37:00.540168 IP 13.224.212.45.443 > 10.0.2.15.48092: Flags [P.], seq 641205:643953, ack 803, win 65535, length 2748
19:37:00.540170 IP 13.224.212.45.443 > 10.0.2.15.48092: Flags [P.], seq 643953:646701, ack 803, win 65535, length 2748
19:37:00.540185 IP 10.0.2.15.48092 > 13.224.212.45.443: Flags [.], ack 643953, win 65535, length 0
19:37:00.540203 IP 10.0.2.15.48092 > 13.224.212.45.443: Flags [.], ack 646701, win 65535, length 0
19:37:00.540473 IP 13.224.212.45.443 > 10.0.2.15.48092: Flags [P.], seq 646701:649449, ack 803, win 65535, length 2748
19:37:00.540474 IP 13.224.212.45.443 > 10.0.2.15.48092: Flags [P.], seq 649449:652197, ack 803, win 65535, length 2748
19:37:00.540485 IP 10.0.2.15.48092 > 13.224.212.45.443: Flags [.], ack 649449, win 65535, length 0
19:37:00.540526 IP 10.0.2.15.48092 > 13.224.212.45.443: Flags [.], ack 652197, win 65535, length 0
19:37:00.540634 IP 13.224.212.45.443 > 10.0.2.15.48092: Flags [P.], seq 652197:654945, ack 803, win 65535, length 2748
19:37:00.540644 IP 10.0.2.15.48092 > 13.224.212.45.443: Flags [.], ack 654945, win 65535, length 0
19:37:00.540834 IP 13.224.212.45.443 > 10.0.2.15.48092: Flags [P.], seq 654945:657693, ack 803, win 65535, length 2748
19:37:00.540836 IP 13.224.212.45.443 > 10.0.2.15.48092: Flags [P.], seq 657693:660441, ack 803, win 65535, length 2748
19:37:00.540846 IP 10.0.2.15.48092 > 13.224.212.45.443: Flags [.], ack 657693, win 65535, length 0
19:37:00.540922 IP 10.0.2.15.48092 > 13.224.212.45.443: Flags [.], ack 660441, win 65535, length 0
19:37:00.541258 IP 13.224.212.45.443 > 10.0.2.15.48092: Flags [P.], seq 660441:665937, ack 803, win 65535, length 5496
19:37:00.541261 IP 13.224.212.45.443 > 10.0.2.15.48092: Flags [P.], seq 665937:670059, ack 803, win 65535, length 4122
19:37:00.541276 IP 10.0.2.15.48092 > 13.224.212.45.443: Flags [.], ack 665937, win 65535, length 0
19:37:00.541444 IP 10.0.2.15.48092 > 13.224.212.45.443: Flags [.], ack 670059, win 65535, length 0
19:37:00.541575 IP 13.224.212.45.443 > 10.0.2.15.48092: Flags [P.], seq 670059:672807, ack 803, win 65535, length 2748
19:37:00.541576 IP 13.224.212.45.443 > 10.0.2.15.48092: Flags [P.], seq 672807:675555, ack 803, win 65535, length 2748
19:37:00.541577 IP 13.224.212.45.443 > 10.0.2.15.48092: Flags [P.], seq 675555:678303, ack 803, win 65535, length 2748
19:37:00.541585 IP 10.0.2.15.48092 > 13.224.212.45.443: Flags [.], ack 672807, win 65535, length 0
19:37:00.541599 IP 10.0.2.15.48092 > 13.224.212.45.443: Flags [.], ack 675555, win 65535, length 0
19:37:00.541611 IP 10.0.2.15.48092 > 13.224.212.45.443: Flags [.], ack 678303, win 65535, length 0
19:37:00.541878 IP 13.224.212.45.443 > 10.0.2.15.48092: Flags [P.], seq 678303:681051, ack 803, win 65535, length 2748
19:37:00.541879 IP 13.224.212.45.443 > 10.0.2.15.48092: Flags [P.], seq 681051:683799, ack 803, win 65535, length 2748
19:37:00.541887 IP 10.0.2.15.48092 > 13.224.212.45.443: Flags [.], ack 681051, win 65535, length 0
19:37:00.541900 IP 10.0.2.15.48092 > 13.224.212.45.443: Flags [.], ack 683799, win 65535, length 0
19:37:00.542493 IP 13.224.212.45.443 > 10.0.2.15.48092: Flags [P.], seq 683799:687921, ack 803, win 65535, length 4122
19:37:00.542495 IP 13.224.212.45.443 > 10.0.2.15.48092: Flags [P.], seq 687921:690669, ack 803, win 65535, length 2748
19:37:00.542496 IP 13.224.212.45.443 > 10.0.2.15.48092: Flags [P.], seq 690669:693417, ack 803, win 65535, length 2748
19:37:00.542497 IP 13.224.212.45.443 > 10.0.2.15.48092: Flags [P.], seq 693417:698913, ack 803, win 65535, length 5496
19:37:00.542510 IP 10.0.2.15.48092 > 13.224.212.45.443: Flags [.], ack 687921, win 65535, length 0
19:37:00.542529 IP 10.0.2.15.48092 > 13.224.212.45.443: Flags [.], ack 690669, win 65535, length 0
19:37:00.542544 IP 10.0.2.15.48092 > 13.224.212.45.443: Flags [.], ack 693417, win 65535, length 0
19:37:00.542556 IP 10.0.2.15.48092 > 13.224.212.45.443: Flags [.], ack 698913, win 65535, length 0
19:37:00.542758 IP 13.224.212.45.443 > 10.0.2.15.48092: Flags [P.], seq 698913:703035, ack 803, win 65535, length 4122
19:37:00.542805 IP 10.0.2.15.48092 > 13.224.212.45.443: Flags [.], ack 703035, win 65535, length 0
19:37:00.542886 IP 13.224.212.45.443 > 10.0.2.15.48092: Flags [P.], seq 703035:704409, ack 803, win 65535, length 1374
19:37:00.542891 IP 10.0.2.15.48092 > 13.224.212.45.443: Flags [.], ack 704409, win 65535, length 0
19:37:00.543563 IP 13.224.212.45.443 > 10.0.2.15.48092: Flags [P.], seq 704409:708531, ack 803, win 65535, length 4122
19:37:00.543635 IP 10.0.2.15.48092 > 13.224.212.45.443: Flags [.], ack 708531, win 65535, length 0
19:37:00.545202 IP 13.224.212.45.443 > 10.0.2.15.48092: Flags [P.], seq 708531:712653, ack 803, win 65535, length 4122
19:37:00.545204 IP 13.224.212.45.443 > 10.0.2.15.48092: Flags [P.], seq 712653:714027, ack 803, win 65535, length 1374
19:37:00.545205 IP 13.224.212.45.443 > 10.0.2.15.48092: Flags [P.], seq 714027:718149, ack 803, win 65535, length 4122
19:37:00.545206 IP 13.224.212.45.443 > 10.0.2.15.48092: Flags [P.], seq 718149:723645, ack 803, win 65535, length 5496
19:37:00.545231 IP 10.0.2.15.48092 > 13.224.212.45.443: Flags [.], ack 712653, win 65535, length 0
19:37:00.545261 IP 10.0.2.15.48092 > 13.224.212.45.443: Flags [.], ack 714027, win 65535, length 0
19:37:00.545274 IP 10.0.2.15.48092 > 13.224.212.45.443: Flags [.], ack 718149, win 65535, length 0
19:37:00.545285 IP 10.0.2.15.48092 > 13.224.212.45.443: Flags [.], ack 723645, win 65535, length 0
19:37:00.545378 IP 13.224.212.45.443 > 10.0.2.15.48092: Flags [P.], seq 723645:726393, ack 803, win 65535, length 2748
19:37:00.545381 IP 13.224.212.45.443 > 10.0.2.15.48092: Flags [P.], seq 726393:727767, ack 803, win 65535, length 1374
19:37:00.545382 IP 13.224.212.45.443 > 10.0.2.15.48092: Flags [P.], seq 727767:731889, ack 803, win 65535, length 4122
19:37:00.545383 IP 13.224.212.45.443 > 10.0.2.15.48092: Flags [P.], seq 731889:734637, ack 803, win 65535, length 2748
19:37:00.545398 IP 10.0.2.15.48092 > 13.224.212.45.443: Flags [.], ack 726393, win 65535, length 0
19:37:00.545418 IP 10.0.2.15.48092 > 13.224.212.45.443: Flags [.], ack 727767, win 65535, length 0
19:37:00.545427 IP 10.0.2.15.48092 > 13.224.212.45.443: Flags [.], ack 731889, win 65535, length 0
19:37:00.545436 IP 10.0.2.15.48092 > 13.224.212.45.443: Flags [.], ack 734637, win 65535, length 0
19:37:00.545479 IP 13.224.212.45.443 > 10.0.2.15.48092: Flags [P.], seq 734637:740133, ack 803, win 65535, length 5496
19:37:00.545482 IP 13.224.212.45.443 > 10.0.2.15.48092: Flags [P.], seq 740133:744255, ack 803, win 65535, length 4122
19:37:00.545557 IP 10.0.2.15.48092 > 13.224.212.45.443: Flags [.], ack 740133, win 65535, length 0
19:37:00.548060 IP 13.224.212.45.443 > 10.0.2.15.48092: Flags [P.], seq 744255:752499, ack 803, win 65535, length 8244
19:37:00.548063 IP 13.224.212.45.443 > 10.0.2.15.48092: Flags [P.], seq 752499:755247, ack 803, win 65535, length 2748
19:37:00.548089 IP 13.224.212.45.443 > 10.0.2.15.48092: Flags [P.], seq 755247:757995, ack 803, win 65535, length 2748
19:37:00.548090 IP 13.224.212.45.443 > 10.0.2.15.48092: Flags [P.], seq 757995:762117, ack 803, win 65535, length 4122
19:37:00.548091 IP 13.224.212.45.443 > 10.0.2.15.48092: Flags [P.], seq 762117:766239, ack 803, win 65535, length 4122
19:37:00.548342 IP 13.224.212.45.443 > 10.0.2.15.48092: Flags [.], seq 766239:782299, ack 803, win 65535, length 16060
19:37:00.548481 IP 13.224.212.45.443 > 10.0.2.15.48092: Flags [.], seq 782299:792519, ack 803, win 65535, length 10220
19:37:00.548630 IP 13.224.212.45.443 > 10.0.2.15.48092: Flags [P.], seq 792519:793719, ack 803, win 65535, length 1200
19:37:00.553127 IP 10.0.2.15.48092 > 13.224.212.45.443: Flags [.], ack 793719, win 65535, length 0
19:37:00.553715 IP 13.224.212.45.443 > 10.0.2.15.48092: Flags [.], seq 793719:857959, ack 803, win 65535, length 64240
19:37:00.553866 IP 10.0.2.15.48092 > 13.224.212.45.443: Flags [.], ack 857959, win 65535, length 0
19:37:00.554051 IP 13.224.212.45.443 > 10.0.2.15.48092: Flags [P.], seq 857959:859419, ack 803, win 65535, length 1460
19:37:00.554345 IP 13.224.212.45.443 > 10.0.2.15.48092: Flags [.], seq 859419:898839, ack 803, win 65535, length 39420
19:37:00.554355 IP 10.0.2.15.48092 > 13.224.212.45.443: Flags [.], ack 898839, win 65535, length 0
19:37:00.554531 IP 13.224.212.45.443 > 10.0.2.15.48092: Flags [P.], seq 898839:922875, ack 803, win 65535, length 24036
19:37:00.554580 IP 13.224.212.45.443 > 10.0.2.15.48092: Flags [P.], seq 922875:931119, ack 803, win 65535, length 8244
19:37:00.554610 IP 10.0.2.15.48092 > 13.224.212.45.443: Flags [.], ack 931119, win 65535, length 0
19:37:00.554689 IP 13.224.212.45.443 > 10.0.2.15.48092: Flags [P.], seq 931119:933867, ack 803, win 65535, length 2748
19:37:00.554723 IP 10.0.2.15.48092 > 13.224.212.45.443: Flags [.], ack 933867, win 65535, length 0
19:37:00.554849 IP 13.224.212.45.443 > 10.0.2.15.48092: Flags [P.], seq 933867:936615, ack 803, win 65535, length 2748
19:37:00.554971 IP 13.224.212.45.443 > 10.0.2.15.48092: Flags [P.], seq 936615:939363, ack 803, win 65535, length 2748
19:37:00.555028 IP 10.0.2.15.48092 > 13.224.212.45.443: Flags [.], ack 939363, win 65535, length 0
19:37:00.555409 IP 13.224.212.45.443 > 10.0.2.15.48092: Flags [P.], seq 939363:944859, ack 803, win 65535, length 5496
19:37:00.555411 IP 13.224.212.45.443 > 10.0.2.15.48092: Flags [P.], seq 944859:947607, ack 803, win 65535, length 2748
19:37:00.555423 IP 10.0.2.15.48092 > 13.224.212.45.443: Flags [.], ack 944859, win 65535, length 0
19:37:00.555610 IP 13.224.212.45.443 > 10.0.2.15.48092: Flags [P.], seq 947607:951729, ack 803, win 65535, length 4122
19:37:00.556009 IP 13.224.212.45.443 > 10.0.2.15.48092: Flags [P.], seq 951729:954477, ack 803, win 65535, length 2748
19:37:00.556011 IP 13.224.212.45.443 > 10.0.2.15.48092: Flags [P.], seq 954477:957225, ack 803, win 65535, length 2748
19:37:00.556012 IP 13.224.212.45.443 > 10.0.2.15.48092: Flags [P.], seq 957225:961347, ack 803, win 65535, length 4122
19:37:00.556225 IP 13.224.212.45.443 > 10.0.2.15.48092: Flags [P.], seq 961347:964095, ack 803, win 65535, length 2748
19:37:00.556227 IP 13.224.212.45.443 > 10.0.2.15.48092: Flags [P.], seq 964095:966843, ack 803, win 65535, length 2748
19:37:00.556243 IP 10.0.2.15.48092 > 13.224.212.45.443: Flags [.], ack 961347, win 65535, length 0
19:37:00.556457 IP 13.224.212.45.443 > 10.0.2.15.48092: Flags [P.], seq 966843:969591, ack 803, win 65535, length 2748
19:37:00.556560 IP 13.224.212.45.443 > 10.0.2.15.48092: Flags [P.], seq 969591:972339, ack 803, win 65535, length 2748
19:37:00.556561 IP 13.224.212.45.443 > 10.0.2.15.48092: Flags [P.], seq 972339:975087, ack 803, win 65535, length 2748
19:37:00.556674 IP 13.224.212.45.443 > 10.0.2.15.48092: Flags [P.], seq 975087:977835, ack 803, win 65535, length 2748
19:37:00.556687 IP 10.0.2.15.48092 > 13.224.212.45.443: Flags [.], ack 975087, win 65535, length 0
19:37:00.556735 IP 13.224.212.45.443 > 10.0.2.15.48092: Flags [P.], seq 977835:979209, ack 803, win 65535, length 1374
19:37:00.556789 IP 10.0.2.15.48092 > 13.224.212.45.443: Flags [.], ack 979209, win 65535, length 0
19:37:00.557034 IP 13.224.212.45.443 > 10.0.2.15.48092: Flags [P.], seq 979209:983331, ack 803, win 65535, length 4122
19:37:00.557035 IP 13.224.212.45.443 > 10.0.2.15.48092: Flags [P.], seq 983331:986079, ack 803, win 65535, length 2748
19:37:00.557094 IP 10.0.2.15.48092 > 13.224.212.45.443: Flags [.], ack 986079, win 65535, length 0
19:37:00.557285 IP 13.224.212.45.443 > 10.0.2.15.48092: Flags [P.], seq 986079:990201, ack 803, win 65535, length 4122

