13:19:22.774612 IP 99.84.126.23.443 > 10.0.2.15.51120: Flags [S.], seq 59648001, ack 2141088570, win 65535, options [mss 1460], length 0
13:19:22.774647 IP 10.0.2.15.51120 > 99.84.126.23.443: Flags [.], ack 1, win 64240, length 0
13:19:22.783080 IP 10.0.2.15.51120 > 99.84.126.23.443: Flags [P.], seq 1:518, ack 1, win 64240, length 517
13:19:22.783643 IP 99.84.126.23.443 > 10.0.2.15.51120: Flags [.], ack 518, win 65535, length 0
13:19:22.799448 IP 99.84.126.23.443 > 10.0.2.15.51120: Flags [P.], seq 1:2749, ack 518, win 65535, length 2748
13:19:22.799525 IP 10.0.2.15.51120 > 99.84.126.23.443: Flags [.], ack 2749, win 62780, length 0
13:19:22.802417 IP 99.84.126.23.443 > 10.0.2.15.51120: Flags [P.], seq 2749:5824, ack 518, win 65535, length 3075
13:19:22.802444 IP 10.0.2.15.51120 > 99.84.126.23.443: Flags [.], ack 5824, win 62780, length 0
13:19:22.803524 IP 10.0.2.15.51120 > 99.84.126.23.443: Flags [P.], seq 518:582, ack 5824, win 62780, length 64
13:19:22.803732 IP 10.0.2.15.51120 > 99.84.126.23.443: Flags [P.], seq 582:628, ack 5824, win 62780, length 46
13:19:22.803873 IP 99.84.126.23.443 > 10.0.2.15.51120: Flags [.], ack 582, win 65535, length 0
13:19:22.803874 IP 99.84.126.23.443 > 10.0.2.15.51120: Flags [.], ack 628, win 65535, length 0
13:19:22.803915 IP 10.0.2.15.51120 > 99.84.126.23.443: Flags [P.], seq 628:677, ack 5824, win 62780, length 49
13:19:22.803958 IP 10.0.2.15.51120 > 99.84.126.23.443: Flags [P.], seq 677:772, ack 5824, win 62780, length 95
13:19:22.804099 IP 99.84.126.23.443 > 10.0.2.15.51120: Flags [.], ack 677, win 65535, length 0
13:19:22.804099 IP 99.84.126.23.443 > 10.0.2.15.51120: Flags [.], ack 772, win 65535, length 0
13:19:22.817684 IP 99.84.126.23.443 > 10.0.2.15.51120: Flags [P.], seq 5824:5917, ack 772, win 65535, length 93
13:19:22.817709 IP 10.0.2.15.51120 > 99.84.126.23.443: Flags [.], ack 5917, win 62780, length 0
13:19:22.818042 IP 10.0.2.15.51120 > 99.84.126.23.443: Flags [P.], seq 772:803, ack 5917, win 62780, length 31
13:19:22.818284 IP 99.84.126.23.443 > 10.0.2.15.51120: Flags [.], ack 803, win 65535, length 0
13:19:22.842420 IP 99.84.126.23.443 > 10.0.2.15.51120: Flags [.], seq 5917:13217, ack 803, win 65535, length 7300
13:19:22.842442 IP 10.0.2.15.51120 > 99.84.126.23.443: Flags [.], ack 13217, win 59860, length 0
13:19:22.842905 IP 99.84.126.23.443 > 10.0.2.15.51120: Flags [P.], seq 13217:16909, ack 803, win 65535, length 3692
13:19:22.842930 IP 10.0.2.15.51120 > 99.84.126.23.443: Flags [.], ack 16909, win 56940, length 0
13:19:22.844118 IP 99.84.126.23.443 > 10.0.2.15.51120: Flags [.], seq 16909:27129, ack 803, win 65535, length 10220
13:19:22.844222 IP 10.0.2.15.51120 > 99.84.126.23.443: Flags [.], ack 27129, win 51100, length 0
13:19:22.845127 IP 99.84.126.23.443 > 10.0.2.15.51120: Flags [.], seq 27129:38809, ack 803, win 65535, length 11680
13:19:22.845150 IP 10.0.2.15.51120 > 99.84.126.23.443: Flags [.], ack 38809, win 56940, length 0
13:19:22.846005 IP 99.84.126.23.443 > 10.0.2.15.51120: Flags [P.], seq 38809:48713, ack 803, win 65535, length 9904
13:19:22.846034 IP 10.0.2.15.51120 > 99.84.126.23.443: Flags [.], ack 48713, win 58400, length 0
13:19:22.855673 IP 99.84.126.23.443 > 10.0.2.15.51120: Flags [P.], seq 48713:55583, ack 803, win 65535, length 6870
13:19:22.855706 IP 10.0.2.15.51120 > 99.84.126.23.443: Flags [.], ack 55583, win 59860, length 0
13:19:22.857850 IP 99.84.126.23.443 > 10.0.2.15.51120: Flags [P.], seq 55583:67949, ack 803, win 65535, length 12366
13:19:22.857877 IP 10.0.2.15.51120 > 99.84.126.23.443: Flags [.], ack 67949, win 55480, length 0
13:19:22.859442 IP 99.84.126.23.443 > 10.0.2.15.51120: Flags [P.], seq 67949:76193, ack 803, win 65535, length 8244
13:19:22.859445 IP 99.84.126.23.443 > 10.0.2.15.51120: Flags [P.], seq 76193:81689, ack 803, win 65535, length 5496
13:19:22.859494 IP 10.0.2.15.51120 > 99.84.126.23.443: Flags [.], ack 76193, win 65535, length 0
13:19:22.859529 IP 10.0.2.15.51120 > 99.84.126.23.443: Flags [.], ack 81689, win 65535, length 0
13:19:22.860285 IP 99.84.126.23.443 > 10.0.2.15.51120: Flags [P.], seq 81689:83063, ack 803, win 65535, length 1374
13:19:22.860300 IP 10.0.2.15.51120 > 99.84.126.23.443: Flags [.], ack 83063, win 65535, length 0
13:19:22.861492 IP 99.84.126.23.443 > 10.0.2.15.51120: Flags [P.], seq 83063:95429, ack 803, win 65535, length 12366
13:19:22.861510 IP 10.0.2.15.51120 > 99.84.126.23.443: Flags [.], ack 95429, win 65535, length 0
13:19:22.862414 IP 99.84.126.23.443 > 10.0.2.15.51120: Flags [P.], seq 95429:105047, ack 803, win 65535, length 9618
13:19:22.862431 IP 10.0.2.15.51120 > 99.84.126.23.443: Flags [.], ack 105047, win 65535, length 0
13:19:22.862554 IP 99.84.126.23.443 > 10.0.2.15.51120: Flags [P.], seq 105047:109169, ack 803, win 65535, length 4122
13:19:22.862561 IP 10.0.2.15.51120 > 99.84.126.23.443: Flags [.], ack 109169, win 65535, length 0
13:19:22.863756 IP 99.84.126.23.443 > 10.0.2.15.51120: Flags [P.], seq 109169:111917, ack 803, win 65535, length 2748
13:19:22.863780 IP 10.0.2.15.51120 > 99.84.126.23.443: Flags [.], ack 111917, win 65535, length 0
13:19:22.864893 IP 99.84.126.23.443 > 10.0.2.15.51120: Flags [P.], seq 111917:118787, ack 803, win 65535, length 6870
13:19:22.864918 IP 10.0.2.15.51120 > 99.84.126.23.443: Flags [.], ack 118787, win 65535, length 0
13:19:22.865889 IP 99.84.126.23.443 > 10.0.2.15.51120: Flags [P.], seq 118787:124283, ack 803, win 65535, length 5496
13:19:22.865910 IP 10.0.2.15.51120 > 99.84.126.23.443: Flags [.], ack 124283, win 65535, length 0
13:19:22.866902 IP 99.84.126.23.443 > 10.0.2.15.51120: Flags [P.], seq 124283:125657, ack 803, win 65535, length 1374
13:19:22.866918 IP 10.0.2.15.51120 > 99.84.126.23.443: Flags [.], ack 125657, win 65535, length 0
13:19:22.868153 IP 99.84.126.23.443 > 10.0.2.15.51120: Flags [P.], seq 125657:138023, ack 803, win 65535, length 12366
13:19:22.868169 IP 10.0.2.15.51120 > 99.84.126.23.443: Flags [.], ack 138023, win 65535, length 0
13:19:22.868344 IP 99.84.126.23.443 > 10.0.2.15.51120: Flags [P.], seq 138023:139397, ack 803, win 65535, length 1374
13:19:22.868356 IP 10.0.2.15.51120 > 99.84.126.23.443: Flags [.], ack 139397, win 65535, length 0
13:19:22.869358 IP 99.84.126.23.443 > 10.0.2.15.51120: Flags [P.], seq 139397:144893, ack 803, win 65535, length 5496
13:19:22.869372 IP 10.0.2.15.51120 > 99.84.126.23.443: Flags [.], ack 144893, win 65535, length 0
13:19:22.870775 IP 99.84.126.23.443 > 10.0.2.15.51120: Flags [.], seq 144893:146353, ack 803, win 65535, length 1460
13:19:22.870827 IP 10.0.2.15.51120 > 99.84.126.23.443: Flags [.], ack 146353, win 65535, length 0
13:19:22.871524 IP 99.84.126.23.443 > 10.0.2.15.51120: Flags [P.], seq 146353:153137, ack 803, win 65535, length 6784
13:19:22.871528 IP 99.84.126.23.443 > 10.0.2.15.51120: Flags [.], seq 153137:158977, ack 803, win 65535, length 5840
13:19:22.871631 IP 10.0.2.15.51120 > 99.84.126.23.443: Flags [.], ack 153137, win 65535, length 0
13:19:22.871672 IP 10.0.2.15.51120 > 99.84.126.23.443: Flags [.], ack 158977, win 65535, length 0
13:19:22.871838 IP 99.84.126.23.443 > 10.0.2.15.51120: Flags [P.], seq 158977:161381, ack 803, win 65535, length 2404
13:19:22.871849 IP 10.0.2.15.51120 > 99.84.126.23.443: Flags [.], ack 161381, win 65535, length 0
13:19:22.872688 IP 99.84.126.23.443 > 10.0.2.15.51120: Flags [P.], seq 161381:168251, ack 803, win 65535, length 6870
13:19:22.872702 IP 10.0.2.15.51120 > 99.84.126.23.443: Flags [.], ack 168251, win 65535, length 0
13:19:22.872896 IP 99.84.126.23.443 > 10.0.2.15.51120: Flags [P.], seq 168251:172373, ack 803, win 65535, length 4122
13:19:22.872905 IP 10.0.2.15.51120 > 99.84.126.23.443: Flags [.], ack 172373, win 65535, length 0
13:19:22.873804 IP 99.84.126.23.443 > 10.0.2.15.51120: Flags [P.], seq 172373:177869, ack 803, win 65535, length 5496
13:19:22.873819 IP 10.0.2.15.51120 > 99.84.126.23.443: Flags [.], ack 177869, win 65535, length 0
13:19:22.874916 IP 99.84.126.23.443 > 10.0.2.15.51120: Flags [P.], seq 177869:184739, ack 803, win 65535, length 6870
13:19:22.874932 IP 10.0.2.15.51120 > 99.84.126.23.443: Flags [.], ack 184739, win 65535, length 0
13:19:22.875106 IP 99.84.126.23.443 > 10.0.2.15.51120: Flags [P.], seq 184739:190235, ack 803, win 65535, length 5496
13:19:22.875116 IP 10.0.2.15.51120 > 99.84.126.23.443: Flags [.], ack 190235, win 65535, length 0
13:19:22.876770 IP 99.84.126.23.443 > 10.0.2.15.51120: Flags [P.], seq 190235:197105, ack 803, win 65535, length 6870
13:19:22.876784 IP 10.0.2.15.51120 > 99.84.126.23.443: Flags [.], ack 197105, win 65535, length 0
13:19:22.877929 IP 99.84.126.23.443 > 10.0.2.15.51120: Flags [P.], seq 197105:202601, ack 803, win 65535, length 5496
13:19:22.877943 IP 10.0.2.15.51120 > 99.84.126.23.443: Flags [.], ack 202601, win 65535, length 0
13:19:22.879376 IP 99.84.126.23.443 > 10.0.2.15.51120: Flags [P.], seq 202601:220463, ack 803, win 65535, length 17862
13:19:22.879414 IP 10.0.2.15.51120 > 99.84.126.23.443: Flags [.], ack 220463, win 65535, length 0
13:19:22.880033 IP 99.84.126.23.443 > 10.0.2.15.51120: Flags [P.], seq 220463:223211, ack 803, win 65535, length 2748
13:19:22.880050 IP 10.0.2.15.51120 > 99.84.126.23.443: Flags [.], ack 223211, win 65535, length 0
13:19:22.880882 IP 99.84.126.23.443 > 10.0.2.15.51120: Flags [P.], seq 223211:227333, ack 803, win 65535, length 4122
13:19:22.880904 IP 10.0.2.15.51120 > 99.84.126.23.443: Flags [.], ack 227333, win 65535, length 0
13:19:22.883639 IP 99.84.126.23.443 > 10.0.2.15.51120: Flags [P.], seq 227333:235577, ack 803, win 65535, length 8244
13:19:22.883654 IP 10.0.2.15.51120 > 99.84.126.23.443: Flags [.], ack 235577, win 65535, length 0
13:19:22.883895 IP 99.84.126.23.443 > 10.0.2.15.51120: Flags [P.], seq 235577:243821, ack 803, win 65535, length 8244
13:19:22.883905 IP 10.0.2.15.51120 > 99.84.126.23.443: Flags [.], ack 243821, win 65535, length 0
13:19:22.884092 IP 99.84.126.23.443 > 10.0.2.15.51120: Flags [P.], seq 243821:247943, ack 803, win 65535, length 4122
13:19:22.884101 IP 10.0.2.15.51120 > 99.84.126.23.443: Flags [.], ack 247943, win 65535, length 0
13:19:22.884429 IP 99.84.126.23.443 > 10.0.2.15.51120: Flags [P.], seq 247943:254813, ack 803, win 65535, length 6870
13:19:22.884444 IP 10.0.2.15.51120 > 99.84.126.23.443: Flags [.], ack 254813, win 65535, length 0
13:19:22.884628 IP 99.84.126.23.443 > 10.0.2.15.51120: Flags [P.], seq 254813:256187, ack 803, win 65535, length 1374
13:19:22.884635 IP 10.0.2.15.51120 > 99.84.126.23.443: Flags [.], ack 256187, win 65535, length 0
13:19:22.885648 IP 99.84.126.23.443 > 10.0.2.15.51120: Flags [P.], seq 256187:263057, ack 803, win 65535, length 6870
13:19:22.885651 IP 99.84.126.23.443 > 10.0.2.15.51120: Flags [P.], seq 263057:269927, ack 803, win 65535, length 6870
13:19:22.885671 IP 10.0.2.15.51120 > 99.84.126.23.443: Flags [.], ack 263057, win 65535, length 0
13:19:22.885698 IP 10.0.2.15.51120 > 99.84.126.23.443: Flags [.], ack 269927, win 65535, length 0
13:19:22.886030 IP 99.84.126.23.443 > 10.0.2.15.51120: Flags [P.], seq 269927:279545, ack 803, win 65535, length 9618
13:19:22.886044 IP 10.0.2.15.51120 > 99.84.126.23.443: Flags [.], ack 279545, win 65535, length 0
13:19:22.886169 IP 99.84.126.23.443 > 10.0.2.15.51120: Flags [.], seq 279545:281005, ack 803, win 65535, length 1460
13:19:22.886177 IP 10.0.2.15.51120 > 99.84.126.23.443: Flags [.], ack 281005, win 65535, length 0
13:19:22.886346 IP 99.84.126.23.443 > 10.0.2.15.51120: Flags [P.], seq 281005:287789, ack 803, win 65535, length 6784
13:19:22.886362 IP 10.0.2.15.51120 > 99.84.126.23.443: Flags [.], ack 287789, win 65535, length 0
13:19:22.886833 IP 99.84.126.23.443 > 10.0.2.15.51120: Flags [P.], seq 287789:291911, ack 803, win 65535, length 4122
13:19:22.886845 IP 10.0.2.15.51120 > 99.84.126.23.443: Flags [.], ack 291911, win 65535, length 0
13:19:22.889075 IP 99.84.126.23.443 > 10.0.2.15.51120: Flags [P.], seq 291911:311147, ack 803, win 65535, length 19236
13:19:22.889093 IP 10.0.2.15.51120 > 99.84.126.23.443: Flags [.], ack 311147, win 65535, length 0
13:19:22.889231 IP 99.84.126.23.443 > 10.0.2.15.51120: Flags [P.], seq 311147:319391, ack 803, win 65535, length 8244
13:19:22.889239 IP 10.0.2.15.51120 > 99.84.126.23.443: Flags [.], ack 319391, win 65535, length 0
13:19:22.889502 IP 99.84.126.23.443 > 10.0.2.15.51120: Flags [P.], seq 319391:323513, ack 803, win 65535, length 4122
13:19:22.889515 IP 10.0.2.15.51120 > 99.84.126.23.443: Flags [.], ack 323513, win 65535, length 0
13:19:22.890012 IP 99.84.126.23.443 > 10.0.2.15.51120: Flags [P.], seq 323513:331757, ack 803, win 65535, length 8244
13:19:22.890025 IP 10.0.2.15.51120 > 99.84.126.23.443: Flags [.], ack 331757, win 65535, length 0
13:19:22.890217 IP 99.84.126.23.443 > 10.0.2.15.51120: Flags [P.], seq 331757:335879, ack 803, win 65535, length 4122
13:19:22.890226 IP 10.0.2.15.51120 > 99.84.126.23.443: Flags [.], ack 335879, win 65535, length 0
13:19:22.891685 IP 99.84.126.23.443 > 10.0.2.15.51120: Flags [P.], seq 335879:350993, ack 803, win 65535, length 15114
13:19:22.891699 IP 10.0.2.15.51120 > 99.84.126.23.443: Flags [.], ack 350993, win 65535, length 0
13:19:22.891923 IP 99.84.126.23.443 > 10.0.2.15.51120: Flags [P.], seq 350993:356489, ack 803, win 65535, length 5496
13:19:22.891936 IP 10.0.2.15.51120 > 99.84.126.23.443: Flags [.], ack 356489, win 65535, length 0
13:19:22.892242 IP 99.84.126.23.443 > 10.0.2.15.51120: Flags [P.], seq 356489:363359, ack 803, win 65535, length 6870
13:19:22.892254 IP 10.0.2.15.51120 > 99.84.126.23.443: Flags [.], ack 363359, win 65535, length 0
13:19:22.892457 IP 99.84.126.23.443 > 10.0.2.15.51120: Flags [P.], seq 363359:370229, ack 803, win 65535, length 6870
13:19:22.892467 IP 10.0.2.15.51120 > 99.84.126.23.443: Flags [.], ack 370229, win 65535, length 0
13:19:22.895049 IP 99.84.126.23.443 > 10.0.2.15.51120: Flags [P.], seq 370229:389465, ack 803, win 65535, length 19236
13:19:22.895064 IP 10.0.2.15.51120 > 99.84.126.23.443: Flags [.], ack 389465, win 65535, length 0
13:19:22.897719 IP 99.84.126.23.443 > 10.0.2.15.51120: Flags [P.], seq 389465:396335, ack 803, win 65535, length 6870
13:19:22.897785 IP 10.0.2.15.51120 > 99.84.126.23.443: Flags [.], ack 396335, win 65535, length 0
13:19:22.898480 IP 99.84.126.23.443 > 10.0.2.15.51120: Flags [P.], seq 396335:434807, ack 803, win 65535, length 38472
13:19:22.898495 IP 10.0.2.15.51120 > 99.84.126.23.443: Flags [.], ack 434807, win 65535, length 0
13:19:22.899006 IP 99.84.126.23.443 > 10.0.2.15.51120: Flags [P.], seq 434807:454043, ack 803, win 65535, length 19236
13:19:22.899020 IP 10.0.2.15.51120 > 99.84.126.23.443: Flags [.], ack 454043, win 65535, length 0
13:19:22.899643 IP 99.84.126.23.443 > 10.0.2.15.51120: Flags [P.], seq 454043:455417, ack 803, win 65535, length 1374
13:19:22.899656 IP 10.0.2.15.51120 > 99.84.126.23.443: Flags [.], ack 455417, win 65535, length 0
13:19:22.901882 IP 99.84.126.23.443 > 10.0.2.15.51120: Flags [P.], seq 455417:473279, ack 803, win 65535, length 17862
13:19:22.901900 IP 10.0.2.15.51120 > 99.84.126.23.443: Flags [.], ack 473279, win 65535, length 0

