00:07:59.783226 IP 99.84.126.86.443 > 10.0.2.15.40366: Flags [.], seq 54656002:54658922, ack 466574685, win 65535, length 2920
00:07:59.783253 IP 10.0.2.15.40366 > 99.84.126.86.443: Flags [.], ack 2920, win 62780, length 0
00:07:59.783458 IP 99.84.126.86.443 > 10.0.2.15.40366: Flags [P.], seq 2920:4122, ack 1, win 65535, length 1202
00:07:59.783472 IP 10.0.2.15.40366 > 99.84.126.86.443: Flags [.], ack 4122, win 61578, length 0
00:07:59.784115 IP 99.84.126.86.443 > 10.0.2.15.40366: Flags [P.], seq 4122:5823, ack 1, win 65535, length 1701
00:07:59.784144 IP 10.0.2.15.40366 > 99.84.126.86.443: Flags [.], ack 5823, win 59877, length 0
00:07:59.787249 IP 10.0.2.15.40366 > 99.84.126.86.443: Flags [P.], seq 1:65, ack 5823, win 62780, length 64
00:07:59.788292 IP 99.84.126.86.443 > 10.0.2.15.40366: Flags [.], ack 65, win 65535, length 0
00:07:59.788563 IP 10.0.2.15.40366 > 99.84.126.86.443: Flags [P.], seq 65:111, ack 5823, win 62780, length 46
00:07:59.788792 IP 10.0.2.15.40366 > 99.84.126.86.443: Flags [P.], seq 111:160, ack 5823, win 62780, length 49
00:07:59.789104 IP 99.84.126.86.443 > 10.0.2.15.40366: Flags [.], ack 111, win 65535, length 0
00:07:59.789173 IP 10.0.2.15.40366 > 99.84.126.86.443: Flags [P.], seq 160:195, ack 5823, win 62780, length 35
00:07:59.789674 IP 99.84.126.86.443 > 10.0.2.15.40366: Flags [.], ack 160, win 65535, length 0
00:07:59.789847 IP 10.0.2.15.40366 > 99.84.126.86.443: Flags [P.], seq 195:255, ack 5823, win 62780, length 60
00:07:59.789963 IP 99.84.126.86.443 > 10.0.2.15.40366: Flags [.], ack 195, win 65535, length 0
00:07:59.790387 IP 99.84.126.86.443 > 10.0.2.15.40366: Flags [.], ack 255, win 65535, length 0
00:07:59.801500 IP 99.84.126.86.443 > 10.0.2.15.40366: Flags [P.], seq 5823:5916, ack 255, win 65535, length 93
00:07:59.801520 IP 10.0.2.15.40366 > 99.84.126.86.443: Flags [.], ack 5916, win 62780, length 0
00:07:59.801746 IP 10.0.2.15.40366 > 99.84.126.86.443: Flags [P.], seq 255:286, ack 5916, win 62780, length 31
00:07:59.802058 IP 99.84.126.86.443 > 10.0.2.15.40366: Flags [.], ack 286, win 65535, length 0
00:07:59.825106 IP 99.84.126.86.443 > 10.0.2.15.40366: Flags [.], seq 5916:7376, ack 286, win 65535, length 1460
00:07:59.825134 IP 10.0.2.15.40366 > 99.84.126.86.443: Flags [.], ack 7376, win 62780, length 0
00:07:59.825550 IP 99.84.126.86.443 > 10.0.2.15.40366: Flags [P.], seq 7376:10038, ack 286, win 65535, length 2662
00:07:59.825565 IP 10.0.2.15.40366 > 99.84.126.86.443: Flags [.], ack 10038, win 62780, length 0
00:07:59.827137 IP 99.84.126.86.443 > 10.0.2.15.40366: Flags [.], seq 10038:21718, ack 286, win 65535, length 11680
00:07:59.827164 IP 10.0.2.15.40366 > 99.84.126.86.443: Flags [.], ack 21718, win 56940, length 0
00:07:59.827487 IP 99.84.126.86.443 > 10.0.2.15.40366: Flags [.], seq 21718:34858, ack 286, win 65535, length 13140
00:07:59.827497 IP 10.0.2.15.40366 > 99.84.126.86.443: Flags [.], ack 34858, win 55480, length 0
00:07:59.827753 IP 99.84.126.86.443 > 10.0.2.15.40366: Flags [P.], seq 34858:36144, ack 286, win 65535, length 1286
00:07:59.827762 IP 10.0.2.15.40366 > 99.84.126.86.443: Flags [.], ack 36144, win 55480, length 0
00:07:59.830623 IP 99.84.126.86.443 > 10.0.2.15.40366: Flags [P.], seq 36144:49884, ack 286, win 65535, length 13740
00:07:59.830643 IP 10.0.2.15.40366 > 99.84.126.86.443: Flags [.], ack 49884, win 55480, length 0
00:07:59.839971 IP 99.84.126.86.443 > 10.0.2.15.40366: Flags [P.], seq 49884:52632, ack 286, win 65535, length 2748
00:07:59.840105 IP 10.0.2.15.40366 > 99.84.126.86.443: Flags [.], ack 52632, win 62780, length 0
00:07:59.840543 IP 99.84.126.86.443 > 10.0.2.15.40366: Flags [P.], seq 52632:56754, ack 286, win 65535, length 4122
00:07:59.840722 IP 99.84.126.86.443 > 10.0.2.15.40366: Flags [P.], seq 56754:60876, ack 286, win 65535, length 4122
00:07:59.840816 IP 99.84.126.86.443 > 10.0.2.15.40366: Flags [P.], seq 60876:62250, ack 286, win 65535, length 1374
00:07:59.840968 IP 99.84.126.86.443 > 10.0.2.15.40366: Flags [P.], seq 62250:64998, ack 286, win 65535, length 2748
00:07:59.841031 IP 10.0.2.15.40366 > 99.84.126.86.443: Flags [.], ack 64998, win 54020, length 0
00:07:59.841176 IP 99.84.126.86.443 > 10.0.2.15.40366: Flags [P.], seq 64998:66372, ack 286, win 65535, length 1374
00:07:59.841250 IP 10.0.2.15.40366 > 99.84.126.86.443: Flags [.], ack 66372, win 62780, length 0
00:07:59.842631 IP 99.84.126.86.443 > 10.0.2.15.40366: Flags [P.], seq 66372:70494, ack 286, win 65535, length 4122
00:07:59.842872 IP 99.84.126.86.443 > 10.0.2.15.40366: Flags [P.], seq 70494:74616, ack 286, win 65535, length 4122
00:07:59.842974 IP 10.0.2.15.40366 > 99.84.126.86.443: Flags [.], ack 74616, win 62780, length 0
00:07:59.843193 IP 99.84.126.86.443 > 10.0.2.15.40366: Flags [P.], seq 74616:78738, ack 286, win 65535, length 4122
00:07:59.843324 IP 99.84.126.86.443 > 10.0.2.15.40366: Flags [P.], seq 78738:82860, ack 286, win 65535, length 4122
00:07:59.843347 IP 10.0.2.15.40366 > 99.84.126.86.443: Flags [.], ack 82860, win 65535, length 0
00:07:59.843553 IP 99.84.126.86.443 > 10.0.2.15.40366: Flags [P.], seq 82860:85608, ack 286, win 65535, length 2748
00:07:59.843598 IP 10.0.2.15.40366 > 99.84.126.86.443: Flags [.], ack 85608, win 65535, length 0
00:07:59.843791 IP 99.84.126.86.443 > 10.0.2.15.40366: Flags [P.], seq 85608:86982, ack 286, win 65535, length 1374
00:07:59.843806 IP 10.0.2.15.40366 > 99.84.126.86.443: Flags [.], ack 86982, win 65535, length 0
00:07:59.844680 IP 99.84.126.86.443 > 10.0.2.15.40366: Flags [P.], seq 86982:91104, ack 286, win 65535, length 4122
00:07:59.844822 IP 10.0.2.15.40366 > 99.84.126.86.443: Flags [.], ack 91104, win 65535, length 0
00:07:59.845068 IP 99.84.126.86.443 > 10.0.2.15.40366: Flags [P.], seq 91104:93852, ack 286, win 65535, length 2748
00:07:59.845070 IP 99.84.126.86.443 > 10.0.2.15.40366: Flags [P.], seq 93852:97974, ack 286, win 65535, length 4122
00:07:59.845085 IP 10.0.2.15.40366 > 99.84.126.86.443: Flags [.], ack 93852, win 65535, length 0
00:07:59.845104 IP 10.0.2.15.40366 > 99.84.126.86.443: Flags [.], ack 97974, win 65535, length 0
00:07:59.845700 IP 99.84.126.86.443 > 10.0.2.15.40366: Flags [P.], seq 97974:100722, ack 286, win 65535, length 2748
00:07:59.845711 IP 10.0.2.15.40366 > 99.84.126.86.443: Flags [.], ack 100722, win 65535, length 0
00:07:59.849383 IP 99.84.126.86.443 > 10.0.2.15.40366: Flags [P.], seq 100722:124080, ack 286, win 65535, length 23358
00:07:59.849452 IP 10.0.2.15.40366 > 99.84.126.86.443: Flags [.], ack 124080, win 65535, length 0
00:07:59.855353 IP 99.84.126.86.443 > 10.0.2.15.40366: Flags [P.], seq 124080:130950, ack 286, win 65535, length 6870
00:07:59.855409 IP 10.0.2.15.40366 > 99.84.126.86.443: Flags [.], ack 130950, win 65535, length 0
00:07:59.855783 IP 99.84.126.86.443 > 10.0.2.15.40366: Flags [P.], seq 130950:136446, ack 286, win 65535, length 5496
00:07:59.855802 IP 10.0.2.15.40366 > 99.84.126.86.443: Flags [.], ack 136446, win 65535, length 0
00:07:59.856388 IP 99.84.126.86.443 > 10.0.2.15.40366: Flags [P.], seq 136446:140568, ack 286, win 65535, length 4122
00:07:59.856390 IP 99.84.126.86.443 > 10.0.2.15.40366: Flags [P.], seq 140568:141942, ack 286, win 65535, length 1374
00:07:59.856409 IP 10.0.2.15.40366 > 99.84.126.86.443: Flags [.], ack 140568, win 65535, length 0
00:07:59.856464 IP 10.0.2.15.40366 > 99.84.126.86.443: Flags [.], ack 141942, win 65535, length 0
00:07:59.856603 IP 99.84.126.86.443 > 10.0.2.15.40366: Flags [P.], seq 141942:147438, ack 286, win 65535, length 5496
00:07:59.856611 IP 10.0.2.15.40366 > 99.84.126.86.443: Flags [.], ack 147438, win 65535, length 0
00:07:59.856814 IP 99.84.126.86.443 > 10.0.2.15.40366: Flags [P.], seq 147438:150186, ack 286, win 65535, length 2748
00:07:59.856822 IP 10.0.2.15.40366 > 99.84.126.86.443: Flags [.], ack 150186, win 65535, length 0
00:07:59.857025 IP 99.84.126.86.443 > 10.0.2.15.40366: Flags [P.], seq 150186:154308, ack 286, win 65535, length 4122
00:07:59.857035 IP 10.0.2.15.40366 > 99.84.126.86.443: Flags [.], ack 154308, win 65535, length 0
00:07:59.857292 IP 99.84.126.86.443 > 10.0.2.15.40366: Flags [P.], seq 154308:155682, ack 286, win 65535, length 1374
00:07:59.857302 IP 10.0.2.15.40366 > 99.84.126.86.443: Flags [.], ack 155682, win 65535, length 0
00:07:59.857978 IP 99.84.126.86.443 > 10.0.2.15.40366: Flags [P.], seq 155682:159804, ack 286, win 65535, length 4122
00:07:59.857996 IP 10.0.2.15.40366 > 99.84.126.86.443: Flags [.], ack 159804, win 65535, length 0
00:07:59.858532 IP 99.84.126.86.443 > 10.0.2.15.40366: Flags [P.], seq 159804:165300, ack 286, win 65535, length 5496
00:07:59.858547 IP 10.0.2.15.40366 > 99.84.126.86.443: Flags [.], ack 165300, win 65535, length 0
00:07:59.858748 IP 99.84.126.86.443 > 10.0.2.15.40366: Flags [P.], seq 165300:169422, ack 286, win 65535, length 4122
00:07:59.858762 IP 10.0.2.15.40366 > 99.84.126.86.443: Flags [.], ack 169422, win 65535, length 0
00:07:59.859298 IP 99.84.126.86.443 > 10.0.2.15.40366: Flags [P.], seq 169422:173544, ack 286, win 65535, length 4122
00:07:59.859321 IP 10.0.2.15.40366 > 99.84.126.86.443: Flags [.], ack 173544, win 65535, length 0
00:07:59.860736 IP 99.84.126.86.443 > 10.0.2.15.40366: Flags [P.], seq 173544:177666, ack 286, win 65535, length 4122
00:07:59.860865 IP 10.0.2.15.40366 > 99.84.126.86.443: Flags [.], ack 177666, win 65535, length 0
00:07:59.861087 IP 99.84.126.86.443 > 10.0.2.15.40366: Flags [P.], seq 177666:183162, ack 286, win 65535, length 5496
00:07:59.861088 IP 99.84.126.86.443 > 10.0.2.15.40366: Flags [P.], seq 183162:187284, ack 286, win 65535, length 4122
00:07:59.861143 IP 10.0.2.15.40366 > 99.84.126.86.443: Flags [.], ack 183162, win 65535, length 0
00:07:59.861205 IP 10.0.2.15.40366 > 99.84.126.86.443: Flags [.], ack 187284, win 65535, length 0
00:07:59.861550 IP 99.84.126.86.443 > 10.0.2.15.40366: Flags [P.], seq 187284:190032, ack 286, win 65535, length 2748
00:07:59.861562 IP 10.0.2.15.40366 > 99.84.126.86.443: Flags [.], ack 190032, win 65535, length 0
00:07:59.861890 IP 99.84.126.86.443 > 10.0.2.15.40366: Flags [P.], seq 190032:192780, ack 286, win 65535, length 2748
00:07:59.861904 IP 10.0.2.15.40366 > 99.84.126.86.443: Flags [.], ack 192780, win 65535, length 0
00:07:59.862497 IP 99.84.126.86.443 > 10.0.2.15.40366: Flags [P.], seq 192780:196902, ack 286, win 65535, length 4122
00:07:59.862511 IP 10.0.2.15.40366 > 99.84.126.86.443: Flags [.], ack 196902, win 65535, length 0
00:07:59.862875 IP 99.84.126.86.443 > 10.0.2.15.40366: Flags [P.], seq 196902:199650, ack 286, win 65535, length 2748
00:07:59.862877 IP 99.84.126.86.443 > 10.0.2.15.40366: Flags [P.], seq 199650:201024, ack 286, win 65535, length 1374
00:07:59.862894 IP 10.0.2.15.40366 > 99.84.126.86.443: Flags [.], ack 199650, win 65535, length 0
00:07:59.862915 IP 10.0.2.15.40366 > 99.84.126.86.443: Flags [.], ack 201024, win 65535, length 0
00:07:59.863266 IP 99.84.126.86.443 > 10.0.2.15.40366: Flags [P.], seq 201024:203772, ack 286, win 65535, length 2748
00:07:59.863279 IP 10.0.2.15.40366 > 99.84.126.86.443: Flags [.], ack 203772, win 65535, length 0
00:07:59.863454 IP 99.84.126.86.443 > 10.0.2.15.40366: Flags [P.], seq 203772:207894, ack 286, win 65535, length 4122
00:07:59.863464 IP 10.0.2.15.40366 > 99.84.126.86.443: Flags [.], ack 207894, win 65535, length 0
00:07:59.863643 IP 99.84.126.86.443 > 10.0.2.15.40366: Flags [P.], seq 207894:210642, ack 286, win 65535, length 2748
00:07:59.863653 IP 10.0.2.15.40366 > 99.84.126.86.443: Flags [.], ack 210642, win 65535, length 0
00:07:59.863857 IP 99.84.126.86.443 > 10.0.2.15.40366: Flags [P.], seq 210642:213390, ack 286, win 65535, length 2748
00:07:59.863867 IP 10.0.2.15.40366 > 99.84.126.86.443: Flags [.], ack 213390, win 65535, length 0
00:07:59.864798 IP 99.84.126.86.443 > 10.0.2.15.40366: Flags [P.], seq 213390:217512, ack 286, win 65535, length 4122
00:07:59.864816 IP 10.0.2.15.40366 > 99.84.126.86.443: Flags [.], ack 217512, win 65535, length 0
00:07:59.864989 IP 99.84.126.86.443 > 10.0.2.15.40366: Flags [P.], seq 217512:221634, ack 286, win 65535, length 4122
00:07:59.864999 IP 10.0.2.15.40366 > 99.84.126.86.443: Flags [.], ack 221634, win 65535, length 0
00:07:59.865419 IP 99.84.126.86.443 > 10.0.2.15.40366: Flags [P.], seq 221634:227130, ack 286, win 65535, length 5496
00:07:59.865520 IP 10.0.2.15.40366 > 99.84.126.86.443: Flags [.], ack 227130, win 65535, length 0
00:07:59.865774 IP 99.84.126.86.443 > 10.0.2.15.40366: Flags [P.], seq 227130:229878, ack 286, win 65535, length 2748
00:07:59.865785 IP 10.0.2.15.40366 > 99.84.126.86.443: Flags [.], ack 229878, win 65535, length 0
00:07:59.865985 IP 99.84.126.86.443 > 10.0.2.15.40366: Flags [P.], seq 229878:232626, ack 286, win 65535, length 2748
00:07:59.865993 IP 10.0.2.15.40366 > 99.84.126.86.443: Flags [.], ack 232626, win 65535, length 0
00:07:59.866195 IP 99.84.126.86.443 > 10.0.2.15.40366: Flags [P.], seq 232626:234000, ack 286, win 65535, length 1374
00:07:59.866205 IP 10.0.2.15.40366 > 99.84.126.86.443: Flags [.], ack 234000, win 65535, length 0
00:07:59.866971 IP 99.84.126.86.443 > 10.0.2.15.40366: Flags [P.], seq 234000:236748, ack 286, win 65535, length 2748
00:07:59.866990 IP 10.0.2.15.40366 > 99.84.126.86.443: Flags [.], ack 236748, win 65535, length 0
00:07:59.867231 IP 99.84.126.86.443 > 10.0.2.15.40366: Flags [P.], seq 236748:240870, ack 286, win 65535, length 4122
00:07:59.867240 IP 10.0.2.15.40366 > 99.84.126.86.443: Flags [.], ack 240870, win 65535, length 0
00:07:59.873945 IP 99.84.126.86.443 > 10.0.2.15.40366: Flags [P.], seq 240870:264228, ack 286, win 65535, length 23358
00:07:59.873968 IP 10.0.2.15.40366 > 99.84.126.86.443: Flags [.], ack 264228, win 65535, length 0
00:07:59.876783 IP 99.84.126.86.443 > 10.0.2.15.40366: Flags [P.], seq 264228:287586, ack 286, win 65535, length 23358
00:07:59.876805 IP 10.0.2.15.40366 > 99.84.126.86.443: Flags [.], ack 287586, win 65535, length 0
00:07:59.876943 IP 99.84.126.86.443 > 10.0.2.15.40366: Flags [P.], seq 287586:293082, ack 286, win 65535, length 5496
00:07:59.876957 IP 10.0.2.15.40366 > 99.84.126.86.443: Flags [.], ack 293082, win 65535, length 0
00:07:59.877300 IP 99.84.126.86.443 > 10.0.2.15.40366: Flags [P.], seq 293082:295830, ack 286, win 65535, length 2748
00:07:59.877302 IP 99.84.126.86.443 > 10.0.2.15.40366: Flags [P.], seq 295830:299952, ack 286, win 65535, length 4122
00:07:59.877352 IP 10.0.2.15.40366 > 99.84.126.86.443: Flags [.], ack 295830, win 65535, length 0
00:07:59.877369 IP 10.0.2.15.40366 > 99.84.126.86.443: Flags [.], ack 299952, win 65535, length 0
00:07:59.877848 IP 99.84.126.86.443 > 10.0.2.15.40366: Flags [P.], seq 299952:304074, ack 286, win 65535, length 4122
00:07:59.877861 IP 10.0.2.15.40366 > 99.84.126.86.443: Flags [.], ack 304074, win 65535, length 0
00:07:59.878290 IP 99.84.126.86.443 > 10.0.2.15.40366: Flags [P.], seq 304074:308196, ack 286, win 65535, length 4122
00:07:59.878310 IP 10.0.2.15.40366 > 99.84.126.86.443: Flags [.], ack 308196, win 65535, length 0
00:07:59.878436 IP 99.84.126.86.443 > 10.0.2.15.40366: Flags [P.], seq 308196:310944, ack 286, win 65535, length 2748
00:07:59.878445 IP 10.0.2.15.40366 > 99.84.126.86.443: Flags [.], ack 310944, win 65535, length 0
00:07:59.888854 IP 99.84.126.86.443 > 10.0.2.15.40366: Flags [.], seq 310944:350364, ack 286, win 65535, length 39420
00:07:59.888892 IP 10.0.2.15.40366 > 99.84.126.86.443: Flags [.], ack 350364, win 65535, length 0
00:07:59.889372 IP 99.84.126.86.443 > 10.0.2.15.40366: Flags [P.], seq 350364:376644, ack 286, win 65535, length 26280
00:07:59.889509 IP 10.0.2.15.40366 > 99.84.126.86.443: Flags [.], ack 376644, win 65535, length 0
00:07:59.889647 IP 99.84.126.86.443 > 10.0.2.15.40366: Flags [P.], seq 376644:409872, ack 286, win 65535, length 33228
00:07:59.889667 IP 10.0.2.15.40366 > 99.84.126.86.443: Flags [.], ack 409872, win 65535, length 0
00:07:59.890022 IP 99.84.126.86.443 > 10.0.2.15.40366: Flags [P.], seq 409872:418116, ack 286, win 65535, length 8244
00:07:59.890040 IP 10.0.2.15.40366 > 99.84.126.86.443: Flags [.], ack 418116, win 65535, length 0
00:07:59.890163 IP 99.84.126.86.443 > 10.0.2.15.40366: Flags [.], seq 418116:419576, ack 286, win 65535, length 1460
00:07:59.890170 IP 10.0.2.15.40366 > 99.84.126.86.443: Flags [.], ack 419576, win 65535, length 0
00:07:59.890254 IP 99.84.126.86.443 > 10.0.2.15.40366: Flags [P.], seq 419576:420864, ack 286, win 65535, length 1288
00:07:59.890260 IP 10.0.2.15.40366 > 99.84.126.86.443: Flags [.], ack 420864, win 65535, length 0
00:07:59.890452 IP 99.84.126.86.443 > 10.0.2.15.40366: Flags [P.], seq 420864:423612, ack 286, win 65535, length 2748
00:07:59.890459 IP 10.0.2.15.40366 > 99.84.126.86.443: Flags [.], ack 423612, win 65535, length 0
00:07:59.890577 IP 99.84.126.86.443 > 10.0.2.15.40366: Flags [P.], seq 423612:424986, ack 286, win 65535, length 1374
00:07:59.890587 IP 10.0.2.15.40366 > 99.84.126.86.443: Flags [.], ack 424986, win 65535, length 0
00:07:59.890851 IP 99.84.126.86.443 > 10.0.2.15.40366: Flags [P.], seq 424986:427734, ack 286, win 65535, length 2748
00:07:59.890859 IP 10.0.2.15.40366 > 99.84.126.86.443: Flags [.], ack 427734, win 65535, length 0
00:07:59.891070 IP 99.84.126.86.443 > 10.0.2.15.40366: Flags [P.], seq 427734:430482, ack 286, win 65535, length 2748
00:07:59.891081 IP 10.0.2.15.40366 > 99.84.126.86.443: Flags [.], ack 430482, win 65535, length 0
00:07:59.891744 IP 99.84.126.86.443 > 10.0.2.15.40366: Flags [.], seq 430482:433402, ack 286, win 65535, length 2920
00:07:59.891766 IP 10.0.2.15.40366 > 99.84.126.86.443: Flags [.], ack 433402, win 65535, length 0
00:07:59.892125 IP 99.84.126.86.443 > 10.0.2.15.40366: Flags [P.], seq 433402:437352, ack 286, win 65535, length 3950
00:07:59.892128 IP 99.84.126.86.443 > 10.0.2.15.40366: Flags [P.], seq 437352:440100, ack 286, win 65535, length 2748
00:07:59.892197 IP 10.0.2.15.40366 > 99.84.126.86.443: Flags [.], ack 437352, win 65535, length 0
00:07:59.892219 IP 10.0.2.15.40366 > 99.84.126.86.443: Flags [.], ack 440100, win 65535, length 0
00:07:59.892612 IP 99.84.126.86.443 > 10.0.2.15.40366: Flags [P.], seq 440100:445596, ack 286, win 65535, length 5496
00:07:59.892624 IP 10.0.2.15.40366 > 99.84.126.86.443: Flags [.], ack 445596, win 65535, length 0
00:07:59.893462 IP 99.84.126.86.443 > 10.0.2.15.40366: Flags [P.], seq 445596:451092, ack 286, win 65535, length 5496
00:07:59.893486 IP 10.0.2.15.40366 > 99.84.126.86.443: Flags [.], ack 451092, win 65535, length 0
00:07:59.895388 IP 99.84.126.86.443 > 10.0.2.15.40366: Flags [.], seq 451092:452552, ack 286, win 65535, length 1460
00:07:59.895414 IP 10.0.2.15.40366 > 99.84.126.86.443: Flags [.], ack 452552, win 65535, length 0
00:07:59.899018 IP 99.84.126.86.443 > 10.0.2.15.40366: Flags [P.], seq 452552:453840, ack 286, win 65535, length 1288
00:07:59.899022 IP 99.84.126.86.443 > 10.0.2.15.40366: Flags [P.], seq 453840:457962, ack 286, win 65535, length 4122
00:07:59.899074 IP 99.84.126.86.443 > 10.0.2.15.40366: Flags [P.], seq 457962:464832, ack 286, win 65535, length 6870
00:07:59.899152 IP 10.0.2.15.40366 > 99.84.126.86.443: Flags [.], ack 453840, win 65535, length 0
00:07:59.899189 IP 10.0.2.15.40366 > 99.84.126.86.443: Flags [.], ack 457962, win 65535, length 0
00:07:59.899200 IP 10.0.2.15.40366 > 99.84.126.86.443: Flags [.], ack 464832, win 65535, length 0
00:07:59.899231 IP 99.84.126.86.443 > 10.0.2.15.40366: Flags [P.], seq 464832:467580, ack 286, win 65535, length 2748
00:07:59.899234 IP 99.84.126.86.443 > 10.0.2.15.40366: Flags [P.], seq 467580:478572, ack 286, win 65535, length 10992
00:07:59.899241 IP 10.0.2.15.40366 > 99.84.126.86.443: Flags [.], ack 467580, win 65535, length 0
00:07:59.899253 IP 10.0.2.15.40366 > 99.84.126.86.443: Flags [.], ack 478572, win 65535, length 0
00:07:59.899298 IP 99.84.126.86.443 > 10.0.2.15.40366: Flags [P.], seq 478572:492312, ack 286, win 65535, length 13740
00:07:59.899313 IP 10.0.2.15.40366 > 99.84.126.86.443: Flags [.], ack 492312, win 65535, length 0
00:07:59.901077 IP 99.84.126.86.443 > 10.0.2.15.40366: Flags [.], seq 492312:522972, ack 286, win 65535, length 30660
00:07:59.901099 IP 10.0.2.15.40366 > 99.84.126.86.443: Flags [.], ack 522972, win 65535, length 0
00:07:59.901482 IP 99.84.126.86.443 > 10.0.2.15.40366: Flags [P.], seq 522972:530784, ack 286, win 65535, length 7812
00:07:59.901484 IP 99.84.126.86.443 > 10.0.2.15.40366: Flags [P.], seq 530784:539028, ack 286, win 65535, length 8244
00:07:59.901498 IP 10.0.2.15.40366 > 99.84.126.86.443: Flags [.], ack 530784, win 65535, length 0
00:07:59.901515 IP 10.0.2.15.40366 > 99.84.126.86.443: Flags [.], ack 539028, win 65535, length 0
00:07:59.902171 IP 99.84.126.86.443 > 10.0.2.15.40366: Flags [P.], seq 539028:543150, ack 286, win 65535, length 4122
00:07:59.902188 IP 10.0.2.15.40366 > 99.84.126.86.443: Flags [.], ack 543150, win 65535, length 0
00:07:59.902351 IP 99.84.126.86.443 > 10.0.2.15.40366: Flags [P.], seq 543150:545898, ack 286, win 65535, length 2748
00:07:59.902359 IP 10.0.2.15.40366 > 99.84.126.86.443: Flags [.], ack 545898, win 65535, length 0
00:07:59.903031 IP 99.84.126.86.443 > 10.0.2.15.40366: Flags [P.], seq 545898:550020, ack 286, win 65535, length 4122
00:07:59.903034 IP 99.84.126.86.443 > 10.0.2.15.40366: Flags [P.], seq 550020:552768, ack 286, win 65535, length 2748
00:07:59.903088 IP 10.0.2.15.40366 > 99.84.126.86.443: Flags [.], ack 550020, win 65535, length 0
00:07:59.903145 IP 10.0.2.15.40366 > 99.84.126.86.443: Flags [.], ack 552768, win 65535, length 0
00:07:59.903254 IP 99.84.126.86.443 > 10.0.2.15.40366: Flags [P.], seq 552768:556890, ack 286, win 65535, length 4122
00:07:59.903324 IP 10.0.2.15.40366 > 99.84.126.86.443: Flags [.], ack 556890, win 65535, length 0
00:07:59.903701 IP 99.84.126.86.443 > 10.0.2.15.40366: Flags [P.], seq 556890:559638, ack 286, win 65535, length 2748
00:07:59.903768 IP 99.84.126.86.443 > 10.0.2.15.40366: Flags [P.], seq 559638:561012, ack 286, win 65535, length 1374
00:07:59.903787 IP 10.0.2.15.40366 > 99.84.126.86.443: Flags [.], ack 559638, win 65535, length 0
00:07:59.903920 IP 10.0.2.15.40366 > 99.84.126.86.443: Flags [.], ack 561012, win 65535, length 0
00:07:59.904142 IP 99.84.126.86.443 > 10.0.2.15.40366: Flags [P.], seq 561012:565134, ack 286, win 65535, length 4122
00:07:59.904156 IP 10.0.2.15.40366 > 99.84.126.86.443: Flags [.], ack 565134, win 65535, length 0
00:07:59.904641 IP 99.84.126.86.443 > 10.0.2.15.40366: Flags [P.], seq 565134:567882, ack 286, win 65535, length 2748
00:07:59.904644 IP 99.84.126.86.443 > 10.0.2.15.40366: Flags [.], seq 567882:569342, ack 286, win 65535, length 1460
00:07:59.904709 IP 10.0.2.15.40366 > 99.84.126.86.443: Flags [.], ack 567882, win 65535, length 0
00:07:59.905123 IP 10.0.2.15.40366 > 99.84.126.86.443: Flags [.], ack 569342, win 65535, length 0
00:07:59.905516 IP 99.84.126.86.443 > 10.0.2.15.40366: Flags [P.], seq 569342:572004, ack 286, win 65535, length 2662
00:07:59.905519 IP 99.84.126.86.443 > 10.0.2.15.40366: Flags [P.], seq 572004:577500, ack 286, win 65535, length 5496
00:07:59.905519 IP 99.84.126.86.443 > 10.0.2.15.40366: Flags [P.], seq 577500:580248, ack 286, win 65535, length 2748
00:07:59.905543 IP 10.0.2.15.40366 > 99.84.126.86.443: Flags [.], ack 572004, win 65535, length 0
00:07:59.905568 IP 10.0.2.15.40366 > 99.84.126.86.443: Flags [.], ack 577500, win 65535, length 0
00:07:59.905873 IP 10.0.2.15.40366 > 99.84.126.86.443: Flags [.], ack 580248, win 65535, length 0
00:07:59.905901 IP 99.84.126.86.443 > 10.0.2.15.40366: Flags [P.], seq 580248:582996, ack 286, win 65535, length 2748
00:07:59.905902 IP 99.84.126.86.443 > 10.0.2.15.40366: Flags [P.], seq 582996:585744, ack 286, win 65535, length 2748
00:07:59.905909 IP 10.0.2.15.40366 > 99.84.126.86.443: Flags [.], ack 582996, win 65535, length 0
00:07:59.905917 IP 10.0.2.15.40366 > 99.84.126.86.443: Flags [.], ack 585744, win 65535, length 0
00:07:59.907082 IP 99.84.126.86.443 > 10.0.2.15.40366: Flags [P.], seq 585744:588492, ack 286, win 65535, length 2748
00:07:59.907085 IP 99.84.126.86.443 > 10.0.2.15.40366: Flags [P.], seq 588492:591240, ack 286, win 65535, length 2748
00:07:59.907104 IP 10.0.2.15.40366 > 99.84.126.86.443: Flags [.], ack 588492, win 65535, length 0
00:07:59.907168 IP 10.0.2.15.40366 > 99.84.126.86.443: Flags [.], ack 591240, win 65535, length 0
00:07:59.907318 IP 99.84.126.86.443 > 10.0.2.15.40366: Flags [P.], seq 591240:593988, ack 286, win 65535, length 2748
00:07:59.907325 IP 10.0.2.15.40366 > 99.84.126.86.443: Flags [.], ack 593988, win 65535, length 0
00:07:59.907862 IP 99.84.126.86.443 > 10.0.2.15.40366: Flags [P.], seq 593988:596736, ack 286, win 65535, length 2748
00:07:59.907865 IP 99.84.126.86.443 > 10.0.2.15.40366: Flags [.], seq 596736:598196, ack 286, win 65535, length 1460
00:07:59.907929 IP 10.0.2.15.40366 > 99.84.126.86.443: Flags [.], ack 596736, win 65535, length 0
00:07:59.908054 IP 10.0.2.15.40366 > 99.84.126.86.443: Flags [.], ack 598196, win 65535, length 0
00:07:59.908441 IP 99.84.126.86.443 > 10.0.2.15.40366: Flags [P.], seq 598196:600858, ack 286, win 65535, length 2662
00:07:59.908443 IP 99.84.126.86.443 > 10.0.2.15.40366: Flags [P.], seq 600858:603606, ack 286, win 65535, length 2748
00:07:59.908444 IP 99.84.126.86.443 > 10.0.2.15.40366: Flags [P.], seq 603606:604980, ack 286, win 65535, length 1374
00:07:59.908462 IP 10.0.2.15.40366 > 99.84.126.86.443: Flags [.], ack 600858, win 65535, length 0
00:07:59.908564 IP 10.0.2.15.40366 > 99.84.126.86.443: Flags [.], ack 603606, win 65535, length 0
00:07:59.908629 IP 10.0.2.15.40366 > 99.84.126.86.443: Flags [.], ack 604980, win 65535, length 0
00:07:59.910064 IP 99.84.126.86.443 > 10.0.2.15.40366: Flags [P.], seq 604980:610476, ack 286, win 65535, length 5496
00:07:59.910067 IP 99.84.126.86.443 > 10.0.2.15.40366: Flags [.], seq 610476:611936, ack 286, win 65535, length 1460
00:07:59.910091 IP 10.0.2.15.40366 > 99.84.126.86.443: Flags [.], ack 610476, win 65535, length 0
00:07:59.910130 IP 10.0.2.15.40366 > 99.84.126.86.443: Flags [.], ack 611936, win 65535, length 0
00:07:59.910277 IP 99.84.126.86.443 > 10.0.2.15.40366: Flags [P.], seq 611936:614598, ack 286, win 65535, length 2662
00:07:59.910286 IP 10.0.2.15.40366 > 99.84.126.86.443: Flags [.], ack 614598, win 65535, length 0
00:07:59.911274 IP 99.84.126.86.443 > 10.0.2.15.40366: Flags [P.], seq 614598:618720, ack 286, win 65535, length 4122
00:07:59.911277 IP 99.84.126.86.443 > 10.0.2.15.40366: Flags [P.], seq 618720:621468, ack 286, win 65535, length 2748
00:07:59.911352 IP 10.0.2.15.40366 > 99.84.126.86.443: Flags [.], ack 618720, win 65535, length 0
00:07:59.911584 IP 10.0.2.15.40366 > 99.84.126.86.443: Flags [.], ack 621468, win 65535, length 0
00:07:59.913770 IP 99.84.126.86.443 > 10.0.2.15.40366: Flags [P.], seq 621468:624216, ack 286, win 65535, length 2748
00:07:59.913775 IP 99.84.126.86.443 > 10.0.2.15.40366: Flags [P.], seq 624216:628338, ack 286, win 65535, length 4122
00:07:59.913861 IP 10.0.2.15.40366 > 99.84.126.86.443: Flags [.], ack 624216, win 65535, length 0
00:07:59.914295 IP 10.0.2.15.40366 > 99.84.126.86.443: Flags [.], ack 628338, win 65535, length 0
00:07:59.914720 IP 99.84.126.86.443 > 10.0.2.15.40366: Flags [.], seq 628338:645858, ack 286, win 65535, length 17520
00:07:59.914734 IP 10.0.2.15.40366 > 99.84.126.86.443: Flags [.], ack 645858, win 65535, length 0
00:07:59.915367 IP 99.84.126.86.443 > 10.0.2.15.40366: Flags [P.], seq 645858:651696, ack 286, win 65535, length 5838
00:07:59.915370 IP 99.84.126.86.443 > 10.0.2.15.40366: Flags [P.], seq 651696:661314, ack 286, win 65535, length 9618
00:07:59.915388 IP 10.0.2.15.40366 > 99.84.126.86.443: Flags [.], ack 651696, win 65535, length 0
00:07:59.915411 IP 10.0.2.15.40366 > 99.84.126.86.443: Flags [.], ack 661314, win 65535, length 0
00:07:59.915539 IP 99.84.126.86.443 > 10.0.2.15.40366: Flags [P.], seq 661314:666810, ack 286, win 65535, length 5496
00:07:59.915549 IP 10.0.2.15.40366 > 99.84.126.86.443: Flags [.], ack 666810, win 65535, length 0
00:07:59.915946 IP 99.84.126.86.443 > 10.0.2.15.40366: Flags [P.], seq 666810:670932, ack 286, win 65535, length 4122
00:07:59.915972 IP 10.0.2.15.40366 > 99.84.126.86.443: Flags [.], ack 670932, win 65535, length 0
00:07:59.916102 IP 99.84.126.86.443 > 10.0.2.15.40366: Flags [P.], seq 670932:675054, ack 286, win 65535, length 4122
00:07:59.916190 IP 10.0.2.15.40366 > 99.84.126.86.443: Flags [.], ack 675054, win 65535, length 0
00:07:59.916624 IP 99.84.126.86.443 > 10.0.2.15.40366: Flags [P.], seq 675054:679176, ack 286, win 65535, length 4122
00:07:59.916681 IP 10.0.2.15.40366 > 99.84.126.86.443: Flags [.], ack 679176, win 65535, length 0
00:07:59.916781 IP 99.84.126.86.443 > 10.0.2.15.40366: Flags [P.], seq 679176:680550, ack 286, win 65535, length 1374
00:07:59.916833 IP 10.0.2.15.40366 > 99.84.126.86.443: Flags [.], ack 680550, win 65535, length 0
00:07:59.917310 IP 99.84.126.86.443 > 10.0.2.15.40366: Flags [P.], seq 680550:681924, ack 286, win 65535, length 1374
00:07:59.917312 IP 99.84.126.86.443 > 10.0.2.15.40366: Flags [P.], seq 681924:686046, ack 286, win 65535, length 4122
00:07:59.917326 IP 10.0.2.15.40366 > 99.84.126.86.443: Flags [.], ack 681924, win 65535, length 0
00:07:59.917342 IP 10.0.2.15.40366 > 99.84.126.86.443: Flags [.], ack 686046, win 65535, length 0
00:07:59.917549 IP 99.84.126.86.443 > 10.0.2.15.40366: Flags [P.], seq 686046:690168, ack 286, win 65535, length 4122
00:07:59.917559 IP 10.0.2.15.40366 > 99.84.126.86.443: Flags [.], ack 690168, win 65535, length 0
00:07:59.917770 IP 99.84.126.86.443 > 10.0.2.15.40366: Flags [P.], seq 690168:692916, ack 286, win 65535, length 2748
00:07:59.917778 IP 10.0.2.15.40366 > 99.84.126.86.443: Flags [.], ack 692916, win 65535, length 0
00:07:59.918279 IP 99.84.126.86.443 > 10.0.2.15.40366: Flags [P.], seq 692916:695664, ack 286, win 65535, length 2748
00:07:59.918281 IP 99.84.126.86.443 > 10.0.2.15.40366: Flags [P.], seq 695664:699786, ack 286, win 65535, length 4122
00:07:59.918296 IP 10.0.2.15.40366 > 99.84.126.86.443: Flags [.], ack 695664, win 65535, length 0
00:07:59.918351 IP 10.0.2.15.40366 > 99.84.126.86.443: Flags [.], ack 699786, win 65535, length 0
00:07:59.918606 IP 99.84.126.86.443 > 10.0.2.15.40366: Flags [P.], seq 699786:703908, ack 286, win 65535, length 4122
00:07:59.918619 IP 10.0.2.15.40366 > 99.84.126.86.443: Flags [.], ack 703908, win 65535, length 0
00:07:59.918836 IP 99.84.126.86.443 > 10.0.2.15.40366: Flags [P.], seq 703908:705282, ack 286, win 65535, length 1374
00:07:59.918869 IP 10.0.2.15.40366 > 99.84.126.86.443: Flags [.], ack 705282, win 65535, length 0
00:07:59.919165 IP 99.84.126.86.443 > 10.0.2.15.40366: Flags [P.], seq 705282:708030, ack 286, win 65535, length 2748
00:07:59.919176 IP 10.0.2.15.40366 > 99.84.126.86.443: Flags [.], ack 708030, win 65535, length 0
00:07:59.919790 IP 99.84.126.86.443 > 10.0.2.15.40366: Flags [P.], seq 708030:712152, ack 286, win 65535, length 4122
00:07:59.920120 IP 10.0.2.15.40366 > 99.84.126.86.443: Flags [.], ack 712152, win 65535, length 0
00:07:59.920351 IP 99.84.126.86.443 > 10.0.2.15.40366: Flags [P.], seq 712152:714900, ack 286, win 65535, length 2748
00:07:59.920353 IP 99.84.126.86.443 > 10.0.2.15.40366: Flags [P.], seq 714900:719022, ack 286, win 65535, length 4122
00:07:59.920366 IP 10.0.2.15.40366 > 99.84.126.86.443: Flags [.], ack 714900, win 65535, length 0
00:07:59.920383 IP 10.0.2.15.40366 > 99.84.126.86.443: Flags [.], ack 719022, win 65535, length 0
00:07:59.920931 IP 99.84.126.86.443 > 10.0.2.15.40366: Flags [P.], seq 719022:720396, ack 286, win 65535, length 1374
00:07:59.920933 IP 99.84.126.86.443 > 10.0.2.15.40366: Flags [P.], seq 720396:724518, ack 286, win 65535, length 4122
00:07:59.920933 IP 99.84.126.86.443 > 10.0.2.15.40366: Flags [P.], seq 724518:727266, ack 286, win 65535, length 2748
00:07:59.920948 IP 10.0.2.15.40366 > 99.84.126.86.443: Flags [.], ack 720396, win 65535, length 0
00:07:59.920965 IP 10.0.2.15.40366 > 99.84.126.86.443: Flags [.], ack 724518, win 65535, length 0
00:07:59.920981 IP 10.0.2.15.40366 > 99.84.126.86.443: Flags [.], ack 727266, win 65535, length 0
00:07:59.921438 IP 99.84.126.86.443 > 10.0.2.15.40366: Flags [P.], seq 727266:731388, ack 286, win 65535, length 4122
00:07:59.921449 IP 10.0.2.15.40366 > 99.84.126.86.443: Flags [.], ack 731388, win 65535, length 0
00:07:59.921958 IP 99.84.126.86.443 > 10.0.2.15.40366: Flags [P.], seq 731388:734136, ack 286, win 65535, length 2748
00:07:59.921960 IP 99.84.126.86.443 > 10.0.2.15.40366: Flags [P.], seq 734136:735510, ack 286, win 65535, length 1374
00:07:59.922021 IP 10.0.2.15.40366 > 99.84.126.86.443: Flags [.], ack 734136, win 65535, length 0
00:07:59.922107 IP 10.0.2.15.40366 > 99.84.126.86.443: Flags [.], ack 735510, win 65535, length 0

