00:07:55.379178 IP 99.84.126.121.443 > 10.0.2.15.37834: Flags [.], seq 53376002:53378922, ack 2245689829, win 65535, length 2920
00:07:55.379200 IP 10.0.2.15.37834 > 99.84.126.121.443: Flags [.], ack 2920, win 62780, length 0
00:07:55.379598 IP 99.84.126.121.443 > 10.0.2.15.37834: Flags [P.], seq 2920:4122, ack 1, win 65535, length 1202
00:07:55.379619 IP 10.0.2.15.37834 > 99.84.126.121.443: Flags [.], ack 4122, win 61578, length 0
00:07:55.381143 IP 99.84.126.121.443 > 10.0.2.15.37834: Flags [.], seq 4122:5582, ack 1, win 65535, length 1460
00:07:55.381167 IP 10.0.2.15.37834 > 99.84.126.121.443: Flags [.], ack 5582, win 62780, length 0
00:07:55.381523 IP 99.84.126.121.443 > 10.0.2.15.37834: Flags [P.], seq 5582:5823, ack 1, win 65535, length 241
00:07:55.381536 IP 10.0.2.15.37834 > 99.84.126.121.443: Flags [.], ack 5823, win 62780, length 0
00:07:55.382621 IP 10.0.2.15.37834 > 99.84.126.121.443: Flags [P.], seq 1:65, ack 5823, win 62780, length 64
00:07:55.383133 IP 99.84.126.121.443 > 10.0.2.15.37834: Flags [.], ack 65, win 65535, length 0
00:07:55.383621 IP 10.0.2.15.37834 > 99.84.126.121.443: Flags [P.], seq 65:111, ack 5823, win 62780, length 46
00:07:55.383876 IP 10.0.2.15.37834 > 99.84.126.121.443: Flags [P.], seq 111:160, ack 5823, win 62780, length 49
00:07:55.384649 IP 99.84.126.121.443 > 10.0.2.15.37834: Flags [.], ack 111, win 65535, length 0
00:07:55.384652 IP 99.84.126.121.443 > 10.0.2.15.37834: Flags [.], ack 160, win 65535, length 0
00:07:55.384680 IP 10.0.2.15.37834 > 99.84.126.121.443: Flags [P.], seq 160:195, ack 5823, win 62780, length 35
00:07:55.385830 IP 99.84.126.121.443 > 10.0.2.15.37834: Flags [.], ack 195, win 65535, length 0
00:07:55.386074 IP 10.0.2.15.37834 > 99.84.126.121.443: Flags [P.], seq 195:255, ack 5823, win 62780, length 60
00:07:55.387421 IP 99.84.126.121.443 > 10.0.2.15.37834: Flags [.], ack 255, win 65535, length 0
00:07:55.395826 IP 99.84.126.121.443 > 10.0.2.15.37834: Flags [P.], seq 5823:5885, ack 255, win 65535, length 62
00:07:55.395849 IP 10.0.2.15.37834 > 99.84.126.121.443: Flags [.], ack 5885, win 62780, length 0
00:07:55.396183 IP 10.0.2.15.37834 > 99.84.126.121.443: Flags [P.], seq 255:286, ack 5885, win 62780, length 31
00:07:55.396532 IP 99.84.126.121.443 > 10.0.2.15.37834: Flags [.], ack 286, win 65535, length 0
00:07:55.396856 IP 99.84.126.121.443 > 10.0.2.15.37834: Flags [P.], seq 5885:5916, ack 286, win 65535, length 31
00:07:55.396871 IP 10.0.2.15.37834 > 99.84.126.121.443: Flags [.], ack 5916, win 62780, length 0
00:07:55.419034 IP 99.84.126.121.443 > 10.0.2.15.37834: Flags [P.], seq 5916:12786, ack 286, win 65535, length 6870
00:07:55.419038 IP 99.84.126.121.443 > 10.0.2.15.37834: Flags [P.], seq 12786:16908, ack 286, win 65535, length 4122
00:07:55.419078 IP 10.0.2.15.37834 > 99.84.126.121.443: Flags [.], ack 12786, win 59860, length 0
00:07:55.419109 IP 10.0.2.15.37834 > 99.84.126.121.443: Flags [.], ack 16908, win 56940, length 0
00:07:55.419697 IP 99.84.126.121.443 > 10.0.2.15.37834: Flags [P.], seq 16908:22404, ack 286, win 65535, length 5496
00:07:55.419815 IP 10.0.2.15.37834 > 99.84.126.121.443: Flags [.], ack 22404, win 52560, length 0
00:07:55.420047 IP 99.84.126.121.443 > 10.0.2.15.37834: Flags [P.], seq 22404:25152, ack 286, win 65535, length 2748
00:07:55.420049 IP 99.84.126.121.443 > 10.0.2.15.37834: Flags [P.], seq 25152:27900, ack 286, win 65535, length 2748
00:07:55.420110 IP 10.0.2.15.37834 > 99.84.126.121.443: Flags [.], ack 27900, win 47064, length 0
00:07:55.420500 IP 99.84.126.121.443 > 10.0.2.15.37834: Flags [P.], seq 27900:29274, ack 286, win 65535, length 1374
00:07:55.420502 IP 99.84.126.121.443 > 10.0.2.15.37834: Flags [.], seq 29274:30734, ack 286, win 65535, length 1460
00:07:55.420816 IP 99.84.126.121.443 > 10.0.2.15.37834: Flags [P.], seq 30734:33396, ack 286, win 65535, length 2662
00:07:55.421088 IP 99.84.126.121.443 > 10.0.2.15.37834: Flags [P.], seq 33396:37518, ack 286, win 65535, length 4122
00:07:55.421090 IP 99.84.126.121.443 > 10.0.2.15.37834: Flags [P.], seq 37518:40266, ack 286, win 65535, length 2748
00:07:55.421295 IP 99.84.126.121.443 > 10.0.2.15.37834: Flags [P.], seq 40266:43014, ack 286, win 65535, length 2748
00:07:55.421511 IP 99.84.126.121.443 > 10.0.2.15.37834: Flags [P.], seq 43014:44388, ack 286, win 65535, length 1374
00:07:55.421569 IP 10.0.2.15.37834 > 99.84.126.121.443: Flags [.], ack 44388, win 37960, length 0
00:07:55.423119 IP 99.84.126.121.443 > 10.0.2.15.37834: Flags [P.], seq 44388:48510, ack 286, win 65535, length 4122
00:07:55.423138 IP 10.0.2.15.37834 > 99.84.126.121.443: Flags [.], ack 48510, win 61320, length 0
00:07:55.423591 IP 99.84.126.121.443 > 10.0.2.15.37834: Flags [P.], seq 48510:49884, ack 286, win 65535, length 1374
00:07:55.423711 IP 10.0.2.15.37834 > 99.84.126.121.443: Flags [.], ack 49884, win 62780, length 0
00:07:55.433823 IP 99.84.126.121.443 > 10.0.2.15.37834: Flags [P.], seq 49884:52632, ack 286, win 65535, length 2748
00:07:55.433845 IP 10.0.2.15.37834 > 99.84.126.121.443: Flags [.], ack 52632, win 62780, length 0
00:07:55.434144 IP 99.84.126.121.443 > 10.0.2.15.37834: Flags [P.], seq 52632:54006, ack 286, win 65535, length 1374
00:07:55.434188 IP 10.0.2.15.37834 > 99.84.126.121.443: Flags [.], ack 54006, win 62780, length 0
00:07:55.435151 IP 99.84.126.121.443 > 10.0.2.15.37834: Flags [P.], seq 54006:58128, ack 286, win 65535, length 4122
00:07:55.435352 IP 10.0.2.15.37834 > 99.84.126.121.443: Flags [.], ack 58128, win 62780, length 0
00:07:55.435502 IP 99.84.126.121.443 > 10.0.2.15.37834: Flags [P.], seq 58128:60876, ack 286, win 65535, length 2748
00:07:55.435504 IP 99.84.126.121.443 > 10.0.2.15.37834: Flags [.], seq 60876:62336, ack 286, win 65535, length 1460
00:07:55.435589 IP 10.0.2.15.37834 > 99.84.126.121.443: Flags [.], ack 62336, win 61320, length 0
00:07:55.436445 IP 99.84.126.121.443 > 10.0.2.15.37834: Flags [P.], seq 62336:63624, ack 286, win 65535, length 1288
00:07:55.436448 IP 99.84.126.121.443 > 10.0.2.15.37834: Flags [P.], seq 63624:66372, ack 286, win 65535, length 2748
00:07:55.436448 IP 99.84.126.121.443 > 10.0.2.15.37834: Flags [P.], seq 66372:67746, ack 286, win 65535, length 1374
00:07:55.436472 IP 10.0.2.15.37834 > 99.84.126.121.443: Flags [.], ack 66372, win 61320, length 0
00:07:55.436658 IP 10.0.2.15.37834 > 99.84.126.121.443: Flags [.], ack 67746, win 62780, length 0
00:07:55.437245 IP 99.84.126.121.443 > 10.0.2.15.37834: Flags [P.], seq 67746:74616, ack 286, win 65535, length 6870
00:07:55.437263 IP 10.0.2.15.37834 > 99.84.126.121.443: Flags [.], ack 74616, win 65535, length 0
00:07:55.437610 IP 99.84.126.121.443 > 10.0.2.15.37834: Flags [P.], seq 74616:77364, ack 286, win 65535, length 2748
00:07:55.437613 IP 99.84.126.121.443 > 10.0.2.15.37834: Flags [P.], seq 77364:78738, ack 286, win 65535, length 1374
00:07:55.437632 IP 10.0.2.15.37834 > 99.84.126.121.443: Flags [.], ack 77364, win 65535, length 0
00:07:55.437655 IP 10.0.2.15.37834 > 99.84.126.121.443: Flags [.], ack 78738, win 65535, length 0
00:07:55.437902 IP 99.84.126.121.443 > 10.0.2.15.37834: Flags [P.], seq 78738:80112, ack 286, win 65535, length 1374
00:07:55.437912 IP 10.0.2.15.37834 > 99.84.126.121.443: Flags [.], ack 80112, win 65535, length 0
00:07:55.438262 IP 99.84.126.121.443 > 10.0.2.15.37834: Flags [P.], seq 80112:81486, ack 286, win 65535, length 1374
00:07:55.438294 IP 10.0.2.15.37834 > 99.84.126.121.443: Flags [.], ack 81486, win 65535, length 0
00:07:55.439888 IP 99.84.126.121.443 > 10.0.2.15.37834: Flags [P.], seq 81486:86982, ack 286, win 65535, length 5496
00:07:55.439891 IP 99.84.126.121.443 > 10.0.2.15.37834: Flags [P.], seq 86982:88356, ack 286, win 65535, length 1374
00:07:55.439943 IP 99.84.126.121.443 > 10.0.2.15.37834: Flags [P.], seq 88356:92478, ack 286, win 65535, length 4122
00:07:55.440001 IP 10.0.2.15.37834 > 99.84.126.121.443: Flags [.], ack 86982, win 65535, length 0
00:07:55.440069 IP 10.0.2.15.37834 > 99.84.126.121.443: Flags [.], ack 88356, win 65535, length 0
00:07:55.440081 IP 10.0.2.15.37834 > 99.84.126.121.443: Flags [.], ack 92478, win 65535, length 0
00:07:55.440098 IP 99.84.126.121.443 > 10.0.2.15.37834: Flags [P.], seq 92478:95226, ack 286, win 65535, length 2748
00:07:55.440105 IP 10.0.2.15.37834 > 99.84.126.121.443: Flags [.], ack 95226, win 65535, length 0
00:07:55.440498 IP 99.84.126.121.443 > 10.0.2.15.37834: Flags [P.], seq 95226:96600, ack 286, win 65535, length 1374
00:07:55.440501 IP 99.84.126.121.443 > 10.0.2.15.37834: Flags [P.], seq 96600:99348, ack 286, win 65535, length 2748
00:07:55.440521 IP 10.0.2.15.37834 > 99.84.126.121.443: Flags [.], ack 96600, win 65535, length 0
00:07:55.440548 IP 10.0.2.15.37834 > 99.84.126.121.443: Flags [.], ack 99348, win 65535, length 0
00:07:55.440900 IP 99.84.126.121.443 > 10.0.2.15.37834: Flags [P.], seq 99348:102096, ack 286, win 65535, length 2748
00:07:55.440917 IP 10.0.2.15.37834 > 99.84.126.121.443: Flags [.], ack 102096, win 65535, length 0
00:07:55.441727 IP 99.84.126.121.443 > 10.0.2.15.37834: Flags [P.], seq 102096:107592, ack 286, win 65535, length 5496
00:07:55.441748 IP 10.0.2.15.37834 > 99.84.126.121.443: Flags [.], ack 107592, win 65535, length 0
00:07:55.442075 IP 99.84.126.121.443 > 10.0.2.15.37834: Flags [P.], seq 107592:110340, ack 286, win 65535, length 2748
00:07:55.442077 IP 99.84.126.121.443 > 10.0.2.15.37834: Flags [P.], seq 110340:111714, ack 286, win 65535, length 1374
00:07:55.442096 IP 10.0.2.15.37834 > 99.84.126.121.443: Flags [.], ack 110340, win 65535, length 0
00:07:55.442125 IP 10.0.2.15.37834 > 99.84.126.121.443: Flags [.], ack 111714, win 65535, length 0
00:07:55.442332 IP 99.84.126.121.443 > 10.0.2.15.37834: Flags [P.], seq 111714:114462, ack 286, win 65535, length 2748
00:07:55.442345 IP 10.0.2.15.37834 > 99.84.126.121.443: Flags [.], ack 114462, win 65535, length 0
00:07:55.443936 IP 99.84.126.121.443 > 10.0.2.15.37834: Flags [P.], seq 114462:119958, ack 286, win 65535, length 5496
00:07:55.443939 IP 99.84.126.121.443 > 10.0.2.15.37834: Flags [P.], seq 119958:122706, ack 286, win 65535, length 2748
00:07:55.443964 IP 10.0.2.15.37834 > 99.84.126.121.443: Flags [.], ack 119958, win 65535, length 0
00:07:55.444076 IP 10.0.2.15.37834 > 99.84.126.121.443: Flags [.], ack 122706, win 65535, length 0
00:07:55.444339 IP 99.84.126.121.443 > 10.0.2.15.37834: Flags [P.], seq 122706:124080, ack 286, win 65535, length 1374
00:07:55.444348 IP 10.0.2.15.37834 > 99.84.126.121.443: Flags [.], ack 124080, win 65535, length 0
00:07:55.445896 IP 99.84.126.121.443 > 10.0.2.15.37834: Flags [P.], seq 124080:128202, ack 286, win 65535, length 4122
00:07:55.445917 IP 10.0.2.15.37834 > 99.84.126.121.443: Flags [.], ack 128202, win 65535, length 0
00:07:55.446221 IP 99.84.126.121.443 > 10.0.2.15.37834: Flags [P.], seq 128202:129576, ack 286, win 65535, length 1374
00:07:55.446235 IP 10.0.2.15.37834 > 99.84.126.121.443: Flags [.], ack 129576, win 65535, length 0
00:07:55.448111 IP 99.84.126.121.443 > 10.0.2.15.37834: Flags [P.], seq 129576:135072, ack 286, win 65535, length 5496
00:07:55.448211 IP 10.0.2.15.37834 > 99.84.126.121.443: Flags [.], ack 135072, win 65535, length 0
00:07:55.448371 IP 99.84.126.121.443 > 10.0.2.15.37834: Flags [P.], seq 135072:136446, ack 286, win 65535, length 1374
00:07:55.448381 IP 10.0.2.15.37834 > 99.84.126.121.443: Flags [.], ack 136446, win 65535, length 0
00:07:55.448571 IP 99.84.126.121.443 > 10.0.2.15.37834: Flags [P.], seq 136446:139194, ack 286, win 65535, length 2748
00:07:55.448579 IP 10.0.2.15.37834 > 99.84.126.121.443: Flags [.], ack 139194, win 65535, length 0
00:07:55.448780 IP 99.84.126.121.443 > 10.0.2.15.37834: Flags [P.], seq 139194:141942, ack 286, win 65535, length 2748
00:07:55.448809 IP 10.0.2.15.37834 > 99.84.126.121.443: Flags [.], ack 141942, win 65535, length 0
00:07:55.448924 IP 99.84.126.121.443 > 10.0.2.15.37834: Flags [P.], seq 141942:143316, ack 286, win 65535, length 1374
00:07:55.448949 IP 10.0.2.15.37834 > 99.84.126.121.443: Flags [.], ack 143316, win 65535, length 0
00:07:55.450588 IP 99.84.126.121.443 > 10.0.2.15.37834: Flags [P.], seq 143316:148812, ack 286, win 65535, length 5496
00:07:55.450613 IP 10.0.2.15.37834 > 99.84.126.121.443: Flags [.], ack 148812, win 65535, length 0
00:07:55.451087 IP 99.84.126.121.443 > 10.0.2.15.37834: Flags [P.], seq 148812:152934, ack 286, win 65535, length 4122
00:07:55.451098 IP 10.0.2.15.37834 > 99.84.126.121.443: Flags [.], ack 152934, win 65535, length 0
00:07:55.451386 IP 99.84.126.121.443 > 10.0.2.15.37834: Flags [P.], seq 152934:157056, ack 286, win 65535, length 4122
00:07:55.451395 IP 10.0.2.15.37834 > 99.84.126.121.443: Flags [.], ack 157056, win 65535, length 0
00:07:55.453331 IP 99.84.126.121.443 > 10.0.2.15.37834: Flags [P.], seq 157056:162552, ack 286, win 65535, length 5496
00:07:55.453333 IP 99.84.126.121.443 > 10.0.2.15.37834: Flags [P.], seq 162552:163926, ack 286, win 65535, length 1374
00:07:55.453407 IP 10.0.2.15.37834 > 99.84.126.121.443: Flags [.], ack 162552, win 65535, length 0
00:07:55.453601 IP 10.0.2.15.37834 > 99.84.126.121.443: Flags [.], ack 163926, win 65535, length 0
00:07:55.454209 IP 99.84.126.121.443 > 10.0.2.15.37834: Flags [P.], seq 163926:166674, ack 286, win 65535, length 2748
00:07:55.454212 IP 99.84.126.121.443 > 10.0.2.15.37834: Flags [P.], seq 166674:169422, ack 286, win 65535, length 2748
00:07:55.454212 IP 99.84.126.121.443 > 10.0.2.15.37834: Flags [P.], seq 169422:170796, ack 286, win 65535, length 1374
00:07:55.454213 IP 99.84.126.121.443 > 10.0.2.15.37834: Flags [P.], seq 170796:173544, ack 286, win 65535, length 2748
00:07:55.454214 IP 99.84.126.121.443 > 10.0.2.15.37834: Flags [P.], seq 173544:176292, ack 286, win 65535, length 2748
00:07:55.454275 IP 10.0.2.15.37834 > 99.84.126.121.443: Flags [.], ack 166674, win 65535, length 0
00:07:55.454308 IP 10.0.2.15.37834 > 99.84.126.121.443: Flags [.], ack 169422, win 65535, length 0
00:07:55.454426 IP 10.0.2.15.37834 > 99.84.126.121.443: Flags [.], ack 170796, win 65535, length 0
00:07:55.454492 IP 10.0.2.15.37834 > 99.84.126.121.443: Flags [.], ack 173544, win 65535, length 0
00:07:55.454507 IP 10.0.2.15.37834 > 99.84.126.121.443: Flags [.], ack 176292, win 65535, length 0
00:07:55.454532 IP 99.84.126.121.443 > 10.0.2.15.37834: Flags [P.], seq 176292:177666, ack 286, win 65535, length 1374
00:07:55.454538 IP 10.0.2.15.37834 > 99.84.126.121.443: Flags [.], ack 177666, win 65535, length 0
00:07:55.455295 IP 99.84.126.121.443 > 10.0.2.15.37834: Flags [P.], seq 177666:181788, ack 286, win 65535, length 4122
00:07:55.455311 IP 10.0.2.15.37834 > 99.84.126.121.443: Flags [.], ack 181788, win 65535, length 0
00:07:55.455630 IP 99.84.126.121.443 > 10.0.2.15.37834: Flags [P.], seq 181788:185910, ack 286, win 65535, length 4122
00:07:55.455632 IP 99.84.126.121.443 > 10.0.2.15.37834: Flags [P.], seq 185910:187284, ack 286, win 65535, length 1374
00:07:55.455688 IP 10.0.2.15.37834 > 99.84.126.121.443: Flags [.], ack 185910, win 65535, length 0
00:07:55.455776 IP 10.0.2.15.37834 > 99.84.126.121.443: Flags [.], ack 187284, win 65535, length 0
00:07:55.456052 IP 99.84.126.121.443 > 10.0.2.15.37834: Flags [P.], seq 187284:190032, ack 286, win 65535, length 2748
00:07:55.456055 IP 99.84.126.121.443 > 10.0.2.15.37834: Flags [P.], seq 190032:191406, ack 286, win 65535, length 1374
00:07:55.456065 IP 10.0.2.15.37834 > 99.84.126.121.443: Flags [.], ack 190032, win 65535, length 0
00:07:55.456086 IP 10.0.2.15.37834 > 99.84.126.121.443: Flags [.], ack 191406, win 65535, length 0
00:07:55.456454 IP 99.84.126.121.443 > 10.0.2.15.37834: Flags [P.], seq 191406:192780, ack 286, win 65535, length 1374
00:07:55.456468 IP 10.0.2.15.37834 > 99.84.126.121.443: Flags [.], ack 192780, win 65535, length 0
00:07:55.457845 IP 99.84.126.121.443 > 10.0.2.15.37834: Flags [P.], seq 192780:196902, ack 286, win 65535, length 4122
00:07:55.457849 IP 99.84.126.121.443 > 10.0.2.15.37834: Flags [P.], seq 196902:201024, ack 286, win 65535, length 4122
00:07:55.457874 IP 10.0.2.15.37834 > 99.84.126.121.443: Flags [.], ack 196902, win 65535, length 0
00:07:55.457912 IP 10.0.2.15.37834 > 99.84.126.121.443: Flags [.], ack 201024, win 65535, length 0
00:07:55.458024 IP 99.84.126.121.443 > 10.0.2.15.37834: Flags [P.], seq 201024:203772, ack 286, win 65535, length 2748
00:07:55.458033 IP 10.0.2.15.37834 > 99.84.126.121.443: Flags [.], ack 203772, win 65535, length 0
00:07:55.458429 IP 99.84.126.121.443 > 10.0.2.15.37834: Flags [P.], seq 203772:207894, ack 286, win 65535, length 4122
00:07:55.458470 IP 10.0.2.15.37834 > 99.84.126.121.443: Flags [.], ack 207894, win 65535, length 0
00:07:55.458782 IP 99.84.126.121.443 > 10.0.2.15.37834: Flags [P.], seq 207894:210642, ack 286, win 65535, length 2748
00:07:55.458784 IP 99.84.126.121.443 > 10.0.2.15.37834: Flags [P.], seq 210642:212016, ack 286, win 65535, length 1374
00:07:55.458800 IP 10.0.2.15.37834 > 99.84.126.121.443: Flags [.], ack 210642, win 65535, length 0
00:07:55.458821 IP 10.0.2.15.37834 > 99.84.126.121.443: Flags [.], ack 212016, win 65535, length 0
00:07:55.459491 IP 99.84.126.121.443 > 10.0.2.15.37834: Flags [P.], seq 212016:213390, ack 286, win 65535, length 1374
00:07:55.459504 IP 10.0.2.15.37834 > 99.84.126.121.443: Flags [.], ack 213390, win 65535, length 0
00:07:55.460239 IP 99.84.126.121.443 > 10.0.2.15.37834: Flags [P.], seq 213390:218886, ack 286, win 65535, length 5496
00:07:55.460243 IP 99.84.126.121.443 > 10.0.2.15.37834: Flags [.], seq 218886:221806, ack 286, win 65535, length 2920
00:07:55.460265 IP 10.0.2.15.37834 > 99.84.126.121.443: Flags [.], ack 218886, win 65535, length 0
00:07:55.460356 IP 10.0.2.15.37834 > 99.84.126.121.443: Flags [.], ack 221806, win 65535, length 0
00:07:55.460494 IP 99.84.126.121.443 > 10.0.2.15.37834: Flags [P.], seq 221806:223008, ack 286, win 65535, length 1202
00:07:55.460502 IP 10.0.2.15.37834 > 99.84.126.121.443: Flags [.], ack 223008, win 65535, length 0
00:07:55.460643 IP 99.84.126.121.443 > 10.0.2.15.37834: Flags [P.], seq 223008:225756, ack 286, win 65535, length 2748
00:07:55.460653 IP 10.0.2.15.37834 > 99.84.126.121.443: Flags [.], ack 225756, win 65535, length 0
00:07:55.460872 IP 99.84.126.121.443 > 10.0.2.15.37834: Flags [P.], seq 225756:229878, ack 286, win 65535, length 4122
00:07:55.460881 IP 10.0.2.15.37834 > 99.84.126.121.443: Flags [.], ack 229878, win 65535, length 0
00:07:55.461359 IP 99.84.126.121.443 > 10.0.2.15.37834: Flags [P.], seq 229878:234000, ack 286, win 65535, length 4122
00:07:55.461411 IP 10.0.2.15.37834 > 99.84.126.121.443: Flags [.], ack 234000, win 65535, length 0
00:07:55.462331 IP 99.84.126.121.443 > 10.0.2.15.37834: Flags [P.], seq 234000:238122, ack 286, win 65535, length 4122
00:07:55.462346 IP 10.0.2.15.37834 > 99.84.126.121.443: Flags [.], ack 238122, win 65535, length 0
00:07:55.462630 IP 99.84.126.121.443 > 10.0.2.15.37834: Flags [P.], seq 238122:242244, ack 286, win 65535, length 4122
00:07:55.462643 IP 10.0.2.15.37834 > 99.84.126.121.443: Flags [.], ack 242244, win 65535, length 0
00:07:55.462952 IP 99.84.126.121.443 > 10.0.2.15.37834: Flags [P.], seq 242244:246366, ack 286, win 65535, length 4122
00:07:55.462962 IP 10.0.2.15.37834 > 99.84.126.121.443: Flags [.], ack 246366, win 65535, length 0
00:07:55.463220 IP 99.84.126.121.443 > 10.0.2.15.37834: Flags [P.], seq 246366:250488, ack 286, win 65535, length 4122
00:07:55.463230 IP 10.0.2.15.37834 > 99.84.126.121.443: Flags [.], ack 250488, win 65535, length 0
00:07:55.463600 IP 99.84.126.121.443 > 10.0.2.15.37834: Flags [P.], seq 250488:254610, ack 286, win 65535, length 4122
00:07:55.463614 IP 10.0.2.15.37834 > 99.84.126.121.443: Flags [.], ack 254610, win 65535, length 0
00:07:55.464342 IP 99.84.126.121.443 > 10.0.2.15.37834: Flags [P.], seq 254610:258732, ack 286, win 65535, length 4122
00:07:55.464345 IP 99.84.126.121.443 > 10.0.2.15.37834: Flags [P.], seq 258732:260106, ack 286, win 65535, length 1374
00:07:55.464362 IP 10.0.2.15.37834 > 99.84.126.121.443: Flags [.], ack 258732, win 65535, length 0
00:07:55.464382 IP 10.0.2.15.37834 > 99.84.126.121.443: Flags [.], ack 260106, win 65535, length 0
00:07:55.465008 IP 99.84.126.121.443 > 10.0.2.15.37834: Flags [P.], seq 260106:264228, ack 286, win 65535, length 4122
00:07:55.465259 IP 99.84.126.121.443 > 10.0.2.15.37834: Flags [P.], seq 264228:268350, ack 286, win 65535, length 4122
00:07:55.465333 IP 99.84.126.121.443 > 10.0.2.15.37834: Flags [P.], seq 268350:269724, ack 286, win 65535, length 1374
00:07:55.465559 IP 99.84.126.121.443 > 10.0.2.15.37834: Flags [P.], seq 269724:272472, ack 286, win 65535, length 2748
00:07:55.465702 IP 99.84.126.121.443 > 10.0.2.15.37834: Flags [P.], seq 272472:275220, ack 286, win 65535, length 2748
00:07:55.465989 IP 99.84.126.121.443 > 10.0.2.15.37834: Flags [P.], seq 275220:277968, ack 286, win 65535, length 2748
00:07:55.466365 IP 99.84.126.121.443 > 10.0.2.15.37834: Flags [P.], seq 277968:280716, ack 286, win 65535, length 2748
00:07:55.466482 IP 99.84.126.121.443 > 10.0.2.15.37834: Flags [P.], seq 280716:283464, ack 286, win 65535, length 2748
00:07:55.466930 IP 10.0.2.15.37834 > 99.84.126.121.443: Flags [.], ack 283464, win 65535, length 0
00:07:55.467636 IP 99.84.126.121.443 > 10.0.2.15.37834: Flags [P.], seq 283464:288960, ack 286, win 65535, length 5496
00:07:55.467848 IP 99.84.126.121.443 > 10.0.2.15.37834: Flags [P.], seq 288960:293082, ack 286, win 65535, length 4122
00:07:55.468043 IP 99.84.126.121.443 > 10.0.2.15.37834: Flags [P.], seq 293082:295830, ack 286, win 65535, length 2748
00:07:55.468519 IP 99.84.126.121.443 > 10.0.2.15.37834: Flags [P.], seq 295830:299952, ack 286, win 65535, length 4122
00:07:55.468521 IP 99.84.126.121.443 > 10.0.2.15.37834: Flags [P.], seq 299952:302700, ack 286, win 65535, length 2748
00:07:55.468584 IP 10.0.2.15.37834 > 99.84.126.121.443: Flags [.], ack 302700, win 65535, length 0
00:07:55.469106 IP 99.84.126.121.443 > 10.0.2.15.37834: Flags [P.], seq 302700:306822, ack 286, win 65535, length 4122
00:07:55.469732 IP 99.84.126.121.443 > 10.0.2.15.37834: Flags [P.], seq 306822:309570, ack 286, win 65535, length 2748
00:07:55.469928 IP 99.84.126.121.443 > 10.0.2.15.37834: Flags [P.], seq 309570:312318, ack 286, win 65535, length 2748
00:07:55.470253 IP 10.0.2.15.37834 > 99.84.126.121.443: Flags [.], ack 312318, win 65535, length 0
00:07:55.470405 IP 99.84.126.121.443 > 10.0.2.15.37834: Flags [P.], seq 312318:316440, ack 286, win 65535, length 4122
00:07:55.470637 IP 99.84.126.121.443 > 10.0.2.15.37834: Flags [P.], seq 316440:320562, ack 286, win 65535, length 4122
00:07:55.470967 IP 99.84.126.121.443 > 10.0.2.15.37834: Flags [P.], seq 320562:324684, ack 286, win 65535, length 4122
00:07:55.471196 IP 99.84.126.121.443 > 10.0.2.15.37834: Flags [P.], seq 324684:327432, ack 286, win 65535, length 2748
00:07:55.471524 IP 99.84.126.121.443 > 10.0.2.15.37834: Flags [P.], seq 327432:330180, ack 286, win 65535, length 2748
00:07:55.471705 IP 10.0.2.15.37834 > 99.84.126.121.443: Flags [.], ack 330180, win 65535, length 0
00:07:55.474566 IP 99.84.126.121.443 > 10.0.2.15.37834: Flags [P.], seq 330180:335676, ack 286, win 65535, length 5496
00:07:55.474593 IP 10.0.2.15.37834 > 99.84.126.121.443: Flags [.], ack 335676, win 65535, length 0
00:07:55.475165 IP 99.84.126.121.443 > 10.0.2.15.37834: Flags [P.], seq 335676:339798, ack 286, win 65535, length 4122
00:07:55.475169 IP 99.84.126.121.443 > 10.0.2.15.37834: Flags [P.], seq 339798:342546, ack 286, win 65535, length 2748
00:07:55.475225 IP 10.0.2.15.37834 > 99.84.126.121.443: Flags [.], ack 339798, win 65535, length 0
00:07:55.475252 IP 10.0.2.15.37834 > 99.84.126.121.443: Flags [.], ack 342546, win 65535, length 0
00:07:55.475918 IP 99.84.126.121.443 > 10.0.2.15.37834: Flags [P.], seq 342546:352164, ack 286, win 65535, length 9618
00:07:55.475936 IP 10.0.2.15.37834 > 99.84.126.121.443: Flags [.], ack 352164, win 65535, length 0
00:07:55.476334 IP 99.84.126.121.443 > 10.0.2.15.37834: Flags [P.], seq 352164:357660, ack 286, win 65535, length 5496
00:07:55.476434 IP 10.0.2.15.37834 > 99.84.126.121.443: Flags [.], ack 357660, win 65535, length 0
00:07:55.476609 IP 99.84.126.121.443 > 10.0.2.15.37834: Flags [P.], seq 357660:361782, ack 286, win 65535, length 4122
00:07:55.476621 IP 10.0.2.15.37834 > 99.84.126.121.443: Flags [.], ack 361782, win 65535, length 0
00:07:55.477358 IP 99.84.126.121.443 > 10.0.2.15.37834: Flags [P.], seq 361782:367278, ack 286, win 65535, length 5496
00:07:55.477390 IP 10.0.2.15.37834 > 99.84.126.121.443: Flags [.], ack 367278, win 65535, length 0
00:07:55.477894 IP 99.84.126.121.443 > 10.0.2.15.37834: Flags [P.], seq 367278:374148, ack 286, win 65535, length 6870
00:07:55.477913 IP 10.0.2.15.37834 > 99.84.126.121.443: Flags [.], ack 374148, win 65535, length 0
00:07:55.478247 IP 99.84.126.121.443 > 10.0.2.15.37834: Flags [P.], seq 374148:376896, ack 286, win 65535, length 2748
00:07:55.478261 IP 10.0.2.15.37834 > 99.84.126.121.443: Flags [.], ack 376896, win 65535, length 0
00:07:55.478751 IP 99.84.126.121.443 > 10.0.2.15.37834: Flags [P.], seq 376896:381018, ack 286, win 65535, length 4122
00:07:55.478788 IP 10.0.2.15.37834 > 99.84.126.121.443: Flags [.], ack 381018, win 65535, length 0
00:07:55.479102 IP 99.84.126.121.443 > 10.0.2.15.37834: Flags [P.], seq 381018:385140, ack 286, win 65535, length 4122
00:07:55.479111 IP 10.0.2.15.37834 > 99.84.126.121.443: Flags [.], ack 385140, win 65535, length 0
00:07:55.479626 IP 99.84.126.121.443 > 10.0.2.15.37834: Flags [P.], seq 385140:389262, ack 286, win 65535, length 4122
00:07:55.479630 IP 99.84.126.121.443 > 10.0.2.15.37834: Flags [P.], seq 389262:393384, ack 286, win 65535, length 4122
00:07:55.479651 IP 10.0.2.15.37834 > 99.84.126.121.443: Flags [.], ack 389262, win 65535, length 0
00:07:55.479675 IP 10.0.2.15.37834 > 99.84.126.121.443: Flags [.], ack 393384, win 65535, length 0
00:07:55.480266 IP 99.84.126.121.443 > 10.0.2.15.37834: Flags [P.], seq 393384:396132, ack 286, win 65535, length 2748
00:07:55.480289 IP 10.0.2.15.37834 > 99.84.126.121.443: Flags [.], ack 396132, win 65535, length 0
00:07:55.480711 IP 99.84.126.121.443 > 10.0.2.15.37834: Flags [P.], seq 396132:403002, ack 286, win 65535, length 6870
00:07:55.480714 IP 99.84.126.121.443 > 10.0.2.15.37834: Flags [P.], seq 403002:407124, ack 286, win 65535, length 4122
00:07:55.480730 IP 10.0.2.15.37834 > 99.84.126.121.443: Flags [.], ack 403002, win 65535, length 0
00:07:55.480760 IP 10.0.2.15.37834 > 99.84.126.121.443: Flags [.], ack 407124, win 65535, length 0
00:07:55.481386 IP 99.84.126.121.443 > 10.0.2.15.37834: Flags [P.], seq 407124:411246, ack 286, win 65535, length 4122
00:07:55.481390 IP 99.84.126.121.443 > 10.0.2.15.37834: Flags [P.], seq 411246:413994, ack 286, win 65535, length 2748
00:07:55.481410 IP 10.0.2.15.37834 > 99.84.126.121.443: Flags [.], ack 411246, win 65535, length 0
00:07:55.481438 IP 10.0.2.15.37834 > 99.84.126.121.443: Flags [.], ack 413994, win 65535, length 0
00:07:55.481711 IP 99.84.126.121.443 > 10.0.2.15.37834: Flags [P.], seq 413994:416742, ack 286, win 65535, length 2748
00:07:55.481724 IP 10.0.2.15.37834 > 99.84.126.121.443: Flags [.], ack 416742, win 65535, length 0
00:07:55.481947 IP 99.84.126.121.443 > 10.0.2.15.37834: Flags [P.], seq 416742:420864, ack 286, win 65535, length 4122
00:07:55.481959 IP 10.0.2.15.37834 > 99.84.126.121.443: Flags [.], ack 420864, win 65535, length 0
00:07:55.482117 IP 99.84.126.121.443 > 10.0.2.15.37834: Flags [P.], seq 420864:422238, ack 286, win 65535, length 1374
00:07:55.482125 IP 10.0.2.15.37834 > 99.84.126.121.443: Flags [.], ack 422238, win 65535, length 0
00:07:55.482996 IP 99.84.126.121.443 > 10.0.2.15.37834: Flags [P.], seq 422238:426360, ack 286, win 65535, length 4122
00:07:55.483010 IP 10.0.2.15.37834 > 99.84.126.121.443: Flags [.], ack 426360, win 65535, length 0
00:07:55.483287 IP 99.84.126.121.443 > 10.0.2.15.37834: Flags [P.], seq 426360:430482, ack 286, win 65535, length 4122
00:07:55.483296 IP 10.0.2.15.37834 > 99.84.126.121.443: Flags [.], ack 430482, win 65535, length 0
00:07:55.483413 IP 99.84.126.121.443 > 10.0.2.15.37834: Flags [P.], seq 430482:433230, ack 286, win 65535, length 2748
00:07:55.483420 IP 10.0.2.15.37834 > 99.84.126.121.443: Flags [.], ack 433230, win 65535, length 0
00:07:55.483714 IP 99.84.126.121.443 > 10.0.2.15.37834: Flags [P.], seq 433230:437352, ack 286, win 65535, length 4122
00:07:55.483723 IP 10.0.2.15.37834 > 99.84.126.121.443: Flags [.], ack 437352, win 65535, length 0
00:07:55.483960 IP 99.84.126.121.443 > 10.0.2.15.37834: Flags [P.], seq 437352:440100, ack 286, win 65535, length 2748
00:07:55.483969 IP 10.0.2.15.37834 > 99.84.126.121.443: Flags [.], ack 440100, win 65535, length 0
00:07:55.484812 IP 99.84.126.121.443 > 10.0.2.15.37834: Flags [P.], seq 440100:441474, ack 286, win 65535, length 1374
00:07:55.484817 IP 99.84.126.121.443 > 10.0.2.15.37834: Flags [P.], seq 441474:444222, ack 286, win 65535, length 2748
00:07:55.484819 IP 99.84.126.121.443 > 10.0.2.15.37834: Flags [P.], seq 444222:448344, ack 286, win 65535, length 4122
00:07:55.484840 IP 10.0.2.15.37834 > 99.84.126.121.443: Flags [.], ack 441474, win 65535, length 0
00:07:55.484875 IP 10.0.2.15.37834 > 99.84.126.121.443: Flags [.], ack 444222, win 65535, length 0
00:07:55.484890 IP 10.0.2.15.37834 > 99.84.126.121.443: Flags [.], ack 448344, win 65535, length 0
00:07:55.485524 IP 99.84.126.121.443 > 10.0.2.15.37834: Flags [P.], seq 448344:451092, ack 286, win 65535, length 2748
00:07:55.485526 IP 99.84.126.121.443 > 10.0.2.15.37834: Flags [P.], seq 451092:452466, ack 286, win 65535, length 1374
00:07:55.485527 IP 99.84.126.121.443 > 10.0.2.15.37834: Flags [P.], seq 452466:453840, ack 286, win 65535, length 1374
00:07:55.485528 IP 99.84.126.121.443 > 10.0.2.15.37834: Flags [P.], seq 453840:455214, ack 286, win 65535, length 1374
00:07:55.485529 IP 99.84.126.121.443 > 10.0.2.15.37834: Flags [P.], seq 455214:457962, ack 286, win 65535, length 2748
00:07:55.485544 IP 10.0.2.15.37834 > 99.84.126.121.443: Flags [.], ack 451092, win 65535, length 0
00:07:55.485564 IP 10.0.2.15.37834 > 99.84.126.121.443: Flags [.], ack 452466, win 65535, length 0
00:07:55.485683 IP 10.0.2.15.37834 > 99.84.126.121.443: Flags [.], ack 453840, win 65535, length 0
00:07:55.485700 IP 10.0.2.15.37834 > 99.84.126.121.443: Flags [.], ack 455214, win 65535, length 0
00:07:55.485712 IP 10.0.2.15.37834 > 99.84.126.121.443: Flags [.], ack 457962, win 65535, length 0
00:07:55.485789 IP 99.84.126.121.443 > 10.0.2.15.37834: Flags [P.], seq 457962:462084, ack 286, win 65535, length 4122
00:07:55.485794 IP 10.0.2.15.37834 > 99.84.126.121.443: Flags [.], ack 462084, win 65535, length 0
00:07:55.486388 IP 99.84.126.121.443 > 10.0.2.15.37834: Flags [P.], seq 462084:466206, ack 286, win 65535, length 4122
00:07:55.486403 IP 10.0.2.15.37834 > 99.84.126.121.443: Flags [.], ack 466206, win 65535, length 0
00:07:55.486592 IP 99.84.126.121.443 > 10.0.2.15.37834: Flags [P.], seq 466206:468954, ack 286, win 65535, length 2748
00:07:55.486599 IP 10.0.2.15.37834 > 99.84.126.121.443: Flags [.], ack 468954, win 65535, length 0
00:07:55.487745 IP 99.84.126.121.443 > 10.0.2.15.37834: Flags [P.], seq 468954:470328, ack 286, win 65535, length 1374
00:07:55.487848 IP 10.0.2.15.37834 > 99.84.126.121.443: Flags [.], ack 470328, win 65535, length 0
00:07:55.488600 IP 99.84.126.121.443 > 10.0.2.15.37834: Flags [P.], seq 470328:477198, ack 286, win 65535, length 6870
00:07:55.488612 IP 99.84.126.121.443 > 10.0.2.15.37834: Flags [P.], seq 477198:479946, ack 286, win 65535, length 2748
00:07:55.488630 IP 10.0.2.15.37834 > 99.84.126.121.443: Flags [.], ack 477198, win 65535, length 0
00:07:55.488688 IP 10.0.2.15.37834 > 99.84.126.121.443: Flags [.], ack 479946, win 65535, length 0
00:07:55.488999 IP 99.84.126.121.443 > 10.0.2.15.37834: Flags [P.], seq 479946:482694, ack 286, win 65535, length 2748
00:07:55.489014 IP 10.0.2.15.37834 > 99.84.126.121.443: Flags [.], ack 482694, win 65535, length 0
00:07:55.490081 IP 99.84.126.121.443 > 10.0.2.15.37834: Flags [P.], seq 482694:485442, ack 286, win 65535, length 2748
00:07:55.490086 IP 99.84.126.121.443 > 10.0.2.15.37834: Flags [P.], seq 485442:490938, ack 286, win 65535, length 5496
00:07:55.490109 IP 10.0.2.15.37834 > 99.84.126.121.443: Flags [.], ack 485442, win 65535, length 0
00:07:55.490145 IP 10.0.2.15.37834 > 99.84.126.121.443: Flags [.], ack 490938, win 65535, length 0
00:07:55.490511 IP 99.84.126.121.443 > 10.0.2.15.37834: Flags [P.], seq 490938:495060, ack 286, win 65535, length 4122
00:07:55.490753 IP 10.0.2.15.37834 > 99.84.126.121.443: Flags [.], ack 495060, win 65535, length 0
00:07:55.491497 IP 99.84.126.121.443 > 10.0.2.15.37834: Flags [P.], seq 495060:499182, ack 286, win 65535, length 4122
00:07:55.491529 IP 99.84.126.121.443 > 10.0.2.15.37834: Flags [P.], seq 499182:503304, ack 286, win 65535, length 4122
00:07:55.491532 IP 99.84.126.121.443 > 10.0.2.15.37834: Flags [P.], seq 503304:508800, ack 286, win 65535, length 5496
00:07:55.491555 IP 10.0.2.15.37834 > 99.84.126.121.443: Flags [.], ack 499182, win 65535, length 0
00:07:55.491671 IP 10.0.2.15.37834 > 99.84.126.121.443: Flags [.], ack 503304, win 65535, length 0
00:07:55.491688 IP 10.0.2.15.37834 > 99.84.126.121.443: Flags [.], ack 508800, win 65535, length 0
00:07:55.491782 IP 99.84.126.121.443 > 10.0.2.15.37834: Flags [P.], seq 508800:510174, ack 286, win 65535, length 1374
00:07:55.491784 IP 99.84.126.121.443 > 10.0.2.15.37834: Flags [P.], seq 510174:514296, ack 286, win 65535, length 4122
00:07:55.491785 IP 99.84.126.121.443 > 10.0.2.15.37834: Flags [P.], seq 514296:515670, ack 286, win 65535, length 1374
00:07:55.491795 IP 10.0.2.15.37834 > 99.84.126.121.443: Flags [.], ack 510174, win 65535, length 0
00:07:55.491872 IP 10.0.2.15.37834 > 99.84.126.121.443: Flags [.], ack 514296, win 65535, length 0
00:07:55.491898 IP 10.0.2.15.37834 > 99.84.126.121.443: Flags [.], ack 515670, win 65535, length 0
00:07:55.492073 IP 99.84.126.121.443 > 10.0.2.15.37834: Flags [P.], seq 515670:518418, ack 286, win 65535, length 2748
00:07:55.492075 IP 99.84.126.121.443 > 10.0.2.15.37834: Flags [P.], seq 518418:519792, ack 286, win 65535, length 1374
00:07:55.492091 IP 10.0.2.15.37834 > 99.84.126.121.443: Flags [.], ack 518418, win 65535, length 0
00:07:55.492108 IP 10.0.2.15.37834 > 99.84.126.121.443: Flags [.], ack 519792, win 65535, length 0
00:07:55.493238 IP 99.84.126.121.443 > 10.0.2.15.37834: Flags [P.], seq 519792:523914, ack 286, win 65535, length 4122
00:07:55.493242 IP 99.84.126.121.443 > 10.0.2.15.37834: Flags [P.], seq 523914:528036, ack 286, win 65535, length 4122
00:07:55.493300 IP 10.0.2.15.37834 > 99.84.126.121.443: Flags [.], ack 523914, win 65535, length 0
00:07:55.493325 IP 10.0.2.15.37834 > 99.84.126.121.443: Flags [.], ack 528036, win 65535, length 0
00:07:55.493449 IP 99.84.126.121.443 > 10.0.2.15.37834: Flags [P.], seq 528036:530784, ack 286, win 65535, length 2748
00:07:55.493455 IP 10.0.2.15.37834 > 99.84.126.121.443: Flags [.], ack 530784, win 65535, length 0
00:07:55.493673 IP 99.84.126.121.443 > 10.0.2.15.37834: Flags [P.], seq 530784:533532, ack 286, win 65535, length 2748
00:07:55.493690 IP 10.0.2.15.37834 > 99.84.126.121.443: Flags [.], ack 533532, win 65535, length 0
00:07:55.494016 IP 99.84.126.121.443 > 10.0.2.15.37834: Flags [P.], seq 533532:536280, ack 286, win 65535, length 2748
00:07:55.494028 IP 10.0.2.15.37834 > 99.84.126.121.443: Flags [.], ack 536280, win 65535, length 0
00:07:55.498402 IP 99.84.126.121.443 > 10.0.2.15.37834: Flags [P.], seq 536280:540402, ack 286, win 65535, length 4122
00:07:55.498411 IP 99.84.126.121.443 > 10.0.2.15.37834: Flags [P.], seq 540402:566508, ack 286, win 65535, length 26106
00:07:55.498438 IP 10.0.2.15.37834 > 99.84.126.121.443: Flags [.], ack 540402, win 65535, length 0
00:07:55.498556 IP 10.0.2.15.37834 > 99.84.126.121.443: Flags [.], ack 566508, win 65535, length 0
00:07:55.498629 IP 99.84.126.121.443 > 10.0.2.15.37834: Flags [P.], seq 566508:580248, ack 286, win 65535, length 13740
00:07:55.498638 IP 10.0.2.15.37834 > 99.84.126.121.443: Flags [.], ack 580248, win 65535, length 0
00:07:55.498963 IP 99.84.126.121.443 > 10.0.2.15.37834: Flags [.], seq 580248:583168, ack 286, win 65535, length 2920
00:07:55.498975 IP 10.0.2.15.37834 > 99.84.126.121.443: Flags [.], ack 583168, win 65535, length 0
00:07:55.499682 IP 99.84.126.121.443 > 10.0.2.15.37834: Flags [P.], seq 583168:587118, ack 286, win 65535, length 3950
00:07:55.499695 IP 10.0.2.15.37834 > 99.84.126.121.443: Flags [.], ack 587118, win 65535, length 0
00:07:55.500194 IP 99.84.126.121.443 > 10.0.2.15.37834: Flags [P.], seq 587118:591240, ack 286, win 65535, length 4122
00:07:55.500196 IP 99.84.126.121.443 > 10.0.2.15.37834: Flags [P.], seq 591240:595362, ack 286, win 65535, length 4122
00:07:55.500211 IP 10.0.2.15.37834 > 99.84.126.121.443: Flags [.], ack 591240, win 65535, length 0
00:07:55.500228 IP 10.0.2.15.37834 > 99.84.126.121.443: Flags [.], ack 595362, win 65535, length 0
00:07:55.500512 IP 99.84.126.121.443 > 10.0.2.15.37834: Flags [P.], seq 595362:599484, ack 286, win 65535, length 4122
00:07:55.500520 IP 10.0.2.15.37834 > 99.84.126.121.443: Flags [.], ack 599484, win 65535, length 0
00:07:55.500642 IP 99.84.126.121.443 > 10.0.2.15.37834: Flags [P.], seq 599484:603606, ack 286, win 65535, length 4122
00:07:55.500651 IP 10.0.2.15.37834 > 99.84.126.121.443: Flags [.], ack 603606, win 65535, length 0
00:07:55.501135 IP 99.84.126.121.443 > 10.0.2.15.37834: Flags [P.], seq 603606:608254, ack 286, win 65535, length 4648
00:07:55.501137 IP 99.84.126.121.443 > 10.0.2.15.37834: Flags [P.], seq 608254:609628, ack 286, win 65535, length 1374
00:07:55.501150 IP 10.0.2.15.37834 > 99.84.126.121.443: Flags [.], ack 608254, win 65535, length 0
00:07:55.501258 IP 10.0.2.15.37834 > 99.84.126.121.443: Flags [.], ack 609628, win 65535, length 0
00:07:55.501474 IP 99.84.126.121.443 > 10.0.2.15.37834: Flags [P.], seq 609628:612376, ack 286, win 65535, length 2748
00:07:55.501482 IP 10.0.2.15.37834 > 99.84.126.121.443: Flags [.], ack 612376, win 65535, length 0
00:07:55.502234 IP 99.84.126.121.443 > 10.0.2.15.37834: Flags [P.], seq 612376:616498, ack 286, win 65535, length 4122
00:07:55.502248 IP 10.0.2.15.37834 > 99.84.126.121.443: Flags [.], ack 616498, win 65535, length 0
00:07:55.502469 IP 99.84.126.121.443 > 10.0.2.15.37834: Flags [P.], seq 616498:619246, ack 286, win 65535, length 2748
00:07:55.502480 IP 10.0.2.15.37834 > 99.84.126.121.443: Flags [.], ack 619246, win 65535, length 0
00:07:55.502666 IP 99.84.126.121.443 > 10.0.2.15.37834: Flags [P.], seq 619246:620620, ack 286, win 65535, length 1374
00:07:55.502676 IP 10.0.2.15.37834 > 99.84.126.121.443: Flags [.], ack 620620, win 65535, length 0
00:07:55.502917 IP 99.84.126.121.443 > 10.0.2.15.37834: Flags [P.], seq 620620:623368, ack 286, win 65535, length 2748
00:07:55.502924 IP 10.0.2.15.37834 > 99.84.126.121.443: Flags [.], ack 623368, win 65535, length 0
00:07:55.503105 IP 99.84.126.121.443 > 10.0.2.15.37834: Flags [P.], seq 623368:624742, ack 286, win 65535, length 1374
00:07:55.503114 IP 10.0.2.15.37834 > 99.84.126.121.443: Flags [.], ack 624742, win 65535, length 0
00:07:55.504696 IP 99.84.126.121.443 > 10.0.2.15.37834: Flags [P.], seq 624742:628864, ack 286, win 65535, length 4122
00:07:55.504711 IP 10.0.2.15.37834 > 99.84.126.121.443: Flags [.], ack 628864, win 65535, length 0
00:07:55.504981 IP 99.84.126.121.443 > 10.0.2.15.37834: Flags [P.], seq 628864:632460, ack 286, win 65535, length 3596
00:07:55.504992 IP 10.0.2.15.37834 > 99.84.126.121.443: Flags [.], ack 632460, win 65535, length 0
00:07:55.505338 IP 99.84.126.121.443 > 10.0.2.15.37834: Flags [P.], seq 632460:636582, ack 286, win 65535, length 4122
00:07:55.505354 IP 10.0.2.15.37834 > 99.84.126.121.443: Flags [.], ack 636582, win 65535, length 0
00:07:55.505552 IP 99.84.126.121.443 > 10.0.2.15.37834: Flags [P.], seq 636582:640704, ack 286, win 65535, length 4122
00:07:55.505563 IP 10.0.2.15.37834 > 99.84.126.121.443: Flags [.], ack 640704, win 65535, length 0
00:07:55.506005 IP 99.84.126.121.443 > 10.0.2.15.37834: Flags [P.], seq 640704:646200, ack 286, win 65535, length 5496
00:07:55.506017 IP 10.0.2.15.37834 > 99.84.126.121.443: Flags [.], ack 646200, win 65535, length 0
00:07:55.506226 IP 99.84.126.121.443 > 10.0.2.15.37834: Flags [P.], seq 646200:648948, ack 286, win 65535, length 2748
00:07:55.506236 IP 10.0.2.15.37834 > 99.84.126.121.443: Flags [.], ack 648948, win 65535, length 0
00:07:55.506789 IP 99.84.126.121.443 > 10.0.2.15.37834: Flags [P.], seq 648948:651696, ack 286, win 65535, length 2748
00:07:55.506791 IP 99.84.126.121.443 > 10.0.2.15.37834: Flags [P.], seq 651696:655818, ack 286, win 65535, length 4122
00:07:55.506806 IP 10.0.2.15.37834 > 99.84.126.121.443: Flags [.], ack 651696, win 65535, length 0
00:07:55.506820 IP 10.0.2.15.37834 > 99.84.126.121.443: Flags [.], ack 655818, win 65535, length 0
00:07:55.506909 IP 99.84.126.121.443 > 10.0.2.15.37834: Flags [P.], seq 655818:657192, ack 286, win 65535, length 1374
00:07:55.506914 IP 10.0.2.15.37834 > 99.84.126.121.443: Flags [.], ack 657192, win 65535, length 0
00:07:55.507149 IP 99.84.126.121.443 > 10.0.2.15.37834: Flags [P.], seq 657192:661314, ack 286, win 65535, length 4122
00:07:55.507155 IP 10.0.2.15.37834 > 99.84.126.121.443: Flags [.], ack 661314, win 65535, length 0
00:07:55.507688 IP 99.84.126.121.443 > 10.0.2.15.37834: Flags [P.], seq 661314:665436, ack 286, win 65535, length 4122
00:07:55.507702 IP 10.0.2.15.37834 > 99.84.126.121.443: Flags [.], ack 665436, win 65535, length 0
00:07:55.507865 IP 99.84.126.121.443 > 10.0.2.15.37834: Flags [P.], seq 665436:668184, ack 286, win 65535, length 2748
00:07:55.507875 IP 10.0.2.15.37834 > 99.84.126.121.443: Flags [.], ack 668184, win 65535, length 0
00:07:55.508074 IP 99.84.126.121.443 > 10.0.2.15.37834: Flags [P.], seq 668184:670932, ack 286, win 65535, length 2748
00:07:55.508083 IP 10.0.2.15.37834 > 99.84.126.121.443: Flags [.], ack 670932, win 65535, length 0
00:07:55.508607 IP 99.84.126.121.443 > 10.0.2.15.37834: Flags [P.], seq 670932:672306, ack 286, win 65535, length 1374
00:07:55.508619 IP 10.0.2.15.37834 > 99.84.126.121.443: Flags [.], ack 672306, win 65535, length 0
00:07:55.509503 IP 99.84.126.121.443 > 10.0.2.15.37834: Flags [P.], seq 672306:677802, ack 286, win 65535, length 5496
00:07:55.509505 IP 99.84.126.121.443 > 10.0.2.15.37834: Flags [P.], seq 677802:680550, ack 286, win 65535, length 2748
00:07:55.509519 IP 10.0.2.15.37834 > 99.84.126.121.443: Flags [.], ack 677802, win 65535, length 0
00:07:55.509546 IP 10.0.2.15.37834 > 99.84.126.121.443: Flags [.], ack 680550, win 65535, length 0
00:07:55.509678 IP 99.84.126.121.443 > 10.0.2.15.37834: Flags [P.], seq 680550:684672, ack 286, win 65535, length 4122
00:07:55.509684 IP 10.0.2.15.37834 > 99.84.126.121.443: Flags [.], ack 684672, win 65535, length 0
00:07:55.509967 IP 99.84.126.121.443 > 10.0.2.15.37834: Flags [P.], seq 684672:687420, ack 286, win 65535, length 2748
00:07:55.509978 IP 10.0.2.15.37834 > 99.84.126.121.443: Flags [.], ack 687420, win 65535, length 0
00:07:55.510085 IP 99.84.126.121.443 > 10.0.2.15.37834: Flags [P.], seq 687420:688794, ack 286, win 65535, length 1374
00:07:55.510090 IP 10.0.2.15.37834 > 99.84.126.121.443: Flags [.], ack 688794, win 65535, length 0
00:07:55.510226 IP 99.84.126.121.443 > 10.0.2.15.37834: Flags [P.], seq 688794:690168, ack 286, win 65535, length 1374
00:07:55.510233 IP 10.0.2.15.37834 > 99.84.126.121.443: Flags [.], ack 690168, win 65535, length 0
00:07:55.510477 IP 99.84.126.121.443 > 10.0.2.15.37834: Flags [P.], seq 690168:694290, ack 286, win 65535, length 4122
00:07:55.510536 IP 10.0.2.15.37834 > 99.84.126.121.443: Flags [.], ack 694290, win 65535, length 0
00:07:55.510786 IP 99.84.126.121.443 > 10.0.2.15.37834: Flags [P.], seq 694290:695664, ack 286, win 65535, length 1374
00:07:55.510788 IP 99.84.126.121.443 > 10.0.2.15.37834: Flags [P.], seq 695664:698412, ack 286, win 65535, length 2748
00:07:55.510801 IP 10.0.2.15.37834 > 99.84.126.121.443: Flags [.], ack 695664, win 65535, length 0
00:07:55.510827 IP 10.0.2.15.37834 > 99.84.126.121.443: Flags [.], ack 698412, win 65535, length 0
00:07:55.511020 IP 99.84.126.121.443 > 10.0.2.15.37834: Flags [P.], seq 698412:701160, ack 286, win 65535, length 2748
00:07:55.511029 IP 10.0.2.15.37834 > 99.84.126.121.443: Flags [.], ack 701160, win 65535, length 0
00:07:55.511180 IP 99.84.126.121.443 > 10.0.2.15.37834: Flags [P.], seq 701160:703908, ack 286, win 65535, length 2748
00:07:55.511186 IP 10.0.2.15.37834 > 99.84.126.121.443: Flags [.], ack 703908, win 65535, length 0
00:07:55.511571 IP 99.84.126.121.443 > 10.0.2.15.37834: Flags [P.], seq 703908:706656, ack 286, win 65535, length 2748
00:07:55.511584 IP 10.0.2.15.37834 > 99.84.126.121.443: Flags [.], ack 706656, win 65535, length 0
00:07:55.511871 IP 99.84.126.121.443 > 10.0.2.15.37834: Flags [P.], seq 706656:709404, ack 286, win 65535, length 2748
00:07:55.511926 IP 10.0.2.15.37834 > 99.84.126.121.443: Flags [.], ack 709404, win 65535, length 0
00:07:55.512160 IP 99.84.126.121.443 > 10.0.2.15.37834: Flags [P.], seq 709404:713526, ack 286, win 65535, length 4122
00:07:55.512372 IP 99.84.126.121.443 > 10.0.2.15.37834: Flags [P.], seq 713526:717648, ack 286, win 65535, length 4122
00:07:55.512418 IP 10.0.2.15.37834 > 99.84.126.121.443: Flags [.], ack 717648, win 65535, length 0
00:07:55.513541 IP 99.84.126.121.443 > 10.0.2.15.37834: Flags [P.], seq 717648:720396, ack 286, win 65535, length 2748

