00:07:57.596296 IP 99.84.126.86.443 > 10.0.2.15.40364: Flags [.], seq 54016002:54018922, ack 2861653509, win 65535, length 2920
00:07:57.596318 IP 10.0.2.15.40364 > 99.84.126.86.443: Flags [.], ack 2920, win 62780, length 0
00:07:57.596609 IP 99.84.126.86.443 > 10.0.2.15.40364: Flags [P.], seq 2920:4122, ack 1, win 65535, length 1202
00:07:57.596623 IP 10.0.2.15.40364 > 99.84.126.86.443: Flags [.], ack 4122, win 61578, length 0
00:07:57.598556 IP 99.84.126.86.443 > 10.0.2.15.40364: Flags [P.], seq 4122:5823, ack 1, win 65535, length 1701
00:07:57.598616 IP 10.0.2.15.40364 > 99.84.126.86.443: Flags [.], ack 5823, win 62780, length 0
00:07:57.600653 IP 10.0.2.15.40364 > 99.84.126.86.443: Flags [P.], seq 1:65, ack 5823, win 62780, length 64
00:07:57.601162 IP 99.84.126.86.443 > 10.0.2.15.40364: Flags [.], ack 65, win 65535, length 0
00:07:57.601295 IP 10.0.2.15.40364 > 99.84.126.86.443: Flags [P.], seq 65:111, ack 5823, win 62780, length 46
00:07:57.601336 IP 10.0.2.15.40364 > 99.84.126.86.443: Flags [P.], seq 111:160, ack 5823, win 62780, length 49
00:07:57.601614 IP 10.0.2.15.40364 > 99.84.126.86.443: Flags [P.], seq 160:195, ack 5823, win 62780, length 35
00:07:57.601744 IP 99.84.126.86.443 > 10.0.2.15.40364: Flags [.], ack 111, win 65535, length 0
00:07:57.601745 IP 99.84.126.86.443 > 10.0.2.15.40364: Flags [.], ack 160, win 65535, length 0
00:07:57.601944 IP 10.0.2.15.40364 > 99.84.126.86.443: Flags [P.], seq 195:255, ack 5823, win 62780, length 60
00:07:57.602098 IP 99.84.126.86.443 > 10.0.2.15.40364: Flags [.], ack 195, win 65535, length 0
00:07:57.602364 IP 99.84.126.86.443 > 10.0.2.15.40364: Flags [.], ack 255, win 65535, length 0
00:07:57.617943 IP 99.84.126.86.443 > 10.0.2.15.40364: Flags [P.], seq 5823:5894, ack 255, win 65535, length 71
00:07:57.617965 IP 10.0.2.15.40364 > 99.84.126.86.443: Flags [.], ack 5894, win 62780, length 0
00:07:57.618200 IP 10.0.2.15.40364 > 99.84.126.86.443: Flags [P.], seq 255:286, ack 5894, win 62780, length 31
00:07:57.618657 IP 99.84.126.86.443 > 10.0.2.15.40364: Flags [.], ack 286, win 65535, length 0
00:07:57.633211 IP 99.84.126.86.443 > 10.0.2.15.40364: Flags [P.], seq 5894:9915, ack 286, win 65535, length 4021
00:07:57.633214 IP 99.84.126.86.443 > 10.0.2.15.40364: Flags [.], seq 9915:14295, ack 286, win 65535, length 4380
00:07:57.633239 IP 10.0.2.15.40364 > 99.84.126.86.443: Flags [.], ack 9915, win 61320, length 0
00:07:57.633370 IP 10.0.2.15.40364 > 99.84.126.86.443: Flags [.], ack 14295, win 58400, length 0
00:07:57.633593 IP 99.84.126.86.443 > 10.0.2.15.40364: Flags [.], seq 14295:20135, ack 286, win 65535, length 5840
00:07:57.633620 IP 10.0.2.15.40364 > 99.84.126.86.443: Flags [.], ack 20135, win 52560, length 0
00:07:57.633943 IP 99.84.126.86.443 > 10.0.2.15.40364: Flags [P.], seq 20135:22913, ack 286, win 65535, length 2778
00:07:57.633962 IP 10.0.2.15.40364 > 99.84.126.86.443: Flags [.], ack 22913, win 49782, length 0
00:07:57.635730 IP 99.84.126.86.443 > 10.0.2.15.40364: Flags [P.], seq 22913:28409, ack 286, win 65535, length 5496
00:07:57.635751 IP 10.0.2.15.40364 > 99.84.126.86.443: Flags [.], ack 28409, win 61320, length 0
00:07:57.636117 IP 99.84.126.86.443 > 10.0.2.15.40364: Flags [P.], seq 28409:32531, ack 286, win 65535, length 4122
00:07:57.636132 IP 10.0.2.15.40364 > 99.84.126.86.443: Flags [.], ack 32531, win 58400, length 0
00:07:57.636526 IP 99.84.126.86.443 > 10.0.2.15.40364: Flags [P.], seq 32531:35279, ack 286, win 65535, length 2748
00:07:57.636528 IP 99.84.126.86.443 > 10.0.2.15.40364: Flags [P.], seq 35279:38027, ack 286, win 65535, length 2748
00:07:57.636803 IP 99.84.126.86.443 > 10.0.2.15.40364: Flags [P.], seq 38027:42149, ack 286, win 65535, length 4122
00:07:57.636858 IP 10.0.2.15.40364 > 99.84.126.86.443: Flags [.], ack 42149, win 51100, length 0
00:07:57.637127 IP 99.84.126.86.443 > 10.0.2.15.40364: Flags [P.], seq 42149:44897, ack 286, win 65535, length 2748
00:07:57.637204 IP 10.0.2.15.40364 > 99.84.126.86.443: Flags [.], ack 44897, win 49640, length 0
00:07:57.637561 IP 99.84.126.86.443 > 10.0.2.15.40364: Flags [P.], seq 44897:47645, ack 286, win 65535, length 2748
00:07:57.637575 IP 10.0.2.15.40364 > 99.84.126.86.443: Flags [.], ack 47645, win 62780, length 0
00:07:57.646745 IP 99.84.126.86.443 > 10.0.2.15.40364: Flags [P.], seq 47645:54515, ack 286, win 65535, length 6870
00:07:57.646979 IP 10.0.2.15.40364 > 99.84.126.86.443: Flags [.], ack 54515, win 59860, length 0
00:07:57.647271 IP 99.84.126.86.443 > 10.0.2.15.40364: Flags [P.], seq 54515:58637, ack 286, win 65535, length 4122
00:07:57.647283 IP 10.0.2.15.40364 > 99.84.126.86.443: Flags [.], ack 58637, win 61320, length 0
00:07:57.648270 IP 99.84.126.86.443 > 10.0.2.15.40364: Flags [P.], seq 58637:62759, ack 286, win 65535, length 4122
00:07:57.648284 IP 10.0.2.15.40364 > 99.84.126.86.443: Flags [.], ack 62759, win 61320, length 0
00:07:57.648709 IP 99.84.126.86.443 > 10.0.2.15.40364: Flags [P.], seq 62759:66881, ack 286, win 65535, length 4122
00:07:57.648712 IP 99.84.126.86.443 > 10.0.2.15.40364: Flags [P.], seq 66881:71003, ack 286, win 65535, length 4122
00:07:57.648728 IP 10.0.2.15.40364 > 99.84.126.86.443: Flags [.], ack 66881, win 61320, length 0
00:07:57.649032 IP 10.0.2.15.40364 > 99.84.126.86.443: Flags [.], ack 71003, win 62780, length 0
00:07:57.649130 IP 99.84.126.86.443 > 10.0.2.15.40364: Flags [P.], seq 71003:72377, ack 286, win 65535, length 1374
00:07:57.649146 IP 10.0.2.15.40364 > 99.84.126.86.443: Flags [.], ack 72377, win 65535, length 0
00:07:57.650211 IP 99.84.126.86.443 > 10.0.2.15.40364: Flags [P.], seq 72377:76499, ack 286, win 65535, length 4122
00:07:57.650233 IP 10.0.2.15.40364 > 99.84.126.86.443: Flags [.], ack 76499, win 65535, length 0
00:07:57.650496 IP 99.84.126.86.443 > 10.0.2.15.40364: Flags [P.], seq 76499:79247, ack 286, win 65535, length 2748
00:07:57.650508 IP 10.0.2.15.40364 > 99.84.126.86.443: Flags [.], ack 79247, win 65535, length 0
00:07:57.650761 IP 99.84.126.86.443 > 10.0.2.15.40364: Flags [P.], seq 79247:83369, ack 286, win 65535, length 4122
00:07:57.650774 IP 10.0.2.15.40364 > 99.84.126.86.443: Flags [.], ack 83369, win 65535, length 0
00:07:57.650989 IP 99.84.126.86.443 > 10.0.2.15.40364: Flags [P.], seq 83369:86117, ack 286, win 65535, length 2748
00:07:57.650997 IP 10.0.2.15.40364 > 99.84.126.86.443: Flags [.], ack 86117, win 65535, length 0
00:07:57.652668 IP 99.84.126.86.443 > 10.0.2.15.40364: Flags [P.], seq 86117:90239, ack 286, win 65535, length 4122
00:07:57.652692 IP 10.0.2.15.40364 > 99.84.126.86.443: Flags [.], ack 90239, win 65535, length 0
00:07:57.653100 IP 99.84.126.86.443 > 10.0.2.15.40364: Flags [P.], seq 90239:94361, ack 286, win 65535, length 4122
00:07:57.653103 IP 99.84.126.86.443 > 10.0.2.15.40364: Flags [P.], seq 94361:97109, ack 286, win 65535, length 2748
00:07:57.653121 IP 10.0.2.15.40364 > 99.84.126.86.443: Flags [.], ack 94361, win 65535, length 0
00:07:57.653141 IP 10.0.2.15.40364 > 99.84.126.86.443: Flags [.], ack 97109, win 65535, length 0
00:07:57.653447 IP 99.84.126.86.443 > 10.0.2.15.40364: Flags [P.], seq 97109:99857, ack 286, win 65535, length 2748
00:07:57.653459 IP 10.0.2.15.40364 > 99.84.126.86.443: Flags [.], ack 99857, win 65535, length 0
00:07:57.654045 IP 99.84.126.86.443 > 10.0.2.15.40364: Flags [P.], seq 99857:103979, ack 286, win 65535, length 4122
00:07:57.654063 IP 10.0.2.15.40364 > 99.84.126.86.443: Flags [.], ack 103979, win 65535, length 0
00:07:57.654199 IP 99.84.126.86.443 > 10.0.2.15.40364: Flags [P.], seq 103979:106727, ack 286, win 65535, length 2748
00:07:57.654207 IP 10.0.2.15.40364 > 99.84.126.86.443: Flags [.], ack 106727, win 65535, length 0
00:07:57.656395 IP 99.84.126.86.443 > 10.0.2.15.40364: Flags [P.], seq 106727:112223, ack 286, win 65535, length 5496
00:07:57.656400 IP 99.84.126.86.443 > 10.0.2.15.40364: Flags [P.], seq 112223:113597, ack 286, win 65535, length 1374
00:07:57.656401 IP 99.84.126.86.443 > 10.0.2.15.40364: Flags [P.], seq 113597:116345, ack 286, win 65535, length 2748
00:07:57.656428 IP 10.0.2.15.40364 > 99.84.126.86.443: Flags [.], ack 112223, win 65535, length 0
00:07:57.656628 IP 10.0.2.15.40364 > 99.84.126.86.443: Flags [.], ack 113597, win 65535, length 0
00:07:57.656732 IP 10.0.2.15.40364 > 99.84.126.86.443: Flags [.], ack 116345, win 65535, length 0
00:07:57.657556 IP 99.84.126.86.443 > 10.0.2.15.40364: Flags [P.], seq 116345:120467, ack 286, win 65535, length 4122
00:07:57.657558 IP 99.84.126.86.443 > 10.0.2.15.40364: Flags [P.], seq 120467:124589, ack 286, win 65535, length 4122
00:07:57.657575 IP 10.0.2.15.40364 > 99.84.126.86.443: Flags [.], ack 120467, win 65535, length 0
00:07:57.657597 IP 10.0.2.15.40364 > 99.84.126.86.443: Flags [.], ack 124589, win 65535, length 0
00:07:57.659319 IP 99.84.126.86.443 > 10.0.2.15.40364: Flags [P.], seq 124589:128711, ack 286, win 65535, length 4122
00:07:57.659436 IP 10.0.2.15.40364 > 99.84.126.86.443: Flags [.], ack 128711, win 65535, length 0
00:07:57.659648 IP 99.84.126.86.443 > 10.0.2.15.40364: Flags [P.], seq 128711:131459, ack 286, win 65535, length 2748
00:07:57.659657 IP 10.0.2.15.40364 > 99.84.126.86.443: Flags [.], ack 131459, win 65535, length 0
00:07:57.660841 IP 99.84.126.86.443 > 10.0.2.15.40364: Flags [P.], seq 131459:138329, ack 286, win 65535, length 6870
00:07:57.660980 IP 10.0.2.15.40364 > 99.84.126.86.443: Flags [.], ack 138329, win 65535, length 0
00:07:57.661931 IP 99.84.126.86.443 > 10.0.2.15.40364: Flags [P.], seq 138329:142451, ack 286, win 65535, length 4122
00:07:57.661934 IP 99.84.126.86.443 > 10.0.2.15.40364: Flags [P.], seq 142451:143825, ack 286, win 65535, length 1374
00:07:57.662203 IP 10.0.2.15.40364 > 99.84.126.86.443: Flags [.], ack 142451, win 65535, length 0
00:07:57.662274 IP 10.0.2.15.40364 > 99.84.126.86.443: Flags [.], ack 143825, win 65535, length 0
00:07:57.662499 IP 99.84.126.86.443 > 10.0.2.15.40364: Flags [P.], seq 143825:147947, ack 286, win 65535, length 4122
00:07:57.662501 IP 99.84.126.86.443 > 10.0.2.15.40364: Flags [P.], seq 147947:150695, ack 286, win 65535, length 2748
00:07:57.662502 IP 99.84.126.86.443 > 10.0.2.15.40364: Flags [P.], seq 150695:152069, ack 286, win 65535, length 1374
00:07:57.662518 IP 10.0.2.15.40364 > 99.84.126.86.443: Flags [.], ack 147947, win 65535, length 0
00:07:57.662537 IP 10.0.2.15.40364 > 99.84.126.86.443: Flags [.], ack 150695, win 65535, length 0
00:07:57.662548 IP 10.0.2.15.40364 > 99.84.126.86.443: Flags [.], ack 152069, win 65535, length 0
00:07:57.664012 IP 99.84.126.86.443 > 10.0.2.15.40364: Flags [P.], seq 152069:154817, ack 286, win 65535, length 2748
00:07:57.664015 IP 99.84.126.86.443 > 10.0.2.15.40364: Flags [P.], seq 154817:158939, ack 286, win 65535, length 4122
00:07:57.664077 IP 10.0.2.15.40364 > 99.84.126.86.443: Flags [.], ack 154817, win 65535, length 0
00:07:57.664237 IP 10.0.2.15.40364 > 99.84.126.86.443: Flags [.], ack 158939, win 65535, length 0
00:07:57.664470 IP 99.84.126.86.443 > 10.0.2.15.40364: Flags [P.], seq 158939:160313, ack 286, win 65535, length 1374
00:07:57.664475 IP 99.84.126.86.443 > 10.0.2.15.40364: Flags [P.], seq 160313:163061, ack 286, win 65535, length 2748
00:07:57.664493 IP 10.0.2.15.40364 > 99.84.126.86.443: Flags [.], ack 160313, win 65535, length 0
00:07:57.664584 IP 10.0.2.15.40364 > 99.84.126.86.443: Flags [.], ack 163061, win 65535, length 0
00:07:57.664856 IP 99.84.126.86.443 > 10.0.2.15.40364: Flags [P.], seq 163061:165809, ack 286, win 65535, length 2748
00:07:57.664858 IP 99.84.126.86.443 > 10.0.2.15.40364: Flags [P.], seq 165809:168557, ack 286, win 65535, length 2748
00:07:57.664947 IP 10.0.2.15.40364 > 99.84.126.86.443: Flags [.], ack 165809, win 65535, length 0
00:07:57.664965 IP 10.0.2.15.40364 > 99.84.126.86.443: Flags [.], ack 168557, win 65535, length 0
00:07:57.665174 IP 99.84.126.86.443 > 10.0.2.15.40364: Flags [P.], seq 168557:172679, ack 286, win 65535, length 4122
00:07:57.665184 IP 10.0.2.15.40364 > 99.84.126.86.443: Flags [.], ack 172679, win 65535, length 0
00:07:57.665589 IP 99.84.126.86.443 > 10.0.2.15.40364: Flags [P.], seq 172679:175427, ack 286, win 65535, length 2748
00:07:57.665604 IP 10.0.2.15.40364 > 99.84.126.86.443: Flags [.], ack 175427, win 65535, length 0
00:07:57.666247 IP 99.84.126.86.443 > 10.0.2.15.40364: Flags [P.], seq 175427:179549, ack 286, win 65535, length 4122
00:07:57.666363 IP 10.0.2.15.40364 > 99.84.126.86.443: Flags [.], ack 179549, win 65535, length 0
00:07:57.666663 IP 99.84.126.86.443 > 10.0.2.15.40364: Flags [P.], seq 179549:183671, ack 286, win 65535, length 4122
00:07:57.666679 IP 10.0.2.15.40364 > 99.84.126.86.443: Flags [.], ack 183671, win 65535, length 0
00:07:57.667235 IP 99.84.126.86.443 > 10.0.2.15.40364: Flags [P.], seq 183671:186419, ack 286, win 65535, length 2748
00:07:57.667238 IP 99.84.126.86.443 > 10.0.2.15.40364: Flags [P.], seq 186419:190541, ack 286, win 65535, length 4122
00:07:57.667253 IP 10.0.2.15.40364 > 99.84.126.86.443: Flags [.], ack 186419, win 65535, length 0
00:07:57.667277 IP 10.0.2.15.40364 > 99.84.126.86.443: Flags [.], ack 190541, win 65535, length 0
00:07:57.667443 IP 99.84.126.86.443 > 10.0.2.15.40364: Flags [P.], seq 190541:191915, ack 286, win 65535, length 1374
00:07:57.667444 IP 99.84.126.86.443 > 10.0.2.15.40364: Flags [P.], seq 191915:193289, ack 286, win 65535, length 1374
00:07:57.667453 IP 10.0.2.15.40364 > 99.84.126.86.443: Flags [.], ack 191915, win 65535, length 0
00:07:57.667555 IP 10.0.2.15.40364 > 99.84.126.86.443: Flags [.], ack 193289, win 65535, length 0
00:07:57.668459 IP 99.84.126.86.443 > 10.0.2.15.40364: Flags [P.], seq 193289:197411, ack 286, win 65535, length 4122
00:07:57.668509 IP 99.84.126.86.443 > 10.0.2.15.40364: Flags [P.], seq 197411:200159, ack 286, win 65535, length 2748
00:07:57.668637 IP 10.0.2.15.40364 > 99.84.126.86.443: Flags [.], ack 197411, win 65535, length 0
00:07:57.668679 IP 10.0.2.15.40364 > 99.84.126.86.443: Flags [.], ack 200159, win 65535, length 0
00:07:57.669251 IP 99.84.126.86.443 > 10.0.2.15.40364: Flags [P.], seq 200159:202907, ack 286, win 65535, length 2748
00:07:57.669254 IP 99.84.126.86.443 > 10.0.2.15.40364: Flags [P.], seq 202907:205655, ack 286, win 65535, length 2748
00:07:57.669254 IP 99.84.126.86.443 > 10.0.2.15.40364: Flags [.], seq 205655:207115, ack 286, win 65535, length 1460
00:07:57.669325 IP 10.0.2.15.40364 > 99.84.126.86.443: Flags [.], ack 202907, win 65535, length 0
00:07:57.669349 IP 10.0.2.15.40364 > 99.84.126.86.443: Flags [.], ack 205655, win 65535, length 0
00:07:57.669489 IP 10.0.2.15.40364 > 99.84.126.86.443: Flags [.], ack 207115, win 65535, length 0
00:07:57.669724 IP 99.84.126.86.443 > 10.0.2.15.40364: Flags [P.], seq 207115:208403, ack 286, win 65535, length 1288
00:07:57.669727 IP 99.84.126.86.443 > 10.0.2.15.40364: Flags [P.], seq 208403:211151, ack 286, win 65535, length 2748
00:07:57.669728 IP 99.84.126.86.443 > 10.0.2.15.40364: Flags [P.], seq 211151:213899, ack 286, win 65535, length 2748
00:07:57.669741 IP 10.0.2.15.40364 > 99.84.126.86.443: Flags [.], ack 208403, win 65535, length 0
00:07:57.669758 IP 10.0.2.15.40364 > 99.84.126.86.443: Flags [.], ack 211151, win 65535, length 0
00:07:57.669771 IP 10.0.2.15.40364 > 99.84.126.86.443: Flags [.], ack 213899, win 65535, length 0
00:07:57.670184 IP 99.84.126.86.443 > 10.0.2.15.40364: Flags [P.], seq 213899:216647, ack 286, win 65535, length 2748
00:07:57.670217 IP 10.0.2.15.40364 > 99.84.126.86.443: Flags [.], ack 216647, win 65535, length 0
00:07:57.670866 IP 99.84.126.86.443 > 10.0.2.15.40364: Flags [P.], seq 216647:220769, ack 286, win 65535, length 4122
00:07:57.670869 IP 99.84.126.86.443 > 10.0.2.15.40364: Flags [P.], seq 220769:223517, ack 286, win 65535, length 2748
00:07:57.670926 IP 10.0.2.15.40364 > 99.84.126.86.443: Flags [.], ack 220769, win 65535, length 0
00:07:57.670982 IP 10.0.2.15.40364 > 99.84.126.86.443: Flags [.], ack 223517, win 65535, length 0
00:07:57.671287 IP 99.84.126.86.443 > 10.0.2.15.40364: Flags [P.], seq 223517:227639, ack 286, win 65535, length 4122
00:07:57.671298 IP 10.0.2.15.40364 > 99.84.126.86.443: Flags [.], ack 227639, win 65535, length 0
00:07:57.671443 IP 99.84.126.86.443 > 10.0.2.15.40364: Flags [P.], seq 227639:230387, ack 286, win 65535, length 2748
00:07:57.671503 IP 10.0.2.15.40364 > 99.84.126.86.443: Flags [.], ack 230387, win 65535, length 0
00:07:57.671994 IP 99.84.126.86.443 > 10.0.2.15.40364: Flags [P.], seq 230387:233135, ack 286, win 65535, length 2748
00:07:57.671996 IP 99.84.126.86.443 > 10.0.2.15.40364: Flags [P.], seq 233135:235883, ack 286, win 65535, length 2748
00:07:57.672027 IP 10.0.2.15.40364 > 99.84.126.86.443: Flags [.], ack 235883, win 65535, length 0
00:07:57.672120 IP 99.84.126.86.443 > 10.0.2.15.40364: Flags [P.], seq 235883:237257, ack 286, win 65535, length 1374
00:07:57.672140 IP 10.0.2.15.40364 > 99.84.126.86.443: Flags [.], ack 237257, win 65535, length 0
00:07:57.673051 IP 99.84.126.86.443 > 10.0.2.15.40364: Flags [P.], seq 237257:241379, ack 286, win 65535, length 4122
00:07:57.673075 IP 10.0.2.15.40364 > 99.84.126.86.443: Flags [.], ack 241379, win 65535, length 0
00:07:57.673258 IP 99.84.126.86.443 > 10.0.2.15.40364: Flags [P.], seq 241379:245501, ack 286, win 65535, length 4122
00:07:57.673273 IP 10.0.2.15.40364 > 99.84.126.86.443: Flags [.], ack 245501, win 65535, length 0
00:07:57.673793 IP 99.84.126.86.443 > 10.0.2.15.40364: Flags [P.], seq 245501:249623, ack 286, win 65535, length 4122
00:07:57.673814 IP 10.0.2.15.40364 > 99.84.126.86.443: Flags [.], ack 249623, win 65535, length 0
00:07:57.674852 IP 99.84.126.86.443 > 10.0.2.15.40364: Flags [P.], seq 249623:253745, ack 286, win 65535, length 4122
00:07:57.674855 IP 99.84.126.86.443 > 10.0.2.15.40364: Flags [P.], seq 253745:259241, ack 286, win 65535, length 5496
00:07:57.674856 IP 99.84.126.86.443 > 10.0.2.15.40364: Flags [P.], seq 259241:260615, ack 286, win 65535, length 1374
00:07:57.674879 IP 10.0.2.15.40364 > 99.84.126.86.443: Flags [.], ack 253745, win 65535, length 0
00:07:57.674902 IP 10.0.2.15.40364 > 99.84.126.86.443: Flags [.], ack 259241, win 65535, length 0
00:07:57.674912 IP 10.0.2.15.40364 > 99.84.126.86.443: Flags [.], ack 260615, win 65535, length 0
00:07:57.675525 IP 99.84.126.86.443 > 10.0.2.15.40364: Flags [P.], seq 260615:264737, ack 286, win 65535, length 4122
00:07:57.675587 IP 10.0.2.15.40364 > 99.84.126.86.443: Flags [.], ack 264737, win 65535, length 0
00:07:57.675896 IP 99.84.126.86.443 > 10.0.2.15.40364: Flags [P.], seq 264737:270233, ack 286, win 65535, length 5496
00:07:57.675898 IP 99.84.126.86.443 > 10.0.2.15.40364: Flags [P.], seq 270233:272981, ack 286, win 65535, length 2748
00:07:57.675914 IP 10.0.2.15.40364 > 99.84.126.86.443: Flags [.], ack 270233, win 65535, length 0
00:07:57.675930 IP 10.0.2.15.40364 > 99.84.126.86.443: Flags [.], ack 272981, win 65535, length 0
00:07:57.676639 IP 99.84.126.86.443 > 10.0.2.15.40364: Flags [P.], seq 272981:277103, ack 286, win 65535, length 4122
00:07:57.676642 IP 99.84.126.86.443 > 10.0.2.15.40364: Flags [P.], seq 277103:279851, ack 286, win 65535, length 2748
00:07:57.676662 IP 10.0.2.15.40364 > 99.84.126.86.443: Flags [.], ack 277103, win 65535, length 0
00:07:57.676683 IP 10.0.2.15.40364 > 99.84.126.86.443: Flags [.], ack 279851, win 65535, length 0
00:07:57.677546 IP 99.84.126.86.443 > 10.0.2.15.40364: Flags [P.], seq 279851:283973, ack 286, win 65535, length 4122
00:07:57.677566 IP 10.0.2.15.40364 > 99.84.126.86.443: Flags [.], ack 283973, win 65535, length 0
00:07:57.677957 IP 99.84.126.86.443 > 10.0.2.15.40364: Flags [P.], seq 283973:289469, ack 286, win 65535, length 5496
00:07:57.677974 IP 10.0.2.15.40364 > 99.84.126.86.443: Flags [.], ack 289469, win 65535, length 0
00:07:57.678091 IP 99.84.126.86.443 > 10.0.2.15.40364: Flags [P.], seq 289469:292217, ack 286, win 65535, length 2748
00:07:57.678102 IP 10.0.2.15.40364 > 99.84.126.86.443: Flags [.], ack 292217, win 65535, length 0
00:07:57.678637 IP 99.84.126.86.443 > 10.0.2.15.40364: Flags [P.], seq 292217:296339, ack 286, win 65535, length 4122
00:07:57.678685 IP 10.0.2.15.40364 > 99.84.126.86.443: Flags [.], ack 296339, win 65535, length 0
00:07:57.678918 IP 99.84.126.86.443 > 10.0.2.15.40364: Flags [P.], seq 296339:299087, ack 286, win 65535, length 2748
00:07:57.678920 IP 99.84.126.86.443 > 10.0.2.15.40364: Flags [P.], seq 299087:301835, ack 286, win 65535, length 2748
00:07:57.678936 IP 10.0.2.15.40364 > 99.84.126.86.443: Flags [.], ack 299087, win 65535, length 0
00:07:57.678953 IP 10.0.2.15.40364 > 99.84.126.86.443: Flags [.], ack 301835, win 65535, length 0
00:07:57.679142 IP 99.84.126.86.443 > 10.0.2.15.40364: Flags [P.], seq 301835:303209, ack 286, win 65535, length 1374
00:07:57.679150 IP 10.0.2.15.40364 > 99.84.126.86.443: Flags [.], ack 303209, win 65535, length 0
00:07:57.679363 IP 99.84.126.86.443 > 10.0.2.15.40364: Flags [P.], seq 303209:307331, ack 286, win 65535, length 4122
00:07:57.679375 IP 10.0.2.15.40364 > 99.84.126.86.443: Flags [.], ack 307331, win 65535, length 0
00:07:57.680272 IP 99.84.126.86.443 > 10.0.2.15.40364: Flags [P.], seq 307331:311453, ack 286, win 65535, length 4122
00:07:57.680297 IP 10.0.2.15.40364 > 99.84.126.86.443: Flags [.], ack 311453, win 65535, length 0
00:07:57.681019 IP 99.84.126.86.443 > 10.0.2.15.40364: Flags [P.], seq 311453:315575, ack 286, win 65535, length 4122
00:07:57.681021 IP 99.84.126.86.443 > 10.0.2.15.40364: Flags [P.], seq 315575:318323, ack 286, win 65535, length 2748
00:07:57.681044 IP 10.0.2.15.40364 > 99.84.126.86.443: Flags [.], ack 315575, win 65535, length 0
00:07:57.681132 IP 10.0.2.15.40364 > 99.84.126.86.443: Flags [.], ack 318323, win 65535, length 0
00:07:57.681330 IP 99.84.126.86.443 > 10.0.2.15.40364: Flags [P.], seq 318323:322445, ack 286, win 65535, length 4122
00:07:57.681347 IP 10.0.2.15.40364 > 99.84.126.86.443: Flags [.], ack 322445, win 65535, length 0
00:07:57.681473 IP 99.84.126.86.443 > 10.0.2.15.40364: Flags [P.], seq 322445:326567, ack 286, win 65535, length 4122
00:07:57.681481 IP 10.0.2.15.40364 > 99.84.126.86.443: Flags [.], ack 326567, win 65535, length 0
00:07:57.682008 IP 99.84.126.86.443 > 10.0.2.15.40364: Flags [.], seq 326567:328027, ack 286, win 65535, length 1460
00:07:57.682029 IP 10.0.2.15.40364 > 99.84.126.86.443: Flags [.], ack 328027, win 65535, length 0
00:07:57.682188 IP 99.84.126.86.443 > 10.0.2.15.40364: Flags [P.], seq 328027:330689, ack 286, win 65535, length 2662
00:07:57.682198 IP 10.0.2.15.40364 > 99.84.126.86.443: Flags [.], ack 330689, win 65535, length 0
00:07:57.682927 IP 99.84.126.86.443 > 10.0.2.15.40364: Flags [P.], seq 330689:334811, ack 286, win 65535, length 4122
00:07:57.682949 IP 10.0.2.15.40364 > 99.84.126.86.443: Flags [.], ack 334811, win 65535, length 0
00:07:57.683448 IP 99.84.126.86.443 > 10.0.2.15.40364: Flags [P.], seq 334811:337559, ack 286, win 65535, length 2748
00:07:57.683451 IP 99.84.126.86.443 > 10.0.2.15.40364: Flags [P.], seq 337559:340307, ack 286, win 65535, length 2748
00:07:57.683509 IP 10.0.2.15.40364 > 99.84.126.86.443: Flags [.], ack 337559, win 65535, length 0
00:07:57.683622 IP 10.0.2.15.40364 > 99.84.126.86.443: Flags [.], ack 340307, win 65535, length 0
00:07:57.683967 IP 99.84.126.86.443 > 10.0.2.15.40364: Flags [P.], seq 340307:344429, ack 286, win 65535, length 4122
00:07:57.683969 IP 99.84.126.86.443 > 10.0.2.15.40364: Flags [P.], seq 344429:345803, ack 286, win 65535, length 1374
00:07:57.683970 IP 99.84.126.86.443 > 10.0.2.15.40364: Flags [P.], seq 345803:348551, ack 286, win 65535, length 2748
00:07:57.683986 IP 10.0.2.15.40364 > 99.84.126.86.443: Flags [.], ack 344429, win 65535, length 0
00:07:57.684062 IP 10.0.2.15.40364 > 99.84.126.86.443: Flags [.], ack 345803, win 65535, length 0
00:07:57.684073 IP 10.0.2.15.40364 > 99.84.126.86.443: Flags [.], ack 348551, win 65535, length 0
00:07:57.684373 IP 99.84.126.86.443 > 10.0.2.15.40364: Flags [P.], seq 348551:351299, ack 286, win 65535, length 2748
00:07:57.684375 IP 99.84.126.86.443 > 10.0.2.15.40364: Flags [P.], seq 351299:354047, ack 286, win 65535, length 2748
00:07:57.684392 IP 10.0.2.15.40364 > 99.84.126.86.443: Flags [.], ack 351299, win 65535, length 0
00:07:57.684510 IP 10.0.2.15.40364 > 99.84.126.86.443: Flags [.], ack 354047, win 65535, length 0
00:07:57.685458 IP 99.84.126.86.443 > 10.0.2.15.40364: Flags [P.], seq 354047:358169, ack 286, win 65535, length 4122
00:07:57.685461 IP 99.84.126.86.443 > 10.0.2.15.40364: Flags [P.], seq 358169:360917, ack 286, win 65535, length 2748
00:07:57.685675 IP 99.84.126.86.443 > 10.0.2.15.40364: Flags [P.], seq 360917:363665, ack 286, win 65535, length 2748
00:07:57.685843 IP 99.84.126.86.443 > 10.0.2.15.40364: Flags [P.], seq 363665:366413, ack 286, win 65535, length 2748
00:07:57.686046 IP 99.84.126.86.443 > 10.0.2.15.40364: Flags [P.], seq 366413:367787, ack 286, win 65535, length 1374
00:07:57.686135 IP 10.0.2.15.40364 > 99.84.126.86.443: Flags [.], ack 367787, win 65535, length 0
00:07:57.686525 IP 99.84.126.86.443 > 10.0.2.15.40364: Flags [P.], seq 367787:370535, ack 286, win 65535, length 2748
00:07:57.686528 IP 99.84.126.86.443 > 10.0.2.15.40364: Flags [P.], seq 370535:374657, ack 286, win 65535, length 4122
00:07:57.686547 IP 10.0.2.15.40364 > 99.84.126.86.443: Flags [.], ack 370535, win 65535, length 0
00:07:57.686665 IP 10.0.2.15.40364 > 99.84.126.86.443: Flags [.], ack 374657, win 65535, length 0
00:07:57.686757 IP 99.84.126.86.443 > 10.0.2.15.40364: Flags [P.], seq 374657:377405, ack 286, win 65535, length 2748
00:07:57.686765 IP 10.0.2.15.40364 > 99.84.126.86.443: Flags [.], ack 377405, win 65535, length 0
00:07:57.687901 IP 99.84.126.86.443 > 10.0.2.15.40364: Flags [P.], seq 377405:381527, ack 286, win 65535, length 4122
00:07:57.687906 IP 99.84.126.86.443 > 10.0.2.15.40364: Flags [P.], seq 381527:384275, ack 286, win 65535, length 2748
00:07:57.687968 IP 10.0.2.15.40364 > 99.84.126.86.443: Flags [.], ack 381527, win 65535, length 0
00:07:57.688085 IP 10.0.2.15.40364 > 99.84.126.86.443: Flags [.], ack 384275, win 65535, length 0
00:07:57.688638 IP 99.84.126.86.443 > 10.0.2.15.40364: Flags [P.], seq 384275:391145, ack 286, win 65535, length 6870
00:07:57.688658 IP 10.0.2.15.40364 > 99.84.126.86.443: Flags [.], ack 391145, win 65535, length 0
00:07:57.689383 IP 99.84.126.86.443 > 10.0.2.15.40364: Flags [P.], seq 391145:395267, ack 286, win 65535, length 4122
00:07:57.689385 IP 99.84.126.86.443 > 10.0.2.15.40364: Flags [P.], seq 395267:398015, ack 286, win 65535, length 2748
00:07:57.689386 IP 99.84.126.86.443 > 10.0.2.15.40364: Flags [P.], seq 398015:399389, ack 286, win 65535, length 1374
00:07:57.689570 IP 10.0.2.15.40364 > 99.84.126.86.443: Flags [.], ack 395267, win 65535, length 0
00:07:57.689594 IP 10.0.2.15.40364 > 99.84.126.86.443: Flags [.], ack 398015, win 65535, length 0
00:07:57.689682 IP 10.0.2.15.40364 > 99.84.126.86.443: Flags [.], ack 399389, win 65535, length 0
00:07:57.690550 IP 99.84.126.86.443 > 10.0.2.15.40364: Flags [P.], seq 399389:402137, ack 286, win 65535, length 2748
00:07:57.690555 IP 99.84.126.86.443 > 10.0.2.15.40364: Flags [P.], seq 402137:404885, ack 286, win 65535, length 2748
00:07:57.690556 IP 99.84.126.86.443 > 10.0.2.15.40364: Flags [P.], seq 404885:406259, ack 286, win 65535, length 1374
00:07:57.690557 IP 99.84.126.86.443 > 10.0.2.15.40364: Flags [P.], seq 406259:409007, ack 286, win 65535, length 2748
00:07:57.690595 IP 10.0.2.15.40364 > 99.84.126.86.443: Flags [.], ack 402137, win 65535, length 0
00:07:57.690631 IP 10.0.2.15.40364 > 99.84.126.86.443: Flags [.], ack 404885, win 65535, length 0
00:07:57.690649 IP 10.0.2.15.40364 > 99.84.126.86.443: Flags [.], ack 406259, win 65535, length 0
00:07:57.690660 IP 10.0.2.15.40364 > 99.84.126.86.443: Flags [.], ack 409007, win 65535, length 0
00:07:57.691385 IP 99.84.126.86.443 > 10.0.2.15.40364: Flags [P.], seq 409007:414503, ack 286, win 65535, length 5496
00:07:57.691510 IP 10.0.2.15.40364 > 99.84.126.86.443: Flags [.], ack 414503, win 65535, length 0
00:07:57.691835 IP 99.84.126.86.443 > 10.0.2.15.40364: Flags [P.], seq 414503:424121, ack 286, win 65535, length 9618
00:07:57.691853 IP 10.0.2.15.40364 > 99.84.126.86.443: Flags [.], ack 424121, win 65535, length 0
00:07:57.696383 IP 99.84.126.86.443 > 10.0.2.15.40364: Flags [P.], seq 424121:443357, ack 286, win 65535, length 19236
00:07:57.696405 IP 10.0.2.15.40364 > 99.84.126.86.443: Flags [.], ack 443357, win 65535, length 0
00:07:57.696645 IP 99.84.126.86.443 > 10.0.2.15.40364: Flags [P.], seq 443357:451601, ack 286, win 65535, length 8244
00:07:57.696647 IP 99.84.126.86.443 > 10.0.2.15.40364: Flags [P.], seq 451601:454349, ack 286, win 65535, length 2748
00:07:57.696664 IP 10.0.2.15.40364 > 99.84.126.86.443: Flags [.], ack 451601, win 65535, length 0
00:07:57.696996 IP 10.0.2.15.40364 > 99.84.126.86.443: Flags [.], ack 454349, win 65535, length 0
00:07:57.697073 IP 99.84.126.86.443 > 10.0.2.15.40364: Flags [P.], seq 454349:457097, ack 286, win 65535, length 2748
00:07:57.697078 IP 99.84.126.86.443 > 10.0.2.15.40364: Flags [P.], seq 457097:461219, ack 286, win 65535, length 4122
00:07:57.697117 IP 10.0.2.15.40364 > 99.84.126.86.443: Flags [.], ack 457097, win 65535, length 0
00:07:57.697147 IP 10.0.2.15.40364 > 99.84.126.86.443: Flags [.], ack 461219, win 65535, length 0
00:07:57.697724 IP 99.84.126.86.443 > 10.0.2.15.40364: Flags [P.], seq 461219:468089, ack 286, win 65535, length 6870
00:07:57.697752 IP 10.0.2.15.40364 > 99.84.126.86.443: Flags [.], ack 468089, win 65535, length 0
00:07:57.698247 IP 99.84.126.86.443 > 10.0.2.15.40364: Flags [P.], seq 468089:470837, ack 286, win 65535, length 2748
00:07:57.698679 IP 10.0.2.15.40364 > 99.84.126.86.443: Flags [.], ack 470837, win 65535, length 0
00:07:57.699717 IP 99.84.126.86.443 > 10.0.2.15.40364: Flags [P.], seq 470837:474959, ack 286, win 65535, length 4122
00:07:57.699721 IP 99.84.126.86.443 > 10.0.2.15.40364: Flags [P.], seq 474959:479081, ack 286, win 65535, length 4122
00:07:57.699732 IP 99.84.126.86.443 > 10.0.2.15.40364: Flags [P.], seq 479081:484577, ack 286, win 65535, length 5496
00:07:57.699760 IP 10.0.2.15.40364 > 99.84.126.86.443: Flags [.], ack 474959, win 65535, length 0
00:07:57.699879 IP 10.0.2.15.40364 > 99.84.126.86.443: Flags [.], ack 479081, win 65535, length 0
00:07:57.699899 IP 10.0.2.15.40364 > 99.84.126.86.443: Flags [.], ack 484577, win 65535, length 0
00:07:57.700781 IP 99.84.126.86.443 > 10.0.2.15.40364: Flags [P.], seq 484577:501065, ack 286, win 65535, length 16488
00:07:57.700836 IP 10.0.2.15.40364 > 99.84.126.86.443: Flags [.], ack 501065, win 65535, length 0
00:07:57.701671 IP 99.84.126.86.443 > 10.0.2.15.40364: Flags [P.], seq 501065:507935, ack 286, win 65535, length 6870
00:07:57.701695 IP 10.0.2.15.40364 > 99.84.126.86.443: Flags [.], ack 507935, win 65535, length 0
00:07:57.701860 IP 99.84.126.86.443 > 10.0.2.15.40364: Flags [P.], seq 507935:510683, ack 286, win 65535, length 2748
00:07:57.701863 IP 99.84.126.86.443 > 10.0.2.15.40364: Flags [P.], seq 510683:514805, ack 286, win 65535, length 4122
00:07:57.701863 IP 99.84.126.86.443 > 10.0.2.15.40364: Flags [P.], seq 514805:516179, ack 286, win 65535, length 1374
00:07:57.701863 IP 99.84.126.86.443 > 10.0.2.15.40364: Flags [P.], seq 516179:517553, ack 286, win 65535, length 1374
00:07:57.701877 IP 10.0.2.15.40364 > 99.84.126.86.443: Flags [.], ack 510683, win 65535, length 0
00:07:57.701894 IP 10.0.2.15.40364 > 99.84.126.86.443: Flags [.], ack 514805, win 65535, length 0
00:07:57.701903 IP 10.0.2.15.40364 > 99.84.126.86.443: Flags [.], ack 516179, win 65535, length 0
00:07:57.701910 IP 10.0.2.15.40364 > 99.84.126.86.443: Flags [.], ack 517553, win 65535, length 0
00:07:57.702557 IP 99.84.126.86.443 > 10.0.2.15.40364: Flags [P.], seq 517553:521675, ack 286, win 65535, length 4122
00:07:57.702573 IP 10.0.2.15.40364 > 99.84.126.86.443: Flags [.], ack 521675, win 65535, length 0
00:07:57.703049 IP 99.84.126.86.443 > 10.0.2.15.40364: Flags [P.], seq 521675:524423, ack 286, win 65535, length 2748
00:07:57.703059 IP 10.0.2.15.40364 > 99.84.126.86.443: Flags [.], ack 524423, win 65535, length 0
00:07:57.703178 IP 99.84.126.86.443 > 10.0.2.15.40364: Flags [P.], seq 524423:527171, ack 286, win 65535, length 2748
00:07:57.703180 IP 99.84.126.86.443 > 10.0.2.15.40364: Flags [P.], seq 527171:529919, ack 286, win 65535, length 2748
00:07:57.703189 IP 10.0.2.15.40364 > 99.84.126.86.443: Flags [.], ack 527171, win 65535, length 0
00:07:57.703234 IP 10.0.2.15.40364 > 99.84.126.86.443: Flags [.], ack 529919, win 65535, length 0
00:07:57.703393 IP 99.84.126.86.443 > 10.0.2.15.40364: Flags [P.], seq 529919:532667, ack 286, win 65535, length 2748
00:07:57.703400 IP 10.0.2.15.40364 > 99.84.126.86.443: Flags [.], ack 532667, win 65535, length 0
00:07:57.703518 IP 99.84.126.86.443 > 10.0.2.15.40364: Flags [P.], seq 532667:534041, ack 286, win 65535, length 1374
00:07:57.703525 IP 10.0.2.15.40364 > 99.84.126.86.443: Flags [.], ack 534041, win 65535, length 0
00:07:57.703641 IP 99.84.126.86.443 > 10.0.2.15.40364: Flags [P.], seq 534041:535415, ack 286, win 65535, length 1374
00:07:57.703649 IP 10.0.2.15.40364 > 99.84.126.86.443: Flags [.], ack 535415, win 65535, length 0
00:07:57.703896 IP 99.84.126.86.443 > 10.0.2.15.40364: Flags [P.], seq 535415:538163, ack 286, win 65535, length 2748
00:07:57.703905 IP 10.0.2.15.40364 > 99.84.126.86.443: Flags [.], ack 538163, win 65535, length 0
00:07:57.704246 IP 99.84.126.86.443 > 10.0.2.15.40364: Flags [P.], seq 538163:539537, ack 286, win 65535, length 1374
00:07:57.704249 IP 99.84.126.86.443 > 10.0.2.15.40364: Flags [P.], seq 539537:542285, ack 286, win 65535, length 2748
00:07:57.704264 IP 10.0.2.15.40364 > 99.84.126.86.443: Flags [.], ack 539537, win 65535, length 0
00:07:57.704348 IP 10.0.2.15.40364 > 99.84.126.86.443: Flags [.], ack 542285, win 65535, length 0
00:07:57.704601 IP 99.84.126.86.443 > 10.0.2.15.40364: Flags [P.], seq 542285:546407, ack 286, win 65535, length 4122
00:07:57.704610 IP 10.0.2.15.40364 > 99.84.126.86.443: Flags [.], ack 546407, win 65535, length 0
00:07:57.704767 IP 99.84.126.86.443 > 10.0.2.15.40364: Flags [P.], seq 546407:549155, ack 286, win 65535, length 2748
00:07:57.704773 IP 10.0.2.15.40364 > 99.84.126.86.443: Flags [.], ack 549155, win 65535, length 0
00:07:57.704888 IP 99.84.126.86.443 > 10.0.2.15.40364: Flags [P.], seq 549155:550529, ack 286, win 65535, length 1374
00:07:57.704894 IP 10.0.2.15.40364 > 99.84.126.86.443: Flags [.], ack 550529, win 65535, length 0
00:07:57.705303 IP 99.84.126.86.443 > 10.0.2.15.40364: Flags [.], seq 550529:551989, ack 286, win 65535, length 1460
00:07:57.705444 IP 10.0.2.15.40364 > 99.84.126.86.443: Flags [.], ack 551989, win 65535, length 0
00:07:57.705591 IP 99.84.126.86.443 > 10.0.2.15.40364: Flags [P.], seq 551989:554651, ack 286, win 65535, length 2662
00:07:57.705647 IP 99.84.126.86.443 > 10.0.2.15.40364: Flags [P.], seq 554651:557399, ack 286, win 65535, length 2748
00:07:57.705648 IP 99.84.126.86.443 > 10.0.2.15.40364: Flags [P.], seq 557399:560147, ack 286, win 65535, length 2748
00:07:57.705661 IP 10.0.2.15.40364 > 99.84.126.86.443: Flags [.], ack 554651, win 65535, length 0
00:07:57.705689 IP 10.0.2.15.40364 > 99.84.126.86.443: Flags [.], ack 557399, win 65535, length 0
00:07:57.705699 IP 10.0.2.15.40364 > 99.84.126.86.443: Flags [.], ack 560147, win 65535, length 0
00:07:57.706237 IP 99.84.126.86.443 > 10.0.2.15.40364: Flags [P.], seq 560147:561521, ack 286, win 65535, length 1374
00:07:57.706240 IP 99.84.126.86.443 > 10.0.2.15.40364: Flags [P.], seq 561521:564269, ack 286, win 65535, length 2748
00:07:57.706257 IP 10.0.2.15.40364 > 99.84.126.86.443: Flags [.], ack 561521, win 65535, length 0
00:07:57.706272 IP 10.0.2.15.40364 > 99.84.126.86.443: Flags [.], ack 564269, win 65535, length 0
00:07:57.707007 IP 99.84.126.86.443 > 10.0.2.15.40364: Flags [P.], seq 564269:568391, ack 286, win 65535, length 4122
00:07:57.707011 IP 99.84.126.86.443 > 10.0.2.15.40364: Flags [P.], seq 568391:572513, ack 286, win 65535, length 4122
00:07:57.707028 IP 10.0.2.15.40364 > 99.84.126.86.443: Flags [.], ack 568391, win 65535, length 0
00:07:57.707050 IP 10.0.2.15.40364 > 99.84.126.86.443: Flags [.], ack 572513, win 65535, length 0
00:07:57.707786 IP 99.84.126.86.443 > 10.0.2.15.40364: Flags [P.], seq 572513:576635, ack 286, win 65535, length 4122
00:07:57.707789 IP 99.84.126.86.443 > 10.0.2.15.40364: Flags [P.], seq 576635:580757, ack 286, win 65535, length 4122
00:07:57.707848 IP 10.0.2.15.40364 > 99.84.126.86.443: Flags [.], ack 576635, win 65535, length 0
00:07:57.707908 IP 10.0.2.15.40364 > 99.84.126.86.443: Flags [.], ack 580757, win 65535, length 0
00:07:57.708516 IP 99.84.126.86.443 > 10.0.2.15.40364: Flags [P.], seq 580757:583505, ack 286, win 65535, length 2748
00:07:57.708518 IP 99.84.126.86.443 > 10.0.2.15.40364: Flags [P.], seq 583505:586253, ack 286, win 65535, length 2748
00:07:57.708518 IP 99.84.126.86.443 > 10.0.2.15.40364: Flags [P.], seq 586253:587627, ack 286, win 65535, length 1374
00:07:57.708519 IP 99.84.126.86.443 > 10.0.2.15.40364: Flags [P.], seq 587627:590375, ack 286, win 65535, length 2748
00:07:57.708538 IP 10.0.2.15.40364 > 99.84.126.86.443: Flags [.], ack 583505, win 65535, length 0
00:07:57.708560 IP 10.0.2.15.40364 > 99.84.126.86.443: Flags [.], ack 586253, win 65535, length 0
00:07:57.708574 IP 10.0.2.15.40364 > 99.84.126.86.443: Flags [.], ack 587627, win 65535, length 0
00:07:57.708585 IP 10.0.2.15.40364 > 99.84.126.86.443: Flags [.], ack 590375, win 65535, length 0
00:07:57.708937 IP 99.84.126.86.443 > 10.0.2.15.40364: Flags [.], seq 590375:591835, ack 286, win 65535, length 1460
00:07:57.708945 IP 10.0.2.15.40364 > 99.84.126.86.443: Flags [.], ack 591835, win 65535, length 0
00:07:57.709099 IP 99.84.126.86.443 > 10.0.2.15.40364: Flags [P.], seq 591835:594497, ack 286, win 65535, length 2662
00:07:57.709100 IP 99.84.126.86.443 > 10.0.2.15.40364: Flags [P.], seq 594497:597245, ack 286, win 65535, length 2748
00:07:57.709110 IP 10.0.2.15.40364 > 99.84.126.86.443: Flags [.], ack 594497, win 65535, length 0
00:07:57.709123 IP 10.0.2.15.40364 > 99.84.126.86.443: Flags [.], ack 597245, win 65535, length 0
00:07:57.709384 IP 99.84.126.86.443 > 10.0.2.15.40364: Flags [P.], seq 597245:601367, ack 286, win 65535, length 4122
00:07:57.709393 IP 10.0.2.15.40364 > 99.84.126.86.443: Flags [.], ack 601367, win 65535, length 0
00:07:57.709734 IP 99.84.126.86.443 > 10.0.2.15.40364: Flags [P.], seq 601367:602741, ack 286, win 65535, length 1374
00:07:57.709737 IP 99.84.126.86.443 > 10.0.2.15.40364: Flags [P.], seq 602741:605489, ack 286, win 65535, length 2748
00:07:57.709750 IP 10.0.2.15.40364 > 99.84.126.86.443: Flags [.], ack 602741, win 65535, length 0
00:07:57.709807 IP 10.0.2.15.40364 > 99.84.126.86.443: Flags [.], ack 605489, win 65535, length 0
00:07:57.709919 IP 99.84.126.86.443 > 10.0.2.15.40364: Flags [P.], seq 605489:606863, ack 286, win 65535, length 1374
00:07:57.709927 IP 10.0.2.15.40364 > 99.84.126.86.443: Flags [.], ack 606863, win 65535, length 0
00:07:57.710117 IP 99.84.126.86.443 > 10.0.2.15.40364: Flags [P.], seq 606863:608237, ack 286, win 65535, length 1374
00:07:57.710125 IP 10.0.2.15.40364 > 99.84.126.86.443: Flags [.], ack 608237, win 65535, length 0
00:07:57.710372 IP 99.84.126.86.443 > 10.0.2.15.40364: Flags [P.], seq 608237:610985, ack 286, win 65535, length 2748
00:07:57.710382 IP 10.0.2.15.40364 > 99.84.126.86.443: Flags [.], ack 610985, win 65535, length 0
00:07:57.711880 IP 99.84.126.86.443 > 10.0.2.15.40364: Flags [P.], seq 610985:615107, ack 286, win 65535, length 4122
00:07:57.711901 IP 10.0.2.15.40364 > 99.84.126.86.443: Flags [.], ack 615107, win 65535, length 0
00:07:57.712315 IP 99.84.126.86.443 > 10.0.2.15.40364: Flags [P.], seq 615107:620603, ack 286, win 65535, length 5496
00:07:57.712330 IP 10.0.2.15.40364 > 99.84.126.86.443: Flags [.], ack 620603, win 65535, length 0
00:07:57.712465 IP 99.84.126.86.443 > 10.0.2.15.40364: Flags [P.], seq 620603:623351, ack 286, win 65535, length 2748
00:07:57.712473 IP 10.0.2.15.40364 > 99.84.126.86.443: Flags [.], ack 623351, win 65535, length 0
00:07:57.712854 IP 99.84.126.86.443 > 10.0.2.15.40364: Flags [P.], seq 623351:627473, ack 286, win 65535, length 4122
00:07:57.712865 IP 10.0.2.15.40364 > 99.84.126.86.443: Flags [.], ack 627473, win 65535, length 0
00:07:57.712988 IP 99.84.126.86.443 > 10.0.2.15.40364: Flags [.], seq 627473:628933, ack 286, win 65535, length 1460
00:07:57.712996 IP 10.0.2.15.40364 > 99.84.126.86.443: Flags [.], ack 628933, win 65535, length 0
00:07:57.713113 IP 99.84.126.86.443 > 10.0.2.15.40364: Flags [P.], seq 628933:630221, ack 286, win 65535, length 1288
00:07:57.713119 IP 10.0.2.15.40364 > 99.84.126.86.443: Flags [.], ack 630221, win 65535, length 0
00:07:57.713242 IP 99.84.126.86.443 > 10.0.2.15.40364: Flags [P.], seq 630221:632969, ack 286, win 65535, length 2748
00:07:57.713249 IP 10.0.2.15.40364 > 99.84.126.86.443: Flags [.], ack 632969, win 65535, length 0
00:07:57.713400 IP 99.84.126.86.443 > 10.0.2.15.40364: Flags [P.], seq 632969:634343, ack 286, win 65535, length 1374
00:07:57.713414 IP 10.0.2.15.40364 > 99.84.126.86.443: Flags [.], ack 634343, win 65535, length 0
00:07:57.713538 IP 99.84.126.86.443 > 10.0.2.15.40364: Flags [P.], seq 634343:637091, ack 286, win 65535, length 2748
00:07:57.713545 IP 10.0.2.15.40364 > 99.84.126.86.443: Flags [.], ack 637091, win 65535, length 0
00:07:57.713706 IP 99.84.126.86.443 > 10.0.2.15.40364: Flags [P.], seq 637091:638465, ack 286, win 65535, length 1374
00:07:57.713713 IP 10.0.2.15.40364 > 99.84.126.86.443: Flags [.], ack 638465, win 65535, length 0
00:07:57.713920 IP 99.84.126.86.443 > 10.0.2.15.40364: Flags [P.], seq 638465:639839, ack 286, win 65535, length 1374
00:07:57.713928 IP 10.0.2.15.40364 > 99.84.126.86.443: Flags [.], ack 639839, win 65535, length 0
00:07:57.714467 IP 99.84.126.86.443 > 10.0.2.15.40364: Flags [P.], seq 639839:642587, ack 286, win 65535, length 2748
00:07:57.714480 IP 10.0.2.15.40364 > 99.84.126.86.443: Flags [.], ack 642587, win 65535, length 0
00:07:57.714683 IP 99.84.126.86.443 > 10.0.2.15.40364: Flags [P.], seq 642587:646709, ack 286, win 65535, length 4122
00:07:57.714693 IP 10.0.2.15.40364 > 99.84.126.86.443: Flags [.], ack 646709, win 65535, length 0
00:07:57.714827 IP 99.84.126.86.443 > 10.0.2.15.40364: Flags [P.], seq 646709:650831, ack 286, win 65535, length 4122
00:07:57.714834 IP 10.0.2.15.40364 > 99.84.126.86.443: Flags [.], ack 650831, win 65535, length 0
00:07:57.715017 IP 99.84.126.86.443 > 10.0.2.15.40364: Flags [P.], seq 650831:654953, ack 286, win 65535, length 4122
00:07:57.715023 IP 10.0.2.15.40364 > 99.84.126.86.443: Flags [.], ack 654953, win 65535, length 0
00:07:57.715481 IP 99.84.126.86.443 > 10.0.2.15.40364: Flags [P.], seq 654953:657701, ack 286, win 65535, length 2748
00:07:57.715492 IP 10.0.2.15.40364 > 99.84.126.86.443: Flags [.], ack 657701, win 65535, length 0
00:07:57.716312 IP 99.84.126.86.443 > 10.0.2.15.40364: Flags [P.], seq 657701:661823, ack 286, win 65535, length 4122
00:07:57.716328 IP 10.0.2.15.40364 > 99.84.126.86.443: Flags [.], ack 661823, win 65535, length 0
00:07:57.716569 IP 99.84.126.86.443 > 10.0.2.15.40364: Flags [P.], seq 661823:664571, ack 286, win 65535, length 2748
00:07:57.716614 IP 10.0.2.15.40364 > 99.84.126.86.443: Flags [.], ack 664571, win 65535, length 0
00:07:57.716834 IP 99.84.126.86.443 > 10.0.2.15.40364: Flags [P.], seq 664571:667319, ack 286, win 65535, length 2748
00:07:57.716846 IP 10.0.2.15.40364 > 99.84.126.86.443: Flags [.], ack 667319, win 65535, length 0
00:07:57.717118 IP 99.84.126.86.443 > 10.0.2.15.40364: Flags [P.], seq 667319:671441, ack 286, win 65535, length 4122
00:07:57.717307 IP 99.84.126.86.443 > 10.0.2.15.40364: Flags [P.], seq 671441:675563, ack 286, win 65535, length 4122
00:07:57.717361 IP 10.0.2.15.40364 > 99.84.126.86.443: Flags [.], ack 675563, win 65535, length 0
00:07:57.717696 IP 99.84.126.86.443 > 10.0.2.15.40364: Flags [P.], seq 675563:678311, ack 286, win 65535, length 2748
00:07:57.717706 IP 10.0.2.15.40364 > 99.84.126.86.443: Flags [.], ack 678311, win 65535, length 0
00:07:57.718050 IP 99.84.126.86.443 > 10.0.2.15.40364: Flags [P.], seq 678311:682433, ack 286, win 65535, length 4122
00:07:57.718325 IP 99.84.126.86.443 > 10.0.2.15.40364: Flags [P.], seq 682433:686555, ack 286, win 65535, length 4122
00:07:57.718362 IP 10.0.2.15.40364 > 99.84.126.86.443: Flags [.], ack 686555, win 65535, length 0
00:07:57.718480 IP 99.84.126.86.443 > 10.0.2.15.40364: Flags [P.], seq 686555:689303, ack 286, win 65535, length 2748
00:07:57.718489 IP 10.0.2.15.40364 > 99.84.126.86.443: Flags [.], ack 689303, win 65535, length 0
00:07:57.718993 IP 99.84.126.86.443 > 10.0.2.15.40364: Flags [P.], seq 689303:694799, ack 286, win 65535, length 5496
00:07:57.719046 IP 10.0.2.15.40364 > 99.84.126.86.443: Flags [.], ack 694799, win 65535, length 0
00:07:57.719146 IP 99.84.126.86.443 > 10.0.2.15.40364: Flags [P.], seq 694799:697547, ack 286, win 65535, length 2748
00:07:57.719171 IP 10.0.2.15.40364 > 99.84.126.86.443: Flags [.], ack 697547, win 65535, length 0
00:07:57.719298 IP 99.84.126.86.443 > 10.0.2.15.40364: Flags [P.], seq 697547:698921, ack 286, win 65535, length 1374
00:07:57.719307 IP 10.0.2.15.40364 > 99.84.126.86.443: Flags [.], ack 698921, win 65535, length 0
00:07:57.719677 IP 99.84.126.86.443 > 10.0.2.15.40364: Flags [P.], seq 698921:700295, ack 286, win 65535, length 1374
00:07:57.719844 IP 99.84.126.86.443 > 10.0.2.15.40364: Flags [P.], seq 700295:704417, ack 286, win 65535, length 4122
00:07:57.719888 IP 10.0.2.15.40364 > 99.84.126.86.443: Flags [.], ack 704417, win 65535, length 0
00:07:57.721189 IP 99.84.126.86.443 > 10.0.2.15.40364: Flags [P.], seq 704417:708539, ack 286, win 65535, length 4122
00:07:57.721234 IP 99.84.126.86.443 > 10.0.2.15.40364: Flags [P.], seq 708539:714035, ack 286, win 65535, length 5496
00:07:57.721510 IP 10.0.2.15.40364 > 99.84.126.86.443: Flags [.], ack 714035, win 65535, length 0
00:07:57.721747 IP 99.84.126.86.443 > 10.0.2.15.40364: Flags [P.], seq 714035:718157, ack 286, win 65535, length 4122
00:07:57.721775 IP 10.0.2.15.40364 > 99.84.126.86.443: Flags [.], ack 718157, win 65535, length 0

