00:07:51.837072 IP 99.84.126.86.443 > 10.0.2.15.40356: Flags [.], seq 52416002:52418922, ack 3827598826, win 65535, length 2920
00:07:51.837126 IP 10.0.2.15.40356 > 99.84.126.86.443: Flags [.], ack 2920, win 62780, length 0
00:07:51.837323 IP 99.84.126.86.443 > 10.0.2.15.40356: Flags [P.], seq 2920:4122, ack 1, win 65535, length 1202
00:07:51.837340 IP 10.0.2.15.40356 > 99.84.126.86.443: Flags [.], ack 4122, win 61578, length 0
00:07:51.840150 IP 99.84.126.86.443 > 10.0.2.15.40356: Flags [P.], seq 4122:5823, ack 1, win 65535, length 1701
00:07:51.840179 IP 10.0.2.15.40356 > 99.84.126.86.443: Flags [.], ack 5823, win 62780, length 0
00:07:51.841242 IP 10.0.2.15.40356 > 99.84.126.86.443: Flags [P.], seq 1:65, ack 5823, win 62780, length 64
00:07:51.841822 IP 99.84.126.86.443 > 10.0.2.15.40356: Flags [.], ack 65, win 65535, length 0
00:07:51.841893 IP 10.0.2.15.40356 > 99.84.126.86.443: Flags [P.], seq 65:111, ack 5823, win 62780, length 46
00:07:51.841926 IP 10.0.2.15.40356 > 99.84.126.86.443: Flags [P.], seq 111:160, ack 5823, win 62780, length 49
00:07:51.842219 IP 99.84.126.86.443 > 10.0.2.15.40356: Flags [.], ack 111, win 65535, length 0
00:07:51.842221 IP 99.84.126.86.443 > 10.0.2.15.40356: Flags [.], ack 160, win 65535, length 0
00:07:51.842237 IP 10.0.2.15.40356 > 99.84.126.86.443: Flags [P.], seq 160:195, ack 5823, win 62780, length 35
00:07:51.842370 IP 10.0.2.15.40356 > 99.84.126.86.443: Flags [P.], seq 195:255, ack 5823, win 62780, length 60
00:07:51.842713 IP 99.84.126.86.443 > 10.0.2.15.40356: Flags [.], ack 195, win 65535, length 0
00:07:51.842714 IP 99.84.126.86.443 > 10.0.2.15.40356: Flags [.], ack 255, win 65535, length 0
00:07:51.856026 IP 99.84.126.86.443 > 10.0.2.15.40356: Flags [P.], seq 5823:5885, ack 255, win 65535, length 62
00:07:51.856105 IP 10.0.2.15.40356 > 99.84.126.86.443: Flags [.], ack 5885, win 62780, length 0
00:07:51.856642 IP 99.84.126.86.443 > 10.0.2.15.40356: Flags [P.], seq 5885:5916, ack 255, win 65535, length 31
00:07:51.856663 IP 10.0.2.15.40356 > 99.84.126.86.443: Flags [.], ack 5916, win 62780, length 0
00:07:51.856975 IP 10.0.2.15.40356 > 99.84.126.86.443: Flags [P.], seq 255:286, ack 5916, win 62780, length 31
00:07:51.858627 IP 99.84.126.86.443 > 10.0.2.15.40356: Flags [.], ack 286, win 65535, length 0
00:07:51.870165 IP 99.84.126.86.443 > 10.0.2.15.40356: Flags [P.], seq 5916:12906, ack 286, win 65535, length 6990
00:07:51.870211 IP 10.0.2.15.40356 > 99.84.126.86.443: Flags [.], ack 12906, win 59860, length 0
00:07:51.876296 IP 99.84.126.86.443 > 10.0.2.15.40356: Flags [P.], seq 12906:23898, ack 286, win 65535, length 10992
00:07:51.876327 IP 10.0.2.15.40356 > 99.84.126.86.443: Flags [.], ack 23898, win 56940, length 0
00:07:51.878326 IP 99.84.126.86.443 > 10.0.2.15.40356: Flags [P.], seq 23898:26646, ack 286, win 65535, length 2748
00:07:51.878330 IP 99.84.126.86.443 > 10.0.2.15.40356: Flags [P.], seq 26646:36601, ack 286, win 65535, length 9955
00:07:51.878352 IP 10.0.2.15.40356 > 99.84.126.86.443: Flags [.], ack 26646, win 55480, length 0
00:07:51.878464 IP 10.0.2.15.40356 > 99.84.126.86.443: Flags [.], ack 36601, win 48180, length 0
00:07:51.880749 IP 99.84.126.86.443 > 10.0.2.15.40356: Flags [P.], seq 36601:40723, ack 286, win 65535, length 4122
00:07:51.880770 IP 10.0.2.15.40356 > 99.84.126.86.443: Flags [.], ack 40723, win 61320, length 0
00:07:51.881200 IP 99.84.126.86.443 > 10.0.2.15.40356: Flags [P.], seq 40723:43471, ack 286, win 65535, length 2748
00:07:51.881211 IP 10.0.2.15.40356 > 99.84.126.86.443: Flags [.], ack 43471, win 62780, length 0
00:07:51.881879 IP 99.84.126.86.443 > 10.0.2.15.40356: Flags [P.], seq 43471:47593, ack 286, win 65535, length 4122
00:07:51.881882 IP 99.84.126.86.443 > 10.0.2.15.40356: Flags [P.], seq 47593:50341, ack 286, win 65535, length 2748
00:07:51.881964 IP 10.0.2.15.40356 > 99.84.126.86.443: Flags [.], ack 50341, win 59860, length 0
00:07:51.887087 IP 99.84.126.86.443 > 10.0.2.15.40356: Flags [P.], seq 50341:55837, ack 286, win 65535, length 5496
00:07:51.887114 IP 10.0.2.15.40356 > 99.84.126.86.443: Flags [.], ack 55837, win 61320, length 0
00:07:51.889705 IP 99.84.126.86.443 > 10.0.2.15.40356: Flags [P.], seq 55837:61333, ack 286, win 65535, length 5496
00:07:51.889710 IP 99.84.126.86.443 > 10.0.2.15.40356: Flags [P.], seq 61333:65455, ack 286, win 65535, length 4122
00:07:51.889736 IP 10.0.2.15.40356 > 99.84.126.86.443: Flags [.], ack 61333, win 61320, length 0
00:07:51.891513 IP 99.84.126.86.443 > 10.0.2.15.40356: Flags [P.], seq 65455:66829, ack 286, win 65535, length 1374
00:07:51.891517 IP 99.84.126.86.443 > 10.0.2.15.40356: Flags [.], seq 66829:71209, ack 286, win 65535, length 4380
00:07:51.891766 IP 10.0.2.15.40356 > 99.84.126.86.443: Flags [.], ack 71209, win 62780, length 0
00:07:51.892108 IP 99.84.126.86.443 > 10.0.2.15.40356: Flags [P.], seq 71209:72325, ack 286, win 65535, length 1116
00:07:51.892110 IP 99.84.126.86.443 > 10.0.2.15.40356: Flags [P.], seq 72325:73699, ack 286, win 65535, length 1374
00:07:51.892112 IP 99.84.126.86.443 > 10.0.2.15.40356: Flags [.], seq 73699:79539, ack 286, win 65535, length 5840
00:07:51.892182 IP 10.0.2.15.40356 > 99.84.126.86.443: Flags [.], ack 79539, win 65535, length 0
00:07:51.892327 IP 99.84.126.86.443 > 10.0.2.15.40356: Flags [.], seq 79539:83919, ack 286, win 65535, length 4380
00:07:51.892339 IP 10.0.2.15.40356 > 99.84.126.86.443: Flags [.], ack 83919, win 65535, length 0
00:07:51.892455 IP 99.84.126.86.443 > 10.0.2.15.40356: Flags [P.], seq 83919:87439, ack 286, win 65535, length 3520
00:07:51.892462 IP 10.0.2.15.40356 > 99.84.126.86.443: Flags [.], ack 87439, win 65535, length 0
00:07:51.894198 IP 99.84.126.86.443 > 10.0.2.15.40356: Flags [P.], seq 87439:94309, ack 286, win 65535, length 6870
00:07:51.894222 IP 10.0.2.15.40356 > 99.84.126.86.443: Flags [.], ack 94309, win 65535, length 0
00:07:51.894529 IP 99.84.126.86.443 > 10.0.2.15.40356: Flags [P.], seq 94309:97057, ack 286, win 65535, length 2748
00:07:51.894541 IP 10.0.2.15.40356 > 99.84.126.86.443: Flags [.], ack 97057, win 65535, length 0
00:07:51.894807 IP 99.84.126.86.443 > 10.0.2.15.40356: Flags [P.], seq 97057:101179, ack 286, win 65535, length 4122
00:07:51.894819 IP 10.0.2.15.40356 > 99.84.126.86.443: Flags [.], ack 101179, win 65535, length 0
00:07:51.895058 IP 99.84.126.86.443 > 10.0.2.15.40356: Flags [P.], seq 101179:105301, ack 286, win 65535, length 4122
00:07:51.895122 IP 10.0.2.15.40356 > 99.84.126.86.443: Flags [.], ack 105301, win 65535, length 0
00:07:51.895643 IP 99.84.126.86.443 > 10.0.2.15.40356: Flags [.], seq 105301:106761, ack 286, win 65535, length 1460
00:07:51.895660 IP 10.0.2.15.40356 > 99.84.126.86.443: Flags [.], ack 106761, win 65535, length 0
00:07:51.895937 IP 99.84.126.86.443 > 10.0.2.15.40356: Flags [P.], seq 106761:108049, ack 286, win 65535, length 1288
00:07:51.895945 IP 10.0.2.15.40356 > 99.84.126.86.443: Flags [.], ack 108049, win 65535, length 0
00:07:51.896937 IP 99.84.126.86.443 > 10.0.2.15.40356: Flags [.], seq 108049:109509, ack 286, win 65535, length 1460
00:07:51.896957 IP 10.0.2.15.40356 > 99.84.126.86.443: Flags [.], ack 109509, win 65535, length 0
00:07:51.897216 IP 99.84.126.86.443 > 10.0.2.15.40356: Flags [P.], seq 109509:113545, ack 286, win 65535, length 4036
00:07:51.897218 IP 99.84.126.86.443 > 10.0.2.15.40356: Flags [P.], seq 113545:116293, ack 286, win 65535, length 2748
00:07:51.897219 IP 99.84.126.86.443 > 10.0.2.15.40356: Flags [P.], seq 116293:120415, ack 286, win 65535, length 4122
00:07:51.897236 IP 10.0.2.15.40356 > 99.84.126.86.443: Flags [.], ack 113545, win 65535, length 0
00:07:51.897263 IP 10.0.2.15.40356 > 99.84.126.86.443: Flags [.], ack 116293, win 65535, length 0
00:07:51.897278 IP 10.0.2.15.40356 > 99.84.126.86.443: Flags [.], ack 120415, win 65535, length 0
00:07:51.897787 IP 99.84.126.86.443 > 10.0.2.15.40356: Flags [P.], seq 120415:125911, ack 286, win 65535, length 5496
00:07:51.897803 IP 10.0.2.15.40356 > 99.84.126.86.443: Flags [.], ack 125911, win 65535, length 0
00:07:51.898001 IP 99.84.126.86.443 > 10.0.2.15.40356: Flags [P.], seq 125911:128659, ack 286, win 65535, length 2748
00:07:51.898011 IP 10.0.2.15.40356 > 99.84.126.86.443: Flags [.], ack 128659, win 65535, length 0
00:07:51.899925 IP 99.84.126.86.443 > 10.0.2.15.40356: Flags [P.], seq 128659:132781, ack 286, win 65535, length 4122
00:07:51.899944 IP 10.0.2.15.40356 > 99.84.126.86.443: Flags [.], ack 132781, win 65535, length 0
00:07:51.900153 IP 99.84.126.86.443 > 10.0.2.15.40356: Flags [P.], seq 132781:136903, ack 286, win 65535, length 4122
00:07:51.900162 IP 10.0.2.15.40356 > 99.84.126.86.443: Flags [.], ack 136903, win 65535, length 0
00:07:51.901272 IP 99.84.126.86.443 > 10.0.2.15.40356: Flags [P.], seq 136903:141025, ack 286, win 65535, length 4122
00:07:51.901331 IP 10.0.2.15.40356 > 99.84.126.86.443: Flags [.], ack 141025, win 65535, length 0
00:07:51.901623 IP 99.84.126.86.443 > 10.0.2.15.40356: Flags [P.], seq 141025:143773, ack 286, win 65535, length 2748
00:07:51.901648 IP 10.0.2.15.40356 > 99.84.126.86.443: Flags [.], ack 143773, win 65535, length 0
00:07:51.902209 IP 99.84.126.86.443 > 10.0.2.15.40356: Flags [P.], seq 143773:145147, ack 286, win 65535, length 1374
00:07:51.902496 IP 10.0.2.15.40356 > 99.84.126.86.443: Flags [.], ack 145147, win 65535, length 0
00:07:51.902962 IP 99.84.126.86.443 > 10.0.2.15.40356: Flags [P.], seq 145147:149269, ack 286, win 65535, length 4122
00:07:51.902965 IP 99.84.126.86.443 > 10.0.2.15.40356: Flags [P.], seq 149269:153391, ack 286, win 65535, length 4122
00:07:51.902966 IP 99.84.126.86.443 > 10.0.2.15.40356: Flags [P.], seq 153391:156139, ack 286, win 65535, length 2748
00:07:51.902985 IP 10.0.2.15.40356 > 99.84.126.86.443: Flags [.], ack 149269, win 65535, length 0
00:07:51.903013 IP 10.0.2.15.40356 > 99.84.126.86.443: Flags [.], ack 153391, win 65535, length 0
00:07:51.903026 IP 10.0.2.15.40356 > 99.84.126.86.443: Flags [.], ack 156139, win 65535, length 0
00:07:51.903046 IP 99.84.126.86.443 > 10.0.2.15.40356: Flags [P.], seq 156139:158887, ack 286, win 65535, length 2748
00:07:51.903052 IP 10.0.2.15.40356 > 99.84.126.86.443: Flags [.], ack 158887, win 65535, length 0
00:07:51.903310 IP 99.84.126.86.443 > 10.0.2.15.40356: Flags [P.], seq 158887:161635, ack 286, win 65535, length 2748
00:07:51.903319 IP 10.0.2.15.40356 > 99.84.126.86.443: Flags [.], ack 161635, win 65535, length 0
00:07:51.904772 IP 99.84.126.86.443 > 10.0.2.15.40356: Flags [P.], seq 161635:168505, ack 286, win 65535, length 6870
00:07:51.904787 IP 10.0.2.15.40356 > 99.84.126.86.443: Flags [.], ack 168505, win 65535, length 0
00:07:51.905275 IP 99.84.126.86.443 > 10.0.2.15.40356: Flags [P.], seq 168505:172627, ack 286, win 65535, length 4122
00:07:51.905349 IP 10.0.2.15.40356 > 99.84.126.86.443: Flags [.], ack 172627, win 65535, length 0
00:07:51.906187 IP 99.84.126.86.443 > 10.0.2.15.40356: Flags [.], seq 172627:175547, ack 286, win 65535, length 2920
00:07:51.906212 IP 10.0.2.15.40356 > 99.84.126.86.443: Flags [.], ack 175547, win 65535, length 0
00:07:51.906396 IP 99.84.126.86.443 > 10.0.2.15.40356: Flags [P.], seq 175547:176749, ack 286, win 65535, length 1202
00:07:51.906398 IP 99.84.126.86.443 > 10.0.2.15.40356: Flags [P.], seq 176749:178123, ack 286, win 65535, length 1374
00:07:51.906413 IP 10.0.2.15.40356 > 99.84.126.86.443: Flags [.], ack 176749, win 65535, length 0
00:07:51.906426 IP 10.0.2.15.40356 > 99.84.126.86.443: Flags [.], ack 178123, win 65535, length 0
00:07:51.908226 IP 99.84.126.86.443 > 10.0.2.15.40356: Flags [P.], seq 178123:189115, ack 286, win 65535, length 10992
00:07:51.908252 IP 10.0.2.15.40356 > 99.84.126.86.443: Flags [.], ack 189115, win 65535, length 0
00:07:51.908303 IP 99.84.126.86.443 > 10.0.2.15.40356: Flags [P.], seq 189115:193237, ack 286, win 65535, length 4122
00:07:51.908304 IP 99.84.126.86.443 > 10.0.2.15.40356: Flags [P.], seq 193237:194611, ack 286, win 65535, length 1374
00:07:51.908317 IP 10.0.2.15.40356 > 99.84.126.86.443: Flags [.], ack 193237, win 65535, length 0
00:07:51.908507 IP 10.0.2.15.40356 > 99.84.126.86.443: Flags [.], ack 194611, win 65535, length 0
00:07:51.908747 IP 99.84.126.86.443 > 10.0.2.15.40356: Flags [P.], seq 194611:198733, ack 286, win 65535, length 4122
00:07:51.908749 IP 99.84.126.86.443 > 10.0.2.15.40356: Flags [P.], seq 198733:202855, ack 286, win 65535, length 4122
00:07:51.908761 IP 10.0.2.15.40356 > 99.84.126.86.443: Flags [.], ack 198733, win 65535, length 0
00:07:51.908816 IP 10.0.2.15.40356 > 99.84.126.86.443: Flags [.], ack 202855, win 65535, length 0
00:07:51.909007 IP 99.84.126.86.443 > 10.0.2.15.40356: Flags [P.], seq 202855:204229, ack 286, win 65535, length 1374
00:07:51.909015 IP 10.0.2.15.40356 > 99.84.126.86.443: Flags [.], ack 204229, win 65535, length 0
00:07:51.909174 IP 99.84.126.86.443 > 10.0.2.15.40356: Flags [P.], seq 204229:208351, ack 286, win 65535, length 4122
00:07:51.909182 IP 10.0.2.15.40356 > 99.84.126.86.443: Flags [.], ack 208351, win 65535, length 0
00:07:51.909305 IP 99.84.126.86.443 > 10.0.2.15.40356: Flags [P.], seq 208351:209725, ack 286, win 65535, length 1374
00:07:51.909312 IP 10.0.2.15.40356 > 99.84.126.86.443: Flags [.], ack 209725, win 65535, length 0
00:07:51.909920 IP 99.84.126.86.443 > 10.0.2.15.40356: Flags [P.], seq 209725:211099, ack 286, win 65535, length 1374
00:07:51.909923 IP 99.84.126.86.443 > 10.0.2.15.40356: Flags [P.], seq 211099:215221, ack 286, win 65535, length 4122
00:07:51.909981 IP 10.0.2.15.40356 > 99.84.126.86.443: Flags [.], ack 211099, win 65535, length 0
00:07:51.910207 IP 10.0.2.15.40356 > 99.84.126.86.443: Flags [.], ack 215221, win 65535, length 0
00:07:51.910870 IP 99.84.126.86.443 > 10.0.2.15.40356: Flags [P.], seq 215221:217969, ack 286, win 65535, length 2748
00:07:51.910872 IP 99.84.126.86.443 > 10.0.2.15.40356: Flags [P.], seq 217969:222091, ack 286, win 65535, length 4122
00:07:51.910873 IP 99.84.126.86.443 > 10.0.2.15.40356: Flags [P.], seq 222091:223465, ack 286, win 65535, length 1374
00:07:51.910890 IP 10.0.2.15.40356 > 99.84.126.86.443: Flags [.], ack 217969, win 65535, length 0
00:07:51.910909 IP 10.0.2.15.40356 > 99.84.126.86.443: Flags [.], ack 222091, win 65535, length 0
00:07:51.910923 IP 10.0.2.15.40356 > 99.84.126.86.443: Flags [.], ack 223465, win 65535, length 0
00:07:51.912457 IP 99.84.126.86.443 > 10.0.2.15.40356: Flags [P.], seq 223465:227587, ack 286, win 65535, length 4122
00:07:51.912479 IP 10.0.2.15.40356 > 99.84.126.86.443: Flags [.], ack 227587, win 65535, length 0
00:07:51.912676 IP 99.84.126.86.443 > 10.0.2.15.40356: Flags [P.], seq 227587:231709, ack 286, win 65535, length 4122
00:07:51.912688 IP 10.0.2.15.40356 > 99.84.126.86.443: Flags [.], ack 231709, win 65535, length 0
00:07:51.912861 IP 99.84.126.86.443 > 10.0.2.15.40356: Flags [P.], seq 231709:234457, ack 286, win 65535, length 2748
00:07:51.912869 IP 10.0.2.15.40356 > 99.84.126.86.443: Flags [.], ack 234457, win 65535, length 0
00:07:51.913332 IP 99.84.126.86.443 > 10.0.2.15.40356: Flags [P.], seq 234457:238579, ack 286, win 65535, length 4122
00:07:51.913348 IP 10.0.2.15.40356 > 99.84.126.86.443: Flags [.], ack 238579, win 65535, length 0
00:07:51.913833 IP 99.84.126.86.443 > 10.0.2.15.40356: Flags [P.], seq 238579:241327, ack 286, win 65535, length 2748
00:07:51.913862 IP 10.0.2.15.40356 > 99.84.126.86.443: Flags [.], ack 241327, win 65535, length 0
00:07:51.914997 IP 99.84.126.86.443 > 10.0.2.15.40356: Flags [P.], seq 241327:245449, ack 286, win 65535, length 4122
00:07:51.915000 IP 99.84.126.86.443 > 10.0.2.15.40356: Flags [P.], seq 245449:248197, ack 286, win 65535, length 2748
00:07:51.915024 IP 10.0.2.15.40356 > 99.84.126.86.443: Flags [.], ack 245449, win 65535, length 0
00:07:51.915062 IP 10.0.2.15.40356 > 99.84.126.86.443: Flags [.], ack 248197, win 65535, length 0
00:07:51.915261 IP 99.84.126.86.443 > 10.0.2.15.40356: Flags [P.], seq 248197:250945, ack 286, win 65535, length 2748
00:07:51.915271 IP 10.0.2.15.40356 > 99.84.126.86.443: Flags [.], ack 250945, win 65535, length 0
00:07:51.915787 IP 99.84.126.86.443 > 10.0.2.15.40356: Flags [P.], seq 250945:257815, ack 286, win 65535, length 6870
00:07:51.915806 IP 10.0.2.15.40356 > 99.84.126.86.443: Flags [.], ack 257815, win 65535, length 0
00:07:51.916291 IP 99.84.126.86.443 > 10.0.2.15.40356: Flags [.], seq 257815:259275, ack 286, win 65535, length 1460
00:07:51.916309 IP 10.0.2.15.40356 > 99.84.126.86.443: Flags [.], ack 259275, win 65535, length 0
00:07:51.916556 IP 99.84.126.86.443 > 10.0.2.15.40356: Flags [P.], seq 259275:261937, ack 286, win 65535, length 2662
00:07:51.916559 IP 99.84.126.86.443 > 10.0.2.15.40356: Flags [P.], seq 261937:264685, ack 286, win 65535, length 2748
00:07:51.916574 IP 10.0.2.15.40356 > 99.84.126.86.443: Flags [.], ack 261937, win 65535, length 0
00:07:51.916591 IP 10.0.2.15.40356 > 99.84.126.86.443: Flags [.], ack 264685, win 65535, length 0
00:07:51.917285 IP 99.84.126.86.443 > 10.0.2.15.40356: Flags [P.], seq 264685:268807, ack 286, win 65535, length 4122
00:07:51.917306 IP 10.0.2.15.40356 > 99.84.126.86.443: Flags [.], ack 268807, win 65535, length 0
00:07:51.917457 IP 99.84.126.86.443 > 10.0.2.15.40356: Flags [P.], seq 268807:271555, ack 286, win 65535, length 2748
00:07:51.917467 IP 10.0.2.15.40356 > 99.84.126.86.443: Flags [.], ack 271555, win 65535, length 0
00:07:51.919173 IP 99.84.126.86.443 > 10.0.2.15.40356: Flags [P.], seq 271555:275677, ack 286, win 65535, length 4122
00:07:51.919175 IP 99.84.126.86.443 > 10.0.2.15.40356: Flags [P.], seq 275677:278425, ack 286, win 65535, length 2748
00:07:51.919194 IP 10.0.2.15.40356 > 99.84.126.86.443: Flags [.], ack 275677, win 65535, length 0
00:07:51.919272 IP 10.0.2.15.40356 > 99.84.126.86.443: Flags [.], ack 278425, win 65535, length 0
00:07:51.919912 IP 99.84.126.86.443 > 10.0.2.15.40356: Flags [P.], seq 278425:281173, ack 286, win 65535, length 2748
00:07:51.919915 IP 99.84.126.86.443 > 10.0.2.15.40356: Flags [P.], seq 281173:285295, ack 286, win 65535, length 4122
00:07:51.919940 IP 10.0.2.15.40356 > 99.84.126.86.443: Flags [.], ack 281173, win 65535, length 0
00:07:51.919969 IP 10.0.2.15.40356 > 99.84.126.86.443: Flags [.], ack 285295, win 65535, length 0
00:07:51.920264 IP 99.84.126.86.443 > 10.0.2.15.40356: Flags [P.], seq 285295:289417, ack 286, win 65535, length 4122
00:07:51.920281 IP 10.0.2.15.40356 > 99.84.126.86.443: Flags [.], ack 289417, win 65535, length 0
00:07:51.920589 IP 99.84.126.86.443 > 10.0.2.15.40356: Flags [P.], seq 289417:293539, ack 286, win 65535, length 4122
00:07:51.920604 IP 10.0.2.15.40356 > 99.84.126.86.443: Flags [.], ack 293539, win 65535, length 0
00:07:51.920889 IP 99.84.126.86.443 > 10.0.2.15.40356: Flags [P.], seq 293539:299035, ack 286, win 65535, length 5496
00:07:51.920938 IP 10.0.2.15.40356 > 99.84.126.86.443: Flags [.], ack 299035, win 65535, length 0
00:07:51.921066 IP 99.84.126.86.443 > 10.0.2.15.40356: Flags [P.], seq 299035:300409, ack 286, win 65535, length 1374
00:07:51.921074 IP 10.0.2.15.40356 > 99.84.126.86.443: Flags [.], ack 300409, win 65535, length 0
00:07:51.921354 IP 99.84.126.86.443 > 10.0.2.15.40356: Flags [P.], seq 300409:304531, ack 286, win 65535, length 4122
00:07:51.921367 IP 10.0.2.15.40356 > 99.84.126.86.443: Flags [.], ack 304531, win 65535, length 0
00:07:51.921772 IP 99.84.126.86.443 > 10.0.2.15.40356: Flags [P.], seq 304531:307279, ack 286, win 65535, length 2748
00:07:51.921787 IP 10.0.2.15.40356 > 99.84.126.86.443: Flags [.], ack 307279, win 65535, length 0
00:07:51.921937 IP 99.84.126.86.443 > 10.0.2.15.40356: Flags [.], seq 307279:308739, ack 286, win 65535, length 1460
00:07:51.921948 IP 10.0.2.15.40356 > 99.84.126.86.443: Flags [.], ack 308739, win 65535, length 0
00:07:51.922127 IP 99.84.126.86.443 > 10.0.2.15.40356: Flags [P.], seq 308739:310027, ack 286, win 65535, length 1288
00:07:51.922128 IP 99.84.126.86.443 > 10.0.2.15.40356: Flags [P.], seq 310027:311401, ack 286, win 65535, length 1374
00:07:51.922140 IP 10.0.2.15.40356 > 99.84.126.86.443: Flags [.], ack 310027, win 65535, length 0
00:07:51.922157 IP 10.0.2.15.40356 > 99.84.126.86.443: Flags [.], ack 311401, win 65535, length 0
00:07:51.922977 IP 99.84.126.86.443 > 10.0.2.15.40356: Flags [P.], seq 311401:315523, ack 286, win 65535, length 4122
00:07:51.922981 IP 99.84.126.86.443 > 10.0.2.15.40356: Flags [P.], seq 315523:318271, ack 286, win 65535, length 2748
00:07:51.923006 IP 10.0.2.15.40356 > 99.84.126.86.443: Flags [.], ack 315523, win 65535, length 0
00:07:51.923077 IP 10.0.2.15.40356 > 99.84.126.86.443: Flags [.], ack 318271, win 65535, length 0
00:07:51.923272 IP 99.84.126.86.443 > 10.0.2.15.40356: Flags [P.], seq 318271:322393, ack 286, win 65535, length 4122
00:07:51.923284 IP 10.0.2.15.40356 > 99.84.126.86.443: Flags [.], ack 322393, win 65535, length 0
00:07:51.923525 IP 99.84.126.86.443 > 10.0.2.15.40356: Flags [P.], seq 322393:325141, ack 286, win 65535, length 2748
00:07:51.923544 IP 10.0.2.15.40356 > 99.84.126.86.443: Flags [.], ack 325141, win 65535, length 0
00:07:51.924868 IP 99.84.126.86.443 > 10.0.2.15.40356: Flags [P.], seq 325141:326515, ack 286, win 65535, length 1374
00:07:51.924871 IP 99.84.126.86.443 > 10.0.2.15.40356: Flags [P.], seq 326515:330637, ack 286, win 65535, length 4122
00:07:51.924871 IP 99.84.126.86.443 > 10.0.2.15.40356: Flags [P.], seq 330637:332011, ack 286, win 65535, length 1374
00:07:51.924873 IP 99.84.126.86.443 > 10.0.2.15.40356: Flags [P.], seq 332011:336133, ack 286, win 65535, length 4122
00:07:51.924896 IP 10.0.2.15.40356 > 99.84.126.86.443: Flags [.], ack 326515, win 65535, length 0
00:07:51.924938 IP 10.0.2.15.40356 > 99.84.126.86.443: Flags [.], ack 330637, win 65535, length 0
00:07:51.924950 IP 10.0.2.15.40356 > 99.84.126.86.443: Flags [.], ack 332011, win 65535, length 0
00:07:51.924960 IP 10.0.2.15.40356 > 99.84.126.86.443: Flags [.], ack 336133, win 65535, length 0
00:07:51.925058 IP 99.84.126.86.443 > 10.0.2.15.40356: Flags [P.], seq 336133:341629, ack 286, win 65535, length 5496
00:07:51.925065 IP 10.0.2.15.40356 > 99.84.126.86.443: Flags [.], ack 341629, win 65535, length 0
00:07:51.925665 IP 99.84.126.86.443 > 10.0.2.15.40356: Flags [P.], seq 341629:343003, ack 286, win 65535, length 1374
00:07:51.925669 IP 99.84.126.86.443 > 10.0.2.15.40356: Flags [P.], seq 343003:345751, ack 286, win 65535, length 2748
00:07:51.925670 IP 99.84.126.86.443 > 10.0.2.15.40356: Flags [P.], seq 345751:347125, ack 286, win 65535, length 1374
00:07:51.925694 IP 10.0.2.15.40356 > 99.84.126.86.443: Flags [.], ack 343003, win 65535, length 0
00:07:51.925854 IP 10.0.2.15.40356 > 99.84.126.86.443: Flags [.], ack 345751, win 65535, length 0
00:07:51.925945 IP 10.0.2.15.40356 > 99.84.126.86.443: Flags [.], ack 347125, win 65535, length 0
00:07:51.926059 IP 99.84.126.86.443 > 10.0.2.15.40356: Flags [P.], seq 347125:352621, ack 286, win 65535, length 5496
00:07:51.926065 IP 10.0.2.15.40356 > 99.84.126.86.443: Flags [.], ack 352621, win 65535, length 0
00:07:51.926329 IP 99.84.126.86.443 > 10.0.2.15.40356: Flags [P.], seq 352621:356743, ack 286, win 65535, length 4122
00:07:51.926331 IP 99.84.126.86.443 > 10.0.2.15.40356: Flags [P.], seq 356743:358117, ack 286, win 65535, length 1374
00:07:51.926344 IP 10.0.2.15.40356 > 99.84.126.86.443: Flags [.], ack 356743, win 65535, length 0
00:07:51.926362 IP 10.0.2.15.40356 > 99.84.126.86.443: Flags [.], ack 358117, win 65535, length 0
00:07:51.927208 IP 99.84.126.86.443 > 10.0.2.15.40356: Flags [P.], seq 358117:362239, ack 286, win 65535, length 4122
00:07:51.927224 IP 10.0.2.15.40356 > 99.84.126.86.443: Flags [.], ack 362239, win 65535, length 0
00:07:51.927620 IP 99.84.126.86.443 > 10.0.2.15.40356: Flags [P.], seq 362239:364987, ack 286, win 65535, length 2748
00:07:51.927631 IP 10.0.2.15.40356 > 99.84.126.86.443: Flags [.], ack 364987, win 65535, length 0
00:07:51.927972 IP 99.84.126.86.443 > 10.0.2.15.40356: Flags [P.], seq 364987:369109, ack 286, win 65535, length 4122
00:07:51.927986 IP 10.0.2.15.40356 > 99.84.126.86.443: Flags [.], ack 369109, win 65535, length 0
00:07:51.928265 IP 99.84.126.86.443 > 10.0.2.15.40356: Flags [P.], seq 369109:373231, ack 286, win 65535, length 4122
00:07:51.928281 IP 10.0.2.15.40356 > 99.84.126.86.443: Flags [.], ack 373231, win 65535, length 0
00:07:51.928614 IP 99.84.126.86.443 > 10.0.2.15.40356: Flags [P.], seq 373231:377353, ack 286, win 65535, length 4122
00:07:51.928623 IP 10.0.2.15.40356 > 99.84.126.86.443: Flags [.], ack 377353, win 65535, length 0
00:07:51.928878 IP 99.84.126.86.443 > 10.0.2.15.40356: Flags [P.], seq 377353:381475, ack 286, win 65535, length 4122
00:07:51.928958 IP 10.0.2.15.40356 > 99.84.126.86.443: Flags [.], ack 381475, win 65535, length 0
00:07:51.929152 IP 99.84.126.86.443 > 10.0.2.15.40356: Flags [P.], seq 381475:385597, ack 286, win 65535, length 4122
00:07:51.929192 IP 10.0.2.15.40356 > 99.84.126.86.443: Flags [.], ack 385597, win 65535, length 0
00:07:51.929546 IP 99.84.126.86.443 > 10.0.2.15.40356: Flags [P.], seq 385597:389719, ack 286, win 65535, length 4122
00:07:51.929557 IP 10.0.2.15.40356 > 99.84.126.86.443: Flags [.], ack 389719, win 65535, length 0
00:07:51.929656 IP 99.84.126.86.443 > 10.0.2.15.40356: Flags [P.], seq 389719:392467, ack 286, win 65535, length 2748
00:07:51.929662 IP 10.0.2.15.40356 > 99.84.126.86.443: Flags [.], ack 392467, win 65535, length 0
00:07:51.929897 IP 99.84.126.86.443 > 10.0.2.15.40356: Flags [P.], seq 392467:393841, ack 286, win 65535, length 1374
00:07:51.929909 IP 10.0.2.15.40356 > 99.84.126.86.443: Flags [.], ack 393841, win 65535, length 0
00:07:51.930031 IP 99.84.126.86.443 > 10.0.2.15.40356: Flags [P.], seq 393841:396589, ack 286, win 65535, length 2748
00:07:51.930039 IP 10.0.2.15.40356 > 99.84.126.86.443: Flags [.], ack 396589, win 65535, length 0
00:07:51.930590 IP 99.84.126.86.443 > 10.0.2.15.40356: Flags [P.], seq 396589:400711, ack 286, win 65535, length 4122
00:07:51.930613 IP 10.0.2.15.40356 > 99.84.126.86.443: Flags [.], ack 400711, win 65535, length 0
00:07:51.930852 IP 99.84.126.86.443 > 10.0.2.15.40356: Flags [P.], seq 400711:402085, ack 286, win 65535, length 1374
00:07:51.930873 IP 10.0.2.15.40356 > 99.84.126.86.443: Flags [.], ack 402085, win 65535, length 0
00:07:51.932210 IP 99.84.126.86.443 > 10.0.2.15.40356: Flags [P.], seq 402085:407581, ack 286, win 65535, length 5496
00:07:51.932213 IP 99.84.126.86.443 > 10.0.2.15.40356: Flags [P.], seq 407581:411703, ack 286, win 65535, length 4122
00:07:51.932235 IP 10.0.2.15.40356 > 99.84.126.86.443: Flags [.], ack 407581, win 65535, length 0
00:07:51.932350 IP 10.0.2.15.40356 > 99.84.126.86.443: Flags [.], ack 411703, win 65535, length 0
00:07:51.932532 IP 99.84.126.86.443 > 10.0.2.15.40356: Flags [P.], seq 411703:413077, ack 286, win 65535, length 1374
00:07:51.932535 IP 99.84.126.86.443 > 10.0.2.15.40356: Flags [P.], seq 413077:417199, ack 286, win 65535, length 4122
00:07:51.932547 IP 10.0.2.15.40356 > 99.84.126.86.443: Flags [.], ack 413077, win 65535, length 0
00:07:51.932651 IP 10.0.2.15.40356 > 99.84.126.86.443: Flags [.], ack 417199, win 65535, length 0
00:07:51.933124 IP 99.84.126.86.443 > 10.0.2.15.40356: Flags [.], seq 417199:420119, ack 286, win 65535, length 2920
00:07:51.933285 IP 10.0.2.15.40356 > 99.84.126.86.443: Flags [.], ack 420119, win 65535, length 0
00:07:51.933699 IP 99.84.126.86.443 > 10.0.2.15.40356: Flags [P.], seq 420119:421321, ack 286, win 65535, length 1202
00:07:51.933701 IP 99.84.126.86.443 > 10.0.2.15.40356: Flags [P.], seq 421321:425443, ack 286, win 65535, length 4122
00:07:51.933702 IP 99.84.126.86.443 > 10.0.2.15.40356: Flags [P.], seq 425443:428191, ack 286, win 65535, length 2748
00:07:51.933721 IP 10.0.2.15.40356 > 99.84.126.86.443: Flags [.], ack 421321, win 65535, length 0
00:07:51.933784 IP 10.0.2.15.40356 > 99.84.126.86.443: Flags [.], ack 425443, win 65535, length 0
00:07:51.933799 IP 10.0.2.15.40356 > 99.84.126.86.443: Flags [.], ack 428191, win 65535, length 0
00:07:51.933914 IP 99.84.126.86.443 > 10.0.2.15.40356: Flags [P.], seq 428191:430939, ack 286, win 65535, length 2748
00:07:51.933924 IP 10.0.2.15.40356 > 99.84.126.86.443: Flags [.], ack 430939, win 65535, length 0
00:07:51.934092 IP 99.84.126.86.443 > 10.0.2.15.40356: Flags [P.], seq 430939:433687, ack 286, win 65535, length 2748
00:07:51.934101 IP 10.0.2.15.40356 > 99.84.126.86.443: Flags [.], ack 433687, win 65535, length 0
00:07:51.934255 IP 99.84.126.86.443 > 10.0.2.15.40356: Flags [P.], seq 433687:437809, ack 286, win 65535, length 4122
00:07:51.934264 IP 10.0.2.15.40356 > 99.84.126.86.443: Flags [.], ack 437809, win 65535, length 0
00:07:51.934743 IP 99.84.126.86.443 > 10.0.2.15.40356: Flags [P.], seq 437809:441931, ack 286, win 65535, length 4122
00:07:51.934764 IP 10.0.2.15.40356 > 99.84.126.86.443: Flags [.], ack 441931, win 65535, length 0
00:07:51.935133 IP 99.84.126.86.443 > 10.0.2.15.40356: Flags [P.], seq 441931:446053, ack 286, win 65535, length 4122
00:07:51.935135 IP 99.84.126.86.443 > 10.0.2.15.40356: Flags [P.], seq 446053:447427, ack 286, win 65535, length 1374
00:07:51.935156 IP 10.0.2.15.40356 > 99.84.126.86.443: Flags [.], ack 446053, win 65535, length 0
00:07:51.935174 IP 10.0.2.15.40356 > 99.84.126.86.443: Flags [.], ack 447427, win 65535, length 0
00:07:51.935349 IP 99.84.126.86.443 > 10.0.2.15.40356: Flags [P.], seq 447427:448801, ack 286, win 65535, length 1374
00:07:51.935357 IP 10.0.2.15.40356 > 99.84.126.86.443: Flags [.], ack 448801, win 65535, length 0
00:07:51.936719 IP 99.84.126.86.443 > 10.0.2.15.40356: Flags [P.], seq 448801:452923, ack 286, win 65535, length 4122
00:07:51.936722 IP 99.84.126.86.443 > 10.0.2.15.40356: Flags [P.], seq 452923:455671, ack 286, win 65535, length 2748
00:07:51.936749 IP 10.0.2.15.40356 > 99.84.126.86.443: Flags [.], ack 452923, win 65535, length 0
00:07:51.936790 IP 10.0.2.15.40356 > 99.84.126.86.443: Flags [.], ack 455671, win 65535, length 0
00:07:51.936985 IP 99.84.126.86.443 > 10.0.2.15.40356: Flags [P.], seq 455671:457045, ack 286, win 65535, length 1374
00:07:51.936998 IP 10.0.2.15.40356 > 99.84.126.86.443: Flags [.], ack 457045, win 65535, length 0
00:07:51.937277 IP 99.84.126.86.443 > 10.0.2.15.40356: Flags [P.], seq 457045:459793, ack 286, win 65535, length 2748
00:07:51.937290 IP 10.0.2.15.40356 > 99.84.126.86.443: Flags [.], ack 459793, win 65535, length 0
00:07:51.939266 IP 99.84.126.86.443 > 10.0.2.15.40356: Flags [P.], seq 459793:463915, ack 286, win 65535, length 4122
00:07:51.939270 IP 99.84.126.86.443 > 10.0.2.15.40356: Flags [P.], seq 463915:468037, ack 286, win 65535, length 4122
00:07:51.939296 IP 10.0.2.15.40356 > 99.84.126.86.443: Flags [.], ack 463915, win 65535, length 0
00:07:51.939637 IP 10.0.2.15.40356 > 99.84.126.86.443: Flags [.], ack 468037, win 65535, length 0
00:07:51.939911 IP 99.84.126.86.443 > 10.0.2.15.40356: Flags [P.], seq 468037:479029, ack 286, win 65535, length 10992
00:07:51.939923 IP 10.0.2.15.40356 > 99.84.126.86.443: Flags [.], ack 479029, win 65535, length 0
00:07:51.940143 IP 99.84.126.86.443 > 10.0.2.15.40356: Flags [P.], seq 479029:481777, ack 286, win 65535, length 2748
00:07:51.940156 IP 99.84.126.86.443 > 10.0.2.15.40356: Flags [P.], seq 481777:485899, ack 286, win 65535, length 4122
00:07:51.940158 IP 99.84.126.86.443 > 10.0.2.15.40356: Flags [P.], seq 485899:488647, ack 286, win 65535, length 2748
00:07:51.940159 IP 99.84.126.86.443 > 10.0.2.15.40356: Flags [P.], seq 488647:492769, ack 286, win 65535, length 4122
00:07:51.940174 IP 10.0.2.15.40356 > 99.84.126.86.443: Flags [.], ack 481777, win 65535, length 0
00:07:51.940254 IP 10.0.2.15.40356 > 99.84.126.86.443: Flags [.], ack 485899, win 65535, length 0
00:07:51.940266 IP 10.0.2.15.40356 > 99.84.126.86.443: Flags [.], ack 488647, win 65535, length 0
00:07:51.940275 IP 10.0.2.15.40356 > 99.84.126.86.443: Flags [.], ack 492769, win 65535, length 0
00:07:51.940297 IP 99.84.126.86.443 > 10.0.2.15.40356: Flags [P.], seq 492769:495517, ack 286, win 65535, length 2748
00:07:51.940302 IP 10.0.2.15.40356 > 99.84.126.86.443: Flags [.], ack 495517, win 65535, length 0
00:07:51.941988 IP 99.84.126.86.443 > 10.0.2.15.40356: Flags [.], seq 495517:496977, ack 286, win 65535, length 1460
00:07:51.942011 IP 10.0.2.15.40356 > 99.84.126.86.443: Flags [.], ack 496977, win 65535, length 0
00:07:51.942493 IP 99.84.126.86.443 > 10.0.2.15.40356: Flags [P.], seq 496977:502387, ack 286, win 65535, length 5410
00:07:51.942496 IP 99.84.126.86.443 > 10.0.2.15.40356: Flags [P.], seq 502387:509257, ack 286, win 65535, length 6870
00:07:51.942572 IP 10.0.2.15.40356 > 99.84.126.86.443: Flags [.], ack 502387, win 65535, length 0
00:07:51.942607 IP 10.0.2.15.40356 > 99.84.126.86.443: Flags [.], ack 509257, win 65535, length 0
00:07:51.942643 IP 99.84.126.86.443 > 10.0.2.15.40356: Flags [P.], seq 509257:513379, ack 286, win 65535, length 4122
00:07:51.942645 IP 99.84.126.86.443 > 10.0.2.15.40356: Flags [P.], seq 513379:517501, ack 286, win 65535, length 4122
00:07:51.942646 IP 99.84.126.86.443 > 10.0.2.15.40356: Flags [P.], seq 517501:518875, ack 286, win 65535, length 1374
00:07:51.942655 IP 10.0.2.15.40356 > 99.84.126.86.443: Flags [.], ack 513379, win 65535, length 0
00:07:51.942705 IP 10.0.2.15.40356 > 99.84.126.86.443: Flags [.], ack 517501, win 65535, length 0
00:07:51.942718 IP 10.0.2.15.40356 > 99.84.126.86.443: Flags [.], ack 518875, win 65535, length 0
00:07:51.942967 IP 99.84.126.86.443 > 10.0.2.15.40356: Flags [P.], seq 518875:520249, ack 286, win 65535, length 1374
00:07:51.942979 IP 10.0.2.15.40356 > 99.84.126.86.443: Flags [.], ack 520249, win 65535, length 0
00:07:51.943163 IP 99.84.126.86.443 > 10.0.2.15.40356: Flags [P.], seq 520249:522997, ack 286, win 65535, length 2748
00:07:51.943177 IP 10.0.2.15.40356 > 99.84.126.86.443: Flags [.], ack 522997, win 65535, length 0
00:07:51.943852 IP 99.84.126.86.443 > 10.0.2.15.40356: Flags [P.], seq 522997:528493, ack 286, win 65535, length 5496
00:07:51.943875 IP 10.0.2.15.40356 > 99.84.126.86.443: Flags [.], ack 528493, win 65535, length 0
00:07:51.944372 IP 99.84.126.86.443 > 10.0.2.15.40356: Flags [P.], seq 528493:533989, ack 286, win 65535, length 5496
00:07:51.944389 IP 10.0.2.15.40356 > 99.84.126.86.443: Flags [.], ack 533989, win 65535, length 0
00:07:51.944860 IP 99.84.126.86.443 > 10.0.2.15.40356: Flags [P.], seq 533989:538111, ack 286, win 65535, length 4122
00:07:51.944863 IP 99.84.126.86.443 > 10.0.2.15.40356: Flags [P.], seq 538111:542233, ack 286, win 65535, length 4122
00:07:51.944889 IP 10.0.2.15.40356 > 99.84.126.86.443: Flags [.], ack 538111, win 65535, length 0
00:07:51.944909 IP 10.0.2.15.40356 > 99.84.126.86.443: Flags [.], ack 542233, win 65535, length 0
00:07:51.945723 IP 99.84.126.86.443 > 10.0.2.15.40356: Flags [P.], seq 542233:546355, ack 286, win 65535, length 4122
00:07:51.945746 IP 10.0.2.15.40356 > 99.84.126.86.443: Flags [.], ack 546355, win 65535, length 0
00:07:51.946577 IP 99.84.126.86.443 > 10.0.2.15.40356: Flags [P.], seq 546355:550477, ack 286, win 65535, length 4122
00:07:51.946651 IP 99.84.126.86.443 > 10.0.2.15.40356: Flags [P.], seq 550477:555973, ack 286, win 65535, length 5496
00:07:51.946655 IP 99.84.126.86.443 > 10.0.2.15.40356: Flags [P.], seq 555973:558721, ack 286, win 65535, length 2748
00:07:51.946682 IP 10.0.2.15.40356 > 99.84.126.86.443: Flags [.], ack 550477, win 65535, length 0
00:07:51.946710 IP 10.0.2.15.40356 > 99.84.126.86.443: Flags [.], ack 555973, win 65535, length 0
00:07:51.946724 IP 10.0.2.15.40356 > 99.84.126.86.443: Flags [.], ack 558721, win 65535, length 0
00:07:51.947618 IP 99.84.126.86.443 > 10.0.2.15.40356: Flags [P.], seq 558721:562843, ack 286, win 65535, length 4122
00:07:51.947689 IP 99.84.126.86.443 > 10.0.2.15.40356: Flags [P.], seq 562843:568339, ack 286, win 65535, length 5496
00:07:51.947719 IP 10.0.2.15.40356 > 99.84.126.86.443: Flags [.], ack 562843, win 65535, length 0
00:07:51.947750 IP 10.0.2.15.40356 > 99.84.126.86.443: Flags [.], ack 568339, win 65535, length 0
00:07:51.948184 IP 99.84.126.86.443 > 10.0.2.15.40356: Flags [P.], seq 568339:571087, ack 286, win 65535, length 2748
00:07:51.948209 IP 10.0.2.15.40356 > 99.84.126.86.443: Flags [.], ack 571087, win 65535, length 0
00:07:51.951761 IP 99.84.126.86.443 > 10.0.2.15.40356: Flags [P.], seq 571087:577957, ack 286, win 65535, length 6870
00:07:51.951817 IP 99.84.126.86.443 > 10.0.2.15.40356: Flags [P.], seq 577957:580705, ack 286, win 65535, length 2748
00:07:51.951818 IP 99.84.126.86.443 > 10.0.2.15.40356: Flags [P.], seq 580705:582079, ack 286, win 65535, length 1374
00:07:51.951872 IP 10.0.2.15.40356 > 99.84.126.86.443: Flags [.], ack 577957, win 65535, length 0
00:07:51.951970 IP 10.0.2.15.40356 > 99.84.126.86.443: Flags [.], ack 580705, win 65535, length 0
00:07:51.951984 IP 10.0.2.15.40356 > 99.84.126.86.443: Flags [.], ack 582079, win 65535, length 0
00:07:51.952212 IP 99.84.126.86.443 > 10.0.2.15.40356: Flags [P.], seq 582079:583453, ack 286, win 65535, length 1374
00:07:51.952214 IP 99.84.126.86.443 > 10.0.2.15.40356: Flags [P.], seq 583453:587575, ack 286, win 65535, length 4122
00:07:51.952215 IP 99.84.126.86.443 > 10.0.2.15.40356: Flags [P.], seq 587575:588949, ack 286, win 65535, length 1374
00:07:51.952217 IP 99.84.126.86.443 > 10.0.2.15.40356: Flags [P.], seq 588949:598567, ack 286, win 65535, length 9618
00:07:51.952231 IP 10.0.2.15.40356 > 99.84.126.86.443: Flags [.], ack 583453, win 65535, length 0
00:07:51.952594 IP 10.0.2.15.40356 > 99.84.126.86.443: Flags [.], ack 587575, win 65535, length 0
00:07:51.952611 IP 10.0.2.15.40356 > 99.84.126.86.443: Flags [.], ack 588949, win 65535, length 0
00:07:51.952621 IP 10.0.2.15.40356 > 99.84.126.86.443: Flags [.], ack 598567, win 65535, length 0
00:07:51.952643 IP 99.84.126.86.443 > 10.0.2.15.40356: Flags [P.], seq 598567:602689, ack 286, win 65535, length 4122
00:07:51.952644 IP 99.84.126.86.443 > 10.0.2.15.40356: Flags [P.], seq 602689:604063, ack 286, win 65535, length 1374
00:07:51.952652 IP 10.0.2.15.40356 > 99.84.126.86.443: Flags [.], ack 602689, win 65535, length 0
00:07:51.952663 IP 10.0.2.15.40356 > 99.84.126.86.443: Flags [.], ack 604063, win 65535, length 0
00:07:51.956055 IP 99.84.126.86.443 > 10.0.2.15.40356: Flags [P.], seq 604063:626047, ack 286, win 65535, length 21984
00:07:51.956145 IP 10.0.2.15.40356 > 99.84.126.86.443: Flags [.], ack 626047, win 65535, length 0
00:07:51.956962 IP 99.84.126.86.443 > 10.0.2.15.40356: Flags [P.], seq 626047:659023, ack 286, win 65535, length 32976
00:07:51.956983 IP 10.0.2.15.40356 > 99.84.126.86.443: Flags [.], ack 659023, win 65535, length 0
00:07:51.959128 IP 99.84.126.86.443 > 10.0.2.15.40356: Flags [.], seq 659023:660483, ack 286, win 65535, length 1460
00:07:51.959154 IP 10.0.2.15.40356 > 99.84.126.86.443: Flags [.], ack 660483, win 65535, length 0
00:07:51.960091 IP 99.84.126.86.443 > 10.0.2.15.40356: Flags [P.], seq 660483:682381, ack 286, win 65535, length 21898
00:07:51.960303 IP 10.0.2.15.40356 > 99.84.126.86.443: Flags [.], ack 682381, win 65535, length 0
00:07:51.960752 IP 99.84.126.86.443 > 10.0.2.15.40356: Flags [P.], seq 682381:689251, ack 286, win 65535, length 6870
00:07:51.960756 IP 99.84.126.86.443 > 10.0.2.15.40356: Flags [P.], seq 689251:691999, ack 286, win 65535, length 2748
00:07:51.960760 IP 99.84.126.86.443 > 10.0.2.15.40356: Flags [P.], seq 691999:702991, ack 286, win 65535, length 10992
00:07:51.960903 IP 10.0.2.15.40356 > 99.84.126.86.443: Flags [.], ack 689251, win 65535, length 0
00:07:51.960938 IP 10.0.2.15.40356 > 99.84.126.86.443: Flags [.], ack 691999, win 65535, length 0
00:07:51.960955 IP 10.0.2.15.40356 > 99.84.126.86.443: Flags [.], ack 702991, win 65535, length 0
00:07:51.963190 IP 99.84.126.86.443 > 10.0.2.15.40356: Flags [P.], seq 702991:729097, ack 286, win 65535, length 26106
00:07:51.963217 IP 10.0.2.15.40356 > 99.84.126.86.443: Flags [.], ack 729097, win 65535, length 0

