13:19:18.966263 IP 10.0.2.15.51114 > 99.84.126.23.443: Flags [P.], seq 1663385721:1663386238, ack 58432002, win 64240, length 517
13:19:18.966838 IP 99.84.126.23.443 > 10.0.2.15.51114: Flags [.], ack 517, win 65535, length 0
13:19:18.982818 IP 99.84.126.23.443 > 10.0.2.15.51114: Flags [P.], seq 1:2749, ack 517, win 65535, length 2748
13:19:18.982844 IP 10.0.2.15.51114 > 99.84.126.23.443: Flags [.], ack 2749, win 62780, length 0
13:19:18.983776 IP 99.84.126.23.443 > 10.0.2.15.51114: Flags [P.], seq 2749:4123, ack 517, win 65535, length 1374
13:19:18.983791 IP 10.0.2.15.51114 > 99.84.126.23.443: Flags [.], ack 4123, win 62780, length 0
13:19:18.984909 IP 99.84.126.23.443 > 10.0.2.15.51114: Flags [P.], seq 4123:5497, ack 517, win 65535, length 1374
13:19:18.984928 IP 10.0.2.15.51114 > 99.84.126.23.443: Flags [.], ack 5497, win 62780, length 0
13:19:18.987485 IP 99.84.126.23.443 > 10.0.2.15.51114: Flags [P.], seq 5497:5824, ack 517, win 65535, length 327
13:19:18.987504 IP 10.0.2.15.51114 > 99.84.126.23.443: Flags [.], ack 5824, win 62780, length 0
13:19:18.987841 IP 10.0.2.15.51114 > 99.84.126.23.443: Flags [P.], seq 517:581, ack 5824, win 62780, length 64
13:19:18.988196 IP 99.84.126.23.443 > 10.0.2.15.51114: Flags [.], ack 581, win 65535, length 0
13:19:18.988280 IP 10.0.2.15.51114 > 99.84.126.23.443: Flags [P.], seq 581:627, ack 5824, win 62780, length 46
13:19:18.988304 IP 10.0.2.15.51114 > 99.84.126.23.443: Flags [P.], seq 627:676, ack 5824, win 62780, length 49
13:19:18.988419 IP 10.0.2.15.51114 > 99.84.126.23.443: Flags [P.], seq 676:711, ack 5824, win 62780, length 35
13:19:18.988559 IP 10.0.2.15.51114 > 99.84.126.23.443: Flags [P.], seq 711:771, ack 5824, win 62780, length 60
13:19:18.988716 IP 99.84.126.23.443 > 10.0.2.15.51114: Flags [.], ack 627, win 65535, length 0
13:19:18.988718 IP 99.84.126.23.443 > 10.0.2.15.51114: Flags [.], ack 676, win 65535, length 0
13:19:18.988718 IP 99.84.126.23.443 > 10.0.2.15.51114: Flags [.], ack 711, win 65535, length 0
13:19:18.988922 IP 99.84.126.23.443 > 10.0.2.15.51114: Flags [.], ack 771, win 65535, length 0
13:19:19.001100 IP 99.84.126.23.443 > 10.0.2.15.51114: Flags [P.], seq 5824:5886, ack 771, win 65535, length 62
13:19:19.001122 IP 10.0.2.15.51114 > 99.84.126.23.443: Flags [.], ack 5886, win 62780, length 0
13:19:19.001326 IP 10.0.2.15.51114 > 99.84.126.23.443: Flags [P.], seq 771:802, ack 5886, win 62780, length 31
13:19:19.001939 IP 99.84.126.23.443 > 10.0.2.15.51114: Flags [.], ack 802, win 65535, length 0
13:19:19.002190 IP 99.84.126.23.443 > 10.0.2.15.51114: Flags [P.], seq 5886:5917, ack 802, win 65535, length 31
13:19:19.002204 IP 10.0.2.15.51114 > 99.84.126.23.443: Flags [.], ack 5917, win 62780, length 0
13:19:19.029533 IP 99.84.126.23.443 > 10.0.2.15.51114: Flags [.], seq 5917:17597, ack 802, win 65535, length 11680
13:19:19.029574 IP 10.0.2.15.51114 > 99.84.126.23.443: Flags [.], ack 17597, win 56940, length 0
13:19:19.030086 IP 99.84.126.23.443 > 10.0.2.15.51114: Flags [.], seq 17597:30737, ack 802, win 65535, length 13140
13:19:19.030154 IP 10.0.2.15.51114 > 99.84.126.23.443: Flags [.], ack 30737, win 55480, length 0
13:19:19.030712 IP 99.84.126.23.443 > 10.0.2.15.51114: Flags [P.], seq 30737:33397, ack 802, win 65535, length 2660
13:19:19.030731 IP 10.0.2.15.51114 > 99.84.126.23.443: Flags [.], ack 33397, win 62780, length 0
13:19:19.032109 IP 99.84.126.23.443 > 10.0.2.15.51114: Flags [.], seq 33397:49457, ack 802, win 65535, length 16060
13:19:19.032131 IP 10.0.2.15.51114 > 99.84.126.23.443: Flags [.], ack 49457, win 54020, length 0
13:19:19.032425 IP 99.84.126.23.443 > 10.0.2.15.51114: Flags [P.], seq 49457:49885, ack 802, win 65535, length 428
13:19:19.032482 IP 10.0.2.15.51114 > 99.84.126.23.443: Flags [.], ack 49885, win 62780, length 0
13:19:19.043245 IP 99.84.126.23.443 > 10.0.2.15.51114: Flags [P.], seq 49885:59503, ack 802, win 65535, length 9618
13:19:19.043415 IP 10.0.2.15.51114 > 99.84.126.23.443: Flags [.], ack 59503, win 62780, length 0
13:19:19.045291 IP 99.84.126.23.443 > 10.0.2.15.51114: Flags [P.], seq 59503:66373, ack 802, win 65535, length 6870
13:19:19.046023 IP 99.84.126.23.443 > 10.0.2.15.51114: Flags [P.], seq 66373:75991, ack 802, win 65535, length 9618
13:19:19.046116 IP 10.0.2.15.51114 > 99.84.126.23.443: Flags [.], ack 75991, win 62780, length 0
13:19:19.046369 IP 99.84.126.23.443 > 10.0.2.15.51114: Flags [P.], seq 75991:81487, ack 802, win 65535, length 5496
13:19:19.046383 IP 10.0.2.15.51114 > 99.84.126.23.443: Flags [.], ack 81487, win 65535, length 0
13:19:19.047299 IP 99.84.126.23.443 > 10.0.2.15.51114: Flags [P.], seq 81487:86983, ack 802, win 65535, length 5496
13:19:19.047318 IP 10.0.2.15.51114 > 99.84.126.23.443: Flags [.], ack 86983, win 65535, length 0
13:19:19.048504 IP 99.84.126.23.443 > 10.0.2.15.51114: Flags [P.], seq 86983:95227, ack 802, win 65535, length 8244
13:19:19.048526 IP 10.0.2.15.51114 > 99.84.126.23.443: Flags [.], ack 95227, win 65535, length 0
13:19:19.048647 IP 99.84.126.23.443 > 10.0.2.15.51114: Flags [P.], seq 95227:96601, ack 802, win 65535, length 1374
13:19:19.048655 IP 10.0.2.15.51114 > 99.84.126.23.443: Flags [.], ack 96601, win 65535, length 0
13:19:19.049240 IP 99.84.126.23.443 > 10.0.2.15.51114: Flags [P.], seq 96601:102097, ack 802, win 65535, length 5496
13:19:19.049259 IP 10.0.2.15.51114 > 99.84.126.23.443: Flags [.], ack 102097, win 65535, length 0
13:19:19.050481 IP 99.84.126.23.443 > 10.0.2.15.51114: Flags [P.], seq 102097:113089, ack 802, win 65535, length 10992
13:19:19.050502 IP 10.0.2.15.51114 > 99.84.126.23.443: Flags [.], ack 113089, win 65535, length 0
13:19:19.051554 IP 99.84.126.23.443 > 10.0.2.15.51114: Flags [P.], seq 113089:119959, ack 802, win 65535, length 6870
13:19:19.051576 IP 10.0.2.15.51114 > 99.84.126.23.443: Flags [.], ack 119959, win 65535, length 0
13:19:19.056910 IP 99.84.126.23.443 > 10.0.2.15.51114: Flags [P.], seq 119959:135073, ack 802, win 65535, length 15114
13:19:19.057019 IP 10.0.2.15.51114 > 99.84.126.23.443: Flags [.], ack 135073, win 65535, length 0
13:19:19.057857 IP 99.84.126.23.443 > 10.0.2.15.51114: Flags [P.], seq 135073:141943, ack 802, win 65535, length 6870
13:19:19.057878 IP 10.0.2.15.51114 > 99.84.126.23.443: Flags [.], ack 141943, win 65535, length 0
13:19:19.058942 IP 99.84.126.23.443 > 10.0.2.15.51114: Flags [P.], seq 141943:148813, ack 802, win 65535, length 6870
13:19:19.058957 IP 10.0.2.15.51114 > 99.84.126.23.443: Flags [.], ack 148813, win 65535, length 0
13:19:19.059223 IP 99.84.126.23.443 > 10.0.2.15.51114: Flags [P.], seq 148813:151561, ack 802, win 65535, length 2748
13:19:19.059237 IP 10.0.2.15.51114 > 99.84.126.23.443: Flags [.], ack 151561, win 65535, length 0
13:19:19.060067 IP 99.84.126.23.443 > 10.0.2.15.51114: Flags [P.], seq 151561:158431, ack 802, win 65535, length 6870
13:19:19.060086 IP 10.0.2.15.51114 > 99.84.126.23.443: Flags [.], ack 158431, win 65535, length 0
13:19:19.061279 IP 99.84.126.23.443 > 10.0.2.15.51114: Flags [P.], seq 158431:165301, ack 802, win 65535, length 6870
13:19:19.061301 IP 10.0.2.15.51114 > 99.84.126.23.443: Flags [.], ack 165301, win 65535, length 0
13:19:19.061612 IP 99.84.126.23.443 > 10.0.2.15.51114: Flags [P.], seq 165301:168049, ack 802, win 65535, length 2748
13:19:19.061895 IP 10.0.2.15.51114 > 99.84.126.23.443: Flags [.], ack 168049, win 65535, length 0
13:19:19.062328 IP 99.84.126.23.443 > 10.0.2.15.51114: Flags [P.], seq 168049:172171, ack 802, win 65535, length 4122
13:19:19.062345 IP 10.0.2.15.51114 > 99.84.126.23.443: Flags [.], ack 172171, win 65535, length 0
13:19:19.064869 IP 99.84.126.23.443 > 10.0.2.15.51114: Flags [P.], seq 172171:188659, ack 802, win 65535, length 16488
13:19:19.064893 IP 10.0.2.15.51114 > 99.84.126.23.443: Flags [.], ack 188659, win 65535, length 0
13:19:19.065597 IP 99.84.126.23.443 > 10.0.2.15.51114: Flags [P.], seq 188659:195529, ack 802, win 65535, length 6870
13:19:19.065619 IP 10.0.2.15.51114 > 99.84.126.23.443: Flags [.], ack 195529, win 65535, length 0
13:19:19.066677 IP 99.84.126.23.443 > 10.0.2.15.51114: Flags [P.], seq 195529:206521, ack 802, win 65535, length 10992
13:19:19.066698 IP 10.0.2.15.51114 > 99.84.126.23.443: Flags [.], ack 206521, win 65535, length 0
13:19:19.069154 IP 99.84.126.23.443 > 10.0.2.15.51114: Flags [P.], seq 206521:214765, ack 802, win 65535, length 8244
13:19:19.069178 IP 10.0.2.15.51114 > 99.84.126.23.443: Flags [.], ack 214765, win 65535, length 0
13:19:19.069464 IP 99.84.126.23.443 > 10.0.2.15.51114: Flags [P.], seq 214765:228505, ack 802, win 65535, length 13740
13:19:19.069477 IP 10.0.2.15.51114 > 99.84.126.23.443: Flags [.], ack 228505, win 65535, length 0
13:19:19.069577 IP 99.84.126.23.443 > 10.0.2.15.51114: Flags [P.], seq 228505:232627, ack 802, win 65535, length 4122
13:19:19.069591 IP 10.0.2.15.51114 > 99.84.126.23.443: Flags [.], ack 232627, win 65535, length 0
13:19:19.070474 IP 99.84.126.23.443 > 10.0.2.15.51114: Flags [P.], seq 232627:244993, ack 802, win 65535, length 12366
13:19:19.070498 IP 10.0.2.15.51114 > 99.84.126.23.443: Flags [.], ack 244993, win 65535, length 0
13:19:19.070792 IP 99.84.126.23.443 > 10.0.2.15.51114: Flags [P.], seq 244993:247741, ack 802, win 65535, length 2748
13:19:19.070842 IP 10.0.2.15.51114 > 99.84.126.23.443: Flags [.], ack 247741, win 65535, length 0
13:19:19.071140 IP 99.84.126.23.443 > 10.0.2.15.51114: Flags [P.], seq 247741:260107, ack 802, win 65535, length 12366
13:19:19.071158 IP 10.0.2.15.51114 > 99.84.126.23.443: Flags [.], ack 260107, win 65535, length 0
13:19:19.071913 IP 99.84.126.23.443 > 10.0.2.15.51114: Flags [P.], seq 260107:265603, ack 802, win 65535, length 5496
13:19:19.071934 IP 10.0.2.15.51114 > 99.84.126.23.443: Flags [.], ack 265603, win 65535, length 0
13:19:19.072465 IP 99.84.126.23.443 > 10.0.2.15.51114: Flags [P.], seq 265603:279343, ack 802, win 65535, length 13740
13:19:19.072486 IP 10.0.2.15.51114 > 99.84.126.23.443: Flags [.], ack 279343, win 65535, length 0
13:19:19.072596 IP 99.84.126.23.443 > 10.0.2.15.51114: Flags [P.], seq 279343:280717, ack 802, win 65535, length 1374
13:19:19.072607 IP 10.0.2.15.51114 > 99.84.126.23.443: Flags [.], ack 280717, win 65535, length 0
13:19:19.073580 IP 99.84.126.23.443 > 10.0.2.15.51114: Flags [P.], seq 280717:290335, ack 802, win 65535, length 9618
13:19:19.073583 IP 99.84.126.23.443 > 10.0.2.15.51114: Flags [P.], seq 290335:294457, ack 802, win 65535, length 4122
13:19:19.073609 IP 10.0.2.15.51114 > 99.84.126.23.443: Flags [.], ack 290335, win 65535, length 0
13:19:19.073636 IP 10.0.2.15.51114 > 99.84.126.23.443: Flags [.], ack 294457, win 65535, length 0
13:19:19.074144 IP 99.84.126.23.443 > 10.0.2.15.51114: Flags [P.], seq 294457:302701, ack 802, win 65535, length 8244
13:19:19.074165 IP 10.0.2.15.51114 > 99.84.126.23.443: Flags [.], ack 302701, win 65535, length 0
13:19:19.074548 IP 99.84.126.23.443 > 10.0.2.15.51114: Flags [P.], seq 302701:308197, ack 802, win 65535, length 5496
13:19:19.074566 IP 10.0.2.15.51114 > 99.84.126.23.443: Flags [.], ack 308197, win 65535, length 0
13:19:19.074797 IP 99.84.126.23.443 > 10.0.2.15.51114: Flags [P.], seq 308197:315067, ack 802, win 65535, length 6870
13:19:19.074810 IP 10.0.2.15.51114 > 99.84.126.23.443: Flags [.], ack 315067, win 65535, length 0
13:19:19.075901 IP 99.84.126.23.443 > 10.0.2.15.51114: Flags [.], seq 315067:323827, ack 802, win 65535, length 8760
13:19:19.076034 IP 99.84.126.23.443 > 10.0.2.15.51114: Flags [P.], seq 323827:326059, ack 802, win 65535, length 2232
13:19:19.076036 IP 99.84.126.23.443 > 10.0.2.15.51114: Flags [P.], seq 326059:330181, ack 802, win 65535, length 4122
13:19:19.076172 IP 10.0.2.15.51114 > 99.84.126.23.443: Flags [.], ack 330181, win 65535, length 0
13:19:19.078012 IP 99.84.126.23.443 > 10.0.2.15.51114: Flags [P.], seq 330181:334303, ack 802, win 65535, length 4122
13:19:19.078043 IP 10.0.2.15.51114 > 99.84.126.23.443: Flags [.], ack 334303, win 65535, length 0
13:19:19.081057 IP 99.84.126.23.443 > 10.0.2.15.51114: Flags [P.], seq 334303:368653, ack 802, win 65535, length 34350
13:19:19.081077 IP 10.0.2.15.51114 > 99.84.126.23.443: Flags [.], ack 368653, win 65535, length 0
13:19:19.081672 IP 99.84.126.23.443 > 10.0.2.15.51114: Flags [P.], seq 368653:381019, ack 802, win 65535, length 12366
13:19:19.081686 IP 10.0.2.15.51114 > 99.84.126.23.443: Flags [.], ack 381019, win 65535, length 0
13:19:19.082782 IP 99.84.126.23.443 > 10.0.2.15.51114: Flags [P.], seq 381019:393385, ack 802, win 65535, length 12366
13:19:19.082798 IP 10.0.2.15.51114 > 99.84.126.23.443: Flags [.], ack 393385, win 65535, length 0
13:19:19.082840 IP 99.84.126.23.443 > 10.0.2.15.51114: Flags [P.], seq 393385:396133, ack 802, win 65535, length 2748
13:19:19.082848 IP 10.0.2.15.51114 > 99.84.126.23.443: Flags [.], ack 396133, win 65535, length 0
13:19:19.084447 IP 99.84.126.23.443 > 10.0.2.15.51114: Flags [P.], seq 396133:405751, ack 802, win 65535, length 9618
13:19:19.084464 IP 10.0.2.15.51114 > 99.84.126.23.443: Flags [.], ack 405751, win 65535, length 0
13:19:19.084593 IP 99.84.126.23.443 > 10.0.2.15.51114: Flags [P.], seq 405751:407125, ack 802, win 65535, length 1374
13:19:19.084599 IP 10.0.2.15.51114 > 99.84.126.23.443: Flags [.], ack 407125, win 65535, length 0
13:19:19.086387 IP 99.84.126.23.443 > 10.0.2.15.51114: Flags [P.], seq 407125:411247, ack 802, win 65535, length 4122
13:19:19.086489 IP 10.0.2.15.51114 > 99.84.126.23.443: Flags [.], ack 411247, win 65535, length 0
13:19:19.086691 IP 99.84.126.23.443 > 10.0.2.15.51114: Flags [P.], seq 411247:415369, ack 802, win 65535, length 4122
13:19:19.086703 IP 10.0.2.15.51114 > 99.84.126.23.443: Flags [.], ack 415369, win 65535, length 0
13:19:19.089041 IP 99.84.126.23.443 > 10.0.2.15.51114: Flags [P.], seq 415369:440101, ack 802, win 65535, length 24732
13:19:19.089072 IP 10.0.2.15.51114 > 99.84.126.23.443: Flags [.], ack 440101, win 65535, length 0
13:19:19.089102 IP 99.84.126.23.443 > 10.0.2.15.51114: Flags [P.], seq 440101:445597, ack 802, win 65535, length 5496
13:19:19.089109 IP 10.0.2.15.51114 > 99.84.126.23.443: Flags [.], ack 445597, win 65535, length 0
13:19:19.089244 IP 99.84.126.23.443 > 10.0.2.15.51114: Flags [P.], seq 445597:448345, ack 802, win 65535, length 2748
13:19:19.089250 IP 10.0.2.15.51114 > 99.84.126.23.443: Flags [.], ack 448345, win 65535, length 0
13:19:19.089636 IP 99.84.126.23.443 > 10.0.2.15.51114: Flags [P.], seq 448345:453841, ack 802, win 65535, length 5496
13:19:19.089648 IP 10.0.2.15.51114 > 99.84.126.23.443: Flags [.], ack 453841, win 65535, length 0
13:19:19.090478 IP 99.84.126.23.443 > 10.0.2.15.51114: Flags [P.], seq 453841:464833, ack 802, win 65535, length 10992
13:19:19.090494 IP 10.0.2.15.51114 > 99.84.126.23.443: Flags [.], ack 464833, win 65535, length 0
13:19:19.090577 IP 99.84.126.23.443 > 10.0.2.15.51114: Flags [P.], seq 464833:467581, ack 802, win 65535, length 2748
13:19:19.090586 IP 10.0.2.15.51114 > 99.84.126.23.443: Flags [.], ack 467581, win 65535, length 0
13:19:19.090860 IP 99.84.126.23.443 > 10.0.2.15.51114: Flags [P.], seq 467581:475825, ack 802, win 65535, length 8244
13:19:19.090871 IP 10.0.2.15.51114 > 99.84.126.23.443: Flags [.], ack 475825, win 65535, length 0
13:19:19.091022 IP 99.84.126.23.443 > 10.0.2.15.51114: Flags [.], seq 475825:478745, ack 802, win 65535, length 2920
13:19:19.091027 IP 10.0.2.15.51114 > 99.84.126.23.443: Flags [.], ack 478745, win 65535, length 0
13:19:19.091714 IP 99.84.126.23.443 > 10.0.2.15.51114: Flags [P.], seq 478745:481321, ack 802, win 65535, length 2576
13:19:19.091717 IP 99.84.126.23.443 > 10.0.2.15.51114: Flags [P.], seq 481321:489565, ack 802, win 65535, length 8244
13:19:19.091734 IP 10.0.2.15.51114 > 99.84.126.23.443: Flags [.], ack 481321, win 65535, length 0
13:19:19.091754 IP 10.0.2.15.51114 > 99.84.126.23.443: Flags [.], ack 489565, win 65535, length 0
13:19:19.091774 IP 99.84.126.23.443 > 10.0.2.15.51114: Flags [P.], seq 489565:493687, ack 802, win 65535, length 4122
13:19:19.091779 IP 10.0.2.15.51114 > 99.84.126.23.443: Flags [.], ack 493687, win 65535, length 0
13:19:19.092938 IP 99.84.126.23.443 > 10.0.2.15.51114: Flags [P.], seq 493687:497809, ack 802, win 65535, length 4122
13:19:19.093118 IP 10.0.2.15.51114 > 99.84.126.23.443: Flags [.], ack 497809, win 65535, length 0

