19:33:19.232659 IP 10.0.2.15.45662 > 140.233.253.2.53: 32725+ A? www.espn.com. (30)
19:33:19.232706 IP 10.0.2.15.45662 > 140.233.253.2.53: 5330+ AAAA? www.espn.com. (30)
19:33:19.237788 IP 140.233.253.2.53 > 10.0.2.15.45662: 32725 4/0/0 A 13.224.212.80, A 13.224.212.45, A 13.224.212.47, A 13.224.212.128 (94)
19:33:19.238909 IP 140.233.253.2.53 > 10.0.2.15.45662: 5330 8/0/0 AAAA 2600:9000:20ed:6800:e:fe33:5580:93a1, AAAA 2600:9000:20ed:7400:e:fe33:5580:93a1, AAAA 2600:9000:20ed:2e00:e:fe33:5580:93a1, AAAA 2600:9000:20ed:4800:e:fe33:5580:93a1, AAAA 2600:9000:20ed:1e00:e:fe33:5580:93a1, AAAA 2600:9000:20ed:ca00:e:fe33:5580:93a1, AAAA 2600:9000:20ed:5600:e:fe33:5580:93a1, AAAA 2600:9000:20ed:a800:e:fe33:5580:93a1 (254)
19:33:19.239708 IP 10.0.2.15.39328 > 13.224.212.80.443: Flags [S], seq 106736633, win 64240, options [mss 1460,sackOK,TS val 3875330422 ecr 0,nop,wscale 6], length 0
19:33:19.255570 IP 13.224.212.80.443 > 10.0.2.15.39328: Flags [S.], seq 173888001, ack 106736634, win 65535, options [mss 1460], length 0
19:33:19.255617 IP 10.0.2.15.39328 > 13.224.212.80.443: Flags [.], ack 1, win 64240, length 0
19:33:19.263964 IP 10.0.2.15.39328 > 13.224.212.80.443: Flags [P.], seq 1:518, ack 1, win 64240, length 517
19:33:19.264214 IP 13.224.212.80.443 > 10.0.2.15.39328: Flags [.], ack 518, win 65535, length 0
19:33:19.282720 IP 13.224.212.80.443 > 10.0.2.15.39328: Flags [P.], seq 1:2749, ack 518, win 65535, length 2748
19:33:19.282742 IP 10.0.2.15.39328 > 13.224.212.80.443: Flags [.], ack 2749, win 62780, length 0
19:33:19.283325 IP 13.224.212.80.443 > 10.0.2.15.39328: Flags [P.], seq 2749:4123, ack 518, win 65535, length 1374
19:33:19.283347 IP 10.0.2.15.39328 > 13.224.212.80.443: Flags [.], ack 4123, win 61406, length 0
19:33:19.284654 IP 13.224.212.80.443 > 10.0.2.15.39328: Flags [P.], seq 4123:5497, ack 518, win 65535, length 1374
19:33:19.284674 IP 10.0.2.15.39328 > 13.224.212.80.443: Flags [.], ack 5497, win 63204, length 0
19:33:19.285500 IP 13.224.212.80.443 > 10.0.2.15.39328: Flags [P.], seq 5497:5824, ack 518, win 65535, length 327
19:33:19.285524 IP 10.0.2.15.39328 > 13.224.212.80.443: Flags [.], ack 5824, win 63204, length 0
19:33:19.286767 IP 10.0.2.15.39328 > 13.224.212.80.443: Flags [P.], seq 518:582, ack 5824, win 63204, length 64
19:33:19.287073 IP 13.224.212.80.443 > 10.0.2.15.39328: Flags [.], ack 582, win 65535, length 0
19:33:19.287125 IP 10.0.2.15.39328 > 13.224.212.80.443: Flags [P.], seq 582:628, ack 5824, win 63204, length 46
19:33:19.287155 IP 10.0.2.15.39328 > 13.224.212.80.443: Flags [P.], seq 628:677, ack 5824, win 63204, length 49
19:33:19.287361 IP 13.224.212.80.443 > 10.0.2.15.39328: Flags [.], ack 628, win 65535, length 0
19:33:19.287362 IP 13.224.212.80.443 > 10.0.2.15.39328: Flags [.], ack 677, win 65535, length 0
19:33:19.287379 IP 10.0.2.15.39328 > 13.224.212.80.443: Flags [P.], seq 677:772, ack 5824, win 63204, length 95
19:33:19.287905 IP 13.224.212.80.443 > 10.0.2.15.39328: Flags [.], ack 772, win 65535, length 0
19:33:19.301922 IP 13.224.212.80.443 > 10.0.2.15.39328: Flags [P.], seq 5824:5917, ack 772, win 65535, length 93
19:33:19.301947 IP 10.0.2.15.39328 > 13.224.212.80.443: Flags [.], ack 5917, win 63204, length 0
19:33:19.302222 IP 10.0.2.15.39328 > 13.224.212.80.443: Flags [P.], seq 772:803, ack 5917, win 63204, length 31
19:33:19.302552 IP 13.224.212.80.443 > 10.0.2.15.39328: Flags [.], ack 803, win 65535, length 0
19:33:19.322435 IP 13.224.212.80.443 > 10.0.2.15.39328: Flags [.], seq 5917:16137, ack 803, win 65535, length 10220
19:33:19.322470 IP 10.0.2.15.39328 > 13.224.212.80.443: Flags [.], ack 16137, win 58400, length 0
19:33:19.322726 IP 13.224.212.80.443 > 10.0.2.15.39328: Flags [.], seq 16137:21977, ack 803, win 65535, length 5840
19:33:19.322753 IP 10.0.2.15.39328 > 13.224.212.80.443: Flags [.], ack 21977, win 56940, length 0
19:33:19.322859 IP 13.224.212.80.443 > 10.0.2.15.39328: Flags [.], seq 21977:27817, ack 803, win 65535, length 5840
19:33:19.322867 IP 10.0.2.15.39328 > 13.224.212.80.443: Flags [.], ack 27817, win 61320, length 0
19:33:19.322976 IP 13.224.212.80.443 > 10.0.2.15.39328: Flags [P.], seq 27817:37437, ack 803, win 65535, length 9620
19:33:19.322981 IP 10.0.2.15.39328 > 13.224.212.80.443: Flags [.], ack 37437, win 54020, length 0
19:33:19.323912 IP 13.224.212.80.443 > 10.0.2.15.39328: Flags [P.], seq 37437:42933, ack 803, win 65535, length 5496
19:33:19.323926 IP 10.0.2.15.39328 > 13.224.212.80.443: Flags [.], ack 42933, win 61320, length 0
19:33:19.324507 IP 13.224.212.80.443 > 10.0.2.15.39328: Flags [P.], seq 42933:48429, ack 803, win 65535, length 5496
19:33:19.324545 IP 10.0.2.15.39328 > 13.224.212.80.443: Flags [.], ack 48429, win 61320, length 0
19:33:19.324646 IP 13.224.212.80.443 > 10.0.2.15.39328: Flags [P.], seq 48429:49803, ack 803, win 65535, length 1374
19:33:19.324692 IP 10.0.2.15.39328 > 13.224.212.80.443: Flags [.], ack 49803, win 62780, length 0
19:33:19.333019 IP 13.224.212.80.443 > 10.0.2.15.39328: Flags [P.], seq 49803:52551, ack 803, win 65535, length 2748
19:33:19.333042 IP 10.0.2.15.39328 > 13.224.212.80.443: Flags [.], ack 52551, win 62780, length 0
19:33:19.333939 IP 13.224.212.80.443 > 10.0.2.15.39328: Flags [P.], seq 52551:60795, ack 803, win 65535, length 8244
19:33:19.333941 IP 13.224.212.80.443 > 10.0.2.15.39328: Flags [P.], seq 60795:62169, ack 803, win 65535, length 1374
19:33:19.334036 IP 10.0.2.15.39328 > 13.224.212.80.443: Flags [.], ack 62169, win 58400, length 0
19:33:19.335967 IP 13.224.212.80.443 > 10.0.2.15.39328: Flags [P.], seq 62169:69039, ack 803, win 65535, length 6870
19:33:19.336002 IP 10.0.2.15.39328 > 13.224.212.80.443: Flags [.], ack 69039, win 59860, length 0
19:33:19.338033 IP 13.224.212.80.443 > 10.0.2.15.39328: Flags [P.], seq 69039:75909, ack 803, win 65535, length 6870
19:33:19.338036 IP 13.224.212.80.443 > 10.0.2.15.39328: Flags [P.], seq 75909:82779, ack 803, win 65535, length 6870
19:33:19.338434 IP 10.0.2.15.39328 > 13.224.212.80.443: Flags [.], ack 82779, win 62780, length 0
19:33:19.338834 IP 13.224.212.80.443 > 10.0.2.15.39328: Flags [P.], seq 82779:91023, ack 803, win 65535, length 8244
19:33:19.339567 IP 13.224.212.80.443 > 10.0.2.15.39328: Flags [P.], seq 91023:97893, ack 803, win 65535, length 6870
19:33:19.339848 IP 10.0.2.15.39328 > 13.224.212.80.443: Flags [.], ack 97893, win 65535, length 0
19:33:19.340816 IP 13.224.212.80.443 > 10.0.2.15.39328: Flags [P.], seq 97893:106137, ack 803, win 65535, length 8244
19:33:19.340817 IP 13.224.212.80.443 > 10.0.2.15.39328: Flags [P.], seq 106137:107511, ack 803, win 65535, length 1374
19:33:19.340854 IP 10.0.2.15.39328 > 13.224.212.80.443: Flags [.], ack 107511, win 65535, length 0
19:33:19.341704 IP 13.224.212.80.443 > 10.0.2.15.39328: Flags [P.], seq 107511:113007, ack 803, win 65535, length 5496
19:33:19.341707 IP 13.224.212.80.443 > 10.0.2.15.39328: Flags [P.], seq 113007:114381, ack 803, win 65535, length 1374
19:33:19.341731 IP 10.0.2.15.39328 > 13.224.212.80.443: Flags [.], ack 113007, win 65535, length 0
19:33:19.341769 IP 10.0.2.15.39328 > 13.224.212.80.443: Flags [.], ack 114381, win 65535, length 0
19:33:19.343170 IP 13.224.212.80.443 > 10.0.2.15.39328: Flags [P.], seq 114381:121251, ack 803, win 65535, length 6870
19:33:19.343173 IP 13.224.212.80.443 > 10.0.2.15.39328: Flags [P.], seq 121251:123999, ack 803, win 65535, length 2748
19:33:19.343200 IP 10.0.2.15.39328 > 13.224.212.80.443: Flags [.], ack 121251, win 65535, length 0
19:33:19.343273 IP 10.0.2.15.39328 > 13.224.212.80.443: Flags [.], ack 123999, win 65535, length 0
19:33:19.344285 IP 13.224.212.80.443 > 10.0.2.15.39328: Flags [P.], seq 123999:125373, ack 803, win 65535, length 1374
19:33:19.344303 IP 10.0.2.15.39328 > 13.224.212.80.443: Flags [.], ack 125373, win 65535, length 0
19:33:19.346816 IP 13.224.212.80.443 > 10.0.2.15.39328: Flags [P.], seq 125373:132243, ack 803, win 65535, length 6870
19:33:19.346851 IP 10.0.2.15.39328 > 13.224.212.80.443: Flags [.], ack 132243, win 65535, length 0
19:33:19.348165 IP 13.224.212.80.443 > 10.0.2.15.39328: Flags [P.], seq 132243:140487, ack 803, win 65535, length 8244
19:33:19.348187 IP 10.0.2.15.39328 > 13.224.212.80.443: Flags [.], ack 140487, win 65535, length 0
19:33:19.349854 IP 13.224.212.80.443 > 10.0.2.15.39328: Flags [P.], seq 140487:145983, ack 803, win 65535, length 5496
19:33:19.349858 IP 13.224.212.80.443 > 10.0.2.15.39328: Flags [P.], seq 145983:148731, ack 803, win 65535, length 2748
19:33:19.349882 IP 10.0.2.15.39328 > 13.224.212.80.443: Flags [.], ack 145983, win 65535, length 0
19:33:19.349959 IP 10.0.2.15.39328 > 13.224.212.80.443: Flags [.], ack 148731, win 65535, length 0
19:33:19.350306 IP 13.224.212.80.443 > 10.0.2.15.39328: Flags [P.], seq 148731:155601, ack 803, win 65535, length 6870
19:33:19.350309 IP 13.224.212.80.443 > 10.0.2.15.39328: Flags [P.], seq 155601:161097, ack 803, win 65535, length 5496
19:33:19.350320 IP 10.0.2.15.39328 > 13.224.212.80.443: Flags [.], ack 155601, win 65535, length 0
19:33:19.350338 IP 10.0.2.15.39328 > 13.224.212.80.443: Flags [.], ack 161097, win 65535, length 0
19:33:19.350365 IP 13.224.212.80.443 > 10.0.2.15.39328: Flags [P.], seq 161097:165219, ack 803, win 65535, length 4122
19:33:19.350371 IP 10.0.2.15.39328 > 13.224.212.80.443: Flags [.], ack 165219, win 65535, length 0
19:33:19.351986 IP 13.224.212.80.443 > 10.0.2.15.39328: Flags [P.], seq 165219:173463, ack 803, win 65535, length 8244
19:33:19.351988 IP 13.224.212.80.443 > 10.0.2.15.39328: Flags [P.], seq 173463:177585, ack 803, win 65535, length 4122
19:33:19.352008 IP 10.0.2.15.39328 > 13.224.212.80.443: Flags [.], ack 173463, win 65535, length 0
19:33:19.352038 IP 10.0.2.15.39328 > 13.224.212.80.443: Flags [.], ack 177585, win 65535, length 0
19:33:19.353180 IP 13.224.212.80.443 > 10.0.2.15.39328: Flags [P.], seq 177585:183081, ack 803, win 65535, length 5496
19:33:19.353183 IP 13.224.212.80.443 > 10.0.2.15.39328: Flags [P.], seq 183081:185829, ack 803, win 65535, length 2748
19:33:19.353184 IP 13.224.212.80.443 > 10.0.2.15.39328: Flags [.], seq 185829:190209, ack 803, win 65535, length 4380
19:33:19.353205 IP 10.0.2.15.39328 > 13.224.212.80.443: Flags [.], ack 183081, win 65535, length 0
19:33:19.353235 IP 10.0.2.15.39328 > 13.224.212.80.443: Flags [.], ack 185829, win 65535, length 0
19:33:19.353250 IP 10.0.2.15.39328 > 13.224.212.80.443: Flags [.], ack 190209, win 65535, length 0
19:33:19.353377 IP 13.224.212.80.443 > 10.0.2.15.39328: Flags [P.], seq 190209:192699, ack 803, win 65535, length 2490
19:33:19.353378 IP 13.224.212.80.443 > 10.0.2.15.39328: Flags [P.], seq 192699:194073, ack 803, win 65535, length 1374
19:33:19.353385 IP 10.0.2.15.39328 > 13.224.212.80.443: Flags [.], ack 192699, win 65535, length 0
19:33:19.353397 IP 10.0.2.15.39328 > 13.224.212.80.443: Flags [.], ack 194073, win 65535, length 0
19:33:19.355121 IP 13.224.212.80.443 > 10.0.2.15.39328: Flags [P.], seq 194073:200943, ack 803, win 65535, length 6870
19:33:19.355252 IP 10.0.2.15.39328 > 13.224.212.80.443: Flags [.], ack 200943, win 65535, length 0
19:33:19.355514 IP 13.224.212.80.443 > 10.0.2.15.39328: Flags [P.], seq 200943:207813, ack 803, win 65535, length 6870
19:33:19.355516 IP 13.224.212.80.443 > 10.0.2.15.39328: Flags [P.], seq 207813:211935, ack 803, win 65535, length 4122
19:33:19.355529 IP 10.0.2.15.39328 > 13.224.212.80.443: Flags [.], ack 207813, win 65535, length 0
19:33:19.355548 IP 10.0.2.15.39328 > 13.224.212.80.443: Flags [.], ack 211935, win 65535, length 0
19:33:19.356268 IP 13.224.212.80.443 > 10.0.2.15.39328: Flags [P.], seq 211935:217431, ack 803, win 65535, length 5496
19:33:19.356270 IP 13.224.212.80.443 > 10.0.2.15.39328: Flags [P.], seq 217431:218805, ack 803, win 65535, length 1374
19:33:19.356284 IP 10.0.2.15.39328 > 13.224.212.80.443: Flags [.], ack 217431, win 65535, length 0
19:33:19.356306 IP 10.0.2.15.39328 > 13.224.212.80.443: Flags [.], ack 218805, win 65535, length 0
19:33:19.357325 IP 13.224.212.80.443 > 10.0.2.15.39328: Flags [P.], seq 218805:225675, ack 803, win 65535, length 6870
19:33:19.357346 IP 10.0.2.15.39328 > 13.224.212.80.443: Flags [.], ack 225675, win 65535, length 0
19:33:19.358590 IP 13.224.212.80.443 > 10.0.2.15.39328: Flags [P.], seq 225675:232545, ack 803, win 65535, length 6870
19:33:19.358592 IP 13.224.212.80.443 > 10.0.2.15.39328: Flags [P.], seq 232545:235293, ack 803, win 65535, length 2748
19:33:19.358606 IP 10.0.2.15.39328 > 13.224.212.80.443: Flags [.], ack 232545, win 65535, length 0
19:33:19.358634 IP 10.0.2.15.39328 > 13.224.212.80.443: Flags [.], ack 235293, win 65535, length 0
19:33:19.359228 IP 13.224.212.80.443 > 10.0.2.15.39328: Flags [P.], seq 235293:240789, ack 803, win 65535, length 5496
19:33:19.359244 IP 10.0.2.15.39328 > 13.224.212.80.443: Flags [.], ack 240789, win 65535, length 0
19:33:19.359510 IP 13.224.212.80.443 > 10.0.2.15.39328: Flags [P.], seq 240789:243537, ack 803, win 65535, length 2748
19:33:19.359511 IP 13.224.212.80.443 > 10.0.2.15.39328: Flags [P.], seq 243537:246285, ack 803, win 65535, length 2748
19:33:19.359512 IP 13.224.212.80.443 > 10.0.2.15.39328: Flags [P.], seq 246285:249033, ack 803, win 65535, length 2748
19:33:19.359526 IP 10.0.2.15.39328 > 13.224.212.80.443: Flags [.], ack 243537, win 65535, length 0
19:33:19.359602 IP 10.0.2.15.39328 > 13.224.212.80.443: Flags [.], ack 246285, win 65535, length 0
19:33:19.359656 IP 10.0.2.15.39328 > 13.224.212.80.443: Flags [.], ack 249033, win 65535, length 0
19:33:19.359758 IP 13.224.212.80.443 > 10.0.2.15.39328: Flags [P.], seq 249033:253155, ack 803, win 65535, length 4122
19:33:19.359762 IP 10.0.2.15.39328 > 13.224.212.80.443: Flags [.], ack 253155, win 65535, length 0
19:33:19.360559 IP 13.224.212.80.443 > 10.0.2.15.39328: Flags [P.], seq 253155:258651, ack 803, win 65535, length 5496
19:33:19.360577 IP 10.0.2.15.39328 > 13.224.212.80.443: Flags [.], ack 258651, win 65535, length 0
19:33:19.360840 IP 13.224.212.80.443 > 10.0.2.15.39328: Flags [P.], seq 258651:261399, ack 803, win 65535, length 2748
19:33:19.360851 IP 10.0.2.15.39328 > 13.224.212.80.443: Flags [.], ack 261399, win 65535, length 0
19:33:19.361421 IP 13.224.212.80.443 > 10.0.2.15.39328: Flags [P.], seq 261399:268269, ack 803, win 65535, length 6870
19:33:19.361424 IP 13.224.212.80.443 > 10.0.2.15.39328: Flags [P.], seq 268269:271017, ack 803, win 65535, length 2748
19:33:19.361446 IP 10.0.2.15.39328 > 13.224.212.80.443: Flags [.], ack 268269, win 65535, length 0
19:33:19.361470 IP 10.0.2.15.39328 > 13.224.212.80.443: Flags [.], ack 271017, win 65535, length 0
19:33:19.362080 IP 13.224.212.80.443 > 10.0.2.15.39328: Flags [P.], seq 271017:276513, ack 803, win 65535, length 5496
19:33:19.362082 IP 13.224.212.80.443 > 10.0.2.15.39328: Flags [P.], seq 276513:279261, ack 803, win 65535, length 2748
19:33:19.362098 IP 10.0.2.15.39328 > 13.224.212.80.443: Flags [.], ack 276513, win 65535, length 0
19:33:19.362325 IP 10.0.2.15.39328 > 13.224.212.80.443: Flags [.], ack 279261, win 65535, length 0
19:33:19.362714 IP 13.224.212.80.443 > 10.0.2.15.39328: Flags [P.], seq 279261:282009, ack 803, win 65535, length 2748
19:33:19.362716 IP 13.224.212.80.443 > 10.0.2.15.39328: Flags [P.], seq 282009:287505, ack 803, win 65535, length 5496
19:33:19.362717 IP 13.224.212.80.443 > 10.0.2.15.39328: Flags [P.], seq 287505:291627, ack 803, win 65535, length 4122
19:33:19.362732 IP 10.0.2.15.39328 > 13.224.212.80.443: Flags [.], ack 282009, win 65535, length 0
19:33:19.362755 IP 10.0.2.15.39328 > 13.224.212.80.443: Flags [.], ack 287505, win 65535, length 0
19:33:19.362768 IP 10.0.2.15.39328 > 13.224.212.80.443: Flags [.], ack 291627, win 65535, length 0
19:33:19.362910 IP 13.224.212.80.443 > 10.0.2.15.39328: Flags [P.], seq 291627:294375, ack 803, win 65535, length 2748
19:33:19.362919 IP 10.0.2.15.39328 > 13.224.212.80.443: Flags [.], ack 294375, win 65535, length 0
19:33:19.364076 IP 13.224.212.80.443 > 10.0.2.15.39328: Flags [P.], seq 294375:298497, ack 803, win 65535, length 4122
19:33:19.364092 IP 10.0.2.15.39328 > 13.224.212.80.443: Flags [.], ack 298497, win 65535, length 0
19:33:19.364290 IP 13.224.212.80.443 > 10.0.2.15.39328: Flags [P.], seq 298497:303993, ack 803, win 65535, length 5496
19:33:19.364298 IP 10.0.2.15.39328 > 13.224.212.80.443: Flags [.], ack 303993, win 65535, length 0
19:33:19.364395 IP 13.224.212.80.443 > 10.0.2.15.39328: Flags [P.], seq 303993:306741, ack 803, win 65535, length 2748
19:33:19.364400 IP 10.0.2.15.39328 > 13.224.212.80.443: Flags [.], ack 306741, win 65535, length 0
19:33:19.365916 IP 13.224.212.80.443 > 10.0.2.15.39328: Flags [P.], seq 306741:317733, ack 803, win 65535, length 10992
19:33:19.365975 IP 10.0.2.15.39328 > 13.224.212.80.443: Flags [.], ack 317733, win 65535, length 0
19:33:19.366025 IP 13.224.212.80.443 > 10.0.2.15.39328: Flags [P.], seq 317733:320481, ack 803, win 65535, length 2748
19:33:19.366026 IP 13.224.212.80.443 > 10.0.2.15.39328: Flags [P.], seq 320481:325977, ack 803, win 65535, length 5496
19:33:19.366037 IP 10.0.2.15.39328 > 13.224.212.80.443: Flags [.], ack 320481, win 65535, length 0
19:33:19.366121 IP 10.0.2.15.39328 > 13.224.212.80.443: Flags [.], ack 325977, win 65535, length 0
19:33:19.366547 IP 13.224.212.80.443 > 10.0.2.15.39328: Flags [P.], seq 325977:330099, ack 803, win 65535, length 4122
19:33:19.366550 IP 13.224.212.80.443 > 10.0.2.15.39328: Flags [P.], seq 330099:332847, ack 803, win 65535, length 2748
19:33:19.366551 IP 13.224.212.80.443 > 10.0.2.15.39328: Flags [P.], seq 332847:335595, ack 803, win 65535, length 2748
19:33:19.366575 IP 10.0.2.15.39328 > 13.224.212.80.443: Flags [.], ack 330099, win 65535, length 0
19:33:19.366621 IP 10.0.2.15.39328 > 13.224.212.80.443: Flags [.], ack 332847, win 65535, length 0
19:33:19.366686 IP 10.0.2.15.39328 > 13.224.212.80.443: Flags [.], ack 335595, win 65535, length 0
19:33:19.367256 IP 13.224.212.80.443 > 10.0.2.15.39328: Flags [P.], seq 335595:338343, ack 803, win 65535, length 2748
19:33:19.367258 IP 13.224.212.80.443 > 10.0.2.15.39328: Flags [P.], seq 338343:345213, ack 803, win 65535, length 6870
19:33:19.367270 IP 10.0.2.15.39328 > 13.224.212.80.443: Flags [.], ack 338343, win 65535, length 0
19:33:19.367289 IP 10.0.2.15.39328 > 13.224.212.80.443: Flags [.], ack 345213, win 65535, length 0
19:33:19.367466 IP 13.224.212.80.443 > 10.0.2.15.39328: Flags [P.], seq 345213:349335, ack 803, win 65535, length 4122
19:33:19.367476 IP 10.0.2.15.39328 > 13.224.212.80.443: Flags [.], ack 349335, win 65535, length 0
19:33:19.367654 IP 13.224.212.80.443 > 10.0.2.15.39328: Flags [P.], seq 349335:352083, ack 803, win 65535, length 2748
19:33:19.367655 IP 13.224.212.80.443 > 10.0.2.15.39328: Flags [P.], seq 352083:353457, ack 803, win 65535, length 1374
19:33:19.367667 IP 10.0.2.15.39328 > 13.224.212.80.443: Flags [.], ack 352083, win 65535, length 0
19:33:19.367681 IP 10.0.2.15.39328 > 13.224.212.80.443: Flags [.], ack 353457, win 65535, length 0
19:33:19.368827 IP 13.224.212.80.443 > 10.0.2.15.39328: Flags [P.], seq 353457:363075, ack 803, win 65535, length 9618
19:33:19.368829 IP 13.224.212.80.443 > 10.0.2.15.39328: Flags [P.], seq 363075:365823, ack 803, win 65535, length 2748
19:33:19.368857 IP 10.0.2.15.39328 > 13.224.212.80.443: Flags [.], ack 363075, win 65535, length 0
19:33:19.368881 IP 10.0.2.15.39328 > 13.224.212.80.443: Flags [.], ack 365823, win 65535, length 0
19:33:19.368900 IP 13.224.212.80.443 > 10.0.2.15.39328: Flags [P.], seq 365823:368571, ack 803, win 65535, length 2748
19:33:19.368906 IP 10.0.2.15.39328 > 13.224.212.80.443: Flags [.], ack 368571, win 65535, length 0
19:33:19.369228 IP 13.224.212.80.443 > 10.0.2.15.39328: Flags [P.], seq 368571:371319, ack 803, win 65535, length 2748
19:33:19.369230 IP 13.224.212.80.443 > 10.0.2.15.39328: Flags [P.], seq 371319:374067, ack 803, win 65535, length 2748
19:33:19.369276 IP 10.0.2.15.39328 > 13.224.212.80.443: Flags [.], ack 371319, win 65535, length 0
19:33:19.369320 IP 10.0.2.15.39328 > 13.224.212.80.443: Flags [.], ack 374067, win 65535, length 0
19:33:19.369451 IP 13.224.212.80.443 > 10.0.2.15.39328: Flags [P.], seq 374067:380937, ack 803, win 65535, length 6870
19:33:19.369461 IP 10.0.2.15.39328 > 13.224.212.80.443: Flags [.], ack 380937, win 65535, length 0
19:33:19.369699 IP 13.224.212.80.443 > 10.0.2.15.39328: Flags [P.], seq 380937:385059, ack 803, win 65535, length 4122
19:33:19.369710 IP 10.0.2.15.39328 > 13.224.212.80.443: Flags [.], ack 385059, win 65535, length 0
19:33:19.371125 IP 13.224.212.80.443 > 10.0.2.15.39328: Flags [P.], seq 385059:393303, ack 803, win 65535, length 8244
19:33:19.371199 IP 10.0.2.15.39328 > 13.224.212.80.443: Flags [.], ack 393303, win 65535, length 0
19:33:19.371608 IP 13.224.212.80.443 > 10.0.2.15.39328: Flags [P.], seq 393303:400173, ack 803, win 65535, length 6870
19:33:19.371610 IP 13.224.212.80.443 > 10.0.2.15.39328: Flags [P.], seq 400173:404295, ack 803, win 65535, length 4122
19:33:19.371622 IP 10.0.2.15.39328 > 13.224.212.80.443: Flags [.], ack 400173, win 65535, length 0
19:33:19.371709 IP 10.0.2.15.39328 > 13.224.212.80.443: Flags [.], ack 404295, win 65535, length 0
19:33:19.371733 IP 13.224.212.80.443 > 10.0.2.15.39328: Flags [P.], seq 404295:407043, ack 803, win 65535, length 2748
19:33:19.371740 IP 10.0.2.15.39328 > 13.224.212.80.443: Flags [.], ack 407043, win 65535, length 0
19:33:19.372496 IP 13.224.212.80.443 > 10.0.2.15.39328: Flags [P.], seq 407043:413913, ack 803, win 65535, length 6870
19:33:19.372540 IP 10.0.2.15.39328 > 13.224.212.80.443: Flags [.], ack 413913, win 65535, length 0
19:33:19.372855 IP 13.224.212.80.443 > 10.0.2.15.39328: Flags [P.], seq 413913:418035, ack 803, win 65535, length 4122
19:33:19.372857 IP 13.224.212.80.443 > 10.0.2.15.39328: Flags [P.], seq 418035:420783, ack 803, win 65535, length 2748
19:33:19.372935 IP 10.0.2.15.39328 > 13.224.212.80.443: Flags [.], ack 418035, win 65535, length 0
19:33:19.373006 IP 10.0.2.15.39328 > 13.224.212.80.443: Flags [.], ack 420783, win 65535, length 0
19:33:19.373256 IP 13.224.212.80.443 > 10.0.2.15.39328: Flags [P.], seq 420783:424905, ack 803, win 65535, length 4122
19:33:19.373258 IP 13.224.212.80.443 > 10.0.2.15.39328: Flags [P.], seq 424905:427653, ack 803, win 65535, length 2748
19:33:19.373259 IP 13.224.212.80.443 > 10.0.2.15.39328: Flags [P.], seq 427653:433149, ack 803, win 65535, length 5496
19:33:19.373270 IP 10.0.2.15.39328 > 13.224.212.80.443: Flags [.], ack 424905, win 65535, length 0
19:33:19.373378 IP 10.0.2.15.39328 > 13.224.212.80.443: Flags [.], ack 427653, win 65535, length 0
19:33:19.373425 IP 10.0.2.15.39328 > 13.224.212.80.443: Flags [.], ack 433149, win 65535, length 0
19:33:19.373449 IP 13.224.212.80.443 > 10.0.2.15.39328: Flags [P.], seq 433149:435897, ack 803, win 65535, length 2748
19:33:19.373456 IP 10.0.2.15.39328 > 13.224.212.80.443: Flags [.], ack 435897, win 65535, length 0
19:33:19.373799 IP 13.224.212.80.443 > 10.0.2.15.39328: Flags [P.], seq 435897:438645, ack 803, win 65535, length 2748
19:33:19.373801 IP 13.224.212.80.443 > 10.0.2.15.39328: Flags [P.], seq 438645:442767, ack 803, win 65535, length 4122
19:33:19.373802 IP 13.224.212.80.443 > 10.0.2.15.39328: Flags [P.], seq 442767:445515, ack 803, win 65535, length 2748
19:33:19.373858 IP 10.0.2.15.39328 > 13.224.212.80.443: Flags [.], ack 438645, win 65535, length 0
19:33:19.373876 IP 10.0.2.15.39328 > 13.224.212.80.443: Flags [.], ack 442767, win 65535, length 0
19:33:19.373938 IP 10.0.2.15.39328 > 13.224.212.80.443: Flags [.], ack 445515, win 65535, length 0
19:33:19.374338 IP 13.224.212.80.443 > 10.0.2.15.39328: Flags [P.], seq 445515:449637, ack 803, win 65535, length 4122
19:33:19.374339 IP 13.224.212.80.443 > 10.0.2.15.39328: Flags [P.], seq 449637:452385, ack 803, win 65535, length 2748
19:33:19.374340 IP 13.224.212.80.443 > 10.0.2.15.39328: Flags [P.], seq 452385:455133, ack 803, win 65535, length 2748
19:33:19.374341 IP 13.224.212.80.443 > 10.0.2.15.39328: Flags [P.], seq 455133:459255, ack 803, win 65535, length 4122
19:33:19.374354 IP 10.0.2.15.39328 > 13.224.212.80.443: Flags [.], ack 449637, win 65535, length 0
19:33:19.374379 IP 10.0.2.15.39328 > 13.224.212.80.443: Flags [.], ack 452385, win 65535, length 0
19:33:19.374392 IP 10.0.2.15.39328 > 13.224.212.80.443: Flags [.], ack 455133, win 65535, length 0
19:33:19.374404 IP 10.0.2.15.39328 > 13.224.212.80.443: Flags [.], ack 459255, win 65535, length 0
19:33:19.374652 IP 13.224.212.80.443 > 10.0.2.15.39328: Flags [P.], seq 459255:463377, ack 803, win 65535, length 4122
19:33:19.374653 IP 13.224.212.80.443 > 10.0.2.15.39328: Flags [P.], seq 463377:464751, ack 803, win 65535, length 1374
19:33:19.374662 IP 10.0.2.15.39328 > 13.224.212.80.443: Flags [.], ack 463377, win 65535, length 0
19:33:19.374674 IP 10.0.2.15.39328 > 13.224.212.80.443: Flags [.], ack 464751, win 65535, length 0
19:33:19.375406 IP 13.224.212.80.443 > 10.0.2.15.39328: Flags [P.], seq 464751:468873, ack 803, win 65535, length 4122
19:33:19.375419 IP 10.0.2.15.39328 > 13.224.212.80.443: Flags [.], ack 468873, win 65535, length 0
19:33:19.375815 IP 13.224.212.80.443 > 10.0.2.15.39328: Flags [P.], seq 468873:472995, ack 803, win 65535, length 4122
19:33:19.375817 IP 13.224.212.80.443 > 10.0.2.15.39328: Flags [P.], seq 472995:474369, ack 803, win 65535, length 1374
19:33:19.375818 IP 13.224.212.80.443 > 10.0.2.15.39328: Flags [P.], seq 474369:475743, ack 803, win 65535, length 1374
19:33:19.375833 IP 10.0.2.15.39328 > 13.224.212.80.443: Flags [.], ack 472995, win 65535, length 0
19:33:19.375856 IP 10.0.2.15.39328 > 13.224.212.80.443: Flags [.], ack 474369, win 65535, length 0
19:33:19.375868 IP 10.0.2.15.39328 > 13.224.212.80.443: Flags [.], ack 475743, win 65535, length 0
19:33:19.376742 IP 13.224.212.80.443 > 10.0.2.15.39328: Flags [P.], seq 475743:481239, ack 803, win 65535, length 5496
19:33:19.376745 IP 13.224.212.80.443 > 10.0.2.15.39328: Flags [P.], seq 481239:486735, ack 803, win 65535, length 5496
19:33:19.376829 IP 10.0.2.15.39328 > 13.224.212.80.443: Flags [.], ack 481239, win 65535, length 0
19:33:19.377137 IP 10.0.2.15.39328 > 13.224.212.80.443: Flags [.], ack 486735, win 65535, length 0
19:33:19.377258 IP 13.224.212.80.443 > 10.0.2.15.39328: Flags [P.], seq 486735:492231, ack 803, win 65535, length 5496
19:33:19.377259 IP 13.224.212.80.443 > 10.0.2.15.39328: Flags [P.], seq 492231:494979, ack 803, win 65535, length 2748
19:33:19.377269 IP 10.0.2.15.39328 > 13.224.212.80.443: Flags [.], ack 492231, win 65535, length 0
19:33:19.377313 IP 10.0.2.15.39328 > 13.224.212.80.443: Flags [.], ack 494979, win 65535, length 0
19:33:19.378354 IP 13.224.212.80.443 > 10.0.2.15.39328: Flags [P.], seq 494979:499101, ack 803, win 65535, length 4122
19:33:19.378356 IP 13.224.212.80.443 > 10.0.2.15.39328: Flags [P.], seq 499101:501849, ack 803, win 65535, length 2748
19:33:19.378357 IP 13.224.212.80.443 > 10.0.2.15.39328: Flags [P.], seq 501849:507345, ack 803, win 65535, length 5496
19:33:19.378369 IP 10.0.2.15.39328 > 13.224.212.80.443: Flags [.], ack 499101, win 65535, length 0
19:33:19.378382 IP 10.0.2.15.39328 > 13.224.212.80.443: Flags [.], ack 501849, win 65535, length 0
19:33:19.378390 IP 10.0.2.15.39328 > 13.224.212.80.443: Flags [.], ack 507345, win 65535, length 0
19:33:19.378408 IP 13.224.212.80.443 > 10.0.2.15.39328: Flags [P.], seq 507345:512841, ack 803, win 65535, length 5496
19:33:19.378408 IP 13.224.212.80.443 > 10.0.2.15.39328: Flags [P.], seq 512841:515589, ack 803, win 65535, length 2748
19:33:19.378411 IP 10.0.2.15.39328 > 13.224.212.80.443: Flags [.], ack 512841, win 65535, length 0
19:33:19.378418 IP 10.0.2.15.39328 > 13.224.212.80.443: Flags [.], ack 515589, win 65535, length 0
19:33:19.378845 IP 13.224.212.80.443 > 10.0.2.15.39328: Flags [P.], seq 515589:521085, ack 803, win 65535, length 5496
19:33:19.378847 IP 13.224.212.80.443 > 10.0.2.15.39328: Flags [P.], seq 521085:522459, ack 803, win 65535, length 1374
19:33:19.378860 IP 10.0.2.15.39328 > 13.224.212.80.443: Flags [.], ack 521085, win 65535, length 0
19:33:19.378882 IP 10.0.2.15.39328 > 13.224.212.80.443: Flags [.], ack 522459, win 65535, length 0
19:33:19.379739 IP 13.224.212.80.443 > 10.0.2.15.39328: Flags [P.], seq 522459:530703, ack 803, win 65535, length 8244
19:33:19.379797 IP 10.0.2.15.39328 > 13.224.212.80.443: Flags [.], ack 530703, win 65535, length 0
19:33:19.380247 IP 13.224.212.80.443 > 10.0.2.15.39328: Flags [P.], seq 530703:533451, ack 803, win 65535, length 2748
19:33:19.380249 IP 13.224.212.80.443 > 10.0.2.15.39328: Flags [P.], seq 533451:536199, ack 803, win 65535, length 2748
19:33:19.380250 IP 13.224.212.80.443 > 10.0.2.15.39328: Flags [P.], seq 536199:540321, ack 803, win 65535, length 4122
19:33:19.380311 IP 10.0.2.15.39328 > 13.224.212.80.443: Flags [.], ack 533451, win 65535, length 0
19:33:19.380331 IP 10.0.2.15.39328 > 13.224.212.80.443: Flags [.], ack 536199, win 65535, length 0
19:33:19.380342 IP 10.0.2.15.39328 > 13.224.212.80.443: Flags [.], ack 540321, win 65535, length 0
19:33:19.380533 IP 13.224.212.80.443 > 10.0.2.15.39328: Flags [P.], seq 540321:543069, ack 803, win 65535, length 2748
19:33:19.380535 IP 13.224.212.80.443 > 10.0.2.15.39328: Flags [P.], seq 543069:545817, ack 803, win 65535, length 2748
19:33:19.380650 IP 10.0.2.15.39328 > 13.224.212.80.443: Flags [.], ack 543069, win 65535, length 0
19:33:19.380673 IP 10.0.2.15.39328 > 13.224.212.80.443: Flags [.], ack 545817, win 65535, length 0
19:33:19.381499 IP 13.224.212.80.443 > 10.0.2.15.39328: Flags [P.], seq 545817:552687, ack 803, win 65535, length 6870
19:33:19.381501 IP 13.224.212.80.443 > 10.0.2.15.39328: Flags [P.], seq 552687:554061, ack 803, win 65535, length 1374
19:33:19.381502 IP 13.224.212.80.443 > 10.0.2.15.39328: Flags [P.], seq 554061:558183, ack 803, win 65535, length 4122
19:33:19.381519 IP 10.0.2.15.39328 > 13.224.212.80.443: Flags [.], ack 552687, win 65535, length 0
19:33:19.381536 IP 10.0.2.15.39328 > 13.224.212.80.443: Flags [.], ack 554061, win 65535, length 0
19:33:19.381542 IP 10.0.2.15.39328 > 13.224.212.80.443: Flags [.], ack 558183, win 65535, length 0
19:33:19.381558 IP 13.224.212.80.443 > 10.0.2.15.39328: Flags [P.], seq 558183:560931, ack 803, win 65535, length 2748
19:33:19.381559 IP 13.224.212.80.443 > 10.0.2.15.39328: Flags [P.], seq 560931:562305, ack 803, win 65535, length 1374
19:33:19.381562 IP 10.0.2.15.39328 > 13.224.212.80.443: Flags [.], ack 560931, win 65535, length 0
19:33:19.381568 IP 10.0.2.15.39328 > 13.224.212.80.443: Flags [.], ack 562305, win 65535, length 0
19:33:19.381840 IP 13.224.212.80.443 > 10.0.2.15.39328: Flags [P.], seq 562305:566427, ack 803, win 65535, length 4122
19:33:19.381852 IP 10.0.2.15.39328 > 13.224.212.80.443: Flags [.], ack 566427, win 65535, length 0
19:33:19.382012 IP 13.224.212.80.443 > 10.0.2.15.39328: Flags [P.], seq 566427:571923, ack 803, win 65535, length 5496
19:33:19.382022 IP 10.0.2.15.39328 > 13.224.212.80.443: Flags [.], ack 571923, win 65535, length 0
19:33:19.382312 IP 13.224.212.80.443 > 10.0.2.15.39328: Flags [P.], seq 571923:578793, ack 803, win 65535, length 6870
19:33:19.382324 IP 10.0.2.15.39328 > 13.224.212.80.443: Flags [.], ack 578793, win 65535, length 0
19:33:19.382476 IP 13.224.212.80.443 > 10.0.2.15.39328: Flags [P.], seq 578793:581541, ack 803, win 65535, length 2748
19:33:19.382483 IP 10.0.2.15.39328 > 13.224.212.80.443: Flags [.], ack 581541, win 65535, length 0
19:33:19.382866 IP 13.224.212.80.443 > 10.0.2.15.39328: Flags [P.], seq 581541:587037, ack 803, win 65535, length 5496
19:33:19.382877 IP 10.0.2.15.39328 > 13.224.212.80.443: Flags [.], ack 587037, win 65535, length 0
19:33:19.383033 IP 13.224.212.80.443 > 10.0.2.15.39328: Flags [P.], seq 587037:589785, ack 803, win 65535, length 2748
19:33:19.383035 IP 13.224.212.80.443 > 10.0.2.15.39328: Flags [P.], seq 589785:593907, ack 803, win 65535, length 4122
19:33:19.383083 IP 10.0.2.15.39328 > 13.224.212.80.443: Flags [.], ack 589785, win 65535, length 0
19:33:19.383097 IP 10.0.2.15.39328 > 13.224.212.80.443: Flags [.], ack 593907, win 65535, length 0
19:33:19.383253 IP 13.224.212.80.443 > 10.0.2.15.39328: Flags [P.], seq 593907:599403, ack 803, win 65535, length 5496
19:33:19.383264 IP 10.0.2.15.39328 > 13.224.212.80.443: Flags [.], ack 599403, win 65535, length 0
19:33:19.383437 IP 13.224.212.80.443 > 10.0.2.15.39328: Flags [P.], seq 599403:602151, ack 803, win 65535, length 2748
19:33:19.383443 IP 10.0.2.15.39328 > 13.224.212.80.443: Flags [.], ack 602151, win 65535, length 0
19:33:19.384268 IP 13.224.212.80.443 > 10.0.2.15.39328: Flags [P.], seq 602151:606273, ack 803, win 65535, length 4122
19:33:19.384317 IP 13.224.212.80.443 > 10.0.2.15.39328: Flags [P.], seq 606273:609021, ack 803, win 65535, length 2748
19:33:19.384476 IP 13.224.212.80.443 > 10.0.2.15.39328: Flags [P.], seq 609021:611769, ack 803, win 65535, length 2748
19:33:19.384477 IP 13.224.212.80.443 > 10.0.2.15.39328: Flags [P.], seq 611769:614517, ack 803, win 65535, length 2748
19:33:19.384645 IP 13.224.212.80.443 > 10.0.2.15.39328: Flags [P.], seq 614517:617265, ack 803, win 65535, length 2748
19:33:19.384816 IP 13.224.212.80.443 > 10.0.2.15.39328: Flags [P.], seq 617265:620013, ack 803, win 65535, length 2748
19:33:19.385003 IP 13.224.212.80.443 > 10.0.2.15.39328: Flags [P.], seq 620013:625509, ack 803, win 65535, length 5496
19:33:19.385392 IP 13.224.212.80.443 > 10.0.2.15.39328: Flags [P.], seq 625509:628257, ack 803, win 65535, length 2748
19:33:19.385394 IP 13.224.212.80.443 > 10.0.2.15.39328: Flags [P.], seq 628257:631005, ack 803, win 65535, length 2748
19:33:19.385731 IP 13.224.212.80.443 > 10.0.2.15.39328: Flags [P.], seq 631005:636501, ack 803, win 65535, length 5496
19:33:19.385886 IP 10.0.2.15.39328 > 13.224.212.80.443: Flags [.], ack 625509, win 65535, length 0
19:33:19.385912 IP 10.0.2.15.39328 > 13.224.212.80.443: Flags [.], ack 636501, win 65535, length 0
19:33:19.386203 IP 13.224.212.80.443 > 10.0.2.15.39328: Flags [P.], seq 636501:641997, ack 803, win 65535, length 5496
19:33:19.386614 IP 13.224.212.80.443 > 10.0.2.15.39328: Flags [P.], seq 641997:646119, ack 803, win 65535, length 4122
19:33:19.386834 IP 13.224.212.80.443 > 10.0.2.15.39328: Flags [P.], seq 646119:651615, ack 803, win 65535, length 5496
19:33:19.387173 IP 13.224.212.80.443 > 10.0.2.15.39328: Flags [P.], seq 651615:655737, ack 803, win 65535, length 4122
19:33:19.387175 IP 13.224.212.80.443 > 10.0.2.15.39328: Flags [P.], seq 655737:658485, ack 803, win 65535, length 2748
19:33:19.387176 IP 13.224.212.80.443 > 10.0.2.15.39328: Flags [P.], seq 658485:661233, ack 803, win 65535, length 2748
19:33:19.387811 IP 13.224.212.80.443 > 10.0.2.15.39328: Flags [P.], seq 661233:665355, ack 803, win 65535, length 4122
19:33:19.387813 IP 13.224.212.80.443 > 10.0.2.15.39328: Flags [P.], seq 665355:669477, ack 803, win 65535, length 4122
19:33:19.388002 IP 10.0.2.15.39328 > 13.224.212.80.443: Flags [.], ack 661233, win 65535, length 0
19:33:19.388354 IP 13.224.212.80.443 > 10.0.2.15.39328: Flags [P.], seq 669477:684591, ack 803, win 65535, length 15114
19:33:19.388574 IP 13.224.212.80.443 > 10.0.2.15.39328: Flags [P.], seq 684591:690087, ack 803, win 65535, length 5496
19:33:19.388598 IP 10.0.2.15.39328 > 13.224.212.80.443: Flags [.], ack 669477, win 65535, length 0
19:33:19.388652 IP 13.224.212.80.443 > 10.0.2.15.39328: Flags [P.], seq 690087:695583, ack 803, win 65535, length 5496
19:33:19.388674 IP 10.0.2.15.39328 > 13.224.212.80.443: Flags [.], ack 690087, win 65535, length 0
19:33:19.388769 IP 10.0.2.15.39328 > 13.224.212.80.443: Flags [.], ack 695583, win 65535, length 0
19:33:19.389692 IP 13.224.212.80.443 > 10.0.2.15.39328: Flags [P.], seq 695583:701079, ack 803, win 65535, length 5496
19:33:19.389807 IP 13.224.212.80.443 > 10.0.2.15.39328: Flags [P.], seq 701079:706575, ack 803, win 65535, length 5496
19:33:19.389830 IP 10.0.2.15.39328 > 13.224.212.80.443: Flags [.], ack 701079, win 65535, length 0
19:33:19.389992 IP 10.0.2.15.39328 > 13.224.212.80.443: Flags [.], ack 706575, win 65535, length 0
19:33:19.390137 IP 13.224.212.80.443 > 10.0.2.15.39328: Flags [P.], seq 706575:709323, ack 803, win 65535, length 2748
19:33:19.390139 IP 13.224.212.80.443 > 10.0.2.15.39328: Flags [P.], seq 709323:714819, ack 803, win 65535, length 5496
19:33:19.390210 IP 10.0.2.15.39328 > 13.224.212.80.443: Flags [.], ack 709323, win 65535, length 0
19:33:19.390392 IP 10.0.2.15.39328 > 13.224.212.80.443: Flags [.], ack 714819, win 65535, length 0
19:33:19.390596 IP 13.224.212.80.443 > 10.0.2.15.39328: Flags [P.], seq 714819:717567, ack 803, win 65535, length 2748
19:33:19.390598 IP 13.224.212.80.443 > 10.0.2.15.39328: Flags [P.], seq 717567:721689, ack 803, win 65535, length 4122
19:33:19.390599 IP 13.224.212.80.443 > 10.0.2.15.39328: Flags [P.], seq 721689:725811, ack 803, win 65535, length 4122
19:33:19.390658 IP 10.0.2.15.39328 > 13.224.212.80.443: Flags [.], ack 717567, win 65535, length 0
19:33:19.390713 IP 10.0.2.15.39328 > 13.224.212.80.443: Flags [.], ack 721689, win 65535, length 0
19:33:19.390728 IP 10.0.2.15.39328 > 13.224.212.80.443: Flags [.], ack 725811, win 65535, length 0
19:33:19.390785 IP 13.224.212.80.443 > 10.0.2.15.39328: Flags [P.], seq 725811:728559, ack 803, win 65535, length 2748
19:33:19.390790 IP 10.0.2.15.39328 > 13.224.212.80.443: Flags [.], ack 728559, win 65535, length 0
19:33:19.391169 IP 13.224.212.80.443 > 10.0.2.15.39328: Flags [P.], seq 728559:731307, ack 803, win 65535, length 2748
19:33:19.391170 IP 13.224.212.80.443 > 10.0.2.15.39328: Flags [P.], seq 731307:735429, ack 803, win 65535, length 4122
19:33:19.391181 IP 10.0.2.15.39328 > 13.224.212.80.443: Flags [.], ack 731307, win 65535, length 0
19:33:19.391196 IP 10.0.2.15.39328 > 13.224.212.80.443: Flags [.], ack 735429, win 65535, length 0
19:33:19.392115 IP 13.224.212.80.443 > 10.0.2.15.39328: Flags [P.], seq 735429:739551, ack 803, win 65535, length 4122
19:33:19.392117 IP 13.224.212.80.443 > 10.0.2.15.39328: Flags [P.], seq 739551:745047, ack 803, win 65535, length 5496
19:33:19.392209 IP 10.0.2.15.39328 > 13.224.212.80.443: Flags [.], ack 739551, win 65535, length 0
19:33:19.392296 IP 10.0.2.15.39328 > 13.224.212.80.443: Flags [.], ack 745047, win 65535, length 0
19:33:19.392457 IP 13.224.212.80.443 > 10.0.2.15.39328: Flags [P.], seq 745047:749169, ack 803, win 65535, length 4122
19:33:19.392458 IP 13.224.212.80.443 > 10.0.2.15.39328: Flags [P.], seq 749169:751917, ack 803, win 65535, length 2748
19:33:19.392465 IP 10.0.2.15.39328 > 13.224.212.80.443: Flags [.], ack 749169, win 65535, length 0
19:33:19.392479 IP 10.0.2.15.39328 > 13.224.212.80.443: Flags [.], ack 751917, win 65535, length 0
19:33:19.392807 IP 13.224.212.80.443 > 10.0.2.15.39328: Flags [P.], seq 751917:757413, ack 803, win 65535, length 5496
19:33:19.392809 IP 13.224.212.80.443 > 10.0.2.15.39328: Flags [P.], seq 757413:761535, ack 803, win 65535, length 4122
19:33:19.393423 IP 13.224.212.80.443 > 10.0.2.15.39328: Flags [P.], seq 761535:765657, ack 803, win 65535, length 4122
19:33:19.393424 IP 13.224.212.80.443 > 10.0.2.15.39328: Flags [P.], seq 765657:767031, ack 803, win 65535, length 1374
19:33:19.393425 IP 13.224.212.80.443 > 10.0.2.15.39328: Flags [P.], seq 767031:769779, ack 803, win 65535, length 2748
19:33:19.393426 IP 13.224.212.80.443 > 10.0.2.15.39328: Flags [P.], seq 769779:772527, ack 803, win 65535, length 2748
19:33:19.393445 IP 13.224.212.80.443 > 10.0.2.15.39328: Flags [P.], seq 772527:775275, ack 803, win 65535, length 2748
19:33:19.393464 IP 10.0.2.15.39328 > 13.224.212.80.443: Flags [.], ack 775275, win 65535, length 0
19:33:19.394338 IP 13.224.212.80.443 > 10.0.2.15.39328: Flags [P.], seq 775275:779397, ack 803, win 65535, length 4122
19:33:19.394431 IP 13.224.212.80.443 > 10.0.2.15.39328: Flags [P.], seq 779397:784893, ack 803, win 65535, length 5496
19:33:19.394453 IP 10.0.2.15.39328 > 13.224.212.80.443: Flags [.], ack 779397, win 65535, length 0
19:33:19.394912 IP 10.0.2.15.39328 > 13.224.212.80.443: Flags [.], ack 784893, win 65535, length 0
19:33:19.395177 IP 13.224.212.80.443 > 10.0.2.15.39328: Flags [P.], seq 784893:789015, ack 803, win 65535, length 4122
19:33:19.395179 IP 13.224.212.80.443 > 10.0.2.15.39328: Flags [P.], seq 789015:791763, ack 803, win 65535, length 2748

