19:35:39.714011 IP 10.0.2.15.54881 > 140.233.253.2.53: 22054+ A? www.espn.com. (30)
19:35:39.714043 IP 10.0.2.15.54881 > 140.233.253.2.53: 11557+ AAAA? www.espn.com. (30)
19:35:39.725086 IP 140.233.253.2.53 > 10.0.2.15.54881: 22054 4/0/0 A 13.224.212.47, A 13.224.212.45, A 13.224.212.128, A 13.224.212.80 (94)
19:35:39.725088 IP 140.233.253.2.53 > 10.0.2.15.54881: 11557 8/0/0 AAAA 2600:9000:20ed:ae00:e:fe33:5580:93a1, AAAA 2600:9000:20ed:800:e:fe33:5580:93a1, AAAA 2600:9000:20ed:3400:e:fe33:5580:93a1, AAAA 2600:9000:20ed:5600:e:fe33:5580:93a1, AAAA 2600:9000:20ed:de00:e:fe33:5580:93a1, AAAA 2600:9000:20ed:3a00:e:fe33:5580:93a1, AAAA 2600:9000:20ed:ea00:e:fe33:5580:93a1, AAAA 2600:9000:20ed:6800:e:fe33:5580:93a1 (254)
19:35:39.725652 IP 10.0.2.15.54580 > 13.224.212.47.443: Flags [S], seq 3794022346, win 64240, options [mss 1460,sackOK,TS val 215388310 ecr 0,nop,wscale 6], length 0
19:35:39.742980 IP 13.224.212.47.443 > 10.0.2.15.54580: Flags [S.], seq 177216001, ack 3794022347, win 65535, options [mss 1460], length 0
19:35:39.743026 IP 10.0.2.15.54580 > 13.224.212.47.443: Flags [.], ack 1, win 64240, length 0
19:35:39.751574 IP 10.0.2.15.54580 > 13.224.212.47.443: Flags [P.], seq 1:518, ack 1, win 64240, length 517
19:35:39.751921 IP 13.224.212.47.443 > 10.0.2.15.54580: Flags [.], ack 518, win 65535, length 0
19:35:39.770808 IP 13.224.212.47.443 > 10.0.2.15.54580: Flags [P.], seq 1:2749, ack 518, win 65535, length 2748
19:35:39.770831 IP 10.0.2.15.54580 > 13.224.212.47.443: Flags [.], ack 2749, win 62780, length 0
19:35:39.771439 IP 13.224.212.47.443 > 10.0.2.15.54580: Flags [P.], seq 2749:4123, ack 518, win 65535, length 1374
19:35:39.771459 IP 10.0.2.15.54580 > 13.224.212.47.443: Flags [.], ack 4123, win 61406, length 0
19:35:39.781413 IP 13.224.212.47.443 > 10.0.2.15.54580: Flags [P.], seq 4123:5824, ack 518, win 65535, length 1701
19:35:39.781439 IP 10.0.2.15.54580 > 13.224.212.47.443: Flags [.], ack 5824, win 62780, length 0
19:35:39.782739 IP 10.0.2.15.54580 > 13.224.212.47.443: Flags [P.], seq 518:582, ack 5824, win 62780, length 64
19:35:39.783022 IP 13.224.212.47.443 > 10.0.2.15.54580: Flags [.], ack 582, win 65535, length 0
19:35:39.783136 IP 10.0.2.15.54580 > 13.224.212.47.443: Flags [P.], seq 582:628, ack 5824, win 62780, length 46
19:35:39.783171 IP 10.0.2.15.54580 > 13.224.212.47.443: Flags [P.], seq 628:677, ack 5824, win 62780, length 49
19:35:39.783555 IP 13.224.212.47.443 > 10.0.2.15.54580: Flags [.], ack 628, win 65535, length 0
19:35:39.783556 IP 13.224.212.47.443 > 10.0.2.15.54580: Flags [.], ack 677, win 65535, length 0
19:35:39.783577 IP 10.0.2.15.54580 > 13.224.212.47.443: Flags [P.], seq 677:772, ack 5824, win 62780, length 95
19:35:39.783975 IP 13.224.212.47.443 > 10.0.2.15.54580: Flags [.], ack 772, win 65535, length 0
19:35:39.797294 IP 13.224.212.47.443 > 10.0.2.15.54580: Flags [P.], seq 5824:5886, ack 772, win 65535, length 62
19:35:39.797317 IP 10.0.2.15.54580 > 13.224.212.47.443: Flags [.], ack 5886, win 62780, length 0
19:35:39.797627 IP 10.0.2.15.54580 > 13.224.212.47.443: Flags [P.], seq 772:803, ack 5886, win 62780, length 31
19:35:39.798102 IP 13.224.212.47.443 > 10.0.2.15.54580: Flags [.], ack 803, win 65535, length 0
19:35:39.798104 IP 13.224.212.47.443 > 10.0.2.15.54580: Flags [P.], seq 5886:5917, ack 803, win 65535, length 31
19:35:39.798136 IP 10.0.2.15.54580 > 13.224.212.47.443: Flags [.], ack 5917, win 62780, length 0
19:35:39.840450 IP 13.224.212.47.443 > 10.0.2.15.54580: Flags [P.], seq 5917:10039, ack 803, win 65535, length 4122
19:35:39.840473 IP 10.0.2.15.54580 > 13.224.212.47.443: Flags [.], ack 10039, win 61320, length 0
19:35:39.840893 IP 13.224.212.47.443 > 10.0.2.15.54580: Flags [P.], seq 10039:15535, ack 803, win 65535, length 5496
19:35:39.840916 IP 10.0.2.15.54580 > 13.224.212.47.443: Flags [.], ack 15535, win 58400, length 0
19:35:39.841876 IP 13.224.212.47.443 > 10.0.2.15.54580: Flags [P.], seq 15535:19657, ack 803, win 65535, length 4122
19:35:39.841892 IP 10.0.2.15.54580 > 13.224.212.47.443: Flags [.], ack 19657, win 61320, length 0
19:35:39.842027 IP 13.224.212.47.443 > 10.0.2.15.54580: Flags [P.], seq 19657:22405, ack 803, win 65535, length 2748
19:35:39.842036 IP 10.0.2.15.54580 > 13.224.212.47.443: Flags [.], ack 22405, win 59860, length 0
19:35:39.843246 IP 13.224.212.47.443 > 10.0.2.15.54580: Flags [P.], seq 22405:29275, ack 803, win 65535, length 6870
19:35:39.843249 IP 13.224.212.47.443 > 10.0.2.15.54580: Flags [P.], seq 29275:32023, ack 803, win 65535, length 2748
19:35:39.843418 IP 10.0.2.15.54580 > 13.224.212.47.443: Flags [.], ack 29275, win 59860, length 0
19:35:39.843460 IP 10.0.2.15.54580 > 13.224.212.47.443: Flags [.], ack 32023, win 58400, length 0
19:35:39.844199 IP 13.224.212.47.443 > 10.0.2.15.54580: Flags [P.], seq 32023:37519, ack 803, win 65535, length 5496
19:35:39.844213 IP 10.0.2.15.54580 > 13.224.212.47.443: Flags [.], ack 37519, win 61320, length 0
19:35:39.845430 IP 13.224.212.47.443 > 10.0.2.15.54580: Flags [P.], seq 37519:43015, ack 803, win 65535, length 5496
19:35:39.845450 IP 10.0.2.15.54580 > 13.224.212.47.443: Flags [.], ack 43015, win 61320, length 0
19:35:39.846176 IP 13.224.212.47.443 > 10.0.2.15.54580: Flags [P.], seq 43015:48511, ack 803, win 65535, length 5496
19:35:39.846192 IP 10.0.2.15.54580 > 13.224.212.47.443: Flags [.], ack 48511, win 61320, length 0
19:35:39.848449 IP 13.224.212.47.443 > 10.0.2.15.54580: Flags [P.], seq 48511:49885, ack 803, win 65535, length 1374
19:35:39.848537 IP 10.0.2.15.54580 > 13.224.212.47.443: Flags [.], ack 49885, win 62780, length 0
19:35:39.853871 IP 13.224.212.47.443 > 10.0.2.15.54580: Flags [P.], seq 49885:52633, ack 803, win 65535, length 2748
19:35:39.853889 IP 10.0.2.15.54580 > 13.224.212.47.443: Flags [.], ack 52633, win 62780, length 0
19:35:39.854853 IP 13.224.212.47.443 > 10.0.2.15.54580: Flags [P.], seq 52633:58129, ack 803, win 65535, length 5496
19:35:39.855045 IP 10.0.2.15.54580 > 13.224.212.47.443: Flags [.], ack 58129, win 61320, length 0
19:35:39.855947 IP 13.224.212.47.443 > 10.0.2.15.54580: Flags [P.], seq 58129:63625, ack 803, win 65535, length 5496
19:35:39.855950 IP 13.224.212.47.443 > 10.0.2.15.54580: Flags [P.], seq 63625:66373, ack 803, win 65535, length 2748
19:35:39.855971 IP 10.0.2.15.54580 > 13.224.212.47.443: Flags [.], ack 63625, win 61320, length 0
19:35:39.856476 IP 10.0.2.15.54580 > 13.224.212.47.443: Flags [.], ack 66373, win 62780, length 0
19:35:39.857007 IP 13.224.212.47.443 > 10.0.2.15.54580: Flags [P.], seq 66373:69121, ack 803, win 65535, length 2748
19:35:39.857020 IP 10.0.2.15.54580 > 13.224.212.47.443: Flags [.], ack 69121, win 62780, length 0
19:35:39.858426 IP 13.224.212.47.443 > 10.0.2.15.54580: Flags [P.], seq 69121:74617, ack 803, win 65535, length 5496
19:35:39.858445 IP 10.0.2.15.54580 > 13.224.212.47.443: Flags [.], ack 74617, win 65535, length 0
19:35:39.858871 IP 13.224.212.47.443 > 10.0.2.15.54580: Flags [P.], seq 74617:82861, ack 803, win 65535, length 8244
19:35:39.858889 IP 10.0.2.15.54580 > 13.224.212.47.443: Flags [.], ack 82861, win 65535, length 0
19:35:39.859450 IP 13.224.212.47.443 > 10.0.2.15.54580: Flags [P.], seq 82861:85609, ack 803, win 65535, length 2748
19:35:39.859464 IP 10.0.2.15.54580 > 13.224.212.47.443: Flags [.], ack 85609, win 65535, length 0
19:35:39.860709 IP 13.224.212.47.443 > 10.0.2.15.54580: Flags [P.], seq 85609:91105, ack 803, win 65535, length 5496
19:35:39.860725 IP 10.0.2.15.54580 > 13.224.212.47.443: Flags [.], ack 91105, win 65535, length 0
19:35:39.861499 IP 13.224.212.47.443 > 10.0.2.15.54580: Flags [P.], seq 91105:96601, ack 803, win 65535, length 5496
19:35:39.861513 IP 10.0.2.15.54580 > 13.224.212.47.443: Flags [.], ack 96601, win 65535, length 0
19:35:39.862739 IP 13.224.212.47.443 > 10.0.2.15.54580: Flags [P.], seq 96601:102097, ack 803, win 65535, length 5496
19:35:39.862760 IP 10.0.2.15.54580 > 13.224.212.47.443: Flags [.], ack 102097, win 65535, length 0
19:35:39.864094 IP 13.224.212.47.443 > 10.0.2.15.54580: Flags [P.], seq 102097:108967, ack 803, win 65535, length 6870
19:35:39.864189 IP 10.0.2.15.54580 > 13.224.212.47.443: Flags [.], ack 108967, win 65535, length 0
19:35:39.864354 IP 13.224.212.47.443 > 10.0.2.15.54580: Flags [P.], seq 108967:113089, ack 803, win 65535, length 4122
19:35:39.864363 IP 10.0.2.15.54580 > 13.224.212.47.443: Flags [.], ack 113089, win 65535, length 0
19:35:39.865441 IP 13.224.212.47.443 > 10.0.2.15.54580: Flags [P.], seq 113089:121333, ack 803, win 65535, length 8244
19:35:39.865538 IP 10.0.2.15.54580 > 13.224.212.47.443: Flags [.], ack 121333, win 65535, length 0
19:35:39.865650 IP 13.224.212.47.443 > 10.0.2.15.54580: Flags [P.], seq 121333:124081, ack 803, win 65535, length 2748
19:35:39.865656 IP 10.0.2.15.54580 > 13.224.212.47.443: Flags [.], ack 124081, win 65535, length 0
19:35:39.867635 IP 13.224.212.47.443 > 10.0.2.15.54580: Flags [P.], seq 124081:125455, ack 803, win 65535, length 1374
19:35:39.867654 IP 10.0.2.15.54580 > 13.224.212.47.443: Flags [.], ack 125455, win 65535, length 0
19:35:39.868825 IP 13.224.212.47.443 > 10.0.2.15.54580: Flags [P.], seq 125455:132325, ack 803, win 65535, length 6870
19:35:39.868828 IP 13.224.212.47.443 > 10.0.2.15.54580: Flags [P.], seq 132325:136447, ack 803, win 65535, length 4122
19:35:39.868851 IP 10.0.2.15.54580 > 13.224.212.47.443: Flags [.], ack 132325, win 65535, length 0
19:35:39.868895 IP 10.0.2.15.54580 > 13.224.212.47.443: Flags [.], ack 136447, win 65535, length 0
19:35:39.869037 IP 13.224.212.47.443 > 10.0.2.15.54580: Flags [P.], seq 136447:137821, ack 803, win 65535, length 1374
19:35:39.869161 IP 10.0.2.15.54580 > 13.224.212.47.443: Flags [.], ack 137821, win 65535, length 0
19:35:39.869745 IP 13.224.212.47.443 > 10.0.2.15.54580: Flags [P.], seq 137821:144691, ack 803, win 65535, length 6870
19:35:39.869762 IP 10.0.2.15.54580 > 13.224.212.47.443: Flags [.], ack 144691, win 65535, length 0
19:35:39.869888 IP 13.224.212.47.443 > 10.0.2.15.54580: Flags [P.], seq 144691:148813, ack 803, win 65535, length 4122
19:35:39.869895 IP 10.0.2.15.54580 > 13.224.212.47.443: Flags [.], ack 148813, win 65535, length 0
19:35:39.871212 IP 13.224.212.47.443 > 10.0.2.15.54580: Flags [P.], seq 148813:155683, ack 803, win 65535, length 6870
19:35:39.871233 IP 10.0.2.15.54580 > 13.224.212.47.443: Flags [.], ack 155683, win 65535, length 0
19:35:39.872323 IP 13.224.212.47.443 > 10.0.2.15.54580: Flags [P.], seq 155683:163927, ack 803, win 65535, length 8244
19:35:39.872343 IP 10.0.2.15.54580 > 13.224.212.47.443: Flags [.], ack 163927, win 65535, length 0
19:35:39.874205 IP 13.224.212.47.443 > 10.0.2.15.54580: Flags [P.], seq 163927:173545, ack 803, win 65535, length 9618
19:35:39.874208 IP 13.224.212.47.443 > 10.0.2.15.54580: Flags [P.], seq 173545:179041, ack 803, win 65535, length 5496
19:35:39.874231 IP 10.0.2.15.54580 > 13.224.212.47.443: Flags [.], ack 173545, win 65535, length 0
19:35:39.874271 IP 10.0.2.15.54580 > 13.224.212.47.443: Flags [.], ack 179041, win 65535, length 0
19:35:39.874375 IP 13.224.212.47.443 > 10.0.2.15.54580: Flags [P.], seq 179041:180415, ack 803, win 65535, length 1374
19:35:39.874389 IP 10.0.2.15.54580 > 13.224.212.47.443: Flags [.], ack 180415, win 65535, length 0
19:35:39.875251 IP 13.224.212.47.443 > 10.0.2.15.54580: Flags [P.], seq 180415:187285, ack 803, win 65535, length 6870
19:35:39.875264 IP 10.0.2.15.54580 > 13.224.212.47.443: Flags [.], ack 187285, win 65535, length 0
19:35:39.875443 IP 13.224.212.47.443 > 10.0.2.15.54580: Flags [P.], seq 187285:194155, ack 803, win 65535, length 6870
19:35:39.875452 IP 10.0.2.15.54580 > 13.224.212.47.443: Flags [.], ack 194155, win 65535, length 0
19:35:39.876408 IP 13.224.212.47.443 > 10.0.2.15.54580: Flags [P.], seq 194155:202399, ack 803, win 65535, length 8244
19:35:39.876410 IP 13.224.212.47.443 > 10.0.2.15.54580: Flags [P.], seq 202399:205147, ack 803, win 65535, length 2748
19:35:39.876433 IP 10.0.2.15.54580 > 13.224.212.47.443: Flags [.], ack 202399, win 65535, length 0
19:35:39.876473 IP 10.0.2.15.54580 > 13.224.212.47.443: Flags [.], ack 205147, win 65535, length 0
19:35:39.877514 IP 13.224.212.47.443 > 10.0.2.15.54580: Flags [P.], seq 205147:210643, ack 803, win 65535, length 5496
19:35:39.877516 IP 13.224.212.47.443 > 10.0.2.15.54580: Flags [P.], seq 210643:213391, ack 803, win 65535, length 2748
19:35:39.877536 IP 10.0.2.15.54580 > 13.224.212.47.443: Flags [.], ack 210643, win 65535, length 0
19:35:39.877565 IP 10.0.2.15.54580 > 13.224.212.47.443: Flags [.], ack 213391, win 65535, length 0
19:35:39.877698 IP 13.224.212.47.443 > 10.0.2.15.54580: Flags [P.], seq 213391:216139, ack 803, win 65535, length 2748
19:35:39.877703 IP 10.0.2.15.54580 > 13.224.212.47.443: Flags [.], ack 216139, win 65535, length 0
19:35:39.878859 IP 13.224.212.47.443 > 10.0.2.15.54580: Flags [P.], seq 216139:223009, ack 803, win 65535, length 6870
19:35:39.878861 IP 13.224.212.47.443 > 10.0.2.15.54580: Flags [P.], seq 223009:228505, ack 803, win 65535, length 5496
19:35:39.878880 IP 10.0.2.15.54580 > 13.224.212.47.443: Flags [.], ack 223009, win 65535, length 0
19:35:39.878908 IP 10.0.2.15.54580 > 13.224.212.47.443: Flags [.], ack 228505, win 65535, length 0
19:35:39.879486 IP 13.224.212.47.443 > 10.0.2.15.54580: Flags [P.], seq 228505:234001, ack 803, win 65535, length 5496
19:35:39.879501 IP 10.0.2.15.54580 > 13.224.212.47.443: Flags [.], ack 234001, win 65535, length 0
19:35:39.880438 IP 13.224.212.47.443 > 10.0.2.15.54580: Flags [P.], seq 234001:239497, ack 803, win 65535, length 5496
19:35:39.880440 IP 13.224.212.47.443 > 10.0.2.15.54580: Flags [P.], seq 239497:244993, ack 803, win 65535, length 5496
19:35:39.880454 IP 10.0.2.15.54580 > 13.224.212.47.443: Flags [.], ack 239497, win 65535, length 0
19:35:39.880486 IP 10.0.2.15.54580 > 13.224.212.47.443: Flags [.], ack 244993, win 65535, length 0
19:35:39.881171 IP 13.224.212.47.443 > 10.0.2.15.54580: Flags [P.], seq 244993:251863, ack 803, win 65535, length 6870
19:35:39.881180 IP 13.224.212.47.443 > 10.0.2.15.54580: Flags [P.], seq 251863:255985, ack 803, win 65535, length 4122
19:35:39.881197 IP 10.0.2.15.54580 > 13.224.212.47.443: Flags [.], ack 251863, win 65535, length 0
19:35:39.881222 IP 10.0.2.15.54580 > 13.224.212.47.443: Flags [.], ack 255985, win 65535, length 0
19:35:39.881416 IP 13.224.212.47.443 > 10.0.2.15.54580: Flags [P.], seq 255985:258733, ack 803, win 65535, length 2748
19:35:39.881427 IP 10.0.2.15.54580 > 13.224.212.47.443: Flags [.], ack 258733, win 65535, length 0
19:35:39.882983 IP 13.224.212.47.443 > 10.0.2.15.54580: Flags [P.], seq 258733:264229, ack 803, win 65535, length 5496
19:35:39.882985 IP 13.224.212.47.443 > 10.0.2.15.54580: Flags [P.], seq 264229:269725, ack 803, win 65535, length 5496
19:35:39.883126 IP 10.0.2.15.54580 > 13.224.212.47.443: Flags [.], ack 264229, win 65535, length 0
19:35:39.883224 IP 10.0.2.15.54580 > 13.224.212.47.443: Flags [.], ack 269725, win 65535, length 0
19:35:39.883259 IP 13.224.212.47.443 > 10.0.2.15.54580: Flags [P.], seq 269725:272473, ack 803, win 65535, length 2748
19:35:39.883264 IP 10.0.2.15.54580 > 13.224.212.47.443: Flags [.], ack 272473, win 65535, length 0
19:35:39.884049 IP 13.224.212.47.443 > 10.0.2.15.54580: Flags [P.], seq 272473:277969, ack 803, win 65535, length 5496
19:35:39.884064 IP 10.0.2.15.54580 > 13.224.212.47.443: Flags [.], ack 277969, win 65535, length 0
19:35:39.884430 IP 13.224.212.47.443 > 10.0.2.15.54580: Flags [P.], seq 277969:283465, ack 803, win 65535, length 5496
19:35:39.884443 IP 10.0.2.15.54580 > 13.224.212.47.443: Flags [.], ack 283465, win 65535, length 0
19:35:39.884579 IP 13.224.212.47.443 > 10.0.2.15.54580: Flags [P.], seq 283465:288961, ack 803, win 65535, length 5496
19:35:39.884587 IP 10.0.2.15.54580 > 13.224.212.47.443: Flags [.], ack 288961, win 65535, length 0
19:35:39.884695 IP 13.224.212.47.443 > 10.0.2.15.54580: Flags [P.], seq 288961:293083, ack 803, win 65535, length 4122
19:35:39.884704 IP 10.0.2.15.54580 > 13.224.212.47.443: Flags [.], ack 293083, win 65535, length 0
19:35:39.885588 IP 13.224.212.47.443 > 10.0.2.15.54580: Flags [P.], seq 293083:298579, ack 803, win 65535, length 5496
19:35:39.885590 IP 13.224.212.47.443 > 10.0.2.15.54580: Flags [P.], seq 298579:304075, ack 803, win 65535, length 5496
19:35:39.885612 IP 10.0.2.15.54580 > 13.224.212.47.443: Flags [.], ack 298579, win 65535, length 0
19:35:39.885806 IP 10.0.2.15.54580 > 13.224.212.47.443: Flags [.], ack 304075, win 65535, length 0
19:35:39.885873 IP 13.224.212.47.443 > 10.0.2.15.54580: Flags [P.], seq 304075:309571, ack 803, win 65535, length 5496
19:35:39.885881 IP 10.0.2.15.54580 > 13.224.212.47.443: Flags [.], ack 309571, win 65535, length 0
19:35:39.886089 IP 13.224.212.47.443 > 10.0.2.15.54580: Flags [P.], seq 309571:312319, ack 803, win 65535, length 2748
19:35:39.886091 IP 13.224.212.47.443 > 10.0.2.15.54580: Flags [P.], seq 312319:315067, ack 803, win 65535, length 2748
19:35:39.886100 IP 10.0.2.15.54580 > 13.224.212.47.443: Flags [.], ack 312319, win 65535, length 0
19:35:39.886115 IP 10.0.2.15.54580 > 13.224.212.47.443: Flags [.], ack 315067, win 65535, length 0
19:35:39.886294 IP 13.224.212.47.443 > 10.0.2.15.54580: Flags [P.], seq 315067:319189, ack 803, win 65535, length 4122
19:35:39.886301 IP 10.0.2.15.54580 > 13.224.212.47.443: Flags [.], ack 319189, win 65535, length 0
19:35:39.887548 IP 13.224.212.47.443 > 10.0.2.15.54580: Flags [P.], seq 319189:323311, ack 803, win 65535, length 4122
19:35:39.887551 IP 13.224.212.47.443 > 10.0.2.15.54580: Flags [P.], seq 323311:328807, ack 803, win 65535, length 5496
19:35:39.887616 IP 10.0.2.15.54580 > 13.224.212.47.443: Flags [.], ack 323311, win 65535, length 0
19:35:39.887664 IP 10.0.2.15.54580 > 13.224.212.47.443: Flags [.], ack 328807, win 65535, length 0
19:35:39.887865 IP 13.224.212.47.443 > 10.0.2.15.54580: Flags [P.], seq 328807:332929, ack 803, win 65535, length 4122
19:35:39.887951 IP 13.224.212.47.443 > 10.0.2.15.54580: Flags [P.], seq 332929:338425, ack 803, win 65535, length 5496
19:35:39.887952 IP 13.224.212.47.443 > 10.0.2.15.54580: Flags [P.], seq 338425:339799, ack 803, win 65535, length 1374
19:35:39.887971 IP 10.0.2.15.54580 > 13.224.212.47.443: Flags [.], ack 332929, win 65535, length 0
19:35:39.888086 IP 10.0.2.15.54580 > 13.224.212.47.443: Flags [.], ack 338425, win 65535, length 0
19:35:39.888103 IP 10.0.2.15.54580 > 13.224.212.47.443: Flags [.], ack 339799, win 65535, length 0
19:35:39.889370 IP 13.224.212.47.443 > 10.0.2.15.54580: Flags [P.], seq 339799:348043, ack 803, win 65535, length 8244
19:35:39.889373 IP 13.224.212.47.443 > 10.0.2.15.54580: Flags [P.], seq 348043:353539, ack 803, win 65535, length 5496
19:35:39.889392 IP 10.0.2.15.54580 > 13.224.212.47.443: Flags [.], ack 348043, win 65535, length 0
19:35:39.889421 IP 10.0.2.15.54580 > 13.224.212.47.443: Flags [.], ack 353539, win 65535, length 0
19:35:39.890722 IP 13.224.212.47.443 > 10.0.2.15.54580: Flags [P.], seq 353539:360409, ack 803, win 65535, length 6870
19:35:39.890727 IP 13.224.212.47.443 > 10.0.2.15.54580: Flags [P.], seq 360409:365905, ack 803, win 65535, length 5496
19:35:39.890749 IP 10.0.2.15.54580 > 13.224.212.47.443: Flags [.], ack 360409, win 65535, length 0
19:35:39.890916 IP 10.0.2.15.54580 > 13.224.212.47.443: Flags [.], ack 365905, win 65535, length 0
19:35:39.890995 IP 13.224.212.47.443 > 10.0.2.15.54580: Flags [P.], seq 365905:370027, ack 803, win 65535, length 4122
19:35:39.890997 IP 13.224.212.47.443 > 10.0.2.15.54580: Flags [P.], seq 370027:372775, ack 803, win 65535, length 2748
19:35:39.891009 IP 10.0.2.15.54580 > 13.224.212.47.443: Flags [.], ack 370027, win 65535, length 0
19:35:39.891028 IP 10.0.2.15.54580 > 13.224.212.47.443: Flags [.], ack 372775, win 65535, length 0
19:35:39.892089 IP 13.224.212.47.443 > 10.0.2.15.54580: Flags [P.], seq 372775:376897, ack 803, win 65535, length 4122
19:35:39.892091 IP 13.224.212.47.443 > 10.0.2.15.54580: Flags [P.], seq 376897:379645, ack 803, win 65535, length 2748
19:35:39.892092 IP 13.224.212.47.443 > 10.0.2.15.54580: Flags [P.], seq 379645:383767, ack 803, win 65535, length 4122
19:35:39.892104 IP 10.0.2.15.54580 > 13.224.212.47.443: Flags [.], ack 376897, win 65535, length 0
19:35:39.892122 IP 10.0.2.15.54580 > 13.224.212.47.443: Flags [.], ack 379645, win 65535, length 0
19:35:39.892134 IP 10.0.2.15.54580 > 13.224.212.47.443: Flags [.], ack 383767, win 65535, length 0
19:35:39.892164 IP 13.224.212.47.443 > 10.0.2.15.54580: Flags [P.], seq 383767:387889, ack 803, win 65535, length 4122
19:35:39.892165 IP 13.224.212.47.443 > 10.0.2.15.54580: Flags [P.], seq 387889:390637, ack 803, win 65535, length 2748
19:35:39.892166 IP 13.224.212.47.443 > 10.0.2.15.54580: Flags [P.], seq 390637:393385, ack 803, win 65535, length 2748
19:35:39.892167 IP 13.224.212.47.443 > 10.0.2.15.54580: Flags [P.], seq 393385:397507, ack 803, win 65535, length 4122
19:35:39.892173 IP 10.0.2.15.54580 > 13.224.212.47.443: Flags [.], ack 387889, win 65535, length 0
19:35:39.892182 IP 10.0.2.15.54580 > 13.224.212.47.443: Flags [.], ack 390637, win 65535, length 0
19:35:39.892248 IP 10.0.2.15.54580 > 13.224.212.47.443: Flags [.], ack 393385, win 65535, length 0
19:35:39.892263 IP 10.0.2.15.54580 > 13.224.212.47.443: Flags [.], ack 397507, win 65535, length 0
19:35:39.893124 IP 13.224.212.47.443 > 10.0.2.15.54580: Flags [P.], seq 397507:401629, ack 803, win 65535, length 4122
19:35:39.893126 IP 13.224.212.47.443 > 10.0.2.15.54580: Flags [P.], seq 401629:408499, ack 803, win 65535, length 6870
19:35:39.893142 IP 10.0.2.15.54580 > 13.224.212.47.443: Flags [.], ack 401629, win 65535, length 0
19:35:39.893161 IP 10.0.2.15.54580 > 13.224.212.47.443: Flags [.], ack 408499, win 65535, length 0
19:35:39.893299 IP 13.224.212.47.443 > 10.0.2.15.54580: Flags [P.], seq 408499:412621, ack 803, win 65535, length 4122
19:35:39.893308 IP 10.0.2.15.54580 > 13.224.212.47.443: Flags [.], ack 412621, win 65535, length 0
19:35:39.893475 IP 13.224.212.47.443 > 10.0.2.15.54580: Flags [P.], seq 412621:415369, ack 803, win 65535, length 2748
19:35:39.893488 IP 10.0.2.15.54580 > 13.224.212.47.443: Flags [.], ack 415369, win 65535, length 0
19:35:39.894089 IP 13.224.212.47.443 > 10.0.2.15.54580: Flags [P.], seq 415369:419491, ack 803, win 65535, length 4122
19:35:39.894091 IP 13.224.212.47.443 > 10.0.2.15.54580: Flags [P.], seq 419491:422239, ack 803, win 65535, length 2748
19:35:39.894092 IP 13.224.212.47.443 > 10.0.2.15.54580: Flags [P.], seq 422239:424987, ack 803, win 65535, length 2748
19:35:39.894092 IP 13.224.212.47.443 > 10.0.2.15.54580: Flags [P.], seq 424987:427735, ack 803, win 65535, length 2748
19:35:39.894113 IP 10.0.2.15.54580 > 13.224.212.47.443: Flags [.], ack 419491, win 65535, length 0
19:35:39.894169 IP 10.0.2.15.54580 > 13.224.212.47.443: Flags [.], ack 422239, win 65535, length 0
19:35:39.894188 IP 10.0.2.15.54580 > 13.224.212.47.443: Flags [.], ack 424987, win 65535, length 0
19:35:39.894297 IP 10.0.2.15.54580 > 13.224.212.47.443: Flags [.], ack 427735, win 65535, length 0
19:35:39.894412 IP 13.224.212.47.443 > 10.0.2.15.54580: Flags [P.], seq 427735:433231, ack 803, win 65535, length 5496
19:35:39.894413 IP 13.224.212.47.443 > 10.0.2.15.54580: Flags [P.], seq 433231:435979, ack 803, win 65535, length 2748
19:35:39.894423 IP 10.0.2.15.54580 > 13.224.212.47.443: Flags [.], ack 433231, win 65535, length 0
19:35:39.894436 IP 10.0.2.15.54580 > 13.224.212.47.443: Flags [.], ack 435979, win 65535, length 0
19:35:39.894602 IP 13.224.212.47.443 > 10.0.2.15.54580: Flags [P.], seq 435979:440101, ack 803, win 65535, length 4122
19:35:39.894610 IP 10.0.2.15.54580 > 13.224.212.47.443: Flags [.], ack 440101, win 65535, length 0
19:35:39.894709 IP 13.224.212.47.443 > 10.0.2.15.54580: Flags [P.], seq 440101:441475, ack 803, win 65535, length 1374
19:35:39.894713 IP 10.0.2.15.54580 > 13.224.212.47.443: Flags [.], ack 441475, win 65535, length 0
19:35:39.895352 IP 13.224.212.47.443 > 10.0.2.15.54580: Flags [P.], seq 441475:445597, ack 803, win 65535, length 4122
19:35:39.895365 IP 10.0.2.15.54580 > 13.224.212.47.443: Flags [.], ack 445597, win 65535, length 0
19:35:39.895756 IP 13.224.212.47.443 > 10.0.2.15.54580: Flags [P.], seq 445597:449719, ack 803, win 65535, length 4122
19:35:39.895758 IP 13.224.212.47.443 > 10.0.2.15.54580: Flags [P.], seq 449719:453841, ack 803, win 65535, length 4122
19:35:39.895769 IP 10.0.2.15.54580 > 13.224.212.47.443: Flags [.], ack 449719, win 65535, length 0
19:35:39.895786 IP 10.0.2.15.54580 > 13.224.212.47.443: Flags [.], ack 453841, win 65535, length 0
19:35:39.896137 IP 13.224.212.47.443 > 10.0.2.15.54580: Flags [P.], seq 453841:457963, ack 803, win 65535, length 4122
19:35:39.896148 IP 10.0.2.15.54580 > 13.224.212.47.443: Flags [.], ack 457963, win 65535, length 0
19:35:39.896292 IP 13.224.212.47.443 > 10.0.2.15.54580: Flags [P.], seq 457963:460711, ack 803, win 65535, length 2748
19:35:39.896340 IP 10.0.2.15.54580 > 13.224.212.47.443: Flags [.], ack 460711, win 65535, length 0
19:35:39.896667 IP 13.224.212.47.443 > 10.0.2.15.54580: Flags [P.], seq 460711:464833, ack 803, win 65535, length 4122
19:35:39.896669 IP 13.224.212.47.443 > 10.0.2.15.54580: Flags [P.], seq 464833:467581, ack 803, win 65535, length 2748
19:35:39.896682 IP 10.0.2.15.54580 > 13.224.212.47.443: Flags [.], ack 464833, win 65535, length 0
19:35:39.896708 IP 10.0.2.15.54580 > 13.224.212.47.443: Flags [.], ack 467581, win 65535, length 0
19:35:39.897093 IP 13.224.212.47.443 > 10.0.2.15.54580: Flags [P.], seq 467581:470329, ack 803, win 65535, length 2748
19:35:39.897095 IP 13.224.212.47.443 > 10.0.2.15.54580: Flags [P.], seq 470329:473077, ack 803, win 65535, length 2748
19:35:39.897095 IP 13.224.212.47.443 > 10.0.2.15.54580: Flags [P.], seq 473077:474451, ack 803, win 65535, length 1374
19:35:39.897096 IP 13.224.212.47.443 > 10.0.2.15.54580: Flags [P.], seq 474451:478573, ack 803, win 65535, length 4122
19:35:39.897143 IP 10.0.2.15.54580 > 13.224.212.47.443: Flags [.], ack 470329, win 65535, length 0
19:35:39.897160 IP 10.0.2.15.54580 > 13.224.212.47.443: Flags [.], ack 473077, win 65535, length 0
19:35:39.897168 IP 10.0.2.15.54580 > 13.224.212.47.443: Flags [.], ack 474451, win 65535, length 0
19:35:39.897175 IP 10.0.2.15.54580 > 13.224.212.47.443: Flags [.], ack 478573, win 65535, length 0
19:35:39.897188 IP 13.224.212.47.443 > 10.0.2.15.54580: Flags [P.], seq 478573:481321, ack 803, win 65535, length 2748
19:35:39.897192 IP 10.0.2.15.54580 > 13.224.212.47.443: Flags [.], ack 481321, win 65535, length 0
19:35:39.897505 IP 13.224.212.47.443 > 10.0.2.15.54580: Flags [P.], seq 481321:484069, ack 803, win 65535, length 2748
19:35:39.897507 IP 13.224.212.47.443 > 10.0.2.15.54580: Flags [P.], seq 484069:489565, ack 803, win 65535, length 5496
19:35:39.897639 IP 10.0.2.15.54580 > 13.224.212.47.443: Flags [.], ack 484069, win 65535, length 0
19:35:39.897670 IP 10.0.2.15.54580 > 13.224.212.47.443: Flags [.], ack 489565, win 65535, length 0
19:35:39.897795 IP 13.224.212.47.443 > 10.0.2.15.54580: Flags [P.], seq 489565:493687, ack 803, win 65535, length 4122
19:35:39.897803 IP 10.0.2.15.54580 > 13.224.212.47.443: Flags [.], ack 493687, win 65535, length 0
19:35:39.898851 IP 13.224.212.47.443 > 10.0.2.15.54580: Flags [P.], seq 493687:499183, ack 803, win 65535, length 5496
19:35:39.898855 IP 13.224.212.47.443 > 10.0.2.15.54580: Flags [P.], seq 499183:501931, ack 803, win 65535, length 2748
19:35:39.898856 IP 13.224.212.47.443 > 10.0.2.15.54580: Flags [P.], seq 501931:507427, ack 803, win 65535, length 5496
19:35:39.898879 IP 10.0.2.15.54580 > 13.224.212.47.443: Flags [.], ack 499183, win 65535, length 0
19:35:39.899091 IP 10.0.2.15.54580 > 13.224.212.47.443: Flags [.], ack 501931, win 65535, length 0
19:35:39.899160 IP 10.0.2.15.54580 > 13.224.212.47.443: Flags [.], ack 507427, win 65535, length 0
19:35:39.899256 IP 13.224.212.47.443 > 10.0.2.15.54580: Flags [P.], seq 507427:512923, ack 803, win 65535, length 5496
19:35:39.899264 IP 10.0.2.15.54580 > 13.224.212.47.443: Flags [.], ack 512923, win 65535, length 0
19:35:39.899850 IP 13.224.212.47.443 > 10.0.2.15.54580: Flags [P.], seq 512923:517045, ack 803, win 65535, length 4122
19:35:39.899852 IP 13.224.212.47.443 > 10.0.2.15.54580: Flags [P.], seq 517045:519793, ack 803, win 65535, length 2748
19:35:39.899853 IP 13.224.212.47.443 > 10.0.2.15.54580: Flags [P.], seq 519793:522541, ack 803, win 65535, length 2748
19:35:39.899854 IP 13.224.212.47.443 > 10.0.2.15.54580: Flags [P.], seq 522541:528037, ack 803, win 65535, length 5496
19:35:39.899872 IP 10.0.2.15.54580 > 13.224.212.47.443: Flags [.], ack 517045, win 65535, length 0
19:35:39.899897 IP 10.0.2.15.54580 > 13.224.212.47.443: Flags [.], ack 519793, win 65535, length 0
19:35:39.899911 IP 10.0.2.15.54580 > 13.224.212.47.443: Flags [.], ack 522541, win 65535, length 0
19:35:39.899923 IP 10.0.2.15.54580 > 13.224.212.47.443: Flags [.], ack 528037, win 65535, length 0
19:35:39.901913 IP 13.224.212.47.443 > 10.0.2.15.54580: Flags [P.], seq 528037:532159, ack 803, win 65535, length 4122
19:35:39.901937 IP 10.0.2.15.54580 > 13.224.212.47.443: Flags [.], ack 532159, win 65535, length 0
19:35:39.902984 IP 13.224.212.47.443 > 10.0.2.15.54580: Flags [P.], seq 532159:561013, ack 803, win 65535, length 28854
19:35:39.903006 IP 10.0.2.15.54580 > 13.224.212.47.443: Flags [.], ack 561013, win 65535, length 0
19:35:39.903166 IP 13.224.212.47.443 > 10.0.2.15.54580: Flags [P.], seq 561013:567883, ack 803, win 65535, length 6870
19:35:39.903179 IP 10.0.2.15.54580 > 13.224.212.47.443: Flags [.], ack 567883, win 65535, length 0
19:35:39.903837 IP 13.224.212.47.443 > 10.0.2.15.54580: Flags [P.], seq 567883:585745, ack 803, win 65535, length 17862
19:35:39.903858 IP 10.0.2.15.54580 > 13.224.212.47.443: Flags [.], ack 585745, win 65535, length 0
19:35:39.903896 IP 13.224.212.47.443 > 10.0.2.15.54580: Flags [P.], seq 585745:589867, ack 803, win 65535, length 4122
19:35:39.903897 IP 13.224.212.47.443 > 10.0.2.15.54580: Flags [P.], seq 589867:592615, ack 803, win 65535, length 2748
19:35:39.903897 IP 13.224.212.47.443 > 10.0.2.15.54580: Flags [P.], seq 592615:595363, ack 803, win 65535, length 2748
19:35:39.903898 IP 13.224.212.47.443 > 10.0.2.15.54580: Flags [P.], seq 595363:598111, ack 803, win 65535, length 2748
19:35:39.903909 IP 10.0.2.15.54580 > 13.224.212.47.443: Flags [.], ack 589867, win 65535, length 0
19:35:39.903922 IP 10.0.2.15.54580 > 13.224.212.47.443: Flags [.], ack 592615, win 65535, length 0
19:35:39.903934 IP 10.0.2.15.54580 > 13.224.212.47.443: Flags [.], ack 595363, win 65535, length 0
19:35:39.903945 IP 10.0.2.15.54580 > 13.224.212.47.443: Flags [.], ack 598111, win 65535, length 0
19:35:39.903961 IP 13.224.212.47.443 > 10.0.2.15.54580: Flags [P.], seq 598111:600859, ack 803, win 65535, length 2748
19:35:39.903966 IP 10.0.2.15.54580 > 13.224.212.47.443: Flags [.], ack 600859, win 65535, length 0
19:35:39.904427 IP 13.224.212.47.443 > 10.0.2.15.54580: Flags [P.], seq 600859:603607, ack 803, win 65535, length 2748
19:35:39.904428 IP 13.224.212.47.443 > 10.0.2.15.54580: Flags [P.], seq 603607:606355, ack 803, win 65535, length 2748
19:35:39.904441 IP 10.0.2.15.54580 > 13.224.212.47.443: Flags [.], ack 603607, win 65535, length 0
19:35:39.904455 IP 10.0.2.15.54580 > 13.224.212.47.443: Flags [.], ack 606355, win 65535, length 0
19:35:39.908476 IP 13.224.212.47.443 > 10.0.2.15.54580: Flags [P.], seq 606355:614599, ack 803, win 65535, length 8244
19:35:39.908478 IP 13.224.212.47.443 > 10.0.2.15.54580: Flags [P.], seq 614599:618721, ack 803, win 65535, length 4122
19:35:39.908501 IP 10.0.2.15.54580 > 13.224.212.47.443: Flags [.], ack 614599, win 65535, length 0
19:35:39.908595 IP 10.0.2.15.54580 > 13.224.212.47.443: Flags [.], ack 618721, win 65535, length 0
19:35:39.908630 IP 13.224.212.47.443 > 10.0.2.15.54580: Flags [P.], seq 618721:624217, ack 803, win 65535, length 5496
19:35:39.908632 IP 13.224.212.47.443 > 10.0.2.15.54580: Flags [P.], seq 624217:626965, ack 803, win 65535, length 2748
19:35:39.908641 IP 10.0.2.15.54580 > 13.224.212.47.443: Flags [.], ack 624217, win 65535, length 0
19:35:39.908657 IP 10.0.2.15.54580 > 13.224.212.47.443: Flags [.], ack 626965, win 65535, length 0
19:35:39.908964 IP 13.224.212.47.443 > 10.0.2.15.54580: Flags [P.], seq 626965:629713, ack 803, win 65535, length 2748
19:35:39.908966 IP 13.224.212.47.443 > 10.0.2.15.54580: Flags [P.], seq 629713:632461, ack 803, win 65535, length 2748
19:35:39.908985 IP 10.0.2.15.54580 > 13.224.212.47.443: Flags [.], ack 629713, win 65535, length 0
19:35:39.909125 IP 10.0.2.15.54580 > 13.224.212.47.443: Flags [.], ack 632461, win 65535, length 0
19:35:39.909675 IP 13.224.212.47.443 > 10.0.2.15.54580: Flags [P.], seq 632461:636583, ack 803, win 65535, length 4122
19:35:39.909676 IP 13.224.212.47.443 > 10.0.2.15.54580: Flags [P.], seq 636583:639331, ack 803, win 65535, length 2748
19:35:39.909677 IP 13.224.212.47.443 > 10.0.2.15.54580: Flags [P.], seq 639331:644827, ack 803, win 65535, length 5496
19:35:39.909688 IP 10.0.2.15.54580 > 13.224.212.47.443: Flags [.], ack 636583, win 65535, length 0
19:35:39.909786 IP 10.0.2.15.54580 > 13.224.212.47.443: Flags [.], ack 639331, win 65535, length 0
19:35:39.909800 IP 10.0.2.15.54580 > 13.224.212.47.443: Flags [.], ack 644827, win 65535, length 0
19:35:39.909823 IP 13.224.212.47.443 > 10.0.2.15.54580: Flags [P.], seq 644827:647575, ack 803, win 65535, length 2748
19:35:39.909824 IP 13.224.212.47.443 > 10.0.2.15.54580: Flags [P.], seq 647575:650323, ack 803, win 65535, length 2748
19:35:39.909831 IP 10.0.2.15.54580 > 13.224.212.47.443: Flags [.], ack 647575, win 65535, length 0
19:35:39.909873 IP 10.0.2.15.54580 > 13.224.212.47.443: Flags [.], ack 650323, win 65535, length 0
19:35:39.910006 IP 13.224.212.47.443 > 10.0.2.15.54580: Flags [P.], seq 650323:655819, ack 803, win 65535, length 5496
19:35:39.910062 IP 10.0.2.15.54580 > 13.224.212.47.443: Flags [.], ack 655819, win 65535, length 0
19:35:39.910397 IP 13.224.212.47.443 > 10.0.2.15.54580: Flags [P.], seq 655819:659941, ack 803, win 65535, length 4122
19:35:39.910399 IP 13.224.212.47.443 > 10.0.2.15.54580: Flags [P.], seq 659941:662689, ack 803, win 65535, length 2748
19:35:39.910400 IP 13.224.212.47.443 > 10.0.2.15.54580: Flags [P.], seq 662689:668185, ack 803, win 65535, length 5496
19:35:39.910411 IP 10.0.2.15.54580 > 13.224.212.47.443: Flags [.], ack 659941, win 65535, length 0
19:35:39.910429 IP 10.0.2.15.54580 > 13.224.212.47.443: Flags [.], ack 662689, win 65535, length 0
19:35:39.910441 IP 10.0.2.15.54580 > 13.224.212.47.443: Flags [.], ack 668185, win 65535, length 0
19:35:39.910656 IP 13.224.212.47.443 > 10.0.2.15.54580: Flags [P.], seq 668185:672307, ack 803, win 65535, length 4122
19:35:39.910665 IP 10.0.2.15.54580 > 13.224.212.47.443: Flags [.], ack 672307, win 65535, length 0
19:35:39.911007 IP 13.224.212.47.443 > 10.0.2.15.54580: Flags [P.], seq 672307:677803, ack 803, win 65535, length 5496
19:35:39.911020 IP 10.0.2.15.54580 > 13.224.212.47.443: Flags [.], ack 677803, win 65535, length 0
19:35:39.911237 IP 13.224.212.47.443 > 10.0.2.15.54580: Flags [P.], seq 677803:680551, ack 803, win 65535, length 2748
19:35:39.911324 IP 10.0.2.15.54580 > 13.224.212.47.443: Flags [.], ack 680551, win 65535, length 0
19:35:39.911444 IP 13.224.212.47.443 > 10.0.2.15.54580: Flags [P.], seq 680551:687421, ack 803, win 65535, length 6870
19:35:39.911451 IP 10.0.2.15.54580 > 13.224.212.47.443: Flags [.], ack 687421, win 65535, length 0
19:35:39.911922 IP 13.224.212.47.443 > 10.0.2.15.54580: Flags [P.], seq 687421:691543, ack 803, win 65535, length 4122
19:35:39.911932 IP 10.0.2.15.54580 > 13.224.212.47.443: Flags [.], ack 691543, win 65535, length 0
19:35:39.912076 IP 13.224.212.47.443 > 10.0.2.15.54580: Flags [P.], seq 691543:697039, ack 803, win 65535, length 5496
19:35:39.912084 IP 10.0.2.15.54580 > 13.224.212.47.443: Flags [.], ack 697039, win 65535, length 0
19:35:39.912296 IP 13.224.212.47.443 > 10.0.2.15.54580: Flags [P.], seq 697039:702535, ack 803, win 65535, length 5496
19:35:39.912306 IP 10.0.2.15.54580 > 13.224.212.47.443: Flags [.], ack 702535, win 65535, length 0
19:35:39.912518 IP 13.224.212.47.443 > 10.0.2.15.54580: Flags [P.], seq 702535:706657, ack 803, win 65535, length 4122
19:35:39.912520 IP 13.224.212.47.443 > 10.0.2.15.54580: Flags [P.], seq 706657:709405, ack 803, win 65535, length 2748
19:35:39.912532 IP 10.0.2.15.54580 > 13.224.212.47.443: Flags [.], ack 706657, win 65535, length 0
19:35:39.912548 IP 10.0.2.15.54580 > 13.224.212.47.443: Flags [.], ack 709405, win 65535, length 0
19:35:39.912759 IP 13.224.212.47.443 > 10.0.2.15.54580: Flags [P.], seq 709405:713527, ack 803, win 65535, length 4122
19:35:39.912770 IP 10.0.2.15.54580 > 13.224.212.47.443: Flags [.], ack 713527, win 65535, length 0
19:35:39.912989 IP 13.224.212.47.443 > 10.0.2.15.54580: Flags [P.], seq 713527:716275, ack 803, win 65535, length 2748
19:35:39.912990 IP 13.224.212.47.443 > 10.0.2.15.54580: Flags [P.], seq 716275:719023, ack 803, win 65535, length 2748
19:35:39.913003 IP 10.0.2.15.54580 > 13.224.212.47.443: Flags [.], ack 716275, win 65535, length 0
19:35:39.913100 IP 10.0.2.15.54580 > 13.224.212.47.443: Flags [.], ack 719023, win 65535, length 0
19:35:39.913243 IP 13.224.212.47.443 > 10.0.2.15.54580: Flags [P.], seq 719023:721771, ack 803, win 65535, length 2748
19:35:39.913244 IP 13.224.212.47.443 > 10.0.2.15.54580: Flags [P.], seq 721771:724519, ack 803, win 65535, length 2748
19:35:39.913251 IP 10.0.2.15.54580 > 13.224.212.47.443: Flags [.], ack 721771, win 65535, length 0
19:35:39.913295 IP 10.0.2.15.54580 > 13.224.212.47.443: Flags [.], ack 724519, win 65535, length 0
19:35:39.914002 IP 13.224.212.47.443 > 10.0.2.15.54580: Flags [P.], seq 724519:727267, ack 803, win 65535, length 2748
19:35:39.914004 IP 13.224.212.47.443 > 10.0.2.15.54580: Flags [P.], seq 727267:731389, ack 803, win 65535, length 4122
19:35:39.914015 IP 10.0.2.15.54580 > 13.224.212.47.443: Flags [.], ack 727267, win 65535, length 0
19:35:39.914027 IP 10.0.2.15.54580 > 13.224.212.47.443: Flags [.], ack 731389, win 65535, length 0
19:35:39.914170 IP 13.224.212.47.443 > 10.0.2.15.54580: Flags [P.], seq 731389:734137, ack 803, win 65535, length 2748
19:35:39.914178 IP 10.0.2.15.54580 > 13.224.212.47.443: Flags [.], ack 734137, win 65535, length 0
19:35:39.914556 IP 13.224.212.47.443 > 10.0.2.15.54580: Flags [P.], seq 734137:736885, ack 803, win 65535, length 2748
19:35:39.914560 IP 13.224.212.47.443 > 10.0.2.15.54580: Flags [P.], seq 736885:739633, ack 803, win 65535, length 2748
19:35:39.914570 IP 13.224.212.47.443 > 10.0.2.15.54580: Flags [P.], seq 739633:742381, ack 803, win 65535, length 2748
19:35:39.914625 IP 10.0.2.15.54580 > 13.224.212.47.443: Flags [.], ack 736885, win 65535, length 0
19:35:39.914645 IP 10.0.2.15.54580 > 13.224.212.47.443: Flags [.], ack 739633, win 65535, length 0
19:35:39.914657 IP 10.0.2.15.54580 > 13.224.212.47.443: Flags [.], ack 742381, win 65535, length 0
19:35:39.915015 IP 13.224.212.47.443 > 10.0.2.15.54580: Flags [P.], seq 742381:745129, ack 803, win 65535, length 2748
19:35:39.915029 IP 10.0.2.15.54580 > 13.224.212.47.443: Flags [.], ack 745129, win 65535, length 0
19:35:39.915566 IP 13.224.212.47.443 > 10.0.2.15.54580: Flags [P.], seq 745129:750625, ack 803, win 65535, length 5496
19:35:39.915569 IP 13.224.212.47.443 > 10.0.2.15.54580: Flags [P.], seq 750625:756121, ack 803, win 65535, length 5496
19:35:39.915591 IP 10.0.2.15.54580 > 13.224.212.47.443: Flags [.], ack 750625, win 65535, length 0
19:35:39.915612 IP 10.0.2.15.54580 > 13.224.212.47.443: Flags [.], ack 756121, win 65535, length 0
19:35:39.916314 IP 13.224.212.47.443 > 10.0.2.15.54580: Flags [P.], seq 756121:761617, ack 803, win 65535, length 5496
19:35:39.916328 IP 10.0.2.15.54580 > 13.224.212.47.443: Flags [.], ack 761617, win 65535, length 0
19:35:39.916476 IP 13.224.212.47.443 > 10.0.2.15.54580: Flags [P.], seq 761617:768487, ack 803, win 65535, length 6870
19:35:39.916478 IP 13.224.212.47.443 > 10.0.2.15.54580: Flags [P.], seq 768487:773983, ack 803, win 65535, length 5496
19:35:39.916490 IP 10.0.2.15.54580 > 13.224.212.47.443: Flags [.], ack 768487, win 65535, length 0
19:35:39.916597 IP 10.0.2.15.54580 > 13.224.212.47.443: Flags [.], ack 773983, win 65535, length 0
19:35:39.916714 IP 13.224.212.47.443 > 10.0.2.15.54580: Flags [P.], seq 773983:778105, ack 803, win 65535, length 4122
19:35:39.916716 IP 13.224.212.47.443 > 10.0.2.15.54580: Flags [P.], seq 778105:783601, ack 803, win 65535, length 5496
19:35:39.916717 IP 13.224.212.47.443 > 10.0.2.15.54580: Flags [P.], seq 783601:786349, ack 803, win 65535, length 2748
19:35:39.916729 IP 10.0.2.15.54580 > 13.224.212.47.443: Flags [.], ack 778105, win 65535, length 0
19:35:39.916797 IP 10.0.2.15.54580 > 13.224.212.47.443: Flags [.], ack 783601, win 65535, length 0
19:35:39.916841 IP 10.0.2.15.54580 > 13.224.212.47.443: Flags [.], ack 786349, win 65535, length 0
19:35:39.916866 IP 13.224.212.47.443 > 10.0.2.15.54580: Flags [P.], seq 786349:790471, ack 803, win 65535, length 4122
19:35:39.916867 IP 13.224.212.47.443 > 10.0.2.15.54580: Flags [P.], seq 790471:793219, ack 803, win 65535, length 2748
19:35:39.916868 IP 13.224.212.47.443 > 10.0.2.15.54580: Flags [.], seq 793219:794679, ack 803, win 65535, length 1460
19:35:39.916875 IP 10.0.2.15.54580 > 13.224.212.47.443: Flags [.], ack 790471, win 65535, length 0
19:35:39.916890 IP 10.0.2.15.54580 > 13.224.212.47.443: Flags [.], ack 793219, win 65535, length 0
19:35:39.916903 IP 10.0.2.15.54580 > 13.224.212.47.443: Flags [.], ack 794679, win 65535, length 0
19:35:39.917101 IP 13.224.212.47.443 > 10.0.2.15.54580: Flags [P.], seq 794679:795967, ack 803, win 65535, length 1288
19:35:39.917102 IP 13.224.212.47.443 > 10.0.2.15.54580: Flags [P.], seq 795967:798715, ack 803, win 65535, length 2748
19:35:39.917151 IP 10.0.2.15.54580 > 13.224.212.47.443: Flags [.], ack 795967, win 65535, length 0
19:35:39.917223 IP 10.0.2.15.54580 > 13.224.212.47.443: Flags [.], ack 798715, win 65535, length 0
19:35:39.917382 IP 13.224.212.47.443 > 10.0.2.15.54580: Flags [P.], seq 798715:801463, ack 803, win 65535, length 2748
19:35:39.917384 IP 13.224.212.47.443 > 10.0.2.15.54580: Flags [P.], seq 801463:805585, ack 803, win 65535, length 4122
19:35:39.917384 IP 13.224.212.47.443 > 10.0.2.15.54580: Flags [P.], seq 805585:806959, ack 803, win 65535, length 1374
19:35:39.917400 IP 10.0.2.15.54580 > 13.224.212.47.443: Flags [.], ack 801463, win 65535, length 0
19:35:39.917418 IP 10.0.2.15.54580 > 13.224.212.47.443: Flags [.], ack 805585, win 65535, length 0
19:35:39.917429 IP 10.0.2.15.54580 > 13.224.212.47.443: Flags [.], ack 806959, win 65535, length 0
19:35:39.918798 IP 13.224.212.47.443 > 10.0.2.15.54580: Flags [P.], seq 806959:815203, ack 803, win 65535, length 8244
19:35:39.918800 IP 13.224.212.47.443 > 10.0.2.15.54580: Flags [P.], seq 815203:817951, ack 803, win 65535, length 2748
19:35:39.918890 IP 13.224.212.47.443 > 10.0.2.15.54580: Flags [P.], seq 817951:820699, ack 803, win 65535, length 2748
19:35:39.919163 IP 13.224.212.47.443 > 10.0.2.15.54580: Flags [P.], seq 820699:826195, ack 803, win 65535, length 5496
19:35:39.919276 IP 13.224.212.47.443 > 10.0.2.15.54580: Flags [P.], seq 826195:830317, ack 803, win 65535, length 4122
19:35:39.919277 IP 13.224.212.47.443 > 10.0.2.15.54580: Flags [P.], seq 830317:833065, ack 803, win 65535, length 2748
19:35:39.919428 IP 13.224.212.47.443 > 10.0.2.15.54580: Flags [P.], seq 833065:835813, ack 803, win 65535, length 2748
19:35:39.919524 IP 13.224.212.47.443 > 10.0.2.15.54580: Flags [P.], seq 835813:838561, ack 803, win 65535, length 2748
19:35:39.919775 IP 13.224.212.47.443 > 10.0.2.15.54580: Flags [P.], seq 838561:842683, ack 803, win 65535, length 4122
19:35:39.920339 IP 10.0.2.15.54580 > 13.224.212.47.443: Flags [.], ack 842683, win 65535, length 0
19:35:39.920557 IP 13.224.212.47.443 > 10.0.2.15.54580: Flags [P.], seq 842683:846805, ack 803, win 65535, length 4122
19:35:39.920566 IP 10.0.2.15.54580 > 13.224.212.47.443: Flags [.], ack 846805, win 65535, length 0
19:35:39.920748 IP 13.224.212.47.443 > 10.0.2.15.54580: Flags [P.], seq 846805:850927, ack 803, win 65535, length 4122
19:35:39.920757 IP 10.0.2.15.54580 > 13.224.212.47.443: Flags [.], ack 850927, win 65535, length 0
19:35:39.921000 IP 13.224.212.47.443 > 10.0.2.15.54580: Flags [P.], seq 850927:856423, ack 803, win 65535, length 5496
19:35:39.921010 IP 10.0.2.15.54580 > 13.224.212.47.443: Flags [.], ack 856423, win 65535, length 0
19:35:39.921201 IP 13.224.212.47.443 > 10.0.2.15.54580: Flags [P.], seq 856423:860545, ack 803, win 65535, length 4122
19:35:39.921210 IP 10.0.2.15.54580 > 13.224.212.47.443: Flags [.], ack 860545, win 65535, length 0
19:35:39.921336 IP 13.224.212.47.443 > 10.0.2.15.54580: Flags [P.], seq 860545:863293, ack 803, win 65535, length 2748
19:35:39.921337 IP 13.224.212.47.443 > 10.0.2.15.54580: Flags [P.], seq 863293:864667, ack 803, win 65535, length 1374
19:35:39.921347 IP 10.0.2.15.54580 > 13.224.212.47.443: Flags [.], ack 863293, win 65535, length 0
19:35:39.921357 IP 10.0.2.15.54580 > 13.224.212.47.443: Flags [.], ack 864667, win 65535, length 0
19:35:39.921539 IP 13.224.212.47.443 > 10.0.2.15.54580: Flags [P.], seq 864667:868789, ack 803, win 65535, length 4122
19:35:39.921540 IP 13.224.212.47.443 > 10.0.2.15.54580: Flags [P.], seq 868789:871537, ack 803, win 65535, length 2748
19:35:39.921548 IP 10.0.2.15.54580 > 13.224.212.47.443: Flags [.], ack 868789, win 65535, length 0
19:35:39.921562 IP 10.0.2.15.54580 > 13.224.212.47.443: Flags [.], ack 871537, win 65535, length 0
19:35:39.921684 IP 13.224.212.47.443 > 10.0.2.15.54580: Flags [P.], seq 871537:874285, ack 803, win 65535, length 2748
19:35:39.921721 IP 10.0.2.15.54580 > 13.224.212.47.443: Flags [.], ack 874285, win 65535, length 0
19:35:39.921995 IP 13.224.212.47.443 > 10.0.2.15.54580: Flags [P.], seq 874285:877033, ack 803, win 65535, length 2748
19:35:39.921997 IP 13.224.212.47.443 > 10.0.2.15.54580: Flags [.], seq 877033:878493, ack 803, win 65535, length 1460
19:35:39.922008 IP 10.0.2.15.54580 > 13.224.212.47.443: Flags [.], ack 877033, win 65535, length 0
19:35:39.922022 IP 10.0.2.15.54580 > 13.224.212.47.443: Flags [.], ack 878493, win 65535, length 0
19:35:39.922140 IP 13.224.212.47.443 > 10.0.2.15.54580: Flags [P.], seq 878493:879781, ack 803, win 65535, length 1288
19:35:39.922142 IP 13.224.212.47.443 > 10.0.2.15.54580: Flags [P.], seq 879781:882529, ack 803, win 65535, length 2748
19:35:39.922148 IP 10.0.2.15.54580 > 13.224.212.47.443: Flags [.], ack 879781, win 65535, length 0
19:35:39.922161 IP 10.0.2.15.54580 > 13.224.212.47.443: Flags [.], ack 882529, win 65535, length 0
19:35:39.922312 IP 13.224.212.47.443 > 10.0.2.15.54580: Flags [P.], seq 882529:886651, ack 803, win 65535, length 4122
19:35:39.922319 IP 10.0.2.15.54580 > 13.224.212.47.443: Flags [.], ack 886651, win 65535, length 0
19:35:39.922474 IP 13.224.212.47.443 > 10.0.2.15.54580: Flags [P.], seq 886651:889399, ack 803, win 65535, length 2748
19:35:39.922483 IP 10.0.2.15.54580 > 13.224.212.47.443: Flags [.], ack 889399, win 65535, length 0
19:35:39.922564 IP 13.224.212.47.443 > 10.0.2.15.54580: Flags [P.], seq 889399:892147, ack 803, win 65535, length 2748
19:35:39.922608 IP 10.0.2.15.54580 > 13.224.212.47.443: Flags [.], ack 892147, win 65535, length 0
19:35:39.922651 IP 13.224.212.47.443 > 10.0.2.15.54580: Flags [P.], seq 892147:894895, ack 803, win 65535, length 2748
19:35:39.922710 IP 10.0.2.15.54580 > 13.224.212.47.443: Flags [.], ack 894895, win 65535, length 0
19:35:39.922979 IP 13.224.212.47.443 > 10.0.2.15.54580: Flags [P.], seq 894895:897643, ack 803, win 65535, length 2748
19:35:39.922986 IP 10.0.2.15.54580 > 13.224.212.47.443: Flags [.], ack 897643, win 65535, length 0
19:35:39.923135 IP 13.224.212.47.443 > 10.0.2.15.54580: Flags [P.], seq 897643:903139, ack 803, win 65535, length 5496
19:35:39.923184 IP 10.0.2.15.54580 > 13.224.212.47.443: Flags [.], ack 903139, win 65535, length 0
19:35:39.923303 IP 13.224.212.47.443 > 10.0.2.15.54580: Flags [P.], seq 903139:907261, ack 803, win 65535, length 4122
19:35:39.923334 IP 10.0.2.15.54580 > 13.224.212.47.443: Flags [.], ack 907261, win 65535, length 0
19:35:39.923495 IP 13.224.212.47.443 > 10.0.2.15.54580: Flags [P.], seq 907261:910009, ack 803, win 65535, length 2748
19:35:39.923822 IP 13.224.212.47.443 > 10.0.2.15.54580: Flags [P.], seq 910009:914131, ack 803, win 65535, length 4122
19:35:39.923823 IP 13.224.212.47.443 > 10.0.2.15.54580: Flags [P.], seq 914131:916879, ack 803, win 65535, length 2748
19:35:39.923824 IP 13.224.212.47.443 > 10.0.2.15.54580: Flags [P.], seq 916879:919627, ack 803, win 65535, length 2748
19:35:39.923824 IP 13.224.212.47.443 > 10.0.2.15.54580: Flags [P.], seq 919627:921001, ack 803, win 65535, length 1374
19:35:39.924001 IP 10.0.2.15.54580 > 13.224.212.47.443: Flags [.], ack 921001, win 65535, length 0
19:35:39.924051 IP 13.224.212.47.443 > 10.0.2.15.54580: Flags [P.], seq 921001:925123, ack 803, win 65535, length 4122
19:35:39.924079 IP 10.0.2.15.54580 > 13.224.212.47.443: Flags [.], ack 925123, win 65535, length 0
19:35:39.924141 IP 13.224.212.47.443 > 10.0.2.15.54580: Flags [P.], seq 925123:926497, ack 803, win 65535, length 1374
19:35:39.924181 IP 10.0.2.15.54580 > 13.224.212.47.443: Flags [.], ack 926497, win 65535, length 0
19:35:39.925115 IP 13.224.212.47.443 > 10.0.2.15.54580: Flags [P.], seq 926497:931993, ack 803, win 65535, length 5496
19:35:39.925117 IP 13.224.212.47.443 > 10.0.2.15.54580: Flags [P.], seq 931993:933367, ack 803, win 65535, length 1374
19:35:39.925198 IP 10.0.2.15.54580 > 13.224.212.47.443: Flags [.], ack 933367, win 65535, length 0
19:35:39.925304 IP 13.224.212.47.443 > 10.0.2.15.54580: Flags [P.], seq 933367:940237, ack 803, win 65535, length 6870
19:35:39.925492 IP 13.224.212.47.443 > 10.0.2.15.54580: Flags [P.], seq 940237:944359, ack 803, win 65535, length 4122
19:35:39.925522 IP 10.0.2.15.54580 > 13.224.212.47.443: Flags [.], ack 944359, win 65535, length 0
19:35:39.925605 IP 13.224.212.47.443 > 10.0.2.15.54580: Flags [.], seq 944359:945819, ack 803, win 65535, length 1460
19:35:39.925613 IP 10.0.2.15.54580 > 13.224.212.47.443: Flags [.], ack 945819, win 65535, length 0
19:35:39.925705 IP 13.224.212.47.443 > 10.0.2.15.54580: Flags [P.], seq 945819:947107, ack 803, win 65535, length 1288
19:35:39.925784 IP 13.224.212.47.443 > 10.0.2.15.54580: Flags [P.], seq 947107:949855, ack 803, win 65535, length 2748
19:35:39.925817 IP 10.0.2.15.54580 > 13.224.212.47.443: Flags [.], ack 949855, win 65535, length 0
19:35:39.925938 IP 13.224.212.47.443 > 10.0.2.15.54580: Flags [P.], seq 949855:953977, ack 803, win 65535, length 4122
19:35:39.926102 IP 13.224.212.47.443 > 10.0.2.15.54580: Flags [P.], seq 953977:956725, ack 803, win 65535, length 2748
19:35:39.926103 IP 13.224.212.47.443 > 10.0.2.15.54580: Flags [P.], seq 956725:958099, ack 803, win 65535, length 1374
19:35:39.926128 IP 10.0.2.15.54580 > 13.224.212.47.443: Flags [.], ack 953977, win 65535, length 0
19:35:39.926245 IP 13.224.212.47.443 > 10.0.2.15.54580: Flags [P.], seq 958099:962221, ack 803, win 65535, length 4122
19:35:39.926279 IP 10.0.2.15.54580 > 13.224.212.47.443: Flags [.], ack 962221, win 65535, length 0
19:35:39.926475 IP 13.224.212.47.443 > 10.0.2.15.54580: Flags [P.], seq 962221:964969, ack 803, win 65535, length 2748
19:35:39.926525 IP 10.0.2.15.54580 > 13.224.212.47.443: Flags [.], ack 964969, win 65535, length 0
19:35:39.926567 IP 13.224.212.47.443 > 10.0.2.15.54580: Flags [P.], seq 964969:966343, ack 803, win 65535, length 1374
19:35:39.926588 IP 10.0.2.15.54580 > 13.224.212.47.443: Flags [.], ack 966343, win 65535, length 0
19:35:39.927264 IP 13.224.212.47.443 > 10.0.2.15.54580: Flags [P.], seq 966343:970465, ack 803, win 65535, length 4122
19:35:39.927266 IP 13.224.212.47.443 > 10.0.2.15.54580: Flags [P.], seq 970465:974587, ack 803, win 65535, length 4122
19:35:39.927267 IP 13.224.212.47.443 > 10.0.2.15.54580: Flags [P.], seq 974587:977335, ack 803, win 65535, length 2748
19:35:39.927306 IP 13.224.212.47.443 > 10.0.2.15.54580: Flags [P.], seq 977335:980083, ack 803, win 65535, length 2748
19:35:39.927365 IP 10.0.2.15.54580 > 13.224.212.47.443: Flags [.], ack 980083, win 65535, length 0
19:35:39.927490 IP 13.224.212.47.443 > 10.0.2.15.54580: Flags [P.], seq 980083:982831, ack 803, win 65535, length 2748
19:35:39.927676 IP 10.0.2.15.54580 > 13.224.212.47.443: Flags [.], ack 982831, win 65535, length 0

