13:19:17.925193 IP 99.84.126.86.443 > 10.0.2.15.51626: Flags [S.], seq 58176001, ack 11800423, win 65535, options [mss 1460], length 0
13:19:17.925248 IP 10.0.2.15.51626 > 99.84.126.86.443: Flags [.], ack 1, win 64240, length 0
13:19:17.934506 IP 10.0.2.15.51626 > 99.84.126.86.443: Flags [P.], seq 1:518, ack 1, win 64240, length 517
13:19:17.935063 IP 99.84.126.86.443 > 10.0.2.15.51626: Flags [.], ack 518, win 65535, length 0
13:19:17.951113 IP 99.84.126.86.443 > 10.0.2.15.51626: Flags [.], seq 1:2921, ack 518, win 65535, length 2920
13:19:17.951131 IP 10.0.2.15.51626 > 99.84.126.86.443: Flags [.], ack 2921, win 62780, length 0
13:19:17.951472 IP 99.84.126.86.443 > 10.0.2.15.51626: Flags [P.], seq 2921:5497, ack 518, win 65535, length 2576
13:19:17.951526 IP 10.0.2.15.51626 > 99.84.126.86.443: Flags [.], ack 5497, win 61320, length 0
13:19:17.951741 IP 99.84.126.86.443 > 10.0.2.15.51626: Flags [P.], seq 5497:5824, ack 518, win 65535, length 327
13:19:17.951749 IP 10.0.2.15.51626 > 99.84.126.86.443: Flags [.], ack 5824, win 60993, length 0
13:19:17.952604 IP 10.0.2.15.51626 > 99.84.126.86.443: Flags [P.], seq 518:582, ack 5824, win 62780, length 64
13:19:17.952945 IP 99.84.126.86.443 > 10.0.2.15.51626: Flags [.], ack 582, win 65535, length 0
13:19:17.953017 IP 10.0.2.15.51626 > 99.84.126.86.443: Flags [P.], seq 582:628, ack 5824, win 62780, length 46
13:19:17.953044 IP 10.0.2.15.51626 > 99.84.126.86.443: Flags [P.], seq 628:677, ack 5824, win 62780, length 49
13:19:17.953340 IP 99.84.126.86.443 > 10.0.2.15.51626: Flags [.], ack 628, win 65535, length 0
13:19:17.953341 IP 99.84.126.86.443 > 10.0.2.15.51626: Flags [.], ack 677, win 65535, length 0
13:19:17.953356 IP 10.0.2.15.51626 > 99.84.126.86.443: Flags [P.], seq 677:712, ack 5824, win 62780, length 35
13:19:17.953723 IP 99.84.126.86.443 > 10.0.2.15.51626: Flags [.], ack 712, win 65535, length 0
13:19:17.953779 IP 10.0.2.15.51626 > 99.84.126.86.443: Flags [P.], seq 712:772, ack 5824, win 62780, length 60
13:19:17.954067 IP 99.84.126.86.443 > 10.0.2.15.51626: Flags [.], ack 772, win 65535, length 0
13:19:17.966240 IP 99.84.126.86.443 > 10.0.2.15.51626: Flags [P.], seq 5824:5895, ack 772, win 65535, length 71
13:19:17.966262 IP 10.0.2.15.51626 > 99.84.126.86.443: Flags [.], ack 5895, win 62780, length 0
13:19:17.966407 IP 10.0.2.15.51626 > 99.84.126.86.443: Flags [P.], seq 772:803, ack 5895, win 62780, length 31
13:19:17.966811 IP 99.84.126.86.443 > 10.0.2.15.51626: Flags [.], ack 803, win 65535, length 0
13:19:17.994923 IP 99.84.126.86.443 > 10.0.2.15.51626: Flags [.], seq 5895:14655, ack 803, win 65535, length 8760
13:19:17.994963 IP 10.0.2.15.51626 > 99.84.126.86.443: Flags [.], ack 14655, win 58400, length 0
13:19:17.995991 IP 99.84.126.86.443 > 10.0.2.15.51626: Flags [.], seq 14655:24875, ack 803, win 65535, length 10220
13:19:17.996022 IP 10.0.2.15.51626 > 99.84.126.86.443: Flags [.], ack 24875, win 58400, length 0
13:19:17.996214 IP 99.84.126.86.443 > 10.0.2.15.51626: Flags [.], seq 24875:27795, ack 803, win 65535, length 2920
13:19:17.996293 IP 99.84.126.86.443 > 10.0.2.15.51626: Flags [.], seq 27795:36555, ack 803, win 65535, length 8760
13:19:17.996318 IP 10.0.2.15.51626 > 99.84.126.86.443: Flags [.], ack 36555, win 46720, length 0
13:19:17.996725 IP 99.84.126.86.443 > 10.0.2.15.51626: Flags [P.], seq 36555:48080, ack 803, win 65535, length 11525
13:19:17.996735 IP 10.0.2.15.51626 > 99.84.126.86.443: Flags [.], ack 48080, win 56940, length 0
13:19:18.008860 IP 99.84.126.86.443 > 10.0.2.15.51626: Flags [.], seq 48080:52460, ack 803, win 65535, length 4380
13:19:18.008881 IP 10.0.2.15.51626 > 99.84.126.86.443: Flags [.], ack 52460, win 61320, length 0
13:19:18.009353 IP 99.84.126.86.443 > 10.0.2.15.51626: Flags [P.], seq 52460:54950, ack 803, win 65535, length 2490
13:19:18.009357 IP 99.84.126.86.443 > 10.0.2.15.51626: Flags [.], seq 54950:62250, ack 803, win 65535, length 7300
13:19:18.009375 IP 10.0.2.15.51626 > 99.84.126.86.443: Flags [.], ack 54950, win 59860, length 0
13:19:18.009668 IP 99.84.126.86.443 > 10.0.2.15.51626: Flags [P.], seq 62250:65942, ack 803, win 65535, length 3692
13:19:18.009764 IP 10.0.2.15.51626 > 99.84.126.86.443: Flags [.], ack 65942, win 52560, length 0
13:19:18.010370 IP 99.84.126.86.443 > 10.0.2.15.51626: Flags [P.], seq 65942:70064, ack 803, win 65535, length 4122
13:19:18.010391 IP 10.0.2.15.51626 > 99.84.126.86.443: Flags [.], ack 70064, win 61320, length 0
13:19:18.011641 IP 99.84.126.86.443 > 10.0.2.15.51626: Flags [P.], seq 70064:83804, ack 803, win 65535, length 13740
13:19:18.011661 IP 10.0.2.15.51626 > 99.84.126.86.443: Flags [.], ack 83804, win 65535, length 0
13:19:18.013789 IP 99.84.126.86.443 > 10.0.2.15.51626: Flags [P.], seq 83804:90674, ack 803, win 65535, length 6870
13:19:18.013807 IP 10.0.2.15.51626 > 99.84.126.86.443: Flags [.], ack 90674, win 65535, length 0
13:19:18.014116 IP 99.84.126.86.443 > 10.0.2.15.51626: Flags [P.], seq 90674:96170, ack 803, win 65535, length 5496
13:19:18.014130 IP 10.0.2.15.51626 > 99.84.126.86.443: Flags [.], ack 96170, win 65535, length 0
13:19:18.016260 IP 99.84.126.86.443 > 10.0.2.15.51626: Flags [P.], seq 96170:107162, ack 803, win 65535, length 10992
13:19:18.016282 IP 10.0.2.15.51626 > 99.84.126.86.443: Flags [.], ack 107162, win 65535, length 0
13:19:18.017238 IP 99.84.126.86.443 > 10.0.2.15.51626: Flags [P.], seq 107162:108536, ack 803, win 65535, length 1374
13:19:18.017258 IP 10.0.2.15.51626 > 99.84.126.86.443: Flags [.], ack 108536, win 65535, length 0
13:19:18.017834 IP 99.84.126.86.443 > 10.0.2.15.51626: Flags [P.], seq 108536:116780, ack 803, win 65535, length 8244
13:19:18.017853 IP 10.0.2.15.51626 > 99.84.126.86.443: Flags [.], ack 116780, win 65535, length 0
13:19:18.023293 IP 99.84.126.86.443 > 10.0.2.15.51626: Flags [P.], seq 116780:131894, ack 803, win 65535, length 15114
13:19:18.023311 IP 10.0.2.15.51626 > 99.84.126.86.443: Flags [.], ack 131894, win 65535, length 0
13:19:18.024772 IP 99.84.126.86.443 > 10.0.2.15.51626: Flags [P.], seq 131894:136016, ack 803, win 65535, length 4122
13:19:18.024812 IP 10.0.2.15.51626 > 99.84.126.86.443: Flags [.], ack 136016, win 65535, length 0
13:19:18.025160 IP 99.84.126.86.443 > 10.0.2.15.51626: Flags [P.], seq 136016:141512, ack 803, win 65535, length 5496
13:19:18.025172 IP 10.0.2.15.51626 > 99.84.126.86.443: Flags [.], ack 141512, win 65535, length 0
13:19:18.025437 IP 99.84.126.86.443 > 10.0.2.15.51626: Flags [P.], seq 141512:145634, ack 803, win 65535, length 4122
13:19:18.025446 IP 10.0.2.15.51626 > 99.84.126.86.443: Flags [.], ack 145634, win 65535, length 0
13:19:18.027391 IP 99.84.126.86.443 > 10.0.2.15.51626: Flags [P.], seq 145634:152504, ack 803, win 65535, length 6870
13:19:18.027412 IP 10.0.2.15.51626 > 99.84.126.86.443: Flags [.], ack 152504, win 65535, length 0
13:19:18.027743 IP 99.84.126.86.443 > 10.0.2.15.51626: Flags [P.], seq 152504:159374, ack 803, win 65535, length 6870
13:19:18.027809 IP 10.0.2.15.51626 > 99.84.126.86.443: Flags [.], ack 159374, win 65535, length 0
13:19:18.030697 IP 99.84.126.86.443 > 10.0.2.15.51626: Flags [P.], seq 159374:177236, ack 803, win 65535, length 17862
13:19:18.030714 IP 10.0.2.15.51626 > 99.84.126.86.443: Flags [.], ack 177236, win 65535, length 0
13:19:18.032074 IP 99.84.126.86.443 > 10.0.2.15.51626: Flags [P.], seq 177236:185480, ack 803, win 65535, length 8244
13:19:18.032094 IP 10.0.2.15.51626 > 99.84.126.86.443: Flags [.], ack 185480, win 65535, length 0
13:19:18.032332 IP 99.84.126.86.443 > 10.0.2.15.51626: Flags [P.], seq 185480:192350, ack 803, win 65535, length 6870
13:19:18.032343 IP 10.0.2.15.51626 > 99.84.126.86.443: Flags [.], ack 192350, win 65535, length 0
13:19:18.035830 IP 99.84.126.86.443 > 10.0.2.15.51626: Flags [P.], seq 192350:197846, ack 803, win 65535, length 5496
13:19:18.035853 IP 10.0.2.15.51626 > 99.84.126.86.443: Flags [.], ack 197846, win 65535, length 0
13:19:18.037404 IP 99.84.126.86.443 > 10.0.2.15.51626: Flags [P.], seq 197846:217082, ack 803, win 65535, length 19236
13:19:18.037424 IP 10.0.2.15.51626 > 99.84.126.86.443: Flags [.], ack 217082, win 65535, length 0
13:19:18.038954 IP 99.84.126.86.443 > 10.0.2.15.51626: Flags [P.], seq 217082:237692, ack 803, win 65535, length 20610
13:19:18.038967 IP 10.0.2.15.51626 > 99.84.126.86.443: Flags [.], ack 237692, win 65535, length 0
13:19:18.039836 IP 99.84.126.86.443 > 10.0.2.15.51626: Flags [P.], seq 237692:243188, ack 803, win 65535, length 5496
13:19:18.039851 IP 10.0.2.15.51626 > 99.84.126.86.443: Flags [.], ack 243188, win 65535, length 0
13:19:18.040218 IP 99.84.126.86.443 > 10.0.2.15.51626: Flags [P.], seq 243188:248684, ack 803, win 65535, length 5496
13:19:18.040232 IP 10.0.2.15.51626 > 99.84.126.86.443: Flags [.], ack 248684, win 65535, length 0
13:19:18.040429 IP 99.84.126.86.443 > 10.0.2.15.51626: Flags [P.], seq 248684:258302, ack 803, win 65535, length 9618
13:19:18.040438 IP 10.0.2.15.51626 > 99.84.126.86.443: Flags [.], ack 258302, win 65535, length 0
13:19:18.040727 IP 99.84.126.86.443 > 10.0.2.15.51626: Flags [.], seq 258302:264142, ack 803, win 65535, length 5840
13:19:18.040738 IP 10.0.2.15.51626 > 99.84.126.86.443: Flags [.], ack 264142, win 65535, length 0
13:19:18.040937 IP 99.84.126.86.443 > 10.0.2.15.51626: Flags [P.], seq 264142:265172, ack 803, win 65535, length 1030
13:19:18.040947 IP 10.0.2.15.51626 > 99.84.126.86.443: Flags [.], ack 265172, win 65535, length 0
13:19:18.041692 IP 99.84.126.86.443 > 10.0.2.15.51626: Flags [P.], seq 265172:272042, ack 803, win 65535, length 6870
13:19:18.041714 IP 10.0.2.15.51626 > 99.84.126.86.443: Flags [.], ack 272042, win 65535, length 0
13:19:18.041909 IP 99.84.126.86.443 > 10.0.2.15.51626: Flags [P.], seq 272042:277538, ack 803, win 65535, length 5496
13:19:18.041925 IP 10.0.2.15.51626 > 99.84.126.86.443: Flags [.], ack 277538, win 65535, length 0
13:19:18.043809 IP 99.84.126.86.443 > 10.0.2.15.51626: Flags [P.], seq 277538:288530, ack 803, win 65535, length 10992
13:19:18.043828 IP 99.84.126.86.443 > 10.0.2.15.51626: Flags [P.], seq 288530:299522, ack 803, win 65535, length 10992
13:19:18.043980 IP 99.84.126.86.443 > 10.0.2.15.51626: Flags [P.], seq 299522:302270, ack 803, win 65535, length 2748
13:19:18.044557 IP 99.84.126.86.443 > 10.0.2.15.51626: Flags [P.], seq 302270:311888, ack 803, win 65535, length 9618
13:19:18.044699 IP 10.0.2.15.51626 > 99.84.126.86.443: Flags [.], ack 302270, win 65535, length 0
13:19:18.044722 IP 10.0.2.15.51626 > 99.84.126.86.443: Flags [.], ack 311888, win 65535, length 0
13:19:18.045517 IP 99.84.126.86.443 > 10.0.2.15.51626: Flags [P.], seq 311888:320132, ack 803, win 65535, length 8244
13:19:18.045536 IP 10.0.2.15.51626 > 99.84.126.86.443: Flags [.], ack 320132, win 65535, length 0
13:19:18.045828 IP 99.84.126.86.443 > 10.0.2.15.51626: Flags [P.], seq 320132:325628, ack 803, win 65535, length 5496
13:19:18.045838 IP 10.0.2.15.51626 > 99.84.126.86.443: Flags [.], ack 325628, win 65535, length 0
13:19:18.046198 IP 99.84.126.86.443 > 10.0.2.15.51626: Flags [P.], seq 325628:333872, ack 803, win 65535, length 8244
13:19:18.046208 IP 10.0.2.15.51626 > 99.84.126.86.443: Flags [.], ack 333872, win 65535, length 0
13:19:18.046755 IP 99.84.126.86.443 > 10.0.2.15.51626: Flags [P.], seq 333872:336620, ack 803, win 65535, length 2748
13:19:18.046758 IP 99.84.126.86.443 > 10.0.2.15.51626: Flags [P.], seq 336620:343490, ack 803, win 65535, length 6870
13:19:18.046775 IP 10.0.2.15.51626 > 99.84.126.86.443: Flags [.], ack 336620, win 65535, length 0
13:19:18.046792 IP 10.0.2.15.51626 > 99.84.126.86.443: Flags [.], ack 343490, win 65535, length 0
13:19:18.047123 IP 99.84.126.86.443 > 10.0.2.15.51626: Flags [P.], seq 343490:350360, ack 803, win 65535, length 6870
13:19:18.047137 IP 10.0.2.15.51626 > 99.84.126.86.443: Flags [.], ack 350360, win 65535, length 0
13:19:18.047307 IP 99.84.126.86.443 > 10.0.2.15.51626: Flags [P.], seq 350360:359978, ack 803, win 65535, length 9618
13:19:18.047340 IP 10.0.2.15.51626 > 99.84.126.86.443: Flags [.], ack 359978, win 65535, length 0
13:19:18.047562 IP 99.84.126.86.443 > 10.0.2.15.51626: Flags [P.], seq 359978:365474, ack 803, win 65535, length 5496
13:19:18.047573 IP 10.0.2.15.51626 > 99.84.126.86.443: Flags [.], ack 365474, win 65535, length 0
13:19:18.047938 IP 99.84.126.86.443 > 10.0.2.15.51626: Flags [P.], seq 365474:366848, ack 803, win 65535, length 1374
13:19:18.047958 IP 10.0.2.15.51626 > 99.84.126.86.443: Flags [.], ack 366848, win 65535, length 0
13:19:18.049053 IP 99.84.126.86.443 > 10.0.2.15.51626: Flags [P.], seq 366848:372344, ack 803, win 65535, length 5496
13:19:18.049074 IP 10.0.2.15.51626 > 99.84.126.86.443: Flags [.], ack 372344, win 65535, length 0
13:19:18.049266 IP 99.84.126.86.443 > 10.0.2.15.51626: Flags [P.], seq 372344:381962, ack 803, win 65535, length 9618
13:19:18.049278 IP 10.0.2.15.51626 > 99.84.126.86.443: Flags [.], ack 381962, win 65535, length 0
13:19:18.051280 IP 99.84.126.86.443 > 10.0.2.15.51626: Flags [P.], seq 381962:383336, ack 803, win 65535, length 1374
13:19:18.051295 IP 10.0.2.15.51626 > 99.84.126.86.443: Flags [.], ack 383336, win 65535, length 0
13:19:18.052323 IP 99.84.126.86.443 > 10.0.2.15.51626: Flags [P.], seq 383336:387458, ack 803, win 65535, length 4122
13:19:18.052347 IP 10.0.2.15.51626 > 99.84.126.86.443: Flags [.], ack 387458, win 65535, length 0
13:19:18.058344 IP 99.84.126.86.443 > 10.0.2.15.51626: Flags [.], seq 387458:451698, ack 803, win 65535, length 64240
13:19:18.058372 IP 10.0.2.15.51626 > 99.84.126.86.443: Flags [.], ack 451698, win 65535, length 0
13:19:18.058667 IP 99.84.126.86.443 > 10.0.2.15.51626: Flags [P.], seq 451698:453158, ack 803, win 65535, length 1460
13:19:18.058676 IP 10.0.2.15.51626 > 99.84.126.86.443: Flags [.], ack 453158, win 65535, length 0
13:19:18.058830 IP 99.84.126.86.443 > 10.0.2.15.51626: Flags [.], seq 453158:461918, ack 803, win 65535, length 8760
13:19:18.058843 IP 10.0.2.15.51626 > 99.84.126.86.443: Flags [.], ack 461918, win 65535, length 0
13:19:18.059323 IP 99.84.126.86.443 > 10.0.2.15.51626: Flags [P.], seq 461918:501500, ack 803, win 65535, length 39582
13:19:18.059337 IP 10.0.2.15.51626 > 99.84.126.86.443: Flags [.], ack 501500, win 65535, length 0

