13:19:21.455655 IP 99.84.126.23.443 > 10.0.2.15.51118: Flags [S.], seq 59200001, ack 3620163632, win 65535, options [mss 1460], length 0
13:19:21.455695 IP 10.0.2.15.51118 > 99.84.126.23.443: Flags [.], ack 1, win 64240, length 0
13:19:21.462804 IP 10.0.2.15.51118 > 99.84.126.23.443: Flags [P.], seq 1:518, ack 1, win 64240, length 517
13:19:21.463246 IP 99.84.126.23.443 > 10.0.2.15.51118: Flags [.], ack 518, win 65535, length 0
13:19:21.483479 IP 99.84.126.23.443 > 10.0.2.15.51118: Flags [.], seq 1:2921, ack 518, win 65535, length 2920
13:19:21.483531 IP 10.0.2.15.51118 > 99.84.126.23.443: Flags [.], ack 2921, win 62780, length 0
13:19:21.483923 IP 99.84.126.23.443 > 10.0.2.15.51118: Flags [P.], seq 2921:4123, ack 518, win 65535, length 1202
13:19:21.483939 IP 10.0.2.15.51118 > 99.84.126.23.443: Flags [.], ack 4123, win 61578, length 0
13:19:21.485528 IP 99.84.126.23.443 > 10.0.2.15.51118: Flags [P.], seq 4123:5824, ack 518, win 65535, length 1701
13:19:21.485543 IP 10.0.2.15.51118 > 99.84.126.23.443: Flags [.], ack 5824, win 62780, length 0
13:19:21.486330 IP 10.0.2.15.51118 > 99.84.126.23.443: Flags [P.], seq 518:582, ack 5824, win 62780, length 64
13:19:21.486532 IP 10.0.2.15.51118 > 99.84.126.23.443: Flags [P.], seq 582:628, ack 5824, win 62780, length 46
13:19:21.486720 IP 99.84.126.23.443 > 10.0.2.15.51118: Flags [.], ack 582, win 65535, length 0
13:19:21.486722 IP 99.84.126.23.443 > 10.0.2.15.51118: Flags [.], ack 628, win 65535, length 0
13:19:21.486775 IP 10.0.2.15.51118 > 99.84.126.23.443: Flags [P.], seq 628:677, ack 5824, win 62780, length 49
13:19:21.486841 IP 10.0.2.15.51118 > 99.84.126.23.443: Flags [P.], seq 677:772, ack 5824, win 62780, length 95
13:19:21.487128 IP 99.84.126.23.443 > 10.0.2.15.51118: Flags [.], ack 677, win 65535, length 0
13:19:21.487130 IP 99.84.126.23.443 > 10.0.2.15.51118: Flags [.], ack 772, win 65535, length 0
13:19:21.500715 IP 99.84.126.23.443 > 10.0.2.15.51118: Flags [P.], seq 5824:5917, ack 772, win 65535, length 93
13:19:21.500739 IP 10.0.2.15.51118 > 99.84.126.23.443: Flags [.], ack 5917, win 62780, length 0
13:19:21.501001 IP 10.0.2.15.51118 > 99.84.126.23.443: Flags [P.], seq 772:803, ack 5917, win 62780, length 31
13:19:21.501362 IP 99.84.126.23.443 > 10.0.2.15.51118: Flags [.], ack 803, win 65535, length 0
13:19:21.518961 IP 99.84.126.23.443 > 10.0.2.15.51118: Flags [.], seq 5917:14677, ack 803, win 65535, length 8760
13:19:21.519002 IP 10.0.2.15.51118 > 99.84.126.23.443: Flags [.], ack 14677, win 58400, length 0
13:19:21.519643 IP 99.84.126.23.443 > 10.0.2.15.51118: Flags [P.], seq 14677:22788, ack 803, win 65535, length 8111
13:19:21.519711 IP 10.0.2.15.51118 > 99.84.126.23.443: Flags [.], ack 22788, win 52560, length 0
13:19:21.521960 IP 99.84.126.23.443 > 10.0.2.15.51118: Flags [.], seq 22788:34468, ack 803, win 65535, length 11680
13:19:21.521976 IP 10.0.2.15.51118 > 99.84.126.23.443: Flags [.], ack 34468, win 56940, length 0
13:19:21.522200 IP 99.84.126.23.443 > 10.0.2.15.51118: Flags [.], seq 34468:38848, ack 803, win 65535, length 4380
13:19:21.522210 IP 10.0.2.15.51118 > 99.84.126.23.443: Flags [.], ack 38848, win 54020, length 0
13:19:21.522580 IP 99.84.126.23.443 > 10.0.2.15.51118: Flags [P.], seq 38848:48894, ack 803, win 65535, length 10046
13:19:21.522594 IP 10.0.2.15.51118 > 99.84.126.23.443: Flags [.], ack 48894, win 58400, length 0
13:19:21.530545 IP 99.84.126.23.443 > 10.0.2.15.51118: Flags [P.], seq 48894:53016, ack 803, win 65535, length 4122
13:19:21.530564 IP 10.0.2.15.51118 > 99.84.126.23.443: Flags [.], ack 53016, win 61320, length 0
13:19:21.531715 IP 99.84.126.23.443 > 10.0.2.15.51118: Flags [P.], seq 53016:54390, ack 803, win 65535, length 1374
13:19:21.531732 IP 10.0.2.15.51118 > 99.84.126.23.443: Flags [.], ack 54390, win 62780, length 0
13:19:21.532591 IP 99.84.126.23.443 > 10.0.2.15.51118: Flags [P.], seq 54390:57138, ack 803, win 65535, length 2748
13:19:21.532607 IP 10.0.2.15.51118 > 99.84.126.23.443: Flags [.], ack 57138, win 62780, length 0
13:19:21.534937 IP 99.84.126.23.443 > 10.0.2.15.51118: Flags [.], seq 57138:77578, ack 803, win 65535, length 20440
13:19:21.535032 IP 10.0.2.15.51118 > 99.84.126.23.443: Flags [.], ack 77578, win 62780, length 0
13:19:21.535320 IP 99.84.126.23.443 > 10.0.2.15.51118: Flags [P.], seq 77578:79122, ack 803, win 65535, length 1544
13:19:21.535330 IP 10.0.2.15.51118 > 99.84.126.23.443: Flags [.], ack 79122, win 65535, length 0
13:19:21.536682 IP 99.84.126.23.443 > 10.0.2.15.51118: Flags [P.], seq 79122:87366, ack 803, win 65535, length 8244
13:19:21.536685 IP 99.84.126.23.443 > 10.0.2.15.51118: Flags [P.], seq 87366:90114, ack 803, win 65535, length 2748
13:19:21.536705 IP 10.0.2.15.51118 > 99.84.126.23.443: Flags [.], ack 87366, win 65535, length 0
13:19:21.536740 IP 10.0.2.15.51118 > 99.84.126.23.443: Flags [.], ack 90114, win 65535, length 0
13:19:21.537739 IP 99.84.126.23.443 > 10.0.2.15.51118: Flags [P.], seq 90114:92862, ack 803, win 65535, length 2748
13:19:21.537753 IP 10.0.2.15.51118 > 99.84.126.23.443: Flags [.], ack 92862, win 65535, length 0
13:19:21.539168 IP 99.84.126.23.443 > 10.0.2.15.51118: Flags [P.], seq 92862:106602, ack 803, win 65535, length 13740
13:19:21.539185 IP 10.0.2.15.51118 > 99.84.126.23.443: Flags [.], ack 106602, win 65535, length 0
13:19:21.539478 IP 99.84.126.23.443 > 10.0.2.15.51118: Flags [P.], seq 106602:110724, ack 803, win 65535, length 4122
13:19:21.539488 IP 10.0.2.15.51118 > 99.84.126.23.443: Flags [.], ack 110724, win 65535, length 0
13:19:21.540456 IP 99.84.126.23.443 > 10.0.2.15.51118: Flags [P.], seq 110724:116220, ack 803, win 65535, length 5496
13:19:21.540519 IP 10.0.2.15.51118 > 99.84.126.23.443: Flags [.], ack 116220, win 65535, length 0
13:19:21.541468 IP 99.84.126.23.443 > 10.0.2.15.51118: Flags [P.], seq 116220:118968, ack 803, win 65535, length 2748
13:19:21.541487 IP 10.0.2.15.51118 > 99.84.126.23.443: Flags [.], ack 118968, win 65535, length 0
13:19:21.542443 IP 99.84.126.23.443 > 10.0.2.15.51118: Flags [P.], seq 118968:123090, ack 803, win 65535, length 4122
13:19:21.542460 IP 10.0.2.15.51118 > 99.84.126.23.443: Flags [.], ack 123090, win 65535, length 0
13:19:21.543432 IP 99.84.126.23.443 > 10.0.2.15.51118: Flags [P.], seq 123090:128586, ack 803, win 65535, length 5496
13:19:21.543448 IP 10.0.2.15.51118 > 99.84.126.23.443: Flags [.], ack 128586, win 65535, length 0
13:19:21.545085 IP 99.84.126.23.443 > 10.0.2.15.51118: Flags [P.], seq 128586:134082, ack 803, win 65535, length 5496
13:19:21.545107 IP 10.0.2.15.51118 > 99.84.126.23.443: Flags [.], ack 134082, win 65535, length 0
13:19:21.546213 IP 99.84.126.23.443 > 10.0.2.15.51118: Flags [P.], seq 134082:135456, ack 803, win 65535, length 1374
13:19:21.546242 IP 10.0.2.15.51118 > 99.84.126.23.443: Flags [.], ack 135456, win 65535, length 0
13:19:21.548083 IP 99.84.126.23.443 > 10.0.2.15.51118: Flags [P.], seq 135456:150570, ack 803, win 65535, length 15114
13:19:21.548101 IP 10.0.2.15.51118 > 99.84.126.23.443: Flags [.], ack 150570, win 65535, length 0
13:19:21.550855 IP 99.84.126.23.443 > 10.0.2.15.51118: Flags [P.], seq 150570:161562, ack 803, win 65535, length 10992
13:19:21.550874 IP 10.0.2.15.51118 > 99.84.126.23.443: Flags [.], ack 161562, win 65535, length 0
13:19:21.550915 IP 99.84.126.23.443 > 10.0.2.15.51118: Flags [P.], seq 161562:164310, ack 803, win 65535, length 2748
13:19:21.550916 IP 99.84.126.23.443 > 10.0.2.15.51118: Flags [P.], seq 164310:167058, ack 803, win 65535, length 2748
13:19:21.550926 IP 10.0.2.15.51118 > 99.84.126.23.443: Flags [.], ack 164310, win 65535, length 0
13:19:21.550939 IP 10.0.2.15.51118 > 99.84.126.23.443: Flags [.], ack 167058, win 65535, length 0
13:19:21.552067 IP 99.84.126.23.443 > 10.0.2.15.51118: Flags [P.], seq 167058:180798, ack 803, win 65535, length 13740
13:19:21.552082 IP 10.0.2.15.51118 > 99.84.126.23.443: Flags [.], ack 180798, win 65535, length 0
13:19:21.552994 IP 99.84.126.23.443 > 10.0.2.15.51118: Flags [P.], seq 180798:187668, ack 803, win 65535, length 6870
13:19:21.553007 IP 10.0.2.15.51118 > 99.84.126.23.443: Flags [.], ack 187668, win 65535, length 0
13:19:21.554157 IP 99.84.126.23.443 > 10.0.2.15.51118: Flags [P.], seq 187668:195912, ack 803, win 65535, length 8244
13:19:21.554173 IP 10.0.2.15.51118 > 99.84.126.23.443: Flags [.], ack 195912, win 65535, length 0
13:19:21.554380 IP 99.84.126.23.443 > 10.0.2.15.51118: Flags [P.], seq 195912:200034, ack 803, win 65535, length 4122
13:19:21.554494 IP 10.0.2.15.51118 > 99.84.126.23.443: Flags [.], ack 200034, win 65535, length 0
13:19:21.555241 IP 99.84.126.23.443 > 10.0.2.15.51118: Flags [P.], seq 200034:201408, ack 803, win 65535, length 1374
13:19:21.555255 IP 10.0.2.15.51118 > 99.84.126.23.443: Flags [.], ack 201408, win 65535, length 0
13:19:21.556270 IP 99.84.126.23.443 > 10.0.2.15.51118: Flags [P.], seq 201408:206904, ack 803, win 65535, length 5496
13:19:21.556285 IP 10.0.2.15.51118 > 99.84.126.23.443: Flags [.], ack 206904, win 65535, length 0
13:19:21.556674 IP 99.84.126.23.443 > 10.0.2.15.51118: Flags [P.], seq 206904:215148, ack 803, win 65535, length 8244
13:19:21.556684 IP 10.0.2.15.51118 > 99.84.126.23.443: Flags [.], ack 215148, win 65535, length 0
13:19:21.558321 IP 99.84.126.23.443 > 10.0.2.15.51118: Flags [P.], seq 215148:230262, ack 803, win 65535, length 15114
13:19:21.558336 IP 10.0.2.15.51118 > 99.84.126.23.443: Flags [.], ack 230262, win 65535, length 0
13:19:21.558603 IP 99.84.126.23.443 > 10.0.2.15.51118: Flags [P.], seq 230262:235758, ack 803, win 65535, length 5496
13:19:21.558617 IP 10.0.2.15.51118 > 99.84.126.23.443: Flags [.], ack 235758, win 65535, length 0
13:19:21.559671 IP 99.84.126.23.443 > 10.0.2.15.51118: Flags [P.], seq 235758:248124, ack 803, win 65535, length 12366
13:19:21.559695 IP 10.0.2.15.51118 > 99.84.126.23.443: Flags [.], ack 248124, win 65535, length 0
13:19:21.559949 IP 99.84.126.23.443 > 10.0.2.15.51118: Flags [P.], seq 248124:252246, ack 803, win 65535, length 4122
13:19:21.559960 IP 10.0.2.15.51118 > 99.84.126.23.443: Flags [.], ack 252246, win 65535, length 0
13:19:21.560130 IP 99.84.126.23.443 > 10.0.2.15.51118: Flags [P.], seq 252246:257742, ack 803, win 65535, length 5496
13:19:21.560165 IP 10.0.2.15.51118 > 99.84.126.23.443: Flags [.], ack 257742, win 65535, length 0
13:19:21.560417 IP 99.84.126.23.443 > 10.0.2.15.51118: Flags [P.], seq 257742:263238, ack 803, win 65535, length 5496
13:19:21.560431 IP 10.0.2.15.51118 > 99.84.126.23.443: Flags [.], ack 263238, win 65535, length 0
13:19:21.561522 IP 99.84.126.23.443 > 10.0.2.15.51118: Flags [P.], seq 263238:272856, ack 803, win 65535, length 9618
13:19:21.561546 IP 10.0.2.15.51118 > 99.84.126.23.443: Flags [.], ack 272856, win 65535, length 0
13:19:21.561697 IP 99.84.126.23.443 > 10.0.2.15.51118: Flags [P.], seq 272856:275604, ack 803, win 65535, length 2748
13:19:21.561705 IP 10.0.2.15.51118 > 99.84.126.23.443: Flags [.], ack 275604, win 65535, length 0
13:19:21.561862 IP 99.84.126.23.443 > 10.0.2.15.51118: Flags [P.], seq 275604:281100, ack 803, win 65535, length 5496
13:19:21.561871 IP 10.0.2.15.51118 > 99.84.126.23.443: Flags [.], ack 281100, win 65535, length 0
13:19:21.562188 IP 99.84.126.23.443 > 10.0.2.15.51118: Flags [P.], seq 281100:282474, ack 803, win 65535, length 1374
13:19:21.562203 IP 10.0.2.15.51118 > 99.84.126.23.443: Flags [.], ack 282474, win 65535, length 0
13:19:21.566943 IP 99.84.126.23.443 > 10.0.2.15.51118: Flags [P.], seq 282474:294840, ack 803, win 65535, length 12366
13:19:21.566974 IP 10.0.2.15.51118 > 99.84.126.23.443: Flags [.], ack 294840, win 65535, length 0
13:19:21.567221 IP 99.84.126.23.443 > 10.0.2.15.51118: Flags [P.], seq 294840:347400, ack 803, win 65535, length 52560
13:19:21.567247 IP 10.0.2.15.51118 > 99.84.126.23.443: Flags [.], ack 347400, win 65535, length 0
13:19:21.567877 IP 99.84.126.23.443 > 10.0.2.15.51118: Flags [P.], seq 347400:366288, ack 803, win 65535, length 18888
13:19:21.567893 IP 10.0.2.15.51118 > 99.84.126.23.443: Flags [.], ack 366288, win 65535, length 0
13:19:21.568081 IP 99.84.126.23.443 > 10.0.2.15.51118: Flags [P.], seq 366288:371784, ack 803, win 65535, length 5496
13:19:21.568092 IP 10.0.2.15.51118 > 99.84.126.23.443: Flags [.], ack 371784, win 65535, length 0
13:19:21.568524 IP 99.84.126.23.443 > 10.0.2.15.51118: Flags [P.], seq 371784:380028, ack 803, win 65535, length 8244
13:19:21.568540 IP 10.0.2.15.51118 > 99.84.126.23.443: Flags [.], ack 380028, win 65535, length 0
13:19:21.568766 IP 99.84.126.23.443 > 10.0.2.15.51118: Flags [P.], seq 380028:384150, ack 803, win 65535, length 4122
13:19:21.568803 IP 10.0.2.15.51118 > 99.84.126.23.443: Flags [.], ack 384150, win 65535, length 0
13:19:21.569219 IP 99.84.126.23.443 > 10.0.2.15.51118: Flags [P.], seq 384150:392394, ack 803, win 65535, length 8244
13:19:21.569232 IP 10.0.2.15.51118 > 99.84.126.23.443: Flags [.], ack 392394, win 65535, length 0
13:19:21.570115 IP 99.84.126.23.443 > 10.0.2.15.51118: Flags [P.], seq 392394:402012, ack 803, win 65535, length 9618
13:19:21.570132 IP 10.0.2.15.51118 > 99.84.126.23.443: Flags [.], ack 402012, win 65535, length 0
13:19:21.570285 IP 99.84.126.23.443 > 10.0.2.15.51118: Flags [P.], seq 402012:403386, ack 803, win 65535, length 1374
13:19:21.570350 IP 10.0.2.15.51118 > 99.84.126.23.443: Flags [.], ack 403386, win 65535, length 0
13:19:21.570969 IP 99.84.126.23.443 > 10.0.2.15.51118: Flags [P.], seq 403386:415752, ack 803, win 65535, length 12366
13:19:21.570983 IP 10.0.2.15.51118 > 99.84.126.23.443: Flags [.], ack 415752, win 65535, length 0
13:19:21.571194 IP 99.84.126.23.443 > 10.0.2.15.51118: Flags [P.], seq 415752:419874, ack 803, win 65535, length 4122
13:19:21.571275 IP 10.0.2.15.51118 > 99.84.126.23.443: Flags [.], ack 419874, win 65535, length 0
13:19:21.571554 IP 99.84.126.23.443 > 10.0.2.15.51118: Flags [P.], seq 419874:425370, ack 803, win 65535, length 5496
13:19:21.571564 IP 10.0.2.15.51118 > 99.84.126.23.443: Flags [.], ack 425370, win 65535, length 0
13:19:21.572002 IP 99.84.126.23.443 > 10.0.2.15.51118: Flags [P.], seq 425370:436362, ack 803, win 65535, length 10992
13:19:21.572013 IP 10.0.2.15.51118 > 99.84.126.23.443: Flags [.], ack 436362, win 65535, length 0
13:19:21.572233 IP 99.84.126.23.443 > 10.0.2.15.51118: Flags [P.], seq 436362:439110, ack 803, win 65535, length 2748
13:19:21.572241 IP 10.0.2.15.51118 > 99.84.126.23.443: Flags [.], ack 439110, win 65535, length 0
13:19:21.572851 IP 99.84.126.23.443 > 10.0.2.15.51118: Flags [P.], seq 439110:448728, ack 803, win 65535, length 9618
13:19:21.572952 IP 10.0.2.15.51118 > 99.84.126.23.443: Flags [.], ack 448728, win 65535, length 0
13:19:21.573191 IP 99.84.126.23.443 > 10.0.2.15.51118: Flags [P.], seq 448728:454224, ack 803, win 65535, length 5496
13:19:21.573201 IP 10.0.2.15.51118 > 99.84.126.23.443: Flags [.], ack 454224, win 65535, length 0
13:19:21.573372 IP 99.84.126.23.443 > 10.0.2.15.51118: Flags [P.], seq 454224:455598, ack 803, win 65535, length 1374
13:19:21.573379 IP 10.0.2.15.51118 > 99.84.126.23.443: Flags [.], ack 455598, win 65535, length 0
13:19:21.573982 IP 99.84.126.23.443 > 10.0.2.15.51118: Flags [P.], seq 455598:461094, ack 803, win 65535, length 5496
13:19:21.573995 IP 10.0.2.15.51118 > 99.84.126.23.443: Flags [.], ack 461094, win 65535, length 0
13:19:21.574179 IP 99.84.126.23.443 > 10.0.2.15.51118: Flags [P.], seq 461094:466590, ack 803, win 65535, length 5496
13:19:21.574189 IP 10.0.2.15.51118 > 99.84.126.23.443: Flags [.], ack 466590, win 65535, length 0
13:19:21.574446 IP 99.84.126.23.443 > 10.0.2.15.51118: Flags [P.], seq 466590:472086, ack 803, win 65535, length 5496
13:19:21.574543 IP 10.0.2.15.51118 > 99.84.126.23.443: Flags [.], ack 472086, win 65535, length 0
13:19:21.574769 IP 99.84.126.23.443 > 10.0.2.15.51118: Flags [P.], seq 472086:477582, ack 803, win 65535, length 5496
13:19:21.574778 IP 10.0.2.15.51118 > 99.84.126.23.443: Flags [.], ack 477582, win 65535, length 0
13:19:21.575172 IP 99.84.126.23.443 > 10.0.2.15.51118: Flags [P.], seq 477582:481704, ack 803, win 65535, length 4122
13:19:21.575185 IP 10.0.2.15.51118 > 99.84.126.23.443: Flags [.], ack 481704, win 65535, length 0
13:19:21.575445 IP 99.84.126.23.443 > 10.0.2.15.51118: Flags [P.], seq 481704:488574, ack 803, win 65535, length 6870
13:19:21.575455 IP 10.0.2.15.51118 > 99.84.126.23.443: Flags [.], ack 488574, win 65535, length 0
13:19:21.575598 IP 99.84.126.23.443 > 10.0.2.15.51118: Flags [P.], seq 488574:491322, ack 803, win 65535, length 2748
13:19:21.575614 IP 10.0.2.15.51118 > 99.84.126.23.443: Flags [.], ack 491322, win 65535, length 0
13:19:21.576395 IP 99.84.126.23.443 > 10.0.2.15.51118: Flags [P.], seq 491322:498192, ack 803, win 65535, length 6870
13:19:21.576408 IP 10.0.2.15.51118 > 99.84.126.23.443: Flags [.], ack 498192, win 65535, length 0

