19:36:49.556234 IP 10.0.2.15.52222 > 140.233.253.2.53: 28848+ A? www.espn.com. (30)
19:36:49.556273 IP 10.0.2.15.52222 > 140.233.253.2.53: 702+ AAAA? www.espn.com. (30)
19:36:49.562042 IP 140.233.253.2.53 > 10.0.2.15.52222: 28848 4/0/0 A 13.224.212.80, A 13.224.212.128, A 13.224.212.45, A 13.224.212.47 (94)
19:36:49.562045 IP 140.233.253.2.53 > 10.0.2.15.52222: 702 8/0/0 AAAA 2600:9000:20ed:e400:e:fe33:5580:93a1, AAAA 2600:9000:20ed:7400:e:fe33:5580:93a1, AAAA 2600:9000:20ed:400:e:fe33:5580:93a1, AAAA 2600:9000:20ed:ec00:e:fe33:5580:93a1, AAAA 2600:9000:20ed:6a00:e:fe33:5580:93a1, AAAA 2600:9000:20ed:5000:e:fe33:5580:93a1, AAAA 2600:9000:20ed:5200:e:fe33:5580:93a1, AAAA 2600:9000:20ed:5e00:e:fe33:5580:93a1 (254)
19:36:49.562449 IP 10.0.2.15.39342 > 13.224.212.80.443: Flags [S], seq 4163935147, win 64240, options [mss 1460,sackOK,TS val 3875540745 ecr 0,nop,wscale 6], length 0
19:36:49.577778 IP 13.224.212.80.443 > 10.0.2.15.39342: Flags [S.], seq 178880001, ack 4163935148, win 65535, options [mss 1460], length 0
19:36:49.577830 IP 10.0.2.15.39342 > 13.224.212.80.443: Flags [.], ack 1, win 64240, length 0
19:36:49.589566 IP 10.0.2.15.39342 > 13.224.212.80.443: Flags [P.], seq 1:518, ack 1, win 64240, length 517
19:36:49.590063 IP 13.224.212.80.443 > 10.0.2.15.39342: Flags [.], ack 518, win 65535, length 0
19:36:49.608656 IP 13.224.212.80.443 > 10.0.2.15.39342: Flags [.], seq 1:2921, ack 518, win 65535, length 2920
19:36:49.608679 IP 10.0.2.15.39342 > 13.224.212.80.443: Flags [.], ack 2921, win 62780, length 0
19:36:49.608997 IP 13.224.212.80.443 > 10.0.2.15.39342: Flags [P.], seq 2921:4123, ack 518, win 65535, length 1202
19:36:49.609016 IP 10.0.2.15.39342 > 13.224.212.80.443: Flags [.], ack 4123, win 61578, length 0
19:36:49.609526 IP 13.224.212.80.443 > 10.0.2.15.39342: Flags [P.], seq 4123:5497, ack 518, win 65535, length 1374
19:36:49.609542 IP 10.0.2.15.39342 > 13.224.212.80.443: Flags [.], ack 5497, win 61320, length 0
19:36:49.610365 IP 13.224.212.80.443 > 10.0.2.15.39342: Flags [P.], seq 5497:5824, ack 518, win 65535, length 327
19:36:49.610422 IP 10.0.2.15.39342 > 13.224.212.80.443: Flags [.], ack 5824, win 60993, length 0
19:36:49.611686 IP 10.0.2.15.39342 > 13.224.212.80.443: Flags [P.], seq 518:582, ack 5824, win 62780, length 64
19:36:49.611952 IP 13.224.212.80.443 > 10.0.2.15.39342: Flags [.], ack 582, win 65535, length 0
19:36:49.612063 IP 10.0.2.15.39342 > 13.224.212.80.443: Flags [P.], seq 582:628, ack 5824, win 62780, length 46
19:36:49.612114 IP 10.0.2.15.39342 > 13.224.212.80.443: Flags [P.], seq 628:677, ack 5824, win 62780, length 49
19:36:49.612405 IP 13.224.212.80.443 > 10.0.2.15.39342: Flags [.], ack 628, win 65535, length 0
19:36:49.612406 IP 13.224.212.80.443 > 10.0.2.15.39342: Flags [.], ack 677, win 65535, length 0
19:36:49.612487 IP 10.0.2.15.39342 > 13.224.212.80.443: Flags [P.], seq 677:712, ack 5824, win 62780, length 35
19:36:49.612548 IP 10.0.2.15.39342 > 13.224.212.80.443: Flags [P.], seq 712:772, ack 5824, win 62780, length 60
19:36:49.612676 IP 13.224.212.80.443 > 10.0.2.15.39342: Flags [.], ack 712, win 65535, length 0
19:36:49.612773 IP 13.224.212.80.443 > 10.0.2.15.39342: Flags [.], ack 772, win 65535, length 0
19:36:49.626726 IP 13.224.212.80.443 > 10.0.2.15.39342: Flags [P.], seq 5824:5917, ack 772, win 65535, length 93
19:36:49.626799 IP 10.0.2.15.39342 > 13.224.212.80.443: Flags [.], ack 5917, win 62780, length 0
19:36:49.627149 IP 10.0.2.15.39342 > 13.224.212.80.443: Flags [P.], seq 772:803, ack 5917, win 62780, length 31
19:36:49.627504 IP 13.224.212.80.443 > 10.0.2.15.39342: Flags [.], ack 803, win 65535, length 0
19:36:49.791081 IP 13.224.212.80.443 > 10.0.2.15.39342: Flags [P.], seq 5917:7291, ack 803, win 65535, length 1374
19:36:49.791103 IP 10.0.2.15.39342 > 13.224.212.80.443: Flags [.], ack 7291, win 62780, length 0
19:36:49.792231 IP 13.224.212.80.443 > 10.0.2.15.39342: Flags [P.], seq 7291:15434, ack 803, win 65535, length 8143
19:36:49.792233 IP 13.224.212.80.443 > 10.0.2.15.39342: Flags [P.], seq 15434:18182, ack 803, win 65535, length 2748
19:36:49.792253 IP 10.0.2.15.39342 > 13.224.212.80.443: Flags [.], ack 15434, win 58400, length 0
19:36:49.792291 IP 10.0.2.15.39342 > 13.224.212.80.443: Flags [.], ack 18182, win 56940, length 0
19:36:49.793053 IP 13.224.212.80.443 > 10.0.2.15.39342: Flags [P.], seq 18182:23678, ack 803, win 65535, length 5496
19:36:49.793123 IP 10.0.2.15.39342 > 13.224.212.80.443: Flags [.], ack 23678, win 52560, length 0
19:36:49.794185 IP 13.224.212.80.443 > 10.0.2.15.39342: Flags [P.], seq 23678:30548, ack 803, win 65535, length 6870
19:36:49.794200 IP 10.0.2.15.39342 > 13.224.212.80.443: Flags [.], ack 30548, win 59860, length 0
19:36:49.795130 IP 13.224.212.80.443 > 10.0.2.15.39342: Flags [P.], seq 30548:36044, ack 803, win 65535, length 5496
19:36:49.795131 IP 13.224.212.80.443 > 10.0.2.15.39342: Flags [P.], seq 36044:38792, ack 803, win 65535, length 2748
19:36:49.795147 IP 10.0.2.15.39342 > 13.224.212.80.443: Flags [.], ack 36044, win 61320, length 0
19:36:49.795500 IP 13.224.212.80.443 > 10.0.2.15.39342: Flags [P.], seq 38792:40166, ack 803, win 65535, length 1374
19:36:49.795550 IP 10.0.2.15.39342 > 13.224.212.80.443: Flags [.], ack 40166, win 58400, length 0
19:36:49.796301 IP 13.224.212.80.443 > 10.0.2.15.39342: Flags [P.], seq 40166:45662, ack 803, win 65535, length 5496
19:36:49.796314 IP 10.0.2.15.39342 > 13.224.212.80.443: Flags [.], ack 45662, win 61320, length 0
19:36:49.797545 IP 13.224.212.80.443 > 10.0.2.15.39342: Flags [P.], seq 45662:48410, ack 803, win 65535, length 2748
19:36:49.797565 IP 10.0.2.15.39342 > 13.224.212.80.443: Flags [.], ack 48410, win 62780, length 0
19:36:49.798378 IP 13.224.212.80.443 > 10.0.2.15.39342: Flags [P.], seq 48410:49784, ack 803, win 65535, length 1374
19:36:49.798449 IP 10.0.2.15.39342 > 13.224.212.80.443: Flags [.], ack 49784, win 62780, length 0
19:36:49.805054 IP 13.224.212.80.443 > 10.0.2.15.39342: Flags [P.], seq 49784:51158, ack 803, win 65535, length 1374
19:36:49.806266 IP 13.224.212.80.443 > 10.0.2.15.39342: Flags [P.], seq 51158:56654, ack 803, win 65535, length 5496
19:36:49.806365 IP 10.0.2.15.39342 > 13.224.212.80.443: Flags [.], ack 56654, win 61320, length 0
19:36:49.807216 IP 13.224.212.80.443 > 10.0.2.15.39342: Flags [P.], seq 56654:63524, ack 803, win 65535, length 6870
19:36:49.807296 IP 10.0.2.15.39342 > 13.224.212.80.443: Flags [.], ack 63524, win 62780, length 0
19:36:49.807715 IP 13.224.212.80.443 > 10.0.2.15.39342: Flags [P.], seq 63524:67646, ack 803, win 65535, length 4122
19:36:49.807754 IP 10.0.2.15.39342 > 13.224.212.80.443: Flags [.], ack 67646, win 62780, length 0
19:36:49.808897 IP 13.224.212.80.443 > 10.0.2.15.39342: Flags [P.], seq 67646:74516, ack 803, win 65535, length 6870
19:36:49.808899 IP 13.224.212.80.443 > 10.0.2.15.39342: Flags [P.], seq 74516:78638, ack 803, win 65535, length 4122
19:36:49.808920 IP 10.0.2.15.39342 > 13.224.212.80.443: Flags [.], ack 74516, win 65535, length 0
19:36:49.809001 IP 10.0.2.15.39342 > 13.224.212.80.443: Flags [.], ack 78638, win 65535, length 0
19:36:49.809770 IP 13.224.212.80.443 > 10.0.2.15.39342: Flags [P.], seq 78638:82760, ack 803, win 65535, length 4122
19:36:49.809785 IP 10.0.2.15.39342 > 13.224.212.80.443: Flags [.], ack 82760, win 65535, length 0
19:36:49.809978 IP 13.224.212.80.443 > 10.0.2.15.39342: Flags [P.], seq 82760:85508, ack 803, win 65535, length 2748
19:36:49.809986 IP 10.0.2.15.39342 > 13.224.212.80.443: Flags [.], ack 85508, win 65535, length 0
19:36:49.811320 IP 13.224.212.80.443 > 10.0.2.15.39342: Flags [P.], seq 85508:92378, ack 803, win 65535, length 6870
19:36:49.811322 IP 13.224.212.80.443 > 10.0.2.15.39342: Flags [P.], seq 92378:95126, ack 803, win 65535, length 2748
19:36:49.811341 IP 10.0.2.15.39342 > 13.224.212.80.443: Flags [.], ack 92378, win 65535, length 0
19:36:49.811372 IP 10.0.2.15.39342 > 13.224.212.80.443: Flags [.], ack 95126, win 65535, length 0
19:36:49.812585 IP 13.224.212.80.443 > 10.0.2.15.39342: Flags [P.], seq 95126:99248, ack 803, win 65535, length 4122
19:36:49.812586 IP 13.224.212.80.443 > 10.0.2.15.39342: Flags [P.], seq 99248:100622, ack 803, win 65535, length 1374
19:36:49.812606 IP 10.0.2.15.39342 > 13.224.212.80.443: Flags [.], ack 99248, win 65535, length 0
19:36:49.812634 IP 10.0.2.15.39342 > 13.224.212.80.443: Flags [.], ack 100622, win 65535, length 0
19:36:49.814242 IP 13.224.212.80.443 > 10.0.2.15.39342: Flags [P.], seq 100622:107492, ack 803, win 65535, length 6870
19:36:49.814247 IP 13.224.212.80.443 > 10.0.2.15.39342: Flags [P.], seq 107492:114362, ack 803, win 65535, length 6870
19:36:49.814268 IP 10.0.2.15.39342 > 13.224.212.80.443: Flags [.], ack 107492, win 65535, length 0
19:36:49.814422 IP 10.0.2.15.39342 > 13.224.212.80.443: Flags [.], ack 114362, win 65535, length 0
19:36:49.814456 IP 13.224.212.80.443 > 10.0.2.15.39342: Flags [P.], seq 114362:115736, ack 803, win 65535, length 1374
19:36:49.814466 IP 10.0.2.15.39342 > 13.224.212.80.443: Flags [.], ack 115736, win 65535, length 0
19:36:49.814847 IP 13.224.212.80.443 > 10.0.2.15.39342: Flags [P.], seq 115736:118484, ack 803, win 65535, length 2748
19:36:49.814856 IP 10.0.2.15.39342 > 13.224.212.80.443: Flags [.], ack 118484, win 65535, length 0
19:36:49.815364 IP 13.224.212.80.443 > 10.0.2.15.39342: Flags [P.], seq 118484:122606, ack 803, win 65535, length 4122
19:36:49.815366 IP 13.224.212.80.443 > 10.0.2.15.39342: Flags [P.], seq 122606:125354, ack 803, win 65535, length 2748
19:36:49.815378 IP 10.0.2.15.39342 > 13.224.212.80.443: Flags [.], ack 122606, win 65535, length 0
19:36:49.815393 IP 10.0.2.15.39342 > 13.224.212.80.443: Flags [.], ack 125354, win 65535, length 0
19:36:49.818508 IP 13.224.212.80.443 > 10.0.2.15.39342: Flags [P.], seq 125354:130850, ack 803, win 65535, length 5496
19:36:49.818528 IP 10.0.2.15.39342 > 13.224.212.80.443: Flags [.], ack 130850, win 65535, length 0
19:36:49.819632 IP 13.224.212.80.443 > 10.0.2.15.39342: Flags [P.], seq 130850:136346, ack 803, win 65535, length 5496
19:36:49.819635 IP 13.224.212.80.443 > 10.0.2.15.39342: Flags [P.], seq 136346:139094, ack 803, win 65535, length 2748
19:36:49.819657 IP 10.0.2.15.39342 > 13.224.212.80.443: Flags [.], ack 136346, win 65535, length 0
19:36:49.819691 IP 10.0.2.15.39342 > 13.224.212.80.443: Flags [.], ack 139094, win 65535, length 0
19:36:49.822021 IP 13.224.212.80.443 > 10.0.2.15.39342: Flags [P.], seq 139094:147338, ack 803, win 65535, length 8244
19:36:49.822025 IP 13.224.212.80.443 > 10.0.2.15.39342: Flags [P.], seq 147338:150086, ack 803, win 65535, length 2748
19:36:49.822116 IP 10.0.2.15.39342 > 13.224.212.80.443: Flags [.], ack 147338, win 65535, length 0
19:36:49.822197 IP 10.0.2.15.39342 > 13.224.212.80.443: Flags [.], ack 150086, win 65535, length 0
19:36:49.822286 IP 13.224.212.80.443 > 10.0.2.15.39342: Flags [P.], seq 150086:155582, ack 803, win 65535, length 5496
19:36:49.822294 IP 10.0.2.15.39342 > 13.224.212.80.443: Flags [.], ack 155582, win 65535, length 0
19:36:49.823415 IP 13.224.212.80.443 > 10.0.2.15.39342: Flags [P.], seq 155582:161078, ack 803, win 65535, length 5496
19:36:49.823417 IP 13.224.212.80.443 > 10.0.2.15.39342: Flags [P.], seq 161078:163826, ack 803, win 65535, length 2748
19:36:49.823436 IP 10.0.2.15.39342 > 13.224.212.80.443: Flags [.], ack 161078, win 65535, length 0
19:36:49.823464 IP 10.0.2.15.39342 > 13.224.212.80.443: Flags [.], ack 163826, win 65535, length 0
19:36:49.824367 IP 13.224.212.80.443 > 10.0.2.15.39342: Flags [P.], seq 163826:170696, ack 803, win 65535, length 6870
19:36:49.824384 IP 10.0.2.15.39342 > 13.224.212.80.443: Flags [.], ack 170696, win 65535, length 0
19:36:49.824562 IP 13.224.212.80.443 > 10.0.2.15.39342: Flags [P.], seq 170696:176192, ack 803, win 65535, length 5496
19:36:49.824568 IP 10.0.2.15.39342 > 13.224.212.80.443: Flags [.], ack 176192, win 65535, length 0
19:36:49.824643 IP 13.224.212.80.443 > 10.0.2.15.39342: Flags [P.], seq 176192:177566, ack 803, win 65535, length 1374
19:36:49.824648 IP 10.0.2.15.39342 > 13.224.212.80.443: Flags [.], ack 177566, win 65535, length 0
19:36:49.826046 IP 13.224.212.80.443 > 10.0.2.15.39342: Flags [P.], seq 177566:187184, ack 803, win 65535, length 9618
19:36:49.826049 IP 13.224.212.80.443 > 10.0.2.15.39342: Flags [P.], seq 187184:189932, ack 803, win 65535, length 2748
19:36:49.826071 IP 10.0.2.15.39342 > 13.224.212.80.443: Flags [.], ack 187184, win 65535, length 0
19:36:49.826110 IP 10.0.2.15.39342 > 13.224.212.80.443: Flags [.], ack 189932, win 65535, length 0
19:36:49.826452 IP 13.224.212.80.443 > 10.0.2.15.39342: Flags [P.], seq 189932:194054, ack 803, win 65535, length 4122
19:36:49.826466 IP 10.0.2.15.39342 > 13.224.212.80.443: Flags [.], ack 194054, win 65535, length 0
19:36:49.826718 IP 13.224.212.80.443 > 10.0.2.15.39342: Flags [P.], seq 194054:199550, ack 803, win 65535, length 5496
19:36:49.826728 IP 10.0.2.15.39342 > 13.224.212.80.443: Flags [.], ack 199550, win 65535, length 0
19:36:49.826990 IP 13.224.212.80.443 > 10.0.2.15.39342: Flags [P.], seq 199550:202298, ack 803, win 65535, length 2748
19:36:49.826998 IP 10.0.2.15.39342 > 13.224.212.80.443: Flags [.], ack 202298, win 65535, length 0
19:36:49.828110 IP 13.224.212.80.443 > 10.0.2.15.39342: Flags [P.], seq 202298:210542, ack 803, win 65535, length 8244
19:36:49.828127 IP 10.0.2.15.39342 > 13.224.212.80.443: Flags [.], ack 210542, win 65535, length 0
19:36:49.829186 IP 13.224.212.80.443 > 10.0.2.15.39342: Flags [P.], seq 210542:217412, ack 803, win 65535, length 6870
19:36:49.829188 IP 13.224.212.80.443 > 10.0.2.15.39342: Flags [P.], seq 217412:221534, ack 803, win 65535, length 4122
19:36:49.829207 IP 10.0.2.15.39342 > 13.224.212.80.443: Flags [.], ack 217412, win 65535, length 0
19:36:49.829242 IP 10.0.2.15.39342 > 13.224.212.80.443: Flags [.], ack 221534, win 65535, length 0
19:36:49.829268 IP 13.224.212.80.443 > 10.0.2.15.39342: Flags [P.], seq 221534:224282, ack 803, win 65535, length 2748
19:36:49.829269 IP 13.224.212.80.443 > 10.0.2.15.39342: Flags [P.], seq 224282:225656, ack 803, win 65535, length 1374
19:36:49.829275 IP 10.0.2.15.39342 > 13.224.212.80.443: Flags [.], ack 224282, win 65535, length 0
19:36:49.829288 IP 10.0.2.15.39342 > 13.224.212.80.443: Flags [.], ack 225656, win 65535, length 0
19:36:49.830432 IP 13.224.212.80.443 > 10.0.2.15.39342: Flags [P.], seq 225656:232526, ack 803, win 65535, length 6870
19:36:49.830435 IP 13.224.212.80.443 > 10.0.2.15.39342: Flags [P.], seq 232526:235274, ack 803, win 65535, length 2748
19:36:49.830457 IP 10.0.2.15.39342 > 13.224.212.80.443: Flags [.], ack 232526, win 65535, length 0
19:36:49.830491 IP 10.0.2.15.39342 > 13.224.212.80.443: Flags [.], ack 235274, win 65535, length 0
19:36:49.831679 IP 13.224.212.80.443 > 10.0.2.15.39342: Flags [P.], seq 235274:240770, ack 803, win 65535, length 5496
19:36:49.831682 IP 13.224.212.80.443 > 10.0.2.15.39342: Flags [P.], seq 240770:243518, ack 803, win 65535, length 2748
19:36:49.831703 IP 10.0.2.15.39342 > 13.224.212.80.443: Flags [.], ack 240770, win 65535, length 0
19:36:49.831740 IP 10.0.2.15.39342 > 13.224.212.80.443: Flags [.], ack 243518, win 65535, length 0
19:36:49.832645 IP 13.224.212.80.443 > 10.0.2.15.39342: Flags [P.], seq 243518:250388, ack 803, win 65535, length 6870
19:36:49.832656 IP 13.224.212.80.443 > 10.0.2.15.39342: Flags [P.], seq 250388:253136, ack 803, win 65535, length 2748
19:36:49.832673 IP 10.0.2.15.39342 > 13.224.212.80.443: Flags [.], ack 250388, win 65535, length 0
19:36:49.832697 IP 10.0.2.15.39342 > 13.224.212.80.443: Flags [.], ack 253136, win 65535, length 0
19:36:49.834553 IP 13.224.212.80.443 > 10.0.2.15.39342: Flags [P.], seq 253136:260006, ack 803, win 65535, length 6870
19:36:49.834556 IP 13.224.212.80.443 > 10.0.2.15.39342: Flags [P.], seq 260006:264128, ack 803, win 65535, length 4122
19:36:49.834576 IP 10.0.2.15.39342 > 13.224.212.80.443: Flags [.], ack 260006, win 65535, length 0
19:36:49.834607 IP 10.0.2.15.39342 > 13.224.212.80.443: Flags [.], ack 264128, win 65535, length 0
19:36:49.834807 IP 13.224.212.80.443 > 10.0.2.15.39342: Flags [P.], seq 264128:266876, ack 803, win 65535, length 2748
19:36:49.834809 IP 13.224.212.80.443 > 10.0.2.15.39342: Flags [P.], seq 266876:269624, ack 803, win 65535, length 2748
19:36:49.834822 IP 10.0.2.15.39342 > 13.224.212.80.443: Flags [.], ack 266876, win 65535, length 0
19:36:49.834917 IP 10.0.2.15.39342 > 13.224.212.80.443: Flags [.], ack 269624, win 65535, length 0
19:36:49.835127 IP 13.224.212.80.443 > 10.0.2.15.39342: Flags [P.], seq 269624:272372, ack 803, win 65535, length 2748
19:36:49.835129 IP 13.224.212.80.443 > 10.0.2.15.39342: Flags [P.], seq 272372:275120, ack 803, win 65535, length 2748
19:36:49.835138 IP 10.0.2.15.39342 > 13.224.212.80.443: Flags [.], ack 272372, win 65535, length 0
19:36:49.835153 IP 10.0.2.15.39342 > 13.224.212.80.443: Flags [.], ack 275120, win 65535, length 0
19:36:49.835407 IP 13.224.212.80.443 > 10.0.2.15.39342: Flags [P.], seq 275120:277868, ack 803, win 65535, length 2748
19:36:49.835414 IP 10.0.2.15.39342 > 13.224.212.80.443: Flags [.], ack 277868, win 65535, length 0
19:36:49.835718 IP 13.224.212.80.443 > 10.0.2.15.39342: Flags [P.], seq 277868:286112, ack 803, win 65535, length 8244
19:36:49.835719 IP 13.224.212.80.443 > 10.0.2.15.39342: Flags [P.], seq 286112:288860, ack 803, win 65535, length 2748
19:36:49.835760 IP 10.0.2.15.39342 > 13.224.212.80.443: Flags [.], ack 288860, win 65535, length 0
19:36:49.835970 IP 13.224.212.80.443 > 10.0.2.15.39342: Flags [P.], seq 288860:290234, ack 803, win 65535, length 1374
19:36:49.835977 IP 10.0.2.15.39342 > 13.224.212.80.443: Flags [.], ack 290234, win 65535, length 0
19:36:49.837230 IP 13.224.212.80.443 > 10.0.2.15.39342: Flags [P.], seq 290234:298478, ack 803, win 65535, length 8244
19:36:49.837232 IP 13.224.212.80.443 > 10.0.2.15.39342: Flags [P.], seq 298478:299852, ack 803, win 65535, length 1374
19:36:49.837248 IP 10.0.2.15.39342 > 13.224.212.80.443: Flags [.], ack 298478, win 65535, length 0
19:36:49.837279 IP 10.0.2.15.39342 > 13.224.212.80.443: Flags [.], ack 299852, win 65535, length 0
19:36:49.837552 IP 13.224.212.80.443 > 10.0.2.15.39342: Flags [P.], seq 299852:306722, ack 803, win 65535, length 6870
19:36:49.837554 IP 13.224.212.80.443 > 10.0.2.15.39342: Flags [P.], seq 306722:312218, ack 803, win 65535, length 5496
19:36:49.837566 IP 10.0.2.15.39342 > 13.224.212.80.443: Flags [.], ack 306722, win 65535, length 0
19:36:49.837639 IP 10.0.2.15.39342 > 13.224.212.80.443: Flags [.], ack 312218, win 65535, length 0
19:36:49.837725 IP 13.224.212.80.443 > 10.0.2.15.39342: Flags [P.], seq 312218:316340, ack 803, win 65535, length 4122
19:36:49.837733 IP 10.0.2.15.39342 > 13.224.212.80.443: Flags [.], ack 316340, win 65535, length 0
19:36:49.838140 IP 13.224.212.80.443 > 10.0.2.15.39342: Flags [P.], seq 316340:319088, ack 803, win 65535, length 2748
19:36:49.838152 IP 10.0.2.15.39342 > 13.224.212.80.443: Flags [.], ack 319088, win 65535, length 0
19:36:49.838405 IP 13.224.212.80.443 > 10.0.2.15.39342: Flags [P.], seq 319088:325958, ack 803, win 65535, length 6870
19:36:49.838418 IP 10.0.2.15.39342 > 13.224.212.80.443: Flags [.], ack 325958, win 65535, length 0
19:36:49.838668 IP 13.224.212.80.443 > 10.0.2.15.39342: Flags [P.], seq 325958:331454, ack 803, win 65535, length 5496
19:36:49.838670 IP 13.224.212.80.443 > 10.0.2.15.39342: Flags [P.], seq 331454:335576, ack 803, win 65535, length 4122
19:36:49.838686 IP 10.0.2.15.39342 > 13.224.212.80.443: Flags [.], ack 331454, win 65535, length 0
19:36:49.838702 IP 10.0.2.15.39342 > 13.224.212.80.443: Flags [.], ack 335576, win 65535, length 0
19:36:49.838986 IP 13.224.212.80.443 > 10.0.2.15.39342: Flags [P.], seq 335576:336950, ack 803, win 65535, length 1374
19:36:49.838996 IP 10.0.2.15.39342 > 13.224.212.80.443: Flags [.], ack 336950, win 65535, length 0
19:36:49.839949 IP 13.224.212.80.443 > 10.0.2.15.39342: Flags [.], seq 336950:341330, ack 803, win 65535, length 4380
19:36:49.840022 IP 10.0.2.15.39342 > 13.224.212.80.443: Flags [.], ack 341330, win 65535, length 0
19:36:49.841762 IP 13.224.212.80.443 > 10.0.2.15.39342: Flags [P.], seq 341330:345194, ack 803, win 65535, length 3864
19:36:49.841765 IP 13.224.212.80.443 > 10.0.2.15.39342: Flags [P.], seq 345194:350690, ack 803, win 65535, length 5496
19:36:49.841766 IP 13.224.212.80.443 > 10.0.2.15.39342: Flags [P.], seq 350690:356186, ack 803, win 65535, length 5496
19:36:49.841790 IP 10.0.2.15.39342 > 13.224.212.80.443: Flags [.], ack 345194, win 65535, length 0
19:36:49.841811 IP 10.0.2.15.39342 > 13.224.212.80.443: Flags [.], ack 350690, win 65535, length 0
19:36:49.841825 IP 10.0.2.15.39342 > 13.224.212.80.443: Flags [.], ack 356186, win 65535, length 0
19:36:49.841849 IP 13.224.212.80.443 > 10.0.2.15.39342: Flags [P.], seq 356186:358934, ack 803, win 65535, length 2748
19:36:49.841855 IP 10.0.2.15.39342 > 13.224.212.80.443: Flags [.], ack 358934, win 65535, length 0
19:36:49.843032 IP 13.224.212.80.443 > 10.0.2.15.39342: Flags [P.], seq 358934:364430, ack 803, win 65535, length 5496
19:36:49.843033 IP 13.224.212.80.443 > 10.0.2.15.39342: Flags [P.], seq 364430:367178, ack 803, win 65535, length 2748
19:36:49.843034 IP 13.224.212.80.443 > 10.0.2.15.39342: Flags [P.], seq 367178:369926, ack 803, win 65535, length 2748
19:36:49.843050 IP 10.0.2.15.39342 > 13.224.212.80.443: Flags [.], ack 364430, win 65535, length 0
19:36:49.843076 IP 10.0.2.15.39342 > 13.224.212.80.443: Flags [.], ack 367178, win 65535, length 0
19:36:49.843168 IP 10.0.2.15.39342 > 13.224.212.80.443: Flags [.], ack 369926, win 65535, length 0
19:36:49.843198 IP 13.224.212.80.443 > 10.0.2.15.39342: Flags [P.], seq 369926:372674, ack 803, win 65535, length 2748
19:36:49.843205 IP 10.0.2.15.39342 > 13.224.212.80.443: Flags [.], ack 372674, win 65535, length 0
19:36:49.843476 IP 13.224.212.80.443 > 10.0.2.15.39342: Flags [P.], seq 372674:375422, ack 803, win 65535, length 2748
19:36:49.843556 IP 10.0.2.15.39342 > 13.224.212.80.443: Flags [.], ack 375422, win 65535, length 0
19:36:49.843747 IP 13.224.212.80.443 > 10.0.2.15.39342: Flags [P.], seq 375422:379544, ack 803, win 65535, length 4122
19:36:49.843749 IP 13.224.212.80.443 > 10.0.2.15.39342: Flags [P.], seq 379544:382292, ack 803, win 65535, length 2748
19:36:49.843750 IP 13.224.212.80.443 > 10.0.2.15.39342: Flags [P.], seq 382292:383666, ack 803, win 65535, length 1374
19:36:49.843760 IP 10.0.2.15.39342 > 13.224.212.80.443: Flags [.], ack 379544, win 65535, length 0
19:36:49.843775 IP 10.0.2.15.39342 > 13.224.212.80.443: Flags [.], ack 382292, win 65535, length 0
19:36:49.843785 IP 10.0.2.15.39342 > 13.224.212.80.443: Flags [.], ack 383666, win 65535, length 0
19:36:49.844489 IP 13.224.212.80.443 > 10.0.2.15.39342: Flags [P.], seq 383666:389162, ack 803, win 65535, length 5496
19:36:49.844502 IP 10.0.2.15.39342 > 13.224.212.80.443: Flags [.], ack 389162, win 65535, length 0
19:36:49.844770 IP 13.224.212.80.443 > 10.0.2.15.39342: Flags [P.], seq 389162:391910, ack 803, win 65535, length 2748
19:36:49.844772 IP 13.224.212.80.443 > 10.0.2.15.39342: Flags [P.], seq 391910:394658, ack 803, win 65535, length 2748
19:36:49.844786 IP 10.0.2.15.39342 > 13.224.212.80.443: Flags [.], ack 391910, win 65535, length 0
19:36:49.844807 IP 10.0.2.15.39342 > 13.224.212.80.443: Flags [.], ack 394658, win 65535, length 0
19:36:49.844888 IP 13.224.212.80.443 > 10.0.2.15.39342: Flags [P.], seq 394658:398780, ack 803, win 65535, length 4122
19:36:49.844892 IP 10.0.2.15.39342 > 13.224.212.80.443: Flags [.], ack 398780, win 65535, length 0
19:36:49.845197 IP 13.224.212.80.443 > 10.0.2.15.39342: Flags [P.], seq 398780:401528, ack 803, win 65535, length 2748
19:36:49.845199 IP 13.224.212.80.443 > 10.0.2.15.39342: Flags [P.], seq 401528:404276, ack 803, win 65535, length 2748
19:36:49.845200 IP 13.224.212.80.443 > 10.0.2.15.39342: Flags [P.], seq 404276:407024, ack 803, win 65535, length 2748
19:36:49.845212 IP 10.0.2.15.39342 > 13.224.212.80.443: Flags [.], ack 401528, win 65535, length 0
19:36:49.845237 IP 10.0.2.15.39342 > 13.224.212.80.443: Flags [.], ack 404276, win 65535, length 0
19:36:49.845248 IP 10.0.2.15.39342 > 13.224.212.80.443: Flags [.], ack 407024, win 65535, length 0
19:36:49.845395 IP 13.224.212.80.443 > 10.0.2.15.39342: Flags [P.], seq 407024:409772, ack 803, win 65535, length 2748
19:36:49.845416 IP 10.0.2.15.39342 > 13.224.212.80.443: Flags [.], ack 409772, win 65535, length 0
19:36:49.845528 IP 13.224.212.80.443 > 10.0.2.15.39342: Flags [P.], seq 409772:413894, ack 803, win 65535, length 4122
19:36:49.845622 IP 13.224.212.80.443 > 10.0.2.15.39342: Flags [P.], seq 413894:416642, ack 803, win 65535, length 2748
19:36:49.845639 IP 10.0.2.15.39342 > 13.224.212.80.443: Flags [.], ack 413894, win 65535, length 0
19:36:49.845894 IP 13.224.212.80.443 > 10.0.2.15.39342: Flags [P.], seq 416642:422138, ack 803, win 65535, length 5496
19:36:49.845975 IP 10.0.2.15.39342 > 13.224.212.80.443: Flags [.], ack 422138, win 65535, length 0
19:36:49.849262 IP 13.224.212.80.443 > 10.0.2.15.39342: Flags [P.], seq 422138:430382, ack 803, win 65535, length 8244
19:36:49.849264 IP 13.224.212.80.443 > 10.0.2.15.39342: Flags [.], seq 430382:431842, ack 803, win 65535, length 1460
19:36:49.849289 IP 10.0.2.15.39342 > 13.224.212.80.443: Flags [.], ack 430382, win 65535, length 0
19:36:49.849440 IP 10.0.2.15.39342 > 13.224.212.80.443: Flags [.], ack 431842, win 65535, length 0
19:36:49.849873 IP 13.224.212.80.443 > 10.0.2.15.39342: Flags [P.], seq 431842:434504, ack 803, win 65535, length 2662
19:36:49.849875 IP 13.224.212.80.443 > 10.0.2.15.39342: Flags [P.], seq 434504:437252, ack 803, win 65535, length 2748
19:36:49.849876 IP 13.224.212.80.443 > 10.0.2.15.39342: Flags [P.], seq 437252:440000, ack 803, win 65535, length 2748
19:36:49.849877 IP 13.224.212.80.443 > 10.0.2.15.39342: Flags [P.], seq 440000:442748, ack 803, win 65535, length 2748
19:36:49.849951 IP 10.0.2.15.39342 > 13.224.212.80.443: Flags [.], ack 434504, win 65535, length 0
19:36:49.849978 IP 10.0.2.15.39342 > 13.224.212.80.443: Flags [.], ack 437252, win 65535, length 0
19:36:49.850975 IP 10.0.2.15.39342 > 13.224.212.80.443: Flags [.], ack 440000, win 65535, length 0
19:36:49.851424 IP 10.0.2.15.39342 > 13.224.212.80.443: Flags [.], ack 442748, win 65535, length 0
19:36:49.851503 IP 13.224.212.80.443 > 10.0.2.15.39342: Flags [P.], seq 442748:448244, ack 803, win 65535, length 5496
19:36:49.851505 IP 13.224.212.80.443 > 10.0.2.15.39342: Flags [P.], seq 448244:455114, ack 803, win 65535, length 6870
19:36:49.851520 IP 10.0.2.15.39342 > 13.224.212.80.443: Flags [.], ack 448244, win 65535, length 0
19:36:49.851538 IP 10.0.2.15.39342 > 13.224.212.80.443: Flags [.], ack 455114, win 65535, length 0
19:36:49.851556 IP 13.224.212.80.443 > 10.0.2.15.39342: Flags [P.], seq 455114:457862, ack 803, win 65535, length 2748
19:36:49.851558 IP 13.224.212.80.443 > 10.0.2.15.39342: Flags [P.], seq 457862:463358, ack 803, win 65535, length 5496
19:36:49.851559 IP 13.224.212.80.443 > 10.0.2.15.39342: Flags [P.], seq 463358:468854, ack 803, win 65535, length 5496
19:36:49.851565 IP 10.0.2.15.39342 > 13.224.212.80.443: Flags [.], ack 457862, win 65535, length 0
19:36:49.851579 IP 10.0.2.15.39342 > 13.224.212.80.443: Flags [.], ack 463358, win 65535, length 0
19:36:49.851592 IP 10.0.2.15.39342 > 13.224.212.80.443: Flags [.], ack 468854, win 65535, length 0
19:36:49.851619 IP 13.224.212.80.443 > 10.0.2.15.39342: Flags [P.], seq 468854:481220, ack 803, win 65535, length 12366
19:36:49.851626 IP 10.0.2.15.39342 > 13.224.212.80.443: Flags [.], ack 481220, win 65535, length 0
19:36:49.851718 IP 13.224.212.80.443 > 10.0.2.15.39342: Flags [P.], seq 481220:492212, ack 803, win 65535, length 10992
19:36:49.851729 IP 10.0.2.15.39342 > 13.224.212.80.443: Flags [.], ack 492212, win 65535, length 0
19:36:49.851978 IP 13.224.212.80.443 > 10.0.2.15.39342: Flags [P.], seq 492212:494960, ack 803, win 65535, length 2748
19:36:49.851985 IP 13.224.212.80.443 > 10.0.2.15.39342: Flags [P.], seq 494960:499082, ack 803, win 65535, length 4122
19:36:49.851998 IP 10.0.2.15.39342 > 13.224.212.80.443: Flags [.], ack 494960, win 65535, length 0
19:36:49.852011 IP 10.0.2.15.39342 > 13.224.212.80.443: Flags [.], ack 499082, win 65535, length 0
19:36:49.852100 IP 13.224.212.80.443 > 10.0.2.15.39342: Flags [P.], seq 499082:500456, ack 803, win 65535, length 1374
19:36:49.852106 IP 10.0.2.15.39342 > 13.224.212.80.443: Flags [.], ack 500456, win 65535, length 0
19:36:49.852254 IP 13.224.212.80.443 > 10.0.2.15.39342: Flags [P.], seq 500456:501830, ack 803, win 65535, length 1374
19:36:49.852261 IP 10.0.2.15.39342 > 13.224.212.80.443: Flags [.], ack 501830, win 65535, length 0
19:36:49.853132 IP 13.224.212.80.443 > 10.0.2.15.39342: Flags [P.], seq 501830:510074, ack 803, win 65535, length 8244
19:36:49.853147 IP 10.0.2.15.39342 > 13.224.212.80.443: Flags [.], ack 510074, win 65535, length 0
19:36:49.853338 IP 13.224.212.80.443 > 10.0.2.15.39342: Flags [P.], seq 510074:515570, ack 803, win 65535, length 5496
19:36:49.853348 IP 10.0.2.15.39342 > 13.224.212.80.443: Flags [.], ack 515570, win 65535, length 0
19:36:49.853484 IP 13.224.212.80.443 > 10.0.2.15.39342: Flags [P.], seq 515570:519692, ack 803, win 65535, length 4122
19:36:49.853493 IP 10.0.2.15.39342 > 13.224.212.80.443: Flags [.], ack 519692, win 65535, length 0
19:36:49.853668 IP 13.224.212.80.443 > 10.0.2.15.39342: Flags [P.], seq 519692:521066, ack 803, win 65535, length 1374
19:36:49.853674 IP 10.0.2.15.39342 > 13.224.212.80.443: Flags [.], ack 521066, win 65535, length 0
19:36:49.855321 IP 13.224.212.80.443 > 10.0.2.15.39342: Flags [P.], seq 521066:530684, ack 803, win 65535, length 9618
19:36:49.855325 IP 13.224.212.80.443 > 10.0.2.15.39342: Flags [.], seq 530684:533604, ack 803, win 65535, length 2920
19:36:49.855349 IP 10.0.2.15.39342 > 13.224.212.80.443: Flags [.], ack 530684, win 65535, length 0
19:36:49.855423 IP 10.0.2.15.39342 > 13.224.212.80.443: Flags [.], ack 533604, win 65535, length 0
19:36:49.856111 IP 13.224.212.80.443 > 10.0.2.15.39342: Flags [P.], seq 533604:534806, ack 803, win 65535, length 1202
19:36:49.856114 IP 13.224.212.80.443 > 10.0.2.15.39342: Flags [P.], seq 534806:538928, ack 803, win 65535, length 4122
19:36:49.856114 IP 13.224.212.80.443 > 10.0.2.15.39342: Flags [P.], seq 538928:541676, ack 803, win 65535, length 2748
19:36:49.856115 IP 13.224.212.80.443 > 10.0.2.15.39342: Flags [P.], seq 541676:544424, ack 803, win 65535, length 2748
19:36:49.856130 IP 10.0.2.15.39342 > 13.224.212.80.443: Flags [.], ack 534806, win 65535, length 0
19:36:49.856148 IP 10.0.2.15.39342 > 13.224.212.80.443: Flags [.], ack 538928, win 65535, length 0
19:36:49.856161 IP 10.0.2.15.39342 > 13.224.212.80.443: Flags [.], ack 541676, win 65535, length 0
19:36:49.856171 IP 10.0.2.15.39342 > 13.224.212.80.443: Flags [.], ack 544424, win 65535, length 0
19:36:49.856197 IP 13.224.212.80.443 > 10.0.2.15.39342: Flags [P.], seq 544424:549920, ack 803, win 65535, length 5496
19:36:49.856198 IP 13.224.212.80.443 > 10.0.2.15.39342: Flags [.], seq 549920:551380, ack 803, win 65535, length 1460
19:36:49.856204 IP 10.0.2.15.39342 > 13.224.212.80.443: Flags [.], ack 549920, win 65535, length 0
19:36:49.856216 IP 10.0.2.15.39342 > 13.224.212.80.443: Flags [.], ack 551380, win 65535, length 0
19:36:49.856454 IP 13.224.212.80.443 > 10.0.2.15.39342: Flags [P.], seq 551380:554042, ack 803, win 65535, length 2662
19:36:49.856455 IP 13.224.212.80.443 > 10.0.2.15.39342: Flags [P.], seq 554042:558164, ack 803, win 65535, length 4122
19:36:49.856478 IP 10.0.2.15.39342 > 13.224.212.80.443: Flags [.], ack 558164, win 65535, length 0
19:36:49.856551 IP 13.224.212.80.443 > 10.0.2.15.39342: Flags [P.], seq 558164:560912, ack 803, win 65535, length 2748
19:36:49.856565 IP 10.0.2.15.39342 > 13.224.212.80.443: Flags [.], ack 560912, win 65535, length 0
19:36:49.857360 IP 13.224.212.80.443 > 10.0.2.15.39342: Flags [P.], seq 560912:565034, ack 803, win 65535, length 4122
19:36:49.857375 IP 10.0.2.15.39342 > 13.224.212.80.443: Flags [.], ack 565034, win 65535, length 0
19:36:49.857484 IP 13.224.212.80.443 > 10.0.2.15.39342: Flags [P.], seq 565034:570530, ack 803, win 65535, length 5496
19:36:49.857491 IP 10.0.2.15.39342 > 13.224.212.80.443: Flags [.], ack 570530, win 65535, length 0
19:36:49.858513 IP 13.224.212.80.443 > 10.0.2.15.39342: Flags [P.], seq 570530:576026, ack 803, win 65535, length 5496
19:36:49.858591 IP 13.224.212.80.443 > 10.0.2.15.39342: Flags [P.], seq 576026:580148, ack 803, win 65535, length 4122
19:36:49.858593 IP 13.224.212.80.443 > 10.0.2.15.39342: Flags [P.], seq 580148:582896, ack 803, win 65535, length 2748
19:36:49.858685 IP 10.0.2.15.39342 > 13.224.212.80.443: Flags [.], ack 576026, win 65535, length 0
19:36:49.858856 IP 10.0.2.15.39342 > 13.224.212.80.443: Flags [.], ack 580148, win 65535, length 0
19:36:49.858888 IP 10.0.2.15.39342 > 13.224.212.80.443: Flags [.], ack 582896, win 65535, length 0
19:36:49.858913 IP 13.224.212.80.443 > 10.0.2.15.39342: Flags [P.], seq 582896:585644, ack 803, win 65535, length 2748
19:36:49.858915 IP 13.224.212.80.443 > 10.0.2.15.39342: Flags [P.], seq 585644:589766, ack 803, win 65535, length 4122
19:36:49.858915 IP 13.224.212.80.443 > 10.0.2.15.39342: Flags [P.], seq 589766:592514, ack 803, win 65535, length 2748
19:36:49.858916 IP 13.224.212.80.443 > 10.0.2.15.39342: Flags [P.], seq 592514:595262, ack 803, win 65535, length 2748
19:36:49.858922 IP 10.0.2.15.39342 > 13.224.212.80.443: Flags [.], ack 585644, win 65535, length 0
19:36:49.858930 IP 10.0.2.15.39342 > 13.224.212.80.443: Flags [.], ack 589766, win 65535, length 0
19:36:49.858935 IP 10.0.2.15.39342 > 13.224.212.80.443: Flags [.], ack 592514, win 65535, length 0
19:36:49.858941 IP 10.0.2.15.39342 > 13.224.212.80.443: Flags [.], ack 595262, win 65535, length 0
19:36:49.858953 IP 13.224.212.80.443 > 10.0.2.15.39342: Flags [P.], seq 595262:598010, ack 803, win 65535, length 2748
19:36:49.858954 IP 13.224.212.80.443 > 10.0.2.15.39342: Flags [P.], seq 598010:600758, ack 803, win 65535, length 2748
19:36:49.858957 IP 10.0.2.15.39342 > 13.224.212.80.443: Flags [.], ack 598010, win 65535, length 0
19:36:49.858963 IP 10.0.2.15.39342 > 13.224.212.80.443: Flags [.], ack 600758, win 65535, length 0
19:36:49.859850 IP 13.224.212.80.443 > 10.0.2.15.39342: Flags [P.], seq 600758:604880, ack 803, win 65535, length 4122
19:36:49.859852 IP 13.224.212.80.443 > 10.0.2.15.39342: Flags [P.], seq 604880:607628, ack 803, win 65535, length 2748
19:36:49.859867 IP 10.0.2.15.39342 > 13.224.212.80.443: Flags [.], ack 604880, win 65535, length 0
19:36:49.859897 IP 10.0.2.15.39342 > 13.224.212.80.443: Flags [.], ack 607628, win 65535, length 0
19:36:49.860161 IP 13.224.212.80.443 > 10.0.2.15.39342: Flags [P.], seq 607628:611750, ack 803, win 65535, length 4122
19:36:49.860163 IP 13.224.212.80.443 > 10.0.2.15.39342: Flags [P.], seq 611750:614498, ack 803, win 65535, length 2748
19:36:49.860164 IP 13.224.212.80.443 > 10.0.2.15.39342: Flags [P.], seq 614498:617246, ack 803, win 65535, length 2748
19:36:49.860165 IP 13.224.212.80.443 > 10.0.2.15.39342: Flags [P.], seq 617246:619994, ack 803, win 65535, length 2748
19:36:49.860179 IP 10.0.2.15.39342 > 13.224.212.80.443: Flags [.], ack 611750, win 65535, length 0
19:36:49.860352 IP 10.0.2.15.39342 > 13.224.212.80.443: Flags [.], ack 614498, win 65535, length 0
19:36:49.860404 IP 10.0.2.15.39342 > 13.224.212.80.443: Flags [.], ack 617246, win 65535, length 0
19:36:49.861178 IP 10.0.2.15.39342 > 13.224.212.80.443: Flags [.], ack 619994, win 65535, length 0
19:36:49.861557 IP 13.224.212.80.443 > 10.0.2.15.39342: Flags [P.], seq 619994:622742, ack 803, win 65535, length 2748
19:36:49.861560 IP 13.224.212.80.443 > 10.0.2.15.39342: Flags [P.], seq 622742:625490, ack 803, win 65535, length 2748
19:36:49.861561 IP 13.224.212.80.443 > 10.0.2.15.39342: Flags [P.], seq 625490:628238, ack 803, win 65535, length 2748
19:36:49.861563 IP 13.224.212.80.443 > 10.0.2.15.39342: Flags [P.], seq 628238:632360, ack 803, win 65535, length 4122
19:36:49.861667 IP 10.0.2.15.39342 > 13.224.212.80.443: Flags [.], ack 622742, win 65535, length 0
19:36:49.861734 IP 10.0.2.15.39342 > 13.224.212.80.443: Flags [.], ack 625490, win 65535, length 0
19:36:49.861748 IP 10.0.2.15.39342 > 13.224.212.80.443: Flags [.], ack 628238, win 65535, length 0
19:36:49.861758 IP 10.0.2.15.39342 > 13.224.212.80.443: Flags [.], ack 632360, win 65535, length 0
19:36:49.861825 IP 13.224.212.80.443 > 10.0.2.15.39342: Flags [P.], seq 632360:636482, ack 803, win 65535, length 4122
19:36:49.861827 IP 13.224.212.80.443 > 10.0.2.15.39342: Flags [P.], seq 636482:639230, ack 803, win 65535, length 2748
19:36:49.861828 IP 13.224.212.80.443 > 10.0.2.15.39342: Flags [P.], seq 639230:643352, ack 803, win 65535, length 4122
19:36:49.861839 IP 10.0.2.15.39342 > 13.224.212.80.443: Flags [.], ack 636482, win 65535, length 0
19:36:49.861859 IP 10.0.2.15.39342 > 13.224.212.80.443: Flags [.], ack 639230, win 65535, length 0
19:36:49.861869 IP 10.0.2.15.39342 > 13.224.212.80.443: Flags [.], ack 643352, win 65535, length 0
19:36:49.861957 IP 13.224.212.80.443 > 10.0.2.15.39342: Flags [P.], seq 643352:647474, ack 803, win 65535, length 4122
19:36:49.861958 IP 13.224.212.80.443 > 10.0.2.15.39342: Flags [P.], seq 647474:650222, ack 803, win 65535, length 2748
19:36:49.861969 IP 10.0.2.15.39342 > 13.224.212.80.443: Flags [.], ack 647474, win 65535, length 0
19:36:49.862059 IP 10.0.2.15.39342 > 13.224.212.80.443: Flags [.], ack 650222, win 65535, length 0
19:36:49.862374 IP 13.224.212.80.443 > 10.0.2.15.39342: Flags [P.], seq 650222:655718, ack 803, win 65535, length 5496
19:36:49.862376 IP 13.224.212.80.443 > 10.0.2.15.39342: Flags [P.], seq 655718:658466, ack 803, win 65535, length 2748
19:36:49.862387 IP 10.0.2.15.39342 > 13.224.212.80.443: Flags [.], ack 655718, win 65535, length 0
19:36:49.862445 IP 10.0.2.15.39342 > 13.224.212.80.443: Flags [.], ack 658466, win 65535, length 0
19:36:49.862847 IP 13.224.212.80.443 > 10.0.2.15.39342: Flags [P.], seq 658466:663962, ack 803, win 65535, length 5496
19:36:49.862850 IP 13.224.212.80.443 > 10.0.2.15.39342: Flags [P.], seq 663962:668084, ack 803, win 65535, length 4122
19:36:49.862851 IP 13.224.212.80.443 > 10.0.2.15.39342: Flags [.], seq 668084:669544, ack 803, win 65535, length 1460
19:36:49.862863 IP 10.0.2.15.39342 > 13.224.212.80.443: Flags [.], ack 663962, win 65535, length 0
19:36:49.862937 IP 10.0.2.15.39342 > 13.224.212.80.443: Flags [.], ack 668084, win 65535, length 0
19:36:49.862951 IP 10.0.2.15.39342 > 13.224.212.80.443: Flags [.], ack 669544, win 65535, length 0
19:36:49.863060 IP 13.224.212.80.443 > 10.0.2.15.39342: Flags [P.], seq 669544:673580, ack 803, win 65535, length 4036
19:36:49.863062 IP 13.224.212.80.443 > 10.0.2.15.39342: Flags [P.], seq 673580:676328, ack 803, win 65535, length 2748
19:36:49.863099 IP 10.0.2.15.39342 > 13.224.212.80.443: Flags [.], ack 673580, win 65535, length 0
19:36:49.863116 IP 10.0.2.15.39342 > 13.224.212.80.443: Flags [.], ack 676328, win 65535, length 0
19:36:49.863235 IP 13.224.212.80.443 > 10.0.2.15.39342: Flags [P.], seq 676328:679076, ack 803, win 65535, length 2748
19:36:49.863241 IP 10.0.2.15.39342 > 13.224.212.80.443: Flags [.], ack 679076, win 65535, length 0
19:36:49.864204 IP 13.224.212.80.443 > 10.0.2.15.39342: Flags [P.], seq 679076:685946, ack 803, win 65535, length 6870
19:36:49.864248 IP 13.224.212.80.443 > 10.0.2.15.39342: Flags [P.], seq 685946:690068, ack 803, win 65535, length 4122
19:36:49.864349 IP 10.0.2.15.39342 > 13.224.212.80.443: Flags [.], ack 685946, win 65535, length 0
19:36:49.864385 IP 10.0.2.15.39342 > 13.224.212.80.443: Flags [.], ack 690068, win 65535, length 0
19:36:49.864412 IP 13.224.212.80.443 > 10.0.2.15.39342: Flags [P.], seq 690068:692816, ack 803, win 65535, length 2748
19:36:49.864417 IP 10.0.2.15.39342 > 13.224.212.80.443: Flags [.], ack 692816, win 65535, length 0
19:36:49.865100 IP 13.224.212.80.443 > 10.0.2.15.39342: Flags [P.], seq 692816:698312, ack 803, win 65535, length 5496
19:36:49.865102 IP 13.224.212.80.443 > 10.0.2.15.39342: Flags [P.], seq 698312:702434, ack 803, win 65535, length 4122
19:36:49.865103 IP 13.224.212.80.443 > 10.0.2.15.39342: Flags [P.], seq 702434:705182, ack 803, win 65535, length 2748
19:36:49.865181 IP 10.0.2.15.39342 > 13.224.212.80.443: Flags [.], ack 698312, win 65535, length 0
19:36:49.865256 IP 10.0.2.15.39342 > 13.224.212.80.443: Flags [.], ack 702434, win 65535, length 0
19:36:49.865270 IP 10.0.2.15.39342 > 13.224.212.80.443: Flags [.], ack 705182, win 65535, length 0
19:36:49.865299 IP 13.224.212.80.443 > 10.0.2.15.39342: Flags [P.], seq 705182:710678, ack 803, win 65535, length 5496
19:36:49.865300 IP 13.224.212.80.443 > 10.0.2.15.39342: Flags [P.], seq 710678:713426, ack 803, win 65535, length 2748
19:36:49.865306 IP 10.0.2.15.39342 > 13.224.212.80.443: Flags [.], ack 710678, win 65535, length 0
19:36:49.865315 IP 10.0.2.15.39342 > 13.224.212.80.443: Flags [.], ack 713426, win 65535, length 0
19:36:49.865464 IP 13.224.212.80.443 > 10.0.2.15.39342: Flags [P.], seq 713426:717548, ack 803, win 65535, length 4122
19:36:49.865471 IP 10.0.2.15.39342 > 13.224.212.80.443: Flags [.], ack 717548, win 65535, length 0
19:36:49.865703 IP 13.224.212.80.443 > 10.0.2.15.39342: Flags [P.], seq 717548:718922, ack 803, win 65535, length 1374
19:36:49.865726 IP 10.0.2.15.39342 > 13.224.212.80.443: Flags [.], ack 718922, win 65535, length 0
19:36:49.865985 IP 13.224.212.80.443 > 10.0.2.15.39342: Flags [P.], seq 718922:723044, ack 803, win 65535, length 4122
19:36:49.865996 IP 10.0.2.15.39342 > 13.224.212.80.443: Flags [.], ack 723044, win 65535, length 0
19:36:49.866296 IP 13.224.212.80.443 > 10.0.2.15.39342: Flags [P.], seq 723044:725792, ack 803, win 65535, length 2748
19:36:49.866299 IP 13.224.212.80.443 > 10.0.2.15.39342: Flags [P.], seq 725792:731288, ack 803, win 65535, length 5496
19:36:49.866312 IP 10.0.2.15.39342 > 13.224.212.80.443: Flags [.], ack 725792, win 65535, length 0
19:36:49.866400 IP 10.0.2.15.39342 > 13.224.212.80.443: Flags [.], ack 731288, win 65535, length 0
19:36:49.866527 IP 13.224.212.80.443 > 10.0.2.15.39342: Flags [P.], seq 731288:735410, ack 803, win 65535, length 4122
19:36:49.866535 IP 10.0.2.15.39342 > 13.224.212.80.443: Flags [.], ack 735410, win 65535, length 0
19:36:49.866869 IP 13.224.212.80.443 > 10.0.2.15.39342: Flags [P.], seq 735410:740906, ack 803, win 65535, length 5496
19:36:49.867138 IP 13.224.212.80.443 > 10.0.2.15.39342: Flags [P.], seq 740906:745028, ack 803, win 65535, length 4122
19:36:49.867139 IP 13.224.212.80.443 > 10.0.2.15.39342: Flags [P.], seq 745028:750524, ack 803, win 65535, length 5496
19:36:49.867347 IP 13.224.212.80.443 > 10.0.2.15.39342: Flags [P.], seq 750524:753272, ack 803, win 65535, length 2748
19:36:49.867644 IP 13.224.212.80.443 > 10.0.2.15.39342: Flags [P.], seq 753272:757394, ack 803, win 65535, length 4122
19:36:49.867645 IP 13.224.212.80.443 > 10.0.2.15.39342: Flags [P.], seq 757394:758768, ack 803, win 65535, length 1374
19:36:49.867775 IP 10.0.2.15.39342 > 13.224.212.80.443: Flags [.], ack 758768, win 65535, length 0
19:36:49.868506 IP 13.224.212.80.443 > 10.0.2.15.39342: Flags [P.], seq 758768:765638, ack 803, win 65535, length 6870
19:36:49.868522 IP 10.0.2.15.39342 > 13.224.212.80.443: Flags [.], ack 765638, win 65535, length 0
19:36:49.868682 IP 13.224.212.80.443 > 10.0.2.15.39342: Flags [P.], seq 765638:771134, ack 803, win 65535, length 5496
19:36:49.869211 IP 13.224.212.80.443 > 10.0.2.15.39342: Flags [P.], seq 771134:773882, ack 803, win 65535, length 2748
19:36:49.869417 IP 13.224.212.80.443 > 10.0.2.15.39342: Flags [P.], seq 773882:779378, ack 803, win 65535, length 5496
19:36:49.869419 IP 13.224.212.80.443 > 10.0.2.15.39342: Flags [P.], seq 779378:784874, ack 803, win 65535, length 5496
19:36:49.869642 IP 13.224.212.80.443 > 10.0.2.15.39342: Flags [P.], seq 784874:791744, ack 803, win 65535, length 6870
19:36:49.869923 IP 13.224.212.80.443 > 10.0.2.15.39342: Flags [P.], seq 791744:794492, ack 803, win 65535, length 2748
19:36:49.869925 IP 13.224.212.80.443 > 10.0.2.15.39342: Flags [P.], seq 794492:797240, ack 803, win 65535, length 2748
19:36:49.870171 IP 13.224.212.80.443 > 10.0.2.15.39342: Flags [P.], seq 797240:798614, ack 803, win 65535, length 1374
19:36:49.871770 IP 10.0.2.15.39342 > 13.224.212.80.443: Flags [.], ack 798614, win 65535, length 0
19:36:49.873752 IP 13.224.212.80.443 > 10.0.2.15.39342: Flags [.], seq 798614:836574, ack 803, win 65535, length 37960
19:36:49.873772 IP 10.0.2.15.39342 > 13.224.212.80.443: Flags [.], ack 836574, win 65535, length 0
19:36:49.874141 IP 13.224.212.80.443 > 10.0.2.15.39342: Flags [P.], seq 836574:838460, ack 803, win 65535, length 1886
19:36:49.874149 IP 13.224.212.80.443 > 10.0.2.15.39342: Flags [P.], seq 838460:870062, ack 803, win 65535, length 31602
19:36:49.874255 IP 10.0.2.15.39342 > 13.224.212.80.443: Flags [.], ack 870062, win 65535, length 0
19:36:49.874486 IP 13.224.212.80.443 > 10.0.2.15.39342: Flags [P.], seq 870062:878306, ack 803, win 65535, length 8244
19:36:49.874495 IP 10.0.2.15.39342 > 13.224.212.80.443: Flags [.], ack 878306, win 65535, length 0
19:36:49.875320 IP 13.224.212.80.443 > 10.0.2.15.39342: Flags [P.], seq 878306:883802, ack 803, win 65535, length 5496
19:36:49.875322 IP 13.224.212.80.443 > 10.0.2.15.39342: Flags [P.], seq 883802:885176, ack 803, win 65535, length 1374
19:36:49.875339 IP 10.0.2.15.39342 > 13.224.212.80.443: Flags [.], ack 883802, win 65535, length 0
19:36:49.875398 IP 10.0.2.15.39342 > 13.224.212.80.443: Flags [.], ack 885176, win 65535, length 0
19:36:49.875643 IP 13.224.212.80.443 > 10.0.2.15.39342: Flags [P.], seq 885176:889298, ack 803, win 65535, length 4122
19:36:49.875646 IP 13.224.212.80.443 > 10.0.2.15.39342: Flags [P.], seq 889298:893420, ack 803, win 65535, length 4122
19:36:49.875660 IP 10.0.2.15.39342 > 13.224.212.80.443: Flags [.], ack 889298, win 65535, length 0
19:36:49.875680 IP 10.0.2.15.39342 > 13.224.212.80.443: Flags [.], ack 893420, win 65535, length 0
19:36:49.875751 IP 13.224.212.80.443 > 10.0.2.15.39342: Flags [P.], seq 893420:894794, ack 803, win 65535, length 1374
19:36:49.875842 IP 10.0.2.15.39342 > 13.224.212.80.443: Flags [.], ack 894794, win 65535, length 0
19:36:49.877169 IP 13.224.212.80.443 > 10.0.2.15.39342: Flags [P.], seq 894794:900290, ack 803, win 65535, length 5496
19:36:49.877171 IP 13.224.212.80.443 > 10.0.2.15.39342: Flags [P.], seq 900290:903038, ack 803, win 65535, length 2748
19:36:49.877173 IP 13.224.212.80.443 > 10.0.2.15.39342: Flags [P.], seq 903038:909908, ack 803, win 65535, length 6870
19:36:49.877191 IP 10.0.2.15.39342 > 13.224.212.80.443: Flags [.], ack 900290, win 65535, length 0
19:36:49.877479 IP 13.224.212.80.443 > 10.0.2.15.39342: Flags [P.], seq 909908:912656, ack 803, win 65535, length 2748
19:36:49.877558 IP 13.224.212.80.443 > 10.0.2.15.39342: Flags [P.], seq 912656:918152, ack 803, win 65535, length 5496
19:36:49.877654 IP 10.0.2.15.39342 > 13.224.212.80.443: Flags [.], ack 918152, win 65535, length 0
19:36:49.877777 IP 13.224.212.80.443 > 10.0.2.15.39342: Flags [P.], seq 918152:920900, ack 803, win 65535, length 2748
19:36:49.877929 IP 10.0.2.15.39342 > 13.224.212.80.443: Flags [.], ack 920900, win 65535, length 0
19:36:49.878295 IP 13.224.212.80.443 > 10.0.2.15.39342: Flags [P.], seq 920900:927770, ack 803, win 65535, length 6870
19:36:49.878297 IP 13.224.212.80.443 > 10.0.2.15.39342: Flags [P.], seq 927770:930518, ack 803, win 65535, length 2748
19:36:49.878361 IP 10.0.2.15.39342 > 13.224.212.80.443: Flags [.], ack 930518, win 65535, length 0
19:36:49.878655 IP 13.224.212.80.443 > 10.0.2.15.39342: Flags [P.], seq 930518:933266, ack 803, win 65535, length 2748
19:36:49.878658 IP 13.224.212.80.443 > 10.0.2.15.39342: Flags [P.], seq 933266:938762, ack 803, win 65535, length 5496
19:36:49.878747 IP 13.224.212.80.443 > 10.0.2.15.39342: Flags [P.], seq 938762:944258, ack 803, win 65535, length 5496
19:36:49.878826 IP 10.0.2.15.39342 > 13.224.212.80.443: Flags [.], ack 944258, win 65535, length 0
19:36:49.879064 IP 13.224.212.80.443 > 10.0.2.15.39342: Flags [P.], seq 944258:948380, ack 803, win 65535, length 4122
19:36:49.879185 IP 13.224.212.80.443 > 10.0.2.15.39342: Flags [P.], seq 948380:952502, ack 803, win 65535, length 4122
19:36:49.879230 IP 10.0.2.15.39342 > 13.224.212.80.443: Flags [.], ack 952502, win 65535, length 0
19:36:49.879363 IP 13.224.212.80.443 > 10.0.2.15.39342: Flags [P.], seq 952502:957998, ack 803, win 65535, length 5496
19:36:49.879386 IP 10.0.2.15.39342 > 13.224.212.80.443: Flags [.], ack 957998, win 65535, length 0
19:36:49.879732 IP 13.224.212.80.443 > 10.0.2.15.39342: Flags [P.], seq 957998:964868, ack 803, win 65535, length 6870
19:36:49.879743 IP 10.0.2.15.39342 > 13.224.212.80.443: Flags [.], ack 964868, win 65535, length 0
19:36:49.880135 IP 13.224.212.80.443 > 10.0.2.15.39342: Flags [P.], seq 964868:970364, ack 803, win 65535, length 5496
19:36:49.880138 IP 13.224.212.80.443 > 10.0.2.15.39342: Flags [P.], seq 970364:974486, ack 803, win 65535, length 4122
19:36:49.880241 IP 13.224.212.80.443 > 10.0.2.15.39342: Flags [P.], seq 974486:977234, ack 803, win 65535, length 2748
19:36:49.880421 IP 13.224.212.80.443 > 10.0.2.15.39342: Flags [P.], seq 977234:978608, ack 803, win 65535, length 1374
19:36:49.880525 IP 10.0.2.15.39342 > 13.224.212.80.443: Flags [.], ack 978608, win 65535, length 0
19:36:49.880552 IP 13.224.212.80.443 > 10.0.2.15.39342: Flags [P.], seq 978608:982730, ack 803, win 65535, length 4122
19:36:49.880616 IP 10.0.2.15.39342 > 13.224.212.80.443: Flags [.], ack 982730, win 65535, length 0

