13:19:20.495141 IP 99.84.126.121.443 > 10.0.2.15.45730: Flags [P.], seq 58944002:58946750, ack 1495829784, win 65535, length 2748
13:19:20.495172 IP 10.0.2.15.45730 > 99.84.126.121.443: Flags [.], ack 2748, win 62780, length 0
13:19:20.496021 IP 99.84.126.121.443 > 10.0.2.15.45730: Flags [P.], seq 2748:5496, ack 1, win 65535, length 2748
13:19:20.496104 IP 10.0.2.15.45730 > 99.84.126.121.443: Flags [.], ack 5496, win 60032, length 0
13:19:20.498163 IP 99.84.126.121.443 > 10.0.2.15.45730: Flags [P.], seq 5496:5823, ack 1, win 65535, length 327
13:19:20.498306 IP 10.0.2.15.45730 > 99.84.126.121.443: Flags [.], ack 5823, win 62780, length 0
13:19:20.499551 IP 10.0.2.15.45730 > 99.84.126.121.443: Flags [P.], seq 1:65, ack 5823, win 62780, length 64
13:19:20.500677 IP 99.84.126.121.443 > 10.0.2.15.45730: Flags [.], ack 65, win 65535, length 0
13:19:20.500817 IP 10.0.2.15.45730 > 99.84.126.121.443: Flags [P.], seq 65:111, ack 5823, win 62780, length 46
13:19:20.500862 IP 10.0.2.15.45730 > 99.84.126.121.443: Flags [P.], seq 111:160, ack 5823, win 62780, length 49
13:19:20.500978 IP 10.0.2.15.45730 > 99.84.126.121.443: Flags [P.], seq 160:195, ack 5823, win 62780, length 35
13:19:20.501180 IP 99.84.126.121.443 > 10.0.2.15.45730: Flags [.], ack 111, win 65535, length 0
13:19:20.501182 IP 99.84.126.121.443 > 10.0.2.15.45730: Flags [.], ack 160, win 65535, length 0
13:19:20.501260 IP 10.0.2.15.45730 > 99.84.126.121.443: Flags [P.], seq 195:255, ack 5823, win 62780, length 60
13:19:20.501552 IP 99.84.126.121.443 > 10.0.2.15.45730: Flags [.], ack 195, win 65535, length 0
13:19:20.501554 IP 99.84.126.121.443 > 10.0.2.15.45730: Flags [.], ack 255, win 65535, length 0
13:19:20.514138 IP 99.84.126.121.443 > 10.0.2.15.45730: Flags [P.], seq 5823:5894, ack 255, win 65535, length 71
13:19:20.514160 IP 10.0.2.15.45730 > 99.84.126.121.443: Flags [.], ack 5894, win 62780, length 0
13:19:20.514322 IP 10.0.2.15.45730 > 99.84.126.121.443: Flags [P.], seq 255:286, ack 5894, win 62780, length 31
13:19:20.514730 IP 99.84.126.121.443 > 10.0.2.15.45730: Flags [.], ack 286, win 65535, length 0
13:19:20.547662 IP 99.84.126.121.443 > 10.0.2.15.45730: Flags [.], seq 5894:14654, ack 286, win 65535, length 8760
13:19:20.547751 IP 10.0.2.15.45730 > 99.84.126.121.443: Flags [.], ack 14654, win 58400, length 0
13:19:20.548360 IP 99.84.126.121.443 > 10.0.2.15.45730: Flags [P.], seq 14654:19744, ack 286, win 65535, length 5090
13:19:20.548376 IP 10.0.2.15.45730 > 99.84.126.121.443: Flags [.], ack 19744, win 55480, length 0
13:19:20.548820 IP 99.84.126.121.443 > 10.0.2.15.45730: Flags [P.], seq 19744:22912, ack 286, win 65535, length 3168
13:19:20.548832 IP 10.0.2.15.45730 > 99.84.126.121.443: Flags [.], ack 22912, win 61320, length 0
13:19:20.550756 IP 99.84.126.121.443 > 10.0.2.15.45730: Flags [P.], seq 22912:35605, ack 286, win 65535, length 12693
13:19:20.550822 IP 10.0.2.15.45730 > 99.84.126.121.443: Flags [.], ack 35605, win 55480, length 0
13:19:20.551057 IP 99.84.126.121.443 > 10.0.2.15.45730: Flags [P.], seq 35605:43849, ack 286, win 65535, length 8244
13:19:20.551067 IP 10.0.2.15.45730 > 99.84.126.121.443: Flags [.], ack 43849, win 58400, length 0
13:19:20.553020 IP 99.84.126.121.443 > 10.0.2.15.45730: Flags [P.], seq 43849:45223, ack 286, win 65535, length 1374
13:19:20.553035 IP 10.0.2.15.45730 > 99.84.126.121.443: Flags [.], ack 45223, win 62780, length 0
13:19:20.559653 IP 99.84.126.121.443 > 10.0.2.15.45730: Flags [P.], seq 45223:50719, ack 286, win 65535, length 5496
13:19:20.559754 IP 10.0.2.15.45730 > 99.84.126.121.443: Flags [.], ack 50719, win 62780, length 0
13:19:20.560735 IP 99.84.126.121.443 > 10.0.2.15.45730: Flags [P.], seq 50719:53467, ack 286, win 65535, length 2748
13:19:20.560751 IP 10.0.2.15.45730 > 99.84.126.121.443: Flags [.], ack 53467, win 62780, length 0
13:19:20.561772 IP 99.84.126.121.443 > 10.0.2.15.45730: Flags [P.], seq 53467:54841, ack 286, win 65535, length 1374
13:19:20.561894 IP 10.0.2.15.45730 > 99.84.126.121.443: Flags [.], ack 54841, win 62780, length 0
13:19:20.563101 IP 99.84.126.121.443 > 10.0.2.15.45730: Flags [.], seq 54841:76741, ack 286, win 65535, length 21900
13:19:20.563388 IP 10.0.2.15.45730 > 99.84.126.121.443: Flags [.], ack 76741, win 62780, length 0
13:19:20.564161 IP 99.84.126.121.443 > 10.0.2.15.45730: Flags [P.], seq 76741:78199, ack 286, win 65535, length 1458
13:19:20.564816 IP 10.0.2.15.45730 > 99.84.126.121.443: Flags [.], ack 78199, win 65535, length 0
13:19:20.565544 IP 99.84.126.121.443 > 10.0.2.15.45730: Flags [P.], seq 78199:86443, ack 286, win 65535, length 8244
13:19:20.565547 IP 99.84.126.121.443 > 10.0.2.15.45730: Flags [P.], seq 86443:87817, ack 286, win 65535, length 1374
13:19:20.565569 IP 10.0.2.15.45730 > 99.84.126.121.443: Flags [.], ack 86443, win 65535, length 0
13:19:20.565589 IP 10.0.2.15.45730 > 99.84.126.121.443: Flags [.], ack 87817, win 65535, length 0
13:19:20.566146 IP 99.84.126.121.443 > 10.0.2.15.45730: Flags [P.], seq 87817:100183, ack 286, win 65535, length 12366
13:19:20.566161 IP 10.0.2.15.45730 > 99.84.126.121.443: Flags [.], ack 100183, win 65535, length 0
13:19:20.567187 IP 99.84.126.121.443 > 10.0.2.15.45730: Flags [P.], seq 100183:101557, ack 286, win 65535, length 1374
13:19:20.567200 IP 10.0.2.15.45730 > 99.84.126.121.443: Flags [.], ack 101557, win 65535, length 0
13:19:20.568134 IP 99.84.126.121.443 > 10.0.2.15.45730: Flags [P.], seq 101557:112549, ack 286, win 65535, length 10992
13:19:20.568147 IP 10.0.2.15.45730 > 99.84.126.121.443: Flags [.], ack 112549, win 65535, length 0
13:19:20.568357 IP 99.84.126.121.443 > 10.0.2.15.45730: Flags [P.], seq 112549:116671, ack 286, win 65535, length 4122
13:19:20.568366 IP 10.0.2.15.45730 > 99.84.126.121.443: Flags [.], ack 116671, win 65535, length 0
13:19:20.569138 IP 99.84.126.121.443 > 10.0.2.15.45730: Flags [P.], seq 116671:122167, ack 286, win 65535, length 5496
13:19:20.569178 IP 10.0.2.15.45730 > 99.84.126.121.443: Flags [.], ack 122167, win 65535, length 0
13:19:20.572098 IP 99.84.126.121.443 > 10.0.2.15.45730: Flags [P.], seq 122167:135907, ack 286, win 65535, length 13740
13:19:20.572118 IP 10.0.2.15.45730 > 99.84.126.121.443: Flags [.], ack 135907, win 65535, length 0
13:19:20.572155 IP 99.84.126.121.443 > 10.0.2.15.45730: Flags [P.], seq 135907:138655, ack 286, win 65535, length 2748
13:19:20.572159 IP 10.0.2.15.45730 > 99.84.126.121.443: Flags [.], ack 138655, win 65535, length 0
13:19:20.572808 IP 99.84.126.121.443 > 10.0.2.15.45730: Flags [P.], seq 138655:145525, ack 286, win 65535, length 6870
13:19:20.572825 IP 10.0.2.15.45730 > 99.84.126.121.443: Flags [.], ack 145525, win 65535, length 0
13:19:20.573709 IP 99.84.126.121.443 > 10.0.2.15.45730: Flags [P.], seq 145525:146899, ack 286, win 65535, length 1374
13:19:20.573722 IP 10.0.2.15.45730 > 99.84.126.121.443: Flags [.], ack 146899, win 65535, length 0
13:19:20.574946 IP 99.84.126.121.443 > 10.0.2.15.45730: Flags [P.], seq 146899:156517, ack 286, win 65535, length 9618
13:19:20.574960 IP 10.0.2.15.45730 > 99.84.126.121.443: Flags [.], ack 156517, win 65535, length 0
13:19:20.575124 IP 99.84.126.121.443 > 10.0.2.15.45730: Flags [P.], seq 156517:157891, ack 286, win 65535, length 1374
13:19:20.575135 IP 10.0.2.15.45730 > 99.84.126.121.443: Flags [.], ack 157891, win 65535, length 0
13:19:20.575373 IP 99.84.126.121.443 > 10.0.2.15.45730: Flags [P.], seq 157891:163387, ack 286, win 65535, length 5496
13:19:20.575388 IP 10.0.2.15.45730 > 99.84.126.121.443: Flags [.], ack 163387, win 65535, length 0
13:19:20.576516 IP 99.84.126.121.443 > 10.0.2.15.45730: Flags [P.], seq 163387:170257, ack 286, win 65535, length 6870
13:19:20.576530 IP 10.0.2.15.45730 > 99.84.126.121.443: Flags [.], ack 170257, win 65535, length 0
13:19:20.576765 IP 99.84.126.121.443 > 10.0.2.15.45730: Flags [P.], seq 170257:173005, ack 286, win 65535, length 2748
13:19:20.576779 IP 10.0.2.15.45730 > 99.84.126.121.443: Flags [.], ack 173005, win 65535, length 0
13:19:20.578683 IP 99.84.126.121.443 > 10.0.2.15.45730: Flags [P.], seq 173005:185371, ack 286, win 65535, length 12366
13:19:20.578701 IP 10.0.2.15.45730 > 99.84.126.121.443: Flags [.], ack 185371, win 65535, length 0
13:19:20.578882 IP 99.84.126.121.443 > 10.0.2.15.45730: Flags [P.], seq 185371:189493, ack 286, win 65535, length 4122
13:19:20.578894 IP 10.0.2.15.45730 > 99.84.126.121.443: Flags [.], ack 189493, win 65535, length 0
13:19:20.579187 IP 99.84.126.121.443 > 10.0.2.15.45730: Flags [P.], seq 189493:194989, ack 286, win 65535, length 5496
13:19:20.579196 IP 10.0.2.15.45730 > 99.84.126.121.443: Flags [.], ack 194989, win 65535, length 0
13:19:20.580561 IP 99.84.126.121.443 > 10.0.2.15.45730: Flags [P.], seq 194989:201859, ack 286, win 65535, length 6870
13:19:20.580573 IP 10.0.2.15.45730 > 99.84.126.121.443: Flags [.], ack 201859, win 65535, length 0
13:19:20.580919 IP 99.84.126.121.443 > 10.0.2.15.45730: Flags [P.], seq 201859:210103, ack 286, win 65535, length 8244
13:19:20.580931 IP 10.0.2.15.45730 > 99.84.126.121.443: Flags [.], ack 210103, win 65535, length 0
13:19:20.581163 IP 99.84.126.121.443 > 10.0.2.15.45730: Flags [P.], seq 210103:214225, ack 286, win 65535, length 4122
13:19:20.581173 IP 10.0.2.15.45730 > 99.84.126.121.443: Flags [.], ack 214225, win 65535, length 0
13:19:20.581414 IP 99.84.126.121.443 > 10.0.2.15.45730: Flags [P.], seq 214225:218347, ack 286, win 65535, length 4122
13:19:20.581421 IP 10.0.2.15.45730 > 99.84.126.121.443: Flags [.], ack 218347, win 65535, length 0
13:19:20.582829 IP 99.84.126.121.443 > 10.0.2.15.45730: Flags [P.], seq 218347:227965, ack 286, win 65535, length 9618
13:19:20.582844 IP 10.0.2.15.45730 > 99.84.126.121.443: Flags [.], ack 227965, win 65535, length 0
13:19:20.583079 IP 99.84.126.121.443 > 10.0.2.15.45730: Flags [P.], seq 227965:232087, ack 286, win 65535, length 4122
13:19:20.583091 IP 10.0.2.15.45730 > 99.84.126.121.443: Flags [.], ack 232087, win 65535, length 0
13:19:20.583408 IP 99.84.126.121.443 > 10.0.2.15.45730: Flags [P.], seq 232087:237583, ack 286, win 65535, length 5496
13:19:20.583519 IP 10.0.2.15.45730 > 99.84.126.121.443: Flags [.], ack 237583, win 65535, length 0
13:19:20.584817 IP 99.84.126.121.443 > 10.0.2.15.45730: Flags [P.], seq 237583:244453, ack 286, win 65535, length 6870
13:19:20.584831 IP 10.0.2.15.45730 > 99.84.126.121.443: Flags [.], ack 244453, win 65535, length 0
13:19:20.585217 IP 99.84.126.121.443 > 10.0.2.15.45730: Flags [P.], seq 244453:252697, ack 286, win 65535, length 8244
13:19:20.585232 IP 10.0.2.15.45730 > 99.84.126.121.443: Flags [.], ack 252697, win 65535, length 0
13:19:20.585464 IP 99.84.126.121.443 > 10.0.2.15.45730: Flags [P.], seq 252697:260941, ack 286, win 65535, length 8244
13:19:20.585473 IP 10.0.2.15.45730 > 99.84.126.121.443: Flags [.], ack 260941, win 65535, length 0
13:19:20.588486 IP 99.84.126.121.443 > 10.0.2.15.45730: Flags [P.], seq 260941:271933, ack 286, win 65535, length 10992
13:19:20.588503 IP 10.0.2.15.45730 > 99.84.126.121.443: Flags [.], ack 271933, win 65535, length 0
13:19:20.588599 IP 99.84.126.121.443 > 10.0.2.15.45730: Flags [P.], seq 271933:276055, ack 286, win 65535, length 4122
13:19:20.588606 IP 10.0.2.15.45730 > 99.84.126.121.443: Flags [.], ack 276055, win 65535, length 0
13:19:20.588774 IP 99.84.126.121.443 > 10.0.2.15.45730: Flags [P.], seq 276055:282925, ack 286, win 65535, length 6870
13:19:20.588783 IP 10.0.2.15.45730 > 99.84.126.121.443: Flags [.], ack 282925, win 65535, length 0
13:19:20.589005 IP 99.84.126.121.443 > 10.0.2.15.45730: Flags [P.], seq 282925:287047, ack 286, win 65535, length 4122
13:19:20.589017 IP 10.0.2.15.45730 > 99.84.126.121.443: Flags [.], ack 287047, win 65535, length 0
13:19:20.589337 IP 99.84.126.121.443 > 10.0.2.15.45730: Flags [P.], seq 287047:293917, ack 286, win 65535, length 6870
13:19:20.589348 IP 10.0.2.15.45730 > 99.84.126.121.443: Flags [.], ack 293917, win 65535, length 0
13:19:20.589600 IP 99.84.126.121.443 > 10.0.2.15.45730: Flags [P.], seq 293917:299413, ack 286, win 65535, length 5496
13:19:20.589612 IP 10.0.2.15.45730 > 99.84.126.121.443: Flags [.], ack 299413, win 65535, length 0
13:19:20.589954 IP 99.84.126.121.443 > 10.0.2.15.45730: Flags [P.], seq 299413:306283, ack 286, win 65535, length 6870
13:19:20.589966 IP 10.0.2.15.45730 > 99.84.126.121.443: Flags [.], ack 306283, win 65535, length 0
13:19:20.590339 IP 99.84.126.121.443 > 10.0.2.15.45730: Flags [P.], seq 306283:307657, ack 286, win 65535, length 1374
13:19:20.590349 IP 10.0.2.15.45730 > 99.84.126.121.443: Flags [.], ack 307657, win 65535, length 0
13:19:20.591031 IP 99.84.126.121.443 > 10.0.2.15.45730: Flags [P.], seq 307657:314527, ack 286, win 65535, length 6870
13:19:20.591043 IP 10.0.2.15.45730 > 99.84.126.121.443: Flags [.], ack 314527, win 65535, length 0
13:19:20.591381 IP 99.84.126.121.443 > 10.0.2.15.45730: Flags [P.], seq 314527:321397, ack 286, win 65535, length 6870
13:19:20.591394 IP 10.0.2.15.45730 > 99.84.126.121.443: Flags [.], ack 321397, win 65535, length 0
13:19:20.592373 IP 99.84.126.121.443 > 10.0.2.15.45730: Flags [P.], seq 321397:332389, ack 286, win 65535, length 10992
13:19:20.592427 IP 10.0.2.15.45730 > 99.84.126.121.443: Flags [.], ack 332389, win 65535, length 0
13:19:20.592478 IP 99.84.126.121.443 > 10.0.2.15.45730: Flags [P.], seq 332389:336511, ack 286, win 65535, length 4122
13:19:20.592479 IP 99.84.126.121.443 > 10.0.2.15.45730: Flags [P.], seq 336511:340633, ack 286, win 65535, length 4122
13:19:20.592520 IP 10.0.2.15.45730 > 99.84.126.121.443: Flags [.], ack 336511, win 65535, length 0
13:19:20.592536 IP 10.0.2.15.45730 > 99.84.126.121.443: Flags [.], ack 340633, win 65535, length 0
13:19:20.593374 IP 99.84.126.121.443 > 10.0.2.15.45730: Flags [P.], seq 340633:347503, ack 286, win 65535, length 6870
13:19:20.593376 IP 99.84.126.121.443 > 10.0.2.15.45730: Flags [P.], seq 347503:352999, ack 286, win 65535, length 5496
13:19:20.593393 IP 10.0.2.15.45730 > 99.84.126.121.443: Flags [.], ack 347503, win 65535, length 0
13:19:20.593471 IP 10.0.2.15.45730 > 99.84.126.121.443: Flags [.], ack 352999, win 65535, length 0
13:19:20.593708 IP 99.84.126.121.443 > 10.0.2.15.45730: Flags [.], seq 352999:354459, ack 286, win 65535, length 1460
13:19:20.593721 IP 10.0.2.15.45730 > 99.84.126.121.443: Flags [.], ack 354459, win 65535, length 0
13:19:20.593956 IP 99.84.126.121.443 > 10.0.2.15.45730: Flags [P.], seq 354459:357121, ack 286, win 65535, length 2662
13:19:20.593959 IP 99.84.126.121.443 > 10.0.2.15.45730: Flags [P.], seq 357121:365365, ack 286, win 65535, length 8244
13:19:20.593972 IP 10.0.2.15.45730 > 99.84.126.121.443: Flags [.], ack 357121, win 65535, length 0
13:19:20.594232 IP 10.0.2.15.45730 > 99.84.126.121.443: Flags [.], ack 365365, win 65535, length 0
13:19:20.594272 IP 99.84.126.121.443 > 10.0.2.15.45730: Flags [P.], seq 365365:372235, ack 286, win 65535, length 6870
13:19:20.594320 IP 10.0.2.15.45730 > 99.84.126.121.443: Flags [.], ack 372235, win 65535, length 0
13:19:20.594520 IP 99.84.126.121.443 > 10.0.2.15.45730: Flags [P.], seq 372235:376357, ack 286, win 65535, length 4122
13:19:20.594527 IP 10.0.2.15.45730 > 99.84.126.121.443: Flags [.], ack 376357, win 65535, length 0
13:19:20.595554 IP 99.84.126.121.443 > 10.0.2.15.45730: Flags [P.], seq 376357:383227, ack 286, win 65535, length 6870
13:19:20.595571 IP 10.0.2.15.45730 > 99.84.126.121.443: Flags [.], ack 383227, win 65535, length 0
13:19:20.596421 IP 99.84.126.121.443 > 10.0.2.15.45730: Flags [P.], seq 383227:392845, ack 286, win 65535, length 9618
13:19:20.596427 IP 99.84.126.121.443 > 10.0.2.15.45730: Flags [P.], seq 392845:398341, ack 286, win 65535, length 5496
13:19:20.596450 IP 10.0.2.15.45730 > 99.84.126.121.443: Flags [.], ack 392845, win 65535, length 0
13:19:20.596482 IP 10.0.2.15.45730 > 99.84.126.121.443: Flags [.], ack 398341, win 65535, length 0
13:19:20.596518 IP 99.84.126.121.443 > 10.0.2.15.45730: Flags [P.], seq 398341:406585, ack 286, win 65535, length 8244
13:19:20.596522 IP 10.0.2.15.45730 > 99.84.126.121.443: Flags [.], ack 406585, win 65535, length 0
13:19:20.596815 IP 99.84.126.121.443 > 10.0.2.15.45730: Flags [P.], seq 406585:412081, ack 286, win 65535, length 5496
13:19:20.596826 IP 10.0.2.15.45730 > 99.84.126.121.443: Flags [.], ack 412081, win 65535, length 0
13:19:20.597612 IP 99.84.126.121.443 > 10.0.2.15.45730: Flags [P.], seq 412081:418951, ack 286, win 65535, length 6870
13:19:20.597629 IP 10.0.2.15.45730 > 99.84.126.121.443: Flags [.], ack 418951, win 65535, length 0
13:19:20.597943 IP 99.84.126.121.443 > 10.0.2.15.45730: Flags [P.], seq 418951:420325, ack 286, win 65535, length 1374
13:19:20.597944 IP 99.84.126.121.443 > 10.0.2.15.45730: Flags [.], seq 420325:421785, ack 286, win 65535, length 1460
13:19:20.597959 IP 10.0.2.15.45730 > 99.84.126.121.443: Flags [.], ack 420325, win 65535, length 0
13:19:20.597987 IP 10.0.2.15.45730 > 99.84.126.121.443: Flags [.], ack 421785, win 65535, length 0
13:19:20.598198 IP 99.84.126.121.443 > 10.0.2.15.45730: Flags [P.], seq 421785:424447, ack 286, win 65535, length 2662
13:19:20.598330 IP 10.0.2.15.45730 > 99.84.126.121.443: Flags [.], ack 424447, win 65535, length 0
13:19:20.598679 IP 99.84.126.121.443 > 10.0.2.15.45730: Flags [P.], seq 424447:435439, ack 286, win 65535, length 10992
13:19:20.598690 IP 10.0.2.15.45730 > 99.84.126.121.443: Flags [.], ack 435439, win 65535, length 0
13:19:20.598812 IP 99.84.126.121.443 > 10.0.2.15.45730: Flags [P.], seq 435439:438187, ack 286, win 65535, length 2748
13:19:20.598822 IP 10.0.2.15.45730 > 99.84.126.121.443: Flags [.], ack 438187, win 65535, length 0
13:19:20.599083 IP 99.84.126.121.443 > 10.0.2.15.45730: Flags [P.], seq 438187:443683, ack 286, win 65535, length 5496
13:19:20.599095 IP 10.0.2.15.45730 > 99.84.126.121.443: Flags [.], ack 443683, win 65535, length 0
13:19:20.599208 IP 99.84.126.121.443 > 10.0.2.15.45730: Flags [P.], seq 443683:447805, ack 286, win 65535, length 4122
13:19:20.599215 IP 10.0.2.15.45730 > 99.84.126.121.443: Flags [.], ack 447805, win 65535, length 0
13:19:20.600040 IP 99.84.126.121.443 > 10.0.2.15.45730: Flags [P.], seq 447805:454675, ack 286, win 65535, length 6870
13:19:20.600054 IP 10.0.2.15.45730 > 99.84.126.121.443: Flags [.], ack 454675, win 65535, length 0
13:19:20.600222 IP 99.84.126.121.443 > 10.0.2.15.45730: Flags [P.], seq 454675:464293, ack 286, win 65535, length 9618
13:19:20.600231 IP 10.0.2.15.45730 > 99.84.126.121.443: Flags [.], ack 464293, win 65535, length 0
13:19:20.600393 IP 99.84.126.121.443 > 10.0.2.15.45730: Flags [P.], seq 464293:465667, ack 286, win 65535, length 1374
13:19:20.600402 IP 10.0.2.15.45730 > 99.84.126.121.443: Flags [.], ack 465667, win 65535, length 0
13:19:20.600760 IP 99.84.126.121.443 > 10.0.2.15.45730: Flags [P.], seq 465667:471163, ack 286, win 65535, length 5496
13:19:20.600776 IP 10.0.2.15.45730 > 99.84.126.121.443: Flags [.], ack 471163, win 65535, length 0
13:19:20.601031 IP 99.84.126.121.443 > 10.0.2.15.45730: Flags [P.], seq 471163:479407, ack 286, win 65535, length 8244
13:19:20.601041 IP 10.0.2.15.45730 > 99.84.126.121.443: Flags [.], ack 479407, win 65535, length 0
13:19:20.601373 IP 99.84.126.121.443 > 10.0.2.15.45730: Flags [P.], seq 479407:483529, ack 286, win 65535, length 4122
13:19:20.601384 IP 10.0.2.15.45730 > 99.84.126.121.443: Flags [.], ack 483529, win 65535, length 0
13:19:20.602110 IP 99.84.126.121.443 > 10.0.2.15.45730: Flags [P.], seq 483529:491773, ack 286, win 65535, length 8244
13:19:20.602125 IP 10.0.2.15.45730 > 99.84.126.121.443: Flags [.], ack 491773, win 65535, length 0

