19:36:44.208221 IP 10.0.2.15.35858 > 140.233.253.2.53: 41849+ A? www.espn.com. (30)
19:36:44.208255 IP 10.0.2.15.35858 > 140.233.253.2.53: 5758+ AAAA? www.espn.com. (30)
19:36:44.214374 IP 140.233.253.2.53 > 10.0.2.15.35858: 5758 8/0/0 AAAA 2600:9000:20ed:5e00:e:fe33:5580:93a1, AAAA 2600:9000:20ed:e400:e:fe33:5580:93a1, AAAA 2600:9000:20ed:7400:e:fe33:5580:93a1, AAAA 2600:9000:20ed:400:e:fe33:5580:93a1, AAAA 2600:9000:20ed:ec00:e:fe33:5580:93a1, AAAA 2600:9000:20ed:6a00:e:fe33:5580:93a1, AAAA 2600:9000:20ed:5000:e:fe33:5580:93a1, AAAA 2600:9000:20ed:5200:e:fe33:5580:93a1 (254)
19:36:44.214376 IP 140.233.253.2.53 > 10.0.2.15.35858: 41849 4/0/0 A 13.224.212.45, A 13.224.212.47, A 13.224.212.80, A 13.224.212.128 (94)
19:36:44.214870 IP 10.0.2.15.48090 > 13.224.212.45.443: Flags [S], seq 2746235811, win 64240, options [mss 1460,sackOK,TS val 2119328466 ecr 0,nop,wscale 6], length 0
19:36:44.231214 IP 13.224.212.45.443 > 10.0.2.15.48090: Flags [S.], seq 178752001, ack 2746235812, win 65535, options [mss 1460], length 0
19:36:44.231260 IP 10.0.2.15.48090 > 13.224.212.45.443: Flags [.], ack 1, win 64240, length 0
19:36:44.242145 IP 10.0.2.15.48090 > 13.224.212.45.443: Flags [P.], seq 1:518, ack 1, win 64240, length 517
19:36:44.242410 IP 13.224.212.45.443 > 10.0.2.15.48090: Flags [.], ack 518, win 65535, length 0
19:36:44.260141 IP 13.224.212.45.443 > 10.0.2.15.48090: Flags [.], seq 1:2921, ack 518, win 65535, length 2920
19:36:44.260180 IP 10.0.2.15.48090 > 13.224.212.45.443: Flags [.], ack 2921, win 62780, length 0
19:36:44.260431 IP 13.224.212.45.443 > 10.0.2.15.48090: Flags [P.], seq 2921:4123, ack 518, win 65535, length 1202
19:36:44.260442 IP 10.0.2.15.48090 > 13.224.212.45.443: Flags [.], ack 4123, win 61578, length 0
19:36:44.262378 IP 13.224.212.45.443 > 10.0.2.15.48090: Flags [P.], seq 4123:5824, ack 518, win 65535, length 1701
19:36:44.262400 IP 10.0.2.15.48090 > 13.224.212.45.443: Flags [.], ack 5824, win 62780, length 0
19:36:44.263847 IP 10.0.2.15.48090 > 13.224.212.45.443: Flags [P.], seq 518:582, ack 5824, win 62780, length 64
19:36:44.264243 IP 13.224.212.45.443 > 10.0.2.15.48090: Flags [.], ack 582, win 65535, length 0
19:36:44.264366 IP 10.0.2.15.48090 > 13.224.212.45.443: Flags [P.], seq 582:628, ack 5824, win 62780, length 46
19:36:44.264554 IP 10.0.2.15.48090 > 13.224.212.45.443: Flags [P.], seq 628:677, ack 5824, win 62780, length 49
19:36:44.264678 IP 13.224.212.45.443 > 10.0.2.15.48090: Flags [.], ack 628, win 65535, length 0
19:36:44.264735 IP 10.0.2.15.48090 > 13.224.212.45.443: Flags [P.], seq 677:712, ack 5824, win 62780, length 35
19:36:44.264788 IP 10.0.2.15.48090 > 13.224.212.45.443: Flags [P.], seq 712:772, ack 5824, win 62780, length 60
19:36:44.264936 IP 13.224.212.45.443 > 10.0.2.15.48090: Flags [.], ack 677, win 65535, length 0
19:36:44.264937 IP 13.224.212.45.443 > 10.0.2.15.48090: Flags [.], ack 712, win 65535, length 0
19:36:44.265089 IP 13.224.212.45.443 > 10.0.2.15.48090: Flags [.], ack 772, win 65535, length 0
19:36:44.278272 IP 13.224.212.45.443 > 10.0.2.15.48090: Flags [P.], seq 5824:5886, ack 772, win 65535, length 62
19:36:44.278294 IP 10.0.2.15.48090 > 13.224.212.45.443: Flags [.], ack 5886, win 62780, length 0
19:36:44.278565 IP 10.0.2.15.48090 > 13.224.212.45.443: Flags [P.], seq 772:803, ack 5886, win 62780, length 31
19:36:44.278906 IP 13.224.212.45.443 > 10.0.2.15.48090: Flags [.], ack 803, win 65535, length 0
19:36:44.279099 IP 13.224.212.45.443 > 10.0.2.15.48090: Flags [P.], seq 5886:5917, ack 803, win 65535, length 31
19:36:44.279108 IP 10.0.2.15.48090 > 13.224.212.45.443: Flags [.], ack 5917, win 62780, length 0
19:36:44.292368 IP 13.224.212.45.443 > 10.0.2.15.48090: Flags [P.], seq 5917:10039, ack 803, win 65535, length 4122
19:36:44.292391 IP 10.0.2.15.48090 > 13.224.212.45.443: Flags [.], ack 10039, win 61320, length 0
19:36:44.295513 IP 13.224.212.45.443 > 10.0.2.15.48090: Flags [.], seq 10039:21719, ack 803, win 65535, length 11680
19:36:44.295543 IP 10.0.2.15.48090 > 13.224.212.45.443: Flags [.], ack 21719, win 56940, length 0
19:36:44.295704 IP 13.224.212.45.443 > 10.0.2.15.48090: Flags [P.], seq 21719:33397, ack 803, win 65535, length 11678
19:36:44.295715 IP 10.0.2.15.48090 > 13.224.212.45.443: Flags [.], ack 33397, win 49640, length 0
19:36:44.297368 IP 13.224.212.45.443 > 10.0.2.15.48090: Flags [P.], seq 33397:44389, ack 803, win 65535, length 10992
19:36:44.297387 IP 10.0.2.15.48090 > 13.224.212.45.443: Flags [.], ack 44389, win 56940, length 0
19:36:44.298295 IP 13.224.212.45.443 > 10.0.2.15.48090: Flags [P.], seq 44389:48511, ack 803, win 65535, length 4122
19:36:44.298313 IP 10.0.2.15.48090 > 13.224.212.45.443: Flags [.], ack 48511, win 54020, length 0
19:36:44.299271 IP 13.224.212.45.443 > 10.0.2.15.48090: Flags [P.], seq 48511:49885, ack 803, win 65535, length 1374
19:36:44.299595 IP 10.0.2.15.48090 > 13.224.212.45.443: Flags [.], ack 49885, win 62780, length 0
19:36:44.307272 IP 13.224.212.45.443 > 10.0.2.15.48090: Flags [P.], seq 49885:54007, ack 803, win 65535, length 4122
19:36:44.307376 IP 10.0.2.15.48090 > 13.224.212.45.443: Flags [.], ack 54007, win 62780, length 0
19:36:44.310454 IP 13.224.212.45.443 > 10.0.2.15.48090: Flags [P.], seq 54007:63625, ack 803, win 65535, length 9618
19:36:44.310548 IP 10.0.2.15.48090 > 13.224.212.45.443: Flags [.], ack 63625, win 62780, length 0
19:36:44.311206 IP 13.224.212.45.443 > 10.0.2.15.48090: Flags [P.], seq 63625:70495, ack 803, win 65535, length 6870
19:36:44.311269 IP 10.0.2.15.48090 > 13.224.212.45.443: Flags [.], ack 70495, win 62780, length 0
19:36:44.312389 IP 13.224.212.45.443 > 10.0.2.15.48090: Flags [P.], seq 70495:77365, ack 803, win 65535, length 6870
19:36:44.312393 IP 13.224.212.45.443 > 10.0.2.15.48090: Flags [P.], seq 77365:80113, ack 803, win 65535, length 2748
19:36:44.312419 IP 10.0.2.15.48090 > 13.224.212.45.443: Flags [.], ack 77365, win 65535, length 0
19:36:44.312459 IP 10.0.2.15.48090 > 13.224.212.45.443: Flags [.], ack 80113, win 65535, length 0
19:36:44.314730 IP 13.224.212.45.443 > 10.0.2.15.48090: Flags [P.], seq 80113:88357, ack 803, win 65535, length 8244
19:36:44.314754 IP 10.0.2.15.48090 > 13.224.212.45.443: Flags [.], ack 88357, win 65535, length 0
19:36:44.314936 IP 13.224.212.45.443 > 10.0.2.15.48090: Flags [P.], seq 88357:91105, ack 803, win 65535, length 2748
19:36:44.314944 IP 10.0.2.15.48090 > 13.224.212.45.443: Flags [.], ack 91105, win 65535, length 0
19:36:44.315494 IP 13.224.212.45.443 > 10.0.2.15.48090: Flags [P.], seq 91105:96601, ack 803, win 65535, length 5496
19:36:44.315510 IP 10.0.2.15.48090 > 13.224.212.45.443: Flags [.], ack 96601, win 65535, length 0
19:36:44.316687 IP 13.224.212.45.443 > 10.0.2.15.48090: Flags [P.], seq 96601:102097, ack 803, win 65535, length 5496
19:36:44.316689 IP 13.224.212.45.443 > 10.0.2.15.48090: Flags [P.], seq 102097:104845, ack 803, win 65535, length 2748
19:36:44.316690 IP 13.224.212.45.443 > 10.0.2.15.48090: Flags [P.], seq 104845:107593, ack 803, win 65535, length 2748
19:36:44.316711 IP 10.0.2.15.48090 > 13.224.212.45.443: Flags [.], ack 102097, win 65535, length 0
19:36:44.316750 IP 10.0.2.15.48090 > 13.224.212.45.443: Flags [.], ack 104845, win 65535, length 0
19:36:44.316768 IP 10.0.2.15.48090 > 13.224.212.45.443: Flags [.], ack 107593, win 65535, length 0
19:36:44.317753 IP 13.224.212.45.443 > 10.0.2.15.48090: Flags [P.], seq 107593:113089, ack 803, win 65535, length 5496
19:36:44.317770 IP 10.0.2.15.48090 > 13.224.212.45.443: Flags [.], ack 113089, win 65535, length 0
19:36:44.318990 IP 13.224.212.45.443 > 10.0.2.15.48090: Flags [P.], seq 113089:119959, ack 803, win 65535, length 6870
19:36:44.319099 IP 10.0.2.15.48090 > 13.224.212.45.443: Flags [.], ack 119959, win 65535, length 0
19:36:44.319875 IP 13.224.212.45.443 > 10.0.2.15.48090: Flags [P.], seq 119959:128203, ack 803, win 65535, length 8244
19:36:44.319925 IP 10.0.2.15.48090 > 13.224.212.45.443: Flags [.], ack 128203, win 65535, length 0
19:36:44.320083 IP 13.224.212.45.443 > 10.0.2.15.48090: Flags [P.], seq 128203:129577, ack 803, win 65535, length 1374
19:36:44.320110 IP 10.0.2.15.48090 > 13.224.212.45.443: Flags [.], ack 129577, win 65535, length 0
19:36:44.321083 IP 13.224.212.45.443 > 10.0.2.15.48090: Flags [P.], seq 129577:137821, ack 803, win 65535, length 8244
19:36:44.321195 IP 10.0.2.15.48090 > 13.224.212.45.443: Flags [.], ack 137821, win 65535, length 0
19:36:44.323547 IP 13.224.212.45.443 > 10.0.2.15.48090: Flags [P.], seq 137821:139195, ack 803, win 65535, length 1374
19:36:44.323568 IP 10.0.2.15.48090 > 13.224.212.45.443: Flags [.], ack 139195, win 65535, length 0
19:36:44.324097 IP 13.224.212.45.443 > 10.0.2.15.48090: Flags [P.], seq 139195:146065, ack 803, win 65535, length 6870
19:36:44.324201 IP 10.0.2.15.48090 > 13.224.212.45.443: Flags [.], ack 146065, win 65535, length 0
19:36:44.324516 IP 13.224.212.45.443 > 10.0.2.15.48090: Flags [P.], seq 146065:150187, ack 803, win 65535, length 4122
19:36:44.324519 IP 13.224.212.45.443 > 10.0.2.15.48090: Flags [P.], seq 150187:154309, ack 803, win 65535, length 4122
19:36:44.324533 IP 10.0.2.15.48090 > 13.224.212.45.443: Flags [.], ack 150187, win 65535, length 0
19:36:44.324559 IP 10.0.2.15.48090 > 13.224.212.45.443: Flags [.], ack 154309, win 65535, length 0
19:36:44.325665 IP 13.224.212.45.443 > 10.0.2.15.48090: Flags [P.], seq 154309:159805, ack 803, win 65535, length 5496
19:36:44.325678 IP 10.0.2.15.48090 > 13.224.212.45.443: Flags [.], ack 159805, win 65535, length 0
19:36:44.326313 IP 13.224.212.45.443 > 10.0.2.15.48090: Flags [P.], seq 159805:166675, ack 803, win 65535, length 6870
19:36:44.326316 IP 13.224.212.45.443 > 10.0.2.15.48090: Flags [P.], seq 166675:170797, ack 803, win 65535, length 4122
19:36:44.326333 IP 10.0.2.15.48090 > 13.224.212.45.443: Flags [.], ack 166675, win 65535, length 0
19:36:44.326375 IP 10.0.2.15.48090 > 13.224.212.45.443: Flags [.], ack 170797, win 65535, length 0
19:36:44.327444 IP 13.224.212.45.443 > 10.0.2.15.48090: Flags [P.], seq 170797:177667, ack 803, win 65535, length 6870
19:36:44.327463 IP 10.0.2.15.48090 > 13.224.212.45.443: Flags [.], ack 177667, win 65535, length 0
19:36:44.328568 IP 13.224.212.45.443 > 10.0.2.15.48090: Flags [P.], seq 177667:183163, ack 803, win 65535, length 5496
19:36:44.328571 IP 13.224.212.45.443 > 10.0.2.15.48090: Flags [P.], seq 183163:187285, ack 803, win 65535, length 4122
19:36:44.328594 IP 10.0.2.15.48090 > 13.224.212.45.443: Flags [.], ack 183163, win 65535, length 0
19:36:44.328627 IP 10.0.2.15.48090 > 13.224.212.45.443: Flags [.], ack 187285, win 65535, length 0
19:36:44.329647 IP 13.224.212.45.443 > 10.0.2.15.48090: Flags [P.], seq 187285:194155, ack 803, win 65535, length 6870
19:36:44.329664 IP 10.0.2.15.48090 > 13.224.212.45.443: Flags [.], ack 194155, win 65535, length 0
19:36:44.330578 IP 13.224.212.45.443 > 10.0.2.15.48090: Flags [P.], seq 194155:201025, ack 803, win 65535, length 6870
19:36:44.330622 IP 10.0.2.15.48090 > 13.224.212.45.443: Flags [.], ack 201025, win 65535, length 0
19:36:44.330835 IP 13.224.212.45.443 > 10.0.2.15.48090: Flags [P.], seq 201025:205147, ack 803, win 65535, length 4122
19:36:44.330836 IP 13.224.212.45.443 > 10.0.2.15.48090: Flags [P.], seq 205147:207895, ack 803, win 65535, length 2748
19:36:44.330847 IP 10.0.2.15.48090 > 13.224.212.45.443: Flags [.], ack 205147, win 65535, length 0
19:36:44.330866 IP 10.0.2.15.48090 > 13.224.212.45.443: Flags [.], ack 207895, win 65535, length 0
19:36:44.333443 IP 13.224.212.45.443 > 10.0.2.15.48090: Flags [P.], seq 207895:218887, ack 803, win 65535, length 10992
19:36:44.333463 IP 10.0.2.15.48090 > 13.224.212.45.443: Flags [.], ack 218887, win 65535, length 0
19:36:44.333527 IP 13.224.212.45.443 > 10.0.2.15.48090: Flags [P.], seq 218887:224383, ack 803, win 65535, length 5496
19:36:44.333528 IP 13.224.212.45.443 > 10.0.2.15.48090: Flags [P.], seq 224383:227131, ack 803, win 65535, length 2748
19:36:44.333538 IP 10.0.2.15.48090 > 13.224.212.45.443: Flags [.], ack 224383, win 65535, length 0
19:36:44.333682 IP 10.0.2.15.48090 > 13.224.212.45.443: Flags [.], ack 227131, win 65535, length 0
19:36:44.335508 IP 13.224.212.45.443 > 10.0.2.15.48090: Flags [P.], seq 227131:239497, ack 803, win 65535, length 12366
19:36:44.335535 IP 10.0.2.15.48090 > 13.224.212.45.443: Flags [.], ack 239497, win 65535, length 0
19:36:44.335601 IP 13.224.212.45.443 > 10.0.2.15.48090: Flags [P.], seq 239497:244993, ack 803, win 65535, length 5496
19:36:44.335611 IP 10.0.2.15.48090 > 13.224.212.45.443: Flags [.], ack 244993, win 65535, length 0
19:36:44.336669 IP 13.224.212.45.443 > 10.0.2.15.48090: Flags [P.], seq 244993:249115, ack 803, win 65535, length 4122
19:36:44.336674 IP 13.224.212.45.443 > 10.0.2.15.48090: Flags [P.], seq 249115:257359, ack 803, win 65535, length 8244
19:36:44.336698 IP 10.0.2.15.48090 > 13.224.212.45.443: Flags [.], ack 249115, win 65535, length 0
19:36:44.336741 IP 10.0.2.15.48090 > 13.224.212.45.443: Flags [.], ack 257359, win 65535, length 0
19:36:44.337057 IP 13.224.212.45.443 > 10.0.2.15.48090: Flags [P.], seq 257359:262855, ack 803, win 65535, length 5496
19:36:44.337074 IP 10.0.2.15.48090 > 13.224.212.45.443: Flags [.], ack 262855, win 65535, length 0
19:36:44.339630 IP 13.224.212.45.443 > 10.0.2.15.48090: Flags [P.], seq 262855:280717, ack 803, win 65535, length 17862
19:36:44.339650 IP 10.0.2.15.48090 > 13.224.212.45.443: Flags [.], ack 280717, win 65535, length 0
19:36:44.339745 IP 13.224.212.45.443 > 10.0.2.15.48090: Flags [P.], seq 280717:295831, ack 803, win 65535, length 15114
19:36:44.339882 IP 10.0.2.15.48090 > 13.224.212.45.443: Flags [.], ack 295831, win 65535, length 0
19:36:44.339958 IP 13.224.212.45.443 > 10.0.2.15.48090: Flags [P.], seq 295831:301327, ack 803, win 65535, length 5496
19:36:44.339968 IP 10.0.2.15.48090 > 13.224.212.45.443: Flags [.], ack 301327, win 65535, length 0
19:36:44.340457 IP 13.224.212.45.443 > 10.0.2.15.48090: Flags [P.], seq 301327:306823, ack 803, win 65535, length 5496
19:36:44.340460 IP 13.224.212.45.443 > 10.0.2.15.48090: Flags [P.], seq 306823:309571, ack 803, win 65535, length 2748
19:36:44.340476 IP 10.0.2.15.48090 > 13.224.212.45.443: Flags [.], ack 306823, win 65535, length 0
19:36:44.340592 IP 10.0.2.15.48090 > 13.224.212.45.443: Flags [.], ack 309571, win 65535, length 0
19:36:44.340720 IP 13.224.212.45.443 > 10.0.2.15.48090: Flags [P.], seq 309571:312319, ack 803, win 65535, length 2748
19:36:44.340721 IP 13.224.212.45.443 > 10.0.2.15.48090: Flags [P.], seq 312319:316441, ack 803, win 65535, length 4122
19:36:44.340732 IP 10.0.2.15.48090 > 13.224.212.45.443: Flags [.], ack 312319, win 65535, length 0
19:36:44.340745 IP 10.0.2.15.48090 > 13.224.212.45.443: Flags [.], ack 316441, win 65535, length 0
19:36:44.341190 IP 13.224.212.45.443 > 10.0.2.15.48090: Flags [P.], seq 316441:319189, ack 803, win 65535, length 2748
19:36:44.341192 IP 13.224.212.45.443 > 10.0.2.15.48090: Flags [P.], seq 319189:321937, ack 803, win 65535, length 2748
19:36:44.341192 IP 13.224.212.45.443 > 10.0.2.15.48090: Flags [P.], seq 321937:324685, ack 803, win 65535, length 2748
19:36:44.341204 IP 10.0.2.15.48090 > 13.224.212.45.443: Flags [.], ack 319189, win 65535, length 0
19:36:44.341223 IP 10.0.2.15.48090 > 13.224.212.45.443: Flags [.], ack 321937, win 65535, length 0
19:36:44.341236 IP 10.0.2.15.48090 > 13.224.212.45.443: Flags [.], ack 324685, win 65535, length 0
19:36:44.341967 IP 13.224.212.45.443 > 10.0.2.15.48090: Flags [P.], seq 324685:331555, ack 803, win 65535, length 6870
19:36:44.341985 IP 10.0.2.15.48090 > 13.224.212.45.443: Flags [.], ack 331555, win 65535, length 0
19:36:44.342189 IP 13.224.212.45.443 > 10.0.2.15.48090: Flags [P.], seq 331555:335677, ack 803, win 65535, length 4122
19:36:44.342191 IP 13.224.212.45.443 > 10.0.2.15.48090: Flags [P.], seq 335677:338425, ack 803, win 65535, length 2748
19:36:44.342207 IP 10.0.2.15.48090 > 13.224.212.45.443: Flags [.], ack 335677, win 65535, length 0
19:36:44.342227 IP 10.0.2.15.48090 > 13.224.212.45.443: Flags [.], ack 338425, win 65535, length 0
19:36:44.342462 IP 13.224.212.45.443 > 10.0.2.15.48090: Flags [P.], seq 338425:339799, ack 803, win 65535, length 1374
19:36:44.342464 IP 13.224.212.45.443 > 10.0.2.15.48090: Flags [P.], seq 339799:343921, ack 803, win 65535, length 4122
19:36:44.342552 IP 10.0.2.15.48090 > 13.224.212.45.443: Flags [.], ack 339799, win 65535, length 0
19:36:44.342571 IP 10.0.2.15.48090 > 13.224.212.45.443: Flags [.], ack 343921, win 65535, length 0
19:36:44.342711 IP 13.224.212.45.443 > 10.0.2.15.48090: Flags [P.], seq 343921:346669, ack 803, win 65535, length 2748
19:36:44.342712 IP 13.224.212.45.443 > 10.0.2.15.48090: Flags [P.], seq 346669:348043, ack 803, win 65535, length 1374
19:36:44.342719 IP 10.0.2.15.48090 > 13.224.212.45.443: Flags [.], ack 346669, win 65535, length 0
19:36:44.342730 IP 10.0.2.15.48090 > 13.224.212.45.443: Flags [.], ack 348043, win 65535, length 0
19:36:44.343106 IP 13.224.212.45.443 > 10.0.2.15.48090: Flags [P.], seq 348043:352165, ack 803, win 65535, length 4122
19:36:44.343120 IP 10.0.2.15.48090 > 13.224.212.45.443: Flags [.], ack 352165, win 65535, length 0
19:36:44.343271 IP 13.224.212.45.443 > 10.0.2.15.48090: Flags [P.], seq 352165:357661, ack 803, win 65535, length 5496
19:36:44.343282 IP 10.0.2.15.48090 > 13.224.212.45.443: Flags [.], ack 357661, win 65535, length 0
19:36:44.343701 IP 13.224.212.45.443 > 10.0.2.15.48090: Flags [P.], seq 357661:363157, ack 803, win 65535, length 5496
19:36:44.343714 IP 10.0.2.15.48090 > 13.224.212.45.443: Flags [.], ack 363157, win 65535, length 0
19:36:44.345220 IP 13.224.212.45.443 > 10.0.2.15.48090: Flags [P.], seq 363157:370027, ack 803, win 65535, length 6870
19:36:44.345222 IP 13.224.212.45.443 > 10.0.2.15.48090: Flags [P.], seq 370027:374149, ack 803, win 65535, length 4122
19:36:44.345268 IP 10.0.2.15.48090 > 13.224.212.45.443: Flags [.], ack 370027, win 65535, length 0
19:36:44.345329 IP 10.0.2.15.48090 > 13.224.212.45.443: Flags [.], ack 374149, win 65535, length 0
19:36:44.345350 IP 13.224.212.45.443 > 10.0.2.15.48090: Flags [P.], seq 374149:375523, ack 803, win 65535, length 1374
19:36:44.345354 IP 10.0.2.15.48090 > 13.224.212.45.443: Flags [.], ack 375523, win 65535, length 0
19:36:44.345692 IP 13.224.212.45.443 > 10.0.2.15.48090: Flags [P.], seq 375523:379645, ack 803, win 65535, length 4122
19:36:44.345694 IP 13.224.212.45.443 > 10.0.2.15.48090: Flags [P.], seq 379645:382393, ack 803, win 65535, length 2748
19:36:44.345694 IP 13.224.212.45.443 > 10.0.2.15.48090: Flags [P.], seq 382393:385141, ack 803, win 65535, length 2748
19:36:44.345739 IP 10.0.2.15.48090 > 13.224.212.45.443: Flags [.], ack 379645, win 65535, length 0
19:36:44.345754 IP 10.0.2.15.48090 > 13.224.212.45.443: Flags [.], ack 382393, win 65535, length 0
19:36:44.345922 IP 10.0.2.15.48090 > 13.224.212.45.443: Flags [.], ack 385141, win 65535, length 0
19:36:44.346270 IP 13.224.212.45.443 > 10.0.2.15.48090: Flags [P.], seq 385141:387889, ack 803, win 65535, length 2748
19:36:44.346272 IP 13.224.212.45.443 > 10.0.2.15.48090: Flags [P.], seq 387889:390637, ack 803, win 65535, length 2748
19:36:44.346282 IP 10.0.2.15.48090 > 13.224.212.45.443: Flags [.], ack 387889, win 65535, length 0
19:36:44.346296 IP 10.0.2.15.48090 > 13.224.212.45.443: Flags [.], ack 390637, win 65535, length 0
19:36:44.347080 IP 13.224.212.45.443 > 10.0.2.15.48090: Flags [P.], seq 390637:397507, ack 803, win 65535, length 6870
19:36:44.347096 IP 10.0.2.15.48090 > 13.224.212.45.443: Flags [.], ack 397507, win 65535, length 0
19:36:44.347493 IP 13.224.212.45.443 > 10.0.2.15.48090: Flags [P.], seq 397507:401629, ack 803, win 65535, length 4122
19:36:44.347495 IP 13.224.212.45.443 > 10.0.2.15.48090: Flags [P.], seq 401629:405751, ack 803, win 65535, length 4122
19:36:44.347496 IP 13.224.212.45.443 > 10.0.2.15.48090: Flags [P.], seq 405751:408499, ack 803, win 65535, length 2748
19:36:44.347512 IP 10.0.2.15.48090 > 13.224.212.45.443: Flags [.], ack 401629, win 65535, length 0
19:36:44.347534 IP 10.0.2.15.48090 > 13.224.212.45.443: Flags [.], ack 405751, win 65535, length 0
19:36:44.347547 IP 10.0.2.15.48090 > 13.224.212.45.443: Flags [.], ack 408499, win 65535, length 0
19:36:44.347563 IP 13.224.212.45.443 > 10.0.2.15.48090: Flags [P.], seq 408499:409873, ack 803, win 65535, length 1374
19:36:44.347568 IP 10.0.2.15.48090 > 13.224.212.45.443: Flags [.], ack 409873, win 65535, length 0
19:36:44.349029 IP 13.224.212.45.443 > 10.0.2.15.48090: Flags [P.], seq 409873:419491, ack 803, win 65535, length 9618
19:36:44.349032 IP 13.224.212.45.443 > 10.0.2.15.48090: Flags [P.], seq 419491:426361, ack 803, win 65535, length 6870
19:36:44.349054 IP 10.0.2.15.48090 > 13.224.212.45.443: Flags [.], ack 419491, win 65535, length 0
19:36:44.349087 IP 10.0.2.15.48090 > 13.224.212.45.443: Flags [.], ack 426361, win 65535, length 0
19:36:44.349165 IP 13.224.212.45.443 > 10.0.2.15.48090: Flags [P.], seq 426361:430483, ack 803, win 65535, length 4122
19:36:44.349166 IP 13.224.212.45.443 > 10.0.2.15.48090: Flags [P.], seq 430483:434605, ack 803, win 65535, length 4122
19:36:44.349176 IP 10.0.2.15.48090 > 13.224.212.45.443: Flags [.], ack 430483, win 65535, length 0
19:36:44.349188 IP 10.0.2.15.48090 > 13.224.212.45.443: Flags [.], ack 434605, win 65535, length 0
19:36:44.350042 IP 13.224.212.45.443 > 10.0.2.15.48090: Flags [P.], seq 434605:440101, ack 803, win 65535, length 5496
19:36:44.350059 IP 10.0.2.15.48090 > 13.224.212.45.443: Flags [.], ack 440101, win 65535, length 0
19:36:44.350394 IP 13.224.212.45.443 > 10.0.2.15.48090: Flags [P.], seq 440101:442849, ack 803, win 65535, length 2748
19:36:44.350397 IP 13.224.212.45.443 > 10.0.2.15.48090: Flags [P.], seq 442849:449719, ack 803, win 65535, length 6870
19:36:44.350411 IP 10.0.2.15.48090 > 13.224.212.45.443: Flags [.], ack 442849, win 65535, length 0
19:36:44.350428 IP 10.0.2.15.48090 > 13.224.212.45.443: Flags [.], ack 449719, win 65535, length 0
19:36:44.350541 IP 13.224.212.45.443 > 10.0.2.15.48090: Flags [P.], seq 449719:452467, ack 803, win 65535, length 2748
19:36:44.350547 IP 10.0.2.15.48090 > 13.224.212.45.443: Flags [.], ack 452467, win 65535, length 0
19:36:44.350673 IP 13.224.212.45.443 > 10.0.2.15.48090: Flags [P.], seq 452467:456589, ack 803, win 65535, length 4122
19:36:44.350681 IP 10.0.2.15.48090 > 13.224.212.45.443: Flags [.], ack 456589, win 65535, length 0
19:36:44.350933 IP 13.224.212.45.443 > 10.0.2.15.48090: Flags [P.], seq 456589:457963, ack 803, win 65535, length 1374
19:36:44.350935 IP 13.224.212.45.443 > 10.0.2.15.48090: Flags [P.], seq 457963:462085, ack 803, win 65535, length 4122
19:36:44.350935 IP 13.224.212.45.443 > 10.0.2.15.48090: Flags [.], seq 462085:463545, ack 803, win 65535, length 1460
19:36:44.350945 IP 10.0.2.15.48090 > 13.224.212.45.443: Flags [.], ack 457963, win 65535, length 0
19:36:44.350958 IP 10.0.2.15.48090 > 13.224.212.45.443: Flags [.], ack 462085, win 65535, length 0
19:36:44.351012 IP 10.0.2.15.48090 > 13.224.212.45.443: Flags [.], ack 463545, win 65535, length 0
19:36:44.351394 IP 13.224.212.45.443 > 10.0.2.15.48090: Flags [P.], seq 463545:464833, ack 803, win 65535, length 1288
19:36:44.351441 IP 10.0.2.15.48090 > 13.224.212.45.443: Flags [.], ack 464833, win 65535, length 0
19:36:44.352058 IP 13.224.212.45.443 > 10.0.2.15.48090: Flags [P.], seq 464833:468955, ack 803, win 65535, length 4122
19:36:44.352060 IP 13.224.212.45.443 > 10.0.2.15.48090: Flags [P.], seq 468955:474451, ack 803, win 65535, length 5496
19:36:44.352076 IP 10.0.2.15.48090 > 13.224.212.45.443: Flags [.], ack 468955, win 65535, length 0
19:36:44.352174 IP 10.0.2.15.48090 > 13.224.212.45.443: Flags [.], ack 474451, win 65535, length 0
19:36:44.352398 IP 13.224.212.45.443 > 10.0.2.15.48090: Flags [P.], seq 474451:481321, ack 803, win 65535, length 6870
19:36:44.352409 IP 10.0.2.15.48090 > 13.224.212.45.443: Flags [.], ack 481321, win 65535, length 0
19:36:44.352672 IP 13.224.212.45.443 > 10.0.2.15.48090: Flags [P.], seq 481321:485443, ack 803, win 65535, length 4122
19:36:44.352674 IP 13.224.212.45.443 > 10.0.2.15.48090: Flags [P.], seq 485443:486817, ack 803, win 65535, length 1374
19:36:44.352688 IP 10.0.2.15.48090 > 13.224.212.45.443: Flags [.], ack 485443, win 65535, length 0
19:36:44.352707 IP 10.0.2.15.48090 > 13.224.212.45.443: Flags [.], ack 486817, win 65535, length 0
19:36:44.352987 IP 13.224.212.45.443 > 10.0.2.15.48090: Flags [P.], seq 486817:492313, ack 803, win 65535, length 5496
19:36:44.352989 IP 13.224.212.45.443 > 10.0.2.15.48090: Flags [.], seq 492313:496693, ack 803, win 65535, length 4380
19:36:44.353001 IP 10.0.2.15.48090 > 13.224.212.45.443: Flags [.], ack 492313, win 65535, length 0
19:36:44.353051 IP 10.0.2.15.48090 > 13.224.212.45.443: Flags [.], ack 496693, win 65535, length 0
19:36:44.353177 IP 13.224.212.45.443 > 10.0.2.15.48090: Flags [P.], seq 496693:497809, ack 803, win 65535, length 1116
19:36:44.353179 IP 13.224.212.45.443 > 10.0.2.15.48090: Flags [P.], seq 497809:501931, ack 803, win 65535, length 4122
19:36:44.353187 IP 10.0.2.15.48090 > 13.224.212.45.443: Flags [.], ack 497809, win 65535, length 0
19:36:44.353242 IP 10.0.2.15.48090 > 13.224.212.45.443: Flags [.], ack 501931, win 65535, length 0
19:36:44.353359 IP 13.224.212.45.443 > 10.0.2.15.48090: Flags [P.], seq 501931:506053, ack 803, win 65535, length 4122
19:36:44.353366 IP 10.0.2.15.48090 > 13.224.212.45.443: Flags [.], ack 506053, win 65535, length 0
19:36:44.353662 IP 13.224.212.45.443 > 10.0.2.15.48090: Flags [P.], seq 506053:510175, ack 803, win 65535, length 4122
19:36:44.353671 IP 10.0.2.15.48090 > 13.224.212.45.443: Flags [.], ack 510175, win 65535, length 0
19:36:44.353862 IP 13.224.212.45.443 > 10.0.2.15.48090: Flags [P.], seq 510175:512923, ack 803, win 65535, length 2748
19:36:44.353863 IP 13.224.212.45.443 > 10.0.2.15.48090: Flags [P.], seq 512923:514297, ack 803, win 65535, length 1374
19:36:44.353874 IP 10.0.2.15.48090 > 13.224.212.45.443: Flags [.], ack 512923, win 65535, length 0
19:36:44.353885 IP 10.0.2.15.48090 > 13.224.212.45.443: Flags [.], ack 514297, win 65535, length 0
19:36:44.354798 IP 13.224.212.45.443 > 10.0.2.15.48090: Flags [P.], seq 514297:518419, ack 803, win 65535, length 4122
19:36:44.354800 IP 13.224.212.45.443 > 10.0.2.15.48090: Flags [.], seq 518419:521339, ack 803, win 65535, length 2920
19:36:44.354851 IP 10.0.2.15.48090 > 13.224.212.45.443: Flags [.], ack 518419, win 65535, length 0
19:36:44.354884 IP 10.0.2.15.48090 > 13.224.212.45.443: Flags [.], ack 521339, win 65535, length 0
19:36:44.355127 IP 13.224.212.45.443 > 10.0.2.15.48090: Flags [P.], seq 521339:523915, ack 803, win 65535, length 2576
19:36:44.355136 IP 13.224.212.45.443 > 10.0.2.15.48090: Flags [P.], seq 523915:528037, ack 803, win 65535, length 4122
19:36:44.355137 IP 13.224.212.45.443 > 10.0.2.15.48090: Flags [P.], seq 528037:533533, ack 803, win 65535, length 5496
19:36:44.355150 IP 10.0.2.15.48090 > 13.224.212.45.443: Flags [.], ack 523915, win 65535, length 0
19:36:44.355388 IP 10.0.2.15.48090 > 13.224.212.45.443: Flags [.], ack 528037, win 65535, length 0
19:36:44.355476 IP 10.0.2.15.48090 > 13.224.212.45.443: Flags [.], ack 533533, win 65535, length 0
19:36:44.355504 IP 13.224.212.45.443 > 10.0.2.15.48090: Flags [P.], seq 533533:536281, ack 803, win 65535, length 2748
19:36:44.355505 IP 13.224.212.45.443 > 10.0.2.15.48090: Flags [P.], seq 536281:539029, ack 803, win 65535, length 2748
19:36:44.355513 IP 10.0.2.15.48090 > 13.224.212.45.443: Flags [.], ack 536281, win 65535, length 0
19:36:44.355525 IP 10.0.2.15.48090 > 13.224.212.45.443: Flags [.], ack 539029, win 65535, length 0
19:36:44.355767 IP 13.224.212.45.443 > 10.0.2.15.48090: Flags [P.], seq 539029:541777, ack 803, win 65535, length 2748
19:36:44.355768 IP 13.224.212.45.443 > 10.0.2.15.48090: Flags [P.], seq 541777:544525, ack 803, win 65535, length 2748
19:36:44.355776 IP 10.0.2.15.48090 > 13.224.212.45.443: Flags [.], ack 541777, win 65535, length 0
19:36:44.355968 IP 10.0.2.15.48090 > 13.224.212.45.443: Flags [.], ack 544525, win 65535, length 0
19:36:44.356216 IP 13.224.212.45.443 > 10.0.2.15.48090: Flags [P.], seq 544525:547273, ack 803, win 65535, length 2748
19:36:44.356217 IP 13.224.212.45.443 > 10.0.2.15.48090: Flags [P.], seq 547273:550021, ack 803, win 65535, length 2748
19:36:44.356218 IP 13.224.212.45.443 > 10.0.2.15.48090: Flags [P.], seq 550021:554143, ack 803, win 65535, length 4122
19:36:44.356228 IP 10.0.2.15.48090 > 13.224.212.45.443: Flags [.], ack 547273, win 65535, length 0
19:36:44.356244 IP 10.0.2.15.48090 > 13.224.212.45.443: Flags [.], ack 550021, win 65535, length 0
19:36:44.356256 IP 10.0.2.15.48090 > 13.224.212.45.443: Flags [.], ack 554143, win 65535, length 0
19:36:44.357045 IP 13.224.212.45.443 > 10.0.2.15.48090: Flags [P.], seq 554143:559639, ack 803, win 65535, length 5496
19:36:44.357047 IP 13.224.212.45.443 > 10.0.2.15.48090: Flags [P.], seq 559639:561013, ack 803, win 65535, length 1374
19:36:44.357063 IP 10.0.2.15.48090 > 13.224.212.45.443: Flags [.], ack 559639, win 65535, length 0
19:36:44.357084 IP 10.0.2.15.48090 > 13.224.212.45.443: Flags [.], ack 561013, win 65535, length 0
19:36:44.357405 IP 13.224.212.45.443 > 10.0.2.15.48090: Flags [P.], seq 561013:565135, ack 803, win 65535, length 4122
19:36:44.357416 IP 10.0.2.15.48090 > 13.224.212.45.443: Flags [.], ack 565135, win 65535, length 0
19:36:44.358088 IP 13.224.212.45.443 > 10.0.2.15.48090: Flags [P.], seq 565135:567883, ack 803, win 65535, length 2748
19:36:44.358090 IP 13.224.212.45.443 > 10.0.2.15.48090: Flags [P.], seq 567883:570631, ack 803, win 65535, length 2748
19:36:44.358091 IP 13.224.212.45.443 > 10.0.2.15.48090: Flags [P.], seq 570631:576127, ack 803, win 65535, length 5496
19:36:44.358105 IP 10.0.2.15.48090 > 13.224.212.45.443: Flags [.], ack 567883, win 65535, length 0
19:36:44.358122 IP 10.0.2.15.48090 > 13.224.212.45.443: Flags [.], ack 570631, win 65535, length 0
19:36:44.358132 IP 10.0.2.15.48090 > 13.224.212.45.443: Flags [.], ack 576127, win 65535, length 0
19:36:44.358155 IP 13.224.212.45.443 > 10.0.2.15.48090: Flags [P.], seq 576127:580249, ack 803, win 65535, length 4122
19:36:44.358156 IP 13.224.212.45.443 > 10.0.2.15.48090: Flags [P.], seq 580249:582997, ack 803, win 65535, length 2748
19:36:44.358157 IP 13.224.212.45.443 > 10.0.2.15.48090: Flags [P.], seq 582997:585745, ack 803, win 65535, length 2748
19:36:44.358164 IP 10.0.2.15.48090 > 13.224.212.45.443: Flags [.], ack 580249, win 65535, length 0
19:36:44.358176 IP 10.0.2.15.48090 > 13.224.212.45.443: Flags [.], ack 582997, win 65535, length 0
19:36:44.358185 IP 10.0.2.15.48090 > 13.224.212.45.443: Flags [.], ack 585745, win 65535, length 0
19:36:44.358548 IP 13.224.212.45.443 > 10.0.2.15.48090: Flags [P.], seq 585745:588493, ack 803, win 65535, length 2748
19:36:44.358550 IP 13.224.212.45.443 > 10.0.2.15.48090: Flags [P.], seq 588493:591241, ack 803, win 65535, length 2748
19:36:44.358550 IP 13.224.212.45.443 > 10.0.2.15.48090: Flags [P.], seq 591241:593989, ack 803, win 65535, length 2748
19:36:44.358564 IP 10.0.2.15.48090 > 13.224.212.45.443: Flags [.], ack 588493, win 65535, length 0
19:36:44.358592 IP 10.0.2.15.48090 > 13.224.212.45.443: Flags [.], ack 591241, win 65535, length 0
19:36:44.358603 IP 10.0.2.15.48090 > 13.224.212.45.443: Flags [.], ack 593989, win 65535, length 0
19:36:44.359347 IP 13.224.212.45.443 > 10.0.2.15.48090: Flags [P.], seq 593989:598111, ack 803, win 65535, length 4122
19:36:44.359364 IP 10.0.2.15.48090 > 13.224.212.45.443: Flags [.], ack 598111, win 65535, length 0
19:36:44.359798 IP 13.224.212.45.443 > 10.0.2.15.48090: Flags [P.], seq 598111:602233, ack 803, win 65535, length 4122
19:36:44.359802 IP 13.224.212.45.443 > 10.0.2.15.48090: Flags [P.], seq 602233:606355, ack 803, win 65535, length 4122
19:36:44.359803 IP 13.224.212.45.443 > 10.0.2.15.48090: Flags [P.], seq 606355:609103, ack 803, win 65535, length 2748
19:36:44.359821 IP 10.0.2.15.48090 > 13.224.212.45.443: Flags [.], ack 602233, win 65535, length 0
19:36:44.359867 IP 10.0.2.15.48090 > 13.224.212.45.443: Flags [.], ack 606355, win 65535, length 0
19:36:44.359878 IP 10.0.2.15.48090 > 13.224.212.45.443: Flags [.], ack 609103, win 65535, length 0
19:36:44.359947 IP 13.224.212.45.443 > 10.0.2.15.48090: Flags [P.], seq 609103:611851, ack 803, win 65535, length 2748
19:36:44.359948 IP 13.224.212.45.443 > 10.0.2.15.48090: Flags [.], seq 611851:613311, ack 803, win 65535, length 1460
19:36:44.359961 IP 10.0.2.15.48090 > 13.224.212.45.443: Flags [.], ack 611851, win 65535, length 0
19:36:44.359977 IP 10.0.2.15.48090 > 13.224.212.45.443: Flags [.], ack 613311, win 65535, length 0
19:36:44.360301 IP 13.224.212.45.443 > 10.0.2.15.48090: Flags [P.], seq 613311:614599, ack 803, win 65535, length 1288
19:36:44.360303 IP 13.224.212.45.443 > 10.0.2.15.48090: Flags [P.], seq 614599:620095, ack 803, win 65535, length 5496
19:36:44.360536 IP 10.0.2.15.48090 > 13.224.212.45.443: Flags [.], ack 614599, win 65535, length 0
19:36:44.360724 IP 10.0.2.15.48090 > 13.224.212.45.443: Flags [.], ack 620095, win 65535, length 0
19:36:44.360829 IP 13.224.212.45.443 > 10.0.2.15.48090: Flags [P.], seq 620095:624217, ack 803, win 65535, length 4122
19:36:44.360830 IP 13.224.212.45.443 > 10.0.2.15.48090: Flags [P.], seq 624217:626965, ack 803, win 65535, length 2748
19:36:44.360831 IP 13.224.212.45.443 > 10.0.2.15.48090: Flags [P.], seq 626965:631087, ack 803, win 65535, length 4122
19:36:44.360841 IP 10.0.2.15.48090 > 13.224.212.45.443: Flags [.], ack 624217, win 65535, length 0
19:36:44.360853 IP 10.0.2.15.48090 > 13.224.212.45.443: Flags [.], ack 626965, win 65535, length 0
19:36:44.360864 IP 10.0.2.15.48090 > 13.224.212.45.443: Flags [.], ack 631087, win 65535, length 0
19:36:44.361714 IP 13.224.212.45.443 > 10.0.2.15.48090: Flags [P.], seq 631087:636583, ack 803, win 65535, length 5496
19:36:44.361773 IP 10.0.2.15.48090 > 13.224.212.45.443: Flags [.], ack 636583, win 65535, length 0
19:36:44.361873 IP 13.224.212.45.443 > 10.0.2.15.48090: Flags [P.], seq 636583:642079, ack 803, win 65535, length 5496
19:36:44.362145 IP 10.0.2.15.48090 > 13.224.212.45.443: Flags [.], ack 642079, win 65535, length 0
19:36:44.362372 IP 13.224.212.45.443 > 10.0.2.15.48090: Flags [P.], seq 642079:646201, ack 803, win 65535, length 4122
19:36:44.362374 IP 13.224.212.45.443 > 10.0.2.15.48090: Flags [P.], seq 646201:648949, ack 803, win 65535, length 2748
19:36:44.362375 IP 13.224.212.45.443 > 10.0.2.15.48090: Flags [P.], seq 648949:653071, ack 803, win 65535, length 4122
19:36:44.362391 IP 10.0.2.15.48090 > 13.224.212.45.443: Flags [.], ack 646201, win 65535, length 0
19:36:44.362410 IP 10.0.2.15.48090 > 13.224.212.45.443: Flags [.], ack 648949, win 65535, length 0
19:36:44.363114 IP 13.224.212.45.443 > 10.0.2.15.48090: Flags [P.], seq 653071:657193, ack 803, win 65535, length 4122
19:36:44.363116 IP 13.224.212.45.443 > 10.0.2.15.48090: Flags [P.], seq 657193:659941, ack 803, win 65535, length 2748
19:36:44.363117 IP 13.224.212.45.443 > 10.0.2.15.48090: Flags [P.], seq 659941:664063, ack 803, win 65535, length 4122
19:36:44.363149 IP 13.224.212.45.443 > 10.0.2.15.48090: Flags [P.], seq 664063:665437, ack 803, win 65535, length 1374
19:36:44.363150 IP 13.224.212.45.443 > 10.0.2.15.48090: Flags [P.], seq 665437:669559, ack 803, win 65535, length 4122
19:36:44.363150 IP 13.224.212.45.443 > 10.0.2.15.48090: Flags [P.], seq 669559:670933, ack 803, win 65535, length 1374
19:36:44.363187 IP 10.0.2.15.48090 > 13.224.212.45.443: Flags [.], ack 670933, win 65535, length 0
19:36:44.364025 IP 13.224.212.45.443 > 10.0.2.15.48090: Flags [P.], seq 670933:676429, ack 803, win 65535, length 5496
19:36:44.364041 IP 10.0.2.15.48090 > 13.224.212.45.443: Flags [.], ack 676429, win 65535, length 0
19:36:44.364365 IP 13.224.212.45.443 > 10.0.2.15.48090: Flags [P.], seq 676429:681925, ack 803, win 65535, length 5496
19:36:44.364368 IP 13.224.212.45.443 > 10.0.2.15.48090: Flags [P.], seq 681925:684673, ack 803, win 65535, length 2748
19:36:44.364383 IP 10.0.2.15.48090 > 13.224.212.45.443: Flags [.], ack 681925, win 65535, length 0
19:36:44.364493 IP 10.0.2.15.48090 > 13.224.212.45.443: Flags [.], ack 684673, win 65535, length 0
19:36:44.364643 IP 13.224.212.45.443 > 10.0.2.15.48090: Flags [P.], seq 684673:687421, ack 803, win 65535, length 2748
19:36:44.364645 IP 13.224.212.45.443 > 10.0.2.15.48090: Flags [P.], seq 687421:692917, ack 803, win 65535, length 5496
19:36:44.364704 IP 10.0.2.15.48090 > 13.224.212.45.443: Flags [.], ack 687421, win 65535, length 0
19:36:44.364726 IP 10.0.2.15.48090 > 13.224.212.45.443: Flags [.], ack 692917, win 65535, length 0
19:36:44.365321 IP 13.224.212.45.443 > 10.0.2.15.48090: Flags [P.], seq 692917:697039, ack 803, win 65535, length 4122
19:36:44.365323 IP 13.224.212.45.443 > 10.0.2.15.48090: Flags [P.], seq 697039:699787, ack 803, win 65535, length 2748
19:36:44.365323 IP 13.224.212.45.443 > 10.0.2.15.48090: Flags [P.], seq 699787:702535, ack 803, win 65535, length 2748
19:36:44.365324 IP 13.224.212.45.443 > 10.0.2.15.48090: Flags [P.], seq 702535:706657, ack 803, win 65535, length 4122
19:36:44.365343 IP 10.0.2.15.48090 > 13.224.212.45.443: Flags [.], ack 697039, win 65535, length 0
19:36:44.365409 IP 10.0.2.15.48090 > 13.224.212.45.443: Flags [.], ack 699787, win 65535, length 0
19:36:44.365423 IP 10.0.2.15.48090 > 13.224.212.45.443: Flags [.], ack 702535, win 65535, length 0
19:36:44.365433 IP 10.0.2.15.48090 > 13.224.212.45.443: Flags [.], ack 706657, win 65535, length 0
19:36:44.365459 IP 13.224.212.45.443 > 10.0.2.15.48090: Flags [P.], seq 706657:709405, ack 803, win 65535, length 2748
19:36:44.365463 IP 10.0.2.15.48090 > 13.224.212.45.443: Flags [.], ack 709405, win 65535, length 0
19:36:44.365741 IP 13.224.212.45.443 > 10.0.2.15.48090: Flags [P.], seq 709405:710779, ack 803, win 65535, length 1374
19:36:44.365873 IP 10.0.2.15.48090 > 13.224.212.45.443: Flags [.], ack 710779, win 65535, length 0
19:36:44.366451 IP 13.224.212.45.443 > 10.0.2.15.48090: Flags [P.], seq 710779:717649, ack 803, win 65535, length 6870
19:36:44.366465 IP 10.0.2.15.48090 > 13.224.212.45.443: Flags [.], ack 717649, win 65535, length 0
19:36:44.366785 IP 13.224.212.45.443 > 10.0.2.15.48090: Flags [P.], seq 717649:723145, ack 803, win 65535, length 5496
19:36:44.366787 IP 13.224.212.45.443 > 10.0.2.15.48090: Flags [P.], seq 723145:727267, ack 803, win 65535, length 4122
19:36:44.366801 IP 10.0.2.15.48090 > 13.224.212.45.443: Flags [.], ack 723145, win 65535, length 0
19:36:44.367131 IP 13.224.212.45.443 > 10.0.2.15.48090: Flags [P.], seq 727267:731389, ack 803, win 65535, length 4122
19:36:44.367132 IP 13.224.212.45.443 > 10.0.2.15.48090: Flags [P.], seq 731389:734137, ack 803, win 65535, length 2748
19:36:44.367133 IP 13.224.212.45.443 > 10.0.2.15.48090: Flags [P.], seq 734137:736885, ack 803, win 65535, length 2748
19:36:44.367245 IP 13.224.212.45.443 > 10.0.2.15.48090: Flags [P.], seq 736885:739633, ack 803, win 65535, length 2748
19:36:44.367330 IP 10.0.2.15.48090 > 13.224.212.45.443: Flags [.], ack 739633, win 65535, length 0
19:36:44.367397 IP 13.224.212.45.443 > 10.0.2.15.48090: Flags [P.], seq 739633:742381, ack 803, win 65535, length 2748
19:36:44.367541 IP 13.224.212.45.443 > 10.0.2.15.48090: Flags [P.], seq 742381:745129, ack 803, win 65535, length 2748
19:36:44.367915 IP 10.0.2.15.48090 > 13.224.212.45.443: Flags [.], ack 745129, win 65535, length 0
19:36:44.367945 IP 13.224.212.45.443 > 10.0.2.15.48090: Flags [P.], seq 745129:749251, ack 803, win 65535, length 4122
19:36:44.367946 IP 13.224.212.45.443 > 10.0.2.15.48090: Flags [P.], seq 749251:750625, ack 803, win 65535, length 1374
19:36:44.368109 IP 10.0.2.15.48090 > 13.224.212.45.443: Flags [.], ack 750625, win 65535, length 0
19:36:44.368792 IP 13.224.212.45.443 > 10.0.2.15.48090: Flags [P.], seq 750625:756121, ack 803, win 65535, length 5496
19:36:44.368794 IP 13.224.212.45.443 > 10.0.2.15.48090: Flags [P.], seq 756121:758869, ack 803, win 65535, length 2748
19:36:44.368954 IP 10.0.2.15.48090 > 13.224.212.45.443: Flags [.], ack 756121, win 65535, length 0
19:36:44.369328 IP 13.224.212.45.443 > 10.0.2.15.48090: Flags [P.], seq 758869:765739, ack 803, win 65535, length 6870

