19:33:30.015740 IP 10.0.2.15.50823 > 140.233.253.2.53: 31707+ A? www.espn.com. (30)
19:33:30.015787 IP 10.0.2.15.50823 > 140.233.253.2.53: 31964+ AAAA? www.espn.com. (30)
19:33:30.022124 IP 140.233.253.2.53 > 10.0.2.15.50823: 31964 8/0/0 AAAA 2600:9000:20ed:2e00:e:fe33:5580:93a1, AAAA 2600:9000:20ed:4800:e:fe33:5580:93a1, AAAA 2600:9000:20ed:1e00:e:fe33:5580:93a1, AAAA 2600:9000:20ed:ca00:e:fe33:5580:93a1, AAAA 2600:9000:20ed:5600:e:fe33:5580:93a1, AAAA 2600:9000:20ed:a800:e:fe33:5580:93a1, AAAA 2600:9000:20ed:6800:e:fe33:5580:93a1, AAAA 2600:9000:20ed:7400:e:fe33:5580:93a1 (254)
19:33:30.022125 IP 140.233.253.2.53 > 10.0.2.15.50823: 31707 4/0/0 A 13.224.212.47, A 13.224.212.128, A 13.224.212.80, A 13.224.212.45 (94)
19:33:30.022468 IP 10.0.2.15.54568 > 13.224.212.47.443: Flags [S], seq 3766296704, win 64240, options [mss 1460,sackOK,TS val 215258607 ecr 0,nop,wscale 6], length 0
19:33:30.037896 IP 13.224.212.47.443 > 10.0.2.15.54568: Flags [S.], seq 174144001, ack 3766296705, win 65535, options [mss 1460], length 0
19:33:30.037943 IP 10.0.2.15.54568 > 13.224.212.47.443: Flags [.], ack 1, win 64240, length 0
19:33:30.047016 IP 10.0.2.15.54568 > 13.224.212.47.443: Flags [P.], seq 1:518, ack 1, win 64240, length 517
19:33:30.047313 IP 13.224.212.47.443 > 10.0.2.15.54568: Flags [.], ack 518, win 65535, length 0
19:33:30.077898 IP 13.224.212.47.443 > 10.0.2.15.54568: Flags [.], seq 1:2921, ack 518, win 65535, length 2920
19:33:30.077920 IP 10.0.2.15.54568 > 13.224.212.47.443: Flags [.], ack 2921, win 62780, length 0
19:33:30.078120 IP 13.224.212.47.443 > 10.0.2.15.54568: Flags [P.], seq 2921:4123, ack 518, win 65535, length 1202
19:33:30.078132 IP 10.0.2.15.54568 > 13.224.212.47.443: Flags [.], ack 4123, win 61578, length 0
19:33:30.081864 IP 13.224.212.47.443 > 10.0.2.15.54568: Flags [P.], seq 4123:5824, ack 518, win 65535, length 1701
19:33:30.081886 IP 10.0.2.15.54568 > 13.224.212.47.443: Flags [.], ack 5824, win 62780, length 0
19:33:30.083455 IP 10.0.2.15.54568 > 13.224.212.47.443: Flags [P.], seq 518:582, ack 5824, win 62780, length 64
19:33:30.083717 IP 13.224.212.47.443 > 10.0.2.15.54568: Flags [.], ack 582, win 65535, length 0
19:33:30.083918 IP 10.0.2.15.54568 > 13.224.212.47.443: Flags [P.], seq 582:628, ack 5824, win 62780, length 46
19:33:30.083947 IP 10.0.2.15.54568 > 13.224.212.47.443: Flags [P.], seq 628:677, ack 5824, win 62780, length 49
19:33:30.084468 IP 13.224.212.47.443 > 10.0.2.15.54568: Flags [.], ack 628, win 65535, length 0
19:33:30.084487 IP 10.0.2.15.54568 > 13.224.212.47.443: Flags [P.], seq 677:772, ack 5824, win 62780, length 95
19:33:30.084716 IP 13.224.212.47.443 > 10.0.2.15.54568: Flags [.], ack 677, win 65535, length 0
19:33:30.084717 IP 13.224.212.47.443 > 10.0.2.15.54568: Flags [.], ack 772, win 65535, length 0
19:33:30.097671 IP 13.224.212.47.443 > 10.0.2.15.54568: Flags [P.], seq 5824:5886, ack 772, win 65535, length 62
19:33:30.097698 IP 10.0.2.15.54568 > 13.224.212.47.443: Flags [.], ack 5886, win 62780, length 0
19:33:30.098410 IP 10.0.2.15.54568 > 13.224.212.47.443: Flags [P.], seq 772:803, ack 5886, win 62780, length 31
19:33:30.099415 IP 13.224.212.47.443 > 10.0.2.15.54568: Flags [P.], seq 5886:5917, ack 772, win 65535, length 31
19:33:30.099418 IP 13.224.212.47.443 > 10.0.2.15.54568: Flags [.], ack 803, win 65535, length 0
19:33:30.099637 IP 10.0.2.15.54568 > 13.224.212.47.443: Flags [.], ack 5917, win 62780, length 0
19:33:30.111362 IP 13.224.212.47.443 > 10.0.2.15.54568: Flags [P.], seq 5917:14161, ack 803, win 65535, length 8244
19:33:30.111364 IP 13.224.212.47.443 > 10.0.2.15.54568: Flags [P.], seq 14161:15535, ack 803, win 65535, length 1374
19:33:30.111396 IP 10.0.2.15.54568 > 13.224.212.47.443: Flags [.], ack 14161, win 58400, length 0
19:33:30.111427 IP 10.0.2.15.54568 > 13.224.212.47.443: Flags [.], ack 15535, win 58400, length 0
19:33:30.112632 IP 13.224.212.47.443 > 10.0.2.15.54568: Flags [P.], seq 15535:19657, ack 803, win 65535, length 4122
19:33:30.113416 IP 13.224.212.47.443 > 10.0.2.15.54568: Flags [P.], seq 19657:25654, ack 803, win 65535, length 5997
19:33:30.113574 IP 10.0.2.15.54568 > 13.224.212.47.443: Flags [.], ack 19657, win 54278, length 0
19:33:30.113728 IP 13.224.212.47.443 > 10.0.2.15.54568: Flags [P.], seq 25654:28402, ack 803, win 65535, length 2748
19:33:30.113747 IP 10.0.2.15.54568 > 13.224.212.47.443: Flags [.], ack 25654, win 48281, length 0
19:33:30.113757 IP 10.0.2.15.54568 > 13.224.212.47.443: Flags [.], ack 28402, win 45533, length 0
19:33:30.113844 IP 13.224.212.47.443 > 10.0.2.15.54568: Flags [P.], seq 28402:29776, ack 803, win 65535, length 1374
19:33:30.113863 IP 10.0.2.15.54568 > 13.224.212.47.443: Flags [.], ack 29776, win 44159, length 0
19:33:30.114526 IP 13.224.212.47.443 > 10.0.2.15.54568: Flags [P.], seq 29776:35272, ack 803, win 65535, length 5496
19:33:30.114537 IP 10.0.2.15.54568 > 13.224.212.47.443: Flags [.], ack 35272, win 54020, length 0
19:33:30.115616 IP 13.224.212.47.443 > 10.0.2.15.54568: Flags [P.], seq 35272:40768, ack 803, win 65535, length 5496
19:33:30.115708 IP 10.0.2.15.54568 > 13.224.212.47.443: Flags [.], ack 40768, win 61320, length 0
19:33:30.116527 IP 13.224.212.47.443 > 10.0.2.15.54568: Flags [P.], seq 40768:46264, ack 803, win 65535, length 5496
19:33:30.116541 IP 10.0.2.15.54568 > 13.224.212.47.443: Flags [.], ack 46264, win 61320, length 0
19:33:30.116754 IP 13.224.212.47.443 > 10.0.2.15.54568: Flags [P.], seq 46264:47638, ack 803, win 65535, length 1374
19:33:30.116794 IP 10.0.2.15.54568 > 13.224.212.47.443: Flags [.], ack 47638, win 62780, length 0
19:33:30.118850 IP 13.224.212.47.443 > 10.0.2.15.54568: Flags [P.], seq 47638:49012, ack 803, win 65535, length 1374
19:33:30.125455 IP 13.224.212.47.443 > 10.0.2.15.54568: Flags [P.], seq 49012:53134, ack 803, win 65535, length 4122
19:33:30.125570 IP 10.0.2.15.54568 > 13.224.212.47.443: Flags [.], ack 53134, win 61320, length 0
19:33:30.126155 IP 13.224.212.47.443 > 10.0.2.15.54568: Flags [P.], seq 53134:58630, ack 803, win 65535, length 5496
19:33:30.126172 IP 10.0.2.15.54568 > 13.224.212.47.443: Flags [.], ack 58630, win 61320, length 0
19:33:30.126400 IP 13.224.212.47.443 > 10.0.2.15.54568: Flags [P.], seq 58630:61378, ack 803, win 65535, length 2748
19:33:30.126568 IP 10.0.2.15.54568 > 13.224.212.47.443: Flags [.], ack 61378, win 62780, length 0
19:33:30.126727 IP 13.224.212.47.443 > 10.0.2.15.54568: Flags [P.], seq 61378:64126, ack 803, win 65535, length 2748
19:33:30.126737 IP 10.0.2.15.54568 > 13.224.212.47.443: Flags [.], ack 64126, win 62780, length 0
19:33:30.127539 IP 13.224.212.47.443 > 10.0.2.15.54568: Flags [P.], seq 64126:69622, ack 803, win 65535, length 5496
19:33:30.127609 IP 10.0.2.15.54568 > 13.224.212.47.443: Flags [.], ack 69622, win 62780, length 0
19:33:30.128766 IP 13.224.212.47.443 > 10.0.2.15.54568: Flags [P.], seq 69622:79240, ack 803, win 65535, length 9618
19:33:30.128768 IP 13.224.212.47.443 > 10.0.2.15.54568: Flags [P.], seq 79240:80614, ack 803, win 65535, length 1374
19:33:30.128797 IP 10.0.2.15.54568 > 13.224.212.47.443: Flags [.], ack 79240, win 65535, length 0
19:33:30.128880 IP 10.0.2.15.54568 > 13.224.212.47.443: Flags [.], ack 80614, win 65535, length 0
19:33:30.130139 IP 13.224.212.47.443 > 10.0.2.15.54568: Flags [P.], seq 80614:86110, ack 803, win 65535, length 5496
19:33:30.130161 IP 10.0.2.15.54568 > 13.224.212.47.443: Flags [.], ack 86110, win 65535, length 0
19:33:30.130684 IP 13.224.212.47.443 > 10.0.2.15.54568: Flags [P.], seq 86110:90232, ack 803, win 65535, length 4122
19:33:30.130685 IP 13.224.212.47.443 > 10.0.2.15.54568: Flags [P.], seq 90232:91606, ack 803, win 65535, length 1374
19:33:30.130700 IP 10.0.2.15.54568 > 13.224.212.47.443: Flags [.], ack 90232, win 65535, length 0
19:33:30.130719 IP 10.0.2.15.54568 > 13.224.212.47.443: Flags [.], ack 91606, win 65535, length 0
19:33:30.132046 IP 13.224.212.47.443 > 10.0.2.15.54568: Flags [P.], seq 91606:98476, ack 803, win 65535, length 6870
19:33:30.132048 IP 13.224.212.47.443 > 10.0.2.15.54568: Flags [P.], seq 98476:102598, ack 803, win 65535, length 4122
19:33:30.132063 IP 10.0.2.15.54568 > 13.224.212.47.443: Flags [.], ack 98476, win 65535, length 0
19:33:30.132104 IP 10.0.2.15.54568 > 13.224.212.47.443: Flags [.], ack 102598, win 65535, length 0
19:33:30.132471 IP 13.224.212.47.443 > 10.0.2.15.54568: Flags [P.], seq 102598:108094, ack 803, win 65535, length 5496
19:33:30.132484 IP 10.0.2.15.54568 > 13.224.212.47.443: Flags [.], ack 108094, win 65535, length 0
19:33:30.133662 IP 13.224.212.47.443 > 10.0.2.15.54568: Flags [P.], seq 108094:113590, ack 803, win 65535, length 5496
19:33:30.133677 IP 10.0.2.15.54568 > 13.224.212.47.443: Flags [.], ack 113590, win 65535, length 0
19:33:30.134857 IP 13.224.212.47.443 > 10.0.2.15.54568: Flags [P.], seq 113590:123208, ack 803, win 65535, length 9618
19:33:30.134872 IP 10.0.2.15.54568 > 13.224.212.47.443: Flags [.], ack 123208, win 65535, length 0
19:33:30.135978 IP 13.224.212.47.443 > 10.0.2.15.54568: Flags [P.], seq 123208:124582, ack 803, win 65535, length 1374
19:33:30.136039 IP 10.0.2.15.54568 > 13.224.212.47.443: Flags [.], ack 124582, win 65535, length 0
19:33:30.139335 IP 13.224.212.47.443 > 10.0.2.15.54568: Flags [P.], seq 124582:132826, ack 803, win 65535, length 8244
19:33:30.139350 IP 10.0.2.15.54568 > 13.224.212.47.443: Flags [.], ack 132826, win 65535, length 0
19:33:30.140511 IP 13.224.212.47.443 > 10.0.2.15.54568: Flags [P.], seq 132826:139696, ack 803, win 65535, length 6870
19:33:30.140513 IP 13.224.212.47.443 > 10.0.2.15.54568: Flags [P.], seq 139696:146566, ack 803, win 65535, length 6870
19:33:30.140533 IP 10.0.2.15.54568 > 13.224.212.47.443: Flags [.], ack 139696, win 65535, length 0
19:33:30.140581 IP 10.0.2.15.54568 > 13.224.212.47.443: Flags [.], ack 146566, win 65535, length 0
19:33:30.140822 IP 13.224.212.47.443 > 10.0.2.15.54568: Flags [P.], seq 146566:147940, ack 803, win 65535, length 1374
19:33:30.140858 IP 10.0.2.15.54568 > 13.224.212.47.443: Flags [.], ack 147940, win 65535, length 0
19:33:30.141684 IP 13.224.212.47.443 > 10.0.2.15.54568: Flags [P.], seq 147940:153436, ack 803, win 65535, length 5496
19:33:30.141686 IP 13.224.212.47.443 > 10.0.2.15.54568: Flags [P.], seq 153436:156184, ack 803, win 65535, length 2748
19:33:30.141706 IP 10.0.2.15.54568 > 13.224.212.47.443: Flags [.], ack 153436, win 65535, length 0
19:33:30.141740 IP 10.0.2.15.54568 > 13.224.212.47.443: Flags [.], ack 156184, win 65535, length 0
19:33:30.141874 IP 13.224.212.47.443 > 10.0.2.15.54568: Flags [P.], seq 156184:157558, ack 803, win 65535, length 1374
19:33:30.141880 IP 10.0.2.15.54568 > 13.224.212.47.443: Flags [.], ack 157558, win 65535, length 0
19:33:30.142953 IP 13.224.212.47.443 > 10.0.2.15.54568: Flags [P.], seq 157558:164428, ack 803, win 65535, length 6870
19:33:30.142971 IP 10.0.2.15.54568 > 13.224.212.47.443: Flags [.], ack 164428, win 65535, length 0
19:33:30.143935 IP 13.224.212.47.443 > 10.0.2.15.54568: Flags [P.], seq 164428:171298, ack 803, win 65535, length 6870
19:33:30.143938 IP 13.224.212.47.443 > 10.0.2.15.54568: Flags [P.], seq 171298:176794, ack 803, win 65535, length 5496
19:33:30.143958 IP 10.0.2.15.54568 > 13.224.212.47.443: Flags [.], ack 171298, win 65535, length 0
19:33:30.143987 IP 10.0.2.15.54568 > 13.224.212.47.443: Flags [.], ack 176794, win 65535, length 0
19:33:30.145010 IP 13.224.212.47.443 > 10.0.2.15.54568: Flags [P.], seq 176794:183664, ack 803, win 65535, length 6870
19:33:30.145104 IP 10.0.2.15.54568 > 13.224.212.47.443: Flags [.], ack 183664, win 65535, length 0
19:33:30.145302 IP 13.224.212.47.443 > 10.0.2.15.54568: Flags [P.], seq 183664:187786, ack 803, win 65535, length 4122
19:33:30.145323 IP 10.0.2.15.54568 > 13.224.212.47.443: Flags [.], ack 187786, win 65535, length 0
19:33:30.145545 IP 13.224.212.47.443 > 10.0.2.15.54568: Flags [P.], seq 187786:191908, ack 803, win 65535, length 4122
19:33:30.145546 IP 13.224.212.47.443 > 10.0.2.15.54568: Flags [P.], seq 191908:196030, ack 803, win 65535, length 4122
19:33:30.145557 IP 10.0.2.15.54568 > 13.224.212.47.443: Flags [.], ack 191908, win 65535, length 0
19:33:30.145569 IP 10.0.2.15.54568 > 13.224.212.47.443: Flags [.], ack 196030, win 65535, length 0
19:33:30.146469 IP 13.224.212.47.443 > 10.0.2.15.54568: Flags [P.], seq 196030:204274, ack 803, win 65535, length 8244
19:33:30.146484 IP 10.0.2.15.54568 > 13.224.212.47.443: Flags [.], ack 204274, win 65535, length 0
19:33:30.147380 IP 13.224.212.47.443 > 10.0.2.15.54568: Flags [P.], seq 204274:213892, ack 803, win 65535, length 9618
19:33:30.147397 IP 10.0.2.15.54568 > 13.224.212.47.443: Flags [.], ack 213892, win 65535, length 0
19:33:30.147579 IP 13.224.212.47.443 > 10.0.2.15.54568: Flags [P.], seq 213892:215266, ack 803, win 65535, length 1374
19:33:30.147587 IP 10.0.2.15.54568 > 13.224.212.47.443: Flags [.], ack 215266, win 65535, length 0
19:33:30.148472 IP 13.224.212.47.443 > 10.0.2.15.54568: Flags [P.], seq 215266:223510, ack 803, win 65535, length 8244
19:33:30.148487 IP 10.0.2.15.54568 > 13.224.212.47.443: Flags [.], ack 223510, win 65535, length 0
19:33:30.149891 IP 13.224.212.47.443 > 10.0.2.15.54568: Flags [P.], seq 223510:234502, ack 803, win 65535, length 10992
19:33:30.149907 IP 10.0.2.15.54568 > 13.224.212.47.443: Flags [.], ack 234502, win 65535, length 0
19:33:30.149948 IP 13.224.212.47.443 > 10.0.2.15.54568: Flags [P.], seq 234502:241372, ack 803, win 65535, length 6870
19:33:30.149952 IP 10.0.2.15.54568 > 13.224.212.47.443: Flags [.], ack 241372, win 65535, length 0
19:33:30.151171 IP 13.224.212.47.443 > 10.0.2.15.54568: Flags [P.], seq 241372:248242, ack 803, win 65535, length 6870
19:33:30.151173 IP 13.224.212.47.443 > 10.0.2.15.54568: Flags [P.], seq 248242:250990, ack 803, win 65535, length 2748
19:33:30.151190 IP 10.0.2.15.54568 > 13.224.212.47.443: Flags [.], ack 248242, win 65535, length 0
19:33:30.151216 IP 10.0.2.15.54568 > 13.224.212.47.443: Flags [.], ack 250990, win 65535, length 0
19:33:30.151561 IP 13.224.212.47.443 > 10.0.2.15.54568: Flags [P.], seq 250990:259234, ack 803, win 65535, length 8244
19:33:30.151573 IP 10.0.2.15.54568 > 13.224.212.47.443: Flags [.], ack 259234, win 65535, length 0
19:33:30.151823 IP 13.224.212.47.443 > 10.0.2.15.54568: Flags [P.], seq 259234:261982, ack 803, win 65535, length 2748
19:33:30.151832 IP 10.0.2.15.54568 > 13.224.212.47.443: Flags [.], ack 261982, win 65535, length 0
19:33:30.153061 IP 13.224.212.47.443 > 10.0.2.15.54568: Flags [P.], seq 261982:268852, ack 803, win 65535, length 6870
19:33:30.153080 IP 10.0.2.15.54568 > 13.224.212.47.443: Flags [.], ack 268852, win 65535, length 0
19:33:30.153320 IP 13.224.212.47.443 > 10.0.2.15.54568: Flags [P.], seq 268852:272974, ack 803, win 65535, length 4122
19:33:30.153322 IP 13.224.212.47.443 > 10.0.2.15.54568: Flags [P.], seq 272974:275722, ack 803, win 65535, length 2748
19:33:30.153323 IP 13.224.212.47.443 > 10.0.2.15.54568: Flags [P.], seq 275722:278470, ack 803, win 65535, length 2748
19:33:30.153337 IP 10.0.2.15.54568 > 13.224.212.47.443: Flags [.], ack 272974, win 65535, length 0
19:33:30.153357 IP 10.0.2.15.54568 > 13.224.212.47.443: Flags [.], ack 275722, win 65535, length 0
19:33:30.153369 IP 10.0.2.15.54568 > 13.224.212.47.443: Flags [.], ack 278470, win 65535, length 0
19:33:30.153476 IP 13.224.212.47.443 > 10.0.2.15.54568: Flags [P.], seq 278470:279844, ack 803, win 65535, length 1374
19:33:30.153481 IP 10.0.2.15.54568 > 13.224.212.47.443: Flags [.], ack 279844, win 65535, length 0
19:33:30.154300 IP 13.224.212.47.443 > 10.0.2.15.54568: Flags [P.], seq 279844:286714, ack 803, win 65535, length 6870
19:33:30.154302 IP 13.224.212.47.443 > 10.0.2.15.54568: Flags [.], seq 286714:288174, ack 803, win 65535, length 1460
19:33:30.154320 IP 10.0.2.15.54568 > 13.224.212.47.443: Flags [.], ack 286714, win 65535, length 0
19:33:30.154342 IP 10.0.2.15.54568 > 13.224.212.47.443: Flags [.], ack 288174, win 65535, length 0
19:33:30.155599 IP 13.224.212.47.443 > 10.0.2.15.54568: Flags [P.], seq 288174:290836, ack 803, win 65535, length 2662
19:33:30.155601 IP 13.224.212.47.443 > 10.0.2.15.54568: Flags [P.], seq 290836:293584, ack 803, win 65535, length 2748
19:33:30.155602 IP 13.224.212.47.443 > 10.0.2.15.54568: Flags [P.], seq 293584:299080, ack 803, win 65535, length 5496
19:33:30.155641 IP 10.0.2.15.54568 > 13.224.212.47.443: Flags [.], ack 290836, win 65535, length 0
19:33:30.155668 IP 10.0.2.15.54568 > 13.224.212.47.443: Flags [.], ack 293584, win 65535, length 0
19:33:30.155684 IP 10.0.2.15.54568 > 13.224.212.47.443: Flags [.], ack 299080, win 65535, length 0
19:33:30.155868 IP 13.224.212.47.443 > 10.0.2.15.54568: Flags [P.], seq 299080:301828, ack 803, win 65535, length 2748
19:33:30.155869 IP 13.224.212.47.443 > 10.0.2.15.54568: Flags [P.], seq 301828:303202, ack 803, win 65535, length 1374
19:33:30.155870 IP 13.224.212.47.443 > 10.0.2.15.54568: Flags [P.], seq 303202:307324, ack 803, win 65535, length 4122
19:33:30.155880 IP 10.0.2.15.54568 > 13.224.212.47.443: Flags [.], ack 301828, win 65535, length 0
19:33:30.155924 IP 10.0.2.15.54568 > 13.224.212.47.443: Flags [.], ack 303202, win 65535, length 0
19:33:30.155939 IP 10.0.2.15.54568 > 13.224.212.47.443: Flags [.], ack 307324, win 65535, length 0
19:33:30.156074 IP 13.224.212.47.443 > 10.0.2.15.54568: Flags [P.], seq 307324:312820, ack 803, win 65535, length 5496
19:33:30.156080 IP 10.0.2.15.54568 > 13.224.212.47.443: Flags [.], ack 312820, win 65535, length 0
19:33:30.156568 IP 13.224.212.47.443 > 10.0.2.15.54568: Flags [P.], seq 312820:319690, ack 803, win 65535, length 6870
19:33:30.156569 IP 13.224.212.47.443 > 10.0.2.15.54568: Flags [P.], seq 319690:323812, ack 803, win 65535, length 4122
19:33:30.156580 IP 10.0.2.15.54568 > 13.224.212.47.443: Flags [.], ack 319690, win 65535, length 0
19:33:30.156594 IP 10.0.2.15.54568 > 13.224.212.47.443: Flags [.], ack 323812, win 65535, length 0
19:33:30.157447 IP 13.224.212.47.443 > 10.0.2.15.54568: Flags [P.], seq 323812:330682, ack 803, win 65535, length 6870
19:33:30.157451 IP 13.224.212.47.443 > 10.0.2.15.54568: Flags [P.], seq 330682:336178, ack 803, win 65535, length 5496
19:33:30.157471 IP 10.0.2.15.54568 > 13.224.212.47.443: Flags [.], ack 330682, win 65535, length 0
19:33:30.157508 IP 10.0.2.15.54568 > 13.224.212.47.443: Flags [.], ack 336178, win 65535, length 0
19:33:30.157649 IP 13.224.212.47.443 > 10.0.2.15.54568: Flags [P.], seq 336178:338926, ack 803, win 65535, length 2748
19:33:30.157662 IP 10.0.2.15.54568 > 13.224.212.47.443: Flags [.], ack 338926, win 65535, length 0
19:33:30.158184 IP 13.224.212.47.443 > 10.0.2.15.54568: Flags [P.], seq 338926:341674, ack 803, win 65535, length 2748
19:33:30.158188 IP 13.224.212.47.443 > 10.0.2.15.54568: Flags [P.], seq 341674:347170, ack 803, win 65535, length 5496
19:33:30.158209 IP 10.0.2.15.54568 > 13.224.212.47.443: Flags [.], ack 341674, win 65535, length 0
19:33:30.158236 IP 10.0.2.15.54568 > 13.224.212.47.443: Flags [.], ack 347170, win 65535, length 0
19:33:30.158437 IP 13.224.212.47.443 > 10.0.2.15.54568: Flags [P.], seq 347170:349918, ack 803, win 65535, length 2748
19:33:30.158452 IP 10.0.2.15.54568 > 13.224.212.47.443: Flags [.], ack 349918, win 65535, length 0
19:33:30.159250 IP 13.224.212.47.443 > 10.0.2.15.54568: Flags [P.], seq 349918:354040, ack 803, win 65535, length 4122
19:33:30.159253 IP 13.224.212.47.443 > 10.0.2.15.54568: Flags [P.], seq 354040:359536, ack 803, win 65535, length 5496
19:33:30.159254 IP 13.224.212.47.443 > 10.0.2.15.54568: Flags [.], seq 359536:365376, ack 803, win 65535, length 5840
19:33:30.159295 IP 10.0.2.15.54568 > 13.224.212.47.443: Flags [.], ack 354040, win 65535, length 0
19:33:30.159325 IP 10.0.2.15.54568 > 13.224.212.47.443: Flags [.], ack 359536, win 65535, length 0
19:33:30.159339 IP 10.0.2.15.54568 > 13.224.212.47.443: Flags [.], ack 365376, win 65535, length 0
19:33:30.159495 IP 13.224.212.47.443 > 10.0.2.15.54568: Flags [P.], seq 365376:366406, ack 803, win 65535, length 1030
19:33:30.159505 IP 10.0.2.15.54568 > 13.224.212.47.443: Flags [.], ack 366406, win 65535, length 0
19:33:30.159753 IP 13.224.212.47.443 > 10.0.2.15.54568: Flags [P.], seq 366406:370528, ack 803, win 65535, length 4122
19:33:30.159761 IP 10.0.2.15.54568 > 13.224.212.47.443: Flags [.], ack 370528, win 65535, length 0
19:33:30.162083 IP 13.224.212.47.443 > 10.0.2.15.54568: Flags [P.], seq 370528:382894, ack 803, win 65535, length 12366
19:33:30.162178 IP 10.0.2.15.54568 > 13.224.212.47.443: Flags [.], ack 382894, win 65535, length 0
19:33:30.162248 IP 13.224.212.47.443 > 10.0.2.15.54568: Flags [P.], seq 382894:385642, ack 803, win 65535, length 2748
19:33:30.162250 IP 13.224.212.47.443 > 10.0.2.15.54568: Flags [P.], seq 385642:388390, ack 803, win 65535, length 2748
19:33:30.162264 IP 10.0.2.15.54568 > 13.224.212.47.443: Flags [.], ack 385642, win 65535, length 0
19:33:30.162284 IP 10.0.2.15.54568 > 13.224.212.47.443: Flags [.], ack 388390, win 65535, length 0
19:33:30.163043 IP 13.224.212.47.443 > 10.0.2.15.54568: Flags [P.], seq 388390:395260, ack 803, win 65535, length 6870
19:33:30.163044 IP 13.224.212.47.443 > 10.0.2.15.54568: Flags [P.], seq 395260:396634, ack 803, win 65535, length 1374
19:33:30.163060 IP 10.0.2.15.54568 > 13.224.212.47.443: Flags [.], ack 395260, win 65535, length 0
19:33:30.163085 IP 10.0.2.15.54568 > 13.224.212.47.443: Flags [.], ack 396634, win 65535, length 0
19:33:30.163284 IP 13.224.212.47.443 > 10.0.2.15.54568: Flags [P.], seq 396634:403504, ack 803, win 65535, length 6870
19:33:30.163331 IP 10.0.2.15.54568 > 13.224.212.47.443: Flags [.], ack 403504, win 65535, length 0
19:33:30.163485 IP 13.224.212.47.443 > 10.0.2.15.54568: Flags [P.], seq 403504:407626, ack 803, win 65535, length 4122
19:33:30.163486 IP 13.224.212.47.443 > 10.0.2.15.54568: Flags [P.], seq 407626:409000, ack 803, win 65535, length 1374
19:33:30.163499 IP 10.0.2.15.54568 > 13.224.212.47.443: Flags [.], ack 407626, win 65535, length 0
19:33:30.163515 IP 10.0.2.15.54568 > 13.224.212.47.443: Flags [.], ack 409000, win 65535, length 0
19:33:30.163770 IP 13.224.212.47.443 > 10.0.2.15.54568: Flags [P.], seq 409000:413122, ack 803, win 65535, length 4122
19:33:30.163828 IP 10.0.2.15.54568 > 13.224.212.47.443: Flags [.], ack 413122, win 65535, length 0
19:33:30.163974 IP 13.224.212.47.443 > 10.0.2.15.54568: Flags [P.], seq 413122:418618, ack 803, win 65535, length 5496
19:33:30.163982 IP 10.0.2.15.54568 > 13.224.212.47.443: Flags [.], ack 418618, win 65535, length 0
19:33:30.164099 IP 13.224.212.47.443 > 10.0.2.15.54568: Flags [P.], seq 418618:422740, ack 803, win 65535, length 4122
19:33:30.164106 IP 10.0.2.15.54568 > 13.224.212.47.443: Flags [.], ack 422740, win 65535, length 0
19:33:30.164367 IP 13.224.212.47.443 > 10.0.2.15.54568: Flags [P.], seq 422740:425488, ack 803, win 65535, length 2748
19:33:30.164379 IP 10.0.2.15.54568 > 13.224.212.47.443: Flags [.], ack 425488, win 65535, length 0
19:33:30.164733 IP 13.224.212.47.443 > 10.0.2.15.54568: Flags [P.], seq 425488:429610, ack 803, win 65535, length 4122
19:33:30.164735 IP 13.224.212.47.443 > 10.0.2.15.54568: Flags [P.], seq 429610:432358, ack 803, win 65535, length 2748
19:33:30.164736 IP 13.224.212.47.443 > 10.0.2.15.54568: Flags [P.], seq 432358:435106, ack 803, win 65535, length 2748
19:33:30.164757 IP 10.0.2.15.54568 > 13.224.212.47.443: Flags [.], ack 429610, win 65535, length 0
19:33:30.164783 IP 10.0.2.15.54568 > 13.224.212.47.443: Flags [.], ack 432358, win 65535, length 0
19:33:30.164794 IP 10.0.2.15.54568 > 13.224.212.47.443: Flags [.], ack 435106, win 65535, length 0
19:33:30.165530 IP 13.224.212.47.443 > 10.0.2.15.54568: Flags [P.], seq 435106:441976, ack 803, win 65535, length 6870
19:33:30.165544 IP 10.0.2.15.54568 > 13.224.212.47.443: Flags [.], ack 441976, win 65535, length 0
19:33:30.165784 IP 13.224.212.47.443 > 10.0.2.15.54568: Flags [P.], seq 441976:446098, ack 803, win 65535, length 4122
19:33:30.165795 IP 10.0.2.15.54568 > 13.224.212.47.443: Flags [.], ack 446098, win 65535, length 0
19:33:30.165916 IP 13.224.212.47.443 > 10.0.2.15.54568: Flags [P.], seq 446098:451594, ack 803, win 65535, length 5496
19:33:30.165924 IP 10.0.2.15.54568 > 13.224.212.47.443: Flags [.], ack 451594, win 65535, length 0
19:33:30.166206 IP 13.224.212.47.443 > 10.0.2.15.54568: Flags [P.], seq 451594:454342, ack 803, win 65535, length 2748
19:33:30.166208 IP 13.224.212.47.443 > 10.0.2.15.54568: Flags [P.], seq 454342:458464, ack 803, win 65535, length 4122
19:33:30.166261 IP 10.0.2.15.54568 > 13.224.212.47.443: Flags [.], ack 454342, win 65535, length 0
19:33:30.166324 IP 10.0.2.15.54568 > 13.224.212.47.443: Flags [.], ack 458464, win 65535, length 0
19:33:30.166647 IP 13.224.212.47.443 > 10.0.2.15.54568: Flags [P.], seq 458464:461212, ack 803, win 65535, length 2748
19:33:30.166648 IP 13.224.212.47.443 > 10.0.2.15.54568: Flags [P.], seq 461212:462586, ack 803, win 65535, length 1374
19:33:30.166661 IP 10.0.2.15.54568 > 13.224.212.47.443: Flags [.], ack 461212, win 65535, length 0
19:33:30.166681 IP 10.0.2.15.54568 > 13.224.212.47.443: Flags [.], ack 462586, win 65535, length 0
19:33:30.167281 IP 13.224.212.47.443 > 10.0.2.15.54568: Flags [P.], seq 462586:469456, ack 803, win 65535, length 6870
19:33:30.167298 IP 10.0.2.15.54568 > 13.224.212.47.443: Flags [.], ack 469456, win 65535, length 0
19:33:30.167647 IP 13.224.212.47.443 > 10.0.2.15.54568: Flags [P.], seq 469456:473578, ack 803, win 65535, length 4122
19:33:30.167650 IP 13.224.212.47.443 > 10.0.2.15.54568: Flags [P.], seq 473578:476326, ack 803, win 65535, length 2748
19:33:30.167650 IP 13.224.212.47.443 > 10.0.2.15.54568: Flags [P.], seq 476326:479074, ack 803, win 65535, length 2748
19:33:30.167667 IP 10.0.2.15.54568 > 13.224.212.47.443: Flags [.], ack 473578, win 65535, length 0
19:33:30.167689 IP 10.0.2.15.54568 > 13.224.212.47.443: Flags [.], ack 476326, win 65535, length 0
19:33:30.167756 IP 10.0.2.15.54568 > 13.224.212.47.443: Flags [.], ack 479074, win 65535, length 0
19:33:30.167975 IP 13.224.212.47.443 > 10.0.2.15.54568: Flags [P.], seq 479074:481822, ack 803, win 65535, length 2748
19:33:30.167977 IP 13.224.212.47.443 > 10.0.2.15.54568: Flags [P.], seq 481822:485944, ack 803, win 65535, length 4122
19:33:30.167992 IP 10.0.2.15.54568 > 13.224.212.47.443: Flags [.], ack 481822, win 65535, length 0
19:33:30.168012 IP 10.0.2.15.54568 > 13.224.212.47.443: Flags [.], ack 485944, win 65535, length 0
19:33:30.168293 IP 13.224.212.47.443 > 10.0.2.15.54568: Flags [P.], seq 485944:488692, ack 803, win 65535, length 2748
19:33:30.168295 IP 13.224.212.47.443 > 10.0.2.15.54568: Flags [P.], seq 488692:491440, ack 803, win 65535, length 2748
19:33:30.168309 IP 10.0.2.15.54568 > 13.224.212.47.443: Flags [.], ack 488692, win 65535, length 0
19:33:30.168326 IP 10.0.2.15.54568 > 13.224.212.47.443: Flags [.], ack 491440, win 65535, length 0
19:33:30.168482 IP 13.224.212.47.443 > 10.0.2.15.54568: Flags [P.], seq 491440:495562, ack 803, win 65535, length 4122
19:33:30.168490 IP 10.0.2.15.54568 > 13.224.212.47.443: Flags [.], ack 495562, win 65535, length 0
19:33:30.168738 IP 13.224.212.47.443 > 10.0.2.15.54568: Flags [P.], seq 495562:501058, ack 803, win 65535, length 5496
19:33:30.168739 IP 13.224.212.47.443 > 10.0.2.15.54568: Flags [P.], seq 501058:502432, ack 803, win 65535, length 1374
19:33:30.168748 IP 10.0.2.15.54568 > 13.224.212.47.443: Flags [.], ack 501058, win 65535, length 0
19:33:30.168761 IP 10.0.2.15.54568 > 13.224.212.47.443: Flags [.], ack 502432, win 65535, length 0
19:33:30.169636 IP 13.224.212.47.443 > 10.0.2.15.54568: Flags [P.], seq 502432:509302, ack 803, win 65535, length 6870
19:33:30.169638 IP 13.224.212.47.443 > 10.0.2.15.54568: Flags [.], seq 509302:512222, ack 803, win 65535, length 2920
19:33:30.169947 IP 13.224.212.47.443 > 10.0.2.15.54568: Flags [P.], seq 512222:513424, ack 803, win 65535, length 1202
19:33:30.169949 IP 13.224.212.47.443 > 10.0.2.15.54568: Flags [P.], seq 513424:516172, ack 803, win 65535, length 2748
19:33:30.169949 IP 13.224.212.47.443 > 10.0.2.15.54568: Flags [P.], seq 516172:520294, ack 803, win 65535, length 4122
19:33:30.170073 IP 13.224.212.47.443 > 10.0.2.15.54568: Flags [P.], seq 520294:523042, ack 803, win 65535, length 2748
19:33:30.170581 IP 13.224.212.47.443 > 10.0.2.15.54568: Flags [P.], seq 523042:525790, ack 803, win 65535, length 2748
19:33:30.170584 IP 13.224.212.47.443 > 10.0.2.15.54568: Flags [P.], seq 525790:528538, ack 803, win 65535, length 2748
19:33:30.170584 IP 13.224.212.47.443 > 10.0.2.15.54568: Flags [P.], seq 528538:531286, ack 803, win 65535, length 2748
19:33:30.170794 IP 13.224.212.47.443 > 10.0.2.15.54568: Flags [P.], seq 531286:536782, ack 803, win 65535, length 5496
19:33:30.171112 IP 10.0.2.15.54568 > 13.224.212.47.443: Flags [.], ack 525790, win 65535, length 0
19:33:30.171368 IP 13.224.212.47.443 > 10.0.2.15.54568: Flags [P.], seq 536782:542278, ack 803, win 65535, length 5496
19:33:30.171792 IP 13.224.212.47.443 > 10.0.2.15.54568: Flags [P.], seq 542278:546400, ack 803, win 65535, length 4122
19:33:30.171794 IP 13.224.212.47.443 > 10.0.2.15.54568: Flags [P.], seq 546400:549148, ack 803, win 65535, length 2748
19:33:30.171973 IP 13.224.212.47.443 > 10.0.2.15.54568: Flags [P.], seq 549148:553270, ack 803, win 65535, length 4122
19:33:30.172435 IP 13.224.212.47.443 > 10.0.2.15.54568: Flags [P.], seq 553270:556018, ack 803, win 65535, length 2748
19:33:30.172437 IP 13.224.212.47.443 > 10.0.2.15.54568: Flags [P.], seq 556018:558766, ack 803, win 65535, length 2748
19:33:30.172829 IP 10.0.2.15.54568 > 13.224.212.47.443: Flags [.], ack 536782, win 65535, length 0
19:33:30.172861 IP 10.0.2.15.54568 > 13.224.212.47.443: Flags [.], ack 558766, win 65535, length 0
19:33:30.173429 IP 13.224.212.47.443 > 10.0.2.15.54568: Flags [P.], seq 558766:575254, ack 803, win 65535, length 16488
19:33:30.173460 IP 13.224.212.47.443 > 10.0.2.15.54568: Flags [P.], seq 575254:580750, ack 803, win 65535, length 5496
19:33:30.173495 IP 10.0.2.15.54568 > 13.224.212.47.443: Flags [.], ack 580750, win 65535, length 0
19:33:30.173707 IP 13.224.212.47.443 > 10.0.2.15.54568: Flags [P.], seq 580750:583498, ack 803, win 65535, length 2748
19:33:30.173722 IP 10.0.2.15.54568 > 13.224.212.47.443: Flags [.], ack 583498, win 65535, length 0
19:33:30.173993 IP 13.224.212.47.443 > 10.0.2.15.54568: Flags [P.], seq 583498:587620, ack 803, win 65535, length 4122
19:33:30.173995 IP 13.224.212.47.443 > 10.0.2.15.54568: Flags [P.], seq 587620:590368, ack 803, win 65535, length 2748
19:33:30.173996 IP 13.224.212.47.443 > 10.0.2.15.54568: Flags [P.], seq 590368:593116, ack 803, win 65535, length 2748
19:33:30.174011 IP 10.0.2.15.54568 > 13.224.212.47.443: Flags [.], ack 587620, win 65535, length 0
19:33:30.174112 IP 10.0.2.15.54568 > 13.224.212.47.443: Flags [.], ack 590368, win 65535, length 0
19:33:30.174135 IP 10.0.2.15.54568 > 13.224.212.47.443: Flags [.], ack 593116, win 65535, length 0
19:33:30.174506 IP 13.224.212.47.443 > 10.0.2.15.54568: Flags [P.], seq 593116:597238, ack 803, win 65535, length 4122
19:33:30.174509 IP 13.224.212.47.443 > 10.0.2.15.54568: Flags [P.], seq 597238:599986, ack 803, win 65535, length 2748
19:33:30.174526 IP 10.0.2.15.54568 > 13.224.212.47.443: Flags [.], ack 597238, win 65535, length 0
19:33:30.174642 IP 10.0.2.15.54568 > 13.224.212.47.443: Flags [.], ack 599986, win 65535, length 0
19:33:30.174826 IP 13.224.212.47.443 > 10.0.2.15.54568: Flags [P.], seq 599986:605482, ack 803, win 65535, length 5496
19:33:30.174834 IP 10.0.2.15.54568 > 13.224.212.47.443: Flags [.], ack 605482, win 65535, length 0
19:33:30.175441 IP 13.224.212.47.443 > 10.0.2.15.54568: Flags [P.], seq 605482:609604, ack 803, win 65535, length 4122
19:33:30.175454 IP 10.0.2.15.54568 > 13.224.212.47.443: Flags [.], ack 609604, win 65535, length 0
19:33:30.175808 IP 13.224.212.47.443 > 10.0.2.15.54568: Flags [P.], seq 609604:613726, ack 803, win 65535, length 4122
19:33:30.175809 IP 13.224.212.47.443 > 10.0.2.15.54568: Flags [P.], seq 613726:615100, ack 803, win 65535, length 1374
19:33:30.175809 IP 13.224.212.47.443 > 10.0.2.15.54568: Flags [P.], seq 615100:619222, ack 803, win 65535, length 4122
19:33:30.175810 IP 13.224.212.47.443 > 10.0.2.15.54568: Flags [P.], seq 619222:620596, ack 803, win 65535, length 1374
19:33:30.175821 IP 10.0.2.15.54568 > 13.224.212.47.443: Flags [.], ack 613726, win 65535, length 0
19:33:30.175838 IP 10.0.2.15.54568 > 13.224.212.47.443: Flags [.], ack 615100, win 65535, length 0
19:33:30.175850 IP 10.0.2.15.54568 > 13.224.212.47.443: Flags [.], ack 619222, win 65535, length 0
19:33:30.175861 IP 10.0.2.15.54568 > 13.224.212.47.443: Flags [.], ack 620596, win 65535, length 0
19:33:30.176010 IP 13.224.212.47.443 > 10.0.2.15.54568: Flags [P.], seq 620596:624718, ack 803, win 65535, length 4122
19:33:30.176020 IP 10.0.2.15.54568 > 13.224.212.47.443: Flags [.], ack 624718, win 65535, length 0
19:33:30.176155 IP 13.224.212.47.443 > 10.0.2.15.54568: Flags [P.], seq 624718:630214, ack 803, win 65535, length 5496
19:33:30.176163 IP 10.0.2.15.54568 > 13.224.212.47.443: Flags [.], ack 630214, win 65535, length 0
19:33:30.176333 IP 13.224.212.47.443 > 10.0.2.15.54568: Flags [P.], seq 630214:632962, ack 803, win 65535, length 2748
19:33:30.176342 IP 10.0.2.15.54568 > 13.224.212.47.443: Flags [.], ack 632962, win 65535, length 0
19:33:30.176525 IP 13.224.212.47.443 > 10.0.2.15.54568: Flags [P.], seq 632962:635710, ack 803, win 65535, length 2748
19:33:30.176526 IP 13.224.212.47.443 > 10.0.2.15.54568: Flags [P.], seq 635710:637084, ack 803, win 65535, length 1374
19:33:30.176566 IP 10.0.2.15.54568 > 13.224.212.47.443: Flags [.], ack 635710, win 65535, length 0
19:33:30.176613 IP 10.0.2.15.54568 > 13.224.212.47.443: Flags [.], ack 637084, win 65535, length 0
19:33:30.176916 IP 13.224.212.47.443 > 10.0.2.15.54568: Flags [P.], seq 637084:641206, ack 803, win 65535, length 4122
19:33:30.176917 IP 13.224.212.47.443 > 10.0.2.15.54568: Flags [P.], seq 641206:643954, ack 803, win 65535, length 2748
19:33:30.176918 IP 13.224.212.47.443 > 10.0.2.15.54568: Flags [P.], seq 643954:645328, ack 803, win 65535, length 1374
19:33:30.176928 IP 10.0.2.15.54568 > 13.224.212.47.443: Flags [.], ack 641206, win 65535, length 0
19:33:30.176984 IP 10.0.2.15.54568 > 13.224.212.47.443: Flags [.], ack 643954, win 65535, length 0
19:33:30.176995 IP 10.0.2.15.54568 > 13.224.212.47.443: Flags [.], ack 645328, win 65535, length 0
19:33:30.177409 IP 13.224.212.47.443 > 10.0.2.15.54568: Flags [P.], seq 645328:649450, ack 803, win 65535, length 4122
19:33:30.177504 IP 10.0.2.15.54568 > 13.224.212.47.443: Flags [.], ack 649450, win 65535, length 0
19:33:30.177715 IP 13.224.212.47.443 > 10.0.2.15.54568: Flags [P.], seq 649450:652198, ack 803, win 65535, length 2748
19:33:30.177717 IP 13.224.212.47.443 > 10.0.2.15.54568: Flags [P.], seq 652198:657694, ack 803, win 65535, length 5496
19:33:30.177739 IP 10.0.2.15.54568 > 13.224.212.47.443: Flags [.], ack 657694, win 65535, length 0
19:33:30.178644 IP 13.224.212.47.443 > 10.0.2.15.54568: Flags [P.], seq 657694:661816, ack 803, win 65535, length 4122
19:33:30.178645 IP 13.224.212.47.443 > 10.0.2.15.54568: Flags [.], seq 661816:663276, ack 803, win 65535, length 1460
19:33:30.178660 IP 10.0.2.15.54568 > 13.224.212.47.443: Flags [.], ack 661816, win 65535, length 0
19:33:30.178687 IP 10.0.2.15.54568 > 13.224.212.47.443: Flags [.], ack 663276, win 65535, length 0
19:33:30.178817 IP 13.224.212.47.443 > 10.0.2.15.54568: Flags [P.], seq 663276:667312, ack 803, win 65535, length 4036
19:33:30.178823 IP 10.0.2.15.54568 > 13.224.212.47.443: Flags [.], ack 667312, win 65535, length 0
19:33:30.178948 IP 13.224.212.47.443 > 10.0.2.15.54568: Flags [P.], seq 667312:671434, ack 803, win 65535, length 4122
19:33:30.178955 IP 10.0.2.15.54568 > 13.224.212.47.443: Flags [.], ack 671434, win 65535, length 0
19:33:30.179323 IP 13.224.212.47.443 > 10.0.2.15.54568: Flags [P.], seq 671434:674182, ack 803, win 65535, length 2748
19:33:30.179327 IP 13.224.212.47.443 > 10.0.2.15.54568: Flags [.], seq 674182:678562, ack 803, win 65535, length 4380
19:33:30.179386 IP 10.0.2.15.54568 > 13.224.212.47.443: Flags [.], ack 674182, win 65535, length 0
19:33:30.179409 IP 10.0.2.15.54568 > 13.224.212.47.443: Flags [.], ack 678562, win 65535, length 0
19:33:30.179702 IP 13.224.212.47.443 > 10.0.2.15.54568: Flags [P.], seq 678562:679678, ack 803, win 65535, length 1116
19:33:30.179704 IP 13.224.212.47.443 > 10.0.2.15.54568: Flags [P.], seq 679678:683800, ack 803, win 65535, length 4122
19:33:30.179704 IP 13.224.212.47.443 > 10.0.2.15.54568: Flags [P.], seq 683800:686548, ack 803, win 65535, length 2748
19:33:30.179705 IP 13.224.212.47.443 > 10.0.2.15.54568: Flags [P.], seq 686548:687922, ack 803, win 65535, length 1374
19:33:30.179717 IP 10.0.2.15.54568 > 13.224.212.47.443: Flags [.], ack 679678, win 65535, length 0
19:33:30.179767 IP 10.0.2.15.54568 > 13.224.212.47.443: Flags [.], ack 683800, win 65535, length 0
19:33:30.179783 IP 10.0.2.15.54568 > 13.224.212.47.443: Flags [.], ack 686548, win 65535, length 0
19:33:30.179795 IP 10.0.2.15.54568 > 13.224.212.47.443: Flags [.], ack 687922, win 65535, length 0
19:33:30.180075 IP 13.224.212.47.443 > 10.0.2.15.54568: Flags [P.], seq 687922:692044, ack 803, win 65535, length 4122
19:33:30.180077 IP 13.224.212.47.443 > 10.0.2.15.54568: Flags [P.], seq 692044:697540, ack 803, win 65535, length 5496
19:33:30.180087 IP 10.0.2.15.54568 > 13.224.212.47.443: Flags [.], ack 692044, win 65535, length 0
19:33:30.180102 IP 10.0.2.15.54568 > 13.224.212.47.443: Flags [.], ack 697540, win 65535, length 0
19:33:30.181220 IP 13.224.212.47.443 > 10.0.2.15.54568: Flags [P.], seq 697540:705784, ack 803, win 65535, length 8244
19:33:30.181265 IP 10.0.2.15.54568 > 13.224.212.47.443: Flags [.], ack 705784, win 65535, length 0
19:33:30.181891 IP 13.224.212.47.443 > 10.0.2.15.54568: Flags [P.], seq 705784:714028, ack 803, win 65535, length 8244
19:33:30.181894 IP 13.224.212.47.443 > 10.0.2.15.54568: Flags [P.], seq 714028:719524, ack 803, win 65535, length 5496
19:33:30.181936 IP 10.0.2.15.54568 > 13.224.212.47.443: Flags [.], ack 714028, win 65535, length 0
19:33:30.181988 IP 10.0.2.15.54568 > 13.224.212.47.443: Flags [.], ack 719524, win 65535, length 0
19:33:30.182051 IP 13.224.212.47.443 > 10.0.2.15.54568: Flags [P.], seq 719524:723646, ack 803, win 65535, length 4122
19:33:30.182052 IP 13.224.212.47.443 > 10.0.2.15.54568: Flags [P.], seq 723646:726394, ack 803, win 65535, length 2748
19:33:30.182053 IP 13.224.212.47.443 > 10.0.2.15.54568: Flags [P.], seq 726394:729142, ack 803, win 65535, length 2748
19:33:30.182059 IP 10.0.2.15.54568 > 13.224.212.47.443: Flags [.], ack 723646, win 65535, length 0
19:33:30.182071 IP 10.0.2.15.54568 > 13.224.212.47.443: Flags [.], ack 726394, win 65535, length 0
19:33:30.182083 IP 10.0.2.15.54568 > 13.224.212.47.443: Flags [.], ack 729142, win 65535, length 0
19:33:30.182551 IP 13.224.212.47.443 > 10.0.2.15.54568: Flags [P.], seq 729142:734638, ack 803, win 65535, length 5496
19:33:30.182552 IP 13.224.212.47.443 > 10.0.2.15.54568: Flags [P.], seq 734638:737386, ack 803, win 65535, length 2748
19:33:30.182563 IP 10.0.2.15.54568 > 13.224.212.47.443: Flags [.], ack 734638, win 65535, length 0
19:33:30.182750 IP 10.0.2.15.54568 > 13.224.212.47.443: Flags [.], ack 737386, win 65535, length 0
19:33:30.183337 IP 13.224.212.47.443 > 10.0.2.15.54568: Flags [P.], seq 737386:741508, ack 803, win 65535, length 4122
19:33:30.183351 IP 10.0.2.15.54568 > 13.224.212.47.443: Flags [.], ack 741508, win 65535, length 0

