13:04:11.776291 IP 99.84.126.23.443 > 10.0.2.15.51078: Flags [.], seq 3968002:3970922, ack 3990515163, win 65535, length 2920
13:04:11.776314 IP 10.0.2.15.51078 > 99.84.126.23.443: Flags [.], ack 2920, win 62780, length 0
13:04:11.776945 IP 99.84.126.23.443 > 10.0.2.15.51078: Flags [P.], seq 2920:5496, ack 1, win 65535, length 2576
13:04:11.776970 IP 10.0.2.15.51078 > 99.84.126.23.443: Flags [.], ack 5496, win 61320, length 0
13:04:11.777169 IP 99.84.126.23.443 > 10.0.2.15.51078: Flags [P.], seq 5496:5823, ack 1, win 65535, length 327
13:04:11.777181 IP 10.0.2.15.51078 > 99.84.126.23.443: Flags [.], ack 5823, win 60993, length 0
13:04:11.778814 IP 10.0.2.15.51078 > 99.84.126.23.443: Flags [P.], seq 1:65, ack 5823, win 62780, length 64
13:04:11.779198 IP 99.84.126.23.443 > 10.0.2.15.51078: Flags [.], ack 65, win 65535, length 0
13:04:11.779338 IP 10.0.2.15.51078 > 99.84.126.23.443: Flags [P.], seq 65:111, ack 5823, win 62780, length 46
13:04:11.779377 IP 10.0.2.15.51078 > 99.84.126.23.443: Flags [P.], seq 111:160, ack 5823, win 62780, length 49
13:04:11.779581 IP 10.0.2.15.51078 > 99.84.126.23.443: Flags [P.], seq 160:195, ack 5823, win 62780, length 35
13:04:11.780160 IP 99.84.126.23.443 > 10.0.2.15.51078: Flags [.], ack 111, win 65535, length 0
13:04:11.780162 IP 99.84.126.23.443 > 10.0.2.15.51078: Flags [.], ack 160, win 65535, length 0
13:04:11.780162 IP 99.84.126.23.443 > 10.0.2.15.51078: Flags [.], ack 195, win 65535, length 0
13:04:11.780248 IP 10.0.2.15.51078 > 99.84.126.23.443: Flags [P.], seq 195:255, ack 5823, win 62780, length 60
13:04:11.781797 IP 99.84.126.23.443 > 10.0.2.15.51078: Flags [.], ack 255, win 65535, length 0
13:04:11.792844 IP 99.84.126.23.443 > 10.0.2.15.51078: Flags [P.], seq 5823:5885, ack 255, win 65535, length 62
13:04:11.792866 IP 10.0.2.15.51078 > 99.84.126.23.443: Flags [.], ack 5885, win 62780, length 0
13:04:11.793716 IP 99.84.126.23.443 > 10.0.2.15.51078: Flags [P.], seq 5885:5916, ack 255, win 65535, length 31
13:04:11.793741 IP 10.0.2.15.51078 > 99.84.126.23.443: Flags [P.], seq 255:286, ack 5885, win 62780, length 31
13:04:11.793761 IP 10.0.2.15.51078 > 99.84.126.23.443: Flags [.], ack 5916, win 62780, length 0
13:04:11.794168 IP 99.84.126.23.443 > 10.0.2.15.51078: Flags [.], ack 286, win 65535, length 0
13:04:11.848768 IP 99.84.126.23.443 > 10.0.2.15.51078: Flags [P.], seq 5916:10038, ack 286, win 65535, length 4122
13:04:11.848800 IP 99.84.126.23.443 > 10.0.2.15.51078: Flags [P.], seq 10038:14160, ack 286, win 65535, length 4122
13:04:11.848801 IP 99.84.126.23.443 > 10.0.2.15.51078: Flags [.], seq 14160:15620, ack 286, win 65535, length 1460
13:04:11.848831 IP 10.0.2.15.51078 > 99.84.126.23.443: Flags [.], ack 10038, win 61320, length 0
13:04:11.849060 IP 10.0.2.15.51078 > 99.84.126.23.443: Flags [.], ack 14160, win 58400, length 0
13:04:11.849180 IP 10.0.2.15.51078 > 99.84.126.23.443: Flags [.], ack 15620, win 58400, length 0
13:04:11.849806 IP 99.84.126.23.443 > 10.0.2.15.51078: Flags [.], seq 15620:30220, ack 286, win 65535, length 14600
13:04:11.849859 IP 10.0.2.15.51078 > 99.84.126.23.443: Flags [.], ack 30220, win 48180, length 0
13:04:11.850523 IP 99.84.126.23.443 > 10.0.2.15.51078: Flags [P.], seq 30220:40266, ack 286, win 65535, length 10046
13:04:11.850541 IP 10.0.2.15.51078 > 99.84.126.23.443: Flags [.], ack 40266, win 40880, length 0
13:04:11.851448 IP 99.84.126.23.443 > 10.0.2.15.51078: Flags [P.], seq 40266:49294, ack 286, win 65535, length 9028
13:04:11.851465 IP 10.0.2.15.51078 > 99.84.126.23.443: Flags [.], ack 49294, win 58400, length 0
13:04:11.863165 IP 99.84.126.23.443 > 10.0.2.15.51078: Flags [P.], seq 49294:54790, ack 286, win 65535, length 5496
13:04:11.863206 IP 10.0.2.15.51078 > 99.84.126.23.443: Flags [.], ack 54790, win 61320, length 0
13:04:11.863926 IP 99.84.126.23.443 > 10.0.2.15.51078: Flags [P.], seq 54790:60286, ack 286, win 65535, length 5496
13:04:11.863928 IP 99.84.126.23.443 > 10.0.2.15.51078: Flags [P.], seq 60286:61660, ack 286, win 65535, length 1374
13:04:11.864127 IP 10.0.2.15.51078 > 99.84.126.23.443: Flags [.], ack 61660, win 55480, length 0
13:04:11.865682 IP 99.84.126.23.443 > 10.0.2.15.51078: Flags [P.], seq 61660:67156, ack 286, win 65535, length 5496
13:04:11.865701 IP 10.0.2.15.51078 > 99.84.126.23.443: Flags [.], ack 67156, win 61320, length 0
13:04:11.866562 IP 99.84.126.23.443 > 10.0.2.15.51078: Flags [P.], seq 67156:75400, ack 286, win 65535, length 8244
13:04:11.866566 IP 99.84.126.23.443 > 10.0.2.15.51078: Flags [.], seq 75400:79780, ack 286, win 65535, length 4380
13:04:11.866777 IP 99.84.126.23.443 > 10.0.2.15.51078: Flags [P.], seq 79780:80896, ack 286, win 65535, length 1116
13:04:11.866778 IP 99.84.126.23.443 > 10.0.2.15.51078: Flags [P.], seq 80896:83644, ack 286, win 65535, length 2748
13:04:11.866840 IP 10.0.2.15.51078 > 99.84.126.23.443: Flags [.], ack 83644, win 62780, length 0
13:04:11.867653 IP 99.84.126.23.443 > 10.0.2.15.51078: Flags [P.], seq 83644:89140, ack 286, win 65535, length 5496
13:04:11.867667 IP 10.0.2.15.51078 > 99.84.126.23.443: Flags [.], ack 89140, win 65535, length 0
13:04:11.870691 IP 99.84.126.23.443 > 10.0.2.15.51078: Flags [P.], seq 89140:98758, ack 286, win 65535, length 9618
13:04:11.870694 IP 99.84.126.23.443 > 10.0.2.15.51078: Flags [P.], seq 98758:101506, ack 286, win 65535, length 2748
13:04:11.870714 IP 10.0.2.15.51078 > 99.84.126.23.443: Flags [.], ack 98758, win 65535, length 0
13:04:11.870756 IP 10.0.2.15.51078 > 99.84.126.23.443: Flags [.], ack 101506, win 65535, length 0
13:04:11.870798 IP 99.84.126.23.443 > 10.0.2.15.51078: Flags [P.], seq 101506:107002, ack 286, win 65535, length 5496
13:04:11.870799 IP 99.84.126.23.443 > 10.0.2.15.51078: Flags [P.], seq 107002:109750, ack 286, win 65535, length 2748
13:04:11.870806 IP 10.0.2.15.51078 > 99.84.126.23.443: Flags [.], ack 107002, win 65535, length 0
13:04:11.870821 IP 10.0.2.15.51078 > 99.84.126.23.443: Flags [.], ack 109750, win 65535, length 0
13:04:11.872095 IP 99.84.126.23.443 > 10.0.2.15.51078: Flags [P.], seq 109750:116620, ack 286, win 65535, length 6870
13:04:11.872114 IP 10.0.2.15.51078 > 99.84.126.23.443: Flags [.], ack 116620, win 65535, length 0
13:04:11.872872 IP 99.84.126.23.443 > 10.0.2.15.51078: Flags [P.], seq 116620:117994, ack 286, win 65535, length 1374
13:04:11.872886 IP 10.0.2.15.51078 > 99.84.126.23.443: Flags [.], ack 117994, win 65535, length 0
13:04:11.873955 IP 99.84.126.23.443 > 10.0.2.15.51078: Flags [P.], seq 117994:119368, ack 286, win 65535, length 1374
13:04:11.873968 IP 10.0.2.15.51078 > 99.84.126.23.443: Flags [.], ack 119368, win 65535, length 0
13:04:11.875265 IP 99.84.126.23.443 > 10.0.2.15.51078: Flags [P.], seq 119368:126238, ack 286, win 65535, length 6870
13:04:11.875290 IP 10.0.2.15.51078 > 99.84.126.23.443: Flags [.], ack 126238, win 65535, length 0
13:04:11.876269 IP 99.84.126.23.443 > 10.0.2.15.51078: Flags [P.], seq 126238:134482, ack 286, win 65535, length 8244
13:04:11.876285 IP 10.0.2.15.51078 > 99.84.126.23.443: Flags [.], ack 134482, win 65535, length 0
13:04:11.877346 IP 99.84.126.23.443 > 10.0.2.15.51078: Flags [P.], seq 134482:139978, ack 286, win 65535, length 5496
13:04:11.877366 IP 10.0.2.15.51078 > 99.84.126.23.443: Flags [.], ack 139978, win 65535, length 0
13:04:11.877605 IP 99.84.126.23.443 > 10.0.2.15.51078: Flags [P.], seq 139978:142726, ack 286, win 65535, length 2748
13:04:11.877613 IP 10.0.2.15.51078 > 99.84.126.23.443: Flags [.], ack 142726, win 65535, length 0
13:04:11.878374 IP 99.84.126.23.443 > 10.0.2.15.51078: Flags [P.], seq 142726:144100, ack 286, win 65535, length 1374
13:04:11.878385 IP 10.0.2.15.51078 > 99.84.126.23.443: Flags [.], ack 144100, win 65535, length 0
13:04:11.879965 IP 99.84.126.23.443 > 10.0.2.15.51078: Flags [P.], seq 144100:163336, ack 286, win 65535, length 19236
13:04:11.880024 IP 10.0.2.15.51078 > 99.84.126.23.443: Flags [.], ack 163336, win 65535, length 0
13:04:11.880062 IP 99.84.126.23.443 > 10.0.2.15.51078: Flags [P.], seq 163336:166084, ack 286, win 65535, length 2748
13:04:11.880067 IP 10.0.2.15.51078 > 99.84.126.23.443: Flags [.], ack 166084, win 65535, length 0
13:04:11.881722 IP 99.84.126.23.443 > 10.0.2.15.51078: Flags [P.], seq 166084:175702, ack 286, win 65535, length 9618
13:04:11.881742 IP 10.0.2.15.51078 > 99.84.126.23.443: Flags [.], ack 175702, win 65535, length 0
13:04:11.882567 IP 99.84.126.23.443 > 10.0.2.15.51078: Flags [P.], seq 175702:182572, ack 286, win 65535, length 6870
13:04:11.882703 IP 10.0.2.15.51078 > 99.84.126.23.443: Flags [.], ack 182572, win 65535, length 0
13:04:11.882900 IP 99.84.126.23.443 > 10.0.2.15.51078: Flags [P.], seq 182572:189442, ack 286, win 65535, length 6870
13:04:11.882911 IP 10.0.2.15.51078 > 99.84.126.23.443: Flags [.], ack 189442, win 65535, length 0
13:04:11.883791 IP 99.84.126.23.443 > 10.0.2.15.51078: Flags [P.], seq 189442:190816, ack 286, win 65535, length 1374
13:04:11.883812 IP 10.0.2.15.51078 > 99.84.126.23.443: Flags [.], ack 190816, win 65535, length 0
13:04:11.885137 IP 99.84.126.23.443 > 10.0.2.15.51078: Flags [P.], seq 190816:210052, ack 286, win 65535, length 19236
13:04:11.885157 IP 10.0.2.15.51078 > 99.84.126.23.443: Flags [.], ack 210052, win 65535, length 0
13:04:11.886040 IP 99.84.126.23.443 > 10.0.2.15.51078: Flags [P.], seq 210052:216922, ack 286, win 65535, length 6870
13:04:11.886055 IP 10.0.2.15.51078 > 99.84.126.23.443: Flags [.], ack 216922, win 65535, length 0
13:04:11.887236 IP 99.84.126.23.443 > 10.0.2.15.51078: Flags [P.], seq 216922:225166, ack 286, win 65535, length 8244
13:04:11.887258 IP 10.0.2.15.51078 > 99.84.126.23.443: Flags [.], ack 225166, win 65535, length 0
13:04:11.888000 IP 99.84.126.23.443 > 10.0.2.15.51078: Flags [P.], seq 225166:233410, ack 286, win 65535, length 8244
13:04:11.888001 IP 99.84.126.23.443 > 10.0.2.15.51078: Flags [P.], seq 233410:234784, ack 286, win 65535, length 1374
13:04:11.888040 IP 10.0.2.15.51078 > 99.84.126.23.443: Flags [.], ack 233410, win 65535, length 0
13:04:11.888056 IP 10.0.2.15.51078 > 99.84.126.23.443: Flags [.], ack 234784, win 65535, length 0
13:04:11.889551 IP 99.84.126.23.443 > 10.0.2.15.51078: Flags [P.], seq 234784:245776, ack 286, win 65535, length 10992
13:04:11.889572 IP 10.0.2.15.51078 > 99.84.126.23.443: Flags [.], ack 245776, win 65535, length 0
13:04:11.889623 IP 99.84.126.23.443 > 10.0.2.15.51078: Flags [P.], seq 245776:249898, ack 286, win 65535, length 4122
13:04:11.889629 IP 10.0.2.15.51078 > 99.84.126.23.443: Flags [.], ack 249898, win 65535, length 0
13:04:11.890639 IP 99.84.126.23.443 > 10.0.2.15.51078: Flags [P.], seq 249898:256768, ack 286, win 65535, length 6870
13:04:11.890642 IP 99.84.126.23.443 > 10.0.2.15.51078: Flags [P.], seq 256768:260890, ack 286, win 65535, length 4122
13:04:11.890690 IP 10.0.2.15.51078 > 99.84.126.23.443: Flags [.], ack 256768, win 65535, length 0
13:04:11.890745 IP 10.0.2.15.51078 > 99.84.126.23.443: Flags [.], ack 260890, win 65535, length 0
13:04:11.891137 IP 99.84.126.23.443 > 10.0.2.15.51078: Flags [P.], seq 260890:265012, ack 286, win 65535, length 4122
13:04:11.891147 IP 10.0.2.15.51078 > 99.84.126.23.443: Flags [.], ack 265012, win 65535, length 0
13:04:11.891274 IP 99.84.126.23.443 > 10.0.2.15.51078: Flags [P.], seq 265012:266386, ack 286, win 65535, length 1374
13:04:11.891276 IP 99.84.126.23.443 > 10.0.2.15.51078: Flags [P.], seq 266386:270508, ack 286, win 65535, length 4122
13:04:11.891276 IP 99.84.126.23.443 > 10.0.2.15.51078: Flags [P.], seq 270508:273256, ack 286, win 65535, length 2748
13:04:11.891285 IP 10.0.2.15.51078 > 99.84.126.23.443: Flags [.], ack 266386, win 65535, length 0
13:04:11.891338 IP 10.0.2.15.51078 > 99.84.126.23.443: Flags [.], ack 270508, win 65535, length 0
13:04:11.891358 IP 10.0.2.15.51078 > 99.84.126.23.443: Flags [.], ack 273256, win 65535, length 0
13:04:11.892171 IP 99.84.126.23.443 > 10.0.2.15.51078: Flags [P.], seq 273256:278752, ack 286, win 65535, length 5496
13:04:11.892173 IP 99.84.126.23.443 > 10.0.2.15.51078: Flags [P.], seq 278752:282874, ack 286, win 65535, length 4122
13:04:11.892193 IP 10.0.2.15.51078 > 99.84.126.23.443: Flags [.], ack 278752, win 65535, length 0
13:04:11.892348 IP 10.0.2.15.51078 > 99.84.126.23.443: Flags [.], ack 282874, win 65535, length 0
13:04:11.892632 IP 99.84.126.23.443 > 10.0.2.15.51078: Flags [P.], seq 282874:286996, ack 286, win 65535, length 4122
13:04:11.892634 IP 99.84.126.23.443 > 10.0.2.15.51078: Flags [P.], seq 286996:291118, ack 286, win 65535, length 4122
13:04:11.892635 IP 99.84.126.23.443 > 10.0.2.15.51078: Flags [P.], seq 291118:295240, ack 286, win 65535, length 4122
13:04:11.892694 IP 10.0.2.15.51078 > 99.84.126.23.443: Flags [.], ack 286996, win 65535, length 0
13:04:11.892717 IP 10.0.2.15.51078 > 99.84.126.23.443: Flags [.], ack 291118, win 65535, length 0
13:04:11.892728 IP 10.0.2.15.51078 > 99.84.126.23.443: Flags [.], ack 295240, win 65535, length 0
13:04:11.892746 IP 99.84.126.23.443 > 10.0.2.15.51078: Flags [P.], seq 295240:296614, ack 286, win 65535, length 1374
13:04:11.892749 IP 10.0.2.15.51078 > 99.84.126.23.443: Flags [.], ack 296614, win 65535, length 0
13:04:11.895458 IP 99.84.126.23.443 > 10.0.2.15.51078: Flags [P.], seq 296614:325468, ack 286, win 65535, length 28854
13:04:11.895484 IP 10.0.2.15.51078 > 99.84.126.23.443: Flags [.], ack 325468, win 65535, length 0
13:04:11.895606 IP 99.84.126.23.443 > 10.0.2.15.51078: Flags [P.], seq 325468:332338, ack 286, win 65535, length 6870
13:04:11.895617 IP 10.0.2.15.51078 > 99.84.126.23.443: Flags [.], ack 332338, win 65535, length 0
13:04:11.895988 IP 99.84.126.23.443 > 10.0.2.15.51078: Flags [P.], seq 332338:337834, ack 286, win 65535, length 5496
13:04:11.895991 IP 99.84.126.23.443 > 10.0.2.15.51078: Flags [P.], seq 337834:340582, ack 286, win 65535, length 2748
13:04:11.896011 IP 10.0.2.15.51078 > 99.84.126.23.443: Flags [.], ack 337834, win 65535, length 0
13:04:11.896034 IP 10.0.2.15.51078 > 99.84.126.23.443: Flags [.], ack 340582, win 65535, length 0
13:04:11.897897 IP 99.84.126.23.443 > 10.0.2.15.51078: Flags [P.], seq 340582:350200, ack 286, win 65535, length 9618
13:04:11.897901 IP 99.84.126.23.443 > 10.0.2.15.51078: Flags [P.], seq 350200:358444, ack 286, win 65535, length 8244
13:04:11.897958 IP 10.0.2.15.51078 > 99.84.126.23.443: Flags [.], ack 350200, win 65535, length 0
13:04:11.897984 IP 10.0.2.15.51078 > 99.84.126.23.443: Flags [.], ack 358444, win 65535, length 0
13:04:11.898018 IP 99.84.126.23.443 > 10.0.2.15.51078: Flags [P.], seq 358444:366688, ack 286, win 65535, length 8244
13:04:11.898024 IP 10.0.2.15.51078 > 99.84.126.23.443: Flags [.], ack 366688, win 65535, length 0
13:04:11.898222 IP 99.84.126.23.443 > 10.0.2.15.51078: Flags [P.], seq 366688:369436, ack 286, win 65535, length 2748
13:04:11.898234 IP 10.0.2.15.51078 > 99.84.126.23.443: Flags [.], ack 369436, win 65535, length 0
13:04:11.898507 IP 99.84.126.23.443 > 10.0.2.15.51078: Flags [P.], seq 369436:374932, ack 286, win 65535, length 5496
13:04:11.898519 IP 10.0.2.15.51078 > 99.84.126.23.443: Flags [.], ack 374932, win 65535, length 0
13:04:11.898689 IP 99.84.126.23.443 > 10.0.2.15.51078: Flags [P.], seq 374932:381802, ack 286, win 65535, length 6870
13:04:11.898734 IP 10.0.2.15.51078 > 99.84.126.23.443: Flags [.], ack 381802, win 65535, length 0
13:04:11.898832 IP 99.84.126.23.443 > 10.0.2.15.51078: Flags [P.], seq 381802:384550, ack 286, win 65535, length 2748
13:04:11.898838 IP 10.0.2.15.51078 > 99.84.126.23.443: Flags [.], ack 384550, win 65535, length 0
13:04:11.898990 IP 99.84.126.23.443 > 10.0.2.15.51078: Flags [P.], seq 384550:387298, ack 286, win 65535, length 2748
13:04:11.898999 IP 10.0.2.15.51078 > 99.84.126.23.443: Flags [.], ack 387298, win 65535, length 0
13:04:11.899117 IP 99.84.126.23.443 > 10.0.2.15.51078: Flags [P.], seq 387298:388672, ack 286, win 65535, length 1374
13:04:11.899124 IP 10.0.2.15.51078 > 99.84.126.23.443: Flags [.], ack 388672, win 65535, length 0
13:04:11.902420 IP 99.84.126.23.443 > 10.0.2.15.51078: Flags [.], seq 388672:431012, ack 286, win 65535, length 42340
13:04:11.902439 IP 10.0.2.15.51078 > 99.84.126.23.443: Flags [.], ack 431012, win 65535, length 0
13:04:11.902816 IP 99.84.126.23.443 > 10.0.2.15.51078: Flags [P.], seq 431012:432640, ack 286, win 65535, length 1628
13:04:11.902819 IP 99.84.126.23.443 > 10.0.2.15.51078: Flags [P.], seq 432640:440884, ack 286, win 65535, length 8244
13:04:11.902838 IP 10.0.2.15.51078 > 99.84.126.23.443: Flags [.], ack 432640, win 65535, length 0
13:04:11.902868 IP 10.0.2.15.51078 > 99.84.126.23.443: Flags [.], ack 440884, win 65535, length 0
13:04:11.902892 IP 99.84.126.23.443 > 10.0.2.15.51078: Flags [.], seq 440884:443804, ack 286, win 65535, length 2920
13:04:11.902897 IP 10.0.2.15.51078 > 99.84.126.23.443: Flags [.], ack 443804, win 65535, length 0
13:04:11.903094 IP 99.84.126.23.443 > 10.0.2.15.51078: Flags [P.], seq 443804:446380, ack 286, win 65535, length 2576
13:04:11.903097 IP 99.84.126.23.443 > 10.0.2.15.51078: Flags [P.], seq 446380:450502, ack 286, win 65535, length 4122
13:04:11.903113 IP 10.0.2.15.51078 > 99.84.126.23.443: Flags [.], ack 446380, win 65535, length 0
13:04:11.903129 IP 10.0.2.15.51078 > 99.84.126.23.443: Flags [.], ack 450502, win 65535, length 0
13:04:11.903575 IP 99.84.126.23.443 > 10.0.2.15.51078: Flags [P.], seq 450502:451876, ack 286, win 65535, length 1374
13:04:11.903577 IP 99.84.126.23.443 > 10.0.2.15.51078: Flags [P.], seq 451876:455998, ack 286, win 65535, length 4122
13:04:11.903578 IP 99.84.126.23.443 > 10.0.2.15.51078: Flags [P.], seq 455998:458746, ack 286, win 65535, length 2748
13:04:11.903579 IP 99.84.126.23.443 > 10.0.2.15.51078: Flags [P.], seq 458746:461494, ack 286, win 65535, length 2748
13:04:11.903594 IP 10.0.2.15.51078 > 99.84.126.23.443: Flags [.], ack 451876, win 65535, length 0
13:04:11.903618 IP 10.0.2.15.51078 > 99.84.126.23.443: Flags [.], ack 455998, win 65535, length 0
13:04:11.903631 IP 10.0.2.15.51078 > 99.84.126.23.443: Flags [.], ack 458746, win 65535, length 0
13:04:11.903753 IP 10.0.2.15.51078 > 99.84.126.23.443: Flags [.], ack 461494, win 65535, length 0
13:04:11.904019 IP 99.84.126.23.443 > 10.0.2.15.51078: Flags [P.], seq 461494:465616, ack 286, win 65535, length 4122
13:04:11.904030 IP 10.0.2.15.51078 > 99.84.126.23.443: Flags [.], ack 465616, win 65535, length 0
13:04:11.904248 IP 99.84.126.23.443 > 10.0.2.15.51078: Flags [P.], seq 465616:468364, ack 286, win 65535, length 2748
13:04:11.904250 IP 99.84.126.23.443 > 10.0.2.15.51078: Flags [P.], seq 468364:471112, ack 286, win 65535, length 2748
13:04:11.904251 IP 99.84.126.23.443 > 10.0.2.15.51078: Flags [P.], seq 471112:473860, ack 286, win 65535, length 2748
13:04:11.904252 IP 99.84.126.23.443 > 10.0.2.15.51078: Flags [P.], seq 473860:476608, ack 286, win 65535, length 2748
13:04:11.904264 IP 10.0.2.15.51078 > 99.84.126.23.443: Flags [.], ack 468364, win 65535, length 0
13:04:11.904327 IP 10.0.2.15.51078 > 99.84.126.23.443: Flags [.], ack 471112, win 65535, length 0
13:04:11.904344 IP 10.0.2.15.51078 > 99.84.126.23.443: Flags [.], ack 473860, win 65535, length 0
13:04:11.904355 IP 10.0.2.15.51078 > 99.84.126.23.443: Flags [.], ack 476608, win 65535, length 0
13:04:11.905256 IP 99.84.126.23.443 > 10.0.2.15.51078: Flags [P.], seq 476608:482104, ack 286, win 65535, length 5496
13:04:11.905322 IP 10.0.2.15.51078 > 99.84.126.23.443: Flags [.], ack 482104, win 65535, length 0
13:04:11.905533 IP 99.84.126.23.443 > 10.0.2.15.51078: Flags [P.], seq 482104:487600, ack 286, win 65535, length 5496
13:04:11.905535 IP 99.84.126.23.443 > 10.0.2.15.51078: Flags [P.], seq 487600:491722, ack 286, win 65535, length 4122
13:04:11.905594 IP 10.0.2.15.51078 > 99.84.126.23.443: Flags [.], ack 487600, win 65535, length 0
13:04:11.905672 IP 10.0.2.15.51078 > 99.84.126.23.443: Flags [.], ack 491722, win 65535, length 0
13:04:11.905990 IP 99.84.126.23.443 > 10.0.2.15.51078: Flags [P.], seq 491722:494470, ack 286, win 65535, length 2748

