13:04:10.153561 IP 99.84.126.23.443 > 10.0.2.15.51076: Flags [S.], seq 3584001, ack 1656100084, win 65535, options [mss 1460], length 0
13:04:10.153597 IP 10.0.2.15.51076 > 99.84.126.23.443: Flags [.], ack 1, win 64240, length 0
13:04:10.160001 IP 10.0.2.15.51076 > 99.84.126.23.443: Flags [P.], seq 1:518, ack 1, win 64240, length 517
13:04:10.160458 IP 99.84.126.23.443 > 10.0.2.15.51076: Flags [.], ack 518, win 65535, length 0
13:04:10.175633 IP 99.84.126.23.443 > 10.0.2.15.51076: Flags [P.], seq 1:2749, ack 518, win 65535, length 2748
13:04:10.175652 IP 10.0.2.15.51076 > 99.84.126.23.443: Flags [.], ack 2749, win 62780, length 0
13:04:10.176957 IP 99.84.126.23.443 > 10.0.2.15.51076: Flags [P.], seq 2749:4123, ack 518, win 65535, length 1374
13:04:10.176976 IP 10.0.2.15.51076 > 99.84.126.23.443: Flags [.], ack 4123, win 62780, length 0
13:04:10.180381 IP 99.84.126.23.443 > 10.0.2.15.51076: Flags [P.], seq 4123:5497, ack 518, win 65535, length 1374
13:04:10.180399 IP 10.0.2.15.51076 > 99.84.126.23.443: Flags [.], ack 5497, win 62780, length 0
13:04:10.182785 IP 99.84.126.23.443 > 10.0.2.15.51076: Flags [P.], seq 5497:5824, ack 518, win 65535, length 327
13:04:10.182813 IP 10.0.2.15.51076 > 99.84.126.23.443: Flags [.], ack 5824, win 62780, length 0
13:04:10.183441 IP 10.0.2.15.51076 > 99.84.126.23.443: Flags [P.], seq 518:582, ack 5824, win 62780, length 64
13:04:10.183678 IP 99.84.126.23.443 > 10.0.2.15.51076: Flags [.], ack 582, win 65535, length 0
13:04:10.183835 IP 10.0.2.15.51076 > 99.84.126.23.443: Flags [P.], seq 582:628, ack 5824, win 62780, length 46
13:04:10.183868 IP 10.0.2.15.51076 > 99.84.126.23.443: Flags [P.], seq 628:677, ack 5824, win 62780, length 49
13:04:10.184088 IP 99.84.126.23.443 > 10.0.2.15.51076: Flags [.], ack 628, win 65535, length 0
13:04:10.184090 IP 99.84.126.23.443 > 10.0.2.15.51076: Flags [.], ack 677, win 65535, length 0
13:04:10.184207 IP 10.0.2.15.51076 > 99.84.126.23.443: Flags [P.], seq 677:772, ack 5824, win 62780, length 95
13:04:10.184403 IP 99.84.126.23.443 > 10.0.2.15.51076: Flags [.], ack 772, win 65535, length 0
13:04:10.198126 IP 99.84.126.23.443 > 10.0.2.15.51076: Flags [P.], seq 5824:5895, ack 772, win 65535, length 71
13:04:10.198155 IP 10.0.2.15.51076 > 99.84.126.23.443: Flags [.], ack 5895, win 62780, length 0
13:04:10.198503 IP 10.0.2.15.51076 > 99.84.126.23.443: Flags [P.], seq 772:803, ack 5895, win 62780, length 31
13:04:10.199076 IP 99.84.126.23.443 > 10.0.2.15.51076: Flags [.], ack 803, win 65535, length 0
13:04:10.530261 IP 99.84.126.23.443 > 10.0.2.15.51076: Flags [P.], seq 5895:10017, ack 803, win 65535, length 4122
13:04:10.530381 IP 10.0.2.15.51076 > 99.84.126.23.443: Flags [.], ack 10017, win 61320, length 0
13:04:10.531486 IP 99.84.126.23.443 > 10.0.2.15.51076: Flags [P.], seq 10017:11391, ack 803, win 65535, length 1374
13:04:10.531512 IP 10.0.2.15.51076 > 99.84.126.23.443: Flags [.], ack 11391, win 62780, length 0
13:04:10.532411 IP 99.84.126.23.443 > 10.0.2.15.51076: Flags [P.], seq 11391:21009, ack 803, win 65535, length 9618
13:04:10.532565 IP 10.0.2.15.51076 > 99.84.126.23.443: Flags [.], ack 21009, win 58400, length 0
13:04:10.533544 IP 99.84.126.23.443 > 10.0.2.15.51076: Flags [P.], seq 21009:32001, ack 803, win 65535, length 10992
13:04:10.533566 IP 10.0.2.15.51076 > 99.84.126.23.443: Flags [.], ack 32001, win 56940, length 0
13:04:10.536791 IP 99.84.126.23.443 > 10.0.2.15.51076: Flags [P.], seq 32001:44367, ack 803, win 65535, length 12366
13:04:10.536814 IP 10.0.2.15.51076 > 99.84.126.23.443: Flags [.], ack 44367, win 55480, length 0
13:04:10.536872 IP 99.84.126.23.443 > 10.0.2.15.51076: Flags [.], seq 44367:47287, ack 803, win 65535, length 2920
13:04:10.536880 IP 10.0.2.15.51076 > 99.84.126.23.443: Flags [.], ack 47287, win 54020, length 0
13:04:10.537122 IP 99.84.126.23.443 > 10.0.2.15.51076: Flags [P.], seq 47287:48489, ack 803, win 65535, length 1202
13:04:10.537131 IP 10.0.2.15.51076 > 99.84.126.23.443: Flags [.], ack 48489, win 52818, length 0
13:04:10.542873 IP 99.84.126.23.443 > 10.0.2.15.51076: Flags [P.], seq 48489:51237, ack 803, win 65535, length 2748
13:04:10.542892 IP 10.0.2.15.51076 > 99.84.126.23.443: Flags [.], ack 51237, win 62780, length 0
13:04:10.543777 IP 99.84.126.23.443 > 10.0.2.15.51076: Flags [P.], seq 51237:52611, ack 803, win 65535, length 1374
13:04:10.543798 IP 10.0.2.15.51076 > 99.84.126.23.443: Flags [.], ack 52611, win 62780, length 0
13:04:10.546571 IP 99.84.126.23.443 > 10.0.2.15.51076: Flags [P.], seq 52611:63603, ack 803, win 65535, length 10992
13:04:10.546593 IP 10.0.2.15.51076 > 99.84.126.23.443: Flags [.], ack 63603, win 56940, length 0
13:04:10.547343 IP 99.84.126.23.443 > 10.0.2.15.51076: Flags [P.], seq 63603:70473, ack 803, win 65535, length 6870
13:04:10.547347 IP 99.84.126.23.443 > 10.0.2.15.51076: Flags [P.], seq 70473:73221, ack 803, win 65535, length 2748
13:04:10.547405 IP 10.0.2.15.51076 > 99.84.126.23.443: Flags [.], ack 70473, win 52560, length 0
13:04:10.547497 IP 10.0.2.15.51076 > 99.84.126.23.443: Flags [.], ack 73221, win 49812, length 0
13:04:10.547779 IP 99.84.126.23.443 > 10.0.2.15.51076: Flags [P.], seq 73221:75969, ack 803, win 65535, length 2748
13:04:10.547807 IP 10.0.2.15.51076 > 99.84.126.23.443: Flags [.], ack 75969, win 65535, length 0
13:04:10.548227 IP 99.84.126.23.443 > 10.0.2.15.51076: Flags [P.], seq 75969:81465, ack 803, win 65535, length 5496
13:04:10.548246 IP 10.0.2.15.51076 > 99.84.126.23.443: Flags [.], ack 81465, win 65535, length 0
13:04:10.548353 IP 99.84.126.23.443 > 10.0.2.15.51076: Flags [P.], seq 81465:85587, ack 803, win 65535, length 4122
13:04:10.548361 IP 10.0.2.15.51076 > 99.84.126.23.443: Flags [.], ack 85587, win 65535, length 0
13:04:10.549271 IP 99.84.126.23.443 > 10.0.2.15.51076: Flags [P.], seq 85587:91083, ack 803, win 65535, length 5496
13:04:10.549274 IP 99.84.126.23.443 > 10.0.2.15.51076: Flags [P.], seq 91083:92457, ack 803, win 65535, length 1374
13:04:10.549296 IP 10.0.2.15.51076 > 99.84.126.23.443: Flags [.], ack 91083, win 65535, length 0
13:04:10.549336 IP 10.0.2.15.51076 > 99.84.126.23.443: Flags [.], ack 92457, win 65535, length 0
13:04:10.550608 IP 99.84.126.23.443 > 10.0.2.15.51076: Flags [P.], seq 92457:96579, ack 803, win 65535, length 4122
13:04:10.550628 IP 10.0.2.15.51076 > 99.84.126.23.443: Flags [.], ack 96579, win 65535, length 0
13:04:10.552807 IP 99.84.126.23.443 > 10.0.2.15.51076: Flags [P.], seq 96579:113067, ack 803, win 65535, length 16488
13:04:10.552833 IP 10.0.2.15.51076 > 99.84.126.23.443: Flags [.], ack 113067, win 65535, length 0
13:04:10.553941 IP 99.84.126.23.443 > 10.0.2.15.51076: Flags [P.], seq 113067:118563, ack 803, win 65535, length 5496
13:04:10.553962 IP 10.0.2.15.51076 > 99.84.126.23.443: Flags [.], ack 118563, win 65535, length 0
13:04:10.554881 IP 99.84.126.23.443 > 10.0.2.15.51076: Flags [P.], seq 118563:125433, ack 803, win 65535, length 6870
13:04:10.554902 IP 10.0.2.15.51076 > 99.84.126.23.443: Flags [.], ack 125433, win 65535, length 0
13:04:10.555899 IP 99.84.126.23.443 > 10.0.2.15.51076: Flags [P.], seq 125433:133677, ack 803, win 65535, length 8244
13:04:10.555920 IP 10.0.2.15.51076 > 99.84.126.23.443: Flags [.], ack 133677, win 65535, length 0
13:04:10.559568 IP 99.84.126.23.443 > 10.0.2.15.51076: Flags [P.], seq 133677:139173, ack 803, win 65535, length 5496
13:04:10.559577 IP 99.84.126.23.443 > 10.0.2.15.51076: Flags [P.], seq 139173:147417, ack 803, win 65535, length 8244
13:04:10.559637 IP 10.0.2.15.51076 > 99.84.126.23.443: Flags [.], ack 139173, win 65535, length 0
13:04:10.559689 IP 10.0.2.15.51076 > 99.84.126.23.443: Flags [.], ack 147417, win 65535, length 0
13:04:10.559725 IP 99.84.126.23.443 > 10.0.2.15.51076: Flags [P.], seq 147417:148791, ack 803, win 65535, length 1374
13:04:10.559726 IP 99.84.126.23.443 > 10.0.2.15.51076: Flags [P.], seq 148791:151539, ack 803, win 65535, length 2748
13:04:10.559734 IP 10.0.2.15.51076 > 99.84.126.23.443: Flags [.], ack 148791, win 65535, length 0
13:04:10.559747 IP 10.0.2.15.51076 > 99.84.126.23.443: Flags [.], ack 151539, win 65535, length 0
13:04:10.561521 IP 99.84.126.23.443 > 10.0.2.15.51076: Flags [P.], seq 151539:157035, ack 803, win 65535, length 5496
13:04:10.561527 IP 99.84.126.23.443 > 10.0.2.15.51076: Flags [P.], seq 157035:163905, ack 803, win 65535, length 6870
13:04:10.561654 IP 10.0.2.15.51076 > 99.84.126.23.443: Flags [.], ack 157035, win 65535, length 0
13:04:10.561708 IP 10.0.2.15.51076 > 99.84.126.23.443: Flags [.], ack 163905, win 65535, length 0
13:04:10.561908 IP 99.84.126.23.443 > 10.0.2.15.51076: Flags [P.], seq 163905:168027, ack 803, win 65535, length 4122
13:04:10.561919 IP 10.0.2.15.51076 > 99.84.126.23.443: Flags [.], ack 168027, win 65535, length 0
13:04:10.562728 IP 99.84.126.23.443 > 10.0.2.15.51076: Flags [P.], seq 168027:173523, ack 803, win 65535, length 5496
13:04:10.562731 IP 99.84.126.23.443 > 10.0.2.15.51076: Flags [P.], seq 173523:176271, ack 803, win 65535, length 2748
13:04:10.562732 IP 99.84.126.23.443 > 10.0.2.15.51076: Flags [P.], seq 176271:179019, ack 803, win 65535, length 2748
13:04:10.562751 IP 10.0.2.15.51076 > 99.84.126.23.443: Flags [.], ack 173523, win 65535, length 0
13:04:10.562784 IP 10.0.2.15.51076 > 99.84.126.23.443: Flags [.], ack 176271, win 65535, length 0
13:04:10.562797 IP 10.0.2.15.51076 > 99.84.126.23.443: Flags [.], ack 179019, win 65535, length 0
13:04:10.562812 IP 99.84.126.23.443 > 10.0.2.15.51076: Flags [P.], seq 179019:181767, ack 803, win 65535, length 2748
13:04:10.562816 IP 10.0.2.15.51076 > 99.84.126.23.443: Flags [.], ack 181767, win 65535, length 0
13:04:10.564359 IP 99.84.126.23.443 > 10.0.2.15.51076: Flags [P.], seq 181767:188637, ack 803, win 65535, length 6870
13:04:10.564362 IP 99.84.126.23.443 > 10.0.2.15.51076: Flags [P.], seq 188637:192759, ack 803, win 65535, length 4122
13:04:10.564387 IP 10.0.2.15.51076 > 99.84.126.23.443: Flags [.], ack 188637, win 65535, length 0
13:04:10.564424 IP 10.0.2.15.51076 > 99.84.126.23.443: Flags [.], ack 192759, win 65535, length 0
13:04:10.564621 IP 99.84.126.23.443 > 10.0.2.15.51076: Flags [P.], seq 192759:195507, ack 803, win 65535, length 2748
13:04:10.564630 IP 10.0.2.15.51076 > 99.84.126.23.443: Flags [.], ack 195507, win 65535, length 0
13:04:10.566592 IP 99.84.126.23.443 > 10.0.2.15.51076: Flags [P.], seq 195507:206499, ack 803, win 65535, length 10992
13:04:10.566613 IP 10.0.2.15.51076 > 99.84.126.23.443: Flags [.], ack 206499, win 65535, length 0
13:04:10.566694 IP 99.84.126.23.443 > 10.0.2.15.51076: Flags [P.], seq 206499:209247, ack 803, win 65535, length 2748
13:04:10.566701 IP 10.0.2.15.51076 > 99.84.126.23.443: Flags [.], ack 209247, win 65535, length 0
13:04:10.567767 IP 99.84.126.23.443 > 10.0.2.15.51076: Flags [P.], seq 209247:216117, ack 803, win 65535, length 6870
13:04:10.567770 IP 99.84.126.23.443 > 10.0.2.15.51076: Flags [P.], seq 216117:220239, ack 803, win 65535, length 4122
13:04:10.567878 IP 10.0.2.15.51076 > 99.84.126.23.443: Flags [.], ack 216117, win 65535, length 0
13:04:10.568036 IP 10.0.2.15.51076 > 99.84.126.23.443: Flags [.], ack 220239, win 65535, length 0
13:04:10.568671 IP 99.84.126.23.443 > 10.0.2.15.51076: Flags [P.], seq 220239:222987, ack 803, win 65535, length 2748
13:04:10.568672 IP 99.84.126.23.443 > 10.0.2.15.51076: Flags [P.], seq 222987:227109, ack 803, win 65535, length 4122
13:04:10.568673 IP 99.84.126.23.443 > 10.0.2.15.51076: Flags [P.], seq 227109:229857, ack 803, win 65535, length 2748
13:04:10.568673 IP 99.84.126.23.443 > 10.0.2.15.51076: Flags [P.], seq 229857:231231, ack 803, win 65535, length 1374
13:04:10.568685 IP 10.0.2.15.51076 > 99.84.126.23.443: Flags [.], ack 222987, win 65535, length 0
13:04:10.568720 IP 10.0.2.15.51076 > 99.84.126.23.443: Flags [.], ack 227109, win 65535, length 0
13:04:10.568728 IP 10.0.2.15.51076 > 99.84.126.23.443: Flags [.], ack 229857, win 65535, length 0
13:04:10.568735 IP 10.0.2.15.51076 > 99.84.126.23.443: Flags [.], ack 231231, win 65535, length 0
13:04:10.568765 IP 99.84.126.23.443 > 10.0.2.15.51076: Flags [P.], seq 231231:233979, ack 803, win 65535, length 2748
13:04:10.568770 IP 10.0.2.15.51076 > 99.84.126.23.443: Flags [.], ack 233979, win 65535, length 0
13:04:10.569701 IP 99.84.126.23.443 > 10.0.2.15.51076: Flags [P.], seq 233979:240849, ack 803, win 65535, length 6870
13:04:10.569703 IP 99.84.126.23.443 > 10.0.2.15.51076: Flags [.], seq 240849:242309, ack 803, win 65535, length 1460
13:04:10.569722 IP 10.0.2.15.51076 > 99.84.126.23.443: Flags [.], ack 240849, win 65535, length 0
13:04:10.569818 IP 10.0.2.15.51076 > 99.84.126.23.443: Flags [.], ack 242309, win 65535, length 0
13:04:10.570114 IP 99.84.126.23.443 > 10.0.2.15.51076: Flags [P.], seq 242309:244971, ack 803, win 65535, length 2662
13:04:10.570116 IP 99.84.126.23.443 > 10.0.2.15.51076: Flags [P.], seq 244971:247719, ack 803, win 65535, length 2748
13:04:10.570116 IP 99.84.126.23.443 > 10.0.2.15.51076: Flags [P.], seq 247719:250467, ack 803, win 65535, length 2748
13:04:10.570117 IP 99.84.126.23.443 > 10.0.2.15.51076: Flags [P.], seq 250467:255963, ack 803, win 65535, length 5496
13:04:10.570469 IP 10.0.2.15.51076 > 99.84.126.23.443: Flags [.], ack 255963, win 65535, length 0
13:04:10.570988 IP 99.84.126.23.443 > 10.0.2.15.51076: Flags [P.], seq 255963:261459, ack 803, win 65535, length 5496
13:04:10.571106 IP 99.84.126.23.443 > 10.0.2.15.51076: Flags [P.], seq 261459:264207, ack 803, win 65535, length 2748
13:04:10.571211 IP 99.84.126.23.443 > 10.0.2.15.51076: Flags [P.], seq 264207:266955, ack 803, win 65535, length 2748
13:04:10.571307 IP 99.84.126.23.443 > 10.0.2.15.51076: Flags [P.], seq 266955:268329, ack 803, win 65535, length 1374
13:04:10.571612 IP 10.0.2.15.51076 > 99.84.126.23.443: Flags [.], ack 268329, win 65535, length 0
13:04:10.575365 IP 99.84.126.23.443 > 10.0.2.15.51076: Flags [P.], seq 268329:286191, ack 803, win 65535, length 17862
13:04:10.575611 IP 10.0.2.15.51076 > 99.84.126.23.443: Flags [.], ack 286191, win 65535, length 0
13:04:10.575667 IP 99.84.126.23.443 > 10.0.2.15.51076: Flags [P.], seq 286191:288939, ack 803, win 65535, length 2748
13:04:10.575668 IP 99.84.126.23.443 > 10.0.2.15.51076: Flags [P.], seq 288939:291687, ack 803, win 65535, length 2748
13:04:10.575669 IP 99.84.126.23.443 > 10.0.2.15.51076: Flags [P.], seq 291687:297183, ack 803, win 65535, length 5496
13:04:10.575683 IP 10.0.2.15.51076 > 99.84.126.23.443: Flags [.], ack 288939, win 65535, length 0
13:04:10.575700 IP 10.0.2.15.51076 > 99.84.126.23.443: Flags [.], ack 291687, win 65535, length 0
13:04:10.575710 IP 10.0.2.15.51076 > 99.84.126.23.443: Flags [.], ack 297183, win 65535, length 0
13:04:10.575721 IP 99.84.126.23.443 > 10.0.2.15.51076: Flags [P.], seq 297183:298557, ack 803, win 65535, length 1374
13:04:10.575726 IP 10.0.2.15.51076 > 99.84.126.23.443: Flags [.], ack 298557, win 65535, length 0
13:04:10.579475 IP 99.84.126.23.443 > 10.0.2.15.51076: Flags [.], seq 298557:329217, ack 803, win 65535, length 30660
13:04:10.579596 IP 10.0.2.15.51076 > 99.84.126.23.443: Flags [.], ack 329217, win 65535, length 0
13:04:10.579870 IP 99.84.126.23.443 > 10.0.2.15.51076: Flags [P.], seq 329217:346647, ack 803, win 65535, length 17430
13:04:10.579885 IP 10.0.2.15.51076 > 99.84.126.23.443: Flags [.], ack 346647, win 65535, length 0
13:04:10.579930 IP 99.84.126.23.443 > 10.0.2.15.51076: Flags [P.], seq 346647:361761, ack 803, win 65535, length 15114
13:04:10.579938 IP 10.0.2.15.51076 > 99.84.126.23.443: Flags [.], ack 361761, win 65535, length 0
13:04:10.580958 IP 99.84.126.23.443 > 10.0.2.15.51076: Flags [P.], seq 361761:363135, ack 803, win 65535, length 1374
13:04:10.580996 IP 10.0.2.15.51076 > 99.84.126.23.443: Flags [.], ack 363135, win 65535, length 0
13:04:10.584866 IP 99.84.126.23.443 > 10.0.2.15.51076: Flags [.], seq 363135:402555, ack 803, win 65535, length 39420
13:04:10.584936 IP 10.0.2.15.51076 > 99.84.126.23.443: Flags [.], ack 402555, win 65535, length 0
13:04:10.585123 IP 99.84.126.23.443 > 10.0.2.15.51076: Flags [P.], seq 402555:405729, ack 803, win 65535, length 3174
13:04:10.585126 IP 99.84.126.23.443 > 10.0.2.15.51076: Flags [.], seq 405729:410109, ack 803, win 65535, length 4380
13:04:10.585141 IP 10.0.2.15.51076 > 99.84.126.23.443: Flags [.], ack 405729, win 65535, length 0
13:04:10.585211 IP 10.0.2.15.51076 > 99.84.126.23.443: Flags [.], ack 410109, win 65535, length 0
13:04:10.585342 IP 99.84.126.23.443 > 10.0.2.15.51076: Flags [P.], seq 410109:441453, ack 803, win 65535, length 31344
13:04:10.585350 IP 10.0.2.15.51076 > 99.84.126.23.443: Flags [.], ack 441453, win 65535, length 0
13:04:10.585814 IP 99.84.126.23.443 > 10.0.2.15.51076: Flags [P.], seq 441453:448323, ack 803, win 65535, length 6870
13:04:10.585826 IP 10.0.2.15.51076 > 99.84.126.23.443: Flags [.], ack 448323, win 65535, length 0
13:04:10.585993 IP 99.84.126.23.443 > 10.0.2.15.51076: Flags [P.], seq 448323:452445, ack 803, win 65535, length 4122
13:04:10.585994 IP 99.84.126.23.443 > 10.0.2.15.51076: Flags [.], seq 452445:453905, ack 803, win 65535, length 1460
13:04:10.586020 IP 10.0.2.15.51076 > 99.84.126.23.443: Flags [.], ack 453905, win 65535, length 0
13:04:10.586154 IP 99.84.126.23.443 > 10.0.2.15.51076: Flags [P.], seq 453905:455193, ack 803, win 65535, length 1288
13:04:10.586155 IP 99.84.126.23.443 > 10.0.2.15.51076: Flags [.], seq 455193:456653, ack 803, win 65535, length 1460
13:04:10.586164 IP 10.0.2.15.51076 > 99.84.126.23.443: Flags [.], ack 455193, win 65535, length 0
13:04:10.586180 IP 10.0.2.15.51076 > 99.84.126.23.443: Flags [.], ack 456653, win 65535, length 0
13:04:10.586608 IP 99.84.126.23.443 > 10.0.2.15.51076: Flags [P.], seq 456653:457941, ack 803, win 65535, length 1288
13:04:10.586670 IP 99.84.126.23.443 > 10.0.2.15.51076: Flags [P.], seq 457941:462063, ack 803, win 65535, length 4122
13:04:10.586671 IP 99.84.126.23.443 > 10.0.2.15.51076: Flags [P.], seq 462063:464811, ack 803, win 65535, length 2748
13:04:10.586672 IP 99.84.126.23.443 > 10.0.2.15.51076: Flags [P.], seq 464811:467559, ack 803, win 65535, length 2748
13:04:10.586686 IP 10.0.2.15.51076 > 99.84.126.23.443: Flags [.], ack 457941, win 65535, length 0
13:04:10.586714 IP 10.0.2.15.51076 > 99.84.126.23.443: Flags [.], ack 462063, win 65535, length 0
13:04:10.586727 IP 10.0.2.15.51076 > 99.84.126.23.443: Flags [.], ack 464811, win 65535, length 0
13:04:10.586737 IP 10.0.2.15.51076 > 99.84.126.23.443: Flags [.], ack 467559, win 65535, length 0
13:04:10.586938 IP 99.84.126.23.443 > 10.0.2.15.51076: Flags [P.], seq 467559:468933, ack 803, win 65535, length 1374
13:04:10.586940 IP 99.84.126.23.443 > 10.0.2.15.51076: Flags [P.], seq 468933:473055, ack 803, win 65535, length 4122
13:04:10.586953 IP 10.0.2.15.51076 > 99.84.126.23.443: Flags [.], ack 468933, win 65535, length 0
13:04:10.587045 IP 10.0.2.15.51076 > 99.84.126.23.443: Flags [.], ack 473055, win 65535, length 0
13:04:10.587380 IP 99.84.126.23.443 > 10.0.2.15.51076: Flags [P.], seq 473055:475803, ack 803, win 65535, length 2748
13:04:10.587381 IP 99.84.126.23.443 > 10.0.2.15.51076: Flags [P.], seq 475803:478551, ack 803, win 65535, length 2748
13:04:10.587382 IP 99.84.126.23.443 > 10.0.2.15.51076: Flags [P.], seq 478551:481299, ack 803, win 65535, length 2748
13:04:10.587391 IP 10.0.2.15.51076 > 99.84.126.23.443: Flags [.], ack 475803, win 65535, length 0
13:04:10.587405 IP 10.0.2.15.51076 > 99.84.126.23.443: Flags [.], ack 478551, win 65535, length 0
13:04:10.587417 IP 10.0.2.15.51076 > 99.84.126.23.443: Flags [.], ack 481299, win 65535, length 0
13:04:10.588341 IP 99.84.126.23.443 > 10.0.2.15.51076: Flags [P.], seq 481299:486795, ack 803, win 65535, length 5496
13:04:10.588344 IP 99.84.126.23.443 > 10.0.2.15.51076: Flags [P.], seq 486795:490917, ack 803, win 65535, length 4122
13:04:10.588429 IP 10.0.2.15.51076 > 99.84.126.23.443: Flags [.], ack 486795, win 65535, length 0
13:04:10.588469 IP 10.0.2.15.51076 > 99.84.126.23.443: Flags [.], ack 490917, win 65535, length 0

