13:04:15.294659 IP 99.84.126.86.443 > 10.0.2.15.51600: Flags [.], seq 5056002:5058922, ack 2911567905, win 65535, length 2920
13:04:15.294681 IP 10.0.2.15.51600 > 99.84.126.86.443: Flags [.], ack 2920, win 62780, length 0
13:04:15.294976 IP 99.84.126.86.443 > 10.0.2.15.51600: Flags [P.], seq 2920:4122, ack 1, win 65535, length 1202
13:04:15.295004 IP 10.0.2.15.51600 > 99.84.126.86.443: Flags [.], ack 4122, win 61578, length 0
13:04:15.296180 IP 99.84.126.86.443 > 10.0.2.15.51600: Flags [P.], seq 4122:5496, ack 1, win 65535, length 1374
13:04:15.296206 IP 10.0.2.15.51600 > 99.84.126.86.443: Flags [.], ack 5496, win 62780, length 0
13:04:15.298293 IP 99.84.126.86.443 > 10.0.2.15.51600: Flags [P.], seq 5496:5823, ack 1, win 65535, length 327
13:04:15.298313 IP 10.0.2.15.51600 > 99.84.126.86.443: Flags [.], ack 5823, win 62780, length 0
13:04:15.298787 IP 10.0.2.15.51600 > 99.84.126.86.443: Flags [P.], seq 1:65, ack 5823, win 62780, length 64
13:04:15.299133 IP 99.84.126.86.443 > 10.0.2.15.51600: Flags [.], ack 65, win 65535, length 0
13:04:15.299324 IP 10.0.2.15.51600 > 99.84.126.86.443: Flags [P.], seq 65:111, ack 5823, win 62780, length 46
13:04:15.299407 IP 10.0.2.15.51600 > 99.84.126.86.443: Flags [P.], seq 111:160, ack 5823, win 62780, length 49
13:04:15.299549 IP 10.0.2.15.51600 > 99.84.126.86.443: Flags [P.], seq 160:195, ack 5823, win 62780, length 35
13:04:15.299970 IP 99.84.126.86.443 > 10.0.2.15.51600: Flags [.], ack 111, win 65535, length 0
13:04:15.299972 IP 99.84.126.86.443 > 10.0.2.15.51600: Flags [.], ack 160, win 65535, length 0
13:04:15.299973 IP 99.84.126.86.443 > 10.0.2.15.51600: Flags [.], ack 195, win 65535, length 0
13:04:15.300872 IP 10.0.2.15.51600 > 99.84.126.86.443: Flags [P.], seq 195:255, ack 5823, win 62780, length 60
13:04:15.301164 IP 99.84.126.86.443 > 10.0.2.15.51600: Flags [.], ack 255, win 65535, length 0
13:04:15.312507 IP 99.84.126.86.443 > 10.0.2.15.51600: Flags [P.], seq 5823:5885, ack 255, win 65535, length 62
13:04:15.312528 IP 10.0.2.15.51600 > 99.84.126.86.443: Flags [.], ack 5885, win 62780, length 0
13:04:15.312813 IP 10.0.2.15.51600 > 99.84.126.86.443: Flags [P.], seq 255:286, ack 5885, win 62780, length 31
13:04:15.313611 IP 99.84.126.86.443 > 10.0.2.15.51600: Flags [.], ack 286, win 65535, length 0
13:04:15.314899 IP 99.84.126.86.443 > 10.0.2.15.51600: Flags [P.], seq 5885:5916, ack 286, win 65535, length 31
13:04:15.314920 IP 10.0.2.15.51600 > 99.84.126.86.443: Flags [.], ack 5916, win 62780, length 0
13:04:15.342387 IP 99.84.126.86.443 > 10.0.2.15.51600: Flags [P.], seq 5916:16908, ack 286, win 65535, length 10992
13:04:15.342429 IP 10.0.2.15.51600 > 99.84.126.86.443: Flags [.], ack 16908, win 56940, length 0
13:04:15.343159 IP 99.84.126.86.443 > 10.0.2.15.51600: Flags [.], seq 16908:30048, ack 286, win 65535, length 13140
13:04:15.343189 IP 10.0.2.15.51600 > 99.84.126.86.443: Flags [.], ack 30048, win 48180, length 0
13:04:15.343722 IP 99.84.126.86.443 > 10.0.2.15.51600: Flags [.], seq 30048:44648, ack 286, win 65535, length 14600
13:04:15.343742 IP 10.0.2.15.51600 > 99.84.126.86.443: Flags [.], ack 44648, win 37960, length 0
13:04:15.344636 IP 99.84.126.86.443 > 10.0.2.15.51600: Flags [P.], seq 44648:48510, ack 286, win 65535, length 3862
13:04:15.344639 IP 99.84.126.86.443 > 10.0.2.15.51600: Flags [P.], seq 48510:49884, ack 286, win 65535, length 1374
13:04:15.344729 IP 10.0.2.15.51600 > 99.84.126.86.443: Flags [.], ack 48510, win 35040, length 0
13:04:15.345092 IP 10.0.2.15.51600 > 99.84.126.86.443: Flags [.], ack 49884, win 62780, length 0
13:04:15.356499 IP 99.84.126.86.443 > 10.0.2.15.51600: Flags [P.], seq 49884:60876, ack 286, win 65535, length 10992
13:04:15.356540 IP 99.84.126.86.443 > 10.0.2.15.51600: Flags [P.], seq 60876:62250, ack 286, win 65535, length 1374
13:04:15.357436 IP 10.0.2.15.51600 > 99.84.126.86.443: Flags [.], ack 62250, win 55480, length 0
13:04:15.357771 IP 99.84.126.86.443 > 10.0.2.15.51600: Flags [P.], seq 62250:75990, ack 286, win 65535, length 13740
13:04:15.358192 IP 99.84.126.86.443 > 10.0.2.15.51600: Flags [P.], seq 75990:81486, ack 286, win 65535, length 5496
13:04:15.358369 IP 10.0.2.15.51600 > 99.84.126.86.443: Flags [.], ack 81486, win 62780, length 0
13:04:15.358500 IP 99.84.126.86.443 > 10.0.2.15.51600: Flags [P.], seq 81486:84234, ack 286, win 65535, length 2748
13:04:15.358508 IP 10.0.2.15.51600 > 99.84.126.86.443: Flags [.], ack 84234, win 65535, length 0
13:04:15.359420 IP 99.84.126.86.443 > 10.0.2.15.51600: Flags [P.], seq 84234:89730, ack 286, win 65535, length 5496
13:04:15.359422 IP 99.84.126.86.443 > 10.0.2.15.51600: Flags [P.], seq 89730:92478, ack 286, win 65535, length 2748
13:04:15.359485 IP 10.0.2.15.51600 > 99.84.126.86.443: Flags [.], ack 89730, win 65535, length 0
13:04:15.359596 IP 10.0.2.15.51600 > 99.84.126.86.443: Flags [.], ack 92478, win 65535, length 0
13:04:15.359707 IP 99.84.126.86.443 > 10.0.2.15.51600: Flags [P.], seq 92478:96600, ack 286, win 65535, length 4122
13:04:15.359711 IP 10.0.2.15.51600 > 99.84.126.86.443: Flags [.], ack 96600, win 65535, length 0
13:04:15.360425 IP 99.84.126.86.443 > 10.0.2.15.51600: Flags [P.], seq 96600:102096, ack 286, win 65535, length 5496
13:04:15.360427 IP 99.84.126.86.443 > 10.0.2.15.51600: Flags [P.], seq 102096:103470, ack 286, win 65535, length 1374
13:04:15.360440 IP 10.0.2.15.51600 > 99.84.126.86.443: Flags [.], ack 102096, win 65535, length 0
13:04:15.360462 IP 10.0.2.15.51600 > 99.84.126.86.443: Flags [.], ack 103470, win 65535, length 0
13:04:15.361910 IP 99.84.126.86.443 > 10.0.2.15.51600: Flags [P.], seq 103470:110340, ack 286, win 65535, length 6870
13:04:15.361927 IP 10.0.2.15.51600 > 99.84.126.86.443: Flags [.], ack 110340, win 65535, length 0
13:04:15.363455 IP 99.84.126.86.443 > 10.0.2.15.51600: Flags [P.], seq 110340:119958, ack 286, win 65535, length 9618
13:04:15.363458 IP 99.84.126.86.443 > 10.0.2.15.51600: Flags [P.], seq 119958:124080, ack 286, win 65535, length 4122
13:04:15.363483 IP 10.0.2.15.51600 > 99.84.126.86.443: Flags [.], ack 119958, win 65535, length 0
13:04:15.363525 IP 10.0.2.15.51600 > 99.84.126.86.443: Flags [.], ack 124080, win 65535, length 0
13:04:15.363941 IP 99.84.126.86.443 > 10.0.2.15.51600: Flags [P.], seq 124080:126828, ack 286, win 65535, length 2748
13:04:15.363956 IP 10.0.2.15.51600 > 99.84.126.86.443: Flags [.], ack 126828, win 65535, length 0
13:04:15.367441 IP 99.84.126.86.443 > 10.0.2.15.51600: Flags [P.], seq 126828:132324, ack 286, win 65535, length 5496
13:04:15.367464 IP 10.0.2.15.51600 > 99.84.126.86.443: Flags [.], ack 132324, win 65535, length 0
13:04:15.368377 IP 99.84.126.86.443 > 10.0.2.15.51600: Flags [P.], seq 132324:140568, ack 286, win 65535, length 8244
13:04:15.368391 IP 10.0.2.15.51600 > 99.84.126.86.443: Flags [.], ack 140568, win 65535, length 0
13:04:15.369540 IP 99.84.126.86.443 > 10.0.2.15.51600: Flags [P.], seq 140568:150186, ack 286, win 65535, length 9618
13:04:15.369560 IP 10.0.2.15.51600 > 99.84.126.86.443: Flags [.], ack 150186, win 65535, length 0
13:04:15.369685 IP 99.84.126.86.443 > 10.0.2.15.51600: Flags [P.], seq 150186:152934, ack 286, win 65535, length 2748
13:04:15.369694 IP 10.0.2.15.51600 > 99.84.126.86.443: Flags [.], ack 152934, win 65535, length 0
13:04:15.370616 IP 99.84.126.86.443 > 10.0.2.15.51600: Flags [P.], seq 152934:159804, ack 286, win 65535, length 6870
13:04:15.370633 IP 10.0.2.15.51600 > 99.84.126.86.443: Flags [.], ack 159804, win 65535, length 0
13:04:15.371609 IP 99.84.126.86.443 > 10.0.2.15.51600: Flags [P.], seq 159804:168048, ack 286, win 65535, length 8244
13:04:15.371628 IP 10.0.2.15.51600 > 99.84.126.86.443: Flags [.], ack 168048, win 65535, length 0
13:04:15.372508 IP 99.84.126.86.443 > 10.0.2.15.51600: Flags [P.], seq 168048:173544, ack 286, win 65535, length 5496
13:04:15.372524 IP 10.0.2.15.51600 > 99.84.126.86.443: Flags [.], ack 173544, win 65535, length 0
13:04:15.372672 IP 99.84.126.86.443 > 10.0.2.15.51600: Flags [P.], seq 173544:174918, ack 286, win 65535, length 1374
13:04:15.372679 IP 10.0.2.15.51600 > 99.84.126.86.443: Flags [.], ack 174918, win 65535, length 0
13:04:15.373570 IP 99.84.126.86.443 > 10.0.2.15.51600: Flags [P.], seq 174918:180414, ack 286, win 65535, length 5496
13:04:15.373587 IP 10.0.2.15.51600 > 99.84.126.86.443: Flags [.], ack 180414, win 65535, length 0
13:04:15.373721 IP 99.84.126.86.443 > 10.0.2.15.51600: Flags [P.], seq 180414:183162, ack 286, win 65535, length 2748
13:04:15.373727 IP 10.0.2.15.51600 > 99.84.126.86.443: Flags [.], ack 183162, win 65535, length 0
13:04:15.374803 IP 99.84.126.86.443 > 10.0.2.15.51600: Flags [P.], seq 183162:188658, ack 286, win 65535, length 5496
13:04:15.374806 IP 99.84.126.86.443 > 10.0.2.15.51600: Flags [P.], seq 188658:191406, ack 286, win 65535, length 2748
13:04:15.374828 IP 10.0.2.15.51600 > 99.84.126.86.443: Flags [.], ack 188658, win 65535, length 0
13:04:15.374863 IP 10.0.2.15.51600 > 99.84.126.86.443: Flags [.], ack 191406, win 65535, length 0
13:04:15.375011 IP 99.84.126.86.443 > 10.0.2.15.51600: Flags [P.], seq 191406:194154, ack 286, win 65535, length 2748
13:04:15.375012 IP 99.84.126.86.443 > 10.0.2.15.51600: Flags [P.], seq 194154:195528, ack 286, win 65535, length 1374
13:04:15.375023 IP 10.0.2.15.51600 > 99.84.126.86.443: Flags [.], ack 194154, win 65535, length 0
13:04:15.375040 IP 10.0.2.15.51600 > 99.84.126.86.443: Flags [.], ack 195528, win 65535, length 0
13:04:15.376101 IP 99.84.126.86.443 > 10.0.2.15.51600: Flags [P.], seq 195528:199650, ack 286, win 65535, length 4122
13:04:15.376104 IP 99.84.126.86.443 > 10.0.2.15.51600: Flags [P.], seq 199650:202398, ack 286, win 65535, length 2748
13:04:15.376127 IP 10.0.2.15.51600 > 99.84.126.86.443: Flags [.], ack 199650, win 65535, length 0
13:04:15.376162 IP 10.0.2.15.51600 > 99.84.126.86.443: Flags [.], ack 202398, win 65535, length 0
13:04:15.376940 IP 99.84.126.86.443 > 10.0.2.15.51600: Flags [P.], seq 202398:207894, ack 286, win 65535, length 5496
13:04:15.376956 IP 10.0.2.15.51600 > 99.84.126.86.443: Flags [.], ack 207894, win 65535, length 0
13:04:15.377069 IP 99.84.126.86.443 > 10.0.2.15.51600: Flags [P.], seq 207894:209268, ack 286, win 65535, length 1374
13:04:15.377076 IP 10.0.2.15.51600 > 99.84.126.86.443: Flags [.], ack 209268, win 65535, length 0
13:04:15.377825 IP 99.84.126.86.443 > 10.0.2.15.51600: Flags [P.], seq 209268:212016, ack 286, win 65535, length 2748
13:04:15.377840 IP 10.0.2.15.51600 > 99.84.126.86.443: Flags [.], ack 212016, win 65535, length 0
13:04:15.379128 IP 99.84.126.86.443 > 10.0.2.15.51600: Flags [P.], seq 212016:225756, ack 286, win 65535, length 13740
13:04:15.379203 IP 10.0.2.15.51600 > 99.84.126.86.443: Flags [.], ack 225756, win 65535, length 0
13:04:15.379332 IP 99.84.126.86.443 > 10.0.2.15.51600: Flags [P.], seq 225756:232626, ack 286, win 65535, length 6870
13:04:15.379346 IP 10.0.2.15.51600 > 99.84.126.86.443: Flags [.], ack 232626, win 65535, length 0
13:04:15.380451 IP 99.84.126.86.443 > 10.0.2.15.51600: Flags [P.], seq 232626:238122, ack 286, win 65535, length 5496
13:04:15.380473 IP 10.0.2.15.51600 > 99.84.126.86.443: Flags [.], ack 238122, win 65535, length 0
13:04:15.380778 IP 99.84.126.86.443 > 10.0.2.15.51600: Flags [P.], seq 238122:240870, ack 286, win 65535, length 2748
13:04:15.380797 IP 10.0.2.15.51600 > 99.84.126.86.443: Flags [.], ack 240870, win 65535, length 0
13:04:15.381875 IP 99.84.126.86.443 > 10.0.2.15.51600: Flags [P.], seq 240870:250488, ack 286, win 65535, length 9618
13:04:15.381878 IP 99.84.126.86.443 > 10.0.2.15.51600: Flags [P.], seq 250488:253236, ack 286, win 65535, length 2748
13:04:15.381896 IP 10.0.2.15.51600 > 99.84.126.86.443: Flags [.], ack 250488, win 65535, length 0
13:04:15.382024 IP 10.0.2.15.51600 > 99.84.126.86.443: Flags [.], ack 253236, win 65535, length 0
13:04:15.382687 IP 99.84.126.86.443 > 10.0.2.15.51600: Flags [P.], seq 253236:260106, ack 286, win 65535, length 6870
13:04:15.382702 IP 10.0.2.15.51600 > 99.84.126.86.443: Flags [.], ack 260106, win 65535, length 0
13:04:15.382852 IP 99.84.126.86.443 > 10.0.2.15.51600: Flags [P.], seq 260106:265602, ack 286, win 65535, length 5496
13:04:15.382858 IP 10.0.2.15.51600 > 99.84.126.86.443: Flags [.], ack 265602, win 65535, length 0
13:04:15.382988 IP 99.84.126.86.443 > 10.0.2.15.51600: Flags [P.], seq 265602:269724, ack 286, win 65535, length 4122
13:04:15.383031 IP 10.0.2.15.51600 > 99.84.126.86.443: Flags [.], ack 269724, win 65535, length 0
13:04:15.383254 IP 99.84.126.86.443 > 10.0.2.15.51600: Flags [P.], seq 269724:272472, ack 286, win 65535, length 2748
13:04:15.383262 IP 10.0.2.15.51600 > 99.84.126.86.443: Flags [.], ack 272472, win 65535, length 0
13:04:15.383423 IP 99.84.126.86.443 > 10.0.2.15.51600: Flags [P.], seq 272472:277968, ack 286, win 65535, length 5496
13:04:15.383430 IP 10.0.2.15.51600 > 99.84.126.86.443: Flags [.], ack 277968, win 65535, length 0
13:04:15.383612 IP 99.84.126.86.443 > 10.0.2.15.51600: Flags [P.], seq 277968:282090, ack 286, win 65535, length 4122
13:04:15.383619 IP 10.0.2.15.51600 > 99.84.126.86.443: Flags [.], ack 282090, win 65535, length 0
13:04:15.383720 IP 99.84.126.86.443 > 10.0.2.15.51600: Flags [P.], seq 282090:283464, ack 286, win 65535, length 1374
13:04:15.383726 IP 10.0.2.15.51600 > 99.84.126.86.443: Flags [.], ack 283464, win 65535, length 0
13:04:15.384761 IP 99.84.126.86.443 > 10.0.2.15.51600: Flags [P.], seq 283464:290334, ack 286, win 65535, length 6870
13:04:15.384765 IP 99.84.126.86.443 > 10.0.2.15.51600: Flags [P.], seq 290334:294456, ack 286, win 65535, length 4122
13:04:15.384786 IP 10.0.2.15.51600 > 99.84.126.86.443: Flags [.], ack 290334, win 65535, length 0
13:04:15.384806 IP 10.0.2.15.51600 > 99.84.126.86.443: Flags [.], ack 294456, win 65535, length 0
13:04:15.384828 IP 99.84.126.86.443 > 10.0.2.15.51600: Flags [P.], seq 294456:298578, ack 286, win 65535, length 4122
13:04:15.384834 IP 10.0.2.15.51600 > 99.84.126.86.443: Flags [.], ack 298578, win 65535, length 0
13:04:15.384987 IP 99.84.126.86.443 > 10.0.2.15.51600: Flags [P.], seq 298578:299952, ack 286, win 65535, length 1374
13:04:15.384992 IP 10.0.2.15.51600 > 99.84.126.86.443: Flags [.], ack 299952, win 65535, length 0
13:04:15.386800 IP 99.84.126.86.443 > 10.0.2.15.51600: Flags [P.], seq 299952:305448, ack 286, win 65535, length 5496
13:04:15.386802 IP 99.84.126.86.443 > 10.0.2.15.51600: Flags [P.], seq 305448:308196, ack 286, win 65535, length 2748
13:04:15.386803 IP 99.84.126.86.443 > 10.0.2.15.51600: Flags [P.], seq 308196:310944, ack 286, win 65535, length 2748
13:04:15.386820 IP 10.0.2.15.51600 > 99.84.126.86.443: Flags [.], ack 305448, win 65535, length 0
13:04:15.386840 IP 10.0.2.15.51600 > 99.84.126.86.443: Flags [.], ack 308196, win 65535, length 0
13:04:15.386847 IP 10.0.2.15.51600 > 99.84.126.86.443: Flags [.], ack 310944, win 65535, length 0
13:04:15.386918 IP 99.84.126.86.443 > 10.0.2.15.51600: Flags [P.], seq 310944:315066, ack 286, win 65535, length 4122
13:04:15.386920 IP 99.84.126.86.443 > 10.0.2.15.51600: Flags [P.], seq 315066:317814, ack 286, win 65535, length 2748
13:04:15.386922 IP 99.84.126.86.443 > 10.0.2.15.51600: Flags [P.], seq 317814:323310, ack 286, win 65535, length 5496
13:04:15.386932 IP 10.0.2.15.51600 > 99.84.126.86.443: Flags [.], ack 315066, win 65535, length 0
13:04:15.386984 IP 10.0.2.15.51600 > 99.84.126.86.443: Flags [.], ack 317814, win 65535, length 0
13:04:15.386997 IP 10.0.2.15.51600 > 99.84.126.86.443: Flags [.], ack 323310, win 65535, length 0
13:04:15.387021 IP 99.84.126.86.443 > 10.0.2.15.51600: Flags [P.], seq 323310:327432, ack 286, win 65535, length 4122
13:04:15.387022 IP 99.84.126.86.443 > 10.0.2.15.51600: Flags [P.], seq 327432:330180, ack 286, win 65535, length 2748
13:04:15.387027 IP 10.0.2.15.51600 > 99.84.126.86.443: Flags [.], ack 327432, win 65535, length 0
13:04:15.387037 IP 10.0.2.15.51600 > 99.84.126.86.443: Flags [.], ack 330180, win 65535, length 0
13:04:15.387660 IP 99.84.126.86.443 > 10.0.2.15.51600: Flags [P.], seq 330180:334302, ack 286, win 65535, length 4122
13:04:15.387662 IP 99.84.126.86.443 > 10.0.2.15.51600: Flags [P.], seq 334302:337050, ack 286, win 65535, length 2748
13:04:15.387676 IP 10.0.2.15.51600 > 99.84.126.86.443: Flags [.], ack 334302, win 65535, length 0
13:04:15.387721 IP 10.0.2.15.51600 > 99.84.126.86.443: Flags [.], ack 337050, win 65535, length 0
13:04:15.388872 IP 99.84.126.86.443 > 10.0.2.15.51600: Flags [P.], seq 337050:348042, ack 286, win 65535, length 10992
13:04:15.388888 IP 10.0.2.15.51600 > 99.84.126.86.443: Flags [.], ack 348042, win 65535, length 0
13:04:15.389189 IP 99.84.126.86.443 > 10.0.2.15.51600: Flags [P.], seq 348042:353538, ack 286, win 65535, length 5496
13:04:15.389261 IP 99.84.126.86.443 > 10.0.2.15.51600: Flags [P.], seq 353538:359034, ack 286, win 65535, length 5496
13:04:15.389279 IP 10.0.2.15.51600 > 99.84.126.86.443: Flags [.], ack 353538, win 65535, length 0
13:04:15.389336 IP 10.0.2.15.51600 > 99.84.126.86.443: Flags [.], ack 359034, win 65535, length 0
13:04:15.389958 IP 99.84.126.86.443 > 10.0.2.15.51600: Flags [P.], seq 359034:364530, ack 286, win 65535, length 5496
13:04:15.389960 IP 99.84.126.86.443 > 10.0.2.15.51600: Flags [P.], seq 364530:370026, ack 286, win 65535, length 5496
13:04:15.390067 IP 10.0.2.15.51600 > 99.84.126.86.443: Flags [.], ack 364530, win 65535, length 0
13:04:15.390088 IP 10.0.2.15.51600 > 99.84.126.86.443: Flags [.], ack 370026, win 65535, length 0
13:04:15.390149 IP 99.84.126.86.443 > 10.0.2.15.51600: Flags [P.], seq 370026:374148, ack 286, win 65535, length 4122
13:04:15.390150 IP 99.84.126.86.443 > 10.0.2.15.51600: Flags [P.], seq 374148:378270, ack 286, win 65535, length 4122
13:04:15.390156 IP 10.0.2.15.51600 > 99.84.126.86.443: Flags [.], ack 374148, win 65535, length 0
13:04:15.390168 IP 10.0.2.15.51600 > 99.84.126.86.443: Flags [.], ack 378270, win 65535, length 0
13:04:15.390405 IP 99.84.126.86.443 > 10.0.2.15.51600: Flags [P.], seq 378270:379644, ack 286, win 65535, length 1374
13:04:15.390413 IP 10.0.2.15.51600 > 99.84.126.86.443: Flags [.], ack 379644, win 65535, length 0
13:04:15.391148 IP 99.84.126.86.443 > 10.0.2.15.51600: Flags [P.], seq 379644:386514, ack 286, win 65535, length 6870
13:04:15.391249 IP 10.0.2.15.51600 > 99.84.126.86.443: Flags [.], ack 386514, win 65535, length 0
13:04:15.391537 IP 99.84.126.86.443 > 10.0.2.15.51600: Flags [P.], seq 386514:392010, ack 286, win 65535, length 5496
13:04:15.391539 IP 99.84.126.86.443 > 10.0.2.15.51600: Flags [P.], seq 392010:397506, ack 286, win 65535, length 5496
13:04:15.391551 IP 10.0.2.15.51600 > 99.84.126.86.443: Flags [.], ack 392010, win 65535, length 0
13:04:15.391574 IP 10.0.2.15.51600 > 99.84.126.86.443: Flags [.], ack 397506, win 65535, length 0
13:04:15.392488 IP 99.84.126.86.443 > 10.0.2.15.51600: Flags [P.], seq 397506:403002, ack 286, win 65535, length 5496
13:04:15.392491 IP 99.84.126.86.443 > 10.0.2.15.51600: Flags [.], seq 403002:408842, ack 286, win 65535, length 5840
13:04:15.392509 IP 10.0.2.15.51600 > 99.84.126.86.443: Flags [.], ack 403002, win 65535, length 0
13:04:15.392553 IP 10.0.2.15.51600 > 99.84.126.86.443: Flags [.], ack 408842, win 65535, length 0
13:04:15.393034 IP 99.84.126.86.443 > 10.0.2.15.51600: Flags [P.], seq 408842:409872, ack 286, win 65535, length 1030
13:04:15.393037 IP 99.84.126.86.443 > 10.0.2.15.51600: Flags [P.], seq 409872:412620, ack 286, win 65535, length 2748
13:04:15.393038 IP 99.84.126.86.443 > 10.0.2.15.51600: Flags [P.], seq 412620:418116, ack 286, win 65535, length 5496
13:04:15.393056 IP 10.0.2.15.51600 > 99.84.126.86.443: Flags [.], ack 409872, win 65535, length 0
13:04:15.393079 IP 10.0.2.15.51600 > 99.84.126.86.443: Flags [.], ack 412620, win 65535, length 0
13:04:15.393092 IP 10.0.2.15.51600 > 99.84.126.86.443: Flags [.], ack 418116, win 65535, length 0
13:04:15.393466 IP 99.84.126.86.443 > 10.0.2.15.51600: Flags [P.], seq 418116:423612, ack 286, win 65535, length 5496
13:04:15.393469 IP 99.84.126.86.443 > 10.0.2.15.51600: Flags [P.], seq 423612:427734, ack 286, win 65535, length 4122
13:04:15.393470 IP 99.84.126.86.443 > 10.0.2.15.51600: Flags [P.], seq 427734:431856, ack 286, win 65535, length 4122
13:04:15.393521 IP 10.0.2.15.51600 > 99.84.126.86.443: Flags [.], ack 423612, win 65535, length 0
13:04:15.393545 IP 10.0.2.15.51600 > 99.84.126.86.443: Flags [.], ack 427734, win 65535, length 0
13:04:15.393557 IP 10.0.2.15.51600 > 99.84.126.86.443: Flags [.], ack 431856, win 65535, length 0
13:04:15.393808 IP 99.84.126.86.443 > 10.0.2.15.51600: Flags [P.], seq 431856:437352, ack 286, win 65535, length 5496
13:04:15.393818 IP 10.0.2.15.51600 > 99.84.126.86.443: Flags [.], ack 437352, win 65535, length 0
13:04:15.394652 IP 99.84.126.86.443 > 10.0.2.15.51600: Flags [P.], seq 437352:441474, ack 286, win 65535, length 4122
13:04:15.394654 IP 99.84.126.86.443 > 10.0.2.15.51600: Flags [.], seq 441474:444394, ack 286, win 65535, length 2920
13:04:15.394672 IP 10.0.2.15.51600 > 99.84.126.86.443: Flags [.], ack 441474, win 65535, length 0
13:04:15.394702 IP 10.0.2.15.51600 > 99.84.126.86.443: Flags [.], ack 444394, win 65535, length 0
13:04:15.394941 IP 99.84.126.86.443 > 10.0.2.15.51600: Flags [P.], seq 444394:446970, ack 286, win 65535, length 2576
13:04:15.394943 IP 99.84.126.86.443 > 10.0.2.15.51600: Flags [P.], seq 446970:452466, ack 286, win 65535, length 5496
13:04:15.394995 IP 10.0.2.15.51600 > 99.84.126.86.443: Flags [.], ack 446970, win 65535, length 0
13:04:15.395042 IP 10.0.2.15.51600 > 99.84.126.86.443: Flags [.], ack 452466, win 65535, length 0
13:04:15.395321 IP 99.84.126.86.443 > 10.0.2.15.51600: Flags [P.], seq 452466:456588, ack 286, win 65535, length 4122
13:04:15.395322 IP 99.84.126.86.443 > 10.0.2.15.51600: Flags [P.], seq 456588:462084, ack 286, win 65535, length 5496
13:04:15.395333 IP 10.0.2.15.51600 > 99.84.126.86.443: Flags [.], ack 456588, win 65535, length 0
13:04:15.395350 IP 10.0.2.15.51600 > 99.84.126.86.443: Flags [.], ack 462084, win 65535, length 0
13:04:15.395876 IP 99.84.126.86.443 > 10.0.2.15.51600: Flags [P.], seq 462084:466206, ack 286, win 65535, length 4122
13:04:15.395888 IP 10.0.2.15.51600 > 99.84.126.86.443: Flags [.], ack 466206, win 65535, length 0
13:04:15.397279 IP 99.84.126.86.443 > 10.0.2.15.51600: Flags [P.], seq 466206:470328, ack 286, win 65535, length 4122
13:04:15.397282 IP 99.84.126.86.443 > 10.0.2.15.51600: Flags [P.], seq 470328:473076, ack 286, win 65535, length 2748
13:04:15.397283 IP 99.84.126.86.443 > 10.0.2.15.51600: Flags [P.], seq 473076:478572, ack 286, win 65535, length 5496
13:04:15.397300 IP 10.0.2.15.51600 > 99.84.126.86.443: Flags [.], ack 470328, win 65535, length 0
13:04:15.397329 IP 10.0.2.15.51600 > 99.84.126.86.443: Flags [.], ack 473076, win 65535, length 0
13:04:15.397340 IP 10.0.2.15.51600 > 99.84.126.86.443: Flags [.], ack 478572, win 65535, length 0
13:04:15.397368 IP 99.84.126.86.443 > 10.0.2.15.51600: Flags [P.], seq 478572:482694, ack 286, win 65535, length 4122
13:04:15.397369 IP 99.84.126.86.443 > 10.0.2.15.51600: Flags [P.], seq 482694:485442, ack 286, win 65535, length 2748

