00:08:00.133239 IP 99.84.126.121.443 > 10.0.2.15.37840: Flags [.], seq 54784002:54786922, ack 2090356565, win 65535, length 2920
00:08:00.133264 IP 10.0.2.15.37840 > 99.84.126.121.443: Flags [.], ack 2920, win 62780, length 0
00:08:00.133575 IP 99.84.126.121.443 > 10.0.2.15.37840: Flags [P.], seq 2920:4122, ack 1, win 65535, length 1202
00:08:00.133595 IP 10.0.2.15.37840 > 99.84.126.121.443: Flags [.], ack 4122, win 61578, length 0
00:08:00.137148 IP 99.84.126.121.443 > 10.0.2.15.37840: Flags [P.], seq 4122:5823, ack 1, win 65535, length 1701
00:08:00.137169 IP 10.0.2.15.37840 > 99.84.126.121.443: Flags [.], ack 5823, win 62780, length 0
00:08:00.139852 IP 10.0.2.15.37840 > 99.84.126.121.443: Flags [P.], seq 1:65, ack 5823, win 62780, length 64
00:08:00.140111 IP 10.0.2.15.37840 > 99.84.126.121.443: Flags [P.], seq 65:111, ack 5823, win 62780, length 46
00:08:00.140137 IP 10.0.2.15.37840 > 99.84.126.121.443: Flags [P.], seq 111:160, ack 5823, win 62780, length 49
00:08:00.140288 IP 10.0.2.15.37840 > 99.84.126.121.443: Flags [P.], seq 160:195, ack 5823, win 62780, length 35
00:08:00.140406 IP 99.84.126.121.443 > 10.0.2.15.37840: Flags [.], ack 65, win 65535, length 0
00:08:00.140408 IP 99.84.126.121.443 > 10.0.2.15.37840: Flags [.], ack 111, win 65535, length 0
00:08:00.140408 IP 99.84.126.121.443 > 10.0.2.15.37840: Flags [.], ack 160, win 65535, length 0
00:08:00.140494 IP 10.0.2.15.37840 > 99.84.126.121.443: Flags [P.], seq 195:255, ack 5823, win 62780, length 60
00:08:00.140828 IP 99.84.126.121.443 > 10.0.2.15.37840: Flags [.], ack 195, win 65535, length 0
00:08:00.140830 IP 99.84.126.121.443 > 10.0.2.15.37840: Flags [.], ack 255, win 65535, length 0
00:08:00.153068 IP 99.84.126.121.443 > 10.0.2.15.37840: Flags [P.], seq 5823:5916, ack 255, win 65535, length 93
00:08:00.153122 IP 10.0.2.15.37840 > 99.84.126.121.443: Flags [.], ack 5916, win 62780, length 0
00:08:00.153497 IP 10.0.2.15.37840 > 99.84.126.121.443: Flags [P.], seq 255:286, ack 5916, win 62780, length 31
00:08:00.153866 IP 99.84.126.121.443 > 10.0.2.15.37840: Flags [.], ack 286, win 65535, length 0
00:08:00.195329 IP 99.84.126.121.443 > 10.0.2.15.37840: Flags [P.], seq 5916:14160, ack 286, win 65535, length 8244
00:08:00.195370 IP 10.0.2.15.37840 > 99.84.126.121.443: Flags [.], ack 14160, win 58400, length 0
00:08:00.195933 IP 99.84.126.121.443 > 10.0.2.15.37840: Flags [P.], seq 14160:19656, ack 286, win 65535, length 5496
00:08:00.195956 IP 10.0.2.15.37840 > 99.84.126.121.443: Flags [.], ack 19656, win 55480, length 0
00:08:00.198427 IP 99.84.126.121.443 > 10.0.2.15.37840: Flags [P.], seq 19656:27900, ack 286, win 65535, length 8244
00:08:00.198445 IP 10.0.2.15.37840 > 99.84.126.121.443: Flags [.], ack 27900, win 58400, length 0
00:08:00.198935 IP 99.84.126.121.443 > 10.0.2.15.37840: Flags [P.], seq 27900:30648, ack 286, win 65535, length 2748
00:08:00.198940 IP 99.84.126.121.443 > 10.0.2.15.37840: Flags [.], seq 30648:32108, ack 286, win 65535, length 1460
00:08:00.198960 IP 10.0.2.15.37840 > 99.84.126.121.443: Flags [.], ack 30648, win 56940, length 0
00:08:00.198984 IP 10.0.2.15.37840 > 99.84.126.121.443: Flags [.], ack 32108, win 55480, length 0
00:08:00.199198 IP 99.84.126.121.443 > 10.0.2.15.37840: Flags [P.], seq 32108:36144, ack 286, win 65535, length 4036
00:08:00.199200 IP 99.84.126.121.443 > 10.0.2.15.37840: Flags [P.], seq 36144:37518, ack 286, win 65535, length 1374
00:08:00.199214 IP 10.0.2.15.37840 > 99.84.126.121.443: Flags [.], ack 36144, win 52560, length 0
00:08:00.199403 IP 99.84.126.121.443 > 10.0.2.15.37840: Flags [.], seq 37518:38978, ack 286, win 65535, length 1460
00:08:00.199566 IP 99.84.126.121.443 > 10.0.2.15.37840: Flags [P.], seq 38978:39041, ack 286, win 65535, length 63
00:08:00.199681 IP 10.0.2.15.37840 > 99.84.126.121.443: Flags [.], ack 39041, win 51100, length 0
00:08:00.200855 IP 99.84.126.121.443 > 10.0.2.15.37840: Flags [P.], seq 39041:44537, ack 286, win 65535, length 5496
00:08:00.200857 IP 99.84.126.121.443 > 10.0.2.15.37840: Flags [P.], seq 44537:47285, ack 286, win 65535, length 2748
00:08:00.200876 IP 10.0.2.15.37840 > 99.84.126.121.443: Flags [.], ack 44537, win 61320, length 0
00:08:00.201054 IP 99.84.126.121.443 > 10.0.2.15.37840: Flags [P.], seq 47285:48659, ack 286, win 65535, length 1374
00:08:00.201199 IP 10.0.2.15.37840 > 99.84.126.121.443: Flags [.], ack 48659, win 58400, length 0
00:08:00.208236 IP 99.84.126.121.443 > 10.0.2.15.37840: Flags [P.], seq 48659:55529, ack 286, win 65535, length 6870
00:08:00.208239 IP 99.84.126.121.443 > 10.0.2.15.37840: Flags [P.], seq 55529:58277, ack 286, win 65535, length 2748
00:08:00.208309 IP 10.0.2.15.37840 > 99.84.126.121.443: Flags [.], ack 55529, win 59860, length 0
00:08:00.208624 IP 99.84.126.121.443 > 10.0.2.15.37840: Flags [P.], seq 58277:59651, ack 286, win 65535, length 1374
00:08:00.208648 IP 10.0.2.15.37840 > 99.84.126.121.443: Flags [.], ack 58277, win 58400, length 0
00:08:00.208821 IP 10.0.2.15.37840 > 99.84.126.121.443: Flags [.], ack 59651, win 62780, length 0
00:08:00.209316 IP 99.84.126.121.443 > 10.0.2.15.37840: Flags [P.], seq 59651:63773, ack 286, win 65535, length 4122
00:08:00.209505 IP 10.0.2.15.37840 > 99.84.126.121.443: Flags [.], ack 63773, win 62780, length 0
00:08:00.209583 IP 99.84.126.121.443 > 10.0.2.15.37840: Flags [P.], seq 63773:66521, ack 286, win 65535, length 2748
00:08:00.209619 IP 10.0.2.15.37840 > 99.84.126.121.443: Flags [.], ack 66521, win 62780, length 0
00:08:00.211337 IP 99.84.126.121.443 > 10.0.2.15.37840: Flags [P.], seq 66521:70643, ack 286, win 65535, length 4122
00:08:00.211469 IP 10.0.2.15.37840 > 99.84.126.121.443: Flags [.], ack 70643, win 62780, length 0
00:08:00.211701 IP 99.84.126.121.443 > 10.0.2.15.37840: Flags [P.], seq 70643:73391, ack 286, win 65535, length 2748
00:08:00.211714 IP 10.0.2.15.37840 > 99.84.126.121.443: Flags [.], ack 73391, win 65535, length 0
00:08:00.212957 IP 99.84.126.121.443 > 10.0.2.15.37840: Flags [P.], seq 73391:77513, ack 286, win 65535, length 4122
00:08:00.212978 IP 10.0.2.15.37840 > 99.84.126.121.443: Flags [.], ack 77513, win 65535, length 0
00:08:00.213317 IP 99.84.126.121.443 > 10.0.2.15.37840: Flags [P.], seq 77513:81635, ack 286, win 65535, length 4122
00:08:00.213335 IP 10.0.2.15.37840 > 99.84.126.121.443: Flags [.], ack 81635, win 65535, length 0
00:08:00.213700 IP 99.84.126.121.443 > 10.0.2.15.37840: Flags [P.], seq 81635:84383, ack 286, win 65535, length 2748
00:08:00.213713 IP 10.0.2.15.37840 > 99.84.126.121.443: Flags [.], ack 84383, win 65535, length 0
00:08:00.213874 IP 99.84.126.121.443 > 10.0.2.15.37840: Flags [P.], seq 84383:87131, ack 286, win 65535, length 2748
00:08:00.213887 IP 10.0.2.15.37840 > 99.84.126.121.443: Flags [.], ack 87131, win 65535, length 0
00:08:00.215089 IP 99.84.126.121.443 > 10.0.2.15.37840: Flags [P.], seq 87131:91253, ack 286, win 65535, length 4122
00:08:00.215092 IP 99.84.126.121.443 > 10.0.2.15.37840: Flags [P.], seq 91253:94001, ack 286, win 65535, length 2748
00:08:00.215151 IP 10.0.2.15.37840 > 99.84.126.121.443: Flags [.], ack 91253, win 65535, length 0
00:08:00.215302 IP 10.0.2.15.37840 > 99.84.126.121.443: Flags [.], ack 94001, win 65535, length 0
00:08:00.215577 IP 99.84.126.121.443 > 10.0.2.15.37840: Flags [P.], seq 94001:96749, ack 286, win 65535, length 2748
00:08:00.215579 IP 99.84.126.121.443 > 10.0.2.15.37840: Flags [P.], seq 96749:98123, ack 286, win 65535, length 1374
00:08:00.215590 IP 10.0.2.15.37840 > 99.84.126.121.443: Flags [.], ack 96749, win 65535, length 0
00:08:00.215605 IP 10.0.2.15.37840 > 99.84.126.121.443: Flags [.], ack 98123, win 65535, length 0
00:08:00.215820 IP 99.84.126.121.443 > 10.0.2.15.37840: Flags [P.], seq 98123:99497, ack 286, win 65535, length 1374
00:08:00.215827 IP 10.0.2.15.37840 > 99.84.126.121.443: Flags [.], ack 99497, win 65535, length 0
00:08:00.217499 IP 99.84.126.121.443 > 10.0.2.15.37840: Flags [P.], seq 99497:104993, ack 286, win 65535, length 5496
00:08:00.217522 IP 10.0.2.15.37840 > 99.84.126.121.443: Flags [.], ack 104993, win 65535, length 0
00:08:00.217995 IP 99.84.126.121.443 > 10.0.2.15.37840: Flags [P.], seq 104993:107741, ack 286, win 65535, length 2748
00:08:00.218032 IP 10.0.2.15.37840 > 99.84.126.121.443: Flags [.], ack 107741, win 65535, length 0
00:08:00.218192 IP 99.84.126.121.443 > 10.0.2.15.37840: Flags [P.], seq 107741:113237, ack 286, win 65535, length 5496
00:08:00.218216 IP 10.0.2.15.37840 > 99.84.126.121.443: Flags [.], ack 113237, win 65535, length 0
00:08:00.218445 IP 99.84.126.121.443 > 10.0.2.15.37840: Flags [P.], seq 113237:114611, ack 286, win 65535, length 1374
00:08:00.218529 IP 10.0.2.15.37840 > 99.84.126.121.443: Flags [.], ack 114611, win 65535, length 0
00:08:00.219767 IP 99.84.126.121.443 > 10.0.2.15.37840: Flags [P.], seq 114611:121481, ack 286, win 65535, length 6870
00:08:00.219793 IP 10.0.2.15.37840 > 99.84.126.121.443: Flags [.], ack 121481, win 65535, length 0
00:08:00.220136 IP 99.84.126.121.443 > 10.0.2.15.37840: Flags [P.], seq 121481:122855, ack 286, win 65535, length 1374
00:08:00.220141 IP 99.84.126.121.443 > 10.0.2.15.37840: Flags [P.], seq 122855:126977, ack 286, win 65535, length 4122
00:08:00.220161 IP 10.0.2.15.37840 > 99.84.126.121.443: Flags [.], ack 122855, win 65535, length 0
00:08:00.220187 IP 10.0.2.15.37840 > 99.84.126.121.443: Flags [.], ack 126977, win 65535, length 0
00:08:00.221521 IP 99.84.126.121.443 > 10.0.2.15.37840: Flags [P.], seq 126977:131099, ack 286, win 65535, length 4122
00:08:00.221655 IP 10.0.2.15.37840 > 99.84.126.121.443: Flags [.], ack 131099, win 65535, length 0
00:08:00.222040 IP 99.84.126.121.443 > 10.0.2.15.37840: Flags [P.], seq 131099:136595, ack 286, win 65535, length 5496
00:08:00.222094 IP 99.84.126.121.443 > 10.0.2.15.37840: Flags [P.], seq 136595:139343, ack 286, win 65535, length 2748
00:08:00.222112 IP 10.0.2.15.37840 > 99.84.126.121.443: Flags [.], ack 136595, win 65535, length 0
00:08:00.222133 IP 10.0.2.15.37840 > 99.84.126.121.443: Flags [.], ack 139343, win 65535, length 0
00:08:00.222366 IP 99.84.126.121.443 > 10.0.2.15.37840: Flags [P.], seq 139343:142091, ack 286, win 65535, length 2748
00:08:00.222367 IP 99.84.126.121.443 > 10.0.2.15.37840: Flags [P.], seq 142091:143465, ack 286, win 65535, length 1374
00:08:00.222376 IP 10.0.2.15.37840 > 99.84.126.121.443: Flags [.], ack 142091, win 65535, length 0
00:08:00.222396 IP 10.0.2.15.37840 > 99.84.126.121.443: Flags [.], ack 143465, win 65535, length 0
00:08:00.227464 IP 99.84.126.121.443 > 10.0.2.15.37840: Flags [P.], seq 143465:148961, ack 286, win 65535, length 5496
00:08:00.227468 IP 99.84.126.121.443 > 10.0.2.15.37840: Flags [P.], seq 148961:151709, ack 286, win 65535, length 2748
00:08:00.227469 IP 99.84.126.121.443 > 10.0.2.15.37840: Flags [P.], seq 151709:154457, ack 286, win 65535, length 2748
00:08:00.227496 IP 10.0.2.15.37840 > 99.84.126.121.443: Flags [.], ack 148961, win 65535, length 0
00:08:00.227746 IP 10.0.2.15.37840 > 99.84.126.121.443: Flags [.], ack 151709, win 65535, length 0
00:08:00.228466 IP 10.0.2.15.37840 > 99.84.126.121.443: Flags [.], ack 154457, win 65535, length 0
00:08:00.230856 IP 99.84.126.121.443 > 10.0.2.15.37840: Flags [P.], seq 154457:157205, ack 286, win 65535, length 2748
00:08:00.230859 IP 99.84.126.121.443 > 10.0.2.15.37840: Flags [P.], seq 157205:158579, ack 286, win 65535, length 1374
00:08:00.230861 IP 99.84.126.121.443 > 10.0.2.15.37840: Flags [P.], seq 158579:159953, ack 286, win 65535, length 1374
00:08:00.230863 IP 99.84.126.121.443 > 10.0.2.15.37840: Flags [P.], seq 159953:164075, ack 286, win 65535, length 4122
00:08:00.230864 IP 99.84.126.121.443 > 10.0.2.15.37840: Flags [P.], seq 164075:168197, ack 286, win 65535, length 4122
00:08:00.230891 IP 10.0.2.15.37840 > 99.84.126.121.443: Flags [.], ack 157205, win 65535, length 0
00:08:00.231124 IP 10.0.2.15.37840 > 99.84.126.121.443: Flags [.], ack 158579, win 65535, length 0
00:08:00.231732 IP 10.0.2.15.37840 > 99.84.126.121.443: Flags [.], ack 159953, win 65535, length 0
00:08:00.231761 IP 10.0.2.15.37840 > 99.84.126.121.443: Flags [.], ack 164075, win 65535, length 0
00:08:00.231774 IP 10.0.2.15.37840 > 99.84.126.121.443: Flags [.], ack 168197, win 65535, length 0
00:08:00.231800 IP 99.84.126.121.443 > 10.0.2.15.37840: Flags [P.], seq 168197:172319, ack 286, win 65535, length 4122
00:08:00.231802 IP 99.84.126.121.443 > 10.0.2.15.37840: Flags [P.], seq 172319:176441, ack 286, win 65535, length 4122
00:08:00.231803 IP 99.84.126.121.443 > 10.0.2.15.37840: Flags [P.], seq 176441:177815, ack 286, win 65535, length 1374
00:08:00.231804 IP 99.84.126.121.443 > 10.0.2.15.37840: Flags [P.], seq 177815:181937, ack 286, win 65535, length 4122
00:08:00.231815 IP 10.0.2.15.37840 > 99.84.126.121.443: Flags [.], ack 172319, win 65535, length 0
00:08:00.231831 IP 10.0.2.15.37840 > 99.84.126.121.443: Flags [.], ack 176441, win 65535, length 0
00:08:00.231842 IP 10.0.2.15.37840 > 99.84.126.121.443: Flags [.], ack 177815, win 65535, length 0
00:08:00.231854 IP 10.0.2.15.37840 > 99.84.126.121.443: Flags [.], ack 181937, win 65535, length 0
00:08:00.231884 IP 99.84.126.121.443 > 10.0.2.15.37840: Flags [P.], seq 181937:186059, ack 286, win 65535, length 4122
00:08:00.231885 IP 99.84.126.121.443 > 10.0.2.15.37840: Flags [P.], seq 186059:194303, ack 286, win 65535, length 8244
00:08:00.231890 IP 10.0.2.15.37840 > 99.84.126.121.443: Flags [.], ack 186059, win 65535, length 0
00:08:00.231960 IP 10.0.2.15.37840 > 99.84.126.121.443: Flags [.], ack 194303, win 65535, length 0
00:08:00.233068 IP 99.84.126.121.443 > 10.0.2.15.37840: Flags [P.], seq 194303:208043, ack 286, win 65535, length 13740
00:08:00.233089 IP 10.0.2.15.37840 > 99.84.126.121.443: Flags [.], ack 208043, win 65535, length 0
00:08:00.233156 IP 99.84.126.121.443 > 10.0.2.15.37840: Flags [P.], seq 208043:212165, ack 286, win 65535, length 4122
00:08:00.233158 IP 99.84.126.121.443 > 10.0.2.15.37840: Flags [P.], seq 212165:214913, ack 286, win 65535, length 2748
00:08:00.233159 IP 99.84.126.121.443 > 10.0.2.15.37840: Flags [P.], seq 214913:217661, ack 286, win 65535, length 2748
00:08:00.233170 IP 10.0.2.15.37840 > 99.84.126.121.443: Flags [.], ack 212165, win 65535, length 0
00:08:00.233189 IP 10.0.2.15.37840 > 99.84.126.121.443: Flags [.], ack 214913, win 65535, length 0
00:08:00.233202 IP 10.0.2.15.37840 > 99.84.126.121.443: Flags [.], ack 217661, win 65535, length 0
00:08:00.233937 IP 99.84.126.121.443 > 10.0.2.15.37840: Flags [P.], seq 217661:221783, ack 286, win 65535, length 4122
00:08:00.233953 IP 10.0.2.15.37840 > 99.84.126.121.443: Flags [.], ack 221783, win 65535, length 0
00:08:00.234601 IP 99.84.126.121.443 > 10.0.2.15.37840: Flags [P.], seq 221783:225905, ack 286, win 65535, length 4122
00:08:00.234604 IP 99.84.126.121.443 > 10.0.2.15.37840: Flags [P.], seq 225905:228653, ack 286, win 65535, length 2748
00:08:00.234605 IP 99.84.126.121.443 > 10.0.2.15.37840: Flags [P.], seq 228653:231401, ack 286, win 65535, length 2748
00:08:00.234620 IP 10.0.2.15.37840 > 99.84.126.121.443: Flags [.], ack 225905, win 65535, length 0
00:08:00.234637 IP 10.0.2.15.37840 > 99.84.126.121.443: Flags [.], ack 228653, win 65535, length 0
00:08:00.234650 IP 10.0.2.15.37840 > 99.84.126.121.443: Flags [.], ack 231401, win 65535, length 0
00:08:00.234810 IP 99.84.126.121.443 > 10.0.2.15.37840: Flags [P.], seq 231401:234149, ack 286, win 65535, length 2748
00:08:00.234817 IP 10.0.2.15.37840 > 99.84.126.121.443: Flags [.], ack 234149, win 65535, length 0
00:08:00.235102 IP 99.84.126.121.443 > 10.0.2.15.37840: Flags [P.], seq 234149:235523, ack 286, win 65535, length 1374
00:08:00.235115 IP 10.0.2.15.37840 > 99.84.126.121.443: Flags [.], ack 235523, win 65535, length 0
00:08:00.235952 IP 99.84.126.121.443 > 10.0.2.15.37840: Flags [P.], seq 235523:238271, ack 286, win 65535, length 2748
00:08:00.235969 IP 10.0.2.15.37840 > 99.84.126.121.443: Flags [.], ack 238271, win 65535, length 0
00:08:00.236359 IP 99.84.126.121.443 > 10.0.2.15.37840: Flags [P.], seq 238271:242393, ack 286, win 65535, length 4122
00:08:00.236362 IP 99.84.126.121.443 > 10.0.2.15.37840: Flags [.], seq 242393:245313, ack 286, win 65535, length 2920
00:08:00.236411 IP 10.0.2.15.37840 > 99.84.126.121.443: Flags [.], ack 242393, win 65535, length 0
00:08:00.236510 IP 10.0.2.15.37840 > 99.84.126.121.443: Flags [.], ack 245313, win 65535, length 0
00:08:00.236672 IP 99.84.126.121.443 > 10.0.2.15.37840: Flags [P.], seq 245313:246515, ack 286, win 65535, length 1202
00:08:00.236674 IP 99.84.126.121.443 > 10.0.2.15.37840: Flags [P.], seq 246515:250637, ack 286, win 65535, length 4122
00:08:00.236688 IP 10.0.2.15.37840 > 99.84.126.121.443: Flags [.], ack 246515, win 65535, length 0
00:08:00.236704 IP 10.0.2.15.37840 > 99.84.126.121.443: Flags [.], ack 250637, win 65535, length 0
00:08:00.236889 IP 99.84.126.121.443 > 10.0.2.15.37840: Flags [P.], seq 250637:253385, ack 286, win 65535, length 2748
00:08:00.236902 IP 10.0.2.15.37840 > 99.84.126.121.443: Flags [.], ack 253385, win 65535, length 0
00:08:00.237274 IP 99.84.126.121.443 > 10.0.2.15.37840: Flags [P.], seq 253385:256133, ack 286, win 65535, length 2748
00:08:00.237284 IP 10.0.2.15.37840 > 99.84.126.121.443: Flags [.], ack 256133, win 65535, length 0
00:08:00.237795 IP 99.84.126.121.443 > 10.0.2.15.37840: Flags [P.], seq 256133:260255, ack 286, win 65535, length 4122
00:08:00.237814 IP 10.0.2.15.37840 > 99.84.126.121.443: Flags [.], ack 260255, win 65535, length 0
00:08:00.238206 IP 99.84.126.121.443 > 10.0.2.15.37840: Flags [P.], seq 260255:263003, ack 286, win 65535, length 2748
00:08:00.238219 IP 10.0.2.15.37840 > 99.84.126.121.443: Flags [.], ack 263003, win 65535, length 0
00:08:00.238574 IP 99.84.126.121.443 > 10.0.2.15.37840: Flags [P.], seq 263003:267125, ack 286, win 65535, length 4122
00:08:00.238589 IP 10.0.2.15.37840 > 99.84.126.121.443: Flags [.], ack 267125, win 65535, length 0
00:08:00.238903 IP 99.84.126.121.443 > 10.0.2.15.37840: Flags [P.], seq 267125:271247, ack 286, win 65535, length 4122
00:08:00.238916 IP 10.0.2.15.37840 > 99.84.126.121.443: Flags [.], ack 271247, win 65535, length 0
00:08:00.239244 IP 99.84.126.121.443 > 10.0.2.15.37840: Flags [P.], seq 271247:275369, ack 286, win 65535, length 4122
00:08:00.239256 IP 10.0.2.15.37840 > 99.84.126.121.443: Flags [.], ack 275369, win 65535, length 0
00:08:00.239614 IP 99.84.126.121.443 > 10.0.2.15.37840: Flags [P.], seq 275369:279491, ack 286, win 65535, length 4122
00:08:00.239678 IP 10.0.2.15.37840 > 99.84.126.121.443: Flags [.], ack 279491, win 65535, length 0
00:08:00.239892 IP 99.84.126.121.443 > 10.0.2.15.37840: Flags [P.], seq 279491:282239, ack 286, win 65535, length 2748
00:08:00.239902 IP 10.0.2.15.37840 > 99.84.126.121.443: Flags [.], ack 282239, win 65535, length 0
00:08:00.243976 IP 99.84.126.121.443 > 10.0.2.15.37840: Flags [P.], seq 282239:286361, ack 286, win 65535, length 4122
00:08:00.243980 IP 99.84.126.121.443 > 10.0.2.15.37840: Flags [P.], seq 286361:289109, ack 286, win 65535, length 2748
00:08:00.244005 IP 10.0.2.15.37840 > 99.84.126.121.443: Flags [.], ack 286361, win 65535, length 0
00:08:00.244163 IP 10.0.2.15.37840 > 99.84.126.121.443: Flags [.], ack 289109, win 65535, length 0
00:08:00.244437 IP 99.84.126.121.443 > 10.0.2.15.37840: Flags [P.], seq 289109:294605, ack 286, win 65535, length 5496
00:08:00.244456 IP 10.0.2.15.37840 > 99.84.126.121.443: Flags [.], ack 294605, win 65535, length 0
00:08:00.244642 IP 99.84.126.121.443 > 10.0.2.15.37840: Flags [P.], seq 294605:300101, ack 286, win 65535, length 5496
00:08:00.244654 IP 10.0.2.15.37840 > 99.84.126.121.443: Flags [.], ack 300101, win 65535, length 0
00:08:00.244971 IP 99.84.126.121.443 > 10.0.2.15.37840: Flags [P.], seq 300101:305597, ack 286, win 65535, length 5496
00:08:00.244987 IP 10.0.2.15.37840 > 99.84.126.121.443: Flags [.], ack 305597, win 65535, length 0
00:08:00.245500 IP 99.84.126.121.443 > 10.0.2.15.37840: Flags [P.], seq 305597:309719, ack 286, win 65535, length 4122
00:08:00.245761 IP 10.0.2.15.37840 > 99.84.126.121.443: Flags [.], ack 309719, win 65535, length 0
00:08:00.246521 IP 99.84.126.121.443 > 10.0.2.15.37840: Flags [P.], seq 309719:312467, ack 286, win 65535, length 2748
00:08:00.246525 IP 99.84.126.121.443 > 10.0.2.15.37840: Flags [P.], seq 312467:320711, ack 286, win 65535, length 8244
00:08:00.246551 IP 10.0.2.15.37840 > 99.84.126.121.443: Flags [.], ack 312467, win 65535, length 0
00:08:00.246671 IP 10.0.2.15.37840 > 99.84.126.121.443: Flags [.], ack 320711, win 65535, length 0
00:08:00.246705 IP 99.84.126.121.443 > 10.0.2.15.37840: Flags [P.], seq 320711:323459, ack 286, win 65535, length 2748
00:08:00.246707 IP 99.84.126.121.443 > 10.0.2.15.37840: Flags [P.], seq 323459:324833, ack 286, win 65535, length 1374
00:08:00.246715 IP 10.0.2.15.37840 > 99.84.126.121.443: Flags [.], ack 323459, win 65535, length 0
00:08:00.246727 IP 10.0.2.15.37840 > 99.84.126.121.443: Flags [.], ack 324833, win 65535, length 0
00:08:00.246942 IP 99.84.126.121.443 > 10.0.2.15.37840: Flags [P.], seq 324833:328955, ack 286, win 65535, length 4122
00:08:00.246953 IP 10.0.2.15.37840 > 99.84.126.121.443: Flags [.], ack 328955, win 65535, length 0
00:08:00.247972 IP 99.84.126.121.443 > 10.0.2.15.37840: Flags [P.], seq 328955:333077, ack 286, win 65535, length 4122
00:08:00.247975 IP 99.84.126.121.443 > 10.0.2.15.37840: Flags [P.], seq 333077:335825, ack 286, win 65535, length 2748
00:08:00.247999 IP 10.0.2.15.37840 > 99.84.126.121.443: Flags [.], ack 333077, win 65535, length 0
00:08:00.248030 IP 10.0.2.15.37840 > 99.84.126.121.443: Flags [.], ack 335825, win 65535, length 0
00:08:00.248296 IP 99.84.126.121.443 > 10.0.2.15.37840: Flags [P.], seq 335825:338573, ack 286, win 65535, length 2748
00:08:00.248348 IP 10.0.2.15.37840 > 99.84.126.121.443: Flags [.], ack 338573, win 65535, length 0
00:08:00.248661 IP 99.84.126.121.443 > 10.0.2.15.37840: Flags [P.], seq 338573:341321, ack 286, win 65535, length 2748
00:08:00.248677 IP 10.0.2.15.37840 > 99.84.126.121.443: Flags [.], ack 341321, win 65535, length 0
00:08:00.249307 IP 99.84.126.121.443 > 10.0.2.15.37840: Flags [P.], seq 341321:345443, ack 286, win 65535, length 4122
00:08:00.249310 IP 99.84.126.121.443 > 10.0.2.15.37840: Flags [P.], seq 345443:349565, ack 286, win 65535, length 4122
00:08:00.249332 IP 10.0.2.15.37840 > 99.84.126.121.443: Flags [.], ack 345443, win 65535, length 0
00:08:00.249417 IP 10.0.2.15.37840 > 99.84.126.121.443: Flags [.], ack 349565, win 65535, length 0
00:08:00.249670 IP 99.84.126.121.443 > 10.0.2.15.37840: Flags [P.], seq 349565:352313, ack 286, win 65535, length 2748
00:08:00.249679 IP 10.0.2.15.37840 > 99.84.126.121.443: Flags [.], ack 352313, win 65535, length 0
00:08:00.250446 IP 99.84.126.121.443 > 10.0.2.15.37840: Flags [P.], seq 352313:357809, ack 286, win 65535, length 5496
00:08:00.250464 IP 10.0.2.15.37840 > 99.84.126.121.443: Flags [.], ack 357809, win 65535, length 0
00:08:00.250791 IP 99.84.126.121.443 > 10.0.2.15.37840: Flags [P.], seq 357809:360557, ack 286, win 65535, length 2748
00:08:00.250805 IP 10.0.2.15.37840 > 99.84.126.121.443: Flags [.], ack 360557, win 65535, length 0
00:08:00.251091 IP 99.84.126.121.443 > 10.0.2.15.37840: Flags [P.], seq 360557:364679, ack 286, win 65535, length 4122
00:08:00.251152 IP 10.0.2.15.37840 > 99.84.126.121.443: Flags [.], ack 364679, win 65535, length 0
00:08:00.251336 IP 99.84.126.121.443 > 10.0.2.15.37840: Flags [P.], seq 364679:368801, ack 286, win 65535, length 4122
00:08:00.251348 IP 10.0.2.15.37840 > 99.84.126.121.443: Flags [.], ack 368801, win 65535, length 0
00:08:00.251624 IP 99.84.126.121.443 > 10.0.2.15.37840: Flags [P.], seq 368801:372923, ack 286, win 65535, length 4122
00:08:00.251725 IP 10.0.2.15.37840 > 99.84.126.121.443: Flags [.], ack 372923, win 65535, length 0
00:08:00.251978 IP 99.84.126.121.443 > 10.0.2.15.37840: Flags [P.], seq 372923:377045, ack 286, win 65535, length 4122
00:08:00.251987 IP 10.0.2.15.37840 > 99.84.126.121.443: Flags [.], ack 377045, win 65535, length 0
00:08:00.252234 IP 99.84.126.121.443 > 10.0.2.15.37840: Flags [P.], seq 377045:381167, ack 286, win 65535, length 4122
00:08:00.252244 IP 10.0.2.15.37840 > 99.84.126.121.443: Flags [.], ack 381167, win 65535, length 0
00:08:00.252748 IP 99.84.126.121.443 > 10.0.2.15.37840: Flags [P.], seq 381167:386663, ack 286, win 65535, length 5496
00:08:00.252765 IP 10.0.2.15.37840 > 99.84.126.121.443: Flags [.], ack 386663, win 65535, length 0
00:08:00.253254 IP 99.84.126.121.443 > 10.0.2.15.37840: Flags [P.], seq 386663:389411, ack 286, win 65535, length 2748
00:08:00.253256 IP 99.84.126.121.443 > 10.0.2.15.37840: Flags [P.], seq 389411:392159, ack 286, win 65535, length 2748
00:08:00.253279 IP 10.0.2.15.37840 > 99.84.126.121.443: Flags [.], ack 389411, win 65535, length 0
00:08:00.253374 IP 10.0.2.15.37840 > 99.84.126.121.443: Flags [.], ack 392159, win 65535, length 0
00:08:00.253684 IP 99.84.126.121.443 > 10.0.2.15.37840: Flags [P.], seq 392159:396281, ack 286, win 65535, length 4122
00:08:00.253700 IP 10.0.2.15.37840 > 99.84.126.121.443: Flags [.], ack 396281, win 65535, length 0
00:08:00.253897 IP 99.84.126.121.443 > 10.0.2.15.37840: Flags [P.], seq 396281:399029, ack 286, win 65535, length 2748
00:08:00.253913 IP 10.0.2.15.37840 > 99.84.126.121.443: Flags [.], ack 399029, win 65535, length 0
00:08:00.254833 IP 99.84.126.121.443 > 10.0.2.15.37840: Flags [P.], seq 399029:403151, ack 286, win 65535, length 4122
00:08:00.254836 IP 99.84.126.121.443 > 10.0.2.15.37840: Flags [P.], seq 403151:407273, ack 286, win 65535, length 4122
00:08:00.254858 IP 10.0.2.15.37840 > 99.84.126.121.443: Flags [.], ack 403151, win 65535, length 0
00:08:00.254889 IP 10.0.2.15.37840 > 99.84.126.121.443: Flags [.], ack 407273, win 65535, length 0
00:08:00.255232 IP 99.84.126.121.443 > 10.0.2.15.37840: Flags [P.], seq 407273:411395, ack 286, win 65535, length 4122
00:08:00.255246 IP 10.0.2.15.37840 > 99.84.126.121.443: Flags [.], ack 411395, win 65535, length 0
00:08:00.255711 IP 99.84.126.121.443 > 10.0.2.15.37840: Flags [P.], seq 411395:415517, ack 286, win 65535, length 4122
00:08:00.255727 IP 10.0.2.15.37840 > 99.84.126.121.443: Flags [.], ack 415517, win 65535, length 0
00:08:00.255966 IP 99.84.126.121.443 > 10.0.2.15.37840: Flags [P.], seq 415517:419639, ack 286, win 65535, length 4122
00:08:00.255979 IP 10.0.2.15.37840 > 99.84.126.121.443: Flags [.], ack 419639, win 65535, length 0
00:08:00.256475 IP 99.84.126.121.443 > 10.0.2.15.37840: Flags [P.], seq 419639:423761, ack 286, win 65535, length 4122
00:08:00.256491 IP 10.0.2.15.37840 > 99.84.126.121.443: Flags [.], ack 423761, win 65535, length 0
00:08:00.256661 IP 99.84.126.121.443 > 10.0.2.15.37840: Flags [P.], seq 423761:429257, ack 286, win 65535, length 5496
00:08:00.256671 IP 10.0.2.15.37840 > 99.84.126.121.443: Flags [.], ack 429257, win 65535, length 0
00:08:00.257359 IP 99.84.126.121.443 > 10.0.2.15.37840: Flags [P.], seq 429257:432005, ack 286, win 65535, length 2748
00:08:00.257379 IP 10.0.2.15.37840 > 99.84.126.121.443: Flags [.], ack 432005, win 65535, length 0
00:08:00.257587 IP 99.84.126.121.443 > 10.0.2.15.37840: Flags [P.], seq 432005:436127, ack 286, win 65535, length 4122
00:08:00.257590 IP 99.84.126.121.443 > 10.0.2.15.37840: Flags [P.], seq 436127:438875, ack 286, win 65535, length 2748
00:08:00.257607 IP 10.0.2.15.37840 > 99.84.126.121.443: Flags [.], ack 436127, win 65535, length 0
00:08:00.257628 IP 10.0.2.15.37840 > 99.84.126.121.443: Flags [.], ack 438875, win 65535, length 0
00:08:00.258141 IP 99.84.126.121.443 > 10.0.2.15.37840: Flags [P.], seq 438875:444371, ack 286, win 65535, length 5496
00:08:00.258197 IP 10.0.2.15.37840 > 99.84.126.121.443: Flags [.], ack 444371, win 65535, length 0
00:08:00.258395 IP 99.84.126.121.443 > 10.0.2.15.37840: Flags [P.], seq 444371:445745, ack 286, win 65535, length 1374
00:08:00.258406 IP 10.0.2.15.37840 > 99.84.126.121.443: Flags [.], ack 445745, win 65535, length 0
00:08:00.259959 IP 99.84.126.121.443 > 10.0.2.15.37840: Flags [P.], seq 445745:451241, ack 286, win 65535, length 5496
00:08:00.259963 IP 99.84.126.121.443 > 10.0.2.15.37840: Flags [P.], seq 451241:453989, ack 286, win 65535, length 2748
00:08:00.259990 IP 10.0.2.15.37840 > 99.84.126.121.443: Flags [.], ack 451241, win 65535, length 0
00:08:00.260035 IP 10.0.2.15.37840 > 99.84.126.121.443: Flags [.], ack 453989, win 65535, length 0
00:08:00.261521 IP 99.84.126.121.443 > 10.0.2.15.37840: Flags [P.], seq 453989:459485, ack 286, win 65535, length 5496
00:08:00.261526 IP 99.84.126.121.443 > 10.0.2.15.37840: Flags [P.], seq 459485:466355, ack 286, win 65535, length 6870
00:08:00.261552 IP 10.0.2.15.37840 > 99.84.126.121.443: Flags [.], ack 459485, win 65535, length 0
00:08:00.261663 IP 10.0.2.15.37840 > 99.84.126.121.443: Flags [.], ack 466355, win 65535, length 0
00:08:00.261947 IP 99.84.126.121.443 > 10.0.2.15.37840: Flags [P.], seq 466355:469103, ack 286, win 65535, length 2748
00:08:00.261960 IP 10.0.2.15.37840 > 99.84.126.121.443: Flags [.], ack 469103, win 65535, length 0
00:08:00.265455 IP 99.84.126.121.443 > 10.0.2.15.37840: Flags [P.], seq 469103:475973, ack 286, win 65535, length 6870
00:08:00.265461 IP 99.84.126.121.443 > 10.0.2.15.37840: Flags [.], seq 475973:477433, ack 286, win 65535, length 1460
00:08:00.265504 IP 10.0.2.15.37840 > 99.84.126.121.443: Flags [.], ack 475973, win 65535, length 0
00:08:00.265541 IP 10.0.2.15.37840 > 99.84.126.121.443: Flags [.], ack 477433, win 65535, length 0
00:08:00.268624 IP 99.84.126.121.443 > 10.0.2.15.37840: Flags [P.], seq 477433:481469, ack 286, win 65535, length 4036
00:08:00.268645 IP 99.84.126.121.443 > 10.0.2.15.37840: Flags [.], seq 481469:494609, ack 286, win 65535, length 13140
00:08:00.268672 IP 10.0.2.15.37840 > 99.84.126.121.443: Flags [.], ack 481469, win 65535, length 0
00:08:00.268696 IP 10.0.2.15.37840 > 99.84.126.121.443: Flags [.], ack 494609, win 65535, length 0
00:08:00.268870 IP 99.84.126.121.443 > 10.0.2.15.37840: Flags [P.], seq 494609:507575, ack 286, win 65535, length 12966
00:08:00.268889 IP 10.0.2.15.37840 > 99.84.126.121.443: Flags [.], ack 507575, win 65535, length 0
00:08:00.269826 IP 99.84.126.121.443 > 10.0.2.15.37840: Flags [.], seq 507575:546995, ack 286, win 65535, length 39420
00:08:00.269855 IP 10.0.2.15.37840 > 99.84.126.121.443: Flags [.], ack 546995, win 65535, length 0
00:08:00.270069 IP 99.84.126.121.443 > 10.0.2.15.37840: Flags [P.], seq 546995:559787, ack 286, win 65535, length 12792
00:08:00.270089 IP 10.0.2.15.37840 > 99.84.126.121.443: Flags [.], ack 559787, win 65535, length 0
00:08:00.270340 IP 99.84.126.121.443 > 10.0.2.15.37840: Flags [P.], seq 559787:566657, ack 286, win 65535, length 6870
00:08:00.270385 IP 10.0.2.15.37840 > 99.84.126.121.443: Flags [.], ack 566657, win 65535, length 0
00:08:00.271228 IP 99.84.126.121.443 > 10.0.2.15.37840: Flags [P.], seq 566657:570779, ack 286, win 65535, length 4122
00:08:00.271251 IP 10.0.2.15.37840 > 99.84.126.121.443: Flags [.], ack 570779, win 65535, length 0
00:08:00.271511 IP 99.84.126.121.443 > 10.0.2.15.37840: Flags [P.], seq 570779:577649, ack 286, win 65535, length 6870
00:08:00.271513 IP 99.84.126.121.443 > 10.0.2.15.37840: Flags [P.], seq 577649:580397, ack 286, win 65535, length 2748
00:08:00.271629 IP 10.0.2.15.37840 > 99.84.126.121.443: Flags [.], ack 577649, win 65535, length 0
00:08:00.271701 IP 10.0.2.15.37840 > 99.84.126.121.443: Flags [.], ack 580397, win 65535, length 0
00:08:00.272048 IP 99.84.126.121.443 > 10.0.2.15.37840: Flags [P.], seq 580397:583145, ack 286, win 65535, length 2748
00:08:00.272132 IP 99.84.126.121.443 > 10.0.2.15.37840: Flags [P.], seq 583145:585893, ack 286, win 65535, length 2748
00:08:00.272151 IP 10.0.2.15.37840 > 99.84.126.121.443: Flags [.], ack 583145, win 65535, length 0
00:08:00.272237 IP 10.0.2.15.37840 > 99.84.126.121.443: Flags [.], ack 585893, win 65535, length 0
00:08:00.272383 IP 99.84.126.121.443 > 10.0.2.15.37840: Flags [P.], seq 585893:590015, ack 286, win 65535, length 4122
00:08:00.272385 IP 99.84.126.121.443 > 10.0.2.15.37840: Flags [P.], seq 590015:592763, ack 286, win 65535, length 2748
00:08:00.272397 IP 10.0.2.15.37840 > 99.84.126.121.443: Flags [.], ack 590015, win 65535, length 0
00:08:00.272414 IP 10.0.2.15.37840 > 99.84.126.121.443: Flags [.], ack 592763, win 65535, length 0
00:08:00.273399 IP 99.84.126.121.443 > 10.0.2.15.37840: Flags [P.], seq 592763:596885, ack 286, win 65535, length 4122
00:08:00.273404 IP 99.84.126.121.443 > 10.0.2.15.37840: Flags [P.], seq 596885:599633, ack 286, win 65535, length 2748
00:08:00.273405 IP 99.84.126.121.443 > 10.0.2.15.37840: Flags [P.], seq 599633:602381, ack 286, win 65535, length 2748
00:08:00.273433 IP 10.0.2.15.37840 > 99.84.126.121.443: Flags [.], ack 596885, win 65535, length 0
00:08:00.273507 IP 10.0.2.15.37840 > 99.84.126.121.443: Flags [.], ack 599633, win 65535, length 0
00:08:00.273524 IP 10.0.2.15.37840 > 99.84.126.121.443: Flags [.], ack 602381, win 65535, length 0
00:08:00.273650 IP 99.84.126.121.443 > 10.0.2.15.37840: Flags [P.], seq 602381:605129, ack 286, win 65535, length 2748
00:08:00.273658 IP 10.0.2.15.37840 > 99.84.126.121.443: Flags [.], ack 605129, win 65535, length 0
00:08:00.274226 IP 99.84.126.121.443 > 10.0.2.15.37840: Flags [.], seq 605129:606589, ack 286, win 65535, length 1460
00:08:00.274242 IP 10.0.2.15.37840 > 99.84.126.121.443: Flags [.], ack 606589, win 65535, length 0
00:08:00.274426 IP 99.84.126.121.443 > 10.0.2.15.37840: Flags [P.], seq 606589:607877, ack 286, win 65535, length 1288
00:08:00.274428 IP 99.84.126.121.443 > 10.0.2.15.37840: Flags [P.], seq 607877:609251, ack 286, win 65535, length 1374
00:08:00.274443 IP 10.0.2.15.37840 > 99.84.126.121.443: Flags [.], ack 607877, win 65535, length 0
00:08:00.274508 IP 10.0.2.15.37840 > 99.84.126.121.443: Flags [.], ack 609251, win 65535, length 0
00:08:00.274902 IP 99.84.126.121.443 > 10.0.2.15.37840: Flags [P.], seq 609251:614747, ack 286, win 65535, length 5496
00:08:00.274923 IP 10.0.2.15.37840 > 99.84.126.121.443: Flags [.], ack 614747, win 65535, length 0
00:08:00.275656 IP 99.84.126.121.443 > 10.0.2.15.37840: Flags [P.], seq 614747:621617, ack 286, win 65535, length 6870
00:08:00.275938 IP 10.0.2.15.37840 > 99.84.126.121.443: Flags [.], ack 621617, win 65535, length 0
00:08:00.279068 IP 99.84.126.121.443 > 10.0.2.15.37840: Flags [P.], seq 621617:625739, ack 286, win 65535, length 4122
00:08:00.279072 IP 99.84.126.121.443 > 10.0.2.15.37840: Flags [P.], seq 625739:632609, ack 286, win 65535, length 6870
00:08:00.279097 IP 10.0.2.15.37840 > 99.84.126.121.443: Flags [.], ack 625739, win 65535, length 0
00:08:00.279133 IP 10.0.2.15.37840 > 99.84.126.121.443: Flags [.], ack 632609, win 65535, length 0
00:08:00.279226 IP 99.84.126.121.443 > 10.0.2.15.37840: Flags [P.], seq 632609:635357, ack 286, win 65535, length 2748
00:08:00.279231 IP 99.84.126.121.443 > 10.0.2.15.37840: Flags [P.], seq 635357:644975, ack 286, win 65535, length 9618
00:08:00.279240 IP 10.0.2.15.37840 > 99.84.126.121.443: Flags [.], ack 635357, win 65535, length 0
00:08:00.279252 IP 10.0.2.15.37840 > 99.84.126.121.443: Flags [.], ack 644975, win 65535, length 0
00:08:00.280560 IP 99.84.126.121.443 > 10.0.2.15.37840: Flags [P.], seq 644975:653219, ack 286, win 65535, length 8244
00:08:00.280563 IP 99.84.126.121.443 > 10.0.2.15.37840: Flags [P.], seq 653219:655967, ack 286, win 65535, length 2748
00:08:00.280589 IP 10.0.2.15.37840 > 99.84.126.121.443: Flags [.], ack 653219, win 65535, length 0
00:08:00.280854 IP 10.0.2.15.37840 > 99.84.126.121.443: Flags [.], ack 655967, win 65535, length 0
00:08:00.281209 IP 99.84.126.121.443 > 10.0.2.15.37840: Flags [P.], seq 655967:683447, ack 286, win 65535, length 27480
00:08:00.281314 IP 10.0.2.15.37840 > 99.84.126.121.443: Flags [.], ack 683447, win 65535, length 0
00:08:00.281410 IP 99.84.126.121.443 > 10.0.2.15.37840: Flags [P.], seq 683447:687569, ack 286, win 65535, length 4122
00:08:00.281420 IP 10.0.2.15.37840 > 99.84.126.121.443: Flags [.], ack 687569, win 65535, length 0
00:08:00.281630 IP 99.84.126.121.443 > 10.0.2.15.37840: Flags [P.], seq 687569:690317, ack 286, win 65535, length 2748
00:08:00.281640 IP 10.0.2.15.37840 > 99.84.126.121.443: Flags [.], ack 690317, win 65535, length 0
00:08:00.281950 IP 99.84.126.121.443 > 10.0.2.15.37840: Flags [P.], seq 690317:693065, ack 286, win 65535, length 2748
00:08:00.281963 IP 10.0.2.15.37840 > 99.84.126.121.443: Flags [.], ack 693065, win 65535, length 0
00:08:00.282245 IP 99.84.126.121.443 > 10.0.2.15.37840: Flags [P.], seq 693065:695813, ack 286, win 65535, length 2748
00:08:00.282246 IP 99.84.126.121.443 > 10.0.2.15.37840: Flags [P.], seq 695813:698561, ack 286, win 65535, length 2748
00:08:00.282261 IP 10.0.2.15.37840 > 99.84.126.121.443: Flags [.], ack 695813, win 65535, length 0
00:08:00.282279 IP 10.0.2.15.37840 > 99.84.126.121.443: Flags [.], ack 698561, win 65535, length 0
00:08:00.282541 IP 99.84.126.121.443 > 10.0.2.15.37840: Flags [P.], seq 698561:701309, ack 286, win 65535, length 2748
00:08:00.282551 IP 10.0.2.15.37840 > 99.84.126.121.443: Flags [.], ack 701309, win 65535, length 0
00:08:00.282825 IP 99.84.126.121.443 > 10.0.2.15.37840: Flags [P.], seq 701309:702683, ack 286, win 65535, length 1374
00:08:00.282834 IP 10.0.2.15.37840 > 99.84.126.121.443: Flags [.], ack 702683, win 65535, length 0
00:08:00.283696 IP 99.84.126.121.443 > 10.0.2.15.37840: Flags [.], seq 702683:704143, ack 286, win 65535, length 1460
00:08:00.283715 IP 10.0.2.15.37840 > 99.84.126.121.443: Flags [.], ack 704143, win 65535, length 0
00:08:00.283930 IP 99.84.126.121.443 > 10.0.2.15.37840: Flags [P.], seq 704143:708179, ack 286, win 65535, length 4036
00:08:00.283932 IP 99.84.126.121.443 > 10.0.2.15.37840: Flags [P.], seq 708179:710927, ack 286, win 65535, length 2748
00:08:00.283950 IP 10.0.2.15.37840 > 99.84.126.121.443: Flags [.], ack 708179, win 65535, length 0
00:08:00.283970 IP 10.0.2.15.37840 > 99.84.126.121.443: Flags [.], ack 710927, win 65535, length 0
00:08:00.284146 IP 99.84.126.121.443 > 10.0.2.15.37840: Flags [P.], seq 710927:715049, ack 286, win 65535, length 4122
00:08:00.284156 IP 10.0.2.15.37840 > 99.84.126.121.443: Flags [.], ack 715049, win 65535, length 0
00:08:00.286870 IP 99.84.126.121.443 > 10.0.2.15.37840: Flags [P.], seq 715049:719171, ack 286, win 65535, length 4122
00:08:00.286926 IP 10.0.2.15.37840 > 99.84.126.121.443: Flags [.], ack 719171, win 65535, length 0
00:08:00.287488 IP 99.84.126.121.443 > 10.0.2.15.37840: Flags [P.], seq 719171:723293, ack 286, win 65535, length 4122
00:08:00.287491 IP 99.84.126.121.443 > 10.0.2.15.37840: Flags [P.], seq 723293:726041, ack 286, win 65535, length 2748
00:08:00.287492 IP 99.84.126.121.443 > 10.0.2.15.37840: Flags [P.], seq 726041:730163, ack 286, win 65535, length 4122
00:08:00.287512 IP 10.0.2.15.37840 > 99.84.126.121.443: Flags [.], ack 723293, win 65535, length 0
00:08:00.287651 IP 10.0.2.15.37840 > 99.84.126.121.443: Flags [.], ack 726041, win 65535, length 0
00:08:00.287671 IP 10.0.2.15.37840 > 99.84.126.121.443: Flags [.], ack 730163, win 65535, length 0

