19:35:07.436894 IP 10.0.2.15.35907 > 140.233.253.2.53: 20211+ A? www.espn.com. (30)
19:35:07.437054 IP 10.0.2.15.35907 > 140.233.253.2.53: 64255+ AAAA? www.espn.com. (30)
19:35:07.442878 IP 140.233.253.2.53 > 10.0.2.15.35907: 20211 4/0/0 A 13.224.212.80, A 13.224.212.47, A 13.224.212.45, A 13.224.212.128 (94)
19:35:07.444473 IP 140.233.253.2.53 > 10.0.2.15.35907: 64255 8/0/0 AAAA 2600:9000:20ed:3400:e:fe33:5580:93a1, AAAA 2600:9000:20ed:5600:e:fe33:5580:93a1, AAAA 2600:9000:20ed:de00:e:fe33:5580:93a1, AAAA 2600:9000:20ed:3a00:e:fe33:5580:93a1, AAAA 2600:9000:20ed:ea00:e:fe33:5580:93a1, AAAA 2600:9000:20ed:6800:e:fe33:5580:93a1, AAAA 2600:9000:20ed:ae00:e:fe33:5580:93a1, AAAA 2600:9000:20ed:800:e:fe33:5580:93a1 (254)
19:35:07.445047 IP 10.0.2.15.39336 > 13.224.212.80.443: Flags [S], seq 1661931626, win 64240, options [mss 1460,sackOK,TS val 3875438628 ecr 0,nop,wscale 6], length 0
19:35:07.459986 IP 13.224.212.80.443 > 10.0.2.15.39336: Flags [S.], seq 176448001, ack 1661931627, win 65535, options [mss 1460], length 0
19:35:07.460038 IP 10.0.2.15.39336 > 13.224.212.80.443: Flags [.], ack 1, win 64240, length 0
19:35:07.468113 IP 10.0.2.15.39336 > 13.224.212.80.443: Flags [P.], seq 1:518, ack 1, win 64240, length 517
19:35:07.468359 IP 13.224.212.80.443 > 10.0.2.15.39336: Flags [.], ack 518, win 65535, length 0
19:35:07.484342 IP 13.224.212.80.443 > 10.0.2.15.39336: Flags [P.], seq 1:2749, ack 518, win 65535, length 2748
19:35:07.484369 IP 10.0.2.15.39336 > 13.224.212.80.443: Flags [.], ack 2749, win 62780, length 0
19:35:07.485328 IP 13.224.212.80.443 > 10.0.2.15.39336: Flags [P.], seq 2749:4123, ack 518, win 65535, length 1374
19:35:07.485388 IP 10.0.2.15.39336 > 13.224.212.80.443: Flags [.], ack 4123, win 62780, length 0
19:35:07.487373 IP 13.224.212.80.443 > 10.0.2.15.39336: Flags [P.], seq 4123:5497, ack 518, win 65535, length 1374
19:35:07.487375 IP 13.224.212.80.443 > 10.0.2.15.39336: Flags [P.], seq 5497:5824, ack 518, win 65535, length 327
19:35:07.487393 IP 10.0.2.15.39336 > 13.224.212.80.443: Flags [.], ack 5497, win 62780, length 0
19:35:07.487428 IP 10.0.2.15.39336 > 13.224.212.80.443: Flags [.], ack 5824, win 62780, length 0
19:35:07.488504 IP 10.0.2.15.39336 > 13.224.212.80.443: Flags [P.], seq 518:582, ack 5824, win 62780, length 64
19:35:07.488858 IP 13.224.212.80.443 > 10.0.2.15.39336: Flags [.], ack 582, win 65535, length 0
19:35:07.488942 IP 10.0.2.15.39336 > 13.224.212.80.443: Flags [P.], seq 582:628, ack 5824, win 62780, length 46
19:35:07.488992 IP 10.0.2.15.39336 > 13.224.212.80.443: Flags [P.], seq 628:677, ack 5824, win 62780, length 49
19:35:07.489359 IP 10.0.2.15.39336 > 13.224.212.80.443: Flags [P.], seq 677:712, ack 5824, win 62780, length 35
19:35:07.489513 IP 13.224.212.80.443 > 10.0.2.15.39336: Flags [.], ack 628, win 65535, length 0
19:35:07.489515 IP 13.224.212.80.443 > 10.0.2.15.39336: Flags [.], ack 677, win 65535, length 0
19:35:07.489515 IP 13.224.212.80.443 > 10.0.2.15.39336: Flags [.], ack 712, win 65535, length 0
19:35:07.489590 IP 10.0.2.15.39336 > 13.224.212.80.443: Flags [P.], seq 712:772, ack 5824, win 62780, length 60
19:35:07.489851 IP 13.224.212.80.443 > 10.0.2.15.39336: Flags [.], ack 772, win 65535, length 0
19:35:07.504725 IP 13.224.212.80.443 > 10.0.2.15.39336: Flags [P.], seq 5824:5895, ack 772, win 65535, length 71
19:35:07.504746 IP 10.0.2.15.39336 > 13.224.212.80.443: Flags [.], ack 5895, win 62780, length 0
19:35:07.504997 IP 10.0.2.15.39336 > 13.224.212.80.443: Flags [P.], seq 772:803, ack 5895, win 62780, length 31
19:35:07.505388 IP 13.224.212.80.443 > 10.0.2.15.39336: Flags [.], ack 803, win 65535, length 0
19:35:07.517641 IP 13.224.212.80.443 > 10.0.2.15.39336: Flags [P.], seq 5895:15513, ack 803, win 65535, length 9618
19:35:07.517684 IP 10.0.2.15.39336 > 13.224.212.80.443: Flags [.], ack 15513, win 58400, length 0
19:35:07.519361 IP 13.224.212.80.443 > 10.0.2.15.39336: Flags [P.], seq 15513:24257, ack 803, win 65535, length 8744
19:35:07.519388 IP 10.0.2.15.39336 > 13.224.212.80.443: Flags [.], ack 24257, win 58400, length 0
19:35:07.519850 IP 13.224.212.80.443 > 10.0.2.15.39336: Flags [P.], seq 24257:29753, ack 803, win 65535, length 5496
19:35:07.519866 IP 10.0.2.15.39336 > 13.224.212.80.443: Flags [.], ack 29753, win 55480, length 0
19:35:07.521363 IP 13.224.212.80.443 > 10.0.2.15.39336: Flags [P.], seq 29753:36623, ack 803, win 65535, length 6870
19:35:07.521365 IP 13.224.212.80.443 > 10.0.2.15.39336: Flags [P.], seq 36623:39371, ack 803, win 65535, length 2748
19:35:07.521386 IP 10.0.2.15.39336 > 13.224.212.80.443: Flags [.], ack 36623, win 59860, length 0
19:35:07.521419 IP 10.0.2.15.39336 > 13.224.212.80.443: Flags [.], ack 39371, win 58400, length 0
19:35:07.522583 IP 13.224.212.80.443 > 10.0.2.15.39336: Flags [P.], seq 39371:47615, ack 803, win 65535, length 8244
19:35:07.522602 IP 10.0.2.15.39336 > 13.224.212.80.443: Flags [.], ack 47615, win 58400, length 0
19:35:07.531070 IP 13.224.212.80.443 > 10.0.2.15.39336: Flags [P.], seq 47615:48989, ack 803, win 65535, length 1374
19:35:07.531170 IP 10.0.2.15.39336 > 13.224.212.80.443: Flags [.], ack 48989, win 62780, length 0
19:35:07.532387 IP 13.224.212.80.443 > 10.0.2.15.39336: Flags [P.], seq 48989:53111, ack 803, win 65535, length 4122
19:35:07.532519 IP 10.0.2.15.39336 > 13.224.212.80.443: Flags [.], ack 53111, win 61320, length 0
19:35:07.533294 IP 13.224.212.80.443 > 10.0.2.15.39336: Flags [P.], seq 53111:59981, ack 803, win 65535, length 6870
19:35:07.533296 IP 13.224.212.80.443 > 10.0.2.15.39336: Flags [P.], seq 59981:62729, ack 803, win 65535, length 2748
19:35:07.533383 IP 10.0.2.15.39336 > 13.224.212.80.443: Flags [.], ack 62729, win 62780, length 0
19:35:07.534329 IP 13.224.212.80.443 > 10.0.2.15.39336: Flags [P.], seq 62729:68225, ack 803, win 65535, length 5496
19:35:07.534331 IP 13.224.212.80.443 > 10.0.2.15.39336: Flags [P.], seq 68225:69599, ack 803, win 65535, length 1374
19:35:07.534406 IP 10.0.2.15.39336 > 13.224.212.80.443: Flags [.], ack 69599, win 62780, length 0
19:35:07.535591 IP 13.224.212.80.443 > 10.0.2.15.39336: Flags [P.], seq 69599:73721, ack 803, win 65535, length 4122
19:35:07.535593 IP 13.224.212.80.443 > 10.0.2.15.39336: Flags [P.], seq 73721:77843, ack 803, win 65535, length 4122
19:35:07.535611 IP 10.0.2.15.39336 > 13.224.212.80.443: Flags [.], ack 73721, win 65535, length 0
19:35:07.535641 IP 10.0.2.15.39336 > 13.224.212.80.443: Flags [.], ack 77843, win 65535, length 0
19:35:07.536866 IP 13.224.212.80.443 > 10.0.2.15.39336: Flags [P.], seq 77843:84713, ack 803, win 65535, length 6870
19:35:07.536888 IP 10.0.2.15.39336 > 13.224.212.80.443: Flags [.], ack 84713, win 65535, length 0
19:35:07.537181 IP 13.224.212.80.443 > 10.0.2.15.39336: Flags [P.], seq 84713:90209, ack 803, win 65535, length 5496
19:35:07.537193 IP 10.0.2.15.39336 > 13.224.212.80.443: Flags [.], ack 90209, win 65535, length 0
19:35:07.539010 IP 13.224.212.80.443 > 10.0.2.15.39336: Flags [P.], seq 90209:101201, ack 803, win 65535, length 10992
19:35:07.539033 IP 10.0.2.15.39336 > 13.224.212.80.443: Flags [.], ack 101201, win 65535, length 0
19:35:07.540091 IP 13.224.212.80.443 > 10.0.2.15.39336: Flags [P.], seq 101201:105323, ack 803, win 65535, length 4122
19:35:07.540093 IP 13.224.212.80.443 > 10.0.2.15.39336: Flags [P.], seq 105323:108071, ack 803, win 65535, length 2748
19:35:07.540113 IP 10.0.2.15.39336 > 13.224.212.80.443: Flags [.], ack 105323, win 65535, length 0
19:35:07.540142 IP 10.0.2.15.39336 > 13.224.212.80.443: Flags [.], ack 108071, win 65535, length 0
19:35:07.541453 IP 13.224.212.80.443 > 10.0.2.15.39336: Flags [P.], seq 108071:116315, ack 803, win 65535, length 8244
19:35:07.541470 IP 10.0.2.15.39336 > 13.224.212.80.443: Flags [.], ack 116315, win 65535, length 0
19:35:07.542470 IP 13.224.212.80.443 > 10.0.2.15.39336: Flags [P.], seq 116315:117689, ack 803, win 65535, length 1374
19:35:07.542489 IP 10.0.2.15.39336 > 13.224.212.80.443: Flags [.], ack 117689, win 65535, length 0
19:35:07.545769 IP 13.224.212.80.443 > 10.0.2.15.39336: Flags [P.], seq 117689:120437, ack 803, win 65535, length 2748
19:35:07.545798 IP 10.0.2.15.39336 > 13.224.212.80.443: Flags [.], ack 120437, win 65535, length 0
19:35:07.546894 IP 13.224.212.80.443 > 10.0.2.15.39336: Flags [P.], seq 120437:125933, ack 803, win 65535, length 5496
19:35:07.546922 IP 10.0.2.15.39336 > 13.224.212.80.443: Flags [.], ack 125933, win 65535, length 0
19:35:07.547774 IP 13.224.212.80.443 > 10.0.2.15.39336: Flags [P.], seq 125933:134177, ack 803, win 65535, length 8244
19:35:07.547793 IP 10.0.2.15.39336 > 13.224.212.80.443: Flags [.], ack 134177, win 65535, length 0
19:35:07.548171 IP 13.224.212.80.443 > 10.0.2.15.39336: Flags [P.], seq 134177:138299, ack 803, win 65535, length 4122
19:35:07.548173 IP 13.224.212.80.443 > 10.0.2.15.39336: Flags [P.], seq 138299:141047, ack 803, win 65535, length 2748
19:35:07.548190 IP 10.0.2.15.39336 > 13.224.212.80.443: Flags [.], ack 138299, win 65535, length 0
19:35:07.548212 IP 10.0.2.15.39336 > 13.224.212.80.443: Flags [.], ack 141047, win 65535, length 0
19:35:07.548805 IP 13.224.212.80.443 > 10.0.2.15.39336: Flags [P.], seq 141047:146543, ack 803, win 65535, length 5496
19:35:07.548821 IP 10.0.2.15.39336 > 13.224.212.80.443: Flags [.], ack 146543, win 65535, length 0
19:35:07.550164 IP 13.224.212.80.443 > 10.0.2.15.39336: Flags [P.], seq 146543:152039, ack 803, win 65535, length 5496
19:35:07.550167 IP 13.224.212.80.443 > 10.0.2.15.39336: Flags [P.], seq 152039:154787, ack 803, win 65535, length 2748
19:35:07.550217 IP 13.224.212.80.443 > 10.0.2.15.39336: Flags [P.], seq 154787:160283, ack 803, win 65535, length 5496
19:35:07.550239 IP 10.0.2.15.39336 > 13.224.212.80.443: Flags [.], ack 152039, win 65535, length 0
19:35:07.550277 IP 10.0.2.15.39336 > 13.224.212.80.443: Flags [.], ack 154787, win 65535, length 0
19:35:07.550296 IP 10.0.2.15.39336 > 13.224.212.80.443: Flags [.], ack 160283, win 65535, length 0
19:35:07.551354 IP 13.224.212.80.443 > 10.0.2.15.39336: Flags [P.], seq 160283:167153, ack 803, win 65535, length 6870
19:35:07.551366 IP 10.0.2.15.39336 > 13.224.212.80.443: Flags [.], ack 167153, win 65535, length 0
19:35:07.551907 IP 13.224.212.80.443 > 10.0.2.15.39336: Flags [P.], seq 167153:172649, ack 803, win 65535, length 5496
19:35:07.551909 IP 13.224.212.80.443 > 10.0.2.15.39336: Flags [P.], seq 172649:174023, ack 803, win 65535, length 1374
19:35:07.551924 IP 10.0.2.15.39336 > 13.224.212.80.443: Flags [.], ack 172649, win 65535, length 0
19:35:07.551946 IP 10.0.2.15.39336 > 13.224.212.80.443: Flags [.], ack 174023, win 65535, length 0
19:35:07.553430 IP 13.224.212.80.443 > 10.0.2.15.39336: Flags [P.], seq 174023:185015, ack 803, win 65535, length 10992
19:35:07.553450 IP 10.0.2.15.39336 > 13.224.212.80.443: Flags [.], ack 185015, win 65535, length 0
19:35:07.554288 IP 13.224.212.80.443 > 10.0.2.15.39336: Flags [P.], seq 185015:190511, ack 803, win 65535, length 5496
19:35:07.554291 IP 13.224.212.80.443 > 10.0.2.15.39336: Flags [P.], seq 190511:194633, ack 803, win 65535, length 4122
19:35:07.554310 IP 10.0.2.15.39336 > 13.224.212.80.443: Flags [.], ack 190511, win 65535, length 0
19:35:07.554461 IP 10.0.2.15.39336 > 13.224.212.80.443: Flags [.], ack 194633, win 65535, length 0
19:35:07.554567 IP 13.224.212.80.443 > 10.0.2.15.39336: Flags [P.], seq 194633:196007, ack 803, win 65535, length 1374
19:35:07.554568 IP 13.224.212.80.443 > 10.0.2.15.39336: Flags [P.], seq 196007:198755, ack 803, win 65535, length 2748
19:35:07.554575 IP 10.0.2.15.39336 > 13.224.212.80.443: Flags [.], ack 196007, win 65535, length 0
19:35:07.554586 IP 10.0.2.15.39336 > 13.224.212.80.443: Flags [.], ack 198755, win 65535, length 0
19:35:07.555630 IP 13.224.212.80.443 > 10.0.2.15.39336: Flags [P.], seq 198755:205625, ack 803, win 65535, length 6870
19:35:07.555633 IP 13.224.212.80.443 > 10.0.2.15.39336: Flags [P.], seq 205625:209747, ack 803, win 65535, length 4122
19:35:07.555649 IP 10.0.2.15.39336 > 13.224.212.80.443: Flags [.], ack 205625, win 65535, length 0
19:35:07.555673 IP 10.0.2.15.39336 > 13.224.212.80.443: Flags [.], ack 209747, win 65535, length 0
19:35:07.557018 IP 13.224.212.80.443 > 10.0.2.15.39336: Flags [P.], seq 209747:216617, ack 803, win 65535, length 6870
19:35:07.557140 IP 10.0.2.15.39336 > 13.224.212.80.443: Flags [.], ack 216617, win 65535, length 0
19:35:07.557505 IP 13.224.212.80.443 > 10.0.2.15.39336: Flags [P.], seq 216617:222113, ack 803, win 65535, length 5496
19:35:07.557507 IP 13.224.212.80.443 > 10.0.2.15.39336: Flags [P.], seq 222113:224861, ack 803, win 65535, length 2748
19:35:07.557520 IP 10.0.2.15.39336 > 13.224.212.80.443: Flags [.], ack 222113, win 65535, length 0
19:35:07.557536 IP 10.0.2.15.39336 > 13.224.212.80.443: Flags [.], ack 224861, win 65535, length 0
19:35:07.557799 IP 13.224.212.80.443 > 10.0.2.15.39336: Flags [P.], seq 224861:227609, ack 803, win 65535, length 2748
19:35:07.557811 IP 10.0.2.15.39336 > 13.224.212.80.443: Flags [.], ack 227609, win 65535, length 0
19:35:07.558563 IP 13.224.212.80.443 > 10.0.2.15.39336: Flags [P.], seq 227609:235853, ack 803, win 65535, length 8244
19:35:07.558574 IP 10.0.2.15.39336 > 13.224.212.80.443: Flags [.], ack 235853, win 65535, length 0
19:35:07.560078 IP 13.224.212.80.443 > 10.0.2.15.39336: Flags [P.], seq 235853:244097, ack 803, win 65535, length 8244
19:35:07.560102 IP 10.0.2.15.39336 > 13.224.212.80.443: Flags [.], ack 244097, win 65535, length 0
19:35:07.560402 IP 13.224.212.80.443 > 10.0.2.15.39336: Flags [P.], seq 244097:249593, ack 803, win 65535, length 5496
19:35:07.560410 IP 10.0.2.15.39336 > 13.224.212.80.443: Flags [.], ack 249593, win 65535, length 0
19:35:07.560950 IP 13.224.212.80.443 > 10.0.2.15.39336: Flags [.], seq 249593:253973, ack 803, win 65535, length 4380
19:35:07.561018 IP 10.0.2.15.39336 > 13.224.212.80.443: Flags [.], ack 253973, win 65535, length 0
19:35:07.561133 IP 13.224.212.80.443 > 10.0.2.15.39336: Flags [P.], seq 253973:255089, ack 803, win 65535, length 1116
19:35:07.561134 IP 13.224.212.80.443 > 10.0.2.15.39336: Flags [P.], seq 255089:257837, ack 803, win 65535, length 2748
19:35:07.561134 IP 13.224.212.80.443 > 10.0.2.15.39336: Flags [P.], seq 257837:259211, ack 803, win 65535, length 1374
19:35:07.561144 IP 10.0.2.15.39336 > 13.224.212.80.443: Flags [.], ack 255089, win 65535, length 0
19:35:07.561158 IP 10.0.2.15.39336 > 13.224.212.80.443: Flags [.], ack 257837, win 65535, length 0
19:35:07.561169 IP 10.0.2.15.39336 > 13.224.212.80.443: Flags [.], ack 259211, win 65535, length 0
19:35:07.562305 IP 13.224.212.80.443 > 10.0.2.15.39336: Flags [P.], seq 259211:264707, ack 803, win 65535, length 5496
19:35:07.562307 IP 13.224.212.80.443 > 10.0.2.15.39336: Flags [P.], seq 264707:270203, ack 803, win 65535, length 5496
19:35:07.562324 IP 10.0.2.15.39336 > 13.224.212.80.443: Flags [.], ack 264707, win 65535, length 0
19:35:07.562351 IP 10.0.2.15.39336 > 13.224.212.80.443: Flags [.], ack 270203, win 65535, length 0
19:35:07.562377 IP 13.224.212.80.443 > 10.0.2.15.39336: Flags [P.], seq 270203:272951, ack 803, win 65535, length 2748
19:35:07.562382 IP 10.0.2.15.39336 > 13.224.212.80.443: Flags [.], ack 272951, win 65535, length 0
19:35:07.563441 IP 13.224.212.80.443 > 10.0.2.15.39336: Flags [P.], seq 272951:283943, ack 803, win 65535, length 10992
19:35:07.563464 IP 10.0.2.15.39336 > 13.224.212.80.443: Flags [.], ack 283943, win 65535, length 0
19:35:07.563520 IP 13.224.212.80.443 > 10.0.2.15.39336: Flags [P.], seq 283943:289439, ack 803, win 65535, length 5496
19:35:07.563527 IP 10.0.2.15.39336 > 13.224.212.80.443: Flags [.], ack 289439, win 65535, length 0
19:35:07.563773 IP 13.224.212.80.443 > 10.0.2.15.39336: Flags [P.], seq 289439:293561, ack 803, win 65535, length 4122
19:35:07.563788 IP 10.0.2.15.39336 > 13.224.212.80.443: Flags [.], ack 293561, win 65535, length 0
19:35:07.566051 IP 13.224.212.80.443 > 10.0.2.15.39336: Flags [P.], seq 293561:304553, ack 803, win 65535, length 10992
19:35:07.566076 IP 10.0.2.15.39336 > 13.224.212.80.443: Flags [.], ack 304553, win 65535, length 0
19:35:07.566299 IP 13.224.212.80.443 > 10.0.2.15.39336: Flags [P.], seq 304553:307301, ack 803, win 65535, length 2748
19:35:07.566301 IP 13.224.212.80.443 > 10.0.2.15.39336: Flags [P.], seq 307301:312797, ack 803, win 65535, length 5496
19:35:07.566302 IP 13.224.212.80.443 > 10.0.2.15.39336: Flags [P.], seq 312797:314171, ack 803, win 65535, length 1374
19:35:07.566302 IP 13.224.212.80.443 > 10.0.2.15.39336: Flags [P.], seq 314171:316919, ack 803, win 65535, length 2748
19:35:07.566315 IP 10.0.2.15.39336 > 13.224.212.80.443: Flags [.], ack 307301, win 65535, length 0
19:35:07.566417 IP 10.0.2.15.39336 > 13.224.212.80.443: Flags [.], ack 312797, win 65535, length 0
19:35:07.566451 IP 10.0.2.15.39336 > 13.224.212.80.443: Flags [.], ack 314171, win 65535, length 0
19:35:07.566462 IP 10.0.2.15.39336 > 13.224.212.80.443: Flags [.], ack 316919, win 65535, length 0
19:35:07.566480 IP 13.224.212.80.443 > 10.0.2.15.39336: Flags [P.], seq 316919:322415, ack 803, win 65535, length 5496
19:35:07.566482 IP 13.224.212.80.443 > 10.0.2.15.39336: Flags [P.], seq 322415:327911, ack 803, win 65535, length 5496
19:35:07.566492 IP 10.0.2.15.39336 > 13.224.212.80.443: Flags [.], ack 322415, win 65535, length 0
19:35:07.566510 IP 10.0.2.15.39336 > 13.224.212.80.443: Flags [.], ack 327911, win 65535, length 0
19:35:07.566525 IP 13.224.212.80.443 > 10.0.2.15.39336: Flags [P.], seq 327911:329285, ack 803, win 65535, length 1374
19:35:07.566529 IP 10.0.2.15.39336 > 13.224.212.80.443: Flags [.], ack 329285, win 65535, length 0
19:35:07.567460 IP 13.224.212.80.443 > 10.0.2.15.39336: Flags [P.], seq 329285:336155, ack 803, win 65535, length 6870
19:35:07.567477 IP 10.0.2.15.39336 > 13.224.212.80.443: Flags [.], ack 336155, win 65535, length 0
19:35:07.567616 IP 13.224.212.80.443 > 10.0.2.15.39336: Flags [P.], seq 336155:340277, ack 803, win 65535, length 4122
19:35:07.567627 IP 10.0.2.15.39336 > 13.224.212.80.443: Flags [.], ack 340277, win 65535, length 0
19:35:07.568710 IP 13.224.212.80.443 > 10.0.2.15.39336: Flags [P.], seq 340277:344399, ack 803, win 65535, length 4122
19:35:07.568713 IP 13.224.212.80.443 > 10.0.2.15.39336: Flags [P.], seq 344399:347147, ack 803, win 65535, length 2748
19:35:07.568731 IP 10.0.2.15.39336 > 13.224.212.80.443: Flags [.], ack 344399, win 65535, length 0
19:35:07.568834 IP 10.0.2.15.39336 > 13.224.212.80.443: Flags [.], ack 347147, win 65535, length 0
19:35:07.569187 IP 13.224.212.80.443 > 10.0.2.15.39336: Flags [P.], seq 347147:349895, ack 803, win 65535, length 2748
19:35:07.569189 IP 13.224.212.80.443 > 10.0.2.15.39336: Flags [P.], seq 349895:352643, ack 803, win 65535, length 2748
19:35:07.569189 IP 13.224.212.80.443 > 10.0.2.15.39336: Flags [P.], seq 352643:356765, ack 803, win 65535, length 4122
19:35:07.569205 IP 10.0.2.15.39336 > 13.224.212.80.443: Flags [.], ack 349895, win 65535, length 0
19:35:07.569228 IP 10.0.2.15.39336 > 13.224.212.80.443: Flags [.], ack 352643, win 65535, length 0
19:35:07.569241 IP 10.0.2.15.39336 > 13.224.212.80.443: Flags [.], ack 356765, win 65535, length 0
19:35:07.569565 IP 13.224.212.80.443 > 10.0.2.15.39336: Flags [P.], seq 356765:359513, ack 803, win 65535, length 2748
19:35:07.569566 IP 13.224.212.80.443 > 10.0.2.15.39336: Flags [P.], seq 359513:362261, ack 803, win 65535, length 2748
19:35:07.569567 IP 13.224.212.80.443 > 10.0.2.15.39336: Flags [P.], seq 362261:365009, ack 803, win 65535, length 2748
19:35:07.569662 IP 10.0.2.15.39336 > 13.224.212.80.443: Flags [.], ack 359513, win 65535, length 0
19:35:07.569686 IP 10.0.2.15.39336 > 13.224.212.80.443: Flags [.], ack 362261, win 65535, length 0
19:35:07.569697 IP 10.0.2.15.39336 > 13.224.212.80.443: Flags [.], ack 365009, win 65535, length 0
19:35:07.570207 IP 13.224.212.80.443 > 10.0.2.15.39336: Flags [P.], seq 365009:369131, ack 803, win 65535, length 4122
19:35:07.570210 IP 13.224.212.80.443 > 10.0.2.15.39336: Flags [P.], seq 369131:373253, ack 803, win 65535, length 4122
19:35:07.570211 IP 13.224.212.80.443 > 10.0.2.15.39336: Flags [P.], seq 373253:377375, ack 803, win 65535, length 4122
19:35:07.570230 IP 10.0.2.15.39336 > 13.224.212.80.443: Flags [.], ack 369131, win 65535, length 0
19:35:07.570254 IP 10.0.2.15.39336 > 13.224.212.80.443: Flags [.], ack 373253, win 65535, length 0
19:35:07.570269 IP 10.0.2.15.39336 > 13.224.212.80.443: Flags [.], ack 377375, win 65535, length 0
19:35:07.570293 IP 13.224.212.80.443 > 10.0.2.15.39336: Flags [P.], seq 377375:380123, ack 803, win 65535, length 2748
19:35:07.570383 IP 10.0.2.15.39336 > 13.224.212.80.443: Flags [.], ack 380123, win 65535, length 0
19:35:07.570930 IP 13.224.212.80.443 > 10.0.2.15.39336: Flags [P.], seq 380123:384245, ack 803, win 65535, length 4122
19:35:07.570933 IP 13.224.212.80.443 > 10.0.2.15.39336: Flags [P.], seq 384245:388367, ack 803, win 65535, length 4122
19:35:07.571010 IP 10.0.2.15.39336 > 13.224.212.80.443: Flags [.], ack 384245, win 65535, length 0
19:35:07.571079 IP 10.0.2.15.39336 > 13.224.212.80.443: Flags [.], ack 388367, win 65535, length 0
19:35:07.572359 IP 13.224.212.80.443 > 10.0.2.15.39336: Flags [P.], seq 388367:392489, ack 803, win 65535, length 4122
19:35:07.572362 IP 13.224.212.80.443 > 10.0.2.15.39336: Flags [P.], seq 392489:397985, ack 803, win 65535, length 5496
19:35:07.572363 IP 13.224.212.80.443 > 10.0.2.15.39336: Flags [P.], seq 397985:402107, ack 803, win 65535, length 4122
19:35:07.572386 IP 10.0.2.15.39336 > 13.224.212.80.443: Flags [.], ack 392489, win 65535, length 0
19:35:07.572411 IP 10.0.2.15.39336 > 13.224.212.80.443: Flags [.], ack 397985, win 65535, length 0
19:35:07.572423 IP 10.0.2.15.39336 > 13.224.212.80.443: Flags [.], ack 402107, win 65535, length 0
19:35:07.572450 IP 13.224.212.80.443 > 10.0.2.15.39336: Flags [P.], seq 402107:407603, ack 803, win 65535, length 5496
19:35:07.572451 IP 13.224.212.80.443 > 10.0.2.15.39336: Flags [P.], seq 407603:411725, ack 803, win 65535, length 4122
19:35:07.572452 IP 13.224.212.80.443 > 10.0.2.15.39336: Flags [P.], seq 411725:413099, ack 803, win 65535, length 1374
19:35:07.572460 IP 10.0.2.15.39336 > 13.224.212.80.443: Flags [.], ack 407603, win 65535, length 0
19:35:07.572475 IP 10.0.2.15.39336 > 13.224.212.80.443: Flags [.], ack 411725, win 65535, length 0
19:35:07.572485 IP 10.0.2.15.39336 > 13.224.212.80.443: Flags [.], ack 413099, win 65535, length 0
19:35:07.572507 IP 13.224.212.80.443 > 10.0.2.15.39336: Flags [P.], seq 413099:417221, ack 803, win 65535, length 4122
19:35:07.572512 IP 10.0.2.15.39336 > 13.224.212.80.443: Flags [.], ack 417221, win 65535, length 0
19:35:07.572742 IP 13.224.212.80.443 > 10.0.2.15.39336: Flags [P.], seq 417221:419969, ack 803, win 65535, length 2748
19:35:07.572744 IP 13.224.212.80.443 > 10.0.2.15.39336: Flags [P.], seq 419969:424091, ack 803, win 65535, length 4122
19:35:07.572757 IP 10.0.2.15.39336 > 13.224.212.80.443: Flags [.], ack 419969, win 65535, length 0
19:35:07.572960 IP 10.0.2.15.39336 > 13.224.212.80.443: Flags [.], ack 424091, win 65535, length 0
19:35:07.573142 IP 13.224.212.80.443 > 10.0.2.15.39336: Flags [P.], seq 424091:426839, ack 803, win 65535, length 2748
19:35:07.573143 IP 13.224.212.80.443 > 10.0.2.15.39336: Flags [P.], seq 426839:429587, ack 803, win 65535, length 2748
19:35:07.573153 IP 10.0.2.15.39336 > 13.224.212.80.443: Flags [.], ack 426839, win 65535, length 0
19:35:07.573168 IP 10.0.2.15.39336 > 13.224.212.80.443: Flags [.], ack 429587, win 65535, length 0
19:35:07.573296 IP 13.224.212.80.443 > 10.0.2.15.39336: Flags [P.], seq 429587:435083, ack 803, win 65535, length 5496
19:35:07.573302 IP 10.0.2.15.39336 > 13.224.212.80.443: Flags [.], ack 435083, win 65535, length 0
19:35:07.574269 IP 13.224.212.80.443 > 10.0.2.15.39336: Flags [P.], seq 435083:439205, ack 803, win 65535, length 4122
19:35:07.574271 IP 13.224.212.80.443 > 10.0.2.15.39336: Flags [P.], seq 439205:443327, ack 803, win 65535, length 4122
19:35:07.574286 IP 10.0.2.15.39336 > 13.224.212.80.443: Flags [.], ack 439205, win 65535, length 0
19:35:07.574314 IP 10.0.2.15.39336 > 13.224.212.80.443: Flags [.], ack 443327, win 65535, length 0
19:35:07.574466 IP 13.224.212.80.443 > 10.0.2.15.39336: Flags [P.], seq 443327:446075, ack 803, win 65535, length 2748
19:35:07.574473 IP 10.0.2.15.39336 > 13.224.212.80.443: Flags [.], ack 446075, win 65535, length 0
19:35:07.574578 IP 13.224.212.80.443 > 10.0.2.15.39336: Flags [P.], seq 446075:450197, ack 803, win 65535, length 4122
19:35:07.574585 IP 10.0.2.15.39336 > 13.224.212.80.443: Flags [.], ack 450197, win 65535, length 0
19:35:07.575207 IP 13.224.212.80.443 > 10.0.2.15.39336: Flags [P.], seq 450197:454319, ack 803, win 65535, length 4122
19:35:07.575209 IP 13.224.212.80.443 > 10.0.2.15.39336: Flags [P.], seq 454319:457067, ack 803, win 65535, length 2748
19:35:07.575210 IP 13.224.212.80.443 > 10.0.2.15.39336: Flags [P.], seq 457067:459815, ack 803, win 65535, length 2748
19:35:07.575255 IP 10.0.2.15.39336 > 13.224.212.80.443: Flags [.], ack 454319, win 65535, length 0
19:35:07.575280 IP 10.0.2.15.39336 > 13.224.212.80.443: Flags [.], ack 457067, win 65535, length 0
19:35:07.575352 IP 10.0.2.15.39336 > 13.224.212.80.443: Flags [.], ack 459815, win 65535, length 0
19:35:07.575542 IP 13.224.212.80.443 > 10.0.2.15.39336: Flags [P.], seq 459815:462563, ack 803, win 65535, length 2748
19:35:07.575543 IP 13.224.212.80.443 > 10.0.2.15.39336: Flags [P.], seq 462563:465311, ack 803, win 65535, length 2748
19:35:07.575544 IP 13.224.212.80.443 > 10.0.2.15.39336: Flags [P.], seq 465311:466685, ack 803, win 65535, length 1374
19:35:07.575555 IP 10.0.2.15.39336 > 13.224.212.80.443: Flags [.], ack 462563, win 65535, length 0
19:35:07.575613 IP 10.0.2.15.39336 > 13.224.212.80.443: Flags [.], ack 465311, win 65535, length 0
19:35:07.575624 IP 10.0.2.15.39336 > 13.224.212.80.443: Flags [.], ack 466685, win 65535, length 0
19:35:07.575814 IP 13.224.212.80.443 > 10.0.2.15.39336: Flags [P.], seq 466685:473555, ack 803, win 65535, length 6870
19:35:07.575823 IP 10.0.2.15.39336 > 13.224.212.80.443: Flags [.], ack 473555, win 65535, length 0
19:35:07.576009 IP 13.224.212.80.443 > 10.0.2.15.39336: Flags [P.], seq 473555:477677, ack 803, win 65535, length 4122
19:35:07.576019 IP 10.0.2.15.39336 > 13.224.212.80.443: Flags [.], ack 477677, win 65535, length 0
19:35:07.576291 IP 13.224.212.80.443 > 10.0.2.15.39336: Flags [P.], seq 477677:480425, ack 803, win 65535, length 2748
19:35:07.576293 IP 13.224.212.80.443 > 10.0.2.15.39336: Flags [P.], seq 480425:483173, ack 803, win 65535, length 2748
19:35:07.576303 IP 10.0.2.15.39336 > 13.224.212.80.443: Flags [.], ack 480425, win 65535, length 0
19:35:07.576322 IP 10.0.2.15.39336 > 13.224.212.80.443: Flags [.], ack 483173, win 65535, length 0
19:35:07.576608 IP 13.224.212.80.443 > 10.0.2.15.39336: Flags [P.], seq 483173:485921, ack 803, win 65535, length 2748
19:35:07.576616 IP 10.0.2.15.39336 > 13.224.212.80.443: Flags [.], ack 485921, win 65535, length 0
19:35:07.577354 IP 13.224.212.80.443 > 10.0.2.15.39336: Flags [P.], seq 485921:490043, ack 803, win 65535, length 4122
19:35:07.577356 IP 13.224.212.80.443 > 10.0.2.15.39336: Flags [P.], seq 490043:494165, ack 803, win 65535, length 4122
19:35:07.577380 IP 10.0.2.15.39336 > 13.224.212.80.443: Flags [.], ack 490043, win 65535, length 0
19:35:07.577455 IP 10.0.2.15.39336 > 13.224.212.80.443: Flags [.], ack 494165, win 65535, length 0
19:35:07.577570 IP 13.224.212.80.443 > 10.0.2.15.39336: Flags [P.], seq 494165:499661, ack 803, win 65535, length 5496
19:35:07.577579 IP 10.0.2.15.39336 > 13.224.212.80.443: Flags [.], ack 499661, win 65535, length 0
19:35:07.578006 IP 13.224.212.80.443 > 10.0.2.15.39336: Flags [P.], seq 499661:505157, ack 803, win 65535, length 5496
19:35:07.578008 IP 13.224.212.80.443 > 10.0.2.15.39336: Flags [P.], seq 505157:509279, ack 803, win 65535, length 4122
19:35:07.578024 IP 10.0.2.15.39336 > 13.224.212.80.443: Flags [.], ack 505157, win 65535, length 0
19:35:07.578317 IP 10.0.2.15.39336 > 13.224.212.80.443: Flags [.], ack 509279, win 65535, length 0
19:35:07.578510 IP 13.224.212.80.443 > 10.0.2.15.39336: Flags [P.], seq 509279:514775, ack 803, win 65535, length 5496
19:35:07.578511 IP 13.224.212.80.443 > 10.0.2.15.39336: Flags [P.], seq 514775:517523, ack 803, win 65535, length 2748
19:35:07.578512 IP 13.224.212.80.443 > 10.0.2.15.39336: Flags [P.], seq 517523:520271, ack 803, win 65535, length 2748
19:35:07.578525 IP 10.0.2.15.39336 > 13.224.212.80.443: Flags [.], ack 514775, win 65535, length 0
19:35:07.578541 IP 10.0.2.15.39336 > 13.224.212.80.443: Flags [.], ack 517523, win 65535, length 0
19:35:07.578601 IP 10.0.2.15.39336 > 13.224.212.80.443: Flags [.], ack 520271, win 65535, length 0
19:35:07.578667 IP 13.224.212.80.443 > 10.0.2.15.39336: Flags [P.], seq 520271:523019, ack 803, win 65535, length 2748
19:35:07.578678 IP 10.0.2.15.39336 > 13.224.212.80.443: Flags [.], ack 523019, win 65535, length 0
19:35:07.579066 IP 13.224.212.80.443 > 10.0.2.15.39336: Flags [P.], seq 523019:525767, ack 803, win 65535, length 2748
19:35:07.579105 IP 10.0.2.15.39336 > 13.224.212.80.443: Flags [.], ack 525767, win 65535, length 0
19:35:07.580090 IP 13.224.212.80.443 > 10.0.2.15.39336: Flags [P.], seq 525767:535385, ack 803, win 65535, length 9618
19:35:07.580104 IP 13.224.212.80.443 > 10.0.2.15.39336: Flags [P.], seq 535385:538133, ack 803, win 65535, length 2748
19:35:07.580128 IP 10.0.2.15.39336 > 13.224.212.80.443: Flags [.], ack 535385, win 65535, length 0
19:35:07.580251 IP 10.0.2.15.39336 > 13.224.212.80.443: Flags [.], ack 538133, win 65535, length 0
19:35:07.580874 IP 13.224.212.80.443 > 10.0.2.15.39336: Flags [P.], seq 538133:542255, ack 803, win 65535, length 4122
19:35:07.580879 IP 13.224.212.80.443 > 10.0.2.15.39336: Flags [P.], seq 542255:547751, ack 803, win 65535, length 5496
19:35:07.581035 IP 10.0.2.15.39336 > 13.224.212.80.443: Flags [.], ack 542255, win 65535, length 0
19:35:07.581150 IP 10.0.2.15.39336 > 13.224.212.80.443: Flags [.], ack 547751, win 65535, length 0
19:35:07.581697 IP 13.224.212.80.443 > 10.0.2.15.39336: Flags [P.], seq 547751:551873, ack 803, win 65535, length 4122
19:35:07.581700 IP 13.224.212.80.443 > 10.0.2.15.39336: Flags [P.], seq 551873:554621, ack 803, win 65535, length 2748
19:35:07.581701 IP 13.224.212.80.443 > 10.0.2.15.39336: Flags [P.], seq 554621:560117, ack 803, win 65535, length 5496
19:35:07.581795 IP 10.0.2.15.39336 > 13.224.212.80.443: Flags [.], ack 551873, win 65535, length 0
19:35:07.581859 IP 10.0.2.15.39336 > 13.224.212.80.443: Flags [.], ack 554621, win 65535, length 0
19:35:07.581874 IP 10.0.2.15.39336 > 13.224.212.80.443: Flags [.], ack 560117, win 65535, length 0
19:35:07.581980 IP 13.224.212.80.443 > 10.0.2.15.39336: Flags [P.], seq 560117:564239, ack 803, win 65535, length 4122
19:35:07.581982 IP 13.224.212.80.443 > 10.0.2.15.39336: Flags [P.], seq 564239:571109, ack 803, win 65535, length 6870
19:35:07.581993 IP 10.0.2.15.39336 > 13.224.212.80.443: Flags [.], ack 564239, win 65535, length 0
19:35:07.582013 IP 10.0.2.15.39336 > 13.224.212.80.443: Flags [.], ack 571109, win 65535, length 0
19:35:07.582032 IP 13.224.212.80.443 > 10.0.2.15.39336: Flags [P.], seq 571109:573857, ack 803, win 65535, length 2748
19:35:07.582033 IP 13.224.212.80.443 > 10.0.2.15.39336: Flags [P.], seq 573857:576605, ack 803, win 65535, length 2748
19:35:07.582034 IP 13.224.212.80.443 > 10.0.2.15.39336: Flags [P.], seq 576605:577979, ack 803, win 65535, length 1374
19:35:07.582040 IP 10.0.2.15.39336 > 13.224.212.80.443: Flags [.], ack 573857, win 65535, length 0
19:35:07.582052 IP 10.0.2.15.39336 > 13.224.212.80.443: Flags [.], ack 576605, win 65535, length 0
19:35:07.582064 IP 10.0.2.15.39336 > 13.224.212.80.443: Flags [.], ack 577979, win 65535, length 0
19:35:07.584852 IP 13.224.212.80.443 > 10.0.2.15.39336: Flags [P.], seq 577979:606833, ack 803, win 65535, length 28854
19:35:07.584945 IP 10.0.2.15.39336 > 13.224.212.80.443: Flags [.], ack 606833, win 65535, length 0
19:35:07.584978 IP 13.224.212.80.443 > 10.0.2.15.39336: Flags [P.], seq 606833:612329, ack 803, win 65535, length 5496
19:35:07.584985 IP 10.0.2.15.39336 > 13.224.212.80.443: Flags [.], ack 612329, win 65535, length 0
19:35:07.585440 IP 13.224.212.80.443 > 10.0.2.15.39336: Flags [.], seq 612329:618169, ack 803, win 65535, length 5840
19:35:07.585457 IP 10.0.2.15.39336 > 13.224.212.80.443: Flags [.], ack 618169, win 65535, length 0
19:35:07.585827 IP 13.224.212.80.443 > 10.0.2.15.39336: Flags [P.], seq 618169:627443, ack 803, win 65535, length 9274
19:35:07.585829 IP 13.224.212.80.443 > 10.0.2.15.39336: Flags [P.], seq 627443:631565, ack 803, win 65535, length 4122
19:35:07.585850 IP 10.0.2.15.39336 > 13.224.212.80.443: Flags [.], ack 627443, win 65535, length 0
19:35:07.585873 IP 10.0.2.15.39336 > 13.224.212.80.443: Flags [.], ack 631565, win 65535, length 0
19:35:07.585902 IP 13.224.212.80.443 > 10.0.2.15.39336: Flags [P.], seq 631565:634313, ack 803, win 65535, length 2748
19:35:07.585903 IP 13.224.212.80.443 > 10.0.2.15.39336: Flags [P.], seq 634313:637061, ack 803, win 65535, length 2748
19:35:07.585905 IP 13.224.212.80.443 > 10.0.2.15.39336: Flags [P.], seq 637061:642557, ack 803, win 65535, length 5496
19:35:07.586106 IP 13.224.212.80.443 > 10.0.2.15.39336: Flags [P.], seq 642557:645305, ack 803, win 65535, length 2748
19:35:07.586327 IP 13.224.212.80.443 > 10.0.2.15.39336: Flags [P.], seq 645305:650801, ack 803, win 65535, length 5496
19:35:07.586426 IP 13.224.212.80.443 > 10.0.2.15.39336: Flags [P.], seq 650801:653549, ack 803, win 65535, length 2748
19:35:07.586626 IP 13.224.212.80.443 > 10.0.2.15.39336: Flags [P.], seq 653549:657671, ack 803, win 65535, length 4122
19:35:07.586931 IP 10.0.2.15.39336 > 13.224.212.80.443: Flags [.], ack 657671, win 65535, length 0
19:35:07.587177 IP 13.224.212.80.443 > 10.0.2.15.39336: Flags [P.], seq 657671:661793, ack 803, win 65535, length 4122
19:35:07.587454 IP 13.224.212.80.443 > 10.0.2.15.39336: Flags [P.], seq 661793:665915, ack 803, win 65535, length 4122
19:35:07.587455 IP 13.224.212.80.443 > 10.0.2.15.39336: Flags [P.], seq 665915:667289, ack 803, win 65535, length 1374
19:35:07.587596 IP 13.224.212.80.443 > 10.0.2.15.39336: Flags [P.], seq 667289:672785, ack 803, win 65535, length 5496
19:35:07.587891 IP 13.224.212.80.443 > 10.0.2.15.39336: Flags [P.], seq 672785:676907, ack 803, win 65535, length 4122
19:35:07.587893 IP 13.224.212.80.443 > 10.0.2.15.39336: Flags [P.], seq 676907:679655, ack 803, win 65535, length 2748
19:35:07.588112 IP 13.224.212.80.443 > 10.0.2.15.39336: Flags [P.], seq 679655:685151, ack 803, win 65535, length 5496
19:35:07.588237 IP 13.224.212.80.443 > 10.0.2.15.39336: Flags [P.], seq 685151:687899, ack 803, win 65535, length 2748
19:35:07.588483 IP 13.224.212.80.443 > 10.0.2.15.39336: Flags [P.], seq 687899:692021, ack 803, win 65535, length 4122
19:35:07.588829 IP 10.0.2.15.39336 > 13.224.212.80.443: Flags [.], ack 692021, win 65535, length 0
19:35:07.589171 IP 13.224.212.80.443 > 10.0.2.15.39336: Flags [P.], seq 692021:696143, ack 803, win 65535, length 4122
19:35:07.589296 IP 13.224.212.80.443 > 10.0.2.15.39336: Flags [P.], seq 696143:700265, ack 803, win 65535, length 4122
19:35:07.589358 IP 13.224.212.80.443 > 10.0.2.15.39336: Flags [P.], seq 700265:704387, ack 803, win 65535, length 4122
19:35:07.589745 IP 13.224.212.80.443 > 10.0.2.15.39336: Flags [P.], seq 704387:707135, ack 803, win 65535, length 2748
19:35:07.589747 IP 13.224.212.80.443 > 10.0.2.15.39336: Flags [P.], seq 707135:709883, ack 803, win 65535, length 2748
19:35:07.589922 IP 13.224.212.80.443 > 10.0.2.15.39336: Flags [P.], seq 709883:715379, ack 803, win 65535, length 5496
19:35:07.590343 IP 13.224.212.80.443 > 10.0.2.15.39336: Flags [P.], seq 715379:719501, ack 803, win 65535, length 4122
19:35:07.590344 IP 13.224.212.80.443 > 10.0.2.15.39336: Flags [P.], seq 719501:722249, ack 803, win 65535, length 2748
19:35:07.590441 IP 13.224.212.80.443 > 10.0.2.15.39336: Flags [P.], seq 722249:727745, ack 803, win 65535, length 5496
19:35:07.590679 IP 10.0.2.15.39336 > 13.224.212.80.443: Flags [.], ack 727745, win 65535, length 0
19:35:07.591060 IP 13.224.212.80.443 > 10.0.2.15.39336: Flags [P.], seq 727745:735989, ack 803, win 65535, length 8244
19:35:07.591336 IP 10.0.2.15.39336 > 13.224.212.80.443: Flags [.], ack 735989, win 65535, length 0
19:35:07.591855 IP 13.224.212.80.443 > 10.0.2.15.39336: Flags [P.], seq 735989:741485, ack 803, win 65535, length 5496
19:35:07.591870 IP 10.0.2.15.39336 > 13.224.212.80.443: Flags [.], ack 741485, win 65535, length 0
19:35:07.592003 IP 13.224.212.80.443 > 10.0.2.15.39336: Flags [P.], seq 741485:746981, ack 803, win 65535, length 5496
19:35:07.592011 IP 10.0.2.15.39336 > 13.224.212.80.443: Flags [.], ack 746981, win 65535, length 0
19:35:07.592320 IP 13.224.212.80.443 > 10.0.2.15.39336: Flags [P.], seq 746981:749729, ack 803, win 65535, length 2748
19:35:07.592322 IP 13.224.212.80.443 > 10.0.2.15.39336: Flags [P.], seq 749729:753851, ack 803, win 65535, length 4122
19:35:07.592366 IP 10.0.2.15.39336 > 13.224.212.80.443: Flags [.], ack 749729, win 65535, length 0
19:35:07.592382 IP 10.0.2.15.39336 > 13.224.212.80.443: Flags [.], ack 753851, win 65535, length 0
19:35:07.592602 IP 13.224.212.80.443 > 10.0.2.15.39336: Flags [P.], seq 753851:756599, ack 803, win 65535, length 2748
19:35:07.592613 IP 10.0.2.15.39336 > 13.224.212.80.443: Flags [.], ack 756599, win 65535, length 0
19:35:07.592814 IP 13.224.212.80.443 > 10.0.2.15.39336: Flags [P.], seq 756599:760721, ack 803, win 65535, length 4122
19:35:07.592815 IP 13.224.212.80.443 > 10.0.2.15.39336: Flags [P.], seq 760721:763469, ack 803, win 65535, length 2748
19:35:07.592817 IP 13.224.212.80.443 > 10.0.2.15.39336: Flags [P.], seq 763469:767591, ack 803, win 65535, length 4122
19:35:07.592865 IP 10.0.2.15.39336 > 13.224.212.80.443: Flags [.], ack 760721, win 65535, length 0
19:35:07.593184 IP 13.224.212.80.443 > 10.0.2.15.39336: Flags [P.], seq 767591:771713, ack 803, win 65535, length 4122
19:35:07.593299 IP 13.224.212.80.443 > 10.0.2.15.39336: Flags [P.], seq 771713:775835, ack 803, win 65535, length 4122
19:35:07.593329 IP 10.0.2.15.39336 > 13.224.212.80.443: Flags [.], ack 775835, win 65535, length 0
19:35:07.594279 IP 13.224.212.80.443 > 10.0.2.15.39336: Flags [P.], seq 775835:782705, ack 803, win 65535, length 6870
19:35:07.594294 IP 10.0.2.15.39336 > 13.224.212.80.443: Flags [.], ack 782705, win 65535, length 0

