22:33:02.756345 IP 10.0.2.15.39696 > 140.233.253.2.53: 20960+ A? www.accuweather.com. (37)
22:33:02.756388 IP 10.0.2.15.39696 > 140.233.253.2.53: 19939+ AAAA? www.accuweather.com. (37)
22:33:02.761982 IP 140.233.253.2.53 > 10.0.2.15.39696: 19939 2/1/0 CNAME www.accuweather.com.edgekey.net., CNAME e1524.e12.akamaiedge.net. (177)
22:33:02.773745 IP 140.233.253.2.53 > 10.0.2.15.39696: 20960 3/0/0 CNAME www.accuweather.com.edgekey.net., CNAME e1524.e12.akamaiedge.net., A 23.36.36.84 (133)
22:33:02.774008 IP 10.0.2.15.60914 > 23.36.36.84.443: Flags [S], seq 3849216707, win 64240, options [mss 1460,sackOK,TS val 3794585315 ecr 0,nop,wscale 6], length 0
22:33:02.790119 IP 23.36.36.84.443 > 10.0.2.15.60914: Flags [S.], seq 327360001, ack 3849216708, win 65535, options [mss 1460], length 0
22:33:02.790158 IP 10.0.2.15.60914 > 23.36.36.84.443: Flags [.], ack 1, win 64240, length 0
22:33:02.800518 IP 10.0.2.15.60914 > 23.36.36.84.443: Flags [P.], seq 1:518, ack 1, win 64240, length 517
22:33:02.800834 IP 23.36.36.84.443 > 10.0.2.15.60914: Flags [.], ack 518, win 65535, length 0
22:33:02.816834 IP 23.36.36.84.443 > 10.0.2.15.60914: Flags [.], seq 1:2921, ack 518, win 65535, length 2920
22:33:02.816856 IP 10.0.2.15.60914 > 23.36.36.84.443: Flags [.], ack 2921, win 62780, length 0
22:33:02.817248 IP 23.36.36.84.443 > 10.0.2.15.60914: Flags [P.], seq 2921:4097, ack 518, win 65535, length 1176
22:33:02.817268 IP 10.0.2.15.60914 > 23.36.36.84.443: Flags [.], ack 4097, win 61604, length 0
22:33:02.818569 IP 23.36.36.84.443 > 10.0.2.15.60914: Flags [P.], seq 4097:4507, ack 518, win 65535, length 410
22:33:02.818592 IP 10.0.2.15.60914 > 23.36.36.84.443: Flags [.], ack 4507, win 62780, length 0
22:33:02.820061 IP 10.0.2.15.60914 > 23.36.36.84.443: Flags [P.], seq 518:598, ack 4507, win 62780, length 80
22:33:02.820433 IP 23.36.36.84.443 > 10.0.2.15.60914: Flags [.], ack 598, win 65535, length 0
22:33:02.820506 IP 10.0.2.15.60914 > 23.36.36.84.443: Flags [P.], seq 598:644, ack 4507, win 62780, length 46
22:33:02.820534 IP 10.0.2.15.60914 > 23.36.36.84.443: Flags [P.], seq 644:693, ack 4507, win 62780, length 49
22:33:02.820747 IP 23.36.36.84.443 > 10.0.2.15.60914: Flags [.], ack 644, win 65535, length 0
22:33:02.820764 IP 10.0.2.15.60914 > 23.36.36.84.443: Flags [P.], seq 693:793, ack 4507, win 62780, length 100
22:33:02.820946 IP 23.36.36.84.443 > 10.0.2.15.60914: Flags [.], ack 693, win 65535, length 0
22:33:02.820947 IP 23.36.36.84.443 > 10.0.2.15.60914: Flags [.], ack 793, win 65535, length 0
22:33:02.835036 IP 23.36.36.84.443 > 10.0.2.15.60914: Flags [P.], seq 4507:5173, ack 793, win 65535, length 666
22:33:02.835064 IP 10.0.2.15.60914 > 23.36.36.84.443: Flags [.], ack 5173, win 62780, length 0
22:33:02.835785 IP 10.0.2.15.60914 > 23.36.36.84.443: Flags [P.], seq 793:824, ack 5173, win 62780, length 31
22:33:02.836168 IP 23.36.36.84.443 > 10.0.2.15.60914: Flags [.], ack 824, win 65535, length 0

