22:33:18.804217 IP 10.0.2.15.42262 > 140.233.253.2.53: 21047+ A? www.accuweather.com. (37)
22:33:18.804248 IP 10.0.2.15.42262 > 140.233.253.2.53: 59184+ AAAA? www.accuweather.com. (37)
22:33:18.808868 IP 140.233.253.2.53 > 10.0.2.15.42262: 21047 3/0/0 CNAME www.accuweather.com.edgekey.net., CNAME e1524.e12.akamaiedge.net., A 23.36.36.84 (133)
22:33:18.808870 IP 140.233.253.2.53 > 10.0.2.15.42262: 59184 2/1/0 CNAME www.accuweather.com.edgekey.net., CNAME e1524.e12.akamaiedge.net. (177)
22:33:18.809094 IP 10.0.2.15.60920 > 23.36.36.84.443: Flags [S], seq 1263270474, win 64240, options [mss 1460,sackOK,TS val 3794601350 ecr 0,nop,wscale 6], length 0
22:33:18.825976 IP 23.36.36.84.443 > 10.0.2.15.60920: Flags [S.], seq 327744001, ack 1263270475, win 65535, options [mss 1460], length 0
22:33:18.826022 IP 10.0.2.15.60920 > 23.36.36.84.443: Flags [.], ack 1, win 64240, length 0
22:33:18.833925 IP 10.0.2.15.60920 > 23.36.36.84.443: Flags [P.], seq 1:518, ack 1, win 64240, length 517
22:33:18.834183 IP 23.36.36.84.443 > 10.0.2.15.60920: Flags [.], ack 518, win 65535, length 0
22:33:18.852153 IP 23.36.36.84.443 > 10.0.2.15.60920: Flags [.], seq 1:2921, ack 518, win 65535, length 2920
22:33:18.852267 IP 10.0.2.15.60920 > 23.36.36.84.443: Flags [.], ack 2921, win 62780, length 0
22:33:18.852504 IP 23.36.36.84.443 > 10.0.2.15.60920: Flags [P.], seq 2921:4507, ack 518, win 65535, length 1586
22:33:18.852518 IP 10.0.2.15.60920 > 23.36.36.84.443: Flags [.], ack 4507, win 61320, length 0
22:33:18.853768 IP 10.0.2.15.60920 > 23.36.36.84.443: Flags [P.], seq 518:598, ack 4507, win 62780, length 80
22:33:18.854125 IP 10.0.2.15.60920 > 23.36.36.84.443: Flags [P.], seq 598:644, ack 4507, win 62780, length 46
22:33:18.854399 IP 23.36.36.84.443 > 10.0.2.15.60920: Flags [.], ack 598, win 65535, length 0
22:33:18.854683 IP 23.36.36.84.443 > 10.0.2.15.60920: Flags [.], ack 644, win 65535, length 0
22:33:18.854836 IP 10.0.2.15.60920 > 23.36.36.84.443: Flags [P.], seq 644:693, ack 4507, win 62780, length 49
22:33:18.855219 IP 10.0.2.15.60920 > 23.36.36.84.443: Flags [P.], seq 693:728, ack 4507, win 62780, length 35
22:33:18.855501 IP 23.36.36.84.443 > 10.0.2.15.60920: Flags [.], ack 693, win 65535, length 0
22:33:18.855503 IP 23.36.36.84.443 > 10.0.2.15.60920: Flags [.], ack 728, win 65535, length 0
22:33:18.855705 IP 10.0.2.15.60920 > 23.36.36.84.443: Flags [P.], seq 728:793, ack 4507, win 62780, length 65
22:33:18.856066 IP 23.36.36.84.443 > 10.0.2.15.60920: Flags [.], ack 793, win 65535, length 0

