22:33:08.138027 IP 10.0.2.15.33473 > 140.233.253.2.53: 23315+ A? www.accuweather.com. (37)
22:33:08.138070 IP 10.0.2.15.33473 > 140.233.253.2.53: 63253+ AAAA? www.accuweather.com. (37)
22:33:08.143627 IP 140.233.253.2.53 > 10.0.2.15.33473: 23315 3/0/0 CNAME www.accuweather.com.edgekey.net., CNAME e1524.e12.akamaiedge.net., A 23.36.36.84 (133)
22:33:08.143629 IP 140.233.253.2.53 > 10.0.2.15.33473: 63253 2/1/0 CNAME www.accuweather.com.edgekey.net., CNAME e1524.e12.akamaiedge.net. (177)
22:33:08.143994 IP 10.0.2.15.60916 > 23.36.36.84.443: Flags [S], seq 2203911245, win 64240, options [mss 1460,sackOK,TS val 3794590685 ecr 0,nop,wscale 6], length 0
22:33:08.159506 IP 23.36.36.84.443 > 10.0.2.15.60916: Flags [S.], seq 327488001, ack 2203911246, win 65535, options [mss 1460], length 0
22:33:08.159557 IP 10.0.2.15.60916 > 23.36.36.84.443: Flags [.], ack 1, win 64240, length 0
22:33:08.168418 IP 10.0.2.15.60916 > 23.36.36.84.443: Flags [P.], seq 1:518, ack 1, win 64240, length 517
22:33:08.168792 IP 23.36.36.84.443 > 10.0.2.15.60916: Flags [.], ack 518, win 65535, length 0
22:33:08.185136 IP 23.36.36.84.443 > 10.0.2.15.60916: Flags [P.], seq 1:2749, ack 518, win 65535, length 2748
22:33:08.185158 IP 10.0.2.15.60916 > 23.36.36.84.443: Flags [.], ack 2749, win 62780, length 0
22:33:08.185888 IP 23.36.36.84.443 > 10.0.2.15.60916: Flags [P.], seq 2749:4097, ack 518, win 65535, length 1348
22:33:08.185904 IP 10.0.2.15.60916 > 23.36.36.84.443: Flags [.], ack 4097, win 61432, length 0
22:33:08.188249 IP 23.36.36.84.443 > 10.0.2.15.60916: Flags [P.], seq 4097:4507, ack 518, win 65535, length 410
22:33:08.188269 IP 10.0.2.15.60916 > 23.36.36.84.443: Flags [.], ack 4507, win 62780, length 0
22:33:08.189265 IP 10.0.2.15.60916 > 23.36.36.84.443: Flags [P.], seq 518:598, ack 4507, win 62780, length 80
22:33:08.189561 IP 23.36.36.84.443 > 10.0.2.15.60916: Flags [.], ack 598, win 65535, length 0
22:33:08.189599 IP 10.0.2.15.60916 > 23.36.36.84.443: Flags [P.], seq 598:644, ack 4507, win 62780, length 46
22:33:08.189627 IP 10.0.2.15.60916 > 23.36.36.84.443: Flags [P.], seq 644:693, ack 4507, win 62780, length 49
22:33:08.189876 IP 23.36.36.84.443 > 10.0.2.15.60916: Flags [.], ack 644, win 65535, length 0
22:33:08.189877 IP 23.36.36.84.443 > 10.0.2.15.60916: Flags [.], ack 693, win 65535, length 0
22:33:08.189897 IP 10.0.2.15.60916 > 23.36.36.84.443: Flags [P.], seq 693:793, ack 4507, win 62780, length 100
22:33:08.190065 IP 23.36.36.84.443 > 10.0.2.15.60916: Flags [.], ack 793, win 65535, length 0
22:33:08.205210 IP 23.36.36.84.443 > 10.0.2.15.60916: Flags [P.], seq 4507:5173, ack 793, win 65535, length 666
22:33:08.205257 IP 10.0.2.15.60916 > 23.36.36.84.443: Flags [.], ack 5173, win 62780, length 0
22:33:08.205701 IP 10.0.2.15.60916 > 23.36.36.84.443: Flags [P.], seq 793:824, ack 5173, win 62780, length 31
22:33:08.206535 IP 23.36.36.84.443 > 10.0.2.15.60916: Flags [.], ack 824, win 65535, length 0
22:33:08.209485 IP 23.36.36.84.443 > 10.0.2.15.60916: Flags [P.], seq 5173:5673, ack 824, win 65535, length 500
22:33:08.209505 IP 10.0.2.15.60916 > 23.36.36.84.443: Flags [.], ack 5673, win 62780, length 0
22:33:08.209941 IP 10.0.2.15.60916 > 23.36.36.84.443: Flags [P.], seq 824:848, ack 5673, win 62780, length 24
22:33:08.210229 IP 23.36.36.84.443 > 10.0.2.15.60916: Flags [.], ack 848, win 65535, length 0
22:33:08.210870 IP 10.0.2.15.60916 > 23.36.36.84.443: Flags [F.], seq 848, ack 5673, win 62780, length 0
22:33:08.211091 IP 23.36.36.84.443 > 10.0.2.15.60916: Flags [.], ack 849, win 65535, length 0
22:33:08.224899 IP 23.36.36.84.443 > 10.0.2.15.60916: Flags [P.], seq 5673:5697, ack 849, win 65535, length 24
22:33:08.224911 IP 23.36.36.84.443 > 10.0.2.15.60916: Flags [F.], seq 5697, ack 849, win 65535, length 0
22:33:08.224932 IP 10.0.2.15.60916 > 23.36.36.84.443: Flags [R], seq 2203912094, win 0, length 0
22:33:08.225057 IP 10.0.2.15.60916 > 23.36.36.84.443: Flags [R], seq 2203912094, win 0, length 0
22:33:08.225270 IP 23.36.36.84.443 > 10.0.2.15.60916: Flags [R.], seq 3967479295, ack 849, win 0, length 0

