22:30:53.635485 IP 10.0.2.15.54408 > 140.233.253.2.53: 41180+ A? www.accuweather.com. (37)
22:30:53.635522 IP 10.0.2.15.54408 > 140.233.253.2.53: 61657+ AAAA? www.accuweather.com. (37)
22:30:53.641973 IP 140.233.253.2.53 > 10.0.2.15.54408: 61657 2/1/0 CNAME www.accuweather.com.edgekey.net., CNAME e1524.e12.akamaiedge.net. (177)
22:30:53.653502 IP 140.233.253.2.53 > 10.0.2.15.54408: 41180 3/0/0 CNAME www.accuweather.com.edgekey.net., CNAME e1524.e12.akamaiedge.net., A 23.36.36.84 (133)
22:30:53.653741 IP 10.0.2.15.60864 > 23.36.36.84.443: Flags [S], seq 164804424, win 64240, options [mss 1460,sackOK,TS val 3794456194 ecr 0,nop,wscale 6], length 0
22:30:53.669703 IP 23.36.36.84.443 > 10.0.2.15.60864: Flags [S.], seq 324288001, ack 164804425, win 65535, options [mss 1460], length 0
22:30:53.669740 IP 10.0.2.15.60864 > 23.36.36.84.443: Flags [.], ack 1, win 64240, length 0
22:30:53.680046 IP 10.0.2.15.60864 > 23.36.36.84.443: Flags [P.], seq 1:518, ack 1, win 64240, length 517
22:30:53.680514 IP 23.36.36.84.443 > 10.0.2.15.60864: Flags [.], ack 518, win 65535, length 0
22:30:53.697124 IP 23.36.36.84.443 > 10.0.2.15.60864: Flags [P.], seq 1:2749, ack 518, win 65535, length 2748
22:30:53.697146 IP 10.0.2.15.60864 > 23.36.36.84.443: Flags [.], ack 2749, win 62780, length 0
22:30:53.697831 IP 23.36.36.84.443 > 10.0.2.15.60864: Flags [P.], seq 2749:4097, ack 518, win 65535, length 1348
22:30:53.697890 IP 10.0.2.15.60864 > 23.36.36.84.443: Flags [.], ack 4097, win 61432, length 0
22:30:53.700146 IP 23.36.36.84.443 > 10.0.2.15.60864: Flags [P.], seq 4097:4507, ack 518, win 65535, length 410
22:30:53.700173 IP 10.0.2.15.60864 > 23.36.36.84.443: Flags [.], ack 4507, win 62780, length 0
22:30:53.701394 IP 10.0.2.15.60864 > 23.36.36.84.443: Flags [P.], seq 518:598, ack 4507, win 62780, length 80
22:30:53.701710 IP 23.36.36.84.443 > 10.0.2.15.60864: Flags [.], ack 598, win 65535, length 0
22:30:53.701732 IP 10.0.2.15.60864 > 23.36.36.84.443: Flags [P.], seq 598:644, ack 4507, win 62780, length 46
22:30:53.701999 IP 23.36.36.84.443 > 10.0.2.15.60864: Flags [.], ack 644, win 65535, length 0
22:30:53.702134 IP 10.0.2.15.60864 > 23.36.36.84.443: Flags [P.], seq 644:693, ack 4507, win 62780, length 49
22:30:53.702203 IP 10.0.2.15.60864 > 23.36.36.84.443: Flags [P.], seq 693:793, ack 4507, win 62780, length 100
22:30:53.702433 IP 23.36.36.84.443 > 10.0.2.15.60864: Flags [.], ack 693, win 65535, length 0
22:30:53.702435 IP 23.36.36.84.443 > 10.0.2.15.60864: Flags [.], ack 793, win 65535, length 0
22:30:53.715398 IP 23.36.36.84.443 > 10.0.2.15.60864: Flags [P.], seq 4507:5142, ack 793, win 65535, length 635
22:30:53.715421 IP 10.0.2.15.60864 > 23.36.36.84.443: Flags [.], ack 5142, win 62780, length 0
22:30:53.715824 IP 10.0.2.15.60864 > 23.36.36.84.443: Flags [P.], seq 793:824, ack 5142, win 62780, length 31
22:30:53.716318 IP 23.36.36.84.443 > 10.0.2.15.60864: Flags [.], ack 824, win 65535, length 0
22:30:53.716439 IP 23.36.36.84.443 > 10.0.2.15.60864: Flags [P.], seq 5142:5173, ack 824, win 65535, length 31
22:30:53.716453 IP 10.0.2.15.60864 > 23.36.36.84.443: Flags [.], ack 5173, win 62780, length 0

