20:24:18.070735 IP 10.0.2.15.47112 > 140.233.253.2.53: 7677+ A? www.ebay.com. (30)
20:24:18.070781 IP 10.0.2.15.47112 > 140.233.253.2.53: 15587+ AAAA? www.ebay.com. (30)
20:24:18.079556 IP 140.233.253.2.53 > 10.0.2.15.47112: 15587 2/1/0 CNAME slot9428.ebay.com.edgekey.net., CNAME e9428.a.akamaiedge.net. (164)
20:24:18.089052 IP 140.233.253.2.53 > 10.0.2.15.47112: 7677 3/0/0 CNAME slot9428.ebay.com.edgekey.net., CNAME e9428.a.akamaiedge.net., A 23.33.241.97 (122)
20:24:18.089336 IP 10.0.2.15.34552 > 23.33.241.97.443: Flags [S], seq 2818501626, win 64240, options [mss 1460,sackOK,TS val 9388764 ecr 0,nop,wscale 6], length 0
20:24:18.104058 IP 23.33.241.97.443 > 10.0.2.15.34552: Flags [S.], seq 253440001, ack 2818501627, win 65535, options [mss 1460], length 0
20:24:18.104293 IP 10.0.2.15.34552 > 23.33.241.97.443: Flags [.], ack 1, win 64240, length 0
20:24:18.112888 IP 10.0.2.15.34552 > 23.33.241.97.443: Flags [P.], seq 1:518, ack 1, win 64240, length 517
20:24:18.113323 IP 23.33.241.97.443 > 10.0.2.15.34552: Flags [.], ack 518, win 65535, length 0
20:24:18.132558 IP 23.33.241.97.443 > 10.0.2.15.34552: Flags [.], seq 1:2921, ack 518, win 65535, length 2920
20:24:18.132581 IP 10.0.2.15.34552 > 23.33.241.97.443: Flags [.], ack 2921, win 62780, length 0
20:24:18.133206 IP 23.33.241.97.443 > 10.0.2.15.34552: Flags [P.], seq 2921:4695, ack 518, win 65535, length 1774
20:24:18.133225 IP 10.0.2.15.34552 > 23.33.241.97.443: Flags [.], ack 4695, win 61320, length 0
20:24:18.134601 IP 10.0.2.15.34552 > 23.33.241.97.443: Flags [P.], seq 518:598, ack 4695, win 62780, length 80
20:24:18.134972 IP 23.33.241.97.443 > 10.0.2.15.34552: Flags [.], ack 598, win 65535, length 0
20:24:18.135299 IP 10.0.2.15.34552 > 23.33.241.97.443: Flags [P.], seq 598:644, ack 4695, win 62780, length 46
20:24:18.135345 IP 10.0.2.15.34552 > 23.33.241.97.443: Flags [P.], seq 644:693, ack 4695, win 62780, length 49
20:24:18.135706 IP 10.0.2.15.34552 > 23.33.241.97.443: Flags [P.], seq 693:728, ack 4695, win 62780, length 35
20:24:18.135900 IP 23.33.241.97.443 > 10.0.2.15.34552: Flags [.], ack 644, win 65535, length 0
20:24:18.135902 IP 23.33.241.97.443 > 10.0.2.15.34552: Flags [.], ack 693, win 65535, length 0
20:24:18.136008 IP 10.0.2.15.34552 > 23.33.241.97.443: Flags [P.], seq 728:788, ack 4695, win 62780, length 60
20:24:18.136846 IP 23.33.241.97.443 > 10.0.2.15.34552: Flags [.], ack 728, win 65535, length 0
20:24:18.136848 IP 23.33.241.97.443 > 10.0.2.15.34552: Flags [.], ack 788, win 65535, length 0
20:24:18.148613 IP 23.33.241.97.443 > 10.0.2.15.34552: Flags [P.], seq 4695:5237, ack 788, win 65535, length 542
20:24:18.148632 IP 10.0.2.15.34552 > 23.33.241.97.443: Flags [.], ack 5237, win 62780, length 0
20:24:18.149730 IP 23.33.241.97.443 > 10.0.2.15.34552: Flags [P.], seq 5237:5329, ack 788, win 65535, length 92
20:24:18.149853 IP 10.0.2.15.34552 > 23.33.241.97.443: Flags [.], ack 5329, win 62780, length 0
20:24:18.150270 IP 10.0.2.15.34552 > 23.33.241.97.443: Flags [P.], seq 788:819, ack 5329, win 62780, length 31
20:24:18.150568 IP 23.33.241.97.443 > 10.0.2.15.34552: Flags [.], ack 819, win 65535, length 0
20:24:18.327737 IP 23.33.241.97.443 > 10.0.2.15.34552: Flags [P.], seq 5329:12169, ack 819, win 65535, length 6840
20:24:18.327740 IP 23.33.241.97.443 > 10.0.2.15.34552: Flags [.], seq 12169:13629, ack 819, win 65535, length 1460
20:24:18.327784 IP 10.0.2.15.34552 > 23.33.241.97.443: Flags [.], ack 12169, win 59860, length 0
20:24:18.327818 IP 10.0.2.15.34552 > 23.33.241.97.443: Flags [.], ack 13629, win 58400, length 0
20:24:18.328078 IP 23.33.241.97.443 > 10.0.2.15.34552: Flags [.], seq 13629:16549, ack 819, win 65535, length 2920
20:24:18.328089 IP 10.0.2.15.34552 > 23.33.241.97.443: Flags [.], ack 16549, win 56940, length 0
20:24:18.328233 IP 23.33.241.97.443 > 10.0.2.15.34552: Flags [P.], seq 16549:17650, ack 819, win 65535, length 1101
20:24:18.328240 IP 10.0.2.15.34552 > 23.33.241.97.443: Flags [.], ack 17650, win 55839, length 0
20:24:18.329249 IP 23.33.241.97.443 > 10.0.2.15.34552: Flags [P.], seq 17650:21582, ack 819, win 65535, length 3932
20:24:18.329264 IP 10.0.2.15.34552 > 23.33.241.97.443: Flags [.], ack 21582, win 61320, length 0
20:24:18.330420 IP 23.33.241.97.443 > 10.0.2.15.34552: Flags [P.], seq 21582:25737, ack 819, win 65535, length 4155
20:24:18.330440 IP 10.0.2.15.34552 > 23.33.241.97.443: Flags [.], ack 25737, win 61320, length 0
20:24:18.332036 IP 23.33.241.97.443 > 10.0.2.15.34552: Flags [P.], seq 25737:28470, ack 819, win 65535, length 2733
20:24:18.332056 IP 10.0.2.15.34552 > 23.33.241.97.443: Flags [.], ack 28470, win 62780, length 0
20:24:18.333019 IP 23.33.241.97.443 > 10.0.2.15.34552: Flags [P.], seq 28470:31218, ack 819, win 65535, length 2748
20:24:18.333036 IP 10.0.2.15.34552 > 23.33.241.97.443: Flags [.], ack 31218, win 62780, length 0
20:24:18.341820 IP 23.33.241.97.443 > 10.0.2.15.34552: Flags [P.], seq 31218:35340, ack 819, win 65535, length 4122
20:24:18.341940 IP 10.0.2.15.34552 > 23.33.241.97.443: Flags [.], ack 35340, win 61320, length 0
20:24:18.342963 IP 23.33.241.97.443 > 10.0.2.15.34552: Flags [P.], seq 35340:38088, ack 819, win 65535, length 2748
20:24:18.342985 IP 10.0.2.15.34552 > 23.33.241.97.443: Flags [.], ack 38088, win 62780, length 0
20:24:18.344970 IP 23.33.241.97.443 > 10.0.2.15.34552: Flags [P.], seq 38088:38222, ack 819, win 65535, length 134
20:24:18.345073 IP 10.0.2.15.34552 > 23.33.241.97.443: Flags [.], ack 38222, win 62780, length 0
20:24:18.361875 IP 23.33.241.97.443 > 10.0.2.15.34552: Flags [P.], seq 38222:43718, ack 819, win 65535, length 5496
20:24:18.362071 IP 10.0.2.15.34552 > 23.33.241.97.443: Flags [.], ack 43718, win 61320, length 0
20:24:18.363444 IP 23.33.241.97.443 > 10.0.2.15.34552: Flags [P.], seq 43718:47825, ack 819, win 65535, length 4107
20:24:18.363472 IP 10.0.2.15.34552 > 23.33.241.97.443: Flags [.], ack 47825, win 61320, length 0
20:24:18.364314 IP 23.33.241.97.443 > 10.0.2.15.34552: Flags [P.], seq 47825:51932, ack 819, win 65535, length 4107
20:24:18.364328 IP 10.0.2.15.34552 > 23.33.241.97.443: Flags [.], ack 51932, win 61320, length 0
20:24:18.370620 IP 23.33.241.97.443 > 10.0.2.15.34552: Flags [P.], seq 51932:54680, ack 819, win 65535, length 2748
20:24:18.370648 IP 10.0.2.15.34552 > 23.33.241.97.443: Flags [.], ack 54680, win 62780, length 0
20:24:18.371901 IP 23.33.241.97.443 > 10.0.2.15.34552: Flags [P.], seq 54680:58839, ack 819, win 65535, length 4159
20:24:18.372074 IP 10.0.2.15.34552 > 23.33.241.97.443: Flags [.], ack 58839, win 61320, length 0
20:24:18.372831 IP 23.33.241.97.443 > 10.0.2.15.34552: Flags [P.], seq 58839:64320, ack 819, win 65535, length 5481
20:24:18.372852 IP 10.0.2.15.34552 > 23.33.241.97.443: Flags [.], ack 64320, win 61320, length 0
20:24:18.373687 IP 23.33.241.97.443 > 10.0.2.15.34552: Flags [P.], seq 64320:68427, ack 819, win 65535, length 4107
20:24:18.373825 IP 10.0.2.15.34552 > 23.33.241.97.443: Flags [.], ack 68427, win 61320, length 0
20:24:18.387718 IP 23.33.241.97.443 > 10.0.2.15.34552: Flags [P.], seq 68427:71212, ack 819, win 65535, length 2785
20:24:18.387747 IP 10.0.2.15.34552 > 23.33.241.97.443: Flags [.], ack 71212, win 65535, length 0
20:24:18.404571 IP 23.33.241.97.443 > 10.0.2.15.34552: Flags [P.], seq 71212:74227, ack 819, win 65535, length 3015
20:24:18.404594 IP 10.0.2.15.34552 > 23.33.241.97.443: Flags [.], ack 74227, win 65535, length 0
20:24:18.568904 IP 23.33.241.97.443 > 10.0.2.15.34552: Flags [P.], seq 74227:75653, ack 819, win 65535, length 1426
20:24:18.568928 IP 10.0.2.15.34552 > 23.33.241.97.443: Flags [.], ack 75653, win 65535, length 0
20:24:18.569846 IP 23.33.241.97.443 > 10.0.2.15.34552: Flags [P.], seq 75653:79928, ack 819, win 65535, length 4275
20:24:18.569868 IP 10.0.2.15.34552 > 23.33.241.97.443: Flags [.], ack 79928, win 65535, length 0
20:24:18.571440 IP 23.33.241.97.443 > 10.0.2.15.34552: Flags [P.], seq 79928:86798, ack 819, win 65535, length 6870
20:24:18.571442 IP 23.33.241.97.443 > 10.0.2.15.34552: Flags [P.], seq 86798:89546, ack 819, win 65535, length 2748
20:24:18.571469 IP 10.0.2.15.34552 > 23.33.241.97.443: Flags [.], ack 86798, win 65535, length 0
20:24:18.571513 IP 10.0.2.15.34552 > 23.33.241.97.443: Flags [.], ack 89546, win 65535, length 0
20:24:18.571893 IP 23.33.241.97.443 > 10.0.2.15.34552: Flags [P.], seq 89546:92294, ack 819, win 65535, length 2748
20:24:18.571909 IP 10.0.2.15.34552 > 23.33.241.97.443: Flags [.], ack 92294, win 65535, length 0
20:24:18.573395 IP 23.33.241.97.443 > 10.0.2.15.34552: Flags [P.], seq 92294:97790, ack 819, win 65535, length 5496
20:24:18.573397 IP 23.33.241.97.443 > 10.0.2.15.34552: Flags [P.], seq 97790:99164, ack 819, win 65535, length 1374
20:24:18.573464 IP 10.0.2.15.34552 > 23.33.241.97.443: Flags [.], ack 97790, win 65535, length 0
20:24:18.573596 IP 10.0.2.15.34552 > 23.33.241.97.443: Flags [.], ack 99164, win 65535, length 0
20:24:18.573779 IP 23.33.241.97.443 > 10.0.2.15.34552: Flags [P.], seq 99164:101912, ack 819, win 65535, length 2748
20:24:18.573780 IP 23.33.241.97.443 > 10.0.2.15.34552: Flags [P.], seq 101912:104660, ack 819, win 65535, length 2748
20:24:18.573789 IP 10.0.2.15.34552 > 23.33.241.97.443: Flags [.], ack 101912, win 65535, length 0
20:24:18.573810 IP 10.0.2.15.34552 > 23.33.241.97.443: Flags [.], ack 104660, win 65535, length 0
20:24:18.575304 IP 23.33.241.97.443 > 10.0.2.15.34552: Flags [P.], seq 104660:108782, ack 819, win 65535, length 4122
20:24:18.575321 IP 10.0.2.15.34552 > 23.33.241.97.443: Flags [.], ack 108782, win 65535, length 0
20:24:18.575453 IP 23.33.241.97.443 > 10.0.2.15.34552: Flags [P.], seq 108782:111500, ack 819, win 65535, length 2718
20:24:18.575460 IP 10.0.2.15.34552 > 23.33.241.97.443: Flags [.], ack 111500, win 65535, length 0
20:24:18.575752 IP 23.33.241.97.443 > 10.0.2.15.34552: Flags [P.], seq 111500:112874, ack 819, win 65535, length 1374
20:24:18.575761 IP 10.0.2.15.34552 > 23.33.241.97.443: Flags [.], ack 112874, win 65535, length 0
20:24:18.576354 IP 23.33.241.97.443 > 10.0.2.15.34552: Flags [P.], seq 112874:116996, ack 819, win 65535, length 4122
20:24:18.576376 IP 10.0.2.15.34552 > 23.33.241.97.443: Flags [.], ack 116996, win 65535, length 0
20:24:18.576755 IP 23.33.241.97.443 > 10.0.2.15.34552: Flags [P.], seq 116996:121118, ack 819, win 65535, length 4122
20:24:18.576767 IP 10.0.2.15.34552 > 23.33.241.97.443: Flags [.], ack 121118, win 65535, length 0
20:24:18.577601 IP 23.33.241.97.443 > 10.0.2.15.34552: Flags [P.], seq 121118:125240, ack 819, win 65535, length 4122
20:24:18.577618 IP 10.0.2.15.34552 > 23.33.241.97.443: Flags [.], ack 125240, win 65535, length 0
20:24:18.578778 IP 23.33.241.97.443 > 10.0.2.15.34552: Flags [P.], seq 125240:130736, ack 819, win 65535, length 5496
20:24:18.578792 IP 10.0.2.15.34552 > 23.33.241.97.443: Flags [.], ack 130736, win 65535, length 0
20:24:18.579648 IP 23.33.241.97.443 > 10.0.2.15.34552: Flags [P.], seq 130736:133484, ack 819, win 65535, length 2748
20:24:18.579661 IP 10.0.2.15.34552 > 23.33.241.97.443: Flags [.], ack 133484, win 65535, length 0
20:24:18.580933 IP 23.33.241.97.443 > 10.0.2.15.34552: Flags [P.], seq 133484:137606, ack 819, win 65535, length 4122
20:24:18.580936 IP 23.33.241.97.443 > 10.0.2.15.34552: Flags [P.], seq 137606:138980, ack 819, win 65535, length 1374
20:24:18.580954 IP 10.0.2.15.34552 > 23.33.241.97.443: Flags [.], ack 137606, win 65535, length 0
20:24:18.581118 IP 10.0.2.15.34552 > 23.33.241.97.443: Flags [.], ack 138980, win 65535, length 0
20:24:18.581222 IP 23.33.241.97.443 > 10.0.2.15.34552: Flags [P.], seq 138980:141728, ack 819, win 65535, length 2748
20:24:18.581228 IP 10.0.2.15.34552 > 23.33.241.97.443: Flags [.], ack 141728, win 65535, length 0
20:24:18.582411 IP 23.33.241.97.443 > 10.0.2.15.34552: Flags [P.], seq 141728:145850, ack 819, win 65535, length 4122
20:24:18.582435 IP 10.0.2.15.34552 > 23.33.241.97.443: Flags [.], ack 145850, win 65535, length 0
20:24:18.583027 IP 23.33.241.97.443 > 10.0.2.15.34552: Flags [P.], seq 145850:149972, ack 819, win 65535, length 4122
20:24:18.583081 IP 23.33.241.97.443 > 10.0.2.15.34552: Flags [P.], seq 149972:151346, ack 819, win 65535, length 1374
20:24:18.583100 IP 10.0.2.15.34552 > 23.33.241.97.443: Flags [.], ack 149972, win 65535, length 0
20:24:18.583167 IP 10.0.2.15.34552 > 23.33.241.97.443: Flags [.], ack 151346, win 65535, length 0
20:24:18.583280 IP 23.33.241.97.443 > 10.0.2.15.34552: Flags [P.], seq 151346:154094, ack 819, win 65535, length 2748
20:24:18.583285 IP 10.0.2.15.34552 > 23.33.241.97.443: Flags [.], ack 154094, win 65535, length 0
20:24:18.584490 IP 23.33.241.97.443 > 10.0.2.15.34552: Flags [P.], seq 154094:159590, ack 819, win 65535, length 5496
20:24:18.584510 IP 10.0.2.15.34552 > 23.33.241.97.443: Flags [.], ack 159590, win 65535, length 0
20:24:18.585469 IP 23.33.241.97.443 > 10.0.2.15.34552: Flags [P.], seq 159590:162338, ack 819, win 65535, length 2748
20:24:18.585492 IP 10.0.2.15.34552 > 23.33.241.97.443: Flags [.], ack 162338, win 65535, length 0
20:24:18.586890 IP 23.33.241.97.443 > 10.0.2.15.34552: Flags [P.], seq 162338:169208, ack 819, win 65535, length 6870
20:24:18.586893 IP 23.33.241.97.443 > 10.0.2.15.34552: Flags [P.], seq 169208:171956, ack 819, win 65535, length 2748
20:24:18.586914 IP 10.0.2.15.34552 > 23.33.241.97.443: Flags [.], ack 169208, win 65535, length 0
20:24:18.586980 IP 10.0.2.15.34552 > 23.33.241.97.443: Flags [.], ack 171956, win 65535, length 0
20:24:18.588099 IP 23.33.241.97.443 > 10.0.2.15.34552: Flags [P.], seq 171956:177452, ack 819, win 65535, length 5496
20:24:18.588101 IP 23.33.241.97.443 > 10.0.2.15.34552: Flags [P.], seq 177452:178826, ack 819, win 65535, length 1374
20:24:18.588121 IP 10.0.2.15.34552 > 23.33.241.97.443: Flags [.], ack 177452, win 65535, length 0
20:24:18.588222 IP 10.0.2.15.34552 > 23.33.241.97.443: Flags [.], ack 178826, win 65535, length 0
20:24:18.589219 IP 23.33.241.97.443 > 10.0.2.15.34552: Flags [P.], seq 178826:182948, ack 819, win 65535, length 4122
20:24:18.589238 IP 10.0.2.15.34552 > 23.33.241.97.443: Flags [.], ack 182948, win 65535, length 0
20:24:18.589878 IP 23.33.241.97.443 > 10.0.2.15.34552: Flags [P.], seq 182948:188445, ack 819, win 65535, length 5497
20:24:18.589897 IP 10.0.2.15.34552 > 23.33.241.97.443: Flags [.], ack 188445, win 65535, length 0
20:24:18.591212 IP 23.33.241.97.443 > 10.0.2.15.34552: Flags [P.], seq 188445:195255, ack 819, win 65535, length 6810
20:24:18.591232 IP 10.0.2.15.34552 > 23.33.241.97.443: Flags [.], ack 195255, win 65535, length 0
20:24:18.591490 IP 23.33.241.97.443 > 10.0.2.15.34552: Flags [P.], seq 195255:198003, ack 819, win 65535, length 2748
20:24:18.591497 IP 10.0.2.15.34552 > 23.33.241.97.443: Flags [.], ack 198003, win 65535, length 0
20:24:18.592599 IP 23.33.241.97.443 > 10.0.2.15.34552: Flags [P.], seq 198003:203499, ack 819, win 65535, length 5496
20:24:18.592618 IP 10.0.2.15.34552 > 23.33.241.97.443: Flags [.], ack 203499, win 65535, length 0
20:24:18.593393 IP 23.33.241.97.443 > 10.0.2.15.34552: Flags [P.], seq 203499:207621, ack 819, win 65535, length 4122
20:24:18.593394 IP 23.33.241.97.443 > 10.0.2.15.34552: Flags [P.], seq 207621:208995, ack 819, win 65535, length 1374
20:24:18.593409 IP 10.0.2.15.34552 > 23.33.241.97.443: Flags [.], ack 207621, win 65535, length 0
20:24:18.593437 IP 10.0.2.15.34552 > 23.33.241.97.443: Flags [.], ack 208995, win 65535, length 0
20:24:18.594227 IP 23.33.241.97.443 > 10.0.2.15.34552: Flags [P.], seq 208995:213117, ack 819, win 65535, length 4122
20:24:18.594228 IP 23.33.241.97.443 > 10.0.2.15.34552: Flags [P.], seq 213117:215865, ack 819, win 65535, length 2748
20:24:18.594246 IP 10.0.2.15.34552 > 23.33.241.97.443: Flags [.], ack 213117, win 65535, length 0
20:24:18.594269 IP 10.0.2.15.34552 > 23.33.241.97.443: Flags [.], ack 215865, win 65535, length 0
20:24:18.595453 IP 23.33.241.97.443 > 10.0.2.15.34552: Flags [P.], seq 215865:219987, ack 819, win 65535, length 4122
20:24:18.595472 IP 10.0.2.15.34552 > 23.33.241.97.443: Flags [.], ack 219987, win 65535, length 0
20:24:18.595935 IP 23.33.241.97.443 > 10.0.2.15.34552: Flags [P.], seq 219987:224109, ack 819, win 65535, length 4122
20:24:18.595937 IP 23.33.241.97.443 > 10.0.2.15.34552: Flags [P.], seq 224109:225483, ack 819, win 65535, length 1374
20:24:18.595950 IP 10.0.2.15.34552 > 23.33.241.97.443: Flags [.], ack 224109, win 65535, length 0
20:24:18.595964 IP 10.0.2.15.34552 > 23.33.241.97.443: Flags [.], ack 225483, win 65535, length 0
20:24:18.596631 IP 23.33.241.97.443 > 10.0.2.15.34552: Flags [P.], seq 225483:229605, ack 819, win 65535, length 4122
20:24:18.596643 IP 10.0.2.15.34552 > 23.33.241.97.443: Flags [.], ack 229605, win 65535, length 0
20:24:18.596787 IP 23.33.241.97.443 > 10.0.2.15.34552: Flags [P.], seq 229605:230979, ack 819, win 65535, length 1374
20:24:18.596802 IP 10.0.2.15.34552 > 23.33.241.97.443: Flags [.], ack 230979, win 65535, length 0
20:24:18.597766 IP 23.33.241.97.443 > 10.0.2.15.34552: Flags [P.], seq 230979:237849, ack 819, win 65535, length 6870
20:24:18.597782 IP 10.0.2.15.34552 > 23.33.241.97.443: Flags [.], ack 237849, win 65535, length 0
20:24:18.598992 IP 23.33.241.97.443 > 10.0.2.15.34552: Flags [P.], seq 237849:244719, ack 819, win 65535, length 6870
20:24:18.599076 IP 10.0.2.15.34552 > 23.33.241.97.443: Flags [.], ack 244719, win 65535, length 0
20:24:18.599212 IP 23.33.241.97.443 > 10.0.2.15.34552: Flags [P.], seq 244719:246093, ack 819, win 65535, length 1374
20:24:18.599220 IP 10.0.2.15.34552 > 23.33.241.97.443: Flags [.], ack 246093, win 65535, length 0

