20:26:49.201964 IP 10.0.2.15.49336 > 140.233.253.2.53: 2610+ A? www.ebay.com. (30)
20:26:49.202005 IP 10.0.2.15.49336 > 140.233.253.2.53: 56109+ AAAA? www.ebay.com. (30)
20:26:49.208746 IP 140.233.253.2.53 > 10.0.2.15.49336: 56109 2/1/0 CNAME slot9428.ebay.com.edgekey.net., CNAME e9428.a.akamaiedge.net. (164)
20:26:49.218029 IP 140.233.253.2.53 > 10.0.2.15.49336: 2610 3/0/0 CNAME slot9428.ebay.com.edgekey.net., CNAME e9428.a.akamaiedge.net., A 23.33.241.97 (122)
20:26:49.218306 IP 10.0.2.15.34610 > 23.33.241.97.443: Flags [S], seq 170512989, win 64240, options [mss 1460,sackOK,TS val 9539893 ecr 0,nop,wscale 6], length 0
20:26:49.235304 IP 23.33.241.97.443 > 10.0.2.15.34610: Flags [S.], seq 258112001, ack 170512990, win 65535, options [mss 1460], length 0
20:26:49.235357 IP 10.0.2.15.34610 > 23.33.241.97.443: Flags [.], ack 1, win 64240, length 0
20:26:49.243522 IP 10.0.2.15.34610 > 23.33.241.97.443: Flags [P.], seq 1:518, ack 1, win 64240, length 517
20:26:49.243904 IP 23.33.241.97.443 > 10.0.2.15.34610: Flags [.], ack 518, win 65535, length 0
20:26:49.260802 IP 23.33.241.97.443 > 10.0.2.15.34610: Flags [.], seq 1:2921, ack 518, win 65535, length 2920
20:26:49.260825 IP 10.0.2.15.34610 > 23.33.241.97.443: Flags [.], ack 2921, win 62780, length 0
20:26:49.261065 IP 23.33.241.97.443 > 10.0.2.15.34610: Flags [P.], seq 2921:4097, ack 518, win 65535, length 1176
20:26:49.261080 IP 10.0.2.15.34610 > 23.33.241.97.443: Flags [.], ack 4097, win 61604, length 0
20:26:49.263109 IP 23.33.241.97.443 > 10.0.2.15.34610: Flags [P.], seq 4097:4695, ack 518, win 65535, length 598
20:26:49.263134 IP 10.0.2.15.34610 > 23.33.241.97.443: Flags [.], ack 4695, win 62780, length 0
20:26:49.264200 IP 10.0.2.15.34610 > 23.33.241.97.443: Flags [P.], seq 518:598, ack 4695, win 62780, length 80
20:26:49.264562 IP 23.33.241.97.443 > 10.0.2.15.34610: Flags [.], ack 598, win 65535, length 0
20:26:49.264657 IP 10.0.2.15.34610 > 23.33.241.97.443: Flags [P.], seq 598:644, ack 4695, win 62780, length 46
20:26:49.264688 IP 10.0.2.15.34610 > 23.33.241.97.443: Flags [P.], seq 644:693, ack 4695, win 62780, length 49
20:26:49.264863 IP 10.0.2.15.34610 > 23.33.241.97.443: Flags [P.], seq 693:788, ack 4695, win 62780, length 95
20:26:49.265330 IP 23.33.241.97.443 > 10.0.2.15.34610: Flags [.], ack 644, win 65535, length 0
20:26:49.265332 IP 23.33.241.97.443 > 10.0.2.15.34610: Flags [.], ack 693, win 65535, length 0
20:26:49.265332 IP 23.33.241.97.443 > 10.0.2.15.34610: Flags [.], ack 788, win 65535, length 0
20:26:49.282381 IP 23.33.241.97.443 > 10.0.2.15.34610: Flags [P.], seq 4695:5237, ack 788, win 65535, length 542
20:26:49.282404 IP 10.0.2.15.34610 > 23.33.241.97.443: Flags [.], ack 5237, win 62780, length 0
20:26:49.302588 IP 23.33.241.97.443 > 10.0.2.15.34610: Flags [P.], seq 5237:5307, ack 788, win 65535, length 70
20:26:49.302613 IP 10.0.2.15.34610 > 23.33.241.97.443: Flags [.], ack 5307, win 62780, length 0
20:26:49.303063 IP 10.0.2.15.34610 > 23.33.241.97.443: Flags [P.], seq 788:819, ack 5307, win 62780, length 31
20:26:49.303390 IP 23.33.241.97.443 > 10.0.2.15.34610: Flags [.], ack 819, win 65535, length 0
20:26:49.451650 IP 23.33.241.97.443 > 10.0.2.15.34610: Flags [.], seq 5307:15527, ack 819, win 65535, length 10220
20:26:49.451686 IP 10.0.2.15.34610 > 23.33.241.97.443: Flags [.], ack 15527, win 58400, length 0
20:26:49.451957 IP 23.33.241.97.443 > 10.0.2.15.34610: Flags [P.], seq 15527:21565, ack 819, win 65535, length 6038
20:26:49.451970 IP 10.0.2.15.34610 > 23.33.241.97.443: Flags [.], ack 21565, win 54020, length 0
20:26:49.452397 IP 23.33.241.97.443 > 10.0.2.15.34610: Flags [P.], seq 21565:27079, ack 819, win 65535, length 5514
20:26:49.452424 IP 10.0.2.15.34610 > 23.33.241.97.443: Flags [.], ack 27079, win 49640, length 0
20:26:49.454817 IP 23.33.241.97.443 > 10.0.2.15.34610: Flags [P.], seq 27079:29827, ack 819, win 65535, length 2748
20:26:49.454840 IP 10.0.2.15.34610 > 23.33.241.97.443: Flags [.], ack 29827, win 62780, length 0
20:26:49.465298 IP 23.33.241.97.443 > 10.0.2.15.34610: Flags [P.], seq 29827:33949, ack 819, win 65535, length 4122
20:26:49.465322 IP 10.0.2.15.34610 > 23.33.241.97.443: Flags [.], ack 33949, win 61320, length 0
20:26:49.466061 IP 23.33.241.97.443 > 10.0.2.15.34610: Flags [P.], seq 33949:36697, ack 819, win 65535, length 2748
20:26:49.466077 IP 10.0.2.15.34610 > 23.33.241.97.443: Flags [.], ack 36697, win 62780, length 0
20:26:49.468603 IP 23.33.241.97.443 > 10.0.2.15.34610: Flags [P.], seq 36697:38205, ack 819, win 65535, length 1508
20:26:49.468627 IP 10.0.2.15.34610 > 23.33.241.97.443: Flags [.], ack 38205, win 62780, length 0
20:26:49.480305 IP 23.33.241.97.443 > 10.0.2.15.34610: Flags [P.], seq 38205:39579, ack 819, win 65535, length 1374
20:26:49.481549 IP 23.33.241.97.443 > 10.0.2.15.34610: Flags [P.], seq 39579:45075, ack 819, win 65535, length 5496
20:26:49.481656 IP 10.0.2.15.34610 > 23.33.241.97.443: Flags [.], ack 45075, win 59860, length 0
20:26:49.482124 IP 23.33.241.97.443 > 10.0.2.15.34610: Flags [P.], seq 45075:47823, ack 819, win 65535, length 2748
20:26:49.482138 IP 10.0.2.15.34610 > 23.33.241.97.443: Flags [.], ack 47823, win 62780, length 0
20:26:49.483275 IP 23.33.241.97.443 > 10.0.2.15.34610: Flags [P.], seq 47823:51915, ack 819, win 65535, length 4092
20:26:49.483350 IP 10.0.2.15.34610 > 23.33.241.97.443: Flags [.], ack 51915, win 62780, length 0
20:26:49.493463 IP 23.33.241.97.443 > 10.0.2.15.34610: Flags [P.], seq 51915:57448, ack 819, win 65535, length 5533
20:26:49.493689 IP 10.0.2.15.34610 > 23.33.241.97.443: Flags [.], ack 57448, win 61320, length 0
20:26:49.494114 IP 23.33.241.97.443 > 10.0.2.15.34610: Flags [P.], seq 57448:58822, ack 819, win 65535, length 1374
20:26:49.494173 IP 10.0.2.15.34610 > 23.33.241.97.443: Flags [.], ack 58822, win 62780, length 0
20:26:49.495409 IP 23.33.241.97.443 > 10.0.2.15.34610: Flags [P.], seq 58822:62944, ack 819, win 65535, length 4122
20:26:49.495492 IP 10.0.2.15.34610 > 23.33.241.97.443: Flags [.], ack 62944, win 61320, length 0
20:26:49.496595 IP 23.33.241.97.443 > 10.0.2.15.34610: Flags [P.], seq 62944:67066, ack 819, win 65535, length 4122
20:26:49.496621 IP 10.0.2.15.34610 > 23.33.241.97.443: Flags [.], ack 67066, win 61320, length 0
20:26:49.497908 IP 23.33.241.97.443 > 10.0.2.15.34610: Flags [P.], seq 67066:68410, ack 819, win 65535, length 1344
20:26:49.498007 IP 10.0.2.15.34610 > 23.33.241.97.443: Flags [.], ack 68410, win 62780, length 0
20:26:49.507113 IP 23.33.241.97.443 > 10.0.2.15.34610: Flags [P.], seq 68410:71158, ack 819, win 65535, length 2748
20:26:49.507138 IP 10.0.2.15.34610 > 23.33.241.97.443: Flags [.], ack 71158, win 65535, length 0
20:26:49.507618 IP 23.33.241.97.443 > 10.0.2.15.34610: Flags [P.], seq 71158:71195, ack 819, win 65535, length 37
20:26:49.507711 IP 10.0.2.15.34610 > 23.33.241.97.443: Flags [.], ack 71195, win 65535, length 0
20:26:49.518285 IP 23.33.241.97.443 > 10.0.2.15.34610: Flags [P.], seq 71195:73943, ack 819, win 65535, length 2748
20:26:49.518351 IP 10.0.2.15.34610 > 23.33.241.97.443: Flags [.], ack 73943, win 65535, length 0
20:26:49.519058 IP 23.33.241.97.443 > 10.0.2.15.34610: Flags [P.], seq 73943:74210, ack 819, win 65535, length 267
20:26:49.519076 IP 10.0.2.15.34610 > 23.33.241.97.443: Flags [.], ack 74210, win 65535, length 0
20:26:49.666005 IP 23.33.241.97.443 > 10.0.2.15.34610: Flags [P.], seq 74210:81132, ack 819, win 65535, length 6922
20:26:49.666042 IP 10.0.2.15.34610 > 23.33.241.97.443: Flags [.], ack 81132, win 65535, length 0
20:26:49.666814 IP 23.33.241.97.443 > 10.0.2.15.34610: Flags [P.], seq 81132:85239, ack 819, win 65535, length 4107
20:26:49.666895 IP 10.0.2.15.34610 > 23.33.241.97.443: Flags [.], ack 85239, win 65535, length 0
20:26:49.668177 IP 23.33.241.97.443 > 10.0.2.15.34610: Flags [P.], seq 85239:89361, ack 819, win 65535, length 4122
20:26:49.668201 IP 10.0.2.15.34610 > 23.33.241.97.443: Flags [.], ack 89361, win 65535, length 0
20:26:49.668887 IP 23.33.241.97.443 > 10.0.2.15.34610: Flags [P.], seq 89361:90735, ack 819, win 65535, length 1374
20:26:49.668901 IP 10.0.2.15.34610 > 23.33.241.97.443: Flags [.], ack 90735, win 65535, length 0
20:26:49.670285 IP 23.33.241.97.443 > 10.0.2.15.34610: Flags [P.], seq 90735:97605, ack 819, win 65535, length 6870
20:26:49.670306 IP 10.0.2.15.34610 > 23.33.241.97.443: Flags [.], ack 97605, win 65535, length 0
20:26:49.671131 IP 23.33.241.97.443 > 10.0.2.15.34610: Flags [P.], seq 97605:103101, ack 819, win 65535, length 5496
20:26:49.671252 IP 10.0.2.15.34610 > 23.33.241.97.443: Flags [.], ack 103101, win 65535, length 0
20:26:49.672104 IP 23.33.241.97.443 > 10.0.2.15.34610: Flags [P.], seq 103101:105849, ack 819, win 65535, length 2748
20:26:49.672121 IP 10.0.2.15.34610 > 23.33.241.97.443: Flags [.], ack 105849, win 65535, length 0
20:26:49.673668 IP 23.33.241.97.443 > 10.0.2.15.34610: Flags [P.], seq 105849:114093, ack 819, win 65535, length 8244
20:26:49.673686 IP 10.0.2.15.34610 > 23.33.241.97.443: Flags [.], ack 114093, win 65535, length 0
20:26:49.674372 IP 23.33.241.97.443 > 10.0.2.15.34610: Flags [P.], seq 114093:116841, ack 819, win 65535, length 2748
20:26:49.674394 IP 10.0.2.15.34610 > 23.33.241.97.443: Flags [.], ack 116841, win 65535, length 0
20:26:49.675754 IP 23.33.241.97.443 > 10.0.2.15.34610: Flags [P.], seq 116841:122337, ack 819, win 65535, length 5496
20:26:49.675820 IP 10.0.2.15.34610 > 23.33.241.97.443: Flags [.], ack 122337, win 65535, length 0
20:26:49.676464 IP 23.33.241.97.443 > 10.0.2.15.34610: Flags [P.], seq 122337:127833, ack 819, win 65535, length 5496
20:26:49.676475 IP 10.0.2.15.34610 > 23.33.241.97.443: Flags [.], ack 127833, win 65535, length 0
20:26:49.678250 IP 23.33.241.97.443 > 10.0.2.15.34610: Flags [P.], seq 127833:130581, ack 819, win 65535, length 2748
20:26:49.678272 IP 10.0.2.15.34610 > 23.33.241.97.443: Flags [.], ack 130581, win 65535, length 0
20:26:49.679039 IP 23.33.241.97.443 > 10.0.2.15.34610: Flags [P.], seq 130581:136077, ack 819, win 65535, length 5496
20:26:49.679111 IP 10.0.2.15.34610 > 23.33.241.97.443: Flags [.], ack 136077, win 65535, length 0
20:26:49.680525 IP 23.33.241.97.443 > 10.0.2.15.34610: Flags [P.], seq 136077:142947, ack 819, win 65535, length 6870
20:26:49.680545 IP 10.0.2.15.34610 > 23.33.241.97.443: Flags [.], ack 142947, win 65535, length 0
20:26:49.681214 IP 23.33.241.97.443 > 10.0.2.15.34610: Flags [P.], seq 142947:147069, ack 819, win 65535, length 4122
20:26:49.681226 IP 10.0.2.15.34610 > 23.33.241.97.443: Flags [.], ack 147069, win 65535, length 0
20:26:49.682869 IP 23.33.241.97.443 > 10.0.2.15.34610: Flags [P.], seq 147069:152565, ack 819, win 65535, length 5496
20:26:49.682887 IP 10.0.2.15.34610 > 23.33.241.97.443: Flags [.], ack 152565, win 65535, length 0
20:26:49.684014 IP 23.33.241.97.443 > 10.0.2.15.34610: Flags [P.], seq 152565:155313, ack 819, win 65535, length 2748
20:26:49.684032 IP 10.0.2.15.34610 > 23.33.241.97.443: Flags [.], ack 155313, win 65535, length 0
20:26:49.684926 IP 23.33.241.97.443 > 10.0.2.15.34610: Flags [P.], seq 155313:157109, ack 819, win 65535, length 1796
20:26:49.684939 IP 10.0.2.15.34610 > 23.33.241.97.443: Flags [.], ack 157109, win 65535, length 0
20:26:49.694606 IP 23.33.241.97.443 > 10.0.2.15.34610: Flags [P.], seq 157109:163979, ack 819, win 65535, length 6870
20:26:49.694609 IP 23.33.241.97.443 > 10.0.2.15.34610: Flags [P.], seq 163979:170849, ack 819, win 65535, length 6870
20:26:49.694692 IP 10.0.2.15.34610 > 23.33.241.97.443: Flags [.], ack 163979, win 65535, length 0
20:26:49.694791 IP 10.0.2.15.34610 > 23.33.241.97.443: Flags [.], ack 170849, win 65535, length 0
20:26:49.694834 IP 23.33.241.97.443 > 10.0.2.15.34610: Flags [P.], seq 170849:173232, ack 819, win 65535, length 2383
20:26:49.694842 IP 10.0.2.15.34610 > 23.33.241.97.443: Flags [.], ack 173232, win 65535, length 0
20:26:49.699151 IP 23.33.241.97.443 > 10.0.2.15.34610: Flags [P.], seq 173232:178728, ack 819, win 65535, length 5496
20:26:49.699154 IP 23.33.241.97.443 > 10.0.2.15.34610: Flags [P.], seq 178728:184224, ack 819, win 65535, length 5496
20:26:49.699179 IP 10.0.2.15.34610 > 23.33.241.97.443: Flags [.], ack 178728, win 65535, length 0
20:26:49.699279 IP 10.0.2.15.34610 > 23.33.241.97.443: Flags [.], ack 184224, win 65535, length 0
20:26:49.699320 IP 23.33.241.97.443 > 10.0.2.15.34610: Flags [P.], seq 184224:185598, ack 819, win 65535, length 1374
20:26:49.699321 IP 23.33.241.97.443 > 10.0.2.15.34610: Flags [P.], seq 185598:186972, ack 819, win 65535, length 1374
20:26:49.699331 IP 10.0.2.15.34610 > 23.33.241.97.443: Flags [.], ack 185598, win 65535, length 0
20:26:49.699348 IP 10.0.2.15.34610 > 23.33.241.97.443: Flags [.], ack 186972, win 65535, length 0
20:26:49.701744 IP 23.33.241.97.443 > 10.0.2.15.34610: Flags [P.], seq 186972:196575, ack 819, win 65535, length 9603
20:26:49.701748 IP 23.33.241.97.443 > 10.0.2.15.34610: Flags [P.], seq 196575:202071, ack 819, win 65535, length 5496
20:26:49.701775 IP 10.0.2.15.34610 > 23.33.241.97.443: Flags [.], ack 196575, win 65535, length 0
20:26:49.701903 IP 10.0.2.15.34610 > 23.33.241.97.443: Flags [.], ack 202071, win 65535, length 0
20:26:49.701988 IP 23.33.241.97.443 > 10.0.2.15.34610: Flags [P.], seq 202071:204819, ack 819, win 65535, length 2748
20:26:49.701998 IP 10.0.2.15.34610 > 23.33.241.97.443: Flags [.], ack 204819, win 65535, length 0
20:26:49.702826 IP 23.33.241.97.443 > 10.0.2.15.34610: Flags [P.], seq 204819:208941, ack 819, win 65535, length 4122
20:26:49.702828 IP 23.33.241.97.443 > 10.0.2.15.34610: Flags [P.], seq 208941:211689, ack 819, win 65535, length 2748
20:26:49.702829 IP 23.33.241.97.443 > 10.0.2.15.34610: Flags [P.], seq 211689:217185, ack 819, win 65535, length 5496
20:26:49.702845 IP 10.0.2.15.34610 > 23.33.241.97.443: Flags [.], ack 208941, win 65535, length 0
20:26:49.702861 IP 10.0.2.15.34610 > 23.33.241.97.443: Flags [.], ack 211689, win 65535, length 0
20:26:49.702877 IP 10.0.2.15.34610 > 23.33.241.97.443: Flags [.], ack 217185, win 65535, length 0
20:26:49.702902 IP 23.33.241.97.443 > 10.0.2.15.34610: Flags [P.], seq 217185:218559, ack 819, win 65535, length 1374
20:26:49.702907 IP 10.0.2.15.34610 > 23.33.241.97.443: Flags [.], ack 218559, win 65535, length 0
20:26:49.703252 IP 23.33.241.97.443 > 10.0.2.15.34610: Flags [P.], seq 218559:221307, ack 819, win 65535, length 2748
20:26:49.703260 IP 10.0.2.15.34610 > 23.33.241.97.443: Flags [.], ack 221307, win 65535, length 0
20:26:49.705575 IP 23.33.241.97.443 > 10.0.2.15.34610: Flags [P.], seq 221307:233673, ack 819, win 65535, length 12366
20:26:49.705592 IP 10.0.2.15.34610 > 23.33.241.97.443: Flags [.], ack 233673, win 65535, length 0
20:26:49.706603 IP 23.33.241.97.443 > 10.0.2.15.34610: Flags [P.], seq 233673:240543, ack 819, win 65535, length 6870
20:26:49.706711 IP 23.33.241.97.443 > 10.0.2.15.34610: Flags [P.], seq 240543:243291, ack 819, win 65535, length 2748
20:26:49.707144 IP 23.33.241.97.443 > 10.0.2.15.34610: Flags [P.], seq 243291:244665, ack 819, win 65535, length 1374
20:26:49.707195 IP 10.0.2.15.34610 > 23.33.241.97.443: Flags [.], ack 244665, win 65535, length 0
20:26:49.708507 IP 23.33.241.97.443 > 10.0.2.15.34610: Flags [P.], seq 244665:247268, ack 819, win 65535, length 2603
20:26:49.708509 IP 23.33.241.97.443 > 10.0.2.15.34610: Flags [.], seq 247268:248728, ack 819, win 65535, length 1460

