20:24:29.832450 IP 10.0.2.15.35126 > 140.233.253.2.53: 16569+ A? www.ebay.com. (30)
20:24:29.832502 IP 10.0.2.15.35126 > 140.233.253.2.53: 55172+ AAAA? www.ebay.com. (30)
20:24:29.836937 IP 140.233.253.2.53 > 10.0.2.15.35126: 16569 3/0/0 CNAME slot9428.ebay.com.edgekey.net., CNAME e9428.a.akamaiedge.net., A 23.33.241.97 (122)
20:24:29.836939 IP 140.233.253.2.53 > 10.0.2.15.35126: 55172 2/1/0 CNAME slot9428.ebay.com.edgekey.net., CNAME e9428.a.akamaiedge.net. (164)
20:24:29.837338 IP 10.0.2.15.34556 > 23.33.241.97.443: Flags [S], seq 1352988288, win 64240, options [mss 1460,sackOK,TS val 9400512 ecr 0,nop,wscale 6], length 0
20:24:29.852116 IP 23.33.241.97.443 > 10.0.2.15.34556: Flags [S.], seq 253824001, ack 1352988289, win 65535, options [mss 1460], length 0
20:24:29.852162 IP 10.0.2.15.34556 > 23.33.241.97.443: Flags [.], ack 1, win 64240, length 0
20:24:29.864511 IP 10.0.2.15.34556 > 23.33.241.97.443: Flags [P.], seq 1:518, ack 1, win 64240, length 517
20:24:29.864790 IP 23.33.241.97.443 > 10.0.2.15.34556: Flags [.], ack 518, win 65535, length 0
20:24:29.881063 IP 23.33.241.97.443 > 10.0.2.15.34556: Flags [.], seq 1:2921, ack 518, win 65535, length 2920
20:24:29.881086 IP 10.0.2.15.34556 > 23.33.241.97.443: Flags [.], ack 2921, win 62780, length 0
20:24:29.881424 IP 23.33.241.97.443 > 10.0.2.15.34556: Flags [P.], seq 2921:4097, ack 518, win 65535, length 1176
20:24:29.881439 IP 10.0.2.15.34556 > 23.33.241.97.443: Flags [.], ack 4097, win 61604, length 0
20:24:29.883190 IP 23.33.241.97.443 > 10.0.2.15.34556: Flags [P.], seq 4097:4695, ack 518, win 65535, length 598
20:24:29.883211 IP 10.0.2.15.34556 > 23.33.241.97.443: Flags [.], ack 4695, win 62780, length 0
20:24:29.884578 IP 10.0.2.15.34556 > 23.33.241.97.443: Flags [P.], seq 518:598, ack 4695, win 62780, length 80
20:24:29.884908 IP 23.33.241.97.443 > 10.0.2.15.34556: Flags [.], ack 598, win 65535, length 0
20:24:29.885005 IP 10.0.2.15.34556 > 23.33.241.97.443: Flags [P.], seq 598:644, ack 4695, win 62780, length 46
20:24:29.885038 IP 10.0.2.15.34556 > 23.33.241.97.443: Flags [P.], seq 644:693, ack 4695, win 62780, length 49
20:24:29.885252 IP 23.33.241.97.443 > 10.0.2.15.34556: Flags [.], ack 644, win 65535, length 0
20:24:29.885253 IP 23.33.241.97.443 > 10.0.2.15.34556: Flags [.], ack 693, win 65535, length 0
20:24:29.885265 IP 10.0.2.15.34556 > 23.33.241.97.443: Flags [P.], seq 693:788, ack 4695, win 62780, length 95
20:24:29.885464 IP 23.33.241.97.443 > 10.0.2.15.34556: Flags [.], ack 788, win 65535, length 0
20:24:29.898492 IP 23.33.241.97.443 > 10.0.2.15.34556: Flags [P.], seq 4695:5237, ack 788, win 65535, length 542
20:24:29.898508 IP 10.0.2.15.34556 > 23.33.241.97.443: Flags [.], ack 5237, win 62780, length 0
20:24:29.899803 IP 23.33.241.97.443 > 10.0.2.15.34556: Flags [P.], seq 5237:5329, ack 788, win 65535, length 92
20:24:29.899825 IP 10.0.2.15.34556 > 23.33.241.97.443: Flags [.], ack 5329, win 62780, length 0
20:24:29.900323 IP 10.0.2.15.34556 > 23.33.241.97.443: Flags [P.], seq 788:819, ack 5329, win 62780, length 31
20:24:29.900665 IP 23.33.241.97.443 > 10.0.2.15.34556: Flags [.], ack 819, win 65535, length 0
20:24:30.067421 IP 23.33.241.97.443 > 10.0.2.15.34556: Flags [P.], seq 5329:8062, ack 819, win 65535, length 2733
20:24:30.067447 IP 10.0.2.15.34556 > 23.33.241.97.443: Flags [.], ack 8062, win 62780, length 0
20:24:30.068922 IP 23.33.241.97.443 > 10.0.2.15.34556: Flags [.], seq 8062:19742, ack 819, win 65535, length 11680
20:24:30.068962 IP 10.0.2.15.34556 > 23.33.241.97.443: Flags [.], ack 19742, win 56940, length 0
20:24:30.069158 IP 23.33.241.97.443 > 10.0.2.15.34556: Flags [P.], seq 19742:21575, ack 819, win 65535, length 1833
20:24:30.069169 IP 10.0.2.15.34556 > 23.33.241.97.443: Flags [.], ack 21575, win 55480, length 0
20:24:30.085054 IP 23.33.241.97.443 > 10.0.2.15.34556: Flags [P.], seq 21575:25746, ack 819, win 65535, length 4171
20:24:30.085073 IP 10.0.2.15.34556 > 23.33.241.97.443: Flags [.], ack 25746, win 61320, length 0
20:24:30.085810 IP 23.33.241.97.443 > 10.0.2.15.34556: Flags [P.], seq 25746:29853, ack 819, win 65535, length 4107
20:24:30.085827 IP 10.0.2.15.34556 > 23.33.241.97.443: Flags [.], ack 29853, win 61320, length 0
20:24:30.086849 IP 23.33.241.97.443 > 10.0.2.15.34556: Flags [P.], seq 29853:31227, ack 819, win 65535, length 1374
20:24:30.086868 IP 10.0.2.15.34556 > 23.33.241.97.443: Flags [.], ack 31227, win 62780, length 0
20:24:30.087962 IP 23.33.241.97.443 > 10.0.2.15.34556: Flags [P.], seq 31227:35349, ack 819, win 65535, length 4122
20:24:30.088109 IP 10.0.2.15.34556 > 23.33.241.97.443: Flags [.], ack 35349, win 61320, length 0
20:24:30.089008 IP 23.33.241.97.443 > 10.0.2.15.34556: Flags [P.], seq 35349:36723, ack 819, win 65535, length 1374
20:24:30.089112 IP 10.0.2.15.34556 > 23.33.241.97.443: Flags [.], ack 36723, win 62780, length 0
20:24:30.090239 IP 23.33.241.97.443 > 10.0.2.15.34556: Flags [P.], seq 36723:38067, ack 819, win 65535, length 1344
20:24:30.090327 IP 10.0.2.15.34556 > 23.33.241.97.443: Flags [.], ack 38067, win 62780, length 0
20:24:30.094352 IP 23.33.241.97.443 > 10.0.2.15.34556: Flags [P.], seq 38067:38150, ack 819, win 65535, length 83
20:24:30.094442 IP 10.0.2.15.34556 > 23.33.241.97.443: Flags [.], ack 38150, win 62780, length 0
20:24:30.108463 IP 23.33.241.97.443 > 10.0.2.15.34556: Flags [P.], seq 38150:39524, ack 819, win 65535, length 1374
20:24:30.108603 IP 10.0.2.15.34556 > 23.33.241.97.443: Flags [.], ack 39524, win 62780, length 0
20:24:30.109255 IP 23.33.241.97.443 > 10.0.2.15.34556: Flags [P.], seq 39524:43631, ack 819, win 65535, length 4107
20:24:30.109510 IP 10.0.2.15.34556 > 23.33.241.97.443: Flags [.], ack 43631, win 62780, length 0
20:24:30.110218 IP 23.33.241.97.443 > 10.0.2.15.34556: Flags [P.], seq 43631:45005, ack 819, win 65535, length 1374
20:24:30.110378 IP 10.0.2.15.34556 > 23.33.241.97.443: Flags [.], ack 45005, win 62780, length 0
20:24:30.111855 IP 23.33.241.97.443 > 10.0.2.15.34556: Flags [P.], seq 45005:50501, ack 819, win 65535, length 5496
20:24:30.114751 IP 10.0.2.15.34556 > 23.33.241.97.443: Flags [.], ack 50501, win 61320, length 0
20:24:30.115611 IP 23.33.241.97.443 > 10.0.2.15.34556: Flags [P.], seq 50501:54593, ack 819, win 65535, length 4092
20:24:30.115630 IP 10.0.2.15.34556 > 23.33.241.97.443: Flags [.], ack 54593, win 61320, length 0
20:24:30.118343 IP 23.33.241.97.443 > 10.0.2.15.34556: Flags [P.], seq 54593:56041, ack 819, win 65535, length 1448
20:24:30.118617 IP 10.0.2.15.34556 > 23.33.241.97.443: Flags [.], ack 56041, win 62780, length 0
20:24:30.119119 IP 23.33.241.97.443 > 10.0.2.15.34556: Flags [P.], seq 56041:60148, ack 819, win 65535, length 4107
20:24:30.119200 IP 10.0.2.15.34556 > 23.33.241.97.443: Flags [.], ack 60148, win 62780, length 0
20:24:30.121114 IP 23.33.241.97.443 > 10.0.2.15.34556: Flags [P.], seq 60148:64270, ack 819, win 65535, length 4122
20:24:30.121342 IP 10.0.2.15.34556 > 23.33.241.97.443: Flags [.], ack 64270, win 61320, length 0
20:24:30.122071 IP 23.33.241.97.443 > 10.0.2.15.34556: Flags [P.], seq 64270:65644, ack 819, win 65535, length 1374
20:24:30.122564 IP 10.0.2.15.34556 > 23.33.241.97.443: Flags [.], ack 65644, win 62780, length 0
20:24:30.126795 IP 23.33.241.97.443 > 10.0.2.15.34556: Flags [P.], seq 65644:69766, ack 819, win 65535, length 4122
20:24:30.126797 IP 23.33.241.97.443 > 10.0.2.15.34556: Flags [P.], seq 69766:71184, ack 819, win 65535, length 1418
20:24:30.126906 IP 10.0.2.15.34556 > 23.33.241.97.443: Flags [.], ack 71184, win 62780, length 0
20:24:30.134696 IP 23.33.241.97.443 > 10.0.2.15.34556: Flags [P.], seq 71184:73932, ack 819, win 65535, length 2748
20:24:30.134805 IP 10.0.2.15.34556 > 23.33.241.97.443: Flags [.], ack 73932, win 65535, length 0
20:24:30.141797 IP 23.33.241.97.443 > 10.0.2.15.34556: Flags [P.], seq 73932:74198, ack 819, win 65535, length 266
20:24:30.141821 IP 10.0.2.15.34556 > 23.33.241.97.443: Flags [.], ack 74198, win 65535, length 0
20:24:30.239434 IP 23.33.241.97.443 > 10.0.2.15.34556: Flags [P.], seq 74198:74251, ack 819, win 65535, length 53
20:24:30.239606 IP 10.0.2.15.34556 > 23.33.241.97.443: Flags [.], ack 74251, win 65535, length 0
20:24:30.240268 IP 23.33.241.97.443 > 10.0.2.15.34556: Flags [P.], seq 74251:75625, ack 819, win 65535, length 1374
20:24:30.240283 IP 10.0.2.15.34556 > 23.33.241.97.443: Flags [.], ack 75625, win 65535, length 0
20:24:30.241748 IP 23.33.241.97.443 > 10.0.2.15.34556: Flags [P.], seq 75625:85228, ack 819, win 65535, length 9603
20:24:30.241795 IP 10.0.2.15.34556 > 23.33.241.97.443: Flags [.], ack 85228, win 65535, length 0
20:24:30.247357 IP 23.33.241.97.443 > 10.0.2.15.34556: Flags [P.], seq 85228:105838, ack 819, win 65535, length 20610
20:24:30.247432 IP 10.0.2.15.34556 > 23.33.241.97.443: Flags [.], ack 105838, win 65535, length 0
20:24:30.247503 IP 23.33.241.97.443 > 10.0.2.15.34556: Flags [P.], seq 105838:109960, ack 819, win 65535, length 4122
20:24:30.247504 IP 23.33.241.97.443 > 10.0.2.15.34556: Flags [P.], seq 109960:112708, ack 819, win 65535, length 2748
20:24:30.247521 IP 10.0.2.15.34556 > 23.33.241.97.443: Flags [.], ack 109960, win 65535, length 0
20:24:30.247543 IP 10.0.2.15.34556 > 23.33.241.97.443: Flags [.], ack 112708, win 65535, length 0
20:24:30.249217 IP 23.33.241.97.443 > 10.0.2.15.34556: Flags [P.], seq 112708:122326, ack 819, win 65535, length 9618
20:24:30.249220 IP 23.33.241.97.443 > 10.0.2.15.34556: Flags [P.], seq 122326:123700, ack 819, win 65535, length 1374
20:24:30.249247 IP 10.0.2.15.34556 > 23.33.241.97.443: Flags [.], ack 122326, win 65535, length 0
20:24:30.249296 IP 10.0.2.15.34556 > 23.33.241.97.443: Flags [.], ack 123700, win 65535, length 0
20:24:30.250322 IP 23.33.241.97.443 > 10.0.2.15.34556: Flags [P.], seq 123700:123736, ack 819, win 65535, length 36
20:24:30.250402 IP 10.0.2.15.34556 > 23.33.241.97.443: Flags [.], ack 123736, win 65535, length 0
20:24:30.253717 IP 23.33.241.97.443 > 10.0.2.15.34556: Flags [P.], seq 123736:133339, ack 819, win 65535, length 9603
20:24:30.253747 IP 10.0.2.15.34556 > 23.33.241.97.443: Flags [.], ack 133339, win 65535, length 0
20:24:30.255766 IP 23.33.241.97.443 > 10.0.2.15.34556: Flags [P.], seq 133339:140209, ack 819, win 65535, length 6870
20:24:30.255792 IP 10.0.2.15.34556 > 23.33.241.97.443: Flags [.], ack 140209, win 65535, length 0
20:24:30.256583 IP 23.33.241.97.443 > 10.0.2.15.34556: Flags [P.], seq 140209:140231, ack 819, win 65535, length 22
20:24:30.256645 IP 10.0.2.15.34556 > 23.33.241.97.443: Flags [.], ack 140231, win 65535, length 0
20:24:30.258770 IP 23.33.241.97.443 > 10.0.2.15.34556: Flags [P.], seq 140231:147101, ack 819, win 65535, length 6870
20:24:30.258790 IP 10.0.2.15.34556 > 23.33.241.97.443: Flags [.], ack 147101, win 65535, length 0
20:24:30.259665 IP 23.33.241.97.443 > 10.0.2.15.34556: Flags [P.], seq 147101:153956, ack 819, win 65535, length 6855
20:24:30.259684 IP 10.0.2.15.34556 > 23.33.241.97.443: Flags [.], ack 153956, win 65535, length 0
20:24:30.260542 IP 23.33.241.97.443 > 10.0.2.15.34556: Flags [P.], seq 153956:158078, ack 819, win 65535, length 4122
20:24:30.260557 IP 10.0.2.15.34556 > 23.33.241.97.443: Flags [.], ack 158078, win 65535, length 0
20:24:30.261894 IP 23.33.241.97.443 > 10.0.2.15.34556: Flags [P.], seq 158078:163574, ack 819, win 65535, length 5496
20:24:30.261914 IP 10.0.2.15.34556 > 23.33.241.97.443: Flags [.], ack 163574, win 65535, length 0
20:24:30.262863 IP 23.33.241.97.443 > 10.0.2.15.34556: Flags [P.], seq 163574:169070, ack 819, win 65535, length 5496
20:24:30.262881 IP 10.0.2.15.34556 > 23.33.241.97.443: Flags [.], ack 169070, win 65535, length 0
20:24:30.263084 IP 23.33.241.97.443 > 10.0.2.15.34556: Flags [P.], seq 169070:170444, ack 819, win 65535, length 1374
20:24:30.263097 IP 10.0.2.15.34556 > 23.33.241.97.443: Flags [.], ack 170444, win 65535, length 0
20:24:30.263766 IP 23.33.241.97.443 > 10.0.2.15.34556: Flags [P.], seq 170444:174566, ack 819, win 65535, length 4122
20:24:30.263776 IP 10.0.2.15.34556 > 23.33.241.97.443: Flags [.], ack 174566, win 65535, length 0
20:24:30.264962 IP 23.33.241.97.443 > 10.0.2.15.34556: Flags [P.], seq 174566:180062, ack 819, win 65535, length 5496
20:24:30.264980 IP 10.0.2.15.34556 > 23.33.241.97.443: Flags [.], ack 180062, win 65535, length 0
20:24:30.265205 IP 23.33.241.97.443 > 10.0.2.15.34556: Flags [P.], seq 180062:182810, ack 819, win 65535, length 2748
20:24:30.265207 IP 23.33.241.97.443 > 10.0.2.15.34556: Flags [P.], seq 182810:185558, ack 819, win 65535, length 2748
20:24:30.265221 IP 10.0.2.15.34556 > 23.33.241.97.443: Flags [.], ack 182810, win 65535, length 0
20:24:30.265242 IP 10.0.2.15.34556 > 23.33.241.97.443: Flags [.], ack 185558, win 65535, length 0
20:24:30.266980 IP 23.33.241.97.443 > 10.0.2.15.34556: Flags [P.], seq 185558:189680, ack 819, win 65535, length 4122
20:24:30.267001 IP 10.0.2.15.34556 > 23.33.241.97.443: Flags [.], ack 189680, win 65535, length 0
20:24:30.267218 IP 23.33.241.97.443 > 10.0.2.15.34556: Flags [P.], seq 189680:195176, ack 819, win 65535, length 5496
20:24:30.267231 IP 10.0.2.15.34556 > 23.33.241.97.443: Flags [.], ack 195176, win 65535, length 0
20:24:30.269551 IP 23.33.241.97.443 > 10.0.2.15.34556: Flags [P.], seq 195176:200672, ack 819, win 65535, length 5496
20:24:30.269554 IP 23.33.241.97.443 > 10.0.2.15.34556: Flags [P.], seq 200672:204794, ack 819, win 65535, length 4122
20:24:30.269891 IP 10.0.2.15.34556 > 23.33.241.97.443: Flags [.], ack 200672, win 65535, length 0
20:24:30.269950 IP 10.0.2.15.34556 > 23.33.241.97.443: Flags [.], ack 204794, win 65535, length 0
20:24:30.270195 IP 23.33.241.97.443 > 10.0.2.15.34556: Flags [P.], seq 204794:207542, ack 819, win 65535, length 2748
20:24:30.270212 IP 10.0.2.15.34556 > 23.33.241.97.443: Flags [.], ack 207542, win 65535, length 0
20:24:30.270936 IP 23.33.241.97.443 > 10.0.2.15.34556: Flags [.], seq 207542:209002, ack 819, win 65535, length 1460
20:24:30.270958 IP 10.0.2.15.34556 > 23.33.241.97.443: Flags [.], ack 209002, win 65535, length 0
20:24:30.271604 IP 23.33.241.97.443 > 10.0.2.15.34556: Flags [P.], seq 209002:215786, ack 819, win 65535, length 6784
20:24:30.271607 IP 23.33.241.97.443 > 10.0.2.15.34556: Flags [P.], seq 215786:218534, ack 819, win 65535, length 2748
20:24:30.271627 IP 10.0.2.15.34556 > 23.33.241.97.443: Flags [.], ack 215786, win 65535, length 0
20:24:30.271649 IP 10.0.2.15.34556 > 23.33.241.97.443: Flags [.], ack 218534, win 65535, length 0
20:24:30.273443 IP 23.33.241.97.443 > 10.0.2.15.34556: Flags [P.], seq 218534:224030, ack 819, win 65535, length 5496
20:24:30.273461 IP 10.0.2.15.34556 > 23.33.241.97.443: Flags [.], ack 224030, win 65535, length 0
20:24:30.275899 IP 23.33.241.97.443 > 10.0.2.15.34556: Flags [P.], seq 224030:228152, ack 819, win 65535, length 4122
20:24:30.275902 IP 23.33.241.97.443 > 10.0.2.15.34556: Flags [P.], seq 228152:232274, ack 819, win 65535, length 4122
20:24:30.275903 IP 23.33.241.97.443 > 10.0.2.15.34556: Flags [P.], seq 232274:235022, ack 819, win 65535, length 2748
20:24:30.275929 IP 10.0.2.15.34556 > 23.33.241.97.443: Flags [.], ack 228152, win 65535, length 0
20:24:30.276443 IP 10.0.2.15.34556 > 23.33.241.97.443: Flags [.], ack 232274, win 65535, length 0
20:24:30.276511 IP 10.0.2.15.34556 > 23.33.241.97.443: Flags [.], ack 235022, win 65535, length 0
20:24:30.276542 IP 23.33.241.97.443 > 10.0.2.15.34556: Flags [P.], seq 235022:237770, ack 819, win 65535, length 2748
20:24:30.276548 IP 10.0.2.15.34556 > 23.33.241.97.443: Flags [.], ack 237770, win 65535, length 0
20:24:30.279236 IP 23.33.241.97.443 > 10.0.2.15.34556: Flags [P.], seq 237770:240518, ack 819, win 65535, length 2748
20:24:30.279239 IP 23.33.241.97.443 > 10.0.2.15.34556: Flags [P.], seq 240518:244640, ack 819, win 65535, length 4122
20:24:30.279240 IP 23.33.241.97.443 > 10.0.2.15.34556: Flags [P.], seq 244640:246014, ack 819, win 65535, length 1374
20:24:30.279241 IP 23.33.241.97.443 > 10.0.2.15.34556: Flags [P.], seq 246014:248762, ack 819, win 65535, length 2748
20:24:30.279268 IP 10.0.2.15.34556 > 23.33.241.97.443: Flags [.], ack 240518, win 65535, length 0
20:24:30.279299 IP 10.0.2.15.34556 > 23.33.241.97.443: Flags [.], ack 244640, win 65535, length 0
20:24:30.279310 IP 10.0.2.15.34556 > 23.33.241.97.443: Flags [.], ack 246014, win 65535, length 0
20:24:30.279318 IP 10.0.2.15.34556 > 23.33.241.97.443: Flags [.], ack 248762, win 65535, length 0

