20:22:15.466819 IP 10.0.2.15.60956 > 140.233.253.2.53: 4486+ A? www.ebay.com. (30)
20:22:15.466859 IP 10.0.2.15.60956 > 140.233.253.2.53: 64385+ AAAA? www.ebay.com. (30)
20:22:15.473001 IP 140.233.253.2.53 > 10.0.2.15.60956: 64385 2/1/0 CNAME slot9428.ebay.com.edgekey.net., CNAME e9428.a.akamaiedge.net. (164)
20:22:15.473375 IP 140.233.253.2.53 > 10.0.2.15.60956: 4486 3/0/0 CNAME slot9428.ebay.com.edgekey.net., CNAME e9428.a.akamaiedge.net., A 23.33.241.97 (122)
20:22:15.473718 IP 10.0.2.15.34508 > 23.33.241.97.443: Flags [S], seq 1523413228, win 64240, options [mss 1460,sackOK,TS val 9266148 ecr 0,nop,wscale 6], length 0
20:22:15.489936 IP 23.33.241.97.443 > 10.0.2.15.34508: Flags [S.], seq 249792001, ack 1523413229, win 65535, options [mss 1460], length 0
20:22:15.490069 IP 10.0.2.15.34508 > 23.33.241.97.443: Flags [.], ack 1, win 64240, length 0
20:22:15.497376 IP 10.0.2.15.34508 > 23.33.241.97.443: Flags [P.], seq 1:518, ack 1, win 64240, length 517
20:22:15.497698 IP 23.33.241.97.443 > 10.0.2.15.34508: Flags [.], ack 518, win 65535, length 0
20:22:15.514592 IP 23.33.241.97.443 > 10.0.2.15.34508: Flags [P.], seq 1:2749, ack 518, win 65535, length 2748
20:22:15.514615 IP 10.0.2.15.34508 > 23.33.241.97.443: Flags [.], ack 2749, win 62780, length 0
20:22:15.515372 IP 23.33.241.97.443 > 10.0.2.15.34508: Flags [P.], seq 2749:4695, ack 518, win 65535, length 1946
20:22:15.515391 IP 10.0.2.15.34508 > 23.33.241.97.443: Flags [.], ack 4695, win 61320, length 0
20:22:15.516547 IP 10.0.2.15.34508 > 23.33.241.97.443: Flags [P.], seq 518:598, ack 4695, win 62780, length 80
20:22:15.516969 IP 23.33.241.97.443 > 10.0.2.15.34508: Flags [.], ack 598, win 65535, length 0
20:22:15.517127 IP 10.0.2.15.34508 > 23.33.241.97.443: Flags [P.], seq 598:644, ack 4695, win 62780, length 46
20:22:15.517155 IP 10.0.2.15.34508 > 23.33.241.97.443: Flags [P.], seq 644:693, ack 4695, win 62780, length 49
20:22:15.517270 IP 10.0.2.15.34508 > 23.33.241.97.443: Flags [P.], seq 693:728, ack 4695, win 62780, length 35
20:22:15.517303 IP 10.0.2.15.34508 > 23.33.241.97.443: Flags [P.], seq 728:788, ack 4695, win 62780, length 60
20:22:15.517382 IP 23.33.241.97.443 > 10.0.2.15.34508: Flags [.], ack 644, win 65535, length 0
20:22:15.517383 IP 23.33.241.97.443 > 10.0.2.15.34508: Flags [.], ack 693, win 65535, length 0
20:22:15.517383 IP 23.33.241.97.443 > 10.0.2.15.34508: Flags [.], ack 728, win 65535, length 0
20:22:15.517498 IP 23.33.241.97.443 > 10.0.2.15.34508: Flags [.], ack 788, win 65535, length 0
20:22:15.530491 IP 23.33.241.97.443 > 10.0.2.15.34508: Flags [P.], seq 4695:5237, ack 788, win 65535, length 542
20:22:15.530514 IP 10.0.2.15.34508 > 23.33.241.97.443: Flags [.], ack 5237, win 62780, length 0
20:22:15.531507 IP 23.33.241.97.443 > 10.0.2.15.34508: Flags [P.], seq 5237:5329, ack 788, win 65535, length 92
20:22:15.531524 IP 10.0.2.15.34508 > 23.33.241.97.443: Flags [.], ack 5329, win 62780, length 0
20:22:15.531852 IP 10.0.2.15.34508 > 23.33.241.97.443: Flags [P.], seq 788:819, ack 5329, win 62780, length 31
20:22:15.532283 IP 23.33.241.97.443 > 10.0.2.15.34508: Flags [.], ack 819, win 65535, length 0
20:22:15.709088 IP 23.33.241.97.443 > 10.0.2.15.34508: Flags [.], seq 5329:14089, ack 819, win 65535, length 8760
20:22:15.709126 IP 10.0.2.15.34508 > 23.33.241.97.443: Flags [.], ack 14089, win 58400, length 0
20:22:15.709485 IP 23.33.241.97.443 > 10.0.2.15.34508: Flags [P.], seq 14089:20368, ack 819, win 65535, length 6279
20:22:15.709513 IP 10.0.2.15.34508 > 23.33.241.97.443: Flags [.], ack 20368, win 54020, length 0
20:22:15.712058 IP 23.33.241.97.443 > 10.0.2.15.34508: Flags [P.], seq 20368:21727, ack 819, win 65535, length 1359
20:22:15.712078 IP 10.0.2.15.34508 > 23.33.241.97.443: Flags [.], ack 21727, win 62780, length 0
20:22:15.715234 IP 23.33.241.97.443 > 10.0.2.15.34508: Flags [P.], seq 21727:22843, ack 819, win 65535, length 1116
20:22:15.715257 IP 10.0.2.15.34508 > 23.33.241.97.443: Flags [.], ack 22843, win 62780, length 0
20:22:15.722829 IP 23.33.241.97.443 > 10.0.2.15.34508: Flags [P.], seq 22843:26950, ack 819, win 65535, length 4107
20:22:15.722851 IP 10.0.2.15.34508 > 23.33.241.97.443: Flags [.], ack 26950, win 61320, length 0
20:22:15.723638 IP 23.33.241.97.443 > 10.0.2.15.34508: Flags [P.], seq 26950:31057, ack 819, win 65535, length 4107
20:22:15.723665 IP 10.0.2.15.34508 > 23.33.241.97.443: Flags [.], ack 31057, win 58400, length 0
20:22:15.724711 IP 23.33.241.97.443 > 10.0.2.15.34508: Flags [P.], seq 31057:32431, ack 819, win 65535, length 1374
20:22:15.724793 IP 10.0.2.15.34508 > 23.33.241.97.443: Flags [.], ack 32431, win 62780, length 0
20:22:15.725594 IP 23.33.241.97.443 > 10.0.2.15.34508: Flags [P.], seq 32431:36553, ack 819, win 65535, length 4122
20:22:15.725701 IP 10.0.2.15.34508 > 23.33.241.97.443: Flags [.], ack 36553, win 61320, length 0
20:22:15.726572 IP 23.33.241.97.443 > 10.0.2.15.34508: Flags [P.], seq 36553:37927, ack 819, win 65535, length 1374
20:22:15.726693 IP 10.0.2.15.34508 > 23.33.241.97.443: Flags [.], ack 37927, win 62780, length 0
20:22:15.727598 IP 23.33.241.97.443 > 10.0.2.15.34508: Flags [P.], seq 37927:39241, ack 819, win 65535, length 1314
20:22:15.727675 IP 10.0.2.15.34508 > 23.33.241.97.443: Flags [.], ack 39241, win 62780, length 0
20:22:15.737437 IP 23.33.241.97.443 > 10.0.2.15.34508: Flags [P.], seq 39241:42174, ack 819, win 65535, length 2933
20:22:15.737456 IP 10.0.2.15.34508 > 23.33.241.97.443: Flags [.], ack 42174, win 62780, length 0
20:22:15.737895 IP 23.33.241.97.443 > 10.0.2.15.34508: Flags [P.], seq 42174:43548, ack 819, win 65535, length 1374
20:22:15.738019 IP 10.0.2.15.34508 > 23.33.241.97.443: Flags [.], ack 43548, win 62780, length 0
20:22:15.739204 IP 23.33.241.97.443 > 10.0.2.15.34508: Flags [P.], seq 43548:49029, ack 819, win 65535, length 5481
20:22:15.739347 IP 10.0.2.15.34508 > 23.33.241.97.443: Flags [.], ack 49029, win 61320, length 0
20:22:15.740434 IP 23.33.241.97.443 > 10.0.2.15.34508: Flags [P.], seq 49029:51777, ack 819, win 65535, length 2748
20:22:15.740453 IP 10.0.2.15.34508 > 23.33.241.97.443: Flags [.], ack 51777, win 62780, length 0
20:22:15.741631 IP 23.33.241.97.443 > 10.0.2.15.34508: Flags [P.], seq 51777:55869, ack 819, win 65535, length 4092
20:22:15.741761 IP 10.0.2.15.34508 > 23.33.241.97.443: Flags [.], ack 55869, win 62780, length 0
20:22:15.746847 IP 23.33.241.97.443 > 10.0.2.15.34508: Flags [P.], seq 55869:57317, ack 819, win 65535, length 1448
20:22:15.747336 IP 23.33.241.97.443 > 10.0.2.15.34508: Flags [P.], seq 57317:61424, ack 819, win 65535, length 4107
20:22:15.747435 IP 10.0.2.15.34508 > 23.33.241.97.443: Flags [.], ack 61424, win 61320, length 0
20:22:15.747998 IP 23.33.241.97.443 > 10.0.2.15.34508: Flags [P.], seq 61424:62798, ack 819, win 65535, length 1374
20:22:15.748054 IP 10.0.2.15.34508 > 23.33.241.97.443: Flags [.], ack 62798, win 62780, length 0
20:22:15.749312 IP 23.33.241.97.443 > 10.0.2.15.34508: Flags [P.], seq 62798:66905, ack 819, win 65535, length 4107
20:22:15.749397 IP 10.0.2.15.34508 > 23.33.241.97.443: Flags [.], ack 66905, win 62780, length 0
20:22:15.755798 IP 23.33.241.97.443 > 10.0.2.15.34508: Flags [P.], seq 66905:68681, ack 819, win 65535, length 1776
20:22:15.755817 IP 10.0.2.15.34508 > 23.33.241.97.443: Flags [.], ack 68681, win 62780, length 0
20:22:15.756796 IP 23.33.241.97.443 > 10.0.2.15.34508: Flags [P.], seq 68681:72803, ack 819, win 65535, length 4122
20:22:15.756811 IP 10.0.2.15.34508 > 23.33.241.97.443: Flags [.], ack 72803, win 65535, length 0
20:22:15.758775 IP 23.33.241.97.443 > 10.0.2.15.34508: Flags [P.], seq 72803:74162, ack 819, win 65535, length 1359
20:22:15.758794 IP 10.0.2.15.34508 > 23.33.241.97.443: Flags [.], ack 74162, win 65535, length 0
20:22:15.769103 IP 23.33.241.97.443 > 10.0.2.15.34508: Flags [P.], seq 74162:74311, ack 819, win 65535, length 149
20:22:15.769132 IP 10.0.2.15.34508 > 23.33.241.97.443: Flags [.], ack 74311, win 65535, length 0
20:22:15.897195 IP 23.33.241.97.443 > 10.0.2.15.34508: Flags [P.], seq 74311:75732, ack 819, win 65535, length 1421
20:22:15.897318 IP 10.0.2.15.34508 > 23.33.241.97.443: Flags [.], ack 75732, win 65535, length 0
20:22:15.898109 IP 23.33.241.97.443 > 10.0.2.15.34508: Flags [P.], seq 75732:79854, ack 819, win 65535, length 4122
20:22:15.898127 IP 10.0.2.15.34508 > 23.33.241.97.443: Flags [.], ack 79854, win 65535, length 0
20:22:15.898701 IP 23.33.241.97.443 > 10.0.2.15.34508: Flags [P.], seq 79854:85335, ack 819, win 65535, length 5481
20:22:15.898714 IP 10.0.2.15.34508 > 23.33.241.97.443: Flags [.], ack 85335, win 65535, length 0
20:22:15.899873 IP 23.33.241.97.443 > 10.0.2.15.34508: Flags [P.], seq 85335:88083, ack 819, win 65535, length 2748
20:22:15.899889 IP 10.0.2.15.34508 > 23.33.241.97.443: Flags [.], ack 88083, win 65535, length 0
20:22:15.901071 IP 23.33.241.97.443 > 10.0.2.15.34508: Flags [P.], seq 88083:93579, ack 819, win 65535, length 5496
20:22:15.901090 IP 10.0.2.15.34508 > 23.33.241.97.443: Flags [.], ack 93579, win 65535, length 0
20:22:15.902120 IP 23.33.241.97.443 > 10.0.2.15.34508: Flags [P.], seq 93579:99075, ack 819, win 65535, length 5496
20:22:15.902134 IP 10.0.2.15.34508 > 23.33.241.97.443: Flags [.], ack 99075, win 65535, length 0
20:22:15.903183 IP 23.33.241.97.443 > 10.0.2.15.34508: Flags [P.], seq 99075:101823, ack 819, win 65535, length 2748
20:22:15.903199 IP 10.0.2.15.34508 > 23.33.241.97.443: Flags [.], ack 101823, win 65535, length 0
20:22:15.904371 IP 23.33.241.97.443 > 10.0.2.15.34508: Flags [P.], seq 101823:107319, ack 819, win 65535, length 5496
20:22:15.904387 IP 10.0.2.15.34508 > 23.33.241.97.443: Flags [.], ack 107319, win 65535, length 0
20:22:15.905439 IP 23.33.241.97.443 > 10.0.2.15.34508: Flags [P.], seq 107319:111441, ack 819, win 65535, length 4122
20:22:15.905455 IP 10.0.2.15.34508 > 23.33.241.97.443: Flags [.], ack 111441, win 65535, length 0
20:22:15.906452 IP 23.33.241.97.443 > 10.0.2.15.34508: Flags [P.], seq 111441:115563, ack 819, win 65535, length 4122
20:22:15.906466 IP 10.0.2.15.34508 > 23.33.241.97.443: Flags [.], ack 115563, win 65535, length 0
20:22:15.907892 IP 23.33.241.97.443 > 10.0.2.15.34508: Flags [P.], seq 115563:121059, ack 819, win 65535, length 5496
20:22:15.907916 IP 10.0.2.15.34508 > 23.33.241.97.443: Flags [.], ack 121059, win 65535, length 0
20:22:15.908627 IP 23.33.241.97.443 > 10.0.2.15.34508: Flags [P.], seq 121059:123807, ack 819, win 65535, length 2748
20:22:15.908647 IP 10.0.2.15.34508 > 23.33.241.97.443: Flags [.], ack 123807, win 65535, length 0
20:22:15.909798 IP 23.33.241.97.443 > 10.0.2.15.34508: Flags [P.], seq 123807:129303, ack 819, win 65535, length 5496
20:22:15.909818 IP 10.0.2.15.34508 > 23.33.241.97.443: Flags [.], ack 129303, win 65535, length 0
20:22:15.910958 IP 23.33.241.97.443 > 10.0.2.15.34508: Flags [P.], seq 129303:132051, ack 819, win 65535, length 2748
20:22:15.910980 IP 10.0.2.15.34508 > 23.33.241.97.443: Flags [.], ack 132051, win 65535, length 0
20:22:15.914471 IP 23.33.241.97.443 > 10.0.2.15.34508: Flags [P.], seq 132051:137547, ack 819, win 65535, length 5496
20:22:15.914474 IP 23.33.241.97.443 > 10.0.2.15.34508: Flags [P.], seq 137547:143086, ack 819, win 65535, length 5539
20:22:15.914532 IP 10.0.2.15.34508 > 23.33.241.97.443: Flags [.], ack 137547, win 65535, length 0
20:22:15.914742 IP 10.0.2.15.34508 > 23.33.241.97.443: Flags [.], ack 143086, win 65535, length 0
20:22:15.914798 IP 23.33.241.97.443 > 10.0.2.15.34508: Flags [P.], seq 143086:147208, ack 819, win 65535, length 4122
20:22:15.914809 IP 10.0.2.15.34508 > 23.33.241.97.443: Flags [.], ack 147208, win 65535, length 0
20:22:15.915578 IP 23.33.241.97.443 > 10.0.2.15.34508: Flags [P.], seq 147208:151330, ack 819, win 65535, length 4122
20:22:15.915591 IP 10.0.2.15.34508 > 23.33.241.97.443: Flags [.], ack 151330, win 65535, length 0
20:22:15.916905 IP 23.33.241.97.443 > 10.0.2.15.34508: Flags [P.], seq 151330:155452, ack 819, win 65535, length 4122
20:22:15.916923 IP 10.0.2.15.34508 > 23.33.241.97.443: Flags [.], ack 155452, win 65535, length 0
20:22:15.917653 IP 23.33.241.97.443 > 10.0.2.15.34508: Flags [P.], seq 155452:160948, ack 819, win 65535, length 5496
20:22:15.917666 IP 10.0.2.15.34508 > 23.33.241.97.443: Flags [.], ack 160948, win 65535, length 0
20:22:15.919632 IP 23.33.241.97.443 > 10.0.2.15.34508: Flags [P.], seq 160948:169187, ack 819, win 65535, length 8239
20:22:15.919657 IP 10.0.2.15.34508 > 23.33.241.97.443: Flags [.], ack 169187, win 65535, length 0
20:22:15.920211 IP 23.33.241.97.443 > 10.0.2.15.34508: Flags [P.], seq 169187:171935, ack 819, win 65535, length 2748
20:22:15.920224 IP 10.0.2.15.34508 > 23.33.241.97.443: Flags [.], ack 171935, win 65535, length 0
20:22:15.921455 IP 23.33.241.97.443 > 10.0.2.15.34508: Flags [P.], seq 171935:177431, ack 819, win 65535, length 5496
20:22:15.921474 IP 10.0.2.15.34508 > 23.33.241.97.443: Flags [.], ack 177431, win 65535, length 0
20:22:15.922439 IP 23.33.241.97.443 > 10.0.2.15.34508: Flags [P.], seq 177431:184301, ack 819, win 65535, length 6870
20:22:15.922460 IP 10.0.2.15.34508 > 23.33.241.97.443: Flags [.], ack 184301, win 65535, length 0
20:22:15.923529 IP 23.33.241.97.443 > 10.0.2.15.34508: Flags [P.], seq 184301:189797, ack 819, win 65535, length 5496
20:22:15.923549 IP 10.0.2.15.34508 > 23.33.241.97.443: Flags [.], ack 189797, win 65535, length 0
20:22:15.925911 IP 23.33.241.97.443 > 10.0.2.15.34508: Flags [P.], seq 189797:196667, ack 819, win 65535, length 6870
20:22:15.925913 IP 23.33.241.97.443 > 10.0.2.15.34508: Flags [P.], seq 196667:199306, ack 819, win 65535, length 2639
20:22:15.925939 IP 10.0.2.15.34508 > 23.33.241.97.443: Flags [.], ack 196667, win 65535, length 0
20:22:15.925980 IP 10.0.2.15.34508 > 23.33.241.97.443: Flags [.], ack 199306, win 65535, length 0
20:22:15.926262 IP 23.33.241.97.443 > 10.0.2.15.34508: Flags [P.], seq 199306:202054, ack 819, win 65535, length 2748
20:22:15.926285 IP 10.0.2.15.34508 > 23.33.241.97.443: Flags [.], ack 202054, win 65535, length 0
20:22:15.930184 IP 23.33.241.97.443 > 10.0.2.15.34508: Flags [P.], seq 202054:210283, ack 819, win 65535, length 8229
20:22:15.930188 IP 23.33.241.97.443 > 10.0.2.15.34508: Flags [P.], seq 210283:224124, ack 819, win 65535, length 13841
20:22:15.930231 IP 10.0.2.15.34508 > 23.33.241.97.443: Flags [.], ack 210283, win 65535, length 0
20:22:15.930482 IP 10.0.2.15.34508 > 23.33.241.97.443: Flags [.], ack 224124, win 65535, length 0
20:22:15.930691 IP 23.33.241.97.443 > 10.0.2.15.34508: Flags [P.], seq 224124:232368, ack 819, win 65535, length 8244
20:22:15.930701 IP 10.0.2.15.34508 > 23.33.241.97.443: Flags [.], ack 232368, win 65535, length 0
20:22:15.931152 IP 23.33.241.97.443 > 10.0.2.15.34508: Flags [P.], seq 232368:239238, ack 819, win 65535, length 6870
20:22:15.931154 IP 23.33.241.97.443 > 10.0.2.15.34508: Flags [P.], seq 239238:243360, ack 819, win 65535, length 4122
20:22:15.931172 IP 10.0.2.15.34508 > 23.33.241.97.443: Flags [.], ack 239238, win 65535, length 0
20:22:15.931194 IP 10.0.2.15.34508 > 23.33.241.97.443: Flags [.], ack 243360, win 65535, length 0
20:22:15.931218 IP 23.33.241.97.443 > 10.0.2.15.34508: Flags [P.], seq 243360:246108, ack 819, win 65535, length 2748
20:22:15.931224 IP 10.0.2.15.34508 > 23.33.241.97.443: Flags [.], ack 246108, win 65535, length 0

