20:23:19.350649 IP 10.0.2.15.55107 > 140.233.253.2.53: 17394+ A? www.ebay.com. (30)
20:23:19.350689 IP 10.0.2.15.55107 > 140.233.253.2.53: 48368+ AAAA? www.ebay.com. (30)
20:23:19.356631 IP 140.233.253.2.53 > 10.0.2.15.55107: 48368 2/1/0 CNAME slot9428.ebay.com.edgekey.net., CNAME e9428.a.akamaiedge.net. (164)
20:23:19.356634 IP 140.233.253.2.53 > 10.0.2.15.55107: 17394 3/0/0 CNAME slot9428.ebay.com.edgekey.net., CNAME e9428.a.akamaiedge.net., A 23.33.241.97 (122)
20:23:19.356940 IP 10.0.2.15.34532 > 23.33.241.97.443: Flags [S], seq 3132806761, win 64240, options [mss 1460,sackOK,TS val 9330032 ecr 0,nop,wscale 6], length 0
20:23:19.372055 IP 23.33.241.97.443 > 10.0.2.15.34532: Flags [S.], seq 251648001, ack 3132806762, win 65535, options [mss 1460], length 0
20:23:19.372102 IP 10.0.2.15.34532 > 23.33.241.97.443: Flags [.], ack 1, win 64240, length 0
20:23:19.381474 IP 10.0.2.15.34532 > 23.33.241.97.443: Flags [P.], seq 1:518, ack 1, win 64240, length 517
20:23:19.381754 IP 23.33.241.97.443 > 10.0.2.15.34532: Flags [.], ack 518, win 65535, length 0
20:23:19.399083 IP 23.33.241.97.443 > 10.0.2.15.34532: Flags [.], seq 1:2921, ack 518, win 65535, length 2920
20:23:19.399106 IP 10.0.2.15.34532 > 23.33.241.97.443: Flags [.], ack 2921, win 62780, length 0
20:23:19.400366 IP 23.33.241.97.443 > 10.0.2.15.34532: Flags [P.], seq 2921:4097, ack 518, win 65535, length 1176
20:23:19.400367 IP 23.33.241.97.443 > 10.0.2.15.34532: Flags [P.], seq 4097:4695, ack 518, win 65535, length 598
20:23:19.400386 IP 10.0.2.15.34532 > 23.33.241.97.443: Flags [.], ack 4097, win 61604, length 0
20:23:19.400402 IP 10.0.2.15.34532 > 23.33.241.97.443: Flags [.], ack 4695, win 61320, length 0
20:23:19.401468 IP 10.0.2.15.34532 > 23.33.241.97.443: Flags [P.], seq 518:598, ack 4695, win 62780, length 80
20:23:19.401802 IP 23.33.241.97.443 > 10.0.2.15.34532: Flags [.], ack 598, win 65535, length 0
20:23:19.401844 IP 10.0.2.15.34532 > 23.33.241.97.443: Flags [P.], seq 598:644, ack 4695, win 62780, length 46
20:23:19.401870 IP 10.0.2.15.34532 > 23.33.241.97.443: Flags [P.], seq 644:693, ack 4695, win 62780, length 49
20:23:19.402088 IP 23.33.241.97.443 > 10.0.2.15.34532: Flags [.], ack 644, win 65535, length 0
20:23:19.402090 IP 23.33.241.97.443 > 10.0.2.15.34532: Flags [.], ack 693, win 65535, length 0
20:23:19.402113 IP 10.0.2.15.34532 > 23.33.241.97.443: Flags [P.], seq 693:788, ack 4695, win 62780, length 95
20:23:19.402304 IP 23.33.241.97.443 > 10.0.2.15.34532: Flags [.], ack 788, win 65535, length 0
20:23:19.415725 IP 23.33.241.97.443 > 10.0.2.15.34532: Flags [P.], seq 4695:5298, ack 788, win 65535, length 603
20:23:19.415748 IP 10.0.2.15.34532 > 23.33.241.97.443: Flags [.], ack 5298, win 62780, length 0
20:23:19.416251 IP 10.0.2.15.34532 > 23.33.241.97.443: Flags [P.], seq 788:819, ack 5298, win 62780, length 31
20:23:19.416662 IP 23.33.241.97.443 > 10.0.2.15.34532: Flags [.], ack 819, win 65535, length 0
20:23:19.416664 IP 23.33.241.97.443 > 10.0.2.15.34532: Flags [P.], seq 5298:5329, ack 819, win 65535, length 31
20:23:19.416687 IP 10.0.2.15.34532 > 23.33.241.97.443: Flags [.], ack 5329, win 62780, length 0
20:23:19.685118 IP 23.33.241.97.443 > 10.0.2.15.34532: Flags [P.], seq 5329:13528, ack 819, win 65535, length 8199
20:23:19.685121 IP 23.33.241.97.443 > 10.0.2.15.34532: Flags [.], seq 13528:14988, ack 819, win 65535, length 1460
20:23:19.685193 IP 10.0.2.15.34532 > 23.33.241.97.443: Flags [.], ack 13528, win 58400, length 0
20:23:19.685220 IP 10.0.2.15.34532 > 23.33.241.97.443: Flags [.], ack 14988, win 58400, length 0
20:23:19.685399 IP 23.33.241.97.443 > 10.0.2.15.34532: Flags [.], seq 14988:16448, ack 819, win 65535, length 1460
20:23:19.685408 IP 10.0.2.15.34532 > 23.33.241.97.443: Flags [.], ack 16448, win 56940, length 0
20:23:19.685588 IP 23.33.241.97.443 > 10.0.2.15.34532: Flags [P.], seq 16448:21727, ack 819, win 65535, length 5279
20:23:19.685599 IP 10.0.2.15.34532 > 23.33.241.97.443: Flags [.], ack 21727, win 52560, length 0
20:23:19.692007 IP 23.33.241.97.443 > 10.0.2.15.34532: Flags [P.], seq 21727:24218, ack 819, win 65535, length 2491
20:23:19.692030 IP 10.0.2.15.34532 > 23.33.241.97.443: Flags [.], ack 24218, win 62780, length 0
20:23:19.695342 IP 23.33.241.97.443 > 10.0.2.15.34532: Flags [P.], seq 24218:26951, ack 819, win 65535, length 2733
20:23:19.695345 IP 23.33.241.97.443 > 10.0.2.15.34532: Flags [P.], seq 26951:29699, ack 819, win 65535, length 2748
20:23:19.695346 IP 23.33.241.97.443 > 10.0.2.15.34532: Flags [P.], seq 29699:31073, ack 819, win 65535, length 1374
20:23:19.695372 IP 10.0.2.15.34532 > 23.33.241.97.443: Flags [.], ack 26951, win 62780, length 0
20:23:19.695516 IP 10.0.2.15.34532 > 23.33.241.97.443: Flags [.], ack 29699, win 61320, length 0
20:23:19.695533 IP 10.0.2.15.34532 > 23.33.241.97.443: Flags [.], ack 31073, win 59946, length 0
20:23:19.699651 IP 23.33.241.97.443 > 10.0.2.15.34532: Flags [P.], seq 31073:32447, ack 819, win 65535, length 1374
20:23:19.699653 IP 23.33.241.97.443 > 10.0.2.15.34532: Flags [P.], seq 32447:36569, ack 819, win 65535, length 4122
20:23:19.699654 IP 23.33.241.97.443 > 10.0.2.15.34532: Flags [P.], seq 36569:37943, ack 819, win 65535, length 1374
20:23:19.699981 IP 10.0.2.15.34532 > 23.33.241.97.443: Flags [.], ack 32447, win 63204, length 0
20:23:19.700984 IP 10.0.2.15.34532 > 23.33.241.97.443: Flags [.], ack 36569, win 61320, length 0
20:23:19.701011 IP 10.0.2.15.34532 > 23.33.241.97.443: Flags [.], ack 37943, win 59946, length 0
20:23:19.702905 IP 23.33.241.97.443 > 10.0.2.15.34532: Flags [P.], seq 37943:39242, ack 819, win 65535, length 1299
20:23:19.702925 IP 10.0.2.15.34532 > 23.33.241.97.443: Flags [.], ack 39242, win 62780, length 0
20:23:19.705951 IP 23.33.241.97.443 > 10.0.2.15.34532: Flags [P.], seq 39242:42175, ack 819, win 65535, length 2933
20:23:19.705970 IP 10.0.2.15.34532 > 23.33.241.97.443: Flags [.], ack 42175, win 62780, length 0
20:23:19.707122 IP 23.33.241.97.443 > 10.0.2.15.34532: Flags [P.], seq 42175:43549, ack 819, win 65535, length 1374
20:23:19.707140 IP 10.0.2.15.34532 > 23.33.241.97.443: Flags [.], ack 43549, win 62780, length 0
20:23:19.709018 IP 23.33.241.97.443 > 10.0.2.15.34532: Flags [P.], seq 43549:47656, ack 819, win 65535, length 4107
20:23:19.709040 IP 10.0.2.15.34532 > 23.33.241.97.443: Flags [.], ack 47656, win 61320, length 0
20:23:19.709388 IP 23.33.241.97.443 > 10.0.2.15.34532: Flags [P.], seq 47656:49030, ack 819, win 65535, length 1374
20:23:19.709407 IP 10.0.2.15.34532 > 23.33.241.97.443: Flags [.], ack 49030, win 61320, length 0
20:23:19.712037 IP 23.33.241.97.443 > 10.0.2.15.34532: Flags [P.], seq 49030:54526, ack 819, win 65535, length 5496
20:23:19.712040 IP 23.33.241.97.443 > 10.0.2.15.34532: Flags [P.], seq 54526:55870, ack 819, win 65535, length 1344
20:23:19.712065 IP 10.0.2.15.34532 > 23.33.241.97.443: Flags [.], ack 54526, win 61320, length 0
20:23:19.712400 IP 10.0.2.15.34532 > 23.33.241.97.443: Flags [.], ack 55870, win 62780, length 0
20:23:19.718301 IP 23.33.241.97.443 > 10.0.2.15.34532: Flags [P.], seq 55870:60066, ack 819, win 65535, length 4196
20:23:19.718419 IP 10.0.2.15.34532 > 23.33.241.97.443: Flags [.], ack 60066, win 61320, length 0
20:23:19.719646 IP 23.33.241.97.443 > 10.0.2.15.34532: Flags [P.], seq 60066:62799, ack 819, win 65535, length 2733
20:23:19.719666 IP 10.0.2.15.34532 > 23.33.241.97.443: Flags [.], ack 62799, win 62780, length 0
20:23:19.729343 IP 23.33.241.97.443 > 10.0.2.15.34532: Flags [P.], seq 62799:66921, ack 819, win 65535, length 4122
20:23:19.730517 IP 23.33.241.97.443 > 10.0.2.15.34532: Flags [P.], seq 66921:67236, ack 819, win 65535, length 315
20:23:19.730732 IP 10.0.2.15.34532 > 23.33.241.97.443: Flags [.], ack 67236, win 62780, length 0
20:23:19.739018 IP 23.33.241.97.443 > 10.0.2.15.34532: Flags [P.], seq 67236:69984, ack 819, win 65535, length 2748
20:23:19.739040 IP 10.0.2.15.34532 > 23.33.241.97.443: Flags [.], ack 69984, win 65535, length 0
20:23:19.739709 IP 23.33.241.97.443 > 10.0.2.15.34532: Flags [P.], seq 69984:74106, ack 819, win 65535, length 4122
20:23:19.739723 IP 10.0.2.15.34532 > 23.33.241.97.443: Flags [.], ack 74106, win 65535, length 0
20:23:19.741731 IP 23.33.241.97.443 > 10.0.2.15.34532: Flags [P.], seq 74106:74268, ack 819, win 65535, length 162
20:23:19.741753 IP 10.0.2.15.34532 > 23.33.241.97.443: Flags [.], ack 74268, win 65535, length 0
20:23:19.965904 IP 23.33.241.97.443 > 10.0.2.15.34532: Flags [P.], seq 74268:75691, ack 819, win 65535, length 1423
20:23:19.965926 IP 10.0.2.15.34532 > 23.33.241.97.443: Flags [.], ack 75691, win 65535, length 0
20:23:19.971846 IP 23.33.241.97.443 > 10.0.2.15.34532: Flags [P.], seq 75691:86668, ack 819, win 65535, length 10977
20:23:19.971966 IP 10.0.2.15.34532 > 23.33.241.97.443: Flags [.], ack 86668, win 65535, length 0
20:23:19.972016 IP 23.33.241.97.443 > 10.0.2.15.34532: Flags [P.], seq 86668:90790, ack 819, win 65535, length 4122
20:23:19.972027 IP 10.0.2.15.34532 > 23.33.241.97.443: Flags [.], ack 90790, win 65535, length 0
20:23:19.972961 IP 23.33.241.97.443 > 10.0.2.15.34532: Flags [P.], seq 90790:96286, ack 819, win 65535, length 5496
20:23:19.972964 IP 23.33.241.97.443 > 10.0.2.15.34532: Flags [P.], seq 96286:101782, ack 819, win 65535, length 5496
20:23:19.973272 IP 10.0.2.15.34532 > 23.33.241.97.443: Flags [.], ack 96286, win 65535, length 0
20:23:19.973423 IP 10.0.2.15.34532 > 23.33.241.97.443: Flags [.], ack 101782, win 65535, length 0
20:23:19.973465 IP 23.33.241.97.443 > 10.0.2.15.34532: Flags [P.], seq 101782:108659, ack 819, win 65535, length 6877
20:23:19.973466 IP 23.33.241.97.443 > 10.0.2.15.34532: Flags [P.], seq 108659:110033, ack 819, win 65535, length 1374
20:23:19.973475 IP 10.0.2.15.34532 > 23.33.241.97.443: Flags [.], ack 108659, win 65535, length 0
20:23:19.973490 IP 10.0.2.15.34532 > 23.33.241.97.443: Flags [.], ack 110033, win 65535, length 0
20:23:19.975609 IP 23.33.241.97.443 > 10.0.2.15.34532: Flags [P.], seq 110033:123758, ack 819, win 65535, length 13725
20:23:19.975627 IP 10.0.2.15.34532 > 23.33.241.97.443: Flags [.], ack 123758, win 65535, length 0
20:23:19.976611 IP 23.33.241.97.443 > 10.0.2.15.34532: Flags [P.], seq 123758:126506, ack 819, win 65535, length 2748
20:23:19.976633 IP 10.0.2.15.34532 > 23.33.241.97.443: Flags [.], ack 126506, win 65535, length 0
20:23:19.978820 IP 23.33.241.97.443 > 10.0.2.15.34532: Flags [P.], seq 126506:132002, ack 819, win 65535, length 5496
20:23:19.978845 IP 10.0.2.15.34532 > 23.33.241.97.443: Flags [.], ack 132002, win 65535, length 0
20:23:19.981544 IP 23.33.241.97.443 > 10.0.2.15.34532: Flags [P.], seq 132002:138872, ack 819, win 65535, length 6870
20:23:19.981547 IP 23.33.241.97.443 > 10.0.2.15.34532: Flags [P.], seq 138872:141620, ack 819, win 65535, length 2748
20:23:19.981570 IP 10.0.2.15.34532 > 23.33.241.97.443: Flags [.], ack 138872, win 65535, length 0
20:23:19.981725 IP 10.0.2.15.34532 > 23.33.241.97.443: Flags [.], ack 141620, win 65535, length 0
20:23:19.982055 IP 23.33.241.97.443 > 10.0.2.15.34532: Flags [P.], seq 141620:144368, ack 819, win 65535, length 2748
20:23:19.982056 IP 23.33.241.97.443 > 10.0.2.15.34532: Flags [P.], seq 144368:148490, ack 819, win 65535, length 4122
20:23:19.982065 IP 10.0.2.15.34532 > 23.33.241.97.443: Flags [.], ack 144368, win 65535, length 0
20:23:19.982111 IP 10.0.2.15.34532 > 23.33.241.97.443: Flags [.], ack 148490, win 65535, length 0
20:23:19.985317 IP 23.33.241.97.443 > 10.0.2.15.34532: Flags [P.], seq 148490:151238, ack 819, win 65535, length 2748
20:23:19.985337 IP 10.0.2.15.34532 > 23.33.241.97.443: Flags [.], ack 151238, win 65535, length 0
20:23:19.986183 IP 23.33.241.97.443 > 10.0.2.15.34532: Flags [P.], seq 151238:153986, ack 819, win 65535, length 2748
20:23:19.986205 IP 10.0.2.15.34532 > 23.33.241.97.443: Flags [.], ack 153986, win 65535, length 0
20:23:19.987242 IP 23.33.241.97.443 > 10.0.2.15.34532: Flags [P.], seq 153986:160856, ack 819, win 65535, length 6870
20:23:19.987267 IP 10.0.2.15.34532 > 23.33.241.97.443: Flags [.], ack 160856, win 65535, length 0
20:23:19.988222 IP 23.33.241.97.443 > 10.0.2.15.34532: Flags [P.], seq 160856:167726, ack 819, win 65535, length 6870
20:23:19.988241 IP 10.0.2.15.34532 > 23.33.241.97.443: Flags [.], ack 167726, win 65535, length 0
20:23:19.989850 IP 23.33.241.97.443 > 10.0.2.15.34532: Flags [P.], seq 167726:173222, ack 819, win 65535, length 5496
20:23:19.989872 IP 10.0.2.15.34532 > 23.33.241.97.443: Flags [.], ack 173222, win 65535, length 0
20:23:19.991768 IP 23.33.241.97.443 > 10.0.2.15.34532: Flags [P.], seq 173222:185588, ack 819, win 65535, length 12366
20:23:19.991787 IP 10.0.2.15.34532 > 23.33.241.97.443: Flags [.], ack 185588, win 65535, length 0
20:23:19.992851 IP 23.33.241.97.443 > 10.0.2.15.34532: Flags [P.], seq 185588:188336, ack 819, win 65535, length 2748
20:23:19.992875 IP 10.0.2.15.34532 > 23.33.241.97.443: Flags [.], ack 188336, win 65535, length 0
20:23:19.994203 IP 23.33.241.97.443 > 10.0.2.15.34532: Flags [P.], seq 188336:195206, ack 819, win 65535, length 6870
20:23:19.994206 IP 23.33.241.97.443 > 10.0.2.15.34532: Flags [P.], seq 195206:197926, ack 819, win 65535, length 2720
20:23:19.994232 IP 10.0.2.15.34532 > 23.33.241.97.443: Flags [.], ack 195206, win 65535, length 0
20:23:19.994814 IP 10.0.2.15.34532 > 23.33.241.97.443: Flags [.], ack 197926, win 65535, length 0
20:23:19.996355 IP 23.33.241.97.443 > 10.0.2.15.34532: Flags [.], seq 197926:199386, ack 819, win 65535, length 1460
20:23:19.996376 IP 10.0.2.15.34532 > 23.33.241.97.443: Flags [.], ack 199386, win 65535, length 0
20:23:19.998053 IP 23.33.241.97.443 > 10.0.2.15.34532: Flags [P.], seq 199386:202048, ack 819, win 65535, length 2662
20:23:19.998056 IP 23.33.241.97.443 > 10.0.2.15.34532: Flags [P.], seq 202048:207544, ack 819, win 65535, length 5496
20:23:19.998059 IP 23.33.241.97.443 > 10.0.2.15.34532: Flags [P.], seq 207544:218536, ack 819, win 65535, length 10992
20:23:19.998082 IP 10.0.2.15.34532 > 23.33.241.97.443: Flags [.], ack 202048, win 65535, length 0
20:23:19.998112 IP 10.0.2.15.34532 > 23.33.241.97.443: Flags [.], ack 207544, win 65535, length 0
20:23:19.998162 IP 10.0.2.15.34532 > 23.33.241.97.443: Flags [.], ack 218536, win 65535, length 0
20:23:19.998197 IP 23.33.241.97.443 > 10.0.2.15.34532: Flags [P.], seq 218536:221284, ack 819, win 65535, length 2748
20:23:19.998199 IP 23.33.241.97.443 > 10.0.2.15.34532: Flags [P.], seq 221284:226780, ack 819, win 65535, length 5496
20:23:19.998205 IP 10.0.2.15.34532 > 23.33.241.97.443: Flags [.], ack 221284, win 65535, length 0
20:23:19.998217 IP 10.0.2.15.34532 > 23.33.241.97.443: Flags [.], ack 226780, win 65535, length 0
20:23:20.000136 IP 23.33.241.97.443 > 10.0.2.15.34532: Flags [P.], seq 226780:239146, ack 819, win 65535, length 12366
20:23:20.000199 IP 10.0.2.15.34532 > 23.33.241.97.443: Flags [.], ack 239146, win 65535, length 0
20:23:20.000250 IP 23.33.241.97.443 > 10.0.2.15.34532: Flags [P.], seq 239146:243268, ack 819, win 65535, length 4122
20:23:20.000252 IP 23.33.241.97.443 > 10.0.2.15.34532: Flags [P.], seq 243268:248764, ack 819, win 65535, length 5496

