20:23:02.018022 IP 10.0.2.15.58196 > 140.233.253.2.53: 44538+ A? www.ebay.com. (30)
20:23:02.018271 IP 10.0.2.15.58196 > 140.233.253.2.53: 35302+ AAAA? www.ebay.com. (30)
20:23:02.025138 IP 140.233.253.2.53 > 10.0.2.15.58196: 35302 2/1/0 CNAME slot9428.ebay.com.edgekey.net., CNAME e9428.a.akamaiedge.net. (164)
20:23:02.026891 IP 140.233.253.2.53 > 10.0.2.15.58196: 44538 3/0/0 CNAME slot9428.ebay.com.edgekey.net., CNAME e9428.a.akamaiedge.net., A 23.33.241.97 (122)
20:23:02.027179 IP 10.0.2.15.34526 > 23.33.241.97.443: Flags [S], seq 564308042, win 64240, options [mss 1460,sackOK,TS val 9312702 ecr 0,nop,wscale 6], length 0
20:23:02.041966 IP 23.33.241.97.443 > 10.0.2.15.34526: Flags [S.], seq 251136001, ack 564308043, win 65535, options [mss 1460], length 0
20:23:02.042006 IP 10.0.2.15.34526 > 23.33.241.97.443: Flags [.], ack 1, win 64240, length 0
20:23:02.049770 IP 10.0.2.15.34526 > 23.33.241.97.443: Flags [P.], seq 1:518, ack 1, win 64240, length 517
20:23:02.050083 IP 23.33.241.97.443 > 10.0.2.15.34526: Flags [.], ack 518, win 65535, length 0
20:23:02.066813 IP 23.33.241.97.443 > 10.0.2.15.34526: Flags [.], seq 1:2921, ack 518, win 65535, length 2920
20:23:02.066838 IP 10.0.2.15.34526 > 23.33.241.97.443: Flags [.], ack 2921, win 62780, length 0
20:23:02.067054 IP 23.33.241.97.443 > 10.0.2.15.34526: Flags [P.], seq 2921:4097, ack 518, win 65535, length 1176
20:23:02.067068 IP 10.0.2.15.34526 > 23.33.241.97.443: Flags [.], ack 4097, win 61604, length 0
20:23:02.067790 IP 23.33.241.97.443 > 10.0.2.15.34526: Flags [P.], seq 4097:4695, ack 518, win 65535, length 598
20:23:02.067806 IP 10.0.2.15.34526 > 23.33.241.97.443: Flags [.], ack 4695, win 61320, length 0
20:23:02.068989 IP 10.0.2.15.34526 > 23.33.241.97.443: Flags [P.], seq 518:598, ack 4695, win 62780, length 80
20:23:02.069378 IP 23.33.241.97.443 > 10.0.2.15.34526: Flags [.], ack 598, win 65535, length 0
20:23:02.069548 IP 10.0.2.15.34526 > 23.33.241.97.443: Flags [P.], seq 598:644, ack 4695, win 62780, length 46
20:23:02.069639 IP 10.0.2.15.34526 > 23.33.241.97.443: Flags [P.], seq 644:693, ack 4695, win 62780, length 49
20:23:02.069844 IP 23.33.241.97.443 > 10.0.2.15.34526: Flags [.], ack 644, win 65535, length 0
20:23:02.069858 IP 10.0.2.15.34526 > 23.33.241.97.443: Flags [P.], seq 693:788, ack 4695, win 62780, length 95
20:23:02.070167 IP 23.33.241.97.443 > 10.0.2.15.34526: Flags [.], ack 693, win 65535, length 0
20:23:02.070168 IP 23.33.241.97.443 > 10.0.2.15.34526: Flags [.], ack 788, win 65535, length 0
20:23:02.085706 IP 23.33.241.97.443 > 10.0.2.15.34526: Flags [P.], seq 4695:5237, ack 788, win 65535, length 542
20:23:02.085729 IP 10.0.2.15.34526 > 23.33.241.97.443: Flags [.], ack 5237, win 62780, length 0
20:23:02.091354 IP 23.33.241.97.443 > 10.0.2.15.34526: Flags [P.], seq 5237:5307, ack 788, win 65535, length 70
20:23:02.091376 IP 10.0.2.15.34526 > 23.33.241.97.443: Flags [.], ack 5307, win 62780, length 0
20:23:02.091621 IP 10.0.2.15.34526 > 23.33.241.97.443: Flags [P.], seq 788:819, ack 5307, win 62780, length 31
20:23:02.092148 IP 23.33.241.97.443 > 10.0.2.15.34526: Flags [.], ack 819, win 65535, length 0
20:23:02.249082 IP 23.33.241.97.443 > 10.0.2.15.34526: Flags [P.], seq 5307:10773, ack 819, win 65535, length 5466
20:23:02.249105 IP 10.0.2.15.34526 > 23.33.241.97.443: Flags [.], ack 10773, win 61320, length 0
20:23:02.250109 IP 23.33.241.97.443 > 10.0.2.15.34526: Flags [P.], seq 10773:16254, ack 819, win 65535, length 5481
20:23:02.250112 IP 23.33.241.97.443 > 10.0.2.15.34526: Flags [P.], seq 16254:20346, ack 819, win 65535, length 4092
20:23:02.250138 IP 10.0.2.15.34526 > 23.33.241.97.443: Flags [.], ack 16254, win 56940, length 0
20:23:02.250164 IP 10.0.2.15.34526 > 23.33.241.97.443: Flags [.], ack 20346, win 54020, length 0
20:23:02.251203 IP 23.33.241.97.443 > 10.0.2.15.34526: Flags [P.], seq 20346:21705, ack 819, win 65535, length 1359
20:23:02.251215 IP 10.0.2.15.34526 > 23.33.241.97.443: Flags [.], ack 21705, win 62780, length 0
20:23:02.255345 IP 23.33.241.97.443 > 10.0.2.15.34526: Flags [P.], seq 21705:22821, ack 819, win 65535, length 1116
20:23:02.255367 IP 10.0.2.15.34526 > 23.33.241.97.443: Flags [.], ack 22821, win 62780, length 0
20:23:02.261647 IP 23.33.241.97.443 > 10.0.2.15.34526: Flags [P.], seq 22821:26928, ack 819, win 65535, length 4107
20:23:02.261670 IP 10.0.2.15.34526 > 23.33.241.97.443: Flags [.], ack 26928, win 61320, length 0
20:23:02.262731 IP 23.33.241.97.443 > 10.0.2.15.34526: Flags [P.], seq 26928:31035, ack 819, win 65535, length 4107
20:23:02.262751 IP 10.0.2.15.34526 > 23.33.241.97.443: Flags [.], ack 31035, win 61320, length 0
20:23:02.263822 IP 23.33.241.97.443 > 10.0.2.15.34526: Flags [P.], seq 31035:32409, ack 819, win 65535, length 1374
20:23:02.263905 IP 10.0.2.15.34526 > 23.33.241.97.443: Flags [.], ack 32409, win 62780, length 0
20:23:02.264674 IP 23.33.241.97.443 > 10.0.2.15.34526: Flags [P.], seq 32409:36531, ack 819, win 65535, length 4122
20:23:02.264797 IP 10.0.2.15.34526 > 23.33.241.97.443: Flags [.], ack 36531, win 61320, length 0
20:23:02.265608 IP 23.33.241.97.443 > 10.0.2.15.34526: Flags [P.], seq 36531:37905, ack 819, win 65535, length 1374
20:23:02.265666 IP 10.0.2.15.34526 > 23.33.241.97.443: Flags [.], ack 37905, win 62780, length 0
20:23:02.266858 IP 23.33.241.97.443 > 10.0.2.15.34526: Flags [P.], seq 37905:39219, ack 819, win 65535, length 1314
20:23:02.266954 IP 10.0.2.15.34526 > 23.33.241.97.443: Flags [.], ack 39219, win 62780, length 0
20:23:02.278934 IP 23.33.241.97.443 > 10.0.2.15.34526: Flags [P.], seq 39219:42152, ack 819, win 65535, length 2933
20:23:02.278956 IP 10.0.2.15.34526 > 23.33.241.97.443: Flags [.], ack 42152, win 62780, length 0
20:23:02.279728 IP 23.33.241.97.443 > 10.0.2.15.34526: Flags [P.], seq 42152:47633, ack 819, win 65535, length 5481
20:23:02.279780 IP 10.0.2.15.34526 > 23.33.241.97.443: Flags [.], ack 47633, win 58400, length 0
20:23:02.280832 IP 23.33.241.97.443 > 10.0.2.15.34526: Flags [P.], seq 47633:51755, ack 819, win 65535, length 4122
20:23:02.280846 IP 10.0.2.15.34526 > 23.33.241.97.443: Flags [.], ack 51755, win 61320, length 0
20:23:02.282002 IP 23.33.241.97.443 > 10.0.2.15.34526: Flags [P.], seq 51755:55847, ack 819, win 65535, length 4092
20:23:02.282020 IP 10.0.2.15.34526 > 23.33.241.97.443: Flags [.], ack 55847, win 61320, length 0
20:23:02.286394 IP 23.33.241.97.443 > 10.0.2.15.34526: Flags [P.], seq 55847:58669, ack 819, win 65535, length 2822
20:23:02.286416 IP 10.0.2.15.34526 > 23.33.241.97.443: Flags [.], ack 58669, win 62780, length 0
20:23:02.287196 IP 23.33.241.97.443 > 10.0.2.15.34526: Flags [P.], seq 58669:61417, ack 819, win 65535, length 2748
20:23:02.287280 IP 10.0.2.15.34526 > 23.33.241.97.443: Flags [.], ack 61417, win 61320, length 0
20:23:02.288393 IP 23.33.241.97.443 > 10.0.2.15.34526: Flags [P.], seq 61417:62776, ack 819, win 65535, length 1359
20:23:02.288499 IP 10.0.2.15.34526 > 23.33.241.97.443: Flags [.], ack 62776, win 62780, length 0
20:23:02.294821 IP 23.33.241.97.443 > 10.0.2.15.34526: Flags [P.], seq 62776:66898, ack 819, win 65535, length 4122
20:23:02.294924 IP 10.0.2.15.34526 > 23.33.241.97.443: Flags [.], ack 66898, win 61320, length 0
20:23:02.295844 IP 23.33.241.97.443 > 10.0.2.15.34526: Flags [P.], seq 66898:67203, ack 819, win 65535, length 305
20:23:02.295929 IP 10.0.2.15.34526 > 23.33.241.97.443: Flags [.], ack 67203, win 62780, length 0
20:23:02.306025 IP 23.33.241.97.443 > 10.0.2.15.34526: Flags [P.], seq 67203:69951, ack 819, win 65535, length 2748
20:23:02.306069 IP 10.0.2.15.34526 > 23.33.241.97.443: Flags [.], ack 69951, win 65535, length 0
20:23:02.306945 IP 23.33.241.97.443 > 10.0.2.15.34526: Flags [P.], seq 69951:74073, ack 819, win 65535, length 4122
20:23:02.306977 IP 10.0.2.15.34526 > 23.33.241.97.443: Flags [.], ack 74073, win 65535, length 0
20:23:02.307992 IP 23.33.241.97.443 > 10.0.2.15.34526: Flags [P.], seq 74073:74246, ack 819, win 65535, length 173
20:23:02.308009 IP 10.0.2.15.34526 > 23.33.241.97.443: Flags [.], ack 74246, win 65535, length 0
20:23:02.450609 IP 23.33.241.97.443 > 10.0.2.15.34526: Flags [P.], seq 74246:82524, ack 819, win 65535, length 8278
20:23:02.450642 IP 10.0.2.15.34526 > 23.33.241.97.443: Flags [.], ack 82524, win 65535, length 0
20:23:02.452197 IP 23.33.241.97.443 > 10.0.2.15.34526: Flags [P.], seq 82524:88020, ack 819, win 65535, length 5496
20:23:02.452217 IP 10.0.2.15.34526 > 23.33.241.97.443: Flags [.], ack 88020, win 65535, length 0
20:23:02.454201 IP 23.33.241.97.443 > 10.0.2.15.34526: Flags [P.], seq 88020:97638, ack 819, win 65535, length 9618
20:23:02.454204 IP 23.33.241.97.443 > 10.0.2.15.34526: Flags [P.], seq 97638:100386, ack 819, win 65535, length 2748
20:23:02.454225 IP 10.0.2.15.34526 > 23.33.241.97.443: Flags [.], ack 97638, win 65535, length 0
20:23:02.454275 IP 10.0.2.15.34526 > 23.33.241.97.443: Flags [.], ack 100386, win 65535, length 0
20:23:02.454298 IP 23.33.241.97.443 > 10.0.2.15.34526: Flags [P.], seq 100386:101760, ack 819, win 65535, length 1374
20:23:02.454304 IP 10.0.2.15.34526 > 23.33.241.97.443: Flags [.], ack 101760, win 65535, length 0
20:23:02.456691 IP 23.33.241.97.443 > 10.0.2.15.34526: Flags [P.], seq 101760:110004, ack 819, win 65535, length 8244
20:23:02.456721 IP 10.0.2.15.34526 > 23.33.241.97.443: Flags [.], ack 110004, win 65535, length 0
20:23:02.457470 IP 23.33.241.97.443 > 10.0.2.15.34526: Flags [P.], seq 110004:114126, ack 819, win 65535, length 4122
20:23:02.457484 IP 10.0.2.15.34526 > 23.33.241.97.443: Flags [.], ack 114126, win 65535, length 0
20:23:02.458672 IP 23.33.241.97.443 > 10.0.2.15.34526: Flags [P.], seq 114126:120996, ack 819, win 65535, length 6870
20:23:02.458781 IP 10.0.2.15.34526 > 23.33.241.97.443: Flags [.], ack 120996, win 65535, length 0
20:23:02.459705 IP 23.33.241.97.443 > 10.0.2.15.34526: Flags [P.], seq 120996:126492, ack 819, win 65535, length 5496
20:23:02.459717 IP 10.0.2.15.34526 > 23.33.241.97.443: Flags [.], ack 126492, win 65535, length 0
20:23:02.460607 IP 23.33.241.97.443 > 10.0.2.15.34526: Flags [P.], seq 126492:130614, ack 819, win 65535, length 4122
20:23:02.460618 IP 10.0.2.15.34526 > 23.33.241.97.443: Flags [.], ack 130614, win 65535, length 0
20:23:02.461671 IP 23.33.241.97.443 > 10.0.2.15.34526: Flags [P.], seq 130614:136110, ack 819, win 65535, length 5496
20:23:02.461684 IP 10.0.2.15.34526 > 23.33.241.97.443: Flags [.], ack 136110, win 65535, length 0
20:23:02.462640 IP 23.33.241.97.443 > 10.0.2.15.34526: Flags [P.], seq 136110:138858, ack 819, win 65535, length 2748
20:23:02.462653 IP 10.0.2.15.34526 > 23.33.241.97.443: Flags [.], ack 138858, win 65535, length 0
20:23:02.463571 IP 23.33.241.97.443 > 10.0.2.15.34526: Flags [P.], seq 138858:143285, ack 819, win 65535, length 4427
20:23:02.463582 IP 10.0.2.15.34526 > 23.33.241.97.443: Flags [.], ack 143285, win 65535, length 0
20:23:02.464648 IP 23.33.241.97.443 > 10.0.2.15.34526: Flags [P.], seq 143285:151469, ack 819, win 65535, length 8184
20:23:02.464664 IP 10.0.2.15.34526 > 23.33.241.97.443: Flags [.], ack 151469, win 65535, length 0
20:23:02.465992 IP 23.33.241.97.443 > 10.0.2.15.34526: Flags [P.], seq 151469:155591, ack 819, win 65535, length 4122
20:23:02.466011 IP 10.0.2.15.34526 > 23.33.241.97.443: Flags [.], ack 155591, win 65535, length 0
20:23:02.467233 IP 23.33.241.97.443 > 10.0.2.15.34526: Flags [P.], seq 155591:159713, ack 819, win 65535, length 4122
20:23:02.467257 IP 10.0.2.15.34526 > 23.33.241.97.443: Flags [.], ack 159713, win 65535, length 0
20:23:02.468678 IP 23.33.241.97.443 > 10.0.2.15.34526: Flags [P.], seq 159713:167957, ack 819, win 65535, length 8244
20:23:02.468694 IP 10.0.2.15.34526 > 23.33.241.97.443: Flags [.], ack 167957, win 65535, length 0
20:23:02.469264 IP 23.33.241.97.443 > 10.0.2.15.34526: Flags [P.], seq 167957:173453, ack 819, win 65535, length 5496
20:23:02.469276 IP 10.0.2.15.34526 > 23.33.241.97.443: Flags [.], ack 173453, win 65535, length 0
20:23:02.470588 IP 23.33.241.97.443 > 10.0.2.15.34526: Flags [P.], seq 173453:180323, ack 819, win 65535, length 6870
20:23:02.470600 IP 10.0.2.15.34526 > 23.33.241.97.443: Flags [.], ack 180323, win 65535, length 0
20:23:02.471590 IP 23.33.241.97.443 > 10.0.2.15.34526: Flags [P.], seq 180323:184445, ack 819, win 65535, length 4122
20:23:02.471602 IP 10.0.2.15.34526 > 23.33.241.97.443: Flags [.], ack 184445, win 65535, length 0
20:23:02.473085 IP 23.33.241.97.443 > 10.0.2.15.34526: Flags [P.], seq 184445:191096, ack 819, win 65535, length 6651
20:23:02.473101 IP 10.0.2.15.34526 > 23.33.241.97.443: Flags [.], ack 191096, win 65535, length 0
20:23:02.473227 IP 23.33.241.97.443 > 10.0.2.15.34526: Flags [P.], seq 191096:192470, ack 819, win 65535, length 1374
20:23:02.473234 IP 10.0.2.15.34526 > 23.33.241.97.443: Flags [.], ack 192470, win 65535, length 0
20:23:02.474048 IP 23.33.241.97.443 > 10.0.2.15.34526: Flags [P.], seq 192470:196592, ack 819, win 65535, length 4122
20:23:02.474061 IP 10.0.2.15.34526 > 23.33.241.97.443: Flags [.], ack 196592, win 65535, length 0
20:23:02.475076 IP 23.33.241.97.443 > 10.0.2.15.34526: Flags [P.], seq 196592:203462, ack 819, win 65535, length 6870
20:23:02.475089 IP 10.0.2.15.34526 > 23.33.241.97.443: Flags [.], ack 203462, win 65535, length 0
20:23:02.476406 IP 23.33.241.97.443 > 10.0.2.15.34526: Flags [P.], seq 203462:210332, ack 819, win 65535, length 6870
20:23:02.476418 IP 10.0.2.15.34526 > 23.33.241.97.443: Flags [.], ack 210332, win 65535, length 0
20:23:02.477141 IP 23.33.241.97.443 > 10.0.2.15.34526: Flags [P.], seq 210332:213080, ack 819, win 65535, length 2748
20:23:02.477154 IP 10.0.2.15.34526 > 23.33.241.97.443: Flags [.], ack 213080, win 65535, length 0
20:23:02.477643 IP 23.33.241.97.443 > 10.0.2.15.34526: Flags [P.], seq 213080:218576, ack 819, win 65535, length 5496
20:23:02.477645 IP 23.33.241.97.443 > 10.0.2.15.34526: Flags [P.], seq 218576:219950, ack 819, win 65535, length 1374
20:23:02.477663 IP 10.0.2.15.34526 > 23.33.241.97.443: Flags [.], ack 218576, win 65535, length 0
20:23:02.477689 IP 10.0.2.15.34526 > 23.33.241.97.443: Flags [.], ack 219950, win 65535, length 0
20:23:02.478665 IP 23.33.241.97.443 > 10.0.2.15.34526: Flags [P.], seq 219950:224072, ack 819, win 65535, length 4122
20:23:02.478667 IP 23.33.241.97.443 > 10.0.2.15.34526: Flags [P.], seq 224072:226820, ack 819, win 65535, length 2748
20:23:02.478667 IP 23.33.241.97.443 > 10.0.2.15.34526: Flags [P.], seq 226820:229568, ack 819, win 65535, length 2748
20:23:02.478684 IP 10.0.2.15.34526 > 23.33.241.97.443: Flags [.], ack 224072, win 65535, length 0
20:23:02.478703 IP 10.0.2.15.34526 > 23.33.241.97.443: Flags [.], ack 226820, win 65535, length 0
20:23:02.478712 IP 10.0.2.15.34526 > 23.33.241.97.443: Flags [.], ack 229568, win 65535, length 0
20:23:02.479966 IP 23.33.241.97.443 > 10.0.2.15.34526: Flags [P.], seq 229568:236438, ack 819, win 65535, length 6870
20:23:02.480085 IP 10.0.2.15.34526 > 23.33.241.97.443: Flags [.], ack 236438, win 65535, length 0
20:23:02.480394 IP 23.33.241.97.443 > 10.0.2.15.34526: Flags [P.], seq 236438:241934, ack 819, win 65535, length 5496
20:23:02.480395 IP 23.33.241.97.443 > 10.0.2.15.34526: Flags [P.], seq 241934:243308, ack 819, win 65535, length 1374
20:23:02.480396 IP 23.33.241.97.443 > 10.0.2.15.34526: Flags [P.], seq 243308:246056, ack 819, win 65535, length 2748
20:23:02.480397 IP 23.33.241.97.443 > 10.0.2.15.34526: Flags [P.], seq 246056:248804, ack 819, win 65535, length 2748
20:23:02.480533 IP 10.0.2.15.34526 > 23.33.241.97.443: Flags [.], ack 241934, win 65535, length 0
20:23:02.480561 IP 10.0.2.15.34526 > 23.33.241.97.443: Flags [.], ack 243308, win 65535, length 0
20:23:02.480578 IP 10.0.2.15.34526 > 23.33.241.97.443: Flags [.], ack 246056, win 65535, length 0
20:23:02.480589 IP 10.0.2.15.34526 > 23.33.241.97.443: Flags [.], ack 248804, win 65535, length 0

