20:24:00.557137 IP 10.0.2.15.40574 > 140.233.253.2.53: 33858+ A? www.ebay.com. (30)
20:24:00.557171 IP 10.0.2.15.40574 > 140.233.253.2.53: 351+ AAAA? www.ebay.com. (30)
20:24:00.563862 IP 140.233.253.2.53 > 10.0.2.15.40574: 351 2/1/0 CNAME slot9428.ebay.com.edgekey.net., CNAME e9428.a.akamaiedge.net. (164)
20:24:00.565246 IP 140.233.253.2.53 > 10.0.2.15.40574: 33858 3/0/0 CNAME slot9428.ebay.com.edgekey.net., CNAME e9428.a.akamaiedge.net., A 23.33.241.97 (122)
20:24:00.565538 IP 10.0.2.15.34546 > 23.33.241.97.443: Flags [S], seq 1934520755, win 64240, options [mss 1460,sackOK,TS val 9371240 ecr 0,nop,wscale 6], length 0
20:24:00.580063 IP 23.33.241.97.443 > 10.0.2.15.34546: Flags [S.], seq 252928001, ack 1934520756, win 65535, options [mss 1460], length 0
20:24:00.580170 IP 10.0.2.15.34546 > 23.33.241.97.443: Flags [.], ack 1, win 64240, length 0
20:24:00.590074 IP 10.0.2.15.34546 > 23.33.241.97.443: Flags [P.], seq 1:518, ack 1, win 64240, length 517
20:24:00.590489 IP 23.33.241.97.443 > 10.0.2.15.34546: Flags [.], ack 518, win 65535, length 0
20:24:00.607076 IP 23.33.241.97.443 > 10.0.2.15.34546: Flags [P.], seq 1:2749, ack 518, win 65535, length 2748
20:24:00.607099 IP 10.0.2.15.34546 > 23.33.241.97.443: Flags [.], ack 2749, win 62780, length 0
20:24:00.608188 IP 23.33.241.97.443 > 10.0.2.15.34546: Flags [P.], seq 2749:4097, ack 518, win 65535, length 1348
20:24:00.608349 IP 10.0.2.15.34546 > 23.33.241.97.443: Flags [.], ack 4097, win 62780, length 0
20:24:00.609525 IP 23.33.241.97.443 > 10.0.2.15.34546: Flags [P.], seq 4097:4695, ack 518, win 65535, length 598
20:24:00.609546 IP 10.0.2.15.34546 > 23.33.241.97.443: Flags [.], ack 4695, win 62780, length 0
20:24:00.610315 IP 10.0.2.15.34546 > 23.33.241.97.443: Flags [P.], seq 518:598, ack 4695, win 62780, length 80
20:24:00.610547 IP 23.33.241.97.443 > 10.0.2.15.34546: Flags [.], ack 598, win 65535, length 0
20:24:00.610643 IP 10.0.2.15.34546 > 23.33.241.97.443: Flags [P.], seq 598:644, ack 4695, win 62780, length 46
20:24:00.610676 IP 10.0.2.15.34546 > 23.33.241.97.443: Flags [P.], seq 644:693, ack 4695, win 62780, length 49
20:24:00.610897 IP 23.33.241.97.443 > 10.0.2.15.34546: Flags [.], ack 644, win 65535, length 0
20:24:00.610898 IP 23.33.241.97.443 > 10.0.2.15.34546: Flags [.], ack 693, win 65535, length 0
20:24:00.610915 IP 10.0.2.15.34546 > 23.33.241.97.443: Flags [P.], seq 693:788, ack 4695, win 62780, length 95
20:24:00.611080 IP 23.33.241.97.443 > 10.0.2.15.34546: Flags [.], ack 788, win 65535, length 0
20:24:00.625616 IP 23.33.241.97.443 > 10.0.2.15.34546: Flags [P.], seq 4695:5307, ack 788, win 65535, length 612
20:24:00.625641 IP 10.0.2.15.34546 > 23.33.241.97.443: Flags [.], ack 5307, win 62780, length 0
20:24:00.626421 IP 10.0.2.15.34546 > 23.33.241.97.443: Flags [P.], seq 788:819, ack 5307, win 62780, length 31
20:24:00.627038 IP 23.33.241.97.443 > 10.0.2.15.34546: Flags [.], ack 819, win 65535, length 0
20:24:00.812257 IP 23.33.241.97.443 > 10.0.2.15.34546: Flags [P.], seq 5307:10773, ack 819, win 65535, length 5466
20:24:00.812290 IP 10.0.2.15.34546 > 23.33.241.97.443: Flags [.], ack 10773, win 61320, length 0
20:24:00.813001 IP 23.33.241.97.443 > 10.0.2.15.34546: Flags [P.], seq 10773:18972, ack 819, win 65535, length 8199
20:24:00.813026 IP 10.0.2.15.34546 > 23.33.241.97.443: Flags [.], ack 18972, win 55480, length 0
20:24:00.813291 IP 23.33.241.97.443 > 10.0.2.15.34546: Flags [P.], seq 18972:21618, ack 819, win 65535, length 2646
20:24:00.813303 IP 10.0.2.15.34546 > 23.33.241.97.443: Flags [.], ack 21618, win 52834, length 0
20:24:00.830494 IP 23.33.241.97.443 > 10.0.2.15.34546: Flags [P.], seq 21618:21697, ack 819, win 65535, length 79
20:24:00.830516 IP 10.0.2.15.34546 > 23.33.241.97.443: Flags [.], ack 21697, win 62780, length 0
20:24:00.834994 IP 23.33.241.97.443 > 10.0.2.15.34546: Flags [P.], seq 21697:32674, ack 819, win 65535, length 10977
20:24:00.835017 IP 10.0.2.15.34546 > 23.33.241.97.443: Flags [.], ack 32674, win 56940, length 0
20:24:00.835267 IP 23.33.241.97.443 > 10.0.2.15.34546: Flags [P.], seq 32674:35422, ack 819, win 65535, length 2748
20:24:00.835280 IP 10.0.2.15.34546 > 23.33.241.97.443: Flags [.], ack 35422, win 55480, length 0
20:24:00.836544 IP 23.33.241.97.443 > 10.0.2.15.34546: Flags [P.], seq 35422:38125, ack 819, win 65535, length 2703
20:24:00.836564 IP 10.0.2.15.34546 > 23.33.241.97.443: Flags [.], ack 38125, win 52777, length 0
20:24:00.840538 IP 23.33.241.97.443 > 10.0.2.15.34546: Flags [P.], seq 38125:38236, ack 819, win 65535, length 111
20:24:00.840621 IP 10.0.2.15.34546 > 23.33.241.97.443: Flags [.], ack 38236, win 62780, length 0
20:24:00.853457 IP 23.33.241.97.443 > 10.0.2.15.34546: Flags [P.], seq 38236:45091, ack 819, win 65535, length 6855
20:24:00.853459 IP 23.33.241.97.443 > 10.0.2.15.34546: Flags [P.], seq 45091:47839, ack 819, win 65535, length 2748
20:24:00.853566 IP 10.0.2.15.34546 > 23.33.241.97.443: Flags [.], ack 47839, win 58400, length 0
20:24:00.854563 IP 23.33.241.97.443 > 10.0.2.15.34546: Flags [P.], seq 47839:50587, ack 819, win 65535, length 2748
20:24:00.854585 IP 10.0.2.15.34546 > 23.33.241.97.443: Flags [.], ack 50587, win 62780, length 0
20:24:00.855234 IP 23.33.241.97.443 > 10.0.2.15.34546: Flags [P.], seq 50587:53335, ack 819, win 65535, length 2748
20:24:00.855255 IP 10.0.2.15.34546 > 23.33.241.97.443: Flags [.], ack 53335, win 62780, length 0
20:24:00.856367 IP 23.33.241.97.443 > 10.0.2.15.34546: Flags [P.], seq 53335:54679, ack 819, win 65535, length 1344
20:24:00.856441 IP 10.0.2.15.34546 > 23.33.241.97.443: Flags [.], ack 54679, win 62780, length 0
20:24:00.865635 IP 23.33.241.97.443 > 10.0.2.15.34546: Flags [P.], seq 54679:56127, ack 819, win 65535, length 1448
20:24:00.867312 IP 23.33.241.97.443 > 10.0.2.15.34546: Flags [P.], seq 56127:61608, ack 819, win 65535, length 5481
20:24:00.867315 IP 23.33.241.97.443 > 10.0.2.15.34546: Flags [P.], seq 61608:65730, ack 819, win 65535, length 4122
20:24:00.869030 IP 10.0.2.15.34546 > 23.33.241.97.443: Flags [.], ack 65730, win 56940, length 0
20:24:00.869811 IP 23.33.241.97.443 > 10.0.2.15.34546: Flags [P.], seq 65730:71196, ack 819, win 65535, length 5466
20:24:00.869830 IP 10.0.2.15.34546 > 23.33.241.97.443: Flags [.], ack 71196, win 61320, length 0
20:24:00.880817 IP 23.33.241.97.443 > 10.0.2.15.34546: Flags [P.], seq 71196:71270, ack 819, win 65535, length 74
20:24:00.880901 IP 10.0.2.15.34546 > 23.33.241.97.443: Flags [.], ack 71270, win 62780, length 0
20:24:00.884906 IP 23.33.241.97.443 > 10.0.2.15.34546: Flags [P.], seq 71270:74018, ack 819, win 65535, length 2748
20:24:00.884927 IP 10.0.2.15.34546 > 23.33.241.97.443: Flags [.], ack 74018, win 65535, length 0
20:24:00.885825 IP 23.33.241.97.443 > 10.0.2.15.34546: Flags [P.], seq 74018:74285, ack 819, win 65535, length 267
20:24:00.885844 IP 10.0.2.15.34546 > 23.33.241.97.443: Flags [.], ack 74285, win 65535, length 0
20:24:01.047542 IP 23.33.241.97.443 > 10.0.2.15.34546: Flags [P.], seq 74285:74368, ack 819, win 65535, length 83
20:24:01.047781 IP 10.0.2.15.34546 > 23.33.241.97.443: Flags [.], ack 74368, win 65535, length 0
20:24:01.049027 IP 23.33.241.97.443 > 10.0.2.15.34546: Flags [P.], seq 74368:79864, ack 819, win 65535, length 5496
20:24:01.049057 IP 10.0.2.15.34546 > 23.33.241.97.443: Flags [.], ack 79864, win 65535, length 0
20:24:01.050189 IP 23.33.241.97.443 > 10.0.2.15.34546: Flags [P.], seq 79864:83971, ack 819, win 65535, length 4107
20:24:01.050215 IP 10.0.2.15.34546 > 23.33.241.97.443: Flags [.], ack 83971, win 65535, length 0
20:24:01.051855 IP 23.33.241.97.443 > 10.0.2.15.34546: Flags [P.], seq 83971:89467, ack 819, win 65535, length 5496
20:24:01.051876 IP 10.0.2.15.34546 > 23.33.241.97.443: Flags [.], ack 89467, win 65535, length 0
20:24:01.054592 IP 23.33.241.97.443 > 10.0.2.15.34546: Flags [P.], seq 89467:96337, ack 819, win 65535, length 6870
20:24:01.054595 IP 23.33.241.97.443 > 10.0.2.15.34546: Flags [P.], seq 96337:104581, ack 819, win 65535, length 8244
20:24:01.054619 IP 10.0.2.15.34546 > 23.33.241.97.443: Flags [.], ack 96337, win 65535, length 0
20:24:01.054654 IP 10.0.2.15.34546 > 23.33.241.97.443: Flags [.], ack 104581, win 65535, length 0
20:24:01.055434 IP 23.33.241.97.443 > 10.0.2.15.34546: Flags [P.], seq 104581:110077, ack 819, win 65535, length 5496
20:24:01.055458 IP 10.0.2.15.34546 > 23.33.241.97.443: Flags [.], ack 110077, win 65535, length 0
20:24:01.056518 IP 23.33.241.97.443 > 10.0.2.15.34546: Flags [P.], seq 110077:115573, ack 819, win 65535, length 5496
20:24:01.056540 IP 10.0.2.15.34546 > 23.33.241.97.443: Flags [.], ack 115573, win 65535, length 0
20:24:01.057434 IP 23.33.241.97.443 > 10.0.2.15.34546: Flags [P.], seq 115573:121069, ack 819, win 65535, length 5496
20:24:01.057454 IP 10.0.2.15.34546 > 23.33.241.97.443: Flags [.], ack 121069, win 65535, length 0
20:24:01.058520 IP 23.33.241.97.443 > 10.0.2.15.34546: Flags [P.], seq 121069:125227, ack 819, win 65535, length 4158
20:24:01.058522 IP 23.33.241.97.443 > 10.0.2.15.34546: Flags [P.], seq 125227:126601, ack 819, win 65535, length 1374
20:24:01.058543 IP 10.0.2.15.34546 > 23.33.241.97.443: Flags [.], ack 125227, win 65535, length 0
20:24:01.058679 IP 10.0.2.15.34546 > 23.33.241.97.443: Flags [.], ack 126601, win 65535, length 0
20:24:01.059949 IP 23.33.241.97.443 > 10.0.2.15.34546: Flags [P.], seq 126601:129349, ack 819, win 65535, length 2748
20:24:01.059970 IP 10.0.2.15.34546 > 23.33.241.97.443: Flags [.], ack 129349, win 65535, length 0
20:24:01.061170 IP 23.33.241.97.443 > 10.0.2.15.34546: Flags [P.], seq 129349:132082, ack 819, win 65535, length 2733
20:24:01.061194 IP 10.0.2.15.34546 > 23.33.241.97.443: Flags [.], ack 132082, win 65535, length 0
20:24:01.061677 IP 23.33.241.97.443 > 10.0.2.15.34546: Flags [P.], seq 132082:137578, ack 819, win 65535, length 5496
20:24:01.061697 IP 10.0.2.15.34546 > 23.33.241.97.443: Flags [.], ack 137578, win 65535, length 0
20:24:01.063141 IP 23.33.241.97.443 > 10.0.2.15.34546: Flags [P.], seq 137578:140348, ack 819, win 65535, length 2770
20:24:01.063143 IP 23.33.241.97.443 > 10.0.2.15.34546: Flags [P.], seq 140348:143096, ack 819, win 65535, length 2748
20:24:01.063144 IP 23.33.241.97.443 > 10.0.2.15.34546: Flags [P.], seq 143096:144470, ack 819, win 65535, length 1374
20:24:01.063169 IP 10.0.2.15.34546 > 23.33.241.97.443: Flags [.], ack 140348, win 65535, length 0
20:24:01.064279 IP 10.0.2.15.34546 > 23.33.241.97.443: Flags [.], ack 143096, win 65535, length 0
20:24:01.064318 IP 10.0.2.15.34546 > 23.33.241.97.443: Flags [.], ack 144470, win 65535, length 0
20:24:01.065307 IP 23.33.241.97.443 > 10.0.2.15.34546: Flags [P.], seq 144470:147218, ack 819, win 65535, length 2748
20:24:01.065458 IP 10.0.2.15.34546 > 23.33.241.97.443: Flags [.], ack 147218, win 65535, length 0
20:24:01.066744 IP 23.33.241.97.443 > 10.0.2.15.34546: Flags [P.], seq 147218:152714, ack 819, win 65535, length 5496
20:24:01.066764 IP 10.0.2.15.34546 > 23.33.241.97.443: Flags [.], ack 152714, win 65535, length 0
20:24:01.067952 IP 23.33.241.97.443 > 10.0.2.15.34546: Flags [P.], seq 152714:158210, ack 819, win 65535, length 5496
20:24:01.068033 IP 23.33.241.97.443 > 10.0.2.15.34546: Flags [P.], seq 158210:160958, ack 819, win 65535, length 2748
20:24:01.068034 IP 23.33.241.97.443 > 10.0.2.15.34546: Flags [P.], seq 160958:162332, ack 819, win 65535, length 1374
20:24:01.068059 IP 10.0.2.15.34546 > 23.33.241.97.443: Flags [.], ack 158210, win 65535, length 0
20:24:01.068098 IP 10.0.2.15.34546 > 23.33.241.97.443: Flags [.], ack 160958, win 65535, length 0
20:24:01.068111 IP 10.0.2.15.34546 > 23.33.241.97.443: Flags [.], ack 162332, win 65535, length 0
20:24:01.068460 IP 23.33.241.97.443 > 10.0.2.15.34546: Flags [P.], seq 162332:163706, ack 819, win 65535, length 1374
20:24:01.068473 IP 10.0.2.15.34546 > 23.33.241.97.443: Flags [.], ack 163706, win 65535, length 0
20:24:01.070086 IP 23.33.241.97.443 > 10.0.2.15.34546: Flags [P.], seq 163706:170576, ack 819, win 65535, length 6870
20:24:01.070088 IP 23.33.241.97.443 > 10.0.2.15.34546: Flags [P.], seq 170576:171950, ack 819, win 65535, length 1374
20:24:01.070107 IP 10.0.2.15.34546 > 23.33.241.97.443: Flags [.], ack 170576, win 65535, length 0
20:24:01.070143 IP 10.0.2.15.34546 > 23.33.241.97.443: Flags [.], ack 171950, win 65535, length 0
20:24:01.070639 IP 23.33.241.97.443 > 10.0.2.15.34546: Flags [P.], seq 171950:176072, ack 819, win 65535, length 4122
20:24:01.070640 IP 23.33.241.97.443 > 10.0.2.15.34546: Flags [P.], seq 176072:177446, ack 819, win 65535, length 1374
20:24:01.070656 IP 10.0.2.15.34546 > 23.33.241.97.443: Flags [.], ack 176072, win 65535, length 0
20:24:01.070737 IP 10.0.2.15.34546 > 23.33.241.97.443: Flags [.], ack 177446, win 65535, length 0
20:24:01.070892 IP 23.33.241.97.443 > 10.0.2.15.34546: Flags [P.], seq 177446:178820, ack 819, win 65535, length 1374
20:24:01.070893 IP 23.33.241.97.443 > 10.0.2.15.34546: Flags [P.], seq 178820:181568, ack 819, win 65535, length 2748
20:24:01.070901 IP 10.0.2.15.34546 > 23.33.241.97.443: Flags [.], ack 178820, win 65535, length 0
20:24:01.070911 IP 10.0.2.15.34546 > 23.33.241.97.443: Flags [.], ack 181568, win 65535, length 0
20:24:01.073800 IP 23.33.241.97.443 > 10.0.2.15.34546: Flags [P.], seq 181568:188438, ack 819, win 65535, length 6870
20:24:01.073803 IP 23.33.241.97.443 > 10.0.2.15.34546: Flags [P.], seq 188438:193846, ack 819, win 65535, length 5408
20:24:01.073825 IP 10.0.2.15.34546 > 23.33.241.97.443: Flags [.], ack 188438, win 65535, length 0
20:24:01.073874 IP 10.0.2.15.34546 > 23.33.241.97.443: Flags [.], ack 193846, win 65535, length 0
20:24:01.076012 IP 23.33.241.97.443 > 10.0.2.15.34546: Flags [.], seq 193846:196766, ack 819, win 65535, length 2920
20:24:01.076035 IP 10.0.2.15.34546 > 23.33.241.97.443: Flags [.], ack 196766, win 65535, length 0
20:24:01.076604 IP 23.33.241.97.443 > 10.0.2.15.34546: Flags [P.], seq 196766:197968, ack 819, win 65535, length 1202
20:24:01.076608 IP 23.33.241.97.443 > 10.0.2.15.34546: Flags [P.], seq 197968:204838, ack 819, win 65535, length 6870
20:24:01.076608 IP 23.33.241.97.443 > 10.0.2.15.34546: Flags [P.], seq 204838:206212, ack 819, win 65535, length 1374
20:24:01.076610 IP 23.33.241.97.443 > 10.0.2.15.34546: Flags [P.], seq 206212:210334, ack 819, win 65535, length 4122
20:24:01.076633 IP 10.0.2.15.34546 > 23.33.241.97.443: Flags [.], ack 197968, win 65535, length 0
20:24:01.076788 IP 10.0.2.15.34546 > 23.33.241.97.443: Flags [.], ack 204838, win 65535, length 0
20:24:01.077034 IP 10.0.2.15.34546 > 23.33.241.97.443: Flags [.], ack 206212, win 65535, length 0
20:24:01.077058 IP 10.0.2.15.34546 > 23.33.241.97.443: Flags [.], ack 210334, win 65535, length 0
20:24:01.078003 IP 23.33.241.97.443 > 10.0.2.15.34546: Flags [P.], seq 210334:214456, ack 819, win 65535, length 4122
20:24:01.078005 IP 23.33.241.97.443 > 10.0.2.15.34546: Flags [P.], seq 214456:218578, ack 819, win 65535, length 4122
20:24:01.078006 IP 23.33.241.97.443 > 10.0.2.15.34546: Flags [P.], seq 218578:222700, ack 819, win 65535, length 4122
20:24:01.078024 IP 10.0.2.15.34546 > 23.33.241.97.443: Flags [.], ack 214456, win 65535, length 0
20:24:01.078044 IP 10.0.2.15.34546 > 23.33.241.97.443: Flags [.], ack 218578, win 65535, length 0
20:24:01.078112 IP 10.0.2.15.34546 > 23.33.241.97.443: Flags [.], ack 222700, win 65535, length 0
20:24:01.078179 IP 23.33.241.97.443 > 10.0.2.15.34546: Flags [P.], seq 222700:225448, ack 819, win 65535, length 2748
20:24:01.078189 IP 10.0.2.15.34546 > 23.33.241.97.443: Flags [.], ack 225448, win 65535, length 0
20:24:01.078387 IP 23.33.241.97.443 > 10.0.2.15.34546: Flags [P.], seq 225448:228196, ack 819, win 65535, length 2748
20:24:01.078388 IP 23.33.241.97.443 > 10.0.2.15.34546: Flags [P.], seq 228196:230944, ack 819, win 65535, length 2748
20:24:01.078388 IP 23.33.241.97.443 > 10.0.2.15.34546: Flags [P.], seq 230944:232318, ack 819, win 65535, length 1374
20:24:01.078400 IP 10.0.2.15.34546 > 23.33.241.97.443: Flags [.], ack 228196, win 65535, length 0
20:24:01.078417 IP 10.0.2.15.34546 > 23.33.241.97.443: Flags [.], ack 230944, win 65535, length 0
20:24:01.078428 IP 10.0.2.15.34546 > 23.33.241.97.443: Flags [.], ack 232318, win 65535, length 0
20:24:01.078583 IP 23.33.241.97.443 > 10.0.2.15.34546: Flags [P.], seq 232318:235066, ack 819, win 65535, length 2748
20:24:01.078601 IP 10.0.2.15.34546 > 23.33.241.97.443: Flags [.], ack 235066, win 65535, length 0
20:24:01.079609 IP 23.33.241.97.443 > 10.0.2.15.34546: Flags [P.], seq 235066:239188, ack 819, win 65535, length 4122
20:24:01.079612 IP 23.33.241.97.443 > 10.0.2.15.34546: Flags [P.], seq 239188:241936, ack 819, win 65535, length 2748
20:24:01.079630 IP 10.0.2.15.34546 > 23.33.241.97.443: Flags [.], ack 239188, win 65535, length 0
20:24:01.079656 IP 10.0.2.15.34546 > 23.33.241.97.443: Flags [.], ack 241936, win 65535, length 0
20:24:01.079878 IP 23.33.241.97.443 > 10.0.2.15.34546: Flags [P.], seq 241936:244684, ack 819, win 65535, length 2748
20:24:01.079885 IP 10.0.2.15.34546 > 23.33.241.97.443: Flags [.], ack 244684, win 65535, length 0
20:24:01.080410 IP 23.33.241.97.443 > 10.0.2.15.34546: Flags [P.], seq 244684:247432, ack 819, win 65535, length 2748

