20:25:28.018780 IP 10.0.2.15.59571 > 140.233.253.2.53: 58627+ A? www.ebay.com. (30)
20:25:28.018823 IP 10.0.2.15.59571 > 140.233.253.2.53: 8193+ AAAA? www.ebay.com. (30)
20:25:28.023517 IP 140.233.253.2.53 > 10.0.2.15.59571: 58627 3/0/0 CNAME slot9428.ebay.com.edgekey.net., CNAME e9428.a.akamaiedge.net., A 23.33.241.97 (122)
20:25:28.023519 IP 140.233.253.2.53 > 10.0.2.15.59571: 8193 2/1/0 CNAME slot9428.ebay.com.edgekey.net., CNAME e9428.a.akamaiedge.net. (164)
20:25:28.023801 IP 10.0.2.15.34578 > 23.33.241.97.443: Flags [S], seq 2295946288, win 64240, options [mss 1460,sackOK,TS val 9458698 ecr 0,nop,wscale 6], length 0
20:25:28.038987 IP 23.33.241.97.443 > 10.0.2.15.34578: Flags [S.], seq 255552001, ack 2295946289, win 65535, options [mss 1460], length 0
20:25:28.039028 IP 10.0.2.15.34578 > 23.33.241.97.443: Flags [.], ack 1, win 64240, length 0
20:25:28.050302 IP 10.0.2.15.34578 > 23.33.241.97.443: Flags [P.], seq 1:518, ack 1, win 64240, length 517
20:25:28.050731 IP 23.33.241.97.443 > 10.0.2.15.34578: Flags [.], ack 518, win 65535, length 0
20:25:28.067901 IP 23.33.241.97.443 > 10.0.2.15.34578: Flags [P.], seq 1:1375, ack 518, win 65535, length 1374
20:25:28.067927 IP 10.0.2.15.34578 > 23.33.241.97.443: Flags [.], ack 1375, win 63204, length 0
20:25:28.069076 IP 23.33.241.97.443 > 10.0.2.15.34578: Flags [P.], seq 1375:4695, ack 518, win 65535, length 3320
20:25:28.069104 IP 10.0.2.15.34578 > 23.33.241.97.443: Flags [.], ack 4695, win 61320, length 0
20:25:28.070310 IP 10.0.2.15.34578 > 23.33.241.97.443: Flags [P.], seq 518:598, ack 4695, win 62780, length 80
20:25:28.070628 IP 23.33.241.97.443 > 10.0.2.15.34578: Flags [.], ack 598, win 65535, length 0
20:25:28.070678 IP 10.0.2.15.34578 > 23.33.241.97.443: Flags [P.], seq 598:644, ack 4695, win 62780, length 46
20:25:28.070707 IP 10.0.2.15.34578 > 23.33.241.97.443: Flags [P.], seq 644:693, ack 4695, win 62780, length 49
20:25:28.070920 IP 23.33.241.97.443 > 10.0.2.15.34578: Flags [.], ack 644, win 65535, length 0
20:25:28.070974 IP 10.0.2.15.34578 > 23.33.241.97.443: Flags [P.], seq 693:788, ack 4695, win 62780, length 95
20:25:28.071097 IP 23.33.241.97.443 > 10.0.2.15.34578: Flags [.], ack 693, win 65535, length 0
20:25:28.071321 IP 23.33.241.97.443 > 10.0.2.15.34578: Flags [.], ack 788, win 65535, length 0
20:25:28.085509 IP 23.33.241.97.443 > 10.0.2.15.34578: Flags [P.], seq 4695:5237, ack 788, win 65535, length 542
20:25:28.085532 IP 10.0.2.15.34578 > 23.33.241.97.443: Flags [.], ack 5237, win 62780, length 0
20:25:28.087373 IP 23.33.241.97.443 > 10.0.2.15.34578: Flags [P.], seq 5237:5307, ack 788, win 65535, length 70
20:25:28.087392 IP 10.0.2.15.34578 > 23.33.241.97.443: Flags [.], ack 5307, win 62780, length 0
20:25:28.087613 IP 10.0.2.15.34578 > 23.33.241.97.443: Flags [P.], seq 788:819, ack 5307, win 62780, length 31
20:25:28.087990 IP 23.33.241.97.443 > 10.0.2.15.34578: Flags [.], ack 819, win 65535, length 0
20:25:28.255948 IP 23.33.241.97.443 > 10.0.2.15.34578: Flags [.], seq 5307:14067, ack 819, win 65535, length 8760
20:25:28.255971 IP 10.0.2.15.34578 > 23.33.241.97.443: Flags [.], ack 14067, win 58400, length 0
20:25:28.256196 IP 23.33.241.97.443 > 10.0.2.15.34578: Flags [P.], seq 14067:20346, ack 819, win 65535, length 6279
20:25:28.256212 IP 10.0.2.15.34578 > 23.33.241.97.443: Flags [.], ack 20346, win 54020, length 0
20:25:28.257663 IP 23.33.241.97.443 > 10.0.2.15.34578: Flags [P.], seq 20346:21615, ack 819, win 65535, length 1269
20:25:28.257689 IP 10.0.2.15.34578 > 23.33.241.97.443: Flags [.], ack 21615, win 62780, length 0
20:25:28.261083 IP 23.33.241.97.443 > 10.0.2.15.34578: Flags [P.], seq 21615:23032, ack 819, win 65535, length 1417
20:25:28.261106 IP 10.0.2.15.34578 > 23.33.241.97.443: Flags [.], ack 23032, win 62780, length 0
20:25:28.262445 IP 23.33.241.97.443 > 10.0.2.15.34578: Flags [P.], seq 23032:25765, ack 819, win 65535, length 2733
20:25:28.262466 IP 10.0.2.15.34578 > 23.33.241.97.443: Flags [.], ack 25765, win 62780, length 0
20:25:28.263704 IP 23.33.241.97.443 > 10.0.2.15.34578: Flags [P.], seq 25765:28498, ack 819, win 65535, length 2733
20:25:28.263724 IP 10.0.2.15.34578 > 23.33.241.97.443: Flags [.], ack 28498, win 62780, length 0
20:25:28.264912 IP 23.33.241.97.443 > 10.0.2.15.34578: Flags [P.], seq 28498:29872, ack 819, win 65535, length 1374
20:25:28.264927 IP 10.0.2.15.34578 > 23.33.241.97.443: Flags [.], ack 29872, win 62780, length 0
20:25:28.269239 IP 23.33.241.97.443 > 10.0.2.15.34578: Flags [P.], seq 29872:31246, ack 819, win 65535, length 1374
20:25:28.270312 IP 23.33.241.97.443 > 10.0.2.15.34578: Flags [P.], seq 31246:33994, ack 819, win 65535, length 2748
20:25:28.270333 IP 10.0.2.15.34578 > 23.33.241.97.443: Flags [.], ack 33994, win 62780, length 0
20:25:28.271575 IP 23.33.241.97.443 > 10.0.2.15.34578: Flags [P.], seq 33994:38116, ack 819, win 65535, length 4122
20:25:28.271861 IP 10.0.2.15.34578 > 23.33.241.97.443: Flags [.], ack 38116, win 61320, length 0
20:25:28.272806 IP 23.33.241.97.443 > 10.0.2.15.34578: Flags [P.], seq 38116:38241, ack 819, win 65535, length 125
20:25:28.272982 IP 10.0.2.15.34578 > 23.33.241.97.443: Flags [.], ack 38241, win 62780, length 0
20:25:28.280975 IP 23.33.241.97.443 > 10.0.2.15.34578: Flags [P.], seq 38241:39615, ack 819, win 65535, length 1374
20:25:28.281145 IP 10.0.2.15.34578 > 23.33.241.97.443: Flags [.], ack 39615, win 62780, length 0
20:25:28.283276 IP 23.33.241.97.443 > 10.0.2.15.34578: Flags [P.], seq 39615:43722, ack 819, win 65535, length 4107
20:25:28.283898 IP 10.0.2.15.34578 > 23.33.241.97.443: Flags [.], ack 43722, win 62780, length 0
20:25:28.284544 IP 23.33.241.97.443 > 10.0.2.15.34578: Flags [P.], seq 43722:47844, ack 819, win 65535, length 4122
20:25:28.284582 IP 10.0.2.15.34578 > 23.33.241.97.443: Flags [.], ack 47844, win 61320, length 0
20:25:28.285676 IP 23.33.241.97.443 > 10.0.2.15.34578: Flags [P.], seq 47844:53340, ack 819, win 65535, length 5496
20:25:28.285692 IP 10.0.2.15.34578 > 23.33.241.97.443: Flags [.], ack 53340, win 61320, length 0
20:25:28.286387 IP 23.33.241.97.443 > 10.0.2.15.34578: Flags [P.], seq 53340:54684, ack 819, win 65535, length 1344
20:25:28.286447 IP 10.0.2.15.34578 > 23.33.241.97.443: Flags [.], ack 54684, win 62780, length 0
20:25:28.290726 IP 23.33.241.97.443 > 10.0.2.15.34578: Flags [P.], seq 54684:57506, ack 819, win 65535, length 2822
20:25:28.290754 IP 10.0.2.15.34578 > 23.33.241.97.443: Flags [.], ack 57506, win 62780, length 0
20:25:28.292479 IP 23.33.241.97.443 > 10.0.2.15.34578: Flags [.], seq 57506:58966, ack 819, win 65535, length 1460
20:25:28.293213 IP 23.33.241.97.443 > 10.0.2.15.34578: Flags [P.], seq 58966:60254, ack 819, win 65535, length 1288
20:25:28.293238 IP 10.0.2.15.34578 > 23.33.241.97.443: Flags [.], ack 60254, win 62780, length 0
20:25:28.293700 IP 23.33.241.97.443 > 10.0.2.15.34578: Flags [P.], seq 60254:67109, ack 819, win 65535, length 6855
20:25:28.293893 IP 10.0.2.15.34578 > 23.33.241.97.443: Flags [.], ack 67109, win 62780, length 0
20:25:28.295354 IP 23.33.241.97.443 > 10.0.2.15.34578: Flags [P.], seq 67109:68468, ack 819, win 65535, length 1359
20:25:28.295389 IP 10.0.2.15.34578 > 23.33.241.97.443: Flags [.], ack 68468, win 65535, length 0
20:25:28.299201 IP 23.33.241.97.443 > 10.0.2.15.34578: Flags [P.], seq 68468:71216, ack 819, win 65535, length 2748
20:25:28.299223 IP 10.0.2.15.34578 > 23.33.241.97.443: Flags [.], ack 71216, win 65535, length 0
20:25:28.300232 IP 23.33.241.97.443 > 10.0.2.15.34578: Flags [P.], seq 71216:71253, ack 819, win 65535, length 37
20:25:28.300316 IP 10.0.2.15.34578 > 23.33.241.97.443: Flags [.], ack 71253, win 65535, length 0
20:25:28.306628 IP 23.33.241.97.443 > 10.0.2.15.34578: Flags [P.], seq 71253:74001, ack 819, win 65535, length 2748
20:25:28.306649 IP 10.0.2.15.34578 > 23.33.241.97.443: Flags [.], ack 74001, win 65535, length 0
20:25:28.307194 IP 23.33.241.97.443 > 10.0.2.15.34578: Flags [P.], seq 74001:74273, ack 819, win 65535, length 272
20:25:28.307210 IP 10.0.2.15.34578 > 23.33.241.97.443: Flags [.], ack 74273, win 65535, length 0
20:25:28.533706 IP 23.33.241.97.443 > 10.0.2.15.34578: Flags [P.], seq 74273:77068, ack 819, win 65535, length 2795
20:25:28.533724 IP 10.0.2.15.34578 > 23.33.241.97.443: Flags [.], ack 77068, win 65535, length 0
20:25:28.534502 IP 23.33.241.97.443 > 10.0.2.15.34578: Flags [P.], seq 77068:82549, ack 819, win 65535, length 5481
20:25:28.534522 IP 10.0.2.15.34578 > 23.33.241.97.443: Flags [.], ack 82549, win 65535, length 0
20:25:28.535958 IP 23.33.241.97.443 > 10.0.2.15.34578: Flags [P.], seq 82549:88045, ack 819, win 65535, length 5496
20:25:28.535978 IP 10.0.2.15.34578 > 23.33.241.97.443: Flags [.], ack 88045, win 65535, length 0
20:25:28.537223 IP 23.33.241.97.443 > 10.0.2.15.34578: Flags [.], seq 88045:92425, ack 819, win 65535, length 4380
20:25:28.537247 IP 10.0.2.15.34578 > 23.33.241.97.443: Flags [.], ack 92425, win 65535, length 0
20:25:28.537951 IP 23.33.241.97.443 > 10.0.2.15.34578: Flags [P.], seq 92425:93541, ack 819, win 65535, length 1116
20:25:28.537970 IP 10.0.2.15.34578 > 23.33.241.97.443: Flags [.], ack 93541, win 65535, length 0
20:25:28.538530 IP 23.33.241.97.443 > 10.0.2.15.34578: Flags [P.], seq 93541:99037, ack 819, win 65535, length 5496
20:25:28.538541 IP 10.0.2.15.34578 > 23.33.241.97.443: Flags [.], ack 99037, win 65535, length 0
20:25:28.539684 IP 23.33.241.97.443 > 10.0.2.15.34578: Flags [P.], seq 99037:104533, ack 819, win 65535, length 5496
20:25:28.539701 IP 10.0.2.15.34578 > 23.33.241.97.443: Flags [.], ack 104533, win 65535, length 0
20:25:28.540424 IP 23.33.241.97.443 > 10.0.2.15.34578: Flags [P.], seq 104533:110029, ack 819, win 65535, length 5496
20:25:28.540438 IP 10.0.2.15.34578 > 23.33.241.97.443: Flags [.], ack 110029, win 65535, length 0
20:25:28.541925 IP 23.33.241.97.443 > 10.0.2.15.34578: Flags [.], seq 110029:112949, ack 819, win 65535, length 2920
20:25:28.541946 IP 10.0.2.15.34578 > 23.33.241.97.443: Flags [.], ack 112949, win 65535, length 0
20:25:28.542090 IP 23.33.241.97.443 > 10.0.2.15.34578: Flags [P.], seq 112949:114151, ack 819, win 65535, length 1202
20:25:28.542096 IP 10.0.2.15.34578 > 23.33.241.97.443: Flags [.], ack 114151, win 65535, length 0
20:25:28.542638 IP 23.33.241.97.443 > 10.0.2.15.34578: Flags [P.], seq 114151:118273, ack 819, win 65535, length 4122
20:25:28.542653 IP 10.0.2.15.34578 > 23.33.241.97.443: Flags [.], ack 118273, win 65535, length 0
20:25:28.543877 IP 23.33.241.97.443 > 10.0.2.15.34578: Flags [P.], seq 118273:122395, ack 819, win 65535, length 4122
20:25:28.543900 IP 10.0.2.15.34578 > 23.33.241.97.443: Flags [.], ack 122395, win 65535, length 0
20:25:28.544954 IP 23.33.241.97.443 > 10.0.2.15.34578: Flags [P.], seq 122395:126517, ack 819, win 65535, length 4122
20:25:28.544976 IP 10.0.2.15.34578 > 23.33.241.97.443: Flags [.], ack 126517, win 65535, length 0
20:25:28.546211 IP 23.33.241.97.443 > 10.0.2.15.34578: Flags [.], seq 126517:133817, ack 819, win 65535, length 7300
20:25:28.546233 IP 10.0.2.15.34578 > 23.33.241.97.443: Flags [.], ack 133817, win 65535, length 0
20:25:28.547079 IP 23.33.241.97.443 > 10.0.2.15.34578: Flags [P.], seq 133817:134761, ack 819, win 65535, length 944
20:25:28.547103 IP 10.0.2.15.34578 > 23.33.241.97.443: Flags [.], ack 134761, win 65535, length 0
20:25:28.547404 IP 23.33.241.97.443 > 10.0.2.15.34578: Flags [P.], seq 134761:138883, ack 819, win 65535, length 4122
20:25:28.547416 IP 10.0.2.15.34578 > 23.33.241.97.443: Flags [.], ack 138883, win 65535, length 0
20:25:28.548135 IP 23.33.241.97.443 > 10.0.2.15.34578: Flags [P.], seq 138883:140568, ack 819, win 65535, length 1685
20:25:28.548146 IP 10.0.2.15.34578 > 23.33.241.97.443: Flags [.], ack 140568, win 65535, length 0
20:25:28.549045 IP 23.33.241.97.443 > 10.0.2.15.34578: Flags [P.], seq 140568:147438, ack 819, win 65535, length 6870
20:25:28.549060 IP 10.0.2.15.34578 > 23.33.241.97.443: Flags [.], ack 147438, win 65535, length 0
20:25:28.550404 IP 23.33.241.97.443 > 10.0.2.15.34578: Flags [P.], seq 147438:152919, ack 819, win 65535, length 5481
20:25:28.550435 IP 10.0.2.15.34578 > 23.33.241.97.443: Flags [.], ack 152919, win 65535, length 0
20:25:28.551093 IP 23.33.241.97.443 > 10.0.2.15.34578: Flags [P.], seq 152919:155667, ack 819, win 65535, length 2748
20:25:28.551116 IP 10.0.2.15.34578 > 23.33.241.97.443: Flags [.], ack 155667, win 65535, length 0
20:25:28.552254 IP 23.33.241.97.443 > 10.0.2.15.34578: Flags [P.], seq 155667:162291, ack 819, win 65535, length 6624
20:25:28.552273 IP 10.0.2.15.34578 > 23.33.241.97.443: Flags [.], ack 162291, win 65535, length 0
20:25:28.552379 IP 23.33.241.97.443 > 10.0.2.15.34578: Flags [P.], seq 162291:163665, ack 819, win 65535, length 1374
20:25:28.552385 IP 10.0.2.15.34578 > 23.33.241.97.443: Flags [.], ack 163665, win 65535, length 0
20:25:28.553523 IP 23.33.241.97.443 > 10.0.2.15.34578: Flags [P.], seq 163665:167787, ack 819, win 65535, length 4122
20:25:28.553545 IP 10.0.2.15.34578 > 23.33.241.97.443: Flags [.], ack 167787, win 65535, length 0
20:25:28.555368 IP 23.33.241.97.443 > 10.0.2.15.34578: Flags [P.], seq 167787:171909, ack 819, win 65535, length 4122
20:25:28.555391 IP 10.0.2.15.34578 > 23.33.241.97.443: Flags [.], ack 171909, win 65535, length 0
20:25:28.556103 IP 23.33.241.97.443 > 10.0.2.15.34578: Flags [P.], seq 171909:177405, ack 819, win 65535, length 5496
20:25:28.556118 IP 10.0.2.15.34578 > 23.33.241.97.443: Flags [.], ack 177405, win 65535, length 0
20:25:28.556730 IP 23.33.241.97.443 > 10.0.2.15.34578: Flags [P.], seq 177405:184275, ack 819, win 65535, length 6870
20:25:28.556747 IP 10.0.2.15.34578 > 23.33.241.97.443: Flags [.], ack 184275, win 65535, length 0
20:25:28.558002 IP 23.33.241.97.443 > 10.0.2.15.34578: Flags [P.], seq 184275:189712, ack 819, win 65535, length 5437
20:25:28.558022 IP 10.0.2.15.34578 > 23.33.241.97.443: Flags [.], ack 189712, win 65535, length 0
20:25:28.560413 IP 23.33.241.97.443 > 10.0.2.15.34578: Flags [P.], seq 189712:200704, ack 819, win 65535, length 10992
20:25:28.560433 IP 10.0.2.15.34578 > 23.33.241.97.443: Flags [.], ack 200704, win 65535, length 0
20:25:28.561360 IP 23.33.241.97.443 > 10.0.2.15.34578: Flags [P.], seq 200704:204826, ack 819, win 65535, length 4122
20:25:28.561374 IP 10.0.2.15.34578 > 23.33.241.97.443: Flags [.], ack 204826, win 65535, length 0
20:25:28.562376 IP 23.33.241.97.443 > 10.0.2.15.34578: Flags [P.], seq 204826:211696, ack 819, win 65535, length 6870
20:25:28.562378 IP 23.33.241.97.443 > 10.0.2.15.34578: Flags [P.], seq 211696:213070, ack 819, win 65535, length 1374
20:25:28.562435 IP 10.0.2.15.34578 > 23.33.241.97.443: Flags [.], ack 211696, win 65535, length 0
20:25:28.562463 IP 10.0.2.15.34578 > 23.33.241.97.443: Flags [.], ack 213070, win 65535, length 0
20:25:28.562587 IP 23.33.241.97.443 > 10.0.2.15.34578: Flags [P.], seq 213070:215818, ack 819, win 65535, length 2748
20:25:28.562605 IP 10.0.2.15.34578 > 23.33.241.97.443: Flags [.], ack 215818, win 65535, length 0
20:25:28.563380 IP 23.33.241.97.443 > 10.0.2.15.34578: Flags [P.], seq 215818:221314, ack 819, win 65535, length 5496
20:25:28.563401 IP 10.0.2.15.34578 > 23.33.241.97.443: Flags [.], ack 221314, win 65535, length 0
20:25:28.564496 IP 23.33.241.97.443 > 10.0.2.15.34578: Flags [P.], seq 221314:229558, ack 819, win 65535, length 8244
20:25:28.564498 IP 23.33.241.97.443 > 10.0.2.15.34578: Flags [P.], seq 229558:230932, ack 819, win 65535, length 1374
20:25:28.564499 IP 23.33.241.97.443 > 10.0.2.15.34578: Flags [P.], seq 230932:235054, ack 819, win 65535, length 4122
20:25:28.564527 IP 10.0.2.15.34578 > 23.33.241.97.443: Flags [.], ack 229558, win 65535, length 0
20:25:28.564644 IP 10.0.2.15.34578 > 23.33.241.97.443: Flags [.], ack 230932, win 65535, length 0
20:25:28.564658 IP 10.0.2.15.34578 > 23.33.241.97.443: Flags [.], ack 235054, win 65535, length 0
20:25:28.564671 IP 23.33.241.97.443 > 10.0.2.15.34578: Flags [P.], seq 235054:237802, ack 819, win 65535, length 2748
20:25:28.564675 IP 10.0.2.15.34578 > 23.33.241.97.443: Flags [.], ack 237802, win 65535, length 0
20:25:28.565831 IP 23.33.241.97.443 > 10.0.2.15.34578: Flags [P.], seq 237802:246046, ack 819, win 65535, length 8244
20:25:28.565845 IP 10.0.2.15.34578 > 23.33.241.97.443: Flags [.], ack 246046, win 65535, length 0
20:25:28.566143 IP 23.33.241.97.443 > 10.0.2.15.34578: Flags [P.], seq 246046:248794, ack 819, win 65535, length 2748

