20:23:48.607215 IP 10.0.2.15.33398 > 140.233.253.2.53: 48259+ A? www.ebay.com. (30)
20:23:48.607255 IP 10.0.2.15.33398 > 140.233.253.2.53: 4736+ AAAA? www.ebay.com. (30)
20:23:48.612739 IP 140.233.253.2.53 > 10.0.2.15.33398: 4736 2/1/0 CNAME slot9428.ebay.com.edgekey.net., CNAME e9428.a.akamaiedge.net. (164)
20:23:48.614249 IP 140.233.253.2.53 > 10.0.2.15.33398: 48259 3/0/0 CNAME slot9428.ebay.com.edgekey.net., CNAME e9428.a.akamaiedge.net., A 23.33.241.97 (122)
20:23:48.614566 IP 10.0.2.15.34542 > 23.33.241.97.443: Flags [S], seq 3682837448, win 64240, options [mss 1460,sackOK,TS val 9359289 ecr 0,nop,wscale 6], length 0
20:23:48.629134 IP 23.33.241.97.443 > 10.0.2.15.34542: Flags [S.], seq 252544001, ack 3682837449, win 65535, options [mss 1460], length 0
20:23:48.629173 IP 10.0.2.15.34542 > 23.33.241.97.443: Flags [.], ack 1, win 64240, length 0
20:23:48.637944 IP 10.0.2.15.34542 > 23.33.241.97.443: Flags [P.], seq 1:518, ack 1, win 64240, length 517
20:23:48.638165 IP 23.33.241.97.443 > 10.0.2.15.34542: Flags [.], ack 518, win 65535, length 0
20:23:48.656990 IP 23.33.241.97.443 > 10.0.2.15.34542: Flags [P.], seq 1:1375, ack 518, win 65535, length 1374
20:23:48.657012 IP 10.0.2.15.34542 > 23.33.241.97.443: Flags [.], ack 1375, win 63204, length 0
20:23:48.657960 IP 23.33.241.97.443 > 10.0.2.15.34542: Flags [P.], seq 1375:4695, ack 518, win 65535, length 3320
20:23:48.657986 IP 10.0.2.15.34542 > 23.33.241.97.443: Flags [.], ack 4695, win 61320, length 0
20:23:48.659103 IP 10.0.2.15.34542 > 23.33.241.97.443: Flags [P.], seq 518:598, ack 4695, win 62780, length 80
20:23:48.659444 IP 23.33.241.97.443 > 10.0.2.15.34542: Flags [.], ack 598, win 65535, length 0
20:23:48.659535 IP 10.0.2.15.34542 > 23.33.241.97.443: Flags [P.], seq 598:644, ack 4695, win 62780, length 46
20:23:48.659563 IP 10.0.2.15.34542 > 23.33.241.97.443: Flags [P.], seq 644:693, ack 4695, win 62780, length 49
20:23:48.659793 IP 23.33.241.97.443 > 10.0.2.15.34542: Flags [.], ack 644, win 65535, length 0
20:23:48.659794 IP 23.33.241.97.443 > 10.0.2.15.34542: Flags [.], ack 693, win 65535, length 0
20:23:48.659853 IP 10.0.2.15.34542 > 23.33.241.97.443: Flags [P.], seq 693:788, ack 4695, win 62780, length 95
20:23:48.660082 IP 23.33.241.97.443 > 10.0.2.15.34542: Flags [.], ack 788, win 65535, length 0
20:23:48.673954 IP 23.33.241.97.443 > 10.0.2.15.34542: Flags [P.], seq 4695:5329, ack 788, win 65535, length 634
20:23:48.673970 IP 10.0.2.15.34542 > 23.33.241.97.443: Flags [.], ack 5329, win 62780, length 0
20:23:48.674308 IP 10.0.2.15.34542 > 23.33.241.97.443: Flags [P.], seq 788:819, ack 5329, win 62780, length 31
20:23:48.674557 IP 23.33.241.97.443 > 10.0.2.15.34542: Flags [.], ack 819, win 65535, length 0
20:23:49.137912 IP 23.33.241.97.443 > 10.0.2.15.34542: Flags [P.], seq 5329:12169, ack 819, win 65535, length 6840
20:23:49.137945 IP 10.0.2.15.34542 > 23.33.241.97.443: Flags [.], ack 12169, win 59860, length 0
20:23:49.138182 IP 23.33.241.97.443 > 10.0.2.15.34542: Flags [P.], seq 12169:17635, ack 819, win 65535, length 5466
20:23:49.138194 IP 10.0.2.15.34542 > 23.33.241.97.443: Flags [.], ack 17635, win 55480, length 0
20:23:49.138881 IP 23.33.241.97.443 > 10.0.2.15.34542: Flags [.], seq 17635:19095, ack 819, win 65535, length 1460
20:23:49.138904 IP 10.0.2.15.34542 > 23.33.241.97.443: Flags [.], ack 19095, win 62780, length 0
20:23:49.139163 IP 23.33.241.97.443 > 10.0.2.15.34542: Flags [P.], seq 19095:20368, ack 819, win 65535, length 1273
20:23:49.139173 IP 10.0.2.15.34542 > 23.33.241.97.443: Flags [.], ack 20368, win 62780, length 0
20:23:49.140043 IP 23.33.241.97.443 > 10.0.2.15.34542: Flags [P.], seq 20368:21637, ack 819, win 65535, length 1269
20:23:49.140059 IP 10.0.2.15.34542 > 23.33.241.97.443: Flags [.], ack 21637, win 62780, length 0
20:23:49.142119 IP 23.33.241.97.443 > 10.0.2.15.34542: Flags [P.], seq 21637:21716, ack 819, win 65535, length 79
20:23:49.142137 IP 10.0.2.15.34542 > 23.33.241.97.443: Flags [.], ack 21716, win 62780, length 0
20:23:49.143786 IP 23.33.241.97.443 > 10.0.2.15.34542: Flags [P.], seq 21716:25823, ack 819, win 65535, length 4107
20:23:49.143809 IP 10.0.2.15.34542 > 23.33.241.97.443: Flags [.], ack 25823, win 61320, length 0
20:23:49.144242 IP 23.33.241.97.443 > 10.0.2.15.34542: Flags [P.], seq 25823:28556, ack 819, win 65535, length 2733
20:23:49.144257 IP 10.0.2.15.34542 > 23.33.241.97.443: Flags [.], ack 28556, win 62780, length 0
20:23:49.145371 IP 23.33.241.97.443 > 10.0.2.15.34542: Flags [P.], seq 28556:29930, ack 819, win 65535, length 1374
20:23:49.145388 IP 10.0.2.15.34542 > 23.33.241.97.443: Flags [.], ack 29930, win 62780, length 0
20:23:49.152170 IP 23.33.241.97.443 > 10.0.2.15.34542: Flags [P.], seq 29930:34052, ack 819, win 65535, length 4122
20:23:49.152284 IP 10.0.2.15.34542 > 23.33.241.97.443: Flags [.], ack 34052, win 61320, length 0
20:23:49.153107 IP 23.33.241.97.443 > 10.0.2.15.34542: Flags [P.], seq 34052:38174, ack 819, win 65535, length 4122
20:23:49.153124 IP 10.0.2.15.34542 > 23.33.241.97.443: Flags [.], ack 38174, win 61320, length 0
20:23:49.155226 IP 23.33.241.97.443 > 10.0.2.15.34542: Flags [P.], seq 38174:38299, ack 819, win 65535, length 125
20:23:49.155242 IP 10.0.2.15.34542 > 23.33.241.97.443: Flags [.], ack 38299, win 62780, length 0
20:23:49.163607 IP 23.33.241.97.443 > 10.0.2.15.34542: Flags [P.], seq 38299:43795, ack 819, win 65535, length 5496
20:23:49.163627 IP 10.0.2.15.34542 > 23.33.241.97.443: Flags [.], ack 43795, win 61320, length 0
20:23:49.165820 IP 23.33.241.97.443 > 10.0.2.15.34542: Flags [P.], seq 43795:50650, ack 819, win 65535, length 6855
20:23:49.165844 IP 10.0.2.15.34542 > 23.33.241.97.443: Flags [.], ack 50650, win 59860, length 0
20:23:49.166614 IP 23.33.241.97.443 > 10.0.2.15.34542: Flags [P.], seq 50650:52009, ack 819, win 65535, length 1359
20:23:49.166630 IP 10.0.2.15.34542 > 23.33.241.97.443: Flags [.], ack 52009, win 58501, length 0
20:23:49.169995 IP 23.33.241.97.443 > 10.0.2.15.34542: Flags [P.], seq 52009:56168, ack 819, win 65535, length 4159
20:23:49.170084 IP 10.0.2.15.34542 > 23.33.241.97.443: Flags [.], ack 56168, win 61320, length 0
20:23:49.170765 IP 23.33.241.97.443 > 10.0.2.15.34542: Flags [P.], seq 56168:60290, ack 819, win 65535, length 4122
20:23:49.170800 IP 10.0.2.15.34542 > 23.33.241.97.443: Flags [.], ack 60290, win 58400, length 0
20:23:49.172030 IP 23.33.241.97.443 > 10.0.2.15.34542: Flags [P.], seq 60290:65771, ack 819, win 65535, length 5481
20:23:49.172170 IP 10.0.2.15.34542 > 23.33.241.97.443: Flags [.], ack 65771, win 61320, length 0
20:23:49.173499 IP 23.33.241.97.443 > 10.0.2.15.34542: Flags [P.], seq 65771:68504, ack 819, win 65535, length 2733
20:23:49.173522 IP 10.0.2.15.34542 > 23.33.241.97.443: Flags [.], ack 68504, win 65535, length 0
20:23:49.182868 IP 23.33.241.97.443 > 10.0.2.15.34542: Flags [P.], seq 68504:71289, ack 819, win 65535, length 2785
20:23:49.182895 IP 10.0.2.15.34542 > 23.33.241.97.443: Flags [.], ack 71289, win 65535, length 0
20:23:49.194315 IP 23.33.241.97.443 > 10.0.2.15.34542: Flags [P.], seq 71289:74037, ack 819, win 65535, length 2748
20:23:49.194379 IP 10.0.2.15.34542 > 23.33.241.97.443: Flags [.], ack 74037, win 65535, length 0
20:23:49.196617 IP 23.33.241.97.443 > 10.0.2.15.34542: Flags [P.], seq 74037:74304, ack 819, win 65535, length 267
20:23:49.196640 IP 10.0.2.15.34542 > 23.33.241.97.443: Flags [.], ack 74304, win 65535, length 0
20:23:49.347621 IP 23.33.241.97.443 > 10.0.2.15.34542: Flags [P.], seq 74304:75723, ack 819, win 65535, length 1419
20:23:49.347646 IP 10.0.2.15.34542 > 23.33.241.97.443: Flags [.], ack 75723, win 65535, length 0
20:23:49.349573 IP 23.33.241.97.443 > 10.0.2.15.34542: Flags [P.], seq 75723:78471, ack 819, win 65535, length 2748
20:23:49.349597 IP 10.0.2.15.34542 > 23.33.241.97.443: Flags [.], ack 78471, win 65535, length 0
20:23:49.350720 IP 23.33.241.97.443 > 10.0.2.15.34542: Flags [P.], seq 78471:89463, ack 819, win 65535, length 10992
20:23:49.350856 IP 10.0.2.15.34542 > 23.33.241.97.443: Flags [.], ack 89463, win 65535, length 0
20:23:49.350915 IP 23.33.241.97.443 > 10.0.2.15.34542: Flags [P.], seq 89463:93585, ack 819, win 65535, length 4122
20:23:49.350929 IP 10.0.2.15.34542 > 23.33.241.97.443: Flags [.], ack 93585, win 65535, length 0
20:23:49.351559 IP 23.33.241.97.443 > 10.0.2.15.34542: Flags [P.], seq 93585:97707, ack 819, win 65535, length 4122
20:23:49.351634 IP 10.0.2.15.34542 > 23.33.241.97.443: Flags [.], ack 97707, win 65535, length 0
20:23:49.352996 IP 23.33.241.97.443 > 10.0.2.15.34542: Flags [P.], seq 97707:105951, ack 819, win 65535, length 8244
20:23:49.353019 IP 10.0.2.15.34542 > 23.33.241.97.443: Flags [.], ack 105951, win 65535, length 0
20:23:49.353762 IP 23.33.241.97.443 > 10.0.2.15.34542: Flags [P.], seq 105951:110043, ack 819, win 65535, length 4092
20:23:49.353780 IP 10.0.2.15.34542 > 23.33.241.97.443: Flags [.], ack 110043, win 65535, length 0
20:23:49.355035 IP 23.33.241.97.443 > 10.0.2.15.34542: Flags [P.], seq 110043:118287, ack 819, win 65535, length 8244
20:23:49.355057 IP 10.0.2.15.34542 > 23.33.241.97.443: Flags [.], ack 118287, win 65535, length 0
20:23:49.355699 IP 23.33.241.97.443 > 10.0.2.15.34542: Flags [.], seq 118287:121207, ack 819, win 65535, length 2920
20:23:49.355720 IP 10.0.2.15.34542 > 23.33.241.97.443: Flags [.], ack 121207, win 65535, length 0
20:23:49.355914 IP 23.33.241.97.443 > 10.0.2.15.34542: Flags [P.], seq 121207:122409, ack 819, win 65535, length 1202
20:23:49.355932 IP 10.0.2.15.34542 > 23.33.241.97.443: Flags [.], ack 122409, win 65535, length 0
20:23:49.356845 IP 23.33.241.97.443 > 10.0.2.15.34542: Flags [P.], seq 122409:126531, ack 819, win 65535, length 4122
20:23:49.356863 IP 10.0.2.15.34542 > 23.33.241.97.443: Flags [.], ack 126531, win 65535, length 0
20:23:49.358596 IP 23.33.241.97.443 > 10.0.2.15.34542: Flags [.], seq 126531:127991, ack 819, win 65535, length 1460
20:23:49.358618 IP 10.0.2.15.34542 > 23.33.241.97.443: Flags [.], ack 127991, win 65535, length 0
20:23:49.359169 IP 23.33.241.97.443 > 10.0.2.15.34542: Flags [P.], seq 127991:130653, ack 819, win 65535, length 2662
20:23:49.359190 IP 10.0.2.15.34542 > 23.33.241.97.443: Flags [.], ack 130653, win 65535, length 0
20:23:49.360173 IP 23.33.241.97.443 > 10.0.2.15.34542: Flags [P.], seq 130653:136149, ack 819, win 65535, length 5496
20:23:49.360175 IP 23.33.241.97.443 > 10.0.2.15.34542: Flags [P.], seq 136149:143019, ack 819, win 65535, length 6870
20:23:49.360197 IP 10.0.2.15.34542 > 23.33.241.97.443: Flags [.], ack 136149, win 65535, length 0
20:23:49.360292 IP 10.0.2.15.34542 > 23.33.241.97.443: Flags [.], ack 143019, win 65535, length 0
20:23:49.360954 IP 23.33.241.97.443 > 10.0.2.15.34542: Flags [P.], seq 143019:147141, ack 819, win 65535, length 4122
20:23:49.360967 IP 10.0.2.15.34542 > 23.33.241.97.443: Flags [.], ack 147141, win 65535, length 0
20:23:49.362052 IP 23.33.241.97.443 > 10.0.2.15.34542: Flags [P.], seq 147141:154011, ack 819, win 65535, length 6870
20:23:49.362054 IP 23.33.241.97.443 > 10.0.2.15.34542: Flags [P.], seq 154011:156759, ack 819, win 65535, length 2748
20:23:49.362073 IP 10.0.2.15.34542 > 23.33.241.97.443: Flags [.], ack 154011, win 65535, length 0
20:23:49.362154 IP 10.0.2.15.34542 > 23.33.241.97.443: Flags [.], ack 156759, win 65535, length 0
20:23:49.363616 IP 23.33.241.97.443 > 10.0.2.15.34542: Flags [P.], seq 156759:159507, ack 819, win 65535, length 2748
20:23:49.363638 IP 10.0.2.15.34542 > 23.33.241.97.443: Flags [.], ack 159507, win 65535, length 0
20:23:49.364298 IP 23.33.241.97.443 > 10.0.2.15.34542: Flags [P.], seq 159507:166377, ack 819, win 65535, length 6870
20:23:49.364312 IP 10.0.2.15.34542 > 23.33.241.97.443: Flags [.], ack 166377, win 65535, length 0
20:23:49.365270 IP 23.33.241.97.443 > 10.0.2.15.34542: Flags [P.], seq 166377:171873, ack 819, win 65535, length 5496
20:23:49.365286 IP 10.0.2.15.34542 > 23.33.241.97.443: Flags [.], ack 171873, win 65535, length 0
20:23:49.366432 IP 23.33.241.97.443 > 10.0.2.15.34542: Flags [P.], seq 171873:175995, ack 819, win 65535, length 4122
20:23:49.366452 IP 10.0.2.15.34542 > 23.33.241.97.443: Flags [.], ack 175995, win 65535, length 0
20:23:49.367235 IP 23.33.241.97.443 > 10.0.2.15.34542: Flags [P.], seq 175995:180117, ack 819, win 65535, length 4122
20:23:49.367247 IP 10.0.2.15.34542 > 23.33.241.97.443: Flags [.], ack 180117, win 65535, length 0
20:23:49.368830 IP 23.33.241.97.443 > 10.0.2.15.34542: Flags [P.], seq 180117:188361, ack 819, win 65535, length 8244
20:23:49.368849 IP 10.0.2.15.34542 > 23.33.241.97.443: Flags [.], ack 188361, win 65535, length 0
20:23:49.369385 IP 23.33.241.97.443 > 10.0.2.15.34542: Flags [P.], seq 188361:192483, ack 819, win 65535, length 4122
20:23:49.369399 IP 10.0.2.15.34542 > 23.33.241.97.443: Flags [.], ack 192483, win 65535, length 0
20:23:49.370638 IP 23.33.241.97.443 > 10.0.2.15.34542: Flags [P.], seq 192483:197805, ack 819, win 65535, length 5322
20:23:49.370660 IP 10.0.2.15.34542 > 23.33.241.97.443: Flags [.], ack 197805, win 65535, length 0
20:23:49.371451 IP 23.33.241.97.443 > 10.0.2.15.34542: Flags [P.], seq 197805:203301, ack 819, win 65535, length 5496
20:23:49.371471 IP 10.0.2.15.34542 > 23.33.241.97.443: Flags [.], ack 203301, win 65535, length 0
20:23:49.372752 IP 23.33.241.97.443 > 10.0.2.15.34542: Flags [P.], seq 203301:212919, ack 819, win 65535, length 9618
20:23:49.372755 IP 23.33.241.97.443 > 10.0.2.15.34542: Flags [P.], seq 212919:214293, ack 819, win 65535, length 1374
20:23:49.372778 IP 10.0.2.15.34542 > 23.33.241.97.443: Flags [.], ack 212919, win 65535, length 0
20:23:49.372817 IP 10.0.2.15.34542 > 23.33.241.97.443: Flags [.], ack 214293, win 65535, length 0
20:23:49.374135 IP 23.33.241.97.443 > 10.0.2.15.34542: Flags [P.], seq 214293:221163, ack 819, win 65535, length 6870
20:23:49.374155 IP 10.0.2.15.34542 > 23.33.241.97.443: Flags [.], ack 221163, win 65535, length 0
20:23:49.374815 IP 23.33.241.97.443 > 10.0.2.15.34542: Flags [.], seq 221163:222623, ack 819, win 65535, length 1460
20:23:49.374854 IP 10.0.2.15.34542 > 23.33.241.97.443: Flags [.], ack 222623, win 65535, length 0
20:23:49.375023 IP 23.33.241.97.443 > 10.0.2.15.34542: Flags [P.], seq 222623:225285, ack 819, win 65535, length 2662
20:23:49.375060 IP 10.0.2.15.34542 > 23.33.241.97.443: Flags [.], ack 225285, win 65535, length 0
20:23:49.375922 IP 23.33.241.97.443 > 10.0.2.15.34542: Flags [P.], seq 225285:232155, ack 819, win 65535, length 6870
20:23:49.375924 IP 23.33.241.97.443 > 10.0.2.15.34542: Flags [P.], seq 232155:233529, ack 819, win 65535, length 1374
20:23:49.375940 IP 10.0.2.15.34542 > 23.33.241.97.443: Flags [.], ack 232155, win 65535, length 0
20:23:49.375967 IP 10.0.2.15.34542 > 23.33.241.97.443: Flags [.], ack 233529, win 65535, length 0

