19:48:15.027819 IP 10.0.2.15.35099 > 140.233.253.2.53: 50777+ A? www.chase.com. (31)
19:48:15.027863 IP 10.0.2.15.35099 > 140.233.253.2.53: 33371+ AAAA? www.chase.com. (31)
19:48:15.034452 IP 140.233.253.2.53 > 10.0.2.15.35099: 50777 2/0/0 CNAME wwwbcchase.gslb.bankone.com., A 159.53.84.126 (85)
19:48:15.072707 IP 140.233.253.2.53 > 10.0.2.15.35099: 33371 1/0/0 CNAME wwwbcchase.gslb.bankone.com. (69)
19:48:15.073052 IP 10.0.2.15.49294 > 159.53.84.126.443: Flags [S], seq 1616541335, win 64240, options [mss 1460,sackOK,TS val 3577392555 ecr 0,nop,wscale 6], length 0
19:48:15.097857 IP 159.53.84.126.443 > 10.0.2.15.49294: Flags [S.], seq 195392001, ack 1616541336, win 65535, options [mss 1460], length 0
19:48:15.097904 IP 10.0.2.15.49294 > 159.53.84.126.443: Flags [.], ack 1, win 64240, length 0
19:48:15.107330 IP 10.0.2.15.49294 > 159.53.84.126.443: Flags [P.], seq 1:518, ack 1, win 64240, length 517
19:48:15.107639 IP 159.53.84.126.443 > 10.0.2.15.49294: Flags [.], ack 518, win 65535, length 0

