19:43:30.898894 IP 10.0.2.15.34756 > 140.233.253.2.53: 1246+ A? www.chase.com. (31)
19:43:30.898926 IP 10.0.2.15.34756 > 140.233.253.2.53: 59356+ AAAA? www.chase.com. (31)
19:43:30.905604 IP 140.233.253.2.53 > 10.0.2.15.34756: 1246 2/0/0 CNAME wwwbcchase.gslb.bankone.com., A 159.53.84.126 (85)
19:43:30.922103 IP 140.233.253.2.53 > 10.0.2.15.34756: 59356 1/0/0 CNAME wwwbcchase.gslb.bankone.com. (69)
19:43:30.922390 IP 10.0.2.15.49270 > 159.53.84.126.443: Flags [S], seq 2150951763, win 64240, options [mss 1460,sackOK,TS val 3577108404 ecr 0,nop,wscale 6], length 0
19:43:30.965959 IP 159.53.84.126.443 > 10.0.2.15.49270: Flags [S.], seq 188736001, ack 2150951764, win 65535, options [mss 1460], length 0
19:43:30.966017 IP 10.0.2.15.49270 > 159.53.84.126.443: Flags [.], ack 1, win 64240, length 0
19:43:30.982126 IP 10.0.2.15.49270 > 159.53.84.126.443: Flags [P.], seq 1:518, ack 1, win 64240, length 517
19:43:30.982843 IP 159.53.84.126.443 > 10.0.2.15.49270: Flags [.], ack 518, win 65535, length 0

