00:10:57.393879 IP 10.0.2.15.57170 > 140.233.253.2.53: 5263+ A? www.chase.com. (31)
00:10:57.393916 IP 10.0.2.15.57170 > 140.233.253.2.53: 39821+ AAAA? www.chase.com. (31)
00:10:57.398670 IP 140.233.253.2.53 > 10.0.2.15.57170: 5263 2/0/0 CNAME wwwbcchase.gslb.bankone.com., A 159.53.113.168 (85)
00:10:57.415672 IP 140.233.253.2.53 > 10.0.2.15.57170: 39821 1/0/0 CNAME wwwbcchase.gslb.bankone.com. (69)
00:10:57.416315 IP 10.0.2.15.46286 > 159.53.113.168.443: Flags [S], seq 1868850442, win 64240, options [mss 1460,sackOK,TS val 3904693096 ecr 0,nop,wscale 6], length 0
00:10:57.461066 IP 159.53.113.168.443 > 10.0.2.15.46286: Flags [S.], seq 62272001, ack 1868850443, win 65535, options [mss 1460], length 0
00:10:57.461111 IP 10.0.2.15.46286 > 159.53.113.168.443: Flags [.], ack 1, win 64240, length 0

