19:47:42.599600 IP 10.0.2.15.52625 > 140.233.253.2.53: 43419+ A? www.chase.com. (31)
19:47:42.599631 IP 10.0.2.15.52625 > 140.233.253.2.53: 49302+ AAAA? www.chase.com. (31)
19:47:42.607065 IP 140.233.253.2.53 > 10.0.2.15.52625: 43419 2/0/0 CNAME wwwbcchase.gslb.bankone.com., A 159.53.113.168 (85)
19:47:42.628091 IP 140.233.253.2.53 > 10.0.2.15.52625: 49302 1/0/0 CNAME wwwbcchase.gslb.bankone.com. (69)
19:47:42.628378 IP 10.0.2.15.46322 > 159.53.113.168.443: Flags [S], seq 3406437635, win 64240, options [mss 1460,sackOK,TS val 3956448219 ecr 0,nop,wscale 6], length 0
19:47:42.666011 IP 159.53.113.168.443 > 10.0.2.15.46322: Flags [S.], seq 194624001, ack 3406437636, win 65535, options [mss 1460], length 0
19:47:42.666055 IP 10.0.2.15.46322 > 159.53.113.168.443: Flags [.], ack 1, win 64240, length 0
19:47:42.673987 IP 10.0.2.15.46322 > 159.53.113.168.443: Flags [P.], seq 1:518, ack 1, win 64240, length 517
19:47:42.674251 IP 159.53.113.168.443 > 10.0.2.15.46322: Flags [.], ack 518, win 65535, length 0

