00:08:58.096190 IP 10.0.2.15.56617 > 140.233.253.2.53: 57293+ A? www.chase.com. (31)
00:08:58.096233 IP 10.0.2.15.56617 > 140.233.253.2.53: 5832+ AAAA? www.chase.com. (31)
00:08:58.100755 IP 140.233.253.2.53 > 10.0.2.15.56617: 57293 2/0/0 CNAME wwwbcchase.gslb.bankone.com., A 159.53.85.137 (85)
00:08:58.117054 IP 140.233.253.2.53 > 10.0.2.15.56617: 5832 1/0/0 CNAME wwwbcchase.gslb.bankone.com. (69)
00:08:58.117403 IP 10.0.2.15.40780 > 159.53.85.137.443: Flags [S], seq 1149049637, win 64240, options [mss 1460,sackOK,TS val 1980553073 ecr 0,nop,wscale 6], length 0
00:08:58.150790 IP 159.53.85.137.443 > 10.0.2.15.40780: Flags [S.], seq 59648001, ack 1149049638, win 65535, options [mss 1460], length 0
00:08:58.150828 IP 10.0.2.15.40780 > 159.53.85.137.443: Flags [.], ack 1, win 64240, length 0
00:08:58.158180 IP 10.0.2.15.40780 > 159.53.85.137.443: Flags [P.], seq 1:518, ack 1, win 64240, length 517
00:08:58.158798 IP 159.53.85.137.443 > 10.0.2.15.40780: Flags [.], ack 518, win 65535, length 0
00:08:58.197427 IP 159.53.85.137.443 > 10.0.2.15.40780: Flags [.], seq 1:2921, ack 518, win 65535, length 2920
00:08:58.197455 IP 10.0.2.15.40780 > 159.53.85.137.443: Flags [.], ack 2921, win 62780, length 0
00:08:58.197710 IP 159.53.85.137.443 > 10.0.2.15.40780: Flags [P.], seq 2921:4717, ack 518, win 65535, length 1796
00:08:58.197728 IP 10.0.2.15.40780 > 159.53.85.137.443: Flags [.], ack 4717, win 61320, length 0
00:08:58.200518 IP 10.0.2.15.40780 > 159.53.85.137.443: Flags [P.], seq 518:644, ack 4717, win 62780, length 126
00:08:58.201191 IP 159.53.85.137.443 > 10.0.2.15.40780: Flags [.], ack 644, win 65535, length 0

