00:09:21.653341 IP 10.0.2.15.57271 > 140.233.253.2.53: 21234+ A? www.chase.com. (31)
00:09:21.653377 IP 10.0.2.15.57271 > 140.233.253.2.53: 41975+ AAAA? www.chase.com. (31)
00:09:21.660239 IP 140.233.253.2.53 > 10.0.2.15.57271: 21234 2/0/0 CNAME wwwbcchase.gslb.bankone.com., A 159.53.42.11 (85)
00:09:21.672951 IP 140.233.253.2.53 > 10.0.2.15.57271: 41975 1/0/0 CNAME wwwbcchase.gslb.bankone.com. (69)
00:09:21.673190 IP 10.0.2.15.54856 > 159.53.42.11.443: Flags [S], seq 281605637, win 64240, options [mss 1460,sackOK,TS val 388553069 ecr 0,nop,wscale 6], length 0
00:09:21.693392 IP 159.53.42.11.443 > 10.0.2.15.54856: Flags [S.], seq 60224001, ack 281605638, win 65535, options [mss 1460], length 0
00:09:21.693440 IP 10.0.2.15.54856 > 159.53.42.11.443: Flags [.], ack 1, win 64240, length 0

