00:10:01.461746 IP 10.0.2.15.36816 > 140.233.253.2.53: 10823+ A? www.chase.com. (31)
00:10:01.461792 IP 10.0.2.15.36816 > 140.233.253.2.53: 39491+ AAAA? www.chase.com. (31)
00:10:01.504796 IP 140.233.253.2.53 > 10.0.2.15.36816: 10823 2/0/0 CNAME wwwbcchase.gslb.bankone.com., A 159.53.113.168 (85)
00:10:01.516759 IP 140.233.253.2.53 > 10.0.2.15.36816: 39491 1/0/0 CNAME wwwbcchase.gslb.bankone.com. (69)
00:10:01.517236 IP 10.0.2.15.46282 > 159.53.113.168.443: Flags [S], seq 2410907214, win 64240, options [mss 1460,sackOK,TS val 3904637197 ecr 0,nop,wscale 6], length 0
00:10:01.550541 IP 159.53.113.168.443 > 10.0.2.15.46282: Flags [S.], seq 61120001, ack 2410907215, win 65535, options [mss 1460], length 0
00:10:01.550587 IP 10.0.2.15.46282 > 159.53.113.168.443: Flags [.], ack 1, win 64240, length 0
00:10:01.563682 IP 10.0.2.15.46282 > 159.53.113.168.443: Flags [P.], seq 1:518, ack 1, win 64240, length 517
00:10:01.564211 IP 159.53.113.168.443 > 10.0.2.15.46282: Flags [.], ack 518, win 65535, length 0

