19:48:09.545868 IP 10.0.2.15.39175 > 140.233.253.2.53: 52439+ A? www.chase.com. (31)
19:48:09.545899 IP 10.0.2.15.39175 > 140.233.253.2.53: 35547+ AAAA? www.chase.com. (31)
19:48:09.574688 IP 140.233.253.2.53 > 10.0.2.15.39175: 35547 1/0/0 CNAME wwwbcchase.gslb.bankone.com. (69)
19:48:09.574690 IP 140.233.253.2.53 > 10.0.2.15.39175: 52439 2/0/0 CNAME wwwbcchase.gslb.bankone.com., A 159.53.84.126 (85)
19:48:09.575014 IP 10.0.2.15.49292 > 159.53.84.126.443: Flags [S], seq 4036682048, win 64240, options [mss 1460,sackOK,TS val 3577387057 ecr 0,nop,wscale 6], length 0
19:48:09.617302 IP 159.53.84.126.443 > 10.0.2.15.49292: Flags [S.], seq 195264001, ack 4036682049, win 65535, options [mss 1460], length 0
19:48:09.617355 IP 10.0.2.15.49292 > 159.53.84.126.443: Flags [.], ack 1, win 64240, length 0
19:48:09.627191 IP 10.0.2.15.49292 > 159.53.84.126.443: Flags [P.], seq 1:518, ack 1, win 64240, length 517
19:48:09.627509 IP 159.53.84.126.443 > 10.0.2.15.49292: Flags [.], ack 518, win 65535, length 0

