19:43:58.131782 IP 10.0.2.15.56919 > 140.233.253.2.53: 14716+ A? www.chase.com. (31)
19:43:58.131827 IP 10.0.2.15.56919 > 140.233.253.2.53: 11646+ AAAA? www.chase.com. (31)
19:43:58.136493 IP 140.233.253.2.53 > 10.0.2.15.56919: 14716 2/0/0 CNAME wwwbcchase.gslb.bankone.com., A 159.53.85.137 (85)
19:43:58.153882 IP 140.233.253.2.53 > 10.0.2.15.56919: 11646 1/0/0 CNAME wwwbcchase.gslb.bankone.com. (69)
19:43:58.154340 IP 10.0.2.15.40796 > 159.53.85.137.443: Flags [S], seq 2381571524, win 64240, options [mss 1460,sackOK,TS val 2032203021 ecr 0,nop,wscale 6], length 0
19:43:58.179567 IP 159.53.85.137.443 > 10.0.2.15.40796: Flags [S.], seq 189376001, ack 2381571525, win 65535, options [mss 1460], length 0
19:43:58.179613 IP 10.0.2.15.40796 > 159.53.85.137.443: Flags [.], ack 1, win 64240, length 0
19:43:58.188154 IP 10.0.2.15.40796 > 159.53.85.137.443: Flags [P.], seq 1:518, ack 1, win 64240, length 517
19:43:58.188563 IP 159.53.85.137.443 > 10.0.2.15.40796: Flags [.], ack 518, win 65535, length 0
19:43:58.215912 IP 159.53.85.137.443 > 10.0.2.15.40796: Flags [.], seq 1:2921, ack 518, win 65535, length 2920
19:43:58.215938 IP 10.0.2.15.40796 > 159.53.85.137.443: Flags [.], ack 2921, win 62780, length 0
19:43:58.216277 IP 159.53.85.137.443 > 10.0.2.15.40796: Flags [P.], seq 2921:4123, ack 518, win 65535, length 1202
19:43:58.216293 IP 10.0.2.15.40796 > 159.53.85.137.443: Flags [.], ack 4123, win 61578, length 0
19:43:58.216488 IP 159.53.85.137.443 > 10.0.2.15.40796: Flags [P.], seq 4123:4717, ack 518, win 65535, length 594
19:43:58.216496 IP 10.0.2.15.40796 > 159.53.85.137.443: Flags [.], ack 4717, win 61320, length 0

