19:47:53.383378 IP 10.0.2.15.55335 > 140.233.253.2.53: 54947+ A? www.chase.com. (31)
19:47:53.383422 IP 10.0.2.15.55335 > 140.233.253.2.53: 30112+ AAAA? www.chase.com. (31)
19:47:53.389880 IP 140.233.253.2.53 > 10.0.2.15.55335: 54947 2/0/0 CNAME wwwbcchase.gslb.bankone.com., A 159.53.44.60 (85)
19:47:53.421818 IP 140.233.253.2.53 > 10.0.2.15.55335: 30112 1/0/0 CNAME wwwbcchase.gslb.bankone.com. (69)
19:47:53.422147 IP 10.0.2.15.35950 > 159.53.44.60.443: Flags [S], seq 3027468964, win 64240, options [mss 1460,sackOK,TS val 1071365079 ecr 0,nop,wscale 6], length 0
19:47:53.442336 IP 159.53.44.60.443 > 10.0.2.15.35950: Flags [S.], seq 194880001, ack 3027468965, win 65535, options [mss 1460], length 0
19:47:53.442386 IP 10.0.2.15.35950 > 159.53.44.60.443: Flags [.], ack 1, win 64240, length 0
19:47:53.451304 IP 10.0.2.15.35950 > 159.53.44.60.443: Flags [P.], seq 1:518, ack 1, win 64240, length 517
19:47:53.451752 IP 159.53.44.60.443 > 10.0.2.15.35950: Flags [.], ack 518, win 65535, length 0

