19:45:48.427545 IP 10.0.2.15.35033 > 140.233.253.2.53: 54989+ A? www.chase.com. (31)
19:45:48.427586 IP 10.0.2.15.35033 > 140.233.253.2.53: 58575+ AAAA? www.chase.com. (31)
19:45:48.433808 IP 140.233.253.2.53 > 10.0.2.15.35033: 54989 2/0/0 CNAME wwwbcchase.gslb.bankone.com., A 159.53.85.137 (85)
19:45:48.464357 IP 140.233.253.2.53 > 10.0.2.15.35033: 58575 1/0/0 CNAME wwwbcchase.gslb.bankone.com. (69)
19:45:48.464637 IP 10.0.2.15.40812 > 159.53.85.137.443: Flags [S], seq 1890753256, win 64240, options [mss 1460,sackOK,TS val 2032313331 ecr 0,nop,wscale 6], length 0
19:45:48.490034 IP 159.53.85.137.443 > 10.0.2.15.40812: Flags [S.], seq 191936001, ack 1890753257, win 65535, options [mss 1460], length 0
19:45:48.490082 IP 10.0.2.15.40812 > 159.53.85.137.443: Flags [.], ack 1, win 64240, length 0
19:45:48.504729 IP 10.0.2.15.40812 > 159.53.85.137.443: Flags [P.], seq 1:518, ack 1, win 64240, length 517
19:45:48.505177 IP 159.53.85.137.443 > 10.0.2.15.40812: Flags [.], ack 518, win 65535, length 0

