16:28:37.098859 IP 10.0.2.15.44507 > 10.64.0.1.53: 13223+ A? www.cnn.com. (29)
16:28:37.098904 IP 10.0.2.15.44507 > 10.64.0.1.53: 35232+ AAAA? www.cnn.com. (29)
16:28:37.113091 IP 10.64.0.1.53 > 10.0.2.15.44507: 13223 2/4/0 CNAME turner-tls.map.fastly.net., A 199.232.37.67 (156)
16:28:37.113094 IP 10.64.0.1.53 > 10.0.2.15.44507: 35232 2/4/0 CNAME turner-tls.map.fastly.net., AAAA 2a04:4e42:46::323 (168)
16:28:37.116398 IP 10.0.2.15.45754 > 199.232.37.67.443: Flags [S], seq 2735654084, win 64240, options [mss 1460,sackOK,TS val 841895621 ecr 0,nop,wscale 6], length 0
16:28:37.128990 IP 199.232.37.67.443 > 10.0.2.15.45754: Flags [S.], seq 23552001, ack 2735654085, win 65535, options [mss 1460], length 0
16:28:37.129040 IP 10.0.2.15.45754 > 199.232.37.67.443: Flags [.], ack 1, win 64240, length 0
16:28:37.140171 IP 10.0.2.15.45754 > 199.232.37.67.443: Flags [P.], seq 1:518, ack 1, win 64240, length 517
16:28:37.140654 IP 199.232.37.67.443 > 10.0.2.15.45754: Flags [.], ack 518, win 65535, length 0
16:28:37.174545 IP 199.232.37.67.443 > 10.0.2.15.45754: Flags [P.], seq 1:1329, ack 518, win 65535, length 1328
16:28:37.174576 IP 10.0.2.15.45754 > 199.232.37.67.443: Flags [.], ack 1329, win 63744, length 0
16:28:37.174848 IP 199.232.37.67.443 > 10.0.2.15.45754: Flags [P.], seq 1329:2657, ack 518, win 65535, length 1328
16:28:37.174864 IP 10.0.2.15.45754 > 199.232.37.67.443: Flags [.], ack 2657, win 62416, length 0
16:28:37.175230 IP 199.232.37.67.443 > 10.0.2.15.45754: Flags [P.], seq 2657:3985, ack 518, win 65535, length 1328
16:28:37.175248 IP 10.0.2.15.45754 > 199.232.37.67.443: Flags [.], ack 3985, win 62416, length 0
16:28:37.175882 IP 199.232.37.67.443 > 10.0.2.15.45754: Flags [P.], seq 3985:5064, ack 518, win 65535, length 1079
16:28:37.175977 IP 10.0.2.15.45754 > 199.232.37.67.443: Flags [.], ack 5064, win 62416, length 0
16:28:37.177125 IP 10.0.2.15.45754 > 199.232.37.67.443: Flags [P.], seq 518:611, ack 5064, win 63744, length 93
16:28:37.177320 IP 199.232.37.67.443 > 10.0.2.15.45754: Flags [.], ack 611, win 65535, length 0
16:28:37.188644 IP 199.232.37.67.443 > 10.0.2.15.45754: Flags [P.], seq 5064:5115, ack 611, win 65535, length 51
16:28:37.188666 IP 10.0.2.15.45754 > 199.232.37.67.443: Flags [.], ack 5115, win 63744, length 0
16:28:37.189233 IP 10.0.2.15.45754 > 199.232.37.67.443: Flags [P.], seq 611:664, ack 5115, win 63744, length 53
16:28:37.189272 IP 10.0.2.15.45754 > 199.232.37.67.443: Flags [P.], seq 664:720, ack 5115, win 63744, length 56
16:28:37.189507 IP 199.232.37.67.443 > 10.0.2.15.45754: Flags [.], ack 664, win 65535, length 0
16:28:37.189509 IP 199.232.37.67.443 > 10.0.2.15.45754: Flags [.], ack 720, win 65535, length 0
16:28:37.189537 IP 10.0.2.15.45754 > 199.232.37.67.443: Flags [P.], seq 720:829, ack 5115, win 63744, length 109
16:28:37.189845 IP 199.232.37.67.443 > 10.0.2.15.45754: Flags [.], ack 829, win 65535, length 0
16:28:37.200892 IP 199.232.37.67.443 > 10.0.2.15.45754: Flags [P.], seq 5115:5181, ack 829, win 65535, length 66
16:28:37.200916 IP 10.0.2.15.45754 > 199.232.37.67.443: Flags [.], ack 5181, win 63744, length 0
16:28:37.201124 IP 10.0.2.15.45754 > 199.232.37.67.443: Flags [P.], seq 829:867, ack 5181, win 63744, length 38
16:28:37.201351 IP 199.232.37.67.443 > 10.0.2.15.45754: Flags [.], ack 867, win 65535, length 0
16:28:37.202885 IP 199.232.37.67.443 > 10.0.2.15.45754: Flags [P.], seq 5181:6509, ack 867, win 65535, length 1328
16:28:37.203493 IP 199.232.37.67.443 > 10.0.2.15.45754: Flags [P.], seq 6509:10493, ack 867, win 65535, length 3984
16:28:37.203834 IP 199.232.37.67.443 > 10.0.2.15.45754: Flags [P.], seq 10493:14477, ack 867, win 65535, length 3984
16:28:37.203925 IP 10.0.2.15.45754 > 199.232.37.67.443: Flags [.], ack 14477, win 58400, length 0
16:28:37.205385 IP 199.232.37.67.443 > 10.0.2.15.45754: Flags [P.], seq 14477:18461, ack 867, win 65535, length 3984
16:28:37.205388 IP 199.232.37.67.443 > 10.0.2.15.45754: Flags [P.], seq 18461:19789, ack 867, win 65535, length 1328
16:28:37.205554 IP 10.0.2.15.45754 > 199.232.37.67.443: Flags [.], ack 18461, win 61320, length 0
16:28:37.205815 IP 199.232.37.67.443 > 10.0.2.15.45754: Flags [P.], seq 19789:22445, ack 867, win 65535, length 2656
16:28:37.205816 IP 199.232.37.67.443 > 10.0.2.15.45754: Flags [P.], seq 22445:23773, ack 867, win 65535, length 1328
16:28:37.205817 IP 199.232.37.67.443 > 10.0.2.15.45754: Flags [P.], seq 23773:25101, ack 867, win 65535, length 1328
16:28:37.205933 IP 10.0.2.15.45754 > 199.232.37.67.443: Flags [.], ack 25101, win 57104, length 0
16:28:37.206282 IP 199.232.37.67.443 > 10.0.2.15.45754: Flags [P.], seq 25101:27757, ack 867, win 65535, length 2656
16:28:37.206316 IP 10.0.2.15.45754 > 199.232.37.67.443: Flags [.], ack 27757, win 55480, length 0
16:28:37.207274 IP 199.232.37.67.443 > 10.0.2.15.45754: Flags [P.], seq 27757:30413, ack 867, win 65535, length 2656
16:28:37.207289 IP 10.0.2.15.45754 > 199.232.37.67.443: Flags [.], ack 30413, win 62780, length 0
16:28:37.207930 IP 199.232.37.67.443 > 10.0.2.15.45754: Flags [P.], seq 30413:34397, ack 867, win 65535, length 3984
16:28:37.207999 IP 10.0.2.15.45754 > 199.232.37.67.443: Flags [.], ack 34397, win 61320, length 0
16:28:37.209675 IP 199.232.37.67.443 > 10.0.2.15.45754: Flags [P.], seq 34397:38381, ack 867, win 65535, length 3984
16:28:37.209692 IP 10.0.2.15.45754 > 199.232.37.67.443: Flags [.], ack 38381, win 61320, length 0
16:28:37.210026 IP 199.232.37.67.443 > 10.0.2.15.45754: Flags [P.], seq 38381:39709, ack 867, win 65535, length 1328
16:28:37.210030 IP 199.232.37.67.443 > 10.0.2.15.45754: Flags [P.], seq 39709:41037, ack 867, win 65535, length 1328
16:28:37.210148 IP 199.232.37.67.443 > 10.0.2.15.45754: Flags [P.], seq 41037:42365, ack 867, win 65535, length 1328
16:28:37.210198 IP 10.0.2.15.45754 > 199.232.37.67.443: Flags [.], ack 42365, win 58432, length 0
16:28:37.210337 IP 199.232.37.67.443 > 10.0.2.15.45754: Flags [P.], seq 42365:45021, ack 867, win 65535, length 2656
16:28:37.210338 IP 199.232.37.67.443 > 10.0.2.15.45754: Flags [P.], seq 45021:46349, ack 867, win 65535, length 1328
16:28:37.210452 IP 10.0.2.15.45754 > 199.232.37.67.443: Flags [.], ack 46349, win 55480, length 0
16:28:37.210508 IP 199.232.37.67.443 > 10.0.2.15.45754: Flags [P.], seq 46349:47677, ack 867, win 65535, length 1328
16:28:37.211122 IP 199.232.37.67.443 > 10.0.2.15.45754: Flags [P.], seq 47677:49005, ack 867, win 65535, length 1328
16:28:37.211135 IP 10.0.2.15.45754 > 199.232.37.67.443: Flags [.], ack 49005, win 63744, length 0
16:28:37.212132 IP 199.232.37.67.443 > 10.0.2.15.45754: Flags [P.], seq 49005:50333, ack 867, win 65535, length 1328
16:28:37.212874 IP 199.232.37.67.443 > 10.0.2.15.45754: Flags [P.], seq 50333:51661, ack 867, win 65535, length 1328
16:28:37.212892 IP 10.0.2.15.45754 > 199.232.37.67.443: Flags [.], ack 51661, win 63744, length 0
16:28:37.213220 IP 199.232.37.67.443 > 10.0.2.15.45754: Flags [P.], seq 51661:52989, ack 867, win 65535, length 1328
16:28:37.213967 IP 199.232.37.67.443 > 10.0.2.15.45754: Flags [P.], seq 52989:54317, ack 867, win 65535, length 1328
16:28:37.213982 IP 10.0.2.15.45754 > 199.232.37.67.443: Flags [.], ack 54317, win 63744, length 0
16:28:37.214891 IP 199.232.37.67.443 > 10.0.2.15.45754: Flags [P.], seq 54317:56973, ack 867, win 65535, length 2656
16:28:37.215229 IP 10.0.2.15.45754 > 199.232.37.67.443: Flags [.], ack 56973, win 62780, length 0
16:28:37.215264 IP 199.232.37.67.443 > 10.0.2.15.45754: Flags [P.], seq 56973:58301, ack 867, win 65535, length 1328
16:28:37.216112 IP 199.232.37.67.443 > 10.0.2.15.45754: Flags [P.], seq 58301:59629, ack 867, win 65535, length 1328
16:28:37.216132 IP 10.0.2.15.45754 > 199.232.37.67.443: Flags [.], ack 59629, win 62780, length 0
16:28:37.217661 IP 199.232.37.67.443 > 10.0.2.15.45754: Flags [P.], seq 59629:60957, ack 867, win 65535, length 1328
16:28:37.218540 IP 199.232.37.67.443 > 10.0.2.15.45754: Flags [P.], seq 60957:62285, ack 867, win 65535, length 1328
16:28:37.218562 IP 10.0.2.15.45754 > 199.232.37.67.443: Flags [.], ack 62285, win 62780, length 0
16:28:37.218980 IP 199.232.37.67.443 > 10.0.2.15.45754: Flags [P.], seq 62285:64941, ack 867, win 65535, length 2656
16:28:37.218983 IP 199.232.37.67.443 > 10.0.2.15.45754: Flags [P.], seq 64941:66269, ack 867, win 65535, length 1328
16:28:37.218983 IP 199.232.37.67.443 > 10.0.2.15.45754: Flags [P.], seq 66269:67597, ack 867, win 65535, length 1328
16:28:37.219277 IP 10.0.2.15.45754 > 199.232.37.67.443: Flags [.], ack 67597, win 62780, length 0
16:28:37.219427 IP 199.232.37.67.443 > 10.0.2.15.45754: Flags [P.], seq 67597:68925, ack 867, win 65535, length 1328
16:28:37.220538 IP 199.232.37.67.443 > 10.0.2.15.45754: Flags [P.], seq 68925:72909, ack 867, win 65535, length 3984
16:28:37.220596 IP 10.0.2.15.45754 > 199.232.37.67.443: Flags [.], ack 72909, win 65535, length 0
16:28:37.221526 IP 199.232.37.67.443 > 10.0.2.15.45754: Flags [P.], seq 72909:74237, ack 867, win 65535, length 1328
16:28:37.221528 IP 199.232.37.67.443 > 10.0.2.15.45754: Flags [P.], seq 74237:75565, ack 867, win 65535, length 1328
16:28:37.221559 IP 10.0.2.15.45754 > 199.232.37.67.443: Flags [.], ack 75565, win 65535, length 0
16:28:37.221761 IP 199.232.37.67.443 > 10.0.2.15.45754: Flags [P.], seq 75565:78221, ack 867, win 65535, length 2656
16:28:37.221812 IP 10.0.2.15.45754 > 199.232.37.67.443: Flags [.], ack 78221, win 65535, length 0
16:28:37.221965 IP 199.232.37.67.443 > 10.0.2.15.45754: Flags [P.], seq 78221:79549, ack 867, win 65535, length 1328
16:28:37.221966 IP 199.232.37.67.443 > 10.0.2.15.45754: Flags [P.], seq 79549:80877, ack 867, win 65535, length 1328
16:28:37.221980 IP 10.0.2.15.45754 > 199.232.37.67.443: Flags [.], ack 80877, win 65535, length 0
16:28:37.222307 IP 199.232.37.67.443 > 10.0.2.15.45754: Flags [P.], seq 80877:83533, ack 867, win 65535, length 2656
16:28:37.222318 IP 10.0.2.15.45754 > 199.232.37.67.443: Flags [.], ack 83533, win 65535, length 0
16:28:37.222437 IP 199.232.37.67.443 > 10.0.2.15.45754: Flags [P.], seq 83533:84861, ack 867, win 65535, length 1328
16:28:37.224038 IP 199.232.37.67.443 > 10.0.2.15.45754: Flags [P.], seq 84861:86189, ack 867, win 65535, length 1328
16:28:37.224062 IP 10.0.2.15.45754 > 199.232.37.67.443: Flags [.], ack 86189, win 65535, length 0
16:28:37.224264 IP 199.232.37.67.443 > 10.0.2.15.45754: Flags [P.], seq 86189:87517, ack 867, win 65535, length 1328
16:28:37.224266 IP 199.232.37.67.443 > 10.0.2.15.45754: Flags [P.], seq 87517:88845, ack 867, win 65535, length 1328
16:28:37.224267 IP 199.232.37.67.443 > 10.0.2.15.45754: Flags [P.], seq 88845:90173, ack 867, win 65535, length 1328
16:28:37.224289 IP 10.0.2.15.45754 > 199.232.37.67.443: Flags [.], ack 88845, win 65535, length 0
16:28:37.224761 IP 199.232.37.67.443 > 10.0.2.15.45754: Flags [P.], seq 90173:92829, ack 867, win 65535, length 2656
16:28:37.224834 IP 10.0.2.15.45754 > 199.232.37.67.443: Flags [.], ack 92829, win 65535, length 0
16:28:37.226344 IP 199.232.37.67.443 > 10.0.2.15.45754: Flags [P.], seq 92829:95485, ack 867, win 65535, length 2656
16:28:37.226364 IP 10.0.2.15.45754 > 199.232.37.67.443: Flags [.], ack 95485, win 65535, length 0
16:28:37.227213 IP 199.232.37.67.443 > 10.0.2.15.45754: Flags [P.], seq 95485:96813, ack 867, win 65535, length 1328
16:28:37.227216 IP 199.232.37.67.443 > 10.0.2.15.45754: Flags [P.], seq 96813:98141, ack 867, win 65535, length 1328
16:28:37.227217 IP 199.232.37.67.443 > 10.0.2.15.45754: Flags [P.], seq 98141:100797, ack 867, win 65535, length 2656
16:28:37.227261 IP 10.0.2.15.45754 > 199.232.37.67.443: Flags [.], ack 98141, win 65535, length 0
16:28:37.227439 IP 10.0.2.15.45754 > 199.232.37.67.443: Flags [.], ack 100797, win 65535, length 0
16:28:37.227738 IP 199.232.37.67.443 > 10.0.2.15.45754: Flags [P.], seq 100797:102125, ack 867, win 65535, length 1328
16:28:37.227741 IP 199.232.37.67.443 > 10.0.2.15.45754: Flags [P.], seq 102125:104781, ack 867, win 65535, length 2656
16:28:37.227760 IP 10.0.2.15.45754 > 199.232.37.67.443: Flags [.], ack 104781, win 65535, length 0
16:28:37.227950 IP 199.232.37.67.443 > 10.0.2.15.45754: Flags [P.], seq 104781:107437, ack 867, win 65535, length 2656
16:28:37.227951 IP 199.232.37.67.443 > 10.0.2.15.45754: Flags [P.], seq 107437:108765, ack 867, win 65535, length 1328
16:28:37.227963 IP 10.0.2.15.45754 > 199.232.37.67.443: Flags [.], ack 107437, win 65535, length 0
16:28:37.228232 IP 199.232.37.67.443 > 10.0.2.15.45754: Flags [P.], seq 108765:110093, ack 867, win 65535, length 1328
16:28:37.228233 IP 199.232.37.67.443 > 10.0.2.15.45754: Flags [P.], seq 110093:111421, ack 867, win 65535, length 1328
16:28:37.228253 IP 10.0.2.15.45754 > 199.232.37.67.443: Flags [.], ack 110093, win 65535, length 0
16:28:37.228375 IP 199.232.37.67.443 > 10.0.2.15.45754: Flags [P.], seq 111421:112749, ack 867, win 65535, length 1328
16:28:37.228386 IP 10.0.2.15.45754 > 199.232.37.67.443: Flags [.], ack 112749, win 65535, length 0
16:28:37.228524 IP 199.232.37.67.443 > 10.0.2.15.45754: Flags [P.], seq 112749:114077, ack 867, win 65535, length 1328
16:28:37.228525 IP 199.232.37.67.443 > 10.0.2.15.45754: Flags [P.], seq 114077:115405, ack 867, win 65535, length 1328
16:28:37.228539 IP 10.0.2.15.45754 > 199.232.37.67.443: Flags [.], ack 115405, win 65535, length 0
16:28:37.228717 IP 199.232.37.67.443 > 10.0.2.15.45754: Flags [P.], seq 115405:119389, ack 867, win 65535, length 3984
16:28:37.228738 IP 10.0.2.15.45754 > 199.232.37.67.443: Flags [.], ack 119389, win 65535, length 0
16:28:37.229373 IP 199.232.37.67.443 > 10.0.2.15.45754: Flags [P.], seq 119389:120717, ack 867, win 65535, length 1328
16:28:37.229375 IP 199.232.37.67.443 > 10.0.2.15.45754: Flags [P.], seq 120717:123373, ack 867, win 65535, length 2656
16:28:37.229376 IP 199.232.37.67.443 > 10.0.2.15.45754: Flags [P.], seq 123373:126029, ack 867, win 65535, length 2656
16:28:37.229408 IP 10.0.2.15.45754 > 199.232.37.67.443: Flags [.], ack 123373, win 65535, length 0
16:28:37.229433 IP 10.0.2.15.45754 > 199.232.37.67.443: Flags [.], ack 126029, win 65535, length 0
16:28:37.230072 IP 199.232.37.67.443 > 10.0.2.15.45754: Flags [P.], seq 126029:127357, ack 867, win 65535, length 1328
16:28:37.230074 IP 199.232.37.67.443 > 10.0.2.15.45754: Flags [P.], seq 127357:128685, ack 867, win 65535, length 1328
16:28:37.230074 IP 199.232.37.67.443 > 10.0.2.15.45754: Flags [P.], seq 128685:130013, ack 867, win 65535, length 1328
16:28:37.230098 IP 10.0.2.15.45754 > 199.232.37.67.443: Flags [.], ack 128685, win 65535, length 0
16:28:37.230292 IP 199.232.37.67.443 > 10.0.2.15.45754: Flags [P.], seq 130013:131341, ack 867, win 65535, length 1328
16:28:37.230304 IP 10.0.2.15.45754 > 199.232.37.67.443: Flags [.], ack 131341, win 65535, length 0
16:28:37.230477 IP 199.232.37.67.443 > 10.0.2.15.45754: Flags [P.], seq 131341:133997, ack 867, win 65535, length 2656
16:28:37.230489 IP 10.0.2.15.45754 > 199.232.37.67.443: Flags [.], ack 133997, win 65535, length 0
16:28:37.230651 IP 199.232.37.67.443 > 10.0.2.15.45754: Flags [P.], seq 133997:135325, ack 867, win 65535, length 1328
16:28:37.230653 IP 199.232.37.67.443 > 10.0.2.15.45754: Flags [P.], seq 135325:136653, ack 867, win 65535, length 1328
16:28:37.230803 IP 10.0.2.15.45754 > 199.232.37.67.443: Flags [.], ack 136653, win 65535, length 0
16:28:37.231020 IP 199.232.37.67.443 > 10.0.2.15.45754: Flags [P.], seq 136653:137981, ack 867, win 65535, length 1328
16:28:37.231025 IP 199.232.37.67.443 > 10.0.2.15.45754: Flags [P.], seq 137981:139309, ack 867, win 65535, length 1328
16:28:37.231025 IP 199.232.37.67.443 > 10.0.2.15.45754: Flags [P.], seq 139309:140637, ack 867, win 65535, length 1328
16:28:37.231045 IP 10.0.2.15.45754 > 199.232.37.67.443: Flags [.], ack 139309, win 65535, length 0
16:28:37.231194 IP 199.232.37.67.443 > 10.0.2.15.45754: Flags [P.], seq 140637:143293, ack 867, win 65535, length 2656
16:28:37.231195 IP 199.232.37.67.443 > 10.0.2.15.45754: Flags [P.], seq 143293:144621, ack 867, win 65535, length 1328
16:28:37.231215 IP 10.0.2.15.45754 > 199.232.37.67.443: Flags [.], ack 143293, win 65535, length 0
16:28:37.231437 IP 199.232.37.67.443 > 10.0.2.15.45754: Flags [P.], seq 144621:145949, ack 867, win 65535, length 1328
16:28:37.231453 IP 10.0.2.15.45754 > 199.232.37.67.443: Flags [.], ack 145949, win 65535, length 0
16:28:37.232286 IP 199.232.37.67.443 > 10.0.2.15.45754: Flags [P.], seq 145949:147277, ack 867, win 65535, length 1328
16:28:37.232819 IP 199.232.37.67.443 > 10.0.2.15.45754: Flags [P.], seq 147277:148605, ack 867, win 65535, length 1328
16:28:37.232835 IP 10.0.2.15.45754 > 199.232.37.67.443: Flags [.], ack 148605, win 65535, length 0
16:28:37.233339 IP 199.232.37.67.443 > 10.0.2.15.45754: Flags [P.], seq 148605:151261, ack 867, win 65535, length 2656
16:28:37.233355 IP 10.0.2.15.45754 > 199.232.37.67.443: Flags [.], ack 151261, win 65535, length 0
16:28:37.233697 IP 199.232.37.67.443 > 10.0.2.15.45754: Flags [P.], seq 151261:152589, ack 867, win 65535, length 1328
16:28:37.234798 IP 199.232.37.67.443 > 10.0.2.15.45754: Flags [P.], seq 152589:153917, ack 867, win 65535, length 1328
16:28:37.234820 IP 10.0.2.15.45754 > 199.232.37.67.443: Flags [.], ack 153917, win 65535, length 0
16:28:37.235176 IP 199.232.37.67.443 > 10.0.2.15.45754: Flags [P.], seq 153917:160557, ack 867, win 65535, length 6640
16:28:37.235193 IP 10.0.2.15.45754 > 199.232.37.67.443: Flags [.], ack 160557, win 65535, length 0
16:28:37.235324 IP 199.232.37.67.443 > 10.0.2.15.45754: Flags [P.], seq 160557:163213, ack 867, win 65535, length 2656
16:28:37.235325 IP 199.232.37.67.443 > 10.0.2.15.45754: Flags [P.], seq 163213:164541, ack 867, win 65535, length 1328
16:28:37.235339 IP 10.0.2.15.45754 > 199.232.37.67.443: Flags [.], ack 163213, win 65535, length 0
16:28:37.235845 IP 199.232.37.67.443 > 10.0.2.15.45754: Flags [P.], seq 164541:165869, ack 867, win 65535, length 1328
16:28:37.235848 IP 199.232.37.67.443 > 10.0.2.15.45754: Flags [P.], seq 165869:167197, ack 867, win 65535, length 1328
16:28:37.235849 IP 199.232.37.67.443 > 10.0.2.15.45754: Flags [P.], seq 167197:168525, ack 867, win 65535, length 1328
16:28:37.235901 IP 10.0.2.15.45754 > 199.232.37.67.443: Flags [.], ack 165869, win 65535, length 0
16:28:37.235946 IP 10.0.2.15.45754 > 199.232.37.67.443: Flags [.], ack 168525, win 65535, length 0
16:28:37.236038 IP 199.232.37.67.443 > 10.0.2.15.45754: Flags [P.], seq 168525:169853, ack 867, win 65535, length 1328
16:28:37.239048 IP 199.232.37.67.443 > 10.0.2.15.45754: Flags [P.], seq 169853:172509, ack 867, win 65535, length 2656
16:28:37.239053 IP 199.232.37.67.443 > 10.0.2.15.45754: Flags [P.], seq 172509:179149, ack 867, win 65535, length 6640
16:28:37.239299 IP 10.0.2.15.45754 > 199.232.37.67.443: Flags [.], ack 172509, win 65535, length 0
16:28:37.239418 IP 10.0.2.15.45754 > 199.232.37.67.443: Flags [.], ack 179149, win 65535, length 0
16:28:37.239843 IP 199.232.37.67.443 > 10.0.2.15.45754: Flags [P.], seq 179149:183133, ack 867, win 65535, length 3984
16:28:37.239845 IP 199.232.37.67.443 > 10.0.2.15.45754: Flags [P.], seq 183133:184461, ack 867, win 65535, length 1328
16:28:37.239869 IP 10.0.2.15.45754 > 199.232.37.67.443: Flags [.], ack 183133, win 65535, length 0
16:28:37.240017 IP 199.232.37.67.443 > 10.0.2.15.45754: Flags [P.], seq 184461:185789, ack 867, win 65535, length 1328
16:28:37.240018 IP 199.232.37.67.443 > 10.0.2.15.45754: Flags [P.], seq 185789:187117, ack 867, win 65535, length 1328
16:28:37.240030 IP 10.0.2.15.45754 > 199.232.37.67.443: Flags [.], ack 185789, win 65535, length 0
16:28:37.240330 IP 199.232.37.67.443 > 10.0.2.15.45754: Flags [P.], seq 187117:189773, ack 867, win 65535, length 2656
16:28:37.240333 IP 199.232.37.67.443 > 10.0.2.15.45754: Flags [P.], seq 189773:191101, ack 867, win 65535, length 1328
16:28:37.240351 IP 10.0.2.15.45754 > 199.232.37.67.443: Flags [.], ack 189773, win 65535, length 0
16:28:37.240714 IP 199.232.37.67.443 > 10.0.2.15.45754: Flags [P.], seq 191101:192429, ack 867, win 65535, length 1328
16:28:37.240717 IP 199.232.37.67.443 > 10.0.2.15.45754: Flags [P.], seq 192429:193757, ack 867, win 65535, length 1328
16:28:37.240717 IP 199.232.37.67.443 > 10.0.2.15.45754: Flags [P.], seq 193757:195085, ack 867, win 65535, length 1328
16:28:37.240737 IP 10.0.2.15.45754 > 199.232.37.67.443: Flags [.], ack 192429, win 65535, length 0
16:28:37.240840 IP 10.0.2.15.45754 > 199.232.37.67.443: Flags [.], ack 195085, win 65535, length 0
16:28:37.241123 IP 199.232.37.67.443 > 10.0.2.15.45754: Flags [P.], seq 195085:200397, ack 867, win 65535, length 5312
16:28:37.241125 IP 199.232.37.67.443 > 10.0.2.15.45754: Flags [P.], seq 200397:201725, ack 867, win 65535, length 1328
16:28:37.241141 IP 10.0.2.15.45754 > 199.232.37.67.443: Flags [.], ack 200397, win 65535, length 0
16:28:37.241808 IP 199.232.37.67.443 > 10.0.2.15.45754: Flags [P.], seq 201725:203053, ack 867, win 65535, length 1328
16:28:37.241823 IP 10.0.2.15.45754 > 199.232.37.67.443: Flags [.], ack 203053, win 65535, length 0
16:28:37.244467 IP 199.232.37.67.443 > 10.0.2.15.45754: Flags [P.], seq 203053:204381, ack 867, win 65535, length 1328
16:28:37.244801 IP 199.232.37.67.443 > 10.0.2.15.45754: Flags [P.], seq 204381:207037, ack 867, win 65535, length 2656
16:28:37.244804 IP 199.232.37.67.443 > 10.0.2.15.45754: Flags [P.], seq 207037:208365, ack 867, win 65535, length 1328
16:28:37.244829 IP 10.0.2.15.45754 > 199.232.37.67.443: Flags [.], ack 207037, win 65535, length 0
16:28:37.245082 IP 199.232.37.67.443 > 10.0.2.15.45754: Flags [P.], seq 208365:209693, ack 867, win 65535, length 1328
16:28:37.245134 IP 10.0.2.15.45754 > 199.232.37.67.443: Flags [.], ack 209693, win 65535, length 0
16:28:37.245433 IP 199.232.37.67.443 > 10.0.2.15.45754: Flags [P.], seq 209693:211021, ack 867, win 65535, length 1328
16:28:37.246201 IP 199.232.37.67.443 > 10.0.2.15.45754: Flags [P.], seq 211021:212349, ack 867, win 65535, length 1328
16:28:37.246224 IP 10.0.2.15.45754 > 199.232.37.67.443: Flags [.], ack 212349, win 65535, length 0
16:28:37.246603 IP 199.232.37.67.443 > 10.0.2.15.45754: Flags [P.], seq 212349:216333, ack 867, win 65535, length 3984
16:28:37.246619 IP 10.0.2.15.45754 > 199.232.37.67.443: Flags [.], ack 216333, win 65535, length 0
16:28:37.246813 IP 199.232.37.67.443 > 10.0.2.15.45754: Flags [P.], seq 216333:217661, ack 867, win 65535, length 1328
16:28:37.246815 IP 199.232.37.67.443 > 10.0.2.15.45754: Flags [P.], seq 217661:220317, ack 867, win 65535, length 2656
16:28:37.246832 IP 10.0.2.15.45754 > 199.232.37.67.443: Flags [.], ack 220317, win 65535, length 0
16:28:37.246930 IP 199.232.37.67.443 > 10.0.2.15.45754: Flags [P.], seq 220317:221645, ack 867, win 65535, length 1328
16:28:37.246932 IP 199.232.37.67.443 > 10.0.2.15.45754: Flags [P.], seq 221645:225629, ack 867, win 65535, length 3984
16:28:37.246933 IP 199.232.37.67.443 > 10.0.2.15.45754: Flags [P.], seq 225629:226957, ack 867, win 65535, length 1328
16:28:37.246944 IP 10.0.2.15.45754 > 199.232.37.67.443: Flags [.], ack 225629, win 65535, length 0
16:28:37.248047 IP 199.232.37.67.443 > 10.0.2.15.45754: Flags [P.], seq 226957:229613, ack 867, win 65535, length 2656
16:28:37.248063 IP 199.232.37.67.443 > 10.0.2.15.45754: Flags [P.], seq 229613:233597, ack 867, win 65535, length 3984
16:28:37.248223 IP 10.0.2.15.45754 > 199.232.37.67.443: Flags [.], ack 229613, win 65535, length 0
16:28:37.248263 IP 10.0.2.15.45754 > 199.232.37.67.443: Flags [.], ack 233597, win 65535, length 0
16:28:37.250192 IP 199.232.37.67.443 > 10.0.2.15.45754: Flags [P.], seq 233597:234925, ack 867, win 65535, length 1328
16:28:37.250194 IP 199.232.37.67.443 > 10.0.2.15.45754: Flags [P.], seq 234925:237581, ack 867, win 65535, length 2656
16:28:37.250195 IP 199.232.37.67.443 > 10.0.2.15.45754: Flags [P.], seq 237581:240237, ack 867, win 65535, length 2656
16:28:37.250195 IP 199.232.37.67.443 > 10.0.2.15.45754: Flags [P.], seq 240237:241565, ack 867, win 65535, length 1328
16:28:37.250196 IP 199.232.37.67.443 > 10.0.2.15.45754: Flags [P.], seq 241565:242893, ack 867, win 65535, length 1328
16:28:37.250197 IP 199.232.37.67.443 > 10.0.2.15.45754: Flags [P.], seq 242893:246877, ack 867, win 65535, length 3984
16:28:37.250223 IP 10.0.2.15.45754 > 199.232.37.67.443: Flags [.], ack 237581, win 65535, length 0
16:28:37.250291 IP 10.0.2.15.45754 > 199.232.37.67.443: Flags [.], ack 240237, win 65535, length 0
16:28:37.250314 IP 10.0.2.15.45754 > 199.232.37.67.443: Flags [.], ack 242893, win 65535, length 0
16:28:37.250328 IP 10.0.2.15.45754 > 199.232.37.67.443: Flags [.], ack 246877, win 65535, length 0
16:28:37.250347 IP 199.232.37.67.443 > 10.0.2.15.45754: Flags [P.], seq 246877:248205, ack 867, win 65535, length 1328
16:28:37.251569 IP 199.232.37.67.443 > 10.0.2.15.45754: Flags [P.], seq 248205:254845, ack 867, win 65535, length 6640
16:28:37.251572 IP 199.232.37.67.443 > 10.0.2.15.45754: Flags [P.], seq 254845:256173, ack 867, win 65535, length 1328
16:28:37.251574 IP 199.232.37.67.443 > 10.0.2.15.45754: Flags [P.], seq 256173:257501, ack 867, win 65535, length 1328
16:28:37.251574 IP 199.232.37.67.443 > 10.0.2.15.45754: Flags [P.], seq 257501:258829, ack 867, win 65535, length 1328
16:28:37.251597 IP 199.232.37.67.443 > 10.0.2.15.45754: Flags [P.], seq 258829:260157, ack 867, win 65535, length 1328
16:28:37.251599 IP 199.232.37.67.443 > 10.0.2.15.45754: Flags [P.], seq 260157:269453, ack 867, win 65535, length 9296
16:28:37.251663 IP 10.0.2.15.45754 > 199.232.37.67.443: Flags [.], ack 269453, win 65535, length 0
16:28:37.251814 IP 199.232.37.67.443 > 10.0.2.15.45754: Flags [P.], seq 269453:272109, ack 867, win 65535, length 2656
16:28:37.251828 IP 10.0.2.15.45754 > 199.232.37.67.443: Flags [.], ack 272109, win 65535, length 0
16:28:37.252039 IP 199.232.37.67.443 > 10.0.2.15.45754: Flags [P.], seq 272109:274765, ack 867, win 65535, length 2656
16:28:37.252050 IP 10.0.2.15.45754 > 199.232.37.67.443: Flags [.], ack 274765, win 65535, length 0
16:28:37.252697 IP 199.232.37.67.443 > 10.0.2.15.45754: Flags [P.], seq 274765:276093, ack 867, win 65535, length 1328
16:28:37.252699 IP 199.232.37.67.443 > 10.0.2.15.45754: Flags [P.], seq 276093:278749, ack 867, win 65535, length 2656
16:28:37.252723 IP 10.0.2.15.45754 > 199.232.37.67.443: Flags [.], ack 278749, win 65535, length 0
16:28:37.253091 IP 199.232.37.67.443 > 10.0.2.15.45754: Flags [P.], seq 278749:280077, ack 867, win 65535, length 1328
16:28:37.253094 IP 199.232.37.67.443 > 10.0.2.15.45754: Flags [P.], seq 280077:282733, ack 867, win 65535, length 2656
16:28:37.253095 IP 199.232.37.67.443 > 10.0.2.15.45754: Flags [P.], seq 282733:286717, ack 867, win 65535, length 3984
16:28:37.253115 IP 10.0.2.15.45754 > 199.232.37.67.443: Flags [.], ack 282733, win 65535, length 0
16:28:37.253137 IP 10.0.2.15.45754 > 199.232.37.67.443: Flags [.], ack 286717, win 65535, length 0
16:28:37.253447 IP 199.232.37.67.443 > 10.0.2.15.45754: Flags [P.], seq 286717:292029, ack 867, win 65535, length 5312
16:28:37.253448 IP 199.232.37.67.443 > 10.0.2.15.45754: Flags [P.], seq 292029:293357, ack 867, win 65535, length 1328
16:28:37.253465 IP 10.0.2.15.45754 > 199.232.37.67.443: Flags [.], ack 292029, win 65535, length 0
16:28:37.254084 IP 199.232.37.67.443 > 10.0.2.15.45754: Flags [P.], seq 293357:296013, ack 867, win 65535, length 2656
16:28:37.254086 IP 199.232.37.67.443 > 10.0.2.15.45754: Flags [P.], seq 296013:299997, ack 867, win 65535, length 3984
16:28:37.254088 IP 199.232.37.67.443 > 10.0.2.15.45754: Flags [P.], seq 299997:302653, ack 867, win 65535, length 2656
16:28:37.254109 IP 10.0.2.15.45754 > 199.232.37.67.443: Flags [.], ack 296013, win 65535, length 0
16:28:37.254134 IP 10.0.2.15.45754 > 199.232.37.67.443: Flags [.], ack 299997, win 65535, length 0
16:28:37.254146 IP 10.0.2.15.45754 > 199.232.37.67.443: Flags [.], ack 302653, win 65535, length 0
16:28:37.254347 IP 199.232.37.67.443 > 10.0.2.15.45754: Flags [P.], seq 302653:303981, ack 867, win 65535, length 1328
16:28:37.254392 IP 199.232.37.67.443 > 10.0.2.15.45754: Flags [P.], seq 303981:305309, ack 867, win 65535, length 1328
16:28:37.254393 IP 199.232.37.67.443 > 10.0.2.15.45754: Flags [P.], seq 305309:306637, ack 867, win 65535, length 1328
16:28:37.254410 IP 10.0.2.15.45754 > 199.232.37.67.443: Flags [.], ack 305309, win 65535, length 0
16:28:37.254628 IP 199.232.37.67.443 > 10.0.2.15.45754: Flags [P.], seq 306637:307965, ack 867, win 65535, length 1328
16:28:37.254631 IP 199.232.37.67.443 > 10.0.2.15.45754: Flags [P.], seq 307965:309293, ack 867, win 65535, length 1328
16:28:37.254631 IP 199.232.37.67.443 > 10.0.2.15.45754: Flags [P.], seq 309293:310621, ack 867, win 65535, length 1328
16:28:37.254648 IP 10.0.2.15.45754 > 199.232.37.67.443: Flags [.], ack 307965, win 65535, length 0
16:28:37.254669 IP 10.0.2.15.45754 > 199.232.37.67.443: Flags [.], ack 310621, win 65535, length 0
16:28:37.254790 IP 199.232.37.67.443 > 10.0.2.15.45754: Flags [P.], seq 310621:311949, ack 867, win 65535, length 1328
16:28:37.254836 IP 199.232.37.67.443 > 10.0.2.15.45754: Flags [P.], seq 311949:313277, ack 867, win 65535, length 1328
16:28:37.254844 IP 10.0.2.15.45754 > 199.232.37.67.443: Flags [.], ack 313277, win 65535, length 0
16:28:37.255097 IP 199.232.37.67.443 > 10.0.2.15.45754: Flags [P.], seq 313277:314605, ack 867, win 65535, length 1328
16:28:37.255937 IP 199.232.37.67.443 > 10.0.2.15.45754: Flags [P.], seq 314605:318589, ack 867, win 65535, length 3984
16:28:37.255960 IP 10.0.2.15.45754 > 199.232.37.67.443: Flags [.], ack 318589, win 65535, length 0
16:28:37.256120 IP 199.232.37.67.443 > 10.0.2.15.45754: Flags [P.], seq 318589:319917, ack 867, win 65535, length 1328
16:28:37.256122 IP 199.232.37.67.443 > 10.0.2.15.45754: Flags [P.], seq 319917:323901, ack 867, win 65535, length 3984
16:28:37.256143 IP 10.0.2.15.45754 > 199.232.37.67.443: Flags [.], ack 323901, win 65535, length 0
16:28:37.256346 IP 199.232.37.67.443 > 10.0.2.15.45754: Flags [P.], seq 323901:325229, ack 867, win 65535, length 1328
16:28:37.256511 IP 199.232.37.67.443 > 10.0.2.15.45754: Flags [P.], seq 325229:327885, ack 867, win 65535, length 2656
16:28:37.256512 IP 199.232.37.67.443 > 10.0.2.15.45754: Flags [P.], seq 327885:329213, ack 867, win 65535, length 1328
16:28:37.256529 IP 10.0.2.15.45754 > 199.232.37.67.443: Flags [.], ack 327885, win 65535, length 0
16:28:37.256842 IP 199.232.37.67.443 > 10.0.2.15.45754: Flags [P.], seq 329213:330541, ack 867, win 65535, length 1328
16:28:37.256845 IP 199.232.37.67.443 > 10.0.2.15.45754: Flags [P.], seq 330541:331869, ack 867, win 65535, length 1328
16:28:37.256862 IP 10.0.2.15.45754 > 199.232.37.67.443: Flags [.], ack 330541, win 65535, length 0
16:28:37.256991 IP 199.232.37.67.443 > 10.0.2.15.45754: Flags [P.], seq 331869:335853, ack 867, win 65535, length 3984
16:28:37.257003 IP 10.0.2.15.45754 > 199.232.37.67.443: Flags [.], ack 335853, win 65535, length 0
16:28:37.257226 IP 199.232.37.67.443 > 10.0.2.15.45754: Flags [P.], seq 335853:339837, ack 867, win 65535, length 3984
16:28:37.257294 IP 10.0.2.15.45754 > 199.232.37.67.443: Flags [.], ack 339837, win 65535, length 0
16:28:37.257705 IP 199.232.37.67.443 > 10.0.2.15.45754: Flags [P.], seq 339837:345149, ack 867, win 65535, length 5312
16:28:37.257708 IP 199.232.37.67.443 > 10.0.2.15.45754: Flags [P.], seq 345149:347805, ack 867, win 65535, length 2656
16:28:37.257725 IP 10.0.2.15.45754 > 199.232.37.67.443: Flags [.], ack 345149, win 65535, length 0
16:28:37.257746 IP 10.0.2.15.45754 > 199.232.37.67.443: Flags [.], ack 347805, win 65535, length 0
16:28:37.257943 IP 199.232.37.67.443 > 10.0.2.15.45754: Flags [P.], seq 347805:351789, ack 867, win 65535, length 3984
16:28:37.257955 IP 10.0.2.15.45754 > 199.232.37.67.443: Flags [.], ack 351789, win 65535, length 0
16:28:37.258378 IP 199.232.37.67.443 > 10.0.2.15.45754: Flags [P.], seq 351789:354445, ack 867, win 65535, length 2656
16:28:37.258379 IP 199.232.37.67.443 > 10.0.2.15.45754: Flags [P.], seq 354445:355773, ack 867, win 65535, length 1328
16:28:37.258380 IP 199.232.37.67.443 > 10.0.2.15.45754: Flags [P.], seq 355773:358429, ack 867, win 65535, length 2656
16:28:37.258381 IP 199.232.37.67.443 > 10.0.2.15.45754: Flags [P.], seq 358429:359757, ack 867, win 65535, length 1328
16:28:37.258395 IP 10.0.2.15.45754 > 199.232.37.67.443: Flags [.], ack 354445, win 65535, length 0
16:28:37.258421 IP 10.0.2.15.45754 > 199.232.37.67.443: Flags [.], ack 358429, win 65535, length 0
16:28:37.260903 IP 199.232.37.67.443 > 10.0.2.15.45754: Flags [P.], seq 359757:362413, ack 867, win 65535, length 2656
16:28:37.260907 IP 199.232.37.67.443 > 10.0.2.15.45754: Flags [P.], seq 362413:366397, ack 867, win 65535, length 3984
16:28:37.260908 IP 199.232.37.67.443 > 10.0.2.15.45754: Flags [P.], seq 366397:367725, ack 867, win 65535, length 1328
16:28:37.260938 IP 10.0.2.15.45754 > 199.232.37.67.443: Flags [.], ack 362413, win 65535, length 0
16:28:37.260985 IP 10.0.2.15.45754 > 199.232.37.67.443: Flags [.], ack 366397, win 65535, length 0
16:28:37.261432 IP 199.232.37.67.443 > 10.0.2.15.45754: Flags [P.], seq 367725:370381, ack 867, win 65535, length 2656
16:28:37.261434 IP 199.232.37.67.443 > 10.0.2.15.45754: Flags [P.], seq 370381:371709, ack 867, win 65535, length 1328
16:28:37.261435 IP 199.232.37.67.443 > 10.0.2.15.45754: Flags [P.], seq 371709:374365, ack 867, win 65535, length 2656
16:28:37.261436 IP 199.232.37.67.443 > 10.0.2.15.45754: Flags [P.], seq 374365:375693, ack 867, win 65535, length 1328
16:28:37.261453 IP 10.0.2.15.45754 > 199.232.37.67.443: Flags [.], ack 370381, win 65535, length 0
16:28:37.261473 IP 10.0.2.15.45754 > 199.232.37.67.443: Flags [.], ack 374365, win 65535, length 0
16:28:37.261648 IP 199.232.37.67.443 > 10.0.2.15.45754: Flags [P.], seq 375693:377021, ack 867, win 65535, length 1328
16:28:37.261720 IP 10.0.2.15.45754 > 199.232.37.67.443: Flags [.], ack 377021, win 65535, length 0
16:28:37.262505 IP 199.232.37.67.443 > 10.0.2.15.45754: Flags [P.], seq 377021:378349, ack 867, win 65535, length 1328
16:28:37.262554 IP 199.232.37.67.443 > 10.0.2.15.45754: Flags [P.], seq 378349:379677, ack 867, win 65535, length 1328
16:28:37.262558 IP 199.232.37.67.443 > 10.0.2.15.45754: Flags [P.], seq 379677:382333, ack 867, win 65535, length 2656
16:28:37.262559 IP 199.232.37.67.443 > 10.0.2.15.45754: Flags [P.], seq 382333:383661, ack 867, win 65535, length 1328
16:28:37.262680 IP 10.0.2.15.45754 > 199.232.37.67.443: Flags [.], ack 379677, win 65535, length 0
16:28:37.262708 IP 10.0.2.15.45754 > 199.232.37.67.443: Flags [.], ack 382333, win 65535, length 0
16:28:37.262888 IP 199.232.37.67.443 > 10.0.2.15.45754: Flags [P.], seq 383661:384989, ack 867, win 65535, length 1328
16:28:37.262890 IP 199.232.37.67.443 > 10.0.2.15.45754: Flags [P.], seq 384989:388973, ack 867, win 65535, length 3984
16:28:37.262902 IP 10.0.2.15.45754 > 199.232.37.67.443: Flags [.], ack 384989, win 65535, length 0
16:28:37.262922 IP 10.0.2.15.45754 > 199.232.37.67.443: Flags [.], ack 388973, win 65535, length 0
16:28:37.263395 IP 199.232.37.67.443 > 10.0.2.15.45754: Flags [P.], seq 388973:390301, ack 867, win 65535, length 1328
16:28:37.263397 IP 199.232.37.67.443 > 10.0.2.15.45754: Flags [P.], seq 390301:392957, ack 867, win 65535, length 2656
16:28:37.263544 IP 10.0.2.15.45754 > 199.232.37.67.443: Flags [.], ack 392957, win 65535, length 0
16:28:37.263836 IP 199.232.37.67.443 > 10.0.2.15.45754: Flags [P.], seq 392957:397821, ack 867, win 65535, length 4864
16:28:37.263838 IP 199.232.37.67.443 > 10.0.2.15.45754: Flags [P.], seq 397821:399149, ack 867, win 65535, length 1328
16:28:37.263905 IP 10.0.2.15.45754 > 199.232.37.67.443: Flags [.], ack 397821, win 65535, length 0
16:28:37.264068 IP 199.232.37.67.443 > 10.0.2.15.45754: Flags [P.], seq 399149:401805, ack 867, win 65535, length 2656
16:28:37.264069 IP 199.232.37.67.443 > 10.0.2.15.45754: Flags [P.], seq 401805:403181, ack 867, win 65535, length 1376
16:28:37.264070 IP 199.232.37.67.443 > 10.0.2.15.45754: Flags [P.], seq 403181:404509, ack 867, win 65535, length 1328
16:28:37.264070 IP 199.232.37.67.443 > 10.0.2.15.45754: Flags [P.], seq 404509:405837, ack 867, win 65535, length 1328
16:28:37.264085 IP 10.0.2.15.45754 > 199.232.37.67.443: Flags [.], ack 401805, win 65535, length 0
16:28:37.264105 IP 10.0.2.15.45754 > 199.232.37.67.443: Flags [.], ack 404509, win 65535, length 0
16:28:37.264421 IP 199.232.37.67.443 > 10.0.2.15.45754: Flags [P.], seq 405837:407165, ack 867, win 65535, length 1328
16:28:37.264423 IP 199.232.37.67.443 > 10.0.2.15.45754: Flags [P.], seq 407165:407565, ack 867, win 65535, length 400
16:28:37.264439 IP 10.0.2.15.45754 > 199.232.37.67.443: Flags [.], ack 407165, win 65535, length 0
16:28:37.264648 IP 199.232.37.67.443 > 10.0.2.15.45754: Flags [P.], seq 407565:411549, ack 867, win 65535, length 3984
16:28:37.264650 IP 199.232.37.67.443 > 10.0.2.15.45754: Flags [P.], seq 411549:412877, ack 867, win 65535, length 1328
16:28:37.264666 IP 10.0.2.15.45754 > 199.232.37.67.443: Flags [.], ack 411549, win 65535, length 0
16:28:37.264991 IP 199.232.37.67.443 > 10.0.2.15.45754: Flags [P.], seq 412877:414205, ack 867, win 65535, length 1328
16:28:37.264992 IP 199.232.37.67.443 > 10.0.2.15.45754: Flags [P.], seq 414205:415533, ack 867, win 65535, length 1328
16:28:37.265006 IP 10.0.2.15.45754 > 199.232.37.67.443: Flags [.], ack 414205, win 65535, length 0
16:28:37.265147 IP 199.232.37.67.443 > 10.0.2.15.45754: Flags [P.], seq 415533:418189, ack 867, win 65535, length 2656
16:28:37.265148 IP 199.232.37.67.443 > 10.0.2.15.45754: Flags [P.], seq 418189:419517, ack 867, win 65535, length 1328
16:28:37.265159 IP 10.0.2.15.45754 > 199.232.37.67.443: Flags [.], ack 418189, win 65535, length 0
16:28:37.265706 IP 199.232.37.67.443 > 10.0.2.15.45754: Flags [P.], seq 419517:422173, ack 867, win 65535, length 2656
16:28:37.265707 IP 199.232.37.67.443 > 10.0.2.15.45754: Flags [P.], seq 422173:423501, ack 867, win 65535, length 1328
16:28:37.265708 IP 199.232.37.67.443 > 10.0.2.15.45754: Flags [P.], seq 423501:424829, ack 867, win 65535, length 1328
16:28:37.265709 IP 199.232.37.67.443 > 10.0.2.15.45754: Flags [P.], seq 424829:427485, ack 867, win 65535, length 2656
16:28:37.265710 IP 199.232.37.67.443 > 10.0.2.15.45754: Flags [P.], seq 427485:428813, ack 867, win 65535, length 1328
16:28:37.265728 IP 10.0.2.15.45754 > 199.232.37.67.443: Flags [.], ack 422173, win 65535, length 0
16:28:37.265755 IP 10.0.2.15.45754 > 199.232.37.67.443: Flags [.], ack 424829, win 65535, length 0
16:28:37.265769 IP 10.0.2.15.45754 > 199.232.37.67.443: Flags [.], ack 427485, win 65535, length 0
16:28:37.266464 IP 199.232.37.67.443 > 10.0.2.15.45754: Flags [P.], seq 428813:431469, ack 867, win 65535, length 2656
16:28:37.266466 IP 199.232.37.67.443 > 10.0.2.15.45754: Flags [P.], seq 431469:432797, ack 867, win 65535, length 1328
16:28:37.266467 IP 199.232.37.67.443 > 10.0.2.15.45754: Flags [P.], seq 432797:435453, ack 867, win 65535, length 2656
16:28:37.266467 IP 199.232.37.67.443 > 10.0.2.15.45754: Flags [P.], seq 435453:436781, ack 867, win 65535, length 1328
16:28:37.266469 IP 199.232.37.67.443 > 10.0.2.15.45754: Flags [P.], seq 436781:439437, ack 867, win 65535, length 2656
16:28:37.266489 IP 10.0.2.15.45754 > 199.232.37.67.443: Flags [.], ack 431469, win 65535, length 0
16:28:37.266520 IP 10.0.2.15.45754 > 199.232.37.67.443: Flags [.], ack 435453, win 65535, length 0
16:28:37.266540 IP 10.0.2.15.45754 > 199.232.37.67.443: Flags [.], ack 439437, win 65535, length 0
16:28:37.266566 IP 199.232.37.67.443 > 10.0.2.15.45754: Flags [P.], seq 439437:440765, ack 867, win 65535, length 1328
16:28:37.266567 IP 199.232.37.67.443 > 10.0.2.15.45754: Flags [P.], seq 440765:442093, ack 867, win 65535, length 1328
16:28:37.266575 IP 10.0.2.15.45754 > 199.232.37.67.443: Flags [.], ack 442093, win 65535, length 0
16:28:37.269444 IP 199.232.37.67.443 > 10.0.2.15.45754: Flags [P.], seq 442093:446077, ack 867, win 65535, length 3984
16:28:37.269447 IP 199.232.37.67.443 > 10.0.2.15.45754: Flags [P.], seq 446077:447405, ack 867, win 65535, length 1328
16:28:37.269448 IP 199.232.37.67.443 > 10.0.2.15.45754: Flags [P.], seq 447405:450061, ack 867, win 65535, length 2656
16:28:37.269475 IP 10.0.2.15.45754 > 199.232.37.67.443: Flags [.], ack 446077, win 65535, length 0
16:28:37.269563 IP 10.0.2.15.45754 > 199.232.37.67.443: Flags [.], ack 450061, win 65535, length 0
16:28:37.270147 IP 199.232.37.67.443 > 10.0.2.15.45754: Flags [P.], seq 450061:455373, ack 867, win 65535, length 5312
16:28:37.270149 IP 199.232.37.67.443 > 10.0.2.15.45754: Flags [P.], seq 455373:458029, ack 867, win 65535, length 2656
16:28:37.270150 IP 199.232.37.67.443 > 10.0.2.15.45754: Flags [P.], seq 458029:459357, ack 867, win 65535, length 1328
16:28:37.270168 IP 10.0.2.15.45754 > 199.232.37.67.443: Flags [.], ack 455373, win 65535, length 0
16:28:37.270190 IP 10.0.2.15.45754 > 199.232.37.67.443: Flags [.], ack 458029, win 65535, length 0
16:28:37.270386 IP 199.232.37.67.443 > 10.0.2.15.45754: Flags [P.], seq 459357:460685, ack 867, win 65535, length 1328
16:28:37.270422 IP 199.232.37.67.443 > 10.0.2.15.45754: Flags [P.], seq 460685:462013, ack 867, win 65535, length 1328
16:28:37.270423 IP 199.232.37.67.443 > 10.0.2.15.45754: Flags [P.], seq 462013:463341, ack 867, win 65535, length 1328
16:28:37.270438 IP 10.0.2.15.45754 > 199.232.37.67.443: Flags [.], ack 460685, win 65535, length 0
16:28:37.270464 IP 10.0.2.15.45754 > 199.232.37.67.443: Flags [.], ack 463341, win 65535, length 0
16:28:37.270801 IP 199.232.37.67.443 > 10.0.2.15.45754: Flags [P.], seq 463341:469981, ack 867, win 65535, length 6640
16:28:37.270804 IP 199.232.37.67.443 > 10.0.2.15.45754: Flags [P.], seq 469981:472637, ack 867, win 65535, length 2656
16:28:37.270805 IP 199.232.37.67.443 > 10.0.2.15.45754: Flags [P.], seq 472637:473965, ack 867, win 65535, length 1328
16:28:37.270900 IP 10.0.2.15.45754 > 199.232.37.67.443: Flags [.], ack 469981, win 65535, length 0
16:28:37.270924 IP 10.0.2.15.45754 > 199.232.37.67.443: Flags [.], ack 472637, win 65535, length 0
16:28:37.270959 IP 199.232.37.67.443 > 10.0.2.15.45754: Flags [P.], seq 473965:475293, ack 867, win 65535, length 1328
16:28:37.270960 IP 199.232.37.67.443 > 10.0.2.15.45754: Flags [P.], seq 475293:476621, ack 867, win 65535, length 1328
16:28:37.270967 IP 10.0.2.15.45754 > 199.232.37.67.443: Flags [.], ack 475293, win 65535, length 0
16:28:37.271580 IP 199.232.37.67.443 > 10.0.2.15.45754: Flags [P.], seq 476621:477949, ack 867, win 65535, length 1328
16:28:37.271582 IP 199.232.37.67.443 > 10.0.2.15.45754: Flags [P.], seq 477949:479277, ack 867, win 65535, length 1328
16:28:37.271582 IP 199.232.37.67.443 > 10.0.2.15.45754: Flags [P.], seq 479277:480605, ack 867, win 65535, length 1328
16:28:37.271583 IP 199.232.37.67.443 > 10.0.2.15.45754: Flags [P.], seq 480605:481933, ack 867, win 65535, length 1328
16:28:37.271584 IP 199.232.37.67.443 > 10.0.2.15.45754: Flags [P.], seq 481933:483261, ack 867, win 65535, length 1328
16:28:37.271584 IP 199.232.37.67.443 > 10.0.2.15.45754: Flags [P.], seq 483261:484589, ack 867, win 65535, length 1328
16:28:37.271603 IP 10.0.2.15.45754 > 199.232.37.67.443: Flags [.], ack 477949, win 65535, length 0
16:28:37.271754 IP 10.0.2.15.45754 > 199.232.37.67.443: Flags [.], ack 480605, win 65535, length 0
16:28:37.271778 IP 10.0.2.15.45754 > 199.232.37.67.443: Flags [.], ack 483261, win 65535, length 0
16:28:37.271951 IP 199.232.37.67.443 > 10.0.2.15.45754: Flags [P.], seq 484589:489901, ack 867, win 65535, length 5312
16:28:37.271959 IP 10.0.2.15.45754 > 199.232.37.67.443: Flags [.], ack 489901, win 65535, length 0
16:28:37.274669 IP 199.232.37.67.443 > 10.0.2.15.45754: Flags [P.], seq 489901:491229, ack 867, win 65535, length 1328
16:28:37.274671 IP 199.232.37.67.443 > 10.0.2.15.45754: Flags [P.], seq 491229:492557, ack 867, win 65535, length 1328
16:28:37.274672 IP 199.232.37.67.443 > 10.0.2.15.45754: Flags [P.], seq 492557:493885, ack 867, win 65535, length 1328
16:28:37.274673 IP 199.232.37.67.443 > 10.0.2.15.45754: Flags [P.], seq 493885:495213, ack 867, win 65535, length 1328
16:28:37.274674 IP 199.232.37.67.443 > 10.0.2.15.45754: Flags [P.], seq 495213:499197, ack 867, win 65535, length 3984
16:28:37.274713 IP 10.0.2.15.45754 > 199.232.37.67.443: Flags [.], ack 492557, win 65535, length 0
16:28:37.274745 IP 10.0.2.15.45754 > 199.232.37.67.443: Flags [.], ack 495213, win 65535, length 0
16:28:37.274758 IP 10.0.2.15.45754 > 199.232.37.67.443: Flags [.], ack 499197, win 65535, length 0
16:28:37.275100 IP 199.232.37.67.443 > 10.0.2.15.45754: Flags [P.], seq 499197:505837, ack 867, win 65535, length 6640
16:28:37.275118 IP 10.0.2.15.45754 > 199.232.37.67.443: Flags [.], ack 505837, win 65535, length 0
16:28:37.275534 IP 199.232.37.67.443 > 10.0.2.15.45754: Flags [P.], seq 505837:507165, ack 867, win 65535, length 1328
16:28:37.275536 IP 199.232.37.67.443 > 10.0.2.15.45754: Flags [P.], seq 507165:508493, ack 867, win 65535, length 1328
16:28:37.275684 IP 10.0.2.15.45754 > 199.232.37.67.443: Flags [.], ack 508493, win 65535, length 0
16:28:37.275914 IP 199.232.37.67.443 > 10.0.2.15.45754: Flags [P.], seq 508493:513805, ack 867, win 65535, length 5312
16:28:37.275916 IP 199.232.37.67.443 > 10.0.2.15.45754: Flags [P.], seq 513805:516461, ack 867, win 65535, length 2656
16:28:37.275916 IP 199.232.37.67.443 > 10.0.2.15.45754: Flags [P.], seq 516461:517789, ack 867, win 65535, length 1328
16:28:37.275932 IP 10.0.2.15.45754 > 199.232.37.67.443: Flags [.], ack 513805, win 65535, length 0
16:28:37.275951 IP 10.0.2.15.45754 > 199.232.37.67.443: Flags [.], ack 516461, win 65535, length 0
16:28:37.276676 IP 199.232.37.67.443 > 10.0.2.15.45754: Flags [P.], seq 517789:520445, ack 867, win 65535, length 2656
16:28:37.276678 IP 199.232.37.67.443 > 10.0.2.15.45754: Flags [P.], seq 520445:521773, ack 867, win 65535, length 1328
16:28:37.276679 IP 199.232.37.67.443 > 10.0.2.15.45754: Flags [P.], seq 521773:523101, ack 867, win 65535, length 1328
16:28:37.276680 IP 199.232.37.67.443 > 10.0.2.15.45754: Flags [P.], seq 523101:524429, ack 867, win 65535, length 1328
16:28:37.276680 IP 199.232.37.67.443 > 10.0.2.15.45754: Flags [P.], seq 524429:525757, ack 867, win 65535, length 1328
16:28:37.276681 IP 199.232.37.67.443 > 10.0.2.15.45754: Flags [P.], seq 525757:527085, ack 867, win 65535, length 1328
16:28:37.276701 IP 10.0.2.15.45754 > 199.232.37.67.443: Flags [.], ack 520445, win 65535, length 0
16:28:37.276723 IP 10.0.2.15.45754 > 199.232.37.67.443: Flags [.], ack 523101, win 65535, length 0
16:28:37.276738 IP 10.0.2.15.45754 > 199.232.37.67.443: Flags [.], ack 525757, win 65535, length 0
16:28:37.276883 IP 199.232.37.67.443 > 10.0.2.15.45754: Flags [P.], seq 527085:529741, ack 867, win 65535, length 2656
16:28:37.276892 IP 10.0.2.15.45754 > 199.232.37.67.443: Flags [.], ack 529741, win 65535, length 0
16:28:37.277059 IP 199.232.37.67.443 > 10.0.2.15.45754: Flags [P.], seq 529741:531069, ack 867, win 65535, length 1328
16:28:37.277060 IP 199.232.37.67.443 > 10.0.2.15.45754: Flags [P.], seq 531069:532397, ack 867, win 65535, length 1328
16:28:37.277061 IP 199.232.37.67.443 > 10.0.2.15.45754: Flags [P.], seq 532397:535053, ack 867, win 65535, length 2656
16:28:37.277105 IP 10.0.2.15.45754 > 199.232.37.67.443: Flags [.], ack 532397, win 65535, length 0
16:28:37.277155 IP 10.0.2.15.45754 > 199.232.37.67.443: Flags [.], ack 535053, win 65535, length 0
16:28:37.277433 IP 199.232.37.67.443 > 10.0.2.15.45754: Flags [P.], seq 535053:536381, ack 867, win 65535, length 1328
16:28:37.277435 IP 199.232.37.67.443 > 10.0.2.15.45754: Flags [P.], seq 536381:539037, ack 867, win 65535, length 2656
16:28:37.277453 IP 10.0.2.15.45754 > 199.232.37.67.443: Flags [.], ack 539037, win 65535, length 0
16:28:37.277704 IP 199.232.37.67.443 > 10.0.2.15.45754: Flags [P.], seq 539037:541693, ack 867, win 65535, length 2656
16:28:37.277706 IP 199.232.37.67.443 > 10.0.2.15.45754: Flags [P.], seq 541693:543021, ack 867, win 65535, length 1328
16:28:37.277720 IP 10.0.2.15.45754 > 199.232.37.67.443: Flags [.], ack 541693, win 65535, length 0
16:28:37.278284 IP 199.232.37.67.443 > 10.0.2.15.45754: Flags [P.], seq 543021:545677, ack 867, win 65535, length 2656
16:28:37.278286 IP 199.232.37.67.443 > 10.0.2.15.45754: Flags [P.], seq 545677:547005, ack 867, win 65535, length 1328
16:28:37.278286 IP 199.232.37.67.443 > 10.0.2.15.45754: Flags [P.], seq 547005:548333, ack 867, win 65535, length 1328
16:28:37.278287 IP 199.232.37.67.443 > 10.0.2.15.45754: Flags [P.], seq 548333:549661, ack 867, win 65535, length 1328
16:28:37.278287 IP 199.232.37.67.443 > 10.0.2.15.45754: Flags [P.], seq 549661:550989, ack 867, win 65535, length 1328
16:28:37.278288 IP 199.232.37.67.443 > 10.0.2.15.45754: Flags [P.], seq 550989:552317, ack 867, win 65535, length 1328
16:28:37.278398 IP 10.0.2.15.45754 > 199.232.37.67.443: Flags [.], ack 545677, win 65535, length 0
16:28:37.278470 IP 10.0.2.15.45754 > 199.232.37.67.443: Flags [.], ack 548333, win 65535, length 0
16:28:37.278589 IP 10.0.2.15.45754 > 199.232.37.67.443: Flags [.], ack 550989, win 65535, length 0
16:28:37.278737 IP 199.232.37.67.443 > 10.0.2.15.45754: Flags [P.], seq 552317:553645, ack 867, win 65535, length 1328
16:28:37.278738 IP 199.232.37.67.443 > 10.0.2.15.45754: Flags [P.], seq 553645:554973, ack 867, win 65535, length 1328
16:28:37.278738 IP 199.232.37.67.443 > 10.0.2.15.45754: Flags [P.], seq 554973:556301, ack 867, win 65535, length 1328
16:28:37.278747 IP 10.0.2.15.45754 > 199.232.37.67.443: Flags [.], ack 553645, win 65535, length 0
16:28:37.278761 IP 10.0.2.15.45754 > 199.232.37.67.443: Flags [.], ack 556301, win 65535, length 0
16:28:37.282706 IP 199.232.37.67.443 > 10.0.2.15.45754: Flags [P.], seq 556301:562941, ack 867, win 65535, length 6640
16:28:37.282708 IP 199.232.37.67.443 > 10.0.2.15.45754: Flags [P.], seq 562941:564269, ack 867, win 65535, length 1328
16:28:37.282709 IP 199.232.37.67.443 > 10.0.2.15.45754: Flags [P.], seq 564269:566925, ack 867, win 65535, length 2656
16:28:37.282733 IP 10.0.2.15.45754 > 199.232.37.67.443: Flags [.], ack 562941, win 65535, length 0
16:28:37.282778 IP 10.0.2.15.45754 > 199.232.37.67.443: Flags [.], ack 566925, win 65535, length 0
16:28:37.282862 IP 199.232.37.67.443 > 10.0.2.15.45754: Flags [P.], seq 566925:568253, ack 867, win 65535, length 1328
16:28:37.282863 IP 199.232.37.67.443 > 10.0.2.15.45754: Flags [P.], seq 568253:570909, ack 867, win 65535, length 2656
16:28:37.282864 IP 199.232.37.67.443 > 10.0.2.15.45754: Flags [P.], seq 570909:573565, ack 867, win 65535, length 2656
16:28:37.282875 IP 10.0.2.15.45754 > 199.232.37.67.443: Flags [.], ack 570909, win 65535, length 0
16:28:37.282984 IP 10.0.2.15.45754 > 199.232.37.67.443: Flags [.], ack 573565, win 65535, length 0
16:28:37.283326 IP 199.232.37.67.443 > 10.0.2.15.45754: Flags [P.], seq 573565:574893, ack 867, win 65535, length 1328
16:28:37.283327 IP 199.232.37.67.443 > 10.0.2.15.45754: Flags [P.], seq 574893:576221, ack 867, win 65535, length 1328
16:28:37.283328 IP 199.232.37.67.443 > 10.0.2.15.45754: Flags [.], seq 576221:580601, ack 867, win 65535, length 4380
16:28:37.283345 IP 10.0.2.15.45754 > 199.232.37.67.443: Flags [.], ack 576221, win 65535, length 0
16:28:37.283360 IP 10.0.2.15.45754 > 199.232.37.67.443: Flags [.], ack 580601, win 65535, length 0
16:28:37.284051 IP 199.232.37.67.443 > 10.0.2.15.45754: Flags [P.], seq 580601:581533, ack 867, win 65535, length 932
16:28:37.284053 IP 199.232.37.67.443 > 10.0.2.15.45754: Flags [P.], seq 581533:582861, ack 867, win 65535, length 1328
16:28:37.284053 IP 199.232.37.67.443 > 10.0.2.15.45754: Flags [P.], seq 582861:584189, ack 867, win 65535, length 1328
16:28:37.284054 IP 199.232.37.67.443 > 10.0.2.15.45754: Flags [P.], seq 584189:586845, ack 867, win 65535, length 2656
16:28:37.284155 IP 10.0.2.15.45754 > 199.232.37.67.443: Flags [.], ack 586845, win 65535, length 0
16:28:37.284311 IP 199.232.37.67.443 > 10.0.2.15.45754: Flags [P.], seq 586845:589501, ack 867, win 65535, length 2656
16:28:37.284313 IP 199.232.37.67.443 > 10.0.2.15.45754: Flags [P.], seq 589501:592157, ack 867, win 65535, length 2656
16:28:37.284314 IP 199.232.37.67.443 > 10.0.2.15.45754: Flags [P.], seq 592157:593485, ack 867, win 65535, length 1328
16:28:37.284562 IP 199.232.37.67.443 > 10.0.2.15.45754: Flags [P.], seq 593485:594813, ack 867, win 65535, length 1328
16:28:37.284564 IP 199.232.37.67.443 > 10.0.2.15.45754: Flags [P.], seq 594813:596141, ack 867, win 65535, length 1328
16:28:37.284564 IP 199.232.37.67.443 > 10.0.2.15.45754: Flags [P.], seq 596141:597469, ack 867, win 65535, length 1328
16:28:37.284643 IP 10.0.2.15.45754 > 199.232.37.67.443: Flags [.], ack 597469, win 65535, length 0
16:28:37.285312 IP 199.232.37.67.443 > 10.0.2.15.45754: Flags [P.], seq 597469:601453, ack 867, win 65535, length 3984
16:28:37.285315 IP 199.232.37.67.443 > 10.0.2.15.45754: Flags [P.], seq 601453:602781, ack 867, win 65535, length 1328
16:28:37.285315 IP 199.232.37.67.443 > 10.0.2.15.45754: Flags [P.], seq 602781:604109, ack 867, win 65535, length 1328
16:28:37.285316 IP 199.232.37.67.443 > 10.0.2.15.45754: Flags [P.], seq 604109:605437, ack 867, win 65535, length 1328
16:28:37.285337 IP 10.0.2.15.45754 > 199.232.37.67.443: Flags [.], ack 601453, win 65535, length 0
16:28:37.285767 IP 199.232.37.67.443 > 10.0.2.15.45754: Flags [P.], seq 605437:606765, ack 867, win 65535, length 1328
16:28:37.285770 IP 199.232.37.67.443 > 10.0.2.15.45754: Flags [P.], seq 606765:610749, ack 867, win 65535, length 3984
16:28:37.285771 IP 199.232.37.67.443 > 10.0.2.15.45754: Flags [P.], seq 610749:612077, ack 867, win 65535, length 1328
16:28:37.285771 IP 199.232.37.67.443 > 10.0.2.15.45754: Flags [P.], seq 612077:613405, ack 867, win 65535, length 1328
16:28:37.285772 IP 199.232.37.67.443 > 10.0.2.15.45754: Flags [P.], seq 613405:614733, ack 867, win 65535, length 1328
16:28:37.286046 IP 199.232.37.67.443 > 10.0.2.15.45754: Flags [P.], seq 614733:617389, ack 867, win 65535, length 2656
16:28:37.286048 IP 199.232.37.67.443 > 10.0.2.15.45754: Flags [P.], seq 617389:618717, ack 867, win 65535, length 1328
16:28:37.286178 IP 199.232.37.67.443 > 10.0.2.15.45754: Flags [P.], seq 618717:621373, ack 867, win 65535, length 2656
16:28:37.286405 IP 199.232.37.67.443 > 10.0.2.15.45754: Flags [P.], seq 621373:622701, ack 867, win 65535, length 1328
16:28:37.286406 IP 199.232.37.67.443 > 10.0.2.15.45754: Flags [P.], seq 622701:624029, ack 867, win 65535, length 1328
16:28:37.286407 IP 199.232.37.67.443 > 10.0.2.15.45754: Flags [P.], seq 624029:625357, ack 867, win 65535, length 1328
16:28:37.286489 IP 10.0.2.15.45754 > 199.232.37.67.443: Flags [.], ack 625357, win 65535, length 0
16:28:37.286740 IP 199.232.37.67.443 > 10.0.2.15.45754: Flags [P.], seq 625357:628013, ack 867, win 65535, length 2656
16:28:37.287020 IP 199.232.37.67.443 > 10.0.2.15.45754: Flags [P.], seq 628013:629341, ack 867, win 65535, length 1328
16:28:37.287022 IP 199.232.37.67.443 > 10.0.2.15.45754: Flags [P.], seq 629341:631997, ack 867, win 65535, length 2656
16:28:37.287099 IP 10.0.2.15.45754 > 199.232.37.67.443: Flags [.], ack 631997, win 65535, length 0
16:28:37.289274 IP 199.232.37.67.443 > 10.0.2.15.45754: Flags [P.], seq 631997:633325, ack 867, win 65535, length 1328
16:28:37.289278 IP 199.232.37.67.443 > 10.0.2.15.45754: Flags [P.], seq 633325:637309, ack 867, win 65535, length 3984
16:28:37.289279 IP 199.232.37.67.443 > 10.0.2.15.45754: Flags [P.], seq 637309:639965, ack 867, win 65535, length 2656
16:28:37.289280 IP 199.232.37.67.443 > 10.0.2.15.45754: Flags [P.], seq 639965:641293, ack 867, win 65535, length 1328
16:28:37.289281 IP 199.232.37.67.443 > 10.0.2.15.45754: Flags [P.], seq 641293:643949, ack 867, win 65535, length 2656
16:28:37.289326 IP 10.0.2.15.45754 > 199.232.37.67.443: Flags [.], ack 637309, win 65535, length 0
16:28:37.289899 IP 199.232.37.67.443 > 10.0.2.15.45754: Flags [P.], seq 643949:645277, ack 867, win 65535, length 1328
16:28:37.289902 IP 199.232.37.67.443 > 10.0.2.15.45754: Flags [P.], seq 645277:650589, ack 867, win 65535, length 5312
16:28:37.289903 IP 199.232.37.67.443 > 10.0.2.15.45754: Flags [P.], seq 650589:651917, ack 867, win 65535, length 1328
16:28:37.289970 IP 10.0.2.15.45754 > 199.232.37.67.443: Flags [.], ack 651917, win 65535, length 0
16:28:37.290292 IP 199.232.37.67.443 > 10.0.2.15.45754: Flags [P.], seq 651917:655901, ack 867, win 65535, length 3984
16:28:37.290294 IP 199.232.37.67.443 > 10.0.2.15.45754: Flags [P.], seq 655901:657229, ack 867, win 65535, length 1328
16:28:37.290294 IP 199.232.37.67.443 > 10.0.2.15.45754: Flags [P.], seq 657229:658557, ack 867, win 65535, length 1328
16:28:37.290510 IP 199.232.37.67.443 > 10.0.2.15.45754: Flags [P.], seq 658557:659885, ack 867, win 65535, length 1328
16:28:37.290512 IP 199.232.37.67.443 > 10.0.2.15.45754: Flags [.], seq 659885:661345, ack 867, win 65535, length 1460
16:28:37.290665 IP 199.232.37.67.443 > 10.0.2.15.45754: Flags [P.], seq 661345:662541, ack 867, win 65535, length 1196
16:28:37.290667 IP 199.232.37.67.443 > 10.0.2.15.45754: Flags [P.], seq 662541:663869, ack 867, win 65535, length 1328
16:28:37.290903 IP 199.232.37.67.443 > 10.0.2.15.45754: Flags [P.], seq 663869:667853, ack 867, win 65535, length 3984
16:28:37.290929 IP 10.0.2.15.45754 > 199.232.37.67.443: Flags [.], ack 663869, win 65535, length 0
16:28:37.291026 IP 199.232.37.67.443 > 10.0.2.15.45754: Flags [P.], seq 667853:669181, ack 867, win 65535, length 1328
16:28:37.291194 IP 199.232.37.67.443 > 10.0.2.15.45754: Flags [P.], seq 669181:673165, ack 867, win 65535, length 3984
16:28:37.291228 IP 10.0.2.15.45754 > 199.232.37.67.443: Flags [.], ack 673165, win 65535, length 0
16:28:37.291327 IP 199.232.37.67.443 > 10.0.2.15.45754: Flags [P.], seq 673165:677149, ack 867, win 65535, length 3984
16:28:37.291558 IP 199.232.37.67.443 > 10.0.2.15.45754: Flags [P.], seq 677149:679805, ack 867, win 65535, length 2656
16:28:37.291560 IP 199.232.37.67.443 > 10.0.2.15.45754: Flags [P.], seq 679805:681133, ack 867, win 65535, length 1328
16:28:37.291607 IP 10.0.2.15.45754 > 199.232.37.67.443: Flags [.], ack 681133, win 65535, length 0
16:28:37.291959 IP 199.232.37.67.443 > 10.0.2.15.45754: Flags [P.], seq 681133:683789, ack 867, win 65535, length 2656
16:28:37.292253 IP 199.232.37.67.443 > 10.0.2.15.45754: Flags [P.], seq 683789:685117, ack 867, win 65535, length 1328
16:28:37.292255 IP 199.232.37.67.443 > 10.0.2.15.45754: Flags [P.], seq 685117:686445, ack 867, win 65535, length 1328
16:28:37.292255 IP 199.232.37.67.443 > 10.0.2.15.45754: Flags [P.], seq 686445:687773, ack 867, win 65535, length 1328
16:28:37.292256 IP 199.232.37.67.443 > 10.0.2.15.45754: Flags [P.], seq 687773:689101, ack 867, win 65535, length 1328
16:28:37.292488 IP 199.232.37.67.443 > 10.0.2.15.45754: Flags [P.], seq 689101:690429, ack 867, win 65535, length 1328
16:28:37.292490 IP 199.232.37.67.443 > 10.0.2.15.45754: Flags [P.], seq 690429:691757, ack 867, win 65535, length 1328
16:28:37.292625 IP 199.232.37.67.443 > 10.0.2.15.45754: Flags [P.], seq 691757:693085, ack 867, win 65535, length 1328
16:28:37.292885 IP 199.232.37.67.443 > 10.0.2.15.45754: Flags [P.], seq 693085:695741, ack 867, win 65535, length 2656
16:28:37.292940 IP 199.232.37.67.443 > 10.0.2.15.45754: Flags [P.], seq 695741:697069, ack 867, win 65535, length 1328
16:28:37.293136 IP 199.232.37.67.443 > 10.0.2.15.45754: Flags [P.], seq 697069:698397, ack 867, win 65535, length 1328
16:28:37.293137 IP 199.232.37.67.443 > 10.0.2.15.45754: Flags [P.], seq 698397:699725, ack 867, win 65535, length 1328
16:28:37.293182 IP 10.0.2.15.45754 > 199.232.37.67.443: Flags [.], ack 699725, win 65535, length 0
16:28:37.293926 IP 199.232.37.67.443 > 10.0.2.15.45754: Flags [P.], seq 699725:701053, ack 867, win 65535, length 1328
16:28:37.293937 IP 199.232.37.67.443 > 10.0.2.15.45754: Flags [P.], seq 701053:702381, ack 867, win 65535, length 1328
16:28:37.293938 IP 199.232.37.67.443 > 10.0.2.15.45754: Flags [P.], seq 702381:703709, ack 867, win 65535, length 1328
16:28:37.293938 IP 199.232.37.67.443 > 10.0.2.15.45754: Flags [P.], seq 703709:705037, ack 867, win 65535, length 1328
16:28:37.293939 IP 199.232.37.67.443 > 10.0.2.15.45754: Flags [P.], seq 705037:706365, ack 867, win 65535, length 1328
16:28:37.293939 IP 199.232.37.67.443 > 10.0.2.15.45754: Flags [P.], seq 706365:707693, ack 867, win 65535, length 1328
16:28:37.294900 IP 10.0.2.15.45754 > 199.232.37.67.443: Flags [.], ack 707693, win 65535, length 0
16:28:37.295523 IP 199.232.37.67.443 > 10.0.2.15.45754: Flags [P.], seq 707693:711677, ack 867, win 65535, length 3984
16:28:37.295526 IP 199.232.37.67.443 > 10.0.2.15.45754: Flags [P.], seq 711677:713005, ack 867, win 65535, length 1328
16:28:37.295526 IP 199.232.37.67.443 > 10.0.2.15.45754: Flags [P.], seq 713005:714333, ack 867, win 65535, length 1328
16:28:37.295941 IP 199.232.37.67.443 > 10.0.2.15.45754: Flags [P.], seq 714333:715661, ack 867, win 65535, length 1328
16:28:37.296002 IP 10.0.2.15.45754 > 199.232.37.67.443: Flags [.], ack 715661, win 65535, length 0
16:28:37.296526 IP 199.232.37.67.443 > 10.0.2.15.45754: Flags [P.], seq 715661:718317, ack 867, win 65535, length 2656
16:28:37.296528 IP 199.232.37.67.443 > 10.0.2.15.45754: Flags [P.], seq 718317:719645, ack 867, win 65535, length 1328
16:28:37.296549 IP 10.0.2.15.45754 > 199.232.37.67.443: Flags [.], ack 718317, win 65535, length 0
16:28:37.297515 IP 199.232.37.67.443 > 10.0.2.15.45754: Flags [P.], seq 719645:728941, ack 867, win 65535, length 9296
16:28:37.297518 IP 199.232.37.67.443 > 10.0.2.15.45754: Flags [P.], seq 728941:731597, ack 867, win 65535, length 2656
16:28:37.297598 IP 199.232.37.67.443 > 10.0.2.15.45754: Flags [P.], seq 731597:732925, ack 867, win 65535, length 1328
16:28:37.297599 IP 199.232.37.67.443 > 10.0.2.15.45754: Flags [P.], seq 732925:734253, ack 867, win 65535, length 1328
16:28:37.297600 IP 199.232.37.67.443 > 10.0.2.15.45754: Flags [P.], seq 734253:735581, ack 867, win 65535, length 1328
16:28:37.297600 IP 199.232.37.67.443 > 10.0.2.15.45754: Flags [P.], seq 735581:736909, ack 867, win 65535, length 1328
16:28:37.297601 IP 199.232.37.67.443 > 10.0.2.15.45754: Flags [P.], seq 736909:738237, ack 867, win 65535, length 1328
16:28:37.297602 IP 199.232.37.67.443 > 10.0.2.15.45754: Flags [P.], seq 738237:739565, ack 867, win 65535, length 1328
16:28:37.297787 IP 199.232.37.67.443 > 10.0.2.15.45754: Flags [P.], seq 739565:742221, ack 867, win 65535, length 2656
16:28:37.298156 IP 199.232.37.67.443 > 10.0.2.15.45754: Flags [P.], seq 742221:743549, ack 867, win 65535, length 1328
16:28:37.298158 IP 199.232.37.67.443 > 10.0.2.15.45754: Flags [P.], seq 743549:748861, ack 867, win 65535, length 5312
16:28:37.298159 IP 199.232.37.67.443 > 10.0.2.15.45754: Flags [.], seq 748861:750321, ack 867, win 65535, length 1460
16:28:37.298355 IP 199.232.37.67.443 > 10.0.2.15.45754: Flags [P.], seq 750321:752845, ack 867, win 65535, length 2524
16:28:37.298485 IP 10.0.2.15.45754 > 199.232.37.67.443: Flags [.], ack 750321, win 65535, length 0
16:28:37.298803 IP 199.232.37.67.443 > 10.0.2.15.45754: Flags [.], seq 752845:757225, ack 867, win 65535, length 4380
16:28:37.299006 IP 199.232.37.67.443 > 10.0.2.15.45754: Flags [P.], seq 757225:762141, ack 867, win 65535, length 4916
16:28:37.299009 IP 199.232.37.67.443 > 10.0.2.15.45754: Flags [P.], seq 762141:767453, ack 867, win 65535, length 5312
16:28:37.299195 IP 199.232.37.67.443 > 10.0.2.15.45754: Flags [P.], seq 767453:771437, ack 867, win 65535, length 3984
16:28:37.299351 IP 10.0.2.15.45754 > 199.232.37.67.443: Flags [.], ack 771437, win 65535, length 0
16:28:37.299587 IP 199.232.37.67.443 > 10.0.2.15.45754: Flags [P.], seq 771437:772765, ack 867, win 65535, length 1328
16:28:37.299993 IP 199.232.37.67.443 > 10.0.2.15.45754: Flags [P.], seq 772765:775421, ack 867, win 65535, length 2656
16:28:37.299995 IP 199.232.37.67.443 > 10.0.2.15.45754: Flags [P.], seq 775421:776749, ack 867, win 65535, length 1328
16:28:37.299996 IP 199.232.37.67.443 > 10.0.2.15.45754: Flags [P.], seq 776749:778077, ack 867, win 65535, length 1328
16:28:37.299997 IP 199.232.37.67.443 > 10.0.2.15.45754: Flags [P.], seq 778077:780733, ack 867, win 65535, length 2656
16:28:37.300091 IP 10.0.2.15.45754 > 199.232.37.67.443: Flags [.], ack 775421, win 65535, length 0
16:28:37.300230 IP 199.232.37.67.443 > 10.0.2.15.45754: Flags [P.], seq 780733:782061, ack 867, win 65535, length 1328
16:28:37.300231 IP 199.232.37.67.443 > 10.0.2.15.45754: Flags [P.], seq 782061:783389, ack 867, win 65535, length 1328
16:28:37.300297 IP 10.0.2.15.45754 > 199.232.37.67.443: Flags [.], ack 783389, win 65535, length 0
16:28:37.302342 IP 199.232.37.67.443 > 10.0.2.15.45754: Flags [P.], seq 783389:784717, ack 867, win 65535, length 1328
16:28:37.302344 IP 199.232.37.67.443 > 10.0.2.15.45754: Flags [P.], seq 784717:787373, ack 867, win 65535, length 2656
16:28:37.302345 IP 199.232.37.67.443 > 10.0.2.15.45754: Flags [P.], seq 787373:790029, ack 867, win 65535, length 2656
16:28:37.302382 IP 10.0.2.15.45754 > 199.232.37.67.443: Flags [.], ack 787373, win 65535, length 0
16:28:37.302652 IP 199.232.37.67.443 > 10.0.2.15.45754: Flags [P.], seq 790029:791357, ack 867, win 65535, length 1328
16:28:37.302654 IP 199.232.37.67.443 > 10.0.2.15.45754: Flags [P.], seq 791357:792685, ack 867, win 65535, length 1328
16:28:37.302724 IP 10.0.2.15.45754 > 199.232.37.67.443: Flags [.], ack 792685, win 65535, length 0
16:28:37.302857 IP 199.232.37.67.443 > 10.0.2.15.45754: Flags [P.], seq 792685:796669, ack 867, win 65535, length 3984
16:28:37.302858 IP 199.232.37.67.443 > 10.0.2.15.45754: Flags [P.], seq 796669:799325, ack 867, win 65535, length 2656
16:28:37.302897 IP 10.0.2.15.45754 > 199.232.37.67.443: Flags [.], ack 799325, win 65535, length 0
16:28:37.303123 IP 199.232.37.67.443 > 10.0.2.15.45754: Flags [P.], seq 799325:800653, ack 867, win 65535, length 1328
16:28:37.303359 IP 199.232.37.67.443 > 10.0.2.15.45754: Flags [P.], seq 800653:801981, ack 867, win 65535, length 1328
16:28:37.303361 IP 199.232.37.67.443 > 10.0.2.15.45754: Flags [P.], seq 801981:804637, ack 867, win 65535, length 2656
16:28:37.303566 IP 199.232.37.67.443 > 10.0.2.15.45754: Flags [P.], seq 804637:805965, ack 867, win 65535, length 1328
16:28:37.303888 IP 199.232.37.67.443 > 10.0.2.15.45754: Flags [P.], seq 805965:809949, ack 867, win 65535, length 3984
16:28:37.303890 IP 199.232.37.67.443 > 10.0.2.15.45754: Flags [P.], seq 809949:812605, ack 867, win 65535, length 2656
16:28:37.303957 IP 199.232.37.67.443 > 10.0.2.15.45754: Flags [P.], seq 812605:816589, ack 867, win 65535, length 3984
16:28:37.304070 IP 10.0.2.15.45754 > 199.232.37.67.443: Flags [.], ack 816589, win 65535, length 0
16:28:37.304689 IP 199.232.37.67.443 > 10.0.2.15.45754: Flags [P.], seq 816589:819245, ack 867, win 65535, length 2656
16:28:37.304828 IP 10.0.2.15.45754 > 199.232.37.67.443: Flags [.], ack 819245, win 65535, length 0
16:28:37.304951 IP 199.232.37.67.443 > 10.0.2.15.45754: Flags [P.], seq 819245:821901, ack 867, win 65535, length 2656
16:28:37.305068 IP 199.232.37.67.443 > 10.0.2.15.45754: Flags [P.], seq 821901:823229, ack 867, win 65535, length 1328
16:28:37.305278 IP 199.232.37.67.443 > 10.0.2.15.45754: Flags [P.], seq 823229:824557, ack 867, win 65535, length 1328
16:28:37.305280 IP 199.232.37.67.443 > 10.0.2.15.45754: Flags [P.], seq 824557:827213, ack 867, win 65535, length 2656
16:28:37.305740 IP 199.232.37.67.443 > 10.0.2.15.45754: Flags [P.], seq 827213:832525, ack 867, win 65535, length 5312
16:28:37.305742 IP 199.232.37.67.443 > 10.0.2.15.45754: Flags [P.], seq 832525:835181, ack 867, win 65535, length 2656
16:28:37.305743 IP 199.232.37.67.443 > 10.0.2.15.45754: Flags [P.], seq 835181:839165, ack 867, win 65535, length 3984
16:28:37.305773 IP 199.232.37.67.443 > 10.0.2.15.45754: Flags [P.], seq 839165:841821, ack 867, win 65535, length 2656
16:28:37.305774 IP 199.232.37.67.443 > 10.0.2.15.45754: Flags [P.], seq 841821:844477, ack 867, win 65535, length 2656
16:28:37.305797 IP 10.0.2.15.45754 > 199.232.37.67.443: Flags [.], ack 827213, win 65535, length 0
16:28:37.306110 IP 199.232.37.67.443 > 10.0.2.15.45754: Flags [P.], seq 844477:845805, ack 867, win 65535, length 1328
16:28:37.306272 IP 199.232.37.67.443 > 10.0.2.15.45754: Flags [P.], seq 845805:847133, ack 867, win 65535, length 1328
16:28:37.306459 IP 199.232.37.67.443 > 10.0.2.15.45754: Flags [P.], seq 847133:853773, ack 867, win 65535, length 6640
16:28:37.306494 IP 10.0.2.15.45754 > 199.232.37.67.443: Flags [.], ack 853773, win 65535, length 0
16:28:37.306752 IP 199.232.37.67.443 > 10.0.2.15.45754: Flags [P.], seq 853773:856429, ack 867, win 65535, length 2656
16:28:37.306767 IP 10.0.2.15.45754 > 199.232.37.67.443: Flags [.], ack 856429, win 65535, length 0
16:28:37.306890 IP 199.232.37.67.443 > 10.0.2.15.45754: Flags [P.], seq 856429:857757, ack 867, win 65535, length 1328
16:28:37.306891 IP 199.232.37.67.443 > 10.0.2.15.45754: Flags [P.], seq 857757:859085, ack 867, win 65535, length 1328
16:28:37.306924 IP 10.0.2.15.45754 > 199.232.37.67.443: Flags [.], ack 859085, win 65535, length 0
16:28:37.308576 IP 199.232.37.67.443 > 10.0.2.15.45754: Flags [P.], seq 859085:860413, ack 867, win 65535, length 1328
16:28:37.308580 IP 199.232.37.67.443 > 10.0.2.15.45754: Flags [P.], seq 860413:864397, ack 867, win 65535, length 3984
16:28:37.308581 IP 199.232.37.67.443 > 10.0.2.15.45754: Flags [P.], seq 864397:865725, ack 867, win 65535, length 1328
16:28:37.308624 IP 10.0.2.15.45754 > 199.232.37.67.443: Flags [.], ack 864397, win 65535, length 0
16:28:37.308951 IP 199.232.37.67.443 > 10.0.2.15.45754: Flags [P.], seq 865725:868381, ack 867, win 65535, length 2656
16:28:37.308952 IP 199.232.37.67.443 > 10.0.2.15.45754: Flags [P.], seq 868381:869709, ack 867, win 65535, length 1328
16:28:37.308953 IP 199.232.37.67.443 > 10.0.2.15.45754: Flags [P.], seq 869709:871037, ack 867, win 65535, length 1328
16:28:37.308953 IP 199.232.37.67.443 > 10.0.2.15.45754: Flags [P.], seq 871037:873693, ack 867, win 65535, length 2656
16:28:37.309024 IP 10.0.2.15.45754 > 199.232.37.67.443: Flags [.], ack 873693, win 65535, length 0
16:28:37.314092 IP 199.232.37.67.443 > 10.0.2.15.45754: Flags [P.], seq 873693:875021, ack 867, win 65535, length 1328
16:28:37.314255 IP 199.232.37.67.443 > 10.0.2.15.45754: Flags [P.], seq 875021:879005, ack 867, win 65535, length 3984
16:28:37.314258 IP 199.232.37.67.443 > 10.0.2.15.45754: Flags [P.], seq 879005:880333, ack 867, win 65535, length 1328
16:28:37.314260 IP 199.232.37.67.443 > 10.0.2.15.45754: Flags [P.], seq 880333:884317, ack 867, win 65535, length 3984
16:28:37.314586 IP 10.0.2.15.45754 > 199.232.37.67.443: Flags [.], ack 879005, win 65535, length 0
16:28:37.314730 IP 199.232.37.67.443 > 10.0.2.15.45754: Flags [P.], seq 884317:885645, ack 867, win 65535, length 1328
16:28:37.314731 IP 199.232.37.67.443 > 10.0.2.15.45754: Flags [P.], seq 885645:886973, ack 867, win 65535, length 1328
16:28:37.314732 IP 199.232.37.67.443 > 10.0.2.15.45754: Flags [P.], seq 886973:889629, ack 867, win 65535, length 2656
16:28:37.314733 IP 199.232.37.67.443 > 10.0.2.15.45754: Flags [P.], seq 889629:893613, ack 867, win 65535, length 3984
16:28:37.314908 IP 199.232.37.67.443 > 10.0.2.15.45754: Flags [P.], seq 893613:894941, ack 867, win 65535, length 1328
16:28:37.314910 IP 199.232.37.67.443 > 10.0.2.15.45754: Flags [P.], seq 894941:896269, ack 867, win 65535, length 1328
16:28:37.314958 IP 10.0.2.15.45754 > 199.232.37.67.443: Flags [.], ack 896269, win 65535, length 0
16:28:37.317835 IP 199.232.37.67.443 > 10.0.2.15.45754: Flags [P.], seq 896269:905565, ack 867, win 65535, length 9296
16:28:37.317839 IP 199.232.37.67.443 > 10.0.2.15.45754: Flags [P.], seq 905565:906893, ack 867, win 65535, length 1328
16:28:37.317868 IP 10.0.2.15.45754 > 199.232.37.67.443: Flags [.], ack 905565, win 65535, length 0
16:28:37.318203 IP 199.232.37.67.443 > 10.0.2.15.45754: Flags [P.], seq 906893:908221, ack 867, win 65535, length 1328
16:28:37.318206 IP 199.232.37.67.443 > 10.0.2.15.45754: Flags [P.], seq 908221:909549, ack 867, win 65535, length 1328
16:28:37.318448 IP 199.232.37.67.443 > 10.0.2.15.45754: Flags [P.], seq 909549:913533, ack 867, win 65535, length 3984
16:28:37.318506 IP 10.0.2.15.45754 > 199.232.37.67.443: Flags [.], ack 913533, win 65535, length 0
16:28:37.318780 IP 199.232.37.67.443 > 10.0.2.15.45754: Flags [P.], seq 913533:914861, ack 867, win 65535, length 1328
16:28:37.318782 IP 199.232.37.67.443 > 10.0.2.15.45754: Flags [P.], seq 914861:916189, ack 867, win 65535, length 1328
16:28:37.319187 IP 199.232.37.67.443 > 10.0.2.15.45754: Flags [P.], seq 916189:917517, ack 867, win 65535, length 1328
16:28:37.319460 IP 199.232.37.67.443 > 10.0.2.15.45754: Flags [P.], seq 917517:930797, ack 867, win 65535, length 13280
16:28:37.319787 IP 199.232.37.67.443 > 10.0.2.15.45754: Flags [P.], seq 930797:932125, ack 867, win 65535, length 1328
16:28:37.319789 IP 199.232.37.67.443 > 10.0.2.15.45754: Flags [P.], seq 932125:934781, ack 867, win 65535, length 2656
16:28:37.319961 IP 10.0.2.15.45754 > 199.232.37.67.443: Flags [.], ack 934781, win 65535, length 0
16:28:37.320107 IP 199.232.37.67.443 > 10.0.2.15.45754: Flags [P.], seq 934781:938765, ack 867, win 65535, length 3984
16:28:37.320118 IP 10.0.2.15.45754 > 199.232.37.67.443: Flags [.], ack 938765, win 65535, length 0
16:28:37.320269 IP 199.232.37.67.443 > 10.0.2.15.45754: Flags [P.], seq 938765:940093, ack 867, win 65535, length 1328
16:28:37.320270 IP 199.232.37.67.443 > 10.0.2.15.45754: Flags [P.], seq 940093:941421, ack 867, win 65535, length 1328
16:28:37.320271 IP 199.232.37.67.443 > 10.0.2.15.45754: Flags [P.], seq 941421:942749, ack 867, win 65535, length 1328
16:28:37.320466 IP 10.0.2.15.45754 > 199.232.37.67.443: Flags [.], ack 942749, win 65535, length 0
16:28:37.321021 IP 199.232.37.67.443 > 10.0.2.15.45754: Flags [P.], seq 942749:944077, ack 867, win 65535, length 1328
16:28:37.321036 IP 199.232.37.67.443 > 10.0.2.15.45754: Flags [P.], seq 944077:948061, ack 867, win 65535, length 3984
16:28:37.321038 IP 199.232.37.67.443 > 10.0.2.15.45754: Flags [P.], seq 948061:952045, ack 867, win 65535, length 3984
16:28:37.321340 IP 199.232.37.67.443 > 10.0.2.15.45754: Flags [P.], seq 952045:956029, ack 867, win 65535, length 3984
16:28:37.321342 IP 199.232.37.67.443 > 10.0.2.15.45754: Flags [P.], seq 956029:957357, ack 867, win 65535, length 1328
16:28:37.321518 IP 199.232.37.67.443 > 10.0.2.15.45754: Flags [P.], seq 957357:960013, ack 867, win 65535, length 2656
16:28:37.321520 IP 199.232.37.67.443 > 10.0.2.15.45754: Flags [P.], seq 960013:962669, ack 867, win 65535, length 2656
16:28:37.322008 IP 199.232.37.67.443 > 10.0.2.15.45754: Flags [P.], seq 962669:966653, ack 867, win 65535, length 3984
16:28:37.322010 IP 199.232.37.67.443 > 10.0.2.15.45754: Flags [P.], seq 966653:967981, ack 867, win 65535, length 1328
16:28:37.322295 IP 199.232.37.67.443 > 10.0.2.15.45754: Flags [P.], seq 967981:969309, ack 867, win 65535, length 1328
16:28:37.322297 IP 199.232.37.67.443 > 10.0.2.15.45754: Flags [P.], seq 969309:971965, ack 867, win 65535, length 2656
16:28:37.322812 IP 199.232.37.67.443 > 10.0.2.15.45754: Flags [P.], seq 971965:974621, ack 867, win 65535, length 2656
16:28:37.322815 IP 199.232.37.67.443 > 10.0.2.15.45754: Flags [P.], seq 974621:975949, ack 867, win 65535, length 1328
16:28:37.323810 IP 10.0.2.15.45754 > 199.232.37.67.443: Flags [.], ack 975949, win 65535, length 0
16:28:37.324275 IP 199.232.37.67.443 > 10.0.2.15.45754: Flags [P.], seq 975949:991885, ack 867, win 65535, length 15936
16:28:37.324335 IP 199.232.37.67.443 > 10.0.2.15.45754: Flags [P.], seq 991885:994541, ack 867, win 65535, length 2656
16:28:37.324336 IP 199.232.37.67.443 > 10.0.2.15.45754: Flags [P.], seq 994541:995869, ack 867, win 65535, length 1328
16:28:37.324630 IP 199.232.37.67.443 > 10.0.2.15.45754: Flags [P.], seq 995869:997197, ack 867, win 65535, length 1328
16:28:37.324633 IP 199.232.37.67.443 > 10.0.2.15.45754: Flags [P.], seq 997197:1001181, ack 867, win 65535, length 3984
16:28:37.324634 IP 199.232.37.67.443 > 10.0.2.15.45754: Flags [P.], seq 1001181:1002509, ack 867, win 65535, length 1328
16:28:37.324814 IP 199.232.37.67.443 > 10.0.2.15.45754: Flags [P.], seq 1002509:1005165, ack 867, win 65535, length 2656
16:28:37.325068 IP 199.232.37.67.443 > 10.0.2.15.45754: Flags [P.], seq 1005165:1006493, ack 867, win 65535, length 1328
16:28:37.325070 IP 199.232.37.67.443 > 10.0.2.15.45754: Flags [P.], seq 1006493:1007821, ack 867, win 65535, length 1328
16:28:37.325102 IP 10.0.2.15.45754 > 199.232.37.67.443: Flags [.], ack 1005165, win 65535, length 0
16:28:37.325146 IP 10.0.2.15.45754 > 199.232.37.67.443: Flags [.], ack 1007821, win 65535, length 0
16:28:37.325300 IP 199.232.37.67.443 > 10.0.2.15.45754: Flags [P.], seq 1007821:1011805, ack 867, win 65535, length 3984
16:28:37.325928 IP 10.0.2.15.45754 > 199.232.37.67.443: Flags [.], ack 1011805, win 65535, length 0
16:28:37.327495 IP 199.232.37.67.443 > 10.0.2.15.45754: Flags [P.], seq 1011805:1014461, ack 867, win 65535, length 2656
16:28:37.327498 IP 199.232.37.67.443 > 10.0.2.15.45754: Flags [P.], seq 1014461:1018445, ack 867, win 65535, length 3984
16:28:37.327576 IP 10.0.2.15.45754 > 199.232.37.67.443: Flags [.], ack 1018445, win 65535, length 0
16:28:37.327977 IP 199.232.37.67.443 > 10.0.2.15.45754: Flags [P.], seq 1018445:1019773, ack 867, win 65535, length 1328
16:28:37.327980 IP 199.232.37.67.443 > 10.0.2.15.45754: Flags [P.], seq 1019773:1021101, ack 867, win 65535, length 1328
16:28:37.327980 IP 199.232.37.67.443 > 10.0.2.15.45754: Flags [P.], seq 1021101:1022429, ack 867, win 65535, length 1328
16:28:37.327981 IP 199.232.37.67.443 > 10.0.2.15.45754: Flags [P.], seq 1022429:1023757, ack 867, win 65535, length 1328
16:28:37.327982 IP 199.232.37.67.443 > 10.0.2.15.45754: Flags [P.], seq 1023757:1025085, ack 867, win 65535, length 1328
16:28:37.328163 IP 199.232.37.67.443 > 10.0.2.15.45754: Flags [P.], seq 1025085:1029069, ack 867, win 65535, length 3984
16:28:37.328165 IP 199.232.37.67.443 > 10.0.2.15.45754: Flags [P.], seq 1029069:1035709, ack 867, win 65535, length 6640
16:28:37.328179 IP 199.232.37.67.443 > 10.0.2.15.45754: Flags [P.], seq 1035709:1039693, ack 867, win 65535, length 3984
16:28:37.328180 IP 199.232.37.67.443 > 10.0.2.15.45754: Flags [P.], seq 1039693:1046333, ack 867, win 65535, length 6640
16:28:37.328203 IP 199.232.37.67.443 > 10.0.2.15.45754: Flags [P.], seq 1046333:1047661, ack 867, win 65535, length 1328
16:28:37.328385 IP 10.0.2.15.45754 > 199.232.37.67.443: Flags [.], ack 1047661, win 65535, length 0
16:28:37.329645 IP 199.232.37.67.443 > 10.0.2.15.45754: Flags [P.], seq 1047661:1048989, ack 867, win 65535, length 1328
16:28:37.329648 IP 199.232.37.67.443 > 10.0.2.15.45754: Flags [P.], seq 1048989:1051645, ack 867, win 65535, length 2656
16:28:37.329649 IP 199.232.37.67.443 > 10.0.2.15.45754: Flags [P.], seq 1051645:1054301, ack 867, win 65535, length 2656
16:28:37.329650 IP 199.232.37.67.443 > 10.0.2.15.45754: Flags [P.], seq 1054301:1055629, ack 867, win 65535, length 1328
16:28:37.329686 IP 10.0.2.15.45754 > 199.232.37.67.443: Flags [.], ack 1051645, win 65535, length 0
16:28:37.329962 IP 199.232.37.67.443 > 10.0.2.15.45754: Flags [P.], seq 1055629:1056957, ack 867, win 65535, length 1328
16:28:37.329964 IP 199.232.37.67.443 > 10.0.2.15.45754: Flags [P.], seq 1056957:1058285, ack 867, win 65535, length 1328
16:28:37.329965 IP 199.232.37.67.443 > 10.0.2.15.45754: Flags [P.], seq 1058285:1060941, ack 867, win 65535, length 2656
16:28:37.330047 IP 10.0.2.15.45754 > 199.232.37.67.443: Flags [.], ack 1060941, win 65535, length 0
16:28:37.330264 IP 199.232.37.67.443 > 10.0.2.15.45754: Flags [P.], seq 1060941:1062269, ack 867, win 65535, length 1328
16:28:37.330266 IP 199.232.37.67.443 > 10.0.2.15.45754: Flags [P.], seq 1062269:1066253, ack 867, win 65535, length 3984
16:28:37.330342 IP 10.0.2.15.45754 > 199.232.37.67.443: Flags [.], ack 1066253, win 65535, length 0
16:28:37.336744 IP 199.232.37.67.443 > 10.0.2.15.45754: Flags [P.], seq 1066253:1068909, ack 867, win 65535, length 2656
16:28:37.336747 IP 199.232.37.67.443 > 10.0.2.15.45754: Flags [P.], seq 1068909:1072893, ack 867, win 65535, length 3984
16:28:37.336774 IP 10.0.2.15.45754 > 199.232.37.67.443: Flags [.], ack 1068909, win 65535, length 0
16:28:37.337332 IP 199.232.37.67.443 > 10.0.2.15.45754: Flags [P.], seq 1072893:1076877, ack 867, win 65535, length 3984
16:28:37.337891 IP 199.232.37.67.443 > 10.0.2.15.45754: Flags [P.], seq 1076877:1082189, ack 867, win 65535, length 5312
16:28:37.337895 IP 199.232.37.67.443 > 10.0.2.15.45754: Flags [.], seq 1082189:1090949, ack 867, win 65535, length 8760
16:28:37.337940 IP 10.0.2.15.45754 > 199.232.37.67.443: Flags [.], ack 1076877, win 65535, length 0
16:28:37.338319 IP 199.232.37.67.443 > 10.0.2.15.45754: Flags [P.], seq 1090949:1096797, ack 867, win 65535, length 5848
16:28:37.338577 IP 199.232.37.67.443 > 10.0.2.15.45754: Flags [P.], seq 1096797:1099453, ack 867, win 65535, length 2656
16:28:37.338581 IP 199.232.37.67.443 > 10.0.2.15.45754: Flags [P.], seq 1099453:1110077, ack 867, win 65535, length 10624
16:28:37.339927 IP 10.0.2.15.45754 > 199.232.37.67.443: Flags [.], ack 1110077, win 65535, length 0
16:28:37.340545 IP 199.232.37.67.443 > 10.0.2.15.45754: Flags [P.], seq 1110077:1123357, ack 867, win 65535, length 13280
16:28:37.340564 IP 10.0.2.15.45754 > 199.232.37.67.443: Flags [.], ack 1123357, win 65535, length 0
16:28:37.340933 IP 199.232.37.67.443 > 10.0.2.15.45754: Flags [P.], seq 1123357:1124431, ack 867, win 65535, length 1074
16:28:37.346445 IP 10.0.2.15.45754 > 199.232.37.67.443: Flags [P.], seq 867:898, ack 1124431, win 65535, length 31
16:28:37.347217 IP 199.232.37.67.443 > 10.0.2.15.45754: Flags [.], ack 898, win 65535, length 0
16:28:37.347534 IP 10.0.2.15.45754 > 199.232.37.67.443: Flags [F.], seq 898, ack 1124431, win 65535, length 0
16:28:37.347699 IP 199.232.37.67.443 > 10.0.2.15.45754: Flags [.], ack 899, win 65535, length 0
16:28:37.358636 IP 199.232.37.67.443 > 10.0.2.15.45754: Flags [P.], seq 1124431:1124462, ack 899, win 65535, length 31
16:28:37.358639 IP 199.232.37.67.443 > 10.0.2.15.45754: Flags [F.], seq 1124462, ack 899, win 65535, length 0
16:28:37.358666 IP 10.0.2.15.45754 > 199.232.37.67.443: Flags [R], seq 2735654983, win 0, length 0
16:28:37.358701 IP 10.0.2.15.45754 > 199.232.37.67.443: Flags [R], seq 2735654983, win 0, length 0
16:28:37.359058 IP 199.232.37.67.443 > 10.0.2.15.45754: Flags [R.], seq 4271415295, ack 899, win 0, length 0

