22:55:13.877528 IP 10.0.2.15.42039 > 140.233.253.2.53: 6407+ A? www.discord.com. (33)
22:55:13.877569 IP 10.0.2.15.42039 > 140.233.253.2.53: 13834+ AAAA? www.discord.com. (33)
22:55:13.884281 IP 140.233.253.2.53 > 10.0.2.15.42039: 6407 5/0/0 A 162.159.137.232, A 162.159.135.232, A 162.159.136.232, A 162.159.128.233, A 162.159.138.232 (113)
22:55:13.884284 IP 140.233.253.2.53 > 10.0.2.15.42039: 13834 0/1/0 (92)
22:55:13.884767 IP 10.0.2.15.38030 > 162.159.137.232.443: Flags [S], seq 6908280, win 64240, options [mss 1460,sackOK,TS val 3508328931 ecr 0,nop,wscale 6], length 0
22:55:13.897791 IP 162.159.137.232.443 > 10.0.2.15.38030: Flags [S.], seq 387328001, ack 6908281, win 65535, options [mss 1460], length 0
22:55:13.897842 IP 10.0.2.15.38030 > 162.159.137.232.443: Flags [.], ack 1, win 64240, length 0
22:55:13.905106 IP 10.0.2.15.38030 > 162.159.137.232.443: Flags [P.], seq 1:518, ack 1, win 64240, length 517
22:55:13.905492 IP 162.159.137.232.443 > 10.0.2.15.38030: Flags [.], ack 518, win 65535, length 0
22:55:13.920663 IP 162.159.137.232.443 > 10.0.2.15.38030: Flags [P.], seq 1:2510, ack 518, win 65535, length 2509
22:55:13.920685 IP 10.0.2.15.38030 > 162.159.137.232.443: Flags [.], ack 2510, win 62780, length 0
22:55:13.922497 IP 10.0.2.15.38030 > 162.159.137.232.443: Flags [P.], seq 518:598, ack 2510, win 62780, length 80
22:55:13.922737 IP 10.0.2.15.38030 > 162.159.137.232.443: Flags [P.], seq 598:644, ack 2510, win 62780, length 46
22:55:13.922803 IP 162.159.137.232.443 > 10.0.2.15.38030: Flags [.], ack 598, win 65535, length 0
22:55:13.922855 IP 10.0.2.15.38030 > 162.159.137.232.443: Flags [P.], seq 644:693, ack 2510, win 62780, length 49
22:55:13.922993 IP 162.159.137.232.443 > 10.0.2.15.38030: Flags [.], ack 644, win 65535, length 0
22:55:13.923004 IP 10.0.2.15.38030 > 162.159.137.232.443: Flags [P.], seq 693:728, ack 2510, win 62780, length 35
22:55:13.923100 IP 10.0.2.15.38030 > 162.159.137.232.443: Flags [P.], seq 728:790, ack 2510, win 62780, length 62
22:55:13.923260 IP 162.159.137.232.443 > 10.0.2.15.38030: Flags [.], ack 693, win 65535, length 0
22:55:13.923372 IP 162.159.137.232.443 > 10.0.2.15.38030: Flags [.], ack 728, win 65535, length 0
22:55:13.923373 IP 162.159.137.232.443 > 10.0.2.15.38030: Flags [.], ack 790, win 65535, length 0
22:55:13.934703 IP 162.159.137.232.443 > 10.0.2.15.38030: Flags [P.], seq 2510:3101, ack 790, win 65535, length 591
22:55:13.934780 IP 10.0.2.15.38030 > 162.159.137.232.443: Flags [.], ack 3101, win 62780, length 0
22:55:13.935293 IP 10.0.2.15.38030 > 162.159.137.232.443: Flags [P.], seq 790:821, ack 3101, win 62780, length 31
22:55:13.935618 IP 162.159.137.232.443 > 10.0.2.15.38030: Flags [.], ack 821, win 65535, length 0
22:55:13.944870 IP 162.159.137.232.443 > 10.0.2.15.38030: Flags [P.], seq 3101:3746, ack 821, win 65535, length 645
22:55:13.944892 IP 10.0.2.15.38030 > 162.159.137.232.443: Flags [.], ack 3746, win 62780, length 0
22:55:13.945629 IP 10.0.2.15.38030 > 162.159.137.232.443: Flags [P.], seq 821:845, ack 3746, win 62780, length 24
22:55:13.946024 IP 162.159.137.232.443 > 10.0.2.15.38030: Flags [.], ack 845, win 65535, length 0
22:55:13.946829 IP 10.0.2.15.38030 > 162.159.137.232.443: Flags [F.], seq 845, ack 3746, win 62780, length 0
22:55:13.947124 IP 162.159.137.232.443 > 10.0.2.15.38030: Flags [.], ack 846, win 65535, length 0
22:55:13.957566 IP 162.159.137.232.443 > 10.0.2.15.38030: Flags [F.], seq 3746, ack 846, win 65535, length 0
22:55:13.957589 IP 10.0.2.15.38030 > 162.159.137.232.443: Flags [.], ack 3747, win 62780, length 0

