22:54:53.026558 IP 10.0.2.15.47073 > 140.233.253.2.53: 14061+ A? www.discord.com. (33)
22:54:53.026604 IP 10.0.2.15.47073 > 140.233.253.2.53: 58384+ AAAA? www.discord.com. (33)
22:54:53.032446 IP 140.233.253.2.53 > 10.0.2.15.47073: 58384 0/1/0 (92)
22:54:53.032448 IP 140.233.253.2.53 > 10.0.2.15.47073: 14061 5/0/0 A 162.159.135.232, A 162.159.136.232, A 162.159.128.233, A 162.159.138.232, A 162.159.137.232 (113)
22:54:53.032799 IP 10.0.2.15.33572 > 162.159.135.232.443: Flags [S], seq 3892410238, win 64240, options [mss 1460,sackOK,TS val 3821330163 ecr 0,nop,wscale 6], length 0
22:54:53.045425 IP 162.159.135.232.443 > 10.0.2.15.33572: Flags [S.], seq 386816001, ack 3892410239, win 65535, options [mss 1460], length 0
22:54:53.045546 IP 10.0.2.15.33572 > 162.159.135.232.443: Flags [.], ack 1, win 64240, length 0
22:54:53.053003 IP 10.0.2.15.33572 > 162.159.135.232.443: Flags [P.], seq 1:518, ack 1, win 64240, length 517
22:54:53.053461 IP 162.159.135.232.443 > 10.0.2.15.33572: Flags [.], ack 518, win 65535, length 0
22:54:53.067816 IP 162.159.135.232.443 > 10.0.2.15.33572: Flags [P.], seq 1:1387, ack 518, win 65535, length 1386
22:54:53.067842 IP 10.0.2.15.33572 > 162.159.135.232.443: Flags [.], ack 1387, win 63756, length 0
22:54:53.070037 IP 162.159.135.232.443 > 10.0.2.15.33572: Flags [P.], seq 1387:2510, ack 518, win 65535, length 1123
22:54:53.070059 IP 10.0.2.15.33572 > 162.159.135.232.443: Flags [.], ack 2510, win 63756, length 0
22:54:53.072013 IP 10.0.2.15.33572 > 162.159.135.232.443: Flags [P.], seq 518:598, ack 2510, win 63756, length 80
22:54:53.072374 IP 162.159.135.232.443 > 10.0.2.15.33572: Flags [.], ack 598, win 65535, length 0
22:54:53.072441 IP 10.0.2.15.33572 > 162.159.135.232.443: Flags [P.], seq 598:644, ack 2510, win 63756, length 46
22:54:53.072473 IP 10.0.2.15.33572 > 162.159.135.232.443: Flags [P.], seq 644:693, ack 2510, win 63756, length 49
22:54:53.072648 IP 162.159.135.232.443 > 10.0.2.15.33572: Flags [.], ack 644, win 65535, length 0
22:54:53.072688 IP 10.0.2.15.33572 > 162.159.135.232.443: Flags [P.], seq 693:790, ack 2510, win 63756, length 97
22:54:53.072793 IP 162.159.135.232.443 > 10.0.2.15.33572: Flags [.], ack 693, win 65535, length 0
22:54:53.072793 IP 162.159.135.232.443 > 10.0.2.15.33572: Flags [.], ack 790, win 65535, length 0
22:54:53.083949 IP 162.159.135.232.443 > 10.0.2.15.33572: Flags [P.], seq 2510:3101, ack 790, win 65535, length 591
22:54:53.083972 IP 10.0.2.15.33572 > 162.159.135.232.443: Flags [.], ack 3101, win 63756, length 0
22:54:53.084395 IP 10.0.2.15.33572 > 162.159.135.232.443: Flags [P.], seq 790:821, ack 3101, win 63756, length 31
22:54:53.084813 IP 162.159.135.232.443 > 10.0.2.15.33572: Flags [.], ack 821, win 65535, length 0
22:54:53.093642 IP 162.159.135.232.443 > 10.0.2.15.33572: Flags [P.], seq 3101:3735, ack 821, win 65535, length 634
22:54:53.093666 IP 10.0.2.15.33572 > 162.159.135.232.443: Flags [.], ack 3735, win 63756, length 0
22:54:53.094224 IP 10.0.2.15.33572 > 162.159.135.232.443: Flags [P.], seq 821:845, ack 3735, win 63756, length 24
22:54:53.094541 IP 162.159.135.232.443 > 10.0.2.15.33572: Flags [.], ack 845, win 65535, length 0
22:54:53.095695 IP 10.0.2.15.33572 > 162.159.135.232.443: Flags [F.], seq 845, ack 3735, win 63756, length 0
22:54:53.096021 IP 162.159.135.232.443 > 10.0.2.15.33572: Flags [.], ack 846, win 65535, length 0
22:54:53.105972 IP 162.159.135.232.443 > 10.0.2.15.33572: Flags [F.], seq 3735, ack 846, win 65535, length 0
22:54:53.105993 IP 10.0.2.15.33572 > 162.159.135.232.443: Flags [.], ack 3736, win 63756, length 0

