22:53:44.081154 IP 10.0.2.15.45849 > 140.233.253.2.53: 55511+ A? www.discord.com. (33)
22:53:44.081194 IP 10.0.2.15.45849 > 140.233.253.2.53: 8144+ AAAA? www.discord.com. (33)
22:53:44.086580 IP 140.233.253.2.53 > 10.0.2.15.45849: 8144 0/1/0 (92)
22:53:44.087257 IP 140.233.253.2.53 > 10.0.2.15.45849: 55511 5/0/0 A 162.159.128.233, A 162.159.138.232, A 162.159.137.232, A 162.159.135.232, A 162.159.136.232 (113)
22:53:44.087751 IP 10.0.2.15.33498 > 162.159.128.233.443: Flags [S], seq 2202025939, win 64240, options [mss 1460,sackOK,TS val 2460963245 ecr 0,nop,wscale 6], length 0
22:53:44.101369 IP 162.159.128.233.443 > 10.0.2.15.33498: Flags [S.], seq 385152001, ack 2202025940, win 65535, options [mss 1460], length 0
22:53:44.101571 IP 10.0.2.15.33498 > 162.159.128.233.443: Flags [.], ack 1, win 64240, length 0
22:53:44.112361 IP 10.0.2.15.33498 > 162.159.128.233.443: Flags [P.], seq 1:518, ack 1, win 64240, length 517
22:53:44.112772 IP 162.159.128.233.443 > 10.0.2.15.33498: Flags [.], ack 518, win 65535, length 0
22:53:44.127161 IP 162.159.128.233.443 > 10.0.2.15.33498: Flags [P.], seq 1:1387, ack 518, win 65535, length 1386
22:53:44.127181 IP 10.0.2.15.33498 > 162.159.128.233.443: Flags [.], ack 1387, win 63756, length 0
22:53:44.129334 IP 162.159.128.233.443 > 10.0.2.15.33498: Flags [P.], seq 1387:2510, ack 518, win 65535, length 1123
22:53:44.129353 IP 10.0.2.15.33498 > 162.159.128.233.443: Flags [.], ack 2510, win 63756, length 0
22:53:44.130497 IP 10.0.2.15.33498 > 162.159.128.233.443: Flags [P.], seq 518:598, ack 2510, win 63756, length 80
22:53:44.130714 IP 162.159.128.233.443 > 10.0.2.15.33498: Flags [.], ack 598, win 65535, length 0
22:53:44.130766 IP 10.0.2.15.33498 > 162.159.128.233.443: Flags [P.], seq 598:644, ack 2510, win 63756, length 46
22:53:44.130793 IP 10.0.2.15.33498 > 162.159.128.233.443: Flags [P.], seq 644:693, ack 2510, win 63756, length 49
22:53:44.131021 IP 162.159.128.233.443 > 10.0.2.15.33498: Flags [.], ack 644, win 65535, length 0
22:53:44.131023 IP 162.159.128.233.443 > 10.0.2.15.33498: Flags [.], ack 693, win 65535, length 0
22:53:44.131127 IP 10.0.2.15.33498 > 162.159.128.233.443: Flags [P.], seq 693:728, ack 2510, win 63756, length 35
22:53:44.131190 IP 10.0.2.15.33498 > 162.159.128.233.443: Flags [P.], seq 728:790, ack 2510, win 63756, length 62
22:53:44.131379 IP 162.159.128.233.443 > 10.0.2.15.33498: Flags [.], ack 728, win 65535, length 0
22:53:44.131380 IP 162.159.128.233.443 > 10.0.2.15.33498: Flags [.], ack 790, win 65535, length 0
22:53:44.141071 IP 162.159.128.233.443 > 10.0.2.15.33498: Flags [P.], seq 2510:3070, ack 790, win 65535, length 560
22:53:44.141226 IP 10.0.2.15.33498 > 162.159.128.233.443: Flags [.], ack 3070, win 63756, length 0
22:53:44.142801 IP 10.0.2.15.33498 > 162.159.128.233.443: Flags [P.], seq 790:821, ack 3070, win 63756, length 31
22:53:44.143979 IP 162.159.128.233.443 > 10.0.2.15.33498: Flags [P.], seq 3070:3101, ack 790, win 65535, length 31
22:53:44.143981 IP 162.159.128.233.443 > 10.0.2.15.33498: Flags [.], ack 821, win 65535, length 0
22:53:44.144002 IP 10.0.2.15.33498 > 162.159.128.233.443: Flags [.], ack 3101, win 63756, length 0

