22:56:17.683568 IP 10.0.2.15.41615 > 140.233.253.2.53: 42196+ A? www.discord.com. (33)
22:56:17.683611 IP 10.0.2.15.41615 > 140.233.253.2.53: 43479+ AAAA? www.discord.com. (33)
22:56:17.688433 IP 140.233.253.2.53 > 10.0.2.15.41615: 42196 5/0/0 A 162.159.136.232, A 162.159.128.233, A 162.159.138.232, A 162.159.137.232, A 162.159.135.232 (113)
22:56:17.688435 IP 140.233.253.2.53 > 10.0.2.15.41615: 43479 0/1/0 (92)
22:56:17.688888 IP 10.0.2.15.40608 > 162.159.136.232.443: Flags [S], seq 2611024462, win 64240, options [mss 1460,sackOK,TS val 1461354941 ecr 0,nop,wscale 6], length 0
22:56:17.701486 IP 162.159.136.232.443 > 10.0.2.15.40608: Flags [S.], seq 388864001, ack 2611024463, win 65535, options [mss 1460], length 0
22:56:17.701523 IP 10.0.2.15.40608 > 162.159.136.232.443: Flags [.], ack 1, win 64240, length 0
22:56:17.709231 IP 10.0.2.15.40608 > 162.159.136.232.443: Flags [P.], seq 1:518, ack 1, win 64240, length 517
22:56:17.709549 IP 162.159.136.232.443 > 10.0.2.15.40608: Flags [.], ack 518, win 65535, length 0
22:56:17.724648 IP 162.159.136.232.443 > 10.0.2.15.40608: Flags [P.], seq 1:2510, ack 518, win 65535, length 2509
22:56:17.724670 IP 10.0.2.15.40608 > 162.159.136.232.443: Flags [.], ack 2510, win 62780, length 0
22:56:17.726185 IP 10.0.2.15.40608 > 162.159.136.232.443: Flags [P.], seq 518:598, ack 2510, win 62780, length 80
22:56:17.726555 IP 162.159.136.232.443 > 10.0.2.15.40608: Flags [.], ack 598, win 65535, length 0
22:56:17.726637 IP 10.0.2.15.40608 > 162.159.136.232.443: Flags [P.], seq 598:644, ack 2510, win 62780, length 46
22:56:17.726667 IP 10.0.2.15.40608 > 162.159.136.232.443: Flags [P.], seq 644:693, ack 2510, win 62780, length 49
22:56:17.726859 IP 10.0.2.15.40608 > 162.159.136.232.443: Flags [P.], seq 693:790, ack 2510, win 62780, length 97
22:56:17.726943 IP 162.159.136.232.443 > 10.0.2.15.40608: Flags [.], ack 644, win 65535, length 0
22:56:17.727038 IP 162.159.136.232.443 > 10.0.2.15.40608: Flags [.], ack 693, win 65535, length 0
22:56:17.727038 IP 162.159.136.232.443 > 10.0.2.15.40608: Flags [.], ack 790, win 65535, length 0
22:56:17.740753 IP 162.159.136.232.443 > 10.0.2.15.40608: Flags [P.], seq 2510:3079, ack 790, win 65535, length 569
22:56:17.740773 IP 10.0.2.15.40608 > 162.159.136.232.443: Flags [.], ack 3079, win 62780, length 0
22:56:17.741107 IP 10.0.2.15.40608 > 162.159.136.232.443: Flags [P.], seq 790:821, ack 3079, win 62780, length 31
22:56:17.741378 IP 162.159.136.232.443 > 10.0.2.15.40608: Flags [.], ack 821, win 65535, length 0
22:56:17.762133 IP 162.159.136.232.443 > 10.0.2.15.40608: Flags [P.], seq 3079:3720, ack 821, win 65535, length 641
22:56:17.762156 IP 10.0.2.15.40608 > 162.159.136.232.443: Flags [.], ack 3720, win 62780, length 0
22:56:17.762751 IP 10.0.2.15.40608 > 162.159.136.232.443: Flags [P.], seq 821:845, ack 3720, win 62780, length 24
22:56:17.763104 IP 162.159.136.232.443 > 10.0.2.15.40608: Flags [.], ack 845, win 65535, length 0
22:56:17.763675 IP 10.0.2.15.40608 > 162.159.136.232.443: Flags [F.], seq 845, ack 3720, win 62780, length 0
22:56:17.764076 IP 162.159.136.232.443 > 10.0.2.15.40608: Flags [.], ack 846, win 65535, length 0

