22:52:45.950628 IP 10.0.2.15.35521 > 140.233.253.2.53: 15281+ A? www.discord.com. (33)
22:52:45.950685 IP 10.0.2.15.35521 > 140.233.253.2.53: 42429+ AAAA? www.discord.com. (33)
22:52:45.958975 IP 140.233.253.2.53 > 10.0.2.15.35521: 42429 0/1/0 (92)
22:52:45.958977 IP 140.233.253.2.53 > 10.0.2.15.35521: 15281 5/0/0 A 162.159.136.232, A 162.159.128.233, A 162.159.138.232, A 162.159.137.232, A 162.159.135.232 (113)
22:52:45.959514 IP 10.0.2.15.40590 > 162.159.136.232.443: Flags [S], seq 1172545136, win 64240, options [mss 1460,sackOK,TS val 1461143211 ecr 0,nop,wscale 6], length 0
22:52:45.972290 IP 162.159.136.232.443 > 10.0.2.15.40590: Flags [S.], seq 383744001, ack 1172545137, win 65535, options [mss 1460], length 0
22:52:45.972329 IP 10.0.2.15.40590 > 162.159.136.232.443: Flags [.], ack 1, win 64240, length 0
22:52:45.985613 IP 10.0.2.15.40590 > 162.159.136.232.443: Flags [P.], seq 1:518, ack 1, win 64240, length 517
22:52:45.986148 IP 162.159.136.232.443 > 10.0.2.15.40590: Flags [.], ack 518, win 65535, length 0
22:52:46.001244 IP 162.159.136.232.443 > 10.0.2.15.40590: Flags [P.], seq 1:1387, ack 518, win 65535, length 1386
22:52:46.001268 IP 10.0.2.15.40590 > 162.159.136.232.443: Flags [.], ack 1387, win 63756, length 0
22:52:46.003073 IP 162.159.136.232.443 > 10.0.2.15.40590: Flags [P.], seq 1387:2510, ack 518, win 65535, length 1123
22:52:46.003096 IP 10.0.2.15.40590 > 162.159.136.232.443: Flags [.], ack 2510, win 63756, length 0
22:52:46.004581 IP 10.0.2.15.40590 > 162.159.136.232.443: Flags [P.], seq 518:598, ack 2510, win 63756, length 80
22:52:46.005092 IP 162.159.136.232.443 > 10.0.2.15.40590: Flags [.], ack 598, win 65535, length 0
22:52:46.005253 IP 10.0.2.15.40590 > 162.159.136.232.443: Flags [P.], seq 598:644, ack 2510, win 63756, length 46
22:52:46.005292 IP 10.0.2.15.40590 > 162.159.136.232.443: Flags [P.], seq 644:693, ack 2510, win 63756, length 49
22:52:46.005518 IP 10.0.2.15.40590 > 162.159.136.232.443: Flags [P.], seq 693:790, ack 2510, win 63756, length 97
22:52:46.005700 IP 162.159.136.232.443 > 10.0.2.15.40590: Flags [.], ack 644, win 65535, length 0
22:52:46.005701 IP 162.159.136.232.443 > 10.0.2.15.40590: Flags [.], ack 693, win 65535, length 0
22:52:46.005701 IP 162.159.136.232.443 > 10.0.2.15.40590: Flags [.], ack 790, win 65535, length 0
22:52:46.019171 IP 162.159.136.232.443 > 10.0.2.15.40590: Flags [P.], seq 2510:3079, ack 790, win 65535, length 569
22:52:46.019191 IP 10.0.2.15.40590 > 162.159.136.232.443: Flags [.], ack 3079, win 63756, length 0
22:52:46.019591 IP 10.0.2.15.40590 > 162.159.136.232.443: Flags [P.], seq 790:821, ack 3079, win 63756, length 31
22:52:46.019901 IP 162.159.136.232.443 > 10.0.2.15.40590: Flags [.], ack 821, win 65535, length 0
22:52:46.024504 IP 162.159.136.232.443 > 10.0.2.15.40590: Flags [P.], seq 3079:3717, ack 821, win 65535, length 638
22:52:46.024571 IP 10.0.2.15.40590 > 162.159.136.232.443: Flags [.], ack 3717, win 63756, length 0
22:52:46.025145 IP 10.0.2.15.40590 > 162.159.136.232.443: Flags [P.], seq 821:845, ack 3717, win 63756, length 24
22:52:46.025565 IP 162.159.136.232.443 > 10.0.2.15.40590: Flags [.], ack 845, win 65535, length 0
22:52:46.026964 IP 10.0.2.15.40590 > 162.159.136.232.443: Flags [F.], seq 845, ack 3717, win 63756, length 0
22:52:46.027363 IP 162.159.136.232.443 > 10.0.2.15.40590: Flags [.], ack 846, win 65535, length 0
22:52:46.035993 IP 162.159.136.232.443 > 10.0.2.15.40590: Flags [F.], seq 3717, ack 846, win 65535, length 0
22:52:46.036108 IP 10.0.2.15.40590 > 162.159.136.232.443: Flags [.], ack 3718, win 63756, length 0

