22:52:24.269156 IP 10.0.2.15.51086 > 140.233.253.2.53: 5056+ A? www.discord.com. (33)
22:52:24.269196 IP 10.0.2.15.51086 > 140.233.253.2.53: 27087+ AAAA? www.discord.com. (33)
22:52:24.275999 IP 140.233.253.2.53 > 10.0.2.15.51086: 5056 5/0/0 A 162.159.128.233, A 162.159.138.232, A 162.159.137.232, A 162.159.135.232, A 162.159.136.232 (113)
22:52:24.276001 IP 140.233.253.2.53 > 10.0.2.15.51086: 27087 0/1/0 (92)
22:52:24.276438 IP 10.0.2.15.33492 > 162.159.128.233.443: Flags [S], seq 1205549639, win 64240, options [mss 1460,sackOK,TS val 2460883434 ecr 0,nop,wscale 6], length 0
22:52:24.289504 IP 162.159.128.233.443 > 10.0.2.15.33492: Flags [S.], seq 383232001, ack 1205549640, win 65535, options [mss 1460], length 0
22:52:24.289542 IP 10.0.2.15.33492 > 162.159.128.233.443: Flags [.], ack 1, win 64240, length 0
22:52:24.297294 IP 10.0.2.15.33492 > 162.159.128.233.443: Flags [P.], seq 1:518, ack 1, win 64240, length 517
22:52:24.297605 IP 162.159.128.233.443 > 10.0.2.15.33492: Flags [.], ack 518, win 65535, length 0
22:52:24.316244 IP 162.159.128.233.443 > 10.0.2.15.33492: Flags [P.], seq 1:2510, ack 518, win 65535, length 2509
22:52:24.316267 IP 10.0.2.15.33492 > 162.159.128.233.443: Flags [.], ack 2510, win 62780, length 0
22:52:24.319657 IP 10.0.2.15.33492 > 162.159.128.233.443: Flags [P.], seq 518:598, ack 2510, win 62780, length 80
22:52:24.319997 IP 162.159.128.233.443 > 10.0.2.15.33492: Flags [.], ack 598, win 65535, length 0
22:52:24.320186 IP 10.0.2.15.33492 > 162.159.128.233.443: Flags [P.], seq 598:644, ack 2510, win 62780, length 46
22:52:24.320218 IP 10.0.2.15.33492 > 162.159.128.233.443: Flags [P.], seq 644:693, ack 2510, win 62780, length 49
22:52:24.320337 IP 162.159.128.233.443 > 10.0.2.15.33492: Flags [.], ack 644, win 65535, length 0
22:52:24.320349 IP 10.0.2.15.33492 > 162.159.128.233.443: Flags [P.], seq 693:728, ack 2510, win 62780, length 35
22:52:24.320393 IP 10.0.2.15.33492 > 162.159.128.233.443: Flags [P.], seq 728:790, ack 2510, win 62780, length 62
22:52:24.320697 IP 162.159.128.233.443 > 10.0.2.15.33492: Flags [.], ack 693, win 65535, length 0
22:52:24.320698 IP 162.159.128.233.443 > 10.0.2.15.33492: Flags [.], ack 728, win 65535, length 0
22:52:24.320882 IP 162.159.128.233.443 > 10.0.2.15.33492: Flags [.], ack 790, win 65535, length 0
22:52:24.334434 IP 162.159.128.233.443 > 10.0.2.15.33492: Flags [P.], seq 2510:3079, ack 790, win 65535, length 569
22:52:24.334461 IP 10.0.2.15.33492 > 162.159.128.233.443: Flags [.], ack 3079, win 62780, length 0
22:52:24.334982 IP 10.0.2.15.33492 > 162.159.128.233.443: Flags [P.], seq 790:821, ack 3079, win 62780, length 31

