22:54:21.180417 IP 10.0.2.15.57612 > 140.233.253.2.53: 59922+ A? www.discord.com. (33)
22:54:21.180460 IP 10.0.2.15.57612 > 140.233.253.2.53: 55593+ AAAA? www.discord.com. (33)
22:54:21.185719 IP 140.233.253.2.53 > 10.0.2.15.57612: 55593 0/1/0 (92)
22:54:21.185722 IP 140.233.253.2.53 > 10.0.2.15.57612: 59922 5/0/0 A 162.159.137.232, A 162.159.135.232, A 162.159.136.232, A 162.159.128.233, A 162.159.138.232 (113)
22:54:21.186248 IP 10.0.2.15.38026 > 162.159.137.232.443: Flags [S], seq 2703050786, win 64240, options [mss 1460,sackOK,TS val 3508276233 ecr 0,nop,wscale 6], length 0
22:54:21.200977 IP 162.159.137.232.443 > 10.0.2.15.38026: Flags [S.], seq 386048001, ack 2703050787, win 65535, options [mss 1460], length 0
22:54:21.201032 IP 10.0.2.15.38026 > 162.159.137.232.443: Flags [.], ack 1, win 64240, length 0
22:54:21.216792 IP 10.0.2.15.38026 > 162.159.137.232.443: Flags [P.], seq 1:518, ack 1, win 64240, length 517
22:54:21.217403 IP 162.159.137.232.443 > 10.0.2.15.38026: Flags [.], ack 518, win 65535, length 0
22:54:21.233425 IP 162.159.137.232.443 > 10.0.2.15.38026: Flags [P.], seq 1:2509, ack 518, win 65535, length 2508
22:54:21.233451 IP 10.0.2.15.38026 > 162.159.137.232.443: Flags [.], ack 2509, win 62780, length 0
22:54:21.235600 IP 10.0.2.15.38026 > 162.159.137.232.443: Flags [P.], seq 518:598, ack 2509, win 62780, length 80
22:54:21.235944 IP 10.0.2.15.38026 > 162.159.137.232.443: Flags [P.], seq 598:644, ack 2509, win 62780, length 46
22:54:21.236032 IP 162.159.137.232.443 > 10.0.2.15.38026: Flags [.], ack 598, win 65535, length 0
22:54:21.236105 IP 10.0.2.15.38026 > 162.159.137.232.443: Flags [P.], seq 644:693, ack 2509, win 62780, length 49
22:54:21.236682 IP 162.159.137.232.443 > 10.0.2.15.38026: Flags [.], ack 644, win 65535, length 0
22:54:21.236684 IP 162.159.137.232.443 > 10.0.2.15.38026: Flags [.], ack 693, win 65535, length 0
22:54:21.236723 IP 10.0.2.15.38026 > 162.159.137.232.443: Flags [P.], seq 693:728, ack 2509, win 62780, length 35
22:54:21.236832 IP 10.0.2.15.38026 > 162.159.137.232.443: Flags [P.], seq 728:790, ack 2509, win 62780, length 62
22:54:21.237321 IP 162.159.137.232.443 > 10.0.2.15.38026: Flags [.], ack 728, win 65535, length 0
22:54:21.237324 IP 162.159.137.232.443 > 10.0.2.15.38026: Flags [.], ack 790, win 65535, length 0
22:54:21.248054 IP 162.159.137.232.443 > 10.0.2.15.38026: Flags [P.], seq 2509:3069, ack 790, win 65535, length 560
22:54:21.248116 IP 10.0.2.15.38026 > 162.159.137.232.443: Flags [.], ack 3069, win 62780, length 0
22:54:21.248593 IP 10.0.2.15.38026 > 162.159.137.232.443: Flags [P.], seq 790:821, ack 3069, win 62780, length 31
22:54:21.248942 IP 162.159.137.232.443 > 10.0.2.15.38026: Flags [.], ack 821, win 65535, length 0
22:54:21.249115 IP 162.159.137.232.443 > 10.0.2.15.38026: Flags [P.], seq 3069:3100, ack 821, win 65535, length 31
22:54:21.249125 IP 10.0.2.15.38026 > 162.159.137.232.443: Flags [.], ack 3100, win 62780, length 0
22:54:21.258147 IP 162.159.137.232.443 > 10.0.2.15.38026: Flags [P.], seq 3100:3742, ack 821, win 65535, length 642
22:54:21.258175 IP 10.0.2.15.38026 > 162.159.137.232.443: Flags [.], ack 3742, win 62780, length 0
22:54:21.258949 IP 10.0.2.15.38026 > 162.159.137.232.443: Flags [P.], seq 821:845, ack 3742, win 62780, length 24
22:54:21.259334 IP 162.159.137.232.443 > 10.0.2.15.38026: Flags [.], ack 845, win 65535, length 0
22:54:21.260533 IP 10.0.2.15.38026 > 162.159.137.232.443: Flags [F.], seq 845, ack 3742, win 62780, length 0
22:54:21.261204 IP 162.159.137.232.443 > 10.0.2.15.38026: Flags [.], ack 846, win 65535, length 0
22:54:21.270383 IP 162.159.137.232.443 > 10.0.2.15.38026: Flags [F.], seq 3742, ack 846, win 65535, length 0
22:54:21.270517 IP 10.0.2.15.38026 > 162.159.137.232.443: Flags [.], ack 3743, win 62780, length 0

