19:54:13.865342 IP 10.0.2.15.53883 > 140.233.253.2.53: 53464+ A? www.google.com. (32)
19:54:13.865382 IP 10.0.2.15.53883 > 140.233.253.2.53: 40613+ AAAA? www.google.com. (32)
19:54:13.871149 IP 140.233.253.2.53 > 10.0.2.15.53883: 53464 1/0/0 A 142.250.80.36 (48)
19:54:13.872793 IP 140.233.253.2.53 > 10.0.2.15.53883: 40613 1/0/0 AAAA 2607:f8b0:4006:80b::2004 (60)
19:54:13.873237 IP 10.0.2.15.57390 > 142.250.80.36.443: Flags [S], seq 3041889979, win 64240, options [mss 1460,sackOK,TS val 3357499823 ecr 0,nop,wscale 6], length 0
19:54:13.885885 IP 142.250.80.36.443 > 10.0.2.15.57390: Flags [S.], seq 203712001, ack 3041889980, win 65535, options [mss 1460], length 0
19:54:13.885938 IP 10.0.2.15.57390 > 142.250.80.36.443: Flags [.], ack 1, win 64240, length 0
19:54:13.893278 IP 10.0.2.15.57390 > 142.250.80.36.443: Flags [P.], seq 1:518, ack 1, win 64240, length 517
19:54:13.893522 IP 142.250.80.36.443 > 10.0.2.15.57390: Flags [.], ack 518, win 65535, length 0
19:54:13.914531 IP 142.250.80.36.443 > 10.0.2.15.57390: Flags [P.], seq 1:1375, ack 518, win 65535, length 1374
19:54:13.914554 IP 10.0.2.15.57390 > 142.250.80.36.443: Flags [.], ack 1375, win 63204, length 0
19:54:13.915520 IP 142.250.80.36.443 > 10.0.2.15.57390: Flags [P.], seq 1375:2749, ack 518, win 65535, length 1374
19:54:13.915539 IP 10.0.2.15.57390 > 142.250.80.36.443: Flags [.], ack 2749, win 63204, length 0
19:54:13.917015 IP 142.250.80.36.443 > 10.0.2.15.57390: Flags [P.], seq 2749:4305, ack 518, win 65535, length 1556
19:54:13.917040 IP 10.0.2.15.57390 > 142.250.80.36.443: Flags [.], ack 4305, win 63204, length 0
19:54:13.918256 IP 10.0.2.15.57390 > 142.250.80.36.443: Flags [P.], seq 518:598, ack 4305, win 63204, length 80
19:54:13.918475 IP 10.0.2.15.57390 > 142.250.80.36.443: Flags [P.], seq 598:644, ack 4305, win 63204, length 46
19:54:13.918532 IP 142.250.80.36.443 > 10.0.2.15.57390: Flags [.], ack 598, win 65535, length 0
19:54:13.918576 IP 10.0.2.15.57390 > 142.250.80.36.443: Flags [P.], seq 644:693, ack 4305, win 63204, length 49
19:54:13.918758 IP 142.250.80.36.443 > 10.0.2.15.57390: Flags [.], ack 644, win 65535, length 0
19:54:13.918759 IP 142.250.80.36.443 > 10.0.2.15.57390: Flags [.], ack 693, win 65535, length 0
19:54:13.918776 IP 10.0.2.15.57390 > 142.250.80.36.443: Flags [P.], seq 693:728, ack 4305, win 63204, length 35
19:54:13.919059 IP 142.250.80.36.443 > 10.0.2.15.57390: Flags [.], ack 728, win 65535, length 0
19:54:13.919115 IP 10.0.2.15.57390 > 142.250.80.36.443: Flags [P.], seq 728:790, ack 4305, win 63204, length 62
19:54:13.919380 IP 142.250.80.36.443 > 10.0.2.15.57390: Flags [.], ack 790, win 65535, length 0
19:54:13.931752 IP 142.250.80.36.443 > 10.0.2.15.57390: Flags [P.], seq 4305:4947, ack 790, win 65535, length 642
19:54:13.931775 IP 10.0.2.15.57390 > 142.250.80.36.443: Flags [.], ack 4947, win 63204, length 0
19:54:13.932202 IP 10.0.2.15.57390 > 142.250.80.36.443: Flags [P.], seq 790:821, ack 4947, win 63204, length 31
19:54:13.932530 IP 142.250.80.36.443 > 10.0.2.15.57390: Flags [.], ack 821, win 65535, length 0
19:54:13.932645 IP 142.250.80.36.443 > 10.0.2.15.57390: Flags [P.], seq 4947:4978, ack 821, win 65535, length 31
19:54:13.932655 IP 10.0.2.15.57390 > 142.250.80.36.443: Flags [.], ack 4978, win 63204, length 0

