19:49:50.026619 IP 10.0.2.15.60263 > 140.233.253.2.53: 36805+ A? www.google.com. (32)
19:49:50.026649 IP 10.0.2.15.60263 > 140.233.253.2.53: 19961+ AAAA? www.google.com. (32)
19:49:50.032579 IP 140.233.253.2.53 > 10.0.2.15.60263: 36805 1/0/0 A 142.250.80.36 (48)
19:49:50.032581 IP 140.233.253.2.53 > 10.0.2.15.60263: 19961 1/0/0 AAAA 2607:f8b0:4006:80b::2004 (60)
19:49:50.032977 IP 10.0.2.15.57286 > 142.250.80.36.443: Flags [S], seq 2470363709, win 64240, options [mss 1460,sackOK,TS val 3357235983 ecr 0,nop,wscale 6], length 0
19:49:50.046175 IP 142.250.80.36.443 > 10.0.2.15.57286: Flags [S.], seq 197568001, ack 2470363710, win 65535, options [mss 1460], length 0
19:49:50.046220 IP 10.0.2.15.57286 > 142.250.80.36.443: Flags [.], ack 1, win 64240, length 0
19:49:50.053633 IP 10.0.2.15.57286 > 142.250.80.36.443: Flags [P.], seq 1:518, ack 1, win 64240, length 517
19:49:50.053945 IP 142.250.80.36.443 > 10.0.2.15.57286: Flags [.], ack 518, win 65535, length 0
19:49:50.075120 IP 142.250.80.36.443 > 10.0.2.15.57286: Flags [.], seq 1:2921, ack 518, win 65535, length 2920
19:49:50.075142 IP 10.0.2.15.57286 > 142.250.80.36.443: Flags [.], ack 2921, win 62780, length 0
19:49:50.075483 IP 142.250.80.36.443 > 10.0.2.15.57286: Flags [P.], seq 2921:4123, ack 518, win 65535, length 1202
19:49:50.075511 IP 10.0.2.15.57286 > 142.250.80.36.443: Flags [.], ack 4123, win 61578, length 0
19:49:50.075684 IP 142.250.80.36.443 > 10.0.2.15.57286: Flags [P.], seq 4123:4304, ack 518, win 65535, length 181
19:49:50.075696 IP 10.0.2.15.57286 > 142.250.80.36.443: Flags [.], ack 4304, win 61578, length 0
19:49:50.077532 IP 10.0.2.15.57286 > 142.250.80.36.443: Flags [P.], seq 518:598, ack 4304, win 62780, length 80
19:49:50.077942 IP 142.250.80.36.443 > 10.0.2.15.57286: Flags [.], ack 598, win 65535, length 0
19:49:50.078021 IP 10.0.2.15.57286 > 142.250.80.36.443: Flags [P.], seq 598:644, ack 4304, win 62780, length 46
19:49:50.078050 IP 10.0.2.15.57286 > 142.250.80.36.443: Flags [P.], seq 644:693, ack 4304, win 62780, length 49
19:49:50.078393 IP 142.250.80.36.443 > 10.0.2.15.57286: Flags [.], ack 644, win 65535, length 0
19:49:50.078395 IP 142.250.80.36.443 > 10.0.2.15.57286: Flags [.], ack 693, win 65535, length 0
19:49:50.078418 IP 10.0.2.15.57286 > 142.250.80.36.443: Flags [P.], seq 693:790, ack 4304, win 62780, length 97
19:49:50.078588 IP 142.250.80.36.443 > 10.0.2.15.57286: Flags [.], ack 790, win 65535, length 0

