19:53:18.247497 IP 10.0.2.15.54014 > 140.233.253.2.53: 55309+ A? www.google.com. (32)
19:53:18.247790 IP 10.0.2.15.54014 > 140.233.253.2.53: 58121+ AAAA? www.google.com. (32)
19:53:18.253141 IP 140.233.253.2.53 > 10.0.2.15.54014: 55309 1/0/0 A 142.250.80.36 (48)
19:53:18.253144 IP 140.233.253.2.53 > 10.0.2.15.54014: 58121 1/0/0 AAAA 2607:f8b0:4006:80b::2004 (60)
19:53:18.253794 IP 10.0.2.15.57366 > 142.250.80.36.443: Flags [S], seq 787107540, win 64240, options [mss 1460,sackOK,TS val 3357444203 ecr 0,nop,wscale 6], length 0
19:53:18.268844 IP 142.250.80.36.443 > 10.0.2.15.57366: Flags [S.], seq 202432001, ack 787107541, win 65535, options [mss 1460], length 0
19:53:18.268943 IP 10.0.2.15.57366 > 142.250.80.36.443: Flags [.], ack 1, win 64240, length 0
19:53:18.285258 IP 10.0.2.15.57366 > 142.250.80.36.443: Flags [P.], seq 1:518, ack 1, win 64240, length 517
19:53:18.285665 IP 142.250.80.36.443 > 10.0.2.15.57366: Flags [.], ack 518, win 65535, length 0
19:53:18.307160 IP 142.250.80.36.443 > 10.0.2.15.57366: Flags [.], seq 1:2921, ack 518, win 65535, length 2920
19:53:18.307184 IP 10.0.2.15.57366 > 142.250.80.36.443: Flags [.], ack 2921, win 62780, length 0
19:53:18.307319 IP 142.250.80.36.443 > 10.0.2.15.57366: Flags [P.], seq 2921:4123, ack 518, win 65535, length 1202
19:53:18.307331 IP 10.0.2.15.57366 > 142.250.80.36.443: Flags [.], ack 4123, win 61578, length 0
19:53:18.307986 IP 142.250.80.36.443 > 10.0.2.15.57366: Flags [P.], seq 4123:4303, ack 518, win 65535, length 180
19:53:18.308000 IP 10.0.2.15.57366 > 142.250.80.36.443: Flags [.], ack 4303, win 62780, length 0
19:53:18.308935 IP 10.0.2.15.57366 > 142.250.80.36.443: Flags [P.], seq 518:598, ack 4303, win 62780, length 80
19:53:18.309203 IP 142.250.80.36.443 > 10.0.2.15.57366: Flags [.], ack 598, win 65535, length 0
19:53:18.309233 IP 10.0.2.15.57366 > 142.250.80.36.443: Flags [P.], seq 598:644, ack 4303, win 62780, length 46
19:53:18.309259 IP 10.0.2.15.57366 > 142.250.80.36.443: Flags [P.], seq 644:693, ack 4303, win 62780, length 49
19:53:18.309360 IP 10.0.2.15.57366 > 142.250.80.36.443: Flags [P.], seq 693:728, ack 4303, win 62780, length 35
19:53:18.309760 IP 142.250.80.36.443 > 10.0.2.15.57366: Flags [.], ack 644, win 65535, length 0
19:53:18.309762 IP 142.250.80.36.443 > 10.0.2.15.57366: Flags [.], ack 693, win 65535, length 0
19:53:18.309849 IP 10.0.2.15.57366 > 142.250.80.36.443: Flags [P.], seq 728:790, ack 4303, win 62780, length 62
19:53:18.310054 IP 142.250.80.36.443 > 10.0.2.15.57366: Flags [.], ack 728, win 65535, length 0
19:53:18.310639 IP 142.250.80.36.443 > 10.0.2.15.57366: Flags [.], ack 790, win 65535, length 0
19:53:18.321974 IP 142.250.80.36.443 > 10.0.2.15.57366: Flags [P.], seq 4303:4976, ack 790, win 65535, length 673
19:53:18.321992 IP 10.0.2.15.57366 > 142.250.80.36.443: Flags [.], ack 4976, win 62780, length 0
19:53:18.322297 IP 10.0.2.15.57366 > 142.250.80.36.443: Flags [P.], seq 790:821, ack 4976, win 62780, length 31
19:53:18.322569 IP 142.250.80.36.443 > 10.0.2.15.57366: Flags [.], ack 821, win 65535, length 0

