19:51:07.970432 IP 10.0.2.15.39256 > 140.233.253.2.53: 363+ A? www.google.com. (32)
19:51:07.970474 IP 10.0.2.15.39256 > 140.233.253.2.53: 16492+ AAAA? www.google.com. (32)
19:51:07.976577 IP 140.233.253.2.53 > 10.0.2.15.39256: 363 1/0/0 A 142.250.80.36 (48)
19:51:07.976579 IP 140.233.253.2.53 > 10.0.2.15.39256: 16492 1/0/0 AAAA 2607:f8b0:4006:80b::2004 (60)
19:51:07.977084 IP 10.0.2.15.57316 > 142.250.80.36.443: Flags [S], seq 1319567465, win 64240, options [mss 1460,sackOK,TS val 3357313927 ecr 0,nop,wscale 6], length 0
19:51:07.990800 IP 142.250.80.36.443 > 10.0.2.15.57316: Flags [S.], seq 199360001, ack 1319567466, win 65535, options [mss 1460], length 0
19:51:07.990846 IP 10.0.2.15.57316 > 142.250.80.36.443: Flags [.], ack 1, win 64240, length 0
19:51:07.998197 IP 10.0.2.15.57316 > 142.250.80.36.443: Flags [P.], seq 1:518, ack 1, win 64240, length 517
19:51:07.998478 IP 142.250.80.36.443 > 10.0.2.15.57316: Flags [.], ack 518, win 65535, length 0
19:51:08.020935 IP 142.250.80.36.443 > 10.0.2.15.57316: Flags [.], seq 1:2921, ack 518, win 65535, length 2920
19:51:08.020958 IP 10.0.2.15.57316 > 142.250.80.36.443: Flags [.], ack 2921, win 62780, length 0
19:51:08.021591 IP 142.250.80.36.443 > 10.0.2.15.57316: Flags [P.], seq 2921:4123, ack 518, win 65535, length 1202
19:51:08.021593 IP 142.250.80.36.443 > 10.0.2.15.57316: Flags [P.], seq 4123:4304, ack 518, win 65535, length 181
19:51:08.021615 IP 10.0.2.15.57316 > 142.250.80.36.443: Flags [.], ack 4123, win 61578, length 0
19:51:08.021742 IP 10.0.2.15.57316 > 142.250.80.36.443: Flags [.], ack 4304, win 61578, length 0
19:51:08.023732 IP 10.0.2.15.57316 > 142.250.80.36.443: Flags [P.], seq 518:598, ack 4304, win 62780, length 80
19:51:08.024060 IP 142.250.80.36.443 > 10.0.2.15.57316: Flags [.], ack 598, win 65535, length 0
19:51:08.024126 IP 10.0.2.15.57316 > 142.250.80.36.443: Flags [P.], seq 598:644, ack 4304, win 62780, length 46
19:51:08.024160 IP 10.0.2.15.57316 > 142.250.80.36.443: Flags [P.], seq 644:693, ack 4304, win 62780, length 49
19:51:08.024236 IP 10.0.2.15.57316 > 142.250.80.36.443: Flags [P.], seq 693:728, ack 4304, win 62780, length 35
19:51:08.024295 IP 10.0.2.15.57316 > 142.250.80.36.443: Flags [P.], seq 728:790, ack 4304, win 62780, length 62
19:51:08.024407 IP 142.250.80.36.443 > 10.0.2.15.57316: Flags [.], ack 644, win 65535, length 0
19:51:08.024409 IP 142.250.80.36.443 > 10.0.2.15.57316: Flags [.], ack 693, win 65535, length 0
19:51:08.024602 IP 142.250.80.36.443 > 10.0.2.15.57316: Flags [.], ack 728, win 65535, length 0
19:51:08.024603 IP 142.250.80.36.443 > 10.0.2.15.57316: Flags [.], ack 790, win 65535, length 0
19:51:08.036787 IP 142.250.80.36.443 > 10.0.2.15.57316: Flags [P.], seq 4304:4977, ack 790, win 65535, length 673
19:51:08.036809 IP 10.0.2.15.57316 > 142.250.80.36.443: Flags [.], ack 4977, win 62780, length 0
19:51:08.037318 IP 10.0.2.15.57316 > 142.250.80.36.443: Flags [P.], seq 790:821, ack 4977, win 62780, length 31
19:51:08.037599 IP 142.250.80.36.443 > 10.0.2.15.57316: Flags [.], ack 821, win 65535, length 0

