19:51:53.714023 IP 10.0.2.15.57040 > 140.233.253.2.53: 7350+ A? www.google.com. (32)
19:51:53.714065 IP 10.0.2.15.57040 > 140.233.253.2.53: 59304+ AAAA? www.google.com. (32)
19:51:53.757016 IP 140.233.253.2.53 > 10.0.2.15.57040: 7350 1/0/0 A 142.250.80.36 (48)
19:51:53.757019 IP 140.233.253.2.53 > 10.0.2.15.57040: 59304 1/0/0 AAAA 2607:f8b0:4006:80b::2004 (60)
19:51:53.757458 IP 10.0.2.15.57334 > 142.250.80.36.443: Flags [S], seq 115695519, win 64240, options [mss 1460,sackOK,TS val 3357359707 ecr 0,nop,wscale 6], length 0
19:51:53.771327 IP 142.250.80.36.443 > 10.0.2.15.57334: Flags [S.], seq 200512001, ack 115695520, win 65535, options [mss 1460], length 0
19:51:53.771370 IP 10.0.2.15.57334 > 142.250.80.36.443: Flags [.], ack 1, win 64240, length 0
19:51:53.779856 IP 10.0.2.15.57334 > 142.250.80.36.443: Flags [P.], seq 1:518, ack 1, win 64240, length 517
19:51:53.780124 IP 142.250.80.36.443 > 10.0.2.15.57334: Flags [.], ack 518, win 65535, length 0

