00:11:48.424786 IP 10.0.2.15.39196 > 140.233.253.2.53: 24051+ A? www.google.com. (32)
00:11:48.424827 IP 10.0.2.15.39196 > 140.233.253.2.53: 28400+ AAAA? www.google.com. (32)
00:11:48.430384 IP 140.233.253.2.53 > 10.0.2.15.39196: 24051 1/0/0 A 142.251.41.4 (48)
00:11:48.430612 IP 140.233.253.2.53 > 10.0.2.15.39196: 28400 1/0/0 AAAA 2607:f8b0:4006:824::2004 (60)
00:11:48.431024 IP 10.0.2.15.46358 > 142.251.41.4.443: Flags [S], seq 2553785887, win 64240, options [mss 1460,sackOK,TS val 4104526566 ecr 0,nop,wscale 6], length 0
00:11:48.444132 IP 142.251.41.4.443 > 10.0.2.15.46358: Flags [S.], seq 66816001, ack 2553785888, win 65535, options [mss 1460], length 0
00:11:48.444183 IP 10.0.2.15.46358 > 142.251.41.4.443: Flags [.], ack 1, win 64240, length 0
00:11:48.455969 IP 10.0.2.15.46358 > 142.251.41.4.443: Flags [P.], seq 1:518, ack 1, win 64240, length 517
00:11:48.456382 IP 142.251.41.4.443 > 10.0.2.15.46358: Flags [.], ack 518, win 65535, length 0
00:11:48.478390 IP 142.251.41.4.443 > 10.0.2.15.46358: Flags [.], seq 1:2921, ack 518, win 65535, length 2920
00:11:48.478414 IP 10.0.2.15.46358 > 142.251.41.4.443: Flags [.], ack 2921, win 62780, length 0
00:11:48.479073 IP 142.251.41.4.443 > 10.0.2.15.46358: Flags [P.], seq 2921:4305, ack 518, win 65535, length 1384
00:11:48.479096 IP 10.0.2.15.46358 > 142.251.41.4.443: Flags [.], ack 4305, win 61396, length 0
00:11:48.481910 IP 10.0.2.15.46358 > 142.251.41.4.443: Flags [P.], seq 518:598, ack 4305, win 62780, length 80
00:11:48.483975 IP 142.251.41.4.443 > 10.0.2.15.46358: Flags [.], ack 598, win 65535, length 0
00:11:48.484162 IP 10.0.2.15.46358 > 142.251.41.4.443: Flags [P.], seq 598:644, ack 4305, win 62780, length 46
00:11:48.484195 IP 10.0.2.15.46358 > 142.251.41.4.443: Flags [P.], seq 644:693, ack 4305, win 62780, length 49
00:11:48.484327 IP 10.0.2.15.46358 > 142.251.41.4.443: Flags [P.], seq 693:790, ack 4305, win 62780, length 97
00:11:48.484576 IP 142.251.41.4.443 > 10.0.2.15.46358: Flags [.], ack 644, win 65535, length 0
00:11:48.484577 IP 142.251.41.4.443 > 10.0.2.15.46358: Flags [.], ack 693, win 65535, length 0
00:11:48.484578 IP 142.251.41.4.443 > 10.0.2.15.46358: Flags [.], ack 790, win 65535, length 0
00:11:48.497306 IP 142.251.41.4.443 > 10.0.2.15.46358: Flags [P.], seq 4305:4978, ack 790, win 65535, length 673
00:11:48.497326 IP 10.0.2.15.46358 > 142.251.41.4.443: Flags [.], ack 4978, win 62780, length 0
00:11:48.497806 IP 10.0.2.15.46358 > 142.251.41.4.443: Flags [P.], seq 790:821, ack 4978, win 62780, length 31
00:11:48.498192 IP 142.251.41.4.443 > 10.0.2.15.46358: Flags [.], ack 821, win 65535, length 0

