19:50:45.775057 IP 10.0.2.15.48370 > 140.233.253.2.53: 32320+ A? www.google.com. (32)
19:50:45.775088 IP 10.0.2.15.48370 > 140.233.253.2.53: 33095+ AAAA? www.google.com. (32)
19:50:45.780889 IP 140.233.253.2.53 > 10.0.2.15.48370: 33095 1/0/0 AAAA 2607:f8b0:4006:80b::2004 (60)
19:50:45.780891 IP 140.233.253.2.53 > 10.0.2.15.48370: 32320 1/0/0 A 142.250.80.36 (48)
19:50:45.781279 IP 10.0.2.15.57308 > 142.250.80.36.443: Flags [S], seq 3250916577, win 64240, options [mss 1460,sackOK,TS val 3357291731 ecr 0,nop,wscale 6], length 0
19:50:45.794305 IP 142.250.80.36.443 > 10.0.2.15.57308: Flags [S.], seq 198848001, ack 3250916578, win 65535, options [mss 1460], length 0
19:50:45.794349 IP 10.0.2.15.57308 > 142.250.80.36.443: Flags [.], ack 1, win 64240, length 0
19:50:45.803106 IP 10.0.2.15.57308 > 142.250.80.36.443: Flags [P.], seq 1:518, ack 1, win 64240, length 517
19:50:45.803407 IP 142.250.80.36.443 > 10.0.2.15.57308: Flags [.], ack 518, win 65535, length 0
19:50:45.826979 IP 142.250.80.36.443 > 10.0.2.15.57308: Flags [.], seq 1:2921, ack 518, win 65535, length 2920
19:50:45.827001 IP 10.0.2.15.57308 > 142.250.80.36.443: Flags [.], ack 2921, win 62780, length 0
19:50:45.827324 IP 142.250.80.36.443 > 10.0.2.15.57308: Flags [P.], seq 2921:4305, ack 518, win 65535, length 1384
19:50:45.827340 IP 10.0.2.15.57308 > 142.250.80.36.443: Flags [.], ack 4305, win 61396, length 0
19:50:45.828904 IP 10.0.2.15.57308 > 142.250.80.36.443: Flags [P.], seq 518:598, ack 4305, win 62780, length 80
19:50:45.829331 IP 142.250.80.36.443 > 10.0.2.15.57308: Flags [.], ack 598, win 65535, length 0
19:50:45.829404 IP 10.0.2.15.57308 > 142.250.80.36.443: Flags [P.], seq 598:644, ack 4305, win 62780, length 46
19:50:45.829458 IP 10.0.2.15.57308 > 142.250.80.36.443: Flags [P.], seq 644:693, ack 4305, win 62780, length 49
19:50:45.830388 IP 142.250.80.36.443 > 10.0.2.15.57308: Flags [.], ack 644, win 65535, length 0
19:50:45.830389 IP 142.250.80.36.443 > 10.0.2.15.57308: Flags [.], ack 693, win 65535, length 0
19:50:45.830410 IP 10.0.2.15.57308 > 142.250.80.36.443: Flags [P.], seq 693:728, ack 4305, win 62780, length 35
19:50:45.830814 IP 142.250.80.36.443 > 10.0.2.15.57308: Flags [.], ack 728, win 65535, length 0
19:50:45.830994 IP 10.0.2.15.57308 > 142.250.80.36.443: Flags [P.], seq 728:790, ack 4305, win 62780, length 62
19:50:45.831213 IP 142.250.80.36.443 > 10.0.2.15.57308: Flags [.], ack 790, win 65535, length 0
19:50:45.842384 IP 142.250.80.36.443 > 10.0.2.15.57308: Flags [P.], seq 4305:4978, ack 790, win 65535, length 673
19:50:45.842405 IP 10.0.2.15.57308 > 142.250.80.36.443: Flags [.], ack 4978, win 62780, length 0
19:50:45.842721 IP 10.0.2.15.57308 > 142.250.80.36.443: Flags [P.], seq 790:821, ack 4978, win 62780, length 31
19:50:45.842995 IP 142.250.80.36.443 > 10.0.2.15.57308: Flags [.], ack 821, win 65535, length 0

