00:12:48.450493 IP 10.0.2.15.50162 > 140.233.253.2.53: 34346+ A? www.google.com. (32)
00:12:48.450529 IP 10.0.2.15.50162 > 140.233.253.2.53: 296+ AAAA? www.google.com. (32)
00:12:48.455784 IP 140.233.253.2.53 > 10.0.2.15.50162: 34346 1/0/0 A 142.251.41.4 (48)
00:12:48.455787 IP 140.233.253.2.53 > 10.0.2.15.50162: 296 1/0/0 AAAA 2607:f8b0:4006:824::2004 (60)
00:12:48.456247 IP 10.0.2.15.46382 > 142.251.41.4.443: Flags [S], seq 4115692322, win 64240, options [mss 1460,sackOK,TS val 4104586591 ecr 0,nop,wscale 6], length 0
00:12:48.470816 IP 142.251.41.4.443 > 10.0.2.15.46382: Flags [S.], seq 68224001, ack 4115692323, win 65535, options [mss 1460], length 0
00:12:48.470961 IP 10.0.2.15.46382 > 142.251.41.4.443: Flags [.], ack 1, win 64240, length 0
00:12:48.482051 IP 10.0.2.15.46382 > 142.251.41.4.443: Flags [P.], seq 1:518, ack 1, win 64240, length 517
00:12:48.483613 IP 142.251.41.4.443 > 10.0.2.15.46382: Flags [.], ack 518, win 65535, length 0
00:12:48.503897 IP 142.251.41.4.443 > 10.0.2.15.46382: Flags [.], seq 1:2921, ack 518, win 65535, length 2920
00:12:48.503926 IP 10.0.2.15.46382 > 142.251.41.4.443: Flags [.], ack 2921, win 62780, length 0
00:12:48.504162 IP 142.251.41.4.443 > 10.0.2.15.46382: Flags [P.], seq 2921:4305, ack 518, win 65535, length 1384
00:12:48.504182 IP 10.0.2.15.46382 > 142.251.41.4.443: Flags [.], ack 4305, win 61396, length 0
00:12:48.507322 IP 10.0.2.15.46382 > 142.251.41.4.443: Flags [P.], seq 518:598, ack 4305, win 62780, length 80
00:12:48.507500 IP 10.0.2.15.46382 > 142.251.41.4.443: Flags [P.], seq 598:693, ack 4305, win 62780, length 95
00:12:48.508906 IP 10.0.2.15.46382 > 142.251.41.4.443: Flags [P.], seq 693:790, ack 4305, win 62780, length 97
00:12:48.509172 IP 142.251.41.4.443 > 10.0.2.15.46382: Flags [.], ack 598, win 65535, length 0
00:12:48.509174 IP 142.251.41.4.443 > 10.0.2.15.46382: Flags [.], ack 693, win 65535, length 0
00:12:48.509578 IP 142.251.41.4.443 > 10.0.2.15.46382: Flags [.], ack 790, win 65535, length 0
00:12:48.521981 IP 142.251.41.4.443 > 10.0.2.15.46382: Flags [P.], seq 4305:4978, ack 790, win 65535, length 673
00:12:48.522007 IP 10.0.2.15.46382 > 142.251.41.4.443: Flags [.], ack 4978, win 62780, length 0
00:12:48.522603 IP 10.0.2.15.46382 > 142.251.41.4.443: Flags [P.], seq 790:821, ack 4978, win 62780, length 31
00:12:48.524813 IP 142.251.41.4.443 > 10.0.2.15.46382: Flags [.], ack 821, win 65535, length 0

