00:12:59.788305 IP 10.0.2.15.34386 > 140.233.253.2.53: 34407+ A? www.google.com. (32)
00:12:59.788346 IP 10.0.2.15.34386 > 140.233.253.2.53: 11877+ AAAA? www.google.com. (32)
00:12:59.793283 IP 140.233.253.2.53 > 10.0.2.15.34386: 11877 1/0/0 AAAA 2607:f8b0:4006:824::2004 (60)
00:12:59.793611 IP 140.233.253.2.53 > 10.0.2.15.34386: 34407 1/0/0 A 142.251.41.4 (48)
00:12:59.793898 IP 10.0.2.15.46386 > 142.251.41.4.443: Flags [S], seq 4023599686, win 64240, options [mss 1460,sackOK,TS val 4104597929 ecr 0,nop,wscale 6], length 0
00:12:59.807153 IP 142.251.41.4.443 > 10.0.2.15.46386: Flags [S.], seq 69120001, ack 4023599687, win 65535, options [mss 1460], length 0
00:12:59.807234 IP 10.0.2.15.46386 > 142.251.41.4.443: Flags [.], ack 1, win 64240, length 0
00:12:59.818865 IP 10.0.2.15.46386 > 142.251.41.4.443: Flags [P.], seq 1:518, ack 1, win 64240, length 517
00:12:59.819464 IP 142.251.41.4.443 > 10.0.2.15.46386: Flags [.], ack 518, win 65535, length 0
00:12:59.841769 IP 142.251.41.4.443 > 10.0.2.15.46386: Flags [.], seq 1:2921, ack 518, win 65535, length 2920
00:12:59.841788 IP 10.0.2.15.46386 > 142.251.41.4.443: Flags [.], ack 2921, win 62780, length 0
00:12:59.842179 IP 142.251.41.4.443 > 10.0.2.15.46386: Flags [P.], seq 2921:4305, ack 518, win 65535, length 1384
00:12:59.842198 IP 10.0.2.15.46386 > 142.251.41.4.443: Flags [.], ack 4305, win 61396, length 0
00:12:59.844478 IP 10.0.2.15.46386 > 142.251.41.4.443: Flags [P.], seq 518:598, ack 4305, win 62780, length 80
00:12:59.844635 IP 10.0.2.15.46386 > 142.251.41.4.443: Flags [P.], seq 598:693, ack 4305, win 62780, length 95
00:12:59.845108 IP 142.251.41.4.443 > 10.0.2.15.46386: Flags [.], ack 598, win 65535, length 0
00:12:59.845250 IP 10.0.2.15.46386 > 142.251.41.4.443: Flags [P.], seq 693:790, ack 4305, win 62780, length 97
00:12:59.845453 IP 142.251.41.4.443 > 10.0.2.15.46386: Flags [.], ack 693, win 65535, length 0
00:12:59.846911 IP 142.251.41.4.443 > 10.0.2.15.46386: Flags [.], ack 790, win 65535, length 0
00:12:59.857421 IP 142.251.41.4.443 > 10.0.2.15.46386: Flags [P.], seq 4305:4978, ack 790, win 65535, length 673
00:12:59.857441 IP 10.0.2.15.46386 > 142.251.41.4.443: Flags [.], ack 4978, win 62780, length 0
00:12:59.857836 IP 10.0.2.15.46386 > 142.251.41.4.443: Flags [P.], seq 790:821, ack 4978, win 62780, length 31
00:12:59.858171 IP 142.251.41.4.443 > 10.0.2.15.46386: Flags [.], ack 821, win 65535, length 0
00:12:59.931367 IP 142.251.41.4.443 > 10.0.2.15.46386: Flags [.], seq 4978:12278, ack 821, win 65535, length 7300
00:12:59.931399 IP 10.0.2.15.46386 > 142.251.41.4.443: Flags [.], ack 12278, win 59860, length 0
00:12:59.932145 IP 142.251.41.4.443 > 10.0.2.15.46386: Flags [P.], seq 12278:17975, ack 821, win 65535, length 5697
00:12:59.932148 IP 142.251.41.4.443 > 10.0.2.15.46386: Flags [P.], seq 17975:20723, ack 821, win 65535, length 2748
00:12:59.932173 IP 10.0.2.15.46386 > 142.251.41.4.443: Flags [.], ack 17975, win 55480, length 0
00:12:59.932263 IP 10.0.2.15.46386 > 142.251.41.4.443: Flags [.], ack 20723, win 54020, length 0
00:12:59.932906 IP 142.251.41.4.443 > 10.0.2.15.46386: Flags [P.], seq 20723:21266, ack 821, win 65535, length 543
00:12:59.932922 IP 10.0.2.15.46386 > 142.251.41.4.443: Flags [.], ack 21266, win 62780, length 0
00:12:59.933111 IP 10.0.2.15.46386 > 142.251.41.4.443: Flags [P.], seq 821:860, ack 21266, win 62780, length 39
00:12:59.933402 IP 142.251.41.4.443 > 10.0.2.15.46386: Flags [.], ack 860, win 65535, length 0
00:12:59.933690 IP 10.0.2.15.46386 > 142.251.41.4.443: Flags [P.], seq 860:884, ack 21266, win 62780, length 24
00:12:59.934050 IP 142.251.41.4.443 > 10.0.2.15.46386: Flags [.], ack 884, win 65535, length 0
00:12:59.934893 IP 10.0.2.15.46386 > 142.251.41.4.443: Flags [F.], seq 884, ack 21266, win 62780, length 0
00:12:59.935341 IP 142.251.41.4.443 > 10.0.2.15.46386: Flags [.], ack 885, win 65535, length 0
00:12:59.951085 IP 142.251.41.4.443 > 10.0.2.15.46386: Flags [F.], seq 21266, ack 885, win 65535, length 0
00:12:59.951115 IP 10.0.2.15.46386 > 142.251.41.4.443: Flags [.], ack 21267, win 62780, length 0

