21:49:48.563383 IP 10.0.2.15.51314 > 140.233.253.2.53: 42706+ A? www.indeed.com. (32)
21:49:48.563428 IP 10.0.2.15.51314 > 140.233.253.2.53: 10280+ AAAA? www.indeed.com. (32)
21:49:48.569862 IP 140.233.253.2.53 > 10.0.2.15.51314: 42706 2/0/0 CNAME us.dyn.indeed.com., A 169.47.19.136 (69)
21:49:48.569865 IP 140.233.253.2.53 > 10.0.2.15.51314: 10280 1/1/0 CNAME us.dyn.indeed.com. (118)
21:49:48.570172 IP 10.0.2.15.53132 > 169.47.19.136.443: Flags [S], seq 4045843213, win 64240, options [mss 1460,sackOK,TS val 1020899407 ecr 0,nop,wscale 6], length 0
21:49:48.587948 IP 169.47.19.136.443 > 10.0.2.15.53132: Flags [S.], seq 272896001, ack 4045843214, win 65535, options [mss 1460], length 0
21:49:48.588000 IP 10.0.2.15.53132 > 169.47.19.136.443: Flags [.], ack 1, win 64240, length 0
21:49:48.598469 IP 10.0.2.15.53132 > 169.47.19.136.443: Flags [P.], seq 1:518, ack 1, win 64240, length 517
21:49:48.598861 IP 169.47.19.136.443 > 10.0.2.15.53132: Flags [.], ack 518, win 65535, length 0
21:49:48.618845 IP 169.47.19.136.443 > 10.0.2.15.53132: Flags [P.], seq 1:1375, ack 518, win 65535, length 1374
21:49:48.618867 IP 10.0.2.15.53132 > 169.47.19.136.443: Flags [.], ack 1375, win 63204, length 0
21:49:48.621357 IP 169.47.19.136.443 > 10.0.2.15.53132: Flags [P.], seq 1375:4375, ack 518, win 65535, length 3000
21:49:48.621386 IP 10.0.2.15.53132 > 169.47.19.136.443: Flags [.], ack 4375, win 62780, length 0
21:49:48.622687 IP 10.0.2.15.53132 > 169.47.19.136.443: Flags [P.], seq 518:644, ack 4375, win 62780, length 126
21:49:48.622991 IP 169.47.19.136.443 > 10.0.2.15.53132: Flags [.], ack 644, win 65535, length 0
21:49:48.639570 IP 169.47.19.136.443 > 10.0.2.15.53132: Flags [P.], seq 4375:4495, ack 644, win 65535, length 120
21:49:48.639595 IP 10.0.2.15.53132 > 169.47.19.136.443: Flags [.], ack 4495, win 62780, length 0
21:49:48.640140 IP 10.0.2.15.53132 > 169.47.19.136.443: Flags [P.], seq 644:697, ack 4495, win 62780, length 53
21:49:48.640187 IP 10.0.2.15.53132 > 169.47.19.136.443: Flags [P.], seq 697:753, ack 4495, win 62780, length 56
21:49:48.640605 IP 169.47.19.136.443 > 10.0.2.15.53132: Flags [.], ack 697, win 65535, length 0
21:49:48.640607 IP 169.47.19.136.443 > 10.0.2.15.53132: Flags [.], ack 753, win 65535, length 0
21:49:48.640633 IP 10.0.2.15.53132 > 169.47.19.136.443: Flags [P.], seq 753:864, ack 4495, win 62780, length 111
21:49:48.640906 IP 169.47.19.136.443 > 10.0.2.15.53132: Flags [.], ack 864, win 65535, length 0
21:49:48.640956 IP 10.0.2.15.53132 > 169.47.19.136.443: Flags [P.], seq 864:902, ack 4495, win 62780, length 38
21:49:48.641329 IP 169.47.19.136.443 > 10.0.2.15.53132: Flags [.], ack 902, win 65535, length 0
21:49:48.655791 IP 169.47.19.136.443 > 10.0.2.15.53132: Flags [P.], seq 4495:4533, ack 902, win 65535, length 38
21:49:48.655813 IP 10.0.2.15.53132 > 169.47.19.136.443: Flags [.], ack 4533, win 62780, length 0
21:49:48.672722 IP 169.47.19.136.443 > 10.0.2.15.53132: Flags [.], seq 4533:13293, ack 902, win 65535, length 8760
21:49:48.672749 IP 10.0.2.15.53132 > 169.47.19.136.443: Flags [.], ack 13293, win 58400, length 0
21:49:48.673003 IP 169.47.19.136.443 > 10.0.2.15.53132: Flags [P.], seq 13293:16284, ack 902, win 65535, length 2991
21:49:48.673017 IP 10.0.2.15.53132 > 169.47.19.136.443: Flags [.], ack 16284, win 56940, length 0
21:49:48.673568 IP 169.47.19.136.443 > 10.0.2.15.53132: Flags [P.], seq 16284:17658, ack 902, win 65535, length 1374
21:49:48.673579 IP 10.0.2.15.53132 > 169.47.19.136.443: Flags [.], ack 17658, win 55566, length 0
21:49:48.688339 IP 169.47.19.136.443 > 10.0.2.15.53132: Flags [P.], seq 17658:27276, ack 902, win 65535, length 9618
21:49:48.688342 IP 169.47.19.136.443 > 10.0.2.15.53132: Flags [.], seq 27276:30196, ack 902, win 65535, length 2920
21:49:48.688363 IP 10.0.2.15.53132 > 169.47.19.136.443: Flags [.], ack 27276, win 58400, length 0
21:49:48.688524 IP 10.0.2.15.53132 > 169.47.19.136.443: Flags [.], ack 30196, win 55480, length 0
21:49:48.690422 IP 169.47.19.136.443 > 10.0.2.15.53132: Flags [P.], seq 30196:39642, ack 902, win 65535, length 9446
21:49:48.690428 IP 169.47.19.136.443 > 10.0.2.15.53132: Flags [P.], seq 39642:42390, ack 902, win 65535, length 2748
21:49:48.690462 IP 10.0.2.15.53132 > 169.47.19.136.443: Flags [.], ack 39642, win 49640, length 0
21:49:48.690497 IP 10.0.2.15.53132 > 169.47.19.136.443: Flags [.], ack 42390, win 46892, length 0
21:49:48.690519 IP 169.47.19.136.443 > 10.0.2.15.53132: Flags [P.], seq 42390:43764, ack 902, win 65535, length 1374
21:49:48.690520 IP 169.47.19.136.443 > 10.0.2.15.53132: Flags [P.], seq 43764:45138, ack 902, win 65535, length 1374
21:49:48.691285 IP 10.0.2.15.53132 > 169.47.19.136.443: Flags [.], ack 45138, win 45342, length 0
21:49:48.703659 IP 169.47.19.136.443 > 10.0.2.15.53132: Flags [P.], seq 45138:54756, ack 902, win 65535, length 9618
21:49:48.703662 IP 169.47.19.136.443 > 10.0.2.15.53132: Flags [P.], seq 54756:58878, ack 902, win 65535, length 4122
21:49:48.703687 IP 10.0.2.15.53132 > 169.47.19.136.443: Flags [.], ack 54756, win 58400, length 0
21:49:48.703761 IP 169.47.19.136.443 > 10.0.2.15.53132: Flags [P.], seq 58878:61626, ack 902, win 65535, length 2748
21:49:48.703848 IP 10.0.2.15.53132 > 169.47.19.136.443: Flags [.], ack 61626, win 52560, length 0
21:49:48.704757 IP 169.47.19.136.443 > 10.0.2.15.53132: Flags [P.], seq 61626:68496, ack 902, win 65535, length 6870
21:49:48.704771 IP 10.0.2.15.53132 > 169.47.19.136.443: Flags [.], ack 68496, win 59860, length 0
21:49:48.705319 IP 169.47.19.136.443 > 10.0.2.15.53132: Flags [P.], seq 68496:73992, ack 902, win 65535, length 5496
21:49:48.705322 IP 169.47.19.136.443 > 10.0.2.15.53132: Flags [P.], seq 73992:78114, ack 902, win 65535, length 4122
21:49:48.705323 IP 169.47.19.136.443 > 10.0.2.15.53132: Flags [P.], seq 78114:80862, ack 902, win 65535, length 2748
21:49:48.705640 IP 169.47.19.136.443 > 10.0.2.15.53132: Flags [P.], seq 80862:84984, ack 902, win 65535, length 4122
21:49:48.705770 IP 169.47.19.136.443 > 10.0.2.15.53132: Flags [P.], seq 84984:89106, ack 902, win 65535, length 4122
21:49:48.705771 IP 169.47.19.136.443 > 10.0.2.15.53132: Flags [P.], seq 89106:91854, ack 902, win 65535, length 2748
21:49:48.705863 IP 10.0.2.15.53132 > 169.47.19.136.443: Flags [.], ack 91854, win 62780, length 0
21:49:48.706596 IP 169.47.19.136.443 > 10.0.2.15.53132: Flags [P.], seq 91854:97350, ack 902, win 65535, length 5496
21:49:48.706614 IP 10.0.2.15.53132 > 169.47.19.136.443: Flags [.], ack 97350, win 65535, length 0
21:49:48.707211 IP 169.47.19.136.443 > 10.0.2.15.53132: Flags [P.], seq 97350:100098, ack 902, win 65535, length 2748
21:49:48.707220 IP 10.0.2.15.53132 > 169.47.19.136.443: Flags [.], ack 100098, win 65535, length 0
21:49:48.718771 IP 169.47.19.136.443 > 10.0.2.15.53132: Flags [P.], seq 100098:106968, ack 902, win 65535, length 6870
21:49:48.718774 IP 169.47.19.136.443 > 10.0.2.15.53132: Flags [P.], seq 106968:112464, ack 902, win 65535, length 5496
21:49:48.718797 IP 10.0.2.15.53132 > 169.47.19.136.443: Flags [.], ack 106968, win 65535, length 0
21:49:48.718837 IP 10.0.2.15.53132 > 169.47.19.136.443: Flags [.], ack 112464, win 65535, length 0
21:49:48.718862 IP 169.47.19.136.443 > 10.0.2.15.53132: Flags [P.], seq 112464:113838, ack 902, win 65535, length 1374
21:49:48.718869 IP 10.0.2.15.53132 > 169.47.19.136.443: Flags [.], ack 113838, win 65535, length 0
21:49:48.721090 IP 169.47.19.136.443 > 10.0.2.15.53132: Flags [P.], seq 113838:120708, ack 902, win 65535, length 6870
21:49:48.721112 IP 10.0.2.15.53132 > 169.47.19.136.443: Flags [.], ack 120708, win 65535, length 0
21:49:48.721309 IP 169.47.19.136.443 > 10.0.2.15.53132: Flags [P.], seq 120708:124830, ack 902, win 65535, length 4122
21:49:48.721319 IP 10.0.2.15.53132 > 169.47.19.136.443: Flags [.], ack 124830, win 65535, length 0
21:49:48.721618 IP 169.47.19.136.443 > 10.0.2.15.53132: Flags [P.], seq 124830:131700, ack 902, win 65535, length 6870
21:49:48.721631 IP 10.0.2.15.53132 > 169.47.19.136.443: Flags [.], ack 131700, win 65535, length 0
21:49:48.722249 IP 169.47.19.136.443 > 10.0.2.15.53132: Flags [P.], seq 131700:135822, ack 902, win 65535, length 4122
21:49:48.722251 IP 169.47.19.136.443 > 10.0.2.15.53132: Flags [P.], seq 135822:141318, ack 902, win 65535, length 5496
21:49:48.722252 IP 169.47.19.136.443 > 10.0.2.15.53132: Flags [P.], seq 141318:144066, ack 902, win 65535, length 2748
21:49:48.722297 IP 10.0.2.15.53132 > 169.47.19.136.443: Flags [.], ack 135822, win 65535, length 0
21:49:48.722320 IP 10.0.2.15.53132 > 169.47.19.136.443: Flags [.], ack 141318, win 65535, length 0
21:49:48.722333 IP 10.0.2.15.53132 > 169.47.19.136.443: Flags [.], ack 144066, win 65535, length 0
21:49:48.722356 IP 169.47.19.136.443 > 10.0.2.15.53132: Flags [.], seq 144066:146986, ack 902, win 65535, length 2920
21:49:48.722364 IP 10.0.2.15.53132 > 169.47.19.136.443: Flags [.], ack 146986, win 65535, length 0
21:49:48.722643 IP 169.47.19.136.443 > 10.0.2.15.53132: Flags [P.], seq 146986:148188, ack 902, win 65535, length 1202
21:49:48.722644 IP 169.47.19.136.443 > 10.0.2.15.53132: Flags [P.], seq 148188:150936, ack 902, win 65535, length 2748
21:49:48.722656 IP 10.0.2.15.53132 > 169.47.19.136.443: Flags [.], ack 148188, win 65535, length 0
21:49:48.722676 IP 10.0.2.15.53132 > 169.47.19.136.443: Flags [.], ack 150936, win 65535, length 0
21:49:48.722975 IP 169.47.19.136.443 > 10.0.2.15.53132: Flags [P.], seq 150936:152310, ack 902, win 65535, length 1374
21:49:48.722982 IP 10.0.2.15.53132 > 169.47.19.136.443: Flags [.], ack 152310, win 65535, length 0
21:49:48.723533 IP 169.47.19.136.443 > 10.0.2.15.53132: Flags [P.], seq 152310:159180, ack 902, win 65535, length 6870
21:49:48.723548 IP 10.0.2.15.53132 > 169.47.19.136.443: Flags [.], ack 159180, win 65535, length 0
21:49:48.723751 IP 169.47.19.136.443 > 10.0.2.15.53132: Flags [P.], seq 159180:161928, ack 902, win 65535, length 2748
21:49:48.723753 IP 169.47.19.136.443 > 10.0.2.15.53132: Flags [P.], seq 161928:166050, ack 902, win 65535, length 4122
21:49:48.723762 IP 10.0.2.15.53132 > 169.47.19.136.443: Flags [.], ack 161928, win 65535, length 0
21:49:48.723777 IP 10.0.2.15.53132 > 169.47.19.136.443: Flags [.], ack 166050, win 65535, length 0
21:49:48.724368 IP 169.47.19.136.443 > 10.0.2.15.53132: Flags [P.], seq 166050:168798, ack 902, win 65535, length 2748
21:49:48.724370 IP 169.47.19.136.443 > 10.0.2.15.53132: Flags [P.], seq 168798:172920, ack 902, win 65535, length 4122
21:49:48.724371 IP 169.47.19.136.443 > 10.0.2.15.53132: Flags [P.], seq 172920:175668, ack 902, win 65535, length 2748
21:49:48.724371 IP 169.47.19.136.443 > 10.0.2.15.53132: Flags [.], seq 175668:177128, ack 902, win 65535, length 1460
21:49:48.724384 IP 10.0.2.15.53132 > 169.47.19.136.443: Flags [.], ack 168798, win 65535, length 0
21:49:48.724400 IP 10.0.2.15.53132 > 169.47.19.136.443: Flags [.], ack 172920, win 65535, length 0
21:49:48.724412 IP 10.0.2.15.53132 > 169.47.19.136.443: Flags [.], ack 175668, win 65535, length 0
21:49:48.724423 IP 10.0.2.15.53132 > 169.47.19.136.443: Flags [.], ack 177128, win 65535, length 0
21:49:48.724600 IP 169.47.19.136.443 > 10.0.2.15.53132: Flags [P.], seq 177128:178416, ack 902, win 65535, length 1288
21:49:48.724602 IP 169.47.19.136.443 > 10.0.2.15.53132: Flags [P.], seq 178416:181164, ack 902, win 65535, length 2748
21:49:48.724613 IP 10.0.2.15.53132 > 169.47.19.136.443: Flags [.], ack 178416, win 65535, length 0
21:49:48.724675 IP 10.0.2.15.53132 > 169.47.19.136.443: Flags [.], ack 181164, win 65535, length 0
21:49:48.725291 IP 169.47.19.136.443 > 10.0.2.15.53132: Flags [P.], seq 181164:183912, ack 902, win 65535, length 2748
21:49:48.725293 IP 169.47.19.136.443 > 10.0.2.15.53132: Flags [P.], seq 183912:186660, ack 902, win 65535, length 2748
21:49:48.725293 IP 169.47.19.136.443 > 10.0.2.15.53132: Flags [P.], seq 186660:188034, ack 902, win 65535, length 1374
21:49:48.725304 IP 10.0.2.15.53132 > 169.47.19.136.443: Flags [.], ack 183912, win 65535, length 0
21:49:48.725319 IP 10.0.2.15.53132 > 169.47.19.136.443: Flags [.], ack 186660, win 65535, length 0
21:49:48.725333 IP 10.0.2.15.53132 > 169.47.19.136.443: Flags [.], ack 188034, win 65535, length 0
21:49:48.725670 IP 169.47.19.136.443 > 10.0.2.15.53132: Flags [.], seq 188034:190954, ack 902, win 65535, length 2920
21:49:48.725684 IP 10.0.2.15.53132 > 169.47.19.136.443: Flags [.], ack 190954, win 65535, length 0
21:49:48.725912 IP 169.47.19.136.443 > 10.0.2.15.53132: Flags [P.], seq 190954:194904, ack 902, win 65535, length 3950
21:49:48.725914 IP 169.47.19.136.443 > 10.0.2.15.53132: Flags [P.], seq 194904:197652, ack 902, win 65535, length 2748
21:49:48.725914 IP 169.47.19.136.443 > 10.0.2.15.53132: Flags [P.], seq 197652:199026, ack 902, win 65535, length 1374
21:49:48.725924 IP 10.0.2.15.53132 > 169.47.19.136.443: Flags [.], ack 194904, win 65535, length 0
21:49:48.725941 IP 10.0.2.15.53132 > 169.47.19.136.443: Flags [.], ack 197652, win 65535, length 0
21:49:48.725954 IP 10.0.2.15.53132 > 169.47.19.136.443: Flags [.], ack 199026, win 65535, length 0
21:49:48.726220 IP 169.47.19.136.443 > 10.0.2.15.53132: Flags [P.], seq 199026:204522, ack 902, win 65535, length 5496
21:49:48.726221 IP 169.47.19.136.443 > 10.0.2.15.53132: Flags [P.], seq 204522:205896, ack 902, win 65535, length 1374
21:49:48.726231 IP 10.0.2.15.53132 > 169.47.19.136.443: Flags [.], ack 204522, win 65535, length 0
21:49:48.726245 IP 10.0.2.15.53132 > 169.47.19.136.443: Flags [.], ack 205896, win 65535, length 0
21:49:48.734910 IP 169.47.19.136.443 > 10.0.2.15.53132: Flags [P.], seq 205896:215514, ack 902, win 65535, length 9618
21:49:48.734914 IP 169.47.19.136.443 > 10.0.2.15.53132: Flags [P.], seq 215514:223758, ack 902, win 65535, length 8244
21:49:48.734939 IP 10.0.2.15.53132 > 169.47.19.136.443: Flags [.], ack 215514, win 65535, length 0
21:49:48.734992 IP 10.0.2.15.53132 > 169.47.19.136.443: Flags [.], ack 223758, win 65535, length 0
21:49:48.735043 IP 169.47.19.136.443 > 10.0.2.15.53132: Flags [P.], seq 223758:226506, ack 902, win 65535, length 2748
21:49:48.735044 IP 169.47.19.136.443 > 10.0.2.15.53132: Flags [P.], seq 226506:229254, ack 902, win 65535, length 2748
21:49:48.735207 IP 10.0.2.15.53132 > 169.47.19.136.443: Flags [.], ack 226506, win 65535, length 0
21:49:48.735235 IP 10.0.2.15.53132 > 169.47.19.136.443: Flags [.], ack 229254, win 65535, length 0
21:49:48.736210 IP 169.47.19.136.443 > 10.0.2.15.53132: Flags [P.], seq 229254:234750, ack 902, win 65535, length 5496
21:49:48.736227 IP 10.0.2.15.53132 > 169.47.19.136.443: Flags [.], ack 234750, win 65535, length 0
21:49:48.737219 IP 169.47.19.136.443 > 10.0.2.15.53132: Flags [P.], seq 234750:237498, ack 902, win 65535, length 2748
21:49:48.737236 IP 10.0.2.15.53132 > 169.47.19.136.443: Flags [.], ack 237498, win 65535, length 0
21:49:48.738881 IP 169.47.19.136.443 > 10.0.2.15.53132: Flags [P.], seq 237498:251238, ack 902, win 65535, length 13740
21:49:48.738901 IP 10.0.2.15.53132 > 169.47.19.136.443: Flags [.], ack 251238, win 65535, length 0
21:49:48.738956 IP 169.47.19.136.443 > 10.0.2.15.53132: Flags [P.], seq 251238:256734, ack 902, win 65535, length 5496
21:49:48.738964 IP 10.0.2.15.53132 > 169.47.19.136.443: Flags [.], ack 256734, win 65535, length 0
21:49:48.739109 IP 169.47.19.136.443 > 10.0.2.15.53132: Flags [P.], seq 256734:259482, ack 902, win 65535, length 2748
21:49:48.739116 IP 10.0.2.15.53132 > 169.47.19.136.443: Flags [.], ack 259482, win 65535, length 0
21:49:48.740500 IP 169.47.19.136.443 > 10.0.2.15.53132: Flags [P.], seq 259482:266352, ack 902, win 65535, length 6870
21:49:48.740517 IP 10.0.2.15.53132 > 169.47.19.136.443: Flags [.], ack 266352, win 65535, length 0
21:49:48.741111 IP 169.47.19.136.443 > 10.0.2.15.53132: Flags [P.], seq 266352:269100, ack 902, win 65535, length 2748
21:49:48.741112 IP 169.47.19.136.443 > 10.0.2.15.53132: Flags [P.], seq 269100:271848, ack 902, win 65535, length 2748
21:49:48.741113 IP 169.47.19.136.443 > 10.0.2.15.53132: Flags [P.], seq 271848:275970, ack 902, win 65535, length 4122
21:49:48.741114 IP 169.47.19.136.443 > 10.0.2.15.53132: Flags [P.], seq 275970:278718, ack 902, win 65535, length 2748
21:49:48.741129 IP 10.0.2.15.53132 > 169.47.19.136.443: Flags [.], ack 269100, win 65535, length 0
21:49:48.741228 IP 10.0.2.15.53132 > 169.47.19.136.443: Flags [.], ack 271848, win 65535, length 0
21:49:48.741253 IP 10.0.2.15.53132 > 169.47.19.136.443: Flags [.], ack 275970, win 65535, length 0
21:49:48.741266 IP 10.0.2.15.53132 > 169.47.19.136.443: Flags [.], ack 278718, win 65535, length 0
21:49:48.741290 IP 169.47.19.136.443 > 10.0.2.15.53132: Flags [P.], seq 278718:281466, ack 902, win 65535, length 2748
21:49:48.741291 IP 169.47.19.136.443 > 10.0.2.15.53132: Flags [.], seq 281466:285846, ack 902, win 65535, length 4380
21:49:48.741298 IP 10.0.2.15.53132 > 169.47.19.136.443: Flags [.], ack 281466, win 65535, length 0
21:49:48.741313 IP 10.0.2.15.53132 > 169.47.19.136.443: Flags [.], ack 285846, win 65535, length 0
21:49:48.741789 IP 169.47.19.136.443 > 10.0.2.15.53132: Flags [P.], seq 285846:286962, ack 902, win 65535, length 1116
21:49:48.741790 IP 169.47.19.136.443 > 10.0.2.15.53132: Flags [P.], seq 286962:288336, ack 902, win 65535, length 1374
21:49:48.741801 IP 10.0.2.15.53132 > 169.47.19.136.443: Flags [.], ack 286962, win 65535, length 0
21:49:48.741814 IP 10.0.2.15.53132 > 169.47.19.136.443: Flags [.], ack 288336, win 65535, length 0
21:49:48.742328 IP 169.47.19.136.443 > 10.0.2.15.53132: Flags [P.], seq 288336:295206, ack 902, win 65535, length 6870
21:49:48.742357 IP 10.0.2.15.53132 > 169.47.19.136.443: Flags [.], ack 295206, win 65535, length 0
21:49:48.742404 IP 169.47.19.136.443 > 10.0.2.15.53132: Flags [P.], seq 295206:297954, ack 902, win 65535, length 2748
21:49:48.742425 IP 10.0.2.15.53132 > 169.47.19.136.443: Flags [.], ack 297954, win 65535, length 0
21:49:48.743207 IP 169.47.19.136.443 > 10.0.2.15.53132: Flags [P.], seq 297954:303450, ack 902, win 65535, length 5496
21:49:48.743208 IP 169.47.19.136.443 > 10.0.2.15.53132: Flags [P.], seq 303450:306198, ack 902, win 65535, length 2748
21:49:48.743209 IP 169.47.19.136.443 > 10.0.2.15.53132: Flags [P.], seq 306198:308946, ack 902, win 65535, length 2748
21:49:48.743224 IP 10.0.2.15.53132 > 169.47.19.136.443: Flags [.], ack 303450, win 65535, length 0
21:49:48.743249 IP 10.0.2.15.53132 > 169.47.19.136.443: Flags [.], ack 306198, win 65535, length 0
21:49:48.743262 IP 10.0.2.15.53132 > 169.47.19.136.443: Flags [.], ack 308946, win 65535, length 0
21:49:48.743287 IP 169.47.19.136.443 > 10.0.2.15.53132: Flags [P.], seq 308946:311694, ack 902, win 65535, length 2748
21:49:48.743288 IP 169.47.19.136.443 > 10.0.2.15.53132: Flags [P.], seq 311694:315816, ack 902, win 65535, length 4122
21:49:48.743294 IP 10.0.2.15.53132 > 169.47.19.136.443: Flags [.], ack 311694, win 65535, length 0
21:49:48.743307 IP 10.0.2.15.53132 > 169.47.19.136.443: Flags [.], ack 315816, win 65535, length 0
21:49:48.743598 IP 169.47.19.136.443 > 10.0.2.15.53132: Flags [P.], seq 315816:318564, ack 902, win 65535, length 2748
21:49:48.743614 IP 10.0.2.15.53132 > 169.47.19.136.443: Flags [.], ack 318564, win 65535, length 0
21:49:48.743870 IP 169.47.19.136.443 > 10.0.2.15.53132: Flags [P.], seq 318564:324060, ack 902, win 65535, length 5496
21:49:48.743877 IP 10.0.2.15.53132 > 169.47.19.136.443: Flags [.], ack 324060, win 65535, length 0
21:49:48.744871 IP 169.47.19.136.443 > 10.0.2.15.53132: Flags [P.], seq 324060:329556, ack 902, win 65535, length 5496
21:49:48.744874 IP 169.47.19.136.443 > 10.0.2.15.53132: Flags [P.], seq 329556:332304, ack 902, win 65535, length 2748
21:49:48.744891 IP 10.0.2.15.53132 > 169.47.19.136.443: Flags [.], ack 329556, win 65535, length 0
21:49:48.745015 IP 10.0.2.15.53132 > 169.47.19.136.443: Flags [.], ack 332304, win 65535, length 0
21:49:48.745469 IP 169.47.19.136.443 > 10.0.2.15.53132: Flags [P.], seq 332304:335052, ack 902, win 65535, length 2748
21:49:48.745472 IP 169.47.19.136.443 > 10.0.2.15.53132: Flags [P.], seq 335052:340548, ack 902, win 65535, length 5496
21:49:48.745472 IP 169.47.19.136.443 > 10.0.2.15.53132: Flags [P.], seq 340548:344670, ack 902, win 65535, length 4122
21:49:48.745486 IP 10.0.2.15.53132 > 169.47.19.136.443: Flags [.], ack 335052, win 65535, length 0
21:49:48.745507 IP 10.0.2.15.53132 > 169.47.19.136.443: Flags [.], ack 340548, win 65535, length 0
21:49:48.745518 IP 10.0.2.15.53132 > 169.47.19.136.443: Flags [.], ack 344670, win 65535, length 0
21:49:48.745654 IP 169.47.19.136.443 > 10.0.2.15.53132: Flags [P.], seq 344670:348792, ack 902, win 65535, length 4122
21:49:48.745665 IP 10.0.2.15.53132 > 169.47.19.136.443: Flags [.], ack 348792, win 65535, length 0
21:49:48.745813 IP 169.47.19.136.443 > 10.0.2.15.53132: Flags [P.], seq 348792:352914, ack 902, win 65535, length 4122
21:49:48.745815 IP 169.47.19.136.443 > 10.0.2.15.53132: Flags [P.], seq 352914:354288, ack 902, win 65535, length 1374
21:49:48.745824 IP 10.0.2.15.53132 > 169.47.19.136.443: Flags [.], ack 352914, win 65535, length 0
21:49:48.745878 IP 10.0.2.15.53132 > 169.47.19.136.443: Flags [.], ack 354288, win 65535, length 0
21:49:48.746030 IP 169.47.19.136.443 > 10.0.2.15.53132: Flags [P.], seq 354288:358410, ack 902, win 65535, length 4122
21:49:48.746036 IP 10.0.2.15.53132 > 169.47.19.136.443: Flags [.], ack 358410, win 65535, length 0
21:49:48.750433 IP 169.47.19.136.443 > 10.0.2.15.53132: Flags [P.], seq 358410:368028, ack 902, win 65535, length 9618
21:49:48.750438 IP 169.47.19.136.443 > 10.0.2.15.53132: Flags [P.], seq 368028:374898, ack 902, win 65535, length 6870
21:49:48.750748 IP 10.0.2.15.53132 > 169.47.19.136.443: Flags [.], ack 368028, win 65535, length 0
21:49:48.750858 IP 10.0.2.15.53132 > 169.47.19.136.443: Flags [.], ack 374898, win 65535, length 0
21:49:48.750900 IP 169.47.19.136.443 > 10.0.2.15.53132: Flags [P.], seq 374898:377646, ack 902, win 65535, length 2748
21:49:48.750902 IP 169.47.19.136.443 > 10.0.2.15.53132: Flags [P.], seq 377646:383142, ack 902, win 65535, length 5496
21:49:48.750903 IP 169.47.19.136.443 > 10.0.2.15.53132: Flags [P.], seq 383142:385890, ack 902, win 65535, length 2748
21:49:48.750914 IP 10.0.2.15.53132 > 169.47.19.136.443: Flags [.], ack 377646, win 65535, length 0
21:49:48.750936 IP 10.0.2.15.53132 > 169.47.19.136.443: Flags [.], ack 383142, win 65535, length 0
21:49:48.750951 IP 10.0.2.15.53132 > 169.47.19.136.443: Flags [.], ack 385890, win 65535, length 0
21:49:48.750972 IP 169.47.19.136.443 > 10.0.2.15.53132: Flags [P.], seq 385890:388638, ack 902, win 65535, length 2748
21:49:48.750980 IP 10.0.2.15.53132 > 169.47.19.136.443: Flags [.], ack 388638, win 65535, length 0
21:49:48.752117 IP 169.47.19.136.443 > 10.0.2.15.53132: Flags [P.], seq 388638:395508, ack 902, win 65535, length 6870
21:49:48.752180 IP 10.0.2.15.53132 > 169.47.19.136.443: Flags [.], ack 395508, win 65535, length 0
21:49:48.752492 IP 169.47.19.136.443 > 10.0.2.15.53132: Flags [P.], seq 395508:401004, ack 902, win 65535, length 5496
21:49:48.752510 IP 10.0.2.15.53132 > 169.47.19.136.443: Flags [.], ack 401004, win 65535, length 0
21:49:48.753734 IP 169.47.19.136.443 > 10.0.2.15.53132: Flags [P.], seq 401004:402378, ack 902, win 65535, length 1374
21:49:48.753754 IP 10.0.2.15.53132 > 169.47.19.136.443: Flags [.], ack 402378, win 65535, length 0
21:49:48.754683 IP 169.47.19.136.443 > 10.0.2.15.53132: Flags [P.], seq 402378:409248, ack 902, win 65535, length 6870
21:49:48.754685 IP 169.47.19.136.443 > 10.0.2.15.53132: Flags [P.], seq 409248:413370, ack 902, win 65535, length 4122
21:49:48.754742 IP 10.0.2.15.53132 > 169.47.19.136.443: Flags [.], ack 409248, win 65535, length 0
21:49:48.754964 IP 10.0.2.15.53132 > 169.47.19.136.443: Flags [.], ack 413370, win 65535, length 0
21:49:48.755054 IP 169.47.19.136.443 > 10.0.2.15.53132: Flags [P.], seq 413370:418866, ack 902, win 65535, length 5496
21:49:48.755067 IP 10.0.2.15.53132 > 169.47.19.136.443: Flags [.], ack 418866, win 65535, length 0
21:49:48.755491 IP 169.47.19.136.443 > 10.0.2.15.53132: Flags [P.], seq 418866:421614, ack 902, win 65535, length 2748
21:49:48.755499 IP 10.0.2.15.53132 > 169.47.19.136.443: Flags [.], ack 421614, win 65535, length 0
21:49:48.756979 IP 169.47.19.136.443 > 10.0.2.15.53132: Flags [P.], seq 421614:427110, ack 902, win 65535, length 5496
21:49:48.756982 IP 169.47.19.136.443 > 10.0.2.15.53132: Flags [P.], seq 427110:431232, ack 902, win 65535, length 4122
21:49:48.757009 IP 10.0.2.15.53132 > 169.47.19.136.443: Flags [.], ack 427110, win 65535, length 0
21:49:48.757052 IP 10.0.2.15.53132 > 169.47.19.136.443: Flags [.], ack 431232, win 65535, length 0
21:49:48.757644 IP 169.47.19.136.443 > 10.0.2.15.53132: Flags [P.], seq 431232:432606, ack 902, win 65535, length 1374
21:49:48.757654 IP 10.0.2.15.53132 > 169.47.19.136.443: Flags [.], ack 432606, win 65535, length 0
21:49:48.759295 IP 169.47.19.136.443 > 10.0.2.15.53132: Flags [.], seq 432606:434066, ack 902, win 65535, length 1460
21:49:48.759351 IP 10.0.2.15.53132 > 169.47.19.136.443: Flags [.], ack 434066, win 65535, length 0
21:49:48.759600 IP 169.47.19.136.443 > 10.0.2.15.53132: Flags [P.], seq 434066:436728, ack 902, win 65535, length 2662
21:49:48.759614 IP 10.0.2.15.53132 > 169.47.19.136.443: Flags [.], ack 436728, win 65535, length 0
21:49:48.760160 IP 169.47.19.136.443 > 10.0.2.15.53132: Flags [P.], seq 436728:438102, ack 902, win 65535, length 1374
21:49:48.760176 IP 10.0.2.15.53132 > 169.47.19.136.443: Flags [.], ack 438102, win 65535, length 0
21:49:48.761796 IP 169.47.19.136.443 > 10.0.2.15.53132: Flags [.], seq 438102:443942, ack 902, win 65535, length 5840
21:49:48.761826 IP 10.0.2.15.53132 > 169.47.19.136.443: Flags [.], ack 443942, win 65535, length 0
21:49:48.762340 IP 169.47.19.136.443 > 10.0.2.15.53132: Flags [P.], seq 443942:446346, ack 902, win 65535, length 2404
21:49:48.762342 IP 169.47.19.136.443 > 10.0.2.15.53132: Flags [.], seq 446346:447806, ack 902, win 65535, length 1460
21:49:48.762363 IP 10.0.2.15.53132 > 169.47.19.136.443: Flags [.], ack 446346, win 65535, length 0
21:49:48.762487 IP 10.0.2.15.53132 > 169.47.19.136.443: Flags [.], ack 447806, win 65535, length 0
21:49:48.762682 IP 169.47.19.136.443 > 10.0.2.15.53132: Flags [P.], seq 447806:454590, ack 902, win 65535, length 6784
21:49:48.762686 IP 169.47.19.136.443 > 10.0.2.15.53132: Flags [P.], seq 454590:468330, ack 902, win 65535, length 13740
21:49:48.762696 IP 10.0.2.15.53132 > 169.47.19.136.443: Flags [.], ack 454590, win 65535, length 0
21:49:48.762781 IP 10.0.2.15.53132 > 169.47.19.136.443: Flags [.], ack 468330, win 65535, length 0
21:49:48.763915 IP 169.47.19.136.443 > 10.0.2.15.53132: Flags [P.], seq 468330:476574, ack 902, win 65535, length 8244
21:49:48.763919 IP 169.47.19.136.443 > 10.0.2.15.53132: Flags [P.], seq 476574:480696, ack 902, win 65535, length 4122
21:49:48.763939 IP 10.0.2.15.53132 > 169.47.19.136.443: Flags [.], ack 476574, win 65535, length 0
21:49:48.764172 IP 10.0.2.15.53132 > 169.47.19.136.443: Flags [.], ack 480696, win 65535, length 0

