21:49:21.164609 IP 10.0.2.15.59612 > 140.233.253.2.53: 10775+ A? www.indeed.com. (32)
21:49:21.164655 IP 10.0.2.15.59612 > 140.233.253.2.53: 57370+ AAAA? www.indeed.com. (32)
21:49:21.170767 IP 140.233.253.2.53 > 10.0.2.15.59612: 10775 2/0/0 CNAME us.dyn.indeed.com., A 169.45.207.200 (69)
21:49:21.170955 IP 140.233.253.2.53 > 10.0.2.15.59612: 57370 1/1/0 CNAME us.dyn.indeed.com. (118)
21:49:21.171169 IP 10.0.2.15.36540 > 169.45.207.200.443: Flags [S], seq 713013636, win 64240, options [mss 1460,sackOK,TS val 4229596417 ecr 0,nop,wscale 6], length 0
21:49:21.189006 IP 169.45.207.200.443 > 10.0.2.15.36540: Flags [S.], seq 272256001, ack 713013637, win 65535, options [mss 1460], length 0
21:49:21.189045 IP 10.0.2.15.36540 > 169.45.207.200.443: Flags [.], ack 1, win 64240, length 0
21:49:21.205359 IP 10.0.2.15.36540 > 169.45.207.200.443: Flags [P.], seq 1:518, ack 1, win 64240, length 517
21:49:21.205846 IP 169.45.207.200.443 > 10.0.2.15.36540: Flags [.], ack 518, win 65535, length 0
21:49:21.227090 IP 169.45.207.200.443 > 10.0.2.15.36540: Flags [.], seq 1:2921, ack 518, win 65535, length 2920
21:49:21.227154 IP 10.0.2.15.36540 > 169.45.207.200.443: Flags [.], ack 2921, win 62780, length 0
21:49:21.227707 IP 169.45.207.200.443 > 10.0.2.15.36540: Flags [P.], seq 2921:4123, ack 518, win 65535, length 1202
21:49:21.227709 IP 169.45.207.200.443 > 10.0.2.15.36540: Flags [P.], seq 4123:4375, ack 518, win 65535, length 252
21:49:21.227730 IP 10.0.2.15.36540 > 169.45.207.200.443: Flags [.], ack 4123, win 61578, length 0
21:49:21.227760 IP 10.0.2.15.36540 > 169.45.207.200.443: Flags [.], ack 4375, win 61326, length 0
21:49:21.228801 IP 10.0.2.15.36540 > 169.45.207.200.443: Flags [P.], seq 518:644, ack 4375, win 62780, length 126
21:49:21.229101 IP 169.45.207.200.443 > 10.0.2.15.36540: Flags [.], ack 644, win 65535, length 0
21:49:21.246134 IP 169.45.207.200.443 > 10.0.2.15.36540: Flags [P.], seq 4375:4495, ack 644, win 65535, length 120
21:49:21.246158 IP 10.0.2.15.36540 > 169.45.207.200.443: Flags [.], ack 4495, win 62780, length 0
21:49:21.246642 IP 10.0.2.15.36540 > 169.45.207.200.443: Flags [P.], seq 644:697, ack 4495, win 62780, length 53
21:49:21.246688 IP 10.0.2.15.36540 > 169.45.207.200.443: Flags [P.], seq 697:753, ack 4495, win 62780, length 56
21:49:21.246786 IP 10.0.2.15.36540 > 169.45.207.200.443: Flags [P.], seq 753:795, ack 4495, win 62780, length 42
21:49:21.247188 IP 169.45.207.200.443 > 10.0.2.15.36540: Flags [.], ack 697, win 65535, length 0
21:49:21.247190 IP 169.45.207.200.443 > 10.0.2.15.36540: Flags [.], ack 753, win 65535, length 0
21:49:21.247191 IP 169.45.207.200.443 > 10.0.2.15.36540: Flags [.], ack 795, win 65535, length 0
21:49:21.247268 IP 10.0.2.15.36540 > 169.45.207.200.443: Flags [P.], seq 795:864, ack 4495, win 62780, length 69
21:49:21.247656 IP 169.45.207.200.443 > 10.0.2.15.36540: Flags [.], ack 864, win 65535, length 0
21:49:21.247757 IP 10.0.2.15.36540 > 169.45.207.200.443: Flags [P.], seq 864:902, ack 4495, win 62780, length 38
21:49:21.248079 IP 169.45.207.200.443 > 10.0.2.15.36540: Flags [.], ack 902, win 65535, length 0
21:49:21.262714 IP 169.45.207.200.443 > 10.0.2.15.36540: Flags [P.], seq 4495:4533, ack 902, win 65535, length 38
21:49:21.262735 IP 10.0.2.15.36540 > 169.45.207.200.443: Flags [.], ack 4533, win 62780, length 0
21:49:21.278080 IP 169.45.207.200.443 > 10.0.2.15.36540: Flags [P.], seq 4533:14151, ack 902, win 65535, length 9618
21:49:21.278114 IP 10.0.2.15.36540 > 169.45.207.200.443: Flags [.], ack 14151, win 58400, length 0
21:49:21.279473 IP 169.45.207.200.443 > 10.0.2.15.36540: Flags [P.], seq 14151:18273, ack 902, win 65535, length 4122
21:49:21.279492 IP 10.0.2.15.36540 > 169.45.207.200.443: Flags [.], ack 18273, win 61320, length 0
21:49:21.294352 IP 169.45.207.200.443 > 10.0.2.15.36540: Flags [P.], seq 18273:29265, ack 902, win 65535, length 10992
21:49:21.294410 IP 10.0.2.15.36540 > 169.45.207.200.443: Flags [.], ack 29265, win 56940, length 0
21:49:21.294552 IP 169.45.207.200.443 > 10.0.2.15.36540: Flags [.], seq 29265:32185, ack 902, win 65535, length 2920
21:49:21.294565 IP 10.0.2.15.36540 > 169.45.207.200.443: Flags [.], ack 32185, win 55480, length 0
21:49:21.295020 IP 169.45.207.200.443 > 10.0.2.15.36540: Flags [P.], seq 32185:36135, ack 902, win 65535, length 3950
21:49:21.295022 IP 169.45.207.200.443 > 10.0.2.15.36540: Flags [P.], seq 36135:37509, ack 902, win 65535, length 1374
21:49:21.295041 IP 10.0.2.15.36540 > 169.45.207.200.443: Flags [.], ack 36135, win 52560, length 0
21:49:21.295487 IP 10.0.2.15.36540 > 169.45.207.200.443: Flags [.], ack 37509, win 62780, length 0
21:49:21.296021 IP 169.45.207.200.443 > 10.0.2.15.36540: Flags [P.], seq 37509:45753, ack 902, win 65535, length 8244
21:49:21.296096 IP 10.0.2.15.36540 > 169.45.207.200.443: Flags [.], ack 45753, win 58400, length 0
21:49:21.310595 IP 169.45.207.200.443 > 10.0.2.15.36540: Flags [P.], seq 45753:58119, ack 902, win 65535, length 12366
21:49:21.310653 IP 169.45.207.200.443 > 10.0.2.15.36540: Flags [P.], seq 58119:62241, ack 902, win 65535, length 4122
21:49:21.310655 IP 169.45.207.200.443 > 10.0.2.15.36540: Flags [.], seq 62241:63701, ack 902, win 65535, length 1460
21:49:21.310781 IP 10.0.2.15.36540 > 169.45.207.200.443: Flags [.], ack 63701, win 52560, length 0
21:49:21.311095 IP 169.45.207.200.443 > 10.0.2.15.36540: Flags [P.], seq 63701:64989, ack 902, win 65535, length 1288
21:49:21.311140 IP 10.0.2.15.36540 > 169.45.207.200.443: Flags [.], ack 64989, win 62780, length 0
21:49:21.312186 IP 169.45.207.200.443 > 10.0.2.15.36540: Flags [P.], seq 64989:70485, ack 902, win 65535, length 5496
21:49:21.312367 IP 10.0.2.15.36540 > 169.45.207.200.443: Flags [.], ack 70485, win 62780, length 0
21:49:21.313118 IP 169.45.207.200.443 > 10.0.2.15.36540: Flags [P.], seq 70485:71859, ack 902, win 65535, length 1374
21:49:21.313137 IP 10.0.2.15.36540 > 169.45.207.200.443: Flags [.], ack 71859, win 65535, length 0
21:49:21.315890 IP 169.45.207.200.443 > 10.0.2.15.36540: Flags [.], seq 71859:98139, ack 902, win 65535, length 26280
21:49:21.315927 IP 10.0.2.15.36540 > 169.45.207.200.443: Flags [.], ack 98139, win 65535, length 0
21:49:21.316231 IP 169.45.207.200.443 > 10.0.2.15.36540: Flags [P.], seq 98139:100713, ack 902, win 65535, length 2574
21:49:21.316241 IP 10.0.2.15.36540 > 169.45.207.200.443: Flags [.], ack 100713, win 65535, length 0
21:49:21.327826 IP 169.45.207.200.443 > 10.0.2.15.36540: Flags [P.], seq 100713:113079, ack 902, win 65535, length 12366
21:49:21.327859 IP 10.0.2.15.36540 > 169.45.207.200.443: Flags [.], ack 113079, win 65535, length 0
21:49:21.328242 IP 169.45.207.200.443 > 10.0.2.15.36540: Flags [P.], seq 113079:117201, ack 902, win 65535, length 4122
21:49:21.328246 IP 169.45.207.200.443 > 10.0.2.15.36540: Flags [P.], seq 117201:124071, ack 902, win 65535, length 6870
21:49:21.328347 IP 10.0.2.15.36540 > 169.45.207.200.443: Flags [.], ack 117201, win 65535, length 0
21:49:21.328379 IP 10.0.2.15.36540 > 169.45.207.200.443: Flags [.], ack 124071, win 65535, length 0
21:49:21.328548 IP 169.45.207.200.443 > 10.0.2.15.36540: Flags [P.], seq 124071:128193, ack 902, win 65535, length 4122
21:49:21.328552 IP 169.45.207.200.443 > 10.0.2.15.36540: Flags [P.], seq 128193:136437, ack 902, win 65535, length 8244
21:49:21.328654 IP 10.0.2.15.36540 > 169.45.207.200.443: Flags [.], ack 128193, win 65535, length 0
21:49:21.328683 IP 10.0.2.15.36540 > 169.45.207.200.443: Flags [.], ack 136437, win 65535, length 0
21:49:21.328764 IP 169.45.207.200.443 > 10.0.2.15.36540: Flags [P.], seq 136437:137811, ack 902, win 65535, length 1374
21:49:21.328773 IP 10.0.2.15.36540 > 169.45.207.200.443: Flags [.], ack 137811, win 65535, length 0
21:49:21.329195 IP 169.45.207.200.443 > 10.0.2.15.36540: Flags [P.], seq 137811:139185, ack 902, win 65535, length 1374
21:49:21.329208 IP 10.0.2.15.36540 > 169.45.207.200.443: Flags [.], ack 139185, win 65535, length 0
21:49:21.330542 IP 169.45.207.200.443 > 10.0.2.15.36540: Flags [P.], seq 139185:146055, ack 902, win 65535, length 6870
21:49:21.330570 IP 10.0.2.15.36540 > 169.45.207.200.443: Flags [.], ack 146055, win 65535, length 0
21:49:21.331890 IP 169.45.207.200.443 > 10.0.2.15.36540: Flags [P.], seq 146055:154299, ack 902, win 65535, length 8244
21:49:21.331894 IP 169.45.207.200.443 > 10.0.2.15.36540: Flags [P.], seq 154299:159795, ack 902, win 65535, length 5496
21:49:21.331918 IP 10.0.2.15.36540 > 169.45.207.200.443: Flags [.], ack 154299, win 65535, length 0
21:49:21.332847 IP 10.0.2.15.36540 > 169.45.207.200.443: Flags [.], ack 159795, win 65535, length 0
21:49:21.332936 IP 169.45.207.200.443 > 10.0.2.15.36540: Flags [P.], seq 159795:162543, ack 902, win 65535, length 2748
21:49:21.332938 IP 169.45.207.200.443 > 10.0.2.15.36540: Flags [P.], seq 162543:168039, ack 902, win 65535, length 5496
21:49:21.332938 IP 169.45.207.200.443 > 10.0.2.15.36540: Flags [P.], seq 168039:170787, ack 902, win 65535, length 2748
21:49:21.332948 IP 10.0.2.15.36540 > 169.45.207.200.443: Flags [.], ack 162543, win 65535, length 0
21:49:21.332962 IP 10.0.2.15.36540 > 169.45.207.200.443: Flags [.], ack 168039, win 65535, length 0
21:49:21.332984 IP 10.0.2.15.36540 > 169.45.207.200.443: Flags [.], ack 170787, win 65535, length 0
21:49:21.333000 IP 169.45.207.200.443 > 10.0.2.15.36540: Flags [P.], seq 170787:172161, ack 902, win 65535, length 1374
21:49:21.333002 IP 169.45.207.200.443 > 10.0.2.15.36540: Flags [P.], seq 172161:177657, ack 902, win 65535, length 5496
21:49:21.333003 IP 169.45.207.200.443 > 10.0.2.15.36540: Flags [P.], seq 177657:181779, ack 902, win 65535, length 4122
21:49:21.333008 IP 10.0.2.15.36540 > 169.45.207.200.443: Flags [.], ack 172161, win 65535, length 0
21:49:21.333020 IP 10.0.2.15.36540 > 169.45.207.200.443: Flags [.], ack 177657, win 65535, length 0
21:49:21.333029 IP 10.0.2.15.36540 > 169.45.207.200.443: Flags [.], ack 181779, win 65535, length 0
21:49:21.333615 IP 169.45.207.200.443 > 10.0.2.15.36540: Flags [P.], seq 181779:188649, ack 902, win 65535, length 6870
21:49:21.333631 IP 10.0.2.15.36540 > 169.45.207.200.443: Flags [.], ack 188649, win 65535, length 0
21:49:21.333827 IP 169.45.207.200.443 > 10.0.2.15.36540: Flags [P.], seq 188649:192771, ack 902, win 65535, length 4122
21:49:21.333837 IP 10.0.2.15.36540 > 169.45.207.200.443: Flags [.], ack 192771, win 65535, length 0
21:49:21.334395 IP 169.45.207.200.443 > 10.0.2.15.36540: Flags [P.], seq 192771:201015, ack 902, win 65535, length 8244
21:49:21.334411 IP 10.0.2.15.36540 > 169.45.207.200.443: Flags [.], ack 201015, win 65535, length 0
21:49:21.344202 IP 169.45.207.200.443 > 10.0.2.15.36540: Flags [P.], seq 201015:206511, ack 902, win 65535, length 5496
21:49:21.344232 IP 10.0.2.15.36540 > 169.45.207.200.443: Flags [.], ack 206511, win 65535, length 0
21:49:21.344826 IP 169.45.207.200.443 > 10.0.2.15.36540: Flags [.], seq 206511:207971, ack 902, win 65535, length 1460
21:49:21.344846 IP 10.0.2.15.36540 > 169.45.207.200.443: Flags [.], ack 207971, win 65535, length 0
21:49:21.348783 IP 169.45.207.200.443 > 10.0.2.15.36540: Flags [P.], seq 207971:214755, ack 902, win 65535, length 6784
21:49:21.348786 IP 169.45.207.200.443 > 10.0.2.15.36540: Flags [P.], seq 214755:222999, ack 902, win 65535, length 8244
21:49:21.348808 IP 10.0.2.15.36540 > 169.45.207.200.443: Flags [.], ack 214755, win 65535, length 0
21:49:21.348832 IP 10.0.2.15.36540 > 169.45.207.200.443: Flags [.], ack 222999, win 65535, length 0
21:49:21.348885 IP 169.45.207.200.443 > 10.0.2.15.36540: Flags [P.], seq 222999:242235, ack 902, win 65535, length 19236
21:49:21.348893 IP 10.0.2.15.36540 > 169.45.207.200.443: Flags [.], ack 242235, win 65535, length 0
21:49:21.349609 IP 169.45.207.200.443 > 10.0.2.15.36540: Flags [.], seq 242235:245155, ack 902, win 65535, length 2920
21:49:21.350066 IP 169.45.207.200.443 > 10.0.2.15.36540: Flags [P.], seq 245155:284829, ack 902, win 65535, length 39674
21:49:21.350980 IP 10.0.2.15.36540 > 169.45.207.200.443: Flags [.], ack 245155, win 65535, length 0
21:49:21.351515 IP 10.0.2.15.36540 > 169.45.207.200.443: Flags [.], ack 284829, win 65535, length 0
21:49:21.352580 IP 169.45.207.200.443 > 10.0.2.15.36540: Flags [P.], seq 284829:324675, ack 902, win 65535, length 39846
21:49:21.352728 IP 10.0.2.15.36540 > 169.45.207.200.443: Flags [.], ack 324675, win 65535, length 0
21:49:21.353027 IP 169.45.207.200.443 > 10.0.2.15.36540: Flags [.], seq 324675:329055, ack 902, win 65535, length 4380
21:49:21.353041 IP 10.0.2.15.36540 > 169.45.207.200.443: Flags [.], ack 329055, win 65535, length 0
21:49:21.353342 IP 169.45.207.200.443 > 10.0.2.15.36540: Flags [P.], seq 329055:332919, ack 902, win 65535, length 3864
21:49:21.353345 IP 169.45.207.200.443 > 10.0.2.15.36540: Flags [P.], seq 332919:337041, ack 902, win 65535, length 4122
21:49:21.353429 IP 10.0.2.15.36540 > 169.45.207.200.443: Flags [.], ack 332919, win 65535, length 0
21:49:21.353450 IP 10.0.2.15.36540 > 169.45.207.200.443: Flags [.], ack 337041, win 65535, length 0
21:49:21.353778 IP 169.45.207.200.443 > 10.0.2.15.36540: Flags [P.], seq 337041:341163, ack 902, win 65535, length 4122
21:49:21.353790 IP 169.45.207.200.443 > 10.0.2.15.36540: Flags [P.], seq 341163:343911, ack 902, win 65535, length 2748
21:49:21.353791 IP 169.45.207.200.443 > 10.0.2.15.36540: Flags [P.], seq 343911:346659, ack 902, win 65535, length 2748
21:49:21.353792 IP 169.45.207.200.443 > 10.0.2.15.36540: Flags [P.], seq 346659:349407, ack 902, win 65535, length 2748
21:49:21.353817 IP 10.0.2.15.36540 > 169.45.207.200.443: Flags [.], ack 341163, win 65535, length 0
21:49:21.353860 IP 10.0.2.15.36540 > 169.45.207.200.443: Flags [.], ack 343911, win 65535, length 0
21:49:21.353872 IP 10.0.2.15.36540 > 169.45.207.200.443: Flags [.], ack 346659, win 65535, length 0
21:49:21.353923 IP 10.0.2.15.36540 > 169.45.207.200.443: Flags [.], ack 349407, win 65535, length 0
21:49:21.353943 IP 169.45.207.200.443 > 10.0.2.15.36540: Flags [P.], seq 349407:354903, ack 902, win 65535, length 5496
21:49:21.353947 IP 10.0.2.15.36540 > 169.45.207.200.443: Flags [.], ack 354903, win 65535, length 0
21:49:21.354251 IP 169.45.207.200.443 > 10.0.2.15.36540: Flags [P.], seq 354903:360399, ack 902, win 65535, length 5496
21:49:21.354582 IP 169.45.207.200.443 > 10.0.2.15.36540: Flags [P.], seq 360399:363147, ack 902, win 65535, length 2748
21:49:21.354584 IP 169.45.207.200.443 > 10.0.2.15.36540: Flags [P.], seq 363147:365895, ack 902, win 65535, length 2748
21:49:21.354606 IP 10.0.2.15.36540 > 169.45.207.200.443: Flags [.], ack 360399, win 65535, length 0
21:49:21.354623 IP 10.0.2.15.36540 > 169.45.207.200.443: Flags [.], ack 365895, win 65535, length 0
21:49:21.355021 IP 169.45.207.200.443 > 10.0.2.15.36540: Flags [P.], seq 365895:370017, ack 902, win 65535, length 4122
21:49:21.355034 IP 10.0.2.15.36540 > 169.45.207.200.443: Flags [.], ack 370017, win 65535, length 0
21:49:21.355500 IP 169.45.207.200.443 > 10.0.2.15.36540: Flags [P.], seq 370017:375513, ack 902, win 65535, length 5496
21:49:21.355503 IP 169.45.207.200.443 > 10.0.2.15.36540: Flags [P.], seq 375513:381009, ack 902, win 65535, length 5496
21:49:21.355518 IP 10.0.2.15.36540 > 169.45.207.200.443: Flags [.], ack 375513, win 65535, length 0
21:49:21.355661 IP 10.0.2.15.36540 > 169.45.207.200.443: Flags [.], ack 381009, win 65535, length 0
21:49:21.355806 IP 169.45.207.200.443 > 10.0.2.15.36540: Flags [P.], seq 381009:387879, ack 902, win 65535, length 6870
21:49:21.355807 IP 169.45.207.200.443 > 10.0.2.15.36540: Flags [P.], seq 387879:390627, ack 902, win 65535, length 2748
21:49:21.355820 IP 10.0.2.15.36540 > 169.45.207.200.443: Flags [.], ack 387879, win 65535, length 0
21:49:21.355838 IP 10.0.2.15.36540 > 169.45.207.200.443: Flags [.], ack 390627, win 65535, length 0
21:49:21.356043 IP 169.45.207.200.443 > 10.0.2.15.36540: Flags [P.], seq 390627:394749, ack 902, win 65535, length 4122
21:49:21.356053 IP 10.0.2.15.36540 > 169.45.207.200.443: Flags [.], ack 394749, win 65535, length 0
21:49:21.356331 IP 169.45.207.200.443 > 10.0.2.15.36540: Flags [P.], seq 394749:396123, ack 902, win 65535, length 1374
21:49:21.356341 IP 10.0.2.15.36540 > 169.45.207.200.443: Flags [.], ack 396123, win 65535, length 0
21:49:21.357280 IP 169.45.207.200.443 > 10.0.2.15.36540: Flags [P.], seq 396123:400245, ack 902, win 65535, length 4122
21:49:21.357289 IP 10.0.2.15.36540 > 169.45.207.200.443: Flags [.], ack 400245, win 65535, length 0
21:49:21.359901 IP 169.45.207.200.443 > 10.0.2.15.36540: Flags [P.], seq 400245:409863, ack 902, win 65535, length 9618
21:49:21.359903 IP 169.45.207.200.443 > 10.0.2.15.36540: Flags [P.], seq 409863:411237, ack 902, win 65535, length 1374
21:49:21.359975 IP 10.0.2.15.36540 > 169.45.207.200.443: Flags [.], ack 409863, win 65535, length 0
21:49:21.360011 IP 10.0.2.15.36540 > 169.45.207.200.443: Flags [.], ack 411237, win 65535, length 0
21:49:21.361353 IP 169.45.207.200.443 > 10.0.2.15.36540: Flags [P.], seq 411237:412611, ack 902, win 65535, length 1374
21:49:21.361619 IP 10.0.2.15.36540 > 169.45.207.200.443: Flags [.], ack 412611, win 65535, length 0
21:49:21.362213 IP 169.45.207.200.443 > 10.0.2.15.36540: Flags [P.], seq 412611:422229, ack 902, win 65535, length 9618
21:49:21.362232 IP 10.0.2.15.36540 > 169.45.207.200.443: Flags [.], ack 422229, win 65535, length 0
21:49:21.362846 IP 169.45.207.200.443 > 10.0.2.15.36540: Flags [P.], seq 422229:423603, ack 902, win 65535, length 1374
21:49:21.362883 IP 10.0.2.15.36540 > 169.45.207.200.443: Flags [.], ack 423603, win 65535, length 0
21:49:21.364302 IP 169.45.207.200.443 > 10.0.2.15.36540: Flags [P.], seq 423603:434595, ack 902, win 65535, length 10992
21:49:21.364325 IP 10.0.2.15.36540 > 169.45.207.200.443: Flags [.], ack 434595, win 65535, length 0
21:49:21.364470 IP 169.45.207.200.443 > 10.0.2.15.36540: Flags [P.], seq 434595:437343, ack 902, win 65535, length 2748
21:49:21.364472 IP 169.45.207.200.443 > 10.0.2.15.36540: Flags [P.], seq 437343:438717, ack 902, win 65535, length 1374
21:49:21.364485 IP 10.0.2.15.36540 > 169.45.207.200.443: Flags [.], ack 437343, win 65535, length 0
21:49:21.364500 IP 10.0.2.15.36540 > 169.45.207.200.443: Flags [.], ack 438717, win 65535, length 0
21:49:21.365012 IP 169.45.207.200.443 > 10.0.2.15.36540: Flags [P.], seq 438717:444213, ack 902, win 65535, length 5496
21:49:21.365064 IP 10.0.2.15.36540 > 169.45.207.200.443: Flags [.], ack 444213, win 65535, length 0
21:49:21.367431 IP 169.45.207.200.443 > 10.0.2.15.36540: Flags [P.], seq 444213:452457, ack 902, win 65535, length 8244
21:49:21.367479 IP 169.45.207.200.443 > 10.0.2.15.36540: Flags [P.], seq 452457:456579, ack 902, win 65535, length 4122
21:49:21.367507 IP 10.0.2.15.36540 > 169.45.207.200.443: Flags [.], ack 452457, win 65535, length 0
21:49:21.367552 IP 10.0.2.15.36540 > 169.45.207.200.443: Flags [.], ack 456579, win 65535, length 0
21:49:21.367764 IP 169.45.207.200.443 > 10.0.2.15.36540: Flags [.], seq 456579:458039, ack 902, win 65535, length 1460
21:49:21.367780 IP 10.0.2.15.36540 > 169.45.207.200.443: Flags [.], ack 458039, win 65535, length 0
21:49:21.367956 IP 169.45.207.200.443 > 10.0.2.15.36540: Flags [P.], seq 458039:463449, ack 902, win 65535, length 5410
21:49:21.367959 IP 169.45.207.200.443 > 10.0.2.15.36540: Flags [P.], seq 463449:470319, ack 902, win 65535, length 6870
21:49:21.367976 IP 10.0.2.15.36540 > 169.45.207.200.443: Flags [.], ack 463449, win 65535, length 0
21:49:21.368002 IP 10.0.2.15.36540 > 169.45.207.200.443: Flags [.], ack 470319, win 65535, length 0
21:49:21.368183 IP 169.45.207.200.443 > 10.0.2.15.36540: Flags [.], seq 470319:471779, ack 902, win 65535, length 1460
21:49:21.368197 IP 10.0.2.15.36540 > 169.45.207.200.443: Flags [.], ack 471779, win 65535, length 0
21:49:21.368456 IP 169.45.207.200.443 > 10.0.2.15.36540: Flags [P.], seq 471779:473067, ack 902, win 65535, length 1288
21:49:21.368459 IP 169.45.207.200.443 > 10.0.2.15.36540: Flags [P.], seq 473067:477189, ack 902, win 65535, length 4122
21:49:21.368476 IP 10.0.2.15.36540 > 169.45.207.200.443: Flags [.], ack 473067, win 65535, length 0
21:49:21.368497 IP 10.0.2.15.36540 > 169.45.207.200.443: Flags [.], ack 477189, win 65535, length 0
21:49:21.368839 IP 169.45.207.200.443 > 10.0.2.15.36540: Flags [P.], seq 477189:478563, ack 902, win 65535, length 1374
21:49:21.368853 IP 10.0.2.15.36540 > 169.45.207.200.443: Flags [.], ack 478563, win 65535, length 0
21:49:21.372766 IP 169.45.207.200.443 > 10.0.2.15.36540: Flags [P.], seq 478563:488181, ack 902, win 65535, length 9618

