21:49:02.911607 IP 10.0.2.15.55876 > 140.233.253.2.53: 28519+ A? www.indeed.com. (32)
21:49:02.912009 IP 10.0.2.15.55876 > 140.233.253.2.53: 23931+ AAAA? www.indeed.com. (32)
21:49:02.918001 IP 140.233.253.2.53 > 10.0.2.15.55876: 23931 1/1/0 CNAME us.dyn.indeed.com. (118)
21:49:02.918003 IP 140.233.253.2.53 > 10.0.2.15.55876: 28519 2/0/0 CNAME us.dyn.indeed.com., A 18.216.114.70 (69)
21:49:02.918296 IP 10.0.2.15.33186 > 18.216.114.70.443: Flags [S], seq 3929740624, win 64240, options [mss 1460,sackOK,TS val 516587648 ecr 0,nop,wscale 6], length 0
21:49:02.951953 IP 18.216.114.70.443 > 10.0.2.15.33186: Flags [S.], seq 271808001, ack 3929740625, win 65535, options [mss 1460], length 0
21:49:02.951999 IP 10.0.2.15.33186 > 18.216.114.70.443: Flags [.], ack 1, win 64240, length 0
21:49:02.967534 IP 10.0.2.15.33186 > 18.216.114.70.443: Flags [P.], seq 1:518, ack 1, win 64240, length 517
21:49:02.968027 IP 18.216.114.70.443 > 10.0.2.15.33186: Flags [.], ack 518, win 65535, length 0
21:49:03.003330 IP 18.216.114.70.443 > 10.0.2.15.33186: Flags [.], seq 1:2921, ack 518, win 65535, length 2920
21:49:03.003350 IP 10.0.2.15.33186 > 18.216.114.70.443: Flags [.], ack 2921, win 62780, length 0
21:49:03.003862 IP 18.216.114.70.443 > 10.0.2.15.33186: Flags [P.], seq 2921:4123, ack 518, win 65535, length 1202
21:49:03.003863 IP 18.216.114.70.443 > 10.0.2.15.33186: Flags [P.], seq 4123:4375, ack 518, win 65535, length 252
21:49:03.003883 IP 10.0.2.15.33186 > 18.216.114.70.443: Flags [.], ack 4123, win 61578, length 0
21:49:03.003899 IP 10.0.2.15.33186 > 18.216.114.70.443: Flags [.], ack 4375, win 61326, length 0
21:49:03.005681 IP 10.0.2.15.33186 > 18.216.114.70.443: Flags [P.], seq 518:644, ack 4375, win 62780, length 126
21:49:03.006157 IP 18.216.114.70.443 > 10.0.2.15.33186: Flags [.], ack 644, win 65535, length 0
21:49:03.036990 IP 18.216.114.70.443 > 10.0.2.15.33186: Flags [P.], seq 4375:4495, ack 644, win 65535, length 120
21:49:03.037014 IP 10.0.2.15.33186 > 18.216.114.70.443: Flags [.], ack 4495, win 62780, length 0
21:49:03.037478 IP 10.0.2.15.33186 > 18.216.114.70.443: Flags [P.], seq 644:697, ack 4495, win 62780, length 53
21:49:03.037516 IP 10.0.2.15.33186 > 18.216.114.70.443: Flags [P.], seq 697:753, ack 4495, win 62780, length 56
21:49:03.037705 IP 10.0.2.15.33186 > 18.216.114.70.443: Flags [P.], seq 753:902, ack 4495, win 62780, length 149
21:49:03.038419 IP 18.216.114.70.443 > 10.0.2.15.33186: Flags [.], ack 697, win 65535, length 0
21:49:03.038421 IP 18.216.114.70.443 > 10.0.2.15.33186: Flags [.], ack 753, win 65535, length 0
21:49:03.038422 IP 18.216.114.70.443 > 10.0.2.15.33186: Flags [.], ack 902, win 65535, length 0
21:49:03.069594 IP 18.216.114.70.443 > 10.0.2.15.33186: Flags [P.], seq 4495:4533, ack 902, win 65535, length 38
21:49:03.069619 IP 10.0.2.15.33186 > 18.216.114.70.443: Flags [.], ack 4533, win 62780, length 0
21:49:03.081390 IP 18.216.114.70.443 > 10.0.2.15.33186: Flags [P.], seq 4533:8655, ack 902, win 65535, length 4122
21:49:03.081417 IP 10.0.2.15.33186 > 18.216.114.70.443: Flags [.], ack 8655, win 61320, length 0
21:49:03.082310 IP 18.216.114.70.443 > 10.0.2.15.33186: Flags [P.], seq 8655:16899, ack 902, win 65535, length 8244
21:49:03.082346 IP 10.0.2.15.33186 > 18.216.114.70.443: Flags [.], ack 16899, win 58400, length 0
21:49:03.099291 IP 18.216.114.70.443 > 10.0.2.15.33186: Flags [P.], seq 16899:18273, ack 902, win 65535, length 1374
21:49:03.099323 IP 10.0.2.15.33186 > 18.216.114.70.443: Flags [.], ack 18273, win 62780, length 0
21:49:03.100316 IP 18.216.114.70.443 > 10.0.2.15.33186: Flags [P.], seq 18273:19647, ack 902, win 65535, length 1374
21:49:03.100334 IP 10.0.2.15.33186 > 18.216.114.70.443: Flags [.], ack 19647, win 62780, length 0
21:49:03.111781 IP 18.216.114.70.443 > 10.0.2.15.33186: Flags [P.], seq 19647:27891, ack 902, win 65535, length 8244
21:49:03.112246 IP 10.0.2.15.33186 > 18.216.114.70.443: Flags [.], ack 27891, win 58400, length 0
21:49:03.112757 IP 18.216.114.70.443 > 10.0.2.15.33186: Flags [P.], seq 27891:34761, ack 902, win 65535, length 6870
21:49:03.112759 IP 18.216.114.70.443 > 10.0.2.15.33186: Flags [P.], seq 34761:41631, ack 902, win 65535, length 6870
21:49:03.112785 IP 10.0.2.15.33186 > 18.216.114.70.443: Flags [.], ack 34761, win 54020, length 0
21:49:03.112815 IP 10.0.2.15.33186 > 18.216.114.70.443: Flags [.], ack 41631, win 49640, length 0
21:49:03.115101 IP 18.216.114.70.443 > 10.0.2.15.33186: Flags [P.], seq 41631:44379, ack 902, win 65535, length 2748
21:49:03.115120 IP 10.0.2.15.33186 > 18.216.114.70.443: Flags [.], ack 44379, win 62780, length 0
21:49:03.129689 IP 18.216.114.70.443 > 10.0.2.15.33186: Flags [P.], seq 44379:45753, ack 902, win 65535, length 1374
21:49:03.129853 IP 10.0.2.15.33186 > 18.216.114.70.443: Flags [.], ack 45753, win 62780, length 0
21:49:03.130666 IP 18.216.114.70.443 > 10.0.2.15.33186: Flags [P.], seq 45753:49875, ack 902, win 65535, length 4122
21:49:03.130905 IP 10.0.2.15.33186 > 18.216.114.70.443: Flags [.], ack 49875, win 62780, length 0
21:49:03.141715 IP 18.216.114.70.443 > 10.0.2.15.33186: Flags [P.], seq 49875:59493, ack 902, win 65535, length 9618
21:49:03.141718 IP 18.216.114.70.443 > 10.0.2.15.33186: Flags [.], seq 59493:62413, ack 902, win 65535, length 2920
21:49:03.142354 IP 18.216.114.70.443 > 10.0.2.15.33186: Flags [P.], seq 62413:63615, ack 902, win 65535, length 1202
21:49:03.142356 IP 18.216.114.70.443 > 10.0.2.15.33186: Flags [P.], seq 63615:64989, ack 902, win 65535, length 1374
21:49:03.142733 IP 18.216.114.70.443 > 10.0.2.15.33186: Flags [P.], seq 64989:73233, ack 902, win 65535, length 8244
21:49:03.142734 IP 18.216.114.70.443 > 10.0.2.15.33186: Flags [.], seq 73233:74693, ack 902, win 65535, length 1460
21:49:03.142816 IP 10.0.2.15.33186 > 18.216.114.70.443: Flags [.], ack 74693, win 62780, length 0
21:49:03.143201 IP 18.216.114.70.443 > 10.0.2.15.33186: Flags [.], seq 74693:76153, ack 902, win 65535, length 1460
21:49:03.143219 IP 10.0.2.15.33186 > 18.216.114.70.443: Flags [.], ack 76153, win 65535, length 0
21:49:03.143806 IP 18.216.114.70.443 > 10.0.2.15.33186: Flags [P.], seq 76153:77355, ack 902, win 65535, length 1202
21:49:03.143820 IP 10.0.2.15.33186 > 18.216.114.70.443: Flags [.], ack 77355, win 65535, length 0
21:49:03.144824 IP 18.216.114.70.443 > 10.0.2.15.33186: Flags [P.], seq 77355:82851, ack 902, win 65535, length 5496
21:49:03.144842 IP 10.0.2.15.33186 > 18.216.114.70.443: Flags [.], ack 82851, win 65535, length 0
21:49:03.147522 IP 18.216.114.70.443 > 10.0.2.15.33186: Flags [P.], seq 82851:97965, ack 902, win 65535, length 15114
21:49:03.147545 IP 10.0.2.15.33186 > 18.216.114.70.443: Flags [.], ack 97965, win 65535, length 0
21:49:03.161202 IP 18.216.114.70.443 > 10.0.2.15.33186: Flags [P.], seq 97965:108957, ack 902, win 65535, length 10992
21:49:03.161228 IP 10.0.2.15.33186 > 18.216.114.70.443: Flags [.], ack 108957, win 65535, length 0
21:49:03.161756 IP 18.216.114.70.443 > 10.0.2.15.33186: Flags [P.], seq 108957:110331, ack 902, win 65535, length 1374
21:49:03.161774 IP 10.0.2.15.33186 > 18.216.114.70.443: Flags [.], ack 110331, win 65535, length 0
21:49:03.172075 IP 18.216.114.70.443 > 10.0.2.15.33186: Flags [P.], seq 110331:124071, ack 902, win 65535, length 13740
21:49:03.172100 IP 10.0.2.15.33186 > 18.216.114.70.443: Flags [.], ack 124071, win 65535, length 0
21:49:03.172268 IP 18.216.114.70.443 > 10.0.2.15.33186: Flags [P.], seq 124071:126819, ack 902, win 65535, length 2748
21:49:03.172278 IP 10.0.2.15.33186 > 18.216.114.70.443: Flags [.], ack 126819, win 65535, length 0
21:49:03.173713 IP 18.216.114.70.443 > 10.0.2.15.33186: Flags [P.], seq 126819:135063, ack 902, win 65535, length 8244
21:49:03.173717 IP 18.216.114.70.443 > 10.0.2.15.33186: Flags [.], seq 135063:136523, ack 902, win 65535, length 1460
21:49:03.173741 IP 10.0.2.15.33186 > 18.216.114.70.443: Flags [.], ack 135063, win 65535, length 0
21:49:03.173786 IP 10.0.2.15.33186 > 18.216.114.70.443: Flags [.], ack 136523, win 65535, length 0
21:49:03.173967 IP 18.216.114.70.443 > 10.0.2.15.33186: Flags [P.], seq 136523:137811, ack 902, win 65535, length 1288
21:49:03.174014 IP 18.216.114.70.443 > 10.0.2.15.33186: Flags [P.], seq 137811:143307, ack 902, win 65535, length 5496
21:49:03.174016 IP 18.216.114.70.443 > 10.0.2.15.33186: Flags [P.], seq 143307:144681, ack 902, win 65535, length 1374
21:49:03.174030 IP 10.0.2.15.33186 > 18.216.114.70.443: Flags [.], ack 137811, win 65535, length 0
21:49:03.174055 IP 10.0.2.15.33186 > 18.216.114.70.443: Flags [.], ack 143307, win 65535, length 0
21:49:03.174068 IP 10.0.2.15.33186 > 18.216.114.70.443: Flags [.], ack 144681, win 65535, length 0
21:49:03.174460 IP 18.216.114.70.443 > 10.0.2.15.33186: Flags [P.], seq 144681:148803, ack 902, win 65535, length 4122
21:49:03.174463 IP 18.216.114.70.443 > 10.0.2.15.33186: Flags [P.], seq 148803:152925, ack 902, win 65535, length 4122
21:49:03.174477 IP 10.0.2.15.33186 > 18.216.114.70.443: Flags [.], ack 148803, win 65535, length 0
21:49:03.174501 IP 10.0.2.15.33186 > 18.216.114.70.443: Flags [.], ack 152925, win 65535, length 0
21:49:03.174662 IP 18.216.114.70.443 > 10.0.2.15.33186: Flags [P.], seq 152925:154299, ack 902, win 65535, length 1374
21:49:03.174664 IP 18.216.114.70.443 > 10.0.2.15.33186: Flags [P.], seq 154299:159795, ack 902, win 65535, length 5496
21:49:03.174676 IP 10.0.2.15.33186 > 18.216.114.70.443: Flags [.], ack 154299, win 65535, length 0
21:49:03.174704 IP 10.0.2.15.33186 > 18.216.114.70.443: Flags [.], ack 159795, win 65535, length 0
21:49:03.174799 IP 18.216.114.70.443 > 10.0.2.15.33186: Flags [P.], seq 159795:162543, ack 902, win 65535, length 2748
21:49:03.174805 IP 10.0.2.15.33186 > 18.216.114.70.443: Flags [.], ack 162543, win 65535, length 0
21:49:03.176110 IP 18.216.114.70.443 > 10.0.2.15.33186: Flags [P.], seq 162543:163917, ack 902, win 65535, length 1374
21:49:03.176132 IP 10.0.2.15.33186 > 18.216.114.70.443: Flags [.], ack 163917, win 65535, length 0
21:49:03.180344 IP 18.216.114.70.443 > 10.0.2.15.33186: Flags [P.], seq 163917:176283, ack 902, win 65535, length 12366
21:49:03.180373 IP 10.0.2.15.33186 > 18.216.114.70.443: Flags [.], ack 176283, win 65535, length 0
21:49:03.180472 IP 18.216.114.70.443 > 10.0.2.15.33186: Flags [P.], seq 176283:181779, ack 902, win 65535, length 5496
21:49:03.180474 IP 18.216.114.70.443 > 10.0.2.15.33186: Flags [P.], seq 181779:188649, ack 902, win 65535, length 6870
21:49:03.180486 IP 10.0.2.15.33186 > 18.216.114.70.443: Flags [.], ack 181779, win 65535, length 0
21:49:03.180503 IP 10.0.2.15.33186 > 18.216.114.70.443: Flags [.], ack 188649, win 65535, length 0
21:49:03.180541 IP 18.216.114.70.443 > 10.0.2.15.33186: Flags [P.], seq 188649:194145, ack 902, win 65535, length 5496
21:49:03.180542 IP 18.216.114.70.443 > 10.0.2.15.33186: Flags [P.], seq 194145:196893, ack 902, win 65535, length 2748
21:49:03.180548 IP 10.0.2.15.33186 > 18.216.114.70.443: Flags [.], ack 194145, win 65535, length 0
21:49:03.180560 IP 10.0.2.15.33186 > 18.216.114.70.443: Flags [.], ack 196893, win 65535, length 0
21:49:03.180760 IP 18.216.114.70.443 > 10.0.2.15.33186: Flags [P.], seq 196893:202389, ack 902, win 65535, length 5496
21:49:03.180773 IP 10.0.2.15.33186 > 18.216.114.70.443: Flags [.], ack 202389, win 65535, length 0
21:49:03.191901 IP 18.216.114.70.443 > 10.0.2.15.33186: Flags [P.], seq 202389:214755, ack 902, win 65535, length 12366
21:49:03.191946 IP 10.0.2.15.33186 > 18.216.114.70.443: Flags [.], ack 214755, win 65535, length 0
21:49:03.191996 IP 18.216.114.70.443 > 10.0.2.15.33186: Flags [P.], seq 214755:220251, ack 902, win 65535, length 5496
21:49:03.191997 IP 18.216.114.70.443 > 10.0.2.15.33186: Flags [P.], seq 220251:221625, ack 902, win 65535, length 1374
21:49:03.192013 IP 10.0.2.15.33186 > 18.216.114.70.443: Flags [.], ack 220251, win 65535, length 0
21:49:03.192034 IP 10.0.2.15.33186 > 18.216.114.70.443: Flags [.], ack 221625, win 65535, length 0
21:49:03.192536 IP 18.216.114.70.443 > 10.0.2.15.33186: Flags [P.], seq 221625:222999, ack 902, win 65535, length 1374
21:49:03.192553 IP 10.0.2.15.33186 > 18.216.114.70.443: Flags [.], ack 222999, win 65535, length 0
21:49:03.203591 IP 18.216.114.70.443 > 10.0.2.15.33186: Flags [P.], seq 222999:232617, ack 902, win 65535, length 9618
21:49:03.203615 IP 10.0.2.15.33186 > 18.216.114.70.443: Flags [.], ack 232617, win 65535, length 0
21:49:03.206810 IP 18.216.114.70.443 > 10.0.2.15.33186: Flags [P.], seq 232617:244983, ack 902, win 65535, length 12366
21:49:03.206839 IP 10.0.2.15.33186 > 18.216.114.70.443: Flags [.], ack 244983, win 65535, length 0
21:49:03.206912 IP 18.216.114.70.443 > 10.0.2.15.33186: Flags [P.], seq 244983:250479, ack 902, win 65535, length 5496
21:49:03.206922 IP 10.0.2.15.33186 > 18.216.114.70.443: Flags [.], ack 250479, win 65535, length 0
21:49:03.207925 IP 18.216.114.70.443 > 10.0.2.15.33186: Flags [P.], seq 250479:254601, ack 902, win 65535, length 4122
21:49:03.207932 IP 18.216.114.70.443 > 10.0.2.15.33186: Flags [P.], seq 254601:264219, ack 902, win 65535, length 9618
21:49:03.207957 IP 10.0.2.15.33186 > 18.216.114.70.443: Flags [.], ack 254601, win 65535, length 0
21:49:03.208053 IP 10.0.2.15.33186 > 18.216.114.70.443: Flags [.], ack 264219, win 65535, length 0
21:49:03.208108 IP 18.216.114.70.443 > 10.0.2.15.33186: Flags [P.], seq 264219:268341, ack 902, win 65535, length 4122
21:49:03.208110 IP 18.216.114.70.443 > 10.0.2.15.33186: Flags [P.], seq 268341:273837, ack 902, win 65535, length 5496
21:49:03.208121 IP 10.0.2.15.33186 > 18.216.114.70.443: Flags [.], ack 268341, win 65535, length 0
21:49:03.208142 IP 10.0.2.15.33186 > 18.216.114.70.443: Flags [.], ack 273837, win 65535, length 0
21:49:03.209132 IP 18.216.114.70.443 > 10.0.2.15.33186: Flags [P.], seq 273837:277959, ack 902, win 65535, length 4122
21:49:03.209152 IP 10.0.2.15.33186 > 18.216.114.70.443: Flags [.], ack 277959, win 65535, length 0
21:49:03.210168 IP 18.216.114.70.443 > 10.0.2.15.33186: Flags [P.], seq 277959:286203, ack 902, win 65535, length 8244
21:49:03.210273 IP 10.0.2.15.33186 > 18.216.114.70.443: Flags [.], ack 286203, win 65535, length 0
21:49:03.210781 IP 18.216.114.70.443 > 10.0.2.15.33186: Flags [P.], seq 286203:291699, ack 902, win 65535, length 5496
21:49:03.210783 IP 18.216.114.70.443 > 10.0.2.15.33186: Flags [P.], seq 291699:297195, ack 902, win 65535, length 5496
21:49:03.210839 IP 10.0.2.15.33186 > 18.216.114.70.443: Flags [.], ack 291699, win 65535, length 0
21:49:03.211059 IP 10.0.2.15.33186 > 18.216.114.70.443: Flags [.], ack 297195, win 65535, length 0
21:49:03.211147 IP 18.216.114.70.443 > 10.0.2.15.33186: Flags [P.], seq 297195:299943, ack 902, win 65535, length 2748
21:49:03.211149 IP 18.216.114.70.443 > 10.0.2.15.33186: Flags [P.], seq 299943:304065, ack 902, win 65535, length 4122
21:49:03.211163 IP 10.0.2.15.33186 > 18.216.114.70.443: Flags [.], ack 299943, win 65535, length 0
21:49:03.211185 IP 10.0.2.15.33186 > 18.216.114.70.443: Flags [.], ack 304065, win 65535, length 0
21:49:03.211314 IP 18.216.114.70.443 > 10.0.2.15.33186: Flags [P.], seq 304065:312309, ack 902, win 65535, length 8244
21:49:03.211323 IP 10.0.2.15.33186 > 18.216.114.70.443: Flags [.], ack 312309, win 65535, length 0
21:49:03.211663 IP 18.216.114.70.443 > 10.0.2.15.33186: Flags [P.], seq 312309:313683, ack 902, win 65535, length 1374
21:49:03.211674 IP 10.0.2.15.33186 > 18.216.114.70.443: Flags [.], ack 313683, win 65535, length 0
21:49:03.212612 IP 18.216.114.70.443 > 10.0.2.15.33186: Flags [P.], seq 313683:321927, ack 902, win 65535, length 8244
21:49:03.212614 IP 18.216.114.70.443 > 10.0.2.15.33186: Flags [P.], seq 321927:324675, ack 902, win 65535, length 2748
21:49:03.212673 IP 10.0.2.15.33186 > 18.216.114.70.443: Flags [.], ack 321927, win 65535, length 0
21:49:03.212699 IP 10.0.2.15.33186 > 18.216.114.70.443: Flags [.], ack 324675, win 65535, length 0
21:49:03.213000 IP 18.216.114.70.443 > 10.0.2.15.33186: Flags [P.], seq 324675:328797, ack 902, win 65535, length 4122
21:49:03.213004 IP 18.216.114.70.443 > 10.0.2.15.33186: Flags [.], seq 328797:330257, ack 902, win 65535, length 1460
21:49:03.213021 IP 10.0.2.15.33186 > 18.216.114.70.443: Flags [.], ack 328797, win 65535, length 0
21:49:03.213045 IP 10.0.2.15.33186 > 18.216.114.70.443: Flags [.], ack 330257, win 65535, length 0
21:49:03.214045 IP 18.216.114.70.443 > 10.0.2.15.33186: Flags [P.], seq 330257:331545, ack 902, win 65535, length 1288
21:49:03.214048 IP 18.216.114.70.443 > 10.0.2.15.33186: Flags [P.], seq 331545:337041, ack 902, win 65535, length 5496
21:49:03.214049 IP 18.216.114.70.443 > 10.0.2.15.33186: Flags [P.], seq 337041:339789, ack 902, win 65535, length 2748
21:49:03.214050 IP 18.216.114.70.443 > 10.0.2.15.33186: Flags [P.], seq 339789:342537, ack 902, win 65535, length 2748
21:49:03.214078 IP 10.0.2.15.33186 > 18.216.114.70.443: Flags [.], ack 331545, win 65535, length 0
21:49:03.214095 IP 10.0.2.15.33186 > 18.216.114.70.443: Flags [.], ack 337041, win 65535, length 0
21:49:03.214107 IP 10.0.2.15.33186 > 18.216.114.70.443: Flags [.], ack 339789, win 65535, length 0
21:49:03.214119 IP 10.0.2.15.33186 > 18.216.114.70.443: Flags [.], ack 342537, win 65535, length 0
21:49:03.214146 IP 18.216.114.70.443 > 10.0.2.15.33186: Flags [P.], seq 342537:346659, ack 902, win 65535, length 4122
21:49:03.214147 IP 18.216.114.70.443 > 10.0.2.15.33186: Flags [P.], seq 346659:349407, ack 902, win 65535, length 2748
21:49:03.214154 IP 10.0.2.15.33186 > 18.216.114.70.443: Flags [.], ack 346659, win 65535, length 0
21:49:03.214165 IP 10.0.2.15.33186 > 18.216.114.70.443: Flags [.], ack 349407, win 65535, length 0
21:49:03.214822 IP 18.216.114.70.443 > 10.0.2.15.33186: Flags [P.], seq 349407:354903, ack 902, win 65535, length 5496
21:49:03.214824 IP 18.216.114.70.443 > 10.0.2.15.33186: Flags [P.], seq 354903:359025, ack 902, win 65535, length 4122
21:49:03.214825 IP 18.216.114.70.443 > 10.0.2.15.33186: Flags [P.], seq 359025:361773, ack 902, win 65535, length 2748
21:49:03.214928 IP 10.0.2.15.33186 > 18.216.114.70.443: Flags [.], ack 354903, win 65535, length 0
21:49:03.214960 IP 10.0.2.15.33186 > 18.216.114.70.443: Flags [.], ack 359025, win 65535, length 0
21:49:03.214979 IP 10.0.2.15.33186 > 18.216.114.70.443: Flags [.], ack 361773, win 65535, length 0
21:49:03.215011 IP 18.216.114.70.443 > 10.0.2.15.33186: Flags [P.], seq 361773:364521, ack 902, win 65535, length 2748
21:49:03.215020 IP 10.0.2.15.33186 > 18.216.114.70.443: Flags [.], ack 364521, win 65535, length 0
21:49:03.215223 IP 18.216.114.70.443 > 10.0.2.15.33186: Flags [P.], seq 364521:368643, ack 902, win 65535, length 4122
21:49:03.215233 IP 10.0.2.15.33186 > 18.216.114.70.443: Flags [.], ack 368643, win 65535, length 0
21:49:03.215419 IP 18.216.114.70.443 > 10.0.2.15.33186: Flags [P.], seq 368643:372765, ack 902, win 65535, length 4122
21:49:03.215420 IP 18.216.114.70.443 > 10.0.2.15.33186: Flags [P.], seq 372765:375513, ack 902, win 65535, length 2748
21:49:03.215429 IP 10.0.2.15.33186 > 18.216.114.70.443: Flags [.], ack 372765, win 65535, length 0
21:49:03.215440 IP 10.0.2.15.33186 > 18.216.114.70.443: Flags [.], ack 375513, win 65535, length 0
21:49:03.215698 IP 18.216.114.70.443 > 10.0.2.15.33186: Flags [P.], seq 375513:376887, ack 902, win 65535, length 1374
21:49:03.215706 IP 10.0.2.15.33186 > 18.216.114.70.443: Flags [.], ack 376887, win 65535, length 0
21:49:03.216299 IP 18.216.114.70.443 > 10.0.2.15.33186: Flags [P.], seq 376887:379635, ack 902, win 65535, length 2748
21:49:03.216330 IP 10.0.2.15.33186 > 18.216.114.70.443: Flags [.], ack 379635, win 65535, length 0
21:49:03.218793 IP 18.216.114.70.443 > 10.0.2.15.33186: Flags [P.], seq 379635:390627, ack 902, win 65535, length 10992
21:49:03.218816 IP 10.0.2.15.33186 > 18.216.114.70.443: Flags [.], ack 390627, win 65535, length 0
21:49:03.218840 IP 18.216.114.70.443 > 10.0.2.15.33186: Flags [P.], seq 390627:401619, ack 902, win 65535, length 10992
21:49:03.218846 IP 10.0.2.15.33186 > 18.216.114.70.443: Flags [.], ack 401619, win 65535, length 0
21:49:03.218874 IP 18.216.114.70.443 > 10.0.2.15.33186: Flags [P.], seq 401619:412611, ack 902, win 65535, length 10992
21:49:03.218880 IP 10.0.2.15.33186 > 18.216.114.70.443: Flags [.], ack 412611, win 65535, length 0
21:49:03.219106 IP 18.216.114.70.443 > 10.0.2.15.33186: Flags [P.], seq 412611:413985, ack 902, win 65535, length 1374
21:49:03.219119 IP 10.0.2.15.33186 > 18.216.114.70.443: Flags [.], ack 413985, win 65535, length 0
21:49:03.223357 IP 18.216.114.70.443 > 10.0.2.15.33186: Flags [P.], seq 413985:430473, ack 902, win 65535, length 16488
21:49:03.223546 IP 10.0.2.15.33186 > 18.216.114.70.443: Flags [.], ack 430473, win 65535, length 0
21:49:03.223936 IP 18.216.114.70.443 > 10.0.2.15.33186: Flags [P.], seq 430473:435969, ack 902, win 65535, length 5496
21:49:03.223941 IP 18.216.114.70.443 > 10.0.2.15.33186: Flags [P.], seq 435969:444213, ack 902, win 65535, length 8244
21:49:03.223963 IP 10.0.2.15.33186 > 18.216.114.70.443: Flags [.], ack 435969, win 65535, length 0
21:49:03.224079 IP 10.0.2.15.33186 > 18.216.114.70.443: Flags [.], ack 444213, win 65535, length 0
21:49:03.224353 IP 18.216.114.70.443 > 10.0.2.15.33186: Flags [P.], seq 444213:445587, ack 902, win 65535, length 1374
21:49:03.224364 IP 10.0.2.15.33186 > 18.216.114.70.443: Flags [.], ack 445587, win 65535, length 0
21:49:03.224515 IP 18.216.114.70.443 > 10.0.2.15.33186: Flags [P.], seq 445587:446961, ack 902, win 65535, length 1374
21:49:03.224523 IP 10.0.2.15.33186 > 18.216.114.70.443: Flags [.], ack 446961, win 65535, length 0
21:49:03.234461 IP 18.216.114.70.443 > 10.0.2.15.33186: Flags [P.], seq 446961:455205, ack 902, win 65535, length 8244
21:49:03.234463 IP 18.216.114.70.443 > 10.0.2.15.33186: Flags [.], seq 455205:456665, ack 902, win 65535, length 1460
21:49:03.234488 IP 10.0.2.15.33186 > 18.216.114.70.443: Flags [.], ack 455205, win 65535, length 0
21:49:03.234519 IP 10.0.2.15.33186 > 18.216.114.70.443: Flags [.], ack 456665, win 65535, length 0
21:49:03.234843 IP 18.216.114.70.443 > 10.0.2.15.33186: Flags [P.], seq 456665:460701, ack 902, win 65535, length 4036
21:49:03.234854 IP 10.0.2.15.33186 > 18.216.114.70.443: Flags [.], ack 460701, win 65535, length 0
21:49:03.238904 IP 18.216.114.70.443 > 10.0.2.15.33186: Flags [P.], seq 460701:470319, ack 902, win 65535, length 9618
21:49:03.238907 IP 18.216.114.70.443 > 10.0.2.15.33186: Flags [P.], seq 470319:474441, ack 902, win 65535, length 4122
21:49:03.238933 IP 10.0.2.15.33186 > 18.216.114.70.443: Flags [.], ack 470319, win 65535, length 0
21:49:03.239057 IP 10.0.2.15.33186 > 18.216.114.70.443: Flags [.], ack 474441, win 65535, length 0
21:49:03.239185 IP 18.216.114.70.443 > 10.0.2.15.33186: Flags [.], seq 474441:477361, ack 902, win 65535, length 2920
21:49:03.239194 IP 10.0.2.15.33186 > 18.216.114.70.443: Flags [.], ack 477361, win 65535, length 0
21:49:03.239430 IP 18.216.114.70.443 > 10.0.2.15.33186: Flags [P.], seq 477361:478563, ack 902, win 65535, length 1202
21:49:03.239432 IP 18.216.114.70.443 > 10.0.2.15.33186: Flags [P.], seq 478563:481311, ack 902, win 65535, length 2748
21:49:03.239433 IP 18.216.114.70.443 > 10.0.2.15.33186: Flags [P.], seq 481311:486807, ack 902, win 65535, length 5496
21:49:03.239434 IP 18.216.114.70.443 > 10.0.2.15.33186: Flags [P.], seq 486807:489555, ack 902, win 65535, length 2748
21:49:03.239449 IP 10.0.2.15.33186 > 18.216.114.70.443: Flags [.], ack 478563, win 65535, length 0
21:49:03.239469 IP 10.0.2.15.33186 > 18.216.114.70.443: Flags [.], ack 481311, win 65535, length 0
21:49:03.239482 IP 10.0.2.15.33186 > 18.216.114.70.443: Flags [.], ack 486807, win 65535, length 0
21:49:03.239492 IP 10.0.2.15.33186 > 18.216.114.70.443: Flags [.], ack 489555, win 65535, length 0
21:49:03.241523 IP 18.216.114.70.443 > 10.0.2.15.33186: Flags [.], seq 489555:493935, ack 902, win 65535, length 4380
21:49:03.241544 IP 10.0.2.15.33186 > 18.216.114.70.443: Flags [.], ack 493935, win 65535, length 0
21:49:03.241817 IP 18.216.114.70.443 > 10.0.2.15.33186: Flags [P.], seq 493935:496425, ack 902, win 65535, length 2490

