21:45:50.887617 IP 10.0.2.15.60748 > 140.233.253.2.53: 35305+ A? www.indeed.com. (32)
21:45:50.887666 IP 10.0.2.15.60748 > 140.233.253.2.53: 55778+ AAAA? www.indeed.com. (32)
21:45:50.892862 IP 140.233.253.2.53 > 10.0.2.15.60748: 35305 2/0/0 CNAME us.dyn.indeed.com., A 18.218.22.89 (69)
21:45:50.892864 IP 140.233.253.2.53 > 10.0.2.15.60748: 55778 1/1/0 CNAME us.dyn.indeed.com. (118)
21:45:50.893239 IP 10.0.2.15.52728 > 18.218.22.89.443: Flags [S], seq 3058126658, win 64240, options [mss 1460,sackOK,TS val 556547542 ecr 0,nop,wscale 6], length 0
21:45:50.926295 IP 18.218.22.89.443 > 10.0.2.15.52728: Flags [S.], seq 267584001, ack 3058126659, win 65535, options [mss 1460], length 0
21:45:50.926340 IP 10.0.2.15.52728 > 18.218.22.89.443: Flags [.], ack 1, win 64240, length 0
21:45:50.941899 IP 10.0.2.15.52728 > 18.218.22.89.443: Flags [P.], seq 1:518, ack 1, win 64240, length 517
21:45:50.942222 IP 18.218.22.89.443 > 10.0.2.15.52728: Flags [.], ack 518, win 65535, length 0
21:45:50.978202 IP 18.218.22.89.443 > 10.0.2.15.52728: Flags [.], seq 1:2921, ack 518, win 65535, length 2920
21:45:50.978226 IP 10.0.2.15.52728 > 18.218.22.89.443: Flags [.], ack 2921, win 62780, length 0
21:45:50.978495 IP 18.218.22.89.443 > 10.0.2.15.52728: Flags [P.], seq 2921:4375, ack 518, win 65535, length 1454
21:45:50.978564 IP 10.0.2.15.52728 > 18.218.22.89.443: Flags [.], ack 4375, win 61326, length 0
21:45:50.980302 IP 10.0.2.15.52728 > 18.218.22.89.443: Flags [P.], seq 518:644, ack 4375, win 62780, length 126
21:45:50.980705 IP 18.218.22.89.443 > 10.0.2.15.52728: Flags [.], ack 644, win 65535, length 0
21:45:51.011938 IP 18.218.22.89.443 > 10.0.2.15.52728: Flags [P.], seq 4375:4495, ack 644, win 65535, length 120
21:45:51.011955 IP 10.0.2.15.52728 > 18.218.22.89.443: Flags [.], ack 4495, win 62780, length 0
21:45:51.012577 IP 10.0.2.15.52728 > 18.218.22.89.443: Flags [P.], seq 644:697, ack 4495, win 62780, length 53
21:45:51.012618 IP 10.0.2.15.52728 > 18.218.22.89.443: Flags [P.], seq 697:753, ack 4495, win 62780, length 56
21:45:51.012826 IP 10.0.2.15.52728 > 18.218.22.89.443: Flags [P.], seq 753:864, ack 4495, win 62780, length 111
21:45:51.013301 IP 18.218.22.89.443 > 10.0.2.15.52728: Flags [.], ack 697, win 65535, length 0
21:45:51.013303 IP 18.218.22.89.443 > 10.0.2.15.52728: Flags [.], ack 753, win 65535, length 0
21:45:51.013362 IP 10.0.2.15.52728 > 18.218.22.89.443: Flags [P.], seq 864:902, ack 4495, win 62780, length 38
21:45:51.013467 IP 18.218.22.89.443 > 10.0.2.15.52728: Flags [.], ack 864, win 65535, length 0
21:45:51.013468 IP 18.218.22.89.443 > 10.0.2.15.52728: Flags [.], ack 902, win 65535, length 0
21:45:51.043640 IP 18.218.22.89.443 > 10.0.2.15.52728: Flags [P.], seq 4495:4533, ack 902, win 65535, length 38
21:45:51.043662 IP 10.0.2.15.52728 > 18.218.22.89.443: Flags [.], ack 4533, win 62780, length 0
21:45:51.060047 IP 18.218.22.89.443 > 10.0.2.15.52728: Flags [.], seq 4533:13293, ack 902, win 65535, length 8760
21:45:51.060084 IP 10.0.2.15.52728 > 18.218.22.89.443: Flags [.], ack 13293, win 58400, length 0
21:45:51.060368 IP 18.218.22.89.443 > 10.0.2.15.52728: Flags [P.], seq 13293:15165, ack 902, win 65535, length 1872
21:45:51.060399 IP 10.0.2.15.52728 > 18.218.22.89.443: Flags [.], ack 15165, win 56528, length 0
21:45:51.064525 IP 18.218.22.89.443 > 10.0.2.15.52728: Flags [P.], seq 15165:16539, ack 902, win 65535, length 1374
21:45:51.064756 IP 10.0.2.15.52728 > 18.218.22.89.443: Flags [.], ack 16539, win 62780, length 0
21:45:51.073691 IP 18.218.22.89.443 > 10.0.2.15.52728: Flags [P.], seq 16539:17913, ack 902, win 65535, length 1374
21:45:51.073744 IP 10.0.2.15.52728 > 18.218.22.89.443: Flags [.], ack 17913, win 62780, length 0
21:45:51.074521 IP 18.218.22.89.443 > 10.0.2.15.52728: Flags [P.], seq 17913:19287, ack 902, win 65535, length 1374
21:45:51.074562 IP 10.0.2.15.52728 > 18.218.22.89.443: Flags [.], ack 19287, win 62780, length 0
21:45:51.089905 IP 18.218.22.89.443 > 10.0.2.15.52728: Flags [P.], seq 19287:27531, ack 902, win 65535, length 8244
21:45:51.089909 IP 18.218.22.89.443 > 10.0.2.15.52728: Flags [P.], seq 27531:31653, ack 902, win 65535, length 4122
21:45:51.089935 IP 10.0.2.15.52728 > 18.218.22.89.443: Flags [.], ack 27531, win 58400, length 0
21:45:51.090109 IP 10.0.2.15.52728 > 18.218.22.89.443: Flags [.], ack 31653, win 55480, length 0
21:45:51.090279 IP 18.218.22.89.443 > 10.0.2.15.52728: Flags [P.], seq 31653:34401, ack 902, win 65535, length 2748
21:45:51.090281 IP 18.218.22.89.443 > 10.0.2.15.52728: Flags [.], seq 34401:35861, ack 902, win 65535, length 1460
21:45:51.090475 IP 10.0.2.15.52728 > 18.218.22.89.443: Flags [.], ack 35861, win 52560, length 0
21:45:51.090902 IP 18.218.22.89.443 > 10.0.2.15.52728: Flags [P.], seq 35861:37149, ack 902, win 65535, length 1288
21:45:51.090980 IP 10.0.2.15.52728 > 18.218.22.89.443: Flags [.], ack 37149, win 62780, length 0
21:45:51.091736 IP 18.218.22.89.443 > 10.0.2.15.52728: Flags [P.], seq 37149:41271, ack 902, win 65535, length 4122
21:45:51.091857 IP 10.0.2.15.52728 > 18.218.22.89.443: Flags [.], ack 41271, win 62780, length 0
21:45:51.094000 IP 18.218.22.89.443 > 10.0.2.15.52728: Flags [P.], seq 41271:42645, ack 902, win 65535, length 1374
21:45:51.094084 IP 10.0.2.15.52728 > 18.218.22.89.443: Flags [.], ack 42645, win 62780, length 0
21:45:51.096537 IP 18.218.22.89.443 > 10.0.2.15.52728: Flags [P.], seq 42645:44019, ack 902, win 65535, length 1374
21:45:51.104103 IP 18.218.22.89.443 > 10.0.2.15.52728: Flags [P.], seq 44019:45393, ack 902, win 65535, length 1374
21:45:51.104126 IP 10.0.2.15.52728 > 18.218.22.89.443: Flags [.], ack 45393, win 62780, length 0
21:45:51.104969 IP 18.218.22.89.443 > 10.0.2.15.52728: Flags [P.], seq 45393:49515, ack 902, win 65535, length 4122
21:45:51.105353 IP 10.0.2.15.52728 > 18.218.22.89.443: Flags [.], ack 49515, win 61320, length 0
21:45:51.120758 IP 18.218.22.89.443 > 10.0.2.15.52728: Flags [P.], seq 49515:56385, ack 902, win 65535, length 6870
21:45:51.120761 IP 18.218.22.89.443 > 10.0.2.15.52728: Flags [P.], seq 56385:60507, ack 902, win 65535, length 4122
21:45:51.120810 IP 18.218.22.89.443 > 10.0.2.15.52728: Flags [P.], seq 60507:61881, ack 902, win 65535, length 1374
21:45:51.121021 IP 18.218.22.89.443 > 10.0.2.15.52728: Flags [P.], seq 61881:66003, ack 902, win 65535, length 4122
21:45:51.121127 IP 10.0.2.15.52728 > 18.218.22.89.443: Flags [.], ack 66003, win 52560, length 0
21:45:51.121308 IP 18.218.22.89.443 > 10.0.2.15.52728: Flags [P.], seq 66003:70125, ack 902, win 65535, length 4122
21:45:51.121384 IP 10.0.2.15.52728 > 18.218.22.89.443: Flags [.], ack 70125, win 62780, length 0
21:45:51.125680 IP 18.218.22.89.443 > 10.0.2.15.52728: Flags [P.], seq 70125:75621, ack 902, win 65535, length 5496
21:45:51.125704 IP 10.0.2.15.52728 > 18.218.22.89.443: Flags [.], ack 75621, win 65535, length 0
21:45:51.126525 IP 18.218.22.89.443 > 10.0.2.15.52728: Flags [P.], seq 75621:82491, ack 902, win 65535, length 6870
21:45:51.126527 IP 18.218.22.89.443 > 10.0.2.15.52728: Flags [P.], seq 82491:83865, ack 902, win 65535, length 1374
21:45:51.126546 IP 10.0.2.15.52728 > 18.218.22.89.443: Flags [.], ack 82491, win 65535, length 0
21:45:51.126639 IP 10.0.2.15.52728 > 18.218.22.89.443: Flags [.], ack 83865, win 65535, length 0
21:45:51.127658 IP 18.218.22.89.443 > 10.0.2.15.52728: Flags [P.], seq 83865:89361, ack 902, win 65535, length 5496
21:45:51.127659 IP 18.218.22.89.443 > 10.0.2.15.52728: Flags [P.], seq 89361:90735, ack 902, win 65535, length 1374
21:45:51.127660 IP 18.218.22.89.443 > 10.0.2.15.52728: Flags [P.], seq 90735:96231, ack 902, win 65535, length 5496
21:45:51.127675 IP 10.0.2.15.52728 > 18.218.22.89.443: Flags [.], ack 89361, win 65535, length 0
21:45:51.127697 IP 10.0.2.15.52728 > 18.218.22.89.443: Flags [.], ack 90735, win 65535, length 0
21:45:51.127715 IP 10.0.2.15.52728 > 18.218.22.89.443: Flags [.], ack 96231, win 65535, length 0
21:45:51.127736 IP 18.218.22.89.443 > 10.0.2.15.52728: Flags [P.], seq 96231:97605, ack 902, win 65535, length 1374
21:45:51.127742 IP 10.0.2.15.52728 > 18.218.22.89.443: Flags [.], ack 97605, win 65535, length 0
21:45:51.134301 IP 18.218.22.89.443 > 10.0.2.15.52728: Flags [P.], seq 97605:98979, ack 902, win 65535, length 1374
21:45:51.134331 IP 10.0.2.15.52728 > 18.218.22.89.443: Flags [.], ack 98979, win 65535, length 0
21:45:51.135558 IP 18.218.22.89.443 > 10.0.2.15.52728: Flags [P.], seq 98979:105849, ack 902, win 65535, length 6870
21:45:51.135561 IP 18.218.22.89.443 > 10.0.2.15.52728: Flags [P.], seq 105849:108597, ack 902, win 65535, length 2748
21:45:51.135741 IP 10.0.2.15.52728 > 18.218.22.89.443: Flags [.], ack 105849, win 65535, length 0
21:45:51.136159 IP 10.0.2.15.52728 > 18.218.22.89.443: Flags [.], ack 108597, win 65535, length 0
21:45:51.136414 IP 18.218.22.89.443 > 10.0.2.15.52728: Flags [P.], seq 108597:109971, ack 902, win 65535, length 1374
21:45:51.136620 IP 10.0.2.15.52728 > 18.218.22.89.443: Flags [.], ack 109971, win 65535, length 0
21:45:51.152771 IP 18.218.22.89.443 > 10.0.2.15.52728: Flags [P.], seq 109971:118215, ack 902, win 65535, length 8244
21:45:51.152774 IP 18.218.22.89.443 > 10.0.2.15.52728: Flags [P.], seq 118215:120963, ack 902, win 65535, length 2748
21:45:51.152799 IP 10.0.2.15.52728 > 18.218.22.89.443: Flags [.], ack 118215, win 65535, length 0
21:45:51.152842 IP 10.0.2.15.52728 > 18.218.22.89.443: Flags [.], ack 120963, win 65535, length 0
21:45:51.155143 IP 18.218.22.89.443 > 10.0.2.15.52728: Flags [P.], seq 120963:130581, ack 902, win 65535, length 9618
21:45:51.155147 IP 18.218.22.89.443 > 10.0.2.15.52728: Flags [.], seq 130581:133501, ack 902, win 65535, length 2920
21:45:51.155236 IP 10.0.2.15.52728 > 18.218.22.89.443: Flags [.], ack 130581, win 65535, length 0
21:45:51.155482 IP 10.0.2.15.52728 > 18.218.22.89.443: Flags [.], ack 133501, win 65535, length 0
21:45:51.155796 IP 18.218.22.89.443 > 10.0.2.15.52728: Flags [P.], seq 133501:137451, ack 902, win 65535, length 3950
21:45:51.155799 IP 18.218.22.89.443 > 10.0.2.15.52728: Flags [P.], seq 137451:142947, ack 902, win 65535, length 5496
21:45:51.155800 IP 18.218.22.89.443 > 10.0.2.15.52728: Flags [P.], seq 142947:147069, ack 902, win 65535, length 4122
21:45:51.155818 IP 10.0.2.15.52728 > 18.218.22.89.443: Flags [.], ack 137451, win 65535, length 0
21:45:51.155851 IP 10.0.2.15.52728 > 18.218.22.89.443: Flags [.], ack 142947, win 65535, length 0
21:45:51.155876 IP 10.0.2.15.52728 > 18.218.22.89.443: Flags [.], ack 147069, win 65535, length 0
21:45:51.155904 IP 18.218.22.89.443 > 10.0.2.15.52728: Flags [P.], seq 147069:148443, ack 902, win 65535, length 1374
21:45:51.155912 IP 10.0.2.15.52728 > 18.218.22.89.443: Flags [.], ack 148443, win 65535, length 0
21:45:51.156857 IP 18.218.22.89.443 > 10.0.2.15.52728: Flags [P.], seq 148443:155313, ack 902, win 65535, length 6870
21:45:51.156880 IP 10.0.2.15.52728 > 18.218.22.89.443: Flags [.], ack 155313, win 65535, length 0
21:45:51.157215 IP 18.218.22.89.443 > 10.0.2.15.52728: Flags [P.], seq 155313:159435, ack 902, win 65535, length 4122
21:45:51.157217 IP 18.218.22.89.443 > 10.0.2.15.52728: Flags [P.], seq 159435:160809, ack 902, win 65535, length 1374
21:45:51.157233 IP 10.0.2.15.52728 > 18.218.22.89.443: Flags [.], ack 159435, win 65535, length 0
21:45:51.157254 IP 10.0.2.15.52728 > 18.218.22.89.443: Flags [.], ack 160809, win 65535, length 0
21:45:51.157358 IP 18.218.22.89.443 > 10.0.2.15.52728: Flags [P.], seq 160809:162183, ack 902, win 65535, length 1374
21:45:51.157364 IP 10.0.2.15.52728 > 18.218.22.89.443: Flags [.], ack 162183, win 65535, length 0
21:45:51.157951 IP 18.218.22.89.443 > 10.0.2.15.52728: Flags [P.], seq 162183:169053, ack 902, win 65535, length 6870
21:45:51.157953 IP 18.218.22.89.443 > 10.0.2.15.52728: Flags [P.], seq 169053:173175, ack 902, win 65535, length 4122
21:45:51.157967 IP 10.0.2.15.52728 > 18.218.22.89.443: Flags [.], ack 169053, win 65535, length 0
21:45:51.158009 IP 10.0.2.15.52728 > 18.218.22.89.443: Flags [.], ack 173175, win 65535, length 0
21:45:51.158076 IP 18.218.22.89.443 > 10.0.2.15.52728: Flags [P.], seq 173175:174549, ack 902, win 65535, length 1374
21:45:51.158083 IP 10.0.2.15.52728 > 18.218.22.89.443: Flags [.], ack 174549, win 65535, length 0
21:45:51.159531 IP 18.218.22.89.443 > 10.0.2.15.52728: Flags [P.], seq 174549:178671, ack 902, win 65535, length 4122
21:45:51.160247 IP 10.0.2.15.52728 > 18.218.22.89.443: Flags [.], ack 178671, win 65535, length 0
21:45:51.160763 IP 18.218.22.89.443 > 10.0.2.15.52728: Flags [P.], seq 178671:184167, ack 902, win 65535, length 5496
21:45:51.160765 IP 18.218.22.89.443 > 10.0.2.15.52728: Flags [P.], seq 184167:189663, ack 902, win 65535, length 5496
21:45:51.160783 IP 10.0.2.15.52728 > 18.218.22.89.443: Flags [.], ack 184167, win 65535, length 0
21:45:51.160806 IP 10.0.2.15.52728 > 18.218.22.89.443: Flags [.], ack 189663, win 65535, length 0
21:45:51.160825 IP 18.218.22.89.443 > 10.0.2.15.52728: Flags [P.], seq 189663:192411, ack 902, win 65535, length 2748
21:45:51.160834 IP 10.0.2.15.52728 > 18.218.22.89.443: Flags [.], ack 192411, win 65535, length 0
21:45:51.162860 IP 18.218.22.89.443 > 10.0.2.15.52728: Flags [P.], seq 192411:199281, ack 902, win 65535, length 6870
21:45:51.162890 IP 10.0.2.15.52728 > 18.218.22.89.443: Flags [.], ack 199281, win 65535, length 0
21:45:51.163091 IP 18.218.22.89.443 > 10.0.2.15.52728: Flags [P.], seq 199281:202029, ack 902, win 65535, length 2748
21:45:51.163097 IP 10.0.2.15.52728 > 18.218.22.89.443: Flags [.], ack 202029, win 65535, length 0
21:45:51.164948 IP 18.218.22.89.443 > 10.0.2.15.52728: Flags [P.], seq 202029:206151, ack 902, win 65535, length 4122
21:45:51.165017 IP 10.0.2.15.52728 > 18.218.22.89.443: Flags [.], ack 206151, win 65535, length 0
21:45:51.165477 IP 18.218.22.89.443 > 10.0.2.15.52728: Flags [P.], seq 206151:211647, ack 902, win 65535, length 5496
21:45:51.165498 IP 10.0.2.15.52728 > 18.218.22.89.443: Flags [.], ack 211647, win 65535, length 0
21:45:51.167114 IP 18.218.22.89.443 > 10.0.2.15.52728: Flags [P.], seq 211647:221265, ack 902, win 65535, length 9618
21:45:51.167117 IP 18.218.22.89.443 > 10.0.2.15.52728: Flags [P.], seq 221265:225387, ack 902, win 65535, length 4122
21:45:51.167263 IP 10.0.2.15.52728 > 18.218.22.89.443: Flags [.], ack 221265, win 65535, length 0
21:45:51.167334 IP 10.0.2.15.52728 > 18.218.22.89.443: Flags [.], ack 225387, win 65535, length 0
21:45:51.183190 IP 18.218.22.89.443 > 10.0.2.15.52728: Flags [P.], seq 225387:232257, ack 902, win 65535, length 6870
21:45:51.183198 IP 18.218.22.89.443 > 10.0.2.15.52728: Flags [P.], seq 232257:237753, ack 902, win 65535, length 5496
21:45:51.183228 IP 10.0.2.15.52728 > 18.218.22.89.443: Flags [.], ack 232257, win 65535, length 0
21:45:51.183379 IP 10.0.2.15.52728 > 18.218.22.89.443: Flags [.], ack 237753, win 65535, length 0
21:45:51.183590 IP 18.218.22.89.443 > 10.0.2.15.52728: Flags [P.], seq 237753:241875, ack 902, win 65535, length 4122
21:45:51.183593 IP 18.218.22.89.443 > 10.0.2.15.52728: Flags [P.], seq 241875:245997, ack 902, win 65535, length 4122
21:45:51.183594 IP 18.218.22.89.443 > 10.0.2.15.52728: Flags [P.], seq 245997:247371, ack 902, win 65535, length 1374
21:45:51.183618 IP 10.0.2.15.52728 > 18.218.22.89.443: Flags [.], ack 241875, win 65535, length 0
21:45:51.183647 IP 10.0.2.15.52728 > 18.218.22.89.443: Flags [.], ack 245997, win 65535, length 0
21:45:51.183668 IP 10.0.2.15.52728 > 18.218.22.89.443: Flags [.], ack 247371, win 65535, length 0
21:45:51.184057 IP 18.218.22.89.443 > 10.0.2.15.52728: Flags [P.], seq 247371:251493, ack 902, win 65535, length 4122
21:45:51.184070 IP 10.0.2.15.52728 > 18.218.22.89.443: Flags [.], ack 251493, win 65535, length 0
21:45:51.188514 IP 18.218.22.89.443 > 10.0.2.15.52728: Flags [P.], seq 251493:269355, ack 902, win 65535, length 17862
21:45:51.188535 IP 10.0.2.15.52728 > 18.218.22.89.443: Flags [.], ack 269355, win 65535, length 0
21:45:51.189236 IP 18.218.22.89.443 > 10.0.2.15.52728: Flags [P.], seq 269355:283095, ack 902, win 65535, length 13740
21:45:51.189321 IP 10.0.2.15.52728 > 18.218.22.89.443: Flags [.], ack 283095, win 65535, length 0
21:45:51.189714 IP 18.218.22.89.443 > 10.0.2.15.52728: Flags [.], seq 283095:284555, ack 902, win 65535, length 1460
21:45:51.189776 IP 10.0.2.15.52728 > 18.218.22.89.443: Flags [.], ack 284555, win 65535, length 0
21:45:51.190071 IP 18.218.22.89.443 > 10.0.2.15.52728: Flags [P.], seq 284555:289965, ack 902, win 65535, length 5410
21:45:51.190074 IP 18.218.22.89.443 > 10.0.2.15.52728: Flags [.], seq 289965:294345, ack 902, win 65535, length 4380
21:45:51.190091 IP 10.0.2.15.52728 > 18.218.22.89.443: Flags [.], ack 289965, win 65535, length 0
21:45:51.190117 IP 10.0.2.15.52728 > 18.218.22.89.443: Flags [.], ack 294345, win 65535, length 0
21:45:51.191030 IP 18.218.22.89.443 > 10.0.2.15.52728: Flags [P.], seq 294345:296835, ack 902, win 65535, length 2490
21:45:51.191032 IP 18.218.22.89.443 > 10.0.2.15.52728: Flags [P.], seq 296835:299583, ack 902, win 65535, length 2748
21:45:51.191034 IP 18.218.22.89.443 > 10.0.2.15.52728: Flags [P.], seq 299583:305079, ack 902, win 65535, length 5496
21:45:51.191151 IP 18.218.22.89.443 > 10.0.2.15.52728: Flags [P.], seq 305079:306453, ack 902, win 65535, length 1374
21:45:51.191155 IP 18.218.22.89.443 > 10.0.2.15.52728: Flags [P.], seq 306453:311949, ack 902, win 65535, length 5496
21:45:51.191211 IP 10.0.2.15.52728 > 18.218.22.89.443: Flags [.], ack 311949, win 65535, length 0
21:45:51.191865 IP 18.218.22.89.443 > 10.0.2.15.52728: Flags [P.], seq 311949:316071, ack 902, win 65535, length 4122
21:45:51.191867 IP 18.218.22.89.443 > 10.0.2.15.52728: Flags [P.], seq 316071:318819, ack 902, win 65535, length 2748
21:45:51.191973 IP 10.0.2.15.52728 > 18.218.22.89.443: Flags [.], ack 316071, win 65535, length 0
21:45:51.192122 IP 10.0.2.15.52728 > 18.218.22.89.443: Flags [.], ack 318819, win 65535, length 0
21:45:51.192383 IP 18.218.22.89.443 > 10.0.2.15.52728: Flags [P.], seq 318819:325689, ack 902, win 65535, length 6870
21:45:51.192399 IP 10.0.2.15.52728 > 18.218.22.89.443: Flags [.], ack 325689, win 65535, length 0
21:45:51.192885 IP 18.218.22.89.443 > 10.0.2.15.52728: Flags [P.], seq 325689:328437, ack 902, win 65535, length 2748
21:45:51.192888 IP 18.218.22.89.443 > 10.0.2.15.52728: Flags [P.], seq 328437:333933, ack 902, win 65535, length 5496
21:45:51.192904 IP 10.0.2.15.52728 > 18.218.22.89.443: Flags [.], ack 328437, win 65535, length 0
21:45:51.192931 IP 10.0.2.15.52728 > 18.218.22.89.443: Flags [.], ack 333933, win 65535, length 0
21:45:51.193642 IP 18.218.22.89.443 > 10.0.2.15.52728: Flags [P.], seq 333933:336681, ack 902, win 65535, length 2748
21:45:51.193644 IP 18.218.22.89.443 > 10.0.2.15.52728: Flags [P.], seq 336681:340803, ack 902, win 65535, length 4122
21:45:51.193645 IP 18.218.22.89.443 > 10.0.2.15.52728: Flags [P.], seq 340803:346299, ack 902, win 65535, length 5496
21:45:51.193679 IP 10.0.2.15.52728 > 18.218.22.89.443: Flags [.], ack 336681, win 65535, length 0
21:45:51.193769 IP 10.0.2.15.52728 > 18.218.22.89.443: Flags [.], ack 340803, win 65535, length 0
21:45:51.193801 IP 10.0.2.15.52728 > 18.218.22.89.443: Flags [.], ack 346299, win 65535, length 0
21:45:51.193852 IP 18.218.22.89.443 > 10.0.2.15.52728: Flags [P.], seq 346299:349047, ack 902, win 65535, length 2748
21:45:51.193853 IP 18.218.22.89.443 > 10.0.2.15.52728: Flags [P.], seq 349047:351795, ack 902, win 65535, length 2748
21:45:51.193861 IP 10.0.2.15.52728 > 18.218.22.89.443: Flags [.], ack 349047, win 65535, length 0
21:45:51.193888 IP 10.0.2.15.52728 > 18.218.22.89.443: Flags [.], ack 351795, win 65535, length 0
21:45:51.194588 IP 18.218.22.89.443 > 10.0.2.15.52728: Flags [P.], seq 351795:354543, ack 902, win 65535, length 2748
21:45:51.194862 IP 10.0.2.15.52728 > 18.218.22.89.443: Flags [.], ack 354543, win 65535, length 0
21:45:51.195168 IP 18.218.22.89.443 > 10.0.2.15.52728: Flags [P.], seq 354543:362787, ack 902, win 65535, length 8244
21:45:51.195170 IP 18.218.22.89.443 > 10.0.2.15.52728: Flags [P.], seq 362787:365535, ack 902, win 65535, length 2748
21:45:51.195284 IP 10.0.2.15.52728 > 18.218.22.89.443: Flags [.], ack 365535, win 65535, length 0
21:45:51.196307 IP 18.218.22.89.443 > 10.0.2.15.52728: Flags [P.], seq 365535:369657, ack 902, win 65535, length 4122
21:45:51.196309 IP 18.218.22.89.443 > 10.0.2.15.52728: Flags [P.], seq 369657:372405, ack 902, win 65535, length 2748
21:45:51.196311 IP 18.218.22.89.443 > 10.0.2.15.52728: Flags [P.], seq 372405:377901, ack 902, win 65535, length 5496
21:45:51.196443 IP 10.0.2.15.52728 > 18.218.22.89.443: Flags [.], ack 369657, win 65535, length 0
21:45:51.196473 IP 10.0.2.15.52728 > 18.218.22.89.443: Flags [.], ack 372405, win 65535, length 0
21:45:51.196488 IP 10.0.2.15.52728 > 18.218.22.89.443: Flags [.], ack 377901, win 65535, length 0
21:45:51.196625 IP 18.218.22.89.443 > 10.0.2.15.52728: Flags [P.], seq 377901:380649, ack 902, win 65535, length 2748
21:45:51.196627 IP 18.218.22.89.443 > 10.0.2.15.52728: Flags [P.], seq 380649:384771, ack 902, win 65535, length 4122
21:45:51.196628 IP 18.218.22.89.443 > 10.0.2.15.52728: Flags [P.], seq 384771:390267, ack 902, win 65535, length 5496
21:45:51.196640 IP 10.0.2.15.52728 > 18.218.22.89.443: Flags [.], ack 380649, win 65535, length 0
21:45:51.196657 IP 10.0.2.15.52728 > 18.218.22.89.443: Flags [.], ack 384771, win 65535, length 0
21:45:51.197487 IP 10.0.2.15.52728 > 18.218.22.89.443: Flags [.], ack 390267, win 65535, length 0
21:45:51.197533 IP 18.218.22.89.443 > 10.0.2.15.52728: Flags [P.], seq 390267:394389, ack 902, win 65535, length 4122
21:45:51.197536 IP 18.218.22.89.443 > 10.0.2.15.52728: Flags [P.], seq 394389:399885, ack 902, win 65535, length 5496
21:45:51.197537 IP 18.218.22.89.443 > 10.0.2.15.52728: Flags [P.], seq 399885:401259, ack 902, win 65535, length 1374
21:45:51.197551 IP 10.0.2.15.52728 > 18.218.22.89.443: Flags [.], ack 394389, win 65535, length 0
21:45:51.197573 IP 10.0.2.15.52728 > 18.218.22.89.443: Flags [.], ack 399885, win 65535, length 0
21:45:51.197591 IP 10.0.2.15.52728 > 18.218.22.89.443: Flags [.], ack 401259, win 65535, length 0
21:45:51.197668 IP 18.218.22.89.443 > 10.0.2.15.52728: Flags [P.], seq 401259:406755, ack 902, win 65535, length 5496
21:45:51.197674 IP 10.0.2.15.52728 > 18.218.22.89.443: Flags [.], ack 406755, win 65535, length 0
21:45:51.199956 IP 18.218.22.89.443 > 10.0.2.15.52728: Flags [P.], seq 406755:432861, ack 902, win 65535, length 26106
21:45:51.200007 IP 10.0.2.15.52728 > 18.218.22.89.443: Flags [.], ack 432861, win 65535, length 0
21:45:51.200037 IP 18.218.22.89.443 > 10.0.2.15.52728: Flags [P.], seq 432861:438357, ack 902, win 65535, length 5496
21:45:51.200038 IP 18.218.22.89.443 > 10.0.2.15.52728: Flags [P.], seq 438357:443853, ack 902, win 65535, length 5496
21:45:51.200047 IP 10.0.2.15.52728 > 18.218.22.89.443: Flags [.], ack 438357, win 65535, length 0
21:45:51.200102 IP 10.0.2.15.52728 > 18.218.22.89.443: Flags [.], ack 443853, win 65535, length 0
21:45:51.200936 IP 18.218.22.89.443 > 10.0.2.15.52728: Flags [P.], seq 443853:449349, ack 902, win 65535, length 5496
21:45:51.200938 IP 18.218.22.89.443 > 10.0.2.15.52728: Flags [P.], seq 449349:450723, ack 902, win 65535, length 1374
21:45:51.200940 IP 18.218.22.89.443 > 10.0.2.15.52728: Flags [P.], seq 450723:456219, ack 902, win 65535, length 5496
21:45:51.200957 IP 10.0.2.15.52728 > 18.218.22.89.443: Flags [.], ack 449349, win 65535, length 0
21:45:51.200983 IP 10.0.2.15.52728 > 18.218.22.89.443: Flags [.], ack 450723, win 65535, length 0
21:45:51.201001 IP 10.0.2.15.52728 > 18.218.22.89.443: Flags [.], ack 456219, win 65535, length 0
21:45:51.201037 IP 18.218.22.89.443 > 10.0.2.15.52728: Flags [P.], seq 456219:458967, ack 902, win 65535, length 2748
21:45:51.201045 IP 10.0.2.15.52728 > 18.218.22.89.443: Flags [.], ack 458967, win 65535, length 0
21:45:51.201521 IP 18.218.22.89.443 > 10.0.2.15.52728: Flags [P.], seq 458967:460341, ack 902, win 65535, length 1374
21:45:51.201530 IP 10.0.2.15.52728 > 18.218.22.89.443: Flags [.], ack 460341, win 65535, length 0
21:45:51.214574 IP 18.218.22.89.443 > 10.0.2.15.52728: Flags [P.], seq 460341:469959, ack 902, win 65535, length 9618
21:45:51.214578 IP 18.218.22.89.443 > 10.0.2.15.52728: Flags [P.], seq 469959:475455, ack 902, win 65535, length 5496
21:45:51.214602 IP 10.0.2.15.52728 > 18.218.22.89.443: Flags [.], ack 469959, win 65535, length 0
21:45:51.214720 IP 10.0.2.15.52728 > 18.218.22.89.443: Flags [.], ack 475455, win 65535, length 0
21:45:51.214758 IP 18.218.22.89.443 > 10.0.2.15.52728: Flags [P.], seq 475455:478203, ack 902, win 65535, length 2748
21:45:51.214764 IP 10.0.2.15.52728 > 18.218.22.89.443: Flags [.], ack 478203, win 65535, length 0
21:45:51.215628 IP 18.218.22.89.443 > 10.0.2.15.52728: Flags [P.], seq 478203:483699, ack 902, win 65535, length 5496
21:45:51.215652 IP 10.0.2.15.52728 > 18.218.22.89.443: Flags [.], ack 483699, win 65535, length 0
21:45:51.216498 IP 18.218.22.89.443 > 10.0.2.15.52728: Flags [P.], seq 483699:493317, ack 902, win 65535, length 9618

