21:47:11.781637 IP 10.0.2.15.42749 > 140.233.253.2.53: 38434+ A? www.indeed.com. (32)
21:47:11.781683 IP 10.0.2.15.42749 > 140.233.253.2.53: 14886+ AAAA? www.indeed.com. (32)
21:47:11.787448 IP 140.233.253.2.53 > 10.0.2.15.42749: 38434 2/0/0 CNAME us.dyn.indeed.com., A 18.218.22.89 (69)
21:47:11.787450 IP 140.233.253.2.53 > 10.0.2.15.42749: 14886 1/1/0 CNAME us.dyn.indeed.com. (118)
21:47:11.787737 IP 10.0.2.15.52738 > 18.218.22.89.443: Flags [S], seq 22644128, win 64240, options [mss 1460,sackOK,TS val 556628436 ecr 0,nop,wscale 6], length 0
21:47:11.820700 IP 18.218.22.89.443 > 10.0.2.15.52738: Flags [S.], seq 269376001, ack 22644129, win 65535, options [mss 1460], length 0
21:47:11.820759 IP 10.0.2.15.52738 > 18.218.22.89.443: Flags [.], ack 1, win 64240, length 0
21:47:11.834613 IP 10.0.2.15.52738 > 18.218.22.89.443: Flags [P.], seq 1:518, ack 1, win 64240, length 517
21:47:11.835123 IP 18.218.22.89.443 > 10.0.2.15.52738: Flags [.], ack 518, win 65535, length 0
21:47:11.870129 IP 18.218.22.89.443 > 10.0.2.15.52738: Flags [.], seq 1:2921, ack 518, win 65535, length 2920
21:47:11.870153 IP 10.0.2.15.52738 > 18.218.22.89.443: Flags [.], ack 2921, win 62780, length 0
21:47:11.870714 IP 18.218.22.89.443 > 10.0.2.15.52738: Flags [P.], seq 2921:4375, ack 518, win 65535, length 1454
21:47:11.870738 IP 10.0.2.15.52738 > 18.218.22.89.443: Flags [.], ack 4375, win 61326, length 0
21:47:11.872442 IP 10.0.2.15.52738 > 18.218.22.89.443: Flags [P.], seq 518:644, ack 4375, win 62780, length 126
21:47:11.872830 IP 18.218.22.89.443 > 10.0.2.15.52738: Flags [.], ack 644, win 65535, length 0
21:47:11.903976 IP 18.218.22.89.443 > 10.0.2.15.52738: Flags [P.], seq 4375:4495, ack 644, win 65535, length 120
21:47:11.903999 IP 10.0.2.15.52738 > 18.218.22.89.443: Flags [.], ack 4495, win 62780, length 0
21:47:11.904862 IP 10.0.2.15.52738 > 18.218.22.89.443: Flags [P.], seq 644:697, ack 4495, win 62780, length 53
21:47:11.904916 IP 10.0.2.15.52738 > 18.218.22.89.443: Flags [P.], seq 697:753, ack 4495, win 62780, length 56
21:47:11.905752 IP 18.218.22.89.443 > 10.0.2.15.52738: Flags [.], ack 697, win 65535, length 0
21:47:11.905754 IP 18.218.22.89.443 > 10.0.2.15.52738: Flags [.], ack 753, win 65535, length 0
21:47:11.905809 IP 10.0.2.15.52738 > 18.218.22.89.443: Flags [P.], seq 753:864, ack 4495, win 62780, length 111
21:47:11.905999 IP 10.0.2.15.52738 > 18.218.22.89.443: Flags [P.], seq 864:902, ack 4495, win 62780, length 38
21:47:11.906432 IP 18.218.22.89.443 > 10.0.2.15.52738: Flags [.], ack 864, win 65535, length 0
21:47:11.906434 IP 18.218.22.89.443 > 10.0.2.15.52738: Flags [.], ack 902, win 65535, length 0
21:47:11.935752 IP 18.218.22.89.443 > 10.0.2.15.52738: Flags [P.], seq 4495:4533, ack 902, win 65535, length 38
21:47:11.935774 IP 10.0.2.15.52738 > 18.218.22.89.443: Flags [.], ack 4533, win 62780, length 0
21:47:11.952457 IP 18.218.22.89.443 > 10.0.2.15.52738: Flags [.], seq 4533:13293, ack 902, win 65535, length 8760
21:47:11.952969 IP 10.0.2.15.52738 > 18.218.22.89.443: Flags [.], ack 13293, win 58400, length 0
21:47:11.953205 IP 18.218.22.89.443 > 10.0.2.15.52738: Flags [P.], seq 13293:16899, ack 902, win 65535, length 3606
21:47:11.953218 IP 10.0.2.15.52738 > 18.218.22.89.443: Flags [.], ack 16899, win 55480, length 0
21:47:11.966123 IP 18.218.22.89.443 > 10.0.2.15.52738: Flags [P.], seq 16899:18273, ack 902, win 65535, length 1374
21:47:11.966152 IP 10.0.2.15.52738 > 18.218.22.89.443: Flags [.], ack 18273, win 62780, length 0
21:47:11.967019 IP 18.218.22.89.443 > 10.0.2.15.52738: Flags [P.], seq 18273:19647, ack 902, win 65535, length 1374
21:47:11.967086 IP 10.0.2.15.52738 > 18.218.22.89.443: Flags [.], ack 19647, win 62780, length 0
21:47:11.982268 IP 18.218.22.89.443 > 10.0.2.15.52738: Flags [P.], seq 19647:26517, ack 902, win 65535, length 6870
21:47:11.982298 IP 10.0.2.15.52738 > 18.218.22.89.443: Flags [.], ack 26517, win 59860, length 0
21:47:11.983743 IP 18.218.22.89.443 > 10.0.2.15.52738: Flags [P.], seq 26517:32013, ack 902, win 65535, length 5496
21:47:11.983747 IP 18.218.22.89.443 > 10.0.2.15.52738: Flags [P.], seq 32013:38883, ack 902, win 65535, length 6870
21:47:11.983771 IP 10.0.2.15.52738 > 18.218.22.89.443: Flags [.], ack 32013, win 55480, length 0
21:47:11.983804 IP 10.0.2.15.52738 > 18.218.22.89.443: Flags [.], ack 38883, win 51100, length 0
21:47:11.983828 IP 18.218.22.89.443 > 10.0.2.15.52738: Flags [P.], seq 38883:40257, ack 902, win 65535, length 1374
21:47:11.983829 IP 18.218.22.89.443 > 10.0.2.15.52738: Flags [.], seq 40257:41717, ack 902, win 65535, length 1460
21:47:11.984115 IP 18.218.22.89.443 > 10.0.2.15.52738: Flags [P.], seq 41717:44379, ack 902, win 65535, length 2662
21:47:11.984274 IP 10.0.2.15.52738 > 18.218.22.89.443: Flags [.], ack 44379, win 46720, length 0
21:47:11.996411 IP 18.218.22.89.443 > 10.0.2.15.52738: Flags [P.], seq 44379:47127, ack 902, win 65535, length 2748
21:47:11.996437 IP 10.0.2.15.52738 > 18.218.22.89.443: Flags [.], ack 47127, win 62780, length 0
21:47:11.997209 IP 18.218.22.89.443 > 10.0.2.15.52738: Flags [P.], seq 47127:48501, ack 902, win 65535, length 1374
21:47:11.997294 IP 10.0.2.15.52738 > 18.218.22.89.443: Flags [.], ack 48501, win 62780, length 0
21:47:11.998758 IP 18.218.22.89.443 > 10.0.2.15.52738: Flags [P.], seq 48501:49875, ack 902, win 65535, length 1374
21:47:12.013052 IP 18.218.22.89.443 > 10.0.2.15.52738: Flags [P.], seq 49875:59493, ack 902, win 65535, length 9618
21:47:12.013182 IP 10.0.2.15.52738 > 18.218.22.89.443: Flags [.], ack 59493, win 58400, length 0
21:47:12.014596 IP 18.218.22.89.443 > 10.0.2.15.52738: Flags [P.], seq 59493:62241, ack 902, win 65535, length 2748
21:47:12.014616 IP 10.0.2.15.52738 > 18.218.22.89.443: Flags [.], ack 62241, win 62780, length 0
21:47:12.016189 IP 18.218.22.89.443 > 10.0.2.15.52738: Flags [P.], seq 62241:70485, ack 902, win 65535, length 8244
21:47:12.016194 IP 18.218.22.89.443 > 10.0.2.15.52738: Flags [P.], seq 70485:73233, ack 902, win 65535, length 2748
21:47:12.016413 IP 18.218.22.89.443 > 10.0.2.15.52738: Flags [P.], seq 73233:75981, ack 902, win 65535, length 2748
21:47:12.016416 IP 18.218.22.89.443 > 10.0.2.15.52738: Flags [P.], seq 75981:81477, ack 902, win 65535, length 5496
21:47:12.016519 IP 10.0.2.15.52738 > 18.218.22.89.443: Flags [.], ack 81477, win 62780, length 0
21:47:12.016741 IP 18.218.22.89.443 > 10.0.2.15.52738: Flags [P.], seq 81477:88347, ack 902, win 65535, length 6870
21:47:12.016743 IP 18.218.22.89.443 > 10.0.2.15.52738: Flags [P.], seq 88347:93843, ack 902, win 65535, length 5496
21:47:12.016808 IP 18.218.22.89.443 > 10.0.2.15.52738: Flags [P.], seq 93843:96591, ack 902, win 65535, length 2748
21:47:12.016835 IP 10.0.2.15.52738 > 18.218.22.89.443: Flags [.], ack 96591, win 65535, length 0
21:47:12.017936 IP 18.218.22.89.443 > 10.0.2.15.52738: Flags [P.], seq 96591:97965, ack 902, win 65535, length 1374
21:47:12.017950 IP 10.0.2.15.52738 > 18.218.22.89.443: Flags [.], ack 97965, win 65535, length 0
21:47:12.026528 IP 18.218.22.89.443 > 10.0.2.15.52738: Flags [P.], seq 97965:103461, ack 902, win 65535, length 5496
21:47:12.026549 IP 10.0.2.15.52738 > 18.218.22.89.443: Flags [.], ack 103461, win 65535, length 0
21:47:12.028710 IP 18.218.22.89.443 > 10.0.2.15.52738: Flags [P.], seq 103461:108957, ack 902, win 65535, length 5496
21:47:12.028730 IP 10.0.2.15.52738 > 18.218.22.89.443: Flags [.], ack 108957, win 65535, length 0
21:47:12.029548 IP 18.218.22.89.443 > 10.0.2.15.52738: Flags [P.], seq 108957:110331, ack 902, win 65535, length 1374
21:47:12.029562 IP 10.0.2.15.52738 > 18.218.22.89.443: Flags [.], ack 110331, win 65535, length 0
21:47:12.043489 IP 18.218.22.89.443 > 10.0.2.15.52738: Flags [P.], seq 110331:121323, ack 902, win 65535, length 10992
21:47:12.043506 IP 10.0.2.15.52738 > 18.218.22.89.443: Flags [.], ack 121323, win 65535, length 0
21:47:12.043575 IP 18.218.22.89.443 > 10.0.2.15.52738: Flags [P.], seq 121323:126819, ack 902, win 65535, length 5496
21:47:12.043585 IP 10.0.2.15.52738 > 18.218.22.89.443: Flags [.], ack 126819, win 65535, length 0
21:47:12.045791 IP 18.218.22.89.443 > 10.0.2.15.52738: Flags [P.], seq 126819:135063, ack 902, win 65535, length 8244
21:47:12.045860 IP 10.0.2.15.52738 > 18.218.22.89.443: Flags [.], ack 135063, win 65535, length 0
21:47:12.048108 IP 18.218.22.89.443 > 10.0.2.15.52738: Flags [P.], seq 135063:146055, ack 902, win 65535, length 10992
21:47:12.048130 IP 10.0.2.15.52738 > 18.218.22.89.443: Flags [.], ack 146055, win 65535, length 0
21:47:12.048559 IP 18.218.22.89.443 > 10.0.2.15.52738: Flags [P.], seq 146055:148803, ack 902, win 65535, length 2748
21:47:12.048561 IP 18.218.22.89.443 > 10.0.2.15.52738: Flags [P.], seq 148803:150177, ack 902, win 65535, length 1374
21:47:12.048582 IP 10.0.2.15.52738 > 18.218.22.89.443: Flags [.], ack 148803, win 65535, length 0
21:47:12.049306 IP 10.0.2.15.52738 > 18.218.22.89.443: Flags [.], ack 150177, win 65535, length 0
21:47:12.051044 IP 18.218.22.89.443 > 10.0.2.15.52738: Flags [P.], seq 150177:151551, ack 902, win 65535, length 1374
21:47:12.051049 IP 18.218.22.89.443 > 10.0.2.15.52738: Flags [P.], seq 151551:157047, ack 902, win 65535, length 5496
21:47:12.051051 IP 18.218.22.89.443 > 10.0.2.15.52738: Flags [P.], seq 157047:161169, ack 902, win 65535, length 4122
21:47:12.051075 IP 10.0.2.15.52738 > 18.218.22.89.443: Flags [.], ack 151551, win 65535, length 0
21:47:12.051203 IP 10.0.2.15.52738 > 18.218.22.89.443: Flags [.], ack 157047, win 65535, length 0
21:47:12.051230 IP 10.0.2.15.52738 > 18.218.22.89.443: Flags [.], ack 161169, win 65535, length 0
21:47:12.051247 IP 18.218.22.89.443 > 10.0.2.15.52738: Flags [P.], seq 161169:165291, ack 902, win 65535, length 4122
21:47:12.051249 IP 18.218.22.89.443 > 10.0.2.15.52738: Flags [P.], seq 165291:172161, ack 902, win 65535, length 6870
21:47:12.051255 IP 10.0.2.15.52738 > 18.218.22.89.443: Flags [.], ack 165291, win 65535, length 0
21:47:12.051268 IP 10.0.2.15.52738 > 18.218.22.89.443: Flags [.], ack 172161, win 65535, length 0
21:47:12.051297 IP 18.218.22.89.443 > 10.0.2.15.52738: Flags [P.], seq 172161:177657, ack 902, win 65535, length 5496
21:47:12.051298 IP 18.218.22.89.443 > 10.0.2.15.52738: Flags [P.], seq 177657:181779, ack 902, win 65535, length 4122
21:47:12.051299 IP 18.218.22.89.443 > 10.0.2.15.52738: Flags [P.], seq 181779:185901, ack 902, win 65535, length 4122
21:47:12.051305 IP 10.0.2.15.52738 > 18.218.22.89.443: Flags [.], ack 177657, win 65535, length 0
21:47:12.051319 IP 10.0.2.15.52738 > 18.218.22.89.443: Flags [.], ack 181779, win 65535, length 0
21:47:12.051327 IP 10.0.2.15.52738 > 18.218.22.89.443: Flags [.], ack 185901, win 65535, length 0
21:47:12.052062 IP 18.218.22.89.443 > 10.0.2.15.52738: Flags [P.], seq 185901:202389, ack 902, win 65535, length 16488
21:47:12.052117 IP 10.0.2.15.52738 > 18.218.22.89.443: Flags [.], ack 202389, win 65535, length 0
21:47:12.052286 IP 18.218.22.89.443 > 10.0.2.15.52738: Flags [P.], seq 202389:203763, ack 902, win 65535, length 1374
21:47:12.052315 IP 10.0.2.15.52738 > 18.218.22.89.443: Flags [.], ack 203763, win 65535, length 0
21:47:12.056464 IP 18.218.22.89.443 > 10.0.2.15.52738: Flags [P.], seq 203763:210633, ack 902, win 65535, length 6870
21:47:12.056466 IP 18.218.22.89.443 > 10.0.2.15.52738: Flags [P.], seq 210633:213381, ack 902, win 65535, length 2748
21:47:12.056487 IP 10.0.2.15.52738 > 18.218.22.89.443: Flags [.], ack 210633, win 65535, length 0
21:47:12.056520 IP 10.0.2.15.52738 > 18.218.22.89.443: Flags [.], ack 213381, win 65535, length 0
21:47:12.059028 IP 18.218.22.89.443 > 10.0.2.15.52738: Flags [P.], seq 213381:214755, ack 902, win 65535, length 1374
21:47:12.059080 IP 10.0.2.15.52738 > 18.218.22.89.443: Flags [.], ack 214755, win 65535, length 0
21:47:12.059615 IP 18.218.22.89.443 > 10.0.2.15.52738: Flags [P.], seq 214755:221625, ack 902, win 65535, length 6870
21:47:12.059682 IP 10.0.2.15.52738 > 18.218.22.89.443: Flags [.], ack 221625, win 65535, length 0
21:47:12.059896 IP 18.218.22.89.443 > 10.0.2.15.52738: Flags [P.], seq 221625:224373, ack 902, win 65535, length 2748
21:47:12.059910 IP 10.0.2.15.52738 > 18.218.22.89.443: Flags [.], ack 224373, win 65535, length 0
21:47:12.060805 IP 18.218.22.89.443 > 10.0.2.15.52738: Flags [P.], seq 224373:225747, ack 902, win 65535, length 1374
21:47:12.060821 IP 10.0.2.15.52738 > 18.218.22.89.443: Flags [.], ack 225747, win 65535, length 0
21:47:12.073664 IP 18.218.22.89.443 > 10.0.2.15.52738: Flags [P.], seq 225747:232617, ack 902, win 65535, length 6870
21:47:12.073860 IP 10.0.2.15.52738 > 18.218.22.89.443: Flags [.], ack 232617, win 65535, length 0
21:47:12.074520 IP 18.218.22.89.443 > 10.0.2.15.52738: Flags [P.], seq 232617:236739, ack 902, win 65535, length 4122
21:47:12.074535 IP 10.0.2.15.52738 > 18.218.22.89.443: Flags [.], ack 236739, win 65535, length 0
21:47:12.077855 IP 18.218.22.89.443 > 10.0.2.15.52738: Flags [.], seq 236739:274699, ack 902, win 65535, length 37960
21:47:12.077879 IP 10.0.2.15.52738 > 18.218.22.89.443: Flags [.], ack 274699, win 65535, length 0
21:47:12.078004 IP 18.218.22.89.443 > 10.0.2.15.52738: Flags [P.], seq 274699:275211, ack 902, win 65535, length 512
21:47:12.078012 IP 10.0.2.15.52738 > 18.218.22.89.443: Flags [.], ack 275211, win 65535, length 0
21:47:12.078796 IP 18.218.22.89.443 > 10.0.2.15.52738: Flags [P.], seq 275211:276585, ack 902, win 65535, length 1374
21:47:12.078799 IP 18.218.22.89.443 > 10.0.2.15.52738: Flags [P.], seq 276585:283455, ack 902, win 65535, length 6870
21:47:12.078915 IP 18.218.22.89.443 > 10.0.2.15.52738: Flags [P.], seq 283455:287577, ack 902, win 65535, length 4122
21:47:12.079176 IP 18.218.22.89.443 > 10.0.2.15.52738: Flags [P.], seq 287577:290325, ack 902, win 65535, length 2748
21:47:12.079330 IP 18.218.22.89.443 > 10.0.2.15.52738: Flags [P.], seq 290325:293073, ack 902, win 65535, length 2748
21:47:12.079331 IP 18.218.22.89.443 > 10.0.2.15.52738: Flags [P.], seq 293073:295821, ack 902, win 65535, length 2748
21:47:12.079449 IP 18.218.22.89.443 > 10.0.2.15.52738: Flags [P.], seq 295821:298569, ack 902, win 65535, length 2748
21:47:12.079561 IP 18.218.22.89.443 > 10.0.2.15.52738: Flags [P.], seq 298569:302691, ack 902, win 65535, length 4122
21:47:12.079735 IP 18.218.22.89.443 > 10.0.2.15.52738: Flags [.], seq 302691:304151, ack 902, win 65535, length 1460
21:47:12.079778 IP 10.0.2.15.52738 > 18.218.22.89.443: Flags [.], ack 298569, win 65535, length 0
21:47:12.080320 IP 18.218.22.89.443 > 10.0.2.15.52738: Flags [P.], seq 304151:305439, ack 902, win 65535, length 1288
21:47:12.080322 IP 18.218.22.89.443 > 10.0.2.15.52738: Flags [P.], seq 305439:306813, ack 902, win 65535, length 1374
21:47:12.081066 IP 18.218.22.89.443 > 10.0.2.15.52738: Flags [P.], seq 306813:308187, ack 902, win 65535, length 1374
21:47:12.081219 IP 10.0.2.15.52738 > 18.218.22.89.443: Flags [.], ack 304151, win 65535, length 0
21:47:12.081246 IP 10.0.2.15.52738 > 18.218.22.89.443: Flags [.], ack 308187, win 65535, length 0
21:47:12.082324 IP 18.218.22.89.443 > 10.0.2.15.52738: Flags [P.], seq 308187:313683, ack 902, win 65535, length 5496
21:47:12.082326 IP 18.218.22.89.443 > 10.0.2.15.52738: Flags [P.], seq 313683:319179, ack 902, win 65535, length 5496
21:47:12.082400 IP 10.0.2.15.52738 > 18.218.22.89.443: Flags [.], ack 313683, win 65535, length 0
21:47:12.082452 IP 10.0.2.15.52738 > 18.218.22.89.443: Flags [.], ack 319179, win 65535, length 0
21:47:12.082531 IP 18.218.22.89.443 > 10.0.2.15.52738: Flags [P.], seq 319179:324675, ack 902, win 65535, length 5496
21:47:12.082539 IP 10.0.2.15.52738 > 18.218.22.89.443: Flags [.], ack 324675, win 65535, length 0
21:47:12.083920 IP 18.218.22.89.443 > 10.0.2.15.52738: Flags [P.], seq 324675:327423, ack 902, win 65535, length 2748
21:47:12.083923 IP 18.218.22.89.443 > 10.0.2.15.52738: Flags [P.], seq 327423:331545, ack 902, win 65535, length 4122
21:47:12.083924 IP 18.218.22.89.443 > 10.0.2.15.52738: Flags [P.], seq 331545:335667, ack 902, win 65535, length 4122
21:47:12.083940 IP 10.0.2.15.52738 > 18.218.22.89.443: Flags [.], ack 327423, win 65535, length 0
21:47:12.084033 IP 10.0.2.15.52738 > 18.218.22.89.443: Flags [.], ack 331545, win 65535, length 0
21:47:12.084064 IP 10.0.2.15.52738 > 18.218.22.89.443: Flags [.], ack 335667, win 65535, length 0
21:47:12.084095 IP 18.218.22.89.443 > 10.0.2.15.52738: Flags [P.], seq 335667:342537, ack 902, win 65535, length 6870
21:47:12.084098 IP 18.218.22.89.443 > 10.0.2.15.52738: Flags [P.], seq 342537:346659, ack 902, win 65535, length 4122
21:47:12.084110 IP 10.0.2.15.52738 > 18.218.22.89.443: Flags [.], ack 342537, win 65535, length 0
21:47:12.084139 IP 10.0.2.15.52738 > 18.218.22.89.443: Flags [.], ack 346659, win 65535, length 0
21:47:12.084818 IP 18.218.22.89.443 > 10.0.2.15.52738: Flags [P.], seq 346659:349407, ack 902, win 65535, length 2748
21:47:12.084819 IP 18.218.22.89.443 > 10.0.2.15.52738: Flags [P.], seq 349407:353529, ack 902, win 65535, length 4122
21:47:12.084820 IP 18.218.22.89.443 > 10.0.2.15.52738: Flags [P.], seq 353529:356277, ack 902, win 65535, length 2748
21:47:12.084821 IP 18.218.22.89.443 > 10.0.2.15.52738: Flags [P.], seq 356277:360399, ack 902, win 65535, length 4122
21:47:12.084832 IP 10.0.2.15.52738 > 18.218.22.89.443: Flags [.], ack 349407, win 65535, length 0
21:47:12.084968 IP 10.0.2.15.52738 > 18.218.22.89.443: Flags [.], ack 353529, win 65535, length 0
21:47:12.085053 IP 10.0.2.15.52738 > 18.218.22.89.443: Flags [.], ack 356277, win 65535, length 0
21:47:12.085077 IP 10.0.2.15.52738 > 18.218.22.89.443: Flags [.], ack 360399, win 65535, length 0
21:47:12.085123 IP 18.218.22.89.443 > 10.0.2.15.52738: Flags [P.], seq 360399:367269, ack 902, win 65535, length 6870
21:47:12.085125 IP 18.218.22.89.443 > 10.0.2.15.52738: Flags [P.], seq 367269:371391, ack 902, win 65535, length 4122
21:47:12.085203 IP 10.0.2.15.52738 > 18.218.22.89.443: Flags [.], ack 367269, win 65535, length 0
21:47:12.085223 IP 10.0.2.15.52738 > 18.218.22.89.443: Flags [.], ack 371391, win 65535, length 0
21:47:12.086508 IP 18.218.22.89.443 > 10.0.2.15.52738: Flags [P.], seq 371391:374139, ack 902, win 65535, length 2748
21:47:12.086510 IP 18.218.22.89.443 > 10.0.2.15.52738: Flags [P.], seq 374139:376887, ack 902, win 65535, length 2748
21:47:12.086642 IP 18.218.22.89.443 > 10.0.2.15.52738: Flags [P.], seq 376887:379635, ack 902, win 65535, length 2748
21:47:12.086644 IP 18.218.22.89.443 > 10.0.2.15.52738: Flags [P.], seq 379635:381009, ack 902, win 65535, length 1374
21:47:12.086644 IP 18.218.22.89.443 > 10.0.2.15.52738: Flags [P.], seq 381009:383757, ack 902, win 65535, length 2748
21:47:12.086660 IP 10.0.2.15.52738 > 18.218.22.89.443: Flags [.], ack 374139, win 65535, length 0
21:47:12.086682 IP 10.0.2.15.52738 > 18.218.22.89.443: Flags [.], ack 376887, win 65535, length 0
21:47:12.086692 IP 10.0.2.15.52738 > 18.218.22.89.443: Flags [.], ack 379635, win 65535, length 0
21:47:12.086703 IP 10.0.2.15.52738 > 18.218.22.89.443: Flags [.], ack 381009, win 65535, length 0
21:47:12.086767 IP 10.0.2.15.52738 > 18.218.22.89.443: Flags [.], ack 383757, win 65535, length 0
21:47:12.086940 IP 18.218.22.89.443 > 10.0.2.15.52738: Flags [P.], seq 383757:400245, ack 902, win 65535, length 16488
21:47:12.086950 IP 10.0.2.15.52738 > 18.218.22.89.443: Flags [.], ack 400245, win 65535, length 0
21:47:12.087380 IP 18.218.22.89.443 > 10.0.2.15.52738: Flags [P.], seq 400245:408489, ack 902, win 65535, length 8244
21:47:12.087383 IP 18.218.22.89.443 > 10.0.2.15.52738: Flags [P.], seq 408489:409863, ack 902, win 65535, length 1374
21:47:12.087404 IP 10.0.2.15.52738 > 18.218.22.89.443: Flags [.], ack 408489, win 65535, length 0
21:47:12.087432 IP 10.0.2.15.52738 > 18.218.22.89.443: Flags [.], ack 409863, win 65535, length 0
21:47:12.088507 IP 18.218.22.89.443 > 10.0.2.15.52738: Flags [P.], seq 409863:416733, ack 902, win 65535, length 6870
21:47:12.088522 IP 10.0.2.15.52738 > 18.218.22.89.443: Flags [.], ack 416733, win 65535, length 0
21:47:12.089889 IP 18.218.22.89.443 > 10.0.2.15.52738: Flags [P.], seq 416733:420855, ack 902, win 65535, length 4122
21:47:12.089893 IP 18.218.22.89.443 > 10.0.2.15.52738: Flags [.], seq 420855:435455, ack 902, win 65535, length 14600
21:47:12.089911 IP 10.0.2.15.52738 > 18.218.22.89.443: Flags [.], ack 420855, win 65535, length 0
21:47:12.090047 IP 10.0.2.15.52738 > 18.218.22.89.443: Flags [.], ack 435455, win 65535, length 0
21:47:12.090266 IP 18.218.22.89.443 > 10.0.2.15.52738: Flags [P.], seq 435455:438717, ack 902, win 65535, length 3262
21:47:12.090268 IP 18.218.22.89.443 > 10.0.2.15.52738: Flags [P.], seq 438717:441465, ack 902, win 65535, length 2748
21:47:12.090268 IP 18.218.22.89.443 > 10.0.2.15.52738: Flags [.], seq 441465:442925, ack 902, win 65535, length 1460
21:47:12.090279 IP 10.0.2.15.52738 > 18.218.22.89.443: Flags [.], ack 438717, win 65535, length 0
21:47:12.090292 IP 10.0.2.15.52738 > 18.218.22.89.443: Flags [.], ack 441465, win 65535, length 0
21:47:12.090347 IP 10.0.2.15.52738 > 18.218.22.89.443: Flags [.], ack 442925, win 65535, length 0
21:47:12.090616 IP 18.218.22.89.443 > 10.0.2.15.52738: Flags [P.], seq 442925:445587, ack 902, win 65535, length 2662
21:47:12.090623 IP 10.0.2.15.52738 > 18.218.22.89.443: Flags [.], ack 445587, win 65535, length 0
21:47:12.093142 IP 18.218.22.89.443 > 10.0.2.15.52738: Flags [P.], seq 445587:446961, ack 902, win 65535, length 1374
21:47:12.093165 IP 10.0.2.15.52738 > 18.218.22.89.443: Flags [.], ack 446961, win 65535, length 0
21:47:12.105762 IP 18.218.22.89.443 > 10.0.2.15.52738: Flags [P.], seq 446961:459327, ack 902, win 65535, length 12366
21:47:12.105791 IP 10.0.2.15.52738 > 18.218.22.89.443: Flags [.], ack 459327, win 65535, length 0
21:47:12.105879 IP 18.218.22.89.443 > 10.0.2.15.52738: Flags [P.], seq 459327:466197, ack 902, win 65535, length 6870
21:47:12.105881 IP 18.218.22.89.443 > 10.0.2.15.52738: Flags [P.], seq 466197:470319, ack 902, win 65535, length 4122
21:47:12.105902 IP 10.0.2.15.52738 > 18.218.22.89.443: Flags [.], ack 466197, win 65535, length 0
21:47:12.105929 IP 10.0.2.15.52738 > 18.218.22.89.443: Flags [.], ack 470319, win 65535, length 0
21:47:12.105965 IP 18.218.22.89.443 > 10.0.2.15.52738: Flags [P.], seq 470319:474441, ack 902, win 65535, length 4122
21:47:12.105975 IP 10.0.2.15.52738 > 18.218.22.89.443: Flags [.], ack 474441, win 65535, length 0

