21:50:32.840166 IP 10.0.2.15.48736 > 140.233.253.2.53: 2995+ A? www.indeed.com. (32)
21:50:32.840490 IP 10.0.2.15.48736 > 140.233.253.2.53: 17294+ AAAA? www.indeed.com. (32)
21:50:32.846585 IP 140.233.253.2.53 > 10.0.2.15.48736: 17294 1/1/0 CNAME us.dyn.indeed.com. (118)
21:50:32.846588 IP 140.233.253.2.53 > 10.0.2.15.48736: 2995 2/0/0 CNAME us.dyn.indeed.com., A 18.216.114.70 (69)
21:50:32.846890 IP 10.0.2.15.33198 > 18.216.114.70.443: Flags [S], seq 2885041308, win 64240, options [mss 1460,sackOK,TS val 516677577 ecr 0,nop,wscale 6], length 0
21:50:32.879269 IP 18.216.114.70.443 > 10.0.2.15.33198: Flags [S.], seq 273920001, ack 2885041309, win 65535, options [mss 1460], length 0
21:50:32.879320 IP 10.0.2.15.33198 > 18.216.114.70.443: Flags [.], ack 1, win 64240, length 0
21:50:32.893546 IP 10.0.2.15.33198 > 18.216.114.70.443: Flags [P.], seq 1:518, ack 1, win 64240, length 517
21:50:32.894078 IP 18.216.114.70.443 > 10.0.2.15.33198: Flags [.], ack 518, win 65535, length 0
21:50:32.928807 IP 18.216.114.70.443 > 10.0.2.15.33198: Flags [.], seq 1:2921, ack 518, win 65535, length 2920
21:50:32.928833 IP 10.0.2.15.33198 > 18.216.114.70.443: Flags [.], ack 2921, win 62780, length 0
21:50:32.929314 IP 18.216.114.70.443 > 10.0.2.15.33198: Flags [P.], seq 2921:4123, ack 518, win 65535, length 1202
21:50:32.929332 IP 10.0.2.15.33198 > 18.216.114.70.443: Flags [.], ack 4123, win 61578, length 0
21:50:32.929515 IP 18.216.114.70.443 > 10.0.2.15.33198: Flags [P.], seq 4123:4375, ack 518, win 65535, length 252
21:50:32.929522 IP 10.0.2.15.33198 > 18.216.114.70.443: Flags [.], ack 4375, win 61326, length 0
21:50:32.930900 IP 10.0.2.15.33198 > 18.216.114.70.443: Flags [P.], seq 518:644, ack 4375, win 62780, length 126
21:50:32.931234 IP 18.216.114.70.443 > 10.0.2.15.33198: Flags [.], ack 644, win 65535, length 0
21:50:32.962579 IP 18.216.114.70.443 > 10.0.2.15.33198: Flags [P.], seq 4375:4495, ack 644, win 65535, length 120
21:50:32.962601 IP 10.0.2.15.33198 > 18.216.114.70.443: Flags [.], ack 4495, win 62780, length 0
21:50:32.963091 IP 10.0.2.15.33198 > 18.216.114.70.443: Flags [P.], seq 644:697, ack 4495, win 62780, length 53
21:50:32.963129 IP 10.0.2.15.33198 > 18.216.114.70.443: Flags [P.], seq 697:753, ack 4495, win 62780, length 56
21:50:32.963380 IP 18.216.114.70.443 > 10.0.2.15.33198: Flags [.], ack 697, win 65535, length 0
21:50:32.963402 IP 10.0.2.15.33198 > 18.216.114.70.443: Flags [P.], seq 753:902, ack 4495, win 62780, length 149
21:50:32.963540 IP 18.216.114.70.443 > 10.0.2.15.33198: Flags [.], ack 753, win 65535, length 0
21:50:32.963541 IP 18.216.114.70.443 > 10.0.2.15.33198: Flags [.], ack 902, win 65535, length 0
21:50:32.995106 IP 18.216.114.70.443 > 10.0.2.15.33198: Flags [P.], seq 4495:4533, ack 902, win 65535, length 38
21:50:32.995128 IP 10.0.2.15.33198 > 18.216.114.70.443: Flags [.], ack 4533, win 62780, length 0
21:50:33.010080 IP 18.216.114.70.443 > 10.0.2.15.33198: Flags [P.], seq 4533:12777, ack 902, win 65535, length 8244
21:50:33.010083 IP 18.216.114.70.443 > 10.0.2.15.33198: Flags [.], seq 12777:14237, ack 902, win 65535, length 1460
21:50:33.010122 IP 10.0.2.15.33198 > 18.216.114.70.443: Flags [.], ack 12777, win 58400, length 0
21:50:33.010154 IP 10.0.2.15.33198 > 18.216.114.70.443: Flags [.], ack 14237, win 58400, length 0
21:50:33.011104 IP 18.216.114.70.443 > 10.0.2.15.33198: Flags [P.], seq 14237:16899, ack 902, win 65535, length 2662
21:50:33.011118 IP 10.0.2.15.33198 > 18.216.114.70.443: Flags [.], ack 16899, win 55738, length 0
21:50:33.026237 IP 18.216.114.70.443 > 10.0.2.15.33198: Flags [P.], seq 16899:19647, ack 902, win 65535, length 2748
21:50:33.026338 IP 10.0.2.15.33198 > 18.216.114.70.443: Flags [.], ack 19647, win 62780, length 0
21:50:33.041726 IP 18.216.114.70.443 > 10.0.2.15.33198: Flags [P.], seq 19647:32013, ack 902, win 65535, length 12366
21:50:33.041781 IP 10.0.2.15.33198 > 18.216.114.70.443: Flags [.], ack 32013, win 55480, length 0
21:50:33.042043 IP 18.216.114.70.443 > 10.0.2.15.33198: Flags [.], seq 32013:37853, ack 902, win 65535, length 5840
21:50:33.042063 IP 10.0.2.15.33198 > 18.216.114.70.443: Flags [.], ack 37853, win 52560, length 0
21:50:33.042240 IP 18.216.114.70.443 > 10.0.2.15.33198: Flags [P.], seq 37853:44379, ack 902, win 65535, length 6526
21:50:33.042251 IP 10.0.2.15.33198 > 18.216.114.70.443: Flags [.], ack 44379, win 46720, length 0
21:50:33.058120 IP 18.216.114.70.443 > 10.0.2.15.33198: Flags [P.], seq 44379:49875, ack 902, win 65535, length 5496
21:50:33.058143 IP 10.0.2.15.33198 > 18.216.114.70.443: Flags [.], ack 49875, win 61320, length 0
21:50:33.074734 IP 18.216.114.70.443 > 10.0.2.15.33198: Flags [.], seq 49875:71775, ack 902, win 65535, length 21900
21:50:33.074830 IP 10.0.2.15.33198 > 18.216.114.70.443: Flags [.], ack 71775, win 62780, length 0
21:50:33.075445 IP 18.216.114.70.443 > 10.0.2.15.33198: Flags [P.], seq 71775:85599, ack 902, win 65535, length 13824
21:50:33.075461 IP 10.0.2.15.33198 > 18.216.114.70.443: Flags [.], ack 85599, win 65535, length 0
21:50:33.076494 IP 18.216.114.70.443 > 10.0.2.15.33198: Flags [P.], seq 85599:93843, ack 902, win 65535, length 8244
21:50:33.076510 IP 10.0.2.15.33198 > 18.216.114.70.443: Flags [.], ack 93843, win 65535, length 0
21:50:33.076694 IP 18.216.114.70.443 > 10.0.2.15.33198: Flags [P.], seq 93843:97965, ack 902, win 65535, length 4122
21:50:33.076703 IP 10.0.2.15.33198 > 18.216.114.70.443: Flags [.], ack 97965, win 65535, length 0
21:50:33.087431 IP 18.216.114.70.443 > 10.0.2.15.33198: Flags [P.], seq 97965:107583, ack 902, win 65535, length 9618
21:50:33.087433 IP 18.216.114.70.443 > 10.0.2.15.33198: Flags [P.], seq 107583:108957, ack 902, win 65535, length 1374
21:50:33.087460 IP 10.0.2.15.33198 > 18.216.114.70.443: Flags [.], ack 107583, win 65535, length 0
21:50:33.087508 IP 10.0.2.15.33198 > 18.216.114.70.443: Flags [.], ack 108957, win 65535, length 0
21:50:33.088413 IP 18.216.114.70.443 > 10.0.2.15.33198: Flags [P.], seq 108957:110331, ack 902, win 65535, length 1374
21:50:33.088426 IP 10.0.2.15.33198 > 18.216.114.70.443: Flags [.], ack 110331, win 65535, length 0
21:50:33.104762 IP 18.216.114.70.443 > 10.0.2.15.33198: Flags [P.], seq 110331:115827, ack 902, win 65535, length 5496
21:50:33.104765 IP 18.216.114.70.443 > 10.0.2.15.33198: Flags [P.], seq 115827:118575, ack 902, win 65535, length 2748
21:50:33.104766 IP 18.216.114.70.443 > 10.0.2.15.33198: Flags [P.], seq 118575:121323, ack 902, win 65535, length 2748
21:50:33.104793 IP 10.0.2.15.33198 > 18.216.114.70.443: Flags [.], ack 115827, win 65535, length 0
21:50:33.104827 IP 10.0.2.15.33198 > 18.216.114.70.443: Flags [.], ack 118575, win 65535, length 0
21:50:33.104842 IP 10.0.2.15.33198 > 18.216.114.70.443: Flags [.], ack 121323, win 65535, length 0
21:50:33.105720 IP 18.216.114.70.443 > 10.0.2.15.33198: Flags [P.], seq 121323:122697, ack 902, win 65535, length 1374
21:50:33.105735 IP 10.0.2.15.33198 > 18.216.114.70.443: Flags [.], ack 122697, win 65535, length 0
21:50:33.106306 IP 18.216.114.70.443 > 10.0.2.15.33198: Flags [P.], seq 122697:128193, ack 902, win 65535, length 5496
21:50:33.106318 IP 10.0.2.15.33198 > 18.216.114.70.443: Flags [.], ack 128193, win 65535, length 0
21:50:33.106602 IP 18.216.114.70.443 > 10.0.2.15.33198: Flags [P.], seq 128193:133689, ack 902, win 65535, length 5496
21:50:33.106603 IP 18.216.114.70.443 > 10.0.2.15.33198: Flags [.], seq 133689:135149, ack 902, win 65535, length 1460
21:50:33.106614 IP 10.0.2.15.33198 > 18.216.114.70.443: Flags [.], ack 133689, win 65535, length 0
21:50:33.106630 IP 10.0.2.15.33198 > 18.216.114.70.443: Flags [.], ack 135149, win 65535, length 0
21:50:33.106989 IP 18.216.114.70.443 > 10.0.2.15.33198: Flags [P.], seq 135149:136437, ack 902, win 65535, length 1288
21:50:33.106991 IP 18.216.114.70.443 > 10.0.2.15.33198: Flags [P.], seq 136437:139185, ack 902, win 65535, length 2748
21:50:33.107003 IP 10.0.2.15.33198 > 18.216.114.70.443: Flags [.], ack 136437, win 65535, length 0
21:50:33.107022 IP 10.0.2.15.33198 > 18.216.114.70.443: Flags [.], ack 139185, win 65535, length 0
21:50:33.110743 IP 18.216.114.70.443 > 10.0.2.15.33198: Flags [P.], seq 139185:173535, ack 902, win 65535, length 34350
21:50:33.110769 IP 10.0.2.15.33198 > 18.216.114.70.443: Flags [.], ack 173535, win 65535, length 0
21:50:33.111344 IP 18.216.114.70.443 > 10.0.2.15.33198: Flags [.], seq 173535:186675, ack 902, win 65535, length 13140
21:50:33.111364 IP 10.0.2.15.33198 > 18.216.114.70.443: Flags [.], ack 186675, win 65535, length 0
21:50:33.111510 IP 18.216.114.70.443 > 10.0.2.15.33198: Flags [P.], seq 186675:196893, ack 902, win 65535, length 10218
21:50:33.111512 IP 18.216.114.70.443 > 10.0.2.15.33198: Flags [P.], seq 196893:198267, ack 902, win 65535, length 1374
21:50:33.111529 IP 18.216.114.70.443 > 10.0.2.15.33198: Flags [P.], seq 198267:202389, ack 902, win 65535, length 4122
21:50:33.111547 IP 10.0.2.15.33198 > 18.216.114.70.443: Flags [.], ack 202389, win 65535, length 0
21:50:33.119121 IP 18.216.114.70.443 > 10.0.2.15.33198: Flags [P.], seq 202389:216129, ack 902, win 65535, length 13740
21:50:33.119170 IP 10.0.2.15.33198 > 18.216.114.70.443: Flags [.], ack 216129, win 65535, length 0
21:50:33.119244 IP 18.216.114.70.443 > 10.0.2.15.33198: Flags [P.], seq 216129:218877, ack 902, win 65535, length 2748
21:50:33.119255 IP 10.0.2.15.33198 > 18.216.114.70.443: Flags [.], ack 218877, win 65535, length 0
21:50:33.121253 IP 18.216.114.70.443 > 10.0.2.15.33198: Flags [P.], seq 218877:227121, ack 902, win 65535, length 8244
21:50:33.121392 IP 10.0.2.15.33198 > 18.216.114.70.443: Flags [.], ack 227121, win 65535, length 0
21:50:33.207626 IP 18.216.114.70.443 > 10.0.2.15.33198: Flags [P.], seq 227121:235365, ack 902, win 65535, length 8244
21:50:33.207629 IP 18.216.114.70.443 > 10.0.2.15.33198: Flags [P.], seq 235365:239487, ack 902, win 65535, length 4122
21:50:33.207687 IP 10.0.2.15.33198 > 18.216.114.70.443: Flags [.], ack 235365, win 65535, length 0
21:50:33.207722 IP 10.0.2.15.33198 > 18.216.114.70.443: Flags [.], ack 239487, win 65535, length 0
21:50:33.207748 IP 18.216.114.70.443 > 10.0.2.15.33198: Flags [P.], seq 239487:246357, ack 902, win 65535, length 6870
21:50:33.207757 IP 10.0.2.15.33198 > 18.216.114.70.443: Flags [.], ack 246357, win 65535, length 0
21:50:33.208328 IP 18.216.114.70.443 > 10.0.2.15.33198: Flags [P.], seq 246357:250479, ack 902, win 65535, length 4122
21:50:33.208331 IP 18.216.114.70.443 > 10.0.2.15.33198: Flags [P.], seq 250479:254601, ack 902, win 65535, length 4122
21:50:33.208549 IP 10.0.2.15.33198 > 18.216.114.70.443: Flags [.], ack 250479, win 65535, length 0
21:50:33.208576 IP 10.0.2.15.33198 > 18.216.114.70.443: Flags [.], ack 254601, win 65535, length 0
21:50:33.209361 IP 18.216.114.70.443 > 10.0.2.15.33198: Flags [P.], seq 254601:258723, ack 902, win 65535, length 4122
21:50:33.209364 IP 18.216.114.70.443 > 10.0.2.15.33198: Flags [P.], seq 258723:264219, ack 902, win 65535, length 5496
21:50:33.209365 IP 18.216.114.70.443 > 10.0.2.15.33198: Flags [P.], seq 264219:269715, ack 902, win 65535, length 5496
21:50:33.209385 IP 10.0.2.15.33198 > 18.216.114.70.443: Flags [.], ack 258723, win 65535, length 0
21:50:33.209413 IP 10.0.2.15.33198 > 18.216.114.70.443: Flags [.], ack 264219, win 65535, length 0
21:50:33.209429 IP 10.0.2.15.33198 > 18.216.114.70.443: Flags [.], ack 269715, win 65535, length 0
21:50:33.209460 IP 18.216.114.70.443 > 10.0.2.15.33198: Flags [P.], seq 269715:272463, ack 902, win 65535, length 2748
21:50:33.209461 IP 18.216.114.70.443 > 10.0.2.15.33198: Flags [P.], seq 272463:273837, ack 902, win 65535, length 1374
21:50:33.209470 IP 10.0.2.15.33198 > 18.216.114.70.443: Flags [.], ack 272463, win 65535, length 0
21:50:33.209488 IP 10.0.2.15.33198 > 18.216.114.70.443: Flags [.], ack 273837, win 65535, length 0
21:50:33.209898 IP 18.216.114.70.443 > 10.0.2.15.33198: Flags [P.], seq 273837:279333, ack 902, win 65535, length 5496
21:50:33.209914 IP 10.0.2.15.33198 > 18.216.114.70.443: Flags [.], ack 279333, win 65535, length 0
21:50:33.211114 IP 18.216.114.70.443 > 10.0.2.15.33198: Flags [P.], seq 279333:284829, ack 902, win 65535, length 5496
21:50:33.211117 IP 18.216.114.70.443 > 10.0.2.15.33198: Flags [P.], seq 284829:290325, ack 902, win 65535, length 5496
21:50:33.211142 IP 10.0.2.15.33198 > 18.216.114.70.443: Flags [.], ack 284829, win 65535, length 0
21:50:33.211281 IP 10.0.2.15.33198 > 18.216.114.70.443: Flags [.], ack 290325, win 65535, length 0
21:50:33.211736 IP 18.216.114.70.443 > 10.0.2.15.33198: Flags [P.], seq 290325:295821, ack 902, win 65535, length 5496
21:50:33.211738 IP 18.216.114.70.443 > 10.0.2.15.33198: Flags [P.], seq 295821:299943, ack 902, win 65535, length 4122
21:50:33.211740 IP 18.216.114.70.443 > 10.0.2.15.33198: Flags [P.], seq 299943:306813, ack 902, win 65535, length 6870
21:50:33.211765 IP 10.0.2.15.33198 > 18.216.114.70.443: Flags [.], ack 295821, win 65535, length 0
21:50:33.212157 IP 10.0.2.15.33198 > 18.216.114.70.443: Flags [.], ack 299943, win 65535, length 0
21:50:33.212298 IP 10.0.2.15.33198 > 18.216.114.70.443: Flags [.], ack 306813, win 65535, length 0
21:50:33.212523 IP 18.216.114.70.443 > 10.0.2.15.33198: Flags [P.], seq 306813:308187, ack 902, win 65535, length 1374
21:50:33.212525 IP 18.216.114.70.443 > 10.0.2.15.33198: Flags [P.], seq 308187:313683, ack 902, win 65535, length 5496
21:50:33.212527 IP 18.216.114.70.443 > 10.0.2.15.33198: Flags [P.], seq 313683:317805, ack 902, win 65535, length 4122
21:50:33.212542 IP 10.0.2.15.33198 > 18.216.114.70.443: Flags [.], ack 308187, win 65535, length 0
21:50:33.212560 IP 10.0.2.15.33198 > 18.216.114.70.443: Flags [.], ack 313683, win 65535, length 0
21:50:33.212662 IP 10.0.2.15.33198 > 18.216.114.70.443: Flags [.], ack 317805, win 65535, length 0
21:50:33.215392 IP 18.216.114.70.443 > 10.0.2.15.33198: Flags [P.], seq 317805:323301, ack 902, win 65535, length 5496
21:50:33.215395 IP 18.216.114.70.443 > 10.0.2.15.33198: Flags [P.], seq 323301:328797, ack 902, win 65535, length 5496
21:50:33.215418 IP 10.0.2.15.33198 > 18.216.114.70.443: Flags [.], ack 323301, win 65535, length 0
21:50:33.215438 IP 10.0.2.15.33198 > 18.216.114.70.443: Flags [.], ack 328797, win 65535, length 0
21:50:33.215481 IP 18.216.114.70.443 > 10.0.2.15.33198: Flags [P.], seq 328797:334293, ack 902, win 65535, length 5496
21:50:33.215485 IP 18.216.114.70.443 > 10.0.2.15.33198: Flags [P.], seq 334293:357651, ack 902, win 65535, length 23358
21:50:33.215493 IP 10.0.2.15.33198 > 18.216.114.70.443: Flags [.], ack 334293, win 65535, length 0
21:50:33.215507 IP 10.0.2.15.33198 > 18.216.114.70.443: Flags [.], ack 357651, win 65535, length 0
21:50:33.216078 IP 18.216.114.70.443 > 10.0.2.15.33198: Flags [P.], seq 357651:378261, ack 902, win 65535, length 20610
21:50:33.216095 IP 10.0.2.15.33198 > 18.216.114.70.443: Flags [.], ack 378261, win 65535, length 0
21:50:33.216131 IP 18.216.114.70.443 > 10.0.2.15.33198: Flags [P.], seq 378261:382383, ack 902, win 65535, length 4122
21:50:33.216131 IP 18.216.114.70.443 > 10.0.2.15.33198: Flags [P.], seq 382383:383757, ack 902, win 65535, length 1374
21:50:33.216132 IP 18.216.114.70.443 > 10.0.2.15.33198: Flags [P.], seq 383757:387879, ack 902, win 65535, length 4122
21:50:33.216133 IP 18.216.114.70.443 > 10.0.2.15.33198: Flags [P.], seq 387879:392001, ack 902, win 65535, length 4122
21:50:33.216589 IP 18.216.114.70.443 > 10.0.2.15.33198: Flags [P.], seq 392001:400245, ack 902, win 65535, length 8244
21:50:33.216733 IP 18.216.114.70.443 > 10.0.2.15.33198: Flags [P.], seq 400245:401619, ack 902, win 65535, length 1374
21:50:33.217033 IP 18.216.114.70.443 > 10.0.2.15.33198: Flags [P.], seq 401619:405741, ack 902, win 65535, length 4122
21:50:33.217034 IP 18.216.114.70.443 > 10.0.2.15.33198: Flags [P.], seq 405741:407115, ack 902, win 65535, length 1374
21:50:33.217144 IP 18.216.114.70.443 > 10.0.2.15.33198: Flags [P.], seq 407115:411237, ack 902, win 65535, length 4122
21:50:33.217647 IP 10.0.2.15.33198 > 18.216.114.70.443: Flags [.], ack 411237, win 65535, length 0
21:50:33.218015 IP 18.216.114.70.443 > 10.0.2.15.33198: Flags [P.], seq 411237:424977, ack 902, win 65535, length 13740
21:50:33.218152 IP 18.216.114.70.443 > 10.0.2.15.33198: Flags [P.], seq 424977:426351, ack 902, win 65535, length 1374
21:50:33.218329 IP 10.0.2.15.33198 > 18.216.114.70.443: Flags [.], ack 426351, win 65535, length 0
21:50:33.218367 IP 18.216.114.70.443 > 10.0.2.15.33198: Flags [P.], seq 426351:431847, ack 902, win 65535, length 5496
21:50:33.218369 IP 18.216.114.70.443 > 10.0.2.15.33198: Flags [P.], seq 431847:435969, ack 902, win 65535, length 4122
21:50:33.218429 IP 10.0.2.15.33198 > 18.216.114.70.443: Flags [.], ack 435969, win 65535, length 0
21:50:33.220538 IP 18.216.114.70.443 > 10.0.2.15.33198: Flags [P.], seq 435969:442839, ack 902, win 65535, length 6870
21:50:33.220541 IP 18.216.114.70.443 > 10.0.2.15.33198: Flags [P.], seq 442839:446961, ack 902, win 65535, length 4122
21:50:33.220566 IP 10.0.2.15.33198 > 18.216.114.70.443: Flags [.], ack 442839, win 65535, length 0
21:50:33.220730 IP 10.0.2.15.33198 > 18.216.114.70.443: Flags [.], ack 446961, win 65535, length 0
21:50:33.220933 IP 18.216.114.70.443 > 10.0.2.15.33198: Flags [P.], seq 446961:451083, ack 902, win 65535, length 4122
21:50:33.220935 IP 18.216.114.70.443 > 10.0.2.15.33198: Flags [.], seq 451083:452543, ack 902, win 65535, length 1460
21:50:33.220952 IP 10.0.2.15.33198 > 18.216.114.70.443: Flags [.], ack 451083, win 65535, length 0
21:50:33.221170 IP 10.0.2.15.33198 > 18.216.114.70.443: Flags [.], ack 452543, win 65535, length 0
21:50:33.222147 IP 18.216.114.70.443 > 10.0.2.15.33198: Flags [P.], seq 452543:457953, ack 902, win 65535, length 5410
21:50:33.222207 IP 10.0.2.15.33198 > 18.216.114.70.443: Flags [.], ack 457953, win 65535, length 0
21:50:33.241163 IP 18.216.114.70.443 > 10.0.2.15.33198: Flags [P.], seq 457953:474441, ack 902, win 65535, length 16488
21:50:33.241185 IP 10.0.2.15.33198 > 18.216.114.70.443: Flags [.], ack 474441, win 65535, length 0
21:50:33.241438 IP 18.216.114.70.443 > 10.0.2.15.33198: Flags [P.], seq 474441:479937, ack 902, win 65535, length 5496
21:50:33.241441 IP 18.216.114.70.443 > 10.0.2.15.33198: Flags [P.], seq 479937:485433, ack 902, win 65535, length 5496
21:50:33.241455 IP 10.0.2.15.33198 > 18.216.114.70.443: Flags [.], ack 479937, win 65535, length 0
21:50:33.241541 IP 18.216.114.70.443 > 10.0.2.15.33198: Flags [P.], seq 485433:489555, ack 902, win 65535, length 4122
21:50:33.241728 IP 18.216.114.70.443 > 10.0.2.15.33198: Flags [P.], seq 489555:493677, ack 902, win 65535, length 4122
21:50:33.241792 IP 10.0.2.15.33198 > 18.216.114.70.443: Flags [.], ack 493677, win 65535, length 0

