21:45:16.681769 IP 10.0.2.15.53155 > 140.233.253.2.53: 28794+ A? www.indeed.com. (32)
21:45:16.681810 IP 10.0.2.15.53155 > 140.233.253.2.53: 61814+ AAAA? www.indeed.com. (32)
21:45:16.687213 IP 140.233.253.2.53 > 10.0.2.15.53155: 61814 1/1/0 CNAME us.dyn.indeed.com. (118)
21:45:16.687215 IP 140.233.253.2.53 > 10.0.2.15.53155: 28794 2/0/0 CNAME us.dyn.indeed.com., A 169.45.207.200 (69)
21:45:16.687502 IP 10.0.2.15.36524 > 169.45.207.200.443: Flags [S], seq 2768406997, win 64240, options [mss 1460,sackOK,TS val 4229351933 ecr 0,nop,wscale 6], length 0
21:45:16.705162 IP 169.45.207.200.443 > 10.0.2.15.36524: Flags [S.], seq 266752001, ack 2768406998, win 65535, options [mss 1460], length 0
21:45:16.705204 IP 10.0.2.15.36524 > 169.45.207.200.443: Flags [.], ack 1, win 64240, length 0
21:45:16.719787 IP 10.0.2.15.36524 > 169.45.207.200.443: Flags [P.], seq 1:518, ack 1, win 64240, length 517
21:45:16.720297 IP 169.45.207.200.443 > 10.0.2.15.36524: Flags [.], ack 518, win 65535, length 0
21:45:17.042654 IP 169.45.207.200.443 > 10.0.2.15.36524: Flags [.], seq 1:2921, ack 518, win 65535, length 2920
21:45:17.042683 IP 10.0.2.15.36524 > 169.45.207.200.443: Flags [.], ack 2921, win 62780, length 0
21:45:17.043005 IP 169.45.207.200.443 > 10.0.2.15.36524: Flags [P.], seq 2921:4375, ack 518, win 65535, length 1454
21:45:17.043025 IP 10.0.2.15.36524 > 169.45.207.200.443: Flags [.], ack 4375, win 61326, length 0
21:45:17.046616 IP 10.0.2.15.36524 > 169.45.207.200.443: Flags [P.], seq 518:644, ack 4375, win 62780, length 126
21:45:17.047052 IP 169.45.207.200.443 > 10.0.2.15.36524: Flags [.], ack 644, win 65535, length 0
21:45:17.069807 IP 169.45.207.200.443 > 10.0.2.15.36524: Flags [P.], seq 4375:4495, ack 644, win 65535, length 120
21:45:17.069841 IP 10.0.2.15.36524 > 169.45.207.200.443: Flags [.], ack 4495, win 62780, length 0
21:45:17.071076 IP 10.0.2.15.36524 > 169.45.207.200.443: Flags [P.], seq 644:697, ack 4495, win 62780, length 53
21:45:17.071629 IP 169.45.207.200.443 > 10.0.2.15.36524: Flags [.], ack 697, win 65535, length 0
21:45:17.071926 IP 10.0.2.15.36524 > 169.45.207.200.443: Flags [P.], seq 697:753, ack 4495, win 62780, length 56
21:45:17.072121 IP 10.0.2.15.36524 > 169.45.207.200.443: Flags [P.], seq 753:864, ack 4495, win 62780, length 111
21:45:17.072241 IP 169.45.207.200.443 > 10.0.2.15.36524: Flags [.], ack 753, win 65535, length 0
21:45:17.072440 IP 169.45.207.200.443 > 10.0.2.15.36524: Flags [.], ack 864, win 65535, length 0
21:45:17.072632 IP 10.0.2.15.36524 > 169.45.207.200.443: Flags [P.], seq 864:902, ack 4495, win 62780, length 38
21:45:17.072936 IP 169.45.207.200.443 > 10.0.2.15.36524: Flags [.], ack 902, win 65535, length 0
21:45:17.126151 IP 169.45.207.200.443 > 10.0.2.15.36524: Flags [P.], seq 4495:4533, ack 902, win 65535, length 38
21:45:17.126172 IP 10.0.2.15.36524 > 169.45.207.200.443: Flags [.], ack 4533, win 62780, length 0
21:45:17.143234 IP 169.45.207.200.443 > 10.0.2.15.36524: Flags [P.], seq 4533:12777, ack 902, win 65535, length 8244
21:45:17.143268 IP 10.0.2.15.36524 > 169.45.207.200.443: Flags [.], ack 12777, win 58400, length 0
21:45:17.143617 IP 169.45.207.200.443 > 10.0.2.15.36524: Flags [P.], seq 12777:15525, ack 902, win 65535, length 2748
21:45:17.143652 IP 10.0.2.15.36524 > 169.45.207.200.443: Flags [.], ack 15525, win 61320, length 0
21:45:17.144132 IP 169.45.207.200.443 > 10.0.2.15.36524: Flags [P.], seq 15525:18273, ack 902, win 65535, length 2748
21:45:17.144148 IP 10.0.2.15.36524 > 169.45.207.200.443: Flags [.], ack 18273, win 62780, length 0
21:45:17.159777 IP 169.45.207.200.443 > 10.0.2.15.36524: Flags [P.], seq 18273:30639, ack 902, win 65535, length 12366
21:45:17.159813 IP 10.0.2.15.36524 > 169.45.207.200.443: Flags [.], ack 30639, win 55480, length 0
21:45:17.160161 IP 169.45.207.200.443 > 10.0.2.15.36524: Flags [P.], seq 30639:40257, ack 902, win 65535, length 9618
21:45:17.160176 IP 10.0.2.15.36524 > 169.45.207.200.443: Flags [.], ack 40257, win 49640, length 0
21:45:17.161631 IP 169.45.207.200.443 > 10.0.2.15.36524: Flags [P.], seq 40257:45753, ack 902, win 65535, length 5496
21:45:17.161646 IP 10.0.2.15.36524 > 169.45.207.200.443: Flags [.], ack 45753, win 61320, length 0
21:45:17.177659 IP 169.45.207.200.443 > 10.0.2.15.36524: Flags [P.], seq 45753:59493, ack 902, win 65535, length 13740
21:45:17.177687 IP 10.0.2.15.36524 > 169.45.207.200.443: Flags [.], ack 59493, win 55480, length 0
21:45:17.177747 IP 169.45.207.200.443 > 10.0.2.15.36524: Flags [.], seq 59493:62413, ack 902, win 65535, length 2920
21:45:17.178128 IP 169.45.207.200.443 > 10.0.2.15.36524: Flags [P.], seq 62413:70485, ack 902, win 65535, length 8072
21:45:17.178323 IP 10.0.2.15.36524 > 169.45.207.200.443: Flags [.], ack 70485, win 62780, length 0
21:45:17.179226 IP 169.45.207.200.443 > 10.0.2.15.36524: Flags [P.], seq 70485:78729, ack 902, win 65535, length 8244
21:45:17.179229 IP 169.45.207.200.443 > 10.0.2.15.36524: Flags [P.], seq 78729:85599, ack 902, win 65535, length 6870
21:45:17.179254 IP 10.0.2.15.36524 > 169.45.207.200.443: Flags [.], ack 78729, win 65535, length 0
21:45:17.179390 IP 10.0.2.15.36524 > 169.45.207.200.443: Flags [.], ack 85599, win 65535, length 0
21:45:17.179437 IP 169.45.207.200.443 > 10.0.2.15.36524: Flags [P.], seq 85599:88347, ack 902, win 65535, length 2748
21:45:17.179438 IP 169.45.207.200.443 > 10.0.2.15.36524: Flags [.], seq 88347:89807, ack 902, win 65535, length 1460
21:45:17.179448 IP 10.0.2.15.36524 > 169.45.207.200.443: Flags [.], ack 88347, win 65535, length 0
21:45:17.179470 IP 10.0.2.15.36524 > 169.45.207.200.443: Flags [.], ack 89807, win 65535, length 0
21:45:17.179744 IP 169.45.207.200.443 > 10.0.2.15.36524: Flags [P.], seq 89807:92469, ack 902, win 65535, length 2662
21:45:17.179756 IP 10.0.2.15.36524 > 169.45.207.200.443: Flags [.], ack 92469, win 65535, length 0
21:45:17.180990 IP 169.45.207.200.443 > 10.0.2.15.36524: Flags [P.], seq 92469:100713, ack 902, win 65535, length 8244
21:45:17.181015 IP 10.0.2.15.36524 > 169.45.207.200.443: Flags [.], ack 100713, win 65535, length 0
21:45:17.191475 IP 169.45.207.200.443 > 10.0.2.15.36524: Flags [P.], seq 100713:108957, ack 902, win 65535, length 8244
21:45:17.191477 IP 169.45.207.200.443 > 10.0.2.15.36524: Flags [P.], seq 108957:111705, ack 902, win 65535, length 2748
21:45:17.191503 IP 10.0.2.15.36524 > 169.45.207.200.443: Flags [.], ack 108957, win 65535, length 0
21:45:17.191541 IP 10.0.2.15.36524 > 169.45.207.200.443: Flags [.], ack 111705, win 65535, length 0
21:45:17.191612 IP 169.45.207.200.443 > 10.0.2.15.36524: Flags [P.], seq 111705:113079, ack 902, win 65535, length 1374
21:45:17.191620 IP 10.0.2.15.36524 > 169.45.207.200.443: Flags [.], ack 113079, win 65535, length 0
21:45:17.192146 IP 169.45.207.200.443 > 10.0.2.15.36524: Flags [P.], seq 113079:118575, ack 902, win 65535, length 5496
21:45:17.192149 IP 169.45.207.200.443 > 10.0.2.15.36524: Flags [P.], seq 118575:124071, ack 902, win 65535, length 5496
21:45:17.192169 IP 10.0.2.15.36524 > 169.45.207.200.443: Flags [.], ack 118575, win 65535, length 0
21:45:17.192194 IP 10.0.2.15.36524 > 169.45.207.200.443: Flags [.], ack 124071, win 65535, length 0
21:45:17.192216 IP 169.45.207.200.443 > 10.0.2.15.36524: Flags [P.], seq 124071:125445, ack 902, win 65535, length 1374
21:45:17.192220 IP 10.0.2.15.36524 > 169.45.207.200.443: Flags [.], ack 125445, win 65535, length 0
21:45:17.193619 IP 169.45.207.200.443 > 10.0.2.15.36524: Flags [P.], seq 125445:132315, ack 902, win 65535, length 6870
21:45:17.193622 IP 169.45.207.200.443 > 10.0.2.15.36524: Flags [P.], seq 132315:135063, ack 902, win 65535, length 2748
21:45:17.193646 IP 10.0.2.15.36524 > 169.45.207.200.443: Flags [.], ack 132315, win 65535, length 0
21:45:17.193682 IP 10.0.2.15.36524 > 169.45.207.200.443: Flags [.], ack 135063, win 65535, length 0
21:45:17.193852 IP 169.45.207.200.443 > 10.0.2.15.36524: Flags [P.], seq 135063:137811, ack 902, win 65535, length 2748
21:45:17.193862 IP 10.0.2.15.36524 > 169.45.207.200.443: Flags [.], ack 137811, win 65535, length 0
21:45:17.194021 IP 169.45.207.200.443 > 10.0.2.15.36524: Flags [P.], seq 137811:143307, ack 902, win 65535, length 5496
21:45:17.194031 IP 10.0.2.15.36524 > 169.45.207.200.443: Flags [.], ack 143307, win 65535, length 0
21:45:17.194868 IP 169.45.207.200.443 > 10.0.2.15.36524: Flags [P.], seq 143307:150177, ack 902, win 65535, length 6870
21:45:17.194939 IP 10.0.2.15.36524 > 169.45.207.200.443: Flags [.], ack 150177, win 65535, length 0
21:45:17.195227 IP 169.45.207.200.443 > 10.0.2.15.36524: Flags [P.], seq 150177:152925, ack 902, win 65535, length 2748
21:45:17.195329 IP 169.45.207.200.443 > 10.0.2.15.36524: Flags [P.], seq 152925:155673, ack 902, win 65535, length 2748
21:45:17.195346 IP 10.0.2.15.36524 > 169.45.207.200.443: Flags [.], ack 152925, win 65535, length 0
21:45:17.195465 IP 10.0.2.15.36524 > 169.45.207.200.443: Flags [.], ack 155673, win 65535, length 0
21:45:17.195915 IP 169.45.207.200.443 > 10.0.2.15.36524: Flags [P.], seq 155673:162543, ack 902, win 65535, length 6870
21:45:17.195917 IP 169.45.207.200.443 > 10.0.2.15.36524: Flags [P.], seq 162543:166665, ack 902, win 65535, length 4122
21:45:17.196061 IP 10.0.2.15.36524 > 169.45.207.200.443: Flags [.], ack 162543, win 65535, length 0
21:45:17.196305 IP 10.0.2.15.36524 > 169.45.207.200.443: Flags [.], ack 166665, win 65535, length 0
21:45:17.196372 IP 169.45.207.200.443 > 10.0.2.15.36524: Flags [P.], seq 166665:170787, ack 902, win 65535, length 4122
21:45:17.196374 IP 169.45.207.200.443 > 10.0.2.15.36524: Flags [P.], seq 170787:172161, ack 902, win 65535, length 1374
21:45:17.196375 IP 169.45.207.200.443 > 10.0.2.15.36524: Flags [P.], seq 172161:174909, ack 902, win 65535, length 2748
21:45:17.196376 IP 169.45.207.200.443 > 10.0.2.15.36524: Flags [.], seq 174909:176369, ack 902, win 65535, length 1460
21:45:17.196392 IP 10.0.2.15.36524 > 169.45.207.200.443: Flags [.], ack 170787, win 65535, length 0
21:45:17.196415 IP 10.0.2.15.36524 > 169.45.207.200.443: Flags [.], ack 172161, win 65535, length 0
21:45:17.196480 IP 10.0.2.15.36524 > 169.45.207.200.443: Flags [.], ack 174909, win 65535, length 0
21:45:17.196490 IP 10.0.2.15.36524 > 169.45.207.200.443: Flags [.], ack 176369, win 65535, length 0
21:45:17.196742 IP 169.45.207.200.443 > 10.0.2.15.36524: Flags [P.], seq 176369:179031, ack 902, win 65535, length 2662
21:45:17.196749 IP 10.0.2.15.36524 > 169.45.207.200.443: Flags [.], ack 179031, win 65535, length 0
21:45:17.197927 IP 169.45.207.200.443 > 10.0.2.15.36524: Flags [P.], seq 179031:185901, ack 902, win 65535, length 6870
21:45:17.197952 IP 10.0.2.15.36524 > 169.45.207.200.443: Flags [.], ack 185901, win 65535, length 0
21:45:17.198384 IP 169.45.207.200.443 > 10.0.2.15.36524: Flags [P.], seq 185901:191397, ack 902, win 65535, length 5496
21:45:17.198386 IP 169.45.207.200.443 > 10.0.2.15.36524: Flags [P.], seq 191397:194145, ack 902, win 65535, length 2748
21:45:17.198407 IP 10.0.2.15.36524 > 169.45.207.200.443: Flags [.], ack 191397, win 65535, length 0
21:45:17.198435 IP 10.0.2.15.36524 > 169.45.207.200.443: Flags [.], ack 194145, win 65535, length 0
21:45:17.198762 IP 169.45.207.200.443 > 10.0.2.15.36524: Flags [P.], seq 194145:199641, ack 902, win 65535, length 5496
21:45:17.198765 IP 169.45.207.200.443 > 10.0.2.15.36524: Flags [P.], seq 199641:203763, ack 902, win 65535, length 4122
21:45:17.198766 IP 169.45.207.200.443 > 10.0.2.15.36524: Flags [P.], seq 203763:206511, ack 902, win 65535, length 2748
21:45:17.198783 IP 10.0.2.15.36524 > 169.45.207.200.443: Flags [.], ack 199641, win 65535, length 0
21:45:17.198811 IP 10.0.2.15.36524 > 169.45.207.200.443: Flags [.], ack 203763, win 65535, length 0
21:45:17.198826 IP 10.0.2.15.36524 > 169.45.207.200.443: Flags [.], ack 206511, win 65535, length 0
21:45:17.208209 IP 169.45.207.200.443 > 10.0.2.15.36524: Flags [P.], seq 206511:217503, ack 902, win 65535, length 10992
21:45:17.208235 IP 10.0.2.15.36524 > 169.45.207.200.443: Flags [.], ack 217503, win 65535, length 0
21:45:17.208316 IP 169.45.207.200.443 > 10.0.2.15.36524: Flags [P.], seq 217503:225747, ack 902, win 65535, length 8244
21:45:17.208462 IP 10.0.2.15.36524 > 169.45.207.200.443: Flags [.], ack 225747, win 65535, length 0
21:45:17.209172 IP 169.45.207.200.443 > 10.0.2.15.36524: Flags [P.], seq 225747:228495, ack 902, win 65535, length 2748
21:45:17.209237 IP 169.45.207.200.443 > 10.0.2.15.36524: Flags [P.], seq 228495:235365, ack 902, win 65535, length 6870
21:45:17.209240 IP 169.45.207.200.443 > 10.0.2.15.36524: Flags [P.], seq 235365:239487, ack 902, win 65535, length 4122
21:45:17.209260 IP 10.0.2.15.36524 > 169.45.207.200.443: Flags [.], ack 228495, win 65535, length 0
21:45:17.209301 IP 10.0.2.15.36524 > 169.45.207.200.443: Flags [.], ack 235365, win 65535, length 0
21:45:17.209322 IP 10.0.2.15.36524 > 169.45.207.200.443: Flags [.], ack 239487, win 65535, length 0
21:45:17.210181 IP 169.45.207.200.443 > 10.0.2.15.36524: Flags [P.], seq 239487:240861, ack 902, win 65535, length 1374
21:45:17.210273 IP 169.45.207.200.443 > 10.0.2.15.36524: Flags [P.], seq 240861:243609, ack 902, win 65535, length 2748
21:45:17.210287 IP 169.45.207.200.443 > 10.0.2.15.36524: Flags [P.], seq 243609:247731, ack 902, win 65535, length 4122
21:45:17.210289 IP 169.45.207.200.443 > 10.0.2.15.36524: Flags [P.], seq 247731:251853, ack 902, win 65535, length 4122
21:45:17.210308 IP 10.0.2.15.36524 > 169.45.207.200.443: Flags [.], ack 240861, win 65535, length 0
21:45:17.210425 IP 10.0.2.15.36524 > 169.45.207.200.443: Flags [.], ack 243609, win 65535, length 0
21:45:17.210656 IP 10.0.2.15.36524 > 169.45.207.200.443: Flags [.], ack 247731, win 65535, length 0
21:45:17.210758 IP 10.0.2.15.36524 > 169.45.207.200.443: Flags [.], ack 251853, win 65535, length 0
21:45:17.210778 IP 169.45.207.200.443 > 10.0.2.15.36524: Flags [P.], seq 251853:253227, ack 902, win 65535, length 1374
21:45:17.210780 IP 169.45.207.200.443 > 10.0.2.15.36524: Flags [P.], seq 253227:258723, ack 902, win 65535, length 5496
21:45:17.210781 IP 169.45.207.200.443 > 10.0.2.15.36524: Flags [P.], seq 258723:264219, ack 902, win 65535, length 5496
21:45:17.210787 IP 10.0.2.15.36524 > 169.45.207.200.443: Flags [.], ack 253227, win 65535, length 0
21:45:17.210864 IP 10.0.2.15.36524 > 169.45.207.200.443: Flags [.], ack 258723, win 65535, length 0
21:45:17.210928 IP 10.0.2.15.36524 > 169.45.207.200.443: Flags [.], ack 264219, win 65535, length 0
21:45:17.211009 IP 169.45.207.200.443 > 10.0.2.15.36524: Flags [P.], seq 264219:265593, ack 902, win 65535, length 1374
21:45:17.211011 IP 169.45.207.200.443 > 10.0.2.15.36524: Flags [P.], seq 265593:271089, ack 902, win 65535, length 5496
21:45:17.211021 IP 10.0.2.15.36524 > 169.45.207.200.443: Flags [.], ack 265593, win 65535, length 0
21:45:17.211148 IP 10.0.2.15.36524 > 169.45.207.200.443: Flags [.], ack 271089, win 65535, length 0
21:45:17.212286 IP 169.45.207.200.443 > 10.0.2.15.36524: Flags [P.], seq 271089:272463, ack 902, win 65535, length 1374
21:45:17.212289 IP 169.45.207.200.443 > 10.0.2.15.36524: Flags [P.], seq 272463:279333, ack 902, win 65535, length 6870
21:45:17.212291 IP 169.45.207.200.443 > 10.0.2.15.36524: Flags [P.], seq 279333:283455, ack 902, win 65535, length 4122
21:45:17.212314 IP 10.0.2.15.36524 > 169.45.207.200.443: Flags [.], ack 272463, win 65535, length 0
21:45:17.212492 IP 10.0.2.15.36524 > 169.45.207.200.443: Flags [.], ack 279333, win 65535, length 0
21:45:17.212511 IP 10.0.2.15.36524 > 169.45.207.200.443: Flags [.], ack 283455, win 65535, length 0
21:45:17.212549 IP 169.45.207.200.443 > 10.0.2.15.36524: Flags [P.], seq 283455:286203, ack 902, win 65535, length 2748
21:45:17.212550 IP 169.45.207.200.443 > 10.0.2.15.36524: Flags [P.], seq 286203:288951, ack 902, win 65535, length 2748
21:45:17.212551 IP 169.45.207.200.443 > 10.0.2.15.36524: Flags [P.], seq 288951:291699, ack 902, win 65535, length 2748
21:45:17.212552 IP 169.45.207.200.443 > 10.0.2.15.36524: Flags [P.], seq 291699:293073, ack 902, win 65535, length 1374
21:45:17.212561 IP 10.0.2.15.36524 > 169.45.207.200.443: Flags [.], ack 286203, win 65535, length 0
21:45:17.212580 IP 10.0.2.15.36524 > 169.45.207.200.443: Flags [.], ack 288951, win 65535, length 0
21:45:17.212596 IP 10.0.2.15.36524 > 169.45.207.200.443: Flags [.], ack 291699, win 65535, length 0
21:45:17.212608 IP 10.0.2.15.36524 > 169.45.207.200.443: Flags [.], ack 293073, win 65535, length 0
21:45:17.213047 IP 169.45.207.200.443 > 10.0.2.15.36524: Flags [P.], seq 293073:295821, ack 902, win 65535, length 2748
21:45:17.213068 IP 10.0.2.15.36524 > 169.45.207.200.443: Flags [.], ack 295821, win 65535, length 0
21:45:17.213285 IP 169.45.207.200.443 > 10.0.2.15.36524: Flags [P.], seq 295821:299943, ack 902, win 65535, length 4122
21:45:17.213302 IP 10.0.2.15.36524 > 169.45.207.200.443: Flags [.], ack 299943, win 65535, length 0
21:45:17.214227 IP 169.45.207.200.443 > 10.0.2.15.36524: Flags [P.], seq 299943:301289, ack 902, win 65535, length 1346
21:45:17.214244 IP 10.0.2.15.36524 > 169.45.207.200.443: Flags [.], ack 301289, win 65535, length 0
21:45:17.248339 IP 169.45.207.200.443 > 10.0.2.15.36524: Flags [P.], seq 301289:311228, ack 902, win 65535, length 9939
21:45:17.248343 IP 169.45.207.200.443 > 10.0.2.15.36524: Flags [P.], seq 311228:317050, ack 902, win 65535, length 5822
21:45:17.248581 IP 10.0.2.15.36524 > 169.45.207.200.443: Flags [.], ack 311228, win 65535, length 0
21:45:17.248615 IP 10.0.2.15.36524 > 169.45.207.200.443: Flags [.], ack 317050, win 65535, length 0
21:45:17.248640 IP 169.45.207.200.443 > 10.0.2.15.36524: Flags [P.], seq 317050:318424, ack 902, win 65535, length 1374
21:45:17.248647 IP 10.0.2.15.36524 > 169.45.207.200.443: Flags [.], ack 318424, win 65535, length 0
21:45:17.249244 IP 169.45.207.200.443 > 10.0.2.15.36524: Flags [P.], seq 318424:323224, ack 902, win 65535, length 4800
21:45:17.249263 IP 10.0.2.15.36524 > 169.45.207.200.443: Flags [.], ack 323224, win 65535, length 0
21:45:17.249789 IP 169.45.207.200.443 > 10.0.2.15.36524: Flags [P.], seq 323224:324598, ack 902, win 65535, length 1374
21:45:17.249800 IP 10.0.2.15.36524 > 169.45.207.200.443: Flags [.], ack 324598, win 65535, length 0
21:45:17.255018 IP 169.45.207.200.443 > 10.0.2.15.36524: Flags [.], seq 324598:337738, ack 902, win 65535, length 13140
21:45:17.255077 IP 10.0.2.15.36524 > 169.45.207.200.443: Flags [.], ack 337738, win 65535, length 0
21:45:17.255479 IP 169.45.207.200.443 > 10.0.2.15.36524: Flags [P.], seq 337738:383538, ack 902, win 65535, length 45800
21:45:17.255534 IP 10.0.2.15.36524 > 169.45.207.200.443: Flags [.], ack 383538, win 65535, length 0
21:45:17.256773 IP 169.45.207.200.443 > 10.0.2.15.36524: Flags [P.], seq 383538:416550, ack 902, win 65535, length 33012
21:45:17.256789 IP 10.0.2.15.36524 > 169.45.207.200.443: Flags [.], ack 416550, win 65535, length 0
21:45:17.257323 IP 169.45.207.200.443 > 10.0.2.15.36524: Flags [P.], seq 416550:441810, ack 902, win 65535, length 25260
21:45:17.257350 IP 169.45.207.200.443 > 10.0.2.15.36524: Flags [P.], seq 441810:448680, ack 902, win 65535, length 6870
21:45:17.257414 IP 10.0.2.15.36524 > 169.45.207.200.443: Flags [.], ack 448680, win 65535, length 0
21:45:17.257660 IP 169.45.207.200.443 > 10.0.2.15.36524: Flags [P.], seq 448680:452756, ack 902, win 65535, length 4076
21:45:17.257828 IP 169.45.207.200.443 > 10.0.2.15.36524: Flags [P.], seq 452756:455504, ack 902, win 65535, length 2748
21:45:17.257830 IP 169.45.207.200.443 > 10.0.2.15.36524: Flags [P.], seq 455504:457556, ack 902, win 65535, length 2052
21:45:17.257854 IP 10.0.2.15.36524 > 169.45.207.200.443: Flags [.], ack 452756, win 65535, length 0
21:45:17.257882 IP 10.0.2.15.36524 > 169.45.207.200.443: Flags [.], ack 457556, win 65535, length 0
21:45:17.257997 IP 169.45.207.200.443 > 10.0.2.15.36524: Flags [P.], seq 457556:458930, ack 902, win 65535, length 1374
21:45:17.258316 IP 10.0.2.15.36524 > 169.45.207.200.443: Flags [.], ack 458930, win 65535, length 0
21:45:17.258503 IP 169.45.207.200.443 > 10.0.2.15.36524: Flags [P.], seq 458930:466486, ack 902, win 65535, length 7556
21:45:17.258542 IP 10.0.2.15.36524 > 169.45.207.200.443: Flags [.], ack 466486, win 65535, length 0
21:45:17.258915 IP 169.45.207.200.443 > 10.0.2.15.36524: Flags [P.], seq 466486:470608, ack 902, win 65535, length 4122
21:45:17.258917 IP 169.45.207.200.443 > 10.0.2.15.36524: Flags [P.], seq 470608:473356, ack 902, win 65535, length 2748
21:45:17.258933 IP 10.0.2.15.36524 > 169.45.207.200.443: Flags [.], ack 470608, win 65535, length 0
21:45:17.259082 IP 169.45.207.200.443 > 10.0.2.15.36524: Flags [P.], seq 473356:474730, ack 902, win 65535, length 1374
21:45:17.259298 IP 10.0.2.15.36524 > 169.45.207.200.443: Flags [.], ack 474730, win 65535, length 0
21:45:17.259504 IP 169.45.207.200.443 > 10.0.2.15.36524: Flags [P.], seq 474730:477478, ack 902, win 65535, length 2748
21:45:17.259512 IP 10.0.2.15.36524 > 169.45.207.200.443: Flags [.], ack 477478, win 65535, length 0
21:45:17.267860 IP 169.45.207.200.443 > 10.0.2.15.36524: Flags [P.], seq 477478:488470, ack 902, win 65535, length 10992
21:45:17.267901 IP 169.45.207.200.443 > 10.0.2.15.36524: Flags [P.], seq 488470:489844, ack 902, win 65535, length 1374
21:45:17.268041 IP 10.0.2.15.36524 > 169.45.207.200.443: Flags [.], ack 489844, win 65535, length 0

