21:50:27.187335 IP 10.0.2.15.52994 > 140.233.253.2.53: 61238+ A? www.indeed.com. (32)
21:50:27.187363 IP 10.0.2.15.52994 > 140.233.253.2.53: 44594+ AAAA? www.indeed.com. (32)
21:50:27.195500 IP 140.233.253.2.53 > 10.0.2.15.52994: 61238 2/0/0 CNAME us.dyn.indeed.com., A 18.216.114.70 (69)
21:50:27.195502 IP 140.233.253.2.53 > 10.0.2.15.52994: 44594 1/1/0 CNAME us.dyn.indeed.com. (118)
21:50:27.195761 IP 10.0.2.15.33196 > 18.216.114.70.443: Flags [S], seq 3712738851, win 64240, options [mss 1460,sackOK,TS val 516671925 ecr 0,nop,wscale 6], length 0
21:50:27.227624 IP 18.216.114.70.443 > 10.0.2.15.33196: Flags [S.], seq 273792001, ack 3712738852, win 65535, options [mss 1460], length 0
21:50:27.227744 IP 10.0.2.15.33196 > 18.216.114.70.443: Flags [.], ack 1, win 64240, length 0
21:50:27.238186 IP 10.0.2.15.33196 > 18.216.114.70.443: Flags [P.], seq 1:518, ack 1, win 64240, length 517
21:50:27.238565 IP 18.216.114.70.443 > 10.0.2.15.33196: Flags [.], ack 518, win 65535, length 0
21:50:27.276516 IP 18.216.114.70.443 > 10.0.2.15.33196: Flags [.], seq 1:2921, ack 518, win 65535, length 2920
21:50:27.276544 IP 10.0.2.15.33196 > 18.216.114.70.443: Flags [.], ack 2921, win 62780, length 0
21:50:27.277103 IP 18.216.114.70.443 > 10.0.2.15.33196: Flags [P.], seq 2921:4375, ack 518, win 65535, length 1454
21:50:27.277124 IP 10.0.2.15.33196 > 18.216.114.70.443: Flags [.], ack 4375, win 61326, length 0
21:50:27.278492 IP 10.0.2.15.33196 > 18.216.114.70.443: Flags [P.], seq 518:644, ack 4375, win 62780, length 126
21:50:27.278875 IP 18.216.114.70.443 > 10.0.2.15.33196: Flags [.], ack 644, win 65535, length 0
21:50:27.310605 IP 18.216.114.70.443 > 10.0.2.15.33196: Flags [P.], seq 4375:4495, ack 644, win 65535, length 120
21:50:27.310630 IP 10.0.2.15.33196 > 18.216.114.70.443: Flags [.], ack 4495, win 62780, length 0
21:50:27.311093 IP 10.0.2.15.33196 > 18.216.114.70.443: Flags [P.], seq 644:697, ack 4495, win 62780, length 53
21:50:27.311129 IP 10.0.2.15.33196 > 18.216.114.70.443: Flags [P.], seq 697:753, ack 4495, win 62780, length 56
21:50:27.311320 IP 10.0.2.15.33196 > 18.216.114.70.443: Flags [P.], seq 753:902, ack 4495, win 62780, length 149
21:50:27.312081 IP 18.216.114.70.443 > 10.0.2.15.33196: Flags [.], ack 697, win 65535, length 0
21:50:27.312083 IP 18.216.114.70.443 > 10.0.2.15.33196: Flags [.], ack 753, win 65535, length 0
21:50:27.312083 IP 18.216.114.70.443 > 10.0.2.15.33196: Flags [.], ack 902, win 65535, length 0
21:50:27.341926 IP 18.216.114.70.443 > 10.0.2.15.33196: Flags [P.], seq 4495:4533, ack 902, win 65535, length 38
21:50:27.341945 IP 10.0.2.15.33196 > 18.216.114.70.443: Flags [.], ack 4533, win 62780, length 0
21:50:27.401825 IP 18.216.114.70.443 > 10.0.2.15.33196: Flags [.], seq 4533:13293, ack 902, win 65535, length 8760
21:50:27.401855 IP 10.0.2.15.33196 > 18.216.114.70.443: Flags [.], ack 13293, win 58400, length 0
21:50:27.402125 IP 18.216.114.70.443 > 10.0.2.15.33196: Flags [P.], seq 13293:16899, ack 902, win 65535, length 3606
21:50:27.402136 IP 10.0.2.15.33196 > 18.216.114.70.443: Flags [.], ack 16899, win 55480, length 0
21:50:27.403244 IP 18.216.114.70.443 > 10.0.2.15.33196: Flags [P.], seq 16899:18273, ack 902, win 65535, length 1374
21:50:27.403261 IP 10.0.2.15.33196 > 18.216.114.70.443: Flags [.], ack 18273, win 62780, length 0
21:50:27.432544 IP 18.216.114.70.443 > 10.0.2.15.33196: Flags [.], seq 18273:27033, ack 902, win 65535, length 8760
21:50:27.432738 IP 10.0.2.15.33196 > 18.216.114.70.443: Flags [.], ack 27033, win 58400, length 0
21:50:27.433265 IP 18.216.114.70.443 > 10.0.2.15.33196: Flags [P.], seq 27033:29265, ack 902, win 65535, length 2232
21:50:27.433269 IP 18.216.114.70.443 > 10.0.2.15.33196: Flags [P.], seq 29265:40257, ack 902, win 65535, length 10992
21:50:27.433290 IP 10.0.2.15.33196 > 18.216.114.70.443: Flags [.], ack 29265, win 56940, length 0
21:50:27.433329 IP 10.0.2.15.33196 > 18.216.114.70.443: Flags [.], ack 40257, win 49640, length 0
21:50:27.433351 IP 18.216.114.70.443 > 10.0.2.15.33196: Flags [P.], seq 40257:41631, ack 902, win 65535, length 1374
21:50:27.433464 IP 10.0.2.15.33196 > 18.216.114.70.443: Flags [.], ack 41631, win 48266, length 0
21:50:27.433780 IP 18.216.114.70.443 > 10.0.2.15.33196: Flags [P.], seq 41631:43005, ack 902, win 65535, length 1374
21:50:27.433793 IP 10.0.2.15.33196 > 18.216.114.70.443: Flags [.], ack 43005, win 48090, length 0
21:50:27.434175 IP 18.216.114.70.443 > 10.0.2.15.33196: Flags [.], seq 43005:44465, ack 902, win 65535, length 1460
21:50:27.434511 IP 18.216.114.70.443 > 10.0.2.15.33196: Flags [P.], seq 44465:45753, ack 902, win 65535, length 1288
21:50:27.434690 IP 10.0.2.15.33196 > 18.216.114.70.443: Flags [.], ack 45753, win 45342, length 0
21:50:27.464540 IP 18.216.114.70.443 > 10.0.2.15.33196: Flags [P.], seq 45753:51249, ack 902, win 65535, length 5496
21:50:27.464567 IP 10.0.2.15.33196 > 18.216.114.70.443: Flags [.], ack 51249, win 61320, length 0
21:50:27.465054 IP 18.216.114.70.443 > 10.0.2.15.33196: Flags [P.], seq 51249:60867, ack 902, win 65535, length 9618
21:50:27.465057 IP 18.216.114.70.443 > 10.0.2.15.33196: Flags [P.], seq 60867:64989, ack 902, win 65535, length 4122
21:50:27.465664 IP 18.216.114.70.443 > 10.0.2.15.33196: Flags [P.], seq 64989:70485, ack 902, win 65535, length 5496
21:50:27.465665 IP 18.216.114.70.443 > 10.0.2.15.33196: Flags [P.], seq 70485:71859, ack 902, win 65535, length 1374
21:50:27.465666 IP 18.216.114.70.443 > 10.0.2.15.33196: Flags [.], seq 71859:73319, ack 902, win 65535, length 1460
21:50:27.465827 IP 10.0.2.15.33196 > 18.216.114.70.443: Flags [.], ack 73319, win 62780, length 0
21:50:27.466354 IP 18.216.114.70.443 > 10.0.2.15.33196: Flags [P.], seq 73319:74607, ack 902, win 65535, length 1288
21:50:27.466358 IP 18.216.114.70.443 > 10.0.2.15.33196: Flags [P.], seq 74607:84225, ack 902, win 65535, length 9618
21:50:27.466375 IP 10.0.2.15.33196 > 18.216.114.70.443: Flags [.], ack 74607, win 65535, length 0
21:50:27.466570 IP 10.0.2.15.33196 > 18.216.114.70.443: Flags [.], ack 84225, win 65535, length 0
21:50:27.466616 IP 18.216.114.70.443 > 10.0.2.15.33196: Flags [P.], seq 84225:85599, ack 902, win 65535, length 1374
21:50:27.466618 IP 18.216.114.70.443 > 10.0.2.15.33196: Flags [P.], seq 85599:91095, ack 902, win 65535, length 5496
21:50:27.466629 IP 10.0.2.15.33196 > 18.216.114.70.443: Flags [.], ack 85599, win 65535, length 0
21:50:27.466647 IP 10.0.2.15.33196 > 18.216.114.70.443: Flags [.], ack 91095, win 65535, length 0
21:50:27.467747 IP 18.216.114.70.443 > 10.0.2.15.33196: Flags [P.], seq 91095:99339, ack 902, win 65535, length 8244
21:50:27.467763 IP 10.0.2.15.33196 > 18.216.114.70.443: Flags [.], ack 99339, win 65535, length 0
21:50:27.497220 IP 18.216.114.70.443 > 10.0.2.15.33196: Flags [P.], seq 99339:103461, ack 902, win 65535, length 4122
21:50:27.497247 IP 10.0.2.15.33196 > 18.216.114.70.443: Flags [.], ack 103461, win 65535, length 0
21:50:27.498150 IP 18.216.114.70.443 > 10.0.2.15.33196: Flags [P.], seq 103461:108957, ack 902, win 65535, length 5496
21:50:27.498173 IP 10.0.2.15.33196 > 18.216.114.70.443: Flags [.], ack 108957, win 65535, length 0
21:50:27.499047 IP 18.216.114.70.443 > 10.0.2.15.33196: Flags [P.], seq 108957:113079, ack 902, win 65535, length 4122
21:50:27.499050 IP 18.216.114.70.443 > 10.0.2.15.33196: Flags [P.], seq 113079:115827, ack 902, win 65535, length 2748
21:50:27.499052 IP 18.216.114.70.443 > 10.0.2.15.33196: Flags [P.], seq 115827:121323, ack 902, win 65535, length 5496
21:50:27.499076 IP 10.0.2.15.33196 > 18.216.114.70.443: Flags [.], ack 113079, win 65535, length 0
21:50:27.499342 IP 10.0.2.15.33196 > 18.216.114.70.443: Flags [.], ack 115827, win 65535, length 0
21:50:27.500107 IP 10.0.2.15.33196 > 18.216.114.70.443: Flags [.], ack 121323, win 65535, length 0
21:50:27.500520 IP 18.216.114.70.443 > 10.0.2.15.33196: Flags [P.], seq 121323:126819, ack 902, win 65535, length 5496
21:50:27.500523 IP 18.216.114.70.443 > 10.0.2.15.33196: Flags [P.], seq 126819:128193, ack 902, win 65535, length 1374
21:50:27.500525 IP 18.216.114.70.443 > 10.0.2.15.33196: Flags [P.], seq 128193:135063, ack 902, win 65535, length 6870
21:50:27.500850 IP 10.0.2.15.33196 > 18.216.114.70.443: Flags [.], ack 126819, win 65535, length 0
21:50:27.501324 IP 10.0.2.15.33196 > 18.216.114.70.443: Flags [.], ack 128193, win 65535, length 0
21:50:27.501359 IP 10.0.2.15.33196 > 18.216.114.70.443: Flags [.], ack 135063, win 65535, length 0
21:50:27.501402 IP 18.216.114.70.443 > 10.0.2.15.33196: Flags [P.], seq 135063:139185, ack 902, win 65535, length 4122
21:50:27.501466 IP 18.216.114.70.443 > 10.0.2.15.33196: Flags [P.], seq 139185:143307, ack 902, win 65535, length 4122
21:50:27.501481 IP 10.0.2.15.33196 > 18.216.114.70.443: Flags [.], ack 139185, win 65535, length 0
21:50:27.501499 IP 10.0.2.15.33196 > 18.216.114.70.443: Flags [.], ack 143307, win 65535, length 0
21:50:27.502199 IP 18.216.114.70.443 > 10.0.2.15.33196: Flags [P.], seq 143307:148803, ack 902, win 65535, length 5496
21:50:27.502205 IP 18.216.114.70.443 > 10.0.2.15.33196: Flags [P.], seq 148803:162543, ack 902, win 65535, length 13740
21:50:27.502231 IP 10.0.2.15.33196 > 18.216.114.70.443: Flags [.], ack 148803, win 65535, length 0
21:50:27.502310 IP 10.0.2.15.33196 > 18.216.114.70.443: Flags [.], ack 162543, win 65535, length 0
21:50:27.502378 IP 18.216.114.70.443 > 10.0.2.15.33196: Flags [P.], seq 162543:170787, ack 902, win 65535, length 8244
21:50:27.502378 IP 18.216.114.70.443 > 10.0.2.15.33196: Flags [P.], seq 170787:172161, ack 902, win 65535, length 1374
21:50:27.502379 IP 18.216.114.70.443 > 10.0.2.15.33196: Flags [P.], seq 172161:176283, ack 902, win 65535, length 4122
21:50:27.502391 IP 10.0.2.15.33196 > 18.216.114.70.443: Flags [.], ack 170787, win 65535, length 0
21:50:27.502446 IP 10.0.2.15.33196 > 18.216.114.70.443: Flags [.], ack 172161, win 65535, length 0
21:50:27.502461 IP 10.0.2.15.33196 > 18.216.114.70.443: Flags [.], ack 176283, win 65535, length 0
21:50:27.502929 IP 18.216.114.70.443 > 10.0.2.15.33196: Flags [P.], seq 176283:184527, ack 902, win 65535, length 8244
21:50:27.502930 IP 18.216.114.70.443 > 10.0.2.15.33196: Flags [P.], seq 184527:185901, ack 902, win 65535, length 1374
21:50:27.502955 IP 10.0.2.15.33196 > 18.216.114.70.443: Flags [.], ack 184527, win 65535, length 0
21:50:27.503029 IP 10.0.2.15.33196 > 18.216.114.70.443: Flags [.], ack 185901, win 65535, length 0
21:50:27.503391 IP 18.216.114.70.443 > 10.0.2.15.33196: Flags [P.], seq 185901:187275, ack 902, win 65535, length 1374
21:50:27.503393 IP 18.216.114.70.443 > 10.0.2.15.33196: Flags [P.], seq 187275:190023, ack 902, win 65535, length 2748
21:50:27.503559 IP 10.0.2.15.33196 > 18.216.114.70.443: Flags [.], ack 187275, win 65535, length 0
21:50:27.503595 IP 10.0.2.15.33196 > 18.216.114.70.443: Flags [.], ack 190023, win 65535, length 0
21:50:27.503733 IP 18.216.114.70.443 > 10.0.2.15.33196: Flags [P.], seq 190023:192771, ack 902, win 65535, length 2748
21:50:27.503735 IP 18.216.114.70.443 > 10.0.2.15.33196: Flags [P.], seq 192771:195519, ack 902, win 65535, length 2748
21:50:27.503736 IP 18.216.114.70.443 > 10.0.2.15.33196: Flags [P.], seq 195519:199641, ack 902, win 65535, length 4122
21:50:27.503751 IP 10.0.2.15.33196 > 18.216.114.70.443: Flags [.], ack 192771, win 65535, length 0
21:50:27.503820 IP 10.0.2.15.33196 > 18.216.114.70.443: Flags [.], ack 195519, win 65535, length 0
21:50:27.503833 IP 10.0.2.15.33196 > 18.216.114.70.443: Flags [.], ack 199641, win 65535, length 0
21:50:27.504085 IP 18.216.114.70.443 > 10.0.2.15.33196: Flags [P.], seq 199641:202389, ack 902, win 65535, length 2748
21:50:27.504098 IP 10.0.2.15.33196 > 18.216.114.70.443: Flags [.], ack 202389, win 65535, length 0
21:50:27.504300 IP 18.216.114.70.443 > 10.0.2.15.33196: Flags [P.], seq 202389:205137, ack 902, win 65535, length 2748
21:50:27.504332 IP 10.0.2.15.33196 > 18.216.114.70.443: Flags [.], ack 205137, win 65535, length 0
21:50:27.528662 IP 18.216.114.70.443 > 10.0.2.15.33196: Flags [P.], seq 205137:210633, ack 902, win 65535, length 5496
21:50:27.528702 IP 10.0.2.15.33196 > 18.216.114.70.443: Flags [.], ack 210633, win 65535, length 0
21:50:27.529355 IP 18.216.114.70.443 > 10.0.2.15.33196: Flags [P.], seq 210633:216129, ack 902, win 65535, length 5496
21:50:27.529380 IP 10.0.2.15.33196 > 18.216.114.70.443: Flags [.], ack 216129, win 65535, length 0
21:50:27.532094 IP 18.216.114.70.443 > 10.0.2.15.33196: Flags [P.], seq 216129:225747, ack 902, win 65535, length 9618
21:50:27.532098 IP 18.216.114.70.443 > 10.0.2.15.33196: Flags [P.], seq 225747:229869, ack 902, win 65535, length 4122
21:50:27.532127 IP 10.0.2.15.33196 > 18.216.114.70.443: Flags [.], ack 225747, win 65535, length 0
21:50:27.532249 IP 10.0.2.15.33196 > 18.216.114.70.443: Flags [.], ack 229869, win 65535, length 0
21:50:27.534450 IP 18.216.114.70.443 > 10.0.2.15.33196: Flags [P.], seq 229869:238113, ack 902, win 65535, length 8244
21:50:27.534452 IP 18.216.114.70.443 > 10.0.2.15.33196: Flags [.], seq 238113:241033, ack 902, win 65535, length 2920
21:50:27.534474 IP 10.0.2.15.33196 > 18.216.114.70.443: Flags [.], ack 238113, win 65535, length 0
21:50:27.534509 IP 10.0.2.15.33196 > 18.216.114.70.443: Flags [.], ack 241033, win 65535, length 0
21:50:27.534876 IP 18.216.114.70.443 > 10.0.2.15.33196: Flags [P.], seq 241033:242235, ack 902, win 65535, length 1202
21:50:27.534877 IP 18.216.114.70.443 > 10.0.2.15.33196: Flags [P.], seq 242235:243609, ack 902, win 65535, length 1374
21:50:27.534886 IP 18.216.114.70.443 > 10.0.2.15.33196: Flags [P.], seq 243609:246357, ack 902, win 65535, length 2748
21:50:27.534900 IP 10.0.2.15.33196 > 18.216.114.70.443: Flags [.], ack 242235, win 65535, length 0
21:50:27.534921 IP 10.0.2.15.33196 > 18.216.114.70.443: Flags [.], ack 243609, win 65535, length 0
21:50:27.534938 IP 10.0.2.15.33196 > 18.216.114.70.443: Flags [.], ack 246357, win 65535, length 0
21:50:27.535150 IP 18.216.114.70.443 > 10.0.2.15.33196: Flags [P.], seq 246357:251853, ack 902, win 65535, length 5496
21:50:27.535151 IP 18.216.114.70.443 > 10.0.2.15.33196: Flags [P.], seq 251853:255975, ack 902, win 65535, length 4122
21:50:27.535164 IP 10.0.2.15.33196 > 18.216.114.70.443: Flags [.], ack 251853, win 65535, length 0
21:50:27.535182 IP 10.0.2.15.33196 > 18.216.114.70.443: Flags [.], ack 255975, win 65535, length 0
21:50:27.535652 IP 18.216.114.70.443 > 10.0.2.15.33196: Flags [P.], seq 255975:257349, ack 902, win 65535, length 1374
21:50:27.535654 IP 18.216.114.70.443 > 10.0.2.15.33196: Flags [P.], seq 257349:260097, ack 902, win 65535, length 2748
21:50:27.535666 IP 10.0.2.15.33196 > 18.216.114.70.443: Flags [.], ack 257349, win 65535, length 0
21:50:27.535687 IP 10.0.2.15.33196 > 18.216.114.70.443: Flags [.], ack 260097, win 65535, length 0
21:50:27.536504 IP 18.216.114.70.443 > 10.0.2.15.33196: Flags [P.], seq 260097:266967, ack 902, win 65535, length 6870
21:50:27.536507 IP 18.216.114.70.443 > 10.0.2.15.33196: Flags [P.], seq 266967:269715, ack 902, win 65535, length 2748
21:50:27.536508 IP 18.216.114.70.443 > 10.0.2.15.33196: Flags [P.], seq 269715:272463, ack 902, win 65535, length 2748
21:50:27.536536 IP 10.0.2.15.33196 > 18.216.114.70.443: Flags [.], ack 266967, win 65535, length 0
21:50:27.536618 IP 10.0.2.15.33196 > 18.216.114.70.443: Flags [.], ack 269715, win 65535, length 0
21:50:27.536780 IP 10.0.2.15.33196 > 18.216.114.70.443: Flags [.], ack 272463, win 65535, length 0
21:50:27.536812 IP 18.216.114.70.443 > 10.0.2.15.33196: Flags [P.], seq 272463:276585, ack 902, win 65535, length 4122
21:50:27.536819 IP 10.0.2.15.33196 > 18.216.114.70.443: Flags [.], ack 276585, win 65535, length 0
21:50:27.536951 IP 18.216.114.70.443 > 10.0.2.15.33196: Flags [P.], seq 276585:280707, ack 902, win 65535, length 4122
21:50:27.536961 IP 10.0.2.15.33196 > 18.216.114.70.443: Flags [.], ack 280707, win 65535, length 0
21:50:27.537221 IP 18.216.114.70.443 > 10.0.2.15.33196: Flags [P.], seq 280707:282081, ack 902, win 65535, length 1374
21:50:27.537229 IP 10.0.2.15.33196 > 18.216.114.70.443: Flags [.], ack 282081, win 65535, length 0
21:50:27.537412 IP 18.216.114.70.443 > 10.0.2.15.33196: Flags [P.], seq 282081:286203, ack 902, win 65535, length 4122
21:50:27.537421 IP 10.0.2.15.33196 > 18.216.114.70.443: Flags [.], ack 286203, win 65535, length 0
21:50:27.537550 IP 18.216.114.70.443 > 10.0.2.15.33196: Flags [P.], seq 286203:288951, ack 902, win 65535, length 2748
21:50:27.537556 IP 10.0.2.15.33196 > 18.216.114.70.443: Flags [.], ack 288951, win 65535, length 0
21:50:27.537881 IP 18.216.114.70.443 > 10.0.2.15.33196: Flags [P.], seq 288951:291699, ack 902, win 65535, length 2748
21:50:27.537883 IP 18.216.114.70.443 > 10.0.2.15.33196: Flags [P.], seq 291699:294447, ack 902, win 65535, length 2748
21:50:27.537883 IP 18.216.114.70.443 > 10.0.2.15.33196: Flags [P.], seq 294447:297195, ack 902, win 65535, length 2748
21:50:27.537898 IP 10.0.2.15.33196 > 18.216.114.70.443: Flags [.], ack 291699, win 65535, length 0
21:50:27.537915 IP 10.0.2.15.33196 > 18.216.114.70.443: Flags [.], ack 294447, win 65535, length 0
21:50:27.537928 IP 10.0.2.15.33196 > 18.216.114.70.443: Flags [.], ack 297195, win 65535, length 0
21:50:27.538134 IP 18.216.114.70.443 > 10.0.2.15.33196: Flags [P.], seq 297195:298569, ack 902, win 65535, length 1374
21:50:27.538143 IP 10.0.2.15.33196 > 18.216.114.70.443: Flags [.], ack 298569, win 65535, length 0
21:50:27.539117 IP 18.216.114.70.443 > 10.0.2.15.33196: Flags [P.], seq 298569:304065, ack 902, win 65535, length 5496
21:50:27.539119 IP 18.216.114.70.443 > 10.0.2.15.33196: Flags [P.], seq 304065:308187, ack 902, win 65535, length 4122
21:50:27.539145 IP 10.0.2.15.33196 > 18.216.114.70.443: Flags [.], ack 304065, win 65535, length 0
21:50:27.539257 IP 10.0.2.15.33196 > 18.216.114.70.443: Flags [.], ack 308187, win 65535, length 0
21:50:27.539684 IP 18.216.114.70.443 > 10.0.2.15.33196: Flags [P.], seq 308187:309561, ack 902, win 65535, length 1374
21:50:27.539686 IP 18.216.114.70.443 > 10.0.2.15.33196: Flags [P.], seq 309561:312309, ack 902, win 65535, length 2748
21:50:27.539968 IP 10.0.2.15.33196 > 18.216.114.70.443: Flags [.], ack 309561, win 65535, length 0
21:50:27.540862 IP 10.0.2.15.33196 > 18.216.114.70.443: Flags [.], ack 312309, win 65535, length 0
21:50:27.541014 IP 18.216.114.70.443 > 10.0.2.15.33196: Flags [P.], seq 312309:317805, ack 902, win 65535, length 5496
21:50:27.541016 IP 18.216.114.70.443 > 10.0.2.15.33196: Flags [P.], seq 317805:321927, ack 902, win 65535, length 4122
21:50:27.541017 IP 18.216.114.70.443 > 10.0.2.15.33196: Flags [P.], seq 321927:328797, ack 902, win 65535, length 6870
21:50:27.541031 IP 10.0.2.15.33196 > 18.216.114.70.443: Flags [.], ack 317805, win 65535, length 0
21:50:27.541046 IP 10.0.2.15.33196 > 18.216.114.70.443: Flags [.], ack 321927, win 65535, length 0
21:50:27.541060 IP 10.0.2.15.33196 > 18.216.114.70.443: Flags [.], ack 328797, win 65535, length 0
21:50:27.546792 IP 18.216.114.70.443 > 10.0.2.15.33196: Flags [P.], seq 328797:337041, ack 902, win 65535, length 8244
21:50:27.546798 IP 18.216.114.70.443 > 10.0.2.15.33196: Flags [P.], seq 337041:341163, ack 902, win 65535, length 4122
21:50:27.546952 IP 10.0.2.15.33196 > 18.216.114.70.443: Flags [.], ack 337041, win 65535, length 0
21:50:27.547417 IP 10.0.2.15.33196 > 18.216.114.70.443: Flags [.], ack 341163, win 65535, length 0
21:50:27.547470 IP 18.216.114.70.443 > 10.0.2.15.33196: Flags [P.], seq 341163:348033, ack 902, win 65535, length 6870
21:50:27.547472 IP 18.216.114.70.443 > 10.0.2.15.33196: Flags [P.], seq 348033:350781, ack 902, win 65535, length 2748
21:50:27.547487 IP 10.0.2.15.33196 > 18.216.114.70.443: Flags [.], ack 348033, win 65535, length 0
21:50:27.547501 IP 10.0.2.15.33196 > 18.216.114.70.443: Flags [.], ack 350781, win 65535, length 0
21:50:27.552320 IP 18.216.114.70.443 > 10.0.2.15.33196: Flags [P.], seq 350781:356277, ack 902, win 65535, length 5496
21:50:27.552322 IP 18.216.114.70.443 > 10.0.2.15.33196: Flags [P.], seq 356277:361773, ack 902, win 65535, length 5496
21:50:27.552344 IP 10.0.2.15.33196 > 18.216.114.70.443: Flags [.], ack 356277, win 65535, length 0
21:50:27.552368 IP 10.0.2.15.33196 > 18.216.114.70.443: Flags [.], ack 361773, win 65535, length 0
21:50:27.552421 IP 18.216.114.70.443 > 10.0.2.15.33196: Flags [P.], seq 361773:402653, ack 902, win 65535, length 40880
21:50:27.552424 IP 10.0.2.15.33196 > 18.216.114.70.443: Flags [.], ack 402653, win 65535, length 0
21:50:27.552986 IP 18.216.114.70.443 > 10.0.2.15.33196: Flags [P.], seq 402653:409863, ack 902, win 65535, length 7210
21:50:27.553002 IP 10.0.2.15.33196 > 18.216.114.70.443: Flags [.], ack 409863, win 65535, length 0
21:50:27.559466 IP 18.216.114.70.443 > 10.0.2.15.33196: Flags [P.], seq 409863:418107, ack 902, win 65535, length 8244
21:50:27.559469 IP 18.216.114.70.443 > 10.0.2.15.33196: Flags [P.], seq 418107:423603, ack 902, win 65535, length 5496
21:50:27.559638 IP 10.0.2.15.33196 > 18.216.114.70.443: Flags [.], ack 418107, win 65535, length 0
21:50:27.559683 IP 10.0.2.15.33196 > 18.216.114.70.443: Flags [.], ack 423603, win 65535, length 0
21:50:27.559720 IP 18.216.114.70.443 > 10.0.2.15.33196: Flags [P.], seq 423603:427725, ack 902, win 65535, length 4122
21:50:27.559728 IP 10.0.2.15.33196 > 18.216.114.70.443: Flags [.], ack 427725, win 65535, length 0
21:50:27.559846 IP 18.216.114.70.443 > 10.0.2.15.33196: Flags [P.], seq 427725:430473, ack 902, win 65535, length 2748
21:50:27.559852 IP 10.0.2.15.33196 > 18.216.114.70.443: Flags [.], ack 430473, win 65535, length 0
21:50:27.562344 IP 18.216.114.70.443 > 10.0.2.15.33196: Flags [P.], seq 430473:435969, ack 902, win 65535, length 5496
21:50:27.562346 IP 18.216.114.70.443 > 10.0.2.15.33196: Flags [P.], seq 435969:441465, ack 902, win 65535, length 5496
21:50:27.562368 IP 10.0.2.15.33196 > 18.216.114.70.443: Flags [.], ack 435969, win 65535, length 0
21:50:27.562437 IP 10.0.2.15.33196 > 18.216.114.70.443: Flags [.], ack 441465, win 65535, length 0
21:50:27.563310 IP 18.216.114.70.443 > 10.0.2.15.33196: Flags [P.], seq 441465:444213, ack 902, win 65535, length 2748
21:50:27.563313 IP 18.216.114.70.443 > 10.0.2.15.33196: Flags [P.], seq 444213:448335, ack 902, win 65535, length 4122
21:50:27.563313 IP 18.216.114.70.443 > 10.0.2.15.33196: Flags [P.], seq 448335:451083, ack 902, win 65535, length 2748
21:50:27.563314 IP 18.216.114.70.443 > 10.0.2.15.33196: Flags [P.], seq 451083:453831, ack 902, win 65535, length 2748
21:50:27.563395 IP 10.0.2.15.33196 > 18.216.114.70.443: Flags [.], ack 444213, win 65535, length 0
21:50:27.563494 IP 10.0.2.15.33196 > 18.216.114.70.443: Flags [.], ack 448335, win 65535, length 0
21:50:27.563516 IP 10.0.2.15.33196 > 18.216.114.70.443: Flags [.], ack 451083, win 65535, length 0
21:50:27.563528 IP 10.0.2.15.33196 > 18.216.114.70.443: Flags [.], ack 453831, win 65535, length 0
21:50:27.564738 IP 18.216.114.70.443 > 10.0.2.15.33196: Flags [P.], seq 453831:455205, ack 902, win 65535, length 1374
21:50:27.564755 IP 10.0.2.15.33196 > 18.216.114.70.443: Flags [.], ack 455205, win 65535, length 0
21:50:27.569251 IP 18.216.114.70.443 > 10.0.2.15.33196: Flags [P.], seq 455205:462075, ack 902, win 65535, length 6870
21:50:27.569254 IP 18.216.114.70.443 > 10.0.2.15.33196: Flags [P.], seq 462075:466197, ack 902, win 65535, length 4122
21:50:27.569284 IP 10.0.2.15.33196 > 18.216.114.70.443: Flags [.], ack 462075, win 65535, length 0
21:50:27.569342 IP 10.0.2.15.33196 > 18.216.114.70.443: Flags [.], ack 466197, win 65535, length 0
21:50:27.570993 IP 18.216.114.70.443 > 10.0.2.15.33196: Flags [P.], seq 466197:467571, ack 902, win 65535, length 1374
21:50:27.571016 IP 10.0.2.15.33196 > 18.216.114.70.443: Flags [.], ack 467571, win 65535, length 0
21:50:27.576419 IP 18.216.114.70.443 > 10.0.2.15.33196: Flags [P.], seq 467571:479937, ack 902, win 65535, length 12366
21:50:27.576441 IP 10.0.2.15.33196 > 18.216.114.70.443: Flags [.], ack 479937, win 65535, length 0
21:50:27.576506 IP 18.216.114.70.443 > 10.0.2.15.33196: Flags [P.], seq 479937:486807, ack 902, win 65535, length 6870
21:50:27.576507 IP 18.216.114.70.443 > 10.0.2.15.33196: Flags [P.], seq 486807:488181, ack 902, win 65535, length 1374
21:50:27.576508 IP 18.216.114.70.443 > 10.0.2.15.33196: Flags [P.], seq 488181:489555, ack 902, win 65535, length 1374

