21:45:39.617008 IP 10.0.2.15.54685 > 140.233.253.2.53: 8485+ A? www.indeed.com. (32)
21:45:39.617049 IP 10.0.2.15.54685 > 140.233.253.2.53: 52058+ AAAA? www.indeed.com. (32)
21:45:39.623313 IP 140.233.253.2.53 > 10.0.2.15.54685: 52058 1/1/0 CNAME us.dyn.indeed.com. (118)
21:45:39.624014 IP 140.233.253.2.53 > 10.0.2.15.54685: 8485 2/0/0 CNAME us.dyn.indeed.com., A 169.45.207.200 (69)
21:45:39.624218 IP 10.0.2.15.36536 > 169.45.207.200.443: Flags [S], seq 421413527, win 64240, options [mss 1460,sackOK,TS val 4229374870 ecr 0,nop,wscale 6], length 0
21:45:39.642530 IP 169.45.207.200.443 > 10.0.2.15.36536: Flags [S.], seq 267328001, ack 421413528, win 65535, options [mss 1460], length 0
21:45:39.642588 IP 10.0.2.15.36536 > 169.45.207.200.443: Flags [.], ack 1, win 64240, length 0
21:45:39.656781 IP 10.0.2.15.36536 > 169.45.207.200.443: Flags [P.], seq 1:518, ack 1, win 64240, length 517
21:45:39.657161 IP 169.45.207.200.443 > 10.0.2.15.36536: Flags [.], ack 518, win 65535, length 0
21:45:39.675560 IP 169.45.207.200.443 > 10.0.2.15.36536: Flags [P.], seq 1:1375, ack 518, win 65535, length 1374
21:45:39.675581 IP 10.0.2.15.36536 > 169.45.207.200.443: Flags [.], ack 1375, win 63204, length 0
21:45:39.676639 IP 169.45.207.200.443 > 10.0.2.15.36536: Flags [P.], seq 1375:4375, ack 518, win 65535, length 3000
21:45:39.676669 IP 10.0.2.15.36536 > 169.45.207.200.443: Flags [.], ack 4375, win 62780, length 0
21:45:39.679232 IP 10.0.2.15.36536 > 169.45.207.200.443: Flags [P.], seq 518:644, ack 4375, win 62780, length 126
21:45:39.679582 IP 169.45.207.200.443 > 10.0.2.15.36536: Flags [.], ack 644, win 65535, length 0
21:45:39.695568 IP 169.45.207.200.443 > 10.0.2.15.36536: Flags [P.], seq 4375:4495, ack 644, win 65535, length 120
21:45:39.695585 IP 10.0.2.15.36536 > 169.45.207.200.443: Flags [.], ack 4495, win 62780, length 0
21:45:39.696399 IP 10.0.2.15.36536 > 169.45.207.200.443: Flags [P.], seq 644:697, ack 4495, win 62780, length 53
21:45:39.696444 IP 10.0.2.15.36536 > 169.45.207.200.443: Flags [P.], seq 697:753, ack 4495, win 62780, length 56
21:45:39.696715 IP 169.45.207.200.443 > 10.0.2.15.36536: Flags [.], ack 697, win 65535, length 0
21:45:39.696736 IP 10.0.2.15.36536 > 169.45.207.200.443: Flags [P.], seq 753:902, ack 4495, win 62780, length 149
21:45:39.697041 IP 169.45.207.200.443 > 10.0.2.15.36536: Flags [.], ack 753, win 65535, length 0
21:45:39.697043 IP 169.45.207.200.443 > 10.0.2.15.36536: Flags [.], ack 902, win 65535, length 0
21:45:39.714012 IP 169.45.207.200.443 > 10.0.2.15.36536: Flags [P.], seq 4495:4533, ack 902, win 65535, length 38
21:45:39.714035 IP 10.0.2.15.36536 > 169.45.207.200.443: Flags [.], ack 4533, win 62780, length 0
21:45:39.728841 IP 169.45.207.200.443 > 10.0.2.15.36536: Flags [.], seq 4533:13293, ack 902, win 65535, length 8760
21:45:39.728866 IP 10.0.2.15.36536 > 169.45.207.200.443: Flags [.], ack 13293, win 58400, length 0
21:45:39.729352 IP 169.45.207.200.443 > 10.0.2.15.36536: Flags [P.], seq 13293:18273, ack 902, win 65535, length 4980
21:45:39.729370 IP 10.0.2.15.36536 > 169.45.207.200.443: Flags [.], ack 18273, win 55480, length 0
21:45:39.730763 IP 169.45.207.200.443 > 10.0.2.15.36536: Flags [P.], seq 18273:19647, ack 902, win 65535, length 1374
21:45:39.730828 IP 10.0.2.15.36536 > 169.45.207.200.443: Flags [.], ack 19647, win 62780, length 0
21:45:39.743848 IP 169.45.207.200.443 > 10.0.2.15.36536: Flags [P.], seq 19647:21021, ack 902, win 65535, length 1374
21:45:39.743872 IP 10.0.2.15.36536 > 169.45.207.200.443: Flags [.], ack 21021, win 62780, length 0
21:45:39.745530 IP 169.45.207.200.443 > 10.0.2.15.36536: Flags [P.], seq 21021:34761, ack 902, win 65535, length 13740
21:45:39.745615 IP 10.0.2.15.36536 > 169.45.207.200.443: Flags [.], ack 34761, win 55480, length 0
21:45:39.745847 IP 169.45.207.200.443 > 10.0.2.15.36536: Flags [P.], seq 34761:47127, ack 902, win 65535, length 12366
21:45:39.745864 IP 10.0.2.15.36536 > 169.45.207.200.443: Flags [.], ack 47127, win 46720, length 0
21:45:39.747267 IP 169.45.207.200.443 > 10.0.2.15.36536: Flags [P.], seq 47127:49875, ack 902, win 65535, length 2748
21:45:39.747295 IP 10.0.2.15.36536 > 169.45.207.200.443: Flags [.], ack 49875, win 62780, length 0
21:45:39.760250 IP 169.45.207.200.443 > 10.0.2.15.36536: Flags [P.], seq 49875:52623, ack 902, win 65535, length 2748
21:45:39.760274 IP 10.0.2.15.36536 > 169.45.207.200.443: Flags [.], ack 52623, win 62780, length 0
21:45:39.761051 IP 169.45.207.200.443 > 10.0.2.15.36536: Flags [P.], seq 52623:60867, ack 902, win 65535, length 8244
21:45:39.761053 IP 169.45.207.200.443 > 10.0.2.15.36536: Flags [P.], seq 60867:62241, ack 902, win 65535, length 1374
21:45:39.761129 IP 10.0.2.15.36536 > 169.45.207.200.443: Flags [.], ack 62241, win 58400, length 0
21:45:39.761364 IP 169.45.207.200.443 > 10.0.2.15.36536: Flags [P.], seq 62241:67737, ack 902, win 65535, length 5496
21:45:39.761654 IP 169.45.207.200.443 > 10.0.2.15.36536: Flags [P.], seq 67737:70485, ack 902, win 65535, length 2748
21:45:39.761855 IP 169.45.207.200.443 > 10.0.2.15.36536: Flags [P.], seq 70485:75981, ack 902, win 65535, length 5496
21:45:39.761856 IP 169.45.207.200.443 > 10.0.2.15.36536: Flags [P.], seq 75981:78729, ack 902, win 65535, length 2748
21:45:39.761884 IP 10.0.2.15.36536 > 169.45.207.200.443: Flags [.], ack 78729, win 62780, length 0
21:45:39.763510 IP 169.45.207.200.443 > 10.0.2.15.36536: Flags [P.], seq 78729:84225, ack 902, win 65535, length 5496
21:45:39.763513 IP 169.45.207.200.443 > 10.0.2.15.36536: Flags [P.], seq 84225:88347, ack 902, win 65535, length 4122
21:45:39.763633 IP 10.0.2.15.36536 > 169.45.207.200.443: Flags [.], ack 84225, win 65535, length 0
21:45:39.763685 IP 10.0.2.15.36536 > 169.45.207.200.443: Flags [.], ack 88347, win 65535, length 0
21:45:39.763841 IP 169.45.207.200.443 > 10.0.2.15.36536: Flags [P.], seq 88347:93843, ack 902, win 65535, length 5496
21:45:39.763842 IP 169.45.207.200.443 > 10.0.2.15.36536: Flags [P.], seq 93843:95217, ack 902, win 65535, length 1374
21:45:39.763843 IP 169.45.207.200.443 > 10.0.2.15.36536: Flags [P.], seq 95217:97965, ack 902, win 65535, length 2748
21:45:39.763886 IP 10.0.2.15.36536 > 169.45.207.200.443: Flags [.], ack 93843, win 65535, length 0
21:45:39.763900 IP 10.0.2.15.36536 > 169.45.207.200.443: Flags [.], ack 95217, win 65535, length 0
21:45:39.763908 IP 10.0.2.15.36536 > 169.45.207.200.443: Flags [.], ack 97965, win 65535, length 0
21:45:39.764237 IP 169.45.207.200.443 > 10.0.2.15.36536: Flags [P.], seq 97965:99339, ack 902, win 65535, length 1374
21:45:39.764247 IP 10.0.2.15.36536 > 169.45.207.200.443: Flags [.], ack 99339, win 65535, length 0
21:45:39.765521 IP 169.45.207.200.443 > 10.0.2.15.36536: Flags [P.], seq 99339:106209, ack 902, win 65535, length 6870
21:45:39.765523 IP 169.45.207.200.443 > 10.0.2.15.36536: Flags [P.], seq 106209:108957, ack 902, win 65535, length 2748
21:45:39.765524 IP 169.45.207.200.443 > 10.0.2.15.36536: Flags [P.], seq 108957:110331, ack 902, win 65535, length 1374
21:45:39.765543 IP 10.0.2.15.36536 > 169.45.207.200.443: Flags [.], ack 106209, win 65535, length 0
21:45:39.765579 IP 10.0.2.15.36536 > 169.45.207.200.443: Flags [.], ack 108957, win 65535, length 0
21:45:39.765592 IP 10.0.2.15.36536 > 169.45.207.200.443: Flags [.], ack 110331, win 65535, length 0
21:45:39.777720 IP 169.45.207.200.443 > 10.0.2.15.36536: Flags [P.], seq 110331:121323, ack 902, win 65535, length 10992
21:45:39.777749 IP 10.0.2.15.36536 > 169.45.207.200.443: Flags [.], ack 121323, win 65535, length 0
21:45:39.777824 IP 169.45.207.200.443 > 10.0.2.15.36536: Flags [P.], seq 121323:126819, ack 902, win 65535, length 5496
21:45:39.777826 IP 169.45.207.200.443 > 10.0.2.15.36536: Flags [P.], seq 126819:129567, ack 902, win 65535, length 2748
21:45:39.777827 IP 169.45.207.200.443 > 10.0.2.15.36536: Flags [P.], seq 129567:130941, ack 902, win 65535, length 1374
21:45:39.777840 IP 10.0.2.15.36536 > 169.45.207.200.443: Flags [.], ack 126819, win 65535, length 0
21:45:39.777854 IP 10.0.2.15.36536 > 169.45.207.200.443: Flags [.], ack 129567, win 65535, length 0
21:45:39.777864 IP 10.0.2.15.36536 > 169.45.207.200.443: Flags [.], ack 130941, win 65535, length 0
21:45:39.779556 IP 169.45.207.200.443 > 10.0.2.15.36536: Flags [P.], seq 130941:139185, ack 902, win 65535, length 8244
21:45:39.779560 IP 169.45.207.200.443 > 10.0.2.15.36536: Flags [P.], seq 139185:144681, ack 902, win 65535, length 5496
21:45:39.779657 IP 10.0.2.15.36536 > 169.45.207.200.443: Flags [.], ack 139185, win 65535, length 0
21:45:39.779697 IP 10.0.2.15.36536 > 169.45.207.200.443: Flags [.], ack 144681, win 65535, length 0
21:45:39.779828 IP 169.45.207.200.443 > 10.0.2.15.36536: Flags [P.], seq 144681:150177, ack 902, win 65535, length 5496
21:45:39.779829 IP 169.45.207.200.443 > 10.0.2.15.36536: Flags [P.], seq 150177:151551, ack 902, win 65535, length 1374
21:45:39.779841 IP 10.0.2.15.36536 > 169.45.207.200.443: Flags [.], ack 150177, win 65535, length 0
21:45:39.779860 IP 10.0.2.15.36536 > 169.45.207.200.443: Flags [.], ack 151551, win 65535, length 0
21:45:39.780405 IP 169.45.207.200.443 > 10.0.2.15.36536: Flags [P.], seq 151551:157047, ack 902, win 65535, length 5496
21:45:39.780418 IP 10.0.2.15.36536 > 169.45.207.200.443: Flags [.], ack 157047, win 65535, length 0
21:45:39.780907 IP 169.45.207.200.443 > 10.0.2.15.36536: Flags [P.], seq 157047:162543, ack 902, win 65535, length 5496
21:45:39.780925 IP 10.0.2.15.36536 > 169.45.207.200.443: Flags [.], ack 162543, win 65535, length 0
21:45:39.789472 IP 169.45.207.200.443 > 10.0.2.15.36536: Flags [.], seq 162543:199043, ack 902, win 65535, length 36500
21:45:39.789500 IP 10.0.2.15.36536 > 169.45.207.200.443: Flags [.], ack 199043, win 65535, length 0
21:45:39.789995 IP 169.45.207.200.443 > 10.0.2.15.36536: Flags [P.], seq 199043:228243, ack 902, win 65535, length 29200
21:45:39.790023 IP 10.0.2.15.36536 > 169.45.207.200.443: Flags [.], ack 228243, win 65535, length 0
21:45:39.790066 IP 169.45.207.200.443 > 10.0.2.15.36536: Flags [P.], seq 228243:228495, ack 902, win 65535, length 252
21:45:39.790638 IP 10.0.2.15.36536 > 169.45.207.200.443: Flags [.], ack 228495, win 65535, length 0
21:45:39.793593 IP 169.45.207.200.443 > 10.0.2.15.36536: Flags [P.], seq 228495:239487, ack 902, win 65535, length 10992
21:45:39.793667 IP 10.0.2.15.36536 > 169.45.207.200.443: Flags [.], ack 239487, win 65535, length 0
21:45:39.793780 IP 169.45.207.200.443 > 10.0.2.15.36536: Flags [P.], seq 239487:243609, ack 902, win 65535, length 4122
21:45:39.793781 IP 169.45.207.200.443 > 10.0.2.15.36536: Flags [P.], seq 243609:246357, ack 902, win 65535, length 2748
21:45:39.793782 IP 169.45.207.200.443 > 10.0.2.15.36536: Flags [P.], seq 246357:249105, ack 902, win 65535, length 2748
21:45:39.793796 IP 10.0.2.15.36536 > 169.45.207.200.443: Flags [.], ack 243609, win 65535, length 0
21:45:39.793926 IP 10.0.2.15.36536 > 169.45.207.200.443: Flags [.], ack 246357, win 65535, length 0
21:45:39.793957 IP 10.0.2.15.36536 > 169.45.207.200.443: Flags [.], ack 249105, win 65535, length 0
21:45:39.794266 IP 169.45.207.200.443 > 10.0.2.15.36536: Flags [P.], seq 249105:253227, ack 902, win 65535, length 4122
21:45:39.794280 IP 169.45.207.200.443 > 10.0.2.15.36536: Flags [P.], seq 253227:257349, ack 902, win 65535, length 4122
21:45:39.794281 IP 169.45.207.200.443 > 10.0.2.15.36536: Flags [P.], seq 257349:258723, ack 902, win 65535, length 1374
21:45:39.794299 IP 10.0.2.15.36536 > 169.45.207.200.443: Flags [.], ack 253227, win 65535, length 0
21:45:39.794429 IP 10.0.2.15.36536 > 169.45.207.200.443: Flags [.], ack 257349, win 65535, length 0
21:45:39.794446 IP 10.0.2.15.36536 > 169.45.207.200.443: Flags [.], ack 258723, win 65535, length 0
21:45:39.795659 IP 169.45.207.200.443 > 10.0.2.15.36536: Flags [P.], seq 258723:266967, ack 902, win 65535, length 8244
21:45:39.795662 IP 169.45.207.200.443 > 10.0.2.15.36536: Flags [P.], seq 266967:271089, ack 902, win 65535, length 4122
21:45:39.795752 IP 10.0.2.15.36536 > 169.45.207.200.443: Flags [.], ack 266967, win 65535, length 0
21:45:39.795854 IP 10.0.2.15.36536 > 169.45.207.200.443: Flags [.], ack 271089, win 65535, length 0
21:45:39.795908 IP 169.45.207.200.443 > 10.0.2.15.36536: Flags [P.], seq 271089:275211, ack 902, win 65535, length 4122
21:45:39.795912 IP 169.45.207.200.443 > 10.0.2.15.36536: Flags [P.], seq 275211:279333, ack 902, win 65535, length 4122
21:45:39.795931 IP 10.0.2.15.36536 > 169.45.207.200.443: Flags [.], ack 275211, win 65535, length 0
21:45:39.796012 IP 10.0.2.15.36536 > 169.45.207.200.443: Flags [.], ack 279333, win 65535, length 0
21:45:39.796144 IP 169.45.207.200.443 > 10.0.2.15.36536: Flags [P.], seq 279333:282081, ack 902, win 65535, length 2748
21:45:39.796149 IP 10.0.2.15.36536 > 169.45.207.200.443: Flags [.], ack 282081, win 65535, length 0
21:45:39.797427 IP 169.45.207.200.443 > 10.0.2.15.36536: Flags [P.], seq 282081:290325, ack 902, win 65535, length 8244
21:45:39.797430 IP 169.45.207.200.443 > 10.0.2.15.36536: Flags [P.], seq 290325:291699, ack 902, win 65535, length 1374
21:45:39.797451 IP 10.0.2.15.36536 > 169.45.207.200.443: Flags [.], ack 290325, win 65535, length 0
21:45:39.797586 IP 10.0.2.15.36536 > 169.45.207.200.443: Flags [.], ack 291699, win 65535, length 0
21:45:39.797730 IP 169.45.207.200.443 > 10.0.2.15.36536: Flags [P.], seq 291699:295821, ack 902, win 65535, length 4122
21:45:39.797741 IP 10.0.2.15.36536 > 169.45.207.200.443: Flags [.], ack 295821, win 65535, length 0
21:45:39.798264 IP 169.45.207.200.443 > 10.0.2.15.36536: Flags [P.], seq 295821:299943, ack 902, win 65535, length 4122
21:45:39.798266 IP 169.45.207.200.443 > 10.0.2.15.36536: Flags [P.], seq 299943:305439, ack 902, win 65535, length 5496
21:45:39.798287 IP 10.0.2.15.36536 > 169.45.207.200.443: Flags [.], ack 299943, win 65535, length 0
21:45:39.798304 IP 10.0.2.15.36536 > 169.45.207.200.443: Flags [.], ack 305439, win 65535, length 0
21:45:39.798520 IP 169.45.207.200.443 > 10.0.2.15.36536: Flags [P.], seq 305439:309561, ack 902, win 65535, length 4122
21:45:39.798526 IP 10.0.2.15.36536 > 169.45.207.200.443: Flags [.], ack 309561, win 65535, length 0
21:45:39.799565 IP 169.45.207.200.443 > 10.0.2.15.36536: Flags [P.], seq 309561:310935, ack 902, win 65535, length 1374
21:45:39.799584 IP 10.0.2.15.36536 > 169.45.207.200.443: Flags [.], ack 310935, win 65535, length 0
21:45:39.801037 IP 169.45.207.200.443 > 10.0.2.15.36536: Flags [P.], seq 310935:312309, ack 902, win 65535, length 1374
21:45:39.801055 IP 10.0.2.15.36536 > 169.45.207.200.443: Flags [.], ack 312309, win 65535, length 0
21:45:39.802065 IP 169.45.207.200.443 > 10.0.2.15.36536: Flags [P.], seq 312309:319179, ack 902, win 65535, length 6870
21:45:39.802068 IP 169.45.207.200.443 > 10.0.2.15.36536: Flags [P.], seq 319179:321927, ack 902, win 65535, length 2748
21:45:39.802069 IP 169.45.207.200.443 > 10.0.2.15.36536: Flags [P.], seq 321927:324675, ack 902, win 65535, length 2748
21:45:39.802092 IP 10.0.2.15.36536 > 169.45.207.200.443: Flags [.], ack 319179, win 65535, length 0
21:45:39.802128 IP 10.0.2.15.36536 > 169.45.207.200.443: Flags [.], ack 321927, win 65535, length 0
21:45:39.802139 IP 10.0.2.15.36536 > 169.45.207.200.443: Flags [.], ack 324675, win 65535, length 0
21:45:39.802162 IP 169.45.207.200.443 > 10.0.2.15.36536: Flags [P.], seq 324675:327423, ack 902, win 65535, length 2748
21:45:39.802167 IP 10.0.2.15.36536 > 169.45.207.200.443: Flags [.], ack 327423, win 65535, length 0
21:45:39.804664 IP 169.45.207.200.443 > 10.0.2.15.36536: Flags [P.], seq 327423:338415, ack 902, win 65535, length 10992
21:45:39.804753 IP 10.0.2.15.36536 > 169.45.207.200.443: Flags [.], ack 338415, win 65535, length 0
21:45:39.804802 IP 169.45.207.200.443 > 10.0.2.15.36536: Flags [P.], seq 338415:342537, ack 902, win 65535, length 4122
21:45:39.804803 IP 169.45.207.200.443 > 10.0.2.15.36536: Flags [P.], seq 342537:345285, ack 902, win 65535, length 2748
21:45:39.804896 IP 10.0.2.15.36536 > 169.45.207.200.443: Flags [.], ack 342537, win 65535, length 0
21:45:39.804929 IP 10.0.2.15.36536 > 169.45.207.200.443: Flags [.], ack 345285, win 65535, length 0
21:45:39.805151 IP 169.45.207.200.443 > 10.0.2.15.36536: Flags [P.], seq 345285:350781, ack 902, win 65535, length 5496
21:45:39.805239 IP 10.0.2.15.36536 > 169.45.207.200.443: Flags [.], ack 350781, win 65535, length 0
21:45:39.805616 IP 169.45.207.200.443 > 10.0.2.15.36536: Flags [P.], seq 350781:356277, ack 902, win 65535, length 5496
21:45:39.805618 IP 169.45.207.200.443 > 10.0.2.15.36536: Flags [P.], seq 356277:359025, ack 902, win 65535, length 2748
21:45:39.805661 IP 10.0.2.15.36536 > 169.45.207.200.443: Flags [.], ack 356277, win 65535, length 0
21:45:39.805678 IP 10.0.2.15.36536 > 169.45.207.200.443: Flags [.], ack 359025, win 65535, length 0
21:45:39.805818 IP 169.45.207.200.443 > 10.0.2.15.36536: Flags [P.], seq 359025:363147, ack 902, win 65535, length 4122
21:45:39.805826 IP 10.0.2.15.36536 > 169.45.207.200.443: Flags [.], ack 363147, win 65535, length 0
21:45:39.806505 IP 169.45.207.200.443 > 10.0.2.15.36536: Flags [P.], seq 363147:370017, ack 902, win 65535, length 6870
21:45:39.806507 IP 169.45.207.200.443 > 10.0.2.15.36536: Flags [P.], seq 370017:375513, ack 902, win 65535, length 5496
21:45:39.806526 IP 10.0.2.15.36536 > 169.45.207.200.443: Flags [.], ack 370017, win 65535, length 0
21:45:39.806613 IP 10.0.2.15.36536 > 169.45.207.200.443: Flags [.], ack 375513, win 65535, length 0
21:45:39.806967 IP 169.45.207.200.443 > 10.0.2.15.36536: Flags [P.], seq 375513:381009, ack 902, win 65535, length 5496
21:45:39.806979 IP 10.0.2.15.36536 > 169.45.207.200.443: Flags [.], ack 381009, win 65535, length 0
21:45:39.807291 IP 169.45.207.200.443 > 10.0.2.15.36536: Flags [P.], seq 381009:386505, ack 902, win 65535, length 5496
21:45:39.807293 IP 169.45.207.200.443 > 10.0.2.15.36536: Flags [P.], seq 386505:389253, ack 902, win 65535, length 2748
21:45:39.807294 IP 169.45.207.200.443 > 10.0.2.15.36536: Flags [P.], seq 389253:392001, ack 902, win 65535, length 2748
21:45:39.807320 IP 10.0.2.15.36536 > 169.45.207.200.443: Flags [.], ack 386505, win 65535, length 0
21:45:39.807433 IP 10.0.2.15.36536 > 169.45.207.200.443: Flags [.], ack 389253, win 65535, length 0
21:45:39.807444 IP 10.0.2.15.36536 > 169.45.207.200.443: Flags [.], ack 392001, win 65535, length 0
21:45:39.807537 IP 169.45.207.200.443 > 10.0.2.15.36536: Flags [P.], seq 392001:393375, ack 902, win 65535, length 1374
21:45:39.807583 IP 10.0.2.15.36536 > 169.45.207.200.443: Flags [.], ack 393375, win 65535, length 0
21:45:39.807748 IP 169.45.207.200.443 > 10.0.2.15.36536: Flags [P.], seq 393375:398871, ack 902, win 65535, length 5496
21:45:39.807756 IP 10.0.2.15.36536 > 169.45.207.200.443: Flags [.], ack 398871, win 65535, length 0
21:45:39.807986 IP 169.45.207.200.443 > 10.0.2.15.36536: Flags [.], seq 398871:400331, ack 902, win 65535, length 1460
21:45:39.807998 IP 10.0.2.15.36536 > 169.45.207.200.443: Flags [.], ack 400331, win 65535, length 0
21:45:39.808209 IP 169.45.207.200.443 > 10.0.2.15.36536: Flags [P.], seq 400331:402993, ack 902, win 65535, length 2662
21:45:39.808211 IP 169.45.207.200.443 > 10.0.2.15.36536: Flags [P.], seq 402993:405741, ack 902, win 65535, length 2748
21:45:39.808212 IP 169.45.207.200.443 > 10.0.2.15.36536: Flags [P.], seq 405741:409863, ack 902, win 65535, length 4122
21:45:39.808246 IP 10.0.2.15.36536 > 169.45.207.200.443: Flags [.], ack 409863, win 65535, length 0
21:45:39.809120 IP 169.45.207.200.443 > 10.0.2.15.36536: Flags [P.], seq 409863:413985, ack 902, win 65535, length 4122
21:45:39.809138 IP 10.0.2.15.36536 > 169.45.207.200.443: Flags [.], ack 413985, win 65535, length 0
21:45:39.809941 IP 169.45.207.200.443 > 10.0.2.15.36536: Flags [P.], seq 413985:419481, ack 902, win 65535, length 5496
21:45:39.809954 IP 10.0.2.15.36536 > 169.45.207.200.443: Flags [.], ack 419481, win 65535, length 0
21:45:39.810115 IP 169.45.207.200.443 > 10.0.2.15.36536: Flags [P.], seq 419481:424977, ack 902, win 65535, length 5496
21:45:39.810122 IP 10.0.2.15.36536 > 169.45.207.200.443: Flags [.], ack 424977, win 65535, length 0
21:45:39.810760 IP 169.45.207.200.443 > 10.0.2.15.36536: Flags [P.], seq 424977:426351, ack 902, win 65535, length 1374
21:45:39.810770 IP 10.0.2.15.36536 > 169.45.207.200.443: Flags [.], ack 426351, win 65535, length 0
21:45:39.812312 IP 169.45.207.200.443 > 10.0.2.15.36536: Flags [P.], seq 426351:435969, ack 902, win 65535, length 9618
21:45:39.812314 IP 169.45.207.200.443 > 10.0.2.15.36536: Flags [P.], seq 435969:441465, ack 902, win 65535, length 5496
21:45:39.812336 IP 10.0.2.15.36536 > 169.45.207.200.443: Flags [.], ack 435969, win 65535, length 0
21:45:39.812371 IP 10.0.2.15.36536 > 169.45.207.200.443: Flags [.], ack 441465, win 65535, length 0
21:45:39.812397 IP 169.45.207.200.443 > 10.0.2.15.36536: Flags [P.], seq 441465:442839, ack 902, win 65535, length 1374
21:45:39.812398 IP 169.45.207.200.443 > 10.0.2.15.36536: Flags [P.], seq 442839:448335, ack 902, win 65535, length 5496
21:45:39.812403 IP 10.0.2.15.36536 > 169.45.207.200.443: Flags [.], ack 442839, win 65535, length 0
21:45:39.812415 IP 10.0.2.15.36536 > 169.45.207.200.443: Flags [.], ack 448335, win 65535, length 0
21:45:39.812919 IP 169.45.207.200.443 > 10.0.2.15.36536: Flags [P.], seq 448335:452457, ack 902, win 65535, length 4122
21:45:39.812921 IP 169.45.207.200.443 > 10.0.2.15.36536: Flags [P.], seq 452457:453831, ack 902, win 65535, length 1374
21:45:39.812933 IP 10.0.2.15.36536 > 169.45.207.200.443: Flags [.], ack 452457, win 65535, length 0
21:45:39.813013 IP 10.0.2.15.36536 > 169.45.207.200.443: Flags [.], ack 453831, win 65535, length 0
21:45:39.813747 IP 169.45.207.200.443 > 10.0.2.15.36536: Flags [P.], seq 453831:456579, ack 902, win 65535, length 2748
21:45:39.813750 IP 169.45.207.200.443 > 10.0.2.15.36536: Flags [P.], seq 456579:460701, ack 902, win 65535, length 4122
21:45:39.813750 IP 169.45.207.200.443 > 10.0.2.15.36536: Flags [P.], seq 460701:462075, ack 902, win 65535, length 1374
21:45:39.813816 IP 10.0.2.15.36536 > 169.45.207.200.443: Flags [.], ack 456579, win 65535, length 0
21:45:39.814012 IP 10.0.2.15.36536 > 169.45.207.200.443: Flags [.], ack 460701, win 65535, length 0
21:45:39.814032 IP 10.0.2.15.36536 > 169.45.207.200.443: Flags [.], ack 462075, win 65535, length 0
21:45:39.814223 IP 169.45.207.200.443 > 10.0.2.15.36536: Flags [P.], seq 462075:466197, ack 902, win 65535, length 4122
21:45:39.814225 IP 169.45.207.200.443 > 10.0.2.15.36536: Flags [P.], seq 466197:470319, ack 902, win 65535, length 4122
21:45:39.814226 IP 169.45.207.200.443 > 10.0.2.15.36536: Flags [P.], seq 470319:473067, ack 902, win 65535, length 2748
21:45:39.814259 IP 10.0.2.15.36536 > 169.45.207.200.443: Flags [.], ack 473067, win 65535, length 0
21:45:39.816970 IP 169.45.207.200.443 > 10.0.2.15.36536: Flags [P.], seq 473067:482685, ack 902, win 65535, length 9618
21:45:39.816974 IP 169.45.207.200.443 > 10.0.2.15.36536: Flags [P.], seq 482685:488181, ack 902, win 65535, length 5496
21:45:39.816997 IP 10.0.2.15.36536 > 169.45.207.200.443: Flags [.], ack 482685, win 65535, length 0
21:45:39.817031 IP 10.0.2.15.36536 > 169.45.207.200.443: Flags [.], ack 488181, win 65535, length 0
21:45:39.817057 IP 169.45.207.200.443 > 10.0.2.15.36536: Flags [P.], seq 488181:490929, ack 902, win 65535, length 2748
21:45:39.817062 IP 10.0.2.15.36536 > 169.45.207.200.443: Flags [.], ack 490929, win 65535, length 0
21:45:39.818566 IP 169.45.207.200.443 > 10.0.2.15.36536: Flags [P.], seq 490929:497799, ack 902, win 65535, length 6870

