19:30:19.006679 IP 10.0.2.15.33496 > 140.233.253.2.53: 21679+ A? www.cnn.com. (29)
19:30:19.006719 IP 10.0.2.15.33496 > 140.233.253.2.53: 61864+ AAAA? www.cnn.com. (29)
19:30:19.012196 IP 140.233.253.2.53 > 10.0.2.15.33496: 21679 2/0/0 CNAME turner-tls.map.fastly.net., A 151.101.117.67 (84)
19:30:19.012198 IP 140.233.253.2.53 > 10.0.2.15.33496: 61864 2/0/0 CNAME turner-tls.map.fastly.net., AAAA 2a04:4e42:1c::323 (96)
19:30:19.012784 IP 10.0.2.15.38046 > 151.101.117.67.443: Flags [S], seq 1910266501, win 64240, options [mss 1460,sackOK,TS val 1396737985 ecr 0,nop,wscale 6], length 0
19:30:19.029680 IP 151.101.117.67.443 > 10.0.2.15.38046: Flags [S.], seq 169600001, ack 1910266502, win 65535, options [mss 1460], length 0
19:30:19.029719 IP 10.0.2.15.38046 > 151.101.117.67.443: Flags [.], ack 1, win 64240, length 0
19:30:19.039292 IP 10.0.2.15.38046 > 151.101.117.67.443: Flags [P.], seq 1:518, ack 1, win 64240, length 517
19:30:19.039621 IP 151.101.117.67.443 > 10.0.2.15.38046: Flags [.], ack 518, win 65535, length 0
19:30:19.059764 IP 151.101.117.67.443 > 10.0.2.15.38046: Flags [.], seq 1:2921, ack 518, win 65535, length 2920
19:30:19.059790 IP 10.0.2.15.38046 > 151.101.117.67.443: Flags [.], ack 2921, win 62780, length 0
19:30:19.060114 IP 151.101.117.67.443 > 10.0.2.15.38046: Flags [P.], seq 2921:4123, ack 518, win 65535, length 1202
19:30:19.060132 IP 10.0.2.15.38046 > 151.101.117.67.443: Flags [.], ack 4123, win 61578, length 0
19:30:19.060506 IP 151.101.117.67.443 > 10.0.2.15.38046: Flags [P.], seq 4123:5064, ack 518, win 65535, length 941
19:30:19.060537 IP 10.0.2.15.38046 > 151.101.117.67.443: Flags [.], ack 5064, win 62780, length 0
19:30:19.062245 IP 10.0.2.15.38046 > 151.101.117.67.443: Flags [P.], seq 518:611, ack 5064, win 62780, length 93
19:30:19.062698 IP 151.101.117.67.443 > 10.0.2.15.38046: Flags [.], ack 611, win 65535, length 0
19:30:19.076813 IP 151.101.117.67.443 > 10.0.2.15.38046: Flags [P.], seq 5064:5115, ack 611, win 65535, length 51
19:30:19.076832 IP 10.0.2.15.38046 > 151.101.117.67.443: Flags [.], ack 5115, win 62780, length 0
19:30:19.077663 IP 10.0.2.15.38046 > 151.101.117.67.443: Flags [P.], seq 611:664, ack 5115, win 62780, length 53
19:30:19.077696 IP 10.0.2.15.38046 > 151.101.117.67.443: Flags [P.], seq 664:720, ack 5115, win 62780, length 56
19:30:19.077957 IP 151.101.117.67.443 > 10.0.2.15.38046: Flags [.], ack 664, win 65535, length 0
19:30:19.077958 IP 151.101.117.67.443 > 10.0.2.15.38046: Flags [.], ack 720, win 65535, length 0
19:30:19.077975 IP 10.0.2.15.38046 > 151.101.117.67.443: Flags [P.], seq 720:829, ack 5115, win 62780, length 109
19:30:19.078108 IP 151.101.117.67.443 > 10.0.2.15.38046: Flags [.], ack 829, win 65535, length 0
19:30:19.091493 IP 151.101.117.67.443 > 10.0.2.15.38046: Flags [P.], seq 5115:5210, ack 829, win 65535, length 95
19:30:19.091511 IP 10.0.2.15.38046 > 151.101.117.67.443: Flags [.], ack 5210, win 62780, length 0
19:30:19.091638 IP 10.0.2.15.38046 > 151.101.117.67.443: Flags [P.], seq 829:867, ack 5210, win 62780, length 38
19:30:19.091835 IP 151.101.117.67.443 > 10.0.2.15.38046: Flags [.], ack 867, win 65535, length 0
19:30:19.095225 IP 151.101.117.67.443 > 10.0.2.15.38046: Flags [P.], seq 5210:12080, ack 867, win 65535, length 6870
19:30:19.095317 IP 10.0.2.15.38046 > 151.101.117.67.443: Flags [.], ack 12080, win 59860, length 0
19:30:19.096068 IP 151.101.117.67.443 > 10.0.2.15.38046: Flags [P.], seq 12080:14828, ack 867, win 65535, length 2748
19:30:19.096083 IP 10.0.2.15.38046 > 151.101.117.67.443: Flags [.], ack 14828, win 62780, length 0
19:30:19.097539 IP 151.101.117.67.443 > 10.0.2.15.38046: Flags [P.], seq 14828:20324, ack 867, win 65535, length 5496
19:30:19.097618 IP 10.0.2.15.38046 > 151.101.117.67.443: Flags [.], ack 20324, win 61320, length 0
19:30:19.098980 IP 151.101.117.67.443 > 10.0.2.15.38046: Flags [P.], seq 20324:24446, ack 867, win 65535, length 4122
19:30:19.099002 IP 10.0.2.15.38046 > 151.101.117.67.443: Flags [.], ack 24446, win 61320, length 0
19:30:19.099761 IP 151.101.117.67.443 > 10.0.2.15.38046: Flags [P.], seq 24446:28568, ack 867, win 65535, length 4122
19:30:19.099778 IP 10.0.2.15.38046 > 151.101.117.67.443: Flags [.], ack 28568, win 61320, length 0
19:30:19.100998 IP 151.101.117.67.443 > 10.0.2.15.38046: Flags [P.], seq 28568:34064, ack 867, win 65535, length 5496
19:30:19.101018 IP 10.0.2.15.38046 > 151.101.117.67.443: Flags [.], ack 34064, win 61320, length 0
19:30:19.104329 IP 151.101.117.67.443 > 10.0.2.15.38046: Flags [P.], seq 34064:45056, ack 867, win 65535, length 10992
19:30:19.104488 IP 10.0.2.15.38046 > 151.101.117.67.443: Flags [.], ack 45056, win 56940, length 0
19:30:19.105844 IP 151.101.117.67.443 > 10.0.2.15.38046: Flags [P.], seq 45056:47804, ack 867, win 65535, length 2748
19:30:19.105864 IP 10.0.2.15.38046 > 151.101.117.67.443: Flags [.], ack 47804, win 62780, length 0
19:30:19.106003 IP 151.101.117.67.443 > 10.0.2.15.38046: Flags [P.], seq 47804:49178, ack 867, win 65535, length 1374
19:30:19.108699 IP 151.101.117.67.443 > 10.0.2.15.38046: Flags [P.], seq 49178:57422, ack 867, win 65535, length 8244
19:30:19.108789 IP 10.0.2.15.38046 > 151.101.117.67.443: Flags [.], ack 57422, win 58400, length 0
19:30:19.109471 IP 151.101.117.67.443 > 10.0.2.15.38046: Flags [P.], seq 57422:60170, ack 867, win 65535, length 2748
19:30:19.109484 IP 10.0.2.15.38046 > 151.101.117.67.443: Flags [.], ack 60170, win 62780, length 0
19:30:19.110862 IP 151.101.117.67.443 > 10.0.2.15.38046: Flags [P.], seq 60170:69788, ack 867, win 65535, length 9618
19:30:19.110961 IP 10.0.2.15.38046 > 151.101.117.67.443: Flags [.], ack 69788, win 62780, length 0
19:30:19.111713 IP 151.101.117.67.443 > 10.0.2.15.38046: Flags [P.], seq 69788:75284, ack 867, win 65535, length 5496
19:30:19.111729 IP 10.0.2.15.38046 > 151.101.117.67.443: Flags [.], ack 75284, win 65535, length 0
19:30:19.113210 IP 151.101.117.67.443 > 10.0.2.15.38046: Flags [P.], seq 75284:80780, ack 867, win 65535, length 5496
19:30:19.113227 IP 10.0.2.15.38046 > 151.101.117.67.443: Flags [.], ack 80780, win 65535, length 0
19:30:19.113872 IP 151.101.117.67.443 > 10.0.2.15.38046: Flags [P.], seq 80780:89024, ack 867, win 65535, length 8244
19:30:19.113888 IP 10.0.2.15.38046 > 151.101.117.67.443: Flags [.], ack 89024, win 65535, length 0
19:30:19.114234 IP 151.101.117.67.443 > 10.0.2.15.38046: Flags [P.], seq 89024:91772, ack 867, win 65535, length 2748
19:30:19.114235 IP 151.101.117.67.443 > 10.0.2.15.38046: Flags [P.], seq 91772:93146, ack 867, win 65535, length 1374
19:30:19.114288 IP 10.0.2.15.38046 > 151.101.117.67.443: Flags [.], ack 91772, win 65535, length 0
19:30:19.116213 IP 151.101.117.67.443 > 10.0.2.15.38046: Flags [P.], seq 93146:98642, ack 867, win 65535, length 5496
19:30:19.116236 IP 10.0.2.15.38046 > 151.101.117.67.443: Flags [.], ack 98642, win 65535, length 0
19:30:19.116570 IP 151.101.117.67.443 > 10.0.2.15.38046: Flags [P.], seq 98642:102764, ack 867, win 65535, length 4122
19:30:19.116662 IP 10.0.2.15.38046 > 151.101.117.67.443: Flags [.], ack 102764, win 65535, length 0
19:30:19.117186 IP 151.101.117.67.443 > 10.0.2.15.38046: Flags [P.], seq 102764:109634, ack 867, win 65535, length 6870
19:30:19.117199 IP 10.0.2.15.38046 > 151.101.117.67.443: Flags [.], ack 109634, win 65535, length 0
19:30:19.119769 IP 151.101.117.67.443 > 10.0.2.15.38046: Flags [P.], seq 109634:119252, ack 867, win 65535, length 9618
19:30:19.119772 IP 151.101.117.67.443 > 10.0.2.15.38046: Flags [P.], seq 119252:126122, ack 867, win 65535, length 6870
19:30:19.119791 IP 10.0.2.15.38046 > 151.101.117.67.443: Flags [.], ack 119252, win 65535, length 0
19:30:19.119818 IP 10.0.2.15.38046 > 151.101.117.67.443: Flags [.], ack 126122, win 65535, length 0
19:30:19.119892 IP 151.101.117.67.443 > 10.0.2.15.38046: Flags [P.], seq 126122:127496, ack 867, win 65535, length 1374
19:30:19.121045 IP 151.101.117.67.443 > 10.0.2.15.38046: Flags [P.], seq 127496:134366, ack 867, win 65535, length 6870
19:30:19.121062 IP 10.0.2.15.38046 > 151.101.117.67.443: Flags [.], ack 134366, win 65535, length 0
19:30:19.121216 IP 151.101.117.67.443 > 10.0.2.15.38046: Flags [P.], seq 134366:138488, ack 867, win 65535, length 4122
19:30:19.121223 IP 10.0.2.15.38046 > 151.101.117.67.443: Flags [.], ack 138488, win 65535, length 0
19:30:19.122380 IP 151.101.117.67.443 > 10.0.2.15.38046: Flags [P.], seq 138488:145358, ack 867, win 65535, length 6870
19:30:19.122381 IP 151.101.117.67.443 > 10.0.2.15.38046: Flags [P.], seq 145358:148106, ack 867, win 65535, length 2748
19:30:19.122382 IP 151.101.117.67.443 > 10.0.2.15.38046: Flags [P.], seq 148106:150854, ack 867, win 65535, length 2748
19:30:19.122397 IP 10.0.2.15.38046 > 151.101.117.67.443: Flags [.], ack 145358, win 65535, length 0
19:30:19.122421 IP 10.0.2.15.38046 > 151.101.117.67.443: Flags [.], ack 148106, win 65535, length 0
19:30:19.122429 IP 10.0.2.15.38046 > 151.101.117.67.443: Flags [.], ack 150854, win 65535, length 0
19:30:19.123777 IP 151.101.117.67.443 > 10.0.2.15.38046: Flags [P.], seq 150854:160472, ack 867, win 65535, length 9618
19:30:19.123790 IP 10.0.2.15.38046 > 151.101.117.67.443: Flags [.], ack 160472, win 65535, length 0
19:30:19.123991 IP 151.101.117.67.443 > 10.0.2.15.38046: Flags [P.], seq 160472:161846, ack 867, win 65535, length 1374
19:30:19.124603 IP 151.101.117.67.443 > 10.0.2.15.38046: Flags [P.], seq 161846:170090, ack 867, win 65535, length 8244
19:30:19.124616 IP 10.0.2.15.38046 > 151.101.117.67.443: Flags [.], ack 170090, win 65535, length 0
19:30:19.124926 IP 151.101.117.67.443 > 10.0.2.15.38046: Flags [P.], seq 170090:175586, ack 867, win 65535, length 5496
19:30:19.124928 IP 151.101.117.67.443 > 10.0.2.15.38046: Flags [P.], seq 175586:178334, ack 867, win 65535, length 2748
19:30:19.124940 IP 10.0.2.15.38046 > 151.101.117.67.443: Flags [.], ack 175586, win 65535, length 0
19:30:19.124955 IP 10.0.2.15.38046 > 151.101.117.67.443: Flags [.], ack 178334, win 65535, length 0
19:30:19.126362 IP 151.101.117.67.443 > 10.0.2.15.38046: Flags [P.], seq 178334:183830, ack 867, win 65535, length 5496
19:30:19.126366 IP 151.101.117.67.443 > 10.0.2.15.38046: Flags [P.], seq 183830:190700, ack 867, win 65535, length 6870
19:30:19.126389 IP 10.0.2.15.38046 > 151.101.117.67.443: Flags [.], ack 183830, win 65535, length 0
19:30:19.126424 IP 10.0.2.15.38046 > 151.101.117.67.443: Flags [.], ack 190700, win 65535, length 0
19:30:19.126449 IP 151.101.117.67.443 > 10.0.2.15.38046: Flags [P.], seq 190700:192074, ack 867, win 65535, length 1374
19:30:19.127938 IP 151.101.117.67.443 > 10.0.2.15.38046: Flags [P.], seq 192074:197570, ack 867, win 65535, length 5496
19:30:19.127940 IP 151.101.117.67.443 > 10.0.2.15.38046: Flags [P.], seq 197570:200318, ack 867, win 65535, length 2748
19:30:19.127941 IP 151.101.117.67.443 > 10.0.2.15.38046: Flags [P.], seq 200318:203066, ack 867, win 65535, length 2748
19:30:19.127963 IP 10.0.2.15.38046 > 151.101.117.67.443: Flags [.], ack 197570, win 65535, length 0
19:30:19.127996 IP 10.0.2.15.38046 > 151.101.117.67.443: Flags [.], ack 200318, win 65535, length 0
19:30:19.128009 IP 10.0.2.15.38046 > 151.101.117.67.443: Flags [.], ack 203066, win 65535, length 0
19:30:19.128039 IP 151.101.117.67.443 > 10.0.2.15.38046: Flags [P.], seq 203066:205814, ack 867, win 65535, length 2748
19:30:19.128041 IP 151.101.117.67.443 > 10.0.2.15.38046: Flags [P.], seq 205814:209936, ack 867, win 65535, length 4122
19:30:19.128041 IP 151.101.117.67.443 > 10.0.2.15.38046: Flags [P.], seq 209936:211310, ack 867, win 65535, length 1374
19:30:19.128042 IP 151.101.117.67.443 > 10.0.2.15.38046: Flags [P.], seq 211310:215432, ack 867, win 65535, length 4122
19:30:19.128049 IP 10.0.2.15.38046 > 151.101.117.67.443: Flags [.], ack 205814, win 65535, length 0
19:30:19.128062 IP 10.0.2.15.38046 > 151.101.117.67.443: Flags [.], ack 209936, win 65535, length 0
19:30:19.128079 IP 10.0.2.15.38046 > 151.101.117.67.443: Flags [.], ack 215432, win 65535, length 0
19:30:19.129890 IP 151.101.117.67.443 > 10.0.2.15.38046: Flags [P.], seq 215432:225050, ack 867, win 65535, length 9618
19:30:19.129893 IP 151.101.117.67.443 > 10.0.2.15.38046: Flags [P.], seq 225050:227798, ack 867, win 65535, length 2748
19:30:19.129917 IP 10.0.2.15.38046 > 151.101.117.67.443: Flags [.], ack 225050, win 65535, length 0
19:30:19.129990 IP 10.0.2.15.38046 > 151.101.117.67.443: Flags [.], ack 227798, win 65535, length 0
19:30:19.130018 IP 151.101.117.67.443 > 10.0.2.15.38046: Flags [P.], seq 227798:231920, ack 867, win 65535, length 4122
19:30:19.130019 IP 151.101.117.67.443 > 10.0.2.15.38046: Flags [P.], seq 231920:233294, ack 867, win 65535, length 1374
19:30:19.130027 IP 10.0.2.15.38046 > 151.101.117.67.443: Flags [.], ack 231920, win 65535, length 0
19:30:19.131572 IP 151.101.117.67.443 > 10.0.2.15.38046: Flags [P.], seq 233294:244286, ack 867, win 65535, length 10992
19:30:19.131589 IP 10.0.2.15.38046 > 151.101.117.67.443: Flags [.], ack 244286, win 65535, length 0
19:30:19.131619 IP 151.101.117.67.443 > 10.0.2.15.38046: Flags [P.], seq 244286:249782, ack 867, win 65535, length 5496
19:30:19.131620 IP 151.101.117.67.443 > 10.0.2.15.38046: Flags [P.], seq 249782:252530, ack 867, win 65535, length 2748
19:30:19.131627 IP 10.0.2.15.38046 > 151.101.117.67.443: Flags [.], ack 249782, win 65535, length 0
19:30:19.131636 IP 10.0.2.15.38046 > 151.101.117.67.443: Flags [.], ack 252530, win 65535, length 0
19:30:19.132636 IP 151.101.117.67.443 > 10.0.2.15.38046: Flags [P.], seq 252530:259400, ack 867, win 65535, length 6870
19:30:19.132888 IP 151.101.117.67.443 > 10.0.2.15.38046: Flags [P.], seq 259400:264896, ack 867, win 65535, length 5496
19:30:19.133852 IP 151.101.117.67.443 > 10.0.2.15.38046: Flags [P.], seq 264896:273140, ack 867, win 65535, length 8244
19:30:19.134023 IP 151.101.117.67.443 > 10.0.2.15.38046: Flags [P.], seq 273140:281384, ack 867, win 65535, length 8244
19:30:19.135409 IP 151.101.117.67.443 > 10.0.2.15.38046: Flags [P.], seq 281384:284132, ack 867, win 65535, length 2748
19:30:19.135413 IP 151.101.117.67.443 > 10.0.2.15.38046: Flags [P.], seq 284132:289628, ack 867, win 65535, length 5496
19:30:19.137480 IP 10.0.2.15.38046 > 151.101.117.67.443: Flags [.], ack 273140, win 65535, length 0
19:30:19.137905 IP 151.101.117.67.443 > 10.0.2.15.38046: Flags [.], seq 289628:302768, ack 867, win 65535, length 13140
19:30:19.138063 IP 151.101.117.67.443 > 10.0.2.15.38046: Flags [P.], seq 302768:328100, ack 867, win 65535, length 25332
19:30:19.140976 IP 10.0.2.15.38046 > 151.101.117.67.443: Flags [.], ack 289628, win 65535, length 0
19:30:19.141076 IP 10.0.2.15.38046 > 151.101.117.67.443: Flags [.], ack 302768, win 65535, length 0
19:30:19.141721 IP 151.101.117.67.443 > 10.0.2.15.38046: Flags [P.], seq 328100:367520, ack 867, win 65535, length 39420
19:30:19.143013 IP 10.0.2.15.38046 > 151.101.117.67.443: Flags [.], ack 328100, win 65535, length 0
19:30:19.143454 IP 10.0.2.15.38046 > 151.101.117.67.443: Flags [.], ack 367520, win 65535, length 0
19:30:19.143952 IP 151.101.117.67.443 > 10.0.2.15.38046: Flags [P.], seq 367520:400290, ack 867, win 65535, length 32770
19:30:19.143968 IP 10.0.2.15.38046 > 151.101.117.67.443: Flags [.], ack 400290, win 65535, length 0
19:30:19.145455 IP 151.101.117.67.443 > 10.0.2.15.38046: Flags [P.], seq 400290:405786, ack 867, win 65535, length 5496
19:30:19.145457 IP 151.101.117.67.443 > 10.0.2.15.38046: Flags [P.], seq 405786:407160, ack 867, win 65535, length 1374
19:30:19.145522 IP 10.0.2.15.38046 > 151.101.117.67.443: Flags [.], ack 405786, win 65535, length 0
19:30:19.145687 IP 151.101.117.67.443 > 10.0.2.15.38046: Flags [P.], seq 407160:411282, ack 867, win 65535, length 4122
19:30:19.145696 IP 10.0.2.15.38046 > 151.101.117.67.443: Flags [.], ack 411282, win 65535, length 0
19:30:19.145929 IP 151.101.117.67.443 > 10.0.2.15.38046: Flags [P.], seq 411282:416778, ack 867, win 65535, length 5496
19:30:19.145940 IP 10.0.2.15.38046 > 151.101.117.67.443: Flags [.], ack 416778, win 65535, length 0
19:30:19.146071 IP 151.101.117.67.443 > 10.0.2.15.38046: Flags [P.], seq 416778:419526, ack 867, win 65535, length 2748
19:30:19.146079 IP 10.0.2.15.38046 > 151.101.117.67.443: Flags [.], ack 419526, win 65535, length 0
19:30:19.146532 IP 151.101.117.67.443 > 10.0.2.15.38046: Flags [P.], seq 419526:422274, ack 867, win 65535, length 2748
19:30:19.146534 IP 151.101.117.67.443 > 10.0.2.15.38046: Flags [P.], seq 422274:426396, ack 867, win 65535, length 4122
19:30:19.146548 IP 10.0.2.15.38046 > 151.101.117.67.443: Flags [.], ack 422274, win 65535, length 0
19:30:19.146634 IP 10.0.2.15.38046 > 151.101.117.67.443: Flags [.], ack 426396, win 65535, length 0
19:30:19.147534 IP 151.101.117.67.443 > 10.0.2.15.38046: Flags [P.], seq 426396:430518, ack 867, win 65535, length 4122
19:30:19.147536 IP 151.101.117.67.443 > 10.0.2.15.38046: Flags [P.], seq 430518:434640, ack 867, win 65535, length 4122
19:30:19.147536 IP 151.101.117.67.443 > 10.0.2.15.38046: Flags [P.], seq 434640:436014, ack 867, win 65535, length 1374
19:30:19.147537 IP 151.101.117.67.443 > 10.0.2.15.38046: Flags [P.], seq 436014:442884, ack 867, win 65535, length 6870
19:30:19.147552 IP 10.0.2.15.38046 > 151.101.117.67.443: Flags [.], ack 430518, win 65535, length 0
19:30:19.147578 IP 10.0.2.15.38046 > 151.101.117.67.443: Flags [.], ack 434640, win 65535, length 0
19:30:19.147589 IP 10.0.2.15.38046 > 151.101.117.67.443: Flags [.], ack 442884, win 65535, length 0
19:30:19.147616 IP 151.101.117.67.443 > 10.0.2.15.38046: Flags [P.], seq 442884:445632, ack 867, win 65535, length 2748
19:30:19.147617 IP 151.101.117.67.443 > 10.0.2.15.38046: Flags [P.], seq 445632:447006, ack 867, win 65535, length 1374
19:30:19.147623 IP 10.0.2.15.38046 > 151.101.117.67.443: Flags [.], ack 445632, win 65535, length 0
19:30:19.148389 IP 151.101.117.67.443 > 10.0.2.15.38046: Flags [P.], seq 447006:452502, ack 867, win 65535, length 5496
19:30:19.148391 IP 151.101.117.67.443 > 10.0.2.15.38046: Flags [P.], seq 452502:455250, ack 867, win 65535, length 2748
19:30:19.148612 IP 151.101.117.67.443 > 10.0.2.15.38046: Flags [P.], seq 455250:459372, ack 867, win 65535, length 4122
19:30:19.148613 IP 151.101.117.67.443 > 10.0.2.15.38046: Flags [P.], seq 459372:462120, ack 867, win 65535, length 2748
19:30:19.149136 IP 151.101.117.67.443 > 10.0.2.15.38046: Flags [P.], seq 462120:464868, ack 867, win 65535, length 2748
19:30:19.149138 IP 151.101.117.67.443 > 10.0.2.15.38046: Flags [P.], seq 464868:467616, ack 867, win 65535, length 2748
19:30:19.149139 IP 151.101.117.67.443 > 10.0.2.15.38046: Flags [P.], seq 467616:471738, ack 867, win 65535, length 4122
19:30:19.149140 IP 151.101.117.67.443 > 10.0.2.15.38046: Flags [P.], seq 471738:474486, ack 867, win 65535, length 2748
19:30:19.149618 IP 151.101.117.67.443 > 10.0.2.15.38046: Flags [P.], seq 474486:482120, ack 867, win 65535, length 7634
19:30:19.149739 IP 10.0.2.15.38046 > 151.101.117.67.443: Flags [.], ack 471738, win 65535, length 0
19:30:19.150449 IP 151.101.117.67.443 > 10.0.2.15.38046: Flags [P.], seq 482120:490364, ack 867, win 65535, length 8244
19:30:19.150450 IP 151.101.117.67.443 > 10.0.2.15.38046: Flags [P.], seq 490364:491738, ack 867, win 65535, length 1374
19:30:19.150451 IP 151.101.117.67.443 > 10.0.2.15.38046: Flags [P.], seq 491738:493112, ack 867, win 65535, length 1374
19:30:19.150996 IP 151.101.117.67.443 > 10.0.2.15.38046: Flags [P.], seq 493112:499982, ack 867, win 65535, length 6870
19:30:19.151239 IP 151.101.117.67.443 > 10.0.2.15.38046: Flags [.], seq 499982:502902, ack 867, win 65535, length 2920
19:30:19.151337 IP 151.101.117.67.443 > 10.0.2.15.38046: Flags [P.], seq 502902:504104, ack 867, win 65535, length 1202
19:30:19.151338 IP 151.101.117.67.443 > 10.0.2.15.38046: Flags [P.], seq 504104:506852, ack 867, win 65535, length 2748
19:30:19.153427 IP 10.0.2.15.38046 > 151.101.117.67.443: Flags [.], ack 482120, win 65535, length 0
19:30:19.154216 IP 151.101.117.67.443 > 10.0.2.15.38046: Flags [.], seq 506852:546272, ack 867, win 65535, length 39420
19:30:19.160490 IP 10.0.2.15.38046 > 151.101.117.67.443: Flags [.], ack 506852, win 65535, length 0
19:30:19.160720 IP 151.101.117.67.443 > 10.0.2.15.38046: Flags [P.], seq 546272:547732, ack 867, win 65535, length 1460
19:30:19.161086 IP 10.0.2.15.38046 > 151.101.117.67.443: Flags [.], ack 547732, win 65535, length 0
19:30:19.161872 IP 151.101.117.67.443 > 10.0.2.15.38046: Flags [.], seq 547732:611972, ack 867, win 65535, length 64240
19:30:19.161887 IP 10.0.2.15.38046 > 151.101.117.67.443: Flags [.], ack 611972, win 65535, length 0
19:30:19.162054 IP 151.101.117.67.443 > 10.0.2.15.38046: Flags [P.], seq 611972:613432, ack 867, win 65535, length 1460
19:30:19.162146 IP 151.101.117.67.443 > 10.0.2.15.38046: Flags [.], seq 613432:639712, ack 867, win 65535, length 26280
19:30:19.162308 IP 151.101.117.67.443 > 10.0.2.15.38046: Flags [.], seq 639712:665992, ack 867, win 65535, length 26280
19:30:19.162372 IP 10.0.2.15.38046 > 151.101.117.67.443: Flags [.], ack 665992, win 65535, length 0
19:30:19.162816 IP 151.101.117.67.443 > 10.0.2.15.38046: Flags [P.], seq 665992:677672, ack 867, win 65535, length 11680
19:30:19.162851 IP 151.101.117.67.443 > 10.0.2.15.38046: Flags [P.], seq 677672:692342, ack 867, win 65535, length 14670
19:30:19.162861 IP 151.101.117.67.443 > 10.0.2.15.38046: Flags [.], seq 692342:693802, ack 867, win 65535, length 1460
19:30:19.162928 IP 151.101.117.67.443 > 10.0.2.15.38046: Flags [P.], seq 693802:699212, ack 867, win 65535, length 5410
19:30:19.162972 IP 10.0.2.15.38046 > 151.101.117.67.443: Flags [.], ack 699212, win 65535, length 0
19:30:19.165452 IP 151.101.117.67.443 > 10.0.2.15.38046: Flags [P.], seq 699212:706082, ack 867, win 65535, length 6870
19:30:19.165478 IP 10.0.2.15.38046 > 151.101.117.67.443: Flags [.], ack 706082, win 65535, length 0
19:30:19.166201 IP 151.101.117.67.443 > 10.0.2.15.38046: Flags [P.], seq 706082:710204, ack 867, win 65535, length 4122
19:30:19.166205 IP 151.101.117.67.443 > 10.0.2.15.38046: Flags [P.], seq 710204:715700, ack 867, win 65535, length 5496
19:30:19.166206 IP 151.101.117.67.443 > 10.0.2.15.38046: Flags [P.], seq 715700:719822, ack 867, win 65535, length 4122
19:30:19.166225 IP 10.0.2.15.38046 > 151.101.117.67.443: Flags [.], ack 710204, win 65535, length 0
19:30:19.166258 IP 10.0.2.15.38046 > 151.101.117.67.443: Flags [.], ack 715700, win 65535, length 0
19:30:19.166268 IP 10.0.2.15.38046 > 151.101.117.67.443: Flags [.], ack 719822, win 65535, length 0
19:30:19.166290 IP 151.101.117.67.443 > 10.0.2.15.38046: Flags [P.], seq 719822:722570, ack 867, win 65535, length 2748
19:30:19.166290 IP 151.101.117.67.443 > 10.0.2.15.38046: Flags [P.], seq 722570:723944, ack 867, win 65535, length 1374
19:30:19.166291 IP 151.101.117.67.443 > 10.0.2.15.38046: Flags [P.], seq 723944:728066, ack 867, win 65535, length 4122
19:30:19.166296 IP 10.0.2.15.38046 > 151.101.117.67.443: Flags [.], ack 722570, win 65535, length 0
19:30:19.166304 IP 10.0.2.15.38046 > 151.101.117.67.443: Flags [.], ack 728066, win 65535, length 0
19:30:19.167046 IP 151.101.117.67.443 > 10.0.2.15.38046: Flags [P.], seq 728066:732188, ack 867, win 65535, length 4122
19:30:19.167049 IP 151.101.117.67.443 > 10.0.2.15.38046: Flags [.], seq 732188:733648, ack 867, win 65535, length 1460
19:30:19.167066 IP 10.0.2.15.38046 > 151.101.117.67.443: Flags [.], ack 732188, win 65535, length 0
19:30:19.167525 IP 151.101.117.67.443 > 10.0.2.15.38046: Flags [P.], seq 733648:736310, ack 867, win 65535, length 2662
19:30:19.167532 IP 151.101.117.67.443 > 10.0.2.15.38046: Flags [P.], seq 736310:741806, ack 867, win 65535, length 5496
19:30:19.167533 IP 151.101.117.67.443 > 10.0.2.15.38046: Flags [P.], seq 741806:745928, ack 867, win 65535, length 4122
19:30:19.167547 IP 10.0.2.15.38046 > 151.101.117.67.443: Flags [.], ack 736310, win 65535, length 0
19:30:19.167568 IP 10.0.2.15.38046 > 151.101.117.67.443: Flags [.], ack 741806, win 65535, length 0
19:30:19.167579 IP 10.0.2.15.38046 > 151.101.117.67.443: Flags [.], ack 745928, win 65535, length 0
19:30:19.169550 IP 151.101.117.67.443 > 10.0.2.15.38046: Flags [P.], seq 745928:752798, ack 867, win 65535, length 6870
19:30:19.169572 IP 10.0.2.15.38046 > 151.101.117.67.443: Flags [.], ack 752798, win 65535, length 0
19:30:19.170136 IP 151.101.117.67.443 > 10.0.2.15.38046: Flags [P.], seq 752798:756920, ack 867, win 65535, length 4122
19:30:19.170233 IP 151.101.117.67.443 > 10.0.2.15.38046: Flags [P.], seq 756920:759668, ack 867, win 65535, length 2748
19:30:19.170237 IP 151.101.117.67.443 > 10.0.2.15.38046: Flags [P.], seq 759668:762416, ack 867, win 65535, length 2748
19:30:19.170239 IP 151.101.117.67.443 > 10.0.2.15.38046: Flags [P.], seq 762416:766538, ack 867, win 65535, length 4122
19:30:19.170259 IP 10.0.2.15.38046 > 151.101.117.67.443: Flags [.], ack 756920, win 65535, length 0
19:30:19.170459 IP 151.101.117.67.443 > 10.0.2.15.38046: Flags [P.], seq 766538:772034, ack 867, win 65535, length 5496
19:30:19.170524 IP 10.0.2.15.38046 > 151.101.117.67.443: Flags [.], ack 772034, win 65535, length 0
19:30:19.170755 IP 151.101.117.67.443 > 10.0.2.15.38046: Flags [P.], seq 772034:774782, ack 867, win 65535, length 2748
19:30:19.170763 IP 10.0.2.15.38046 > 151.101.117.67.443: Flags [.], ack 774782, win 65535, length 0
19:30:19.171816 IP 151.101.117.67.443 > 10.0.2.15.38046: Flags [P.], seq 774782:785774, ack 867, win 65535, length 10992
19:30:19.171989 IP 151.101.117.67.443 > 10.0.2.15.38046: Flags [P.], seq 785774:789896, ack 867, win 65535, length 4122
19:30:19.172118 IP 151.101.117.67.443 > 10.0.2.15.38046: Flags [P.], seq 789896:795392, ack 867, win 65535, length 5496
19:30:19.172120 IP 151.101.117.67.443 > 10.0.2.15.38046: Flags [P.], seq 795392:799514, ack 867, win 65535, length 4122
19:30:19.172121 IP 151.101.117.67.443 > 10.0.2.15.38046: Flags [P.], seq 799514:802262, ack 867, win 65535, length 2748
19:30:19.172179 IP 10.0.2.15.38046 > 151.101.117.67.443: Flags [.], ack 802262, win 65535, length 0
19:30:19.172353 IP 151.101.117.67.443 > 10.0.2.15.38046: Flags [P.], seq 802262:805010, ack 867, win 65535, length 2748
19:30:19.172365 IP 10.0.2.15.38046 > 151.101.117.67.443: Flags [.], ack 805010, win 65535, length 0
19:30:19.173454 IP 151.101.117.67.443 > 10.0.2.15.38046: Flags [P.], seq 805010:811880, ack 867, win 65535, length 6870
19:30:19.173457 IP 151.101.117.67.443 > 10.0.2.15.38046: Flags [P.], seq 811880:816002, ack 867, win 65535, length 4122
19:30:19.173477 IP 10.0.2.15.38046 > 151.101.117.67.443: Flags [.], ack 811880, win 65535, length 0
19:30:19.173505 IP 10.0.2.15.38046 > 151.101.117.67.443: Flags [.], ack 816002, win 65535, length 0
19:30:19.173533 IP 151.101.117.67.443 > 10.0.2.15.38046: Flags [P.], seq 816002:821498, ack 867, win 65535, length 5496
19:30:19.173538 IP 10.0.2.15.38046 > 151.101.117.67.443: Flags [.], ack 821498, win 65535, length 0
19:30:19.174061 IP 151.101.117.67.443 > 10.0.2.15.38046: Flags [P.], seq 821498:825620, ack 867, win 65535, length 4122
19:30:19.174074 IP 10.0.2.15.38046 > 151.101.117.67.443: Flags [.], ack 825620, win 65535, length 0
19:30:19.174421 IP 151.101.117.67.443 > 10.0.2.15.38046: Flags [P.], seq 825620:829742, ack 867, win 65535, length 4122
19:30:19.174423 IP 151.101.117.67.443 > 10.0.2.15.38046: Flags [P.], seq 829742:832490, ack 867, win 65535, length 2748
19:30:19.174435 IP 10.0.2.15.38046 > 151.101.117.67.443: Flags [.], ack 829742, win 65535, length 0
19:30:19.174451 IP 10.0.2.15.38046 > 151.101.117.67.443: Flags [.], ack 832490, win 65535, length 0
19:30:19.174811 IP 151.101.117.67.443 > 10.0.2.15.38046: Flags [P.], seq 832490:835238, ack 867, win 65535, length 2748
19:30:19.174813 IP 151.101.117.67.443 > 10.0.2.15.38046: Flags [P.], seq 835238:837986, ack 867, win 65535, length 2748
19:30:19.174815 IP 151.101.117.67.443 > 10.0.2.15.38046: Flags [P.], seq 837986:842108, ack 867, win 65535, length 4122
19:30:19.174815 IP 151.101.117.67.443 > 10.0.2.15.38046: Flags [P.], seq 842108:843482, ack 867, win 65535, length 1374
19:30:19.174828 IP 10.0.2.15.38046 > 151.101.117.67.443: Flags [.], ack 835238, win 65535, length 0
19:30:19.174852 IP 10.0.2.15.38046 > 151.101.117.67.443: Flags [.], ack 837986, win 65535, length 0
19:30:19.174866 IP 10.0.2.15.38046 > 151.101.117.67.443: Flags [.], ack 842108, win 65535, length 0
19:30:19.175066 IP 151.101.117.67.443 > 10.0.2.15.38046: Flags [P.], seq 843482:847604, ack 867, win 65535, length 4122
19:30:19.175068 IP 151.101.117.67.443 > 10.0.2.15.38046: Flags [P.], seq 847604:850352, ack 867, win 65535, length 2748
19:30:19.175079 IP 10.0.2.15.38046 > 151.101.117.67.443: Flags [.], ack 847604, win 65535, length 0
19:30:19.175103 IP 10.0.2.15.38046 > 151.101.117.67.443: Flags [.], ack 850352, win 65535, length 0
19:30:19.175410 IP 151.101.117.67.443 > 10.0.2.15.38046: Flags [P.], seq 850352:854474, ack 867, win 65535, length 4122
19:30:19.175420 IP 10.0.2.15.38046 > 151.101.117.67.443: Flags [.], ack 854474, win 65535, length 0
19:30:19.175548 IP 151.101.117.67.443 > 10.0.2.15.38046: Flags [P.], seq 854474:857222, ack 867, win 65535, length 2748
19:30:19.175549 IP 151.101.117.67.443 > 10.0.2.15.38046: Flags [P.], seq 857222:858596, ack 867, win 65535, length 1374
19:30:19.175558 IP 10.0.2.15.38046 > 151.101.117.67.443: Flags [.], ack 857222, win 65535, length 0
19:30:19.176424 IP 151.101.117.67.443 > 10.0.2.15.38046: Flags [P.], seq 858596:866840, ack 867, win 65535, length 8244
19:30:19.176427 IP 151.101.117.67.443 > 10.0.2.15.38046: Flags [P.], seq 866840:868214, ack 867, win 65535, length 1374
19:30:19.176448 IP 10.0.2.15.38046 > 151.101.117.67.443: Flags [.], ack 866840, win 65535, length 0
19:30:19.176843 IP 151.101.117.67.443 > 10.0.2.15.38046: Flags [P.], seq 868214:869588, ack 867, win 65535, length 1374
19:30:19.176853 IP 10.0.2.15.38046 > 151.101.117.67.443: Flags [.], ack 869588, win 65535, length 0
19:30:19.178538 IP 151.101.117.67.443 > 10.0.2.15.38046: Flags [P.], seq 869588:875084, ack 867, win 65535, length 5496
19:30:19.178541 IP 151.101.117.67.443 > 10.0.2.15.38046: Flags [P.], seq 875084:877832, ack 867, win 65535, length 2748
19:30:19.178542 IP 151.101.117.67.443 > 10.0.2.15.38046: Flags [P.], seq 877832:880580, ack 867, win 65535, length 2748
19:30:19.178600 IP 10.0.2.15.38046 > 151.101.117.67.443: Flags [.], ack 875084, win 65535, length 0
19:30:19.178705 IP 10.0.2.15.38046 > 151.101.117.67.443: Flags [.], ack 877832, win 65535, length 0
19:30:19.178797 IP 10.0.2.15.38046 > 151.101.117.67.443: Flags [.], ack 880580, win 65535, length 0
19:30:19.178993 IP 151.101.117.67.443 > 10.0.2.15.38046: Flags [P.], seq 880580:884702, ack 867, win 65535, length 4122
19:30:19.178996 IP 151.101.117.67.443 > 10.0.2.15.38046: Flags [P.], seq 884702:890198, ack 867, win 65535, length 5496
19:30:19.178997 IP 151.101.117.67.443 > 10.0.2.15.38046: Flags [P.], seq 890198:894320, ack 867, win 65535, length 4122
19:30:19.179009 IP 10.0.2.15.38046 > 151.101.117.67.443: Flags [.], ack 884702, win 65535, length 0
19:30:19.179027 IP 10.0.2.15.38046 > 151.101.117.67.443: Flags [.], ack 890198, win 65535, length 0
19:30:19.179040 IP 10.0.2.15.38046 > 151.101.117.67.443: Flags [.], ack 894320, win 65535, length 0
19:30:19.179057 IP 151.101.117.67.443 > 10.0.2.15.38046: Flags [P.], seq 894320:898442, ack 867, win 65535, length 4122
19:30:19.179059 IP 151.101.117.67.443 > 10.0.2.15.38046: Flags [P.], seq 898442:902564, ack 867, win 65535, length 4122
19:30:19.179060 IP 151.101.117.67.443 > 10.0.2.15.38046: Flags [P.], seq 902564:903938, ack 867, win 65535, length 1374
19:30:19.179061 IP 151.101.117.67.443 > 10.0.2.15.38046: Flags [P.], seq 903938:909434, ack 867, win 65535, length 5496
19:30:19.179068 IP 10.0.2.15.38046 > 151.101.117.67.443: Flags [.], ack 898442, win 65535, length 0
19:30:19.179087 IP 10.0.2.15.38046 > 151.101.117.67.443: Flags [.], ack 902564, win 65535, length 0
19:30:19.179100 IP 10.0.2.15.38046 > 151.101.117.67.443: Flags [.], ack 909434, win 65535, length 0
19:30:19.179692 IP 151.101.117.67.443 > 10.0.2.15.38046: Flags [P.], seq 909434:914930, ack 867, win 65535, length 5496
19:30:19.179694 IP 151.101.117.67.443 > 10.0.2.15.38046: Flags [P.], seq 914930:917678, ack 867, win 65535, length 2748
19:30:19.179709 IP 10.0.2.15.38046 > 151.101.117.67.443: Flags [.], ack 914930, win 65535, length 0
19:30:19.179773 IP 10.0.2.15.38046 > 151.101.117.67.443: Flags [.], ack 917678, win 65535, length 0
19:30:19.179948 IP 151.101.117.67.443 > 10.0.2.15.38046: Flags [P.], seq 917678:920426, ack 867, win 65535, length 2748
19:30:19.179957 IP 10.0.2.15.38046 > 151.101.117.67.443: Flags [.], ack 920426, win 65535, length 0
19:30:19.180651 IP 151.101.117.67.443 > 10.0.2.15.38046: Flags [P.], seq 920426:925922, ack 867, win 65535, length 5496
19:30:19.180652 IP 151.101.117.67.443 > 10.0.2.15.38046: Flags [P.], seq 925922:930044, ack 867, win 65535, length 4122
19:30:19.180653 IP 151.101.117.67.443 > 10.0.2.15.38046: Flags [P.], seq 930044:932792, ack 867, win 65535, length 2748
19:30:19.180666 IP 10.0.2.15.38046 > 151.101.117.67.443: Flags [.], ack 925922, win 65535, length 0
19:30:19.180720 IP 10.0.2.15.38046 > 151.101.117.67.443: Flags [.], ack 930044, win 65535, length 0
19:30:19.180729 IP 10.0.2.15.38046 > 151.101.117.67.443: Flags [.], ack 932792, win 65535, length 0
19:30:19.180743 IP 151.101.117.67.443 > 10.0.2.15.38046: Flags [P.], seq 932792:934166, ack 867, win 65535, length 1374
19:30:19.181608 IP 151.101.117.67.443 > 10.0.2.15.38046: Flags [P.], seq 934166:939662, ack 867, win 65535, length 5496
19:30:19.181611 IP 151.101.117.67.443 > 10.0.2.15.38046: Flags [P.], seq 939662:942410, ack 867, win 65535, length 2748
19:30:19.181612 IP 151.101.117.67.443 > 10.0.2.15.38046: Flags [P.], seq 942410:946532, ack 867, win 65535, length 4122
19:30:19.181629 IP 10.0.2.15.38046 > 151.101.117.67.443: Flags [.], ack 939662, win 65535, length 0
19:30:19.181661 IP 10.0.2.15.38046 > 151.101.117.67.443: Flags [.], ack 942410, win 65535, length 0
19:30:19.181678 IP 10.0.2.15.38046 > 151.101.117.67.443: Flags [.], ack 946532, win 65535, length 0
19:30:19.181701 IP 151.101.117.67.443 > 10.0.2.15.38046: Flags [.], seq 946532:947992, ack 867, win 65535, length 1460
19:30:19.182098 IP 151.101.117.67.443 > 10.0.2.15.38046: Flags [P.], seq 947992:949280, ack 867, win 65535, length 1288
19:30:19.182100 IP 151.101.117.67.443 > 10.0.2.15.38046: Flags [P.], seq 949280:953402, ack 867, win 65535, length 4122
19:30:19.182101 IP 151.101.117.67.443 > 10.0.2.15.38046: Flags [P.], seq 953402:956150, ack 867, win 65535, length 2748
19:30:19.182102 IP 151.101.117.67.443 > 10.0.2.15.38046: Flags [P.], seq 956150:958898, ack 867, win 65535, length 2748
19:30:19.182116 IP 10.0.2.15.38046 > 151.101.117.67.443: Flags [.], ack 949280, win 65535, length 0
19:30:19.182148 IP 10.0.2.15.38046 > 151.101.117.67.443: Flags [.], ack 953402, win 65535, length 0
19:30:19.182164 IP 10.0.2.15.38046 > 151.101.117.67.443: Flags [.], ack 956150, win 65535, length 0
19:30:19.182176 IP 10.0.2.15.38046 > 151.101.117.67.443: Flags [.], ack 958898, win 65535, length 0
19:30:19.182283 IP 151.101.117.67.443 > 10.0.2.15.38046: Flags [P.], seq 958898:961646, ack 867, win 65535, length 2748
19:30:19.182291 IP 10.0.2.15.38046 > 151.101.117.67.443: Flags [.], ack 961646, win 65535, length 0
19:30:19.182543 IP 151.101.117.67.443 > 10.0.2.15.38046: Flags [P.], seq 961646:965768, ack 867, win 65535, length 4122
19:30:19.182551 IP 10.0.2.15.38046 > 151.101.117.67.443: Flags [.], ack 965768, win 65535, length 0
19:30:19.183132 IP 151.101.117.67.443 > 10.0.2.15.38046: Flags [P.], seq 965768:967142, ack 867, win 65535, length 1374
19:30:19.183134 IP 151.101.117.67.443 > 10.0.2.15.38046: Flags [P.], seq 967142:971264, ack 867, win 65535, length 4122
19:30:19.183135 IP 151.101.117.67.443 > 10.0.2.15.38046: Flags [P.], seq 971264:974012, ack 867, win 65535, length 2748
19:30:19.183158 IP 10.0.2.15.38046 > 151.101.117.67.443: Flags [.], ack 971264, win 65535, length 0
19:30:19.183182 IP 10.0.2.15.38046 > 151.101.117.67.443: Flags [.], ack 974012, win 65535, length 0
19:30:19.183837 IP 151.101.117.67.443 > 10.0.2.15.38046: Flags [P.], seq 974012:979508, ack 867, win 65535, length 5496
19:30:19.183894 IP 10.0.2.15.38046 > 151.101.117.67.443: Flags [.], ack 979508, win 65535, length 0

