00:11:10.765180 IP 151.101.117.67.443 > 10.0.2.15.37844: Flags [S.], seq 63040001, ack 2280805450, win 65535, options [mss 1460], length 0
00:11:10.765387 IP 10.0.2.15.37844 > 151.101.117.67.443: Flags [.], ack 1, win 64240, length 0
00:11:10.791543 IP 10.0.2.15.37844 > 151.101.117.67.443: Flags [P.], seq 1:518, ack 1, win 64240, length 517
00:11:10.792003 IP 151.101.117.67.443 > 10.0.2.15.37844: Flags [.], ack 518, win 65535, length 0
00:11:10.814503 IP 151.101.117.67.443 > 10.0.2.15.37844: Flags [.], seq 1:2921, ack 518, win 65535, length 2920
00:11:10.814539 IP 10.0.2.15.37844 > 151.101.117.67.443: Flags [.], ack 2921, win 62780, length 0
00:11:10.814813 IP 151.101.117.67.443 > 10.0.2.15.37844: Flags [P.], seq 2921:5064, ack 518, win 65535, length 2143
00:11:10.814833 IP 10.0.2.15.37844 > 151.101.117.67.443: Flags [.], ack 5064, win 61320, length 0
00:11:10.818488 IP 10.0.2.15.37844 > 151.101.117.67.443: Flags [P.], seq 518:611, ack 5064, win 62780, length 93
00:11:10.818953 IP 151.101.117.67.443 > 10.0.2.15.37844: Flags [.], ack 611, win 65535, length 0
00:11:10.834874 IP 151.101.117.67.443 > 10.0.2.15.37844: Flags [P.], seq 5064:5115, ack 611, win 65535, length 51
00:11:10.835140 IP 10.0.2.15.37844 > 151.101.117.67.443: Flags [.], ack 5115, win 62780, length 0
00:11:10.835902 IP 10.0.2.15.37844 > 151.101.117.67.443: Flags [P.], seq 611:664, ack 5115, win 62780, length 53
00:11:10.835946 IP 10.0.2.15.37844 > 151.101.117.67.443: Flags [P.], seq 664:720, ack 5115, win 62780, length 56
00:11:10.836167 IP 10.0.2.15.37844 > 151.101.117.67.443: Flags [P.], seq 720:762, ack 5115, win 62780, length 42
00:11:10.836414 IP 151.101.117.67.443 > 10.0.2.15.37844: Flags [.], ack 664, win 65535, length 0
00:11:10.836415 IP 151.101.117.67.443 > 10.0.2.15.37844: Flags [.], ack 720, win 65535, length 0
00:11:10.836485 IP 10.0.2.15.37844 > 151.101.117.67.443: Flags [P.], seq 762:829, ack 5115, win 62780, length 67
00:11:10.836624 IP 151.101.117.67.443 > 10.0.2.15.37844: Flags [.], ack 762, win 65535, length 0
00:11:10.836721 IP 151.101.117.67.443 > 10.0.2.15.37844: Flags [.], ack 829, win 65535, length 0
00:11:10.849855 IP 151.101.117.67.443 > 10.0.2.15.37844: Flags [P.], seq 5115:5181, ack 829, win 65535, length 66
00:11:10.849875 IP 10.0.2.15.37844 > 151.101.117.67.443: Flags [.], ack 5181, win 62780, length 0
00:11:10.850081 IP 10.0.2.15.37844 > 151.101.117.67.443: Flags [P.], seq 829:867, ack 5181, win 62780, length 38
00:11:10.850391 IP 151.101.117.67.443 > 10.0.2.15.37844: Flags [.], ack 867, win 65535, length 0
00:11:10.853858 IP 151.101.117.67.443 > 10.0.2.15.37844: Flags [P.], seq 5181:10677, ack 867, win 65535, length 5496
00:11:10.853996 IP 10.0.2.15.37844 > 151.101.117.67.443: Flags [.], ack 10677, win 61320, length 0
00:11:10.855078 IP 151.101.117.67.443 > 10.0.2.15.37844: Flags [P.], seq 10677:13425, ack 867, win 65535, length 2748
00:11:10.855098 IP 10.0.2.15.37844 > 151.101.117.67.443: Flags [.], ack 13425, win 62780, length 0
00:11:10.856253 IP 151.101.117.67.443 > 10.0.2.15.37844: Flags [P.], seq 13425:16173, ack 867, win 65535, length 2748
00:11:10.856270 IP 10.0.2.15.37844 > 151.101.117.67.443: Flags [.], ack 16173, win 62780, length 0
00:11:10.857150 IP 151.101.117.67.443 > 10.0.2.15.37844: Flags [P.], seq 16173:18921, ack 867, win 65535, length 2748
00:11:10.857174 IP 10.0.2.15.37844 > 151.101.117.67.443: Flags [.], ack 18921, win 62780, length 0
00:11:10.866940 IP 151.101.117.67.443 > 10.0.2.15.37844: Flags [P.], seq 18921:27165, ack 867, win 65535, length 8244
00:11:10.866943 IP 151.101.117.67.443 > 10.0.2.15.37844: Flags [P.], seq 27165:29913, ack 867, win 65535, length 2748
00:11:10.867221 IP 10.0.2.15.37844 > 151.101.117.67.443: Flags [.], ack 29913, win 56940, length 0
00:11:10.867477 IP 151.101.117.67.443 > 10.0.2.15.37844: Flags [.], seq 29913:35753, ack 867, win 65535, length 5840
00:11:10.867726 IP 151.101.117.67.443 > 10.0.2.15.37844: Flags [P.], seq 35753:40905, ack 867, win 65535, length 5152
00:11:10.867802 IP 10.0.2.15.37844 > 151.101.117.67.443: Flags [.], ack 40905, win 49640, length 0
00:11:10.868430 IP 151.101.117.67.443 > 10.0.2.15.37844: Flags [P.], seq 40905:43653, ack 867, win 65535, length 2748
00:11:10.868446 IP 10.0.2.15.37844 > 151.101.117.67.443: Flags [.], ack 43653, win 62780, length 0
00:11:10.870184 IP 151.101.117.67.443 > 10.0.2.15.37844: Flags [P.], seq 43653:49149, ack 867, win 65535, length 5496
00:11:10.870289 IP 10.0.2.15.37844 > 151.101.117.67.443: Flags [.], ack 49149, win 61320, length 0
00:11:10.872588 IP 151.101.117.67.443 > 10.0.2.15.37844: Flags [P.], seq 49149:57393, ack 867, win 65535, length 8244
00:11:10.872868 IP 151.101.117.67.443 > 10.0.2.15.37844: Flags [P.], seq 57393:60141, ack 867, win 65535, length 2748
00:11:10.872974 IP 10.0.2.15.37844 > 151.101.117.67.443: Flags [.], ack 60141, win 56940, length 0
00:11:10.873212 IP 151.101.117.67.443 > 10.0.2.15.37844: Flags [P.], seq 60141:64263, ack 867, win 65535, length 4122
00:11:10.873353 IP 10.0.2.15.37844 > 151.101.117.67.443: Flags [.], ack 64263, win 54020, length 0
00:11:10.873873 IP 151.101.117.67.443 > 10.0.2.15.37844: Flags [P.], seq 64263:68385, ack 867, win 65535, length 4122
00:11:10.873892 IP 10.0.2.15.37844 > 151.101.117.67.443: Flags [.], ack 68385, win 61320, length 0
00:11:10.882085 IP 151.101.117.67.443 > 10.0.2.15.37844: Flags [P.], seq 68385:72507, ack 867, win 65535, length 4122
00:11:10.882097 IP 151.101.117.67.443 > 10.0.2.15.37844: Flags [P.], seq 72507:90369, ack 867, win 65535, length 17862
00:11:10.886123 IP 10.0.2.15.37844 > 151.101.117.67.443: Flags [.], ack 72507, win 65535, length 0
00:11:10.886181 IP 10.0.2.15.37844 > 151.101.117.67.443: Flags [.], ack 90369, win 65535, length 0
00:11:10.886223 IP 151.101.117.67.443 > 10.0.2.15.37844: Flags [.], seq 90369:91829, ack 867, win 65535, length 1460
00:11:10.890587 IP 151.101.117.67.443 > 10.0.2.15.37844: Flags [.], seq 91829:118109, ack 867, win 65535, length 26280
00:11:10.896654 IP 10.0.2.15.37844 > 151.101.117.67.443: Flags [.], ack 118109, win 65535, length 0
00:11:10.903320 IP 151.101.117.67.443 > 10.0.2.15.37844: Flags [P.], seq 118109:133653, ack 867, win 65535, length 15544
00:11:10.903346 IP 10.0.2.15.37844 > 151.101.117.67.443: Flags [.], ack 133653, win 65535, length 0
00:11:10.903411 IP 151.101.117.67.443 > 10.0.2.15.37844: Flags [.], seq 133653:146793, ack 867, win 65535, length 13140
00:11:10.903418 IP 10.0.2.15.37844 > 151.101.117.67.443: Flags [.], ack 146793, win 65535, length 0
00:11:10.903542 IP 151.101.117.67.443 > 10.0.2.15.37844: Flags [.], seq 146793:148253, ack 867, win 65535, length 1460
00:11:10.903664 IP 151.101.117.67.443 > 10.0.2.15.37844: Flags [.], seq 148253:154093, ack 867, win 65535, length 5840
00:11:10.903672 IP 10.0.2.15.37844 > 151.101.117.67.443: Flags [.], ack 154093, win 65535, length 0
00:11:10.904162 IP 151.101.117.67.443 > 10.0.2.15.37844: Flags [.], seq 154093:159933, ack 867, win 65535, length 5840
00:11:10.904179 IP 10.0.2.15.37844 > 151.101.117.67.443: Flags [.], ack 159933, win 65535, length 0
00:11:10.904450 IP 151.101.117.67.443 > 10.0.2.15.37844: Flags [.], seq 159933:175993, ack 867, win 65535, length 16060
00:11:10.904463 IP 10.0.2.15.37844 > 151.101.117.67.443: Flags [.], ack 175993, win 65535, length 0
00:11:10.909901 IP 151.101.117.67.443 > 10.0.2.15.37844: Flags [P.], seq 175993:183293, ack 867, win 65535, length 7300
00:11:10.909908 IP 151.101.117.67.443 > 10.0.2.15.37844: Flags [.], seq 183293:199353, ack 867, win 65535, length 16060
00:11:10.909935 IP 10.0.2.15.37844 > 151.101.117.67.443: Flags [.], ack 183293, win 65535, length 0
00:11:10.917772 IP 10.0.2.15.37844 > 151.101.117.67.443: Flags [.], ack 199353, win 65535, length 0
00:11:10.918443 IP 151.101.117.67.443 > 10.0.2.15.37844: Flags [.], seq 199353:212493, ack 867, win 65535, length 13140
00:11:10.918704 IP 10.0.2.15.37844 > 151.101.117.67.443: Flags [.], ack 212493, win 65535, length 0
00:11:10.940730 IP 151.101.117.67.443 > 10.0.2.15.37844: Flags [P.], seq 212493:219793, ack 867, win 65535, length 7300
00:11:10.940735 IP 151.101.117.67.443 > 10.0.2.15.37844: Flags [.], seq 219793:221253, ack 867, win 65535, length 1460
00:11:10.940760 IP 10.0.2.15.37844 > 151.101.117.67.443: Flags [.], ack 219793, win 65535, length 0
00:11:10.946763 IP 151.101.117.67.443 > 10.0.2.15.37844: Flags [.], seq 221253:262133, ack 867, win 65535, length 40880
00:11:10.946785 IP 10.0.2.15.37844 > 151.101.117.67.443: Flags [.], ack 262133, win 65535, length 0
00:11:10.947333 IP 151.101.117.67.443 > 10.0.2.15.37844: Flags [P.], seq 262133:278193, ack 867, win 65535, length 16060
00:11:10.947537 IP 10.0.2.15.37844 > 151.101.117.67.443: Flags [.], ack 278193, win 65535, length 0
00:11:10.947704 IP 151.101.117.67.443 > 10.0.2.15.37844: Flags [.], seq 278193:305933, ack 867, win 65535, length 27740
00:11:10.947720 IP 10.0.2.15.37844 > 151.101.117.67.443: Flags [.], ack 305933, win 65535, length 0
00:11:10.948044 IP 151.101.117.67.443 > 10.0.2.15.37844: Flags [P.], seq 305933:327833, ack 867, win 65535, length 21900
00:11:10.948061 IP 10.0.2.15.37844 > 151.101.117.67.443: Flags [.], ack 327833, win 65535, length 0
00:11:10.948224 IP 151.101.117.67.443 > 10.0.2.15.37844: Flags [.], seq 327833:358493, ack 867, win 65535, length 30660
00:11:10.948269 IP 10.0.2.15.37844 > 151.101.117.67.443: Flags [.], ack 358493, win 65535, length 0
00:11:10.948358 IP 151.101.117.67.443 > 10.0.2.15.37844: Flags [P.], seq 358493:371633, ack 867, win 65535, length 13140
00:11:10.948364 IP 10.0.2.15.37844 > 151.101.117.67.443: Flags [.], ack 371633, win 65535, length 0
00:11:10.949363 IP 151.101.117.67.443 > 10.0.2.15.37844: Flags [.], seq 371633:422733, ack 867, win 65535, length 51100
00:11:10.949468 IP 10.0.2.15.37844 > 151.101.117.67.443: Flags [.], ack 422733, win 65535, length 0
00:11:10.967254 IP 151.101.117.67.443 > 10.0.2.15.37844: Flags [P.], seq 422733:424193, ack 867, win 65535, length 1460
00:11:10.967269 IP 151.101.117.67.443 > 10.0.2.15.37844: Flags [.], seq 424193:475293, ack 867, win 65535, length 51100
00:11:10.967299 IP 10.0.2.15.37844 > 151.101.117.67.443: Flags [.], ack 475293, win 65535, length 0
00:11:10.967758 IP 151.101.117.67.443 > 10.0.2.15.37844: Flags [P.], seq 475293:488433, ack 867, win 65535, length 13140
00:11:10.967774 IP 10.0.2.15.37844 > 151.101.117.67.443: Flags [.], ack 488433, win 65535, length 0
00:11:10.968299 IP 151.101.117.67.443 > 10.0.2.15.37844: Flags [P.], seq 488433:540993, ack 867, win 65535, length 52560
00:11:10.968327 IP 10.0.2.15.37844 > 151.101.117.67.443: Flags [.], ack 540993, win 65535, length 0
00:11:10.969973 IP 151.101.117.67.443 > 10.0.2.15.37844: Flags [.], seq 540993:597933, ack 867, win 65535, length 56940
00:11:10.970001 IP 10.0.2.15.37844 > 151.101.117.67.443: Flags [.], ack 597933, win 65535, length 0
00:11:10.971624 IP 151.101.117.67.443 > 10.0.2.15.37844: Flags [P.], seq 597933:606693, ack 867, win 65535, length 8760
00:11:10.972558 IP 151.101.117.67.443 > 10.0.2.15.37844: Flags [.], seq 606693:656333, ack 867, win 65535, length 49640
00:11:10.979734 IP 10.0.2.15.37844 > 151.101.117.67.443: Flags [.], ack 656333, win 65535, length 0
00:11:10.980069 IP 151.101.117.67.443 > 10.0.2.15.37844: Flags [P.], seq 656333:663633, ack 867, win 65535, length 7300
00:11:10.980351 IP 151.101.117.67.443 > 10.0.2.15.37844: Flags [.], seq 663633:694293, ack 867, win 65535, length 30660
00:11:10.980538 IP 151.101.117.67.443 > 10.0.2.15.37844: Flags [.], seq 694293:716193, ack 867, win 65535, length 21900
00:11:10.980738 IP 10.0.2.15.37844 > 151.101.117.67.443: Flags [.], ack 716193, win 65535, length 0
00:11:10.980941 IP 151.101.117.67.443 > 10.0.2.15.37844: Flags [P.], seq 716193:722033, ack 867, win 65535, length 5840
00:11:10.981024 IP 10.0.2.15.37844 > 151.101.117.67.443: Flags [.], ack 722033, win 65535, length 0
00:11:10.981396 IP 151.101.117.67.443 > 10.0.2.15.37844: Flags [P.], seq 722033:781893, ack 867, win 65535, length 59860
00:11:10.981471 IP 10.0.2.15.37844 > 151.101.117.67.443: Flags [.], ack 781893, win 65535, length 0
00:11:10.981816 IP 151.101.117.67.443 > 10.0.2.15.37844: Flags [.], seq 781893:803793, ack 867, win 65535, length 21900
00:11:10.983050 IP 151.101.117.67.443 > 10.0.2.15.37844: Flags [.], seq 803793:846133, ack 867, win 65535, length 42340
00:11:10.983216 IP 10.0.2.15.37844 > 151.101.117.67.443: Flags [.], ack 846133, win 65535, length 0
00:11:10.983457 IP 151.101.117.67.443 > 10.0.2.15.37844: Flags [P.], seq 846133:847593, ack 867, win 65535, length 1460
00:11:10.984560 IP 151.101.117.67.443 > 10.0.2.15.37844: Flags [.], seq 847593:910373, ack 867, win 65535, length 62780
00:11:10.984582 IP 10.0.2.15.37844 > 151.101.117.67.443: Flags [.], ack 910373, win 65535, length 0
00:11:10.985904 IP 151.101.117.67.443 > 10.0.2.15.37844: Flags [P.], seq 910373:911833, ack 867, win 65535, length 1460
00:11:10.985915 IP 151.101.117.67.443 > 10.0.2.15.37844: Flags [.], seq 911833:952713, ack 867, win 65535, length 40880
00:11:10.985941 IP 10.0.2.15.37844 > 151.101.117.67.443: Flags [.], ack 952713, win 65535, length 0
00:11:10.986134 IP 151.101.117.67.443 > 10.0.2.15.37844: Flags [P.], seq 952713:976073, ack 867, win 65535, length 23360

