19:30:29.827691 IP 10.0.2.15.36707 > 140.233.253.2.53: 46307+ A? www.cnn.com. (29)
19:30:29.827737 IP 10.0.2.15.36707 > 140.233.253.2.53: 15841+ AAAA? www.cnn.com. (29)
19:30:29.833406 IP 140.233.253.2.53 > 10.0.2.15.36707: 46307 2/0/0 CNAME turner-tls.map.fastly.net., A 151.101.117.67 (84)
19:30:29.833409 IP 140.233.253.2.53 > 10.0.2.15.36707: 15841 2/0/0 CNAME turner-tls.map.fastly.net., AAAA 2a04:4e42:1c::323 (96)
19:30:29.834360 IP 10.0.2.15.38050 > 151.101.117.67.443: Flags [S], seq 3838006628, win 64240, options [mss 1460,sackOK,TS val 1396748807 ecr 0,nop,wscale 6], length 0
19:30:29.849907 IP 151.101.117.67.443 > 10.0.2.15.38050: Flags [S.], seq 169856001, ack 3838006629, win 65535, options [mss 1460], length 0
19:30:29.849955 IP 10.0.2.15.38050 > 151.101.117.67.443: Flags [.], ack 1, win 64240, length 0
19:30:29.859024 IP 10.0.2.15.38050 > 151.101.117.67.443: Flags [P.], seq 1:518, ack 1, win 64240, length 517
19:30:29.859271 IP 151.101.117.67.443 > 10.0.2.15.38050: Flags [.], ack 518, win 65535, length 0
19:30:29.877010 IP 151.101.117.67.443 > 10.0.2.15.38050: Flags [.], seq 1:2921, ack 518, win 65535, length 2920
19:30:29.877032 IP 10.0.2.15.38050 > 151.101.117.67.443: Flags [.], ack 2921, win 62780, length 0
19:30:29.877401 IP 151.101.117.67.443 > 10.0.2.15.38050: Flags [P.], seq 2921:4123, ack 518, win 65535, length 1202
19:30:29.877546 IP 10.0.2.15.38050 > 151.101.117.67.443: Flags [.], ack 4123, win 61578, length 0
19:30:29.877761 IP 151.101.117.67.443 > 10.0.2.15.38050: Flags [P.], seq 4123:5064, ack 518, win 65535, length 941
19:30:29.877770 IP 10.0.2.15.38050 > 151.101.117.67.443: Flags [.], ack 5064, win 61320, length 0
19:30:29.879131 IP 10.0.2.15.38050 > 151.101.117.67.443: Flags [P.], seq 518:611, ack 5064, win 62780, length 93
19:30:29.879478 IP 151.101.117.67.443 > 10.0.2.15.38050: Flags [.], ack 611, win 65535, length 0
19:30:29.895093 IP 151.101.117.67.443 > 10.0.2.15.38050: Flags [P.], seq 5064:5115, ack 611, win 65535, length 51
19:30:29.895114 IP 10.0.2.15.38050 > 151.101.117.67.443: Flags [.], ack 5115, win 62780, length 0
19:30:29.895610 IP 10.0.2.15.38050 > 151.101.117.67.443: Flags [P.], seq 611:664, ack 5115, win 62780, length 53
19:30:29.895648 IP 10.0.2.15.38050 > 151.101.117.67.443: Flags [P.], seq 664:720, ack 5115, win 62780, length 56
19:30:29.895912 IP 10.0.2.15.38050 > 151.101.117.67.443: Flags [P.], seq 720:829, ack 5115, win 62780, length 109
19:30:29.896340 IP 151.101.117.67.443 > 10.0.2.15.38050: Flags [.], ack 664, win 65535, length 0
19:30:29.896342 IP 151.101.117.67.443 > 10.0.2.15.38050: Flags [.], ack 720, win 65535, length 0
19:30:29.896485 IP 151.101.117.67.443 > 10.0.2.15.38050: Flags [.], ack 829, win 65535, length 0
19:30:29.908920 IP 151.101.117.67.443 > 10.0.2.15.38050: Flags [P.], seq 5115:5172, ack 829, win 65535, length 57
19:30:29.908943 IP 10.0.2.15.38050 > 151.101.117.67.443: Flags [.], ack 5172, win 62780, length 0
19:30:29.909257 IP 10.0.2.15.38050 > 151.101.117.67.443: Flags [P.], seq 829:867, ack 5172, win 62780, length 38
19:30:29.909517 IP 151.101.117.67.443 > 10.0.2.15.38050: Flags [P.], seq 5172:5210, ack 829, win 65535, length 38
19:30:29.909729 IP 151.101.117.67.443 > 10.0.2.15.38050: Flags [.], ack 867, win 65535, length 0
19:30:29.910942 IP 151.101.117.67.443 > 10.0.2.15.38050: Flags [P.], seq 5210:9332, ack 867, win 65535, length 4122
19:30:29.911155 IP 10.0.2.15.38050 > 151.101.117.67.443: Flags [.], ack 9332, win 61320, length 0
19:30:29.912114 IP 151.101.117.67.443 > 10.0.2.15.38050: Flags [P.], seq 9332:14828, ack 867, win 65535, length 5496
19:30:29.912132 IP 10.0.2.15.38050 > 151.101.117.67.443: Flags [.], ack 14828, win 61320, length 0
19:30:29.913016 IP 151.101.117.67.443 > 10.0.2.15.38050: Flags [P.], seq 14828:17576, ack 867, win 65535, length 2748
19:30:29.913030 IP 10.0.2.15.38050 > 151.101.117.67.443: Flags [.], ack 17576, win 62780, length 0
19:30:29.914077 IP 151.101.117.67.443 > 10.0.2.15.38050: Flags [P.], seq 17576:24446, ack 867, win 65535, length 6870
19:30:29.914205 IP 10.0.2.15.38050 > 151.101.117.67.443: Flags [.], ack 24446, win 59860, length 0
19:30:29.915060 IP 151.101.117.67.443 > 10.0.2.15.38050: Flags [P.], seq 24446:25820, ack 867, win 65535, length 1374
19:30:29.916409 IP 151.101.117.67.443 > 10.0.2.15.38050: Flags [P.], seq 25820:31316, ack 867, win 65535, length 5496
19:30:29.916594 IP 10.0.2.15.38050 > 151.101.117.67.443: Flags [.], ack 31316, win 61320, length 0
19:30:29.917359 IP 151.101.117.67.443 > 10.0.2.15.38050: Flags [P.], seq 31316:34064, ack 867, win 65535, length 2748
19:30:29.917379 IP 10.0.2.15.38050 > 151.101.117.67.443: Flags [.], ack 34064, win 62780, length 0
19:30:29.918127 IP 151.101.117.67.443 > 10.0.2.15.38050: Flags [P.], seq 34064:39560, ack 867, win 65535, length 5496
19:30:29.918200 IP 10.0.2.15.38050 > 151.101.117.67.443: Flags [.], ack 39560, win 61320, length 0
19:30:29.919572 IP 151.101.117.67.443 > 10.0.2.15.38050: Flags [P.], seq 39560:42308, ack 867, win 65535, length 2748
19:30:29.919591 IP 10.0.2.15.38050 > 151.101.117.67.443: Flags [.], ack 42308, win 62780, length 0
19:30:29.920549 IP 151.101.117.67.443 > 10.0.2.15.38050: Flags [P.], seq 42308:43682, ack 867, win 65535, length 1374
19:30:29.921552 IP 151.101.117.67.443 > 10.0.2.15.38050: Flags [P.], seq 43682:45056, ack 867, win 65535, length 1374
19:30:29.921575 IP 10.0.2.15.38050 > 151.101.117.67.443: Flags [.], ack 45056, win 62780, length 0
19:30:29.922820 IP 151.101.117.67.443 > 10.0.2.15.38050: Flags [P.], seq 45056:46430, ack 867, win 65535, length 1374
19:30:29.924389 IP 151.101.117.67.443 > 10.0.2.15.38050: Flags [P.], seq 46430:54674, ack 867, win 65535, length 8244
19:30:29.924484 IP 10.0.2.15.38050 > 151.101.117.67.443: Flags [.], ack 54674, win 58400, length 0
19:30:29.925232 IP 151.101.117.67.443 > 10.0.2.15.38050: Flags [P.], seq 54674:58796, ack 867, win 65535, length 4122
19:30:29.925243 IP 10.0.2.15.38050 > 151.101.117.67.443: Flags [.], ack 58796, win 61320, length 0
19:30:29.926265 IP 151.101.117.67.443 > 10.0.2.15.38050: Flags [P.], seq 58796:65666, ack 867, win 65535, length 6870
19:30:29.926491 IP 10.0.2.15.38050 > 151.101.117.67.443: Flags [.], ack 65666, win 59860, length 0
19:30:29.927614 IP 151.101.117.67.443 > 10.0.2.15.38050: Flags [P.], seq 65666:72536, ack 867, win 65535, length 6870
19:30:29.927637 IP 10.0.2.15.38050 > 151.101.117.67.443: Flags [.], ack 72536, win 59860, length 0
19:30:29.927962 IP 151.101.117.67.443 > 10.0.2.15.38050: Flags [P.], seq 72536:78032, ack 867, win 65535, length 5496
19:30:29.928192 IP 10.0.2.15.38050 > 151.101.117.67.443: Flags [.], ack 78032, win 62780, length 0
19:30:29.928910 IP 151.101.117.67.443 > 10.0.2.15.38050: Flags [P.], seq 78032:86276, ack 867, win 65535, length 8244
19:30:29.928923 IP 10.0.2.15.38050 > 151.101.117.67.443: Flags [.], ack 86276, win 65535, length 0
19:30:29.930220 IP 151.101.117.67.443 > 10.0.2.15.38050: Flags [P.], seq 86276:90398, ack 867, win 65535, length 4122
19:30:29.930241 IP 10.0.2.15.38050 > 151.101.117.67.443: Flags [.], ack 90398, win 65535, length 0
19:30:29.932006 IP 151.101.117.67.443 > 10.0.2.15.38050: Flags [P.], seq 90398:100016, ack 867, win 65535, length 9618
19:30:29.932080 IP 151.101.117.67.443 > 10.0.2.15.38050: Flags [P.], seq 100016:102764, ack 867, win 65535, length 2748
19:30:29.932110 IP 10.0.2.15.38050 > 151.101.117.67.443: Flags [.], ack 100016, win 65535, length 0
19:30:29.932171 IP 10.0.2.15.38050 > 151.101.117.67.443: Flags [.], ack 102764, win 65535, length 0
19:30:29.932199 IP 151.101.117.67.443 > 10.0.2.15.38050: Flags [P.], seq 102764:105512, ack 867, win 65535, length 2748
19:30:29.932210 IP 10.0.2.15.38050 > 151.101.117.67.443: Flags [.], ack 105512, win 65535, length 0
19:30:29.933012 IP 151.101.117.67.443 > 10.0.2.15.38050: Flags [P.], seq 105512:113756, ack 867, win 65535, length 8244
19:30:29.933028 IP 10.0.2.15.38050 > 151.101.117.67.443: Flags [.], ack 113756, win 65535, length 0
19:30:29.934034 IP 151.101.117.67.443 > 10.0.2.15.38050: Flags [P.], seq 113756:116504, ack 867, win 65535, length 2748
19:30:29.934051 IP 10.0.2.15.38050 > 151.101.117.67.443: Flags [.], ack 116504, win 65535, length 0
19:30:29.935706 IP 151.101.117.67.443 > 10.0.2.15.38050: Flags [P.], seq 116504:123374, ack 867, win 65535, length 6870
19:30:29.935726 IP 10.0.2.15.38050 > 151.101.117.67.443: Flags [.], ack 123374, win 65535, length 0
19:30:29.936508 IP 151.101.117.67.443 > 10.0.2.15.38050: Flags [P.], seq 123374:124748, ack 867, win 65535, length 1374
19:30:29.937350 IP 151.101.117.67.443 > 10.0.2.15.38050: Flags [P.], seq 124748:132992, ack 867, win 65535, length 8244
19:30:29.937353 IP 151.101.117.67.443 > 10.0.2.15.38050: Flags [P.], seq 132992:135740, ack 867, win 65535, length 2748
19:30:29.937409 IP 10.0.2.15.38050 > 151.101.117.67.443: Flags [.], ack 132992, win 65535, length 0
19:30:29.937452 IP 10.0.2.15.38050 > 151.101.117.67.443: Flags [.], ack 135740, win 65535, length 0
19:30:29.937576 IP 151.101.117.67.443 > 10.0.2.15.38050: Flags [P.], seq 135740:138488, ack 867, win 65535, length 2748
19:30:29.937578 IP 151.101.117.67.443 > 10.0.2.15.38050: Flags [P.], seq 138488:141236, ack 867, win 65535, length 2748
19:30:29.937597 IP 10.0.2.15.38050 > 151.101.117.67.443: Flags [.], ack 138488, win 65535, length 0
19:30:29.937817 IP 10.0.2.15.38050 > 151.101.117.67.443: Flags [.], ack 141236, win 65535, length 0
19:30:29.938437 IP 151.101.117.67.443 > 10.0.2.15.38050: Flags [P.], seq 141236:143984, ack 867, win 65535, length 2748
19:30:29.938439 IP 151.101.117.67.443 > 10.0.2.15.38050: Flags [P.], seq 143984:146732, ack 867, win 65535, length 2748
19:30:29.938453 IP 10.0.2.15.38050 > 151.101.117.67.443: Flags [.], ack 143984, win 65535, length 0
19:30:29.938478 IP 10.0.2.15.38050 > 151.101.117.67.443: Flags [.], ack 146732, win 65535, length 0
19:30:29.939626 IP 151.101.117.67.443 > 10.0.2.15.38050: Flags [P.], seq 146732:153602, ack 867, win 65535, length 6870
19:30:29.939660 IP 151.101.117.67.443 > 10.0.2.15.38050: Flags [P.], seq 153602:157724, ack 867, win 65535, length 4122
19:30:29.939685 IP 10.0.2.15.38050 > 151.101.117.67.443: Flags [.], ack 153602, win 65535, length 0
19:30:29.939826 IP 10.0.2.15.38050 > 151.101.117.67.443: Flags [.], ack 157724, win 65535, length 0
19:30:29.939864 IP 151.101.117.67.443 > 10.0.2.15.38050: Flags [P.], seq 157724:160472, ack 867, win 65535, length 2748
19:30:29.939865 IP 151.101.117.67.443 > 10.0.2.15.38050: Flags [.], seq 160472:161932, ack 867, win 65535, length 1460
19:30:29.939877 IP 10.0.2.15.38050 > 151.101.117.67.443: Flags [.], ack 160472, win 65535, length 0
19:30:29.940022 IP 151.101.117.67.443 > 10.0.2.15.38050: Flags [P.], seq 161932:165968, ack 867, win 65535, length 4036
19:30:29.940024 IP 151.101.117.67.443 > 10.0.2.15.38050: Flags [P.], seq 165968:167342, ack 867, win 65535, length 1374
19:30:29.940034 IP 10.0.2.15.38050 > 151.101.117.67.443: Flags [.], ack 165968, win 65535, length 0
19:30:29.942300 IP 151.101.117.67.443 > 10.0.2.15.38050: Flags [P.], seq 167342:178334, ack 867, win 65535, length 10992
19:30:29.942412 IP 10.0.2.15.38050 > 151.101.117.67.443: Flags [.], ack 178334, win 65535, length 0
19:30:29.942460 IP 151.101.117.67.443 > 10.0.2.15.38050: Flags [P.], seq 178334:189326, ack 867, win 65535, length 10992
19:30:29.942468 IP 10.0.2.15.38050 > 151.101.117.67.443: Flags [.], ack 189326, win 65535, length 0
19:30:29.944169 IP 151.101.117.67.443 > 10.0.2.15.38050: Flags [P.], seq 189326:198944, ack 867, win 65535, length 9618
19:30:29.944171 IP 151.101.117.67.443 > 10.0.2.15.38050: Flags [P.], seq 198944:201692, ack 867, win 65535, length 2748
19:30:29.944190 IP 10.0.2.15.38050 > 151.101.117.67.443: Flags [.], ack 198944, win 65535, length 0
19:30:29.944226 IP 10.0.2.15.38050 > 151.101.117.67.443: Flags [.], ack 201692, win 65535, length 0
19:30:29.944288 IP 151.101.117.67.443 > 10.0.2.15.38050: Flags [P.], seq 201692:207188, ack 867, win 65535, length 5496
19:30:29.944289 IP 151.101.117.67.443 > 10.0.2.15.38050: Flags [P.], seq 207188:211310, ack 867, win 65535, length 4122
19:30:29.944296 IP 10.0.2.15.38050 > 151.101.117.67.443: Flags [.], ack 207188, win 65535, length 0
19:30:29.944398 IP 10.0.2.15.38050 > 151.101.117.67.443: Flags [.], ack 211310, win 65535, length 0
19:30:29.944986 IP 151.101.117.67.443 > 10.0.2.15.38050: Flags [P.], seq 211310:214058, ack 867, win 65535, length 2748
19:30:29.944998 IP 10.0.2.15.38050 > 151.101.117.67.443: Flags [.], ack 214058, win 65535, length 0
19:30:29.946313 IP 151.101.117.67.443 > 10.0.2.15.38050: Flags [P.], seq 214058:223676, ack 867, win 65535, length 9618
19:30:29.946315 IP 151.101.117.67.443 > 10.0.2.15.38050: Flags [P.], seq 223676:227798, ack 867, win 65535, length 4122
19:30:29.946334 IP 10.0.2.15.38050 > 151.101.117.67.443: Flags [.], ack 223676, win 65535, length 0
19:30:29.946360 IP 10.0.2.15.38050 > 151.101.117.67.443: Flags [.], ack 227798, win 65535, length 0
19:30:29.946380 IP 151.101.117.67.443 > 10.0.2.15.38050: Flags [P.], seq 227798:233294, ack 867, win 65535, length 5496
19:30:29.946383 IP 10.0.2.15.38050 > 151.101.117.67.443: Flags [.], ack 233294, win 65535, length 0
19:30:29.947686 IP 151.101.117.67.443 > 10.0.2.15.38050: Flags [P.], seq 233294:240164, ack 867, win 65535, length 6870
19:30:29.947742 IP 10.0.2.15.38050 > 151.101.117.67.443: Flags [.], ack 240164, win 65535, length 0
19:30:29.948006 IP 151.101.117.67.443 > 10.0.2.15.38050: Flags [P.], seq 240164:245660, ack 867, win 65535, length 5496
19:30:29.948008 IP 151.101.117.67.443 > 10.0.2.15.38050: Flags [P.], seq 245660:248408, ack 867, win 65535, length 2748
19:30:29.948009 IP 151.101.117.67.443 > 10.0.2.15.38050: Flags [P.], seq 248408:249782, ack 867, win 65535, length 1374
19:30:29.948025 IP 10.0.2.15.38050 > 151.101.117.67.443: Flags [.], ack 245660, win 65535, length 0
19:30:29.948044 IP 10.0.2.15.38050 > 151.101.117.67.443: Flags [.], ack 248408, win 65535, length 0
19:30:29.948152 IP 151.101.117.67.443 > 10.0.2.15.38050: Flags [P.], seq 249782:251156, ack 867, win 65535, length 1374
19:30:29.948157 IP 10.0.2.15.38050 > 151.101.117.67.443: Flags [.], ack 251156, win 65535, length 0
19:30:29.948961 IP 151.101.117.67.443 > 10.0.2.15.38050: Flags [P.], seq 251156:258026, ack 867, win 65535, length 6870
19:30:29.948963 IP 151.101.117.67.443 > 10.0.2.15.38050: Flags [.], seq 258026:259486, ack 867, win 65535, length 1460
19:30:29.949034 IP 10.0.2.15.38050 > 151.101.117.67.443: Flags [.], ack 258026, win 65535, length 0
19:30:29.949348 IP 151.101.117.67.443 > 10.0.2.15.38050: Flags [P.], seq 259486:260774, ack 867, win 65535, length 1288
19:30:29.949350 IP 151.101.117.67.443 > 10.0.2.15.38050: Flags [P.], seq 260774:263522, ack 867, win 65535, length 2748
19:30:29.949351 IP 151.101.117.67.443 > 10.0.2.15.38050: Flags [P.], seq 263522:266270, ack 867, win 65535, length 2748
19:30:29.949364 IP 10.0.2.15.38050 > 151.101.117.67.443: Flags [.], ack 260774, win 65535, length 0
19:30:29.949383 IP 10.0.2.15.38050 > 151.101.117.67.443: Flags [.], ack 263522, win 65535, length 0
19:30:29.949473 IP 10.0.2.15.38050 > 151.101.117.67.443: Flags [.], ack 266270, win 65535, length 0
19:30:29.949802 IP 151.101.117.67.443 > 10.0.2.15.38050: Flags [P.], seq 266270:269018, ack 867, win 65535, length 2748
19:30:29.949803 IP 151.101.117.67.443 > 10.0.2.15.38050: Flags [P.], seq 269018:273140, ack 867, win 65535, length 4122
19:30:29.949804 IP 151.101.117.67.443 > 10.0.2.15.38050: Flags [P.], seq 273140:275888, ack 867, win 65535, length 2748
19:30:29.949934 IP 10.0.2.15.38050 > 151.101.117.67.443: Flags [.], ack 269018, win 65535, length 0
19:30:29.949955 IP 10.0.2.15.38050 > 151.101.117.67.443: Flags [.], ack 273140, win 65535, length 0
19:30:29.949972 IP 10.0.2.15.38050 > 151.101.117.67.443: Flags [.], ack 275888, win 65535, length 0
19:30:29.950278 IP 151.101.117.67.443 > 10.0.2.15.38050: Flags [P.], seq 275888:277262, ack 867, win 65535, length 1374
19:30:29.951586 IP 151.101.117.67.443 > 10.0.2.15.38050: Flags [P.], seq 277262:284132, ack 867, win 65535, length 6870
19:30:29.951588 IP 151.101.117.67.443 > 10.0.2.15.38050: Flags [P.], seq 284132:286880, ack 867, win 65535, length 2748
19:30:29.951590 IP 151.101.117.67.443 > 10.0.2.15.38050: Flags [P.], seq 286880:292376, ack 867, win 65535, length 5496
19:30:29.951655 IP 10.0.2.15.38050 > 151.101.117.67.443: Flags [.], ack 284132, win 65535, length 0
19:30:29.951681 IP 10.0.2.15.38050 > 151.101.117.67.443: Flags [.], ack 286880, win 65535, length 0
19:30:29.951696 IP 10.0.2.15.38050 > 151.101.117.67.443: Flags [.], ack 292376, win 65535, length 0
19:30:29.952314 IP 151.101.117.67.443 > 10.0.2.15.38050: Flags [P.], seq 292376:295124, ack 867, win 65535, length 2748
19:30:29.952316 IP 151.101.117.67.443 > 10.0.2.15.38050: Flags [P.], seq 295124:296498, ack 867, win 65535, length 1374
19:30:29.952344 IP 10.0.2.15.38050 > 151.101.117.67.443: Flags [.], ack 295124, win 65535, length 0
19:30:29.953243 IP 151.101.117.67.443 > 10.0.2.15.38050: Flags [P.], seq 296498:303368, ack 867, win 65535, length 6870
19:30:29.953261 IP 10.0.2.15.38050 > 151.101.117.67.443: Flags [.], ack 303368, win 65535, length 0
19:30:29.953748 IP 151.101.117.67.443 > 10.0.2.15.38050: Flags [P.], seq 303368:308864, ack 867, win 65535, length 5496
19:30:29.953751 IP 151.101.117.67.443 > 10.0.2.15.38050: Flags [P.], seq 308864:311612, ack 867, win 65535, length 2748
19:30:29.953751 IP 151.101.117.67.443 > 10.0.2.15.38050: Flags [P.], seq 311612:312986, ack 867, win 65535, length 1374
19:30:29.953753 IP 151.101.117.67.443 > 10.0.2.15.38050: Flags [P.], seq 312986:317108, ack 867, win 65535, length 4122
19:30:29.953771 IP 10.0.2.15.38050 > 151.101.117.67.443: Flags [.], ack 308864, win 65535, length 0
19:30:29.953797 IP 10.0.2.15.38050 > 151.101.117.67.443: Flags [.], ack 311612, win 65535, length 0
19:30:29.953810 IP 10.0.2.15.38050 > 151.101.117.67.443: Flags [.], ack 317108, win 65535, length 0
19:30:29.953828 IP 151.101.117.67.443 > 10.0.2.15.38050: Flags [P.], seq 317108:318482, ack 867, win 65535, length 1374
19:30:29.954464 IP 151.101.117.67.443 > 10.0.2.15.38050: Flags [P.], seq 318482:321230, ack 867, win 65535, length 2748
19:30:29.954478 IP 10.0.2.15.38050 > 151.101.117.67.443: Flags [.], ack 321230, win 65535, length 0
19:30:29.955295 IP 151.101.117.67.443 > 10.0.2.15.38050: Flags [P.], seq 321230:326726, ack 867, win 65535, length 5496
19:30:29.955317 IP 10.0.2.15.38050 > 151.101.117.67.443: Flags [.], ack 326726, win 65535, length 0
19:30:29.956492 IP 151.101.117.67.443 > 10.0.2.15.38050: Flags [P.], seq 326726:333596, ack 867, win 65535, length 6870
19:30:29.956517 IP 10.0.2.15.38050 > 151.101.117.67.443: Flags [.], ack 333596, win 65535, length 0
19:30:29.956918 IP 151.101.117.67.443 > 10.0.2.15.38050: Flags [P.], seq 333596:337718, ack 867, win 65535, length 4122
19:30:29.956920 IP 151.101.117.67.443 > 10.0.2.15.38050: Flags [P.], seq 337718:340466, ack 867, win 65535, length 2748
19:30:29.956921 IP 151.101.117.67.443 > 10.0.2.15.38050: Flags [P.], seq 340466:343214, ack 867, win 65535, length 2748
19:30:29.956922 IP 151.101.117.67.443 > 10.0.2.15.38050: Flags [P.], seq 343214:344588, ack 867, win 65535, length 1374
19:30:29.956975 IP 10.0.2.15.38050 > 151.101.117.67.443: Flags [.], ack 337718, win 65535, length 0
19:30:29.956995 IP 10.0.2.15.38050 > 151.101.117.67.443: Flags [.], ack 340466, win 65535, length 0
19:30:29.957007 IP 10.0.2.15.38050 > 151.101.117.67.443: Flags [.], ack 343214, win 65535, length 0
19:30:29.958713 IP 151.101.117.67.443 > 10.0.2.15.38050: Flags [P.], seq 344588:351458, ack 867, win 65535, length 6870
19:30:29.958716 IP 151.101.117.67.443 > 10.0.2.15.38050: Flags [P.], seq 351458:356954, ack 867, win 65535, length 5496
19:30:29.958766 IP 10.0.2.15.38050 > 151.101.117.67.443: Flags [.], ack 351458, win 65535, length 0
19:30:29.958790 IP 10.0.2.15.38050 > 151.101.117.67.443: Flags [.], ack 356954, win 65535, length 0
19:30:29.958940 IP 151.101.117.67.443 > 10.0.2.15.38050: Flags [P.], seq 356954:359702, ack 867, win 65535, length 2748
19:30:29.958953 IP 10.0.2.15.38050 > 151.101.117.67.443: Flags [.], ack 359702, win 65535, length 0
19:30:29.959435 IP 151.101.117.67.443 > 10.0.2.15.38050: Flags [P.], seq 359702:365198, ack 867, win 65535, length 5496
19:30:29.959437 IP 151.101.117.67.443 > 10.0.2.15.38050: Flags [P.], seq 365198:367946, ack 867, win 65535, length 2748
19:30:29.959438 IP 151.101.117.67.443 > 10.0.2.15.38050: Flags [P.], seq 367946:370694, ack 867, win 65535, length 2748
19:30:29.959586 IP 10.0.2.15.38050 > 151.101.117.67.443: Flags [.], ack 365198, win 65535, length 0
19:30:29.959678 IP 10.0.2.15.38050 > 151.101.117.67.443: Flags [.], ack 367946, win 65535, length 0
19:30:29.959690 IP 10.0.2.15.38050 > 151.101.117.67.443: Flags [.], ack 370694, win 65535, length 0
19:30:29.959708 IP 151.101.117.67.443 > 10.0.2.15.38050: Flags [P.], seq 370694:372068, ack 867, win 65535, length 1374
19:30:29.960917 IP 151.101.117.67.443 > 10.0.2.15.38050: Flags [P.], seq 372068:378938, ack 867, win 65535, length 6870
19:30:29.961061 IP 10.0.2.15.38050 > 151.101.117.67.443: Flags [.], ack 378938, win 65535, length 0
19:30:29.961451 IP 151.101.117.67.443 > 10.0.2.15.38050: Flags [P.], seq 378938:383060, ack 867, win 65535, length 4122
19:30:29.961453 IP 151.101.117.67.443 > 10.0.2.15.38050: Flags [P.], seq 383060:385808, ack 867, win 65535, length 2748
19:30:29.961453 IP 151.101.117.67.443 > 10.0.2.15.38050: Flags [P.], seq 385808:387182, ack 867, win 65535, length 1374
19:30:29.961454 IP 151.101.117.67.443 > 10.0.2.15.38050: Flags [P.], seq 387182:389930, ack 867, win 65535, length 2748
19:30:29.961471 IP 10.0.2.15.38050 > 151.101.117.67.443: Flags [.], ack 383060, win 65535, length 0
19:30:29.961495 IP 10.0.2.15.38050 > 151.101.117.67.443: Flags [.], ack 385808, win 65535, length 0
19:30:29.961511 IP 10.0.2.15.38050 > 151.101.117.67.443: Flags [.], ack 389930, win 65535, length 0
19:30:29.961575 IP 151.101.117.67.443 > 10.0.2.15.38050: Flags [P.], seq 389930:394052, ack 867, win 65535, length 4122
19:30:29.961577 IP 151.101.117.67.443 > 10.0.2.15.38050: Flags [P.], seq 394052:395426, ack 867, win 65535, length 1374
19:30:29.961590 IP 10.0.2.15.38050 > 151.101.117.67.443: Flags [.], ack 394052, win 65535, length 0
19:30:29.961921 IP 151.101.117.67.443 > 10.0.2.15.38050: Flags [P.], seq 395426:396800, ack 867, win 65535, length 1374
19:30:29.961934 IP 10.0.2.15.38050 > 151.101.117.67.443: Flags [.], ack 396800, win 65535, length 0
19:30:29.963103 IP 151.101.117.67.443 > 10.0.2.15.38050: Flags [P.], seq 396800:403670, ack 867, win 65535, length 6870
19:30:29.963105 IP 151.101.117.67.443 > 10.0.2.15.38050: Flags [P.], seq 403670:407792, ack 867, win 65535, length 4122
19:30:29.963126 IP 10.0.2.15.38050 > 151.101.117.67.443: Flags [.], ack 403670, win 65535, length 0
19:30:29.963144 IP 10.0.2.15.38050 > 151.101.117.67.443: Flags [.], ack 407792, win 65535, length 0
19:30:29.963319 IP 151.101.117.67.443 > 10.0.2.15.38050: Flags [P.], seq 407792:409166, ack 867, win 65535, length 1374
19:30:29.964357 IP 151.101.117.67.443 > 10.0.2.15.38050: Flags [P.], seq 409166:416036, ack 867, win 65535, length 6870
19:30:29.964378 IP 10.0.2.15.38050 > 151.101.117.67.443: Flags [.], ack 416036, win 65535, length 0
19:30:29.964667 IP 151.101.117.67.443 > 10.0.2.15.38050: Flags [P.], seq 416036:418784, ack 867, win 65535, length 2748
19:30:29.964669 IP 151.101.117.67.443 > 10.0.2.15.38050: Flags [P.], seq 418784:424280, ack 867, win 65535, length 5496
19:30:29.964681 IP 10.0.2.15.38050 > 151.101.117.67.443: Flags [.], ack 418784, win 65535, length 0
19:30:29.964697 IP 10.0.2.15.38050 > 151.101.117.67.443: Flags [.], ack 424280, win 65535, length 0
19:30:29.966132 IP 151.101.117.67.443 > 10.0.2.15.38050: Flags [P.], seq 424280:431150, ack 867, win 65535, length 6870
19:30:29.966256 IP 10.0.2.15.38050 > 151.101.117.67.443: Flags [.], ack 431150, win 65535, length 0
19:30:29.966842 IP 151.101.117.67.443 > 10.0.2.15.38050: Flags [P.], seq 431150:433898, ack 867, win 65535, length 2748
19:30:29.966844 IP 151.101.117.67.443 > 10.0.2.15.38050: Flags [P.], seq 433898:439394, ack 867, win 65535, length 5496
19:30:29.966845 IP 151.101.117.67.443 > 10.0.2.15.38050: Flags [P.], seq 439394:440768, ack 867, win 65535, length 1374
19:30:29.966845 IP 151.101.117.67.443 > 10.0.2.15.38050: Flags [P.], seq 440768:444890, ack 867, win 65535, length 4122
19:30:29.966859 IP 10.0.2.15.38050 > 151.101.117.67.443: Flags [.], ack 433898, win 65535, length 0
19:30:29.966876 IP 10.0.2.15.38050 > 151.101.117.67.443: Flags [.], ack 439394, win 65535, length 0
19:30:29.966886 IP 10.0.2.15.38050 > 151.101.117.67.443: Flags [.], ack 444890, win 65535, length 0
19:30:29.966901 IP 151.101.117.67.443 > 10.0.2.15.38050: Flags [P.], seq 444890:447638, ack 867, win 65535, length 2748
19:30:29.966901 IP 151.101.117.67.443 > 10.0.2.15.38050: Flags [P.], seq 447638:449012, ack 867, win 65535, length 1374
19:30:29.966905 IP 10.0.2.15.38050 > 151.101.117.67.443: Flags [.], ack 447638, win 65535, length 0
19:30:29.968179 IP 151.101.117.67.443 > 10.0.2.15.38050: Flags [P.], seq 449012:455882, ack 867, win 65535, length 6870
19:30:29.968206 IP 10.0.2.15.38050 > 151.101.117.67.443: Flags [.], ack 455882, win 65535, length 0
19:30:29.969216 IP 151.101.117.67.443 > 10.0.2.15.38050: Flags [P.], seq 455882:460004, ack 867, win 65535, length 4122
19:30:29.969316 IP 151.101.117.67.443 > 10.0.2.15.38050: Flags [P.], seq 460004:464126, ack 867, win 65535, length 4122
19:30:29.969317 IP 151.101.117.67.443 > 10.0.2.15.38050: Flags [P.], seq 464126:466874, ack 867, win 65535, length 2748
19:30:29.969338 IP 10.0.2.15.38050 > 151.101.117.67.443: Flags [.], ack 460004, win 65535, length 0
19:30:29.969361 IP 10.0.2.15.38050 > 151.101.117.67.443: Flags [.], ack 464126, win 65535, length 0
19:30:29.969375 IP 10.0.2.15.38050 > 151.101.117.67.443: Flags [.], ack 466874, win 65535, length 0
19:30:29.969394 IP 151.101.117.67.443 > 10.0.2.15.38050: Flags [P.], seq 466874:469622, ack 867, win 65535, length 2748
19:30:29.969395 IP 151.101.117.67.443 > 10.0.2.15.38050: Flags [P.], seq 469622:470996, ack 867, win 65535, length 1374
19:30:29.969403 IP 10.0.2.15.38050 > 151.101.117.67.443: Flags [.], ack 469622, win 65535, length 0
19:30:29.970566 IP 151.101.117.67.443 > 10.0.2.15.38050: Flags [P.], seq 470996:476492, ack 867, win 65535, length 5496
19:30:29.970568 IP 151.101.117.67.443 > 10.0.2.15.38050: Flags [P.], seq 476492:479240, ack 867, win 65535, length 2748
19:30:29.970569 IP 151.101.117.67.443 > 10.0.2.15.38050: Flags [P.], seq 479240:481988, ack 867, win 65535, length 2748
19:30:29.970626 IP 10.0.2.15.38050 > 151.101.117.67.443: Flags [.], ack 476492, win 65535, length 0
19:30:29.970660 IP 10.0.2.15.38050 > 151.101.117.67.443: Flags [.], ack 479240, win 65535, length 0
19:30:29.970674 IP 10.0.2.15.38050 > 151.101.117.67.443: Flags [.], ack 481988, win 65535, length 0
19:30:29.970748 IP 151.101.117.67.443 > 10.0.2.15.38050: Flags [P.], seq 481988:483362, ack 867, win 65535, length 1374
19:30:29.970752 IP 151.101.117.67.443 > 10.0.2.15.38050: Flags [.], seq 483362:484822, ack 867, win 65535, length 1460
19:30:29.970765 IP 10.0.2.15.38050 > 151.101.117.67.443: Flags [.], ack 484822, win 65535, length 0
19:30:29.971169 IP 151.101.117.67.443 > 10.0.2.15.38050: Flags [P.], seq 484822:488858, ack 867, win 65535, length 4036
19:30:29.971171 IP 151.101.117.67.443 > 10.0.2.15.38050: Flags [P.], seq 488858:491606, ack 867, win 65535, length 2748
19:30:29.971172 IP 151.101.117.67.443 > 10.0.2.15.38050: Flags [P.], seq 491606:494354, ack 867, win 65535, length 2748
19:30:29.971173 IP 151.101.117.67.443 > 10.0.2.15.38050: Flags [P.], seq 494354:497102, ack 867, win 65535, length 2748
19:30:29.971188 IP 10.0.2.15.38050 > 151.101.117.67.443: Flags [.], ack 488858, win 65535, length 0
19:30:29.971349 IP 10.0.2.15.38050 > 151.101.117.67.443: Flags [.], ack 491606, win 65535, length 0
19:30:29.971366 IP 10.0.2.15.38050 > 151.101.117.67.443: Flags [.], ack 494354, win 65535, length 0
19:30:29.971376 IP 10.0.2.15.38050 > 151.101.117.67.443: Flags [.], ack 497102, win 65535, length 0
19:30:29.971400 IP 151.101.117.67.443 > 10.0.2.15.38050: Flags [P.], seq 497102:499850, ack 867, win 65535, length 2748
19:30:29.971406 IP 10.0.2.15.38050 > 151.101.117.67.443: Flags [.], ack 499850, win 65535, length 0
19:30:29.971633 IP 151.101.117.67.443 > 10.0.2.15.38050: Flags [P.], seq 499850:502598, ack 867, win 65535, length 2748
19:30:29.971642 IP 10.0.2.15.38050 > 151.101.117.67.443: Flags [.], ack 502598, win 65535, length 0
19:30:29.972644 IP 151.101.117.67.443 > 10.0.2.15.38050: Flags [P.], seq 502598:512216, ack 867, win 65535, length 9618
19:30:29.972646 IP 151.101.117.67.443 > 10.0.2.15.38050: Flags [P.], seq 512216:513590, ack 867, win 65535, length 1374
19:30:29.972670 IP 10.0.2.15.38050 > 151.101.117.67.443: Flags [.], ack 512216, win 65535, length 0
19:30:29.973702 IP 151.101.117.67.443 > 10.0.2.15.38050: Flags [P.], seq 513590:520460, ack 867, win 65535, length 6870
19:30:29.973726 IP 10.0.2.15.38050 > 151.101.117.67.443: Flags [.], ack 520460, win 65535, length 0
19:30:29.973944 IP 151.101.117.67.443 > 10.0.2.15.38050: Flags [P.], seq 520460:524582, ack 867, win 65535, length 4122
19:30:29.973946 IP 151.101.117.67.443 > 10.0.2.15.38050: Flags [P.], seq 524582:527330, ack 867, win 65535, length 2748
19:30:29.973960 IP 10.0.2.15.38050 > 151.101.117.67.443: Flags [.], ack 524582, win 65535, length 0
19:30:29.973974 IP 10.0.2.15.38050 > 151.101.117.67.443: Flags [.], ack 527330, win 65535, length 0
19:30:29.975019 IP 151.101.117.67.443 > 10.0.2.15.38050: Flags [P.], seq 527330:534200, ack 867, win 65535, length 6870
19:30:29.975041 IP 10.0.2.15.38050 > 151.101.117.67.443: Flags [.], ack 534200, win 65535, length 0
19:30:29.975842 IP 151.101.117.67.443 > 10.0.2.15.38050: Flags [P.], seq 534200:539696, ack 867, win 65535, length 5496
19:30:29.975859 IP 10.0.2.15.38050 > 151.101.117.67.443: Flags [.], ack 539696, win 65535, length 0
19:30:29.976342 IP 151.101.117.67.443 > 10.0.2.15.38050: Flags [P.], seq 539696:546566, ack 867, win 65535, length 6870
19:30:29.976346 IP 151.101.117.67.443 > 10.0.2.15.38050: Flags [P.], seq 546566:552062, ack 867, win 65535, length 5496
19:30:29.976368 IP 10.0.2.15.38050 > 151.101.117.67.443: Flags [.], ack 546566, win 65535, length 0
19:30:29.976507 IP 10.0.2.15.38050 > 151.101.117.67.443: Flags [.], ack 552062, win 65535, length 0
19:30:29.976531 IP 151.101.117.67.443 > 10.0.2.15.38050: Flags [P.], seq 552062:554810, ack 867, win 65535, length 2748
19:30:29.976538 IP 10.0.2.15.38050 > 151.101.117.67.443: Flags [.], ack 554810, win 65535, length 0
19:30:29.976853 IP 151.101.117.67.443 > 10.0.2.15.38050: Flags [P.], seq 554810:560306, ack 867, win 65535, length 5496
19:30:29.976855 IP 151.101.117.67.443 > 10.0.2.15.38050: Flags [P.], seq 560306:565802, ack 867, win 65535, length 5496
19:30:29.976871 IP 10.0.2.15.38050 > 151.101.117.67.443: Flags [.], ack 560306, win 65535, length 0
19:30:29.976889 IP 10.0.2.15.38050 > 151.101.117.67.443: Flags [.], ack 565802, win 65535, length 0
19:30:29.978303 IP 151.101.117.67.443 > 10.0.2.15.38050: Flags [P.], seq 565802:572672, ack 867, win 65535, length 6870
19:30:29.978320 IP 10.0.2.15.38050 > 151.101.117.67.443: Flags [.], ack 572672, win 65535, length 0
19:30:29.978515 IP 151.101.117.67.443 > 10.0.2.15.38050: Flags [P.], seq 572672:578168, ack 867, win 65535, length 5496
19:30:29.978524 IP 10.0.2.15.38050 > 151.101.117.67.443: Flags [.], ack 578168, win 65535, length 0
19:30:29.978888 IP 151.101.117.67.443 > 10.0.2.15.38050: Flags [P.], seq 578168:583664, ack 867, win 65535, length 5496
19:30:29.978899 IP 10.0.2.15.38050 > 151.101.117.67.443: Flags [.], ack 583664, win 65535, length 0
19:30:29.979118 IP 151.101.117.67.443 > 10.0.2.15.38050: Flags [P.], seq 583664:586412, ack 867, win 65535, length 2748
19:30:29.979125 IP 10.0.2.15.38050 > 151.101.117.67.443: Flags [.], ack 586412, win 65535, length 0
19:30:29.980370 IP 151.101.117.67.443 > 10.0.2.15.38050: Flags [P.], seq 586412:593282, ack 867, win 65535, length 6870
19:30:29.980392 IP 10.0.2.15.38050 > 151.101.117.67.443: Flags [.], ack 593282, win 65535, length 0
19:30:29.980766 IP 151.101.117.67.443 > 10.0.2.15.38050: Flags [P.], seq 593282:598778, ack 867, win 65535, length 5496
19:30:29.980803 IP 151.101.117.67.443 > 10.0.2.15.38050: Flags [P.], seq 598778:601526, ack 867, win 65535, length 2748
19:30:29.980803 IP 151.101.117.67.443 > 10.0.2.15.38050: Flags [P.], seq 601526:604274, ack 867, win 65535, length 2748
19:30:29.980818 IP 10.0.2.15.38050 > 151.101.117.67.443: Flags [.], ack 598778, win 65535, length 0
19:30:29.980842 IP 10.0.2.15.38050 > 151.101.117.67.443: Flags [.], ack 601526, win 65535, length 0
19:30:29.980855 IP 10.0.2.15.38050 > 151.101.117.67.443: Flags [.], ack 604274, win 65535, length 0
19:30:29.980877 IP 151.101.117.67.443 > 10.0.2.15.38050: Flags [P.], seq 604274:607022, ack 867, win 65535, length 2748
19:30:29.980882 IP 10.0.2.15.38050 > 151.101.117.67.443: Flags [.], ack 607022, win 65535, length 0
19:30:29.981362 IP 151.101.117.67.443 > 10.0.2.15.38050: Flags [P.], seq 607022:611144, ack 867, win 65535, length 4122
19:30:29.981372 IP 10.0.2.15.38050 > 151.101.117.67.443: Flags [.], ack 611144, win 65535, length 0
19:30:29.982945 IP 151.101.117.67.443 > 10.0.2.15.38050: Flags [P.], seq 611144:615266, ack 867, win 65535, length 4122
19:30:29.983015 IP 10.0.2.15.38050 > 151.101.117.67.443: Flags [.], ack 615266, win 65535, length 0
19:30:29.983263 IP 151.101.117.67.443 > 10.0.2.15.38050: Flags [P.], seq 615266:623510, ack 867, win 65535, length 8244
19:30:29.983265 IP 151.101.117.67.443 > 10.0.2.15.38050: Flags [P.], seq 623510:629006, ack 867, win 65535, length 5496
19:30:29.983280 IP 10.0.2.15.38050 > 151.101.117.67.443: Flags [.], ack 623510, win 65535, length 0
19:30:29.983300 IP 10.0.2.15.38050 > 151.101.117.67.443: Flags [.], ack 629006, win 65535, length 0
19:30:29.983320 IP 151.101.117.67.443 > 10.0.2.15.38050: Flags [P.], seq 629006:631754, ack 867, win 65535, length 2748
19:30:29.983326 IP 10.0.2.15.38050 > 151.101.117.67.443: Flags [.], ack 631754, win 65535, length 0
19:30:29.984593 IP 151.101.117.67.443 > 10.0.2.15.38050: Flags [P.], seq 631754:638624, ack 867, win 65535, length 6870
19:30:29.984615 IP 10.0.2.15.38050 > 151.101.117.67.443: Flags [.], ack 638624, win 65535, length 0
19:30:29.984919 IP 151.101.117.67.443 > 10.0.2.15.38050: Flags [P.], seq 638624:644120, ack 867, win 65535, length 5496
19:30:29.985063 IP 10.0.2.15.38050 > 151.101.117.67.443: Flags [.], ack 644120, win 65535, length 0
19:30:29.985731 IP 151.101.117.67.443 > 10.0.2.15.38050: Flags [P.], seq 644120:650990, ack 867, win 65535, length 6870
19:30:29.985822 IP 10.0.2.15.38050 > 151.101.117.67.443: Flags [.], ack 650990, win 65535, length 0
19:30:29.985999 IP 151.101.117.67.443 > 10.0.2.15.38050: Flags [P.], seq 650990:655112, ack 867, win 65535, length 4122
19:30:29.986001 IP 151.101.117.67.443 > 10.0.2.15.38050: Flags [P.], seq 655112:656486, ack 867, win 65535, length 1374
19:30:29.986013 IP 10.0.2.15.38050 > 151.101.117.67.443: Flags [.], ack 655112, win 65535, length 0
19:30:29.986590 IP 151.101.117.67.443 > 10.0.2.15.38050: Flags [P.], seq 656486:659234, ack 867, win 65535, length 2748
19:30:29.986591 IP 151.101.117.67.443 > 10.0.2.15.38050: Flags [P.], seq 659234:661982, ack 867, win 65535, length 2748
19:30:29.986605 IP 10.0.2.15.38050 > 151.101.117.67.443: Flags [.], ack 659234, win 65535, length 0
19:30:29.986624 IP 10.0.2.15.38050 > 151.101.117.67.443: Flags [.], ack 661982, win 65535, length 0
19:30:29.986880 IP 151.101.117.67.443 > 10.0.2.15.38050: Flags [P.], seq 661982:664730, ack 867, win 65535, length 2748
19:30:29.986881 IP 151.101.117.67.443 > 10.0.2.15.38050: Flags [P.], seq 664730:667478, ack 867, win 65535, length 2748
19:30:29.986889 IP 10.0.2.15.38050 > 151.101.117.67.443: Flags [.], ack 664730, win 65535, length 0
19:30:29.986911 IP 10.0.2.15.38050 > 151.101.117.67.443: Flags [.], ack 667478, win 65535, length 0
19:30:29.987994 IP 151.101.117.67.443 > 10.0.2.15.38050: Flags [P.], seq 667478:674348, ack 867, win 65535, length 6870
19:30:29.987996 IP 151.101.117.67.443 > 10.0.2.15.38050: Flags [P.], seq 674348:679844, ack 867, win 65535, length 5496
19:30:29.988017 IP 10.0.2.15.38050 > 151.101.117.67.443: Flags [.], ack 674348, win 65535, length 0
19:30:29.988122 IP 10.0.2.15.38050 > 151.101.117.67.443: Flags [.], ack 679844, win 65535, length 0
19:30:29.988306 IP 151.101.117.67.443 > 10.0.2.15.38050: Flags [P.], seq 679844:685340, ack 867, win 65535, length 5496
19:30:29.988474 IP 151.101.117.67.443 > 10.0.2.15.38050: Flags [P.], seq 685340:689462, ack 867, win 65535, length 4122
19:30:29.988793 IP 151.101.117.67.443 > 10.0.2.15.38050: Flags [P.], seq 689462:693584, ack 867, win 65535, length 4122
19:30:29.990040 IP 151.101.117.67.443 > 10.0.2.15.38050: Flags [P.], seq 693584:700454, ack 867, win 65535, length 6870
19:30:29.990391 IP 151.101.117.67.443 > 10.0.2.15.38050: Flags [P.], seq 700454:707324, ack 867, win 65535, length 6870
19:30:29.990393 IP 151.101.117.67.443 > 10.0.2.15.38050: Flags [P.], seq 707324:708698, ack 867, win 65535, length 1374
19:30:29.990394 IP 151.101.117.67.443 > 10.0.2.15.38050: Flags [P.], seq 708698:710072, ack 867, win 65535, length 1374
19:30:29.990642 IP 151.101.117.67.443 > 10.0.2.15.38050: Flags [P.], seq 710072:714194, ack 867, win 65535, length 4122
19:30:29.990815 IP 10.0.2.15.38050 > 151.101.117.67.443: Flags [.], ack 714194, win 65535, length 0
19:30:29.991102 IP 151.101.117.67.443 > 10.0.2.15.38050: Flags [P.], seq 714194:718316, ack 867, win 65535, length 4122
19:30:29.991112 IP 10.0.2.15.38050 > 151.101.117.67.443: Flags [.], ack 718316, win 65535, length 0
19:30:29.992280 IP 151.101.117.67.443 > 10.0.2.15.38050: Flags [P.], seq 718316:726560, ack 867, win 65535, length 8244
19:30:29.992284 IP 151.101.117.67.443 > 10.0.2.15.38050: Flags [P.], seq 726560:730682, ack 867, win 65535, length 4122
19:30:29.992307 IP 10.0.2.15.38050 > 151.101.117.67.443: Flags [.], ack 726560, win 65535, length 0
19:30:29.992429 IP 10.0.2.15.38050 > 151.101.117.67.443: Flags [.], ack 730682, win 65535, length 0
19:30:29.992481 IP 151.101.117.67.443 > 10.0.2.15.38050: Flags [P.], seq 730682:733430, ack 867, win 65535, length 2748
19:30:29.992482 IP 151.101.117.67.443 > 10.0.2.15.38050: Flags [P.], seq 733430:734804, ack 867, win 65535, length 1374
19:30:29.992494 IP 10.0.2.15.38050 > 151.101.117.67.443: Flags [.], ack 733430, win 65535, length 0
19:30:29.992743 IP 151.101.117.67.443 > 10.0.2.15.38050: Flags [P.], seq 734804:738926, ack 867, win 65535, length 4122
19:30:29.992745 IP 151.101.117.67.443 > 10.0.2.15.38050: Flags [P.], seq 738926:741674, ack 867, win 65535, length 2748
19:30:29.992755 IP 10.0.2.15.38050 > 151.101.117.67.443: Flags [.], ack 738926, win 65535, length 0
19:30:29.992768 IP 10.0.2.15.38050 > 151.101.117.67.443: Flags [.], ack 741674, win 65535, length 0
19:30:29.992840 IP 151.101.117.67.443 > 10.0.2.15.38050: Flags [P.], seq 741674:743048, ack 867, win 65535, length 1374
19:30:29.993895 IP 151.101.117.67.443 > 10.0.2.15.38050: Flags [P.], seq 743048:748544, ack 867, win 65535, length 5496
19:30:29.993897 IP 151.101.117.67.443 > 10.0.2.15.38050: Flags [P.], seq 748544:749918, ack 867, win 65535, length 1374
19:30:29.993898 IP 151.101.117.67.443 > 10.0.2.15.38050: Flags [P.], seq 749918:754040, ack 867, win 65535, length 4122
19:30:29.993918 IP 10.0.2.15.38050 > 151.101.117.67.443: Flags [.], ack 748544, win 65535, length 0
19:30:29.994021 IP 10.0.2.15.38050 > 151.101.117.67.443: Flags [.], ack 754040, win 65535, length 0
19:30:29.994055 IP 151.101.117.67.443 > 10.0.2.15.38050: Flags [P.], seq 754040:756788, ack 867, win 65535, length 2748
19:30:29.994055 IP 151.101.117.67.443 > 10.0.2.15.38050: Flags [P.], seq 756788:758162, ack 867, win 65535, length 1374
19:30:29.994063 IP 10.0.2.15.38050 > 151.101.117.67.443: Flags [.], ack 756788, win 65535, length 0
19:30:29.995447 IP 151.101.117.67.443 > 10.0.2.15.38050: Flags [P.], seq 758162:760910, ack 867, win 65535, length 2748
19:30:29.995451 IP 151.101.117.67.443 > 10.0.2.15.38050: Flags [P.], seq 760910:766406, ack 867, win 65535, length 5496
19:30:29.995452 IP 151.101.117.67.443 > 10.0.2.15.38050: Flags [P.], seq 766406:767780, ack 867, win 65535, length 1374
19:30:29.995473 IP 10.0.2.15.38050 > 151.101.117.67.443: Flags [.], ack 760910, win 65535, length 0
19:30:29.995504 IP 10.0.2.15.38050 > 151.101.117.67.443: Flags [.], ack 766406, win 65535, length 0
19:30:29.995823 IP 151.101.117.67.443 > 10.0.2.15.38050: Flags [P.], seq 767780:773276, ack 867, win 65535, length 5496
19:30:29.995831 IP 10.0.2.15.38050 > 151.101.117.67.443: Flags [.], ack 773276, win 65535, length 0
19:30:29.996221 IP 151.101.117.67.443 > 10.0.2.15.38050: Flags [P.], seq 773276:778772, ack 867, win 65535, length 5496
19:30:29.996223 IP 151.101.117.67.443 > 10.0.2.15.38050: Flags [P.], seq 778772:780146, ack 867, win 65535, length 1374
19:30:29.996236 IP 10.0.2.15.38050 > 151.101.117.67.443: Flags [.], ack 778772, win 65535, length 0
19:30:29.996693 IP 151.101.117.67.443 > 10.0.2.15.38050: Flags [P.], seq 780146:785642, ack 867, win 65535, length 5496
19:30:29.996707 IP 10.0.2.15.38050 > 151.101.117.67.443: Flags [.], ack 785642, win 65535, length 0
19:30:29.997206 IP 151.101.117.67.443 > 10.0.2.15.38050: Flags [P.], seq 785642:791138, ack 867, win 65535, length 5496
19:30:29.997208 IP 151.101.117.67.443 > 10.0.2.15.38050: Flags [P.], seq 791138:795260, ack 867, win 65535, length 4122
19:30:29.997208 IP 151.101.117.67.443 > 10.0.2.15.38050: Flags [P.], seq 795260:798008, ack 867, win 65535, length 2748
19:30:29.997222 IP 10.0.2.15.38050 > 151.101.117.67.443: Flags [.], ack 791138, win 65535, length 0
19:30:29.997241 IP 10.0.2.15.38050 > 151.101.117.67.443: Flags [.], ack 795260, win 65535, length 0
19:30:29.997254 IP 10.0.2.15.38050 > 151.101.117.67.443: Flags [.], ack 798008, win 65535, length 0
19:30:29.997272 IP 151.101.117.67.443 > 10.0.2.15.38050: Flags [P.], seq 798008:800756, ack 867, win 65535, length 2748
19:30:29.997277 IP 10.0.2.15.38050 > 151.101.117.67.443: Flags [.], ack 800756, win 65535, length 0
19:30:29.998842 IP 151.101.117.67.443 > 10.0.2.15.38050: Flags [P.], seq 800756:806252, ack 867, win 65535, length 5496
19:30:29.998845 IP 151.101.117.67.443 > 10.0.2.15.38050: Flags [P.], seq 806252:811748, ack 867, win 65535, length 5496
19:30:29.999021 IP 10.0.2.15.38050 > 151.101.117.67.443: Flags [.], ack 806252, win 65535, length 0
19:30:29.999060 IP 10.0.2.15.38050 > 151.101.117.67.443: Flags [.], ack 811748, win 65535, length 0
19:30:29.999090 IP 151.101.117.67.443 > 10.0.2.15.38050: Flags [P.], seq 811748:814496, ack 867, win 65535, length 2748
19:30:29.999097 IP 10.0.2.15.38050 > 151.101.117.67.443: Flags [.], ack 814496, win 65535, length 0
19:30:29.999540 IP 151.101.117.67.443 > 10.0.2.15.38050: Flags [P.], seq 814496:819992, ack 867, win 65535, length 5496
19:30:29.999554 IP 10.0.2.15.38050 > 151.101.117.67.443: Flags [.], ack 819992, win 65535, length 0
19:30:29.999791 IP 151.101.117.67.443 > 10.0.2.15.38050: Flags [P.], seq 819992:821366, ack 867, win 65535, length 1374
19:30:29.999793 IP 151.101.117.67.443 > 10.0.2.15.38050: Flags [P.], seq 821366:825488, ack 867, win 65535, length 4122
19:30:29.999794 IP 151.101.117.67.443 > 10.0.2.15.38050: Flags [P.], seq 825488:828236, ack 867, win 65535, length 2748
19:30:29.999855 IP 10.0.2.15.38050 > 151.101.117.67.443: Flags [.], ack 825488, win 65535, length 0
19:30:29.999878 IP 10.0.2.15.38050 > 151.101.117.67.443: Flags [.], ack 828236, win 65535, length 0
19:30:30.000378 IP 151.101.117.67.443 > 10.0.2.15.38050: Flags [P.], seq 828236:830984, ack 867, win 65535, length 2748
19:30:30.000381 IP 151.101.117.67.443 > 10.0.2.15.38050: Flags [P.], seq 830984:833732, ack 867, win 65535, length 2748
19:30:30.000383 IP 151.101.117.67.443 > 10.0.2.15.38050: Flags [P.], seq 833732:839228, ack 867, win 65535, length 5496
19:30:30.000401 IP 10.0.2.15.38050 > 151.101.117.67.443: Flags [.], ack 830984, win 65535, length 0
19:30:30.000596 IP 10.0.2.15.38050 > 151.101.117.67.443: Flags [.], ack 833732, win 65535, length 0
19:30:30.000612 IP 10.0.2.15.38050 > 151.101.117.67.443: Flags [.], ack 839228, win 65535, length 0
19:30:30.000631 IP 151.101.117.67.443 > 10.0.2.15.38050: Flags [P.], seq 839228:841976, ack 867, win 65535, length 2748
19:30:30.000637 IP 10.0.2.15.38050 > 151.101.117.67.443: Flags [.], ack 841976, win 65535, length 0
19:30:30.003057 IP 151.101.117.67.443 > 10.0.2.15.38050: Flags [P.], seq 841976:851594, ack 867, win 65535, length 9618
19:30:30.003060 IP 151.101.117.67.443 > 10.0.2.15.38050: Flags [P.], seq 851594:854342, ack 867, win 65535, length 2748
19:30:30.003125 IP 10.0.2.15.38050 > 151.101.117.67.443: Flags [.], ack 851594, win 65535, length 0
19:30:30.003165 IP 10.0.2.15.38050 > 151.101.117.67.443: Flags [.], ack 854342, win 65535, length 0
19:30:30.003189 IP 151.101.117.67.443 > 10.0.2.15.38050: Flags [P.], seq 854342:858464, ack 867, win 65535, length 4122
19:30:30.003190 IP 151.101.117.67.443 > 10.0.2.15.38050: Flags [P.], seq 858464:861212, ack 867, win 65535, length 2748
19:30:30.003196 IP 10.0.2.15.38050 > 151.101.117.67.443: Flags [.], ack 858464, win 65535, length 0
19:30:30.003205 IP 10.0.2.15.38050 > 151.101.117.67.443: Flags [.], ack 861212, win 65535, length 0
19:30:30.004044 IP 151.101.117.67.443 > 10.0.2.15.38050: Flags [P.], seq 861212:863960, ack 867, win 65535, length 2748
19:30:30.004046 IP 151.101.117.67.443 > 10.0.2.15.38050: Flags [P.], seq 863960:865334, ack 867, win 65535, length 1374
19:30:30.004060 IP 10.0.2.15.38050 > 151.101.117.67.443: Flags [.], ack 863960, win 65535, length 0
19:30:30.004315 IP 151.101.117.67.443 > 10.0.2.15.38050: Flags [P.], seq 865334:870830, ack 867, win 65535, length 5496
19:30:30.004322 IP 10.0.2.15.38050 > 151.101.117.67.443: Flags [.], ack 870830, win 65535, length 0
19:30:30.004546 IP 151.101.117.67.443 > 10.0.2.15.38050: Flags [P.], seq 870830:876326, ack 867, win 65535, length 5496
19:30:30.004554 IP 10.0.2.15.38050 > 151.101.117.67.443: Flags [.], ack 876326, win 65535, length 0
19:30:30.004703 IP 151.101.117.67.443 > 10.0.2.15.38050: Flags [P.], seq 876326:881822, ack 867, win 65535, length 5496
19:30:30.004810 IP 10.0.2.15.38050 > 151.101.117.67.443: Flags [.], ack 881822, win 65535, length 0
19:30:30.005117 IP 151.101.117.67.443 > 10.0.2.15.38050: Flags [P.], seq 881822:884570, ack 867, win 65535, length 2748
19:30:30.005119 IP 151.101.117.67.443 > 10.0.2.15.38050: Flags [P.], seq 884570:888692, ack 867, win 65535, length 4122
19:30:30.005133 IP 10.0.2.15.38050 > 151.101.117.67.443: Flags [.], ack 884570, win 65535, length 0
19:30:30.005160 IP 10.0.2.15.38050 > 151.101.117.67.443: Flags [.], ack 888692, win 65535, length 0
19:30:30.006717 IP 151.101.117.67.443 > 10.0.2.15.38050: Flags [P.], seq 888692:896936, ack 867, win 65535, length 8244
19:30:30.006780 IP 10.0.2.15.38050 > 151.101.117.67.443: Flags [.], ack 896936, win 65535, length 0
19:30:30.007305 IP 151.101.117.67.443 > 10.0.2.15.38050: Flags [P.], seq 896936:903806, ack 867, win 65535, length 6870
19:30:30.007307 IP 151.101.117.67.443 > 10.0.2.15.38050: Flags [P.], seq 903806:907928, ack 867, win 65535, length 4122
19:30:30.007320 IP 10.0.2.15.38050 > 151.101.117.67.443: Flags [.], ack 903806, win 65535, length 0
19:30:30.007344 IP 10.0.2.15.38050 > 151.101.117.67.443: Flags [.], ack 907928, win 65535, length 0
19:30:30.008497 IP 151.101.117.67.443 > 10.0.2.15.38050: Flags [P.], seq 907928:916172, ack 867, win 65535, length 8244
19:30:30.008499 IP 151.101.117.67.443 > 10.0.2.15.38050: Flags [P.], seq 916172:917546, ack 867, win 65535, length 1374
19:30:30.008518 IP 10.0.2.15.38050 > 151.101.117.67.443: Flags [.], ack 916172, win 65535, length 0
19:30:30.008787 IP 151.101.117.67.443 > 10.0.2.15.38050: Flags [P.], seq 917546:920294, ack 867, win 65535, length 2748
19:30:30.008788 IP 151.101.117.67.443 > 10.0.2.15.38050: Flags [P.], seq 920294:923042, ack 867, win 65535, length 2748
19:30:30.008799 IP 10.0.2.15.38050 > 151.101.117.67.443: Flags [.], ack 920294, win 65535, length 0
19:30:30.008842 IP 10.0.2.15.38050 > 151.101.117.67.443: Flags [.], ack 923042, win 65535, length 0
19:30:30.008946 IP 151.101.117.67.443 > 10.0.2.15.38050: Flags [P.], seq 923042:927164, ack 867, win 65535, length 4122
19:30:30.008954 IP 10.0.2.15.38050 > 151.101.117.67.443: Flags [.], ack 927164, win 65535, length 0
19:30:30.009283 IP 151.101.117.67.443 > 10.0.2.15.38050: Flags [P.], seq 927164:929912, ack 867, win 65535, length 2748
19:30:30.009284 IP 151.101.117.67.443 > 10.0.2.15.38050: Flags [P.], seq 929912:932660, ack 867, win 65535, length 2748
19:30:30.009296 IP 10.0.2.15.38050 > 151.101.117.67.443: Flags [.], ack 929912, win 65535, length 0
19:30:30.009313 IP 10.0.2.15.38050 > 151.101.117.67.443: Flags [.], ack 932660, win 65535, length 0
19:30:30.011354 IP 151.101.117.67.443 > 10.0.2.15.38050: Flags [P.], seq 932660:939530, ack 867, win 65535, length 6870
19:30:30.011495 IP 151.101.117.67.443 > 10.0.2.15.38050: Flags [P.], seq 939530:943652, ack 867, win 65535, length 4122
19:30:30.011530 IP 10.0.2.15.38050 > 151.101.117.67.443: Flags [.], ack 939530, win 65535, length 0
19:30:30.011566 IP 10.0.2.15.38050 > 151.101.117.67.443: Flags [.], ack 943652, win 65535, length 0
19:30:30.011635 IP 151.101.117.67.443 > 10.0.2.15.38050: Flags [P.], seq 943652:949148, ack 867, win 65535, length 5496
19:30:30.011636 IP 151.101.117.67.443 > 10.0.2.15.38050: Flags [P.], seq 949148:951896, ack 867, win 65535, length 2748
19:30:30.011637 IP 151.101.117.67.443 > 10.0.2.15.38050: Flags [P.], seq 951896:954644, ack 867, win 65535, length 2748
19:30:30.011643 IP 10.0.2.15.38050 > 151.101.117.67.443: Flags [.], ack 949148, win 65535, length 0
19:30:30.011656 IP 10.0.2.15.38050 > 151.101.117.67.443: Flags [.], ack 951896, win 65535, length 0
19:30:30.011664 IP 10.0.2.15.38050 > 151.101.117.67.443: Flags [.], ack 954644, win 65535, length 0
19:30:30.012502 IP 151.101.117.67.443 > 10.0.2.15.38050: Flags [P.], seq 954644:960140, ack 867, win 65535, length 5496
19:30:30.012516 IP 10.0.2.15.38050 > 151.101.117.67.443: Flags [.], ack 960140, win 65535, length 0
19:30:30.012785 IP 151.101.117.67.443 > 10.0.2.15.38050: Flags [P.], seq 960140:965636, ack 867, win 65535, length 5496
19:30:30.012787 IP 151.101.117.67.443 > 10.0.2.15.38050: Flags [P.], seq 965636:968384, ack 867, win 65535, length 2748
19:30:30.012881 IP 10.0.2.15.38050 > 151.101.117.67.443: Flags [.], ack 968384, win 65535, length 0
19:30:30.012962 IP 151.101.117.67.443 > 10.0.2.15.38050: Flags [P.], seq 968384:972506, ack 867, win 65535, length 4122
19:30:30.012963 IP 151.101.117.67.443 > 10.0.2.15.38050: Flags [.], seq 972506:973966, ack 867, win 65535, length 1460
19:30:30.013063 IP 151.101.117.67.443 > 10.0.2.15.38050: Flags [P.], seq 973966:975254, ack 867, win 65535, length 1288
19:30:30.013130 IP 10.0.2.15.38050 > 151.101.117.67.443: Flags [.], ack 975254, win 65535, length 0

