14:09:08.437992 IP 151.101.117.67.443 > 140.233.172.227.60805: Flags [.], ack 1350855527, win 285, options [nop,nop,TS val 352622719 ecr 2432158863], length 0
14:09:08.440462 IP 151.101.117.67.443 > 140.233.172.227.60805: Flags [.], seq 0:1374, ack 1, win 285, options [nop,nop,TS val 352622721 ecr 2432158863], length 1374
14:09:08.440463 IP 151.101.117.67.443 > 140.233.172.227.60805: Flags [P.], seq 1374:2748, ack 1, win 285, options [nop,nop,TS val 352622721 ecr 2432158863], length 1374
14:09:08.440463 IP 151.101.117.67.443 > 140.233.172.227.60805: Flags [.], seq 2748:4122, ack 1, win 285, options [nop,nop,TS val 352622721 ecr 2432158863], length 1374
14:09:08.440507 IP 140.233.172.227.60805 > 151.101.117.67.443: Flags [.], ack 4122, win 1996, options [nop,nop,TS val 2432158878 ecr 352622721], length 0
14:09:08.440664 IP 140.233.172.227.60805 > 151.101.117.67.443: Flags [.], ack 4122, win 2048, options [nop,nop,TS val 2432158878 ecr 352622721], length 0
14:09:08.441437 IP 151.101.117.67.443 > 140.233.172.227.60805: Flags [P.], seq 4122:5059, ack 1, win 285, options [nop,nop,TS val 352622721 ecr 2432158863], length 937
14:09:08.441471 IP 140.233.172.227.60805 > 151.101.117.67.443: Flags [.], ack 5059, win 2033, options [nop,nop,TS val 2432158878 ecr 352622721], length 0
14:09:08.443824 IP 140.233.172.227.60805 > 151.101.117.67.443: Flags [P.], seq 1:94, ack 5059, win 2048, options [nop,nop,TS val 2432158880 ecr 352622721], length 93
14:09:08.457398 IP 151.101.117.67.443 > 140.233.172.227.60805: Flags [.], ack 94, win 285, options [nop,nop,TS val 352622738 ecr 2432158880], length 0
14:09:08.459756 IP 151.101.117.67.443 > 140.233.172.227.60805: Flags [P.], seq 5059:5110, ack 94, win 285, options [nop,nop,TS val 352622740 ecr 2432158880], length 51
14:09:08.459831 IP 140.233.172.227.60805 > 151.101.117.67.443: Flags [.], ack 5110, win 2047, options [nop,nop,TS val 2432158896 ecr 352622740], length 0
14:09:08.460339 IP 140.233.172.227.60805 > 151.101.117.67.443: Flags [P.], seq 94:147, ack 5110, win 2048, options [nop,nop,TS val 2432158896 ecr 352622740], length 53
14:09:08.460367 IP 140.233.172.227.60805 > 151.101.117.67.443: Flags [P.], seq 147:203, ack 5110, win 2048, options [nop,nop,TS val 2432158896 ecr 352622740], length 56
14:09:08.460381 IP 140.233.172.227.60805 > 151.101.117.67.443: Flags [P.], seq 203:245, ack 5110, win 2048, options [nop,nop,TS val 2432158896 ecr 352622740], length 42
14:09:08.460433 IP 140.233.172.227.60805 > 151.101.117.67.443: Flags [P.], seq 245:312, ack 5110, win 2048, options [nop,nop,TS val 2432158896 ecr 352622740], length 67
14:09:08.472486 IP 151.101.117.67.443 > 140.233.172.227.60805: Flags [.], ack 147, win 285, options [nop,nop,TS val 352622755 ecr 2432158896], length 0
14:09:08.472488 IP 151.101.117.67.443 > 140.233.172.227.60805: Flags [.], ack 203, win 285, options [nop,nop,TS val 352622755 ecr 2432158896], length 0
14:09:08.472489 IP 151.101.117.67.443 > 140.233.172.227.60805: Flags [.], ack 245, win 285, options [nop,nop,TS val 352622755 ecr 2432158896], length 0
14:09:08.474590 IP 151.101.117.67.443 > 140.233.172.227.60805: Flags [.], ack 312, win 285, options [nop,nop,TS val 352622755 ecr 2432158896], length 0
14:09:08.474592 IP 151.101.117.67.443 > 140.233.172.227.60805: Flags [P.], seq 5110:5176, ack 312, win 285, options [nop,nop,TS val 352622756 ecr 2432158896], length 66
14:09:08.474669 IP 140.233.172.227.60805 > 151.101.117.67.443: Flags [.], ack 5176, win 2046, options [nop,nop,TS val 2432158910 ecr 352622756], length 0
14:09:08.474930 IP 140.233.172.227.60805 > 151.101.117.67.443: Flags [P.], seq 312:350, ack 5176, win 2048, options [nop,nop,TS val 2432158910 ecr 352622756], length 38
14:09:08.479105 IP 151.101.117.67.443 > 140.233.172.227.60805: Flags [.], seq 5176:6550, ack 312, win 285, options [nop,nop,TS val 352622761 ecr 2432158896], length 1374
14:09:08.479158 IP 140.233.172.227.60805 > 151.101.117.67.443: Flags [.], ack 6550, win 2026, options [nop,nop,TS val 2432158914 ecr 352622761], length 0
14:09:08.480026 IP 151.101.117.67.443 > 140.233.172.227.60805: Flags [P.], seq 6550:7924, ack 312, win 285, options [nop,nop,TS val 352622761 ecr 2432158896], length 1374
14:09:08.480027 IP 151.101.117.67.443 > 140.233.172.227.60805: Flags [.], seq 7924:9298, ack 312, win 285, options [nop,nop,TS val 352622761 ecr 2432158896], length 1374
14:09:08.480028 IP 151.101.117.67.443 > 140.233.172.227.60805: Flags [P.], seq 9298:10672, ack 312, win 285, options [nop,nop,TS val 352622761 ecr 2432158896], length 1374
14:09:08.480029 IP 151.101.117.67.443 > 140.233.172.227.60805: Flags [.], seq 10672:12046, ack 312, win 285, options [nop,nop,TS val 352622761 ecr 2432158896], length 1374
14:09:08.480077 IP 140.233.172.227.60805 > 151.101.117.67.443: Flags [.], ack 12046, win 1962, options [nop,nop,TS val 2432158914 ecr 352622761], length 0
14:09:08.480112 IP 151.101.117.67.443 > 140.233.172.227.60805: Flags [P.], seq 12046:13420, ack 312, win 285, options [nop,nop,TS val 352622761 ecr 2432158896], length 1374
14:09:08.480114 IP 151.101.117.67.443 > 140.233.172.227.60805: Flags [.], seq 13420:14794, ack 312, win 285, options [nop,nop,TS val 352622762 ecr 2432158896], length 1374
14:09:08.480149 IP 140.233.172.227.60805 > 151.101.117.67.443: Flags [.], ack 14794, win 1919, options [nop,nop,TS val 2432158915 ecr 352622762], length 0
14:09:08.480520 IP 140.233.172.227.60805 > 151.101.117.67.443: Flags [.], ack 14794, win 2048, options [nop,nop,TS val 2432158915 ecr 352622762], length 0
14:09:08.481090 IP 151.101.117.67.443 > 140.233.172.227.60805: Flags [P.], seq 14794:16168, ack 312, win 285, options [nop,nop,TS val 352622762 ecr 2432158896], length 1374
14:09:08.481092 IP 151.101.117.67.443 > 140.233.172.227.60805: Flags [.], seq 16168:17542, ack 312, win 285, options [nop,nop,TS val 352622763 ecr 2432158896], length 1374
14:09:08.481093 IP 151.101.117.67.443 > 140.233.172.227.60805: Flags [P.], seq 17542:18916, ack 312, win 285, options [nop,nop,TS val 352622763 ecr 2432158896], length 1374
14:09:08.481133 IP 140.233.172.227.60805 > 151.101.117.67.443: Flags [.], ack 18916, win 1983, options [nop,nop,TS val 2432158915 ecr 352622763], length 0
14:09:08.481146 IP 151.101.117.67.443 > 140.233.172.227.60805: Flags [.], seq 18916:20290, ack 312, win 285, options [nop,nop,TS val 352622764 ecr 2432158896], length 1374
14:09:08.481176 IP 140.233.172.227.60805 > 151.101.117.67.443: Flags [.], ack 20290, win 1962, options [nop,nop,TS val 2432158916 ecr 352622764], length 0
14:09:08.481271 IP 140.233.172.227.60805 > 151.101.117.67.443: Flags [.], ack 20290, win 2048, options [nop,nop,TS val 2432158916 ecr 352622764], length 0
14:09:08.482284 IP 151.101.117.67.443 > 140.233.172.227.60805: Flags [P.], seq 20290:21664, ack 312, win 285, options [nop,nop,TS val 352622764 ecr 2432158896], length 1374
14:09:08.482285 IP 151.101.117.67.443 > 140.233.172.227.60805: Flags [.], seq 21664:23038, ack 312, win 285, options [nop,nop,TS val 352622765 ecr 2432158896], length 1374
14:09:08.482330 IP 140.233.172.227.60805 > 151.101.117.67.443: Flags [.], ack 23038, win 2005, options [nop,nop,TS val 2432158917 ecr 352622765], length 0
14:09:08.482432 IP 140.233.172.227.60805 > 151.101.117.67.443: Flags [.], ack 23038, win 2048, options [nop,nop,TS val 2432158917 ecr 352622765], length 0
14:09:08.485389 IP 151.101.117.67.443 > 140.233.172.227.60805: Flags [P.], seq 23038:24412, ack 312, win 285, options [nop,nop,TS val 352622765 ecr 2432158896], length 1374
14:09:08.485394 IP 151.101.117.67.443 > 140.233.172.227.60805: Flags [.], seq 24412:25786, ack 312, win 285, options [nop,nop,TS val 352622765 ecr 2432158896], length 1374
14:09:08.485395 IP 151.101.117.67.443 > 140.233.172.227.60805: Flags [P.], seq 25786:27160, ack 312, win 285, options [nop,nop,TS val 352622765 ecr 2432158896], length 1374
14:09:08.485396 IP 151.101.117.67.443 > 140.233.172.227.60805: Flags [.], seq 27160:28534, ack 312, win 285, options [nop,nop,TS val 352622766 ecr 2432158896], length 1374
14:09:08.485397 IP 151.101.117.67.443 > 140.233.172.227.60805: Flags [P.], seq 28534:29908, ack 312, win 285, options [nop,nop,TS val 352622766 ecr 2432158896], length 1374
14:09:08.485463 IP 140.233.172.227.60805 > 151.101.117.67.443: Flags [.], ack 29908, win 1940, options [nop,nop,TS val 2432158920 ecr 352622766], length 0
14:09:08.485545 IP 151.101.117.67.443 > 140.233.172.227.60805: Flags [.], seq 29908:31282, ack 312, win 285, options [nop,nop,TS val 352622767 ecr 2432158896], length 1374
14:09:08.485547 IP 151.101.117.67.443 > 140.233.172.227.60805: Flags [P.], seq 31282:32656, ack 312, win 285, options [nop,nop,TS val 352622767 ecr 2432158896], length 1374
14:09:08.485548 IP 151.101.117.67.443 > 140.233.172.227.60805: Flags [.], seq 32656:34030, ack 312, win 285, options [nop,nop,TS val 352622768 ecr 2432158896], length 1374
14:09:08.485586 IP 140.233.172.227.60805 > 151.101.117.67.443: Flags [.], ack 34030, win 1881, options [nop,nop,TS val 2432158920 ecr 352622768], length 0
14:09:08.485695 IP 140.233.172.227.60805 > 151.101.117.67.443: Flags [.], ack 34030, win 2048, options [nop,nop,TS val 2432158920 ecr 352622768], length 0
14:09:08.486784 IP 151.101.117.67.443 > 140.233.172.227.60805: Flags [P.], seq 34030:35404, ack 312, win 285, options [nop,nop,TS val 352622768 ecr 2432158896], length 1374
14:09:08.486787 IP 151.101.117.67.443 > 140.233.172.227.60805: Flags [.], seq 35404:36778, ack 312, win 285, options [nop,nop,TS val 352622769 ecr 2432158896], length 1374
14:09:08.486788 IP 151.101.117.67.443 > 140.233.172.227.60805: Flags [P.], seq 36778:38152, ack 312, win 285, options [nop,nop,TS val 352622769 ecr 2432158896], length 1374
14:09:08.486839 IP 140.233.172.227.60805 > 151.101.117.67.443: Flags [.], ack 38152, win 1983, options [nop,nop,TS val 2432158921 ecr 352622769], length 0
14:09:08.486979 IP 140.233.172.227.60805 > 151.101.117.67.443: Flags [.], ack 38152, win 2048, options [nop,nop,TS val 2432158921 ecr 352622769], length 0
14:09:08.487784 IP 151.101.117.67.443 > 140.233.172.227.60805: Flags [.], seq 38152:39526, ack 312, win 285, options [nop,nop,TS val 352622770 ecr 2432158896], length 1374
14:09:08.487785 IP 151.101.117.67.443 > 140.233.172.227.60805: Flags [P.], seq 39526:40900, ack 312, win 285, options [nop,nop,TS val 352622770 ecr 2432158896], length 1374
14:09:08.487786 IP 151.101.117.67.443 > 140.233.172.227.60805: Flags [.], seq 40900:42274, ack 312, win 285, options [nop,nop,TS val 352622770 ecr 2432158910], length 1374
14:09:08.487833 IP 140.233.172.227.60805 > 151.101.117.67.443: Flags [.], ack 42274, win 2241, options [nop,nop,TS val 2432158921 ecr 352622770], length 0
14:09:08.487950 IP 140.233.172.227.60805 > 151.101.117.67.443: Flags [.], ack 42274, win 2305, options [nop,nop,TS val 2432158922 ecr 352622770], length 0
14:09:08.491029 IP 151.101.117.67.443 > 140.233.172.227.60805: Flags [P.], seq 42274:43648, ack 312, win 285, options [nop,nop,TS val 352622770 ecr 2432158910], length 1374
14:09:08.491031 IP 151.101.117.67.443 > 140.233.172.227.60805: Flags [.], ack 350, win 285, options [nop,nop,TS val 352622771 ecr 2432158910], length 0
14:09:08.491031 IP 151.101.117.67.443 > 140.233.172.227.60805: Flags [.], seq 43648:45022, ack 350, win 285, options [nop,nop,TS val 352622771 ecr 2432158910], length 1374
14:09:08.491033 IP 151.101.117.67.443 > 140.233.172.227.60805: Flags [P.], seq 45022:46396, ack 350, win 285, options [nop,nop,TS val 352622771 ecr 2432158910], length 1374
14:09:08.491085 IP 140.233.172.227.60805 > 151.101.117.67.443: Flags [.], ack 43648, win 2284, options [nop,nop,TS val 2432158925 ecr 352622770], length 0
14:09:08.491220 IP 151.101.117.67.443 > 140.233.172.227.60805: Flags [.], seq 46396:47770, ack 350, win 285, options [nop,nop,TS val 352622772 ecr 2432158910], length 1374
14:09:08.491222 IP 151.101.117.67.443 > 140.233.172.227.60805: Flags [.], seq 47770:49144, ack 350, win 285, options [nop,nop,TS val 352622773 ecr 2432158914], length 1374
14:09:08.491255 IP 140.233.172.227.60805 > 151.101.117.67.443: Flags [.], ack 49144, win 2209, options [nop,nop,TS val 2432158925 ecr 352622771], length 0
14:09:08.491375 IP 140.233.172.227.60805 > 151.101.117.67.443: Flags [.], ack 49144, win 2305, options [nop,nop,TS val 2432158925 ecr 352622771], length 0
14:09:08.492406 IP 151.101.117.67.443 > 140.233.172.227.60805: Flags [P.], seq 49144:50518, ack 350, win 285, options [nop,nop,TS val 352622773 ecr 2432158914], length 1374
14:09:08.492407 IP 151.101.117.67.443 > 140.233.172.227.60805: Flags [.], seq 50518:51892, ack 350, win 285, options [nop,nop,TS val 352622774 ecr 2432158914], length 1374
14:09:08.492409 IP 151.101.117.67.443 > 140.233.172.227.60805: Flags [.], seq 51892:53266, ack 350, win 285, options [nop,nop,TS val 352622774 ecr 2432158914], length 1374
14:09:08.492464 IP 140.233.172.227.60805 > 151.101.117.67.443: Flags [.], ack 53266, win 2241, options [nop,nop,TS val 2432158926 ecr 352622774], length 0
14:09:08.492553 IP 151.101.117.67.443 > 140.233.172.227.60805: Flags [P.], seq 53266:54640, ack 350, win 285, options [nop,nop,TS val 352622774 ecr 2432158914], length 1374
14:09:08.492555 IP 151.101.117.67.443 > 140.233.172.227.60805: Flags [.], seq 54640:56014, ack 350, win 285, options [nop,nop,TS val 352622774 ecr 2432158914], length 1374
14:09:08.492589 IP 140.233.172.227.60805 > 151.101.117.67.443: Flags [.], ack 56014, win 2198, options [nop,nop,TS val 2432158926 ecr 352622774], length 0
14:09:08.492751 IP 151.101.117.67.443 > 140.233.172.227.60805: Flags [.], seq 56014:57388, ack 350, win 285, options [nop,nop,TS val 352622774 ecr 2432158914], length 1374
14:09:08.492753 IP 151.101.117.67.443 > 140.233.172.227.60805: Flags [P.], seq 57388:58762, ack 350, win 285, options [nop,nop,TS val 352622774 ecr 2432158914], length 1374
14:09:08.492779 IP 140.233.172.227.60805 > 151.101.117.67.443: Flags [.], ack 58762, win 2212, options [nop,nop,TS val 2432158926 ecr 352622774], length 0
14:09:08.492829 IP 140.233.172.227.60805 > 151.101.117.67.443: Flags [.], ack 58762, win 2305, options [nop,nop,TS val 2432158926 ecr 352622774], length 0
14:09:08.493595 IP 151.101.117.67.443 > 140.233.172.227.60805: Flags [.], seq 58762:60136, ack 350, win 285, options [nop,nop,TS val 352622775 ecr 2432158915], length 1374
14:09:08.493596 IP 151.101.117.67.443 > 140.233.172.227.60805: Flags [.], seq 60136:61510, ack 350, win 285, options [nop,nop,TS val 352622775 ecr 2432158915], length 1374
14:09:08.493634 IP 140.233.172.227.60805 > 151.101.117.67.443: Flags [.], ack 61510, win 2262, options [nop,nop,TS val 2432158927 ecr 352622775], length 0
14:09:08.493804 IP 140.233.172.227.60805 > 151.101.117.67.443: Flags [.], ack 61510, win 2305, options [nop,nop,TS val 2432158927 ecr 352622775], length 0
14:09:08.495589 IP 151.101.117.67.443 > 140.233.172.227.60805: Flags [P.], seq 61510:62884, ack 350, win 285, options [nop,nop,TS val 352622775 ecr 2432158915], length 1374
14:09:08.495590 IP 151.101.117.67.443 > 140.233.172.227.60805: Flags [.], seq 62884:64258, ack 350, win 285, options [nop,nop,TS val 352622776 ecr 2432158915], length 1374
14:09:08.495591 IP 151.101.117.67.443 > 140.233.172.227.60805: Flags [.], seq 64258:65632, ack 350, win 285, options [nop,nop,TS val 352622776 ecr 2432158915], length 1374
14:09:08.495592 IP 151.101.117.67.443 > 140.233.172.227.60805: Flags [P.], seq 65632:67006, ack 350, win 285, options [nop,nop,TS val 352622776 ecr 2432158915], length 1374
14:09:08.495593 IP 151.101.117.67.443 > 140.233.172.227.60805: Flags [.], seq 67006:68380, ack 350, win 285, options [nop,nop,TS val 352622777 ecr 2432158915], length 1374
14:09:08.495646 IP 140.233.172.227.60805 > 151.101.117.67.443: Flags [.], ack 68380, win 2198, options [nop,nop,TS val 2432158928 ecr 352622777], length 0
14:09:08.495691 IP 151.101.117.67.443 > 140.233.172.227.60805: Flags [.], seq 68380:69754, ack 350, win 285, options [nop,nop,TS val 352622777 ecr 2432158915], length 1374
14:09:08.495692 IP 151.101.117.67.443 > 140.233.172.227.60805: Flags [.], seq 69754:71128, ack 350, win 285, options [nop,nop,TS val 352622777 ecr 2432158915], length 1374
14:09:08.495723 IP 140.233.172.227.60805 > 151.101.117.67.443: Flags [.], ack 71128, win 2172, options [nop,nop,TS val 2432158928 ecr 352622777], length 0
14:09:08.495813 IP 140.233.172.227.60805 > 151.101.117.67.443: Flags [.], ack 71128, win 2305, options [nop,nop,TS val 2432158928 ecr 352622777], length 0
14:09:08.496442 IP 151.101.117.67.443 > 140.233.172.227.60805: Flags [P.], seq 71128:72502, ack 350, win 285, options [nop,nop,TS val 352622777 ecr 2432158915], length 1374
14:09:08.496443 IP 151.101.117.67.443 > 140.233.172.227.60805: Flags [.], seq 72502:73876, ack 350, win 285, options [nop,nop,TS val 352622778 ecr 2432158916], length 1374
14:09:08.496482 IP 140.233.172.227.60805 > 151.101.117.67.443: Flags [.], ack 73876, win 2262, options [nop,nop,TS val 2432158929 ecr 352622778], length 0
14:09:08.496623 IP 140.233.172.227.60805 > 151.101.117.67.443: Flags [.], ack 73876, win 2305, options [nop,nop,TS val 2432158929 ecr 352622778], length 0
14:09:08.496675 IP 151.101.117.67.443 > 140.233.172.227.60805: Flags [.], seq 73876:75250, ack 350, win 285, options [nop,nop,TS val 352622778 ecr 2432158916], length 1374
14:09:08.496676 IP 151.101.117.67.443 > 140.233.172.227.60805: Flags [.], seq 75250:76624, ack 350, win 285, options [nop,nop,TS val 352622778 ecr 2432158916], length 1374
14:09:08.496677 IP 151.101.117.67.443 > 140.233.172.227.60805: Flags [P.], seq 76624:77998, ack 350, win 285, options [nop,nop,TS val 352622778 ecr 2432158916], length 1374
14:09:08.496698 IP 140.233.172.227.60805 > 151.101.117.67.443: Flags [.], ack 77998, win 2241, options [nop,nop,TS val 2432158929 ecr 352622778], length 0
14:09:08.496730 IP 151.101.117.67.443 > 140.233.172.227.60805: Flags [.], seq 77998:79372, ack 350, win 285, options [nop,nop,TS val 352622779 ecr 2432158917], length 1374
14:09:08.496760 IP 140.233.172.227.60805 > 151.101.117.67.443: Flags [.], ack 79372, win 2305, options [nop,nop,TS val 2432158929 ecr 352622779], length 0
14:09:08.497773 IP 151.101.117.67.443 > 140.233.172.227.60805: Flags [P.], seq 79372:80746, ack 350, win 285, options [nop,nop,TS val 352622779 ecr 2432158917], length 1374
14:09:08.497774 IP 151.101.117.67.443 > 140.233.172.227.60805: Flags [.], seq 80746:82120, ack 350, win 285, options [nop,nop,TS val 352622780 ecr 2432158920], length 1374
14:09:08.497775 IP 151.101.117.67.443 > 140.233.172.227.60805: Flags [.], seq 82120:83494, ack 350, win 285, options [nop,nop,TS val 352622780 ecr 2432158920], length 1374
14:09:08.497776 IP 151.101.117.67.443 > 140.233.172.227.60805: Flags [.], seq 83494:84868, ack 350, win 285, options [nop,nop,TS val 352622780 ecr 2432158920], length 1374
14:09:08.497777 IP 151.101.117.67.443 > 140.233.172.227.60805: Flags [.], seq 84868:86242, ack 350, win 285, options [nop,nop,TS val 352622780 ecr 2432158920], length 1374
14:09:08.497788 IP 151.101.117.67.443 > 140.233.172.227.60805: Flags [P.], seq 86242:87616, ack 350, win 285, options [nop,nop,TS val 352622780 ecr 2432158920], length 1374
14:09:08.497824 IP 140.233.172.227.60805 > 151.101.117.67.443: Flags [.], ack 86242, win 2198, options [nop,nop,TS val 2432158930 ecr 352622780], length 0
14:09:08.497907 IP 140.233.172.227.60805 > 151.101.117.67.443: Flags [.], ack 87616, win 2305, options [nop,nop,TS val 2432158930 ecr 352622780], length 0
14:09:08.498031 IP 151.101.117.67.443 > 140.233.172.227.60805: Flags [.], seq 87616:88990, ack 350, win 285, options [nop,nop,TS val 352622780 ecr 2432158920], length 1374
14:09:08.498032 IP 151.101.117.67.443 > 140.233.172.227.60805: Flags [.], seq 88990:90364, ack 350, win 285, options [nop,nop,TS val 352622780 ecr 2432158920], length 1374
14:09:08.498033 IP 151.101.117.67.443 > 140.233.172.227.60805: Flags [.], seq 90364:91738, ack 350, win 285, options [nop,nop,TS val 352622780 ecr 2432158920], length 1374
14:09:08.498063 IP 140.233.172.227.60805 > 151.101.117.67.443: Flags [.], ack 91738, win 2241, options [nop,nop,TS val 2432158930 ecr 352622780], length 0
14:09:08.498182 IP 140.233.172.227.60805 > 151.101.117.67.443: Flags [.], ack 91738, win 2305, options [nop,nop,TS val 2432158930 ecr 352622780], length 0
14:09:08.498302 IP 151.101.117.67.443 > 140.233.172.227.60805: Flags [.], seq 91738:93112, ack 350, win 285, options [nop,nop,TS val 352622780 ecr 2432158920], length 1374
14:09:08.499194 IP 151.101.117.67.443 > 140.233.172.227.60805: Flags [P.], seq 93112:94486, ack 350, win 285, options [nop,nop,TS val 352622780 ecr 2432158920], length 1374
14:09:08.499195 IP 151.101.117.67.443 > 140.233.172.227.60805: Flags [.], seq 94486:95860, ack 350, win 285, options [nop,nop,TS val 352622781 ecr 2432158920], length 1374
14:09:08.499196 IP 151.101.117.67.443 > 140.233.172.227.60805: Flags [.], seq 95860:97234, ack 350, win 285, options [nop,nop,TS val 352622781 ecr 2432158920], length 1374
14:09:08.499197 IP 151.101.117.67.443 > 140.233.172.227.60805: Flags [.], seq 97234:98608, ack 350, win 285, options [nop,nop,TS val 352622781 ecr 2432158920], length 1374
14:09:08.499198 IP 151.101.117.67.443 > 140.233.172.227.60805: Flags [.], seq 98608:99982, ack 350, win 285, options [nop,nop,TS val 352622781 ecr 2432158920], length 1374
14:09:08.499211 IP 151.101.117.67.443 > 140.233.172.227.60805: Flags [.], seq 99982:101356, ack 350, win 285, options [nop,nop,TS val 352622781 ecr 2432158920], length 1374
14:09:08.499239 IP 140.233.172.227.60805 > 151.101.117.67.443: Flags [.], ack 99982, win 2198, options [nop,nop,TS val 2432158931 ecr 352622780], length 0
14:09:08.499334 IP 140.233.172.227.60805 > 151.101.117.67.443: Flags [.], ack 101356, win 2305, options [nop,nop,TS val 2432158931 ecr 352622781], length 0
14:09:08.500049 IP 151.101.117.67.443 > 140.233.172.227.60805: Flags [P.], seq 101356:102730, ack 350, win 285, options [nop,nop,TS val 352622781 ecr 2432158920], length 1374
14:09:08.500050 IP 151.101.117.67.443 > 140.233.172.227.60805: Flags [.], seq 102730:104104, ack 350, win 285, options [nop,nop,TS val 352622782 ecr 2432158921], length 1374
14:09:08.500051 IP 151.101.117.67.443 > 140.233.172.227.60805: Flags [.], seq 104104:105478, ack 350, win 285, options [nop,nop,TS val 352622782 ecr 2432158921], length 1374
14:09:08.500061 IP 151.101.117.67.443 > 140.233.172.227.60805: Flags [.], seq 105478:106852, ack 350, win 285, options [nop,nop,TS val 352622782 ecr 2432158921], length 1374
14:09:08.500088 IP 140.233.172.227.60805 > 151.101.117.67.443: Flags [.], ack 105478, win 3872, options [nop,nop,TS val 2432158931 ecr 352622782], length 0
14:09:08.500218 IP 140.233.172.227.60805 > 151.101.117.67.443: Flags [.], ack 106852, win 3937, options [nop,nop,TS val 2432158931 ecr 352622782], length 0
14:09:08.500239 IP 151.101.117.67.443 > 140.233.172.227.60805: Flags [.], seq 106852:108226, ack 350, win 285, options [nop,nop,TS val 352622782 ecr 2432158921], length 1374
14:09:08.500240 IP 151.101.117.67.443 > 140.233.172.227.60805: Flags [.], seq 108226:109600, ack 350, win 285, options [nop,nop,TS val 352622782 ecr 2432158921], length 1374
14:09:08.500283 IP 140.233.172.227.60805 > 151.101.117.67.443: Flags [.], ack 109600, win 3937, options [nop,nop,TS val 2432158932 ecr 352622782], length 0
14:09:08.500420 IP 151.101.117.67.443 > 140.233.172.227.60805: Flags [P.], seq 109600:110974, ack 350, win 285, options [nop,nop,TS val 352622782 ecr 2432158921], length 1374
14:09:08.500541 IP 140.233.172.227.60805 > 151.101.117.67.443: Flags [.], ack 110974, win 3937, options [nop,nop,TS val 2432158932 ecr 352622782], length 0
14:09:08.501264 IP 151.101.117.67.443 > 140.233.172.227.60805: Flags [.], seq 110974:112348, ack 350, win 285, options [nop,nop,TS val 352622783 ecr 2432158921], length 1374
14:09:08.501266 IP 151.101.117.67.443 > 140.233.172.227.60805: Flags [.], seq 112348:113722, ack 350, win 285, options [nop,nop,TS val 352622783 ecr 2432158921], length 1374
14:09:08.501266 IP 151.101.117.67.443 > 140.233.172.227.60805: Flags [.], seq 113722:115096, ack 350, win 285, options [nop,nop,TS val 352622783 ecr 2432158921], length 1374
14:09:08.501267 IP 151.101.117.67.443 > 140.233.172.227.60805: Flags [.], seq 115096:116470, ack 350, win 285, options [nop,nop,TS val 352622783 ecr 2432158921], length 1374
14:09:08.501354 IP 140.233.172.227.60805 > 151.101.117.67.443: Flags [.], ack 116470, win 3937, options [nop,nop,TS val 2432158933 ecr 352622783], length 0
14:09:08.502260 IP 151.101.117.67.443 > 140.233.172.227.60805: Flags [.], seq 116470:117844, ack 350, win 285, options [nop,nop,TS val 352622783 ecr 2432158921], length 1374
14:09:08.502261 IP 151.101.117.67.443 > 140.233.172.227.60805: Flags [.], seq 117844:119218, ack 350, win 285, options [nop,nop,TS val 352622783 ecr 2432158921], length 1374
14:09:08.502263 IP 151.101.117.67.443 > 140.233.172.227.60805: Flags [P.], seq 119218:120592, ack 350, win 285, options [nop,nop,TS val 352622783 ecr 2432158921], length 1374
14:09:08.502325 IP 140.233.172.227.60805 > 151.101.117.67.443: Flags [.], ack 120592, win 3937, options [nop,nop,TS val 2432158934 ecr 352622783], length 0
14:09:08.503378 IP 151.101.117.67.443 > 140.233.172.227.60805: Flags [.], seq 120592:121966, ack 350, win 285, options [nop,nop,TS val 352622785 ecr 2432158925], length 1374
14:09:08.503379 IP 151.101.117.67.443 > 140.233.172.227.60805: Flags [.], seq 121966:123340, ack 350, win 285, options [nop,nop,TS val 352622785 ecr 2432158925], length 1374
14:09:08.503381 IP 151.101.117.67.443 > 140.233.172.227.60805: Flags [P.], seq 123340:124714, ack 350, win 285, options [nop,nop,TS val 352622785 ecr 2432158925], length 1374
14:09:08.503382 IP 151.101.117.67.443 > 140.233.172.227.60805: Flags [.], seq 124714:126088, ack 350, win 285, options [nop,nop,TS val 352622785 ecr 2432158925], length 1374
14:09:08.503397 IP 151.101.117.67.443 > 140.233.172.227.60805: Flags [.], seq 126088:127462, ack 350, win 285, options [nop,nop,TS val 352622785 ecr 2432158925], length 1374
14:09:08.503530 IP 140.233.172.227.60805 > 151.101.117.67.443: Flags [.], ack 127462, win 3937, options [nop,nop,TS val 2432158935 ecr 352622785], length 0
14:09:08.503571 IP 151.101.117.67.443 > 140.233.172.227.60805: Flags [.], seq 127462:128836, ack 350, win 285, options [nop,nop,TS val 352622785 ecr 2432158925], length 1374
14:09:08.503629 IP 151.101.117.67.443 > 140.233.172.227.60805: Flags [.], seq 128836:130210, ack 350, win 285, options [nop,nop,TS val 352622785 ecr 2432158925], length 1374
14:09:08.503631 IP 151.101.117.67.443 > 140.233.172.227.60805: Flags [.], seq 130210:131584, ack 350, win 285, options [nop,nop,TS val 352622785 ecr 2432158925], length 1374
14:09:08.503696 IP 140.233.172.227.60805 > 151.101.117.67.443: Flags [.], ack 131584, win 3937, options [nop,nop,TS val 2432158935 ecr 352622785], length 0
14:09:08.503749 IP 151.101.117.67.443 > 140.233.172.227.60805: Flags [.], seq 131584:132958, ack 350, win 285, options [nop,nop,TS val 352622785 ecr 2432158925], length 1374
14:09:08.503883 IP 151.101.117.67.443 > 140.233.172.227.60805: Flags [.], seq 132958:134332, ack 350, win 285, options [nop,nop,TS val 352622785 ecr 2432158925], length 1374
14:09:08.503927 IP 140.233.172.227.60805 > 151.101.117.67.443: Flags [.], ack 134332, win 3937, options [nop,nop,TS val 2432158935 ecr 352622785], length 0
14:09:08.504821 IP 151.101.117.67.443 > 140.233.172.227.60805: Flags [P.], seq 134332:135706, ack 350, win 285, options [nop,nop,TS val 352622785 ecr 2432158925], length 1374
14:09:08.504822 IP 151.101.117.67.443 > 140.233.172.227.60805: Flags [.], seq 135706:137080, ack 350, win 285, options [nop,nop,TS val 352622787 ecr 2432158926], length 1374
14:09:08.504823 IP 151.101.117.67.443 > 140.233.172.227.60805: Flags [.], seq 137080:138454, ack 350, win 285, options [nop,nop,TS val 352622787 ecr 2432158926], length 1374
14:09:08.504824 IP 151.101.117.67.443 > 140.233.172.227.60805: Flags [.], seq 138454:139828, ack 350, win 285, options [nop,nop,TS val 352622787 ecr 2432158926], length 1374
14:09:08.505005 IP 151.101.117.67.443 > 140.233.172.227.60805: Flags [.], seq 139828:141202, ack 350, win 285, options [nop,nop,TS val 352622787 ecr 2432158926], length 1374
14:09:08.505006 IP 151.101.117.67.443 > 140.233.172.227.60805: Flags [.], seq 141202:142576, ack 350, win 285, options [nop,nop,TS val 352622787 ecr 2432158926], length 1374
14:09:08.505010 IP 140.233.172.227.60805 > 151.101.117.67.443: Flags [.], ack 139828, win 3937, options [nop,nop,TS val 2432158936 ecr 352622787], length 0
14:09:08.505060 IP 140.233.172.227.60805 > 151.101.117.67.443: Flags [.], ack 142576, win 3937, options [nop,nop,TS val 2432158936 ecr 352622787], length 0
14:09:08.505138 IP 151.101.117.67.443 > 140.233.172.227.60805: Flags [.], seq 142576:143950, ack 350, win 285, options [nop,nop,TS val 352622787 ecr 2432158926], length 1374
14:09:08.507340 IP 151.101.117.67.443 > 140.233.172.227.60805: Flags [P.], seq 143950:145324, ack 350, win 285, options [nop,nop,TS val 352622787 ecr 2432158926], length 1374
14:09:08.507341 IP 151.101.117.67.443 > 140.233.172.227.60805: Flags [.], seq 145324:146698, ack 350, win 285, options [nop,nop,TS val 352622788 ecr 2432158927], length 1374
14:09:08.507343 IP 151.101.117.67.443 > 140.233.172.227.60805: Flags [.], seq 146698:148072, ack 350, win 285, options [nop,nop,TS val 352622788 ecr 2432158927], length 1374
14:09:08.507484 IP 140.233.172.227.60805 > 151.101.117.67.443: Flags [.], ack 148072, win 3937, options [nop,nop,TS val 2432158938 ecr 352622787], length 0
14:09:08.507493 IP 151.101.117.67.443 > 140.233.172.227.60805: Flags [.], seq 148072:149446, ack 350, win 285, options [nop,nop,TS val 352622788 ecr 2432158927], length 1374
14:09:08.507494 IP 151.101.117.67.443 > 140.233.172.227.60805: Flags [.], seq 149446:150820, ack 350, win 285, options [nop,nop,TS val 352622788 ecr 2432158927], length 1374
14:09:08.507573 IP 140.233.172.227.60805 > 151.101.117.67.443: Flags [.], ack 150820, win 3937, options [nop,nop,TS val 2432158938 ecr 352622788], length 0
14:09:08.507603 IP 151.101.117.67.443 > 140.233.172.227.60805: Flags [.], seq 150820:152194, ack 350, win 285, options [nop,nop,TS val 352622788 ecr 2432158927], length 1374
14:09:08.507604 IP 151.101.117.67.443 > 140.233.172.227.60805: Flags [.], seq 152194:153568, ack 350, win 285, options [nop,nop,TS val 352622788 ecr 2432158927], length 1374
14:09:08.507643 IP 140.233.172.227.60805 > 151.101.117.67.443: Flags [.], ack 153568, win 3937, options [nop,nop,TS val 2432158938 ecr 352622788], length 0
14:09:08.507728 IP 151.101.117.67.443 > 140.233.172.227.60805: Flags [.], seq 153568:154942, ack 350, win 285, options [nop,nop,TS val 352622788 ecr 2432158927], length 1374
14:09:08.507937 IP 151.101.117.67.443 > 140.233.172.227.60805: Flags [.], seq 154942:156316, ack 350, win 285, options [nop,nop,TS val 352622788 ecr 2432158927], length 1374
14:09:08.507939 IP 151.101.117.67.443 > 140.233.172.227.60805: Flags [P.], seq 156316:157690, ack 350, win 285, options [nop,nop,TS val 352622788 ecr 2432158927], length 1374
14:09:08.508027 IP 140.233.172.227.60805 > 151.101.117.67.443: Flags [.], ack 157690, win 3937, options [nop,nop,TS val 2432158938 ecr 352622788], length 0
14:09:08.509114 IP 151.101.117.67.443 > 140.233.172.227.60805: Flags [.], seq 157690:159064, ack 350, win 285, options [nop,nop,TS val 352622790 ecr 2432158928], length 1374
14:09:08.509116 IP 151.101.117.67.443 > 140.233.172.227.60805: Flags [.], seq 159064:160438, ack 350, win 285, options [nop,nop,TS val 352622790 ecr 2432158928], length 1374
14:09:08.509117 IP 151.101.117.67.443 > 140.233.172.227.60805: Flags [.], seq 160438:161812, ack 350, win 285, options [nop,nop,TS val 352622790 ecr 2432158928], length 1374
14:09:08.509127 IP 151.101.117.67.443 > 140.233.172.227.60805: Flags [.], seq 161812:163186, ack 350, win 285, options [nop,nop,TS val 352622790 ecr 2432158928], length 1374
14:09:08.509210 IP 140.233.172.227.60805 > 151.101.117.67.443: Flags [.], ack 163186, win 3937, options [nop,nop,TS val 2432158939 ecr 352622790], length 0
14:09:08.509400 IP 151.101.117.67.443 > 140.233.172.227.60805: Flags [.], seq 163186:164560, ack 350, win 285, options [nop,nop,TS val 352622790 ecr 2432158928], length 1374
14:09:08.509401 IP 151.101.117.67.443 > 140.233.172.227.60805: Flags [.], seq 164560:165934, ack 350, win 285, options [nop,nop,TS val 352622790 ecr 2432158928], length 1374
14:09:08.509402 IP 151.101.117.67.443 > 140.233.172.227.60805: Flags [.], seq 165934:167308, ack 350, win 285, options [nop,nop,TS val 352622790 ecr 2432158928], length 1374
14:09:08.509462 IP 140.233.172.227.60805 > 151.101.117.67.443: Flags [.], ack 167308, win 3937, options [nop,nop,TS val 2432158939 ecr 352622790], length 0
14:09:08.509634 IP 151.101.117.67.443 > 140.233.172.227.60805: Flags [.], seq 167308:168682, ack 350, win 285, options [nop,nop,TS val 352622790 ecr 2432158928], length 1374
14:09:08.509635 IP 151.101.117.67.443 > 140.233.172.227.60805: Flags [.], seq 168682:170056, ack 350, win 285, options [nop,nop,TS val 352622790 ecr 2432158928], length 1374
14:09:08.509677 IP 140.233.172.227.60805 > 151.101.117.67.443: Flags [.], ack 170056, win 3937, options [nop,nop,TS val 2432158939 ecr 352622790], length 0
14:09:08.510773 IP 151.101.117.67.443 > 140.233.172.227.60805: Flags [P.], seq 170056:171430, ack 350, win 285, options [nop,nop,TS val 352622790 ecr 2432158928], length 1374
14:09:08.510774 IP 151.101.117.67.443 > 140.233.172.227.60805: Flags [.], seq 171430:172804, ack 350, win 285, options [nop,nop,TS val 352622792 ecr 2432158929], length 1374
14:09:08.510775 IP 151.101.117.67.443 > 140.233.172.227.60805: Flags [.], seq 172804:174178, ack 350, win 285, options [nop,nop,TS val 352622792 ecr 2432158929], length 1374
14:09:08.510906 IP 140.233.172.227.60805 > 151.101.117.67.443: Flags [.], ack 174178, win 3937, options [nop,nop,TS val 2432158940 ecr 352622792], length 0
14:09:08.510947 IP 151.101.117.67.443 > 140.233.172.227.60805: Flags [.], seq 174178:175552, ack 350, win 285, options [nop,nop,TS val 352622792 ecr 2432158929], length 1374
14:09:08.510948 IP 151.101.117.67.443 > 140.233.172.227.60805: Flags [.], seq 175552:176926, ack 350, win 285, options [nop,nop,TS val 352622792 ecr 2432158929], length 1374
14:09:08.510992 IP 151.101.117.67.443 > 140.233.172.227.60805: Flags [.], seq 176926:178300, ack 350, win 285, options [nop,nop,TS val 352622792 ecr 2432158929], length 1374
14:09:08.511008 IP 140.233.172.227.60805 > 151.101.117.67.443: Flags [.], ack 176926, win 3937, options [nop,nop,TS val 2432158940 ecr 352622792], length 0
14:09:08.511162 IP 151.101.117.67.443 > 140.233.172.227.60805: Flags [.], seq 178300:179674, ack 350, win 285, options [nop,nop,TS val 352622792 ecr 2432158929], length 1374
14:09:08.511164 IP 151.101.117.67.443 > 140.233.172.227.60805: Flags [.], seq 179674:181048, ack 350, win 285, options [nop,nop,TS val 352622792 ecr 2432158929], length 1374
14:09:08.511223 IP 140.233.172.227.60805 > 151.101.117.67.443: Flags [.], ack 181048, win 3937, options [nop,nop,TS val 2432158940 ecr 352622792], length 0
14:09:08.511226 IP 151.101.117.67.443 > 140.233.172.227.60805: Flags [.], seq 181048:182422, ack 350, win 285, options [nop,nop,TS val 352622792 ecr 2432158929], length 1374
14:09:08.511510 IP 151.101.117.67.443 > 140.233.172.227.60805: Flags [.], seq 182422:183796, ack 350, win 285, options [nop,nop,TS val 352622792 ecr 2432158929], length 1374
14:09:08.511511 IP 151.101.117.67.443 > 140.233.172.227.60805: Flags [P.], seq 183796:185170, ack 350, win 285, options [nop,nop,TS val 352622792 ecr 2432158929], length 1374
14:09:08.511512 IP 151.101.117.67.443 > 140.233.172.227.60805: Flags [.], seq 185170:186544, ack 350, win 285, options [nop,nop,TS val 352622793 ecr 2432158930], length 1374
14:09:08.511544 IP 151.101.117.67.443 > 140.233.172.227.60805: Flags [.], seq 186544:187918, ack 350, win 285, options [nop,nop,TS val 352622793 ecr 2432158930], length 1374
14:09:08.511646 IP 151.101.117.67.443 > 140.233.172.227.60805: Flags [.], seq 187918:189292, ack 350, win 285, options [nop,nop,TS val 352622793 ecr 2432158930], length 1374
14:09:08.511653 IP 140.233.172.227.60805 > 151.101.117.67.443: Flags [.], ack 187918, win 3937, options [nop,nop,TS val 2432158940 ecr 352622792], length 0
14:09:08.511861 IP 151.101.117.67.443 > 140.233.172.227.60805: Flags [.], seq 189292:190666, ack 350, win 285, options [nop,nop,TS val 352622793 ecr 2432158930], length 1374
14:09:08.511863 IP 151.101.117.67.443 > 140.233.172.227.60805: Flags [.], seq 190666:192040, ack 350, win 285, options [nop,nop,TS val 352622793 ecr 2432158930], length 1374
14:09:08.511903 IP 151.101.117.67.443 > 140.233.172.227.60805: Flags [.], seq 192040:193414, ack 350, win 285, options [nop,nop,TS val 352622793 ecr 2432158930], length 1374
14:09:08.511940 IP 140.233.172.227.60805 > 151.101.117.67.443: Flags [.], ack 193414, win 3937, options [nop,nop,TS val 2432158941 ecr 352622793], length 0
14:09:08.512097 IP 151.101.117.67.443 > 140.233.172.227.60805: Flags [.], seq 193414:194788, ack 350, win 285, options [nop,nop,TS val 352622793 ecr 2432158930], length 1374
14:09:08.512098 IP 151.101.117.67.443 > 140.233.172.227.60805: Flags [.], seq 194788:196162, ack 350, win 285, options [nop,nop,TS val 352622793 ecr 2432158930], length 1374
14:09:08.512138 IP 151.101.117.67.443 > 140.233.172.227.60805: Flags [.], seq 196162:197536, ack 350, win 285, options [nop,nop,TS val 352622793 ecr 2432158930], length 1374
14:09:08.512175 IP 140.233.172.227.60805 > 151.101.117.67.443: Flags [.], ack 197536, win 3937, options [nop,nop,TS val 2432158941 ecr 352622793], length 0
14:09:08.512442 IP 151.101.117.67.443 > 140.233.172.227.60805: Flags [.], seq 197536:198910, ack 350, win 285, options [nop,nop,TS val 352622793 ecr 2432158930], length 1374
14:09:08.512443 IP 151.101.117.67.443 > 140.233.172.227.60805: Flags [.], seq 198910:200284, ack 350, win 285, options [nop,nop,TS val 352622793 ecr 2432158930], length 1374
14:09:08.512505 IP 140.233.172.227.60805 > 151.101.117.67.443: Flags [.], ack 200284, win 3937, options [nop,nop,TS val 2432158941 ecr 352622793], length 0
14:09:08.513456 IP 151.101.117.67.443 > 140.233.172.227.60805: Flags [P.], seq 200284:201658, ack 350, win 285, options [nop,nop,TS val 352622793 ecr 2432158930], length 1374
14:09:08.513457 IP 151.101.117.67.443 > 140.233.172.227.60805: Flags [.], seq 201658:203032, ack 350, win 285, options [nop,nop,TS val 352622794 ecr 2432158930], length 1374
14:09:08.513458 IP 151.101.117.67.443 > 140.233.172.227.60805: Flags [.], seq 203032:204406, ack 350, win 285, options [nop,nop,TS val 352622794 ecr 2432158930], length 1374
14:09:08.513459 IP 151.101.117.67.443 > 140.233.172.227.60805: Flags [.], seq 204406:205780, ack 350, win 285, options [nop,nop,TS val 352622794 ecr 2432158930], length 1374
14:09:08.513461 IP 151.101.117.67.443 > 140.233.172.227.60805: Flags [.], seq 205780:207154, ack 350, win 285, options [nop,nop,TS val 352622794 ecr 2432158930], length 1374
14:09:08.513496 IP 151.101.117.67.443 > 140.233.172.227.60805: Flags [.], seq 207154:208528, ack 350, win 285, options [nop,nop,TS val 352622794 ecr 2432158930], length 1374
14:09:08.513497 IP 151.101.117.67.443 > 140.233.172.227.60805: Flags [P.], seq 208528:209902, ack 350, win 285, options [nop,nop,TS val 352622794 ecr 2432158930], length 1374
14:09:08.513609 IP 140.233.172.227.60805 > 151.101.117.67.443: Flags [.], ack 209902, win 3937, options [nop,nop,TS val 2432158942 ecr 352622794], length 0
14:09:08.513775 IP 151.101.117.67.443 > 140.233.172.227.60805: Flags [.], seq 209902:211276, ack 350, win 285, options [nop,nop,TS val 352622794 ecr 2432158931], length 1374
14:09:08.513776 IP 151.101.117.67.443 > 140.233.172.227.60805: Flags [.], seq 211276:212650, ack 350, win 285, options [nop,nop,TS val 352622794 ecr 2432158931], length 1374
