19:27:25.204946 IP 10.0.2.15.41673 > 140.233.253.2.53: 52850+ A? www.cnn.com. (29)
19:27:25.204994 IP 10.0.2.15.41673 > 140.233.253.2.53: 46198+ AAAA? www.cnn.com. (29)
19:27:25.209752 IP 140.233.253.2.53 > 10.0.2.15.41673: 52850 2/0/0 CNAME turner-tls.map.fastly.net., A 151.101.117.67 (84)
19:27:25.209754 IP 140.233.253.2.53 > 10.0.2.15.41673: 46198 2/0/0 CNAME turner-tls.map.fastly.net., AAAA 2a04:4e42:1c::323 (96)
19:27:25.210870 IP 10.0.2.15.37972 > 151.101.117.67.443: Flags [S], seq 1759680597, win 64240, options [mss 1460,sackOK,TS val 1396564183 ecr 0,nop,wscale 6], length 0
19:27:25.225981 IP 151.101.117.67.443 > 10.0.2.15.37972: Flags [S.], seq 165504001, ack 1759680598, win 65535, options [mss 1460], length 0
19:27:25.226086 IP 10.0.2.15.37972 > 151.101.117.67.443: Flags [.], ack 1, win 64240, length 0
19:27:25.238602 IP 10.0.2.15.37972 > 151.101.117.67.443: Flags [P.], seq 1:518, ack 1, win 64240, length 517
19:27:25.238992 IP 151.101.117.67.443 > 10.0.2.15.37972: Flags [.], ack 518, win 65535, length 0
19:27:25.259237 IP 151.101.117.67.443 > 10.0.2.15.37972: Flags [.], seq 1:2921, ack 518, win 65535, length 2920
19:27:25.259267 IP 10.0.2.15.37972 > 151.101.117.67.443: Flags [.], ack 2921, win 62780, length 0
19:27:25.259420 IP 151.101.117.67.443 > 10.0.2.15.37972: Flags [P.], seq 2921:5064, ack 518, win 65535, length 2143
19:27:25.259431 IP 10.0.2.15.37972 > 151.101.117.67.443: Flags [.], ack 5064, win 61320, length 0
19:27:25.261292 IP 10.0.2.15.37972 > 151.101.117.67.443: Flags [P.], seq 518:611, ack 5064, win 62780, length 93
19:27:25.261702 IP 151.101.117.67.443 > 10.0.2.15.37972: Flags [.], ack 611, win 65535, length 0
19:27:25.282519 IP 151.101.117.67.443 > 10.0.2.15.37972: Flags [P.], seq 5064:5115, ack 611, win 65535, length 51
19:27:25.282623 IP 10.0.2.15.37972 > 151.101.117.67.443: Flags [.], ack 5115, win 62780, length 0
19:27:25.283214 IP 10.0.2.15.37972 > 151.101.117.67.443: Flags [P.], seq 611:664, ack 5115, win 62780, length 53
19:27:25.283252 IP 10.0.2.15.37972 > 151.101.117.67.443: Flags [P.], seq 664:720, ack 5115, win 62780, length 56
19:27:25.283514 IP 151.101.117.67.443 > 10.0.2.15.37972: Flags [.], ack 664, win 65535, length 0
19:27:25.283515 IP 151.101.117.67.443 > 10.0.2.15.37972: Flags [.], ack 720, win 65535, length 0
19:27:25.283534 IP 10.0.2.15.37972 > 151.101.117.67.443: Flags [P.], seq 720:829, ack 5115, win 62780, length 109
19:27:25.283701 IP 151.101.117.67.443 > 10.0.2.15.37972: Flags [.], ack 829, win 65535, length 0
19:27:25.297654 IP 151.101.117.67.443 > 10.0.2.15.37972: Flags [P.], seq 5115:5210, ack 829, win 65535, length 95
19:27:25.297676 IP 10.0.2.15.37972 > 151.101.117.67.443: Flags [.], ack 5210, win 62780, length 0
19:27:25.297884 IP 10.0.2.15.37972 > 151.101.117.67.443: Flags [P.], seq 829:867, ack 5210, win 62780, length 38
19:27:25.298311 IP 151.101.117.67.443 > 10.0.2.15.37972: Flags [.], ack 867, win 65535, length 0
19:27:25.301581 IP 151.101.117.67.443 > 10.0.2.15.37972: Flags [.], seq 5210:13970, ack 867, win 65535, length 8760
19:27:25.301663 IP 10.0.2.15.37972 > 151.101.117.67.443: Flags [.], ack 13970, win 58400, length 0
19:27:25.302232 IP 151.101.117.67.443 > 10.0.2.15.37972: Flags [P.], seq 13970:18950, ack 867, win 65535, length 4980
19:27:25.302279 IP 10.0.2.15.37972 > 151.101.117.67.443: Flags [.], ack 18950, win 55480, length 0
19:27:25.305104 IP 151.101.117.67.443 > 10.0.2.15.37972: Flags [P.], seq 18950:24446, ack 867, win 65535, length 5496
19:27:25.305106 IP 151.101.117.67.443 > 10.0.2.15.37972: Flags [P.], seq 24446:28568, ack 867, win 65535, length 4122
19:27:25.305124 IP 10.0.2.15.37972 > 151.101.117.67.443: Flags [.], ack 24446, win 61320, length 0
19:27:25.305343 IP 10.0.2.15.37972 > 151.101.117.67.443: Flags [.], ack 28568, win 58400, length 0
19:27:25.305935 IP 151.101.117.67.443 > 10.0.2.15.37972: Flags [P.], seq 28568:32690, ack 867, win 65535, length 4122
19:27:25.305945 IP 10.0.2.15.37972 > 151.101.117.67.443: Flags [.], ack 32690, win 61320, length 0
19:27:25.307147 IP 151.101.117.67.443 > 10.0.2.15.37972: Flags [P.], seq 32690:36812, ack 867, win 65535, length 4122
19:27:25.307166 IP 10.0.2.15.37972 > 151.101.117.67.443: Flags [.], ack 36812, win 61320, length 0
19:27:25.308043 IP 151.101.117.67.443 > 10.0.2.15.37972: Flags [P.], seq 36812:39560, ack 867, win 65535, length 2748
19:27:25.308062 IP 10.0.2.15.37972 > 151.101.117.67.443: Flags [.], ack 39560, win 62780, length 0
19:27:25.309299 IP 151.101.117.67.443 > 10.0.2.15.37972: Flags [P.], seq 39560:42308, ack 867, win 65535, length 2748
19:27:25.309321 IP 10.0.2.15.37972 > 151.101.117.67.443: Flags [.], ack 42308, win 62780, length 0
19:27:25.310275 IP 151.101.117.67.443 > 10.0.2.15.37972: Flags [P.], seq 42308:47804, ack 867, win 65535, length 5496
19:27:25.310704 IP 10.0.2.15.37972 > 151.101.117.67.443: Flags [.], ack 47804, win 61320, length 0
19:27:25.311087 IP 151.101.117.67.443 > 10.0.2.15.37972: Flags [P.], seq 47804:49178, ack 867, win 65535, length 1374
19:27:25.315009 IP 151.101.117.67.443 > 10.0.2.15.37972: Flags [P.], seq 49178:56048, ack 867, win 65535, length 6870
19:27:25.315096 IP 10.0.2.15.37972 > 151.101.117.67.443: Flags [.], ack 56048, win 59860, length 0
19:27:25.315837 IP 151.101.117.67.443 > 10.0.2.15.37972: Flags [P.], seq 56048:61544, ack 867, win 65535, length 5496
19:27:25.315859 IP 10.0.2.15.37972 > 151.101.117.67.443: Flags [.], ack 61544, win 61320, length 0
19:27:25.316980 IP 151.101.117.67.443 > 10.0.2.15.37972: Flags [P.], seq 61544:69788, ack 867, win 65535, length 8244
19:27:25.317054 IP 10.0.2.15.37972 > 151.101.117.67.443: Flags [.], ack 69788, win 62780, length 0
19:27:25.318591 IP 151.101.117.67.443 > 10.0.2.15.37972: Flags [P.], seq 69788:75284, ack 867, win 65535, length 5496
19:27:25.318651 IP 10.0.2.15.37972 > 151.101.117.67.443: Flags [.], ack 75284, win 65535, length 0
19:27:25.319263 IP 151.101.117.67.443 > 10.0.2.15.37972: Flags [.], seq 75284:79664, ack 867, win 65535, length 4380
19:27:25.319280 IP 10.0.2.15.37972 > 151.101.117.67.443: Flags [.], ack 79664, win 65535, length 0
19:27:25.319524 IP 151.101.117.67.443 > 10.0.2.15.37972: Flags [P.], seq 79664:82154, ack 867, win 65535, length 2490
19:27:25.319525 IP 151.101.117.67.443 > 10.0.2.15.37972: Flags [P.], seq 82154:84902, ack 867, win 65535, length 2748
19:27:25.319536 IP 10.0.2.15.37972 > 151.101.117.67.443: Flags [.], ack 82154, win 65535, length 0
19:27:25.319554 IP 10.0.2.15.37972 > 151.101.117.67.443: Flags [.], ack 84902, win 65535, length 0
19:27:25.320906 IP 151.101.117.67.443 > 10.0.2.15.37972: Flags [P.], seq 84902:91772, ack 867, win 65535, length 6870
19:27:25.320923 IP 10.0.2.15.37972 > 151.101.117.67.443: Flags [.], ack 91772, win 65535, length 0
19:27:25.321729 IP 151.101.117.67.443 > 10.0.2.15.37972: Flags [P.], seq 91772:98642, ack 867, win 65535, length 6870
19:27:25.321730 IP 151.101.117.67.443 > 10.0.2.15.37972: Flags [P.], seq 98642:100016, ack 867, win 65535, length 1374
19:27:25.321744 IP 10.0.2.15.37972 > 151.101.117.67.443: Flags [.], ack 98642, win 65535, length 0
19:27:25.322660 IP 151.101.117.67.443 > 10.0.2.15.37972: Flags [P.], seq 100016:106886, ack 867, win 65535, length 6870
19:27:25.322775 IP 10.0.2.15.37972 > 151.101.117.67.443: Flags [.], ack 106886, win 65535, length 0
19:27:25.324077 IP 151.101.117.67.443 > 10.0.2.15.37972: Flags [P.], seq 106886:111008, ack 867, win 65535, length 4122
19:27:25.324079 IP 151.101.117.67.443 > 10.0.2.15.37972: Flags [P.], seq 111008:116504, ack 867, win 65535, length 5496
19:27:25.324100 IP 10.0.2.15.37972 > 151.101.117.67.443: Flags [.], ack 111008, win 65535, length 0
19:27:25.324132 IP 10.0.2.15.37972 > 151.101.117.67.443: Flags [.], ack 116504, win 65535, length 0
19:27:25.325496 IP 151.101.117.67.443 > 10.0.2.15.37972: Flags [P.], seq 116504:124748, ack 867, win 65535, length 8244
19:27:25.325498 IP 151.101.117.67.443 > 10.0.2.15.37972: Flags [P.], seq 124748:126122, ack 867, win 65535, length 1374
19:27:25.325520 IP 10.0.2.15.37972 > 151.101.117.67.443: Flags [.], ack 124748, win 65535, length 0
19:27:25.326894 IP 151.101.117.67.443 > 10.0.2.15.37972: Flags [P.], seq 126122:132992, ack 867, win 65535, length 6870
19:27:25.326916 IP 10.0.2.15.37972 > 151.101.117.67.443: Flags [.], ack 132992, win 65535, length 0
19:27:25.327644 IP 151.101.117.67.443 > 10.0.2.15.37972: Flags [P.], seq 132992:137114, ack 867, win 65535, length 4122
19:27:25.327660 IP 10.0.2.15.37972 > 151.101.117.67.443: Flags [.], ack 137114, win 65535, length 0
19:27:25.328191 IP 151.101.117.67.443 > 10.0.2.15.37972: Flags [P.], seq 137114:142610, ack 867, win 65535, length 5496
19:27:25.328204 IP 10.0.2.15.37972 > 151.101.117.67.443: Flags [.], ack 142610, win 65535, length 0
19:27:25.329275 IP 151.101.117.67.443 > 10.0.2.15.37972: Flags [P.], seq 142610:148106, ack 867, win 65535, length 5496
19:27:25.329278 IP 151.101.117.67.443 > 10.0.2.15.37972: Flags [P.], seq 148106:149480, ack 867, win 65535, length 1374
19:27:25.329279 IP 151.101.117.67.443 > 10.0.2.15.37972: Flags [P.], seq 149480:152228, ack 867, win 65535, length 2748
19:27:25.329351 IP 10.0.2.15.37972 > 151.101.117.67.443: Flags [.], ack 148106, win 65535, length 0
19:27:25.329576 IP 10.0.2.15.37972 > 151.101.117.67.443: Flags [.], ack 152228, win 65535, length 0
19:27:25.329702 IP 151.101.117.67.443 > 10.0.2.15.37972: Flags [P.], seq 152228:154976, ack 867, win 65535, length 2748
19:27:25.329773 IP 151.101.117.67.443 > 10.0.2.15.37972: Flags [P.], seq 154976:157724, ack 867, win 65535, length 2748
19:27:25.329775 IP 151.101.117.67.443 > 10.0.2.15.37972: Flags [P.], seq 157724:160472, ack 867, win 65535, length 2748
19:27:25.329789 IP 10.0.2.15.37972 > 151.101.117.67.443: Flags [.], ack 154976, win 65535, length 0
19:27:25.329816 IP 10.0.2.15.37972 > 151.101.117.67.443: Flags [.], ack 157724, win 65535, length 0
19:27:25.329837 IP 10.0.2.15.37972 > 151.101.117.67.443: Flags [.], ack 160472, win 65535, length 0
19:27:25.331422 IP 151.101.117.67.443 > 10.0.2.15.37972: Flags [P.], seq 160472:165968, ack 867, win 65535, length 5496
19:27:25.331425 IP 151.101.117.67.443 > 10.0.2.15.37972: Flags [P.], seq 165968:170090, ack 867, win 65535, length 4122
19:27:25.331426 IP 151.101.117.67.443 > 10.0.2.15.37972: Flags [P.], seq 170090:172838, ack 867, win 65535, length 2748
19:27:25.331446 IP 10.0.2.15.37972 > 151.101.117.67.443: Flags [.], ack 165968, win 65535, length 0
19:27:25.331682 IP 10.0.2.15.37972 > 151.101.117.67.443: Flags [.], ack 170090, win 65535, length 0
19:27:25.331799 IP 10.0.2.15.37972 > 151.101.117.67.443: Flags [.], ack 172838, win 65535, length 0
19:27:25.331837 IP 151.101.117.67.443 > 10.0.2.15.37972: Flags [P.], seq 172838:175586, ack 867, win 65535, length 2748
19:27:25.331839 IP 151.101.117.67.443 > 10.0.2.15.37972: Flags [P.], seq 175586:178334, ack 867, win 65535, length 2748
19:27:25.331849 IP 10.0.2.15.37972 > 151.101.117.67.443: Flags [.], ack 175586, win 65535, length 0
19:27:25.331862 IP 10.0.2.15.37972 > 151.101.117.67.443: Flags [.], ack 178334, win 65535, length 0
19:27:25.332746 IP 151.101.117.67.443 > 10.0.2.15.37972: Flags [P.], seq 178334:181082, ack 867, win 65535, length 2748
19:27:25.332747 IP 151.101.117.67.443 > 10.0.2.15.37972: Flags [P.], seq 181082:182456, ack 867, win 65535, length 1374
19:27:25.332763 IP 10.0.2.15.37972 > 151.101.117.67.443: Flags [.], ack 181082, win 65535, length 0
19:27:25.333868 IP 151.101.117.67.443 > 10.0.2.15.37972: Flags [P.], seq 182456:187952, ack 867, win 65535, length 5496
19:27:25.333870 IP 151.101.117.67.443 > 10.0.2.15.37972: Flags [P.], seq 187952:190700, ack 867, win 65535, length 2748
19:27:25.333871 IP 151.101.117.67.443 > 10.0.2.15.37972: Flags [P.], seq 190700:193448, ack 867, win 65535, length 2748
19:27:25.334168 IP 10.0.2.15.37972 > 151.101.117.67.443: Flags [.], ack 187952, win 65535, length 0
19:27:25.334302 IP 10.0.2.15.37972 > 151.101.117.67.443: Flags [.], ack 190700, win 65535, length 0
19:27:25.334438 IP 10.0.2.15.37972 > 151.101.117.67.443: Flags [.], ack 193448, win 65535, length 0
19:27:25.334479 IP 151.101.117.67.443 > 10.0.2.15.37972: Flags [P.], seq 193448:197570, ack 867, win 65535, length 4122
19:27:25.334481 IP 151.101.117.67.443 > 10.0.2.15.37972: Flags [P.], seq 197570:200318, ack 867, win 65535, length 2748
19:27:25.334481 IP 151.101.117.67.443 > 10.0.2.15.37972: Flags [P.], seq 200318:201692, ack 867, win 65535, length 1374
19:27:25.334483 IP 151.101.117.67.443 > 10.0.2.15.37972: Flags [P.], seq 201692:205814, ack 867, win 65535, length 4122
19:27:25.334492 IP 10.0.2.15.37972 > 151.101.117.67.443: Flags [.], ack 197570, win 65535, length 0
19:27:25.334509 IP 10.0.2.15.37972 > 151.101.117.67.443: Flags [.], ack 200318, win 65535, length 0
19:27:25.334526 IP 10.0.2.15.37972 > 151.101.117.67.443: Flags [.], ack 205814, win 65535, length 0
19:27:25.334609 IP 151.101.117.67.443 > 10.0.2.15.37972: Flags [P.], seq 205814:209936, ack 867, win 65535, length 4122
19:27:25.334611 IP 151.101.117.67.443 > 10.0.2.15.37972: Flags [P.], seq 209936:212684, ack 867, win 65535, length 2748
19:27:25.334611 IP 151.101.117.67.443 > 10.0.2.15.37972: Flags [P.], seq 212684:214058, ack 867, win 65535, length 1374
19:27:25.334621 IP 10.0.2.15.37972 > 151.101.117.67.443: Flags [.], ack 209936, win 65535, length 0
19:27:25.334644 IP 10.0.2.15.37972 > 151.101.117.67.443: Flags [.], ack 212684, win 65535, length 0
19:27:25.335654 IP 151.101.117.67.443 > 10.0.2.15.37972: Flags [P.], seq 214058:220928, ack 867, win 65535, length 6870
19:27:25.335656 IP 151.101.117.67.443 > 10.0.2.15.37972: Flags [P.], seq 220928:225050, ack 867, win 65535, length 4122
19:27:25.335713 IP 10.0.2.15.37972 > 151.101.117.67.443: Flags [.], ack 220928, win 65535, length 0
19:27:25.335857 IP 10.0.2.15.37972 > 151.101.117.67.443: Flags [.], ack 225050, win 65535, length 0
19:27:25.335882 IP 151.101.117.67.443 > 10.0.2.15.37972: Flags [P.], seq 225050:226424, ack 867, win 65535, length 1374
19:27:25.335884 IP 151.101.117.67.443 > 10.0.2.15.37972: Flags [P.], seq 226424:229172, ack 867, win 65535, length 2748
19:27:25.335894 IP 10.0.2.15.37972 > 151.101.117.67.443: Flags [.], ack 229172, win 65535, length 0
19:27:25.336901 IP 151.101.117.67.443 > 10.0.2.15.37972: Flags [P.], seq 229172:236042, ack 867, win 65535, length 6870
19:27:25.336904 IP 151.101.117.67.443 > 10.0.2.15.37972: Flags [P.], seq 236042:240164, ack 867, win 65535, length 4122
19:27:25.336921 IP 10.0.2.15.37972 > 151.101.117.67.443: Flags [.], ack 236042, win 65535, length 0
19:27:25.336968 IP 10.0.2.15.37972 > 151.101.117.67.443: Flags [.], ack 240164, win 65535, length 0
19:27:25.336985 IP 151.101.117.67.443 > 10.0.2.15.37972: Flags [P.], seq 240164:241538, ack 867, win 65535, length 1374
19:27:25.337669 IP 151.101.117.67.443 > 10.0.2.15.37972: Flags [P.], seq 241538:245660, ack 867, win 65535, length 4122
19:27:25.337671 IP 151.101.117.67.443 > 10.0.2.15.37972: Flags [P.], seq 245660:248408, ack 867, win 65535, length 2748
19:27:25.337753 IP 10.0.2.15.37972 > 151.101.117.67.443: Flags [.], ack 248408, win 65535, length 0
19:27:25.338006 IP 151.101.117.67.443 > 10.0.2.15.37972: Flags [P.], seq 248408:251156, ack 867, win 65535, length 2748
19:27:25.338008 IP 151.101.117.67.443 > 10.0.2.15.37972: Flags [P.], seq 251156:253904, ack 867, win 65535, length 2748
19:27:25.338009 IP 151.101.117.67.443 > 10.0.2.15.37972: Flags [P.], seq 253904:258026, ack 867, win 65535, length 4122
19:27:25.338098 IP 10.0.2.15.37972 > 151.101.117.67.443: Flags [.], ack 258026, win 65535, length 0
19:27:25.338195 IP 151.101.117.67.443 > 10.0.2.15.37972: Flags [P.], seq 258026:259400, ack 867, win 65535, length 1374
19:27:25.338196 IP 151.101.117.67.443 > 10.0.2.15.37972: Flags [P.], seq 259400:260774, ack 867, win 65535, length 1374
19:27:25.338219 IP 10.0.2.15.37972 > 151.101.117.67.443: Flags [.], ack 260774, win 65535, length 0
19:27:25.339287 IP 151.101.117.67.443 > 10.0.2.15.37972: Flags [P.], seq 260774:267644, ack 867, win 65535, length 6870
19:27:25.339291 IP 151.101.117.67.443 > 10.0.2.15.37972: Flags [P.], seq 267644:269018, ack 867, win 65535, length 1374
19:27:25.339292 IP 151.101.117.67.443 > 10.0.2.15.37972: Flags [P.], seq 269018:271766, ack 867, win 65535, length 2748
19:27:25.339319 IP 10.0.2.15.37972 > 151.101.117.67.443: Flags [.], ack 267644, win 65535, length 0
19:27:25.339375 IP 10.0.2.15.37972 > 151.101.117.67.443: Flags [.], ack 271766, win 65535, length 0
19:27:25.339592 IP 151.101.117.67.443 > 10.0.2.15.37972: Flags [P.], seq 271766:274514, ack 867, win 65535, length 2748
19:27:25.339645 IP 10.0.2.15.37972 > 151.101.117.67.443: Flags [.], ack 274514, win 65535, length 0
19:27:25.340200 IP 151.101.117.67.443 > 10.0.2.15.37972: Flags [P.], seq 274514:277262, ack 867, win 65535, length 2748
19:27:25.340203 IP 151.101.117.67.443 > 10.0.2.15.37972: Flags [P.], seq 277262:280010, ack 867, win 65535, length 2748
19:27:25.340203 IP 151.101.117.67.443 > 10.0.2.15.37972: Flags [.], seq 280010:281470, ack 867, win 65535, length 1460
19:27:25.340227 IP 10.0.2.15.37972 > 151.101.117.67.443: Flags [.], ack 277262, win 65535, length 0
19:27:25.340465 IP 10.0.2.15.37972 > 151.101.117.67.443: Flags [.], ack 280010, win 65535, length 0
19:27:25.340721 IP 151.101.117.67.443 > 10.0.2.15.37972: Flags [P.], seq 281470:282758, ack 867, win 65535, length 1288
19:27:25.340730 IP 10.0.2.15.37972 > 151.101.117.67.443: Flags [.], ack 282758, win 65535, length 0
19:27:25.341405 IP 151.101.117.67.443 > 10.0.2.15.37972: Flags [P.], seq 282758:286880, ack 867, win 65535, length 4122
19:27:25.341407 IP 151.101.117.67.443 > 10.0.2.15.37972: Flags [P.], seq 286880:289628, ack 867, win 65535, length 2748
19:27:25.341408 IP 151.101.117.67.443 > 10.0.2.15.37972: Flags [.], seq 289628:292548, ack 867, win 65535, length 2920
19:27:25.341425 IP 10.0.2.15.37972 > 151.101.117.67.443: Flags [.], ack 286880, win 65535, length 0
19:27:25.341557 IP 10.0.2.15.37972 > 151.101.117.67.443: Flags [.], ack 289628, win 65535, length 0
19:27:25.341614 IP 10.0.2.15.37972 > 151.101.117.67.443: Flags [.], ack 292548, win 65535, length 0
19:27:25.341938 IP 151.101.117.67.443 > 10.0.2.15.37972: Flags [P.], seq 292548:293750, ack 867, win 65535, length 1202
19:27:25.341973 IP 151.101.117.67.443 > 10.0.2.15.37972: Flags [P.], seq 293750:296498, ack 867, win 65535, length 2748
19:27:25.341975 IP 151.101.117.67.443 > 10.0.2.15.37972: Flags [P.], seq 296498:299246, ack 867, win 65535, length 2748
19:27:25.341977 IP 151.101.117.67.443 > 10.0.2.15.37972: Flags [P.], seq 299246:301994, ack 867, win 65535, length 2748
19:27:25.342119 IP 10.0.2.15.37972 > 151.101.117.67.443: Flags [.], ack 296498, win 65535, length 0
19:27:25.342141 IP 10.0.2.15.37972 > 151.101.117.67.443: Flags [.], ack 299246, win 65535, length 0
19:27:25.342154 IP 10.0.2.15.37972 > 151.101.117.67.443: Flags [.], ack 301994, win 65535, length 0
19:27:25.342402 IP 151.101.117.67.443 > 10.0.2.15.37972: Flags [P.], seq 301994:304742, ack 867, win 65535, length 2748
19:27:25.342403 IP 151.101.117.67.443 > 10.0.2.15.37972: Flags [P.], seq 304742:307490, ack 867, win 65535, length 2748
19:27:25.342415 IP 10.0.2.15.37972 > 151.101.117.67.443: Flags [.], ack 304742, win 65535, length 0
19:27:25.342438 IP 10.0.2.15.37972 > 151.101.117.67.443: Flags [.], ack 307490, win 65535, length 0
19:27:25.343572 IP 151.101.117.67.443 > 10.0.2.15.37972: Flags [P.], seq 307490:312986, ack 867, win 65535, length 5496
19:27:25.343574 IP 151.101.117.67.443 > 10.0.2.15.37972: Flags [P.], seq 312986:314360, ack 867, win 65535, length 1374
19:27:25.343895 IP 10.0.2.15.37972 > 151.101.117.67.443: Flags [.], ack 312986, win 65535, length 0
19:27:25.344344 IP 151.101.117.67.443 > 10.0.2.15.37972: Flags [P.], seq 314360:317108, ack 867, win 65535, length 2748
19:27:25.344346 IP 151.101.117.67.443 > 10.0.2.15.37972: Flags [P.], seq 317108:319856, ack 867, win 65535, length 2748
19:27:25.344348 IP 151.101.117.67.443 > 10.0.2.15.37972: Flags [P.], seq 319856:322604, ack 867, win 65535, length 2748
19:27:25.344349 IP 151.101.117.67.443 > 10.0.2.15.37972: Flags [P.], seq 322604:325352, ack 867, win 65535, length 2748
19:27:25.344428 IP 10.0.2.15.37972 > 151.101.117.67.443: Flags [.], ack 317108, win 65535, length 0
19:27:25.344462 IP 10.0.2.15.37972 > 151.101.117.67.443: Flags [.], ack 319856, win 65535, length 0
19:27:25.344477 IP 10.0.2.15.37972 > 151.101.117.67.443: Flags [.], ack 322604, win 65535, length 0
19:27:25.344488 IP 10.0.2.15.37972 > 151.101.117.67.443: Flags [.], ack 325352, win 65535, length 0
19:27:25.344516 IP 151.101.117.67.443 > 10.0.2.15.37972: Flags [P.], seq 325352:328100, ack 867, win 65535, length 2748
19:27:25.344517 IP 151.101.117.67.443 > 10.0.2.15.37972: Flags [P.], seq 328100:330848, ack 867, win 65535, length 2748
19:27:25.344518 IP 151.101.117.67.443 > 10.0.2.15.37972: Flags [P.], seq 330848:334970, ack 867, win 65535, length 4122
19:27:25.344527 IP 10.0.2.15.37972 > 151.101.117.67.443: Flags [.], ack 328100, win 65535, length 0
19:27:25.344541 IP 10.0.2.15.37972 > 151.101.117.67.443: Flags [.], ack 330848, win 65535, length 0
19:27:25.344553 IP 10.0.2.15.37972 > 151.101.117.67.443: Flags [.], ack 334970, win 65535, length 0
19:27:25.345648 IP 151.101.117.67.443 > 10.0.2.15.37972: Flags [P.], seq 334970:341840, ack 867, win 65535, length 6870
19:27:25.345651 IP 151.101.117.67.443 > 10.0.2.15.37972: Flags [P.], seq 341840:344588, ack 867, win 65535, length 2748
19:27:25.345652 IP 151.101.117.67.443 > 10.0.2.15.37972: Flags [P.], seq 344588:347336, ack 867, win 65535, length 2748
19:27:25.345786 IP 151.101.117.67.443 > 10.0.2.15.37972: Flags [P.], seq 347336:350084, ack 867, win 65535, length 2748
19:27:25.345997 IP 151.101.117.67.443 > 10.0.2.15.37972: Flags [P.], seq 350084:352832, ack 867, win 65535, length 2748
19:27:25.346323 IP 151.101.117.67.443 > 10.0.2.15.37972: Flags [P.], seq 352832:354206, ack 867, win 65535, length 1374
19:27:25.346510 IP 10.0.2.15.37972 > 151.101.117.67.443: Flags [.], ack 354206, win 65535, length 0
19:27:25.347111 IP 151.101.117.67.443 > 10.0.2.15.37972: Flags [P.], seq 354206:361076, ack 867, win 65535, length 6870
19:27:25.347114 IP 151.101.117.67.443 > 10.0.2.15.37972: Flags [P.], seq 361076:365198, ack 867, win 65535, length 4122
19:27:25.347134 IP 10.0.2.15.37972 > 151.101.117.67.443: Flags [.], ack 361076, win 65535, length 0
19:27:25.347170 IP 10.0.2.15.37972 > 151.101.117.67.443: Flags [.], ack 365198, win 65535, length 0
19:27:25.347354 IP 151.101.117.67.443 > 10.0.2.15.37972: Flags [P.], seq 365198:366572, ack 867, win 65535, length 1374
19:27:25.347511 IP 151.101.117.67.443 > 10.0.2.15.37972: Flags [P.], seq 366572:369320, ack 867, win 65535, length 2748
19:27:25.347522 IP 151.101.117.67.443 > 10.0.2.15.37972: Flags [P.], seq 369320:373442, ack 867, win 65535, length 4122
19:27:25.347522 IP 151.101.117.67.443 > 10.0.2.15.37972: Flags [P.], seq 373442:374816, ack 867, win 65535, length 1374
19:27:25.347545 IP 10.0.2.15.37972 > 151.101.117.67.443: Flags [.], ack 369320, win 65535, length 0
19:27:25.347709 IP 10.0.2.15.37972 > 151.101.117.67.443: Flags [.], ack 373442, win 65535, length 0
19:27:25.347899 IP 151.101.117.67.443 > 10.0.2.15.37972: Flags [P.], seq 374816:376190, ack 867, win 65535, length 1374
19:27:25.347909 IP 10.0.2.15.37972 > 151.101.117.67.443: Flags [.], ack 376190, win 65535, length 0
19:27:25.350202 IP 151.101.117.67.443 > 10.0.2.15.37972: Flags [P.], seq 376190:381686, ack 867, win 65535, length 5496
19:27:25.350205 IP 151.101.117.67.443 > 10.0.2.15.37972: Flags [P.], seq 381686:384434, ack 867, win 65535, length 2748
19:27:25.350206 IP 151.101.117.67.443 > 10.0.2.15.37972: Flags [P.], seq 384434:387182, ack 867, win 65535, length 2748
19:27:25.350234 IP 10.0.2.15.37972 > 151.101.117.67.443: Flags [.], ack 381686, win 65535, length 0
19:27:25.350440 IP 10.0.2.15.37972 > 151.101.117.67.443: Flags [.], ack 384434, win 65535, length 0
19:27:25.350464 IP 10.0.2.15.37972 > 151.101.117.67.443: Flags [.], ack 387182, win 65535, length 0
19:27:25.350499 IP 151.101.117.67.443 > 10.0.2.15.37972: Flags [P.], seq 387182:389930, ack 867, win 65535, length 2748
19:27:25.350501 IP 151.101.117.67.443 > 10.0.2.15.37972: Flags [P.], seq 389930:392678, ack 867, win 65535, length 2748
19:27:25.350510 IP 10.0.2.15.37972 > 151.101.117.67.443: Flags [.], ack 389930, win 65535, length 0
19:27:25.350544 IP 10.0.2.15.37972 > 151.101.117.67.443: Flags [.], ack 392678, win 65535, length 0
19:27:25.354148 IP 151.101.117.67.443 > 10.0.2.15.37972: Flags [P.], seq 392678:398174, ack 867, win 65535, length 5496
19:27:25.354151 IP 151.101.117.67.443 > 10.0.2.15.37972: Flags [P.], seq 398174:400922, ack 867, win 65535, length 2748
19:27:25.354154 IP 151.101.117.67.443 > 10.0.2.15.37972: Flags [P.], seq 400922:413288, ack 867, win 65535, length 12366
19:27:25.354178 IP 10.0.2.15.37972 > 151.101.117.67.443: Flags [.], ack 398174, win 65535, length 0
19:27:25.354311 IP 10.0.2.15.37972 > 151.101.117.67.443: Flags [.], ack 400922, win 65535, length 0
19:27:25.354382 IP 10.0.2.15.37972 > 151.101.117.67.443: Flags [.], ack 413288, win 65535, length 0
19:27:25.354452 IP 151.101.117.67.443 > 10.0.2.15.37972: Flags [P.], seq 413288:418784, ack 867, win 65535, length 5496
19:27:25.354453 IP 151.101.117.67.443 > 10.0.2.15.37972: Flags [P.], seq 418784:421532, ack 867, win 65535, length 2748
19:27:25.354456 IP 151.101.117.67.443 > 10.0.2.15.37972: Flags [P.], seq 421532:436646, ack 867, win 65535, length 15114
19:27:25.354463 IP 10.0.2.15.37972 > 151.101.117.67.443: Flags [.], ack 418784, win 65535, length 0
19:27:25.354542 IP 10.0.2.15.37972 > 151.101.117.67.443: Flags [.], ack 421532, win 65535, length 0
19:27:25.354557 IP 10.0.2.15.37972 > 151.101.117.67.443: Flags [.], ack 436646, win 65535, length 0
19:27:25.354646 IP 151.101.117.67.443 > 10.0.2.15.37972: Flags [.], seq 436646:448326, ack 867, win 65535, length 11680
19:27:25.354652 IP 10.0.2.15.37972 > 151.101.117.67.443: Flags [.], ack 448326, win 65535, length 0
19:27:25.355497 IP 151.101.117.67.443 > 10.0.2.15.37972: Flags [P.], seq 448326:453134, ack 867, win 65535, length 4808
19:27:25.355500 IP 151.101.117.67.443 > 10.0.2.15.37972: Flags [P.], seq 453134:458630, ack 867, win 65535, length 5496
19:27:25.355518 IP 10.0.2.15.37972 > 151.101.117.67.443: Flags [.], ack 453134, win 65535, length 0
19:27:25.355536 IP 10.0.2.15.37972 > 151.101.117.67.443: Flags [.], ack 458630, win 65535, length 0
19:27:25.355567 IP 151.101.117.67.443 > 10.0.2.15.37972: Flags [P.], seq 458630:462752, ack 867, win 65535, length 4122
19:27:25.355568 IP 151.101.117.67.443 > 10.0.2.15.37972: Flags [P.], seq 462752:464126, ack 867, win 65535, length 1374
19:27:25.355569 IP 151.101.117.67.443 > 10.0.2.15.37972: Flags [P.], seq 464126:465500, ack 867, win 65535, length 1374
19:27:25.355570 IP 151.101.117.67.443 > 10.0.2.15.37972: Flags [P.], seq 465500:468248, ack 867, win 65535, length 2748
19:27:25.355572 IP 151.101.117.67.443 > 10.0.2.15.37972: Flags [P.], seq 468248:472370, ack 867, win 65535, length 4122
19:27:25.355580 IP 10.0.2.15.37972 > 151.101.117.67.443: Flags [.], ack 462752, win 65535, length 0
19:27:25.355635 IP 10.0.2.15.37972 > 151.101.117.67.443: Flags [.], ack 465500, win 65535, length 0
19:27:25.355650 IP 10.0.2.15.37972 > 151.101.117.67.443: Flags [.], ack 468248, win 65535, length 0
19:27:25.355696 IP 10.0.2.15.37972 > 151.101.117.67.443: Flags [.], ack 472370, win 65535, length 0
19:27:25.356531 IP 151.101.117.67.443 > 10.0.2.15.37972: Flags [P.], seq 472370:477866, ack 867, win 65535, length 5496
19:27:25.356533 IP 151.101.117.67.443 > 10.0.2.15.37972: Flags [P.], seq 477866:479240, ack 867, win 65535, length 1374
19:27:25.356534 IP 151.101.117.67.443 > 10.0.2.15.37972: Flags [.], seq 479240:480700, ack 867, win 65535, length 1460
19:27:25.356595 IP 10.0.2.15.37972 > 151.101.117.67.443: Flags [.], ack 477866, win 65535, length 0
19:27:25.356667 IP 10.0.2.15.37972 > 151.101.117.67.443: Flags [.], ack 480700, win 65535, length 0
19:27:25.357282 IP 151.101.117.67.443 > 10.0.2.15.37972: Flags [P.], seq 480700:481988, ack 867, win 65535, length 1288
19:27:25.357284 IP 151.101.117.67.443 > 10.0.2.15.37972: Flags [P.], seq 481988:484736, ack 867, win 65535, length 2748
19:27:25.357285 IP 151.101.117.67.443 > 10.0.2.15.37972: Flags [P.], seq 484736:487484, ack 867, win 65535, length 2748
19:27:25.357286 IP 151.101.117.67.443 > 10.0.2.15.37972: Flags [P.], seq 487484:491606, ack 867, win 65535, length 4122
19:27:25.357305 IP 10.0.2.15.37972 > 151.101.117.67.443: Flags [.], ack 484736, win 65535, length 0
19:27:25.357358 IP 10.0.2.15.37972 > 151.101.117.67.443: Flags [.], ack 487484, win 65535, length 0
19:27:25.357374 IP 10.0.2.15.37972 > 151.101.117.67.443: Flags [.], ack 491606, win 65535, length 0
19:27:25.357538 IP 151.101.117.67.443 > 10.0.2.15.37972: Flags [P.], seq 491606:494354, ack 867, win 65535, length 2748
19:27:25.357540 IP 151.101.117.67.443 > 10.0.2.15.37972: Flags [P.], seq 494354:497102, ack 867, win 65535, length 2748
19:27:25.357541 IP 151.101.117.67.443 > 10.0.2.15.37972: Flags [P.], seq 497102:498476, ack 867, win 65535, length 1374
19:27:25.357607 IP 10.0.2.15.37972 > 151.101.117.67.443: Flags [.], ack 494354, win 65535, length 0
19:27:25.357636 IP 10.0.2.15.37972 > 151.101.117.67.443: Flags [.], ack 497102, win 65535, length 0
19:27:25.357983 IP 151.101.117.67.443 > 10.0.2.15.37972: Flags [P.], seq 498476:502598, ack 867, win 65535, length 4122
19:27:25.357986 IP 151.101.117.67.443 > 10.0.2.15.37972: Flags [P.], seq 502598:505346, ack 867, win 65535, length 2748
19:27:25.357987 IP 151.101.117.67.443 > 10.0.2.15.37972: Flags [P.], seq 505346:506720, ack 867, win 65535, length 1374
19:27:25.358002 IP 10.0.2.15.37972 > 151.101.117.67.443: Flags [.], ack 502598, win 65535, length 0
19:27:25.358024 IP 10.0.2.15.37972 > 151.101.117.67.443: Flags [.], ack 505346, win 65535, length 0
19:27:25.358483 IP 151.101.117.67.443 > 10.0.2.15.37972: Flags [P.], seq 506720:510842, ack 867, win 65535, length 4122
19:27:25.358485 IP 151.101.117.67.443 > 10.0.2.15.37972: Flags [P.], seq 510842:514964, ack 867, win 65535, length 4122
19:27:25.358487 IP 151.101.117.67.443 > 10.0.2.15.37972: Flags [P.], seq 514964:520460, ack 867, win 65535, length 5496
19:27:25.358504 IP 10.0.2.15.37972 > 151.101.117.67.443: Flags [.], ack 510842, win 65535, length 0
19:27:25.358530 IP 10.0.2.15.37972 > 151.101.117.67.443: Flags [.], ack 514964, win 65535, length 0
19:27:25.358541 IP 10.0.2.15.37972 > 151.101.117.67.443: Flags [.], ack 520460, win 65535, length 0
19:27:25.358562 IP 151.101.117.67.443 > 10.0.2.15.37972: Flags [P.], seq 520460:521834, ack 867, win 65535, length 1374
19:27:25.358655 IP 151.101.117.67.443 > 10.0.2.15.37972: Flags [.], seq 521834:523294, ack 867, win 65535, length 1460
19:27:25.358662 IP 10.0.2.15.37972 > 151.101.117.67.443: Flags [.], ack 523294, win 65535, length 0
19:27:25.359046 IP 151.101.117.67.443 > 10.0.2.15.37972: Flags [P.], seq 523294:524582, ack 867, win 65535, length 1288
19:27:25.359049 IP 151.101.117.67.443 > 10.0.2.15.37972: Flags [P.], seq 524582:527330, ack 867, win 65535, length 2748
19:27:25.359050 IP 151.101.117.67.443 > 10.0.2.15.37972: Flags [.], seq 527330:528790, ack 867, win 65535, length 1460
19:27:25.359068 IP 10.0.2.15.37972 > 151.101.117.67.443: Flags [.], ack 527330, win 65535, length 0
19:27:25.359651 IP 151.101.117.67.443 > 10.0.2.15.37972: Flags [P.], seq 528790:531452, ack 867, win 65535, length 2662
19:27:25.359653 IP 151.101.117.67.443 > 10.0.2.15.37972: Flags [P.], seq 531452:534200, ack 867, win 65535, length 2748
19:27:25.359654 IP 151.101.117.67.443 > 10.0.2.15.37972: Flags [P.], seq 534200:535574, ack 867, win 65535, length 1374
19:27:25.359655 IP 151.101.117.67.443 > 10.0.2.15.37972: Flags [.], seq 535574:537034, ack 867, win 65535, length 1460
19:27:25.359688 IP 10.0.2.15.37972 > 151.101.117.67.443: Flags [.], ack 531452, win 65535, length 0
19:27:25.359749 IP 10.0.2.15.37972 > 151.101.117.67.443: Flags [.], ack 534200, win 65535, length 0
19:27:25.359764 IP 10.0.2.15.37972 > 151.101.117.67.443: Flags [.], ack 537034, win 65535, length 0
19:27:25.360488 IP 151.101.117.67.443 > 10.0.2.15.37972: Flags [P.], seq 537034:541070, ack 867, win 65535, length 4036
19:27:25.360492 IP 151.101.117.67.443 > 10.0.2.15.37972: Flags [P.], seq 541070:543818, ack 867, win 65535, length 2748
19:27:25.360515 IP 10.0.2.15.37972 > 151.101.117.67.443: Flags [.], ack 541070, win 65535, length 0
19:27:25.360541 IP 10.0.2.15.37972 > 151.101.117.67.443: Flags [.], ack 543818, win 65535, length 0
19:27:25.360915 IP 151.101.117.67.443 > 10.0.2.15.37972: Flags [P.], seq 543818:549314, ack 867, win 65535, length 5496
19:27:25.360918 IP 151.101.117.67.443 > 10.0.2.15.37972: Flags [P.], seq 549314:553436, ack 867, win 65535, length 4122
19:27:25.360919 IP 151.101.117.67.443 > 10.0.2.15.37972: Flags [P.], seq 553436:556184, ack 867, win 65535, length 2748
19:27:25.360983 IP 10.0.2.15.37972 > 151.101.117.67.443: Flags [.], ack 549314, win 65535, length 0
19:27:25.361045 IP 10.0.2.15.37972 > 151.101.117.67.443: Flags [.], ack 553436, win 65535, length 0
19:27:25.361130 IP 10.0.2.15.37972 > 151.101.117.67.443: Flags [.], ack 556184, win 65535, length 0
19:27:25.361167 IP 151.101.117.67.443 > 10.0.2.15.37972: Flags [P.], seq 556184:557558, ack 867, win 65535, length 1374
19:27:25.361168 IP 151.101.117.67.443 > 10.0.2.15.37972: Flags [P.], seq 557558:560306, ack 867, win 65535, length 2748
19:27:25.361168 IP 151.101.117.67.443 > 10.0.2.15.37972: Flags [P.], seq 560306:561680, ack 867, win 65535, length 1374
19:27:25.361169 IP 151.101.117.67.443 > 10.0.2.15.37972: Flags [P.], seq 561680:564428, ack 867, win 65535, length 2748
19:27:25.361178 IP 10.0.2.15.37972 > 151.101.117.67.443: Flags [.], ack 560306, win 65535, length 0
19:27:25.361326 IP 10.0.2.15.37972 > 151.101.117.67.443: Flags [.], ack 564428, win 65535, length 0
19:27:25.362041 IP 151.101.117.67.443 > 10.0.2.15.37972: Flags [P.], seq 564428:569924, ack 867, win 65535, length 5496
19:27:25.362043 IP 151.101.117.67.443 > 10.0.2.15.37972: Flags [.], seq 569924:571384, ack 867, win 65535, length 1460
19:27:25.362068 IP 10.0.2.15.37972 > 151.101.117.67.443: Flags [.], ack 569924, win 65535, length 0
19:27:25.362449 IP 151.101.117.67.443 > 10.0.2.15.37972: Flags [P.], seq 571384:572672, ack 867, win 65535, length 1288
19:27:25.362451 IP 151.101.117.67.443 > 10.0.2.15.37972: Flags [P.], seq 572672:574046, ack 867, win 65535, length 1374
19:27:25.362452 IP 151.101.117.67.443 > 10.0.2.15.37972: Flags [P.], seq 574046:579542, ack 867, win 65535, length 5496
19:27:25.362454 IP 151.101.117.67.443 > 10.0.2.15.37972: Flags [P.], seq 579542:585038, ack 867, win 65535, length 5496
19:27:25.362469 IP 10.0.2.15.37972 > 151.101.117.67.443: Flags [.], ack 572672, win 65535, length 0
19:27:25.362543 IP 10.0.2.15.37972 > 151.101.117.67.443: Flags [.], ack 579542, win 65535, length 0
19:27:25.362583 IP 151.101.117.67.443 > 10.0.2.15.37972: Flags [P.], seq 585038:586412, ack 867, win 65535, length 1374
19:27:25.362789 IP 151.101.117.67.443 > 10.0.2.15.37972: Flags [P.], seq 586412:589160, ack 867, win 65535, length 2748
19:27:25.362790 IP 151.101.117.67.443 > 10.0.2.15.37972: Flags [.], seq 589160:590620, ack 867, win 65535, length 1460
19:27:25.362971 IP 151.101.117.67.443 > 10.0.2.15.37972: Flags [P.], seq 590620:591908, ack 867, win 65535, length 1288
19:27:25.362972 IP 151.101.117.67.443 > 10.0.2.15.37972: Flags [P.], seq 591908:596030, ack 867, win 65535, length 4122
19:27:25.362973 IP 151.101.117.67.443 > 10.0.2.15.37972: Flags [P.], seq 596030:597404, ack 867, win 65535, length 1374
19:27:25.363535 IP 151.101.117.67.443 > 10.0.2.15.37972: Flags [P.], seq 597404:602900, ack 867, win 65535, length 5496
19:27:25.363538 IP 151.101.117.67.443 > 10.0.2.15.37972: Flags [P.], seq 602900:604274, ack 867, win 65535, length 1374
19:27:25.363539 IP 151.101.117.67.443 > 10.0.2.15.37972: Flags [P.], seq 604274:608396, ack 867, win 65535, length 4122
19:27:25.363579 IP 151.101.117.67.443 > 10.0.2.15.37972: Flags [P.], seq 608396:609770, ack 867, win 65535, length 1374
19:27:25.363825 IP 151.101.117.67.443 > 10.0.2.15.37972: Flags [P.], seq 609770:612518, ack 867, win 65535, length 2748
19:27:25.365542 IP 10.0.2.15.37972 > 151.101.117.67.443: Flags [.], ack 612518, win 65535, length 0
19:27:25.366136 IP 151.101.117.67.443 > 10.0.2.15.37972: Flags [P.], seq 612518:641372, ack 867, win 65535, length 28854
19:27:25.366155 IP 151.101.117.67.443 > 10.0.2.15.37972: Flags [P.], seq 641372:645494, ack 867, win 65535, length 4122
19:27:25.367601 IP 10.0.2.15.37972 > 151.101.117.67.443: Flags [.], ack 645494, win 65535, length 0
19:27:25.368271 IP 151.101.117.67.443 > 10.0.2.15.37972: Flags [P.], seq 645494:681218, ack 867, win 65535, length 35724
19:27:25.368342 IP 10.0.2.15.37972 > 151.101.117.67.443: Flags [.], ack 681218, win 65535, length 0
19:27:25.368906 IP 151.101.117.67.443 > 10.0.2.15.37972: Flags [P.], seq 681218:686714, ack 867, win 65535, length 5496
19:27:25.369126 IP 10.0.2.15.37972 > 151.101.117.67.443: Flags [.], ack 686714, win 65535, length 0
19:27:25.369296 IP 151.101.117.67.443 > 10.0.2.15.37972: Flags [P.], seq 686714:690836, ack 867, win 65535, length 4122
19:27:25.369298 IP 151.101.117.67.443 > 10.0.2.15.37972: Flags [P.], seq 690836:692210, ack 867, win 65535, length 1374
19:27:25.369315 IP 10.0.2.15.37972 > 151.101.117.67.443: Flags [.], ack 690836, win 65535, length 0
19:27:25.370298 IP 151.101.117.67.443 > 10.0.2.15.37972: Flags [P.], seq 692210:697706, ack 867, win 65535, length 5496
19:27:25.370301 IP 151.101.117.67.443 > 10.0.2.15.37972: Flags [P.], seq 697706:700454, ack 867, win 65535, length 2748
19:27:25.370448 IP 151.101.117.67.443 > 10.0.2.15.37972: Flags [P.], seq 700454:703202, ack 867, win 65535, length 2748
19:27:25.370555 IP 10.0.2.15.37972 > 151.101.117.67.443: Flags [.], ack 697706, win 65535, length 0
19:27:25.370760 IP 151.101.117.67.443 > 10.0.2.15.37972: Flags [P.], seq 703202:705950, ack 867, win 65535, length 2748
19:27:25.370762 IP 151.101.117.67.443 > 10.0.2.15.37972: Flags [P.], seq 705950:708698, ack 867, win 65535, length 2748
19:27:25.370763 IP 151.101.117.67.443 > 10.0.2.15.37972: Flags [P.], seq 708698:710072, ack 867, win 65535, length 1374
19:27:25.370764 IP 151.101.117.67.443 > 10.0.2.15.37972: Flags [P.], seq 710072:712820, ack 867, win 65535, length 2748
19:27:25.370764 IP 151.101.117.67.443 > 10.0.2.15.37972: Flags [P.], seq 712820:715568, ack 867, win 65535, length 2748
19:27:25.371105 IP 151.101.117.67.443 > 10.0.2.15.37972: Flags [P.], seq 715568:718316, ack 867, win 65535, length 2748
19:27:25.371107 IP 151.101.117.67.443 > 10.0.2.15.37972: Flags [P.], seq 718316:721064, ack 867, win 65535, length 2748
19:27:25.372056 IP 151.101.117.67.443 > 10.0.2.15.37972: Flags [P.], seq 721064:725186, ack 867, win 65535, length 4122
19:27:25.372059 IP 151.101.117.67.443 > 10.0.2.15.37972: Flags [P.], seq 725186:729308, ack 867, win 65535, length 4122
19:27:25.372060 IP 151.101.117.67.443 > 10.0.2.15.37972: Flags [P.], seq 729308:734804, ack 867, win 65535, length 5496
19:27:25.375092 IP 10.0.2.15.37972 > 151.101.117.67.443: Flags [.], ack 734804, win 65535, length 0
19:27:25.376530 IP 151.101.117.67.443 > 10.0.2.15.37972: Flags [.], seq 734804:775684, ack 867, win 65535, length 40880
19:27:25.377384 IP 151.101.117.67.443 > 10.0.2.15.37972: Flags [.], seq 775684:799044, ack 867, win 65535, length 23360
19:27:25.377659 IP 10.0.2.15.37972 > 151.101.117.67.443: Flags [.], ack 799044, win 65535, length 0
19:27:25.377966 IP 151.101.117.67.443 > 10.0.2.15.37972: Flags [P.], seq 799044:800504, ack 867, win 65535, length 1460
19:27:25.377969 IP 151.101.117.67.443 > 10.0.2.15.37972: Flags [.], seq 800504:806344, ack 867, win 65535, length 5840
19:27:25.378361 IP 151.101.117.67.443 > 10.0.2.15.37972: Flags [P.], seq 806344:848846, ack 867, win 65535, length 42502
19:27:25.379605 IP 10.0.2.15.37972 > 151.101.117.67.443: Flags [.], ack 848846, win 65535, length 0
19:27:25.380716 IP 151.101.117.67.443 > 10.0.2.15.37972: Flags [P.], seq 848846:883196, ack 867, win 65535, length 34350
19:27:25.381337 IP 10.0.2.15.37972 > 151.101.117.67.443: Flags [.], ack 883196, win 65535, length 0
19:27:25.382249 IP 151.101.117.67.443 > 10.0.2.15.37972: Flags [P.], seq 883196:909302, ack 867, win 65535, length 26106
19:27:25.382270 IP 10.0.2.15.37972 > 151.101.117.67.443: Flags [.], ack 909302, win 65535, length 0
19:27:25.382311 IP 151.101.117.67.443 > 10.0.2.15.37972: Flags [P.], seq 909302:914798, ack 867, win 65535, length 5496
19:27:25.382312 IP 151.101.117.67.443 > 10.0.2.15.37972: Flags [P.], seq 914798:918920, ack 867, win 65535, length 4122
19:27:25.382509 IP 10.0.2.15.37972 > 151.101.117.67.443: Flags [.], ack 918920, win 65535, length 0
19:27:25.382534 IP 151.101.117.67.443 > 10.0.2.15.37972: Flags [P.], seq 918920:927164, ack 867, win 65535, length 8244
19:27:25.382736 IP 10.0.2.15.37972 > 151.101.117.67.443: Flags [.], ack 927164, win 65535, length 0
19:27:25.383235 IP 151.101.117.67.443 > 10.0.2.15.37972: Flags [P.], seq 927164:931286, ack 867, win 65535, length 4122
19:27:25.383285 IP 10.0.2.15.37972 > 151.101.117.67.443: Flags [.], ack 931286, win 65535, length 0
19:27:25.383581 IP 151.101.117.67.443 > 10.0.2.15.37972: Flags [P.], seq 931286:936782, ack 867, win 65535, length 5496
19:27:25.383586 IP 151.101.117.67.443 > 10.0.2.15.37972: Flags [P.], seq 936782:939530, ack 867, win 65535, length 2748
19:27:25.384623 IP 151.101.117.67.443 > 10.0.2.15.37972: Flags [P.], seq 939530:942278, ack 867, win 65535, length 2748
19:27:25.384629 IP 151.101.117.67.443 > 10.0.2.15.37972: Flags [P.], seq 942278:945026, ack 867, win 65535, length 2748
19:27:25.384631 IP 151.101.117.67.443 > 10.0.2.15.37972: Flags [P.], seq 945026:947774, ack 867, win 65535, length 2748
19:27:25.385472 IP 151.101.117.67.443 > 10.0.2.15.37972: Flags [P.], seq 947774:957392, ack 867, win 65535, length 9618
19:27:25.385505 IP 151.101.117.67.443 > 10.0.2.15.37972: Flags [P.], seq 957392:961514, ack 867, win 65535, length 4122
19:27:25.385537 IP 151.101.117.67.443 > 10.0.2.15.37972: Flags [P.], seq 961514:968384, ack 867, win 65535, length 6870
19:27:25.385786 IP 10.0.2.15.37972 > 151.101.117.67.443: Flags [.], ack 968384, win 65535, length 0
19:27:25.386397 IP 151.101.117.67.443 > 10.0.2.15.37972: Flags [.], seq 968384:974224, ack 867, win 65535, length 5840
19:27:25.386418 IP 10.0.2.15.37972 > 151.101.117.67.443: Flags [.], ack 974224, win 65535, length 0
19:27:25.386589 IP 151.101.117.67.443 > 10.0.2.15.37972: Flags [P.], seq 974224:986246, ack 867, win 65535, length 12022
19:27:25.386688 IP 151.101.117.67.443 > 10.0.2.15.37972: Flags [P.], seq 986246:991742, ack 867, win 65535, length 5496
19:27:25.386690 IP 151.101.117.67.443 > 10.0.2.15.37972: Flags [P.], seq 991742:994490, ack 867, win 65535, length 2748
19:27:25.386691 IP 151.101.117.67.443 > 10.0.2.15.37972: Flags [P.], seq 994490:997238, ack 867, win 65535, length 2748
19:27:25.386740 IP 151.101.117.67.443 > 10.0.2.15.37972: Flags [P.], seq 997238:999986, ack 867, win 65535, length 2748
19:27:25.386742 IP 151.101.117.67.443 > 10.0.2.15.37972: Flags [P.], seq 999986:1002734, ack 867, win 65535, length 2748
19:27:25.386742 IP 151.101.117.67.443 > 10.0.2.15.37972: Flags [P.], seq 1002734:1005482, ack 867, win 65535, length 2748
19:27:25.386804 IP 10.0.2.15.37972 > 151.101.117.67.443: Flags [.], ack 1005482, win 65535, length 0
19:27:25.387887 IP 151.101.117.67.443 > 10.0.2.15.37972: Flags [P.], seq 1005482:1010978, ack 867, win 65535, length 5496
19:27:25.387889 IP 151.101.117.67.443 > 10.0.2.15.37972: Flags [P.], seq 1010978:1013726, ack 867, win 65535, length 2748
19:27:25.387911 IP 10.0.2.15.37972 > 151.101.117.67.443: Flags [.], ack 1010978, win 65535, length 0
19:27:25.387986 IP 10.0.2.15.37972 > 151.101.117.67.443: Flags [.], ack 1013726, win 65535, length 0
19:27:25.388326 IP 151.101.117.67.443 > 10.0.2.15.37972: Flags [P.], seq 1013726:1017848, ack 867, win 65535, length 4122
19:27:25.388328 IP 151.101.117.67.443 > 10.0.2.15.37972: Flags [P.], seq 1017848:1020596, ack 867, win 65535, length 2748
19:27:25.388329 IP 151.101.117.67.443 > 10.0.2.15.37972: Flags [P.], seq 1020596:1021970, ack 867, win 65535, length 1374
19:27:25.388330 IP 151.101.117.67.443 > 10.0.2.15.37972: Flags [P.], seq 1021970:1024718, ack 867, win 65535, length 2748
19:27:25.388375 IP 10.0.2.15.37972 > 151.101.117.67.443: Flags [.], ack 1017848, win 65535, length 0
19:27:25.388517 IP 10.0.2.15.37972 > 151.101.117.67.443: Flags [.], ack 1020596, win 65535, length 0
19:27:25.388624 IP 10.0.2.15.37972 > 151.101.117.67.443: Flags [.], ack 1024718, win 65535, length 0
19:27:25.388659 IP 151.101.117.67.443 > 10.0.2.15.37972: Flags [P.], seq 1024718:1027466, ack 867, win 65535, length 2748
19:27:25.388660 IP 151.101.117.67.443 > 10.0.2.15.37972: Flags [P.], seq 1027466:1030214, ack 867, win 65535, length 2748
19:27:25.388669 IP 10.0.2.15.37972 > 151.101.117.67.443: Flags [.], ack 1027466, win 65535, length 0
19:27:25.388768 IP 10.0.2.15.37972 > 151.101.117.67.443: Flags [.], ack 1030214, win 65535, length 0

