13:19:52.155649 IP 151.101.117.67.443 > 10.0.2.15.50984: Flags [.], seq 68608002:68610922, ack 458349668, win 65535, length 2920
13:19:52.155671 IP 10.0.2.15.50984 > 151.101.117.67.443: Flags [.], ack 2920, win 62780, length 0
13:19:52.156072 IP 151.101.117.67.443 > 10.0.2.15.50984: Flags [P.], seq 2920:4122, ack 1, win 65535, length 1202
13:19:52.156094 IP 10.0.2.15.50984 > 151.101.117.67.443: Flags [.], ack 4122, win 61578, length 0
13:19:52.158416 IP 151.101.117.67.443 > 10.0.2.15.50984: Flags [P.], seq 4122:5063, ack 1, win 65535, length 941
13:19:52.158438 IP 10.0.2.15.50984 > 151.101.117.67.443: Flags [.], ack 5063, win 62780, length 0
13:19:52.160310 IP 10.0.2.15.50984 > 151.101.117.67.443: Flags [P.], seq 1:94, ack 5063, win 62780, length 93
13:19:52.161093 IP 151.101.117.67.443 > 10.0.2.15.50984: Flags [.], ack 94, win 65535, length 0
13:19:52.181866 IP 151.101.117.67.443 > 10.0.2.15.50984: Flags [P.], seq 5063:5114, ack 94, win 65535, length 51
13:19:52.181901 IP 10.0.2.15.50984 > 151.101.117.67.443: Flags [.], ack 5114, win 62780, length 0
13:19:52.184751 IP 10.0.2.15.50984 > 151.101.117.67.443: Flags [P.], seq 94:147, ack 5114, win 62780, length 53
13:19:52.184796 IP 10.0.2.15.50984 > 151.101.117.67.443: Flags [P.], seq 147:203, ack 5114, win 62780, length 56
13:19:52.184934 IP 10.0.2.15.50984 > 151.101.117.67.443: Flags [P.], seq 203:312, ack 5114, win 62780, length 109
13:19:52.185300 IP 151.101.117.67.443 > 10.0.2.15.50984: Flags [.], ack 147, win 65535, length 0
13:19:52.185301 IP 151.101.117.67.443 > 10.0.2.15.50984: Flags [.], ack 203, win 65535, length 0
13:19:52.185302 IP 151.101.117.67.443 > 10.0.2.15.50984: Flags [.], ack 312, win 65535, length 0
13:19:52.205160 IP 151.101.117.67.443 > 10.0.2.15.50984: Flags [P.], seq 5114:9302, ack 312, win 65535, length 4188
13:19:52.205179 IP 10.0.2.15.50984 > 151.101.117.67.443: Flags [.], ack 9302, win 61320, length 0
13:19:52.205379 IP 10.0.2.15.50984 > 151.101.117.67.443: Flags [P.], seq 312:350, ack 9302, win 61320, length 38
13:19:52.205841 IP 151.101.117.67.443 > 10.0.2.15.50984: Flags [.], ack 350, win 65535, length 0
13:19:52.207136 IP 151.101.117.67.443 > 10.0.2.15.50984: Flags [P.], seq 9302:17546, ack 350, win 65535, length 8244
13:19:52.207217 IP 10.0.2.15.50984 > 151.101.117.67.443: Flags [.], ack 17546, win 58400, length 0
13:19:52.208930 IP 151.101.117.67.443 > 10.0.2.15.50984: Flags [P.], seq 17546:23042, ack 350, win 65535, length 5496
13:19:52.208946 IP 10.0.2.15.50984 > 151.101.117.67.443: Flags [.], ack 23042, win 61320, length 0
13:19:52.210011 IP 151.101.117.67.443 > 10.0.2.15.50984: Flags [P.], seq 23042:27164, ack 350, win 65535, length 4122
13:19:52.210027 IP 10.0.2.15.50984 > 151.101.117.67.443: Flags [.], ack 27164, win 61320, length 0
13:19:52.210358 IP 151.101.117.67.443 > 10.0.2.15.50984: Flags [P.], seq 27164:31286, ack 350, win 65535, length 4122
13:19:52.210445 IP 10.0.2.15.50984 > 151.101.117.67.443: Flags [.], ack 31286, win 58400, length 0
13:19:52.211426 IP 151.101.117.67.443 > 10.0.2.15.50984: Flags [P.], seq 31286:34034, ack 350, win 65535, length 2748
13:19:52.211443 IP 10.0.2.15.50984 > 151.101.117.67.443: Flags [.], ack 34034, win 62780, length 0
13:19:52.212466 IP 151.101.117.67.443 > 10.0.2.15.50984: Flags [P.], seq 34034:36782, ack 350, win 65535, length 2748
13:19:52.212481 IP 10.0.2.15.50984 > 151.101.117.67.443: Flags [.], ack 36782, win 62780, length 0
13:19:52.215255 IP 151.101.117.67.443 > 10.0.2.15.50984: Flags [P.], seq 36782:45026, ack 350, win 65535, length 8244
13:19:52.215388 IP 10.0.2.15.50984 > 151.101.117.67.443: Flags [.], ack 45026, win 58400, length 0
13:19:52.217115 IP 151.101.117.67.443 > 10.0.2.15.50984: Flags [P.], seq 45026:46400, ack 350, win 65535, length 1374
13:19:52.218501 IP 151.101.117.67.443 > 10.0.2.15.50984: Flags [P.], seq 46400:54644, ack 350, win 65535, length 8244
13:19:52.218524 IP 10.0.2.15.50984 > 151.101.117.67.443: Flags [.], ack 54644, win 58400, length 0
13:19:52.219530 IP 151.101.117.67.443 > 10.0.2.15.50984: Flags [P.], seq 54644:56018, ack 350, win 65535, length 1374
13:19:52.220601 IP 151.101.117.67.443 > 10.0.2.15.50984: Flags [P.], seq 56018:64262, ack 350, win 65535, length 8244
13:19:52.220617 IP 10.0.2.15.50984 > 151.101.117.67.443: Flags [.], ack 64262, win 58400, length 0
13:19:52.220935 IP 151.101.117.67.443 > 10.0.2.15.50984: Flags [P.], seq 64262:68384, ack 350, win 65535, length 4122
13:19:52.220962 IP 10.0.2.15.50984 > 151.101.117.67.443: Flags [.], ack 68384, win 62780, length 0
13:19:52.221977 IP 151.101.117.67.443 > 10.0.2.15.50984: Flags [P.], seq 68384:73880, ack 350, win 65535, length 5496
13:19:52.221991 IP 10.0.2.15.50984 > 151.101.117.67.443: Flags [.], ack 73880, win 65535, length 0
13:19:52.223355 IP 151.101.117.67.443 > 10.0.2.15.50984: Flags [P.], seq 73880:80750, ack 350, win 65535, length 6870
13:19:52.223371 IP 10.0.2.15.50984 > 151.101.117.67.443: Flags [.], ack 80750, win 65535, length 0
13:19:52.224302 IP 151.101.117.67.443 > 10.0.2.15.50984: Flags [P.], seq 80750:86246, ack 350, win 65535, length 5496
13:19:52.224318 IP 10.0.2.15.50984 > 151.101.117.67.443: Flags [.], ack 86246, win 65535, length 0
13:19:52.226760 IP 151.101.117.67.443 > 10.0.2.15.50984: Flags [P.], seq 86246:99986, ack 350, win 65535, length 13740
13:19:52.226778 IP 10.0.2.15.50984 > 151.101.117.67.443: Flags [.], ack 99986, win 65535, length 0
13:19:52.226920 IP 151.101.117.67.443 > 10.0.2.15.50984: Flags [P.], seq 99986:105482, ack 350, win 65535, length 5496
13:19:52.226937 IP 10.0.2.15.50984 > 151.101.117.67.443: Flags [.], ack 105482, win 65535, length 0
13:19:52.228261 IP 151.101.117.67.443 > 10.0.2.15.50984: Flags [P.], seq 105482:115100, ack 350, win 65535, length 9618
13:19:52.228324 IP 10.0.2.15.50984 > 151.101.117.67.443: Flags [.], ack 115100, win 65535, length 0
13:19:52.228670 IP 151.101.117.67.443 > 10.0.2.15.50984: Flags [P.], seq 115100:117848, ack 350, win 65535, length 2748
13:19:52.228681 IP 10.0.2.15.50984 > 151.101.117.67.443: Flags [.], ack 117848, win 65535, length 0
13:19:52.230256 IP 151.101.117.67.443 > 10.0.2.15.50984: Flags [P.], seq 117848:126092, ack 350, win 65535, length 8244
13:19:52.230282 IP 10.0.2.15.50984 > 151.101.117.67.443: Flags [.], ack 126092, win 65535, length 0
13:19:52.232269 IP 151.101.117.67.443 > 10.0.2.15.50984: Flags [P.], seq 126092:131588, ack 350, win 65535, length 5496
13:19:52.232284 IP 10.0.2.15.50984 > 151.101.117.67.443: Flags [.], ack 131588, win 65535, length 0
13:19:52.234916 IP 151.101.117.67.443 > 10.0.2.15.50984: Flags [P.], seq 131588:156320, ack 350, win 65535, length 24732
13:19:52.234950 IP 10.0.2.15.50984 > 151.101.117.67.443: Flags [.], ack 156320, win 65535, length 0
13:19:52.235123 IP 151.101.117.67.443 > 10.0.2.15.50984: Flags [P.], seq 156320:168686, ack 350, win 65535, length 12366
13:19:52.235136 IP 10.0.2.15.50984 > 151.101.117.67.443: Flags [.], ack 168686, win 65535, length 0
13:19:52.235934 IP 151.101.117.67.443 > 10.0.2.15.50984: Flags [P.], seq 168686:185174, ack 350, win 65535, length 16488
13:19:52.235951 IP 10.0.2.15.50984 > 151.101.117.67.443: Flags [.], ack 185174, win 65535, length 0
13:19:52.237606 IP 151.101.117.67.443 > 10.0.2.15.50984: Flags [P.], seq 185174:189296, ack 350, win 65535, length 4122
13:19:52.237625 IP 10.0.2.15.50984 > 151.101.117.67.443: Flags [.], ack 189296, win 65535, length 0
13:19:52.237924 IP 151.101.117.67.443 > 10.0.2.15.50984: Flags [P.], seq 189296:200288, ack 350, win 65535, length 10992
13:19:52.237939 IP 10.0.2.15.50984 > 151.101.117.67.443: Flags [.], ack 200288, win 65535, length 0
13:19:52.238996 IP 151.101.117.67.443 > 10.0.2.15.50984: Flags [P.], seq 200288:201662, ack 350, win 65535, length 1374
13:19:52.240040 IP 151.101.117.67.443 > 10.0.2.15.50984: Flags [P.], seq 201662:207158, ack 350, win 65535, length 5496
13:19:52.240056 IP 10.0.2.15.50984 > 151.101.117.67.443: Flags [.], ack 207158, win 65535, length 0
13:19:52.240484 IP 151.101.117.67.443 > 10.0.2.15.50984: Flags [P.], seq 207158:219524, ack 350, win 65535, length 12366
13:19:52.240509 IP 10.0.2.15.50984 > 151.101.117.67.443: Flags [.], ack 219524, win 65535, length 0
13:19:52.242231 IP 151.101.117.67.443 > 10.0.2.15.50984: Flags [P.], seq 219524:230516, ack 350, win 65535, length 10992
13:19:52.242247 IP 10.0.2.15.50984 > 151.101.117.67.443: Flags [.], ack 230516, win 65535, length 0
13:19:52.242626 IP 151.101.117.67.443 > 10.0.2.15.50984: Flags [P.], seq 230516:241508, ack 350, win 65535, length 10992
13:19:52.242639 IP 10.0.2.15.50984 > 151.101.117.67.443: Flags [.], ack 241508, win 65535, length 0
13:19:52.242865 IP 151.101.117.67.443 > 10.0.2.15.50984: Flags [P.], seq 241508:242882, ack 350, win 65535, length 1374
13:19:52.245192 IP 151.101.117.67.443 > 10.0.2.15.50984: Flags [P.], seq 242882:253874, ack 350, win 65535, length 10992
13:19:52.245209 IP 10.0.2.15.50984 > 151.101.117.67.443: Flags [.], ack 253874, win 65535, length 0
13:19:52.245533 IP 151.101.117.67.443 > 10.0.2.15.50984: Flags [P.], seq 253874:262118, ack 350, win 65535, length 8244
13:19:52.245546 IP 10.0.2.15.50984 > 151.101.117.67.443: Flags [.], ack 262118, win 65535, length 0
13:19:52.246016 IP 151.101.117.67.443 > 10.0.2.15.50984: Flags [P.], seq 262118:274484, ack 350, win 65535, length 12366
13:19:52.246027 IP 10.0.2.15.50984 > 151.101.117.67.443: Flags [.], ack 274484, win 65535, length 0
13:19:52.246416 IP 151.101.117.67.443 > 10.0.2.15.50984: Flags [P.], seq 274484:285476, ack 350, win 65535, length 10992
13:19:52.246428 IP 10.0.2.15.50984 > 151.101.117.67.443: Flags [.], ack 285476, win 65535, length 0
13:19:52.248037 IP 151.101.117.67.443 > 10.0.2.15.50984: Flags [P.], seq 285476:296468, ack 350, win 65535, length 10992
13:19:52.248055 IP 10.0.2.15.50984 > 151.101.117.67.443: Flags [.], ack 296468, win 65535, length 0
13:19:52.248512 IP 151.101.117.67.443 > 10.0.2.15.50984: Flags [P.], seq 296468:297842, ack 350, win 65535, length 1374
13:19:52.248923 IP 151.101.117.67.443 > 10.0.2.15.50984: Flags [P.], seq 297842:311582, ack 350, win 65535, length 13740
13:19:52.248946 IP 10.0.2.15.50984 > 151.101.117.67.443: Flags [.], ack 311582, win 65535, length 0
13:19:52.250480 IP 151.101.117.67.443 > 10.0.2.15.50984: Flags [P.], seq 311582:321200, ack 350, win 65535, length 9618
13:19:52.250484 IP 151.101.117.67.443 > 10.0.2.15.50984: Flags [P.], seq 321200:332192, ack 350, win 65535, length 10992
13:19:52.250508 IP 10.0.2.15.50984 > 151.101.117.67.443: Flags [.], ack 321200, win 65535, length 0
13:19:52.250669 IP 10.0.2.15.50984 > 151.101.117.67.443: Flags [.], ack 332192, win 65535, length 0
13:19:52.251168 IP 151.101.117.67.443 > 10.0.2.15.50984: Flags [P.], seq 332192:343184, ack 350, win 65535, length 10992
13:19:52.251192 IP 10.0.2.15.50984 > 151.101.117.67.443: Flags [.], ack 343184, win 65535, length 0
13:19:52.253435 IP 151.101.117.67.443 > 10.0.2.15.50984: Flags [P.], seq 343184:378908, ack 350, win 65535, length 35724
13:19:52.253452 IP 10.0.2.15.50984 > 151.101.117.67.443: Flags [.], ack 378908, win 65535, length 0
13:19:52.254294 IP 151.101.117.67.443 > 10.0.2.15.50984: Flags [P.], seq 378908:385778, ack 350, win 65535, length 6870
13:19:52.254308 IP 10.0.2.15.50984 > 151.101.117.67.443: Flags [.], ack 385778, win 65535, length 0
13:19:52.254631 IP 151.101.117.67.443 > 10.0.2.15.50984: Flags [P.], seq 385778:400892, ack 350, win 65535, length 15114
13:19:52.254642 IP 10.0.2.15.50984 > 151.101.117.67.443: Flags [.], ack 400892, win 65535, length 0
13:19:52.254954 IP 151.101.117.67.443 > 10.0.2.15.50984: Flags [P.], seq 400892:410510, ack 350, win 65535, length 9618
13:19:52.255004 IP 10.0.2.15.50984 > 151.101.117.67.443: Flags [.], ack 410510, win 65535, length 0
13:19:52.255429 IP 151.101.117.67.443 > 10.0.2.15.50984: Flags [P.], seq 410510:414632, ack 350, win 65535, length 4122
13:19:52.255441 IP 10.0.2.15.50984 > 151.101.117.67.443: Flags [.], ack 414632, win 65535, length 0
13:19:52.256225 IP 151.101.117.67.443 > 10.0.2.15.50984: Flags [P.], seq 414632:425624, ack 350, win 65535, length 10992
13:19:52.256275 IP 10.0.2.15.50984 > 151.101.117.67.443: Flags [.], ack 425624, win 65535, length 0
13:19:52.256724 IP 151.101.117.67.443 > 10.0.2.15.50984: Flags [P.], seq 425624:437990, ack 350, win 65535, length 12366
13:19:52.256737 IP 10.0.2.15.50984 > 151.101.117.67.443: Flags [.], ack 437990, win 65535, length 0
13:19:52.257157 IP 151.101.117.67.443 > 10.0.2.15.50984: Flags [P.], seq 437990:444860, ack 350, win 65535, length 6870
13:19:52.257171 IP 10.0.2.15.50984 > 151.101.117.67.443: Flags [.], ack 444860, win 65535, length 0
13:19:52.257945 IP 151.101.117.67.443 > 10.0.2.15.50984: Flags [P.], seq 444860:446234, ack 350, win 65535, length 1374
13:19:52.258204 IP 151.101.117.67.443 > 10.0.2.15.50984: Flags [P.], seq 446234:455852, ack 350, win 65535, length 9618
13:19:52.258218 IP 10.0.2.15.50984 > 151.101.117.67.443: Flags [.], ack 455852, win 65535, length 0
13:19:52.258566 IP 151.101.117.67.443 > 10.0.2.15.50984: Flags [P.], seq 455852:465470, ack 350, win 65535, length 9618
13:19:52.258577 IP 10.0.2.15.50984 > 151.101.117.67.443: Flags [.], ack 465470, win 65535, length 0
13:19:52.259127 IP 151.101.117.67.443 > 10.0.2.15.50984: Flags [P.], seq 465470:475088, ack 350, win 65535, length 9618
13:19:52.259146 IP 10.0.2.15.50984 > 151.101.117.67.443: Flags [.], ack 475088, win 65535, length 0
13:19:52.259599 IP 151.101.117.67.443 > 10.0.2.15.50984: Flags [P.], seq 475088:477836, ack 350, win 65535, length 2748
13:19:52.259618 IP 10.0.2.15.50984 > 151.101.117.67.443: Flags [.], ack 477836, win 65535, length 0
13:19:52.261033 IP 151.101.117.67.443 > 10.0.2.15.50984: Flags [P.], seq 477836:484706, ack 350, win 65535, length 6870
13:19:52.261052 IP 10.0.2.15.50984 > 151.101.117.67.443: Flags [.], ack 484706, win 65535, length 0
13:19:52.261364 IP 151.101.117.67.443 > 10.0.2.15.50984: Flags [P.], seq 484706:492950, ack 350, win 65535, length 8244
13:19:52.261374 IP 10.0.2.15.50984 > 151.101.117.67.443: Flags [.], ack 492950, win 65535, length 0
13:19:52.262794 IP 151.101.117.67.443 > 10.0.2.15.50984: Flags [P.], seq 492950:501194, ack 350, win 65535, length 8244
13:19:52.262818 IP 10.0.2.15.50984 > 151.101.117.67.443: Flags [.], ack 501194, win 65535, length 0
13:19:52.263436 IP 151.101.117.67.443 > 10.0.2.15.50984: Flags [P.], seq 501194:514934, ack 350, win 65535, length 13740
13:19:52.263456 IP 10.0.2.15.50984 > 151.101.117.67.443: Flags [.], ack 514934, win 65535, length 0
13:19:52.263504 IP 151.101.117.67.443 > 10.0.2.15.50984: Flags [P.], seq 514934:521804, ack 350, win 65535, length 6870
13:19:52.263510 IP 10.0.2.15.50984 > 151.101.117.67.443: Flags [.], ack 521804, win 65535, length 0
13:19:52.264707 IP 151.101.117.67.443 > 10.0.2.15.50984: Flags [P.], seq 521804:531422, ack 350, win 65535, length 9618
13:19:52.264730 IP 10.0.2.15.50984 > 151.101.117.67.443: Flags [.], ack 531422, win 65535, length 0
13:19:52.266761 IP 151.101.117.67.443 > 10.0.2.15.50984: Flags [P.], seq 531422:542414, ack 350, win 65535, length 10992
13:19:52.266781 IP 10.0.2.15.50984 > 151.101.117.67.443: Flags [.], ack 542414, win 65535, length 0
13:19:52.272915 IP 151.101.117.67.443 > 10.0.2.15.50984: Flags [.], seq 542414:606654, ack 350, win 65535, length 64240
13:19:52.272933 IP 10.0.2.15.50984 > 151.101.117.67.443: Flags [.], ack 606654, win 65535, length 0
13:19:52.273308 IP 151.101.117.67.443 > 10.0.2.15.50984: Flags [P.], seq 606654:608114, ack 350, win 65535, length 1460
13:19:52.273814 IP 151.101.117.67.443 > 10.0.2.15.50984: Flags [.], seq 608114:619794, ack 350, win 65535, length 11680
13:19:52.273831 IP 10.0.2.15.50984 > 151.101.117.67.443: Flags [.], ack 619794, win 65535, length 0
13:19:52.274018 IP 151.101.117.67.443 > 10.0.2.15.50984: Flags [P.], seq 619794:642716, ack 350, win 65535, length 22922
13:19:52.274067 IP 10.0.2.15.50984 > 151.101.117.67.443: Flags [.], ack 642716, win 65535, length 0
13:19:52.274577 IP 151.101.117.67.443 > 10.0.2.15.50984: Flags [P.], seq 642716:648212, ack 350, win 65535, length 5496
13:19:52.274590 IP 10.0.2.15.50984 > 151.101.117.67.443: Flags [.], ack 648212, win 65535, length 0
13:19:52.279065 IP 151.101.117.67.443 > 10.0.2.15.50984: Flags [P.], seq 648212:656456, ack 350, win 65535, length 8244
13:19:52.279082 IP 10.0.2.15.50984 > 151.101.117.67.443: Flags [.], ack 656456, win 65535, length 0
13:19:52.279324 IP 151.101.117.67.443 > 10.0.2.15.50984: Flags [P.], seq 656456:666074, ack 350, win 65535, length 9618
13:19:52.279334 IP 10.0.2.15.50984 > 151.101.117.67.443: Flags [.], ack 666074, win 65535, length 0
13:19:52.279805 IP 151.101.117.67.443 > 10.0.2.15.50984: Flags [P.], seq 666074:677066, ack 350, win 65535, length 10992
13:19:52.279864 IP 10.0.2.15.50984 > 151.101.117.67.443: Flags [.], ack 677066, win 65535, length 0
13:19:52.280598 IP 151.101.117.67.443 > 10.0.2.15.50984: Flags [P.], seq 677066:689432, ack 350, win 65535, length 12366
13:19:52.281486 IP 151.101.117.67.443 > 10.0.2.15.50984: Flags [P.], seq 689432:700424, ack 350, win 65535, length 10992
13:19:52.281539 IP 151.101.117.67.443 > 10.0.2.15.50984: Flags [P.], seq 700424:712790, ack 350, win 65535, length 12366
13:19:52.281593 IP 10.0.2.15.50984 > 151.101.117.67.443: Flags [.], ack 712790, win 65535, length 0
13:19:52.282373 IP 151.101.117.67.443 > 10.0.2.15.50984: Flags [P.], seq 712790:732026, ack 350, win 65535, length 19236
13:19:52.282388 IP 10.0.2.15.50984 > 151.101.117.67.443: Flags [.], ack 732026, win 65535, length 0
13:19:52.282771 IP 151.101.117.67.443 > 10.0.2.15.50984: Flags [P.], seq 732026:736148, ack 350, win 65535, length 4122
13:19:52.282786 IP 10.0.2.15.50984 > 151.101.117.67.443: Flags [.], ack 736148, win 65535, length 0
13:19:52.283629 IP 151.101.117.67.443 > 10.0.2.15.50984: Flags [P.], seq 736148:749888, ack 350, win 65535, length 13740
13:19:52.284089 IP 151.101.117.67.443 > 10.0.2.15.50984: Flags [P.], seq 749888:758132, ack 350, win 65535, length 8244
13:19:52.284402 IP 151.101.117.67.443 > 10.0.2.15.50984: Flags [P.], seq 758132:767750, ack 350, win 65535, length 9618
13:19:52.284824 IP 151.101.117.67.443 > 10.0.2.15.50984: Flags [P.], seq 767750:775994, ack 350, win 65535, length 8244
13:19:52.285126 IP 10.0.2.15.50984 > 151.101.117.67.443: Flags [.], ack 749888, win 65535, length 0
13:19:52.285827 IP 10.0.2.15.50984 > 151.101.117.67.443: Flags [.], ack 775994, win 65535, length 0
13:19:52.286231 IP 151.101.117.67.443 > 10.0.2.15.50984: Flags [.], seq 775994:789134, ack 350, win 65535, length 13140
13:19:52.286246 IP 10.0.2.15.50984 > 151.101.117.67.443: Flags [.], ack 789134, win 65535, length 0
13:19:52.287365 IP 151.101.117.67.443 > 10.0.2.15.50984: Flags [P.], seq 789134:806222, ack 350, win 65535, length 17088
13:19:52.287393 IP 151.101.117.67.443 > 10.0.2.15.50984: Flags [P.], seq 806222:818588, ack 350, win 65535, length 12366
13:19:52.287404 IP 151.101.117.67.443 > 10.0.2.15.50984: Flags [P.], seq 818588:824084, ack 350, win 65535, length 5496
13:19:52.287459 IP 10.0.2.15.50984 > 151.101.117.67.443: Flags [.], ack 824084, win 65535, length 0
13:19:52.288164 IP 151.101.117.67.443 > 10.0.2.15.50984: Flags [P.], seq 824084:836450, ack 350, win 65535, length 12366
13:19:52.288178 IP 10.0.2.15.50984 > 151.101.117.67.443: Flags [.], ack 836450, win 65535, length 0
13:19:52.288592 IP 151.101.117.67.443 > 10.0.2.15.50984: Flags [P.], seq 836450:846068, ack 350, win 65535, length 9618
13:19:52.288605 IP 10.0.2.15.50984 > 151.101.117.67.443: Flags [.], ack 846068, win 65535, length 0
13:19:52.289096 IP 151.101.117.67.443 > 10.0.2.15.50984: Flags [P.], seq 846068:858434, ack 350, win 65535, length 12366
13:19:52.289160 IP 10.0.2.15.50984 > 151.101.117.67.443: Flags [.], ack 858434, win 65535, length 0
13:19:52.289630 IP 151.101.117.67.443 > 10.0.2.15.50984: Flags [P.], seq 858434:869426, ack 350, win 65535, length 10992
13:19:52.289643 IP 10.0.2.15.50984 > 151.101.117.67.443: Flags [.], ack 869426, win 65535, length 0
13:19:52.290226 IP 151.101.117.67.443 > 10.0.2.15.50984: Flags [P.], seq 869426:879044, ack 350, win 65535, length 9618
13:19:52.290288 IP 10.0.2.15.50984 > 151.101.117.67.443: Flags [.], ack 879044, win 65535, length 0
13:19:52.290443 IP 151.101.117.67.443 > 10.0.2.15.50984: Flags [.], seq 879044:887804, ack 350, win 65535, length 8760
13:19:52.290452 IP 10.0.2.15.50984 > 151.101.117.67.443: Flags [.], ack 887804, win 65535, length 0
13:19:52.290665 IP 151.101.117.67.443 > 10.0.2.15.50984: Flags [P.], seq 887804:890036, ack 350, win 65535, length 2232
13:19:52.290730 IP 10.0.2.15.50984 > 151.101.117.67.443: Flags [.], ack 890036, win 65535, length 0
13:19:52.291152 IP 151.101.117.67.443 > 10.0.2.15.50984: Flags [P.], seq 890036:898280, ack 350, win 65535, length 8244
13:19:52.291163 IP 10.0.2.15.50984 > 151.101.117.67.443: Flags [.], ack 898280, win 65535, length 0
13:19:52.298280 IP 151.101.117.67.443 > 10.0.2.15.50984: Flags [.], seq 898280:958140, ack 350, win 65535, length 59860
13:19:52.298591 IP 151.101.117.67.443 > 10.0.2.15.50984: Flags [.], seq 958140:962520, ack 350, win 65535, length 4380
13:19:52.298899 IP 10.0.2.15.50984 > 151.101.117.67.443: Flags [.], ack 962520, win 65535, length 0
13:19:52.299357 IP 151.101.117.67.443 > 10.0.2.15.50984: Flags [P.], seq 962520:963980, ack 350, win 65535, length 1460
13:19:52.299697 IP 151.101.117.67.443 > 10.0.2.15.50984: Flags [.], seq 963980:982960, ack 350, win 65535, length 18980
13:19:52.299758 IP 10.0.2.15.50984 > 151.101.117.67.443: Flags [.], ack 982960, win 65535, length 0

