19:29:13.031130 IP 10.0.2.15.49575 > 140.233.253.2.53: 3387+ A? www.cnn.com. (29)
19:29:13.031173 IP 10.0.2.15.49575 > 140.233.253.2.53: 22590+ AAAA? www.cnn.com. (29)
19:29:13.037148 IP 140.233.253.2.53 > 10.0.2.15.49575: 22590 2/0/0 CNAME turner-tls.map.fastly.net., AAAA 2a04:4e42:1c::323 (96)
19:29:13.037150 IP 140.233.253.2.53 > 10.0.2.15.49575: 3387 2/0/0 CNAME turner-tls.map.fastly.net., A 151.101.117.67 (84)
19:29:13.037606 IP 10.0.2.15.38014 > 151.101.117.67.443: Flags [S], seq 3272241426, win 64240, options [mss 1460,sackOK,TS val 1396672010 ecr 0,nop,wscale 6], length 0
19:29:13.053485 IP 151.101.117.67.443 > 10.0.2.15.38014: Flags [S.], seq 168064001, ack 3272241427, win 65535, options [mss 1460], length 0
19:29:13.053539 IP 10.0.2.15.38014 > 151.101.117.67.443: Flags [.], ack 1, win 64240, length 0
19:29:13.066545 IP 10.0.2.15.38014 > 151.101.117.67.443: Flags [P.], seq 1:518, ack 1, win 64240, length 517
19:29:13.066856 IP 151.101.117.67.443 > 10.0.2.15.38014: Flags [.], ack 518, win 65535, length 0
19:29:13.085795 IP 151.101.117.67.443 > 10.0.2.15.38014: Flags [.], seq 1:2921, ack 518, win 65535, length 2920
19:29:13.085821 IP 10.0.2.15.38014 > 151.101.117.67.443: Flags [.], ack 2921, win 62780, length 0
19:29:13.086059 IP 151.101.117.67.443 > 10.0.2.15.38014: Flags [P.], seq 2921:4123, ack 518, win 65535, length 1202
19:29:13.086073 IP 10.0.2.15.38014 > 151.101.117.67.443: Flags [.], ack 4123, win 61578, length 0
19:29:13.086395 IP 151.101.117.67.443 > 10.0.2.15.38014: Flags [P.], seq 4123:5064, ack 518, win 65535, length 941
19:29:13.086405 IP 10.0.2.15.38014 > 151.101.117.67.443: Flags [.], ack 5064, win 62780, length 0
19:29:13.087666 IP 10.0.2.15.38014 > 151.101.117.67.443: Flags [P.], seq 518:611, ack 5064, win 62780, length 93
19:29:13.087900 IP 151.101.117.67.443 > 10.0.2.15.38014: Flags [.], ack 611, win 65535, length 0
19:29:13.101755 IP 151.101.117.67.443 > 10.0.2.15.38014: Flags [P.], seq 5064:5115, ack 611, win 65535, length 51
19:29:13.101776 IP 10.0.2.15.38014 > 151.101.117.67.443: Flags [.], ack 5115, win 62780, length 0
19:29:13.102271 IP 10.0.2.15.38014 > 151.101.117.67.443: Flags [P.], seq 611:664, ack 5115, win 62780, length 53
19:29:13.102309 IP 10.0.2.15.38014 > 151.101.117.67.443: Flags [P.], seq 664:720, ack 5115, win 62780, length 56
19:29:13.102626 IP 151.101.117.67.443 > 10.0.2.15.38014: Flags [.], ack 664, win 65535, length 0
19:29:13.102628 IP 151.101.117.67.443 > 10.0.2.15.38014: Flags [.], ack 720, win 65535, length 0
19:29:13.102649 IP 10.0.2.15.38014 > 151.101.117.67.443: Flags [P.], seq 720:829, ack 5115, win 62780, length 109
19:29:13.102899 IP 151.101.117.67.443 > 10.0.2.15.38014: Flags [.], ack 829, win 65535, length 0
19:29:13.115605 IP 151.101.117.67.443 > 10.0.2.15.38014: Flags [P.], seq 5115:5210, ack 829, win 65535, length 95
19:29:13.115654 IP 10.0.2.15.38014 > 151.101.117.67.443: Flags [.], ack 5210, win 62780, length 0
19:29:13.115872 IP 10.0.2.15.38014 > 151.101.117.67.443: Flags [P.], seq 829:867, ack 5210, win 62780, length 38
19:29:13.116121 IP 151.101.117.67.443 > 10.0.2.15.38014: Flags [.], ack 867, win 65535, length 0
19:29:13.119498 IP 151.101.117.67.443 > 10.0.2.15.38014: Flags [P.], seq 5210:12080, ack 867, win 65535, length 6870
19:29:13.119606 IP 10.0.2.15.38014 > 151.101.117.67.443: Flags [.], ack 12080, win 59860, length 0
19:29:13.120403 IP 151.101.117.67.443 > 10.0.2.15.38014: Flags [P.], seq 12080:14828, ack 867, win 65535, length 2748
19:29:13.120416 IP 10.0.2.15.38014 > 151.101.117.67.443: Flags [.], ack 14828, win 62780, length 0
19:29:13.121659 IP 151.101.117.67.443 > 10.0.2.15.38014: Flags [P.], seq 14828:20324, ack 867, win 65535, length 5496
19:29:13.121794 IP 10.0.2.15.38014 > 151.101.117.67.443: Flags [.], ack 20324, win 61320, length 0
19:29:13.122490 IP 151.101.117.67.443 > 10.0.2.15.38014: Flags [P.], seq 20324:23072, ack 867, win 65535, length 2748
19:29:13.122503 IP 10.0.2.15.38014 > 151.101.117.67.443: Flags [.], ack 23072, win 62780, length 0
19:29:13.124656 IP 151.101.117.67.443 > 10.0.2.15.38014: Flags [P.], seq 23072:29942, ack 867, win 65535, length 6870
19:29:13.124996 IP 10.0.2.15.38014 > 151.101.117.67.443: Flags [.], ack 29942, win 59860, length 0
19:29:13.125812 IP 151.101.117.67.443 > 10.0.2.15.38014: Flags [P.], seq 29942:34064, ack 867, win 65535, length 4122
19:29:13.125826 IP 10.0.2.15.38014 > 151.101.117.67.443: Flags [.], ack 34064, win 61320, length 0
19:29:13.127172 IP 151.101.117.67.443 > 10.0.2.15.38014: Flags [P.], seq 34064:38186, ack 867, win 65535, length 4122
19:29:13.127192 IP 10.0.2.15.38014 > 151.101.117.67.443: Flags [.], ack 38186, win 61320, length 0
19:29:13.128028 IP 151.101.117.67.443 > 10.0.2.15.38014: Flags [P.], seq 38186:39560, ack 867, win 65535, length 1374
19:29:13.129338 IP 151.101.117.67.443 > 10.0.2.15.38014: Flags [P.], seq 39560:45056, ack 867, win 65535, length 5496
19:29:13.129354 IP 10.0.2.15.38014 > 151.101.117.67.443: Flags [.], ack 45056, win 61320, length 0
19:29:13.130547 IP 151.101.117.67.443 > 10.0.2.15.38014: Flags [P.], seq 45056:49178, ack 867, win 65535, length 4122
19:29:13.130564 IP 10.0.2.15.38014 > 151.101.117.67.443: Flags [.], ack 49178, win 61320, length 0
19:29:13.132724 IP 151.101.117.67.443 > 10.0.2.15.38014: Flags [P.], seq 49178:56048, ack 867, win 65535, length 6870
19:29:13.132884 IP 10.0.2.15.38014 > 151.101.117.67.443: Flags [.], ack 56048, win 59860, length 0
19:29:13.133408 IP 151.101.117.67.443 > 10.0.2.15.38014: Flags [P.], seq 56048:60170, ack 867, win 65535, length 4122
19:29:13.133419 IP 10.0.2.15.38014 > 151.101.117.67.443: Flags [.], ack 60170, win 61320, length 0
19:29:13.135782 IP 151.101.117.67.443 > 10.0.2.15.38014: Flags [P.], seq 60170:75284, ack 867, win 65535, length 15114
19:29:13.135921 IP 10.0.2.15.38014 > 151.101.117.67.443: Flags [.], ack 75284, win 62780, length 0
19:29:13.136551 IP 151.101.117.67.443 > 10.0.2.15.38014: Flags [P.], seq 75284:79406, ack 867, win 65535, length 4122
19:29:13.136568 IP 10.0.2.15.38014 > 151.101.117.67.443: Flags [.], ack 79406, win 65535, length 0
19:29:13.136777 IP 151.101.117.67.443 > 10.0.2.15.38014: Flags [P.], seq 79406:80780, ack 867, win 65535, length 1374
19:29:13.138135 IP 151.101.117.67.443 > 10.0.2.15.38014: Flags [P.], seq 80780:86276, ack 867, win 65535, length 5496
19:29:13.138137 IP 151.101.117.67.443 > 10.0.2.15.38014: Flags [P.], seq 86276:89024, ack 867, win 65535, length 2748
19:29:13.138137 IP 151.101.117.67.443 > 10.0.2.15.38014: Flags [P.], seq 89024:90398, ack 867, win 65535, length 1374
19:29:13.138154 IP 10.0.2.15.38014 > 151.101.117.67.443: Flags [.], ack 86276, win 65535, length 0
19:29:13.138184 IP 10.0.2.15.38014 > 151.101.117.67.443: Flags [.], ack 89024, win 65535, length 0
19:29:13.138748 IP 151.101.117.67.443 > 10.0.2.15.38014: Flags [P.], seq 90398:95894, ack 867, win 65535, length 5496
19:29:13.138765 IP 10.0.2.15.38014 > 151.101.117.67.443: Flags [.], ack 95894, win 65535, length 0
19:29:13.138904 IP 151.101.117.67.443 > 10.0.2.15.38014: Flags [P.], seq 95894:97268, ack 867, win 65535, length 1374
19:29:13.140168 IP 151.101.117.67.443 > 10.0.2.15.38014: Flags [P.], seq 97268:104138, ack 867, win 65535, length 6870
19:29:13.140180 IP 10.0.2.15.38014 > 151.101.117.67.443: Flags [.], ack 104138, win 65535, length 0
19:29:13.141233 IP 151.101.117.67.443 > 10.0.2.15.38014: Flags [P.], seq 104138:109634, ack 867, win 65535, length 5496
19:29:13.141235 IP 151.101.117.67.443 > 10.0.2.15.38014: Flags [P.], seq 109634:112382, ack 867, win 65535, length 2748
19:29:13.141250 IP 10.0.2.15.38014 > 151.101.117.67.443: Flags [.], ack 109634, win 65535, length 0
19:29:13.141280 IP 10.0.2.15.38014 > 151.101.117.67.443: Flags [.], ack 112382, win 65535, length 0
19:29:13.141481 IP 151.101.117.67.443 > 10.0.2.15.38014: Flags [P.], seq 112382:113756, ack 867, win 65535, length 1374
19:29:13.142014 IP 151.101.117.67.443 > 10.0.2.15.38014: Flags [P.], seq 113756:117878, ack 867, win 65535, length 4122
19:29:13.142015 IP 151.101.117.67.443 > 10.0.2.15.38014: Flags [P.], seq 117878:122000, ack 867, win 65535, length 4122
19:29:13.142028 IP 10.0.2.15.38014 > 151.101.117.67.443: Flags [.], ack 117878, win 65535, length 0
19:29:13.142048 IP 10.0.2.15.38014 > 151.101.117.67.443: Flags [.], ack 122000, win 65535, length 0
19:29:13.143440 IP 151.101.117.67.443 > 10.0.2.15.38014: Flags [P.], seq 122000:130244, ack 867, win 65535, length 8244
19:29:13.143453 IP 10.0.2.15.38014 > 151.101.117.67.443: Flags [.], ack 130244, win 65535, length 0
19:29:13.143531 IP 151.101.117.67.443 > 10.0.2.15.38014: Flags [P.], seq 130244:131618, ack 867, win 65535, length 1374
19:29:13.144463 IP 151.101.117.67.443 > 10.0.2.15.38014: Flags [P.], seq 131618:132992, ack 867, win 65535, length 1374
19:29:13.144475 IP 10.0.2.15.38014 > 151.101.117.67.443: Flags [.], ack 132992, win 65535, length 0
19:29:13.145699 IP 151.101.117.67.443 > 10.0.2.15.38014: Flags [P.], seq 132992:141236, ack 867, win 65535, length 8244
19:29:13.145719 IP 10.0.2.15.38014 > 151.101.117.67.443: Flags [.], ack 141236, win 65535, length 0
19:29:13.146131 IP 151.101.117.67.443 > 10.0.2.15.38014: Flags [P.], seq 141236:148106, ack 867, win 65535, length 6870
19:29:13.146148 IP 10.0.2.15.38014 > 151.101.117.67.443: Flags [.], ack 148106, win 65535, length 0
19:29:13.146797 IP 151.101.117.67.443 > 10.0.2.15.38014: Flags [P.], seq 148106:149480, ack 867, win 65535, length 1374
19:29:13.148159 IP 151.101.117.67.443 > 10.0.2.15.38014: Flags [P.], seq 149480:156350, ack 867, win 65535, length 6870
19:29:13.148162 IP 151.101.117.67.443 > 10.0.2.15.38014: Flags [P.], seq 156350:161846, ack 867, win 65535, length 5496
19:29:13.148184 IP 10.0.2.15.38014 > 151.101.117.67.443: Flags [.], ack 156350, win 65535, length 0
19:29:13.148254 IP 10.0.2.15.38014 > 151.101.117.67.443: Flags [.], ack 161846, win 65535, length 0
19:29:13.149291 IP 151.101.117.67.443 > 10.0.2.15.38014: Flags [P.], seq 161846:168716, ack 867, win 65535, length 6870
19:29:13.149312 IP 10.0.2.15.38014 > 151.101.117.67.443: Flags [.], ack 168716, win 65535, length 0
19:29:13.149525 IP 151.101.117.67.443 > 10.0.2.15.38014: Flags [P.], seq 168716:174212, ack 867, win 65535, length 5496
19:29:13.149526 IP 151.101.117.67.443 > 10.0.2.15.38014: Flags [P.], seq 174212:175586, ack 867, win 65535, length 1374
19:29:13.149551 IP 10.0.2.15.38014 > 151.101.117.67.443: Flags [.], ack 175586, win 65535, length 0
19:29:13.150751 IP 151.101.117.67.443 > 10.0.2.15.38014: Flags [P.], seq 175586:185204, ack 867, win 65535, length 9618
19:29:13.150753 IP 151.101.117.67.443 > 10.0.2.15.38014: Flags [P.], seq 185204:190700, ack 867, win 65535, length 5496
19:29:13.150777 IP 10.0.2.15.38014 > 151.101.117.67.443: Flags [.], ack 185204, win 65535, length 0
19:29:13.150857 IP 10.0.2.15.38014 > 151.101.117.67.443: Flags [.], ack 190700, win 65535, length 0
19:29:13.150899 IP 151.101.117.67.443 > 10.0.2.15.38014: Flags [P.], seq 190700:197570, ack 867, win 65535, length 6870
19:29:13.150900 IP 151.101.117.67.443 > 10.0.2.15.38014: Flags [P.], seq 197570:198944, ack 867, win 65535, length 1374
19:29:13.150905 IP 10.0.2.15.38014 > 151.101.117.67.443: Flags [.], ack 197570, win 65535, length 0
19:29:13.152609 IP 151.101.117.67.443 > 10.0.2.15.38014: Flags [P.], seq 198944:207188, ack 867, win 65535, length 8244
19:29:13.152611 IP 151.101.117.67.443 > 10.0.2.15.38014: Flags [P.], seq 207188:211310, ack 867, win 65535, length 4122
19:29:13.152631 IP 10.0.2.15.38014 > 151.101.117.67.443: Flags [.], ack 207188, win 65535, length 0
19:29:13.152665 IP 10.0.2.15.38014 > 151.101.117.67.443: Flags [.], ack 211310, win 65535, length 0
19:29:13.152864 IP 151.101.117.67.443 > 10.0.2.15.38014: Flags [P.], seq 211310:214058, ack 867, win 65535, length 2748
19:29:13.152876 IP 10.0.2.15.38014 > 151.101.117.67.443: Flags [.], ack 214058, win 65535, length 0
19:29:13.153967 IP 151.101.117.67.443 > 10.0.2.15.38014: Flags [P.], seq 214058:220928, ack 867, win 65535, length 6870
19:29:13.153970 IP 151.101.117.67.443 > 10.0.2.15.38014: Flags [P.], seq 220928:225050, ack 867, win 65535, length 4122
19:29:13.153988 IP 10.0.2.15.38014 > 151.101.117.67.443: Flags [.], ack 220928, win 65535, length 0
19:29:13.154100 IP 10.0.2.15.38014 > 151.101.117.67.443: Flags [.], ack 225050, win 65535, length 0
19:29:13.154130 IP 151.101.117.67.443 > 10.0.2.15.38014: Flags [P.], seq 225050:227798, ack 867, win 65535, length 2748
19:29:13.154131 IP 151.101.117.67.443 > 10.0.2.15.38014: Flags [P.], seq 227798:231920, ack 867, win 65535, length 4122
19:29:13.154136 IP 10.0.2.15.38014 > 151.101.117.67.443: Flags [.], ack 227798, win 65535, length 0
19:29:13.154144 IP 10.0.2.15.38014 > 151.101.117.67.443: Flags [.], ack 231920, win 65535, length 0
19:29:13.156093 IP 151.101.117.67.443 > 10.0.2.15.38014: Flags [P.], seq 231920:240164, ack 867, win 65535, length 8244
19:29:13.156096 IP 151.101.117.67.443 > 10.0.2.15.38014: Flags [P.], seq 240164:242912, ack 867, win 65535, length 2748
19:29:13.156124 IP 10.0.2.15.38014 > 151.101.117.67.443: Flags [.], ack 240164, win 65535, length 0
19:29:13.156663 IP 10.0.2.15.38014 > 151.101.117.67.443: Flags [.], ack 242912, win 65535, length 0
19:29:13.156751 IP 151.101.117.67.443 > 10.0.2.15.38014: Flags [P.], seq 242912:245660, ack 867, win 65535, length 2748
19:29:13.156753 IP 151.101.117.67.443 > 10.0.2.15.38014: Flags [P.], seq 245660:249782, ack 867, win 65535, length 4122
19:29:13.156754 IP 151.101.117.67.443 > 10.0.2.15.38014: Flags [P.], seq 249782:252530, ack 867, win 65535, length 2748
19:29:13.156755 IP 151.101.117.67.443 > 10.0.2.15.38014: Flags [P.], seq 252530:258026, ack 867, win 65535, length 5496
19:29:13.156766 IP 10.0.2.15.38014 > 151.101.117.67.443: Flags [.], ack 245660, win 65535, length 0
19:29:13.156782 IP 10.0.2.15.38014 > 151.101.117.67.443: Flags [.], ack 249782, win 65535, length 0
19:29:13.156816 IP 10.0.2.15.38014 > 151.101.117.67.443: Flags [.], ack 252530, win 65535, length 0
19:29:13.156828 IP 10.0.2.15.38014 > 151.101.117.67.443: Flags [.], ack 258026, win 65535, length 0
19:29:13.156846 IP 151.101.117.67.443 > 10.0.2.15.38014: Flags [P.], seq 258026:259400, ack 867, win 65535, length 1374
19:29:13.158465 IP 151.101.117.67.443 > 10.0.2.15.38014: Flags [P.], seq 259400:270392, ack 867, win 65535, length 10992
19:29:13.158541 IP 10.0.2.15.38014 > 151.101.117.67.443: Flags [.], ack 270392, win 65535, length 0
19:29:13.158593 IP 151.101.117.67.443 > 10.0.2.15.38014: Flags [P.], seq 270392:275888, ack 867, win 65535, length 5496
19:29:13.158603 IP 10.0.2.15.38014 > 151.101.117.67.443: Flags [.], ack 275888, win 65535, length 0
19:29:13.158728 IP 151.101.117.67.443 > 10.0.2.15.38014: Flags [P.], seq 275888:282758, ack 867, win 65535, length 6870
19:29:13.158736 IP 10.0.2.15.38014 > 151.101.117.67.443: Flags [.], ack 282758, win 65535, length 0
19:29:13.159286 IP 151.101.117.67.443 > 10.0.2.15.38014: Flags [P.], seq 282758:286880, ack 867, win 65535, length 4122
19:29:13.159288 IP 151.101.117.67.443 > 10.0.2.15.38014: Flags [P.], seq 286880:288254, ack 867, win 65535, length 1374
19:29:13.159289 IP 151.101.117.67.443 > 10.0.2.15.38014: Flags [P.], seq 288254:292376, ack 867, win 65535, length 4122
19:29:13.159304 IP 10.0.2.15.38014 > 151.101.117.67.443: Flags [.], ack 286880, win 65535, length 0
19:29:13.159332 IP 10.0.2.15.38014 > 151.101.117.67.443: Flags [.], ack 292376, win 65535, length 0
19:29:13.159959 IP 151.101.117.67.443 > 10.0.2.15.38014: Flags [P.], seq 292376:299246, ack 867, win 65535, length 6870
19:29:13.159970 IP 10.0.2.15.38014 > 151.101.117.67.443: Flags [.], ack 299246, win 65535, length 0
19:29:13.160866 IP 151.101.117.67.443 > 10.0.2.15.38014: Flags [P.], seq 299246:307490, ack 867, win 65535, length 8244
19:29:13.160896 IP 10.0.2.15.38014 > 151.101.117.67.443: Flags [.], ack 307490, win 65535, length 0
19:29:13.161125 IP 151.101.117.67.443 > 10.0.2.15.38014: Flags [P.], seq 307490:310238, ack 867, win 65535, length 2748
19:29:13.161128 IP 151.101.117.67.443 > 10.0.2.15.38014: Flags [P.], seq 310238:314360, ack 867, win 65535, length 4122
19:29:13.161129 IP 151.101.117.67.443 > 10.0.2.15.38014: Flags [P.], seq 314360:315734, ack 867, win 65535, length 1374
19:29:13.161140 IP 10.0.2.15.38014 > 151.101.117.67.443: Flags [.], ack 310238, win 65535, length 0
19:29:13.161156 IP 10.0.2.15.38014 > 151.101.117.67.443: Flags [.], ack 314360, win 65535, length 0
19:29:13.161429 IP 151.101.117.67.443 > 10.0.2.15.38014: Flags [P.], seq 315734:321230, ack 867, win 65535, length 5496
19:29:13.161431 IP 151.101.117.67.443 > 10.0.2.15.38014: Flags [P.], seq 321230:325352, ack 867, win 65535, length 4122
19:29:13.161432 IP 151.101.117.67.443 > 10.0.2.15.38014: Flags [P.], seq 325352:326726, ack 867, win 65535, length 1374
19:29:13.161449 IP 10.0.2.15.38014 > 151.101.117.67.443: Flags [.], ack 321230, win 65535, length 0
19:29:13.161537 IP 10.0.2.15.38014 > 151.101.117.67.443: Flags [.], ack 325352, win 65535, length 0
19:29:13.161712 IP 151.101.117.67.443 > 10.0.2.15.38014: Flags [P.], seq 326726:328100, ack 867, win 65535, length 1374
19:29:13.161721 IP 10.0.2.15.38014 > 151.101.117.67.443: Flags [.], ack 328100, win 65535, length 0
19:29:13.162322 IP 151.101.117.67.443 > 10.0.2.15.38014: Flags [P.], seq 328100:333596, ack 867, win 65535, length 5496
19:29:13.162324 IP 151.101.117.67.443 > 10.0.2.15.38014: Flags [.], seq 333596:335056, ack 867, win 65535, length 1460
19:29:13.162348 IP 10.0.2.15.38014 > 151.101.117.67.443: Flags [.], ack 333596, win 65535, length 0
19:29:13.162608 IP 151.101.117.67.443 > 10.0.2.15.38014: Flags [P.], seq 335056:336344, ack 867, win 65535, length 1288
19:29:13.162610 IP 151.101.117.67.443 > 10.0.2.15.38014: Flags [P.], seq 336344:340466, ack 867, win 65535, length 4122
19:29:13.162611 IP 151.101.117.67.443 > 10.0.2.15.38014: Flags [P.], seq 340466:343214, ack 867, win 65535, length 2748
19:29:13.162684 IP 10.0.2.15.38014 > 151.101.117.67.443: Flags [.], ack 336344, win 65535, length 0
19:29:13.162701 IP 10.0.2.15.38014 > 151.101.117.67.443: Flags [.], ack 340466, win 65535, length 0
19:29:13.162714 IP 10.0.2.15.38014 > 151.101.117.67.443: Flags [.], ack 343214, win 65535, length 0
19:29:13.162797 IP 151.101.117.67.443 > 10.0.2.15.38014: Flags [P.], seq 343214:344588, ack 867, win 65535, length 1374
19:29:13.163627 IP 151.101.117.67.443 > 10.0.2.15.38014: Flags [P.], seq 344588:350084, ack 867, win 65535, length 5496
19:29:13.163629 IP 151.101.117.67.443 > 10.0.2.15.38014: Flags [P.], seq 350084:354206, ack 867, win 65535, length 4122
19:29:13.163698 IP 10.0.2.15.38014 > 151.101.117.67.443: Flags [.], ack 350084, win 65535, length 0
19:29:13.163729 IP 10.0.2.15.38014 > 151.101.117.67.443: Flags [.], ack 354206, win 65535, length 0
19:29:13.163972 IP 151.101.117.67.443 > 10.0.2.15.38014: Flags [P.], seq 354206:355580, ack 867, win 65535, length 1374
19:29:13.163974 IP 151.101.117.67.443 > 10.0.2.15.38014: Flags [P.], seq 355580:358328, ack 867, win 65535, length 2748
19:29:13.163974 IP 151.101.117.67.443 > 10.0.2.15.38014: Flags [P.], seq 358328:361076, ack 867, win 65535, length 2748
19:29:13.163988 IP 10.0.2.15.38014 > 151.101.117.67.443: Flags [.], ack 358328, win 65535, length 0
19:29:13.164054 IP 10.0.2.15.38014 > 151.101.117.67.443: Flags [.], ack 361076, win 65535, length 0
19:29:13.164208 IP 151.101.117.67.443 > 10.0.2.15.38014: Flags [P.], seq 361076:363824, ack 867, win 65535, length 2748
19:29:13.164210 IP 151.101.117.67.443 > 10.0.2.15.38014: Flags [P.], seq 363824:366572, ack 867, win 65535, length 2748
19:29:13.164220 IP 10.0.2.15.38014 > 151.101.117.67.443: Flags [.], ack 363824, win 65535, length 0
19:29:13.164411 IP 10.0.2.15.38014 > 151.101.117.67.443: Flags [.], ack 366572, win 65535, length 0
19:29:13.164853 IP 151.101.117.67.443 > 10.0.2.15.38014: Flags [P.], seq 366572:369320, ack 867, win 65535, length 2748
19:29:13.164855 IP 151.101.117.67.443 > 10.0.2.15.38014: Flags [P.], seq 369320:372068, ack 867, win 65535, length 2748
19:29:13.164855 IP 151.101.117.67.443 > 10.0.2.15.38014: Flags [P.], seq 372068:373442, ack 867, win 65535, length 1374
19:29:13.164867 IP 10.0.2.15.38014 > 151.101.117.67.443: Flags [.], ack 369320, win 65535, length 0
19:29:13.164885 IP 10.0.2.15.38014 > 151.101.117.67.443: Flags [.], ack 372068, win 65535, length 0
19:29:13.165414 IP 151.101.117.67.443 > 10.0.2.15.38014: Flags [P.], seq 373442:378938, ack 867, win 65535, length 5496
19:29:13.165416 IP 151.101.117.67.443 > 10.0.2.15.38014: Flags [P.], seq 378938:381686, ack 867, win 65535, length 2748
19:29:13.165428 IP 10.0.2.15.38014 > 151.101.117.67.443: Flags [.], ack 378938, win 65535, length 0
19:29:13.165483 IP 10.0.2.15.38014 > 151.101.117.67.443: Flags [.], ack 381686, win 65535, length 0
19:29:13.165747 IP 151.101.117.67.443 > 10.0.2.15.38014: Flags [P.], seq 381686:385808, ack 867, win 65535, length 4122
19:29:13.165749 IP 151.101.117.67.443 > 10.0.2.15.38014: Flags [P.], seq 385808:388556, ack 867, win 65535, length 2748
19:29:13.165759 IP 10.0.2.15.38014 > 151.101.117.67.443: Flags [.], ack 385808, win 65535, length 0
19:29:13.165774 IP 10.0.2.15.38014 > 151.101.117.67.443: Flags [.], ack 388556, win 65535, length 0
19:29:13.165842 IP 151.101.117.67.443 > 10.0.2.15.38014: Flags [P.], seq 388556:389930, ack 867, win 65535, length 1374
19:29:13.168034 IP 151.101.117.67.443 > 10.0.2.15.38014: Flags [P.], seq 389930:395426, ack 867, win 65535, length 5496
19:29:13.168038 IP 151.101.117.67.443 > 10.0.2.15.38014: Flags [P.], seq 395426:400922, ack 867, win 65535, length 5496
19:29:13.168066 IP 10.0.2.15.38014 > 151.101.117.67.443: Flags [.], ack 395426, win 65535, length 0
19:29:13.168169 IP 10.0.2.15.38014 > 151.101.117.67.443: Flags [.], ack 400922, win 65535, length 0
19:29:13.168391 IP 151.101.117.67.443 > 10.0.2.15.38014: Flags [P.], seq 400922:405044, ack 867, win 65535, length 4122
19:29:13.168392 IP 151.101.117.67.443 > 10.0.2.15.38014: Flags [P.], seq 405044:406418, ack 867, win 65535, length 1374
19:29:13.168393 IP 151.101.117.67.443 > 10.0.2.15.38014: Flags [P.], seq 406418:410540, ack 867, win 65535, length 4122
19:29:13.168404 IP 10.0.2.15.38014 > 151.101.117.67.443: Flags [.], ack 405044, win 65535, length 0
19:29:13.168558 IP 10.0.2.15.38014 > 151.101.117.67.443: Flags [.], ack 410540, win 65535, length 0
19:29:13.169070 IP 151.101.117.67.443 > 10.0.2.15.38014: Flags [P.], seq 410540:416036, ack 867, win 65535, length 5496
19:29:13.169073 IP 151.101.117.67.443 > 10.0.2.15.38014: Flags [P.], seq 416036:421532, ack 867, win 65535, length 5496
19:29:13.169088 IP 10.0.2.15.38014 > 151.101.117.67.443: Flags [.], ack 416036, win 65535, length 0
19:29:13.169114 IP 10.0.2.15.38014 > 151.101.117.67.443: Flags [.], ack 421532, win 65535, length 0
19:29:13.169154 IP 151.101.117.67.443 > 10.0.2.15.38014: Flags [P.], seq 421532:428402, ack 867, win 65535, length 6870
19:29:13.169156 IP 151.101.117.67.443 > 10.0.2.15.38014: Flags [P.], seq 428402:429776, ack 867, win 65535, length 1374
19:29:13.169163 IP 10.0.2.15.38014 > 151.101.117.67.443: Flags [.], ack 428402, win 65535, length 0
19:29:13.169985 IP 151.101.117.67.443 > 10.0.2.15.38014: Flags [P.], seq 429776:433898, ack 867, win 65535, length 4122
19:29:13.169987 IP 151.101.117.67.443 > 10.0.2.15.38014: Flags [P.], seq 433898:438020, ack 867, win 65535, length 4122
19:29:13.169988 IP 151.101.117.67.443 > 10.0.2.15.38014: Flags [P.], seq 438020:439394, ack 867, win 65535, length 1374
19:29:13.170146 IP 10.0.2.15.38014 > 151.101.117.67.443: Flags [.], ack 433898, win 65535, length 0
19:29:13.170177 IP 10.0.2.15.38014 > 151.101.117.67.443: Flags [.], ack 438020, win 65535, length 0
19:29:13.170424 IP 151.101.117.67.443 > 10.0.2.15.38014: Flags [P.], seq 439394:443516, ack 867, win 65535, length 4122
19:29:13.170425 IP 151.101.117.67.443 > 10.0.2.15.38014: Flags [P.], seq 443516:444890, ack 867, win 65535, length 1374
19:29:13.170434 IP 10.0.2.15.38014 > 151.101.117.67.443: Flags [.], ack 443516, win 65535, length 0
19:29:13.171364 IP 151.101.117.67.443 > 10.0.2.15.38014: Flags [P.], seq 444890:451760, ack 867, win 65535, length 6870
19:29:13.171383 IP 10.0.2.15.38014 > 151.101.117.67.443: Flags [.], ack 451760, win 65535, length 0
19:29:13.172155 IP 151.101.117.67.443 > 10.0.2.15.38014: Flags [P.], seq 451760:458630, ack 867, win 65535, length 6870
19:29:13.172158 IP 151.101.117.67.443 > 10.0.2.15.38014: Flags [P.], seq 458630:462752, ack 867, win 65535, length 4122
19:29:13.172180 IP 10.0.2.15.38014 > 151.101.117.67.443: Flags [.], ack 458630, win 65535, length 0
19:29:13.172311 IP 10.0.2.15.38014 > 151.101.117.67.443: Flags [.], ack 462752, win 65535, length 0
19:29:13.172930 IP 151.101.117.67.443 > 10.0.2.15.38014: Flags [P.], seq 462752:464126, ack 867, win 65535, length 1374
19:29:13.172932 IP 151.101.117.67.443 > 10.0.2.15.38014: Flags [P.], seq 464126:468248, ack 867, win 65535, length 4122
19:29:13.172933 IP 151.101.117.67.443 > 10.0.2.15.38014: Flags [P.], seq 468248:470996, ack 867, win 65535, length 2748
19:29:13.172979 IP 151.101.117.67.443 > 10.0.2.15.38014: Flags [P.], seq 470996:475118, ack 867, win 65535, length 4122
19:29:13.172999 IP 10.0.2.15.38014 > 151.101.117.67.443: Flags [.], ack 468248, win 65535, length 0
19:29:13.173069 IP 10.0.2.15.38014 > 151.101.117.67.443: Flags [.], ack 470996, win 65535, length 0
19:29:13.173246 IP 10.0.2.15.38014 > 151.101.117.67.443: Flags [.], ack 475118, win 65535, length 0
19:29:13.173277 IP 151.101.117.67.443 > 10.0.2.15.38014: Flags [P.], seq 475118:479240, ack 867, win 65535, length 4122
19:29:13.173279 IP 151.101.117.67.443 > 10.0.2.15.38014: Flags [P.], seq 479240:483362, ack 867, win 65535, length 4122
19:29:13.173280 IP 151.101.117.67.443 > 10.0.2.15.38014: Flags [P.], seq 483362:484736, ack 867, win 65535, length 1374
19:29:13.173281 IP 151.101.117.67.443 > 10.0.2.15.38014: Flags [P.], seq 484736:490232, ack 867, win 65535, length 5496
19:29:13.173289 IP 10.0.2.15.38014 > 151.101.117.67.443: Flags [.], ack 479240, win 65535, length 0
19:29:13.173386 IP 10.0.2.15.38014 > 151.101.117.67.443: Flags [.], ack 483362, win 65535, length 0
19:29:13.173409 IP 10.0.2.15.38014 > 151.101.117.67.443: Flags [.], ack 490232, win 65535, length 0
19:29:13.173438 IP 151.101.117.67.443 > 10.0.2.15.38014: Flags [P.], seq 490232:492980, ack 867, win 65535, length 2748
19:29:13.173439 IP 151.101.117.67.443 > 10.0.2.15.38014: Flags [P.], seq 492980:495728, ack 867, win 65535, length 2748
19:29:13.173446 IP 10.0.2.15.38014 > 151.101.117.67.443: Flags [.], ack 492980, win 65535, length 0
19:29:13.173459 IP 10.0.2.15.38014 > 151.101.117.67.443: Flags [.], ack 495728, win 65535, length 0
19:29:13.174599 IP 151.101.117.67.443 > 10.0.2.15.38014: Flags [P.], seq 495728:499850, ack 867, win 65535, length 4122
19:29:13.174601 IP 151.101.117.67.443 > 10.0.2.15.38014: Flags [P.], seq 499850:502598, ack 867, win 65535, length 2748
19:29:13.174602 IP 151.101.117.67.443 > 10.0.2.15.38014: Flags [P.], seq 502598:505346, ack 867, win 65535, length 2748
19:29:13.174602 IP 151.101.117.67.443 > 10.0.2.15.38014: Flags [P.], seq 505346:508094, ack 867, win 65535, length 2748
19:29:13.174616 IP 10.0.2.15.38014 > 151.101.117.67.443: Flags [.], ack 499850, win 65535, length 0
19:29:13.174639 IP 10.0.2.15.38014 > 151.101.117.67.443: Flags [.], ack 502598, win 65535, length 0
19:29:13.174700 IP 10.0.2.15.38014 > 151.101.117.67.443: Flags [.], ack 505346, win 65535, length 0
19:29:13.174720 IP 10.0.2.15.38014 > 151.101.117.67.443: Flags [.], ack 508094, win 65535, length 0
19:29:13.174753 IP 151.101.117.67.443 > 10.0.2.15.38014: Flags [P.], seq 508094:513590, ack 867, win 65535, length 5496
19:29:13.174765 IP 151.101.117.67.443 > 10.0.2.15.38014: Flags [P.], seq 513590:517712, ack 867, win 65535, length 4122
19:29:13.174767 IP 151.101.117.67.443 > 10.0.2.15.38014: Flags [P.], seq 517712:521834, ack 867, win 65535, length 4122
19:29:13.174775 IP 10.0.2.15.38014 > 151.101.117.67.443: Flags [.], ack 513590, win 65535, length 0
19:29:13.174835 IP 10.0.2.15.38014 > 151.101.117.67.443: Flags [.], ack 517712, win 65535, length 0
19:29:13.174848 IP 10.0.2.15.38014 > 151.101.117.67.443: Flags [.], ack 521834, win 65535, length 0
19:29:13.174862 IP 151.101.117.67.443 > 10.0.2.15.38014: Flags [P.], seq 521834:523208, ack 867, win 65535, length 1374
19:29:13.174863 IP 151.101.117.67.443 > 10.0.2.15.38014: Flags [P.], seq 523208:524582, ack 867, win 65535, length 1374
19:29:13.174868 IP 10.0.2.15.38014 > 151.101.117.67.443: Flags [.], ack 524582, win 65535, length 0
19:29:13.175599 IP 151.101.117.67.443 > 10.0.2.15.38014: Flags [P.], seq 524582:530078, ack 867, win 65535, length 5496
19:29:13.175616 IP 10.0.2.15.38014 > 151.101.117.67.443: Flags [.], ack 530078, win 65535, length 0
19:29:13.175835 IP 151.101.117.67.443 > 10.0.2.15.38014: Flags [P.], seq 530078:532826, ack 867, win 65535, length 2748
19:29:13.175836 IP 151.101.117.67.443 > 10.0.2.15.38014: Flags [P.], seq 532826:535574, ack 867, win 65535, length 2748
19:29:13.175848 IP 10.0.2.15.38014 > 151.101.117.67.443: Flags [.], ack 532826, win 65535, length 0
19:29:13.175942 IP 10.0.2.15.38014 > 151.101.117.67.443: Flags [.], ack 535574, win 65535, length 0
19:29:13.176105 IP 151.101.117.67.443 > 10.0.2.15.38014: Flags [P.], seq 535574:539696, ack 867, win 65535, length 4122
19:29:13.176107 IP 151.101.117.67.443 > 10.0.2.15.38014: Flags [P.], seq 539696:541070, ack 867, win 65535, length 1374
19:29:13.176116 IP 10.0.2.15.38014 > 151.101.117.67.443: Flags [.], ack 539696, win 65535, length 0
19:29:13.176303 IP 151.101.117.67.443 > 10.0.2.15.38014: Flags [P.], seq 541070:545192, ack 867, win 65535, length 4122
19:29:13.176312 IP 10.0.2.15.38014 > 151.101.117.67.443: Flags [.], ack 545192, win 65535, length 0
19:29:13.176534 IP 151.101.117.67.443 > 10.0.2.15.38014: Flags [P.], seq 545192:549314, ack 867, win 65535, length 4122
19:29:13.176536 IP 151.101.117.67.443 > 10.0.2.15.38014: Flags [P.], seq 549314:550688, ack 867, win 65535, length 1374
19:29:13.176550 IP 10.0.2.15.38014 > 151.101.117.67.443: Flags [.], ack 549314, win 65535, length 0
19:29:13.176897 IP 151.101.117.67.443 > 10.0.2.15.38014: Flags [P.], seq 550688:554810, ack 867, win 65535, length 4122
19:29:13.176898 IP 151.101.117.67.443 > 10.0.2.15.38014: Flags [P.], seq 554810:557558, ack 867, win 65535, length 2748
19:29:13.176908 IP 10.0.2.15.38014 > 151.101.117.67.443: Flags [.], ack 554810, win 65535, length 0
19:29:13.176928 IP 10.0.2.15.38014 > 151.101.117.67.443: Flags [.], ack 557558, win 65535, length 0
19:29:13.177093 IP 151.101.117.67.443 > 10.0.2.15.38014: Flags [P.], seq 557558:563054, ack 867, win 65535, length 5496
19:29:13.177101 IP 10.0.2.15.38014 > 151.101.117.67.443: Flags [.], ack 563054, win 65535, length 0
19:29:13.177208 IP 151.101.117.67.443 > 10.0.2.15.38014: Flags [P.], seq 563054:564428, ack 867, win 65535, length 1374
19:29:13.178082 IP 151.101.117.67.443 > 10.0.2.15.38014: Flags [P.], seq 564428:568550, ack 867, win 65535, length 4122
19:29:13.178084 IP 151.101.117.67.443 > 10.0.2.15.38014: Flags [P.], seq 568550:572672, ack 867, win 65535, length 4122
19:29:13.178135 IP 10.0.2.15.38014 > 151.101.117.67.443: Flags [.], ack 568550, win 65535, length 0
19:29:13.178160 IP 10.0.2.15.38014 > 151.101.117.67.443: Flags [.], ack 572672, win 65535, length 0
19:29:13.179036 IP 151.101.117.67.443 > 10.0.2.15.38014: Flags [P.], seq 572672:578168, ack 867, win 65535, length 5496
19:29:13.179038 IP 151.101.117.67.443 > 10.0.2.15.38014: Flags [P.], seq 578168:582290, ack 867, win 65535, length 4122
19:29:13.179039 IP 151.101.117.67.443 > 10.0.2.15.38014: Flags [P.], seq 582290:583664, ack 867, win 65535, length 1374
19:29:13.179153 IP 151.101.117.67.443 > 10.0.2.15.38014: Flags [P.], seq 583664:590534, ack 867, win 65535, length 6870
19:29:13.179156 IP 151.101.117.67.443 > 10.0.2.15.38014: Flags [P.], seq 590534:593282, ack 867, win 65535, length 2748
19:29:13.179157 IP 151.101.117.67.443 > 10.0.2.15.38014: Flags [P.], seq 593282:596030, ack 867, win 65535, length 2748
19:29:13.179236 IP 151.101.117.67.443 > 10.0.2.15.38014: Flags [P.], seq 596030:601526, ack 867, win 65535, length 5496
19:29:13.179449 IP 151.101.117.67.443 > 10.0.2.15.38014: Flags [P.], seq 601526:604274, ack 867, win 65535, length 2748
19:29:13.179720 IP 10.0.2.15.38014 > 151.101.117.67.443: Flags [.], ack 604274, win 65535, length 0
19:29:13.180459 IP 151.101.117.67.443 > 10.0.2.15.38014: Flags [P.], seq 604274:608396, ack 867, win 65535, length 4122
19:29:13.180462 IP 151.101.117.67.443 > 10.0.2.15.38014: Flags [P.], seq 608396:612518, ack 867, win 65535, length 4122
19:29:13.180525 IP 10.0.2.15.38014 > 151.101.117.67.443: Flags [.], ack 608396, win 65535, length 0
19:29:13.180588 IP 10.0.2.15.38014 > 151.101.117.67.443: Flags [.], ack 612518, win 65535, length 0
19:29:13.180718 IP 151.101.117.67.443 > 10.0.2.15.38014: Flags [P.], seq 612518:615266, ack 867, win 65535, length 2748
19:29:13.180719 IP 151.101.117.67.443 > 10.0.2.15.38014: Flags [P.], seq 615266:616640, ack 867, win 65535, length 1374
19:29:13.180729 IP 10.0.2.15.38014 > 151.101.117.67.443: Flags [.], ack 615266, win 65535, length 0
19:29:13.180953 IP 151.101.117.67.443 > 10.0.2.15.38014: Flags [P.], seq 616640:620762, ack 867, win 65535, length 4122
19:29:13.180955 IP 151.101.117.67.443 > 10.0.2.15.38014: Flags [P.], seq 620762:624884, ack 867, win 65535, length 4122
19:29:13.180962 IP 10.0.2.15.38014 > 151.101.117.67.443: Flags [.], ack 620762, win 65535, length 0
19:29:13.181007 IP 10.0.2.15.38014 > 151.101.117.67.443: Flags [.], ack 624884, win 65535, length 0
19:29:13.181115 IP 151.101.117.67.443 > 10.0.2.15.38014: Flags [P.], seq 624884:627632, ack 867, win 65535, length 2748
19:29:13.181116 IP 151.101.117.67.443 > 10.0.2.15.38014: Flags [P.], seq 627632:630380, ack 867, win 65535, length 2748
19:29:13.181303 IP 151.101.117.67.443 > 10.0.2.15.38014: Flags [P.], seq 630380:633128, ack 867, win 65535, length 2748
19:29:13.181321 IP 10.0.2.15.38014 > 151.101.117.67.443: Flags [.], ack 630380, win 65535, length 0
19:29:13.181485 IP 151.101.117.67.443 > 10.0.2.15.38014: Flags [P.], seq 633128:635876, ack 867, win 65535, length 2748
19:29:13.181662 IP 151.101.117.67.443 > 10.0.2.15.38014: Flags [P.], seq 635876:638624, ack 867, win 65535, length 2748
19:29:13.181720 IP 10.0.2.15.38014 > 151.101.117.67.443: Flags [.], ack 638624, win 65535, length 0
19:29:13.181958 IP 151.101.117.67.443 > 10.0.2.15.38014: Flags [P.], seq 638624:641372, ack 867, win 65535, length 2748
19:29:13.181960 IP 151.101.117.67.443 > 10.0.2.15.38014: Flags [P.], seq 641372:646868, ack 867, win 65535, length 5496
19:29:13.182233 IP 151.101.117.67.443 > 10.0.2.15.38014: Flags [P.], seq 646868:650990, ack 867, win 65535, length 4122
19:29:13.182234 IP 151.101.117.67.443 > 10.0.2.15.38014: Flags [P.], seq 650990:653738, ack 867, win 65535, length 2748
19:29:13.182323 IP 10.0.2.15.38014 > 151.101.117.67.443: Flags [.], ack 653738, win 65535, length 0
19:29:13.182443 IP 151.101.117.67.443 > 10.0.2.15.38014: Flags [P.], seq 653738:656486, ack 867, win 65535, length 2748
19:29:13.182673 IP 151.101.117.67.443 > 10.0.2.15.38014: Flags [P.], seq 656486:660608, ack 867, win 65535, length 4122
19:29:13.182675 IP 151.101.117.67.443 > 10.0.2.15.38014: Flags [P.], seq 660608:663356, ack 867, win 65535, length 2748
19:29:13.182918 IP 151.101.117.67.443 > 10.0.2.15.38014: Flags [P.], seq 663356:664730, ack 867, win 65535, length 1374
19:29:13.183117 IP 151.101.117.67.443 > 10.0.2.15.38014: Flags [P.], seq 664730:668852, ack 867, win 65535, length 4122
19:29:13.183118 IP 151.101.117.67.443 > 10.0.2.15.38014: Flags [P.], seq 668852:672974, ack 867, win 65535, length 4122
19:29:13.183218 IP 151.101.117.67.443 > 10.0.2.15.38014: Flags [P.], seq 672974:675722, ack 867, win 65535, length 2748
19:29:13.183259 IP 10.0.2.15.38014 > 151.101.117.67.443: Flags [.], ack 675722, win 65535, length 0
19:29:13.183345 IP 151.101.117.67.443 > 10.0.2.15.38014: Flags [P.], seq 675722:678470, ack 867, win 65535, length 2748
19:29:13.183397 IP 10.0.2.15.38014 > 151.101.117.67.443: Flags [.], ack 678470, win 65535, length 0
19:29:13.183624 IP 151.101.117.67.443 > 10.0.2.15.38014: Flags [P.], seq 678470:679844, ack 867, win 65535, length 1374
19:29:13.190831 IP 151.101.117.67.443 > 10.0.2.15.38014: Flags [P.], seq 679844:683966, ack 867, win 65535, length 4122
19:29:13.190837 IP 151.101.117.67.443 > 10.0.2.15.38014: Flags [P.], seq 683966:719690, ack 867, win 65535, length 35724
19:29:13.190857 IP 10.0.2.15.38014 > 151.101.117.67.443: Flags [.], ack 683966, win 65535, length 0
19:29:13.191104 IP 10.0.2.15.38014 > 151.101.117.67.443: Flags [.], ack 719690, win 65535, length 0
19:29:13.191380 IP 151.101.117.67.443 > 10.0.2.15.38014: Flags [.], seq 719690:724070, ack 867, win 65535, length 4380
19:29:13.191393 IP 10.0.2.15.38014 > 151.101.117.67.443: Flags [.], ack 724070, win 65535, length 0
19:29:13.192041 IP 151.101.117.67.443 > 10.0.2.15.38014: Flags [P.], seq 724070:785390, ack 867, win 65535, length 61320
19:29:13.192433 IP 10.0.2.15.38014 > 151.101.117.67.443: Flags [.], ack 785390, win 65535, length 0
19:29:13.192738 IP 151.101.117.67.443 > 10.0.2.15.38014: Flags [.], seq 785390:791230, ack 867, win 65535, length 5840
19:29:13.193203 IP 151.101.117.67.443 > 10.0.2.15.38014: Flags [.], seq 791230:820430, ack 867, win 65535, length 29200
19:29:13.193426 IP 151.101.117.67.443 > 10.0.2.15.38014: Flags [.], seq 820430:830650, ack 867, win 65535, length 10220
19:29:13.193717 IP 151.101.117.67.443 > 10.0.2.15.38014: Flags [P.], seq 830650:830984, ack 867, win 65535, length 334
19:29:13.194297 IP 10.0.2.15.38014 > 151.101.117.67.443: Flags [.], ack 830984, win 65535, length 0
19:29:13.194969 IP 151.101.117.67.443 > 10.0.2.15.38014: Flags [P.], seq 830984:869456, ack 867, win 65535, length 38472
19:29:13.196179 IP 10.0.2.15.38014 > 151.101.117.67.443: Flags [.], ack 869456, win 65535, length 0
19:29:13.198099 IP 151.101.117.67.443 > 10.0.2.15.38014: Flags [P.], seq 869456:907928, ack 867, win 65535, length 38472
19:29:13.198514 IP 10.0.2.15.38014 > 151.101.117.67.443: Flags [.], ack 907928, win 65535, length 0
19:29:13.199129 IP 151.101.117.67.443 > 10.0.2.15.38014: Flags [.], seq 907928:938588, ack 867, win 65535, length 30660
19:29:13.199209 IP 10.0.2.15.38014 > 151.101.117.67.443: Flags [.], ack 938588, win 65535, length 0
19:29:13.199335 IP 151.101.117.67.443 > 10.0.2.15.38014: Flags [P.], seq 938588:942764, ack 867, win 65535, length 4176
19:29:13.199379 IP 151.101.117.67.443 > 10.0.2.15.38014: Flags [P.], seq 942764:945512, ack 867, win 65535, length 2748
19:29:13.199403 IP 10.0.2.15.38014 > 151.101.117.67.443: Flags [.], ack 945512, win 65535, length 0
19:29:13.204098 IP 151.101.117.67.443 > 10.0.2.15.38014: Flags [P.], seq 945512:956504, ack 867, win 65535, length 10992
19:29:13.204117 IP 10.0.2.15.38014 > 151.101.117.67.443: Flags [.], ack 956504, win 65535, length 0

