00:11:18.918223 IP 151.101.117.67.443 > 10.0.2.15.37882: Flags [.], seq 65088002:65090922, ack 2079445581, win 65535, length 2920
00:11:18.918247 IP 10.0.2.15.37882 > 151.101.117.67.443: Flags [.], ack 2920, win 62780, length 0
00:11:18.918511 IP 151.101.117.67.443 > 10.0.2.15.37882: Flags [P.], seq 2920:5063, ack 1, win 65535, length 2143
00:11:18.918529 IP 10.0.2.15.37882 > 151.101.117.67.443: Flags [.], ack 5063, win 61320, length 0
00:11:18.919943 IP 10.0.2.15.37882 > 151.101.117.67.443: Flags [P.], seq 1:94, ack 5063, win 62780, length 93
00:11:18.920500 IP 151.101.117.67.443 > 10.0.2.15.37882: Flags [.], ack 94, win 65535, length 0
00:11:18.934412 IP 151.101.117.67.443 > 10.0.2.15.37882: Flags [P.], seq 5063:5114, ack 94, win 65535, length 51
00:11:18.934436 IP 10.0.2.15.37882 > 151.101.117.67.443: Flags [.], ack 5114, win 62780, length 0
00:11:18.934795 IP 10.0.2.15.37882 > 151.101.117.67.443: Flags [P.], seq 94:147, ack 5114, win 62780, length 53
00:11:18.934831 IP 10.0.2.15.37882 > 151.101.117.67.443: Flags [P.], seq 147:203, ack 5114, win 62780, length 56
00:11:18.934957 IP 10.0.2.15.37882 > 151.101.117.67.443: Flags [P.], seq 203:245, ack 5114, win 62780, length 42
00:11:18.935099 IP 10.0.2.15.37882 > 151.101.117.67.443: Flags [P.], seq 245:312, ack 5114, win 62780, length 67
00:11:18.935210 IP 151.101.117.67.443 > 10.0.2.15.37882: Flags [.], ack 147, win 65535, length 0
00:11:18.935212 IP 151.101.117.67.443 > 10.0.2.15.37882: Flags [.], ack 203, win 65535, length 0
00:11:18.935212 IP 151.101.117.67.443 > 10.0.2.15.37882: Flags [.], ack 245, win 65535, length 0
00:11:18.935525 IP 151.101.117.67.443 > 10.0.2.15.37882: Flags [.], ack 312, win 65535, length 0
00:11:18.948577 IP 151.101.117.67.443 > 10.0.2.15.37882: Flags [P.], seq 5114:5209, ack 312, win 65535, length 95
00:11:18.948601 IP 10.0.2.15.37882 > 151.101.117.67.443: Flags [.], ack 5209, win 62780, length 0
00:11:18.948834 IP 10.0.2.15.37882 > 151.101.117.67.443: Flags [P.], seq 312:350, ack 5209, win 62780, length 38
00:11:18.949144 IP 151.101.117.67.443 > 10.0.2.15.37882: Flags [.], ack 350, win 65535, length 0
00:11:18.949620 IP 151.101.117.67.443 > 10.0.2.15.37882: Flags [P.], seq 5209:9331, ack 350, win 65535, length 4122
00:11:18.949622 IP 151.101.117.67.443 > 10.0.2.15.37882: Flags [P.], seq 9331:10705, ack 350, win 65535, length 1374
00:11:18.949708 IP 10.0.2.15.37882 > 151.101.117.67.443: Flags [.], ack 10705, win 61320, length 0
00:11:18.953757 IP 151.101.117.67.443 > 10.0.2.15.37882: Flags [P.], seq 10705:18949, ack 350, win 65535, length 8244
00:11:18.953761 IP 151.101.117.67.443 > 10.0.2.15.37882: Flags [.], seq 18949:20409, ack 350, win 65535, length 1460
00:11:18.953961 IP 10.0.2.15.37882 > 151.101.117.67.443: Flags [.], ack 20409, win 58400, length 0
00:11:18.956268 IP 151.101.117.67.443 > 10.0.2.15.37882: Flags [.], seq 20409:32089, ack 350, win 65535, length 11680
00:11:18.956365 IP 10.0.2.15.37882 > 151.101.117.67.443: Flags [.], ack 32089, win 56940, length 0
00:11:18.956550 IP 151.101.117.67.443 > 10.0.2.15.37882: Flags [P.], seq 32089:32689, ack 350, win 65535, length 600
00:11:18.957586 IP 151.101.117.67.443 > 10.0.2.15.37882: Flags [P.], seq 32689:38185, ack 350, win 65535, length 5496
00:11:18.957613 IP 10.0.2.15.37882 > 151.101.117.67.443: Flags [.], ack 38185, win 61320, length 0
00:11:18.960458 IP 151.101.117.67.443 > 10.0.2.15.37882: Flags [P.], seq 38185:43681, ack 350, win 65535, length 5496
00:11:18.960482 IP 10.0.2.15.37882 > 151.101.117.67.443: Flags [.], ack 43681, win 61320, length 0
00:11:18.962248 IP 151.101.117.67.443 > 10.0.2.15.37882: Flags [P.], seq 43681:46429, ack 350, win 65535, length 2748
00:11:18.962270 IP 10.0.2.15.37882 > 151.101.117.67.443: Flags [.], ack 46429, win 62780, length 0
00:11:18.966978 IP 151.101.117.67.443 > 10.0.2.15.37882: Flags [.], seq 46429:63949, ack 350, win 65535, length 17520
00:11:18.967911 IP 10.0.2.15.37882 > 151.101.117.67.443: Flags [.], ack 63949, win 52560, length 0
00:11:18.973716 IP 151.101.117.67.443 > 10.0.2.15.37882: Flags [P.], seq 63949:80779, ack 350, win 65535, length 16830
00:11:18.973738 IP 10.0.2.15.37882 > 151.101.117.67.443: Flags [.], ack 80779, win 52560, length 0
00:11:18.973903 IP 151.101.117.67.443 > 10.0.2.15.37882: Flags [.], seq 80779:82239, ack 350, win 65535, length 1460
00:11:18.976411 IP 151.101.117.67.443 > 10.0.2.15.37882: Flags [.], seq 82239:101219, ack 350, win 65535, length 18980
00:11:18.976435 IP 10.0.2.15.37882 > 151.101.117.67.443: Flags [.], ack 101219, win 65535, length 0
00:11:18.976794 IP 151.101.117.67.443 > 10.0.2.15.37882: Flags [.], seq 101219:123119, ack 350, win 65535, length 21900
00:11:18.976810 IP 10.0.2.15.37882 > 151.101.117.67.443: Flags [.], ack 123119, win 65535, length 0
00:11:18.977212 IP 151.101.117.67.443 > 10.0.2.15.37882: Flags [.], seq 123119:124579, ack 350, win 65535, length 1460
00:11:18.977456 IP 151.101.117.67.443 > 10.0.2.15.37882: Flags [P.], seq 124579:130243, ack 350, win 65535, length 5664
00:11:18.977471 IP 10.0.2.15.37882 > 151.101.117.67.443: Flags [.], ack 130243, win 65535, length 0
00:11:18.980494 IP 151.101.117.67.443 > 10.0.2.15.37882: Flags [P.], seq 130243:142609, ack 350, win 65535, length 12366
00:11:18.980552 IP 10.0.2.15.37882 > 151.101.117.67.443: Flags [.], ack 142609, win 65535, length 0
00:11:18.980609 IP 151.101.117.67.443 > 10.0.2.15.37882: Flags [P.], seq 142609:150853, ack 350, win 65535, length 8244
00:11:18.980610 IP 151.101.117.67.443 > 10.0.2.15.37882: Flags [P.], seq 150853:153601, ack 350, win 65535, length 2748
00:11:18.980621 IP 10.0.2.15.37882 > 151.101.117.67.443: Flags [.], ack 150853, win 65535, length 0
00:11:18.980772 IP 10.0.2.15.37882 > 151.101.117.67.443: Flags [.], ack 153601, win 65535, length 0
00:11:18.980791 IP 151.101.117.67.443 > 10.0.2.15.37882: Flags [.], seq 153601:155061, ack 350, win 65535, length 1460
00:11:18.981541 IP 151.101.117.67.443 > 10.0.2.15.37882: Flags [P.], seq 155061:156349, ack 350, win 65535, length 1288
00:11:18.981545 IP 151.101.117.67.443 > 10.0.2.15.37882: Flags [P.], seq 156349:161845, ack 350, win 65535, length 5496
00:11:18.981569 IP 10.0.2.15.37882 > 151.101.117.67.443: Flags [.], ack 156349, win 65535, length 0
00:11:18.981607 IP 10.0.2.15.37882 > 151.101.117.67.443: Flags [.], ack 161845, win 65535, length 0
00:11:18.985538 IP 151.101.117.67.443 > 10.0.2.15.37882: Flags [.], seq 161845:193965, ack 350, win 65535, length 32120
00:11:18.985565 IP 10.0.2.15.37882 > 151.101.117.67.443: Flags [.], ack 193965, win 65535, length 0
00:11:18.987063 IP 151.101.117.67.443 > 10.0.2.15.37882: Flags [P.], seq 193965:194821, ack 350, win 65535, length 856
00:11:18.987067 IP 151.101.117.67.443 > 10.0.2.15.37882: Flags [P.], seq 194821:208561, ack 350, win 65535, length 13740
00:11:18.987102 IP 10.0.2.15.37882 > 151.101.117.67.443: Flags [.], ack 208561, win 65535, length 0
00:11:18.991986 IP 151.101.117.67.443 > 10.0.2.15.37882: Flags [P.], seq 208561:238789, ack 350, win 65535, length 30228
00:11:18.992007 IP 10.0.2.15.37882 > 151.101.117.67.443: Flags [.], ack 238789, win 65535, length 0
00:11:18.992402 IP 151.101.117.67.443 > 10.0.2.15.37882: Flags [.], seq 238789:243169, ack 350, win 65535, length 4380
00:11:18.993750 IP 10.0.2.15.37882 > 151.101.117.67.443: Flags [.], ack 243169, win 65535, length 0
00:11:18.996209 IP 151.101.117.67.443 > 10.0.2.15.37882: Flags [P.], seq 243169:245659, ack 350, win 65535, length 2490
00:11:18.996232 IP 151.101.117.67.443 > 10.0.2.15.37882: Flags [.], seq 245659:269019, ack 350, win 65535, length 23360
00:11:18.998145 IP 10.0.2.15.37882 > 151.101.117.67.443: Flags [.], ack 245659, win 65535, length 0
00:11:18.998329 IP 10.0.2.15.37882 > 151.101.117.67.443: Flags [.], ack 269019, win 65535, length 0
00:11:18.998428 IP 151.101.117.67.443 > 10.0.2.15.37882: Flags [P.], seq 269019:269021, ack 350, win 65535, length 2
00:11:19.001235 IP 151.101.117.67.443 > 10.0.2.15.37882: Flags [P.], seq 269021:286883, ack 350, win 65535, length 17862
00:11:19.001265 IP 10.0.2.15.37882 > 151.101.117.67.443: Flags [.], ack 286883, win 65535, length 0
00:11:19.001392 IP 151.101.117.67.443 > 10.0.2.15.37882: Flags [P.], seq 286883:297875, ack 350, win 65535, length 10992
00:11:19.001399 IP 10.0.2.15.37882 > 151.101.117.67.443: Flags [.], ack 297875, win 65535, length 0
00:11:19.001413 IP 151.101.117.67.443 > 10.0.2.15.37882: Flags [P.], seq 297875:299249, ack 350, win 65535, length 1374
00:11:19.003862 IP 151.101.117.67.443 > 10.0.2.15.37882: Flags [P.], seq 299249:304745, ack 350, win 65535, length 5496
00:11:19.004059 IP 151.101.117.67.443 > 10.0.2.15.37882: Flags [P.], seq 304745:310241, ack 350, win 65535, length 5496
00:11:19.004665 IP 10.0.2.15.37882 > 151.101.117.67.443: Flags [.], ack 304745, win 65535, length 0
00:11:19.004750 IP 10.0.2.15.37882 > 151.101.117.67.443: Flags [.], ack 310241, win 65535, length 0
00:11:19.004981 IP 151.101.117.67.443 > 10.0.2.15.37882: Flags [P.], seq 310241:315737, ack 350, win 65535, length 5496
00:11:19.004988 IP 151.101.117.67.443 > 10.0.2.15.37882: Flags [P.], seq 315737:319859, ack 350, win 65535, length 4122
00:11:19.004991 IP 151.101.117.67.443 > 10.0.2.15.37882: Flags [P.], seq 319859:325355, ack 350, win 65535, length 5496
00:11:19.005587 IP 10.0.2.15.37882 > 151.101.117.67.443: Flags [.], ack 315737, win 65535, length 0
00:11:19.005684 IP 10.0.2.15.37882 > 151.101.117.67.443: Flags [.], ack 319859, win 65535, length 0
00:11:19.005701 IP 10.0.2.15.37882 > 151.101.117.67.443: Flags [.], ack 325355, win 65535, length 0
00:11:19.007129 IP 151.101.117.67.443 > 10.0.2.15.37882: Flags [P.], seq 325355:334973, ack 350, win 65535, length 9618
00:11:19.007172 IP 10.0.2.15.37882 > 151.101.117.67.443: Flags [.], ack 334973, win 65535, length 0
00:11:19.012666 IP 151.101.117.67.443 > 10.0.2.15.37882: Flags [P.], seq 334973:380315, ack 350, win 65535, length 45342
00:11:19.012691 IP 10.0.2.15.37882 > 151.101.117.67.443: Flags [.], ack 380315, win 65535, length 0
00:11:19.015563 IP 151.101.117.67.443 > 10.0.2.15.37882: Flags [P.], seq 380315:431153, ack 350, win 65535, length 50838
00:11:19.015589 IP 10.0.2.15.37882 > 151.101.117.67.443: Flags [.], ack 431153, win 65535, length 0
00:11:19.018601 IP 151.101.117.67.443 > 10.0.2.15.37882: Flags [.], seq 431153:432613, ack 350, win 65535, length 1460
00:11:19.022144 IP 151.101.117.67.443 > 10.0.2.15.37882: Flags [P.], seq 432613:473747, ack 350, win 65535, length 41134
00:11:19.022180 IP 10.0.2.15.37882 > 151.101.117.67.443: Flags [.], ack 473747, win 65535, length 0
00:11:19.048489 IP 151.101.117.67.443 > 10.0.2.15.37882: Flags [.], seq 473747:516087, ack 350, win 65535, length 42340
00:11:19.048744 IP 10.0.2.15.37882 > 151.101.117.67.443: Flags [.], ack 516087, win 65535, length 0
00:11:19.049704 IP 151.101.117.67.443 > 10.0.2.15.37882: Flags [P.], seq 516087:539447, ack 350, win 65535, length 23360
00:11:19.049785 IP 10.0.2.15.37882 > 151.101.117.67.443: Flags [.], ack 539447, win 65535, length 0
00:11:19.050062 IP 151.101.117.67.443 > 10.0.2.15.37882: Flags [.], seq 539447:574487, ack 350, win 65535, length 35040
00:11:19.050077 IP 10.0.2.15.37882 > 151.101.117.67.443: Flags [.], ack 574487, win 65535, length 0
00:11:19.050789 IP 151.101.117.67.443 > 10.0.2.15.37882: Flags [P.], seq 574487:581787, ack 350, win 65535, length 7300
00:11:19.050796 IP 151.101.117.67.443 > 10.0.2.15.37882: Flags [.], seq 581787:606607, ack 350, win 65535, length 24820
00:11:19.050825 IP 10.0.2.15.37882 > 151.101.117.67.443: Flags [.], ack 581787, win 65535, length 0
00:11:19.050849 IP 10.0.2.15.37882 > 151.101.117.67.443: Flags [.], ack 606607, win 65535, length 0
00:11:19.051088 IP 151.101.117.67.443 > 10.0.2.15.37882: Flags [.], seq 606607:635807, ack 350, win 65535, length 29200
00:11:19.051551 IP 151.101.117.67.443 > 10.0.2.15.37882: Flags [P.], seq 635807:640187, ack 350, win 65535, length 4380
00:11:19.051916 IP 10.0.2.15.37882 > 151.101.117.67.443: Flags [.], ack 640187, win 65535, length 0
00:11:19.052605 IP 151.101.117.67.443 > 10.0.2.15.37882: Flags [.], seq 640187:669387, ack 350, win 65535, length 29200
00:11:19.052625 IP 10.0.2.15.37882 > 151.101.117.67.443: Flags [.], ack 669387, win 65535, length 0
00:11:19.053519 IP 151.101.117.67.443 > 10.0.2.15.37882: Flags [P.], seq 669387:705887, ack 350, win 65535, length 36500
00:11:19.053617 IP 10.0.2.15.37882 > 151.101.117.67.443: Flags [.], ack 705887, win 65535, length 0
00:11:19.054410 IP 151.101.117.67.443 > 10.0.2.15.37882: Flags [.], seq 705887:721947, ack 350, win 65535, length 16060
00:11:19.054438 IP 10.0.2.15.37882 > 151.101.117.67.443: Flags [.], ack 721947, win 65535, length 0
00:11:19.054835 IP 151.101.117.67.443 > 10.0.2.15.37882: Flags [.], seq 721947:770127, ack 350, win 65535, length 48180
00:11:19.055355 IP 10.0.2.15.37882 > 151.101.117.67.443: Flags [.], ack 770127, win 65535, length 0
00:11:19.056960 IP 151.101.117.67.443 > 10.0.2.15.37882: Flags [P.], seq 770127:771587, ack 350, win 65535, length 1460
00:11:19.056967 IP 151.101.117.67.443 > 10.0.2.15.37882: Flags [.], seq 771587:790567, ack 350, win 65535, length 18980
00:11:19.056997 IP 10.0.2.15.37882 > 151.101.117.67.443: Flags [.], ack 790567, win 65535, length 0
00:11:19.057718 IP 151.101.117.67.443 > 10.0.2.15.37882: Flags [.], seq 790567:834367, ack 350, win 65535, length 43800
00:11:19.057932 IP 151.101.117.67.443 > 10.0.2.15.37882: Flags [P.], seq 834367:835827, ack 350, win 65535, length 1460
00:11:19.058401 IP 10.0.2.15.37882 > 151.101.117.67.443: Flags [.], ack 835827, win 65535, length 0
00:11:19.059692 IP 151.101.117.67.443 > 10.0.2.15.37882: Flags [.], seq 835827:837287, ack 350, win 65535, length 1460
00:11:19.064828 IP 151.101.117.67.443 > 10.0.2.15.37882: Flags [.], seq 837287:900067, ack 350, win 65535, length 62780
00:11:19.064862 IP 10.0.2.15.37882 > 151.101.117.67.443: Flags [.], ack 900067, win 65535, length 0
00:11:19.069133 IP 151.101.117.67.443 > 10.0.2.15.37882: Flags [P.], seq 900067:901527, ack 350, win 65535, length 1460
00:11:19.069144 IP 151.101.117.67.443 > 10.0.2.15.37882: Flags [.], seq 901527:945327, ack 350, win 65535, length 43800
00:11:19.069181 IP 10.0.2.15.37882 > 151.101.117.67.443: Flags [.], ack 945327, win 65535, length 0
00:11:19.069453 IP 151.101.117.67.443 > 10.0.2.15.37882: Flags [P.], seq 945327:965767, ack 350, win 65535, length 20440
00:11:19.069467 IP 10.0.2.15.37882 > 151.101.117.67.443: Flags [.], ack 965767, win 65535, length 0

