00:11:16.637110 IP 151.101.117.67.443 > 10.0.2.15.37872: Flags [.], seq 64512002:64514922, ack 1099381564, win 65535, length 2920
00:11:16.637139 IP 10.0.2.15.37872 > 151.101.117.67.443: Flags [.], ack 2920, win 62780, length 0
00:11:16.637431 IP 151.101.117.67.443 > 10.0.2.15.37872: Flags [P.], seq 2920:5063, ack 1, win 65535, length 2143
00:11:16.637450 IP 10.0.2.15.37872 > 151.101.117.67.443: Flags [.], ack 5063, win 61320, length 0
00:11:16.638609 IP 10.0.2.15.37872 > 151.101.117.67.443: Flags [P.], seq 1:94, ack 5063, win 62780, length 93
00:11:16.639118 IP 151.101.117.67.443 > 10.0.2.15.37872: Flags [.], ack 94, win 65535, length 0
00:11:16.651993 IP 151.101.117.67.443 > 10.0.2.15.37872: Flags [P.], seq 5063:5114, ack 94, win 65535, length 51
00:11:16.652015 IP 10.0.2.15.37872 > 151.101.117.67.443: Flags [.], ack 5114, win 62780, length 0
00:11:16.652389 IP 10.0.2.15.37872 > 151.101.117.67.443: Flags [P.], seq 94:147, ack 5114, win 62780, length 53
00:11:16.652424 IP 10.0.2.15.37872 > 151.101.117.67.443: Flags [P.], seq 147:203, ack 5114, win 62780, length 56
00:11:16.652567 IP 10.0.2.15.37872 > 151.101.117.67.443: Flags [P.], seq 203:245, ack 5114, win 62780, length 42
00:11:16.652874 IP 151.101.117.67.443 > 10.0.2.15.37872: Flags [.], ack 147, win 65535, length 0
00:11:16.652875 IP 151.101.117.67.443 > 10.0.2.15.37872: Flags [.], ack 203, win 65535, length 0
00:11:16.652876 IP 151.101.117.67.443 > 10.0.2.15.37872: Flags [.], ack 245, win 65535, length 0
00:11:16.652909 IP 10.0.2.15.37872 > 151.101.117.67.443: Flags [P.], seq 245:312, ack 5114, win 62780, length 67
00:11:16.653374 IP 151.101.117.67.443 > 10.0.2.15.37872: Flags [.], ack 312, win 65535, length 0
00:11:16.666174 IP 151.101.117.67.443 > 10.0.2.15.37872: Flags [P.], seq 5114:5209, ack 312, win 65535, length 95
00:11:16.666193 IP 10.0.2.15.37872 > 151.101.117.67.443: Flags [.], ack 5209, win 62780, length 0
00:11:16.666458 IP 10.0.2.15.37872 > 151.101.117.67.443: Flags [P.], seq 312:350, ack 5209, win 62780, length 38
00:11:16.666767 IP 151.101.117.67.443 > 10.0.2.15.37872: Flags [.], ack 350, win 65535, length 0
00:11:16.670308 IP 151.101.117.67.443 > 10.0.2.15.37872: Flags [P.], seq 5209:13453, ack 350, win 65535, length 8244
00:11:16.670433 IP 10.0.2.15.37872 > 151.101.117.67.443: Flags [.], ack 13453, win 58400, length 0
00:11:16.672434 IP 151.101.117.67.443 > 10.0.2.15.37872: Flags [P.], seq 13453:21697, ack 350, win 65535, length 8244
00:11:16.672456 IP 10.0.2.15.37872 > 151.101.117.67.443: Flags [.], ack 21697, win 58400, length 0
00:11:16.674694 IP 151.101.117.67.443 > 10.0.2.15.37872: Flags [P.], seq 21697:29941, ack 350, win 65535, length 8244
00:11:16.674889 IP 10.0.2.15.37872 > 151.101.117.67.443: Flags [.], ack 29941, win 58400, length 0
00:11:16.677224 IP 151.101.117.67.443 > 10.0.2.15.37872: Flags [.], seq 29941:32861, ack 350, win 65535, length 2920
00:11:16.677322 IP 10.0.2.15.37872 > 151.101.117.67.443: Flags [.], ack 32861, win 56940, length 0
00:11:16.679890 IP 151.101.117.67.443 > 10.0.2.15.37872: Flags [P.], seq 32861:43681, ack 350, win 65535, length 10820
00:11:16.679917 IP 10.0.2.15.37872 > 151.101.117.67.443: Flags [.], ack 43681, win 56940, length 0
00:11:16.680078 IP 151.101.117.67.443 > 10.0.2.15.37872: Flags [P.], seq 43681:46429, ack 350, win 65535, length 2748
00:11:16.680180 IP 10.0.2.15.37872 > 151.101.117.67.443: Flags [.], ack 46429, win 55480, length 0
00:11:16.683737 IP 151.101.117.67.443 > 10.0.2.15.37872: Flags [P.], seq 46429:53299, ack 350, win 65535, length 6870
00:11:16.683761 IP 10.0.2.15.37872 > 151.101.117.67.443: Flags [.], ack 53299, win 59860, length 0
00:11:16.684359 IP 151.101.117.67.443 > 10.0.2.15.37872: Flags [P.], seq 53299:54673, ack 350, win 65535, length 1374
00:11:16.685387 IP 151.101.117.67.443 > 10.0.2.15.37872: Flags [.], seq 54673:56133, ack 350, win 65535, length 1460
00:11:16.685832 IP 151.101.117.67.443 > 10.0.2.15.37872: Flags [P.], seq 56133:62917, ack 350, win 65535, length 6784
00:11:16.685892 IP 10.0.2.15.37872 > 151.101.117.67.443: Flags [.], ack 62917, win 58400, length 0
00:11:16.688576 IP 151.101.117.67.443 > 10.0.2.15.37872: Flags [P.], seq 62917:68413, ack 350, win 65535, length 5496
00:11:16.688581 IP 151.101.117.67.443 > 10.0.2.15.37872: Flags [P.], seq 68413:78031, ack 350, win 65535, length 9618
00:11:16.688619 IP 10.0.2.15.37872 > 151.101.117.67.443: Flags [.], ack 68413, win 61320, length 0
00:11:16.689006 IP 151.101.117.67.443 > 10.0.2.15.37872: Flags [P.], seq 78031:79405, ack 350, win 65535, length 1374
00:11:16.690350 IP 10.0.2.15.37872 > 151.101.117.67.443: Flags [.], ack 79405, win 62780, length 0
00:11:16.691181 IP 151.101.117.67.443 > 10.0.2.15.37872: Flags [P.], seq 79405:87649, ack 350, win 65535, length 8244
00:11:16.691513 IP 10.0.2.15.37872 > 151.101.117.67.443: Flags [.], ack 87649, win 65535, length 0
00:11:16.694355 IP 151.101.117.67.443 > 10.0.2.15.37872: Flags [.], seq 87649:112469, ack 350, win 65535, length 24820
00:11:16.694382 IP 10.0.2.15.37872 > 151.101.117.67.443: Flags [.], ack 112469, win 65535, length 0
00:11:16.694712 IP 151.101.117.67.443 > 10.0.2.15.37872: Flags [P.], seq 112469:124747, ack 350, win 65535, length 12278
00:11:16.694722 IP 10.0.2.15.37872 > 151.101.117.67.443: Flags [.], ack 124747, win 65535, length 0
00:11:16.694890 IP 151.101.117.67.443 > 10.0.2.15.37872: Flags [P.], seq 124747:130243, ack 350, win 65535, length 5496
00:11:16.694943 IP 10.0.2.15.37872 > 151.101.117.67.443: Flags [.], ack 130243, win 65535, length 0
00:11:16.698085 IP 151.101.117.67.443 > 10.0.2.15.37872: Flags [P.], seq 130243:139861, ack 350, win 65535, length 9618
00:11:16.698112 IP 10.0.2.15.37872 > 151.101.117.67.443: Flags [.], ack 139861, win 65535, length 0
00:11:16.698431 IP 151.101.117.67.443 > 10.0.2.15.37872: Flags [P.], seq 139861:148105, ack 350, win 65535, length 8244
00:11:16.698445 IP 10.0.2.15.37872 > 151.101.117.67.443: Flags [.], ack 148105, win 65535, length 0
00:11:16.699555 IP 151.101.117.67.443 > 10.0.2.15.37872: Flags [P.], seq 148105:153601, ack 350, win 65535, length 5496
00:11:16.699581 IP 10.0.2.15.37872 > 151.101.117.67.443: Flags [.], ack 153601, win 65535, length 0
00:11:16.699807 IP 151.101.117.67.443 > 10.0.2.15.37872: Flags [P.], seq 153601:157723, ack 350, win 65535, length 4122
00:11:16.699817 IP 10.0.2.15.37872 > 151.101.117.67.443: Flags [.], ack 157723, win 65535, length 0
00:11:16.701304 IP 151.101.117.67.443 > 10.0.2.15.37872: Flags [P.], seq 157723:161845, ack 350, win 65535, length 4122
00:11:16.701362 IP 151.101.117.67.443 > 10.0.2.15.37872: Flags [P.], seq 161845:164593, ack 350, win 65535, length 2748
00:11:16.701388 IP 10.0.2.15.37872 > 151.101.117.67.443: Flags [.], ack 161845, win 65535, length 0
00:11:16.701532 IP 10.0.2.15.37872 > 151.101.117.67.443: Flags [.], ack 164593, win 65535, length 0
00:11:16.701790 IP 151.101.117.67.443 > 10.0.2.15.37872: Flags [P.], seq 164593:167341, ack 350, win 65535, length 2748
00:11:16.701792 IP 151.101.117.67.443 > 10.0.2.15.37872: Flags [P.], seq 167341:170089, ack 350, win 65535, length 2748
00:11:16.701856 IP 10.0.2.15.37872 > 151.101.117.67.443: Flags [.], ack 167341, win 65535, length 0
00:11:16.701896 IP 10.0.2.15.37872 > 151.101.117.67.443: Flags [.], ack 170089, win 65535, length 0
00:11:16.702136 IP 151.101.117.67.443 > 10.0.2.15.37872: Flags [P.], seq 170089:172837, ack 350, win 65535, length 2748
00:11:16.702137 IP 151.101.117.67.443 > 10.0.2.15.37872: Flags [P.], seq 172837:174211, ack 350, win 65535, length 1374
00:11:16.702150 IP 10.0.2.15.37872 > 151.101.117.67.443: Flags [.], ack 172837, win 65535, length 0
00:11:16.702418 IP 151.101.117.67.443 > 10.0.2.15.37872: Flags [P.], seq 174211:179707, ack 350, win 65535, length 5496
00:11:16.702426 IP 10.0.2.15.37872 > 151.101.117.67.443: Flags [.], ack 179707, win 65535, length 0
00:11:16.702792 IP 151.101.117.67.443 > 10.0.2.15.37872: Flags [P.], seq 179707:181081, ack 350, win 65535, length 1374
00:11:16.703933 IP 151.101.117.67.443 > 10.0.2.15.37872: Flags [P.], seq 181081:185203, ack 350, win 65535, length 4122
00:11:16.703961 IP 10.0.2.15.37872 > 151.101.117.67.443: Flags [.], ack 185203, win 65535, length 0
00:11:16.705494 IP 151.101.117.67.443 > 10.0.2.15.37872: Flags [.], seq 185203:188123, ack 350, win 65535, length 2920
00:11:16.705516 IP 10.0.2.15.37872 > 151.101.117.67.443: Flags [.], ack 188123, win 65535, length 0
00:11:16.708279 IP 151.101.117.67.443 > 10.0.2.15.37872: Flags [.], seq 188123:189583, ack 350, win 65535, length 1460
00:11:16.708582 IP 151.101.117.67.443 > 10.0.2.15.37872: Flags [P.], seq 189583:193447, ack 350, win 65535, length 3864
00:11:16.708586 IP 151.101.117.67.443 > 10.0.2.15.37872: Flags [P.], seq 193447:203065, ack 350, win 65535, length 9618
00:11:16.708611 IP 10.0.2.15.37872 > 151.101.117.67.443: Flags [.], ack 193447, win 65535, length 0
00:11:16.708637 IP 10.0.2.15.37872 > 151.101.117.67.443: Flags [.], ack 203065, win 65535, length 0
00:11:16.708668 IP 151.101.117.67.443 > 10.0.2.15.37872: Flags [P.], seq 203065:204439, ack 350, win 65535, length 1374
00:11:16.708672 IP 151.101.117.67.443 > 10.0.2.15.37872: Flags [P.], seq 204439:211309, ack 350, win 65535, length 6870
00:11:16.708672 IP 151.101.117.67.443 > 10.0.2.15.37872: Flags [P.], seq 211309:214057, ack 350, win 65535, length 2748
00:11:16.708681 IP 10.0.2.15.37872 > 151.101.117.67.443: Flags [.], ack 211309, win 65535, length 0
00:11:16.708696 IP 10.0.2.15.37872 > 151.101.117.67.443: Flags [.], ack 214057, win 65535, length 0
00:11:16.708715 IP 151.101.117.67.443 > 10.0.2.15.37872: Flags [P.], seq 214057:216805, ack 350, win 65535, length 2748
00:11:16.708718 IP 151.101.117.67.443 > 10.0.2.15.37872: Flags [P.], seq 216805:227797, ack 350, win 65535, length 10992
00:11:16.708723 IP 10.0.2.15.37872 > 151.101.117.67.443: Flags [.], ack 216805, win 65535, length 0
00:11:16.708735 IP 10.0.2.15.37872 > 151.101.117.67.443: Flags [.], ack 227797, win 65535, length 0
00:11:16.709060 IP 151.101.117.67.443 > 10.0.2.15.37872: Flags [P.], seq 227797:230545, ack 350, win 65535, length 2748
00:11:16.709070 IP 10.0.2.15.37872 > 151.101.117.67.443: Flags [.], ack 230545, win 65535, length 0
00:11:16.710152 IP 151.101.117.67.443 > 10.0.2.15.37872: Flags [P.], seq 230545:234667, ack 350, win 65535, length 4122
00:11:16.710178 IP 10.0.2.15.37872 > 151.101.117.67.443: Flags [.], ack 234667, win 65535, length 0
00:11:16.710558 IP 151.101.117.67.443 > 10.0.2.15.37872: Flags [P.], seq 234667:238789, ack 350, win 65535, length 4122
00:11:16.710561 IP 151.101.117.67.443 > 10.0.2.15.37872: Flags [P.], seq 238789:244285, ack 350, win 65535, length 5496
00:11:16.710578 IP 10.0.2.15.37872 > 151.101.117.67.443: Flags [.], ack 238789, win 65535, length 0
00:11:16.710604 IP 10.0.2.15.37872 > 151.101.117.67.443: Flags [.], ack 244285, win 65535, length 0
00:11:16.710989 IP 151.101.117.67.443 > 10.0.2.15.37872: Flags [P.], seq 244285:245659, ack 350, win 65535, length 1374
00:11:16.711207 IP 151.101.117.67.443 > 10.0.2.15.37872: Flags [P.], seq 245659:249781, ack 350, win 65535, length 4122
00:11:16.711219 IP 10.0.2.15.37872 > 151.101.117.67.443: Flags [.], ack 249781, win 65535, length 0
00:11:16.711805 IP 151.101.117.67.443 > 10.0.2.15.37872: Flags [P.], seq 249781:251155, ack 350, win 65535, length 1374
00:11:16.712035 IP 151.101.117.67.443 > 10.0.2.15.37872: Flags [P.], seq 251155:255277, ack 350, win 65535, length 4122
00:11:16.712050 IP 10.0.2.15.37872 > 151.101.117.67.443: Flags [.], ack 255277, win 65535, length 0
00:11:16.712278 IP 151.101.117.67.443 > 10.0.2.15.37872: Flags [P.], seq 255277:259399, ack 350, win 65535, length 4122
00:11:16.712292 IP 10.0.2.15.37872 > 151.101.117.67.443: Flags [.], ack 259399, win 65535, length 0
00:11:16.712578 IP 151.101.117.67.443 > 10.0.2.15.37872: Flags [P.], seq 259399:262147, ack 350, win 65535, length 2748
00:11:16.712587 IP 10.0.2.15.37872 > 151.101.117.67.443: Flags [.], ack 262147, win 65535, length 0
00:11:16.713175 IP 151.101.117.67.443 > 10.0.2.15.37872: Flags [P.], seq 262147:264895, ack 350, win 65535, length 2748
00:11:16.713190 IP 10.0.2.15.37872 > 151.101.117.67.443: Flags [.], ack 264895, win 65535, length 0
00:11:16.713295 IP 151.101.117.67.443 > 10.0.2.15.37872: Flags [P.], seq 264895:267643, ack 350, win 65535, length 2748
00:11:16.713296 IP 151.101.117.67.443 > 10.0.2.15.37872: Flags [P.], seq 267643:271765, ack 350, win 65535, length 4122
00:11:16.713306 IP 10.0.2.15.37872 > 151.101.117.67.443: Flags [.], ack 267643, win 65535, length 0
00:11:16.713322 IP 10.0.2.15.37872 > 151.101.117.67.443: Flags [.], ack 271765, win 65535, length 0
00:11:16.713552 IP 151.101.117.67.443 > 10.0.2.15.37872: Flags [P.], seq 271765:274513, ack 350, win 65535, length 2748
00:11:16.713564 IP 10.0.2.15.37872 > 151.101.117.67.443: Flags [.], ack 274513, win 65535, length 0
00:11:16.714251 IP 151.101.117.67.443 > 10.0.2.15.37872: Flags [P.], seq 274513:280009, ack 350, win 65535, length 5496
00:11:16.714267 IP 10.0.2.15.37872 > 151.101.117.67.443: Flags [.], ack 280009, win 65535, length 0
00:11:16.715107 IP 151.101.117.67.443 > 10.0.2.15.37872: Flags [P.], seq 280009:284131, ack 350, win 65535, length 4122
00:11:16.715110 IP 151.101.117.67.443 > 10.0.2.15.37872: Flags [P.], seq 284131:289627, ack 350, win 65535, length 5496
00:11:16.715178 IP 10.0.2.15.37872 > 151.101.117.67.443: Flags [.], ack 284131, win 65535, length 0
00:11:16.715241 IP 10.0.2.15.37872 > 151.101.117.67.443: Flags [.], ack 289627, win 65535, length 0
00:11:16.715452 IP 151.101.117.67.443 > 10.0.2.15.37872: Flags [.], seq 289627:292547, ack 350, win 65535, length 2920
00:11:16.715464 IP 10.0.2.15.37872 > 151.101.117.67.443: Flags [.], ack 292547, win 65535, length 0
00:11:16.715574 IP 151.101.117.67.443 > 10.0.2.15.37872: Flags [P.], seq 292547:293749, ack 350, win 65535, length 1202
00:11:16.715897 IP 151.101.117.67.443 > 10.0.2.15.37872: Flags [P.], seq 293749:296497, ack 350, win 65535, length 2748
00:11:16.715962 IP 10.0.2.15.37872 > 151.101.117.67.443: Flags [.], ack 296497, win 65535, length 0
00:11:16.716459 IP 151.101.117.67.443 > 10.0.2.15.37872: Flags [P.], seq 296497:297871, ack 350, win 65535, length 1374
00:11:16.717079 IP 151.101.117.67.443 > 10.0.2.15.37872: Flags [P.], seq 297871:306115, ack 350, win 65535, length 8244
00:11:16.717104 IP 10.0.2.15.37872 > 151.101.117.67.443: Flags [.], ack 306115, win 65535, length 0
00:11:16.717547 IP 151.101.117.67.443 > 10.0.2.15.37872: Flags [.], seq 306115:307575, ack 350, win 65535, length 1460
00:11:16.717791 IP 151.101.117.67.443 > 10.0.2.15.37872: Flags [P.], seq 307575:310237, ack 350, win 65535, length 2662
00:11:16.717794 IP 151.101.117.67.443 > 10.0.2.15.37872: Flags [P.], seq 310237:314359, ack 350, win 65535, length 4122
00:11:16.717795 IP 151.101.117.67.443 > 10.0.2.15.37872: Flags [.], seq 314359:315819, ack 350, win 65535, length 1460
00:11:16.717817 IP 10.0.2.15.37872 > 151.101.117.67.443: Flags [.], ack 310237, win 65535, length 0
00:11:16.717841 IP 10.0.2.15.37872 > 151.101.117.67.443: Flags [.], ack 314359, win 65535, length 0
00:11:16.718218 IP 151.101.117.67.443 > 10.0.2.15.37872: Flags [P.], seq 315819:318481, ack 350, win 65535, length 2662
00:11:16.718233 IP 10.0.2.15.37872 > 151.101.117.67.443: Flags [.], ack 318481, win 65535, length 0
00:11:16.718633 IP 151.101.117.67.443 > 10.0.2.15.37872: Flags [P.], seq 318481:322603, ack 350, win 65535, length 4122
00:11:16.718636 IP 151.101.117.67.443 > 10.0.2.15.37872: Flags [P.], seq 322603:328099, ack 350, win 65535, length 5496
00:11:16.718655 IP 10.0.2.15.37872 > 151.101.117.67.443: Flags [.], ack 322603, win 65535, length 0
00:11:16.718674 IP 10.0.2.15.37872 > 151.101.117.67.443: Flags [.], ack 328099, win 65535, length 0
00:11:16.719233 IP 151.101.117.67.443 > 10.0.2.15.37872: Flags [P.], seq 328099:332221, ack 350, win 65535, length 4122
00:11:16.719277 IP 10.0.2.15.37872 > 151.101.117.67.443: Flags [.], ack 332221, win 65535, length 0
00:11:16.720048 IP 151.101.117.67.443 > 10.0.2.15.37872: Flags [P.], seq 332221:336343, ack 350, win 65535, length 4122
00:11:16.720083 IP 10.0.2.15.37872 > 151.101.117.67.443: Flags [.], ack 336343, win 65535, length 0
00:11:16.720498 IP 151.101.117.67.443 > 10.0.2.15.37872: Flags [P.], seq 336343:344587, ack 350, win 65535, length 8244
00:11:16.720522 IP 10.0.2.15.37872 > 151.101.117.67.443: Flags [.], ack 344587, win 65535, length 0
00:11:16.721475 IP 151.101.117.67.443 > 10.0.2.15.37872: Flags [.], seq 344587:350427, ack 350, win 65535, length 5840
00:11:16.721513 IP 10.0.2.15.37872 > 151.101.117.67.443: Flags [.], ack 350427, win 65535, length 0
00:11:16.721634 IP 151.101.117.67.443 > 10.0.2.15.37872: Flags [P.], seq 350427:352831, ack 350, win 65535, length 2404
00:11:16.721643 IP 10.0.2.15.37872 > 151.101.117.67.443: Flags [.], ack 352831, win 65535, length 0
00:11:16.721866 IP 151.101.117.67.443 > 10.0.2.15.37872: Flags [P.], seq 352831:356953, ack 350, win 65535, length 4122
00:11:16.721879 IP 10.0.2.15.37872 > 151.101.117.67.443: Flags [.], ack 356953, win 65535, length 0
00:11:16.722162 IP 151.101.117.67.443 > 10.0.2.15.37872: Flags [P.], seq 356953:362449, ack 350, win 65535, length 5496
00:11:16.722171 IP 10.0.2.15.37872 > 151.101.117.67.443: Flags [.], ack 362449, win 65535, length 0
00:11:16.723295 IP 151.101.117.67.443 > 10.0.2.15.37872: Flags [P.], seq 362449:366571, ack 350, win 65535, length 4122
00:11:16.723298 IP 151.101.117.67.443 > 10.0.2.15.37872: Flags [P.], seq 366571:369319, ack 350, win 65535, length 2748
00:11:16.723319 IP 10.0.2.15.37872 > 151.101.117.67.443: Flags [.], ack 366571, win 65535, length 0
00:11:16.723386 IP 10.0.2.15.37872 > 151.101.117.67.443: Flags [.], ack 369319, win 65535, length 0
00:11:16.723563 IP 151.101.117.67.443 > 10.0.2.15.37872: Flags [P.], seq 369319:373441, ack 350, win 65535, length 4122
00:11:16.723573 IP 10.0.2.15.37872 > 151.101.117.67.443: Flags [.], ack 373441, win 65535, length 0
00:11:16.723975 IP 151.101.117.67.443 > 10.0.2.15.37872: Flags [P.], seq 373441:376189, ack 350, win 65535, length 2748
00:11:16.724035 IP 10.0.2.15.37872 > 151.101.117.67.443: Flags [.], ack 376189, win 65535, length 0
00:11:16.724307 IP 151.101.117.67.443 > 10.0.2.15.37872: Flags [P.], seq 376189:380311, ack 350, win 65535, length 4122
00:11:16.724365 IP 10.0.2.15.37872 > 151.101.117.67.443: Flags [.], ack 380311, win 65535, length 0
00:11:16.724670 IP 151.101.117.67.443 > 10.0.2.15.37872: Flags [P.], seq 380311:383059, ack 350, win 65535, length 2748
00:11:16.724672 IP 151.101.117.67.443 > 10.0.2.15.37872: Flags [P.], seq 383059:385807, ack 350, win 65535, length 2748
00:11:16.724685 IP 10.0.2.15.37872 > 151.101.117.67.443: Flags [.], ack 383059, win 65535, length 0
00:11:16.724701 IP 10.0.2.15.37872 > 151.101.117.67.443: Flags [.], ack 385807, win 65535, length 0
00:11:16.725876 IP 151.101.117.67.443 > 10.0.2.15.37872: Flags [P.], seq 385807:389929, ack 350, win 65535, length 4122
00:11:16.726007 IP 10.0.2.15.37872 > 151.101.117.67.443: Flags [.], ack 389929, win 65535, length 0
00:11:16.726332 IP 151.101.117.67.443 > 10.0.2.15.37872: Flags [P.], seq 389929:396799, ack 350, win 65535, length 6870
00:11:16.726334 IP 151.101.117.67.443 > 10.0.2.15.37872: Flags [P.], seq 396799:399547, ack 350, win 65535, length 2748
00:11:16.726350 IP 10.0.2.15.37872 > 151.101.117.67.443: Flags [.], ack 396799, win 65535, length 0
00:11:16.726490 IP 10.0.2.15.37872 > 151.101.117.67.443: Flags [.], ack 399547, win 65535, length 0
00:11:16.726797 IP 151.101.117.67.443 > 10.0.2.15.37872: Flags [P.], seq 399547:402295, ack 350, win 65535, length 2748
00:11:16.726992 IP 151.101.117.67.443 > 10.0.2.15.37872: Flags [P.], seq 402295:406417, ack 350, win 65535, length 4122
00:11:16.726994 IP 151.101.117.67.443 > 10.0.2.15.37872: Flags [P.], seq 406417:409165, ack 350, win 65535, length 2748
00:11:16.727032 IP 10.0.2.15.37872 > 151.101.117.67.443: Flags [.], ack 409165, win 65535, length 0
00:11:16.727441 IP 151.101.117.67.443 > 10.0.2.15.37872: Flags [P.], seq 409165:411913, ack 350, win 65535, length 2748
00:11:16.727467 IP 10.0.2.15.37872 > 151.101.117.67.443: Flags [.], ack 411913, win 65535, length 0
00:11:16.727673 IP 151.101.117.67.443 > 10.0.2.15.37872: Flags [P.], seq 411913:414661, ack 350, win 65535, length 2748
00:11:16.727685 IP 10.0.2.15.37872 > 151.101.117.67.443: Flags [.], ack 414661, win 65535, length 0
00:11:16.727779 IP 151.101.117.67.443 > 10.0.2.15.37872: Flags [P.], seq 414661:417409, ack 350, win 65535, length 2748
00:11:16.727785 IP 10.0.2.15.37872 > 151.101.117.67.443: Flags [.], ack 417409, win 65535, length 0
00:11:16.728344 IP 151.101.117.67.443 > 10.0.2.15.37872: Flags [P.], seq 417409:421531, ack 350, win 65535, length 4122
00:11:16.728346 IP 151.101.117.67.443 > 10.0.2.15.37872: Flags [P.], seq 421531:425653, ack 350, win 65535, length 4122
00:11:16.728363 IP 10.0.2.15.37872 > 151.101.117.67.443: Flags [.], ack 421531, win 65535, length 0
00:11:16.728384 IP 10.0.2.15.37872 > 151.101.117.67.443: Flags [.], ack 425653, win 65535, length 0
00:11:16.728952 IP 151.101.117.67.443 > 10.0.2.15.37872: Flags [P.], seq 425653:429775, ack 350, win 65535, length 4122
00:11:16.728968 IP 10.0.2.15.37872 > 151.101.117.67.443: Flags [.], ack 429775, win 65535, length 0
00:11:16.729430 IP 151.101.117.67.443 > 10.0.2.15.37872: Flags [P.], seq 429775:432523, ack 350, win 65535, length 2748
00:11:16.729442 IP 10.0.2.15.37872 > 151.101.117.67.443: Flags [.], ack 432523, win 65535, length 0
00:11:16.730027 IP 151.101.117.67.443 > 10.0.2.15.37872: Flags [P.], seq 432523:438019, ack 350, win 65535, length 5496
00:11:16.730130 IP 10.0.2.15.37872 > 151.101.117.67.443: Flags [.], ack 438019, win 65535, length 0
00:11:16.730317 IP 151.101.117.67.443 > 10.0.2.15.37872: Flags [P.], seq 438019:440767, ack 350, win 65535, length 2748
00:11:16.730330 IP 10.0.2.15.37872 > 151.101.117.67.443: Flags [.], ack 440767, win 65535, length 0
00:11:16.730564 IP 151.101.117.67.443 > 10.0.2.15.37872: Flags [P.], seq 440767:444889, ack 350, win 65535, length 4122
00:11:16.730576 IP 10.0.2.15.37872 > 151.101.117.67.443: Flags [.], ack 444889, win 65535, length 0
00:11:16.731022 IP 151.101.117.67.443 > 10.0.2.15.37872: Flags [P.], seq 444889:449011, ack 350, win 65535, length 4122
00:11:16.731035 IP 10.0.2.15.37872 > 151.101.117.67.443: Flags [.], ack 449011, win 65535, length 0
00:11:16.731451 IP 151.101.117.67.443 > 10.0.2.15.37872: Flags [P.], seq 449011:451759, ack 350, win 65535, length 2748
00:11:16.731454 IP 151.101.117.67.443 > 10.0.2.15.37872: Flags [P.], seq 451759:455881, ack 350, win 65535, length 4122
00:11:16.731470 IP 10.0.2.15.37872 > 151.101.117.67.443: Flags [.], ack 451759, win 65535, length 0
00:11:16.731496 IP 10.0.2.15.37872 > 151.101.117.67.443: Flags [.], ack 455881, win 65535, length 0
00:11:16.732538 IP 151.101.117.67.443 > 10.0.2.15.37872: Flags [P.], seq 455881:460003, ack 350, win 65535, length 4122
00:11:16.732556 IP 10.0.2.15.37872 > 151.101.117.67.443: Flags [.], ack 460003, win 65535, length 0
00:11:16.732900 IP 151.101.117.67.443 > 10.0.2.15.37872: Flags [P.], seq 460003:462751, ack 350, win 65535, length 2748
00:11:16.732915 IP 10.0.2.15.37872 > 151.101.117.67.443: Flags [.], ack 462751, win 65535, length 0
00:11:16.733022 IP 151.101.117.67.443 > 10.0.2.15.37872: Flags [.], seq 462751:467131, ack 350, win 65535, length 4380
00:11:16.733029 IP 10.0.2.15.37872 > 151.101.117.67.443: Flags [.], ack 467131, win 65535, length 0
00:11:16.733266 IP 151.101.117.67.443 > 10.0.2.15.37872: Flags [P.], seq 467131:468247, ack 350, win 65535, length 1116
00:11:16.733614 IP 151.101.117.67.443 > 10.0.2.15.37872: Flags [P.], seq 468247:472369, ack 350, win 65535, length 4122
00:11:16.733711 IP 10.0.2.15.37872 > 151.101.117.67.443: Flags [.], ack 472369, win 65535, length 0
00:11:16.734016 IP 151.101.117.67.443 > 10.0.2.15.37872: Flags [P.], seq 472369:476491, ack 350, win 65535, length 4122
00:11:16.734327 IP 10.0.2.15.37872 > 151.101.117.67.443: Flags [.], ack 476491, win 65535, length 0
00:11:16.734626 IP 151.101.117.67.443 > 10.0.2.15.37872: Flags [P.], seq 476491:479239, ack 350, win 65535, length 2748
00:11:16.734629 IP 151.101.117.67.443 > 10.0.2.15.37872: Flags [P.], seq 479239:483361, ack 350, win 65535, length 4122
00:11:16.734646 IP 10.0.2.15.37872 > 151.101.117.67.443: Flags [.], ack 479239, win 65535, length 0
00:11:16.734701 IP 10.0.2.15.37872 > 151.101.117.67.443: Flags [.], ack 483361, win 65535, length 0
00:11:16.734830 IP 151.101.117.67.443 > 10.0.2.15.37872: Flags [P.], seq 483361:487483, ack 350, win 65535, length 4122
00:11:16.734839 IP 151.101.117.67.443 > 10.0.2.15.37872: Flags [P.], seq 487483:490231, ack 350, win 65535, length 2748
00:11:16.734848 IP 10.0.2.15.37872 > 151.101.117.67.443: Flags [.], ack 487483, win 65535, length 0
00:11:16.734866 IP 10.0.2.15.37872 > 151.101.117.67.443: Flags [.], ack 490231, win 65535, length 0
00:11:16.735246 IP 151.101.117.67.443 > 10.0.2.15.37872: Flags [P.], seq 490231:492979, ack 350, win 65535, length 2748
00:11:16.735301 IP 10.0.2.15.37872 > 151.101.117.67.443: Flags [.], ack 492979, win 65535, length 0
00:11:16.735710 IP 151.101.117.67.443 > 10.0.2.15.37872: Flags [P.], seq 492979:497101, ack 350, win 65535, length 4122
00:11:16.735774 IP 10.0.2.15.37872 > 151.101.117.67.443: Flags [.], ack 497101, win 65535, length 0
00:11:16.735945 IP 151.101.117.67.443 > 10.0.2.15.37872: Flags [P.], seq 497101:501223, ack 350, win 65535, length 4122
00:11:16.735956 IP 10.0.2.15.37872 > 151.101.117.67.443: Flags [.], ack 501223, win 65535, length 0
00:11:16.738832 IP 151.101.117.67.443 > 10.0.2.15.37872: Flags [P.], seq 501223:502597, ack 350, win 65535, length 1374
00:11:16.738839 IP 151.101.117.67.443 > 10.0.2.15.37872: Flags [P.], seq 502597:520459, ack 350, win 65535, length 17862
00:11:16.738997 IP 10.0.2.15.37872 > 151.101.117.67.443: Flags [.], ack 520459, win 65535, length 0
00:11:16.739120 IP 151.101.117.67.443 > 10.0.2.15.37872: Flags [P.], seq 520459:530077, ack 350, win 65535, length 9618
00:11:16.739129 IP 10.0.2.15.37872 > 151.101.117.67.443: Flags [.], ack 530077, win 65535, length 0
00:11:16.739694 IP 151.101.117.67.443 > 10.0.2.15.37872: Flags [P.], seq 530077:536947, ack 350, win 65535, length 6870
00:11:16.739712 IP 10.0.2.15.37872 > 151.101.117.67.443: Flags [.], ack 536947, win 65535, length 0
00:11:16.739845 IP 151.101.117.67.443 > 10.0.2.15.37872: Flags [P.], seq 536947:538321, ack 350, win 65535, length 1374
00:11:16.740302 IP 151.101.117.67.443 > 10.0.2.15.37872: Flags [P.], seq 538321:543817, ack 350, win 65535, length 5496
00:11:16.740304 IP 151.101.117.67.443 > 10.0.2.15.37872: Flags [P.], seq 543817:546565, ack 350, win 65535, length 2748
00:11:16.740376 IP 10.0.2.15.37872 > 151.101.117.67.443: Flags [.], ack 543817, win 65535, length 0
00:11:16.740400 IP 10.0.2.15.37872 > 151.101.117.67.443: Flags [.], ack 546565, win 65535, length 0
00:11:16.740569 IP 151.101.117.67.443 > 10.0.2.15.37872: Flags [P.], seq 546565:549313, ack 350, win 65535, length 2748
00:11:16.740578 IP 10.0.2.15.37872 > 151.101.117.67.443: Flags [.], ack 549313, win 65535, length 0
00:11:16.741552 IP 151.101.117.67.443 > 10.0.2.15.37872: Flags [P.], seq 549313:554809, ack 350, win 65535, length 5496
00:11:16.741778 IP 151.101.117.67.443 > 10.0.2.15.37872: Flags [P.], seq 554809:556183, ack 350, win 65535, length 1374
00:11:16.742092 IP 151.101.117.67.443 > 10.0.2.15.37872: Flags [P.], seq 556183:558931, ack 350, win 65535, length 2748
00:11:16.742286 IP 151.101.117.67.443 > 10.0.2.15.37872: Flags [P.], seq 558931:563053, ack 350, win 65535, length 4122
00:11:16.742399 IP 10.0.2.15.37872 > 151.101.117.67.443: Flags [.], ack 563053, win 65535, length 0
00:11:16.742858 IP 151.101.117.67.443 > 10.0.2.15.37872: Flags [P.], seq 563053:565801, ack 350, win 65535, length 2748
00:11:16.742861 IP 151.101.117.67.443 > 10.0.2.15.37872: Flags [P.], seq 565801:569923, ack 350, win 65535, length 4122
00:11:16.743185 IP 151.101.117.67.443 > 10.0.2.15.37872: Flags [P.], seq 569923:574045, ack 350, win 65535, length 4122
00:11:16.743481 IP 151.101.117.67.443 > 10.0.2.15.37872: Flags [P.], seq 574045:576793, ack 350, win 65535, length 2748
00:11:16.743775 IP 151.101.117.67.443 > 10.0.2.15.37872: Flags [P.], seq 576793:580915, ack 350, win 65535, length 4122
00:11:16.743948 IP 151.101.117.67.443 > 10.0.2.15.37872: Flags [P.], seq 580915:583663, ack 350, win 65535, length 2748
00:11:16.744161 IP 10.0.2.15.37872 > 151.101.117.67.443: Flags [.], ack 583663, win 65535, length 0
00:11:16.744505 IP 151.101.117.67.443 > 10.0.2.15.37872: Flags [P.], seq 583663:587785, ack 350, win 65535, length 4122
00:11:16.744510 IP 151.101.117.67.443 > 10.0.2.15.37872: Flags [P.], seq 587785:591907, ack 350, win 65535, length 4122
00:11:16.744538 IP 10.0.2.15.37872 > 151.101.117.67.443: Flags [.], ack 587785, win 65535, length 0
00:11:16.744562 IP 10.0.2.15.37872 > 151.101.117.67.443: Flags [.], ack 591907, win 65535, length 0
00:11:16.745018 IP 151.101.117.67.443 > 10.0.2.15.37872: Flags [P.], seq 591907:596029, ack 350, win 65535, length 4122
00:11:16.745037 IP 10.0.2.15.37872 > 151.101.117.67.443: Flags [.], ack 596029, win 65535, length 0
00:11:16.746741 IP 151.101.117.67.443 > 10.0.2.15.37872: Flags [P.], seq 596029:601525, ack 350, win 65535, length 5496
00:11:16.746744 IP 151.101.117.67.443 > 10.0.2.15.37872: Flags [P.], seq 601525:605647, ack 350, win 65535, length 4122
00:11:16.746744 IP 151.101.117.67.443 > 10.0.2.15.37872: Flags [P.], seq 605647:608395, ack 350, win 65535, length 2748
00:11:16.746765 IP 10.0.2.15.37872 > 151.101.117.67.443: Flags [.], ack 601525, win 65535, length 0
00:11:16.746800 IP 10.0.2.15.37872 > 151.101.117.67.443: Flags [.], ack 605647, win 65535, length 0
00:11:16.746815 IP 10.0.2.15.37872 > 151.101.117.67.443: Flags [.], ack 608395, win 65535, length 0
00:11:16.747036 IP 151.101.117.67.443 > 10.0.2.15.37872: Flags [P.], seq 608395:612517, ack 350, win 65535, length 4122
00:11:16.747043 IP 10.0.2.15.37872 > 151.101.117.67.443: Flags [.], ack 612517, win 65535, length 0
00:11:16.747319 IP 151.101.117.67.443 > 10.0.2.15.37872: Flags [P.], seq 612517:616639, ack 350, win 65535, length 4122
00:11:16.747328 IP 10.0.2.15.37872 > 151.101.117.67.443: Flags [.], ack 616639, win 65535, length 0
00:11:16.747483 IP 151.101.117.67.443 > 10.0.2.15.37872: Flags [P.], seq 616639:619387, ack 350, win 65535, length 2748
00:11:16.747493 IP 10.0.2.15.37872 > 151.101.117.67.443: Flags [.], ack 619387, win 65535, length 0
00:11:16.747615 IP 151.101.117.67.443 > 10.0.2.15.37872: Flags [P.], seq 619387:620761, ack 350, win 65535, length 1374
00:11:16.747844 IP 151.101.117.67.443 > 10.0.2.15.37872: Flags [P.], seq 620761:623509, ack 350, win 65535, length 2748
00:11:16.747854 IP 10.0.2.15.37872 > 151.101.117.67.443: Flags [.], ack 623509, win 65535, length 0
00:11:16.748024 IP 151.101.117.67.443 > 10.0.2.15.37872: Flags [P.], seq 623509:624883, ack 350, win 65535, length 1374
00:11:16.748195 IP 151.101.117.67.443 > 10.0.2.15.37872: Flags [P.], seq 624883:629005, ack 350, win 65535, length 4122
00:11:16.748202 IP 10.0.2.15.37872 > 151.101.117.67.443: Flags [.], ack 629005, win 65535, length 0
00:11:16.748811 IP 151.101.117.67.443 > 10.0.2.15.37872: Flags [P.], seq 629005:634501, ack 350, win 65535, length 5496
00:11:16.748826 IP 10.0.2.15.37872 > 151.101.117.67.443: Flags [.], ack 634501, win 65535, length 0
00:11:16.749182 IP 151.101.117.67.443 > 10.0.2.15.37872: Flags [P.], seq 634501:635875, ack 350, win 65535, length 1374
00:11:16.749185 IP 151.101.117.67.443 > 10.0.2.15.37872: Flags [P.], seq 635875:638623, ack 350, win 65535, length 2748
00:11:16.749204 IP 10.0.2.15.37872 > 151.101.117.67.443: Flags [.], ack 638623, win 65535, length 0
00:11:16.749349 IP 151.101.117.67.443 > 10.0.2.15.37872: Flags [P.], seq 638623:642745, ack 350, win 65535, length 4122
00:11:16.749356 IP 10.0.2.15.37872 > 151.101.117.67.443: Flags [.], ack 642745, win 65535, length 0
00:11:16.750331 IP 151.101.117.67.443 > 10.0.2.15.37872: Flags [P.], seq 642745:646867, ack 350, win 65535, length 4122
00:11:16.750348 IP 10.0.2.15.37872 > 151.101.117.67.443: Flags [.], ack 646867, win 65535, length 0
00:11:16.750597 IP 151.101.117.67.443 > 10.0.2.15.37872: Flags [P.], seq 646867:650989, ack 350, win 65535, length 4122
00:11:16.750863 IP 151.101.117.67.443 > 10.0.2.15.37872: Flags [P.], seq 650989:653737, ack 350, win 65535, length 2748
00:11:16.750927 IP 10.0.2.15.37872 > 151.101.117.67.443: Flags [.], ack 653737, win 65535, length 0
00:11:16.751057 IP 151.101.117.67.443 > 10.0.2.15.37872: Flags [P.], seq 653737:655111, ack 350, win 65535, length 1374
00:11:16.751195 IP 151.101.117.67.443 > 10.0.2.15.37872: Flags [P.], seq 655111:657859, ack 350, win 65535, length 2748
00:11:16.751204 IP 10.0.2.15.37872 > 151.101.117.67.443: Flags [.], ack 657859, win 65535, length 0
00:11:16.751747 IP 151.101.117.67.443 > 10.0.2.15.37872: Flags [P.], seq 657859:661981, ack 350, win 65535, length 4122
00:11:16.751867 IP 151.101.117.67.443 > 10.0.2.15.37872: Flags [P.], seq 661981:666103, ack 350, win 65535, length 4122
00:11:16.751894 IP 10.0.2.15.37872 > 151.101.117.67.443: Flags [.], ack 666103, win 65535, length 0
00:11:16.752099 IP 151.101.117.67.443 > 10.0.2.15.37872: Flags [P.], seq 666103:668851, ack 350, win 65535, length 2748
00:11:16.752108 IP 10.0.2.15.37872 > 151.101.117.67.443: Flags [.], ack 668851, win 65535, length 0
00:11:16.752339 IP 151.101.117.67.443 > 10.0.2.15.37872: Flags [P.], seq 668851:670225, ack 350, win 65535, length 1374
00:11:16.752506 IP 151.101.117.67.443 > 10.0.2.15.37872: Flags [P.], seq 670225:672973, ack 350, win 65535, length 2748
00:11:16.752516 IP 10.0.2.15.37872 > 151.101.117.67.443: Flags [.], ack 672973, win 65535, length 0
00:11:16.752750 IP 151.101.117.67.443 > 10.0.2.15.37872: Flags [P.], seq 672973:677095, ack 350, win 65535, length 4122
00:11:16.752839 IP 10.0.2.15.37872 > 151.101.117.67.443: Flags [.], ack 677095, win 65535, length 0
00:11:16.752987 IP 151.101.117.67.443 > 10.0.2.15.37872: Flags [P.], seq 677095:678469, ack 350, win 65535, length 1374
00:11:16.753155 IP 151.101.117.67.443 > 10.0.2.15.37872: Flags [P.], seq 678469:679843, ack 350, win 65535, length 1374
00:11:16.753164 IP 10.0.2.15.37872 > 151.101.117.67.443: Flags [.], ack 679843, win 65535, length 0
00:11:16.753412 IP 151.101.117.67.443 > 10.0.2.15.37872: Flags [P.], seq 679843:685339, ack 350, win 65535, length 5496
00:11:16.753464 IP 10.0.2.15.37872 > 151.101.117.67.443: Flags [.], ack 685339, win 65535, length 0
00:11:16.753766 IP 151.101.117.67.443 > 10.0.2.15.37872: Flags [P.], seq 685339:688087, ack 350, win 65535, length 2748
00:11:16.753809 IP 10.0.2.15.37872 > 151.101.117.67.443: Flags [.], ack 688087, win 65535, length 0
00:11:16.754014 IP 151.101.117.67.443 > 10.0.2.15.37872: Flags [P.], seq 688087:689461, ack 350, win 65535, length 1374
00:11:16.754952 IP 151.101.117.67.443 > 10.0.2.15.37872: Flags [P.], seq 689461:693583, ack 350, win 65535, length 4122
00:11:16.755039 IP 10.0.2.15.37872 > 151.101.117.67.443: Flags [.], ack 693583, win 65535, length 0
00:11:16.755221 IP 151.101.117.67.443 > 10.0.2.15.37872: Flags [P.], seq 693583:696331, ack 350, win 65535, length 2748
00:11:16.755225 IP 151.101.117.67.443 > 10.0.2.15.37872: Flags [P.], seq 696331:699079, ack 350, win 65535, length 2748
00:11:16.755285 IP 10.0.2.15.37872 > 151.101.117.67.443: Flags [.], ack 699079, win 65535, length 0
00:11:16.755415 IP 151.101.117.67.443 > 10.0.2.15.37872: Flags [P.], seq 699079:703201, ack 350, win 65535, length 4122
00:11:16.755422 IP 10.0.2.15.37872 > 151.101.117.67.443: Flags [.], ack 703201, win 65535, length 0
00:11:16.755974 IP 151.101.117.67.443 > 10.0.2.15.37872: Flags [P.], seq 703201:707323, ack 350, win 65535, length 4122
00:11:16.755991 IP 10.0.2.15.37872 > 151.101.117.67.443: Flags [.], ack 707323, win 65535, length 0
00:11:16.757105 IP 151.101.117.67.443 > 10.0.2.15.37872: Flags [P.], seq 707323:712819, ack 350, win 65535, length 5496
00:11:16.757108 IP 151.101.117.67.443 > 10.0.2.15.37872: Flags [P.], seq 712819:714193, ack 350, win 65535, length 1374
00:11:16.757208 IP 151.101.117.67.443 > 10.0.2.15.37872: Flags [P.], seq 714193:722437, ack 350, win 65535, length 8244
00:11:16.757329 IP 10.0.2.15.37872 > 151.101.117.67.443: Flags [.], ack 722437, win 65535, length 0
00:11:16.757758 IP 151.101.117.67.443 > 10.0.2.15.37872: Flags [.], seq 722437:726817, ack 350, win 65535, length 4380
00:11:16.757810 IP 10.0.2.15.37872 > 151.101.117.67.443: Flags [.], ack 726817, win 65535, length 0
00:11:16.758328 IP 151.101.117.67.443 > 10.0.2.15.37872: Flags [P.], seq 726817:727933, ack 350, win 65535, length 1116
00:11:16.759066 IP 151.101.117.67.443 > 10.0.2.15.37872: Flags [P.], seq 727933:736177, ack 350, win 65535, length 8244
00:11:16.759087 IP 10.0.2.15.37872 > 151.101.117.67.443: Flags [.], ack 736177, win 65535, length 0
00:11:16.765071 IP 151.101.117.67.443 > 10.0.2.15.37872: Flags [P.], seq 736177:744421, ack 350, win 65535, length 8244
00:11:16.765077 IP 151.101.117.67.443 > 10.0.2.15.37872: Flags [P.], seq 744421:752665, ack 350, win 65535, length 8244
00:11:16.765101 IP 10.0.2.15.37872 > 151.101.117.67.443: Flags [.], ack 744421, win 65535, length 0
00:11:16.765268 IP 151.101.117.67.443 > 10.0.2.15.37872: Flags [P.], seq 752665:763657, ack 350, win 65535, length 10992
00:11:16.765345 IP 151.101.117.67.443 > 10.0.2.15.37872: Flags [P.], seq 763657:791137, ack 350, win 65535, length 27480
00:11:16.766911 IP 10.0.2.15.37872 > 151.101.117.67.443: Flags [.], ack 791137, win 65535, length 0
00:11:16.767808 IP 151.101.117.67.443 > 10.0.2.15.37872: Flags [P.], seq 791137:829609, ack 350, win 65535, length 38472
00:11:16.768719 IP 10.0.2.15.37872 > 151.101.117.67.443: Flags [.], ack 829609, win 65535, length 0
00:11:16.769107 IP 151.101.117.67.443 > 10.0.2.15.37872: Flags [P.], seq 829609:844723, ack 350, win 65535, length 15114
00:11:16.769118 IP 10.0.2.15.37872 > 151.101.117.67.443: Flags [.], ack 844723, win 65535, length 0
00:11:16.770196 IP 151.101.117.67.443 > 10.0.2.15.37872: Flags [P.], seq 844723:850219, ack 350, win 65535, length 5496
00:11:16.770198 IP 151.101.117.67.443 > 10.0.2.15.37872: Flags [P.], seq 850219:851593, ack 350, win 65535, length 1374
00:11:16.770199 IP 151.101.117.67.443 > 10.0.2.15.37872: Flags [P.], seq 851593:854341, ack 350, win 65535, length 2748
00:11:16.770200 IP 151.101.117.67.443 > 10.0.2.15.37872: Flags [P.], seq 854341:858463, ack 350, win 65535, length 4122
00:11:16.770479 IP 151.101.117.67.443 > 10.0.2.15.37872: Flags [P.], seq 858463:861211, ack 350, win 65535, length 2748
00:11:16.770481 IP 151.101.117.67.443 > 10.0.2.15.37872: Flags [P.], seq 861211:863959, ack 350, win 65535, length 2748
00:11:16.770661 IP 151.101.117.67.443 > 10.0.2.15.37872: Flags [P.], seq 863959:865333, ack 350, win 65535, length 1374
00:11:16.770728 IP 10.0.2.15.37872 > 151.101.117.67.443: Flags [.], ack 865333, win 65535, length 0
00:11:16.771212 IP 151.101.117.67.443 > 10.0.2.15.37872: Flags [P.], seq 865333:868081, ack 350, win 65535, length 2748
00:11:16.771216 IP 151.101.117.67.443 > 10.0.2.15.37872: Flags [P.], seq 868081:872203, ack 350, win 65535, length 4122
00:11:16.771428 IP 151.101.117.67.443 > 10.0.2.15.37872: Flags [P.], seq 872203:874951, ack 350, win 65535, length 2748
00:11:16.771481 IP 10.0.2.15.37872 > 151.101.117.67.443: Flags [.], ack 874951, win 65535, length 0
00:11:16.771901 IP 151.101.117.67.443 > 10.0.2.15.37872: Flags [P.], seq 874951:876325, ack 350, win 65535, length 1374
00:11:16.772551 IP 151.101.117.67.443 > 10.0.2.15.37872: Flags [P.], seq 876325:880447, ack 350, win 65535, length 4122
00:11:16.772570 IP 10.0.2.15.37872 > 151.101.117.67.443: Flags [.], ack 880447, win 65535, length 0
00:11:16.773231 IP 151.101.117.67.443 > 10.0.2.15.37872: Flags [P.], seq 880447:885943, ack 350, win 65535, length 5496
00:11:16.773276 IP 151.101.117.67.443 > 10.0.2.15.37872: Flags [P.], seq 885943:890065, ack 350, win 65535, length 4122
00:11:16.773961 IP 151.101.117.67.443 > 10.0.2.15.37872: Flags [P.], seq 890065:896935, ack 350, win 65535, length 6870
00:11:16.774019 IP 10.0.2.15.37872 > 151.101.117.67.443: Flags [.], ack 896935, win 65535, length 0
00:11:16.775519 IP 151.101.117.67.443 > 10.0.2.15.37872: Flags [P.], seq 896935:903805, ack 350, win 65535, length 6870
00:11:16.775559 IP 151.101.117.67.443 > 10.0.2.15.37872: Flags [P.], seq 903805:913423, ack 350, win 65535, length 9618
00:11:16.775584 IP 10.0.2.15.37872 > 151.101.117.67.443: Flags [.], ack 903805, win 65535, length 0
00:11:16.775798 IP 10.0.2.15.37872 > 151.101.117.67.443: Flags [.], ack 913423, win 65535, length 0
00:11:16.779995 IP 151.101.117.67.443 > 10.0.2.15.37872: Flags [P.], seq 913423:923041, ack 350, win 65535, length 9618
00:11:16.780008 IP 151.101.117.67.443 > 10.0.2.15.37872: Flags [P.], seq 923041:949147, ack 350, win 65535, length 26106
00:11:16.780096 IP 10.0.2.15.37872 > 151.101.117.67.443: Flags [.], ack 923041, win 65535, length 0
00:11:16.780333 IP 10.0.2.15.37872 > 151.101.117.67.443: Flags [.], ack 949147, win 65535, length 0
00:11:16.780661 IP 151.101.117.67.443 > 10.0.2.15.37872: Flags [.], seq 949147:962287, ack 350, win 65535, length 13140
00:11:16.780674 IP 10.0.2.15.37872 > 151.101.117.67.443: Flags [.], ack 962287, win 65535, length 0
00:11:16.780835 IP 151.101.117.67.443 > 10.0.2.15.37872: Flags [P.], seq 962287:969757, ack 350, win 65535, length 7470
00:11:16.780865 IP 10.0.2.15.37872 > 151.101.117.67.443: Flags [.], ack 969757, win 65535, length 0
00:11:16.781373 IP 151.101.117.67.443 > 10.0.2.15.37872: Flags [P.], seq 969757:975253, ack 350, win 65535, length 5496
00:11:16.781452 IP 10.0.2.15.37872 > 151.101.117.67.443: Flags [.], ack 975253, win 65535, length 0
00:11:16.781625 IP 151.101.117.67.443 > 10.0.2.15.37872: Flags [P.], seq 975253:976627, ack 350, win 65535, length 1374
00:11:16.781881 IP 151.101.117.67.443 > 10.0.2.15.37872: Flags [P.], seq 976627:980749, ack 350, win 65535, length 4122

