00:11:15.413390 IP 151.101.117.67.443 > 10.0.2.15.37866: Flags [.], seq 64192002:64194922, ack 1506404504, win 65535, length 2920
00:11:15.413413 IP 10.0.2.15.37866 > 151.101.117.67.443: Flags [.], ack 2920, win 62780, length 0
00:11:15.413658 IP 151.101.117.67.443 > 10.0.2.15.37866: Flags [P.], seq 2920:5063, ack 1, win 65535, length 2143
00:11:15.413671 IP 10.0.2.15.37866 > 151.101.117.67.443: Flags [.], ack 5063, win 61320, length 0
00:11:15.414759 IP 10.0.2.15.37866 > 151.101.117.67.443: Flags [P.], seq 1:94, ack 5063, win 62780, length 93
00:11:15.415077 IP 151.101.117.67.443 > 10.0.2.15.37866: Flags [.], ack 94, win 65535, length 0
00:11:15.429528 IP 151.101.117.67.443 > 10.0.2.15.37866: Flags [P.], seq 5063:5114, ack 94, win 65535, length 51
00:11:15.429550 IP 10.0.2.15.37866 > 151.101.117.67.443: Flags [.], ack 5114, win 62780, length 0
00:11:15.430236 IP 10.0.2.15.37866 > 151.101.117.67.443: Flags [P.], seq 94:147, ack 5114, win 62780, length 53
00:11:15.430280 IP 10.0.2.15.37866 > 151.101.117.67.443: Flags [P.], seq 147:203, ack 5114, win 62780, length 56
00:11:15.430650 IP 10.0.2.15.37866 > 151.101.117.67.443: Flags [P.], seq 203:312, ack 5114, win 62780, length 109
00:11:15.431757 IP 151.101.117.67.443 > 10.0.2.15.37866: Flags [.], ack 147, win 65535, length 0
00:11:15.431760 IP 151.101.117.67.443 > 10.0.2.15.37866: Flags [.], ack 203, win 65535, length 0
00:11:15.431760 IP 151.101.117.67.443 > 10.0.2.15.37866: Flags [.], ack 312, win 65535, length 0
00:11:15.444715 IP 151.101.117.67.443 > 10.0.2.15.37866: Flags [P.], seq 5114:5209, ack 312, win 65535, length 95
00:11:15.444740 IP 10.0.2.15.37866 > 151.101.117.67.443: Flags [.], ack 5209, win 62780, length 0
00:11:15.445723 IP 151.101.117.67.443 > 10.0.2.15.37866: Flags [P.], seq 5209:9331, ack 312, win 65535, length 4122
00:11:15.445743 IP 10.0.2.15.37866 > 151.101.117.67.443: Flags [.], ack 9331, win 61320, length 0
00:11:15.445948 IP 10.0.2.15.37866 > 151.101.117.67.443: Flags [P.], seq 312:350, ack 9331, win 61320, length 38
00:11:15.447639 IP 151.101.117.67.443 > 10.0.2.15.37866: Flags [P.], seq 9331:13453, ack 312, win 65535, length 4122
00:11:15.447642 IP 151.101.117.67.443 > 10.0.2.15.37866: Flags [.], ack 350, win 65535, length 0
00:11:15.447643 IP 151.101.117.67.443 > 10.0.2.15.37866: Flags [P.], seq 13453:18949, ack 350, win 65535, length 5496
00:11:15.447667 IP 10.0.2.15.37866 > 151.101.117.67.443: Flags [.], ack 13453, win 61320, length 0
00:11:15.448063 IP 10.0.2.15.37866 > 151.101.117.67.443: Flags [.], ack 18949, win 58400, length 0
00:11:15.450699 IP 151.101.117.67.443 > 10.0.2.15.37866: Flags [P.], seq 18949:25819, ack 350, win 65535, length 6870
00:11:15.450702 IP 151.101.117.67.443 > 10.0.2.15.37866: Flags [P.], seq 25819:29941, ack 350, win 65535, length 4122
00:11:15.450728 IP 10.0.2.15.37866 > 151.101.117.67.443: Flags [.], ack 25819, win 59860, length 0
00:11:15.450842 IP 10.0.2.15.37866 > 151.101.117.67.443: Flags [.], ack 29941, win 56940, length 0
00:11:15.451313 IP 151.101.117.67.443 > 10.0.2.15.37866: Flags [.], seq 29941:31401, ack 350, win 65535, length 1460
00:11:15.452465 IP 151.101.117.67.443 > 10.0.2.15.37866: Flags [P.], seq 31401:34063, ack 350, win 65535, length 2662
00:11:15.452499 IP 10.0.2.15.37866 > 151.101.117.67.443: Flags [.], ack 34063, win 62780, length 0
00:11:15.454023 IP 151.101.117.67.443 > 10.0.2.15.37866: Flags [P.], seq 34063:38185, ack 350, win 65535, length 4122
00:11:15.454025 IP 151.101.117.67.443 > 10.0.2.15.37866: Flags [P.], seq 38185:42307, ack 350, win 65535, length 4122
00:11:15.454121 IP 10.0.2.15.37866 > 151.101.117.67.443: Flags [.], ack 42307, win 58400, length 0
00:11:15.454347 IP 151.101.117.67.443 > 10.0.2.15.37866: Flags [P.], seq 42307:46429, ack 350, win 65535, length 4122
00:11:15.454369 IP 10.0.2.15.37866 > 151.101.117.67.443: Flags [.], ack 46429, win 55480, length 0
00:11:15.455407 IP 151.101.117.67.443 > 10.0.2.15.37866: Flags [P.], seq 46429:49177, ack 350, win 65535, length 2748
00:11:15.455456 IP 10.0.2.15.37866 > 151.101.117.67.443: Flags [.], ack 49177, win 62780, length 0
00:11:15.455612 IP 151.101.117.67.443 > 10.0.2.15.37866: Flags [P.], seq 49177:50551, ack 350, win 65535, length 1374
00:11:15.457395 IP 151.101.117.67.443 > 10.0.2.15.37866: Flags [P.], seq 50551:53299, ack 350, win 65535, length 2748
00:11:15.457504 IP 10.0.2.15.37866 > 151.101.117.67.443: Flags [.], ack 53299, win 62780, length 0
00:11:15.459267 IP 151.101.117.67.443 > 10.0.2.15.37866: Flags [P.], seq 53299:57421, ack 350, win 65535, length 4122
00:11:15.459534 IP 10.0.2.15.37866 > 151.101.117.67.443: Flags [.], ack 57421, win 61320, length 0
00:11:15.460518 IP 151.101.117.67.443 > 10.0.2.15.37866: Flags [P.], seq 57421:61543, ack 350, win 65535, length 4122
00:11:15.460541 IP 10.0.2.15.37866 > 151.101.117.67.443: Flags [.], ack 61543, win 61320, length 0
00:11:15.461491 IP 151.101.117.67.443 > 10.0.2.15.37866: Flags [P.], seq 61543:67039, ack 350, win 65535, length 5496
00:11:15.461545 IP 10.0.2.15.37866 > 151.101.117.67.443: Flags [.], ack 67039, win 61320, length 0
00:11:15.461877 IP 151.101.117.67.443 > 10.0.2.15.37866: Flags [P.], seq 67039:69787, ack 350, win 65535, length 2748
00:11:15.461890 IP 10.0.2.15.37866 > 151.101.117.67.443: Flags [.], ack 69787, win 62780, length 0
00:11:15.463312 IP 151.101.117.67.443 > 10.0.2.15.37866: Flags [P.], seq 69787:73909, ack 350, win 65535, length 4122
00:11:15.463335 IP 10.0.2.15.37866 > 151.101.117.67.443: Flags [.], ack 73909, win 65535, length 0
00:11:15.463803 IP 151.101.117.67.443 > 10.0.2.15.37866: Flags [P.], seq 73909:78031, ack 350, win 65535, length 4122
00:11:15.463819 IP 10.0.2.15.37866 > 151.101.117.67.443: Flags [.], ack 78031, win 65535, length 0
00:11:15.464828 IP 151.101.117.67.443 > 10.0.2.15.37866: Flags [P.], seq 78031:82153, ack 350, win 65535, length 4122
00:11:15.464849 IP 10.0.2.15.37866 > 151.101.117.67.443: Flags [.], ack 82153, win 65535, length 0
00:11:15.465779 IP 151.101.117.67.443 > 10.0.2.15.37866: Flags [P.], seq 82153:86275, ack 350, win 65535, length 4122
00:11:15.465798 IP 10.0.2.15.37866 > 151.101.117.67.443: Flags [.], ack 86275, win 65535, length 0
00:11:15.466989 IP 151.101.117.67.443 > 10.0.2.15.37866: Flags [P.], seq 86275:89023, ack 350, win 65535, length 2748
00:11:15.466993 IP 151.101.117.67.443 > 10.0.2.15.37866: Flags [P.], seq 89023:93145, ack 350, win 65535, length 4122
00:11:15.467018 IP 10.0.2.15.37866 > 151.101.117.67.443: Flags [.], ack 89023, win 65535, length 0
00:11:15.467109 IP 10.0.2.15.37866 > 151.101.117.67.443: Flags [.], ack 93145, win 65535, length 0
00:11:15.470375 IP 151.101.117.67.443 > 10.0.2.15.37866: Flags [P.], seq 93145:102763, ack 350, win 65535, length 9618
00:11:15.470405 IP 10.0.2.15.37866 > 151.101.117.67.443: Flags [.], ack 102763, win 65535, length 0
00:11:15.470663 IP 151.101.117.67.443 > 10.0.2.15.37866: Flags [.], seq 102763:107143, ack 350, win 65535, length 4380
00:11:15.470676 IP 10.0.2.15.37866 > 151.101.117.67.443: Flags [.], ack 107143, win 65535, length 0
00:11:15.470927 IP 151.101.117.67.443 > 10.0.2.15.37866: Flags [P.], seq 107143:111007, ack 350, win 65535, length 3864
00:11:15.471156 IP 10.0.2.15.37866 > 151.101.117.67.443: Flags [.], ack 111007, win 65535, length 0
00:11:15.471599 IP 151.101.117.67.443 > 10.0.2.15.37866: Flags [P.], seq 111007:116503, ack 350, win 65535, length 5496
00:11:15.471612 IP 10.0.2.15.37866 > 151.101.117.67.443: Flags [.], ack 116503, win 65535, length 0
00:11:15.472424 IP 151.101.117.67.443 > 10.0.2.15.37866: Flags [.], seq 116503:117963, ack 350, win 65535, length 1460
00:11:15.472816 IP 151.101.117.67.443 > 10.0.2.15.37866: Flags [.], seq 117963:119423, ack 350, win 65535, length 1460
00:11:15.472831 IP 10.0.2.15.37866 > 151.101.117.67.443: Flags [.], ack 119423, win 65535, length 0
00:11:15.473016 IP 151.101.117.67.443 > 10.0.2.15.37866: Flags [P.], seq 119423:121999, ack 350, win 65535, length 2576
00:11:15.473024 IP 10.0.2.15.37866 > 151.101.117.67.443: Flags [.], ack 121999, win 65535, length 0
00:11:15.475276 IP 151.101.117.67.443 > 10.0.2.15.37866: Flags [P.], seq 121999:127495, ack 350, win 65535, length 5496
00:11:15.475282 IP 151.101.117.67.443 > 10.0.2.15.37866: Flags [P.], seq 127495:131617, ack 350, win 65535, length 4122
00:11:15.475304 IP 10.0.2.15.37866 > 151.101.117.67.443: Flags [.], ack 127495, win 65535, length 0
00:11:15.475345 IP 10.0.2.15.37866 > 151.101.117.67.443: Flags [.], ack 131617, win 65535, length 0
00:11:15.476033 IP 151.101.117.67.443 > 10.0.2.15.37866: Flags [P.], seq 131617:137113, ack 350, win 65535, length 5496
00:11:15.476036 IP 151.101.117.67.443 > 10.0.2.15.37866: Flags [P.], seq 137113:141235, ack 350, win 65535, length 4122
00:11:15.476054 IP 10.0.2.15.37866 > 151.101.117.67.443: Flags [.], ack 137113, win 65535, length 0
00:11:15.476259 IP 10.0.2.15.37866 > 151.101.117.67.443: Flags [.], ack 141235, win 65535, length 0
00:11:15.476572 IP 151.101.117.67.443 > 10.0.2.15.37866: Flags [P.], seq 141235:143983, ack 350, win 65535, length 2748
00:11:15.476574 IP 151.101.117.67.443 > 10.0.2.15.37866: Flags [P.], seq 143983:148105, ack 350, win 65535, length 4122
00:11:15.476592 IP 10.0.2.15.37866 > 151.101.117.67.443: Flags [.], ack 143983, win 65535, length 0
00:11:15.476610 IP 10.0.2.15.37866 > 151.101.117.67.443: Flags [.], ack 148105, win 65535, length 0
00:11:15.477900 IP 151.101.117.67.443 > 10.0.2.15.37866: Flags [P.], seq 148105:153601, ack 350, win 65535, length 5496
00:11:15.477922 IP 10.0.2.15.37866 > 151.101.117.67.443: Flags [.], ack 153601, win 65535, length 0
00:11:15.478892 IP 151.101.117.67.443 > 10.0.2.15.37866: Flags [P.], seq 153601:157723, ack 350, win 65535, length 4122
00:11:15.478908 IP 10.0.2.15.37866 > 151.101.117.67.443: Flags [.], ack 157723, win 65535, length 0
00:11:15.479352 IP 151.101.117.67.443 > 10.0.2.15.37866: Flags [P.], seq 157723:160471, ack 350, win 65535, length 2748
00:11:15.479354 IP 151.101.117.67.443 > 10.0.2.15.37866: Flags [P.], seq 160471:163219, ack 350, win 65535, length 2748
00:11:15.479355 IP 151.101.117.67.443 > 10.0.2.15.37866: Flags [P.], seq 163219:167341, ack 350, win 65535, length 4122
00:11:15.479356 IP 151.101.117.67.443 > 10.0.2.15.37866: Flags [P.], seq 167341:168715, ack 350, win 65535, length 1374
00:11:15.479421 IP 10.0.2.15.37866 > 151.101.117.67.443: Flags [.], ack 160471, win 65535, length 0
00:11:15.479449 IP 10.0.2.15.37866 > 151.101.117.67.443: Flags [.], ack 163219, win 65535, length 0
00:11:15.479461 IP 10.0.2.15.37866 > 151.101.117.67.443: Flags [.], ack 167341, win 65535, length 0
00:11:15.481244 IP 151.101.117.67.443 > 10.0.2.15.37866: Flags [.], seq 168715:170175, ack 350, win 65535, length 1460
00:11:15.481266 IP 10.0.2.15.37866 > 151.101.117.67.443: Flags [.], ack 170175, win 65535, length 0
00:11:15.481770 IP 151.101.117.67.443 > 10.0.2.15.37866: Flags [P.], seq 170175:174211, ack 350, win 65535, length 4036
00:11:15.481772 IP 151.101.117.67.443 > 10.0.2.15.37866: Flags [P.], seq 174211:175585, ack 350, win 65535, length 1374
00:11:15.481774 IP 151.101.117.67.443 > 10.0.2.15.37866: Flags [P.], seq 175585:182455, ack 350, win 65535, length 6870
00:11:15.481807 IP 151.101.117.67.443 > 10.0.2.15.37866: Flags [P.], seq 182455:187951, ack 350, win 65535, length 5496
00:11:15.481836 IP 10.0.2.15.37866 > 151.101.117.67.443: Flags [.], ack 187951, win 65535, length 0
00:11:15.481964 IP 151.101.117.67.443 > 10.0.2.15.37866: Flags [P.], seq 187951:190699, ack 350, win 65535, length 2748
00:11:15.481965 IP 151.101.117.67.443 > 10.0.2.15.37866: Flags [P.], seq 190699:194821, ack 350, win 65535, length 4122
00:11:15.481989 IP 10.0.2.15.37866 > 151.101.117.67.443: Flags [.], ack 194821, win 65535, length 0
00:11:15.483444 IP 151.101.117.67.443 > 10.0.2.15.37866: Flags [P.], seq 194821:200317, ack 350, win 65535, length 5496
00:11:15.483447 IP 151.101.117.67.443 > 10.0.2.15.37866: Flags [P.], seq 200317:204439, ack 350, win 65535, length 4122
00:11:15.483448 IP 151.101.117.67.443 > 10.0.2.15.37866: Flags [P.], seq 204439:205813, ack 350, win 65535, length 1374
00:11:15.483469 IP 10.0.2.15.37866 > 151.101.117.67.443: Flags [.], ack 200317, win 65535, length 0
00:11:15.483574 IP 10.0.2.15.37866 > 151.101.117.67.443: Flags [.], ack 204439, win 65535, length 0
00:11:15.483968 IP 151.101.117.67.443 > 10.0.2.15.37866: Flags [P.], seq 205813:209935, ack 350, win 65535, length 4122
00:11:15.483970 IP 151.101.117.67.443 > 10.0.2.15.37866: Flags [P.], seq 209935:214057, ack 350, win 65535, length 4122
00:11:15.483971 IP 151.101.117.67.443 > 10.0.2.15.37866: Flags [P.], seq 214057:216805, ack 350, win 65535, length 2748
00:11:15.483986 IP 10.0.2.15.37866 > 151.101.117.67.443: Flags [.], ack 209935, win 65535, length 0
00:11:15.484068 IP 10.0.2.15.37866 > 151.101.117.67.443: Flags [.], ack 214057, win 65535, length 0
00:11:15.484156 IP 10.0.2.15.37866 > 151.101.117.67.443: Flags [.], ack 216805, win 65535, length 0
00:11:15.484654 IP 151.101.117.67.443 > 10.0.2.15.37866: Flags [P.], seq 216805:220927, ack 350, win 65535, length 4122
00:11:15.484664 IP 10.0.2.15.37866 > 151.101.117.67.443: Flags [.], ack 220927, win 65535, length 0
00:11:15.485490 IP 151.101.117.67.443 > 10.0.2.15.37866: Flags [P.], seq 220927:225049, ack 350, win 65535, length 4122
00:11:15.485493 IP 151.101.117.67.443 > 10.0.2.15.37866: Flags [P.], seq 225049:230545, ack 350, win 65535, length 5496
00:11:15.485518 IP 10.0.2.15.37866 > 151.101.117.67.443: Flags [.], ack 225049, win 65535, length 0
00:11:15.485616 IP 10.0.2.15.37866 > 151.101.117.67.443: Flags [.], ack 230545, win 65535, length 0
00:11:15.486141 IP 151.101.117.67.443 > 10.0.2.15.37866: Flags [P.], seq 230545:236041, ack 350, win 65535, length 5496
00:11:15.486144 IP 151.101.117.67.443 > 10.0.2.15.37866: Flags [P.], seq 236041:240163, ack 350, win 65535, length 4122
00:11:15.486164 IP 10.0.2.15.37866 > 151.101.117.67.443: Flags [.], ack 236041, win 65535, length 0
00:11:15.486495 IP 10.0.2.15.37866 > 151.101.117.67.443: Flags [.], ack 240163, win 65535, length 0
00:11:15.486874 IP 151.101.117.67.443 > 10.0.2.15.37866: Flags [P.], seq 240163:241537, ack 350, win 65535, length 1374
00:11:15.487800 IP 151.101.117.67.443 > 10.0.2.15.37866: Flags [P.], seq 241537:247033, ack 350, win 65535, length 5496
00:11:15.487804 IP 151.101.117.67.443 > 10.0.2.15.37866: Flags [P.], seq 247033:251155, ack 350, win 65535, length 4122
00:11:15.487805 IP 151.101.117.67.443 > 10.0.2.15.37866: Flags [P.], seq 251155:253903, ack 350, win 65535, length 2748
00:11:15.487827 IP 10.0.2.15.37866 > 151.101.117.67.443: Flags [.], ack 247033, win 65535, length 0
00:11:15.487984 IP 10.0.2.15.37866 > 151.101.117.67.443: Flags [.], ack 251155, win 65535, length 0
00:11:15.487997 IP 10.0.2.15.37866 > 151.101.117.67.443: Flags [.], ack 253903, win 65535, length 0
00:11:15.488022 IP 151.101.117.67.443 > 10.0.2.15.37866: Flags [P.], seq 253903:258025, ack 350, win 65535, length 4122
00:11:15.488027 IP 10.0.2.15.37866 > 151.101.117.67.443: Flags [.], ack 258025, win 65535, length 0
00:11:15.489933 IP 151.101.117.67.443 > 10.0.2.15.37866: Flags [P.], seq 258025:260773, ack 350, win 65535, length 2748
00:11:15.490033 IP 10.0.2.15.37866 > 151.101.117.67.443: Flags [.], ack 260773, win 65535, length 0
00:11:15.490988 IP 151.101.117.67.443 > 10.0.2.15.37866: Flags [P.], seq 260773:263521, ack 350, win 65535, length 2748
00:11:15.491006 IP 10.0.2.15.37866 > 151.101.117.67.443: Flags [.], ack 263521, win 65535, length 0
00:11:15.501030 IP 151.101.117.67.443 > 10.0.2.15.37866: Flags [P.], seq 263521:267643, ack 350, win 65535, length 4122
00:11:15.501055 IP 10.0.2.15.37866 > 151.101.117.67.443: Flags [.], ack 267643, win 65535, length 0
00:11:15.501546 IP 151.101.117.67.443 > 10.0.2.15.37866: Flags [P.], seq 267643:271765, ack 350, win 65535, length 4122
00:11:15.501618 IP 10.0.2.15.37866 > 151.101.117.67.443: Flags [.], ack 271765, win 65535, length 0
00:11:15.504683 IP 151.101.117.67.443 > 10.0.2.15.37866: Flags [P.], seq 271765:280009, ack 350, win 65535, length 8244
00:11:15.504687 IP 151.101.117.67.443 > 10.0.2.15.37866: Flags [.], seq 280009:287309, ack 350, win 65535, length 7300
00:11:15.504713 IP 10.0.2.15.37866 > 151.101.117.67.443: Flags [.], ack 280009, win 65535, length 0
00:11:15.504889 IP 10.0.2.15.37866 > 151.101.117.67.443: Flags [.], ack 287309, win 65535, length 0
00:11:15.505308 IP 151.101.117.67.443 > 10.0.2.15.37866: Flags [P.], seq 287309:292375, ack 350, win 65535, length 5066
00:11:15.505318 IP 10.0.2.15.37866 > 151.101.117.67.443: Flags [.], ack 292375, win 65535, length 0
00:11:15.507410 IP 151.101.117.67.443 > 10.0.2.15.37866: Flags [P.], seq 292375:297871, ack 350, win 65535, length 5496
00:11:15.507437 IP 10.0.2.15.37866 > 151.101.117.67.443: Flags [.], ack 297871, win 65535, length 0
00:11:15.509621 IP 151.101.117.67.443 > 10.0.2.15.37866: Flags [P.], seq 297871:300619, ack 350, win 65535, length 2748
00:11:15.509627 IP 151.101.117.67.443 > 10.0.2.15.37866: Flags [P.], seq 300619:303367, ack 350, win 65535, length 2748
00:11:15.509631 IP 151.101.117.67.443 > 10.0.2.15.37866: Flags [P.], seq 303367:312985, ack 350, win 65535, length 9618
00:11:15.509704 IP 10.0.2.15.37866 > 151.101.117.67.443: Flags [.], ack 300619, win 65535, length 0
00:11:15.509755 IP 10.0.2.15.37866 > 151.101.117.67.443: Flags [.], ack 303367, win 65535, length 0
00:11:15.509770 IP 10.0.2.15.37866 > 151.101.117.67.443: Flags [.], ack 312985, win 65535, length 0
00:11:15.509813 IP 151.101.117.67.443 > 10.0.2.15.37866: Flags [P.], seq 312985:321229, ack 350, win 65535, length 8244
00:11:15.509814 IP 151.101.117.67.443 > 10.0.2.15.37866: Flags [P.], seq 321229:322603, ack 350, win 65535, length 1374
00:11:15.509821 IP 10.0.2.15.37866 > 151.101.117.67.443: Flags [.], ack 321229, win 65535, length 0
00:11:15.511839 IP 151.101.117.67.443 > 10.0.2.15.37866: Flags [P.], seq 322603:326725, ack 350, win 65535, length 4122
00:11:15.511860 IP 10.0.2.15.37866 > 151.101.117.67.443: Flags [.], ack 326725, win 65535, length 0
00:11:15.512004 IP 151.101.117.67.443 > 10.0.2.15.37866: Flags [.], seq 326725:339865, ack 350, win 65535, length 13140
00:11:15.512015 IP 10.0.2.15.37866 > 151.101.117.67.443: Flags [.], ack 339865, win 65535, length 0
00:11:15.512210 IP 151.101.117.67.443 > 10.0.2.15.37866: Flags [P.], seq 339865:352831, ack 350, win 65535, length 12966
00:11:15.512222 IP 10.0.2.15.37866 > 151.101.117.67.443: Flags [.], ack 352831, win 65535, length 0
00:11:15.512852 IP 151.101.117.67.443 > 10.0.2.15.37866: Flags [P.], seq 352831:358327, ack 350, win 65535, length 5496
00:11:15.512855 IP 151.101.117.67.443 > 10.0.2.15.37866: Flags [P.], seq 358327:362449, ack 350, win 65535, length 4122
00:11:15.512880 IP 10.0.2.15.37866 > 151.101.117.67.443: Flags [.], ack 358327, win 65535, length 0
00:11:15.512901 IP 10.0.2.15.37866 > 151.101.117.67.443: Flags [.], ack 362449, win 65535, length 0
00:11:15.513148 IP 151.101.117.67.443 > 10.0.2.15.37866: Flags [P.], seq 362449:365197, ack 350, win 65535, length 2748
00:11:15.513163 IP 10.0.2.15.37866 > 151.101.117.67.443: Flags [.], ack 365197, win 65535, length 0
00:11:15.513383 IP 151.101.117.67.443 > 10.0.2.15.37866: Flags [P.], seq 365197:367945, ack 350, win 65535, length 2748
00:11:15.513396 IP 10.0.2.15.37866 > 151.101.117.67.443: Flags [.], ack 367945, win 65535, length 0
00:11:15.513565 IP 151.101.117.67.443 > 10.0.2.15.37866: Flags [P.], seq 367945:372067, ack 350, win 65535, length 4122
00:11:15.513584 IP 10.0.2.15.37866 > 151.101.117.67.443: Flags [.], ack 372067, win 65535, length 0
00:11:15.513891 IP 151.101.117.67.443 > 10.0.2.15.37866: Flags [P.], seq 372067:373441, ack 350, win 65535, length 1374
00:11:15.513892 IP 151.101.117.67.443 > 10.0.2.15.37866: Flags [.], seq 373441:374901, ack 350, win 65535, length 1460
00:11:15.513906 IP 10.0.2.15.37866 > 151.101.117.67.443: Flags [.], ack 374901, win 65535, length 0
00:11:15.514065 IP 151.101.117.67.443 > 10.0.2.15.37866: Flags [P.], seq 374901:376189, ack 350, win 65535, length 1288
00:11:15.514379 IP 151.101.117.67.443 > 10.0.2.15.37866: Flags [P.], seq 376189:378937, ack 350, win 65535, length 2748
00:11:15.514380 IP 151.101.117.67.443 > 10.0.2.15.37866: Flags [P.], seq 378937:381685, ack 350, win 65535, length 2748
00:11:15.514392 IP 10.0.2.15.37866 > 151.101.117.67.443: Flags [.], ack 378937, win 65535, length 0
00:11:15.514411 IP 10.0.2.15.37866 > 151.101.117.67.443: Flags [.], ack 381685, win 65535, length 0
00:11:15.514644 IP 151.101.117.67.443 > 10.0.2.15.37866: Flags [P.], seq 381685:387181, ack 350, win 65535, length 5496
00:11:15.514655 IP 10.0.2.15.37866 > 151.101.117.67.443: Flags [.], ack 387181, win 65535, length 0
00:11:15.515150 IP 151.101.117.67.443 > 10.0.2.15.37866: Flags [P.], seq 387181:391303, ack 350, win 65535, length 4122
00:11:15.515161 IP 10.0.2.15.37866 > 151.101.117.67.443: Flags [.], ack 391303, win 65535, length 0
00:11:15.515396 IP 151.101.117.67.443 > 10.0.2.15.37866: Flags [P.], seq 391303:396799, ack 350, win 65535, length 5496
00:11:15.515406 IP 10.0.2.15.37866 > 151.101.117.67.443: Flags [.], ack 396799, win 65535, length 0
00:11:15.515518 IP 151.101.117.67.443 > 10.0.2.15.37866: Flags [.], seq 396799:398259, ack 350, win 65535, length 1460
00:11:15.515661 IP 151.101.117.67.443 > 10.0.2.15.37866: Flags [P.], seq 398259:400921, ack 350, win 65535, length 2662
00:11:15.515667 IP 10.0.2.15.37866 > 151.101.117.67.443: Flags [.], ack 400921, win 65535, length 0
00:11:15.515853 IP 151.101.117.67.443 > 10.0.2.15.37866: Flags [P.], seq 400921:402295, ack 350, win 65535, length 1374
00:11:15.515991 IP 151.101.117.67.443 > 10.0.2.15.37866: Flags [P.], seq 402295:405043, ack 350, win 65535, length 2748
00:11:15.515998 IP 10.0.2.15.37866 > 151.101.117.67.443: Flags [.], ack 405043, win 65535, length 0
00:11:15.517253 IP 151.101.117.67.443 > 10.0.2.15.37866: Flags [P.], seq 405043:409165, ack 350, win 65535, length 4122
00:11:15.517255 IP 151.101.117.67.443 > 10.0.2.15.37866: Flags [P.], seq 409165:411913, ack 350, win 65535, length 2748
00:11:15.517256 IP 151.101.117.67.443 > 10.0.2.15.37866: Flags [P.], seq 411913:416035, ack 350, win 65535, length 4122
00:11:15.517335 IP 10.0.2.15.37866 > 151.101.117.67.443: Flags [.], ack 409165, win 65535, length 0
00:11:15.517770 IP 10.0.2.15.37866 > 151.101.117.67.443: Flags [.], ack 411913, win 65535, length 0
00:11:15.517800 IP 10.0.2.15.37866 > 151.101.117.67.443: Flags [.], ack 416035, win 65535, length 0
00:11:15.517873 IP 151.101.117.67.443 > 10.0.2.15.37866: Flags [P.], seq 416035:418783, ack 350, win 65535, length 2748
00:11:15.517875 IP 151.101.117.67.443 > 10.0.2.15.37866: Flags [P.], seq 418783:422905, ack 350, win 65535, length 4122
00:11:15.517885 IP 10.0.2.15.37866 > 151.101.117.67.443: Flags [.], ack 418783, win 65535, length 0
00:11:15.517903 IP 10.0.2.15.37866 > 151.101.117.67.443: Flags [.], ack 422905, win 65535, length 0
00:11:15.518770 IP 151.101.117.67.443 > 10.0.2.15.37866: Flags [P.], seq 422905:425653, ack 350, win 65535, length 2748
00:11:15.518774 IP 151.101.117.67.443 > 10.0.2.15.37866: Flags [P.], seq 425653:428401, ack 350, win 65535, length 2748
00:11:15.518774 IP 151.101.117.67.443 > 10.0.2.15.37866: Flags [P.], seq 428401:431149, ack 350, win 65535, length 2748
00:11:15.518775 IP 151.101.117.67.443 > 10.0.2.15.37866: Flags [P.], seq 431149:435271, ack 350, win 65535, length 4122
00:11:15.518790 IP 10.0.2.15.37866 > 151.101.117.67.443: Flags [.], ack 425653, win 65535, length 0
00:11:15.518813 IP 10.0.2.15.37866 > 151.101.117.67.443: Flags [.], ack 428401, win 65535, length 0
00:11:15.518824 IP 10.0.2.15.37866 > 151.101.117.67.443: Flags [.], ack 431149, win 65535, length 0
00:11:15.518835 IP 10.0.2.15.37866 > 151.101.117.67.443: Flags [.], ack 435271, win 65535, length 0
00:11:15.519025 IP 151.101.117.67.443 > 10.0.2.15.37866: Flags [P.], seq 435271:438019, ack 350, win 65535, length 2748
00:11:15.519034 IP 10.0.2.15.37866 > 151.101.117.67.443: Flags [.], ack 438019, win 65535, length 0
00:11:15.519219 IP 151.101.117.67.443 > 10.0.2.15.37866: Flags [P.], seq 438019:442141, ack 350, win 65535, length 4122
00:11:15.519228 IP 10.0.2.15.37866 > 151.101.117.67.443: Flags [.], ack 442141, win 65535, length 0
00:11:15.519534 IP 151.101.117.67.443 > 10.0.2.15.37866: Flags [P.], seq 442141:443515, ack 350, win 65535, length 1374
00:11:15.520030 IP 151.101.117.67.443 > 10.0.2.15.37866: Flags [P.], seq 443515:446263, ack 350, win 65535, length 2748
00:11:15.520033 IP 151.101.117.67.443 > 10.0.2.15.37866: Flags [P.], seq 446263:451759, ack 350, win 65535, length 5496
00:11:15.520058 IP 10.0.2.15.37866 > 151.101.117.67.443: Flags [.], ack 446263, win 65535, length 0
00:11:15.520094 IP 10.0.2.15.37866 > 151.101.117.67.443: Flags [.], ack 451759, win 65535, length 0
00:11:15.520324 IP 151.101.117.67.443 > 10.0.2.15.37866: Flags [P.], seq 451759:455881, ack 350, win 65535, length 4122
00:11:15.520336 IP 10.0.2.15.37866 > 151.101.117.67.443: Flags [.], ack 455881, win 65535, length 0
00:11:15.520788 IP 151.101.117.67.443 > 10.0.2.15.37866: Flags [P.], seq 455881:457255, ack 350, win 65535, length 1374
00:11:15.530702 IP 151.101.117.67.443 > 10.0.2.15.37866: Flags [.], seq 457255:520035, ack 350, win 65535, length 62780
00:11:15.530732 IP 10.0.2.15.37866 > 151.101.117.67.443: Flags [.], ack 520035, win 65535, length 0
00:11:15.531258 IP 151.101.117.67.443 > 10.0.2.15.37866: Flags [P.], seq 520035:521495, ack 350, win 65535, length 1460
00:11:15.531261 IP 151.101.117.67.443 > 10.0.2.15.37866: Flags [.], seq 521495:522955, ack 350, win 65535, length 1460
00:11:15.531286 IP 10.0.2.15.37866 > 151.101.117.67.443: Flags [.], ack 522955, win 65535, length 0
00:11:15.531790 IP 151.101.117.67.443 > 10.0.2.15.37866: Flags [P.], seq 522955:568549, ack 350, win 65535, length 45594
00:11:15.531810 IP 10.0.2.15.37866 > 151.101.117.67.443: Flags [.], ack 568549, win 65535, length 0
00:11:15.532469 IP 151.101.117.67.443 > 10.0.2.15.37866: Flags [.], seq 568549:574389, ack 350, win 65535, length 5840
00:11:15.532498 IP 10.0.2.15.37866 > 151.101.117.67.443: Flags [.], ack 574389, win 65535, length 0
00:11:15.532793 IP 151.101.117.67.443 > 10.0.2.15.37866: Flags [P.], seq 574389:585037, ack 350, win 65535, length 10648
00:11:15.532810 IP 10.0.2.15.37866 > 151.101.117.67.443: Flags [.], ack 585037, win 65535, length 0
00:11:15.532962 IP 151.101.117.67.443 > 10.0.2.15.37866: Flags [P.], seq 585037:589159, ack 350, win 65535, length 4122
00:11:15.532964 IP 151.101.117.67.443 > 10.0.2.15.37866: Flags [.], seq 589159:592079, ack 350, win 65535, length 2920
00:11:15.532984 IP 10.0.2.15.37866 > 151.101.117.67.443: Flags [.], ack 589159, win 65535, length 0
00:11:15.533080 IP 10.0.2.15.37866 > 151.101.117.67.443: Flags [.], ack 592079, win 65535, length 0
00:11:15.533267 IP 151.101.117.67.443 > 10.0.2.15.37866: Flags [P.], seq 592079:593281, ack 350, win 65535, length 1202
00:11:15.533269 IP 151.101.117.67.443 > 10.0.2.15.37866: Flags [P.], seq 593281:597403, ack 350, win 65535, length 4122
00:11:15.533284 IP 10.0.2.15.37866 > 151.101.117.67.443: Flags [.], ack 597403, win 65535, length 0
00:11:15.551706 IP 151.101.117.67.443 > 10.0.2.15.37866: Flags [.], seq 597403:632443, ack 350, win 65535, length 35040
00:11:15.551730 IP 10.0.2.15.37866 > 151.101.117.67.443: Flags [.], ack 632443, win 65535, length 0
00:11:15.552532 IP 151.101.117.67.443 > 10.0.2.15.37866: Flags [P.], seq 632443:655111, ack 350, win 65535, length 22668
00:11:15.552545 IP 10.0.2.15.37866 > 151.101.117.67.443: Flags [.], ack 655111, win 65535, length 0
00:11:15.552611 IP 151.101.117.67.443 > 10.0.2.15.37866: Flags [P.], seq 655111:697451, ack 350, win 65535, length 42340
00:11:15.552615 IP 10.0.2.15.37866 > 151.101.117.67.443: Flags [.], ack 697451, win 65535, length 0
00:11:15.553451 IP 151.101.117.67.443 > 10.0.2.15.37866: Flags [.], seq 697451:726651, ack 350, win 65535, length 29200
00:11:15.553730 IP 151.101.117.67.443 > 10.0.2.15.37866: Flags [.], seq 726651:742711, ack 350, win 65535, length 16060
00:11:15.553828 IP 151.101.117.67.443 > 10.0.2.15.37866: Flags [.], seq 742711:758771, ack 350, win 65535, length 16060
00:11:15.553973 IP 151.101.117.67.443 > 10.0.2.15.37866: Flags [.], seq 758771:761691, ack 350, win 65535, length 2920
00:11:15.554216 IP 10.0.2.15.37866 > 151.101.117.67.443: Flags [.], ack 761691, win 65535, length 0
00:11:15.554802 IP 151.101.117.67.443 > 10.0.2.15.37866: Flags [P.], seq 761691:763151, ack 350, win 65535, length 1460
00:11:15.555250 IP 151.101.117.67.443 > 10.0.2.15.37866: Flags [.], seq 763151:780671, ack 350, win 65535, length 17520
00:11:15.555830 IP 151.101.117.67.443 > 10.0.2.15.37866: Flags [.], seq 780671:825931, ack 350, win 65535, length 45260
00:11:15.557552 IP 10.0.2.15.37866 > 151.101.117.67.443: Flags [.], ack 825931, win 65535, length 0
00:11:15.558083 IP 151.101.117.67.443 > 10.0.2.15.37866: Flags [P.], seq 825931:827391, ack 350, win 65535, length 1460
00:11:15.558088 IP 151.101.117.67.443 > 10.0.2.15.37866: Flags [.], seq 827391:836151, ack 350, win 65535, length 8760
00:11:15.558675 IP 151.101.117.67.443 > 10.0.2.15.37866: Flags [P.], seq 836151:888691, ack 350, win 65535, length 52540
00:11:15.558766 IP 10.0.2.15.37866 > 151.101.117.67.443: Flags [.], ack 888691, win 65535, length 0
00:11:15.559310 IP 151.101.117.67.443 > 10.0.2.15.37866: Flags [P.], seq 888691:899683, ack 350, win 65535, length 10992
00:11:15.559327 IP 10.0.2.15.37866 > 151.101.117.67.443: Flags [.], ack 899683, win 65535, length 0
00:11:15.560199 IP 151.101.117.67.443 > 10.0.2.15.37866: Flags [P.], seq 899683:905179, ack 350, win 65535, length 5496
00:11:15.560219 IP 10.0.2.15.37866 > 151.101.117.67.443: Flags [.], ack 905179, win 65535, length 0
00:11:15.560553 IP 151.101.117.67.443 > 10.0.2.15.37866: Flags [P.], seq 905179:910675, ack 350, win 65535, length 5496
00:11:15.560568 IP 10.0.2.15.37866 > 151.101.117.67.443: Flags [.], ack 910675, win 65535, length 0
00:11:15.561575 IP 151.101.117.67.443 > 10.0.2.15.37866: Flags [P.], seq 910675:916171, ack 350, win 65535, length 5496
00:11:15.561578 IP 151.101.117.67.443 > 10.0.2.15.37866: Flags [P.], seq 916171:920293, ack 350, win 65535, length 4122
00:11:15.561581 IP 151.101.117.67.443 > 10.0.2.15.37866: Flags [P.], seq 920293:924415, ack 350, win 65535, length 4122
00:11:15.561687 IP 10.0.2.15.37866 > 151.101.117.67.443: Flags [.], ack 916171, win 65535, length 0
00:11:15.561722 IP 10.0.2.15.37866 > 151.101.117.67.443: Flags [.], ack 920293, win 65535, length 0
00:11:15.561734 IP 10.0.2.15.37866 > 151.101.117.67.443: Flags [.], ack 924415, win 65535, length 0
00:11:15.561760 IP 151.101.117.67.443 > 10.0.2.15.37866: Flags [P.], seq 924415:928537, ack 350, win 65535, length 4122
00:11:15.561766 IP 10.0.2.15.37866 > 151.101.117.67.443: Flags [.], ack 928537, win 65535, length 0
00:11:15.562031 IP 151.101.117.67.443 > 10.0.2.15.37866: Flags [P.], seq 928537:932659, ack 350, win 65535, length 4122
00:11:15.562110 IP 10.0.2.15.37866 > 151.101.117.67.443: Flags [.], ack 932659, win 65535, length 0
00:11:15.562471 IP 151.101.117.67.443 > 10.0.2.15.37866: Flags [P.], seq 932659:934033, ack 350, win 65535, length 1374
00:11:15.562474 IP 151.101.117.67.443 > 10.0.2.15.37866: Flags [P.], seq 934033:938155, ack 350, win 65535, length 4122
00:11:15.562876 IP 151.101.117.67.443 > 10.0.2.15.37866: Flags [P.], seq 938155:942277, ack 350, win 65535, length 4122
00:11:15.563179 IP 151.101.117.67.443 > 10.0.2.15.37866: Flags [P.], seq 942277:945025, ack 350, win 65535, length 2748
00:11:15.563325 IP 151.101.117.67.443 > 10.0.2.15.37866: Flags [P.], seq 945025:950521, ack 350, win 65535, length 5496
00:11:15.563345 IP 10.0.2.15.37866 > 151.101.117.67.443: Flags [.], ack 942277, win 65535, length 0
00:11:15.563390 IP 10.0.2.15.37866 > 151.101.117.67.443: Flags [.], ack 950521, win 65535, length 0
00:11:15.563500 IP 151.101.117.67.443 > 10.0.2.15.37866: Flags [P.], seq 950521:951895, ack 350, win 65535, length 1374

