19:28:35.296189 IP 10.0.2.15.47827 > 140.233.253.2.53: 16756+ A? www.cnn.com. (29)
19:28:35.296229 IP 10.0.2.15.47827 > 140.233.253.2.53: 21373+ AAAA? www.cnn.com. (29)
19:28:35.301958 IP 140.233.253.2.53 > 10.0.2.15.47827: 16756 2/0/0 CNAME turner-tls.map.fastly.net., A 151.101.117.67 (84)
19:28:35.302328 IP 140.233.253.2.53 > 10.0.2.15.47827: 21373 2/0/0 CNAME turner-tls.map.fastly.net., AAAA 2a04:4e42:1c::323 (96)
19:28:35.302989 IP 10.0.2.15.37998 > 151.101.117.67.443: Flags [S], seq 696962857, win 64240, options [mss 1460,sackOK,TS val 1396634276 ecr 0,nop,wscale 6], length 0
19:28:35.319246 IP 151.101.117.67.443 > 10.0.2.15.37998: Flags [S.], seq 167168001, ack 696962858, win 65535, options [mss 1460], length 0
19:28:35.319289 IP 10.0.2.15.37998 > 151.101.117.67.443: Flags [.], ack 1, win 64240, length 0
19:28:35.330277 IP 10.0.2.15.37998 > 151.101.117.67.443: Flags [P.], seq 1:518, ack 1, win 64240, length 517
19:28:35.330539 IP 151.101.117.67.443 > 10.0.2.15.37998: Flags [.], ack 518, win 65535, length 0
19:28:35.349267 IP 151.101.117.67.443 > 10.0.2.15.37998: Flags [.], seq 1:2921, ack 518, win 65535, length 2920
19:28:35.349293 IP 10.0.2.15.37998 > 151.101.117.67.443: Flags [.], ack 2921, win 62780, length 0
19:28:35.349552 IP 151.101.117.67.443 > 10.0.2.15.37998: Flags [P.], seq 2921:4123, ack 518, win 65535, length 1202
19:28:35.349571 IP 10.0.2.15.37998 > 151.101.117.67.443: Flags [.], ack 4123, win 61578, length 0
19:28:35.349947 IP 151.101.117.67.443 > 10.0.2.15.37998: Flags [P.], seq 4123:5064, ack 518, win 65535, length 941
19:28:35.349959 IP 10.0.2.15.37998 > 151.101.117.67.443: Flags [.], ack 5064, win 61320, length 0
19:28:35.352236 IP 10.0.2.15.37998 > 151.101.117.67.443: Flags [P.], seq 518:611, ack 5064, win 62780, length 93
19:28:35.352707 IP 151.101.117.67.443 > 10.0.2.15.37998: Flags [.], ack 611, win 65535, length 0
19:28:35.366380 IP 151.101.117.67.443 > 10.0.2.15.37998: Flags [P.], seq 5064:5115, ack 611, win 65535, length 51
19:28:35.366402 IP 10.0.2.15.37998 > 151.101.117.67.443: Flags [.], ack 5115, win 62780, length 0
19:28:35.366899 IP 10.0.2.15.37998 > 151.101.117.67.443: Flags [P.], seq 611:664, ack 5115, win 62780, length 53
19:28:35.366937 IP 10.0.2.15.37998 > 151.101.117.67.443: Flags [P.], seq 664:720, ack 5115, win 62780, length 56
19:28:35.367268 IP 151.101.117.67.443 > 10.0.2.15.37998: Flags [.], ack 664, win 65535, length 0
19:28:35.367270 IP 151.101.117.67.443 > 10.0.2.15.37998: Flags [.], ack 720, win 65535, length 0
19:28:35.367291 IP 10.0.2.15.37998 > 151.101.117.67.443: Flags [P.], seq 720:829, ack 5115, win 62780, length 109
19:28:35.367688 IP 151.101.117.67.443 > 10.0.2.15.37998: Flags [.], ack 829, win 65535, length 0
19:28:35.381111 IP 151.101.117.67.443 > 10.0.2.15.37998: Flags [P.], seq 5115:5210, ack 829, win 65535, length 95
19:28:35.381458 IP 10.0.2.15.37998 > 151.101.117.67.443: Flags [.], ack 5210, win 62780, length 0
19:28:35.382087 IP 10.0.2.15.37998 > 151.101.117.67.443: Flags [P.], seq 829:867, ack 5210, win 62780, length 38
19:28:35.382396 IP 151.101.117.67.443 > 10.0.2.15.37998: Flags [.], ack 867, win 65535, length 0
19:28:35.384302 IP 151.101.117.67.443 > 10.0.2.15.37998: Flags [P.], seq 5210:6584, ack 867, win 65535, length 1374
19:28:35.385347 IP 151.101.117.67.443 > 10.0.2.15.37998: Flags [P.], seq 6584:10706, ack 867, win 65535, length 4122
19:28:35.385350 IP 151.101.117.67.443 > 10.0.2.15.37998: Flags [P.], seq 10706:12080, ack 867, win 65535, length 1374
19:28:35.386377 IP 151.101.117.67.443 > 10.0.2.15.37998: Flags [.], seq 12080:15000, ack 867, win 65535, length 2920
19:28:35.386861 IP 10.0.2.15.37998 > 151.101.117.67.443: Flags [.], ack 15000, win 58400, length 0
19:28:35.387121 IP 151.101.117.67.443 > 10.0.2.15.37998: Flags [P.], seq 15000:17576, ack 867, win 65535, length 2576
19:28:35.387190 IP 10.0.2.15.37998 > 151.101.117.67.443: Flags [.], ack 17576, win 55824, length 0
19:28:35.387925 IP 151.101.117.67.443 > 10.0.2.15.37998: Flags [P.], seq 17576:20324, ack 867, win 65535, length 2748
19:28:35.387942 IP 10.0.2.15.37998 > 151.101.117.67.443: Flags [.], ack 20324, win 62780, length 0
19:28:35.389813 IP 151.101.117.67.443 > 10.0.2.15.37998: Flags [P.], seq 20324:25820, ack 867, win 65535, length 5496
19:28:35.389816 IP 151.101.117.67.443 > 10.0.2.15.37998: Flags [P.], seq 25820:28568, ack 867, win 65535, length 2748
19:28:35.389886 IP 10.0.2.15.37998 > 151.101.117.67.443: Flags [.], ack 28568, win 58400, length 0
19:28:35.391234 IP 151.101.117.67.443 > 10.0.2.15.37998: Flags [P.], seq 28568:32690, ack 867, win 65535, length 4122
19:28:35.391253 IP 10.0.2.15.37998 > 151.101.117.67.443: Flags [.], ack 32690, win 61320, length 0
19:28:35.393775 IP 151.101.117.67.443 > 10.0.2.15.37998: Flags [P.], seq 32690:36812, ack 867, win 65535, length 4122
19:28:35.393778 IP 151.101.117.67.443 > 10.0.2.15.37998: Flags [P.], seq 36812:39560, ack 867, win 65535, length 2748
19:28:35.393921 IP 10.0.2.15.37998 > 151.101.117.67.443: Flags [.], ack 39560, win 56940, length 0
19:28:35.394517 IP 151.101.117.67.443 > 10.0.2.15.37998: Flags [P.], seq 39560:45056, ack 867, win 65535, length 5496
19:28:35.394518 IP 151.101.117.67.443 > 10.0.2.15.37998: Flags [P.], seq 45056:46430, ack 867, win 65535, length 1374
19:28:35.394531 IP 10.0.2.15.37998 > 151.101.117.67.443: Flags [.], ack 45056, win 61320, length 0
19:28:35.395678 IP 151.101.117.67.443 > 10.0.2.15.37998: Flags [P.], seq 46430:47804, ack 867, win 65535, length 1374
19:28:35.395694 IP 10.0.2.15.37998 > 151.101.117.67.443: Flags [.], ack 47804, win 63204, length 0
19:28:35.396472 IP 151.101.117.67.443 > 10.0.2.15.37998: Flags [P.], seq 47804:49178, ack 867, win 65535, length 1374
19:28:35.397580 IP 151.101.117.67.443 > 10.0.2.15.37998: Flags [P.], seq 49178:51926, ack 867, win 65535, length 2748
19:28:35.397595 IP 10.0.2.15.37998 > 151.101.117.67.443: Flags [.], ack 51926, win 63204, length 0
19:28:35.398652 IP 151.101.117.67.443 > 10.0.2.15.37998: Flags [P.], seq 51926:56048, ack 867, win 65535, length 4122
19:28:35.398655 IP 151.101.117.67.443 > 10.0.2.15.37998: Flags [P.], seq 56048:57422, ack 867, win 65535, length 1374
19:28:35.398859 IP 10.0.2.15.37998 > 151.101.117.67.443: Flags [.], ack 57422, win 61320, length 0
19:28:35.399759 IP 151.101.117.67.443 > 10.0.2.15.37998: Flags [P.], seq 57422:62918, ack 867, win 65535, length 5496
19:28:35.399819 IP 10.0.2.15.37998 > 151.101.117.67.443: Flags [.], ack 62918, win 61320, length 0
19:28:35.400009 IP 151.101.117.67.443 > 10.0.2.15.37998: Flags [P.], seq 62918:65666, ack 867, win 65535, length 2748
19:28:35.400016 IP 10.0.2.15.37998 > 151.101.117.67.443: Flags [.], ack 65666, win 62780, length 0
19:28:35.400932 IP 151.101.117.67.443 > 10.0.2.15.37998: Flags [P.], seq 65666:69788, ack 867, win 65535, length 4122
19:28:35.401090 IP 151.101.117.67.443 > 10.0.2.15.37998: Flags [P.], seq 69788:71162, ack 867, win 65535, length 1374
19:28:35.401284 IP 10.0.2.15.37998 > 151.101.117.67.443: Flags [.], ack 71162, win 62780, length 0
19:28:35.402161 IP 151.101.117.67.443 > 10.0.2.15.37998: Flags [P.], seq 71162:76658, ack 867, win 65535, length 5496
19:28:35.402164 IP 151.101.117.67.443 > 10.0.2.15.37998: Flags [P.], seq 76658:79406, ack 867, win 65535, length 2748
19:28:35.402182 IP 10.0.2.15.37998 > 151.101.117.67.443: Flags [.], ack 76658, win 65535, length 0
19:28:35.402213 IP 10.0.2.15.37998 > 151.101.117.67.443: Flags [.], ack 79406, win 65535, length 0
19:28:35.402345 IP 151.101.117.67.443 > 10.0.2.15.37998: Flags [P.], seq 79406:80780, ack 867, win 65535, length 1374
19:28:35.403439 IP 151.101.117.67.443 > 10.0.2.15.37998: Flags [P.], seq 80780:84902, ack 867, win 65535, length 4122
19:28:35.403441 IP 151.101.117.67.443 > 10.0.2.15.37998: Flags [P.], seq 84902:87650, ack 867, win 65535, length 2748
19:28:35.403441 IP 151.101.117.67.443 > 10.0.2.15.37998: Flags [P.], seq 87650:89024, ack 867, win 65535, length 1374
19:28:35.403459 IP 10.0.2.15.37998 > 151.101.117.67.443: Flags [.], ack 84902, win 65535, length 0
19:28:35.403484 IP 10.0.2.15.37998 > 151.101.117.67.443: Flags [.], ack 87650, win 65535, length 0
19:28:35.404890 IP 151.101.117.67.443 > 10.0.2.15.37998: Flags [P.], seq 89024:94520, ack 867, win 65535, length 5496
19:28:35.404892 IP 151.101.117.67.443 > 10.0.2.15.37998: Flags [P.], seq 94520:97268, ack 867, win 65535, length 2748
19:28:35.404893 IP 151.101.117.67.443 > 10.0.2.15.37998: Flags [.], seq 97268:98728, ack 867, win 65535, length 1460
19:28:35.404915 IP 10.0.2.15.37998 > 151.101.117.67.443: Flags [.], ack 94520, win 65535, length 0
19:28:35.404946 IP 10.0.2.15.37998 > 151.101.117.67.443: Flags [.], ack 97268, win 65535, length 0
19:28:35.405214 IP 151.101.117.67.443 > 10.0.2.15.37998: Flags [P.], seq 98728:102764, ack 867, win 65535, length 4036
19:28:35.405215 IP 151.101.117.67.443 > 10.0.2.15.37998: Flags [P.], seq 102764:105512, ack 867, win 65535, length 2748
19:28:35.405223 IP 10.0.2.15.37998 > 151.101.117.67.443: Flags [.], ack 102764, win 65535, length 0
19:28:35.405241 IP 10.0.2.15.37998 > 151.101.117.67.443: Flags [.], ack 105512, win 65535, length 0
19:28:35.405974 IP 151.101.117.67.443 > 10.0.2.15.37998: Flags [P.], seq 105512:109634, ack 867, win 65535, length 4122
19:28:35.405990 IP 10.0.2.15.37998 > 151.101.117.67.443: Flags [.], ack 109634, win 65535, length 0
19:28:35.406248 IP 151.101.117.67.443 > 10.0.2.15.37998: Flags [P.], seq 109634:115130, ack 867, win 65535, length 5496
19:28:35.406262 IP 10.0.2.15.37998 > 151.101.117.67.443: Flags [.], ack 115130, win 65535, length 0
19:28:35.406968 IP 151.101.117.67.443 > 10.0.2.15.37998: Flags [P.], seq 115130:120626, ack 867, win 65535, length 5496
19:28:35.407096 IP 10.0.2.15.37998 > 151.101.117.67.443: Flags [.], ack 120626, win 65535, length 0
19:28:35.407958 IP 151.101.117.67.443 > 10.0.2.15.37998: Flags [P.], seq 120626:126122, ack 867, win 65535, length 5496
19:28:35.407972 IP 10.0.2.15.37998 > 151.101.117.67.443: Flags [.], ack 126122, win 65535, length 0
19:28:35.409507 IP 151.101.117.67.443 > 10.0.2.15.37998: Flags [P.], seq 126122:132992, ack 867, win 65535, length 6870
19:28:35.409554 IP 151.101.117.67.443 > 10.0.2.15.37998: Flags [P.], seq 132992:135740, ack 867, win 65535, length 2748
19:28:35.409657 IP 10.0.2.15.37998 > 151.101.117.67.443: Flags [.], ack 132992, win 65535, length 0
19:28:35.409844 IP 10.0.2.15.37998 > 151.101.117.67.443: Flags [.], ack 135740, win 65535, length 0
19:28:35.411372 IP 151.101.117.67.443 > 10.0.2.15.37998: Flags [P.], seq 135740:137114, ack 867, win 65535, length 1374
19:28:35.411375 IP 151.101.117.67.443 > 10.0.2.15.37998: Flags [P.], seq 137114:142610, ack 867, win 65535, length 5496
19:28:35.411375 IP 151.101.117.67.443 > 10.0.2.15.37998: Flags [P.], seq 142610:143984, ack 867, win 65535, length 1374
19:28:35.411503 IP 10.0.2.15.37998 > 151.101.117.67.443: Flags [.], ack 142610, win 65535, length 0
19:28:35.411828 IP 151.101.117.67.443 > 10.0.2.15.37998: Flags [P.], seq 143984:148106, ack 867, win 65535, length 4122
19:28:35.411846 IP 10.0.2.15.37998 > 151.101.117.67.443: Flags [.], ack 148106, win 65535, length 0
19:28:35.412711 IP 151.101.117.67.443 > 10.0.2.15.37998: Flags [P.], seq 148106:153602, ack 867, win 65535, length 5496
19:28:35.412713 IP 151.101.117.67.443 > 10.0.2.15.37998: Flags [P.], seq 153602:154976, ack 867, win 65535, length 1374
19:28:35.412729 IP 10.0.2.15.37998 > 151.101.117.67.443: Flags [.], ack 153602, win 65535, length 0
19:28:35.413336 IP 151.101.117.67.443 > 10.0.2.15.37998: Flags [P.], seq 154976:159098, ack 867, win 65535, length 4122
19:28:35.413338 IP 151.101.117.67.443 > 10.0.2.15.37998: Flags [P.], seq 159098:161846, ack 867, win 65535, length 2748
19:28:35.413339 IP 151.101.117.67.443 > 10.0.2.15.37998: Flags [P.], seq 161846:164594, ack 867, win 65535, length 2748
19:28:35.413339 IP 151.101.117.67.443 > 10.0.2.15.37998: Flags [P.], seq 164594:165968, ack 867, win 65535, length 1374
19:28:35.413354 IP 10.0.2.15.37998 > 151.101.117.67.443: Flags [.], ack 159098, win 65535, length 0
19:28:35.413435 IP 10.0.2.15.37998 > 151.101.117.67.443: Flags [.], ack 161846, win 65535, length 0
19:28:35.413446 IP 10.0.2.15.37998 > 151.101.117.67.443: Flags [.], ack 164594, win 65535, length 0
19:28:35.413463 IP 151.101.117.67.443 > 10.0.2.15.37998: Flags [P.], seq 165968:167342, ack 867, win 65535, length 1374
19:28:35.413466 IP 10.0.2.15.37998 > 151.101.117.67.443: Flags [.], ack 167342, win 65535, length 0
19:28:35.415096 IP 151.101.117.67.443 > 10.0.2.15.37998: Flags [P.], seq 167342:170090, ack 867, win 65535, length 2748
19:28:35.415382 IP 10.0.2.15.37998 > 151.101.117.67.443: Flags [.], ack 170090, win 65535, length 0
19:28:35.415683 IP 151.101.117.67.443 > 10.0.2.15.37998: Flags [P.], seq 170090:176960, ack 867, win 65535, length 6870
19:28:35.415724 IP 10.0.2.15.37998 > 151.101.117.67.443: Flags [.], ack 176960, win 65535, length 0
19:28:35.415921 IP 151.101.117.67.443 > 10.0.2.15.37998: Flags [P.], seq 176960:181082, ack 867, win 65535, length 4122
19:28:35.415922 IP 151.101.117.67.443 > 10.0.2.15.37998: Flags [P.], seq 181082:182456, ack 867, win 65535, length 1374
19:28:35.415932 IP 10.0.2.15.37998 > 151.101.117.67.443: Flags [.], ack 181082, win 65535, length 0
19:28:35.416874 IP 151.101.117.67.443 > 10.0.2.15.37998: Flags [P.], seq 182456:187952, ack 867, win 65535, length 5496
19:28:35.416875 IP 151.101.117.67.443 > 10.0.2.15.37998: Flags [P.], seq 187952:189326, ack 867, win 65535, length 1374
19:28:35.416895 IP 10.0.2.15.37998 > 151.101.117.67.443: Flags [.], ack 187952, win 65535, length 0
19:28:35.418053 IP 151.101.117.67.443 > 10.0.2.15.37998: Flags [P.], seq 189326:193448, ack 867, win 65535, length 4122
19:28:35.418055 IP 151.101.117.67.443 > 10.0.2.15.37998: Flags [P.], seq 193448:196196, ack 867, win 65535, length 2748
19:28:35.418055 IP 151.101.117.67.443 > 10.0.2.15.37998: Flags [P.], seq 196196:198944, ack 867, win 65535, length 2748
19:28:35.418108 IP 10.0.2.15.37998 > 151.101.117.67.443: Flags [.], ack 193448, win 65535, length 0
19:28:35.418165 IP 10.0.2.15.37998 > 151.101.117.67.443: Flags [.], ack 196196, win 65535, length 0
19:28:35.418180 IP 10.0.2.15.37998 > 151.101.117.67.443: Flags [.], ack 198944, win 65535, length 0
19:28:35.418496 IP 151.101.117.67.443 > 10.0.2.15.37998: Flags [P.], seq 198944:203066, ack 867, win 65535, length 4122
19:28:35.418497 IP 151.101.117.67.443 > 10.0.2.15.37998: Flags [P.], seq 203066:208562, ack 867, win 65535, length 5496
19:28:35.418507 IP 10.0.2.15.37998 > 151.101.117.67.443: Flags [.], ack 203066, win 65535, length 0
19:28:35.418590 IP 10.0.2.15.37998 > 151.101.117.67.443: Flags [.], ack 208562, win 65535, length 0
19:28:35.418729 IP 151.101.117.67.443 > 10.0.2.15.37998: Flags [P.], seq 208562:215432, ack 867, win 65535, length 6870
19:28:35.418737 IP 10.0.2.15.37998 > 151.101.117.67.443: Flags [.], ack 215432, win 65535, length 0
19:28:35.418897 IP 151.101.117.67.443 > 10.0.2.15.37998: Flags [P.], seq 215432:218180, ack 867, win 65535, length 2748
19:28:35.418906 IP 10.0.2.15.37998 > 151.101.117.67.443: Flags [.], ack 218180, win 65535, length 0
19:28:35.421545 IP 151.101.117.67.443 > 10.0.2.15.37998: Flags [P.], seq 218180:229172, ack 867, win 65535, length 10992
19:28:35.421610 IP 10.0.2.15.37998 > 151.101.117.67.443: Flags [.], ack 229172, win 65535, length 0
19:28:35.421655 IP 151.101.117.67.443 > 10.0.2.15.37998: Flags [P.], seq 229172:231920, ack 867, win 65535, length 2748
19:28:35.421657 IP 151.101.117.67.443 > 10.0.2.15.37998: Flags [P.], seq 231920:237416, ack 867, win 65535, length 5496
19:28:35.421657 IP 151.101.117.67.443 > 10.0.2.15.37998: Flags [P.], seq 237416:241538, ack 867, win 65535, length 4122
19:28:35.421667 IP 10.0.2.15.37998 > 151.101.117.67.443: Flags [.], ack 231920, win 65535, length 0
19:28:35.421678 IP 10.0.2.15.37998 > 151.101.117.67.443: Flags [.], ack 237416, win 65535, length 0
19:28:35.421687 IP 10.0.2.15.37998 > 151.101.117.67.443: Flags [.], ack 241538, win 65535, length 0
19:28:35.421700 IP 151.101.117.67.443 > 10.0.2.15.37998: Flags [P.], seq 241538:244286, ack 867, win 65535, length 2748
19:28:35.421701 IP 151.101.117.67.443 > 10.0.2.15.37998: Flags [P.], seq 244286:245660, ack 867, win 65535, length 1374
19:28:35.421704 IP 10.0.2.15.37998 > 151.101.117.67.443: Flags [.], ack 244286, win 65535, length 0
19:28:35.423763 IP 151.101.117.67.443 > 10.0.2.15.37998: Flags [P.], seq 245660:252530, ack 867, win 65535, length 6870
19:28:35.423768 IP 151.101.117.67.443 > 10.0.2.15.37998: Flags [P.], seq 252530:256652, ack 867, win 65535, length 4122
19:28:35.423791 IP 10.0.2.15.37998 > 151.101.117.67.443: Flags [.], ack 252530, win 65535, length 0
19:28:35.423823 IP 10.0.2.15.37998 > 151.101.117.67.443: Flags [.], ack 256652, win 65535, length 0
19:28:35.423841 IP 151.101.117.67.443 > 10.0.2.15.37998: Flags [P.], seq 256652:259400, ack 867, win 65535, length 2748
19:28:35.423842 IP 151.101.117.67.443 > 10.0.2.15.37998: Flags [P.], seq 259400:262148, ack 867, win 65535, length 2748
19:28:35.423843 IP 151.101.117.67.443 > 10.0.2.15.37998: Flags [P.], seq 262148:264896, ack 867, win 65535, length 2748
19:28:35.423844 IP 151.101.117.67.443 > 10.0.2.15.37998: Flags [P.], seq 264896:267644, ack 867, win 65535, length 2748
19:28:35.423849 IP 10.0.2.15.37998 > 151.101.117.67.443: Flags [.], ack 259400, win 65535, length 0
19:28:35.423858 IP 10.0.2.15.37998 > 151.101.117.67.443: Flags [.], ack 262148, win 65535, length 0
19:28:35.423866 IP 10.0.2.15.37998 > 151.101.117.67.443: Flags [.], ack 264896, win 65535, length 0
19:28:35.423907 IP 10.0.2.15.37998 > 151.101.117.67.443: Flags [.], ack 267644, win 65535, length 0
19:28:35.423937 IP 151.101.117.67.443 > 10.0.2.15.37998: Flags [P.], seq 267644:270392, ack 867, win 65535, length 2748
19:28:35.423938 IP 151.101.117.67.443 > 10.0.2.15.37998: Flags [P.], seq 270392:274514, ack 867, win 65535, length 4122
19:28:35.423938 IP 151.101.117.67.443 > 10.0.2.15.37998: Flags [P.], seq 274514:275888, ack 867, win 65535, length 1374
19:28:35.423939 IP 151.101.117.67.443 > 10.0.2.15.37998: Flags [P.], seq 275888:280010, ack 867, win 65535, length 4122
19:28:35.423946 IP 10.0.2.15.37998 > 151.101.117.67.443: Flags [.], ack 270392, win 65535, length 0
19:28:35.423958 IP 10.0.2.15.37998 > 151.101.117.67.443: Flags [.], ack 274514, win 65535, length 0
19:28:35.423970 IP 10.0.2.15.37998 > 151.101.117.67.443: Flags [.], ack 280010, win 65535, length 0
19:28:35.425127 IP 151.101.117.67.443 > 10.0.2.15.37998: Flags [P.], seq 280010:284132, ack 867, win 65535, length 4122
19:28:35.425183 IP 10.0.2.15.37998 > 151.101.117.67.443: Flags [.], ack 284132, win 65535, length 0
19:28:35.426917 IP 151.101.117.67.443 > 10.0.2.15.37998: Flags [P.], seq 284132:291002, ack 867, win 65535, length 6870
19:28:35.426919 IP 151.101.117.67.443 > 10.0.2.15.37998: Flags [P.], seq 291002:295124, ack 867, win 65535, length 4122
19:28:35.426937 IP 10.0.2.15.37998 > 151.101.117.67.443: Flags [.], ack 291002, win 65535, length 0
19:28:35.426969 IP 10.0.2.15.37998 > 151.101.117.67.443: Flags [.], ack 295124, win 65535, length 0
19:28:35.426988 IP 151.101.117.67.443 > 10.0.2.15.37998: Flags [P.], seq 295124:296498, ack 867, win 65535, length 1374
19:28:35.427946 IP 151.101.117.67.443 > 10.0.2.15.37998: Flags [P.], seq 296498:304742, ack 867, win 65535, length 8244
19:28:35.427948 IP 151.101.117.67.443 > 10.0.2.15.37998: Flags [P.], seq 304742:307490, ack 867, win 65535, length 2748
19:28:35.428014 IP 10.0.2.15.37998 > 151.101.117.67.443: Flags [.], ack 304742, win 65535, length 0
19:28:35.428126 IP 10.0.2.15.37998 > 151.101.117.67.443: Flags [.], ack 307490, win 65535, length 0
19:28:35.428261 IP 151.101.117.67.443 > 10.0.2.15.37998: Flags [P.], seq 307490:310238, ack 867, win 65535, length 2748
19:28:35.428263 IP 151.101.117.67.443 > 10.0.2.15.37998: Flags [P.], seq 310238:312986, ack 867, win 65535, length 2748
19:28:35.428263 IP 151.101.117.67.443 > 10.0.2.15.37998: Flags [P.], seq 312986:315734, ack 867, win 65535, length 2748
19:28:35.428264 IP 151.101.117.67.443 > 10.0.2.15.37998: Flags [P.], seq 315734:318482, ack 867, win 65535, length 2748
19:28:35.428276 IP 10.0.2.15.37998 > 151.101.117.67.443: Flags [.], ack 310238, win 65535, length 0
19:28:35.428295 IP 10.0.2.15.37998 > 151.101.117.67.443: Flags [.], ack 312986, win 65535, length 0
19:28:35.428306 IP 10.0.2.15.37998 > 151.101.117.67.443: Flags [.], ack 315734, win 65535, length 0
19:28:35.428314 IP 10.0.2.15.37998 > 151.101.117.67.443: Flags [.], ack 318482, win 65535, length 0
19:28:35.428408 IP 151.101.117.67.443 > 10.0.2.15.37998: Flags [P.], seq 318482:321230, ack 867, win 65535, length 2748
19:28:35.428410 IP 151.101.117.67.443 > 10.0.2.15.37998: Flags [P.], seq 321230:323978, ack 867, win 65535, length 2748
19:28:35.428410 IP 151.101.117.67.443 > 10.0.2.15.37998: Flags [P.], seq 323978:326726, ack 867, win 65535, length 2748
19:28:35.428422 IP 10.0.2.15.37998 > 151.101.117.67.443: Flags [.], ack 321230, win 65535, length 0
19:28:35.428480 IP 10.0.2.15.37998 > 151.101.117.67.443: Flags [.], ack 323978, win 65535, length 0
19:28:35.428495 IP 10.0.2.15.37998 > 151.101.117.67.443: Flags [.], ack 326726, win 65535, length 0
19:28:35.428717 IP 151.101.117.67.443 > 10.0.2.15.37998: Flags [P.], seq 326726:329474, ack 867, win 65535, length 2748
19:28:35.428724 IP 10.0.2.15.37998 > 151.101.117.67.443: Flags [.], ack 329474, win 65535, length 0
19:28:35.429689 IP 151.101.117.67.443 > 10.0.2.15.37998: Flags [P.], seq 329474:334970, ack 867, win 65535, length 5496
19:28:35.429787 IP 10.0.2.15.37998 > 151.101.117.67.443: Flags [.], ack 334970, win 65535, length 0
19:28:35.430110 IP 151.101.117.67.443 > 10.0.2.15.37998: Flags [P.], seq 334970:340466, ack 867, win 65535, length 5496
19:28:35.430112 IP 151.101.117.67.443 > 10.0.2.15.37998: Flags [P.], seq 340466:344588, ack 867, win 65535, length 4122
19:28:35.430112 IP 151.101.117.67.443 > 10.0.2.15.37998: Flags [P.], seq 344588:347336, ack 867, win 65535, length 2748
19:28:35.430125 IP 10.0.2.15.37998 > 151.101.117.67.443: Flags [.], ack 340466, win 65535, length 0
19:28:35.430228 IP 10.0.2.15.37998 > 151.101.117.67.443: Flags [.], ack 344588, win 65535, length 0
19:28:35.430244 IP 10.0.2.15.37998 > 151.101.117.67.443: Flags [.], ack 347336, win 65535, length 0
19:28:35.430275 IP 151.101.117.67.443 > 10.0.2.15.37998: Flags [P.], seq 347336:350084, ack 867, win 65535, length 2748
19:28:35.430276 IP 151.101.117.67.443 > 10.0.2.15.37998: Flags [P.], seq 350084:351458, ack 867, win 65535, length 1374
19:28:35.430282 IP 10.0.2.15.37998 > 151.101.117.67.443: Flags [.], ack 350084, win 65535, length 0
19:28:35.430752 IP 151.101.117.67.443 > 10.0.2.15.37998: Flags [P.], seq 351458:355580, ack 867, win 65535, length 4122
19:28:35.430754 IP 151.101.117.67.443 > 10.0.2.15.37998: Flags [P.], seq 355580:358328, ack 867, win 65535, length 2748
19:28:35.430755 IP 151.101.117.67.443 > 10.0.2.15.37998: Flags [P.], seq 358328:361076, ack 867, win 65535, length 2748
19:28:35.430768 IP 10.0.2.15.37998 > 151.101.117.67.443: Flags [.], ack 355580, win 65535, length 0
19:28:35.430817 IP 10.0.2.15.37998 > 151.101.117.67.443: Flags [.], ack 358328, win 65535, length 0
19:28:35.430831 IP 10.0.2.15.37998 > 151.101.117.67.443: Flags [.], ack 361076, win 65535, length 0
19:28:35.431072 IP 151.101.117.67.443 > 10.0.2.15.37998: Flags [P.], seq 361076:363824, ack 867, win 65535, length 2748
19:28:35.431073 IP 151.101.117.67.443 > 10.0.2.15.37998: Flags [P.], seq 363824:366572, ack 867, win 65535, length 2748
19:28:35.431074 IP 151.101.117.67.443 > 10.0.2.15.37998: Flags [P.], seq 366572:369320, ack 867, win 65535, length 2748
19:28:35.431084 IP 10.0.2.15.37998 > 151.101.117.67.443: Flags [.], ack 363824, win 65535, length 0
19:28:35.431098 IP 10.0.2.15.37998 > 151.101.117.67.443: Flags [.], ack 366572, win 65535, length 0
19:28:35.431110 IP 10.0.2.15.37998 > 151.101.117.67.443: Flags [.], ack 369320, win 65535, length 0
19:28:35.434281 IP 151.101.117.67.443 > 10.0.2.15.37998: Flags [P.], seq 369320:376190, ack 867, win 65535, length 6870
19:28:35.434283 IP 151.101.117.67.443 > 10.0.2.15.37998: Flags [P.], seq 376190:380312, ack 867, win 65535, length 4122
19:28:35.434307 IP 10.0.2.15.37998 > 151.101.117.67.443: Flags [.], ack 376190, win 65535, length 0
19:28:35.434337 IP 10.0.2.15.37998 > 151.101.117.67.443: Flags [.], ack 380312, win 65535, length 0
19:28:35.434364 IP 151.101.117.67.443 > 10.0.2.15.37998: Flags [P.], seq 380312:383060, ack 867, win 65535, length 2748
19:28:35.434369 IP 10.0.2.15.37998 > 151.101.117.67.443: Flags [.], ack 383060, win 65535, length 0
19:28:35.434539 IP 151.101.117.67.443 > 10.0.2.15.37998: Flags [P.], seq 383060:385808, ack 867, win 65535, length 2748
19:28:35.434585 IP 10.0.2.15.37998 > 151.101.117.67.443: Flags [.], ack 385808, win 65535, length 0
19:28:35.434716 IP 151.101.117.67.443 > 10.0.2.15.37998: Flags [P.], seq 385808:388556, ack 867, win 65535, length 2748
19:28:35.434727 IP 10.0.2.15.37998 > 151.101.117.67.443: Flags [.], ack 388556, win 65535, length 0
19:28:35.435389 IP 151.101.117.67.443 > 10.0.2.15.37998: Flags [P.], seq 388556:392678, ack 867, win 65535, length 4122
19:28:35.435390 IP 151.101.117.67.443 > 10.0.2.15.37998: Flags [P.], seq 392678:395426, ack 867, win 65535, length 2748
19:28:35.435391 IP 151.101.117.67.443 > 10.0.2.15.37998: Flags [P.], seq 395426:396800, ack 867, win 65535, length 1374
19:28:35.435392 IP 151.101.117.67.443 > 10.0.2.15.37998: Flags [P.], seq 396800:399548, ack 867, win 65535, length 2748
19:28:35.435420 IP 151.101.117.67.443 > 10.0.2.15.37998: Flags [P.], seq 399548:403670, ack 867, win 65535, length 4122
19:28:35.435420 IP 151.101.117.67.443 > 10.0.2.15.37998: Flags [P.], seq 403670:405044, ack 867, win 65535, length 1374
19:28:35.435459 IP 10.0.2.15.37998 > 151.101.117.67.443: Flags [.], ack 405044, win 65535, length 0
19:28:35.435658 IP 151.101.117.67.443 > 10.0.2.15.37998: Flags [P.], seq 405044:407792, ack 867, win 65535, length 2748
19:28:35.435659 IP 151.101.117.67.443 > 10.0.2.15.37998: Flags [P.], seq 407792:411914, ack 867, win 65535, length 4122
19:28:35.435668 IP 10.0.2.15.37998 > 151.101.117.67.443: Flags [.], ack 407792, win 65535, length 0
19:28:35.435688 IP 10.0.2.15.37998 > 151.101.117.67.443: Flags [.], ack 411914, win 65535, length 0
19:28:35.435987 IP 151.101.117.67.443 > 10.0.2.15.37998: Flags [P.], seq 411914:414662, ack 867, win 65535, length 2748
19:28:35.435990 IP 151.101.117.67.443 > 10.0.2.15.37998: Flags [P.], seq 414662:417410, ack 867, win 65535, length 2748
19:28:35.435999 IP 10.0.2.15.37998 > 151.101.117.67.443: Flags [.], ack 414662, win 65535, length 0
19:28:35.436020 IP 10.0.2.15.37998 > 151.101.117.67.443: Flags [.], ack 417410, win 65535, length 0
19:28:35.436395 IP 151.101.117.67.443 > 10.0.2.15.37998: Flags [P.], seq 417410:420158, ack 867, win 65535, length 2748
19:28:35.436397 IP 151.101.117.67.443 > 10.0.2.15.37998: Flags [P.], seq 420158:425654, ack 867, win 65535, length 5496
19:28:35.436398 IP 151.101.117.67.443 > 10.0.2.15.37998: Flags [P.], seq 425654:428402, ack 867, win 65535, length 2748
19:28:35.436407 IP 10.0.2.15.37998 > 151.101.117.67.443: Flags [.], ack 420158, win 65535, length 0
19:28:35.436509 IP 10.0.2.15.37998 > 151.101.117.67.443: Flags [.], ack 425654, win 65535, length 0
19:28:35.436564 IP 10.0.2.15.37998 > 151.101.117.67.443: Flags [.], ack 428402, win 65535, length 0
19:28:35.436630 IP 151.101.117.67.443 > 10.0.2.15.37998: Flags [P.], seq 428402:429776, ack 867, win 65535, length 1374
19:28:35.436816 IP 151.101.117.67.443 > 10.0.2.15.37998: Flags [P.], seq 429776:433898, ack 867, win 65535, length 4122
19:28:35.436817 IP 151.101.117.67.443 > 10.0.2.15.37998: Flags [P.], seq 433898:438020, ack 867, win 65535, length 4122
19:28:35.436828 IP 10.0.2.15.37998 > 151.101.117.67.443: Flags [.], ack 433898, win 65535, length 0
19:28:35.436850 IP 10.0.2.15.37998 > 151.101.117.67.443: Flags [.], ack 438020, win 65535, length 0
19:28:35.437376 IP 151.101.117.67.443 > 10.0.2.15.37998: Flags [P.], seq 438020:440768, ack 867, win 65535, length 2748
19:28:35.437378 IP 151.101.117.67.443 > 10.0.2.15.37998: Flags [P.], seq 440768:443516, ack 867, win 65535, length 2748
19:28:35.437378 IP 151.101.117.67.443 > 10.0.2.15.37998: Flags [P.], seq 443516:444890, ack 867, win 65535, length 1374
19:28:35.437389 IP 10.0.2.15.37998 > 151.101.117.67.443: Flags [.], ack 440768, win 65535, length 0
19:28:35.437413 IP 10.0.2.15.37998 > 151.101.117.67.443: Flags [.], ack 443516, win 65535, length 0
19:28:35.438130 IP 151.101.117.67.443 > 10.0.2.15.37998: Flags [P.], seq 444890:447638, ack 867, win 65535, length 2748
19:28:35.438192 IP 10.0.2.15.37998 > 151.101.117.67.443: Flags [.], ack 447638, win 65535, length 0
19:28:35.438503 IP 151.101.117.67.443 > 10.0.2.15.37998: Flags [P.], seq 447638:451760, ack 867, win 65535, length 4122
19:28:35.438505 IP 151.101.117.67.443 > 10.0.2.15.37998: Flags [P.], seq 451760:455882, ack 867, win 65535, length 4122
19:28:35.438506 IP 151.101.117.67.443 > 10.0.2.15.37998: Flags [P.], seq 455882:458630, ack 867, win 65535, length 2748
19:28:35.439613 IP 10.0.2.15.37998 > 151.101.117.67.443: Flags [.], ack 451760, win 65535, length 0
19:28:35.439644 IP 10.0.2.15.37998 > 151.101.117.67.443: Flags [.], ack 455882, win 65535, length 0
19:28:35.439655 IP 10.0.2.15.37998 > 151.101.117.67.443: Flags [.], ack 458630, win 65535, length 0
19:28:35.439692 IP 151.101.117.67.443 > 10.0.2.15.37998: Flags [P.], seq 458630:460004, ack 867, win 65535, length 1374
19:28:35.439694 IP 151.101.117.67.443 > 10.0.2.15.37998: Flags [P.], seq 460004:464126, ack 867, win 65535, length 4122
19:28:35.439694 IP 151.101.117.67.443 > 10.0.2.15.37998: Flags [P.], seq 464126:466874, ack 867, win 65535, length 2748
19:28:35.439696 IP 151.101.117.67.443 > 10.0.2.15.37998: Flags [P.], seq 466874:470996, ack 867, win 65535, length 4122
19:28:35.439708 IP 10.0.2.15.37998 > 151.101.117.67.443: Flags [.], ack 464126, win 65535, length 0
19:28:35.439719 IP 10.0.2.15.37998 > 151.101.117.67.443: Flags [.], ack 466874, win 65535, length 0
19:28:35.439730 IP 10.0.2.15.37998 > 151.101.117.67.443: Flags [.], ack 470996, win 65535, length 0
19:28:35.439746 IP 151.101.117.67.443 > 10.0.2.15.37998: Flags [P.], seq 470996:472370, ack 867, win 65535, length 1374
19:28:35.439747 IP 151.101.117.67.443 > 10.0.2.15.37998: Flags [P.], seq 472370:476492, ack 867, win 65535, length 4122
19:28:35.439748 IP 151.101.117.67.443 > 10.0.2.15.37998: Flags [P.], seq 476492:479240, ack 867, win 65535, length 2748
19:28:35.439749 IP 151.101.117.67.443 > 10.0.2.15.37998: Flags [P.], seq 479240:481988, ack 867, win 65535, length 2748
19:28:35.439755 IP 10.0.2.15.37998 > 151.101.117.67.443: Flags [.], ack 476492, win 65535, length 0
19:28:35.439768 IP 10.0.2.15.37998 > 151.101.117.67.443: Flags [.], ack 479240, win 65535, length 0
19:28:35.439779 IP 10.0.2.15.37998 > 151.101.117.67.443: Flags [.], ack 481988, win 65535, length 0
19:28:35.440167 IP 151.101.117.67.443 > 10.0.2.15.37998: Flags [P.], seq 481988:487484, ack 867, win 65535, length 5496
19:28:35.440191 IP 10.0.2.15.37998 > 151.101.117.67.443: Flags [.], ack 487484, win 65535, length 0
19:28:35.441091 IP 151.101.117.67.443 > 10.0.2.15.37998: Flags [P.], seq 487484:494354, ack 867, win 65535, length 6870
19:28:35.441094 IP 151.101.117.67.443 > 10.0.2.15.37998: Flags [P.], seq 494354:501224, ack 867, win 65535, length 6870
19:28:35.441112 IP 10.0.2.15.37998 > 151.101.117.67.443: Flags [.], ack 494354, win 65535, length 0
19:28:35.441137 IP 10.0.2.15.37998 > 151.101.117.67.443: Flags [.], ack 501224, win 65535, length 0
19:28:35.441319 IP 151.101.117.67.443 > 10.0.2.15.37998: Flags [P.], seq 501224:503972, ack 867, win 65535, length 2748
19:28:35.441326 IP 10.0.2.15.37998 > 151.101.117.67.443: Flags [.], ack 503972, win 65535, length 0
19:28:35.441407 IP 151.101.117.67.443 > 10.0.2.15.37998: Flags [P.], seq 503972:506720, ack 867, win 65535, length 2748
19:28:35.441413 IP 10.0.2.15.37998 > 151.101.117.67.443: Flags [.], ack 506720, win 65535, length 0
19:28:35.441687 IP 151.101.117.67.443 > 10.0.2.15.37998: Flags [P.], seq 506720:509468, ack 867, win 65535, length 2748
19:28:35.441688 IP 151.101.117.67.443 > 10.0.2.15.37998: Flags [P.], seq 509468:510842, ack 867, win 65535, length 1374
19:28:35.441690 IP 151.101.117.67.443 > 10.0.2.15.37998: Flags [P.], seq 510842:514964, ack 867, win 65535, length 4122
19:28:35.441701 IP 10.0.2.15.37998 > 151.101.117.67.443: Flags [.], ack 509468, win 65535, length 0
19:28:35.441721 IP 10.0.2.15.37998 > 151.101.117.67.443: Flags [.], ack 514964, win 65535, length 0
19:28:35.441850 IP 151.101.117.67.443 > 10.0.2.15.37998: Flags [P.], seq 514964:517712, ack 867, win 65535, length 2748
19:28:35.442015 IP 10.0.2.15.37998 > 151.101.117.67.443: Flags [.], ack 517712, win 65535, length 0
19:28:35.442257 IP 151.101.117.67.443 > 10.0.2.15.37998: Flags [P.], seq 517712:519086, ack 867, win 65535, length 1374
19:28:35.442259 IP 151.101.117.67.443 > 10.0.2.15.37998: Flags [P.], seq 519086:523208, ack 867, win 65535, length 4122
19:28:35.442274 IP 10.0.2.15.37998 > 151.101.117.67.443: Flags [.], ack 523208, win 65535, length 0
19:28:35.443229 IP 151.101.117.67.443 > 10.0.2.15.37998: Flags [P.], seq 523208:530078, ack 867, win 65535, length 6870
19:28:35.443231 IP 151.101.117.67.443 > 10.0.2.15.37998: Flags [.], seq 530078:531538, ack 867, win 65535, length 1460
19:28:35.443251 IP 10.0.2.15.37998 > 151.101.117.67.443: Flags [.], ack 530078, win 65535, length 0
19:28:35.443572 IP 151.101.117.67.443 > 10.0.2.15.37998: Flags [P.], seq 531538:534200, ack 867, win 65535, length 2662
19:28:35.443575 IP 151.101.117.67.443 > 10.0.2.15.37998: Flags [P.], seq 534200:536948, ack 867, win 65535, length 2748
19:28:35.443575 IP 151.101.117.67.443 > 10.0.2.15.37998: Flags [P.], seq 536948:539696, ack 867, win 65535, length 2748
19:28:35.443589 IP 10.0.2.15.37998 > 151.101.117.67.443: Flags [.], ack 534200, win 65535, length 0
19:28:35.443607 IP 10.0.2.15.37998 > 151.101.117.67.443: Flags [.], ack 536948, win 65535, length 0
19:28:35.443620 IP 10.0.2.15.37998 > 151.101.117.67.443: Flags [.], ack 539696, win 65535, length 0
19:28:35.444061 IP 151.101.117.67.443 > 10.0.2.15.37998: Flags [P.], seq 539696:542444, ack 867, win 65535, length 2748
19:28:35.444064 IP 151.101.117.67.443 > 10.0.2.15.37998: Flags [P.], seq 542444:546566, ack 867, win 65535, length 4122
19:28:35.444124 IP 10.0.2.15.37998 > 151.101.117.67.443: Flags [.], ack 542444, win 65535, length 0
19:28:35.444185 IP 10.0.2.15.37998 > 151.101.117.67.443: Flags [.], ack 546566, win 65535, length 0
19:28:35.444983 IP 151.101.117.67.443 > 10.0.2.15.37998: Flags [P.], seq 546566:549314, ack 867, win 65535, length 2748
19:28:35.444985 IP 151.101.117.67.443 > 10.0.2.15.37998: Flags [P.], seq 549314:553436, ack 867, win 65535, length 4122
19:28:35.444985 IP 151.101.117.67.443 > 10.0.2.15.37998: Flags [P.], seq 553436:556184, ack 867, win 65535, length 2748
19:28:35.444986 IP 151.101.117.67.443 > 10.0.2.15.37998: Flags [P.], seq 556184:558932, ack 867, win 65535, length 2748
19:28:35.445002 IP 10.0.2.15.37998 > 151.101.117.67.443: Flags [.], ack 549314, win 65535, length 0
19:28:35.445018 IP 10.0.2.15.37998 > 151.101.117.67.443: Flags [.], ack 553436, win 65535, length 0
19:28:35.445030 IP 10.0.2.15.37998 > 151.101.117.67.443: Flags [.], ack 556184, win 65535, length 0
19:28:35.445042 IP 10.0.2.15.37998 > 151.101.117.67.443: Flags [.], ack 558932, win 65535, length 0
19:28:35.445070 IP 151.101.117.67.443 > 10.0.2.15.37998: Flags [P.], seq 558932:563054, ack 867, win 65535, length 4122
19:28:35.445071 IP 151.101.117.67.443 > 10.0.2.15.37998: Flags [P.], seq 563054:565802, ack 867, win 65535, length 2748
19:28:35.445071 IP 151.101.117.67.443 > 10.0.2.15.37998: Flags [P.], seq 565802:568550, ack 867, win 65535, length 2748
19:28:35.445130 IP 10.0.2.15.37998 > 151.101.117.67.443: Flags [.], ack 563054, win 65535, length 0
19:28:35.445151 IP 10.0.2.15.37998 > 151.101.117.67.443: Flags [.], ack 565802, win 65535, length 0
19:28:35.445215 IP 10.0.2.15.37998 > 151.101.117.67.443: Flags [.], ack 568550, win 65535, length 0
19:28:35.446450 IP 151.101.117.67.443 > 10.0.2.15.37998: Flags [P.], seq 568550:571298, ack 867, win 65535, length 2748
19:28:35.446452 IP 151.101.117.67.443 > 10.0.2.15.37998: Flags [P.], seq 571298:574046, ack 867, win 65535, length 2748
19:28:35.446452 IP 151.101.117.67.443 > 10.0.2.15.37998: Flags [P.], seq 574046:578168, ack 867, win 65535, length 4122
19:28:35.446453 IP 151.101.117.67.443 > 10.0.2.15.37998: Flags [P.], seq 578168:579542, ack 867, win 65535, length 1374
19:28:35.446470 IP 10.0.2.15.37998 > 151.101.117.67.443: Flags [.], ack 571298, win 65535, length 0
19:28:35.446488 IP 10.0.2.15.37998 > 151.101.117.67.443: Flags [.], ack 574046, win 65535, length 0
19:28:35.446502 IP 10.0.2.15.37998 > 151.101.117.67.443: Flags [.], ack 578168, win 65535, length 0
19:28:35.446536 IP 151.101.117.67.443 > 10.0.2.15.37998: Flags [P.], seq 579542:582290, ack 867, win 65535, length 2748
19:28:35.446538 IP 151.101.117.67.443 > 10.0.2.15.37998: Flags [P.], seq 582290:587786, ack 867, win 65535, length 5496
19:28:35.446539 IP 151.101.117.67.443 > 10.0.2.15.37998: Flags [P.], seq 587786:589160, ack 867, win 65535, length 1374
19:28:35.446547 IP 10.0.2.15.37998 > 151.101.117.67.443: Flags [.], ack 582290, win 65535, length 0
19:28:35.446562 IP 10.0.2.15.37998 > 151.101.117.67.443: Flags [.], ack 587786, win 65535, length 0
19:28:35.448019 IP 151.101.117.67.443 > 10.0.2.15.37998: Flags [P.], seq 589160:596030, ack 867, win 65535, length 6870
19:28:35.448045 IP 10.0.2.15.37998 > 151.101.117.67.443: Flags [.], ack 596030, win 65535, length 0
19:28:35.450408 IP 151.101.117.67.443 > 10.0.2.15.37998: Flags [P.], seq 596030:602900, ack 867, win 65535, length 6870
19:28:35.450428 IP 10.0.2.15.37998 > 151.101.117.67.443: Flags [.], ack 602900, win 65535, length 0
19:28:35.451471 IP 151.101.117.67.443 > 10.0.2.15.37998: Flags [P.], seq 602900:609770, ack 867, win 65535, length 6870
19:28:35.451472 IP 151.101.117.67.443 > 10.0.2.15.37998: Flags [P.], seq 609770:612518, ack 867, win 65535, length 2748
19:28:35.451473 IP 151.101.117.67.443 > 10.0.2.15.37998: Flags [P.], seq 612518:616640, ack 867, win 65535, length 4122
19:28:35.451518 IP 10.0.2.15.37998 > 151.101.117.67.443: Flags [.], ack 609770, win 65535, length 0
19:28:35.451539 IP 10.0.2.15.37998 > 151.101.117.67.443: Flags [.], ack 612518, win 65535, length 0
19:28:35.451552 IP 10.0.2.15.37998 > 151.101.117.67.443: Flags [.], ack 616640, win 65535, length 0
19:28:35.451577 IP 151.101.117.67.443 > 10.0.2.15.37998: Flags [P.], seq 616640:620762, ack 867, win 65535, length 4122
19:28:35.451582 IP 10.0.2.15.37998 > 151.101.117.67.443: Flags [.], ack 620762, win 65535, length 0
19:28:35.458995 IP 151.101.117.67.443 > 10.0.2.15.37998: Flags [P.], seq 620762:631754, ack 867, win 65535, length 10992
19:28:35.459013 IP 10.0.2.15.37998 > 151.101.117.67.443: Flags [.], ack 631754, win 65535, length 0
19:28:35.459060 IP 151.101.117.67.443 > 10.0.2.15.37998: Flags [P.], seq 631754:638624, ack 867, win 65535, length 6870
19:28:35.459061 IP 151.101.117.67.443 > 10.0.2.15.37998: Flags [P.], seq 638624:644120, ack 867, win 65535, length 5496
19:28:35.459068 IP 10.0.2.15.37998 > 151.101.117.67.443: Flags [.], ack 638624, win 65535, length 0
19:28:35.459077 IP 10.0.2.15.37998 > 151.101.117.67.443: Flags [.], ack 644120, win 65535, length 0
19:28:35.459086 IP 151.101.117.67.443 > 10.0.2.15.37998: Flags [P.], seq 644120:646868, ack 867, win 65535, length 2748
19:28:35.459087 IP 151.101.117.67.443 > 10.0.2.15.37998: Flags [P.], seq 646868:650990, ack 867, win 65535, length 4122
19:28:35.459088 IP 151.101.117.67.443 > 10.0.2.15.37998: Flags [P.], seq 650990:656486, ack 867, win 65535, length 5496
19:28:35.459091 IP 10.0.2.15.37998 > 151.101.117.67.443: Flags [.], ack 646868, win 65535, length 0
19:28:35.459098 IP 10.0.2.15.37998 > 151.101.117.67.443: Flags [.], ack 650990, win 65535, length 0
19:28:35.459104 IP 10.0.2.15.37998 > 151.101.117.67.443: Flags [.], ack 656486, win 65535, length 0
19:28:35.459271 IP 151.101.117.67.443 > 10.0.2.15.37998: Flags [.], seq 656486:666706, ack 867, win 65535, length 10220
19:28:35.459281 IP 10.0.2.15.37998 > 151.101.117.67.443: Flags [.], ack 666706, win 65535, length 0
19:28:35.459508 IP 151.101.117.67.443 > 10.0.2.15.37998: Flags [P.], seq 666706:697366, ack 867, win 65535, length 30660
19:28:35.459520 IP 10.0.2.15.37998 > 151.101.117.67.443: Flags [.], ack 697366, win 65535, length 0
19:28:35.459556 IP 151.101.117.67.443 > 10.0.2.15.37998: Flags [P.], seq 697366:707324, ack 867, win 65535, length 9958
19:28:35.459668 IP 151.101.117.67.443 > 10.0.2.15.37998: Flags [P.], seq 707324:714194, ack 867, win 65535, length 6870
19:28:35.459733 IP 10.0.2.15.37998 > 151.101.117.67.443: Flags [.], ack 714194, win 65535, length 0
19:28:35.460079 IP 151.101.117.67.443 > 10.0.2.15.37998: Flags [P.], seq 714194:721064, ack 867, win 65535, length 6870
19:28:35.460117 IP 10.0.2.15.37998 > 151.101.117.67.443: Flags [.], ack 721064, win 65535, length 0
19:28:35.460690 IP 151.101.117.67.443 > 10.0.2.15.37998: Flags [P.], seq 721064:725186, ack 867, win 65535, length 4122
19:28:35.460691 IP 151.101.117.67.443 > 10.0.2.15.37998: Flags [P.], seq 725186:727934, ack 867, win 65535, length 2748
19:28:35.460692 IP 151.101.117.67.443 > 10.0.2.15.37998: Flags [P.], seq 727934:732056, ack 867, win 65535, length 4122
19:28:35.460707 IP 10.0.2.15.37998 > 151.101.117.67.443: Flags [.], ack 725186, win 65535, length 0
19:28:35.460769 IP 10.0.2.15.37998 > 151.101.117.67.443: Flags [.], ack 727934, win 65535, length 0
19:28:35.460779 IP 10.0.2.15.37998 > 151.101.117.67.443: Flags [.], ack 732056, win 65535, length 0
19:28:35.460801 IP 151.101.117.67.443 > 10.0.2.15.37998: Flags [P.], seq 732056:734804, ack 867, win 65535, length 2748
19:28:35.460806 IP 151.101.117.67.443 > 10.0.2.15.37998: Flags [P.], seq 734804:736178, ack 867, win 65535, length 1374
19:28:35.460813 IP 10.0.2.15.37998 > 151.101.117.67.443: Flags [.], ack 734804, win 65535, length 0
19:28:35.461140 IP 151.101.117.67.443 > 10.0.2.15.37998: Flags [P.], seq 736178:740300, ack 867, win 65535, length 4122
19:28:35.461141 IP 151.101.117.67.443 > 10.0.2.15.37998: Flags [P.], seq 740300:743048, ack 867, win 65535, length 2748
19:28:35.461142 IP 151.101.117.67.443 > 10.0.2.15.37998: Flags [P.], seq 743048:745796, ack 867, win 65535, length 2748
19:28:35.461323 IP 151.101.117.67.443 > 10.0.2.15.37998: Flags [P.], seq 745796:748544, ack 867, win 65535, length 2748
19:28:35.461593 IP 10.0.2.15.37998 > 151.101.117.67.443: Flags [.], ack 748544, win 65535, length 0
19:28:35.462117 IP 151.101.117.67.443 > 10.0.2.15.37998: Flags [P.], seq 748544:754040, ack 867, win 65535, length 5496
19:28:35.462119 IP 151.101.117.67.443 > 10.0.2.15.37998: Flags [P.], seq 754040:756788, ack 867, win 65535, length 2748
19:28:35.462887 IP 151.101.117.67.443 > 10.0.2.15.37998: Flags [P.], seq 756788:759536, ack 867, win 65535, length 2748
19:28:35.462889 IP 151.101.117.67.443 > 10.0.2.15.37998: Flags [P.], seq 759536:760910, ack 867, win 65535, length 1374
19:28:35.463297 IP 10.0.2.15.37998 > 151.101.117.67.443: Flags [.], ack 760910, win 65535, length 0
19:28:35.466700 IP 151.101.117.67.443 > 10.0.2.15.37998: Flags [P.], seq 760910:773276, ack 867, win 65535, length 12366
19:28:35.466717 IP 10.0.2.15.37998 > 151.101.117.67.443: Flags [.], ack 773276, win 65535, length 0
19:28:35.466770 IP 151.101.117.67.443 > 10.0.2.15.37998: Flags [P.], seq 773276:778772, ack 867, win 65535, length 5496
19:28:35.466771 IP 151.101.117.67.443 > 10.0.2.15.37998: Flags [P.], seq 778772:781520, ack 867, win 65535, length 2748
19:28:35.466772 IP 151.101.117.67.443 > 10.0.2.15.37998: Flags [P.], seq 781520:787016, ack 867, win 65535, length 5496
19:28:35.466869 IP 10.0.2.15.37998 > 151.101.117.67.443: Flags [.], ack 787016, win 65535, length 0
19:28:35.467123 IP 151.101.117.67.443 > 10.0.2.15.37998: Flags [P.], seq 787016:792512, ack 867, win 65535, length 5496
19:28:35.467450 IP 151.101.117.67.443 > 10.0.2.15.37998: Flags [P.], seq 792512:799382, ack 867, win 65535, length 6870
19:28:35.467701 IP 151.101.117.67.443 > 10.0.2.15.37998: Flags [P.], seq 799382:803504, ack 867, win 65535, length 4122
19:28:35.467702 IP 151.101.117.67.443 > 10.0.2.15.37998: Flags [P.], seq 803504:804878, ack 867, win 65535, length 1374
19:28:35.467704 IP 151.101.117.67.443 > 10.0.2.15.37998: Flags [P.], seq 804878:809000, ack 867, win 65535, length 4122
19:28:35.467843 IP 151.101.117.67.443 > 10.0.2.15.37998: Flags [P.], seq 809000:811748, ack 867, win 65535, length 2748
19:28:35.467864 IP 10.0.2.15.37998 > 151.101.117.67.443: Flags [.], ack 792512, win 65535, length 0
19:28:35.467903 IP 10.0.2.15.37998 > 151.101.117.67.443: Flags [.], ack 811748, win 65535, length 0
19:28:35.468043 IP 151.101.117.67.443 > 10.0.2.15.37998: Flags [P.], seq 811748:814496, ack 867, win 65535, length 2748
19:28:35.468293 IP 151.101.117.67.443 > 10.0.2.15.37998: Flags [P.], seq 814496:817244, ack 867, win 65535, length 2748
19:28:35.468294 IP 151.101.117.67.443 > 10.0.2.15.37998: Flags [P.], seq 817244:818618, ack 867, win 65535, length 1374
19:28:35.468336 IP 10.0.2.15.37998 > 151.101.117.67.443: Flags [.], ack 818618, win 65535, length 0
19:28:35.469473 IP 151.101.117.67.443 > 10.0.2.15.37998: Flags [P.], seq 818618:822740, ack 867, win 65535, length 4122
19:28:35.469476 IP 151.101.117.67.443 > 10.0.2.15.37998: Flags [.], seq 822740:825660, ack 867, win 65535, length 2920
19:28:35.469500 IP 10.0.2.15.37998 > 151.101.117.67.443: Flags [.], ack 822740, win 65535, length 0
19:28:35.469911 IP 151.101.117.67.443 > 10.0.2.15.37998: Flags [P.], seq 825660:828236, ack 867, win 65535, length 2576
19:28:35.469914 IP 151.101.117.67.443 > 10.0.2.15.37998: Flags [P.], seq 828236:833732, ack 867, win 65535, length 5496
19:28:35.469915 IP 151.101.117.67.443 > 10.0.2.15.37998: Flags [P.], seq 833732:836480, ack 867, win 65535, length 2748
19:28:35.469942 IP 151.101.117.67.443 > 10.0.2.15.37998: Flags [P.], seq 836480:839228, ack 867, win 65535, length 2748
19:28:35.472793 IP 151.101.117.67.443 > 10.0.2.15.37998: Flags [P.], seq 839228:844724, ack 867, win 65535, length 5496
19:28:35.472797 IP 151.101.117.67.443 > 10.0.2.15.37998: Flags [P.], seq 844724:851594, ack 867, win 65535, length 6870
19:28:35.472828 IP 151.101.117.67.443 > 10.0.2.15.37998: Flags [P.], seq 851594:858464, ack 867, win 65535, length 6870
19:28:35.473230 IP 10.0.2.15.37998 > 151.101.117.67.443: Flags [.], ack 858464, win 65535, length 0
19:28:35.473504 IP 151.101.117.67.443 > 10.0.2.15.37998: Flags [.], seq 858464:859924, ack 867, win 65535, length 1460
19:28:35.473882 IP 151.101.117.67.443 > 10.0.2.15.37998: Flags [P.], seq 859924:898310, ack 867, win 65535, length 38386
19:28:35.474465 IP 10.0.2.15.37998 > 151.101.117.67.443: Flags [.], ack 898310, win 65535, length 0
19:28:35.474997 IP 151.101.117.67.443 > 10.0.2.15.37998: Flags [.], seq 898310:899770, ack 867, win 65535, length 1460
19:28:35.475818 IP 151.101.117.67.443 > 10.0.2.15.37998: Flags [P.], seq 899770:928538, ack 867, win 65535, length 28768
19:28:35.475882 IP 151.101.117.67.443 > 10.0.2.15.37998: Flags [P.], seq 928538:929912, ack 867, win 65535, length 1374
19:28:35.475883 IP 151.101.117.67.443 > 10.0.2.15.37998: Flags [P.], seq 929912:934034, ack 867, win 65535, length 4122
19:28:35.476195 IP 10.0.2.15.37998 > 151.101.117.67.443: Flags [.], ack 934034, win 65535, length 0
19:28:35.477042 IP 151.101.117.67.443 > 10.0.2.15.37998: Flags [P.], seq 934034:945026, ack 867, win 65535, length 10992
19:28:35.477056 IP 10.0.2.15.37998 > 151.101.117.67.443: Flags [.], ack 945026, win 65535, length 0
19:28:35.477088 IP 151.101.117.67.443 > 10.0.2.15.37998: Flags [P.], seq 945026:949148, ack 867, win 65535, length 4122
19:28:35.477089 IP 151.101.117.67.443 > 10.0.2.15.37998: Flags [P.], seq 949148:951896, ack 867, win 65535, length 2748
19:28:35.477432 IP 10.0.2.15.37998 > 151.101.117.67.443: Flags [.], ack 951896, win 65535, length 0
19:28:35.477915 IP 151.101.117.67.443 > 10.0.2.15.37998: Flags [P.], seq 951896:957392, ack 867, win 65535, length 5496
19:28:35.477916 IP 151.101.117.67.443 > 10.0.2.15.37998: Flags [P.], seq 957392:958766, ack 867, win 65535, length 1374
19:28:35.477930 IP 10.0.2.15.37998 > 151.101.117.67.443: Flags [.], ack 957392, win 65535, length 0
19:28:35.478215 IP 151.101.117.67.443 > 10.0.2.15.37998: Flags [P.], seq 958766:962888, ack 867, win 65535, length 4122
19:28:35.478216 IP 151.101.117.67.443 > 10.0.2.15.37998: Flags [P.], seq 962888:965636, ack 867, win 65535, length 2748
19:28:35.478217 IP 151.101.117.67.443 > 10.0.2.15.37998: Flags [P.], seq 965636:967010, ack 867, win 65535, length 1374
19:28:35.480160 IP 151.101.117.67.443 > 10.0.2.15.37998: Flags [P.], seq 967010:969758, ack 867, win 65535, length 2748
19:28:35.480163 IP 151.101.117.67.443 > 10.0.2.15.37998: Flags [P.], seq 969758:973880, ack 867, win 65535, length 4122
19:28:35.480164 IP 151.101.117.67.443 > 10.0.2.15.37998: Flags [P.], seq 973880:976628, ack 867, win 65535, length 2748
19:28:35.480165 IP 151.101.117.67.443 > 10.0.2.15.37998: Flags [P.], seq 976628:980750, ack 867, win 65535, length 4122
19:28:35.480376 IP 151.101.117.67.443 > 10.0.2.15.37998: Flags [P.], seq 980750:984872, ack 867, win 65535, length 4122

