19:28:24.516699 IP 10.0.2.15.33032 > 140.233.253.2.53: 35209+ A? www.cnn.com. (29)
19:28:24.516738 IP 10.0.2.15.33032 > 140.233.253.2.53: 46474+ AAAA? www.cnn.com. (29)
19:28:24.521739 IP 140.233.253.2.53 > 10.0.2.15.33032: 35209 2/0/0 CNAME turner-tls.map.fastly.net., A 151.101.117.67 (84)
19:28:24.521741 IP 140.233.253.2.53 > 10.0.2.15.33032: 46474 2/0/0 CNAME turner-tls.map.fastly.net., AAAA 2a04:4e42:1c::323 (96)
19:28:24.522257 IP 10.0.2.15.37994 > 151.101.117.67.443: Flags [S], seq 3047075962, win 64240, options [mss 1460,sackOK,TS val 1396623495 ecr 0,nop,wscale 6], length 0
19:28:24.536495 IP 151.101.117.67.443 > 10.0.2.15.37994: Flags [S.], seq 166912001, ack 3047075963, win 65535, options [mss 1460], length 0
19:28:24.536540 IP 10.0.2.15.37994 > 151.101.117.67.443: Flags [.], ack 1, win 64240, length 0
19:28:24.545196 IP 10.0.2.15.37994 > 151.101.117.67.443: Flags [P.], seq 1:518, ack 1, win 64240, length 517
19:28:24.545498 IP 151.101.117.67.443 > 10.0.2.15.37994: Flags [.], ack 518, win 65535, length 0
19:28:24.567821 IP 151.101.117.67.443 > 10.0.2.15.37994: Flags [.], seq 1:2921, ack 518, win 65535, length 2920
19:28:24.567845 IP 10.0.2.15.37994 > 151.101.117.67.443: Flags [.], ack 2921, win 62780, length 0
19:28:24.568094 IP 151.101.117.67.443 > 10.0.2.15.37994: Flags [P.], seq 2921:5064, ack 518, win 65535, length 2143
19:28:24.568123 IP 10.0.2.15.37994 > 151.101.117.67.443: Flags [.], ack 5064, win 60637, length 0
19:28:24.569873 IP 10.0.2.15.37994 > 151.101.117.67.443: Flags [P.], seq 518:611, ack 5064, win 62780, length 93
19:28:24.570166 IP 151.101.117.67.443 > 10.0.2.15.37994: Flags [.], ack 611, win 65535, length 0
19:28:24.584774 IP 151.101.117.67.443 > 10.0.2.15.37994: Flags [P.], seq 5064:5115, ack 611, win 65535, length 51
19:28:24.584798 IP 10.0.2.15.37994 > 151.101.117.67.443: Flags [.], ack 5115, win 62780, length 0
19:28:24.585810 IP 10.0.2.15.37994 > 151.101.117.67.443: Flags [P.], seq 611:664, ack 5115, win 62780, length 53
19:28:24.585876 IP 10.0.2.15.37994 > 151.101.117.67.443: Flags [P.], seq 664:720, ack 5115, win 62780, length 56
19:28:24.586231 IP 151.101.117.67.443 > 10.0.2.15.37994: Flags [.], ack 664, win 65535, length 0
19:28:24.586233 IP 151.101.117.67.443 > 10.0.2.15.37994: Flags [.], ack 720, win 65535, length 0
19:28:24.586268 IP 10.0.2.15.37994 > 151.101.117.67.443: Flags [P.], seq 720:829, ack 5115, win 62780, length 109
19:28:24.588149 IP 151.101.117.67.443 > 10.0.2.15.37994: Flags [.], ack 829, win 65535, length 0
19:28:24.599613 IP 151.101.117.67.443 > 10.0.2.15.37994: Flags [P.], seq 5115:5210, ack 829, win 65535, length 95
19:28:24.599635 IP 10.0.2.15.37994 > 151.101.117.67.443: Flags [.], ack 5210, win 62780, length 0
19:28:24.599901 IP 10.0.2.15.37994 > 151.101.117.67.443: Flags [P.], seq 829:867, ack 5210, win 62780, length 38
19:28:24.600383 IP 151.101.117.67.443 > 10.0.2.15.37994: Flags [.], ack 867, win 65535, length 0
19:28:24.603002 IP 151.101.117.67.443 > 10.0.2.15.37994: Flags [P.], seq 5210:13454, ack 867, win 65535, length 8244
19:28:24.603112 IP 10.0.2.15.37994 > 151.101.117.67.443: Flags [.], ack 13454, win 58400, length 0
19:28:24.603809 IP 151.101.117.67.443 > 10.0.2.15.37994: Flags [P.], seq 13454:14828, ack 867, win 65535, length 1374
19:28:24.605024 IP 151.101.117.67.443 > 10.0.2.15.37994: Flags [P.], seq 14828:20324, ack 867, win 65535, length 5496
19:28:24.605052 IP 10.0.2.15.37994 > 151.101.117.67.443: Flags [.], ack 20324, win 61320, length 0
19:28:24.606064 IP 151.101.117.67.443 > 10.0.2.15.37994: Flags [P.], seq 20324:23072, ack 867, win 65535, length 2748
19:28:24.606082 IP 10.0.2.15.37994 > 151.101.117.67.443: Flags [.], ack 23072, win 62780, length 0
19:28:24.608059 IP 151.101.117.67.443 > 10.0.2.15.37994: Flags [P.], seq 23072:28568, ack 867, win 65535, length 5496
19:28:24.608257 IP 10.0.2.15.37994 > 151.101.117.67.443: Flags [.], ack 28568, win 61320, length 0
19:28:24.608824 IP 151.101.117.67.443 > 10.0.2.15.37994: Flags [P.], seq 28568:31316, ack 867, win 65535, length 2748
19:28:24.608838 IP 10.0.2.15.37994 > 151.101.117.67.443: Flags [.], ack 31316, win 62780, length 0
19:28:24.610169 IP 151.101.117.67.443 > 10.0.2.15.37994: Flags [P.], seq 31316:39560, ack 867, win 65535, length 8244
19:28:24.610336 IP 10.0.2.15.37994 > 151.101.117.67.443: Flags [.], ack 39560, win 58400, length 0
19:28:24.611604 IP 151.101.117.67.443 > 10.0.2.15.37994: Flags [P.], seq 39560:42308, ack 867, win 65535, length 2748
19:28:24.611622 IP 10.0.2.15.37994 > 151.101.117.67.443: Flags [.], ack 42308, win 62780, length 0
19:28:24.612546 IP 151.101.117.67.443 > 10.0.2.15.37994: Flags [P.], seq 42308:46430, ack 867, win 65535, length 4122
19:28:24.612622 IP 10.0.2.15.37994 > 151.101.117.67.443: Flags [.], ack 46430, win 61320, length 0
19:28:24.615526 IP 151.101.117.67.443 > 10.0.2.15.37994: Flags [P.], seq 46430:49178, ack 867, win 65535, length 2748
19:28:24.615547 IP 10.0.2.15.37994 > 151.101.117.67.443: Flags [.], ack 49178, win 62780, length 0
19:28:24.616498 IP 151.101.117.67.443 > 10.0.2.15.37994: Flags [P.], seq 49178:57422, ack 867, win 65535, length 8244
19:28:24.616631 IP 10.0.2.15.37994 > 151.101.117.67.443: Flags [.], ack 57422, win 58400, length 0
19:28:24.617670 IP 151.101.117.67.443 > 10.0.2.15.37994: Flags [P.], seq 57422:61544, ack 867, win 65535, length 4122
19:28:24.617692 IP 10.0.2.15.37994 > 151.101.117.67.443: Flags [.], ack 61544, win 61320, length 0
19:28:24.618624 IP 151.101.117.67.443 > 10.0.2.15.37994: Flags [P.], seq 61544:68414, ack 867, win 65535, length 6870
19:28:24.618990 IP 10.0.2.15.37994 > 151.101.117.67.443: Flags [.], ack 68414, win 62780, length 0
19:28:24.619606 IP 151.101.117.67.443 > 10.0.2.15.37994: Flags [P.], seq 68414:72536, ack 867, win 65535, length 4122
19:28:24.619627 IP 10.0.2.15.37994 > 151.101.117.67.443: Flags [.], ack 72536, win 65535, length 0
19:28:24.620871 IP 151.101.117.67.443 > 10.0.2.15.37994: Flags [P.], seq 72536:83528, ack 867, win 65535, length 10992
19:28:24.620891 IP 10.0.2.15.37994 > 151.101.117.67.443: Flags [.], ack 83528, win 65535, length 0
19:28:24.621879 IP 151.101.117.67.443 > 10.0.2.15.37994: Flags [P.], seq 83528:90398, ack 867, win 65535, length 6870
19:28:24.621893 IP 10.0.2.15.37994 > 151.101.117.67.443: Flags [.], ack 90398, win 65535, length 0
19:28:24.623092 IP 151.101.117.67.443 > 10.0.2.15.37994: Flags [P.], seq 90398:100016, ack 867, win 65535, length 9618
19:28:24.623119 IP 10.0.2.15.37994 > 151.101.117.67.443: Flags [.], ack 100016, win 65535, length 0
19:28:24.623326 IP 151.101.117.67.443 > 10.0.2.15.37994: Flags [P.], seq 100016:102764, ack 867, win 65535, length 2748
19:28:24.623336 IP 10.0.2.15.37994 > 151.101.117.67.443: Flags [.], ack 102764, win 65535, length 0
19:28:24.624125 IP 151.101.117.67.443 > 10.0.2.15.37994: Flags [P.], seq 102764:111008, ack 867, win 65535, length 8244
19:28:24.624136 IP 10.0.2.15.37994 > 151.101.117.67.443: Flags [.], ack 111008, win 65535, length 0
19:28:24.625097 IP 151.101.117.67.443 > 10.0.2.15.37994: Flags [P.], seq 111008:120626, ack 867, win 65535, length 9618
19:28:24.625122 IP 10.0.2.15.37994 > 151.101.117.67.443: Flags [.], ack 120626, win 65535, length 0
19:28:24.626334 IP 151.101.117.67.443 > 10.0.2.15.37994: Flags [P.], seq 120626:130244, ack 867, win 65535, length 9618
19:28:24.626336 IP 151.101.117.67.443 > 10.0.2.15.37994: Flags [P.], seq 130244:131618, ack 867, win 65535, length 1374
19:28:24.626363 IP 10.0.2.15.37994 > 151.101.117.67.443: Flags [.], ack 130244, win 65535, length 0
19:28:24.628343 IP 151.101.117.67.443 > 10.0.2.15.37994: Flags [P.], seq 131618:135740, ack 867, win 65535, length 4122
19:28:24.628362 IP 10.0.2.15.37994 > 151.101.117.67.443: Flags [.], ack 135740, win 65535, length 0
19:28:24.629699 IP 151.101.117.67.443 > 10.0.2.15.37994: Flags [P.], seq 135740:143984, ack 867, win 65535, length 8244
19:28:24.629701 IP 151.101.117.67.443 > 10.0.2.15.37994: Flags [P.], seq 143984:146732, ack 867, win 65535, length 2748
19:28:24.629718 IP 10.0.2.15.37994 > 151.101.117.67.443: Flags [.], ack 143984, win 65535, length 0
19:28:24.629751 IP 10.0.2.15.37994 > 151.101.117.67.443: Flags [.], ack 146732, win 65535, length 0
19:28:24.630421 IP 151.101.117.67.443 > 10.0.2.15.37994: Flags [P.], seq 146732:153602, ack 867, win 65535, length 6870
19:28:24.630423 IP 151.101.117.67.443 > 10.0.2.15.37994: Flags [P.], seq 153602:156350, ack 867, win 65535, length 2748
19:28:24.630489 IP 10.0.2.15.37994 > 151.101.117.67.443: Flags [.], ack 153602, win 65535, length 0
19:28:24.630515 IP 10.0.2.15.37994 > 151.101.117.67.443: Flags [.], ack 156350, win 65535, length 0
19:28:24.630858 IP 151.101.117.67.443 > 10.0.2.15.37994: Flags [P.], seq 156350:159098, ack 867, win 65535, length 2748
19:28:24.630866 IP 10.0.2.15.37994 > 151.101.117.67.443: Flags [.], ack 159098, win 65535, length 0
19:28:24.632074 IP 151.101.117.67.443 > 10.0.2.15.37994: Flags [P.], seq 159098:171464, ack 867, win 65535, length 12366
19:28:24.632099 IP 10.0.2.15.37994 > 151.101.117.67.443: Flags [.], ack 171464, win 65535, length 0
19:28:24.632159 IP 151.101.117.67.443 > 10.0.2.15.37994: Flags [P.], seq 171464:172838, ack 867, win 65535, length 1374
19:28:24.634040 IP 151.101.117.67.443 > 10.0.2.15.37994: Flags [P.], seq 172838:183830, ack 867, win 65535, length 10992
19:28:24.634063 IP 10.0.2.15.37994 > 151.101.117.67.443: Flags [.], ack 183830, win 65535, length 0
19:28:24.634116 IP 151.101.117.67.443 > 10.0.2.15.37994: Flags [P.], seq 183830:186578, ack 867, win 65535, length 2748
19:28:24.634117 IP 151.101.117.67.443 > 10.0.2.15.37994: Flags [P.], seq 186578:189326, ack 867, win 65535, length 2748
19:28:24.634129 IP 10.0.2.15.37994 > 151.101.117.67.443: Flags [.], ack 186578, win 65535, length 0
19:28:24.634150 IP 10.0.2.15.37994 > 151.101.117.67.443: Flags [.], ack 189326, win 65535, length 0
19:28:24.635670 IP 151.101.117.67.443 > 10.0.2.15.37994: Flags [P.], seq 189326:198944, ack 867, win 65535, length 9618
19:28:24.635673 IP 151.101.117.67.443 > 10.0.2.15.37994: Flags [P.], seq 198944:204440, ack 867, win 65535, length 5496
19:28:24.635695 IP 10.0.2.15.37994 > 151.101.117.67.443: Flags [.], ack 198944, win 65535, length 0
19:28:24.635734 IP 10.0.2.15.37994 > 151.101.117.67.443: Flags [.], ack 204440, win 65535, length 0
19:28:24.636807 IP 151.101.117.67.443 > 10.0.2.15.37994: Flags [P.], seq 204440:212684, ack 867, win 65535, length 8244
19:28:24.636912 IP 10.0.2.15.37994 > 151.101.117.67.443: Flags [.], ack 212684, win 65535, length 0
19:28:24.637406 IP 151.101.117.67.443 > 10.0.2.15.37994: Flags [P.], seq 212684:216806, ack 867, win 65535, length 4122
19:28:24.637408 IP 151.101.117.67.443 > 10.0.2.15.37994: Flags [P.], seq 216806:222302, ack 867, win 65535, length 5496
19:28:24.637408 IP 151.101.117.67.443 > 10.0.2.15.37994: Flags [P.], seq 222302:223676, ack 867, win 65535, length 1374
19:28:24.637469 IP 10.0.2.15.37994 > 151.101.117.67.443: Flags [.], ack 216806, win 65535, length 0
19:28:24.637500 IP 10.0.2.15.37994 > 151.101.117.67.443: Flags [.], ack 222302, win 65535, length 0
19:28:24.637540 IP 151.101.117.67.443 > 10.0.2.15.37994: Flags [P.], seq 223676:226424, ack 867, win 65535, length 2748
19:28:24.637542 IP 151.101.117.67.443 > 10.0.2.15.37994: Flags [P.], seq 226424:229172, ack 867, win 65535, length 2748
19:28:24.637542 IP 151.101.117.67.443 > 10.0.2.15.37994: Flags [P.], seq 229172:230546, ack 867, win 65535, length 1374
19:28:24.637551 IP 10.0.2.15.37994 > 151.101.117.67.443: Flags [.], ack 226424, win 65535, length 0
19:28:24.637569 IP 10.0.2.15.37994 > 151.101.117.67.443: Flags [.], ack 229172, win 65535, length 0
19:28:24.638167 IP 151.101.117.67.443 > 10.0.2.15.37994: Flags [P.], seq 230546:234668, ack 867, win 65535, length 4122
19:28:24.638169 IP 151.101.117.67.443 > 10.0.2.15.37994: Flags [P.], seq 234668:236042, ack 867, win 65535, length 1374
19:28:24.638169 IP 151.101.117.67.443 > 10.0.2.15.37994: Flags [P.], seq 236042:240164, ack 867, win 65535, length 4122
19:28:24.638181 IP 10.0.2.15.37994 > 151.101.117.67.443: Flags [.], ack 234668, win 65535, length 0
19:28:24.638244 IP 10.0.2.15.37994 > 151.101.117.67.443: Flags [.], ack 240164, win 65535, length 0
19:28:24.639691 IP 151.101.117.67.443 > 10.0.2.15.37994: Flags [P.], seq 240164:251156, ack 867, win 65535, length 10992
19:28:24.639708 IP 10.0.2.15.37994 > 151.101.117.67.443: Flags [.], ack 251156, win 65535, length 0
19:28:24.640923 IP 151.101.117.67.443 > 10.0.2.15.37994: Flags [P.], seq 251156:260774, ack 867, win 65535, length 9618
19:28:24.640967 IP 151.101.117.67.443 > 10.0.2.15.37994: Flags [P.], seq 260774:264896, ack 867, win 65535, length 4122
19:28:24.640991 IP 10.0.2.15.37994 > 151.101.117.67.443: Flags [.], ack 260774, win 65535, length 0
19:28:24.641023 IP 10.0.2.15.37994 > 151.101.117.67.443: Flags [.], ack 264896, win 65535, length 0
19:28:24.641049 IP 151.101.117.67.443 > 10.0.2.15.37994: Flags [P.], seq 264896:266270, ack 867, win 65535, length 1374
19:28:24.641050 IP 151.101.117.67.443 > 10.0.2.15.37994: Flags [P.], seq 266270:269018, ack 867, win 65535, length 2748
19:28:24.641056 IP 10.0.2.15.37994 > 151.101.117.67.443: Flags [.], ack 269018, win 65535, length 0
19:28:24.641177 IP 151.101.117.67.443 > 10.0.2.15.37994: Flags [P.], seq 269018:271766, ack 867, win 65535, length 2748
19:28:24.641185 IP 10.0.2.15.37994 > 151.101.117.67.443: Flags [.], ack 271766, win 65535, length 0
19:28:24.641497 IP 151.101.117.67.443 > 10.0.2.15.37994: Flags [P.], seq 271766:275888, ack 867, win 65535, length 4122
19:28:24.641499 IP 151.101.117.67.443 > 10.0.2.15.37994: Flags [P.], seq 275888:277262, ack 867, win 65535, length 1374
19:28:24.641515 IP 10.0.2.15.37994 > 151.101.117.67.443: Flags [.], ack 275888, win 65535, length 0
19:28:24.641609 IP 151.101.117.67.443 > 10.0.2.15.37994: Flags [P.], seq 277262:280010, ack 867, win 65535, length 2748
19:28:24.641610 IP 151.101.117.67.443 > 10.0.2.15.37994: Flags [P.], seq 280010:281384, ack 867, win 65535, length 1374
19:28:24.641617 IP 10.0.2.15.37994 > 151.101.117.67.443: Flags [.], ack 280010, win 65535, length 0
19:28:24.641802 IP 151.101.117.67.443 > 10.0.2.15.37994: Flags [P.], seq 281384:285506, ack 867, win 65535, length 4122
19:28:24.641810 IP 10.0.2.15.37994 > 151.101.117.67.443: Flags [.], ack 285506, win 65535, length 0
19:28:24.642878 IP 151.101.117.67.443 > 10.0.2.15.37994: Flags [P.], seq 285506:292376, ack 867, win 65535, length 6870
19:28:24.642880 IP 151.101.117.67.443 > 10.0.2.15.37994: Flags [P.], seq 292376:295124, ack 867, win 65535, length 2748
19:28:24.642897 IP 10.0.2.15.37994 > 151.101.117.67.443: Flags [.], ack 292376, win 65535, length 0
19:28:24.642930 IP 10.0.2.15.37994 > 151.101.117.67.443: Flags [.], ack 295124, win 65535, length 0
19:28:24.643115 IP 151.101.117.67.443 > 10.0.2.15.37994: Flags [P.], seq 295124:297872, ack 867, win 65535, length 2748
19:28:24.643121 IP 10.0.2.15.37994 > 151.101.117.67.443: Flags [.], ack 297872, win 65535, length 0
19:28:24.644327 IP 151.101.117.67.443 > 10.0.2.15.37994: Flags [P.], seq 297872:308864, ack 867, win 65535, length 10992
19:28:24.644350 IP 10.0.2.15.37994 > 151.101.117.67.443: Flags [.], ack 308864, win 65535, length 0
19:28:24.644576 IP 151.101.117.67.443 > 10.0.2.15.37994: Flags [P.], seq 308864:314360, ack 867, win 65535, length 5496
19:28:24.644591 IP 10.0.2.15.37994 > 151.101.117.67.443: Flags [.], ack 314360, win 65535, length 0
19:28:24.644840 IP 151.101.117.67.443 > 10.0.2.15.37994: Flags [P.], seq 314360:317108, ack 867, win 65535, length 2748
19:28:24.644842 IP 151.101.117.67.443 > 10.0.2.15.37994: Flags [P.], seq 317108:321230, ack 867, win 65535, length 4122
19:28:24.644843 IP 151.101.117.67.443 > 10.0.2.15.37994: Flags [P.], seq 321230:322604, ack 867, win 65535, length 1374
19:28:24.644856 IP 10.0.2.15.37994 > 151.101.117.67.443: Flags [.], ack 317108, win 65535, length 0
19:28:24.644880 IP 10.0.2.15.37994 > 151.101.117.67.443: Flags [.], ack 321230, win 65535, length 0
19:28:24.645011 IP 151.101.117.67.443 > 10.0.2.15.37994: Flags [P.], seq 322604:325352, ack 867, win 65535, length 2748
19:28:24.645016 IP 10.0.2.15.37994 > 151.101.117.67.443: Flags [.], ack 325352, win 65535, length 0
19:28:24.645905 IP 151.101.117.67.443 > 10.0.2.15.37994: Flags [P.], seq 325352:330848, ack 867, win 65535, length 5496
19:28:24.645907 IP 151.101.117.67.443 > 10.0.2.15.37994: Flags [P.], seq 330848:332222, ack 867, win 65535, length 1374
19:28:24.646508 IP 10.0.2.15.37994 > 151.101.117.67.443: Flags [.], ack 332222, win 65535, length 0
19:28:24.646543 IP 151.101.117.67.443 > 10.0.2.15.37994: Flags [P.], seq 332222:336344, ack 867, win 65535, length 4122
19:28:24.646544 IP 151.101.117.67.443 > 10.0.2.15.37994: Flags [P.], seq 336344:337718, ack 867, win 65535, length 1374
19:28:24.646727 IP 10.0.2.15.37994 > 151.101.117.67.443: Flags [.], ack 337718, win 65535, length 0
19:28:24.650653 IP 151.101.117.67.443 > 10.0.2.15.37994: Flags [P.], seq 337718:347336, ack 867, win 65535, length 9618
19:28:24.650656 IP 151.101.117.67.443 > 10.0.2.15.37994: Flags [P.], seq 347336:351458, ack 867, win 65535, length 4122
19:28:24.650681 IP 10.0.2.15.37994 > 151.101.117.67.443: Flags [.], ack 347336, win 65535, length 0
19:28:24.650710 IP 10.0.2.15.37994 > 151.101.117.67.443: Flags [.], ack 351458, win 65535, length 0
19:28:24.650738 IP 151.101.117.67.443 > 10.0.2.15.37994: Flags [P.], seq 351458:356954, ack 867, win 65535, length 5496
19:28:24.650739 IP 151.101.117.67.443 > 10.0.2.15.37994: Flags [P.], seq 356954:362450, ack 867, win 65535, length 5496
19:28:24.650746 IP 10.0.2.15.37994 > 151.101.117.67.443: Flags [.], ack 356954, win 65535, length 0
19:28:24.650815 IP 10.0.2.15.37994 > 151.101.117.67.443: Flags [.], ack 362450, win 65535, length 0
19:28:24.650848 IP 151.101.117.67.443 > 10.0.2.15.37994: Flags [P.], seq 362450:365198, ack 867, win 65535, length 2748
19:28:24.650849 IP 151.101.117.67.443 > 10.0.2.15.37994: Flags [P.], seq 365198:366572, ack 867, win 65535, length 1374
19:28:24.650857 IP 10.0.2.15.37994 > 151.101.117.67.443: Flags [.], ack 365198, win 65535, length 0
19:28:24.654418 IP 151.101.117.67.443 > 10.0.2.15.37994: Flags [.], seq 366572:404532, ack 867, win 65535, length 37960
19:28:24.654449 IP 10.0.2.15.37994 > 151.101.117.67.443: Flags [.], ack 404532, win 65535, length 0
19:28:24.654587 IP 151.101.117.67.443 > 10.0.2.15.37994: Flags [P.], seq 404532:418784, ack 867, win 65535, length 14252
19:28:24.654598 IP 10.0.2.15.37994 > 151.101.117.67.443: Flags [.], ack 418784, win 65535, length 0
19:28:24.654873 IP 151.101.117.67.443 > 10.0.2.15.37994: Flags [.], seq 418784:426084, ack 867, win 65535, length 7300
19:28:24.654973 IP 10.0.2.15.37994 > 151.101.117.67.443: Flags [.], ack 426084, win 65535, length 0
19:28:24.655380 IP 151.101.117.67.443 > 10.0.2.15.37994: Flags [P.], seq 426084:428402, ack 867, win 65535, length 2318
19:28:24.655382 IP 151.101.117.67.443 > 10.0.2.15.37994: Flags [P.], seq 428402:432524, ack 867, win 65535, length 4122
19:28:24.655383 IP 151.101.117.67.443 > 10.0.2.15.37994: Flags [P.], seq 432524:433898, ack 867, win 65535, length 1374
19:28:24.655383 IP 151.101.117.67.443 > 10.0.2.15.37994: Flags [P.], seq 433898:436646, ack 867, win 65535, length 2748
19:28:24.655399 IP 10.0.2.15.37994 > 151.101.117.67.443: Flags [.], ack 428402, win 65535, length 0
19:28:24.655423 IP 10.0.2.15.37994 > 151.101.117.67.443: Flags [.], ack 432524, win 65535, length 0
19:28:24.655476 IP 10.0.2.15.37994 > 151.101.117.67.443: Flags [.], ack 436646, win 65535, length 0
19:28:24.655498 IP 151.101.117.67.443 > 10.0.2.15.37994: Flags [P.], seq 436646:440768, ack 867, win 65535, length 4122
19:28:24.655498 IP 151.101.117.67.443 > 10.0.2.15.37994: Flags [P.], seq 440768:442142, ack 867, win 65535, length 1374
19:28:24.655499 IP 151.101.117.67.443 > 10.0.2.15.37994: Flags [P.], seq 442142:444890, ack 867, win 65535, length 2748
19:28:24.655504 IP 10.0.2.15.37994 > 151.101.117.67.443: Flags [.], ack 440768, win 65535, length 0
19:28:24.655568 IP 10.0.2.15.37994 > 151.101.117.67.443: Flags [.], ack 444890, win 65535, length 0
19:28:24.655698 IP 151.101.117.67.443 > 10.0.2.15.37994: Flags [P.], seq 444890:449012, ack 867, win 65535, length 4122
19:28:24.655752 IP 10.0.2.15.37994 > 151.101.117.67.443: Flags [.], ack 449012, win 65535, length 0
19:28:24.655901 IP 151.101.117.67.443 > 10.0.2.15.37994: Flags [P.], seq 449012:451760, ack 867, win 65535, length 2748
19:28:24.655902 IP 151.101.117.67.443 > 10.0.2.15.37994: Flags [P.], seq 451760:454508, ack 867, win 65535, length 2748
19:28:24.655914 IP 10.0.2.15.37994 > 151.101.117.67.443: Flags [.], ack 451760, win 65535, length 0
19:28:24.655933 IP 10.0.2.15.37994 > 151.101.117.67.443: Flags [.], ack 454508, win 65535, length 0
19:28:24.656272 IP 151.101.117.67.443 > 10.0.2.15.37994: Flags [P.], seq 454508:457256, ack 867, win 65535, length 2748
19:28:24.656274 IP 151.101.117.67.443 > 10.0.2.15.37994: Flags [P.], seq 457256:458630, ack 867, win 65535, length 1374
19:28:24.656284 IP 10.0.2.15.37994 > 151.101.117.67.443: Flags [.], ack 457256, win 65535, length 0
19:28:24.656367 IP 151.101.117.67.443 > 10.0.2.15.37994: Flags [P.], seq 458630:462752, ack 867, win 65535, length 4122
19:28:24.656368 IP 151.101.117.67.443 > 10.0.2.15.37994: Flags [P.], seq 462752:464126, ack 867, win 65535, length 1374
19:28:24.656374 IP 10.0.2.15.37994 > 151.101.117.67.443: Flags [.], ack 462752, win 65535, length 0
19:28:24.657253 IP 151.101.117.67.443 > 10.0.2.15.37994: Flags [P.], seq 464126:469622, ack 867, win 65535, length 5496
19:28:24.657255 IP 151.101.117.67.443 > 10.0.2.15.37994: Flags [P.], seq 469622:470996, ack 867, win 65535, length 1374
19:28:24.657256 IP 151.101.117.67.443 > 10.0.2.15.37994: Flags [P.], seq 470996:473744, ack 867, win 65535, length 2748
19:28:24.657257 IP 151.101.117.67.443 > 10.0.2.15.37994: Flags [P.], seq 473744:477866, ack 867, win 65535, length 4122
19:28:24.657278 IP 10.0.2.15.37994 > 151.101.117.67.443: Flags [.], ack 469622, win 65535, length 0
19:28:24.657402 IP 10.0.2.15.37994 > 151.101.117.67.443: Flags [.], ack 473744, win 65535, length 0
19:28:24.657526 IP 10.0.2.15.37994 > 151.101.117.67.443: Flags [.], ack 477866, win 65535, length 0
19:28:24.657759 IP 151.101.117.67.443 > 10.0.2.15.37994: Flags [P.], seq 477866:480614, ack 867, win 65535, length 2748
19:28:24.657760 IP 151.101.117.67.443 > 10.0.2.15.37994: Flags [P.], seq 480614:481988, ack 867, win 65535, length 1374
19:28:24.657761 IP 151.101.117.67.443 > 10.0.2.15.37994: Flags [P.], seq 481988:484736, ack 867, win 65535, length 2748
19:28:24.657761 IP 151.101.117.67.443 > 10.0.2.15.37994: Flags [P.], seq 484736:487484, ack 867, win 65535, length 2748
19:28:24.657762 IP 151.101.117.67.443 > 10.0.2.15.37994: Flags [P.], seq 487484:490232, ack 867, win 65535, length 2748
19:28:24.657775 IP 10.0.2.15.37994 > 151.101.117.67.443: Flags [.], ack 480614, win 65535, length 0
19:28:24.657791 IP 10.0.2.15.37994 > 151.101.117.67.443: Flags [.], ack 484736, win 65535, length 0
19:28:24.657798 IP 10.0.2.15.37994 > 151.101.117.67.443: Flags [.], ack 487484, win 65535, length 0
19:28:24.657806 IP 10.0.2.15.37994 > 151.101.117.67.443: Flags [.], ack 490232, win 65535, length 0
19:28:24.658626 IP 151.101.117.67.443 > 10.0.2.15.37994: Flags [P.], seq 490232:495728, ack 867, win 65535, length 5496
19:28:24.658684 IP 10.0.2.15.37994 > 151.101.117.67.443: Flags [.], ack 495728, win 65535, length 0
19:28:24.659081 IP 151.101.117.67.443 > 10.0.2.15.37994: Flags [P.], seq 495728:499850, ack 867, win 65535, length 4122
19:28:24.659222 IP 151.101.117.67.443 > 10.0.2.15.37994: Flags [P.], seq 499850:501224, ack 867, win 65535, length 1374
19:28:24.659225 IP 151.101.117.67.443 > 10.0.2.15.37994: Flags [P.], seq 501224:505346, ack 867, win 65535, length 4122
19:28:24.659226 IP 151.101.117.67.443 > 10.0.2.15.37994: Flags [P.], seq 505346:508094, ack 867, win 65535, length 2748
19:28:24.659251 IP 151.101.117.67.443 > 10.0.2.15.37994: Flags [P.], seq 508094:510842, ack 867, win 65535, length 2748
19:28:24.659251 IP 151.101.117.67.443 > 10.0.2.15.37994: Flags [P.], seq 510842:512216, ack 867, win 65535, length 1374
19:28:24.659275 IP 10.0.2.15.37994 > 151.101.117.67.443: Flags [.], ack 512216, win 65535, length 0
19:28:24.659539 IP 151.101.117.67.443 > 10.0.2.15.37994: Flags [P.], seq 512216:516338, ack 867, win 65535, length 4122
19:28:24.659664 IP 10.0.2.15.37994 > 151.101.117.67.443: Flags [.], ack 516338, win 65535, length 0
19:28:24.660016 IP 151.101.117.67.443 > 10.0.2.15.37994: Flags [P.], seq 516338:519086, ack 867, win 65535, length 2748
19:28:24.660017 IP 151.101.117.67.443 > 10.0.2.15.37994: Flags [P.], seq 519086:520460, ack 867, win 65535, length 1374
19:28:24.660018 IP 151.101.117.67.443 > 10.0.2.15.37994: Flags [P.], seq 520460:523208, ack 867, win 65535, length 2748
19:28:24.660019 IP 151.101.117.67.443 > 10.0.2.15.37994: Flags [P.], seq 523208:527330, ack 867, win 65535, length 4122
19:28:24.660063 IP 10.0.2.15.37994 > 151.101.117.67.443: Flags [.], ack 527330, win 65535, length 0
19:28:24.660286 IP 151.101.117.67.443 > 10.0.2.15.37994: Flags [P.], seq 527330:531452, ack 867, win 65535, length 4122
19:28:24.660294 IP 10.0.2.15.37994 > 151.101.117.67.443: Flags [.], ack 531452, win 65535, length 0
19:28:24.661572 IP 151.101.117.67.443 > 10.0.2.15.37994: Flags [P.], seq 531452:536948, ack 867, win 65535, length 5496
19:28:24.661574 IP 151.101.117.67.443 > 10.0.2.15.37994: Flags [P.], seq 536948:541070, ack 867, win 65535, length 4122
19:28:24.661575 IP 151.101.117.67.443 > 10.0.2.15.37994: Flags [P.], seq 541070:543818, ack 867, win 65535, length 2748
19:28:24.661593 IP 10.0.2.15.37994 > 151.101.117.67.443: Flags [.], ack 536948, win 65535, length 0
19:28:24.661620 IP 10.0.2.15.37994 > 151.101.117.67.443: Flags [.], ack 541070, win 65535, length 0
19:28:24.661706 IP 10.0.2.15.37994 > 151.101.117.67.443: Flags [.], ack 543818, win 65535, length 0
19:28:24.661759 IP 151.101.117.67.443 > 10.0.2.15.37994: Flags [P.], seq 543818:545192, ack 867, win 65535, length 1374
19:28:24.661885 IP 151.101.117.67.443 > 10.0.2.15.37994: Flags [P.], seq 545192:550688, ack 867, win 65535, length 5496
19:28:24.661886 IP 151.101.117.67.443 > 10.0.2.15.37994: Flags [P.], seq 550688:553436, ack 867, win 65535, length 2748
19:28:24.661897 IP 10.0.2.15.37994 > 151.101.117.67.443: Flags [.], ack 550688, win 65535, length 0
19:28:24.661964 IP 10.0.2.15.37994 > 151.101.117.67.443: Flags [.], ack 553436, win 65535, length 0
19:28:24.662048 IP 151.101.117.67.443 > 10.0.2.15.37994: Flags [P.], seq 553436:554810, ack 867, win 65535, length 1374
19:28:24.662251 IP 151.101.117.67.443 > 10.0.2.15.37994: Flags [P.], seq 554810:557558, ack 867, win 65535, length 2748
19:28:24.662259 IP 10.0.2.15.37994 > 151.101.117.67.443: Flags [.], ack 557558, win 65535, length 0
19:28:24.662455 IP 151.101.117.67.443 > 10.0.2.15.37994: Flags [P.], seq 557558:561680, ack 867, win 65535, length 4122
19:28:24.662456 IP 151.101.117.67.443 > 10.0.2.15.37994: Flags [P.], seq 561680:564428, ack 867, win 65535, length 2748
19:28:24.662466 IP 10.0.2.15.37994 > 151.101.117.67.443: Flags [.], ack 561680, win 65535, length 0
19:28:24.662482 IP 10.0.2.15.37994 > 151.101.117.67.443: Flags [.], ack 564428, win 65535, length 0
19:28:24.662624 IP 151.101.117.67.443 > 10.0.2.15.37994: Flags [P.], seq 564428:567176, ack 867, win 65535, length 2748
19:28:24.662631 IP 10.0.2.15.37994 > 151.101.117.67.443: Flags [.], ack 567176, win 65535, length 0
19:28:24.663802 IP 151.101.117.67.443 > 10.0.2.15.37994: Flags [P.], seq 567176:574046, ack 867, win 65535, length 6870
19:28:24.663816 IP 10.0.2.15.37994 > 151.101.117.67.443: Flags [.], ack 574046, win 65535, length 0
19:28:24.664062 IP 151.101.117.67.443 > 10.0.2.15.37994: Flags [P.], seq 574046:578168, ack 867, win 65535, length 4122
19:28:24.664064 IP 151.101.117.67.443 > 10.0.2.15.37994: Flags [P.], seq 578168:579542, ack 867, win 65535, length 1374
19:28:24.664065 IP 151.101.117.67.443 > 10.0.2.15.37994: Flags [P.], seq 579542:583664, ack 867, win 65535, length 4122
19:28:24.664216 IP 151.101.117.67.443 > 10.0.2.15.37994: Flags [P.], seq 583664:585038, ack 867, win 65535, length 1374
19:28:24.664443 IP 151.101.117.67.443 > 10.0.2.15.37994: Flags [P.], seq 585038:589160, ack 867, win 65535, length 4122
19:28:24.664444 IP 151.101.117.67.443 > 10.0.2.15.37994: Flags [P.], seq 589160:590534, ack 867, win 65535, length 1374
19:28:24.664660 IP 151.101.117.67.443 > 10.0.2.15.37994: Flags [P.], seq 590534:593282, ack 867, win 65535, length 2748
19:28:24.664701 IP 10.0.2.15.37994 > 151.101.117.67.443: Flags [.], ack 593282, win 65535, length 0
19:28:24.665017 IP 151.101.117.67.443 > 10.0.2.15.37994: Flags [P.], seq 593282:597404, ack 867, win 65535, length 4122
19:28:24.665018 IP 151.101.117.67.443 > 10.0.2.15.37994: Flags [P.], seq 597404:598778, ack 867, win 65535, length 1374
19:28:24.665104 IP 151.101.117.67.443 > 10.0.2.15.37994: Flags [P.], seq 598778:602900, ack 867, win 65535, length 4122
19:28:24.665139 IP 10.0.2.15.37994 > 151.101.117.67.443: Flags [.], ack 602900, win 65535, length 0
19:28:24.665231 IP 151.101.117.67.443 > 10.0.2.15.37994: Flags [P.], seq 602900:604274, ack 867, win 65535, length 1374
19:28:24.665486 IP 151.101.117.67.443 > 10.0.2.15.37994: Flags [P.], seq 604274:607022, ack 867, win 65535, length 2748
19:28:24.665487 IP 151.101.117.67.443 > 10.0.2.15.37994: Flags [P.], seq 607022:609770, ack 867, win 65535, length 2748
19:28:24.665593 IP 10.0.2.15.37994 > 151.101.117.67.443: Flags [.], ack 609770, win 65535, length 0
19:28:24.665729 IP 151.101.117.67.443 > 10.0.2.15.37994: Flags [P.], seq 609770:613892, ack 867, win 65535, length 4122
19:28:24.665731 IP 151.101.117.67.443 > 10.0.2.15.37994: Flags [P.], seq 613892:615266, ack 867, win 65535, length 1374
19:28:24.665776 IP 10.0.2.15.37994 > 151.101.117.67.443: Flags [.], ack 615266, win 65535, length 0
19:28:24.665914 IP 151.101.117.67.443 > 10.0.2.15.37994: Flags [P.], seq 615266:616640, ack 867, win 65535, length 1374
19:28:24.665916 IP 151.101.117.67.443 > 10.0.2.15.37994: Flags [P.], seq 616640:619388, ack 867, win 65535, length 2748
19:28:24.665986 IP 10.0.2.15.37994 > 151.101.117.67.443: Flags [.], ack 619388, win 65535, length 0
19:28:24.666107 IP 151.101.117.67.443 > 10.0.2.15.37994: Flags [P.], seq 619388:622136, ack 867, win 65535, length 2748
19:28:24.666114 IP 10.0.2.15.37994 > 151.101.117.67.443: Flags [.], ack 622136, win 65535, length 0
19:28:24.666311 IP 151.101.117.67.443 > 10.0.2.15.37994: Flags [P.], seq 622136:626258, ack 867, win 65535, length 4122
19:28:24.666312 IP 151.101.117.67.443 > 10.0.2.15.37994: Flags [P.], seq 626258:627632, ack 867, win 65535, length 1374
19:28:24.666320 IP 10.0.2.15.37994 > 151.101.117.67.443: Flags [.], ack 626258, win 65535, length 0
19:28:24.666512 IP 151.101.117.67.443 > 10.0.2.15.37994: Flags [P.], seq 627632:630380, ack 867, win 65535, length 2748
19:28:24.666520 IP 10.0.2.15.37994 > 151.101.117.67.443: Flags [.], ack 630380, win 65535, length 0
19:28:24.666944 IP 151.101.117.67.443 > 10.0.2.15.37994: Flags [P.], seq 630380:635876, ack 867, win 65535, length 5496
19:28:24.666946 IP 151.101.117.67.443 > 10.0.2.15.37994: Flags [P.], seq 635876:638624, ack 867, win 65535, length 2748
19:28:24.667007 IP 10.0.2.15.37994 > 151.101.117.67.443: Flags [.], ack 635876, win 65535, length 0
19:28:24.667271 IP 10.0.2.15.37994 > 151.101.117.67.443: Flags [.], ack 638624, win 65535, length 0
19:28:24.667851 IP 151.101.117.67.443 > 10.0.2.15.37994: Flags [P.], seq 638624:642746, ack 867, win 65535, length 4122
19:28:24.667853 IP 151.101.117.67.443 > 10.0.2.15.37994: Flags [.], seq 642746:645666, ack 867, win 65535, length 2920
19:28:24.667875 IP 10.0.2.15.37994 > 151.101.117.67.443: Flags [.], ack 642746, win 65535, length 0
19:28:24.668025 IP 10.0.2.15.37994 > 151.101.117.67.443: Flags [.], ack 645666, win 65535, length 0
19:28:24.668121 IP 151.101.117.67.443 > 10.0.2.15.37994: Flags [P.], seq 645666:646868, ack 867, win 65535, length 1202
19:28:24.668122 IP 151.101.117.67.443 > 10.0.2.15.37994: Flags [P.], seq 646868:650990, ack 867, win 65535, length 4122
19:28:24.668123 IP 151.101.117.67.443 > 10.0.2.15.37994: Flags [P.], seq 650990:652364, ack 867, win 65535, length 1374
19:28:24.668151 IP 10.0.2.15.37994 > 151.101.117.67.443: Flags [.], ack 652364, win 65535, length 0
19:28:24.668683 IP 151.101.117.67.443 > 10.0.2.15.37994: Flags [P.], seq 652364:655112, ack 867, win 65535, length 2748
19:28:24.668685 IP 151.101.117.67.443 > 10.0.2.15.37994: Flags [P.], seq 655112:660608, ack 867, win 65535, length 5496
19:28:24.668686 IP 151.101.117.67.443 > 10.0.2.15.37994: Flags [P.], seq 660608:663356, ack 867, win 65535, length 2748
19:28:24.668810 IP 10.0.2.15.37994 > 151.101.117.67.443: Flags [.], ack 663356, win 65535, length 0
19:28:24.669165 IP 151.101.117.67.443 > 10.0.2.15.37994: Flags [P.], seq 663356:666104, ack 867, win 65535, length 2748
19:28:24.669167 IP 151.101.117.67.443 > 10.0.2.15.37994: Flags [P.], seq 666104:668852, ack 867, win 65535, length 2748
19:28:24.669168 IP 151.101.117.67.443 > 10.0.2.15.37994: Flags [P.], seq 668852:672974, ack 867, win 65535, length 4122
19:28:24.669169 IP 151.101.117.67.443 > 10.0.2.15.37994: Flags [P.], seq 672974:674348, ack 867, win 65535, length 1374
19:28:24.669256 IP 10.0.2.15.37994 > 151.101.117.67.443: Flags [.], ack 674348, win 65535, length 0
19:28:24.670779 IP 151.101.117.67.443 > 10.0.2.15.37994: Flags [P.], seq 674348:679844, ack 867, win 65535, length 5496
19:28:24.670782 IP 151.101.117.67.443 > 10.0.2.15.37994: Flags [P.], seq 679844:683966, ack 867, win 65535, length 4122
19:28:24.670783 IP 151.101.117.67.443 > 10.0.2.15.37994: Flags [P.], seq 683966:686714, ack 867, win 65535, length 2748
19:28:24.670803 IP 10.0.2.15.37994 > 151.101.117.67.443: Flags [.], ack 679844, win 65535, length 0
19:28:24.670952 IP 151.101.117.67.443 > 10.0.2.15.37994: Flags [P.], seq 686714:689462, ack 867, win 65535, length 2748
19:28:24.670954 IP 151.101.117.67.443 > 10.0.2.15.37994: Flags [P.], seq 689462:693584, ack 867, win 65535, length 4122
19:28:24.670955 IP 151.101.117.67.443 > 10.0.2.15.37994: Flags [P.], seq 693584:697706, ack 867, win 65535, length 4122
19:28:24.671080 IP 151.101.117.67.443 > 10.0.2.15.37994: Flags [P.], seq 697706:700454, ack 867, win 65535, length 2748
19:28:24.671156 IP 10.0.2.15.37994 > 151.101.117.67.443: Flags [.], ack 700454, win 65535, length 0
19:28:24.671346 IP 151.101.117.67.443 > 10.0.2.15.37994: Flags [P.], seq 700454:704576, ack 867, win 65535, length 4122
19:28:24.671567 IP 151.101.117.67.443 > 10.0.2.15.37994: Flags [P.], seq 704576:708698, ack 867, win 65535, length 4122
19:28:24.671569 IP 151.101.117.67.443 > 10.0.2.15.37994: Flags [P.], seq 708698:710072, ack 867, win 65535, length 1374
19:28:24.671607 IP 10.0.2.15.37994 > 151.101.117.67.443: Flags [.], ack 710072, win 65535, length 0
19:28:24.673101 IP 151.101.117.67.443 > 10.0.2.15.37994: Flags [P.], seq 710072:719690, ack 867, win 65535, length 9618
19:28:24.673103 IP 151.101.117.67.443 > 10.0.2.15.37994: Flags [P.], seq 719690:722438, ack 867, win 65535, length 2748
19:28:24.673124 IP 10.0.2.15.37994 > 151.101.117.67.443: Flags [.], ack 719690, win 65535, length 0
19:28:24.673706 IP 151.101.117.67.443 > 10.0.2.15.37994: Flags [P.], seq 722438:725186, ack 867, win 65535, length 2748
19:28:24.673708 IP 151.101.117.67.443 > 10.0.2.15.37994: Flags [P.], seq 725186:729308, ack 867, win 65535, length 4122
19:28:24.673709 IP 151.101.117.67.443 > 10.0.2.15.37994: Flags [.], seq 729308:730768, ack 867, win 65535, length 1460
19:28:24.673863 IP 151.101.117.67.443 > 10.0.2.15.37994: Flags [P.], seq 730768:733430, ack 867, win 65535, length 2662
19:28:24.673864 IP 151.101.117.67.443 > 10.0.2.15.37994: Flags [P.], seq 733430:736178, ack 867, win 65535, length 2748
19:28:24.673865 IP 151.101.117.67.443 > 10.0.2.15.37994: Flags [P.], seq 736178:737552, ack 867, win 65535, length 1374
19:28:24.673865 IP 151.101.117.67.443 > 10.0.2.15.37994: Flags [P.], seq 737552:741674, ack 867, win 65535, length 4122
19:28:24.673925 IP 10.0.2.15.37994 > 151.101.117.67.443: Flags [.], ack 741674, win 65535, length 0
19:28:24.674822 IP 151.101.117.67.443 > 10.0.2.15.37994: Flags [P.], seq 741674:749918, ack 867, win 65535, length 8244
19:28:24.674864 IP 151.101.117.67.443 > 10.0.2.15.37994: Flags [P.], seq 749918:751292, ack 867, win 65535, length 1374
19:28:24.674880 IP 10.0.2.15.37994 > 151.101.117.67.443: Flags [.], ack 749918, win 65535, length 0
19:28:24.675101 IP 151.101.117.67.443 > 10.0.2.15.37994: Flags [P.], seq 751292:754040, ack 867, win 65535, length 2748
19:28:24.675102 IP 151.101.117.67.443 > 10.0.2.15.37994: Flags [P.], seq 754040:756788, ack 867, win 65535, length 2748
19:28:24.675281 IP 151.101.117.67.443 > 10.0.2.15.37994: Flags [P.], seq 756788:759536, ack 867, win 65535, length 2748
19:28:24.675283 IP 151.101.117.67.443 > 10.0.2.15.37994: Flags [P.], seq 759536:760910, ack 867, win 65535, length 1374
19:28:24.675337 IP 10.0.2.15.37994 > 151.101.117.67.443: Flags [.], ack 760910, win 65535, length 0
19:28:24.675506 IP 151.101.117.67.443 > 10.0.2.15.37994: Flags [P.], seq 760910:765032, ack 867, win 65535, length 4122
19:28:24.675507 IP 151.101.117.67.443 > 10.0.2.15.37994: Flags [P.], seq 765032:766406, ack 867, win 65535, length 1374
19:28:24.675753 IP 151.101.117.67.443 > 10.0.2.15.37994: Flags [P.], seq 766406:769154, ack 867, win 65535, length 2748
19:28:24.675908 IP 10.0.2.15.37994 > 151.101.117.67.443: Flags [.], ack 769154, win 65535, length 0
19:28:24.675936 IP 151.101.117.67.443 > 10.0.2.15.37994: Flags [P.], seq 769154:773276, ack 867, win 65535, length 4122
19:28:24.675937 IP 151.101.117.67.443 > 10.0.2.15.37994: Flags [P.], seq 773276:774650, ack 867, win 65535, length 1374
19:28:24.676142 IP 151.101.117.67.443 > 10.0.2.15.37994: Flags [P.], seq 774650:777398, ack 867, win 65535, length 2748
19:28:24.676143 IP 151.101.117.67.443 > 10.0.2.15.37994: Flags [P.], seq 777398:778772, ack 867, win 65535, length 1374
19:28:24.676200 IP 10.0.2.15.37994 > 151.101.117.67.443: Flags [.], ack 774650, win 65535, length 0
19:28:24.676702 IP 151.101.117.67.443 > 10.0.2.15.37994: Flags [P.], seq 778772:782894, ack 867, win 65535, length 4122
19:28:24.677050 IP 151.101.117.67.443 > 10.0.2.15.37994: Flags [P.], seq 782894:789764, ack 867, win 65535, length 6870
19:28:24.677061 IP 151.101.117.67.443 > 10.0.2.15.37994: Flags [P.], seq 789764:792512, ack 867, win 65535, length 2748
19:28:24.677208 IP 151.101.117.67.443 > 10.0.2.15.37994: Flags [P.], seq 792512:795260, ack 867, win 65535, length 2748
19:28:24.677210 IP 151.101.117.67.443 > 10.0.2.15.37994: Flags [P.], seq 795260:798008, ack 867, win 65535, length 2748
19:28:24.677506 IP 151.101.117.67.443 > 10.0.2.15.37994: Flags [P.], seq 798008:799382, ack 867, win 65535, length 1374
19:28:24.677508 IP 151.101.117.67.443 > 10.0.2.15.37994: Flags [P.], seq 799382:803504, ack 867, win 65535, length 4122
19:28:24.677509 IP 151.101.117.67.443 > 10.0.2.15.37994: Flags [P.], seq 803504:804878, ack 867, win 65535, length 1374
19:28:24.678283 IP 10.0.2.15.37994 > 151.101.117.67.443: Flags [.], ack 804878, win 65535, length 0
19:28:24.680236 IP 151.101.117.67.443 > 10.0.2.15.37994: Flags [P.], seq 804878:813122, ack 867, win 65535, length 8244
19:28:24.680241 IP 151.101.117.67.443 > 10.0.2.15.37994: Flags [P.], seq 813122:829610, ack 867, win 65535, length 16488
19:28:24.680349 IP 151.101.117.67.443 > 10.0.2.15.37994: Flags [P.], seq 829610:833732, ack 867, win 65535, length 4122
19:28:24.680350 IP 151.101.117.67.443 > 10.0.2.15.37994: Flags [P.], seq 833732:835106, ack 867, win 65535, length 1374
19:28:24.680351 IP 151.101.117.67.443 > 10.0.2.15.37994: Flags [P.], seq 835106:839228, ack 867, win 65535, length 4122
19:28:24.682015 IP 10.0.2.15.37994 > 151.101.117.67.443: Flags [.], ack 839228, win 65535, length 0
19:28:24.682481 IP 151.101.117.67.443 > 10.0.2.15.37994: Flags [.], seq 839228:869888, ack 867, win 65535, length 30660
19:28:24.682494 IP 10.0.2.15.37994 > 151.101.117.67.443: Flags [.], ack 869888, win 65535, length 0
19:28:24.682586 IP 151.101.117.67.443 > 10.0.2.15.37994: Flags [P.], seq 869888:884570, ack 867, win 65535, length 14682
19:28:24.682628 IP 10.0.2.15.37994 > 151.101.117.67.443: Flags [.], ack 884570, win 65535, length 0
19:28:24.683020 IP 151.101.117.67.443 > 10.0.2.15.37994: Flags [P.], seq 884570:891440, ack 867, win 65535, length 6870
19:28:24.683075 IP 10.0.2.15.37994 > 151.101.117.67.443: Flags [.], ack 891440, win 65535, length 0
19:28:24.683240 IP 151.101.117.67.443 > 10.0.2.15.37994: Flags [P.], seq 891440:894188, ack 867, win 65535, length 2748
19:28:24.683264 IP 151.101.117.67.443 > 10.0.2.15.37994: Flags [P.], seq 894188:896936, ack 867, win 65535, length 2748
19:28:24.683275 IP 10.0.2.15.37994 > 151.101.117.67.443: Flags [.], ack 894188, win 65535, length 0
19:28:24.683349 IP 10.0.2.15.37994 > 151.101.117.67.443: Flags [.], ack 896936, win 65535, length 0
19:28:24.683572 IP 151.101.117.67.443 > 10.0.2.15.37994: Flags [P.], seq 896936:899684, ack 867, win 65535, length 2748
19:28:24.684118 IP 151.101.117.67.443 > 10.0.2.15.37994: Flags [P.], seq 899684:902432, ack 867, win 65535, length 2748
19:28:24.684121 IP 151.101.117.67.443 > 10.0.2.15.37994: Flags [P.], seq 902432:906554, ack 867, win 65535, length 4122
19:28:24.684122 IP 151.101.117.67.443 > 10.0.2.15.37994: Flags [P.], seq 906554:909302, ack 867, win 65535, length 2748
19:28:24.684123 IP 151.101.117.67.443 > 10.0.2.15.37994: Flags [P.], seq 909302:912050, ack 867, win 65535, length 2748
19:28:24.684331 IP 151.101.117.67.443 > 10.0.2.15.37994: Flags [P.], seq 912050:914798, ack 867, win 65535, length 2748
19:28:24.684335 IP 151.101.117.67.443 > 10.0.2.15.37994: Flags [P.], seq 914798:917546, ack 867, win 65535, length 2748
19:28:24.684834 IP 151.101.117.67.443 > 10.0.2.15.37994: Flags [P.], seq 917546:921668, ack 867, win 65535, length 4122
19:28:24.684836 IP 151.101.117.67.443 > 10.0.2.15.37994: Flags [P.], seq 921668:924416, ack 867, win 65535, length 2748
19:28:24.684837 IP 151.101.117.67.443 > 10.0.2.15.37994: Flags [P.], seq 924416:927164, ack 867, win 65535, length 2748
19:28:24.684879 IP 10.0.2.15.37994 > 151.101.117.67.443: Flags [.], ack 917546, win 65535, length 0
19:28:24.685346 IP 151.101.117.67.443 > 10.0.2.15.37994: Flags [P.], seq 927164:932660, ack 867, win 65535, length 5496
19:28:24.685348 IP 151.101.117.67.443 > 10.0.2.15.37994: Flags [P.], seq 932660:935408, ack 867, win 65535, length 2748
19:28:24.685349 IP 151.101.117.67.443 > 10.0.2.15.37994: Flags [P.], seq 935408:938156, ack 867, win 65535, length 2748
19:28:24.685646 IP 151.101.117.67.443 > 10.0.2.15.37994: Flags [P.], seq 938156:939530, ack 867, win 65535, length 1374
19:28:24.685789 IP 10.0.2.15.37994 > 151.101.117.67.443: Flags [.], ack 939530, win 65535, length 0
19:28:24.686947 IP 151.101.117.67.443 > 10.0.2.15.37994: Flags [P.], seq 939530:942278, ack 867, win 65535, length 2748
19:28:24.686954 IP 151.101.117.67.443 > 10.0.2.15.37994: Flags [P.], seq 942278:946400, ack 867, win 65535, length 4122
19:28:24.686955 IP 151.101.117.67.443 > 10.0.2.15.37994: Flags [P.], seq 946400:947774, ack 867, win 65535, length 1374
19:28:24.687164 IP 151.101.117.67.443 > 10.0.2.15.37994: Flags [P.], seq 947774:956018, ack 867, win 65535, length 8244
19:28:24.687166 IP 151.101.117.67.443 > 10.0.2.15.37994: Flags [P.], seq 956018:961514, ack 867, win 65535, length 5496
19:28:24.687243 IP 10.0.2.15.37994 > 151.101.117.67.443: Flags [.], ack 961514, win 65535, length 0
19:28:24.688153 IP 151.101.117.67.443 > 10.0.2.15.37994: Flags [P.], seq 961514:969758, ack 867, win 65535, length 8244
19:28:24.688168 IP 10.0.2.15.37994 > 151.101.117.67.443: Flags [.], ack 969758, win 65535, length 0
19:28:24.688680 IP 151.101.117.67.443 > 10.0.2.15.37994: Flags [P.], seq 969758:975254, ack 867, win 65535, length 5496
19:28:24.688682 IP 151.101.117.67.443 > 10.0.2.15.37994: Flags [P.], seq 975254:978002, ack 867, win 65535, length 2748
19:28:24.688683 IP 151.101.117.67.443 > 10.0.2.15.37994: Flags [P.], seq 978002:980750, ack 867, win 65535, length 2748
19:28:24.688707 IP 151.101.117.67.443 > 10.0.2.15.37994: Flags [P.], seq 980750:982124, ack 867, win 65535, length 1374
19:28:24.688869 IP 151.101.117.67.443 > 10.0.2.15.37994: Flags [P.], seq 982124:986246, ack 867, win 65535, length 4122
19:28:24.688871 IP 151.101.117.67.443 > 10.0.2.15.37994: Flags [P.], seq 986246:988994, ack 867, win 65535, length 2748
19:28:24.689038 IP 10.0.2.15.37994 > 151.101.117.67.443: Flags [.], ack 988994, win 65535, length 0
19:28:24.689418 IP 151.101.117.67.443 > 10.0.2.15.37994: Flags [P.], seq 988994:991742, ack 867, win 65535, length 2748
19:28:24.689419 IP 151.101.117.67.443 > 10.0.2.15.37994: Flags [P.], seq 991742:994490, ack 867, win 65535, length 2748
19:28:24.689420 IP 151.101.117.67.443 > 10.0.2.15.37994: Flags [P.], seq 994490:995864, ack 867, win 65535, length 1374
19:28:24.689421 IP 151.101.117.67.443 > 10.0.2.15.37994: Flags [P.], seq 995864:999986, ack 867, win 65535, length 4122
19:28:24.689619 IP 151.101.117.67.443 > 10.0.2.15.37994: Flags [P.], seq 999986:1001360, ack 867, win 65535, length 1374
19:28:24.689955 IP 151.101.117.67.443 > 10.0.2.15.37994: Flags [P.], seq 1001360:1005482, ack 867, win 65535, length 4122
19:28:24.689958 IP 151.101.117.67.443 > 10.0.2.15.37994: Flags [P.], seq 1005482:1008230, ack 867, win 65535, length 2748
19:28:24.689985 IP 10.0.2.15.37994 > 151.101.117.67.443: Flags [.], ack 999986, win 65535, length 0
19:28:24.690171 IP 151.101.117.67.443 > 10.0.2.15.37994: Flags [P.], seq 1008230:1010978, ack 867, win 65535, length 2748
19:28:24.690216 IP 10.0.2.15.37994 > 151.101.117.67.443: Flags [.], ack 1010978, win 65535, length 0
19:28:24.690453 IP 151.101.117.67.443 > 10.0.2.15.37994: Flags [P.], seq 1010978:1015100, ack 867, win 65535, length 4122
19:28:24.690455 IP 151.101.117.67.443 > 10.0.2.15.37994: Flags [P.], seq 1015100:1016474, ack 867, win 65535, length 1374
19:28:24.690483 IP 10.0.2.15.37994 > 151.101.117.67.443: Flags [.], ack 1016474, win 65535, length 0
19:28:24.693193 IP 151.101.117.67.443 > 10.0.2.15.37994: Flags [P.], seq 1016474:1039832, ack 867, win 65535, length 23358
19:28:24.693210 IP 10.0.2.15.37994 > 151.101.117.67.443: Flags [.], ack 1039832, win 65535, length 0

