19:31:46.136693 IP 10.0.2.15.60074 > 140.233.253.2.53: 17400+ A? www.cnn.com. (29)
19:31:46.136727 IP 10.0.2.15.60074 > 140.233.253.2.53: 40186+ AAAA? www.cnn.com. (29)
19:31:46.143248 IP 140.233.253.2.53 > 10.0.2.15.60074: 17400 2/0/0 CNAME turner-tls.map.fastly.net., A 151.101.117.67 (84)
19:31:46.143250 IP 140.233.253.2.53 > 10.0.2.15.60074: 40186 2/0/0 CNAME turner-tls.map.fastly.net., AAAA 2a04:4e42:1c::323 (96)
19:31:46.144354 IP 10.0.2.15.38080 > 151.101.117.67.443: Flags [S], seq 1665548138, win 64240, options [mss 1460,sackOK,TS val 1396825117 ecr 0,nop,wscale 6], length 0
19:31:46.158754 IP 151.101.117.67.443 > 10.0.2.15.38080: Flags [S.], seq 171648001, ack 1665548139, win 65535, options [mss 1460], length 0
19:31:46.159108 IP 10.0.2.15.38080 > 151.101.117.67.443: Flags [.], ack 1, win 64240, length 0
19:31:46.175268 IP 10.0.2.15.38080 > 151.101.117.67.443: Flags [P.], seq 1:518, ack 1, win 64240, length 517
19:31:46.175717 IP 151.101.117.67.443 > 10.0.2.15.38080: Flags [.], ack 518, win 65535, length 0
19:31:46.194332 IP 151.101.117.67.443 > 10.0.2.15.38080: Flags [.], seq 1:2921, ack 518, win 65535, length 2920
19:31:46.194424 IP 10.0.2.15.38080 > 151.101.117.67.443: Flags [.], ack 2921, win 62780, length 0
19:31:46.194809 IP 151.101.117.67.443 > 10.0.2.15.38080: Flags [P.], seq 2921:4123, ack 518, win 65535, length 1202
19:31:46.194826 IP 10.0.2.15.38080 > 151.101.117.67.443: Flags [.], ack 4123, win 61578, length 0
19:31:46.195290 IP 151.101.117.67.443 > 10.0.2.15.38080: Flags [P.], seq 4123:5064, ack 518, win 65535, length 941
19:31:46.195306 IP 10.0.2.15.38080 > 151.101.117.67.443: Flags [.], ack 5064, win 62780, length 0
19:31:46.197432 IP 10.0.2.15.38080 > 151.101.117.67.443: Flags [P.], seq 518:611, ack 5064, win 62780, length 93
19:31:46.197847 IP 151.101.117.67.443 > 10.0.2.15.38080: Flags [.], ack 611, win 65535, length 0
19:31:46.212827 IP 151.101.117.67.443 > 10.0.2.15.38080: Flags [P.], seq 5064:5115, ack 611, win 65535, length 51
19:31:46.212844 IP 10.0.2.15.38080 > 151.101.117.67.443: Flags [.], ack 5115, win 62780, length 0
19:31:46.213406 IP 10.0.2.15.38080 > 151.101.117.67.443: Flags [P.], seq 611:664, ack 5115, win 62780, length 53
19:31:46.213479 IP 10.0.2.15.38080 > 151.101.117.67.443: Flags [P.], seq 664:720, ack 5115, win 62780, length 56
19:31:46.214022 IP 10.0.2.15.38080 > 151.101.117.67.443: Flags [P.], seq 720:762, ack 5115, win 62780, length 42
19:31:46.214300 IP 151.101.117.67.443 > 10.0.2.15.38080: Flags [.], ack 664, win 65535, length 0
19:31:46.214301 IP 151.101.117.67.443 > 10.0.2.15.38080: Flags [.], ack 720, win 65535, length 0
19:31:46.214556 IP 151.101.117.67.443 > 10.0.2.15.38080: Flags [.], ack 762, win 65535, length 0
19:31:46.214770 IP 10.0.2.15.38080 > 151.101.117.67.443: Flags [P.], seq 762:829, ack 5115, win 62780, length 67
19:31:46.215764 IP 151.101.117.67.443 > 10.0.2.15.38080: Flags [.], ack 829, win 65535, length 0
19:31:46.232573 IP 151.101.117.67.443 > 10.0.2.15.38080: Flags [P.], seq 5115:5181, ack 829, win 65535, length 66
19:31:46.232597 IP 10.0.2.15.38080 > 151.101.117.67.443: Flags [.], ack 5181, win 62780, length 0
19:31:46.233033 IP 10.0.2.15.38080 > 151.101.117.67.443: Flags [P.], seq 829:867, ack 5181, win 62780, length 38
19:31:46.233682 IP 151.101.117.67.443 > 10.0.2.15.38080: Flags [.], ack 867, win 65535, length 0
19:31:46.235831 IP 151.101.117.67.443 > 10.0.2.15.38080: Flags [P.], seq 5181:9303, ack 867, win 65535, length 4122
19:31:46.235991 IP 10.0.2.15.38080 > 151.101.117.67.443: Flags [.], ack 9303, win 61320, length 0
19:31:46.237093 IP 151.101.117.67.443 > 10.0.2.15.38080: Flags [P.], seq 9303:13425, ack 867, win 65535, length 4122
19:31:46.237112 IP 10.0.2.15.38080 > 151.101.117.67.443: Flags [.], ack 13425, win 61320, length 0
19:31:46.237649 IP 151.101.117.67.443 > 10.0.2.15.38080: Flags [P.], seq 13425:17547, ack 867, win 65535, length 4122
19:31:46.237664 IP 10.0.2.15.38080 > 151.101.117.67.443: Flags [.], ack 17547, win 61320, length 0
19:31:46.239039 IP 151.101.117.67.443 > 10.0.2.15.38080: Flags [P.], seq 17547:20295, ack 867, win 65535, length 2748
19:31:46.239059 IP 10.0.2.15.38080 > 151.101.117.67.443: Flags [.], ack 20295, win 62780, length 0
19:31:46.240295 IP 151.101.117.67.443 > 10.0.2.15.38080: Flags [P.], seq 20295:27165, ack 867, win 65535, length 6870
19:31:46.240574 IP 10.0.2.15.38080 > 151.101.117.67.443: Flags [.], ack 27165, win 59860, length 0
19:31:46.241635 IP 151.101.117.67.443 > 10.0.2.15.38080: Flags [P.], seq 27165:31287, ack 867, win 65535, length 4122
19:31:46.241657 IP 10.0.2.15.38080 > 151.101.117.67.443: Flags [.], ack 31287, win 61320, length 0
19:31:46.242408 IP 151.101.117.67.443 > 10.0.2.15.38080: Flags [.], seq 31287:32747, ack 867, win 65535, length 1460
19:31:46.242825 IP 151.101.117.67.443 > 10.0.2.15.38080: Flags [P.], seq 32747:35409, ack 867, win 65535, length 2662
19:31:46.242844 IP 10.0.2.15.38080 > 151.101.117.67.443: Flags [.], ack 35409, win 61320, length 0
19:31:46.243591 IP 151.101.117.67.443 > 10.0.2.15.38080: Flags [P.], seq 35409:36783, ack 867, win 65535, length 1374
19:31:46.244579 IP 151.101.117.67.443 > 10.0.2.15.38080: Flags [P.], seq 36783:42279, ack 867, win 65535, length 5496
19:31:46.244601 IP 10.0.2.15.38080 > 151.101.117.67.443: Flags [.], ack 42279, win 61320, length 0
19:31:46.245780 IP 151.101.117.67.443 > 10.0.2.15.38080: Flags [P.], seq 42279:45027, ack 867, win 65535, length 2748
19:31:46.247072 IP 151.101.117.67.443 > 10.0.2.15.38080: Flags [P.], seq 45027:50523, ack 867, win 65535, length 5496
19:31:46.248248 IP 151.101.117.67.443 > 10.0.2.15.38080: Flags [P.], seq 50523:54645, ack 867, win 65535, length 4122
19:31:46.250164 IP 151.101.117.67.443 > 10.0.2.15.38080: Flags [P.], seq 54645:56019, ack 867, win 65535, length 1374
19:31:46.250659 IP 151.101.117.67.443 > 10.0.2.15.38080: Flags [P.], seq 56019:62889, ack 867, win 65535, length 6870
19:31:46.250766 IP 10.0.2.15.38080 > 151.101.117.67.443: Flags [.], ack 45027, win 58572, length 0
19:31:46.251608 IP 10.0.2.15.38080 > 151.101.117.67.443: Flags [.], ack 62889, win 46720, length 0
19:31:46.252797 IP 151.101.117.67.443 > 10.0.2.15.38080: Flags [P.], seq 62889:69759, ack 867, win 65535, length 6870
19:31:46.252818 IP 10.0.2.15.38080 > 151.101.117.67.443: Flags [.], ack 69759, win 59860, length 0
19:31:46.254513 IP 151.101.117.67.443 > 10.0.2.15.38080: Flags [P.], seq 69759:76629, ack 867, win 65535, length 6870
19:31:46.254538 IP 10.0.2.15.38080 > 151.101.117.67.443: Flags [.], ack 76629, win 65535, length 0
19:31:46.255334 IP 151.101.117.67.443 > 10.0.2.15.38080: Flags [P.], seq 76629:79377, ack 867, win 65535, length 2748
19:31:46.255358 IP 10.0.2.15.38080 > 151.101.117.67.443: Flags [.], ack 79377, win 65535, length 0
19:31:46.256309 IP 151.101.117.67.443 > 10.0.2.15.38080: Flags [P.], seq 79377:83499, ack 867, win 65535, length 4122
19:31:46.257269 IP 10.0.2.15.38080 > 151.101.117.67.443: Flags [.], ack 83499, win 65535, length 0
19:31:46.257698 IP 151.101.117.67.443 > 10.0.2.15.38080: Flags [P.], seq 83499:87621, ack 867, win 65535, length 4122
19:31:46.258976 IP 10.0.2.15.38080 > 151.101.117.67.443: Flags [.], ack 87621, win 65535, length 0
19:31:46.260790 IP 151.101.117.67.443 > 10.0.2.15.38080: Flags [P.], seq 87621:93117, ack 867, win 65535, length 5496
19:31:46.260793 IP 151.101.117.67.443 > 10.0.2.15.38080: Flags [P.], seq 93117:97239, ack 867, win 65535, length 4122
19:31:46.260794 IP 151.101.117.67.443 > 10.0.2.15.38080: Flags [P.], seq 97239:101361, ack 867, win 65535, length 4122
19:31:46.260817 IP 10.0.2.15.38080 > 151.101.117.67.443: Flags [.], ack 93117, win 65535, length 0
19:31:46.260853 IP 10.0.2.15.38080 > 151.101.117.67.443: Flags [.], ack 97239, win 65535, length 0
19:31:46.260866 IP 10.0.2.15.38080 > 151.101.117.67.443: Flags [.], ack 101361, win 65535, length 0
19:31:46.262171 IP 151.101.117.67.443 > 10.0.2.15.38080: Flags [P.], seq 101361:106857, ack 867, win 65535, length 5496
19:31:46.262194 IP 10.0.2.15.38080 > 151.101.117.67.443: Flags [.], ack 106857, win 65535, length 0
19:31:46.263097 IP 151.101.117.67.443 > 10.0.2.15.38080: Flags [P.], seq 106857:117849, ack 867, win 65535, length 10992
19:31:46.263123 IP 10.0.2.15.38080 > 151.101.117.67.443: Flags [.], ack 117849, win 65535, length 0
19:31:46.264843 IP 151.101.117.67.443 > 10.0.2.15.38080: Flags [P.], seq 117849:123345, ack 867, win 65535, length 5496
19:31:46.264870 IP 10.0.2.15.38080 > 151.101.117.67.443: Flags [.], ack 123345, win 65535, length 0
19:31:46.267383 IP 151.101.117.67.443 > 10.0.2.15.38080: Flags [P.], seq 123345:135711, ack 867, win 65535, length 12366
19:31:46.267406 IP 10.0.2.15.38080 > 151.101.117.67.443: Flags [.], ack 135711, win 65535, length 0
19:31:46.268339 IP 151.101.117.67.443 > 10.0.2.15.38080: Flags [P.], seq 135711:145329, ack 867, win 65535, length 9618
19:31:46.268343 IP 151.101.117.67.443 > 10.0.2.15.38080: Flags [P.], seq 145329:152199, ack 867, win 65535, length 6870
19:31:46.268368 IP 10.0.2.15.38080 > 151.101.117.67.443: Flags [.], ack 145329, win 65535, length 0
19:31:46.268409 IP 10.0.2.15.38080 > 151.101.117.67.443: Flags [.], ack 152199, win 65535, length 0
19:31:46.268455 IP 151.101.117.67.443 > 10.0.2.15.38080: Flags [P.], seq 152199:160443, ack 867, win 65535, length 8244
19:31:46.268468 IP 10.0.2.15.38080 > 151.101.117.67.443: Flags [.], ack 160443, win 65535, length 0
19:31:46.269012 IP 151.101.117.67.443 > 10.0.2.15.38080: Flags [P.], seq 160443:163191, ack 867, win 65535, length 2748
19:31:46.269028 IP 10.0.2.15.38080 > 151.101.117.67.443: Flags [.], ack 163191, win 65535, length 0
19:31:46.271133 IP 151.101.117.67.443 > 10.0.2.15.38080: Flags [P.], seq 163191:168687, ack 867, win 65535, length 5496
19:31:46.271136 IP 151.101.117.67.443 > 10.0.2.15.38080: Flags [P.], seq 168687:176931, ack 867, win 65535, length 8244
19:31:46.271167 IP 10.0.2.15.38080 > 151.101.117.67.443: Flags [.], ack 168687, win 65535, length 0
19:31:46.271386 IP 10.0.2.15.38080 > 151.101.117.67.443: Flags [.], ack 176931, win 65535, length 0
19:31:46.271426 IP 151.101.117.67.443 > 10.0.2.15.38080: Flags [P.], seq 176931:181053, ack 867, win 65535, length 4122
19:31:46.271427 IP 151.101.117.67.443 > 10.0.2.15.38080: Flags [P.], seq 181053:182427, ack 867, win 65535, length 1374
19:31:46.271436 IP 10.0.2.15.38080 > 151.101.117.67.443: Flags [.], ack 181053, win 65535, length 0
19:31:46.275234 IP 151.101.117.67.443 > 10.0.2.15.38080: Flags [P.], seq 182427:194793, ack 867, win 65535, length 12366
19:31:46.275263 IP 10.0.2.15.38080 > 151.101.117.67.443: Flags [.], ack 194793, win 65535, length 0
19:31:46.275483 IP 151.101.117.67.443 > 10.0.2.15.38080: Flags [P.], seq 194793:204411, ack 867, win 65535, length 9618
19:31:46.275486 IP 151.101.117.67.443 > 10.0.2.15.38080: Flags [P.], seq 204411:208533, ack 867, win 65535, length 4122
19:31:46.275506 IP 10.0.2.15.38080 > 151.101.117.67.443: Flags [.], ack 204411, win 65535, length 0
19:31:46.275531 IP 10.0.2.15.38080 > 151.101.117.67.443: Flags [.], ack 208533, win 65535, length 0
19:31:46.275552 IP 151.101.117.67.443 > 10.0.2.15.38080: Flags [.], seq 208533:217293, ack 867, win 65535, length 8760
19:31:46.275557 IP 10.0.2.15.38080 > 151.101.117.67.443: Flags [.], ack 217293, win 65535, length 0
19:31:46.275808 IP 151.101.117.67.443 > 10.0.2.15.38080: Flags [.], seq 217293:218753, ack 867, win 65535, length 1460
19:31:46.278147 IP 151.101.117.67.443 > 10.0.2.15.38080: Flags [.], seq 218753:221673, ack 867, win 65535, length 2920
19:31:46.278265 IP 10.0.2.15.38080 > 151.101.117.67.443: Flags [.], ack 221673, win 65535, length 0
19:31:46.278554 IP 151.101.117.67.443 > 10.0.2.15.38080: Flags [P.], seq 221673:227769, ack 867, win 65535, length 6096
19:31:46.278556 IP 151.101.117.67.443 > 10.0.2.15.38080: Flags [.], seq 227769:229229, ack 867, win 65535, length 1460
19:31:46.278577 IP 10.0.2.15.38080 > 151.101.117.67.443: Flags [.], ack 227769, win 65535, length 0
19:31:46.279144 IP 151.101.117.67.443 > 10.0.2.15.38080: Flags [P.], seq 229229:257997, ack 867, win 65535, length 28768
19:31:46.279165 IP 10.0.2.15.38080 > 151.101.117.67.443: Flags [.], ack 257997, win 65535, length 0
19:31:46.279204 IP 151.101.117.67.443 > 10.0.2.15.38080: Flags [P.], seq 257997:267615, ack 867, win 65535, length 9618
19:31:46.279210 IP 10.0.2.15.38080 > 151.101.117.67.443: Flags [.], ack 267615, win 65535, length 0
19:31:46.279607 IP 151.101.117.67.443 > 10.0.2.15.38080: Flags [P.], seq 267615:271737, ack 867, win 65535, length 4122
19:31:46.279621 IP 10.0.2.15.38080 > 151.101.117.67.443: Flags [.], ack 271737, win 65535, length 0
19:31:46.280876 IP 151.101.117.67.443 > 10.0.2.15.38080: Flags [P.], seq 271737:278607, ack 867, win 65535, length 6870
19:31:46.280879 IP 151.101.117.67.443 > 10.0.2.15.38080: Flags [P.], seq 278607:284103, ack 867, win 65535, length 5496
19:31:46.280963 IP 10.0.2.15.38080 > 151.101.117.67.443: Flags [.], ack 278607, win 65535, length 0
19:31:46.280999 IP 10.0.2.15.38080 > 151.101.117.67.443: Flags [.], ack 284103, win 65535, length 0
19:31:46.281164 IP 151.101.117.67.443 > 10.0.2.15.38080: Flags [P.], seq 284103:286851, ack 867, win 65535, length 2748
19:31:46.281175 IP 10.0.2.15.38080 > 151.101.117.67.443: Flags [.], ack 286851, win 65535, length 0
19:31:46.285998 IP 151.101.117.67.443 > 10.0.2.15.38080: Flags [P.], seq 286851:303339, ack 867, win 65535, length 16488
19:31:46.286020 IP 10.0.2.15.38080 > 151.101.117.67.443: Flags [.], ack 303339, win 65535, length 0
19:31:46.286179 IP 151.101.117.67.443 > 10.0.2.15.38080: Flags [P.], seq 303339:310209, ack 867, win 65535, length 6870
19:31:46.286181 IP 151.101.117.67.443 > 10.0.2.15.38080: Flags [P.], seq 310209:318453, ack 867, win 65535, length 8244
19:31:46.286195 IP 10.0.2.15.38080 > 151.101.117.67.443: Flags [.], ack 310209, win 65535, length 0
19:31:46.286209 IP 10.0.2.15.38080 > 151.101.117.67.443: Flags [.], ack 318453, win 65535, length 0
19:31:46.286229 IP 151.101.117.67.443 > 10.0.2.15.38080: Flags [P.], seq 318453:322575, ack 867, win 65535, length 4122
19:31:46.286234 IP 10.0.2.15.38080 > 151.101.117.67.443: Flags [.], ack 322575, win 65535, length 0
19:31:46.289745 IP 151.101.117.67.443 > 10.0.2.15.38080: Flags [P.], seq 322575:363795, ack 867, win 65535, length 41220
19:31:46.289767 IP 10.0.2.15.38080 > 151.101.117.67.443: Flags [.], ack 363795, win 65535, length 0
19:31:46.290777 IP 151.101.117.67.443 > 10.0.2.15.38080: Flags [P.], seq 363795:402771, ack 867, win 65535, length 38976
19:31:46.290798 IP 10.0.2.15.38080 > 151.101.117.67.443: Flags [.], ack 402771, win 65535, length 0
19:31:46.291428 IP 151.101.117.67.443 > 10.0.2.15.38080: Flags [.], seq 402771:404231, ack 867, win 65535, length 1460
19:31:46.291987 IP 151.101.117.67.443 > 10.0.2.15.38080: Flags [P.], seq 404231:418755, ack 867, win 65535, length 14524
19:31:46.292004 IP 10.0.2.15.38080 > 151.101.117.67.443: Flags [.], ack 418755, win 65535, length 0
19:31:46.292255 IP 151.101.117.67.443 > 10.0.2.15.38080: Flags [P.], seq 418755:421503, ack 867, win 65535, length 2748
19:31:46.292376 IP 151.101.117.67.443 > 10.0.2.15.38080: Flags [P.], seq 421503:426999, ack 867, win 65535, length 5496
19:31:46.292378 IP 151.101.117.67.443 > 10.0.2.15.38080: Flags [P.], seq 426999:429747, ack 867, win 65535, length 2748
19:31:46.292396 IP 10.0.2.15.38080 > 151.101.117.67.443: Flags [.], ack 421503, win 65535, length 0
19:31:46.292527 IP 10.0.2.15.38080 > 151.101.117.67.443: Flags [.], ack 426999, win 65535, length 0
19:31:46.292608 IP 10.0.2.15.38080 > 151.101.117.67.443: Flags [.], ack 429747, win 65535, length 0
19:31:46.292673 IP 151.101.117.67.443 > 10.0.2.15.38080: Flags [P.], seq 429747:435243, ack 867, win 65535, length 5496
19:31:46.292674 IP 151.101.117.67.443 > 10.0.2.15.38080: Flags [P.], seq 435243:437991, ack 867, win 65535, length 2748
19:31:46.292676 IP 151.101.117.67.443 > 10.0.2.15.38080: Flags [P.], seq 437991:446235, ack 867, win 65535, length 8244
19:31:46.292691 IP 10.0.2.15.38080 > 151.101.117.67.443: Flags [.], ack 435243, win 65535, length 0
19:31:46.293054 IP 10.0.2.15.38080 > 151.101.117.67.443: Flags [.], ack 437991, win 65535, length 0
19:31:46.293071 IP 10.0.2.15.38080 > 151.101.117.67.443: Flags [.], ack 446235, win 65535, length 0
19:31:46.293425 IP 151.101.117.67.443 > 10.0.2.15.38080: Flags [.], seq 446235:447695, ack 867, win 65535, length 1460
19:31:46.293825 IP 151.101.117.67.443 > 10.0.2.15.38080: Flags [P.], seq 447695:448983, ack 867, win 65535, length 1288
19:31:46.293884 IP 10.0.2.15.38080 > 151.101.117.67.443: Flags [.], ack 448983, win 65535, length 0
19:31:46.294151 IP 151.101.117.67.443 > 10.0.2.15.38080: Flags [P.], seq 448983:462723, ack 867, win 65535, length 13740
19:31:46.294167 IP 10.0.2.15.38080 > 151.101.117.67.443: Flags [.], ack 462723, win 65535, length 0
19:31:46.294258 IP 151.101.117.67.443 > 10.0.2.15.38080: Flags [P.], seq 462723:468219, ack 867, win 65535, length 5496
19:31:46.294272 IP 10.0.2.15.38080 > 151.101.117.67.443: Flags [.], ack 468219, win 65535, length 0
19:31:46.295131 IP 151.101.117.67.443 > 10.0.2.15.38080: Flags [P.], seq 468219:475089, ack 867, win 65535, length 6870
19:31:46.295319 IP 10.0.2.15.38080 > 151.101.117.67.443: Flags [.], ack 475089, win 65535, length 0
19:31:46.295787 IP 151.101.117.67.443 > 10.0.2.15.38080: Flags [P.], seq 475089:477837, ack 867, win 65535, length 2748
19:31:46.295789 IP 151.101.117.67.443 > 10.0.2.15.38080: Flags [P.], seq 477837:480585, ack 867, win 65535, length 2748
19:31:46.295791 IP 151.101.117.67.443 > 10.0.2.15.38080: Flags [P.], seq 480585:484707, ack 867, win 65535, length 4122
19:31:46.295809 IP 10.0.2.15.38080 > 151.101.117.67.443: Flags [.], ack 477837, win 65535, length 0
19:31:46.295834 IP 10.0.2.15.38080 > 151.101.117.67.443: Flags [.], ack 480585, win 65535, length 0
19:31:46.295845 IP 10.0.2.15.38080 > 151.101.117.67.443: Flags [.], ack 484707, win 65535, length 0
19:31:46.296115 IP 151.101.117.67.443 > 10.0.2.15.38080: Flags [P.], seq 484707:490203, ack 867, win 65535, length 5496
19:31:46.296116 IP 151.101.117.67.443 > 10.0.2.15.38080: Flags [P.], seq 490203:491577, ack 867, win 65535, length 1374
19:31:46.296117 IP 151.101.117.67.443 > 10.0.2.15.38080: Flags [P.], seq 491577:494325, ack 867, win 65535, length 2748
19:31:46.296131 IP 10.0.2.15.38080 > 151.101.117.67.443: Flags [.], ack 490203, win 65535, length 0
19:31:46.296151 IP 10.0.2.15.38080 > 151.101.117.67.443: Flags [.], ack 494325, win 65535, length 0
19:31:46.296738 IP 151.101.117.67.443 > 10.0.2.15.38080: Flags [P.], seq 494325:503943, ack 867, win 65535, length 9618
19:31:46.296759 IP 10.0.2.15.38080 > 151.101.117.67.443: Flags [.], ack 503943, win 65535, length 0
19:31:46.297383 IP 151.101.117.67.443 > 10.0.2.15.38080: Flags [P.], seq 503943:509439, ack 867, win 65535, length 5496
19:31:46.297717 IP 10.0.2.15.38080 > 151.101.117.67.443: Flags [.], ack 509439, win 65535, length 0
19:31:46.298103 IP 151.101.117.67.443 > 10.0.2.15.38080: Flags [P.], seq 509439:512187, ack 867, win 65535, length 2748
19:31:46.298107 IP 151.101.117.67.443 > 10.0.2.15.38080: Flags [P.], seq 512187:516309, ack 867, win 65535, length 4122
19:31:46.298108 IP 151.101.117.67.443 > 10.0.2.15.38080: Flags [P.], seq 516309:521805, ack 867, win 65535, length 5496
19:31:46.298174 IP 10.0.2.15.38080 > 151.101.117.67.443: Flags [.], ack 512187, win 65535, length 0
19:31:46.298202 IP 10.0.2.15.38080 > 151.101.117.67.443: Flags [.], ack 516309, win 65535, length 0
19:31:46.298213 IP 10.0.2.15.38080 > 151.101.117.67.443: Flags [.], ack 521805, win 65535, length 0
19:31:46.300213 IP 151.101.117.67.443 > 10.0.2.15.38080: Flags [P.], seq 521805:528675, ack 867, win 65535, length 6870
19:31:46.300216 IP 151.101.117.67.443 > 10.0.2.15.38080: Flags [P.], seq 528675:534171, ack 867, win 65535, length 5496
19:31:46.300240 IP 10.0.2.15.38080 > 151.101.117.67.443: Flags [.], ack 528675, win 65535, length 0
19:31:46.300266 IP 10.0.2.15.38080 > 151.101.117.67.443: Flags [.], ack 534171, win 65535, length 0
19:31:46.300361 IP 151.101.117.67.443 > 10.0.2.15.38080: Flags [P.], seq 534171:539667, ack 867, win 65535, length 5496
19:31:46.300364 IP 151.101.117.67.443 > 10.0.2.15.38080: Flags [P.], seq 539667:545163, ack 867, win 65535, length 5496
19:31:46.300373 IP 10.0.2.15.38080 > 151.101.117.67.443: Flags [.], ack 539667, win 65535, length 0
19:31:46.300388 IP 10.0.2.15.38080 > 151.101.117.67.443: Flags [.], ack 545163, win 65535, length 0
19:31:46.300405 IP 151.101.117.67.443 > 10.0.2.15.38080: Flags [P.], seq 545163:550659, ack 867, win 65535, length 5496
19:31:46.300406 IP 151.101.117.67.443 > 10.0.2.15.38080: Flags [P.], seq 550659:553407, ack 867, win 65535, length 2748
19:31:46.300407 IP 151.101.117.67.443 > 10.0.2.15.38080: Flags [P.], seq 553407:557529, ack 867, win 65535, length 4122
19:31:46.300413 IP 10.0.2.15.38080 > 151.101.117.67.443: Flags [.], ack 550659, win 65535, length 0
19:31:46.300422 IP 10.0.2.15.38080 > 151.101.117.67.443: Flags [.], ack 553407, win 65535, length 0
19:31:46.300431 IP 10.0.2.15.38080 > 151.101.117.67.443: Flags [.], ack 557529, win 65535, length 0
19:31:46.300986 IP 151.101.117.67.443 > 10.0.2.15.38080: Flags [P.], seq 557529:565773, ack 867, win 65535, length 8244
19:31:46.300989 IP 151.101.117.67.443 > 10.0.2.15.38080: Flags [P.], seq 565773:568521, ack 867, win 65535, length 2748
19:31:46.301009 IP 10.0.2.15.38080 > 151.101.117.67.443: Flags [.], ack 565773, win 65535, length 0
19:31:46.301662 IP 10.0.2.15.38080 > 151.101.117.67.443: Flags [.], ack 568521, win 65535, length 0
19:31:46.301830 IP 151.101.117.67.443 > 10.0.2.15.38080: Flags [P.], seq 568521:571269, ack 867, win 65535, length 2748
19:31:46.301831 IP 151.101.117.67.443 > 10.0.2.15.38080: Flags [P.], seq 571269:574017, ack 867, win 65535, length 2748
19:31:46.301832 IP 151.101.117.67.443 > 10.0.2.15.38080: Flags [P.], seq 574017:576765, ack 867, win 65535, length 2748
19:31:46.301833 IP 151.101.117.67.443 > 10.0.2.15.38080: Flags [P.], seq 576765:578139, ack 867, win 65535, length 1374
19:31:46.301835 IP 151.101.117.67.443 > 10.0.2.15.38080: Flags [P.], seq 578139:580887, ack 867, win 65535, length 2748
19:31:46.301914 IP 151.101.117.67.443 > 10.0.2.15.38080: Flags [P.], seq 580887:585009, ack 867, win 65535, length 4122
19:31:46.301916 IP 151.101.117.67.443 > 10.0.2.15.38080: Flags [P.], seq 585009:587757, ack 867, win 65535, length 2748
19:31:46.301917 IP 151.101.117.67.443 > 10.0.2.15.38080: Flags [P.], seq 587757:591879, ack 867, win 65535, length 4122
19:31:46.302544 IP 151.101.117.67.443 > 10.0.2.15.38080: Flags [P.], seq 591879:594627, ack 867, win 65535, length 2748
19:31:46.302873 IP 151.101.117.67.443 > 10.0.2.15.38080: Flags [P.], seq 594627:602871, ack 867, win 65535, length 8244
19:31:46.303049 IP 10.0.2.15.38080 > 151.101.117.67.443: Flags [.], ack 602871, win 65535, length 0
19:31:46.303505 IP 151.101.117.67.443 > 10.0.2.15.38080: Flags [.], seq 602871:605791, ack 867, win 65535, length 2920
19:31:46.303570 IP 10.0.2.15.38080 > 151.101.117.67.443: Flags [.], ack 605791, win 65535, length 0
19:31:46.304352 IP 151.101.117.67.443 > 10.0.2.15.38080: Flags [P.], seq 605791:611115, ack 867, win 65535, length 5324
19:31:46.304356 IP 151.101.117.67.443 > 10.0.2.15.38080: Flags [P.], seq 611115:617985, ack 867, win 65535, length 6870
19:31:46.304375 IP 10.0.2.15.38080 > 151.101.117.67.443: Flags [.], ack 611115, win 65535, length 0
19:31:46.304419 IP 151.101.117.67.443 > 10.0.2.15.38080: Flags [P.], seq 617985:620733, ack 867, win 65535, length 2748
19:31:46.305019 IP 10.0.2.15.38080 > 151.101.117.67.443: Flags [.], ack 620733, win 65535, length 0
19:31:46.305043 IP 151.101.117.67.443 > 10.0.2.15.38080: Flags [P.], seq 620733:624855, ack 867, win 65535, length 4122
19:31:46.305086 IP 10.0.2.15.38080 > 151.101.117.67.443: Flags [.], ack 624855, win 65535, length 0
19:31:46.306340 IP 151.101.117.67.443 > 10.0.2.15.38080: Flags [P.], seq 624855:645465, ack 867, win 65535, length 20610
19:31:46.306359 IP 10.0.2.15.38080 > 151.101.117.67.443: Flags [.], ack 645465, win 65535, length 0
19:31:46.306475 IP 151.101.117.67.443 > 10.0.2.15.38080: Flags [P.], seq 645465:646839, ack 867, win 65535, length 1374
19:31:46.306478 IP 151.101.117.67.443 > 10.0.2.15.38080: Flags [P.], seq 646839:655083, ack 867, win 65535, length 8244
19:31:46.306479 IP 151.101.117.67.443 > 10.0.2.15.38080: Flags [P.], seq 655083:657831, ack 867, win 65535, length 2748
19:31:46.306495 IP 10.0.2.15.38080 > 151.101.117.67.443: Flags [.], ack 655083, win 65535, length 0
19:31:46.306516 IP 10.0.2.15.38080 > 151.101.117.67.443: Flags [.], ack 657831, win 65535, length 0
19:31:46.306606 IP 151.101.117.67.443 > 10.0.2.15.38080: Flags [P.], seq 657831:661953, ack 867, win 65535, length 4122
19:31:46.306619 IP 10.0.2.15.38080 > 151.101.117.67.443: Flags [.], ack 661953, win 65535, length 0
19:31:46.307640 IP 151.101.117.67.443 > 10.0.2.15.38080: Flags [P.], seq 661953:668823, ack 867, win 65535, length 6870
19:31:46.307663 IP 10.0.2.15.38080 > 151.101.117.67.443: Flags [.], ack 668823, win 65535, length 0
19:31:46.307819 IP 151.101.117.67.443 > 10.0.2.15.38080: Flags [P.], seq 668823:675693, ack 867, win 65535, length 6870
19:31:46.307832 IP 10.0.2.15.38080 > 151.101.117.67.443: Flags [.], ack 675693, win 65535, length 0
19:31:46.308456 IP 151.101.117.67.443 > 10.0.2.15.38080: Flags [P.], seq 675693:681189, ack 867, win 65535, length 5496
19:31:46.308460 IP 151.101.117.67.443 > 10.0.2.15.38080: Flags [P.], seq 681189:685311, ack 867, win 65535, length 4122
19:31:46.308460 IP 151.101.117.67.443 > 10.0.2.15.38080: Flags [P.], seq 685311:688059, ack 867, win 65535, length 2748
19:31:46.308492 IP 151.101.117.67.443 > 10.0.2.15.38080: Flags [P.], seq 688059:689433, ack 867, win 65535, length 1374
19:31:46.308878 IP 151.101.117.67.443 > 10.0.2.15.38080: Flags [P.], seq 689433:693555, ack 867, win 65535, length 4122
19:31:46.309503 IP 151.101.117.67.443 > 10.0.2.15.38080: Flags [P.], seq 693555:700425, ack 867, win 65535, length 6870
19:31:46.309507 IP 151.101.117.67.443 > 10.0.2.15.38080: Flags [P.], seq 700425:705921, ack 867, win 65535, length 5496
19:31:46.309730 IP 151.101.117.67.443 > 10.0.2.15.38080: Flags [P.], seq 705921:708669, ack 867, win 65535, length 2748
19:31:46.318724 IP 10.0.2.15.38080 > 151.101.117.67.443: Flags [.], ack 708669, win 65535, length 0
19:31:46.319648 IP 151.101.117.67.443 > 10.0.2.15.38080: Flags [.], seq 708669:726189, ack 867, win 65535, length 17520
19:31:46.319669 IP 10.0.2.15.38080 > 151.101.117.67.443: Flags [.], ack 726189, win 65535, length 0
19:31:46.320247 IP 151.101.117.67.443 > 10.0.2.15.38080: Flags [.], seq 726189:767069, ack 867, win 65535, length 40880
19:31:46.320264 IP 10.0.2.15.38080 > 151.101.117.67.443: Flags [.], ack 767069, win 65535, length 0
19:31:46.320443 IP 151.101.117.67.443 > 10.0.2.15.38080: Flags [P.], seq 767069:774369, ack 867, win 65535, length 7300
19:31:46.320445 IP 151.101.117.67.443 > 10.0.2.15.38080: Flags [.], seq 774369:778749, ack 867, win 65535, length 4380
19:31:46.320459 IP 10.0.2.15.38080 > 151.101.117.67.443: Flags [.], ack 774369, win 65535, length 0
19:31:46.321136 IP 10.0.2.15.38080 > 151.101.117.67.443: Flags [.], ack 778749, win 65535, length 0
19:31:46.321433 IP 151.101.117.67.443 > 10.0.2.15.38080: Flags [P.], seq 778749:832769, ack 867, win 65535, length 54020
19:31:46.321446 IP 10.0.2.15.38080 > 151.101.117.67.443: Flags [.], ack 832769, win 65535, length 0
19:31:46.323414 IP 151.101.117.67.443 > 10.0.2.15.38080: Flags [.], seq 832769:897009, ack 867, win 65535, length 64240
19:31:46.323446 IP 10.0.2.15.38080 > 151.101.117.67.443: Flags [.], ack 897009, win 65535, length 0
19:31:46.323998 IP 151.101.117.67.443 > 10.0.2.15.38080: Flags [P.], seq 897009:898469, ack 867, win 65535, length 1460
19:31:46.324002 IP 151.101.117.67.443 > 10.0.2.15.38080: Flags [.], seq 898469:907229, ack 867, win 65535, length 8760
19:31:46.324027 IP 10.0.2.15.38080 > 151.101.117.67.443: Flags [.], ack 907229, win 65535, length 0
19:31:46.324740 IP 151.101.117.67.443 > 10.0.2.15.38080: Flags [P.], seq 907229:951867, ack 867, win 65535, length 44638
19:31:46.324760 IP 10.0.2.15.38080 > 151.101.117.67.443: Flags [.], ack 951867, win 65535, length 0
19:31:46.325198 IP 151.101.117.67.443 > 10.0.2.15.38080: Flags [.], seq 951867:960627, ack 867, win 65535, length 8760
19:31:46.325333 IP 151.101.117.67.443 > 10.0.2.15.38080: Flags [P.], seq 960627:965607, ack 867, win 65535, length 4980
19:31:46.326421 IP 151.101.117.67.443 > 10.0.2.15.38080: Flags [P.], seq 965607:972477, ack 867, win 65535, length 6870
19:31:46.326424 IP 151.101.117.67.443 > 10.0.2.15.38080: Flags [P.], seq 972477:975225, ack 867, win 65535, length 2748
19:31:46.326425 IP 151.101.117.67.443 > 10.0.2.15.38080: Flags [.], seq 975225:976685, ack 867, win 65535, length 1460
19:31:46.327224 IP 151.101.117.67.443 > 10.0.2.15.38080: Flags [P.], seq 976685:980721, ack 867, win 65535, length 4036
19:31:46.327226 IP 151.101.117.67.443 > 10.0.2.15.38080: Flags [P.], seq 980721:983469, ack 867, win 65535, length 2748
19:31:46.327227 IP 151.101.117.67.443 > 10.0.2.15.38080: Flags [P.], seq 983469:986217, ack 867, win 65535, length 2748
19:31:46.331511 IP 10.0.2.15.38080 > 151.101.117.67.443: Flags [.], ack 986217, win 65535, length 0

