19:30:13.576382 IP 10.0.2.15.57351 > 140.233.253.2.53: 19215+ A? www.cnn.com. (29)
19:30:13.576411 IP 10.0.2.15.57351 > 140.233.253.2.53: 2572+ AAAA? www.cnn.com. (29)
19:30:13.582264 IP 140.233.253.2.53 > 10.0.2.15.57351: 19215 2/0/0 CNAME turner-tls.map.fastly.net., A 151.101.117.67 (84)
19:30:13.582265 IP 140.233.253.2.53 > 10.0.2.15.57351: 2572 2/0/0 CNAME turner-tls.map.fastly.net., AAAA 2a04:4e42:1c::323 (96)
19:30:13.582641 IP 10.0.2.15.38044 > 151.101.117.67.443: Flags [S], seq 1547262470, win 64240, options [mss 1460,sackOK,TS val 1396732555 ecr 0,nop,wscale 6], length 0
19:30:13.597903 IP 151.101.117.67.443 > 10.0.2.15.38044: Flags [S.], seq 169472001, ack 1547262471, win 65535, options [mss 1460], length 0
19:30:13.597946 IP 10.0.2.15.38044 > 151.101.117.67.443: Flags [.], ack 1, win 64240, length 0
19:30:13.606499 IP 10.0.2.15.38044 > 151.101.117.67.443: Flags [P.], seq 1:518, ack 1, win 64240, length 517
19:30:13.606873 IP 151.101.117.67.443 > 10.0.2.15.38044: Flags [.], ack 518, win 65535, length 0
19:30:13.626088 IP 151.101.117.67.443 > 10.0.2.15.38044: Flags [.], seq 1:2921, ack 518, win 65535, length 2920
19:30:13.626111 IP 10.0.2.15.38044 > 151.101.117.67.443: Flags [.], ack 2921, win 62780, length 0
19:30:13.626361 IP 151.101.117.67.443 > 10.0.2.15.38044: Flags [P.], seq 2921:5064, ack 518, win 65535, length 2143
19:30:13.626376 IP 10.0.2.15.38044 > 151.101.117.67.443: Flags [.], ack 5064, win 61320, length 0
19:30:13.627801 IP 10.0.2.15.38044 > 151.101.117.67.443: Flags [P.], seq 518:611, ack 5064, win 62780, length 93
19:30:13.628054 IP 151.101.117.67.443 > 10.0.2.15.38044: Flags [.], ack 611, win 65535, length 0
19:30:13.643966 IP 151.101.117.67.443 > 10.0.2.15.38044: Flags [P.], seq 5064:5115, ack 611, win 65535, length 51
19:30:13.643984 IP 10.0.2.15.38044 > 151.101.117.67.443: Flags [.], ack 5115, win 62780, length 0
19:30:13.644602 IP 10.0.2.15.38044 > 151.101.117.67.443: Flags [P.], seq 611:664, ack 5115, win 62780, length 53
19:30:13.644667 IP 10.0.2.15.38044 > 151.101.117.67.443: Flags [P.], seq 664:720, ack 5115, win 62780, length 56
19:30:13.645182 IP 151.101.117.67.443 > 10.0.2.15.38044: Flags [.], ack 664, win 65535, length 0
19:30:13.645184 IP 151.101.117.67.443 > 10.0.2.15.38044: Flags [.], ack 720, win 65535, length 0
19:30:13.645237 IP 10.0.2.15.38044 > 151.101.117.67.443: Flags [P.], seq 720:762, ack 5115, win 62780, length 42
19:30:13.645299 IP 10.0.2.15.38044 > 151.101.117.67.443: Flags [P.], seq 762:829, ack 5115, win 62780, length 67
19:30:13.645612 IP 151.101.117.67.443 > 10.0.2.15.38044: Flags [.], ack 762, win 65535, length 0
19:30:13.645613 IP 151.101.117.67.443 > 10.0.2.15.38044: Flags [.], ack 829, win 65535, length 0
19:30:13.657962 IP 151.101.117.67.443 > 10.0.2.15.38044: Flags [P.], seq 5115:5210, ack 829, win 65535, length 95
19:30:13.657984 IP 10.0.2.15.38044 > 151.101.117.67.443: Flags [.], ack 5210, win 62780, length 0
19:30:13.658723 IP 10.0.2.15.38044 > 151.101.117.67.443: Flags [P.], seq 829:867, ack 5210, win 62780, length 38
19:30:13.659165 IP 151.101.117.67.443 > 10.0.2.15.38044: Flags [.], ack 867, win 65535, length 0
19:30:13.661106 IP 151.101.117.67.443 > 10.0.2.15.38044: Flags [P.], seq 5210:10706, ack 867, win 65535, length 5496
19:30:13.661285 IP 10.0.2.15.38044 > 151.101.117.67.443: Flags [.], ack 10706, win 61320, length 0
19:30:13.662041 IP 151.101.117.67.443 > 10.0.2.15.38044: Flags [P.], seq 10706:14828, ack 867, win 65535, length 4122
19:30:13.662057 IP 10.0.2.15.38044 > 151.101.117.67.443: Flags [.], ack 14828, win 61320, length 0
19:30:13.663477 IP 151.101.117.67.443 > 10.0.2.15.38044: Flags [P.], seq 14828:17576, ack 867, win 65535, length 2748
19:30:13.663494 IP 10.0.2.15.38044 > 151.101.117.67.443: Flags [.], ack 17576, win 62780, length 0
19:30:13.664297 IP 151.101.117.67.443 > 10.0.2.15.38044: Flags [P.], seq 17576:23072, ack 867, win 65535, length 5496
19:30:13.664424 IP 10.0.2.15.38044 > 151.101.117.67.443: Flags [.], ack 23072, win 61320, length 0
19:30:13.665455 IP 151.101.117.67.443 > 10.0.2.15.38044: Flags [P.], seq 23072:25820, ack 867, win 65535, length 2748
19:30:13.665475 IP 10.0.2.15.38044 > 151.101.117.67.443: Flags [.], ack 25820, win 62780, length 0
19:30:13.666421 IP 151.101.117.67.443 > 10.0.2.15.38044: Flags [P.], seq 25820:32690, ack 867, win 65535, length 6870
19:30:13.666496 IP 10.0.2.15.38044 > 151.101.117.67.443: Flags [.], ack 32690, win 59860, length 0
19:30:13.667665 IP 151.101.117.67.443 > 10.0.2.15.38044: Flags [P.], seq 32690:36812, ack 867, win 65535, length 4122
19:30:13.667684 IP 10.0.2.15.38044 > 151.101.117.67.443: Flags [.], ack 36812, win 61320, length 0
19:30:13.668797 IP 151.101.117.67.443 > 10.0.2.15.38044: Flags [P.], seq 36812:39560, ack 867, win 65535, length 2748
19:30:13.668817 IP 10.0.2.15.38044 > 151.101.117.67.443: Flags [.], ack 39560, win 62780, length 0
19:30:13.669770 IP 151.101.117.67.443 > 10.0.2.15.38044: Flags [P.], seq 39560:42308, ack 867, win 65535, length 2748
19:30:13.669786 IP 10.0.2.15.38044 > 151.101.117.67.443: Flags [.], ack 42308, win 62780, length 0
19:30:13.670821 IP 151.101.117.67.443 > 10.0.2.15.38044: Flags [P.], seq 42308:47804, ack 867, win 65535, length 5496
19:30:13.670911 IP 10.0.2.15.38044 > 151.101.117.67.443: Flags [.], ack 47804, win 61320, length 0
19:30:13.672283 IP 151.101.117.67.443 > 10.0.2.15.38044: Flags [P.], seq 47804:49178, ack 867, win 65535, length 1374
19:30:13.674866 IP 151.101.117.67.443 > 10.0.2.15.38044: Flags [P.], seq 49178:57422, ack 867, win 65535, length 8244
19:30:13.675161 IP 151.101.117.67.443 > 10.0.2.15.38044: Flags [P.], seq 57422:64292, ack 867, win 65535, length 6870
19:30:13.675215 IP 10.0.2.15.38044 > 151.101.117.67.443: Flags [.], ack 64292, win 54020, length 0
19:30:13.675261 IP 151.101.117.67.443 > 10.0.2.15.38044: Flags [P.], seq 64292:65666, ack 867, win 65535, length 1374
19:30:13.676676 IP 151.101.117.67.443 > 10.0.2.15.38044: Flags [P.], seq 65666:72536, ack 867, win 65535, length 6870
19:30:13.676773 IP 10.0.2.15.38044 > 151.101.117.67.443: Flags [.], ack 72536, win 59860, length 0
19:30:13.677661 IP 151.101.117.67.443 > 10.0.2.15.38044: Flags [P.], seq 72536:79406, ack 867, win 65535, length 6870
19:30:13.677677 IP 10.0.2.15.38044 > 151.101.117.67.443: Flags [.], ack 79406, win 65535, length 0
19:30:13.678975 IP 151.101.117.67.443 > 10.0.2.15.38044: Flags [P.], seq 79406:87650, ack 867, win 65535, length 8244
19:30:13.678978 IP 151.101.117.67.443 > 10.0.2.15.38044: Flags [P.], seq 87650:91772, ack 867, win 65535, length 4122
19:30:13.679000 IP 10.0.2.15.38044 > 151.101.117.67.443: Flags [.], ack 87650, win 65535, length 0
19:30:13.679044 IP 10.0.2.15.38044 > 151.101.117.67.443: Flags [.], ack 91772, win 65535, length 0
19:30:13.680482 IP 151.101.117.67.443 > 10.0.2.15.38044: Flags [P.], seq 91772:101390, ack 867, win 65535, length 9618
19:30:13.680502 IP 10.0.2.15.38044 > 151.101.117.67.443: Flags [.], ack 101390, win 65535, length 0
19:30:13.681933 IP 151.101.117.67.443 > 10.0.2.15.38044: Flags [P.], seq 101390:108260, ack 867, win 65535, length 6870
19:30:13.681954 IP 10.0.2.15.38044 > 151.101.117.67.443: Flags [.], ack 108260, win 65535, length 0
19:30:13.684596 IP 151.101.117.67.443 > 10.0.2.15.38044: Flags [P.], seq 108260:119252, ack 867, win 65535, length 10992
19:30:13.684618 IP 10.0.2.15.38044 > 151.101.117.67.443: Flags [.], ack 119252, win 65535, length 0
19:30:13.684719 IP 151.101.117.67.443 > 10.0.2.15.38044: Flags [P.], seq 119252:128870, ack 867, win 65535, length 9618
19:30:13.684731 IP 10.0.2.15.38044 > 151.101.117.67.443: Flags [.], ack 128870, win 65535, length 0
19:30:13.685022 IP 151.101.117.67.443 > 10.0.2.15.38044: Flags [P.], seq 128870:130244, ack 867, win 65535, length 1374
19:30:13.687648 IP 151.101.117.67.443 > 10.0.2.15.38044: Flags [P.], seq 130244:141236, ack 867, win 65535, length 10992
19:30:13.687761 IP 10.0.2.15.38044 > 151.101.117.67.443: Flags [.], ack 141236, win 65535, length 0
19:30:13.687811 IP 151.101.117.67.443 > 10.0.2.15.38044: Flags [P.], seq 141236:145358, ack 867, win 65535, length 4122
19:30:13.687812 IP 151.101.117.67.443 > 10.0.2.15.38044: Flags [P.], seq 145358:148106, ack 867, win 65535, length 2748
19:30:13.687820 IP 10.0.2.15.38044 > 151.101.117.67.443: Flags [.], ack 145358, win 65535, length 0
19:30:13.687831 IP 10.0.2.15.38044 > 151.101.117.67.443: Flags [.], ack 148106, win 65535, length 0
19:30:13.689059 IP 151.101.117.67.443 > 10.0.2.15.38044: Flags [P.], seq 148106:153602, ack 867, win 65535, length 5496
19:30:13.689077 IP 10.0.2.15.38044 > 151.101.117.67.443: Flags [.], ack 153602, win 65535, length 0
19:30:13.689425 IP 151.101.117.67.443 > 10.0.2.15.38044: Flags [P.], seq 153602:160472, ack 867, win 65535, length 6870
19:30:13.689427 IP 151.101.117.67.443 > 10.0.2.15.38044: Flags [P.], seq 160472:161846, ack 867, win 65535, length 1374
19:30:13.689442 IP 10.0.2.15.38044 > 151.101.117.67.443: Flags [.], ack 160472, win 65535, length 0
19:30:13.691022 IP 151.101.117.67.443 > 10.0.2.15.38044: Flags [P.], seq 161846:171464, ack 867, win 65535, length 9618
19:30:13.691024 IP 151.101.117.67.443 > 10.0.2.15.38044: Flags [P.], seq 171464:174212, ack 867, win 65535, length 2748
19:30:13.691049 IP 10.0.2.15.38044 > 151.101.117.67.443: Flags [.], ack 171464, win 65535, length 0
19:30:13.691228 IP 10.0.2.15.38044 > 151.101.117.67.443: Flags [.], ack 174212, win 65535, length 0
19:30:13.691353 IP 151.101.117.67.443 > 10.0.2.15.38044: Flags [P.], seq 174212:176960, ack 867, win 65535, length 2748
19:30:13.691355 IP 151.101.117.67.443 > 10.0.2.15.38044: Flags [.], seq 176960:178420, ack 867, win 65535, length 1460
19:30:13.691364 IP 10.0.2.15.38044 > 151.101.117.67.443: Flags [.], ack 176960, win 65535, length 0
19:30:13.691679 IP 151.101.117.67.443 > 10.0.2.15.38044: Flags [P.], seq 178420:181082, ack 867, win 65535, length 2662
19:30:13.691681 IP 151.101.117.67.443 > 10.0.2.15.38044: Flags [P.], seq 181082:183830, ack 867, win 65535, length 2748
19:30:13.691697 IP 10.0.2.15.38044 > 151.101.117.67.443: Flags [.], ack 181082, win 65535, length 0
19:30:13.691722 IP 10.0.2.15.38044 > 151.101.117.67.443: Flags [.], ack 183830, win 65535, length 0
19:30:13.691888 IP 151.101.117.67.443 > 10.0.2.15.38044: Flags [P.], seq 183830:189326, ack 867, win 65535, length 5496
19:30:13.691889 IP 151.101.117.67.443 > 10.0.2.15.38044: Flags [P.], seq 189326:190700, ack 867, win 65535, length 1374
19:30:13.691900 IP 10.0.2.15.38044 > 151.101.117.67.443: Flags [.], ack 189326, win 65535, length 0
19:30:13.692930 IP 151.101.117.67.443 > 10.0.2.15.38044: Flags [P.], seq 190700:200318, ack 867, win 65535, length 9618
19:30:13.692932 IP 151.101.117.67.443 > 10.0.2.15.38044: Flags [P.], seq 200318:201692, ack 867, win 65535, length 1374
19:30:13.692951 IP 10.0.2.15.38044 > 151.101.117.67.443: Flags [.], ack 200318, win 65535, length 0
19:30:13.693001 IP 151.101.117.67.443 > 10.0.2.15.38044: Flags [P.], seq 201692:204440, ack 867, win 65535, length 2748
19:30:13.693006 IP 10.0.2.15.38044 > 151.101.117.67.443: Flags [.], ack 204440, win 65535, length 0
19:30:13.693309 IP 151.101.117.67.443 > 10.0.2.15.38044: Flags [P.], seq 204440:205814, ack 867, win 65535, length 1374
19:30:13.693311 IP 151.101.117.67.443 > 10.0.2.15.38044: Flags [P.], seq 205814:208562, ack 867, win 65535, length 2748
19:30:13.693312 IP 151.101.117.67.443 > 10.0.2.15.38044: Flags [.], seq 208562:210022, ack 867, win 65535, length 1460
19:30:13.693326 IP 10.0.2.15.38044 > 151.101.117.67.443: Flags [.], ack 208562, win 65535, length 0
19:30:13.693584 IP 151.101.117.67.443 > 10.0.2.15.38044: Flags [P.], seq 210022:212684, ack 867, win 65535, length 2662
19:30:13.693586 IP 151.101.117.67.443 > 10.0.2.15.38044: Flags [P.], seq 212684:214058, ack 867, win 65535, length 1374
19:30:13.693597 IP 10.0.2.15.38044 > 151.101.117.67.443: Flags [.], ack 212684, win 65535, length 0
19:30:13.693840 IP 151.101.117.67.443 > 10.0.2.15.38044: Flags [P.], seq 214058:216806, ack 867, win 65535, length 2748
19:30:13.693901 IP 151.101.117.67.443 > 10.0.2.15.38044: Flags [P.], seq 216806:219554, ack 867, win 65535, length 2748
19:30:13.693917 IP 10.0.2.15.38044 > 151.101.117.67.443: Flags [.], ack 216806, win 65535, length 0
19:30:13.693939 IP 10.0.2.15.38044 > 151.101.117.67.443: Flags [.], ack 219554, win 65535, length 0
19:30:13.694051 IP 151.101.117.67.443 > 10.0.2.15.38044: Flags [P.], seq 219554:225050, ack 867, win 65535, length 5496
19:30:13.694059 IP 10.0.2.15.38044 > 151.101.117.67.443: Flags [.], ack 225050, win 65535, length 0
19:30:13.694511 IP 151.101.117.67.443 > 10.0.2.15.38044: Flags [P.], seq 225050:226424, ack 867, win 65535, length 1374
19:30:13.694513 IP 151.101.117.67.443 > 10.0.2.15.38044: Flags [P.], seq 226424:230546, ack 867, win 65535, length 4122
19:30:13.694529 IP 10.0.2.15.38044 > 151.101.117.67.443: Flags [.], ack 230546, win 65535, length 0
19:30:13.694726 IP 151.101.117.67.443 > 10.0.2.15.38044: Flags [P.], seq 230546:234668, ack 867, win 65535, length 4122
19:30:13.694906 IP 10.0.2.15.38044 > 151.101.117.67.443: Flags [.], ack 234668, win 65535, length 0
19:30:13.695112 IP 151.101.117.67.443 > 10.0.2.15.38044: Flags [P.], seq 234668:237416, ack 867, win 65535, length 2748
19:30:13.695121 IP 10.0.2.15.38044 > 151.101.117.67.443: Flags [.], ack 237416, win 65535, length 0
19:30:13.695857 IP 151.101.117.67.443 > 10.0.2.15.38044: Flags [P.], seq 237416:244286, ack 867, win 65535, length 6870
19:30:13.695908 IP 10.0.2.15.38044 > 151.101.117.67.443: Flags [.], ack 244286, win 65535, length 0
19:30:13.696051 IP 151.101.117.67.443 > 10.0.2.15.38044: Flags [P.], seq 244286:249782, ack 867, win 65535, length 5496
19:30:13.696061 IP 10.0.2.15.38044 > 151.101.117.67.443: Flags [.], ack 249782, win 65535, length 0
19:30:13.696299 IP 151.101.117.67.443 > 10.0.2.15.38044: Flags [.], seq 249782:251242, ack 867, win 65535, length 1460
19:30:13.696571 IP 151.101.117.67.443 > 10.0.2.15.38044: Flags [P.], seq 251242:253904, ack 867, win 65535, length 2662
19:30:13.696583 IP 10.0.2.15.38044 > 151.101.117.67.443: Flags [.], ack 253904, win 65535, length 0
19:30:13.697427 IP 151.101.117.67.443 > 10.0.2.15.38044: Flags [P.], seq 253904:260774, ack 867, win 65535, length 6870
19:30:13.697431 IP 151.101.117.67.443 > 10.0.2.15.38044: Flags [P.], seq 260774:263522, ack 867, win 65535, length 2748
19:30:13.697431 IP 151.101.117.67.443 > 10.0.2.15.38044: Flags [P.], seq 263522:264896, ack 867, win 65535, length 1374
19:30:13.697570 IP 151.101.117.67.443 > 10.0.2.15.38044: Flags [P.], seq 264896:267644, ack 867, win 65535, length 2748
19:30:13.697571 IP 151.101.117.67.443 > 10.0.2.15.38044: Flags [P.], seq 267644:269018, ack 867, win 65535, length 1374
19:30:13.697885 IP 151.101.117.67.443 > 10.0.2.15.38044: Flags [P.], seq 269018:273140, ack 867, win 65535, length 4122
19:30:13.697886 IP 151.101.117.67.443 > 10.0.2.15.38044: Flags [P.], seq 273140:275888, ack 867, win 65535, length 2748
19:30:13.698328 IP 151.101.117.67.443 > 10.0.2.15.38044: Flags [P.], seq 275888:277262, ack 867, win 65535, length 1374
19:30:13.699000 IP 10.0.2.15.38044 > 151.101.117.67.443: Flags [.], ack 277262, win 65535, length 0
19:30:13.699692 IP 151.101.117.67.443 > 10.0.2.15.38044: Flags [P.], seq 277262:278636, ack 867, win 65535, length 1374
19:30:13.702825 IP 151.101.117.67.443 > 10.0.2.15.38044: Flags [P.], seq 278636:285506, ack 867, win 65535, length 6870
19:30:13.702916 IP 10.0.2.15.38044 > 151.101.117.67.443: Flags [.], ack 285506, win 65535, length 0
19:30:13.703105 IP 151.101.117.67.443 > 10.0.2.15.38044: Flags [P.], seq 285506:289628, ack 867, win 65535, length 4122
19:30:13.703106 IP 151.101.117.67.443 > 10.0.2.15.38044: Flags [P.], seq 289628:291002, ack 867, win 65535, length 1374
19:30:13.703107 IP 151.101.117.67.443 > 10.0.2.15.38044: Flags [P.], seq 291002:293750, ack 867, win 65535, length 2748
19:30:13.703121 IP 10.0.2.15.38044 > 151.101.117.67.443: Flags [.], ack 289628, win 65535, length 0
19:30:13.703214 IP 10.0.2.15.38044 > 151.101.117.67.443: Flags [.], ack 293750, win 65535, length 0
19:30:13.704172 IP 151.101.117.67.443 > 10.0.2.15.38044: Flags [P.], seq 293750:297872, ack 867, win 65535, length 4122
19:30:13.704174 IP 151.101.117.67.443 > 10.0.2.15.38044: Flags [P.], seq 297872:300620, ack 867, win 65535, length 2748
19:30:13.704175 IP 151.101.117.67.443 > 10.0.2.15.38044: Flags [P.], seq 300620:301994, ack 867, win 65535, length 1374
19:30:13.704176 IP 151.101.117.67.443 > 10.0.2.15.38044: Flags [P.], seq 301994:306116, ack 867, win 65535, length 4122
19:30:13.704242 IP 10.0.2.15.38044 > 151.101.117.67.443: Flags [.], ack 297872, win 65535, length 0
19:30:13.704271 IP 10.0.2.15.38044 > 151.101.117.67.443: Flags [.], ack 300620, win 65535, length 0
19:30:13.704647 IP 10.0.2.15.38044 > 151.101.117.67.443: Flags [.], ack 306116, win 65535, length 0
19:30:13.704714 IP 151.101.117.67.443 > 10.0.2.15.38044: Flags [P.], seq 306116:308864, ack 867, win 65535, length 2748
19:30:13.704716 IP 151.101.117.67.443 > 10.0.2.15.38044: Flags [P.], seq 308864:311612, ack 867, win 65535, length 2748
19:30:13.704716 IP 151.101.117.67.443 > 10.0.2.15.38044: Flags [P.], seq 311612:312986, ack 867, win 65535, length 1374
19:30:13.704717 IP 151.101.117.67.443 > 10.0.2.15.38044: Flags [P.], seq 312986:318482, ack 867, win 65535, length 5496
19:30:13.704728 IP 10.0.2.15.38044 > 151.101.117.67.443: Flags [.], ack 308864, win 65535, length 0
19:30:13.704749 IP 10.0.2.15.38044 > 151.101.117.67.443: Flags [.], ack 311612, win 65535, length 0
19:30:13.704812 IP 10.0.2.15.38044 > 151.101.117.67.443: Flags [.], ack 318482, win 65535, length 0
19:30:13.704879 IP 151.101.117.67.443 > 10.0.2.15.38044: Flags [P.], seq 318482:321230, ack 867, win 65535, length 2748
19:30:13.704880 IP 151.101.117.67.443 > 10.0.2.15.38044: Flags [P.], seq 321230:322604, ack 867, win 65535, length 1374
19:30:13.704888 IP 10.0.2.15.38044 > 151.101.117.67.443: Flags [.], ack 321230, win 65535, length 0
19:30:13.706120 IP 151.101.117.67.443 > 10.0.2.15.38044: Flags [P.], seq 322604:328100, ack 867, win 65535, length 5496
19:30:13.706138 IP 10.0.2.15.38044 > 151.101.117.67.443: Flags [.], ack 328100, win 65535, length 0
19:30:13.706580 IP 151.101.117.67.443 > 10.0.2.15.38044: Flags [P.], seq 328100:334970, ack 867, win 65535, length 6870
19:30:13.706594 IP 10.0.2.15.38044 > 151.101.117.67.443: Flags [.], ack 334970, win 65535, length 0
19:30:13.706857 IP 151.101.117.67.443 > 10.0.2.15.38044: Flags [.], seq 334970:336430, ack 867, win 65535, length 1460
19:30:13.707071 IP 151.101.117.67.443 > 10.0.2.15.38044: Flags [P.], seq 336430:339092, ack 867, win 65535, length 2662
19:30:13.707072 IP 151.101.117.67.443 > 10.0.2.15.38044: Flags [P.], seq 339092:343214, ack 867, win 65535, length 4122
19:30:13.707086 IP 10.0.2.15.38044 > 151.101.117.67.443: Flags [.], ack 339092, win 65535, length 0
19:30:13.707111 IP 10.0.2.15.38044 > 151.101.117.67.443: Flags [.], ack 343214, win 65535, length 0
19:30:13.707425 IP 151.101.117.67.443 > 10.0.2.15.38044: Flags [P.], seq 343214:347336, ack 867, win 65535, length 4122
19:30:13.707438 IP 10.0.2.15.38044 > 151.101.117.67.443: Flags [.], ack 347336, win 65535, length 0
19:30:13.708480 IP 151.101.117.67.443 > 10.0.2.15.38044: Flags [.], seq 347336:353176, ack 867, win 65535, length 5840
19:30:13.708495 IP 10.0.2.15.38044 > 151.101.117.67.443: Flags [.], ack 353176, win 65535, length 0
19:30:13.709149 IP 151.101.117.67.443 > 10.0.2.15.38044: Flags [P.], seq 353176:363824, ack 867, win 65535, length 10648
19:30:13.709160 IP 10.0.2.15.38044 > 151.101.117.67.443: Flags [.], ack 363824, win 65535, length 0
19:30:13.709181 IP 151.101.117.67.443 > 10.0.2.15.38044: Flags [P.], seq 363824:369320, ack 867, win 65535, length 5496
19:30:13.709182 IP 151.101.117.67.443 > 10.0.2.15.38044: Flags [P.], seq 369320:373442, ack 867, win 65535, length 4122
19:30:13.709182 IP 151.101.117.67.443 > 10.0.2.15.38044: Flags [P.], seq 373442:374816, ack 867, win 65535, length 1374
19:30:13.709188 IP 10.0.2.15.38044 > 151.101.117.67.443: Flags [.], ack 369320, win 65535, length 0
19:30:13.709197 IP 10.0.2.15.38044 > 151.101.117.67.443: Flags [.], ack 373442, win 65535, length 0
19:30:13.710095 IP 151.101.117.67.443 > 10.0.2.15.38044: Flags [P.], seq 374816:380312, ack 867, win 65535, length 5496
19:30:13.710097 IP 151.101.117.67.443 > 10.0.2.15.38044: Flags [P.], seq 380312:385808, ack 867, win 65535, length 5496
19:30:13.710114 IP 10.0.2.15.38044 > 151.101.117.67.443: Flags [.], ack 380312, win 65535, length 0
19:30:13.710171 IP 10.0.2.15.38044 > 151.101.117.67.443: Flags [.], ack 385808, win 65535, length 0
19:30:13.710207 IP 151.101.117.67.443 > 10.0.2.15.38044: Flags [P.], seq 385808:388556, ack 867, win 65535, length 2748
19:30:13.710208 IP 151.101.117.67.443 > 10.0.2.15.38044: Flags [P.], seq 388556:391304, ack 867, win 65535, length 2748
19:30:13.710209 IP 151.101.117.67.443 > 10.0.2.15.38044: Flags [P.], seq 391304:394052, ack 867, win 65535, length 2748
19:30:13.710217 IP 10.0.2.15.38044 > 151.101.117.67.443: Flags [.], ack 388556, win 65535, length 0
19:30:13.710230 IP 10.0.2.15.38044 > 151.101.117.67.443: Flags [.], ack 391304, win 65535, length 0
19:30:13.710236 IP 10.0.2.15.38044 > 151.101.117.67.443: Flags [.], ack 394052, win 65535, length 0
19:30:13.712007 IP 151.101.117.67.443 > 10.0.2.15.38044: Flags [P.], seq 394052:398174, ack 867, win 65535, length 4122
19:30:13.712012 IP 151.101.117.67.443 > 10.0.2.15.38044: Flags [P.], seq 398174:417410, ack 867, win 65535, length 19236
19:30:13.712042 IP 10.0.2.15.38044 > 151.101.117.67.443: Flags [.], ack 398174, win 65535, length 0
19:30:13.712064 IP 10.0.2.15.38044 > 151.101.117.67.443: Flags [.], ack 417410, win 65535, length 0
19:30:13.715160 IP 151.101.117.67.443 > 10.0.2.15.38044: Flags [P.], seq 417410:433898, ack 867, win 65535, length 16488
19:30:13.715178 IP 10.0.2.15.38044 > 151.101.117.67.443: Flags [.], ack 433898, win 65535, length 0
19:30:13.715219 IP 151.101.117.67.443 > 10.0.2.15.38044: Flags [P.], seq 433898:440768, ack 867, win 65535, length 6870
19:30:13.715221 IP 151.101.117.67.443 > 10.0.2.15.38044: Flags [P.], seq 440768:444890, ack 867, win 65535, length 4122
19:30:13.715228 IP 10.0.2.15.38044 > 151.101.117.67.443: Flags [.], ack 440768, win 65535, length 0
19:30:13.715238 IP 10.0.2.15.38044 > 151.101.117.67.443: Flags [.], ack 444890, win 65535, length 0
19:30:13.715250 IP 151.101.117.67.443 > 10.0.2.15.38044: Flags [P.], seq 444890:447638, ack 867, win 65535, length 2748
19:30:13.715251 IP 151.101.117.67.443 > 10.0.2.15.38044: Flags [P.], seq 447638:450386, ack 867, win 65535, length 2748
19:30:13.715254 IP 10.0.2.15.38044 > 151.101.117.67.443: Flags [.], ack 447638, win 65535, length 0
19:30:13.715261 IP 10.0.2.15.38044 > 151.101.117.67.443: Flags [.], ack 450386, win 65535, length 0
19:30:13.718244 IP 151.101.117.67.443 > 10.0.2.15.38044: Flags [P.], seq 450386:462752, ack 867, win 65535, length 12366
19:30:13.718354 IP 10.0.2.15.38044 > 151.101.117.67.443: Flags [.], ack 462752, win 65535, length 0
19:30:13.718492 IP 151.101.117.67.443 > 10.0.2.15.38044: Flags [P.], seq 462752:468248, ack 867, win 65535, length 5496
19:30:13.718495 IP 151.101.117.67.443 > 10.0.2.15.38044: Flags [P.], seq 468248:470996, ack 867, win 65535, length 2748
19:30:13.718510 IP 10.0.2.15.38044 > 151.101.117.67.443: Flags [.], ack 468248, win 65535, length 0
19:30:13.718603 IP 10.0.2.15.38044 > 151.101.117.67.443: Flags [.], ack 470996, win 65535, length 0
19:30:13.719206 IP 151.101.117.67.443 > 10.0.2.15.38044: Flags [P.], seq 470996:473744, ack 867, win 65535, length 2748
19:30:13.719208 IP 151.101.117.67.443 > 10.0.2.15.38044: Flags [P.], seq 473744:476492, ack 867, win 65535, length 2748
19:30:13.719208 IP 151.101.117.67.443 > 10.0.2.15.38044: Flags [P.], seq 476492:479240, ack 867, win 65535, length 2748
19:30:13.719209 IP 151.101.117.67.443 > 10.0.2.15.38044: Flags [P.], seq 479240:481988, ack 867, win 65535, length 2748
19:30:13.719349 IP 10.0.2.15.38044 > 151.101.117.67.443: Flags [.], ack 473744, win 65535, length 0
19:30:13.719553 IP 10.0.2.15.38044 > 151.101.117.67.443: Flags [.], ack 476492, win 65535, length 0
19:30:13.719681 IP 10.0.2.15.38044 > 151.101.117.67.443: Flags [.], ack 479240, win 65535, length 0
19:30:13.719746 IP 10.0.2.15.38044 > 151.101.117.67.443: Flags [.], ack 481988, win 65535, length 0
19:30:13.719905 IP 151.101.117.67.443 > 10.0.2.15.38044: Flags [P.], seq 481988:483362, ack 867, win 65535, length 1374
19:30:13.719908 IP 151.101.117.67.443 > 10.0.2.15.38044: Flags [P.], seq 483362:487484, ack 867, win 65535, length 4122
19:30:13.719908 IP 151.101.117.67.443 > 10.0.2.15.38044: Flags [P.], seq 487484:490232, ack 867, win 65535, length 2748
19:30:13.719909 IP 151.101.117.67.443 > 10.0.2.15.38044: Flags [P.], seq 490232:492980, ack 867, win 65535, length 2748
19:30:13.719923 IP 10.0.2.15.38044 > 151.101.117.67.443: Flags [.], ack 487484, win 65535, length 0
19:30:13.719998 IP 10.0.2.15.38044 > 151.101.117.67.443: Flags [.], ack 490232, win 65535, length 0
19:30:13.720016 IP 10.0.2.15.38044 > 151.101.117.67.443: Flags [.], ack 492980, win 65535, length 0
19:30:13.720110 IP 151.101.117.67.443 > 10.0.2.15.38044: Flags [P.], seq 492980:495728, ack 867, win 65535, length 2748
19:30:13.720111 IP 151.101.117.67.443 > 10.0.2.15.38044: Flags [P.], seq 495728:498476, ack 867, win 65535, length 2748
19:30:13.720295 IP 151.101.117.67.443 > 10.0.2.15.38044: Flags [P.], seq 498476:502598, ack 867, win 65535, length 4122
19:30:13.720298 IP 151.101.117.67.443 > 10.0.2.15.38044: Flags [P.], seq 502598:505346, ack 867, win 65535, length 2748
19:30:13.720310 IP 10.0.2.15.38044 > 151.101.117.67.443: Flags [.], ack 495728, win 65535, length 0
19:30:13.720427 IP 10.0.2.15.38044 > 151.101.117.67.443: Flags [.], ack 498476, win 65535, length 0
19:30:13.720487 IP 10.0.2.15.38044 > 151.101.117.67.443: Flags [.], ack 502598, win 65535, length 0
19:30:13.720544 IP 10.0.2.15.38044 > 151.101.117.67.443: Flags [.], ack 505346, win 65535, length 0
19:30:13.720625 IP 151.101.117.67.443 > 10.0.2.15.38044: Flags [P.], seq 505346:508094, ack 867, win 65535, length 2748
19:30:13.720627 IP 151.101.117.67.443 > 10.0.2.15.38044: Flags [P.], seq 508094:510842, ack 867, win 65535, length 2748
19:30:13.720627 IP 151.101.117.67.443 > 10.0.2.15.38044: Flags [P.], seq 510842:513590, ack 867, win 65535, length 2748
19:30:13.720628 IP 151.101.117.67.443 > 10.0.2.15.38044: Flags [P.], seq 513590:516338, ack 867, win 65535, length 2748
19:30:13.720636 IP 10.0.2.15.38044 > 151.101.117.67.443: Flags [.], ack 508094, win 65535, length 0
19:30:13.720708 IP 10.0.2.15.38044 > 151.101.117.67.443: Flags [.], ack 510842, win 65535, length 0
19:30:13.720725 IP 10.0.2.15.38044 > 151.101.117.67.443: Flags [.], ack 513590, win 65535, length 0
19:30:13.720739 IP 10.0.2.15.38044 > 151.101.117.67.443: Flags [.], ack 516338, win 65535, length 0
19:30:13.720751 IP 151.101.117.67.443 > 10.0.2.15.38044: Flags [P.], seq 516338:519086, ack 867, win 65535, length 2748
19:30:13.720753 IP 10.0.2.15.38044 > 151.101.117.67.443: Flags [.], ack 519086, win 65535, length 0
19:30:13.721047 IP 151.101.117.67.443 > 10.0.2.15.38044: Flags [P.], seq 519086:521834, ack 867, win 65535, length 2748
19:30:13.721049 IP 151.101.117.67.443 > 10.0.2.15.38044: Flags [P.], seq 521834:524582, ack 867, win 65535, length 2748
19:30:13.721060 IP 10.0.2.15.38044 > 151.101.117.67.443: Flags [.], ack 521834, win 65535, length 0
19:30:13.721080 IP 10.0.2.15.38044 > 151.101.117.67.443: Flags [.], ack 524582, win 65535, length 0
19:30:13.721310 IP 151.101.117.67.443 > 10.0.2.15.38044: Flags [P.], seq 524582:525956, ack 867, win 65535, length 1374
19:30:13.721312 IP 151.101.117.67.443 > 10.0.2.15.38044: Flags [P.], seq 525956:528704, ack 867, win 65535, length 2748
19:30:13.721326 IP 10.0.2.15.38044 > 151.101.117.67.443: Flags [.], ack 528704, win 65535, length 0
19:30:13.722390 IP 151.101.117.67.443 > 10.0.2.15.38044: Flags [P.], seq 528704:532826, ack 867, win 65535, length 4122
19:30:13.722516 IP 10.0.2.15.38044 > 151.101.117.67.443: Flags [.], ack 532826, win 65535, length 0
19:30:13.722819 IP 151.101.117.67.443 > 10.0.2.15.38044: Flags [P.], seq 532826:538322, ack 867, win 65535, length 5496
19:30:13.722821 IP 151.101.117.67.443 > 10.0.2.15.38044: Flags [P.], seq 538322:541070, ack 867, win 65535, length 2748
19:30:13.722822 IP 151.101.117.67.443 > 10.0.2.15.38044: Flags [P.], seq 541070:543818, ack 867, win 65535, length 2748
19:30:13.722837 IP 10.0.2.15.38044 > 151.101.117.67.443: Flags [.], ack 538322, win 65535, length 0
19:30:13.722899 IP 10.0.2.15.38044 > 151.101.117.67.443: Flags [.], ack 541070, win 65535, length 0
19:30:13.722910 IP 10.0.2.15.38044 > 151.101.117.67.443: Flags [.], ack 543818, win 65535, length 0
19:30:13.722928 IP 151.101.117.67.443 > 10.0.2.15.38044: Flags [P.], seq 543818:545192, ack 867, win 65535, length 1374
19:30:13.723094 IP 151.101.117.67.443 > 10.0.2.15.38044: Flags [P.], seq 545192:550688, ack 867, win 65535, length 5496
19:30:13.723103 IP 10.0.2.15.38044 > 151.101.117.67.443: Flags [.], ack 550688, win 65535, length 0
19:30:13.723345 IP 151.101.117.67.443 > 10.0.2.15.38044: Flags [P.], seq 550688:553436, ack 867, win 65535, length 2748
19:30:13.723352 IP 10.0.2.15.38044 > 151.101.117.67.443: Flags [.], ack 553436, win 65535, length 0
19:30:13.724163 IP 151.101.117.67.443 > 10.0.2.15.38044: Flags [P.], seq 553436:557558, ack 867, win 65535, length 4122
19:30:13.724166 IP 151.101.117.67.443 > 10.0.2.15.38044: Flags [P.], seq 557558:561680, ack 867, win 65535, length 4122
19:30:13.724168 IP 151.101.117.67.443 > 10.0.2.15.38044: Flags [P.], seq 561680:568550, ack 867, win 65535, length 6870
19:30:13.724195 IP 10.0.2.15.38044 > 151.101.117.67.443: Flags [.], ack 557558, win 65535, length 0
19:30:13.724228 IP 10.0.2.15.38044 > 151.101.117.67.443: Flags [.], ack 561680, win 65535, length 0
19:30:13.724243 IP 10.0.2.15.38044 > 151.101.117.67.443: Flags [.], ack 568550, win 65535, length 0
19:30:13.724260 IP 151.101.117.67.443 > 10.0.2.15.38044: Flags [P.], seq 568550:569924, ack 867, win 65535, length 1374
19:30:13.725081 IP 151.101.117.67.443 > 10.0.2.15.38044: Flags [P.], seq 569924:578168, ack 867, win 65535, length 8244
19:30:13.725108 IP 10.0.2.15.38044 > 151.101.117.67.443: Flags [.], ack 578168, win 65535, length 0
19:30:13.725277 IP 151.101.117.67.443 > 10.0.2.15.38044: Flags [P.], seq 578168:583664, ack 867, win 65535, length 5496
19:30:13.725278 IP 151.101.117.67.443 > 10.0.2.15.38044: Flags [.], seq 583664:589504, ack 867, win 65535, length 5840
19:30:13.725290 IP 10.0.2.15.38044 > 151.101.117.67.443: Flags [.], ack 583664, win 65535, length 0
19:30:13.725358 IP 10.0.2.15.38044 > 151.101.117.67.443: Flags [.], ack 589504, win 65535, length 0
19:30:13.725641 IP 151.101.117.67.443 > 10.0.2.15.38044: Flags [P.], seq 589504:590534, ack 867, win 65535, length 1030
19:30:13.725642 IP 151.101.117.67.443 > 10.0.2.15.38044: Flags [P.], seq 590534:593282, ack 867, win 65535, length 2748
19:30:13.725643 IP 151.101.117.67.443 > 10.0.2.15.38044: Flags [P.], seq 593282:596030, ack 867, win 65535, length 2748
19:30:13.725661 IP 10.0.2.15.38044 > 151.101.117.67.443: Flags [.], ack 593282, win 65535, length 0
19:30:13.725681 IP 10.0.2.15.38044 > 151.101.117.67.443: Flags [.], ack 596030, win 65535, length 0
19:30:13.725785 IP 151.101.117.67.443 > 10.0.2.15.38044: Flags [P.], seq 596030:598778, ack 867, win 65535, length 2748
19:30:13.725791 IP 10.0.2.15.38044 > 151.101.117.67.443: Flags [.], ack 598778, win 65535, length 0
19:30:13.726013 IP 151.101.117.67.443 > 10.0.2.15.38044: Flags [P.], seq 598778:601526, ack 867, win 65535, length 2748
19:30:13.726023 IP 10.0.2.15.38044 > 151.101.117.67.443: Flags [.], ack 601526, win 65535, length 0
19:30:13.726125 IP 151.101.117.67.443 > 10.0.2.15.38044: Flags [P.], seq 601526:605648, ack 867, win 65535, length 4122
19:30:13.726140 IP 10.0.2.15.38044 > 151.101.117.67.443: Flags [.], ack 605648, win 65535, length 0
19:30:13.726569 IP 151.101.117.67.443 > 10.0.2.15.38044: Flags [P.], seq 605648:612518, ack 867, win 65535, length 6870
19:30:13.726571 IP 151.101.117.67.443 > 10.0.2.15.38044: Flags [P.], seq 612518:615266, ack 867, win 65535, length 2748
19:30:13.726667 IP 10.0.2.15.38044 > 151.101.117.67.443: Flags [.], ack 615266, win 65535, length 0
19:30:13.726721 IP 151.101.117.67.443 > 10.0.2.15.38044: Flags [P.], seq 615266:618014, ack 867, win 65535, length 2748
19:30:13.726741 IP 10.0.2.15.38044 > 151.101.117.67.443: Flags [.], ack 618014, win 65535, length 0
19:30:13.726923 IP 151.101.117.67.443 > 10.0.2.15.38044: Flags [P.], seq 618014:620762, ack 867, win 65535, length 2748
19:30:13.726930 IP 10.0.2.15.38044 > 151.101.117.67.443: Flags [.], ack 620762, win 65535, length 0
19:30:13.727134 IP 151.101.117.67.443 > 10.0.2.15.38044: Flags [P.], seq 620762:623510, ack 867, win 65535, length 2748
19:30:13.727135 IP 151.101.117.67.443 > 10.0.2.15.38044: Flags [P.], seq 623510:627632, ack 867, win 65535, length 4122
19:30:13.727143 IP 10.0.2.15.38044 > 151.101.117.67.443: Flags [.], ack 623510, win 65535, length 0
19:30:13.727186 IP 10.0.2.15.38044 > 151.101.117.67.443: Flags [.], ack 627632, win 65535, length 0
19:30:13.727363 IP 151.101.117.67.443 > 10.0.2.15.38044: Flags [P.], seq 627632:629006, ack 867, win 65535, length 1374
19:30:13.727545 IP 151.101.117.67.443 > 10.0.2.15.38044: Flags [P.], seq 629006:634502, ack 867, win 65535, length 5496
19:30:13.727556 IP 10.0.2.15.38044 > 151.101.117.67.443: Flags [.], ack 634502, win 65535, length 0
19:30:13.727708 IP 151.101.117.67.443 > 10.0.2.15.38044: Flags [P.], seq 634502:637250, ack 867, win 65535, length 2748
19:30:13.727718 IP 10.0.2.15.38044 > 151.101.117.67.443: Flags [.], ack 637250, win 65535, length 0
19:30:13.727868 IP 151.101.117.67.443 > 10.0.2.15.38044: Flags [P.], seq 637250:639998, ack 867, win 65535, length 2748
19:30:13.727876 IP 10.0.2.15.38044 > 151.101.117.67.443: Flags [.], ack 639998, win 65535, length 0
19:30:13.729296 IP 151.101.117.67.443 > 10.0.2.15.38044: Flags [P.], seq 639998:645494, ack 867, win 65535, length 5496
19:30:13.729298 IP 151.101.117.67.443 > 10.0.2.15.38044: Flags [P.], seq 645494:648242, ack 867, win 65535, length 2748
19:30:13.729299 IP 151.101.117.67.443 > 10.0.2.15.38044: Flags [P.], seq 648242:650990, ack 867, win 65535, length 2748
19:30:13.729325 IP 10.0.2.15.38044 > 151.101.117.67.443: Flags [.], ack 645494, win 65535, length 0
19:30:13.729627 IP 10.0.2.15.38044 > 151.101.117.67.443: Flags [.], ack 648242, win 65535, length 0
19:30:13.729653 IP 10.0.2.15.38044 > 151.101.117.67.443: Flags [.], ack 650990, win 65535, length 0
19:30:13.729771 IP 151.101.117.67.443 > 10.0.2.15.38044: Flags [P.], seq 650990:653738, ack 867, win 65535, length 2748
19:30:13.729785 IP 10.0.2.15.38044 > 151.101.117.67.443: Flags [.], ack 653738, win 65535, length 0
19:30:13.730251 IP 151.101.117.67.443 > 10.0.2.15.38044: Flags [P.], seq 653738:657860, ack 867, win 65535, length 4122
19:30:13.730268 IP 10.0.2.15.38044 > 151.101.117.67.443: Flags [.], ack 657860, win 65535, length 0
19:30:13.730939 IP 151.101.117.67.443 > 10.0.2.15.38044: Flags [P.], seq 657860:664730, ack 867, win 65535, length 6870
19:30:13.730943 IP 151.101.117.67.443 > 10.0.2.15.38044: Flags [P.], seq 664730:675722, ack 867, win 65535, length 10992
19:30:13.731013 IP 10.0.2.15.38044 > 151.101.117.67.443: Flags [.], ack 664730, win 65535, length 0
19:30:13.731242 IP 10.0.2.15.38044 > 151.101.117.67.443: Flags [.], ack 675722, win 65535, length 0
19:30:13.732122 IP 151.101.117.67.443 > 10.0.2.15.38044: Flags [P.], seq 675722:681218, ack 867, win 65535, length 5496
19:30:13.732335 IP 151.101.117.67.443 > 10.0.2.15.38044: Flags [P.], seq 681218:688088, ack 867, win 65535, length 6870
19:30:13.732411 IP 10.0.2.15.38044 > 151.101.117.67.443: Flags [.], ack 681218, win 65535, length 0
19:30:13.732614 IP 151.101.117.67.443 > 10.0.2.15.38044: Flags [P.], seq 688088:689462, ack 867, win 65535, length 1374
19:30:13.732632 IP 151.101.117.67.443 > 10.0.2.15.38044: Flags [P.], seq 689462:705950, ack 867, win 65535, length 16488
19:30:13.733433 IP 151.101.117.67.443 > 10.0.2.15.38044: Flags [P.], seq 705950:711446, ack 867, win 65535, length 5496
19:30:13.733436 IP 151.101.117.67.443 > 10.0.2.15.38044: Flags [P.], seq 711446:714194, ack 867, win 65535, length 2748
19:30:13.733463 IP 10.0.2.15.38044 > 151.101.117.67.443: Flags [.], ack 705950, win 65535, length 0
19:30:13.733707 IP 10.0.2.15.38044 > 151.101.117.67.443: Flags [.], ack 714194, win 65535, length 0
19:30:13.733916 IP 151.101.117.67.443 > 10.0.2.15.38044: Flags [P.], seq 714194:719690, ack 867, win 65535, length 5496
19:30:13.733917 IP 151.101.117.67.443 > 10.0.2.15.38044: Flags [P.], seq 719690:722438, ack 867, win 65535, length 2748
19:30:13.733918 IP 151.101.117.67.443 > 10.0.2.15.38044: Flags [P.], seq 722438:723812, ack 867, win 65535, length 1374
19:30:13.733929 IP 10.0.2.15.38044 > 151.101.117.67.443: Flags [.], ack 719690, win 65535, length 0
19:30:13.733948 IP 10.0.2.15.38044 > 151.101.117.67.443: Flags [.], ack 722438, win 65535, length 0
19:30:13.734065 IP 151.101.117.67.443 > 10.0.2.15.38044: Flags [P.], seq 723812:726560, ack 867, win 65535, length 2748
19:30:13.734070 IP 10.0.2.15.38044 > 151.101.117.67.443: Flags [.], ack 726560, win 65535, length 0
19:30:13.734418 IP 151.101.117.67.443 > 10.0.2.15.38044: Flags [P.], seq 726560:730682, ack 867, win 65535, length 4122
19:30:13.734420 IP 151.101.117.67.443 > 10.0.2.15.38044: Flags [P.], seq 730682:733430, ack 867, win 65535, length 2748
19:30:13.734538 IP 151.101.117.67.443 > 10.0.2.15.38044: Flags [P.], seq 733430:734804, ack 867, win 65535, length 1374
19:30:13.734690 IP 151.101.117.67.443 > 10.0.2.15.38044: Flags [P.], seq 734804:737552, ack 867, win 65535, length 2748
19:30:13.734831 IP 151.101.117.67.443 > 10.0.2.15.38044: Flags [P.], seq 737552:743048, ack 867, win 65535, length 5496
19:30:13.734972 IP 151.101.117.67.443 > 10.0.2.15.38044: Flags [P.], seq 743048:745796, ack 867, win 65535, length 2748
19:30:13.735132 IP 151.101.117.67.443 > 10.0.2.15.38044: Flags [P.], seq 745796:748544, ack 867, win 65535, length 2748
19:30:13.738421 IP 151.101.117.67.443 > 10.0.2.15.38044: Flags [P.], seq 748544:756788, ack 867, win 65535, length 8244
19:30:13.738424 IP 151.101.117.67.443 > 10.0.2.15.38044: Flags [P.], seq 756788:759536, ack 867, win 65535, length 2748
19:30:13.739201 IP 10.0.2.15.38044 > 151.101.117.67.443: Flags [.], ack 748544, win 65535, length 0
19:30:13.739759 IP 151.101.117.67.443 > 10.0.2.15.38044: Flags [P.], seq 759536:782894, ack 867, win 65535, length 23358
19:30:13.740240 IP 10.0.2.15.38044 > 151.101.117.67.443: Flags [.], ack 782894, win 65535, length 0
19:30:13.740823 IP 151.101.117.67.443 > 10.0.2.15.38044: Flags [.], seq 782894:796034, ack 867, win 65535, length 13140
19:30:13.740908 IP 151.101.117.67.443 > 10.0.2.15.38044: Flags [P.], seq 796034:800756, ack 867, win 65535, length 4722
19:30:13.740910 IP 151.101.117.67.443 > 10.0.2.15.38044: Flags [P.], seq 800756:804878, ack 867, win 65535, length 4122
19:30:13.740910 IP 151.101.117.67.443 > 10.0.2.15.38044: Flags [P.], seq 804878:807626, ack 867, win 65535, length 2748
19:30:13.740929 IP 151.101.117.67.443 > 10.0.2.15.38044: Flags [P.], seq 807626:810374, ack 867, win 65535, length 2748
19:30:13.740967 IP 10.0.2.15.38044 > 151.101.117.67.443: Flags [.], ack 810374, win 65535, length 0
19:30:13.742681 IP 151.101.117.67.443 > 10.0.2.15.38044: Flags [P.], seq 810374:815870, ack 867, win 65535, length 5496
19:30:13.742683 IP 151.101.117.67.443 > 10.0.2.15.38044: Flags [P.], seq 815870:819992, ack 867, win 65535, length 4122
19:30:13.742701 IP 10.0.2.15.38044 > 151.101.117.67.443: Flags [.], ack 815870, win 65535, length 0
19:30:13.742894 IP 151.101.117.67.443 > 10.0.2.15.38044: Flags [P.], seq 819992:825488, ack 867, win 65535, length 5496
19:30:13.742979 IP 10.0.2.15.38044 > 151.101.117.67.443: Flags [.], ack 825488, win 65535, length 0
19:30:13.743033 IP 151.101.117.67.443 > 10.0.2.15.38044: Flags [P.], seq 825488:828236, ack 867, win 65535, length 2748
19:30:13.743195 IP 151.101.117.67.443 > 10.0.2.15.38044: Flags [P.], seq 828236:830984, ack 867, win 65535, length 2748
19:30:13.743277 IP 10.0.2.15.38044 > 151.101.117.67.443: Flags [.], ack 830984, win 65535, length 0
19:30:13.743362 IP 151.101.117.67.443 > 10.0.2.15.38044: Flags [P.], seq 830984:833732, ack 867, win 65535, length 2748
19:30:13.743386 IP 10.0.2.15.38044 > 151.101.117.67.443: Flags [.], ack 833732, win 65535, length 0
19:30:13.744500 IP 151.101.117.67.443 > 10.0.2.15.38044: Flags [P.], seq 833732:839228, ack 867, win 65535, length 5496
19:30:13.744503 IP 151.101.117.67.443 > 10.0.2.15.38044: Flags [P.], seq 839228:844724, ack 867, win 65535, length 5496
19:30:13.744520 IP 10.0.2.15.38044 > 151.101.117.67.443: Flags [.], ack 839228, win 65535, length 0
19:30:13.744587 IP 151.101.117.67.443 > 10.0.2.15.38044: Flags [P.], seq 844724:847472, ack 867, win 65535, length 2748
19:30:13.744589 IP 151.101.117.67.443 > 10.0.2.15.38044: Flags [P.], seq 847472:850220, ack 867, win 65535, length 2748
19:30:13.744589 IP 151.101.117.67.443 > 10.0.2.15.38044: Flags [P.], seq 850220:852968, ack 867, win 65535, length 2748
19:30:13.744590 IP 151.101.117.67.443 > 10.0.2.15.38044: Flags [P.], seq 852968:855716, ack 867, win 65535, length 2748
19:30:13.744612 IP 151.101.117.67.443 > 10.0.2.15.38044: Flags [P.], seq 855716:858464, ack 867, win 65535, length 2748
19:30:13.744667 IP 10.0.2.15.38044 > 151.101.117.67.443: Flags [.], ack 858464, win 65535, length 0
19:30:13.747080 IP 151.101.117.67.443 > 10.0.2.15.38044: Flags [P.], seq 858464:862586, ack 867, win 65535, length 4122
19:30:13.747082 IP 151.101.117.67.443 > 10.0.2.15.38044: Flags [P.], seq 862586:868082, ack 867, win 65535, length 5496
19:30:13.747108 IP 10.0.2.15.38044 > 151.101.117.67.443: Flags [.], ack 862586, win 65535, length 0
19:30:13.747250 IP 10.0.2.15.38044 > 151.101.117.67.443: Flags [.], ack 868082, win 65535, length 0
19:30:13.751150 IP 151.101.117.67.443 > 10.0.2.15.38044: Flags [P.], seq 868082:884570, ack 867, win 65535, length 16488
19:30:13.751241 IP 151.101.117.67.443 > 10.0.2.15.38044: Flags [P.], seq 884570:898310, ack 867, win 65535, length 13740
19:30:13.751250 IP 151.101.117.67.443 > 10.0.2.15.38044: Flags [P.], seq 898310:901058, ack 867, win 65535, length 2748
19:30:13.751316 IP 10.0.2.15.38044 > 151.101.117.67.443: Flags [.], ack 901058, win 65535, length 0
19:30:13.751574 IP 151.101.117.67.443 > 10.0.2.15.38044: Flags [P.], seq 901058:914798, ack 867, win 65535, length 13740
19:30:13.751586 IP 10.0.2.15.38044 > 151.101.117.67.443: Flags [.], ack 914798, win 65535, length 0
19:30:13.752084 IP 151.101.117.67.443 > 10.0.2.15.38044: Flags [P.], seq 914798:920294, ack 867, win 65535, length 5496
19:30:13.752086 IP 151.101.117.67.443 > 10.0.2.15.38044: Flags [P.], seq 920294:921668, ack 867, win 65535, length 1374
19:30:13.752087 IP 151.101.117.67.443 > 10.0.2.15.38044: Flags [P.], seq 921668:924416, ack 867, win 65535, length 2748
19:30:13.752104 IP 10.0.2.15.38044 > 151.101.117.67.443: Flags [.], ack 920294, win 65535, length 0
19:30:13.752369 IP 151.101.117.67.443 > 10.0.2.15.38044: Flags [P.], seq 924416:927164, ack 867, win 65535, length 2748
19:30:13.752371 IP 151.101.117.67.443 > 10.0.2.15.38044: Flags [.], seq 927164:930084, ack 867, win 65535, length 2920
19:30:13.752483 IP 151.101.117.67.443 > 10.0.2.15.38044: Flags [P.], seq 930084:931286, ack 867, win 65535, length 1202
19:30:13.752484 IP 151.101.117.67.443 > 10.0.2.15.38044: Flags [P.], seq 931286:932660, ack 867, win 65535, length 1374
19:30:13.752516 IP 10.0.2.15.38044 > 151.101.117.67.443: Flags [.], ack 932660, win 65535, length 0
19:30:13.752614 IP 151.101.117.67.443 > 10.0.2.15.38044: Flags [P.], seq 932660:935408, ack 867, win 65535, length 2748
19:30:13.752670 IP 10.0.2.15.38044 > 151.101.117.67.443: Flags [.], ack 935408, win 65535, length 0
19:30:13.752747 IP 151.101.117.67.443 > 10.0.2.15.38044: Flags [P.], seq 935408:936782, ack 867, win 65535, length 1374
19:30:13.752748 IP 151.101.117.67.443 > 10.0.2.15.38044: Flags [.], seq 936782:938242, ack 867, win 65535, length 1460
19:30:13.752775 IP 10.0.2.15.38044 > 151.101.117.67.443: Flags [.], ack 938242, win 65535, length 0
19:30:13.752890 IP 151.101.117.67.443 > 10.0.2.15.38044: Flags [P.], seq 938242:939530, ack 867, win 65535, length 1288
19:30:13.752951 IP 151.101.117.67.443 > 10.0.2.15.38044: Flags [P.], seq 939530:942278, ack 867, win 65535, length 2748
19:30:13.752956 IP 10.0.2.15.38044 > 151.101.117.67.443: Flags [.], ack 942278, win 65535, length 0
19:30:13.762515 IP 151.101.117.67.443 > 10.0.2.15.38044: Flags [.], seq 942278:977318, ack 867, win 65535, length 35040
19:30:13.763044 IP 10.0.2.15.38044 > 151.101.117.67.443: Flags [.], ack 977318, win 65535, length 0
19:30:13.763340 IP 151.101.117.67.443 > 10.0.2.15.38044: Flags [P.], seq 977318:995864, ack 867, win 65535, length 18546
19:30:13.763387 IP 10.0.2.15.38044 > 151.101.117.67.443: Flags [.], ack 995864, win 65535, length 0

