00:11:23.664913 IP 10.0.2.15.37894 > 151.101.117.67.443: Flags [P.], seq 3245400305:3245400822, ack 65984002, win 64240, length 517
00:11:23.665439 IP 151.101.117.67.443 > 10.0.2.15.37894: Flags [.], ack 517, win 65535, length 0
00:11:23.685480 IP 151.101.117.67.443 > 10.0.2.15.37894: Flags [.], seq 1:2921, ack 517, win 65535, length 2920
00:11:23.685504 IP 10.0.2.15.37894 > 151.101.117.67.443: Flags [.], ack 2921, win 62780, length 0
00:11:23.685827 IP 151.101.117.67.443 > 10.0.2.15.37894: Flags [P.], seq 2921:5064, ack 517, win 65535, length 2143
00:11:23.685838 IP 10.0.2.15.37894 > 151.101.117.67.443: Flags [.], ack 5064, win 62780, length 0
00:11:23.687306 IP 10.0.2.15.37894 > 151.101.117.67.443: Flags [P.], seq 517:610, ack 5064, win 62780, length 93
00:11:23.687834 IP 151.101.117.67.443 > 10.0.2.15.37894: Flags [.], ack 610, win 65535, length 0
00:11:23.701929 IP 151.101.117.67.443 > 10.0.2.15.37894: Flags [P.], seq 5064:5115, ack 610, win 65535, length 51
00:11:23.701951 IP 10.0.2.15.37894 > 151.101.117.67.443: Flags [.], ack 5115, win 62780, length 0
00:11:23.702516 IP 10.0.2.15.37894 > 151.101.117.67.443: Flags [P.], seq 610:663, ack 5115, win 62780, length 53
00:11:23.702562 IP 10.0.2.15.37894 > 151.101.117.67.443: Flags [P.], seq 663:719, ack 5115, win 62780, length 56
00:11:23.702798 IP 10.0.2.15.37894 > 151.101.117.67.443: Flags [P.], seq 719:828, ack 5115, win 62780, length 109
00:11:23.703035 IP 151.101.117.67.443 > 10.0.2.15.37894: Flags [.], ack 663, win 65535, length 0
00:11:23.703092 IP 151.101.117.67.443 > 10.0.2.15.37894: Flags [.], ack 719, win 65535, length 0
00:11:23.704688 IP 151.101.117.67.443 > 10.0.2.15.37894: Flags [.], ack 828, win 65535, length 0
00:11:23.731738 IP 151.101.117.67.443 > 10.0.2.15.37894: Flags [P.], seq 5115:5210, ack 828, win 65535, length 95
00:11:23.731742 IP 151.101.117.67.443 > 10.0.2.15.37894: Flags [P.], seq 5210:10706, ack 828, win 65535, length 5496
00:11:23.731743 IP 151.101.117.67.443 > 10.0.2.15.37894: Flags [.], seq 10706:12166, ack 828, win 65535, length 1460
00:11:23.731767 IP 10.0.2.15.37894 > 151.101.117.67.443: Flags [.], ack 5210, win 62780, length 0
00:11:23.731832 IP 10.0.2.15.37894 > 151.101.117.67.443: Flags [.], ack 10706, win 59860, length 0
00:11:23.731845 IP 10.0.2.15.37894 > 151.101.117.67.443: Flags [.], ack 12166, win 59860, length 0
00:11:23.741061 IP 151.101.117.67.443 > 10.0.2.15.37894: Flags [P.], seq 12166:21698, ack 828, win 65535, length 9532
00:11:23.741066 IP 151.101.117.67.443 > 10.0.2.15.37894: Flags [.], seq 21698:23158, ack 828, win 65535, length 1460
00:11:23.741097 IP 10.0.2.15.37894 > 151.101.117.67.443: Flags [.], ack 21698, win 52560, length 0
00:11:23.741126 IP 10.0.2.15.37894 > 151.101.117.67.443: Flags [.], ack 23158, win 52560, length 0
00:11:23.741333 IP 10.0.2.15.37894 > 151.101.117.67.443: Flags [P.], seq 828:866, ack 23158, win 52560, length 38
00:11:23.742809 IP 151.101.117.67.443 > 10.0.2.15.37894: Flags [P.], seq 23158:32690, ack 828, win 65535, length 9532
00:11:23.742812 IP 151.101.117.67.443 > 10.0.2.15.37894: Flags [.], ack 866, win 65535, length 0
00:11:23.742871 IP 151.101.117.67.443 > 10.0.2.15.37894: Flags [.], seq 32690:37070, ack 866, win 65535, length 4380
00:11:23.743087 IP 10.0.2.15.37894 > 151.101.117.67.443: Flags [.], ack 37070, win 42340, length 0
00:11:23.748531 IP 151.101.117.67.443 > 10.0.2.15.37894: Flags [P.], seq 37070:38186, ack 866, win 65535, length 1116
00:11:23.748535 IP 151.101.117.67.443 > 10.0.2.15.37894: Flags [P.], seq 38186:40934, ack 866, win 65535, length 2748
00:11:23.748536 IP 151.101.117.67.443 > 10.0.2.15.37894: Flags [P.], seq 40934:43682, ack 866, win 65535, length 2748
00:11:23.751270 IP 151.101.117.67.443 > 10.0.2.15.37894: Flags [P.], seq 43682:46430, ack 866, win 65535, length 2748
00:11:23.751314 IP 10.0.2.15.37894 > 151.101.117.67.443: Flags [.], ack 40934, win 61320, length 0
00:11:23.751991 IP 151.101.117.67.443 > 10.0.2.15.37894: Flags [P.], seq 46430:51926, ack 866, win 65535, length 5496
00:11:23.751996 IP 151.101.117.67.443 > 10.0.2.15.37894: Flags [.], seq 51926:57766, ack 866, win 65535, length 5840
00:11:23.752310 IP 10.0.2.15.37894 > 151.101.117.67.443: Flags [.], ack 57766, win 49640, length 0
00:11:23.752850 IP 151.101.117.67.443 > 10.0.2.15.37894: Flags [P.], seq 57766:58796, ack 866, win 65535, length 1030
00:11:23.754190 IP 151.101.117.67.443 > 10.0.2.15.37894: Flags [P.], seq 58796:64292, ack 866, win 65535, length 5496
00:11:23.754573 IP 10.0.2.15.37894 > 151.101.117.67.443: Flags [.], ack 64292, win 61320, length 0
00:11:23.757765 IP 151.101.117.67.443 > 10.0.2.15.37894: Flags [P.], seq 64292:67040, ack 866, win 65535, length 2748
00:11:23.757770 IP 151.101.117.67.443 > 10.0.2.15.37894: Flags [P.], seq 67040:69788, ack 866, win 65535, length 2748
00:11:23.757771 IP 151.101.117.67.443 > 10.0.2.15.37894: Flags [P.], seq 69788:75284, ack 866, win 65535, length 5496
00:11:23.758106 IP 151.101.117.67.443 > 10.0.2.15.37894: Flags [P.], seq 75284:78032, ack 866, win 65535, length 2748
00:11:23.758221 IP 10.0.2.15.37894 > 151.101.117.67.443: Flags [.], ack 78032, win 62780, length 0
00:11:23.759110 IP 151.101.117.67.443 > 10.0.2.15.37894: Flags [P.], seq 78032:80780, ack 866, win 65535, length 2748
00:11:23.759344 IP 10.0.2.15.37894 > 151.101.117.67.443: Flags [.], ack 80780, win 65535, length 0
00:11:23.761417 IP 151.101.117.67.443 > 10.0.2.15.37894: Flags [P.], seq 80780:86276, ack 866, win 65535, length 5496
00:11:23.761446 IP 10.0.2.15.37894 > 151.101.117.67.443: Flags [.], ack 86276, win 65535, length 0
00:11:23.763657 IP 151.101.117.67.443 > 10.0.2.15.37894: Flags [P.], seq 86276:89024, ack 866, win 65535, length 2748
00:11:23.763661 IP 151.101.117.67.443 > 10.0.2.15.37894: Flags [P.], seq 89024:94520, ack 866, win 65535, length 5496
00:11:23.763726 IP 10.0.2.15.37894 > 151.101.117.67.443: Flags [.], ack 89024, win 65535, length 0
00:11:23.763798 IP 10.0.2.15.37894 > 151.101.117.67.443: Flags [.], ack 94520, win 65535, length 0
00:11:23.764289 IP 151.101.117.67.443 > 10.0.2.15.37894: Flags [P.], seq 94520:100016, ack 866, win 65535, length 5496
00:11:23.764308 IP 10.0.2.15.37894 > 151.101.117.67.443: Flags [.], ack 100016, win 65535, length 0
00:11:23.776838 IP 151.101.117.67.443 > 10.0.2.15.37894: Flags [P.], seq 100016:104138, ack 866, win 65535, length 4122
00:11:23.776841 IP 151.101.117.67.443 > 10.0.2.15.37894: Flags [P.], seq 104138:109634, ack 866, win 65535, length 5496
00:11:23.776843 IP 151.101.117.67.443 > 10.0.2.15.37894: Flags [P.], seq 109634:116504, ack 866, win 65535, length 6870
00:11:23.776869 IP 10.0.2.15.37894 > 151.101.117.67.443: Flags [.], ack 104138, win 65535, length 0
00:11:23.782462 IP 10.0.2.15.37894 > 151.101.117.67.443: Flags [.], ack 109634, win 65535, length 0
00:11:23.782516 IP 10.0.2.15.37894 > 151.101.117.67.443: Flags [.], ack 116504, win 65535, length 0
00:11:23.782684 IP 151.101.117.67.443 > 10.0.2.15.37894: Flags [P.], seq 116504:124748, ack 866, win 65535, length 8244
00:11:23.782690 IP 151.101.117.67.443 > 10.0.2.15.37894: Flags [.], seq 124748:133508, ack 866, win 65535, length 8760
00:11:23.782712 IP 10.0.2.15.37894 > 151.101.117.67.443: Flags [.], ack 124748, win 65535, length 0
00:11:23.782735 IP 10.0.2.15.37894 > 151.101.117.67.443: Flags [.], ack 133508, win 65535, length 0
00:11:23.784739 IP 151.101.117.67.443 > 10.0.2.15.37894: Flags [P.], seq 133508:137114, ack 866, win 65535, length 3606
00:11:23.784750 IP 151.101.117.67.443 > 10.0.2.15.37894: Flags [.], seq 137114:169234, ack 866, win 65535, length 32120
00:11:23.784776 IP 10.0.2.15.37894 > 151.101.117.67.443: Flags [.], ack 137114, win 65535, length 0
00:11:23.784812 IP 10.0.2.15.37894 > 151.101.117.67.443: Flags [.], ack 169234, win 65535, length 0
00:11:23.789625 IP 151.101.117.67.443 > 10.0.2.15.37894: Flags [P.], seq 169234:198434, ack 866, win 65535, length 29200
00:11:23.789650 IP 10.0.2.15.37894 > 151.101.117.67.443: Flags [.], ack 198434, win 65535, length 0
00:11:23.789711 IP 151.101.117.67.443 > 10.0.2.15.37894: Flags [.], seq 198434:208654, ack 866, win 65535, length 10220
00:11:23.789718 IP 10.0.2.15.37894 > 151.101.117.67.443: Flags [.], ack 208654, win 65535, length 0
00:11:23.799192 IP 151.101.117.67.443 > 10.0.2.15.37894: Flags [P.], seq 208654:234934, ack 866, win 65535, length 26280
00:11:23.799217 IP 10.0.2.15.37894 > 151.101.117.67.443: Flags [.], ack 234934, win 65535, length 0
00:11:23.801312 IP 151.101.117.67.443 > 10.0.2.15.37894: Flags [P.], seq 234934:274354, ack 866, win 65535, length 39420
00:11:23.801672 IP 10.0.2.15.37894 > 151.101.117.67.443: Flags [.], ack 274354, win 65535, length 0
00:11:23.802744 IP 151.101.117.67.443 > 10.0.2.15.37894: Flags [.], seq 274354:319614, ack 866, win 65535, length 45260
00:11:23.802778 IP 10.0.2.15.37894 > 151.101.117.67.443: Flags [.], ack 319614, win 65535, length 0
00:11:23.803371 IP 151.101.117.67.443 > 10.0.2.15.37894: Flags [P.], seq 319614:340054, ack 866, win 65535, length 20440
00:11:23.803395 IP 10.0.2.15.37894 > 151.101.117.67.443: Flags [.], ack 340054, win 65535, length 0
00:11:23.803468 IP 151.101.117.67.443 > 10.0.2.15.37894: Flags [.], seq 340054:366334, ack 866, win 65535, length 26280
00:11:23.803476 IP 10.0.2.15.37894 > 151.101.117.67.443: Flags [.], ack 366334, win 65535, length 0
00:11:23.804507 IP 151.101.117.67.443 > 10.0.2.15.37894: Flags [P.], seq 366334:385314, ack 866, win 65535, length 18980
00:11:23.804539 IP 10.0.2.15.37894 > 151.101.117.67.443: Flags [.], ack 385314, win 65535, length 0
00:11:23.805042 IP 151.101.117.67.443 > 10.0.2.15.37894: Flags [P.], seq 385314:421532, ack 866, win 65535, length 36218
00:11:23.805474 IP 10.0.2.15.37894 > 151.101.117.67.443: Flags [.], ack 421532, win 65535, length 0
00:11:23.806463 IP 151.101.117.67.443 > 10.0.2.15.37894: Flags [P.], seq 421532:439394, ack 866, win 65535, length 17862
00:11:23.806491 IP 10.0.2.15.37894 > 151.101.117.67.443: Flags [.], ack 439394, win 65535, length 0
00:11:23.806552 IP 151.101.117.67.443 > 10.0.2.15.37894: Flags [P.], seq 439394:446264, ack 866, win 65535, length 6870
00:11:23.806559 IP 10.0.2.15.37894 > 151.101.117.67.443: Flags [.], ack 446264, win 65535, length 0
00:11:23.808230 IP 151.101.117.67.443 > 10.0.2.15.37894: Flags [P.], seq 446264:449012, ack 866, win 65535, length 2748
00:11:23.808235 IP 151.101.117.67.443 > 10.0.2.15.37894: Flags [P.], seq 449012:453134, ack 866, win 65535, length 4122
00:11:23.808236 IP 151.101.117.67.443 > 10.0.2.15.37894: Flags [P.], seq 453134:455882, ack 866, win 65535, length 2748
00:11:23.808237 IP 151.101.117.67.443 > 10.0.2.15.37894: Flags [P.], seq 455882:458630, ack 866, win 65535, length 2748
00:11:23.810490 IP 10.0.2.15.37894 > 151.101.117.67.443: Flags [.], ack 449012, win 65535, length 0
00:11:23.810641 IP 10.0.2.15.37894 > 151.101.117.67.443: Flags [.], ack 453134, win 65535, length 0
00:11:23.810669 IP 10.0.2.15.37894 > 151.101.117.67.443: Flags [.], ack 455882, win 65535, length 0
00:11:23.810685 IP 10.0.2.15.37894 > 151.101.117.67.443: Flags [.], ack 458630, win 65535, length 0
00:11:23.810729 IP 151.101.117.67.443 > 10.0.2.15.37894: Flags [P.], seq 458630:465500, ack 866, win 65535, length 6870
00:11:23.810733 IP 151.101.117.67.443 > 10.0.2.15.37894: Flags [P.], seq 465500:483362, ack 866, win 65535, length 17862
00:11:23.811313 IP 10.0.2.15.37894 > 151.101.117.67.443: Flags [.], ack 483362, win 65535, length 0
00:11:23.817682 IP 151.101.117.67.443 > 10.0.2.15.37894: Flags [P.], seq 483362:502598, ack 866, win 65535, length 19236
00:11:23.817730 IP 151.101.117.67.443 > 10.0.2.15.37894: Flags [P.], seq 502598:513590, ack 866, win 65535, length 10992
00:11:23.817743 IP 151.101.117.67.443 > 10.0.2.15.37894: Flags [P.], seq 513590:525956, ack 866, win 65535, length 12366
00:11:23.824419 IP 10.0.2.15.37894 > 151.101.117.67.443: Flags [.], ack 525956, win 65535, length 0
00:11:23.825839 IP 151.101.117.67.443 > 10.0.2.15.37894: Flags [.], seq 525956:590196, ack 866, win 65535, length 64240
00:11:23.826720 IP 10.0.2.15.37894 > 151.101.117.67.443: Flags [.], ack 590196, win 65535, length 0
00:11:23.828971 IP 151.101.117.67.443 > 10.0.2.15.37894: Flags [P.], seq 590196:591656, ack 866, win 65535, length 1460
00:11:23.829249 IP 151.101.117.67.443 > 10.0.2.15.37894: Flags [.], seq 591656:654436, ack 866, win 65535, length 62780
00:11:23.830628 IP 10.0.2.15.37894 > 151.101.117.67.443: Flags [.], ack 654436, win 65535, length 0
00:11:23.835280 IP 151.101.117.67.443 > 10.0.2.15.37894: Flags [P.], seq 654436:655896, ack 866, win 65535, length 1460
00:11:23.835296 IP 151.101.117.67.443 > 10.0.2.15.37894: Flags [.], seq 655896:718676, ack 866, win 65535, length 62780
00:11:23.835630 IP 10.0.2.15.37894 > 151.101.117.67.443: Flags [.], ack 718676, win 65535, length 0
00:11:23.835965 IP 151.101.117.67.443 > 10.0.2.15.37894: Flags [P.], seq 718676:720136, ack 866, win 65535, length 1460
00:11:23.837288 IP 151.101.117.67.443 > 10.0.2.15.37894: Flags [.], seq 720136:782916, ack 866, win 65535, length 62780
00:11:23.837311 IP 10.0.2.15.37894 > 151.101.117.67.443: Flags [.], ack 782916, win 65535, length 0
00:11:23.837671 IP 151.101.117.67.443 > 10.0.2.15.37894: Flags [P.], seq 782916:784376, ack 866, win 65535, length 1460
00:11:23.839056 IP 151.101.117.67.443 > 10.0.2.15.37894: Flags [P.], seq 784376:824114, ack 866, win 65535, length 39738
00:11:23.841519 IP 10.0.2.15.37894 > 151.101.117.67.443: Flags [.], ack 824114, win 65535, length 0
00:11:23.843064 IP 151.101.117.67.443 > 10.0.2.15.37894: Flags [P.], seq 824114:873578, ack 866, win 65535, length 49464
00:11:23.844314 IP 10.0.2.15.37894 > 151.101.117.67.443: Flags [.], ack 873578, win 65535, length 0
00:11:23.844934 IP 151.101.117.67.443 > 10.0.2.15.37894: Flags [P.], seq 873578:910676, ack 866, win 65535, length 37098
00:11:23.845310 IP 10.0.2.15.37894 > 151.101.117.67.443: Flags [.], ack 910676, win 65535, length 0
00:11:23.862896 IP 151.101.117.67.443 > 10.0.2.15.37894: Flags [P.], seq 910676:950522, ack 866, win 65535, length 39846
00:11:23.864216 IP 10.0.2.15.37894 > 151.101.117.67.443: Flags [.], ack 950522, win 65535, length 0

