13:04:45.997541 IP 151.101.117.67.443 > 10.0.2.15.50720: Flags [.], seq 14336002:14338922, ack 1621047567, win 65535, length 2920
13:04:45.997602 IP 10.0.2.15.50720 > 151.101.117.67.443: Flags [.], ack 2920, win 62780, length 0
13:04:45.998051 IP 151.101.117.67.443 > 10.0.2.15.50720: Flags [P.], seq 2920:5063, ack 1, win 65535, length 2143
13:04:45.998075 IP 10.0.2.15.50720 > 151.101.117.67.443: Flags [.], ack 5063, win 61320, length 0
13:04:45.999301 IP 10.0.2.15.50720 > 151.101.117.67.443: Flags [P.], seq 1:94, ack 5063, win 62780, length 93
13:04:45.999849 IP 151.101.117.67.443 > 10.0.2.15.50720: Flags [.], ack 94, win 65535, length 0
13:04:46.014984 IP 151.101.117.67.443 > 10.0.2.15.50720: Flags [P.], seq 5063:5114, ack 94, win 65535, length 51
13:04:46.015018 IP 10.0.2.15.50720 > 151.101.117.67.443: Flags [.], ack 5114, win 62780, length 0
13:04:46.015762 IP 10.0.2.15.50720 > 151.101.117.67.443: Flags [P.], seq 94:147, ack 5114, win 62780, length 53
13:04:46.015833 IP 10.0.2.15.50720 > 151.101.117.67.443: Flags [P.], seq 147:203, ack 5114, win 62780, length 56
13:04:46.016081 IP 10.0.2.15.50720 > 151.101.117.67.443: Flags [P.], seq 203:312, ack 5114, win 62780, length 109
13:04:46.016561 IP 151.101.117.67.443 > 10.0.2.15.50720: Flags [.], ack 147, win 65535, length 0
13:04:46.016565 IP 151.101.117.67.443 > 10.0.2.15.50720: Flags [.], ack 203, win 65535, length 0
13:04:46.016566 IP 151.101.117.67.443 > 10.0.2.15.50720: Flags [.], ack 312, win 65535, length 0
13:04:46.030391 IP 151.101.117.67.443 > 10.0.2.15.50720: Flags [P.], seq 5114:5209, ack 312, win 65535, length 95
13:04:46.030420 IP 10.0.2.15.50720 > 151.101.117.67.443: Flags [.], ack 5209, win 62780, length 0
13:04:46.030993 IP 10.0.2.15.50720 > 151.101.117.67.443: Flags [P.], seq 312:350, ack 5209, win 62780, length 38
13:04:46.031464 IP 151.101.117.67.443 > 10.0.2.15.50720: Flags [.], ack 350, win 65535, length 0
13:04:46.031999 IP 151.101.117.67.443 > 10.0.2.15.50720: Flags [P.], seq 5209:10705, ack 350, win 65535, length 5496
13:04:46.032134 IP 151.101.117.67.443 > 10.0.2.15.50720: Flags [P.], seq 10705:13453, ack 350, win 65535, length 2748
13:04:46.032150 IP 10.0.2.15.50720 > 151.101.117.67.443: Flags [.], ack 10705, win 58400, length 0
13:04:46.032179 IP 10.0.2.15.50720 > 151.101.117.67.443: Flags [.], ack 13453, win 58400, length 0
13:04:46.033441 IP 151.101.117.67.443 > 10.0.2.15.50720: Flags [P.], seq 13453:14827, ack 350, win 65535, length 1374
13:04:46.034225 IP 151.101.117.67.443 > 10.0.2.15.50720: Flags [P.], seq 14827:20323, ack 350, win 65535, length 5496
13:04:46.034242 IP 10.0.2.15.50720 > 151.101.117.67.443: Flags [.], ack 20323, win 61320, length 0
13:04:46.035187 IP 151.101.117.67.443 > 10.0.2.15.50720: Flags [P.], seq 20323:23071, ack 350, win 65535, length 2748
13:04:46.035202 IP 10.0.2.15.50720 > 151.101.117.67.443: Flags [.], ack 23071, win 62780, length 0
13:04:46.036321 IP 151.101.117.67.443 > 10.0.2.15.50720: Flags [P.], seq 23071:28567, ack 350, win 65535, length 5496
13:04:46.036390 IP 10.0.2.15.50720 > 151.101.117.67.443: Flags [.], ack 28567, win 61320, length 0
13:04:46.038101 IP 151.101.117.67.443 > 10.0.2.15.50720: Flags [P.], seq 28567:31315, ack 350, win 65535, length 2748
13:04:46.038121 IP 10.0.2.15.50720 > 151.101.117.67.443: Flags [.], ack 31315, win 62780, length 0
13:04:46.038856 IP 151.101.117.67.443 > 10.0.2.15.50720: Flags [P.], seq 31315:36811, ack 350, win 65535, length 5496
13:04:46.038981 IP 10.0.2.15.50720 > 151.101.117.67.443: Flags [.], ack 36811, win 61320, length 0
13:04:46.039855 IP 151.101.117.67.443 > 10.0.2.15.50720: Flags [P.], seq 36811:39559, ack 350, win 65535, length 2748
13:04:46.039868 IP 10.0.2.15.50720 > 151.101.117.67.443: Flags [.], ack 39559, win 62780, length 0
13:04:46.040859 IP 151.101.117.67.443 > 10.0.2.15.50720: Flags [P.], seq 39559:43681, ack 350, win 65535, length 4122
13:04:46.040916 IP 10.0.2.15.50720 > 151.101.117.67.443: Flags [.], ack 43681, win 61320, length 0
13:04:46.043084 IP 151.101.117.67.443 > 10.0.2.15.50720: Flags [P.], seq 43681:45055, ack 350, win 65535, length 1374
13:04:46.044091 IP 151.101.117.67.443 > 10.0.2.15.50720: Flags [P.], seq 45055:46429, ack 350, win 65535, length 1374
13:04:46.044106 IP 10.0.2.15.50720 > 151.101.117.67.443: Flags [.], ack 46429, win 63204, length 0
13:04:46.045675 IP 151.101.117.67.443 > 10.0.2.15.50720: Flags [P.], seq 46429:51925, ack 350, win 65535, length 5496
13:04:46.045744 IP 10.0.2.15.50720 > 151.101.117.67.443: Flags [.], ack 51925, win 61320, length 0
13:04:46.046329 IP 151.101.117.67.443 > 10.0.2.15.50720: Flags [P.], seq 51925:56047, ack 350, win 65535, length 4122
13:04:46.046351 IP 10.0.2.15.50720 > 151.101.117.67.443: Flags [.], ack 56047, win 61320, length 0
13:04:46.047652 IP 151.101.117.67.443 > 10.0.2.15.50720: Flags [P.], seq 56047:61543, ack 350, win 65535, length 5496
13:04:46.047670 IP 10.0.2.15.50720 > 151.101.117.67.443: Flags [.], ack 61543, win 61320, length 0
13:04:46.048686 IP 151.101.117.67.443 > 10.0.2.15.50720: Flags [P.], seq 61543:69787, ack 350, win 65535, length 8244
13:04:46.048938 IP 151.101.117.67.443 > 10.0.2.15.50720: Flags [P.], seq 69787:72535, ack 350, win 65535, length 2748
13:04:46.049012 IP 10.0.2.15.50720 > 151.101.117.67.443: Flags [.], ack 72535, win 62780, length 0
13:04:46.049819 IP 151.101.117.67.443 > 10.0.2.15.50720: Flags [P.], seq 72535:78031, ack 350, win 65535, length 5496
13:04:46.049833 IP 10.0.2.15.50720 > 151.101.117.67.443: Flags [.], ack 78031, win 65535, length 0
13:04:46.050829 IP 151.101.117.67.443 > 10.0.2.15.50720: Flags [P.], seq 78031:83527, ack 350, win 65535, length 5496
13:04:46.050846 IP 10.0.2.15.50720 > 151.101.117.67.443: Flags [.], ack 83527, win 65535, length 0
13:04:46.051024 IP 151.101.117.67.443 > 10.0.2.15.50720: Flags [P.], seq 83527:86275, ack 350, win 65535, length 2748
13:04:46.051033 IP 10.0.2.15.50720 > 151.101.117.67.443: Flags [.], ack 86275, win 65535, length 0
13:04:46.052106 IP 151.101.117.67.443 > 10.0.2.15.50720: Flags [P.], seq 86275:91771, ack 350, win 65535, length 5496
13:04:46.052108 IP 151.101.117.67.443 > 10.0.2.15.50720: Flags [P.], seq 91771:94519, ack 350, win 65535, length 2748
13:04:46.052125 IP 10.0.2.15.50720 > 151.101.117.67.443: Flags [.], ack 91771, win 65535, length 0
13:04:46.052150 IP 10.0.2.15.50720 > 151.101.117.67.443: Flags [.], ack 94519, win 65535, length 0
13:04:46.052304 IP 151.101.117.67.443 > 10.0.2.15.50720: Flags [P.], seq 94519:95893, ack 350, win 65535, length 1374
13:04:46.053137 IP 151.101.117.67.443 > 10.0.2.15.50720: Flags [P.], seq 95893:102763, ack 350, win 65535, length 6870
13:04:46.053154 IP 10.0.2.15.50720 > 151.101.117.67.443: Flags [.], ack 102763, win 65535, length 0
13:04:46.053298 IP 151.101.117.67.443 > 10.0.2.15.50720: Flags [P.], seq 102763:109633, ack 350, win 65535, length 6870
13:04:46.053310 IP 10.0.2.15.50720 > 151.101.117.67.443: Flags [.], ack 109633, win 65535, length 0
13:04:46.054244 IP 151.101.117.67.443 > 10.0.2.15.50720: Flags [P.], seq 109633:113755, ack 350, win 65535, length 4122
13:04:46.054246 IP 151.101.117.67.443 > 10.0.2.15.50720: Flags [P.], seq 113755:117877, ack 350, win 65535, length 4122
13:04:46.054263 IP 10.0.2.15.50720 > 151.101.117.67.443: Flags [.], ack 113755, win 65535, length 0
13:04:46.054288 IP 10.0.2.15.50720 > 151.101.117.67.443: Flags [.], ack 117877, win 65535, length 0
13:04:46.054375 IP 151.101.117.67.443 > 10.0.2.15.50720: Flags [P.], seq 117877:119251, ack 350, win 65535, length 1374
13:04:46.056356 IP 151.101.117.67.443 > 10.0.2.15.50720: Flags [P.], seq 119251:127495, ack 350, win 65535, length 8244
13:04:46.056372 IP 10.0.2.15.50720 > 151.101.117.67.443: Flags [.], ack 127495, win 65535, length 0
13:04:46.057626 IP 151.101.117.67.443 > 10.0.2.15.50720: Flags [P.], seq 127495:130243, ack 350, win 65535, length 2748
13:04:46.057642 IP 10.0.2.15.50720 > 151.101.117.67.443: Flags [.], ack 130243, win 65535, length 0
13:04:46.059044 IP 151.101.117.67.443 > 10.0.2.15.50720: Flags [P.], seq 130243:131617, ack 350, win 65535, length 1374
13:04:46.059237 IP 151.101.117.67.443 > 10.0.2.15.50720: Flags [.], seq 131617:134537, ack 350, win 65535, length 2920
13:04:46.059254 IP 10.0.2.15.50720 > 151.101.117.67.443: Flags [.], ack 134537, win 65535, length 0
13:04:46.059451 IP 151.101.117.67.443 > 10.0.2.15.50720: Flags [P.], seq 134537:137113, ack 350, win 65535, length 2576
13:04:46.059462 IP 10.0.2.15.50720 > 151.101.117.67.443: Flags [.], ack 137113, win 65535, length 0
13:04:46.059569 IP 151.101.117.67.443 > 10.0.2.15.50720: Flags [P.], seq 137113:145357, ack 350, win 65535, length 8244
13:04:46.059575 IP 10.0.2.15.50720 > 151.101.117.67.443: Flags [.], ack 145357, win 65535, length 0
13:04:46.060673 IP 151.101.117.67.443 > 10.0.2.15.50720: Flags [P.], seq 145357:152227, ack 350, win 65535, length 6870
13:04:46.060689 IP 10.0.2.15.50720 > 151.101.117.67.443: Flags [.], ack 152227, win 65535, length 0
13:04:46.061206 IP 151.101.117.67.443 > 10.0.2.15.50720: Flags [P.], seq 152227:156349, ack 350, win 65535, length 4122
13:04:46.061218 IP 10.0.2.15.50720 > 151.101.117.67.443: Flags [.], ack 156349, win 65535, length 0
13:04:46.062094 IP 151.101.117.67.443 > 10.0.2.15.50720: Flags [P.], seq 156349:157723, ack 350, win 65535, length 1374
13:04:46.062458 IP 151.101.117.67.443 > 10.0.2.15.50720: Flags [P.], seq 157723:161845, ack 350, win 65535, length 4122
13:04:46.062478 IP 10.0.2.15.50720 > 151.101.117.67.443: Flags [.], ack 161845, win 65535, length 0
13:04:46.062741 IP 151.101.117.67.443 > 10.0.2.15.50720: Flags [P.], seq 161845:168715, ack 350, win 65535, length 6870
13:04:46.062804 IP 10.0.2.15.50720 > 151.101.117.67.443: Flags [.], ack 168715, win 65535, length 0
13:04:46.062965 IP 151.101.117.67.443 > 10.0.2.15.50720: Flags [P.], seq 168715:174211, ack 350, win 65535, length 5496
13:04:46.062973 IP 10.0.2.15.50720 > 151.101.117.67.443: Flags [.], ack 174211, win 65535, length 0
13:04:46.063181 IP 151.101.117.67.443 > 10.0.2.15.50720: Flags [P.], seq 174211:181081, ack 350, win 65535, length 6870
13:04:46.063209 IP 10.0.2.15.50720 > 151.101.117.67.443: Flags [.], ack 181081, win 65535, length 0
13:04:46.063472 IP 151.101.117.67.443 > 10.0.2.15.50720: Flags [P.], seq 181081:182455, ack 350, win 65535, length 1374
13:04:46.064459 IP 151.101.117.67.443 > 10.0.2.15.50720: Flags [P.], seq 182455:187951, ack 350, win 65535, length 5496
13:04:46.064478 IP 10.0.2.15.50720 > 151.101.117.67.443: Flags [.], ack 187951, win 65535, length 0
13:04:46.065164 IP 151.101.117.67.443 > 10.0.2.15.50720: Flags [P.], seq 187951:193447, ack 350, win 65535, length 5496
13:04:46.065168 IP 151.101.117.67.443 > 10.0.2.15.50720: Flags [P.], seq 193447:201691, ack 350, win 65535, length 8244
13:04:46.065184 IP 10.0.2.15.50720 > 151.101.117.67.443: Flags [.], ack 193447, win 65535, length 0
13:04:46.065206 IP 10.0.2.15.50720 > 151.101.117.67.443: Flags [.], ack 201691, win 65535, length 0
13:04:46.065232 IP 151.101.117.67.443 > 10.0.2.15.50720: Flags [P.], seq 201691:203065, ack 350, win 65535, length 1374
13:04:46.065904 IP 151.101.117.67.443 > 10.0.2.15.50720: Flags [P.], seq 203065:209935, ack 350, win 65535, length 6870
13:04:46.065920 IP 10.0.2.15.50720 > 151.101.117.67.443: Flags [.], ack 209935, win 65535, length 0
13:04:46.067019 IP 151.101.117.67.443 > 10.0.2.15.50720: Flags [P.], seq 209935:216805, ack 350, win 65535, length 6870
13:04:46.067034 IP 10.0.2.15.50720 > 151.101.117.67.443: Flags [.], ack 216805, win 65535, length 0
13:04:46.067228 IP 151.101.117.67.443 > 10.0.2.15.50720: Flags [P.], seq 216805:223675, ack 350, win 65535, length 6870
13:04:46.067240 IP 10.0.2.15.50720 > 151.101.117.67.443: Flags [.], ack 223675, win 65535, length 0
13:04:46.067318 IP 151.101.117.67.443 > 10.0.2.15.50720: Flags [P.], seq 223675:226423, ack 350, win 65535, length 2748
13:04:46.067323 IP 10.0.2.15.50720 > 151.101.117.67.443: Flags [.], ack 226423, win 65535, length 0
13:04:46.069603 IP 151.101.117.67.443 > 10.0.2.15.50720: Flags [P.], seq 226423:236041, ack 350, win 65535, length 9618
13:04:46.069618 IP 10.0.2.15.50720 > 151.101.117.67.443: Flags [.], ack 236041, win 65535, length 0
13:04:46.069765 IP 151.101.117.67.443 > 10.0.2.15.50720: Flags [P.], seq 236041:237415, ack 350, win 65535, length 1374
13:04:46.070179 IP 151.101.117.67.443 > 10.0.2.15.50720: Flags [P.], seq 237415:244285, ack 350, win 65535, length 6870
13:04:46.070187 IP 151.101.117.67.443 > 10.0.2.15.50720: Flags [P.], seq 244285:247033, ack 350, win 65535, length 2748
13:04:46.070203 IP 10.0.2.15.50720 > 151.101.117.67.443: Flags [.], ack 244285, win 65535, length 0
13:04:46.070220 IP 10.0.2.15.50720 > 151.101.117.67.443: Flags [.], ack 247033, win 65535, length 0
13:04:46.070422 IP 151.101.117.67.443 > 10.0.2.15.50720: Flags [P.], seq 247033:251155, ack 350, win 65535, length 4122
13:04:46.070431 IP 10.0.2.15.50720 > 151.101.117.67.443: Flags [.], ack 251155, win 65535, length 0
13:04:46.070788 IP 151.101.117.67.443 > 10.0.2.15.50720: Flags [.], seq 251155:255535, ack 350, win 65535, length 4380
13:04:46.070800 IP 10.0.2.15.50720 > 151.101.117.67.443: Flags [.], ack 255535, win 65535, length 0
13:04:46.071377 IP 151.101.117.67.443 > 10.0.2.15.50720: Flags [P.], seq 255535:256651, ack 350, win 65535, length 1116
13:04:46.071379 IP 151.101.117.67.443 > 10.0.2.15.50720: Flags [P.], seq 256651:262147, ack 350, win 65535, length 5496
13:04:46.071380 IP 151.101.117.67.443 > 10.0.2.15.50720: Flags [P.], seq 262147:267643, ack 350, win 65535, length 5496
13:04:46.071398 IP 10.0.2.15.50720 > 151.101.117.67.443: Flags [.], ack 262147, win 65535, length 0
13:04:46.071415 IP 10.0.2.15.50720 > 151.101.117.67.443: Flags [.], ack 267643, win 65535, length 0
13:04:46.071476 IP 151.101.117.67.443 > 10.0.2.15.50720: Flags [P.], seq 267643:271765, ack 350, win 65535, length 4122
13:04:46.071483 IP 10.0.2.15.50720 > 151.101.117.67.443: Flags [.], ack 271765, win 65535, length 0
13:04:46.071594 IP 151.101.117.67.443 > 10.0.2.15.50720: Flags [P.], seq 271765:274513, ack 350, win 65535, length 2748
13:04:46.071600 IP 10.0.2.15.50720 > 151.101.117.67.443: Flags [.], ack 274513, win 65535, length 0
13:04:46.073160 IP 151.101.117.67.443 > 10.0.2.15.50720: Flags [P.], seq 274513:285505, ack 350, win 65535, length 10992
13:04:46.073178 IP 10.0.2.15.50720 > 151.101.117.67.443: Flags [.], ack 285505, win 65535, length 0
13:04:46.073340 IP 151.101.117.67.443 > 10.0.2.15.50720: Flags [P.], seq 285505:291001, ack 350, win 65535, length 5496
13:04:46.073353 IP 10.0.2.15.50720 > 151.101.117.67.443: Flags [.], ack 291001, win 65535, length 0
13:04:46.073626 IP 151.101.117.67.443 > 10.0.2.15.50720: Flags [P.], seq 291001:295123, ack 350, win 65535, length 4122
13:04:46.073636 IP 10.0.2.15.50720 > 151.101.117.67.443: Flags [.], ack 295123, win 65535, length 0
13:04:46.074339 IP 151.101.117.67.443 > 10.0.2.15.50720: Flags [P.], seq 295123:301993, ack 350, win 65535, length 6870
13:04:46.074342 IP 151.101.117.67.443 > 10.0.2.15.50720: Flags [.], seq 301993:307833, ack 350, win 65535, length 5840
13:04:46.074448 IP 10.0.2.15.50720 > 151.101.117.67.443: Flags [.], ack 301993, win 65535, length 0
13:04:46.074472 IP 10.0.2.15.50720 > 151.101.117.67.443: Flags [.], ack 307833, win 65535, length 0
13:04:46.074630 IP 151.101.117.67.443 > 10.0.2.15.50720: Flags [P.], seq 307833:308863, ack 350, win 65535, length 1030
13:04:46.074632 IP 151.101.117.67.443 > 10.0.2.15.50720: Flags [P.], seq 308863:314359, ack 350, win 65535, length 5496
13:04:46.074705 IP 10.0.2.15.50720 > 151.101.117.67.443: Flags [.], ack 314359, win 65535, length 0
13:04:46.074854 IP 151.101.117.67.443 > 10.0.2.15.50720: Flags [P.], seq 314359:318481, ack 350, win 65535, length 4122
13:04:46.074863 IP 10.0.2.15.50720 > 151.101.117.67.443: Flags [.], ack 318481, win 65535, length 0
13:04:46.074973 IP 151.101.117.67.443 > 10.0.2.15.50720: Flags [P.], seq 318481:321229, ack 350, win 65535, length 2748
13:04:46.074978 IP 10.0.2.15.50720 > 151.101.117.67.443: Flags [.], ack 321229, win 65535, length 0
13:04:46.075707 IP 151.101.117.67.443 > 10.0.2.15.50720: Flags [P.], seq 321229:326725, ack 350, win 65535, length 5496
13:04:46.075723 IP 10.0.2.15.50720 > 151.101.117.67.443: Flags [.], ack 326725, win 65535, length 0
13:04:46.075946 IP 151.101.117.67.443 > 10.0.2.15.50720: Flags [P.], seq 326725:329473, ack 350, win 65535, length 2748
13:04:46.075968 IP 10.0.2.15.50720 > 151.101.117.67.443: Flags [.], ack 329473, win 65535, length 0
13:04:46.076191 IP 151.101.117.67.443 > 10.0.2.15.50720: Flags [P.], seq 329473:336343, ack 350, win 65535, length 6870
13:04:46.076203 IP 10.0.2.15.50720 > 151.101.117.67.443: Flags [.], ack 336343, win 65535, length 0
13:04:46.076314 IP 151.101.117.67.443 > 10.0.2.15.50720: Flags [P.], seq 336343:339091, ack 350, win 65535, length 2748
13:04:46.076321 IP 10.0.2.15.50720 > 151.101.117.67.443: Flags [.], ack 339091, win 65535, length 0
13:04:46.077249 IP 151.101.117.67.443 > 10.0.2.15.50720: Flags [P.], seq 339091:345961, ack 350, win 65535, length 6870
13:04:46.077265 IP 10.0.2.15.50720 > 151.101.117.67.443: Flags [.], ack 345961, win 65535, length 0
13:04:46.077648 IP 151.101.117.67.443 > 10.0.2.15.50720: Flags [P.], seq 345961:352831, ack 350, win 65535, length 6870
13:04:46.077651 IP 151.101.117.67.443 > 10.0.2.15.50720: Flags [P.], seq 352831:358327, ack 350, win 65535, length 5496
13:04:46.077743 IP 10.0.2.15.50720 > 151.101.117.67.443: Flags [.], ack 352831, win 65535, length 0
13:04:46.077871 IP 10.0.2.15.50720 > 151.101.117.67.443: Flags [.], ack 358327, win 65535, length 0
13:04:46.077992 IP 151.101.117.67.443 > 10.0.2.15.50720: Flags [P.], seq 358327:362449, ack 350, win 65535, length 4122
13:04:46.077993 IP 151.101.117.67.443 > 10.0.2.15.50720: Flags [P.], seq 362449:365197, ack 350, win 65535, length 2748
13:04:46.078004 IP 10.0.2.15.50720 > 151.101.117.67.443: Flags [.], ack 362449, win 65535, length 0
13:04:46.078069 IP 10.0.2.15.50720 > 151.101.117.67.443: Flags [.], ack 365197, win 65535, length 0
13:04:46.078269 IP 151.101.117.67.443 > 10.0.2.15.50720: Flags [P.], seq 365197:372067, ack 350, win 65535, length 6870
13:04:46.078280 IP 10.0.2.15.50720 > 151.101.117.67.443: Flags [.], ack 372067, win 65535, length 0
13:04:46.078509 IP 151.101.117.67.443 > 10.0.2.15.50720: Flags [P.], seq 372067:374815, ack 350, win 65535, length 2748
13:04:46.078518 IP 10.0.2.15.50720 > 151.101.117.67.443: Flags [.], ack 374815, win 65535, length 0
13:04:46.079075 IP 151.101.117.67.443 > 10.0.2.15.50720: Flags [P.], seq 374815:380311, ack 350, win 65535, length 5496
13:04:46.079087 IP 10.0.2.15.50720 > 151.101.117.67.443: Flags [.], ack 380311, win 65535, length 0
13:04:46.079226 IP 151.101.117.67.443 > 10.0.2.15.50720: Flags [P.], seq 380311:385807, ack 350, win 65535, length 5496
13:04:46.079234 IP 10.0.2.15.50720 > 151.101.117.67.443: Flags [.], ack 385807, win 65535, length 0
13:04:46.080290 IP 151.101.117.67.443 > 10.0.2.15.50720: Flags [P.], seq 385807:394051, ack 350, win 65535, length 8244
13:04:46.080348 IP 151.101.117.67.443 > 10.0.2.15.50720: Flags [P.], seq 394051:399547, ack 350, win 65535, length 5496
13:04:46.080366 IP 10.0.2.15.50720 > 151.101.117.67.443: Flags [.], ack 394051, win 65535, length 0
13:04:46.080443 IP 10.0.2.15.50720 > 151.101.117.67.443: Flags [.], ack 399547, win 65535, length 0
13:04:46.080942 IP 151.101.117.67.443 > 10.0.2.15.50720: Flags [P.], seq 399547:406417, ack 350, win 65535, length 6870
13:04:46.080945 IP 151.101.117.67.443 > 10.0.2.15.50720: Flags [P.], seq 406417:411913, ack 350, win 65535, length 5496
13:04:46.080961 IP 10.0.2.15.50720 > 151.101.117.67.443: Flags [.], ack 406417, win 65535, length 0
13:04:46.080997 IP 10.0.2.15.50720 > 151.101.117.67.443: Flags [.], ack 411913, win 65535, length 0
13:04:46.081222 IP 151.101.117.67.443 > 10.0.2.15.50720: Flags [P.], seq 411913:420157, ack 350, win 65535, length 8244
13:04:46.081229 IP 10.0.2.15.50720 > 151.101.117.67.443: Flags [.], ack 420157, win 65535, length 0
13:04:46.081518 IP 151.101.117.67.443 > 10.0.2.15.50720: Flags [P.], seq 420157:425653, ack 350, win 65535, length 5496
13:04:46.081526 IP 10.0.2.15.50720 > 151.101.117.67.443: Flags [.], ack 425653, win 65535, length 0
13:04:46.082478 IP 151.101.117.67.443 > 10.0.2.15.50720: Flags [P.], seq 425653:433897, ack 350, win 65535, length 8244
13:04:46.082498 IP 10.0.2.15.50720 > 151.101.117.67.443: Flags [.], ack 433897, win 65535, length 0
13:04:46.082780 IP 151.101.117.67.443 > 10.0.2.15.50720: Flags [P.], seq 433897:435271, ack 350, win 65535, length 1374
13:04:46.084244 IP 151.101.117.67.443 > 10.0.2.15.50720: Flags [P.], seq 435271:439393, ack 350, win 65535, length 4122
13:04:46.084269 IP 10.0.2.15.50720 > 151.101.117.67.443: Flags [.], ack 439393, win 65535, length 0
13:04:46.084580 IP 151.101.117.67.443 > 10.0.2.15.50720: Flags [P.], seq 439393:447637, ack 350, win 65535, length 8244
13:04:46.084582 IP 151.101.117.67.443 > 10.0.2.15.50720: Flags [P.], seq 447637:450385, ack 350, win 65535, length 2748
13:04:46.084596 IP 10.0.2.15.50720 > 151.101.117.67.443: Flags [.], ack 447637, win 65535, length 0
13:04:46.084616 IP 10.0.2.15.50720 > 151.101.117.67.443: Flags [.], ack 450385, win 65535, length 0
13:04:46.084858 IP 151.101.117.67.443 > 10.0.2.15.50720: Flags [P.], seq 450385:455881, ack 350, win 65535, length 5496
13:04:46.084871 IP 10.0.2.15.50720 > 151.101.117.67.443: Flags [.], ack 455881, win 65535, length 0
13:04:46.085052 IP 151.101.117.67.443 > 10.0.2.15.50720: Flags [P.], seq 455881:460003, ack 350, win 65535, length 4122
13:04:46.085061 IP 10.0.2.15.50720 > 151.101.117.67.443: Flags [.], ack 460003, win 65535, length 0
13:04:46.085334 IP 151.101.117.67.443 > 10.0.2.15.50720: Flags [P.], seq 460003:462751, ack 350, win 65535, length 2748
13:04:46.085346 IP 10.0.2.15.50720 > 151.101.117.67.443: Flags [.], ack 462751, win 65535, length 0
13:04:46.087053 IP 151.101.117.67.443 > 10.0.2.15.50720: Flags [P.], seq 462751:469621, ack 350, win 65535, length 6870
13:04:46.087056 IP 151.101.117.67.443 > 10.0.2.15.50720: Flags [P.], seq 469621:477865, ack 350, win 65535, length 8244
13:04:46.087075 IP 10.0.2.15.50720 > 151.101.117.67.443: Flags [.], ack 469621, win 65535, length 0
13:04:46.087149 IP 10.0.2.15.50720 > 151.101.117.67.443: Flags [.], ack 477865, win 65535, length 0
13:04:46.087360 IP 151.101.117.67.443 > 10.0.2.15.50720: Flags [P.], seq 477865:481987, ack 350, win 65535, length 4122
13:04:46.087369 IP 10.0.2.15.50720 > 151.101.117.67.443: Flags [.], ack 481987, win 65535, length 0
13:04:46.088705 IP 151.101.117.67.443 > 10.0.2.15.50720: Flags [P.], seq 481987:487483, ack 350, win 65535, length 5496
13:04:46.088716 IP 151.101.117.67.443 > 10.0.2.15.50720: Flags [P.], seq 487483:492979, ack 350, win 65535, length 5496
13:04:46.088734 IP 10.0.2.15.50720 > 151.101.117.67.443: Flags [.], ack 487483, win 65535, length 0
13:04:46.088824 IP 10.0.2.15.50720 > 151.101.117.67.443: Flags [.], ack 492979, win 65535, length 0
13:04:46.088868 IP 151.101.117.67.443 > 10.0.2.15.50720: Flags [P.], seq 492979:498475, ack 350, win 65535, length 5496
13:04:46.088939 IP 10.0.2.15.50720 > 151.101.117.67.443: Flags [.], ack 498475, win 65535, length 0
13:04:46.089187 IP 151.101.117.67.443 > 10.0.2.15.50720: Flags [P.], seq 498475:501223, ack 350, win 65535, length 2748
13:04:46.089197 IP 10.0.2.15.50720 > 151.101.117.67.443: Flags [.], ack 501223, win 65535, length 0
13:04:46.089431 IP 151.101.117.67.443 > 10.0.2.15.50720: Flags [P.], seq 501223:506719, ack 350, win 65535, length 5496
13:04:46.089445 IP 10.0.2.15.50720 > 151.101.117.67.443: Flags [.], ack 506719, win 65535, length 0
13:04:46.089534 IP 151.101.117.67.443 > 10.0.2.15.50720: Flags [P.], seq 506719:509467, ack 350, win 65535, length 2748
13:04:46.089542 IP 10.0.2.15.50720 > 151.101.117.67.443: Flags [.], ack 509467, win 65535, length 0
13:04:46.090686 IP 151.101.117.67.443 > 10.0.2.15.50720: Flags [P.], seq 509467:517711, ack 350, win 65535, length 8244
13:04:46.090708 IP 10.0.2.15.50720 > 151.101.117.67.443: Flags [.], ack 517711, win 65535, length 0
13:04:46.091726 IP 151.101.117.67.443 > 10.0.2.15.50720: Flags [P.], seq 517711:521833, ack 350, win 65535, length 4122
13:04:46.091731 IP 151.101.117.67.443 > 10.0.2.15.50720: Flags [.], seq 521833:530593, ack 350, win 65535, length 8760
13:04:46.091804 IP 10.0.2.15.50720 > 151.101.117.67.443: Flags [.], ack 521833, win 65535, length 0
13:04:46.091833 IP 10.0.2.15.50720 > 151.101.117.67.443: Flags [.], ack 530593, win 65535, length 0
13:04:46.092474 IP 151.101.117.67.443 > 10.0.2.15.50720: Flags [P.], seq 530593:534199, ack 350, win 65535, length 3606
13:04:46.092476 IP 151.101.117.67.443 > 10.0.2.15.50720: Flags [P.], seq 534199:541069, ack 350, win 65535, length 6870
13:04:46.092495 IP 10.0.2.15.50720 > 151.101.117.67.443: Flags [.], ack 534199, win 65535, length 0
13:04:46.092515 IP 10.0.2.15.50720 > 151.101.117.67.443: Flags [.], ack 541069, win 65535, length 0
13:04:46.092549 IP 151.101.117.67.443 > 10.0.2.15.50720: Flags [P.], seq 541069:543817, ack 350, win 65535, length 2748
13:04:46.092550 IP 151.101.117.67.443 > 10.0.2.15.50720: Flags [P.], seq 543817:546565, ack 350, win 65535, length 2748
13:04:46.092604 IP 151.101.117.67.443 > 10.0.2.15.50720: Flags [P.], seq 546565:553435, ack 350, win 65535, length 6870
13:04:46.092639 IP 10.0.2.15.50720 > 151.101.117.67.443: Flags [.], ack 543817, win 65535, length 0
13:04:46.092655 IP 10.0.2.15.50720 > 151.101.117.67.443: Flags [.], ack 546565, win 65535, length 0
13:04:46.092666 IP 10.0.2.15.50720 > 151.101.117.67.443: Flags [.], ack 553435, win 65535, length 0
13:04:46.092682 IP 151.101.117.67.443 > 10.0.2.15.50720: Flags [P.], seq 553435:560305, ack 350, win 65535, length 6870
13:04:46.092727 IP 10.0.2.15.50720 > 151.101.117.67.443: Flags [.], ack 560305, win 65535, length 0
13:04:46.093272 IP 151.101.117.67.443 > 10.0.2.15.50720: Flags [P.], seq 560305:563053, ack 350, win 65535, length 2748
13:04:46.093274 IP 151.101.117.67.443 > 10.0.2.15.50720: Flags [P.], seq 563053:569923, ack 350, win 65535, length 6870
13:04:46.093275 IP 151.101.117.67.443 > 10.0.2.15.50720: Flags [P.], seq 569923:574045, ack 350, win 65535, length 4122
13:04:46.093362 IP 10.0.2.15.50720 > 151.101.117.67.443: Flags [.], ack 563053, win 65535, length 0
13:04:46.093453 IP 10.0.2.15.50720 > 151.101.117.67.443: Flags [.], ack 569923, win 65535, length 0
13:04:46.094157 IP 10.0.2.15.50720 > 151.101.117.67.443: Flags [.], ack 574045, win 65535, length 0
13:04:46.094235 IP 151.101.117.67.443 > 10.0.2.15.50720: Flags [P.], seq 574045:579541, ack 350, win 65535, length 5496
13:04:46.094264 IP 151.101.117.67.443 > 10.0.2.15.50720: Flags [P.], seq 579541:582289, ack 350, win 65535, length 2748
13:04:46.094266 IP 151.101.117.67.443 > 10.0.2.15.50720: Flags [P.], seq 582289:587785, ack 350, win 65535, length 5496
13:04:46.094288 IP 10.0.2.15.50720 > 151.101.117.67.443: Flags [.], ack 579541, win 65535, length 0
13:04:46.094314 IP 10.0.2.15.50720 > 151.101.117.67.443: Flags [.], ack 582289, win 65535, length 0
13:04:46.094340 IP 151.101.117.67.443 > 10.0.2.15.50720: Flags [P.], seq 587785:590533, ack 350, win 65535, length 2748
13:04:46.094341 IP 151.101.117.67.443 > 10.0.2.15.50720: Flags [P.], seq 590533:596029, ack 350, win 65535, length 5496
13:04:46.094512 IP 151.101.117.67.443 > 10.0.2.15.50720: Flags [.], seq 596029:600409, ack 350, win 65535, length 4380
13:04:46.095108 IP 151.101.117.67.443 > 10.0.2.15.50720: Flags [P.], seq 600409:601525, ack 350, win 65535, length 1116
13:04:46.095466 IP 151.101.117.67.443 > 10.0.2.15.50720: Flags [P.], seq 601525:608395, ack 350, win 65535, length 6870
13:04:46.095666 IP 151.101.117.67.443 > 10.0.2.15.50720: Flags [P.], seq 608395:615265, ack 350, win 65535, length 6870
13:04:46.095792 IP 10.0.2.15.50720 > 151.101.117.67.443: Flags [.], ack 615265, win 65535, length 0
13:04:46.096160 IP 151.101.117.67.443 > 10.0.2.15.50720: Flags [P.], seq 615265:622135, ack 350, win 65535, length 6870
13:04:46.096184 IP 10.0.2.15.50720 > 151.101.117.67.443: Flags [.], ack 622135, win 65535, length 0
13:04:46.096440 IP 151.101.117.67.443 > 10.0.2.15.50720: Flags [P.], seq 622135:633127, ack 350, win 65535, length 10992
13:04:46.096538 IP 10.0.2.15.50720 > 151.101.117.67.443: Flags [.], ack 633127, win 65535, length 0
13:04:46.096719 IP 151.101.117.67.443 > 10.0.2.15.50720: Flags [P.], seq 633127:639997, ack 350, win 65535, length 6870
13:04:46.096728 IP 10.0.2.15.50720 > 151.101.117.67.443: Flags [.], ack 639997, win 65535, length 0
13:04:46.096969 IP 151.101.117.67.443 > 10.0.2.15.50720: Flags [P.], seq 639997:641371, ack 350, win 65535, length 1374
13:04:46.097725 IP 151.101.117.67.443 > 10.0.2.15.50720: Flags [P.], seq 641371:652363, ack 350, win 65535, length 10992
13:04:46.097805 IP 151.101.117.67.443 > 10.0.2.15.50720: Flags [P.], seq 652363:653737, ack 350, win 65535, length 1374
13:04:46.098041 IP 10.0.2.15.50720 > 151.101.117.67.443: Flags [.], ack 653737, win 65535, length 0
13:04:46.098077 IP 151.101.117.67.443 > 10.0.2.15.50720: Flags [P.], seq 653737:661981, ack 350, win 65535, length 8244
13:04:46.098163 IP 10.0.2.15.50720 > 151.101.117.67.443: Flags [.], ack 661981, win 65535, length 0
13:04:46.098695 IP 151.101.117.67.443 > 10.0.2.15.50720: Flags [P.], seq 661981:667477, ack 350, win 65535, length 5496
13:04:46.098698 IP 151.101.117.67.443 > 10.0.2.15.50720: Flags [P.], seq 667477:672973, ack 350, win 65535, length 5496
13:04:46.098891 IP 151.101.117.67.443 > 10.0.2.15.50720: Flags [.], seq 672973:677353, ack 350, win 65535, length 4380
13:04:46.099101 IP 151.101.117.67.443 > 10.0.2.15.50720: Flags [P.], seq 677353:678469, ack 350, win 65535, length 1116
13:04:46.099103 IP 151.101.117.67.443 > 10.0.2.15.50720: Flags [P.], seq 678469:681217, ack 350, win 65535, length 2748
13:04:46.099133 IP 10.0.2.15.50720 > 151.101.117.67.443: Flags [.], ack 677353, win 65535, length 0
13:04:46.099153 IP 10.0.2.15.50720 > 151.101.117.67.443: Flags [.], ack 681217, win 65535, length 0
13:04:46.100135 IP 151.101.117.67.443 > 10.0.2.15.50720: Flags [P.], seq 681217:685339, ack 350, win 65535, length 4122
13:04:46.100138 IP 151.101.117.67.443 > 10.0.2.15.50720: Flags [P.], seq 685339:693583, ack 350, win 65535, length 8244
13:04:46.100156 IP 10.0.2.15.50720 > 151.101.117.67.443: Flags [.], ack 685339, win 65535, length 0
13:04:46.100198 IP 10.0.2.15.50720 > 151.101.117.67.443: Flags [.], ack 693583, win 65535, length 0
13:04:46.105336 IP 151.101.117.67.443 > 10.0.2.15.50720: Flags [.], seq 693583:757823, ack 350, win 65535, length 64240
13:04:46.106044 IP 10.0.2.15.50720 > 151.101.117.67.443: Flags [.], ack 757823, win 65535, length 0
13:04:46.106313 IP 151.101.117.67.443 > 10.0.2.15.50720: Flags [P.], seq 757823:759283, ack 350, win 65535, length 1460
13:04:46.106663 IP 151.101.117.67.443 > 10.0.2.15.50720: Flags [.], seq 759283:770963, ack 350, win 65535, length 11680
13:04:46.107193 IP 151.101.117.67.443 > 10.0.2.15.50720: Flags [P.], seq 770963:814495, ack 350, win 65535, length 43532
13:04:46.107781 IP 10.0.2.15.50720 > 151.101.117.67.443: Flags [.], ack 814495, win 65535, length 0
13:04:46.108811 IP 151.101.117.67.443 > 10.0.2.15.50720: Flags [P.], seq 814495:852967, ack 350, win 65535, length 38472
13:04:46.108990 IP 10.0.2.15.50720 > 151.101.117.67.443: Flags [.], ack 852967, win 65535, length 0
13:04:46.109495 IP 151.101.117.67.443 > 10.0.2.15.50720: Flags [P.], seq 852967:869455, ack 350, win 65535, length 16488
13:04:46.109507 IP 10.0.2.15.50720 > 151.101.117.67.443: Flags [.], ack 869455, win 65535, length 0
13:04:46.114619 IP 151.101.117.67.443 > 10.0.2.15.50720: Flags [P.], seq 869455:877699, ack 350, win 65535, length 8244
13:04:46.114625 IP 151.101.117.67.443 > 10.0.2.15.50720: Flags [P.], seq 877699:883195, ack 350, win 65535, length 5496
13:04:46.114814 IP 10.0.2.15.50720 > 151.101.117.67.443: Flags [.], ack 877699, win 65535, length 0
13:04:46.115245 IP 151.101.117.67.443 > 10.0.2.15.50720: Flags [P.], seq 883195:885943, ack 350, win 65535, length 2748
13:04:46.115251 IP 151.101.117.67.443 > 10.0.2.15.50720: Flags [P.], seq 885943:891439, ack 350, win 65535, length 5496
13:04:46.115422 IP 151.101.117.67.443 > 10.0.2.15.50720: Flags [P.], seq 891439:896935, ack 350, win 65535, length 5496
13:04:46.115426 IP 151.101.117.67.443 > 10.0.2.15.50720: Flags [P.], seq 896935:903805, ack 350, win 65535, length 6870
13:04:46.115519 IP 10.0.2.15.50720 > 151.101.117.67.443: Flags [.], ack 903805, win 65535, length 0
13:04:46.115674 IP 151.101.117.67.443 > 10.0.2.15.50720: Flags [P.], seq 903805:907927, ack 350, win 65535, length 4122
13:04:46.115724 IP 10.0.2.15.50720 > 151.101.117.67.443: Flags [.], ack 907927, win 65535, length 0
13:04:46.116069 IP 151.101.117.67.443 > 10.0.2.15.50720: Flags [P.], seq 907927:910675, ack 350, win 65535, length 2748
13:04:46.116072 IP 151.101.117.67.443 > 10.0.2.15.50720: Flags [P.], seq 910675:917545, ack 350, win 65535, length 6870
13:04:46.116084 IP 10.0.2.15.50720 > 151.101.117.67.443: Flags [.], ack 910675, win 65535, length 0
13:04:46.116214 IP 151.101.117.67.443 > 10.0.2.15.50720: Flags [P.], seq 917545:920293, ack 350, win 65535, length 2748
13:04:46.116249 IP 10.0.2.15.50720 > 151.101.117.67.443: Flags [.], ack 920293, win 65535, length 0
13:04:46.116480 IP 151.101.117.67.443 > 10.0.2.15.50720: Flags [P.], seq 920293:923041, ack 350, win 65535, length 2748
13:04:46.116490 IP 10.0.2.15.50720 > 151.101.117.67.443: Flags [.], ack 923041, win 65535, length 0
13:04:46.116977 IP 151.101.117.67.443 > 10.0.2.15.50720: Flags [P.], seq 923041:928537, ack 350, win 65535, length 5496
13:04:46.116979 IP 151.101.117.67.443 > 10.0.2.15.50720: Flags [P.], seq 928537:935407, ack 350, win 65535, length 6870
13:04:46.117031 IP 10.0.2.15.50720 > 151.101.117.67.443: Flags [.], ack 935407, win 65535, length 0
13:04:46.117424 IP 151.101.117.67.443 > 10.0.2.15.50720: Flags [P.], seq 935407:942277, ack 350, win 65535, length 6870
13:04:46.117426 IP 151.101.117.67.443 > 10.0.2.15.50720: Flags [P.], seq 942277:945025, ack 350, win 65535, length 2748
13:04:46.117735 IP 151.101.117.67.443 > 10.0.2.15.50720: Flags [P.], seq 945025:949147, ack 350, win 65535, length 4122
13:04:46.117736 IP 151.101.117.67.443 > 10.0.2.15.50720: Flags [.], seq 949147:950607, ack 350, win 65535, length 1460
13:04:46.117861 IP 10.0.2.15.50720 > 151.101.117.67.443: Flags [.], ack 950607, win 65535, length 0

