13:19:50.396934 IP 151.101.117.67.443 > 10.0.2.15.50974: Flags [.], seq 68096002:68098922, ack 1228404989, win 65535, length 2920
13:19:50.396958 IP 10.0.2.15.50974 > 151.101.117.67.443: Flags [.], ack 2920, win 62780, length 0
13:19:50.397598 IP 151.101.117.67.443 > 10.0.2.15.50974: Flags [P.], seq 2920:4122, ack 1, win 65535, length 1202
13:19:50.397615 IP 10.0.2.15.50974 > 151.101.117.67.443: Flags [.], ack 4122, win 62780, length 0
13:19:50.398123 IP 151.101.117.67.443 > 10.0.2.15.50974: Flags [P.], seq 4122:5063, ack 1, win 65535, length 941
13:19:50.398143 IP 10.0.2.15.50974 > 151.101.117.67.443: Flags [.], ack 5063, win 62780, length 0
13:19:50.400520 IP 10.0.2.15.50974 > 151.101.117.67.443: Flags [P.], seq 1:94, ack 5063, win 62780, length 93
13:19:50.400966 IP 151.101.117.67.443 > 10.0.2.15.50974: Flags [.], ack 94, win 65535, length 0
13:19:50.416209 IP 151.101.117.67.443 > 10.0.2.15.50974: Flags [P.], seq 5063:5114, ack 94, win 65535, length 51
13:19:50.416230 IP 10.0.2.15.50974 > 151.101.117.67.443: Flags [.], ack 5114, win 62780, length 0
13:19:50.416815 IP 10.0.2.15.50974 > 151.101.117.67.443: Flags [P.], seq 94:147, ack 5114, win 62780, length 53
13:19:50.416858 IP 10.0.2.15.50974 > 151.101.117.67.443: Flags [P.], seq 147:203, ack 5114, win 62780, length 56
13:19:50.417086 IP 10.0.2.15.50974 > 151.101.117.67.443: Flags [P.], seq 203:245, ack 5114, win 62780, length 42
13:19:50.417117 IP 10.0.2.15.50974 > 151.101.117.67.443: Flags [P.], seq 245:312, ack 5114, win 62780, length 67
13:19:50.417570 IP 151.101.117.67.443 > 10.0.2.15.50974: Flags [.], ack 147, win 65535, length 0
13:19:50.417572 IP 151.101.117.67.443 > 10.0.2.15.50974: Flags [.], ack 203, win 65535, length 0
13:19:50.417573 IP 151.101.117.67.443 > 10.0.2.15.50974: Flags [.], ack 245, win 65535, length 0
13:19:50.417574 IP 151.101.117.67.443 > 10.0.2.15.50974: Flags [.], ack 312, win 65535, length 0
13:19:50.431335 IP 151.101.117.67.443 > 10.0.2.15.50974: Flags [P.], seq 5114:5180, ack 312, win 65535, length 66
13:19:50.431360 IP 10.0.2.15.50974 > 151.101.117.67.443: Flags [.], ack 5180, win 62780, length 0
13:19:50.431654 IP 10.0.2.15.50974 > 151.101.117.67.443: Flags [P.], seq 312:350, ack 5180, win 62780, length 38
13:19:50.432676 IP 151.101.117.67.443 > 10.0.2.15.50974: Flags [P.], seq 5180:6554, ack 312, win 65535, length 1374
13:19:50.432679 IP 151.101.117.67.443 > 10.0.2.15.50974: Flags [.], ack 350, win 65535, length 0
13:19:50.433145 IP 151.101.117.67.443 > 10.0.2.15.50974: Flags [.], seq 6554:15314, ack 350, win 65535, length 8760
13:19:50.433192 IP 10.0.2.15.50974 > 151.101.117.67.443: Flags [.], ack 15314, win 58400, length 0
13:19:50.433510 IP 151.101.117.67.443 > 10.0.2.15.50974: Flags [P.], seq 15314:16172, ack 350, win 65535, length 858
13:19:50.435377 IP 151.101.117.67.443 > 10.0.2.15.50974: Flags [P.], seq 16172:20294, ack 350, win 65535, length 4122
13:19:50.435398 IP 10.0.2.15.50974 > 151.101.117.67.443: Flags [.], ack 20294, win 61320, length 0
13:19:50.436372 IP 151.101.117.67.443 > 10.0.2.15.50974: Flags [P.], seq 20294:31286, ack 350, win 65535, length 10992
13:19:50.436512 IP 10.0.2.15.50974 > 151.101.117.67.443: Flags [.], ack 31286, win 56940, length 0
13:19:50.437053 IP 151.101.117.67.443 > 10.0.2.15.50974: Flags [P.], seq 31286:32660, ack 350, win 65535, length 1374
13:19:50.437827 IP 151.101.117.67.443 > 10.0.2.15.50974: Flags [P.], seq 32660:36782, ack 350, win 65535, length 4122
13:19:50.437844 IP 10.0.2.15.50974 > 151.101.117.67.443: Flags [.], ack 36782, win 61320, length 0
13:19:50.438439 IP 151.101.117.67.443 > 10.0.2.15.50974: Flags [P.], seq 36782:40904, ack 350, win 65535, length 4122
13:19:50.438452 IP 10.0.2.15.50974 > 151.101.117.67.443: Flags [.], ack 40904, win 61320, length 0
13:19:50.439391 IP 151.101.117.67.443 > 10.0.2.15.50974: Flags [P.], seq 40904:46400, ack 350, win 65535, length 5496
13:19:50.439404 IP 10.0.2.15.50974 > 151.101.117.67.443: Flags [.], ack 46400, win 61320, length 0
13:19:50.440515 IP 151.101.117.67.443 > 10.0.2.15.50974: Flags [P.], seq 46400:50522, ack 350, win 65535, length 4122
13:19:50.440531 IP 10.0.2.15.50974 > 151.101.117.67.443: Flags [.], ack 50522, win 61320, length 0
13:19:50.441711 IP 151.101.117.67.443 > 10.0.2.15.50974: Flags [P.], seq 50522:51896, ack 350, win 65535, length 1374
13:19:50.443794 IP 151.101.117.67.443 > 10.0.2.15.50974: Flags [P.], seq 51896:53270, ack 350, win 65535, length 1374
13:19:50.443810 IP 10.0.2.15.50974 > 151.101.117.67.443: Flags [.], ack 53270, win 63204, length 0
13:19:50.444745 IP 151.101.117.67.443 > 10.0.2.15.50974: Flags [P.], seq 53270:54644, ack 350, win 65535, length 1374
13:19:50.450356 IP 151.101.117.67.443 > 10.0.2.15.50974: Flags [.], seq 54644:75084, ack 350, win 65535, length 20440
13:19:50.450537 IP 10.0.2.15.50974 > 151.101.117.67.443: Flags [.], ack 75084, win 63204, length 0
13:19:50.450780 IP 151.101.117.67.443 > 10.0.2.15.50974: Flags [P.], seq 75084:76628, ack 350, win 65535, length 1544
13:19:50.450792 IP 10.0.2.15.50974 > 151.101.117.67.443: Flags [.], ack 76628, win 65535, length 0
13:19:50.451799 IP 151.101.117.67.443 > 10.0.2.15.50974: Flags [P.], seq 76628:84872, ack 350, win 65535, length 8244
13:19:50.451819 IP 10.0.2.15.50974 > 151.101.117.67.443: Flags [.], ack 84872, win 65535, length 0
13:19:50.453200 IP 151.101.117.67.443 > 10.0.2.15.50974: Flags [P.], seq 84872:93116, ack 350, win 65535, length 8244
13:19:50.453257 IP 10.0.2.15.50974 > 151.101.117.67.443: Flags [.], ack 93116, win 65535, length 0
13:19:50.454135 IP 151.101.117.67.443 > 10.0.2.15.50974: Flags [P.], seq 93116:97238, ack 350, win 65535, length 4122
13:19:50.454153 IP 10.0.2.15.50974 > 151.101.117.67.443: Flags [.], ack 97238, win 65535, length 0
13:19:50.455261 IP 151.101.117.67.443 > 10.0.2.15.50974: Flags [P.], seq 97238:106856, ack 350, win 65535, length 9618
13:19:50.455276 IP 10.0.2.15.50974 > 151.101.117.67.443: Flags [.], ack 106856, win 65535, length 0
13:19:50.456379 IP 151.101.117.67.443 > 10.0.2.15.50974: Flags [P.], seq 106856:113726, ack 350, win 65535, length 6870
13:19:50.456394 IP 10.0.2.15.50974 > 151.101.117.67.443: Flags [.], ack 113726, win 65535, length 0
13:19:50.457304 IP 151.101.117.67.443 > 10.0.2.15.50974: Flags [P.], seq 113726:119222, ack 350, win 65535, length 5496
13:19:50.457319 IP 10.0.2.15.50974 > 151.101.117.67.443: Flags [.], ack 119222, win 65535, length 0
13:19:50.458993 IP 151.101.117.67.443 > 10.0.2.15.50974: Flags [P.], seq 119222:126092, ack 350, win 65535, length 6870
13:19:50.459017 IP 10.0.2.15.50974 > 151.101.117.67.443: Flags [.], ack 126092, win 65535, length 0
13:19:50.459723 IP 151.101.117.67.443 > 10.0.2.15.50974: Flags [P.], seq 126092:128840, ack 350, win 65535, length 2748
13:19:50.459747 IP 10.0.2.15.50974 > 151.101.117.67.443: Flags [.], ack 128840, win 65535, length 0
13:19:50.460862 IP 151.101.117.67.443 > 10.0.2.15.50974: Flags [P.], seq 128840:135710, ack 350, win 65535, length 6870
13:19:50.460880 IP 10.0.2.15.50974 > 151.101.117.67.443: Flags [.], ack 135710, win 65535, length 0
13:19:50.462779 IP 151.101.117.67.443 > 10.0.2.15.50974: Flags [P.], seq 135710:143954, ack 350, win 65535, length 8244
13:19:50.462805 IP 10.0.2.15.50974 > 151.101.117.67.443: Flags [.], ack 143954, win 65535, length 0
13:19:50.464200 IP 151.101.117.67.443 > 10.0.2.15.50974: Flags [P.], seq 143954:154946, ack 350, win 65535, length 10992
13:19:50.464224 IP 10.0.2.15.50974 > 151.101.117.67.443: Flags [.], ack 154946, win 65535, length 0
13:19:50.466370 IP 151.101.117.67.443 > 10.0.2.15.50974: Flags [P.], seq 154946:181052, ack 350, win 65535, length 26106
13:19:50.466388 IP 10.0.2.15.50974 > 151.101.117.67.443: Flags [.], ack 181052, win 65535, length 0
13:19:50.467170 IP 151.101.117.67.443 > 10.0.2.15.50974: Flags [P.], seq 181052:192044, ack 350, win 65535, length 10992
13:19:50.467187 IP 10.0.2.15.50974 > 151.101.117.67.443: Flags [.], ack 192044, win 65535, length 0
13:19:50.467554 IP 151.101.117.67.443 > 10.0.2.15.50974: Flags [P.], seq 192044:193418, ack 350, win 65535, length 1374
13:19:50.469363 IP 151.101.117.67.443 > 10.0.2.15.50974: Flags [P.], seq 193418:207158, ack 350, win 65535, length 13740
13:19:50.469380 IP 10.0.2.15.50974 > 151.101.117.67.443: Flags [.], ack 207158, win 65535, length 0
13:19:50.470982 IP 151.101.117.67.443 > 10.0.2.15.50974: Flags [P.], seq 207158:229142, ack 350, win 65535, length 21984
13:19:50.471010 IP 10.0.2.15.50974 > 151.101.117.67.443: Flags [.], ack 229142, win 65535, length 0
13:19:50.472143 IP 151.101.117.67.443 > 10.0.2.15.50974: Flags [P.], seq 229142:238760, ack 350, win 65535, length 9618
13:19:50.472159 IP 10.0.2.15.50974 > 151.101.117.67.443: Flags [.], ack 238760, win 65535, length 0
13:19:50.474578 IP 151.101.117.67.443 > 10.0.2.15.50974: Flags [P.], seq 238760:268988, ack 350, win 65535, length 30228
13:19:50.474603 IP 10.0.2.15.50974 > 151.101.117.67.443: Flags [.], ack 268988, win 65535, length 0
13:19:50.474720 IP 151.101.117.67.443 > 10.0.2.15.50974: Flags [P.], seq 268988:273110, ack 350, win 65535, length 4122
13:19:50.474729 IP 10.0.2.15.50974 > 151.101.117.67.443: Flags [.], ack 273110, win 65535, length 0
13:19:50.475779 IP 151.101.117.67.443 > 10.0.2.15.50974: Flags [.], seq 273110:278950, ack 350, win 65535, length 5840
13:19:50.475806 IP 10.0.2.15.50974 > 151.101.117.67.443: Flags [.], ack 278950, win 65535, length 0
13:19:50.475986 IP 151.101.117.67.443 > 10.0.2.15.50974: Flags [P.], seq 278950:284102, ack 350, win 65535, length 5152
13:19:50.475989 IP 151.101.117.67.443 > 10.0.2.15.50974: Flags [P.], seq 284102:286850, ack 350, win 65535, length 2748
13:19:50.476004 IP 10.0.2.15.50974 > 151.101.117.67.443: Flags [.], ack 284102, win 65535, length 0
13:19:50.476021 IP 10.0.2.15.50974 > 151.101.117.67.443: Flags [.], ack 286850, win 65535, length 0
13:19:50.477215 IP 151.101.117.67.443 > 10.0.2.15.50974: Flags [P.], seq 286850:303338, ack 350, win 65535, length 16488
13:19:50.477245 IP 10.0.2.15.50974 > 151.101.117.67.443: Flags [.], ack 303338, win 65535, length 0
13:19:50.477655 IP 151.101.117.67.443 > 10.0.2.15.50974: Flags [P.], seq 303338:304712, ack 350, win 65535, length 1374
13:19:50.478366 IP 151.101.117.67.443 > 10.0.2.15.50974: Flags [P.], seq 304712:314330, ack 350, win 65535, length 9618
13:19:50.478574 IP 10.0.2.15.50974 > 151.101.117.67.443: Flags [.], ack 314330, win 65535, length 0
13:19:50.479076 IP 151.101.117.67.443 > 10.0.2.15.50974: Flags [P.], seq 314330:328070, ack 350, win 65535, length 13740
13:19:50.479130 IP 10.0.2.15.50974 > 151.101.117.67.443: Flags [.], ack 328070, win 65535, length 0
13:19:50.479730 IP 151.101.117.67.443 > 10.0.2.15.50974: Flags [.], seq 328070:333910, ack 350, win 65535, length 5840
13:19:50.479754 IP 10.0.2.15.50974 > 151.101.117.67.443: Flags [.], ack 333910, win 65535, length 0
13:19:50.480017 IP 151.101.117.67.443 > 10.0.2.15.50974: Flags [P.], seq 333910:337688, ack 350, win 65535, length 3778
13:19:50.480119 IP 10.0.2.15.50974 > 151.101.117.67.443: Flags [.], ack 337688, win 65535, length 0
13:19:50.481152 IP 151.101.117.67.443 > 10.0.2.15.50974: Flags [P.], seq 337688:348680, ack 350, win 65535, length 10992
13:19:50.481174 IP 10.0.2.15.50974 > 151.101.117.67.443: Flags [.], ack 348680, win 65535, length 0
13:19:50.482318 IP 151.101.117.67.443 > 10.0.2.15.50974: Flags [.], seq 348680:350140, ack 350, win 65535, length 1460
13:19:50.484066 IP 151.101.117.67.443 > 10.0.2.15.50974: Flags [P.], seq 350140:365168, ack 350, win 65535, length 15028
13:19:50.484088 IP 10.0.2.15.50974 > 151.101.117.67.443: Flags [.], ack 365168, win 65535, length 0
13:19:50.484144 IP 151.101.117.67.443 > 10.0.2.15.50974: Flags [P.], seq 365168:373412, ack 350, win 65535, length 8244
13:19:50.484146 IP 151.101.117.67.443 > 10.0.2.15.50974: Flags [P.], seq 373412:384404, ack 350, win 65535, length 10992
13:19:50.484157 IP 10.0.2.15.50974 > 151.101.117.67.443: Flags [.], ack 373412, win 65535, length 0
13:19:50.484244 IP 10.0.2.15.50974 > 151.101.117.67.443: Flags [.], ack 384404, win 65535, length 0
13:19:50.485163 IP 151.101.117.67.443 > 10.0.2.15.50974: Flags [P.], seq 384404:405014, ack 350, win 65535, length 20610
13:19:50.485176 IP 10.0.2.15.50974 > 151.101.117.67.443: Flags [.], ack 405014, win 65535, length 0
13:19:50.486256 IP 151.101.117.67.443 > 10.0.2.15.50974: Flags [P.], seq 405014:416006, ack 350, win 65535, length 10992
13:19:50.486273 IP 10.0.2.15.50974 > 151.101.117.67.443: Flags [.], ack 416006, win 65535, length 0
13:19:50.486829 IP 151.101.117.67.443 > 10.0.2.15.50974: Flags [P.], seq 416006:424250, ack 350, win 65535, length 8244
13:19:50.486843 IP 10.0.2.15.50974 > 151.101.117.67.443: Flags [.], ack 424250, win 65535, length 0
13:19:50.487738 IP 151.101.117.67.443 > 10.0.2.15.50974: Flags [P.], seq 424250:437990, ack 350, win 65535, length 13740
13:19:50.487754 IP 10.0.2.15.50974 > 151.101.117.67.443: Flags [.], ack 437990, win 65535, length 0
13:19:50.488092 IP 151.101.117.67.443 > 10.0.2.15.50974: Flags [P.], seq 437990:446234, ack 350, win 65535, length 8244
13:19:50.488103 IP 10.0.2.15.50974 > 151.101.117.67.443: Flags [.], ack 446234, win 65535, length 0
13:19:50.488512 IP 151.101.117.67.443 > 10.0.2.15.50974: Flags [P.], seq 446234:447608, ack 350, win 65535, length 1374
13:19:50.489735 IP 151.101.117.67.443 > 10.0.2.15.50974: Flags [P.], seq 447608:457226, ack 350, win 65535, length 9618
13:19:50.489761 IP 10.0.2.15.50974 > 151.101.117.67.443: Flags [.], ack 457226, win 65535, length 0
13:19:50.490159 IP 151.101.117.67.443 > 10.0.2.15.50974: Flags [P.], seq 457226:464096, ack 350, win 65535, length 6870
13:19:50.490172 IP 10.0.2.15.50974 > 151.101.117.67.443: Flags [.], ack 464096, win 65535, length 0
13:19:50.490590 IP 151.101.117.67.443 > 10.0.2.15.50974: Flags [P.], seq 464096:470966, ack 350, win 65535, length 6870
13:19:50.490615 IP 10.0.2.15.50974 > 151.101.117.67.443: Flags [.], ack 470966, win 65535, length 0
13:19:50.491495 IP 151.101.117.67.443 > 10.0.2.15.50974: Flags [P.], seq 470966:481958, ack 350, win 65535, length 10992
13:19:50.491513 IP 10.0.2.15.50974 > 151.101.117.67.443: Flags [.], ack 481958, win 65535, length 0
13:19:50.492102 IP 151.101.117.67.443 > 10.0.2.15.50974: Flags [P.], seq 481958:491576, ack 350, win 65535, length 9618
13:19:50.492115 IP 10.0.2.15.50974 > 151.101.117.67.443: Flags [.], ack 491576, win 65535, length 0
13:19:50.493031 IP 151.101.117.67.443 > 10.0.2.15.50974: Flags [P.], seq 491576:506690, ack 350, win 65535, length 15114
13:19:50.493046 IP 10.0.2.15.50974 > 151.101.117.67.443: Flags [.], ack 506690, win 65535, length 0
13:19:50.493083 IP 151.101.117.67.443 > 10.0.2.15.50974: Flags [P.], seq 506690:510812, ack 350, win 65535, length 4122
13:19:50.493088 IP 10.0.2.15.50974 > 151.101.117.67.443: Flags [.], ack 510812, win 65535, length 0
13:19:50.494002 IP 151.101.117.67.443 > 10.0.2.15.50974: Flags [P.], seq 510812:516308, ack 350, win 65535, length 5496
13:19:50.494021 IP 10.0.2.15.50974 > 151.101.117.67.443: Flags [.], ack 516308, win 65535, length 0
13:19:50.494391 IP 151.101.117.67.443 > 10.0.2.15.50974: Flags [P.], seq 516308:527300, ack 350, win 65535, length 10992
13:19:50.494404 IP 10.0.2.15.50974 > 151.101.117.67.443: Flags [.], ack 527300, win 65535, length 0
13:19:50.494815 IP 151.101.117.67.443 > 10.0.2.15.50974: Flags [P.], seq 527300:538292, ack 350, win 65535, length 10992
13:19:50.494829 IP 10.0.2.15.50974 > 151.101.117.67.443: Flags [.], ack 538292, win 65535, length 0
13:19:50.496375 IP 151.101.117.67.443 > 10.0.2.15.50974: Flags [P.], seq 538292:556154, ack 350, win 65535, length 17862
13:19:50.496394 IP 10.0.2.15.50974 > 151.101.117.67.443: Flags [.], ack 556154, win 65535, length 0
13:19:50.497028 IP 151.101.117.67.443 > 10.0.2.15.50974: Flags [P.], seq 556154:567146, ack 350, win 65535, length 10992
13:19:50.497146 IP 10.0.2.15.50974 > 151.101.117.67.443: Flags [.], ack 567146, win 65535, length 0
13:19:50.497247 IP 151.101.117.67.443 > 10.0.2.15.50974: Flags [P.], seq 567146:575390, ack 350, win 65535, length 8244
13:19:50.497260 IP 10.0.2.15.50974 > 151.101.117.67.443: Flags [.], ack 575390, win 65535, length 0
13:19:50.497600 IP 151.101.117.67.443 > 10.0.2.15.50974: Flags [P.], seq 575390:583634, ack 350, win 65535, length 8244
13:19:50.497648 IP 10.0.2.15.50974 > 151.101.117.67.443: Flags [.], ack 583634, win 65535, length 0
13:19:50.497874 IP 151.101.117.67.443 > 10.0.2.15.50974: Flags [P.], seq 583634:596000, ack 350, win 65535, length 12366
13:19:50.497885 IP 10.0.2.15.50974 > 151.101.117.67.443: Flags [.], ack 596000, win 65535, length 0
13:19:50.498547 IP 151.101.117.67.443 > 10.0.2.15.50974: Flags [P.], seq 596000:604244, ack 350, win 65535, length 8244
13:19:50.498599 IP 10.0.2.15.50974 > 151.101.117.67.443: Flags [.], ack 604244, win 65535, length 0
13:19:50.498828 IP 151.101.117.67.443 > 10.0.2.15.50974: Flags [P.], seq 604244:613862, ack 350, win 65535, length 9618
13:19:50.498840 IP 10.0.2.15.50974 > 151.101.117.67.443: Flags [.], ack 613862, win 65535, length 0
13:19:50.499299 IP 151.101.117.67.443 > 10.0.2.15.50974: Flags [P.], seq 613862:623480, ack 350, win 65535, length 9618
13:19:50.499312 IP 10.0.2.15.50974 > 151.101.117.67.443: Flags [.], ack 623480, win 65535, length 0
13:19:50.499688 IP 151.101.117.67.443 > 10.0.2.15.50974: Flags [P.], seq 623480:626228, ack 350, win 65535, length 2748
13:19:50.499701 IP 10.0.2.15.50974 > 151.101.117.67.443: Flags [.], ack 626228, win 65535, length 0
13:19:50.500105 IP 151.101.117.67.443 > 10.0.2.15.50974: Flags [.], seq 626228:633528, ack 350, win 65535, length 7300
13:19:50.500116 IP 10.0.2.15.50974 > 151.101.117.67.443: Flags [.], ack 633528, win 65535, length 0
13:19:50.500436 IP 151.101.117.67.443 > 10.0.2.15.50974: Flags [P.], seq 633528:634472, ack 350, win 65535, length 944
13:19:50.507167 IP 151.101.117.67.443 > 10.0.2.15.50974: Flags [P.], seq 634472:698712, ack 350, win 65535, length 64240
13:19:50.507188 IP 10.0.2.15.50974 > 151.101.117.67.443: Flags [.], ack 698712, win 65535, length 0
13:19:50.508225 IP 151.101.117.67.443 > 10.0.2.15.50974: Flags [P.], seq 698712:751262, ack 350, win 65535, length 52550
13:19:50.508241 IP 10.0.2.15.50974 > 151.101.117.67.443: Flags [.], ack 751262, win 65535, length 0
13:19:50.509371 IP 151.101.117.67.443 > 10.0.2.15.50974: Flags [P.], seq 751262:778742, ack 350, win 65535, length 27480
13:19:50.509393 IP 10.0.2.15.50974 > 151.101.117.67.443: Flags [.], ack 778742, win 65535, length 0
13:19:50.509432 IP 151.101.117.67.443 > 10.0.2.15.50974: Flags [.], seq 778742:783122, ack 350, win 65535, length 4380
13:19:50.509565 IP 151.101.117.67.443 > 10.0.2.15.50974: Flags [P.], seq 783122:788360, ack 350, win 65535, length 5238
13:19:50.509591 IP 10.0.2.15.50974 > 151.101.117.67.443: Flags [.], ack 783122, win 65535, length 0
13:19:50.509730 IP 10.0.2.15.50974 > 151.101.117.67.443: Flags [.], ack 788360, win 65535, length 0
13:19:50.510399 IP 151.101.117.67.443 > 10.0.2.15.50974: Flags [P.], seq 788360:804848, ack 350, win 65535, length 16488
13:19:50.510413 IP 10.0.2.15.50974 > 151.101.117.67.443: Flags [.], ack 804848, win 65535, length 0
13:19:50.510671 IP 151.101.117.67.443 > 10.0.2.15.50974: Flags [P.], seq 804848:810344, ack 350, win 65535, length 5496
13:19:50.510762 IP 10.0.2.15.50974 > 151.101.117.67.443: Flags [.], ack 810344, win 65535, length 0
13:19:50.512195 IP 151.101.117.67.443 > 10.0.2.15.50974: Flags [P.], seq 810344:821336, ack 350, win 65535, length 10992
13:19:50.512214 IP 10.0.2.15.50974 > 151.101.117.67.443: Flags [.], ack 821336, win 65535, length 0
13:19:50.512497 IP 151.101.117.67.443 > 10.0.2.15.50974: Flags [P.], seq 821336:836450, ack 350, win 65535, length 15114
13:19:50.512555 IP 10.0.2.15.50974 > 151.101.117.67.443: Flags [.], ack 836450, win 65535, length 0
13:19:50.513005 IP 151.101.117.67.443 > 10.0.2.15.50974: Flags [P.], seq 836450:847442, ack 350, win 65535, length 10992
13:19:50.513019 IP 10.0.2.15.50974 > 151.101.117.67.443: Flags [.], ack 847442, win 65535, length 0
13:19:50.513524 IP 151.101.117.67.443 > 10.0.2.15.50974: Flags [P.], seq 847442:857060, ack 350, win 65535, length 9618
13:19:50.513586 IP 10.0.2.15.50974 > 151.101.117.67.443: Flags [.], ack 857060, win 65535, length 0
13:19:50.513882 IP 151.101.117.67.443 > 10.0.2.15.50974: Flags [P.], seq 857060:866678, ack 350, win 65535, length 9618
13:19:50.513893 IP 10.0.2.15.50974 > 151.101.117.67.443: Flags [.], ack 866678, win 65535, length 0
13:19:50.514415 IP 151.101.117.67.443 > 10.0.2.15.50974: Flags [P.], seq 866678:880418, ack 350, win 65535, length 13740
13:19:50.514717 IP 10.0.2.15.50974 > 151.101.117.67.443: Flags [.], ack 880418, win 65535, length 0
13:19:50.515366 IP 151.101.117.67.443 > 10.0.2.15.50974: Flags [P.], seq 880418:891410, ack 350, win 65535, length 10992
13:19:50.515404 IP 151.101.117.67.443 > 10.0.2.15.50974: Flags [P.], seq 891410:898280, ack 350, win 65535, length 6870
13:19:50.515447 IP 10.0.2.15.50974 > 151.101.117.67.443: Flags [.], ack 898280, win 65535, length 0
13:19:50.516239 IP 151.101.117.67.443 > 10.0.2.15.50974: Flags [P.], seq 898280:901028, ack 350, win 65535, length 2748
13:19:50.516256 IP 10.0.2.15.50974 > 151.101.117.67.443: Flags [.], ack 901028, win 65535, length 0
13:19:50.521052 IP 151.101.117.67.443 > 10.0.2.15.50974: Flags [.], seq 901028:965268, ack 350, win 65535, length 64240
13:19:50.521623 IP 10.0.2.15.50974 > 151.101.117.67.443: Flags [.], ack 965268, win 65535, length 0
13:19:50.521941 IP 151.101.117.67.443 > 10.0.2.15.50974: Flags [P.], seq 965268:966728, ack 350, win 65535, length 1460
13:19:50.522508 IP 151.101.117.67.443 > 10.0.2.15.50974: Flags [P.], seq 966728:988964, ack 350, win 65535, length 22236
13:19:50.522560 IP 10.0.2.15.50974 > 151.101.117.67.443: Flags [.], ack 988964, win 65535, length 0
13:19:50.526435 IP 151.101.117.67.443 > 10.0.2.15.50974: Flags [.], seq 988964:1053204, ack 350, win 65535, length 64240
13:19:50.526774 IP 10.0.2.15.50974 > 151.101.117.67.443: Flags [.], ack 1053204, win 65535, length 0
13:19:50.526972 IP 151.101.117.67.443 > 10.0.2.15.50974: Flags [P.], seq 1053204:1054664, ack 350, win 65535, length 1460
13:19:50.527670 IP 151.101.117.67.443 > 10.0.2.15.50974: Flags [.], seq 1054664:1083864, ack 350, win 65535, length 29200
13:19:50.527689 IP 10.0.2.15.50974 > 151.101.117.67.443: Flags [.], ack 1083864, win 65535, length 0
13:19:50.528003 IP 151.101.117.67.443 > 10.0.2.15.50974: Flags [P.], seq 1083864:1107128, ack 350, win 65535, length 23264
13:19:50.528069 IP 10.0.2.15.50974 > 151.101.117.67.443: Flags [.], ack 1107128, win 65535, length 0
13:19:50.528383 IP 151.101.117.67.443 > 10.0.2.15.50974: Flags [.], seq 1107128:1117348, ack 350, win 65535, length 10220
13:19:50.528393 IP 10.0.2.15.50974 > 151.101.117.67.443: Flags [.], ack 1117348, win 65535, length 0
13:19:50.528890 IP 151.101.117.67.443 > 10.0.2.15.50974: Flags [P.], seq 1117348:1126364, ack 350, win 65535, length 9016
13:19:50.528895 IP 151.101.117.67.443 > 10.0.2.15.50974: Flags [.], seq 1126364:1135124, ack 350, win 65535, length 8760
13:19:50.529087 IP 151.101.117.67.443 > 10.0.2.15.50974: Flags [P.], seq 1135124:1140104, ack 350, win 65535, length 4980
13:19:50.529257 IP 10.0.2.15.50974 > 151.101.117.67.443: Flags [.], ack 1140104, win 65535, length 0
13:19:50.529362 IP 151.101.117.67.443 > 10.0.2.15.50974: Flags [P.], seq 1140104:1149722, ack 350, win 65535, length 9618
13:19:50.529438 IP 10.0.2.15.50974 > 151.101.117.67.443: Flags [.], ack 1149722, win 65535, length 0

