19:31:40.599196 IP 10.0.2.15.56036 > 140.233.253.2.53: 13946+ A? www.cnn.com. (29)
19:31:40.599230 IP 10.0.2.15.56036 > 140.233.253.2.53: 20863+ AAAA? www.cnn.com. (29)
19:31:40.605524 IP 140.233.253.2.53 > 10.0.2.15.56036: 13946 2/0/0 CNAME turner-tls.map.fastly.net., A 151.101.117.67 (84)
19:31:40.605526 IP 140.233.253.2.53 > 10.0.2.15.56036: 20863 2/0/0 CNAME turner-tls.map.fastly.net., AAAA 2a04:4e42:1c::323 (96)
19:31:40.605952 IP 10.0.2.15.38078 > 151.101.117.67.443: Flags [S], seq 2565752786, win 64240, options [mss 1460,sackOK,TS val 1396819579 ecr 0,nop,wscale 6], length 0
19:31:40.621019 IP 151.101.117.67.443 > 10.0.2.15.38078: Flags [S.], seq 171520001, ack 2565752787, win 65535, options [mss 1460], length 0
19:31:40.621094 IP 10.0.2.15.38078 > 151.101.117.67.443: Flags [.], ack 1, win 64240, length 0
19:31:40.628617 IP 10.0.2.15.38078 > 151.101.117.67.443: Flags [P.], seq 1:518, ack 1, win 64240, length 517
19:31:40.629253 IP 151.101.117.67.443 > 10.0.2.15.38078: Flags [.], ack 518, win 65535, length 0
19:31:40.647729 IP 151.101.117.67.443 > 10.0.2.15.38078: Flags [.], seq 1:2921, ack 518, win 65535, length 2920
19:31:40.647749 IP 10.0.2.15.38078 > 151.101.117.67.443: Flags [.], ack 2921, win 62780, length 0
19:31:40.647960 IP 151.101.117.67.443 > 10.0.2.15.38078: Flags [P.], seq 2921:5064, ack 518, win 65535, length 2143
19:31:40.647972 IP 10.0.2.15.38078 > 151.101.117.67.443: Flags [.], ack 5064, win 61320, length 0
19:31:40.649151 IP 10.0.2.15.38078 > 151.101.117.67.443: Flags [P.], seq 518:611, ack 5064, win 62780, length 93
19:31:40.649518 IP 151.101.117.67.443 > 10.0.2.15.38078: Flags [.], ack 611, win 65535, length 0
19:31:40.663096 IP 151.101.117.67.443 > 10.0.2.15.38078: Flags [P.], seq 5064:5115, ack 611, win 65535, length 51
19:31:40.663118 IP 10.0.2.15.38078 > 151.101.117.67.443: Flags [.], ack 5115, win 62780, length 0
19:31:40.663699 IP 10.0.2.15.38078 > 151.101.117.67.443: Flags [P.], seq 611:664, ack 5115, win 62780, length 53
19:31:40.663737 IP 10.0.2.15.38078 > 151.101.117.67.443: Flags [P.], seq 664:720, ack 5115, win 62780, length 56
19:31:40.664171 IP 151.101.117.67.443 > 10.0.2.15.38078: Flags [.], ack 664, win 65535, length 0
19:31:40.664172 IP 151.101.117.67.443 > 10.0.2.15.38078: Flags [.], ack 720, win 65535, length 0
19:31:40.664209 IP 10.0.2.15.38078 > 151.101.117.67.443: Flags [P.], seq 720:829, ack 5115, win 62780, length 109
19:31:40.664818 IP 151.101.117.67.443 > 10.0.2.15.38078: Flags [.], ack 829, win 65535, length 0
19:31:40.677131 IP 151.101.117.67.443 > 10.0.2.15.38078: Flags [P.], seq 5115:5210, ack 829, win 65535, length 95
19:31:40.677149 IP 10.0.2.15.38078 > 151.101.117.67.443: Flags [.], ack 5210, win 62780, length 0
19:31:40.678630 IP 10.0.2.15.38078 > 151.101.117.67.443: Flags [P.], seq 829:867, ack 5210, win 62780, length 38
19:31:40.682825 IP 151.101.117.67.443 > 10.0.2.15.38078: Flags [P.], seq 5210:10706, ack 829, win 65535, length 5496
19:31:40.683726 IP 151.101.117.67.443 > 10.0.2.15.38078: Flags [.], ack 867, win 65535, length 0
19:31:40.683728 IP 151.101.117.67.443 > 10.0.2.15.38078: Flags [.], seq 10706:13626, ack 867, win 65535, length 2920
19:31:40.684494 IP 10.0.2.15.38078 > 151.101.117.67.443: Flags [.], ack 13626, win 58400, length 0
19:31:40.686640 IP 151.101.117.67.443 > 10.0.2.15.38078: Flags [.], seq 13626:23846, ack 867, win 65535, length 10220
19:31:40.686662 IP 10.0.2.15.38078 > 151.101.117.67.443: Flags [.], ack 23846, win 58400, length 0
19:31:40.690150 IP 151.101.117.67.443 > 10.0.2.15.38078: Flags [.], seq 23846:35526, ack 867, win 65535, length 11680
19:31:40.690727 IP 10.0.2.15.38078 > 151.101.117.67.443: Flags [.], ack 35526, win 56940, length 0
19:31:40.692349 IP 151.101.117.67.443 > 10.0.2.15.38078: Flags [P.], seq 35526:46430, ack 867, win 65535, length 10904
19:31:40.692475 IP 10.0.2.15.38078 > 151.101.117.67.443: Flags [.], ack 46430, win 49640, length 0
19:31:40.693950 IP 151.101.117.67.443 > 10.0.2.15.38078: Flags [P.], seq 46430:53300, ack 867, win 65535, length 6870
19:31:40.694570 IP 10.0.2.15.38078 > 151.101.117.67.443: Flags [.], ack 53300, win 43800, length 0
19:31:40.695385 IP 151.101.117.67.443 > 10.0.2.15.38078: Flags [P.], seq 53300:60170, ack 867, win 65535, length 6870
19:31:40.696735 IP 151.101.117.67.443 > 10.0.2.15.38078: Flags [.], seq 60170:68930, ack 867, win 65535, length 8760
19:31:40.696830 IP 10.0.2.15.38078 > 151.101.117.67.443: Flags [.], ack 60170, win 36930, length 0
19:31:40.698848 IP 10.0.2.15.38078 > 151.101.117.67.443: Flags [.], ack 68930, win 62780, length 0
19:31:40.699823 IP 151.101.117.67.443 > 10.0.2.15.38078: Flags [.], seq 68930:73310, ack 867, win 65535, length 4380
19:31:40.700079 IP 10.0.2.15.38078 > 151.101.117.67.443: Flags [.], ack 73310, win 65535, length 0
19:31:40.701588 IP 151.101.117.67.443 > 10.0.2.15.38078: Flags [.], seq 73310:87910, ack 867, win 65535, length 14600
19:31:40.701680 IP 10.0.2.15.38078 > 151.101.117.67.443: Flags [.], ack 87910, win 65535, length 0
19:31:40.704868 IP 151.101.117.67.443 > 10.0.2.15.38078: Flags [.], seq 87910:90830, ack 867, win 65535, length 2920
19:31:40.705021 IP 10.0.2.15.38078 > 151.101.117.67.443: Flags [.], ack 90830, win 65535, length 0
19:31:40.706752 IP 151.101.117.67.443 > 10.0.2.15.38078: Flags [.], seq 90830:93750, ack 867, win 65535, length 2920
19:31:40.706773 IP 10.0.2.15.38078 > 151.101.117.67.443: Flags [.], ack 93750, win 65535, length 0
19:31:40.707746 IP 151.101.117.67.443 > 10.0.2.15.38078: Flags [P.], seq 93750:102764, ack 867, win 65535, length 9014
19:31:40.707750 IP 151.101.117.67.443 > 10.0.2.15.38078: Flags [.], seq 102764:112984, ack 867, win 65535, length 10220
19:31:40.707770 IP 10.0.2.15.38078 > 151.101.117.67.443: Flags [.], ack 102764, win 65535, length 0
19:31:40.707970 IP 10.0.2.15.38078 > 151.101.117.67.443: Flags [.], ack 112984, win 65535, length 0
19:31:40.709258 IP 151.101.117.67.443 > 10.0.2.15.38078: Flags [.], seq 112984:114444, ack 867, win 65535, length 1460
19:31:40.709839 IP 151.101.117.67.443 > 10.0.2.15.38078: Flags [.], seq 114444:117364, ack 867, win 65535, length 2920
19:31:40.712065 IP 10.0.2.15.38078 > 151.101.117.67.443: Flags [.], ack 117364, win 65535, length 0
19:31:40.717502 IP 151.101.117.67.443 > 10.0.2.15.38078: Flags [P.], seq 117364:134366, ack 867, win 65535, length 17002
19:31:40.717590 IP 10.0.2.15.38078 > 151.101.117.67.443: Flags [.], ack 134366, win 65535, length 0
19:31:40.717841 IP 151.101.117.67.443 > 10.0.2.15.38078: Flags [.], seq 134366:146046, ack 867, win 65535, length 11680
19:31:40.718427 IP 10.0.2.15.38078 > 151.101.117.67.443: Flags [.], ack 146046, win 65535, length 0
19:31:40.718876 IP 151.101.117.67.443 > 10.0.2.15.38078: Flags [.], seq 146046:165026, ack 867, win 65535, length 18980
19:31:40.718897 IP 10.0.2.15.38078 > 151.101.117.67.443: Flags [.], ack 165026, win 65535, length 0
19:31:40.719835 IP 151.101.117.67.443 > 10.0.2.15.38078: Flags [P.], seq 165026:182546, ack 867, win 65535, length 17520
19:31:40.719929 IP 10.0.2.15.38078 > 151.101.117.67.443: Flags [.], ack 182546, win 65535, length 0
19:31:40.721834 IP 151.101.117.67.443 > 10.0.2.15.38078: Flags [.], seq 182546:217586, ack 867, win 65535, length 35040
19:31:40.721926 IP 10.0.2.15.38078 > 151.101.117.67.443: Flags [.], ack 217586, win 65535, length 0
19:31:40.723018 IP 151.101.117.67.443 > 10.0.2.15.38078: Flags [P.], seq 217586:230726, ack 867, win 65535, length 13140
19:31:40.723037 IP 10.0.2.15.38078 > 151.101.117.67.443: Flags [.], ack 230726, win 65535, length 0
19:31:40.723334 IP 151.101.117.67.443 > 10.0.2.15.38078: Flags [.], seq 230726:254086, ack 867, win 65535, length 23360
19:31:40.724155 IP 10.0.2.15.38078 > 151.101.117.67.443: Flags [.], ack 254086, win 65535, length 0
19:31:40.725395 IP 151.101.117.67.443 > 10.0.2.15.38078: Flags [.], seq 254086:259926, ack 867, win 65535, length 5840
19:31:40.726509 IP 151.101.117.67.443 > 10.0.2.15.38078: Flags [.], seq 259926:268686, ack 867, win 65535, length 8760
19:31:40.727723 IP 151.101.117.67.443 > 10.0.2.15.38078: Flags [P.], seq 268686:283286, ack 867, win 65535, length 14600
19:31:40.727981 IP 151.101.117.67.443 > 10.0.2.15.38078: Flags [.], seq 283286:293506, ack 867, win 65535, length 10220
19:31:40.732932 IP 10.0.2.15.38078 > 151.101.117.67.443: Flags [.], ack 293506, win 65535, length 0
19:31:40.735415 IP 151.101.117.67.443 > 10.0.2.15.38078: Flags [.], seq 293506:309566, ack 867, win 65535, length 16060
19:31:40.735908 IP 10.0.2.15.38078 > 151.101.117.67.443: Flags [.], ack 309566, win 65535, length 0
19:31:40.737675 IP 151.101.117.67.443 > 10.0.2.15.38078: Flags [P.], seq 309566:312986, ack 867, win 65535, length 3420
19:31:40.737686 IP 151.101.117.67.443 > 10.0.2.15.38078: Flags [.], seq 312986:350946, ack 867, win 65535, length 37960
19:31:40.737713 IP 10.0.2.15.38078 > 151.101.117.67.443: Flags [.], ack 312986, win 65535, length 0
19:31:40.737736 IP 10.0.2.15.38078 > 151.101.117.67.443: Flags [.], ack 350946, win 65535, length 0
19:31:40.741222 IP 151.101.117.67.443 > 10.0.2.15.38078: Flags [P.], seq 350946:358246, ack 867, win 65535, length 7300
19:31:40.741233 IP 151.101.117.67.443 > 10.0.2.15.38078: Flags [.], seq 358246:396206, ack 867, win 65535, length 37960
19:31:40.741261 IP 10.0.2.15.38078 > 151.101.117.67.443: Flags [.], ack 358246, win 65535, length 0
19:31:40.741396 IP 10.0.2.15.38078 > 151.101.117.67.443: Flags [.], ack 396206, win 65535, length 0
19:31:40.742040 IP 151.101.117.67.443 > 10.0.2.15.38078: Flags [P.], seq 396206:416646, ack 867, win 65535, length 20440
19:31:40.742061 IP 10.0.2.15.38078 > 151.101.117.67.443: Flags [.], ack 416646, win 65535, length 0
19:31:40.742302 IP 151.101.117.67.443 > 10.0.2.15.38078: Flags [.], seq 416646:419566, ack 867, win 65535, length 2920
19:31:40.742370 IP 10.0.2.15.38078 > 151.101.117.67.443: Flags [.], ack 419566, win 65535, length 0
19:31:40.743368 IP 151.101.117.67.443 > 10.0.2.15.38078: Flags [.], seq 419566:421026, ack 867, win 65535, length 1460
19:31:40.746533 IP 151.101.117.67.443 > 10.0.2.15.38078: Flags [.], seq 421026:422486, ack 867, win 65535, length 1460
19:31:40.746560 IP 10.0.2.15.38078 > 151.101.117.67.443: Flags [.], ack 422486, win 65535, length 0
19:31:40.747075 IP 151.101.117.67.443 > 10.0.2.15.38078: Flags [.], seq 422486:423946, ack 867, win 65535, length 1460
19:31:40.747328 IP 151.101.117.67.443 > 10.0.2.15.38078: Flags [.], seq 423946:425406, ack 867, win 65535, length 1460
19:31:40.747343 IP 10.0.2.15.38078 > 151.101.117.67.443: Flags [.], ack 425406, win 65535, length 0
19:31:40.747584 IP 151.101.117.67.443 > 10.0.2.15.38078: Flags [.], seq 425406:431246, ack 867, win 65535, length 5840
19:31:40.747598 IP 10.0.2.15.38078 > 151.101.117.67.443: Flags [.], ack 431246, win 65535, length 0
19:31:40.747759 IP 151.101.117.67.443 > 10.0.2.15.38078: Flags [.], seq 431246:435626, ack 867, win 65535, length 4380
19:31:40.747768 IP 10.0.2.15.38078 > 151.101.117.67.443: Flags [.], ack 435626, win 65535, length 0
19:31:40.747929 IP 151.101.117.67.443 > 10.0.2.15.38078: Flags [.], seq 435626:440006, ack 867, win 65535, length 4380
19:31:40.747940 IP 10.0.2.15.38078 > 151.101.117.67.443: Flags [.], ack 440006, win 65535, length 0
19:31:40.748545 IP 151.101.117.67.443 > 10.0.2.15.38078: Flags [.], seq 440006:442926, ack 867, win 65535, length 2920
19:31:40.748559 IP 10.0.2.15.38078 > 151.101.117.67.443: Flags [.], ack 442926, win 65535, length 0
19:31:40.749109 IP 151.101.117.67.443 > 10.0.2.15.38078: Flags [P.], seq 442926:461906, ack 867, win 65535, length 18980
19:31:40.749127 IP 10.0.2.15.38078 > 151.101.117.67.443: Flags [.], ack 461906, win 65535, length 0
19:31:40.749176 IP 151.101.117.67.443 > 10.0.2.15.38078: Flags [P.], seq 461906:480614, ack 867, win 65535, length 18708
19:31:40.749182 IP 10.0.2.15.38078 > 151.101.117.67.443: Flags [.], ack 480614, win 65535, length 0
19:31:40.749532 IP 151.101.117.67.443 > 10.0.2.15.38078: Flags [P.], seq 480614:481988, ack 867, win 65535, length 1374
19:31:40.750282 IP 151.101.117.67.443 > 10.0.2.15.38078: Flags [P.], seq 481988:488858, ack 867, win 65535, length 6870
19:31:40.750413 IP 10.0.2.15.38078 > 151.101.117.67.443: Flags [.], ack 488858, win 65535, length 0
19:31:40.751170 IP 151.101.117.67.443 > 10.0.2.15.38078: Flags [P.], seq 488858:491606, ack 867, win 65535, length 2748
19:31:40.751173 IP 151.101.117.67.443 > 10.0.2.15.38078: Flags [P.], seq 491606:494354, ack 867, win 65535, length 2748
19:31:40.751174 IP 151.101.117.67.443 > 10.0.2.15.38078: Flags [P.], seq 494354:497102, ack 867, win 65535, length 2748
19:31:40.751174 IP 151.101.117.67.443 > 10.0.2.15.38078: Flags [P.], seq 497102:499850, ack 867, win 65535, length 2748
19:31:40.751192 IP 10.0.2.15.38078 > 151.101.117.67.443: Flags [.], ack 491606, win 65535, length 0
19:31:40.751216 IP 10.0.2.15.38078 > 151.101.117.67.443: Flags [.], ack 494354, win 65535, length 0
19:31:40.751302 IP 10.0.2.15.38078 > 151.101.117.67.443: Flags [.], ack 497102, win 65535, length 0
19:31:40.751313 IP 10.0.2.15.38078 > 151.101.117.67.443: Flags [.], ack 499850, win 65535, length 0
19:31:40.751336 IP 151.101.117.67.443 > 10.0.2.15.38078: Flags [P.], seq 499850:501224, ack 867, win 65535, length 1374
19:31:40.751640 IP 151.101.117.67.443 > 10.0.2.15.38078: Flags [P.], seq 501224:505346, ack 867, win 65535, length 4122
19:31:40.751641 IP 151.101.117.67.443 > 10.0.2.15.38078: Flags [P.], seq 505346:510842, ack 867, win 65535, length 5496
19:31:40.751651 IP 10.0.2.15.38078 > 151.101.117.67.443: Flags [.], ack 505346, win 65535, length 0
19:31:40.751666 IP 10.0.2.15.38078 > 151.101.117.67.443: Flags [.], ack 510842, win 65535, length 0
19:31:40.751994 IP 151.101.117.67.443 > 10.0.2.15.38078: Flags [P.], seq 510842:513590, ack 867, win 65535, length 2748
19:31:40.751997 IP 151.101.117.67.443 > 10.0.2.15.38078: Flags [P.], seq 513590:516338, ack 867, win 65535, length 2748
19:31:40.752009 IP 10.0.2.15.38078 > 151.101.117.67.443: Flags [.], ack 513590, win 65535, length 0
19:31:40.752029 IP 10.0.2.15.38078 > 151.101.117.67.443: Flags [.], ack 516338, win 65535, length 0
19:31:40.752806 IP 151.101.117.67.443 > 10.0.2.15.38078: Flags [P.], seq 516338:519086, ack 867, win 65535, length 2748
19:31:40.752817 IP 10.0.2.15.38078 > 151.101.117.67.443: Flags [.], ack 519086, win 65535, length 0
19:31:40.753435 IP 151.101.117.67.443 > 10.0.2.15.38078: Flags [P.], seq 519086:525956, ack 867, win 65535, length 6870
19:31:40.753674 IP 151.101.117.67.443 > 10.0.2.15.38078: Flags [P.], seq 525956:531452, ack 867, win 65535, length 5496
19:31:40.753838 IP 151.101.117.67.443 > 10.0.2.15.38078: Flags [P.], seq 531452:534200, ack 867, win 65535, length 2748
19:31:40.754133 IP 151.101.117.67.443 > 10.0.2.15.38078: Flags [P.], seq 534200:536948, ack 867, win 65535, length 2748
19:31:40.754410 IP 151.101.117.67.443 > 10.0.2.15.38078: Flags [P.], seq 536948:539696, ack 867, win 65535, length 2748
19:31:40.754412 IP 151.101.117.67.443 > 10.0.2.15.38078: Flags [P.], seq 539696:543818, ack 867, win 65535, length 4122
19:31:40.755098 IP 10.0.2.15.38078 > 151.101.117.67.443: Flags [.], ack 543818, win 65535, length 0
19:31:40.755433 IP 151.101.117.67.443 > 10.0.2.15.38078: Flags [P.], seq 543818:545192, ack 867, win 65535, length 1374
19:31:40.755854 IP 151.101.117.67.443 > 10.0.2.15.38078: Flags [P.], seq 545192:553436, ack 867, win 65535, length 8244
19:31:40.755995 IP 151.101.117.67.443 > 10.0.2.15.38078: Flags [P.], seq 553436:558932, ack 867, win 65535, length 5496
19:31:40.756309 IP 151.101.117.67.443 > 10.0.2.15.38078: Flags [P.], seq 558932:561680, ack 867, win 65535, length 2748
19:31:40.756379 IP 151.101.117.67.443 > 10.0.2.15.38078: Flags [P.], seq 561680:565802, ack 867, win 65535, length 4122
19:31:40.756497 IP 151.101.117.67.443 > 10.0.2.15.38078: Flags [P.], seq 565802:569924, ack 867, win 65535, length 4122
19:31:40.756640 IP 10.0.2.15.38078 > 151.101.117.67.443: Flags [.], ack 565802, win 65535, length 0
19:31:40.757077 IP 151.101.117.67.443 > 10.0.2.15.38078: Flags [P.], seq 569924:571298, ack 867, win 65535, length 1374
19:31:40.757189 IP 10.0.2.15.38078 > 151.101.117.67.443: Flags [.], ack 569924, win 65535, length 0
19:31:40.758022 IP 151.101.117.67.443 > 10.0.2.15.38078: Flags [P.], seq 571298:578168, ack 867, win 65535, length 6870
19:31:40.758190 IP 151.101.117.67.443 > 10.0.2.15.38078: Flags [P.], seq 578168:582290, ack 867, win 65535, length 4122
19:31:40.758353 IP 151.101.117.67.443 > 10.0.2.15.38078: Flags [P.], seq 582290:586412, ack 867, win 65535, length 4122
19:31:40.758796 IP 151.101.117.67.443 > 10.0.2.15.38078: Flags [P.], seq 586412:589160, ack 867, win 65535, length 2748
19:31:40.758798 IP 151.101.117.67.443 > 10.0.2.15.38078: Flags [P.], seq 589160:590534, ack 867, win 65535, length 1374
19:31:40.758798 IP 151.101.117.67.443 > 10.0.2.15.38078: Flags [P.], seq 590534:593282, ack 867, win 65535, length 2748
19:31:40.759466 IP 10.0.2.15.38078 > 151.101.117.67.443: Flags [.], ack 593282, win 65535, length 0
19:31:40.760610 IP 151.101.117.67.443 > 10.0.2.15.38078: Flags [P.], seq 593282:601526, ack 867, win 65535, length 8244
19:31:40.760613 IP 151.101.117.67.443 > 10.0.2.15.38078: Flags [P.], seq 601526:605648, ack 867, win 65535, length 4122
19:31:40.760724 IP 151.101.117.67.443 > 10.0.2.15.38078: Flags [P.], seq 605648:609770, ack 867, win 65535, length 4122
19:31:40.760880 IP 151.101.117.67.443 > 10.0.2.15.38078: Flags [P.], seq 609770:612518, ack 867, win 65535, length 2748
19:31:40.761026 IP 151.101.117.67.443 > 10.0.2.15.38078: Flags [P.], seq 612518:616640, ack 867, win 65535, length 4122
19:31:40.761131 IP 10.0.2.15.38078 > 151.101.117.67.443: Flags [.], ack 616640, win 65535, length 0
19:31:40.761332 IP 151.101.117.67.443 > 10.0.2.15.38078: Flags [P.], seq 616640:618014, ack 867, win 65535, length 1374
19:31:40.764020 IP 151.101.117.67.443 > 10.0.2.15.38078: Flags [P.], seq 618014:626258, ack 867, win 65535, length 8244
19:31:40.764024 IP 151.101.117.67.443 > 10.0.2.15.38078: Flags [P.], seq 626258:633128, ack 867, win 65535, length 6870
19:31:40.764416 IP 10.0.2.15.38078 > 151.101.117.67.443: Flags [.], ack 626258, win 65535, length 0
19:31:40.764899 IP 10.0.2.15.38078 > 151.101.117.67.443: Flags [.], ack 633128, win 65535, length 0
19:31:40.765290 IP 151.101.117.67.443 > 10.0.2.15.38078: Flags [P.], seq 633128:639998, ack 867, win 65535, length 6870
19:31:40.765293 IP 151.101.117.67.443 > 10.0.2.15.38078: Flags [P.], seq 639998:649616, ack 867, win 65535, length 9618
19:31:40.765311 IP 10.0.2.15.38078 > 151.101.117.67.443: Flags [.], ack 639998, win 65535, length 0
19:31:40.765338 IP 10.0.2.15.38078 > 151.101.117.67.443: Flags [.], ack 649616, win 65535, length 0
19:31:40.765357 IP 151.101.117.67.443 > 10.0.2.15.38078: Flags [P.], seq 649616:657860, ack 867, win 65535, length 8244
19:31:40.765358 IP 151.101.117.67.443 > 10.0.2.15.38078: Flags [P.], seq 657860:661982, ack 867, win 65535, length 4122
19:31:40.765449 IP 10.0.2.15.38078 > 151.101.117.67.443: Flags [.], ack 657860, win 65535, length 0
19:31:40.765471 IP 10.0.2.15.38078 > 151.101.117.67.443: Flags [.], ack 661982, win 65535, length 0
19:31:40.765502 IP 151.101.117.67.443 > 10.0.2.15.38078: Flags [P.], seq 661982:663356, ack 867, win 65535, length 1374
19:31:40.765503 IP 151.101.117.67.443 > 10.0.2.15.38078: Flags [P.], seq 663356:664730, ack 867, win 65535, length 1374
19:31:40.765511 IP 10.0.2.15.38078 > 151.101.117.67.443: Flags [.], ack 664730, win 65535, length 0
19:31:40.766179 IP 151.101.117.67.443 > 10.0.2.15.38078: Flags [P.], seq 664730:671600, ack 867, win 65535, length 6870
19:31:40.766190 IP 10.0.2.15.38078 > 151.101.117.67.443: Flags [.], ack 671600, win 65535, length 0
19:31:40.766376 IP 151.101.117.67.443 > 10.0.2.15.38078: Flags [P.], seq 671600:674348, ack 867, win 65535, length 2748
19:31:40.766384 IP 10.0.2.15.38078 > 151.101.117.67.443: Flags [.], ack 674348, win 65535, length 0
19:31:40.766864 IP 151.101.117.67.443 > 10.0.2.15.38078: Flags [P.], seq 674348:679844, ack 867, win 65535, length 5496
19:31:40.766866 IP 151.101.117.67.443 > 10.0.2.15.38078: Flags [P.], seq 679844:681218, ack 867, win 65535, length 1374
19:31:40.766867 IP 151.101.117.67.443 > 10.0.2.15.38078: Flags [P.], seq 681218:686714, ack 867, win 65535, length 5496
19:31:40.766879 IP 10.0.2.15.38078 > 151.101.117.67.443: Flags [.], ack 679844, win 65535, length 0
19:31:40.766902 IP 10.0.2.15.38078 > 151.101.117.67.443: Flags [.], ack 686714, win 65535, length 0
19:31:40.768160 IP 151.101.117.67.443 > 10.0.2.15.38078: Flags [P.], seq 686714:692210, ack 867, win 65535, length 5496
19:31:40.768162 IP 151.101.117.67.443 > 10.0.2.15.38078: Flags [P.], seq 692210:694958, ack 867, win 65535, length 2748
19:31:40.768187 IP 10.0.2.15.38078 > 151.101.117.67.443: Flags [.], ack 692210, win 65535, length 0
19:31:40.768212 IP 10.0.2.15.38078 > 151.101.117.67.443: Flags [.], ack 694958, win 65535, length 0
19:31:40.768470 IP 151.101.117.67.443 > 10.0.2.15.38078: Flags [P.], seq 694958:700454, ack 867, win 65535, length 5496
19:31:40.768472 IP 151.101.117.67.443 > 10.0.2.15.38078: Flags [P.], seq 700454:701828, ack 867, win 65535, length 1374
19:31:40.768557 IP 10.0.2.15.38078 > 151.101.117.67.443: Flags [.], ack 700454, win 65535, length 0
19:31:40.769335 IP 151.101.117.67.443 > 10.0.2.15.38078: Flags [P.], seq 701828:703202, ack 867, win 65535, length 1374
19:31:40.769351 IP 10.0.2.15.38078 > 151.101.117.67.443: Flags [.], ack 703202, win 65535, length 0
19:31:40.770464 IP 151.101.117.67.443 > 10.0.2.15.38078: Flags [P.], seq 703202:710072, ack 867, win 65535, length 6870
19:31:40.770493 IP 10.0.2.15.38078 > 151.101.117.67.443: Flags [.], ack 710072, win 65535, length 0
19:31:40.770798 IP 151.101.117.67.443 > 10.0.2.15.38078: Flags [P.], seq 710072:714194, ack 867, win 65535, length 4122
19:31:40.770800 IP 151.101.117.67.443 > 10.0.2.15.38078: Flags [P.], seq 714194:718316, ack 867, win 65535, length 4122
19:31:40.770800 IP 151.101.117.67.443 > 10.0.2.15.38078: Flags [P.], seq 718316:721064, ack 867, win 65535, length 2748
19:31:40.770813 IP 10.0.2.15.38078 > 151.101.117.67.443: Flags [.], ack 714194, win 65535, length 0
19:31:40.770927 IP 10.0.2.15.38078 > 151.101.117.67.443: Flags [.], ack 718316, win 65535, length 0
19:31:40.770942 IP 10.0.2.15.38078 > 151.101.117.67.443: Flags [.], ack 721064, win 65535, length 0
19:31:40.770957 IP 151.101.117.67.443 > 10.0.2.15.38078: Flags [P.], seq 721064:723812, ack 867, win 65535, length 2748
19:31:40.770963 IP 10.0.2.15.38078 > 151.101.117.67.443: Flags [.], ack 723812, win 65535, length 0
19:31:40.771068 IP 151.101.117.67.443 > 10.0.2.15.38078: Flags [P.], seq 723812:725186, ack 867, win 65535, length 1374
19:31:40.771561 IP 151.101.117.67.443 > 10.0.2.15.38078: Flags [P.], seq 725186:732056, ack 867, win 65535, length 6870
19:31:40.771650 IP 10.0.2.15.38078 > 151.101.117.67.443: Flags [.], ack 732056, win 65535, length 0
19:31:40.771853 IP 151.101.117.67.443 > 10.0.2.15.38078: Flags [P.], seq 732056:734804, ack 867, win 65535, length 2748
19:31:40.771863 IP 10.0.2.15.38078 > 151.101.117.67.443: Flags [.], ack 734804, win 65535, length 0
19:31:40.772336 IP 151.101.117.67.443 > 10.0.2.15.38078: Flags [P.], seq 734804:740300, ack 867, win 65535, length 5496
19:31:40.772338 IP 151.101.117.67.443 > 10.0.2.15.38078: Flags [P.], seq 740300:744422, ack 867, win 65535, length 4122
19:31:40.772362 IP 10.0.2.15.38078 > 151.101.117.67.443: Flags [.], ack 740300, win 65535, length 0
19:31:40.772377 IP 10.0.2.15.38078 > 151.101.117.67.443: Flags [.], ack 744422, win 65535, length 0
19:31:40.772598 IP 151.101.117.67.443 > 10.0.2.15.38078: Flags [P.], seq 744422:747170, ack 867, win 65535, length 2748
19:31:40.772600 IP 151.101.117.67.443 > 10.0.2.15.38078: Flags [P.], seq 747170:749918, ack 867, win 65535, length 2748
19:31:40.772612 IP 10.0.2.15.38078 > 151.101.117.67.443: Flags [.], ack 747170, win 65535, length 0
19:31:40.772731 IP 10.0.2.15.38078 > 151.101.117.67.443: Flags [.], ack 749918, win 65535, length 0
19:31:40.773224 IP 151.101.117.67.443 > 10.0.2.15.38078: Flags [P.], seq 749918:755414, ack 867, win 65535, length 5496
19:31:40.773226 IP 151.101.117.67.443 > 10.0.2.15.38078: Flags [P.], seq 755414:758162, ack 867, win 65535, length 2748
19:31:40.773238 IP 10.0.2.15.38078 > 151.101.117.67.443: Flags [.], ack 755414, win 65535, length 0
19:31:40.773254 IP 10.0.2.15.38078 > 151.101.117.67.443: Flags [.], ack 758162, win 65535, length 0
19:31:40.773500 IP 151.101.117.67.443 > 10.0.2.15.38078: Flags [P.], seq 758162:759536, ack 867, win 65535, length 1374
19:31:40.773501 IP 151.101.117.67.443 > 10.0.2.15.38078: Flags [P.], seq 759536:762284, ack 867, win 65535, length 2748
19:31:40.773510 IP 10.0.2.15.38078 > 151.101.117.67.443: Flags [.], ack 762284, win 65535, length 0
19:31:40.773825 IP 151.101.117.67.443 > 10.0.2.15.38078: Flags [P.], seq 762284:766406, ack 867, win 65535, length 4122
19:31:40.773826 IP 151.101.117.67.443 > 10.0.2.15.38078: Flags [P.], seq 766406:769154, ack 867, win 65535, length 2748
19:31:40.773837 IP 10.0.2.15.38078 > 151.101.117.67.443: Flags [.], ack 766406, win 65535, length 0
19:31:40.773854 IP 10.0.2.15.38078 > 151.101.117.67.443: Flags [.], ack 769154, win 65535, length 0
19:31:40.774649 IP 151.101.117.67.443 > 10.0.2.15.38078: Flags [P.], seq 769154:774650, ack 867, win 65535, length 5496
19:31:40.774651 IP 151.101.117.67.443 > 10.0.2.15.38078: Flags [P.], seq 774650:777398, ack 867, win 65535, length 2748
19:31:40.774652 IP 151.101.117.67.443 > 10.0.2.15.38078: Flags [P.], seq 777398:781520, ack 867, win 65535, length 4122
19:31:40.774665 IP 10.0.2.15.38078 > 151.101.117.67.443: Flags [.], ack 774650, win 65535, length 0
19:31:40.774682 IP 10.0.2.15.38078 > 151.101.117.67.443: Flags [.], ack 777398, win 65535, length 0
19:31:40.774694 IP 10.0.2.15.38078 > 151.101.117.67.443: Flags [.], ack 781520, win 65535, length 0
19:31:40.774984 IP 151.101.117.67.443 > 10.0.2.15.38078: Flags [P.], seq 781520:788390, ack 867, win 65535, length 6870
19:31:40.774994 IP 10.0.2.15.38078 > 151.101.117.67.443: Flags [.], ack 788390, win 65535, length 0
19:31:40.778080 IP 151.101.117.67.443 > 10.0.2.15.38078: Flags [P.], seq 788390:795260, ack 867, win 65535, length 6870
19:31:40.778537 IP 151.101.117.67.443 > 10.0.2.15.38078: Flags [P.], seq 795260:803504, ack 867, win 65535, length 8244
19:31:40.778759 IP 151.101.117.67.443 > 10.0.2.15.38078: Flags [P.], seq 803504:810374, ack 867, win 65535, length 6870
19:31:40.779278 IP 151.101.117.67.443 > 10.0.2.15.38078: Flags [P.], seq 810374:813122, ack 867, win 65535, length 2748
19:31:40.779280 IP 151.101.117.67.443 > 10.0.2.15.38078: Flags [P.], seq 813122:819992, ack 867, win 65535, length 6870
19:31:40.779510 IP 10.0.2.15.38078 > 151.101.117.67.443: Flags [.], ack 813122, win 65535, length 0
19:31:40.779572 IP 10.0.2.15.38078 > 151.101.117.67.443: Flags [.], ack 819992, win 65535, length 0
19:31:40.782475 IP 151.101.117.67.443 > 10.0.2.15.38078: Flags [P.], seq 819992:828236, ack 867, win 65535, length 8244
19:31:40.782479 IP 151.101.117.67.443 > 10.0.2.15.38078: Flags [P.], seq 828236:830984, ack 867, win 65535, length 2748
19:31:40.782584 IP 10.0.2.15.38078 > 151.101.117.67.443: Flags [.], ack 828236, win 65535, length 0
19:31:40.782643 IP 10.0.2.15.38078 > 151.101.117.67.443: Flags [.], ack 830984, win 65535, length 0
19:31:40.783046 IP 151.101.117.67.443 > 10.0.2.15.38078: Flags [P.], seq 830984:833732, ack 867, win 65535, length 2748
19:31:40.783050 IP 151.101.117.67.443 > 10.0.2.15.38078: Flags [P.], seq 833732:847472, ack 867, win 65535, length 13740
19:31:40.783066 IP 10.0.2.15.38078 > 151.101.117.67.443: Flags [.], ack 833732, win 65535, length 0
19:31:40.783085 IP 10.0.2.15.38078 > 151.101.117.67.443: Flags [.], ack 847472, win 65535, length 0
19:31:40.783110 IP 151.101.117.67.443 > 10.0.2.15.38078: Flags [P.], seq 847472:851594, ack 867, win 65535, length 4122
19:31:40.783114 IP 10.0.2.15.38078 > 151.101.117.67.443: Flags [.], ack 851594, win 65535, length 0
19:31:40.783789 IP 151.101.117.67.443 > 10.0.2.15.38078: Flags [P.], seq 851594:858464, ack 867, win 65535, length 6870
19:31:40.783804 IP 10.0.2.15.38078 > 151.101.117.67.443: Flags [.], ack 858464, win 65535, length 0
19:31:40.783944 IP 151.101.117.67.443 > 10.0.2.15.38078: Flags [P.], seq 858464:862586, ack 867, win 65535, length 4122
19:31:40.783953 IP 10.0.2.15.38078 > 151.101.117.67.443: Flags [.], ack 862586, win 65535, length 0
19:31:40.784322 IP 151.101.117.67.443 > 10.0.2.15.38078: Flags [P.], seq 862586:865334, ack 867, win 65535, length 2748
19:31:40.784324 IP 151.101.117.67.443 > 10.0.2.15.38078: Flags [P.], seq 865334:868082, ack 867, win 65535, length 2748
19:31:40.784325 IP 151.101.117.67.443 > 10.0.2.15.38078: Flags [P.], seq 868082:870830, ack 867, win 65535, length 2748
19:31:40.784341 IP 10.0.2.15.38078 > 151.101.117.67.443: Flags [.], ack 865334, win 65535, length 0
19:31:40.784364 IP 10.0.2.15.38078 > 151.101.117.67.443: Flags [.], ack 868082, win 65535, length 0
19:31:40.784377 IP 10.0.2.15.38078 > 151.101.117.67.443: Flags [.], ack 870830, win 65535, length 0
19:31:40.784726 IP 151.101.117.67.443 > 10.0.2.15.38078: Flags [P.], seq 870830:873578, ack 867, win 65535, length 2748
19:31:40.784728 IP 151.101.117.67.443 > 10.0.2.15.38078: Flags [P.], seq 873578:877700, ack 867, win 65535, length 4122
19:31:40.784743 IP 10.0.2.15.38078 > 151.101.117.67.443: Flags [.], ack 873578, win 65535, length 0
19:31:40.784770 IP 10.0.2.15.38078 > 151.101.117.67.443: Flags [.], ack 877700, win 65535, length 0
19:31:40.784918 IP 151.101.117.67.443 > 10.0.2.15.38078: Flags [P.], seq 877700:881822, ack 867, win 65535, length 4122
19:31:40.784924 IP 10.0.2.15.38078 > 151.101.117.67.443: Flags [.], ack 881822, win 65535, length 0
19:31:40.787761 IP 151.101.117.67.443 > 10.0.2.15.38078: Flags [P.], seq 881822:888692, ack 867, win 65535, length 6870
19:31:40.787874 IP 10.0.2.15.38078 > 151.101.117.67.443: Flags [.], ack 888692, win 65535, length 0
19:31:40.788107 IP 151.101.117.67.443 > 10.0.2.15.38078: Flags [P.], seq 888692:894188, ack 867, win 65535, length 5496
19:31:40.788109 IP 151.101.117.67.443 > 10.0.2.15.38078: Flags [P.], seq 894188:898310, ack 867, win 65535, length 4122
19:31:40.788123 IP 10.0.2.15.38078 > 151.101.117.67.443: Flags [.], ack 894188, win 65535, length 0
19:31:40.788307 IP 10.0.2.15.38078 > 151.101.117.67.443: Flags [.], ack 898310, win 65535, length 0
19:31:40.791051 IP 151.101.117.67.443 > 10.0.2.15.38078: Flags [P.], seq 898310:907928, ack 867, win 65535, length 9618
19:31:40.791053 IP 151.101.117.67.443 > 10.0.2.15.38078: Flags [P.], seq 907928:910676, ack 867, win 65535, length 2748
19:31:40.791075 IP 10.0.2.15.38078 > 151.101.117.67.443: Flags [.], ack 907928, win 65535, length 0
19:31:40.791310 IP 151.101.117.67.443 > 10.0.2.15.38078: Flags [P.], seq 910676:912050, ack 867, win 65535, length 1374
19:31:40.791313 IP 151.101.117.67.443 > 10.0.2.15.38078: Flags [P.], seq 912050:917546, ack 867, win 65535, length 5496
19:31:40.791501 IP 10.0.2.15.38078 > 151.101.117.67.443: Flags [.], ack 917546, win 65535, length 0
19:31:40.791814 IP 151.101.117.67.443 > 10.0.2.15.38078: Flags [P.], seq 917546:921668, ack 867, win 65535, length 4122
19:31:40.791910 IP 10.0.2.15.38078 > 151.101.117.67.443: Flags [.], ack 921668, win 65535, length 0
19:31:40.792133 IP 151.101.117.67.443 > 10.0.2.15.38078: Flags [P.], seq 921668:928538, ack 867, win 65535, length 6870
19:31:40.792136 IP 151.101.117.67.443 > 10.0.2.15.38078: Flags [P.], seq 928538:934034, ack 867, win 65535, length 5496
19:31:40.792251 IP 10.0.2.15.38078 > 151.101.117.67.443: Flags [.], ack 934034, win 65535, length 0
19:31:40.792533 IP 151.101.117.67.443 > 10.0.2.15.38078: Flags [P.], seq 934034:936782, ack 867, win 65535, length 2748
19:31:40.792618 IP 151.101.117.67.443 > 10.0.2.15.38078: Flags [P.], seq 936782:939530, ack 867, win 65535, length 2748
19:31:40.792689 IP 10.0.2.15.38078 > 151.101.117.67.443: Flags [.], ack 939530, win 65535, length 0
19:31:40.794219 IP 151.101.117.67.443 > 10.0.2.15.38078: Flags [P.], seq 939530:945026, ack 867, win 65535, length 5496
19:31:40.794221 IP 151.101.117.67.443 > 10.0.2.15.38078: Flags [P.], seq 945026:947774, ack 867, win 65535, length 2748
19:31:40.794236 IP 10.0.2.15.38078 > 151.101.117.67.443: Flags [.], ack 945026, win 65535, length 0
19:31:40.794325 IP 10.0.2.15.38078 > 151.101.117.67.443: Flags [.], ack 947774, win 65535, length 0
19:31:40.794640 IP 151.101.117.67.443 > 10.0.2.15.38078: Flags [P.], seq 947774:954644, ack 867, win 65535, length 6870
19:31:40.794651 IP 10.0.2.15.38078 > 151.101.117.67.443: Flags [.], ack 954644, win 65535, length 0
19:31:40.794915 IP 151.101.117.67.443 > 10.0.2.15.38078: Flags [P.], seq 954644:957392, ack 867, win 65535, length 2748
19:31:40.794926 IP 10.0.2.15.38078 > 151.101.117.67.443: Flags [.], ack 957392, win 65535, length 0
19:31:40.795292 IP 151.101.117.67.443 > 10.0.2.15.38078: Flags [P.], seq 957392:961514, ack 867, win 65535, length 4122
19:31:40.795294 IP 151.101.117.67.443 > 10.0.2.15.38078: Flags [P.], seq 961514:964262, ack 867, win 65535, length 2748
19:31:40.795294 IP 151.101.117.67.443 > 10.0.2.15.38078: Flags [P.], seq 964262:967010, ack 867, win 65535, length 2748
19:31:40.795718 IP 151.101.117.67.443 > 10.0.2.15.38078: Flags [P.], seq 967010:972506, ack 867, win 65535, length 5496

