19:30:51.562657 IP 10.0.2.15.39950 > 140.233.253.2.53: 18518+ A? www.cnn.com. (29)
19:30:51.562695 IP 10.0.2.15.39950 > 140.233.253.2.53: 55125+ AAAA? www.cnn.com. (29)
19:30:51.568422 IP 140.233.253.2.53 > 10.0.2.15.39950: 18518 2/0/0 CNAME turner-tls.map.fastly.net., A 151.101.117.67 (84)
19:30:51.568425 IP 140.233.253.2.53 > 10.0.2.15.39950: 55125 2/0/0 CNAME turner-tls.map.fastly.net., AAAA 2a04:4e42:1c::323 (96)
19:30:51.568971 IP 10.0.2.15.38058 > 151.101.117.67.443: Flags [S], seq 3417462228, win 64240, options [mss 1460,sackOK,TS val 1396770542 ecr 0,nop,wscale 6], length 0
19:30:51.585254 IP 151.101.117.67.443 > 10.0.2.15.38058: Flags [S.], seq 170368001, ack 3417462229, win 65535, options [mss 1460], length 0
19:30:51.585306 IP 10.0.2.15.38058 > 151.101.117.67.443: Flags [.], ack 1, win 64240, length 0
19:30:51.593482 IP 10.0.2.15.38058 > 151.101.117.67.443: Flags [P.], seq 1:518, ack 1, win 64240, length 517
19:30:51.593868 IP 151.101.117.67.443 > 10.0.2.15.38058: Flags [.], ack 518, win 65535, length 0
19:30:51.611904 IP 151.101.117.67.443 > 10.0.2.15.38058: Flags [P.], seq 1:2749, ack 518, win 65535, length 2748
19:30:51.611930 IP 10.0.2.15.38058 > 151.101.117.67.443: Flags [.], ack 2749, win 62780, length 0
19:30:51.612692 IP 151.101.117.67.443 > 10.0.2.15.38058: Flags [P.], seq 2749:5064, ack 518, win 65535, length 2315
19:30:51.612713 IP 10.0.2.15.38058 > 151.101.117.67.443: Flags [.], ack 5064, win 61320, length 0
19:30:51.614159 IP 10.0.2.15.38058 > 151.101.117.67.443: Flags [P.], seq 518:611, ack 5064, win 62780, length 93
19:30:51.614469 IP 151.101.117.67.443 > 10.0.2.15.38058: Flags [.], ack 611, win 65535, length 0
19:30:51.628417 IP 151.101.117.67.443 > 10.0.2.15.38058: Flags [P.], seq 5064:5115, ack 611, win 65535, length 51
19:30:51.628439 IP 10.0.2.15.38058 > 151.101.117.67.443: Flags [.], ack 5115, win 62780, length 0
19:30:51.628934 IP 10.0.2.15.38058 > 151.101.117.67.443: Flags [P.], seq 611:664, ack 5115, win 62780, length 53
19:30:51.628972 IP 10.0.2.15.38058 > 151.101.117.67.443: Flags [P.], seq 664:720, ack 5115, win 62780, length 56
19:30:51.629216 IP 151.101.117.67.443 > 10.0.2.15.38058: Flags [.], ack 664, win 65535, length 0
19:30:51.629238 IP 10.0.2.15.38058 > 151.101.117.67.443: Flags [P.], seq 720:829, ack 5115, win 62780, length 109
19:30:51.629389 IP 151.101.117.67.443 > 10.0.2.15.38058: Flags [.], ack 720, win 65535, length 0
19:30:51.629390 IP 151.101.117.67.443 > 10.0.2.15.38058: Flags [.], ack 829, win 65535, length 0
19:30:51.643601 IP 151.101.117.67.443 > 10.0.2.15.38058: Flags [P.], seq 5115:5210, ack 829, win 65535, length 95
19:30:51.643621 IP 10.0.2.15.38058 > 151.101.117.67.443: Flags [.], ack 5210, win 62780, length 0
19:30:51.644150 IP 10.0.2.15.38058 > 151.101.117.67.443: Flags [P.], seq 829:867, ack 5210, win 62780, length 38
19:30:51.644529 IP 151.101.117.67.443 > 10.0.2.15.38058: Flags [.], ack 867, win 65535, length 0
19:30:51.646517 IP 151.101.117.67.443 > 10.0.2.15.38058: Flags [P.], seq 5210:9332, ack 867, win 65535, length 4122
19:30:51.646654 IP 10.0.2.15.38058 > 151.101.117.67.443: Flags [.], ack 9332, win 61320, length 0
19:30:51.647145 IP 151.101.117.67.443 > 10.0.2.15.38058: Flags [P.], seq 9332:12080, ack 867, win 65535, length 2748
19:30:51.647186 IP 10.0.2.15.38058 > 151.101.117.67.443: Flags [.], ack 12080, win 59860, length 0
19:30:51.648587 IP 151.101.117.67.443 > 10.0.2.15.38058: Flags [P.], seq 12080:17576, ack 867, win 65535, length 5496
19:30:51.648607 IP 10.0.2.15.38058 > 151.101.117.67.443: Flags [.], ack 17576, win 61320, length 0
19:30:51.649695 IP 151.101.117.67.443 > 10.0.2.15.38058: Flags [P.], seq 17576:20324, ack 867, win 65535, length 2748
19:30:51.649715 IP 10.0.2.15.38058 > 151.101.117.67.443: Flags [.], ack 20324, win 62780, length 0
19:30:51.650695 IP 151.101.117.67.443 > 10.0.2.15.38058: Flags [P.], seq 20324:27194, ack 867, win 65535, length 6870
19:30:51.650869 IP 10.0.2.15.38058 > 151.101.117.67.443: Flags [.], ack 27194, win 59860, length 0
19:30:51.651707 IP 151.101.117.67.443 > 10.0.2.15.38058: Flags [P.], seq 27194:28568, ack 867, win 65535, length 1374
19:30:51.654243 IP 151.101.117.67.443 > 10.0.2.15.38058: Flags [P.], seq 28568:34064, ack 867, win 65535, length 5496
19:30:51.654246 IP 151.101.117.67.443 > 10.0.2.15.38058: Flags [P.], seq 34064:36812, ack 867, win 65535, length 2748
19:30:51.654267 IP 10.0.2.15.38058 > 151.101.117.67.443: Flags [.], ack 34064, win 61320, length 0
19:30:51.654491 IP 10.0.2.15.38058 > 151.101.117.67.443: Flags [.], ack 36812, win 58572, length 0
19:30:51.654887 IP 151.101.117.67.443 > 10.0.2.15.38058: Flags [P.], seq 36812:40934, ack 867, win 65535, length 4122
19:30:51.655088 IP 151.101.117.67.443 > 10.0.2.15.38058: Flags [P.], seq 40934:42308, ack 867, win 65535, length 1374
19:30:51.655104 IP 10.0.2.15.38058 > 151.101.117.67.443: Flags [.], ack 40934, win 55480, length 0
19:30:51.656215 IP 151.101.117.67.443 > 10.0.2.15.38058: Flags [P.], seq 42308:45056, ack 867, win 65535, length 2748
19:30:51.656294 IP 10.0.2.15.38058 > 151.101.117.67.443: Flags [.], ack 45056, win 62780, length 0
19:30:51.657191 IP 151.101.117.67.443 > 10.0.2.15.38058: Flags [P.], seq 45056:49178, ack 867, win 65535, length 4122
19:30:51.657256 IP 10.0.2.15.38058 > 151.101.117.67.443: Flags [.], ack 49178, win 61320, length 0
19:30:51.659686 IP 151.101.117.67.443 > 10.0.2.15.38058: Flags [P.], seq 49178:56048, ack 867, win 65535, length 6870
19:30:51.659775 IP 10.0.2.15.38058 > 151.101.117.67.443: Flags [.], ack 56048, win 59860, length 0
19:30:51.661189 IP 151.101.117.67.443 > 10.0.2.15.38058: Flags [P.], seq 56048:61544, ack 867, win 65535, length 5496
19:30:51.661191 IP 151.101.117.67.443 > 10.0.2.15.38058: Flags [P.], seq 61544:65666, ack 867, win 65535, length 4122
19:30:51.661211 IP 10.0.2.15.38058 > 151.101.117.67.443: Flags [.], ack 61544, win 61320, length 0
19:30:51.661401 IP 10.0.2.15.38058 > 151.101.117.67.443: Flags [.], ack 65666, win 58400, length 0
19:30:51.662053 IP 151.101.117.67.443 > 10.0.2.15.38058: Flags [P.], seq 65666:69788, ack 867, win 65535, length 4122
19:30:51.662055 IP 151.101.117.67.443 > 10.0.2.15.38058: Flags [P.], seq 69788:71162, ack 867, win 65535, length 1374
19:30:51.662120 IP 10.0.2.15.38058 > 151.101.117.67.443: Flags [.], ack 69788, win 61320, length 0
19:30:51.662865 IP 151.101.117.67.443 > 10.0.2.15.38058: Flags [P.], seq 71162:76658, ack 867, win 65535, length 5496
19:30:51.662882 IP 10.0.2.15.38058 > 151.101.117.67.443: Flags [.], ack 76658, win 65535, length 0
19:30:51.663089 IP 151.101.117.67.443 > 10.0.2.15.38058: Flags [P.], seq 76658:79406, ack 867, win 65535, length 2748
19:30:51.663139 IP 10.0.2.15.38058 > 151.101.117.67.443: Flags [.], ack 79406, win 65535, length 0
19:30:51.664221 IP 151.101.117.67.443 > 10.0.2.15.38058: Flags [P.], seq 79406:84902, ack 867, win 65535, length 5496
19:30:51.664239 IP 10.0.2.15.38058 > 151.101.117.67.443: Flags [.], ack 84902, win 65535, length 0
19:30:51.664373 IP 151.101.117.67.443 > 10.0.2.15.38058: Flags [P.], seq 84902:87650, ack 867, win 65535, length 2748
19:30:51.664381 IP 10.0.2.15.38058 > 151.101.117.67.443: Flags [.], ack 87650, win 65535, length 0
19:30:51.665120 IP 151.101.117.67.443 > 10.0.2.15.38058: Flags [P.], seq 87650:91772, ack 867, win 65535, length 4122
19:30:51.665129 IP 10.0.2.15.38058 > 151.101.117.67.443: Flags [.], ack 91772, win 65535, length 0
19:30:51.666119 IP 151.101.117.67.443 > 10.0.2.15.38058: Flags [P.], seq 91772:95894, ack 867, win 65535, length 4122
19:30:51.666121 IP 151.101.117.67.443 > 10.0.2.15.38058: Flags [P.], seq 95894:100016, ack 867, win 65535, length 4122
19:30:51.666140 IP 10.0.2.15.38058 > 151.101.117.67.443: Flags [.], ack 95894, win 65535, length 0
19:30:51.666168 IP 10.0.2.15.38058 > 151.101.117.67.443: Flags [.], ack 100016, win 65535, length 0
19:30:51.666282 IP 151.101.117.67.443 > 10.0.2.15.38058: Flags [P.], seq 100016:101390, ack 867, win 65535, length 1374
19:30:51.667420 IP 151.101.117.67.443 > 10.0.2.15.38058: Flags [P.], seq 101390:108260, ack 867, win 65535, length 6870
19:30:51.667436 IP 10.0.2.15.38058 > 151.101.117.67.443: Flags [.], ack 108260, win 65535, length 0
19:30:51.668732 IP 151.101.117.67.443 > 10.0.2.15.38058: Flags [P.], seq 108260:117878, ack 867, win 65535, length 9618
19:30:51.668735 IP 151.101.117.67.443 > 10.0.2.15.38058: Flags [P.], seq 117878:119252, ack 867, win 65535, length 1374
19:30:51.668754 IP 10.0.2.15.38058 > 151.101.117.67.443: Flags [.], ack 117878, win 65535, length 0
19:30:51.669940 IP 151.101.117.67.443 > 10.0.2.15.38058: Flags [P.], seq 119252:126122, ack 867, win 65535, length 6870
19:30:51.669951 IP 10.0.2.15.38058 > 151.101.117.67.443: Flags [.], ack 126122, win 65535, length 0
19:30:51.671336 IP 151.101.117.67.443 > 10.0.2.15.38058: Flags [P.], seq 126122:128870, ack 867, win 65535, length 2748
19:30:51.671352 IP 10.0.2.15.38058 > 151.101.117.67.443: Flags [.], ack 128870, win 65535, length 0
19:30:51.672548 IP 151.101.117.67.443 > 10.0.2.15.38058: Flags [P.], seq 128870:138488, ack 867, win 65535, length 9618
19:30:51.672564 IP 10.0.2.15.38058 > 151.101.117.67.443: Flags [.], ack 138488, win 65535, length 0
19:30:51.672843 IP 151.101.117.67.443 > 10.0.2.15.38058: Flags [P.], seq 138488:139862, ack 867, win 65535, length 1374
19:30:51.674045 IP 151.101.117.67.443 > 10.0.2.15.38058: Flags [P.], seq 139862:146732, ack 867, win 65535, length 6870
19:30:51.674046 IP 151.101.117.67.443 > 10.0.2.15.38058: Flags [P.], seq 146732:148106, ack 867, win 65535, length 1374
19:30:51.674047 IP 151.101.117.67.443 > 10.0.2.15.38058: Flags [P.], seq 148106:150854, ack 867, win 65535, length 2748
19:30:51.674064 IP 10.0.2.15.38058 > 151.101.117.67.443: Flags [.], ack 146732, win 65535, length 0
19:30:51.674101 IP 10.0.2.15.38058 > 151.101.117.67.443: Flags [.], ack 150854, win 65535, length 0
19:30:51.674956 IP 151.101.117.67.443 > 10.0.2.15.38058: Flags [P.], seq 150854:157724, ack 867, win 65535, length 6870
19:30:51.674968 IP 10.0.2.15.38058 > 151.101.117.67.443: Flags [.], ack 157724, win 65535, length 0
19:30:51.677686 IP 151.101.117.67.443 > 10.0.2.15.38058: Flags [P.], seq 157724:160472, ack 867, win 65535, length 2748
19:30:51.677700 IP 10.0.2.15.38058 > 151.101.117.67.443: Flags [.], ack 160472, win 65535, length 0
19:30:51.680450 IP 151.101.117.67.443 > 10.0.2.15.38058: Flags [P.], seq 160472:201692, ack 867, win 65535, length 41220
19:30:51.680482 IP 10.0.2.15.38058 > 151.101.117.67.443: Flags [.], ack 201692, win 65535, length 0
19:30:51.680836 IP 151.101.117.67.443 > 10.0.2.15.38058: Flags [.], seq 201692:216292, ack 867, win 65535, length 14600
19:30:51.680885 IP 10.0.2.15.38058 > 151.101.117.67.443: Flags [.], ack 216292, win 65535, length 0
19:30:51.681251 IP 151.101.117.67.443 > 10.0.2.15.38058: Flags [P.], seq 216292:216806, ack 867, win 65535, length 514
19:30:51.681254 IP 151.101.117.67.443 > 10.0.2.15.38058: Flags [P.], seq 216806:222302, ack 867, win 65535, length 5496
19:30:51.681277 IP 10.0.2.15.38058 > 151.101.117.67.443: Flags [.], ack 222302, win 65535, length 0
19:30:51.681429 IP 151.101.117.67.443 > 10.0.2.15.38058: Flags [P.], seq 222302:226424, ack 867, win 65535, length 4122
19:30:51.681436 IP 10.0.2.15.38058 > 151.101.117.67.443: Flags [.], ack 226424, win 65535, length 0
19:30:51.683373 IP 151.101.117.67.443 > 10.0.2.15.38058: Flags [P.], seq 226424:248408, ack 867, win 65535, length 21984
19:30:51.683388 IP 10.0.2.15.38058 > 151.101.117.67.443: Flags [.], ack 248408, win 65535, length 0
19:30:51.683423 IP 151.101.117.67.443 > 10.0.2.15.38058: Flags [P.], seq 248408:253904, ack 867, win 65535, length 5496
19:30:51.683424 IP 151.101.117.67.443 > 10.0.2.15.38058: Flags [P.], seq 253904:256652, ack 867, win 65535, length 2748
19:30:51.683425 IP 151.101.117.67.443 > 10.0.2.15.38058: Flags [P.], seq 256652:259400, ack 867, win 65535, length 2748
19:30:51.683432 IP 10.0.2.15.38058 > 151.101.117.67.443: Flags [.], ack 253904, win 65535, length 0
19:30:51.683439 IP 10.0.2.15.38058 > 151.101.117.67.443: Flags [.], ack 256652, win 65535, length 0
19:30:51.683444 IP 10.0.2.15.38058 > 151.101.117.67.443: Flags [.], ack 259400, win 65535, length 0
19:30:51.683759 IP 151.101.117.67.443 > 10.0.2.15.38058: Flags [P.], seq 259400:269018, ack 867, win 65535, length 9618
19:30:51.683769 IP 10.0.2.15.38058 > 151.101.117.67.443: Flags [.], ack 269018, win 65535, length 0
19:30:51.684131 IP 151.101.117.67.443 > 10.0.2.15.38058: Flags [P.], seq 269018:271766, ack 867, win 65535, length 2748
19:30:51.684133 IP 151.101.117.67.443 > 10.0.2.15.38058: Flags [P.], seq 271766:277262, ack 867, win 65535, length 5496
19:30:51.684146 IP 10.0.2.15.38058 > 151.101.117.67.443: Flags [.], ack 271766, win 65535, length 0
19:30:51.684163 IP 10.0.2.15.38058 > 151.101.117.67.443: Flags [.], ack 277262, win 65535, length 0
19:30:51.684823 IP 151.101.117.67.443 > 10.0.2.15.38058: Flags [P.], seq 277262:281384, ack 867, win 65535, length 4122
19:30:51.684827 IP 151.101.117.67.443 > 10.0.2.15.38058: Flags [P.], seq 281384:286880, ack 867, win 65535, length 5496
19:30:51.684845 IP 10.0.2.15.38058 > 151.101.117.67.443: Flags [.], ack 281384, win 65535, length 0
19:30:51.684865 IP 10.0.2.15.38058 > 151.101.117.67.443: Flags [.], ack 286880, win 65535, length 0
19:30:51.686462 IP 151.101.117.67.443 > 10.0.2.15.38058: Flags [P.], seq 286880:295124, ack 867, win 65535, length 8244
19:30:51.686464 IP 151.101.117.67.443 > 10.0.2.15.38058: Flags [P.], seq 295124:297872, ack 867, win 65535, length 2748
19:30:51.686894 IP 151.101.117.67.443 > 10.0.2.15.38058: Flags [P.], seq 297872:303368, ack 867, win 65535, length 5496
19:30:51.686896 IP 151.101.117.67.443 > 10.0.2.15.38058: Flags [P.], seq 303368:304742, ack 867, win 65535, length 1374
19:30:51.687294 IP 151.101.117.67.443 > 10.0.2.15.38058: Flags [P.], seq 304742:308864, ack 867, win 65535, length 4122
19:30:51.687296 IP 151.101.117.67.443 > 10.0.2.15.38058: Flags [P.], seq 308864:310238, ack 867, win 65535, length 1374
19:30:51.687297 IP 151.101.117.67.443 > 10.0.2.15.38058: Flags [P.], seq 310238:314360, ack 867, win 65535, length 4122
19:30:51.687569 IP 151.101.117.67.443 > 10.0.2.15.38058: Flags [P.], seq 314360:317108, ack 867, win 65535, length 2748
19:30:51.687570 IP 151.101.117.67.443 > 10.0.2.15.38058: Flags [P.], seq 317108:318482, ack 867, win 65535, length 1374
19:30:51.687614 IP 151.101.117.67.443 > 10.0.2.15.38058: Flags [P.], seq 318482:322604, ack 867, win 65535, length 4122
19:30:51.689275 IP 10.0.2.15.38058 > 151.101.117.67.443: Flags [.], ack 310238, win 65535, length 0
19:30:51.689503 IP 10.0.2.15.38058 > 151.101.117.67.443: Flags [.], ack 322604, win 65535, length 0
19:30:51.689782 IP 151.101.117.67.443 > 10.0.2.15.38058: Flags [P.], seq 322604:345962, ack 867, win 65535, length 23358
19:30:51.689929 IP 151.101.117.67.443 > 10.0.2.15.38058: Flags [P.], seq 345962:351458, ack 867, win 65535, length 5496
19:30:51.691892 IP 151.101.117.67.443 > 10.0.2.15.38058: Flags [P.], seq 351458:355580, ack 867, win 65535, length 4122
19:30:51.692429 IP 10.0.2.15.38058 > 151.101.117.67.443: Flags [.], ack 345962, win 65535, length 0
19:30:51.692856 IP 151.101.117.67.443 > 10.0.2.15.38058: Flags [P.], seq 355580:358328, ack 867, win 65535, length 2748
19:30:51.692985 IP 10.0.2.15.38058 > 151.101.117.67.443: Flags [.], ack 355580, win 65535, length 0
19:30:51.693361 IP 10.0.2.15.38058 > 151.101.117.67.443: Flags [.], ack 358328, win 65535, length 0
19:30:51.694023 IP 151.101.117.67.443 > 10.0.2.15.38058: Flags [P.], seq 358328:359702, ack 867, win 65535, length 1374
19:30:51.695106 IP 151.101.117.67.443 > 10.0.2.15.38058: Flags [P.], seq 359702:366572, ack 867, win 65535, length 6870
19:30:51.695179 IP 10.0.2.15.38058 > 151.101.117.67.443: Flags [.], ack 366572, win 65535, length 0
19:30:51.695350 IP 151.101.117.67.443 > 10.0.2.15.38058: Flags [P.], seq 366572:370694, ack 867, win 65535, length 4122
19:30:51.695359 IP 10.0.2.15.38058 > 151.101.117.67.443: Flags [.], ack 370694, win 65535, length 0
19:30:51.695613 IP 151.101.117.67.443 > 10.0.2.15.38058: Flags [P.], seq 370694:373442, ack 867, win 65535, length 2748
19:30:51.695614 IP 151.101.117.67.443 > 10.0.2.15.38058: Flags [.], seq 373442:376362, ack 867, win 65535, length 2920
19:30:51.695626 IP 10.0.2.15.38058 > 151.101.117.67.443: Flags [.], ack 373442, win 65535, length 0
19:30:51.695745 IP 10.0.2.15.38058 > 151.101.117.67.443: Flags [.], ack 376362, win 65535, length 0
19:30:51.696110 IP 151.101.117.67.443 > 10.0.2.15.38058: Flags [P.], seq 376362:378938, ack 867, win 65535, length 2576
19:30:51.696111 IP 151.101.117.67.443 > 10.0.2.15.38058: Flags [P.], seq 378938:383060, ack 867, win 65535, length 4122
19:30:51.696112 IP 151.101.117.67.443 > 10.0.2.15.38058: Flags [P.], seq 383060:385808, ack 867, win 65535, length 2748
19:30:51.696112 IP 151.101.117.67.443 > 10.0.2.15.38058: Flags [P.], seq 385808:388556, ack 867, win 65535, length 2748
19:30:51.696126 IP 10.0.2.15.38058 > 151.101.117.67.443: Flags [.], ack 378938, win 65535, length 0
19:30:51.696144 IP 10.0.2.15.38058 > 151.101.117.67.443: Flags [.], ack 383060, win 65535, length 0
19:30:51.696157 IP 10.0.2.15.38058 > 151.101.117.67.443: Flags [.], ack 385808, win 65535, length 0
19:30:51.696167 IP 10.0.2.15.38058 > 151.101.117.67.443: Flags [.], ack 388556, win 65535, length 0
19:30:51.696190 IP 151.101.117.67.443 > 10.0.2.15.38058: Flags [P.], seq 388556:392678, ack 867, win 65535, length 4122
19:30:51.696191 IP 151.101.117.67.443 > 10.0.2.15.38058: Flags [P.], seq 392678:394052, ack 867, win 65535, length 1374
19:30:51.696197 IP 10.0.2.15.38058 > 151.101.117.67.443: Flags [.], ack 392678, win 65535, length 0
19:30:51.700669 IP 151.101.117.67.443 > 10.0.2.15.38058: Flags [P.], seq 394052:400922, ack 867, win 65535, length 6870
19:30:51.700687 IP 10.0.2.15.38058 > 151.101.117.67.443: Flags [.], ack 400922, win 65535, length 0
19:30:51.703723 IP 151.101.117.67.443 > 10.0.2.15.38058: Flags [P.], seq 400922:435272, ack 867, win 65535, length 34350
19:30:51.703742 IP 10.0.2.15.38058 > 151.101.117.67.443: Flags [.], ack 435272, win 65535, length 0
19:30:51.704003 IP 151.101.117.67.443 > 10.0.2.15.38058: Flags [.], seq 435272:444032, ack 867, win 65535, length 8760
19:30:51.704012 IP 10.0.2.15.38058 > 151.101.117.67.443: Flags [.], ack 444032, win 65535, length 0
19:30:51.704388 IP 151.101.117.67.443 > 10.0.2.15.38058: Flags [P.], seq 444032:477866, ack 867, win 65535, length 33834
19:30:51.704401 IP 10.0.2.15.38058 > 151.101.117.67.443: Flags [.], ack 477866, win 65535, length 0
19:30:51.704619 IP 151.101.117.67.443 > 10.0.2.15.38058: Flags [P.], seq 477866:488858, ack 867, win 65535, length 10992
19:30:51.704627 IP 10.0.2.15.38058 > 151.101.117.67.443: Flags [.], ack 488858, win 65535, length 0
19:30:51.705439 IP 151.101.117.67.443 > 10.0.2.15.38058: Flags [P.], seq 488858:495728, ack 867, win 65535, length 6870
19:30:51.705459 IP 10.0.2.15.38058 > 151.101.117.67.443: Flags [.], ack 495728, win 65535, length 0
19:30:51.705656 IP 151.101.117.67.443 > 10.0.2.15.38058: Flags [P.], seq 495728:499850, ack 867, win 65535, length 4122
19:30:51.705722 IP 10.0.2.15.38058 > 151.101.117.67.443: Flags [.], ack 499850, win 65535, length 0
19:30:51.705960 IP 151.101.117.67.443 > 10.0.2.15.38058: Flags [P.], seq 499850:502598, ack 867, win 65535, length 2748
19:30:51.705962 IP 151.101.117.67.443 > 10.0.2.15.38058: Flags [P.], seq 502598:505346, ack 867, win 65535, length 2748
19:30:51.705974 IP 10.0.2.15.38058 > 151.101.117.67.443: Flags [.], ack 502598, win 65535, length 0
19:30:51.706084 IP 10.0.2.15.38058 > 151.101.117.67.443: Flags [.], ack 505346, win 65535, length 0
19:30:51.706222 IP 151.101.117.67.443 > 10.0.2.15.38058: Flags [P.], seq 505346:506720, ack 867, win 65535, length 1374
19:30:51.706224 IP 151.101.117.67.443 > 10.0.2.15.38058: Flags [P.], seq 506720:510842, ack 867, win 65535, length 4122
19:30:51.706224 IP 151.101.117.67.443 > 10.0.2.15.38058: Flags [P.], seq 510842:512216, ack 867, win 65535, length 1374
19:30:51.706371 IP 10.0.2.15.38058 > 151.101.117.67.443: Flags [.], ack 510842, win 65535, length 0
19:30:51.706609 IP 151.101.117.67.443 > 10.0.2.15.38058: Flags [P.], seq 512216:514964, ack 867, win 65535, length 2748
19:30:51.706611 IP 151.101.117.67.443 > 10.0.2.15.38058: Flags [P.], seq 514964:520460, ack 867, win 65535, length 5496
19:30:51.706622 IP 10.0.2.15.38058 > 151.101.117.67.443: Flags [.], ack 514964, win 65535, length 0
19:30:51.706637 IP 10.0.2.15.38058 > 151.101.117.67.443: Flags [.], ack 520460, win 65535, length 0
19:30:51.707314 IP 151.101.117.67.443 > 10.0.2.15.38058: Flags [P.], seq 520460:527330, ack 867, win 65535, length 6870
19:30:51.707316 IP 151.101.117.67.443 > 10.0.2.15.38058: Flags [P.], seq 527330:530078, ack 867, win 65535, length 2748
19:30:51.707318 IP 151.101.117.67.443 > 10.0.2.15.38058: Flags [P.], seq 530078:535574, ack 867, win 65535, length 5496
19:30:51.707497 IP 10.0.2.15.38058 > 151.101.117.67.443: Flags [.], ack 527330, win 65535, length 0
19:30:51.707568 IP 10.0.2.15.38058 > 151.101.117.67.443: Flags [.], ack 530078, win 65535, length 0
19:30:51.707593 IP 10.0.2.15.38058 > 151.101.117.67.443: Flags [.], ack 535574, win 65535, length 0
19:30:51.707622 IP 151.101.117.67.443 > 10.0.2.15.38058: Flags [P.], seq 535574:538322, ack 867, win 65535, length 2748
19:30:51.707623 IP 151.101.117.67.443 > 10.0.2.15.38058: Flags [P.], seq 538322:541070, ack 867, win 65535, length 2748
19:30:51.707631 IP 10.0.2.15.38058 > 151.101.117.67.443: Flags [.], ack 538322, win 65535, length 0
19:30:51.707644 IP 10.0.2.15.38058 > 151.101.117.67.443: Flags [.], ack 541070, win 65535, length 0
19:30:51.707939 IP 151.101.117.67.443 > 10.0.2.15.38058: Flags [P.], seq 541070:542444, ack 867, win 65535, length 1374
19:30:51.707941 IP 151.101.117.67.443 > 10.0.2.15.38058: Flags [P.], seq 542444:547940, ack 867, win 65535, length 5496
19:30:51.707957 IP 10.0.2.15.38058 > 151.101.117.67.443: Flags [.], ack 547940, win 65535, length 0
19:30:51.708214 IP 151.101.117.67.443 > 10.0.2.15.38058: Flags [P.], seq 547940:550688, ack 867, win 65535, length 2748
19:30:51.708227 IP 10.0.2.15.38058 > 151.101.117.67.443: Flags [.], ack 550688, win 65535, length 0
19:30:51.708427 IP 151.101.117.67.443 > 10.0.2.15.38058: Flags [P.], seq 550688:553436, ack 867, win 65535, length 2748
19:30:51.708442 IP 10.0.2.15.38058 > 151.101.117.67.443: Flags [.], ack 553436, win 65535, length 0
19:30:51.708525 IP 151.101.117.67.443 > 10.0.2.15.38058: Flags [P.], seq 553436:558932, ack 867, win 65535, length 5496
19:30:51.708532 IP 10.0.2.15.38058 > 151.101.117.67.443: Flags [.], ack 558932, win 65535, length 0
19:30:51.708901 IP 151.101.117.67.443 > 10.0.2.15.38058: Flags [P.], seq 558932:565802, ack 867, win 65535, length 6870
19:30:51.708916 IP 10.0.2.15.38058 > 151.101.117.67.443: Flags [.], ack 565802, win 65535, length 0
19:30:51.709030 IP 151.101.117.67.443 > 10.0.2.15.38058: Flags [P.], seq 565802:567176, ack 867, win 65535, length 1374
19:30:51.709875 IP 151.101.117.67.443 > 10.0.2.15.38058: Flags [P.], seq 567176:569924, ack 867, win 65535, length 2748
19:30:51.709878 IP 151.101.117.67.443 > 10.0.2.15.38058: Flags [P.], seq 569924:574046, ack 867, win 65535, length 4122
19:30:51.709900 IP 10.0.2.15.38058 > 151.101.117.67.443: Flags [.], ack 569924, win 65535, length 0
19:30:51.710020 IP 10.0.2.15.38058 > 151.101.117.67.443: Flags [.], ack 574046, win 65535, length 0
19:30:51.710226 IP 151.101.117.67.443 > 10.0.2.15.38058: Flags [P.], seq 574046:575420, ack 867, win 65535, length 1374
19:30:51.710228 IP 151.101.117.67.443 > 10.0.2.15.38058: Flags [P.], seq 575420:579542, ack 867, win 65535, length 4122
19:30:51.710229 IP 151.101.117.67.443 > 10.0.2.15.38058: Flags [P.], seq 579542:583664, ack 867, win 65535, length 4122
19:30:51.710255 IP 10.0.2.15.38058 > 151.101.117.67.443: Flags [.], ack 579542, win 65535, length 0
19:30:51.710268 IP 10.0.2.15.38058 > 151.101.117.67.443: Flags [.], ack 583664, win 65535, length 0
19:30:51.710711 IP 151.101.117.67.443 > 10.0.2.15.38058: Flags [P.], seq 583664:589160, ack 867, win 65535, length 5496
19:30:51.710713 IP 151.101.117.67.443 > 10.0.2.15.38058: Flags [P.], seq 589160:591908, ack 867, win 65535, length 2748
19:30:51.710783 IP 10.0.2.15.38058 > 151.101.117.67.443: Flags [.], ack 589160, win 65535, length 0
19:30:51.710808 IP 10.0.2.15.38058 > 151.101.117.67.443: Flags [.], ack 591908, win 65535, length 0
19:30:51.711111 IP 151.101.117.67.443 > 10.0.2.15.38058: Flags [P.], seq 591908:593282, ack 867, win 65535, length 1374
19:30:51.711113 IP 151.101.117.67.443 > 10.0.2.15.38058: Flags [P.], seq 593282:597404, ack 867, win 65535, length 4122
19:30:51.711114 IP 151.101.117.67.443 > 10.0.2.15.38058: Flags [P.], seq 597404:600152, ack 867, win 65535, length 2748
19:30:51.711132 IP 10.0.2.15.38058 > 151.101.117.67.443: Flags [.], ack 597404, win 65535, length 0
19:30:51.711180 IP 10.0.2.15.38058 > 151.101.117.67.443: Flags [.], ack 600152, win 65535, length 0
19:30:51.711328 IP 151.101.117.67.443 > 10.0.2.15.38058: Flags [P.], seq 600152:601526, ack 867, win 65535, length 1374
19:30:51.711482 IP 151.101.117.67.443 > 10.0.2.15.38058: Flags [P.], seq 601526:607022, ack 867, win 65535, length 5496
19:30:51.711490 IP 10.0.2.15.38058 > 151.101.117.67.443: Flags [.], ack 607022, win 65535, length 0
19:30:51.711584 IP 151.101.117.67.443 > 10.0.2.15.38058: Flags [P.], seq 607022:609770, ack 867, win 65535, length 2748
19:30:51.711592 IP 10.0.2.15.38058 > 151.101.117.67.443: Flags [.], ack 609770, win 65535, length 0
19:30:51.711764 IP 151.101.117.67.443 > 10.0.2.15.38058: Flags [.], seq 609770:612690, ack 867, win 65535, length 2920
19:30:51.711773 IP 10.0.2.15.38058 > 151.101.117.67.443: Flags [.], ack 612690, win 65535, length 0
19:30:51.711881 IP 151.101.117.67.443 > 10.0.2.15.38058: Flags [P.], seq 612690:615266, ack 867, win 65535, length 2576
19:30:51.711889 IP 10.0.2.15.38058 > 151.101.117.67.443: Flags [.], ack 615266, win 65535, length 0
19:30:51.712061 IP 151.101.117.67.443 > 10.0.2.15.38058: Flags [P.], seq 615266:618014, ack 867, win 65535, length 2748
19:30:51.712171 IP 151.101.117.67.443 > 10.0.2.15.38058: Flags [P.], seq 618014:620762, ack 867, win 65535, length 2748
19:30:51.712352 IP 151.101.117.67.443 > 10.0.2.15.38058: Flags [P.], seq 620762:623510, ack 867, win 65535, length 2748
19:30:51.712643 IP 151.101.117.67.443 > 10.0.2.15.38058: Flags [P.], seq 623510:626258, ack 867, win 65535, length 2748
19:30:51.712645 IP 151.101.117.67.443 > 10.0.2.15.38058: Flags [P.], seq 626258:631754, ack 867, win 65535, length 5496
19:30:51.712832 IP 10.0.2.15.38058 > 151.101.117.67.443: Flags [.], ack 631754, win 65535, length 0
19:30:51.713172 IP 151.101.117.67.443 > 10.0.2.15.38058: Flags [P.], seq 631754:634502, ack 867, win 65535, length 2748
19:30:51.713174 IP 151.101.117.67.443 > 10.0.2.15.38058: Flags [P.], seq 634502:637250, ack 867, win 65535, length 2748
19:30:51.713175 IP 151.101.117.67.443 > 10.0.2.15.38058: Flags [P.], seq 637250:639998, ack 867, win 65535, length 2748
19:30:51.713435 IP 151.101.117.67.443 > 10.0.2.15.38058: Flags [P.], seq 639998:641372, ack 867, win 65535, length 1374
19:30:51.713437 IP 151.101.117.67.443 > 10.0.2.15.38058: Flags [P.], seq 641372:645494, ack 867, win 65535, length 4122
19:30:51.714051 IP 10.0.2.15.38058 > 151.101.117.67.443: Flags [.], ack 645494, win 65535, length 0
19:30:51.714322 IP 151.101.117.67.443 > 10.0.2.15.38058: Flags [P.], seq 645494:649616, ack 867, win 65535, length 4122
19:30:51.714337 IP 10.0.2.15.38058 > 151.101.117.67.443: Flags [.], ack 649616, win 65535, length 0
19:30:51.714615 IP 151.101.117.67.443 > 10.0.2.15.38058: Flags [P.], seq 649616:655112, ack 867, win 65535, length 5496
19:30:51.714617 IP 151.101.117.67.443 > 10.0.2.15.38058: Flags [P.], seq 655112:657860, ack 867, win 65535, length 2748
19:30:51.714653 IP 10.0.2.15.38058 > 151.101.117.67.443: Flags [.], ack 657860, win 65535, length 0
19:30:51.714909 IP 151.101.117.67.443 > 10.0.2.15.38058: Flags [P.], seq 657860:660608, ack 867, win 65535, length 2748
19:30:51.714910 IP 151.101.117.67.443 > 10.0.2.15.38058: Flags [P.], seq 660608:661982, ack 867, win 65535, length 1374
19:30:51.715095 IP 151.101.117.67.443 > 10.0.2.15.38058: Flags [P.], seq 661982:667478, ack 867, win 65535, length 5496
19:30:51.715285 IP 151.101.117.67.443 > 10.0.2.15.38058: Flags [P.], seq 667478:670226, ack 867, win 65535, length 2748
19:30:51.715285 IP 151.101.117.67.443 > 10.0.2.15.38058: Flags [P.], seq 670226:671600, ack 867, win 65535, length 1374
19:30:51.715346 IP 10.0.2.15.38058 > 151.101.117.67.443: Flags [.], ack 671600, win 65535, length 0
19:30:51.715426 IP 151.101.117.67.443 > 10.0.2.15.38058: Flags [P.], seq 671600:675722, ack 867, win 65535, length 4122
19:30:51.715461 IP 10.0.2.15.38058 > 151.101.117.67.443: Flags [.], ack 675722, win 65535, length 0
19:30:51.715656 IP 151.101.117.67.443 > 10.0.2.15.38058: Flags [P.], seq 675722:678470, ack 867, win 65535, length 2748
19:30:51.715657 IP 151.101.117.67.443 > 10.0.2.15.38058: Flags [P.], seq 678470:679844, ack 867, win 65535, length 1374
19:30:51.715722 IP 10.0.2.15.38058 > 151.101.117.67.443: Flags [.], ack 679844, win 65535, length 0
19:30:51.715828 IP 151.101.117.67.443 > 10.0.2.15.38058: Flags [P.], seq 679844:683966, ack 867, win 65535, length 4122
19:30:51.715856 IP 10.0.2.15.38058 > 151.101.117.67.443: Flags [.], ack 683966, win 65535, length 0
19:30:51.716026 IP 151.101.117.67.443 > 10.0.2.15.38058: Flags [P.], seq 683966:686714, ack 867, win 65535, length 2748
19:30:51.716144 IP 151.101.117.67.443 > 10.0.2.15.38058: Flags [P.], seq 686714:689462, ack 867, win 65535, length 2748
19:30:51.716146 IP 151.101.117.67.443 > 10.0.2.15.38058: Flags [P.], seq 689462:690836, ack 867, win 65535, length 1374
19:30:51.716207 IP 10.0.2.15.38058 > 151.101.117.67.443: Flags [.], ack 690836, win 65535, length 0
19:30:51.716299 IP 151.101.117.67.443 > 10.0.2.15.38058: Flags [P.], seq 690836:692210, ack 867, win 65535, length 1374
19:30:51.716489 IP 151.101.117.67.443 > 10.0.2.15.38058: Flags [P.], seq 692210:694958, ack 867, win 65535, length 2748
19:30:51.716530 IP 10.0.2.15.38058 > 151.101.117.67.443: Flags [.], ack 694958, win 65535, length 0
19:30:51.716737 IP 151.101.117.67.443 > 10.0.2.15.38058: Flags [P.], seq 694958:697706, ack 867, win 65535, length 2748
19:30:51.716758 IP 10.0.2.15.38058 > 151.101.117.67.443: Flags [.], ack 697706, win 65535, length 0
19:30:51.717016 IP 151.101.117.67.443 > 10.0.2.15.38058: Flags [P.], seq 697706:704576, ack 867, win 65535, length 6870
19:30:51.717018 IP 151.101.117.67.443 > 10.0.2.15.38058: Flags [.], seq 704576:706036, ack 867, win 65535, length 1460
19:30:51.717120 IP 151.101.117.67.443 > 10.0.2.15.38058: Flags [P.], seq 706036:708698, ack 867, win 65535, length 2662
19:30:51.717258 IP 151.101.117.67.443 > 10.0.2.15.38058: Flags [P.], seq 708698:711446, ack 867, win 65535, length 2748
19:30:51.717356 IP 151.101.117.67.443 > 10.0.2.15.38058: Flags [P.], seq 711446:714194, ack 867, win 65535, length 2748
19:30:51.717554 IP 151.101.117.67.443 > 10.0.2.15.38058: Flags [P.], seq 714194:716942, ack 867, win 65535, length 2748
19:30:51.717653 IP 151.101.117.67.443 > 10.0.2.15.38058: Flags [P.], seq 716942:719690, ack 867, win 65535, length 2748
19:30:51.718130 IP 151.101.117.67.443 > 10.0.2.15.38058: Flags [P.], seq 719690:723812, ack 867, win 65535, length 4122
19:30:51.719004 IP 151.101.117.67.443 > 10.0.2.15.38058: Flags [P.], seq 723812:730682, ack 867, win 65535, length 6870
19:30:51.721101 IP 10.0.2.15.38058 > 151.101.117.67.443: Flags [.], ack 730682, win 65535, length 0
19:30:51.721507 IP 151.101.117.67.443 > 10.0.2.15.38058: Flags [.], seq 730682:748202, ack 867, win 65535, length 17520
19:30:51.721693 IP 151.101.117.67.443 > 10.0.2.15.38058: Flags [P.], seq 748202:759536, ack 867, win 65535, length 11334
19:30:51.721996 IP 151.101.117.67.443 > 10.0.2.15.38058: Flags [P.], seq 759536:766406, ack 867, win 65535, length 6870
19:30:51.723154 IP 10.0.2.15.38058 > 151.101.117.67.443: Flags [.], ack 766406, win 65535, length 0
19:30:51.723583 IP 151.101.117.67.443 > 10.0.2.15.38058: Flags [.], seq 766406:781006, ack 867, win 65535, length 14600
19:30:51.723597 IP 10.0.2.15.38058 > 151.101.117.67.443: Flags [.], ack 781006, win 65535, length 0
19:30:51.723942 IP 151.101.117.67.443 > 10.0.2.15.38058: Flags [P.], seq 781006:799382, ack 867, win 65535, length 18376
19:30:51.723959 IP 10.0.2.15.38058 > 151.101.117.67.443: Flags [.], ack 799382, win 65535, length 0
19:30:51.724007 IP 151.101.117.67.443 > 10.0.2.15.38058: Flags [P.], seq 799382:803504, ack 867, win 65535, length 4122
19:30:51.724009 IP 151.101.117.67.443 > 10.0.2.15.38058: Flags [P.], seq 803504:809000, ack 867, win 65535, length 5496
19:30:51.724082 IP 10.0.2.15.38058 > 151.101.117.67.443: Flags [.], ack 809000, win 65535, length 0
19:30:51.724249 IP 151.101.117.67.443 > 10.0.2.15.38058: Flags [P.], seq 809000:811748, ack 867, win 65535, length 2748
19:30:51.724279 IP 10.0.2.15.38058 > 151.101.117.67.443: Flags [.], ack 811748, win 65535, length 0
19:30:51.724388 IP 151.101.117.67.443 > 10.0.2.15.38058: Flags [P.], seq 811748:814496, ack 867, win 65535, length 2748
19:30:51.724454 IP 151.101.117.67.443 > 10.0.2.15.38058: Flags [P.], seq 814496:817244, ack 867, win 65535, length 2748
19:30:51.724514 IP 10.0.2.15.38058 > 151.101.117.67.443: Flags [.], ack 817244, win 65535, length 0
19:30:51.724626 IP 151.101.117.67.443 > 10.0.2.15.38058: Flags [P.], seq 817244:819992, ack 867, win 65535, length 2748
19:30:51.724650 IP 10.0.2.15.38058 > 151.101.117.67.443: Flags [.], ack 819992, win 65535, length 0
19:30:51.725071 IP 151.101.117.67.443 > 10.0.2.15.38058: Flags [P.], seq 819992:826862, ack 867, win 65535, length 6870
19:30:51.725072 IP 151.101.117.67.443 > 10.0.2.15.38058: Flags [P.], seq 826862:829610, ack 867, win 65535, length 2748
19:30:51.725100 IP 10.0.2.15.38058 > 151.101.117.67.443: Flags [.], ack 829610, win 65535, length 0
19:30:51.725362 IP 151.101.117.67.443 > 10.0.2.15.38058: Flags [P.], seq 829610:830984, ack 867, win 65535, length 1374
19:30:51.725557 IP 151.101.117.67.443 > 10.0.2.15.38058: Flags [P.], seq 830984:836480, ack 867, win 65535, length 5496
19:30:51.725558 IP 151.101.117.67.443 > 10.0.2.15.38058: Flags [P.], seq 836480:837854, ack 867, win 65535, length 1374
19:30:51.725570 IP 10.0.2.15.38058 > 151.101.117.67.443: Flags [.], ack 836480, win 65535, length 0
19:30:51.726332 IP 151.101.117.67.443 > 10.0.2.15.38058: Flags [P.], seq 837854:843350, ack 867, win 65535, length 5496
19:30:51.726350 IP 10.0.2.15.38058 > 151.101.117.67.443: Flags [.], ack 843350, win 65535, length 0
19:30:51.726459 IP 151.101.117.67.443 > 10.0.2.15.38058: Flags [P.], seq 843350:846098, ack 867, win 65535, length 2748
19:30:51.726469 IP 10.0.2.15.38058 > 151.101.117.67.443: Flags [.], ack 846098, win 65535, length 0
19:30:51.726592 IP 151.101.117.67.443 > 10.0.2.15.38058: Flags [P.], seq 846098:848846, ack 867, win 65535, length 2748
19:30:51.726599 IP 10.0.2.15.38058 > 151.101.117.67.443: Flags [.], ack 848846, win 65535, length 0
19:30:51.726773 IP 151.101.117.67.443 > 10.0.2.15.38058: Flags [P.], seq 848846:851594, ack 867, win 65535, length 2748
19:30:51.726785 IP 10.0.2.15.38058 > 151.101.117.67.443: Flags [.], ack 851594, win 65535, length 0
19:30:51.727180 IP 151.101.117.67.443 > 10.0.2.15.38058: Flags [P.], seq 851594:854342, ack 867, win 65535, length 2748
19:30:51.727182 IP 151.101.117.67.443 > 10.0.2.15.38058: Flags [P.], seq 854342:857090, ack 867, win 65535, length 2748
19:30:51.727183 IP 151.101.117.67.443 > 10.0.2.15.38058: Flags [P.], seq 857090:859838, ack 867, win 65535, length 2748
19:30:51.727199 IP 10.0.2.15.38058 > 151.101.117.67.443: Flags [.], ack 854342, win 65535, length 0
19:30:51.727219 IP 10.0.2.15.38058 > 151.101.117.67.443: Flags [.], ack 857090, win 65535, length 0
19:30:51.727232 IP 10.0.2.15.38058 > 151.101.117.67.443: Flags [.], ack 859838, win 65535, length 0
19:30:51.727362 IP 151.101.117.67.443 > 10.0.2.15.38058: Flags [P.], seq 859838:865334, ack 867, win 65535, length 5496
19:30:51.727370 IP 10.0.2.15.38058 > 151.101.117.67.443: Flags [.], ack 865334, win 65535, length 0
19:30:51.727675 IP 151.101.117.67.443 > 10.0.2.15.38058: Flags [P.], seq 865334:868082, ack 867, win 65535, length 2748
19:30:51.727676 IP 151.101.117.67.443 > 10.0.2.15.38058: Flags [P.], seq 868082:869456, ack 867, win 65535, length 1374
19:30:51.727798 IP 151.101.117.67.443 > 10.0.2.15.38058: Flags [P.], seq 869456:872204, ack 867, win 65535, length 2748
19:30:51.727868 IP 151.101.117.67.443 > 10.0.2.15.38058: Flags [P.], seq 872204:874952, ack 867, win 65535, length 2748
19:30:51.728021 IP 151.101.117.67.443 > 10.0.2.15.38058: Flags [P.], seq 874952:879074, ack 867, win 65535, length 4122
19:30:51.728209 IP 151.101.117.67.443 > 10.0.2.15.38058: Flags [P.], seq 879074:881822, ack 867, win 65535, length 2748
19:30:51.728346 IP 151.101.117.67.443 > 10.0.2.15.38058: Flags [P.], seq 881822:883196, ack 867, win 65535, length 1374
19:30:51.728390 IP 151.101.117.67.443 > 10.0.2.15.38058: Flags [P.], seq 883196:887318, ack 867, win 65535, length 4122
19:30:51.728589 IP 151.101.117.67.443 > 10.0.2.15.38058: Flags [P.], seq 887318:888692, ack 867, win 65535, length 1374
19:30:51.728745 IP 151.101.117.67.443 > 10.0.2.15.38058: Flags [P.], seq 888692:892814, ack 867, win 65535, length 4122
19:30:51.728994 IP 151.101.117.67.443 > 10.0.2.15.38058: Flags [P.], seq 892814:895562, ack 867, win 65535, length 2748
19:30:51.728996 IP 151.101.117.67.443 > 10.0.2.15.38058: Flags [P.], seq 895562:898310, ack 867, win 65535, length 2748
19:30:51.730274 IP 10.0.2.15.38058 > 151.101.117.67.443: Flags [.], ack 898310, win 65535, length 0
19:30:51.731054 IP 151.101.117.67.443 > 10.0.2.15.38058: Flags [P.], seq 898310:916172, ack 867, win 65535, length 17862
19:30:51.731235 IP 151.101.117.67.443 > 10.0.2.15.38058: Flags [P.], seq 916172:923042, ack 867, win 65535, length 6870
19:30:51.731237 IP 151.101.117.67.443 > 10.0.2.15.38058: Flags [P.], seq 923042:927164, ack 867, win 65535, length 4122
19:30:51.731463 IP 151.101.117.67.443 > 10.0.2.15.38058: Flags [P.], seq 927164:932660, ack 867, win 65535, length 5496
19:30:51.731702 IP 10.0.2.15.38058 > 151.101.117.67.443: Flags [.], ack 932660, win 65535, length 0
19:30:51.731993 IP 151.101.117.67.443 > 10.0.2.15.38058: Flags [P.], seq 932660:943652, ack 867, win 65535, length 10992
19:30:51.732005 IP 10.0.2.15.38058 > 151.101.117.67.443: Flags [.], ack 943652, win 65535, length 0
19:30:51.732032 IP 151.101.117.67.443 > 10.0.2.15.38058: Flags [P.], seq 943652:946400, ack 867, win 65535, length 2748
19:30:51.732033 IP 151.101.117.67.443 > 10.0.2.15.38058: Flags [P.], seq 946400:947774, ack 867, win 65535, length 1374
19:30:51.732077 IP 10.0.2.15.38058 > 151.101.117.67.443: Flags [.], ack 947774, win 65535, length 0
19:30:51.732279 IP 151.101.117.67.443 > 10.0.2.15.38058: Flags [P.], seq 947774:951896, ack 867, win 65535, length 4122
19:30:51.732287 IP 10.0.2.15.38058 > 151.101.117.67.443: Flags [.], ack 951896, win 65535, length 0
19:30:51.732529 IP 151.101.117.67.443 > 10.0.2.15.38058: Flags [P.], seq 951896:953270, ack 867, win 65535, length 1374
19:30:51.732530 IP 151.101.117.67.443 > 10.0.2.15.38058: Flags [P.], seq 953270:956018, ack 867, win 65535, length 2748
19:30:51.732541 IP 10.0.2.15.38058 > 151.101.117.67.443: Flags [.], ack 956018, win 65535, length 0
19:30:51.732783 IP 151.101.117.67.443 > 10.0.2.15.38058: Flags [P.], seq 956018:958766, ack 867, win 65535, length 2748
19:30:51.732784 IP 151.101.117.67.443 > 10.0.2.15.38058: Flags [P.], seq 958766:961514, ack 867, win 65535, length 2748
19:30:51.732792 IP 10.0.2.15.38058 > 151.101.117.67.443: Flags [.], ack 958766, win 65535, length 0
19:30:51.732828 IP 10.0.2.15.38058 > 151.101.117.67.443: Flags [.], ack 961514, win 65535, length 0
19:30:51.732948 IP 151.101.117.67.443 > 10.0.2.15.38058: Flags [P.], seq 961514:964262, ack 867, win 65535, length 2748
19:30:51.732953 IP 10.0.2.15.38058 > 151.101.117.67.443: Flags [.], ack 964262, win 65535, length 0
19:30:51.733723 IP 151.101.117.67.443 > 10.0.2.15.38058: Flags [P.], seq 964262:967010, ack 867, win 65535, length 2748
19:30:51.733725 IP 151.101.117.67.443 > 10.0.2.15.38058: Flags [P.], seq 967010:969758, ack 867, win 65535, length 2748

