19:29:51.171011 IP 10.0.2.15.35623 > 140.233.253.2.53: 28751+ A? www.cnn.com. (29)
19:29:51.171043 IP 10.0.2.15.35623 > 140.233.253.2.53: 35397+ AAAA? www.cnn.com. (29)
19:29:51.176351 IP 140.233.253.2.53 > 10.0.2.15.35623: 35397 2/0/0 CNAME turner-tls.map.fastly.net., AAAA 2a04:4e42:1c::323 (96)
19:29:51.178583 IP 140.233.253.2.53 > 10.0.2.15.35623: 28751 2/0/0 CNAME turner-tls.map.fastly.net., A 151.101.117.67 (84)
19:29:51.181139 IP 10.0.2.15.38030 > 151.101.117.67.443: Flags [S], seq 3636285355, win 64240, options [mss 1460,sackOK,TS val 1396710154 ecr 0,nop,wscale 6], length 0
19:29:51.195817 IP 151.101.117.67.443 > 10.0.2.15.38030: Flags [S.], seq 168960001, ack 3636285356, win 65535, options [mss 1460], length 0
19:29:51.195851 IP 10.0.2.15.38030 > 151.101.117.67.443: Flags [.], ack 1, win 64240, length 0
19:29:51.209816 IP 10.0.2.15.38030 > 151.101.117.67.443: Flags [P.], seq 1:518, ack 1, win 64240, length 517
19:29:51.210448 IP 151.101.117.67.443 > 10.0.2.15.38030: Flags [.], ack 518, win 65535, length 0
19:29:51.227947 IP 151.101.117.67.443 > 10.0.2.15.38030: Flags [.], seq 1:2921, ack 518, win 65535, length 2920
19:29:51.227969 IP 10.0.2.15.38030 > 151.101.117.67.443: Flags [.], ack 2921, win 62780, length 0
19:29:51.228185 IP 151.101.117.67.443 > 10.0.2.15.38030: Flags [P.], seq 2921:4123, ack 518, win 65535, length 1202
19:29:51.228242 IP 10.0.2.15.38030 > 151.101.117.67.443: Flags [.], ack 4123, win 61578, length 0
19:29:51.228603 IP 151.101.117.67.443 > 10.0.2.15.38030: Flags [P.], seq 4123:5064, ack 518, win 65535, length 941
19:29:51.228613 IP 10.0.2.15.38030 > 151.101.117.67.443: Flags [.], ack 5064, win 61320, length 0
19:29:51.231565 IP 10.0.2.15.38030 > 151.101.117.67.443: Flags [P.], seq 518:611, ack 5064, win 62780, length 93
19:29:51.231909 IP 151.101.117.67.443 > 10.0.2.15.38030: Flags [.], ack 611, win 65535, length 0
19:29:51.245160 IP 151.101.117.67.443 > 10.0.2.15.38030: Flags [P.], seq 5064:5115, ack 611, win 65535, length 51
19:29:51.245177 IP 10.0.2.15.38030 > 151.101.117.67.443: Flags [.], ack 5115, win 62780, length 0
19:29:51.245592 IP 10.0.2.15.38030 > 151.101.117.67.443: Flags [P.], seq 611:664, ack 5115, win 62780, length 53
19:29:51.245624 IP 10.0.2.15.38030 > 151.101.117.67.443: Flags [P.], seq 664:720, ack 5115, win 62780, length 56
19:29:51.245807 IP 151.101.117.67.443 > 10.0.2.15.38030: Flags [.], ack 664, win 65535, length 0
19:29:51.245826 IP 10.0.2.15.38030 > 151.101.117.67.443: Flags [P.], seq 720:762, ack 5115, win 62780, length 42
19:29:51.246185 IP 151.101.117.67.443 > 10.0.2.15.38030: Flags [.], ack 720, win 65535, length 0
19:29:51.246186 IP 151.101.117.67.443 > 10.0.2.15.38030: Flags [.], ack 762, win 65535, length 0
19:29:51.246250 IP 10.0.2.15.38030 > 151.101.117.67.443: Flags [P.], seq 762:829, ack 5115, win 62780, length 67
19:29:51.246430 IP 151.101.117.67.443 > 10.0.2.15.38030: Flags [.], ack 829, win 65535, length 0
19:29:51.259230 IP 151.101.117.67.443 > 10.0.2.15.38030: Flags [P.], seq 5115:5210, ack 829, win 65535, length 95
19:29:51.259246 IP 10.0.2.15.38030 > 151.101.117.67.443: Flags [.], ack 5210, win 62780, length 0
19:29:51.259501 IP 10.0.2.15.38030 > 151.101.117.67.443: Flags [P.], seq 829:867, ack 5210, win 62780, length 38
19:29:51.259783 IP 151.101.117.67.443 > 10.0.2.15.38030: Flags [.], ack 867, win 65535, length 0
19:29:51.261077 IP 151.101.117.67.443 > 10.0.2.15.38030: Flags [P.], seq 5210:12080, ack 867, win 65535, length 6870
19:29:51.261143 IP 10.0.2.15.38030 > 151.101.117.67.443: Flags [.], ack 12080, win 59860, length 0
19:29:51.262462 IP 151.101.117.67.443 > 10.0.2.15.38030: Flags [P.], seq 12080:14828, ack 867, win 65535, length 2748
19:29:51.262478 IP 10.0.2.15.38030 > 151.101.117.67.443: Flags [.], ack 14828, win 62780, length 0
19:29:51.263490 IP 151.101.117.67.443 > 10.0.2.15.38030: Flags [P.], seq 14828:21698, ack 867, win 65535, length 6870
19:29:51.263583 IP 10.0.2.15.38030 > 151.101.117.67.443: Flags [.], ack 21698, win 59860, length 0
19:29:51.265713 IP 151.101.117.67.443 > 10.0.2.15.38030: Flags [P.], seq 21698:27194, ack 867, win 65535, length 5496
19:29:51.265715 IP 151.101.117.67.443 > 10.0.2.15.38030: Flags [P.], seq 27194:29942, ack 867, win 65535, length 2748
19:29:51.265736 IP 10.0.2.15.38030 > 151.101.117.67.443: Flags [.], ack 27194, win 61320, length 0
19:29:51.266181 IP 10.0.2.15.38030 > 151.101.117.67.443: Flags [.], ack 29942, win 58572, length 0
19:29:51.266618 IP 151.101.117.67.443 > 10.0.2.15.38030: Flags [P.], seq 29942:34064, ack 867, win 65535, length 4122
19:29:51.266670 IP 10.0.2.15.38030 > 151.101.117.67.443: Flags [.], ack 34064, win 55480, length 0
19:29:51.267745 IP 151.101.117.67.443 > 10.0.2.15.38030: Flags [P.], seq 34064:38186, ack 867, win 65535, length 4122
19:29:51.267762 IP 10.0.2.15.38030 > 151.101.117.67.443: Flags [.], ack 38186, win 61320, length 0
19:29:51.268773 IP 151.101.117.67.443 > 10.0.2.15.38030: Flags [P.], seq 38186:42308, ack 867, win 65535, length 4122
19:29:51.268790 IP 10.0.2.15.38030 > 151.101.117.67.443: Flags [.], ack 42308, win 61320, length 0
19:29:51.269710 IP 151.101.117.67.443 > 10.0.2.15.38030: Flags [P.], seq 42308:45056, ack 867, win 65535, length 2748
19:29:51.269724 IP 10.0.2.15.38030 > 151.101.117.67.443: Flags [.], ack 45056, win 62780, length 0
19:29:51.270768 IP 151.101.117.67.443 > 10.0.2.15.38030: Flags [P.], seq 45056:49178, ack 867, win 65535, length 4122
19:29:51.270836 IP 10.0.2.15.38030 > 151.101.117.67.443: Flags [.], ack 49178, win 61320, length 0
19:29:51.272191 IP 151.101.117.67.443 > 10.0.2.15.38030: Flags [P.], seq 49178:54674, ack 867, win 65535, length 5496
19:29:51.272206 IP 10.0.2.15.38030 > 151.101.117.67.443: Flags [.], ack 54674, win 61320, length 0
19:29:51.273222 IP 151.101.117.67.443 > 10.0.2.15.38030: Flags [P.], seq 54674:56048, ack 867, win 65535, length 1374
19:29:51.274428 IP 151.101.117.67.443 > 10.0.2.15.38030: Flags [P.], seq 56048:60170, ack 867, win 65535, length 4122
19:29:51.274444 IP 10.0.2.15.38030 > 151.101.117.67.443: Flags [.], ack 60170, win 61320, length 0
19:29:51.275333 IP 151.101.117.67.443 > 10.0.2.15.38030: Flags [P.], seq 60170:64292, ack 867, win 65535, length 4122
19:29:51.275356 IP 10.0.2.15.38030 > 151.101.117.67.443: Flags [.], ack 64292, win 61320, length 0
19:29:51.276399 IP 151.101.117.67.443 > 10.0.2.15.38030: Flags [P.], seq 64292:67040, ack 867, win 65535, length 2748
19:29:51.276415 IP 10.0.2.15.38030 > 151.101.117.67.443: Flags [.], ack 67040, win 62780, length 0
19:29:51.277653 IP 151.101.117.67.443 > 10.0.2.15.38030: Flags [P.], seq 67040:72536, ack 867, win 65535, length 5496
19:29:51.277736 IP 10.0.2.15.38030 > 151.101.117.67.443: Flags [.], ack 72536, win 62780, length 0
19:29:51.279109 IP 151.101.117.67.443 > 10.0.2.15.38030: Flags [P.], seq 72536:76658, ack 867, win 65535, length 4122
19:29:51.279125 IP 10.0.2.15.38030 > 151.101.117.67.443: Flags [.], ack 76658, win 65535, length 0
19:29:51.279941 IP 151.101.117.67.443 > 10.0.2.15.38030: Flags [P.], seq 76658:82154, ack 867, win 65535, length 5496
19:29:51.280004 IP 10.0.2.15.38030 > 151.101.117.67.443: Flags [.], ack 82154, win 65535, length 0
19:29:51.281094 IP 151.101.117.67.443 > 10.0.2.15.38030: Flags [P.], seq 82154:87650, ack 867, win 65535, length 5496
19:29:51.281108 IP 10.0.2.15.38030 > 151.101.117.67.443: Flags [.], ack 87650, win 65535, length 0
19:29:51.282064 IP 151.101.117.67.443 > 10.0.2.15.38030: Flags [P.], seq 87650:91772, ack 867, win 65535, length 4122
19:29:51.282079 IP 10.0.2.15.38030 > 151.101.117.67.443: Flags [.], ack 91772, win 65535, length 0
19:29:51.283313 IP 151.101.117.67.443 > 10.0.2.15.38030: Flags [P.], seq 91772:97268, ack 867, win 65535, length 5496
19:29:51.283330 IP 10.0.2.15.38030 > 151.101.117.67.443: Flags [.], ack 97268, win 65535, length 0
19:29:51.284441 IP 151.101.117.67.443 > 10.0.2.15.38030: Flags [P.], seq 97268:104138, ack 867, win 65535, length 6870
19:29:51.284457 IP 10.0.2.15.38030 > 151.101.117.67.443: Flags [.], ack 104138, win 65535, length 0
19:29:51.285526 IP 151.101.117.67.443 > 10.0.2.15.38030: Flags [P.], seq 104138:108260, ack 867, win 65535, length 4122
19:29:51.285541 IP 10.0.2.15.38030 > 151.101.117.67.443: Flags [.], ack 108260, win 65535, length 0
19:29:51.286583 IP 151.101.117.67.443 > 10.0.2.15.38030: Flags [P.], seq 108260:113756, ack 867, win 65535, length 5496
19:29:51.286600 IP 10.0.2.15.38030 > 151.101.117.67.443: Flags [.], ack 113756, win 65535, length 0
19:29:51.287783 IP 151.101.117.67.443 > 10.0.2.15.38030: Flags [P.], seq 113756:120626, ack 867, win 65535, length 6870
19:29:51.287803 IP 10.0.2.15.38030 > 151.101.117.67.443: Flags [.], ack 120626, win 65535, length 0
19:29:51.288224 IP 151.101.117.67.443 > 10.0.2.15.38030: Flags [P.], seq 120626:123374, ack 867, win 65535, length 2748
19:29:51.288226 IP 151.101.117.67.443 > 10.0.2.15.38030: Flags [P.], seq 123374:126122, ack 867, win 65535, length 2748
19:29:51.288226 IP 151.101.117.67.443 > 10.0.2.15.38030: Flags [P.], seq 126122:128870, ack 867, win 65535, length 2748
19:29:51.288244 IP 10.0.2.15.38030 > 151.101.117.67.443: Flags [.], ack 123374, win 65535, length 0
19:29:51.288261 IP 10.0.2.15.38030 > 151.101.117.67.443: Flags [.], ack 126122, win 65535, length 0
19:29:51.288281 IP 10.0.2.15.38030 > 151.101.117.67.443: Flags [.], ack 128870, win 65535, length 0
19:29:51.288390 IP 151.101.117.67.443 > 10.0.2.15.38030: Flags [P.], seq 128870:131618, ack 867, win 65535, length 2748
19:29:51.288396 IP 10.0.2.15.38030 > 151.101.117.67.443: Flags [.], ack 131618, win 65535, length 0
19:29:51.289133 IP 151.101.117.67.443 > 10.0.2.15.38030: Flags [P.], seq 131618:137114, ack 867, win 65535, length 5496
19:29:51.289250 IP 10.0.2.15.38030 > 151.101.117.67.443: Flags [.], ack 137114, win 65535, length 0
19:29:51.289417 IP 151.101.117.67.443 > 10.0.2.15.38030: Flags [P.], seq 137114:142610, ack 867, win 65535, length 5496
19:29:51.289426 IP 10.0.2.15.38030 > 151.101.117.67.443: Flags [.], ack 142610, win 65535, length 0
19:29:51.290389 IP 151.101.117.67.443 > 10.0.2.15.38030: Flags [P.], seq 142610:149480, ack 867, win 65535, length 6870
19:29:51.290391 IP 151.101.117.67.443 > 10.0.2.15.38030: Flags [P.], seq 149480:152228, ack 867, win 65535, length 2748
19:29:51.290409 IP 10.0.2.15.38030 > 151.101.117.67.443: Flags [.], ack 149480, win 65535, length 0
19:29:51.290432 IP 10.0.2.15.38030 > 151.101.117.67.443: Flags [.], ack 152228, win 65535, length 0
19:29:51.292136 IP 151.101.117.67.443 > 10.0.2.15.38030: Flags [P.], seq 152228:164594, ack 867, win 65535, length 12366
19:29:51.292160 IP 10.0.2.15.38030 > 151.101.117.67.443: Flags [.], ack 164594, win 65535, length 0
19:29:51.292212 IP 151.101.117.67.443 > 10.0.2.15.38030: Flags [P.], seq 164594:168716, ack 867, win 65535, length 4122
19:29:51.292214 IP 151.101.117.67.443 > 10.0.2.15.38030: Flags [P.], seq 168716:170090, ack 867, win 65535, length 1374
19:29:51.292228 IP 10.0.2.15.38030 > 151.101.117.67.443: Flags [.], ack 168716, win 65535, length 0
19:29:51.293558 IP 151.101.117.67.443 > 10.0.2.15.38030: Flags [.], seq 170090:174470, ack 867, win 65535, length 4380
19:29:51.293788 IP 10.0.2.15.38030 > 151.101.117.67.443: Flags [.], ack 174470, win 65535, length 0
19:29:51.294622 IP 151.101.117.67.443 > 10.0.2.15.38030: Flags [P.], seq 174470:178334, ack 867, win 65535, length 3864
19:29:51.294625 IP 151.101.117.67.443 > 10.0.2.15.38030: Flags [P.], seq 178334:182456, ack 867, win 65535, length 4122
19:29:51.294626 IP 151.101.117.67.443 > 10.0.2.15.38030: Flags [P.], seq 182456:186578, ack 867, win 65535, length 4122
19:29:51.294648 IP 10.0.2.15.38030 > 151.101.117.67.443: Flags [.], ack 178334, win 65535, length 0
19:29:51.294690 IP 10.0.2.15.38030 > 151.101.117.67.443: Flags [.], ack 182456, win 65535, length 0
19:29:51.294705 IP 10.0.2.15.38030 > 151.101.117.67.443: Flags [.], ack 186578, win 65535, length 0
19:29:51.294744 IP 151.101.117.67.443 > 10.0.2.15.38030: Flags [P.], seq 186578:189326, ack 867, win 65535, length 2748
19:29:51.294746 IP 151.101.117.67.443 > 10.0.2.15.38030: Flags [P.], seq 189326:194822, ack 867, win 65535, length 5496
19:29:51.294747 IP 151.101.117.67.443 > 10.0.2.15.38030: Flags [P.], seq 194822:196196, ack 867, win 65535, length 1374
19:29:51.294747 IP 151.101.117.67.443 > 10.0.2.15.38030: Flags [P.], seq 196196:198944, ack 867, win 65535, length 2748
19:29:51.294755 IP 10.0.2.15.38030 > 151.101.117.67.443: Flags [.], ack 189326, win 65535, length 0
19:29:51.294774 IP 10.0.2.15.38030 > 151.101.117.67.443: Flags [.], ack 194822, win 65535, length 0
19:29:51.294855 IP 10.0.2.15.38030 > 151.101.117.67.443: Flags [.], ack 198944, win 65535, length 0
19:29:51.295976 IP 151.101.117.67.443 > 10.0.2.15.38030: Flags [P.], seq 198944:205814, ack 867, win 65535, length 6870
19:29:51.296092 IP 10.0.2.15.38030 > 151.101.117.67.443: Flags [.], ack 205814, win 65535, length 0
19:29:51.297173 IP 151.101.117.67.443 > 10.0.2.15.38030: Flags [P.], seq 205814:208562, ack 867, win 65535, length 2748
19:29:51.297175 IP 151.101.117.67.443 > 10.0.2.15.38030: Flags [P.], seq 208562:211310, ack 867, win 65535, length 2748
19:29:51.297175 IP 151.101.117.67.443 > 10.0.2.15.38030: Flags [P.], seq 211310:215432, ack 867, win 65535, length 4122
19:29:51.297193 IP 10.0.2.15.38030 > 151.101.117.67.443: Flags [.], ack 208562, win 65535, length 0
19:29:51.297254 IP 10.0.2.15.38030 > 151.101.117.67.443: Flags [.], ack 211310, win 65535, length 0
19:29:51.297264 IP 10.0.2.15.38030 > 151.101.117.67.443: Flags [.], ack 215432, win 65535, length 0
19:29:51.297582 IP 151.101.117.67.443 > 10.0.2.15.38030: Flags [P.], seq 215432:220928, ack 867, win 65535, length 5496
19:29:51.297762 IP 10.0.2.15.38030 > 151.101.117.67.443: Flags [.], ack 220928, win 65535, length 0
19:29:51.297901 IP 151.101.117.67.443 > 10.0.2.15.38030: Flags [P.], seq 220928:225050, ack 867, win 65535, length 4122
19:29:51.297902 IP 151.101.117.67.443 > 10.0.2.15.38030: Flags [P.], seq 225050:227798, ack 867, win 65535, length 2748
19:29:51.297912 IP 10.0.2.15.38030 > 151.101.117.67.443: Flags [.], ack 225050, win 65535, length 0
19:29:51.297926 IP 10.0.2.15.38030 > 151.101.117.67.443: Flags [.], ack 227798, win 65535, length 0
19:29:51.298031 IP 151.101.117.67.443 > 10.0.2.15.38030: Flags [P.], seq 227798:230546, ack 867, win 65535, length 2748
19:29:51.298036 IP 10.0.2.15.38030 > 151.101.117.67.443: Flags [.], ack 230546, win 65535, length 0
19:29:51.298346 IP 151.101.117.67.443 > 10.0.2.15.38030: Flags [P.], seq 230546:234668, ack 867, win 65535, length 4122
19:29:51.298357 IP 10.0.2.15.38030 > 151.101.117.67.443: Flags [.], ack 234668, win 65535, length 0
19:29:51.300253 IP 151.101.117.67.443 > 10.0.2.15.38030: Flags [P.], seq 234668:242912, ack 867, win 65535, length 8244
19:29:51.300258 IP 151.101.117.67.443 > 10.0.2.15.38030: Flags [P.], seq 242912:245660, ack 867, win 65535, length 2748
19:29:51.300387 IP 10.0.2.15.38030 > 151.101.117.67.443: Flags [.], ack 242912, win 65535, length 0
19:29:51.300511 IP 10.0.2.15.38030 > 151.101.117.67.443: Flags [.], ack 245660, win 65535, length 0
19:29:51.300551 IP 151.101.117.67.443 > 10.0.2.15.38030: Flags [P.], seq 245660:248408, ack 867, win 65535, length 2748
19:29:51.300552 IP 151.101.117.67.443 > 10.0.2.15.38030: Flags [P.], seq 248408:251156, ack 867, win 65535, length 2748
19:29:51.300553 IP 151.101.117.67.443 > 10.0.2.15.38030: Flags [P.], seq 251156:253904, ack 867, win 65535, length 2748
19:29:51.300554 IP 151.101.117.67.443 > 10.0.2.15.38030: Flags [P.], seq 253904:255278, ack 867, win 65535, length 1374
19:29:51.300741 IP 10.0.2.15.38030 > 151.101.117.67.443: Flags [.], ack 248408, win 65535, length 0
19:29:51.300821 IP 10.0.2.15.38030 > 151.101.117.67.443: Flags [.], ack 251156, win 65535, length 0
19:29:51.300898 IP 10.0.2.15.38030 > 151.101.117.67.443: Flags [.], ack 253904, win 65535, length 0
19:29:51.302353 IP 151.101.117.67.443 > 10.0.2.15.38030: Flags [P.], seq 255278:260774, ack 867, win 65535, length 5496
19:29:51.302355 IP 151.101.117.67.443 > 10.0.2.15.38030: Flags [P.], seq 260774:264896, ack 867, win 65535, length 4122
19:29:51.302356 IP 151.101.117.67.443 > 10.0.2.15.38030: Flags [P.], seq 264896:269018, ack 867, win 65535, length 4122
19:29:51.302374 IP 10.0.2.15.38030 > 151.101.117.67.443: Flags [.], ack 260774, win 65535, length 0
19:29:51.302440 IP 10.0.2.15.38030 > 151.101.117.67.443: Flags [.], ack 264896, win 65535, length 0
19:29:51.302455 IP 10.0.2.15.38030 > 151.101.117.67.443: Flags [.], ack 269018, win 65535, length 0
19:29:51.302474 IP 151.101.117.67.443 > 10.0.2.15.38030: Flags [P.], seq 269018:270392, ack 867, win 65535, length 1374
19:29:51.305402 IP 151.101.117.67.443 > 10.0.2.15.38030: Flags [P.], seq 270392:277262, ack 867, win 65535, length 6870
19:29:51.305405 IP 151.101.117.67.443 > 10.0.2.15.38030: Flags [P.], seq 277262:282758, ack 867, win 65535, length 5496
19:29:51.305425 IP 10.0.2.15.38030 > 151.101.117.67.443: Flags [.], ack 277262, win 65535, length 0
19:29:51.305454 IP 10.0.2.15.38030 > 151.101.117.67.443: Flags [.], ack 282758, win 65535, length 0
19:29:51.305488 IP 151.101.117.67.443 > 10.0.2.15.38030: Flags [P.], seq 282758:286880, ack 867, win 65535, length 4122
19:29:51.305490 IP 151.101.117.67.443 > 10.0.2.15.38030: Flags [P.], seq 286880:292376, ack 867, win 65535, length 5496
19:29:51.305490 IP 151.101.117.67.443 > 10.0.2.15.38030: Flags [P.], seq 292376:293750, ack 867, win 65535, length 1374
19:29:51.305498 IP 10.0.2.15.38030 > 151.101.117.67.443: Flags [.], ack 286880, win 65535, length 0
19:29:51.305512 IP 10.0.2.15.38030 > 151.101.117.67.443: Flags [.], ack 292376, win 65535, length 0
19:29:51.307528 IP 151.101.117.67.443 > 10.0.2.15.38030: Flags [P.], seq 293750:300620, ack 867, win 65535, length 6870
19:29:51.307531 IP 151.101.117.67.443 > 10.0.2.15.38030: Flags [P.], seq 300620:304742, ack 867, win 65535, length 4122
19:29:51.307614 IP 10.0.2.15.38030 > 151.101.117.67.443: Flags [.], ack 300620, win 65535, length 0
19:29:51.307654 IP 10.0.2.15.38030 > 151.101.117.67.443: Flags [.], ack 304742, win 65535, length 0
19:29:51.307739 IP 151.101.117.67.443 > 10.0.2.15.38030: Flags [P.], seq 304742:310238, ack 867, win 65535, length 5496
19:29:51.307815 IP 10.0.2.15.38030 > 151.101.117.67.443: Flags [.], ack 310238, win 65535, length 0
19:29:51.308142 IP 151.101.117.67.443 > 10.0.2.15.38030: Flags [P.], seq 310238:312986, ack 867, win 65535, length 2748
19:29:51.308144 IP 151.101.117.67.443 > 10.0.2.15.38030: Flags [P.], seq 312986:315734, ack 867, win 65535, length 2748
19:29:51.308167 IP 10.0.2.15.38030 > 151.101.117.67.443: Flags [.], ack 312986, win 65535, length 0
19:29:51.308192 IP 10.0.2.15.38030 > 151.101.117.67.443: Flags [.], ack 315734, win 65535, length 0
19:29:51.308382 IP 151.101.117.67.443 > 10.0.2.15.38030: Flags [P.], seq 315734:318482, ack 867, win 65535, length 2748
19:29:51.308383 IP 151.101.117.67.443 > 10.0.2.15.38030: Flags [P.], seq 318482:319856, ack 867, win 65535, length 1374
19:29:51.308384 IP 151.101.117.67.443 > 10.0.2.15.38030: Flags [.], seq 319856:321316, ack 867, win 65535, length 1460
19:29:51.308398 IP 10.0.2.15.38030 > 151.101.117.67.443: Flags [.], ack 318482, win 65535, length 0
19:29:51.308420 IP 10.0.2.15.38030 > 151.101.117.67.443: Flags [.], ack 321316, win 65535, length 0
19:29:51.308653 IP 151.101.117.67.443 > 10.0.2.15.38030: Flags [P.], seq 321316:325352, ack 867, win 65535, length 4036
19:29:51.308668 IP 10.0.2.15.38030 > 151.101.117.67.443: Flags [.], ack 325352, win 65535, length 0
19:29:51.308953 IP 151.101.117.67.443 > 10.0.2.15.38030: Flags [P.], seq 325352:329474, ack 867, win 65535, length 4122
19:29:51.308965 IP 10.0.2.15.38030 > 151.101.117.67.443: Flags [.], ack 329474, win 65535, length 0
19:29:51.311272 IP 151.101.117.67.443 > 10.0.2.15.38030: Flags [P.], seq 329474:336344, ack 867, win 65535, length 6870
19:29:51.311309 IP 151.101.117.67.443 > 10.0.2.15.38030: Flags [P.], seq 336344:339092, ack 867, win 65535, length 2748
19:29:51.311405 IP 10.0.2.15.38030 > 151.101.117.67.443: Flags [.], ack 336344, win 65535, length 0
19:29:51.311447 IP 10.0.2.15.38030 > 151.101.117.67.443: Flags [.], ack 339092, win 65535, length 0
19:29:51.311800 IP 151.101.117.67.443 > 10.0.2.15.38030: Flags [P.], seq 339092:343214, ack 867, win 65535, length 4122
19:29:51.311802 IP 151.101.117.67.443 > 10.0.2.15.38030: Flags [P.], seq 343214:345962, ack 867, win 65535, length 2748
19:29:51.311804 IP 151.101.117.67.443 > 10.0.2.15.38030: Flags [P.], seq 345962:350084, ack 867, win 65535, length 4122
19:29:51.311818 IP 10.0.2.15.38030 > 151.101.117.67.443: Flags [.], ack 343214, win 65535, length 0
19:29:51.311928 IP 10.0.2.15.38030 > 151.101.117.67.443: Flags [.], ack 345962, win 65535, length 0
19:29:51.311953 IP 10.0.2.15.38030 > 151.101.117.67.443: Flags [.], ack 350084, win 65535, length 0
19:29:51.312014 IP 151.101.117.67.443 > 10.0.2.15.38030: Flags [P.], seq 350084:351458, ack 867, win 65535, length 1374
19:29:51.312015 IP 151.101.117.67.443 > 10.0.2.15.38030: Flags [P.], seq 351458:352832, ack 867, win 65535, length 1374
19:29:51.312017 IP 151.101.117.67.443 > 10.0.2.15.38030: Flags [P.], seq 352832:359702, ack 867, win 65535, length 6870
19:29:51.312018 IP 151.101.117.67.443 > 10.0.2.15.38030: Flags [P.], seq 359702:363824, ack 867, win 65535, length 4122
19:29:51.312029 IP 10.0.2.15.38030 > 151.101.117.67.443: Flags [.], ack 352832, win 65535, length 0
19:29:51.312041 IP 10.0.2.15.38030 > 151.101.117.67.443: Flags [.], ack 359702, win 65535, length 0
19:29:51.312160 IP 10.0.2.15.38030 > 151.101.117.67.443: Flags [.], ack 363824, win 65535, length 0
19:29:51.312284 IP 151.101.117.67.443 > 10.0.2.15.38030: Flags [P.], seq 363824:365198, ack 867, win 65535, length 1374
19:29:51.312286 IP 151.101.117.67.443 > 10.0.2.15.38030: Flags [P.], seq 365198:370694, ack 867, win 65535, length 5496
19:29:51.312287 IP 151.101.117.67.443 > 10.0.2.15.38030: Flags [P.], seq 370694:373442, ack 867, win 65535, length 2748
19:29:51.312287 IP 151.101.117.67.443 > 10.0.2.15.38030: Flags [P.], seq 373442:376190, ack 867, win 65535, length 2748
19:29:51.312410 IP 10.0.2.15.38030 > 151.101.117.67.443: Flags [.], ack 370694, win 65535, length 0
19:29:51.312434 IP 10.0.2.15.38030 > 151.101.117.67.443: Flags [.], ack 373442, win 65535, length 0
19:29:51.312446 IP 10.0.2.15.38030 > 151.101.117.67.443: Flags [.], ack 376190, win 65535, length 0
19:29:51.312474 IP 151.101.117.67.443 > 10.0.2.15.38030: Flags [P.], seq 376190:380312, ack 867, win 65535, length 4122
19:29:51.312475 IP 151.101.117.67.443 > 10.0.2.15.38030: Flags [P.], seq 380312:383060, ack 867, win 65535, length 2748
19:29:51.312487 IP 10.0.2.15.38030 > 151.101.117.67.443: Flags [.], ack 380312, win 65535, length 0
19:29:51.312547 IP 10.0.2.15.38030 > 151.101.117.67.443: Flags [.], ack 383060, win 65535, length 0
19:29:51.312844 IP 151.101.117.67.443 > 10.0.2.15.38030: Flags [P.], seq 383060:385808, ack 867, win 65535, length 2748
19:29:51.312846 IP 151.101.117.67.443 > 10.0.2.15.38030: Flags [P.], seq 385808:388556, ack 867, win 65535, length 2748
19:29:51.312859 IP 10.0.2.15.38030 > 151.101.117.67.443: Flags [.], ack 385808, win 65535, length 0
19:29:51.312875 IP 10.0.2.15.38030 > 151.101.117.67.443: Flags [.], ack 388556, win 65535, length 0
19:29:51.313796 IP 151.101.117.67.443 > 10.0.2.15.38030: Flags [P.], seq 388556:394052, ack 867, win 65535, length 5496
19:29:51.313799 IP 151.101.117.67.443 > 10.0.2.15.38030: Flags [P.], seq 394052:400922, ack 867, win 65535, length 6870
19:29:51.313822 IP 10.0.2.15.38030 > 151.101.117.67.443: Flags [.], ack 394052, win 65535, length 0
19:29:51.313847 IP 10.0.2.15.38030 > 151.101.117.67.443: Flags [.], ack 400922, win 65535, length 0
19:29:51.315341 IP 151.101.117.67.443 > 10.0.2.15.38030: Flags [P.], seq 400922:407792, ack 867, win 65535, length 6870
19:29:51.315344 IP 151.101.117.67.443 > 10.0.2.15.38030: Flags [P.], seq 407792:413288, ack 867, win 65535, length 5496
19:29:51.315368 IP 10.0.2.15.38030 > 151.101.117.67.443: Flags [.], ack 407792, win 65535, length 0
19:29:51.315516 IP 10.0.2.15.38030 > 151.101.117.67.443: Flags [.], ack 413288, win 65535, length 0
19:29:51.315651 IP 151.101.117.67.443 > 10.0.2.15.38030: Flags [P.], seq 413288:417946, ack 867, win 65535, length 4658
19:29:51.315653 IP 151.101.117.67.443 > 10.0.2.15.38030: Flags [P.], seq 417946:423442, ack 867, win 65535, length 5496
19:29:51.315664 IP 10.0.2.15.38030 > 151.101.117.67.443: Flags [.], ack 417946, win 65535, length 0
19:29:51.315682 IP 10.0.2.15.38030 > 151.101.117.67.443: Flags [.], ack 423442, win 65535, length 0
19:29:51.315759 IP 151.101.117.67.443 > 10.0.2.15.38030: Flags [P.], seq 423442:426190, ack 867, win 65535, length 2748
19:29:51.315771 IP 10.0.2.15.38030 > 151.101.117.67.443: Flags [.], ack 426190, win 65535, length 0
19:29:51.316309 IP 151.101.117.67.443 > 10.0.2.15.38030: Flags [P.], seq 426190:428938, ack 867, win 65535, length 2748
19:29:51.316372 IP 151.101.117.67.443 > 10.0.2.15.38030: Flags [P.], seq 428938:434400, ack 867, win 65535, length 5462
19:29:51.316373 IP 151.101.117.67.443 > 10.0.2.15.38030: Flags [P.], seq 434400:437148, ack 867, win 65535, length 2748
19:29:51.316395 IP 10.0.2.15.38030 > 151.101.117.67.443: Flags [.], ack 428938, win 65535, length 0
19:29:51.316433 IP 10.0.2.15.38030 > 151.101.117.67.443: Flags [.], ack 434400, win 65535, length 0
19:29:51.316446 IP 10.0.2.15.38030 > 151.101.117.67.443: Flags [.], ack 437148, win 65535, length 0
19:29:51.318008 IP 151.101.117.67.443 > 10.0.2.15.38030: Flags [.], seq 437148:441528, ack 867, win 65535, length 4380
19:29:51.318033 IP 10.0.2.15.38030 > 151.101.117.67.443: Flags [.], ack 441528, win 65535, length 0
19:29:51.318259 IP 151.101.117.67.443 > 10.0.2.15.38030: Flags [P.], seq 441528:445392, ack 867, win 65535, length 3864
19:29:51.318262 IP 151.101.117.67.443 > 10.0.2.15.38030: Flags [P.], seq 445392:450888, ack 867, win 65535, length 5496
19:29:51.318262 IP 151.101.117.67.443 > 10.0.2.15.38030: Flags [P.], seq 450888:452262, ack 867, win 65535, length 1374
19:29:51.318284 IP 10.0.2.15.38030 > 151.101.117.67.443: Flags [.], ack 445392, win 65535, length 0
19:29:51.318307 IP 10.0.2.15.38030 > 151.101.117.67.443: Flags [.], ack 450888, win 65535, length 0
19:29:51.318326 IP 151.101.117.67.443 > 10.0.2.15.38030: Flags [P.], seq 452262:457758, ack 867, win 65535, length 5496
19:29:51.318327 IP 151.101.117.67.443 > 10.0.2.15.38030: Flags [P.], seq 457758:460506, ack 867, win 65535, length 2748
19:29:51.318328 IP 151.101.117.67.443 > 10.0.2.15.38030: Flags [P.], seq 460506:463254, ack 867, win 65535, length 2748
19:29:51.318334 IP 10.0.2.15.38030 > 151.101.117.67.443: Flags [.], ack 457758, win 65535, length 0
19:29:51.318414 IP 10.0.2.15.38030 > 151.101.117.67.443: Flags [.], ack 460506, win 65535, length 0
19:29:51.319989 IP 10.0.2.15.38030 > 151.101.117.67.443: Flags [.], ack 463254, win 65535, length 0
19:29:51.321007 IP 151.101.117.67.443 > 10.0.2.15.38030: Flags [P.], seq 463254:468248, ack 867, win 65535, length 4994
19:29:51.321009 IP 151.101.117.67.443 > 10.0.2.15.38030: Flags [P.], seq 468248:470996, ack 867, win 65535, length 2748
19:29:51.321009 IP 151.101.117.67.443 > 10.0.2.15.38030: Flags [P.], seq 470996:472370, ack 867, win 65535, length 1374
19:29:51.321013 IP 151.101.117.67.443 > 10.0.2.15.38030: Flags [P.], seq 472370:481988, ack 867, win 65535, length 9618
19:29:51.321034 IP 10.0.2.15.38030 > 151.101.117.67.443: Flags [.], ack 468248, win 65535, length 0
19:29:51.321053 IP 10.0.2.15.38030 > 151.101.117.67.443: Flags [.], ack 470996, win 65535, length 0
19:29:51.321069 IP 10.0.2.15.38030 > 151.101.117.67.443: Flags [.], ack 481988, win 65535, length 0
19:29:51.321087 IP 151.101.117.67.443 > 10.0.2.15.38030: Flags [P.], seq 481988:492980, ack 867, win 65535, length 10992
19:29:51.321091 IP 10.0.2.15.38030 > 151.101.117.67.443: Flags [.], ack 492980, win 65535, length 0
19:29:51.321109 IP 151.101.117.67.443 > 10.0.2.15.38030: Flags [P.], seq 492980:495728, ack 867, win 65535, length 2748
19:29:51.321112 IP 151.101.117.67.443 > 10.0.2.15.38030: Flags [P.], seq 495728:508094, ack 867, win 65535, length 12366
19:29:51.321116 IP 10.0.2.15.38030 > 151.101.117.67.443: Flags [.], ack 495728, win 65535, length 0
19:29:51.321124 IP 10.0.2.15.38030 > 151.101.117.67.443: Flags [.], ack 508094, win 65535, length 0
19:29:51.321699 IP 151.101.117.67.443 > 10.0.2.15.38030: Flags [P.], seq 508094:514964, ack 867, win 65535, length 6870
19:29:51.321711 IP 10.0.2.15.38030 > 151.101.117.67.443: Flags [.], ack 514964, win 65535, length 0
19:29:51.321912 IP 151.101.117.67.443 > 10.0.2.15.38030: Flags [P.], seq 514964:519086, ack 867, win 65535, length 4122
19:29:51.321913 IP 151.101.117.67.443 > 10.0.2.15.38030: Flags [P.], seq 519086:520460, ack 867, win 65535, length 1374
19:29:51.321926 IP 10.0.2.15.38030 > 151.101.117.67.443: Flags [.], ack 519086, win 65535, length 0
19:29:51.322042 IP 151.101.117.67.443 > 10.0.2.15.38030: Flags [P.], seq 520460:523208, ack 867, win 65535, length 2748
19:29:51.322171 IP 10.0.2.15.38030 > 151.101.117.67.443: Flags [.], ack 523208, win 65535, length 0
19:29:51.322580 IP 151.101.117.67.443 > 10.0.2.15.38030: Flags [P.], seq 523208:525956, ack 867, win 65535, length 2748
19:29:51.322582 IP 151.101.117.67.443 > 10.0.2.15.38030: Flags [P.], seq 525956:530078, ack 867, win 65535, length 4122
19:29:51.322582 IP 151.101.117.67.443 > 10.0.2.15.38030: Flags [P.], seq 530078:532826, ack 867, win 65535, length 2748
19:29:51.322583 IP 151.101.117.67.443 > 10.0.2.15.38030: Flags [P.], seq 532826:534200, ack 867, win 65535, length 1374
19:29:51.322651 IP 10.0.2.15.38030 > 151.101.117.67.443: Flags [.], ack 525956, win 65535, length 0
19:29:51.322704 IP 10.0.2.15.38030 > 151.101.117.67.443: Flags [.], ack 530078, win 65535, length 0
19:29:51.322762 IP 10.0.2.15.38030 > 151.101.117.67.443: Flags [.], ack 532826, win 65535, length 0
19:29:51.322863 IP 151.101.117.67.443 > 10.0.2.15.38030: Flags [P.], seq 534200:538322, ack 867, win 65535, length 4122
19:29:51.322864 IP 151.101.117.67.443 > 10.0.2.15.38030: Flags [P.], seq 538322:541070, ack 867, win 65535, length 2748
19:29:51.322950 IP 10.0.2.15.38030 > 151.101.117.67.443: Flags [.], ack 538322, win 65535, length 0
19:29:51.322973 IP 10.0.2.15.38030 > 151.101.117.67.443: Flags [.], ack 541070, win 65535, length 0
19:29:51.323176 IP 151.101.117.67.443 > 10.0.2.15.38030: Flags [P.], seq 541070:543818, ack 867, win 65535, length 2748
19:29:51.323213 IP 10.0.2.15.38030 > 151.101.117.67.443: Flags [.], ack 543818, win 65535, length 0
19:29:51.323760 IP 151.101.117.67.443 > 10.0.2.15.38030: Flags [P.], seq 543818:547940, ack 867, win 65535, length 4122
19:29:51.323762 IP 151.101.117.67.443 > 10.0.2.15.38030: Flags [P.], seq 547940:550688, ack 867, win 65535, length 2748
19:29:51.323777 IP 10.0.2.15.38030 > 151.101.117.67.443: Flags [.], ack 547940, win 65535, length 0
19:29:51.323844 IP 10.0.2.15.38030 > 151.101.117.67.443: Flags [.], ack 550688, win 65535, length 0
19:29:51.324283 IP 151.101.117.67.443 > 10.0.2.15.38030: Flags [P.], seq 550688:552062, ack 867, win 65535, length 1374
19:29:51.324285 IP 151.101.117.67.443 > 10.0.2.15.38030: Flags [P.], seq 552062:556184, ack 867, win 65535, length 4122
19:29:51.324286 IP 151.101.117.67.443 > 10.0.2.15.38030: Flags [P.], seq 556184:561680, ack 867, win 65535, length 5496
19:29:51.324301 IP 10.0.2.15.38030 > 151.101.117.67.443: Flags [.], ack 556184, win 65535, length 0
19:29:51.324317 IP 10.0.2.15.38030 > 151.101.117.67.443: Flags [.], ack 561680, win 65535, length 0
19:29:51.325351 IP 151.101.117.67.443 > 10.0.2.15.38030: Flags [P.], seq 561680:563054, ack 867, win 65535, length 1374
19:29:51.325354 IP 151.101.117.67.443 > 10.0.2.15.38030: Flags [P.], seq 563054:568550, ack 867, win 65535, length 5496
19:29:51.325355 IP 151.101.117.67.443 > 10.0.2.15.38030: Flags [P.], seq 568550:571298, ack 867, win 65535, length 2748
19:29:51.325356 IP 151.101.117.67.443 > 10.0.2.15.38030: Flags [P.], seq 571298:575420, ack 867, win 65535, length 4122
19:29:51.325401 IP 10.0.2.15.38030 > 151.101.117.67.443: Flags [.], ack 568550, win 65535, length 0
19:29:51.325462 IP 10.0.2.15.38030 > 151.101.117.67.443: Flags [.], ack 571298, win 65535, length 0
19:29:51.325474 IP 10.0.2.15.38030 > 151.101.117.67.443: Flags [.], ack 575420, win 65535, length 0
19:29:51.326602 IP 151.101.117.67.443 > 10.0.2.15.38030: Flags [P.], seq 575420:579542, ack 867, win 65535, length 4122
19:29:51.326604 IP 151.101.117.67.443 > 10.0.2.15.38030: Flags [P.], seq 579542:582290, ack 867, win 65535, length 2748
19:29:51.326605 IP 151.101.117.67.443 > 10.0.2.15.38030: Flags [P.], seq 582290:585038, ack 867, win 65535, length 2748
19:29:51.326605 IP 151.101.117.67.443 > 10.0.2.15.38030: Flags [P.], seq 585038:589160, ack 867, win 65535, length 4122
19:29:51.326620 IP 10.0.2.15.38030 > 151.101.117.67.443: Flags [.], ack 579542, win 65535, length 0
19:29:51.326642 IP 10.0.2.15.38030 > 151.101.117.67.443: Flags [.], ack 582290, win 65535, length 0
19:29:51.326655 IP 10.0.2.15.38030 > 151.101.117.67.443: Flags [.], ack 585038, win 65535, length 0
19:29:51.326668 IP 10.0.2.15.38030 > 151.101.117.67.443: Flags [.], ack 589160, win 65535, length 0
19:29:51.326681 IP 151.101.117.67.443 > 10.0.2.15.38030: Flags [P.], seq 589160:591908, ack 867, win 65535, length 2748
19:29:51.326682 IP 151.101.117.67.443 > 10.0.2.15.38030: Flags [P.], seq 591908:593282, ack 867, win 65535, length 1374
19:29:51.326683 IP 151.101.117.67.443 > 10.0.2.15.38030: Flags [P.], seq 593282:597404, ack 867, win 65535, length 4122
19:29:51.326684 IP 151.101.117.67.443 > 10.0.2.15.38030: Flags [P.], seq 597404:600152, ack 867, win 65535, length 2748
19:29:51.326690 IP 10.0.2.15.38030 > 151.101.117.67.443: Flags [.], ack 591908, win 65535, length 0
19:29:51.326705 IP 10.0.2.15.38030 > 151.101.117.67.443: Flags [.], ack 597404, win 65535, length 0
19:29:51.326721 IP 10.0.2.15.38030 > 151.101.117.67.443: Flags [.], ack 600152, win 65535, length 0
19:29:51.326756 IP 151.101.117.67.443 > 10.0.2.15.38030: Flags [P.], seq 600152:601526, ack 867, win 65535, length 1374
19:29:51.326757 IP 151.101.117.67.443 > 10.0.2.15.38030: Flags [P.], seq 601526:604274, ack 867, win 65535, length 2748
19:29:51.326758 IP 151.101.117.67.443 > 10.0.2.15.38030: Flags [P.], seq 604274:607022, ack 867, win 65535, length 2748
19:29:51.326767 IP 10.0.2.15.38030 > 151.101.117.67.443: Flags [.], ack 604274, win 65535, length 0
19:29:51.326857 IP 10.0.2.15.38030 > 151.101.117.67.443: Flags [.], ack 607022, win 65535, length 0
19:29:51.327101 IP 151.101.117.67.443 > 10.0.2.15.38030: Flags [P.], seq 607022:609770, ack 867, win 65535, length 2748
19:29:51.327102 IP 151.101.117.67.443 > 10.0.2.15.38030: Flags [P.], seq 609770:611144, ack 867, win 65535, length 1374
19:29:51.327103 IP 151.101.117.67.443 > 10.0.2.15.38030: Flags [P.], seq 611144:615266, ack 867, win 65535, length 4122
19:29:51.327114 IP 10.0.2.15.38030 > 151.101.117.67.443: Flags [.], ack 609770, win 65535, length 0
19:29:51.327130 IP 10.0.2.15.38030 > 151.101.117.67.443: Flags [.], ack 615266, win 65535, length 0
19:29:51.327971 IP 151.101.117.67.443 > 10.0.2.15.38030: Flags [P.], seq 615266:620762, ack 867, win 65535, length 5496
19:29:51.327986 IP 10.0.2.15.38030 > 151.101.117.67.443: Flags [.], ack 620762, win 65535, length 0
19:29:51.329057 IP 151.101.117.67.443 > 10.0.2.15.38030: Flags [P.], seq 620762:627632, ack 867, win 65535, length 6870
19:29:51.329058 IP 151.101.117.67.443 > 10.0.2.15.38030: Flags [P.], seq 627632:630380, ack 867, win 65535, length 2748
19:29:51.329076 IP 10.0.2.15.38030 > 151.101.117.67.443: Flags [.], ack 627632, win 65535, length 0
19:29:51.329277 IP 10.0.2.15.38030 > 151.101.117.67.443: Flags [.], ack 630380, win 65535, length 0
19:29:51.329871 IP 151.101.117.67.443 > 10.0.2.15.38030: Flags [P.], seq 630380:635876, ack 867, win 65535, length 5496
19:29:51.329872 IP 151.101.117.67.443 > 10.0.2.15.38030: Flags [P.], seq 635876:638624, ack 867, win 65535, length 2748
19:29:51.329873 IP 151.101.117.67.443 > 10.0.2.15.38030: Flags [P.], seq 638624:641372, ack 867, win 65535, length 2748
19:29:51.329884 IP 10.0.2.15.38030 > 151.101.117.67.443: Flags [.], ack 635876, win 65535, length 0
19:29:51.329901 IP 10.0.2.15.38030 > 151.101.117.67.443: Flags [.], ack 638624, win 65535, length 0
19:29:51.329916 IP 10.0.2.15.38030 > 151.101.117.67.443: Flags [.], ack 641372, win 65535, length 0
19:29:51.329942 IP 151.101.117.67.443 > 10.0.2.15.38030: Flags [P.], seq 641372:644120, ack 867, win 65535, length 2748
19:29:51.329944 IP 151.101.117.67.443 > 10.0.2.15.38030: Flags [P.], seq 644120:648242, ack 867, win 65535, length 4122
19:29:51.329944 IP 151.101.117.67.443 > 10.0.2.15.38030: Flags [P.], seq 648242:649616, ack 867, win 65535, length 1374
19:29:51.329951 IP 10.0.2.15.38030 > 151.101.117.67.443: Flags [.], ack 644120, win 65535, length 0
19:29:51.329963 IP 10.0.2.15.38030 > 151.101.117.67.443: Flags [.], ack 648242, win 65535, length 0
19:29:51.330144 IP 151.101.117.67.443 > 10.0.2.15.38030: Flags [P.], seq 649616:652364, ack 867, win 65535, length 2748
19:29:51.330149 IP 10.0.2.15.38030 > 151.101.117.67.443: Flags [.], ack 652364, win 65535, length 0
19:29:51.330311 IP 151.101.117.67.443 > 10.0.2.15.38030: Flags [P.], seq 652364:655112, ack 867, win 65535, length 2748
19:29:51.330316 IP 10.0.2.15.38030 > 151.101.117.67.443: Flags [.], ack 655112, win 65535, length 0
19:29:51.331405 IP 151.101.117.67.443 > 10.0.2.15.38030: Flags [P.], seq 655112:657860, ack 867, win 65535, length 2748
19:29:51.331408 IP 151.101.117.67.443 > 10.0.2.15.38030: Flags [P.], seq 657860:661982, ack 867, win 65535, length 4122
19:29:51.331408 IP 151.101.117.67.443 > 10.0.2.15.38030: Flags [P.], seq 661982:663356, ack 867, win 65535, length 1374
19:29:51.331410 IP 151.101.117.67.443 > 10.0.2.15.38030: Flags [P.], seq 663356:668852, ack 867, win 65535, length 5496
19:29:51.331427 IP 10.0.2.15.38030 > 151.101.117.67.443: Flags [.], ack 657860, win 65535, length 0
19:29:51.331448 IP 10.0.2.15.38030 > 151.101.117.67.443: Flags [.], ack 661982, win 65535, length 0
19:29:51.331462 IP 10.0.2.15.38030 > 151.101.117.67.443: Flags [.], ack 668852, win 65535, length 0
19:29:51.331486 IP 151.101.117.67.443 > 10.0.2.15.38030: Flags [P.], seq 668852:671600, ack 867, win 65535, length 2748
19:29:51.331487 IP 151.101.117.67.443 > 10.0.2.15.38030: Flags [P.], seq 671600:674348, ack 867, win 65535, length 2748
19:29:51.331488 IP 151.101.117.67.443 > 10.0.2.15.38030: Flags [P.], seq 674348:677096, ack 867, win 65535, length 2748
19:29:51.331489 IP 151.101.117.67.443 > 10.0.2.15.38030: Flags [P.], seq 677096:679844, ack 867, win 65535, length 2748
19:29:51.331494 IP 10.0.2.15.38030 > 151.101.117.67.443: Flags [.], ack 671600, win 65535, length 0
19:29:51.331505 IP 10.0.2.15.38030 > 151.101.117.67.443: Flags [.], ack 674348, win 65535, length 0
19:29:51.331515 IP 10.0.2.15.38030 > 151.101.117.67.443: Flags [.], ack 677096, win 65535, length 0
19:29:51.331524 IP 10.0.2.15.38030 > 151.101.117.67.443: Flags [.], ack 679844, win 65535, length 0
19:29:51.332950 IP 151.101.117.67.443 > 10.0.2.15.38030: Flags [P.], seq 679844:682592, ack 867, win 65535, length 2748
19:29:51.332952 IP 151.101.117.67.443 > 10.0.2.15.38030: Flags [P.], seq 682592:686714, ack 867, win 65535, length 4122
19:29:51.332953 IP 151.101.117.67.443 > 10.0.2.15.38030: Flags [P.], seq 686714:689462, ack 867, win 65535, length 2748
19:29:51.332954 IP 151.101.117.67.443 > 10.0.2.15.38030: Flags [P.], seq 689462:690836, ack 867, win 65535, length 1374
19:29:51.332974 IP 10.0.2.15.38030 > 151.101.117.67.443: Flags [.], ack 682592, win 65535, length 0
19:29:51.333055 IP 10.0.2.15.38030 > 151.101.117.67.443: Flags [.], ack 686714, win 65535, length 0
19:29:51.333408 IP 10.0.2.15.38030 > 151.101.117.67.443: Flags [.], ack 689462, win 65535, length 0
19:29:51.333716 IP 151.101.117.67.443 > 10.0.2.15.38030: Flags [P.], seq 690836:694958, ack 867, win 65535, length 4122
19:29:51.333717 IP 151.101.117.67.443 > 10.0.2.15.38030: Flags [P.], seq 694958:696332, ack 867, win 65535, length 1374
19:29:51.333718 IP 151.101.117.67.443 > 10.0.2.15.38030: Flags [P.], seq 696332:699080, ack 867, win 65535, length 2748
19:29:51.333719 IP 151.101.117.67.443 > 10.0.2.15.38030: Flags [P.], seq 699080:703202, ack 867, win 65535, length 4122
19:29:51.333734 IP 10.0.2.15.38030 > 151.101.117.67.443: Flags [.], ack 694958, win 65535, length 0
19:29:51.333791 IP 10.0.2.15.38030 > 151.101.117.67.443: Flags [.], ack 699080, win 65535, length 0
19:29:51.333873 IP 151.101.117.67.443 > 10.0.2.15.38030: Flags [P.], seq 703202:705950, ack 867, win 65535, length 2748
19:29:51.333876 IP 151.101.117.67.443 > 10.0.2.15.38030: Flags [P.], seq 705950:711446, ack 867, win 65535, length 5496
19:29:51.333877 IP 151.101.117.67.443 > 10.0.2.15.38030: Flags [P.], seq 711446:714194, ack 867, win 65535, length 2748
19:29:51.333979 IP 151.101.117.67.443 > 10.0.2.15.38030: Flags [P.], seq 714194:719690, ack 867, win 65535, length 5496
19:29:51.335190 IP 151.101.117.67.443 > 10.0.2.15.38030: Flags [P.], seq 719690:722438, ack 867, win 65535, length 2748
19:29:51.335191 IP 151.101.117.67.443 > 10.0.2.15.38030: Flags [P.], seq 722438:725186, ack 867, win 65535, length 2748
19:29:51.335192 IP 151.101.117.67.443 > 10.0.2.15.38030: Flags [P.], seq 725186:730682, ack 867, win 65535, length 5496
19:29:51.335272 IP 151.101.117.67.443 > 10.0.2.15.38030: Flags [P.], seq 730682:733430, ack 867, win 65535, length 2748
19:29:51.336905 IP 10.0.2.15.38030 > 151.101.117.67.443: Flags [.], ack 733430, win 65535, length 0
19:29:51.337368 IP 151.101.117.67.443 > 10.0.2.15.38030: Flags [.], seq 733430:734890, ack 867, win 65535, length 1460
19:29:51.337723 IP 151.101.117.67.443 > 10.0.2.15.38030: Flags [P.], seq 734890:777398, ack 867, win 65535, length 42508
19:29:51.337884 IP 10.0.2.15.38030 > 151.101.117.67.443: Flags [.], ack 777398, win 65535, length 0
19:29:51.338515 IP 151.101.117.67.443 > 10.0.2.15.38030: Flags [P.], seq 777398:789764, ack 867, win 65535, length 12366
19:29:51.338528 IP 10.0.2.15.38030 > 151.101.117.67.443: Flags [.], ack 789764, win 65535, length 0
19:29:51.338623 IP 151.101.117.67.443 > 10.0.2.15.38030: Flags [P.], seq 789764:792512, ack 867, win 65535, length 2748
19:29:51.338624 IP 151.101.117.67.443 > 10.0.2.15.38030: Flags [P.], seq 792512:793886, ack 867, win 65535, length 1374
19:29:51.338626 IP 151.101.117.67.443 > 10.0.2.15.38030: Flags [P.], seq 793886:799382, ack 867, win 65535, length 5496
19:29:51.338826 IP 10.0.2.15.38030 > 151.101.117.67.443: Flags [.], ack 799382, win 65535, length 0
19:29:51.338860 IP 151.101.117.67.443 > 10.0.2.15.38030: Flags [P.], seq 799382:802130, ack 867, win 65535, length 2748
19:29:51.338862 IP 151.101.117.67.443 > 10.0.2.15.38030: Flags [P.], seq 802130:804878, ack 867, win 65535, length 2748
19:29:51.338913 IP 10.0.2.15.38030 > 151.101.117.67.443: Flags [.], ack 804878, win 65535, length 0
19:29:51.339035 IP 151.101.117.67.443 > 10.0.2.15.38030: Flags [P.], seq 804878:807626, ack 867, win 65535, length 2748
19:29:51.339268 IP 10.0.2.15.38030 > 151.101.117.67.443: Flags [.], ack 807626, win 65535, length 0
19:29:51.339522 IP 151.101.117.67.443 > 10.0.2.15.38030: Flags [P.], seq 807626:815870, ack 867, win 65535, length 8244
19:29:51.339557 IP 151.101.117.67.443 > 10.0.2.15.38030: Flags [.], seq 815870:817330, ack 867, win 65535, length 1460
19:29:51.339727 IP 151.101.117.67.443 > 10.0.2.15.38030: Flags [P.], seq 817330:818618, ack 867, win 65535, length 1288
19:29:51.339728 IP 151.101.117.67.443 > 10.0.2.15.38030: Flags [P.], seq 818618:821366, ack 867, win 65535, length 2748
19:29:51.339760 IP 10.0.2.15.38030 > 151.101.117.67.443: Flags [.], ack 821366, win 65535, length 0
19:29:51.339833 IP 151.101.117.67.443 > 10.0.2.15.38030: Flags [P.], seq 821366:824114, ack 867, win 65535, length 2748
19:29:51.339834 IP 151.101.117.67.443 > 10.0.2.15.38030: Flags [P.], seq 824114:825488, ack 867, win 65535, length 1374
19:29:51.339879 IP 10.0.2.15.38030 > 151.101.117.67.443: Flags [.], ack 825488, win 65535, length 0
19:29:51.340110 IP 151.101.117.67.443 > 10.0.2.15.38030: Flags [P.], seq 825488:828236, ack 867, win 65535, length 2748
19:29:51.340462 IP 151.101.117.67.443 > 10.0.2.15.38030: Flags [P.], seq 828236:832358, ack 867, win 65535, length 4122
19:29:51.340463 IP 151.101.117.67.443 > 10.0.2.15.38030: Flags [P.], seq 832358:833732, ack 867, win 65535, length 1374
19:29:51.340464 IP 151.101.117.67.443 > 10.0.2.15.38030: Flags [P.], seq 833732:837854, ack 867, win 65535, length 4122
19:29:51.340559 IP 151.101.117.67.443 > 10.0.2.15.38030: Flags [P.], seq 837854:839228, ack 867, win 65535, length 1374
19:29:51.340808 IP 151.101.117.67.443 > 10.0.2.15.38030: Flags [P.], seq 839228:841976, ack 867, win 65535, length 2748
19:29:51.340995 IP 151.101.117.67.443 > 10.0.2.15.38030: Flags [P.], seq 841976:846098, ack 867, win 65535, length 4122
19:29:51.341233 IP 151.101.117.67.443 > 10.0.2.15.38030: Flags [P.], seq 846098:851594, ack 867, win 65535, length 5496
19:29:51.341521 IP 151.101.117.67.443 > 10.0.2.15.38030: Flags [P.], seq 851594:852968, ack 867, win 65535, length 1374
19:29:51.341522 IP 151.101.117.67.443 > 10.0.2.15.38030: Flags [P.], seq 852968:855716, ack 867, win 65535, length 2748
19:29:51.342126 IP 151.101.117.67.443 > 10.0.2.15.38030: Flags [P.], seq 855716:859838, ack 867, win 65535, length 4122
19:29:51.342541 IP 10.0.2.15.38030 > 151.101.117.67.443: Flags [.], ack 859838, win 65535, length 0
19:29:51.342952 IP 151.101.117.67.443 > 10.0.2.15.38030: Flags [P.], seq 859838:874952, ack 867, win 65535, length 15114
19:29:51.342967 IP 10.0.2.15.38030 > 151.101.117.67.443: Flags [.], ack 874952, win 65535, length 0
19:29:51.343584 IP 151.101.117.67.443 > 10.0.2.15.38030: Flags [P.], seq 874952:877700, ack 867, win 65535, length 2748
19:29:51.343587 IP 151.101.117.67.443 > 10.0.2.15.38030: Flags [P.], seq 877700:883196, ack 867, win 65535, length 5496
19:29:51.343588 IP 151.101.117.67.443 > 10.0.2.15.38030: Flags [P.], seq 883196:885944, ack 867, win 65535, length 2748
19:29:51.343677 IP 151.101.117.67.443 > 10.0.2.15.38030: Flags [P.], seq 885944:888692, ack 867, win 65535, length 2748
19:29:51.343677 IP 151.101.117.67.443 > 10.0.2.15.38030: Flags [P.], seq 888692:891440, ack 867, win 65535, length 2748
19:29:51.343803 IP 151.101.117.67.443 > 10.0.2.15.38030: Flags [P.], seq 891440:892814, ack 867, win 65535, length 1374
19:29:51.343804 IP 151.101.117.67.443 > 10.0.2.15.38030: Flags [P.], seq 892814:895562, ack 867, win 65535, length 2748
19:29:51.344010 IP 151.101.117.67.443 > 10.0.2.15.38030: Flags [P.], seq 895562:898310, ack 867, win 65535, length 2748
19:29:51.344050 IP 10.0.2.15.38030 > 151.101.117.67.443: Flags [.], ack 898310, win 65535, length 0
19:29:51.344101 IP 151.101.117.67.443 > 10.0.2.15.38030: Flags [P.], seq 898310:901058, ack 867, win 65535, length 2748
19:29:51.344198 IP 10.0.2.15.38030 > 151.101.117.67.443: Flags [.], ack 901058, win 65535, length 0
19:29:51.344604 IP 151.101.117.67.443 > 10.0.2.15.38030: Flags [P.], seq 901058:903806, ack 867, win 65535, length 2748
19:29:51.344606 IP 151.101.117.67.443 > 10.0.2.15.38030: Flags [P.], seq 903806:906554, ack 867, win 65535, length 2748
19:29:51.344920 IP 151.101.117.67.443 > 10.0.2.15.38030: Flags [P.], seq 906554:910676, ack 867, win 65535, length 4122
19:29:51.344922 IP 151.101.117.67.443 > 10.0.2.15.38030: Flags [P.], seq 910676:914798, ack 867, win 65535, length 4122
19:29:51.344922 IP 151.101.117.67.443 > 10.0.2.15.38030: Flags [P.], seq 914798:917546, ack 867, win 65535, length 2748
19:29:51.345059 IP 151.101.117.67.443 > 10.0.2.15.38030: Flags [P.], seq 917546:920294, ack 867, win 65535, length 2748
19:29:51.345183 IP 151.101.117.67.443 > 10.0.2.15.38030: Flags [P.], seq 920294:921668, ack 867, win 65535, length 1374
19:29:51.345236 IP 10.0.2.15.38030 > 151.101.117.67.443: Flags [.], ack 921668, win 65535, length 0
19:29:51.345292 IP 151.101.117.67.443 > 10.0.2.15.38030: Flags [P.], seq 921668:925790, ack 867, win 65535, length 4122
19:29:51.345332 IP 10.0.2.15.38030 > 151.101.117.67.443: Flags [.], ack 925790, win 65535, length 0
19:29:51.345499 IP 151.101.117.67.443 > 10.0.2.15.38030: Flags [P.], seq 925790:927164, ack 867, win 65535, length 1374
19:29:51.345658 IP 151.101.117.67.443 > 10.0.2.15.38030: Flags [P.], seq 927164:931286, ack 867, win 65535, length 4122
19:29:51.345659 IP 151.101.117.67.443 > 10.0.2.15.38030: Flags [P.], seq 931286:932660, ack 867, win 65535, length 1374
19:29:51.345682 IP 10.0.2.15.38030 > 151.101.117.67.443: Flags [.], ack 932660, win 65535, length 0
19:29:51.345878 IP 151.101.117.67.443 > 10.0.2.15.38030: Flags [P.], seq 932660:934034, ack 867, win 65535, length 1374
19:29:51.347499 IP 151.101.117.67.443 > 10.0.2.15.38030: Flags [P.], seq 934034:942278, ack 867, win 65535, length 8244
19:29:51.347502 IP 151.101.117.67.443 > 10.0.2.15.38030: Flags [P.], seq 942278:947774, ack 867, win 65535, length 5496
19:29:51.347524 IP 10.0.2.15.38030 > 151.101.117.67.443: Flags [.], ack 942278, win 65535, length 0
19:29:51.347626 IP 10.0.2.15.38030 > 151.101.117.67.443: Flags [.], ack 947774, win 65535, length 0
19:29:51.347769 IP 151.101.117.67.443 > 10.0.2.15.38030: Flags [P.], seq 947774:949148, ack 867, win 65535, length 1374
19:29:51.347771 IP 151.101.117.67.443 > 10.0.2.15.38030: Flags [P.], seq 949148:954644, ack 867, win 65535, length 5496
19:29:51.347772 IP 151.101.117.67.443 > 10.0.2.15.38030: Flags [P.], seq 954644:960140, ack 867, win 65535, length 5496
19:29:51.347786 IP 10.0.2.15.38030 > 151.101.117.67.443: Flags [.], ack 954644, win 65535, length 0
19:29:51.347813 IP 151.101.117.67.443 > 10.0.2.15.38030: Flags [P.], seq 960140:962888, ack 867, win 65535, length 2748

