00:11:18.480010 IP 10.0.2.15.37880 > 151.101.117.67.443: Flags [P.], seq 2610060075:2610060592, ack 64960002, win 64240, length 517
00:11:18.482498 IP 151.101.117.67.443 > 10.0.2.15.37880: Flags [.], ack 517, win 65535, length 0
00:11:18.499819 IP 151.101.117.67.443 > 10.0.2.15.37880: Flags [.], seq 1:2921, ack 517, win 65535, length 2920
00:11:18.499844 IP 10.0.2.15.37880 > 151.101.117.67.443: Flags [.], ack 2921, win 62780, length 0
00:11:18.500503 IP 151.101.117.67.443 > 10.0.2.15.37880: Flags [P.], seq 2921:5064, ack 517, win 65535, length 2143
00:11:18.500523 IP 10.0.2.15.37880 > 151.101.117.67.443: Flags [.], ack 5064, win 62780, length 0
00:11:18.501993 IP 10.0.2.15.37880 > 151.101.117.67.443: Flags [P.], seq 517:610, ack 5064, win 62780, length 93
00:11:18.503321 IP 151.101.117.67.443 > 10.0.2.15.37880: Flags [.], ack 610, win 65535, length 0
00:11:18.522223 IP 151.101.117.67.443 > 10.0.2.15.37880: Flags [P.], seq 5064:5115, ack 610, win 65535, length 51
00:11:18.522304 IP 10.0.2.15.37880 > 151.101.117.67.443: Flags [.], ack 5115, win 62780, length 0
00:11:18.522802 IP 10.0.2.15.37880 > 151.101.117.67.443: Flags [P.], seq 610:663, ack 5115, win 62780, length 53
00:11:18.522841 IP 10.0.2.15.37880 > 151.101.117.67.443: Flags [P.], seq 663:719, ack 5115, win 62780, length 56
00:11:18.523104 IP 10.0.2.15.37880 > 151.101.117.67.443: Flags [P.], seq 719:828, ack 5115, win 62780, length 109
00:11:18.523674 IP 151.101.117.67.443 > 10.0.2.15.37880: Flags [.], ack 663, win 65535, length 0
00:11:18.523676 IP 151.101.117.67.443 > 10.0.2.15.37880: Flags [.], ack 719, win 65535, length 0
00:11:18.523677 IP 151.101.117.67.443 > 10.0.2.15.37880: Flags [.], ack 828, win 65535, length 0
00:11:18.537559 IP 151.101.117.67.443 > 10.0.2.15.37880: Flags [P.], seq 5115:5210, ack 828, win 65535, length 95
00:11:18.537594 IP 10.0.2.15.37880 > 151.101.117.67.443: Flags [.], ack 5210, win 62780, length 0
00:11:18.537927 IP 10.0.2.15.37880 > 151.101.117.67.443: Flags [P.], seq 828:866, ack 5210, win 62780, length 38
00:11:18.538297 IP 151.101.117.67.443 > 10.0.2.15.37880: Flags [.], ack 866, win 65535, length 0
00:11:18.539629 IP 151.101.117.67.443 > 10.0.2.15.37880: Flags [.], seq 5210:8130, ack 866, win 65535, length 2920
00:11:18.539653 IP 10.0.2.15.37880 > 151.101.117.67.443: Flags [.], ack 8130, win 62780, length 0
00:11:18.540626 IP 151.101.117.67.443 > 10.0.2.15.37880: Flags [P.], seq 8130:11876, ack 866, win 65535, length 3746
00:11:18.540731 IP 10.0.2.15.37880 > 151.101.117.67.443: Flags [.], ack 11876, win 61320, length 0
00:11:18.541102 IP 151.101.117.67.443 > 10.0.2.15.37880: Flags [P.], seq 11876:14624, ack 866, win 65535, length 2748
00:11:18.541138 IP 10.0.2.15.37880 > 151.101.117.67.443: Flags [.], ack 14624, win 59860, length 0
00:11:18.542371 IP 151.101.117.67.443 > 10.0.2.15.37880: Flags [P.], seq 14624:17372, ack 866, win 65535, length 2748
00:11:18.542392 IP 10.0.2.15.37880 > 151.101.117.67.443: Flags [.], ack 17372, win 62780, length 0
00:11:18.545290 IP 151.101.117.67.443 > 10.0.2.15.37880: Flags [.], seq 17372:18832, ack 866, win 65535, length 1460
00:11:18.545943 IP 151.101.117.67.443 > 10.0.2.15.37880: Flags [P.], seq 18832:20120, ack 866, win 65535, length 1288
00:11:18.545948 IP 151.101.117.67.443 > 10.0.2.15.37880: Flags [P.], seq 20120:25616, ack 866, win 65535, length 5496
00:11:18.546020 IP 10.0.2.15.37880 > 151.101.117.67.443: Flags [.], ack 25616, win 58400, length 0
00:11:18.547743 IP 151.101.117.67.443 > 10.0.2.15.37880: Flags [P.], seq 25616:31112, ack 866, win 65535, length 5496
00:11:18.547746 IP 151.101.117.67.443 > 10.0.2.15.37880: Flags [P.], seq 31112:33860, ack 866, win 65535, length 2748
00:11:18.547769 IP 10.0.2.15.37880 > 151.101.117.67.443: Flags [.], ack 31112, win 61320, length 0
00:11:18.548238 IP 10.0.2.15.37880 > 151.101.117.67.443: Flags [.], ack 33860, win 58572, length 0
00:11:18.551059 IP 151.101.117.67.443 > 10.0.2.15.37880: Flags [P.], seq 33860:36608, ack 866, win 65535, length 2748
00:11:18.551062 IP 151.101.117.67.443 > 10.0.2.15.37880: Flags [.], seq 36608:40988, ack 866, win 65535, length 4380
00:11:18.551087 IP 10.0.2.15.37880 > 151.101.117.67.443: Flags [.], ack 36608, win 62780, length 0
00:11:18.551206 IP 10.0.2.15.37880 > 151.101.117.67.443: Flags [.], ack 40988, win 59860, length 0
00:11:18.551477 IP 151.101.117.67.443 > 10.0.2.15.37880: Flags [P.], seq 40988:42104, ack 866, win 65535, length 1116
00:11:18.552585 IP 151.101.117.67.443 > 10.0.2.15.37880: Flags [P.], seq 42104:44852, ack 866, win 65535, length 2748
00:11:18.552608 IP 10.0.2.15.37880 > 151.101.117.67.443: Flags [.], ack 44852, win 62780, length 0
00:11:18.553943 IP 151.101.117.67.443 > 10.0.2.15.37880: Flags [P.], seq 44852:48974, ack 866, win 65535, length 4122
00:11:18.553946 IP 151.101.117.67.443 > 10.0.2.15.37880: Flags [P.], seq 48974:50348, ack 866, win 65535, length 1374
00:11:18.554048 IP 10.0.2.15.37880 > 151.101.117.67.443: Flags [.], ack 50348, win 61320, length 0
00:11:18.554972 IP 151.101.117.67.443 > 10.0.2.15.37880: Flags [P.], seq 50348:53096, ack 866, win 65535, length 2748
00:11:18.555036 IP 10.0.2.15.37880 > 151.101.117.67.443: Flags [.], ack 53096, win 62780, length 0
00:11:18.555938 IP 151.101.117.67.443 > 10.0.2.15.37880: Flags [P.], seq 53096:55844, ack 866, win 65535, length 2748
00:11:18.555953 IP 10.0.2.15.37880 > 151.101.117.67.443: Flags [.], ack 55844, win 62780, length 0
00:11:18.558053 IP 151.101.117.67.443 > 10.0.2.15.37880: Flags [P.], seq 55844:61340, ack 866, win 65535, length 5496
00:11:18.558143 IP 10.0.2.15.37880 > 151.101.117.67.443: Flags [.], ack 61340, win 61320, length 0
00:11:18.559134 IP 151.101.117.67.443 > 10.0.2.15.37880: Flags [P.], seq 61340:64088, ack 866, win 65535, length 2748
00:11:18.559157 IP 10.0.2.15.37880 > 151.101.117.67.443: Flags [.], ack 64088, win 62780, length 0
00:11:18.560138 IP 151.101.117.67.443 > 10.0.2.15.37880: Flags [P.], seq 64088:66836, ack 866, win 65535, length 2748
00:11:18.560161 IP 10.0.2.15.37880 > 151.101.117.67.443: Flags [.], ack 66836, win 62780, length 0
00:11:18.561498 IP 151.101.117.67.443 > 10.0.2.15.37880: Flags [P.], seq 66836:72332, ack 866, win 65535, length 5496
00:11:18.561691 IP 10.0.2.15.37880 > 151.101.117.67.443: Flags [.], ack 72332, win 62780, length 0
00:11:18.563218 IP 151.101.117.67.443 > 10.0.2.15.37880: Flags [P.], seq 72332:75080, ack 866, win 65535, length 2748
00:11:18.563243 IP 10.0.2.15.37880 > 151.101.117.67.443: Flags [.], ack 75080, win 65535, length 0
00:11:18.565604 IP 151.101.117.67.443 > 10.0.2.15.37880: Flags [P.], seq 75080:80576, ack 866, win 65535, length 5496
00:11:18.565629 IP 10.0.2.15.37880 > 151.101.117.67.443: Flags [.], ack 80576, win 65535, length 0
00:11:18.566130 IP 151.101.117.67.443 > 10.0.2.15.37880: Flags [P.], seq 80576:86072, ack 866, win 65535, length 5496
00:11:18.566146 IP 10.0.2.15.37880 > 151.101.117.67.443: Flags [.], ack 86072, win 65535, length 0
00:11:18.567707 IP 151.101.117.67.443 > 10.0.2.15.37880: Flags [P.], seq 86072:91568, ack 866, win 65535, length 5496
00:11:18.567731 IP 10.0.2.15.37880 > 151.101.117.67.443: Flags [.], ack 91568, win 65535, length 0
00:11:18.569207 IP 151.101.117.67.443 > 10.0.2.15.37880: Flags [P.], seq 91568:94316, ack 866, win 65535, length 2748
00:11:18.569210 IP 151.101.117.67.443 > 10.0.2.15.37880: Flags [P.], seq 94316:98438, ack 866, win 65535, length 4122
00:11:18.569236 IP 10.0.2.15.37880 > 151.101.117.67.443: Flags [.], ack 94316, win 65535, length 0
00:11:18.570139 IP 10.0.2.15.37880 > 151.101.117.67.443: Flags [.], ack 98438, win 65535, length 0
00:11:18.570865 IP 151.101.117.67.443 > 10.0.2.15.37880: Flags [P.], seq 98438:110804, ack 866, win 65535, length 12366
00:11:18.570904 IP 10.0.2.15.37880 > 151.101.117.67.443: Flags [.], ack 110804, win 65535, length 0
00:11:18.571107 IP 151.101.117.67.443 > 10.0.2.15.37880: Flags [P.], seq 110804:112178, ack 866, win 65535, length 1374
00:11:18.573184 IP 151.101.117.67.443 > 10.0.2.15.37880: Flags [.], seq 112178:113638, ack 866, win 65535, length 1460
00:11:18.573208 IP 10.0.2.15.37880 > 151.101.117.67.443: Flags [.], ack 113638, win 65535, length 0
00:11:18.573905 IP 151.101.117.67.443 > 10.0.2.15.37880: Flags [P.], seq 113638:117674, ack 866, win 65535, length 4036
00:11:18.573909 IP 151.101.117.67.443 > 10.0.2.15.37880: Flags [P.], seq 117674:123170, ack 866, win 65535, length 5496
00:11:18.574374 IP 151.101.117.67.443 > 10.0.2.15.37880: Flags [P.], seq 123170:127292, ack 866, win 65535, length 4122
00:11:18.574406 IP 10.0.2.15.37880 > 151.101.117.67.443: Flags [.], ack 117674, win 65535, length 0
00:11:18.574667 IP 10.0.2.15.37880 > 151.101.117.67.443: Flags [.], ack 123170, win 65535, length 0
00:11:18.575369 IP 10.0.2.15.37880 > 151.101.117.67.443: Flags [.], ack 127292, win 65535, length 0
00:11:18.575408 IP 151.101.117.67.443 > 10.0.2.15.37880: Flags [P.], seq 127292:130040, ack 866, win 65535, length 2748
00:11:18.575418 IP 10.0.2.15.37880 > 151.101.117.67.443: Flags [.], ack 130040, win 65535, length 0
00:11:18.576980 IP 151.101.117.67.443 > 10.0.2.15.37880: Flags [P.], seq 130040:146528, ack 866, win 65535, length 16488
00:11:18.577005 IP 10.0.2.15.37880 > 151.101.117.67.443: Flags [.], ack 146528, win 65535, length 0
00:11:18.577157 IP 151.101.117.67.443 > 10.0.2.15.37880: Flags [P.], seq 146528:156146, ack 866, win 65535, length 9618
00:11:18.577180 IP 10.0.2.15.37880 > 151.101.117.67.443: Flags [.], ack 156146, win 65535, length 0
00:11:18.577770 IP 151.101.117.67.443 > 10.0.2.15.37880: Flags [P.], seq 156146:160268, ack 866, win 65535, length 4122
00:11:18.577789 IP 10.0.2.15.37880 > 151.101.117.67.443: Flags [.], ack 160268, win 65535, length 0
00:11:18.578658 IP 151.101.117.67.443 > 10.0.2.15.37880: Flags [P.], seq 160268:169886, ack 866, win 65535, length 9618
00:11:18.578745 IP 10.0.2.15.37880 > 151.101.117.67.443: Flags [.], ack 169886, win 65535, length 0
00:11:18.579082 IP 151.101.117.67.443 > 10.0.2.15.37880: Flags [P.], seq 169886:174008, ack 866, win 65535, length 4122
00:11:18.579097 IP 10.0.2.15.37880 > 151.101.117.67.443: Flags [.], ack 174008, win 65535, length 0
00:11:18.580829 IP 151.101.117.67.443 > 10.0.2.15.37880: Flags [.], seq 174008:178388, ack 866, win 65535, length 4380
00:11:18.580856 IP 10.0.2.15.37880 > 151.101.117.67.443: Flags [.], ack 178388, win 65535, length 0
00:11:18.582686 IP 151.101.117.67.443 > 10.0.2.15.37880: Flags [.], seq 178388:181308, ack 866, win 65535, length 2920
00:11:18.582707 IP 10.0.2.15.37880 > 151.101.117.67.443: Flags [.], ack 181308, win 65535, length 0
00:11:18.585107 IP 151.101.117.67.443 > 10.0.2.15.37880: Flags [P.], seq 181308:183626, ack 866, win 65535, length 2318
00:11:18.585111 IP 151.101.117.67.443 > 10.0.2.15.37880: Flags [P.], seq 183626:187748, ack 866, win 65535, length 4122
00:11:18.585113 IP 151.101.117.67.443 > 10.0.2.15.37880: Flags [P.], seq 187748:195992, ack 866, win 65535, length 8244
00:11:18.585137 IP 10.0.2.15.37880 > 151.101.117.67.443: Flags [.], ack 183626, win 65535, length 0
00:11:18.585395 IP 10.0.2.15.37880 > 151.101.117.67.443: Flags [.], ack 187748, win 65535, length 0
00:11:18.585465 IP 10.0.2.15.37880 > 151.101.117.67.443: Flags [.], ack 195992, win 65535, length 0
00:11:18.585506 IP 151.101.117.67.443 > 10.0.2.15.37880: Flags [P.], seq 195992:200114, ack 866, win 65535, length 4122
00:11:18.585508 IP 151.101.117.67.443 > 10.0.2.15.37880: Flags [P.], seq 200114:202862, ack 866, win 65535, length 2748
00:11:18.585509 IP 151.101.117.67.443 > 10.0.2.15.37880: Flags [P.], seq 202862:209732, ack 866, win 65535, length 6870
00:11:18.585517 IP 10.0.2.15.37880 > 151.101.117.67.443: Flags [.], ack 200114, win 65535, length 0
00:11:18.585532 IP 10.0.2.15.37880 > 151.101.117.67.443: Flags [.], ack 202862, win 65535, length 0
00:11:18.585541 IP 10.0.2.15.37880 > 151.101.117.67.443: Flags [.], ack 209732, win 65535, length 0
00:11:18.585562 IP 151.101.117.67.443 > 10.0.2.15.37880: Flags [P.], seq 209732:220724, ack 866, win 65535, length 10992
00:11:18.585571 IP 10.0.2.15.37880 > 151.101.117.67.443: Flags [.], ack 220724, win 65535, length 0
00:11:18.587269 IP 151.101.117.67.443 > 10.0.2.15.37880: Flags [P.], seq 220724:227594, ack 866, win 65535, length 6870
00:11:18.587296 IP 10.0.2.15.37880 > 151.101.117.67.443: Flags [.], ack 227594, win 65535, length 0
00:11:18.588577 IP 151.101.117.67.443 > 10.0.2.15.37880: Flags [P.], seq 227594:237212, ack 866, win 65535, length 9618
00:11:18.588598 IP 151.101.117.67.443 > 10.0.2.15.37880: Flags [P.], seq 237212:245456, ack 866, win 65535, length 8244
00:11:18.588631 IP 10.0.2.15.37880 > 151.101.117.67.443: Flags [.], ack 237212, win 65535, length 0
00:11:18.588683 IP 10.0.2.15.37880 > 151.101.117.67.443: Flags [.], ack 245456, win 65535, length 0
00:11:18.591532 IP 151.101.117.67.443 > 10.0.2.15.37880: Flags [P.], seq 245456:253700, ack 866, win 65535, length 8244
00:11:18.591538 IP 151.101.117.67.443 > 10.0.2.15.37880: Flags [P.], seq 253700:264692, ack 866, win 65535, length 10992
00:11:18.591606 IP 10.0.2.15.37880 > 151.101.117.67.443: Flags [.], ack 264692, win 65535, length 0
00:11:18.594644 IP 151.101.117.67.443 > 10.0.2.15.37880: Flags [P.], seq 264692:299042, ack 866, win 65535, length 34350
00:11:18.594674 IP 10.0.2.15.37880 > 151.101.117.67.443: Flags [.], ack 299042, win 65535, length 0
00:11:18.597878 IP 151.101.117.67.443 > 10.0.2.15.37880: Flags [P.], seq 299042:326522, ack 866, win 65535, length 27480
00:11:18.597902 IP 10.0.2.15.37880 > 151.101.117.67.443: Flags [.], ack 326522, win 65535, length 0
00:11:18.598164 IP 151.101.117.67.443 > 10.0.2.15.37880: Flags [P.], seq 326522:333392, ack 866, win 65535, length 6870
00:11:18.598175 IP 10.0.2.15.37880 > 151.101.117.67.443: Flags [.], ack 333392, win 65535, length 0
00:11:18.601452 IP 151.101.117.67.443 > 10.0.2.15.37880: Flags [P.], seq 333392:362780, ack 866, win 65535, length 29388
00:11:18.601476 IP 10.0.2.15.37880 > 151.101.117.67.443: Flags [.], ack 362780, win 65535, length 0
00:11:18.601601 IP 151.101.117.67.443 > 10.0.2.15.37880: Flags [P.], seq 362780:372398, ack 866, win 65535, length 9618
00:11:18.601609 IP 10.0.2.15.37880 > 151.101.117.67.443: Flags [.], ack 372398, win 65535, length 0
00:11:18.602648 IP 151.101.117.67.443 > 10.0.2.15.37880: Flags [P.], seq 372398:393008, ack 866, win 65535, length 20610
00:11:18.602676 IP 10.0.2.15.37880 > 151.101.117.67.443: Flags [.], ack 393008, win 65535, length 0
00:11:18.603848 IP 151.101.117.67.443 > 10.0.2.15.37880: Flags [P.], seq 393008:402626, ack 866, win 65535, length 9618
00:11:18.603853 IP 151.101.117.67.443 > 10.0.2.15.37880: Flags [P.], seq 402626:404840, ack 866, win 65535, length 2214
00:11:18.603881 IP 10.0.2.15.37880 > 151.101.117.67.443: Flags [.], ack 402626, win 65535, length 0
00:11:18.603912 IP 10.0.2.15.37880 > 151.101.117.67.443: Flags [.], ack 404840, win 65535, length 0
00:11:18.603932 IP 151.101.117.67.443 > 10.0.2.15.37880: Flags [P.], seq 404840:410336, ack 866, win 65535, length 5496
00:11:18.603933 IP 151.101.117.67.443 > 10.0.2.15.37880: Flags [P.], seq 410336:415832, ack 866, win 65535, length 5496
00:11:18.603939 IP 10.0.2.15.37880 > 151.101.117.67.443: Flags [.], ack 410336, win 65535, length 0
00:11:18.603952 IP 10.0.2.15.37880 > 151.101.117.67.443: Flags [.], ack 415832, win 65535, length 0
00:11:18.606004 IP 151.101.117.67.443 > 10.0.2.15.37880: Flags [P.], seq 415832:418580, ack 866, win 65535, length 2748
00:11:18.606008 IP 151.101.117.67.443 > 10.0.2.15.37880: Flags [P.], seq 418580:419954, ack 866, win 65535, length 1374
00:11:18.606107 IP 10.0.2.15.37880 > 151.101.117.67.443: Flags [.], ack 418580, win 65535, length 0
00:11:18.613545 IP 151.101.117.67.443 > 10.0.2.15.37880: Flags [P.], seq 419954:428198, ack 866, win 65535, length 8244
00:11:18.613550 IP 151.101.117.67.443 > 10.0.2.15.37880: Flags [P.], seq 428198:430946, ack 866, win 65535, length 2748
00:11:18.613580 IP 10.0.2.15.37880 > 151.101.117.67.443: Flags [.], ack 428198, win 65535, length 0
00:11:18.613674 IP 10.0.2.15.37880 > 151.101.117.67.443: Flags [.], ack 430946, win 65535, length 0
00:11:18.613712 IP 151.101.117.67.443 > 10.0.2.15.37880: Flags [P.], seq 430946:436442, ack 866, win 65535, length 5496
00:11:18.613714 IP 151.101.117.67.443 > 10.0.2.15.37880: Flags [P.], seq 436442:439190, ack 866, win 65535, length 2748
00:11:18.613714 IP 151.101.117.67.443 > 10.0.2.15.37880: Flags [P.], seq 439190:440564, ack 866, win 65535, length 1374
00:11:18.613716 IP 151.101.117.67.443 > 10.0.2.15.37880: Flags [P.], seq 440564:446060, ack 866, win 65535, length 5496
00:11:18.613725 IP 10.0.2.15.37880 > 151.101.117.67.443: Flags [.], ack 436442, win 65535, length 0
00:11:18.613736 IP 10.0.2.15.37880 > 151.101.117.67.443: Flags [.], ack 439190, win 65535, length 0
00:11:18.613747 IP 10.0.2.15.37880 > 151.101.117.67.443: Flags [.], ack 446060, win 65535, length 0
00:11:18.613765 IP 151.101.117.67.443 > 10.0.2.15.37880: Flags [P.], seq 446060:451556, ack 866, win 65535, length 5496
00:11:18.613770 IP 10.0.2.15.37880 > 151.101.117.67.443: Flags [.], ack 451556, win 65535, length 0
00:11:18.616436 IP 151.101.117.67.443 > 10.0.2.15.37880: Flags [.], seq 451556:515796, ack 866, win 65535, length 64240
00:11:18.616459 IP 10.0.2.15.37880 > 151.101.117.67.443: Flags [.], ack 515796, win 65535, length 0
00:11:18.617079 IP 151.101.117.67.443 > 10.0.2.15.37880: Flags [P.], seq 515796:517256, ack 866, win 65535, length 1460
00:11:18.617082 IP 151.101.117.67.443 > 10.0.2.15.37880: Flags [.], seq 517256:526016, ack 866, win 65535, length 8760
00:11:18.617105 IP 10.0.2.15.37880 > 151.101.117.67.443: Flags [.], ack 526016, win 65535, length 0
00:11:18.619987 IP 151.101.117.67.443 > 10.0.2.15.37880: Flags [P.], seq 526016:569720, ack 866, win 65535, length 43704
00:11:18.620013 IP 10.0.2.15.37880 > 151.101.117.67.443: Flags [.], ack 569720, win 65535, length 0
00:11:18.621317 IP 151.101.117.67.443 > 10.0.2.15.37880: Flags [P.], seq 569720:610940, ack 866, win 65535, length 41220
00:11:18.621350 IP 10.0.2.15.37880 > 151.101.117.67.443: Flags [.], ack 610940, win 65535, length 0
00:11:18.622440 IP 151.101.117.67.443 > 10.0.2.15.37880: Flags [P.], seq 610940:627428, ack 866, win 65535, length 16488
00:11:18.622467 IP 10.0.2.15.37880 > 151.101.117.67.443: Flags [.], ack 627428, win 65535, length 0
00:11:18.622504 IP 151.101.117.67.443 > 10.0.2.15.37880: Flags [P.], seq 627428:628802, ack 866, win 65535, length 1374
00:11:18.629917 IP 151.101.117.67.443 > 10.0.2.15.37880: Flags [.], seq 628802:637562, ack 866, win 65535, length 8760
00:11:18.629957 IP 10.0.2.15.37880 > 151.101.117.67.443: Flags [.], ack 637562, win 65535, length 0
00:11:18.631890 IP 151.101.117.67.443 > 10.0.2.15.37880: Flags [.], seq 637562:639022, ack 866, win 65535, length 1460
00:11:18.632917 IP 151.101.117.67.443 > 10.0.2.15.37880: Flags [.], seq 639022:641942, ack 866, win 65535, length 2920
00:11:18.632943 IP 10.0.2.15.37880 > 151.101.117.67.443: Flags [.], ack 641942, win 65535, length 0
00:11:18.633681 IP 151.101.117.67.443 > 10.0.2.15.37880: Flags [.], seq 641942:643402, ack 866, win 65535, length 1460
00:11:18.635186 IP 151.101.117.67.443 > 10.0.2.15.37880: Flags [.], seq 643402:644862, ack 866, win 65535, length 1460
00:11:18.635209 IP 10.0.2.15.37880 > 151.101.117.67.443: Flags [.], ack 644862, win 65535, length 0
00:11:18.636128 IP 151.101.117.67.443 > 10.0.2.15.37880: Flags [.], seq 644862:646322, ack 866, win 65535, length 1460
00:11:18.638326 IP 151.101.117.67.443 > 10.0.2.15.37880: Flags [P.], seq 646322:693042, ack 866, win 65535, length 46720
00:11:18.638410 IP 10.0.2.15.37880 > 151.101.117.67.443: Flags [.], ack 693042, win 65535, length 0
00:11:18.639350 IP 151.101.117.67.443 > 10.0.2.15.37880: Flags [.], seq 693042:713482, ack 866, win 65535, length 20440
00:11:18.639540 IP 10.0.2.15.37880 > 151.101.117.67.443: Flags [.], ack 713482, win 65535, length 0
00:11:18.640017 IP 151.101.117.67.443 > 10.0.2.15.37880: Flags [P.], seq 713482:758742, ack 866, win 65535, length 45260
00:11:18.640106 IP 10.0.2.15.37880 > 151.101.117.67.443: Flags [.], ack 758742, win 65535, length 0
00:11:18.641737 IP 151.101.117.67.443 > 10.0.2.15.37880: Flags [.], seq 758742:790862, ack 866, win 65535, length 32120
00:11:18.641853 IP 10.0.2.15.37880 > 151.101.117.67.443: Flags [.], ack 790862, win 65535, length 0
00:11:18.642122 IP 151.101.117.67.443 > 10.0.2.15.37880: Flags [P.], seq 790862:824442, ack 866, win 65535, length 33580
00:11:18.642138 IP 10.0.2.15.37880 > 151.101.117.67.443: Flags [.], ack 824442, win 65535, length 0
00:11:18.642880 IP 151.101.117.67.443 > 10.0.2.15.37880: Flags [P.], seq 824442:863756, ack 866, win 65535, length 39314
00:11:18.642905 IP 10.0.2.15.37880 > 151.101.117.67.443: Flags [.], ack 863756, win 65535, length 0
00:11:18.643649 IP 151.101.117.67.443 > 10.0.2.15.37880: Flags [P.], seq 863756:873916, ack 866, win 65535, length 10160
00:11:18.645856 IP 10.0.2.15.37880 > 151.101.117.67.443: Flags [.], ack 873916, win 65535, length 0
00:11:18.647058 IP 151.101.117.67.443 > 10.0.2.15.37880: Flags [P.], seq 873916:906892, ack 866, win 65535, length 32976
00:11:18.647125 IP 10.0.2.15.37880 > 151.101.117.67.443: Flags [.], ack 906892, win 65535, length 0
00:11:18.647597 IP 151.101.117.67.443 > 10.0.2.15.37880: Flags [P.], seq 906892:925586, ack 866, win 65535, length 18694
00:11:18.647610 IP 10.0.2.15.37880 > 151.101.117.67.443: Flags [.], ack 925586, win 65535, length 0
00:11:18.647754 IP 151.101.117.67.443 > 10.0.2.15.37880: Flags [P.], seq 925586:926960, ack 866, win 65535, length 1374
00:11:18.648679 IP 151.101.117.67.443 > 10.0.2.15.37880: Flags [P.], seq 926960:929708, ack 866, win 65535, length 2748
00:11:18.648682 IP 151.101.117.67.443 > 10.0.2.15.37880: Flags [P.], seq 929708:935204, ack 866, win 65535, length 5496
00:11:18.648740 IP 10.0.2.15.37880 > 151.101.117.67.443: Flags [.], ack 929708, win 65535, length 0
00:11:18.648773 IP 10.0.2.15.37880 > 151.101.117.67.443: Flags [.], ack 935204, win 65535, length 0
00:11:18.648897 IP 151.101.117.67.443 > 10.0.2.15.37880: Flags [P.], seq 935204:937952, ack 866, win 65535, length 2748
00:11:18.648907 IP 10.0.2.15.37880 > 151.101.117.67.443: Flags [.], ack 937952, win 65535, length 0
00:11:18.649193 IP 151.101.117.67.443 > 10.0.2.15.37880: Flags [P.], seq 937952:940700, ack 866, win 65535, length 2748
00:11:18.649201 IP 10.0.2.15.37880 > 151.101.117.67.443: Flags [.], ack 940700, win 65535, length 0
00:11:18.649354 IP 151.101.117.67.443 > 10.0.2.15.37880: Flags [P.], seq 940700:943448, ack 866, win 65535, length 2748
00:11:18.649362 IP 10.0.2.15.37880 > 151.101.117.67.443: Flags [.], ack 943448, win 65535, length 0
00:11:18.649783 IP 151.101.117.67.443 > 10.0.2.15.37880: Flags [P.], seq 943448:947570, ack 866, win 65535, length 4122
00:11:18.649792 IP 10.0.2.15.37880 > 151.101.117.67.443: Flags [.], ack 947570, win 65535, length 0

