19:32:08.050165 IP 10.0.2.15.41579 > 140.233.253.2.53: 20356+ A? www.cnn.com. (29)
19:32:08.050209 IP 10.0.2.15.41579 > 140.233.253.2.53: 38016+ AAAA? www.cnn.com. (29)
19:32:08.056298 IP 140.233.253.2.53 > 10.0.2.15.41579: 20356 2/0/0 CNAME turner-tls.map.fastly.net., A 151.101.117.67 (84)
19:32:08.056300 IP 140.233.253.2.53 > 10.0.2.15.41579: 38016 2/0/0 CNAME turner-tls.map.fastly.net., AAAA 2a04:4e42:1c::323 (96)
19:32:08.056697 IP 10.0.2.15.38088 > 151.101.117.67.443: Flags [S], seq 1148489876, win 64240, options [mss 1460,sackOK,TS val 1396847029 ecr 0,nop,wscale 6], length 0
19:32:08.072341 IP 151.101.117.67.443 > 10.0.2.15.38088: Flags [S.], seq 172160001, ack 1148489877, win 65535, options [mss 1460], length 0
19:32:08.072379 IP 10.0.2.15.38088 > 151.101.117.67.443: Flags [.], ack 1, win 64240, length 0
19:32:08.082683 IP 10.0.2.15.38088 > 151.101.117.67.443: Flags [P.], seq 1:518, ack 1, win 64240, length 517
19:32:08.083087 IP 151.101.117.67.443 > 10.0.2.15.38088: Flags [.], ack 518, win 65535, length 0
19:32:08.104141 IP 151.101.117.67.443 > 10.0.2.15.38088: Flags [.], seq 1:2921, ack 518, win 65535, length 2920
19:32:08.104161 IP 10.0.2.15.38088 > 151.101.117.67.443: Flags [.], ack 2921, win 62780, length 0
19:32:08.104313 IP 151.101.117.67.443 > 10.0.2.15.38088: Flags [P.], seq 2921:5064, ack 518, win 65535, length 2143
19:32:08.104325 IP 10.0.2.15.38088 > 151.101.117.67.443: Flags [.], ack 5064, win 61320, length 0
19:32:08.105340 IP 10.0.2.15.38088 > 151.101.117.67.443: Flags [P.], seq 518:611, ack 5064, win 62780, length 93
19:32:08.105691 IP 151.101.117.67.443 > 10.0.2.15.38088: Flags [.], ack 611, win 65535, length 0
19:32:08.119804 IP 151.101.117.67.443 > 10.0.2.15.38088: Flags [P.], seq 5064:5115, ack 611, win 65535, length 51
19:32:08.119824 IP 10.0.2.15.38088 > 151.101.117.67.443: Flags [.], ack 5115, win 62780, length 0
19:32:08.120265 IP 10.0.2.15.38088 > 151.101.117.67.443: Flags [P.], seq 611:664, ack 5115, win 62780, length 53
19:32:08.120304 IP 10.0.2.15.38088 > 151.101.117.67.443: Flags [P.], seq 664:720, ack 5115, win 62780, length 56
19:32:08.120544 IP 151.101.117.67.443 > 10.0.2.15.38088: Flags [.], ack 664, win 65535, length 0
19:32:08.120546 IP 151.101.117.67.443 > 10.0.2.15.38088: Flags [.], ack 720, win 65535, length 0
19:32:08.120729 IP 10.0.2.15.38088 > 151.101.117.67.443: Flags [P.], seq 720:762, ack 5115, win 62780, length 42
19:32:08.120961 IP 151.101.117.67.443 > 10.0.2.15.38088: Flags [.], ack 762, win 65535, length 0
19:32:08.121067 IP 10.0.2.15.38088 > 151.101.117.67.443: Flags [P.], seq 762:829, ack 5115, win 62780, length 67
19:32:08.121397 IP 151.101.117.67.443 > 10.0.2.15.38088: Flags [.], ack 829, win 65535, length 0
19:32:08.137381 IP 151.101.117.67.443 > 10.0.2.15.38088: Flags [P.], seq 5115:5181, ack 829, win 65535, length 66
19:32:08.137397 IP 10.0.2.15.38088 > 151.101.117.67.443: Flags [.], ack 5181, win 62780, length 0
19:32:08.137626 IP 10.0.2.15.38088 > 151.101.117.67.443: Flags [P.], seq 829:867, ack 5181, win 62780, length 38
19:32:08.137911 IP 151.101.117.67.443 > 10.0.2.15.38088: Flags [.], ack 867, win 65535, length 0
19:32:08.139554 IP 151.101.117.67.443 > 10.0.2.15.38088: Flags [P.], seq 5181:9303, ack 867, win 65535, length 4122
19:32:08.139651 IP 10.0.2.15.38088 > 151.101.117.67.443: Flags [.], ack 9303, win 61320, length 0
19:32:08.141063 IP 151.101.117.67.443 > 10.0.2.15.38088: Flags [P.], seq 9303:14799, ack 867, win 65535, length 5496
19:32:08.141082 IP 10.0.2.15.38088 > 151.101.117.67.443: Flags [.], ack 14799, win 61320, length 0
19:32:08.141545 IP 151.101.117.67.443 > 10.0.2.15.38088: Flags [P.], seq 14799:17547, ack 867, win 65535, length 2748
19:32:08.141598 IP 10.0.2.15.38088 > 151.101.117.67.443: Flags [.], ack 17547, win 58572, length 0
19:32:08.144287 IP 151.101.117.67.443 > 10.0.2.15.38088: Flags [P.], seq 17547:21669, ack 867, win 65535, length 4122
19:32:08.144314 IP 10.0.2.15.38088 > 151.101.117.67.443: Flags [.], ack 21669, win 61320, length 0
19:32:08.145615 IP 151.101.117.67.443 > 10.0.2.15.38088: Flags [P.], seq 21669:25791, ack 867, win 65535, length 4122
19:32:08.145618 IP 151.101.117.67.443 > 10.0.2.15.38088: Flags [P.], seq 25791:29913, ack 867, win 65535, length 4122
19:32:08.145716 IP 10.0.2.15.38088 > 151.101.117.67.443: Flags [.], ack 29913, win 55480, length 0
19:32:08.145850 IP 151.101.117.67.443 > 10.0.2.15.38088: Flags [P.], seq 29913:31287, ack 867, win 65535, length 1374
19:32:08.147289 IP 151.101.117.67.443 > 10.0.2.15.38088: Flags [P.], seq 31287:36783, ack 867, win 65535, length 5496
19:32:08.147307 IP 10.0.2.15.38088 > 151.101.117.67.443: Flags [.], ack 36783, win 61320, length 0
19:32:08.148346 IP 151.101.117.67.443 > 10.0.2.15.38088: Flags [P.], seq 36783:39531, ack 867, win 65535, length 2748
19:32:08.148362 IP 10.0.2.15.38088 > 151.101.117.67.443: Flags [.], ack 39531, win 62780, length 0
19:32:08.149438 IP 151.101.117.67.443 > 10.0.2.15.38088: Flags [P.], seq 39531:43653, ack 867, win 65535, length 4122
19:32:08.149821 IP 10.0.2.15.38088 > 151.101.117.67.443: Flags [.], ack 43653, win 61320, length 0
19:32:08.152783 IP 151.101.117.67.443 > 10.0.2.15.38088: Flags [P.], seq 43653:47775, ack 867, win 65535, length 4122
19:32:08.152786 IP 151.101.117.67.443 > 10.0.2.15.38088: Flags [P.], seq 47775:54645, ack 867, win 65535, length 6870
19:32:08.152813 IP 10.0.2.15.38088 > 151.101.117.67.443: Flags [.], ack 47775, win 61320, length 0
19:32:08.153121 IP 10.0.2.15.38088 > 151.101.117.67.443: Flags [.], ack 54645, win 56940, length 0
19:32:08.154021 IP 151.101.117.67.443 > 10.0.2.15.38088: Flags [P.], seq 54645:58767, ack 867, win 65535, length 4122
19:32:08.154041 IP 10.0.2.15.38088 > 151.101.117.67.443: Flags [.], ack 58767, win 61320, length 0
19:32:08.155094 IP 151.101.117.67.443 > 10.0.2.15.38088: Flags [P.], seq 58767:64263, ack 867, win 65535, length 5496
19:32:08.155113 IP 10.0.2.15.38088 > 151.101.117.67.443: Flags [.], ack 64263, win 61320, length 0
19:32:08.156036 IP 151.101.117.67.443 > 10.0.2.15.38088: Flags [P.], seq 64263:69759, ack 867, win 65535, length 5496
19:32:08.156053 IP 10.0.2.15.38088 > 151.101.117.67.443: Flags [.], ack 69759, win 61320, length 0
19:32:08.157378 IP 151.101.117.67.443 > 10.0.2.15.38088: Flags [.], seq 69759:75599, ack 867, win 65535, length 5840
19:32:08.157400 IP 10.0.2.15.38088 > 151.101.117.67.443: Flags [.], ack 75599, win 65535, length 0
19:32:08.157527 IP 151.101.117.67.443 > 10.0.2.15.38088: Flags [P.], seq 75599:76629, ack 867, win 65535, length 1030
19:32:08.158627 IP 151.101.117.67.443 > 10.0.2.15.38088: Flags [P.], seq 76629:82125, ack 867, win 65535, length 5496
19:32:08.158631 IP 151.101.117.67.443 > 10.0.2.15.38088: Flags [P.], seq 82125:84873, ack 867, win 65535, length 2748
19:32:08.158660 IP 10.0.2.15.38088 > 151.101.117.67.443: Flags [.], ack 82125, win 65535, length 0
19:32:08.159186 IP 10.0.2.15.38088 > 151.101.117.67.443: Flags [.], ack 84873, win 65535, length 0
19:32:08.161852 IP 151.101.117.67.443 > 10.0.2.15.38088: Flags [P.], seq 84873:87621, ack 867, win 65535, length 2748
19:32:08.161856 IP 151.101.117.67.443 > 10.0.2.15.38088: Flags [.], seq 87621:96381, ack 867, win 65535, length 8760
19:32:08.161886 IP 10.0.2.15.38088 > 151.101.117.67.443: Flags [.], ack 87621, win 65535, length 0
19:32:08.161997 IP 10.0.2.15.38088 > 151.101.117.67.443: Flags [.], ack 96381, win 65535, length 0
19:32:08.162444 IP 151.101.117.67.443 > 10.0.2.15.38088: Flags [P.], seq 96381:102735, ack 867, win 65535, length 6354
19:32:08.162447 IP 151.101.117.67.443 > 10.0.2.15.38088: Flags [P.], seq 102735:109605, ack 867, win 65535, length 6870
19:32:08.162470 IP 10.0.2.15.38088 > 151.101.117.67.443: Flags [.], ack 102735, win 65535, length 0
19:32:08.162567 IP 10.0.2.15.38088 > 151.101.117.67.443: Flags [.], ack 109605, win 65535, length 0
19:32:08.162608 IP 151.101.117.67.443 > 10.0.2.15.38088: Flags [P.], seq 109605:116475, ack 867, win 65535, length 6870
19:32:08.162610 IP 151.101.117.67.443 > 10.0.2.15.38088: Flags [P.], seq 116475:120597, ack 867, win 65535, length 4122
19:32:08.162619 IP 10.0.2.15.38088 > 151.101.117.67.443: Flags [.], ack 116475, win 65535, length 0
19:32:08.162635 IP 10.0.2.15.38088 > 151.101.117.67.443: Flags [.], ack 120597, win 65535, length 0
19:32:08.163850 IP 151.101.117.67.443 > 10.0.2.15.38088: Flags [P.], seq 120597:127467, ack 867, win 65535, length 6870
19:32:08.163853 IP 151.101.117.67.443 > 10.0.2.15.38088: Flags [P.], seq 127467:128841, ack 867, win 65535, length 1374
19:32:08.163877 IP 10.0.2.15.38088 > 151.101.117.67.443: Flags [.], ack 127467, win 65535, length 0
19:32:08.164614 IP 151.101.117.67.443 > 10.0.2.15.38088: Flags [P.], seq 128841:130215, ack 867, win 65535, length 1374
19:32:08.164671 IP 10.0.2.15.38088 > 151.101.117.67.443: Flags [.], ack 130215, win 65535, length 0
19:32:08.165888 IP 151.101.117.67.443 > 10.0.2.15.38088: Flags [P.], seq 130215:137085, ack 867, win 65535, length 6870
19:32:08.165907 IP 10.0.2.15.38088 > 151.101.117.67.443: Flags [.], ack 137085, win 65535, length 0
19:32:08.169123 IP 151.101.117.67.443 > 10.0.2.15.38088: Flags [P.], seq 137085:165939, ack 867, win 65535, length 28854
19:32:08.169146 IP 10.0.2.15.38088 > 151.101.117.67.443: Flags [.], ack 165939, win 65535, length 0
19:32:08.170918 IP 151.101.117.67.443 > 10.0.2.15.38088: Flags [P.], seq 165939:171435, ack 867, win 65535, length 5496
19:32:08.170921 IP 151.101.117.67.443 > 10.0.2.15.38088: Flags [P.], seq 171435:176931, ack 867, win 65535, length 5496
19:32:08.170950 IP 10.0.2.15.38088 > 151.101.117.67.443: Flags [.], ack 171435, win 65535, length 0
19:32:08.170984 IP 10.0.2.15.38088 > 151.101.117.67.443: Flags [.], ack 176931, win 65535, length 0
19:32:08.171011 IP 151.101.117.67.443 > 10.0.2.15.38088: Flags [P.], seq 176931:178305, ack 867, win 65535, length 1374
19:32:08.171012 IP 151.101.117.67.443 > 10.0.2.15.38088: Flags [P.], seq 178305:179679, ack 867, win 65535, length 1374
19:32:08.171022 IP 10.0.2.15.38088 > 151.101.117.67.443: Flags [.], ack 179679, win 65535, length 0
19:32:08.172310 IP 151.101.117.67.443 > 10.0.2.15.38088: Flags [P.], seq 179679:186549, ack 867, win 65535, length 6870
19:32:08.172312 IP 151.101.117.67.443 > 10.0.2.15.38088: Flags [P.], seq 186549:189297, ack 867, win 65535, length 2748
19:32:08.172313 IP 151.101.117.67.443 > 10.0.2.15.38088: Flags [P.], seq 189297:190671, ack 867, win 65535, length 1374
19:32:08.172338 IP 10.0.2.15.38088 > 151.101.117.67.443: Flags [.], ack 186549, win 65535, length 0
19:32:08.172361 IP 10.0.2.15.38088 > 151.101.117.67.443: Flags [.], ack 189297, win 65535, length 0
19:32:08.172385 IP 151.101.117.67.443 > 10.0.2.15.38088: Flags [P.], seq 190671:193419, ack 867, win 65535, length 2748
19:32:08.172389 IP 10.0.2.15.38088 > 151.101.117.67.443: Flags [.], ack 193419, win 65535, length 0
19:32:08.174314 IP 151.101.117.67.443 > 10.0.2.15.38088: Flags [P.], seq 193419:200289, ack 867, win 65535, length 6870
19:32:08.174317 IP 151.101.117.67.443 > 10.0.2.15.38088: Flags [P.], seq 200289:205785, ack 867, win 65535, length 5496
19:32:08.174350 IP 10.0.2.15.38088 > 151.101.117.67.443: Flags [.], ack 200289, win 65535, length 0
19:32:08.174437 IP 10.0.2.15.38088 > 151.101.117.67.443: Flags [.], ack 205785, win 65535, length 0
19:32:08.174466 IP 151.101.117.67.443 > 10.0.2.15.38088: Flags [P.], seq 205785:208533, ack 867, win 65535, length 2748
19:32:08.174737 IP 10.0.2.15.38088 > 151.101.117.67.443: Flags [.], ack 208533, win 65535, length 0
19:32:08.177082 IP 151.101.117.67.443 > 10.0.2.15.38088: Flags [P.], seq 208533:215403, ack 867, win 65535, length 6870
19:32:08.177086 IP 151.101.117.67.443 > 10.0.2.15.38088: Flags [P.], seq 215403:216777, ack 867, win 65535, length 1374
19:32:08.177087 IP 151.101.117.67.443 > 10.0.2.15.38088: Flags [.], seq 216777:218237, ack 867, win 65535, length 1460
19:32:08.177118 IP 10.0.2.15.38088 > 151.101.117.67.443: Flags [.], ack 215403, win 65535, length 0
19:32:08.177187 IP 10.0.2.15.38088 > 151.101.117.67.443: Flags [.], ack 218237, win 65535, length 0
19:32:08.177921 IP 151.101.117.67.443 > 10.0.2.15.38088: Flags [P.], seq 218237:241509, ack 867, win 65535, length 23272
19:32:08.177950 IP 10.0.2.15.38088 > 151.101.117.67.443: Flags [.], ack 241509, win 65535, length 0
19:32:08.178165 IP 151.101.117.67.443 > 10.0.2.15.38088: Flags [P.], seq 241509:251127, ack 867, win 65535, length 9618
19:32:08.178183 IP 10.0.2.15.38088 > 151.101.117.67.443: Flags [.], ack 251127, win 65535, length 0
19:32:08.178370 IP 151.101.117.67.443 > 10.0.2.15.38088: Flags [.], seq 251127:254047, ack 867, win 65535, length 2920
19:32:08.178382 IP 10.0.2.15.38088 > 151.101.117.67.443: Flags [.], ack 254047, win 65535, length 0
19:32:08.178633 IP 151.101.117.67.443 > 10.0.2.15.38088: Flags [.], seq 254047:262807, ack 867, win 65535, length 8760
19:32:08.178648 IP 10.0.2.15.38088 > 151.101.117.67.443: Flags [.], ack 262807, win 65535, length 0
19:32:08.179321 IP 151.101.117.67.443 > 10.0.2.15.38088: Flags [P.], seq 262807:263493, ack 867, win 65535, length 686
19:32:08.179325 IP 151.101.117.67.443 > 10.0.2.15.38088: Flags [P.], seq 263493:270363, ack 867, win 65535, length 6870
19:32:08.179398 IP 10.0.2.15.38088 > 151.101.117.67.443: Flags [.], ack 270363, win 65535, length 0
19:32:08.179664 IP 151.101.117.67.443 > 10.0.2.15.38088: Flags [P.], seq 270363:278607, ack 867, win 65535, length 8244
19:32:08.179666 IP 151.101.117.67.443 > 10.0.2.15.38088: Flags [P.], seq 278607:282729, ack 867, win 65535, length 4122
19:32:08.179836 IP 10.0.2.15.38088 > 151.101.117.67.443: Flags [.], ack 278607, win 65535, length 0
19:32:08.179863 IP 10.0.2.15.38088 > 151.101.117.67.443: Flags [.], ack 282729, win 65535, length 0
19:32:08.179884 IP 151.101.117.67.443 > 10.0.2.15.38088: Flags [P.], seq 282729:285477, ack 867, win 65535, length 2748
19:32:08.179886 IP 151.101.117.67.443 > 10.0.2.15.38088: Flags [P.], seq 285477:288225, ack 867, win 65535, length 2748
19:32:08.179898 IP 10.0.2.15.38088 > 151.101.117.67.443: Flags [.], ack 285477, win 65535, length 0
19:32:08.179910 IP 10.0.2.15.38088 > 151.101.117.67.443: Flags [.], ack 288225, win 65535, length 0
19:32:08.186246 IP 151.101.117.67.443 > 10.0.2.15.38088: Flags [P.], seq 288225:306087, ack 867, win 65535, length 17862
19:32:08.186267 IP 10.0.2.15.38088 > 151.101.117.67.443: Flags [.], ack 306087, win 65535, length 0
19:32:08.186515 IP 151.101.117.67.443 > 10.0.2.15.38088: Flags [P.], seq 306087:344047, ack 867, win 65535, length 37960
19:32:08.186525 IP 10.0.2.15.38088 > 151.101.117.67.443: Flags [.], ack 344047, win 65535, length 0
19:32:08.188292 IP 151.101.117.67.443 > 10.0.2.15.38088: Flags [P.], seq 344047:389901, ack 867, win 65535, length 45854
19:32:08.188315 IP 10.0.2.15.38088 > 151.101.117.67.443: Flags [.], ack 389901, win 65535, length 0
19:32:08.189233 IP 151.101.117.67.443 > 10.0.2.15.38088: Flags [.], seq 389901:391361, ack 867, win 65535, length 1460
19:32:08.189879 IP 151.101.117.67.443 > 10.0.2.15.38088: Flags [P.], seq 391361:421503, ack 867, win 65535, length 30142
19:32:08.189900 IP 10.0.2.15.38088 > 151.101.117.67.443: Flags [.], ack 421503, win 65535, length 0
19:32:08.189998 IP 151.101.117.67.443 > 10.0.2.15.38088: Flags [P.], seq 421503:433869, ack 867, win 65535, length 12366
19:32:08.190004 IP 10.0.2.15.38088 > 151.101.117.67.443: Flags [.], ack 433869, win 65535, length 0
19:32:08.190754 IP 151.101.117.67.443 > 10.0.2.15.38088: Flags [.], seq 433869:435329, ack 867, win 65535, length 1460
19:32:08.192744 IP 151.101.117.67.443 > 10.0.2.15.38088: Flags [P.], seq 435329:437991, ack 867, win 65535, length 2662
19:32:08.192746 IP 151.101.117.67.443 > 10.0.2.15.38088: Flags [P.], seq 437991:444861, ack 867, win 65535, length 6870
19:32:08.192752 IP 151.101.117.67.443 > 10.0.2.15.38088: Flags [P.], seq 444861:468219, ack 867, win 65535, length 23358
19:32:08.192777 IP 10.0.2.15.38088 > 151.101.117.67.443: Flags [.], ack 437991, win 65535, length 0
19:32:08.192857 IP 10.0.2.15.38088 > 151.101.117.67.443: Flags [.], ack 444861, win 65535, length 0
19:32:08.192944 IP 10.0.2.15.38088 > 151.101.117.67.443: Flags [.], ack 468219, win 65535, length 0
19:32:08.193510 IP 151.101.117.67.443 > 10.0.2.15.38088: Flags [P.], seq 468219:484707, ack 867, win 65535, length 16488
19:32:08.193534 IP 10.0.2.15.38088 > 151.101.117.67.443: Flags [.], ack 484707, win 65535, length 0
19:32:08.194035 IP 151.101.117.67.443 > 10.0.2.15.38088: Flags [P.], seq 484707:492951, ack 867, win 65535, length 8244
19:32:08.194037 IP 151.101.117.67.443 > 10.0.2.15.38088: Flags [P.], seq 492951:495699, ack 867, win 65535, length 2748
19:32:08.194066 IP 10.0.2.15.38088 > 151.101.117.67.443: Flags [.], ack 492951, win 65535, length 0
19:32:08.194209 IP 10.0.2.15.38088 > 151.101.117.67.443: Flags [.], ack 495699, win 65535, length 0
19:32:08.194240 IP 151.101.117.67.443 > 10.0.2.15.38088: Flags [P.], seq 495699:498447, ack 867, win 65535, length 2748
19:32:08.194246 IP 10.0.2.15.38088 > 151.101.117.67.443: Flags [.], ack 498447, win 65535, length 0
19:32:08.198744 IP 151.101.117.67.443 > 10.0.2.15.38088: Flags [P.], seq 498447:502569, ack 867, win 65535, length 4122
19:32:08.198748 IP 151.101.117.67.443 > 10.0.2.15.38088: Flags [P.], seq 502569:513561, ack 867, win 65535, length 10992
19:32:08.198946 IP 10.0.2.15.38088 > 151.101.117.67.443: Flags [.], ack 502569, win 65535, length 0
19:32:08.200157 IP 10.0.2.15.38088 > 151.101.117.67.443: Flags [.], ack 513561, win 65535, length 0
19:32:08.200215 IP 151.101.117.67.443 > 10.0.2.15.38088: Flags [P.], seq 513561:521805, ack 867, win 65535, length 8244
19:32:08.200217 IP 151.101.117.67.443 > 10.0.2.15.38088: Flags [P.], seq 521805:530049, ack 867, win 65535, length 8244
19:32:08.200227 IP 10.0.2.15.38088 > 151.101.117.67.443: Flags [.], ack 521805, win 65535, length 0
19:32:08.200239 IP 10.0.2.15.38088 > 151.101.117.67.443: Flags [.], ack 530049, win 65535, length 0
19:32:08.200282 IP 151.101.117.67.443 > 10.0.2.15.38088: Flags [P.], seq 530049:560277, ack 867, win 65535, length 30228
19:32:08.200287 IP 10.0.2.15.38088 > 151.101.117.67.443: Flags [.], ack 560277, win 65535, length 0
19:32:08.201019 IP 151.101.117.67.443 > 10.0.2.15.38088: Flags [P.], seq 560277:585009, ack 867, win 65535, length 24732
19:32:08.201039 IP 10.0.2.15.38088 > 151.101.117.67.443: Flags [.], ack 585009, win 65535, length 0
19:32:08.201590 IP 151.101.117.67.443 > 10.0.2.15.38088: Flags [P.], seq 585009:593253, ack 867, win 65535, length 8244
19:32:08.201666 IP 10.0.2.15.38088 > 151.101.117.67.443: Flags [.], ack 593253, win 65535, length 0
19:32:08.201912 IP 151.101.117.67.443 > 10.0.2.15.38088: Flags [P.], seq 593253:600123, ack 867, win 65535, length 6870
19:32:08.201916 IP 151.101.117.67.443 > 10.0.2.15.38088: Flags [P.], seq 600123:602871, ack 867, win 65535, length 2748
19:32:08.201917 IP 151.101.117.67.443 > 10.0.2.15.38088: Flags [P.], seq 602871:604245, ack 867, win 65535, length 1374
19:32:08.202068 IP 10.0.2.15.38088 > 151.101.117.67.443: Flags [.], ack 600123, win 65535, length 0
19:32:08.202089 IP 10.0.2.15.38088 > 151.101.117.67.443: Flags [.], ack 602871, win 65535, length 0
19:32:08.202119 IP 151.101.117.67.443 > 10.0.2.15.38088: Flags [P.], seq 604245:609741, ack 867, win 65535, length 5496
19:32:08.202124 IP 10.0.2.15.38088 > 151.101.117.67.443: Flags [.], ack 609741, win 65535, length 0
19:32:08.202465 IP 151.101.117.67.443 > 10.0.2.15.38088: Flags [P.], seq 609741:616611, ack 867, win 65535, length 6870
19:32:08.202496 IP 10.0.2.15.38088 > 151.101.117.67.443: Flags [.], ack 616611, win 65535, length 0
19:32:08.202751 IP 151.101.117.67.443 > 10.0.2.15.38088: Flags [P.], seq 616611:620733, ack 867, win 65535, length 4122
19:32:08.202962 IP 151.101.117.67.443 > 10.0.2.15.38088: Flags [P.], seq 620733:623481, ack 867, win 65535, length 2748
19:32:08.202993 IP 10.0.2.15.38088 > 151.101.117.67.443: Flags [.], ack 620733, win 65535, length 0
19:32:08.203144 IP 151.101.117.67.443 > 10.0.2.15.38088: Flags [P.], seq 623481:626229, ack 867, win 65535, length 2748
19:32:08.203318 IP 151.101.117.67.443 > 10.0.2.15.38088: Flags [P.], seq 626229:628977, ack 867, win 65535, length 2748
19:32:08.203320 IP 151.101.117.67.443 > 10.0.2.15.38088: Flags [P.], seq 628977:633099, ack 867, win 65535, length 4122
19:32:08.203351 IP 10.0.2.15.38088 > 151.101.117.67.443: Flags [.], ack 633099, win 65535, length 0
19:32:08.203588 IP 151.101.117.67.443 > 10.0.2.15.38088: Flags [P.], seq 633099:635847, ack 867, win 65535, length 2748
19:32:08.203599 IP 10.0.2.15.38088 > 151.101.117.67.443: Flags [.], ack 635847, win 65535, length 0
19:32:08.203998 IP 151.101.117.67.443 > 10.0.2.15.38088: Flags [P.], seq 635847:641343, ack 867, win 65535, length 5496
19:32:08.204000 IP 151.101.117.67.443 > 10.0.2.15.38088: Flags [P.], seq 641343:645465, ack 867, win 65535, length 4122
19:32:08.204013 IP 10.0.2.15.38088 > 151.101.117.67.443: Flags [.], ack 641343, win 65535, length 0
19:32:08.204228 IP 151.101.117.67.443 > 10.0.2.15.38088: Flags [P.], seq 645465:646839, ack 867, win 65535, length 1374
19:32:08.204247 IP 10.0.2.15.38088 > 151.101.117.67.443: Flags [.], ack 645465, win 65535, length 0
19:32:08.205283 IP 151.101.117.67.443 > 10.0.2.15.38088: Flags [P.], seq 646839:657831, ack 867, win 65535, length 10992
19:32:08.205303 IP 10.0.2.15.38088 > 151.101.117.67.443: Flags [.], ack 657831, win 65535, length 0
19:32:08.205419 IP 151.101.117.67.443 > 10.0.2.15.38088: Flags [P.], seq 657831:659205, ack 867, win 65535, length 1374
19:32:08.205421 IP 151.101.117.67.443 > 10.0.2.15.38088: Flags [.], seq 659205:660665, ack 867, win 65535, length 1460
19:32:08.205437 IP 10.0.2.15.38088 > 151.101.117.67.443: Flags [.], ack 660665, win 65535, length 0
19:32:08.205787 IP 151.101.117.67.443 > 10.0.2.15.38088: Flags [P.], seq 660665:661953, ack 867, win 65535, length 1288
19:32:08.205790 IP 151.101.117.67.443 > 10.0.2.15.38088: Flags [P.], seq 661953:667449, ack 867, win 65535, length 5496
19:32:08.205857 IP 10.0.2.15.38088 > 151.101.117.67.443: Flags [.], ack 667449, win 65535, length 0
19:32:08.206149 IP 151.101.117.67.443 > 10.0.2.15.38088: Flags [.], seq 667449:668909, ack 867, win 65535, length 1460
19:32:08.206540 IP 151.101.117.67.443 > 10.0.2.15.38088: Flags [P.], seq 668909:674319, ack 867, win 65535, length 5410
19:32:08.208693 IP 151.101.117.67.443 > 10.0.2.15.38088: Flags [.], seq 674319:710819, ack 867, win 65535, length 36500
19:32:08.209804 IP 151.101.117.67.443 > 10.0.2.15.38088: Flags [P.], seq 710819:725157, ack 867, win 65535, length 14338
19:32:08.212536 IP 10.0.2.15.38088 > 151.101.117.67.443: Flags [.], ack 725157, win 65535, length 0
19:32:08.213724 IP 151.101.117.67.443 > 10.0.2.15.38088: Flags [P.], seq 725157:789735, ack 867, win 65535, length 64578
19:32:08.213745 IP 10.0.2.15.38088 > 151.101.117.67.443: Flags [.], ack 789735, win 65535, length 0
19:32:08.215124 IP 151.101.117.67.443 > 10.0.2.15.38088: Flags [.], seq 789735:792655, ack 867, win 65535, length 2920
19:32:08.216765 IP 10.0.2.15.38088 > 151.101.117.67.443: Flags [.], ack 792655, win 65535, length 0
19:32:08.217497 IP 151.101.117.67.443 > 10.0.2.15.38088: Flags [.], seq 792655:794115, ack 867, win 65535, length 1460
19:32:08.218575 IP 151.101.117.67.443 > 10.0.2.15.38088: Flags [.], seq 794115:795575, ack 867, win 65535, length 1460
19:32:08.218599 IP 10.0.2.15.38088 > 151.101.117.67.443: Flags [.], ack 795575, win 65535, length 0
19:32:08.219675 IP 151.101.117.67.443 > 10.0.2.15.38088: Flags [P.], seq 795575:815841, ack 867, win 65535, length 20266
19:32:08.219697 IP 10.0.2.15.38088 > 151.101.117.67.443: Flags [.], ack 815841, win 65535, length 0
19:32:08.220743 IP 151.101.117.67.443 > 10.0.2.15.38088: Flags [P.], seq 815841:861101, ack 867, win 65535, length 45260
19:32:08.220764 IP 10.0.2.15.38088 > 151.101.117.67.443: Flags [.], ack 861101, win 65535, length 0
19:32:08.221624 IP 151.101.117.67.443 > 10.0.2.15.38088: Flags [.], seq 861101:925341, ack 867, win 65535, length 64240
19:32:08.221648 IP 10.0.2.15.38088 > 151.101.117.67.443: Flags [.], ack 925341, win 65535, length 0
19:32:08.221844 IP 151.101.117.67.443 > 10.0.2.15.38088: Flags [P.], seq 925341:926801, ack 867, win 65535, length 1460
19:32:08.222373 IP 151.101.117.67.443 > 10.0.2.15.38088: Flags [.], seq 926801:929721, ack 867, win 65535, length 2920
19:32:08.222462 IP 10.0.2.15.38088 > 151.101.117.67.443: Flags [.], ack 929721, win 65535, length 0
19:32:08.222936 IP 151.101.117.67.443 > 10.0.2.15.38088: Flags [.], seq 929721:932641, ack 867, win 65535, length 2920
19:32:08.222954 IP 10.0.2.15.38088 > 151.101.117.67.443: Flags [.], ack 932641, win 65535, length 0
19:32:08.225436 IP 151.101.117.67.443 > 10.0.2.15.38088: Flags [P.], seq 932641:951867, ack 867, win 65535, length 19226
19:32:08.225456 IP 10.0.2.15.38088 > 151.101.117.67.443: Flags [.], ack 951867, win 65535, length 0
19:32:08.225523 IP 151.101.117.67.443 > 10.0.2.15.38088: Flags [.], seq 951867:970847, ack 867, win 65535, length 18980
19:32:08.226195 IP 151.101.117.67.443 > 10.0.2.15.38088: Flags [P.], seq 970847:997127, ack 867, win 65535, length 26280
19:32:08.226839 IP 10.0.2.15.38088 > 151.101.117.67.443: Flags [.], ack 997127, win 65535, length 0
19:32:08.227601 IP 151.101.117.67.443 > 10.0.2.15.38088: Flags [.], seq 997127:1019027, ack 867, win 65535, length 21900
19:32:08.228048 IP 151.101.117.67.443 > 10.0.2.15.38088: Flags [P.], seq 1019027:1041177, ack 867, win 65535, length 22150
19:32:08.233947 IP 10.0.2.15.38088 > 151.101.117.67.443: Flags [.], ack 1041177, win 65535, length 0
19:32:08.234295 IP 151.101.117.67.443 > 10.0.2.15.38088: Flags [.], seq 1041177:1052857, ack 867, win 65535, length 11680

