19:31:29.629453 IP 10.0.2.15.35952 > 140.233.253.2.53: 39726+ A? www.cnn.com. (29)
19:31:29.629497 IP 10.0.2.15.35952 > 140.233.253.2.53: 53779+ AAAA? www.cnn.com. (29)
19:31:29.648167 IP 140.233.253.2.53 > 10.0.2.15.35952: 53779 2/0/0 CNAME turner-tls.map.fastly.net., AAAA 2a04:4e42:1c::323 (96)
19:31:29.648447 IP 140.233.253.2.53 > 10.0.2.15.35952: 39726 2/0/0 CNAME turner-tls.map.fastly.net., A 151.101.117.67 (84)
19:31:29.648820 IP 10.0.2.15.38074 > 151.101.117.67.443: Flags [S], seq 1822776659, win 64240, options [mss 1460,sackOK,TS val 1396808621 ecr 0,nop,wscale 6], length 0
19:31:29.662608 IP 151.101.117.67.443 > 10.0.2.15.38074: Flags [S.], seq 171264001, ack 1822776660, win 65535, options [mss 1460], length 0
19:31:29.662648 IP 10.0.2.15.38074 > 151.101.117.67.443: Flags [.], ack 1, win 64240, length 0
19:31:29.670799 IP 10.0.2.15.38074 > 151.101.117.67.443: Flags [P.], seq 1:518, ack 1, win 64240, length 517
19:31:29.671097 IP 151.101.117.67.443 > 10.0.2.15.38074: Flags [.], ack 518, win 65535, length 0
19:31:29.688399 IP 151.101.117.67.443 > 10.0.2.15.38074: Flags [.], seq 1:2921, ack 518, win 65535, length 2920
19:31:29.688517 IP 10.0.2.15.38074 > 151.101.117.67.443: Flags [.], ack 2921, win 62780, length 0
19:31:29.688862 IP 151.101.117.67.443 > 10.0.2.15.38074: Flags [P.], seq 2921:4123, ack 518, win 65535, length 1202
19:31:29.688882 IP 10.0.2.15.38074 > 151.101.117.67.443: Flags [.], ack 4123, win 61578, length 0
19:31:29.690373 IP 151.101.117.67.443 > 10.0.2.15.38074: Flags [P.], seq 4123:5064, ack 518, win 65535, length 941
19:31:29.690395 IP 10.0.2.15.38074 > 151.101.117.67.443: Flags [.], ack 5064, win 62780, length 0
19:31:29.691977 IP 10.0.2.15.38074 > 151.101.117.67.443: Flags [P.], seq 518:611, ack 5064, win 62780, length 93
19:31:29.692470 IP 151.101.117.67.443 > 10.0.2.15.38074: Flags [.], ack 611, win 65535, length 0
19:31:29.707571 IP 151.101.117.67.443 > 10.0.2.15.38074: Flags [P.], seq 5064:5115, ack 611, win 65535, length 51
19:31:29.707597 IP 10.0.2.15.38074 > 151.101.117.67.443: Flags [.], ack 5115, win 62780, length 0
19:31:29.708173 IP 10.0.2.15.38074 > 151.101.117.67.443: Flags [P.], seq 611:664, ack 5115, win 62780, length 53
19:31:29.708221 IP 10.0.2.15.38074 > 151.101.117.67.443: Flags [P.], seq 664:720, ack 5115, win 62780, length 56
19:31:29.708389 IP 10.0.2.15.38074 > 151.101.117.67.443: Flags [P.], seq 720:829, ack 5115, win 62780, length 109
19:31:29.708611 IP 151.101.117.67.443 > 10.0.2.15.38074: Flags [.], ack 664, win 65535, length 0
19:31:29.708748 IP 151.101.117.67.443 > 10.0.2.15.38074: Flags [.], ack 720, win 65535, length 0
19:31:29.708749 IP 151.101.117.67.443 > 10.0.2.15.38074: Flags [.], ack 829, win 65535, length 0
19:31:29.721418 IP 151.101.117.67.443 > 10.0.2.15.38074: Flags [P.], seq 5115:5210, ack 829, win 65535, length 95
19:31:29.721444 IP 10.0.2.15.38074 > 151.101.117.67.443: Flags [.], ack 5210, win 62780, length 0
19:31:29.721910 IP 10.0.2.15.38074 > 151.101.117.67.443: Flags [P.], seq 829:867, ack 5210, win 62780, length 38
19:31:29.722297 IP 151.101.117.67.443 > 10.0.2.15.38074: Flags [.], ack 867, win 65535, length 0
19:31:29.723494 IP 151.101.117.67.443 > 10.0.2.15.38074: Flags [P.], seq 5210:9332, ack 867, win 65535, length 4122
19:31:29.723496 IP 151.101.117.67.443 > 10.0.2.15.38074: Flags [P.], seq 9332:12080, ack 867, win 65535, length 2748
19:31:29.723596 IP 10.0.2.15.38074 > 151.101.117.67.443: Flags [.], ack 12080, win 59860, length 0
19:31:29.724378 IP 151.101.117.67.443 > 10.0.2.15.38074: Flags [P.], seq 12080:14828, ack 867, win 65535, length 2748
19:31:29.724394 IP 10.0.2.15.38074 > 151.101.117.67.443: Flags [.], ack 14828, win 62780, length 0
19:31:29.725695 IP 151.101.117.67.443 > 10.0.2.15.38074: Flags [P.], seq 14828:20324, ack 867, win 65535, length 5496
19:31:29.725792 IP 10.0.2.15.38074 > 151.101.117.67.443: Flags [.], ack 20324, win 61320, length 0
19:31:29.726496 IP 151.101.117.67.443 > 10.0.2.15.38074: Flags [P.], seq 20324:24446, ack 867, win 65535, length 4122
19:31:29.726510 IP 10.0.2.15.38074 > 151.101.117.67.443: Flags [.], ack 24446, win 61320, length 0
19:31:29.727636 IP 151.101.117.67.443 > 10.0.2.15.38074: Flags [P.], seq 24446:28568, ack 867, win 65535, length 4122
19:31:29.727651 IP 10.0.2.15.38074 > 151.101.117.67.443: Flags [.], ack 28568, win 61320, length 0
19:31:29.729973 IP 151.101.117.67.443 > 10.0.2.15.38074: Flags [P.], seq 28568:34064, ack 867, win 65535, length 5496
19:31:29.730035 IP 10.0.2.15.38074 > 151.101.117.67.443: Flags [.], ack 34064, win 61320, length 0
19:31:29.731071 IP 151.101.117.67.443 > 10.0.2.15.38074: Flags [P.], seq 34064:40934, ack 867, win 65535, length 6870
19:31:29.731073 IP 151.101.117.67.443 > 10.0.2.15.38074: Flags [P.], seq 40934:42308, ack 867, win 65535, length 1374
19:31:29.731146 IP 10.0.2.15.38074 > 151.101.117.67.443: Flags [.], ack 42308, win 58400, length 0
19:31:29.733214 IP 151.101.117.67.443 > 10.0.2.15.38074: Flags [P.], seq 42308:43682, ack 867, win 65535, length 1374
19:31:29.733981 IP 151.101.117.67.443 > 10.0.2.15.38074: Flags [P.], seq 43682:45056, ack 867, win 65535, length 1374
19:31:29.733998 IP 10.0.2.15.38074 > 151.101.117.67.443: Flags [.], ack 45056, win 63204, length 0
19:31:29.735260 IP 151.101.117.67.443 > 10.0.2.15.38074: Flags [P.], seq 45056:46430, ack 867, win 65535, length 1374
19:31:29.735976 IP 151.101.117.67.443 > 10.0.2.15.38074: Flags [P.], seq 46430:51926, ack 867, win 65535, length 5496
19:31:29.735978 IP 151.101.117.67.443 > 10.0.2.15.38074: Flags [P.], seq 51926:53300, ack 867, win 65535, length 1374
19:31:29.736051 IP 10.0.2.15.38074 > 151.101.117.67.443: Flags [.], ack 53300, win 59860, length 0
19:31:29.737411 IP 151.101.117.67.443 > 10.0.2.15.38074: Flags [P.], seq 53300:58796, ack 867, win 65535, length 5496
19:31:29.737516 IP 10.0.2.15.38074 > 151.101.117.67.443: Flags [.], ack 58796, win 61320, length 0
19:31:29.738236 IP 151.101.117.67.443 > 10.0.2.15.38074: Flags [P.], seq 58796:65666, ack 867, win 65535, length 6870
19:31:29.738285 IP 10.0.2.15.38074 > 151.101.117.67.443: Flags [.], ack 65666, win 59860, length 0
19:31:29.739814 IP 151.101.117.67.443 > 10.0.2.15.38074: Flags [P.], seq 65666:71162, ack 867, win 65535, length 5496
19:31:29.739839 IP 10.0.2.15.38074 > 151.101.117.67.443: Flags [.], ack 71162, win 61320, length 0
19:31:29.740647 IP 151.101.117.67.443 > 10.0.2.15.38074: Flags [P.], seq 71162:78032, ack 867, win 65535, length 6870
19:31:29.740649 IP 151.101.117.67.443 > 10.0.2.15.38074: Flags [P.], seq 78032:82154, ack 867, win 65535, length 4122
19:31:29.740664 IP 10.0.2.15.38074 > 151.101.117.67.443: Flags [.], ack 78032, win 65535, length 0
19:31:29.740690 IP 10.0.2.15.38074 > 151.101.117.67.443: Flags [.], ack 82154, win 65535, length 0
19:31:29.740743 IP 151.101.117.67.443 > 10.0.2.15.38074: Flags [P.], seq 82154:83528, ack 867, win 65535, length 1374
19:31:29.741801 IP 151.101.117.67.443 > 10.0.2.15.38074: Flags [P.], seq 83528:87650, ack 867, win 65535, length 4122
19:31:29.741812 IP 10.0.2.15.38074 > 151.101.117.67.443: Flags [.], ack 87650, win 65535, length 0
19:31:29.742926 IP 151.101.117.67.443 > 10.0.2.15.38074: Flags [P.], seq 87650:97268, ack 867, win 65535, length 9618
19:31:29.742928 IP 151.101.117.67.443 > 10.0.2.15.38074: Flags [P.], seq 97268:98642, ack 867, win 65535, length 1374
19:31:29.742944 IP 10.0.2.15.38074 > 151.101.117.67.443: Flags [.], ack 97268, win 65535, length 0
19:31:29.743111 IP 151.101.117.67.443 > 10.0.2.15.38074: Flags [P.], seq 98642:102764, ack 867, win 65535, length 4122
19:31:29.743122 IP 10.0.2.15.38074 > 151.101.117.67.443: Flags [.], ack 102764, win 65535, length 0
19:31:29.745027 IP 151.101.117.67.443 > 10.0.2.15.38074: Flags [P.], seq 102764:109634, ack 867, win 65535, length 6870
19:31:29.745030 IP 151.101.117.67.443 > 10.0.2.15.38074: Flags [P.], seq 109634:113756, ack 867, win 65535, length 4122
19:31:29.745053 IP 10.0.2.15.38074 > 151.101.117.67.443: Flags [.], ack 109634, win 65535, length 0
19:31:29.745185 IP 10.0.2.15.38074 > 151.101.117.67.443: Flags [.], ack 113756, win 65535, length 0
19:31:29.745224 IP 151.101.117.67.443 > 10.0.2.15.38074: Flags [P.], seq 113756:116504, ack 867, win 65535, length 2748
19:31:29.745226 IP 151.101.117.67.443 > 10.0.2.15.38074: Flags [P.], seq 116504:119252, ack 867, win 65535, length 2748
19:31:29.745236 IP 10.0.2.15.38074 > 151.101.117.67.443: Flags [.], ack 116504, win 65535, length 0
19:31:29.745367 IP 10.0.2.15.38074 > 151.101.117.67.443: Flags [.], ack 119252, win 65535, length 0
19:31:29.745695 IP 151.101.117.67.443 > 10.0.2.15.38074: Flags [P.], seq 119252:122000, ack 867, win 65535, length 2748
19:31:29.745704 IP 10.0.2.15.38074 > 151.101.117.67.443: Flags [.], ack 122000, win 65535, length 0
19:31:29.747029 IP 151.101.117.67.443 > 10.0.2.15.38074: Flags [P.], seq 122000:127496, ack 867, win 65535, length 5496
19:31:29.747044 IP 10.0.2.15.38074 > 151.101.117.67.443: Flags [.], ack 127496, win 65535, length 0
19:31:29.747930 IP 151.101.117.67.443 > 10.0.2.15.38074: Flags [P.], seq 127496:131618, ack 867, win 65535, length 4122
19:31:29.747943 IP 10.0.2.15.38074 > 151.101.117.67.443: Flags [.], ack 131618, win 65535, length 0
19:31:29.748988 IP 151.101.117.67.443 > 10.0.2.15.38074: Flags [P.], seq 131618:135740, ack 867, win 65535, length 4122
19:31:29.749001 IP 10.0.2.15.38074 > 151.101.117.67.443: Flags [.], ack 135740, win 65535, length 0
19:31:29.750634 IP 151.101.117.67.443 > 10.0.2.15.38074: Flags [P.], seq 135740:141236, ack 867, win 65535, length 5496
19:31:29.750636 IP 151.101.117.67.443 > 10.0.2.15.38074: Flags [P.], seq 141236:142610, ack 867, win 65535, length 1374
19:31:29.750638 IP 151.101.117.67.443 > 10.0.2.15.38074: Flags [P.], seq 142610:146732, ack 867, win 65535, length 4122
19:31:29.750655 IP 10.0.2.15.38074 > 151.101.117.67.443: Flags [.], ack 141236, win 65535, length 0
19:31:29.750919 IP 10.0.2.15.38074 > 151.101.117.67.443: Flags [.], ack 146732, win 65535, length 0
19:31:29.750954 IP 151.101.117.67.443 > 10.0.2.15.38074: Flags [P.], seq 146732:150854, ack 867, win 65535, length 4122
19:31:29.750955 IP 151.101.117.67.443 > 10.0.2.15.38074: Flags [P.], seq 150854:152228, ack 867, win 65535, length 1374
19:31:29.750957 IP 151.101.117.67.443 > 10.0.2.15.38074: Flags [P.], seq 152228:157724, ack 867, win 65535, length 5496
19:31:29.750965 IP 10.0.2.15.38074 > 151.101.117.67.443: Flags [.], ack 150854, win 65535, length 0
19:31:29.751065 IP 10.0.2.15.38074 > 151.101.117.67.443: Flags [.], ack 157724, win 65535, length 0
19:31:29.751296 IP 151.101.117.67.443 > 10.0.2.15.38074: Flags [P.], seq 157724:161846, ack 867, win 65535, length 4122
19:31:29.751411 IP 10.0.2.15.38074 > 151.101.117.67.443: Flags [.], ack 161846, win 65535, length 0
19:31:29.752759 IP 151.101.117.67.443 > 10.0.2.15.38074: Flags [P.], seq 161846:171464, ack 867, win 65535, length 9618
19:31:29.752761 IP 151.101.117.67.443 > 10.0.2.15.38074: Flags [P.], seq 171464:176960, ack 867, win 65535, length 5496
19:31:29.752775 IP 10.0.2.15.38074 > 151.101.117.67.443: Flags [.], ack 171464, win 65535, length 0
19:31:29.752805 IP 10.0.2.15.38074 > 151.101.117.67.443: Flags [.], ack 176960, win 65535, length 0
19:31:29.753187 IP 151.101.117.67.443 > 10.0.2.15.38074: Flags [P.], seq 176960:181082, ack 867, win 65535, length 4122
19:31:29.753198 IP 10.0.2.15.38074 > 151.101.117.67.443: Flags [.], ack 181082, win 65535, length 0
19:31:29.753921 IP 151.101.117.67.443 > 10.0.2.15.38074: Flags [P.], seq 181082:186578, ack 867, win 65535, length 5496
19:31:29.753923 IP 151.101.117.67.443 > 10.0.2.15.38074: Flags [P.], seq 186578:189326, ack 867, win 65535, length 2748
19:31:29.753937 IP 10.0.2.15.38074 > 151.101.117.67.443: Flags [.], ack 186578, win 65535, length 0
19:31:29.753960 IP 10.0.2.15.38074 > 151.101.117.67.443: Flags [.], ack 189326, win 65535, length 0
19:31:29.754210 IP 151.101.117.67.443 > 10.0.2.15.38074: Flags [P.], seq 189326:192074, ack 867, win 65535, length 2748
19:31:29.754212 IP 151.101.117.67.443 > 10.0.2.15.38074: Flags [P.], seq 192074:194822, ack 867, win 65535, length 2748
19:31:29.754225 IP 10.0.2.15.38074 > 151.101.117.67.443: Flags [.], ack 192074, win 65535, length 0
19:31:29.754241 IP 10.0.2.15.38074 > 151.101.117.67.443: Flags [.], ack 194822, win 65535, length 0
19:31:29.754644 IP 151.101.117.67.443 > 10.0.2.15.38074: Flags [P.], seq 194822:197570, ack 867, win 65535, length 2748
19:31:29.754653 IP 10.0.2.15.38074 > 151.101.117.67.443: Flags [.], ack 197570, win 65535, length 0
19:31:29.756275 IP 151.101.117.67.443 > 10.0.2.15.38074: Flags [P.], seq 197570:207188, ack 867, win 65535, length 9618
19:31:29.756301 IP 10.0.2.15.38074 > 151.101.117.67.443: Flags [.], ack 207188, win 65535, length 0
19:31:29.756852 IP 151.101.117.67.443 > 10.0.2.15.38074: Flags [P.], seq 207188:214058, ack 867, win 65535, length 6870
19:31:29.756857 IP 151.101.117.67.443 > 10.0.2.15.38074: Flags [P.], seq 214058:220928, ack 867, win 65535, length 6870
19:31:29.756913 IP 10.0.2.15.38074 > 151.101.117.67.443: Flags [.], ack 214058, win 65535, length 0
19:31:29.757228 IP 10.0.2.15.38074 > 151.101.117.67.443: Flags [.], ack 220928, win 65535, length 0
19:31:29.757273 IP 151.101.117.67.443 > 10.0.2.15.38074: Flags [P.], seq 220928:223676, ack 867, win 65535, length 2748
19:31:29.757275 IP 151.101.117.67.443 > 10.0.2.15.38074: Flags [P.], seq 223676:229172, ack 867, win 65535, length 5496
19:31:29.757276 IP 151.101.117.67.443 > 10.0.2.15.38074: Flags [P.], seq 229172:231920, ack 867, win 65535, length 2748
19:31:29.757323 IP 10.0.2.15.38074 > 151.101.117.67.443: Flags [.], ack 223676, win 65535, length 0
19:31:29.757347 IP 10.0.2.15.38074 > 151.101.117.67.443: Flags [.], ack 229172, win 65535, length 0
19:31:29.757364 IP 10.0.2.15.38074 > 151.101.117.67.443: Flags [.], ack 231920, win 65535, length 0
19:31:29.758262 IP 151.101.117.67.443 > 10.0.2.15.38074: Flags [P.], seq 231920:236042, ack 867, win 65535, length 4122
19:31:29.758273 IP 10.0.2.15.38074 > 151.101.117.67.443: Flags [.], ack 236042, win 65535, length 0
19:31:29.759010 IP 151.101.117.67.443 > 10.0.2.15.38074: Flags [P.], seq 236042:240164, ack 867, win 65535, length 4122
19:31:29.759012 IP 151.101.117.67.443 > 10.0.2.15.38074: Flags [P.], seq 240164:242912, ack 867, win 65535, length 2748
19:31:29.759024 IP 10.0.2.15.38074 > 151.101.117.67.443: Flags [.], ack 240164, win 65535, length 0
19:31:29.759051 IP 10.0.2.15.38074 > 151.101.117.67.443: Flags [.], ack 242912, win 65535, length 0
19:31:29.760824 IP 151.101.117.67.443 > 10.0.2.15.38074: Flags [P.], seq 242912:247034, ack 867, win 65535, length 4122
19:31:29.760839 IP 10.0.2.15.38074 > 151.101.117.67.443: Flags [.], ack 247034, win 65535, length 0
19:31:29.761445 IP 151.101.117.67.443 > 10.0.2.15.38074: Flags [P.], seq 247034:252530, ack 867, win 65535, length 5496
19:31:29.761449 IP 151.101.117.67.443 > 10.0.2.15.38074: Flags [P.], seq 252530:258026, ack 867, win 65535, length 5496
19:31:29.761564 IP 10.0.2.15.38074 > 151.101.117.67.443: Flags [.], ack 252530, win 65535, length 0
19:31:29.761827 IP 10.0.2.15.38074 > 151.101.117.67.443: Flags [.], ack 258026, win 65535, length 0
19:31:29.762168 IP 151.101.117.67.443 > 10.0.2.15.38074: Flags [P.], seq 258026:260774, ack 867, win 65535, length 2748
19:31:29.762170 IP 151.101.117.67.443 > 10.0.2.15.38074: Flags [P.], seq 260774:267644, ack 867, win 65535, length 6870
19:31:29.762171 IP 151.101.117.67.443 > 10.0.2.15.38074: Flags [P.], seq 267644:270392, ack 867, win 65535, length 2748
19:31:29.762184 IP 10.0.2.15.38074 > 151.101.117.67.443: Flags [.], ack 260774, win 65535, length 0
19:31:29.762199 IP 10.0.2.15.38074 > 151.101.117.67.443: Flags [.], ack 267644, win 65535, length 0
19:31:29.762211 IP 10.0.2.15.38074 > 151.101.117.67.443: Flags [.], ack 270392, win 65535, length 0
19:31:29.762230 IP 151.101.117.67.443 > 10.0.2.15.38074: Flags [P.], seq 270392:273140, ack 867, win 65535, length 2748
19:31:29.762231 IP 151.101.117.67.443 > 10.0.2.15.38074: Flags [P.], seq 273140:277262, ack 867, win 65535, length 4122
19:31:29.762237 IP 10.0.2.15.38074 > 151.101.117.67.443: Flags [.], ack 273140, win 65535, length 0
19:31:29.762249 IP 10.0.2.15.38074 > 151.101.117.67.443: Flags [.], ack 277262, win 65535, length 0
19:31:29.762962 IP 151.101.117.67.443 > 10.0.2.15.38074: Flags [P.], seq 277262:282758, ack 867, win 65535, length 5496
19:31:29.762964 IP 151.101.117.67.443 > 10.0.2.15.38074: Flags [P.], seq 282758:288254, ack 867, win 65535, length 5496
19:31:29.763028 IP 10.0.2.15.38074 > 151.101.117.67.443: Flags [.], ack 282758, win 65535, length 0
19:31:29.763052 IP 10.0.2.15.38074 > 151.101.117.67.443: Flags [.], ack 288254, win 65535, length 0
19:31:29.763137 IP 151.101.117.67.443 > 10.0.2.15.38074: Flags [P.], seq 288254:293750, ack 867, win 65535, length 5496
19:31:29.763152 IP 10.0.2.15.38074 > 151.101.117.67.443: Flags [.], ack 293750, win 65535, length 0
19:31:29.763365 IP 151.101.117.67.443 > 10.0.2.15.38074: Flags [P.], seq 293750:296498, ack 867, win 65535, length 2748
19:31:29.763366 IP 151.101.117.67.443 > 10.0.2.15.38074: Flags [P.], seq 296498:300620, ack 867, win 65535, length 4122
19:31:29.763377 IP 10.0.2.15.38074 > 151.101.117.67.443: Flags [.], ack 296498, win 65535, length 0
19:31:29.763392 IP 10.0.2.15.38074 > 151.101.117.67.443: Flags [.], ack 300620, win 65535, length 0
19:31:29.764718 IP 151.101.117.67.443 > 10.0.2.15.38074: Flags [P.], seq 300620:306116, ack 867, win 65535, length 5496
19:31:29.764743 IP 10.0.2.15.38074 > 151.101.117.67.443: Flags [.], ack 306116, win 65535, length 0
19:31:29.765090 IP 151.101.117.67.443 > 10.0.2.15.38074: Flags [P.], seq 306116:311612, ack 867, win 65535, length 5496
19:31:29.765093 IP 151.101.117.67.443 > 10.0.2.15.38074: Flags [P.], seq 311612:317108, ack 867, win 65535, length 5496
19:31:29.765108 IP 10.0.2.15.38074 > 151.101.117.67.443: Flags [.], ack 311612, win 65535, length 0
19:31:29.765175 IP 10.0.2.15.38074 > 151.101.117.67.443: Flags [.], ack 317108, win 65535, length 0
19:31:29.765204 IP 151.101.117.67.443 > 10.0.2.15.38074: Flags [P.], seq 317108:321230, ack 867, win 65535, length 4122
19:31:29.765260 IP 10.0.2.15.38074 > 151.101.117.67.443: Flags [.], ack 321230, win 65535, length 0
19:31:29.765508 IP 151.101.117.67.443 > 10.0.2.15.38074: Flags [P.], seq 321230:325352, ack 867, win 65535, length 4122
19:31:29.765510 IP 151.101.117.67.443 > 10.0.2.15.38074: Flags [P.], seq 325352:329474, ack 867, win 65535, length 4122
19:31:29.765518 IP 10.0.2.15.38074 > 151.101.117.67.443: Flags [.], ack 325352, win 65535, length 0
19:31:29.765582 IP 10.0.2.15.38074 > 151.101.117.67.443: Flags [.], ack 329474, win 65535, length 0
19:31:29.765690 IP 151.101.117.67.443 > 10.0.2.15.38074: Flags [P.], seq 329474:332222, ack 867, win 65535, length 2748
19:31:29.765695 IP 10.0.2.15.38074 > 151.101.117.67.443: Flags [.], ack 332222, win 65535, length 0
19:31:29.766165 IP 151.101.117.67.443 > 10.0.2.15.38074: Flags [P.], seq 332222:336344, ack 867, win 65535, length 4122
19:31:29.766184 IP 10.0.2.15.38074 > 151.101.117.67.443: Flags [.], ack 336344, win 65535, length 0
19:31:29.766401 IP 151.101.117.67.443 > 10.0.2.15.38074: Flags [P.], seq 336344:343214, ack 867, win 65535, length 6870
19:31:29.766412 IP 10.0.2.15.38074 > 151.101.117.67.443: Flags [.], ack 343214, win 65535, length 0
19:31:29.766510 IP 151.101.117.67.443 > 10.0.2.15.38074: Flags [P.], seq 343214:345962, ack 867, win 65535, length 2748
19:31:29.766515 IP 10.0.2.15.38074 > 151.101.117.67.443: Flags [.], ack 345962, win 65535, length 0
19:31:29.769700 IP 151.101.117.67.443 > 10.0.2.15.38074: Flags [P.], seq 345962:350084, ack 867, win 65535, length 4122
19:31:29.769705 IP 151.101.117.67.443 > 10.0.2.15.38074: Flags [P.], seq 350084:354206, ack 867, win 65535, length 4122
19:31:29.769726 IP 10.0.2.15.38074 > 151.101.117.67.443: Flags [.], ack 350084, win 65535, length 0
19:31:29.769780 IP 10.0.2.15.38074 > 151.101.117.67.443: Flags [.], ack 354206, win 65535, length 0
19:31:29.769941 IP 151.101.117.67.443 > 10.0.2.15.38074: Flags [P.], seq 354206:358328, ack 867, win 65535, length 4122
19:31:29.769943 IP 151.101.117.67.443 > 10.0.2.15.38074: Flags [P.], seq 358328:362450, ack 867, win 65535, length 4122
19:31:29.769944 IP 151.101.117.67.443 > 10.0.2.15.38074: Flags [P.], seq 362450:366572, ack 867, win 65535, length 4122
19:31:29.770158 IP 10.0.2.15.38074 > 151.101.117.67.443: Flags [.], ack 358328, win 65535, length 0
19:31:29.770180 IP 10.0.2.15.38074 > 151.101.117.67.443: Flags [.], ack 362450, win 65535, length 0
19:31:29.770191 IP 10.0.2.15.38074 > 151.101.117.67.443: Flags [.], ack 366572, win 65535, length 0
19:31:29.770219 IP 151.101.117.67.443 > 10.0.2.15.38074: Flags [P.], seq 366572:369320, ack 867, win 65535, length 2748
19:31:29.770221 IP 151.101.117.67.443 > 10.0.2.15.38074: Flags [P.], seq 369320:374816, ack 867, win 65535, length 5496
19:31:29.770228 IP 10.0.2.15.38074 > 151.101.117.67.443: Flags [.], ack 369320, win 65535, length 0
19:31:29.770242 IP 10.0.2.15.38074 > 151.101.117.67.443: Flags [.], ack 374816, win 65535, length 0
19:31:29.770793 IP 151.101.117.67.443 > 10.0.2.15.38074: Flags [P.], seq 374816:377564, ack 867, win 65535, length 2748
19:31:29.770795 IP 151.101.117.67.443 > 10.0.2.15.38074: Flags [.], seq 377564:379024, ack 867, win 65535, length 1460
19:31:29.770809 IP 10.0.2.15.38074 > 151.101.117.67.443: Flags [.], ack 377564, win 65535, length 0
19:31:29.771079 IP 151.101.117.67.443 > 10.0.2.15.38074: Flags [P.], seq 379024:381686, ack 867, win 65535, length 2662
19:31:29.771081 IP 151.101.117.67.443 > 10.0.2.15.38074: Flags [P.], seq 381686:385808, ack 867, win 65535, length 4122
19:31:29.771082 IP 151.101.117.67.443 > 10.0.2.15.38074: Flags [P.], seq 385808:388556, ack 867, win 65535, length 2748
19:31:29.771110 IP 10.0.2.15.38074 > 151.101.117.67.443: Flags [.], ack 381686, win 65535, length 0
19:31:29.771124 IP 10.0.2.15.38074 > 151.101.117.67.443: Flags [.], ack 385808, win 65535, length 0
19:31:29.771135 IP 10.0.2.15.38074 > 151.101.117.67.443: Flags [.], ack 388556, win 65535, length 0
19:31:29.771564 IP 151.101.117.67.443 > 10.0.2.15.38074: Flags [P.], seq 388556:391304, ack 867, win 65535, length 2748
19:31:29.771566 IP 151.101.117.67.443 > 10.0.2.15.38074: Flags [P.], seq 391304:395426, ack 867, win 65535, length 4122
19:31:29.771567 IP 151.101.117.67.443 > 10.0.2.15.38074: Flags [P.], seq 395426:398174, ack 867, win 65535, length 2748
19:31:29.771582 IP 10.0.2.15.38074 > 151.101.117.67.443: Flags [.], ack 391304, win 65535, length 0
19:31:29.771600 IP 10.0.2.15.38074 > 151.101.117.67.443: Flags [.], ack 395426, win 65535, length 0
19:31:29.771800 IP 10.0.2.15.38074 > 151.101.117.67.443: Flags [.], ack 398174, win 65535, length 0
19:31:29.771961 IP 151.101.117.67.443 > 10.0.2.15.38074: Flags [P.], seq 398174:402296, ack 867, win 65535, length 4122
19:31:29.771962 IP 151.101.117.67.443 > 10.0.2.15.38074: Flags [P.], seq 402296:403670, ack 867, win 65535, length 1374
19:31:29.771963 IP 151.101.117.67.443 > 10.0.2.15.38074: Flags [P.], seq 403670:407792, ack 867, win 65535, length 4122
19:31:29.771973 IP 10.0.2.15.38074 > 151.101.117.67.443: Flags [.], ack 402296, win 65535, length 0
19:31:29.771991 IP 10.0.2.15.38074 > 151.101.117.67.443: Flags [.], ack 407792, win 65535, length 0
19:31:29.772241 IP 151.101.117.67.443 > 10.0.2.15.38074: Flags [P.], seq 407792:411914, ack 867, win 65535, length 4122
19:31:29.772243 IP 151.101.117.67.443 > 10.0.2.15.38074: Flags [P.], seq 411914:417410, ack 867, win 65535, length 5496
19:31:29.772253 IP 10.0.2.15.38074 > 151.101.117.67.443: Flags [.], ack 411914, win 65535, length 0
19:31:29.772272 IP 10.0.2.15.38074 > 151.101.117.67.443: Flags [.], ack 417410, win 65535, length 0
19:31:29.773171 IP 151.101.117.67.443 > 10.0.2.15.38074: Flags [.], seq 417410:420330, ack 867, win 65535, length 2920
19:31:29.773198 IP 10.0.2.15.38074 > 151.101.117.67.443: Flags [.], ack 420330, win 65535, length 0
19:31:29.776332 IP 151.101.117.67.443 > 10.0.2.15.38074: Flags [P.], seq 420330:421532, ack 867, win 65535, length 1202
19:31:29.776335 IP 151.101.117.67.443 > 10.0.2.15.38074: Flags [P.], seq 421532:425654, ack 867, win 65535, length 4122
19:31:29.776337 IP 151.101.117.67.443 > 10.0.2.15.38074: Flags [P.], seq 425654:433898, ack 867, win 65535, length 8244
19:31:29.776436 IP 10.0.2.15.38074 > 151.101.117.67.443: Flags [.], ack 425654, win 65535, length 0
19:31:29.776469 IP 10.0.2.15.38074 > 151.101.117.67.443: Flags [.], ack 433898, win 65535, length 0
19:31:29.776584 IP 151.101.117.67.443 > 10.0.2.15.38074: Flags [P.], seq 433898:439394, ack 867, win 65535, length 5496
19:31:29.776585 IP 151.101.117.67.443 > 10.0.2.15.38074: Flags [P.], seq 439394:443516, ack 867, win 65535, length 4122
19:31:29.776586 IP 151.101.117.67.443 > 10.0.2.15.38074: Flags [P.], seq 443516:449012, ack 867, win 65535, length 5496
19:31:29.776613 IP 10.0.2.15.38074 > 151.101.117.67.443: Flags [.], ack 439394, win 65535, length 0
19:31:29.776628 IP 10.0.2.15.38074 > 151.101.117.67.443: Flags [.], ack 443516, win 65535, length 0
19:31:29.776755 IP 10.0.2.15.38074 > 151.101.117.67.443: Flags [.], ack 449012, win 65535, length 0
19:31:29.776812 IP 151.101.117.67.443 > 10.0.2.15.38074: Flags [P.], seq 449012:451760, ack 867, win 65535, length 2748
19:31:29.776816 IP 151.101.117.67.443 > 10.0.2.15.38074: Flags [P.], seq 451760:465500, ack 867, win 65535, length 13740
19:31:29.776829 IP 10.0.2.15.38074 > 151.101.117.67.443: Flags [.], ack 451760, win 65535, length 0
19:31:29.776844 IP 10.0.2.15.38074 > 151.101.117.67.443: Flags [.], ack 465500, win 65535, length 0
19:31:29.776880 IP 151.101.117.67.443 > 10.0.2.15.38074: Flags [P.], seq 465500:490232, ack 867, win 65535, length 24732
19:31:29.776887 IP 10.0.2.15.38074 > 151.101.117.67.443: Flags [.], ack 490232, win 65535, length 0
19:31:29.777323 IP 151.101.117.67.443 > 10.0.2.15.38074: Flags [P.], seq 490232:498476, ack 867, win 65535, length 8244
19:31:29.777325 IP 151.101.117.67.443 > 10.0.2.15.38074: Flags [P.], seq 498476:501224, ack 867, win 65535, length 2748
19:31:29.777338 IP 10.0.2.15.38074 > 151.101.117.67.443: Flags [.], ack 498476, win 65535, length 0
19:31:29.777357 IP 10.0.2.15.38074 > 151.101.117.67.443: Flags [.], ack 501224, win 65535, length 0
19:31:29.777376 IP 151.101.117.67.443 > 10.0.2.15.38074: Flags [P.], seq 501224:505346, ack 867, win 65535, length 4122
19:31:29.777380 IP 10.0.2.15.38074 > 151.101.117.67.443: Flags [.], ack 505346, win 65535, length 0
19:31:29.778198 IP 151.101.117.67.443 > 10.0.2.15.38074: Flags [P.], seq 505346:509468, ack 867, win 65535, length 4122
19:31:29.778200 IP 151.101.117.67.443 > 10.0.2.15.38074: Flags [P.], seq 509468:512216, ack 867, win 65535, length 2748
19:31:29.778216 IP 10.0.2.15.38074 > 151.101.117.67.443: Flags [.], ack 509468, win 65535, length 0
19:31:29.778239 IP 10.0.2.15.38074 > 151.101.117.67.443: Flags [.], ack 512216, win 65535, length 0
19:31:29.778623 IP 151.101.117.67.443 > 10.0.2.15.38074: Flags [P.], seq 512216:516338, ack 867, win 65535, length 4122
19:31:29.778627 IP 151.101.117.67.443 > 10.0.2.15.38074: Flags [P.], seq 516338:519086, ack 867, win 65535, length 2748
19:31:29.778628 IP 151.101.117.67.443 > 10.0.2.15.38074: Flags [P.], seq 519086:521834, ack 867, win 65535, length 2748
19:31:29.778648 IP 10.0.2.15.38074 > 151.101.117.67.443: Flags [.], ack 516338, win 65535, length 0
19:31:29.778757 IP 10.0.2.15.38074 > 151.101.117.67.443: Flags [.], ack 519086, win 65535, length 0
19:31:29.778859 IP 10.0.2.15.38074 > 151.101.117.67.443: Flags [.], ack 521834, win 65535, length 0
19:31:29.779373 IP 151.101.117.67.443 > 10.0.2.15.38074: Flags [P.], seq 521834:524582, ack 867, win 65535, length 2748
19:31:29.779375 IP 151.101.117.67.443 > 10.0.2.15.38074: Flags [P.], seq 524582:527330, ack 867, win 65535, length 2748
19:31:29.779376 IP 151.101.117.67.443 > 10.0.2.15.38074: Flags [P.], seq 527330:532826, ack 867, win 65535, length 5496
19:31:29.779432 IP 10.0.2.15.38074 > 151.101.117.67.443: Flags [.], ack 524582, win 65535, length 0
19:31:29.779452 IP 10.0.2.15.38074 > 151.101.117.67.443: Flags [.], ack 527330, win 65535, length 0
19:31:29.779466 IP 10.0.2.15.38074 > 151.101.117.67.443: Flags [.], ack 532826, win 65535, length 0
19:31:29.779493 IP 151.101.117.67.443 > 10.0.2.15.38074: Flags [P.], seq 532826:536948, ack 867, win 65535, length 4122
19:31:29.779494 IP 151.101.117.67.443 > 10.0.2.15.38074: Flags [.], seq 536948:542788, ack 867, win 65535, length 5840
19:31:29.779499 IP 10.0.2.15.38074 > 151.101.117.67.443: Flags [.], ack 536948, win 65535, length 0
19:31:29.779509 IP 10.0.2.15.38074 > 151.101.117.67.443: Flags [.], ack 542788, win 65535, length 0
19:31:29.779763 IP 151.101.117.67.443 > 10.0.2.15.38074: Flags [P.], seq 542788:543818, ack 867, win 65535, length 1030
19:31:29.779901 IP 151.101.117.67.443 > 10.0.2.15.38074: Flags [P.], seq 543818:545192, ack 867, win 65535, length 1374
19:31:29.779911 IP 10.0.2.15.38074 > 151.101.117.67.443: Flags [.], ack 545192, win 65535, length 0
19:31:29.780700 IP 151.101.117.67.443 > 10.0.2.15.38074: Flags [P.], seq 545192:550688, ack 867, win 65535, length 5496
19:31:29.780703 IP 151.101.117.67.443 > 10.0.2.15.38074: Flags [P.], seq 550688:553436, ack 867, win 65535, length 2748
19:31:29.780704 IP 151.101.117.67.443 > 10.0.2.15.38074: Flags [P.], seq 553436:557558, ack 867, win 65535, length 4122
19:31:29.780790 IP 10.0.2.15.38074 > 151.101.117.67.443: Flags [.], ack 550688, win 65535, length 0
19:31:29.780906 IP 10.0.2.15.38074 > 151.101.117.67.443: Flags [.], ack 553436, win 65535, length 0
19:31:29.780923 IP 10.0.2.15.38074 > 151.101.117.67.443: Flags [.], ack 557558, win 65535, length 0
19:31:29.781034 IP 151.101.117.67.443 > 10.0.2.15.38074: Flags [P.], seq 557558:560306, ack 867, win 65535, length 2748
19:31:29.781035 IP 151.101.117.67.443 > 10.0.2.15.38074: Flags [P.], seq 560306:563054, ack 867, win 65535, length 2748
19:31:29.781047 IP 10.0.2.15.38074 > 151.101.117.67.443: Flags [.], ack 560306, win 65535, length 0
19:31:29.781143 IP 10.0.2.15.38074 > 151.101.117.67.443: Flags [.], ack 563054, win 65535, length 0
19:31:29.781320 IP 151.101.117.67.443 > 10.0.2.15.38074: Flags [P.], seq 563054:565802, ack 867, win 65535, length 2748
19:31:29.781322 IP 151.101.117.67.443 > 10.0.2.15.38074: Flags [P.], seq 565802:568550, ack 867, win 65535, length 2748
19:31:29.781323 IP 151.101.117.67.443 > 10.0.2.15.38074: Flags [P.], seq 568550:571298, ack 867, win 65535, length 2748
19:31:29.781334 IP 10.0.2.15.38074 > 151.101.117.67.443: Flags [.], ack 565802, win 65535, length 0
19:31:29.781379 IP 10.0.2.15.38074 > 151.101.117.67.443: Flags [.], ack 568550, win 65535, length 0
19:31:29.781391 IP 10.0.2.15.38074 > 151.101.117.67.443: Flags [.], ack 571298, win 65535, length 0
19:31:29.781544 IP 151.101.117.67.443 > 10.0.2.15.38074: Flags [P.], seq 571298:574046, ack 867, win 65535, length 2748
19:31:29.781545 IP 151.101.117.67.443 > 10.0.2.15.38074: Flags [P.], seq 574046:576794, ack 867, win 65535, length 2748
19:31:29.781597 IP 10.0.2.15.38074 > 151.101.117.67.443: Flags [.], ack 574046, win 65535, length 0
19:31:29.781622 IP 10.0.2.15.38074 > 151.101.117.67.443: Flags [.], ack 576794, win 65535, length 0
19:31:29.782069 IP 151.101.117.67.443 > 10.0.2.15.38074: Flags [P.], seq 576794:579542, ack 867, win 65535, length 2748
19:31:29.782071 IP 151.101.117.67.443 > 10.0.2.15.38074: Flags [P.], seq 579542:582290, ack 867, win 65535, length 2748
19:31:29.782072 IP 151.101.117.67.443 > 10.0.2.15.38074: Flags [P.], seq 582290:585038, ack 867, win 65535, length 2748
19:31:29.782094 IP 10.0.2.15.38074 > 151.101.117.67.443: Flags [.], ack 579542, win 65535, length 0
19:31:29.782116 IP 10.0.2.15.38074 > 151.101.117.67.443: Flags [.], ack 582290, win 65535, length 0
19:31:29.782126 IP 10.0.2.15.38074 > 151.101.117.67.443: Flags [.], ack 585038, win 65535, length 0
19:31:29.782908 IP 151.101.117.67.443 > 10.0.2.15.38074: Flags [P.], seq 585038:590534, ack 867, win 65535, length 5496
19:31:29.782910 IP 151.101.117.67.443 > 10.0.2.15.38074: Flags [P.], seq 590534:593282, ack 867, win 65535, length 2748
19:31:29.782931 IP 10.0.2.15.38074 > 151.101.117.67.443: Flags [.], ack 590534, win 65535, length 0
19:31:29.783007 IP 10.0.2.15.38074 > 151.101.117.67.443: Flags [.], ack 593282, win 65535, length 0
19:31:29.783190 IP 151.101.117.67.443 > 10.0.2.15.38074: Flags [P.], seq 593282:596030, ack 867, win 65535, length 2748
19:31:29.783199 IP 10.0.2.15.38074 > 151.101.117.67.443: Flags [.], ack 596030, win 65535, length 0
19:31:29.783280 IP 151.101.117.67.443 > 10.0.2.15.38074: Flags [P.], seq 596030:602900, ack 867, win 65535, length 6870
19:31:29.783589 IP 151.101.117.67.443 > 10.0.2.15.38074: Flags [P.], seq 602900:608396, ack 867, win 65535, length 5496
19:31:29.783803 IP 151.101.117.67.443 > 10.0.2.15.38074: Flags [P.], seq 608396:612518, ack 867, win 65535, length 4122
19:31:29.783804 IP 151.101.117.67.443 > 10.0.2.15.38074: Flags [P.], seq 612518:615266, ack 867, win 65535, length 2748
19:31:29.783873 IP 151.101.117.67.443 > 10.0.2.15.38074: Flags [P.], seq 615266:616640, ack 867, win 65535, length 1374
19:31:29.784128 IP 151.101.117.67.443 > 10.0.2.15.38074: Flags [P.], seq 616640:620762, ack 867, win 65535, length 4122
19:31:29.784328 IP 151.101.117.67.443 > 10.0.2.15.38074: Flags [P.], seq 620762:623510, ack 867, win 65535, length 2748
19:31:29.784329 IP 151.101.117.67.443 > 10.0.2.15.38074: Flags [P.], seq 623510:624884, ack 867, win 65535, length 1374
19:31:29.785319 IP 151.101.117.67.443 > 10.0.2.15.38074: Flags [P.], seq 624884:631754, ack 867, win 65535, length 6870
19:31:29.788409 IP 10.0.2.15.38074 > 151.101.117.67.443: Flags [.], ack 631754, win 65535, length 0
19:31:29.788989 IP 151.101.117.67.443 > 10.0.2.15.38074: Flags [.], seq 631754:633214, ack 867, win 65535, length 1460
19:31:29.790709 IP 151.101.117.67.443 > 10.0.2.15.38074: Flags [.], seq 633214:695994, ack 867, win 65535, length 62780
19:31:29.797400 IP 10.0.2.15.38074 > 151.101.117.67.443: Flags [.], ack 695994, win 65535, length 0
19:31:29.797737 IP 151.101.117.67.443 > 10.0.2.15.38074: Flags [P.], seq 695994:697454, ack 867, win 65535, length 1460
19:31:29.797929 IP 151.101.117.67.443 > 10.0.2.15.38074: Flags [.], seq 697454:714974, ack 867, win 65535, length 17520
19:31:29.798086 IP 151.101.117.67.443 > 10.0.2.15.38074: Flags [.], seq 714974:757314, ack 867, win 65535, length 42340
19:31:29.798531 IP 151.101.117.67.443 > 10.0.2.15.38074: Flags [.], seq 757314:760234, ack 867, win 65535, length 2920
19:31:29.798918 IP 10.0.2.15.38074 > 151.101.117.67.443: Flags [.], ack 760234, win 65535, length 0
19:31:29.799128 IP 151.101.117.67.443 > 10.0.2.15.38074: Flags [P.], seq 760234:761694, ack 867, win 65535, length 1460
19:31:29.799325 IP 151.101.117.67.443 > 10.0.2.15.38074: Flags [.], seq 761694:777754, ack 867, win 65535, length 16060
19:31:29.799338 IP 10.0.2.15.38074 > 151.101.117.67.443: Flags [.], ack 777754, win 65535, length 0
19:31:29.800004 IP 151.101.117.67.443 > 10.0.2.15.38074: Flags [P.], seq 777754:825934, ack 867, win 65535, length 48180
19:31:29.800191 IP 10.0.2.15.38074 > 151.101.117.67.443: Flags [.], ack 825934, win 65535, length 0
19:31:29.800705 IP 151.101.117.67.443 > 10.0.2.15.38074: Flags [.], seq 825934:890174, ack 867, win 65535, length 64240
19:31:29.801153 IP 10.0.2.15.38074 > 151.101.117.67.443: Flags [.], ack 890174, win 65535, length 0
19:31:29.801279 IP 151.101.117.67.443 > 10.0.2.15.38074: Flags [P.], seq 890174:891634, ack 867, win 65535, length 1460
19:31:29.802003 IP 151.101.117.67.443 > 10.0.2.15.38074: Flags [.], seq 891634:931054, ack 867, win 65535, length 39420
19:31:29.802575 IP 151.101.117.67.443 > 10.0.2.15.38074: Flags [P.], seq 931054:950522, ack 867, win 65535, length 19468
19:31:29.802723 IP 10.0.2.15.38074 > 151.101.117.67.443: Flags [.], ack 950522, win 65535, length 0
19:31:29.811899 IP 151.101.117.67.443 > 10.0.2.15.38074: Flags [P.], seq 950522:956018, ack 867, win 65535, length 5496

