19:28:02.959086 IP 10.0.2.15.60897 > 140.233.253.2.53: 65204+ A? www.cnn.com. (29)
19:28:02.959121 IP 10.0.2.15.60897 > 140.233.253.2.53: 17329+ AAAA? www.cnn.com. (29)
19:28:02.965055 IP 140.233.253.2.53 > 10.0.2.15.60897: 17329 2/0/0 CNAME turner-tls.map.fastly.net., AAAA 2a04:4e42:1c::323 (96)
19:28:02.965057 IP 140.233.253.2.53 > 10.0.2.15.60897: 65204 2/0/0 CNAME turner-tls.map.fastly.net., A 151.101.117.67 (84)
19:28:02.965422 IP 10.0.2.15.37986 > 151.101.117.67.443: Flags [S], seq 4021771111, win 64240, options [mss 1460,sackOK,TS val 1396601938 ecr 0,nop,wscale 6], length 0
19:28:02.979765 IP 151.101.117.67.443 > 10.0.2.15.37986: Flags [S.], seq 166400001, ack 4021771112, win 65535, options [mss 1460], length 0
19:28:02.979812 IP 10.0.2.15.37986 > 151.101.117.67.443: Flags [.], ack 1, win 64240, length 0
19:28:02.989021 IP 10.0.2.15.37986 > 151.101.117.67.443: Flags [P.], seq 1:518, ack 1, win 64240, length 517
19:28:02.989409 IP 151.101.117.67.443 > 10.0.2.15.37986: Flags [.], ack 518, win 65535, length 0
19:28:03.007498 IP 151.101.117.67.443 > 10.0.2.15.37986: Flags [P.], seq 1:1375, ack 518, win 65535, length 1374
19:28:03.007520 IP 10.0.2.15.37986 > 151.101.117.67.443: Flags [.], ack 1375, win 63204, length 0
19:28:03.010939 IP 151.101.117.67.443 > 10.0.2.15.37986: Flags [P.], seq 1375:5064, ack 518, win 65535, length 3689
19:28:03.010976 IP 10.0.2.15.37986 > 151.101.117.67.443: Flags [.], ack 5064, win 61320, length 0
19:28:03.012767 IP 10.0.2.15.37986 > 151.101.117.67.443: Flags [P.], seq 518:611, ack 5064, win 62780, length 93
19:28:03.013113 IP 151.101.117.67.443 > 10.0.2.15.37986: Flags [.], ack 611, win 65535, length 0
19:28:03.044095 IP 151.101.117.67.443 > 10.0.2.15.37986: Flags [P.], seq 5064:5115, ack 611, win 65535, length 51
19:28:03.044128 IP 10.0.2.15.37986 > 151.101.117.67.443: Flags [.], ack 5115, win 62780, length 0
19:28:03.045460 IP 10.0.2.15.37986 > 151.101.117.67.443: Flags [P.], seq 611:664, ack 5115, win 62780, length 53
19:28:03.045519 IP 10.0.2.15.37986 > 151.101.117.67.443: Flags [P.], seq 664:720, ack 5115, win 62780, length 56
19:28:03.045840 IP 151.101.117.67.443 > 10.0.2.15.37986: Flags [.], ack 664, win 65535, length 0
19:28:03.045841 IP 151.101.117.67.443 > 10.0.2.15.37986: Flags [.], ack 720, win 65535, length 0
19:28:03.045867 IP 10.0.2.15.37986 > 151.101.117.67.443: Flags [P.], seq 720:829, ack 5115, win 62780, length 109
19:28:03.046365 IP 151.101.117.67.443 > 10.0.2.15.37986: Flags [.], ack 829, win 65535, length 0
19:28:03.059143 IP 151.101.117.67.443 > 10.0.2.15.37986: Flags [P.], seq 5115:5210, ack 829, win 65535, length 95
19:28:03.059272 IP 10.0.2.15.37986 > 151.101.117.67.443: Flags [.], ack 5210, win 62780, length 0
19:28:03.059829 IP 10.0.2.15.37986 > 151.101.117.67.443: Flags [P.], seq 829:867, ack 5210, win 62780, length 38
19:28:03.060631 IP 151.101.117.67.443 > 10.0.2.15.37986: Flags [.], ack 867, win 65535, length 0
19:28:03.060633 IP 151.101.117.67.443 > 10.0.2.15.37986: Flags [P.], seq 5210:9332, ack 867, win 65535, length 4122
19:28:03.060785 IP 10.0.2.15.37986 > 151.101.117.67.443: Flags [.], ack 9332, win 61320, length 0
19:28:03.062153 IP 151.101.117.67.443 > 10.0.2.15.37986: Flags [P.], seq 9332:14828, ack 867, win 65535, length 5496
19:28:03.062172 IP 10.0.2.15.37986 > 151.101.117.67.443: Flags [.], ack 14828, win 61320, length 0
19:28:03.063138 IP 151.101.117.67.443 > 10.0.2.15.37986: Flags [P.], seq 14828:17576, ack 867, win 65535, length 2748
19:28:03.063155 IP 10.0.2.15.37986 > 151.101.117.67.443: Flags [.], ack 17576, win 62780, length 0
19:28:03.064288 IP 151.101.117.67.443 > 10.0.2.15.37986: Flags [P.], seq 17576:23072, ack 867, win 65535, length 5496
19:28:03.064390 IP 10.0.2.15.37986 > 151.101.117.67.443: Flags [.], ack 23072, win 61320, length 0
19:28:03.065112 IP 151.101.117.67.443 > 10.0.2.15.37986: Flags [P.], seq 23072:25820, ack 867, win 65535, length 2748
19:28:03.065124 IP 10.0.2.15.37986 > 151.101.117.67.443: Flags [.], ack 25820, win 62780, length 0
19:28:03.066322 IP 151.101.117.67.443 > 10.0.2.15.37986: Flags [P.], seq 25820:28568, ack 867, win 65535, length 2748
19:28:03.066339 IP 10.0.2.15.37986 > 151.101.117.67.443: Flags [.], ack 28568, win 62780, length 0
19:28:03.067286 IP 151.101.117.67.443 > 10.0.2.15.37986: Flags [P.], seq 28568:35438, ack 867, win 65535, length 6870
19:28:03.067417 IP 10.0.2.15.37986 > 151.101.117.67.443: Flags [.], ack 35438, win 59860, length 0
19:28:03.068378 IP 151.101.117.67.443 > 10.0.2.15.37986: Flags [P.], seq 35438:36812, ack 867, win 65535, length 1374
19:28:03.069294 IP 151.101.117.67.443 > 10.0.2.15.37986: Flags [P.], seq 36812:42308, ack 867, win 65535, length 5496
19:28:03.069307 IP 10.0.2.15.37986 > 151.101.117.67.443: Flags [.], ack 42308, win 61320, length 0
19:28:03.071634 IP 151.101.117.67.443 > 10.0.2.15.37986: Flags [P.], seq 42308:45056, ack 867, win 65535, length 2748
19:28:03.071660 IP 10.0.2.15.37986 > 151.101.117.67.443: Flags [.], ack 45056, win 62780, length 0
19:28:03.074660 IP 151.101.117.67.443 > 10.0.2.15.37986: Flags [P.], seq 45056:51926, ack 867, win 65535, length 6870
19:28:03.074664 IP 151.101.117.67.443 > 10.0.2.15.37986: Flags [P.], seq 51926:56048, ack 867, win 65535, length 4122
19:28:03.075036 IP 10.0.2.15.37986 > 151.101.117.67.443: Flags [.], ack 56048, win 56940, length 0
19:28:03.075734 IP 151.101.117.67.443 > 10.0.2.15.37986: Flags [P.], seq 56048:61544, ack 867, win 65535, length 5496
19:28:03.075751 IP 10.0.2.15.37986 > 151.101.117.67.443: Flags [.], ack 61544, win 61320, length 0
19:28:03.077052 IP 151.101.117.67.443 > 10.0.2.15.37986: Flags [P.], seq 61544:68414, ack 867, win 65535, length 6870
19:28:03.077180 IP 10.0.2.15.37986 > 151.101.117.67.443: Flags [.], ack 68414, win 62780, length 0
19:28:03.077846 IP 151.101.117.67.443 > 10.0.2.15.37986: Flags [P.], seq 68414:75284, ack 867, win 65535, length 6870
19:28:03.077848 IP 151.101.117.67.443 > 10.0.2.15.37986: Flags [.], seq 75284:76744, ack 867, win 65535, length 1460
19:28:03.077866 IP 10.0.2.15.37986 > 151.101.117.67.443: Flags [.], ack 75284, win 65535, length 0
19:28:03.078058 IP 151.101.117.67.443 > 10.0.2.15.37986: Flags [P.], seq 76744:78032, ack 867, win 65535, length 1288
19:28:03.078059 IP 151.101.117.67.443 > 10.0.2.15.37986: Flags [P.], seq 78032:79406, ack 867, win 65535, length 1374
19:28:03.078067 IP 10.0.2.15.37986 > 151.101.117.67.443: Flags [.], ack 78032, win 65535, length 0
19:28:03.078915 IP 151.101.117.67.443 > 10.0.2.15.37986: Flags [P.], seq 79406:84902, ack 867, win 65535, length 5496
19:28:03.078938 IP 10.0.2.15.37986 > 151.101.117.67.443: Flags [.], ack 84902, win 65535, length 0
19:28:03.079139 IP 151.101.117.67.443 > 10.0.2.15.37986: Flags [P.], seq 84902:87650, ack 867, win 65535, length 2748
19:28:03.079145 IP 10.0.2.15.37986 > 151.101.117.67.443: Flags [.], ack 87650, win 65535, length 0
19:28:03.080138 IP 151.101.117.67.443 > 10.0.2.15.37986: Flags [P.], seq 87650:93146, ack 867, win 65535, length 5496
19:28:03.080157 IP 10.0.2.15.37986 > 151.101.117.67.443: Flags [.], ack 93146, win 65535, length 0
19:28:03.081542 IP 151.101.117.67.443 > 10.0.2.15.37986: Flags [P.], seq 93146:100016, ack 867, win 65535, length 6870
19:28:03.081544 IP 151.101.117.67.443 > 10.0.2.15.37986: Flags [P.], seq 100016:102764, ack 867, win 65535, length 2748
19:28:03.081545 IP 151.101.117.67.443 > 10.0.2.15.37986: Flags [P.], seq 102764:104138, ack 867, win 65535, length 1374
19:28:03.081560 IP 10.0.2.15.37986 > 151.101.117.67.443: Flags [.], ack 100016, win 65535, length 0
19:28:03.081592 IP 10.0.2.15.37986 > 151.101.117.67.443: Flags [.], ack 102764, win 65535, length 0
19:28:03.082660 IP 151.101.117.67.443 > 10.0.2.15.37986: Flags [P.], seq 104138:111008, ack 867, win 65535, length 6870
19:28:03.082671 IP 10.0.2.15.37986 > 151.101.117.67.443: Flags [.], ack 111008, win 65535, length 0
19:28:03.083791 IP 151.101.117.67.443 > 10.0.2.15.37986: Flags [P.], seq 111008:117878, ack 867, win 65535, length 6870
19:28:03.083794 IP 151.101.117.67.443 > 10.0.2.15.37986: Flags [P.], seq 117878:120626, ack 867, win 65535, length 2748
19:28:03.083794 IP 151.101.117.67.443 > 10.0.2.15.37986: Flags [P.], seq 120626:122000, ack 867, win 65535, length 1374
19:28:03.083812 IP 10.0.2.15.37986 > 151.101.117.67.443: Flags [.], ack 117878, win 65535, length 0
19:28:03.083842 IP 10.0.2.15.37986 > 151.101.117.67.443: Flags [.], ack 120626, win 65535, length 0
19:28:03.087633 IP 151.101.117.67.443 > 10.0.2.15.37986: Flags [P.], seq 122000:128870, ack 867, win 65535, length 6870
19:28:03.087667 IP 10.0.2.15.37986 > 151.101.117.67.443: Flags [.], ack 128870, win 65535, length 0
19:28:03.088143 IP 151.101.117.67.443 > 10.0.2.15.37986: Flags [P.], seq 128870:135740, ack 867, win 65535, length 6870
19:28:03.088145 IP 151.101.117.67.443 > 10.0.2.15.37986: Flags [P.], seq 135740:141236, ack 867, win 65535, length 5496
19:28:03.088161 IP 10.0.2.15.37986 > 151.101.117.67.443: Flags [.], ack 135740, win 65535, length 0
19:28:03.088352 IP 10.0.2.15.37986 > 151.101.117.67.443: Flags [.], ack 141236, win 65535, length 0
19:28:03.088388 IP 151.101.117.67.443 > 10.0.2.15.37986: Flags [P.], seq 141236:142610, ack 867, win 65535, length 1374
19:28:03.089936 IP 151.101.117.67.443 > 10.0.2.15.37986: Flags [P.], seq 142610:150854, ack 867, win 65535, length 8244
19:28:03.089938 IP 151.101.117.67.443 > 10.0.2.15.37986: Flags [P.], seq 150854:153602, ack 867, win 65535, length 2748
19:28:03.089959 IP 10.0.2.15.37986 > 151.101.117.67.443: Flags [.], ack 150854, win 65535, length 0
19:28:03.089996 IP 10.0.2.15.37986 > 151.101.117.67.443: Flags [.], ack 153602, win 65535, length 0
19:28:03.090020 IP 151.101.117.67.443 > 10.0.2.15.37986: Flags [P.], seq 153602:156350, ack 867, win 65535, length 2748
19:28:03.090079 IP 151.101.117.67.443 > 10.0.2.15.37986: Flags [P.], seq 156350:159098, ack 867, win 65535, length 2748
19:28:03.090080 IP 151.101.117.67.443 > 10.0.2.15.37986: Flags [P.], seq 159098:161846, ack 867, win 65535, length 2748
19:28:03.090098 IP 10.0.2.15.37986 > 151.101.117.67.443: Flags [.], ack 156350, win 65535, length 0
19:28:03.090158 IP 10.0.2.15.37986 > 151.101.117.67.443: Flags [.], ack 159098, win 65535, length 0
19:28:03.090172 IP 10.0.2.15.37986 > 151.101.117.67.443: Flags [.], ack 161846, win 65535, length 0
19:28:03.090773 IP 151.101.117.67.443 > 10.0.2.15.37986: Flags [P.], seq 161846:164594, ack 867, win 65535, length 2748
19:28:03.090774 IP 151.101.117.67.443 > 10.0.2.15.37986: Flags [P.], seq 164594:167342, ack 867, win 65535, length 2748
19:28:03.090775 IP 151.101.117.67.443 > 10.0.2.15.37986: Flags [P.], seq 167342:168716, ack 867, win 65535, length 1374
19:28:03.090775 IP 151.101.117.67.443 > 10.0.2.15.37986: Flags [P.], seq 168716:172838, ack 867, win 65535, length 4122
19:28:03.090788 IP 10.0.2.15.37986 > 151.101.117.67.443: Flags [.], ack 164594, win 65535, length 0
19:28:03.090807 IP 10.0.2.15.37986 > 151.101.117.67.443: Flags [.], ack 167342, win 65535, length 0
19:28:03.090818 IP 10.0.2.15.37986 > 151.101.117.67.443: Flags [.], ack 172838, win 65535, length 0
19:28:03.091936 IP 151.101.117.67.443 > 10.0.2.15.37986: Flags [P.], seq 172838:181082, ack 867, win 65535, length 8244
19:28:03.091938 IP 151.101.117.67.443 > 10.0.2.15.37986: Flags [P.], seq 181082:185204, ack 867, win 65535, length 4122
19:28:03.091958 IP 10.0.2.15.37986 > 151.101.117.67.443: Flags [.], ack 181082, win 65535, length 0
19:28:03.091994 IP 10.0.2.15.37986 > 151.101.117.67.443: Flags [.], ack 185204, win 65535, length 0
19:28:03.092016 IP 151.101.117.67.443 > 10.0.2.15.37986: Flags [P.], seq 185204:186578, ack 867, win 65535, length 1374
19:28:03.092017 IP 151.101.117.67.443 > 10.0.2.15.37986: Flags [P.], seq 186578:187952, ack 867, win 65535, length 1374
19:28:03.092024 IP 10.0.2.15.37986 > 151.101.117.67.443: Flags [.], ack 187952, win 65535, length 0
19:28:03.092315 IP 151.101.117.67.443 > 10.0.2.15.37986: Flags [P.], seq 187952:190700, ack 867, win 65535, length 2748
19:28:03.092326 IP 10.0.2.15.37986 > 151.101.117.67.443: Flags [.], ack 190700, win 65535, length 0
19:28:03.094187 IP 151.101.117.67.443 > 10.0.2.15.37986: Flags [P.], seq 190700:194822, ack 867, win 65535, length 4122
19:28:03.094190 IP 151.101.117.67.443 > 10.0.2.15.37986: Flags [P.], seq 194822:197570, ack 867, win 65535, length 2748
19:28:03.094192 IP 151.101.117.67.443 > 10.0.2.15.37986: Flags [P.], seq 197570:200318, ack 867, win 65535, length 2748
19:28:03.094269 IP 10.0.2.15.37986 > 151.101.117.67.443: Flags [.], ack 194822, win 65535, length 0
19:28:03.094319 IP 10.0.2.15.37986 > 151.101.117.67.443: Flags [.], ack 197570, win 65535, length 0
19:28:03.094339 IP 10.0.2.15.37986 > 151.101.117.67.443: Flags [.], ack 200318, win 65535, length 0
19:28:03.094834 IP 151.101.117.67.443 > 10.0.2.15.37986: Flags [P.], seq 200318:205814, ack 867, win 65535, length 5496
19:28:03.094836 IP 151.101.117.67.443 > 10.0.2.15.37986: Flags [P.], seq 205814:208562, ack 867, win 65535, length 2748
19:28:03.094836 IP 151.101.117.67.443 > 10.0.2.15.37986: Flags [P.], seq 208562:209936, ack 867, win 65535, length 1374
19:28:03.094837 IP 151.101.117.67.443 > 10.0.2.15.37986: Flags [P.], seq 209936:216806, ack 867, win 65535, length 6870
19:28:03.094851 IP 10.0.2.15.37986 > 151.101.117.67.443: Flags [.], ack 205814, win 65535, length 0
19:28:03.094881 IP 10.0.2.15.37986 > 151.101.117.67.443: Flags [.], ack 208562, win 65535, length 0
19:28:03.094894 IP 10.0.2.15.37986 > 151.101.117.67.443: Flags [.], ack 216806, win 65535, length 0
19:28:03.094928 IP 151.101.117.67.443 > 10.0.2.15.37986: Flags [P.], seq 216806:219554, ack 867, win 65535, length 2748
19:28:03.094932 IP 10.0.2.15.37986 > 151.101.117.67.443: Flags [.], ack 219554, win 65535, length 0
19:28:03.096421 IP 151.101.117.67.443 > 10.0.2.15.37986: Flags [P.], seq 219554:225050, ack 867, win 65535, length 5496
19:28:03.096423 IP 151.101.117.67.443 > 10.0.2.15.37986: Flags [P.], seq 225050:227798, ack 867, win 65535, length 2748
19:28:03.096424 IP 151.101.117.67.443 > 10.0.2.15.37986: Flags [P.], seq 227798:230546, ack 867, win 65535, length 2748
19:28:03.096447 IP 10.0.2.15.37986 > 151.101.117.67.443: Flags [.], ack 225050, win 65535, length 0
19:28:03.096484 IP 10.0.2.15.37986 > 151.101.117.67.443: Flags [.], ack 227798, win 65535, length 0
19:28:03.096497 IP 10.0.2.15.37986 > 151.101.117.67.443: Flags [.], ack 230546, win 65535, length 0
19:28:03.096525 IP 151.101.117.67.443 > 10.0.2.15.37986: Flags [P.], seq 230546:233294, ack 867, win 65535, length 2748
19:28:03.096526 IP 151.101.117.67.443 > 10.0.2.15.37986: Flags [P.], seq 233294:236042, ack 867, win 65535, length 2748
19:28:03.096533 IP 10.0.2.15.37986 > 151.101.117.67.443: Flags [.], ack 233294, win 65535, length 0
19:28:03.096546 IP 10.0.2.15.37986 > 151.101.117.67.443: Flags [.], ack 236042, win 65535, length 0
19:28:03.096897 IP 151.101.117.67.443 > 10.0.2.15.37986: Flags [P.], seq 236042:238790, ack 867, win 65535, length 2748
19:28:03.096899 IP 151.101.117.67.443 > 10.0.2.15.37986: Flags [.], seq 238790:240250, ack 867, win 65535, length 1460
19:28:03.096910 IP 10.0.2.15.37986 > 151.101.117.67.443: Flags [.], ack 238790, win 65535, length 0
19:28:03.097114 IP 151.101.117.67.443 > 10.0.2.15.37986: Flags [P.], seq 240250:241538, ack 867, win 65535, length 1288
19:28:03.097115 IP 151.101.117.67.443 > 10.0.2.15.37986: Flags [P.], seq 241538:244286, ack 867, win 65535, length 2748
19:28:03.097122 IP 10.0.2.15.37986 > 151.101.117.67.443: Flags [.], ack 241538, win 65535, length 0
19:28:03.097135 IP 10.0.2.15.37986 > 151.101.117.67.443: Flags [.], ack 244286, win 65535, length 0
19:28:03.098630 IP 151.101.117.67.443 > 10.0.2.15.37986: Flags [P.], seq 244286:251156, ack 867, win 65535, length 6870
19:28:03.098634 IP 151.101.117.67.443 > 10.0.2.15.37986: Flags [P.], seq 251156:258026, ack 867, win 65535, length 6870
19:28:03.098658 IP 10.0.2.15.37986 > 151.101.117.67.443: Flags [.], ack 251156, win 65535, length 0
19:28:03.098882 IP 10.0.2.15.37986 > 151.101.117.67.443: Flags [.], ack 258026, win 65535, length 0
19:28:03.098917 IP 151.101.117.67.443 > 10.0.2.15.37986: Flags [P.], seq 258026:259400, ack 867, win 65535, length 1374
19:28:03.098919 IP 151.101.117.67.443 > 10.0.2.15.37986: Flags [P.], seq 259400:264896, ack 867, win 65535, length 5496
19:28:03.098930 IP 10.0.2.15.37986 > 151.101.117.67.443: Flags [.], ack 264896, win 65535, length 0
19:28:03.101136 IP 151.101.117.67.443 > 10.0.2.15.37986: Flags [.], seq 264896:269276, ack 867, win 65535, length 4380
19:28:03.101159 IP 10.0.2.15.37986 > 151.101.117.67.443: Flags [.], ack 269276, win 65535, length 0
19:28:03.101294 IP 151.101.117.67.443 > 10.0.2.15.37986: Flags [P.], seq 269276:270392, ack 867, win 65535, length 1116
19:28:03.101296 IP 151.101.117.67.443 > 10.0.2.15.37986: Flags [P.], seq 270392:275888, ack 867, win 65535, length 5496
19:28:03.101297 IP 151.101.117.67.443 > 10.0.2.15.37986: Flags [P.], seq 275888:278636, ack 867, win 65535, length 2748
19:28:03.101310 IP 10.0.2.15.37986 > 151.101.117.67.443: Flags [.], ack 275888, win 65535, length 0
19:28:03.101386 IP 10.0.2.15.37986 > 151.101.117.67.443: Flags [.], ack 278636, win 65535, length 0
19:28:03.101726 IP 151.101.117.67.443 > 10.0.2.15.37986: Flags [P.], seq 278636:281384, ack 867, win 65535, length 2748
19:28:03.101727 IP 151.101.117.67.443 > 10.0.2.15.37986: Flags [P.], seq 281384:282758, ack 867, win 65535, length 1374
19:28:03.101741 IP 10.0.2.15.37986 > 151.101.117.67.443: Flags [.], ack 281384, win 65535, length 0
19:28:03.102004 IP 151.101.117.67.443 > 10.0.2.15.37986: Flags [P.], seq 282758:286880, ack 867, win 65535, length 4122
19:28:03.102005 IP 151.101.117.67.443 > 10.0.2.15.37986: Flags [P.], seq 286880:288254, ack 867, win 65535, length 1374
19:28:03.102006 IP 151.101.117.67.443 > 10.0.2.15.37986: Flags [.], seq 288254:291174, ack 867, win 65535, length 2920
19:28:03.102015 IP 10.0.2.15.37986 > 151.101.117.67.443: Flags [.], ack 286880, win 65535, length 0
19:28:03.102035 IP 10.0.2.15.37986 > 151.101.117.67.443: Flags [.], ack 291174, win 65535, length 0
19:28:03.102226 IP 151.101.117.67.443 > 10.0.2.15.37986: Flags [P.], seq 291174:292376, ack 867, win 65535, length 1202
19:28:03.102228 IP 151.101.117.67.443 > 10.0.2.15.37986: Flags [P.], seq 292376:293750, ack 867, win 65535, length 1374
19:28:03.102229 IP 151.101.117.67.443 > 10.0.2.15.37986: Flags [P.], seq 293750:296498, ack 867, win 65535, length 2748
19:28:03.102282 IP 10.0.2.15.37986 > 151.101.117.67.443: Flags [.], ack 293750, win 65535, length 0
19:28:03.102298 IP 10.0.2.15.37986 > 151.101.117.67.443: Flags [.], ack 296498, win 65535, length 0
19:28:03.102883 IP 151.101.117.67.443 > 10.0.2.15.37986: Flags [P.], seq 296498:299246, ack 867, win 65535, length 2748
19:28:03.102884 IP 151.101.117.67.443 > 10.0.2.15.37986: Flags [P.], seq 299246:300620, ack 867, win 65535, length 1374
19:28:03.102896 IP 10.0.2.15.37986 > 151.101.117.67.443: Flags [.], ack 299246, win 65535, length 0
19:28:03.103944 IP 151.101.117.67.443 > 10.0.2.15.37986: Flags [P.], seq 300620:306116, ack 867, win 65535, length 5496
19:28:03.103961 IP 10.0.2.15.37986 > 151.101.117.67.443: Flags [.], ack 306116, win 65535, length 0
19:28:03.107448 IP 151.101.117.67.443 > 10.0.2.15.37986: Flags [P.], seq 306116:315734, ack 867, win 65535, length 9618
19:28:03.107452 IP 151.101.117.67.443 > 10.0.2.15.37986: Flags [P.], seq 315734:322604, ack 867, win 65535, length 6870
19:28:03.107510 IP 10.0.2.15.37986 > 151.101.117.67.443: Flags [.], ack 315734, win 65535, length 0
19:28:03.107581 IP 10.0.2.15.37986 > 151.101.117.67.443: Flags [.], ack 322604, win 65535, length 0
19:28:03.107660 IP 151.101.117.67.443 > 10.0.2.15.37986: Flags [P.], seq 322604:325352, ack 867, win 65535, length 2748
19:28:03.107664 IP 151.101.117.67.443 > 10.0.2.15.37986: Flags [P.], seq 325352:336344, ack 867, win 65535, length 10992
19:28:03.107714 IP 10.0.2.15.37986 > 151.101.117.67.443: Flags [.], ack 325352, win 65535, length 0
19:28:03.107858 IP 10.0.2.15.37986 > 151.101.117.67.443: Flags [.], ack 336344, win 65535, length 0
19:28:03.107977 IP 151.101.117.67.443 > 10.0.2.15.37986: Flags [P.], seq 336344:339092, ack 867, win 65535, length 2748
19:28:03.107978 IP 151.101.117.67.443 > 10.0.2.15.37986: Flags [P.], seq 339092:341840, ack 867, win 65535, length 2748
19:28:03.107979 IP 151.101.117.67.443 > 10.0.2.15.37986: Flags [P.], seq 341840:344588, ack 867, win 65535, length 2748
19:28:03.107992 IP 10.0.2.15.37986 > 151.101.117.67.443: Flags [.], ack 339092, win 65535, length 0
19:28:03.108020 IP 10.0.2.15.37986 > 151.101.117.67.443: Flags [.], ack 341840, win 65535, length 0
19:28:03.108071 IP 10.0.2.15.37986 > 151.101.117.67.443: Flags [.], ack 344588, win 65535, length 0
19:28:03.108575 IP 151.101.117.67.443 > 10.0.2.15.37986: Flags [P.], seq 344588:347336, ack 867, win 65535, length 2748
19:28:03.108576 IP 151.101.117.67.443 > 10.0.2.15.37986: Flags [P.], seq 347336:350084, ack 867, win 65535, length 2748
19:28:03.108577 IP 151.101.117.67.443 > 10.0.2.15.37986: Flags [P.], seq 350084:352832, ack 867, win 65535, length 2748
19:28:03.108590 IP 10.0.2.15.37986 > 151.101.117.67.443: Flags [.], ack 347336, win 65535, length 0
19:28:03.108613 IP 10.0.2.15.37986 > 151.101.117.67.443: Flags [.], ack 350084, win 65535, length 0
19:28:03.108625 IP 10.0.2.15.37986 > 151.101.117.67.443: Flags [.], ack 352832, win 65535, length 0
19:28:03.111528 IP 151.101.117.67.443 > 10.0.2.15.37986: Flags [P.], seq 352832:359702, ack 867, win 65535, length 6870
19:28:03.111553 IP 10.0.2.15.37986 > 151.101.117.67.443: Flags [.], ack 359702, win 65535, length 0
19:28:03.111745 IP 151.101.117.67.443 > 10.0.2.15.37986: Flags [P.], seq 359702:365198, ack 867, win 65535, length 5496
19:28:03.111746 IP 151.101.117.67.443 > 10.0.2.15.37986: Flags [P.], seq 365198:369320, ack 867, win 65535, length 4122
19:28:03.111788 IP 10.0.2.15.37986 > 151.101.117.67.443: Flags [.], ack 365198, win 65535, length 0
19:28:03.111807 IP 10.0.2.15.37986 > 151.101.117.67.443: Flags [.], ack 369320, win 65535, length 0
19:28:03.112004 IP 151.101.117.67.443 > 10.0.2.15.37986: Flags [P.], seq 369320:370694, ack 867, win 65535, length 1374
19:28:03.112196 IP 151.101.117.67.443 > 10.0.2.15.37986: Flags [P.], seq 370694:374816, ack 867, win 65535, length 4122
19:28:03.112197 IP 151.101.117.67.443 > 10.0.2.15.37986: Flags [P.], seq 374816:376190, ack 867, win 65535, length 1374
19:28:03.112198 IP 151.101.117.67.443 > 10.0.2.15.37986: Flags [P.], seq 376190:378938, ack 867, win 65535, length 2748
19:28:03.112251 IP 10.0.2.15.37986 > 151.101.117.67.443: Flags [.], ack 374816, win 65535, length 0
19:28:03.112272 IP 10.0.2.15.37986 > 151.101.117.67.443: Flags [.], ack 378938, win 65535, length 0
19:28:03.112467 IP 151.101.117.67.443 > 10.0.2.15.37986: Flags [P.], seq 378938:381686, ack 867, win 65535, length 2748
19:28:03.112477 IP 10.0.2.15.37986 > 151.101.117.67.443: Flags [.], ack 381686, win 65535, length 0
19:28:03.112966 IP 151.101.117.67.443 > 10.0.2.15.37986: Flags [P.], seq 381686:384434, ack 867, win 65535, length 2748
19:28:03.112967 IP 151.101.117.67.443 > 10.0.2.15.37986: Flags [P.], seq 384434:388556, ack 867, win 65535, length 4122
19:28:03.112980 IP 10.0.2.15.37986 > 151.101.117.67.443: Flags [.], ack 384434, win 65535, length 0
19:28:03.112997 IP 10.0.2.15.37986 > 151.101.117.67.443: Flags [.], ack 388556, win 65535, length 0
19:28:03.113791 IP 151.101.117.67.443 > 10.0.2.15.37986: Flags [P.], seq 388556:395426, ack 867, win 65535, length 6870
19:28:03.113793 IP 151.101.117.67.443 > 10.0.2.15.37986: Flags [P.], seq 395426:399548, ack 867, win 65535, length 4122
19:28:03.113809 IP 10.0.2.15.37986 > 151.101.117.67.443: Flags [.], ack 395426, win 65535, length 0
19:28:03.113894 IP 10.0.2.15.37986 > 151.101.117.67.443: Flags [.], ack 399548, win 65535, length 0
19:28:03.113935 IP 151.101.117.67.443 > 10.0.2.15.37986: Flags [P.], seq 399548:402296, ack 867, win 65535, length 2748
19:28:03.113936 IP 151.101.117.67.443 > 10.0.2.15.37986: Flags [P.], seq 402296:405044, ack 867, win 65535, length 2748
19:28:03.113946 IP 10.0.2.15.37986 > 151.101.117.67.443: Flags [.], ack 402296, win 65535, length 0
19:28:03.113967 IP 10.0.2.15.37986 > 151.101.117.67.443: Flags [.], ack 405044, win 65535, length 0
19:28:03.114392 IP 151.101.117.67.443 > 10.0.2.15.37986: Flags [P.], seq 405044:409166, ack 867, win 65535, length 4122
19:28:03.114394 IP 151.101.117.67.443 > 10.0.2.15.37986: Flags [P.], seq 409166:411914, ack 867, win 65535, length 2748
19:28:03.114403 IP 10.0.2.15.37986 > 151.101.117.67.443: Flags [.], ack 409166, win 65535, length 0
19:28:03.114422 IP 10.0.2.15.37986 > 151.101.117.67.443: Flags [.], ack 411914, win 65535, length 0
19:28:03.114887 IP 151.101.117.67.443 > 10.0.2.15.37986: Flags [P.], seq 411914:414662, ack 867, win 65535, length 2748
19:28:03.114889 IP 151.101.117.67.443 > 10.0.2.15.37986: Flags [P.], seq 414662:418784, ack 867, win 65535, length 4122
19:28:03.114890 IP 151.101.117.67.443 > 10.0.2.15.37986: Flags [P.], seq 418784:421532, ack 867, win 65535, length 2748
19:28:03.114902 IP 10.0.2.15.37986 > 151.101.117.67.443: Flags [.], ack 414662, win 65535, length 0
19:28:03.114922 IP 10.0.2.15.37986 > 151.101.117.67.443: Flags [.], ack 418784, win 65535, length 0
19:28:03.114935 IP 10.0.2.15.37986 > 151.101.117.67.443: Flags [.], ack 421532, win 65535, length 0
19:28:03.115030 IP 151.101.117.67.443 > 10.0.2.15.37986: Flags [P.], seq 421532:424280, ack 867, win 65535, length 2748
19:28:03.115035 IP 10.0.2.15.37986 > 151.101.117.67.443: Flags [.], ack 424280, win 65535, length 0
19:28:03.118773 IP 151.101.117.67.443 > 10.0.2.15.37986: Flags [P.], seq 424280:431150, ack 867, win 65535, length 6870
19:28:03.118776 IP 151.101.117.67.443 > 10.0.2.15.37986: Flags [P.], seq 431150:436646, ack 867, win 65535, length 5496
19:28:03.118841 IP 10.0.2.15.37986 > 151.101.117.67.443: Flags [.], ack 431150, win 65535, length 0
19:28:03.118905 IP 10.0.2.15.37986 > 151.101.117.67.443: Flags [.], ack 436646, win 65535, length 0
19:28:03.118998 IP 151.101.117.67.443 > 10.0.2.15.37986: Flags [P.], seq 436646:439394, ack 867, win 65535, length 2748
19:28:03.118999 IP 151.101.117.67.443 > 10.0.2.15.37986: Flags [P.], seq 439394:442142, ack 867, win 65535, length 2748
19:28:03.119000 IP 151.101.117.67.443 > 10.0.2.15.37986: Flags [P.], seq 442142:444890, ack 867, win 65535, length 2748
19:28:03.119002 IP 151.101.117.67.443 > 10.0.2.15.37986: Flags [P.], seq 444890:449012, ack 867, win 65535, length 4122
19:28:03.119011 IP 10.0.2.15.37986 > 151.101.117.67.443: Flags [.], ack 439394, win 65535, length 0
19:28:03.119154 IP 10.0.2.15.37986 > 151.101.117.67.443: Flags [.], ack 442142, win 65535, length 0
19:28:03.119194 IP 10.0.2.15.37986 > 151.101.117.67.443: Flags [.], ack 444890, win 65535, length 0
19:28:03.119205 IP 10.0.2.15.37986 > 151.101.117.67.443: Flags [.], ack 449012, win 65535, length 0
19:28:03.119229 IP 151.101.117.67.443 > 10.0.2.15.37986: Flags [P.], seq 449012:451760, ack 867, win 65535, length 2748
19:28:03.119230 IP 151.101.117.67.443 > 10.0.2.15.37986: Flags [P.], seq 451760:454508, ack 867, win 65535, length 2748
19:28:03.119231 IP 151.101.117.67.443 > 10.0.2.15.37986: Flags [P.], seq 454508:457256, ack 867, win 65535, length 2748
19:28:03.119263 IP 151.101.117.67.443 > 10.0.2.15.37986: Flags [P.], seq 457256:458630, ack 867, win 65535, length 1374
19:28:03.119271 IP 10.0.2.15.37986 > 151.101.117.67.443: Flags [.], ack 451760, win 65535, length 0
19:28:03.119284 IP 10.0.2.15.37986 > 151.101.117.67.443: Flags [.], ack 454508, win 65535, length 0
19:28:03.119294 IP 10.0.2.15.37986 > 151.101.117.67.443: Flags [.], ack 457256, win 65535, length 0
19:28:03.119481 IP 151.101.117.67.443 > 10.0.2.15.37986: Flags [P.], seq 458630:462752, ack 867, win 65535, length 4122
19:28:03.119490 IP 10.0.2.15.37986 > 151.101.117.67.443: Flags [.], ack 462752, win 65535, length 0
19:28:03.119849 IP 151.101.117.67.443 > 10.0.2.15.37986: Flags [P.], seq 462752:464126, ack 867, win 65535, length 1374
19:28:03.119850 IP 151.101.117.67.443 > 10.0.2.15.37986: Flags [P.], seq 464126:466908, ack 867, win 65535, length 2782
19:28:03.119860 IP 10.0.2.15.37986 > 151.101.117.67.443: Flags [.], ack 466908, win 65535, length 0
19:28:03.120683 IP 151.101.117.67.443 > 10.0.2.15.37986: Flags [P.], seq 466908:473778, ack 867, win 65535, length 6870
19:28:03.120685 IP 151.101.117.67.443 > 10.0.2.15.37986: Flags [P.], seq 473778:476526, ack 867, win 65535, length 2748
19:28:03.120703 IP 10.0.2.15.37986 > 151.101.117.67.443: Flags [.], ack 473778, win 65535, length 0
19:28:03.120732 IP 10.0.2.15.37986 > 151.101.117.67.443: Flags [.], ack 476526, win 65535, length 0
19:28:03.121658 IP 151.101.117.67.443 > 10.0.2.15.37986: Flags [P.], seq 476526:479274, ack 867, win 65535, length 2748
19:28:03.121744 IP 151.101.117.67.443 > 10.0.2.15.37986: Flags [P.], seq 479274:482022, ack 867, win 65535, length 2748
19:28:03.121745 IP 151.101.117.67.443 > 10.0.2.15.37986: Flags [P.], seq 482022:483396, ack 867, win 65535, length 1374
19:28:03.121745 IP 151.101.117.67.443 > 10.0.2.15.37986: Flags [P.], seq 483396:484770, ack 867, win 65535, length 1374
19:28:03.121754 IP 151.101.117.67.443 > 10.0.2.15.37986: Flags [P.], seq 484770:488892, ack 867, win 65535, length 4122
19:28:03.121771 IP 10.0.2.15.37986 > 151.101.117.67.443: Flags [.], ack 479274, win 65535, length 0
19:28:03.121827 IP 10.0.2.15.37986 > 151.101.117.67.443: Flags [.], ack 482022, win 65535, length 0
19:28:03.121846 IP 10.0.2.15.37986 > 151.101.117.67.443: Flags [.], ack 484770, win 65535, length 0
19:28:03.121857 IP 10.0.2.15.37986 > 151.101.117.67.443: Flags [.], ack 488892, win 65535, length 0
19:28:03.121942 IP 151.101.117.67.443 > 10.0.2.15.37986: Flags [P.], seq 488892:490266, ack 867, win 65535, length 1374
19:28:03.121944 IP 151.101.117.67.443 > 10.0.2.15.37986: Flags [P.], seq 490266:494388, ack 867, win 65535, length 4122
19:28:03.121944 IP 151.101.117.67.443 > 10.0.2.15.37986: Flags [P.], seq 494388:497136, ack 867, win 65535, length 2748
19:28:03.121945 IP 151.101.117.67.443 > 10.0.2.15.37986: Flags [P.], seq 497136:498510, ack 867, win 65535, length 1374
19:28:03.121959 IP 10.0.2.15.37986 > 151.101.117.67.443: Flags [.], ack 494388, win 65535, length 0
19:28:03.122098 IP 10.0.2.15.37986 > 151.101.117.67.443: Flags [.], ack 497136, win 65535, length 0
19:28:03.122403 IP 151.101.117.67.443 > 10.0.2.15.37986: Flags [P.], seq 498510:502632, ack 867, win 65535, length 4122
19:28:03.122405 IP 151.101.117.67.443 > 10.0.2.15.37986: Flags [P.], seq 502632:504006, ack 867, win 65535, length 1374
19:28:03.122406 IP 151.101.117.67.443 > 10.0.2.15.37986: Flags [P.], seq 504006:505380, ack 867, win 65535, length 1374
19:28:03.122416 IP 10.0.2.15.37986 > 151.101.117.67.443: Flags [.], ack 502632, win 65535, length 0
19:28:03.122432 IP 10.0.2.15.37986 > 151.101.117.67.443: Flags [.], ack 505380, win 65535, length 0
19:28:03.122940 IP 151.101.117.67.443 > 10.0.2.15.37986: Flags [P.], seq 505380:510876, ack 867, win 65535, length 5496
19:28:03.122959 IP 10.0.2.15.37986 > 151.101.117.67.443: Flags [.], ack 510876, win 65535, length 0
19:28:03.123190 IP 151.101.117.67.443 > 10.0.2.15.37986: Flags [.], seq 510876:512336, ack 867, win 65535, length 1460
19:28:03.123358 IP 151.101.117.67.443 > 10.0.2.15.37986: Flags [P.], seq 512336:516372, ack 867, win 65535, length 4036
19:28:03.123360 IP 151.101.117.67.443 > 10.0.2.15.37986: Flags [P.], seq 516372:519120, ack 867, win 65535, length 2748
19:28:03.123376 IP 10.0.2.15.37986 > 151.101.117.67.443: Flags [.], ack 516372, win 65535, length 0
19:28:03.123426 IP 10.0.2.15.37986 > 151.101.117.67.443: Flags [.], ack 519120, win 65535, length 0
19:28:03.123548 IP 151.101.117.67.443 > 10.0.2.15.37986: Flags [P.], seq 519120:520494, ack 867, win 65535, length 1374
19:28:03.123817 IP 151.101.117.67.443 > 10.0.2.15.37986: Flags [P.], seq 520494:527364, ack 867, win 65535, length 6870
19:28:03.123818 IP 151.101.117.67.443 > 10.0.2.15.37986: Flags [P.], seq 527364:528738, ack 867, win 65535, length 1374
19:28:03.123831 IP 10.0.2.15.37986 > 151.101.117.67.443: Flags [.], ack 527364, win 65535, length 0
19:28:03.123946 IP 151.101.117.67.443 > 10.0.2.15.37986: Flags [P.], seq 528738:531486, ack 867, win 65535, length 2748
19:28:03.123954 IP 10.0.2.15.37986 > 151.101.117.67.443: Flags [.], ack 531486, win 65535, length 0
19:28:03.124256 IP 151.101.117.67.443 > 10.0.2.15.37986: Flags [P.], seq 531486:534234, ack 867, win 65535, length 2748
19:28:03.124269 IP 10.0.2.15.37986 > 151.101.117.67.443: Flags [.], ack 534234, win 65535, length 0
19:28:03.124498 IP 151.101.117.67.443 > 10.0.2.15.37986: Flags [P.], seq 534234:538356, ack 867, win 65535, length 4122
19:28:03.124500 IP 151.101.117.67.443 > 10.0.2.15.37986: Flags [P.], seq 538356:541104, ack 867, win 65535, length 2748
19:28:03.124519 IP 10.0.2.15.37986 > 151.101.117.67.443: Flags [.], ack 538356, win 65535, length 0
19:28:03.124576 IP 10.0.2.15.37986 > 151.101.117.67.443: Flags [.], ack 541104, win 65535, length 0
19:28:03.125251 IP 151.101.117.67.443 > 10.0.2.15.37986: Flags [P.], seq 541104:546600, ack 867, win 65535, length 5496
19:28:03.125277 IP 10.0.2.15.37986 > 151.101.117.67.443: Flags [.], ack 546600, win 65535, length 0
19:28:03.125625 IP 151.101.117.67.443 > 10.0.2.15.37986: Flags [.], seq 546600:549520, ack 867, win 65535, length 2920
19:28:03.125637 IP 10.0.2.15.37986 > 151.101.117.67.443: Flags [.], ack 549520, win 65535, length 0
19:28:03.125744 IP 151.101.117.67.443 > 10.0.2.15.37986: Flags [P.], seq 549520:552096, ack 867, win 65535, length 2576
19:28:03.125746 IP 151.101.117.67.443 > 10.0.2.15.37986: Flags [P.], seq 552096:553470, ack 867, win 65535, length 1374
19:28:03.125758 IP 10.0.2.15.37986 > 151.101.117.67.443: Flags [.], ack 552096, win 65535, length 0
19:28:03.126230 IP 151.101.117.67.443 > 10.0.2.15.37986: Flags [P.], seq 553470:558184, ack 867, win 65535, length 4714
19:28:03.126232 IP 151.101.117.67.443 > 10.0.2.15.37986: Flags [P.], seq 558184:560932, ack 867, win 65535, length 2748
19:28:03.126233 IP 151.101.117.67.443 > 10.0.2.15.37986: Flags [P.], seq 560932:563680, ack 867, win 65535, length 2748
19:28:03.126248 IP 10.0.2.15.37986 > 151.101.117.67.443: Flags [.], ack 558184, win 65535, length 0
19:28:03.126275 IP 10.0.2.15.37986 > 151.101.117.67.443: Flags [.], ack 560932, win 65535, length 0
19:28:03.126288 IP 10.0.2.15.37986 > 151.101.117.67.443: Flags [.], ack 563680, win 65535, length 0
19:28:03.126312 IP 151.101.117.67.443 > 10.0.2.15.37986: Flags [P.], seq 563680:566428, ack 867, win 65535, length 2748
19:28:03.126313 IP 151.101.117.67.443 > 10.0.2.15.37986: Flags [P.], seq 566428:567802, ack 867, win 65535, length 1374
19:28:03.126320 IP 10.0.2.15.37986 > 151.101.117.67.443: Flags [.], ack 566428, win 65535, length 0
19:28:03.126515 IP 151.101.117.67.443 > 10.0.2.15.37986: Flags [P.], seq 567802:573298, ack 867, win 65535, length 5496
19:28:03.126549 IP 10.0.2.15.37986 > 151.101.117.67.443: Flags [.], ack 573298, win 65535, length 0
19:28:03.126713 IP 151.101.117.67.443 > 10.0.2.15.37986: Flags [P.], seq 573298:576046, ack 867, win 65535, length 2748
19:28:03.126906 IP 10.0.2.15.37986 > 151.101.117.67.443: Flags [.], ack 576046, win 65535, length 0
19:28:03.127460 IP 151.101.117.67.443 > 10.0.2.15.37986: Flags [P.], seq 576046:581542, ack 867, win 65535, length 5496
19:28:03.127614 IP 151.101.117.67.443 > 10.0.2.15.37986: Flags [P.], seq 581542:584290, ack 867, win 65535, length 2748
19:28:03.127755 IP 10.0.2.15.37986 > 151.101.117.67.443: Flags [.], ack 581542, win 65535, length 0
19:28:03.127966 IP 151.101.117.67.443 > 10.0.2.15.37986: Flags [P.], seq 584290:589786, ack 867, win 65535, length 5496
19:28:03.127968 IP 151.101.117.67.443 > 10.0.2.15.37986: Flags [P.], seq 589786:592534, ack 867, win 65535, length 2748
19:28:03.127968 IP 151.101.117.67.443 > 10.0.2.15.37986: Flags [P.], seq 592534:593908, ack 867, win 65535, length 1374
19:28:03.127970 IP 151.101.117.67.443 > 10.0.2.15.37986: Flags [P.], seq 593908:598030, ack 867, win 65535, length 4122
19:28:03.128210 IP 151.101.117.67.443 > 10.0.2.15.37986: Flags [P.], seq 598030:599404, ack 867, win 65535, length 1374
19:28:03.128686 IP 151.101.117.67.443 > 10.0.2.15.37986: Flags [P.], seq 599404:602152, ack 867, win 65535, length 2748
19:28:03.128688 IP 151.101.117.67.443 > 10.0.2.15.37986: Flags [P.], seq 602152:606274, ack 867, win 65535, length 4122
19:28:03.128689 IP 151.101.117.67.443 > 10.0.2.15.37986: Flags [P.], seq 606274:609022, ack 867, win 65535, length 2748
19:28:03.128690 IP 151.101.117.67.443 > 10.0.2.15.37986: Flags [P.], seq 609022:611770, ack 867, win 65535, length 2748
19:28:03.128892 IP 151.101.117.67.443 > 10.0.2.15.37986: Flags [P.], seq 611770:614518, ack 867, win 65535, length 2748
19:28:03.129283 IP 10.0.2.15.37986 > 151.101.117.67.443: Flags [.], ack 614518, win 65535, length 0
19:28:03.129654 IP 151.101.117.67.443 > 10.0.2.15.37986: Flags [.], seq 614518:627658, ack 867, win 65535, length 13140
19:28:03.129774 IP 151.101.117.67.443 > 10.0.2.15.37986: Flags [P.], seq 627658:629632, ack 867, win 65535, length 1974
19:28:03.129775 IP 151.101.117.67.443 > 10.0.2.15.37986: Flags [P.], seq 629632:632380, ack 867, win 65535, length 2748
19:28:03.130061 IP 151.101.117.67.443 > 10.0.2.15.37986: Flags [P.], seq 632380:635128, ack 867, win 65535, length 2748
19:28:03.130062 IP 151.101.117.67.443 > 10.0.2.15.37986: Flags [P.], seq 635128:637876, ack 867, win 65535, length 2748
19:28:03.130284 IP 151.101.117.67.443 > 10.0.2.15.37986: Flags [P.], seq 637876:641998, ack 867, win 65535, length 4122
19:28:03.130286 IP 151.101.117.67.443 > 10.0.2.15.37986: Flags [P.], seq 641998:643372, ack 867, win 65535, length 1374
19:28:03.130577 IP 151.101.117.67.443 > 10.0.2.15.37986: Flags [P.], seq 643372:646120, ack 867, win 65535, length 2748
19:28:03.130578 IP 151.101.117.67.443 > 10.0.2.15.37986: Flags [P.], seq 646120:647494, ack 867, win 65535, length 1374
19:28:03.130645 IP 10.0.2.15.37986 > 151.101.117.67.443: Flags [.], ack 647494, win 65535, length 0
19:28:03.131471 IP 151.101.117.67.443 > 10.0.2.15.37986: Flags [P.], seq 647494:654364, ack 867, win 65535, length 6870
19:28:03.131474 IP 151.101.117.67.443 > 10.0.2.15.37986: Flags [P.], seq 654364:658486, ack 867, win 65535, length 4122
19:28:03.131627 IP 10.0.2.15.37986 > 151.101.117.67.443: Flags [.], ack 654364, win 65535, length 0
19:28:03.131656 IP 10.0.2.15.37986 > 151.101.117.67.443: Flags [.], ack 658486, win 65535, length 0
19:28:03.131724 IP 151.101.117.67.443 > 10.0.2.15.37986: Flags [P.], seq 658486:661234, ack 867, win 65535, length 2748
19:28:03.131725 IP 151.101.117.67.443 > 10.0.2.15.37986: Flags [P.], seq 661234:662608, ack 867, win 65535, length 1374
19:28:03.131726 IP 151.101.117.67.443 > 10.0.2.15.37986: Flags [P.], seq 662608:665356, ack 867, win 65535, length 2748
19:28:03.131727 IP 151.101.117.67.443 > 10.0.2.15.37986: Flags [P.], seq 665356:668104, ack 867, win 65535, length 2748
19:28:03.131735 IP 10.0.2.15.37986 > 151.101.117.67.443: Flags [.], ack 661234, win 65535, length 0
19:28:03.131750 IP 10.0.2.15.37986 > 151.101.117.67.443: Flags [.], ack 665356, win 65535, length 0
19:28:03.131951 IP 151.101.117.67.443 > 10.0.2.15.37986: Flags [P.], seq 668104:670852, ack 867, win 65535, length 2748
19:28:03.132085 IP 151.101.117.67.443 > 10.0.2.15.37986: Flags [P.], seq 670852:673600, ack 867, win 65535, length 2748
19:28:03.132145 IP 151.101.117.67.443 > 10.0.2.15.37986: Flags [P.], seq 673600:674974, ack 867, win 65535, length 1374
19:28:03.132193 IP 10.0.2.15.37986 > 151.101.117.67.443: Flags [.], ack 670852, win 65535, length 0
19:28:03.132224 IP 10.0.2.15.37986 > 151.101.117.67.443: Flags [.], ack 674974, win 65535, length 0
19:28:03.132563 IP 151.101.117.67.443 > 10.0.2.15.37986: Flags [.], seq 674974:677894, ack 867, win 65535, length 2920
19:28:03.132841 IP 151.101.117.67.443 > 10.0.2.15.37986: Flags [P.], seq 677894:679096, ack 867, win 65535, length 1202
19:28:03.132843 IP 151.101.117.67.443 > 10.0.2.15.37986: Flags [P.], seq 679096:681844, ack 867, win 65535, length 2748
19:28:03.132844 IP 151.101.117.67.443 > 10.0.2.15.37986: Flags [P.], seq 681844:683218, ack 867, win 65535, length 1374
19:28:03.132845 IP 151.101.117.67.443 > 10.0.2.15.37986: Flags [P.], seq 683218:688714, ack 867, win 65535, length 5496
19:28:03.132923 IP 151.101.117.67.443 > 10.0.2.15.37986: Flags [P.], seq 688714:690088, ack 867, win 65535, length 1374
19:28:03.133090 IP 151.101.117.67.443 > 10.0.2.15.37986: Flags [P.], seq 690088:692836, ack 867, win 65535, length 2748
19:28:03.133116 IP 10.0.2.15.37986 > 151.101.117.67.443: Flags [.], ack 692836, win 65535, length 0
19:28:03.133473 IP 151.101.117.67.443 > 10.0.2.15.37986: Flags [P.], seq 692836:695584, ack 867, win 65535, length 2748
19:28:03.133475 IP 151.101.117.67.443 > 10.0.2.15.37986: Flags [P.], seq 695584:699706, ack 867, win 65535, length 4122
19:28:03.133475 IP 151.101.117.67.443 > 10.0.2.15.37986: Flags [.], seq 699706:701166, ack 867, win 65535, length 1460
19:28:03.133914 IP 151.101.117.67.443 > 10.0.2.15.37986: Flags [P.], seq 701166:702454, ack 867, win 65535, length 1288
19:28:03.133915 IP 151.101.117.67.443 > 10.0.2.15.37986: Flags [P.], seq 702454:703828, ack 867, win 65535, length 1374
19:28:03.133916 IP 151.101.117.67.443 > 10.0.2.15.37986: Flags [P.], seq 703828:706576, ack 867, win 65535, length 2748
19:28:03.133916 IP 151.101.117.67.443 > 10.0.2.15.37986: Flags [P.], seq 706576:709324, ack 867, win 65535, length 2748
19:28:03.133991 IP 10.0.2.15.37986 > 151.101.117.67.443: Flags [.], ack 701166, win 65535, length 0
19:28:03.134196 IP 151.101.117.67.443 > 10.0.2.15.37986: Flags [P.], seq 709324:713446, ack 867, win 65535, length 4122
19:28:03.134197 IP 151.101.117.67.443 > 10.0.2.15.37986: Flags [P.], seq 713446:714820, ack 867, win 65535, length 1374
19:28:03.134198 IP 151.101.117.67.443 > 10.0.2.15.37986: Flags [P.], seq 714820:717568, ack 867, win 65535, length 2748
19:28:03.134374 IP 151.101.117.67.443 > 10.0.2.15.37986: Flags [P.], seq 717568:718942, ack 867, win 65535, length 1374
19:28:03.134429 IP 10.0.2.15.37986 > 151.101.117.67.443: Flags [.], ack 718942, win 65535, length 0
19:28:03.135410 IP 151.101.117.67.443 > 10.0.2.15.37986: Flags [P.], seq 718942:725812, ack 867, win 65535, length 6870
19:28:03.135426 IP 10.0.2.15.37986 > 151.101.117.67.443: Flags [.], ack 725812, win 65535, length 0
19:28:03.135708 IP 151.101.117.67.443 > 10.0.2.15.37986: Flags [P.], seq 725812:729934, ack 867, win 65535, length 4122
19:28:03.135714 IP 151.101.117.67.443 > 10.0.2.15.37986: Flags [P.], seq 729934:731308, ack 867, win 65535, length 1374
19:28:03.135714 IP 151.101.117.67.443 > 10.0.2.15.37986: Flags [P.], seq 731308:732682, ack 867, win 65535, length 1374
19:28:03.135749 IP 10.0.2.15.37986 > 151.101.117.67.443: Flags [.], ack 729934, win 65535, length 0
19:28:03.135769 IP 10.0.2.15.37986 > 151.101.117.67.443: Flags [.], ack 732682, win 65535, length 0
19:28:03.136032 IP 151.101.117.67.443 > 10.0.2.15.37986: Flags [P.], seq 732682:735430, ack 867, win 65535, length 2748
19:28:03.136033 IP 151.101.117.67.443 > 10.0.2.15.37986: Flags [P.], seq 735430:739552, ack 867, win 65535, length 4122
19:28:03.136313 IP 151.101.117.67.443 > 10.0.2.15.37986: Flags [P.], seq 739552:742300, ack 867, win 65535, length 2748
19:28:03.136314 IP 151.101.117.67.443 > 10.0.2.15.37986: Flags [P.], seq 742300:743674, ack 867, win 65535, length 1374
19:28:03.136314 IP 151.101.117.67.443 > 10.0.2.15.37986: Flags [P.], seq 743674:746422, ack 867, win 65535, length 2748
19:28:03.136484 IP 151.101.117.67.443 > 10.0.2.15.37986: Flags [P.], seq 746422:750544, ack 867, win 65535, length 4122
19:28:03.136605 IP 151.101.117.67.443 > 10.0.2.15.37986: Flags [.], seq 750544:752004, ack 867, win 65535, length 1460
19:28:03.136782 IP 151.101.117.67.443 > 10.0.2.15.37986: Flags [P.], seq 752004:753292, ack 867, win 65535, length 1288
19:28:03.136783 IP 151.101.117.67.443 > 10.0.2.15.37986: Flags [P.], seq 753292:756040, ack 867, win 65535, length 2748
19:28:03.136784 IP 151.101.117.67.443 > 10.0.2.15.37986: Flags [P.], seq 756040:757414, ack 867, win 65535, length 1374
19:28:03.137038 IP 151.101.117.67.443 > 10.0.2.15.37986: Flags [P.], seq 757414:760162, ack 867, win 65535, length 2748
19:28:03.137039 IP 151.101.117.67.443 > 10.0.2.15.37986: Flags [P.], seq 760162:761536, ack 867, win 65535, length 1374
19:28:03.137314 IP 151.101.117.67.443 > 10.0.2.15.37986: Flags [P.], seq 761536:765658, ack 867, win 65535, length 4122
19:28:03.138376 IP 10.0.2.15.37986 > 151.101.117.67.443: Flags [.], ack 765658, win 65535, length 0
19:28:03.138770 IP 151.101.117.67.443 > 10.0.2.15.37986: Flags [.], seq 765658:775878, ack 867, win 65535, length 10220
19:28:03.138967 IP 151.101.117.67.443 > 10.0.2.15.37986: Flags [P.], seq 775878:790390, ack 867, win 65535, length 14512
19:28:03.139253 IP 10.0.2.15.37986 > 151.101.117.67.443: Flags [.], ack 790390, win 65535, length 0
19:28:03.139933 IP 151.101.117.67.443 > 10.0.2.15.37986: Flags [P.], seq 790390:794512, ack 867, win 65535, length 4122
19:28:03.139936 IP 151.101.117.67.443 > 10.0.2.15.37986: Flags [P.], seq 794512:795886, ack 867, win 65535, length 1374
19:28:03.139937 IP 151.101.117.67.443 > 10.0.2.15.37986: Flags [P.], seq 795886:798634, ack 867, win 65535, length 2748
19:28:03.140044 IP 10.0.2.15.37986 > 151.101.117.67.443: Flags [.], ack 794512, win 65535, length 0
19:28:03.140194 IP 10.0.2.15.37986 > 151.101.117.67.443: Flags [.], ack 798634, win 65535, length 0
19:28:03.140559 IP 151.101.117.67.443 > 10.0.2.15.37986: Flags [P.], seq 798634:802756, ack 867, win 65535, length 4122
19:28:03.140561 IP 151.101.117.67.443 > 10.0.2.15.37986: Flags [P.], seq 802756:805504, ack 867, win 65535, length 2748
19:28:03.140562 IP 151.101.117.67.443 > 10.0.2.15.37986: Flags [P.], seq 805504:806878, ack 867, win 65535, length 1374
19:28:03.140563 IP 151.101.117.67.443 > 10.0.2.15.37986: Flags [P.], seq 806878:811000, ack 867, win 65535, length 4122
19:28:03.140579 IP 10.0.2.15.37986 > 151.101.117.67.443: Flags [.], ack 802756, win 65535, length 0
19:28:03.140629 IP 10.0.2.15.37986 > 151.101.117.67.443: Flags [.], ack 805504, win 65535, length 0
19:28:03.140644 IP 10.0.2.15.37986 > 151.101.117.67.443: Flags [.], ack 811000, win 65535, length 0
19:28:03.140771 IP 151.101.117.67.443 > 10.0.2.15.37986: Flags [P.], seq 811000:813748, ack 867, win 65535, length 2748
19:28:03.140772 IP 151.101.117.67.443 > 10.0.2.15.37986: Flags [P.], seq 813748:816496, ack 867, win 65535, length 2748
19:28:03.140773 IP 151.101.117.67.443 > 10.0.2.15.37986: Flags [P.], seq 816496:819244, ack 867, win 65535, length 2748
19:28:03.140785 IP 10.0.2.15.37986 > 151.101.117.67.443: Flags [.], ack 813748, win 65535, length 0
19:28:03.140800 IP 10.0.2.15.37986 > 151.101.117.67.443: Flags [.], ack 816496, win 65535, length 0
19:28:03.140813 IP 10.0.2.15.37986 > 151.101.117.67.443: Flags [.], ack 819244, win 65535, length 0
19:28:03.141583 IP 151.101.117.67.443 > 10.0.2.15.37986: Flags [P.], seq 819244:820618, ack 867, win 65535, length 1374
19:28:03.141585 IP 151.101.117.67.443 > 10.0.2.15.37986: Flags [P.], seq 820618:824740, ack 867, win 65535, length 4122
19:28:03.141587 IP 151.101.117.67.443 > 10.0.2.15.37986: Flags [P.], seq 824740:828862, ack 867, win 65535, length 4122
19:28:03.141587 IP 151.101.117.67.443 > 10.0.2.15.37986: Flags [P.], seq 828862:830236, ack 867, win 65535, length 1374
19:28:03.141602 IP 10.0.2.15.37986 > 151.101.117.67.443: Flags [.], ack 824740, win 65535, length 0
19:28:03.141707 IP 10.0.2.15.37986 > 151.101.117.67.443: Flags [.], ack 828862, win 65535, length 0
19:28:03.141740 IP 151.101.117.67.443 > 10.0.2.15.37986: Flags [P.], seq 830236:835732, ack 867, win 65535, length 5496
19:28:03.141741 IP 151.101.117.67.443 > 10.0.2.15.37986: Flags [P.], seq 835732:838480, ack 867, win 65535, length 2748
19:28:03.141747 IP 10.0.2.15.37986 > 151.101.117.67.443: Flags [.], ack 835732, win 65535, length 0
19:28:03.141756 IP 10.0.2.15.37986 > 151.101.117.67.443: Flags [.], ack 838480, win 65535, length 0
19:28:03.141919 IP 151.101.117.67.443 > 10.0.2.15.37986: Flags [P.], seq 838480:839854, ack 867, win 65535, length 1374
19:28:03.142148 IP 151.101.117.67.443 > 10.0.2.15.37986: Flags [P.], seq 839854:842602, ack 867, win 65535, length 2748
19:28:03.142150 IP 151.101.117.67.443 > 10.0.2.15.37986: Flags [P.], seq 842602:846724, ack 867, win 65535, length 4122
19:28:03.142159 IP 10.0.2.15.37986 > 151.101.117.67.443: Flags [.], ack 842602, win 65535, length 0
19:28:03.142173 IP 10.0.2.15.37986 > 151.101.117.67.443: Flags [.], ack 846724, win 65535, length 0
19:28:03.142312 IP 151.101.117.67.443 > 10.0.2.15.37986: Flags [P.], seq 846724:848098, ack 867, win 65535, length 1374
19:28:03.142313 IP 151.101.117.67.443 > 10.0.2.15.37986: Flags [P.], seq 848098:850846, ack 867, win 65535, length 2748
19:28:03.142324 IP 10.0.2.15.37986 > 151.101.117.67.443: Flags [.], ack 850846, win 65535, length 0
19:28:03.142490 IP 151.101.117.67.443 > 10.0.2.15.37986: Flags [.], seq 850846:852306, ack 867, win 65535, length 1460
19:28:03.142742 IP 151.101.117.67.443 > 10.0.2.15.37986: Flags [P.], seq 852306:853594, ack 867, win 65535, length 1288
19:28:03.142744 IP 151.101.117.67.443 > 10.0.2.15.37986: Flags [P.], seq 853594:856342, ack 867, win 65535, length 2748
19:28:03.142759 IP 10.0.2.15.37986 > 151.101.117.67.443: Flags [.], ack 853594, win 65535, length 0
19:28:03.142779 IP 10.0.2.15.37986 > 151.101.117.67.443: Flags [.], ack 856342, win 65535, length 0
19:28:03.142882 IP 151.101.117.67.443 > 10.0.2.15.37986: Flags [P.], seq 856342:860464, ack 867, win 65535, length 4122
19:28:03.142883 IP 151.101.117.67.443 > 10.0.2.15.37986: Flags [P.], seq 860464:861838, ack 867, win 65535, length 1374
19:28:03.143071 IP 10.0.2.15.37986 > 151.101.117.67.443: Flags [.], ack 860464, win 65535, length 0
19:28:03.143263 IP 151.101.117.67.443 > 10.0.2.15.37986: Flags [P.], seq 861838:864586, ack 867, win 65535, length 2748
19:28:03.143273 IP 151.101.117.67.443 > 10.0.2.15.37986: Flags [P.], seq 864586:868708, ack 867, win 65535, length 4122
19:28:03.143282 IP 10.0.2.15.37986 > 151.101.117.67.443: Flags [.], ack 864586, win 65535, length 0
19:28:03.143305 IP 10.0.2.15.37986 > 151.101.117.67.443: Flags [.], ack 868708, win 65535, length 0
19:28:03.144236 IP 151.101.117.67.443 > 10.0.2.15.37986: Flags [P.], seq 868708:874204, ack 867, win 65535, length 5496
19:28:03.144258 IP 10.0.2.15.37986 > 151.101.117.67.443: Flags [.], ack 874204, win 65535, length 0
19:28:03.144735 IP 151.101.117.67.443 > 10.0.2.15.37986: Flags [P.], seq 874204:879700, ack 867, win 65535, length 5496
19:28:03.144737 IP 151.101.117.67.443 > 10.0.2.15.37986: Flags [P.], seq 879700:881074, ack 867, win 65535, length 1374
19:28:03.144738 IP 151.101.117.67.443 > 10.0.2.15.37986: Flags [P.], seq 881074:883822, ack 867, win 65535, length 2748
19:28:03.144754 IP 10.0.2.15.37986 > 151.101.117.67.443: Flags [.], ack 879700, win 65535, length 0
19:28:03.144823 IP 10.0.2.15.37986 > 151.101.117.67.443: Flags [.], ack 883822, win 65535, length 0
19:28:03.145101 IP 151.101.117.67.443 > 10.0.2.15.37986: Flags [P.], seq 883822:886570, ack 867, win 65535, length 2748
19:28:03.145102 IP 151.101.117.67.443 > 10.0.2.15.37986: Flags [.], seq 886570:888030, ack 867, win 65535, length 1460
19:28:03.145111 IP 10.0.2.15.37986 > 151.101.117.67.443: Flags [.], ack 886570, win 65535, length 0
19:28:03.145338 IP 151.101.117.67.443 > 10.0.2.15.37986: Flags [P.], seq 888030:889318, ack 867, win 65535, length 1288
19:28:03.145340 IP 151.101.117.67.443 > 10.0.2.15.37986: Flags [P.], seq 889318:892066, ack 867, win 65535, length 2748
19:28:03.145350 IP 10.0.2.15.37986 > 151.101.117.67.443: Flags [.], ack 889318, win 65535, length 0
19:28:03.145367 IP 10.0.2.15.37986 > 151.101.117.67.443: Flags [.], ack 892066, win 65535, length 0
19:28:03.145618 IP 151.101.117.67.443 > 10.0.2.15.37986: Flags [P.], seq 892066:896188, ack 867, win 65535, length 4122
19:28:03.145620 IP 151.101.117.67.443 > 10.0.2.15.37986: Flags [P.], seq 896188:898936, ack 867, win 65535, length 2748
19:28:03.145620 IP 151.101.117.67.443 > 10.0.2.15.37986: Flags [P.], seq 898936:900310, ack 867, win 65535, length 1374
19:28:03.145620 IP 151.101.117.67.443 > 10.0.2.15.37986: Flags [.], seq 900310:901770, ack 867, win 65535, length 1460
19:28:03.145631 IP 10.0.2.15.37986 > 151.101.117.67.443: Flags [.], ack 896188, win 65535, length 0
19:28:03.145646 IP 10.0.2.15.37986 > 151.101.117.67.443: Flags [.], ack 898936, win 65535, length 0
19:28:03.145660 IP 10.0.2.15.37986 > 151.101.117.67.443: Flags [.], ack 901770, win 65535, length 0
19:28:03.145785 IP 151.101.117.67.443 > 10.0.2.15.37986: Flags [P.], seq 901770:903058, ack 867, win 65535, length 1288
19:28:03.145786 IP 151.101.117.67.443 > 10.0.2.15.37986: Flags [P.], seq 903058:905806, ack 867, win 65535, length 2748
19:28:03.145829 IP 10.0.2.15.37986 > 151.101.117.67.443: Flags [.], ack 905806, win 65535, length 0
19:28:03.145901 IP 151.101.117.67.443 > 10.0.2.15.37986: Flags [P.], seq 905806:907180, ack 867, win 65535, length 1374
19:28:03.146108 IP 151.101.117.67.443 > 10.0.2.15.37986: Flags [P.], seq 907180:909928, ack 867, win 65535, length 2748
19:28:03.146131 IP 10.0.2.15.37986 > 151.101.117.67.443: Flags [.], ack 909928, win 65535, length 0
19:28:03.146467 IP 151.101.117.67.443 > 10.0.2.15.37986: Flags [P.], seq 909928:914050, ack 867, win 65535, length 4122
19:28:03.146468 IP 151.101.117.67.443 > 10.0.2.15.37986: Flags [P.], seq 914050:915424, ack 867, win 65535, length 1374
19:28:03.146558 IP 10.0.2.15.37986 > 151.101.117.67.443: Flags [.], ack 915424, win 65535, length 0
19:28:03.147526 IP 151.101.117.67.443 > 10.0.2.15.37986: Flags [P.], seq 915424:922294, ack 867, win 65535, length 6870
19:28:03.147528 IP 151.101.117.67.443 > 10.0.2.15.37986: Flags [P.], seq 922294:923668, ack 867, win 65535, length 1374
19:28:03.147529 IP 151.101.117.67.443 > 10.0.2.15.37986: Flags [P.], seq 923668:927790, ack 867, win 65535, length 4122
19:28:03.147543 IP 10.0.2.15.37986 > 151.101.117.67.443: Flags [.], ack 922294, win 65535, length 0
19:28:03.147565 IP 10.0.2.15.37986 > 151.101.117.67.443: Flags [.], ack 927790, win 65535, length 0
19:28:03.147715 IP 151.101.117.67.443 > 10.0.2.15.37986: Flags [P.], seq 927790:929164, ack 867, win 65535, length 1374
19:28:03.147717 IP 151.101.117.67.443 > 10.0.2.15.37986: Flags [P.], seq 929164:931912, ack 867, win 65535, length 2748
19:28:03.147717 IP 151.101.117.67.443 > 10.0.2.15.37986: Flags [P.], seq 931912:934660, ack 867, win 65535, length 2748
19:28:03.147718 IP 151.101.117.67.443 > 10.0.2.15.37986: Flags [P.], seq 934660:937408, ack 867, win 65535, length 2748
19:28:03.147719 IP 151.101.117.67.443 > 10.0.2.15.37986: Flags [P.], seq 937408:940156, ack 867, win 65535, length 2748
19:28:03.147818 IP 10.0.2.15.37986 > 151.101.117.67.443: Flags [.], ack 931912, win 65535, length 0
19:28:03.147859 IP 10.0.2.15.37986 > 151.101.117.67.443: Flags [.], ack 934660, win 65535, length 0
19:28:03.147869 IP 10.0.2.15.37986 > 151.101.117.67.443: Flags [.], ack 937408, win 65535, length 0
19:28:03.147879 IP 10.0.2.15.37986 > 151.101.117.67.443: Flags [.], ack 940156, win 65535, length 0
19:28:03.147994 IP 151.101.117.67.443 > 10.0.2.15.37986: Flags [P.], seq 940156:942904, ack 867, win 65535, length 2748
19:28:03.147995 IP 151.101.117.67.443 > 10.0.2.15.37986: Flags [P.], seq 942904:947026, ack 867, win 65535, length 4122
19:28:03.148076 IP 10.0.2.15.37986 > 151.101.117.67.443: Flags [.], ack 942904, win 65535, length 0
19:28:03.148614 IP 10.0.2.15.37986 > 151.101.117.67.443: Flags [.], ack 947026, win 65535, length 0
19:28:03.148741 IP 151.101.117.67.443 > 10.0.2.15.37986: Flags [P.], seq 947026:949774, ack 867, win 65535, length 2748
19:28:03.148742 IP 151.101.117.67.443 > 10.0.2.15.37986: Flags [P.], seq 949774:952522, ack 867, win 65535, length 2748
19:28:03.148751 IP 10.0.2.15.37986 > 151.101.117.67.443: Flags [.], ack 949774, win 65535, length 0
19:28:03.148771 IP 10.0.2.15.37986 > 151.101.117.67.443: Flags [.], ack 952522, win 65535, length 0
19:28:03.149155 IP 151.101.117.67.443 > 10.0.2.15.37986: Flags [P.], seq 952522:956644, ack 867, win 65535, length 4122
19:28:03.149166 IP 10.0.2.15.37986 > 151.101.117.67.443: Flags [.], ack 956644, win 65535, length 0
19:28:03.149527 IP 151.101.117.67.443 > 10.0.2.15.37986: Flags [P.], seq 956644:959392, ack 867, win 65535, length 2748
19:28:03.149529 IP 151.101.117.67.443 > 10.0.2.15.37986: Flags [P.], seq 959392:964888, ack 867, win 65535, length 5496
19:28:03.149542 IP 10.0.2.15.37986 > 151.101.117.67.443: Flags [.], ack 959392, win 65535, length 0
19:28:03.149626 IP 10.0.2.15.37986 > 151.101.117.67.443: Flags [.], ack 964888, win 65535, length 0
19:28:03.149751 IP 151.101.117.67.443 > 10.0.2.15.37986: Flags [P.], seq 964888:967636, ack 867, win 65535, length 2748
19:28:03.149752 IP 151.101.117.67.443 > 10.0.2.15.37986: Flags [P.], seq 967636:970384, ack 867, win 65535, length 2748
19:28:03.149760 IP 10.0.2.15.37986 > 151.101.117.67.443: Flags [.], ack 967636, win 65535, length 0
19:28:03.149773 IP 10.0.2.15.37986 > 151.101.117.67.443: Flags [.], ack 970384, win 65535, length 0
19:28:03.149875 IP 151.101.117.67.443 > 10.0.2.15.37986: Flags [P.], seq 970384:973132, ack 867, win 65535, length 2748

