13:04:44.470645 IP 10.0.2.15.50712 > 151.101.117.67.443: Flags [P.], seq 4173667900:4173668417, ack 13952002, win 64240, length 517
13:04:44.471224 IP 151.101.117.67.443 > 10.0.2.15.50712: Flags [.], ack 517, win 65535, length 0
13:04:44.490614 IP 151.101.117.67.443 > 10.0.2.15.50712: Flags [.], seq 1:2921, ack 517, win 65535, length 2920
13:04:44.490637 IP 10.0.2.15.50712 > 151.101.117.67.443: Flags [.], ack 2921, win 62780, length 0
13:04:44.490896 IP 151.101.117.67.443 > 10.0.2.15.50712: Flags [P.], seq 2921:4123, ack 517, win 65535, length 1202
13:04:44.490913 IP 10.0.2.15.50712 > 151.101.117.67.443: Flags [.], ack 4123, win 61578, length 0
13:04:44.491313 IP 151.101.117.67.443 > 10.0.2.15.50712: Flags [P.], seq 4123:5064, ack 517, win 65535, length 941
13:04:44.491324 IP 10.0.2.15.50712 > 151.101.117.67.443: Flags [.], ack 5064, win 62780, length 0
13:04:44.492491 IP 10.0.2.15.50712 > 151.101.117.67.443: Flags [P.], seq 517:610, ack 5064, win 62780, length 93
13:04:44.492904 IP 151.101.117.67.443 > 10.0.2.15.50712: Flags [.], ack 610, win 65535, length 0
13:04:44.506603 IP 151.101.117.67.443 > 10.0.2.15.50712: Flags [P.], seq 5064:5115, ack 610, win 65535, length 51
13:04:44.506625 IP 10.0.2.15.50712 > 151.101.117.67.443: Flags [.], ack 5115, win 62780, length 0
13:04:44.507212 IP 10.0.2.15.50712 > 151.101.117.67.443: Flags [P.], seq 610:663, ack 5115, win 62780, length 53
13:04:44.507263 IP 10.0.2.15.50712 > 151.101.117.67.443: Flags [P.], seq 663:719, ack 5115, win 62780, length 56
13:04:44.507456 IP 10.0.2.15.50712 > 151.101.117.67.443: Flags [P.], seq 719:761, ack 5115, win 62780, length 42
13:04:44.507491 IP 10.0.2.15.50712 > 151.101.117.67.443: Flags [P.], seq 761:828, ack 5115, win 62780, length 67
13:04:44.508082 IP 151.101.117.67.443 > 10.0.2.15.50712: Flags [.], ack 663, win 65535, length 0
13:04:44.508086 IP 151.101.117.67.443 > 10.0.2.15.50712: Flags [.], ack 719, win 65535, length 0
13:04:44.508086 IP 151.101.117.67.443 > 10.0.2.15.50712: Flags [.], ack 761, win 65535, length 0
13:04:44.508087 IP 151.101.117.67.443 > 10.0.2.15.50712: Flags [.], ack 828, win 65535, length 0
13:04:44.520903 IP 151.101.117.67.443 > 10.0.2.15.50712: Flags [P.], seq 5115:5210, ack 828, win 65535, length 95
13:04:44.520924 IP 10.0.2.15.50712 > 151.101.117.67.443: Flags [.], ack 5210, win 62780, length 0
13:04:44.521226 IP 10.0.2.15.50712 > 151.101.117.67.443: Flags [P.], seq 828:866, ack 5210, win 62780, length 38
13:04:44.521558 IP 151.101.117.67.443 > 10.0.2.15.50712: Flags [.], ack 866, win 65535, length 0
13:04:44.521877 IP 151.101.117.67.443 > 10.0.2.15.50712: Flags [P.], seq 5210:7958, ack 866, win 65535, length 2748
13:04:44.521890 IP 10.0.2.15.50712 > 151.101.117.67.443: Flags [.], ack 7958, win 62780, length 0
13:04:44.523359 IP 151.101.117.67.443 > 10.0.2.15.50712: Flags [P.], seq 7958:14828, ack 866, win 65535, length 6870
13:04:44.523642 IP 10.0.2.15.50712 > 151.101.117.67.443: Flags [.], ack 14828, win 59860, length 0
13:04:44.524497 IP 151.101.117.67.443 > 10.0.2.15.50712: Flags [P.], seq 14828:17576, ack 866, win 65535, length 2748
13:04:44.524513 IP 10.0.2.15.50712 > 151.101.117.67.443: Flags [.], ack 17576, win 62780, length 0
13:04:44.525438 IP 151.101.117.67.443 > 10.0.2.15.50712: Flags [P.], seq 17576:23072, ack 866, win 65535, length 5496
13:04:44.525504 IP 10.0.2.15.50712 > 151.101.117.67.443: Flags [.], ack 23072, win 61320, length 0
13:04:44.526735 IP 151.101.117.67.443 > 10.0.2.15.50712: Flags [P.], seq 23072:25820, ack 866, win 65535, length 2748
13:04:44.526750 IP 10.0.2.15.50712 > 151.101.117.67.443: Flags [.], ack 25820, win 62780, length 0
13:04:44.527397 IP 151.101.117.67.443 > 10.0.2.15.50712: Flags [P.], seq 25820:32690, ack 866, win 65535, length 6870
13:04:44.527458 IP 10.0.2.15.50712 > 151.101.117.67.443: Flags [.], ack 32690, win 59860, length 0
13:04:44.529000 IP 151.101.117.67.443 > 10.0.2.15.50712: Flags [P.], seq 32690:36812, ack 866, win 65535, length 4122
13:04:44.529020 IP 10.0.2.15.50712 > 151.101.117.67.443: Flags [.], ack 36812, win 61320, length 0
13:04:44.529801 IP 151.101.117.67.443 > 10.0.2.15.50712: Flags [P.], seq 36812:40934, ack 866, win 65535, length 4122
13:04:44.529803 IP 151.101.117.67.443 > 10.0.2.15.50712: Flags [P.], seq 40934:42308, ack 866, win 65535, length 1374
13:04:44.529821 IP 10.0.2.15.50712 > 151.101.117.67.443: Flags [.], ack 40934, win 61320, length 0
13:04:44.530882 IP 151.101.117.67.443 > 10.0.2.15.50712: Flags [P.], seq 42308:45056, ack 866, win 65535, length 2748
13:04:44.530942 IP 10.0.2.15.50712 > 151.101.117.67.443: Flags [.], ack 45056, win 62780, length 0
13:04:44.532125 IP 151.101.117.67.443 > 10.0.2.15.50712: Flags [P.], seq 45056:49178, ack 866, win 65535, length 4122
13:04:44.532199 IP 10.0.2.15.50712 > 151.101.117.67.443: Flags [.], ack 49178, win 61320, length 0
13:04:44.533172 IP 151.101.117.67.443 > 10.0.2.15.50712: Flags [P.], seq 49178:51926, ack 866, win 65535, length 2748
13:04:44.533191 IP 10.0.2.15.50712 > 151.101.117.67.443: Flags [.], ack 51926, win 62780, length 0
13:04:44.534185 IP 151.101.117.67.443 > 10.0.2.15.50712: Flags [P.], seq 51926:57422, ack 866, win 65535, length 5496
13:04:44.534246 IP 10.0.2.15.50712 > 151.101.117.67.443: Flags [.], ack 57422, win 61320, length 0
13:04:44.535089 IP 151.101.117.67.443 > 10.0.2.15.50712: Flags [P.], seq 57422:60170, ack 866, win 65535, length 2748
13:04:44.535102 IP 10.0.2.15.50712 > 151.101.117.67.443: Flags [.], ack 60170, win 62780, length 0
13:04:44.536552 IP 151.101.117.67.443 > 10.0.2.15.50712: Flags [P.], seq 60170:65666, ack 866, win 65535, length 5496
13:04:44.536622 IP 10.0.2.15.50712 > 151.101.117.67.443: Flags [.], ack 65666, win 61320, length 0
13:04:44.538415 IP 151.101.117.67.443 > 10.0.2.15.50712: Flags [P.], seq 65666:71162, ack 866, win 65535, length 5496
13:04:44.538429 IP 10.0.2.15.50712 > 151.101.117.67.443: Flags [.], ack 71162, win 61320, length 0
13:04:44.539680 IP 151.101.117.67.443 > 10.0.2.15.50712: Flags [P.], seq 71162:78032, ack 866, win 65535, length 6870
13:04:44.539695 IP 10.0.2.15.50712 > 151.101.117.67.443: Flags [.], ack 78032, win 65535, length 0
13:04:44.540932 IP 151.101.117.67.443 > 10.0.2.15.50712: Flags [P.], seq 78032:83528, ack 866, win 65535, length 5496
13:04:44.540951 IP 10.0.2.15.50712 > 151.101.117.67.443: Flags [.], ack 83528, win 65535, length 0
13:04:44.541752 IP 151.101.117.67.443 > 10.0.2.15.50712: Flags [P.], seq 83528:87650, ack 866, win 65535, length 4122
13:04:44.541771 IP 10.0.2.15.50712 > 151.101.117.67.443: Flags [.], ack 87650, win 65535, length 0
13:04:44.542924 IP 151.101.117.67.443 > 10.0.2.15.50712: Flags [P.], seq 87650:91772, ack 866, win 65535, length 4122
13:04:44.542940 IP 10.0.2.15.50712 > 151.101.117.67.443: Flags [.], ack 91772, win 65535, length 0
13:04:44.544079 IP 151.101.117.67.443 > 10.0.2.15.50712: Flags [P.], seq 91772:95894, ack 866, win 65535, length 4122
13:04:44.544100 IP 10.0.2.15.50712 > 151.101.117.67.443: Flags [.], ack 95894, win 65535, length 0
13:04:44.545142 IP 151.101.117.67.443 > 10.0.2.15.50712: Flags [P.], seq 95894:105512, ack 866, win 65535, length 9618
13:04:44.545155 IP 10.0.2.15.50712 > 151.101.117.67.443: Flags [.], ack 105512, win 65535, length 0
13:04:44.546071 IP 151.101.117.67.443 > 10.0.2.15.50712: Flags [P.], seq 105512:108260, ack 866, win 65535, length 2748
13:04:44.546085 IP 10.0.2.15.50712 > 151.101.117.67.443: Flags [.], ack 108260, win 65535, length 0
13:04:44.547228 IP 151.101.117.67.443 > 10.0.2.15.50712: Flags [P.], seq 108260:113756, ack 866, win 65535, length 5496
13:04:44.547250 IP 10.0.2.15.50712 > 151.101.117.67.443: Flags [.], ack 113756, win 65535, length 0
13:04:44.548613 IP 151.101.117.67.443 > 10.0.2.15.50712: Flags [P.], seq 113756:119252, ack 866, win 65535, length 5496
13:04:44.548631 IP 10.0.2.15.50712 > 151.101.117.67.443: Flags [.], ack 119252, win 65535, length 0
13:04:44.548749 IP 151.101.117.67.443 > 10.0.2.15.50712: Flags [P.], seq 119252:126122, ack 866, win 65535, length 6870
13:04:44.548757 IP 10.0.2.15.50712 > 151.101.117.67.443: Flags [.], ack 126122, win 65535, length 0
13:04:44.549792 IP 151.101.117.67.443 > 10.0.2.15.50712: Flags [P.], seq 126122:132992, ack 866, win 65535, length 6870
13:04:44.549807 IP 10.0.2.15.50712 > 151.101.117.67.443: Flags [.], ack 132992, win 65535, length 0
13:04:44.550073 IP 151.101.117.67.443 > 10.0.2.15.50712: Flags [P.], seq 132992:139862, ack 866, win 65535, length 6870
13:04:44.550074 IP 151.101.117.67.443 > 10.0.2.15.50712: Flags [.], seq 139862:142782, ack 866, win 65535, length 2920
13:04:44.550085 IP 10.0.2.15.50712 > 151.101.117.67.443: Flags [.], ack 139862, win 65535, length 0
13:04:44.550100 IP 10.0.2.15.50712 > 151.101.117.67.443: Flags [.], ack 142782, win 65535, length 0
13:04:44.550458 IP 151.101.117.67.443 > 10.0.2.15.50712: Flags [P.], seq 142782:143984, ack 866, win 65535, length 1202
13:04:44.552505 IP 151.101.117.67.443 > 10.0.2.15.50712: Flags [P.], seq 143984:150854, ack 866, win 65535, length 6870
13:04:44.552527 IP 10.0.2.15.50712 > 151.101.117.67.443: Flags [.], ack 150854, win 65535, length 0
13:04:44.552738 IP 151.101.117.67.443 > 10.0.2.15.50712: Flags [P.], seq 150854:164594, ack 866, win 65535, length 13740
13:04:44.552747 IP 10.0.2.15.50712 > 151.101.117.67.443: Flags [.], ack 164594, win 65535, length 0
13:04:44.552775 IP 151.101.117.67.443 > 10.0.2.15.50712: Flags [P.], seq 164594:168716, ack 866, win 65535, length 4122
13:04:44.552782 IP 10.0.2.15.50712 > 151.101.117.67.443: Flags [.], ack 168716, win 65535, length 0
13:04:44.554269 IP 151.101.117.67.443 > 10.0.2.15.50712: Flags [P.], seq 168716:176960, ack 866, win 65535, length 8244
13:04:44.554272 IP 151.101.117.67.443 > 10.0.2.15.50712: Flags [P.], seq 176960:182456, ack 866, win 65535, length 5496
13:04:44.554292 IP 10.0.2.15.50712 > 151.101.117.67.443: Flags [.], ack 176960, win 65535, length 0
13:04:44.554325 IP 10.0.2.15.50712 > 151.101.117.67.443: Flags [.], ack 182456, win 65535, length 0
13:04:44.554421 IP 151.101.117.67.443 > 10.0.2.15.50712: Flags [P.], seq 182456:186578, ack 866, win 65535, length 4122
13:04:44.554432 IP 10.0.2.15.50712 > 151.101.117.67.443: Flags [.], ack 186578, win 65535, length 0
13:04:44.554622 IP 151.101.117.67.443 > 10.0.2.15.50712: Flags [P.], seq 186578:190700, ack 866, win 65535, length 4122
13:04:44.554633 IP 10.0.2.15.50712 > 151.101.117.67.443: Flags [.], ack 190700, win 65535, length 0
13:04:44.556280 IP 151.101.117.67.443 > 10.0.2.15.50712: Flags [P.], seq 190700:198944, ack 866, win 65535, length 8244
13:04:44.556297 IP 10.0.2.15.50712 > 151.101.117.67.443: Flags [.], ack 198944, win 65535, length 0
13:04:44.556752 IP 151.101.117.67.443 > 10.0.2.15.50712: Flags [P.], seq 198944:204440, ack 866, win 65535, length 5496
13:04:44.556755 IP 151.101.117.67.443 > 10.0.2.15.50712: Flags [P.], seq 204440:208562, ack 866, win 65535, length 4122
13:04:44.556772 IP 10.0.2.15.50712 > 151.101.117.67.443: Flags [.], ack 204440, win 65535, length 0
13:04:44.556795 IP 10.0.2.15.50712 > 151.101.117.67.443: Flags [.], ack 208562, win 65535, length 0
13:04:44.557563 IP 151.101.117.67.443 > 10.0.2.15.50712: Flags [P.], seq 208562:214058, ack 866, win 65535, length 5496
13:04:44.557580 IP 10.0.2.15.50712 > 151.101.117.67.443: Flags [.], ack 214058, win 65535, length 0
13:04:44.558844 IP 151.101.117.67.443 > 10.0.2.15.50712: Flags [P.], seq 214058:219554, ack 866, win 65535, length 5496
13:04:44.558848 IP 151.101.117.67.443 > 10.0.2.15.50712: Flags [P.], seq 219554:226424, ack 866, win 65535, length 6870
13:04:44.558865 IP 10.0.2.15.50712 > 151.101.117.67.443: Flags [.], ack 219554, win 65535, length 0
13:04:44.558977 IP 10.0.2.15.50712 > 151.101.117.67.443: Flags [.], ack 226424, win 65535, length 0
13:04:44.559494 IP 151.101.117.67.443 > 10.0.2.15.50712: Flags [P.], seq 226424:227798, ack 866, win 65535, length 1374
13:04:44.559496 IP 151.101.117.67.443 > 10.0.2.15.50712: Flags [P.], seq 227798:230546, ack 866, win 65535, length 2748
13:04:44.559512 IP 10.0.2.15.50712 > 151.101.117.67.443: Flags [.], ack 230546, win 65535, length 0
13:04:44.560844 IP 151.101.117.67.443 > 10.0.2.15.50712: Flags [P.], seq 230546:238790, ack 866, win 65535, length 8244
13:04:44.560867 IP 10.0.2.15.50712 > 151.101.117.67.443: Flags [.], ack 238790, win 65535, length 0
13:04:44.561099 IP 151.101.117.67.443 > 10.0.2.15.50712: Flags [P.], seq 238790:244286, ack 866, win 65535, length 5496
13:04:44.561107 IP 151.101.117.67.443 > 10.0.2.15.50712: Flags [P.], seq 244286:251156, ack 866, win 65535, length 6870
13:04:44.561120 IP 10.0.2.15.50712 > 151.101.117.67.443: Flags [.], ack 244286, win 65535, length 0
13:04:44.561136 IP 10.0.2.15.50712 > 151.101.117.67.443: Flags [.], ack 251156, win 65535, length 0
13:04:44.561322 IP 151.101.117.67.443 > 10.0.2.15.50712: Flags [P.], seq 251156:252530, ack 866, win 65535, length 1374
13:04:44.562443 IP 151.101.117.67.443 > 10.0.2.15.50712: Flags [P.], seq 252530:262148, ack 866, win 65535, length 9618
13:04:44.562459 IP 10.0.2.15.50712 > 151.101.117.67.443: Flags [.], ack 262148, win 65535, length 0
13:04:44.562693 IP 151.101.117.67.443 > 10.0.2.15.50712: Flags [P.], seq 262148:267644, ack 866, win 65535, length 5496
13:04:44.562706 IP 10.0.2.15.50712 > 151.101.117.67.443: Flags [.], ack 267644, win 65535, length 0
13:04:44.562832 IP 151.101.117.67.443 > 10.0.2.15.50712: Flags [P.], seq 267644:273140, ack 866, win 65535, length 5496
13:04:44.562897 IP 10.0.2.15.50712 > 151.101.117.67.443: Flags [.], ack 273140, win 65535, length 0
13:04:44.563032 IP 151.101.117.67.443 > 10.0.2.15.50712: Flags [P.], seq 273140:277262, ack 866, win 65535, length 4122
13:04:44.563039 IP 10.0.2.15.50712 > 151.101.117.67.443: Flags [.], ack 277262, win 65535, length 0
13:04:44.564053 IP 151.101.117.67.443 > 10.0.2.15.50712: Flags [P.], seq 277262:284132, ack 866, win 65535, length 6870
13:04:44.564079 IP 10.0.2.15.50712 > 151.101.117.67.443: Flags [.], ack 284132, win 65535, length 0
13:04:44.564581 IP 151.101.117.67.443 > 10.0.2.15.50712: Flags [P.], seq 284132:289628, ack 866, win 65535, length 5496
13:04:44.564584 IP 151.101.117.67.443 > 10.0.2.15.50712: Flags [P.], seq 289628:295124, ack 866, win 65535, length 5496
13:04:44.564703 IP 10.0.2.15.50712 > 151.101.117.67.443: Flags [.], ack 289628, win 65535, length 0
13:04:44.564731 IP 10.0.2.15.50712 > 151.101.117.67.443: Flags [.], ack 295124, win 65535, length 0
13:04:44.564760 IP 151.101.117.67.443 > 10.0.2.15.50712: Flags [P.], seq 295124:297872, ack 866, win 65535, length 2748
13:04:44.564765 IP 10.0.2.15.50712 > 151.101.117.67.443: Flags [.], ack 297872, win 65535, length 0
13:04:44.564904 IP 151.101.117.67.443 > 10.0.2.15.50712: Flags [P.], seq 297872:301994, ack 866, win 65535, length 4122
13:04:44.564913 IP 10.0.2.15.50712 > 151.101.117.67.443: Flags [.], ack 301994, win 65535, length 0
13:04:44.565164 IP 151.101.117.67.443 > 10.0.2.15.50712: Flags [.], seq 301994:306374, ack 866, win 65535, length 4380
13:04:44.565177 IP 10.0.2.15.50712 > 151.101.117.67.443: Flags [.], ack 306374, win 65535, length 0
13:04:44.565295 IP 151.101.117.67.443 > 10.0.2.15.50712: Flags [P.], seq 306374:308864, ack 866, win 65535, length 2490
13:04:44.565302 IP 10.0.2.15.50712 > 151.101.117.67.443: Flags [.], ack 308864, win 65535, length 0
13:04:44.565479 IP 151.101.117.67.443 > 10.0.2.15.50712: Flags [P.], seq 308864:312986, ack 866, win 65535, length 4122
13:04:44.565570 IP 10.0.2.15.50712 > 151.101.117.67.443: Flags [.], ack 312986, win 65535, length 0
13:04:44.565888 IP 151.101.117.67.443 > 10.0.2.15.50712: Flags [P.], seq 312986:321230, ack 866, win 65535, length 8244
13:04:44.565904 IP 10.0.2.15.50712 > 151.101.117.67.443: Flags [.], ack 321230, win 65535, length 0
13:04:44.566143 IP 151.101.117.67.443 > 10.0.2.15.50712: Flags [P.], seq 321230:323978, ack 866, win 65535, length 2748
13:04:44.566151 IP 10.0.2.15.50712 > 151.101.117.67.443: Flags [.], ack 323978, win 65535, length 0
13:04:44.567675 IP 151.101.117.67.443 > 10.0.2.15.50712: Flags [P.], seq 323978:332222, ack 866, win 65535, length 8244
13:04:44.567693 IP 10.0.2.15.50712 > 151.101.117.67.443: Flags [.], ack 332222, win 65535, length 0
13:04:44.567852 IP 151.101.117.67.443 > 10.0.2.15.50712: Flags [P.], seq 332222:337718, ack 866, win 65535, length 5496
13:04:44.567860 IP 10.0.2.15.50712 > 151.101.117.67.443: Flags [.], ack 337718, win 65535, length 0
13:04:44.568120 IP 151.101.117.67.443 > 10.0.2.15.50712: Flags [P.], seq 337718:339092, ack 866, win 65535, length 1374
13:04:44.569787 IP 151.101.117.67.443 > 10.0.2.15.50712: Flags [P.], seq 339092:350084, ack 866, win 65535, length 10992
13:04:44.569863 IP 10.0.2.15.50712 > 151.101.117.67.443: Flags [.], ack 350084, win 65535, length 0
13:04:44.570087 IP 151.101.117.67.443 > 10.0.2.15.50712: Flags [P.], seq 350084:355580, ack 866, win 65535, length 5496
13:04:44.570089 IP 151.101.117.67.443 > 10.0.2.15.50712: Flags [P.], seq 355580:362450, ack 866, win 65535, length 6870
13:04:44.570102 IP 10.0.2.15.50712 > 151.101.117.67.443: Flags [.], ack 355580, win 65535, length 0
13:04:44.570119 IP 10.0.2.15.50712 > 151.101.117.67.443: Flags [.], ack 362450, win 65535, length 0
13:04:44.571157 IP 151.101.117.67.443 > 10.0.2.15.50712: Flags [P.], seq 362450:367946, ack 866, win 65535, length 5496
13:04:44.571171 IP 10.0.2.15.50712 > 151.101.117.67.443: Flags [.], ack 367946, win 65535, length 0
13:04:44.571380 IP 151.101.117.67.443 > 10.0.2.15.50712: Flags [P.], seq 367946:376190, ack 866, win 65535, length 8244
13:04:44.571390 IP 10.0.2.15.50712 > 151.101.117.67.443: Flags [.], ack 376190, win 65535, length 0
13:04:44.571693 IP 151.101.117.67.443 > 10.0.2.15.50712: Flags [P.], seq 376190:380798, ack 866, win 65535, length 4608
13:04:44.571702 IP 10.0.2.15.50712 > 151.101.117.67.443: Flags [.], ack 380798, win 65535, length 0
13:04:44.572269 IP 151.101.117.67.443 > 10.0.2.15.50712: Flags [P.], seq 380798:384920, ack 866, win 65535, length 4122
13:04:44.572279 IP 10.0.2.15.50712 > 151.101.117.67.443: Flags [.], ack 384920, win 65535, length 0
13:04:44.572966 IP 151.101.117.67.443 > 10.0.2.15.50712: Flags [P.], seq 384920:391790, ack 866, win 65535, length 6870
13:04:44.572979 IP 10.0.2.15.50712 > 151.101.117.67.443: Flags [.], ack 391790, win 65535, length 0
13:04:44.573115 IP 151.101.117.67.443 > 10.0.2.15.50712: Flags [P.], seq 391790:397286, ack 866, win 65535, length 5496
13:04:44.573125 IP 10.0.2.15.50712 > 151.101.117.67.443: Flags [.], ack 397286, win 65535, length 0
13:04:44.573406 IP 151.101.117.67.443 > 10.0.2.15.50712: Flags [P.], seq 397286:403670, ack 866, win 65535, length 6384
13:04:44.573463 IP 10.0.2.15.50712 > 151.101.117.67.443: Flags [.], ack 403670, win 65535, length 0
13:04:44.574692 IP 151.101.117.67.443 > 10.0.2.15.50712: Flags [P.], seq 403670:406418, ack 866, win 65535, length 2748
13:04:44.574708 IP 10.0.2.15.50712 > 151.101.117.67.443: Flags [.], ack 406418, win 65535, length 0
13:04:44.575675 IP 151.101.117.67.443 > 10.0.2.15.50712: Flags [P.], seq 406418:419270, ack 866, win 65535, length 12852
13:04:44.575702 IP 10.0.2.15.50712 > 151.101.117.67.443: Flags [.], ack 419270, win 65535, length 0
13:04:44.575760 IP 151.101.117.67.443 > 10.0.2.15.50712: Flags [P.], seq 419270:424766, ack 866, win 65535, length 5496
13:04:44.575768 IP 10.0.2.15.50712 > 151.101.117.67.443: Flags [.], ack 424766, win 65535, length 0
13:04:44.575974 IP 151.101.117.67.443 > 10.0.2.15.50712: Flags [P.], seq 424766:435758, ack 866, win 65535, length 10992
13:04:44.575988 IP 10.0.2.15.50712 > 151.101.117.67.443: Flags [.], ack 435758, win 65535, length 0
13:04:44.576187 IP 151.101.117.67.443 > 10.0.2.15.50712: Flags [P.], seq 435758:437132, ack 866, win 65535, length 1374
13:04:44.576386 IP 151.101.117.67.443 > 10.0.2.15.50712: Flags [P.], seq 437132:441254, ack 866, win 65535, length 4122
13:04:44.576396 IP 10.0.2.15.50712 > 151.101.117.67.443: Flags [.], ack 441254, win 65535, length 0
13:04:44.577245 IP 151.101.117.67.443 > 10.0.2.15.50712: Flags [P.], seq 441254:449498, ack 866, win 65535, length 8244
13:04:44.577260 IP 10.0.2.15.50712 > 151.101.117.67.443: Flags [.], ack 449498, win 65535, length 0
13:04:44.577562 IP 151.101.117.67.443 > 10.0.2.15.50712: Flags [P.], seq 449498:454994, ack 866, win 65535, length 5496
13:04:44.577564 IP 151.101.117.67.443 > 10.0.2.15.50712: Flags [P.], seq 454994:459116, ack 866, win 65535, length 4122
13:04:44.577579 IP 10.0.2.15.50712 > 151.101.117.67.443: Flags [.], ack 454994, win 65535, length 0
13:04:44.577598 IP 10.0.2.15.50712 > 151.101.117.67.443: Flags [.], ack 459116, win 65535, length 0
13:04:44.577991 IP 151.101.117.67.443 > 10.0.2.15.50712: Flags [P.], seq 459116:464612, ack 866, win 65535, length 5496
13:04:44.578003 IP 10.0.2.15.50712 > 151.101.117.67.443: Flags [.], ack 464612, win 65535, length 0
13:04:44.580576 IP 151.101.117.67.443 > 10.0.2.15.50712: Flags [P.], seq 464612:469622, ack 866, win 65535, length 5010
13:04:44.580580 IP 151.101.117.67.443 > 10.0.2.15.50712: Flags [P.], seq 469622:475118, ack 866, win 65535, length 5496
13:04:44.580599 IP 10.0.2.15.50712 > 151.101.117.67.443: Flags [.], ack 469622, win 65535, length 0
13:04:44.580707 IP 10.0.2.15.50712 > 151.101.117.67.443: Flags [.], ack 475118, win 65535, length 0
13:04:44.580779 IP 151.101.117.67.443 > 10.0.2.15.50712: Flags [P.], seq 475118:481988, ack 866, win 65535, length 6870
13:04:44.580780 IP 151.101.117.67.443 > 10.0.2.15.50712: Flags [P.], seq 481988:484736, ack 866, win 65535, length 2748
13:04:44.580789 IP 10.0.2.15.50712 > 151.101.117.67.443: Flags [.], ack 481988, win 65535, length 0
13:04:44.580804 IP 10.0.2.15.50712 > 151.101.117.67.443: Flags [.], ack 484736, win 65535, length 0
13:04:44.581047 IP 151.101.117.67.443 > 10.0.2.15.50712: Flags [P.], seq 484736:487484, ack 866, win 65535, length 2748
13:04:44.581062 IP 10.0.2.15.50712 > 151.101.117.67.443: Flags [.], ack 487484, win 65535, length 0
13:04:44.582007 IP 151.101.117.67.443 > 10.0.2.15.50712: Flags [P.], seq 487484:495728, ack 866, win 65535, length 8244
13:04:44.582011 IP 151.101.117.67.443 > 10.0.2.15.50712: Flags [P.], seq 495728:498476, ack 866, win 65535, length 2748
13:04:44.582063 IP 10.0.2.15.50712 > 151.101.117.67.443: Flags [.], ack 495728, win 65535, length 0
13:04:44.582097 IP 10.0.2.15.50712 > 151.101.117.67.443: Flags [.], ack 498476, win 65535, length 0
13:04:44.582564 IP 151.101.117.67.443 > 10.0.2.15.50712: Flags [P.], seq 498476:506720, ack 866, win 65535, length 8244
13:04:44.582566 IP 151.101.117.67.443 > 10.0.2.15.50712: Flags [P.], seq 506720:512216, ack 866, win 65535, length 5496
13:04:44.582579 IP 10.0.2.15.50712 > 151.101.117.67.443: Flags [.], ack 506720, win 65535, length 0
13:04:44.582602 IP 10.0.2.15.50712 > 151.101.117.67.443: Flags [.], ack 512216, win 65535, length 0
13:04:44.582764 IP 151.101.117.67.443 > 10.0.2.15.50712: Flags [P.], seq 512216:517712, ack 866, win 65535, length 5496
13:04:44.582772 IP 10.0.2.15.50712 > 151.101.117.67.443: Flags [.], ack 517712, win 65535, length 0
13:04:44.582948 IP 151.101.117.67.443 > 10.0.2.15.50712: Flags [P.], seq 517712:520460, ack 866, win 65535, length 2748
13:04:44.582954 IP 10.0.2.15.50712 > 151.101.117.67.443: Flags [.], ack 520460, win 65535, length 0
13:04:44.583147 IP 151.101.117.67.443 > 10.0.2.15.50712: Flags [P.], seq 520460:527330, ack 866, win 65535, length 6870
13:04:44.583155 IP 10.0.2.15.50712 > 151.101.117.67.443: Flags [.], ack 527330, win 65535, length 0
13:04:44.584166 IP 151.101.117.67.443 > 10.0.2.15.50712: Flags [P.], seq 527330:536948, ack 866, win 65535, length 9618
13:04:44.584305 IP 10.0.2.15.50712 > 151.101.117.67.443: Flags [.], ack 536948, win 65535, length 0
13:04:44.584485 IP 151.101.117.67.443 > 10.0.2.15.50712: Flags [P.], seq 536948:543818, ack 866, win 65535, length 6870
13:04:44.584548 IP 10.0.2.15.50712 > 151.101.117.67.443: Flags [.], ack 543818, win 65535, length 0
13:04:44.584754 IP 151.101.117.67.443 > 10.0.2.15.50712: Flags [P.], seq 543818:550688, ack 866, win 65535, length 6870
13:04:44.584763 IP 10.0.2.15.50712 > 151.101.117.67.443: Flags [.], ack 550688, win 65535, length 0
13:04:44.584869 IP 151.101.117.67.443 > 10.0.2.15.50712: Flags [P.], seq 550688:556184, ack 866, win 65535, length 5496
13:04:44.584877 IP 10.0.2.15.50712 > 151.101.117.67.443: Flags [.], ack 556184, win 65535, length 0
13:04:44.585301 IP 151.101.117.67.443 > 10.0.2.15.50712: Flags [P.], seq 556184:560306, ack 866, win 65535, length 4122
13:04:44.585303 IP 151.101.117.67.443 > 10.0.2.15.50712: Flags [P.], seq 560306:563054, ack 866, win 65535, length 2748
13:04:44.585320 IP 10.0.2.15.50712 > 151.101.117.67.443: Flags [.], ack 560306, win 65535, length 0
13:04:44.585339 IP 10.0.2.15.50712 > 151.101.117.67.443: Flags [.], ack 563054, win 65535, length 0
13:04:44.585499 IP 151.101.117.67.443 > 10.0.2.15.50712: Flags [P.], seq 563054:565802, ack 866, win 65535, length 2748
13:04:44.585510 IP 10.0.2.15.50712 > 151.101.117.67.443: Flags [.], ack 565802, win 65535, length 0
13:04:44.585768 IP 151.101.117.67.443 > 10.0.2.15.50712: Flags [P.], seq 565802:567176, ack 866, win 65535, length 1374
13:04:44.586395 IP 151.101.117.67.443 > 10.0.2.15.50712: Flags [P.], seq 567176:574046, ack 866, win 65535, length 6870
13:04:44.586466 IP 10.0.2.15.50712 > 151.101.117.67.443: Flags [.], ack 574046, win 65535, length 0
13:04:44.586794 IP 151.101.117.67.443 > 10.0.2.15.50712: Flags [P.], seq 574046:578168, ack 866, win 65535, length 4122
13:04:44.586796 IP 151.101.117.67.443 > 10.0.2.15.50712: Flags [P.], seq 578168:583664, ack 866, win 65535, length 5496
13:04:44.586796 IP 151.101.117.67.443 > 10.0.2.15.50712: Flags [.], seq 583664:585124, ack 866, win 65535, length 1460
13:04:44.586812 IP 10.0.2.15.50712 > 151.101.117.67.443: Flags [.], ack 578168, win 65535, length 0
13:04:44.586830 IP 10.0.2.15.50712 > 151.101.117.67.443: Flags [.], ack 583664, win 65535, length 0
13:04:44.587002 IP 151.101.117.67.443 > 10.0.2.15.50712: Flags [P.], seq 585124:589160, ack 866, win 65535, length 4036
13:04:44.587045 IP 10.0.2.15.50712 > 151.101.117.67.443: Flags [.], ack 589160, win 65535, length 0
13:04:44.587506 IP 151.101.117.67.443 > 10.0.2.15.50712: Flags [P.], seq 589160:594656, ack 866, win 65535, length 5496
13:04:44.587508 IP 151.101.117.67.443 > 10.0.2.15.50712: Flags [P.], seq 594656:601526, ack 866, win 65535, length 6870
13:04:44.587579 IP 10.0.2.15.50712 > 151.101.117.67.443: Flags [.], ack 594656, win 65535, length 0
13:04:44.587761 IP 10.0.2.15.50712 > 151.101.117.67.443: Flags [.], ack 601526, win 65535, length 0
13:04:44.587801 IP 151.101.117.67.443 > 10.0.2.15.50712: Flags [P.], seq 601526:605648, ack 866, win 65535, length 4122
13:04:44.587810 IP 10.0.2.15.50712 > 151.101.117.67.443: Flags [.], ack 605648, win 65535, length 0
13:04:44.590614 IP 151.101.117.67.443 > 10.0.2.15.50712: Flags [.], seq 605648:642148, ack 866, win 65535, length 36500
13:04:44.590636 IP 10.0.2.15.50712 > 151.101.117.67.443: Flags [.], ack 642148, win 65535, length 0
13:04:44.590799 IP 151.101.117.67.443 > 10.0.2.15.50712: Flags [P.], seq 642148:652364, ack 866, win 65535, length 10216
13:04:44.590822 IP 10.0.2.15.50712 > 151.101.117.67.443: Flags [.], ack 652364, win 65535, length 0
13:04:44.591130 IP 151.101.117.67.443 > 10.0.2.15.50712: Flags [P.], seq 652364:667478, ack 866, win 65535, length 15114
13:04:44.591141 IP 10.0.2.15.50712 > 151.101.117.67.443: Flags [.], ack 667478, win 65535, length 0
13:04:44.591487 IP 151.101.117.67.443 > 10.0.2.15.50712: Flags [P.], seq 667478:671600, ack 866, win 65535, length 4122
13:04:44.591489 IP 151.101.117.67.443 > 10.0.2.15.50712: Flags [.], seq 671600:673060, ack 866, win 65535, length 1460
13:04:44.591618 IP 10.0.2.15.50712 > 151.101.117.67.443: Flags [.], ack 671600, win 65535, length 0
13:04:44.591791 IP 151.101.117.67.443 > 10.0.2.15.50712: Flags [P.], seq 673060:677096, ack 866, win 65535, length 4036
13:04:44.591793 IP 151.101.117.67.443 > 10.0.2.15.50712: Flags [P.], seq 677096:683966, ack 866, win 65535, length 6870
13:04:44.591802 IP 10.0.2.15.50712 > 151.101.117.67.443: Flags [.], ack 677096, win 65535, length 0
13:04:44.591817 IP 10.0.2.15.50712 > 151.101.117.67.443: Flags [.], ack 683966, win 65535, length 0
13:04:44.592055 IP 151.101.117.67.443 > 10.0.2.15.50712: Flags [P.], seq 683966:686714, ack 866, win 65535, length 2748
13:04:44.592063 IP 10.0.2.15.50712 > 151.101.117.67.443: Flags [.], ack 686714, win 65535, length 0
13:04:44.592222 IP 151.101.117.67.443 > 10.0.2.15.50712: Flags [P.], seq 686714:692210, ack 866, win 65535, length 5496
13:04:44.592285 IP 10.0.2.15.50712 > 151.101.117.67.443: Flags [.], ack 692210, win 65535, length 0
13:04:44.592560 IP 151.101.117.67.443 > 10.0.2.15.50712: Flags [P.], seq 692210:693584, ack 866, win 65535, length 1374
13:04:44.593207 IP 151.101.117.67.443 > 10.0.2.15.50712: Flags [P.], seq 693584:700454, ack 866, win 65535, length 6870
13:04:44.593221 IP 10.0.2.15.50712 > 151.101.117.67.443: Flags [.], ack 700454, win 65535, length 0
13:04:44.593747 IP 151.101.117.67.443 > 10.0.2.15.50712: Flags [P.], seq 700454:705950, ack 866, win 65535, length 5496
13:04:44.593750 IP 151.101.117.67.443 > 10.0.2.15.50712: Flags [P.], seq 705950:715568, ack 866, win 65535, length 9618
13:04:44.593926 IP 10.0.2.15.50712 > 151.101.117.67.443: Flags [.], ack 715568, win 65535, length 0
13:04:44.595038 IP 151.101.117.67.443 > 10.0.2.15.50712: Flags [P.], seq 715568:721064, ack 866, win 65535, length 5496
13:04:44.595041 IP 151.101.117.67.443 > 10.0.2.15.50712: Flags [P.], seq 721064:727934, ack 866, win 65535, length 6870
13:04:44.595088 IP 151.101.117.67.443 > 10.0.2.15.50712: Flags [P.], seq 727934:730682, ack 866, win 65535, length 2748
13:04:44.595090 IP 151.101.117.67.443 > 10.0.2.15.50712: Flags [P.], seq 730682:737552, ack 866, win 65535, length 6870
13:04:44.595103 IP 151.101.117.67.443 > 10.0.2.15.50712: Flags [P.], seq 737552:744422, ack 866, win 65535, length 6870
13:04:44.595124 IP 151.101.117.67.443 > 10.0.2.15.50712: Flags [P.], seq 744422:745796, ack 866, win 65535, length 1374
13:04:44.595503 IP 151.101.117.67.443 > 10.0.2.15.50712: Flags [P.], seq 745796:751292, ack 866, win 65535, length 5496
13:04:44.596843 IP 10.0.2.15.50712 > 151.101.117.67.443: Flags [.], ack 751292, win 65535, length 0
13:04:44.597666 IP 151.101.117.67.443 > 10.0.2.15.50712: Flags [P.], seq 751292:781520, ack 866, win 65535, length 30228
13:04:44.597687 IP 10.0.2.15.50712 > 151.101.117.67.443: Flags [.], ack 781520, win 65535, length 0
13:04:44.597733 IP 151.101.117.67.443 > 10.0.2.15.50712: Flags [P.], seq 781520:785642, ack 866, win 65535, length 4122
13:04:44.599398 IP 151.101.117.67.443 > 10.0.2.15.50712: Flags [P.], seq 785642:802130, ack 866, win 65535, length 16488
13:04:44.599577 IP 151.101.117.67.443 > 10.0.2.15.50712: Flags [P.], seq 802130:807626, ack 866, win 65535, length 5496
13:04:44.599579 IP 151.101.117.67.443 > 10.0.2.15.50712: Flags [P.], seq 807626:811748, ack 866, win 65535, length 4122
13:04:44.599580 IP 151.101.117.67.443 > 10.0.2.15.50712: Flags [P.], seq 811748:815870, ack 866, win 65535, length 4122
13:04:44.599778 IP 10.0.2.15.50712 > 151.101.117.67.443: Flags [.], ack 815870, win 65535, length 0
13:04:44.602064 IP 151.101.117.67.443 > 10.0.2.15.50712: Flags [P.], seq 815870:848846, ack 866, win 65535, length 32976
13:04:44.602080 IP 10.0.2.15.50712 > 151.101.117.67.443: Flags [.], ack 848846, win 65535, length 0
13:04:44.602646 IP 151.101.117.67.443 > 10.0.2.15.50712: Flags [P.], seq 848846:881822, ack 866, win 65535, length 32976
13:04:44.602661 IP 10.0.2.15.50712 > 151.101.117.67.443: Flags [.], ack 881822, win 65535, length 0
13:04:44.602916 IP 151.101.117.67.443 > 10.0.2.15.50712: Flags [P.], seq 881822:883196, ack 866, win 65535, length 1374
13:04:44.604133 IP 151.101.117.67.443 > 10.0.2.15.50712: Flags [P.], seq 883196:887318, ack 866, win 65535, length 4122
13:04:44.604149 IP 10.0.2.15.50712 > 151.101.117.67.443: Flags [.], ack 887318, win 65535, length 0
13:04:44.604383 IP 151.101.117.67.443 > 10.0.2.15.50712: Flags [P.], seq 887318:894188, ack 866, win 65535, length 6870
13:04:44.604385 IP 151.101.117.67.443 > 10.0.2.15.50712: Flags [P.], seq 894188:898310, ack 866, win 65535, length 4122
13:04:44.604515 IP 10.0.2.15.50712 > 151.101.117.67.443: Flags [.], ack 898310, win 65535, length 0
13:04:44.605251 IP 151.101.117.67.443 > 10.0.2.15.50712: Flags [P.], seq 898310:903806, ack 866, win 65535, length 5496
13:04:44.605254 IP 151.101.117.67.443 > 10.0.2.15.50712: Flags [.], seq 903806:911106, ack 866, win 65535, length 7300
13:04:44.605365 IP 10.0.2.15.50712 > 151.101.117.67.443: Flags [.], ack 903806, win 65535, length 0
13:04:44.605620 IP 10.0.2.15.50712 > 151.101.117.67.443: Flags [.], ack 911106, win 65535, length 0
13:04:44.606085 IP 151.101.117.67.443 > 10.0.2.15.50712: Flags [P.], seq 911106:912050, ack 866, win 65535, length 944
13:04:44.606092 IP 151.101.117.67.443 > 10.0.2.15.50712: Flags [P.], seq 912050:918920, ack 866, win 65535, length 6870
13:04:44.606094 IP 151.101.117.67.443 > 10.0.2.15.50712: Flags [P.], seq 918920:923042, ack 866, win 65535, length 4122
13:04:44.606124 IP 10.0.2.15.50712 > 151.101.117.67.443: Flags [.], ack 918920, win 65535, length 0
13:04:44.606271 IP 151.101.117.67.443 > 10.0.2.15.50712: Flags [P.], seq 923042:931286, ack 866, win 65535, length 8244
13:04:44.606273 IP 151.101.117.67.443 > 10.0.2.15.50712: Flags [P.], seq 931286:936782, ack 866, win 65535, length 5496
13:04:44.606329 IP 10.0.2.15.50712 > 151.101.117.67.443: Flags [.], ack 936782, win 65535, length 0
13:04:44.607149 IP 151.101.117.67.443 > 10.0.2.15.50712: Flags [P.], seq 936782:943652, ack 866, win 65535, length 6870
13:04:44.607152 IP 151.101.117.67.443 > 10.0.2.15.50712: Flags [P.], seq 943652:951896, ack 866, win 65535, length 8244
13:04:44.607181 IP 151.101.117.67.443 > 10.0.2.15.50712: Flags [P.], seq 951896:957392, ack 866, win 65535, length 5496
13:04:44.607421 IP 151.101.117.67.443 > 10.0.2.15.50712: Flags [P.], seq 957392:967010, ack 866, win 65535, length 9618
13:04:44.607512 IP 10.0.2.15.50712 > 151.101.117.67.443: Flags [.], ack 967010, win 65535, length 0
13:04:44.607712 IP 151.101.117.67.443 > 10.0.2.15.50712: Flags [P.], seq 967010:969758, ack 866, win 65535, length 2748
13:04:44.607721 IP 10.0.2.15.50712 > 151.101.117.67.443: Flags [.], ack 969758, win 65535, length 0
13:04:44.607980 IP 151.101.117.67.443 > 10.0.2.15.50712: Flags [P.], seq 969758:971132, ack 866, win 65535, length 1374
13:04:44.608596 IP 151.101.117.67.443 > 10.0.2.15.50712: Flags [P.], seq 971132:975254, ack 866, win 65535, length 4122
13:04:44.608611 IP 10.0.2.15.50712 > 151.101.117.67.443: Flags [.], ack 975254, win 65535, length 0
13:04:44.608890 IP 151.101.117.67.443 > 10.0.2.15.50712: Flags [P.], seq 975254:982124, ack 866, win 65535, length 6870
13:04:44.608893 IP 151.101.117.67.443 > 10.0.2.15.50712: Flags [P.], seq 982124:987620, ack 866, win 65535, length 5496
13:04:44.608976 IP 10.0.2.15.50712 > 151.101.117.67.443: Flags [.], ack 987620, win 65535, length 0
13:04:44.609275 IP 151.101.117.67.443 > 10.0.2.15.50712: Flags [P.], seq 987620:991742, ack 866, win 65535, length 4122
13:04:44.609377 IP 10.0.2.15.50712 > 151.101.117.67.443: Flags [.], ack 991742, win 65535, length 0

