21:53:02.277988 IP 10.0.2.15.33300 > 140.233.253.2.53: 43759+ A? www.usps.com. (30)
21:53:02.278024 IP 10.0.2.15.33300 > 140.233.253.2.53: 51179+ AAAA? www.usps.com. (30)
21:53:02.284043 IP 140.233.253.2.53 > 10.0.2.15.33300: 43759 2/0/0 CNAME cs1799.wpc.upsiloncdn.net., A 152.195.33.23 (85)
21:53:02.284045 IP 140.233.253.2.53 > 10.0.2.15.33300: 51179 2/0/0 CNAME cs1799.wpc.upsiloncdn.net., AAAA 2606:2800:21f:3e9e:5a:9b8f:bddb:fb7c (97)
21:53:02.284411 IP 10.0.2.15.52944 > 152.195.33.23.443: Flags [S], seq 1445877798, win 64240, options [mss 1460,sackOK,TS val 3501353313 ecr 0,nop,wscale 6], length 0
21:53:02.299498 IP 152.195.33.23.443 > 10.0.2.15.52944: Flags [S.], seq 277376001, ack 1445877799, win 65535, options [mss 1460], length 0
21:53:02.299543 IP 10.0.2.15.52944 > 152.195.33.23.443: Flags [.], ack 1, win 64240, length 0
21:53:02.315688 IP 10.0.2.15.52944 > 152.195.33.23.443: Flags [P.], seq 1:518, ack 1, win 64240, length 517
21:53:02.316204 IP 152.195.33.23.443 > 10.0.2.15.52944: Flags [.], ack 518, win 65535, length 0
21:53:02.329728 IP 152.195.33.23.443 > 10.0.2.15.52944: Flags [P.], seq 1:100, ack 518, win 65535, length 99
21:53:02.329757 IP 10.0.2.15.52944 > 152.195.33.23.443: Flags [.], ack 100, win 64141, length 0
21:53:02.330366 IP 10.0.2.15.52944 > 152.195.33.23.443: Flags [P.], seq 518:1041, ack 100, win 64141, length 523
21:53:02.330807 IP 152.195.33.23.443 > 10.0.2.15.52944: Flags [.], ack 1041, win 65535, length 0
21:53:02.345796 IP 152.195.33.23.443 > 10.0.2.15.52944: Flags [.], seq 100:4480, ack 1041, win 65535, length 4380
21:53:02.345841 IP 10.0.2.15.52944 > 152.195.33.23.443: Flags [.], ack 4480, win 61320, length 0
21:53:02.346388 IP 152.195.33.23.443 > 10.0.2.15.52944: Flags [P.], seq 4480:4541, ack 1041, win 65535, length 61
21:53:02.346408 IP 10.0.2.15.52944 > 152.195.33.23.443: Flags [.], ack 4541, win 61320, length 0
21:53:02.360360 IP 10.0.2.15.52944 > 152.195.33.23.443: Flags [P.], seq 1041:1115, ack 4541, win 62780, length 74
21:53:02.360793 IP 152.195.33.23.443 > 10.0.2.15.52944: Flags [.], ack 1115, win 65535, length 0
21:53:02.361182 IP 10.0.2.15.52944 > 152.195.33.23.443: Flags [P.], seq 1115:1161, ack 4541, win 62780, length 46
21:53:02.361230 IP 10.0.2.15.52944 > 152.195.33.23.443: Flags [P.], seq 1161:1210, ack 4541, win 62780, length 49
21:53:02.361674 IP 152.195.33.23.443 > 10.0.2.15.52944: Flags [.], ack 1161, win 65535, length 0
21:53:02.361675 IP 152.195.33.23.443 > 10.0.2.15.52944: Flags [.], ack 1210, win 65535, length 0
21:53:02.361968 IP 10.0.2.15.52944 > 152.195.33.23.443: Flags [P.], seq 1210:1305, ack 4541, win 62780, length 95

