21:53:40.584921 IP 10.0.2.15.54992 > 140.233.253.2.53: 18005+ A? www.usps.com. (30)
21:53:40.584961 IP 10.0.2.15.54992 > 140.233.253.2.53: 60763+ AAAA? www.usps.com. (30)
21:53:40.590367 IP 140.233.253.2.53 > 10.0.2.15.54992: 60763 2/0/0 CNAME cs1799.wpc.upsiloncdn.net., AAAA 2606:2800:21f:3e9e:5a:9b8f:bddb:fb7c (97)
21:53:40.604103 IP 140.233.253.2.53 > 10.0.2.15.54992: 18005 2/0/0 CNAME cs1799.wpc.upsiloncdn.net., A 152.195.33.23 (85)
21:53:40.604584 IP 10.0.2.15.52958 > 152.195.33.23.443: Flags [S], seq 2563403097, win 64240, options [mss 1460,sackOK,TS val 3501391633 ecr 0,nop,wscale 6], length 0
21:53:40.617961 IP 152.195.33.23.443 > 10.0.2.15.52958: Flags [S.], seq 278272001, ack 2563403098, win 65535, options [mss 1460], length 0
21:53:40.618008 IP 10.0.2.15.52958 > 152.195.33.23.443: Flags [.], ack 1, win 64240, length 0
21:53:40.626374 IP 10.0.2.15.52958 > 152.195.33.23.443: Flags [P.], seq 1:518, ack 1, win 64240, length 517
21:53:40.626669 IP 152.195.33.23.443 > 10.0.2.15.52958: Flags [.], ack 518, win 65535, length 0
21:53:40.639980 IP 152.195.33.23.443 > 10.0.2.15.52958: Flags [P.], seq 1:100, ack 518, win 65535, length 99
21:53:40.640002 IP 10.0.2.15.52958 > 152.195.33.23.443: Flags [.], ack 100, win 64141, length 0
21:53:40.640493 IP 10.0.2.15.52958 > 152.195.33.23.443: Flags [P.], seq 518:1041, ack 100, win 64141, length 523
21:53:40.640848 IP 152.195.33.23.443 > 10.0.2.15.52958: Flags [.], ack 1041, win 65535, length 0
21:53:40.655037 IP 152.195.33.23.443 > 10.0.2.15.52958: Flags [P.], seq 100:4196, ack 1041, win 65535, length 4096
21:53:40.655074 IP 10.0.2.15.52958 > 152.195.33.23.443: Flags [.], ack 4196, win 61320, length 0
21:53:40.656815 IP 152.195.33.23.443 > 10.0.2.15.52958: Flags [P.], seq 4196:4541, ack 1041, win 65535, length 345
21:53:40.656835 IP 10.0.2.15.52958 > 152.195.33.23.443: Flags [.], ack 4541, win 61320, length 0
21:53:40.657465 IP 10.0.2.15.52958 > 152.195.33.23.443: Flags [P.], seq 1041:1115, ack 4541, win 62780, length 74
21:53:40.657880 IP 152.195.33.23.443 > 10.0.2.15.52958: Flags [.], ack 1115, win 65535, length 0
21:53:40.657985 IP 10.0.2.15.52958 > 152.195.33.23.443: Flags [P.], seq 1115:1161, ack 4541, win 62780, length 46
21:53:40.658016 IP 10.0.2.15.52958 > 152.195.33.23.443: Flags [P.], seq 1161:1210, ack 4541, win 62780, length 49
21:53:40.658182 IP 10.0.2.15.52958 > 152.195.33.23.443: Flags [P.], seq 1210:1245, ack 4541, win 62780, length 35
21:53:40.658329 IP 152.195.33.23.443 > 10.0.2.15.52958: Flags [.], ack 1161, win 65535, length 0
21:53:40.658331 IP 152.195.33.23.443 > 10.0.2.15.52958: Flags [.], ack 1210, win 65535, length 0
21:53:40.658364 IP 10.0.2.15.52958 > 152.195.33.23.443: Flags [P.], seq 1245:1305, ack 4541, win 62780, length 60
21:53:40.658558 IP 152.195.33.23.443 > 10.0.2.15.52958: Flags [.], ack 1245, win 65535, length 0
21:53:40.658559 IP 152.195.33.23.443 > 10.0.2.15.52958: Flags [.], ack 1305, win 65535, length 0
21:53:40.669879 IP 152.195.33.23.443 > 10.0.2.15.52958: Flags [P.], seq 4541:5147, ack 1305, win 65535, length 606
21:53:40.669901 IP 10.0.2.15.52958 > 152.195.33.23.443: Flags [.], ack 5147, win 62780, length 0
21:53:40.670506 IP 10.0.2.15.52958 > 152.195.33.23.443: Flags [P.], seq 1305:1336, ack 5147, win 62780, length 31
21:53:40.671089 IP 152.195.33.23.443 > 10.0.2.15.52958: Flags [P.], seq 5147:5178, ack 1305, win 65535, length 31
21:53:40.671091 IP 152.195.33.23.443 > 10.0.2.15.52958: Flags [.], ack 1336, win 65535, length 0
21:53:40.672165 IP 152.195.33.23.443 > 10.0.2.15.52958: Flags [P.], seq 5178:5385, ack 1336, win 65535, length 207
21:53:40.672357 IP 10.0.2.15.52958 > 152.195.33.23.443: Flags [.], ack 5385, win 62780, length 0
21:53:40.672891 IP 10.0.2.15.52958 > 152.195.33.23.443: Flags [P.], seq 1336:1360, ack 5385, win 62780, length 24
21:53:40.673297 IP 152.195.33.23.443 > 10.0.2.15.52958: Flags [.], ack 1360, win 65535, length 0
21:53:40.674104 IP 10.0.2.15.52958 > 152.195.33.23.443: Flags [F.], seq 1360, ack 5385, win 62780, length 0
21:53:40.674504 IP 152.195.33.23.443 > 10.0.2.15.52958: Flags [.], ack 1361, win 65535, length 0

