21:56:09.263455 IP 10.0.2.15.60169 > 140.233.253.2.53: 5428+ A? www.usps.com. (30)
21:56:09.263500 IP 10.0.2.15.60169 > 140.233.253.2.53: 40240+ AAAA? www.usps.com. (30)
21:56:09.269476 IP 140.233.253.2.53 > 10.0.2.15.60169: 5428 2/0/0 CNAME cs1799.wpc.upsiloncdn.net., A 152.195.33.23 (85)
21:56:09.269478 IP 140.233.253.2.53 > 10.0.2.15.60169: 40240 2/0/0 CNAME cs1799.wpc.upsiloncdn.net., AAAA 2606:2800:21f:3e9e:5a:9b8f:bddb:fb7c (97)
21:56:09.270004 IP 10.0.2.15.53014 > 152.195.33.23.443: Flags [S], seq 3480603879, win 64240, options [mss 1460,sackOK,TS val 3501540299 ecr 0,nop,wscale 6], length 0
21:56:09.282899 IP 152.195.33.23.443 > 10.0.2.15.53014: Flags [S.], seq 281728001, ack 3480603880, win 65535, options [mss 1460], length 0
21:56:09.282956 IP 10.0.2.15.53014 > 152.195.33.23.443: Flags [.], ack 1, win 64240, length 0
21:56:09.294769 IP 10.0.2.15.53014 > 152.195.33.23.443: Flags [P.], seq 1:518, ack 1, win 64240, length 517
21:56:09.295536 IP 152.195.33.23.443 > 10.0.2.15.53014: Flags [.], ack 518, win 65535, length 0
21:56:09.311032 IP 152.195.33.23.443 > 10.0.2.15.53014: Flags [P.], seq 1:100, ack 518, win 65535, length 99
21:56:09.311059 IP 10.0.2.15.53014 > 152.195.33.23.443: Flags [.], ack 100, win 64141, length 0
21:56:09.312454 IP 10.0.2.15.53014 > 152.195.33.23.443: Flags [P.], seq 518:1041, ack 100, win 64141, length 523
21:56:09.313765 IP 152.195.33.23.443 > 10.0.2.15.53014: Flags [.], ack 1041, win 65535, length 0
21:56:09.328402 IP 152.195.33.23.443 > 10.0.2.15.53014: Flags [P.], seq 100:4196, ack 1041, win 65535, length 4096
21:56:09.328518 IP 10.0.2.15.53014 > 152.195.33.23.443: Flags [.], ack 4196, win 61320, length 0
21:56:09.330378 IP 152.195.33.23.443 > 10.0.2.15.53014: Flags [P.], seq 4196:4541, ack 1041, win 65535, length 345
21:56:09.330409 IP 10.0.2.15.53014 > 152.195.33.23.443: Flags [.], ack 4541, win 61320, length 0
21:56:09.331227 IP 10.0.2.15.53014 > 152.195.33.23.443: Flags [P.], seq 1041:1115, ack 4541, win 62780, length 74
21:56:09.331823 IP 152.195.33.23.443 > 10.0.2.15.53014: Flags [.], ack 1115, win 65535, length 0
21:56:09.331899 IP 10.0.2.15.53014 > 152.195.33.23.443: Flags [P.], seq 1115:1161, ack 4541, win 62780, length 46
21:56:09.331969 IP 10.0.2.15.53014 > 152.195.33.23.443: Flags [P.], seq 1161:1210, ack 4541, win 62780, length 49
21:56:09.332217 IP 152.195.33.23.443 > 10.0.2.15.53014: Flags [.], ack 1161, win 65535, length 0
21:56:09.332310 IP 10.0.2.15.53014 > 152.195.33.23.443: Flags [P.], seq 1210:1245, ack 4541, win 62780, length 35
21:56:09.332385 IP 10.0.2.15.53014 > 152.195.33.23.443: Flags [P.], seq 1245:1305, ack 4541, win 62780, length 60
21:56:09.332868 IP 152.195.33.23.443 > 10.0.2.15.53014: Flags [.], ack 1210, win 65535, length 0
21:56:09.332871 IP 152.195.33.23.443 > 10.0.2.15.53014: Flags [.], ack 1245, win 65535, length 0
21:56:09.332872 IP 152.195.33.23.443 > 10.0.2.15.53014: Flags [.], ack 1305, win 65535, length 0
21:56:09.344355 IP 152.195.33.23.443 > 10.0.2.15.53014: Flags [P.], seq 4541:5147, ack 1305, win 65535, length 606
21:56:09.344380 IP 10.0.2.15.53014 > 152.195.33.23.443: Flags [.], ack 5147, win 62780, length 0
21:56:09.345097 IP 152.195.33.23.443 > 10.0.2.15.53014: Flags [P.], seq 5147:5178, ack 1305, win 65535, length 31
21:56:09.345187 IP 10.0.2.15.53014 > 152.195.33.23.443: Flags [.], ack 5178, win 62780, length 0
21:56:09.345682 IP 10.0.2.15.53014 > 152.195.33.23.443: Flags [P.], seq 1305:1336, ack 5178, win 62780, length 31
21:56:09.346141 IP 152.195.33.23.443 > 10.0.2.15.53014: Flags [.], ack 1336, win 65535, length 0
21:56:09.347795 IP 152.195.33.23.443 > 10.0.2.15.53014: Flags [P.], seq 5178:5385, ack 1336, win 65535, length 207
21:56:09.348308 IP 10.0.2.15.53014 > 152.195.33.23.443: Flags [P.], seq 1336:1360, ack 5385, win 62780, length 24
21:56:09.349021 IP 152.195.33.23.443 > 10.0.2.15.53014: Flags [.], ack 1360, win 65535, length 0
21:56:09.350229 IP 10.0.2.15.53014 > 152.195.33.23.443: Flags [F.], seq 1360, ack 5385, win 62780, length 0
21:56:09.350690 IP 152.195.33.23.443 > 10.0.2.15.53014: Flags [.], ack 1361, win 65535, length 0
21:56:09.361543 IP 152.195.33.23.443 > 10.0.2.15.53014: Flags [P.], seq 5385:5409, ack 1361, win 65535, length 24
21:56:09.361546 IP 152.195.33.23.443 > 10.0.2.15.53014: Flags [F.], seq 5409, ack 1361, win 65535, length 0
21:56:09.361573 IP 10.0.2.15.53014 > 152.195.33.23.443: Flags [R], seq 3480605240, win 0, length 0
21:56:09.361614 IP 10.0.2.15.53014 > 152.195.33.23.443: Flags [R], seq 3480605240, win 0, length 0
21:56:09.362442 IP 152.195.33.23.443 > 10.0.2.15.53014: Flags [R.], seq 4013239295, ack 1361, win 0, length 0

