21:52:40.412232 IP 10.0.2.15.42700 > 140.233.253.2.53: 23138+ A? www.usps.com. (30)
21:52:40.412282 IP 10.0.2.15.42700 > 140.233.253.2.53: 51325+ AAAA? www.usps.com. (30)
21:52:40.417423 IP 140.233.253.2.53 > 10.0.2.15.42700: 51325 2/0/0 CNAME cs1799.wpc.upsiloncdn.net., AAAA 2606:2800:21f:3e9e:5a:9b8f:bddb:fb7c (97)
21:52:40.417425 IP 140.233.253.2.53 > 10.0.2.15.42700: 23138 2/0/0 CNAME cs1799.wpc.upsiloncdn.net., A 152.195.33.23 (85)
21:52:40.417841 IP 10.0.2.15.52936 > 152.195.33.23.443: Flags [S], seq 2229149659, win 64240, options [mss 1460,sackOK,TS val 3501331447 ecr 0,nop,wscale 6], length 0
21:52:40.432594 IP 152.195.33.23.443 > 10.0.2.15.52936: Flags [S.], seq 276864001, ack 2229149660, win 65535, options [mss 1460], length 0
21:52:40.432645 IP 10.0.2.15.52936 > 152.195.33.23.443: Flags [.], ack 1, win 64240, length 0
21:52:40.447843 IP 10.0.2.15.52936 > 152.195.33.23.443: Flags [P.], seq 1:518, ack 1, win 64240, length 517
21:52:40.448371 IP 152.195.33.23.443 > 10.0.2.15.52936: Flags [.], ack 518, win 65535, length 0
21:52:40.466114 IP 152.195.33.23.443 > 10.0.2.15.52936: Flags [P.], seq 1:100, ack 518, win 65535, length 99
21:52:40.466141 IP 10.0.2.15.52936 > 152.195.33.23.443: Flags [.], ack 100, win 64141, length 0
21:52:40.466645 IP 10.0.2.15.52936 > 152.195.33.23.443: Flags [P.], seq 518:1041, ack 100, win 64141, length 523
21:52:40.467004 IP 152.195.33.23.443 > 10.0.2.15.52936: Flags [.], ack 1041, win 65535, length 0
21:52:40.482785 IP 152.195.33.23.443 > 10.0.2.15.52936: Flags [P.], seq 100:2848, ack 1041, win 65535, length 2748
21:52:40.482807 IP 10.0.2.15.52936 > 152.195.33.23.443: Flags [.], ack 2848, win 62780, length 0
21:52:40.483335 IP 152.195.33.23.443 > 10.0.2.15.52936: Flags [P.], seq 2848:4541, ack 1041, win 65535, length 1693
21:52:40.483362 IP 10.0.2.15.52936 > 152.195.33.23.443: Flags [.], ack 4541, win 61320, length 0
21:52:40.486780 IP 10.0.2.15.52936 > 152.195.33.23.443: Flags [P.], seq 1041:1115, ack 4541, win 62780, length 74
21:52:40.487337 IP 152.195.33.23.443 > 10.0.2.15.52936: Flags [.], ack 1115, win 65535, length 0
21:52:40.487411 IP 10.0.2.15.52936 > 152.195.33.23.443: Flags [P.], seq 1115:1161, ack 4541, win 62780, length 46
21:52:40.487626 IP 10.0.2.15.52936 > 152.195.33.23.443: Flags [P.], seq 1161:1210, ack 4541, win 62780, length 49
21:52:40.487743 IP 152.195.33.23.443 > 10.0.2.15.52936: Flags [.], ack 1161, win 65535, length 0
21:52:40.487866 IP 152.195.33.23.443 > 10.0.2.15.52936: Flags [.], ack 1210, win 65535, length 0
21:52:40.487884 IP 10.0.2.15.52936 > 152.195.33.23.443: Flags [P.], seq 1210:1245, ack 4541, win 62780, length 35
21:52:40.488108 IP 152.195.33.23.443 > 10.0.2.15.52936: Flags [.], ack 1245, win 65535, length 0
21:52:40.488304 IP 10.0.2.15.52936 > 152.195.33.23.443: Flags [P.], seq 1245:1305, ack 4541, win 62780, length 60
21:52:40.488855 IP 152.195.33.23.443 > 10.0.2.15.52936: Flags [.], ack 1305, win 65535, length 0
21:52:40.499520 IP 152.195.33.23.443 > 10.0.2.15.52936: Flags [P.], seq 4541:5147, ack 1305, win 65535, length 606
21:52:40.499546 IP 10.0.2.15.52936 > 152.195.33.23.443: Flags [.], ack 5147, win 62780, length 0
21:52:40.500871 IP 10.0.2.15.52936 > 152.195.33.23.443: Flags [P.], seq 1305:1336, ack 5147, win 62780, length 31
21:52:40.501834 IP 152.195.33.23.443 > 10.0.2.15.52936: Flags [P.], seq 5147:5385, ack 1305, win 65535, length 238
21:52:40.501837 IP 152.195.33.23.443 > 10.0.2.15.52936: Flags [.], ack 1336, win 65535, length 0
21:52:40.502642 IP 10.0.2.15.52936 > 152.195.33.23.443: Flags [P.], seq 1336:1360, ack 5385, win 62780, length 24
21:52:40.502989 IP 152.195.33.23.443 > 10.0.2.15.52936: Flags [.], ack 1360, win 65535, length 0
21:52:40.503830 IP 10.0.2.15.52936 > 152.195.33.23.443: Flags [F.], seq 1360, ack 5385, win 62780, length 0
21:52:40.504268 IP 152.195.33.23.443 > 10.0.2.15.52936: Flags [.], ack 1361, win 65535, length 0
21:52:40.517917 IP 152.195.33.23.443 > 10.0.2.15.52936: Flags [P.], seq 5385:5409, ack 1361, win 65535, length 24
21:52:40.517920 IP 152.195.33.23.443 > 10.0.2.15.52936: Flags [F.], seq 5409, ack 1361, win 65535, length 0
21:52:40.517944 IP 10.0.2.15.52936 > 152.195.33.23.443: Flags [R], seq 2229151020, win 0, length 0
21:52:40.517979 IP 10.0.2.15.52936 > 152.195.33.23.443: Flags [R], seq 2229151020, win 0, length 0
21:52:40.518226 IP 152.195.33.23.443 > 10.0.2.15.52936: Flags [R.], seq 4018103295, ack 1361, win 0, length 0

