21:55:46.215808 IP 10.0.2.15.47269 > 140.233.253.2.53: 32112+ A? www.usps.com. (30)
21:55:46.216145 IP 10.0.2.15.47269 > 140.233.253.2.53: 29052+ AAAA? www.usps.com. (30)
21:55:46.220369 IP 140.233.253.2.53 > 10.0.2.15.47269: 32112 2/0/0 CNAME cs1799.wpc.upsiloncdn.net., A 152.195.33.23 (85)
21:55:46.220371 IP 140.233.253.2.53 > 10.0.2.15.47269: 29052 2/0/0 CNAME cs1799.wpc.upsiloncdn.net., AAAA 2606:2800:21f:3e9e:5a:9b8f:bddb:fb7c (97)
21:55:46.224073 IP 10.0.2.15.53006 > 152.195.33.23.443: Flags [S], seq 3273762420, win 64240, options [mss 1460,sackOK,TS val 3501517253 ecr 0,nop,wscale 6], length 0
21:55:46.237707 IP 152.195.33.23.443 > 10.0.2.15.53006: Flags [S.], seq 281216001, ack 3273762421, win 65535, options [mss 1460], length 0
21:55:46.237734 IP 10.0.2.15.53006 > 152.195.33.23.443: Flags [.], ack 1, win 64240, length 0

