21:52:51.386331 IP 10.0.2.15.57458 > 140.233.253.2.53: 9782+ A? www.usps.com. (30)
21:52:51.387461 IP 10.0.2.15.57458 > 140.233.253.2.53: 52521+ AAAA? www.usps.com. (30)
21:52:51.392030 IP 140.233.253.2.53 > 10.0.2.15.57458: 9782 2/0/0 CNAME cs1799.wpc.upsiloncdn.net., A 152.195.33.23 (85)
21:52:51.392032 IP 140.233.253.2.53 > 10.0.2.15.57458: 52521 2/0/0 CNAME cs1799.wpc.upsiloncdn.net., AAAA 2606:2800:21f:3e9e:5a:9b8f:bddb:fb7c (97)
21:52:51.392669 IP 10.0.2.15.52940 > 152.195.33.23.443: Flags [S], seq 2732193656, win 64240, options [mss 1460,sackOK,TS val 3501342421 ecr 0,nop,wscale 6], length 0
21:52:51.406969 IP 152.195.33.23.443 > 10.0.2.15.52940: Flags [S.], seq 277120001, ack 2732193657, win 65535, options [mss 1460], length 0
21:52:51.407024 IP 10.0.2.15.52940 > 152.195.33.23.443: Flags [.], ack 1, win 64240, length 0
21:52:51.420814 IP 10.0.2.15.52940 > 152.195.33.23.443: Flags [P.], seq 1:518, ack 1, win 64240, length 517
21:52:51.421257 IP 152.195.33.23.443 > 10.0.2.15.52940: Flags [.], ack 518, win 65535, length 0
21:52:51.435958 IP 152.195.33.23.443 > 10.0.2.15.52940: Flags [P.], seq 1:100, ack 518, win 65535, length 99
21:52:51.435978 IP 10.0.2.15.52940 > 152.195.33.23.443: Flags [.], ack 100, win 64141, length 0
21:52:51.437538 IP 10.0.2.15.52940 > 152.195.33.23.443: Flags [P.], seq 518:1041, ack 100, win 64141, length 523
21:52:51.439251 IP 152.195.33.23.443 > 10.0.2.15.52940: Flags [.], ack 1041, win 65535, length 0
21:52:51.454842 IP 152.195.33.23.443 > 10.0.2.15.52940: Flags [.], seq 100:4480, ack 1041, win 65535, length 4380
21:52:51.454918 IP 10.0.2.15.52940 > 152.195.33.23.443: Flags [.], ack 4480, win 61320, length 0
21:52:51.455392 IP 152.195.33.23.443 > 10.0.2.15.52940: Flags [P.], seq 4480:4541, ack 1041, win 65535, length 61
21:52:51.455404 IP 10.0.2.15.52940 > 152.195.33.23.443: Flags [.], ack 4541, win 61320, length 0
21:52:51.456937 IP 10.0.2.15.52940 > 152.195.33.23.443: Flags [P.], seq 1041:1115, ack 4541, win 62780, length 74
21:52:51.457297 IP 152.195.33.23.443 > 10.0.2.15.52940: Flags [.], ack 1115, win 65535, length 0
21:52:51.457392 IP 10.0.2.15.52940 > 152.195.33.23.443: Flags [P.], seq 1115:1161, ack 4541, win 62780, length 46
21:52:51.457428 IP 10.0.2.15.52940 > 152.195.33.23.443: Flags [P.], seq 1161:1210, ack 4541, win 62780, length 49
21:52:51.457570 IP 10.0.2.15.52940 > 152.195.33.23.443: Flags [P.], seq 1210:1245, ack 4541, win 62780, length 35
21:52:51.457731 IP 10.0.2.15.52940 > 152.195.33.23.443: Flags [P.], seq 1245:1305, ack 4541, win 62780, length 60
21:52:51.457924 IP 152.195.33.23.443 > 10.0.2.15.52940: Flags [.], ack 1161, win 65535, length 0
21:52:51.457926 IP 152.195.33.23.443 > 10.0.2.15.52940: Flags [.], ack 1210, win 65535, length 0
21:52:51.457927 IP 152.195.33.23.443 > 10.0.2.15.52940: Flags [.], ack 1245, win 65535, length 0
21:52:51.457927 IP 152.195.33.23.443 > 10.0.2.15.52940: Flags [.], ack 1305, win 65535, length 0
21:52:51.469831 IP 152.195.33.23.443 > 10.0.2.15.52940: Flags [P.], seq 4541:5178, ack 1305, win 65535, length 637
21:52:51.469854 IP 10.0.2.15.52940 > 152.195.33.23.443: Flags [.], ack 5178, win 62780, length 0
21:52:51.470444 IP 10.0.2.15.52940 > 152.195.33.23.443: Flags [P.], seq 1305:1336, ack 5178, win 62780, length 31
21:52:51.470858 IP 152.195.33.23.443 > 10.0.2.15.52940: Flags [.], ack 1336, win 65535, length 0
21:52:51.472897 IP 152.195.33.23.443 > 10.0.2.15.52940: Flags [P.], seq 5178:5385, ack 1336, win 65535, length 207
21:52:51.473322 IP 10.0.2.15.52940 > 152.195.33.23.443: Flags [P.], seq 1336:1360, ack 5385, win 62780, length 24
21:52:51.473700 IP 152.195.33.23.443 > 10.0.2.15.52940: Flags [.], ack 1360, win 65535, length 0
21:52:51.474336 IP 10.0.2.15.52940 > 152.195.33.23.443: Flags [F.], seq 1360, ack 5385, win 62780, length 0
21:52:51.474600 IP 152.195.33.23.443 > 10.0.2.15.52940: Flags [.], ack 1361, win 65535, length 0
21:52:51.485905 IP 152.195.33.23.443 > 10.0.2.15.52940: Flags [P.], seq 5385:5409, ack 1361, win 65535, length 24
21:52:51.485933 IP 10.0.2.15.52940 > 152.195.33.23.443: Flags [R], seq 2732195017, win 0, length 0

