21:53:29.991647 IP 10.0.2.15.57168 > 140.233.253.2.53: 26995+ A? www.usps.com. (30)
21:53:29.991695 IP 10.0.2.15.57168 > 140.233.253.2.53: 3964+ AAAA? www.usps.com. (30)
21:53:29.997283 IP 140.233.253.2.53 > 10.0.2.15.57168: 26995 2/0/0 CNAME cs1799.wpc.upsiloncdn.net., A 152.195.33.23 (85)
21:53:29.998979 IP 140.233.253.2.53 > 10.0.2.15.57168: 3964 2/0/0 CNAME cs1799.wpc.upsiloncdn.net., AAAA 2606:2800:21f:3e9e:5a:9b8f:bddb:fb7c (97)
21:53:29.999483 IP 10.0.2.15.52954 > 152.195.33.23.443: Flags [S], seq 3341917726, win 64240, options [mss 1460,sackOK,TS val 3501381028 ecr 0,nop,wscale 6], length 0
21:53:30.012900 IP 152.195.33.23.443 > 10.0.2.15.52954: Flags [S.], seq 278016001, ack 3341917727, win 65535, options [mss 1460], length 0
21:53:30.012939 IP 10.0.2.15.52954 > 152.195.33.23.443: Flags [.], ack 1, win 64240, length 0
21:53:30.020189 IP 10.0.2.15.52954 > 152.195.33.23.443: Flags [P.], seq 1:518, ack 1, win 64240, length 517
21:53:30.020570 IP 152.195.33.23.443 > 10.0.2.15.52954: Flags [.], ack 518, win 65535, length 0
21:53:30.036510 IP 152.195.33.23.443 > 10.0.2.15.52954: Flags [P.], seq 1:100, ack 518, win 65535, length 99
21:53:30.036532 IP 10.0.2.15.52954 > 152.195.33.23.443: Flags [.], ack 100, win 64141, length 0
21:53:30.037041 IP 10.0.2.15.52954 > 152.195.33.23.443: Flags [P.], seq 518:1041, ack 100, win 64141, length 523
21:53:30.037396 IP 152.195.33.23.443 > 10.0.2.15.52954: Flags [.], ack 1041, win 65535, length 0
21:53:30.052055 IP 152.195.33.23.443 > 10.0.2.15.52954: Flags [P.], seq 100:1474, ack 1041, win 65535, length 1374
21:53:30.052079 IP 10.0.2.15.52954 > 152.195.33.23.443: Flags [.], ack 1474, win 63204, length 0
21:53:30.055587 IP 152.195.33.23.443 > 10.0.2.15.52954: Flags [P.], seq 1474:4541, ack 1041, win 65535, length 3067
21:53:30.055622 IP 10.0.2.15.52954 > 152.195.33.23.443: Flags [.], ack 4541, win 62780, length 0
21:53:30.057242 IP 10.0.2.15.52954 > 152.195.33.23.443: Flags [P.], seq 1041:1115, ack 4541, win 62780, length 74
21:53:30.057547 IP 10.0.2.15.52954 > 152.195.33.23.443: Flags [P.], seq 1115:1161, ack 4541, win 62780, length 46
21:53:30.057658 IP 152.195.33.23.443 > 10.0.2.15.52954: Flags [.], ack 1115, win 65535, length 0
21:53:30.057712 IP 10.0.2.15.52954 > 152.195.33.23.443: Flags [P.], seq 1161:1210, ack 4541, win 62780, length 49
21:53:30.057966 IP 152.195.33.23.443 > 10.0.2.15.52954: Flags [.], ack 1161, win 65535, length 0
21:53:30.057967 IP 152.195.33.23.443 > 10.0.2.15.52954: Flags [.], ack 1210, win 65535, length 0
21:53:30.058023 IP 10.0.2.15.52954 > 152.195.33.23.443: Flags [P.], seq 1210:1245, ack 4541, win 62780, length 35
21:53:30.058248 IP 10.0.2.15.52954 > 152.195.33.23.443: Flags [P.], seq 1245:1305, ack 4541, win 62780, length 60
21:53:30.058322 IP 152.195.33.23.443 > 10.0.2.15.52954: Flags [.], ack 1245, win 65535, length 0
21:53:30.058537 IP 152.195.33.23.443 > 10.0.2.15.52954: Flags [.], ack 1305, win 65535, length 0
21:53:30.070188 IP 152.195.33.23.443 > 10.0.2.15.52954: Flags [P.], seq 4541:5178, ack 1305, win 65535, length 637
21:53:30.070239 IP 10.0.2.15.52954 > 152.195.33.23.443: Flags [.], ack 5178, win 62780, length 0
21:53:30.070855 IP 10.0.2.15.52954 > 152.195.33.23.443: Flags [P.], seq 1305:1336, ack 5178, win 62780, length 31
21:53:30.071353 IP 152.195.33.23.443 > 10.0.2.15.52954: Flags [.], ack 1336, win 65535, length 0
21:53:30.076535 IP 152.195.33.23.443 > 10.0.2.15.52954: Flags [P.], seq 5178:5385, ack 1336, win 65535, length 207
21:53:30.076968 IP 10.0.2.15.52954 > 152.195.33.23.443: Flags [P.], seq 1336:1360, ack 5385, win 62780, length 24
21:53:30.077338 IP 152.195.33.23.443 > 10.0.2.15.52954: Flags [.], ack 1360, win 65535, length 0
21:53:30.078129 IP 10.0.2.15.52954 > 152.195.33.23.443: Flags [F.], seq 1360, ack 5385, win 62780, length 0
21:53:30.078365 IP 152.195.33.23.443 > 10.0.2.15.52954: Flags [.], ack 1361, win 65535, length 0
21:53:30.089173 IP 152.195.33.23.443 > 10.0.2.15.52954: Flags [P.], seq 5385:5409, ack 1361, win 65535, length 24
21:53:30.089202 IP 10.0.2.15.52954 > 152.195.33.23.443: Flags [R], seq 3341919087, win 0, length 0

