23:00:27.699233 IP 10.0.2.15.41191 > 140.233.253.2.53: 18872+ A? www.office.com. (32)
23:00:27.699287 IP 10.0.2.15.41191 > 140.233.253.2.53: 48061+ AAAA? www.office.com. (32)
23:00:27.706262 IP 140.233.253.2.53 > 10.0.2.15.41191: 18872 4/0/0 CNAME home-portal.office.com., CNAME home-office365-com.b-0004.b-msedge.net., CNAME b-0004.b-msedge.net., A 13.107.6.156 (140)
23:00:27.706264 IP 140.233.253.2.53 > 10.0.2.15.41191: 48061 4/0/0 CNAME home-portal.office.com., CNAME home-office365-com.b-0004.b-msedge.net., CNAME b-0004.b-msedge.net., AAAA 2620:1ec:a92::156 (152)
23:00:27.706604 IP 10.0.2.15.55144 > 13.107.6.156.443: Flags [S], seq 809628396, win 64240, options [mss 1460,sackOK,TS val 2602212524 ecr 0,nop,wscale 6], length 0
23:00:27.721628 IP 13.107.6.156.443 > 10.0.2.15.55144: Flags [S.], seq 394880001, ack 809628397, win 65535, options [mss 1460], length 0
23:00:27.721664 IP 10.0.2.15.55144 > 13.107.6.156.443: Flags [.], ack 1, win 64240, length 0
23:00:27.730415 IP 10.0.2.15.55144 > 13.107.6.156.443: Flags [P.], seq 1:518, ack 1, win 64240, length 517
23:00:27.730839 IP 13.107.6.156.443 > 10.0.2.15.55144: Flags [.], ack 518, win 65535, length 0
23:00:27.751213 IP 13.107.6.156.443 > 10.0.2.15.55144: Flags [P.], seq 1:1387, ack 518, win 65535, length 1386
23:00:27.751236 IP 10.0.2.15.55144 > 13.107.6.156.443: Flags [.], ack 1387, win 63756, length 0
23:00:27.754321 IP 13.107.6.156.443 > 10.0.2.15.55144: Flags [P.], seq 1387:3956, ack 518, win 65535, length 2569
23:00:27.754341 IP 10.0.2.15.55144 > 13.107.6.156.443: Flags [.], ack 3956, win 62780, length 0
23:00:27.758733 IP 10.0.2.15.55144 > 13.107.6.156.443: Flags [P.], seq 518:676, ack 3956, win 62780, length 158
23:00:27.759139 IP 13.107.6.156.443 > 10.0.2.15.55144: Flags [.], ack 676, win 65535, length 0

