23:00:59.451880 IP 10.0.2.15.52894 > 140.233.253.2.53: 52553+ A? www.office.com. (32)
23:00:59.451914 IP 10.0.2.15.52894 > 140.233.253.2.53: 5452+ AAAA? www.office.com. (32)
23:00:59.458567 IP 140.233.253.2.53 > 10.0.2.15.52894: 52553 4/0/0 CNAME home-portal.office.com., CNAME home-office365-com.b-0004.b-msedge.net., CNAME b-0004.b-msedge.net., A 13.107.6.156 (140)
23:00:59.472623 IP 140.233.253.2.53 > 10.0.2.15.52894: 5452 4/0/0 CNAME home-portal.office.com., CNAME home-office365-com.b-0004.b-msedge.net., CNAME b-0004.b-msedge.net., AAAA 2620:1ec:a92::156 (152)
23:00:59.473082 IP 10.0.2.15.55156 > 13.107.6.156.443: Flags [S], seq 3256726785, win 64240, options [mss 1460,sackOK,TS val 2602244291 ecr 0,nop,wscale 6], length 0
23:00:59.488094 IP 13.107.6.156.443 > 10.0.2.15.55156: Flags [S.], seq 395648001, ack 3256726786, win 65535, options [mss 1460], length 0
23:00:59.488139 IP 10.0.2.15.55156 > 13.107.6.156.443: Flags [.], ack 1, win 64240, length 0
23:00:59.497986 IP 10.0.2.15.55156 > 13.107.6.156.443: Flags [P.], seq 1:518, ack 1, win 64240, length 517
23:00:59.498370 IP 13.107.6.156.443 > 10.0.2.15.55156: Flags [.], ack 518, win 65535, length 0
23:00:59.515891 IP 13.107.6.156.443 > 10.0.2.15.55156: Flags [P.], seq 1:2773, ack 518, win 65535, length 2772
23:00:59.515917 IP 10.0.2.15.55156 > 13.107.6.156.443: Flags [.], ack 2773, win 62780, length 0
23:00:59.516691 IP 13.107.6.156.443 > 10.0.2.15.55156: Flags [P.], seq 2773:3956, ack 518, win 65535, length 1183
23:00:59.516703 IP 10.0.2.15.55156 > 13.107.6.156.443: Flags [.], ack 3956, win 62780, length 0
23:00:59.521248 IP 10.0.2.15.55156 > 13.107.6.156.443: Flags [P.], seq 518:676, ack 3956, win 62780, length 158
23:00:59.521678 IP 13.107.6.156.443 > 10.0.2.15.55156: Flags [.], ack 676, win 65535, length 0

