22:58:41.379481 IP 10.0.2.15.51592 > 140.233.253.2.53: 23173+ A? www.office.com. (32)
22:58:41.379753 IP 10.0.2.15.51592 > 140.233.253.2.53: 18570+ AAAA? www.office.com. (32)
22:58:41.385217 IP 140.233.253.2.53 > 10.0.2.15.51592: 23173 4/0/0 CNAME home-portal.office.com., CNAME home-office365-com.b-0004.b-msedge.net., CNAME b-0004.b-msedge.net., A 13.107.6.156 (140)
22:58:41.385219 IP 140.233.253.2.53 > 10.0.2.15.51592: 18570 4/0/0 CNAME home-portal.office.com., CNAME home-office365-com.b-0004.b-msedge.net., CNAME b-0004.b-msedge.net., AAAA 2620:1ec:a92::156 (152)
22:58:41.385538 IP 10.0.2.15.55100 > 13.107.6.156.443: Flags [S], seq 1229720225, win 64240, options [mss 1460,sackOK,TS val 2602106203 ecr 0,nop,wscale 6], length 0
22:58:41.399881 IP 13.107.6.156.443 > 10.0.2.15.55100: Flags [S.], seq 392320001, ack 1229720226, win 65535, options [mss 1460], length 0
22:58:41.399925 IP 10.0.2.15.55100 > 13.107.6.156.443: Flags [.], ack 1, win 64240, length 0
22:58:41.407935 IP 10.0.2.15.55100 > 13.107.6.156.443: Flags [P.], seq 1:518, ack 1, win 64240, length 517
22:58:41.408507 IP 13.107.6.156.443 > 10.0.2.15.55100: Flags [.], ack 518, win 65535, length 0
22:58:41.429237 IP 13.107.6.156.443 > 10.0.2.15.55100: Flags [.], seq 1:2921, ack 518, win 65535, length 2920
22:58:41.429261 IP 10.0.2.15.55100 > 13.107.6.156.443: Flags [.], ack 2921, win 62780, length 0
22:58:41.429624 IP 13.107.6.156.443 > 10.0.2.15.55100: Flags [P.], seq 2921:3956, ack 518, win 65535, length 1035
22:58:41.429635 IP 10.0.2.15.55100 > 13.107.6.156.443: Flags [.], ack 3956, win 62780, length 0
22:58:41.433543 IP 10.0.2.15.55100 > 13.107.6.156.443: Flags [P.], seq 518:676, ack 3956, win 62780, length 158
22:58:41.433945 IP 13.107.6.156.443 > 10.0.2.15.55100: Flags [.], ack 676, win 65535, length 0
22:58:41.450429 IP 13.107.6.156.443 > 10.0.2.15.55100: Flags [P.], seq 3956:4076, ack 676, win 65535, length 120
22:58:41.450453 IP 10.0.2.15.55100 > 13.107.6.156.443: Flags [.], ack 4076, win 62780, length 0
22:58:41.450900 IP 10.0.2.15.55100 > 13.107.6.156.443: Flags [P.], seq 676:729, ack 4076, win 62780, length 53
22:58:41.450939 IP 10.0.2.15.55100 > 13.107.6.156.443: Flags [P.], seq 729:785, ack 4076, win 62780, length 56
22:58:41.451132 IP 10.0.2.15.55100 > 13.107.6.156.443: Flags [P.], seq 785:934, ack 4076, win 62780, length 149
22:58:41.451974 IP 13.107.6.156.443 > 10.0.2.15.55100: Flags [.], ack 729, win 65535, length 0
22:58:41.451976 IP 13.107.6.156.443 > 10.0.2.15.55100: Flags [.], ack 785, win 65535, length 0
22:58:41.451977 IP 13.107.6.156.443 > 10.0.2.15.55100: Flags [.], ack 934, win 65535, length 0

