22:57:37.098098 IP 10.0.2.15.37645 > 140.233.253.2.53: 8065+ A? www.office.com. (32)
22:57:37.098145 IP 10.0.2.15.37645 > 140.233.253.2.53: 46269+ AAAA? www.office.com. (32)
22:57:37.102949 IP 140.233.253.2.53 > 10.0.2.15.37645: 8065 4/0/0 CNAME home-portal.office.com., CNAME home-office365-com.b-0004.b-msedge.net., CNAME b-0004.b-msedge.net., A 13.107.6.156 (140)
22:57:37.102951 IP 140.233.253.2.53 > 10.0.2.15.37645: 46269 4/0/0 CNAME home-portal.office.com., CNAME home-office365-com.b-0004.b-msedge.net., CNAME b-0004.b-msedge.net., AAAA 2620:1ec:a92::156 (152)
22:57:37.103405 IP 10.0.2.15.55074 > 13.107.6.156.443: Flags [S], seq 3990849943, win 64240, options [mss 1460,sackOK,TS val 2602041921 ecr 0,nop,wscale 6], length 0
22:57:37.117662 IP 13.107.6.156.443 > 10.0.2.15.55074: Flags [S.], seq 390784001, ack 3990849944, win 65535, options [mss 1460], length 0
22:57:37.117717 IP 10.0.2.15.55074 > 13.107.6.156.443: Flags [.], ack 1, win 64240, length 0
22:57:37.132050 IP 10.0.2.15.55074 > 13.107.6.156.443: Flags [P.], seq 1:518, ack 1, win 64240, length 517
22:57:37.132543 IP 13.107.6.156.443 > 10.0.2.15.55074: Flags [.], ack 518, win 65535, length 0
22:57:37.149943 IP 13.107.6.156.443 > 10.0.2.15.55074: Flags [.], seq 1:2921, ack 518, win 65535, length 2920
22:57:37.149965 IP 10.0.2.15.55074 > 13.107.6.156.443: Flags [.], ack 2921, win 62780, length 0
22:57:37.150451 IP 13.107.6.156.443 > 10.0.2.15.55074: Flags [P.], seq 2921:3956, ack 518, win 65535, length 1035
22:57:37.150471 IP 10.0.2.15.55074 > 13.107.6.156.443: Flags [.], ack 3956, win 61745, length 0
22:57:37.158676 IP 10.0.2.15.55074 > 13.107.6.156.443: Flags [P.], seq 518:676, ack 3956, win 62780, length 158
22:57:37.159203 IP 13.107.6.156.443 > 10.0.2.15.55074: Flags [.], ack 676, win 65535, length 0
22:57:37.173217 IP 13.107.6.156.443 > 10.0.2.15.55074: Flags [P.], seq 3956:4076, ack 676, win 65535, length 120
22:57:37.173238 IP 10.0.2.15.55074 > 13.107.6.156.443: Flags [.], ack 4076, win 62780, length 0
22:57:37.173673 IP 10.0.2.15.55074 > 13.107.6.156.443: Flags [P.], seq 676:729, ack 4076, win 62780, length 53
22:57:37.173712 IP 10.0.2.15.55074 > 13.107.6.156.443: Flags [P.], seq 729:785, ack 4076, win 62780, length 56
22:57:37.173824 IP 10.0.2.15.55074 > 13.107.6.156.443: Flags [P.], seq 785:827, ack 4076, win 62780, length 42
22:57:37.174027 IP 13.107.6.156.443 > 10.0.2.15.55074: Flags [.], ack 729, win 65535, length 0
22:57:37.174028 IP 13.107.6.156.443 > 10.0.2.15.55074: Flags [.], ack 785, win 65535, length 0
22:57:37.174029 IP 13.107.6.156.443 > 10.0.2.15.55074: Flags [.], ack 827, win 65535, length 0
22:57:37.174110 IP 10.0.2.15.55074 > 13.107.6.156.443: Flags [P.], seq 827:896, ack 4076, win 62780, length 69
22:57:37.174341 IP 13.107.6.156.443 > 10.0.2.15.55074: Flags [.], ack 896, win 65535, length 0
22:57:37.174356 IP 10.0.2.15.55074 > 13.107.6.156.443: Flags [P.], seq 896:934, ack 4076, win 62780, length 38
22:57:37.174592 IP 13.107.6.156.443 > 10.0.2.15.55074: Flags [.], ack 934, win 65535, length 0
22:57:37.188698 IP 13.107.6.156.443 > 10.0.2.15.55074: Flags [P.], seq 4076:4114, ack 934, win 65535, length 38
22:57:37.188819 IP 10.0.2.15.55074 > 13.107.6.156.443: Flags [.], ack 4114, win 62780, length 0

