22:58:52.033789 IP 10.0.2.15.45418 > 140.233.253.2.53: 23287+ A? www.office.com. (32)
22:58:52.033867 IP 10.0.2.15.45418 > 140.233.253.2.53: 56309+ AAAA? www.office.com. (32)
22:58:52.041855 IP 140.233.253.2.53 > 10.0.2.15.45418: 23287 4/0/0 CNAME home-portal.office.com., CNAME home-office365-com.b-0004.b-msedge.net., CNAME b-0004.b-msedge.net., A 13.107.6.156 (140)
22:58:52.041858 IP 140.233.253.2.53 > 10.0.2.15.45418: 56309 4/0/0 CNAME home-portal.office.com., CNAME home-office365-com.b-0004.b-msedge.net., CNAME b-0004.b-msedge.net., AAAA 2620:1ec:a92::156 (152)
22:58:52.042499 IP 10.0.2.15.55104 > 13.107.6.156.443: Flags [S], seq 3398633435, win 64240, options [mss 1460,sackOK,TS val 2602116860 ecr 0,nop,wscale 6], length 0
22:58:52.060961 IP 13.107.6.156.443 > 10.0.2.15.55104: Flags [S.], seq 392576001, ack 3398633436, win 65535, options [mss 1460], length 0
22:58:52.060998 IP 10.0.2.15.55104 > 13.107.6.156.443: Flags [.], ack 1, win 64240, length 0
22:58:52.073513 IP 10.0.2.15.55104 > 13.107.6.156.443: Flags [P.], seq 1:518, ack 1, win 64240, length 517
22:58:52.073961 IP 13.107.6.156.443 > 10.0.2.15.55104: Flags [.], ack 518, win 65535, length 0
22:58:52.091252 IP 13.107.6.156.443 > 10.0.2.15.55104: Flags [.], seq 1:2921, ack 518, win 65535, length 2920
22:58:52.091286 IP 10.0.2.15.55104 > 13.107.6.156.443: Flags [.], ack 2921, win 62780, length 0
22:58:52.091893 IP 13.107.6.156.443 > 10.0.2.15.55104: Flags [P.], seq 2921:3956, ack 518, win 65535, length 1035
22:58:52.091927 IP 10.0.2.15.55104 > 13.107.6.156.443: Flags [.], ack 3956, win 61745, length 0
22:58:52.097264 IP 10.0.2.15.55104 > 13.107.6.156.443: Flags [P.], seq 518:676, ack 3956, win 62780, length 158
22:58:52.097612 IP 13.107.6.156.443 > 10.0.2.15.55104: Flags [.], ack 676, win 65535, length 0
22:58:52.111946 IP 13.107.6.156.443 > 10.0.2.15.55104: Flags [P.], seq 3956:4076, ack 676, win 65535, length 120
22:58:52.112209 IP 10.0.2.15.55104 > 13.107.6.156.443: Flags [.], ack 4076, win 62780, length 0
22:58:52.112854 IP 10.0.2.15.55104 > 13.107.6.156.443: Flags [P.], seq 676:729, ack 4076, win 62780, length 53
22:58:52.112895 IP 10.0.2.15.55104 > 13.107.6.156.443: Flags [P.], seq 729:785, ack 4076, win 62780, length 56
22:58:52.113147 IP 13.107.6.156.443 > 10.0.2.15.55104: Flags [.], ack 729, win 65535, length 0
22:58:52.113168 IP 10.0.2.15.55104 > 13.107.6.156.443: Flags [P.], seq 785:934, ack 4076, win 62780, length 149
22:58:52.113358 IP 13.107.6.156.443 > 10.0.2.15.55104: Flags [.], ack 785, win 65535, length 0
22:58:52.113360 IP 13.107.6.156.443 > 10.0.2.15.55104: Flags [.], ack 934, win 65535, length 0

