23:00:11.766746 IP 10.0.2.15.53563 > 140.233.253.2.53: 58899+ A? www.office.com. (32)
23:00:11.766791 IP 10.0.2.15.53563 > 140.233.253.2.53: 12815+ AAAA? www.office.com. (32)
23:00:11.773097 IP 140.233.253.2.53 > 10.0.2.15.53563: 58899 4/0/0 CNAME home-portal.office.com., CNAME home-office365-com.b-0004.b-msedge.net., CNAME b-0004.b-msedge.net., A 13.107.6.156 (140)
23:00:11.773099 IP 140.233.253.2.53 > 10.0.2.15.53563: 12815 4/0/0 CNAME home-portal.office.com., CNAME home-office365-com.b-0004.b-msedge.net., CNAME b-0004.b-msedge.net., AAAA 2620:1ec:a92::156 (152)
23:00:11.773489 IP 10.0.2.15.55138 > 13.107.6.156.443: Flags [S], seq 1480508148, win 64240, options [mss 1460,sackOK,TS val 2602196591 ecr 0,nop,wscale 6], length 0
23:00:11.789476 IP 13.107.6.156.443 > 10.0.2.15.55138: Flags [S.], seq 394496001, ack 1480508149, win 65535, options [mss 1460], length 0
23:00:11.789517 IP 10.0.2.15.55138 > 13.107.6.156.443: Flags [.], ack 1, win 64240, length 0
23:00:11.806237 IP 10.0.2.15.55138 > 13.107.6.156.443: Flags [P.], seq 1:518, ack 1, win 64240, length 517
23:00:11.809389 IP 13.107.6.156.443 > 10.0.2.15.55138: Flags [.], ack 518, win 65535, length 0
23:00:11.827158 IP 13.107.6.156.443 > 10.0.2.15.55138: Flags [P.], seq 1:2773, ack 518, win 65535, length 2772
23:00:11.827226 IP 10.0.2.15.55138 > 13.107.6.156.443: Flags [.], ack 2773, win 62780, length 0

