22:59:23.859826 IP 10.0.2.15.52160 > 140.233.253.2.53: 50131+ A? www.office.com. (32)
22:59:23.860062 IP 10.0.2.15.52160 > 140.233.253.2.53: 62676+ AAAA? www.office.com. (32)
22:59:23.866787 IP 140.233.253.2.53 > 10.0.2.15.52160: 50131 4/0/0 CNAME home-portal.office.com., CNAME home-office365-com.b-0004.b-msedge.net., CNAME b-0004.b-msedge.net., A 13.107.6.156 (140)
22:59:23.866790 IP 140.233.253.2.53 > 10.0.2.15.52160: 62676 4/0/0 CNAME home-portal.office.com., CNAME home-office365-com.b-0004.b-msedge.net., CNAME b-0004.b-msedge.net., AAAA 2620:1ec:a92::156 (152)
22:59:23.867247 IP 10.0.2.15.55118 > 13.107.6.156.443: Flags [S], seq 2558752929, win 64240, options [mss 1460,sackOK,TS val 2602148685 ecr 0,nop,wscale 6], length 0
22:59:23.882205 IP 13.107.6.156.443 > 10.0.2.15.55118: Flags [S.], seq 393344001, ack 2558752930, win 65535, options [mss 1460], length 0
22:59:23.882250 IP 10.0.2.15.55118 > 13.107.6.156.443: Flags [.], ack 1, win 64240, length 0
22:59:23.891720 IP 10.0.2.15.55118 > 13.107.6.156.443: Flags [P.], seq 1:518, ack 1, win 64240, length 517
22:59:23.891969 IP 13.107.6.156.443 > 10.0.2.15.55118: Flags [.], ack 518, win 65535, length 0
22:59:23.909175 IP 13.107.6.156.443 > 10.0.2.15.55118: Flags [P.], seq 1:2773, ack 518, win 65535, length 2772
22:59:23.909199 IP 10.0.2.15.55118 > 13.107.6.156.443: Flags [.], ack 2773, win 62780, length 0
22:59:23.910182 IP 13.107.6.156.443 > 10.0.2.15.55118: Flags [P.], seq 2773:3956, ack 518, win 65535, length 1183
22:59:23.910210 IP 10.0.2.15.55118 > 13.107.6.156.443: Flags [.], ack 3956, win 62780, length 0
22:59:23.914510 IP 10.0.2.15.55118 > 13.107.6.156.443: Flags [P.], seq 518:676, ack 3956, win 62780, length 158
22:59:23.914881 IP 13.107.6.156.443 > 10.0.2.15.55118: Flags [.], ack 676, win 65535, length 0
22:59:23.930409 IP 13.107.6.156.443 > 10.0.2.15.55118: Flags [P.], seq 3956:4076, ack 676, win 65535, length 120
22:59:23.930430 IP 10.0.2.15.55118 > 13.107.6.156.443: Flags [.], ack 4076, win 62780, length 0
22:59:23.930878 IP 10.0.2.15.55118 > 13.107.6.156.443: Flags [P.], seq 676:729, ack 4076, win 62780, length 53
22:59:23.930916 IP 10.0.2.15.55118 > 13.107.6.156.443: Flags [P.], seq 729:785, ack 4076, win 62780, length 56
22:59:23.931326 IP 13.107.6.156.443 > 10.0.2.15.55118: Flags [.], ack 729, win 65535, length 0
22:59:23.931327 IP 13.107.6.156.443 > 10.0.2.15.55118: Flags [.], ack 785, win 65535, length 0
22:59:23.931370 IP 10.0.2.15.55118 > 13.107.6.156.443: Flags [P.], seq 785:896, ack 4076, win 62780, length 111
22:59:23.931705 IP 13.107.6.156.443 > 10.0.2.15.55118: Flags [.], ack 896, win 65535, length 0
22:59:23.931752 IP 10.0.2.15.55118 > 13.107.6.156.443: Flags [P.], seq 896:934, ack 4076, win 62780, length 38
22:59:23.932011 IP 13.107.6.156.443 > 10.0.2.15.55118: Flags [.], ack 934, win 65535, length 0

