23:01:36.571387 IP 10.0.2.15.36888 > 140.233.253.2.53: 10839+ A? www.office.com. (32)
23:01:36.571434 IP 10.0.2.15.36888 > 140.233.253.2.53: 59739+ AAAA? www.office.com. (32)
23:01:36.577897 IP 140.233.253.2.53 > 10.0.2.15.36888: 59739 4/0/0 CNAME home-portal.office.com., CNAME home-office365-com.b-0004.b-msedge.net., CNAME b-0004.b-msedge.net., AAAA 2620:1ec:a92::156 (152)
23:01:36.577900 IP 140.233.253.2.53 > 10.0.2.15.36888: 10839 4/0/0 CNAME home-portal.office.com., CNAME home-office365-com.b-0004.b-msedge.net., CNAME b-0004.b-msedge.net., A 13.107.6.156 (140)
23:01:36.578352 IP 10.0.2.15.55172 > 13.107.6.156.443: Flags [S], seq 3666128020, win 64240, options [mss 1460,sackOK,TS val 2602281396 ecr 0,nop,wscale 6], length 0
23:01:36.593323 IP 13.107.6.156.443 > 10.0.2.15.55172: Flags [S.], seq 396544001, ack 3666128021, win 65535, options [mss 1460], length 0
23:01:36.593362 IP 10.0.2.15.55172 > 13.107.6.156.443: Flags [.], ack 1, win 64240, length 0
23:01:36.608452 IP 10.0.2.15.55172 > 13.107.6.156.443: Flags [P.], seq 1:518, ack 1, win 64240, length 517
23:01:36.609021 IP 13.107.6.156.443 > 10.0.2.15.55172: Flags [.], ack 518, win 65535, length 0
23:01:36.630014 IP 13.107.6.156.443 > 10.0.2.15.55172: Flags [.], seq 1:2921, ack 518, win 65535, length 2920
23:01:36.630043 IP 10.0.2.15.55172 > 13.107.6.156.443: Flags [.], ack 2921, win 62780, length 0
23:01:36.630998 IP 13.107.6.156.443 > 10.0.2.15.55172: Flags [P.], seq 2921:3956, ack 518, win 65535, length 1035
23:01:36.631022 IP 10.0.2.15.55172 > 13.107.6.156.443: Flags [.], ack 3956, win 61745, length 0
23:01:36.636751 IP 10.0.2.15.55172 > 13.107.6.156.443: Flags [P.], seq 518:676, ack 3956, win 62780, length 158
23:01:36.637259 IP 13.107.6.156.443 > 10.0.2.15.55172: Flags [.], ack 676, win 65535, length 0
23:01:36.652352 IP 13.107.6.156.443 > 10.0.2.15.55172: Flags [P.], seq 3956:4076, ack 676, win 65535, length 120
23:01:36.652378 IP 10.0.2.15.55172 > 13.107.6.156.443: Flags [.], ack 4076, win 62780, length 0
23:01:36.652831 IP 10.0.2.15.55172 > 13.107.6.156.443: Flags [P.], seq 676:729, ack 4076, win 62780, length 53
23:01:36.652867 IP 10.0.2.15.55172 > 13.107.6.156.443: Flags [P.], seq 729:785, ack 4076, win 62780, length 56
23:01:36.653271 IP 13.107.6.156.443 > 10.0.2.15.55172: Flags [.], ack 729, win 65535, length 0
23:01:36.653272 IP 13.107.6.156.443 > 10.0.2.15.55172: Flags [.], ack 785, win 65535, length 0
23:01:36.653294 IP 10.0.2.15.55172 > 13.107.6.156.443: Flags [P.], seq 785:934, ack 4076, win 62780, length 149
23:01:36.653738 IP 13.107.6.156.443 > 10.0.2.15.55172: Flags [.], ack 934, win 65535, length 0
23:01:36.666243 IP 13.107.6.156.443 > 10.0.2.15.55172: Flags [P.], seq 4076:4114, ack 934, win 65535, length 38
23:01:36.666262 IP 10.0.2.15.55172 > 13.107.6.156.443: Flags [.], ack 4114, win 62780, length 0

