23:02:13.728370 IP 10.0.2.15.45400 > 140.233.253.2.53: 49964+ A? www.office.com. (32)
23:02:13.728421 IP 10.0.2.15.45400 > 140.233.253.2.53: 35115+ AAAA? www.office.com. (32)
23:02:13.733296 IP 140.233.253.2.53 > 10.0.2.15.45400: 35115 4/0/0 CNAME home-portal.office.com., CNAME home-office365-com.b-0004.b-msedge.net., CNAME b-0004.b-msedge.net., AAAA 2620:1ec:a92::156 (152)
23:02:13.733298 IP 140.233.253.2.53 > 10.0.2.15.45400: 49964 4/0/0 CNAME home-portal.office.com., CNAME home-office365-com.b-0004.b-msedge.net., CNAME b-0004.b-msedge.net., A 13.107.6.156 (140)
23:02:13.733690 IP 10.0.2.15.55186 > 13.107.6.156.443: Flags [S], seq 2785090301, win 64240, options [mss 1460,sackOK,TS val 2602318551 ecr 0,nop,wscale 6], length 0
23:02:13.748626 IP 13.107.6.156.443 > 10.0.2.15.55186: Flags [S.], seq 397440001, ack 2785090302, win 65535, options [mss 1460], length 0
23:02:13.748671 IP 10.0.2.15.55186 > 13.107.6.156.443: Flags [.], ack 1, win 64240, length 0
23:02:13.757101 IP 10.0.2.15.55186 > 13.107.6.156.443: Flags [P.], seq 1:518, ack 1, win 64240, length 517
23:02:13.757422 IP 13.107.6.156.443 > 10.0.2.15.55186: Flags [.], ack 518, win 65535, length 0
23:02:13.776504 IP 13.107.6.156.443 > 10.0.2.15.55186: Flags [P.], seq 1:2773, ack 518, win 65535, length 2772
23:02:13.776526 IP 10.0.2.15.55186 > 13.107.6.156.443: Flags [.], ack 2773, win 62780, length 0
23:02:13.777212 IP 13.107.6.156.443 > 10.0.2.15.55186: Flags [P.], seq 2773:3956, ack 518, win 65535, length 1183
23:02:13.777229 IP 10.0.2.15.55186 > 13.107.6.156.443: Flags [.], ack 3956, win 62780, length 0
23:02:13.781661 IP 10.0.2.15.55186 > 13.107.6.156.443: Flags [P.], seq 518:676, ack 3956, win 62780, length 158
23:02:13.781916 IP 13.107.6.156.443 > 10.0.2.15.55186: Flags [.], ack 676, win 65535, length 0
23:02:13.797819 IP 13.107.6.156.443 > 10.0.2.15.55186: Flags [P.], seq 3956:4076, ack 676, win 65535, length 120
23:02:13.797844 IP 10.0.2.15.55186 > 13.107.6.156.443: Flags [.], ack 4076, win 62780, length 0
23:02:13.798397 IP 10.0.2.15.55186 > 13.107.6.156.443: Flags [P.], seq 676:729, ack 4076, win 62780, length 53
23:02:13.798436 IP 10.0.2.15.55186 > 13.107.6.156.443: Flags [P.], seq 729:785, ack 4076, win 62780, length 56
23:02:13.798622 IP 10.0.2.15.55186 > 13.107.6.156.443: Flags [P.], seq 785:934, ack 4076, win 62780, length 149
23:02:13.798699 IP 13.107.6.156.443 > 10.0.2.15.55186: Flags [.], ack 729, win 65535, length 0
23:02:13.798817 IP 13.107.6.156.443 > 10.0.2.15.55186: Flags [.], ack 785, win 65535, length 0
23:02:13.798818 IP 13.107.6.156.443 > 10.0.2.15.55186: Flags [.], ack 934, win 65535, length 0

