22:59:50.372659 IP 10.0.2.15.59971 > 140.233.253.2.53: 63580+ A? www.office.com. (32)
22:59:50.372699 IP 10.0.2.15.59971 > 140.233.253.2.53: 13393+ AAAA? www.office.com. (32)
22:59:50.377470 IP 140.233.253.2.53 > 10.0.2.15.59971: 13393 4/0/0 CNAME home-portal.office.com., CNAME home-office365-com.b-0004.b-msedge.net., CNAME b-0004.b-msedge.net., AAAA 2620:1ec:a92::156 (152)
22:59:50.377472 IP 140.233.253.2.53 > 10.0.2.15.59971: 63580 4/0/0 CNAME home-portal.office.com., CNAME home-office365-com.b-0004.b-msedge.net., CNAME b-0004.b-msedge.net., A 13.107.6.156 (140)
22:59:50.377876 IP 10.0.2.15.55130 > 13.107.6.156.443: Flags [S], seq 4046364947, win 64240, options [mss 1460,sackOK,TS val 2602175196 ecr 0,nop,wscale 6], length 0
22:59:50.392524 IP 13.107.6.156.443 > 10.0.2.15.55130: Flags [S.], seq 393984001, ack 4046364948, win 65535, options [mss 1460], length 0
22:59:50.392569 IP 10.0.2.15.55130 > 13.107.6.156.443: Flags [.], ack 1, win 64240, length 0
22:59:50.401412 IP 10.0.2.15.55130 > 13.107.6.156.443: Flags [P.], seq 1:518, ack 1, win 64240, length 517
22:59:50.401760 IP 13.107.6.156.443 > 10.0.2.15.55130: Flags [.], ack 518, win 65535, length 0
22:59:50.419986 IP 13.107.6.156.443 > 10.0.2.15.55130: Flags [.], seq 1:2921, ack 518, win 65535, length 2920
22:59:50.420004 IP 10.0.2.15.55130 > 13.107.6.156.443: Flags [.], ack 2921, win 62780, length 0
22:59:50.420632 IP 13.107.6.156.443 > 10.0.2.15.55130: Flags [P.], seq 2921:3956, ack 518, win 65535, length 1035
22:59:50.420654 IP 10.0.2.15.55130 > 13.107.6.156.443: Flags [.], ack 3956, win 62780, length 0
22:59:50.424139 IP 10.0.2.15.55130 > 13.107.6.156.443: Flags [P.], seq 518:676, ack 3956, win 62780, length 158
22:59:50.424670 IP 13.107.6.156.443 > 10.0.2.15.55130: Flags [.], ack 676, win 65535, length 0
22:59:50.441948 IP 13.107.6.156.443 > 10.0.2.15.55130: Flags [P.], seq 3956:4076, ack 676, win 65535, length 120
22:59:50.441971 IP 10.0.2.15.55130 > 13.107.6.156.443: Flags [.], ack 4076, win 62780, length 0
22:59:50.442525 IP 10.0.2.15.55130 > 13.107.6.156.443: Flags [P.], seq 676:729, ack 4076, win 62780, length 53
22:59:50.444222 IP 10.0.2.15.55130 > 13.107.6.156.443: Flags [P.], seq 729:785, ack 4076, win 62780, length 56
22:59:50.448080 IP 10.0.2.15.55130 > 13.107.6.156.443: Flags [P.], seq 785:934, ack 4076, win 62780, length 149
22:59:50.451516 IP 13.107.6.156.443 > 10.0.2.15.55130: Flags [.], ack 729, win 65535, length 0
22:59:50.451518 IP 13.107.6.156.443 > 10.0.2.15.55130: Flags [.], ack 785, win 65535, length 0
22:59:50.451518 IP 13.107.6.156.443 > 10.0.2.15.55130: Flags [.], ack 934, win 65535, length 0
22:59:50.461462 IP 13.107.6.156.443 > 10.0.2.15.55130: Flags [P.], seq 4076:4114, ack 934, win 65535, length 38
22:59:50.461560 IP 10.0.2.15.55130 > 13.107.6.156.443: Flags [.], ack 4114, win 62780, length 0

