22:27:09.761802 IP 10.0.2.15.36996 > 140.233.253.2.53: 45291+ A? www.weather.com. (33)
22:27:09.761849 IP 10.0.2.15.36996 > 140.233.253.2.53: 52462+ AAAA? www.weather.com. (33)
22:27:09.767338 IP 140.233.253.2.53 > 10.0.2.15.36996: 52462 2/1/0 CNAME pmd-www.weather.com.edgekey.net., CNAME e11779.ksd.akamaiedge.net. (174)
22:27:09.767339 IP 140.233.253.2.53 > 10.0.2.15.36996: 45291 3/0/0 CNAME pmd-www.weather.com.edgekey.net., CNAME e11779.ksd.akamaiedge.net., A 104.77.227.231 (130)
22:27:09.767629 IP 10.0.2.15.58502 > 104.77.227.231.443: Flags [S], seq 819060293, win 64240, options [mss 1460,sackOK,TS val 7908851 ecr 0,nop,wscale 6], length 0
22:27:09.783828 IP 104.77.227.231.443 > 10.0.2.15.58502: Flags [S.], seq 318912001, ack 819060294, win 65535, options [mss 1460], length 0
22:27:09.783920 IP 10.0.2.15.58502 > 104.77.227.231.443: Flags [.], ack 1, win 64240, length 0
22:27:09.792481 IP 10.0.2.15.58502 > 104.77.227.231.443: Flags [P.], seq 1:518, ack 1, win 64240, length 517
22:27:09.792756 IP 104.77.227.231.443 > 10.0.2.15.58502: Flags [.], ack 518, win 65535, length 0
22:27:09.809403 IP 104.77.227.231.443 > 10.0.2.15.58502: Flags [P.], seq 1:1375, ack 518, win 65535, length 1374
22:27:09.809468 IP 10.0.2.15.58502 > 104.77.227.231.443: Flags [.], ack 1375, win 63204, length 0
22:27:09.810496 IP 104.77.227.231.443 > 10.0.2.15.58502: Flags [P.], seq 1375:3491, ack 518, win 65535, length 2116
22:27:09.810520 IP 10.0.2.15.58502 > 104.77.227.231.443: Flags [.], ack 3491, win 61320, length 0
22:27:09.812218 IP 10.0.2.15.58502 > 104.77.227.231.443: Flags [P.], seq 518:598, ack 3491, win 62780, length 80
22:27:09.812649 IP 104.77.227.231.443 > 10.0.2.15.58502: Flags [.], ack 598, win 65535, length 0
22:27:09.812840 IP 10.0.2.15.58502 > 104.77.227.231.443: Flags [P.], seq 598:644, ack 3491, win 62780, length 46
22:27:09.812880 IP 10.0.2.15.58502 > 104.77.227.231.443: Flags [P.], seq 644:693, ack 3491, win 62780, length 49
22:27:09.813207 IP 104.77.227.231.443 > 10.0.2.15.58502: Flags [.], ack 644, win 65535, length 0
22:27:09.813208 IP 104.77.227.231.443 > 10.0.2.15.58502: Flags [.], ack 693, win 65535, length 0
22:27:09.813224 IP 10.0.2.15.58502 > 104.77.227.231.443: Flags [P.], seq 693:728, ack 3491, win 62780, length 35
22:27:09.813545 IP 104.77.227.231.443 > 10.0.2.15.58502: Flags [.], ack 728, win 65535, length 0
22:27:09.813621 IP 10.0.2.15.58502 > 104.77.227.231.443: Flags [P.], seq 728:790, ack 3491, win 62780, length 62
22:27:09.813880 IP 104.77.227.231.443 > 10.0.2.15.58502: Flags [.], ack 790, win 65535, length 0
22:27:09.828719 IP 104.77.227.231.443 > 10.0.2.15.58502: Flags [P.], seq 3491:4033, ack 790, win 65535, length 542
22:27:09.828742 IP 10.0.2.15.58502 > 104.77.227.231.443: Flags [.], ack 4033, win 62780, length 0
22:27:09.836348 IP 104.77.227.231.443 > 10.0.2.15.58502: Flags [P.], seq 4033:5008, ack 790, win 65535, length 975
22:27:09.836383 IP 10.0.2.15.58502 > 104.77.227.231.443: Flags [.], ack 5008, win 62780, length 0
22:27:09.837178 IP 10.0.2.15.58502 > 104.77.227.231.443: Flags [P.], seq 790:821, ack 5008, win 62780, length 31
22:27:09.837734 IP 104.77.227.231.443 > 10.0.2.15.58502: Flags [.], ack 821, win 65535, length 0
22:27:09.838303 IP 10.0.2.15.58502 > 104.77.227.231.443: Flags [P.], seq 821:845, ack 5008, win 62780, length 24
22:27:09.839744 IP 104.77.227.231.443 > 10.0.2.15.58502: Flags [.], ack 845, win 65535, length 0
22:27:09.840991 IP 10.0.2.15.58502 > 104.77.227.231.443: Flags [F.], seq 845, ack 5008, win 62780, length 0
22:27:09.841406 IP 104.77.227.231.443 > 10.0.2.15.58502: Flags [.], ack 846, win 65535, length 0
22:27:09.854376 IP 104.77.227.231.443 > 10.0.2.15.58502: Flags [P.], seq 5008:5032, ack 846, win 65535, length 24
22:27:09.854379 IP 104.77.227.231.443 > 10.0.2.15.58502: Flags [F.], seq 5032, ack 846, win 65535, length 0
22:27:09.854409 IP 10.0.2.15.58502 > 104.77.227.231.443: Flags [R], seq 819061139, win 0, length 0
22:27:09.854449 IP 10.0.2.15.58502 > 104.77.227.231.443: Flags [R], seq 819061139, win 0, length 0
22:27:09.855859 IP 104.77.227.231.443 > 10.0.2.15.58502: Flags [R.], seq 3976055295, ack 846, win 0, length 0

