22:26:37.392632 IP 10.0.2.15.51897 > 140.233.253.2.53: 8510+ A? www.weather.com. (33)
22:26:37.392680 IP 10.0.2.15.51897 > 140.233.253.2.53: 3363+ AAAA? www.weather.com. (33)
22:26:37.398333 IP 140.233.253.2.53 > 10.0.2.15.51897: 8510 3/0/0 CNAME pmd-www.weather.com.edgekey.net., CNAME e11779.ksd.akamaiedge.net., A 104.77.227.231 (130)
22:26:37.398335 IP 140.233.253.2.53 > 10.0.2.15.51897: 3363 2/1/0 CNAME pmd-www.weather.com.edgekey.net., CNAME e11779.ksd.akamaiedge.net. (174)
22:26:37.398643 IP 10.0.2.15.58490 > 104.77.227.231.443: Flags [S], seq 3935963507, win 64240, options [mss 1460,sackOK,TS val 7876482 ecr 0,nop,wscale 6], length 0
22:26:37.413972 IP 104.77.227.231.443 > 10.0.2.15.58490: Flags [S.], seq 318144001, ack 3935963508, win 65535, options [mss 1460], length 0
22:26:37.414024 IP 10.0.2.15.58490 > 104.77.227.231.443: Flags [.], ack 1, win 64240, length 0
22:26:37.427727 IP 10.0.2.15.58490 > 104.77.227.231.443: Flags [P.], seq 1:518, ack 1, win 64240, length 517
22:26:37.428251 IP 104.77.227.231.443 > 10.0.2.15.58490: Flags [.], ack 518, win 65535, length 0
22:26:37.444818 IP 104.77.227.231.443 > 10.0.2.15.58490: Flags [.], seq 1:2921, ack 518, win 65535, length 2920
22:26:37.444841 IP 10.0.2.15.58490 > 104.77.227.231.443: Flags [.], ack 2921, win 62780, length 0
22:26:37.445222 IP 104.77.227.231.443 > 10.0.2.15.58490: Flags [P.], seq 2921:3491, ack 518, win 65535, length 570
22:26:37.445240 IP 10.0.2.15.58490 > 104.77.227.231.443: Flags [.], ack 3491, win 62210, length 0
22:26:37.446732 IP 10.0.2.15.58490 > 104.77.227.231.443: Flags [P.], seq 518:598, ack 3491, win 62780, length 80
22:26:37.447025 IP 104.77.227.231.443 > 10.0.2.15.58490: Flags [.], ack 598, win 65535, length 0
22:26:37.447101 IP 10.0.2.15.58490 > 104.77.227.231.443: Flags [P.], seq 598:644, ack 3491, win 62780, length 46
22:26:37.447129 IP 10.0.2.15.58490 > 104.77.227.231.443: Flags [P.], seq 644:693, ack 3491, win 62780, length 49
22:26:37.447532 IP 104.77.227.231.443 > 10.0.2.15.58490: Flags [.], ack 644, win 65535, length 0
22:26:37.447534 IP 104.77.227.231.443 > 10.0.2.15.58490: Flags [.], ack 693, win 65535, length 0
22:26:37.447603 IP 10.0.2.15.58490 > 104.77.227.231.443: Flags [P.], seq 693:790, ack 3491, win 62780, length 97
22:26:37.447902 IP 104.77.227.231.443 > 10.0.2.15.58490: Flags [.], ack 790, win 65535, length 0
22:26:37.461642 IP 104.77.227.231.443 > 10.0.2.15.58490: Flags [P.], seq 3491:4033, ack 790, win 65535, length 542
22:26:37.461665 IP 10.0.2.15.58490 > 104.77.227.231.443: Flags [.], ack 4033, win 62780, length 0
22:26:37.464283 IP 104.77.227.231.443 > 10.0.2.15.58490: Flags [P.], seq 4033:4103, ack 790, win 65535, length 70
22:26:37.464305 IP 10.0.2.15.58490 > 104.77.227.231.443: Flags [.], ack 4103, win 62780, length 0
22:26:37.464573 IP 10.0.2.15.58490 > 104.77.227.231.443: Flags [P.], seq 790:821, ack 4103, win 62780, length 31
22:26:37.465006 IP 104.77.227.231.443 > 10.0.2.15.58490: Flags [.], ack 821, win 65535, length 0
22:26:37.468396 IP 104.77.227.231.443 > 10.0.2.15.58490: Flags [P.], seq 4103:5030, ack 821, win 65535, length 927
22:26:37.468415 IP 10.0.2.15.58490 > 104.77.227.231.443: Flags [.], ack 5030, win 62780, length 0
22:26:37.469008 IP 10.0.2.15.58490 > 104.77.227.231.443: Flags [P.], seq 821:845, ack 5030, win 62780, length 24
22:26:37.469349 IP 104.77.227.231.443 > 10.0.2.15.58490: Flags [.], ack 845, win 65535, length 0
22:26:37.470009 IP 10.0.2.15.58490 > 104.77.227.231.443: Flags [F.], seq 845, ack 5030, win 62780, length 0
22:26:37.470373 IP 104.77.227.231.443 > 10.0.2.15.58490: Flags [.], ack 846, win 65535, length 0
22:26:37.483611 IP 104.77.227.231.443 > 10.0.2.15.58490: Flags [P.], seq 5030:5054, ack 846, win 65535, length 24
22:26:37.483617 IP 104.77.227.231.443 > 10.0.2.15.58490: Flags [F.], seq 5054, ack 846, win 65535, length 0
22:26:37.483655 IP 10.0.2.15.58490 > 104.77.227.231.443: Flags [R], seq 3935964353, win 0, length 0
22:26:37.483973 IP 10.0.2.15.58490 > 104.77.227.231.443: Flags [R], seq 3935964353, win 0, length 0
22:26:37.484190 IP 104.77.227.231.443 > 10.0.2.15.58490: Flags [R.], seq 3976823295, ack 846, win 0, length 0

