22:26:48.258988 IP 10.0.2.15.55073 > 140.233.253.2.53: 52598+ A? www.weather.com. (33)
22:26:48.259056 IP 10.0.2.15.55073 > 140.233.253.2.53: 45578+ AAAA? www.weather.com. (33)
22:26:48.267347 IP 140.233.253.2.53 > 10.0.2.15.55073: 52598 3/0/0 CNAME pmd-www.weather.com.edgekey.net., CNAME e11779.ksd.akamaiedge.net., A 104.77.227.231 (130)
22:26:48.267349 IP 140.233.253.2.53 > 10.0.2.15.55073: 45578 2/1/0 CNAME pmd-www.weather.com.edgekey.net., CNAME e11779.ksd.akamaiedge.net. (174)
22:26:48.267653 IP 10.0.2.15.58494 > 104.77.227.231.443: Flags [S], seq 370552444, win 64240, options [mss 1460,sackOK,TS val 7887351 ecr 0,nop,wscale 6], length 0
22:26:48.282511 IP 104.77.227.231.443 > 10.0.2.15.58494: Flags [S.], seq 318400001, ack 370552445, win 65535, options [mss 1460], length 0
22:26:48.282558 IP 10.0.2.15.58494 > 104.77.227.231.443: Flags [.], ack 1, win 64240, length 0
22:26:48.295911 IP 10.0.2.15.58494 > 104.77.227.231.443: Flags [P.], seq 1:518, ack 1, win 64240, length 517
22:26:48.296405 IP 104.77.227.231.443 > 10.0.2.15.58494: Flags [.], ack 518, win 65535, length 0
22:26:48.313469 IP 104.77.227.231.443 > 10.0.2.15.58494: Flags [.], seq 1:2921, ack 518, win 65535, length 2920
22:26:48.313488 IP 10.0.2.15.58494 > 104.77.227.231.443: Flags [.], ack 2921, win 62780, length 0
22:26:48.313806 IP 104.77.227.231.443 > 10.0.2.15.58494: Flags [P.], seq 2921:3492, ack 518, win 65535, length 571
22:26:48.313817 IP 10.0.2.15.58494 > 104.77.227.231.443: Flags [.], ack 3492, win 62209, length 0
22:26:48.314763 IP 10.0.2.15.58494 > 104.77.227.231.443: Flags [P.], seq 518:598, ack 3492, win 62780, length 80
22:26:48.315037 IP 104.77.227.231.443 > 10.0.2.15.58494: Flags [.], ack 598, win 65535, length 0
22:26:48.315192 IP 10.0.2.15.58494 > 104.77.227.231.443: Flags [P.], seq 598:644, ack 3492, win 62780, length 46
22:26:48.315226 IP 10.0.2.15.58494 > 104.77.227.231.443: Flags [P.], seq 644:693, ack 3492, win 62780, length 49
22:26:48.315624 IP 104.77.227.231.443 > 10.0.2.15.58494: Flags [.], ack 644, win 65535, length 0
22:26:48.315625 IP 104.77.227.231.443 > 10.0.2.15.58494: Flags [.], ack 693, win 65535, length 0
22:26:48.315641 IP 10.0.2.15.58494 > 104.77.227.231.443: Flags [P.], seq 693:790, ack 3492, win 62780, length 97
22:26:48.315806 IP 104.77.227.231.443 > 10.0.2.15.58494: Flags [.], ack 790, win 65535, length 0
22:26:48.329606 IP 104.77.227.231.443 > 10.0.2.15.58494: Flags [P.], seq 3492:4126, ack 790, win 65535, length 634
22:26:48.329634 IP 10.0.2.15.58494 > 104.77.227.231.443: Flags [.], ack 4126, win 62780, length 0
22:26:48.330104 IP 10.0.2.15.58494 > 104.77.227.231.443: Flags [P.], seq 790:821, ack 4126, win 62780, length 31
22:26:48.330491 IP 104.77.227.231.443 > 10.0.2.15.58494: Flags [.], ack 821, win 65535, length 0
22:26:48.334799 IP 104.77.227.231.443 > 10.0.2.15.58494: Flags [P.], seq 4126:5053, ack 821, win 65535, length 927
22:26:48.335016 IP 10.0.2.15.58494 > 104.77.227.231.443: Flags [.], ack 5053, win 62780, length 0
22:26:48.335831 IP 10.0.2.15.58494 > 104.77.227.231.443: Flags [P.], seq 821:845, ack 5053, win 62780, length 24
22:26:48.336160 IP 104.77.227.231.443 > 10.0.2.15.58494: Flags [.], ack 845, win 65535, length 0
22:26:48.336792 IP 10.0.2.15.58494 > 104.77.227.231.443: Flags [F.], seq 845, ack 5053, win 62780, length 0
22:26:48.337054 IP 104.77.227.231.443 > 10.0.2.15.58494: Flags [.], ack 846, win 65535, length 0
22:26:48.349607 IP 104.77.227.231.443 > 10.0.2.15.58494: Flags [P.], seq 5053:5077, ack 846, win 65535, length 24
22:26:48.349627 IP 10.0.2.15.58494 > 104.77.227.231.443: Flags [R], seq 370553290, win 0, length 0

