22:24:59.239229 IP 10.0.2.15.37540 > 140.233.253.2.53: 38458+ A? www.weather.com. (33)
22:24:59.239264 IP 10.0.2.15.37540 > 140.233.253.2.53: 18983+ AAAA? www.weather.com. (33)
22:24:59.245329 IP 140.233.253.2.53 > 10.0.2.15.37540: 38458 3/0/0 CNAME pmd-www.weather.com.edgekey.net., CNAME e11779.ksd.akamaiedge.net., A 104.77.227.231 (130)
22:24:59.245331 IP 140.233.253.2.53 > 10.0.2.15.37540: 18983 2/1/0 CNAME pmd-www.weather.com.edgekey.net., CNAME e11779.ksd.akamaiedge.net. (174)
22:24:59.245635 IP 10.0.2.15.58452 > 104.77.227.231.443: Flags [S], seq 3999621330, win 64240, options [mss 1460,sackOK,TS val 7778329 ecr 0,nop,wscale 6], length 0
22:24:59.261410 IP 104.77.227.231.443 > 10.0.2.15.58452: Flags [S.], seq 315840001, ack 3999621331, win 65535, options [mss 1460], length 0
22:24:59.261456 IP 10.0.2.15.58452 > 104.77.227.231.443: Flags [.], ack 1, win 64240, length 0
22:24:59.271720 IP 10.0.2.15.58452 > 104.77.227.231.443: Flags [P.], seq 1:518, ack 1, win 64240, length 517
22:24:59.272021 IP 104.77.227.231.443 > 10.0.2.15.58452: Flags [.], ack 518, win 65535, length 0
22:24:59.289145 IP 104.77.227.231.443 > 10.0.2.15.58452: Flags [P.], seq 1:2749, ack 518, win 65535, length 2748
22:24:59.289170 IP 10.0.2.15.58452 > 104.77.227.231.443: Flags [.], ack 2749, win 62780, length 0
22:24:59.291215 IP 104.77.227.231.443 > 10.0.2.15.58452: Flags [P.], seq 2749:3493, ack 518, win 65535, length 744
22:24:59.291242 IP 10.0.2.15.58452 > 104.77.227.231.443: Flags [.], ack 3493, win 62780, length 0
22:24:59.293109 IP 10.0.2.15.58452 > 104.77.227.231.443: Flags [P.], seq 518:598, ack 3493, win 62780, length 80
22:24:59.293680 IP 104.77.227.231.443 > 10.0.2.15.58452: Flags [.], ack 598, win 65535, length 0
22:24:59.293814 IP 10.0.2.15.58452 > 104.77.227.231.443: Flags [P.], seq 598:644, ack 3493, win 62780, length 46
22:24:59.293862 IP 10.0.2.15.58452 > 104.77.227.231.443: Flags [P.], seq 644:693, ack 3493, win 62780, length 49
22:24:59.294040 IP 10.0.2.15.58452 > 104.77.227.231.443: Flags [P.], seq 693:728, ack 3493, win 62780, length 35
22:24:59.294099 IP 10.0.2.15.58452 > 104.77.227.231.443: Flags [P.], seq 728:790, ack 3493, win 62780, length 62
22:24:59.294518 IP 104.77.227.231.443 > 10.0.2.15.58452: Flags [.], ack 644, win 65535, length 0
22:24:59.294519 IP 104.77.227.231.443 > 10.0.2.15.58452: Flags [.], ack 693, win 65535, length 0
22:24:59.294520 IP 104.77.227.231.443 > 10.0.2.15.58452: Flags [.], ack 728, win 65535, length 0
22:24:59.294819 IP 104.77.227.231.443 > 10.0.2.15.58452: Flags [.], ack 790, win 65535, length 0
22:24:59.308365 IP 104.77.227.231.443 > 10.0.2.15.58452: Flags [P.], seq 3493:4127, ack 790, win 65535, length 634
22:24:59.308389 IP 10.0.2.15.58452 > 104.77.227.231.443: Flags [.], ack 4127, win 62780, length 0
22:24:59.308896 IP 10.0.2.15.58452 > 104.77.227.231.443: Flags [P.], seq 790:821, ack 4127, win 62780, length 31
22:24:59.309307 IP 104.77.227.231.443 > 10.0.2.15.58452: Flags [.], ack 821, win 65535, length 0
22:24:59.314094 IP 104.77.227.231.443 > 10.0.2.15.58452: Flags [P.], seq 4127:5054, ack 821, win 65535, length 927
22:24:59.314196 IP 10.0.2.15.58452 > 104.77.227.231.443: Flags [.], ack 5054, win 62780, length 0
22:24:59.314909 IP 10.0.2.15.58452 > 104.77.227.231.443: Flags [P.], seq 821:845, ack 5054, win 62780, length 24
22:24:59.315303 IP 104.77.227.231.443 > 10.0.2.15.58452: Flags [.], ack 845, win 65535, length 0
22:24:59.316658 IP 10.0.2.15.58452 > 104.77.227.231.443: Flags [F.], seq 845, ack 5054, win 62780, length 0
22:24:59.317044 IP 104.77.227.231.443 > 10.0.2.15.58452: Flags [.], ack 846, win 65535, length 0

