22:25:25.912696 IP 10.0.2.15.60983 > 140.233.253.2.53: 42598+ A? www.weather.com. (33)
22:25:25.912736 IP 10.0.2.15.60983 > 140.233.253.2.53: 2409+ AAAA? www.weather.com. (33)
22:25:25.918355 IP 140.233.253.2.53 > 10.0.2.15.60983: 2409 2/1/0 CNAME pmd-www.weather.com.edgekey.net., CNAME e11779.ksd.akamaiedge.net. (174)
22:25:25.930286 IP 140.233.253.2.53 > 10.0.2.15.60983: 42598 3/0/0 CNAME pmd-www.weather.com.edgekey.net., CNAME e11779.ksd.akamaiedge.net., A 104.77.227.231 (130)
22:25:25.930581 IP 10.0.2.15.58462 > 104.77.227.231.443: Flags [S], seq 3344921590, win 64240, options [mss 1460,sackOK,TS val 7805014 ecr 0,nop,wscale 6], length 0
22:25:25.946744 IP 104.77.227.231.443 > 10.0.2.15.58462: Flags [S.], seq 316480001, ack 3344921591, win 65535, options [mss 1460], length 0
22:25:25.946989 IP 10.0.2.15.58462 > 104.77.227.231.443: Flags [.], ack 1, win 64240, length 0
22:25:25.956226 IP 10.0.2.15.58462 > 104.77.227.231.443: Flags [P.], seq 1:518, ack 1, win 64240, length 517
22:25:25.956497 IP 104.77.227.231.443 > 10.0.2.15.58462: Flags [.], ack 518, win 65535, length 0
22:25:25.971827 IP 104.77.227.231.443 > 10.0.2.15.58462: Flags [P.], seq 1:2749, ack 518, win 65535, length 2748
22:25:25.971844 IP 10.0.2.15.58462 > 104.77.227.231.443: Flags [.], ack 2749, win 62780, length 0
22:25:25.973012 IP 104.77.227.231.443 > 10.0.2.15.58462: Flags [P.], seq 2749:3491, ack 518, win 65535, length 742
22:25:25.973027 IP 10.0.2.15.58462 > 104.77.227.231.443: Flags [.], ack 3491, win 62780, length 0
22:25:25.973815 IP 10.0.2.15.58462 > 104.77.227.231.443: Flags [P.], seq 518:598, ack 3491, win 62780, length 80
22:25:25.974136 IP 104.77.227.231.443 > 10.0.2.15.58462: Flags [.], ack 598, win 65535, length 0
22:25:25.974240 IP 10.0.2.15.58462 > 104.77.227.231.443: Flags [P.], seq 598:644, ack 3491, win 62780, length 46
22:25:25.974273 IP 10.0.2.15.58462 > 104.77.227.231.443: Flags [P.], seq 644:693, ack 3491, win 62780, length 49
22:25:25.974434 IP 104.77.227.231.443 > 10.0.2.15.58462: Flags [.], ack 644, win 65535, length 0
22:25:25.974435 IP 104.77.227.231.443 > 10.0.2.15.58462: Flags [.], ack 693, win 65535, length 0
22:25:25.974452 IP 10.0.2.15.58462 > 104.77.227.231.443: Flags [P.], seq 693:790, ack 3491, win 62780, length 97
22:25:25.974646 IP 104.77.227.231.443 > 10.0.2.15.58462: Flags [.], ack 790, win 65535, length 0
22:25:25.988594 IP 104.77.227.231.443 > 10.0.2.15.58462: Flags [P.], seq 3491:4125, ack 790, win 65535, length 634
22:25:25.988619 IP 10.0.2.15.58462 > 104.77.227.231.443: Flags [.], ack 4125, win 62780, length 0
22:25:25.989130 IP 10.0.2.15.58462 > 104.77.227.231.443: Flags [P.], seq 790:821, ack 4125, win 62780, length 31
22:25:25.989564 IP 104.77.227.231.443 > 10.0.2.15.58462: Flags [.], ack 821, win 65535, length 0
22:25:25.995795 IP 104.77.227.231.443 > 10.0.2.15.58462: Flags [P.], seq 4125:5052, ack 821, win 65535, length 927
22:25:25.995814 IP 10.0.2.15.58462 > 104.77.227.231.443: Flags [.], ack 5052, win 62780, length 0
22:25:25.996302 IP 10.0.2.15.58462 > 104.77.227.231.443: Flags [P.], seq 821:845, ack 5052, win 62780, length 24
22:25:25.996703 IP 104.77.227.231.443 > 10.0.2.15.58462: Flags [.], ack 845, win 65535, length 0
22:25:25.997401 IP 10.0.2.15.58462 > 104.77.227.231.443: Flags [F.], seq 845, ack 5052, win 62780, length 0
22:25:25.997784 IP 104.77.227.231.443 > 10.0.2.15.58462: Flags [.], ack 846, win 65535, length 0

