22:27:25.804549 IP 10.0.2.15.51431 > 140.233.253.2.53: 41984+ A? www.weather.com. (33)
22:27:25.804583 IP 10.0.2.15.51431 > 140.233.253.2.53: 31756+ AAAA? www.weather.com. (33)
22:27:25.809529 IP 140.233.253.2.53 > 10.0.2.15.51431: 31756 2/1/0 CNAME pmd-www.weather.com.edgekey.net., CNAME e11779.ksd.akamaiedge.net. (174)
22:27:25.809530 IP 140.233.253.2.53 > 10.0.2.15.51431: 41984 3/0/0 CNAME pmd-www.weather.com.edgekey.net., CNAME e11779.ksd.akamaiedge.net., A 104.77.227.231 (130)
22:27:25.809767 IP 10.0.2.15.58508 > 104.77.227.231.443: Flags [S], seq 2138369577, win 64240, options [mss 1460,sackOK,TS val 7924893 ecr 0,nop,wscale 6], length 0
22:27:25.825844 IP 104.77.227.231.443 > 10.0.2.15.58508: Flags [S.], seq 319296001, ack 2138369578, win 65535, options [mss 1460], length 0
22:27:25.825897 IP 10.0.2.15.58508 > 104.77.227.231.443: Flags [.], ack 1, win 64240, length 0
22:27:25.833882 IP 10.0.2.15.58508 > 104.77.227.231.443: Flags [P.], seq 1:518, ack 1, win 64240, length 517
22:27:25.834261 IP 104.77.227.231.443 > 10.0.2.15.58508: Flags [.], ack 518, win 65535, length 0
22:27:25.851508 IP 104.77.227.231.443 > 10.0.2.15.58508: Flags [P.], seq 1:2749, ack 518, win 65535, length 2748
22:27:25.851531 IP 10.0.2.15.58508 > 104.77.227.231.443: Flags [.], ack 2749, win 62780, length 0
22:27:25.852277 IP 104.77.227.231.443 > 10.0.2.15.58508: Flags [P.], seq 2749:3491, ack 518, win 65535, length 742
22:27:25.852293 IP 10.0.2.15.58508 > 104.77.227.231.443: Flags [.], ack 3491, win 62038, length 0
22:27:25.853434 IP 10.0.2.15.58508 > 104.77.227.231.443: Flags [P.], seq 518:598, ack 3491, win 62780, length 80
22:27:25.853695 IP 104.77.227.231.443 > 10.0.2.15.58508: Flags [.], ack 598, win 65535, length 0
22:27:25.853712 IP 10.0.2.15.58508 > 104.77.227.231.443: Flags [P.], seq 598:644, ack 3491, win 62780, length 46
22:27:25.853758 IP 10.0.2.15.58508 > 104.77.227.231.443: Flags [P.], seq 644:693, ack 3491, win 62780, length 49
22:27:25.853886 IP 104.77.227.231.443 > 10.0.2.15.58508: Flags [.], ack 644, win 65535, length 0
22:27:25.853895 IP 10.0.2.15.58508 > 104.77.227.231.443: Flags [P.], seq 693:790, ack 3491, win 62780, length 97
22:27:25.854073 IP 104.77.227.231.443 > 10.0.2.15.58508: Flags [.], ack 693, win 65535, length 0
22:27:25.854074 IP 104.77.227.231.443 > 10.0.2.15.58508: Flags [.], ack 790, win 65535, length 0
22:27:25.868508 IP 104.77.227.231.443 > 10.0.2.15.58508: Flags [P.], seq 3491:4125, ack 790, win 65535, length 634
22:27:25.868527 IP 10.0.2.15.58508 > 104.77.227.231.443: Flags [.], ack 4125, win 62780, length 0
22:27:25.868859 IP 10.0.2.15.58508 > 104.77.227.231.443: Flags [P.], seq 790:821, ack 4125, win 62780, length 31
22:27:25.869233 IP 104.77.227.231.443 > 10.0.2.15.58508: Flags [.], ack 821, win 65535, length 0
22:27:25.875380 IP 104.77.227.231.443 > 10.0.2.15.58508: Flags [P.], seq 4125:5052, ack 821, win 65535, length 927
22:27:25.875404 IP 10.0.2.15.58508 > 104.77.227.231.443: Flags [.], ack 5052, win 62780, length 0
22:27:25.876074 IP 10.0.2.15.58508 > 104.77.227.231.443: Flags [P.], seq 821:845, ack 5052, win 62780, length 24
22:27:25.876388 IP 104.77.227.231.443 > 10.0.2.15.58508: Flags [.], ack 845, win 65535, length 0
22:27:25.877018 IP 10.0.2.15.58508 > 104.77.227.231.443: Flags [F.], seq 845, ack 5052, win 62780, length 0
22:27:25.877295 IP 104.77.227.231.443 > 10.0.2.15.58508: Flags [.], ack 846, win 65535, length 0
22:27:25.894552 IP 104.77.227.231.443 > 10.0.2.15.58508: Flags [P.], seq 5052:5076, ack 846, win 65535, length 24
22:27:25.894578 IP 10.0.2.15.58508 > 104.77.227.231.443: Flags [R], seq 2138370423, win 0, length 0
22:27:25.894717 IP 104.77.227.231.443 > 10.0.2.15.58508: Flags [F.], seq 5076, ack 846, win 65535, length 0
22:27:25.894730 IP 10.0.2.15.58508 > 104.77.227.231.443: Flags [R], seq 2138370423, win 0, length 0
22:27:25.894849 IP 104.77.227.231.443 > 10.0.2.15.58508: Flags [R.], seq 3975671295, ack 846, win 0, length 0

