22:23:10.127718 IP 10.0.2.15.45245 > 140.233.253.2.53: 30965+ A? www.weather.com. (33)
22:23:10.127750 IP 10.0.2.15.45245 > 140.233.253.2.53: 57586+ AAAA? www.weather.com. (33)
22:23:10.135015 IP 140.233.253.2.53 > 10.0.2.15.45245: 57586 2/1/0 CNAME pmd-www.weather.com.edgekey.net., CNAME e11779.ksd.akamaiedge.net. (174)
22:23:10.135017 IP 140.233.253.2.53 > 10.0.2.15.45245: 30965 3/0/0 CNAME pmd-www.weather.com.edgekey.net., CNAME e11779.ksd.akamaiedge.net., A 104.77.227.231 (130)
22:23:10.135238 IP 10.0.2.15.58410 > 104.77.227.231.443: Flags [S], seq 2723336366, win 64240, options [mss 1460,sackOK,TS val 7669219 ecr 0,nop,wscale 6], length 0
22:23:10.150353 IP 104.77.227.231.443 > 10.0.2.15.58410: Flags [S.], seq 313408001, ack 2723336367, win 65535, options [mss 1460], length 0
22:23:10.150393 IP 10.0.2.15.58410 > 104.77.227.231.443: Flags [.], ack 1, win 64240, length 0
22:23:10.162611 IP 10.0.2.15.58410 > 104.77.227.231.443: Flags [P.], seq 1:518, ack 1, win 64240, length 517
22:23:10.163075 IP 104.77.227.231.443 > 10.0.2.15.58410: Flags [.], ack 518, win 65535, length 0
22:23:10.179470 IP 104.77.227.231.443 > 10.0.2.15.58410: Flags [P.], seq 1:2749, ack 518, win 65535, length 2748
22:23:10.179545 IP 10.0.2.15.58410 > 104.77.227.231.443: Flags [.], ack 2749, win 62780, length 0
22:23:10.179985 IP 104.77.227.231.443 > 10.0.2.15.58410: Flags [P.], seq 2749:3493, ack 518, win 65535, length 744
22:23:10.180003 IP 10.0.2.15.58410 > 104.77.227.231.443: Flags [.], ack 3493, win 62036, length 0
22:23:10.182774 IP 10.0.2.15.58410 > 104.77.227.231.443: Flags [P.], seq 518:598, ack 3493, win 62780, length 80
22:23:10.183101 IP 104.77.227.231.443 > 10.0.2.15.58410: Flags [.], ack 598, win 65535, length 0
22:23:10.183202 IP 10.0.2.15.58410 > 104.77.227.231.443: Flags [P.], seq 598:644, ack 3493, win 62780, length 46
22:23:10.183234 IP 10.0.2.15.58410 > 104.77.227.231.443: Flags [P.], seq 644:693, ack 3493, win 62780, length 49
22:23:10.183583 IP 104.77.227.231.443 > 10.0.2.15.58410: Flags [.], ack 644, win 65535, length 0
22:23:10.183605 IP 10.0.2.15.58410 > 104.77.227.231.443: Flags [P.], seq 693:790, ack 3493, win 62780, length 97
22:23:10.183840 IP 104.77.227.231.443 > 10.0.2.15.58410: Flags [.], ack 693, win 65535, length 0
22:23:10.183843 IP 104.77.227.231.443 > 10.0.2.15.58410: Flags [.], ack 790, win 65535, length 0
22:23:10.197565 IP 104.77.227.231.443 > 10.0.2.15.58410: Flags [P.], seq 3493:4127, ack 790, win 65535, length 634
22:23:10.197591 IP 10.0.2.15.58410 > 104.77.227.231.443: Flags [.], ack 4127, win 62780, length 0
22:23:10.198060 IP 10.0.2.15.58410 > 104.77.227.231.443: Flags [P.], seq 790:821, ack 4127, win 62780, length 31
22:23:10.198355 IP 104.77.227.231.443 > 10.0.2.15.58410: Flags [.], ack 821, win 65535, length 0
22:23:10.203808 IP 104.77.227.231.443 > 10.0.2.15.58410: Flags [P.], seq 4127:5054, ack 821, win 65535, length 927
22:23:10.203837 IP 10.0.2.15.58410 > 104.77.227.231.443: Flags [.], ack 5054, win 62780, length 0
22:23:10.204405 IP 10.0.2.15.58410 > 104.77.227.231.443: Flags [P.], seq 821:845, ack 5054, win 62780, length 24
22:23:10.205660 IP 104.77.227.231.443 > 10.0.2.15.58410: Flags [.], ack 845, win 65535, length 0
22:23:10.206979 IP 10.0.2.15.58410 > 104.77.227.231.443: Flags [F.], seq 845, ack 5054, win 62780, length 0
22:23:10.207370 IP 104.77.227.231.443 > 10.0.2.15.58410: Flags [.], ack 846, win 65535, length 0
22:23:10.219686 IP 104.77.227.231.443 > 10.0.2.15.58410: Flags [P.], seq 5054:5078, ack 846, win 65535, length 24
22:23:10.219688 IP 104.77.227.231.443 > 10.0.2.15.58410: Flags [F.], seq 5078, ack 846, win 65535, length 0
22:23:10.219786 IP 10.0.2.15.58410 > 104.77.227.231.443: Flags [R], seq 2723337212, win 0, length 0
22:23:10.219822 IP 10.0.2.15.58410 > 104.77.227.231.443: Flags [R], seq 2723337212, win 0, length 0
22:23:10.224078 IP 104.77.227.231.443 > 10.0.2.15.58410: Flags [R.], seq 3981559295, ack 846, win 0, length 0

