22:27:15.124106 IP 10.0.2.15.42343 > 140.233.253.2.53: 17764+ A? www.weather.com. (33)
22:27:15.124144 IP 10.0.2.15.42343 > 140.233.253.2.53: 14443+ AAAA? www.weather.com. (33)
22:27:15.130652 IP 140.233.253.2.53 > 10.0.2.15.42343: 14443 2/1/0 CNAME pmd-www.weather.com.edgekey.net., CNAME e11779.ksd.akamaiedge.net. (174)
22:27:15.142191 IP 140.233.253.2.53 > 10.0.2.15.42343: 17764 3/0/0 CNAME pmd-www.weather.com.edgekey.net., CNAME e11779.ksd.akamaiedge.net., A 104.77.227.231 (130)
22:27:15.142407 IP 10.0.2.15.58504 > 104.77.227.231.443: Flags [S], seq 363580812, win 64240, options [mss 1460,sackOK,TS val 7914226 ecr 0,nop,wscale 6], length 0
22:27:15.159129 IP 104.77.227.231.443 > 10.0.2.15.58504: Flags [S.], seq 319040001, ack 363580813, win 65535, options [mss 1460], length 0
22:27:15.159167 IP 10.0.2.15.58504 > 104.77.227.231.443: Flags [.], ack 1, win 64240, length 0
22:27:15.167843 IP 10.0.2.15.58504 > 104.77.227.231.443: Flags [P.], seq 1:518, ack 1, win 64240, length 517
22:27:15.168227 IP 104.77.227.231.443 > 10.0.2.15.58504: Flags [.], ack 518, win 65535, length 0
22:27:15.185287 IP 104.77.227.231.443 > 10.0.2.15.58504: Flags [.], seq 1:2921, ack 518, win 65535, length 2920
22:27:15.185310 IP 10.0.2.15.58504 > 104.77.227.231.443: Flags [.], ack 2921, win 62780, length 0
22:27:15.185652 IP 104.77.227.231.443 > 10.0.2.15.58504: Flags [P.], seq 2921:3491, ack 518, win 65535, length 570
22:27:15.185667 IP 10.0.2.15.58504 > 104.77.227.231.443: Flags [.], ack 3491, win 62210, length 0
22:27:15.187236 IP 10.0.2.15.58504 > 104.77.227.231.443: Flags [P.], seq 518:598, ack 3491, win 62780, length 80
22:27:15.187647 IP 104.77.227.231.443 > 10.0.2.15.58504: Flags [.], ack 598, win 65535, length 0
22:27:15.187767 IP 10.0.2.15.58504 > 104.77.227.231.443: Flags [P.], seq 598:644, ack 3491, win 62780, length 46
22:27:15.187841 IP 10.0.2.15.58504 > 104.77.227.231.443: Flags [P.], seq 644:693, ack 3491, win 62780, length 49
22:27:15.188204 IP 104.77.227.231.443 > 10.0.2.15.58504: Flags [.], ack 644, win 65535, length 0
22:27:15.188205 IP 104.77.227.231.443 > 10.0.2.15.58504: Flags [.], ack 693, win 65535, length 0
22:27:15.188223 IP 10.0.2.15.58504 > 104.77.227.231.443: Flags [P.], seq 693:790, ack 3491, win 62780, length 97
22:27:15.188689 IP 104.77.227.231.443 > 10.0.2.15.58504: Flags [.], ack 790, win 65535, length 0
22:27:15.207743 IP 104.77.227.231.443 > 10.0.2.15.58504: Flags [P.], seq 3491:4033, ack 790, win 65535, length 542
22:27:15.207760 IP 10.0.2.15.58504 > 104.77.227.231.443: Flags [.], ack 4033, win 62780, length 0
22:27:15.212940 IP 104.77.227.231.443 > 10.0.2.15.58504: Flags [P.], seq 4033:5008, ack 790, win 65535, length 975
22:27:15.212958 IP 10.0.2.15.58504 > 104.77.227.231.443: Flags [.], ack 5008, win 62780, length 0
22:27:15.213222 IP 10.0.2.15.58504 > 104.77.227.231.443: Flags [P.], seq 790:821, ack 5008, win 62780, length 31
22:27:15.213430 IP 104.77.227.231.443 > 10.0.2.15.58504: Flags [.], ack 821, win 65535, length 0
22:27:15.213848 IP 10.0.2.15.58504 > 104.77.227.231.443: Flags [P.], seq 821:845, ack 5008, win 62780, length 24
22:27:15.214121 IP 104.77.227.231.443 > 10.0.2.15.58504: Flags [.], ack 845, win 65535, length 0
22:27:15.214789 IP 10.0.2.15.58504 > 104.77.227.231.443: Flags [F.], seq 845, ack 5008, win 62780, length 0
22:27:15.215127 IP 104.77.227.231.443 > 10.0.2.15.58504: Flags [.], ack 846, win 65535, length 0

