22:24:21.909014 IP 10.0.2.15.33403 > 140.233.253.2.53: 44382+ A? www.weather.com. (33)
22:24:21.909054 IP 10.0.2.15.33403 > 140.233.253.2.53: 33363+ AAAA? www.weather.com. (33)
22:24:21.913390 IP 140.233.253.2.53 > 10.0.2.15.33403: 33363 2/1/0 CNAME pmd-www.weather.com.edgekey.net., CNAME e11779.ksd.akamaiedge.net. (174)
22:24:21.928382 IP 140.233.253.2.53 > 10.0.2.15.33403: 44382 3/0/0 CNAME pmd-www.weather.com.edgekey.net., CNAME e11779.ksd.akamaiedge.net., A 104.77.227.231 (130)
22:24:21.928761 IP 10.0.2.15.58436 > 104.77.227.231.443: Flags [S], seq 4291856072, win 64240, options [mss 1460,sackOK,TS val 7741012 ecr 0,nop,wscale 6], length 0
22:24:21.944752 IP 104.77.227.231.443 > 10.0.2.15.58436: Flags [S.], seq 314944001, ack 4291856073, win 65535, options [mss 1460], length 0
22:24:21.944794 IP 10.0.2.15.58436 > 104.77.227.231.443: Flags [.], ack 1, win 64240, length 0
22:24:21.954721 IP 10.0.2.15.58436 > 104.77.227.231.443: Flags [P.], seq 1:518, ack 1, win 64240, length 517
22:24:21.955122 IP 104.77.227.231.443 > 10.0.2.15.58436: Flags [.], ack 518, win 65535, length 0
22:24:21.971574 IP 104.77.227.231.443 > 10.0.2.15.58436: Flags [.], seq 1:2921, ack 518, win 65535, length 2920
22:24:21.971591 IP 10.0.2.15.58436 > 104.77.227.231.443: Flags [.], ack 2921, win 62780, length 0
22:24:21.971824 IP 104.77.227.231.443 > 10.0.2.15.58436: Flags [P.], seq 2921:3492, ack 518, win 65535, length 571
22:24:21.971839 IP 10.0.2.15.58436 > 104.77.227.231.443: Flags [.], ack 3492, win 62209, length 0
22:24:21.972861 IP 10.0.2.15.58436 > 104.77.227.231.443: Flags [P.], seq 518:598, ack 3492, win 62780, length 80
22:24:21.973060 IP 10.0.2.15.58436 > 104.77.227.231.443: Flags [P.], seq 598:693, ack 3492, win 62780, length 95
22:24:21.973533 IP 104.77.227.231.443 > 10.0.2.15.58436: Flags [.], ack 598, win 65535, length 0
22:24:21.973554 IP 10.0.2.15.58436 > 104.77.227.231.443: Flags [P.], seq 693:790, ack 3492, win 62780, length 97
22:24:21.974161 IP 104.77.227.231.443 > 10.0.2.15.58436: Flags [.], ack 693, win 65535, length 0
22:24:21.974163 IP 104.77.227.231.443 > 10.0.2.15.58436: Flags [.], ack 790, win 65535, length 0
22:24:21.987516 IP 104.77.227.231.443 > 10.0.2.15.58436: Flags [P.], seq 3492:4104, ack 790, win 65535, length 612
22:24:21.987540 IP 10.0.2.15.58436 > 104.77.227.231.443: Flags [.], ack 4104, win 62780, length 0
22:24:21.987995 IP 10.0.2.15.58436 > 104.77.227.231.443: Flags [P.], seq 790:821, ack 4104, win 62780, length 31
22:24:21.988302 IP 104.77.227.231.443 > 10.0.2.15.58436: Flags [.], ack 821, win 65535, length 0

