22:24:43.091067 IP 10.0.2.15.46606 > 140.233.253.2.53: 33564+ A? www.weather.com. (33)
22:24:43.091108 IP 10.0.2.15.46606 > 140.233.253.2.53: 33793+ AAAA? www.weather.com. (33)
22:24:43.098895 IP 140.233.253.2.53 > 10.0.2.15.46606: 33793 2/1/0 CNAME pmd-www.weather.com.edgekey.net., CNAME e11779.ksd.akamaiedge.net. (174)
22:24:43.111424 IP 140.233.253.2.53 > 10.0.2.15.46606: 33564 3/0/0 CNAME pmd-www.weather.com.edgekey.net., CNAME e11779.ksd.akamaiedge.net., A 104.77.227.231 (130)
22:24:43.111736 IP 10.0.2.15.58446 > 104.77.227.231.443: Flags [S], seq 3987055416, win 64240, options [mss 1460,sackOK,TS val 7762195 ecr 0,nop,wscale 6], length 0
22:24:43.127744 IP 104.77.227.231.443 > 10.0.2.15.58446: Flags [S.], seq 315456001, ack 3987055417, win 65535, options [mss 1460], length 0
22:24:43.127792 IP 10.0.2.15.58446 > 104.77.227.231.443: Flags [.], ack 1, win 64240, length 0
22:24:43.136668 IP 10.0.2.15.58446 > 104.77.227.231.443: Flags [P.], seq 1:518, ack 1, win 64240, length 517
22:24:43.137111 IP 104.77.227.231.443 > 10.0.2.15.58446: Flags [.], ack 518, win 65535, length 0
22:24:43.153487 IP 104.77.227.231.443 > 10.0.2.15.58446: Flags [P.], seq 1:2749, ack 518, win 65535, length 2748
22:24:43.153507 IP 10.0.2.15.58446 > 104.77.227.231.443: Flags [.], ack 2749, win 62780, length 0
22:24:43.154071 IP 104.77.227.231.443 > 10.0.2.15.58446: Flags [P.], seq 2749:3492, ack 518, win 65535, length 743
22:24:43.154087 IP 10.0.2.15.58446 > 104.77.227.231.443: Flags [.], ack 3492, win 62037, length 0
22:24:43.155324 IP 10.0.2.15.58446 > 104.77.227.231.443: Flags [P.], seq 518:598, ack 3492, win 62780, length 80
22:24:43.155651 IP 104.77.227.231.443 > 10.0.2.15.58446: Flags [.], ack 598, win 65535, length 0
22:24:43.155749 IP 10.0.2.15.58446 > 104.77.227.231.443: Flags [P.], seq 598:644, ack 3492, win 62780, length 46
22:24:43.155777 IP 10.0.2.15.58446 > 104.77.227.231.443: Flags [P.], seq 644:693, ack 3492, win 62780, length 49
22:24:43.156084 IP 104.77.227.231.443 > 10.0.2.15.58446: Flags [.], ack 644, win 65535, length 0
22:24:43.156085 IP 104.77.227.231.443 > 10.0.2.15.58446: Flags [.], ack 693, win 65535, length 0
22:24:43.156202 IP 10.0.2.15.58446 > 104.77.227.231.443: Flags [P.], seq 693:790, ack 3492, win 62780, length 97
22:24:43.156442 IP 104.77.227.231.443 > 10.0.2.15.58446: Flags [.], ack 790, win 65535, length 0
22:24:43.170506 IP 104.77.227.231.443 > 10.0.2.15.58446: Flags [P.], seq 3492:4034, ack 790, win 65535, length 542
22:24:43.170528 IP 10.0.2.15.58446 > 104.77.227.231.443: Flags [.], ack 4034, win 62780, length 0
22:24:43.175675 IP 104.77.227.231.443 > 10.0.2.15.58446: Flags [P.], seq 4034:5009, ack 790, win 65535, length 975
22:24:43.175697 IP 10.0.2.15.58446 > 104.77.227.231.443: Flags [.], ack 5009, win 62780, length 0
22:24:43.176063 IP 10.0.2.15.58446 > 104.77.227.231.443: Flags [P.], seq 790:821, ack 5009, win 62780, length 31
22:24:43.176352 IP 104.77.227.231.443 > 10.0.2.15.58446: Flags [.], ack 821, win 65535, length 0
22:24:43.176616 IP 10.0.2.15.58446 > 104.77.227.231.443: Flags [P.], seq 821:845, ack 5009, win 62780, length 24
22:24:43.176930 IP 104.77.227.231.443 > 10.0.2.15.58446: Flags [.], ack 845, win 65535, length 0
22:24:43.177794 IP 10.0.2.15.58446 > 104.77.227.231.443: Flags [F.], seq 845, ack 5009, win 62780, length 0
22:24:43.178152 IP 104.77.227.231.443 > 10.0.2.15.58446: Flags [.], ack 846, win 65535, length 0

