22:26:42.789855 IP 10.0.2.15.41159 > 140.233.253.2.53: 45879+ A? www.weather.com. (33)
22:26:42.789891 IP 10.0.2.15.41159 > 140.233.253.2.53: 31793+ AAAA? www.weather.com. (33)
22:26:42.795574 IP 140.233.253.2.53 > 10.0.2.15.41159: 45879 3/0/0 CNAME pmd-www.weather.com.edgekey.net., CNAME e11779.ksd.akamaiedge.net., A 104.77.227.231 (130)
22:26:42.795848 IP 140.233.253.2.53 > 10.0.2.15.41159: 31793 2/1/0 CNAME pmd-www.weather.com.edgekey.net., CNAME e11779.ksd.akamaiedge.net. (174)
22:26:42.796085 IP 10.0.2.15.58492 > 104.77.227.231.443: Flags [S], seq 2556918983, win 64240, options [mss 1460,sackOK,TS val 7881880 ecr 0,nop,wscale 6], length 0
22:26:42.811549 IP 104.77.227.231.443 > 10.0.2.15.58492: Flags [S.], seq 318272001, ack 2556918984, win 65535, options [mss 1460], length 0
22:26:42.811589 IP 10.0.2.15.58492 > 104.77.227.231.443: Flags [.], ack 1, win 64240, length 0
22:26:42.824307 IP 10.0.2.15.58492 > 104.77.227.231.443: Flags [P.], seq 1:518, ack 1, win 64240, length 517
22:26:42.824773 IP 104.77.227.231.443 > 10.0.2.15.58492: Flags [.], ack 518, win 65535, length 0
22:26:42.841433 IP 104.77.227.231.443 > 10.0.2.15.58492: Flags [P.], seq 1:2749, ack 518, win 65535, length 2748
22:26:42.841458 IP 10.0.2.15.58492 > 104.77.227.231.443: Flags [.], ack 2749, win 62780, length 0
22:26:42.843443 IP 104.77.227.231.443 > 10.0.2.15.58492: Flags [P.], seq 2749:3493, ack 518, win 65535, length 744
22:26:42.843483 IP 10.0.2.15.58492 > 104.77.227.231.443: Flags [.], ack 3493, win 62780, length 0
22:26:42.845178 IP 10.0.2.15.58492 > 104.77.227.231.443: Flags [P.], seq 518:598, ack 3493, win 62780, length 80
22:26:42.845887 IP 104.77.227.231.443 > 10.0.2.15.58492: Flags [.], ack 598, win 65535, length 0
22:26:42.846179 IP 10.0.2.15.58492 > 104.77.227.231.443: Flags [P.], seq 598:644, ack 3493, win 62780, length 46
22:26:42.846639 IP 104.77.227.231.443 > 10.0.2.15.58492: Flags [.], ack 644, win 65535, length 0
22:26:42.846918 IP 10.0.2.15.58492 > 104.77.227.231.443: Flags [P.], seq 644:693, ack 3493, win 62780, length 49
22:26:42.847252 IP 10.0.2.15.58492 > 104.77.227.231.443: Flags [P.], seq 693:728, ack 3493, win 62780, length 35
22:26:42.847295 IP 104.77.227.231.443 > 10.0.2.15.58492: Flags [.], ack 693, win 65535, length 0
22:26:42.847523 IP 104.77.227.231.443 > 10.0.2.15.58492: Flags [.], ack 728, win 65535, length 0
22:26:42.847563 IP 10.0.2.15.58492 > 104.77.227.231.443: Flags [P.], seq 728:790, ack 3493, win 62780, length 62
22:26:42.847970 IP 104.77.227.231.443 > 10.0.2.15.58492: Flags [.], ack 790, win 65535, length 0
22:26:42.860276 IP 104.77.227.231.443 > 10.0.2.15.58492: Flags [P.], seq 3493:3764, ack 790, win 65535, length 271
22:26:42.860297 IP 10.0.2.15.58492 > 104.77.227.231.443: Flags [.], ack 3764, win 62780, length 0
22:26:42.861021 IP 104.77.227.231.443 > 10.0.2.15.58492: Flags [P.], seq 3764:4096, ack 790, win 65535, length 332
22:26:42.861036 IP 10.0.2.15.58492 > 104.77.227.231.443: Flags [.], ack 4096, win 62780, length 0
22:26:42.861236 IP 10.0.2.15.58492 > 104.77.227.231.443: Flags [P.], seq 790:821, ack 4096, win 62780, length 31
22:26:42.862226 IP 104.77.227.231.443 > 10.0.2.15.58492: Flags [.], ack 821, win 65535, length 0
22:26:42.876199 IP 104.77.227.231.443 > 10.0.2.15.58492: Flags [P.], seq 4096:5032, ack 821, win 65535, length 936
22:26:42.876225 IP 10.0.2.15.58492 > 104.77.227.231.443: Flags [.], ack 5032, win 62780, length 0
22:26:42.877840 IP 10.0.2.15.58492 > 104.77.227.231.443: Flags [P.], seq 821:845, ack 5032, win 62780, length 24
22:26:42.879097 IP 104.77.227.231.443 > 10.0.2.15.58492: Flags [.], ack 845, win 65535, length 0
22:26:42.880154 IP 10.0.2.15.58492 > 104.77.227.231.443: Flags [F.], seq 845, ack 5032, win 62780, length 0
22:26:42.880785 IP 104.77.227.231.443 > 10.0.2.15.58492: Flags [.], ack 846, win 65535, length 0
22:26:42.893368 IP 104.77.227.231.443 > 10.0.2.15.58492: Flags [P.], seq 5032:5056, ack 846, win 65535, length 24
22:26:42.893370 IP 104.77.227.231.443 > 10.0.2.15.58492: Flags [F.], seq 5056, ack 846, win 65535, length 0
22:26:42.893394 IP 10.0.2.15.58492 > 104.77.227.231.443: Flags [R], seq 2556919829, win 0, length 0
22:26:42.893421 IP 10.0.2.15.58492 > 104.77.227.231.443: Flags [R], seq 2556919829, win 0, length 0
22:26:42.893822 IP 104.77.227.231.443 > 10.0.2.15.58492: Flags [R.], seq 3976695295, ack 846, win 0, length 0

