22:20:18.511272 IP 10.0.2.15.40972 > 140.233.253.2.53: 42970+ A? www.msn.com. (29)
22:20:18.511739 IP 10.0.2.15.40972 > 140.233.253.2.53: 46550+ AAAA? www.msn.com. (29)
22:20:18.517487 IP 140.233.253.2.53 > 10.0.2.15.40972: 42970 3/0/0 CNAME www-msn-com.a-0003.a-msedge.net., CNAME a-0003.a-msedge.net., A 204.79.197.203 (104)
22:20:18.519204 IP 140.233.253.2.53 > 10.0.2.15.40972: 46550 2/1/0 CNAME www-msn-com.a-0003.a-msedge.net., CNAME a-0003.a-msedge.net. (145)
22:20:18.519494 IP 10.0.2.15.60356 > 204.79.197.203.443: Flags [S], seq 1334111943, win 64240, options [mss 1460,sackOK,TS val 1800075621 ecr 0,nop,wscale 6], length 0
22:20:18.535437 IP 204.79.197.203.443 > 10.0.2.15.60356: Flags [S.], seq 309120001, ack 1334111944, win 65535, options [mss 1460], length 0
22:20:18.535524 IP 10.0.2.15.60356 > 204.79.197.203.443: Flags [.], ack 1, win 64240, length 0
22:20:18.551521 IP 10.0.2.15.60356 > 204.79.197.203.443: Flags [P.], seq 1:518, ack 1, win 64240, length 517
22:20:18.552006 IP 204.79.197.203.443 > 10.0.2.15.60356: Flags [.], ack 518, win 65535, length 0
22:20:18.570955 IP 204.79.197.203.443 > 10.0.2.15.60356: Flags [.], seq 1:2921, ack 518, win 65535, length 2920
22:20:18.570980 IP 10.0.2.15.60356 > 204.79.197.203.443: Flags [.], ack 2921, win 62780, length 0
22:20:18.571897 IP 204.79.197.203.443 > 10.0.2.15.60356: Flags [P.], seq 2921:3934, ack 518, win 65535, length 1013
22:20:18.571920 IP 10.0.2.15.60356 > 204.79.197.203.443: Flags [.], ack 3934, win 61767, length 0

