22:17:06.727251 IP 10.0.2.15.45534 > 140.233.253.2.53: 22802+ A? www.msn.com. (29)
22:17:06.727298 IP 10.0.2.15.45534 > 140.233.253.2.53: 49420+ AAAA? www.msn.com. (29)
22:17:06.732804 IP 140.233.253.2.53 > 10.0.2.15.45534: 22802 3/0/0 CNAME www-msn-com.a-0003.a-msedge.net., CNAME a-0003.a-msedge.net., A 204.79.197.203 (104)
22:17:06.732806 IP 140.233.253.2.53 > 10.0.2.15.45534: 49420 2/1/0 CNAME www-msn-com.a-0003.a-msedge.net., CNAME a-0003.a-msedge.net. (145)
22:17:06.733143 IP 10.0.2.15.60288 > 204.79.197.203.443: Flags [S], seq 2845248755, win 64240, options [mss 1460,sackOK,TS val 1799883835 ecr 0,nop,wscale 6], length 0
22:17:06.748517 IP 204.79.197.203.443 > 10.0.2.15.60288: Flags [S.], seq 304064001, ack 2845248756, win 65535, options [mss 1460], length 0
22:17:06.748570 IP 10.0.2.15.60288 > 204.79.197.203.443: Flags [.], ack 1, win 64240, length 0
22:17:06.759169 IP 10.0.2.15.60288 > 204.79.197.203.443: Flags [P.], seq 1:518, ack 1, win 64240, length 517
22:17:06.759441 IP 204.79.197.203.443 > 10.0.2.15.60288: Flags [.], ack 518, win 65535, length 0
22:17:06.775015 IP 204.79.197.203.443 > 10.0.2.15.60288: Flags [P.], seq 1:2773, ack 518, win 65535, length 2772
22:17:06.775037 IP 10.0.2.15.60288 > 204.79.197.203.443: Flags [.], ack 2773, win 62780, length 0
22:17:06.776053 IP 204.79.197.203.443 > 10.0.2.15.60288: Flags [P.], seq 2773:3934, ack 518, win 65535, length 1161
22:17:06.776068 IP 10.0.2.15.60288 > 204.79.197.203.443: Flags [.], ack 3934, win 62780, length 0
22:17:06.781006 IP 10.0.2.15.60288 > 204.79.197.203.443: Flags [P.], seq 518:676, ack 3934, win 62780, length 158
22:17:06.781279 IP 204.79.197.203.443 > 10.0.2.15.60288: Flags [.], ack 676, win 65535, length 0
22:17:06.794766 IP 204.79.197.203.443 > 10.0.2.15.60288: Flags [P.], seq 3934:3985, ack 676, win 65535, length 51
22:17:06.794787 IP 10.0.2.15.60288 > 204.79.197.203.443: Flags [.], ack 3985, win 62780, length 0
22:17:06.795206 IP 10.0.2.15.60288 > 204.79.197.203.443: Flags [P.], seq 676:729, ack 3985, win 62780, length 53
22:17:06.795238 IP 10.0.2.15.60288 > 204.79.197.203.443: Flags [P.], seq 729:785, ack 3985, win 62780, length 56
22:17:06.795521 IP 204.79.197.203.443 > 10.0.2.15.60288: Flags [.], ack 729, win 65535, length 0
22:17:06.795523 IP 204.79.197.203.443 > 10.0.2.15.60288: Flags [.], ack 785, win 65535, length 0
22:17:06.795539 IP 10.0.2.15.60288 > 204.79.197.203.443: Flags [P.], seq 785:894, ack 3985, win 62780, length 109
22:17:06.795867 IP 204.79.197.203.443 > 10.0.2.15.60288: Flags [.], ack 894, win 65535, length 0
22:17:06.797003 IP 204.79.197.203.443 > 10.0.2.15.60288: Flags [P.], seq 3985:4054, ack 894, win 65535, length 69
22:17:06.797023 IP 10.0.2.15.60288 > 204.79.197.203.443: Flags [.], ack 4054, win 62780, length 0
22:17:06.797259 IP 10.0.2.15.60288 > 204.79.197.203.443: Flags [P.], seq 894:932, ack 4054, win 62780, length 38
22:17:06.797579 IP 204.79.197.203.443 > 10.0.2.15.60288: Flags [.], ack 932, win 65535, length 0
22:17:06.808962 IP 204.79.197.203.443 > 10.0.2.15.60288: Flags [P.], seq 4054:4092, ack 932, win 65535, length 38
22:17:06.808983 IP 10.0.2.15.60288 > 204.79.197.203.443: Flags [.], ack 4092, win 62780, length 0

