22:18:46.212828 IP 10.0.2.15.41795 > 140.233.253.2.53: 35996+ A? www.msn.com. (29)
22:18:46.212868 IP 10.0.2.15.41795 > 140.233.253.2.53: 45983+ AAAA? www.msn.com. (29)
22:18:46.217490 IP 140.233.253.2.53 > 10.0.2.15.41795: 45983 2/1/0 CNAME www-msn-com.a-0003.a-msedge.net., CNAME a-0003.a-msedge.net. (145)
22:18:46.217493 IP 140.233.253.2.53 > 10.0.2.15.41795: 35996 3/0/0 CNAME www-msn-com.a-0003.a-msedge.net., CNAME a-0003.a-msedge.net., A 204.79.197.203 (104)
22:18:46.217911 IP 10.0.2.15.60322 > 204.79.197.203.443: Flags [S], seq 1649088930, win 64240, options [mss 1460,sackOK,TS val 1799983320 ecr 0,nop,wscale 6], length 0
22:18:46.235376 IP 204.79.197.203.443 > 10.0.2.15.60322: Flags [S.], seq 306624001, ack 1649088931, win 65535, options [mss 1460], length 0
22:18:46.235420 IP 10.0.2.15.60322 > 204.79.197.203.443: Flags [.], ack 1, win 64240, length 0
22:18:46.245256 IP 10.0.2.15.60322 > 204.79.197.203.443: Flags [P.], seq 1:518, ack 1, win 64240, length 517
22:18:46.245561 IP 204.79.197.203.443 > 10.0.2.15.60322: Flags [.], ack 518, win 65535, length 0
22:18:46.262811 IP 204.79.197.203.443 > 10.0.2.15.60322: Flags [P.], seq 1:2773, ack 518, win 65535, length 2772
22:18:46.262835 IP 10.0.2.15.60322 > 204.79.197.203.443: Flags [.], ack 2773, win 62780, length 0
22:18:46.263380 IP 204.79.197.203.443 > 10.0.2.15.60322: Flags [P.], seq 2773:3934, ack 518, win 65535, length 1161
22:18:46.263390 IP 10.0.2.15.60322 > 204.79.197.203.443: Flags [.], ack 3934, win 62780, length 0
22:18:46.267417 IP 10.0.2.15.60322 > 204.79.197.203.443: Flags [P.], seq 518:676, ack 3934, win 62780, length 158
22:18:46.267788 IP 204.79.197.203.443 > 10.0.2.15.60322: Flags [.], ack 676, win 65535, length 0
22:18:46.284090 IP 204.79.197.203.443 > 10.0.2.15.60322: Flags [P.], seq 3934:4054, ack 676, win 65535, length 120
22:18:46.284112 IP 10.0.2.15.60322 > 204.79.197.203.443: Flags [.], ack 4054, win 62780, length 0
22:18:46.284569 IP 10.0.2.15.60322 > 204.79.197.203.443: Flags [P.], seq 676:729, ack 4054, win 62780, length 53
22:18:46.284600 IP 10.0.2.15.60322 > 204.79.197.203.443: Flags [P.], seq 729:785, ack 4054, win 62780, length 56
22:18:46.284828 IP 204.79.197.203.443 > 10.0.2.15.60322: Flags [.], ack 729, win 65535, length 0
22:18:46.284868 IP 10.0.2.15.60322 > 204.79.197.203.443: Flags [P.], seq 785:894, ack 4054, win 62780, length 109
22:18:46.285031 IP 204.79.197.203.443 > 10.0.2.15.60322: Flags [.], ack 785, win 65535, length 0
22:18:46.285032 IP 204.79.197.203.443 > 10.0.2.15.60322: Flags [.], ack 894, win 65535, length 0
22:18:46.285150 IP 10.0.2.15.60322 > 204.79.197.203.443: Flags [P.], seq 894:932, ack 4054, win 62780, length 38
22:18:46.285313 IP 204.79.197.203.443 > 10.0.2.15.60322: Flags [.], ack 932, win 65535, length 0
22:18:46.298843 IP 204.79.197.203.443 > 10.0.2.15.60322: Flags [P.], seq 4054:4092, ack 932, win 65535, length 38
22:18:46.298865 IP 10.0.2.15.60322 > 204.79.197.203.443: Flags [.], ack 4092, win 62780, length 0

