23:08:05.751423 IP 10.0.2.15.50942 > 140.233.253.2.53: 38015+ A? www.duckduckgo.com. (36)
23:08:05.751462 IP 10.0.2.15.50942 > 140.233.253.2.53: 12920+ AAAA? www.duckduckgo.com. (36)
23:08:05.757583 IP 140.233.253.2.53 > 10.0.2.15.50942: 38015 2/0/0 CNAME duckduckgo.com., A 52.149.246.39 (66)
23:08:05.757585 IP 140.233.253.2.53 > 10.0.2.15.50942: 12920 1/1/0 CNAME duckduckgo.com. (115)
23:08:05.757886 IP 10.0.2.15.56356 > 52.149.246.39.443: Flags [S], seq 2709864761, win 64240, options [mss 1460,sackOK,TS val 2477334120 ecr 0,nop,wscale 6], length 0
23:08:05.777615 IP 52.149.246.39.443 > 10.0.2.15.56356: Flags [S.], seq 406016001, ack 2709864762, win 65535, options [mss 1460], length 0
23:08:05.777664 IP 10.0.2.15.56356 > 52.149.246.39.443: Flags [.], ack 1, win 64240, length 0
23:08:05.786335 IP 10.0.2.15.56356 > 52.149.246.39.443: Flags [P.], seq 1:518, ack 1, win 64240, length 517
23:08:05.786797 IP 52.149.246.39.443 > 10.0.2.15.56356: Flags [.], ack 518, win 65535, length 0
23:08:05.807912 IP 52.149.246.39.443 > 10.0.2.15.56356: Flags [.], seq 1:2921, ack 518, win 65535, length 2920
23:08:05.807932 IP 10.0.2.15.56356 > 52.149.246.39.443: Flags [.], ack 2921, win 62780, length 0
23:08:05.808089 IP 52.149.246.39.443 > 10.0.2.15.56356: Flags [P.], seq 2921:3535, ack 518, win 65535, length 614
23:08:05.808100 IP 10.0.2.15.56356 > 52.149.246.39.443: Flags [.], ack 3535, win 62166, length 0
23:08:05.809001 IP 10.0.2.15.56356 > 52.149.246.39.443: Flags [P.], seq 518:598, ack 3535, win 62780, length 80
23:08:05.809336 IP 52.149.246.39.443 > 10.0.2.15.56356: Flags [.], ack 598, win 65535, length 0
23:08:05.809396 IP 10.0.2.15.56356 > 52.149.246.39.443: Flags [P.], seq 598:644, ack 3535, win 62780, length 46
23:08:05.809429 IP 10.0.2.15.56356 > 52.149.246.39.443: Flags [P.], seq 644:693, ack 3535, win 62780, length 49
23:08:05.809686 IP 52.149.246.39.443 > 10.0.2.15.56356: Flags [.], ack 644, win 65535, length 0
23:08:05.809687 IP 52.149.246.39.443 > 10.0.2.15.56356: Flags [.], ack 693, win 65535, length 0
23:08:05.809706 IP 10.0.2.15.56356 > 52.149.246.39.443: Flags [P.], seq 693:793, ack 3535, win 62780, length 100
23:08:05.809980 IP 52.149.246.39.443 > 10.0.2.15.56356: Flags [.], ack 793, win 65535, length 0
23:08:05.827783 IP 52.149.246.39.443 > 10.0.2.15.56356: Flags [P.], seq 3535:4171, ack 793, win 65535, length 636
23:08:05.827806 IP 10.0.2.15.56356 > 52.149.246.39.443: Flags [.], ack 4171, win 62780, length 0

