23:08:58.145490 IP 10.0.2.15.43495 > 140.233.253.2.53: 26476+ A? www.duckduckgo.com. (36)
23:08:58.145531 IP 10.0.2.15.43495 > 140.233.253.2.53: 46434+ AAAA? www.duckduckgo.com. (36)
23:08:58.152119 IP 140.233.253.2.53 > 10.0.2.15.43495: 26476 2/0/0 CNAME duckduckgo.com., A 52.149.246.39 (66)
23:08:58.152121 IP 140.233.253.2.53 > 10.0.2.15.43495: 46434 1/1/0 CNAME duckduckgo.com. (115)
23:08:58.152420 IP 10.0.2.15.56378 > 52.149.246.39.443: Flags [S], seq 3420271031, win 64240, options [mss 1460,sackOK,TS val 2477386514 ecr 0,nop,wscale 6], length 0
23:08:58.173941 IP 52.149.246.39.443 > 10.0.2.15.56378: Flags [S.], seq 407296001, ack 3420271032, win 65535, options [mss 1460], length 0
23:08:58.173993 IP 10.0.2.15.56378 > 52.149.246.39.443: Flags [.], ack 1, win 64240, length 0
23:08:58.182139 IP 10.0.2.15.56378 > 52.149.246.39.443: Flags [P.], seq 1:518, ack 1, win 64240, length 517
23:08:58.182610 IP 52.149.246.39.443 > 10.0.2.15.56378: Flags [.], ack 518, win 65535, length 0
23:08:58.204941 IP 52.149.246.39.443 > 10.0.2.15.56378: Flags [.], seq 1:2921, ack 518, win 65535, length 2920
23:08:58.204963 IP 10.0.2.15.56378 > 52.149.246.39.443: Flags [.], ack 2921, win 62780, length 0
23:08:58.205332 IP 52.149.246.39.443 > 10.0.2.15.56378: Flags [P.], seq 2921:3535, ack 518, win 65535, length 614
23:08:58.205347 IP 10.0.2.15.56378 > 52.149.246.39.443: Flags [.], ack 3535, win 62166, length 0
23:08:58.206378 IP 10.0.2.15.56378 > 52.149.246.39.443: Flags [P.], seq 518:598, ack 3535, win 62780, length 80
23:08:58.206657 IP 52.149.246.39.443 > 10.0.2.15.56378: Flags [.], ack 598, win 65535, length 0
23:08:58.206828 IP 10.0.2.15.56378 > 52.149.246.39.443: Flags [P.], seq 598:644, ack 3535, win 62780, length 46
23:08:58.206859 IP 10.0.2.15.56378 > 52.149.246.39.443: Flags [P.], seq 644:693, ack 3535, win 62780, length 49
23:08:58.207208 IP 52.149.246.39.443 > 10.0.2.15.56378: Flags [.], ack 644, win 65535, length 0
23:08:58.207210 IP 52.149.246.39.443 > 10.0.2.15.56378: Flags [.], ack 693, win 65535, length 0
23:08:58.207230 IP 10.0.2.15.56378 > 52.149.246.39.443: Flags [P.], seq 693:793, ack 3535, win 62780, length 100
23:08:58.207535 IP 52.149.246.39.443 > 10.0.2.15.56378: Flags [.], ack 793, win 65535, length 0

