23:08:37.240287 IP 10.0.2.15.46088 > 140.233.253.2.53: 4764+ A? www.duckduckgo.com. (36)
23:08:37.240328 IP 10.0.2.15.46088 > 140.233.253.2.53: 49537+ AAAA? www.duckduckgo.com. (36)
23:08:37.245447 IP 140.233.253.2.53 > 10.0.2.15.46088: 4764 2/0/0 CNAME duckduckgo.com., A 52.149.246.39 (66)
23:08:37.245449 IP 140.233.253.2.53 > 10.0.2.15.46088: 49537 1/1/0 CNAME duckduckgo.com. (115)
23:08:37.245702 IP 10.0.2.15.56368 > 52.149.246.39.443: Flags [S], seq 1981268725, win 64240, options [mss 1460,sackOK,TS val 2477365607 ecr 0,nop,wscale 6], length 0
23:08:37.266445 IP 52.149.246.39.443 > 10.0.2.15.56368: Flags [S.], seq 406784001, ack 1981268726, win 65535, options [mss 1460], length 0
23:08:37.266492 IP 10.0.2.15.56368 > 52.149.246.39.443: Flags [.], ack 1, win 64240, length 0
23:08:37.274186 IP 10.0.2.15.56368 > 52.149.246.39.443: Flags [P.], seq 1:518, ack 1, win 64240, length 517
23:08:37.274539 IP 52.149.246.39.443 > 10.0.2.15.56368: Flags [.], ack 518, win 65535, length 0
23:08:37.295170 IP 52.149.246.39.443 > 10.0.2.15.56368: Flags [P.], seq 1:2749, ack 518, win 65535, length 2748
23:08:37.295194 IP 10.0.2.15.56368 > 52.149.246.39.443: Flags [.], ack 2749, win 62780, length 0
23:08:37.298521 IP 52.149.246.39.443 > 10.0.2.15.56368: Flags [P.], seq 2749:3535, ack 518, win 65535, length 786
23:08:37.298548 IP 10.0.2.15.56368 > 52.149.246.39.443: Flags [.], ack 3535, win 62780, length 0
23:08:37.299776 IP 10.0.2.15.56368 > 52.149.246.39.443: Flags [P.], seq 518:598, ack 3535, win 62780, length 80
23:08:37.301356 IP 52.149.246.39.443 > 10.0.2.15.56368: Flags [.], ack 598, win 65535, length 0
23:08:37.301771 IP 10.0.2.15.56368 > 52.149.246.39.443: Flags [P.], seq 598:644, ack 3535, win 62780, length 46
23:08:37.301960 IP 10.0.2.15.56368 > 52.149.246.39.443: Flags [P.], seq 644:693, ack 3535, win 62780, length 49
23:08:37.302335 IP 52.149.246.39.443 > 10.0.2.15.56368: Flags [.], ack 644, win 65535, length 0
23:08:37.302337 IP 52.149.246.39.443 > 10.0.2.15.56368: Flags [.], ack 693, win 65535, length 0
23:08:37.302471 IP 10.0.2.15.56368 > 52.149.246.39.443: Flags [P.], seq 693:728, ack 3535, win 62780, length 35
23:08:37.302634 IP 52.149.246.39.443 > 10.0.2.15.56368: Flags [.], ack 728, win 65535, length 0
23:08:37.302741 IP 10.0.2.15.56368 > 52.149.246.39.443: Flags [P.], seq 728:793, ack 3535, win 62780, length 65
23:08:37.302902 IP 52.149.246.39.443 > 10.0.2.15.56368: Flags [.], ack 793, win 65535, length 0
23:08:37.318685 IP 52.149.246.39.443 > 10.0.2.15.56368: Flags [P.], seq 3535:4109, ack 793, win 65535, length 574
23:08:37.318708 IP 10.0.2.15.56368 > 52.149.246.39.443: Flags [.], ack 4109, win 62780, length 0
23:08:37.321047 IP 52.149.246.39.443 > 10.0.2.15.56368: Flags [P.], seq 4109:4202, ack 793, win 65535, length 93
23:08:37.321069 IP 10.0.2.15.56368 > 52.149.246.39.443: Flags [.], ack 4202, win 62780, length 0
23:08:37.321324 IP 10.0.2.15.56368 > 52.149.246.39.443: Flags [P.], seq 793:824, ack 4202, win 62780, length 31

