23:11:45.732398 IP 10.0.2.15.43386 > 140.233.253.2.53: 14302+ A? www.duckduckgo.com. (36)
23:11:45.732447 IP 10.0.2.15.43386 > 140.233.253.2.53: 43484+ AAAA? www.duckduckgo.com. (36)
23:11:45.738438 IP 140.233.253.2.53 > 10.0.2.15.43386: 14302 2/0/0 CNAME duckduckgo.com., A 52.149.246.39 (66)
23:11:45.738441 IP 140.233.253.2.53 > 10.0.2.15.43386: 43484 1/1/0 CNAME duckduckgo.com. (115)
23:11:45.738775 IP 10.0.2.15.56446 > 52.149.246.39.443: Flags [S], seq 3736235803, win 64240, options [mss 1460,sackOK,TS val 2477554100 ecr 0,nop,wscale 6], length 0
23:11:45.758848 IP 52.149.246.39.443 > 10.0.2.15.56446: Flags [S.], seq 411392001, ack 3736235804, win 65535, options [mss 1460], length 0
23:11:45.758890 IP 10.0.2.15.56446 > 52.149.246.39.443: Flags [.], ack 1, win 64240, length 0
23:11:45.767992 IP 10.0.2.15.56446 > 52.149.246.39.443: Flags [P.], seq 1:518, ack 1, win 64240, length 517
23:11:45.768336 IP 52.149.246.39.443 > 10.0.2.15.56446: Flags [.], ack 518, win 65535, length 0
23:11:45.789185 IP 52.149.246.39.443 > 10.0.2.15.56446: Flags [.], seq 1:2921, ack 518, win 65535, length 2920
23:11:45.789207 IP 10.0.2.15.56446 > 52.149.246.39.443: Flags [.], ack 2921, win 62780, length 0
23:11:45.789472 IP 52.149.246.39.443 > 10.0.2.15.56446: Flags [P.], seq 2921:3535, ack 518, win 65535, length 614
23:11:45.789487 IP 10.0.2.15.56446 > 52.149.246.39.443: Flags [.], ack 3535, win 62166, length 0
23:11:45.790705 IP 10.0.2.15.56446 > 52.149.246.39.443: Flags [P.], seq 518:598, ack 3535, win 62780, length 80
23:11:45.790987 IP 52.149.246.39.443 > 10.0.2.15.56446: Flags [.], ack 598, win 65535, length 0
23:11:45.791173 IP 10.0.2.15.56446 > 52.149.246.39.443: Flags [P.], seq 598:644, ack 3535, win 62780, length 46
23:11:45.791204 IP 10.0.2.15.56446 > 52.149.246.39.443: Flags [P.], seq 644:693, ack 3535, win 62780, length 49
23:11:45.791817 IP 52.149.246.39.443 > 10.0.2.15.56446: Flags [.], ack 644, win 65535, length 0
23:11:45.791819 IP 52.149.246.39.443 > 10.0.2.15.56446: Flags [.], ack 693, win 65535, length 0
23:11:45.791845 IP 10.0.2.15.56446 > 52.149.246.39.443: Flags [P.], seq 693:728, ack 3535, win 62780, length 35
23:11:45.792063 IP 10.0.2.15.56446 > 52.149.246.39.443: Flags [P.], seq 728:793, ack 3535, win 62780, length 65
23:11:45.792124 IP 52.149.246.39.443 > 10.0.2.15.56446: Flags [.], ack 728, win 65535, length 0
23:11:45.792398 IP 52.149.246.39.443 > 10.0.2.15.56446: Flags [.], ack 793, win 65535, length 0

