23:11:19.589715 IP 10.0.2.15.42540 > 140.233.253.2.53: 36354+ A? www.duckduckgo.com. (36)
23:11:19.589746 IP 10.0.2.15.42540 > 140.233.253.2.53: 270+ AAAA? www.duckduckgo.com. (36)
23:11:19.595740 IP 140.233.253.2.53 > 10.0.2.15.42540: 36354 2/0/0 CNAME duckduckgo.com., A 52.149.246.39 (66)
23:11:19.596213 IP 140.233.253.2.53 > 10.0.2.15.42540: 270 1/1/0 CNAME duckduckgo.com. (115)
23:11:19.596386 IP 10.0.2.15.56434 > 52.149.246.39.443: Flags [S], seq 2777517405, win 64240, options [mss 1460,sackOK,TS val 2477527958 ecr 0,nop,wscale 6], length 0
23:11:19.617543 IP 52.149.246.39.443 > 10.0.2.15.56434: Flags [S.], seq 410752001, ack 2777517406, win 65535, options [mss 1460], length 0
23:11:19.617595 IP 10.0.2.15.56434 > 52.149.246.39.443: Flags [.], ack 1, win 64240, length 0
23:11:19.625886 IP 10.0.2.15.56434 > 52.149.246.39.443: Flags [P.], seq 1:518, ack 1, win 64240, length 517
23:11:19.626293 IP 52.149.246.39.443 > 10.0.2.15.56434: Flags [.], ack 518, win 65535, length 0
23:11:19.647794 IP 52.149.246.39.443 > 10.0.2.15.56434: Flags [P.], seq 1:2749, ack 518, win 65535, length 2748
23:11:19.647817 IP 10.0.2.15.56434 > 52.149.246.39.443: Flags [.], ack 2749, win 62780, length 0
23:11:19.649930 IP 52.149.246.39.443 > 10.0.2.15.56434: Flags [P.], seq 2749:3535, ack 518, win 65535, length 786
23:11:19.649952 IP 10.0.2.15.56434 > 52.149.246.39.443: Flags [.], ack 3535, win 62780, length 0
23:11:19.650992 IP 10.0.2.15.56434 > 52.149.246.39.443: Flags [P.], seq 518:598, ack 3535, win 62780, length 80
23:11:19.651375 IP 52.149.246.39.443 > 10.0.2.15.56434: Flags [.], ack 598, win 65535, length 0
23:11:19.651702 IP 10.0.2.15.56434 > 52.149.246.39.443: Flags [P.], seq 598:644, ack 3535, win 62780, length 46
23:11:19.651741 IP 10.0.2.15.56434 > 52.149.246.39.443: Flags [P.], seq 644:693, ack 3535, win 62780, length 49
23:11:19.651990 IP 10.0.2.15.56434 > 52.149.246.39.443: Flags [P.], seq 693:728, ack 3535, win 62780, length 35
23:11:19.652021 IP 52.149.246.39.443 > 10.0.2.15.56434: Flags [.], ack 644, win 65535, length 0
23:11:19.652022 IP 52.149.246.39.443 > 10.0.2.15.56434: Flags [.], ack 693, win 65535, length 0
23:11:19.652098 IP 10.0.2.15.56434 > 52.149.246.39.443: Flags [P.], seq 728:793, ack 3535, win 62780, length 65
23:11:19.652184 IP 52.149.246.39.443 > 10.0.2.15.56434: Flags [.], ack 728, win 65535, length 0
23:11:19.652346 IP 52.149.246.39.443 > 10.0.2.15.56434: Flags [.], ack 793, win 65535, length 0

