23:09:45.322768 IP 10.0.2.15.43436 > 140.233.253.2.53: 47346+ A? www.duckduckgo.com. (36)
23:09:45.322809 IP 10.0.2.15.43436 > 140.233.253.2.53: 14349+ AAAA? www.duckduckgo.com. (36)
23:09:45.327773 IP 140.233.253.2.53 > 10.0.2.15.43436: 47346 2/0/0 CNAME duckduckgo.com., A 52.149.246.39 (66)
23:09:45.327775 IP 140.233.253.2.53 > 10.0.2.15.43436: 14349 1/1/0 CNAME duckduckgo.com. (115)
23:09:45.328081 IP 10.0.2.15.56396 > 52.149.246.39.443: Flags [S], seq 3205046486, win 64240, options [mss 1460,sackOK,TS val 2477433690 ecr 0,nop,wscale 6], length 0
23:09:45.346928 IP 52.149.246.39.443 > 10.0.2.15.56396: Flags [S.], seq 408448001, ack 3205046487, win 65535, options [mss 1460], length 0
23:09:45.346974 IP 10.0.2.15.56396 > 52.149.246.39.443: Flags [.], ack 1, win 64240, length 0
23:09:45.355797 IP 10.0.2.15.56396 > 52.149.246.39.443: Flags [P.], seq 1:518, ack 1, win 64240, length 517
23:09:45.356100 IP 52.149.246.39.443 > 10.0.2.15.56396: Flags [.], ack 518, win 65535, length 0
23:09:45.376878 IP 52.149.246.39.443 > 10.0.2.15.56396: Flags [P.], seq 1:2749, ack 518, win 65535, length 2748
23:09:45.376901 IP 10.0.2.15.56396 > 52.149.246.39.443: Flags [.], ack 2749, win 62780, length 0
23:09:45.378805 IP 52.149.246.39.443 > 10.0.2.15.56396: Flags [P.], seq 2749:3535, ack 518, win 65535, length 786
23:09:45.378829 IP 10.0.2.15.56396 > 52.149.246.39.443: Flags [.], ack 3535, win 62780, length 0
23:09:45.379721 IP 10.0.2.15.56396 > 52.149.246.39.443: Flags [P.], seq 518:598, ack 3535, win 62780, length 80
23:09:45.379959 IP 10.0.2.15.56396 > 52.149.246.39.443: Flags [P.], seq 598:644, ack 3535, win 62780, length 46
23:09:45.380025 IP 52.149.246.39.443 > 10.0.2.15.56396: Flags [.], ack 598, win 65535, length 0
23:09:45.380075 IP 10.0.2.15.56396 > 52.149.246.39.443: Flags [P.], seq 644:693, ack 3535, win 62780, length 49
23:09:45.380214 IP 52.149.246.39.443 > 10.0.2.15.56396: Flags [.], ack 644, win 65535, length 0
23:09:45.380320 IP 10.0.2.15.56396 > 52.149.246.39.443: Flags [P.], seq 693:728, ack 3535, win 62780, length 35
23:09:45.380485 IP 52.149.246.39.443 > 10.0.2.15.56396: Flags [.], ack 693, win 65535, length 0
23:09:45.380487 IP 52.149.246.39.443 > 10.0.2.15.56396: Flags [.], ack 728, win 65535, length 0
23:09:45.380543 IP 10.0.2.15.56396 > 52.149.246.39.443: Flags [P.], seq 728:793, ack 3535, win 62780, length 65
23:09:45.380725 IP 52.149.246.39.443 > 10.0.2.15.56396: Flags [.], ack 793, win 65535, length 0
23:09:45.398651 IP 52.149.246.39.443 > 10.0.2.15.56396: Flags [P.], seq 3535:4558, ack 793, win 65535, length 1023
23:09:45.398673 IP 10.0.2.15.56396 > 52.149.246.39.443: Flags [.], ack 4558, win 62780, length 0
23:09:45.399094 IP 10.0.2.15.56396 > 52.149.246.39.443: Flags [P.], seq 793:824, ack 4558, win 62780, length 31
23:09:45.399623 IP 52.149.246.39.443 > 10.0.2.15.56396: Flags [.], ack 824, win 65535, length 0
23:09:45.399990 IP 10.0.2.15.56396 > 52.149.246.39.443: Flags [P.], seq 824:848, ack 4558, win 62780, length 24
23:09:45.400353 IP 52.149.246.39.443 > 10.0.2.15.56396: Flags [.], ack 848, win 65535, length 0
23:09:45.401174 IP 10.0.2.15.56396 > 52.149.246.39.443: Flags [F.], seq 848, ack 4558, win 62780, length 0
23:09:45.401441 IP 52.149.246.39.443 > 10.0.2.15.56396: Flags [.], ack 849, win 65535, length 0

