23:10:27.103289 IP 10.0.2.15.58311 > 140.233.253.2.53: 2334+ A? www.duckduckgo.com. (36)
23:10:27.103330 IP 10.0.2.15.58311 > 140.233.253.2.53: 49954+ AAAA? www.duckduckgo.com. (36)
23:10:27.108897 IP 140.233.253.2.53 > 10.0.2.15.58311: 49954 1/1/0 CNAME duckduckgo.com. (115)
23:10:27.108899 IP 140.233.253.2.53 > 10.0.2.15.58311: 2334 2/0/0 CNAME duckduckgo.com., A 52.149.246.39 (66)
23:10:27.109122 IP 10.0.2.15.56414 > 52.149.246.39.443: Flags [S], seq 253422042, win 64240, options [mss 1460,sackOK,TS val 2477475471 ecr 0,nop,wscale 6], length 0
23:10:27.128347 IP 52.149.246.39.443 > 10.0.2.15.56414: Flags [S.], seq 409472001, ack 253422043, win 65535, options [mss 1460], length 0
23:10:27.128392 IP 10.0.2.15.56414 > 52.149.246.39.443: Flags [.], ack 1, win 64240, length 0
23:10:27.137300 IP 10.0.2.15.56414 > 52.149.246.39.443: Flags [P.], seq 1:518, ack 1, win 64240, length 517
23:10:27.137621 IP 52.149.246.39.443 > 10.0.2.15.56414: Flags [.], ack 518, win 65535, length 0
23:10:27.159350 IP 52.149.246.39.443 > 10.0.2.15.56414: Flags [P.], seq 1:2749, ack 518, win 65535, length 2748
23:10:27.159373 IP 10.0.2.15.56414 > 52.149.246.39.443: Flags [.], ack 2749, win 62780, length 0
23:10:27.160044 IP 52.149.246.39.443 > 10.0.2.15.56414: Flags [P.], seq 2749:3535, ack 518, win 65535, length 786
23:10:27.160056 IP 10.0.2.15.56414 > 52.149.246.39.443: Flags [.], ack 3535, win 62780, length 0
23:10:27.161185 IP 10.0.2.15.56414 > 52.149.246.39.443: Flags [P.], seq 518:598, ack 3535, win 62780, length 80
23:10:27.161657 IP 52.149.246.39.443 > 10.0.2.15.56414: Flags [.], ack 598, win 65535, length 0
23:10:27.161711 IP 10.0.2.15.56414 > 52.149.246.39.443: Flags [P.], seq 598:644, ack 3535, win 62780, length 46
23:10:27.161792 IP 10.0.2.15.56414 > 52.149.246.39.443: Flags [P.], seq 644:693, ack 3535, win 62780, length 49
23:10:27.162093 IP 52.149.246.39.443 > 10.0.2.15.56414: Flags [.], ack 644, win 65535, length 0
23:10:27.162095 IP 52.149.246.39.443 > 10.0.2.15.56414: Flags [.], ack 693, win 65535, length 0
23:10:27.162120 IP 10.0.2.15.56414 > 52.149.246.39.443: Flags [P.], seq 693:793, ack 3535, win 62780, length 100
23:10:27.162244 IP 52.149.246.39.443 > 10.0.2.15.56414: Flags [.], ack 793, win 65535, length 0
23:10:27.180628 IP 52.149.246.39.443 > 10.0.2.15.56414: Flags [P.], seq 3535:4558, ack 793, win 65535, length 1023
23:10:27.180687 IP 10.0.2.15.56414 > 52.149.246.39.443: Flags [.], ack 4558, win 62780, length 0
23:10:27.181299 IP 10.0.2.15.56414 > 52.149.246.39.443: Flags [P.], seq 793:824, ack 4558, win 62780, length 31
23:10:27.181613 IP 52.149.246.39.443 > 10.0.2.15.56414: Flags [.], ack 824, win 65535, length 0
23:10:27.181891 IP 10.0.2.15.56414 > 52.149.246.39.443: Flags [P.], seq 824:848, ack 4558, win 62780, length 24
23:10:27.182116 IP 52.149.246.39.443 > 10.0.2.15.56414: Flags [.], ack 848, win 65535, length 0
23:10:27.182953 IP 10.0.2.15.56414 > 52.149.246.39.443: Flags [F.], seq 848, ack 4558, win 62780, length 0
23:10:27.183207 IP 52.149.246.39.443 > 10.0.2.15.56414: Flags [.], ack 849, win 65535, length 0

