23:07:49.979875 IP 10.0.2.15.50795 > 140.233.253.2.53: 38978+ A? www.duckduckgo.com. (36)
23:07:49.979920 IP 10.0.2.15.50795 > 140.233.253.2.53: 9039+ AAAA? www.duckduckgo.com. (36)
23:07:49.984922 IP 140.233.253.2.53 > 10.0.2.15.50795: 38978 2/0/0 CNAME duckduckgo.com., A 52.149.246.39 (66)
23:07:49.986594 IP 140.233.253.2.53 > 10.0.2.15.50795: 9039 1/1/0 CNAME duckduckgo.com. (115)
23:07:49.986833 IP 10.0.2.15.56350 > 52.149.246.39.443: Flags [S], seq 2806877135, win 64240, options [mss 1460,sackOK,TS val 2477318349 ecr 0,nop,wscale 6], length 0
23:07:50.005912 IP 52.149.246.39.443 > 10.0.2.15.56350: Flags [S.], seq 405632001, ack 2806877136, win 65535, options [mss 1460], length 0
23:07:50.005957 IP 10.0.2.15.56350 > 52.149.246.39.443: Flags [.], ack 1, win 64240, length 0
23:07:50.014288 IP 10.0.2.15.56350 > 52.149.246.39.443: Flags [P.], seq 1:518, ack 1, win 64240, length 517
23:07:50.014636 IP 52.149.246.39.443 > 10.0.2.15.56350: Flags [.], ack 518, win 65535, length 0
23:07:50.035621 IP 52.149.246.39.443 > 10.0.2.15.56350: Flags [P.], seq 1:2749, ack 518, win 65535, length 2748
23:07:50.035645 IP 10.0.2.15.56350 > 52.149.246.39.443: Flags [.], ack 2749, win 62780, length 0
23:07:50.037869 IP 52.149.246.39.443 > 10.0.2.15.56350: Flags [P.], seq 2749:3535, ack 518, win 65535, length 786
23:07:50.037892 IP 10.0.2.15.56350 > 52.149.246.39.443: Flags [.], ack 3535, win 62780, length 0
23:07:50.039396 IP 10.0.2.15.56350 > 52.149.246.39.443: Flags [P.], seq 518:598, ack 3535, win 62780, length 80
23:07:50.039736 IP 52.149.246.39.443 > 10.0.2.15.56350: Flags [.], ack 598, win 65535, length 0
23:07:50.039924 IP 10.0.2.15.56350 > 52.149.246.39.443: Flags [P.], seq 598:644, ack 3535, win 62780, length 46
23:07:50.040288 IP 52.149.246.39.443 > 10.0.2.15.56350: Flags [.], ack 644, win 65535, length 0
23:07:50.040339 IP 10.0.2.15.56350 > 52.149.246.39.443: Flags [P.], seq 644:693, ack 3535, win 62780, length 49
23:07:50.040404 IP 10.0.2.15.56350 > 52.149.246.39.443: Flags [P.], seq 693:793, ack 3535, win 62780, length 100
23:07:50.040646 IP 52.149.246.39.443 > 10.0.2.15.56350: Flags [.], ack 693, win 65535, length 0
23:07:50.040775 IP 52.149.246.39.443 > 10.0.2.15.56350: Flags [.], ack 793, win 65535, length 0
23:07:50.058484 IP 52.149.246.39.443 > 10.0.2.15.56350: Flags [P.], seq 3535:4171, ack 793, win 65535, length 636
23:07:50.058931 IP 10.0.2.15.56350 > 52.149.246.39.443: Flags [.], ack 4171, win 62780, length 0
23:07:50.059275 IP 52.149.246.39.443 > 10.0.2.15.56350: Flags [P.], seq 4171:4558, ack 793, win 65535, length 387
23:07:50.059294 IP 10.0.2.15.56350 > 52.149.246.39.443: Flags [.], ack 4558, win 62780, length 0
23:07:50.059622 IP 10.0.2.15.56350 > 52.149.246.39.443: Flags [P.], seq 793:824, ack 4558, win 62780, length 31
23:07:50.060016 IP 52.149.246.39.443 > 10.0.2.15.56350: Flags [.], ack 824, win 65535, length 0
23:07:50.060215 IP 10.0.2.15.56350 > 52.149.246.39.443: Flags [P.], seq 824:848, ack 4558, win 62780, length 24
23:07:50.060520 IP 52.149.246.39.443 > 10.0.2.15.56350: Flags [.], ack 848, win 65535, length 0
23:07:50.061948 IP 10.0.2.15.56350 > 52.149.246.39.443: Flags [F.], seq 848, ack 4558, win 62780, length 0
23:07:50.062283 IP 52.149.246.39.443 > 10.0.2.15.56350: Flags [.], ack 849, win 65535, length 0

