22:33:52.585210 IP 10.0.2.15.53399 > 140.233.253.2.53: 16742+ A? www.craigslist.com. (36)
22:33:52.585241 IP 10.0.2.15.53399 > 140.233.253.2.53: 33890+ AAAA? www.craigslist.com. (36)
22:33:52.590814 IP 140.233.253.2.53 > 10.0.2.15.53399: 16742 1/0/0 A 208.82.238.135 (52)
22:33:52.590816 IP 140.233.253.2.53 > 10.0.2.15.53399: 33890 0/1/0 (102)
22:33:52.591097 IP 10.0.2.15.35210 > 208.82.238.135.443: Flags [S], seq 18892397, win 64240, options [mss 1460,sackOK,TS val 1542678446 ecr 0,nop,wscale 6], length 0

