22:37:50.132011 IP 10.0.2.15.40092 > 140.233.253.2.53: 42542+ A? www.craigslist.com. (36)
22:37:50.132049 IP 10.0.2.15.40092 > 140.233.253.2.53: 31528+ AAAA? www.craigslist.com. (36)
22:37:50.137276 IP 140.233.253.2.53 > 10.0.2.15.40092: 42542 1/0/0 A 208.82.238.135 (52)
22:37:50.137433 IP 140.233.253.2.53 > 10.0.2.15.40092: 31528 0/1/0 (102)
22:37:50.137612 IP 10.0.2.15.35302 > 208.82.238.135.443: Flags [S], seq 3665055059, win 64240, options [mss 1460,sackOK,TS val 1542915992 ecr 0,nop,wscale 6], length 0

