22:34:32.408781 IP 10.0.2.15.33437 > 140.233.253.2.53: 21650+ A? www.craigslist.com. (36)
22:34:32.408813 IP 10.0.2.15.33437 > 140.233.253.2.53: 13469+ AAAA? www.craigslist.com. (36)
22:34:32.414266 IP 140.233.253.2.53 > 10.0.2.15.33437: 21650 1/0/0 A 208.82.238.135 (52)
22:34:32.414268 IP 140.233.253.2.53 > 10.0.2.15.33437: 13469 0/1/0 (102)
22:34:32.414511 IP 10.0.2.15.35226 > 208.82.238.135.443: Flags [S], seq 2202554508, win 64240, options [mss 1460,sackOK,TS val 1542718269 ecr 0,nop,wscale 6], length 0

