22:38:23.641107 IP 10.0.2.15.45955 > 140.233.253.2.53: 47462+ A? www.craigslist.com. (36)
22:38:23.641150 IP 10.0.2.15.45955 > 140.233.253.2.53: 34145+ AAAA? www.craigslist.com. (36)
22:38:23.647185 IP 140.233.253.2.53 > 10.0.2.15.45955: 47462 1/0/0 A 208.82.238.135 (52)
22:38:23.647187 IP 140.233.253.2.53 > 10.0.2.15.45955: 34145 0/1/0 (102)
22:38:23.647441 IP 10.0.2.15.35314 > 208.82.238.135.443: Flags [S], seq 1742409605, win 64240, options [mss 1460,sackOK,TS val 1542949502 ecr 0,nop,wscale 6], length 0

