22:36:53.534841 IP 10.0.2.15.52741 > 140.233.253.2.53: 32658+ A? www.craigslist.com. (36)
22:36:53.534885 IP 10.0.2.15.52741 > 140.233.253.2.53: 18583+ AAAA? www.craigslist.com. (36)
22:36:53.541849 IP 140.233.253.2.53 > 10.0.2.15.52741: 18583 0/1/0 (102)
22:36:53.541851 IP 140.233.253.2.53 > 10.0.2.15.52741: 32658 1/0/0 A 208.82.238.135 (52)
22:36:53.542146 IP 10.0.2.15.35280 > 208.82.238.135.443: Flags [S], seq 3823660990, win 64240, options [mss 1460,sackOK,TS val 1542859397 ecr 0,nop,wscale 6], length 0

