22:33:58.290141 IP 10.0.2.15.49870 > 140.233.253.2.53: 44275+ A? www.craigslist.com. (36)
22:33:58.290172 IP 10.0.2.15.49870 > 140.233.253.2.53: 24567+ AAAA? www.craigslist.com. (36)
22:33:58.295983 IP 140.233.253.2.53 > 10.0.2.15.49870: 44275 1/0/0 A 208.82.238.135 (52)
22:33:58.295985 IP 140.233.253.2.53 > 10.0.2.15.49870: 24567 0/1/0 (102)
22:33:58.296309 IP 10.0.2.15.35212 > 208.82.238.135.443: Flags [S], seq 3645593676, win 64240, options [mss 1460,sackOK,TS val 1542684151 ecr 0,nop,wscale 6], length 0

