22:36:19.906377 IP 10.0.2.15.50722 > 140.233.253.2.53: 55648+ A? www.craigslist.com. (36)
22:36:19.906417 IP 10.0.2.15.50722 > 140.233.253.2.53: 22371+ AAAA? www.craigslist.com. (36)
22:36:19.912234 IP 140.233.253.2.53 > 10.0.2.15.50722: 55648 1/0/0 A 208.82.238.135 (52)
22:36:19.912236 IP 140.233.253.2.53 > 10.0.2.15.50722: 22371 0/1/0 (102)
22:36:19.912488 IP 10.0.2.15.35266 > 208.82.238.135.443: Flags [S], seq 935153631, win 64240, options [mss 1460,sackOK,TS val 1542825767 ecr 0,nop,wscale 6], length 0

