22:37:21.843840 IP 10.0.2.15.56585 > 140.233.253.2.53: 62302+ A? www.craigslist.com. (36)
22:37:21.844656 IP 10.0.2.15.56585 > 140.233.253.2.53: 35649+ AAAA? www.craigslist.com. (36)
22:37:21.848448 IP 140.233.253.2.53 > 10.0.2.15.56585: 62302 1/0/0 A 208.82.238.135 (52)
22:37:21.848451 IP 140.233.253.2.53 > 10.0.2.15.56585: 35649 0/1/0 (102)
22:37:21.849114 IP 10.0.2.15.35292 > 208.82.238.135.443: Flags [S], seq 565474193, win 64240, options [mss 1460,sackOK,TS val 1542887704 ecr 0,nop,wscale 6], length 0
22:37:21.931429 IP 208.82.238.135.443 > 10.0.2.15.35292: Flags [S.], seq 360128001, ack 565474194, win 65535, options [mss 1460], length 0
22:37:21.931477 IP 10.0.2.15.35292 > 208.82.238.135.443: Flags [.], ack 1, win 64240, length 0

