22:34:43.700718 IP 10.0.2.15.39541 > 140.233.253.2.53: 902+ A? www.craigslist.com. (36)
22:34:43.700791 IP 10.0.2.15.39541 > 140.233.253.2.53: 6555+ AAAA? www.craigslist.com. (36)
22:34:43.705782 IP 140.233.253.2.53 > 10.0.2.15.39541: 902 1/0/0 A 208.82.238.135 (52)
22:34:43.705784 IP 140.233.253.2.53 > 10.0.2.15.39541: 6555 0/1/0 (102)
22:34:43.706086 IP 10.0.2.15.35230 > 208.82.238.135.443: Flags [S], seq 3965913461, win 64240, options [mss 1460,sackOK,TS val 1542729561 ecr 0,nop,wscale 6], length 0
22:34:43.791258 IP 208.82.238.135.443 > 10.0.2.15.35230: Flags [S.], seq 338560001, ack 3965913462, win 65535, options [mss 1460], length 0
22:34:43.791295 IP 10.0.2.15.35230 > 208.82.238.135.443: Flags [.], ack 1, win 64240, length 0
22:34:43.798883 IP 10.0.2.15.35230 > 208.82.238.135.443: Flags [P.], seq 1:518, ack 1, win 64240, length 517
22:34:43.799327 IP 208.82.238.135.443 > 10.0.2.15.35230: Flags [.], ack 518, win 65535, length 0

