22:35:57.578333 IP 10.0.2.15.44654 > 140.233.253.2.53: 36188+ A? www.craigslist.com. (36)
22:35:57.578375 IP 10.0.2.15.44654 > 140.233.253.2.53: 63585+ AAAA? www.craigslist.com. (36)
22:35:57.583305 IP 140.233.253.2.53 > 10.0.2.15.44654: 36188 1/0/0 A 208.82.238.135 (52)
22:35:57.583306 IP 140.233.253.2.53 > 10.0.2.15.44654: 63585 0/1/0 (102)
22:35:57.583661 IP 10.0.2.15.35258 > 208.82.238.135.443: Flags [S], seq 307107989, win 64240, options [mss 1460,sackOK,TS val 1542803438 ecr 0,nop,wscale 6], length 0

