22:33:29.862347 IP 10.0.2.15.52698 > 140.233.253.2.53: 29093+ A? www.craigslist.com. (36)
22:33:29.862390 IP 10.0.2.15.52698 > 140.233.253.2.53: 40359+ AAAA? www.craigslist.com. (36)
22:33:29.868306 IP 140.233.253.2.53 > 10.0.2.15.52698: 29093 1/0/0 A 208.82.238.135 (52)
22:33:29.868309 IP 140.233.253.2.53 > 10.0.2.15.52698: 40359 0/1/0 (102)
22:33:29.868608 IP 10.0.2.15.35202 > 208.82.238.135.443: Flags [S], seq 3714410312, win 64240, options [mss 1460,sackOK,TS val 1542655723 ecr 0,nop,wscale 6], length 0
22:33:29.950390 IP 208.82.238.135.443 > 10.0.2.15.35202: Flags [S.], seq 328576001, ack 3714410313, win 65535, options [mss 1460], length 0
22:33:29.950435 IP 10.0.2.15.35202 > 208.82.238.135.443: Flags [.], ack 1, win 64240, length 0
22:33:29.958789 IP 10.0.2.15.35202 > 208.82.238.135.443: Flags [P.], seq 1:518, ack 1, win 64240, length 517
22:33:29.959200 IP 208.82.238.135.443 > 10.0.2.15.35202: Flags [.], ack 518, win 65535, length 0

