22:35:29.646463 IP 10.0.2.15.36146 > 140.233.253.2.53: 56292+ A? www.craigslist.com. (36)
22:35:29.646490 IP 10.0.2.15.36146 > 140.233.253.2.53: 9697+ AAAA? www.craigslist.com. (36)
22:35:29.651596 IP 140.233.253.2.53 > 10.0.2.15.36146: 56292 1/0/0 A 208.82.238.135 (52)
22:35:29.651599 IP 140.233.253.2.53 > 10.0.2.15.36146: 9697 0/1/0 (102)
22:35:29.652067 IP 10.0.2.15.35248 > 208.82.238.135.443: Flags [S], seq 700460573, win 64240, options [mss 1460,sackOK,TS val 1542775507 ecr 0,nop,wscale 6], length 0

