22:36:31.080838 IP 10.0.2.15.45932 > 140.233.253.2.53: 7144+ A? www.craigslist.com. (36)
22:36:31.080879 IP 10.0.2.15.45932 > 140.233.253.2.53: 38639+ AAAA? www.craigslist.com. (36)
22:36:31.086663 IP 140.233.253.2.53 > 10.0.2.15.45932: 7144 1/0/0 A 208.82.238.135 (52)
22:36:31.088125 IP 140.233.253.2.53 > 10.0.2.15.45932: 38639 0/1/0 (102)
22:36:31.088541 IP 10.0.2.15.35270 > 208.82.238.135.443: Flags [S], seq 572281405, win 64240, options [mss 1460,sackOK,TS val 1542836943 ecr 0,nop,wscale 6], length 0

