13:05:41.699955 IP 140.233.253.2.53 > 10.0.2.15.56958: 25188 2/0/0 CNAME dualstack.reddit.map.fastly.net., AAAA 2a04:4e42:1c::396 (105)
13:05:41.700315 IP 140.233.253.2.53 > 10.0.2.15.56958: 18025 2/0/0 CNAME dualstack.reddit.map.fastly.net., A 151.101.117.140 (93)
13:05:41.700650 IP 10.0.2.15.43244 > 151.101.117.140.443: Flags [S], seq 3149104216, win 64240, options [mss 1460,sackOK,TS val 4091101858 ecr 0,nop,wscale 6], length 0
13:05:41.715625 IP 151.101.117.140.443 > 10.0.2.15.43244: Flags [S.], seq 25728001, ack 3149104217, win 65535, options [mss 1460], length 0
13:05:41.715732 IP 10.0.2.15.43244 > 151.101.117.140.443: Flags [.], ack 1, win 64240, length 0
13:05:41.724078 IP 10.0.2.15.43244 > 151.101.117.140.443: Flags [P.], seq 1:518, ack 1, win 64240, length 517
13:05:41.724683 IP 151.101.117.140.443 > 10.0.2.15.43244: Flags [.], ack 518, win 65535, length 0
13:05:41.740312 IP 151.101.117.140.443 > 10.0.2.15.43244: Flags [P.], seq 1:2749, ack 518, win 65535, length 2748
13:05:41.740335 IP 10.0.2.15.43244 > 151.101.117.140.443: Flags [.], ack 2749, win 62780, length 0
13:05:41.742578 IP 151.101.117.140.443 > 10.0.2.15.43244: Flags [P.], seq 2749:3722, ack 518, win 65535, length 973
13:05:41.742603 IP 10.0.2.15.43244 > 151.101.117.140.443: Flags [.], ack 3722, win 62780, length 0
13:05:41.743887 IP 10.0.2.15.43244 > 151.101.117.140.443: Flags [P.], seq 518:598, ack 3722, win 62780, length 80
13:05:41.744148 IP 10.0.2.15.43244 > 151.101.117.140.443: Flags [P.], seq 598:644, ack 3722, win 62780, length 46
13:05:41.744181 IP 10.0.2.15.43244 > 151.101.117.140.443: Flags [P.], seq 644:693, ack 3722, win 62780, length 49
13:05:41.744255 IP 10.0.2.15.43244 > 151.101.117.140.443: Flags [P.], seq 693:728, ack 3722, win 62780, length 35
13:05:41.744316 IP 10.0.2.15.43244 > 151.101.117.140.443: Flags [P.], seq 728:790, ack 3722, win 62780, length 62
13:05:41.744801 IP 151.101.117.140.443 > 10.0.2.15.43244: Flags [.], ack 598, win 65535, length 0
13:05:41.744803 IP 151.101.117.140.443 > 10.0.2.15.43244: Flags [.], ack 644, win 65535, length 0
13:05:41.744804 IP 151.101.117.140.443 > 10.0.2.15.43244: Flags [.], ack 693, win 65535, length 0
13:05:41.744804 IP 151.101.117.140.443 > 10.0.2.15.43244: Flags [.], ack 728, win 65535, length 0
13:05:41.744944 IP 151.101.117.140.443 > 10.0.2.15.43244: Flags [.], ack 790, win 65535, length 0
13:05:41.958159 IP 151.101.117.140.443 > 10.0.2.15.43244: Flags [P.], seq 3722:3781, ack 790, win 65535, length 59
13:05:41.958177 IP 10.0.2.15.43244 > 151.101.117.140.443: Flags [.], ack 3781, win 62780, length 0
13:05:41.958345 IP 10.0.2.15.43244 > 151.101.117.140.443: Flags [P.], seq 790:821, ack 3781, win 62780, length 31
13:05:41.958621 IP 151.101.117.140.443 > 10.0.2.15.43244: Flags [.], ack 821, win 65535, length 0
13:05:42.103534 IP 151.101.117.140.443 > 10.0.2.15.43244: Flags [.], seq 3781:11081, ack 821, win 65535, length 7300
13:05:42.103563 IP 10.0.2.15.43244 > 151.101.117.140.443: Flags [.], ack 11081, win 59860, length 0
13:05:42.104073 IP 151.101.117.140.443 > 10.0.2.15.43244: Flags [.], seq 11081:19841, ack 821, win 65535, length 8760
13:05:42.104097 IP 10.0.2.15.43244 > 151.101.117.140.443: Flags [.], ack 19841, win 54020, length 0
13:05:42.104563 IP 151.101.117.140.443 > 10.0.2.15.43244: Flags [.], seq 19841:30061, ack 821, win 65535, length 10220
13:05:42.104579 IP 10.0.2.15.43244 > 151.101.117.140.443: Flags [.], ack 30061, win 46720, length 0
13:05:42.104862 IP 151.101.117.140.443 > 10.0.2.15.43244: Flags [P.], seq 30061:39505, ack 821, win 65535, length 9444
13:05:42.104871 IP 10.0.2.15.43244 > 151.101.117.140.443: Flags [.], ack 39505, win 40880, length 0
13:05:42.107568 IP 151.101.117.140.443 > 10.0.2.15.43244: Flags [P.], seq 39505:45001, ack 821, win 65535, length 5496
13:05:42.107583 IP 10.0.2.15.43244 > 151.101.117.140.443: Flags [.], ack 45001, win 61320, length 0
13:05:42.117797 IP 151.101.117.140.443 > 10.0.2.15.43244: Flags [P.], seq 45001:49123, ack 821, win 65535, length 4122
13:05:42.117824 IP 10.0.2.15.43244 > 151.101.117.140.443: Flags [.], ack 49123, win 61320, length 0
13:05:42.118838 IP 151.101.117.140.443 > 10.0.2.15.43244: Flags [P.], seq 49123:51871, ack 821, win 65535, length 2748
13:05:42.118857 IP 10.0.2.15.43244 > 151.101.117.140.443: Flags [.], ack 51871, win 62780, length 0
13:05:42.119621 IP 151.101.117.140.443 > 10.0.2.15.43244: Flags [P.], seq 51871:54619, ack 821, win 65535, length 2748
13:05:42.119640 IP 10.0.2.15.43244 > 151.101.117.140.443: Flags [.], ack 54619, win 62780, length 0
13:05:42.120498 IP 151.101.117.140.443 > 10.0.2.15.43244: Flags [P.], seq 54619:57367, ack 821, win 65535, length 2748
13:05:42.120516 IP 10.0.2.15.43244 > 151.101.117.140.443: Flags [.], ack 57367, win 62780, length 0
13:05:42.121641 IP 151.101.117.140.443 > 10.0.2.15.43244: Flags [P.], seq 57367:64237, ack 821, win 65535, length 6870
13:05:42.121657 IP 10.0.2.15.43244 > 151.101.117.140.443: Flags [.], ack 64237, win 59860, length 0
13:05:42.121883 IP 151.101.117.140.443 > 10.0.2.15.43244: Flags [P.], seq 64237:65611, ack 821, win 65535, length 1374
13:05:42.121891 IP 10.0.2.15.43244 > 151.101.117.140.443: Flags [.], ack 65611, win 58486, length 0
13:05:42.122891 IP 151.101.117.140.443 > 10.0.2.15.43244: Flags [P.], seq 65611:69733, ack 821, win 65535, length 4122
13:05:42.122908 IP 10.0.2.15.43244 > 151.101.117.140.443: Flags [.], ack 69733, win 61320, length 0
13:05:42.124066 IP 151.101.117.140.443 > 10.0.2.15.43244: Flags [P.], seq 69733:75229, ack 821, win 65535, length 5496
13:05:42.124081 IP 10.0.2.15.43244 > 151.101.117.140.443: Flags [.], ack 75229, win 65535, length 0
13:05:42.125073 IP 151.101.117.140.443 > 10.0.2.15.43244: Flags [P.], seq 75229:83473, ack 821, win 65535, length 8244
13:05:42.125088 IP 10.0.2.15.43244 > 151.101.117.140.443: Flags [.], ack 83473, win 65535, length 0
13:05:42.125201 IP 151.101.117.140.443 > 10.0.2.15.43244: Flags [P.], seq 83473:86221, ack 821, win 65535, length 2748
13:05:42.125210 IP 10.0.2.15.43244 > 151.101.117.140.443: Flags [.], ack 86221, win 65535, length 0
13:05:42.126203 IP 151.101.117.140.443 > 10.0.2.15.43244: Flags [P.], seq 86221:91717, ack 821, win 65535, length 5496
13:05:42.126217 IP 10.0.2.15.43244 > 151.101.117.140.443: Flags [.], ack 91717, win 65535, length 0
13:05:42.128724 IP 151.101.117.140.443 > 10.0.2.15.43244: Flags [P.], seq 91717:105457, ack 821, win 65535, length 13740
13:05:42.128752 IP 10.0.2.15.43244 > 151.101.117.140.443: Flags [.], ack 105457, win 65535, length 0
13:05:42.130944 IP 151.101.117.140.443 > 10.0.2.15.43244: Flags [P.], seq 105457:113701, ack 821, win 65535, length 8244
13:05:42.130960 IP 10.0.2.15.43244 > 151.101.117.140.443: Flags [.], ack 113701, win 65535, length 0
13:05:42.131095 IP 151.101.117.140.443 > 10.0.2.15.43244: Flags [P.], seq 113701:117823, ack 821, win 65535, length 4122
13:05:42.131102 IP 10.0.2.15.43244 > 151.101.117.140.443: Flags [.], ack 117823, win 65535, length 0
13:05:42.131947 IP 151.101.117.140.443 > 10.0.2.15.43244: Flags [P.], seq 117823:126067, ack 821, win 65535, length 8244
13:05:42.131963 IP 10.0.2.15.43244 > 151.101.117.140.443: Flags [.], ack 126067, win 65535, length 0
13:05:42.132903 IP 151.101.117.140.443 > 10.0.2.15.43244: Flags [P.], seq 126067:134311, ack 821, win 65535, length 8244
13:05:42.132920 IP 10.0.2.15.43244 > 151.101.117.140.443: Flags [.], ack 134311, win 65535, length 0
13:05:42.134394 IP 151.101.117.140.443 > 10.0.2.15.43244: Flags [P.], seq 134311:148051, ack 821, win 65535, length 13740
13:05:42.134418 IP 10.0.2.15.43244 > 151.101.117.140.443: Flags [.], ack 148051, win 65535, length 0
13:05:42.134665 IP 151.101.117.140.443 > 10.0.2.15.43244: Flags [P.], seq 148051:149425, ack 821, win 65535, length 1374
13:05:42.134679 IP 10.0.2.15.43244 > 151.101.117.140.443: Flags [.], ack 149425, win 65535, length 0
13:05:42.135631 IP 151.101.117.140.443 > 10.0.2.15.43244: Flags [P.], seq 149425:157669, ack 821, win 65535, length 8244
13:05:42.135647 IP 10.0.2.15.43244 > 151.101.117.140.443: Flags [.], ack 157669, win 65535, length 0
13:05:42.136877 IP 151.101.117.140.443 > 10.0.2.15.43244: Flags [P.], seq 157669:164539, ack 821, win 65535, length 6870
13:05:42.136893 IP 10.0.2.15.43244 > 151.101.117.140.443: Flags [.], ack 164539, win 65535, length 0
13:05:42.137197 IP 151.101.117.140.443 > 10.0.2.15.43244: Flags [P.], seq 164539:170035, ack 821, win 65535, length 5496
13:05:42.137207 IP 10.0.2.15.43244 > 151.101.117.140.443: Flags [.], ack 170035, win 65535, length 0
13:05:42.138781 IP 151.101.117.140.443 > 10.0.2.15.43244: Flags [P.], seq 170035:179653, ack 821, win 65535, length 9618
13:05:42.138798 IP 10.0.2.15.43244 > 151.101.117.140.443: Flags [.], ack 179653, win 65535, length 0
13:05:42.139086 IP 151.101.117.140.443 > 10.0.2.15.43244: Flags [P.], seq 179653:183775, ack 821, win 65535, length 4122
13:05:42.139099 IP 10.0.2.15.43244 > 151.101.117.140.443: Flags [.], ack 183775, win 65535, length 0
13:05:42.139471 IP 151.101.117.140.443 > 10.0.2.15.43244: Flags [P.], seq 183775:189271, ack 821, win 65535, length 5496
13:05:42.139482 IP 10.0.2.15.43244 > 151.101.117.140.443: Flags [.], ack 189271, win 65535, length 0
13:05:42.139813 IP 151.101.117.140.443 > 10.0.2.15.43244: Flags [P.], seq 189271:197515, ack 821, win 65535, length 8244
13:05:42.139824 IP 10.0.2.15.43244 > 151.101.117.140.443: Flags [.], ack 197515, win 65535, length 0
13:05:42.141040 IP 151.101.117.140.443 > 10.0.2.15.43244: Flags [P.], seq 197515:197768, ack 821, win 65535, length 253
13:05:42.141055 IP 10.0.2.15.43244 > 151.101.117.140.443: Flags [.], ack 197768, win 65535, length 0
13:05:42.609599 IP 151.101.117.140.443 > 10.0.2.15.43244: Flags [P.], seq 197768:225226, ack 821, win 65535, length 27458
13:05:42.609623 IP 10.0.2.15.43244 > 151.101.117.140.443: Flags [.], ack 225226, win 65535, length 0
13:05:42.609653 IP 151.101.117.140.443 > 10.0.2.15.43244: Flags [P.], seq 225226:234844, ack 821, win 65535, length 9618
13:05:42.609661 IP 10.0.2.15.43244 > 151.101.117.140.443: Flags [.], ack 234844, win 65535, length 0

