20:05:12.707904 IP 10.0.2.15.44580 > 140.233.253.2.53: 44018+ A? www.reddit.com. (32)
20:05:12.707948 IP 10.0.2.15.44580 > 140.233.253.2.53: 23025+ AAAA? www.reddit.com. (32)
20:05:12.716463 IP 140.233.253.2.53 > 10.0.2.15.44580: 23025 1/1/0 CNAME reddit.map.fastly.net. (125)
20:05:12.725832 IP 140.233.253.2.53 > 10.0.2.15.44580: 44018 2/0/0 CNAME reddit.map.fastly.net., A 151.101.117.140 (83)
20:05:12.726087 IP 10.0.2.15.53150 > 151.101.117.140.443: Flags [S], seq 2933749289, win 64240, options [mss 1460,sackOK,TS val 3623801910 ecr 0,nop,wscale 6], length 0
20:05:12.742035 IP 151.101.117.140.443 > 10.0.2.15.53150: Flags [S.], seq 225856001, ack 2933749290, win 65535, options [mss 1460], length 0
20:05:12.742088 IP 10.0.2.15.53150 > 151.101.117.140.443: Flags [.], ack 1, win 64240, length 0
20:05:12.752250 IP 10.0.2.15.53150 > 151.101.117.140.443: Flags [P.], seq 1:518, ack 1, win 64240, length 517
20:05:12.752544 IP 151.101.117.140.443 > 10.0.2.15.53150: Flags [.], ack 518, win 65535, length 0
20:05:12.778853 IP 151.101.117.140.443 > 10.0.2.15.53150: Flags [.], seq 1:2921, ack 518, win 65535, length 2920
20:05:12.778870 IP 10.0.2.15.53150 > 151.101.117.140.443: Flags [.], ack 2921, win 62780, length 0
20:05:12.779090 IP 151.101.117.140.443 > 10.0.2.15.53150: Flags [P.], seq 2921:3722, ack 518, win 65535, length 801
20:05:12.779109 IP 10.0.2.15.53150 > 151.101.117.140.443: Flags [.], ack 3722, win 61979, length 0
20:05:12.791076 IP 10.0.2.15.53150 > 151.101.117.140.443: Flags [P.], seq 518:598, ack 3722, win 61979, length 80
20:05:12.791341 IP 10.0.2.15.53150 > 151.101.117.140.443: Flags [P.], seq 598:644, ack 3722, win 61979, length 46
20:05:12.791384 IP 10.0.2.15.53150 > 151.101.117.140.443: Flags [P.], seq 644:693, ack 3722, win 61979, length 49
20:05:12.791485 IP 151.101.117.140.443 > 10.0.2.15.53150: Flags [.], ack 598, win 65535, length 0
20:05:12.791727 IP 10.0.2.15.53150 > 151.101.117.140.443: Flags [P.], seq 693:728, ack 3722, win 61979, length 35
20:05:12.791826 IP 10.0.2.15.53150 > 151.101.117.140.443: Flags [P.], seq 728:790, ack 3722, win 61979, length 62
20:05:12.792522 IP 151.101.117.140.443 > 10.0.2.15.53150: Flags [.], ack 644, win 65535, length 0
20:05:12.792525 IP 151.101.117.140.443 > 10.0.2.15.53150: Flags [.], ack 693, win 65535, length 0
20:05:12.792525 IP 151.101.117.140.443 > 10.0.2.15.53150: Flags [.], ack 728, win 65535, length 0
20:05:12.792762 IP 151.101.117.140.443 > 10.0.2.15.53150: Flags [.], ack 790, win 65535, length 0
20:05:12.804956 IP 151.101.117.140.443 > 10.0.2.15.53150: Flags [P.], seq 3722:3803, ack 790, win 65535, length 81
20:05:12.804981 IP 10.0.2.15.53150 > 151.101.117.140.443: Flags [.], ack 3803, win 62780, length 0
20:05:12.805725 IP 10.0.2.15.53150 > 151.101.117.140.443: Flags [P.], seq 790:821, ack 3803, win 62780, length 31
20:05:12.805976 IP 151.101.117.140.443 > 10.0.2.15.53150: Flags [.], ack 821, win 65535, length 0
20:05:12.918638 IP 151.101.117.140.443 > 10.0.2.15.53150: Flags [P.], seq 3803:10673, ack 821, win 65535, length 6870
20:05:12.918661 IP 10.0.2.15.53150 > 151.101.117.140.443: Flags [.], ack 10673, win 59860, length 0
20:05:12.919892 IP 151.101.117.140.443 > 10.0.2.15.53150: Flags [P.], seq 10673:14795, ack 821, win 65535, length 4122
20:05:12.919894 IP 151.101.117.140.443 > 10.0.2.15.53150: Flags [P.], seq 14795:16169, ack 821, win 65535, length 1374
20:05:12.919915 IP 10.0.2.15.53150 > 151.101.117.140.443: Flags [.], ack 14795, win 61320, length 0
20:05:12.919946 IP 10.0.2.15.53150 > 151.101.117.140.443: Flags [.], ack 16169, win 61320, length 0
20:05:12.920568 IP 151.101.117.140.443 > 10.0.2.15.53150: Flags [P.], seq 16169:21665, ack 821, win 65535, length 5496
20:05:12.920584 IP 10.0.2.15.53150 > 151.101.117.140.443: Flags [.], ack 21665, win 56940, length 0
20:05:12.922483 IP 151.101.117.140.443 > 10.0.2.15.53150: Flags [P.], seq 21665:27161, ack 821, win 65535, length 5496
20:05:12.922486 IP 151.101.117.140.443 > 10.0.2.15.53150: Flags [P.], seq 27161:31283, ack 821, win 65535, length 4122
20:05:12.922509 IP 10.0.2.15.53150 > 151.101.117.140.443: Flags [.], ack 27161, win 61320, length 0
20:05:12.922717 IP 10.0.2.15.53150 > 151.101.117.140.443: Flags [.], ack 31283, win 58400, length 0
20:05:12.923844 IP 151.101.117.140.443 > 10.0.2.15.53150: Flags [P.], seq 31283:35405, ack 821, win 65535, length 4122
20:05:12.923863 IP 10.0.2.15.53150 > 151.101.117.140.443: Flags [.], ack 35405, win 61320, length 0
20:05:12.924980 IP 151.101.117.140.443 > 10.0.2.15.53150: Flags [P.], seq 35405:39527, ack 821, win 65535, length 4122
20:05:12.924999 IP 10.0.2.15.53150 > 151.101.117.140.443: Flags [.], ack 39527, win 61320, length 0
20:05:12.925848 IP 151.101.117.140.443 > 10.0.2.15.53150: Flags [P.], seq 39527:43649, ack 821, win 65535, length 4122
20:05:12.925860 IP 10.0.2.15.53150 > 151.101.117.140.443: Flags [.], ack 43649, win 61320, length 0
20:05:12.927338 IP 151.101.117.140.443 > 10.0.2.15.53150: Flags [P.], seq 43649:50519, ack 821, win 65535, length 6870
20:05:12.927412 IP 10.0.2.15.53150 > 151.101.117.140.443: Flags [.], ack 50519, win 59860, length 0
20:05:12.929192 IP 151.101.117.140.443 > 10.0.2.15.53150: Flags [P.], seq 50519:51893, ack 821, win 65535, length 1374
20:05:12.929310 IP 10.0.2.15.53150 > 151.101.117.140.443: Flags [.], ack 51893, win 62780, length 0
20:05:12.931310 IP 151.101.117.140.443 > 10.0.2.15.53150: Flags [P.], seq 51893:54641, ack 821, win 65535, length 2748
20:05:12.931329 IP 10.0.2.15.53150 > 151.101.117.140.443: Flags [.], ack 54641, win 62780, length 0
20:05:12.933796 IP 151.101.117.140.443 > 10.0.2.15.53150: Flags [P.], seq 54641:62885, ack 821, win 65535, length 8244
20:05:12.933901 IP 10.0.2.15.53150 > 151.101.117.140.443: Flags [.], ack 62885, win 58400, length 0
20:05:12.934489 IP 151.101.117.140.443 > 10.0.2.15.53150: Flags [P.], seq 62885:67007, ack 821, win 65535, length 4122
20:05:12.934501 IP 10.0.2.15.53150 > 151.101.117.140.443: Flags [.], ack 67007, win 61320, length 0
20:05:12.935911 IP 151.101.117.140.443 > 10.0.2.15.53150: Flags [P.], seq 67007:71129, ack 821, win 65535, length 4122
20:05:12.935932 IP 10.0.2.15.53150 > 151.101.117.140.443: Flags [.], ack 71129, win 61320, length 0
20:05:12.937105 IP 151.101.117.140.443 > 10.0.2.15.53150: Flags [P.], seq 71129:75251, ack 821, win 65535, length 4122
20:05:12.937130 IP 10.0.2.15.53150 > 151.101.117.140.443: Flags [.], ack 75251, win 65535, length 0
20:05:12.939580 IP 151.101.117.140.443 > 10.0.2.15.53150: Flags [P.], seq 75251:88991, ack 821, win 65535, length 13740
20:05:12.939639 IP 10.0.2.15.53150 > 151.101.117.140.443: Flags [.], ack 88991, win 65535, length 0
20:05:12.940998 IP 151.101.117.140.443 > 10.0.2.15.53150: Flags [P.], seq 88991:95861, ack 821, win 65535, length 6870
20:05:12.941000 IP 151.101.117.140.443 > 10.0.2.15.53150: Flags [P.], seq 95861:97235, ack 821, win 65535, length 1374
20:05:12.941027 IP 10.0.2.15.53150 > 151.101.117.140.443: Flags [.], ack 95861, win 65535, length 0
20:05:12.941064 IP 10.0.2.15.53150 > 151.101.117.140.443: Flags [.], ack 97235, win 65535, length 0
20:05:12.942507 IP 151.101.117.140.443 > 10.0.2.15.53150: Flags [P.], seq 97235:104105, ack 821, win 65535, length 6870
20:05:12.942529 IP 10.0.2.15.53150 > 151.101.117.140.443: Flags [.], ack 104105, win 65535, length 0
20:05:12.943268 IP 151.101.117.140.443 > 10.0.2.15.53150: Flags [P.], seq 104105:111204, ack 821, win 65535, length 7099
20:05:12.943283 IP 10.0.2.15.53150 > 151.101.117.140.443: Flags [.], ack 111204, win 65535, length 0
20:05:12.944488 IP 151.101.117.140.443 > 10.0.2.15.53150: Flags [P.], seq 111204:116700, ack 821, win 65535, length 5496
20:05:12.944490 IP 151.101.117.140.443 > 10.0.2.15.53150: Flags [P.], seq 116700:118074, ack 821, win 65535, length 1374
20:05:12.944514 IP 10.0.2.15.53150 > 151.101.117.140.443: Flags [.], ack 116700, win 65535, length 0
20:05:12.944593 IP 10.0.2.15.53150 > 151.101.117.140.443: Flags [.], ack 118074, win 65535, length 0
20:05:12.945227 IP 151.101.117.140.443 > 10.0.2.15.53150: Flags [P.], seq 118074:122196, ack 821, win 65535, length 4122
20:05:12.945228 IP 151.101.117.140.443 > 10.0.2.15.53150: Flags [P.], seq 122196:123570, ack 821, win 65535, length 1374
20:05:12.945324 IP 10.0.2.15.53150 > 151.101.117.140.443: Flags [.], ack 122196, win 65535, length 0
20:05:12.945362 IP 10.0.2.15.53150 > 151.101.117.140.443: Flags [.], ack 123570, win 65535, length 0
20:05:12.946514 IP 151.101.117.140.443 > 10.0.2.15.53150: Flags [P.], seq 123570:129066, ack 821, win 65535, length 5496
20:05:12.946535 IP 10.0.2.15.53150 > 151.101.117.140.443: Flags [.], ack 129066, win 65535, length 0
20:05:12.947451 IP 151.101.117.140.443 > 10.0.2.15.53150: Flags [.], seq 129066:131986, ack 821, win 65535, length 2920
20:05:12.947464 IP 10.0.2.15.53150 > 151.101.117.140.443: Flags [.], ack 131986, win 65535, length 0
20:05:12.947692 IP 151.101.117.140.443 > 10.0.2.15.53150: Flags [P.], seq 131986:134562, ack 821, win 65535, length 2576
20:05:12.947693 IP 151.101.117.140.443 > 10.0.2.15.53150: Flags [P.], seq 134562:137310, ack 821, win 65535, length 2748
20:05:12.947711 IP 10.0.2.15.53150 > 151.101.117.140.443: Flags [.], ack 134562, win 65535, length 0
20:05:12.947733 IP 10.0.2.15.53150 > 151.101.117.140.443: Flags [.], ack 137310, win 65535, length 0
20:05:12.948732 IP 151.101.117.140.443 > 10.0.2.15.53150: Flags [P.], seq 137310:144180, ack 821, win 65535, length 6870
20:05:12.948747 IP 10.0.2.15.53150 > 151.101.117.140.443: Flags [.], ack 144180, win 65535, length 0
20:05:12.949217 IP 151.101.117.140.443 > 10.0.2.15.53150: Flags [P.], seq 144180:148302, ack 821, win 65535, length 4122
20:05:12.949219 IP 151.101.117.140.443 > 10.0.2.15.53150: Flags [P.], seq 148302:153798, ack 821, win 65535, length 5496
20:05:12.949231 IP 10.0.2.15.53150 > 151.101.117.140.443: Flags [.], ack 148302, win 65535, length 0
20:05:12.949252 IP 10.0.2.15.53150 > 151.101.117.140.443: Flags [.], ack 153798, win 65535, length 0
20:05:12.950530 IP 151.101.117.140.443 > 10.0.2.15.53150: Flags [P.], seq 153798:159294, ack 821, win 65535, length 5496
20:05:12.950548 IP 10.0.2.15.53150 > 151.101.117.140.443: Flags [.], ack 159294, win 65535, length 0
20:05:12.951176 IP 151.101.117.140.443 > 10.0.2.15.53150: Flags [P.], seq 159294:164790, ack 821, win 65535, length 5496
20:05:12.951178 IP 151.101.117.140.443 > 10.0.2.15.53150: Flags [P.], seq 164790:166164, ack 821, win 65535, length 1374
20:05:12.951179 IP 151.101.117.140.443 > 10.0.2.15.53150: Flags [P.], seq 166164:168912, ack 821, win 65535, length 2748
20:05:12.951180 IP 151.101.117.140.443 > 10.0.2.15.53150: Flags [P.], seq 168912:170019, ack 821, win 65535, length 1107
20:05:12.951263 IP 10.0.2.15.53150 > 151.101.117.140.443: Flags [.], ack 164790, win 65535, length 0
20:05:12.951282 IP 10.0.2.15.53150 > 151.101.117.140.443: Flags [.], ack 166164, win 65535, length 0
20:05:12.951288 IP 10.0.2.15.53150 > 151.101.117.140.443: Flags [.], ack 168912, win 65535, length 0
20:05:12.951294 IP 10.0.2.15.53150 > 151.101.117.140.443: Flags [.], ack 170019, win 65535, length 0
20:05:12.953758 IP 151.101.117.140.443 > 10.0.2.15.53150: Flags [P.], seq 170019:176889, ack 821, win 65535, length 6870
20:05:12.953777 IP 10.0.2.15.53150 > 151.101.117.140.443: Flags [.], ack 176889, win 65535, length 0
20:05:12.955203 IP 151.101.117.140.443 > 10.0.2.15.53150: Flags [P.], seq 176889:180298, ack 821, win 65535, length 3409
20:05:12.955206 IP 151.101.117.140.443 > 10.0.2.15.53150: Flags [P.], seq 180298:183046, ack 821, win 65535, length 2748
20:05:12.955206 IP 151.101.117.140.443 > 10.0.2.15.53150: Flags [P.], seq 183046:185794, ack 821, win 65535, length 2748
20:05:12.955260 IP 10.0.2.15.53150 > 151.101.117.140.443: Flags [.], ack 180298, win 65535, length 0
20:05:12.955297 IP 10.0.2.15.53150 > 151.101.117.140.443: Flags [.], ack 183046, win 65535, length 0
20:05:12.955303 IP 10.0.2.15.53150 > 151.101.117.140.443: Flags [.], ack 185794, win 65535, length 0
20:05:12.955734 IP 151.101.117.140.443 > 10.0.2.15.53150: Flags [P.], seq 185794:189916, ack 821, win 65535, length 4122
20:05:12.955736 IP 151.101.117.140.443 > 10.0.2.15.53150: Flags [P.], seq 189916:192664, ack 821, win 65535, length 2748
20:05:12.955750 IP 10.0.2.15.53150 > 151.101.117.140.443: Flags [.], ack 189916, win 65535, length 0
20:05:12.955776 IP 10.0.2.15.53150 > 151.101.117.140.443: Flags [.], ack 192664, win 65535, length 0
20:05:12.956545 IP 151.101.117.140.443 > 10.0.2.15.53150: Flags [P.], seq 192664:195412, ack 821, win 65535, length 2748
20:05:12.956547 IP 151.101.117.140.443 > 10.0.2.15.53150: Flags [P.], seq 195412:196786, ack 821, win 65535, length 1374
20:05:12.956558 IP 10.0.2.15.53150 > 151.101.117.140.443: Flags [.], ack 195412, win 65535, length 0
20:05:12.956585 IP 10.0.2.15.53150 > 151.101.117.140.443: Flags [.], ack 196786, win 65535, length 0
20:05:12.957511 IP 151.101.117.140.443 > 10.0.2.15.53150: Flags [P.], seq 196786:197809, ack 821, win 65535, length 1023
20:05:12.957527 IP 10.0.2.15.53150 > 151.101.117.140.443: Flags [.], ack 197809, win 65535, length 0
20:05:13.909391 IP 151.101.117.140.443 > 10.0.2.15.53150: Flags [P.], seq 197809:199183, ack 821, win 65535, length 1374
20:05:13.909442 IP 10.0.2.15.53150 > 151.101.117.140.443: Flags [.], ack 199183, win 65535, length 0
20:05:13.910183 IP 151.101.117.140.443 > 10.0.2.15.53150: Flags [P.], seq 199183:199280, ack 821, win 65535, length 97
20:05:13.910202 IP 10.0.2.15.53150 > 151.101.117.140.443: Flags [.], ack 199280, win 65535, length 0
20:05:13.952204 IP 151.101.117.140.443 > 10.0.2.15.53150: Flags [.], seq 199280:209500, ack 821, win 65535, length 10220
20:05:13.952241 IP 10.0.2.15.53150 > 151.101.117.140.443: Flags [.], ack 209500, win 65535, length 0
20:05:13.952838 IP 151.101.117.140.443 > 10.0.2.15.53150: Flags [.], seq 209500:227020, ack 821, win 65535, length 17520
20:05:13.952864 IP 10.0.2.15.53150 > 151.101.117.140.443: Flags [.], ack 227020, win 65535, length 0
20:05:13.953691 IP 151.101.117.140.443 > 10.0.2.15.53150: Flags [P.], seq 227020:230824, ack 821, win 65535, length 3804
20:05:13.953695 IP 151.101.117.140.443 > 10.0.2.15.53150: Flags [P.], seq 230824:240442, ack 821, win 65535, length 9618
20:05:13.953717 IP 10.0.2.15.53150 > 151.101.117.140.443: Flags [.], ack 230824, win 65535, length 0
20:05:13.953747 IP 10.0.2.15.53150 > 151.101.117.140.443: Flags [.], ack 240442, win 65535, length 0
20:05:13.953782 IP 151.101.117.140.443 > 10.0.2.15.53150: Flags [P.], seq 240442:245938, ack 821, win 65535, length 5496
20:05:13.953792 IP 10.0.2.15.53150 > 151.101.117.140.443: Flags [.], ack 245938, win 65535, length 0
20:05:13.954908 IP 151.101.117.140.443 > 10.0.2.15.53150: Flags [P.], seq 245938:251434, ack 821, win 65535, length 5496
20:05:13.954911 IP 151.101.117.140.443 > 10.0.2.15.53150: Flags [P.], seq 251434:254103, ack 821, win 65535, length 2669
20:05:13.954939 IP 10.0.2.15.53150 > 151.101.117.140.443: Flags [.], ack 251434, win 65535, length 0
20:05:13.955023 IP 10.0.2.15.53150 > 151.101.117.140.443: Flags [.], ack 254103, win 65535, length 0
20:05:13.961620 IP 151.101.117.140.443 > 10.0.2.15.53150: Flags [P.], seq 254103:255477, ack 821, win 65535, length 1374
20:05:13.961715 IP 10.0.2.15.53150 > 151.101.117.140.443: Flags [.], ack 255477, win 65535, length 0
20:05:13.962097 IP 151.101.117.140.443 > 10.0.2.15.53150: Flags [.], seq 255477:261317, ack 821, win 65535, length 5840
20:05:13.962111 IP 10.0.2.15.53150 > 151.101.117.140.443: Flags [.], ack 261317, win 65535, length 0
20:05:13.962270 IP 151.101.117.140.443 > 10.0.2.15.53150: Flags [P.], seq 261317:263721, ack 821, win 65535, length 2404
20:05:13.962272 IP 151.101.117.140.443 > 10.0.2.15.53150: Flags [P.], seq 263721:267843, ack 821, win 65535, length 4122
20:05:13.962319 IP 10.0.2.15.53150 > 151.101.117.140.443: Flags [.], ack 263721, win 65535, length 0
20:05:13.962413 IP 10.0.2.15.53150 > 151.101.117.140.443: Flags [.], ack 267843, win 65535, length 0
20:05:13.962682 IP 151.101.117.140.443 > 10.0.2.15.53150: Flags [P.], seq 267843:273387, ack 821, win 65535, length 5544
20:05:13.962759 IP 151.101.117.140.443 > 10.0.2.15.53150: Flags [P.], seq 273387:278883, ack 821, win 65535, length 5496
20:05:13.962777 IP 10.0.2.15.53150 > 151.101.117.140.443: Flags [.], ack 278883, win 65535, length 0
20:05:13.963002 IP 151.101.117.140.443 > 10.0.2.15.53150: Flags [P.], seq 278883:283005, ack 821, win 65535, length 4122
20:05:13.963011 IP 10.0.2.15.53150 > 151.101.117.140.443: Flags [.], ack 283005, win 65535, length 0
20:05:13.963525 IP 151.101.117.140.443 > 10.0.2.15.53150: Flags [P.], seq 283005:285753, ack 821, win 65535, length 2748
20:05:13.963527 IP 151.101.117.140.443 > 10.0.2.15.53150: Flags [P.], seq 285753:289818, ack 821, win 65535, length 4065
20:05:13.963543 IP 10.0.2.15.53150 > 151.101.117.140.443: Flags [.], ack 285753, win 65535, length 0
20:05:13.963595 IP 10.0.2.15.53150 > 151.101.117.140.443: Flags [.], ack 289818, win 65535, length 0
20:05:13.964775 IP 151.101.117.140.443 > 10.0.2.15.53150: Flags [P.], seq 289818:296688, ack 821, win 65535, length 6870
20:05:13.964792 IP 10.0.2.15.53150 > 151.101.117.140.443: Flags [.], ack 296688, win 65535, length 0
20:05:13.965286 IP 151.101.117.140.443 > 10.0.2.15.53150: Flags [P.], seq 296688:300810, ack 821, win 65535, length 4122
20:05:13.965288 IP 151.101.117.140.443 > 10.0.2.15.53150: Flags [P.], seq 300810:304881, ack 821, win 65535, length 4071
20:05:13.965289 IP 151.101.117.140.443 > 10.0.2.15.53150: Flags [P.], seq 304881:307629, ack 821, win 65535, length 2748
20:05:13.965302 IP 10.0.2.15.53150 > 151.101.117.140.443: Flags [.], ack 300810, win 65535, length 0
20:05:13.965318 IP 10.0.2.15.53150 > 151.101.117.140.443: Flags [.], ack 304881, win 65535, length 0
20:05:13.965376 IP 10.0.2.15.53150 > 151.101.117.140.443: Flags [.], ack 307629, win 65535, length 0
20:05:13.965449 IP 151.101.117.140.443 > 10.0.2.15.53150: Flags [P.], seq 307629:311751, ack 821, win 65535, length 4122
20:05:13.965455 IP 10.0.2.15.53150 > 151.101.117.140.443: Flags [.], ack 311751, win 65535, length 0
20:05:13.965691 IP 151.101.117.140.443 > 10.0.2.15.53150: Flags [P.], seq 311751:317247, ack 821, win 65535, length 5496
20:05:13.965701 IP 10.0.2.15.53150 > 151.101.117.140.443: Flags [.], ack 317247, win 65535, length 0
20:05:13.965813 IP 151.101.117.140.443 > 10.0.2.15.53150: Flags [P.], seq 317247:319995, ack 821, win 65535, length 2748
20:05:13.965818 IP 10.0.2.15.53150 > 151.101.117.140.443: Flags [.], ack 319995, win 65535, length 0
20:05:13.966015 IP 151.101.117.140.443 > 10.0.2.15.53150: Flags [P.], seq 319995:321318, ack 821, win 65535, length 1323
20:05:13.966023 IP 10.0.2.15.53150 > 151.101.117.140.443: Flags [.], ack 321318, win 65535, length 0
20:05:13.973687 IP 151.101.117.140.443 > 10.0.2.15.53150: Flags [P.], seq 321318:331343, ack 821, win 65535, length 10025
20:05:13.973689 IP 151.101.117.140.443 > 10.0.2.15.53150: Flags [P.], seq 331343:334091, ack 821, win 65535, length 2748
20:05:13.973714 IP 10.0.2.15.53150 > 151.101.117.140.443: Flags [.], ack 331343, win 65535, length 0
20:05:13.973888 IP 10.0.2.15.53150 > 151.101.117.140.443: Flags [.], ack 334091, win 65535, length 0
20:05:13.973925 IP 151.101.117.140.443 > 10.0.2.15.53150: Flags [P.], seq 334091:336839, ack 821, win 65535, length 2748
20:05:13.973932 IP 10.0.2.15.53150 > 151.101.117.140.443: Flags [.], ack 336839, win 65535, length 0
20:05:13.975564 IP 151.101.117.140.443 > 10.0.2.15.53150: Flags [P.], seq 336839:343252, ack 821, win 65535, length 6413
20:05:13.975567 IP 151.101.117.140.443 > 10.0.2.15.53150: Flags [P.], seq 343252:348748, ack 821, win 65535, length 5496
20:05:13.975595 IP 10.0.2.15.53150 > 151.101.117.140.443: Flags [.], ack 343252, win 65535, length 0
20:05:13.975698 IP 10.0.2.15.53150 > 151.101.117.140.443: Flags [.], ack 348748, win 65535, length 0
20:05:13.975779 IP 151.101.117.140.443 > 10.0.2.15.53150: Flags [P.], seq 348748:352870, ack 821, win 65535, length 4122
20:05:13.975780 IP 151.101.117.140.443 > 10.0.2.15.53150: Flags [P.], seq 352870:354193, ack 821, win 65535, length 1323
20:05:13.975790 IP 10.0.2.15.53150 > 151.101.117.140.443: Flags [.], ack 352870, win 65535, length 0
20:05:13.975808 IP 10.0.2.15.53150 > 151.101.117.140.443: Flags [.], ack 354193, win 65535, length 0
20:05:13.976725 IP 151.101.117.140.443 > 10.0.2.15.53150: Flags [P.], seq 354193:359689, ack 821, win 65535, length 5496
20:05:13.976910 IP 10.0.2.15.53150 > 151.101.117.140.443: Flags [.], ack 359689, win 65535, length 0
20:05:13.979250 IP 151.101.117.140.443 > 10.0.2.15.53150: Flags [P.], seq 359689:361063, ack 821, win 65535, length 1374
20:05:13.979269 IP 10.0.2.15.53150 > 151.101.117.140.443: Flags [.], ack 361063, win 65535, length 0
20:05:13.979642 IP 151.101.117.140.443 > 10.0.2.15.53150: Flags [.], seq 361063:381503, ack 821, win 65535, length 20440
20:05:13.979655 IP 10.0.2.15.53150 > 151.101.117.140.443: Flags [.], ack 381503, win 65535, length 0
20:05:13.979780 IP 151.101.117.140.443 > 10.0.2.15.53150: Flags [P.], seq 381503:387029, ack 821, win 65535, length 5526
20:05:13.979786 IP 10.0.2.15.53150 > 151.101.117.140.443: Flags [.], ack 387029, win 65535, length 0
20:05:13.985693 IP 151.101.117.140.443 > 10.0.2.15.53150: Flags [P.], seq 387029:389647, ack 821, win 65535, length 2618
20:05:13.985716 IP 10.0.2.15.53150 > 151.101.117.140.443: Flags [.], ack 389647, win 65535, length 0
20:05:13.989723 IP 151.101.117.140.443 > 10.0.2.15.53150: Flags [P.], seq 389647:435012, ack 821, win 65535, length 45365
20:05:13.989742 IP 10.0.2.15.53150 > 151.101.117.140.443: Flags [.], ack 435012, win 65535, length 0
20:05:13.990072 IP 151.101.117.140.443 > 10.0.2.15.53150: Flags [P.], seq 435012:444630, ack 821, win 65535, length 9618
20:05:13.990143 IP 10.0.2.15.53150 > 151.101.117.140.443: Flags [.], ack 444630, win 65535, length 0
20:05:13.991814 IP 151.101.117.140.443 > 10.0.2.15.53150: Flags [P.], seq 444630:452773, ack 821, win 65535, length 8143
20:05:13.991833 IP 10.0.2.15.53150 > 151.101.117.140.443: Flags [.], ack 452773, win 65535, length 0
20:05:13.998927 IP 151.101.117.140.443 > 10.0.2.15.53150: Flags [P.], seq 452773:458243, ack 821, win 65535, length 5470
20:05:13.998932 IP 151.101.117.140.443 > 10.0.2.15.53150: Flags [P.], seq 458243:466487, ack 821, win 65535, length 8244
20:05:13.998993 IP 10.0.2.15.53150 > 151.101.117.140.443: Flags [.], ack 458243, win 65535, length 0
20:05:13.999065 IP 10.0.2.15.53150 > 151.101.117.140.443: Flags [.], ack 466487, win 65535, length 0
20:05:13.999307 IP 151.101.117.140.443 > 10.0.2.15.53150: Flags [P.], seq 466487:469204, ack 821, win 65535, length 2717
20:05:13.999309 IP 151.101.117.140.443 > 10.0.2.15.53150: Flags [P.], seq 469204:470578, ack 821, win 65535, length 1374
20:05:13.999311 IP 151.101.117.140.443 > 10.0.2.15.53150: Flags [P.], seq 470578:478822, ack 821, win 65535, length 8244
20:05:13.999327 IP 10.0.2.15.53150 > 151.101.117.140.443: Flags [.], ack 469204, win 65535, length 0
20:05:13.999404 IP 10.0.2.15.53150 > 151.101.117.140.443: Flags [.], ack 470578, win 65535, length 0
20:05:14.001115 IP 10.0.2.15.53150 > 151.101.117.140.443: Flags [.], ack 478822, win 65535, length 0
20:05:14.001295 IP 151.101.117.140.443 > 10.0.2.15.53150: Flags [P.], seq 478822:482944, ack 821, win 65535, length 4122
20:05:14.001297 IP 151.101.117.140.443 > 10.0.2.15.53150: Flags [P.], seq 482944:484318, ack 821, win 65535, length 1374
20:05:14.001313 IP 10.0.2.15.53150 > 151.101.117.140.443: Flags [.], ack 482944, win 65535, length 0
20:05:14.001329 IP 10.0.2.15.53150 > 151.101.117.140.443: Flags [.], ack 484318, win 65535, length 0
20:05:14.002603 IP 151.101.117.140.443 > 10.0.2.15.53150: Flags [.], seq 484318:485778, ack 821, win 65535, length 1460
20:05:14.002623 IP 10.0.2.15.53150 > 151.101.117.140.443: Flags [.], ack 485778, win 65535, length 0
20:05:14.004181 IP 151.101.117.140.443 > 10.0.2.15.53150: Flags [P.], seq 485778:502129, ack 821, win 65535, length 16351
20:05:14.004206 IP 10.0.2.15.53150 > 151.101.117.140.443: Flags [.], ack 502129, win 65535, length 0
20:05:14.004294 IP 151.101.117.140.443 > 10.0.2.15.53150: Flags [P.], seq 502129:534953, ack 821, win 65535, length 32824
20:05:14.004302 IP 10.0.2.15.53150 > 151.101.117.140.443: Flags [.], ack 534953, win 65535, length 0
20:05:14.010944 IP 151.101.117.140.443 > 10.0.2.15.53150: Flags [P.], seq 534953:543566, ack 821, win 65535, length 8613
20:05:14.010948 IP 151.101.117.140.443 > 10.0.2.15.53150: Flags [P.], seq 543566:549062, ack 821, win 65535, length 5496
20:05:14.010977 IP 10.0.2.15.53150 > 151.101.117.140.443: Flags [.], ack 543566, win 65535, length 0
20:05:14.011286 IP 10.0.2.15.53150 > 151.101.117.140.443: Flags [.], ack 549062, win 65535, length 0
20:05:14.011629 IP 151.101.117.140.443 > 10.0.2.15.53150: Flags [P.], seq 549062:554131, ack 821, win 65535, length 5069
20:05:14.011633 IP 151.101.117.140.443 > 10.0.2.15.53150: Flags [P.], seq 554131:556879, ack 821, win 65535, length 2748
20:05:14.011634 IP 151.101.117.140.443 > 10.0.2.15.53150: Flags [P.], seq 556879:559627, ack 821, win 65535, length 2748
20:05:14.011668 IP 10.0.2.15.53150 > 151.101.117.140.443: Flags [.], ack 554131, win 65535, length 0
20:05:14.011816 IP 10.0.2.15.53150 > 151.101.117.140.443: Flags [.], ack 556879, win 65535, length 0
20:05:14.012006 IP 10.0.2.15.53150 > 151.101.117.140.443: Flags [.], ack 559627, win 65535, length 0
20:05:14.012331 IP 151.101.117.140.443 > 10.0.2.15.53150: Flags [P.], seq 559627:565123, ack 821, win 65535, length 5496
20:05:14.012333 IP 151.101.117.140.443 > 10.0.2.15.53150: Flags [P.], seq 565123:566497, ack 821, win 65535, length 1374
20:05:14.012335 IP 151.101.117.140.443 > 10.0.2.15.53150: Flags [P.], seq 566497:573340, ack 821, win 65535, length 6843
20:05:14.012379 IP 151.101.117.140.443 > 10.0.2.15.53150: Flags [P.], seq 573340:580210, ack 821, win 65535, length 6870
20:05:14.012743 IP 10.0.2.15.53150 > 151.101.117.140.443: Flags [.], ack 565123, win 65535, length 0
20:05:14.012769 IP 10.0.2.15.53150 > 151.101.117.140.443: Flags [.], ack 566497, win 65535, length 0
20:05:14.012770 IP 10.0.2.15.53150 > 151.101.117.140.443: Flags [.], ack 573340, win 65535, length 0
20:05:14.012771 IP 10.0.2.15.53150 > 151.101.117.140.443: Flags [.], ack 580210, win 65535, length 0
20:05:14.013403 IP 151.101.117.140.443 > 10.0.2.15.53150: Flags [P.], seq 580210:587080, ack 821, win 65535, length 6870
20:05:14.013416 IP 10.0.2.15.53150 > 151.101.117.140.443: Flags [.], ack 587080, win 65535, length 0
20:05:14.013761 IP 151.101.117.140.443 > 10.0.2.15.53150: Flags [P.], seq 587080:593950, ack 821, win 65535, length 6870
20:05:14.013763 IP 151.101.117.140.443 > 10.0.2.15.53150: Flags [P.], seq 593950:595324, ack 821, win 65535, length 1374
20:05:14.013778 IP 10.0.2.15.53150 > 151.101.117.140.443: Flags [.], ack 593950, win 65535, length 0
20:05:14.013835 IP 10.0.2.15.53150 > 151.101.117.140.443: Flags [.], ack 595324, win 65535, length 0
20:05:14.014149 IP 151.101.117.140.443 > 10.0.2.15.53150: Flags [P.], seq 595324:596698, ack 821, win 65535, length 1374
20:05:14.014151 IP 151.101.117.140.443 > 10.0.2.15.53150: Flags [P.], seq 596698:600820, ack 821, win 65535, length 4122
20:05:14.014152 IP 151.101.117.140.443 > 10.0.2.15.53150: Flags [P.], seq 600820:603568, ack 821, win 65535, length 2748
20:05:14.014161 IP 10.0.2.15.53150 > 151.101.117.140.443: Flags [.], ack 596698, win 65535, length 0
20:05:14.014183 IP 10.0.2.15.53150 > 151.101.117.140.443: Flags [.], ack 600820, win 65535, length 0
20:05:14.014194 IP 10.0.2.15.53150 > 151.101.117.140.443: Flags [.], ack 603568, win 65535, length 0
20:05:14.015006 IP 151.101.117.140.443 > 10.0.2.15.53150: Flags [P.], seq 603568:611812, ack 821, win 65535, length 8244
20:05:14.015019 IP 10.0.2.15.53150 > 151.101.117.140.443: Flags [.], ack 611812, win 65535, length 0
20:05:14.015251 IP 151.101.117.140.443 > 10.0.2.15.53150: Flags [P.], seq 611812:615934, ack 821, win 65535, length 4122
20:05:14.015259 IP 10.0.2.15.53150 > 151.101.117.140.443: Flags [.], ack 615934, win 65535, length 0
20:05:14.016150 IP 151.101.117.140.443 > 10.0.2.15.53150: Flags [P.], seq 615934:617158, ack 821, win 65535, length 1224
20:05:14.016165 IP 10.0.2.15.53150 > 151.101.117.140.443: Flags [.], ack 617158, win 65535, length 0
20:05:14.022717 IP 151.101.117.140.443 > 10.0.2.15.53150: Flags [P.], seq 617158:632272, ack 821, win 65535, length 15114
20:05:14.022737 IP 10.0.2.15.53150 > 151.101.117.140.443: Flags [.], ack 632272, win 65535, length 0
20:05:14.024220 IP 151.101.117.140.443 > 10.0.2.15.53150: Flags [P.], seq 632272:659701, ack 821, win 65535, length 27429
20:05:14.024372 IP 10.0.2.15.53150 > 151.101.117.140.443: Flags [.], ack 659701, win 65535, length 0
20:05:14.024532 IP 151.101.117.140.443 > 10.0.2.15.53150: Flags [P.], seq 659701:663823, ack 821, win 65535, length 4122
20:05:14.024534 IP 151.101.117.140.443 > 10.0.2.15.53150: Flags [P.], seq 663823:667945, ack 821, win 65535, length 4122
20:05:14.024547 IP 10.0.2.15.53150 > 151.101.117.140.443: Flags [.], ack 663823, win 65535, length 0
20:05:14.024565 IP 10.0.2.15.53150 > 151.101.117.140.443: Flags [.], ack 667945, win 65535, length 0
20:05:14.024803 IP 151.101.117.140.443 > 10.0.2.15.53150: Flags [P.], seq 667945:673441, ack 821, win 65535, length 5496
20:05:14.024815 IP 10.0.2.15.53150 > 151.101.117.140.443: Flags [.], ack 673441, win 65535, length 0
20:05:14.025113 IP 151.101.117.140.443 > 10.0.2.15.53150: Flags [P.], seq 673441:674815, ack 821, win 65535, length 1374
20:05:14.025120 IP 10.0.2.15.53150 > 151.101.117.140.443: Flags [.], ack 674815, win 65535, length 0
20:05:14.027210 IP 151.101.117.140.443 > 10.0.2.15.53150: Flags [P.], seq 674815:677563, ack 821, win 65535, length 2748
20:05:14.027255 IP 10.0.2.15.53150 > 151.101.117.140.443: Flags [.], ack 677563, win 65535, length 0
20:05:14.027855 IP 151.101.117.140.443 > 10.0.2.15.53150: Flags [P.], seq 677563:678937, ack 821, win 65535, length 1374
20:05:14.027870 IP 10.0.2.15.53150 > 151.101.117.140.443: Flags [.], ack 678937, win 65535, length 0

