00:14:50.934551 IP 151.101.117.140.443 > 10.0.2.15.52948: Flags [.], seq 78080002:78082922, ack 252629989, win 65535, length 2920
00:14:50.934580 IP 10.0.2.15.52948 > 151.101.117.140.443: Flags [.], ack 2920, win 62780, length 0
00:14:50.934867 IP 151.101.117.140.443 > 10.0.2.15.52948: Flags [P.], seq 2920:3721, ack 1, win 65535, length 801
00:14:50.934886 IP 10.0.2.15.52948 > 151.101.117.140.443: Flags [.], ack 3721, win 61979, length 0
00:14:50.938507 IP 10.0.2.15.52948 > 151.101.117.140.443: Flags [P.], seq 1:81, ack 3721, win 61979, length 80
00:14:50.938820 IP 10.0.2.15.52948 > 151.101.117.140.443: Flags [P.], seq 81:127, ack 3721, win 61979, length 46
00:14:50.939091 IP 151.101.117.140.443 > 10.0.2.15.52948: Flags [.], ack 81, win 65535, length 0
00:14:50.939093 IP 151.101.117.140.443 > 10.0.2.15.52948: Flags [.], ack 127, win 65535, length 0
00:14:50.939174 IP 10.0.2.15.52948 > 151.101.117.140.443: Flags [P.], seq 127:176, ack 3721, win 61979, length 49
00:14:50.939563 IP 151.101.117.140.443 > 10.0.2.15.52948: Flags [.], ack 176, win 65535, length 0
00:14:50.939701 IP 10.0.2.15.52948 > 151.101.117.140.443: Flags [P.], seq 176:211, ack 3721, win 61979, length 35
00:14:50.940072 IP 10.0.2.15.52948 > 151.101.117.140.443: Flags [P.], seq 211:273, ack 3721, win 61979, length 62
00:14:50.940118 IP 151.101.117.140.443 > 10.0.2.15.52948: Flags [.], ack 211, win 65535, length 0
00:14:50.940392 IP 151.101.117.140.443 > 10.0.2.15.52948: Flags [.], ack 273, win 65535, length 0
00:14:50.952271 IP 151.101.117.140.443 > 10.0.2.15.52948: Flags [P.], seq 3721:3802, ack 273, win 65535, length 81
00:14:50.952289 IP 10.0.2.15.52948 > 151.101.117.140.443: Flags [.], ack 3802, win 62780, length 0
00:14:50.952529 IP 10.0.2.15.52948 > 151.101.117.140.443: Flags [P.], seq 273:304, ack 3802, win 62780, length 31
00:14:50.952840 IP 151.101.117.140.443 > 10.0.2.15.52948: Flags [.], ack 304, win 65535, length 0
00:14:51.338543 IP 151.101.117.140.443 > 10.0.2.15.52948: Flags [P.], seq 3802:9298, ack 304, win 65535, length 5496
00:14:51.338700 IP 151.101.117.140.443 > 10.0.2.15.52948: Flags [.], seq 9298:10758, ack 304, win 65535, length 1460
00:14:51.338744 IP 10.0.2.15.52948 > 151.101.117.140.443: Flags [.], ack 9298, win 61320, length 0
00:14:51.338782 IP 10.0.2.15.52948 > 151.101.117.140.443: Flags [.], ack 10758, win 59860, length 0
00:14:51.339224 IP 151.101.117.140.443 > 10.0.2.15.52948: Flags [.], seq 10758:12218, ack 304, win 65535, length 1460
00:14:51.339237 IP 10.0.2.15.52948 > 151.101.117.140.443: Flags [.], ack 12218, win 58400, length 0
00:14:51.339389 IP 151.101.117.140.443 > 10.0.2.15.52948: Flags [P.], seq 12218:16168, ack 304, win 65535, length 3950
00:14:51.339485 IP 10.0.2.15.52948 > 151.101.117.140.443: Flags [.], ack 16168, win 55480, length 0
00:14:51.341912 IP 151.101.117.140.443 > 10.0.2.15.52948: Flags [P.], seq 16168:24412, ack 304, win 65535, length 8244
00:14:51.341916 IP 151.101.117.140.443 > 10.0.2.15.52948: Flags [.], seq 24412:28792, ack 304, win 65535, length 4380
00:14:51.341944 IP 10.0.2.15.52948 > 151.101.117.140.443: Flags [.], ack 24412, win 58400, length 0
00:14:51.341987 IP 10.0.2.15.52948 > 151.101.117.140.443: Flags [.], ack 28792, win 55480, length 0
00:14:51.342299 IP 151.101.117.140.443 > 10.0.2.15.52948: Flags [P.], seq 28792:32656, ack 304, win 65535, length 3864
00:14:51.342318 IP 10.0.2.15.52948 > 151.101.117.140.443: Flags [.], ack 32656, win 52560, length 0
00:14:51.343774 IP 151.101.117.140.443 > 10.0.2.15.52948: Flags [P.], seq 32656:38152, ack 304, win 65535, length 5496
00:14:51.343792 IP 10.0.2.15.52948 > 151.101.117.140.443: Flags [.], ack 38152, win 61320, length 0
00:14:51.343996 IP 151.101.117.140.443 > 10.0.2.15.52948: Flags [P.], seq 38152:43648, ack 304, win 65535, length 5496
00:14:51.344007 IP 10.0.2.15.52948 > 151.101.117.140.443: Flags [.], ack 43648, win 56940, length 0
00:14:51.344174 IP 151.101.117.140.443 > 10.0.2.15.52948: Flags [P.], seq 43648:45022, ack 304, win 65535, length 1374
00:14:51.344182 IP 10.0.2.15.52948 > 151.101.117.140.443: Flags [.], ack 45022, win 55566, length 0
00:14:51.346021 IP 151.101.117.140.443 > 10.0.2.15.52948: Flags [P.], seq 45022:45685, ack 304, win 65535, length 663
00:14:51.346105 IP 10.0.2.15.52948 > 151.101.117.140.443: Flags [.], ack 45685, win 62780, length 0
00:14:51.350489 IP 151.101.117.140.443 > 10.0.2.15.52948: Flags [P.], seq 45685:49807, ack 304, win 65535, length 4122
00:14:51.350519 IP 10.0.2.15.52948 > 151.101.117.140.443: Flags [.], ack 49807, win 61320, length 0
00:14:51.352846 IP 151.101.117.140.443 > 10.0.2.15.52948: Flags [P.], seq 49807:56677, ack 304, win 65535, length 6870
00:14:51.352850 IP 151.101.117.140.443 > 10.0.2.15.52948: Flags [P.], seq 56677:58051, ack 304, win 65535, length 1374
00:14:51.352880 IP 10.0.2.15.52948 > 151.101.117.140.443: Flags [.], ack 56677, win 59860, length 0
00:14:51.352931 IP 10.0.2.15.52948 > 151.101.117.140.443: Flags [.], ack 58051, win 58486, length 0
00:14:51.353632 IP 151.101.117.140.443 > 10.0.2.15.52948: Flags [P.], seq 58051:62173, ack 304, win 65535, length 4122
00:14:51.353650 IP 10.0.2.15.52948 > 151.101.117.140.443: Flags [.], ack 62173, win 55480, length 0
00:14:51.354647 IP 151.101.117.140.443 > 10.0.2.15.52948: Flags [P.], seq 62173:66295, ack 304, win 65535, length 4122
00:14:51.354664 IP 10.0.2.15.52948 > 151.101.117.140.443: Flags [.], ack 66295, win 61320, length 0
00:14:51.355704 IP 151.101.117.140.443 > 10.0.2.15.52948: Flags [P.], seq 66295:70417, ack 304, win 65535, length 4122
00:14:51.355723 IP 10.0.2.15.52948 > 151.101.117.140.443: Flags [.], ack 70417, win 61320, length 0
00:14:51.355983 IP 151.101.117.140.443 > 10.0.2.15.52948: Flags [P.], seq 70417:71791, ack 304, win 65535, length 1374
00:14:51.355985 IP 151.101.117.140.443 > 10.0.2.15.52948: Flags [P.], seq 71791:74539, ack 304, win 65535, length 2748
00:14:51.356319 IP 10.0.2.15.52948 > 151.101.117.140.443: Flags [.], ack 74539, win 62780, length 0
00:14:51.356777 IP 151.101.117.140.443 > 10.0.2.15.52948: Flags [P.], seq 74539:78906, ack 304, win 65535, length 4367
00:14:51.356794 IP 10.0.2.15.52948 > 151.101.117.140.443: Flags [.], ack 78906, win 65535, length 0
00:14:51.362655 IP 151.101.117.140.443 > 10.0.2.15.52948: Flags [P.], seq 78906:87150, ack 304, win 65535, length 8244
00:14:51.362659 IP 151.101.117.140.443 > 10.0.2.15.52948: Flags [P.], seq 87150:89898, ack 304, win 65535, length 2748
00:14:51.362874 IP 10.0.2.15.52948 > 151.101.117.140.443: Flags [.], ack 87150, win 65535, length 0
00:14:51.362924 IP 10.0.2.15.52948 > 151.101.117.140.443: Flags [.], ack 89898, win 65535, length 0
00:14:51.363402 IP 151.101.117.140.443 > 10.0.2.15.52948: Flags [P.], seq 89898:94020, ack 304, win 65535, length 4122
00:14:51.363418 IP 10.0.2.15.52948 > 151.101.117.140.443: Flags [.], ack 94020, win 65535, length 0
00:14:51.363660 IP 151.101.117.140.443 > 10.0.2.15.52948: Flags [P.], seq 94020:95343, ack 304, win 65535, length 1323
00:14:51.363669 IP 10.0.2.15.52948 > 151.101.117.140.443: Flags [.], ack 95343, win 65535, length 0
00:14:51.364330 IP 151.101.117.140.443 > 10.0.2.15.52948: Flags [P.], seq 95343:100839, ack 304, win 65535, length 5496
00:14:51.364345 IP 10.0.2.15.52948 > 151.101.117.140.443: Flags [.], ack 100839, win 65535, length 0
00:14:51.365668 IP 151.101.117.140.443 > 10.0.2.15.52948: Flags [P.], seq 100839:104961, ack 304, win 65535, length 4122
00:14:51.365671 IP 151.101.117.140.443 > 10.0.2.15.52948: Flags [P.], seq 104961:106335, ack 304, win 65535, length 1374
00:14:51.365688 IP 10.0.2.15.52948 > 151.101.117.140.443: Flags [.], ack 104961, win 65535, length 0
00:14:51.365723 IP 10.0.2.15.52948 > 151.101.117.140.443: Flags [.], ack 106335, win 65535, length 0
00:14:51.365971 IP 151.101.117.140.443 > 10.0.2.15.52948: Flags [P.], seq 106335:111831, ack 304, win 65535, length 5496
00:14:51.365981 IP 10.0.2.15.52948 > 151.101.117.140.443: Flags [.], ack 111831, win 65535, length 0
00:14:51.366845 IP 151.101.117.140.443 > 10.0.2.15.52948: Flags [P.], seq 111831:115953, ack 304, win 65535, length 4122
00:14:51.366869 IP 10.0.2.15.52948 > 151.101.117.140.443: Flags [.], ack 115953, win 65535, length 0
00:14:51.367155 IP 151.101.117.140.443 > 10.0.2.15.52948: Flags [P.], seq 115953:117327, ack 304, win 65535, length 1374
00:14:51.367170 IP 10.0.2.15.52948 > 151.101.117.140.443: Flags [.], ack 117327, win 65535, length 0
00:14:51.367889 IP 151.101.117.140.443 > 10.0.2.15.52948: Flags [P.], seq 117327:122823, ack 304, win 65535, length 5496
00:14:51.367947 IP 10.0.2.15.52948 > 151.101.117.140.443: Flags [.], ack 122823, win 65535, length 0
00:14:51.369100 IP 151.101.117.140.443 > 10.0.2.15.52948: Flags [P.], seq 122823:125571, ack 304, win 65535, length 2748
00:14:51.369102 IP 151.101.117.140.443 > 10.0.2.15.52948: Flags [P.], seq 125571:128218, ack 304, win 65535, length 2647
00:14:51.369124 IP 10.0.2.15.52948 > 151.101.117.140.443: Flags [.], ack 125571, win 65535, length 0
00:14:51.369256 IP 10.0.2.15.52948 > 151.101.117.140.443: Flags [.], ack 128218, win 65535, length 0
00:14:51.374779 IP 151.101.117.140.443 > 10.0.2.15.52948: Flags [P.], seq 128218:137836, ack 304, win 65535, length 9618
00:14:51.374783 IP 151.101.117.140.443 > 10.0.2.15.52948: Flags [P.], seq 137836:141958, ack 304, win 65535, length 4122
00:14:51.374810 IP 10.0.2.15.52948 > 151.101.117.140.443: Flags [.], ack 137836, win 65535, length 0
00:14:51.374959 IP 10.0.2.15.52948 > 151.101.117.140.443: Flags [.], ack 141958, win 65535, length 0
00:14:51.374991 IP 151.101.117.140.443 > 10.0.2.15.52948: Flags [P.], seq 141958:144647, ack 304, win 65535, length 2689
00:14:51.375108 IP 10.0.2.15.52948 > 151.101.117.140.443: Flags [.], ack 144647, win 65535, length 0
00:14:51.376997 IP 151.101.117.140.443 > 10.0.2.15.52948: Flags [P.], seq 144647:150143, ack 304, win 65535, length 5496
00:14:51.377022 IP 10.0.2.15.52948 > 151.101.117.140.443: Flags [.], ack 150143, win 65535, length 0
00:14:51.377544 IP 151.101.117.140.443 > 10.0.2.15.52948: Flags [P.], seq 150143:155639, ack 304, win 65535, length 5496
00:14:51.377549 IP 151.101.117.140.443 > 10.0.2.15.52948: Flags [P.], seq 155639:161135, ack 304, win 65535, length 5496
00:14:51.377567 IP 10.0.2.15.52948 > 151.101.117.140.443: Flags [.], ack 155639, win 65535, length 0
00:14:51.377651 IP 10.0.2.15.52948 > 151.101.117.140.443: Flags [.], ack 161135, win 65535, length 0
00:14:51.377687 IP 151.101.117.140.443 > 10.0.2.15.52948: Flags [P.], seq 161135:163883, ack 304, win 65535, length 2748
00:14:51.377692 IP 10.0.2.15.52948 > 151.101.117.140.443: Flags [.], ack 163883, win 65535, length 0
00:14:51.379254 IP 151.101.117.140.443 > 10.0.2.15.52948: Flags [P.], seq 163883:172127, ack 304, win 65535, length 8244
00:14:51.379317 IP 10.0.2.15.52948 > 151.101.117.140.443: Flags [.], ack 172127, win 65535, length 0
00:14:51.379545 IP 151.101.117.140.443 > 10.0.2.15.52948: Flags [P.], seq 172127:177514, ack 304, win 65535, length 5387
00:14:51.379554 IP 10.0.2.15.52948 > 151.101.117.140.443: Flags [.], ack 177514, win 65535, length 0
00:14:51.387498 IP 151.101.117.140.443 > 10.0.2.15.52948: Flags [P.], seq 177514:193951, ack 304, win 65535, length 16437
00:14:51.387522 IP 10.0.2.15.52948 > 151.101.117.140.443: Flags [.], ack 193951, win 65535, length 0
00:14:51.388779 IP 151.101.117.140.443 > 10.0.2.15.52948: Flags [P.], seq 193951:197841, ack 304, win 65535, length 3890
00:14:51.388793 IP 10.0.2.15.52948 > 151.101.117.140.443: Flags [.], ack 197841, win 65535, length 0
00:14:52.259229 IP 151.101.117.140.443 > 10.0.2.15.52948: Flags [P.], seq 197841:203434, ack 304, win 65535, length 5593
00:14:52.259358 IP 10.0.2.15.52948 > 151.101.117.140.443: Flags [.], ack 203434, win 65535, length 0
00:14:52.259585 IP 151.101.117.140.443 > 10.0.2.15.52948: Flags [P.], seq 203434:211678, ack 304, win 65535, length 8244
00:14:52.259588 IP 151.101.117.140.443 > 10.0.2.15.52948: Flags [P.], seq 211678:215800, ack 304, win 65535, length 4122
00:14:52.259609 IP 10.0.2.15.52948 > 151.101.117.140.443: Flags [.], ack 211678, win 65535, length 0
00:14:52.259638 IP 10.0.2.15.52948 > 151.101.117.140.443: Flags [.], ack 215800, win 65535, length 0
00:14:52.260525 IP 151.101.117.140.443 > 10.0.2.15.52948: Flags [P.], seq 215800:219922, ack 304, win 65535, length 4122
00:14:52.260530 IP 151.101.117.140.443 > 10.0.2.15.52948: Flags [P.], seq 219922:222670, ack 304, win 65535, length 2748
00:14:52.260531 IP 151.101.117.140.443 > 10.0.2.15.52948: Flags [P.], seq 222670:225418, ack 304, win 65535, length 2748
00:14:52.260668 IP 151.101.117.140.443 > 10.0.2.15.52948: Flags [P.], seq 225418:229540, ack 304, win 65535, length 4122
00:14:52.260722 IP 10.0.2.15.52948 > 151.101.117.140.443: Flags [.], ack 229540, win 65535, length 0
00:14:52.260799 IP 151.101.117.140.443 > 10.0.2.15.52948: Flags [P.], seq 229540:232288, ack 304, win 65535, length 2748
00:14:52.260827 IP 10.0.2.15.52948 > 151.101.117.140.443: Flags [.], ack 232288, win 65535, length 0
00:14:52.261306 IP 151.101.117.140.443 > 10.0.2.15.52948: Flags [P.], seq 232288:236410, ack 304, win 65535, length 4122
00:14:52.261308 IP 151.101.117.140.443 > 10.0.2.15.52948: Flags [P.], seq 236410:240358, ack 304, win 65535, length 3948
00:14:52.261323 IP 10.0.2.15.52948 > 151.101.117.140.443: Flags [.], ack 236410, win 65535, length 0
00:14:52.261374 IP 10.0.2.15.52948 > 151.101.117.140.443: Flags [.], ack 240358, win 65535, length 0
00:14:52.261495 IP 151.101.117.140.443 > 10.0.2.15.52948: Flags [P.], seq 240358:241732, ack 304, win 65535, length 1374
00:14:52.261501 IP 10.0.2.15.52948 > 151.101.117.140.443: Flags [.], ack 241732, win 65535, length 0
00:14:52.263390 IP 151.101.117.140.443 > 10.0.2.15.52948: Flags [P.], seq 241732:248602, ack 304, win 65535, length 6870
00:14:52.263410 IP 10.0.2.15.52948 > 151.101.117.140.443: Flags [.], ack 248602, win 65535, length 0
00:14:52.263539 IP 151.101.117.140.443 > 10.0.2.15.52948: Flags [P.], seq 248602:249976, ack 304, win 65535, length 1374
00:14:52.263548 IP 10.0.2.15.52948 > 151.101.117.140.443: Flags [.], ack 249976, win 65535, length 0
00:14:52.263676 IP 151.101.117.140.443 > 10.0.2.15.52948: Flags [P.], seq 249976:251350, ack 304, win 65535, length 1374
00:14:52.263682 IP 10.0.2.15.52948 > 151.101.117.140.443: Flags [.], ack 251350, win 65535, length 0
00:14:52.263871 IP 151.101.117.140.443 > 10.0.2.15.52948: Flags [P.], seq 251350:254098, ack 304, win 65535, length 2748
00:14:52.263882 IP 10.0.2.15.52948 > 151.101.117.140.443: Flags [.], ack 254098, win 65535, length 0
00:14:52.264125 IP 151.101.117.140.443 > 10.0.2.15.52948: Flags [P.], seq 254098:256846, ack 304, win 65535, length 2748
00:14:52.264133 IP 10.0.2.15.52948 > 151.101.117.140.443: Flags [.], ack 256846, win 65535, length 0
00:14:52.264385 IP 151.101.117.140.443 > 10.0.2.15.52948: Flags [P.], seq 256846:259594, ack 304, win 65535, length 2748
00:14:52.264387 IP 151.101.117.140.443 > 10.0.2.15.52948: Flags [.], seq 259594:261054, ack 304, win 65535, length 1460
00:14:52.264400 IP 10.0.2.15.52948 > 151.101.117.140.443: Flags [.], ack 259594, win 65535, length 0
00:14:52.264414 IP 10.0.2.15.52948 > 151.101.117.140.443: Flags [.], ack 261054, win 65535, length 0
00:14:52.264487 IP 151.101.117.140.443 > 10.0.2.15.52948: Flags [P.], seq 261054:262342, ack 304, win 65535, length 1288
00:14:52.264492 IP 10.0.2.15.52948 > 151.101.117.140.443: Flags [.], ack 262342, win 65535, length 0
00:14:52.264748 IP 151.101.117.140.443 > 10.0.2.15.52948: Flags [P.], seq 262342:263716, ack 304, win 65535, length 1374
00:14:52.264756 IP 10.0.2.15.52948 > 151.101.117.140.443: Flags [.], ack 263716, win 65535, length 0
00:14:52.265342 IP 151.101.117.140.443 > 10.0.2.15.52948: Flags [P.], seq 263716:267838, ack 304, win 65535, length 4122
00:14:52.265344 IP 151.101.117.140.443 > 10.0.2.15.52948: Flags [P.], seq 267838:270586, ack 304, win 65535, length 2748
00:14:52.265345 IP 151.101.117.140.443 > 10.0.2.15.52948: Flags [P.], seq 270586:273334, ack 304, win 65535, length 2748
00:14:52.265357 IP 10.0.2.15.52948 > 151.101.117.140.443: Flags [.], ack 267838, win 65535, length 0
00:14:52.265373 IP 10.0.2.15.52948 > 151.101.117.140.443: Flags [.], ack 270586, win 65535, length 0
00:14:52.265384 IP 10.0.2.15.52948 > 151.101.117.140.443: Flags [.], ack 273334, win 65535, length 0
00:14:52.265642 IP 151.101.117.140.443 > 10.0.2.15.52948: Flags [P.], seq 273334:276082, ack 304, win 65535, length 2748
00:14:52.265643 IP 151.101.117.140.443 > 10.0.2.15.52948: Flags [P.], seq 276082:278830, ack 304, win 65535, length 2748
00:14:52.265655 IP 10.0.2.15.52948 > 151.101.117.140.443: Flags [.], ack 276082, win 65535, length 0
00:14:52.265703 IP 10.0.2.15.52948 > 151.101.117.140.443: Flags [.], ack 278830, win 65535, length 0
00:14:52.265977 IP 151.101.117.140.443 > 10.0.2.15.52948: Flags [P.], seq 278830:280204, ack 304, win 65535, length 1374
00:14:52.265995 IP 10.0.2.15.52948 > 151.101.117.140.443: Flags [.], ack 280204, win 65535, length 0
00:14:52.266227 IP 151.101.117.140.443 > 10.0.2.15.52948: Flags [P.], seq 280204:282952, ack 304, win 65535, length 2748
00:14:52.266228 IP 151.101.117.140.443 > 10.0.2.15.52948: Flags [P.], seq 282952:284326, ack 304, win 65535, length 1374
00:14:52.266229 IP 151.101.117.140.443 > 10.0.2.15.52948: Flags [P.], seq 284326:287074, ack 304, win 65535, length 2748
00:14:52.266265 IP 10.0.2.15.52948 > 151.101.117.140.443: Flags [.], ack 282952, win 65535, length 0
00:14:52.266281 IP 10.0.2.15.52948 > 151.101.117.140.443: Flags [.], ack 284326, win 65535, length 0
00:14:52.266294 IP 10.0.2.15.52948 > 151.101.117.140.443: Flags [.], ack 287074, win 65535, length 0
00:14:52.266534 IP 151.101.117.140.443 > 10.0.2.15.52948: Flags [P.], seq 287074:289822, ack 304, win 65535, length 2748
00:14:52.266543 IP 10.0.2.15.52948 > 151.101.117.140.443: Flags [.], ack 289822, win 65535, length 0
00:14:52.266700 IP 151.101.117.140.443 > 10.0.2.15.52948: Flags [P.], seq 289822:292438, ack 304, win 65535, length 2616
00:14:52.266709 IP 10.0.2.15.52948 > 151.101.117.140.443: Flags [.], ack 292438, win 65535, length 0
00:14:52.266921 IP 151.101.117.140.443 > 10.0.2.15.52948: Flags [P.], seq 292438:293977, ack 304, win 65535, length 1539
00:14:52.266927 IP 10.0.2.15.52948 > 151.101.117.140.443: Flags [.], ack 293977, win 65535, length 0
00:14:52.267898 IP 151.101.117.140.443 > 10.0.2.15.52948: Flags [P.], seq 293977:298099, ack 304, win 65535, length 4122
00:14:52.267979 IP 10.0.2.15.52948 > 151.101.117.140.443: Flags [.], ack 298099, win 65535, length 0
00:14:52.268254 IP 151.101.117.140.443 > 10.0.2.15.52948: Flags [P.], seq 298099:302221, ack 304, win 65535, length 4122
00:14:52.268256 IP 151.101.117.140.443 > 10.0.2.15.52948: Flags [P.], seq 302221:307502, ack 304, win 65535, length 5281
00:14:52.268270 IP 10.0.2.15.52948 > 151.101.117.140.443: Flags [.], ack 302221, win 65535, length 0
00:14:52.268293 IP 10.0.2.15.52948 > 151.101.117.140.443: Flags [.], ack 307502, win 65535, length 0
00:14:52.268602 IP 151.101.117.140.443 > 10.0.2.15.52948: Flags [P.], seq 307502:308876, ack 304, win 65535, length 1374
00:14:52.268701 IP 10.0.2.15.52948 > 151.101.117.140.443: Flags [.], ack 308876, win 65535, length 0
00:14:52.268973 IP 151.101.117.140.443 > 10.0.2.15.52948: Flags [P.], seq 308876:312998, ack 304, win 65535, length 4122
00:14:52.268975 IP 151.101.117.140.443 > 10.0.2.15.52948: Flags [P.], seq 312998:315746, ack 304, win 65535, length 2748
00:14:52.269059 IP 10.0.2.15.52948 > 151.101.117.140.443: Flags [.], ack 312998, win 65535, length 0
00:14:52.269199 IP 10.0.2.15.52948 > 151.101.117.140.443: Flags [.], ack 315746, win 65535, length 0
00:14:52.269585 IP 151.101.117.140.443 > 10.0.2.15.52948: Flags [P.], seq 315746:319868, ack 304, win 65535, length 4122
00:14:52.269588 IP 151.101.117.140.443 > 10.0.2.15.52948: Flags [P.], seq 319868:321242, ack 304, win 65535, length 1374
00:14:52.269607 IP 10.0.2.15.52948 > 151.101.117.140.443: Flags [.], ack 319868, win 65535, length 0
00:14:52.269631 IP 10.0.2.15.52948 > 151.101.117.140.443: Flags [.], ack 321242, win 65535, length 0
00:14:52.269810 IP 151.101.117.140.443 > 10.0.2.15.52948: Flags [P.], seq 321242:323990, ack 304, win 65535, length 2748
00:14:52.269890 IP 10.0.2.15.52948 > 151.101.117.140.443: Flags [.], ack 323990, win 65535, length 0
00:14:52.270218 IP 151.101.117.140.443 > 10.0.2.15.52948: Flags [P.], seq 323990:326738, ack 304, win 65535, length 2748
00:14:52.270221 IP 151.101.117.140.443 > 10.0.2.15.52948: Flags [P.], seq 326738:330860, ack 304, win 65535, length 4122
00:14:52.270238 IP 10.0.2.15.52948 > 151.101.117.140.443: Flags [.], ack 326738, win 65535, length 0
00:14:52.270260 IP 10.0.2.15.52948 > 151.101.117.140.443: Flags [.], ack 330860, win 65535, length 0
00:14:52.270641 IP 151.101.117.140.443 > 10.0.2.15.52948: Flags [P.], seq 330860:334982, ack 304, win 65535, length 4122
00:14:52.270655 IP 10.0.2.15.52948 > 151.101.117.140.443: Flags [.], ack 334982, win 65535, length 0
00:14:52.270879 IP 151.101.117.140.443 > 10.0.2.15.52948: Flags [P.], seq 334982:340478, ack 304, win 65535, length 5496
00:14:52.270887 IP 10.0.2.15.52948 > 151.101.117.140.443: Flags [.], ack 340478, win 65535, length 0
00:14:52.271008 IP 151.101.117.140.443 > 10.0.2.15.52948: Flags [P.], seq 340478:344600, ack 304, win 65535, length 4122
00:14:52.271016 IP 10.0.2.15.52948 > 151.101.117.140.443: Flags [.], ack 344600, win 65535, length 0
00:14:52.271275 IP 151.101.117.140.443 > 10.0.2.15.52948: Flags [P.], seq 344600:347348, ack 304, win 65535, length 2748
00:14:52.271284 IP 10.0.2.15.52948 > 151.101.117.140.443: Flags [.], ack 347348, win 65535, length 0
00:14:52.272488 IP 151.101.117.140.443 > 10.0.2.15.52948: Flags [P.], seq 347348:350096, ack 304, win 65535, length 2748
00:14:52.272491 IP 151.101.117.140.443 > 10.0.2.15.52948: Flags [P.], seq 350096:355592, ack 304, win 65535, length 5496
00:14:52.272650 IP 10.0.2.15.52948 > 151.101.117.140.443: Flags [.], ack 350096, win 65535, length 0
00:14:52.272920 IP 10.0.2.15.52948 > 151.101.117.140.443: Flags [.], ack 355592, win 65535, length 0
00:14:52.273251 IP 151.101.117.140.443 > 10.0.2.15.52948: Flags [P.], seq 355592:356814, ack 304, win 65535, length 1222
00:14:52.273253 IP 151.101.117.140.443 > 10.0.2.15.52948: Flags [P.], seq 356814:359562, ack 304, win 65535, length 2748
00:14:52.273253 IP 151.101.117.140.443 > 10.0.2.15.52948: Flags [P.], seq 359562:362310, ack 304, win 65535, length 2748
00:14:52.273299 IP 10.0.2.15.52948 > 151.101.117.140.443: Flags [.], ack 356814, win 65535, length 0
00:14:52.273317 IP 10.0.2.15.52948 > 151.101.117.140.443: Flags [.], ack 359562, win 65535, length 0
00:14:52.273327 IP 10.0.2.15.52948 > 151.101.117.140.443: Flags [.], ack 362310, win 65535, length 0
00:14:52.273650 IP 151.101.117.140.443 > 10.0.2.15.52948: Flags [P.], seq 362310:369180, ack 304, win 65535, length 6870
00:14:52.273664 IP 10.0.2.15.52948 > 151.101.117.140.443: Flags [.], ack 369180, win 65535, length 0
00:14:52.273967 IP 151.101.117.140.443 > 10.0.2.15.52948: Flags [P.], seq 369180:371928, ack 304, win 65535, length 2748
00:14:52.273977 IP 10.0.2.15.52948 > 151.101.117.140.443: Flags [.], ack 371928, win 65535, length 0
00:14:52.274494 IP 151.101.117.140.443 > 10.0.2.15.52948: Flags [P.], seq 371928:375999, ack 304, win 65535, length 4071
00:14:52.274496 IP 151.101.117.140.443 > 10.0.2.15.52948: Flags [P.], seq 375999:378747, ack 304, win 65535, length 2748
00:14:52.274507 IP 10.0.2.15.52948 > 151.101.117.140.443: Flags [.], ack 375999, win 65535, length 0
00:14:52.274522 IP 10.0.2.15.52948 > 151.101.117.140.443: Flags [.], ack 378747, win 65535, length 0
00:14:52.274909 IP 151.101.117.140.443 > 10.0.2.15.52948: Flags [P.], seq 378747:382869, ack 304, win 65535, length 4122
00:14:52.274911 IP 151.101.117.140.443 > 10.0.2.15.52948: Flags [P.], seq 382869:386577, ack 304, win 65535, length 3708
00:14:52.274922 IP 10.0.2.15.52948 > 151.101.117.140.443: Flags [.], ack 382869, win 65535, length 0
00:14:52.274936 IP 10.0.2.15.52948 > 151.101.117.140.443: Flags [.], ack 386577, win 65535, length 0
00:14:52.277154 IP 151.101.117.140.443 > 10.0.2.15.52948: Flags [P.], seq 386577:389325, ack 304, win 65535, length 2748
00:14:52.277157 IP 151.101.117.140.443 > 10.0.2.15.52948: Flags [P.], seq 389325:392170, ack 304, win 65535, length 2845
00:14:52.277325 IP 10.0.2.15.52948 > 151.101.117.140.443: Flags [.], ack 389325, win 65535, length 0
00:14:52.277455 IP 10.0.2.15.52948 > 151.101.117.140.443: Flags [.], ack 392170, win 65535, length 0
00:14:52.278076 IP 151.101.117.140.443 > 10.0.2.15.52948: Flags [P.], seq 392170:399040, ack 304, win 65535, length 6870
00:14:52.278179 IP 10.0.2.15.52948 > 151.101.117.140.443: Flags [.], ack 399040, win 65535, length 0
00:14:52.278333 IP 151.101.117.140.443 > 10.0.2.15.52948: Flags [.], seq 399040:401960, ack 304, win 65535, length 2920
00:14:52.278343 IP 10.0.2.15.52948 > 151.101.117.140.443: Flags [.], ack 401960, win 65535, length 0
00:14:52.278582 IP 151.101.117.140.443 > 10.0.2.15.52948: Flags [P.], seq 401960:403162, ack 304, win 65535, length 1202
00:14:52.278590 IP 10.0.2.15.52948 > 151.101.117.140.443: Flags [.], ack 403162, win 65535, length 0
00:14:52.279205 IP 151.101.117.140.443 > 10.0.2.15.52948: Flags [P.], seq 403162:407284, ack 304, win 65535, length 4122
00:14:52.279207 IP 151.101.117.140.443 > 10.0.2.15.52948: Flags [P.], seq 407284:410032, ack 304, win 65535, length 2748
00:14:52.279219 IP 10.0.2.15.52948 > 151.101.117.140.443: Flags [.], ack 407284, win 65535, length 0
00:14:52.279237 IP 10.0.2.15.52948 > 151.101.117.140.443: Flags [.], ack 410032, win 65535, length 0
00:14:52.279341 IP 151.101.117.140.443 > 10.0.2.15.52948: Flags [P.], seq 410032:412780, ack 304, win 65535, length 2748
00:14:52.279343 IP 151.101.117.140.443 > 10.0.2.15.52948: Flags [P.], seq 412780:416902, ack 304, win 65535, length 4122
00:14:52.279349 IP 10.0.2.15.52948 > 151.101.117.140.443: Flags [.], ack 412780, win 65535, length 0
00:14:52.279362 IP 10.0.2.15.52948 > 151.101.117.140.443: Flags [.], ack 416902, win 65535, length 0
00:14:52.279598 IP 151.101.117.140.443 > 10.0.2.15.52948: Flags [P.], seq 416902:418276, ack 304, win 65535, length 1374
00:14:52.279605 IP 10.0.2.15.52948 > 151.101.117.140.443: Flags [.], ack 418276, win 65535, length 0
00:14:52.280293 IP 151.101.117.140.443 > 10.0.2.15.52948: Flags [P.], seq 418276:422398, ack 304, win 65535, length 4122
00:14:52.280294 IP 151.101.117.140.443 > 10.0.2.15.52948: Flags [P.], seq 422398:423772, ack 304, win 65535, length 1374
00:14:52.280308 IP 10.0.2.15.52948 > 151.101.117.140.443: Flags [.], ack 422398, win 65535, length 0
00:14:52.280354 IP 10.0.2.15.52948 > 151.101.117.140.443: Flags [.], ack 423772, win 65535, length 0
00:14:52.280591 IP 151.101.117.140.443 > 10.0.2.15.52948: Flags [P.], seq 423772:426520, ack 304, win 65535, length 2748
00:14:52.280599 IP 10.0.2.15.52948 > 151.101.117.140.443: Flags [.], ack 426520, win 65535, length 0
00:14:52.280781 IP 151.101.117.140.443 > 10.0.2.15.52948: Flags [P.], seq 426520:429268, ack 304, win 65535, length 2748
00:14:52.280789 IP 10.0.2.15.52948 > 151.101.117.140.443: Flags [.], ack 429268, win 65535, length 0
00:14:52.281024 IP 151.101.117.140.443 > 10.0.2.15.52948: Flags [P.], seq 429268:430494, ack 304, win 65535, length 1226
00:14:52.281032 IP 10.0.2.15.52948 > 151.101.117.140.443: Flags [.], ack 430494, win 65535, length 0
00:14:52.285500 IP 151.101.117.140.443 > 10.0.2.15.52948: Flags [P.], seq 430494:437338, ack 304, win 65535, length 6844
00:14:52.285547 IP 151.101.117.140.443 > 10.0.2.15.52948: Flags [P.], seq 437338:440086, ack 304, win 65535, length 2748
00:14:52.285568 IP 10.0.2.15.52948 > 151.101.117.140.443: Flags [.], ack 437338, win 65535, length 0
00:14:52.285599 IP 10.0.2.15.52948 > 151.101.117.140.443: Flags [.], ack 440086, win 65535, length 0
00:14:52.286145 IP 151.101.117.140.443 > 10.0.2.15.52948: Flags [P.], seq 440086:444208, ack 304, win 65535, length 4122
00:14:52.286148 IP 151.101.117.140.443 > 10.0.2.15.52948: Flags [P.], seq 444208:446956, ack 304, win 65535, length 2748
00:14:52.286166 IP 10.0.2.15.52948 > 151.101.117.140.443: Flags [.], ack 444208, win 65535, length 0
00:14:52.286185 IP 10.0.2.15.52948 > 151.101.117.140.443: Flags [.], ack 446956, win 65535, length 0
00:14:52.286296 IP 151.101.117.140.443 > 10.0.2.15.52948: Flags [P.], seq 446956:451155, ack 304, win 65535, length 4199
00:14:52.286301 IP 10.0.2.15.52948 > 151.101.117.140.443: Flags [.], ack 451155, win 65535, length 0
00:14:52.287561 IP 151.101.117.140.443 > 10.0.2.15.52948: Flags [P.], seq 451155:453903, ack 304, win 65535, length 2748
00:14:52.287577 IP 10.0.2.15.52948 > 151.101.117.140.443: Flags [.], ack 453903, win 65535, length 0
00:14:52.287879 IP 151.101.117.140.443 > 10.0.2.15.52948: Flags [P.], seq 453903:459399, ack 304, win 65535, length 5496
00:14:52.287893 IP 10.0.2.15.52948 > 151.101.117.140.443: Flags [.], ack 459399, win 65535, length 0
00:14:52.288439 IP 151.101.117.140.443 > 10.0.2.15.52948: Flags [P.], seq 459399:464895, ack 304, win 65535, length 5496
00:14:52.288441 IP 151.101.117.140.443 > 10.0.2.15.52948: Flags [P.], seq 464895:467643, ack 304, win 65535, length 2748
00:14:52.288457 IP 10.0.2.15.52948 > 151.101.117.140.443: Flags [.], ack 464895, win 65535, length 0
00:14:52.288547 IP 10.0.2.15.52948 > 151.101.117.140.443: Flags [.], ack 467643, win 65535, length 0
00:14:52.288843 IP 151.101.117.140.443 > 10.0.2.15.52948: Flags [P.], seq 467643:470391, ack 304, win 65535, length 2748
00:14:52.288845 IP 151.101.117.140.443 > 10.0.2.15.52948: Flags [P.], seq 470391:473139, ack 304, win 65535, length 2748
00:14:52.288846 IP 151.101.117.140.443 > 10.0.2.15.52948: Flags [P.], seq 473139:474513, ack 304, win 65535, length 1374
00:14:52.288857 IP 10.0.2.15.52948 > 151.101.117.140.443: Flags [.], ack 470391, win 65535, length 0
00:14:52.288954 IP 10.0.2.15.52948 > 151.101.117.140.443: Flags [.], ack 473139, win 65535, length 0
00:14:52.288967 IP 10.0.2.15.52948 > 151.101.117.140.443: Flags [.], ack 474513, win 65535, length 0
00:14:52.289075 IP 151.101.117.140.443 > 10.0.2.15.52948: Flags [P.], seq 474513:477261, ack 304, win 65535, length 2748
00:14:52.289076 IP 151.101.117.140.443 > 10.0.2.15.52948: Flags [P.], seq 477261:478635, ack 304, win 65535, length 1374
00:14:52.289082 IP 10.0.2.15.52948 > 151.101.117.140.443: Flags [.], ack 477261, win 65535, length 0
00:14:52.289095 IP 10.0.2.15.52948 > 151.101.117.140.443: Flags [.], ack 478635, win 65535, length 0
00:14:52.290123 IP 151.101.117.140.443 > 10.0.2.15.52948: Flags [P.], seq 478635:481383, ack 304, win 65535, length 2748
00:14:52.290142 IP 10.0.2.15.52948 > 151.101.117.140.443: Flags [.], ack 481383, win 65535, length 0
00:14:52.290369 IP 151.101.117.140.443 > 10.0.2.15.52948: Flags [P.], seq 481383:485457, ack 304, win 65535, length 4074
00:14:52.290389 IP 10.0.2.15.52948 > 151.101.117.140.443: Flags [.], ack 485457, win 65535, length 0
00:14:52.290734 IP 151.101.117.140.443 > 10.0.2.15.52948: Flags [P.], seq 485457:490953, ack 304, win 65535, length 5496
00:14:52.290735 IP 151.101.117.140.443 > 10.0.2.15.52948: Flags [P.], seq 490953:493701, ack 304, win 65535, length 2748
00:14:52.290827 IP 10.0.2.15.52948 > 151.101.117.140.443: Flags [.], ack 490953, win 65535, length 0
00:14:52.290855 IP 10.0.2.15.52948 > 151.101.117.140.443: Flags [.], ack 493701, win 65535, length 0
00:14:52.290993 IP 151.101.117.140.443 > 10.0.2.15.52948: Flags [P.], seq 493701:496449, ack 304, win 65535, length 2748
00:14:52.291003 IP 10.0.2.15.52948 > 151.101.117.140.443: Flags [.], ack 496449, win 65535, length 0
00:14:52.291112 IP 151.101.117.140.443 > 10.0.2.15.52948: Flags [P.], seq 496449:497823, ack 304, win 65535, length 1374
00:14:52.291119 IP 10.0.2.15.52948 > 151.101.117.140.443: Flags [.], ack 497823, win 65535, length 0
00:14:52.291902 IP 151.101.117.140.443 > 10.0.2.15.52948: Flags [P.], seq 497823:501945, ack 304, win 65535, length 4122
00:14:52.291913 IP 10.0.2.15.52948 > 151.101.117.140.443: Flags [.], ack 501945, win 65535, length 0
00:14:52.292480 IP 151.101.117.140.443 > 10.0.2.15.52948: Flags [P.], seq 501945:504693, ack 304, win 65535, length 2748
00:14:52.292482 IP 151.101.117.140.443 > 10.0.2.15.52948: Flags [P.], seq 504693:510189, ack 304, win 65535, length 5496
00:14:52.292498 IP 10.0.2.15.52948 > 151.101.117.140.443: Flags [.], ack 504693, win 65535, length 0
00:14:52.292562 IP 10.0.2.15.52948 > 151.101.117.140.443: Flags [.], ack 510189, win 65535, length 0
00:14:52.292675 IP 151.101.117.140.443 > 10.0.2.15.52948: Flags [P.], seq 510189:511563, ack 304, win 65535, length 1374
00:14:52.292681 IP 10.0.2.15.52948 > 151.101.117.140.443: Flags [.], ack 511563, win 65535, length 0
00:14:52.292810 IP 151.101.117.140.443 > 10.0.2.15.52948: Flags [P.], seq 511563:512937, ack 304, win 65535, length 1374
00:14:52.292815 IP 10.0.2.15.52948 > 151.101.117.140.443: Flags [.], ack 512937, win 65535, length 0
00:14:52.293632 IP 151.101.117.140.443 > 10.0.2.15.52948: Flags [P.], seq 512937:517107, ack 304, win 65535, length 4170
00:14:52.293649 IP 10.0.2.15.52948 > 151.101.117.140.443: Flags [.], ack 517107, win 65535, length 0
00:14:52.294113 IP 151.101.117.140.443 > 10.0.2.15.52948: Flags [P.], seq 517107:519855, ack 304, win 65535, length 2748
00:14:52.294118 IP 151.101.117.140.443 > 10.0.2.15.52948: Flags [P.], seq 519855:523977, ack 304, win 65535, length 4122
00:14:52.294118 IP 151.101.117.140.443 > 10.0.2.15.52948: Flags [P.], seq 523977:525351, ack 304, win 65535, length 1374
00:14:52.294142 IP 10.0.2.15.52948 > 151.101.117.140.443: Flags [.], ack 525351, win 65535, length 0
00:14:52.294346 IP 151.101.117.140.443 > 10.0.2.15.52948: Flags [P.], seq 525351:528099, ack 304, win 65535, length 2748
00:14:52.294355 IP 10.0.2.15.52948 > 151.101.117.140.443: Flags [.], ack 528099, win 65535, length 0
00:14:52.294492 IP 151.101.117.140.443 > 10.0.2.15.52948: Flags [P.], seq 528099:529473, ack 304, win 65535, length 1374
00:14:52.294501 IP 10.0.2.15.52948 > 151.101.117.140.443: Flags [.], ack 529473, win 65535, length 0
00:14:52.294843 IP 151.101.117.140.443 > 10.0.2.15.52948: Flags [P.], seq 529473:532221, ack 304, win 65535, length 2748
00:14:52.294852 IP 10.0.2.15.52948 > 151.101.117.140.443: Flags [.], ack 532221, win 65535, length 0
00:14:52.295053 IP 151.101.117.140.443 > 10.0.2.15.52948: Flags [P.], seq 532221:537717, ack 304, win 65535, length 5496
00:14:52.295054 IP 151.101.117.140.443 > 10.0.2.15.52948: Flags [P.], seq 537717:539091, ack 304, win 65535, length 1374
00:14:52.295063 IP 10.0.2.15.52948 > 151.101.117.140.443: Flags [.], ack 537717, win 65535, length 0
00:14:52.295082 IP 10.0.2.15.52948 > 151.101.117.140.443: Flags [.], ack 539091, win 65535, length 0
00:14:52.296121 IP 151.101.117.140.443 > 10.0.2.15.52948: Flags [P.], seq 539091:544587, ack 304, win 65535, length 5496
00:14:52.296134 IP 10.0.2.15.52948 > 151.101.117.140.443: Flags [.], ack 544587, win 65535, length 0
00:14:52.296349 IP 151.101.117.140.443 > 10.0.2.15.52948: Flags [P.], seq 544587:548709, ack 304, win 65535, length 4122
00:14:52.296358 IP 10.0.2.15.52948 > 151.101.117.140.443: Flags [.], ack 548709, win 65535, length 0
00:14:52.296675 IP 151.101.117.140.443 > 10.0.2.15.52948: Flags [P.], seq 548709:551457, ack 304, win 65535, length 2748
00:14:52.296687 IP 10.0.2.15.52948 > 151.101.117.140.443: Flags [.], ack 551457, win 65535, length 0
00:14:52.296839 IP 151.101.117.140.443 > 10.0.2.15.52948: Flags [P.], seq 551457:555579, ack 304, win 65535, length 4122
00:14:52.296846 IP 10.0.2.15.52948 > 151.101.117.140.443: Flags [.], ack 555579, win 65535, length 0
00:14:52.297135 IP 151.101.117.140.443 > 10.0.2.15.52948: Flags [P.], seq 555579:559701, ack 304, win 65535, length 4122
00:14:52.297145 IP 10.0.2.15.52948 > 151.101.117.140.443: Flags [.], ack 559701, win 65535, length 0
00:14:52.297404 IP 151.101.117.140.443 > 10.0.2.15.52948: Flags [P.], seq 559701:561075, ack 304, win 65535, length 1374
00:14:52.297406 IP 151.101.117.140.443 > 10.0.2.15.52948: Flags [P.], seq 561075:563823, ack 304, win 65535, length 2748
00:14:52.297417 IP 10.0.2.15.52948 > 151.101.117.140.443: Flags [.], ack 561075, win 65535, length 0
00:14:52.297445 IP 10.0.2.15.52948 > 151.101.117.140.443: Flags [.], ack 563823, win 65535, length 0
00:14:52.297549 IP 151.101.117.140.443 > 10.0.2.15.52948: Flags [P.], seq 563823:565197, ack 304, win 65535, length 1374
00:14:52.297565 IP 10.0.2.15.52948 > 151.101.117.140.443: Flags [.], ack 565197, win 65535, length 0
00:14:52.298541 IP 151.101.117.140.443 > 10.0.2.15.52948: Flags [P.], seq 565197:567945, ack 304, win 65535, length 2748
00:14:52.298555 IP 10.0.2.15.52948 > 151.101.117.140.443: Flags [.], ack 567945, win 65535, length 0
00:14:52.298763 IP 151.101.117.140.443 > 10.0.2.15.52948: Flags [P.], seq 567945:573441, ack 304, win 65535, length 5496
00:14:52.298773 IP 10.0.2.15.52948 > 151.101.117.140.443: Flags [.], ack 573441, win 65535, length 0
00:14:52.298921 IP 151.101.117.140.443 > 10.0.2.15.52948: Flags [P.], seq 573441:576189, ack 304, win 65535, length 2748
00:14:52.298928 IP 10.0.2.15.52948 > 151.101.117.140.443: Flags [.], ack 576189, win 65535, length 0
00:14:52.299106 IP 151.101.117.140.443 > 10.0.2.15.52948: Flags [P.], seq 576189:578937, ack 304, win 65535, length 2748
00:14:52.299114 IP 10.0.2.15.52948 > 151.101.117.140.443: Flags [.], ack 578937, win 65535, length 0
00:14:52.299283 IP 151.101.117.140.443 > 10.0.2.15.52948: Flags [P.], seq 578937:581685, ack 304, win 65535, length 2748
00:14:52.299290 IP 10.0.2.15.52948 > 151.101.117.140.443: Flags [.], ack 581685, win 65535, length 0
00:14:52.299647 IP 151.101.117.140.443 > 10.0.2.15.52948: Flags [P.], seq 581685:585807, ack 304, win 65535, length 4122
00:14:52.299657 IP 10.0.2.15.52948 > 151.101.117.140.443: Flags [.], ack 585807, win 65535, length 0
00:14:52.299915 IP 151.101.117.140.443 > 10.0.2.15.52948: Flags [P.], seq 585807:591303, ack 304, win 65535, length 5496
00:14:52.299926 IP 10.0.2.15.52948 > 151.101.117.140.443: Flags [.], ack 591303, win 65535, length 0
00:14:52.300987 IP 151.101.117.140.443 > 10.0.2.15.52948: Flags [P.], seq 591303:595425, ack 304, win 65535, length 4122
00:14:52.301001 IP 10.0.2.15.52948 > 151.101.117.140.443: Flags [.], ack 595425, win 65535, length 0
00:14:52.301522 IP 151.101.117.140.443 > 10.0.2.15.52948: Flags [P.], seq 595425:598173, ack 304, win 65535, length 2748
00:14:52.301524 IP 151.101.117.140.443 > 10.0.2.15.52948: Flags [P.], seq 598173:600921, ack 304, win 65535, length 2748
00:14:52.301548 IP 10.0.2.15.52948 > 151.101.117.140.443: Flags [.], ack 598173, win 65535, length 0
00:14:52.301629 IP 10.0.2.15.52948 > 151.101.117.140.443: Flags [.], ack 600921, win 65535, length 0
00:14:52.301791 IP 151.101.117.140.443 > 10.0.2.15.52948: Flags [P.], seq 600921:605043, ack 304, win 65535, length 4122
00:14:52.301793 IP 151.101.117.140.443 > 10.0.2.15.52948: Flags [P.], seq 605043:606417, ack 304, win 65535, length 1374
00:14:52.301794 IP 151.101.117.140.443 > 10.0.2.15.52948: Flags [P.], seq 606417:609165, ack 304, win 65535, length 2748
00:14:52.301807 IP 10.0.2.15.52948 > 151.101.117.140.443: Flags [.], ack 605043, win 65535, length 0
00:14:52.301865 IP 10.0.2.15.52948 > 151.101.117.140.443: Flags [.], ack 606417, win 65535, length 0
00:14:52.301879 IP 10.0.2.15.52948 > 151.101.117.140.443: Flags [.], ack 609165, win 65535, length 0
00:14:52.302080 IP 151.101.117.140.443 > 10.0.2.15.52948: Flags [P.], seq 609165:611913, ack 304, win 65535, length 2748
00:14:52.302087 IP 10.0.2.15.52948 > 151.101.117.140.443: Flags [.], ack 611913, win 65535, length 0
00:14:52.302376 IP 151.101.117.140.443 > 10.0.2.15.52948: Flags [P.], seq 611913:614661, ack 304, win 65535, length 2748
00:14:52.302386 IP 10.0.2.15.52948 > 151.101.117.140.443: Flags [.], ack 614661, win 65535, length 0
00:14:52.302604 IP 151.101.117.140.443 > 10.0.2.15.52948: Flags [P.], seq 614661:617409, ack 304, win 65535, length 2748
00:14:52.302612 IP 10.0.2.15.52948 > 151.101.117.140.443: Flags [.], ack 617409, win 65535, length 0
00:14:52.303523 IP 151.101.117.140.443 > 10.0.2.15.52948: Flags [P.], seq 617409:620157, ack 304, win 65535, length 2748
00:14:52.303525 IP 151.101.117.140.443 > 10.0.2.15.52948: Flags [P.], seq 620157:625653, ack 304, win 65535, length 5496
00:14:52.303538 IP 10.0.2.15.52948 > 151.101.117.140.443: Flags [.], ack 620157, win 65535, length 0
00:14:52.303560 IP 10.0.2.15.52948 > 151.101.117.140.443: Flags [.], ack 625653, win 65535, length 0
00:14:52.303683 IP 151.101.117.140.443 > 10.0.2.15.52948: Flags [P.], seq 625653:628401, ack 304, win 65535, length 2748
00:14:52.303692 IP 10.0.2.15.52948 > 151.101.117.140.443: Flags [.], ack 628401, win 65535, length 0
00:14:52.304099 IP 151.101.117.140.443 > 10.0.2.15.52948: Flags [P.], seq 628401:631149, ack 304, win 65535, length 2748
00:14:52.304113 IP 10.0.2.15.52948 > 151.101.117.140.443: Flags [.], ack 631149, win 65535, length 0
00:14:52.304209 IP 151.101.117.140.443 > 10.0.2.15.52948: Flags [P.], seq 631149:633897, ack 304, win 65535, length 2748
00:14:52.304215 IP 10.0.2.15.52948 > 151.101.117.140.443: Flags [.], ack 633897, win 65535, length 0
00:14:52.304418 IP 151.101.117.140.443 > 10.0.2.15.52948: Flags [P.], seq 633897:636645, ack 304, win 65535, length 2748
00:14:52.304430 IP 10.0.2.15.52948 > 151.101.117.140.443: Flags [.], ack 636645, win 65535, length 0
00:14:52.304762 IP 151.101.117.140.443 > 10.0.2.15.52948: Flags [P.], seq 636645:639393, ack 304, win 65535, length 2748
00:14:52.304763 IP 151.101.117.140.443 > 10.0.2.15.52948: Flags [P.], seq 639393:642141, ack 304, win 65535, length 2748
00:14:52.304773 IP 10.0.2.15.52948 > 151.101.117.140.443: Flags [.], ack 639393, win 65535, length 0
00:14:52.304789 IP 10.0.2.15.52948 > 151.101.117.140.443: Flags [.], ack 642141, win 65535, length 0
00:14:52.305242 IP 151.101.117.140.443 > 10.0.2.15.52948: Flags [P.], seq 642141:643515, ack 304, win 65535, length 1374
00:14:52.305259 IP 10.0.2.15.52948 > 151.101.117.140.443: Flags [.], ack 643515, win 65535, length 0
00:14:52.305732 IP 151.101.117.140.443 > 10.0.2.15.52948: Flags [P.], seq 643515:647637, ack 304, win 65535, length 4122
00:14:52.305799 IP 10.0.2.15.52948 > 151.101.117.140.443: Flags [.], ack 647637, win 65535, length 0
00:14:52.306527 IP 151.101.117.140.443 > 10.0.2.15.52948: Flags [P.], seq 647637:651759, ack 304, win 65535, length 4122
00:14:52.306529 IP 151.101.117.140.443 > 10.0.2.15.52948: Flags [P.], seq 651759:654507, ack 304, win 65535, length 2748
00:14:52.306530 IP 151.101.117.140.443 > 10.0.2.15.52948: Flags [P.], seq 654507:657255, ack 304, win 65535, length 2748
00:14:52.306531 IP 151.101.117.140.443 > 10.0.2.15.52948: Flags [P.], seq 657255:660003, ack 304, win 65535, length 2748
00:14:52.306547 IP 10.0.2.15.52948 > 151.101.117.140.443: Flags [.], ack 651759, win 65535, length 0
00:14:52.306567 IP 10.0.2.15.52948 > 151.101.117.140.443: Flags [.], ack 654507, win 65535, length 0
00:14:52.306581 IP 10.0.2.15.52948 > 151.101.117.140.443: Flags [.], ack 657255, win 65535, length 0
00:14:52.306593 IP 10.0.2.15.52948 > 151.101.117.140.443: Flags [.], ack 660003, win 65535, length 0
00:14:52.306866 IP 151.101.117.140.443 > 10.0.2.15.52948: Flags [P.], seq 660003:662751, ack 304, win 65535, length 2748
00:14:52.306938 IP 10.0.2.15.52948 > 151.101.117.140.443: Flags [.], ack 662751, win 65535, length 0
00:14:52.307266 IP 151.101.117.140.443 > 10.0.2.15.52948: Flags [P.], seq 662751:665499, ack 304, win 65535, length 2748
00:14:52.307268 IP 151.101.117.140.443 > 10.0.2.15.52948: Flags [P.], seq 665499:668247, ack 304, win 65535, length 2748
00:14:52.307286 IP 10.0.2.15.52948 > 151.101.117.140.443: Flags [.], ack 665499, win 65535, length 0
00:14:52.307307 IP 10.0.2.15.52948 > 151.101.117.140.443: Flags [.], ack 668247, win 65535, length 0
00:14:52.307699 IP 151.101.117.140.443 > 10.0.2.15.52948: Flags [P.], seq 668247:669621, ack 304, win 65535, length 1374
00:14:52.307710 IP 10.0.2.15.52948 > 151.101.117.140.443: Flags [.], ack 669621, win 65535, length 0
00:14:52.308133 IP 151.101.117.140.443 > 10.0.2.15.52948: Flags [P.], seq 669621:673743, ack 304, win 65535, length 4122
00:14:52.308144 IP 10.0.2.15.52948 > 151.101.117.140.443: Flags [.], ack 673743, win 65535, length 0
00:14:52.308504 IP 151.101.117.140.443 > 10.0.2.15.52948: Flags [P.], seq 673743:676491, ack 304, win 65535, length 2748

