00:14:57.101904 IP 10.0.2.15.52958 > 151.101.117.140.443: Flags [P.], seq 3999201558:3999202075, ack 79040002, win 64240, length 517
00:14:57.102364 IP 151.101.117.140.443 > 10.0.2.15.52958: Flags [.], ack 517, win 65535, length 0
00:14:57.118667 IP 151.101.117.140.443 > 10.0.2.15.52958: Flags [.], seq 1:2921, ack 517, win 65535, length 2920
00:14:57.118689 IP 10.0.2.15.52958 > 151.101.117.140.443: Flags [.], ack 2921, win 62780, length 0
00:14:57.118882 IP 151.101.117.140.443 > 10.0.2.15.52958: Flags [P.], seq 2921:3722, ack 517, win 65535, length 801
00:14:57.118895 IP 10.0.2.15.52958 > 151.101.117.140.443: Flags [.], ack 3722, win 61979, length 0
00:14:57.121658 IP 10.0.2.15.52958 > 151.101.117.140.443: Flags [P.], seq 517:597, ack 3722, win 61979, length 80
00:14:57.122149 IP 10.0.2.15.52958 > 151.101.117.140.443: Flags [P.], seq 597:643, ack 3722, win 61979, length 46
00:14:57.122246 IP 10.0.2.15.52958 > 151.101.117.140.443: Flags [P.], seq 643:692, ack 3722, win 61979, length 49
00:14:57.123003 IP 151.101.117.140.443 > 10.0.2.15.52958: Flags [.], ack 597, win 65535, length 0
00:14:57.123034 IP 10.0.2.15.52958 > 151.101.117.140.443: Flags [P.], seq 692:789, ack 3722, win 62780, length 97
00:14:57.124065 IP 151.101.117.140.443 > 10.0.2.15.52958: Flags [.], ack 643, win 65535, length 0
00:14:57.124068 IP 151.101.117.140.443 > 10.0.2.15.52958: Flags [.], ack 692, win 65535, length 0
00:14:57.124069 IP 151.101.117.140.443 > 10.0.2.15.52958: Flags [.], ack 789, win 65535, length 0
00:14:57.136852 IP 151.101.117.140.443 > 10.0.2.15.52958: Flags [P.], seq 3722:3803, ack 789, win 65535, length 81
00:14:57.136869 IP 10.0.2.15.52958 > 151.101.117.140.443: Flags [.], ack 3803, win 62780, length 0
00:14:57.137055 IP 10.0.2.15.52958 > 151.101.117.140.443: Flags [P.], seq 789:820, ack 3803, win 62780, length 31
00:14:57.137502 IP 151.101.117.140.443 > 10.0.2.15.52958: Flags [.], ack 820, win 65535, length 0
00:14:57.278765 IP 151.101.117.140.443 > 10.0.2.15.52958: Flags [.], seq 3803:11103, ack 820, win 65535, length 7300
00:14:57.278792 IP 10.0.2.15.52958 > 151.101.117.140.443: Flags [.], ack 11103, win 59860, length 0
00:14:57.279023 IP 151.101.117.140.443 > 10.0.2.15.52958: Flags [.], seq 11103:12563, ack 820, win 65535, length 1460
00:14:57.279042 IP 10.0.2.15.52958 > 151.101.117.140.443: Flags [.], ack 12563, win 58400, length 0
00:14:57.279284 IP 151.101.117.140.443 > 10.0.2.15.52958: Flags [P.], seq 12563:13199, ack 820, win 65535, length 636
00:14:57.279302 IP 10.0.2.15.52958 > 151.101.117.140.443: Flags [.], ack 13199, win 58400, length 0
00:14:57.280794 IP 151.101.117.140.443 > 10.0.2.15.52958: Flags [P.], seq 13199:16527, ack 820, win 65535, length 3328
00:14:57.280810 IP 10.0.2.15.52958 > 151.101.117.140.443: Flags [.], ack 16527, win 61320, length 0
00:14:57.289749 IP 151.101.117.140.443 > 10.0.2.15.52958: Flags [P.], seq 16527:20649, ack 820, win 65535, length 4122
00:14:57.289806 IP 10.0.2.15.52958 > 151.101.117.140.443: Flags [.], ack 20649, win 61320, length 0
00:14:57.289951 IP 151.101.117.140.443 > 10.0.2.15.52958: Flags [P.], seq 20649:22023, ack 820, win 65535, length 1374
00:14:57.289995 IP 10.0.2.15.52958 > 151.101.117.140.443: Flags [.], ack 22023, win 61320, length 0
00:14:57.291007 IP 151.101.117.140.443 > 10.0.2.15.52958: Flags [P.], seq 22023:24771, ack 820, win 65535, length 2748
00:14:57.291024 IP 10.0.2.15.52958 > 151.101.117.140.443: Flags [.], ack 24771, win 62780, length 0
00:14:57.292318 IP 151.101.117.140.443 > 10.0.2.15.52958: Flags [P.], seq 24771:27519, ack 820, win 65535, length 2748
00:14:57.292435 IP 10.0.2.15.52958 > 151.101.117.140.443: Flags [.], ack 27519, win 62780, length 0
00:14:57.293705 IP 151.101.117.140.443 > 10.0.2.15.52958: Flags [P.], seq 27519:31641, ack 820, win 65535, length 4122
00:14:57.293708 IP 151.101.117.140.443 > 10.0.2.15.52958: Flags [P.], seq 31641:33015, ack 820, win 65535, length 1374
00:14:57.293791 IP 10.0.2.15.52958 > 151.101.117.140.443: Flags [.], ack 33015, win 61320, length 0
00:14:57.294566 IP 151.101.117.140.443 > 10.0.2.15.52958: Flags [P.], seq 33015:38511, ack 820, win 65535, length 5496
00:14:57.294580 IP 10.0.2.15.52958 > 151.101.117.140.443: Flags [.], ack 38511, win 61320, length 0
00:14:57.294890 IP 151.101.117.140.443 > 10.0.2.15.52958: Flags [P.], seq 38511:39885, ack 820, win 65535, length 1374
00:14:57.294942 IP 10.0.2.15.52958 > 151.101.117.140.443: Flags [.], ack 39885, win 62780, length 0
00:14:57.296949 IP 151.101.117.140.443 > 10.0.2.15.52958: Flags [P.], seq 39885:45673, ack 820, win 65535, length 5788
00:14:57.297056 IP 10.0.2.15.52958 > 151.101.117.140.443: Flags [.], ack 45673, win 61320, length 0
00:14:57.301564 IP 151.101.117.140.443 > 10.0.2.15.52958: Flags [P.], seq 45673:49795, ack 820, win 65535, length 4122
00:14:57.301586 IP 10.0.2.15.52958 > 151.101.117.140.443: Flags [.], ack 49795, win 61320, length 0
00:14:57.302569 IP 151.101.117.140.443 > 10.0.2.15.52958: Flags [P.], seq 49795:55291, ack 820, win 65535, length 5496
00:14:57.302681 IP 10.0.2.15.52958 > 151.101.117.140.443: Flags [.], ack 55291, win 61320, length 0
00:14:57.302918 IP 151.101.117.140.443 > 10.0.2.15.52958: Flags [P.], seq 55291:58039, ack 820, win 65535, length 2748
00:14:57.302993 IP 10.0.2.15.52958 > 151.101.117.140.443: Flags [.], ack 58039, win 58572, length 0
00:14:57.303766 IP 151.101.117.140.443 > 10.0.2.15.52958: Flags [P.], seq 58039:62161, ack 820, win 65535, length 4122
00:14:57.303781 IP 10.0.2.15.52958 > 151.101.117.140.443: Flags [.], ack 62161, win 61320, length 0
00:14:57.305006 IP 151.101.117.140.443 > 10.0.2.15.52958: Flags [P.], seq 62161:67657, ack 820, win 65535, length 5496
00:14:57.305026 IP 10.0.2.15.52958 > 151.101.117.140.443: Flags [.], ack 67657, win 61320, length 0
00:14:57.305171 IP 151.101.117.140.443 > 10.0.2.15.52958: Flags [P.], seq 67657:70405, ack 820, win 65535, length 2748
00:14:57.305270 IP 151.101.117.140.443 > 10.0.2.15.52958: Flags [P.], seq 70405:71779, ack 820, win 65535, length 1374
00:14:57.305318 IP 10.0.2.15.52958 > 151.101.117.140.443: Flags [.], ack 71779, win 62780, length 0
00:14:57.306200 IP 151.101.117.140.443 > 10.0.2.15.52958: Flags [P.], seq 71779:74527, ack 820, win 65535, length 2748
00:14:57.306201 IP 151.101.117.140.443 > 10.0.2.15.52958: Flags [P.], seq 74527:77275, ack 820, win 65535, length 2748
00:14:57.306218 IP 10.0.2.15.52958 > 151.101.117.140.443: Flags [.], ack 74527, win 65535, length 0
00:14:57.306243 IP 10.0.2.15.52958 > 151.101.117.140.443: Flags [.], ack 77275, win 65535, length 0
00:14:57.307285 IP 151.101.117.140.443 > 10.0.2.15.52958: Flags [P.], seq 77275:84145, ack 820, win 65535, length 6870
00:14:57.307288 IP 151.101.117.140.443 > 10.0.2.15.52958: Flags [P.], seq 84145:85519, ack 820, win 65535, length 1374
00:14:57.307306 IP 10.0.2.15.52958 > 151.101.117.140.443: Flags [.], ack 84145, win 65535, length 0
00:14:57.307334 IP 10.0.2.15.52958 > 151.101.117.140.443: Flags [.], ack 85519, win 65535, length 0
00:14:57.307490 IP 151.101.117.140.443 > 10.0.2.15.52958: Flags [P.], seq 85519:88267, ack 820, win 65535, length 2748
00:14:57.307497 IP 10.0.2.15.52958 > 151.101.117.140.443: Flags [.], ack 88267, win 65535, length 0
00:14:57.307675 IP 151.101.117.140.443 > 10.0.2.15.52958: Flags [P.], seq 88267:89641, ack 820, win 65535, length 1374
00:14:57.307682 IP 10.0.2.15.52958 > 151.101.117.140.443: Flags [.], ack 89641, win 65535, length 0
00:14:57.308667 IP 151.101.117.140.443 > 10.0.2.15.52958: Flags [P.], seq 89641:92389, ack 820, win 65535, length 2748
00:14:57.308669 IP 151.101.117.140.443 > 10.0.2.15.52958: Flags [P.], seq 92389:95315, ack 820, win 65535, length 2926
00:14:57.308684 IP 10.0.2.15.52958 > 151.101.117.140.443: Flags [.], ack 92389, win 65535, length 0
00:14:57.308755 IP 10.0.2.15.52958 > 151.101.117.140.443: Flags [.], ack 95315, win 65535, length 0
00:14:57.314158 IP 151.101.117.140.443 > 10.0.2.15.52958: Flags [P.], seq 95315:102185, ack 820, win 65535, length 6870
00:14:57.314160 IP 151.101.117.140.443 > 10.0.2.15.52958: Flags [.], seq 102185:103645, ack 820, win 65535, length 1460
00:14:57.314228 IP 10.0.2.15.52958 > 151.101.117.140.443: Flags [.], ack 102185, win 65535, length 0
00:14:57.314261 IP 10.0.2.15.52958 > 151.101.117.140.443: Flags [.], ack 103645, win 65535, length 0
00:14:57.314762 IP 151.101.117.140.443 > 10.0.2.15.52958: Flags [P.], seq 103645:104933, ack 820, win 65535, length 1288
00:14:57.314766 IP 151.101.117.140.443 > 10.0.2.15.52958: Flags [P.], seq 104933:110429, ack 820, win 65535, length 5496
00:14:57.314767 IP 151.101.117.140.443 > 10.0.2.15.52958: Flags [P.], seq 110429:111744, ack 820, win 65535, length 1315
00:14:57.314788 IP 10.0.2.15.52958 > 151.101.117.140.443: Flags [.], ack 104933, win 65535, length 0
00:14:57.314819 IP 10.0.2.15.52958 > 151.101.117.140.443: Flags [.], ack 110429, win 65535, length 0
00:14:57.314832 IP 10.0.2.15.52958 > 151.101.117.140.443: Flags [.], ack 111744, win 65535, length 0
00:14:57.315611 IP 151.101.117.140.443 > 10.0.2.15.52958: Flags [P.], seq 111744:114492, ack 820, win 65535, length 2748
00:14:57.315627 IP 10.0.2.15.52958 > 151.101.117.140.443: Flags [.], ack 114492, win 65535, length 0
00:14:57.315863 IP 151.101.117.140.443 > 10.0.2.15.52958: Flags [P.], seq 114492:120215, ack 820, win 65535, length 5723
00:14:57.315876 IP 10.0.2.15.52958 > 151.101.117.140.443: Flags [.], ack 120215, win 65535, length 0
00:14:57.316153 IP 151.101.117.140.443 > 10.0.2.15.52958: Flags [P.], seq 120215:121589, ack 820, win 65535, length 1374
00:14:57.316162 IP 10.0.2.15.52958 > 151.101.117.140.443: Flags [.], ack 121589, win 65535, length 0
00:14:57.316259 IP 151.101.117.140.443 > 10.0.2.15.52958: Flags [P.], seq 121589:125711, ack 820, win 65535, length 4122
00:14:57.316265 IP 10.0.2.15.52958 > 151.101.117.140.443: Flags [.], ack 125711, win 65535, length 0
00:14:57.316714 IP 151.101.117.140.443 > 10.0.2.15.52958: Flags [P.], seq 125711:127085, ack 820, win 65535, length 1374
00:14:57.316716 IP 151.101.117.140.443 > 10.0.2.15.52958: Flags [P.], seq 127085:131207, ack 820, win 65535, length 4122
00:14:57.316731 IP 10.0.2.15.52958 > 151.101.117.140.443: Flags [.], ack 127085, win 65535, length 0
00:14:57.316752 IP 10.0.2.15.52958 > 151.101.117.140.443: Flags [.], ack 131207, win 65535, length 0
00:14:57.316932 IP 151.101.117.140.443 > 10.0.2.15.52958: Flags [P.], seq 131207:135329, ack 820, win 65535, length 4122
00:14:57.316940 IP 10.0.2.15.52958 > 151.101.117.140.443: Flags [.], ack 135329, win 65535, length 0
00:14:57.317162 IP 151.101.117.140.443 > 10.0.2.15.52958: Flags [P.], seq 135329:138077, ack 820, win 65535, length 2748
00:14:57.317180 IP 10.0.2.15.52958 > 151.101.117.140.443: Flags [.], ack 138077, win 65535, length 0
00:14:57.318350 IP 151.101.117.140.443 > 10.0.2.15.52958: Flags [P.], seq 138077:142199, ack 820, win 65535, length 4122
00:14:57.318360 IP 10.0.2.15.52958 > 151.101.117.140.443: Flags [.], ack 142199, win 65535, length 0
00:14:57.318511 IP 151.101.117.140.443 > 10.0.2.15.52958: Flags [P.], seq 142199:144947, ack 820, win 65535, length 2748
00:14:57.318520 IP 10.0.2.15.52958 > 151.101.117.140.443: Flags [.], ack 144947, win 65535, length 0
00:14:57.318763 IP 151.101.117.140.443 > 10.0.2.15.52958: Flags [P.], seq 144947:147695, ack 820, win 65535, length 2748
00:14:57.318772 IP 10.0.2.15.52958 > 151.101.117.140.443: Flags [.], ack 147695, win 65535, length 0
00:14:57.318953 IP 151.101.117.140.443 > 10.0.2.15.52958: Flags [P.], seq 147695:150443, ack 820, win 65535, length 2748
00:14:57.318959 IP 10.0.2.15.52958 > 151.101.117.140.443: Flags [.], ack 150443, win 65535, length 0
00:14:57.319185 IP 151.101.117.140.443 > 10.0.2.15.52958: Flags [P.], seq 150443:153191, ack 820, win 65535, length 2748
00:14:57.319197 IP 10.0.2.15.52958 > 151.101.117.140.443: Flags [.], ack 153191, win 65535, length 0
00:14:57.319597 IP 151.101.117.140.443 > 10.0.2.15.52958: Flags [P.], seq 153191:155939, ack 820, win 65535, length 2748
00:14:57.319606 IP 10.0.2.15.52958 > 151.101.117.140.443: Flags [.], ack 155939, win 65535, length 0
00:14:57.320913 IP 151.101.117.140.443 > 10.0.2.15.52958: Flags [P.], seq 155939:161435, ack 820, win 65535, length 5496
00:14:57.320928 IP 10.0.2.15.52958 > 151.101.117.140.443: Flags [.], ack 161435, win 65535, length 0
00:14:57.321149 IP 151.101.117.140.443 > 10.0.2.15.52958: Flags [P.], seq 161435:165557, ack 820, win 65535, length 4122
00:14:57.321151 IP 151.101.117.140.443 > 10.0.2.15.52958: Flags [P.], seq 165557:166931, ack 820, win 65535, length 1374
00:14:57.321166 IP 10.0.2.15.52958 > 151.101.117.140.443: Flags [.], ack 165557, win 65535, length 0
00:14:57.321237 IP 10.0.2.15.52958 > 151.101.117.140.443: Flags [.], ack 166931, win 65535, length 0
00:14:57.321455 IP 151.101.117.140.443 > 10.0.2.15.52958: Flags [P.], seq 166931:168305, ack 820, win 65535, length 1374
00:14:57.321457 IP 151.101.117.140.443 > 10.0.2.15.52958: Flags [P.], seq 168305:171053, ack 820, win 65535, length 2748
00:14:57.321467 IP 10.0.2.15.52958 > 151.101.117.140.443: Flags [.], ack 168305, win 65535, length 0
00:14:57.321483 IP 10.0.2.15.52958 > 151.101.117.140.443: Flags [.], ack 171053, win 65535, length 0
00:14:57.321720 IP 151.101.117.140.443 > 10.0.2.15.52958: Flags [P.], seq 171053:173801, ack 820, win 65535, length 2748
00:14:57.321731 IP 10.0.2.15.52958 > 151.101.117.140.443: Flags [.], ack 173801, win 65535, length 0
00:14:57.321947 IP 151.101.117.140.443 > 10.0.2.15.52958: Flags [P.], seq 173801:176549, ack 820, win 65535, length 2748
00:14:57.322073 IP 10.0.2.15.52958 > 151.101.117.140.443: Flags [.], ack 176549, win 65535, length 0
00:14:57.322229 IP 151.101.117.140.443 > 10.0.2.15.52958: Flags [P.], seq 176549:177454, ack 820, win 65535, length 905
00:14:57.322238 IP 10.0.2.15.52958 > 151.101.117.140.443: Flags [.], ack 177454, win 65535, length 0
00:14:57.328811 IP 151.101.117.140.443 > 10.0.2.15.52958: Flags [P.], seq 177454:184324, ack 820, win 65535, length 6870
00:14:57.328816 IP 151.101.117.140.443 > 10.0.2.15.52958: Flags [P.], seq 184324:189820, ack 820, win 65535, length 5496
00:14:57.329131 IP 10.0.2.15.52958 > 151.101.117.140.443: Flags [.], ack 184324, win 65535, length 0
00:14:57.329460 IP 10.0.2.15.52958 > 151.101.117.140.443: Flags [.], ack 189820, win 65535, length 0
00:14:57.329787 IP 151.101.117.140.443 > 10.0.2.15.52958: Flags [P.], seq 189820:193942, ack 820, win 65535, length 4122
00:14:57.329790 IP 151.101.117.140.443 > 10.0.2.15.52958: Flags [P.], seq 193942:197760, ack 820, win 65535, length 3818
00:14:57.329814 IP 10.0.2.15.52958 > 151.101.117.140.443: Flags [.], ack 193942, win 65535, length 0
00:14:57.329894 IP 10.0.2.15.52958 > 151.101.117.140.443: Flags [.], ack 197760, win 65535, length 0
00:14:58.099864 IP 151.101.117.140.443 > 10.0.2.15.52958: Flags [P.], seq 197760:199231, ack 820, win 65535, length 1471
00:14:58.100150 IP 10.0.2.15.52958 > 151.101.117.140.443: Flags [.], ack 199231, win 65535, length 0
00:14:58.110177 IP 151.101.117.140.443 > 10.0.2.15.52958: Flags [.], seq 199231:202151, ack 820, win 65535, length 2920
00:14:58.110200 IP 10.0.2.15.52958 > 151.101.117.140.443: Flags [.], ack 202151, win 65535, length 0
00:14:58.110547 IP 151.101.117.140.443 > 10.0.2.15.52958: Flags [P.], seq 202151:207475, ack 820, win 65535, length 5324
00:14:58.110550 IP 151.101.117.140.443 > 10.0.2.15.52958: Flags [P.], seq 207475:212971, ack 820, win 65535, length 5496
00:14:58.110572 IP 10.0.2.15.52958 > 151.101.117.140.443: Flags [.], ack 207475, win 65535, length 0
00:14:58.110712 IP 10.0.2.15.52958 > 151.101.117.140.443: Flags [.], ack 212971, win 65535, length 0
00:14:58.110760 IP 151.101.117.140.443 > 10.0.2.15.52958: Flags [P.], seq 212971:215661, ack 820, win 65535, length 2690
00:14:58.110762 IP 151.101.117.140.443 > 10.0.2.15.52958: Flags [P.], seq 215661:219783, ack 820, win 65535, length 4122
00:14:58.110776 IP 10.0.2.15.52958 > 151.101.117.140.443: Flags [.], ack 215661, win 65535, length 0
00:14:58.110794 IP 10.0.2.15.52958 > 151.101.117.140.443: Flags [.], ack 219783, win 65535, length 0
00:14:58.111391 IP 151.101.117.140.443 > 10.0.2.15.52958: Flags [P.], seq 219783:222531, ack 820, win 65535, length 2748
00:14:58.111447 IP 151.101.117.140.443 > 10.0.2.15.52958: Flags [P.], seq 222531:225279, ack 820, win 65535, length 2748
00:14:58.111511 IP 10.0.2.15.52958 > 151.101.117.140.443: Flags [.], ack 222531, win 65535, length 0
00:14:58.111577 IP 10.0.2.15.52958 > 151.101.117.140.443: Flags [.], ack 225279, win 65535, length 0
00:14:58.111699 IP 151.101.117.140.443 > 10.0.2.15.52958: Flags [P.], seq 225279:233466, ack 820, win 65535, length 8187
00:14:58.111712 IP 10.0.2.15.52958 > 151.101.117.140.443: Flags [.], ack 233466, win 65535, length 0
00:14:58.115382 IP 151.101.117.140.443 > 10.0.2.15.52958: Flags [P.], seq 233466:247217, ack 820, win 65535, length 13751
00:14:58.115455 IP 10.0.2.15.52958 > 151.101.117.140.443: Flags [.], ack 247217, win 65535, length 0
00:14:58.115520 IP 151.101.117.140.443 > 10.0.2.15.52958: Flags [P.], seq 247217:263647, ack 820, win 65535, length 16430
00:14:58.115533 IP 10.0.2.15.52958 > 151.101.117.140.443: Flags [.], ack 263647, win 65535, length 0
00:14:58.115560 IP 151.101.117.140.443 > 10.0.2.15.52958: Flags [P.], seq 263647:269092, ack 820, win 65535, length 5445
00:14:58.115568 IP 10.0.2.15.52958 > 151.101.117.140.443: Flags [.], ack 269092, win 65535, length 0
00:14:58.123965 IP 151.101.117.140.443 > 10.0.2.15.52958: Flags [P.], seq 269092:280084, ack 820, win 65535, length 10992
00:14:58.123989 IP 10.0.2.15.52958 > 151.101.117.140.443: Flags [.], ack 280084, win 65535, length 0
00:14:58.125434 IP 151.101.117.140.443 > 10.0.2.15.52958: Flags [P.], seq 280084:307462, ack 820, win 65535, length 27378
00:14:58.125455 IP 10.0.2.15.52958 > 151.101.117.140.443: Flags [.], ack 307462, win 65535, length 0
00:14:58.126591 IP 151.101.117.140.443 > 10.0.2.15.52958: Flags [P.], seq 307462:312122, ack 820, win 65535, length 4660
00:14:58.126594 IP 151.101.117.140.443 > 10.0.2.15.52958: Flags [P.], seq 312122:314870, ack 820, win 65535, length 2748
00:14:58.126738 IP 10.0.2.15.52958 > 151.101.117.140.443: Flags [.], ack 312122, win 65535, length 0
00:14:58.126922 IP 10.0.2.15.52958 > 151.101.117.140.443: Flags [.], ack 314870, win 65535, length 0
00:14:58.130762 IP 151.101.117.140.443 > 10.0.2.15.52958: Flags [.], seq 314870:328010, ack 820, win 65535, length 13140
00:14:58.131764 IP 10.0.2.15.52958 > 151.101.117.140.443: Flags [.], ack 328010, win 65535, length 0
00:14:58.136473 IP 151.101.117.140.443 > 10.0.2.15.52958: Flags [P.], seq 328010:339545, ack 820, win 65535, length 11535
00:14:58.136533 IP 10.0.2.15.52958 > 151.101.117.140.443: Flags [.], ack 339545, win 65535, length 0
00:14:58.136666 IP 151.101.117.140.443 > 10.0.2.15.52958: Flags [P.], seq 339545:340919, ack 820, win 65535, length 1374
00:14:58.136670 IP 151.101.117.140.443 > 10.0.2.15.52958: Flags [P.], seq 340919:356003, ack 820, win 65535, length 15084
00:14:58.136891 IP 10.0.2.15.52958 > 151.101.117.140.443: Flags [.], ack 340919, win 65535, length 0
00:14:58.136983 IP 10.0.2.15.52958 > 151.101.117.140.443: Flags [.], ack 356003, win 65535, length 0
00:14:58.137360 IP 151.101.117.140.443 > 10.0.2.15.52958: Flags [.], seq 356003:370603, ack 820, win 65535, length 14600
00:14:58.137378 IP 10.0.2.15.52958 > 151.101.117.140.443: Flags [.], ack 370603, win 65535, length 0
00:14:58.164460 IP 151.101.117.140.443 > 10.0.2.15.52958: Flags [P.], seq 370603:391548, ack 820, win 65535, length 20945
00:14:58.164486 IP 10.0.2.15.52958 > 151.101.117.140.443: Flags [.], ack 391548, win 65535, length 0
00:14:58.166192 IP 151.101.117.140.443 > 10.0.2.15.52958: Flags [P.], seq 391548:435348, ack 820, win 65535, length 43800
00:14:58.166222 IP 10.0.2.15.52958 > 151.101.117.140.443: Flags [.], ack 435348, win 65535, length 0
00:14:58.169170 IP 151.101.117.140.443 > 10.0.2.15.52958: Flags [.], seq 435348:499588, ack 820, win 65535, length 64240
00:14:58.169479 IP 10.0.2.15.52958 > 151.101.117.140.443: Flags [.], ack 499588, win 65535, length 0
00:14:58.173505 IP 151.101.117.140.443 > 10.0.2.15.52958: Flags [P.], seq 499588:501048, ack 820, win 65535, length 1460
00:14:58.173528 IP 10.0.2.15.52958 > 151.101.117.140.443: Flags [.], ack 501048, win 65535, length 0
00:14:58.180274 IP 151.101.117.140.443 > 10.0.2.15.52958: Flags [P.], seq 501048:565288, ack 820, win 65535, length 64240
00:14:58.180303 IP 10.0.2.15.52958 > 151.101.117.140.443: Flags [.], ack 565288, win 65535, length 0
00:14:58.181231 IP 151.101.117.140.443 > 10.0.2.15.52958: Flags [.], seq 565288:597408, ack 820, win 65535, length 32120
00:14:58.181257 IP 10.0.2.15.52958 > 151.101.117.140.443: Flags [.], ack 597408, win 65535, length 0
00:14:58.202136 IP 151.101.117.140.443 > 10.0.2.15.52958: Flags [.], seq 597408:598868, ack 820, win 65535, length 1460
00:14:58.202167 IP 10.0.2.15.52958 > 151.101.117.140.443: Flags [.], ack 598868, win 65535, length 0
00:14:58.206548 IP 151.101.117.140.443 > 10.0.2.15.52958: Flags [.], seq 598868:600328, ack 820, win 65535, length 1460
00:14:58.206631 IP 10.0.2.15.52958 > 151.101.117.140.443: Flags [.], ack 600328, win 65535, length 0
00:14:58.210874 IP 151.101.117.140.443 > 10.0.2.15.52958: Flags [.], seq 600328:601788, ack 820, win 65535, length 1460
00:14:58.210901 IP 10.0.2.15.52958 > 151.101.117.140.443: Flags [.], ack 601788, win 65535, length 0
00:14:58.211444 IP 151.101.117.140.443 > 10.0.2.15.52958: Flags [.], seq 601788:603248, ack 820, win 65535, length 1460
00:14:58.211465 IP 10.0.2.15.52958 > 151.101.117.140.443: Flags [.], ack 603248, win 65535, length 0
00:14:58.212027 IP 151.101.117.140.443 > 10.0.2.15.52958: Flags [.], seq 603248:604708, ack 820, win 65535, length 1460
00:14:58.212225 IP 10.0.2.15.52958 > 151.101.117.140.443: Flags [.], ack 604708, win 65535, length 0
00:14:58.216704 IP 151.101.117.140.443 > 10.0.2.15.52958: Flags [.], seq 604708:606168, ack 820, win 65535, length 1460
00:14:58.216732 IP 10.0.2.15.52958 > 151.101.117.140.443: Flags [.], ack 606168, win 65535, length 0
00:14:58.217540 IP 151.101.117.140.443 > 10.0.2.15.52958: Flags [.], seq 606168:607628, ack 820, win 65535, length 1460
00:14:58.217563 IP 10.0.2.15.52958 > 151.101.117.140.443: Flags [.], ack 607628, win 65535, length 0
00:14:58.218147 IP 151.101.117.140.443 > 10.0.2.15.52958: Flags [.], seq 607628:609088, ack 820, win 65535, length 1460
00:14:58.218168 IP 10.0.2.15.52958 > 151.101.117.140.443: Flags [.], ack 609088, win 65535, length 0
00:14:58.218320 IP 151.101.117.140.443 > 10.0.2.15.52958: Flags [.], seq 609088:613468, ack 820, win 65535, length 4380
00:14:58.218329 IP 10.0.2.15.52958 > 151.101.117.140.443: Flags [.], ack 613468, win 65535, length 0
00:14:58.218483 IP 151.101.117.140.443 > 10.0.2.15.52958: Flags [.], seq 613468:616388, ack 820, win 65535, length 2920
00:14:58.218491 IP 10.0.2.15.52958 > 151.101.117.140.443: Flags [.], ack 616388, win 65535, length 0
00:14:58.218652 IP 151.101.117.140.443 > 10.0.2.15.52958: Flags [.], seq 616388:620768, ack 820, win 65535, length 4380
00:14:58.218733 IP 10.0.2.15.52958 > 151.101.117.140.443: Flags [.], ack 620768, win 65535, length 0
00:14:58.219630 IP 151.101.117.140.443 > 10.0.2.15.52958: Flags [.], seq 620768:626608, ack 820, win 65535, length 5840
00:14:58.219691 IP 10.0.2.15.52958 > 151.101.117.140.443: Flags [.], ack 626608, win 65535, length 0
00:14:58.219998 IP 151.101.117.140.443 > 10.0.2.15.52958: Flags [P.], seq 626608:630988, ack 820, win 65535, length 4380
00:14:58.220023 IP 10.0.2.15.52958 > 151.101.117.140.443: Flags [.], ack 630988, win 65535, length 0
00:14:58.221073 IP 151.101.117.140.443 > 10.0.2.15.52958: Flags [.], seq 630988:652888, ack 820, win 65535, length 21900
00:14:58.221096 IP 10.0.2.15.52958 > 151.101.117.140.443: Flags [.], ack 652888, win 65535, length 0

