20:03:36.539519 IP 10.0.2.15.47930 > 140.233.253.2.53: 3972+ A? www.reddit.com. (32)
20:03:36.539561 IP 10.0.2.15.47930 > 140.233.253.2.53: 42374+ AAAA? www.reddit.com. (32)
20:03:36.547459 IP 140.233.253.2.53 > 10.0.2.15.47930: 3972 2/0/0 CNAME reddit.map.fastly.net., A 151.101.117.140 (83)
20:03:36.547461 IP 140.233.253.2.53 > 10.0.2.15.47930: 42374 1/1/0 CNAME reddit.map.fastly.net. (125)
20:03:36.547684 IP 10.0.2.15.53120 > 151.101.117.140.443: Flags [S], seq 3267354082, win 64240, options [mss 1460,sackOK,TS val 3623705731 ecr 0,nop,wscale 6], length 0
20:03:36.563152 IP 151.101.117.140.443 > 10.0.2.15.53120: Flags [S.], seq 222144001, ack 3267354083, win 65535, options [mss 1460], length 0
20:03:36.563206 IP 10.0.2.15.53120 > 151.101.117.140.443: Flags [.], ack 1, win 64240, length 0
20:03:36.575142 IP 10.0.2.15.53120 > 151.101.117.140.443: Flags [P.], seq 1:518, ack 1, win 64240, length 517
20:03:36.575597 IP 151.101.117.140.443 > 10.0.2.15.53120: Flags [.], ack 518, win 65535, length 0
20:03:36.592260 IP 151.101.117.140.443 > 10.0.2.15.53120: Flags [P.], seq 1:2749, ack 518, win 65535, length 2748
20:03:36.592283 IP 10.0.2.15.53120 > 151.101.117.140.443: Flags [.], ack 2749, win 62780, length 0
20:03:36.593063 IP 151.101.117.140.443 > 10.0.2.15.53120: Flags [P.], seq 2749:3722, ack 518, win 65535, length 973
20:03:36.593082 IP 10.0.2.15.53120 > 151.101.117.140.443: Flags [.], ack 3722, win 61807, length 0
20:03:36.594233 IP 10.0.2.15.53120 > 151.101.117.140.443: Flags [P.], seq 518:598, ack 3722, win 61807, length 80
20:03:36.594511 IP 10.0.2.15.53120 > 151.101.117.140.443: Flags [P.], seq 598:644, ack 3722, win 61807, length 46
20:03:36.594550 IP 10.0.2.15.53120 > 151.101.117.140.443: Flags [P.], seq 644:693, ack 3722, win 61807, length 49
20:03:36.594685 IP 151.101.117.140.443 > 10.0.2.15.53120: Flags [.], ack 598, win 65535, length 0
20:03:36.595171 IP 151.101.117.140.443 > 10.0.2.15.53120: Flags [.], ack 644, win 65535, length 0
20:03:36.595259 IP 10.0.2.15.53120 > 151.101.117.140.443: Flags [P.], seq 693:728, ack 3722, win 61807, length 35
20:03:36.595318 IP 10.0.2.15.53120 > 151.101.117.140.443: Flags [P.], seq 728:790, ack 3722, win 61807, length 62
20:03:36.595488 IP 151.101.117.140.443 > 10.0.2.15.53120: Flags [.], ack 693, win 65535, length 0
20:03:36.595490 IP 151.101.117.140.443 > 10.0.2.15.53120: Flags [.], ack 728, win 65535, length 0
20:03:36.595491 IP 151.101.117.140.443 > 10.0.2.15.53120: Flags [.], ack 790, win 65535, length 0
20:03:36.608049 IP 151.101.117.140.443 > 10.0.2.15.53120: Flags [P.], seq 3722:3772, ack 790, win 65535, length 50
20:03:36.608068 IP 10.0.2.15.53120 > 151.101.117.140.443: Flags [.], ack 3772, win 62780, length 0
20:03:36.608276 IP 10.0.2.15.53120 > 151.101.117.140.443: Flags [P.], seq 790:821, ack 3772, win 62780, length 31
20:03:36.608598 IP 151.101.117.140.443 > 10.0.2.15.53120: Flags [.], ack 821, win 65535, length 0
20:03:36.612504 IP 151.101.117.140.443 > 10.0.2.15.53120: Flags [P.], seq 3772:3803, ack 821, win 65535, length 31
20:03:36.612526 IP 10.0.2.15.53120 > 151.101.117.140.443: Flags [.], ack 3803, win 62780, length 0
20:03:36.735654 IP 151.101.117.140.443 > 10.0.2.15.53120: Flags [P.], seq 3803:4953, ack 821, win 65535, length 1150
20:03:36.735673 IP 10.0.2.15.53120 > 151.101.117.140.443: Flags [.], ack 4953, win 62780, length 0
20:03:36.737688 IP 151.101.117.140.443 > 10.0.2.15.53120: Flags [P.], seq 4953:13197, ack 821, win 65535, length 8244
20:03:36.737691 IP 151.101.117.140.443 > 10.0.2.15.53120: Flags [P.], seq 13197:14571, ack 821, win 65535, length 1374
20:03:36.737719 IP 10.0.2.15.53120 > 151.101.117.140.443: Flags [.], ack 13197, win 58400, length 0
20:03:36.737766 IP 10.0.2.15.53120 > 151.101.117.140.443: Flags [.], ack 14571, win 58400, length 0
20:03:36.738488 IP 151.101.117.140.443 > 10.0.2.15.53120: Flags [P.], seq 14571:18693, ack 821, win 65535, length 4122
20:03:36.738491 IP 151.101.117.140.443 > 10.0.2.15.53120: Flags [P.], seq 18693:20067, ack 821, win 65535, length 1374
20:03:36.738514 IP 10.0.2.15.53120 > 151.101.117.140.443: Flags [.], ack 18693, win 61320, length 0
20:03:36.738551 IP 10.0.2.15.53120 > 151.101.117.140.443: Flags [.], ack 20067, win 61320, length 0
20:03:36.740234 IP 151.101.117.140.443 > 10.0.2.15.53120: Flags [P.], seq 20067:22815, ack 821, win 65535, length 2748
20:03:36.740267 IP 10.0.2.15.53120 > 151.101.117.140.443: Flags [.], ack 22815, win 62780, length 0
20:03:36.740792 IP 151.101.117.140.443 > 10.0.2.15.53120: Flags [P.], seq 22815:28311, ack 821, win 65535, length 5496
20:03:36.740856 IP 10.0.2.15.53120 > 151.101.117.140.443: Flags [.], ack 28311, win 58400, length 0
20:03:36.741848 IP 151.101.117.140.443 > 10.0.2.15.53120: Flags [P.], seq 28311:31059, ack 821, win 65535, length 2748
20:03:36.741861 IP 10.0.2.15.53120 > 151.101.117.140.443: Flags [.], ack 31059, win 62780, length 0
20:03:36.743042 IP 151.101.117.140.443 > 10.0.2.15.53120: Flags [P.], seq 31059:36555, ack 821, win 65535, length 5496
20:03:36.743130 IP 10.0.2.15.53120 > 151.101.117.140.443: Flags [.], ack 36555, win 61320, length 0
20:03:36.743877 IP 151.101.117.140.443 > 10.0.2.15.53120: Flags [P.], seq 36555:39303, ack 821, win 65535, length 2748
20:03:36.743890 IP 10.0.2.15.53120 > 151.101.117.140.443: Flags [.], ack 39303, win 62780, length 0
20:03:36.745500 IP 151.101.117.140.443 > 10.0.2.15.53120: Flags [P.], seq 39303:42051, ack 821, win 65535, length 2748
20:03:36.745517 IP 10.0.2.15.53120 > 151.101.117.140.443: Flags [.], ack 42051, win 62780, length 0
20:03:36.746055 IP 151.101.117.140.443 > 10.0.2.15.53120: Flags [P.], seq 42051:43425, ack 821, win 65535, length 1374
20:03:36.746147 IP 10.0.2.15.53120 > 151.101.117.140.443: Flags [.], ack 43425, win 62780, length 0
20:03:36.747080 IP 151.101.117.140.443 > 10.0.2.15.53120: Flags [P.], seq 43425:44799, ack 821, win 65535, length 1374
20:03:36.749287 IP 151.101.117.140.443 > 10.0.2.15.53120: Flags [P.], seq 44799:47547, ack 821, win 65535, length 2748
20:03:36.749305 IP 10.0.2.15.53120 > 151.101.117.140.443: Flags [.], ack 47547, win 62780, length 0
20:03:36.750562 IP 151.101.117.140.443 > 10.0.2.15.53120: Flags [P.], seq 47547:50295, ack 821, win 65535, length 2748
20:03:36.750586 IP 10.0.2.15.53120 > 151.101.117.140.443: Flags [.], ack 50295, win 62780, length 0
20:03:36.751245 IP 151.101.117.140.443 > 10.0.2.15.53120: Flags [P.], seq 50295:54417, ack 821, win 65535, length 4122
20:03:36.751620 IP 10.0.2.15.53120 > 151.101.117.140.443: Flags [.], ack 54417, win 59860, length 0
20:03:36.752384 IP 151.101.117.140.443 > 10.0.2.15.53120: Flags [P.], seq 54417:58539, ack 821, win 65535, length 4122
20:03:36.752386 IP 151.101.117.140.443 > 10.0.2.15.53120: Flags [P.], seq 58539:62661, ack 821, win 65535, length 4122
20:03:36.752403 IP 10.0.2.15.53120 > 151.101.117.140.443: Flags [.], ack 58539, win 61320, length 0
20:03:36.752541 IP 10.0.2.15.53120 > 151.101.117.140.443: Flags [.], ack 62661, win 58400, length 0
20:03:36.753915 IP 151.101.117.140.443 > 10.0.2.15.53120: Flags [P.], seq 62661:68157, ack 821, win 65535, length 5496
20:03:36.753937 IP 10.0.2.15.53120 > 151.101.117.140.443: Flags [.], ack 68157, win 61320, length 0
20:03:36.754877 IP 151.101.117.140.443 > 10.0.2.15.53120: Flags [P.], seq 68157:73653, ack 821, win 65535, length 5496
20:03:36.754902 IP 10.0.2.15.53120 > 151.101.117.140.443: Flags [.], ack 73653, win 65535, length 0
20:03:36.756582 IP 151.101.117.140.443 > 10.0.2.15.53120: Flags [P.], seq 73653:86019, ack 821, win 65535, length 12366
20:03:36.756657 IP 10.0.2.15.53120 > 151.101.117.140.443: Flags [.], ack 86019, win 65535, length 0
20:03:36.756691 IP 151.101.117.140.443 > 10.0.2.15.53120: Flags [P.], seq 86019:87393, ack 821, win 65535, length 1374
20:03:36.756697 IP 10.0.2.15.53120 > 151.101.117.140.443: Flags [.], ack 87393, win 65535, length 0
20:03:36.757485 IP 151.101.117.140.443 > 10.0.2.15.53120: Flags [P.], seq 87393:91515, ack 821, win 65535, length 4122
20:03:36.757486 IP 151.101.117.140.443 > 10.0.2.15.53120: Flags [P.], seq 91515:92889, ack 821, win 65535, length 1374
20:03:36.757502 IP 10.0.2.15.53120 > 151.101.117.140.443: Flags [.], ack 91515, win 65535, length 0
20:03:36.757657 IP 10.0.2.15.53120 > 151.101.117.140.443: Flags [.], ack 92889, win 65535, length 0
20:03:36.758181 IP 151.101.117.140.443 > 10.0.2.15.53120: Flags [P.], seq 92889:97011, ack 821, win 65535, length 4122
20:03:36.758183 IP 151.101.117.140.443 > 10.0.2.15.53120: Flags [P.], seq 97011:98385, ack 821, win 65535, length 1374
20:03:36.758201 IP 10.0.2.15.53120 > 151.101.117.140.443: Flags [.], ack 97011, win 65535, length 0
20:03:36.758230 IP 10.0.2.15.53120 > 151.101.117.140.443: Flags [.], ack 98385, win 65535, length 0
20:03:36.758353 IP 151.101.117.140.443 > 10.0.2.15.53120: Flags [P.], seq 98385:101133, ack 821, win 65535, length 2748
20:03:36.758359 IP 10.0.2.15.53120 > 151.101.117.140.443: Flags [.], ack 101133, win 65535, length 0
20:03:36.758452 IP 151.101.117.140.443 > 10.0.2.15.53120: Flags [P.], seq 101133:102507, ack 821, win 65535, length 1374
20:03:36.758457 IP 10.0.2.15.53120 > 151.101.117.140.443: Flags [.], ack 102507, win 65535, length 0
20:03:36.760630 IP 151.101.117.140.443 > 10.0.2.15.53120: Flags [P.], seq 102507:110751, ack 821, win 65535, length 8244
20:03:36.760633 IP 151.101.117.140.443 > 10.0.2.15.53120: Flags [P.], seq 110751:114873, ack 821, win 65535, length 4122
20:03:36.760661 IP 10.0.2.15.53120 > 151.101.117.140.443: Flags [.], ack 110751, win 65535, length 0
20:03:36.760799 IP 10.0.2.15.53120 > 151.101.117.140.443: Flags [.], ack 114873, win 65535, length 0
20:03:36.760834 IP 151.101.117.140.443 > 10.0.2.15.53120: Flags [P.], seq 114873:117621, ack 821, win 65535, length 2748
20:03:36.760842 IP 10.0.2.15.53120 > 151.101.117.140.443: Flags [.], ack 117621, win 65535, length 0
20:03:36.761930 IP 151.101.117.140.443 > 10.0.2.15.53120: Flags [P.], seq 117621:118995, ack 821, win 65535, length 1374
20:03:36.761972 IP 10.0.2.15.53120 > 151.101.117.140.443: Flags [.], ack 118995, win 65535, length 0
20:03:36.762970 IP 151.101.117.140.443 > 10.0.2.15.53120: Flags [P.], seq 118995:120369, ack 821, win 65535, length 1374
20:03:36.763027 IP 10.0.2.15.53120 > 151.101.117.140.443: Flags [.], ack 120369, win 65535, length 0
20:03:36.764789 IP 151.101.117.140.443 > 10.0.2.15.53120: Flags [P.], seq 120369:127239, ack 821, win 65535, length 6870
20:03:36.764791 IP 151.101.117.140.443 > 10.0.2.15.53120: Flags [.], seq 127239:130159, ack 821, win 65535, length 2920
20:03:36.764818 IP 10.0.2.15.53120 > 151.101.117.140.443: Flags [.], ack 127239, win 65535, length 0
20:03:36.764853 IP 10.0.2.15.53120 > 151.101.117.140.443: Flags [.], ack 130159, win 65535, length 0
20:03:36.765016 IP 151.101.117.140.443 > 10.0.2.15.53120: Flags [P.], seq 130159:131361, ack 821, win 65535, length 1202
20:03:36.765018 IP 151.101.117.140.443 > 10.0.2.15.53120: Flags [P.], seq 131361:134109, ack 821, win 65535, length 2748
20:03:36.765018 IP 151.101.117.140.443 > 10.0.2.15.53120: Flags [P.], seq 134109:136857, ack 821, win 65535, length 2748
20:03:36.765032 IP 10.0.2.15.53120 > 151.101.117.140.443: Flags [.], ack 131361, win 65535, length 0
20:03:36.765047 IP 10.0.2.15.53120 > 151.101.117.140.443: Flags [.], ack 134109, win 65535, length 0
20:03:36.765058 IP 10.0.2.15.53120 > 151.101.117.140.443: Flags [.], ack 136857, win 65535, length 0
20:03:36.765177 IP 151.101.117.140.443 > 10.0.2.15.53120: Flags [P.], seq 136857:138231, ack 821, win 65535, length 1374
20:03:36.765183 IP 10.0.2.15.53120 > 151.101.117.140.443: Flags [.], ack 138231, win 65535, length 0
20:03:36.766360 IP 151.101.117.140.443 > 10.0.2.15.53120: Flags [P.], seq 138231:145101, ack 821, win 65535, length 6870
20:03:36.766362 IP 151.101.117.140.443 > 10.0.2.15.53120: Flags [.], seq 145101:148021, ack 821, win 65535, length 2920
20:03:36.766384 IP 10.0.2.15.53120 > 151.101.117.140.443: Flags [.], ack 145101, win 65535, length 0
20:03:36.766416 IP 10.0.2.15.53120 > 151.101.117.140.443: Flags [.], ack 148021, win 65535, length 0
20:03:36.766603 IP 151.101.117.140.443 > 10.0.2.15.53120: Flags [P.], seq 148021:149223, ack 821, win 65535, length 1202
20:03:36.766604 IP 151.101.117.140.443 > 10.0.2.15.53120: Flags [P.], seq 149223:151971, ack 821, win 65535, length 2748
20:03:36.766610 IP 10.0.2.15.53120 > 151.101.117.140.443: Flags [.], ack 149223, win 65535, length 0
20:03:36.766628 IP 10.0.2.15.53120 > 151.101.117.140.443: Flags [.], ack 151971, win 65535, length 0
20:03:36.768427 IP 151.101.117.140.443 > 10.0.2.15.53120: Flags [P.], seq 151971:161589, ack 821, win 65535, length 9618
20:03:36.768430 IP 151.101.117.140.443 > 10.0.2.15.53120: Flags [P.], seq 161589:164337, ack 821, win 65535, length 2748
20:03:36.768500 IP 10.0.2.15.53120 > 151.101.117.140.443: Flags [.], ack 161589, win 65535, length 0
20:03:36.768594 IP 10.0.2.15.53120 > 151.101.117.140.443: Flags [.], ack 164337, win 65535, length 0
20:03:36.769571 IP 151.101.117.140.443 > 10.0.2.15.53120: Flags [P.], seq 164337:169833, ack 821, win 65535, length 5496
20:03:36.769574 IP 151.101.117.140.443 > 10.0.2.15.53120: Flags [P.], seq 169833:175329, ack 821, win 65535, length 5496
20:03:36.769597 IP 10.0.2.15.53120 > 151.101.117.140.443: Flags [.], ack 169833, win 65535, length 0
20:03:36.769834 IP 10.0.2.15.53120 > 151.101.117.140.443: Flags [.], ack 175329, win 65535, length 0
20:03:36.769968 IP 151.101.117.140.443 > 10.0.2.15.53120: Flags [P.], seq 175329:176703, ack 821, win 65535, length 1374
20:03:36.769982 IP 10.0.2.15.53120 > 151.101.117.140.443: Flags [.], ack 176703, win 65535, length 0
20:03:36.770442 IP 151.101.117.140.443 > 10.0.2.15.53120: Flags [P.], seq 176703:180825, ack 821, win 65535, length 4122
20:03:36.770461 IP 10.0.2.15.53120 > 151.101.117.140.443: Flags [.], ack 180825, win 65535, length 0
20:03:36.771472 IP 151.101.117.140.443 > 10.0.2.15.53120: Flags [P.], seq 180825:181637, ack 821, win 65535, length 812
20:03:36.771527 IP 10.0.2.15.53120 > 151.101.117.140.443: Flags [.], ack 181637, win 65535, length 0
20:03:36.789626 IP 151.101.117.140.443 > 10.0.2.15.53120: Flags [P.], seq 181637:189881, ack 821, win 65535, length 8244
20:03:36.789631 IP 151.101.117.140.443 > 10.0.2.15.53120: Flags [P.], seq 189881:195377, ack 821, win 65535, length 5496
20:03:36.790012 IP 10.0.2.15.53120 > 151.101.117.140.443: Flags [.], ack 189881, win 65535, length 0
20:03:36.790155 IP 10.0.2.15.53120 > 151.101.117.140.443: Flags [.], ack 195377, win 65535, length 0
20:03:36.790193 IP 151.101.117.140.443 > 10.0.2.15.53120: Flags [P.], seq 195377:196751, ack 821, win 65535, length 1374
20:03:36.790202 IP 10.0.2.15.53120 > 151.101.117.140.443: Flags [.], ack 196751, win 65535, length 0
20:03:36.790649 IP 151.101.117.140.443 > 10.0.2.15.53120: Flags [P.], seq 196751:197807, ack 821, win 65535, length 1056
20:03:36.790662 IP 10.0.2.15.53120 > 151.101.117.140.443: Flags [.], ack 197807, win 65535, length 0
20:03:38.071249 IP 151.101.117.140.443 > 10.0.2.15.53120: Flags [P.], seq 197807:204772, ack 821, win 65535, length 6965
20:03:38.071649 IP 151.101.117.140.443 > 10.0.2.15.53120: Flags [P.], seq 204772:214369, ack 821, win 65535, length 9597
20:03:38.072269 IP 10.0.2.15.53120 > 151.101.117.140.443: Flags [.], ack 204772, win 65535, length 0
20:03:38.073308 IP 10.0.2.15.53120 > 151.101.117.140.443: Flags [.], ack 214369, win 65535, length 0
20:03:38.073585 IP 151.101.117.140.443 > 10.0.2.15.53120: Flags [P.], seq 214369:217117, ack 821, win 65535, length 2748
20:03:38.073587 IP 151.101.117.140.443 > 10.0.2.15.53120: Flags [P.], seq 217117:219865, ack 821, win 65535, length 2748
20:03:38.073589 IP 151.101.117.140.443 > 10.0.2.15.53120: Flags [P.], seq 219865:226735, ack 821, win 65535, length 6870
20:03:38.073714 IP 10.0.2.15.53120 > 151.101.117.140.443: Flags [.], ack 217117, win 65535, length 0
20:03:38.073748 IP 10.0.2.15.53120 > 151.101.117.140.443: Flags [.], ack 219865, win 65535, length 0
20:03:38.073890 IP 10.0.2.15.53120 > 151.101.117.140.443: Flags [.], ack 226735, win 65535, length 0
20:03:38.073917 IP 151.101.117.140.443 > 10.0.2.15.53120: Flags [P.], seq 226735:229426, ack 821, win 65535, length 2691
20:03:38.073920 IP 151.101.117.140.443 > 10.0.2.15.53120: Flags [P.], seq 229426:240408, ack 821, win 65535, length 10982
20:03:38.073929 IP 10.0.2.15.53120 > 151.101.117.140.443: Flags [.], ack 229426, win 65535, length 0
20:03:38.073940 IP 10.0.2.15.53120 > 151.101.117.140.443: Flags [.], ack 240408, win 65535, length 0
20:03:38.074162 IP 151.101.117.140.443 > 10.0.2.15.53120: Flags [P.], seq 240408:243156, ack 821, win 65535, length 2748
20:03:38.074177 IP 10.0.2.15.53120 > 151.101.117.140.443: Flags [.], ack 243156, win 65535, length 0
20:03:38.077114 IP 151.101.117.140.443 > 10.0.2.15.53120: Flags [P.], seq 243156:256839, ack 821, win 65535, length 13683
20:03:38.077138 IP 10.0.2.15.53120 > 151.101.117.140.443: Flags [.], ack 256839, win 65535, length 0
20:03:38.082025 IP 151.101.117.140.443 > 10.0.2.15.53120: Flags [P.], seq 256839:266457, ack 821, win 65535, length 9618
20:03:38.082047 IP 10.0.2.15.53120 > 151.101.117.140.443: Flags [.], ack 266457, win 65535, length 0
20:03:38.082744 IP 151.101.117.140.443 > 10.0.2.15.53120: Flags [P.], seq 266457:281520, ack 821, win 65535, length 15063
20:03:38.082882 IP 10.0.2.15.53120 > 151.101.117.140.443: Flags [.], ack 281520, win 65535, length 0
20:03:38.083065 IP 151.101.117.140.443 > 10.0.2.15.53120: Flags [P.], seq 281520:287016, ack 821, win 65535, length 5496
20:03:38.083126 IP 10.0.2.15.53120 > 151.101.117.140.443: Flags [.], ack 287016, win 65535, length 0
20:03:38.083416 IP 151.101.117.140.443 > 10.0.2.15.53120: Flags [P.], seq 287016:291087, ack 821, win 65535, length 4071
20:03:38.083418 IP 151.101.117.140.443 > 10.0.2.15.53120: Flags [P.], seq 291087:295843, ack 821, win 65535, length 4756
20:03:38.083419 IP 151.101.117.140.443 > 10.0.2.15.53120: Flags [P.], seq 295843:299965, ack 821, win 65535, length 4122
20:03:38.083566 IP 151.101.117.140.443 > 10.0.2.15.53120: Flags [P.], seq 299965:301339, ack 821, win 65535, length 1374
20:03:38.083590 IP 10.0.2.15.53120 > 151.101.117.140.443: Flags [.], ack 301339, win 65535, length 0
20:03:38.083877 IP 151.101.117.140.443 > 10.0.2.15.53120: Flags [P.], seq 301339:304087, ack 821, win 65535, length 2748
20:03:38.083892 IP 10.0.2.15.53120 > 151.101.117.140.443: Flags [.], ack 304087, win 65535, length 0
20:03:38.084133 IP 151.101.117.140.443 > 10.0.2.15.53120: Flags [P.], seq 304087:308209, ack 821, win 65535, length 4122
20:03:38.084135 IP 151.101.117.140.443 > 10.0.2.15.53120: Flags [P.], seq 308209:309583, ack 821, win 65535, length 1374
20:03:38.084135 IP 151.101.117.140.443 > 10.0.2.15.53120: Flags [P.], seq 309583:310900, ack 821, win 65535, length 1317
20:03:38.084146 IP 10.0.2.15.53120 > 151.101.117.140.443: Flags [.], ack 308209, win 65535, length 0
20:03:38.084160 IP 10.0.2.15.53120 > 151.101.117.140.443: Flags [.], ack 309583, win 65535, length 0
20:03:38.084169 IP 10.0.2.15.53120 > 151.101.117.140.443: Flags [.], ack 310900, win 65535, length 0
20:03:38.084537 IP 151.101.117.140.443 > 10.0.2.15.53120: Flags [P.], seq 310900:313648, ack 821, win 65535, length 2748
20:03:38.084550 IP 10.0.2.15.53120 > 151.101.117.140.443: Flags [.], ack 313648, win 65535, length 0
20:03:38.084732 IP 151.101.117.140.443 > 10.0.2.15.53120: Flags [P.], seq 313648:316396, ack 821, win 65535, length 2748
20:03:38.084742 IP 10.0.2.15.53120 > 151.101.117.140.443: Flags [.], ack 316396, win 65535, length 0
20:03:38.086057 IP 151.101.117.140.443 > 10.0.2.15.53120: Flags [P.], seq 316396:323266, ack 821, win 65535, length 6870
20:03:38.086069 IP 10.0.2.15.53120 > 151.101.117.140.443: Flags [.], ack 323266, win 65535, length 0
20:03:38.086358 IP 151.101.117.140.443 > 10.0.2.15.53120: Flags [P.], seq 323266:328762, ack 821, win 65535, length 5496
20:03:38.086369 IP 10.0.2.15.53120 > 151.101.117.140.443: Flags [.], ack 328762, win 65535, length 0
20:03:38.086538 IP 151.101.117.140.443 > 10.0.2.15.53120: Flags [P.], seq 328762:331510, ack 821, win 65535, length 2748
20:03:38.086547 IP 10.0.2.15.53120 > 151.101.117.140.443: Flags [.], ack 331510, win 65535, length 0
20:03:38.086867 IP 151.101.117.140.443 > 10.0.2.15.53120: Flags [P.], seq 331510:332963, ack 821, win 65535, length 1453
20:03:38.086877 IP 10.0.2.15.53120 > 151.101.117.140.443: Flags [.], ack 332963, win 65535, length 0
20:03:38.094847 IP 151.101.117.140.443 > 10.0.2.15.53120: Flags [P.], seq 332963:350828, ack 821, win 65535, length 17865
20:03:38.094869 IP 10.0.2.15.53120 > 151.101.117.140.443: Flags [.], ack 350828, win 65535, length 0
20:03:38.094929 IP 151.101.117.140.443 > 10.0.2.15.53120: Flags [P.], seq 350828:363194, ack 821, win 65535, length 12366
20:03:38.094934 IP 10.0.2.15.53120 > 151.101.117.140.443: Flags [.], ack 363194, win 65535, length 0
20:03:38.094949 IP 151.101.117.140.443 > 10.0.2.15.53120: Flags [P.], seq 363194:364568, ack 821, win 65535, length 1374
20:03:38.094953 IP 10.0.2.15.53120 > 151.101.117.140.443: Flags [.], ack 364568, win 65535, length 0
20:03:38.096685 IP 151.101.117.140.443 > 10.0.2.15.53120: Flags [P.], seq 364568:372709, ack 821, win 65535, length 8141
20:03:38.096687 IP 151.101.117.140.443 > 10.0.2.15.53120: Flags [P.], seq 372709:376831, ack 821, win 65535, length 4122
20:03:38.096707 IP 10.0.2.15.53120 > 151.101.117.140.443: Flags [.], ack 372709, win 65535, length 0
20:03:38.096737 IP 10.0.2.15.53120 > 151.101.117.140.443: Flags [.], ack 376831, win 65535, length 0
20:03:38.097177 IP 151.101.117.140.443 > 10.0.2.15.53120: Flags [P.], seq 376831:379579, ack 821, win 65535, length 2748
20:03:38.097179 IP 151.101.117.140.443 > 10.0.2.15.53120: Flags [P.], seq 379579:382327, ack 821, win 65535, length 2748
20:03:38.097194 IP 10.0.2.15.53120 > 151.101.117.140.443: Flags [.], ack 379579, win 65535, length 0
20:03:38.097240 IP 10.0.2.15.53120 > 151.101.117.140.443: Flags [.], ack 382327, win 65535, length 0
20:03:38.097886 IP 151.101.117.140.443 > 10.0.2.15.53120: Flags [P.], seq 382327:386449, ack 821, win 65535, length 4122
20:03:38.097888 IP 151.101.117.140.443 > 10.0.2.15.53120: Flags [P.], seq 386449:387823, ack 821, win 65535, length 1374
20:03:38.097889 IP 151.101.117.140.443 > 10.0.2.15.53120: Flags [P.], seq 387823:393319, ack 821, win 65535, length 5496
20:03:38.097905 IP 10.0.2.15.53120 > 151.101.117.140.443: Flags [.], ack 386449, win 65535, length 0
20:03:38.098039 IP 10.0.2.15.53120 > 151.101.117.140.443: Flags [.], ack 387823, win 65535, length 0
20:03:38.098107 IP 10.0.2.15.53120 > 151.101.117.140.443: Flags [.], ack 393319, win 65535, length 0
20:03:38.098140 IP 151.101.117.140.443 > 10.0.2.15.53120: Flags [P.], seq 393319:394693, ack 821, win 65535, length 1374
20:03:38.098185 IP 151.101.117.140.443 > 10.0.2.15.53120: Flags [P.], seq 394693:397441, ack 821, win 65535, length 2748
20:03:38.098188 IP 151.101.117.140.443 > 10.0.2.15.53120: Flags [P.], seq 397441:400189, ack 821, win 65535, length 2748
20:03:38.098257 IP 10.0.2.15.53120 > 151.101.117.140.443: Flags [.], ack 394693, win 65535, length 0
20:03:38.098284 IP 10.0.2.15.53120 > 151.101.117.140.443: Flags [.], ack 397441, win 65535, length 0
20:03:38.098331 IP 10.0.2.15.53120 > 151.101.117.140.443: Flags [.], ack 400189, win 65535, length 0
20:03:38.098550 IP 151.101.117.140.443 > 10.0.2.15.53120: Flags [P.], seq 400189:402937, ack 821, win 65535, length 2748
20:03:38.098552 IP 151.101.117.140.443 > 10.0.2.15.53120: Flags [P.], seq 402937:405685, ack 821, win 65535, length 2748
20:03:38.098552 IP 151.101.117.140.443 > 10.0.2.15.53120: Flags [P.], seq 405685:408433, ack 821, win 65535, length 2748
20:03:38.098563 IP 10.0.2.15.53120 > 151.101.117.140.443: Flags [.], ack 402937, win 65535, length 0
20:03:38.098675 IP 10.0.2.15.53120 > 151.101.117.140.443: Flags [.], ack 405685, win 65535, length 0
20:03:38.098974 IP 10.0.2.15.53120 > 151.101.117.140.443: Flags [.], ack 408433, win 65535, length 0
20:03:38.099102 IP 151.101.117.140.443 > 10.0.2.15.53120: Flags [P.], seq 408433:411181, ack 821, win 65535, length 2748
20:03:38.099103 IP 151.101.117.140.443 > 10.0.2.15.53120: Flags [P.], seq 411181:412555, ack 821, win 65535, length 1374
20:03:38.099110 IP 10.0.2.15.53120 > 151.101.117.140.443: Flags [.], ack 411181, win 65535, length 0
20:03:38.099122 IP 10.0.2.15.53120 > 151.101.117.140.443: Flags [.], ack 412555, win 65535, length 0
20:03:38.099424 IP 151.101.117.140.443 > 10.0.2.15.53120: Flags [P.], seq 412555:415135, ack 821, win 65535, length 2580
20:03:38.099431 IP 10.0.2.15.53120 > 151.101.117.140.443: Flags [.], ack 415135, win 65535, length 0
20:03:38.107521 IP 151.101.117.140.443 > 10.0.2.15.53120: Flags [P.], seq 415135:422005, ack 821, win 65535, length 6870
20:03:38.107523 IP 151.101.117.140.443 > 10.0.2.15.53120: Flags [P.], seq 422005:424753, ack 821, win 65535, length 2748
20:03:38.107547 IP 10.0.2.15.53120 > 151.101.117.140.443: Flags [.], ack 422005, win 65535, length 0
20:03:38.107575 IP 10.0.2.15.53120 > 151.101.117.140.443: Flags [.], ack 424753, win 65535, length 0
20:03:38.107701 IP 151.101.117.140.443 > 10.0.2.15.53120: Flags [P.], seq 424753:426127, ack 821, win 65535, length 1374
20:03:38.107702 IP 151.101.117.140.443 > 10.0.2.15.53120: Flags [P.], seq 426127:430249, ack 821, win 65535, length 4122
20:03:38.107710 IP 10.0.2.15.53120 > 151.101.117.140.443: Flags [.], ack 426127, win 65535, length 0
20:03:38.107754 IP 10.0.2.15.53120 > 151.101.117.140.443: Flags [.], ack 430249, win 65535, length 0
20:03:38.107864 IP 151.101.117.140.443 > 10.0.2.15.53120: Flags [P.], seq 430249:432946, ack 821, win 65535, length 2697
20:03:38.107872 IP 10.0.2.15.53120 > 151.101.117.140.443: Flags [.], ack 432946, win 65535, length 0
20:03:38.108111 IP 151.101.117.140.443 > 10.0.2.15.53120: Flags [P.], seq 432946:435694, ack 821, win 65535, length 2748
20:03:38.108126 IP 10.0.2.15.53120 > 151.101.117.140.443: Flags [.], ack 435694, win 65535, length 0
20:03:38.108840 IP 151.101.117.140.443 > 10.0.2.15.53120: Flags [P.], seq 435694:442564, ack 821, win 65535, length 6870
20:03:38.108865 IP 151.101.117.140.443 > 10.0.2.15.53120: Flags [P.], seq 442564:443938, ack 821, win 65535, length 1374
20:03:38.108876 IP 151.101.117.140.443 > 10.0.2.15.53120: Flags [P.], seq 443938:452131, ack 821, win 65535, length 8193
20:03:38.108891 IP 10.0.2.15.53120 > 151.101.117.140.443: Flags [.], ack 442564, win 65535, length 0
20:03:38.108957 IP 10.0.2.15.53120 > 151.101.117.140.443: Flags [.], ack 443938, win 65535, length 0
20:03:38.108968 IP 10.0.2.15.53120 > 151.101.117.140.443: Flags [.], ack 452131, win 65535, length 0
20:03:38.109040 IP 151.101.117.140.443 > 10.0.2.15.53120: Flags [P.], seq 452131:454879, ack 821, win 65535, length 2748
20:03:38.109041 IP 151.101.117.140.443 > 10.0.2.15.53120: Flags [P.], seq 454879:456253, ack 821, win 65535, length 1374
20:03:38.109042 IP 151.101.117.140.443 > 10.0.2.15.53120: Flags [P.], seq 456253:458650, ack 821, win 65535, length 2397
20:03:38.109052 IP 10.0.2.15.53120 > 151.101.117.140.443: Flags [.], ack 454879, win 65535, length 0
20:03:38.109070 IP 10.0.2.15.53120 > 151.101.117.140.443: Flags [.], ack 456253, win 65535, length 0
20:03:38.109082 IP 10.0.2.15.53120 > 151.101.117.140.443: Flags [.], ack 458650, win 65535, length 0
20:03:38.109187 IP 151.101.117.140.443 > 10.0.2.15.53120: Flags [P.], seq 458650:461398, ack 821, win 65535, length 2748
20:03:38.109191 IP 10.0.2.15.53120 > 151.101.117.140.443: Flags [.], ack 461398, win 65535, length 0
20:03:38.110103 IP 151.101.117.140.443 > 10.0.2.15.53120: Flags [P.], seq 461398:468268, ack 821, win 65535, length 6870
20:03:38.110183 IP 10.0.2.15.53120 > 151.101.117.140.443: Flags [.], ack 468268, win 65535, length 0
20:03:38.110915 IP 151.101.117.140.443 > 10.0.2.15.53120: Flags [P.], seq 468268:471016, ack 821, win 65535, length 2748
20:03:38.110918 IP 151.101.117.140.443 > 10.0.2.15.53120: Flags [P.], seq 471016:473764, ack 821, win 65535, length 2748
20:03:38.110918 IP 151.101.117.140.443 > 10.0.2.15.53120: Flags [P.], seq 473764:475138, ack 821, win 65535, length 1374
20:03:38.110919 IP 151.101.117.140.443 > 10.0.2.15.53120: Flags [P.], seq 475138:479260, ack 821, win 65535, length 4122
20:03:38.110936 IP 10.0.2.15.53120 > 151.101.117.140.443: Flags [.], ack 471016, win 65535, length 0
20:03:38.110968 IP 10.0.2.15.53120 > 151.101.117.140.443: Flags [.], ack 473764, win 65535, length 0
20:03:38.110982 IP 10.0.2.15.53120 > 151.101.117.140.443: Flags [.], ack 475138, win 65535, length 0
20:03:38.110990 IP 10.0.2.15.53120 > 151.101.117.140.443: Flags [.], ack 479260, win 65535, length 0
20:03:38.111770 IP 151.101.117.140.443 > 10.0.2.15.53120: Flags [P.], seq 479260:480884, ack 821, win 65535, length 1624
20:03:38.111773 IP 151.101.117.140.443 > 10.0.2.15.53120: Flags [P.], seq 480884:483632, ack 821, win 65535, length 2748
20:03:38.111774 IP 151.101.117.140.443 > 10.0.2.15.53120: Flags [P.], seq 483632:490179, ack 821, win 65535, length 6547
20:03:38.111799 IP 10.0.2.15.53120 > 151.101.117.140.443: Flags [.], ack 480884, win 65535, length 0
20:03:38.111821 IP 10.0.2.15.53120 > 151.101.117.140.443: Flags [.], ack 483632, win 65535, length 0
20:03:38.111834 IP 10.0.2.15.53120 > 151.101.117.140.443: Flags [.], ack 490179, win 65535, length 0
20:03:38.113617 IP 151.101.117.140.443 > 10.0.2.15.53120: Flags [P.], seq 490179:497322, ack 821, win 65535, length 7143
20:03:38.113835 IP 10.0.2.15.53120 > 151.101.117.140.443: Flags [.], ack 497322, win 65535, length 0
20:03:38.117576 IP 151.101.117.140.443 > 10.0.2.15.53120: Flags [P.], seq 497322:504192, ack 821, win 65535, length 6870
20:03:38.117599 IP 10.0.2.15.53120 > 151.101.117.140.443: Flags [.], ack 504192, win 65535, length 0
20:03:38.118941 IP 151.101.117.140.443 > 10.0.2.15.53120: Flags [P.], seq 504192:508314, ack 821, win 65535, length 4122
20:03:38.118962 IP 10.0.2.15.53120 > 151.101.117.140.443: Flags [.], ack 508314, win 65535, length 0
20:03:38.121113 IP 151.101.117.140.443 > 10.0.2.15.53120: Flags [P.], seq 508314:516471, ack 821, win 65535, length 8157
20:03:38.121119 IP 151.101.117.140.443 > 10.0.2.15.53120: Flags [P.], seq 516471:531496, ack 821, win 65535, length 15025
20:03:38.121200 IP 10.0.2.15.53120 > 151.101.117.140.443: Flags [.], ack 516471, win 65535, length 0
20:03:38.121463 IP 10.0.2.15.53120 > 151.101.117.140.443: Flags [.], ack 531496, win 65535, length 0
20:03:38.121497 IP 151.101.117.140.443 > 10.0.2.15.53120: Flags [P.], seq 531496:534244, ack 821, win 65535, length 2748
20:03:38.121499 IP 151.101.117.140.443 > 10.0.2.15.53120: Flags [P.], seq 534244:543862, ack 821, win 65535, length 9618
20:03:38.121509 IP 10.0.2.15.53120 > 151.101.117.140.443: Flags [.], ack 534244, win 65535, length 0
20:03:38.121522 IP 10.0.2.15.53120 > 151.101.117.140.443: Flags [.], ack 543862, win 65535, length 0
20:03:38.124017 IP 151.101.117.140.443 > 10.0.2.15.53120: Flags [.], seq 543862:575982, ack 821, win 65535, length 32120
20:03:38.124039 IP 10.0.2.15.53120 > 151.101.117.140.443: Flags [.], ack 575982, win 65535, length 0
20:03:38.124487 IP 151.101.117.140.443 > 10.0.2.15.53120: Flags [P.], seq 575982:579409, ack 821, win 65535, length 3427
20:03:38.124503 IP 10.0.2.15.53120 > 151.101.117.140.443: Flags [.], ack 579409, win 65535, length 0
20:03:38.129253 IP 151.101.117.140.443 > 10.0.2.15.53120: Flags [P.], seq 579409:583531, ack 821, win 65535, length 4122
20:03:38.129489 IP 151.101.117.140.443 > 10.0.2.15.53120: Flags [P.], seq 583531:586279, ack 821, win 65535, length 2748
20:03:38.129490 IP 151.101.117.140.443 > 10.0.2.15.53120: Flags [P.], seq 586279:587653, ack 821, win 65535, length 1374
20:03:38.129629 IP 10.0.2.15.53120 > 151.101.117.140.443: Flags [.], ack 583531, win 65535, length 0
20:03:38.129867 IP 10.0.2.15.53120 > 151.101.117.140.443: Flags [.], ack 586279, win 65535, length 0
20:03:38.129886 IP 10.0.2.15.53120 > 151.101.117.140.443: Flags [.], ack 587653, win 65535, length 0
20:03:38.130231 IP 151.101.117.140.443 > 10.0.2.15.53120: Flags [P.], seq 587653:590401, ack 821, win 65535, length 2748
20:03:38.130233 IP 151.101.117.140.443 > 10.0.2.15.53120: Flags [P.], seq 590401:591775, ack 821, win 65535, length 1374
20:03:38.130234 IP 151.101.117.140.443 > 10.0.2.15.53120: Flags [P.], seq 591775:594523, ack 821, win 65535, length 2748
20:03:38.130235 IP 151.101.117.140.443 > 10.0.2.15.53120: Flags [P.], seq 594523:597220, ack 821, win 65535, length 2697
20:03:38.130235 IP 151.101.117.140.443 > 10.0.2.15.53120: Flags [P.], seq 597220:598594, ack 821, win 65535, length 1374
20:03:38.130254 IP 10.0.2.15.53120 > 151.101.117.140.443: Flags [.], ack 590401, win 65535, length 0
20:03:38.130282 IP 10.0.2.15.53120 > 151.101.117.140.443: Flags [.], ack 591775, win 65535, length 0
20:03:38.130292 IP 10.0.2.15.53120 > 151.101.117.140.443: Flags [.], ack 594523, win 65535, length 0
20:03:38.130301 IP 10.0.2.15.53120 > 151.101.117.140.443: Flags [.], ack 597220, win 65535, length 0
20:03:38.130309 IP 10.0.2.15.53120 > 151.101.117.140.443: Flags [.], ack 598594, win 65535, length 0
20:03:38.130329 IP 151.101.117.140.443 > 10.0.2.15.53120: Flags [P.], seq 598594:604090, ack 821, win 65535, length 5496
20:03:38.130330 IP 151.101.117.140.443 > 10.0.2.15.53120: Flags [P.], seq 604090:606838, ack 821, win 65535, length 2748
20:03:38.130336 IP 10.0.2.15.53120 > 151.101.117.140.443: Flags [.], ack 604090, win 65535, length 0
20:03:38.130347 IP 10.0.2.15.53120 > 151.101.117.140.443: Flags [.], ack 606838, win 65535, length 0
20:03:38.130560 IP 151.101.117.140.443 > 10.0.2.15.53120: Flags [P.], seq 606838:609586, ack 821, win 65535, length 2748
20:03:38.130571 IP 10.0.2.15.53120 > 151.101.117.140.443: Flags [.], ack 609586, win 65535, length 0
20:03:38.131117 IP 151.101.117.140.443 > 10.0.2.15.53120: Flags [P.], seq 609586:610960, ack 821, win 65535, length 1374
20:03:38.131134 IP 10.0.2.15.53120 > 151.101.117.140.443: Flags [.], ack 610960, win 65535, length 0
20:03:38.134164 IP 151.101.117.140.443 > 10.0.2.15.53120: Flags [P.], seq 610960:617780, ack 821, win 65535, length 6820
20:03:38.134166 IP 151.101.117.140.443 > 10.0.2.15.53120: Flags [P.], seq 617780:620528, ack 821, win 65535, length 2748
20:03:38.134167 IP 151.101.117.140.443 > 10.0.2.15.53120: Flags [P.], seq 620528:621902, ack 821, win 65535, length 1374
20:03:38.134191 IP 10.0.2.15.53120 > 151.101.117.140.443: Flags [.], ack 617780, win 65535, length 0
20:03:38.134283 IP 10.0.2.15.53120 > 151.101.117.140.443: Flags [.], ack 620528, win 65535, length 0
20:03:38.134328 IP 10.0.2.15.53120 > 151.101.117.140.443: Flags [.], ack 621902, win 65535, length 0
20:03:38.135050 IP 151.101.117.140.443 > 10.0.2.15.53120: Flags [P.], seq 621902:624650, ack 821, win 65535, length 2748
20:03:38.135053 IP 151.101.117.140.443 > 10.0.2.15.53120: Flags [P.], seq 624650:626024, ack 821, win 65535, length 1374
20:03:38.135054 IP 151.101.117.140.443 > 10.0.2.15.53120: Flags [P.], seq 626024:628713, ack 821, win 65535, length 2689
20:03:38.135055 IP 151.101.117.140.443 > 10.0.2.15.53120: Flags [P.], seq 628713:631461, ack 821, win 65535, length 2748
20:03:38.135056 IP 151.101.117.140.443 > 10.0.2.15.53120: Flags [P.], seq 631461:634209, ack 821, win 65535, length 2748
20:03:38.135075 IP 10.0.2.15.53120 > 151.101.117.140.443: Flags [.], ack 624650, win 65535, length 0
20:03:38.135115 IP 10.0.2.15.53120 > 151.101.117.140.443: Flags [.], ack 626024, win 65535, length 0
20:03:38.135122 IP 10.0.2.15.53120 > 151.101.117.140.443: Flags [.], ack 628713, win 65535, length 0
20:03:38.135130 IP 10.0.2.15.53120 > 151.101.117.140.443: Flags [.], ack 631461, win 65535, length 0
20:03:38.135196 IP 10.0.2.15.53120 > 151.101.117.140.443: Flags [.], ack 634209, win 65535, length 0
20:03:38.135279 IP 151.101.117.140.443 > 10.0.2.15.53120: Flags [P.], seq 634209:635583, ack 821, win 65535, length 1374
20:03:38.135282 IP 151.101.117.140.443 > 10.0.2.15.53120: Flags [P.], seq 635583:641079, ack 821, win 65535, length 5496
20:03:38.135282 IP 151.101.117.140.443 > 10.0.2.15.53120: Flags [P.], seq 641079:642453, ack 821, win 65535, length 1374
20:03:38.135284 IP 151.101.117.140.443 > 10.0.2.15.53120: Flags [P.], seq 642453:647890, ack 821, win 65535, length 5437
20:03:38.135355 IP 10.0.2.15.53120 > 151.101.117.140.443: Flags [.], ack 635583, win 65535, length 0
20:03:38.135375 IP 10.0.2.15.53120 > 151.101.117.140.443: Flags [.], ack 641079, win 65535, length 0
20:03:38.135388 IP 10.0.2.15.53120 > 151.101.117.140.443: Flags [.], ack 642453, win 65535, length 0
20:03:38.135399 IP 10.0.2.15.53120 > 151.101.117.140.443: Flags [.], ack 647890, win 65535, length 0
20:03:38.135421 IP 151.101.117.140.443 > 10.0.2.15.53120: Flags [P.], seq 647890:650638, ack 821, win 65535, length 2748
20:03:38.135427 IP 10.0.2.15.53120 > 151.101.117.140.443: Flags [.], ack 650638, win 65535, length 0
20:03:38.136159 IP 151.101.117.140.443 > 10.0.2.15.53120: Flags [P.], seq 650638:654760, ack 821, win 65535, length 4122
20:03:38.136161 IP 151.101.117.140.443 > 10.0.2.15.53120: Flags [P.], seq 654760:658882, ack 821, win 65535, length 4122
20:03:38.136348 IP 10.0.2.15.53120 > 151.101.117.140.443: Flags [.], ack 654760, win 65535, length 0
20:03:38.136587 IP 10.0.2.15.53120 > 151.101.117.140.443: Flags [.], ack 658882, win 65535, length 0
20:03:38.137710 IP 151.101.117.140.443 > 10.0.2.15.53120: Flags [P.], seq 658882:664327, ack 821, win 65535, length 5445
20:03:38.137741 IP 151.101.117.140.443 > 10.0.2.15.53120: Flags [P.], seq 664327:665701, ack 821, win 65535, length 1374
20:03:38.137743 IP 151.101.117.140.443 > 10.0.2.15.53120: Flags [P.], seq 665701:668449, ack 821, win 65535, length 2748
20:03:38.137744 IP 151.101.117.140.443 > 10.0.2.15.53120: Flags [P.], seq 668449:669823, ack 821, win 65535, length 1374
20:03:38.137768 IP 10.0.2.15.53120 > 151.101.117.140.443: Flags [.], ack 664327, win 65535, length 0
20:03:38.137797 IP 10.0.2.15.53120 > 151.101.117.140.443: Flags [.], ack 665701, win 65535, length 0
20:03:38.137826 IP 151.101.117.140.443 > 10.0.2.15.53120: Flags [P.], seq 669823:672571, ack 821, win 65535, length 2748
20:03:38.137828 IP 151.101.117.140.443 > 10.0.2.15.53120: Flags [P.], seq 672571:676693, ack 821, win 65535, length 4122
20:03:38.137830 IP 151.101.117.140.443 > 10.0.2.15.53120: Flags [P.], seq 676693:677978, ack 821, win 65535, length 1285
20:03:38.138178 IP 10.0.2.15.53120 > 151.101.117.140.443: Flags [.], ack 677978, win 65535, length 0
20:03:38.140467 IP 151.101.117.140.443 > 10.0.2.15.53120: Flags [P.], seq 677978:682100, ack 821, win 65535, length 4122
20:03:38.140488 IP 10.0.2.15.53120 > 151.101.117.140.443: Flags [.], ack 682100, win 65535, length 0
20:03:38.141591 IP 151.101.117.140.443 > 10.0.2.15.53120: Flags [P.], seq 682100:688490, ack 821, win 65535, length 6390

