00:15:16.870447 IP 151.101.117.140.443 > 10.0.2.15.52978: Flags [.], seq 81664002:81666922, ack 3295511082, win 65535, length 2920
00:15:16.870470 IP 10.0.2.15.52978 > 151.101.117.140.443: Flags [.], ack 2920, win 62780, length 0
00:15:16.870629 IP 151.101.117.140.443 > 10.0.2.15.52978: Flags [P.], seq 2920:3721, ack 1, win 65535, length 801
00:15:16.870640 IP 10.0.2.15.52978 > 151.101.117.140.443: Flags [.], ack 3721, win 61979, length 0
00:15:16.873075 IP 10.0.2.15.52978 > 151.101.117.140.443: Flags [P.], seq 1:81, ack 3721, win 61979, length 80
00:15:16.873492 IP 151.101.117.140.443 > 10.0.2.15.52978: Flags [.], ack 81, win 65535, length 0
00:15:16.873545 IP 10.0.2.15.52978 > 151.101.117.140.443: Flags [P.], seq 81:127, ack 3721, win 61979, length 46
00:15:16.873719 IP 10.0.2.15.52978 > 151.101.117.140.443: Flags [P.], seq 127:176, ack 3721, win 61979, length 49
00:15:16.874029 IP 10.0.2.15.52978 > 151.101.117.140.443: Flags [P.], seq 176:273, ack 3721, win 62780, length 97
00:15:16.874997 IP 151.101.117.140.443 > 10.0.2.15.52978: Flags [.], ack 127, win 65535, length 0
00:15:16.875000 IP 151.101.117.140.443 > 10.0.2.15.52978: Flags [.], ack 176, win 65535, length 0
00:15:16.875000 IP 151.101.117.140.443 > 10.0.2.15.52978: Flags [.], ack 273, win 65535, length 0
00:15:16.889793 IP 151.101.117.140.443 > 10.0.2.15.52978: Flags [P.], seq 3721:3802, ack 273, win 65535, length 81
00:15:16.889814 IP 10.0.2.15.52978 > 151.101.117.140.443: Flags [.], ack 3802, win 62780, length 0
00:15:16.890535 IP 10.0.2.15.52978 > 151.101.117.140.443: Flags [P.], seq 273:304, ack 3802, win 62780, length 31
00:15:16.890999 IP 151.101.117.140.443 > 10.0.2.15.52978: Flags [.], ack 304, win 65535, length 0
00:15:17.255273 IP 151.101.117.140.443 > 10.0.2.15.52978: Flags [P.], seq 3802:9298, ack 304, win 65535, length 5496
00:15:17.255275 IP 151.101.117.140.443 > 10.0.2.15.52978: Flags [.], seq 9298:10758, ack 304, win 65535, length 1460
00:15:17.255315 IP 10.0.2.15.52978 > 151.101.117.140.443: Flags [.], ack 9298, win 61320, length 0
00:15:17.255419 IP 10.0.2.15.52978 > 151.101.117.140.443: Flags [.], ack 10758, win 59860, length 0
00:15:17.255813 IP 151.101.117.140.443 > 10.0.2.15.52978: Flags [P.], seq 10758:16168, ack 304, win 65535, length 5410
00:15:17.255815 IP 151.101.117.140.443 > 10.0.2.15.52978: Flags [P.], seq 16168:20290, ack 304, win 65535, length 4122
00:15:17.255921 IP 10.0.2.15.52978 > 151.101.117.140.443: Flags [.], ack 16168, win 55480, length 0
00:15:17.255948 IP 10.0.2.15.52978 > 151.101.117.140.443: Flags [.], ack 20290, win 52560, length 0
00:15:17.256371 IP 151.101.117.140.443 > 10.0.2.15.52978: Flags [P.], seq 20290:24412, ack 304, win 65535, length 4122
00:15:17.256374 IP 151.101.117.140.443 > 10.0.2.15.52978: Flags [P.], seq 24412:28534, ack 304, win 65535, length 4122
00:15:17.256394 IP 10.0.2.15.52978 > 151.101.117.140.443: Flags [.], ack 24412, win 49640, length 0
00:15:17.256722 IP 10.0.2.15.52978 > 151.101.117.140.443: Flags [.], ack 28534, win 46720, length 0
00:15:17.257546 IP 151.101.117.140.443 > 10.0.2.15.52978: Flags [P.], seq 28534:29908, ack 304, win 65535, length 1374
00:15:17.257567 IP 151.101.117.140.443 > 10.0.2.15.52978: Flags [P.], seq 29908:31282, ack 304, win 65535, length 1374
00:15:17.257579 IP 151.101.117.140.443 > 10.0.2.15.52978: Flags [P.], seq 31282:34030, ack 304, win 65535, length 2748
00:15:17.257584 IP 151.101.117.140.443 > 10.0.2.15.52978: Flags [P.], seq 34030:35404, ack 304, win 65535, length 1374
00:15:17.257889 IP 10.0.2.15.52978 > 151.101.117.140.443: Flags [.], ack 29908, win 46720, length 0
00:15:17.257949 IP 10.0.2.15.52978 > 151.101.117.140.443: Flags [.], ack 31282, win 45346, length 0
00:15:17.257969 IP 10.0.2.15.52978 > 151.101.117.140.443: Flags [.], ack 34030, win 43800, length 0
00:15:17.257986 IP 10.0.2.15.52978 > 151.101.117.140.443: Flags [.], ack 35404, win 42426, length 0
00:15:17.258773 IP 151.101.117.140.443 > 10.0.2.15.52978: Flags [P.], seq 35404:38152, ack 304, win 65535, length 2748
00:15:17.258806 IP 10.0.2.15.52978 > 151.101.117.140.443: Flags [.], ack 38152, win 40880, length 0
00:15:17.259508 IP 151.101.117.140.443 > 10.0.2.15.52978: Flags [P.], seq 38152:42274, ack 304, win 65535, length 4122
00:15:17.259510 IP 151.101.117.140.443 > 10.0.2.15.52978: Flags [.], seq 42274:43734, ack 304, win 65535, length 1460
00:15:17.259531 IP 10.0.2.15.52978 > 151.101.117.140.443: Flags [.], ack 42274, win 61320, length 0
00:15:17.259551 IP 10.0.2.15.52978 > 151.101.117.140.443: Flags [.], ack 43734, win 61320, length 0
00:15:17.260628 IP 151.101.117.140.443 > 10.0.2.15.52978: Flags [P.], seq 43734:45022, ack 304, win 65535, length 1288
00:15:17.260647 IP 10.0.2.15.52978 > 151.101.117.140.443: Flags [.], ack 45022, win 62780, length 0
00:15:17.273109 IP 151.101.117.140.443 > 10.0.2.15.52978: Flags [.], seq 45022:46482, ack 304, win 65535, length 1460
00:15:17.273138 IP 10.0.2.15.52978 > 151.101.117.140.443: Flags [.], ack 46482, win 62780, length 0
00:15:17.273489 IP 151.101.117.140.443 > 10.0.2.15.52978: Flags [P.], seq 46482:50518, ack 304, win 65535, length 4036
00:15:17.273492 IP 151.101.117.140.443 > 10.0.2.15.52978: Flags [P.], seq 50518:53266, ack 304, win 65535, length 2748
00:15:17.273512 IP 10.0.2.15.52978 > 151.101.117.140.443: Flags [.], ack 50518, win 61320, length 0
00:15:17.273632 IP 10.0.2.15.52978 > 151.101.117.140.443: Flags [.], ack 53266, win 58572, length 0
00:15:17.273939 IP 151.101.117.140.443 > 10.0.2.15.52978: Flags [P.], seq 53266:56014, ack 304, win 65535, length 2748
00:15:17.273998 IP 10.0.2.15.52978 > 151.101.117.140.443: Flags [.], ack 56014, win 56940, length 0
00:15:17.275172 IP 151.101.117.140.443 > 10.0.2.15.52978: Flags [P.], seq 56014:58762, ack 304, win 65535, length 2748
00:15:17.275192 IP 10.0.2.15.52978 > 151.101.117.140.443: Flags [.], ack 58762, win 62780, length 0
00:15:17.276117 IP 151.101.117.140.443 > 10.0.2.15.52978: Flags [P.], seq 58762:61510, ack 304, win 65535, length 2748
00:15:17.276138 IP 10.0.2.15.52978 > 151.101.117.140.443: Flags [.], ack 61510, win 62780, length 0
00:15:17.279339 IP 151.101.117.140.443 > 10.0.2.15.52978: Flags [P.], seq 61510:64258, ack 304, win 65535, length 2748
00:15:17.279466 IP 10.0.2.15.52978 > 151.101.117.140.443: Flags [.], ack 64258, win 62780, length 0
00:15:17.280545 IP 151.101.117.140.443 > 10.0.2.15.52978: Flags [.], seq 64258:65718, ack 304, win 65535, length 1460
00:15:17.280912 IP 151.101.117.140.443 > 10.0.2.15.52978: Flags [P.], seq 65718:67006, ack 304, win 65535, length 1288
00:15:17.280934 IP 10.0.2.15.52978 > 151.101.117.140.443: Flags [.], ack 67006, win 62780, length 0
00:15:17.283307 IP 151.101.117.140.443 > 10.0.2.15.52978: Flags [P.], seq 67006:69754, ack 304, win 65535, length 2748
00:15:17.283339 IP 10.0.2.15.52978 > 151.101.117.140.443: Flags [.], ack 69754, win 62780, length 0
00:15:17.285923 IP 151.101.117.140.443 > 10.0.2.15.52978: Flags [P.], seq 69754:72502, ack 304, win 65535, length 2748
00:15:17.285951 IP 10.0.2.15.52978 > 151.101.117.140.443: Flags [.], ack 72502, win 65535, length 0
00:15:17.287434 IP 151.101.117.140.443 > 10.0.2.15.52978: Flags [P.], seq 72502:75250, ack 304, win 65535, length 2748
00:15:17.287484 IP 10.0.2.15.52978 > 151.101.117.140.443: Flags [.], ack 75250, win 65535, length 0
00:15:17.289696 IP 151.101.117.140.443 > 10.0.2.15.52978: Flags [P.], seq 75250:77998, ack 304, win 65535, length 2748
00:15:17.289721 IP 10.0.2.15.52978 > 151.101.117.140.443: Flags [.], ack 77998, win 65535, length 0
00:15:17.291843 IP 151.101.117.140.443 > 10.0.2.15.52978: Flags [P.], seq 77998:80746, ack 304, win 65535, length 2748
00:15:17.291871 IP 10.0.2.15.52978 > 151.101.117.140.443: Flags [.], ack 80746, win 65535, length 0
00:15:17.292920 IP 151.101.117.140.443 > 10.0.2.15.52978: Flags [P.], seq 80746:83494, ack 304, win 65535, length 2748
00:15:17.292945 IP 10.0.2.15.52978 > 151.101.117.140.443: Flags [.], ack 83494, win 65535, length 0
00:15:17.295104 IP 151.101.117.140.443 > 10.0.2.15.52978: Flags [P.], seq 83494:86242, ack 304, win 65535, length 2748
00:15:17.295130 IP 10.0.2.15.52978 > 151.101.117.140.443: Flags [.], ack 86242, win 65535, length 0
00:15:17.295391 IP 151.101.117.140.443 > 10.0.2.15.52978: Flags [P.], seq 86242:88990, ack 304, win 65535, length 2748
00:15:17.295404 IP 10.0.2.15.52978 > 151.101.117.140.443: Flags [.], ack 88990, win 65535, length 0
00:15:17.298290 IP 151.101.117.140.443 > 10.0.2.15.52978: Flags [P.], seq 88990:91738, ack 304, win 65535, length 2748
00:15:17.298293 IP 151.101.117.140.443 > 10.0.2.15.52978: Flags [P.], seq 91738:94486, ack 304, win 65535, length 2748
00:15:17.298332 IP 10.0.2.15.52978 > 151.101.117.140.443: Flags [.], ack 91738, win 65535, length 0
00:15:17.298360 IP 10.0.2.15.52978 > 151.101.117.140.443: Flags [.], ack 94486, win 65535, length 0
00:15:17.298480 IP 151.101.117.140.443 > 10.0.2.15.52978: Flags [.], seq 94486:95946, ack 304, win 65535, length 1460
00:15:17.298485 IP 10.0.2.15.52978 > 151.101.117.140.443: Flags [.], ack 95946, win 65535, length 0
00:15:17.298674 IP 151.101.117.140.443 > 10.0.2.15.52978: Flags [P.], seq 95946:97234, ack 304, win 65535, length 1288
00:15:17.298717 IP 10.0.2.15.52978 > 151.101.117.140.443: Flags [.], ack 97234, win 65535, length 0
00:15:17.299872 IP 151.101.117.140.443 > 10.0.2.15.52978: Flags [P.], seq 97234:99982, ack 304, win 65535, length 2748
00:15:17.299889 IP 10.0.2.15.52978 > 151.101.117.140.443: Flags [.], ack 99982, win 65535, length 0
00:15:17.301152 IP 151.101.117.140.443 > 10.0.2.15.52978: Flags [P.], seq 99982:102730, ack 304, win 65535, length 2748
00:15:17.301172 IP 10.0.2.15.52978 > 151.101.117.140.443: Flags [.], ack 102730, win 65535, length 0
00:15:17.302672 IP 151.101.117.140.443 > 10.0.2.15.52978: Flags [P.], seq 102730:105478, ack 304, win 65535, length 2748
00:15:17.302689 IP 10.0.2.15.52978 > 151.101.117.140.443: Flags [.], ack 105478, win 65535, length 0
00:15:17.303192 IP 151.101.117.140.443 > 10.0.2.15.52978: Flags [P.], seq 105478:108226, ack 304, win 65535, length 2748
00:15:17.303208 IP 10.0.2.15.52978 > 151.101.117.140.443: Flags [.], ack 108226, win 65535, length 0
00:15:17.304527 IP 151.101.117.140.443 > 10.0.2.15.52978: Flags [P.], seq 108226:112348, ack 304, win 65535, length 4122
00:15:17.304548 IP 10.0.2.15.52978 > 151.101.117.140.443: Flags [.], ack 112348, win 65535, length 0
00:15:17.305324 IP 151.101.117.140.443 > 10.0.2.15.52978: Flags [P.], seq 112348:115096, ack 304, win 65535, length 2748
00:15:17.305339 IP 10.0.2.15.52978 > 151.101.117.140.443: Flags [.], ack 115096, win 65535, length 0
00:15:17.306895 IP 151.101.117.140.443 > 10.0.2.15.52978: Flags [P.], seq 115096:117844, ack 304, win 65535, length 2748
00:15:17.306918 IP 10.0.2.15.52978 > 151.101.117.140.443: Flags [.], ack 117844, win 65535, length 0
00:15:17.307669 IP 151.101.117.140.443 > 10.0.2.15.52978: Flags [P.], seq 117844:123340, ack 304, win 65535, length 5496
00:15:17.307689 IP 10.0.2.15.52978 > 151.101.117.140.443: Flags [.], ack 123340, win 65535, length 0
00:15:17.308674 IP 151.101.117.140.443 > 10.0.2.15.52978: Flags [P.], seq 123340:126088, ack 304, win 65535, length 2748
00:15:17.308693 IP 10.0.2.15.52978 > 151.101.117.140.443: Flags [.], ack 126088, win 65535, length 0
00:15:17.310116 IP 151.101.117.140.443 > 10.0.2.15.52978: Flags [P.], seq 126088:131584, ack 304, win 65535, length 5496
00:15:17.310135 IP 10.0.2.15.52978 > 151.101.117.140.443: Flags [.], ack 131584, win 65535, length 0
00:15:17.311124 IP 151.101.117.140.443 > 10.0.2.15.52978: Flags [P.], seq 131584:137080, ack 304, win 65535, length 5496
00:15:17.311142 IP 10.0.2.15.52978 > 151.101.117.140.443: Flags [.], ack 137080, win 65535, length 0
00:15:17.312128 IP 151.101.117.140.443 > 10.0.2.15.52978: Flags [P.], seq 137080:139828, ack 304, win 65535, length 2748
00:15:17.312149 IP 10.0.2.15.52978 > 151.101.117.140.443: Flags [.], ack 139828, win 65535, length 0
00:15:17.313561 IP 151.101.117.140.443 > 10.0.2.15.52978: Flags [P.], seq 139828:145324, ack 304, win 65535, length 5496
00:15:17.313564 IP 151.101.117.140.443 > 10.0.2.15.52978: Flags [P.], seq 145324:146698, ack 304, win 65535, length 1374
00:15:17.313588 IP 10.0.2.15.52978 > 151.101.117.140.443: Flags [.], ack 145324, win 65535, length 0
00:15:17.313621 IP 10.0.2.15.52978 > 151.101.117.140.443: Flags [.], ack 146698, win 65535, length 0
00:15:17.314537 IP 151.101.117.140.443 > 10.0.2.15.52978: Flags [P.], seq 146698:150820, ack 304, win 65535, length 4122
00:15:17.314552 IP 10.0.2.15.52978 > 151.101.117.140.443: Flags [.], ack 150820, win 65535, length 0
00:15:17.315645 IP 151.101.117.140.443 > 10.0.2.15.52978: Flags [P.], seq 150820:154942, ack 304, win 65535, length 4122
00:15:17.315659 IP 10.0.2.15.52978 > 151.101.117.140.443: Flags [.], ack 154942, win 65535, length 0
00:15:17.316705 IP 151.101.117.140.443 > 10.0.2.15.52978: Flags [P.], seq 154942:159064, ack 304, win 65535, length 4122
00:15:17.316719 IP 10.0.2.15.52978 > 151.101.117.140.443: Flags [.], ack 159064, win 65535, length 0
00:15:17.317861 IP 151.101.117.140.443 > 10.0.2.15.52978: Flags [P.], seq 159064:163186, ack 304, win 65535, length 4122
00:15:17.317864 IP 151.101.117.140.443 > 10.0.2.15.52978: Flags [P.], seq 163186:165934, ack 304, win 65535, length 2748
00:15:17.317886 IP 10.0.2.15.52978 > 151.101.117.140.443: Flags [.], ack 163186, win 65535, length 0
00:15:17.317919 IP 10.0.2.15.52978 > 151.101.117.140.443: Flags [.], ack 165934, win 65535, length 0
00:15:17.318168 IP 151.101.117.140.443 > 10.0.2.15.52978: Flags [P.], seq 165934:167308, ack 304, win 65535, length 1374
00:15:17.318323 IP 10.0.2.15.52978 > 151.101.117.140.443: Flags [.], ack 167308, win 65535, length 0
00:15:17.318949 IP 151.101.117.140.443 > 10.0.2.15.52978: Flags [P.], seq 167308:171430, ack 304, win 65535, length 4122
00:15:17.319003 IP 10.0.2.15.52978 > 151.101.117.140.443: Flags [.], ack 171430, win 65535, length 0
00:15:17.321669 IP 151.101.117.140.443 > 10.0.2.15.52978: Flags [P.], seq 171430:178300, ack 304, win 65535, length 6870
00:15:17.321743 IP 10.0.2.15.52978 > 151.101.117.140.443: Flags [.], ack 178300, win 65535, length 0
00:15:17.321974 IP 151.101.117.140.443 > 10.0.2.15.52978: Flags [P.], seq 178300:181048, ack 304, win 65535, length 2748
00:15:17.321975 IP 151.101.117.140.443 > 10.0.2.15.52978: Flags [P.], seq 181048:182422, ack 304, win 65535, length 1374
00:15:17.321988 IP 10.0.2.15.52978 > 151.101.117.140.443: Flags [.], ack 181048, win 65535, length 0
00:15:17.322002 IP 10.0.2.15.52978 > 151.101.117.140.443: Flags [.], ack 182422, win 65535, length 0
00:15:17.323036 IP 151.101.117.140.443 > 10.0.2.15.52978: Flags [P.], seq 182422:186544, ack 304, win 65535, length 4122
00:15:17.323039 IP 151.101.117.140.443 > 10.0.2.15.52978: Flags [P.], seq 186544:187918, ack 304, win 65535, length 1374
00:15:17.323205 IP 10.0.2.15.52978 > 151.101.117.140.443: Flags [.], ack 186544, win 65535, length 0
00:15:17.323229 IP 10.0.2.15.52978 > 151.101.117.140.443: Flags [.], ack 187918, win 65535, length 0
00:15:17.323403 IP 151.101.117.140.443 > 10.0.2.15.52978: Flags [P.], seq 187918:190666, ack 304, win 65535, length 2748
00:15:17.323410 IP 10.0.2.15.52978 > 151.101.117.140.443: Flags [.], ack 190666, win 65535, length 0
00:15:17.324346 IP 151.101.117.140.443 > 10.0.2.15.52978: Flags [P.], seq 190666:196162, ack 304, win 65535, length 5496
00:15:17.324349 IP 151.101.117.140.443 > 10.0.2.15.52978: Flags [P.], seq 196162:197753, ack 304, win 65535, length 1591
00:15:17.324366 IP 10.0.2.15.52978 > 151.101.117.140.443: Flags [.], ack 196162, win 65535, length 0
00:15:17.324428 IP 10.0.2.15.52978 > 151.101.117.140.443: Flags [.], ack 197753, win 65535, length 0
00:15:17.871288 IP 151.101.117.140.443 > 10.0.2.15.52978: Flags [P.], seq 197753:215658, ack 304, win 65535, length 17905
00:15:17.871325 IP 10.0.2.15.52978 > 151.101.117.140.443: Flags [.], ack 215658, win 65535, length 0
00:15:17.875181 IP 151.101.117.140.443 > 10.0.2.15.52978: Flags [P.], seq 215658:234894, ack 304, win 65535, length 19236
00:15:17.875209 IP 10.0.2.15.52978 > 151.101.117.140.443: Flags [.], ack 234894, win 65535, length 0
00:15:17.875268 IP 151.101.117.140.443 > 10.0.2.15.52978: Flags [P.], seq 234894:236268, ack 304, win 65535, length 1374
00:15:17.875281 IP 10.0.2.15.52978 > 151.101.117.140.443: Flags [.], ack 236268, win 65535, length 0
00:15:17.876893 IP 151.101.117.140.443 > 10.0.2.15.52978: Flags [P.], seq 236268:241764, ack 304, win 65535, length 5496
00:15:17.876915 IP 10.0.2.15.52978 > 151.101.117.140.443: Flags [.], ack 241764, win 65535, length 0
00:15:17.877278 IP 151.101.117.140.443 > 10.0.2.15.52978: Flags [P.], seq 241764:243138, ack 304, win 65535, length 1374
00:15:17.877281 IP 151.101.117.140.443 > 10.0.2.15.52978: Flags [P.], seq 243138:245886, ack 304, win 65535, length 2748
00:15:17.877349 IP 10.0.2.15.52978 > 151.101.117.140.443: Flags [.], ack 243138, win 65535, length 0
00:15:17.877418 IP 10.0.2.15.52978 > 151.101.117.140.443: Flags [.], ack 245886, win 65535, length 0
00:15:17.877659 IP 151.101.117.140.443 > 10.0.2.15.52978: Flags [P.], seq 245886:250008, ack 304, win 65535, length 4122
00:15:17.877660 IP 151.101.117.140.443 > 10.0.2.15.52978: Flags [P.], seq 250008:251382, ack 304, win 65535, length 1374
00:15:17.877674 IP 10.0.2.15.52978 > 151.101.117.140.443: Flags [.], ack 250008, win 65535, length 0
00:15:17.877692 IP 10.0.2.15.52978 > 151.101.117.140.443: Flags [.], ack 251382, win 65535, length 0
00:15:17.877868 IP 151.101.117.140.443 > 10.0.2.15.52978: Flags [P.], seq 251382:254130, ack 304, win 65535, length 2748
00:15:17.877897 IP 10.0.2.15.52978 > 151.101.117.140.443: Flags [.], ack 254130, win 65535, length 0
00:15:17.878040 IP 151.101.117.140.443 > 10.0.2.15.52978: Flags [P.], seq 254130:256878, ack 304, win 65535, length 2748
00:15:17.878047 IP 10.0.2.15.52978 > 151.101.117.140.443: Flags [.], ack 256878, win 65535, length 0
00:15:17.879653 IP 151.101.117.140.443 > 10.0.2.15.52978: Flags [P.], seq 256878:258196, ack 304, win 65535, length 1318
00:15:17.879677 IP 10.0.2.15.52978 > 151.101.117.140.443: Flags [.], ack 258196, win 65535, length 0
00:15:17.885050 IP 151.101.117.140.443 > 10.0.2.15.52978: Flags [P.], seq 258196:260944, ack 304, win 65535, length 2748
00:15:17.885056 IP 151.101.117.140.443 > 10.0.2.15.52978: Flags [P.], seq 260944:263692, ack 304, win 65535, length 2748
00:15:17.885968 IP 10.0.2.15.52978 > 151.101.117.140.443: Flags [.], ack 260944, win 65535, length 0
00:15:17.886217 IP 10.0.2.15.52978 > 151.101.117.140.443: Flags [.], ack 263692, win 65535, length 0
00:15:17.890536 IP 151.101.117.140.443 > 10.0.2.15.52978: Flags [P.], seq 263692:271936, ack 304, win 65535, length 8244
00:15:17.890543 IP 151.101.117.140.443 > 10.0.2.15.52978: Flags [P.], seq 271936:282928, ack 304, win 65535, length 10992
00:15:17.890572 IP 10.0.2.15.52978 > 151.101.117.140.443: Flags [.], ack 271936, win 65535, length 0
00:15:17.890768 IP 10.0.2.15.52978 > 151.101.117.140.443: Flags [.], ack 282928, win 65535, length 0
00:15:17.893906 IP 151.101.117.140.443 > 10.0.2.15.52978: Flags [P.], seq 282928:291172, ack 304, win 65535, length 8244
00:15:17.893910 IP 151.101.117.140.443 > 10.0.2.15.52978: Flags [P.], seq 291172:298042, ack 304, win 65535, length 6870
00:15:17.893945 IP 10.0.2.15.52978 > 151.101.117.140.443: Flags [.], ack 291172, win 65535, length 0
00:15:17.894197 IP 10.0.2.15.52978 > 151.101.117.140.443: Flags [.], ack 298042, win 65535, length 0
00:15:17.894241 IP 151.101.117.140.443 > 10.0.2.15.52978: Flags [P.], seq 298042:302164, ack 304, win 65535, length 4122
00:15:17.894250 IP 10.0.2.15.52978 > 151.101.117.140.443: Flags [.], ack 302164, win 65535, length 0
00:15:17.899134 IP 151.101.117.140.443 > 10.0.2.15.52978: Flags [P.], seq 302164:306286, ack 304, win 65535, length 4122
00:15:17.899139 IP 151.101.117.140.443 > 10.0.2.15.52978: Flags [P.], seq 306286:309034, ack 304, win 65535, length 2748
00:15:17.899140 IP 151.101.117.140.443 > 10.0.2.15.52978: Flags [P.], seq 309034:310408, ack 304, win 65535, length 1374
00:15:17.899172 IP 10.0.2.15.52978 > 151.101.117.140.443: Flags [.], ack 306286, win 65535, length 0
00:15:17.899361 IP 10.0.2.15.52978 > 151.101.117.140.443: Flags [.], ack 309034, win 65535, length 0
00:15:17.899388 IP 10.0.2.15.52978 > 151.101.117.140.443: Flags [.], ack 310408, win 65535, length 0
00:15:17.906979 IP 151.101.117.140.443 > 10.0.2.15.52978: Flags [P.], seq 310408:324148, ack 304, win 65535, length 13740
00:15:17.907008 IP 10.0.2.15.52978 > 151.101.117.140.443: Flags [.], ack 324148, win 65535, length 0
00:15:17.907173 IP 151.101.117.140.443 > 10.0.2.15.52978: Flags [P.], seq 324148:325522, ack 304, win 65535, length 1374
00:15:17.907178 IP 151.101.117.140.443 > 10.0.2.15.52978: Flags [P.], seq 325522:333766, ack 304, win 65535, length 8244
00:15:17.907179 IP 151.101.117.140.443 > 10.0.2.15.52978: Flags [P.], seq 333766:337888, ack 304, win 65535, length 4122
00:15:17.907200 IP 10.0.2.15.52978 > 151.101.117.140.443: Flags [.], ack 325522, win 65535, length 0
00:15:17.907219 IP 10.0.2.15.52978 > 151.101.117.140.443: Flags [.], ack 333766, win 65535, length 0
00:15:17.907229 IP 10.0.2.15.52978 > 151.101.117.140.443: Flags [.], ack 337888, win 65535, length 0
00:15:17.907246 IP 151.101.117.140.443 > 10.0.2.15.52978: Flags [P.], seq 337888:350254, ack 304, win 65535, length 12366
00:15:17.907252 IP 10.0.2.15.52978 > 151.101.117.140.443: Flags [.], ack 350254, win 65535, length 0
00:15:17.914934 IP 151.101.117.140.443 > 10.0.2.15.52978: Flags [.], seq 350254:376534, ack 304, win 65535, length 26280
00:15:17.914967 IP 10.0.2.15.52978 > 151.101.117.140.443: Flags [.], ack 376534, win 65535, length 0
00:15:17.917642 IP 151.101.117.140.443 > 10.0.2.15.52978: Flags [P.], seq 376534:383230, ack 304, win 65535, length 6696
00:15:17.917805 IP 10.0.2.15.52978 > 151.101.117.140.443: Flags [.], ack 383230, win 65535, length 0
00:15:17.919520 IP 151.101.117.140.443 > 10.0.2.15.52978: Flags [P.], seq 383230:417580, ack 304, win 65535, length 34350
00:15:17.919542 IP 10.0.2.15.52978 > 151.101.117.140.443: Flags [.], ack 417580, win 65535, length 0
00:15:17.923219 IP 151.101.117.140.443 > 10.0.2.15.52978: Flags [.], seq 417580:429260, ack 304, win 65535, length 11680
00:15:17.923243 IP 10.0.2.15.52978 > 151.101.117.140.443: Flags [.], ack 429260, win 65535, length 0
00:15:17.924024 IP 151.101.117.140.443 > 10.0.2.15.52978: Flags [.], seq 429260:454080, ack 304, win 65535, length 24820
00:15:17.924052 IP 10.0.2.15.52978 > 151.101.117.140.443: Flags [.], ack 454080, win 65535, length 0
00:15:17.924444 IP 151.101.117.140.443 > 10.0.2.15.52978: Flags [P.], seq 454080:454678, ack 304, win 65535, length 598
00:15:17.924615 IP 10.0.2.15.52978 > 151.101.117.140.443: Flags [.], ack 454678, win 65535, length 0
00:15:17.927061 IP 151.101.117.140.443 > 10.0.2.15.52978: Flags [.], seq 454678:456138, ack 304, win 65535, length 1460
00:15:17.927084 IP 10.0.2.15.52978 > 151.101.117.140.443: Flags [.], ack 456138, win 65535, length 0
00:15:17.933129 IP 151.101.117.140.443 > 10.0.2.15.52978: Flags [P.], seq 456138:460174, ack 304, win 65535, length 4036
00:15:17.933133 IP 151.101.117.140.443 > 10.0.2.15.52978: Flags [P.], seq 460174:465670, ack 304, win 65535, length 5496
00:15:17.933134 IP 151.101.117.140.443 > 10.0.2.15.52978: Flags [P.], seq 465670:469792, ack 304, win 65535, length 4122
00:15:17.933166 IP 10.0.2.15.52978 > 151.101.117.140.443: Flags [.], ack 460174, win 65535, length 0
00:15:17.933202 IP 10.0.2.15.52978 > 151.101.117.140.443: Flags [.], ack 465670, win 65535, length 0
00:15:17.933214 IP 10.0.2.15.52978 > 151.101.117.140.443: Flags [.], ack 469792, win 65535, length 0
00:15:17.933372 IP 151.101.117.140.443 > 10.0.2.15.52978: Flags [P.], seq 469792:471166, ack 304, win 65535, length 1374
00:15:17.933374 IP 151.101.117.140.443 > 10.0.2.15.52978: Flags [P.], seq 471166:476662, ack 304, win 65535, length 5496
00:15:17.933375 IP 151.101.117.140.443 > 10.0.2.15.52978: Flags [.], seq 476662:479582, ack 304, win 65535, length 2920
00:15:17.933385 IP 10.0.2.15.52978 > 151.101.117.140.443: Flags [.], ack 471166, win 65535, length 0
00:15:17.933401 IP 10.0.2.15.52978 > 151.101.117.140.443: Flags [.], ack 476662, win 65535, length 0
00:15:17.933410 IP 10.0.2.15.52978 > 151.101.117.140.443: Flags [.], ack 479582, win 65535, length 0
00:15:17.933967 IP 151.101.117.140.443 > 10.0.2.15.52978: Flags [.], seq 479582:483962, ack 304, win 65535, length 4380
00:15:17.933983 IP 10.0.2.15.52978 > 151.101.117.140.443: Flags [.], ack 483962, win 65535, length 0
00:15:17.935911 IP 151.101.117.140.443 > 10.0.2.15.52978: Flags [P.], seq 483962:484906, ack 304, win 65535, length 944
00:15:17.935914 IP 151.101.117.140.443 > 10.0.2.15.52978: Flags [P.], seq 484906:486280, ack 304, win 65535, length 1374
00:15:17.935916 IP 151.101.117.140.443 > 10.0.2.15.52978: Flags [P.], seq 486280:491776, ack 304, win 65535, length 5496
00:15:17.935918 IP 151.101.117.140.443 > 10.0.2.15.52978: Flags [P.], seq 491776:502768, ack 304, win 65535, length 10992
00:15:17.935943 IP 10.0.2.15.52978 > 151.101.117.140.443: Flags [.], ack 484906, win 65535, length 0
00:15:17.942081 IP 10.0.2.15.52978 > 151.101.117.140.443: Flags [.], ack 486280, win 65535, length 0
00:15:17.942150 IP 10.0.2.15.52978 > 151.101.117.140.443: Flags [.], ack 491776, win 65535, length 0
00:15:17.942163 IP 10.0.2.15.52978 > 151.101.117.140.443: Flags [.], ack 502768, win 65535, length 0
00:15:17.942211 IP 151.101.117.140.443 > 10.0.2.15.52978: Flags [P.], seq 502768:512386, ack 304, win 65535, length 9618
00:15:17.942214 IP 151.101.117.140.443 > 10.0.2.15.52978: Flags [P.], seq 512386:522004, ack 304, win 65535, length 9618
00:15:17.942226 IP 10.0.2.15.52978 > 151.101.117.140.443: Flags [.], ack 512386, win 65535, length 0
00:15:17.942237 IP 10.0.2.15.52978 > 151.101.117.140.443: Flags [.], ack 522004, win 65535, length 0
00:15:17.947714 IP 151.101.117.140.443 > 10.0.2.15.52978: Flags [P.], seq 522004:552232, ack 304, win 65535, length 30228
00:15:17.947749 IP 10.0.2.15.52978 > 151.101.117.140.443: Flags [.], ack 552232, win 65535, length 0
00:15:17.947835 IP 151.101.117.140.443 > 10.0.2.15.52978: Flags [P.], seq 552232:560476, ack 304, win 65535, length 8244
00:15:17.947844 IP 10.0.2.15.52978 > 151.101.117.140.443: Flags [.], ack 560476, win 65535, length 0
00:15:17.949327 IP 151.101.117.140.443 > 10.0.2.15.52978: Flags [P.], seq 560476:583834, ack 304, win 65535, length 23358
00:15:17.949355 IP 10.0.2.15.52978 > 151.101.117.140.443: Flags [.], ack 583834, win 65535, length 0
00:15:17.949532 IP 151.101.117.140.443 > 10.0.2.15.52978: Flags [P.], seq 583834:590704, ack 304, win 65535, length 6870
00:15:17.949534 IP 151.101.117.140.443 > 10.0.2.15.52978: Flags [P.], seq 590704:592078, ack 304, win 65535, length 1374
00:15:17.949549 IP 10.0.2.15.52978 > 151.101.117.140.443: Flags [.], ack 590704, win 65535, length 0
00:15:17.949568 IP 10.0.2.15.52978 > 151.101.117.140.443: Flags [.], ack 592078, win 65535, length 0
00:15:17.954982 IP 151.101.117.140.443 > 10.0.2.15.52978: Flags [P.], seq 592078:594826, ack 304, win 65535, length 2748
00:15:17.955003 IP 10.0.2.15.52978 > 151.101.117.140.443: Flags [.], ack 594826, win 65535, length 0
00:15:17.960382 IP 151.101.117.140.443 > 10.0.2.15.52978: Flags [P.], seq 594826:598948, ack 304, win 65535, length 4122
00:15:17.960388 IP 151.101.117.140.443 > 10.0.2.15.52978: Flags [P.], seq 598948:605818, ack 304, win 65535, length 6870
00:15:17.960423 IP 10.0.2.15.52978 > 151.101.117.140.443: Flags [.], ack 598948, win 65535, length 0
00:15:17.960724 IP 10.0.2.15.52978 > 151.101.117.140.443: Flags [.], ack 605818, win 65535, length 0
00:15:17.961102 IP 151.101.117.140.443 > 10.0.2.15.52978: Flags [P.], seq 605818:612688, ack 304, win 65535, length 6870
00:15:17.961104 IP 151.101.117.140.443 > 10.0.2.15.52978: Flags [P.], seq 612688:614062, ack 304, win 65535, length 1374
00:15:17.961107 IP 151.101.117.140.443 > 10.0.2.15.52978: Flags [P.], seq 614062:627802, ack 304, win 65535, length 13740
00:15:17.961126 IP 10.0.2.15.52978 > 151.101.117.140.443: Flags [.], ack 612688, win 65535, length 0
00:15:17.961141 IP 10.0.2.15.52978 > 151.101.117.140.443: Flags [.], ack 614062, win 65535, length 0
00:15:17.961151 IP 10.0.2.15.52978 > 151.101.117.140.443: Flags [.], ack 627802, win 65535, length 0
00:15:17.962558 IP 151.101.117.140.443 > 10.0.2.15.52978: Flags [P.], seq 627802:655282, ack 304, win 65535, length 27480
00:15:17.962876 IP 10.0.2.15.52978 > 151.101.117.140.443: Flags [.], ack 655282, win 65535, length 0
00:15:17.963002 IP 151.101.117.140.443 > 10.0.2.15.52978: Flags [P.], seq 655282:662152, ack 304, win 65535, length 6870
00:15:17.963022 IP 10.0.2.15.52978 > 151.101.117.140.443: Flags [.], ack 662152, win 65535, length 0
00:15:17.963959 IP 151.101.117.140.443 > 10.0.2.15.52978: Flags [P.], seq 662152:667648, ack 304, win 65535, length 5496
00:15:17.963961 IP 151.101.117.140.443 > 10.0.2.15.52978: Flags [P.], seq 667648:669022, ack 304, win 65535, length 1374
00:15:17.963984 IP 10.0.2.15.52978 > 151.101.117.140.443: Flags [.], ack 667648, win 65535, length 0
00:15:17.964138 IP 10.0.2.15.52978 > 151.101.117.140.443: Flags [.], ack 669022, win 65535, length 0
00:15:17.964879 IP 151.101.117.140.443 > 10.0.2.15.52978: Flags [P.], seq 669022:673144, ack 304, win 65535, length 4122
00:15:17.964897 IP 10.0.2.15.52978 > 151.101.117.140.443: Flags [.], ack 673144, win 65535, length 0
00:15:17.965132 IP 151.101.117.140.443 > 10.0.2.15.52978: Flags [P.], seq 673144:675892, ack 304, win 65535, length 2748
00:15:17.965142 IP 10.0.2.15.52978 > 151.101.117.140.443: Flags [.], ack 675892, win 65535, length 0
00:15:17.969217 IP 151.101.117.140.443 > 10.0.2.15.52978: Flags [P.], seq 675892:678640, ack 304, win 65535, length 2748
00:15:17.969220 IP 151.101.117.140.443 > 10.0.2.15.52978: Flags [P.], seq 678640:681388, ack 304, win 65535, length 2748

