20:05:06.198664 IP 10.0.2.15.33486 > 140.233.253.2.53: 45260+ A? www.reddit.com. (32)
20:05:06.198698 IP 10.0.2.15.33486 > 140.233.253.2.53: 24009+ AAAA? www.reddit.com. (32)
20:05:06.204200 IP 140.233.253.2.53 > 10.0.2.15.33486: 45260 2/0/0 CNAME reddit.map.fastly.net., A 151.101.117.140 (83)
20:05:06.205910 IP 140.233.253.2.53 > 10.0.2.15.33486: 24009 1/1/0 CNAME reddit.map.fastly.net. (125)
20:05:06.206434 IP 10.0.2.15.53148 > 151.101.117.140.443: Flags [S], seq 196260600, win 64240, options [mss 1460,sackOK,TS val 3623795390 ecr 0,nop,wscale 6], length 0
20:05:06.221224 IP 151.101.117.140.443 > 10.0.2.15.53148: Flags [S.], seq 225664001, ack 196260601, win 65535, options [mss 1460], length 0
20:05:06.221270 IP 10.0.2.15.53148 > 151.101.117.140.443: Flags [.], ack 1, win 64240, length 0
20:05:06.228217 IP 10.0.2.15.53148 > 151.101.117.140.443: Flags [P.], seq 1:518, ack 1, win 64240, length 517
20:05:06.228508 IP 151.101.117.140.443 > 10.0.2.15.53148: Flags [.], ack 518, win 65535, length 0
20:05:06.243621 IP 151.101.117.140.443 > 10.0.2.15.53148: Flags [P.], seq 1:2749, ack 518, win 65535, length 2748
20:05:06.243643 IP 10.0.2.15.53148 > 151.101.117.140.443: Flags [.], ack 2749, win 62780, length 0
20:05:06.244378 IP 151.101.117.140.443 > 10.0.2.15.53148: Flags [P.], seq 2749:3722, ack 518, win 65535, length 973
20:05:06.244391 IP 10.0.2.15.53148 > 151.101.117.140.443: Flags [.], ack 3722, win 62780, length 0
20:05:06.245304 IP 10.0.2.15.53148 > 151.101.117.140.443: Flags [P.], seq 518:598, ack 3722, win 62780, length 80
20:05:06.245629 IP 10.0.2.15.53148 > 151.101.117.140.443: Flags [P.], seq 598:644, ack 3722, win 62780, length 46
20:05:06.245694 IP 151.101.117.140.443 > 10.0.2.15.53148: Flags [.], ack 598, win 65535, length 0
20:05:06.246019 IP 10.0.2.15.53148 > 151.101.117.140.443: Flags [P.], seq 644:693, ack 3722, win 62780, length 49
20:05:06.246187 IP 151.101.117.140.443 > 10.0.2.15.53148: Flags [.], ack 644, win 65535, length 0
20:05:06.246200 IP 10.0.2.15.53148 > 151.101.117.140.443: Flags [P.], seq 693:728, ack 3722, win 62780, length 35
20:05:06.246483 IP 151.101.117.140.443 > 10.0.2.15.53148: Flags [.], ack 693, win 65535, length 0
20:05:06.246485 IP 151.101.117.140.443 > 10.0.2.15.53148: Flags [.], ack 728, win 65535, length 0
20:05:06.246532 IP 10.0.2.15.53148 > 151.101.117.140.443: Flags [P.], seq 728:790, ack 3722, win 62780, length 62
20:05:06.246714 IP 151.101.117.140.443 > 10.0.2.15.53148: Flags [.], ack 790, win 65535, length 0
20:05:06.259682 IP 151.101.117.140.443 > 10.0.2.15.53148: Flags [P.], seq 3722:3803, ack 790, win 65535, length 81
20:05:06.259704 IP 10.0.2.15.53148 > 151.101.117.140.443: Flags [.], ack 3803, win 62780, length 0
20:05:06.260253 IP 10.0.2.15.53148 > 151.101.117.140.443: Flags [P.], seq 790:821, ack 3803, win 62780, length 31
20:05:06.260558 IP 151.101.117.140.443 > 10.0.2.15.53148: Flags [.], ack 821, win 65535, length 0
20:05:06.608070 IP 151.101.117.140.443 > 10.0.2.15.53148: Flags [P.], seq 3803:9299, ack 821, win 65535, length 5496
20:05:06.608074 IP 151.101.117.140.443 > 10.0.2.15.53148: Flags [.], seq 9299:10759, ack 821, win 65535, length 1460
20:05:06.608115 IP 10.0.2.15.53148 > 151.101.117.140.443: Flags [.], ack 9299, win 61320, length 0
20:05:06.608199 IP 10.0.2.15.53148 > 151.101.117.140.443: Flags [.], ack 10759, win 59860, length 0
20:05:06.609214 IP 151.101.117.140.443 > 10.0.2.15.53148: Flags [.], seq 10759:20979, ack 821, win 65535, length 10220
20:05:06.609239 IP 10.0.2.15.53148 > 151.101.117.140.443: Flags [.], ack 20979, win 52560, length 0
20:05:06.609510 IP 151.101.117.140.443 > 10.0.2.15.53148: Flags [.], seq 20979:32659, ack 821, win 65535, length 11680
20:05:06.609524 IP 10.0.2.15.53148 > 151.101.117.140.443: Flags [.], ack 32659, win 45260, length 0
20:05:06.609704 IP 151.101.117.140.443 > 10.0.2.15.53148: Flags [.], seq 32659:44339, ack 821, win 65535, length 11680
20:05:06.609719 IP 10.0.2.15.53148 > 151.101.117.140.443: Flags [.], ack 44339, win 37960, length 0
20:05:06.609921 IP 151.101.117.140.443 > 10.0.2.15.53148: Flags [P.], seq 44339:46397, ack 821, win 65535, length 2058
20:05:06.609932 IP 10.0.2.15.53148 > 151.101.117.140.443: Flags [.], ack 46397, win 35902, length 0
20:05:06.622880 IP 151.101.117.140.443 > 10.0.2.15.53148: Flags [P.], seq 46397:50519, ack 821, win 65535, length 4122
20:05:06.622902 IP 10.0.2.15.53148 > 151.101.117.140.443: Flags [.], ack 50519, win 61320, length 0
20:05:06.623811 IP 151.101.117.140.443 > 10.0.2.15.53148: Flags [P.], seq 50519:54641, ack 821, win 65535, length 4122
20:05:06.623827 IP 10.0.2.15.53148 > 151.101.117.140.443: Flags [.], ack 54641, win 61320, length 0
20:05:06.624989 IP 151.101.117.140.443 > 10.0.2.15.53148: Flags [P.], seq 54641:56015, ack 821, win 65535, length 1374
20:05:06.625007 IP 10.0.2.15.53148 > 151.101.117.140.443: Flags [.], ack 56015, win 62780, length 0
20:05:06.625989 IP 151.101.117.140.443 > 10.0.2.15.53148: Flags [P.], seq 56015:60137, ack 821, win 65535, length 4122
20:05:06.626010 IP 10.0.2.15.53148 > 151.101.117.140.443: Flags [.], ack 60137, win 61320, length 0
20:05:06.628071 IP 151.101.117.140.443 > 10.0.2.15.53148: Flags [P.], seq 60137:61511, ack 821, win 65535, length 1374
20:05:06.628090 IP 10.0.2.15.53148 > 151.101.117.140.443: Flags [.], ack 61511, win 62780, length 0
20:05:06.629595 IP 151.101.117.140.443 > 10.0.2.15.53148: Flags [P.], seq 61511:62885, ack 821, win 65535, length 1374
20:05:06.629618 IP 10.0.2.15.53148 > 151.101.117.140.443: Flags [.], ack 62885, win 62780, length 0
20:05:06.630475 IP 151.101.117.140.443 > 10.0.2.15.53148: Flags [P.], seq 62885:64259, ack 821, win 65535, length 1374
20:05:06.630488 IP 10.0.2.15.53148 > 151.101.117.140.443: Flags [.], ack 64259, win 62780, length 0
20:05:06.631867 IP 151.101.117.140.443 > 10.0.2.15.53148: Flags [P.], seq 64259:65633, ack 821, win 65535, length 1374
20:05:06.631887 IP 10.0.2.15.53148 > 151.101.117.140.443: Flags [.], ack 65633, win 62780, length 0
20:05:06.632742 IP 151.101.117.140.443 > 10.0.2.15.53148: Flags [P.], seq 65633:67007, ack 821, win 65535, length 1374
20:05:06.632755 IP 10.0.2.15.53148 > 151.101.117.140.443: Flags [.], ack 67007, win 62780, length 0
20:05:06.633981 IP 151.101.117.140.443 > 10.0.2.15.53148: Flags [P.], seq 67007:68381, ack 821, win 65535, length 1374
20:05:06.634001 IP 10.0.2.15.53148 > 151.101.117.140.443: Flags [.], ack 68381, win 65535, length 0
20:05:06.635043 IP 151.101.117.140.443 > 10.0.2.15.53148: Flags [P.], seq 68381:69755, ack 821, win 65535, length 1374
20:05:06.635063 IP 10.0.2.15.53148 > 151.101.117.140.443: Flags [.], ack 69755, win 65535, length 0
20:05:06.639330 IP 151.101.117.140.443 > 10.0.2.15.53148: Flags [P.], seq 69755:73877, ack 821, win 65535, length 4122
20:05:06.639352 IP 10.0.2.15.53148 > 151.101.117.140.443: Flags [.], ack 73877, win 65535, length 0
20:05:06.641716 IP 151.101.117.140.443 > 10.0.2.15.53148: Flags [P.], seq 73877:76625, ack 821, win 65535, length 2748
20:05:06.641736 IP 10.0.2.15.53148 > 151.101.117.140.443: Flags [.], ack 76625, win 65535, length 0
20:05:06.643773 IP 151.101.117.140.443 > 10.0.2.15.53148: Flags [P.], seq 76625:79373, ack 821, win 65535, length 2748
20:05:06.643794 IP 10.0.2.15.53148 > 151.101.117.140.443: Flags [.], ack 79373, win 65535, length 0
20:05:06.644852 IP 151.101.117.140.443 > 10.0.2.15.53148: Flags [P.], seq 79373:80747, ack 821, win 65535, length 1374
20:05:06.644871 IP 10.0.2.15.53148 > 151.101.117.140.443: Flags [.], ack 80747, win 65535, length 0
20:05:06.646182 IP 151.101.117.140.443 > 10.0.2.15.53148: Flags [P.], seq 80747:82121, ack 821, win 65535, length 1374
20:05:06.646203 IP 10.0.2.15.53148 > 151.101.117.140.443: Flags [.], ack 82121, win 65535, length 0
20:05:06.647130 IP 151.101.117.140.443 > 10.0.2.15.53148: Flags [P.], seq 82121:84869, ack 821, win 65535, length 2748
20:05:06.647145 IP 10.0.2.15.53148 > 151.101.117.140.443: Flags [.], ack 84869, win 65535, length 0
20:05:06.648077 IP 151.101.117.140.443 > 10.0.2.15.53148: Flags [P.], seq 84869:86243, ack 821, win 65535, length 1374
20:05:06.648093 IP 10.0.2.15.53148 > 151.101.117.140.443: Flags [.], ack 86243, win 65535, length 0
20:05:06.649495 IP 151.101.117.140.443 > 10.0.2.15.53148: Flags [P.], seq 86243:88991, ack 821, win 65535, length 2748
20:05:06.649516 IP 10.0.2.15.53148 > 151.101.117.140.443: Flags [.], ack 88991, win 65535, length 0
20:05:06.651592 IP 151.101.117.140.443 > 10.0.2.15.53148: Flags [P.], seq 88991:93113, ack 821, win 65535, length 4122
20:05:06.651611 IP 10.0.2.15.53148 > 151.101.117.140.443: Flags [.], ack 93113, win 65535, length 0
20:05:06.652887 IP 151.101.117.140.443 > 10.0.2.15.53148: Flags [P.], seq 93113:95861, ack 821, win 65535, length 2748
20:05:06.652908 IP 10.0.2.15.53148 > 151.101.117.140.443: Flags [.], ack 95861, win 65535, length 0
20:05:06.653606 IP 151.101.117.140.443 > 10.0.2.15.53148: Flags [P.], seq 95861:97235, ack 821, win 65535, length 1374
20:05:06.653622 IP 10.0.2.15.53148 > 151.101.117.140.443: Flags [.], ack 97235, win 65535, length 0
20:05:06.655299 IP 151.101.117.140.443 > 10.0.2.15.53148: Flags [P.], seq 97235:101357, ack 821, win 65535, length 4122
20:05:06.655322 IP 10.0.2.15.53148 > 151.101.117.140.443: Flags [.], ack 101357, win 65535, length 0
20:05:06.657436 IP 151.101.117.140.443 > 10.0.2.15.53148: Flags [P.], seq 101357:106853, ack 821, win 65535, length 5496
20:05:06.657525 IP 10.0.2.15.53148 > 151.101.117.140.443: Flags [.], ack 106853, win 65535, length 0
20:05:06.659996 IP 151.101.117.140.443 > 10.0.2.15.53148: Flags [P.], seq 106853:113723, ack 821, win 65535, length 6870
20:05:06.660016 IP 10.0.2.15.53148 > 151.101.117.140.443: Flags [.], ack 113723, win 65535, length 0
20:05:06.660963 IP 151.101.117.140.443 > 10.0.2.15.53148: Flags [P.], seq 113723:117845, ack 821, win 65535, length 4122
20:05:06.660973 IP 10.0.2.15.53148 > 151.101.117.140.443: Flags [.], ack 117845, win 65535, length 0
20:05:06.662152 IP 151.101.117.140.443 > 10.0.2.15.53148: Flags [P.], seq 117845:119219, ack 821, win 65535, length 1374
20:05:06.662168 IP 10.0.2.15.53148 > 151.101.117.140.443: Flags [.], ack 119219, win 65535, length 0
20:05:06.663324 IP 151.101.117.140.443 > 10.0.2.15.53148: Flags [P.], seq 119219:124715, ack 821, win 65535, length 5496
20:05:06.663351 IP 10.0.2.15.53148 > 151.101.117.140.443: Flags [.], ack 124715, win 65535, length 0
20:05:06.664212 IP 151.101.117.140.443 > 10.0.2.15.53148: Flags [P.], seq 124715:130211, ack 821, win 65535, length 5496
20:05:06.664225 IP 10.0.2.15.53148 > 151.101.117.140.443: Flags [.], ack 130211, win 65535, length 0
20:05:06.665606 IP 151.101.117.140.443 > 10.0.2.15.53148: Flags [P.], seq 130211:132959, ack 821, win 65535, length 2748
20:05:06.665624 IP 10.0.2.15.53148 > 151.101.117.140.443: Flags [.], ack 132959, win 65535, length 0
20:05:06.666640 IP 151.101.117.140.443 > 10.0.2.15.53148: Flags [P.], seq 132959:137081, ack 821, win 65535, length 4122
20:05:06.666658 IP 10.0.2.15.53148 > 151.101.117.140.443: Flags [.], ack 137081, win 65535, length 0
20:05:06.667887 IP 151.101.117.140.443 > 10.0.2.15.53148: Flags [P.], seq 137081:141203, ack 821, win 65535, length 4122
20:05:06.667904 IP 10.0.2.15.53148 > 151.101.117.140.443: Flags [.], ack 141203, win 65535, length 0
20:05:06.668580 IP 151.101.117.140.443 > 10.0.2.15.53148: Flags [P.], seq 141203:145325, ack 821, win 65535, length 4122
20:05:06.668593 IP 10.0.2.15.53148 > 151.101.117.140.443: Flags [.], ack 145325, win 65535, length 0
20:05:06.669933 IP 151.101.117.140.443 > 10.0.2.15.53148: Flags [P.], seq 145325:149447, ack 821, win 65535, length 4122
20:05:06.669954 IP 10.0.2.15.53148 > 151.101.117.140.443: Flags [.], ack 149447, win 65535, length 0
20:05:06.670888 IP 151.101.117.140.443 > 10.0.2.15.53148: Flags [P.], seq 149447:154943, ack 821, win 65535, length 5496
20:05:06.670969 IP 10.0.2.15.53148 > 151.101.117.140.443: Flags [.], ack 154943, win 65535, length 0
20:05:06.672068 IP 151.101.117.140.443 > 10.0.2.15.53148: Flags [P.], seq 154943:157691, ack 821, win 65535, length 2748
20:05:06.672092 IP 10.0.2.15.53148 > 151.101.117.140.443: Flags [.], ack 157691, win 65535, length 0
20:05:06.673282 IP 151.101.117.140.443 > 10.0.2.15.53148: Flags [P.], seq 157691:163187, ack 821, win 65535, length 5496
20:05:06.673298 IP 10.0.2.15.53148 > 151.101.117.140.443: Flags [.], ack 163187, win 65535, length 0
20:05:06.674426 IP 151.101.117.140.443 > 10.0.2.15.53148: Flags [P.], seq 163187:170057, ack 821, win 65535, length 6870
20:05:06.674446 IP 10.0.2.15.53148 > 151.101.117.140.443: Flags [.], ack 170057, win 65535, length 0
20:05:06.675434 IP 151.101.117.140.443 > 10.0.2.15.53148: Flags [P.], seq 170057:172805, ack 821, win 65535, length 2748
20:05:06.675453 IP 10.0.2.15.53148 > 151.101.117.140.443: Flags [.], ack 172805, win 65535, length 0
20:05:06.676659 IP 151.101.117.140.443 > 10.0.2.15.53148: Flags [P.], seq 172805:178301, ack 821, win 65535, length 5496
20:05:06.676679 IP 10.0.2.15.53148 > 151.101.117.140.443: Flags [.], ack 178301, win 65535, length 0
20:05:06.677565 IP 151.101.117.140.443 > 10.0.2.15.53148: Flags [P.], seq 178301:185171, ack 821, win 65535, length 6870
20:05:06.677583 IP 10.0.2.15.53148 > 151.101.117.140.443: Flags [.], ack 185171, win 65535, length 0
20:05:06.678588 IP 151.101.117.140.443 > 10.0.2.15.53148: Flags [P.], seq 185171:189293, ack 821, win 65535, length 4122
20:05:06.678631 IP 10.0.2.15.53148 > 151.101.117.140.443: Flags [.], ack 189293, win 65535, length 0
20:05:06.679528 IP 151.101.117.140.443 > 10.0.2.15.53148: Flags [P.], seq 189293:193415, ack 821, win 65535, length 4122
20:05:06.679543 IP 10.0.2.15.53148 > 151.101.117.140.443: Flags [.], ack 193415, win 65535, length 0
20:05:06.680790 IP 151.101.117.140.443 > 10.0.2.15.53148: Flags [P.], seq 193415:197537, ack 821, win 65535, length 4122
20:05:06.680817 IP 10.0.2.15.53148 > 151.101.117.140.443: Flags [.], ack 197537, win 65535, length 0
20:05:06.681591 IP 151.101.117.140.443 > 10.0.2.15.53148: Flags [P.], seq 197537:197740, ack 821, win 65535, length 203
20:05:06.681648 IP 10.0.2.15.53148 > 151.101.117.140.443: Flags [.], ack 197740, win 65535, length 0
20:05:07.327213 IP 151.101.117.140.443 > 10.0.2.15.53148: Flags [P.], seq 197740:199114, ack 821, win 65535, length 1374
20:05:07.327237 IP 10.0.2.15.53148 > 151.101.117.140.443: Flags [.], ack 199114, win 65535, length 0
20:05:07.329328 IP 151.101.117.140.443 > 10.0.2.15.53148: Flags [P.], seq 199114:199211, ack 821, win 65535, length 97
20:05:07.329344 IP 10.0.2.15.53148 > 151.101.117.140.443: Flags [.], ack 199211, win 65535, length 0
20:05:07.369496 IP 151.101.117.140.443 > 10.0.2.15.53148: Flags [P.], seq 199211:200585, ack 821, win 65535, length 1374
20:05:07.369514 IP 10.0.2.15.53148 > 151.101.117.140.443: Flags [.], ack 200585, win 65535, length 0
20:05:07.370632 IP 151.101.117.140.443 > 10.0.2.15.53148: Flags [P.], seq 200585:201959, ack 821, win 65535, length 1374
20:05:07.370647 IP 10.0.2.15.53148 > 151.101.117.140.443: Flags [.], ack 201959, win 65535, length 0
20:05:07.371958 IP 151.101.117.140.443 > 10.0.2.15.53148: Flags [P.], seq 201959:204707, ack 821, win 65535, length 2748
20:05:07.371982 IP 10.0.2.15.53148 > 151.101.117.140.443: Flags [.], ack 204707, win 65535, length 0
20:05:07.372780 IP 151.101.117.140.443 > 10.0.2.15.53148: Flags [P.], seq 204707:206081, ack 821, win 65535, length 1374
20:05:07.372805 IP 10.0.2.15.53148 > 151.101.117.140.443: Flags [.], ack 206081, win 65535, length 0
20:05:07.373882 IP 151.101.117.140.443 > 10.0.2.15.53148: Flags [P.], seq 206081:208829, ack 821, win 65535, length 2748
20:05:07.373900 IP 10.0.2.15.53148 > 151.101.117.140.443: Flags [.], ack 208829, win 65535, length 0
20:05:07.376189 IP 151.101.117.140.443 > 10.0.2.15.53148: Flags [P.], seq 208829:211577, ack 821, win 65535, length 2748
20:05:07.376213 IP 10.0.2.15.53148 > 151.101.117.140.443: Flags [.], ack 211577, win 65535, length 0
20:05:07.380025 IP 151.101.117.140.443 > 10.0.2.15.53148: Flags [P.], seq 211577:214325, ack 821, win 65535, length 2748
20:05:07.380479 IP 10.0.2.15.53148 > 151.101.117.140.443: Flags [.], ack 214325, win 65535, length 0
20:05:07.380875 IP 151.101.117.140.443 > 10.0.2.15.53148: Flags [.], seq 214325:215785, ack 821, win 65535, length 1460
20:05:07.380901 IP 10.0.2.15.53148 > 151.101.117.140.443: Flags [.], ack 215785, win 65535, length 0
20:05:07.381475 IP 151.101.117.140.443 > 10.0.2.15.53148: Flags [P.], seq 215785:217073, ack 821, win 65535, length 1288
20:05:07.381497 IP 10.0.2.15.53148 > 151.101.117.140.443: Flags [.], ack 217073, win 65535, length 0
20:05:07.381722 IP 151.101.117.140.443 > 10.0.2.15.53148: Flags [P.], seq 217073:218447, ack 821, win 65535, length 1374
20:05:07.381735 IP 10.0.2.15.53148 > 151.101.117.140.443: Flags [.], ack 218447, win 65535, length 0
20:05:07.382654 IP 151.101.117.140.443 > 10.0.2.15.53148: Flags [P.], seq 218447:219821, ack 821, win 65535, length 1374
20:05:07.382670 IP 10.0.2.15.53148 > 151.101.117.140.443: Flags [.], ack 219821, win 65535, length 0
20:05:07.383645 IP 151.101.117.140.443 > 10.0.2.15.53148: Flags [P.], seq 219821:221195, ack 821, win 65535, length 1374
20:05:07.383662 IP 10.0.2.15.53148 > 151.101.117.140.443: Flags [.], ack 221195, win 65535, length 0
20:05:07.386012 IP 151.101.117.140.443 > 10.0.2.15.53148: Flags [P.], seq 221195:222569, ack 821, win 65535, length 1374
20:05:07.386035 IP 10.0.2.15.53148 > 151.101.117.140.443: Flags [.], ack 222569, win 65535, length 0
20:05:07.386201 IP 151.101.117.140.443 > 10.0.2.15.53148: Flags [P.], seq 222569:225317, ack 821, win 65535, length 2748
20:05:07.386210 IP 10.0.2.15.53148 > 151.101.117.140.443: Flags [.], ack 225317, win 65535, length 0
20:05:07.389490 IP 151.101.117.140.443 > 10.0.2.15.53148: Flags [P.], seq 225317:229439, ack 821, win 65535, length 4122
20:05:07.389509 IP 10.0.2.15.53148 > 151.101.117.140.443: Flags [.], ack 229439, win 65535, length 0
20:05:07.390354 IP 151.101.117.140.443 > 10.0.2.15.53148: Flags [P.], seq 229439:230813, ack 821, win 65535, length 1374
20:05:07.390372 IP 10.0.2.15.53148 > 151.101.117.140.443: Flags [.], ack 230813, win 65535, length 0
20:05:07.391183 IP 151.101.117.140.443 > 10.0.2.15.53148: Flags [P.], seq 230813:232187, ack 821, win 65535, length 1374
20:05:07.391200 IP 10.0.2.15.53148 > 151.101.117.140.443: Flags [.], ack 232187, win 65535, length 0
20:05:07.393904 IP 151.101.117.140.443 > 10.0.2.15.53148: Flags [P.], seq 232187:233561, ack 821, win 65535, length 1374
20:05:07.394035 IP 10.0.2.15.53148 > 151.101.117.140.443: Flags [.], ack 233561, win 65535, length 0
20:05:07.395566 IP 151.101.117.140.443 > 10.0.2.15.53148: Flags [P.], seq 233561:237683, ack 821, win 65535, length 4122
20:05:07.395626 IP 10.0.2.15.53148 > 151.101.117.140.443: Flags [.], ack 237683, win 65535, length 0
20:05:07.395923 IP 151.101.117.140.443 > 10.0.2.15.53148: Flags [P.], seq 237683:239057, ack 821, win 65535, length 1374
20:05:07.395926 IP 151.101.117.140.443 > 10.0.2.15.53148: Flags [P.], seq 239057:240431, ack 821, win 65535, length 1374
20:05:07.395945 IP 10.0.2.15.53148 > 151.101.117.140.443: Flags [.], ack 239057, win 65535, length 0
20:05:07.395967 IP 10.0.2.15.53148 > 151.101.117.140.443: Flags [.], ack 240431, win 65535, length 0
20:05:07.396803 IP 151.101.117.140.443 > 10.0.2.15.53148: Flags [P.], seq 240431:241805, ack 821, win 65535, length 1374
20:05:07.397116 IP 10.0.2.15.53148 > 151.101.117.140.443: Flags [.], ack 241805, win 65535, length 0
20:05:07.405265 IP 151.101.117.140.443 > 10.0.2.15.53148: Flags [P.], seq 241805:247301, ack 821, win 65535, length 5496
20:05:07.405270 IP 151.101.117.140.443 > 10.0.2.15.53148: Flags [P.], seq 247301:262415, ack 821, win 65535, length 15114
20:05:07.405298 IP 10.0.2.15.53148 > 151.101.117.140.443: Flags [.], ack 247301, win 65535, length 0
20:05:07.405347 IP 10.0.2.15.53148 > 151.101.117.140.443: Flags [.], ack 262415, win 65535, length 0
20:05:07.405754 IP 151.101.117.140.443 > 10.0.2.15.53148: Flags [P.], seq 262415:263789, ack 821, win 65535, length 1374
20:05:07.405757 IP 151.101.117.140.443 > 10.0.2.15.53148: Flags [P.], seq 263789:267911, ack 821, win 65535, length 4122
20:05:07.405777 IP 10.0.2.15.53148 > 151.101.117.140.443: Flags [.], ack 263789, win 65535, length 0
20:05:07.405803 IP 10.0.2.15.53148 > 151.101.117.140.443: Flags [.], ack 267911, win 65535, length 0
20:05:07.407920 IP 151.101.117.140.443 > 10.0.2.15.53148: Flags [P.], seq 267911:272033, ack 821, win 65535, length 4122
20:05:07.407944 IP 10.0.2.15.53148 > 151.101.117.140.443: Flags [.], ack 272033, win 65535, length 0
20:05:07.411838 IP 151.101.117.140.443 > 10.0.2.15.53148: Flags [P.], seq 272033:274781, ack 821, win 65535, length 2748
20:05:07.411864 IP 10.0.2.15.53148 > 151.101.117.140.443: Flags [.], ack 274781, win 65535, length 0
20:05:07.413611 IP 151.101.117.140.443 > 10.0.2.15.53148: Flags [P.], seq 274781:284399, ack 821, win 65535, length 9618
20:05:07.413615 IP 151.101.117.140.443 > 10.0.2.15.53148: Flags [P.], seq 284399:294017, ack 821, win 65535, length 9618
20:05:07.413637 IP 10.0.2.15.53148 > 151.101.117.140.443: Flags [.], ack 284399, win 65535, length 0
20:05:07.413994 IP 10.0.2.15.53148 > 151.101.117.140.443: Flags [.], ack 294017, win 65535, length 0
20:05:07.414039 IP 151.101.117.140.443 > 10.0.2.15.53148: Flags [P.], seq 294017:299513, ack 821, win 65535, length 5496
20:05:07.414046 IP 10.0.2.15.53148 > 151.101.117.140.443: Flags [.], ack 299513, win 65535, length 0
20:05:07.415201 IP 151.101.117.140.443 > 10.0.2.15.53148: Flags [P.], seq 299513:302261, ack 821, win 65535, length 2748
20:05:07.415322 IP 10.0.2.15.53148 > 151.101.117.140.443: Flags [.], ack 302261, win 65535, length 0
20:05:07.415630 IP 151.101.117.140.443 > 10.0.2.15.53148: Flags [.], seq 302261:306641, ack 821, win 65535, length 4380
20:05:07.415645 IP 10.0.2.15.53148 > 151.101.117.140.443: Flags [.], ack 306641, win 65535, length 0
20:05:07.415756 IP 151.101.117.140.443 > 10.0.2.15.53148: Flags [P.], seq 306641:309131, ack 821, win 65535, length 2490
20:05:07.415764 IP 10.0.2.15.53148 > 151.101.117.140.443: Flags [.], ack 309131, win 65535, length 0
20:05:07.416018 IP 151.101.117.140.443 > 10.0.2.15.53148: Flags [P.], seq 309131:310505, ack 821, win 65535, length 1374
20:05:07.416030 IP 10.0.2.15.53148 > 151.101.117.140.443: Flags [.], ack 310505, win 65535, length 0
20:05:07.418685 IP 151.101.117.140.443 > 10.0.2.15.53148: Flags [P.], seq 310505:311879, ack 821, win 65535, length 1374
20:05:07.418709 IP 10.0.2.15.53148 > 151.101.117.140.443: Flags [.], ack 311879, win 65535, length 0
20:05:07.419462 IP 151.101.117.140.443 > 10.0.2.15.53148: Flags [P.], seq 311879:324245, ack 821, win 65535, length 12366
20:05:07.419482 IP 10.0.2.15.53148 > 151.101.117.140.443: Flags [.], ack 324245, win 65535, length 0
20:05:07.419514 IP 151.101.117.140.443 > 10.0.2.15.53148: Flags [P.], seq 324245:326993, ack 821, win 65535, length 2748
20:05:07.419520 IP 10.0.2.15.53148 > 151.101.117.140.443: Flags [.], ack 326993, win 65535, length 0
20:05:07.420902 IP 151.101.117.140.443 > 10.0.2.15.53148: Flags [P.], seq 326993:328367, ack 821, win 65535, length 1374
20:05:07.420925 IP 10.0.2.15.53148 > 151.101.117.140.443: Flags [.], ack 328367, win 65535, length 0
20:05:07.421958 IP 151.101.117.140.443 > 10.0.2.15.53148: Flags [P.], seq 328367:342107, ack 821, win 65535, length 13740
20:05:07.421976 IP 10.0.2.15.53148 > 151.101.117.140.443: Flags [.], ack 342107, win 65535, length 0
20:05:07.423581 IP 151.101.117.140.443 > 10.0.2.15.53148: Flags [P.], seq 342107:347603, ack 821, win 65535, length 5496
20:05:07.423600 IP 10.0.2.15.53148 > 151.101.117.140.443: Flags [.], ack 347603, win 65535, length 0
20:05:07.424391 IP 151.101.117.140.443 > 10.0.2.15.53148: Flags [P.], seq 347603:348977, ack 821, win 65535, length 1374
20:05:07.424406 IP 10.0.2.15.53148 > 151.101.117.140.443: Flags [.], ack 348977, win 65535, length 0
20:05:07.425935 IP 151.101.117.140.443 > 10.0.2.15.53148: Flags [P.], seq 348977:357221, ack 821, win 65535, length 8244
20:05:07.425937 IP 151.101.117.140.443 > 10.0.2.15.53148: Flags [P.], seq 357221:362717, ack 821, win 65535, length 5496
20:05:07.425957 IP 10.0.2.15.53148 > 151.101.117.140.443: Flags [.], ack 357221, win 65535, length 0
20:05:07.425985 IP 10.0.2.15.53148 > 151.101.117.140.443: Flags [.], ack 362717, win 65535, length 0
20:05:07.427832 IP 151.101.117.140.443 > 10.0.2.15.53148: Flags [P.], seq 362717:369587, ack 821, win 65535, length 6870
20:05:07.427853 IP 10.0.2.15.53148 > 151.101.117.140.443: Flags [.], ack 369587, win 65535, length 0
20:05:07.428715 IP 151.101.117.140.443 > 10.0.2.15.53148: Flags [P.], seq 369587:379205, ack 821, win 65535, length 9618
20:05:07.428730 IP 10.0.2.15.53148 > 151.101.117.140.443: Flags [.], ack 379205, win 65535, length 0
20:05:07.430379 IP 151.101.117.140.443 > 10.0.2.15.53148: Flags [P.], seq 379205:384701, ack 821, win 65535, length 5496
20:05:07.430405 IP 10.0.2.15.53148 > 151.101.117.140.443: Flags [.], ack 384701, win 65535, length 0
20:05:07.431235 IP 151.101.117.140.443 > 10.0.2.15.53148: Flags [P.], seq 384701:390197, ack 821, win 65535, length 5496
20:05:07.431248 IP 10.0.2.15.53148 > 151.101.117.140.443: Flags [.], ack 390197, win 65535, length 0
20:05:07.432611 IP 151.101.117.140.443 > 10.0.2.15.53148: Flags [P.], seq 390197:397067, ack 821, win 65535, length 6870
20:05:07.432628 IP 10.0.2.15.53148 > 151.101.117.140.443: Flags [.], ack 397067, win 65535, length 0
20:05:07.432966 IP 151.101.117.140.443 > 10.0.2.15.53148: Flags [P.], seq 397067:398441, ack 821, win 65535, length 1374
20:05:07.432975 IP 10.0.2.15.53148 > 151.101.117.140.443: Flags [.], ack 398441, win 65535, length 0
20:05:07.434376 IP 151.101.117.140.443 > 10.0.2.15.53148: Flags [P.], seq 398441:403937, ack 821, win 65535, length 5496
20:05:07.434517 IP 10.0.2.15.53148 > 151.101.117.140.443: Flags [.], ack 403937, win 65535, length 0
20:05:07.436025 IP 151.101.117.140.443 > 10.0.2.15.53148: Flags [P.], seq 403937:413555, ack 821, win 65535, length 9618
20:05:07.436045 IP 10.0.2.15.53148 > 151.101.117.140.443: Flags [.], ack 413555, win 65535, length 0
20:05:07.436962 IP 151.101.117.140.443 > 10.0.2.15.53148: Flags [P.], seq 413555:419051, ack 821, win 65535, length 5496
20:05:07.436974 IP 10.0.2.15.53148 > 151.101.117.140.443: Flags [.], ack 419051, win 65535, length 0
20:05:07.438208 IP 151.101.117.140.443 > 10.0.2.15.53148: Flags [P.], seq 419051:420425, ack 821, win 65535, length 1374
20:05:07.438229 IP 10.0.2.15.53148 > 151.101.117.140.443: Flags [.], ack 420425, win 65535, length 0
20:05:07.439040 IP 151.101.117.140.443 > 10.0.2.15.53148: Flags [P.], seq 420425:425921, ack 821, win 65535, length 5496
20:05:07.439219 IP 10.0.2.15.53148 > 151.101.117.140.443: Flags [.], ack 425921, win 65535, length 0
20:05:07.439587 IP 151.101.117.140.443 > 10.0.2.15.53148: Flags [P.], seq 425921:430043, ack 821, win 65535, length 4122
20:05:07.439597 IP 10.0.2.15.53148 > 151.101.117.140.443: Flags [.], ack 430043, win 65535, length 0
20:05:07.440544 IP 151.101.117.140.443 > 10.0.2.15.53148: Flags [P.], seq 430043:435539, ack 821, win 65535, length 5496
20:05:07.440545 IP 151.101.117.140.443 > 10.0.2.15.53148: Flags [P.], seq 435539:436913, ack 821, win 65535, length 1374
20:05:07.440562 IP 10.0.2.15.53148 > 151.101.117.140.443: Flags [.], ack 435539, win 65535, length 0
20:05:07.440590 IP 10.0.2.15.53148 > 151.101.117.140.443: Flags [.], ack 436913, win 65535, length 0
20:05:07.442133 IP 151.101.117.140.443 > 10.0.2.15.53148: Flags [P.], seq 436913:446531, ack 821, win 65535, length 9618
20:05:07.442154 IP 10.0.2.15.53148 > 151.101.117.140.443: Flags [.], ack 446531, win 65535, length 0
20:05:07.443376 IP 151.101.117.140.443 > 10.0.2.15.53148: Flags [P.], seq 446531:453401, ack 821, win 65535, length 6870
20:05:07.443393 IP 10.0.2.15.53148 > 151.101.117.140.443: Flags [.], ack 453401, win 65535, length 0
20:05:07.443707 IP 151.101.117.140.443 > 10.0.2.15.53148: Flags [P.], seq 453401:456149, ack 821, win 65535, length 2748
20:05:07.443709 IP 151.101.117.140.443 > 10.0.2.15.53148: Flags [P.], seq 456149:457523, ack 821, win 65535, length 1374
20:05:07.443722 IP 10.0.2.15.53148 > 151.101.117.140.443: Flags [.], ack 456149, win 65535, length 0
20:05:07.443742 IP 10.0.2.15.53148 > 151.101.117.140.443: Flags [.], ack 457523, win 65535, length 0
20:05:07.444444 IP 151.101.117.140.443 > 10.0.2.15.53148: Flags [P.], seq 457523:463019, ack 821, win 65535, length 5496
20:05:07.444536 IP 10.0.2.15.53148 > 151.101.117.140.443: Flags [.], ack 463019, win 65535, length 0
20:05:07.445892 IP 151.101.117.140.443 > 10.0.2.15.53148: Flags [P.], seq 463019:468515, ack 821, win 65535, length 5496
20:05:07.445919 IP 10.0.2.15.53148 > 151.101.117.140.443: Flags [.], ack 468515, win 65535, length 0
20:05:07.446825 IP 151.101.117.140.443 > 10.0.2.15.53148: Flags [P.], seq 468515:474011, ack 821, win 65535, length 5496
20:05:07.446840 IP 10.0.2.15.53148 > 151.101.117.140.443: Flags [.], ack 474011, win 65535, length 0
20:05:07.447853 IP 151.101.117.140.443 > 10.0.2.15.53148: Flags [P.], seq 474011:478133, ack 821, win 65535, length 4122
20:05:07.447880 IP 10.0.2.15.53148 > 151.101.117.140.443: Flags [.], ack 478133, win 65535, length 0
20:05:07.449088 IP 151.101.117.140.443 > 10.0.2.15.53148: Flags [P.], seq 478133:485003, ack 821, win 65535, length 6870
20:05:07.449109 IP 10.0.2.15.53148 > 151.101.117.140.443: Flags [.], ack 485003, win 65535, length 0
20:05:07.450445 IP 151.101.117.140.443 > 10.0.2.15.53148: Flags [P.], seq 485003:489125, ack 821, win 65535, length 4122
20:05:07.450498 IP 10.0.2.15.53148 > 151.101.117.140.443: Flags [.], ack 489125, win 65535, length 0
20:05:07.451236 IP 151.101.117.140.443 > 10.0.2.15.53148: Flags [P.], seq 489125:494621, ack 821, win 65535, length 5496
20:05:07.451247 IP 10.0.2.15.53148 > 151.101.117.140.443: Flags [.], ack 494621, win 65535, length 0
20:05:07.452512 IP 151.101.117.140.443 > 10.0.2.15.53148: Flags [P.], seq 494621:501491, ack 821, win 65535, length 6870
20:05:07.452514 IP 151.101.117.140.443 > 10.0.2.15.53148: Flags [P.], seq 501491:505613, ack 821, win 65535, length 4122
20:05:07.452533 IP 10.0.2.15.53148 > 151.101.117.140.443: Flags [.], ack 501491, win 65535, length 0
20:05:07.452566 IP 10.0.2.15.53148 > 151.101.117.140.443: Flags [.], ack 505613, win 65535, length 0
20:05:07.453895 IP 151.101.117.140.443 > 10.0.2.15.53148: Flags [P.], seq 505613:511109, ack 821, win 65535, length 5496
20:05:07.453912 IP 10.0.2.15.53148 > 151.101.117.140.443: Flags [.], ack 511109, win 65535, length 0
20:05:07.455954 IP 151.101.117.140.443 > 10.0.2.15.53148: Flags [P.], seq 511109:513857, ack 821, win 65535, length 2748
20:05:07.455979 IP 10.0.2.15.53148 > 151.101.117.140.443: Flags [.], ack 513857, win 65535, length 0
20:05:07.457400 IP 151.101.117.140.443 > 10.0.2.15.53148: Flags [P.], seq 513857:534467, ack 821, win 65535, length 20610
20:05:07.457416 IP 10.0.2.15.53148 > 151.101.117.140.443: Flags [.], ack 534467, win 65535, length 0
20:05:07.457453 IP 151.101.117.140.443 > 10.0.2.15.53148: Flags [P.], seq 534467:538589, ack 821, win 65535, length 4122
20:05:07.457457 IP 10.0.2.15.53148 > 151.101.117.140.443: Flags [.], ack 538589, win 65535, length 0
20:05:07.458728 IP 151.101.117.140.443 > 10.0.2.15.53148: Flags [P.], seq 538589:544085, ack 821, win 65535, length 5496
20:05:07.458743 IP 10.0.2.15.53148 > 151.101.117.140.443: Flags [.], ack 544085, win 65535, length 0
20:05:07.460049 IP 151.101.117.140.443 > 10.0.2.15.53148: Flags [P.], seq 544085:549581, ack 821, win 65535, length 5496
20:05:07.460122 IP 10.0.2.15.53148 > 151.101.117.140.443: Flags [.], ack 549581, win 65535, length 0
20:05:07.460906 IP 151.101.117.140.443 > 10.0.2.15.53148: Flags [P.], seq 549581:553703, ack 821, win 65535, length 4122
20:05:07.460919 IP 10.0.2.15.53148 > 151.101.117.140.443: Flags [.], ack 553703, win 65535, length 0
20:05:07.462337 IP 151.101.117.140.443 > 10.0.2.15.53148: Flags [P.], seq 553703:555077, ack 821, win 65535, length 1374
20:05:07.462340 IP 151.101.117.140.443 > 10.0.2.15.53148: Flags [P.], seq 555077:559199, ack 821, win 65535, length 4122
20:05:07.462342 IP 151.101.117.140.443 > 10.0.2.15.53148: Flags [P.], seq 559199:563321, ack 821, win 65535, length 4122
20:05:07.462373 IP 10.0.2.15.53148 > 151.101.117.140.443: Flags [.], ack 555077, win 65535, length 0
20:05:07.462414 IP 10.0.2.15.53148 > 151.101.117.140.443: Flags [.], ack 559199, win 65535, length 0
20:05:07.462424 IP 10.0.2.15.53148 > 151.101.117.140.443: Flags [.], ack 563321, win 65535, length 0
20:05:07.462835 IP 151.101.117.140.443 > 10.0.2.15.53148: Flags [P.], seq 563321:564695, ack 821, win 65535, length 1374
20:05:07.462845 IP 10.0.2.15.53148 > 151.101.117.140.443: Flags [.], ack 564695, win 65535, length 0
20:05:07.465431 IP 151.101.117.140.443 > 10.0.2.15.53148: Flags [P.], seq 564695:575687, ack 821, win 65535, length 10992
20:05:07.465596 IP 10.0.2.15.53148 > 151.101.117.140.443: Flags [.], ack 575687, win 65535, length 0
20:05:07.465660 IP 151.101.117.140.443 > 10.0.2.15.53148: Flags [.], seq 575687:577147, ack 821, win 65535, length 1460
20:05:07.465670 IP 10.0.2.15.53148 > 151.101.117.140.443: Flags [.], ack 577147, win 65535, length 0
20:05:07.465958 IP 151.101.117.140.443 > 10.0.2.15.53148: Flags [P.], seq 577147:583931, ack 821, win 65535, length 6784
20:05:07.465967 IP 10.0.2.15.53148 > 151.101.117.140.443: Flags [.], ack 583931, win 65535, length 0
20:05:07.467184 IP 151.101.117.140.443 > 10.0.2.15.53148: Flags [P.], seq 583931:586679, ack 821, win 65535, length 2748
20:05:07.467209 IP 10.0.2.15.53148 > 151.101.117.140.443: Flags [.], ack 586679, win 65535, length 0
20:05:07.468264 IP 151.101.117.140.443 > 10.0.2.15.53148: Flags [P.], seq 586679:592175, ack 821, win 65535, length 5496
20:05:07.468282 IP 10.0.2.15.53148 > 151.101.117.140.443: Flags [.], ack 592175, win 65535, length 0
20:05:07.470033 IP 151.101.117.140.443 > 10.0.2.15.53148: Flags [P.], seq 592175:593549, ack 821, win 65535, length 1374
20:05:07.470038 IP 151.101.117.140.443 > 10.0.2.15.53148: Flags [P.], seq 593549:601793, ack 821, win 65535, length 8244
20:05:07.470062 IP 10.0.2.15.53148 > 151.101.117.140.443: Flags [.], ack 593549, win 65535, length 0
20:05:07.470188 IP 10.0.2.15.53148 > 151.101.117.140.443: Flags [.], ack 601793, win 65535, length 0
20:05:07.471474 IP 151.101.117.140.443 > 10.0.2.15.53148: Flags [P.], seq 601793:610037, ack 821, win 65535, length 8244
20:05:07.471493 IP 10.0.2.15.53148 > 151.101.117.140.443: Flags [.], ack 610037, win 65535, length 0
20:05:07.472443 IP 151.101.117.140.443 > 10.0.2.15.53148: Flags [P.], seq 610037:618281, ack 821, win 65535, length 8244
20:05:07.472466 IP 10.0.2.15.53148 > 151.101.117.140.443: Flags [.], ack 618281, win 65535, length 0
20:05:07.473490 IP 151.101.117.140.443 > 10.0.2.15.53148: Flags [P.], seq 618281:626525, ack 821, win 65535, length 8244
20:05:07.473509 IP 10.0.2.15.53148 > 151.101.117.140.443: Flags [.], ack 626525, win 65535, length 0
20:05:07.474927 IP 151.101.117.140.443 > 10.0.2.15.53148: Flags [P.], seq 626525:633395, ack 821, win 65535, length 6870
20:05:07.474948 IP 10.0.2.15.53148 > 151.101.117.140.443: Flags [.], ack 633395, win 65535, length 0
20:05:07.475205 IP 151.101.117.140.443 > 10.0.2.15.53148: Flags [P.], seq 633395:640265, ack 821, win 65535, length 6870
20:05:07.475255 IP 10.0.2.15.53148 > 151.101.117.140.443: Flags [.], ack 640265, win 65535, length 0
20:05:07.475388 IP 151.101.117.140.443 > 10.0.2.15.53148: Flags [P.], seq 640265:641639, ack 821, win 65535, length 1374
20:05:07.475397 IP 10.0.2.15.53148 > 151.101.117.140.443: Flags [.], ack 641639, win 65535, length 0
20:05:07.478492 IP 151.101.117.140.443 > 10.0.2.15.53148: Flags [P.], seq 641639:647135, ack 821, win 65535, length 5496
20:05:07.478563 IP 10.0.2.15.53148 > 151.101.117.140.443: Flags [.], ack 647135, win 65535, length 0
20:05:07.479344 IP 151.101.117.140.443 > 10.0.2.15.53148: Flags [P.], seq 647135:655379, ack 821, win 65535, length 8244
20:05:07.479357 IP 10.0.2.15.53148 > 151.101.117.140.443: Flags [.], ack 655379, win 65535, length 0
20:05:07.481502 IP 151.101.117.140.443 > 10.0.2.15.53148: Flags [P.], seq 655379:666371, ack 821, win 65535, length 10992
20:05:07.481560 IP 10.0.2.15.53148 > 151.101.117.140.443: Flags [.], ack 666371, win 65535, length 0
20:05:07.481664 IP 151.101.117.140.443 > 10.0.2.15.53148: Flags [P.], seq 666371:669119, ack 821, win 65535, length 2748
20:05:07.481665 IP 151.101.117.140.443 > 10.0.2.15.53148: Flags [P.], seq 669119:671867, ack 821, win 65535, length 2748
20:05:07.481674 IP 10.0.2.15.53148 > 151.101.117.140.443: Flags [.], ack 669119, win 65535, length 0
20:05:07.481713 IP 10.0.2.15.53148 > 151.101.117.140.443: Flags [.], ack 671867, win 65535, length 0
20:05:07.483754 IP 151.101.117.140.443 > 10.0.2.15.53148: Flags [P.], seq 671867:673241, ack 821, win 65535, length 1374
20:05:07.483773 IP 10.0.2.15.53148 > 151.101.117.140.443: Flags [.], ack 673241, win 65535, length 0
20:05:07.484433 IP 151.101.117.140.443 > 10.0.2.15.53148: Flags [P.], seq 673241:678737, ack 821, win 65535, length 5496

