13:05:35.800135 IP 151.101.117.140.443 > 10.0.2.15.43232: Flags [S.], seq 24896001, ack 125928155, win 65535, options [mss 1460], length 0
13:05:35.800175 IP 10.0.2.15.43232 > 151.101.117.140.443: Flags [.], ack 1, win 64240, length 0
13:05:35.808359 IP 10.0.2.15.43232 > 151.101.117.140.443: Flags [P.], seq 1:518, ack 1, win 64240, length 517
13:05:35.808939 IP 151.101.117.140.443 > 10.0.2.15.43232: Flags [.], ack 518, win 65535, length 0
13:05:35.830768 IP 151.101.117.140.443 > 10.0.2.15.43232: Flags [P.], seq 1:2749, ack 518, win 65535, length 2748
13:05:35.830786 IP 10.0.2.15.43232 > 151.101.117.140.443: Flags [.], ack 2749, win 62780, length 0
13:05:35.832885 IP 151.101.117.140.443 > 10.0.2.15.43232: Flags [P.], seq 2749:3722, ack 518, win 65535, length 973
13:05:35.832904 IP 10.0.2.15.43232 > 151.101.117.140.443: Flags [.], ack 3722, win 62780, length 0
13:05:35.834113 IP 10.0.2.15.43232 > 151.101.117.140.443: Flags [P.], seq 518:598, ack 3722, win 62780, length 80
13:05:35.834382 IP 10.0.2.15.43232 > 151.101.117.140.443: Flags [P.], seq 598:644, ack 3722, win 62780, length 46
13:05:35.834415 IP 10.0.2.15.43232 > 151.101.117.140.443: Flags [P.], seq 644:693, ack 3722, win 62780, length 49
13:05:35.834539 IP 10.0.2.15.43232 > 151.101.117.140.443: Flags [P.], seq 693:728, ack 3722, win 62780, length 35
13:05:35.834584 IP 151.101.117.140.443 > 10.0.2.15.43232: Flags [.], ack 598, win 65535, length 0
13:05:35.834691 IP 151.101.117.140.443 > 10.0.2.15.43232: Flags [.], ack 644, win 65535, length 0
13:05:35.834692 IP 151.101.117.140.443 > 10.0.2.15.43232: Flags [.], ack 693, win 65535, length 0
13:05:35.834692 IP 151.101.117.140.443 > 10.0.2.15.43232: Flags [.], ack 728, win 65535, length 0
13:05:35.834728 IP 10.0.2.15.43232 > 151.101.117.140.443: Flags [P.], seq 728:790, ack 3722, win 62780, length 62
13:05:35.835259 IP 151.101.117.140.443 > 10.0.2.15.43232: Flags [.], ack 790, win 65535, length 0
13:05:35.848869 IP 151.101.117.140.443 > 10.0.2.15.43232: Flags [P.], seq 3722:3803, ack 790, win 65535, length 81
13:05:35.848887 IP 10.0.2.15.43232 > 151.101.117.140.443: Flags [.], ack 3803, win 62780, length 0
13:05:35.849113 IP 10.0.2.15.43232 > 151.101.117.140.443: Flags [P.], seq 790:821, ack 3803, win 62780, length 31
13:05:35.849627 IP 151.101.117.140.443 > 10.0.2.15.43232: Flags [.], ack 821, win 65535, length 0
13:05:36.138058 IP 151.101.117.140.443 > 10.0.2.15.43232: Flags [.], seq 3803:11103, ack 821, win 65535, length 7300
13:05:36.138187 IP 10.0.2.15.43232 > 151.101.117.140.443: Flags [.], ack 11103, win 59860, length 0
13:05:36.138522 IP 151.101.117.140.443 > 10.0.2.15.43232: Flags [.], seq 11103:19863, ack 821, win 65535, length 8760
13:05:36.138540 IP 10.0.2.15.43232 > 151.101.117.140.443: Flags [.], ack 19863, win 54020, length 0
13:05:36.139029 IP 151.101.117.140.443 > 10.0.2.15.43232: Flags [.], seq 19863:30083, ack 821, win 65535, length 10220
13:05:36.139046 IP 10.0.2.15.43232 > 151.101.117.140.443: Flags [.], ack 30083, win 46720, length 0
13:05:36.139422 IP 151.101.117.140.443 > 10.0.2.15.43232: Flags [.], seq 30083:41763, ack 821, win 65535, length 11680
13:05:36.139436 IP 10.0.2.15.43232 > 151.101.117.140.443: Flags [.], ack 41763, win 39420, length 0
13:05:36.139786 IP 151.101.117.140.443 > 10.0.2.15.43232: Flags [P.], seq 41763:45023, ack 821, win 65535, length 3260
13:05:36.139794 IP 10.0.2.15.43232 > 151.101.117.140.443: Flags [.], ack 45023, win 61320, length 0
13:05:36.152907 IP 151.101.117.140.443 > 10.0.2.15.43232: Flags [P.], seq 45023:49145, ack 821, win 65535, length 4122
13:05:36.152939 IP 10.0.2.15.43232 > 151.101.117.140.443: Flags [.], ack 49145, win 61320, length 0
13:05:36.153959 IP 151.101.117.140.443 > 10.0.2.15.43232: Flags [P.], seq 49145:54641, ack 821, win 65535, length 5496
13:05:36.153980 IP 10.0.2.15.43232 > 151.101.117.140.443: Flags [.], ack 54641, win 61320, length 0
13:05:36.155563 IP 151.101.117.140.443 > 10.0.2.15.43232: Flags [P.], seq 54641:58763, ack 821, win 65535, length 4122
13:05:36.155580 IP 10.0.2.15.43232 > 151.101.117.140.443: Flags [.], ack 58763, win 61320, length 0
13:05:36.155750 IP 151.101.117.140.443 > 10.0.2.15.43232: Flags [P.], seq 58763:60137, ack 821, win 65535, length 1374
13:05:36.155758 IP 10.0.2.15.43232 > 151.101.117.140.443: Flags [.], ack 60137, win 61320, length 0
13:05:36.157034 IP 151.101.117.140.443 > 10.0.2.15.43232: Flags [P.], seq 60137:62885, ack 821, win 65535, length 2748
13:05:36.157047 IP 10.0.2.15.43232 > 151.101.117.140.443: Flags [.], ack 62885, win 62780, length 0
13:05:36.157774 IP 151.101.117.140.443 > 10.0.2.15.43232: Flags [P.], seq 62885:65633, ack 821, win 65535, length 2748
13:05:36.157786 IP 10.0.2.15.43232 > 151.101.117.140.443: Flags [.], ack 65633, win 62780, length 0
13:05:36.159439 IP 151.101.117.140.443 > 10.0.2.15.43232: Flags [P.], seq 65633:68381, ack 821, win 65535, length 2748
13:05:36.159464 IP 10.0.2.15.43232 > 151.101.117.140.443: Flags [.], ack 68381, win 62780, length 0
13:05:36.161422 IP 151.101.117.140.443 > 10.0.2.15.43232: Flags [P.], seq 68381:72503, ack 821, win 65535, length 4122
13:05:36.161443 IP 10.0.2.15.43232 > 151.101.117.140.443: Flags [.], ack 72503, win 65535, length 0
13:05:36.162331 IP 151.101.117.140.443 > 10.0.2.15.43232: Flags [P.], seq 72503:73877, ack 821, win 65535, length 1374
13:05:36.162343 IP 10.0.2.15.43232 > 151.101.117.140.443: Flags [.], ack 73877, win 65535, length 0
13:05:36.163530 IP 151.101.117.140.443 > 10.0.2.15.43232: Flags [P.], seq 73877:76625, ack 821, win 65535, length 2748
13:05:36.163546 IP 10.0.2.15.43232 > 151.101.117.140.443: Flags [.], ack 76625, win 65535, length 0
13:05:36.164491 IP 151.101.117.140.443 > 10.0.2.15.43232: Flags [P.], seq 76625:80747, ack 821, win 65535, length 4122
13:05:36.164505 IP 10.0.2.15.43232 > 151.101.117.140.443: Flags [.], ack 80747, win 65535, length 0
13:05:36.165316 IP 151.101.117.140.443 > 10.0.2.15.43232: Flags [P.], seq 80747:82121, ack 821, win 65535, length 1374
13:05:36.165332 IP 10.0.2.15.43232 > 151.101.117.140.443: Flags [.], ack 82121, win 65535, length 0
13:05:36.166499 IP 151.101.117.140.443 > 10.0.2.15.43232: Flags [P.], seq 82121:86243, ack 821, win 65535, length 4122
13:05:36.166521 IP 10.0.2.15.43232 > 151.101.117.140.443: Flags [.], ack 86243, win 65535, length 0
13:05:36.167609 IP 151.101.117.140.443 > 10.0.2.15.43232: Flags [P.], seq 86243:87617, ack 821, win 65535, length 1374
13:05:36.167624 IP 10.0.2.15.43232 > 151.101.117.140.443: Flags [.], ack 87617, win 65535, length 0
13:05:36.168688 IP 151.101.117.140.443 > 10.0.2.15.43232: Flags [P.], seq 87617:90365, ack 821, win 65535, length 2748
13:05:36.168700 IP 10.0.2.15.43232 > 151.101.117.140.443: Flags [.], ack 90365, win 65535, length 0
13:05:36.169636 IP 151.101.117.140.443 > 10.0.2.15.43232: Flags [P.], seq 90365:93113, ack 821, win 65535, length 2748
13:05:36.169649 IP 10.0.2.15.43232 > 151.101.117.140.443: Flags [.], ack 93113, win 65535, length 0
13:05:36.170750 IP 151.101.117.140.443 > 10.0.2.15.43232: Flags [P.], seq 93113:95861, ack 821, win 65535, length 2748
13:05:36.170764 IP 10.0.2.15.43232 > 151.101.117.140.443: Flags [.], ack 95861, win 65535, length 0
13:05:36.171852 IP 151.101.117.140.443 > 10.0.2.15.43232: Flags [P.], seq 95861:98609, ack 821, win 65535, length 2748
13:05:36.171867 IP 10.0.2.15.43232 > 151.101.117.140.443: Flags [.], ack 98609, win 65535, length 0
13:05:36.172915 IP 151.101.117.140.443 > 10.0.2.15.43232: Flags [P.], seq 98609:101357, ack 821, win 65535, length 2748
13:05:36.172927 IP 10.0.2.15.43232 > 151.101.117.140.443: Flags [.], ack 101357, win 65535, length 0
13:05:36.174049 IP 151.101.117.140.443 > 10.0.2.15.43232: Flags [P.], seq 101357:106853, ack 821, win 65535, length 5496
13:05:36.174064 IP 10.0.2.15.43232 > 151.101.117.140.443: Flags [.], ack 106853, win 65535, length 0
13:05:36.175050 IP 151.101.117.140.443 > 10.0.2.15.43232: Flags [P.], seq 106853:110975, ack 821, win 65535, length 4122
13:05:36.175066 IP 10.0.2.15.43232 > 151.101.117.140.443: Flags [.], ack 110975, win 65535, length 0
13:05:36.176142 IP 151.101.117.140.443 > 10.0.2.15.43232: Flags [P.], seq 110975:115097, ack 821, win 65535, length 4122
13:05:36.176162 IP 10.0.2.15.43232 > 151.101.117.140.443: Flags [.], ack 115097, win 65535, length 0
13:05:36.177457 IP 151.101.117.140.443 > 10.0.2.15.43232: Flags [P.], seq 115097:119219, ack 821, win 65535, length 4122
13:05:36.177478 IP 10.0.2.15.43232 > 151.101.117.140.443: Flags [.], ack 119219, win 65535, length 0
13:05:36.178496 IP 151.101.117.140.443 > 10.0.2.15.43232: Flags [P.], seq 119219:124715, ack 821, win 65535, length 5496
13:05:36.178516 IP 10.0.2.15.43232 > 151.101.117.140.443: Flags [.], ack 124715, win 65535, length 0
13:05:36.179510 IP 151.101.117.140.443 > 10.0.2.15.43232: Flags [P.], seq 124715:128837, ack 821, win 65535, length 4122
13:05:36.179531 IP 10.0.2.15.43232 > 151.101.117.140.443: Flags [.], ack 128837, win 65535, length 0
13:05:36.180822 IP 151.101.117.140.443 > 10.0.2.15.43232: Flags [P.], seq 128837:132959, ack 821, win 65535, length 4122
13:05:36.180896 IP 10.0.2.15.43232 > 151.101.117.140.443: Flags [.], ack 132959, win 65535, length 0
13:05:36.181952 IP 151.101.117.140.443 > 10.0.2.15.43232: Flags [P.], seq 132959:141203, ack 821, win 65535, length 8244
13:05:36.181966 IP 10.0.2.15.43232 > 151.101.117.140.443: Flags [.], ack 141203, win 65535, length 0
13:05:36.184505 IP 151.101.117.140.443 > 10.0.2.15.43232: Flags [P.], seq 141203:150821, ack 821, win 65535, length 9618
13:05:36.184525 IP 10.0.2.15.43232 > 151.101.117.140.443: Flags [.], ack 150821, win 65535, length 0
13:05:36.185312 IP 151.101.117.140.443 > 10.0.2.15.43232: Flags [P.], seq 150821:153569, ack 821, win 65535, length 2748
13:05:36.185325 IP 10.0.2.15.43232 > 151.101.117.140.443: Flags [.], ack 153569, win 65535, length 0
13:05:36.187637 IP 151.101.117.140.443 > 10.0.2.15.43232: Flags [P.], seq 153569:161813, ack 821, win 65535, length 8244
13:05:36.187662 IP 10.0.2.15.43232 > 151.101.117.140.443: Flags [.], ack 161813, win 65535, length 0
13:05:36.188124 IP 151.101.117.140.443 > 10.0.2.15.43232: Flags [P.], seq 161813:165935, ack 821, win 65535, length 4122
13:05:36.188137 IP 10.0.2.15.43232 > 151.101.117.140.443: Flags [.], ack 165935, win 65535, length 0
13:05:36.189653 IP 151.101.117.140.443 > 10.0.2.15.43232: Flags [P.], seq 165935:174179, ack 821, win 65535, length 8244
13:05:36.189669 IP 10.0.2.15.43232 > 151.101.117.140.443: Flags [.], ack 174179, win 65535, length 0
13:05:36.189819 IP 151.101.117.140.443 > 10.0.2.15.43232: Flags [P.], seq 174179:178301, ack 821, win 65535, length 4122
13:05:36.189827 IP 10.0.2.15.43232 > 151.101.117.140.443: Flags [.], ack 178301, win 65535, length 0
13:05:36.190784 IP 151.101.117.140.443 > 10.0.2.15.43232: Flags [P.], seq 178301:183797, ack 821, win 65535, length 5496
13:05:36.190799 IP 10.0.2.15.43232 > 151.101.117.140.443: Flags [.], ack 183797, win 65535, length 0
13:05:36.191032 IP 151.101.117.140.443 > 10.0.2.15.43232: Flags [P.], seq 183797:185171, ack 821, win 65535, length 1374
13:05:36.191040 IP 10.0.2.15.43232 > 151.101.117.140.443: Flags [.], ack 185171, win 65535, length 0
13:05:36.191910 IP 151.101.117.140.443 > 10.0.2.15.43232: Flags [P.], seq 185171:192041, ack 821, win 65535, length 6870
13:05:36.191927 IP 10.0.2.15.43232 > 151.101.117.140.443: Flags [.], ack 192041, win 65535, length 0
13:05:36.192930 IP 151.101.117.140.443 > 10.0.2.15.43232: Flags [P.], seq 192041:196163, ack 821, win 65535, length 4122
13:05:36.192947 IP 10.0.2.15.43232 > 151.101.117.140.443: Flags [.], ack 196163, win 65535, length 0
13:05:36.194067 IP 151.101.117.140.443 > 10.0.2.15.43232: Flags [P.], seq 196163:197788, ack 821, win 65535, length 1625
13:05:36.194080 IP 10.0.2.15.43232 > 151.101.117.140.443: Flags [.], ack 197788, win 65535, length 0
13:05:36.954986 IP 151.101.117.140.443 > 10.0.2.15.43232: Flags [P.], seq 197788:208212, ack 821, win 65535, length 10424
13:05:36.955010 IP 10.0.2.15.43232 > 151.101.117.140.443: Flags [.], ack 208212, win 65535, length 0
13:05:36.955397 IP 151.101.117.140.443 > 10.0.2.15.43232: Flags [P.], seq 208212:216456, ack 821, win 65535, length 8244
13:05:36.955417 IP 10.0.2.15.43232 > 151.101.117.140.443: Flags [.], ack 216456, win 65535, length 0
13:05:36.956060 IP 151.101.117.140.443 > 10.0.2.15.43232: Flags [P.], seq 216456:227448, ack 821, win 65535, length 10992
13:05:36.956080 IP 10.0.2.15.43232 > 151.101.117.140.443: Flags [.], ack 227448, win 65535, length 0
13:05:36.956177 IP 151.101.117.140.443 > 10.0.2.15.43232: Flags [P.], seq 227448:239814, ack 821, win 65535, length 12366
13:05:36.956224 IP 10.0.2.15.43232 > 151.101.117.140.443: Flags [.], ack 239814, win 65535, length 0
13:05:36.956416 IP 151.101.117.140.443 > 10.0.2.15.43232: Flags [P.], seq 239814:241188, ack 821, win 65535, length 1374
13:05:36.956425 IP 10.0.2.15.43232 > 151.101.117.140.443: Flags [.], ack 241188, win 65535, length 0
13:05:36.957417 IP 151.101.117.140.443 > 10.0.2.15.43232: Flags [P.], seq 241188:252180, ack 821, win 65535, length 10992
13:05:36.957435 IP 10.0.2.15.43232 > 151.101.117.140.443: Flags [.], ack 252180, win 65535, length 0
13:05:36.957698 IP 151.101.117.140.443 > 10.0.2.15.43232: Flags [P.], seq 252180:261798, ack 821, win 65535, length 9618
13:05:36.957711 IP 10.0.2.15.43232 > 151.101.117.140.443: Flags [.], ack 261798, win 65535, length 0
13:05:36.958011 IP 151.101.117.140.443 > 10.0.2.15.43232: Flags [P.], seq 261798:267294, ack 821, win 65535, length 5496
13:05:36.958022 IP 10.0.2.15.43232 > 151.101.117.140.443: Flags [.], ack 267294, win 65535, length 0
13:05:36.958329 IP 151.101.117.140.443 > 10.0.2.15.43232: Flags [P.], seq 267294:274164, ack 821, win 65535, length 6870
13:05:36.958343 IP 10.0.2.15.43232 > 151.101.117.140.443: Flags [.], ack 274164, win 65535, length 0
13:05:36.969797 IP 151.101.117.140.443 > 10.0.2.15.43232: Flags [P.], seq 274164:281034, ack 821, win 65535, length 6870
13:05:36.969821 IP 10.0.2.15.43232 > 151.101.117.140.443: Flags [.], ack 281034, win 65535, length 0
13:05:36.971954 IP 151.101.117.140.443 > 10.0.2.15.43232: Flags [P.], seq 281034:289278, ack 821, win 65535, length 8244
13:05:36.971976 IP 10.0.2.15.43232 > 151.101.117.140.443: Flags [.], ack 289278, win 65535, length 0
13:05:36.972898 IP 151.101.117.140.443 > 10.0.2.15.43232: Flags [P.], seq 289278:293400, ack 821, win 65535, length 4122
13:05:36.972919 IP 10.0.2.15.43232 > 151.101.117.140.443: Flags [.], ack 293400, win 65535, length 0
13:05:36.974110 IP 151.101.117.140.443 > 10.0.2.15.43232: Flags [P.], seq 293400:296148, ack 821, win 65535, length 2748
13:05:36.974133 IP 10.0.2.15.43232 > 151.101.117.140.443: Flags [.], ack 296148, win 65535, length 0
13:05:36.975069 IP 151.101.117.140.443 > 10.0.2.15.43232: Flags [P.], seq 296148:301644, ack 821, win 65535, length 5496
13:05:36.975089 IP 10.0.2.15.43232 > 151.101.117.140.443: Flags [.], ack 301644, win 65535, length 0
13:05:36.976112 IP 151.101.117.140.443 > 10.0.2.15.43232: Flags [P.], seq 301644:307140, ack 821, win 65535, length 5496
13:05:36.976131 IP 10.0.2.15.43232 > 151.101.117.140.443: Flags [.], ack 307140, win 65535, length 0
13:05:36.977155 IP 151.101.117.140.443 > 10.0.2.15.43232: Flags [P.], seq 307140:309888, ack 821, win 65535, length 2748
13:05:36.977180 IP 10.0.2.15.43232 > 151.101.117.140.443: Flags [.], ack 309888, win 65535, length 0
13:05:36.978147 IP 151.101.117.140.443 > 10.0.2.15.43232: Flags [P.], seq 309888:315384, ack 821, win 65535, length 5496
13:05:36.978161 IP 10.0.2.15.43232 > 151.101.117.140.443: Flags [.], ack 315384, win 65535, length 0
13:05:36.979306 IP 151.101.117.140.443 > 10.0.2.15.43232: Flags [P.], seq 315384:319506, ack 821, win 65535, length 4122
13:05:36.979319 IP 10.0.2.15.43232 > 151.101.117.140.443: Flags [.], ack 319506, win 65535, length 0
13:05:36.980329 IP 151.101.117.140.443 > 10.0.2.15.43232: Flags [P.], seq 319506:323628, ack 821, win 65535, length 4122
13:05:36.980344 IP 10.0.2.15.43232 > 151.101.117.140.443: Flags [.], ack 323628, win 65535, length 0
13:05:36.981512 IP 151.101.117.140.443 > 10.0.2.15.43232: Flags [P.], seq 323628:327750, ack 821, win 65535, length 4122
13:05:36.981529 IP 10.0.2.15.43232 > 151.101.117.140.443: Flags [.], ack 327750, win 65535, length 0
13:05:36.982420 IP 151.101.117.140.443 > 10.0.2.15.43232: Flags [P.], seq 327750:331872, ack 821, win 65535, length 4122
13:05:36.982434 IP 10.0.2.15.43232 > 151.101.117.140.443: Flags [.], ack 331872, win 65535, length 0
13:05:36.983498 IP 151.101.117.140.443 > 10.0.2.15.43232: Flags [P.], seq 331872:337368, ack 821, win 65535, length 5496
13:05:36.983511 IP 10.0.2.15.43232 > 151.101.117.140.443: Flags [.], ack 337368, win 65535, length 0
13:05:36.984549 IP 151.101.117.140.443 > 10.0.2.15.43232: Flags [P.], seq 337368:340116, ack 821, win 65535, length 2748
13:05:36.984564 IP 10.0.2.15.43232 > 151.101.117.140.443: Flags [.], ack 340116, win 65535, length 0
13:05:36.986133 IP 151.101.117.140.443 > 10.0.2.15.43232: Flags [P.], seq 340116:345612, ack 821, win 65535, length 5496
13:05:36.986150 IP 10.0.2.15.43232 > 151.101.117.140.443: Flags [.], ack 345612, win 65535, length 0
13:05:36.986899 IP 151.101.117.140.443 > 10.0.2.15.43232: Flags [P.], seq 345612:348360, ack 821, win 65535, length 2748
13:05:36.986913 IP 10.0.2.15.43232 > 151.101.117.140.443: Flags [.], ack 348360, win 65535, length 0
13:05:36.987824 IP 151.101.117.140.443 > 10.0.2.15.43232: Flags [P.], seq 348360:355230, ack 821, win 65535, length 6870
13:05:36.987840 IP 10.0.2.15.43232 > 151.101.117.140.443: Flags [.], ack 355230, win 65535, length 0
13:05:36.988812 IP 151.101.117.140.443 > 10.0.2.15.43232: Flags [P.], seq 355230:360726, ack 821, win 65535, length 5496
13:05:36.988827 IP 10.0.2.15.43232 > 151.101.117.140.443: Flags [.], ack 360726, win 65535, length 0
13:05:36.989029 IP 151.101.117.140.443 > 10.0.2.15.43232: Flags [P.], seq 360726:362100, ack 821, win 65535, length 1374
13:05:36.989037 IP 10.0.2.15.43232 > 151.101.117.140.443: Flags [.], ack 362100, win 65535, length 0
13:05:36.990108 IP 151.101.117.140.443 > 10.0.2.15.43232: Flags [P.], seq 362100:364848, ack 821, win 65535, length 2748
13:05:36.990121 IP 10.0.2.15.43232 > 151.101.117.140.443: Flags [.], ack 364848, win 65535, length 0
13:05:36.991068 IP 151.101.117.140.443 > 10.0.2.15.43232: Flags [P.], seq 364848:370344, ack 821, win 65535, length 5496
13:05:36.991083 IP 10.0.2.15.43232 > 151.101.117.140.443: Flags [.], ack 370344, win 65535, length 0
13:05:36.992356 IP 151.101.117.140.443 > 10.0.2.15.43232: Flags [P.], seq 370344:377214, ack 821, win 65535, length 6870
13:05:36.992372 IP 10.0.2.15.43232 > 151.101.117.140.443: Flags [.], ack 377214, win 65535, length 0
13:05:36.993545 IP 151.101.117.140.443 > 10.0.2.15.43232: Flags [P.], seq 377214:385458, ack 821, win 65535, length 8244
13:05:36.993547 IP 151.101.117.140.443 > 10.0.2.15.43232: Flags [P.], seq 385458:386832, ack 821, win 65535, length 1374
13:05:36.993565 IP 10.0.2.15.43232 > 151.101.117.140.443: Flags [.], ack 385458, win 65535, length 0
13:05:36.993598 IP 10.0.2.15.43232 > 151.101.117.140.443: Flags [.], ack 386832, win 65535, length 0
13:05:36.994538 IP 151.101.117.140.443 > 10.0.2.15.43232: Flags [P.], seq 386832:392328, ack 821, win 65535, length 5496
13:05:36.994551 IP 10.0.2.15.43232 > 151.101.117.140.443: Flags [.], ack 392328, win 65535, length 0
13:05:36.995922 IP 151.101.117.140.443 > 10.0.2.15.43232: Flags [P.], seq 392328:397824, ack 821, win 65535, length 5496
13:05:36.995937 IP 10.0.2.15.43232 > 151.101.117.140.443: Flags [.], ack 397824, win 65535, length 0
13:05:36.997079 IP 151.101.117.140.443 > 10.0.2.15.43232: Flags [P.], seq 397824:404694, ack 821, win 65535, length 6870
13:05:36.997143 IP 10.0.2.15.43232 > 151.101.117.140.443: Flags [.], ack 404694, win 65535, length 0
13:05:36.997267 IP 151.101.117.140.443 > 10.0.2.15.43232: Flags [P.], seq 404694:407442, ack 821, win 65535, length 2748
13:05:36.997275 IP 10.0.2.15.43232 > 151.101.117.140.443: Flags [.], ack 407442, win 65535, length 0
13:05:36.998219 IP 151.101.117.140.443 > 10.0.2.15.43232: Flags [P.], seq 407442:412938, ack 821, win 65535, length 5496
13:05:36.998232 IP 10.0.2.15.43232 > 151.101.117.140.443: Flags [.], ack 412938, win 65535, length 0
13:05:36.999268 IP 151.101.117.140.443 > 10.0.2.15.43232: Flags [P.], seq 412938:418434, ack 821, win 65535, length 5496
13:05:36.999281 IP 10.0.2.15.43232 > 151.101.117.140.443: Flags [.], ack 418434, win 65535, length 0
13:05:37.000351 IP 151.101.117.140.443 > 10.0.2.15.43232: Flags [P.], seq 418434:425304, ack 821, win 65535, length 6870
13:05:37.000368 IP 10.0.2.15.43232 > 151.101.117.140.443: Flags [.], ack 425304, win 65535, length 0
13:05:37.000610 IP 151.101.117.140.443 > 10.0.2.15.43232: Flags [P.], seq 425304:429426, ack 821, win 65535, length 4122
13:05:37.000623 IP 10.0.2.15.43232 > 151.101.117.140.443: Flags [.], ack 429426, win 65535, length 0
13:05:37.001681 IP 151.101.117.140.443 > 10.0.2.15.43232: Flags [P.], seq 429426:434922, ack 821, win 65535, length 5496
13:05:37.001696 IP 10.0.2.15.43232 > 151.101.117.140.443: Flags [.], ack 434922, win 65535, length 0
13:05:37.002463 IP 151.101.117.140.443 > 10.0.2.15.43232: Flags [P.], seq 434922:440418, ack 821, win 65535, length 5496
13:05:37.002477 IP 10.0.2.15.43232 > 151.101.117.140.443: Flags [.], ack 440418, win 65535, length 0
13:05:37.002623 IP 151.101.117.140.443 > 10.0.2.15.43232: Flags [P.], seq 440418:441792, ack 821, win 65535, length 1374
13:05:37.002631 IP 10.0.2.15.43232 > 151.101.117.140.443: Flags [.], ack 441792, win 65535, length 0
13:05:37.003445 IP 151.101.117.140.443 > 10.0.2.15.43232: Flags [P.], seq 441792:445914, ack 821, win 65535, length 4122
13:05:37.003457 IP 10.0.2.15.43232 > 151.101.117.140.443: Flags [.], ack 445914, win 65535, length 0
13:05:37.004678 IP 151.101.117.140.443 > 10.0.2.15.43232: Flags [P.], seq 445914:447288, ack 821, win 65535, length 1374
13:05:37.004695 IP 10.0.2.15.43232 > 151.101.117.140.443: Flags [.], ack 447288, win 65535, length 0
13:05:37.005818 IP 151.101.117.140.443 > 10.0.2.15.43232: Flags [P.], seq 447288:459654, ack 821, win 65535, length 12366
13:05:37.005834 IP 10.0.2.15.43232 > 151.101.117.140.443: Flags [.], ack 459654, win 65535, length 0
13:05:37.006725 IP 151.101.117.140.443 > 10.0.2.15.43232: Flags [P.], seq 459654:466524, ack 821, win 65535, length 6870
13:05:37.006739 IP 10.0.2.15.43232 > 151.101.117.140.443: Flags [.], ack 466524, win 65535, length 0
13:05:37.006903 IP 151.101.117.140.443 > 10.0.2.15.43232: Flags [P.], seq 466524:467898, ack 821, win 65535, length 1374
13:05:37.006911 IP 10.0.2.15.43232 > 151.101.117.140.443: Flags [.], ack 467898, win 65535, length 0
13:05:37.008069 IP 151.101.117.140.443 > 10.0.2.15.43232: Flags [P.], seq 467898:473394, ack 821, win 65535, length 5496
13:05:37.008084 IP 10.0.2.15.43232 > 151.101.117.140.443: Flags [.], ack 473394, win 65535, length 0
13:05:37.010562 IP 151.101.117.140.443 > 10.0.2.15.43232: Flags [P.], seq 473394:481638, ack 821, win 65535, length 8244
13:05:37.010564 IP 151.101.117.140.443 > 10.0.2.15.43232: Flags [P.], seq 481638:487134, ack 821, win 65535, length 5496
13:05:37.010587 IP 10.0.2.15.43232 > 151.101.117.140.443: Flags [.], ack 481638, win 65535, length 0
13:05:37.010619 IP 10.0.2.15.43232 > 151.101.117.140.443: Flags [.], ack 487134, win 65535, length 0
13:05:37.012043 IP 151.101.117.140.443 > 10.0.2.15.43232: Flags [P.], seq 487134:491256, ack 821, win 65535, length 4122
13:05:37.012066 IP 10.0.2.15.43232 > 151.101.117.140.443: Flags [.], ack 491256, win 65535, length 0
13:05:37.012334 IP 151.101.117.140.443 > 10.0.2.15.43232: Flags [P.], seq 491256:499500, ack 821, win 65535, length 8244
13:05:37.012348 IP 10.0.2.15.43232 > 151.101.117.140.443: Flags [.], ack 499500, win 65535, length 0
13:05:37.013454 IP 151.101.117.140.443 > 10.0.2.15.43232: Flags [P.], seq 499500:506370, ack 821, win 65535, length 6870
13:05:37.013469 IP 10.0.2.15.43232 > 151.101.117.140.443: Flags [.], ack 506370, win 65535, length 0
13:05:37.014387 IP 151.101.117.140.443 > 10.0.2.15.43232: Flags [P.], seq 506370:511866, ack 821, win 65535, length 5496
13:05:37.014400 IP 10.0.2.15.43232 > 151.101.117.140.443: Flags [.], ack 511866, win 65535, length 0
13:05:37.015479 IP 151.101.117.140.443 > 10.0.2.15.43232: Flags [P.], seq 511866:517362, ack 821, win 65535, length 5496
13:05:37.015493 IP 10.0.2.15.43232 > 151.101.117.140.443: Flags [.], ack 517362, win 65535, length 0
13:05:37.016771 IP 151.101.117.140.443 > 10.0.2.15.43232: Flags [P.], seq 517362:531102, ack 821, win 65535, length 13740
13:05:37.016788 IP 10.0.2.15.43232 > 151.101.117.140.443: Flags [.], ack 531102, win 65535, length 0
13:05:37.018373 IP 151.101.117.140.443 > 10.0.2.15.43232: Flags [P.], seq 531102:535224, ack 821, win 65535, length 4122
13:05:37.018388 IP 10.0.2.15.43232 > 151.101.117.140.443: Flags [.], ack 535224, win 65535, length 0
13:05:37.018538 IP 151.101.117.140.443 > 10.0.2.15.43232: Flags [P.], seq 535224:537972, ack 821, win 65535, length 2748
13:05:37.018612 IP 10.0.2.15.43232 > 151.101.117.140.443: Flags [.], ack 537972, win 65535, length 0
13:05:37.019663 IP 151.101.117.140.443 > 10.0.2.15.43232: Flags [P.], seq 537972:543468, ack 821, win 65535, length 5496
13:05:37.019678 IP 10.0.2.15.43232 > 151.101.117.140.443: Flags [.], ack 543468, win 65535, length 0
13:05:37.019971 IP 151.101.117.140.443 > 10.0.2.15.43232: Flags [P.], seq 543468:544842, ack 821, win 65535, length 1374
13:05:37.019982 IP 10.0.2.15.43232 > 151.101.117.140.443: Flags [.], ack 544842, win 65535, length 0
13:05:37.020708 IP 151.101.117.140.443 > 10.0.2.15.43232: Flags [P.], seq 544842:553086, ack 821, win 65535, length 8244
13:05:37.020723 IP 10.0.2.15.43232 > 151.101.117.140.443: Flags [.], ack 553086, win 65535, length 0
13:05:37.021688 IP 151.101.117.140.443 > 10.0.2.15.43232: Flags [P.], seq 553086:555834, ack 821, win 65535, length 2748
13:05:37.021701 IP 10.0.2.15.43232 > 151.101.117.140.443: Flags [.], ack 555834, win 65535, length 0
13:05:37.022765 IP 151.101.117.140.443 > 10.0.2.15.43232: Flags [P.], seq 555834:559956, ack 821, win 65535, length 4122
13:05:37.022779 IP 10.0.2.15.43232 > 151.101.117.140.443: Flags [.], ack 559956, win 65535, length 0
13:05:37.023081 IP 151.101.117.140.443 > 10.0.2.15.43232: Flags [P.], seq 559956:565452, ack 821, win 65535, length 5496
13:05:37.023094 IP 10.0.2.15.43232 > 151.101.117.140.443: Flags [.], ack 565452, win 65535, length 0
13:05:37.024011 IP 151.101.117.140.443 > 10.0.2.15.43232: Flags [P.], seq 565452:569574, ack 821, win 65535, length 4122
13:05:37.024073 IP 10.0.2.15.43232 > 151.101.117.140.443: Flags [.], ack 569574, win 65535, length 0
13:05:37.024394 IP 151.101.117.140.443 > 10.0.2.15.43232: Flags [P.], seq 569574:573696, ack 821, win 65535, length 4122
13:05:37.024405 IP 10.0.2.15.43232 > 151.101.117.140.443: Flags [.], ack 573696, win 65535, length 0
13:05:37.025193 IP 151.101.117.140.443 > 10.0.2.15.43232: Flags [P.], seq 573696:581940, ack 821, win 65535, length 8244
13:05:37.025208 IP 10.0.2.15.43232 > 151.101.117.140.443: Flags [.], ack 581940, win 65535, length 0
13:05:37.026290 IP 151.101.117.140.443 > 10.0.2.15.43232: Flags [P.], seq 581940:584688, ack 821, win 65535, length 2748
13:05:37.026305 IP 10.0.2.15.43232 > 151.101.117.140.443: Flags [.], ack 584688, win 65535, length 0
13:05:37.027484 IP 151.101.117.140.443 > 10.0.2.15.43232: Flags [P.], seq 584688:602550, ack 821, win 65535, length 17862
13:05:37.027501 IP 10.0.2.15.43232 > 151.101.117.140.443: Flags [.], ack 602550, win 65535, length 0
13:05:37.028590 IP 151.101.117.140.443 > 10.0.2.15.43232: Flags [P.], seq 602550:606672, ack 821, win 65535, length 4122
13:05:37.028604 IP 10.0.2.15.43232 > 151.101.117.140.443: Flags [.], ack 606672, win 65535, length 0
13:05:37.028819 IP 151.101.117.140.443 > 10.0.2.15.43232: Flags [P.], seq 606672:609420, ack 821, win 65535, length 2748
13:05:37.028829 IP 10.0.2.15.43232 > 151.101.117.140.443: Flags [.], ack 609420, win 65535, length 0
13:05:37.029556 IP 151.101.117.140.443 > 10.0.2.15.43232: Flags [P.], seq 609420:616290, ack 821, win 65535, length 6870
13:05:37.029571 IP 10.0.2.15.43232 > 151.101.117.140.443: Flags [.], ack 616290, win 65535, length 0
13:05:37.030458 IP 151.101.117.140.443 > 10.0.2.15.43232: Flags [P.], seq 616290:623160, ack 821, win 65535, length 6870
13:05:37.030472 IP 10.0.2.15.43232 > 151.101.117.140.443: Flags [.], ack 623160, win 65535, length 0
13:05:37.031596 IP 151.101.117.140.443 > 10.0.2.15.43232: Flags [P.], seq 623160:630030, ack 821, win 65535, length 6870
13:05:37.031619 IP 10.0.2.15.43232 > 151.101.117.140.443: Flags [.], ack 630030, win 65535, length 0
13:05:37.032861 IP 151.101.117.140.443 > 10.0.2.15.43232: Flags [P.], seq 630030:636900, ack 821, win 65535, length 6870
13:05:37.032880 IP 10.0.2.15.43232 > 151.101.117.140.443: Flags [.], ack 636900, win 65535, length 0
13:05:37.033870 IP 151.101.117.140.443 > 10.0.2.15.43232: Flags [P.], seq 636900:643770, ack 821, win 65535, length 6870
13:05:37.033887 IP 10.0.2.15.43232 > 151.101.117.140.443: Flags [.], ack 643770, win 65535, length 0
13:05:37.034861 IP 151.101.117.140.443 > 10.0.2.15.43232: Flags [P.], seq 643770:645144, ack 821, win 65535, length 1374
13:05:37.034874 IP 10.0.2.15.43232 > 151.101.117.140.443: Flags [.], ack 645144, win 65535, length 0
13:05:37.036041 IP 151.101.117.140.443 > 10.0.2.15.43232: Flags [P.], seq 645144:653388, ack 821, win 65535, length 8244
13:05:37.036084 IP 10.0.2.15.43232 > 151.101.117.140.443: Flags [.], ack 653388, win 65535, length 0
13:05:37.036294 IP 151.101.117.140.443 > 10.0.2.15.43232: Flags [P.], seq 653388:657510, ack 821, win 65535, length 4122
13:05:37.036305 IP 10.0.2.15.43232 > 151.101.117.140.443: Flags [.], ack 657510, win 65535, length 0
13:05:37.037705 IP 151.101.117.140.443 > 10.0.2.15.43232: Flags [P.], seq 657510:663006, ack 821, win 65535, length 5496
13:05:37.037724 IP 10.0.2.15.43232 > 151.101.117.140.443: Flags [.], ack 663006, win 65535, length 0
13:05:37.038015 IP 151.101.117.140.443 > 10.0.2.15.43232: Flags [P.], seq 663006:672624, ack 821, win 65535, length 9618
13:05:37.038063 IP 10.0.2.15.43232 > 151.101.117.140.443: Flags [.], ack 672624, win 65535, length 0
13:05:37.038366 IP 151.101.117.140.443 > 10.0.2.15.43232: Flags [P.], seq 672624:673998, ack 821, win 65535, length 1374
13:05:37.038381 IP 10.0.2.15.43232 > 151.101.117.140.443: Flags [.], ack 673998, win 65535, length 0
13:05:37.040198 IP 151.101.117.140.443 > 10.0.2.15.43232: Flags [P.], seq 673998:680868, ack 821, win 65535, length 6870
13:05:37.040214 IP 10.0.2.15.43232 > 151.101.117.140.443: Flags [.], ack 680868, win 65535, length 0
13:05:37.041228 IP 151.101.117.140.443 > 10.0.2.15.43232: Flags [P.], seq 680868:686364, ack 821, win 65535, length 5496
13:05:37.041242 IP 10.0.2.15.43232 > 151.101.117.140.443: Flags [.], ack 686364, win 65535, length 0
13:05:37.041499 IP 151.101.117.140.443 > 10.0.2.15.43232: Flags [P.], seq 686364:691860, ack 821, win 65535, length 5496
13:05:37.041508 IP 10.0.2.15.43232 > 151.101.117.140.443: Flags [.], ack 691860, win 65535, length 0
13:05:37.041632 IP 151.101.117.140.443 > 10.0.2.15.43232: Flags [P.], seq 691860:693234, ack 821, win 65535, length 1374
13:05:37.041638 IP 10.0.2.15.43232 > 151.101.117.140.443: Flags [.], ack 693234, win 65535, length 0

