13:21:27.178322 IP 151.101.117.140.443 > 10.0.2.15.43344: Flags [S.], seq 84864001, ack 2592625426, win 65535, options [mss 1460], length 0
13:21:27.178390 IP 10.0.2.15.43344 > 151.101.117.140.443: Flags [.], ack 1, win 64240, length 0
13:21:27.191120 IP 10.0.2.15.43344 > 151.101.117.140.443: Flags [P.], seq 1:518, ack 1, win 64240, length 517
13:21:27.191674 IP 151.101.117.140.443 > 10.0.2.15.43344: Flags [.], ack 518, win 65535, length 0
13:21:27.207777 IP 151.101.117.140.443 > 10.0.2.15.43344: Flags [P.], seq 1:2749, ack 518, win 65535, length 2748
13:21:27.207887 IP 10.0.2.15.43344 > 151.101.117.140.443: Flags [.], ack 2749, win 62780, length 0
13:21:27.208625 IP 151.101.117.140.443 > 10.0.2.15.43344: Flags [P.], seq 2749:3722, ack 518, win 65535, length 973
13:21:27.208695 IP 10.0.2.15.43344 > 151.101.117.140.443: Flags [.], ack 3722, win 61807, length 0
13:21:27.209565 IP 10.0.2.15.43344 > 151.101.117.140.443: Flags [P.], seq 518:598, ack 3722, win 61807, length 80
13:21:27.209842 IP 10.0.2.15.43344 > 151.101.117.140.443: Flags [P.], seq 598:644, ack 3722, win 61807, length 46
13:21:27.209869 IP 10.0.2.15.43344 > 151.101.117.140.443: Flags [P.], seq 644:693, ack 3722, win 61807, length 49
13:21:27.210075 IP 151.101.117.140.443 > 10.0.2.15.43344: Flags [.], ack 598, win 65535, length 0
13:21:27.210087 IP 10.0.2.15.43344 > 151.101.117.140.443: Flags [P.], seq 693:728, ack 3722, win 61807, length 35
13:21:27.210551 IP 151.101.117.140.443 > 10.0.2.15.43344: Flags [.], ack 644, win 65535, length 0
13:21:27.210553 IP 151.101.117.140.443 > 10.0.2.15.43344: Flags [.], ack 693, win 65535, length 0
13:21:27.210553 IP 151.101.117.140.443 > 10.0.2.15.43344: Flags [.], ack 728, win 65535, length 0
13:21:27.210584 IP 10.0.2.15.43344 > 151.101.117.140.443: Flags [P.], seq 728:790, ack 3722, win 61807, length 62
13:21:27.210984 IP 151.101.117.140.443 > 10.0.2.15.43344: Flags [.], ack 790, win 65535, length 0
13:21:27.224383 IP 151.101.117.140.443 > 10.0.2.15.43344: Flags [P.], seq 3722:3803, ack 790, win 65535, length 81
13:21:27.224456 IP 10.0.2.15.43344 > 151.101.117.140.443: Flags [.], ack 3803, win 62780, length 0
13:21:27.224628 IP 10.0.2.15.43344 > 151.101.117.140.443: Flags [P.], seq 790:821, ack 3803, win 62780, length 31
13:21:27.224939 IP 151.101.117.140.443 > 10.0.2.15.43344: Flags [.], ack 821, win 65535, length 0
13:21:27.966121 IP 151.101.117.140.443 > 10.0.2.15.43344: Flags [.], seq 3803:11103, ack 821, win 65535, length 7300
13:21:27.966161 IP 10.0.2.15.43344 > 151.101.117.140.443: Flags [.], ack 11103, win 59860, length 0
13:21:27.966749 IP 151.101.117.140.443 > 10.0.2.15.43344: Flags [.], seq 11103:19863, ack 821, win 65535, length 8760
13:21:27.966770 IP 10.0.2.15.43344 > 151.101.117.140.443: Flags [.], ack 19863, win 54020, length 0
13:21:27.967072 IP 151.101.117.140.443 > 10.0.2.15.43344: Flags [.], seq 19863:28623, ack 821, win 65535, length 8760
13:21:27.967097 IP 10.0.2.15.43344 > 151.101.117.140.443: Flags [.], ack 28623, win 48180, length 0
13:21:27.967299 IP 151.101.117.140.443 > 10.0.2.15.43344: Flags [.], seq 28623:30083, ack 821, win 65535, length 1460
13:21:27.967306 IP 10.0.2.15.43344 > 151.101.117.140.443: Flags [.], ack 30083, win 46720, length 0
13:21:27.967530 IP 151.101.117.140.443 > 10.0.2.15.43344: Flags [.], seq 30083:34463, ack 821, win 65535, length 4380
13:21:27.967543 IP 10.0.2.15.43344 > 151.101.117.140.443: Flags [.], ack 34463, win 43800, length 0
13:21:27.967681 IP 151.101.117.140.443 > 10.0.2.15.43344: Flags [P.], seq 34463:42800, ack 821, win 65535, length 8337
13:21:27.967690 IP 10.0.2.15.43344 > 151.101.117.140.443: Flags [.], ack 42800, win 37960, length 0
13:21:27.980687 IP 151.101.117.140.443 > 10.0.2.15.43344: Flags [P.], seq 42800:46922, ack 821, win 65535, length 4122
13:21:27.980900 IP 10.0.2.15.43344 > 151.101.117.140.443: Flags [.], ack 46922, win 61320, length 0
13:21:27.981184 IP 151.101.117.140.443 > 10.0.2.15.43344: Flags [.], seq 46922:48382, ack 821, win 65535, length 1460
13:21:27.981202 IP 10.0.2.15.43344 > 151.101.117.140.443: Flags [.], ack 48382, win 61320, length 0
13:21:27.981655 IP 151.101.117.140.443 > 10.0.2.15.43344: Flags [P.], seq 48382:49670, ack 821, win 65535, length 1288
13:21:27.981669 IP 10.0.2.15.43344 > 151.101.117.140.443: Flags [.], ack 49670, win 60032, length 0
13:21:27.982538 IP 151.101.117.140.443 > 10.0.2.15.43344: Flags [P.], seq 49670:52418, ack 821, win 65535, length 2748
13:21:27.982553 IP 10.0.2.15.43344 > 151.101.117.140.443: Flags [.], ack 52418, win 62780, length 0
13:21:27.983338 IP 151.101.117.140.443 > 10.0.2.15.43344: Flags [P.], seq 52418:56540, ack 821, win 65535, length 4122
13:21:27.983351 IP 10.0.2.15.43344 > 151.101.117.140.443: Flags [.], ack 56540, win 61320, length 0
13:21:27.985989 IP 151.101.117.140.443 > 10.0.2.15.43344: Flags [P.], seq 56540:59288, ack 821, win 65535, length 2748
13:21:27.986009 IP 10.0.2.15.43344 > 151.101.117.140.443: Flags [.], ack 59288, win 62780, length 0
13:21:27.988197 IP 151.101.117.140.443 > 10.0.2.15.43344: Flags [P.], seq 59288:63410, ack 821, win 65535, length 4122
13:21:27.988217 IP 10.0.2.15.43344 > 151.101.117.140.443: Flags [.], ack 63410, win 61320, length 0
13:21:27.989034 IP 151.101.117.140.443 > 10.0.2.15.43344: Flags [P.], seq 63410:64784, ack 821, win 65535, length 1374
13:21:27.989048 IP 10.0.2.15.43344 > 151.101.117.140.443: Flags [.], ack 64784, win 62780, length 0
13:21:27.990095 IP 151.101.117.140.443 > 10.0.2.15.43344: Flags [P.], seq 64784:66158, ack 821, win 65535, length 1374
13:21:27.990107 IP 10.0.2.15.43344 > 151.101.117.140.443: Flags [.], ack 66158, win 62780, length 0
13:21:27.991503 IP 151.101.117.140.443 > 10.0.2.15.43344: Flags [P.], seq 66158:68906, ack 821, win 65535, length 2748
13:21:27.991519 IP 10.0.2.15.43344 > 151.101.117.140.443: Flags [.], ack 68906, win 62780, length 0
13:21:27.993507 IP 151.101.117.140.443 > 10.0.2.15.43344: Flags [P.], seq 68906:71654, ack 821, win 65535, length 2748
13:21:27.993563 IP 10.0.2.15.43344 > 151.101.117.140.443: Flags [.], ack 71654, win 65535, length 0
13:21:27.995936 IP 151.101.117.140.443 > 10.0.2.15.43344: Flags [P.], seq 71654:75776, ack 821, win 65535, length 4122
13:21:27.995956 IP 10.0.2.15.43344 > 151.101.117.140.443: Flags [.], ack 75776, win 65535, length 0
13:21:27.996965 IP 151.101.117.140.443 > 10.0.2.15.43344: Flags [P.], seq 75776:77150, ack 821, win 65535, length 1374
13:21:27.996981 IP 10.0.2.15.43344 > 151.101.117.140.443: Flags [.], ack 77150, win 65535, length 0
13:21:27.997848 IP 151.101.117.140.443 > 10.0.2.15.43344: Flags [P.], seq 77150:78524, ack 821, win 65535, length 1374
13:21:27.997906 IP 10.0.2.15.43344 > 151.101.117.140.443: Flags [.], ack 78524, win 65535, length 0
13:21:27.998925 IP 151.101.117.140.443 > 10.0.2.15.43344: Flags [P.], seq 78524:81272, ack 821, win 65535, length 2748
13:21:27.998944 IP 10.0.2.15.43344 > 151.101.117.140.443: Flags [.], ack 81272, win 65535, length 0
13:21:28.000255 IP 151.101.117.140.443 > 10.0.2.15.43344: Flags [P.], seq 81272:82646, ack 821, win 65535, length 1374
13:21:28.000269 IP 10.0.2.15.43344 > 151.101.117.140.443: Flags [.], ack 82646, win 65535, length 0
13:21:28.001289 IP 151.101.117.140.443 > 10.0.2.15.43344: Flags [P.], seq 82646:85394, ack 821, win 65535, length 2748
13:21:28.001308 IP 10.0.2.15.43344 > 151.101.117.140.443: Flags [.], ack 85394, win 65535, length 0
13:21:28.002464 IP 151.101.117.140.443 > 10.0.2.15.43344: Flags [P.], seq 85394:88142, ack 821, win 65535, length 2748
13:21:28.002479 IP 10.0.2.15.43344 > 151.101.117.140.443: Flags [.], ack 88142, win 65535, length 0
13:21:28.003527 IP 151.101.117.140.443 > 10.0.2.15.43344: Flags [P.], seq 88142:90890, ack 821, win 65535, length 2748
13:21:28.003542 IP 10.0.2.15.43344 > 151.101.117.140.443: Flags [.], ack 90890, win 65535, length 0
13:21:28.004642 IP 151.101.117.140.443 > 10.0.2.15.43344: Flags [P.], seq 90890:93638, ack 821, win 65535, length 2748
13:21:28.004659 IP 10.0.2.15.43344 > 151.101.117.140.443: Flags [.], ack 93638, win 65535, length 0
13:21:28.005773 IP 151.101.117.140.443 > 10.0.2.15.43344: Flags [P.], seq 93638:96386, ack 821, win 65535, length 2748
13:21:28.005787 IP 10.0.2.15.43344 > 151.101.117.140.443: Flags [.], ack 96386, win 65535, length 0
13:21:28.007002 IP 151.101.117.140.443 > 10.0.2.15.43344: Flags [P.], seq 96386:100508, ack 821, win 65535, length 4122
13:21:28.007022 IP 10.0.2.15.43344 > 151.101.117.140.443: Flags [.], ack 100508, win 65535, length 0
13:21:28.007942 IP 151.101.117.140.443 > 10.0.2.15.43344: Flags [P.], seq 100508:104630, ack 821, win 65535, length 4122
13:21:28.007964 IP 10.0.2.15.43344 > 151.101.117.140.443: Flags [.], ack 104630, win 65535, length 0
13:21:28.008991 IP 151.101.117.140.443 > 10.0.2.15.43344: Flags [P.], seq 104630:108752, ack 821, win 65535, length 4122
13:21:28.009009 IP 10.0.2.15.43344 > 151.101.117.140.443: Flags [.], ack 108752, win 65535, length 0
13:21:28.010342 IP 151.101.117.140.443 > 10.0.2.15.43344: Flags [P.], seq 108752:111500, ack 821, win 65535, length 2748
13:21:28.010358 IP 10.0.2.15.43344 > 151.101.117.140.443: Flags [.], ack 111500, win 65535, length 0
13:21:28.010985 IP 151.101.117.140.443 > 10.0.2.15.43344: Flags [P.], seq 111500:114248, ack 821, win 65535, length 2748
13:21:28.010997 IP 10.0.2.15.43344 > 151.101.117.140.443: Flags [.], ack 114248, win 65535, length 0
13:21:28.012372 IP 151.101.117.140.443 > 10.0.2.15.43344: Flags [P.], seq 114248:119744, ack 821, win 65535, length 5496
13:21:28.012386 IP 10.0.2.15.43344 > 151.101.117.140.443: Flags [.], ack 119744, win 65535, length 0
13:21:28.013289 IP 151.101.117.140.443 > 10.0.2.15.43344: Flags [P.], seq 119744:122492, ack 821, win 65535, length 2748
13:21:28.013305 IP 10.0.2.15.43344 > 151.101.117.140.443: Flags [.], ack 122492, win 65535, length 0
13:21:28.014338 IP 151.101.117.140.443 > 10.0.2.15.43344: Flags [P.], seq 122492:129362, ack 821, win 65535, length 6870
13:21:28.014351 IP 10.0.2.15.43344 > 151.101.117.140.443: Flags [.], ack 129362, win 65535, length 0
13:21:28.015488 IP 151.101.117.140.443 > 10.0.2.15.43344: Flags [P.], seq 129362:130736, ack 821, win 65535, length 1374
13:21:28.015499 IP 10.0.2.15.43344 > 151.101.117.140.443: Flags [.], ack 130736, win 65535, length 0
13:21:28.016740 IP 151.101.117.140.443 > 10.0.2.15.43344: Flags [P.], seq 130736:136232, ack 821, win 65535, length 5496
13:21:28.016757 IP 10.0.2.15.43344 > 151.101.117.140.443: Flags [.], ack 136232, win 65535, length 0
13:21:28.017726 IP 151.101.117.140.443 > 10.0.2.15.43344: Flags [P.], seq 136232:140354, ack 821, win 65535, length 4122
13:21:28.017741 IP 10.0.2.15.43344 > 151.101.117.140.443: Flags [.], ack 140354, win 65535, length 0
13:21:28.018847 IP 151.101.117.140.443 > 10.0.2.15.43344: Flags [P.], seq 140354:145850, ack 821, win 65535, length 5496
13:21:28.018970 IP 10.0.2.15.43344 > 151.101.117.140.443: Flags [.], ack 145850, win 65535, length 0
13:21:28.020883 IP 151.101.117.140.443 > 10.0.2.15.43344: Flags [.], seq 145850:148770, ack 821, win 65535, length 2920
13:21:28.020905 IP 10.0.2.15.43344 > 151.101.117.140.443: Flags [.], ack 148770, win 65535, length 0
13:21:28.021102 IP 151.101.117.140.443 > 10.0.2.15.43344: Flags [P.], seq 148770:154094, ack 821, win 65535, length 5324
13:21:28.021150 IP 10.0.2.15.43344 > 151.101.117.140.443: Flags [.], ack 154094, win 65535, length 0
13:21:28.021660 IP 151.101.117.140.443 > 10.0.2.15.43344: Flags [P.], seq 154094:156842, ack 821, win 65535, length 2748
13:21:28.021672 IP 10.0.2.15.43344 > 151.101.117.140.443: Flags [.], ack 156842, win 65535, length 0
13:21:28.023844 IP 151.101.117.140.443 > 10.0.2.15.43344: Flags [P.], seq 156842:163712, ack 821, win 65535, length 6870
13:21:28.023865 IP 10.0.2.15.43344 > 151.101.117.140.443: Flags [.], ack 163712, win 65535, length 0
13:21:28.024036 IP 151.101.117.140.443 > 10.0.2.15.43344: Flags [P.], seq 163712:169208, ack 821, win 65535, length 5496
13:21:28.024045 IP 10.0.2.15.43344 > 151.101.117.140.443: Flags [.], ack 169208, win 65535, length 0
13:21:28.025224 IP 151.101.117.140.443 > 10.0.2.15.43344: Flags [P.], seq 169208:174704, ack 821, win 65535, length 5496
13:21:28.025237 IP 10.0.2.15.43344 > 151.101.117.140.443: Flags [.], ack 174704, win 65535, length 0
13:21:28.026117 IP 151.101.117.140.443 > 10.0.2.15.43344: Flags [P.], seq 174704:182948, ack 821, win 65535, length 8244
13:21:28.026132 IP 10.0.2.15.43344 > 151.101.117.140.443: Flags [.], ack 182948, win 65535, length 0
13:21:28.027183 IP 151.101.117.140.443 > 10.0.2.15.43344: Flags [P.], seq 182948:187070, ack 821, win 65535, length 4122
13:21:28.027198 IP 10.0.2.15.43344 > 151.101.117.140.443: Flags [.], ack 187070, win 65535, length 0
13:21:28.028175 IP 151.101.117.140.443 > 10.0.2.15.43344: Flags [P.], seq 187070:193940, ack 821, win 65535, length 6870
13:21:28.028192 IP 10.0.2.15.43344 > 151.101.117.140.443: Flags [.], ack 193940, win 65535, length 0
13:21:28.029179 IP 151.101.117.140.443 > 10.0.2.15.43344: Flags [P.], seq 193940:197762, ack 821, win 65535, length 3822
13:21:28.029193 IP 10.0.2.15.43344 > 151.101.117.140.443: Flags [.], ack 197762, win 65535, length 0
13:21:28.888959 IP 151.101.117.140.443 > 10.0.2.15.43344: Flags [P.], seq 197762:199233, ack 821, win 65535, length 1471
13:21:28.888988 IP 10.0.2.15.43344 > 151.101.117.140.443: Flags [.], ack 199233, win 65535, length 0
13:21:28.920254 IP 151.101.117.140.443 > 10.0.2.15.43344: Flags [P.], seq 199233:208851, ack 821, win 65535, length 9618
13:21:28.920293 IP 10.0.2.15.43344 > 151.101.117.140.443: Flags [.], ack 208851, win 65535, length 0
13:21:28.920677 IP 151.101.117.140.443 > 10.0.2.15.43344: Flags [P.], seq 208851:214347, ack 821, win 65535, length 5496
13:21:28.920701 IP 10.0.2.15.43344 > 151.101.117.140.443: Flags [.], ack 214347, win 65535, length 0
13:21:28.922588 IP 151.101.117.140.443 > 10.0.2.15.43344: Flags [P.], seq 214347:219843, ack 821, win 65535, length 5496
13:21:28.922611 IP 10.0.2.15.43344 > 151.101.117.140.443: Flags [.], ack 219843, win 65535, length 0
13:21:28.922978 IP 151.101.117.140.443 > 10.0.2.15.43344: Flags [P.], seq 219843:229461, ack 821, win 65535, length 9618
13:21:28.922994 IP 10.0.2.15.43344 > 151.101.117.140.443: Flags [.], ack 229461, win 65535, length 0
13:21:28.923341 IP 151.101.117.140.443 > 10.0.2.15.43344: Flags [P.], seq 229461:237705, ack 821, win 65535, length 8244
13:21:28.923355 IP 10.0.2.15.43344 > 151.101.117.140.443: Flags [.], ack 237705, win 65535, length 0
13:21:28.924259 IP 151.101.117.140.443 > 10.0.2.15.43344: Flags [P.], seq 237705:239079, ack 821, win 65535, length 1374
13:21:28.924272 IP 10.0.2.15.43344 > 151.101.117.140.443: Flags [.], ack 239079, win 65535, length 0
13:21:28.925206 IP 151.101.117.140.443 > 10.0.2.15.43344: Flags [P.], seq 239079:240354, ack 821, win 65535, length 1275
13:21:28.925218 IP 10.0.2.15.43344 > 151.101.117.140.443: Flags [.], ack 240354, win 65535, length 0
13:21:28.930740 IP 151.101.117.140.443 > 10.0.2.15.43344: Flags [P.], seq 240354:244476, ack 821, win 65535, length 4122
13:21:28.930760 IP 10.0.2.15.43344 > 151.101.117.140.443: Flags [.], ack 244476, win 65535, length 0
13:21:28.931590 IP 151.101.117.140.443 > 10.0.2.15.43344: Flags [P.], seq 244476:249972, ack 821, win 65535, length 5496
13:21:28.931603 IP 10.0.2.15.43344 > 151.101.117.140.443: Flags [.], ack 249972, win 65535, length 0
13:21:28.932952 IP 151.101.117.140.443 > 10.0.2.15.43344: Flags [P.], seq 249972:258159, ack 821, win 65535, length 8187
13:21:28.932967 IP 10.0.2.15.43344 > 151.101.117.140.443: Flags [.], ack 258159, win 65535, length 0
13:21:28.933112 IP 151.101.117.140.443 > 10.0.2.15.43344: Flags [P.], seq 258159:262281, ack 821, win 65535, length 4122
13:21:28.933120 IP 10.0.2.15.43344 > 151.101.117.140.443: Flags [.], ack 262281, win 65535, length 0
13:21:28.934298 IP 151.101.117.140.443 > 10.0.2.15.43344: Flags [P.], seq 262281:266403, ack 821, win 65535, length 4122
13:21:28.934311 IP 10.0.2.15.43344 > 151.101.117.140.443: Flags [.], ack 266403, win 65535, length 0
13:21:28.935424 IP 151.101.117.140.443 > 10.0.2.15.43344: Flags [P.], seq 266403:271899, ack 821, win 65535, length 5496
13:21:28.935448 IP 10.0.2.15.43344 > 151.101.117.140.443: Flags [.], ack 271899, win 65535, length 0
13:21:28.935635 IP 151.101.117.140.443 > 10.0.2.15.43344: Flags [P.], seq 271899:273273, ack 821, win 65535, length 1374
13:21:28.935644 IP 10.0.2.15.43344 > 151.101.117.140.443: Flags [.], ack 273273, win 65535, length 0
13:21:28.937099 IP 151.101.117.140.443 > 10.0.2.15.43344: Flags [P.], seq 273273:281517, ack 821, win 65535, length 8244
13:21:28.937101 IP 151.101.117.140.443 > 10.0.2.15.43344: Flags [P.], seq 281517:282891, ack 821, win 65535, length 1374
13:21:28.937118 IP 10.0.2.15.43344 > 151.101.117.140.443: Flags [.], ack 281517, win 65535, length 0
13:21:28.937141 IP 10.0.2.15.43344 > 151.101.117.140.443: Flags [.], ack 282891, win 65535, length 0
13:21:28.937343 IP 151.101.117.140.443 > 10.0.2.15.43344: Flags [P.], seq 282891:287013, ack 821, win 65535, length 4122
13:21:28.937351 IP 10.0.2.15.43344 > 151.101.117.140.443: Flags [.], ack 287013, win 65535, length 0
13:21:28.938521 IP 151.101.117.140.443 > 10.0.2.15.43344: Flags [P.], seq 287013:293883, ack 821, win 65535, length 6870
13:21:28.938536 IP 10.0.2.15.43344 > 151.101.117.140.443: Flags [.], ack 293883, win 65535, length 0
13:21:28.939559 IP 151.101.117.140.443 > 10.0.2.15.43344: Flags [P.], seq 293883:299379, ack 821, win 65535, length 5496
13:21:28.939573 IP 10.0.2.15.43344 > 151.101.117.140.443: Flags [.], ack 299379, win 65535, length 0
13:21:28.940971 IP 151.101.117.140.443 > 10.0.2.15.43344: Flags [P.], seq 299379:303501, ack 821, win 65535, length 4122
13:21:28.940973 IP 151.101.117.140.443 > 10.0.2.15.43344: Flags [P.], seq 303501:306249, ack 821, win 65535, length 2748
13:21:28.940992 IP 10.0.2.15.43344 > 151.101.117.140.443: Flags [.], ack 303501, win 65535, length 0
13:21:28.941095 IP 10.0.2.15.43344 > 151.101.117.140.443: Flags [.], ack 306249, win 65535, length 0
13:21:28.941950 IP 151.101.117.140.443 > 10.0.2.15.43344: Flags [P.], seq 306249:307623, ack 821, win 65535, length 1374
13:21:28.941963 IP 10.0.2.15.43344 > 151.101.117.140.443: Flags [.], ack 307623, win 65535, length 0
13:21:28.942989 IP 151.101.117.140.443 > 10.0.2.15.43344: Flags [P.], seq 307623:308961, ack 821, win 65535, length 1338
13:21:28.943001 IP 10.0.2.15.43344 > 151.101.117.140.443: Flags [.], ack 308961, win 65535, length 0
13:21:28.944084 IP 151.101.117.140.443 > 10.0.2.15.43344: Flags [P.], seq 308961:313083, ack 821, win 65535, length 4122
13:21:28.944142 IP 10.0.2.15.43344 > 151.101.117.140.443: Flags [.], ack 313083, win 65535, length 0
13:21:28.944337 IP 151.101.117.140.443 > 10.0.2.15.43344: Flags [P.], seq 313083:318579, ack 821, win 65535, length 5496
13:21:28.944347 IP 10.0.2.15.43344 > 151.101.117.140.443: Flags [.], ack 318579, win 65535, length 0
13:21:28.945225 IP 151.101.117.140.443 > 10.0.2.15.43344: Flags [P.], seq 318579:324075, ack 821, win 65535, length 5496
13:21:28.945238 IP 10.0.2.15.43344 > 151.101.117.140.443: Flags [.], ack 324075, win 65535, length 0
13:21:28.946250 IP 151.101.117.140.443 > 10.0.2.15.43344: Flags [P.], seq 324075:329571, ack 821, win 65535, length 5496
13:21:28.946262 IP 10.0.2.15.43344 > 151.101.117.140.443: Flags [.], ack 329571, win 65535, length 0
13:21:28.947352 IP 151.101.117.140.443 > 10.0.2.15.43344: Flags [P.], seq 329571:339189, ack 821, win 65535, length 9618
13:21:28.947367 IP 10.0.2.15.43344 > 151.101.117.140.443: Flags [.], ack 339189, win 65535, length 0
13:21:28.947537 IP 151.101.117.140.443 > 10.0.2.15.43344: Flags [P.], seq 339189:340563, ack 821, win 65535, length 1374
13:21:28.947545 IP 10.0.2.15.43344 > 151.101.117.140.443: Flags [.], ack 340563, win 65535, length 0
13:21:28.948369 IP 151.101.117.140.443 > 10.0.2.15.43344: Flags [P.], seq 340563:346059, ack 821, win 65535, length 5496
13:21:28.948384 IP 10.0.2.15.43344 > 151.101.117.140.443: Flags [.], ack 346059, win 65535, length 0
13:21:28.948586 IP 151.101.117.140.443 > 10.0.2.15.43344: Flags [P.], seq 346059:347433, ack 821, win 65535, length 1374
13:21:28.948593 IP 10.0.2.15.43344 > 151.101.117.140.443: Flags [.], ack 347433, win 65535, length 0
13:21:28.950570 IP 151.101.117.140.443 > 10.0.2.15.43344: Flags [P.], seq 347433:357051, ack 821, win 65535, length 9618
13:21:28.950584 IP 10.0.2.15.43344 > 151.101.117.140.443: Flags [.], ack 357051, win 65535, length 0
13:21:28.950742 IP 151.101.117.140.443 > 10.0.2.15.43344: Flags [P.], seq 357051:358265, ack 821, win 65535, length 1214
13:21:28.950749 IP 10.0.2.15.43344 > 151.101.117.140.443: Flags [.], ack 358265, win 65535, length 0
13:21:28.956277 IP 151.101.117.140.443 > 10.0.2.15.43344: Flags [P.], seq 358265:362387, ack 821, win 65535, length 4122
13:21:28.956299 IP 10.0.2.15.43344 > 151.101.117.140.443: Flags [.], ack 362387, win 65535, length 0
13:21:28.957193 IP 151.101.117.140.443 > 10.0.2.15.43344: Flags [P.], seq 362387:367883, ack 821, win 65535, length 5496
13:21:28.957209 IP 10.0.2.15.43344 > 151.101.117.140.443: Flags [.], ack 367883, win 65535, length 0
13:21:28.958330 IP 151.101.117.140.443 > 10.0.2.15.43344: Flags [P.], seq 367883:376076, ack 821, win 65535, length 8193
13:21:28.958345 IP 10.0.2.15.43344 > 151.101.117.140.443: Flags [.], ack 376076, win 65535, length 0
13:21:28.958485 IP 151.101.117.140.443 > 10.0.2.15.43344: Flags [.], seq 376076:377536, ack 821, win 65535, length 1460
13:21:28.958494 IP 10.0.2.15.43344 > 151.101.117.140.443: Flags [.], ack 377536, win 65535, length 0
13:21:28.958690 IP 151.101.117.140.443 > 10.0.2.15.43344: Flags [P.], seq 377536:378824, ack 821, win 65535, length 1288
13:21:28.958699 IP 10.0.2.15.43344 > 151.101.117.140.443: Flags [.], ack 378824, win 65535, length 0
13:21:28.959304 IP 151.101.117.140.443 > 10.0.2.15.43344: Flags [P.], seq 378824:380198, ack 821, win 65535, length 1374
13:21:28.959316 IP 10.0.2.15.43344 > 151.101.117.140.443: Flags [.], ack 380198, win 65535, length 0
13:21:28.960466 IP 151.101.117.140.443 > 10.0.2.15.43344: Flags [P.], seq 380198:391190, ack 821, win 65535, length 10992
13:21:28.960480 IP 10.0.2.15.43344 > 151.101.117.140.443: Flags [.], ack 391190, win 65535, length 0
13:21:28.961323 IP 151.101.117.140.443 > 10.0.2.15.43344: Flags [P.], seq 391190:399434, ack 821, win 65535, length 8244
13:21:28.961337 IP 10.0.2.15.43344 > 151.101.117.140.443: Flags [.], ack 399434, win 65535, length 0
13:21:28.961587 IP 151.101.117.140.443 > 10.0.2.15.43344: Flags [P.], seq 399434:400808, ack 821, win 65535, length 1374
13:21:28.961612 IP 10.0.2.15.43344 > 151.101.117.140.443: Flags [.], ack 400808, win 65535, length 0
13:21:28.962391 IP 151.101.117.140.443 > 10.0.2.15.43344: Flags [P.], seq 400808:407678, ack 821, win 65535, length 6870
13:21:28.962405 IP 10.0.2.15.43344 > 151.101.117.140.443: Flags [.], ack 407678, win 65535, length 0
13:21:28.963406 IP 151.101.117.140.443 > 10.0.2.15.43344: Flags [P.], seq 407678:411800, ack 821, win 65535, length 4122
13:21:28.963432 IP 10.0.2.15.43344 > 151.101.117.140.443: Flags [.], ack 411800, win 65535, length 0
13:21:28.964887 IP 151.101.117.140.443 > 10.0.2.15.43344: Flags [P.], seq 411800:422792, ack 821, win 65535, length 10992
13:21:28.964904 IP 10.0.2.15.43344 > 151.101.117.140.443: Flags [.], ack 422792, win 65535, length 0
13:21:28.965888 IP 151.101.117.140.443 > 10.0.2.15.43344: Flags [P.], seq 422792:424016, ack 821, win 65535, length 1224
13:21:28.965900 IP 10.0.2.15.43344 > 151.101.117.140.443: Flags [.], ack 424016, win 65535, length 0
13:21:28.969592 IP 151.101.117.140.443 > 10.0.2.15.43344: Flags [P.], seq 424016:433634, ack 821, win 65535, length 9618
13:21:28.969619 IP 10.0.2.15.43344 > 151.101.117.140.443: Flags [.], ack 433634, win 65535, length 0
13:21:28.970599 IP 151.101.117.140.443 > 10.0.2.15.43344: Flags [P.], seq 433634:442545, ack 821, win 65535, length 8911
13:21:28.970613 IP 10.0.2.15.43344 > 151.101.117.140.443: Flags [.], ack 442545, win 65535, length 0
13:21:28.971567 IP 151.101.117.140.443 > 10.0.2.15.43344: Flags [P.], seq 442545:449415, ack 821, win 65535, length 6870
13:21:28.971581 IP 10.0.2.15.43344 > 151.101.117.140.443: Flags [.], ack 449415, win 65535, length 0
13:21:28.972747 IP 151.101.117.140.443 > 10.0.2.15.43344: Flags [P.], seq 449415:456285, ack 821, win 65535, length 6870
13:21:28.972762 IP 10.0.2.15.43344 > 151.101.117.140.443: Flags [.], ack 456285, win 65535, length 0
13:21:28.973720 IP 151.101.117.140.443 > 10.0.2.15.43344: Flags [P.], seq 456285:464529, ack 821, win 65535, length 8244
13:21:28.973734 IP 10.0.2.15.43344 > 151.101.117.140.443: Flags [.], ack 464529, win 65535, length 0
13:21:28.974864 IP 151.101.117.140.443 > 10.0.2.15.43344: Flags [P.], seq 464529:472773, ack 821, win 65535, length 8244
13:21:28.974879 IP 10.0.2.15.43344 > 151.101.117.140.443: Flags [.], ack 472773, win 65535, length 0
13:21:28.975142 IP 151.101.117.140.443 > 10.0.2.15.43344: Flags [P.], seq 472773:476895, ack 821, win 65535, length 4122
13:21:28.975151 IP 10.0.2.15.43344 > 151.101.117.140.443: Flags [.], ack 476895, win 65535, length 0
13:21:28.975980 IP 151.101.117.140.443 > 10.0.2.15.43344: Flags [P.], seq 476895:481017, ack 821, win 65535, length 4122
13:21:28.975994 IP 10.0.2.15.43344 > 151.101.117.140.443: Flags [.], ack 481017, win 65535, length 0
13:21:28.976218 IP 151.101.117.140.443 > 10.0.2.15.43344: Flags [P.], seq 481017:483765, ack 821, win 65535, length 2748
13:21:28.976228 IP 10.0.2.15.43344 > 151.101.117.140.443: Flags [.], ack 483765, win 65535, length 0
13:21:28.978465 IP 151.101.117.140.443 > 10.0.2.15.43344: Flags [P.], seq 483765:489759, ack 821, win 65535, length 5994
13:21:28.978479 IP 10.0.2.15.43344 > 151.101.117.140.443: Flags [.], ack 489759, win 65535, length 0
13:21:28.981818 IP 151.101.117.140.443 > 10.0.2.15.43344: Flags [P.], seq 489759:495255, ack 821, win 65535, length 5496
13:21:28.981839 IP 10.0.2.15.43344 > 151.101.117.140.443: Flags [.], ack 495255, win 65535, length 0
13:21:28.982675 IP 151.101.117.140.443 > 10.0.2.15.43344: Flags [P.], seq 495255:502115, ack 821, win 65535, length 6860
13:21:28.982688 IP 10.0.2.15.43344 > 151.101.117.140.443: Flags [.], ack 502115, win 65535, length 0
13:21:28.984058 IP 151.101.117.140.443 > 10.0.2.15.43344: Flags [P.], seq 502115:507611, ack 821, win 65535, length 5496
13:21:28.984073 IP 10.0.2.15.43344 > 151.101.117.140.443: Flags [.], ack 507611, win 65535, length 0
13:21:28.984414 IP 151.101.117.140.443 > 10.0.2.15.43344: Flags [P.], seq 507611:510359, ack 821, win 65535, length 2748
13:21:28.984459 IP 10.0.2.15.43344 > 151.101.117.140.443: Flags [.], ack 510359, win 65535, length 0
13:21:28.985365 IP 151.101.117.140.443 > 10.0.2.15.43344: Flags [P.], seq 510359:517229, ack 821, win 65535, length 6870
13:21:28.985367 IP 151.101.117.140.443 > 10.0.2.15.43344: Flags [P.], seq 517229:521351, ack 821, win 65535, length 4122
13:21:28.985384 IP 10.0.2.15.43344 > 151.101.117.140.443: Flags [.], ack 517229, win 65535, length 0
13:21:28.985418 IP 10.0.2.15.43344 > 151.101.117.140.443: Flags [.], ack 521351, win 65535, length 0
13:21:28.985682 IP 151.101.117.140.443 > 10.0.2.15.43344: Flags [P.], seq 521351:522725, ack 821, win 65535, length 1374
13:21:28.985690 IP 10.0.2.15.43344 > 151.101.117.140.443: Flags [.], ack 522725, win 65535, length 0
13:21:28.986745 IP 151.101.117.140.443 > 10.0.2.15.43344: Flags [P.], seq 522725:528221, ack 821, win 65535, length 5496
13:21:28.986760 IP 10.0.2.15.43344 > 151.101.117.140.443: Flags [.], ack 528221, win 65535, length 0
13:21:28.987092 IP 151.101.117.140.443 > 10.0.2.15.43344: Flags [P.], seq 528221:532343, ack 821, win 65535, length 4122
13:21:28.987103 IP 10.0.2.15.43344 > 151.101.117.140.443: Flags [.], ack 532343, win 65535, length 0
13:21:28.989377 IP 151.101.117.140.443 > 10.0.2.15.43344: Flags [P.], seq 532343:544709, ack 821, win 65535, length 12366
13:21:28.989397 IP 10.0.2.15.43344 > 151.101.117.140.443: Flags [.], ack 544709, win 65535, length 0
13:21:28.989529 IP 151.101.117.140.443 > 10.0.2.15.43344: Flags [P.], seq 544709:550205, ack 821, win 65535, length 5496
13:21:28.989537 IP 10.0.2.15.43344 > 151.101.117.140.443: Flags [.], ack 550205, win 65535, length 0
13:21:28.990643 IP 151.101.117.140.443 > 10.0.2.15.43344: Flags [P.], seq 550205:555502, ack 821, win 65535, length 5297
13:21:28.990658 IP 10.0.2.15.43344 > 151.101.117.140.443: Flags [.], ack 555502, win 65535, length 0
13:21:28.994685 IP 151.101.117.140.443 > 10.0.2.15.43344: Flags [P.], seq 555502:565120, ack 821, win 65535, length 9618
13:21:28.994702 IP 10.0.2.15.43344 > 151.101.117.140.443: Flags [.], ack 565120, win 65535, length 0
13:21:28.995657 IP 151.101.117.140.443 > 10.0.2.15.43344: Flags [P.], seq 565120:571990, ack 821, win 65535, length 6870
13:21:28.995672 IP 10.0.2.15.43344 > 151.101.117.140.443: Flags [.], ack 571990, win 65535, length 0
13:21:28.995880 IP 151.101.117.140.443 > 10.0.2.15.43344: Flags [P.], seq 571990:574738, ack 821, win 65535, length 2748
13:21:28.995890 IP 10.0.2.15.43344 > 151.101.117.140.443: Flags [.], ack 574738, win 65535, length 0
13:21:28.996929 IP 151.101.117.140.443 > 10.0.2.15.43344: Flags [P.], seq 574738:580234, ack 821, win 65535, length 5496
13:21:28.996944 IP 10.0.2.15.43344 > 151.101.117.140.443: Flags [.], ack 580234, win 65535, length 0
13:21:28.997067 IP 151.101.117.140.443 > 10.0.2.15.43344: Flags [P.], seq 580234:581608, ack 821, win 65535, length 1374
13:21:28.997074 IP 10.0.2.15.43344 > 151.101.117.140.443: Flags [.], ack 581608, win 65535, length 0
13:21:28.997874 IP 151.101.117.140.443 > 10.0.2.15.43344: Flags [P.], seq 581608:587104, ack 821, win 65535, length 5496
13:21:28.997886 IP 10.0.2.15.43344 > 151.101.117.140.443: Flags [.], ack 587104, win 65535, length 0
13:21:28.998079 IP 151.101.117.140.443 > 10.0.2.15.43344: Flags [P.], seq 587104:588478, ack 821, win 65535, length 1374
13:21:28.998086 IP 10.0.2.15.43344 > 151.101.117.140.443: Flags [.], ack 588478, win 65535, length 0
13:21:28.999030 IP 151.101.117.140.443 > 10.0.2.15.43344: Flags [P.], seq 588478:595348, ack 821, win 65535, length 6870
13:21:28.999044 IP 10.0.2.15.43344 > 151.101.117.140.443: Flags [.], ack 595348, win 65535, length 0
13:21:29.000004 IP 151.101.117.140.443 > 10.0.2.15.43344: Flags [P.], seq 595348:600844, ack 821, win 65535, length 5496
13:21:29.000019 IP 10.0.2.15.43344 > 151.101.117.140.443: Flags [.], ack 600844, win 65535, length 0
13:21:29.000189 IP 151.101.117.140.443 > 10.0.2.15.43344: Flags [P.], seq 600844:604966, ack 821, win 65535, length 4122
13:21:29.000200 IP 10.0.2.15.43344 > 151.101.117.140.443: Flags [.], ack 604966, win 65535, length 0
13:21:29.001360 IP 151.101.117.140.443 > 10.0.2.15.43344: Flags [P.], seq 604966:610462, ack 821, win 65535, length 5496
13:21:29.001375 IP 10.0.2.15.43344 > 151.101.117.140.443: Flags [.], ack 610462, win 65535, length 0
13:21:29.001674 IP 151.101.117.140.443 > 10.0.2.15.43344: Flags [P.], seq 610462:614584, ack 821, win 65535, length 4122
13:21:29.001735 IP 10.0.2.15.43344 > 151.101.117.140.443: Flags [.], ack 614584, win 65535, length 0
13:21:29.002349 IP 151.101.117.140.443 > 10.0.2.15.43344: Flags [P.], seq 614584:620080, ack 821, win 65535, length 5496
13:21:29.002363 IP 10.0.2.15.43344 > 151.101.117.140.443: Flags [.], ack 620080, win 65535, length 0
13:21:29.003315 IP 151.101.117.140.443 > 10.0.2.15.43344: Flags [P.], seq 620080:621242, ack 821, win 65535, length 1162
13:21:29.003329 IP 10.0.2.15.43344 > 151.101.117.140.443: Flags [.], ack 621242, win 65535, length 0
13:21:29.007179 IP 151.101.117.140.443 > 10.0.2.15.43344: Flags [P.], seq 621242:630357, ack 821, win 65535, length 9115
13:21:29.007197 IP 10.0.2.15.43344 > 151.101.117.140.443: Flags [.], ack 630357, win 65535, length 0
13:21:29.008624 IP 151.101.117.140.443 > 10.0.2.15.43344: Flags [P.], seq 630357:637679, ack 821, win 65535, length 7322
13:21:29.008703 IP 10.0.2.15.43344 > 151.101.117.140.443: Flags [.], ack 637679, win 65535, length 0
13:21:29.008970 IP 151.101.117.140.443 > 10.0.2.15.43344: Flags [P.], seq 637679:639053, ack 821, win 65535, length 1374
13:21:29.008986 IP 10.0.2.15.43344 > 151.101.117.140.443: Flags [.], ack 639053, win 65535, length 0
13:21:29.009841 IP 151.101.117.140.443 > 10.0.2.15.43344: Flags [P.], seq 639053:647297, ack 821, win 65535, length 8244
13:21:29.009908 IP 10.0.2.15.43344 > 151.101.117.140.443: Flags [.], ack 647297, win 65535, length 0
13:21:29.010036 IP 151.101.117.140.443 > 10.0.2.15.43344: Flags [P.], seq 647297:648671, ack 821, win 65535, length 1374
13:21:29.010043 IP 10.0.2.15.43344 > 151.101.117.140.443: Flags [.], ack 648671, win 65535, length 0
13:21:29.010873 IP 151.101.117.140.443 > 10.0.2.15.43344: Flags [P.], seq 648671:656915, ack 821, win 65535, length 8244
13:21:29.010887 IP 10.0.2.15.43344 > 151.101.117.140.443: Flags [.], ack 656915, win 65535, length 0
13:21:29.011958 IP 151.101.117.140.443 > 10.0.2.15.43344: Flags [P.], seq 656915:663785, ack 821, win 65535, length 6870
13:21:29.011973 IP 10.0.2.15.43344 > 151.101.117.140.443: Flags [.], ack 663785, win 65535, length 0
13:21:29.013055 IP 151.101.117.140.443 > 10.0.2.15.43344: Flags [P.], seq 663785:667907, ack 821, win 65535, length 4122
13:21:29.013073 IP 10.0.2.15.43344 > 151.101.117.140.443: Flags [.], ack 667907, win 65535, length 0
13:21:29.013317 IP 151.101.117.140.443 > 10.0.2.15.43344: Flags [P.], seq 667907:672029, ack 821, win 65535, length 4122
13:21:29.013336 IP 10.0.2.15.43344 > 151.101.117.140.443: Flags [.], ack 672029, win 65535, length 0
13:21:29.014285 IP 151.101.117.140.443 > 10.0.2.15.43344: Flags [P.], seq 672029:680273, ack 821, win 65535, length 8244
13:21:29.014300 IP 10.0.2.15.43344 > 151.101.117.140.443: Flags [.], ack 680273, win 65535, length 0
13:21:29.014540 IP 151.101.117.140.443 > 10.0.2.15.43344: Flags [P.], seq 680273:681647, ack 821, win 65535, length 1374
13:21:29.014553 IP 10.0.2.15.43344 > 151.101.117.140.443: Flags [.], ack 681647, win 65535, length 0
13:21:29.015067 IP 151.101.117.140.443 > 10.0.2.15.43344: Flags [P.], seq 681647:688517, ack 821, win 65535, length 6870
13:21:29.015080 IP 10.0.2.15.43344 > 151.101.117.140.443: Flags [.], ack 688517, win 65535, length 0
13:21:29.015322 IP 151.101.117.140.443 > 10.0.2.15.43344: Flags [P.], seq 688517:691265, ack 821, win 65535, length 2748

