13:06:15.623477 IP 151.101.117.140.443 > 10.0.2.15.43280: Flags [S.], seq 29760001, ack 247962896, win 65535, options [mss 1460], length 0
13:06:15.623518 IP 10.0.2.15.43280 > 151.101.117.140.443: Flags [.], ack 1, win 64240, length 0
13:06:15.631287 IP 10.0.2.15.43280 > 151.101.117.140.443: Flags [P.], seq 1:518, ack 1, win 64240, length 517
13:06:15.632549 IP 151.101.117.140.443 > 10.0.2.15.43280: Flags [.], ack 518, win 65535, length 0
13:06:15.648638 IP 151.101.117.140.443 > 10.0.2.15.43280: Flags [P.], seq 1:2749, ack 518, win 65535, length 2748
13:06:15.648670 IP 10.0.2.15.43280 > 151.101.117.140.443: Flags [.], ack 2749, win 62780, length 0
13:06:15.649493 IP 151.101.117.140.443 > 10.0.2.15.43280: Flags [P.], seq 2749:3722, ack 518, win 65535, length 973
13:06:15.649523 IP 10.0.2.15.43280 > 151.101.117.140.443: Flags [.], ack 3722, win 61807, length 0
13:06:15.650474 IP 10.0.2.15.43280 > 151.101.117.140.443: Flags [P.], seq 518:598, ack 3722, win 61807, length 80
13:06:15.651928 IP 151.101.117.140.443 > 10.0.2.15.43280: Flags [.], ack 598, win 65535, length 0
13:06:15.652096 IP 10.0.2.15.43280 > 151.101.117.140.443: Flags [P.], seq 598:644, ack 3722, win 61807, length 46
13:06:15.654438 IP 151.101.117.140.443 > 10.0.2.15.43280: Flags [.], ack 644, win 65535, length 0
13:06:15.654596 IP 10.0.2.15.43280 > 151.101.117.140.443: Flags [P.], seq 644:693, ack 3722, win 61807, length 49
13:06:15.655096 IP 10.0.2.15.43280 > 151.101.117.140.443: Flags [P.], seq 693:728, ack 3722, win 61807, length 35
13:06:15.655373 IP 151.101.117.140.443 > 10.0.2.15.43280: Flags [.], ack 693, win 65535, length 0
13:06:15.655375 IP 151.101.117.140.443 > 10.0.2.15.43280: Flags [.], ack 728, win 65535, length 0
13:06:15.655449 IP 10.0.2.15.43280 > 151.101.117.140.443: Flags [P.], seq 728:790, ack 3722, win 61807, length 62
13:06:15.655684 IP 151.101.117.140.443 > 10.0.2.15.43280: Flags [.], ack 790, win 65535, length 0
13:06:15.666501 IP 151.101.117.140.443 > 10.0.2.15.43280: Flags [P.], seq 3722:3772, ack 790, win 65535, length 50
13:06:15.666524 IP 10.0.2.15.43280 > 151.101.117.140.443: Flags [.], ack 3772, win 62780, length 0
13:06:15.667430 IP 10.0.2.15.43280 > 151.101.117.140.443: Flags [P.], seq 790:821, ack 3772, win 62780, length 31
13:06:15.668746 IP 151.101.117.140.443 > 10.0.2.15.43280: Flags [P.], seq 3772:3803, ack 790, win 65535, length 31
13:06:15.668748 IP 151.101.117.140.443 > 10.0.2.15.43280: Flags [.], ack 821, win 65535, length 0
13:06:15.668767 IP 10.0.2.15.43280 > 151.101.117.140.443: Flags [.], ack 3803, win 62780, length 0
13:06:16.295775 IP 151.101.117.140.443 > 10.0.2.15.43280: Flags [.], seq 3803:12563, ack 821, win 65535, length 8760
13:06:16.295812 IP 10.0.2.15.43280 > 151.101.117.140.443: Flags [.], ack 12563, win 58400, length 0
13:06:16.296578 IP 151.101.117.140.443 > 10.0.2.15.43280: Flags [.], seq 12563:22783, ack 821, win 65535, length 10220
13:06:16.296597 IP 10.0.2.15.43280 > 151.101.117.140.443: Flags [.], ack 22783, win 52560, length 0
13:06:16.296888 IP 151.101.117.140.443 > 10.0.2.15.43280: Flags [.], seq 22783:34463, ack 821, win 65535, length 11680
13:06:16.296900 IP 10.0.2.15.43280 > 151.101.117.140.443: Flags [.], ack 34463, win 43800, length 0
13:06:16.297122 IP 151.101.117.140.443 > 10.0.2.15.43280: Flags [P.], seq 34463:45023, ack 821, win 65535, length 10560
13:06:16.297130 IP 10.0.2.15.43280 > 151.101.117.140.443: Flags [.], ack 45023, win 36500, length 0
13:06:16.308712 IP 151.101.117.140.443 > 10.0.2.15.43280: Flags [P.], seq 45023:46397, ack 821, win 65535, length 1374
13:06:16.308735 IP 10.0.2.15.43280 > 151.101.117.140.443: Flags [.], ack 46397, win 62780, length 0
13:06:16.309659 IP 151.101.117.140.443 > 10.0.2.15.43280: Flags [P.], seq 46397:47771, ack 821, win 65535, length 1374
13:06:16.309678 IP 10.0.2.15.43280 > 151.101.117.140.443: Flags [.], ack 47771, win 62780, length 0
13:06:16.310590 IP 151.101.117.140.443 > 10.0.2.15.43280: Flags [P.], seq 47771:53267, ack 821, win 65535, length 5496
13:06:16.310606 IP 10.0.2.15.43280 > 151.101.117.140.443: Flags [.], ack 53267, win 61320, length 0
13:06:16.311369 IP 151.101.117.140.443 > 10.0.2.15.43280: Flags [P.], seq 53267:56015, ack 821, win 65535, length 2748
13:06:16.311385 IP 10.0.2.15.43280 > 151.101.117.140.443: Flags [.], ack 56015, win 62780, length 0
13:06:16.312528 IP 151.101.117.140.443 > 10.0.2.15.43280: Flags [P.], seq 56015:58763, ack 821, win 65535, length 2748
13:06:16.312541 IP 10.0.2.15.43280 > 151.101.117.140.443: Flags [.], ack 58763, win 62780, length 0
13:06:16.313882 IP 151.101.117.140.443 > 10.0.2.15.43280: Flags [P.], seq 58763:62885, ack 821, win 65535, length 4122
13:06:16.313904 IP 10.0.2.15.43280 > 151.101.117.140.443: Flags [.], ack 62885, win 61320, length 0
13:06:16.315818 IP 151.101.117.140.443 > 10.0.2.15.43280: Flags [P.], seq 62885:65633, ack 821, win 65535, length 2748
13:06:16.315838 IP 10.0.2.15.43280 > 151.101.117.140.443: Flags [.], ack 65633, win 62780, length 0
13:06:16.316578 IP 151.101.117.140.443 > 10.0.2.15.43280: Flags [P.], seq 65633:67007, ack 821, win 65535, length 1374
13:06:16.316591 IP 10.0.2.15.43280 > 151.101.117.140.443: Flags [.], ack 67007, win 62780, length 0
13:06:16.317953 IP 151.101.117.140.443 > 10.0.2.15.43280: Flags [P.], seq 67007:68381, ack 821, win 65535, length 1374
13:06:16.317971 IP 10.0.2.15.43280 > 151.101.117.140.443: Flags [.], ack 68381, win 65535, length 0
13:06:16.318770 IP 151.101.117.140.443 > 10.0.2.15.43280: Flags [P.], seq 68381:69755, ack 821, win 65535, length 1374
13:06:16.318783 IP 10.0.2.15.43280 > 151.101.117.140.443: Flags [.], ack 69755, win 65535, length 0
13:06:16.320241 IP 151.101.117.140.443 > 10.0.2.15.43280: Flags [P.], seq 69755:72503, ack 821, win 65535, length 2748
13:06:16.320259 IP 10.0.2.15.43280 > 151.101.117.140.443: Flags [.], ack 72503, win 65535, length 0
13:06:16.322489 IP 151.101.117.140.443 > 10.0.2.15.43280: Flags [P.], seq 72503:76625, ack 821, win 65535, length 4122
13:06:16.322508 IP 10.0.2.15.43280 > 151.101.117.140.443: Flags [.], ack 76625, win 65535, length 0
13:06:16.323128 IP 151.101.117.140.443 > 10.0.2.15.43280: Flags [P.], seq 76625:77999, ack 821, win 65535, length 1374
13:06:16.323140 IP 10.0.2.15.43280 > 151.101.117.140.443: Flags [.], ack 77999, win 65535, length 0
13:06:16.324211 IP 151.101.117.140.443 > 10.0.2.15.43280: Flags [P.], seq 77999:79373, ack 821, win 65535, length 1374
13:06:16.324227 IP 10.0.2.15.43280 > 151.101.117.140.443: Flags [.], ack 79373, win 65535, length 0
13:06:16.325512 IP 151.101.117.140.443 > 10.0.2.15.43280: Flags [P.], seq 79373:82121, ack 821, win 65535, length 2748
13:06:16.325530 IP 10.0.2.15.43280 > 151.101.117.140.443: Flags [.], ack 82121, win 65535, length 0
13:06:16.326495 IP 151.101.117.140.443 > 10.0.2.15.43280: Flags [P.], seq 82121:83495, ack 821, win 65535, length 1374
13:06:16.326506 IP 10.0.2.15.43280 > 151.101.117.140.443: Flags [.], ack 83495, win 65535, length 0
13:06:16.327911 IP 151.101.117.140.443 > 10.0.2.15.43280: Flags [P.], seq 83495:87617, ack 821, win 65535, length 4122
13:06:16.327924 IP 10.0.2.15.43280 > 151.101.117.140.443: Flags [.], ack 87617, win 65535, length 0
13:06:16.328687 IP 151.101.117.140.443 > 10.0.2.15.43280: Flags [P.], seq 87617:88991, ack 821, win 65535, length 1374
13:06:16.328699 IP 10.0.2.15.43280 > 151.101.117.140.443: Flags [.], ack 88991, win 65535, length 0
13:06:16.329870 IP 151.101.117.140.443 > 10.0.2.15.43280: Flags [P.], seq 88991:91739, ack 821, win 65535, length 2748
13:06:16.329887 IP 10.0.2.15.43280 > 151.101.117.140.443: Flags [.], ack 91739, win 65535, length 0
13:06:16.330842 IP 151.101.117.140.443 > 10.0.2.15.43280: Flags [P.], seq 91739:94487, ack 821, win 65535, length 2748
13:06:16.330857 IP 10.0.2.15.43280 > 151.101.117.140.443: Flags [.], ack 94487, win 65535, length 0
13:06:16.331927 IP 151.101.117.140.443 > 10.0.2.15.43280: Flags [P.], seq 94487:97235, ack 821, win 65535, length 2748
13:06:16.331942 IP 10.0.2.15.43280 > 151.101.117.140.443: Flags [.], ack 97235, win 65535, length 0
13:06:16.333097 IP 151.101.117.140.443 > 10.0.2.15.43280: Flags [P.], seq 97235:102731, ack 821, win 65535, length 5496
13:06:16.333116 IP 10.0.2.15.43280 > 151.101.117.140.443: Flags [.], ack 102731, win 65535, length 0
13:06:16.335474 IP 151.101.117.140.443 > 10.0.2.15.43280: Flags [P.], seq 102731:110975, ack 821, win 65535, length 8244
13:06:16.335491 IP 10.0.2.15.43280 > 151.101.117.140.443: Flags [.], ack 110975, win 65535, length 0
13:06:16.336455 IP 151.101.117.140.443 > 10.0.2.15.43280: Flags [P.], seq 110975:116471, ack 821, win 65535, length 5496
13:06:16.336469 IP 10.0.2.15.43280 > 151.101.117.140.443: Flags [.], ack 116471, win 65535, length 0
13:06:16.337633 IP 151.101.117.140.443 > 10.0.2.15.43280: Flags [P.], seq 116471:119219, ack 821, win 65535, length 2748
13:06:16.337652 IP 10.0.2.15.43280 > 151.101.117.140.443: Flags [.], ack 119219, win 65535, length 0
13:06:16.338605 IP 151.101.117.140.443 > 10.0.2.15.43280: Flags [P.], seq 119219:126089, ack 821, win 65535, length 6870
13:06:16.338620 IP 10.0.2.15.43280 > 151.101.117.140.443: Flags [.], ack 126089, win 65535, length 0
13:06:16.339799 IP 151.101.117.140.443 > 10.0.2.15.43280: Flags [P.], seq 126089:130211, ack 821, win 65535, length 4122
13:06:16.339813 IP 10.0.2.15.43280 > 151.101.117.140.443: Flags [.], ack 130211, win 65535, length 0
13:06:16.341128 IP 151.101.117.140.443 > 10.0.2.15.43280: Flags [P.], seq 130211:134333, ack 821, win 65535, length 4122
13:06:16.341144 IP 10.0.2.15.43280 > 151.101.117.140.443: Flags [.], ack 134333, win 65535, length 0
13:06:16.341271 IP 151.101.117.140.443 > 10.0.2.15.43280: Flags [P.], seq 134333:135707, ack 821, win 65535, length 1374
13:06:16.341278 IP 10.0.2.15.43280 > 151.101.117.140.443: Flags [.], ack 135707, win 65535, length 0
13:06:16.342409 IP 151.101.117.140.443 > 10.0.2.15.43280: Flags [P.], seq 135707:139829, ack 821, win 65535, length 4122
13:06:16.342427 IP 10.0.2.15.43280 > 151.101.117.140.443: Flags [.], ack 139829, win 65535, length 0
13:06:16.342765 IP 151.101.117.140.443 > 10.0.2.15.43280: Flags [P.], seq 139829:142577, ack 821, win 65535, length 2748
13:06:16.342780 IP 10.0.2.15.43280 > 151.101.117.140.443: Flags [.], ack 142577, win 65535, length 0
13:06:16.343635 IP 151.101.117.140.443 > 10.0.2.15.43280: Flags [P.], seq 142577:146699, ack 821, win 65535, length 4122
13:06:16.343650 IP 10.0.2.15.43280 > 151.101.117.140.443: Flags [.], ack 146699, win 65535, length 0
13:06:16.344615 IP 151.101.117.140.443 > 10.0.2.15.43280: Flags [P.], seq 146699:150821, ack 821, win 65535, length 4122
13:06:16.344629 IP 10.0.2.15.43280 > 151.101.117.140.443: Flags [.], ack 150821, win 65535, length 0
13:06:16.346261 IP 151.101.117.140.443 > 10.0.2.15.43280: Flags [P.], seq 150821:157691, ack 821, win 65535, length 6870
13:06:16.346278 IP 10.0.2.15.43280 > 151.101.117.140.443: Flags [.], ack 157691, win 65535, length 0
13:06:16.347066 IP 151.101.117.140.443 > 10.0.2.15.43280: Flags [P.], seq 157691:163187, ack 821, win 65535, length 5496
13:06:16.347085 IP 10.0.2.15.43280 > 151.101.117.140.443: Flags [.], ack 163187, win 65535, length 0
13:06:16.347284 IP 151.101.117.140.443 > 10.0.2.15.43280: Flags [P.], seq 163187:164561, ack 821, win 65535, length 1374
13:06:16.347296 IP 10.0.2.15.43280 > 151.101.117.140.443: Flags [.], ack 164561, win 65535, length 0
13:06:16.348420 IP 151.101.117.140.443 > 10.0.2.15.43280: Flags [P.], seq 164561:167309, ack 821, win 65535, length 2748
13:06:16.348442 IP 10.0.2.15.43280 > 151.101.117.140.443: Flags [.], ack 167309, win 65535, length 0
13:06:16.349335 IP 151.101.117.140.443 > 10.0.2.15.43280: Flags [P.], seq 167309:175553, ack 821, win 65535, length 8244
13:06:16.349358 IP 10.0.2.15.43280 > 151.101.117.140.443: Flags [.], ack 175553, win 65535, length 0
13:06:16.349557 IP 151.101.117.140.443 > 10.0.2.15.43280: Flags [P.], seq 175553:176927, ack 821, win 65535, length 1374
13:06:16.349567 IP 10.0.2.15.43280 > 151.101.117.140.443: Flags [.], ack 176927, win 65535, length 0
13:06:16.351862 IP 151.101.117.140.443 > 10.0.2.15.43280: Flags [P.], seq 176927:183797, ack 821, win 65535, length 6870
13:06:16.351865 IP 151.101.117.140.443 > 10.0.2.15.43280: Flags [.], seq 183797:185257, ack 821, win 65535, length 1460
13:06:16.351890 IP 10.0.2.15.43280 > 151.101.117.140.443: Flags [.], ack 183797, win 65535, length 0
13:06:16.351932 IP 10.0.2.15.43280 > 151.101.117.140.443: Flags [.], ack 185257, win 65535, length 0
13:06:16.352121 IP 151.101.117.140.443 > 10.0.2.15.43280: Flags [P.], seq 185257:190667, ack 821, win 65535, length 5410
13:06:16.352134 IP 10.0.2.15.43280 > 151.101.117.140.443: Flags [.], ack 190667, win 65535, length 0
13:06:16.352955 IP 151.101.117.140.443 > 10.0.2.15.43280: Flags [P.], seq 190667:197537, ack 821, win 65535, length 6870
13:06:16.352972 IP 10.0.2.15.43280 > 151.101.117.140.443: Flags [.], ack 197537, win 65535, length 0
13:06:16.354845 IP 151.101.117.140.443 > 10.0.2.15.43280: Flags [P.], seq 197537:197784, ack 821, win 65535, length 247
13:06:16.354860 IP 10.0.2.15.43280 > 151.101.117.140.443: Flags [.], ack 197784, win 65535, length 0
13:06:16.982347 IP 151.101.117.140.443 > 10.0.2.15.43280: Flags [P.], seq 197784:199255, ack 821, win 65535, length 1471
13:06:16.982379 IP 10.0.2.15.43280 > 151.101.117.140.443: Flags [.], ack 199255, win 65535, length 0
13:06:17.027442 IP 151.101.117.140.443 > 10.0.2.15.43280: Flags [P.], seq 199255:211621, ack 821, win 65535, length 12366
13:06:17.027477 IP 10.0.2.15.43280 > 151.101.117.140.443: Flags [.], ack 211621, win 65535, length 0
13:06:17.028238 IP 151.101.117.140.443 > 10.0.2.15.43280: Flags [P.], seq 211621:218491, ack 821, win 65535, length 6870
13:06:17.028257 IP 10.0.2.15.43280 > 151.101.117.140.443: Flags [.], ack 218491, win 65535, length 0
13:06:17.029497 IP 151.101.117.140.443 > 10.0.2.15.43280: Flags [P.], seq 218491:225361, ack 821, win 65535, length 6870
13:06:17.029514 IP 10.0.2.15.43280 > 151.101.117.140.443: Flags [.], ack 225361, win 65535, length 0
13:06:17.030533 IP 151.101.117.140.443 > 10.0.2.15.43280: Flags [P.], seq 225361:232231, ack 821, win 65535, length 6870
13:06:17.030551 IP 10.0.2.15.43280 > 151.101.117.140.443: Flags [.], ack 232231, win 65535, length 0
13:06:17.031595 IP 151.101.117.140.443 > 10.0.2.15.43280: Flags [P.], seq 232231:240475, ack 821, win 65535, length 8244
13:06:17.031610 IP 10.0.2.15.43280 > 151.101.117.140.443: Flags [.], ack 240475, win 65535, length 0
13:06:17.033655 IP 151.101.117.140.443 > 10.0.2.15.43280: Flags [P.], seq 240475:251467, ack 821, win 65535, length 10992
13:06:17.033674 IP 10.0.2.15.43280 > 151.101.117.140.443: Flags [.], ack 251467, win 65535, length 0
13:06:17.033844 IP 151.101.117.140.443 > 10.0.2.15.43280: Flags [P.], seq 251467:255589, ack 821, win 65535, length 4122
13:06:17.033855 IP 10.0.2.15.43280 > 151.101.117.140.443: Flags [.], ack 255589, win 65535, length 0
13:06:17.036095 IP 151.101.117.140.443 > 10.0.2.15.43280: Flags [P.], seq 255589:256807, ack 821, win 65535, length 1218
13:06:17.036115 IP 10.0.2.15.43280 > 151.101.117.140.443: Flags [.], ack 256807, win 65535, length 0
13:06:17.038315 IP 151.101.117.140.443 > 10.0.2.15.43280: Flags [P.], seq 256807:262303, ack 821, win 65535, length 5496
13:06:17.038332 IP 10.0.2.15.43280 > 151.101.117.140.443: Flags [.], ack 262303, win 65535, length 0
13:06:17.039369 IP 151.101.117.140.443 > 10.0.2.15.43280: Flags [P.], seq 262303:266425, ack 821, win 65535, length 4122
13:06:17.039385 IP 10.0.2.15.43280 > 151.101.117.140.443: Flags [.], ack 266425, win 65535, length 0
13:06:17.039523 IP 151.101.117.140.443 > 10.0.2.15.43280: Flags [P.], seq 266425:270547, ack 821, win 65535, length 4122
13:06:17.039569 IP 10.0.2.15.43280 > 151.101.117.140.443: Flags [.], ack 270547, win 65535, length 0
13:06:17.041985 IP 151.101.117.140.443 > 10.0.2.15.43280: Flags [P.], seq 270547:284403, ack 821, win 65535, length 13856
13:06:17.042008 IP 10.0.2.15.43280 > 151.101.117.140.443: Flags [.], ack 284403, win 65535, length 0
13:06:17.042402 IP 151.101.117.140.443 > 10.0.2.15.43280: Flags [P.], seq 284403:288525, ack 821, win 65535, length 4122
13:06:17.042505 IP 10.0.2.15.43280 > 151.101.117.140.443: Flags [.], ack 288525, win 65535, length 0
13:06:17.043583 IP 151.101.117.140.443 > 10.0.2.15.43280: Flags [P.], seq 288525:299517, ack 821, win 65535, length 10992
13:06:17.043600 IP 10.0.2.15.43280 > 151.101.117.140.443: Flags [.], ack 299517, win 65535, length 0
13:06:17.043863 IP 151.101.117.140.443 > 10.0.2.15.43280: Flags [P.], seq 299517:302265, ack 821, win 65535, length 2748
13:06:17.043897 IP 10.0.2.15.43280 > 151.101.117.140.443: Flags [.], ack 302265, win 65535, length 0
13:06:17.044578 IP 151.101.117.140.443 > 10.0.2.15.43280: Flags [P.], seq 302265:307761, ack 821, win 65535, length 5496
13:06:17.044592 IP 10.0.2.15.43280 > 151.101.117.140.443: Flags [.], ack 307761, win 65535, length 0
13:06:17.044776 IP 151.101.117.140.443 > 10.0.2.15.43280: Flags [P.], seq 307761:310509, ack 821, win 65535, length 2748
13:06:17.044787 IP 10.0.2.15.43280 > 151.101.117.140.443: Flags [.], ack 310509, win 65535, length 0
13:06:17.046054 IP 151.101.117.140.443 > 10.0.2.15.43280: Flags [P.], seq 310509:316005, ack 821, win 65535, length 5496
13:06:17.046069 IP 10.0.2.15.43280 > 151.101.117.140.443: Flags [.], ack 316005, win 65535, length 0
13:06:17.046858 IP 151.101.117.140.443 > 10.0.2.15.43280: Flags [P.], seq 316005:321501, ack 821, win 65535, length 5496
13:06:17.046877 IP 10.0.2.15.43280 > 151.101.117.140.443: Flags [.], ack 321501, win 65535, length 0
13:06:17.047207 IP 151.101.117.140.443 > 10.0.2.15.43280: Flags [P.], seq 321501:324249, ack 821, win 65535, length 2748
13:06:17.047221 IP 10.0.2.15.43280 > 151.101.117.140.443: Flags [.], ack 324249, win 65535, length 0
13:06:17.048878 IP 151.101.117.140.443 > 10.0.2.15.43280: Flags [P.], seq 324249:325463, ack 821, win 65535, length 1214
13:06:17.048893 IP 10.0.2.15.43280 > 151.101.117.140.443: Flags [.], ack 325463, win 65535, length 0
13:06:17.050127 IP 151.101.117.140.443 > 10.0.2.15.43280: Flags [P.], seq 325463:330959, ack 821, win 65535, length 5496
13:06:17.050145 IP 10.0.2.15.43280 > 151.101.117.140.443: Flags [.], ack 330959, win 65535, length 0
13:06:17.051520 IP 151.101.117.140.443 > 10.0.2.15.43280: Flags [P.], seq 330959:341951, ack 821, win 65535, length 10992
13:06:17.051543 IP 10.0.2.15.43280 > 151.101.117.140.443: Flags [.], ack 341951, win 65535, length 0
13:06:17.051858 IP 151.101.117.140.443 > 10.0.2.15.43280: Flags [P.], seq 341951:344699, ack 821, win 65535, length 2748
13:06:17.051874 IP 10.0.2.15.43280 > 151.101.117.140.443: Flags [.], ack 344699, win 65535, length 0
13:06:17.052835 IP 151.101.117.140.443 > 10.0.2.15.43280: Flags [P.], seq 344699:346073, ack 821, win 65535, length 1374
13:06:17.052851 IP 10.0.2.15.43280 > 151.101.117.140.443: Flags [.], ack 346073, win 65535, length 0
13:06:17.053442 IP 151.101.117.140.443 > 10.0.2.15.43280: Flags [P.], seq 346073:351569, ack 821, win 65535, length 5496
13:06:17.053458 IP 10.0.2.15.43280 > 151.101.117.140.443: Flags [.], ack 351569, win 65535, length 0
13:06:17.054547 IP 151.101.117.140.443 > 10.0.2.15.43280: Flags [P.], seq 351569:354317, ack 821, win 65535, length 2748
13:06:17.054565 IP 10.0.2.15.43280 > 151.101.117.140.443: Flags [.], ack 354317, win 65535, length 0
13:06:17.055620 IP 151.101.117.140.443 > 10.0.2.15.43280: Flags [P.], seq 354317:361187, ack 821, win 65535, length 6870
13:06:17.055640 IP 10.0.2.15.43280 > 151.101.117.140.443: Flags [.], ack 361187, win 65535, length 0
13:06:17.055781 IP 151.101.117.140.443 > 10.0.2.15.43280: Flags [P.], seq 361187:365309, ack 821, win 65535, length 4122
13:06:17.055798 IP 10.0.2.15.43280 > 151.101.117.140.443: Flags [.], ack 365309, win 65535, length 0
13:06:17.057103 IP 151.101.117.140.443 > 10.0.2.15.43280: Flags [P.], seq 365309:373553, ack 821, win 65535, length 8244
13:06:17.057118 IP 10.0.2.15.43280 > 151.101.117.140.443: Flags [.], ack 373553, win 65535, length 0
13:06:17.058056 IP 151.101.117.140.443 > 10.0.2.15.43280: Flags [P.], seq 373553:381797, ack 821, win 65535, length 8244
13:06:17.058190 IP 10.0.2.15.43280 > 151.101.117.140.443: Flags [.], ack 381797, win 65535, length 0
13:06:17.058325 IP 151.101.117.140.443 > 10.0.2.15.43280: Flags [P.], seq 381797:385919, ack 821, win 65535, length 4122
13:06:17.058333 IP 10.0.2.15.43280 > 151.101.117.140.443: Flags [.], ack 385919, win 65535, length 0
13:06:17.060297 IP 151.101.117.140.443 > 10.0.2.15.43280: Flags [P.], seq 385919:390041, ack 821, win 65535, length 4122
13:06:17.060319 IP 10.0.2.15.43280 > 151.101.117.140.443: Flags [.], ack 390041, win 65535, length 0
13:06:17.060586 IP 151.101.117.140.443 > 10.0.2.15.43280: Flags [P.], seq 390041:401033, ack 821, win 65535, length 10992
13:06:17.060599 IP 10.0.2.15.43280 > 151.101.117.140.443: Flags [.], ack 401033, win 65535, length 0
13:06:17.061763 IP 151.101.117.140.443 > 10.0.2.15.43280: Flags [P.], seq 401033:406529, ack 821, win 65535, length 5496
13:06:17.061785 IP 10.0.2.15.43280 > 151.101.117.140.443: Flags [.], ack 406529, win 65535, length 0
13:06:17.062506 IP 151.101.117.140.443 > 10.0.2.15.43280: Flags [P.], seq 406529:411796, ack 821, win 65535, length 5267
13:06:17.062521 IP 10.0.2.15.43280 > 151.101.117.140.443: Flags [.], ack 411796, win 65535, length 0
13:06:17.064972 IP 151.101.117.140.443 > 10.0.2.15.43280: Flags [P.], seq 411796:424162, ack 821, win 65535, length 12366
13:06:17.064992 IP 10.0.2.15.43280 > 151.101.117.140.443: Flags [.], ack 424162, win 65535, length 0
13:06:17.065124 IP 151.101.117.140.443 > 10.0.2.15.43280: Flags [P.], seq 424162:425536, ack 821, win 65535, length 1374
13:06:17.065133 IP 10.0.2.15.43280 > 151.101.117.140.443: Flags [.], ack 425536, win 65535, length 0
13:06:17.065961 IP 151.101.117.140.443 > 10.0.2.15.43280: Flags [P.], seq 425536:432406, ack 821, win 65535, length 6870
13:06:17.065984 IP 10.0.2.15.43280 > 151.101.117.140.443: Flags [.], ack 432406, win 65535, length 0
13:06:17.067099 IP 151.101.117.140.443 > 10.0.2.15.43280: Flags [P.], seq 432406:439276, ack 821, win 65535, length 6870
13:06:17.067121 IP 10.0.2.15.43280 > 151.101.117.140.443: Flags [.], ack 439276, win 65535, length 0
13:06:17.069501 IP 151.101.117.140.443 > 10.0.2.15.43280: Flags [P.], seq 439276:446146, ack 821, win 65535, length 6870
13:06:17.069569 IP 10.0.2.15.43280 > 151.101.117.140.443: Flags [.], ack 446146, win 65535, length 0
13:06:17.069690 IP 151.101.117.140.443 > 10.0.2.15.43280: Flags [P.], seq 446146:453016, ack 821, win 65535, length 6870
13:06:17.069698 IP 10.0.2.15.43280 > 151.101.117.140.443: Flags [.], ack 453016, win 65535, length 0
13:06:17.070274 IP 151.101.117.140.443 > 10.0.2.15.43280: Flags [P.], seq 453016:461260, ack 821, win 65535, length 8244
13:06:17.070291 IP 10.0.2.15.43280 > 151.101.117.140.443: Flags [.], ack 461260, win 65535, length 0
13:06:17.071506 IP 151.101.117.140.443 > 10.0.2.15.43280: Flags [P.], seq 461260:465382, ack 821, win 65535, length 4122
13:06:17.071522 IP 10.0.2.15.43280 > 151.101.117.140.443: Flags [.], ack 465382, win 65535, length 0
13:06:17.071714 IP 151.101.117.140.443 > 10.0.2.15.43280: Flags [P.], seq 465382:472252, ack 821, win 65535, length 6870
13:06:17.071767 IP 10.0.2.15.43280 > 151.101.117.140.443: Flags [.], ack 472252, win 65535, length 0
13:06:17.073031 IP 151.101.117.140.443 > 10.0.2.15.43280: Flags [P.], seq 472252:476374, ack 821, win 65535, length 4122
13:06:17.073043 IP 10.0.2.15.43280 > 151.101.117.140.443: Flags [.], ack 476374, win 65535, length 0
13:06:17.074441 IP 151.101.117.140.443 > 10.0.2.15.43280: Flags [P.], seq 476374:487366, ack 821, win 65535, length 10992
13:06:17.074462 IP 10.0.2.15.43280 > 151.101.117.140.443: Flags [.], ack 487366, win 65535, length 0
13:06:17.074660 IP 151.101.117.140.443 > 10.0.2.15.43280: Flags [P.], seq 487366:490114, ack 821, win 65535, length 2748
13:06:17.074670 IP 10.0.2.15.43280 > 151.101.117.140.443: Flags [.], ack 490114, win 65535, length 0
13:06:17.076832 IP 151.101.117.140.443 > 10.0.2.15.43280: Flags [P.], seq 490114:496984, ack 821, win 65535, length 6870
13:06:17.076852 IP 10.0.2.15.43280 > 151.101.117.140.443: Flags [.], ack 496984, win 65535, length 0
13:06:17.077116 IP 151.101.117.140.443 > 10.0.2.15.43280: Flags [P.], seq 496984:498358, ack 821, win 65535, length 1374
13:06:17.077125 IP 10.0.2.15.43280 > 151.101.117.140.443: Flags [.], ack 498358, win 65535, length 0
13:06:17.078770 IP 151.101.117.140.443 > 10.0.2.15.43280: Flags [P.], seq 498358:513472, ack 821, win 65535, length 15114
13:06:17.078786 IP 10.0.2.15.43280 > 151.101.117.140.443: Flags [.], ack 513472, win 65535, length 0
13:06:17.080287 IP 151.101.117.140.443 > 10.0.2.15.43280: Flags [P.], seq 513472:523090, ack 821, win 65535, length 9618
13:06:17.080303 IP 10.0.2.15.43280 > 151.101.117.140.443: Flags [.], ack 523090, win 65535, length 0
13:06:17.080400 IP 151.101.117.140.443 > 10.0.2.15.43280: Flags [P.], seq 523090:524464, ack 821, win 65535, length 1374
13:06:17.080408 IP 10.0.2.15.43280 > 151.101.117.140.443: Flags [.], ack 524464, win 65535, length 0
13:06:17.081287 IP 151.101.117.140.443 > 10.0.2.15.43280: Flags [P.], seq 524464:529960, ack 821, win 65535, length 5496
13:06:17.081345 IP 10.0.2.15.43280 > 151.101.117.140.443: Flags [.], ack 529960, win 65535, length 0
13:06:17.081613 IP 151.101.117.140.443 > 10.0.2.15.43280: Flags [P.], seq 529960:538204, ack 821, win 65535, length 8244
13:06:17.081626 IP 10.0.2.15.43280 > 151.101.117.140.443: Flags [.], ack 538204, win 65535, length 0
13:06:17.082082 IP 151.101.117.140.443 > 10.0.2.15.43280: Flags [P.], seq 538204:539578, ack 821, win 65535, length 1374
13:06:17.082099 IP 10.0.2.15.43280 > 151.101.117.140.443: Flags [.], ack 539578, win 65535, length 0
13:06:17.083054 IP 151.101.117.140.443 > 10.0.2.15.43280: Flags [P.], seq 539578:545074, ack 821, win 65535, length 5496
13:06:17.083070 IP 10.0.2.15.43280 > 151.101.117.140.443: Flags [.], ack 545074, win 65535, length 0
13:06:17.084156 IP 151.101.117.140.443 > 10.0.2.15.43280: Flags [P.], seq 545074:553318, ack 821, win 65535, length 8244
13:06:17.084275 IP 10.0.2.15.43280 > 151.101.117.140.443: Flags [.], ack 553318, win 65535, length 0
13:06:17.085091 IP 151.101.117.140.443 > 10.0.2.15.43280: Flags [P.], seq 553318:561562, ack 821, win 65535, length 8244
13:06:17.085113 IP 10.0.2.15.43280 > 151.101.117.140.443: Flags [.], ack 561562, win 65535, length 0
13:06:17.086440 IP 151.101.117.140.443 > 10.0.2.15.43280: Flags [P.], seq 561562:565684, ack 821, win 65535, length 4122
13:06:17.086455 IP 10.0.2.15.43280 > 151.101.117.140.443: Flags [.], ack 565684, win 65535, length 0
13:06:17.088298 IP 151.101.117.140.443 > 10.0.2.15.43280: Flags [P.], seq 565684:575302, ack 821, win 65535, length 9618
13:06:17.088317 IP 10.0.2.15.43280 > 151.101.117.140.443: Flags [.], ack 575302, win 65535, length 0
13:06:17.088595 IP 151.101.117.140.443 > 10.0.2.15.43280: Flags [P.], seq 575302:580798, ack 821, win 65535, length 5496
13:06:17.088606 IP 10.0.2.15.43280 > 151.101.117.140.443: Flags [.], ack 580798, win 65535, length 0
13:06:17.090225 IP 151.101.117.140.443 > 10.0.2.15.43280: Flags [P.], seq 580798:589042, ack 821, win 65535, length 8244
13:06:17.090244 IP 10.0.2.15.43280 > 151.101.117.140.443: Flags [.], ack 589042, win 65535, length 0
13:06:17.090507 IP 151.101.117.140.443 > 10.0.2.15.43280: Flags [P.], seq 589042:591790, ack 821, win 65535, length 2748
13:06:17.090519 IP 10.0.2.15.43280 > 151.101.117.140.443: Flags [.], ack 591790, win 65535, length 0
13:06:17.091400 IP 151.101.117.140.443 > 10.0.2.15.43280: Flags [P.], seq 591790:600034, ack 821, win 65535, length 8244
13:06:17.091506 IP 10.0.2.15.43280 > 151.101.117.140.443: Flags [.], ack 600034, win 65535, length 0
13:06:17.093554 IP 151.101.117.140.443 > 10.0.2.15.43280: Flags [P.], seq 600034:608278, ack 821, win 65535, length 8244
13:06:17.093573 IP 10.0.2.15.43280 > 151.101.117.140.443: Flags [.], ack 608278, win 65535, length 0
13:06:17.094531 IP 151.101.117.140.443 > 10.0.2.15.43280: Flags [P.], seq 608278:619270, ack 821, win 65535, length 10992
13:06:17.094548 IP 10.0.2.15.43280 > 151.101.117.140.443: Flags [.], ack 619270, win 65535, length 0
13:06:17.094735 IP 151.101.117.140.443 > 10.0.2.15.43280: Flags [P.], seq 619270:620644, ack 821, win 65535, length 1374
13:06:17.094744 IP 10.0.2.15.43280 > 151.101.117.140.443: Flags [.], ack 620644, win 65535, length 0
13:06:17.095673 IP 151.101.117.140.443 > 10.0.2.15.43280: Flags [P.], seq 620644:627514, ack 821, win 65535, length 6870
13:06:17.095689 IP 10.0.2.15.43280 > 151.101.117.140.443: Flags [.], ack 627514, win 65535, length 0
13:06:17.096816 IP 151.101.117.140.443 > 10.0.2.15.43280: Flags [P.], seq 627514:635758, ack 821, win 65535, length 8244
13:06:17.096852 IP 10.0.2.15.43280 > 151.101.117.140.443: Flags [.], ack 635758, win 65535, length 0
13:06:17.097013 IP 151.101.117.140.443 > 10.0.2.15.43280: Flags [P.], seq 635758:637132, ack 821, win 65535, length 1374
13:06:17.097031 IP 10.0.2.15.43280 > 151.101.117.140.443: Flags [.], ack 637132, win 65535, length 0
13:06:17.098183 IP 151.101.117.140.443 > 10.0.2.15.43280: Flags [P.], seq 637132:644002, ack 821, win 65535, length 6870
13:06:17.098197 IP 10.0.2.15.43280 > 151.101.117.140.443: Flags [.], ack 644002, win 65535, length 0
13:06:17.098906 IP 151.101.117.140.443 > 10.0.2.15.43280: Flags [P.], seq 644002:650872, ack 821, win 65535, length 6870
13:06:17.098922 IP 10.0.2.15.43280 > 151.101.117.140.443: Flags [.], ack 650872, win 65535, length 0
13:06:17.100218 IP 151.101.117.140.443 > 10.0.2.15.43280: Flags [P.], seq 650872:660490, ack 821, win 65535, length 9618
13:06:17.100235 IP 10.0.2.15.43280 > 151.101.117.140.443: Flags [.], ack 660490, win 65535, length 0
13:06:17.101325 IP 151.101.117.140.443 > 10.0.2.15.43280: Flags [P.], seq 660490:668734, ack 821, win 65535, length 8244
13:06:17.101352 IP 10.0.2.15.43280 > 151.101.117.140.443: Flags [.], ack 668734, win 65535, length 0
13:06:17.101482 IP 151.101.117.140.443 > 10.0.2.15.43280: Flags [P.], seq 668734:671482, ack 821, win 65535, length 2748
13:06:17.101492 IP 10.0.2.15.43280 > 151.101.117.140.443: Flags [.], ack 671482, win 65535, length 0
13:06:17.102880 IP 151.101.117.140.443 > 10.0.2.15.43280: Flags [P.], seq 671482:679726, ack 821, win 65535, length 8244
13:06:17.102894 IP 10.0.2.15.43280 > 151.101.117.140.443: Flags [.], ack 679726, win 65535, length 0
13:06:17.103382 IP 151.101.117.140.443 > 10.0.2.15.43280: Flags [P.], seq 679726:682474, ack 821, win 65535, length 2748
13:06:17.103393 IP 10.0.2.15.43280 > 151.101.117.140.443: Flags [.], ack 682474, win 65535, length 0
13:06:17.104428 IP 151.101.117.140.443 > 10.0.2.15.43280: Flags [P.], seq 682474:689344, ack 821, win 65535, length 6870
13:06:17.104445 IP 10.0.2.15.43280 > 151.101.117.140.443: Flags [.], ack 689344, win 65535, length 0
13:06:17.104682 IP 151.101.117.140.443 > 10.0.2.15.43280: Flags [P.], seq 689344:692092, ack 821, win 65535, length 2748
13:06:17.104692 IP 10.0.2.15.43280 > 151.101.117.140.443: Flags [.], ack 692092, win 65535, length 0

