13:05:55.105683 IP 151.101.117.140.443 > 10.0.2.15.43262: Flags [S.], seq 27648001, ack 756635357, win 65535, options [mss 1460], length 0
13:05:55.105730 IP 10.0.2.15.43262 > 151.101.117.140.443: Flags [.], ack 1, win 64240, length 0
13:05:55.113970 IP 10.0.2.15.43262 > 151.101.117.140.443: Flags [P.], seq 1:518, ack 1, win 64240, length 517
13:05:55.114475 IP 151.101.117.140.443 > 10.0.2.15.43262: Flags [.], ack 518, win 65535, length 0
13:05:55.131063 IP 151.101.117.140.443 > 10.0.2.15.43262: Flags [P.], seq 1:2749, ack 518, win 65535, length 2748
13:05:55.131085 IP 10.0.2.15.43262 > 151.101.117.140.443: Flags [.], ack 2749, win 62780, length 0
13:05:55.131799 IP 151.101.117.140.443 > 10.0.2.15.43262: Flags [P.], seq 2749:3722, ack 518, win 65535, length 973
13:05:55.131818 IP 10.0.2.15.43262 > 151.101.117.140.443: Flags [.], ack 3722, win 61807, length 0
13:05:55.132644 IP 10.0.2.15.43262 > 151.101.117.140.443: Flags [P.], seq 518:598, ack 3722, win 61807, length 80
13:05:55.132855 IP 10.0.2.15.43262 > 151.101.117.140.443: Flags [P.], seq 598:644, ack 3722, win 61807, length 46
13:05:55.132880 IP 10.0.2.15.43262 > 151.101.117.140.443: Flags [P.], seq 644:693, ack 3722, win 61807, length 49
13:05:55.133064 IP 151.101.117.140.443 > 10.0.2.15.43262: Flags [.], ack 598, win 65535, length 0
13:05:55.133066 IP 151.101.117.140.443 > 10.0.2.15.43262: Flags [.], ack 644, win 65535, length 0
13:05:55.133067 IP 151.101.117.140.443 > 10.0.2.15.43262: Flags [.], ack 693, win 65535, length 0
13:05:55.133102 IP 10.0.2.15.43262 > 151.101.117.140.443: Flags [P.], seq 693:728, ack 3722, win 61807, length 35
13:05:55.133231 IP 10.0.2.15.43262 > 151.101.117.140.443: Flags [P.], seq 728:790, ack 3722, win 61807, length 62
13:05:55.133560 IP 151.101.117.140.443 > 10.0.2.15.43262: Flags [.], ack 728, win 65535, length 0
13:05:55.133561 IP 151.101.117.140.443 > 10.0.2.15.43262: Flags [.], ack 790, win 65535, length 0
13:05:55.146962 IP 151.101.117.140.443 > 10.0.2.15.43262: Flags [P.], seq 3722:3803, ack 790, win 65535, length 81
13:05:55.146983 IP 10.0.2.15.43262 > 151.101.117.140.443: Flags [.], ack 3803, win 62780, length 0
13:05:55.147226 IP 10.0.2.15.43262 > 151.101.117.140.443: Flags [P.], seq 790:821, ack 3803, win 62780, length 31
13:05:55.147715 IP 151.101.117.140.443 > 10.0.2.15.43262: Flags [.], ack 821, win 65535, length 0
13:05:56.026628 IP 151.101.117.140.443 > 10.0.2.15.43262: Flags [P.], seq 3803:10673, ack 821, win 65535, length 6870
13:05:56.026669 IP 10.0.2.15.43262 > 151.101.117.140.443: Flags [.], ack 10673, win 59860, length 0
13:05:56.027710 IP 151.101.117.140.443 > 10.0.2.15.43262: Flags [P.], seq 10673:14795, ack 821, win 65535, length 4122
13:05:56.027725 IP 10.0.2.15.43262 > 151.101.117.140.443: Flags [.], ack 14795, win 61320, length 0
13:05:56.028781 IP 151.101.117.140.443 > 10.0.2.15.43262: Flags [P.], seq 14795:18917, ack 821, win 65535, length 4122
13:05:56.028797 IP 10.0.2.15.43262 > 151.101.117.140.443: Flags [.], ack 18917, win 61320, length 0
13:05:56.029806 IP 151.101.117.140.443 > 10.0.2.15.43262: Flags [P.], seq 18917:24413, ack 821, win 65535, length 5496
13:05:56.029822 IP 10.0.2.15.43262 > 151.101.117.140.443: Flags [.], ack 24413, win 61320, length 0
13:05:56.030817 IP 151.101.117.140.443 > 10.0.2.15.43262: Flags [P.], seq 24413:27161, ack 821, win 65535, length 2748
13:05:56.030833 IP 10.0.2.15.43262 > 151.101.117.140.443: Flags [.], ack 27161, win 62780, length 0
13:05:56.031788 IP 151.101.117.140.443 > 10.0.2.15.43262: Flags [P.], seq 27161:31283, ack 821, win 65535, length 4122
13:05:56.031802 IP 10.0.2.15.43262 > 151.101.117.140.443: Flags [.], ack 31283, win 61320, length 0
13:05:56.032149 IP 151.101.117.140.443 > 10.0.2.15.43262: Flags [P.], seq 31283:32657, ack 821, win 65535, length 1374
13:05:56.032160 IP 10.0.2.15.43262 > 151.101.117.140.443: Flags [.], ack 32657, win 62780, length 0
13:05:56.033493 IP 151.101.117.140.443 > 10.0.2.15.43262: Flags [P.], seq 32657:36779, ack 821, win 65535, length 4122
13:05:56.033510 IP 10.0.2.15.43262 > 151.101.117.140.443: Flags [.], ack 36779, win 61320, length 0
13:05:56.035512 IP 151.101.117.140.443 > 10.0.2.15.43262: Flags [P.], seq 36779:45023, ack 821, win 65535, length 8244
13:05:56.035531 IP 10.0.2.15.43262 > 151.101.117.140.443: Flags [.], ack 45023, win 58400, length 0
13:05:56.039768 IP 151.101.117.140.443 > 10.0.2.15.43262: Flags [P.], seq 45023:51893, ack 821, win 65535, length 6870
13:05:56.039853 IP 10.0.2.15.43262 > 151.101.117.140.443: Flags [.], ack 51893, win 59860, length 0
13:05:56.041162 IP 151.101.117.140.443 > 10.0.2.15.43262: Flags [P.], seq 51893:56015, ack 821, win 65535, length 4122
13:05:56.041184 IP 10.0.2.15.43262 > 151.101.117.140.443: Flags [.], ack 56015, win 61320, length 0
13:05:56.042045 IP 151.101.117.140.443 > 10.0.2.15.43262: Flags [P.], seq 56015:61511, ack 821, win 65535, length 5496
13:05:56.042069 IP 10.0.2.15.43262 > 151.101.117.140.443: Flags [.], ack 61511, win 61320, length 0
13:05:56.042740 IP 151.101.117.140.443 > 10.0.2.15.43262: Flags [P.], seq 61511:68381, ack 821, win 65535, length 6870
13:05:56.042762 IP 10.0.2.15.43262 > 151.101.117.140.443: Flags [.], ack 68381, win 55480, length 0
13:05:56.043825 IP 151.101.117.140.443 > 10.0.2.15.43262: Flags [P.], seq 68381:77999, ack 821, win 65535, length 9618
13:05:56.043839 IP 10.0.2.15.43262 > 151.101.117.140.443: Flags [.], ack 77999, win 65535, length 0
13:05:56.043959 IP 151.101.117.140.443 > 10.0.2.15.43262: Flags [P.], seq 77999:79373, ack 821, win 65535, length 1374
13:05:56.043965 IP 10.0.2.15.43262 > 151.101.117.140.443: Flags [.], ack 79373, win 65535, length 0
13:05:56.045128 IP 151.101.117.140.443 > 10.0.2.15.43262: Flags [P.], seq 79373:83495, ack 821, win 65535, length 4122
13:05:56.045143 IP 10.0.2.15.43262 > 151.101.117.140.443: Flags [.], ack 83495, win 65535, length 0
13:05:56.045842 IP 151.101.117.140.443 > 10.0.2.15.43262: Flags [P.], seq 83495:90365, ack 821, win 65535, length 6870
13:05:56.045866 IP 10.0.2.15.43262 > 151.101.117.140.443: Flags [.], ack 90365, win 65535, length 0
13:05:56.047892 IP 151.101.117.140.443 > 10.0.2.15.43262: Flags [P.], seq 90365:102731, ack 821, win 65535, length 12366
13:05:56.047911 IP 10.0.2.15.43262 > 151.101.117.140.443: Flags [.], ack 102731, win 65535, length 0
13:05:56.048158 IP 151.101.117.140.443 > 10.0.2.15.43262: Flags [P.], seq 102731:109601, ack 821, win 65535, length 6870
13:05:56.048173 IP 10.0.2.15.43262 > 151.101.117.140.443: Flags [.], ack 109601, win 65535, length 0
13:05:56.049737 IP 151.101.117.140.443 > 10.0.2.15.43262: Flags [P.], seq 109601:117845, ack 821, win 65535, length 8244
13:05:56.049739 IP 151.101.117.140.443 > 10.0.2.15.43262: Flags [P.], seq 117845:120593, ack 821, win 65535, length 2748
13:05:56.049755 IP 10.0.2.15.43262 > 151.101.117.140.443: Flags [.], ack 117845, win 65535, length 0
13:05:56.049785 IP 10.0.2.15.43262 > 151.101.117.140.443: Flags [.], ack 120593, win 65535, length 0
13:05:56.051289 IP 151.101.117.140.443 > 10.0.2.15.43262: Flags [P.], seq 120593:124715, ack 821, win 65535, length 4122
13:05:56.051292 IP 151.101.117.140.443 > 10.0.2.15.43262: Flags [P.], seq 124715:126089, ack 821, win 65535, length 1374
13:05:56.051310 IP 10.0.2.15.43262 > 151.101.117.140.443: Flags [.], ack 124715, win 65535, length 0
13:05:56.051340 IP 10.0.2.15.43262 > 151.101.117.140.443: Flags [.], ack 126089, win 65535, length 0
13:05:56.052201 IP 151.101.117.140.443 > 10.0.2.15.43262: Flags [P.], seq 126089:132959, ack 821, win 65535, length 6870
13:05:56.052219 IP 10.0.2.15.43262 > 151.101.117.140.443: Flags [.], ack 132959, win 65535, length 0
13:05:56.053284 IP 151.101.117.140.443 > 10.0.2.15.43262: Flags [P.], seq 132959:138455, ack 821, win 65535, length 5496
13:05:56.053299 IP 10.0.2.15.43262 > 151.101.117.140.443: Flags [.], ack 138455, win 65535, length 0
13:05:56.055616 IP 151.101.117.140.443 > 10.0.2.15.43262: Flags [P.], seq 138455:146699, ack 821, win 65535, length 8244
13:05:56.055619 IP 151.101.117.140.443 > 10.0.2.15.43262: Flags [P.], seq 146699:152195, ack 821, win 65535, length 5496
13:05:56.056144 IP 10.0.2.15.43262 > 151.101.117.140.443: Flags [.], ack 146699, win 65535, length 0
13:05:56.057026 IP 10.0.2.15.43262 > 151.101.117.140.443: Flags [.], ack 152195, win 65535, length 0
13:05:56.057097 IP 151.101.117.140.443 > 10.0.2.15.43262: Flags [P.], seq 152195:164561, ack 821, win 65535, length 12366
13:05:56.057114 IP 10.0.2.15.43262 > 151.101.117.140.443: Flags [.], ack 164561, win 65535, length 0
13:05:56.057818 IP 151.101.117.140.443 > 10.0.2.15.43262: Flags [P.], seq 164561:168683, ack 821, win 65535, length 4122
13:05:56.057916 IP 10.0.2.15.43262 > 151.101.117.140.443: Flags [.], ack 168683, win 65535, length 0
13:05:56.059810 IP 151.101.117.140.443 > 10.0.2.15.43262: Flags [P.], seq 168683:197806, ack 821, win 65535, length 29123
13:05:56.059877 IP 10.0.2.15.43262 > 151.101.117.140.443: Flags [.], ack 197806, win 65535, length 0
13:05:57.855793 IP 151.101.117.140.443 > 10.0.2.15.43262: Flags [.], seq 197806:199266, ack 821, win 65535, length 1460
13:05:57.855831 IP 10.0.2.15.43262 > 151.101.117.140.443: Flags [.], ack 199266, win 65535, length 0
13:05:57.857267 IP 151.101.117.140.443 > 10.0.2.15.43262: Flags [.], seq 199266:202186, ack 821, win 65535, length 2920
13:05:57.857370 IP 10.0.2.15.43262 > 151.101.117.140.443: Flags [.], ack 202186, win 65535, length 0
13:05:57.857644 IP 151.101.117.140.443 > 10.0.2.15.43262: Flags [.], seq 202186:206566, ack 821, win 65535, length 4380
13:05:57.857666 IP 10.0.2.15.43262 > 151.101.117.140.443: Flags [.], ack 206566, win 65535, length 0
13:05:57.859078 IP 151.101.117.140.443 > 10.0.2.15.43262: Flags [.], seq 206566:212406, ack 821, win 65535, length 5840
13:05:57.859132 IP 10.0.2.15.43262 > 151.101.117.140.443: Flags [.], ack 212406, win 65535, length 0
13:05:57.859547 IP 151.101.117.140.443 > 10.0.2.15.43262: Flags [.], seq 212406:219706, ack 821, win 65535, length 7300
13:05:57.859560 IP 10.0.2.15.43262 > 151.101.117.140.443: Flags [.], ack 219706, win 65535, length 0
13:05:57.859867 IP 151.101.117.140.443 > 10.0.2.15.43262: Flags [.], seq 219706:228466, ack 821, win 65535, length 8760
13:05:57.859883 IP 10.0.2.15.43262 > 151.101.117.140.443: Flags [.], ack 228466, win 65535, length 0
13:05:57.860077 IP 151.101.117.140.443 > 10.0.2.15.43262: Flags [.], seq 228466:235766, ack 821, win 65535, length 7300
13:05:57.860089 IP 10.0.2.15.43262 > 151.101.117.140.443: Flags [.], ack 235766, win 65535, length 0
13:05:57.860246 IP 151.101.117.140.443 > 10.0.2.15.43262: Flags [.], seq 235766:238686, ack 821, win 65535, length 2920
13:05:57.860254 IP 10.0.2.15.43262 > 151.101.117.140.443: Flags [.], ack 238686, win 65535, length 0
13:05:57.860460 IP 151.101.117.140.443 > 10.0.2.15.43262: Flags [.], seq 238686:251826, ack 821, win 65535, length 13140
13:05:57.860474 IP 10.0.2.15.43262 > 151.101.117.140.443: Flags [.], ack 251826, win 65535, length 0
13:05:57.860887 IP 151.101.117.140.443 > 10.0.2.15.43262: Flags [.], seq 251826:266426, ack 821, win 65535, length 14600
13:05:57.860900 IP 10.0.2.15.43262 > 151.101.117.140.443: Flags [.], ack 266426, win 65535, length 0
13:05:57.861318 IP 151.101.117.140.443 > 10.0.2.15.43262: Flags [.], seq 266426:282486, ack 821, win 65535, length 16060
13:05:57.861333 IP 10.0.2.15.43262 > 151.101.117.140.443: Flags [.], ack 282486, win 65535, length 0
13:05:57.861788 IP 151.101.117.140.443 > 10.0.2.15.43262: Flags [.], seq 282486:300006, ack 821, win 65535, length 17520
13:05:57.861803 IP 10.0.2.15.43262 > 151.101.117.140.443: Flags [.], ack 300006, win 65535, length 0
13:05:57.862072 IP 151.101.117.140.443 > 10.0.2.15.43262: Flags [.], seq 300006:311686, ack 821, win 65535, length 11680
13:05:57.862122 IP 10.0.2.15.43262 > 151.101.117.140.443: Flags [.], ack 311686, win 65535, length 0
13:05:57.862559 IP 151.101.117.140.443 > 10.0.2.15.43262: Flags [.], seq 311686:326286, ack 821, win 65535, length 14600
13:05:57.862571 IP 10.0.2.15.43262 > 151.101.117.140.443: Flags [.], ack 326286, win 65535, length 0
13:05:57.862757 IP 151.101.117.140.443 > 10.0.2.15.43262: Flags [.], seq 326286:332126, ack 821, win 65535, length 5840
13:05:57.862767 IP 10.0.2.15.43262 > 151.101.117.140.443: Flags [.], ack 332126, win 65535, length 0
13:05:57.862932 IP 151.101.117.140.443 > 10.0.2.15.43262: Flags [.], seq 332126:355486, ack 821, win 65535, length 23360
13:05:57.862940 IP 10.0.2.15.43262 > 151.101.117.140.443: Flags [.], ack 355486, win 65535, length 0
13:05:57.863236 IP 151.101.117.140.443 > 10.0.2.15.43262: Flags [.], seq 355486:370086, ack 821, win 65535, length 14600
13:05:57.863251 IP 10.0.2.15.43262 > 151.101.117.140.443: Flags [.], ack 370086, win 65535, length 0
13:05:57.863433 IP 151.101.117.140.443 > 10.0.2.15.43262: Flags [P.], seq 370086:379825, ack 821, win 65535, length 9739
13:05:57.863442 IP 10.0.2.15.43262 > 151.101.117.140.443: Flags [.], ack 379825, win 65535, length 0
13:05:57.863761 IP 151.101.117.140.443 > 10.0.2.15.43262: Flags [P.], seq 379825:387988, ack 821, win 65535, length 8163
13:05:57.863770 IP 10.0.2.15.43262 > 151.101.117.140.443: Flags [.], ack 387988, win 65535, length 0
13:05:57.863890 IP 151.101.117.140.443 > 10.0.2.15.43262: Flags [P.], seq 387988:393484, ack 821, win 65535, length 5496
13:05:57.863901 IP 10.0.2.15.43262 > 151.101.117.140.443: Flags [.], ack 393484, win 65535, length 0
13:05:57.864315 IP 151.101.117.140.443 > 10.0.2.15.43262: Flags [P.], seq 393484:398980, ack 821, win 65535, length 5496
13:05:57.864341 IP 10.0.2.15.43262 > 151.101.117.140.443: Flags [.], ack 398980, win 65535, length 0
13:05:57.864735 IP 151.101.117.140.443 > 10.0.2.15.43262: Flags [P.], seq 398980:401641, ack 821, win 65535, length 2661
13:05:57.864745 IP 10.0.2.15.43262 > 151.101.117.140.443: Flags [.], ack 401641, win 65535, length 0
13:05:57.865077 IP 151.101.117.140.443 > 10.0.2.15.43262: Flags [P.], seq 401641:409885, ack 821, win 65535, length 8244
13:05:57.865089 IP 10.0.2.15.43262 > 151.101.117.140.443: Flags [.], ack 409885, win 65535, length 0
13:05:57.865526 IP 151.101.117.140.443 > 10.0.2.15.43262: Flags [P.], seq 409885:419503, ack 821, win 65535, length 9618
13:05:57.865541 IP 10.0.2.15.43262 > 151.101.117.140.443: Flags [.], ack 419503, win 65535, length 0
13:05:57.865837 IP 151.101.117.140.443 > 10.0.2.15.43262: Flags [P.], seq 419503:427873, ack 821, win 65535, length 8370
13:05:57.865856 IP 10.0.2.15.43262 > 151.101.117.140.443: Flags [.], ack 427873, win 65535, length 0
13:05:57.866935 IP 151.101.117.140.443 > 10.0.2.15.43262: Flags [P.], seq 427873:429247, ack 821, win 65535, length 1374
13:05:57.866952 IP 10.0.2.15.43262 > 151.101.117.140.443: Flags [.], ack 429247, win 65535, length 0
13:05:57.869582 IP 151.101.117.140.443 > 10.0.2.15.43262: Flags [P.], seq 429247:433369, ack 821, win 65535, length 4122
13:05:57.869643 IP 10.0.2.15.43262 > 151.101.117.140.443: Flags [.], ack 433369, win 65535, length 0
13:05:57.869828 IP 151.101.117.140.443 > 10.0.2.15.43262: Flags [P.], seq 433369:445735, ack 821, win 65535, length 12366
13:05:57.869840 IP 10.0.2.15.43262 > 151.101.117.140.443: Flags [.], ack 445735, win 65535, length 0
13:05:57.870292 IP 151.101.117.140.443 > 10.0.2.15.43262: Flags [P.], seq 445735:452605, ack 821, win 65535, length 6870
13:05:57.870305 IP 10.0.2.15.43262 > 151.101.117.140.443: Flags [.], ack 452605, win 65535, length 0
13:05:57.870666 IP 151.101.117.140.443 > 10.0.2.15.43262: Flags [P.], seq 452605:463597, ack 821, win 65535, length 10992
13:05:57.870799 IP 10.0.2.15.43262 > 151.101.117.140.443: Flags [.], ack 463597, win 65535, length 0
13:05:57.871009 IP 151.101.117.140.443 > 10.0.2.15.43262: Flags [P.], seq 463597:469093, ack 821, win 65535, length 5496
13:05:57.871021 IP 10.0.2.15.43262 > 151.101.117.140.443: Flags [.], ack 469093, win 65535, length 0
13:05:57.872076 IP 151.101.117.140.443 > 10.0.2.15.43262: Flags [P.], seq 469093:475963, ack 821, win 65535, length 6870
13:05:57.872094 IP 10.0.2.15.43262 > 151.101.117.140.443: Flags [.], ack 475963, win 65535, length 0
13:05:57.873176 IP 151.101.117.140.443 > 10.0.2.15.43262: Flags [P.], seq 475963:481459, ack 821, win 65535, length 5496
13:05:57.873195 IP 10.0.2.15.43262 > 151.101.117.140.443: Flags [.], ack 481459, win 65535, length 0
13:05:57.873652 IP 151.101.117.140.443 > 10.0.2.15.43262: Flags [P.], seq 481459:493825, ack 821, win 65535, length 12366
13:05:57.873666 IP 10.0.2.15.43262 > 151.101.117.140.443: Flags [.], ack 493825, win 65535, length 0
13:05:57.874042 IP 151.101.117.140.443 > 10.0.2.15.43262: Flags [P.], seq 493825:495199, ack 821, win 65535, length 1374
13:05:57.874054 IP 10.0.2.15.43262 > 151.101.117.140.443: Flags [.], ack 495199, win 65535, length 0
13:05:57.874773 IP 151.101.117.140.443 > 10.0.2.15.43262: Flags [P.], seq 495199:502069, ack 821, win 65535, length 6870
13:05:57.874777 IP 151.101.117.140.443 > 10.0.2.15.43262: Flags [.], seq 502069:506449, ack 821, win 65535, length 4380
13:05:57.874797 IP 10.0.2.15.43262 > 151.101.117.140.443: Flags [.], ack 502069, win 65535, length 0
13:05:57.874901 IP 10.0.2.15.43262 > 151.101.117.140.443: Flags [.], ack 506449, win 65535, length 0
13:05:57.875172 IP 151.101.117.140.443 > 10.0.2.15.43262: Flags [P.], seq 506449:508939, ack 821, win 65535, length 2490
13:05:57.875175 IP 151.101.117.140.443 > 10.0.2.15.43262: Flags [P.], seq 508939:517183, ack 821, win 65535, length 8244
13:05:57.875189 IP 10.0.2.15.43262 > 151.101.117.140.443: Flags [.], ack 508939, win 65535, length 0
13:05:57.875206 IP 10.0.2.15.43262 > 151.101.117.140.443: Flags [.], ack 517183, win 65535, length 0
13:05:57.876276 IP 151.101.117.140.443 > 10.0.2.15.43262: Flags [P.], seq 517183:522989, ack 821, win 65535, length 5806
13:05:57.876295 IP 10.0.2.15.43262 > 151.101.117.140.443: Flags [.], ack 522989, win 65535, length 0
13:05:57.876999 IP 151.101.117.140.443 > 10.0.2.15.43262: Flags [.], seq 522989:531749, ack 821, win 65535, length 8760
13:05:57.877020 IP 10.0.2.15.43262 > 151.101.117.140.443: Flags [.], ack 531749, win 65535, length 0
13:05:57.877302 IP 151.101.117.140.443 > 10.0.2.15.43262: Flags [P.], seq 531749:538044, ack 821, win 65535, length 6295
13:05:57.877304 IP 151.101.117.140.443 > 10.0.2.15.43262: Flags [P.], seq 538044:540792, ack 821, win 65535, length 2748
13:05:57.877320 IP 10.0.2.15.43262 > 151.101.117.140.443: Flags [.], ack 538044, win 65535, length 0
13:05:57.878030 IP 10.0.2.15.43262 > 151.101.117.140.443: Flags [.], ack 540792, win 65535, length 0
13:05:57.879095 IP 151.101.117.140.443 > 10.0.2.15.43262: Flags [P.], seq 540792:554482, ack 821, win 65535, length 13690
13:05:57.879112 IP 10.0.2.15.43262 > 151.101.117.140.443: Flags [.], ack 554482, win 65535, length 0
13:05:57.879153 IP 151.101.117.140.443 > 10.0.2.15.43262: Flags [P.], seq 554482:566848, ack 821, win 65535, length 12366
13:05:57.879158 IP 10.0.2.15.43262 > 151.101.117.140.443: Flags [.], ack 566848, win 65535, length 0
13:05:57.879400 IP 151.101.117.140.443 > 10.0.2.15.43262: Flags [P.], seq 566848:580246, ack 821, win 65535, length 13398
13:05:57.879406 IP 10.0.2.15.43262 > 151.101.117.140.443: Flags [.], ack 580246, win 65535, length 0
13:05:57.880523 IP 151.101.117.140.443 > 10.0.2.15.43262: Flags [P.], seq 580246:588490, ack 821, win 65535, length 8244
13:05:57.880539 IP 10.0.2.15.43262 > 151.101.117.140.443: Flags [.], ack 588490, win 65535, length 0
13:05:57.880708 IP 151.101.117.140.443 > 10.0.2.15.43262: Flags [P.], seq 588490:592612, ack 821, win 65535, length 4122
13:05:57.880720 IP 10.0.2.15.43262 > 151.101.117.140.443: Flags [.], ack 592612, win 65535, length 0
13:05:57.881170 IP 151.101.117.140.443 > 10.0.2.15.43262: Flags [P.], seq 592612:602230, ack 821, win 65535, length 9618
13:05:57.881187 IP 10.0.2.15.43262 > 151.101.117.140.443: Flags [.], ack 602230, win 65535, length 0
13:05:57.881732 IP 151.101.117.140.443 > 10.0.2.15.43262: Flags [P.], seq 602230:607726, ack 821, win 65535, length 5496
13:05:57.881752 IP 10.0.2.15.43262 > 151.101.117.140.443: Flags [.], ack 607726, win 65535, length 0
13:05:57.882749 IP 151.101.117.140.443 > 10.0.2.15.43262: Flags [P.], seq 607726:618718, ack 821, win 65535, length 10992
13:05:57.882834 IP 10.0.2.15.43262 > 151.101.117.140.443: Flags [.], ack 618718, win 65535, length 0
13:05:57.882939 IP 151.101.117.140.443 > 10.0.2.15.43262: Flags [P.], seq 618718:620092, ack 821, win 65535, length 1374
13:05:57.882949 IP 10.0.2.15.43262 > 151.101.117.140.443: Flags [.], ack 620092, win 65535, length 0
13:05:57.883240 IP 151.101.117.140.443 > 10.0.2.15.43262: Flags [.], seq 620092:625932, ack 821, win 65535, length 5840
13:05:57.883408 IP 151.101.117.140.443 > 10.0.2.15.43262: Flags [P.], seq 625932:632548, ack 821, win 65535, length 6616
13:05:57.883554 IP 10.0.2.15.43262 > 151.101.117.140.443: Flags [.], ack 632548, win 65535, length 0
13:05:57.888299 IP 151.101.117.140.443 > 10.0.2.15.43262: Flags [P.], seq 632548:643540, ack 821, win 65535, length 10992
13:05:57.888321 IP 10.0.2.15.43262 > 151.101.117.140.443: Flags [.], ack 643540, win 65535, length 0
13:05:57.888504 IP 151.101.117.140.443 > 10.0.2.15.43262: Flags [.], seq 643540:645000, ack 821, win 65535, length 1460
13:05:57.888515 IP 10.0.2.15.43262 > 151.101.117.140.443: Flags [.], ack 645000, win 65535, length 0
13:05:57.888644 IP 151.101.117.140.443 > 10.0.2.15.43262: Flags [P.], seq 645000:648978, ack 821, win 65535, length 3978
13:05:57.888651 IP 10.0.2.15.43262 > 151.101.117.140.443: Flags [.], ack 648978, win 65535, length 0
13:05:57.888994 IP 151.101.117.140.443 > 10.0.2.15.43262: Flags [P.], seq 648978:662718, ack 821, win 65535, length 13740
13:05:57.889009 IP 10.0.2.15.43262 > 151.101.117.140.443: Flags [.], ack 662718, win 65535, length 0
13:05:57.889295 IP 151.101.117.140.443 > 10.0.2.15.43262: Flags [P.], seq 662718:670904, ack 821, win 65535, length 8186
13:05:57.889308 IP 10.0.2.15.43262 > 151.101.117.140.443: Flags [.], ack 670904, win 65535, length 0
13:05:57.889578 IP 151.101.117.140.443 > 10.0.2.15.43262: Flags [P.], seq 670904:677774, ack 821, win 65535, length 6870
13:05:57.889588 IP 10.0.2.15.43262 > 151.101.117.140.443: Flags [.], ack 677774, win 65535, length 0
13:05:57.889821 IP 151.101.117.140.443 > 10.0.2.15.43262: Flags [P.], seq 677774:679148, ack 821, win 65535, length 1374
13:05:57.889829 IP 10.0.2.15.43262 > 151.101.117.140.443: Flags [.], ack 679148, win 65535, length 0
13:05:57.891036 IP 151.101.117.140.443 > 10.0.2.15.43262: Flags [P.], seq 679148:688715, ack 821, win 65535, length 9567
13:05:57.891052 IP 10.0.2.15.43262 > 151.101.117.140.443: Flags [.], ack 688715, win 65535, length 0
13:05:57.891393 IP 151.101.117.140.443 > 10.0.2.15.43262: Flags [P.], seq 688715:692837, ack 821, win 65535, length 4122
13:05:57.891404 IP 10.0.2.15.43262 > 151.101.117.140.443: Flags [.], ack 692837, win 65535, length 0

