20:04:52.724944 IP 10.0.2.15.47098 > 140.233.253.2.53: 9169+ A? www.reddit.com. (32)
20:04:52.724979 IP 10.0.2.15.47098 > 140.233.253.2.53: 13268+ AAAA? www.reddit.com. (32)
20:04:52.729391 IP 140.233.253.2.53 > 10.0.2.15.47098: 9169 2/0/0 CNAME reddit.map.fastly.net., A 151.101.117.140 (83)
20:04:52.729617 IP 140.233.253.2.53 > 10.0.2.15.47098: 13268 1/1/0 CNAME reddit.map.fastly.net. (125)
20:04:52.732549 IP 10.0.2.15.53144 > 151.101.117.140.443: Flags [S], seq 2777228375, win 64240, options [mss 1460,sackOK,TS val 3623781916 ecr 0,nop,wscale 6], length 0
20:04:52.747867 IP 151.101.117.140.443 > 10.0.2.15.53144: Flags [S.], seq 225152001, ack 2777228376, win 65535, options [mss 1460], length 0
20:04:52.747904 IP 10.0.2.15.53144 > 151.101.117.140.443: Flags [.], ack 1, win 64240, length 0
20:04:52.756245 IP 10.0.2.15.53144 > 151.101.117.140.443: Flags [P.], seq 1:518, ack 1, win 64240, length 517
20:04:52.756625 IP 151.101.117.140.443 > 10.0.2.15.53144: Flags [.], ack 518, win 65535, length 0
20:04:52.774640 IP 151.101.117.140.443 > 10.0.2.15.53144: Flags [P.], seq 1:1375, ack 518, win 65535, length 1374
20:04:52.774659 IP 10.0.2.15.53144 > 151.101.117.140.443: Flags [.], ack 1375, win 63204, length 0
20:04:52.775921 IP 151.101.117.140.443 > 10.0.2.15.53144: Flags [P.], seq 1375:3722, ack 518, win 65535, length 2347
20:04:52.775936 IP 10.0.2.15.53144 > 151.101.117.140.443: Flags [.], ack 3722, win 63204, length 0
20:04:52.776913 IP 10.0.2.15.53144 > 151.101.117.140.443: Flags [P.], seq 518:598, ack 3722, win 63204, length 80
20:04:52.777277 IP 151.101.117.140.443 > 10.0.2.15.53144: Flags [.], ack 598, win 65535, length 0
20:04:52.777505 IP 10.0.2.15.53144 > 151.101.117.140.443: Flags [P.], seq 598:644, ack 3722, win 63204, length 46
20:04:52.777571 IP 10.0.2.15.53144 > 151.101.117.140.443: Flags [P.], seq 644:693, ack 3722, win 63204, length 49
20:04:52.777714 IP 10.0.2.15.53144 > 151.101.117.140.443: Flags [P.], seq 693:728, ack 3722, win 63204, length 35
20:04:52.777766 IP 151.101.117.140.443 > 10.0.2.15.53144: Flags [.], ack 644, win 65535, length 0
20:04:52.777767 IP 151.101.117.140.443 > 10.0.2.15.53144: Flags [.], ack 693, win 65535, length 0
20:04:52.777845 IP 10.0.2.15.53144 > 151.101.117.140.443: Flags [P.], seq 728:790, ack 3722, win 63204, length 62
20:04:52.777921 IP 151.101.117.140.443 > 10.0.2.15.53144: Flags [.], ack 728, win 65535, length 0
20:04:52.778015 IP 151.101.117.140.443 > 10.0.2.15.53144: Flags [.], ack 790, win 65535, length 0
20:04:52.790856 IP 151.101.117.140.443 > 10.0.2.15.53144: Flags [P.], seq 3722:3772, ack 790, win 65535, length 50
20:04:52.790919 IP 10.0.2.15.53144 > 151.101.117.140.443: Flags [.], ack 3772, win 63204, length 0
20:04:52.791186 IP 10.0.2.15.53144 > 151.101.117.140.443: Flags [P.], seq 790:821, ack 3772, win 63204, length 31
20:04:52.791704 IP 151.101.117.140.443 > 10.0.2.15.53144: Flags [.], ack 821, win 65535, length 0
20:04:52.791706 IP 151.101.117.140.443 > 10.0.2.15.53144: Flags [P.], seq 3772:3803, ack 821, win 65535, length 31
20:04:52.791728 IP 10.0.2.15.53144 > 151.101.117.140.443: Flags [.], ack 3803, win 63204, length 0
20:04:53.084726 IP 151.101.117.140.443 > 10.0.2.15.53144: Flags [P.], seq 3803:9299, ack 821, win 65535, length 5496
20:04:53.084729 IP 151.101.117.140.443 > 10.0.2.15.53144: Flags [.], seq 9299:12219, ack 821, win 65535, length 2920
20:04:53.085117 IP 10.0.2.15.53144 > 151.101.117.140.443: Flags [.], ack 9299, win 61320, length 0
20:04:53.085227 IP 10.0.2.15.53144 > 151.101.117.140.443: Flags [.], ack 12219, win 58400, length 0
20:04:53.085540 IP 151.101.117.140.443 > 10.0.2.15.53144: Flags [P.], seq 12219:23039, ack 821, win 65535, length 10820
20:04:53.085553 IP 10.0.2.15.53144 > 151.101.117.140.443: Flags [.], ack 23039, win 51100, length 0
20:04:53.085783 IP 151.101.117.140.443 > 10.0.2.15.53144: Flags [P.], seq 23039:27161, ack 821, win 65535, length 4122
20:04:53.085784 IP 151.101.117.140.443 > 10.0.2.15.53144: Flags [P.], seq 27161:28535, ack 821, win 65535, length 1374
20:04:53.085796 IP 10.0.2.15.53144 > 151.101.117.140.443: Flags [.], ack 27161, win 48180, length 0
20:04:53.085839 IP 10.0.2.15.53144 > 151.101.117.140.443: Flags [.], ack 28535, win 46806, length 0
20:04:53.085994 IP 151.101.117.140.443 > 10.0.2.15.53144: Flags [P.], seq 28535:29909, ack 821, win 65535, length 1374
20:04:53.086008 IP 10.0.2.15.53144 > 151.101.117.140.443: Flags [.], ack 29909, win 46806, length 0
20:04:53.086278 IP 151.101.117.140.443 > 10.0.2.15.53144: Flags [P.], seq 29909:32657, ack 821, win 65535, length 2748
20:04:53.086279 IP 151.101.117.140.443 > 10.0.2.15.53144: Flags [P.], seq 32657:34031, ack 821, win 65535, length 1374
20:04:53.086292 IP 10.0.2.15.53144 > 151.101.117.140.443: Flags [.], ack 32657, win 44058, length 0
20:04:53.086350 IP 10.0.2.15.53144 > 151.101.117.140.443: Flags [.], ack 34031, win 44058, length 0
20:04:53.086714 IP 151.101.117.140.443 > 10.0.2.15.53144: Flags [P.], seq 34031:36779, ack 821, win 65535, length 2748
20:04:53.086716 IP 151.101.117.140.443 > 10.0.2.15.53144: Flags [P.], seq 36779:38153, ack 821, win 65535, length 1374
20:04:53.086717 IP 151.101.117.140.443 > 10.0.2.15.53144: Flags [P.], seq 38153:40901, ack 821, win 65535, length 2748
20:04:53.086734 IP 10.0.2.15.53144 > 151.101.117.140.443: Flags [.], ack 36779, win 41310, length 0
20:04:53.086816 IP 10.0.2.15.53144 > 151.101.117.140.443: Flags [.], ack 38153, win 40880, length 0
20:04:53.086960 IP 10.0.2.15.53144 > 151.101.117.140.443: Flags [.], ack 40901, win 38132, length 0
20:04:53.087093 IP 151.101.117.140.443 > 10.0.2.15.53144: Flags [P.], seq 40901:45023, ack 821, win 65535, length 4122
20:04:53.087101 IP 10.0.2.15.53144 > 151.101.117.140.443: Flags [.], ack 45023, win 35040, length 0
20:04:53.100635 IP 151.101.117.140.443 > 10.0.2.15.53144: Flags [P.], seq 45023:49145, ack 821, win 65535, length 4122
20:04:53.100657 IP 10.0.2.15.53144 > 151.101.117.140.443: Flags [.], ack 49145, win 61320, length 0
20:04:53.101333 IP 151.101.117.140.443 > 10.0.2.15.53144: Flags [P.], seq 49145:51893, ack 821, win 65535, length 2748
20:04:53.101348 IP 10.0.2.15.53144 > 151.101.117.140.443: Flags [.], ack 51893, win 62780, length 0
20:04:53.102875 IP 151.101.117.140.443 > 10.0.2.15.53144: Flags [P.], seq 51893:56015, ack 821, win 65535, length 4122
20:04:53.102898 IP 10.0.2.15.53144 > 151.101.117.140.443: Flags [.], ack 56015, win 61320, length 0
20:04:53.103660 IP 151.101.117.140.443 > 10.0.2.15.53144: Flags [P.], seq 56015:58763, ack 821, win 65535, length 2748
20:04:53.103674 IP 10.0.2.15.53144 > 151.101.117.140.443: Flags [.], ack 58763, win 59860, length 0
20:04:53.105013 IP 151.101.117.140.443 > 10.0.2.15.53144: Flags [P.], seq 58763:60137, ack 821, win 65535, length 1374
20:04:53.105115 IP 10.0.2.15.53144 > 151.101.117.140.443: Flags [.], ack 60137, win 62780, length 0
20:04:53.105818 IP 151.101.117.140.443 > 10.0.2.15.53144: Flags [P.], seq 60137:61511, ack 821, win 65535, length 1374
20:04:53.106845 IP 151.101.117.140.443 > 10.0.2.15.53144: Flags [P.], seq 61511:62885, ack 821, win 65535, length 1374
20:04:53.106859 IP 10.0.2.15.53144 > 151.101.117.140.443: Flags [.], ack 62885, win 62780, length 0
20:04:53.107927 IP 151.101.117.140.443 > 10.0.2.15.53144: Flags [P.], seq 62885:65633, ack 821, win 65535, length 2748
20:04:53.107940 IP 10.0.2.15.53144 > 151.101.117.140.443: Flags [.], ack 65633, win 62780, length 0
20:04:53.110073 IP 151.101.117.140.443 > 10.0.2.15.53144: Flags [P.], seq 65633:68381, ack 821, win 65535, length 2748
20:04:53.110088 IP 10.0.2.15.53144 > 151.101.117.140.443: Flags [.], ack 68381, win 65535, length 0
20:04:53.112167 IP 151.101.117.140.443 > 10.0.2.15.53144: Flags [P.], seq 68381:71129, ack 821, win 65535, length 2748
20:04:53.112183 IP 10.0.2.15.53144 > 151.101.117.140.443: Flags [.], ack 71129, win 65535, length 0
20:04:53.113204 IP 151.101.117.140.443 > 10.0.2.15.53144: Flags [P.], seq 71129:73877, ack 821, win 65535, length 2748
20:04:53.113219 IP 10.0.2.15.53144 > 151.101.117.140.443: Flags [.], ack 73877, win 65535, length 0
20:04:53.115349 IP 151.101.117.140.443 > 10.0.2.15.53144: Flags [P.], seq 73877:77999, ack 821, win 65535, length 4122
20:04:53.115364 IP 10.0.2.15.53144 > 151.101.117.140.443: Flags [.], ack 77999, win 65535, length 0
20:04:53.117451 IP 151.101.117.140.443 > 10.0.2.15.53144: Flags [P.], seq 77999:80747, ack 821, win 65535, length 2748
20:04:53.117464 IP 10.0.2.15.53144 > 151.101.117.140.443: Flags [.], ack 80747, win 65535, length 0
20:04:53.118471 IP 151.101.117.140.443 > 10.0.2.15.53144: Flags [P.], seq 80747:82121, ack 821, win 65535, length 1374
20:04:53.118489 IP 10.0.2.15.53144 > 151.101.117.140.443: Flags [.], ack 82121, win 65535, length 0
20:04:53.119826 IP 151.101.117.140.443 > 10.0.2.15.53144: Flags [P.], seq 82121:83495, ack 821, win 65535, length 1374
20:04:53.119849 IP 10.0.2.15.53144 > 151.101.117.140.443: Flags [.], ack 83495, win 65535, length 0
20:04:53.120828 IP 151.101.117.140.443 > 10.0.2.15.53144: Flags [P.], seq 83495:86243, ack 821, win 65535, length 2748
20:04:53.120830 IP 151.101.117.140.443 > 10.0.2.15.53144: Flags [P.], seq 86243:87617, ack 821, win 65535, length 1374
20:04:53.120849 IP 10.0.2.15.53144 > 151.101.117.140.443: Flags [.], ack 86243, win 65535, length 0
20:04:53.120918 IP 10.0.2.15.53144 > 151.101.117.140.443: Flags [.], ack 87617, win 65535, length 0
20:04:53.123085 IP 151.101.117.140.443 > 10.0.2.15.53144: Flags [P.], seq 87617:91739, ack 821, win 65535, length 4122
20:04:53.123139 IP 10.0.2.15.53144 > 151.101.117.140.443: Flags [.], ack 91739, win 65535, length 0
20:04:53.124071 IP 151.101.117.140.443 > 10.0.2.15.53144: Flags [P.], seq 91739:93113, ack 821, win 65535, length 1374
20:04:53.124086 IP 10.0.2.15.53144 > 151.101.117.140.443: Flags [.], ack 93113, win 65535, length 0
20:04:53.125553 IP 151.101.117.140.443 > 10.0.2.15.53144: Flags [P.], seq 93113:98609, ack 821, win 65535, length 5496
20:04:53.125574 IP 10.0.2.15.53144 > 151.101.117.140.443: Flags [.], ack 98609, win 65535, length 0
20:04:53.126529 IP 151.101.117.140.443 > 10.0.2.15.53144: Flags [P.], seq 98609:101357, ack 821, win 65535, length 2748
20:04:53.126591 IP 10.0.2.15.53144 > 151.101.117.140.443: Flags [.], ack 101357, win 65535, length 0
20:04:53.127657 IP 151.101.117.140.443 > 10.0.2.15.53144: Flags [P.], seq 101357:104105, ack 821, win 65535, length 2748
20:04:53.127677 IP 10.0.2.15.53144 > 151.101.117.140.443: Flags [.], ack 104105, win 65535, length 0
20:04:53.128804 IP 151.101.117.140.443 > 10.0.2.15.53144: Flags [P.], seq 104105:109601, ack 821, win 65535, length 5496
20:04:53.128819 IP 10.0.2.15.53144 > 151.101.117.140.443: Flags [.], ack 109601, win 65535, length 0
20:04:53.129807 IP 151.101.117.140.443 > 10.0.2.15.53144: Flags [P.], seq 109601:110975, ack 821, win 65535, length 1374
20:04:53.129822 IP 10.0.2.15.53144 > 151.101.117.140.443: Flags [.], ack 110975, win 65535, length 0
20:04:53.130919 IP 151.101.117.140.443 > 10.0.2.15.53144: Flags [P.], seq 110975:115097, ack 821, win 65535, length 4122
20:04:53.130933 IP 10.0.2.15.53144 > 151.101.117.140.443: Flags [.], ack 115097, win 65535, length 0
20:04:53.131053 IP 151.101.117.140.443 > 10.0.2.15.53144: Flags [P.], seq 115097:116471, ack 821, win 65535, length 1374
20:04:53.131061 IP 10.0.2.15.53144 > 151.101.117.140.443: Flags [.], ack 116471, win 65535, length 0
20:04:53.132099 IP 151.101.117.140.443 > 10.0.2.15.53144: Flags [P.], seq 116471:119219, ack 821, win 65535, length 2748
20:04:53.132114 IP 10.0.2.15.53144 > 151.101.117.140.443: Flags [.], ack 119219, win 65535, length 0
20:04:53.135738 IP 151.101.117.140.443 > 10.0.2.15.53144: Flags [P.], seq 119219:124715, ack 821, win 65535, length 5496
20:04:53.135740 IP 151.101.117.140.443 > 10.0.2.15.53144: Flags [P.], seq 124715:128837, ack 821, win 65535, length 4122
20:04:53.135762 IP 10.0.2.15.53144 > 151.101.117.140.443: Flags [.], ack 124715, win 65535, length 0
20:04:53.135797 IP 10.0.2.15.53144 > 151.101.117.140.443: Flags [.], ack 128837, win 65535, length 0
20:04:53.135941 IP 151.101.117.140.443 > 10.0.2.15.53144: Flags [P.], seq 128837:132959, ack 821, win 65535, length 4122
20:04:53.135947 IP 10.0.2.15.53144 > 151.101.117.140.443: Flags [.], ack 132959, win 65535, length 0
20:04:53.137447 IP 151.101.117.140.443 > 10.0.2.15.53144: Flags [P.], seq 132959:137081, ack 821, win 65535, length 4122
20:04:53.137528 IP 10.0.2.15.53144 > 151.101.117.140.443: Flags [.], ack 137081, win 65535, length 0
20:04:53.137850 IP 151.101.117.140.443 > 10.0.2.15.53144: Flags [P.], seq 137081:138455, ack 821, win 65535, length 1374
20:04:53.137852 IP 151.101.117.140.443 > 10.0.2.15.53144: Flags [P.], seq 138455:141203, ack 821, win 65535, length 2748
20:04:53.137867 IP 10.0.2.15.53144 > 151.101.117.140.443: Flags [.], ack 138455, win 65535, length 0
20:04:53.137891 IP 10.0.2.15.53144 > 151.101.117.140.443: Flags [.], ack 141203, win 65535, length 0
20:04:53.141208 IP 151.101.117.140.443 > 10.0.2.15.53144: Flags [P.], seq 141203:146699, ack 821, win 65535, length 5496
20:04:53.141211 IP 151.101.117.140.443 > 10.0.2.15.53144: Flags [P.], seq 146699:149447, ack 821, win 65535, length 2748
20:04:53.141241 IP 10.0.2.15.53144 > 151.101.117.140.443: Flags [.], ack 146699, win 65535, length 0
20:04:53.141610 IP 10.0.2.15.53144 > 151.101.117.140.443: Flags [.], ack 149447, win 65535, length 0
20:04:53.141971 IP 151.101.117.140.443 > 10.0.2.15.53144: Flags [P.], seq 149447:153569, ack 821, win 65535, length 4122
20:04:53.141974 IP 151.101.117.140.443 > 10.0.2.15.53144: Flags [P.], seq 153569:156317, ack 821, win 65535, length 2748
20:04:53.141991 IP 10.0.2.15.53144 > 151.101.117.140.443: Flags [.], ack 153569, win 65535, length 0
20:04:53.142014 IP 10.0.2.15.53144 > 151.101.117.140.443: Flags [.], ack 156317, win 65535, length 0
20:04:53.143511 IP 151.101.117.140.443 > 10.0.2.15.53144: Flags [P.], seq 156317:161813, ack 821, win 65535, length 5496
20:04:53.143530 IP 10.0.2.15.53144 > 151.101.117.140.443: Flags [.], ack 161813, win 65535, length 0
20:04:53.145629 IP 151.101.117.140.443 > 10.0.2.15.53144: Flags [P.], seq 161813:167309, ack 821, win 65535, length 5496
20:04:53.145631 IP 151.101.117.140.443 > 10.0.2.15.53144: Flags [P.], seq 167309:170057, ack 821, win 65535, length 2748
20:04:53.145656 IP 10.0.2.15.53144 > 151.101.117.140.443: Flags [.], ack 167309, win 65535, length 0
20:04:53.145690 IP 10.0.2.15.53144 > 151.101.117.140.443: Flags [.], ack 170057, win 65535, length 0
20:04:53.145885 IP 151.101.117.140.443 > 10.0.2.15.53144: Flags [P.], seq 170057:175553, ack 821, win 65535, length 5496
20:04:53.145886 IP 151.101.117.140.443 > 10.0.2.15.53144: Flags [P.], seq 175553:176927, ack 821, win 65535, length 1374
20:04:53.145895 IP 10.0.2.15.53144 > 151.101.117.140.443: Flags [.], ack 175553, win 65535, length 0
20:04:53.145908 IP 10.0.2.15.53144 > 151.101.117.140.443: Flags [.], ack 176927, win 65535, length 0
20:04:53.147337 IP 151.101.117.140.443 > 10.0.2.15.53144: Flags [P.], seq 176927:182423, ack 821, win 65535, length 5496
20:04:53.147366 IP 10.0.2.15.53144 > 151.101.117.140.443: Flags [.], ack 182423, win 65535, length 0
20:04:53.149871 IP 151.101.117.140.443 > 10.0.2.15.53144: Flags [P.], seq 182423:186545, ack 821, win 65535, length 4122
20:04:53.149874 IP 151.101.117.140.443 > 10.0.2.15.53144: Flags [P.], seq 186545:189293, ack 821, win 65535, length 2748
20:04:53.150250 IP 10.0.2.15.53144 > 151.101.117.140.443: Flags [.], ack 186545, win 65535, length 0
20:04:53.150288 IP 10.0.2.15.53144 > 151.101.117.140.443: Flags [.], ack 189293, win 65535, length 0
20:04:53.151111 IP 151.101.117.140.443 > 10.0.2.15.53144: Flags [P.], seq 189293:193415, ack 821, win 65535, length 4122
20:04:53.151113 IP 151.101.117.140.443 > 10.0.2.15.53144: Flags [P.], seq 193415:194789, ack 821, win 65535, length 1374
20:04:53.151128 IP 10.0.2.15.53144 > 151.101.117.140.443: Flags [.], ack 193415, win 65535, length 0
20:04:53.151153 IP 10.0.2.15.53144 > 151.101.117.140.443: Flags [.], ack 194789, win 65535, length 0
20:04:53.153196 IP 151.101.117.140.443 > 10.0.2.15.53144: Flags [P.], seq 194789:197843, ack 821, win 65535, length 3054
20:04:53.153216 IP 10.0.2.15.53144 > 151.101.117.140.443: Flags [.], ack 197843, win 65535, length 0
20:04:53.904297 IP 151.101.117.140.443 > 10.0.2.15.53144: Flags [P.], seq 197843:204810, ack 821, win 65535, length 6967
20:04:53.904324 IP 10.0.2.15.53144 > 151.101.117.140.443: Flags [.], ack 204810, win 65535, length 0
20:04:53.904953 IP 151.101.117.140.443 > 10.0.2.15.53144: Flags [P.], seq 204810:208932, ack 821, win 65535, length 4122
20:04:53.904956 IP 151.101.117.140.443 > 10.0.2.15.53144: Flags [P.], seq 208932:211680, ack 821, win 65535, length 2748
20:04:53.904957 IP 151.101.117.140.443 > 10.0.2.15.53144: Flags [P.], seq 211680:213054, ack 821, win 65535, length 1374
20:04:53.904958 IP 151.101.117.140.443 > 10.0.2.15.53144: Flags [P.], seq 213054:215745, ack 821, win 65535, length 2691
20:04:53.905158 IP 10.0.2.15.53144 > 151.101.117.140.443: Flags [.], ack 208932, win 65535, length 0
20:04:53.905266 IP 10.0.2.15.53144 > 151.101.117.140.443: Flags [.], ack 211680, win 65535, length 0
20:04:53.905328 IP 10.0.2.15.53144 > 151.101.117.140.443: Flags [.], ack 213054, win 65535, length 0
20:04:53.905345 IP 10.0.2.15.53144 > 151.101.117.140.443: Flags [.], ack 215745, win 65535, length 0
20:04:53.905517 IP 151.101.117.140.443 > 10.0.2.15.53144: Flags [P.], seq 215745:219867, ack 821, win 65535, length 4122
20:04:53.905532 IP 10.0.2.15.53144 > 151.101.117.140.443: Flags [.], ack 219867, win 65535, length 0
20:04:53.905934 IP 151.101.117.140.443 > 10.0.2.15.53144: Flags [P.], seq 219867:223989, ack 821, win 65535, length 4122
20:04:53.905937 IP 151.101.117.140.443 > 10.0.2.15.53144: Flags [P.], seq 223989:228111, ack 821, win 65535, length 4122
20:04:53.906000 IP 10.0.2.15.53144 > 151.101.117.140.443: Flags [.], ack 223989, win 65535, length 0
20:04:53.906017 IP 10.0.2.15.53144 > 151.101.117.140.443: Flags [.], ack 228111, win 65535, length 0
20:04:53.906294 IP 151.101.117.140.443 > 10.0.2.15.53144: Flags [P.], seq 228111:230859, ack 821, win 65535, length 2748
20:04:53.906296 IP 151.101.117.140.443 > 10.0.2.15.53144: Flags [P.], seq 230859:233607, ack 821, win 65535, length 2748
20:04:53.906308 IP 10.0.2.15.53144 > 151.101.117.140.443: Flags [.], ack 230859, win 65535, length 0
20:04:53.906328 IP 10.0.2.15.53144 > 151.101.117.140.443: Flags [.], ack 233607, win 65535, length 0
20:04:53.906493 IP 151.101.117.140.443 > 10.0.2.15.53144: Flags [P.], seq 233607:236355, ack 821, win 65535, length 2748
20:04:53.906495 IP 151.101.117.140.443 > 10.0.2.15.53144: Flags [P.], seq 236355:237729, ack 821, win 65535, length 1374
20:04:53.906495 IP 151.101.117.140.443 > 10.0.2.15.53144: Flags [P.], seq 237729:239103, ack 821, win 65535, length 1374
20:04:53.906505 IP 10.0.2.15.53144 > 151.101.117.140.443: Flags [.], ack 236355, win 65535, length 0
20:04:53.906566 IP 10.0.2.15.53144 > 151.101.117.140.443: Flags [.], ack 237729, win 65535, length 0
20:04:53.906578 IP 10.0.2.15.53144 > 151.101.117.140.443: Flags [.], ack 239103, win 65535, length 0
20:04:53.906667 IP 151.101.117.140.443 > 10.0.2.15.53144: Flags [P.], seq 239103:240477, ack 821, win 65535, length 1374
20:04:53.906673 IP 10.0.2.15.53144 > 151.101.117.140.443: Flags [.], ack 240477, win 65535, length 0
20:04:53.906928 IP 151.101.117.140.443 > 10.0.2.15.53144: Flags [P.], seq 240477:243225, ack 821, win 65535, length 2748
20:04:53.906930 IP 151.101.117.140.443 > 10.0.2.15.53144: Flags [P.], seq 243225:244599, ack 821, win 65535, length 1374
20:04:53.906944 IP 10.0.2.15.53144 > 151.101.117.140.443: Flags [.], ack 243225, win 65535, length 0
20:04:53.906963 IP 10.0.2.15.53144 > 151.101.117.140.443: Flags [.], ack 244599, win 65535, length 0
20:04:53.907248 IP 151.101.117.140.443 > 10.0.2.15.53144: Flags [P.], seq 244599:245973, ack 821, win 65535, length 1374
20:04:53.907257 IP 10.0.2.15.53144 > 151.101.117.140.443: Flags [.], ack 245973, win 65535, length 0
20:04:53.907875 IP 151.101.117.140.443 > 10.0.2.15.53144: Flags [P.], seq 245973:248721, ack 821, win 65535, length 2748
20:04:53.907886 IP 10.0.2.15.53144 > 151.101.117.140.443: Flags [.], ack 248721, win 65535, length 0
20:04:53.907971 IP 151.101.117.140.443 > 10.0.2.15.53144: Flags [P.], seq 248721:251469, ack 821, win 65535, length 2748
20:04:53.907976 IP 10.0.2.15.53144 > 151.101.117.140.443: Flags [.], ack 251469, win 65535, length 0
20:04:53.909169 IP 151.101.117.140.443 > 10.0.2.15.53144: Flags [P.], seq 251469:258339, ack 821, win 65535, length 6870
20:04:53.909171 IP 151.101.117.140.443 > 10.0.2.15.53144: Flags [P.], seq 258339:261087, ack 821, win 65535, length 2748
20:04:53.909191 IP 10.0.2.15.53144 > 151.101.117.140.443: Flags [.], ack 258339, win 65535, length 0
20:04:53.909220 IP 10.0.2.15.53144 > 151.101.117.140.443: Flags [.], ack 261087, win 65535, length 0
20:04:53.909389 IP 151.101.117.140.443 > 10.0.2.15.53144: Flags [P.], seq 261087:262461, ack 821, win 65535, length 1374
20:04:53.909397 IP 10.0.2.15.53144 > 151.101.117.140.443: Flags [.], ack 262461, win 65535, length 0
20:04:53.909509 IP 151.101.117.140.443 > 10.0.2.15.53144: Flags [P.], seq 262461:265209, ack 821, win 65535, length 2748
20:04:53.909513 IP 10.0.2.15.53144 > 151.101.117.140.443: Flags [.], ack 265209, win 65535, length 0
20:04:53.920726 IP 151.101.117.140.443 > 10.0.2.15.53144: Flags [P.], seq 265209:269331, ack 821, win 65535, length 4122
20:04:53.920751 IP 10.0.2.15.53144 > 151.101.117.140.443: Flags [.], ack 269331, win 65535, length 0
20:04:53.921465 IP 151.101.117.140.443 > 10.0.2.15.53144: Flags [P.], seq 269331:272079, ack 821, win 65535, length 2748
20:04:53.921485 IP 10.0.2.15.53144 > 151.101.117.140.443: Flags [.], ack 272079, win 65535, length 0
20:04:53.922699 IP 151.101.117.140.443 > 10.0.2.15.53144: Flags [P.], seq 272079:276201, ack 821, win 65535, length 4122
20:04:53.922721 IP 10.0.2.15.53144 > 151.101.117.140.443: Flags [.], ack 276201, win 65535, length 0
20:04:53.923870 IP 151.101.117.140.443 > 10.0.2.15.53144: Flags [P.], seq 276201:280323, ack 821, win 65535, length 4122
20:04:53.923961 IP 10.0.2.15.53144 > 151.101.117.140.443: Flags [.], ack 280323, win 65535, length 0
20:04:53.924982 IP 151.101.117.140.443 > 10.0.2.15.53144: Flags [P.], seq 280323:283071, ack 821, win 65535, length 2748
20:04:53.924996 IP 10.0.2.15.53144 > 151.101.117.140.443: Flags [.], ack 283071, win 65535, length 0
20:04:53.925739 IP 151.101.117.140.443 > 10.0.2.15.53144: Flags [P.], seq 283071:285819, ack 821, win 65535, length 2748
20:04:53.925753 IP 10.0.2.15.53144 > 151.101.117.140.443: Flags [.], ack 285819, win 65535, length 0
20:04:53.927235 IP 151.101.117.140.443 > 10.0.2.15.53144: Flags [P.], seq 285819:291315, ack 821, win 65535, length 5496
20:04:53.927254 IP 10.0.2.15.53144 > 151.101.117.140.443: Flags [.], ack 291315, win 65535, length 0
20:04:53.927959 IP 151.101.117.140.443 > 10.0.2.15.53144: Flags [P.], seq 291315:294063, ack 821, win 65535, length 2748
20:04:53.927976 IP 10.0.2.15.53144 > 151.101.117.140.443: Flags [.], ack 294063, win 65535, length 0
20:04:53.929421 IP 151.101.117.140.443 > 10.0.2.15.53144: Flags [P.], seq 294063:296811, ack 821, win 65535, length 2748
20:04:53.929441 IP 10.0.2.15.53144 > 151.101.117.140.443: Flags [.], ack 296811, win 65535, length 0
20:04:53.930384 IP 151.101.117.140.443 > 10.0.2.15.53144: Flags [P.], seq 296811:300933, ack 821, win 65535, length 4122
20:04:53.930410 IP 10.0.2.15.53144 > 151.101.117.140.443: Flags [.], ack 300933, win 65535, length 0
20:04:53.931448 IP 151.101.117.140.443 > 10.0.2.15.53144: Flags [P.], seq 300933:305055, ack 821, win 65535, length 4122
20:04:53.931463 IP 10.0.2.15.53144 > 151.101.117.140.443: Flags [.], ack 305055, win 65535, length 0
20:04:53.932595 IP 151.101.117.140.443 > 10.0.2.15.53144: Flags [P.], seq 305055:309177, ack 821, win 65535, length 4122
20:04:53.932610 IP 10.0.2.15.53144 > 151.101.117.140.443: Flags [.], ack 309177, win 65535, length 0
20:04:53.933527 IP 151.101.117.140.443 > 10.0.2.15.53144: Flags [P.], seq 309177:310551, ack 821, win 65535, length 1374
20:04:53.933541 IP 10.0.2.15.53144 > 151.101.117.140.443: Flags [.], ack 310551, win 65535, length 0
20:04:53.934349 IP 151.101.117.140.443 > 10.0.2.15.53144: Flags [P.], seq 310551:316047, ack 821, win 65535, length 5496
20:04:53.934359 IP 10.0.2.15.53144 > 151.101.117.140.443: Flags [.], ack 316047, win 65535, length 0
20:04:53.935354 IP 151.101.117.140.443 > 10.0.2.15.53144: Flags [P.], seq 316047:318795, ack 821, win 65535, length 2748
20:04:53.935366 IP 10.0.2.15.53144 > 151.101.117.140.443: Flags [.], ack 318795, win 65535, length 0
20:04:53.936475 IP 151.101.117.140.443 > 10.0.2.15.53144: Flags [P.], seq 318795:324291, ack 821, win 65535, length 5496
20:04:53.936488 IP 10.0.2.15.53144 > 151.101.117.140.443: Flags [.], ack 324291, win 65535, length 0
20:04:53.937544 IP 151.101.117.140.443 > 10.0.2.15.53144: Flags [P.], seq 324291:327039, ack 821, win 65535, length 2748
20:04:53.937557 IP 10.0.2.15.53144 > 151.101.117.140.443: Flags [.], ack 327039, win 65535, length 0
20:04:53.938644 IP 151.101.117.140.443 > 10.0.2.15.53144: Flags [P.], seq 327039:331161, ack 821, win 65535, length 4122
20:04:53.938658 IP 10.0.2.15.53144 > 151.101.117.140.443: Flags [.], ack 331161, win 65535, length 0
20:04:53.939656 IP 151.101.117.140.443 > 10.0.2.15.53144: Flags [P.], seq 331161:338031, ack 821, win 65535, length 6870
20:04:53.939673 IP 10.0.2.15.53144 > 151.101.117.140.443: Flags [.], ack 338031, win 65535, length 0
20:04:53.940728 IP 151.101.117.140.443 > 10.0.2.15.53144: Flags [P.], seq 338031:340779, ack 821, win 65535, length 2748
20:04:53.940740 IP 10.0.2.15.53144 > 151.101.117.140.443: Flags [.], ack 340779, win 65535, length 0
20:04:53.941792 IP 151.101.117.140.443 > 10.0.2.15.53144: Flags [P.], seq 340779:346275, ack 821, win 65535, length 5496
20:04:53.941806 IP 10.0.2.15.53144 > 151.101.117.140.443: Flags [.], ack 346275, win 65535, length 0
20:04:53.942835 IP 151.101.117.140.443 > 10.0.2.15.53144: Flags [P.], seq 346275:353145, ack 821, win 65535, length 6870
20:04:53.942849 IP 10.0.2.15.53144 > 151.101.117.140.443: Flags [.], ack 353145, win 65535, length 0
20:04:53.943957 IP 151.101.117.140.443 > 10.0.2.15.53144: Flags [P.], seq 353145:357267, ack 821, win 65535, length 4122
20:04:53.943969 IP 10.0.2.15.53144 > 151.101.117.140.443: Flags [.], ack 357267, win 65535, length 0
20:04:53.945290 IP 151.101.117.140.443 > 10.0.2.15.53144: Flags [P.], seq 357267:361389, ack 821, win 65535, length 4122
20:04:53.945305 IP 10.0.2.15.53144 > 151.101.117.140.443: Flags [.], ack 361389, win 65535, length 0
20:04:53.946169 IP 151.101.117.140.443 > 10.0.2.15.53144: Flags [P.], seq 361389:366885, ack 821, win 65535, length 5496
20:04:53.946190 IP 10.0.2.15.53144 > 151.101.117.140.443: Flags [.], ack 366885, win 65535, length 0
20:04:53.948599 IP 151.101.117.140.443 > 10.0.2.15.53144: Flags [P.], seq 366885:372381, ack 821, win 65535, length 5496
20:04:53.948614 IP 10.0.2.15.53144 > 151.101.117.140.443: Flags [.], ack 372381, win 65535, length 0
20:04:53.951472 IP 151.101.117.140.443 > 10.0.2.15.53144: Flags [P.], seq 372381:381999, ack 821, win 65535, length 9618
20:04:53.951475 IP 151.101.117.140.443 > 10.0.2.15.53144: Flags [P.], seq 381999:386121, ack 821, win 65535, length 4122
20:04:53.951713 IP 10.0.2.15.53144 > 151.101.117.140.443: Flags [.], ack 381999, win 65535, length 0
20:04:53.951763 IP 10.0.2.15.53144 > 151.101.117.140.443: Flags [.], ack 386121, win 65535, length 0
20:04:53.951801 IP 151.101.117.140.443 > 10.0.2.15.53144: Flags [P.], seq 386121:390243, ack 821, win 65535, length 4122
20:04:53.951803 IP 151.101.117.140.443 > 10.0.2.15.53144: Flags [P.], seq 390243:392991, ack 821, win 65535, length 2748
20:04:53.951811 IP 10.0.2.15.53144 > 151.101.117.140.443: Flags [.], ack 390243, win 65535, length 0
20:04:53.951825 IP 10.0.2.15.53144 > 151.101.117.140.443: Flags [.], ack 392991, win 65535, length 0
20:04:53.953638 IP 151.101.117.140.443 > 10.0.2.15.53144: Flags [P.], seq 392991:401235, ack 821, win 65535, length 8244
20:04:53.953641 IP 151.101.117.140.443 > 10.0.2.15.53144: Flags [P.], seq 401235:405357, ack 821, win 65535, length 4122
20:04:53.953667 IP 10.0.2.15.53144 > 151.101.117.140.443: Flags [.], ack 401235, win 65535, length 0
20:04:53.953808 IP 10.0.2.15.53144 > 151.101.117.140.443: Flags [.], ack 405357, win 65535, length 0
20:04:53.953886 IP 151.101.117.140.443 > 10.0.2.15.53144: Flags [P.], seq 405357:408105, ack 821, win 65535, length 2748
20:04:53.953886 IP 151.101.117.140.443 > 10.0.2.15.53144: Flags [P.], seq 408105:409479, ack 821, win 65535, length 1374
20:04:53.953893 IP 10.0.2.15.53144 > 151.101.117.140.443: Flags [.], ack 408105, win 65535, length 0
20:04:53.953906 IP 10.0.2.15.53144 > 151.101.117.140.443: Flags [.], ack 409479, win 65535, length 0
20:04:53.955675 IP 151.101.117.140.443 > 10.0.2.15.53144: Flags [P.], seq 409479:414975, ack 821, win 65535, length 5496
20:04:53.955678 IP 151.101.117.140.443 > 10.0.2.15.53144: Flags [P.], seq 414975:419097, ack 821, win 65535, length 4122
20:04:53.955702 IP 10.0.2.15.53144 > 151.101.117.140.443: Flags [.], ack 414975, win 65535, length 0
20:04:53.955739 IP 10.0.2.15.53144 > 151.101.117.140.443: Flags [.], ack 419097, win 65535, length 0
20:04:53.955895 IP 151.101.117.140.443 > 10.0.2.15.53144: Flags [P.], seq 419097:421845, ack 821, win 65535, length 2748
20:04:53.955905 IP 10.0.2.15.53144 > 151.101.117.140.443: Flags [.], ack 421845, win 65535, length 0
20:04:53.956533 IP 151.101.117.140.443 > 10.0.2.15.53144: Flags [P.], seq 421845:425967, ack 821, win 65535, length 4122
20:04:53.956545 IP 10.0.2.15.53144 > 151.101.117.140.443: Flags [.], ack 425967, win 65535, length 0
20:04:53.958064 IP 151.101.117.140.443 > 10.0.2.15.53144: Flags [P.], seq 425967:432837, ack 821, win 65535, length 6870
20:04:53.958085 IP 10.0.2.15.53144 > 151.101.117.140.443: Flags [.], ack 432837, win 65535, length 0
20:04:53.959894 IP 151.101.117.140.443 > 10.0.2.15.53144: Flags [P.], seq 432837:438333, ack 821, win 65535, length 5496
20:04:53.959914 IP 10.0.2.15.53144 > 151.101.117.140.443: Flags [.], ack 438333, win 65535, length 0
20:04:53.961996 IP 151.101.117.140.443 > 10.0.2.15.53144: Flags [P.], seq 438333:445203, ack 821, win 65535, length 6870
20:04:53.962000 IP 151.101.117.140.443 > 10.0.2.15.53144: Flags [P.], seq 445203:447951, ack 821, win 65535, length 2748
20:04:53.962024 IP 10.0.2.15.53144 > 151.101.117.140.443: Flags [.], ack 445203, win 65535, length 0
20:04:53.962128 IP 10.0.2.15.53144 > 151.101.117.140.443: Flags [.], ack 447951, win 65535, length 0
20:04:53.963892 IP 151.101.117.140.443 > 10.0.2.15.53144: Flags [P.], seq 447951:449325, ack 821, win 65535, length 1374
20:04:53.963911 IP 10.0.2.15.53144 > 151.101.117.140.443: Flags [.], ack 449325, win 65535, length 0
20:04:53.965209 IP 151.101.117.140.443 > 10.0.2.15.53144: Flags [P.], seq 449325:453447, ack 821, win 65535, length 4122
20:04:53.965233 IP 10.0.2.15.53144 > 151.101.117.140.443: Flags [.], ack 453447, win 65535, length 0
20:04:53.966062 IP 151.101.117.140.443 > 10.0.2.15.53144: Flags [P.], seq 453447:463065, ack 821, win 65535, length 9618
20:04:53.966077 IP 10.0.2.15.53144 > 151.101.117.140.443: Flags [.], ack 463065, win 65535, length 0
20:04:53.967255 IP 151.101.117.140.443 > 10.0.2.15.53144: Flags [P.], seq 463065:468561, ack 821, win 65535, length 5496
20:04:53.967257 IP 151.101.117.140.443 > 10.0.2.15.53144: Flags [P.], seq 468561:469935, ack 821, win 65535, length 1374
20:04:53.967274 IP 10.0.2.15.53144 > 151.101.117.140.443: Flags [.], ack 468561, win 65535, length 0
20:04:53.967301 IP 10.0.2.15.53144 > 151.101.117.140.443: Flags [.], ack 469935, win 65535, length 0
20:04:53.968438 IP 151.101.117.140.443 > 10.0.2.15.53144: Flags [P.], seq 469935:474057, ack 821, win 65535, length 4122
20:04:53.968459 IP 10.0.2.15.53144 > 151.101.117.140.443: Flags [.], ack 474057, win 65535, length 0
20:04:53.969406 IP 151.101.117.140.443 > 10.0.2.15.53144: Flags [P.], seq 474057:480927, ack 821, win 65535, length 6870
20:04:53.969485 IP 10.0.2.15.53144 > 151.101.117.140.443: Flags [.], ack 480927, win 65535, length 0
20:04:53.970379 IP 151.101.117.140.443 > 10.0.2.15.53144: Flags [P.], seq 480927:487797, ack 821, win 65535, length 6870
20:04:53.970392 IP 10.0.2.15.53144 > 151.101.117.140.443: Flags [.], ack 487797, win 65535, length 0
20:04:53.971031 IP 151.101.117.140.443 > 10.0.2.15.53144: Flags [P.], seq 487797:490545, ack 821, win 65535, length 2748
20:04:53.971042 IP 10.0.2.15.53144 > 151.101.117.140.443: Flags [.], ack 490545, win 65535, length 0
20:04:53.971276 IP 151.101.117.140.443 > 10.0.2.15.53144: Flags [P.], seq 490545:496041, ack 821, win 65535, length 5496
20:04:53.971285 IP 10.0.2.15.53144 > 151.101.117.140.443: Flags [.], ack 496041, win 65535, length 0
20:04:53.972754 IP 151.101.117.140.443 > 10.0.2.15.53144: Flags [P.], seq 496041:501537, ack 821, win 65535, length 5496
20:04:53.972882 IP 10.0.2.15.53144 > 151.101.117.140.443: Flags [.], ack 501537, win 65535, length 0
20:04:53.973933 IP 151.101.117.140.443 > 10.0.2.15.53144: Flags [P.], seq 501537:508407, ack 821, win 65535, length 6870
20:04:53.973936 IP 151.101.117.140.443 > 10.0.2.15.53144: Flags [P.], seq 508407:512529, ack 821, win 65535, length 4122
20:04:53.973957 IP 10.0.2.15.53144 > 151.101.117.140.443: Flags [.], ack 508407, win 65535, length 0
20:04:53.973994 IP 10.0.2.15.53144 > 151.101.117.140.443: Flags [.], ack 512529, win 65535, length 0
20:04:53.975412 IP 151.101.117.140.443 > 10.0.2.15.53144: Flags [P.], seq 512529:518025, ack 821, win 65535, length 5496
20:04:53.975430 IP 10.0.2.15.53144 > 151.101.117.140.443: Flags [.], ack 518025, win 65535, length 0
20:04:53.975755 IP 151.101.117.140.443 > 10.0.2.15.53144: Flags [P.], seq 518025:522147, ack 821, win 65535, length 4122
20:04:53.975764 IP 10.0.2.15.53144 > 151.101.117.140.443: Flags [.], ack 522147, win 65535, length 0
20:04:53.977552 IP 151.101.117.140.443 > 10.0.2.15.53144: Flags [P.], seq 522147:529017, ack 821, win 65535, length 6870
20:04:53.977577 IP 10.0.2.15.53144 > 151.101.117.140.443: Flags [.], ack 529017, win 65535, length 0
20:04:53.978456 IP 151.101.117.140.443 > 10.0.2.15.53144: Flags [.], seq 529017:530477, ack 821, win 65535, length 1460
20:04:53.978579 IP 10.0.2.15.53144 > 151.101.117.140.443: Flags [.], ack 530477, win 65535, length 0
20:04:53.978859 IP 151.101.117.140.443 > 10.0.2.15.53144: Flags [P.], seq 530477:533139, ack 821, win 65535, length 2662
20:04:53.978867 IP 10.0.2.15.53144 > 151.101.117.140.443: Flags [.], ack 533139, win 65535, length 0
20:04:53.979389 IP 151.101.117.140.443 > 10.0.2.15.53144: Flags [P.], seq 533139:538635, ack 821, win 65535, length 5496
20:04:53.979399 IP 10.0.2.15.53144 > 151.101.117.140.443: Flags [.], ack 538635, win 65535, length 0
20:04:53.980824 IP 151.101.117.140.443 > 10.0.2.15.53144: Flags [P.], seq 538635:544131, ack 821, win 65535, length 5496
20:04:53.980853 IP 10.0.2.15.53144 > 151.101.117.140.443: Flags [.], ack 544131, win 65535, length 0
20:04:53.982014 IP 151.101.117.140.443 > 10.0.2.15.53144: Flags [P.], seq 544131:551001, ack 821, win 65535, length 6870
20:04:53.982029 IP 10.0.2.15.53144 > 151.101.117.140.443: Flags [.], ack 551001, win 65535, length 0
20:04:53.983030 IP 151.101.117.140.443 > 10.0.2.15.53144: Flags [P.], seq 551001:556497, ack 821, win 65535, length 5496
20:04:53.983032 IP 151.101.117.140.443 > 10.0.2.15.53144: Flags [P.], seq 556497:557871, ack 821, win 65535, length 1374
20:04:53.983049 IP 10.0.2.15.53144 > 151.101.117.140.443: Flags [.], ack 556497, win 65535, length 0
20:04:53.983074 IP 10.0.2.15.53144 > 151.101.117.140.443: Flags [.], ack 557871, win 65535, length 0
20:04:53.984698 IP 151.101.117.140.443 > 10.0.2.15.53144: Flags [P.], seq 557871:566115, ack 821, win 65535, length 8244
20:04:53.984700 IP 151.101.117.140.443 > 10.0.2.15.53144: Flags [P.], seq 566115:568863, ack 821, win 65535, length 2748
20:04:53.984718 IP 10.0.2.15.53144 > 151.101.117.140.443: Flags [.], ack 566115, win 65535, length 0
20:04:53.984768 IP 10.0.2.15.53144 > 151.101.117.140.443: Flags [.], ack 568863, win 65535, length 0
20:04:53.986242 IP 151.101.117.140.443 > 10.0.2.15.53144: Flags [P.], seq 568863:574359, ack 821, win 65535, length 5496
20:04:53.986245 IP 151.101.117.140.443 > 10.0.2.15.53144: Flags [P.], seq 574359:579855, ack 821, win 65535, length 5496
20:04:53.986305 IP 10.0.2.15.53144 > 151.101.117.140.443: Flags [.], ack 574359, win 65535, length 0
20:04:53.986341 IP 10.0.2.15.53144 > 151.101.117.140.443: Flags [.], ack 579855, win 65535, length 0
20:04:53.986366 IP 151.101.117.140.443 > 10.0.2.15.53144: Flags [P.], seq 579855:581229, ack 821, win 65535, length 1374
20:04:53.986367 IP 151.101.117.140.443 > 10.0.2.15.53144: Flags [P.], seq 581229:582603, ack 821, win 65535, length 1374
20:04:53.986374 IP 10.0.2.15.53144 > 151.101.117.140.443: Flags [.], ack 581229, win 65535, length 0
20:04:53.986387 IP 10.0.2.15.53144 > 151.101.117.140.443: Flags [.], ack 582603, win 65535, length 0
20:04:53.988949 IP 151.101.117.140.443 > 10.0.2.15.53144: Flags [P.], seq 582603:588099, ack 821, win 65535, length 5496
20:04:53.988968 IP 10.0.2.15.53144 > 151.101.117.140.443: Flags [.], ack 588099, win 65535, length 0
20:04:53.989803 IP 151.101.117.140.443 > 10.0.2.15.53144: Flags [P.], seq 588099:594969, ack 821, win 65535, length 6870
20:04:53.989822 IP 10.0.2.15.53144 > 151.101.117.140.443: Flags [.], ack 594969, win 65535, length 0
20:04:53.990216 IP 151.101.117.140.443 > 10.0.2.15.53144: Flags [P.], seq 594969:597717, ack 821, win 65535, length 2748
20:04:53.990218 IP 151.101.117.140.443 > 10.0.2.15.53144: Flags [P.], seq 597717:600465, ack 821, win 65535, length 2748
20:04:53.990219 IP 151.101.117.140.443 > 10.0.2.15.53144: Flags [P.], seq 600465:601839, ack 821, win 65535, length 1374
20:04:53.990235 IP 10.0.2.15.53144 > 151.101.117.140.443: Flags [.], ack 597717, win 65535, length 0
20:04:53.990261 IP 10.0.2.15.53144 > 151.101.117.140.443: Flags [.], ack 600465, win 65535, length 0
20:04:53.990278 IP 10.0.2.15.53144 > 151.101.117.140.443: Flags [.], ack 601839, win 65535, length 0
20:04:53.992118 IP 151.101.117.140.443 > 10.0.2.15.53144: Flags [P.], seq 601839:607335, ack 821, win 65535, length 5496
20:04:53.992121 IP 151.101.117.140.443 > 10.0.2.15.53144: Flags [P.], seq 607335:611457, ack 821, win 65535, length 4122
20:04:53.992122 IP 151.101.117.140.443 > 10.0.2.15.53144: Flags [P.], seq 611457:614205, ack 821, win 65535, length 2748
20:04:53.992148 IP 10.0.2.15.53144 > 151.101.117.140.443: Flags [.], ack 607335, win 65535, length 0
20:04:53.992260 IP 10.0.2.15.53144 > 151.101.117.140.443: Flags [.], ack 611457, win 65535, length 0
20:04:53.992287 IP 10.0.2.15.53144 > 151.101.117.140.443: Flags [.], ack 614205, win 65535, length 0
20:04:53.993772 IP 151.101.117.140.443 > 10.0.2.15.53144: Flags [P.], seq 614205:618327, ack 821, win 65535, length 4122
20:04:53.993775 IP 151.101.117.140.443 > 10.0.2.15.53144: Flags [P.], seq 618327:622449, ack 821, win 65535, length 4122
20:04:53.993776 IP 151.101.117.140.443 > 10.0.2.15.53144: Flags [P.], seq 622449:626571, ack 821, win 65535, length 4122
20:04:53.993799 IP 10.0.2.15.53144 > 151.101.117.140.443: Flags [.], ack 618327, win 65535, length 0
20:04:53.993846 IP 10.0.2.15.53144 > 151.101.117.140.443: Flags [.], ack 622449, win 65535, length 0
20:04:53.993866 IP 10.0.2.15.53144 > 151.101.117.140.443: Flags [.], ack 626571, win 65535, length 0
20:04:53.993895 IP 151.101.117.140.443 > 10.0.2.15.53144: Flags [P.], seq 626571:627945, ack 821, win 65535, length 1374
20:04:53.993901 IP 10.0.2.15.53144 > 151.101.117.140.443: Flags [.], ack 627945, win 65535, length 0
20:04:53.995166 IP 151.101.117.140.443 > 10.0.2.15.53144: Flags [P.], seq 627945:634815, ack 821, win 65535, length 6870
20:04:53.995281 IP 10.0.2.15.53144 > 151.101.117.140.443: Flags [.], ack 634815, win 65535, length 0
20:04:53.997018 IP 151.101.117.140.443 > 10.0.2.15.53144: Flags [P.], seq 634815:636189, ack 821, win 65535, length 1374
20:04:53.997040 IP 10.0.2.15.53144 > 151.101.117.140.443: Flags [.], ack 636189, win 65535, length 0
20:04:53.998458 IP 151.101.117.140.443 > 10.0.2.15.53144: Flags [P.], seq 636189:641685, ack 821, win 65535, length 5496
20:04:53.998461 IP 151.101.117.140.443 > 10.0.2.15.53144: Flags [P.], seq 641685:648555, ack 821, win 65535, length 6870
20:04:53.998483 IP 10.0.2.15.53144 > 151.101.117.140.443: Flags [.], ack 641685, win 65535, length 0
20:04:53.998521 IP 10.0.2.15.53144 > 151.101.117.140.443: Flags [.], ack 648555, win 65535, length 0
20:04:53.999391 IP 151.101.117.140.443 > 10.0.2.15.53144: Flags [P.], seq 648555:652677, ack 821, win 65535, length 4122
20:04:53.999393 IP 151.101.117.140.443 > 10.0.2.15.53144: Flags [P.], seq 652677:655425, ack 821, win 65535, length 2748
20:04:53.999447 IP 10.0.2.15.53144 > 151.101.117.140.443: Flags [.], ack 652677, win 65535, length 0
20:04:53.999471 IP 10.0.2.15.53144 > 151.101.117.140.443: Flags [.], ack 655425, win 65535, length 0
20:04:53.999739 IP 151.101.117.140.443 > 10.0.2.15.53144: Flags [P.], seq 655425:656799, ack 821, win 65535, length 1374
20:04:53.999746 IP 10.0.2.15.53144 > 151.101.117.140.443: Flags [.], ack 656799, win 65535, length 0
20:04:54.000379 IP 151.101.117.140.443 > 10.0.2.15.53144: Flags [P.], seq 656799:663669, ack 821, win 65535, length 6870
20:04:54.000393 IP 10.0.2.15.53144 > 151.101.117.140.443: Flags [.], ack 663669, win 65535, length 0
20:04:54.000579 IP 151.101.117.140.443 > 10.0.2.15.53144: Flags [P.], seq 663669:666417, ack 821, win 65535, length 2748
20:04:54.000595 IP 10.0.2.15.53144 > 151.101.117.140.443: Flags [.], ack 666417, win 65535, length 0
20:04:54.001831 IP 151.101.117.140.443 > 10.0.2.15.53144: Flags [P.], seq 666417:671913, ack 821, win 65535, length 5496
20:04:54.001842 IP 10.0.2.15.53144 > 151.101.117.140.443: Flags [.], ack 671913, win 65535, length 0
20:04:54.002954 IP 151.101.117.140.443 > 10.0.2.15.53144: Flags [P.], seq 671913:676035, ack 821, win 65535, length 4122
20:04:54.002968 IP 10.0.2.15.53144 > 151.101.117.140.443: Flags [.], ack 676035, win 65535, length 0
20:04:54.003107 IP 151.101.117.140.443 > 10.0.2.15.53144: Flags [P.], seq 676035:677409, ack 821, win 65535, length 1374
20:04:54.003114 IP 10.0.2.15.53144 > 151.101.117.140.443: Flags [.], ack 677409, win 65535, length 0
20:04:54.004924 IP 151.101.117.140.443 > 10.0.2.15.53144: Flags [P.], seq 677409:682905, ack 821, win 65535, length 5496
20:04:54.004925 IP 151.101.117.140.443 > 10.0.2.15.53144: Flags [P.], seq 682905:684279, ack 821, win 65535, length 1374

