00:14:47.891946 IP 10.0.2.15.52944 > 151.101.117.140.443: Flags [P.], seq 2209823429:2209823946, ack 77696002, win 64240, length 517
00:14:47.892414 IP 151.101.117.140.443 > 10.0.2.15.52944: Flags [.], ack 517, win 65535, length 0
00:14:47.908199 IP 151.101.117.140.443 > 10.0.2.15.52944: Flags [.], seq 1:2921, ack 517, win 65535, length 2920
00:14:47.908229 IP 10.0.2.15.52944 > 151.101.117.140.443: Flags [.], ack 2921, win 62780, length 0
00:14:47.908886 IP 151.101.117.140.443 > 10.0.2.15.52944: Flags [P.], seq 2921:3722, ack 517, win 65535, length 801
00:14:47.908907 IP 10.0.2.15.52944 > 151.101.117.140.443: Flags [.], ack 3722, win 62780, length 0
00:14:47.910590 IP 10.0.2.15.52944 > 151.101.117.140.443: Flags [P.], seq 517:597, ack 3722, win 62780, length 80
00:14:47.910829 IP 10.0.2.15.52944 > 151.101.117.140.443: Flags [P.], seq 597:643, ack 3722, win 62780, length 46
00:14:47.911011 IP 151.101.117.140.443 > 10.0.2.15.52944: Flags [.], ack 597, win 65535, length 0
00:14:47.911012 IP 151.101.117.140.443 > 10.0.2.15.52944: Flags [.], ack 643, win 65535, length 0
00:14:47.911057 IP 10.0.2.15.52944 > 151.101.117.140.443: Flags [P.], seq 643:692, ack 3722, win 62780, length 49
00:14:47.911174 IP 10.0.2.15.52944 > 151.101.117.140.443: Flags [P.], seq 692:727, ack 3722, win 62780, length 35
00:14:47.911198 IP 10.0.2.15.52944 > 151.101.117.140.443: Flags [P.], seq 727:789, ack 3722, win 62780, length 62
00:14:47.911522 IP 151.101.117.140.443 > 10.0.2.15.52944: Flags [.], ack 692, win 65535, length 0
00:14:47.911523 IP 151.101.117.140.443 > 10.0.2.15.52944: Flags [.], ack 727, win 65535, length 0
00:14:47.911524 IP 151.101.117.140.443 > 10.0.2.15.52944: Flags [.], ack 789, win 65535, length 0
00:14:47.924222 IP 151.101.117.140.443 > 10.0.2.15.52944: Flags [P.], seq 3722:3772, ack 789, win 65535, length 50
00:14:47.924251 IP 10.0.2.15.52944 > 151.101.117.140.443: Flags [.], ack 3772, win 62780, length 0
00:14:47.924421 IP 10.0.2.15.52944 > 151.101.117.140.443: Flags [P.], seq 789:820, ack 3772, win 62780, length 31
00:14:47.925248 IP 151.101.117.140.443 > 10.0.2.15.52944: Flags [.], ack 820, win 65535, length 0
00:14:47.925250 IP 151.101.117.140.443 > 10.0.2.15.52944: Flags [P.], seq 3772:3803, ack 820, win 65535, length 31
00:14:47.925279 IP 10.0.2.15.52944 > 151.101.117.140.443: Flags [.], ack 3803, win 62780, length 0
00:14:48.103813 IP 151.101.117.140.443 > 10.0.2.15.52944: Flags [P.], seq 3803:12047, ack 820, win 65535, length 8244
00:14:48.103855 IP 10.0.2.15.52944 > 151.101.117.140.443: Flags [.], ack 12047, win 58400, length 0
00:14:48.104300 IP 151.101.117.140.443 > 10.0.2.15.52944: Flags [P.], seq 12047:14795, ack 820, win 65535, length 2748
00:14:48.104322 IP 10.0.2.15.52944 > 151.101.117.140.443: Flags [.], ack 14795, win 56940, length 0
00:14:48.106484 IP 151.101.117.140.443 > 10.0.2.15.52944: Flags [P.], seq 14795:23039, ack 820, win 65535, length 8244
00:14:48.106504 IP 10.0.2.15.52944 > 151.101.117.140.443: Flags [.], ack 23039, win 58400, length 0
00:14:48.108724 IP 151.101.117.140.443 > 10.0.2.15.52944: Flags [P.], seq 23039:29909, ack 820, win 65535, length 6870
00:14:48.108727 IP 151.101.117.140.443 > 10.0.2.15.52944: Flags [P.], seq 29909:31283, ack 820, win 65535, length 1374
00:14:48.108749 IP 10.0.2.15.52944 > 151.101.117.140.443: Flags [.], ack 29909, win 59860, length 0
00:14:48.108787 IP 10.0.2.15.52944 > 151.101.117.140.443: Flags [.], ack 31283, win 58486, length 0
00:14:48.109358 IP 151.101.117.140.443 > 10.0.2.15.52944: Flags [P.], seq 31283:35405, ack 820, win 65535, length 4122
00:14:48.109426 IP 10.0.2.15.52944 > 151.101.117.140.443: Flags [.], ack 35405, win 61320, length 0
00:14:48.109796 IP 151.101.117.140.443 > 10.0.2.15.52944: Flags [P.], seq 35405:36779, ack 820, win 65535, length 1374
00:14:48.109891 IP 10.0.2.15.52944 > 151.101.117.140.443: Flags [.], ack 36779, win 62780, length 0
00:14:48.110439 IP 151.101.117.140.443 > 10.0.2.15.52944: Flags [P.], seq 36779:37002, ack 820, win 65535, length 223
00:14:48.110505 IP 10.0.2.15.52944 > 151.101.117.140.443: Flags [.], ack 37002, win 62780, length 0
00:14:48.116264 IP 151.101.117.140.443 > 10.0.2.15.52944: Flags [P.], seq 37002:43872, ack 820, win 65535, length 6870
00:14:48.116356 IP 10.0.2.15.52944 > 151.101.117.140.443: Flags [.], ack 43872, win 59860, length 0
00:14:48.119098 IP 151.101.117.140.443 > 10.0.2.15.52944: Flags [P.], seq 43872:53490, ack 820, win 65535, length 9618
00:14:48.119100 IP 151.101.117.140.443 > 10.0.2.15.52944: Flags [P.], seq 53490:56238, ack 820, win 65535, length 2748
00:14:48.119552 IP 151.101.117.140.443 > 10.0.2.15.52944: Flags [P.], seq 56238:60360, ack 820, win 65535, length 4122
00:14:48.119636 IP 10.0.2.15.52944 > 151.101.117.140.443: Flags [.], ack 60360, win 52560, length 0
00:14:48.120407 IP 151.101.117.140.443 > 10.0.2.15.52944: Flags [P.], seq 60360:64482, ack 820, win 65535, length 4122
00:14:48.120497 IP 10.0.2.15.52944 > 151.101.117.140.443: Flags [.], ack 64482, win 61320, length 0
00:14:48.121629 IP 151.101.117.140.443 > 10.0.2.15.52944: Flags [P.], seq 64482:68604, ack 820, win 65535, length 4122
00:14:48.121645 IP 10.0.2.15.52944 > 151.101.117.140.443: Flags [.], ack 68604, win 61320, length 0
00:14:48.121746 IP 151.101.117.140.443 > 10.0.2.15.52944: Flags [P.], seq 68604:72726, ack 820, win 65535, length 4122
00:14:48.121798 IP 10.0.2.15.52944 > 151.101.117.140.443: Flags [.], ack 72726, win 62780, length 0
00:14:48.121910 IP 151.101.117.140.443 > 10.0.2.15.52944: Flags [P.], seq 72726:74100, ack 820, win 65535, length 1374
00:14:48.121933 IP 10.0.2.15.52944 > 151.101.117.140.443: Flags [.], ack 74100, win 65535, length 0
00:14:48.122025 IP 151.101.117.140.443 > 10.0.2.15.52944: Flags [P.], seq 74100:75474, ack 820, win 65535, length 1374
00:14:48.122037 IP 10.0.2.15.52944 > 151.101.117.140.443: Flags [.], ack 75474, win 65535, length 0
00:14:48.122937 IP 151.101.117.140.443 > 10.0.2.15.52944: Flags [P.], seq 75474:80970, ack 820, win 65535, length 5496
00:14:48.122950 IP 10.0.2.15.52944 > 151.101.117.140.443: Flags [.], ack 80970, win 65535, length 0
00:14:48.124022 IP 151.101.117.140.443 > 10.0.2.15.52944: Flags [P.], seq 80970:85092, ack 820, win 65535, length 4122
00:14:48.124025 IP 151.101.117.140.443 > 10.0.2.15.52944: Flags [P.], seq 85092:86768, ack 820, win 65535, length 1676
00:14:48.124047 IP 10.0.2.15.52944 > 151.101.117.140.443: Flags [.], ack 85092, win 65535, length 0
00:14:48.124085 IP 10.0.2.15.52944 > 151.101.117.140.443: Flags [.], ack 86768, win 65535, length 0
00:14:48.128232 IP 151.101.117.140.443 > 10.0.2.15.52944: Flags [P.], seq 86768:95012, ack 820, win 65535, length 8244
00:14:48.128235 IP 151.101.117.140.443 > 10.0.2.15.52944: Flags [P.], seq 95012:97760, ack 820, win 65535, length 2748
00:14:48.128263 IP 10.0.2.15.52944 > 151.101.117.140.443: Flags [.], ack 95012, win 65535, length 0
00:14:48.128399 IP 10.0.2.15.52944 > 151.101.117.140.443: Flags [.], ack 97760, win 65535, length 0
00:14:48.128445 IP 151.101.117.140.443 > 10.0.2.15.52944: Flags [P.], seq 97760:101882, ack 820, win 65535, length 4122
00:14:48.128451 IP 10.0.2.15.52944 > 151.101.117.140.443: Flags [.], ack 101882, win 65535, length 0
00:14:48.128626 IP 151.101.117.140.443 > 10.0.2.15.52944: Flags [P.], seq 101882:103205, ack 820, win 65535, length 1323
00:14:48.128635 IP 10.0.2.15.52944 > 151.101.117.140.443: Flags [.], ack 103205, win 65535, length 0
00:14:48.130020 IP 151.101.117.140.443 > 10.0.2.15.52944: Flags [P.], seq 103205:110075, ack 820, win 65535, length 6870
00:14:48.130037 IP 10.0.2.15.52944 > 151.101.117.140.443: Flags [.], ack 110075, win 65535, length 0
00:14:48.130493 IP 151.101.117.140.443 > 10.0.2.15.52944: Flags [P.], seq 110075:111449, ack 820, win 65535, length 1374
00:14:48.130504 IP 10.0.2.15.52944 > 151.101.117.140.443: Flags [.], ack 111449, win 65535, length 0
00:14:48.132514 IP 151.101.117.140.443 > 10.0.2.15.52944: Flags [P.], seq 111449:116945, ack 820, win 65535, length 5496
00:14:48.132517 IP 151.101.117.140.443 > 10.0.2.15.52944: Flags [P.], seq 116945:121067, ack 820, win 65535, length 4122
00:14:48.132545 IP 10.0.2.15.52944 > 151.101.117.140.443: Flags [.], ack 116945, win 65535, length 0
00:14:48.132643 IP 10.0.2.15.52944 > 151.101.117.140.443: Flags [.], ack 121067, win 65535, length 0
00:14:48.132885 IP 151.101.117.140.443 > 10.0.2.15.52944: Flags [P.], seq 121067:125189, ack 820, win 65535, length 4122
00:14:48.132896 IP 10.0.2.15.52944 > 151.101.117.140.443: Flags [.], ack 125189, win 65535, length 0
00:14:48.133089 IP 151.101.117.140.443 > 10.0.2.15.52944: Flags [P.], seq 125189:130685, ack 820, win 65535, length 5496
00:14:48.133095 IP 10.0.2.15.52944 > 151.101.117.140.443: Flags [.], ack 130685, win 65535, length 0
00:14:48.134072 IP 151.101.117.140.443 > 10.0.2.15.52944: Flags [P.], seq 130685:134807, ack 820, win 65535, length 4122
00:14:48.134087 IP 10.0.2.15.52944 > 151.101.117.140.443: Flags [.], ack 134807, win 65535, length 0
00:14:48.134405 IP 151.101.117.140.443 > 10.0.2.15.52944: Flags [P.], seq 134807:136071, ack 820, win 65535, length 1264
00:14:48.134416 IP 10.0.2.15.52944 > 151.101.117.140.443: Flags [.], ack 136071, win 65535, length 0
00:14:48.139940 IP 151.101.117.140.443 > 10.0.2.15.52944: Flags [P.], seq 136071:144315, ack 820, win 65535, length 8244
00:14:48.139947 IP 151.101.117.140.443 > 10.0.2.15.52944: Flags [P.], seq 144315:148437, ack 820, win 65535, length 4122
00:14:48.140303 IP 10.0.2.15.52944 > 151.101.117.140.443: Flags [.], ack 144315, win 65535, length 0
00:14:48.140363 IP 10.0.2.15.52944 > 151.101.117.140.443: Flags [.], ack 148437, win 65535, length 0
00:14:48.140557 IP 151.101.117.140.443 > 10.0.2.15.52944: Flags [P.], seq 148437:153882, ack 820, win 65535, length 5445
00:14:48.140584 IP 10.0.2.15.52944 > 151.101.117.140.443: Flags [.], ack 153882, win 65535, length 0
00:14:48.140880 IP 151.101.117.140.443 > 10.0.2.15.52944: Flags [P.], seq 153882:157363, ack 820, win 65535, length 3481
00:14:48.140899 IP 10.0.2.15.52944 > 151.101.117.140.443: Flags [.], ack 157363, win 65535, length 0
00:14:48.141291 IP 151.101.117.140.443 > 10.0.2.15.52944: Flags [P.], seq 157363:158737, ack 820, win 65535, length 1374
00:14:48.141316 IP 10.0.2.15.52944 > 151.101.117.140.443: Flags [.], ack 158737, win 65535, length 0
00:14:48.142187 IP 151.101.117.140.443 > 10.0.2.15.52944: Flags [P.], seq 158737:166981, ack 820, win 65535, length 8244
00:14:48.142192 IP 151.101.117.140.443 > 10.0.2.15.52944: Flags [.], seq 166981:169901, ack 820, win 65535, length 2920
00:14:48.142218 IP 10.0.2.15.52944 > 151.101.117.140.443: Flags [.], ack 166981, win 65535, length 0
00:14:48.142252 IP 10.0.2.15.52944 > 151.101.117.140.443: Flags [.], ack 169901, win 65535, length 0
00:14:48.143707 IP 151.101.117.140.443 > 10.0.2.15.52944: Flags [P.], seq 169901:171686, ack 820, win 65535, length 1785
00:14:48.143711 IP 151.101.117.140.443 > 10.0.2.15.52944: Flags [P.], seq 171686:175808, ack 820, win 65535, length 4122
00:14:48.143713 IP 151.101.117.140.443 > 10.0.2.15.52944: Flags [P.], seq 175808:181304, ack 820, win 65535, length 5496
00:14:48.143846 IP 10.0.2.15.52944 > 151.101.117.140.443: Flags [.], ack 171686, win 65535, length 0
00:14:48.143889 IP 10.0.2.15.52944 > 151.101.117.140.443: Flags [.], ack 175808, win 65535, length 0
00:14:48.144121 IP 10.0.2.15.52944 > 151.101.117.140.443: Flags [.], ack 181304, win 65535, length 0
00:14:48.144167 IP 151.101.117.140.443 > 10.0.2.15.52944: Flags [P.], seq 181304:184052, ack 820, win 65535, length 2748
00:14:48.144340 IP 10.0.2.15.52944 > 151.101.117.140.443: Flags [.], ack 184052, win 65535, length 0
00:14:48.144730 IP 151.101.117.140.443 > 10.0.2.15.52944: Flags [P.], seq 184052:189497, ack 820, win 65535, length 5445
00:14:48.144753 IP 10.0.2.15.52944 > 151.101.117.140.443: Flags [.], ack 189497, win 65535, length 0
00:14:48.145226 IP 151.101.117.140.443 > 10.0.2.15.52944: Flags [P.], seq 189497:193619, ack 820, win 65535, length 4122
00:14:48.145229 IP 151.101.117.140.443 > 10.0.2.15.52944: Flags [P.], seq 193619:196367, ack 820, win 65535, length 2748
00:14:48.145252 IP 10.0.2.15.52944 > 151.101.117.140.443: Flags [.], ack 193619, win 65535, length 0
00:14:48.145272 IP 10.0.2.15.52944 > 151.101.117.140.443: Flags [.], ack 196367, win 65535, length 0
00:14:48.145382 IP 151.101.117.140.443 > 10.0.2.15.52944: Flags [P.], seq 196367:197777, ack 820, win 65535, length 1410
00:14:48.145387 IP 10.0.2.15.52944 > 151.101.117.140.443: Flags [.], ack 197777, win 65535, length 0

