13:05:32.614358 IP 140.233.253.2.53 > 10.0.2.15.42991: 37002 2/0/0 CNAME dualstack.reddit.map.fastly.net., AAAA 2a04:4e42:1c::396 (105)
13:05:32.614713 IP 10.0.2.15.43228 > 151.101.117.140.443: Flags [S], seq 1639133848, win 64240, options [mss 1460,sackOK,TS val 4091092772 ecr 0,nop,wscale 6], length 0
13:05:32.629983 IP 151.101.117.140.443 > 10.0.2.15.43228: Flags [S.], seq 24448001, ack 1639133849, win 65535, options [mss 1460], length 0
13:05:32.630030 IP 10.0.2.15.43228 > 151.101.117.140.443: Flags [.], ack 1, win 64240, length 0
13:05:32.639372 IP 10.0.2.15.43228 > 151.101.117.140.443: Flags [P.], seq 1:518, ack 1, win 64240, length 517
13:05:32.640451 IP 151.101.117.140.443 > 10.0.2.15.43228: Flags [.], ack 518, win 65535, length 0
13:05:32.657322 IP 151.101.117.140.443 > 10.0.2.15.43228: Flags [.], seq 1:2921, ack 518, win 65535, length 2920
13:05:32.657347 IP 10.0.2.15.43228 > 151.101.117.140.443: Flags [.], ack 2921, win 62780, length 0
13:05:32.657955 IP 151.101.117.140.443 > 10.0.2.15.43228: Flags [P.], seq 2921:3722, ack 518, win 65535, length 801
13:05:32.657974 IP 10.0.2.15.43228 > 151.101.117.140.443: Flags [.], ack 3722, win 62780, length 0
13:05:32.659015 IP 10.0.2.15.43228 > 151.101.117.140.443: Flags [P.], seq 518:598, ack 3722, win 62780, length 80
13:05:32.659313 IP 10.0.2.15.43228 > 151.101.117.140.443: Flags [P.], seq 598:644, ack 3722, win 62780, length 46
13:05:32.659343 IP 10.0.2.15.43228 > 151.101.117.140.443: Flags [P.], seq 644:693, ack 3722, win 62780, length 49
13:05:32.659539 IP 10.0.2.15.43228 > 151.101.117.140.443: Flags [P.], seq 693:728, ack 3722, win 62780, length 35
13:05:32.659680 IP 151.101.117.140.443 > 10.0.2.15.43228: Flags [.], ack 598, win 65535, length 0
13:05:32.659681 IP 151.101.117.140.443 > 10.0.2.15.43228: Flags [.], ack 644, win 65535, length 0
13:05:32.659682 IP 151.101.117.140.443 > 10.0.2.15.43228: Flags [.], ack 693, win 65535, length 0
13:05:32.659723 IP 10.0.2.15.43228 > 151.101.117.140.443: Flags [P.], seq 728:790, ack 3722, win 62780, length 62
13:05:32.662314 IP 151.101.117.140.443 > 10.0.2.15.43228: Flags [.], ack 728, win 65535, length 0
13:05:32.662318 IP 151.101.117.140.443 > 10.0.2.15.43228: Flags [.], ack 790, win 65535, length 0
13:05:32.673653 IP 151.101.117.140.443 > 10.0.2.15.43228: Flags [P.], seq 3722:3803, ack 790, win 65535, length 81
13:05:32.673679 IP 10.0.2.15.43228 > 151.101.117.140.443: Flags [.], ack 3803, win 62780, length 0
13:05:32.673914 IP 10.0.2.15.43228 > 151.101.117.140.443: Flags [P.], seq 790:821, ack 3803, win 62780, length 31
13:05:32.674370 IP 151.101.117.140.443 > 10.0.2.15.43228: Flags [.], ack 821, win 65535, length 0
13:05:33.188197 IP 151.101.117.140.443 > 10.0.2.15.43228: Flags [P.], seq 3803:10673, ack 821, win 65535, length 6870
13:05:33.188241 IP 10.0.2.15.43228 > 151.101.117.140.443: Flags [.], ack 10673, win 59860, length 0
13:05:33.190399 IP 151.101.117.140.443 > 10.0.2.15.43228: Flags [P.], seq 10673:18917, ack 821, win 65535, length 8244
13:05:33.190425 IP 10.0.2.15.43228 > 151.101.117.140.443: Flags [.], ack 18917, win 58400, length 0
13:05:33.192181 IP 151.101.117.140.443 > 10.0.2.15.43228: Flags [P.], seq 18917:27161, ack 821, win 65535, length 8244
13:05:33.192199 IP 10.0.2.15.43228 > 151.101.117.140.443: Flags [.], ack 27161, win 58400, length 0
13:05:33.193075 IP 151.101.117.140.443 > 10.0.2.15.43228: Flags [P.], seq 27161:29909, ack 821, win 65535, length 2748
13:05:33.193088 IP 10.0.2.15.43228 > 151.101.117.140.443: Flags [.], ack 29909, win 62780, length 0
13:05:33.196709 IP 151.101.117.140.443 > 10.0.2.15.43228: Flags [P.], seq 29909:42275, ack 821, win 65535, length 12366
13:05:33.196740 IP 10.0.2.15.43228 > 151.101.117.140.443: Flags [.], ack 42275, win 55480, length 0
13:05:33.197162 IP 151.101.117.140.443 > 10.0.2.15.43228: Flags [P.], seq 42275:45023, ack 821, win 65535, length 2748
13:05:33.197188 IP 10.0.2.15.43228 > 151.101.117.140.443: Flags [.], ack 45023, win 61320, length 0
13:05:33.201298 IP 151.101.117.140.443 > 10.0.2.15.43228: Flags [P.], seq 45023:51893, ack 821, win 65535, length 6870
13:05:33.201317 IP 10.0.2.15.43228 > 151.101.117.140.443: Flags [.], ack 51893, win 59860, length 0
13:05:33.202262 IP 151.101.117.140.443 > 10.0.2.15.43228: Flags [P.], seq 51893:57389, ack 821, win 65535, length 5496
13:05:33.202278 IP 10.0.2.15.43228 > 151.101.117.140.443: Flags [.], ack 57389, win 61320, length 0
13:05:33.203518 IP 151.101.117.140.443 > 10.0.2.15.43228: Flags [P.], seq 57389:60137, ack 821, win 65535, length 2748
13:05:33.203530 IP 10.0.2.15.43228 > 151.101.117.140.443: Flags [.], ack 60137, win 62780, length 0
13:05:33.204478 IP 151.101.117.140.443 > 10.0.2.15.43228: Flags [P.], seq 60137:67007, ack 821, win 65535, length 6870
13:05:33.204532 IP 10.0.2.15.43228 > 151.101.117.140.443: Flags [.], ack 67007, win 59860, length 0
13:05:33.205423 IP 151.101.117.140.443 > 10.0.2.15.43228: Flags [P.], seq 67007:73877, ack 821, win 65535, length 6870
13:05:33.205439 IP 10.0.2.15.43228 > 151.101.117.140.443: Flags [.], ack 73877, win 59860, length 0
13:05:33.206614 IP 151.101.117.140.443 > 10.0.2.15.43228: Flags [P.], seq 73877:80747, ack 821, win 65535, length 6870
13:05:33.206737 IP 10.0.2.15.43228 > 151.101.117.140.443: Flags [.], ack 80747, win 65535, length 0
13:05:33.207724 IP 151.101.117.140.443 > 10.0.2.15.43228: Flags [P.], seq 80747:86243, ack 821, win 65535, length 5496
13:05:33.207740 IP 10.0.2.15.43228 > 151.101.117.140.443: Flags [.], ack 86243, win 65535, length 0
13:05:33.209176 IP 151.101.117.140.443 > 10.0.2.15.43228: Flags [P.], seq 86243:91739, ack 821, win 65535, length 5496
13:05:33.209199 IP 10.0.2.15.43228 > 151.101.117.140.443: Flags [.], ack 91739, win 65535, length 0
13:05:33.210348 IP 151.101.117.140.443 > 10.0.2.15.43228: Flags [P.], seq 91739:105479, ack 821, win 65535, length 13740
13:05:33.210364 IP 10.0.2.15.43228 > 151.101.117.140.443: Flags [.], ack 105479, win 65535, length 0
13:05:33.211130 IP 151.101.117.140.443 > 10.0.2.15.43228: Flags [P.], seq 105479:112349, ack 821, win 65535, length 6870
13:05:33.211146 IP 10.0.2.15.43228 > 151.101.117.140.443: Flags [.], ack 112349, win 65535, length 0
13:05:33.213634 IP 151.101.117.140.443 > 10.0.2.15.43228: Flags [P.], seq 112349:121967, ack 821, win 65535, length 9618
13:05:33.213650 IP 10.0.2.15.43228 > 151.101.117.140.443: Flags [.], ack 121967, win 65535, length 0
13:05:33.216464 IP 151.101.117.140.443 > 10.0.2.15.43228: Flags [P.], seq 121967:137081, ack 821, win 65535, length 15114
13:05:33.216484 IP 10.0.2.15.43228 > 151.101.117.140.443: Flags [.], ack 137081, win 65535, length 0
13:05:33.216637 IP 151.101.117.140.443 > 10.0.2.15.43228: Flags [P.], seq 137081:141203, ack 821, win 65535, length 4122
13:05:33.216639 IP 151.101.117.140.443 > 10.0.2.15.43228: Flags [P.], seq 141203:149447, ack 821, win 65535, length 8244
13:05:33.216650 IP 10.0.2.15.43228 > 151.101.117.140.443: Flags [.], ack 141203, win 65535, length 0
13:05:33.216761 IP 10.0.2.15.43228 > 151.101.117.140.443: Flags [.], ack 149447, win 65535, length 0
13:05:33.216781 IP 151.101.117.140.443 > 10.0.2.15.43228: Flags [P.], seq 149447:150821, ack 821, win 65535, length 1374
13:05:33.216786 IP 10.0.2.15.43228 > 151.101.117.140.443: Flags [.], ack 150821, win 65535, length 0
13:05:33.217965 IP 151.101.117.140.443 > 10.0.2.15.43228: Flags [P.], seq 150821:157691, ack 821, win 65535, length 6870
13:05:33.218025 IP 10.0.2.15.43228 > 151.101.117.140.443: Flags [.], ack 157691, win 65535, length 0
13:05:33.218239 IP 151.101.117.140.443 > 10.0.2.15.43228: Flags [P.], seq 157691:165935, ack 821, win 65535, length 8244
13:05:33.218249 IP 10.0.2.15.43228 > 151.101.117.140.443: Flags [.], ack 165935, win 65535, length 0
13:05:33.218461 IP 151.101.117.140.443 > 10.0.2.15.43228: Flags [P.], seq 165935:167309, ack 821, win 65535, length 1374
13:05:33.218467 IP 10.0.2.15.43228 > 151.101.117.140.443: Flags [.], ack 167309, win 65535, length 0
13:05:33.220188 IP 151.101.117.140.443 > 10.0.2.15.43228: Flags [P.], seq 167309:174179, ack 821, win 65535, length 6870
13:05:33.220205 IP 10.0.2.15.43228 > 151.101.117.140.443: Flags [.], ack 174179, win 65535, length 0
13:05:33.220473 IP 151.101.117.140.443 > 10.0.2.15.43228: Flags [P.], seq 174179:182423, ack 821, win 65535, length 8244
13:05:33.220484 IP 10.0.2.15.43228 > 151.101.117.140.443: Flags [.], ack 182423, win 65535, length 0
13:05:33.220699 IP 151.101.117.140.443 > 10.0.2.15.43228: Flags [P.], seq 182423:183797, ack 821, win 65535, length 1374
13:05:33.220706 IP 10.0.2.15.43228 > 151.101.117.140.443: Flags [.], ack 183797, win 65535, length 0
13:05:33.221570 IP 151.101.117.140.443 > 10.0.2.15.43228: Flags [P.], seq 183797:190667, ack 821, win 65535, length 6870
13:05:33.221630 IP 10.0.2.15.43228 > 151.101.117.140.443: Flags [.], ack 190667, win 65535, length 0
13:05:33.221962 IP 151.101.117.140.443 > 10.0.2.15.43228: Flags [P.], seq 190667:197537, ack 821, win 65535, length 6870
13:05:33.221976 IP 10.0.2.15.43228 > 151.101.117.140.443: Flags [.], ack 197537, win 65535, length 0
13:05:33.223377 IP 151.101.117.140.443 > 10.0.2.15.43228: Flags [P.], seq 197537:197612, ack 821, win 65535, length 75
13:05:33.223410 IP 10.0.2.15.43228 > 151.101.117.140.443: Flags [.], ack 197612, win 65535, length 0
13:05:34.189644 IP 151.101.117.140.443 > 10.0.2.15.43228: Flags [P.], seq 197612:201831, ack 821, win 65535, length 4219
13:05:34.189721 IP 10.0.2.15.43228 > 151.101.117.140.443: Flags [.], ack 201831, win 65535, length 0
13:05:34.189977 IP 151.101.117.140.443 > 10.0.2.15.43228: Flags [P.], seq 201831:212823, ack 821, win 65535, length 10992
13:05:34.189992 IP 10.0.2.15.43228 > 151.101.117.140.443: Flags [.], ack 212823, win 65535, length 0
13:05:34.190562 IP 151.101.117.140.443 > 10.0.2.15.43228: Flags [P.], seq 212823:221010, ack 821, win 65535, length 8187
13:05:34.190584 IP 10.0.2.15.43228 > 151.101.117.140.443: Flags [.], ack 221010, win 65535, length 0
13:05:34.190927 IP 151.101.117.140.443 > 10.0.2.15.43228: Flags [P.], seq 221010:227880, ack 821, win 65535, length 6870
13:05:34.190948 IP 10.0.2.15.43228 > 151.101.117.140.443: Flags [.], ack 227880, win 65535, length 0
13:05:34.191192 IP 151.101.117.140.443 > 10.0.2.15.43228: Flags [P.], seq 227880:234707, ack 821, win 65535, length 6827
13:05:34.191212 IP 10.0.2.15.43228 > 151.101.117.140.443: Flags [.], ack 234707, win 65535, length 0
13:05:34.191475 IP 151.101.117.140.443 > 10.0.2.15.43228: Flags [P.], seq 234707:242930, ack 821, win 65535, length 8223
13:05:34.191490 IP 10.0.2.15.43228 > 151.101.117.140.443: Flags [.], ack 242930, win 65535, length 0
13:05:34.192119 IP 151.101.117.140.443 > 10.0.2.15.43228: Flags [P.], seq 242930:248426, ack 821, win 65535, length 5496
13:05:34.192134 IP 10.0.2.15.43228 > 151.101.117.140.443: Flags [.], ack 248426, win 65535, length 0
13:05:34.192286 IP 151.101.117.140.443 > 10.0.2.15.43228: Flags [P.], seq 248426:258044, ack 821, win 65535, length 9618
13:05:34.192295 IP 10.0.2.15.43228 > 151.101.117.140.443: Flags [.], ack 258044, win 65535, length 0
13:05:34.192929 IP 151.101.117.140.443 > 10.0.2.15.43228: Flags [P.], seq 258044:264914, ack 821, win 65535, length 6870
13:05:34.192931 IP 151.101.117.140.443 > 10.0.2.15.43228: Flags [.], seq 264914:269294, ack 821, win 65535, length 4380
13:05:34.192951 IP 10.0.2.15.43228 > 151.101.117.140.443: Flags [.], ack 264914, win 65535, length 0
13:05:34.192977 IP 10.0.2.15.43228 > 151.101.117.140.443: Flags [.], ack 269294, win 65535, length 0
13:05:34.193100 IP 151.101.117.140.443 > 10.0.2.15.43228: Flags [P.], seq 269294:273900, ack 821, win 65535, length 4606
13:05:34.193145 IP 10.0.2.15.43228 > 151.101.117.140.443: Flags [.], ack 273900, win 65535, length 0
13:05:34.193466 IP 151.101.117.140.443 > 10.0.2.15.43228: Flags [P.], seq 273900:280770, ack 821, win 65535, length 6870
13:05:34.193481 IP 10.0.2.15.43228 > 151.101.117.140.443: Flags [.], ack 280770, win 65535, length 0
13:05:34.194594 IP 151.101.117.140.443 > 10.0.2.15.43228: Flags [P.], seq 280770:289014, ack 821, win 65535, length 8244
13:05:34.194670 IP 10.0.2.15.43228 > 151.101.117.140.443: Flags [.], ack 289014, win 65535, length 0
13:05:34.195279 IP 151.101.117.140.443 > 10.0.2.15.43228: Flags [P.], seq 289014:300006, ack 821, win 65535, length 10992
13:05:34.195299 IP 10.0.2.15.43228 > 151.101.117.140.443: Flags [.], ack 300006, win 65535, length 0
13:05:34.195328 IP 151.101.117.140.443 > 10.0.2.15.43228: Flags [P.], seq 300006:305568, ack 821, win 65535, length 5562
13:05:34.195334 IP 10.0.2.15.43228 > 151.101.117.140.443: Flags [.], ack 305568, win 65535, length 0
13:05:34.195736 IP 151.101.117.140.443 > 10.0.2.15.43228: Flags [P.], seq 305568:318324, ack 821, win 65535, length 12756
13:05:34.195753 IP 10.0.2.15.43228 > 151.101.117.140.443: Flags [.], ack 318324, win 65535, length 0
13:05:34.196098 IP 151.101.117.140.443 > 10.0.2.15.43228: Flags [P.], seq 318324:325194, ack 821, win 65535, length 6870
13:05:34.196115 IP 10.0.2.15.43228 > 151.101.117.140.443: Flags [.], ack 325194, win 65535, length 0
13:05:34.196397 IP 151.101.117.140.443 > 10.0.2.15.43228: Flags [.], seq 325194:326654, ack 821, win 65535, length 1460
13:05:34.196409 IP 10.0.2.15.43228 > 151.101.117.140.443: Flags [.], ack 326654, win 65535, length 0
13:05:34.196552 IP 151.101.117.140.443 > 10.0.2.15.43228: Flags [P.], seq 326654:333381, ack 821, win 65535, length 6727
13:05:34.196561 IP 10.0.2.15.43228 > 151.101.117.140.443: Flags [.], ack 333381, win 65535, length 0
13:05:34.196899 IP 151.101.117.140.443 > 10.0.2.15.43228: Flags [P.], seq 333381:338893, ack 821, win 65535, length 5512
13:05:34.196939 IP 10.0.2.15.43228 > 151.101.117.140.443: Flags [.], ack 338893, win 65535, length 0
13:05:34.197238 IP 151.101.117.140.443 > 10.0.2.15.43228: Flags [P.], seq 338893:348511, ack 821, win 65535, length 9618
13:05:34.197381 IP 10.0.2.15.43228 > 151.101.117.140.443: Flags [.], ack 348511, win 65535, length 0
13:05:34.197769 IP 151.101.117.140.443 > 10.0.2.15.43228: Flags [P.], seq 348511:356698, ack 821, win 65535, length 8187
13:05:34.197799 IP 10.0.2.15.43228 > 151.101.117.140.443: Flags [.], ack 356698, win 65535, length 0
13:05:34.198071 IP 151.101.117.140.443 > 10.0.2.15.43228: Flags [P.], seq 356698:359446, ack 821, win 65535, length 2748
13:05:34.198080 IP 10.0.2.15.43228 > 151.101.117.140.443: Flags [.], ack 359446, win 65535, length 0
13:05:34.198947 IP 151.101.117.140.443 > 10.0.2.15.43228: Flags [P.], seq 359446:367690, ack 821, win 65535, length 8244
13:05:34.198969 IP 10.0.2.15.43228 > 151.101.117.140.443: Flags [.], ack 367690, win 65535, length 0
13:05:34.199115 IP 151.101.117.140.443 > 10.0.2.15.43228: Flags [.], seq 367690:370610, ack 821, win 65535, length 2920
13:05:34.199123 IP 10.0.2.15.43228 > 151.101.117.140.443: Flags [.], ack 370610, win 65535, length 0
13:05:34.199298 IP 151.101.117.140.443 > 10.0.2.15.43228: Flags [P.], seq 370610:375934, ack 821, win 65535, length 5324
13:05:34.199308 IP 10.0.2.15.43228 > 151.101.117.140.443: Flags [.], ack 375934, win 65535, length 0
13:05:34.199634 IP 151.101.117.140.443 > 10.0.2.15.43228: Flags [P.], seq 375934:381430, ack 821, win 65535, length 5496
13:05:34.199649 IP 10.0.2.15.43228 > 151.101.117.140.443: Flags [.], ack 381430, win 65535, length 0
13:05:34.200176 IP 151.101.117.140.443 > 10.0.2.15.43228: Flags [P.], seq 381430:393796, ack 821, win 65535, length 12366
13:05:34.200190 IP 10.0.2.15.43228 > 151.101.117.140.443: Flags [.], ack 393796, win 65535, length 0
13:05:34.200413 IP 151.101.117.140.443 > 10.0.2.15.43228: Flags [P.], seq 393796:400666, ack 821, win 65535, length 6870
13:05:34.200430 IP 10.0.2.15.43228 > 151.101.117.140.443: Flags [.], ack 400666, win 65535, length 0
13:05:34.200795 IP 151.101.117.140.443 > 10.0.2.15.43228: Flags [P.], seq 400666:408910, ack 821, win 65535, length 8244
13:05:34.200808 IP 10.0.2.15.43228 > 151.101.117.140.443: Flags [.], ack 408910, win 65535, length 0
13:05:34.201300 IP 151.101.117.140.443 > 10.0.2.15.43228: Flags [P.], seq 408910:419401, ack 821, win 65535, length 10491
13:05:34.201316 IP 10.0.2.15.43228 > 151.101.117.140.443: Flags [.], ack 419401, win 65535, length 0
13:05:34.206621 IP 151.101.117.140.443 > 10.0.2.15.43228: Flags [P.], seq 419401:422149, ack 821, win 65535, length 2748
13:05:34.206702 IP 10.0.2.15.43228 > 151.101.117.140.443: Flags [.], ack 422149, win 65535, length 0
13:05:34.207603 IP 151.101.117.140.443 > 10.0.2.15.43228: Flags [P.], seq 422149:434515, ack 821, win 65535, length 12366
13:05:34.207626 IP 10.0.2.15.43228 > 151.101.117.140.443: Flags [.], ack 434515, win 65535, length 0
13:05:34.207988 IP 151.101.117.140.443 > 10.0.2.15.43228: Flags [P.], seq 434515:440011, ack 821, win 65535, length 5496
13:05:34.208005 IP 10.0.2.15.43228 > 151.101.117.140.443: Flags [.], ack 440011, win 65535, length 0
13:05:34.208201 IP 151.101.117.140.443 > 10.0.2.15.43228: Flags [P.], seq 440011:445507, ack 821, win 65535, length 5496
13:05:34.208248 IP 10.0.2.15.43228 > 151.101.117.140.443: Flags [.], ack 445507, win 65535, length 0
13:05:34.209690 IP 151.101.117.140.443 > 10.0.2.15.43228: Flags [P.], seq 445507:452377, ack 821, win 65535, length 6870
13:05:34.209711 IP 10.0.2.15.43228 > 151.101.117.140.443: Flags [.], ack 452377, win 65535, length 0
13:05:34.211834 IP 151.101.117.140.443 > 10.0.2.15.43228: Flags [P.], seq 452377:464743, ack 821, win 65535, length 12366
13:05:34.211856 IP 10.0.2.15.43228 > 151.101.117.140.443: Flags [.], ack 464743, win 65535, length 0
13:05:34.212489 IP 151.101.117.140.443 > 10.0.2.15.43228: Flags [P.], seq 464743:472987, ack 821, win 65535, length 8244
13:05:34.212508 IP 10.0.2.15.43228 > 151.101.117.140.443: Flags [.], ack 472987, win 65535, length 0
13:05:34.212642 IP 151.101.117.140.443 > 10.0.2.15.43228: Flags [P.], seq 472987:478483, ack 821, win 65535, length 5496
13:05:34.212650 IP 10.0.2.15.43228 > 151.101.117.140.443: Flags [.], ack 478483, win 65535, length 0
13:05:34.213005 IP 151.101.117.140.443 > 10.0.2.15.43228: Flags [P.], seq 478483:481231, ack 821, win 65535, length 2748
13:05:34.213019 IP 10.0.2.15.43228 > 151.101.117.140.443: Flags [.], ack 481231, win 65535, length 0
13:05:34.214255 IP 151.101.117.140.443 > 10.0.2.15.43228: Flags [P.], seq 481231:490849, ack 821, win 65535, length 9618
13:05:34.214276 IP 10.0.2.15.43228 > 151.101.117.140.443: Flags [.], ack 490849, win 65535, length 0
13:05:34.214876 IP 151.101.117.140.443 > 10.0.2.15.43228: Flags [P.], seq 490849:496345, ack 821, win 65535, length 5496
13:05:34.215033 IP 10.0.2.15.43228 > 151.101.117.140.443: Flags [.], ack 496345, win 65535, length 0
13:05:34.215218 IP 151.101.117.140.443 > 10.0.2.15.43228: Flags [P.], seq 496345:501841, ack 821, win 65535, length 5496
13:05:34.215229 IP 10.0.2.15.43228 > 151.101.117.140.443: Flags [.], ack 501841, win 65535, length 0
13:05:34.216316 IP 151.101.117.140.443 > 10.0.2.15.43228: Flags [P.], seq 501841:511459, ack 821, win 65535, length 9618
13:05:34.216338 IP 10.0.2.15.43228 > 151.101.117.140.443: Flags [.], ack 511459, win 65535, length 0
13:05:34.216757 IP 151.101.117.140.443 > 10.0.2.15.43228: Flags [P.], seq 511459:522451, ack 821, win 65535, length 10992
13:05:34.216773 IP 10.0.2.15.43228 > 151.101.117.140.443: Flags [.], ack 522451, win 65535, length 0
13:05:34.219292 IP 151.101.117.140.443 > 10.0.2.15.43228: Flags [P.], seq 522451:530695, ack 821, win 65535, length 8244
13:05:34.219315 IP 10.0.2.15.43228 > 151.101.117.140.443: Flags [.], ack 530695, win 65535, length 0
13:05:34.219540 IP 151.101.117.140.443 > 10.0.2.15.43228: Flags [P.], seq 530695:540313, ack 821, win 65535, length 9618
13:05:34.219555 IP 10.0.2.15.43228 > 151.101.117.140.443: Flags [.], ack 540313, win 65535, length 0
13:05:34.219745 IP 151.101.117.140.443 > 10.0.2.15.43228: Flags [.], seq 540313:543233, ack 821, win 65535, length 2920
13:05:34.219757 IP 10.0.2.15.43228 > 151.101.117.140.443: Flags [.], ack 543233, win 65535, length 0
13:05:34.219895 IP 151.101.117.140.443 > 10.0.2.15.43228: Flags [P.], seq 543233:547183, ack 821, win 65535, length 3950
13:05:34.219903 IP 10.0.2.15.43228 > 151.101.117.140.443: Flags [.], ack 547183, win 65535, length 0
13:05:34.222844 IP 151.101.117.140.443 > 10.0.2.15.43228: Flags [P.], seq 547183:555427, ack 821, win 65535, length 8244
13:05:34.222847 IP 151.101.117.140.443 > 10.0.2.15.43228: Flags [.], seq 555427:556887, ack 821, win 65535, length 1460
13:05:34.222873 IP 10.0.2.15.43228 > 151.101.117.140.443: Flags [.], ack 555427, win 65535, length 0
13:05:34.223013 IP 10.0.2.15.43228 > 151.101.117.140.443: Flags [.], ack 556887, win 65535, length 0
13:05:34.223160 IP 151.101.117.140.443 > 10.0.2.15.43228: Flags [P.], seq 556887:563671, ack 821, win 65535, length 6784
13:05:34.223173 IP 10.0.2.15.43228 > 151.101.117.140.443: Flags [.], ack 563671, win 65535, length 0
13:05:34.223708 IP 151.101.117.140.443 > 10.0.2.15.43228: Flags [P.], seq 563671:574663, ack 821, win 65535, length 10992
13:05:34.223721 IP 10.0.2.15.43228 > 151.101.117.140.443: Flags [.], ack 574663, win 65535, length 0
13:05:34.223746 IP 151.101.117.140.443 > 10.0.2.15.43228: Flags [.], seq 574663:576123, ack 821, win 65535, length 1460
13:05:34.223750 IP 10.0.2.15.43228 > 151.101.117.140.443: Flags [.], ack 576123, win 65535, length 0
13:05:34.223834 IP 151.101.117.140.443 > 10.0.2.15.43228: Flags [P.], seq 576123:580159, ack 821, win 65535, length 4036
13:05:34.223839 IP 10.0.2.15.43228 > 151.101.117.140.443: Flags [.], ack 580159, win 65535, length 0
13:05:34.225181 IP 151.101.117.140.443 > 10.0.2.15.43228: Flags [P.], seq 580159:589777, ack 821, win 65535, length 9618
13:05:34.225185 IP 151.101.117.140.443 > 10.0.2.15.43228: Flags [P.], seq 589777:593899, ack 821, win 65535, length 4122
13:05:34.225213 IP 10.0.2.15.43228 > 151.101.117.140.443: Flags [.], ack 589777, win 65535, length 0
13:05:34.225423 IP 10.0.2.15.43228 > 151.101.117.140.443: Flags [.], ack 593899, win 65535, length 0
13:05:34.225947 IP 151.101.117.140.443 > 10.0.2.15.43228: Flags [P.], seq 593899:606265, ack 821, win 65535, length 12366
13:05:34.225965 IP 10.0.2.15.43228 > 151.101.117.140.443: Flags [.], ack 606265, win 65535, length 0
13:05:34.226317 IP 151.101.117.140.443 > 10.0.2.15.43228: Flags [P.], seq 606265:610387, ack 821, win 65535, length 4122
13:05:34.226364 IP 10.0.2.15.43228 > 151.101.117.140.443: Flags [.], ack 610387, win 65535, length 0
13:05:34.228198 IP 151.101.117.140.443 > 10.0.2.15.43228: Flags [P.], seq 610387:620005, ack 821, win 65535, length 9618
13:05:34.228222 IP 10.0.2.15.43228 > 151.101.117.140.443: Flags [.], ack 620005, win 65535, length 0
13:05:34.228806 IP 151.101.117.140.443 > 10.0.2.15.43228: Flags [P.], seq 620005:630997, ack 821, win 65535, length 10992
13:05:34.228827 IP 10.0.2.15.43228 > 151.101.117.140.443: Flags [.], ack 630997, win 65535, length 0
13:05:34.229154 IP 151.101.117.140.443 > 10.0.2.15.43228: Flags [P.], seq 630997:643363, ack 821, win 65535, length 12366
13:05:34.229291 IP 10.0.2.15.43228 > 151.101.117.140.443: Flags [.], ack 643363, win 65535, length 0
13:05:34.231251 IP 151.101.117.140.443 > 10.0.2.15.43228: Flags [P.], seq 643363:651607, ack 821, win 65535, length 8244
13:05:34.231276 IP 10.0.2.15.43228 > 151.101.117.140.443: Flags [.], ack 651607, win 65535, length 0
13:05:34.232267 IP 151.101.117.140.443 > 10.0.2.15.43228: Flags [P.], seq 651607:657103, ack 821, win 65535, length 5496
13:05:34.232345 IP 10.0.2.15.43228 > 151.101.117.140.443: Flags [.], ack 657103, win 65535, length 0
13:05:34.232597 IP 151.101.117.140.443 > 10.0.2.15.43228: Flags [P.], seq 657103:673591, ack 821, win 65535, length 16488
13:05:34.232610 IP 10.0.2.15.43228 > 151.101.117.140.443: Flags [.], ack 673591, win 65535, length 0
13:05:34.233079 IP 151.101.117.140.443 > 10.0.2.15.43228: Flags [P.], seq 673591:683209, ack 821, win 65535, length 9618
13:05:34.233096 IP 10.0.2.15.43228 > 151.101.117.140.443: Flags [.], ack 683209, win 65535, length 0
13:05:34.233384 IP 151.101.117.140.443 > 10.0.2.15.43228: Flags [.], seq 683209:690509, ack 821, win 65535, length 7300
13:05:34.233399 IP 10.0.2.15.43228 > 151.101.117.140.443: Flags [.], ack 690509, win 65535, length 0
13:05:34.233574 IP 151.101.117.140.443 > 10.0.2.15.43228: Flags [P.], seq 690509:692827, ack 821, win 65535, length 2318
13:05:34.233583 IP 10.0.2.15.43228 > 151.101.117.140.443: Flags [.], ack 692827, win 65535, length 0

