20:06:21.898265 IP 10.0.2.15.38643 > 140.233.253.2.53: 40821+ A? www.reddit.com. (32)
20:06:21.898318 IP 10.0.2.15.38643 > 140.233.253.2.53: 30064+ AAAA? www.reddit.com. (32)
20:06:21.904774 IP 140.233.253.2.53 > 10.0.2.15.38643: 40821 2/0/0 CNAME reddit.map.fastly.net., A 151.101.117.140 (83)
20:06:21.904777 IP 140.233.253.2.53 > 10.0.2.15.38643: 30064 1/1/0 CNAME reddit.map.fastly.net. (125)
20:06:21.905052 IP 10.0.2.15.53170 > 151.101.117.140.443: Flags [S], seq 2162372218, win 64240, options [mss 1460,sackOK,TS val 3623871089 ecr 0,nop,wscale 6], length 0
20:06:21.919390 IP 151.101.117.140.443 > 10.0.2.15.53170: Flags [S.], seq 228672001, ack 2162372219, win 65535, options [mss 1460], length 0
20:06:21.919604 IP 10.0.2.15.53170 > 151.101.117.140.443: Flags [.], ack 1, win 64240, length 0
20:06:21.927559 IP 10.0.2.15.53170 > 151.101.117.140.443: Flags [P.], seq 1:518, ack 1, win 64240, length 517
20:06:21.927897 IP 151.101.117.140.443 > 10.0.2.15.53170: Flags [.], ack 518, win 65535, length 0
20:06:21.944355 IP 151.101.117.140.443 > 10.0.2.15.53170: Flags [P.], seq 1:2749, ack 518, win 65535, length 2748
20:06:21.944378 IP 10.0.2.15.53170 > 151.101.117.140.443: Flags [.], ack 2749, win 62780, length 0
20:06:21.944952 IP 151.101.117.140.443 > 10.0.2.15.53170: Flags [P.], seq 2749:3722, ack 518, win 65535, length 973
20:06:21.944974 IP 10.0.2.15.53170 > 151.101.117.140.443: Flags [.], ack 3722, win 61807, length 0
20:06:21.946245 IP 10.0.2.15.53170 > 151.101.117.140.443: Flags [P.], seq 518:598, ack 3722, win 61807, length 80
20:06:21.946606 IP 151.101.117.140.443 > 10.0.2.15.53170: Flags [.], ack 598, win 65535, length 0
20:06:21.946899 IP 10.0.2.15.53170 > 151.101.117.140.443: Flags [P.], seq 598:644, ack 3722, win 61807, length 46
20:06:21.946938 IP 10.0.2.15.53170 > 151.101.117.140.443: Flags [P.], seq 644:693, ack 3722, win 61807, length 49
20:06:21.947102 IP 10.0.2.15.53170 > 151.101.117.140.443: Flags [P.], seq 693:728, ack 3722, win 61807, length 35
20:06:21.947166 IP 151.101.117.140.443 > 10.0.2.15.53170: Flags [.], ack 644, win 65535, length 0
20:06:21.947264 IP 151.101.117.140.443 > 10.0.2.15.53170: Flags [.], ack 693, win 65535, length 0
20:06:21.947264 IP 151.101.117.140.443 > 10.0.2.15.53170: Flags [.], ack 728, win 65535, length 0
20:06:21.947301 IP 10.0.2.15.53170 > 151.101.117.140.443: Flags [P.], seq 728:790, ack 3722, win 61807, length 62
20:06:21.947475 IP 151.101.117.140.443 > 10.0.2.15.53170: Flags [.], ack 790, win 65535, length 0
20:06:21.960210 IP 151.101.117.140.443 > 10.0.2.15.53170: Flags [P.], seq 3722:3772, ack 790, win 65535, length 50
20:06:21.960228 IP 10.0.2.15.53170 > 151.101.117.140.443: Flags [.], ack 3772, win 62780, length 0
20:06:21.960434 IP 10.0.2.15.53170 > 151.101.117.140.443: Flags [P.], seq 790:821, ack 3772, win 62780, length 31
20:06:21.960688 IP 151.101.117.140.443 > 10.0.2.15.53170: Flags [.], ack 821, win 65535, length 0
20:06:21.960690 IP 151.101.117.140.443 > 10.0.2.15.53170: Flags [P.], seq 3772:3803, ack 821, win 65535, length 31
20:06:21.960708 IP 10.0.2.15.53170 > 151.101.117.140.443: Flags [.], ack 3803, win 62780, length 0
20:06:22.214029 IP 151.101.117.140.443 > 10.0.2.15.53170: Flags [.], seq 3803:12563, ack 821, win 65535, length 8760
20:06:22.214161 IP 10.0.2.15.53170 > 151.101.117.140.443: Flags [.], ack 12563, win 58400, length 0
20:06:22.215904 IP 151.101.117.140.443 > 10.0.2.15.53170: Flags [.], seq 12563:22783, ack 821, win 65535, length 10220
20:06:22.215927 IP 10.0.2.15.53170 > 151.101.117.140.443: Flags [.], ack 22783, win 52560, length 0
20:06:22.216132 IP 151.101.117.140.443 > 10.0.2.15.53170: Flags [.], seq 22783:34463, ack 821, win 65535, length 11680
20:06:22.216144 IP 10.0.2.15.53170 > 151.101.117.140.443: Flags [.], ack 34463, win 43800, length 0
20:06:22.216273 IP 151.101.117.140.443 > 10.0.2.15.53170: Flags [.], seq 34463:41763, ack 821, win 65535, length 7300
20:06:22.216283 IP 10.0.2.15.53170 > 151.101.117.140.443: Flags [.], ack 41763, win 39420, length 0
20:06:22.216549 IP 151.101.117.140.443 > 10.0.2.15.53170: Flags [P.], seq 41763:42494, ack 821, win 65535, length 731
20:06:22.216602 IP 10.0.2.15.53170 > 151.101.117.140.443: Flags [.], ack 42494, win 38689, length 0
20:06:22.217011 IP 151.101.117.140.443 > 10.0.2.15.53170: Flags [P.], seq 42494:43868, ack 821, win 65535, length 1374
20:06:22.217025 IP 10.0.2.15.53170 > 151.101.117.140.443: Flags [.], ack 43868, win 37960, length 0
20:06:22.227875 IP 151.101.117.140.443 > 10.0.2.15.53170: Flags [P.], seq 43868:46616, ack 821, win 65535, length 2748
20:06:22.227895 IP 10.0.2.15.53170 > 151.101.117.140.443: Flags [.], ack 46616, win 62780, length 0
20:06:22.228904 IP 151.101.117.140.443 > 10.0.2.15.53170: Flags [P.], seq 46616:52112, ack 821, win 65535, length 5496
20:06:22.228919 IP 10.0.2.15.53170 > 151.101.117.140.443: Flags [.], ack 52112, win 61320, length 0
20:06:22.229769 IP 151.101.117.140.443 > 10.0.2.15.53170: Flags [P.], seq 52112:58982, ack 821, win 65535, length 6870
20:06:22.229784 IP 10.0.2.15.53170 > 151.101.117.140.443: Flags [.], ack 58982, win 59860, length 0
20:06:22.230956 IP 151.101.117.140.443 > 10.0.2.15.53170: Flags [P.], seq 58982:61730, ack 821, win 65535, length 2748
20:06:22.230977 IP 10.0.2.15.53170 > 151.101.117.140.443: Flags [.], ack 61730, win 62780, length 0
20:06:22.231898 IP 151.101.117.140.443 > 10.0.2.15.53170: Flags [P.], seq 61730:65852, ack 821, win 65535, length 4122
20:06:22.231916 IP 10.0.2.15.53170 > 151.101.117.140.443: Flags [.], ack 65852, win 61320, length 0
20:06:22.232858 IP 151.101.117.140.443 > 10.0.2.15.53170: Flags [P.], seq 65852:68600, ack 821, win 65535, length 2748
20:06:22.232880 IP 10.0.2.15.53170 > 151.101.117.140.443: Flags [.], ack 68600, win 62780, length 0
20:06:22.234075 IP 151.101.117.140.443 > 10.0.2.15.53170: Flags [P.], seq 68600:72722, ack 821, win 65535, length 4122
20:06:22.234093 IP 10.0.2.15.53170 > 151.101.117.140.443: Flags [.], ack 72722, win 65535, length 0
20:06:22.235071 IP 151.101.117.140.443 > 10.0.2.15.53170: Flags [P.], seq 72722:74096, ack 821, win 65535, length 1374
20:06:22.235087 IP 10.0.2.15.53170 > 151.101.117.140.443: Flags [.], ack 74096, win 65535, length 0
20:06:22.236416 IP 151.101.117.140.443 > 10.0.2.15.53170: Flags [P.], seq 74096:78218, ack 821, win 65535, length 4122
20:06:22.236438 IP 10.0.2.15.53170 > 151.101.117.140.443: Flags [.], ack 78218, win 65535, length 0
20:06:22.237453 IP 151.101.117.140.443 > 10.0.2.15.53170: Flags [P.], seq 78218:82340, ack 821, win 65535, length 4122
20:06:22.237470 IP 10.0.2.15.53170 > 151.101.117.140.443: Flags [.], ack 82340, win 65535, length 0
20:06:22.238496 IP 151.101.117.140.443 > 10.0.2.15.53170: Flags [P.], seq 82340:85088, ack 821, win 65535, length 2748
20:06:22.238510 IP 10.0.2.15.53170 > 151.101.117.140.443: Flags [.], ack 85088, win 65535, length 0
20:06:22.239554 IP 151.101.117.140.443 > 10.0.2.15.53170: Flags [P.], seq 85088:87836, ack 821, win 65535, length 2748
20:06:22.239576 IP 10.0.2.15.53170 > 151.101.117.140.443: Flags [.], ack 87836, win 65535, length 0
20:06:22.240690 IP 151.101.117.140.443 > 10.0.2.15.53170: Flags [P.], seq 87836:90584, ack 821, win 65535, length 2748
20:06:22.240709 IP 10.0.2.15.53170 > 151.101.117.140.443: Flags [.], ack 90584, win 65535, length 0
20:06:22.241985 IP 151.101.117.140.443 > 10.0.2.15.53170: Flags [P.], seq 90584:93332, ack 821, win 65535, length 2748
20:06:22.242007 IP 10.0.2.15.53170 > 151.101.117.140.443: Flags [.], ack 93332, win 65535, length 0
20:06:22.242864 IP 151.101.117.140.443 > 10.0.2.15.53170: Flags [P.], seq 93332:98828, ack 821, win 65535, length 5496
20:06:22.242878 IP 10.0.2.15.53170 > 151.101.117.140.443: Flags [.], ack 98828, win 65535, length 0
20:06:22.243960 IP 151.101.117.140.443 > 10.0.2.15.53170: Flags [P.], seq 98828:102950, ack 821, win 65535, length 4122
20:06:22.244055 IP 10.0.2.15.53170 > 151.101.117.140.443: Flags [.], ack 102950, win 65535, length 0
20:06:22.244790 IP 151.101.117.140.443 > 10.0.2.15.53170: Flags [P.], seq 102950:104324, ack 821, win 65535, length 1374
20:06:22.244804 IP 10.0.2.15.53170 > 151.101.117.140.443: Flags [.], ack 104324, win 65535, length 0
20:06:22.246012 IP 151.101.117.140.443 > 10.0.2.15.53170: Flags [P.], seq 104324:112568, ack 821, win 65535, length 8244
20:06:22.246032 IP 10.0.2.15.53170 > 151.101.117.140.443: Flags [.], ack 112568, win 65535, length 0
20:06:22.247223 IP 151.101.117.140.443 > 10.0.2.15.53170: Flags [P.], seq 112568:115316, ack 821, win 65535, length 2748
20:06:22.247241 IP 10.0.2.15.53170 > 151.101.117.140.443: Flags [.], ack 115316, win 65535, length 0
20:06:22.247882 IP 151.101.117.140.443 > 10.0.2.15.53170: Flags [P.], seq 115316:120812, ack 821, win 65535, length 5496
20:06:22.247900 IP 10.0.2.15.53170 > 151.101.117.140.443: Flags [.], ack 120812, win 65535, length 0
20:06:22.249179 IP 151.101.117.140.443 > 10.0.2.15.53170: Flags [P.], seq 120812:127682, ack 821, win 65535, length 6870
20:06:22.249200 IP 10.0.2.15.53170 > 151.101.117.140.443: Flags [.], ack 127682, win 65535, length 0
20:06:22.250467 IP 151.101.117.140.443 > 10.0.2.15.53170: Flags [P.], seq 127682:131804, ack 821, win 65535, length 4122
20:06:22.250498 IP 10.0.2.15.53170 > 151.101.117.140.443: Flags [.], ack 131804, win 65535, length 0
20:06:22.251167 IP 151.101.117.140.443 > 10.0.2.15.53170: Flags [P.], seq 131804:135926, ack 821, win 65535, length 4122
20:06:22.251183 IP 10.0.2.15.53170 > 151.101.117.140.443: Flags [.], ack 135926, win 65535, length 0
20:06:22.252667 IP 151.101.117.140.443 > 10.0.2.15.53170: Flags [P.], seq 135926:140048, ack 821, win 65535, length 4122
20:06:22.252685 IP 10.0.2.15.53170 > 151.101.117.140.443: Flags [.], ack 140048, win 65535, length 0
20:06:22.253287 IP 151.101.117.140.443 > 10.0.2.15.53170: Flags [P.], seq 140048:141422, ack 821, win 65535, length 1374
20:06:22.253302 IP 10.0.2.15.53170 > 151.101.117.140.443: Flags [.], ack 141422, win 65535, length 0
20:06:22.254371 IP 151.101.117.140.443 > 10.0.2.15.53170: Flags [P.], seq 141422:152414, ack 821, win 65535, length 10992
20:06:22.254386 IP 10.0.2.15.53170 > 151.101.117.140.443: Flags [.], ack 152414, win 65535, length 0
20:06:22.255418 IP 151.101.117.140.443 > 10.0.2.15.53170: Flags [P.], seq 152414:156536, ack 821, win 65535, length 4122
20:06:22.255420 IP 151.101.117.140.443 > 10.0.2.15.53170: Flags [P.], seq 156536:160658, ack 821, win 65535, length 4122
20:06:22.255487 IP 10.0.2.15.53170 > 151.101.117.140.443: Flags [.], ack 156536, win 65535, length 0
20:06:22.255528 IP 10.0.2.15.53170 > 151.101.117.140.443: Flags [.], ack 160658, win 65535, length 0
20:06:22.256490 IP 151.101.117.140.443 > 10.0.2.15.53170: Flags [P.], seq 160658:164780, ack 821, win 65535, length 4122
20:06:22.256511 IP 10.0.2.15.53170 > 151.101.117.140.443: Flags [.], ack 164780, win 65535, length 0
20:06:22.258002 IP 151.101.117.140.443 > 10.0.2.15.53170: Flags [P.], seq 164780:171650, ack 821, win 65535, length 6870
20:06:22.258024 IP 10.0.2.15.53170 > 151.101.117.140.443: Flags [.], ack 171650, win 65535, length 0
20:06:22.259372 IP 151.101.117.140.443 > 10.0.2.15.53170: Flags [P.], seq 171650:177146, ack 821, win 65535, length 5496
20:06:22.259394 IP 10.0.2.15.53170 > 151.101.117.140.443: Flags [.], ack 177146, win 65535, length 0
20:06:22.260009 IP 151.101.117.140.443 > 10.0.2.15.53170: Flags [.], seq 177146:182986, ack 821, win 65535, length 5840
20:06:22.260028 IP 10.0.2.15.53170 > 151.101.117.140.443: Flags [.], ack 182986, win 65535, length 0
20:06:22.260190 IP 151.101.117.140.443 > 10.0.2.15.53170: Flags [P.], seq 182986:184016, ack 821, win 65535, length 1030
20:06:22.260199 IP 10.0.2.15.53170 > 151.101.117.140.443: Flags [.], ack 184016, win 65535, length 0
20:06:22.262645 IP 151.101.117.140.443 > 10.0.2.15.53170: Flags [P.], seq 184016:193634, ack 821, win 65535, length 9618
20:06:22.262669 IP 10.0.2.15.53170 > 151.101.117.140.443: Flags [.], ack 193634, win 65535, length 0
20:06:22.263888 IP 151.101.117.140.443 > 10.0.2.15.53170: Flags [P.], seq 193634:197756, ack 821, win 65535, length 4122
20:06:22.263917 IP 10.0.2.15.53170 > 151.101.117.140.443: Flags [.], ack 197756, win 65535, length 0
20:06:22.264664 IP 151.101.117.140.443 > 10.0.2.15.53170: Flags [P.], seq 197756:197764, ack 821, win 65535, length 8
20:06:22.264691 IP 10.0.2.15.53170 > 151.101.117.140.443: Flags [.], ack 197764, win 65535, length 0
20:06:22.930606 IP 151.101.117.140.443 > 10.0.2.15.53170: Flags [P.], seq 197764:199235, ack 821, win 65535, length 1471
20:06:22.930633 IP 10.0.2.15.53170 > 151.101.117.140.443: Flags [.], ack 199235, win 65535, length 0
20:06:22.964423 IP 151.101.117.140.443 > 10.0.2.15.53170: Flags [P.], seq 199235:200609, ack 821, win 65535, length 1374
20:06:22.964450 IP 10.0.2.15.53170 > 151.101.117.140.443: Flags [.], ack 200609, win 65535, length 0
20:06:22.965545 IP 151.101.117.140.443 > 10.0.2.15.53170: Flags [P.], seq 200609:203357, ack 821, win 65535, length 2748
20:06:22.965567 IP 10.0.2.15.53170 > 151.101.117.140.443: Flags [.], ack 203357, win 65535, length 0
20:06:22.967045 IP 151.101.117.140.443 > 10.0.2.15.53170: Flags [P.], seq 203357:216411, ack 821, win 65535, length 13054
20:06:22.967081 IP 10.0.2.15.53170 > 151.101.117.140.443: Flags [.], ack 216411, win 65535, length 0
20:06:22.967120 IP 151.101.117.140.443 > 10.0.2.15.53170: Flags [P.], seq 216411:220533, ack 821, win 65535, length 4122
20:06:22.967125 IP 10.0.2.15.53170 > 151.101.117.140.443: Flags [.], ack 220533, win 65535, length 0
20:06:22.967805 IP 151.101.117.140.443 > 10.0.2.15.53170: Flags [P.], seq 220533:223281, ack 821, win 65535, length 2748
20:06:22.967824 IP 10.0.2.15.53170 > 151.101.117.140.443: Flags [.], ack 223281, win 65535, length 0
20:06:22.969286 IP 151.101.117.140.443 > 10.0.2.15.53170: Flags [P.], seq 223281:236953, ack 821, win 65535, length 13672
20:06:22.969307 IP 10.0.2.15.53170 > 151.101.117.140.443: Flags [.], ack 236953, win 65535, length 0
20:06:22.976720 IP 151.101.117.140.443 > 10.0.2.15.53170: Flags [P.], seq 236953:246571, ack 821, win 65535, length 9618
20:06:22.976744 IP 10.0.2.15.53170 > 151.101.117.140.443: Flags [.], ack 246571, win 65535, length 0
20:06:22.979046 IP 151.101.117.140.443 > 10.0.2.15.53170: Flags [P.], seq 246571:254815, ack 821, win 65535, length 8244
20:06:22.979050 IP 151.101.117.140.443 > 10.0.2.15.53170: Flags [P.], seq 254815:257563, ack 821, win 65535, length 2748
20:06:22.979076 IP 10.0.2.15.53170 > 151.101.117.140.443: Flags [.], ack 254815, win 65535, length 0
20:06:22.979113 IP 10.0.2.15.53170 > 151.101.117.140.443: Flags [.], ack 257563, win 65535, length 0
20:06:22.979139 IP 151.101.117.140.443 > 10.0.2.15.53170: Flags [P.], seq 257563:258937, ack 821, win 65535, length 1374
20:06:22.979143 IP 10.0.2.15.53170 > 151.101.117.140.443: Flags [.], ack 258937, win 65535, length 0
20:06:22.981076 IP 151.101.117.140.443 > 10.0.2.15.53170: Flags [P.], seq 258937:261685, ack 821, win 65535, length 2748
20:06:22.981096 IP 10.0.2.15.53170 > 151.101.117.140.443: Flags [.], ack 261685, win 65535, length 0
20:06:22.982596 IP 151.101.117.140.443 > 10.0.2.15.53170: Flags [P.], seq 261685:268555, ack 821, win 65535, length 6870
20:06:22.982600 IP 151.101.117.140.443 > 10.0.2.15.53170: Flags [.], seq 268555:270015, ack 821, win 65535, length 1460
20:06:22.982912 IP 10.0.2.15.53170 > 151.101.117.140.443: Flags [.], ack 268555, win 65535, length 0
20:06:22.982958 IP 10.0.2.15.53170 > 151.101.117.140.443: Flags [.], ack 270015, win 65535, length 0
20:06:22.983238 IP 151.101.117.140.443 > 10.0.2.15.53170: Flags [P.], seq 270015:272677, ack 821, win 65535, length 2662
20:06:22.983240 IP 151.101.117.140.443 > 10.0.2.15.53170: Flags [P.], seq 272677:275425, ack 821, win 65535, length 2748
20:06:22.983242 IP 151.101.117.140.443 > 10.0.2.15.53170: Flags [P.], seq 275425:278173, ack 821, win 65535, length 2748
20:06:22.983243 IP 151.101.117.140.443 > 10.0.2.15.53170: Flags [P.], seq 278173:280921, ack 821, win 65535, length 2748
20:06:22.983262 IP 10.0.2.15.53170 > 151.101.117.140.443: Flags [.], ack 272677, win 65535, length 0
20:06:22.983349 IP 10.0.2.15.53170 > 151.101.117.140.443: Flags [.], ack 275425, win 65535, length 0
20:06:22.983372 IP 10.0.2.15.53170 > 151.101.117.140.443: Flags [.], ack 278173, win 65535, length 0
20:06:22.983392 IP 10.0.2.15.53170 > 151.101.117.140.443: Flags [.], ack 280921, win 65535, length 0
20:06:22.984920 IP 151.101.117.140.443 > 10.0.2.15.53170: Flags [P.], seq 280921:287791, ack 821, win 65535, length 6870
20:06:22.984923 IP 151.101.117.140.443 > 10.0.2.15.53170: Flags [P.], seq 287791:291913, ack 821, win 65535, length 4122
20:06:22.984942 IP 10.0.2.15.53170 > 151.101.117.140.443: Flags [.], ack 287791, win 65535, length 0
20:06:22.984977 IP 10.0.2.15.53170 > 151.101.117.140.443: Flags [.], ack 291913, win 65535, length 0
20:06:22.985009 IP 151.101.117.140.443 > 10.0.2.15.53170: Flags [P.], seq 291913:294490, ack 821, win 65535, length 2577
20:06:22.985015 IP 10.0.2.15.53170 > 151.101.117.140.443: Flags [.], ack 294490, win 65535, length 0
20:06:22.988352 IP 151.101.117.140.443 > 10.0.2.15.53170: Flags [P.], seq 294490:304108, ack 821, win 65535, length 9618
20:06:22.988375 IP 10.0.2.15.53170 > 151.101.117.140.443: Flags [.], ack 304108, win 65535, length 0
20:06:22.989104 IP 151.101.117.140.443 > 10.0.2.15.53170: Flags [P.], seq 304108:309604, ack 821, win 65535, length 5496
20:06:22.989122 IP 10.0.2.15.53170 > 151.101.117.140.443: Flags [.], ack 309604, win 65535, length 0
20:06:22.990425 IP 151.101.117.140.443 > 10.0.2.15.53170: Flags [P.], seq 309604:316385, ack 821, win 65535, length 6781
20:06:22.990442 IP 10.0.2.15.53170 > 151.101.117.140.443: Flags [.], ack 316385, win 65535, length 0
20:06:22.991508 IP 151.101.117.140.443 > 10.0.2.15.53170: Flags [P.], seq 316385:320507, ack 821, win 65535, length 4122
20:06:22.991520 IP 10.0.2.15.53170 > 151.101.117.140.443: Flags [.], ack 320507, win 65535, length 0
20:06:22.992574 IP 151.101.117.140.443 > 10.0.2.15.53170: Flags [P.], seq 320507:328751, ack 821, win 65535, length 8244
20:06:22.992576 IP 151.101.117.140.443 > 10.0.2.15.53170: Flags [P.], seq 328751:331499, ack 821, win 65535, length 2748
20:06:22.992595 IP 10.0.2.15.53170 > 151.101.117.140.443: Flags [.], ack 328751, win 65535, length 0
20:06:22.992624 IP 10.0.2.15.53170 > 151.101.117.140.443: Flags [.], ack 331499, win 65535, length 0
20:06:22.995033 IP 151.101.117.140.443 > 10.0.2.15.53170: Flags [P.], seq 331499:338369, ack 821, win 65535, length 6870
20:06:22.995053 IP 10.0.2.15.53170 > 151.101.117.140.443: Flags [.], ack 338369, win 65535, length 0
20:06:22.995568 IP 151.101.117.140.443 > 10.0.2.15.53170: Flags [P.], seq 338369:342491, ack 821, win 65535, length 4122
20:06:22.995581 IP 10.0.2.15.53170 > 151.101.117.140.443: Flags [.], ack 342491, win 65535, length 0
20:06:22.996487 IP 151.101.117.140.443 > 10.0.2.15.53170: Flags [P.], seq 342491:343755, ack 821, win 65535, length 1264
20:06:22.996502 IP 10.0.2.15.53170 > 151.101.117.140.443: Flags [.], ack 343755, win 65535, length 0
20:06:23.000039 IP 151.101.117.140.443 > 10.0.2.15.53170: Flags [P.], seq 343755:348370, ack 821, win 65535, length 4615
20:06:23.000060 IP 10.0.2.15.53170 > 151.101.117.140.443: Flags [.], ack 348370, win 65535, length 0
20:06:23.002555 IP 151.101.117.140.443 > 10.0.2.15.53170: Flags [P.], seq 348370:349744, ack 821, win 65535, length 1374
20:06:23.002576 IP 10.0.2.15.53170 > 151.101.117.140.443: Flags [.], ack 349744, win 65535, length 0
20:06:23.004196 IP 151.101.117.140.443 > 10.0.2.15.53170: Flags [P.], seq 349744:356614, ack 821, win 65535, length 6870
20:06:23.004215 IP 10.0.2.15.53170 > 151.101.117.140.443: Flags [.], ack 356614, win 65535, length 0
20:06:23.004648 IP 151.101.117.140.443 > 10.0.2.15.53170: Flags [P.], seq 356614:369811, ack 821, win 65535, length 13197
20:06:23.004662 IP 10.0.2.15.53170 > 151.101.117.140.443: Flags [.], ack 369811, win 65535, length 0
20:06:23.004696 IP 151.101.117.140.443 > 10.0.2.15.53170: Flags [P.], seq 369811:375307, ack 821, win 65535, length 5496
20:06:23.004697 IP 151.101.117.140.443 > 10.0.2.15.53170: Flags [P.], seq 375307:376681, ack 821, win 65535, length 1374
20:06:23.004708 IP 10.0.2.15.53170 > 151.101.117.140.443: Flags [.], ack 375307, win 65535, length 0
20:06:23.004718 IP 10.0.2.15.53170 > 151.101.117.140.443: Flags [.], ack 376681, win 65535, length 0
20:06:23.006453 IP 151.101.117.140.443 > 10.0.2.15.53170: Flags [P.], seq 376681:383551, ack 821, win 65535, length 6870
20:06:23.006456 IP 151.101.117.140.443 > 10.0.2.15.53170: Flags [P.], seq 383551:387673, ack 821, win 65535, length 4122
20:06:23.006547 IP 10.0.2.15.53170 > 151.101.117.140.443: Flags [.], ack 383551, win 65535, length 0
20:06:23.006594 IP 10.0.2.15.53170 > 151.101.117.140.443: Flags [.], ack 387673, win 65535, length 0
20:06:23.006634 IP 151.101.117.140.443 > 10.0.2.15.53170: Flags [P.], seq 387673:390421, ack 821, win 65535, length 2748
20:06:23.006635 IP 151.101.117.140.443 > 10.0.2.15.53170: Flags [P.], seq 390421:391795, ack 821, win 65535, length 1374
20:06:23.006643 IP 10.0.2.15.53170 > 151.101.117.140.443: Flags [.], ack 390421, win 65535, length 0
20:06:23.006666 IP 10.0.2.15.53170 > 151.101.117.140.443: Flags [.], ack 391795, win 65535, length 0
20:06:23.010608 IP 151.101.117.140.443 > 10.0.2.15.53170: Flags [P.], seq 391795:393061, ack 821, win 65535, length 1266
20:06:23.010629 IP 10.0.2.15.53170 > 151.101.117.140.443: Flags [.], ack 393061, win 65535, length 0
20:06:23.011625 IP 151.101.117.140.443 > 10.0.2.15.53170: Flags [P.], seq 393061:397183, ack 821, win 65535, length 4122
20:06:23.011644 IP 10.0.2.15.53170 > 151.101.117.140.443: Flags [.], ack 397183, win 65535, length 0
20:06:23.012033 IP 151.101.117.140.443 > 10.0.2.15.53170: Flags [P.], seq 397183:399931, ack 821, win 65535, length 2748
20:06:23.012045 IP 10.0.2.15.53170 > 151.101.117.140.443: Flags [.], ack 399931, win 65535, length 0
20:06:23.013161 IP 151.101.117.140.443 > 10.0.2.15.53170: Flags [P.], seq 399931:405427, ack 821, win 65535, length 5496
20:06:23.013185 IP 10.0.2.15.53170 > 151.101.117.140.443: Flags [.], ack 405427, win 65535, length 0
20:06:23.014603 IP 151.101.117.140.443 > 10.0.2.15.53170: Flags [P.], seq 405427:410923, ack 821, win 65535, length 5496
20:06:23.014607 IP 151.101.117.140.443 > 10.0.2.15.53170: Flags [P.], seq 410923:416419, ack 821, win 65535, length 5496
20:06:23.014632 IP 10.0.2.15.53170 > 151.101.117.140.443: Flags [.], ack 410923, win 65535, length 0
20:06:23.014673 IP 10.0.2.15.53170 > 151.101.117.140.443: Flags [.], ack 416419, win 65535, length 0
20:06:23.014698 IP 151.101.117.140.443 > 10.0.2.15.53170: Flags [P.], seq 416419:419167, ack 821, win 65535, length 2748
20:06:23.014703 IP 10.0.2.15.53170 > 151.101.117.140.443: Flags [.], ack 419167, win 65535, length 0
20:06:23.016063 IP 151.101.117.140.443 > 10.0.2.15.53170: Flags [P.], seq 419167:424663, ack 821, win 65535, length 5496
20:06:23.016124 IP 10.0.2.15.53170 > 151.101.117.140.443: Flags [.], ack 424663, win 65535, length 0
20:06:23.016413 IP 151.101.117.140.443 > 10.0.2.15.53170: Flags [P.], seq 424663:427411, ack 821, win 65535, length 2748
20:06:23.016430 IP 10.0.2.15.53170 > 151.101.117.140.443: Flags [.], ack 427411, win 65535, length 0
20:06:23.017380 IP 151.101.117.140.443 > 10.0.2.15.53170: Flags [P.], seq 427411:431533, ack 821, win 65535, length 4122
20:06:23.017395 IP 10.0.2.15.53170 > 151.101.117.140.443: Flags [.], ack 431533, win 65535, length 0
20:06:23.018602 IP 151.101.117.140.443 > 10.0.2.15.53170: Flags [P.], seq 431533:438403, ack 821, win 65535, length 6870
20:06:23.018621 IP 10.0.2.15.53170 > 151.101.117.140.443: Flags [.], ack 438403, win 65535, length 0
20:06:23.020554 IP 151.101.117.140.443 > 10.0.2.15.53170: Flags [P.], seq 438403:446647, ack 821, win 65535, length 8244
20:06:23.020557 IP 151.101.117.140.443 > 10.0.2.15.53170: Flags [P.], seq 446647:452143, ack 821, win 65535, length 5496
20:06:23.020577 IP 10.0.2.15.53170 > 151.101.117.140.443: Flags [.], ack 446647, win 65535, length 0
20:06:23.020609 IP 10.0.2.15.53170 > 151.101.117.140.443: Flags [.], ack 452143, win 65535, length 0
20:06:23.020742 IP 151.101.117.140.443 > 10.0.2.15.53170: Flags [P.], seq 452143:453517, ack 821, win 65535, length 1374
20:06:23.020747 IP 10.0.2.15.53170 > 151.101.117.140.443: Flags [.], ack 453517, win 65535, length 0
20:06:23.021702 IP 151.101.117.140.443 > 10.0.2.15.53170: Flags [P.], seq 453517:458803, ack 821, win 65535, length 5286
20:06:23.021723 IP 10.0.2.15.53170 > 151.101.117.140.443: Flags [.], ack 458803, win 65535, length 0
20:06:23.024323 IP 151.101.117.140.443 > 10.0.2.15.53170: Flags [P.], seq 458803:462925, ack 821, win 65535, length 4122
20:06:23.024348 IP 10.0.2.15.53170 > 151.101.117.140.443: Flags [.], ack 462925, win 65535, length 0
20:06:23.025420 IP 151.101.117.140.443 > 10.0.2.15.53170: Flags [P.], seq 462925:469795, ack 821, win 65535, length 6870
20:06:23.025576 IP 10.0.2.15.53170 > 151.101.117.140.443: Flags [.], ack 469795, win 65535, length 0
20:06:23.025729 IP 151.101.117.140.443 > 10.0.2.15.53170: Flags [P.], seq 469795:475291, ack 821, win 65535, length 5496
20:06:23.025739 IP 10.0.2.15.53170 > 151.101.117.140.443: Flags [.], ack 475291, win 65535, length 0
20:06:23.026753 IP 151.101.117.140.443 > 10.0.2.15.53170: Flags [P.], seq 475291:480787, ack 821, win 65535, length 5496
20:06:23.026823 IP 10.0.2.15.53170 > 151.101.117.140.443: Flags [.], ack 480787, win 65535, length 0
20:06:23.027470 IP 151.101.117.140.443 > 10.0.2.15.53170: Flags [P.], seq 480787:484909, ack 821, win 65535, length 4122
20:06:23.027473 IP 151.101.117.140.443 > 10.0.2.15.53170: Flags [P.], seq 484909:487657, ack 821, win 65535, length 2748
20:06:23.027491 IP 10.0.2.15.53170 > 151.101.117.140.443: Flags [.], ack 484909, win 65535, length 0
20:06:23.027523 IP 10.0.2.15.53170 > 151.101.117.140.443: Flags [.], ack 487657, win 65535, length 0
20:06:23.027837 IP 151.101.117.140.443 > 10.0.2.15.53170: Flags [P.], seq 487657:489031, ack 821, win 65535, length 1374
20:06:23.027846 IP 10.0.2.15.53170 > 151.101.117.140.443: Flags [.], ack 489031, win 65535, length 0
20:06:23.028407 IP 151.101.117.140.443 > 10.0.2.15.53170: Flags [P.], seq 489031:494527, ack 821, win 65535, length 5496
20:06:23.028420 IP 10.0.2.15.53170 > 151.101.117.140.443: Flags [.], ack 494527, win 65535, length 0
20:06:23.029960 IP 151.101.117.140.443 > 10.0.2.15.53170: Flags [P.], seq 494527:502771, ack 821, win 65535, length 8244
20:06:23.029977 IP 10.0.2.15.53170 > 151.101.117.140.443: Flags [.], ack 502771, win 65535, length 0
20:06:23.031142 IP 151.101.117.140.443 > 10.0.2.15.53170: Flags [P.], seq 502771:506893, ack 821, win 65535, length 4122
20:06:23.031180 IP 10.0.2.15.53170 > 151.101.117.140.443: Flags [.], ack 506893, win 65535, length 0
20:06:23.031824 IP 151.101.117.140.443 > 10.0.2.15.53170: Flags [P.], seq 506893:508068, ack 821, win 65535, length 1175
20:06:23.031846 IP 10.0.2.15.53170 > 151.101.117.140.443: Flags [.], ack 508068, win 65535, length 0
20:06:23.035283 IP 151.101.117.140.443 > 10.0.2.15.53170: Flags [P.], seq 508068:514938, ack 821, win 65535, length 6870
20:06:23.035304 IP 10.0.2.15.53170 > 151.101.117.140.443: Flags [.], ack 514938, win 65535, length 0
20:06:23.036310 IP 151.101.117.140.443 > 10.0.2.15.53170: Flags [P.], seq 514938:520434, ack 821, win 65535, length 5496
20:06:23.036326 IP 10.0.2.15.53170 > 151.101.117.140.443: Flags [.], ack 520434, win 65535, length 0
20:06:23.037417 IP 151.101.117.140.443 > 10.0.2.15.53170: Flags [P.], seq 520434:527304, ack 821, win 65535, length 6870
20:06:23.037509 IP 10.0.2.15.53170 > 151.101.117.140.443: Flags [.], ack 527304, win 65535, length 0
20:06:23.037685 IP 151.101.117.140.443 > 10.0.2.15.53170: Flags [P.], seq 527304:531426, ack 821, win 65535, length 4122
20:06:23.037686 IP 151.101.117.140.443 > 10.0.2.15.53170: Flags [P.], seq 531426:534174, ack 821, win 65535, length 2748
20:06:23.037700 IP 10.0.2.15.53170 > 151.101.117.140.443: Flags [.], ack 531426, win 65535, length 0
20:06:23.037719 IP 10.0.2.15.53170 > 151.101.117.140.443: Flags [.], ack 534174, win 65535, length 0
20:06:23.038820 IP 151.101.117.140.443 > 10.0.2.15.53170: Flags [P.], seq 534174:539670, ack 821, win 65535, length 5496
20:06:23.038822 IP 151.101.117.140.443 > 10.0.2.15.53170: Flags [P.], seq 539670:541044, ack 821, win 65535, length 1374
20:06:23.038849 IP 10.0.2.15.53170 > 151.101.117.140.443: Flags [.], ack 539670, win 65535, length 0
20:06:23.038896 IP 10.0.2.15.53170 > 151.101.117.140.443: Flags [.], ack 541044, win 65535, length 0
20:06:23.039995 IP 151.101.117.140.443 > 10.0.2.15.53170: Flags [P.], seq 541044:547914, ack 821, win 65535, length 6870
20:06:23.040015 IP 10.0.2.15.53170 > 151.101.117.140.443: Flags [.], ack 547914, win 65535, length 0
20:06:23.040247 IP 151.101.117.140.443 > 10.0.2.15.53170: Flags [P.], seq 547914:549288, ack 821, win 65535, length 1374
20:06:23.040256 IP 10.0.2.15.53170 > 151.101.117.140.443: Flags [.], ack 549288, win 65535, length 0
20:06:23.041816 IP 151.101.117.140.443 > 10.0.2.15.53170: Flags [P.], seq 549288:556158, ack 821, win 65535, length 6870
20:06:23.041820 IP 151.101.117.140.443 > 10.0.2.15.53170: Flags [P.], seq 556158:563028, ack 821, win 65535, length 6870
20:06:23.041841 IP 10.0.2.15.53170 > 151.101.117.140.443: Flags [.], ack 556158, win 65535, length 0
20:06:23.041972 IP 10.0.2.15.53170 > 151.101.117.140.443: Flags [.], ack 563028, win 65535, length 0
20:06:23.042117 IP 151.101.117.140.443 > 10.0.2.15.53170: Flags [P.], seq 563028:567150, ack 821, win 65535, length 4122
20:06:23.042126 IP 10.0.2.15.53170 > 151.101.117.140.443: Flags [.], ack 567150, win 65535, length 0
20:06:23.042305 IP 151.101.117.140.443 > 10.0.2.15.53170: Flags [P.], seq 567150:568524, ack 821, win 65535, length 1374
20:06:23.042311 IP 10.0.2.15.53170 > 151.101.117.140.443: Flags [.], ack 568524, win 65535, length 0
20:06:23.043265 IP 151.101.117.140.443 > 10.0.2.15.53170: Flags [P.], seq 568524:573826, ack 821, win 65535, length 5302
20:06:23.043282 IP 10.0.2.15.53170 > 151.101.117.140.443: Flags [.], ack 573826, win 65535, length 0
20:06:23.048558 IP 151.101.117.140.443 > 10.0.2.15.53170: Flags [P.], seq 573826:582070, ack 821, win 65535, length 8244
20:06:23.048563 IP 151.101.117.140.443 > 10.0.2.15.53170: Flags [P.], seq 582070:586192, ack 821, win 65535, length 4122
20:06:23.048713 IP 10.0.2.15.53170 > 151.101.117.140.443: Flags [.], ack 582070, win 65535, length 0
20:06:23.048827 IP 10.0.2.15.53170 > 151.101.117.140.443: Flags [.], ack 586192, win 65535, length 0
20:06:23.049562 IP 151.101.117.140.443 > 10.0.2.15.53170: Flags [P.], seq 586192:593062, ack 821, win 65535, length 6870
20:06:23.049582 IP 10.0.2.15.53170 > 151.101.117.140.443: Flags [.], ack 593062, win 65535, length 0
20:06:23.051584 IP 151.101.117.140.443 > 10.0.2.15.53170: Flags [P.], seq 593062:599932, ack 821, win 65535, length 6870
20:06:23.051587 IP 151.101.117.140.443 > 10.0.2.15.53170: Flags [P.], seq 599932:606802, ack 821, win 65535, length 6870
20:06:23.051609 IP 10.0.2.15.53170 > 151.101.117.140.443: Flags [.], ack 599932, win 65535, length 0
20:06:23.051772 IP 10.0.2.15.53170 > 151.101.117.140.443: Flags [.], ack 606802, win 65535, length 0
20:06:23.051808 IP 151.101.117.140.443 > 10.0.2.15.53170: Flags [P.], seq 606802:609550, ack 821, win 65535, length 2748
20:06:23.051809 IP 151.101.117.140.443 > 10.0.2.15.53170: Flags [P.], seq 609550:610924, ack 821, win 65535, length 1374
20:06:23.051810 IP 151.101.117.140.443 > 10.0.2.15.53170: Flags [P.], seq 610924:613672, ack 821, win 65535, length 2748
20:06:23.051818 IP 10.0.2.15.53170 > 151.101.117.140.443: Flags [.], ack 609550, win 65535, length 0
20:06:23.051831 IP 10.0.2.15.53170 > 151.101.117.140.443: Flags [.], ack 610924, win 65535, length 0
20:06:23.051843 IP 10.0.2.15.53170 > 151.101.117.140.443: Flags [.], ack 613672, win 65535, length 0
20:06:23.053993 IP 151.101.117.140.443 > 10.0.2.15.53170: Flags [P.], seq 613672:620542, ack 821, win 65535, length 6870
20:06:23.053997 IP 151.101.117.140.443 > 10.0.2.15.53170: Flags [P.], seq 620542:627412, ack 821, win 65535, length 6870
20:06:23.054019 IP 10.0.2.15.53170 > 151.101.117.140.443: Flags [.], ack 620542, win 65535, length 0
20:06:23.054065 IP 10.0.2.15.53170 > 151.101.117.140.443: Flags [.], ack 627412, win 65535, length 0
20:06:23.055087 IP 151.101.117.140.443 > 10.0.2.15.53170: Flags [P.], seq 627412:632908, ack 821, win 65535, length 5496
20:06:23.055107 IP 10.0.2.15.53170 > 151.101.117.140.443: Flags [.], ack 632908, win 65535, length 0
20:06:23.055250 IP 151.101.117.140.443 > 10.0.2.15.53170: Flags [P.], seq 632908:638404, ack 821, win 65535, length 5496
20:06:23.055259 IP 10.0.2.15.53170 > 151.101.117.140.443: Flags [.], ack 638404, win 65535, length 0
20:06:23.057028 IP 151.101.117.140.443 > 10.0.2.15.53170: Flags [P.], seq 638404:639520, ack 821, win 65535, length 1116
20:06:23.057047 IP 10.0.2.15.53170 > 151.101.117.140.443: Flags [.], ack 639520, win 65535, length 0
20:06:23.059813 IP 151.101.117.140.443 > 10.0.2.15.53170: Flags [P.], seq 639520:646390, ack 821, win 65535, length 6870
20:06:23.059838 IP 10.0.2.15.53170 > 151.101.117.140.443: Flags [.], ack 646390, win 65535, length 0
20:06:23.060481 IP 151.101.117.140.443 > 10.0.2.15.53170: Flags [P.], seq 646390:654634, ack 821, win 65535, length 8244
20:06:23.060495 IP 10.0.2.15.53170 > 151.101.117.140.443: Flags [.], ack 654634, win 65535, length 0
20:06:23.060866 IP 151.101.117.140.443 > 10.0.2.15.53170: Flags [P.], seq 654634:658756, ack 821, win 65535, length 4122
20:06:23.060879 IP 10.0.2.15.53170 > 151.101.117.140.443: Flags [.], ack 658756, win 65535, length 0
20:06:23.062515 IP 151.101.117.140.443 > 10.0.2.15.53170: Flags [P.], seq 658756:664252, ack 821, win 65535, length 5496
20:06:23.062518 IP 151.101.117.140.443 > 10.0.2.15.53170: Flags [P.], seq 664252:667000, ack 821, win 65535, length 2748
20:06:23.062519 IP 151.101.117.140.443 > 10.0.2.15.53170: Flags [P.], seq 667000:671122, ack 821, win 65535, length 4122
20:06:23.062547 IP 10.0.2.15.53170 > 151.101.117.140.443: Flags [.], ack 664252, win 65535, length 0
20:06:23.062659 IP 10.0.2.15.53170 > 151.101.117.140.443: Flags [.], ack 667000, win 65535, length 0
20:06:23.062682 IP 10.0.2.15.53170 > 151.101.117.140.443: Flags [.], ack 671122, win 65535, length 0
20:06:23.062996 IP 151.101.117.140.443 > 10.0.2.15.53170: Flags [P.], seq 671122:672496, ack 821, win 65535, length 1374
20:06:23.062997 IP 151.101.117.140.443 > 10.0.2.15.53170: Flags [P.], seq 672496:673870, ack 821, win 65535, length 1374
20:06:23.063009 IP 10.0.2.15.53170 > 151.101.117.140.443: Flags [.], ack 672496, win 65535, length 0
20:06:23.063028 IP 10.0.2.15.53170 > 151.101.117.140.443: Flags [.], ack 673870, win 65535, length 0
20:06:23.065169 IP 151.101.117.140.443 > 10.0.2.15.53170: Flags [P.], seq 673870:682114, ack 821, win 65535, length 8244
20:06:23.065251 IP 10.0.2.15.53170 > 151.101.117.140.443: Flags [.], ack 682114, win 65535, length 0
20:06:23.065418 IP 151.101.117.140.443 > 10.0.2.15.53170: Flags [P.], seq 682114:687610, ack 821, win 65535, length 5496
20:06:23.065429 IP 10.0.2.15.53170 > 151.101.117.140.443: Flags [.], ack 687610, win 65535, length 0
20:06:23.067026 IP 151.101.117.140.443 > 10.0.2.15.53170: Flags [P.], seq 687610:695854, ack 821, win 65535, length 8244
20:06:23.067030 IP 151.101.117.140.443 > 10.0.2.15.53170: Flags [P.], seq 695854:699976, ack 821, win 65535, length 4122
20:06:23.067055 IP 10.0.2.15.53170 > 151.101.117.140.443: Flags [.], ack 695854, win 65535, length 0
20:06:23.067104 IP 10.0.2.15.53170 > 151.101.117.140.443: Flags [.], ack 699976, win 65535, length 0
20:06:23.067243 IP 151.101.117.140.443 > 10.0.2.15.53170: Flags [P.], seq 699976:702724, ack 821, win 65535, length 2748
20:06:23.067260 IP 10.0.2.15.53170 > 151.101.117.140.443: Flags [.], ack 702724, win 65535, length 0
20:06:23.067608 IP 151.101.117.140.443 > 10.0.2.15.53170: Flags [P.], seq 702724:705472, ack 821, win 65535, length 2748
20:06:23.067609 IP 151.101.117.140.443 > 10.0.2.15.53170: Flags [P.], seq 705472:706846, ack 821, win 65535, length 1374
20:06:23.067621 IP 10.0.2.15.53170 > 151.101.117.140.443: Flags [.], ack 705472, win 65535, length 0
20:06:23.067647 IP 10.0.2.15.53170 > 151.101.117.140.443: Flags [.], ack 706846, win 65535, length 0
20:06:23.069073 IP 151.101.117.140.443 > 10.0.2.15.53170: Flags [P.], seq 706846:715090, ack 821, win 65535, length 8244
20:06:23.069076 IP 151.101.117.140.443 > 10.0.2.15.53170: Flags [P.], seq 715090:717838, ack 821, win 65535, length 2748
20:06:23.069103 IP 10.0.2.15.53170 > 151.101.117.140.443: Flags [.], ack 715090, win 65535, length 0
20:06:23.069146 IP 10.0.2.15.53170 > 151.101.117.140.443: Flags [.], ack 717838, win 65535, length 0
20:06:23.069183 IP 151.101.117.140.443 > 10.0.2.15.53170: Flags [P.], seq 717838:720586, ack 821, win 65535, length 2748
20:06:23.069187 IP 10.0.2.15.53170 > 151.101.117.140.443: Flags [.], ack 720586, win 65535, length 0
20:06:23.069276 IP 151.101.117.140.443 > 10.0.2.15.53170: Flags [P.], seq 720586:721689, ack 821, win 65535, length 1103
20:06:23.069280 IP 10.0.2.15.53170 > 151.101.117.140.443: Flags [.], ack 721689, win 65535, length 0
20:06:23.072874 IP 151.101.117.140.443 > 10.0.2.15.53170: Flags [P.], seq 721689:728559, ack 821, win 65535, length 6870
20:06:23.072878 IP 151.101.117.140.443 > 10.0.2.15.53170: Flags [P.], seq 728559:734055, ack 821, win 65535, length 5496
20:06:23.072904 IP 10.0.2.15.53170 > 151.101.117.140.443: Flags [.], ack 728559, win 65535, length 0
20:06:23.072951 IP 10.0.2.15.53170 > 151.101.117.140.443: Flags [.], ack 734055, win 65535, length 0
20:06:23.073834 IP 151.101.117.140.443 > 10.0.2.15.53170: Flags [P.], seq 734055:735429, ack 821, win 65535, length 1374
20:06:23.073855 IP 10.0.2.15.53170 > 151.101.117.140.443: Flags [.], ack 735429, win 65535, length 0

