13:06:10.707888 IP 151.101.117.140.443 > 10.0.2.15.43272: Flags [S.], seq 29120001, ack 326226961, win 65535, options [mss 1460], length 0
13:06:10.707934 IP 10.0.2.15.43272 > 151.101.117.140.443: Flags [.], ack 1, win 64240, length 0
13:06:10.718070 IP 10.0.2.15.43272 > 151.101.117.140.443: Flags [P.], seq 1:518, ack 1, win 64240, length 517
13:06:10.718656 IP 151.101.117.140.443 > 10.0.2.15.43272: Flags [.], ack 518, win 65535, length 0
13:06:10.734883 IP 151.101.117.140.443 > 10.0.2.15.43272: Flags [P.], seq 1:2749, ack 518, win 65535, length 2748
13:06:10.734900 IP 10.0.2.15.43272 > 151.101.117.140.443: Flags [.], ack 2749, win 62780, length 0
13:06:10.735924 IP 151.101.117.140.443 > 10.0.2.15.43272: Flags [P.], seq 2749:3722, ack 518, win 65535, length 973
13:06:10.735939 IP 10.0.2.15.43272 > 151.101.117.140.443: Flags [.], ack 3722, win 62780, length 0
13:06:10.736711 IP 10.0.2.15.43272 > 151.101.117.140.443: Flags [P.], seq 518:598, ack 3722, win 62780, length 80
13:06:10.737009 IP 10.0.2.15.43272 > 151.101.117.140.443: Flags [P.], seq 598:644, ack 3722, win 62780, length 46
13:06:10.737045 IP 10.0.2.15.43272 > 151.101.117.140.443: Flags [P.], seq 644:693, ack 3722, win 62780, length 49
13:06:10.737163 IP 151.101.117.140.443 > 10.0.2.15.43272: Flags [.], ack 598, win 65535, length 0
13:06:10.737177 IP 10.0.2.15.43272 > 151.101.117.140.443: Flags [P.], seq 693:728, ack 3722, win 62780, length 35
13:06:10.737230 IP 10.0.2.15.43272 > 151.101.117.140.443: Flags [P.], seq 728:790, ack 3722, win 62780, length 62
13:06:10.737645 IP 151.101.117.140.443 > 10.0.2.15.43272: Flags [.], ack 644, win 65535, length 0
13:06:10.737791 IP 151.101.117.140.443 > 10.0.2.15.43272: Flags [.], ack 693, win 65535, length 0
13:06:10.737792 IP 151.101.117.140.443 > 10.0.2.15.43272: Flags [.], ack 728, win 65535, length 0
13:06:10.737792 IP 151.101.117.140.443 > 10.0.2.15.43272: Flags [.], ack 790, win 65535, length 0
13:06:10.750815 IP 151.101.117.140.443 > 10.0.2.15.43272: Flags [P.], seq 3722:3803, ack 790, win 65535, length 81
13:06:10.750834 IP 10.0.2.15.43272 > 151.101.117.140.443: Flags [.], ack 3803, win 62780, length 0
13:06:10.751034 IP 10.0.2.15.43272 > 151.101.117.140.443: Flags [P.], seq 790:821, ack 3803, win 62780, length 31
13:06:10.751457 IP 151.101.117.140.443 > 10.0.2.15.43272: Flags [.], ack 821, win 65535, length 0
13:06:11.378338 IP 151.101.117.140.443 > 10.0.2.15.43272: Flags [.], seq 3803:11103, ack 821, win 65535, length 7300
13:06:11.378408 IP 10.0.2.15.43272 > 151.101.117.140.443: Flags [.], ack 11103, win 59860, length 0
13:06:11.379602 IP 151.101.117.140.443 > 10.0.2.15.43272: Flags [.], seq 11103:12563, ack 821, win 65535, length 1460
13:06:11.379625 IP 10.0.2.15.43272 > 151.101.117.140.443: Flags [.], ack 12563, win 62780, length 0
13:06:11.380635 IP 151.101.117.140.443 > 10.0.2.15.43272: Flags [.], seq 12563:15483, ack 821, win 65535, length 2920
13:06:11.380654 IP 10.0.2.15.43272 > 151.101.117.140.443: Flags [.], ack 15483, win 62780, length 0
13:06:11.381370 IP 151.101.117.140.443 > 10.0.2.15.43272: Flags [.], seq 15483:16943, ack 821, win 65535, length 1460
13:06:11.381386 IP 10.0.2.15.43272 > 151.101.117.140.443: Flags [.], ack 16943, win 62780, length 0
13:06:11.381965 IP 151.101.117.140.443 > 10.0.2.15.43272: Flags [.], seq 16943:18403, ack 821, win 65535, length 1460
13:06:11.381981 IP 10.0.2.15.43272 > 151.101.117.140.443: Flags [.], ack 18403, win 62780, length 0
13:06:11.382325 IP 151.101.117.140.443 > 10.0.2.15.43272: Flags [.], seq 18403:30083, ack 821, win 65535, length 11680
13:06:11.382346 IP 10.0.2.15.43272 > 151.101.117.140.443: Flags [.], ack 30083, win 56940, length 0
13:06:11.382660 IP 151.101.117.140.443 > 10.0.2.15.43272: Flags [.], seq 30083:33003, ack 821, win 65535, length 2920
13:06:11.382670 IP 10.0.2.15.43272 > 151.101.117.140.443: Flags [.], ack 33003, win 62780, length 0
13:06:11.382840 IP 151.101.117.140.443 > 10.0.2.15.43272: Flags [.], seq 33003:38843, ack 821, win 65535, length 5840
13:06:11.382848 IP 10.0.2.15.43272 > 151.101.117.140.443: Flags [.], ack 38843, win 61320, length 0
13:06:11.383015 IP 151.101.117.140.443 > 10.0.2.15.43272: Flags [.], seq 38843:44683, ack 821, win 65535, length 5840
13:06:11.383144 IP 151.101.117.140.443 > 10.0.2.15.43272: Flags [P.], seq 44683:45585, ack 821, win 65535, length 902
13:06:11.383172 IP 10.0.2.15.43272 > 151.101.117.140.443: Flags [.], ack 45585, win 55480, length 0
13:06:11.392145 IP 151.101.117.140.443 > 10.0.2.15.43272: Flags [P.], seq 45585:51081, ack 821, win 65535, length 5496
13:06:11.392226 IP 10.0.2.15.43272 > 151.101.117.140.443: Flags [.], ack 51081, win 61320, length 0
13:06:11.393160 IP 151.101.117.140.443 > 10.0.2.15.43272: Flags [P.], seq 51081:52455, ack 821, win 65535, length 1374
13:06:11.393184 IP 10.0.2.15.43272 > 151.101.117.140.443: Flags [.], ack 52455, win 62780, length 0
13:06:11.394027 IP 151.101.117.140.443 > 10.0.2.15.43272: Flags [P.], seq 52455:55203, ack 821, win 65535, length 2748
13:06:11.394041 IP 10.0.2.15.43272 > 151.101.117.140.443: Flags [.], ack 55203, win 62780, length 0
13:06:11.395025 IP 151.101.117.140.443 > 10.0.2.15.43272: Flags [P.], seq 55203:57951, ack 821, win 65535, length 2748
13:06:11.395040 IP 10.0.2.15.43272 > 151.101.117.140.443: Flags [.], ack 57951, win 62780, length 0
13:06:11.396271 IP 151.101.117.140.443 > 10.0.2.15.43272: Flags [P.], seq 57951:59325, ack 821, win 65535, length 1374
13:06:11.396289 IP 10.0.2.15.43272 > 151.101.117.140.443: Flags [.], ack 59325, win 62780, length 0
13:06:11.398411 IP 151.101.117.140.443 > 10.0.2.15.43272: Flags [P.], seq 59325:60699, ack 821, win 65535, length 1374
13:06:11.398430 IP 10.0.2.15.43272 > 151.101.117.140.443: Flags [.], ack 60699, win 62780, length 0
13:06:11.399292 IP 151.101.117.140.443 > 10.0.2.15.43272: Flags [P.], seq 60699:62073, ack 821, win 65535, length 1374
13:06:11.399308 IP 10.0.2.15.43272 > 151.101.117.140.443: Flags [.], ack 62073, win 62780, length 0
13:06:11.401569 IP 151.101.117.140.443 > 10.0.2.15.43272: Flags [P.], seq 62073:64821, ack 821, win 65535, length 2748
13:06:11.401589 IP 10.0.2.15.43272 > 151.101.117.140.443: Flags [.], ack 64821, win 62780, length 0
13:06:11.404733 IP 151.101.117.140.443 > 10.0.2.15.43272: Flags [P.], seq 64821:66195, ack 821, win 65535, length 1374
13:06:11.404847 IP 10.0.2.15.43272 > 151.101.117.140.443: Flags [.], ack 66195, win 62780, length 0
13:06:11.405500 IP 151.101.117.140.443 > 10.0.2.15.43272: Flags [P.], seq 66195:67569, ack 821, win 65535, length 1374
13:06:11.406903 IP 151.101.117.140.443 > 10.0.2.15.43272: Flags [P.], seq 67569:68943, ack 821, win 65535, length 1374
13:06:11.406921 IP 10.0.2.15.43272 > 151.101.117.140.443: Flags [.], ack 68943, win 65535, length 0
13:06:11.407738 IP 151.101.117.140.443 > 10.0.2.15.43272: Flags [P.], seq 68943:70317, ack 821, win 65535, length 1374
13:06:11.407755 IP 10.0.2.15.43272 > 151.101.117.140.443: Flags [.], ack 70317, win 65535, length 0
13:06:11.410126 IP 151.101.117.140.443 > 10.0.2.15.43272: Flags [P.], seq 70317:71691, ack 821, win 65535, length 1374
13:06:11.410146 IP 10.0.2.15.43272 > 151.101.117.140.443: Flags [.], ack 71691, win 65535, length 0
13:06:11.410952 IP 151.101.117.140.443 > 10.0.2.15.43272: Flags [P.], seq 71691:73065, ack 821, win 65535, length 1374
13:06:11.410966 IP 10.0.2.15.43272 > 151.101.117.140.443: Flags [.], ack 73065, win 65535, length 0
13:06:11.413693 IP 151.101.117.140.443 > 10.0.2.15.43272: Flags [P.], seq 73065:75813, ack 821, win 65535, length 2748
13:06:11.413715 IP 10.0.2.15.43272 > 151.101.117.140.443: Flags [.], ack 75813, win 65535, length 0
13:06:11.415605 IP 151.101.117.140.443 > 10.0.2.15.43272: Flags [P.], seq 75813:78561, ack 821, win 65535, length 2748
13:06:11.415630 IP 10.0.2.15.43272 > 151.101.117.140.443: Flags [.], ack 78561, win 65535, length 0
13:06:11.417484 IP 151.101.117.140.443 > 10.0.2.15.43272: Flags [P.], seq 78561:81309, ack 821, win 65535, length 2748
13:06:11.417537 IP 10.0.2.15.43272 > 151.101.117.140.443: Flags [.], ack 81309, win 65535, length 0
13:06:11.418724 IP 151.101.117.140.443 > 10.0.2.15.43272: Flags [P.], seq 81309:82683, ack 821, win 65535, length 1374
13:06:11.418742 IP 10.0.2.15.43272 > 151.101.117.140.443: Flags [.], ack 82683, win 65535, length 0
13:06:11.419251 IP 151.101.117.140.443 > 10.0.2.15.43272: Flags [P.], seq 82683:84057, ack 821, win 65535, length 1374
13:06:11.419262 IP 10.0.2.15.43272 > 151.101.117.140.443: Flags [.], ack 84057, win 65535, length 0
13:06:11.420699 IP 151.101.117.140.443 > 10.0.2.15.43272: Flags [P.], seq 84057:85431, ack 821, win 65535, length 1374
13:06:11.420719 IP 10.0.2.15.43272 > 151.101.117.140.443: Flags [.], ack 85431, win 65535, length 0
13:06:11.421823 IP 151.101.117.140.443 > 10.0.2.15.43272: Flags [P.], seq 85431:88179, ack 821, win 65535, length 2748
13:06:11.421840 IP 10.0.2.15.43272 > 151.101.117.140.443: Flags [.], ack 88179, win 65535, length 0
13:06:11.422952 IP 151.101.117.140.443 > 10.0.2.15.43272: Flags [P.], seq 88179:89553, ack 821, win 65535, length 1374
13:06:11.422969 IP 10.0.2.15.43272 > 151.101.117.140.443: Flags [.], ack 89553, win 65535, length 0
13:06:11.424062 IP 151.101.117.140.443 > 10.0.2.15.43272: Flags [P.], seq 89553:90927, ack 821, win 65535, length 1374
13:06:11.424079 IP 10.0.2.15.43272 > 151.101.117.140.443: Flags [.], ack 90927, win 65535, length 0
13:06:11.425722 IP 151.101.117.140.443 > 10.0.2.15.43272: Flags [P.], seq 90927:96423, ack 821, win 65535, length 5496
13:06:11.425740 IP 10.0.2.15.43272 > 151.101.117.140.443: Flags [.], ack 96423, win 65535, length 0
13:06:11.426540 IP 151.101.117.140.443 > 10.0.2.15.43272: Flags [P.], seq 96423:97797, ack 821, win 65535, length 1374
13:06:11.426554 IP 10.0.2.15.43272 > 151.101.117.140.443: Flags [.], ack 97797, win 65535, length 0
13:06:11.427944 IP 151.101.117.140.443 > 10.0.2.15.43272: Flags [P.], seq 97797:101919, ack 821, win 65535, length 4122
13:06:11.427962 IP 10.0.2.15.43272 > 151.101.117.140.443: Flags [.], ack 101919, win 65535, length 0
13:06:11.428835 IP 151.101.117.140.443 > 10.0.2.15.43272: Flags [P.], seq 101919:103293, ack 821, win 65535, length 1374
13:06:11.428849 IP 10.0.2.15.43272 > 151.101.117.140.443: Flags [.], ack 103293, win 65535, length 0
13:06:11.431311 IP 151.101.117.140.443 > 10.0.2.15.43272: Flags [P.], seq 103293:110163, ack 821, win 65535, length 6870
13:06:11.431331 IP 10.0.2.15.43272 > 151.101.117.140.443: Flags [.], ack 110163, win 65535, length 0
13:06:11.432196 IP 151.101.117.140.443 > 10.0.2.15.43272: Flags [P.], seq 110163:112911, ack 821, win 65535, length 2748
13:06:11.432213 IP 10.0.2.15.43272 > 151.101.117.140.443: Flags [.], ack 112911, win 65535, length 0
13:06:11.433250 IP 151.101.117.140.443 > 10.0.2.15.43272: Flags [P.], seq 112911:115659, ack 821, win 65535, length 2748
13:06:11.433265 IP 10.0.2.15.43272 > 151.101.117.140.443: Flags [.], ack 115659, win 65535, length 0
13:06:11.434636 IP 151.101.117.140.443 > 10.0.2.15.43272: Flags [P.], seq 115659:118407, ack 821, win 65535, length 2748
13:06:11.434653 IP 10.0.2.15.43272 > 151.101.117.140.443: Flags [.], ack 118407, win 65535, length 0
13:06:11.435358 IP 151.101.117.140.443 > 10.0.2.15.43272: Flags [P.], seq 118407:123903, ack 821, win 65535, length 5496
13:06:11.435372 IP 10.0.2.15.43272 > 151.101.117.140.443: Flags [.], ack 123903, win 65535, length 0
13:06:11.436404 IP 151.101.117.140.443 > 10.0.2.15.43272: Flags [P.], seq 123903:128025, ack 821, win 65535, length 4122
13:06:11.436418 IP 10.0.2.15.43272 > 151.101.117.140.443: Flags [.], ack 128025, win 65535, length 0
13:06:11.437381 IP 151.101.117.140.443 > 10.0.2.15.43272: Flags [P.], seq 128025:132147, ack 821, win 65535, length 4122
13:06:11.437396 IP 10.0.2.15.43272 > 151.101.117.140.443: Flags [.], ack 132147, win 65535, length 0
13:06:11.439730 IP 151.101.117.140.443 > 10.0.2.15.43272: Flags [P.], seq 132147:140391, ack 821, win 65535, length 8244
13:06:11.439753 IP 10.0.2.15.43272 > 151.101.117.140.443: Flags [.], ack 140391, win 65535, length 0
13:06:11.440605 IP 151.101.117.140.443 > 10.0.2.15.43272: Flags [P.], seq 140391:144513, ack 821, win 65535, length 4122
13:06:11.440625 IP 10.0.2.15.43272 > 151.101.117.140.443: Flags [.], ack 144513, win 65535, length 0
13:06:11.441720 IP 151.101.117.140.443 > 10.0.2.15.43272: Flags [.], seq 144513:148893, ack 821, win 65535, length 4380
13:06:11.441908 IP 10.0.2.15.43272 > 151.101.117.140.443: Flags [.], ack 148893, win 65535, length 0
13:06:11.442033 IP 151.101.117.140.443 > 10.0.2.15.43272: Flags [P.], seq 148893:150009, ack 821, win 65535, length 1116
13:06:11.442040 IP 10.0.2.15.43272 > 151.101.117.140.443: Flags [.], ack 150009, win 65535, length 0
13:06:11.442740 IP 151.101.117.140.443 > 10.0.2.15.43272: Flags [P.], seq 150009:154131, ack 821, win 65535, length 4122
13:06:11.442761 IP 10.0.2.15.43272 > 151.101.117.140.443: Flags [.], ack 154131, win 65535, length 0
13:06:11.443803 IP 151.101.117.140.443 > 10.0.2.15.43272: Flags [P.], seq 154131:158253, ack 821, win 65535, length 4122
13:06:11.443826 IP 10.0.2.15.43272 > 151.101.117.140.443: Flags [.], ack 158253, win 65535, length 0
13:06:11.444766 IP 151.101.117.140.443 > 10.0.2.15.43272: Flags [P.], seq 158253:162375, ack 821, win 65535, length 4122
13:06:11.444784 IP 10.0.2.15.43272 > 151.101.117.140.443: Flags [.], ack 162375, win 65535, length 0
13:06:11.445004 IP 151.101.117.140.443 > 10.0.2.15.43272: Flags [P.], seq 162375:165123, ack 821, win 65535, length 2748
13:06:11.445017 IP 10.0.2.15.43272 > 151.101.117.140.443: Flags [.], ack 165123, win 65535, length 0
13:06:11.445967 IP 151.101.117.140.443 > 10.0.2.15.43272: Flags [P.], seq 165123:170619, ack 821, win 65535, length 5496
13:06:11.445983 IP 10.0.2.15.43272 > 151.101.117.140.443: Flags [.], ack 170619, win 65535, length 0
13:06:11.447100 IP 151.101.117.140.443 > 10.0.2.15.43272: Flags [P.], seq 170619:176115, ack 821, win 65535, length 5496
13:06:11.447134 IP 10.0.2.15.43272 > 151.101.117.140.443: Flags [.], ack 176115, win 65535, length 0
13:06:11.448145 IP 151.101.117.140.443 > 10.0.2.15.43272: Flags [P.], seq 176115:181611, ack 821, win 65535, length 5496
13:06:11.448159 IP 10.0.2.15.43272 > 151.101.117.140.443: Flags [.], ack 181611, win 65535, length 0
13:06:11.449333 IP 151.101.117.140.443 > 10.0.2.15.43272: Flags [P.], seq 181611:184359, ack 821, win 65535, length 2748
13:06:11.449357 IP 10.0.2.15.43272 > 151.101.117.140.443: Flags [.], ack 184359, win 65535, length 0
13:06:11.450745 IP 151.101.117.140.443 > 10.0.2.15.43272: Flags [P.], seq 184359:192603, ack 821, win 65535, length 8244
13:06:11.450767 IP 10.0.2.15.43272 > 151.101.117.140.443: Flags [.], ack 192603, win 65535, length 0
13:06:11.451500 IP 151.101.117.140.443 > 10.0.2.15.43272: Flags [P.], seq 192603:196725, ack 821, win 65535, length 4122
13:06:11.451520 IP 10.0.2.15.43272 > 151.101.117.140.443: Flags [.], ack 196725, win 65535, length 0
13:06:11.452302 IP 151.101.117.140.443 > 10.0.2.15.43272: Flags [P.], seq 196725:197757, ack 821, win 65535, length 1032
13:06:11.452316 IP 10.0.2.15.43272 > 151.101.117.140.443: Flags [.], ack 197757, win 65535, length 0
13:06:12.197389 IP 151.101.117.140.443 > 10.0.2.15.43272: Flags [P.], seq 197757:199228, ack 821, win 65535, length 1471
13:06:12.197412 IP 10.0.2.15.43272 > 151.101.117.140.443: Flags [.], ack 199228, win 65535, length 0
13:06:12.234250 IP 151.101.117.140.443 > 10.0.2.15.43272: Flags [P.], seq 199228:203350, ack 821, win 65535, length 4122
13:06:12.234283 IP 10.0.2.15.43272 > 151.101.117.140.443: Flags [.], ack 203350, win 65535, length 0
13:06:12.235652 IP 151.101.117.140.443 > 10.0.2.15.43272: Flags [P.], seq 203350:208846, ack 821, win 65535, length 5496
13:06:12.235672 IP 10.0.2.15.43272 > 151.101.117.140.443: Flags [.], ack 208846, win 65535, length 0
13:06:12.236836 IP 151.101.117.140.443 > 10.0.2.15.43272: Flags [P.], seq 208846:219781, ack 821, win 65535, length 10935
13:06:12.236870 IP 10.0.2.15.43272 > 151.101.117.140.443: Flags [.], ack 219781, win 65535, length 0
13:06:12.237646 IP 151.101.117.140.443 > 10.0.2.15.43272: Flags [P.], seq 219781:225277, ack 821, win 65535, length 5496
13:06:12.237661 IP 10.0.2.15.43272 > 151.101.117.140.443: Flags [.], ack 225277, win 65535, length 0
13:06:12.238822 IP 151.101.117.140.443 > 10.0.2.15.43272: Flags [P.], seq 225277:230773, ack 821, win 65535, length 5496
13:06:12.238837 IP 10.0.2.15.43272 > 151.101.117.140.443: Flags [.], ack 230773, win 65535, length 0
13:06:12.239698 IP 151.101.117.140.443 > 10.0.2.15.43272: Flags [P.], seq 230773:234895, ack 821, win 65535, length 4122
13:06:12.239717 IP 10.0.2.15.43272 > 151.101.117.140.443: Flags [.], ack 234895, win 65535, length 0
13:06:12.239886 IP 151.101.117.140.443 > 10.0.2.15.43272: Flags [P.], seq 234895:237643, ack 821, win 65535, length 2748
13:06:12.239896 IP 10.0.2.15.43272 > 151.101.117.140.443: Flags [.], ack 237643, win 65535, length 0
13:06:12.240912 IP 151.101.117.140.443 > 10.0.2.15.43272: Flags [P.], seq 237643:241765, ack 821, win 65535, length 4122
13:06:12.240926 IP 10.0.2.15.43272 > 151.101.117.140.443: Flags [.], ack 241765, win 65535, length 0
13:06:12.242131 IP 151.101.117.140.443 > 10.0.2.15.43272: Flags [P.], seq 241765:248635, ack 821, win 65535, length 6870
13:06:12.242145 IP 10.0.2.15.43272 > 151.101.117.140.443: Flags [.], ack 248635, win 65535, length 0
13:06:12.244026 IP 151.101.117.140.443 > 10.0.2.15.43272: Flags [P.], seq 248635:255505, ack 821, win 65535, length 6870
13:06:12.244053 IP 10.0.2.15.43272 > 151.101.117.140.443: Flags [.], ack 255505, win 65535, length 0
13:06:12.244609 IP 151.101.117.140.443 > 10.0.2.15.43272: Flags [P.], seq 255505:256780, ack 821, win 65535, length 1275
13:06:12.244626 IP 10.0.2.15.43272 > 151.101.117.140.443: Flags [.], ack 256780, win 65535, length 0
13:06:12.247404 IP 151.101.117.140.443 > 10.0.2.15.43272: Flags [P.], seq 256780:263650, ack 821, win 65535, length 6870
13:06:12.247474 IP 10.0.2.15.43272 > 151.101.117.140.443: Flags [.], ack 263650, win 65535, length 0
13:06:12.248359 IP 151.101.117.140.443 > 10.0.2.15.43272: Flags [P.], seq 263650:271894, ack 821, win 65535, length 8244
13:06:12.248375 IP 10.0.2.15.43272 > 151.101.117.140.443: Flags [.], ack 271894, win 65535, length 0
13:06:12.249883 IP 151.101.117.140.443 > 10.0.2.15.43272: Flags [P.], seq 271894:278764, ack 821, win 65535, length 6870
13:06:12.249904 IP 10.0.2.15.43272 > 151.101.117.140.443: Flags [.], ack 278764, win 65535, length 0
13:06:12.250520 IP 151.101.117.140.443 > 10.0.2.15.43272: Flags [P.], seq 278764:282886, ack 821, win 65535, length 4122
13:06:12.250543 IP 10.0.2.15.43272 > 151.101.117.140.443: Flags [.], ack 282886, win 65535, length 0
13:06:12.251717 IP 151.101.117.140.443 > 10.0.2.15.43272: Flags [P.], seq 282886:289756, ack 821, win 65535, length 6870
13:06:12.251736 IP 10.0.2.15.43272 > 151.101.117.140.443: Flags [.], ack 289756, win 65535, length 0
13:06:12.252544 IP 151.101.117.140.443 > 10.0.2.15.43272: Flags [P.], seq 289756:293878, ack 821, win 65535, length 4122
13:06:12.252559 IP 10.0.2.15.43272 > 151.101.117.140.443: Flags [.], ack 293878, win 65535, length 0
13:06:12.252849 IP 151.101.117.140.443 > 10.0.2.15.43272: Flags [P.], seq 293878:299374, ack 821, win 65535, length 5496
13:06:12.252862 IP 10.0.2.15.43272 > 151.101.117.140.443: Flags [.], ack 299374, win 65535, length 0
13:06:12.253925 IP 151.101.117.140.443 > 10.0.2.15.43272: Flags [P.], seq 299374:304870, ack 821, win 65535, length 5496
13:06:12.253941 IP 10.0.2.15.43272 > 151.101.117.140.443: Flags [.], ack 304870, win 65535, length 0
13:06:12.255249 IP 151.101.117.140.443 > 10.0.2.15.43272: Flags [P.], seq 304870:308992, ack 821, win 65535, length 4122
13:06:12.255265 IP 10.0.2.15.43272 > 151.101.117.140.443: Flags [.], ack 308992, win 65535, length 0
13:06:12.257353 IP 151.101.117.140.443 > 10.0.2.15.43272: Flags [P.], seq 308992:308999, ack 821, win 65535, length 7
13:06:12.257424 IP 10.0.2.15.43272 > 151.101.117.140.443: Flags [.], ack 308999, win 65535, length 0
13:06:12.261238 IP 151.101.117.140.443 > 10.0.2.15.43272: Flags [P.], seq 308999:321365, ack 821, win 65535, length 12366
13:06:12.261262 IP 10.0.2.15.43272 > 151.101.117.140.443: Flags [.], ack 321365, win 65535, length 0
13:06:12.262676 IP 151.101.117.140.443 > 10.0.2.15.43272: Flags [P.], seq 321365:328184, ack 821, win 65535, length 6819
13:06:12.262696 IP 10.0.2.15.43272 > 151.101.117.140.443: Flags [.], ack 328184, win 65535, length 0
13:06:12.263336 IP 151.101.117.140.443 > 10.0.2.15.43272: Flags [.], seq 328184:332564, ack 821, win 65535, length 4380
13:06:12.263357 IP 10.0.2.15.43272 > 151.101.117.140.443: Flags [.], ack 332564, win 65535, length 0
13:06:12.263737 IP 151.101.117.140.443 > 10.0.2.15.43272: Flags [P.], seq 332564:335054, ack 821, win 65535, length 2490
13:06:12.263785 IP 10.0.2.15.43272 > 151.101.117.140.443: Flags [.], ack 335054, win 65535, length 0
13:06:12.264023 IP 151.101.117.140.443 > 10.0.2.15.43272: Flags [P.], seq 335054:346046, ack 821, win 65535, length 10992
13:06:12.264038 IP 10.0.2.15.43272 > 151.101.117.140.443: Flags [.], ack 346046, win 65535, length 0
13:06:12.266719 IP 151.101.117.140.443 > 10.0.2.15.43272: Flags [P.], seq 346046:362534, ack 821, win 65535, length 16488
13:06:12.266735 IP 10.0.2.15.43272 > 151.101.117.140.443: Flags [.], ack 362534, win 65535, length 0
13:06:12.267819 IP 151.101.117.140.443 > 10.0.2.15.43272: Flags [P.], seq 362534:369404, ack 821, win 65535, length 6870
13:06:12.267834 IP 10.0.2.15.43272 > 151.101.117.140.443: Flags [.], ack 369404, win 65535, length 0
13:06:12.269554 IP 151.101.117.140.443 > 10.0.2.15.43272: Flags [P.], seq 369404:374748, ack 821, win 65535, length 5344
13:06:12.269574 IP 10.0.2.15.43272 > 151.101.117.140.443: Flags [.], ack 374748, win 65535, length 0
13:06:12.274117 IP 151.101.117.140.443 > 10.0.2.15.43272: Flags [P.], seq 374748:385740, ack 821, win 65535, length 10992
13:06:12.274137 IP 10.0.2.15.43272 > 151.101.117.140.443: Flags [.], ack 385740, win 65535, length 0
13:06:12.274642 IP 151.101.117.140.443 > 10.0.2.15.43272: Flags [P.], seq 385740:392610, ack 821, win 65535, length 6870
13:06:12.274654 IP 10.0.2.15.43272 > 151.101.117.140.443: Flags [.], ack 392610, win 65535, length 0
13:06:12.275948 IP 151.101.117.140.443 > 10.0.2.15.43272: Flags [P.], seq 392610:400854, ack 821, win 65535, length 8244
13:06:12.275966 IP 10.0.2.15.43272 > 151.101.117.140.443: Flags [.], ack 400854, win 65535, length 0
13:06:12.276196 IP 151.101.117.140.443 > 10.0.2.15.43272: Flags [P.], seq 400854:404976, ack 821, win 65535, length 4122
13:06:12.276205 IP 10.0.2.15.43272 > 151.101.117.140.443: Flags [.], ack 404976, win 65535, length 0
13:06:12.277229 IP 151.101.117.140.443 > 10.0.2.15.43272: Flags [P.], seq 404976:415968, ack 821, win 65535, length 10992
13:06:12.277244 IP 10.0.2.15.43272 > 151.101.117.140.443: Flags [.], ack 415968, win 65535, length 0
13:06:12.278505 IP 151.101.117.140.443 > 10.0.2.15.43272: Flags [P.], seq 415968:421464, ack 821, win 65535, length 5496
13:06:12.278524 IP 10.0.2.15.43272 > 151.101.117.140.443: Flags [.], ack 421464, win 65535, length 0
13:06:12.279744 IP 151.101.117.140.443 > 10.0.2.15.43272: Flags [P.], seq 421464:428334, ack 821, win 65535, length 6870
13:06:12.279762 IP 10.0.2.15.43272 > 151.101.117.140.443: Flags [.], ack 428334, win 65535, length 0
13:06:12.281016 IP 151.101.117.140.443 > 10.0.2.15.43272: Flags [P.], seq 428334:437952, ack 821, win 65535, length 9618
13:06:12.281038 IP 10.0.2.15.43272 > 151.101.117.140.443: Flags [.], ack 437952, win 65535, length 0
13:06:12.282124 IP 151.101.117.140.443 > 10.0.2.15.43272: Flags [P.], seq 437952:440483, ack 821, win 65535, length 2531
13:06:12.282140 IP 10.0.2.15.43272 > 151.101.117.140.443: Flags [.], ack 440483, win 65535, length 0
13:06:12.285148 IP 151.101.117.140.443 > 10.0.2.15.43272: Flags [P.], seq 440483:448727, ack 821, win 65535, length 8244
13:06:12.285170 IP 10.0.2.15.43272 > 151.101.117.140.443: Flags [.], ack 448727, win 65535, length 0
13:06:12.285348 IP 151.101.117.140.443 > 10.0.2.15.43272: Flags [P.], seq 448727:452849, ack 821, win 65535, length 4122
13:06:12.285358 IP 10.0.2.15.43272 > 151.101.117.140.443: Flags [.], ack 452849, win 65535, length 0
13:06:12.287297 IP 151.101.117.140.443 > 10.0.2.15.43272: Flags [P.], seq 452849:466589, ack 821, win 65535, length 13740
13:06:12.287313 IP 10.0.2.15.43272 > 151.101.117.140.443: Flags [.], ack 466589, win 65535, length 0
13:06:12.288494 IP 151.101.117.140.443 > 10.0.2.15.43272: Flags [P.], seq 466589:474833, ack 821, win 65535, length 8244
13:06:12.288524 IP 10.0.2.15.43272 > 151.101.117.140.443: Flags [.], ack 474833, win 65535, length 0
13:06:12.289593 IP 151.101.117.140.443 > 10.0.2.15.43272: Flags [P.], seq 474833:480329, ack 821, win 65535, length 5496
13:06:12.289609 IP 10.0.2.15.43272 > 151.101.117.140.443: Flags [.], ack 480329, win 65535, length 0
13:06:12.290561 IP 151.101.117.140.443 > 10.0.2.15.43272: Flags [P.], seq 480329:484451, ack 821, win 65535, length 4122
13:06:12.290600 IP 10.0.2.15.43272 > 151.101.117.140.443: Flags [.], ack 484451, win 65535, length 0
13:06:12.290815 IP 151.101.117.140.443 > 10.0.2.15.43272: Flags [P.], seq 484451:488573, ack 821, win 65535, length 4122
13:06:12.290829 IP 10.0.2.15.43272 > 151.101.117.140.443: Flags [.], ack 488573, win 65535, length 0
13:06:12.291759 IP 151.101.117.140.443 > 10.0.2.15.43272: Flags [P.], seq 488573:494069, ack 821, win 65535, length 5496
13:06:12.291772 IP 10.0.2.15.43272 > 151.101.117.140.443: Flags [.], ack 494069, win 65535, length 0
13:06:12.292542 IP 151.101.117.140.443 > 10.0.2.15.43272: Flags [P.], seq 494069:499565, ack 821, win 65535, length 5496
13:06:12.292601 IP 10.0.2.15.43272 > 151.101.117.140.443: Flags [.], ack 499565, win 65535, length 0
13:06:12.292746 IP 151.101.117.140.443 > 10.0.2.15.43272: Flags [.], seq 499565:501025, ack 821, win 65535, length 1460
13:06:12.292755 IP 10.0.2.15.43272 > 151.101.117.140.443: Flags [.], ack 501025, win 65535, length 0
13:06:12.292862 IP 151.101.117.140.443 > 10.0.2.15.43272: Flags [P.], seq 501025:502313, ack 821, win 65535, length 1288
13:06:12.292868 IP 10.0.2.15.43272 > 151.101.117.140.443: Flags [.], ack 502313, win 65535, length 0
13:06:12.294599 IP 151.101.117.140.443 > 10.0.2.15.43272: Flags [P.], seq 502313:506234, ack 821, win 65535, length 3921
13:06:12.294615 IP 10.0.2.15.43272 > 151.101.117.140.443: Flags [.], ack 506234, win 65535, length 0
13:06:12.297858 IP 151.101.117.140.443 > 10.0.2.15.43272: Flags [P.], seq 506234:509419, ack 821, win 65535, length 3185
13:06:12.297875 IP 10.0.2.15.43272 > 151.101.117.140.443: Flags [.], ack 509419, win 65535, length 0
13:06:12.298883 IP 151.101.117.140.443 > 10.0.2.15.43272: Flags [P.], seq 509419:516289, ack 821, win 65535, length 6870
13:06:12.298900 IP 10.0.2.15.43272 > 151.101.117.140.443: Flags [.], ack 516289, win 65535, length 0
13:06:12.299191 IP 151.101.117.140.443 > 10.0.2.15.43272: Flags [P.], seq 516289:522664, ack 821, win 65535, length 6375
13:06:12.299253 IP 10.0.2.15.43272 > 151.101.117.140.443: Flags [.], ack 522664, win 65535, length 0
13:06:12.300491 IP 151.101.117.140.443 > 10.0.2.15.43272: Flags [P.], seq 522664:530908, ack 821, win 65535, length 8244
13:06:12.300506 IP 10.0.2.15.43272 > 151.101.117.140.443: Flags [.], ack 530908, win 65535, length 0
13:06:12.300660 IP 151.101.117.140.443 > 10.0.2.15.43272: Flags [P.], seq 530908:535030, ack 821, win 65535, length 4122
13:06:12.300719 IP 10.0.2.15.43272 > 151.101.117.140.443: Flags [.], ack 535030, win 65535, length 0
13:06:12.301450 IP 151.101.117.140.443 > 10.0.2.15.43272: Flags [P.], seq 535030:541900, ack 821, win 65535, length 6870
13:06:12.301466 IP 10.0.2.15.43272 > 151.101.117.140.443: Flags [.], ack 541900, win 65535, length 0
13:06:12.302989 IP 151.101.117.140.443 > 10.0.2.15.43272: Flags [P.], seq 541900:550144, ack 821, win 65535, length 8244
13:06:12.303005 IP 10.0.2.15.43272 > 151.101.117.140.443: Flags [.], ack 550144, win 65535, length 0
13:06:12.304018 IP 151.101.117.140.443 > 10.0.2.15.43272: Flags [P.], seq 550144:554266, ack 821, win 65535, length 4122
13:06:12.304037 IP 10.0.2.15.43272 > 151.101.117.140.443: Flags [.], ack 554266, win 65535, length 0
13:06:12.304347 IP 151.101.117.140.443 > 10.0.2.15.43272: Flags [P.], seq 554266:562510, ack 821, win 65535, length 8244
13:06:12.304360 IP 10.0.2.15.43272 > 151.101.117.140.443: Flags [.], ack 562510, win 65535, length 0
13:06:12.305363 IP 151.101.117.140.443 > 10.0.2.15.43272: Flags [P.], seq 562510:569380, ack 821, win 65535, length 6870
13:06:12.305380 IP 10.0.2.15.43272 > 151.101.117.140.443: Flags [.], ack 569380, win 65535, length 0
13:06:12.306599 IP 151.101.117.140.443 > 10.0.2.15.43272: Flags [P.], seq 569380:577624, ack 821, win 65535, length 8244
13:06:12.306658 IP 10.0.2.15.43272 > 151.101.117.140.443: Flags [.], ack 577624, win 65535, length 0
13:06:12.307796 IP 151.101.117.140.443 > 10.0.2.15.43272: Flags [P.], seq 577624:587242, ack 821, win 65535, length 9618
13:06:12.307816 IP 10.0.2.15.43272 > 151.101.117.140.443: Flags [.], ack 587242, win 65535, length 0
13:06:12.308832 IP 151.101.117.140.443 > 10.0.2.15.43272: Flags [P.], seq 587242:588375, ack 821, win 65535, length 1133
13:06:12.308845 IP 10.0.2.15.43272 > 151.101.117.140.443: Flags [.], ack 588375, win 65535, length 0
13:06:12.310450 IP 151.101.117.140.443 > 10.0.2.15.43272: Flags [P.], seq 588375:595245, ack 821, win 65535, length 6870
13:06:12.310466 IP 10.0.2.15.43272 > 151.101.117.140.443: Flags [.], ack 595245, win 65535, length 0
13:06:12.311769 IP 151.101.117.140.443 > 10.0.2.15.43272: Flags [P.], seq 595245:599367, ack 821, win 65535, length 4122
13:06:12.311784 IP 10.0.2.15.43272 > 151.101.117.140.443: Flags [.], ack 599367, win 65535, length 0
13:06:12.312946 IP 151.101.117.140.443 > 10.0.2.15.43272: Flags [P.], seq 599367:603489, ack 821, win 65535, length 4122
13:06:12.312948 IP 151.101.117.140.443 > 10.0.2.15.43272: Flags [P.], seq 603489:607611, ack 821, win 65535, length 4122
13:06:12.312968 IP 10.0.2.15.43272 > 151.101.117.140.443: Flags [.], ack 603489, win 65535, length 0
13:06:12.312996 IP 10.0.2.15.43272 > 151.101.117.140.443: Flags [.], ack 607611, win 65535, length 0
13:06:12.314337 IP 151.101.117.140.443 > 10.0.2.15.43272: Flags [P.], seq 607611:618603, ack 821, win 65535, length 10992
13:06:12.314364 IP 10.0.2.15.43272 > 151.101.117.140.443: Flags [.], ack 618603, win 65535, length 0
13:06:12.315390 IP 151.101.117.140.443 > 10.0.2.15.43272: Flags [P.], seq 618603:625473, ack 821, win 65535, length 6870
13:06:12.315407 IP 10.0.2.15.43272 > 151.101.117.140.443: Flags [.], ack 625473, win 65535, length 0
13:06:12.316033 IP 151.101.117.140.443 > 10.0.2.15.43272: Flags [P.], seq 625473:628221, ack 821, win 65535, length 2748
13:06:12.316048 IP 10.0.2.15.43272 > 151.101.117.140.443: Flags [.], ack 628221, win 65535, length 0
13:06:12.317005 IP 151.101.117.140.443 > 10.0.2.15.43272: Flags [P.], seq 628221:633717, ack 821, win 65535, length 5496
13:06:12.317007 IP 151.101.117.140.443 > 10.0.2.15.43272: Flags [P.], seq 633717:636465, ack 821, win 65535, length 2748
13:06:12.317028 IP 10.0.2.15.43272 > 151.101.117.140.443: Flags [.], ack 633717, win 65535, length 0
13:06:12.317055 IP 10.0.2.15.43272 > 151.101.117.140.443: Flags [.], ack 636465, win 65535, length 0
13:06:12.318292 IP 151.101.117.140.443 > 10.0.2.15.43272: Flags [P.], seq 636465:646083, ack 821, win 65535, length 9618
13:06:12.318309 IP 10.0.2.15.43272 > 151.101.117.140.443: Flags [.], ack 646083, win 65535, length 0
13:06:12.319497 IP 151.101.117.140.443 > 10.0.2.15.43272: Flags [P.], seq 646083:652953, ack 821, win 65535, length 6870
13:06:12.319513 IP 10.0.2.15.43272 > 151.101.117.140.443: Flags [.], ack 652953, win 65535, length 0
13:06:12.320470 IP 151.101.117.140.443 > 10.0.2.15.43272: Flags [P.], seq 652953:654147, ack 821, win 65535, length 1194
13:06:12.320485 IP 10.0.2.15.43272 > 151.101.117.140.443: Flags [.], ack 654147, win 65535, length 0
13:06:12.322163 IP 151.101.117.140.443 > 10.0.2.15.43272: Flags [P.], seq 654147:658269, ack 821, win 65535, length 4122
13:06:12.322178 IP 10.0.2.15.43272 > 151.101.117.140.443: Flags [.], ack 658269, win 65535, length 0
13:06:12.322341 IP 151.101.117.140.443 > 10.0.2.15.43272: Flags [P.], seq 658269:663765, ack 821, win 65535, length 5496
13:06:12.322348 IP 10.0.2.15.43272 > 151.101.117.140.443: Flags [.], ack 663765, win 65535, length 0
13:06:12.323856 IP 151.101.117.140.443 > 10.0.2.15.43272: Flags [P.], seq 663765:673383, ack 821, win 65535, length 9618
13:06:12.323872 IP 10.0.2.15.43272 > 151.101.117.140.443: Flags [.], ack 673383, win 65535, length 0
13:06:12.324850 IP 151.101.117.140.443 > 10.0.2.15.43272: Flags [P.], seq 673383:680253, ack 821, win 65535, length 6870
13:06:12.324867 IP 10.0.2.15.43272 > 151.101.117.140.443: Flags [.], ack 680253, win 65535, length 0
13:06:12.325647 IP 151.101.117.140.443 > 10.0.2.15.43272: Flags [P.], seq 680253:688497, ack 821, win 65535, length 8244
13:06:12.325661 IP 10.0.2.15.43272 > 151.101.117.140.443: Flags [.], ack 688497, win 65535, length 0
13:06:12.325875 IP 151.101.117.140.443 > 10.0.2.15.43272: Flags [P.], seq 688497:689871, ack 821, win 65535, length 1374
13:06:12.325883 IP 10.0.2.15.43272 > 151.101.117.140.443: Flags [.], ack 689871, win 65535, length 0

