20:06:54.679540 IP 10.0.2.15.44069 > 140.233.253.2.53: 28635+ A? www.reddit.com. (32)
20:06:54.679581 IP 10.0.2.15.44069 > 140.233.253.2.53: 5337+ AAAA? www.reddit.com. (32)
20:06:54.685366 IP 140.233.253.2.53 > 10.0.2.15.44069: 28635 2/0/0 CNAME reddit.map.fastly.net., A 151.101.117.140 (83)
20:06:54.685653 IP 140.233.253.2.53 > 10.0.2.15.44069: 5337 1/1/0 CNAME reddit.map.fastly.net. (125)
20:06:54.685881 IP 10.0.2.15.53180 > 151.101.117.140.443: Flags [S], seq 3024511509, win 64240, options [mss 1460,sackOK,TS val 3623903869 ecr 0,nop,wscale 6], length 0
20:06:54.700371 IP 151.101.117.140.443 > 10.0.2.15.53180: Flags [S.], seq 229760001, ack 3024511510, win 65535, options [mss 1460], length 0
20:06:54.700423 IP 10.0.2.15.53180 > 151.101.117.140.443: Flags [.], ack 1, win 64240, length 0
20:06:54.711699 IP 10.0.2.15.53180 > 151.101.117.140.443: Flags [P.], seq 1:518, ack 1, win 64240, length 517
20:06:54.712085 IP 151.101.117.140.443 > 10.0.2.15.53180: Flags [.], ack 518, win 65535, length 0
20:06:54.728167 IP 151.101.117.140.443 > 10.0.2.15.53180: Flags [P.], seq 1:2749, ack 518, win 65535, length 2748
20:06:54.728192 IP 10.0.2.15.53180 > 151.101.117.140.443: Flags [.], ack 2749, win 62780, length 0
20:06:54.730242 IP 151.101.117.140.443 > 10.0.2.15.53180: Flags [P.], seq 2749:3722, ack 518, win 65535, length 973
20:06:54.730261 IP 10.0.2.15.53180 > 151.101.117.140.443: Flags [.], ack 3722, win 62780, length 0
20:06:54.731208 IP 10.0.2.15.53180 > 151.101.117.140.443: Flags [P.], seq 518:598, ack 3722, win 62780, length 80
20:06:54.731382 IP 10.0.2.15.53180 > 151.101.117.140.443: Flags [P.], seq 598:644, ack 3722, win 62780, length 46
20:06:54.731459 IP 151.101.117.140.443 > 10.0.2.15.53180: Flags [.], ack 598, win 65535, length 0
20:06:54.731498 IP 10.0.2.15.53180 > 151.101.117.140.443: Flags [P.], seq 644:693, ack 3722, win 62780, length 49
20:06:54.731555 IP 10.0.2.15.53180 > 151.101.117.140.443: Flags [P.], seq 693:790, ack 3722, win 62780, length 97
20:06:54.732055 IP 151.101.117.140.443 > 10.0.2.15.53180: Flags [.], ack 644, win 65535, length 0
20:06:54.732057 IP 151.101.117.140.443 > 10.0.2.15.53180: Flags [.], ack 693, win 65535, length 0
20:06:54.732058 IP 151.101.117.140.443 > 10.0.2.15.53180: Flags [.], ack 790, win 65535, length 0
20:06:54.745056 IP 151.101.117.140.443 > 10.0.2.15.53180: Flags [P.], seq 3722:3803, ack 790, win 65535, length 81
20:06:54.745075 IP 10.0.2.15.53180 > 151.101.117.140.443: Flags [.], ack 3803, win 62780, length 0
20:06:54.745246 IP 10.0.2.15.53180 > 151.101.117.140.443: Flags [P.], seq 790:821, ack 3803, win 62780, length 31
20:06:54.745449 IP 151.101.117.140.443 > 10.0.2.15.53180: Flags [.], ack 821, win 65535, length 0
20:06:55.203026 IP 151.101.117.140.443 > 10.0.2.15.53180: Flags [.], seq 3803:11103, ack 821, win 65535, length 7300
20:06:55.203062 IP 10.0.2.15.53180 > 151.101.117.140.443: Flags [.], ack 11103, win 59860, length 0
20:06:55.203346 IP 151.101.117.140.443 > 10.0.2.15.53180: Flags [.], seq 11103:19863, ack 821, win 65535, length 8760
20:06:55.203362 IP 10.0.2.15.53180 > 151.101.117.140.443: Flags [.], ack 19863, win 54020, length 0
20:06:55.203616 IP 151.101.117.140.443 > 10.0.2.15.53180: Flags [.], seq 19863:30083, ack 821, win 65535, length 10220
20:06:55.203652 IP 10.0.2.15.53180 > 151.101.117.140.443: Flags [.], ack 30083, win 43800, length 0
20:06:55.203966 IP 151.101.117.140.443 > 10.0.2.15.53180: Flags [.], seq 30083:41763, ack 821, win 65535, length 11680
20:06:55.203980 IP 10.0.2.15.53180 > 151.101.117.140.443: Flags [.], ack 41763, win 39420, length 0
20:06:55.204220 IP 151.101.117.140.443 > 10.0.2.15.53180: Flags [P.], seq 41763:51174, ack 821, win 65535, length 9411
20:06:55.204232 IP 10.0.2.15.53180 > 151.101.117.140.443: Flags [.], ack 51174, win 33580, length 0
20:06:55.219657 IP 151.101.117.140.443 > 10.0.2.15.53180: Flags [P.], seq 51174:60792, ack 821, win 65535, length 9618
20:06:55.219660 IP 151.101.117.140.443 > 10.0.2.15.53180: Flags [P.], seq 60792:63540, ack 821, win 65535, length 2748
20:06:55.219685 IP 10.0.2.15.53180 > 151.101.117.140.443: Flags [.], ack 60792, win 58400, length 0
20:06:55.219725 IP 10.0.2.15.53180 > 151.101.117.140.443: Flags [.], ack 63540, win 55652, length 0
20:06:55.219744 IP 151.101.117.140.443 > 10.0.2.15.53180: Flags [P.], seq 63540:64914, ack 821, win 65535, length 1374
20:06:55.219749 IP 10.0.2.15.53180 > 151.101.117.140.443: Flags [.], ack 64914, win 55652, length 0
20:06:55.220577 IP 151.101.117.140.443 > 10.0.2.15.53180: Flags [P.], seq 64914:67662, ack 821, win 65535, length 2748
20:06:55.220579 IP 151.101.117.140.443 > 10.0.2.15.53180: Flags [P.], seq 67662:70410, ack 821, win 65535, length 2748
20:06:55.220670 IP 10.0.2.15.53180 > 151.101.117.140.443: Flags [.], ack 67662, win 52904, length 0
20:06:55.220746 IP 10.0.2.15.53180 > 151.101.117.140.443: Flags [.], ack 70410, win 51100, length 0
20:06:55.221262 IP 151.101.117.140.443 > 10.0.2.15.53180: Flags [P.], seq 70410:74532, ack 821, win 65535, length 4122
20:06:55.221282 IP 10.0.2.15.53180 > 151.101.117.140.443: Flags [.], ack 74532, win 65535, length 0
20:06:55.221621 IP 151.101.117.140.443 > 10.0.2.15.53180: Flags [P.], seq 74532:80028, ack 821, win 65535, length 5496
20:06:55.221635 IP 10.0.2.15.53180 > 151.101.117.140.443: Flags [.], ack 80028, win 65535, length 0
20:06:55.223063 IP 151.101.117.140.443 > 10.0.2.15.53180: Flags [P.], seq 80028:82776, ack 821, win 65535, length 2748
20:06:55.223084 IP 10.0.2.15.53180 > 151.101.117.140.443: Flags [.], ack 82776, win 65535, length 0
20:06:55.224237 IP 151.101.117.140.443 > 10.0.2.15.53180: Flags [P.], seq 82776:91020, ack 821, win 65535, length 8244
20:06:55.224318 IP 10.0.2.15.53180 > 151.101.117.140.443: Flags [.], ack 91020, win 65535, length 0
20:06:55.227078 IP 151.101.117.140.443 > 10.0.2.15.53180: Flags [P.], seq 91020:95142, ack 821, win 65535, length 4122
20:06:55.227103 IP 10.0.2.15.53180 > 151.101.117.140.443: Flags [.], ack 95142, win 65535, length 0
20:06:55.227574 IP 151.101.117.140.443 > 10.0.2.15.53180: Flags [P.], seq 95142:99264, ack 821, win 65535, length 4122
20:06:55.227578 IP 151.101.117.140.443 > 10.0.2.15.53180: Flags [P.], seq 99264:104760, ack 821, win 65535, length 5496
20:06:55.227599 IP 10.0.2.15.53180 > 151.101.117.140.443: Flags [.], ack 99264, win 65535, length 0
20:06:55.227619 IP 10.0.2.15.53180 > 151.101.117.140.443: Flags [.], ack 104760, win 65535, length 0
20:06:55.234009 IP 151.101.117.140.443 > 10.0.2.15.53180: Flags [P.], seq 104760:113004, ack 821, win 65535, length 8244
20:06:55.234034 IP 10.0.2.15.53180 > 151.101.117.140.443: Flags [.], ack 113004, win 65535, length 0
20:06:55.234877 IP 151.101.117.140.443 > 10.0.2.15.53180: Flags [P.], seq 113004:118500, ack 821, win 65535, length 5496
20:06:55.234899 IP 10.0.2.15.53180 > 151.101.117.140.443: Flags [.], ack 118500, win 65535, length 0
20:06:55.236915 IP 151.101.117.140.443 > 10.0.2.15.53180: Flags [P.], seq 118500:121248, ack 821, win 65535, length 2748
20:06:55.236933 IP 10.0.2.15.53180 > 151.101.117.140.443: Flags [.], ack 121248, win 65535, length 0
20:06:55.238478 IP 151.101.117.140.443 > 10.0.2.15.53180: Flags [P.], seq 121248:129492, ack 821, win 65535, length 8244
20:06:55.238497 IP 10.0.2.15.53180 > 151.101.117.140.443: Flags [.], ack 129492, win 65535, length 0
20:06:55.238648 IP 151.101.117.140.443 > 10.0.2.15.53180: Flags [P.], seq 129492:133614, ack 821, win 65535, length 4122
20:06:55.238658 IP 10.0.2.15.53180 > 151.101.117.140.443: Flags [.], ack 133614, win 65535, length 0
20:06:55.240453 IP 151.101.117.140.443 > 10.0.2.15.53180: Flags [P.], seq 133614:140484, ack 821, win 65535, length 6870
20:06:55.240455 IP 151.101.117.140.443 > 10.0.2.15.53180: Flags [P.], seq 140484:141858, ack 821, win 65535, length 1374
20:06:55.240506 IP 10.0.2.15.53180 > 151.101.117.140.443: Flags [.], ack 140484, win 65535, length 0
20:06:55.240537 IP 10.0.2.15.53180 > 151.101.117.140.443: Flags [.], ack 141858, win 65535, length 0
20:06:55.241572 IP 151.101.117.140.443 > 10.0.2.15.53180: Flags [P.], seq 141858:147354, ack 821, win 65535, length 5496
20:06:55.241593 IP 10.0.2.15.53180 > 151.101.117.140.443: Flags [.], ack 147354, win 65535, length 0
20:06:55.242752 IP 151.101.117.140.443 > 10.0.2.15.53180: Flags [P.], seq 147354:150102, ack 821, win 65535, length 2748
20:06:55.242776 IP 10.0.2.15.53180 > 151.101.117.140.443: Flags [.], ack 150102, win 65535, length 0
20:06:55.244821 IP 151.101.117.140.443 > 10.0.2.15.53180: Flags [P.], seq 150102:162468, ack 821, win 65535, length 12366
20:06:55.244843 IP 10.0.2.15.53180 > 151.101.117.140.443: Flags [.], ack 162468, win 65535, length 0
20:06:55.246278 IP 151.101.117.140.443 > 10.0.2.15.53180: Flags [P.], seq 162468:170712, ack 821, win 65535, length 8244
20:06:55.246302 IP 10.0.2.15.53180 > 151.101.117.140.443: Flags [.], ack 170712, win 65535, length 0
20:06:55.247409 IP 151.101.117.140.443 > 10.0.2.15.53180: Flags [P.], seq 170712:176208, ack 821, win 65535, length 5496
20:06:55.247427 IP 10.0.2.15.53180 > 151.101.117.140.443: Flags [.], ack 176208, win 65535, length 0
20:06:55.248443 IP 151.101.117.140.443 > 10.0.2.15.53180: Flags [P.], seq 176208:183078, ack 821, win 65535, length 6870
20:06:55.248464 IP 10.0.2.15.53180 > 151.101.117.140.443: Flags [.], ack 183078, win 65535, length 0
20:06:55.249848 IP 151.101.117.140.443 > 10.0.2.15.53180: Flags [P.], seq 183078:189948, ack 821, win 65535, length 6870
20:06:55.249851 IP 151.101.117.140.443 > 10.0.2.15.53180: Flags [P.], seq 189948:195444, ack 821, win 65535, length 5496
20:06:55.249878 IP 10.0.2.15.53180 > 151.101.117.140.443: Flags [.], ack 189948, win 65535, length 0
20:06:55.249993 IP 10.0.2.15.53180 > 151.101.117.140.443: Flags [.], ack 195444, win 65535, length 0
20:06:55.250263 IP 151.101.117.140.443 > 10.0.2.15.53180: Flags [P.], seq 195444:196818, ack 821, win 65535, length 1374
20:06:55.250277 IP 10.0.2.15.53180 > 151.101.117.140.443: Flags [.], ack 196818, win 65535, length 0
20:06:55.251646 IP 151.101.117.140.443 > 10.0.2.15.53180: Flags [P.], seq 196818:197750, ack 821, win 65535, length 932
20:06:55.251724 IP 10.0.2.15.53180 > 151.101.117.140.443: Flags [.], ack 197750, win 65535, length 0
20:06:56.328631 IP 151.101.117.140.443 > 10.0.2.15.53180: Flags [P.], seq 197750:200595, ack 821, win 65535, length 2845
20:06:56.328653 IP 10.0.2.15.53180 > 151.101.117.140.443: Flags [.], ack 200595, win 65535, length 0
20:06:56.332790 IP 151.101.117.140.443 > 10.0.2.15.53180: Flags [P.], seq 200595:254051, ack 821, win 65535, length 53456
20:06:56.332825 IP 10.0.2.15.53180 > 151.101.117.140.443: Flags [.], ack 254051, win 65535, length 0
20:06:56.333682 IP 151.101.117.140.443 > 10.0.2.15.53180: Flags [.], seq 254051:267191, ack 821, win 65535, length 13140
20:06:56.333881 IP 10.0.2.15.53180 > 151.101.117.140.443: Flags [.], ack 267191, win 65535, length 0
20:06:56.333994 IP 151.101.117.140.443 > 10.0.2.15.53180: Flags [P.], seq 267191:282847, ack 821, win 65535, length 15656
20:06:56.334004 IP 10.0.2.15.53180 > 151.101.117.140.443: Flags [.], ack 282847, win 65535, length 0
20:06:56.334028 IP 151.101.117.140.443 > 10.0.2.15.53180: Flags [P.], seq 282847:286969, ack 821, win 65535, length 4122
20:06:56.334029 IP 151.101.117.140.443 > 10.0.2.15.53180: Flags [P.], seq 286969:288343, ack 821, win 65535, length 1374
20:06:56.334036 IP 10.0.2.15.53180 > 151.101.117.140.443: Flags [.], ack 286969, win 65535, length 0
20:06:56.334044 IP 10.0.2.15.53180 > 151.101.117.140.443: Flags [.], ack 288343, win 65535, length 0
20:06:56.339036 IP 151.101.117.140.443 > 10.0.2.15.53180: Flags [P.], seq 288343:292465, ack 821, win 65535, length 4122
20:06:56.339056 IP 10.0.2.15.53180 > 151.101.117.140.443: Flags [.], ack 292465, win 65535, length 0
20:06:56.339341 IP 151.101.117.140.443 > 10.0.2.15.53180: Flags [.], seq 292465:323125, ack 821, win 65535, length 30660
20:06:56.339352 IP 10.0.2.15.53180 > 151.101.117.140.443: Flags [.], ack 323125, win 65535, length 0
20:06:56.339746 IP 151.101.117.140.443 > 10.0.2.15.53180: Flags [P.], seq 323125:350020, ack 821, win 65535, length 26895
20:06:56.339756 IP 10.0.2.15.53180 > 151.101.117.140.443: Flags [.], ack 350020, win 65535, length 0
20:06:56.340450 IP 151.101.117.140.443 > 10.0.2.15.53180: Flags [.], seq 350020:369000, ack 821, win 65535, length 18980
20:06:56.340462 IP 10.0.2.15.53180 > 151.101.117.140.443: Flags [.], ack 369000, win 65535, length 0
20:06:56.340573 IP 151.101.117.140.443 > 10.0.2.15.53180: Flags [P.], seq 369000:370439, ack 821, win 65535, length 1439
20:06:56.340579 IP 10.0.2.15.53180 > 151.101.117.140.443: Flags [.], ack 370439, win 65535, length 0
20:06:56.344012 IP 151.101.117.140.443 > 10.0.2.15.53180: Flags [P.], seq 370439:378683, ack 821, win 65535, length 8244
20:06:56.344033 IP 10.0.2.15.53180 > 151.101.117.140.443: Flags [.], ack 378683, win 65535, length 0
20:06:56.347365 IP 151.101.117.140.443 > 10.0.2.15.53180: Flags [P.], seq 378683:385553, ack 821, win 65535, length 6870
20:06:56.347390 IP 10.0.2.15.53180 > 151.101.117.140.443: Flags [.], ack 385553, win 65535, length 0
20:06:56.348061 IP 151.101.117.140.443 > 10.0.2.15.53180: Flags [P.], seq 385553:389348, ack 821, win 65535, length 3795
20:06:56.348078 IP 10.0.2.15.53180 > 151.101.117.140.443: Flags [.], ack 389348, win 65535, length 0
20:06:56.351651 IP 151.101.117.140.443 > 10.0.2.15.53180: Flags [P.], seq 389348:398966, ack 821, win 65535, length 9618
20:06:56.351654 IP 151.101.117.140.443 > 10.0.2.15.53180: Flags [P.], seq 398966:401714, ack 821, win 65535, length 2748
20:06:56.351686 IP 10.0.2.15.53180 > 151.101.117.140.443: Flags [.], ack 398966, win 65535, length 0
20:06:56.351723 IP 10.0.2.15.53180 > 151.101.117.140.443: Flags [.], ack 401714, win 65535, length 0
20:06:56.352816 IP 151.101.117.140.443 > 10.0.2.15.53180: Flags [P.], seq 401714:403088, ack 821, win 65535, length 1374
20:06:56.352833 IP 10.0.2.15.53180 > 151.101.117.140.443: Flags [.], ack 403088, win 65535, length 0
20:06:56.354414 IP 151.101.117.140.443 > 10.0.2.15.53180: Flags [P.], seq 403088:419576, ack 821, win 65535, length 16488
20:06:56.354441 IP 10.0.2.15.53180 > 151.101.117.140.443: Flags [.], ack 419576, win 65535, length 0
20:06:56.354780 IP 151.101.117.140.443 > 10.0.2.15.53180: Flags [P.], seq 419576:426446, ack 821, win 65535, length 6870
20:06:56.354782 IP 151.101.117.140.443 > 10.0.2.15.53180: Flags [P.], seq 426446:430568, ack 821, win 65535, length 4122
20:06:56.354802 IP 10.0.2.15.53180 > 151.101.117.140.443: Flags [.], ack 426446, win 65535, length 0
20:06:56.354833 IP 10.0.2.15.53180 > 151.101.117.140.443: Flags [.], ack 430568, win 65535, length 0
20:06:56.354873 IP 151.101.117.140.443 > 10.0.2.15.53180: Flags [P.], seq 430568:434690, ack 821, win 65535, length 4122
20:06:56.354925 IP 10.0.2.15.53180 > 151.101.117.140.443: Flags [.], ack 434690, win 65535, length 0
20:06:56.356517 IP 151.101.117.140.443 > 10.0.2.15.53180: Flags [P.], seq 434690:436064, ack 821, win 65535, length 1374
20:06:56.356534 IP 10.0.2.15.53180 > 151.101.117.140.443: Flags [.], ack 436064, win 65535, length 0
20:06:56.358961 IP 151.101.117.140.443 > 10.0.2.15.53180: Flags [P.], seq 436064:486902, ack 821, win 65535, length 50838
20:06:56.358981 IP 10.0.2.15.53180 > 151.101.117.140.443: Flags [.], ack 486902, win 65535, length 0
20:06:56.359267 IP 151.101.117.140.443 > 10.0.2.15.53180: Flags [P.], seq 486902:489650, ack 821, win 65535, length 2748
20:06:56.359281 IP 10.0.2.15.53180 > 151.101.117.140.443: Flags [.], ack 489650, win 65535, length 0
20:06:56.362117 IP 151.101.117.140.443 > 10.0.2.15.53180: Flags [P.], seq 489650:525374, ack 821, win 65535, length 35724
20:06:56.362134 IP 10.0.2.15.53180 > 151.101.117.140.443: Flags [.], ack 525374, win 65535, length 0
20:06:56.362398 IP 151.101.117.140.443 > 10.0.2.15.53180: Flags [P.], seq 525374:536366, ack 821, win 65535, length 10992
20:06:56.362408 IP 10.0.2.15.53180 > 151.101.117.140.443: Flags [.], ack 536366, win 65535, length 0
20:06:56.364932 IP 151.101.117.140.443 > 10.0.2.15.53180: Flags [P.], seq 536366:552854, ack 821, win 65535, length 16488
20:06:56.364951 IP 10.0.2.15.53180 > 151.101.117.140.443: Flags [.], ack 552854, win 65535, length 0
20:06:56.365006 IP 151.101.117.140.443 > 10.0.2.15.53180: Flags [P.], seq 552854:559724, ack 821, win 65535, length 6870
20:06:56.365007 IP 151.101.117.140.443 > 10.0.2.15.53180: Flags [P.], seq 559724:562472, ack 821, win 65535, length 2748
20:06:56.365008 IP 151.101.117.140.443 > 10.0.2.15.53180: Flags [P.], seq 562472:563846, ack 821, win 65535, length 1374
20:06:56.365019 IP 10.0.2.15.53180 > 151.101.117.140.443: Flags [.], ack 559724, win 65535, length 0
20:06:56.365199 IP 10.0.2.15.53180 > 151.101.117.140.443: Flags [.], ack 562472, win 65535, length 0
20:06:56.365222 IP 10.0.2.15.53180 > 151.101.117.140.443: Flags [.], ack 563846, win 65535, length 0
20:06:56.365281 IP 151.101.117.140.443 > 10.0.2.15.53180: Flags [P.], seq 563846:566594, ack 821, win 65535, length 2748
20:06:56.365289 IP 10.0.2.15.53180 > 151.101.117.140.443: Flags [.], ack 566594, win 65535, length 0
20:06:56.365468 IP 151.101.117.140.443 > 10.0.2.15.53180: Flags [P.], seq 566594:569342, ack 821, win 65535, length 2748
20:06:56.365470 IP 151.101.117.140.443 > 10.0.2.15.53180: Flags [P.], seq 569342:572090, ack 821, win 65535, length 2748
20:06:56.365479 IP 10.0.2.15.53180 > 151.101.117.140.443: Flags [.], ack 569342, win 65535, length 0
20:06:56.365535 IP 10.0.2.15.53180 > 151.101.117.140.443: Flags [.], ack 572090, win 65535, length 0
20:06:56.365785 IP 151.101.117.140.443 > 10.0.2.15.53180: Flags [P.], seq 572090:573464, ack 821, win 65535, length 1374
20:06:56.365787 IP 151.101.117.140.443 > 10.0.2.15.53180: Flags [P.], seq 573464:576212, ack 821, win 65535, length 2748
20:06:56.365798 IP 10.0.2.15.53180 > 151.101.117.140.443: Flags [.], ack 573464, win 65535, length 0
20:06:56.365815 IP 10.0.2.15.53180 > 151.101.117.140.443: Flags [.], ack 576212, win 65535, length 0
20:06:56.365986 IP 151.101.117.140.443 > 10.0.2.15.53180: Flags [P.], seq 576212:578960, ack 821, win 65535, length 2748
20:06:56.365987 IP 151.101.117.140.443 > 10.0.2.15.53180: Flags [P.], seq 578960:581708, ack 821, win 65535, length 2748
20:06:56.365995 IP 10.0.2.15.53180 > 151.101.117.140.443: Flags [.], ack 578960, win 65535, length 0
20:06:56.366012 IP 10.0.2.15.53180 > 151.101.117.140.443: Flags [.], ack 581708, win 65535, length 0
20:06:56.366375 IP 151.101.117.140.443 > 10.0.2.15.53180: Flags [P.], seq 581708:584456, ack 821, win 65535, length 2748
20:06:56.366385 IP 10.0.2.15.53180 > 151.101.117.140.443: Flags [.], ack 584456, win 65535, length 0
20:06:56.366939 IP 151.101.117.140.443 > 10.0.2.15.53180: Flags [P.], seq 584456:588578, ack 821, win 65535, length 4122
20:06:56.366941 IP 151.101.117.140.443 > 10.0.2.15.53180: Flags [P.], seq 588578:592700, ack 821, win 65535, length 4122
20:06:56.366953 IP 10.0.2.15.53180 > 151.101.117.140.443: Flags [.], ack 588578, win 65535, length 0
20:06:56.366967 IP 10.0.2.15.53180 > 151.101.117.140.443: Flags [.], ack 592700, win 65535, length 0
20:06:56.367537 IP 151.101.117.140.443 > 10.0.2.15.53180: Flags [P.], seq 592700:596822, ack 821, win 65535, length 4122
20:06:56.367552 IP 10.0.2.15.53180 > 151.101.117.140.443: Flags [.], ack 596822, win 65535, length 0
20:06:56.368626 IP 151.101.117.140.443 > 10.0.2.15.53180: Flags [P.], seq 596822:603692, ack 821, win 65535, length 6870
20:06:56.368649 IP 10.0.2.15.53180 > 151.101.117.140.443: Flags [.], ack 603692, win 65535, length 0
20:06:56.370443 IP 151.101.117.140.443 > 10.0.2.15.53180: Flags [P.], seq 603692:607814, ack 821, win 65535, length 4122
20:06:56.370448 IP 151.101.117.140.443 > 10.0.2.15.53180: Flags [P.], seq 607814:628424, ack 821, win 65535, length 20610
20:06:56.370469 IP 10.0.2.15.53180 > 151.101.117.140.443: Flags [.], ack 607814, win 65535, length 0
20:06:56.370540 IP 10.0.2.15.53180 > 151.101.117.140.443: Flags [.], ack 628424, win 65535, length 0
20:06:56.370562 IP 151.101.117.140.443 > 10.0.2.15.53180: Flags [P.], seq 628424:632546, ack 821, win 65535, length 4122
20:06:56.370563 IP 151.101.117.140.443 > 10.0.2.15.53180: Flags [P.], seq 632546:635294, ack 821, win 65535, length 2748
20:06:56.370569 IP 10.0.2.15.53180 > 151.101.117.140.443: Flags [.], ack 632546, win 65535, length 0
20:06:56.370581 IP 10.0.2.15.53180 > 151.101.117.140.443: Flags [.], ack 635294, win 65535, length 0
20:06:56.371040 IP 151.101.117.140.443 > 10.0.2.15.53180: Flags [P.], seq 635294:640790, ack 821, win 65535, length 5496
20:06:56.371042 IP 151.101.117.140.443 > 10.0.2.15.53180: Flags [P.], seq 640790:643538, ack 821, win 65535, length 2748
20:06:56.371063 IP 10.0.2.15.53180 > 151.101.117.140.443: Flags [.], ack 640790, win 65535, length 0
20:06:56.371079 IP 10.0.2.15.53180 > 151.101.117.140.443: Flags [.], ack 643538, win 65535, length 0
20:06:56.373006 IP 151.101.117.140.443 > 10.0.2.15.53180: Flags [P.], seq 643538:654530, ack 821, win 65535, length 10992
20:06:56.373027 IP 10.0.2.15.53180 > 151.101.117.140.443: Flags [.], ack 654530, win 65535, length 0
20:06:56.373073 IP 151.101.117.140.443 > 10.0.2.15.53180: Flags [P.], seq 654530:657278, ack 821, win 65535, length 2748
20:06:56.373078 IP 10.0.2.15.53180 > 151.101.117.140.443: Flags [.], ack 657278, win 65535, length 0
20:06:56.375777 IP 151.101.117.140.443 > 10.0.2.15.53180: Flags [P.], seq 657278:666896, ack 821, win 65535, length 9618
20:06:56.375780 IP 151.101.117.140.443 > 10.0.2.15.53180: Flags [.], seq 666896:669816, ack 821, win 65535, length 2920
20:06:56.375805 IP 10.0.2.15.53180 > 151.101.117.140.443: Flags [.], ack 666896, win 65535, length 0
20:06:56.375990 IP 10.0.2.15.53180 > 151.101.117.140.443: Flags [.], ack 669816, win 65535, length 0
20:06:56.376291 IP 151.101.117.140.443 > 10.0.2.15.53180: Flags [P.], seq 669816:675140, ack 821, win 65535, length 5324
20:06:56.376293 IP 151.101.117.140.443 > 10.0.2.15.53180: Flags [P.], seq 675140:677888, ack 821, win 65535, length 2748
20:06:56.376294 IP 151.101.117.140.443 > 10.0.2.15.53180: Flags [P.], seq 677888:679262, ack 821, win 65535, length 1374
20:06:56.376294 IP 151.101.117.140.443 > 10.0.2.15.53180: Flags [P.], seq 679262:683384, ack 821, win 65535, length 4122
20:06:56.376430 IP 10.0.2.15.53180 > 151.101.117.140.443: Flags [.], ack 675140, win 65535, length 0
20:06:56.376453 IP 10.0.2.15.53180 > 151.101.117.140.443: Flags [.], ack 677888, win 65535, length 0
20:06:56.376467 IP 10.0.2.15.53180 > 151.101.117.140.443: Flags [.], ack 679262, win 65535, length 0
20:06:56.376477 IP 10.0.2.15.53180 > 151.101.117.140.443: Flags [.], ack 683384, win 65535, length 0
20:06:56.376505 IP 151.101.117.140.443 > 10.0.2.15.53180: Flags [P.], seq 683384:687506, ack 821, win 65535, length 4122

