20:03:02.263215 IP 10.0.2.15.43813 > 140.233.253.2.53: 64046+ A? www.reddit.com. (32)
20:03:02.263396 IP 10.0.2.15.43813 > 140.233.253.2.53: 16657+ AAAA? www.reddit.com. (32)
20:03:02.275616 IP 140.233.253.2.53 > 10.0.2.15.43813: 64046 2/0/0 CNAME reddit.map.fastly.net., A 151.101.117.140 (83)
20:03:02.275619 IP 140.233.253.2.53 > 10.0.2.15.43813: 16657 1/1/0 CNAME reddit.map.fastly.net. (125)
20:03:02.276189 IP 10.0.2.15.53108 > 151.101.117.140.443: Flags [S], seq 2126504367, win 64240, options [mss 1460,sackOK,TS val 3623671460 ecr 0,nop,wscale 6], length 0
20:03:02.298572 IP 151.101.117.140.443 > 10.0.2.15.53108: Flags [S.], seq 221056001, ack 2126504368, win 65535, options [mss 1460], length 0
20:03:02.298612 IP 10.0.2.15.53108 > 151.101.117.140.443: Flags [.], ack 1, win 64240, length 0
20:03:02.344061 IP 10.0.2.15.53108 > 151.101.117.140.443: Flags [P.], seq 1:518, ack 1, win 64240, length 517
20:03:02.345507 IP 151.101.117.140.443 > 10.0.2.15.53108: Flags [.], ack 518, win 65535, length 0
20:03:02.376365 IP 151.101.117.140.443 > 10.0.2.15.53108: Flags [.], seq 1:2921, ack 518, win 65535, length 2920
20:03:02.376558 IP 10.0.2.15.53108 > 151.101.117.140.443: Flags [.], ack 2921, win 62780, length 0
20:03:02.383316 IP 151.101.117.140.443 > 10.0.2.15.53108: Flags [P.], seq 2921:3722, ack 518, win 65535, length 801
20:03:02.383341 IP 10.0.2.15.53108 > 151.101.117.140.443: Flags [.], ack 3722, win 62780, length 0
20:03:02.389310 IP 10.0.2.15.53108 > 151.101.117.140.443: Flags [P.], seq 518:598, ack 3722, win 62780, length 80
20:03:02.390125 IP 10.0.2.15.53108 > 151.101.117.140.443: Flags [P.], seq 598:693, ack 3722, win 62780, length 95
20:03:02.393253 IP 10.0.2.15.53108 > 151.101.117.140.443: Flags [P.], seq 693:790, ack 3722, win 62780, length 97
20:03:02.393873 IP 151.101.117.140.443 > 10.0.2.15.53108: Flags [.], ack 598, win 65535, length 0
20:03:02.393875 IP 151.101.117.140.443 > 10.0.2.15.53108: Flags [.], ack 693, win 65535, length 0
20:03:02.395473 IP 151.101.117.140.443 > 10.0.2.15.53108: Flags [.], ack 790, win 65535, length 0
20:03:02.408684 IP 151.101.117.140.443 > 10.0.2.15.53108: Flags [P.], seq 3722:3781, ack 790, win 65535, length 59
20:03:02.408708 IP 10.0.2.15.53108 > 151.101.117.140.443: Flags [.], ack 3781, win 62780, length 0
20:03:02.409005 IP 10.0.2.15.53108 > 151.101.117.140.443: Flags [P.], seq 790:821, ack 3781, win 62780, length 31
20:03:02.409890 IP 151.101.117.140.443 > 10.0.2.15.53108: Flags [.], ack 821, win 65535, length 0
20:03:02.724432 IP 151.101.117.140.443 > 10.0.2.15.53108: Flags [P.], seq 3781:10651, ack 821, win 65535, length 6870
20:03:02.724467 IP 10.0.2.15.53108 > 151.101.117.140.443: Flags [.], ack 10651, win 59860, length 0
20:03:02.724606 IP 151.101.117.140.443 > 10.0.2.15.53108: Flags [P.], seq 10651:13399, ack 821, win 65535, length 2748
20:03:02.724618 IP 10.0.2.15.53108 > 151.101.117.140.443: Flags [.], ack 13399, win 58400, length 0
20:03:02.726484 IP 151.101.117.140.443 > 10.0.2.15.53108: Flags [P.], seq 13399:17521, ack 821, win 65535, length 4122
20:03:02.726507 IP 10.0.2.15.53108 > 151.101.117.140.443: Flags [.], ack 17521, win 61320, length 0
20:03:02.729194 IP 151.101.117.140.443 > 10.0.2.15.53108: Flags [P.], seq 17521:20269, ack 821, win 65535, length 2748
20:03:02.729221 IP 10.0.2.15.53108 > 151.101.117.140.443: Flags [.], ack 20269, win 62780, length 0
20:03:02.730802 IP 151.101.117.140.443 > 10.0.2.15.53108: Flags [P.], seq 20269:23017, ack 821, win 65535, length 2748
20:03:02.730823 IP 10.0.2.15.53108 > 151.101.117.140.443: Flags [.], ack 23017, win 61320, length 0
20:03:02.732656 IP 151.101.117.140.443 > 10.0.2.15.53108: Flags [P.], seq 23017:27139, ack 821, win 65535, length 4122
20:03:02.732688 IP 10.0.2.15.53108 > 151.101.117.140.443: Flags [.], ack 27139, win 57198, length 0
20:03:02.734475 IP 151.101.117.140.443 > 10.0.2.15.53108: Flags [P.], seq 27139:29887, ack 821, win 65535, length 2748
20:03:02.734501 IP 10.0.2.15.53108 > 151.101.117.140.443: Flags [.], ack 29887, win 62780, length 0
20:03:02.735454 IP 151.101.117.140.443 > 10.0.2.15.53108: Flags [P.], seq 29887:31261, ack 821, win 65535, length 1374
20:03:02.735476 IP 10.0.2.15.53108 > 151.101.117.140.443: Flags [.], ack 31261, win 62780, length 0
20:03:02.736544 IP 151.101.117.140.443 > 10.0.2.15.53108: Flags [P.], seq 31261:32635, ack 821, win 65535, length 1374
20:03:02.736618 IP 10.0.2.15.53108 > 151.101.117.140.443: Flags [.], ack 32635, win 62780, length 0
20:03:02.737926 IP 151.101.117.140.443 > 10.0.2.15.53108: Flags [P.], seq 32635:34009, ack 821, win 65535, length 1374
20:03:02.737963 IP 10.0.2.15.53108 > 151.101.117.140.443: Flags [.], ack 34009, win 62780, length 0
20:03:02.738830 IP 151.101.117.140.443 > 10.0.2.15.53108: Flags [P.], seq 34009:36757, ack 821, win 65535, length 2748
20:03:02.738850 IP 10.0.2.15.53108 > 151.101.117.140.443: Flags [.], ack 36757, win 62780, length 0
20:03:02.741670 IP 151.101.117.140.443 > 10.0.2.15.53108: Flags [P.], seq 36757:40879, ack 821, win 65535, length 4122
20:03:02.741688 IP 10.0.2.15.53108 > 151.101.117.140.443: Flags [.], ack 40879, win 61320, length 0
20:03:02.743423 IP 151.101.117.140.443 > 10.0.2.15.53108: Flags [P.], seq 40879:46375, ack 821, win 65535, length 5496
20:03:02.743500 IP 10.0.2.15.53108 > 151.101.117.140.443: Flags [.], ack 46375, win 61320, length 0
20:03:02.745786 IP 151.101.117.140.443 > 10.0.2.15.53108: Flags [P.], seq 46375:51871, ack 821, win 65535, length 5496
20:03:02.745808 IP 10.0.2.15.53108 > 151.101.117.140.443: Flags [.], ack 51871, win 61320, length 0
20:03:02.749043 IP 151.101.117.140.443 > 10.0.2.15.53108: Flags [P.], seq 51871:58741, ack 821, win 65535, length 6870
20:03:02.749045 IP 151.101.117.140.443 > 10.0.2.15.53108: Flags [P.], seq 58741:62417, ack 821, win 65535, length 3676
20:03:02.749070 IP 10.0.2.15.53108 > 151.101.117.140.443: Flags [.], ack 58741, win 59860, length 0
20:03:02.749176 IP 10.0.2.15.53108 > 151.101.117.140.443: Flags [.], ack 62417, win 56940, length 0
20:03:02.749525 IP 151.101.117.140.443 > 10.0.2.15.53108: Flags [P.], seq 62417:69287, ack 821, win 65535, length 6870
20:03:02.749688 IP 10.0.2.15.53108 > 151.101.117.140.443: Flags [.], ack 69287, win 62780, length 0
20:03:02.750384 IP 151.101.117.140.443 > 10.0.2.15.53108: Flags [P.], seq 69287:73409, ack 821, win 65535, length 4122
20:03:02.750468 IP 10.0.2.15.53108 > 151.101.117.140.443: Flags [.], ack 73409, win 65535, length 0
20:03:02.751203 IP 151.101.117.140.443 > 10.0.2.15.53108: Flags [P.], seq 73409:78905, ack 821, win 65535, length 5496
20:03:02.751266 IP 10.0.2.15.53108 > 151.101.117.140.443: Flags [.], ack 78905, win 65535, length 0
20:03:02.754562 IP 151.101.117.140.443 > 10.0.2.15.53108: Flags [P.], seq 78905:87149, ack 821, win 65535, length 8244
20:03:02.754568 IP 151.101.117.140.443 > 10.0.2.15.53108: Flags [P.], seq 87149:92645, ack 821, win 65535, length 5496
20:03:02.754866 IP 10.0.2.15.53108 > 151.101.117.140.443: Flags [.], ack 87149, win 65535, length 0
20:03:02.755038 IP 10.0.2.15.53108 > 151.101.117.140.443: Flags [.], ack 92645, win 65535, length 0
20:03:02.755601 IP 151.101.117.140.443 > 10.0.2.15.53108: Flags [P.], seq 92645:100889, ack 821, win 65535, length 8244
20:03:02.755603 IP 151.101.117.140.443 > 10.0.2.15.53108: Flags [.], seq 100889:103809, ack 821, win 65535, length 2920
20:03:02.755623 IP 10.0.2.15.53108 > 151.101.117.140.443: Flags [.], ack 100889, win 65535, length 0
20:03:02.755732 IP 10.0.2.15.53108 > 151.101.117.140.443: Flags [.], ack 103809, win 65535, length 0
20:03:02.756485 IP 151.101.117.140.443 > 10.0.2.15.53108: Flags [P.], seq 103809:110507, ack 821, win 65535, length 6698
20:03:02.756505 IP 10.0.2.15.53108 > 151.101.117.140.443: Flags [.], ack 110507, win 65535, length 0
20:03:02.758661 IP 151.101.117.140.443 > 10.0.2.15.53108: Flags [P.], seq 110507:126995, ack 821, win 65535, length 16488
20:03:02.758682 IP 10.0.2.15.53108 > 151.101.117.140.443: Flags [.], ack 126995, win 65535, length 0
20:03:02.766458 IP 151.101.117.140.443 > 10.0.2.15.53108: Flags [.], seq 126995:143055, ack 821, win 65535, length 16060
20:03:02.766481 IP 10.0.2.15.53108 > 151.101.117.140.443: Flags [.], ack 143055, win 65535, length 0
20:03:02.767223 IP 151.101.117.140.443 > 10.0.2.15.53108: Flags [P.], seq 143055:146007, ack 821, win 65535, length 2952
20:03:02.767227 IP 151.101.117.140.443 > 10.0.2.15.53108: Flags [P.], seq 146007:155625, ack 821, win 65535, length 9618
20:03:02.767250 IP 10.0.2.15.53108 > 151.101.117.140.443: Flags [.], ack 146007, win 65535, length 0
20:03:02.767277 IP 10.0.2.15.53108 > 151.101.117.140.443: Flags [.], ack 155625, win 65535, length 0
20:03:02.767315 IP 151.101.117.140.443 > 10.0.2.15.53108: Flags [P.], seq 155625:176235, ack 821, win 65535, length 20610
20:03:02.767323 IP 10.0.2.15.53108 > 151.101.117.140.443: Flags [.], ack 176235, win 65535, length 0
20:03:02.768047 IP 151.101.117.140.443 > 10.0.2.15.53108: Flags [P.], seq 176235:177449, ack 821, win 65535, length 1214
20:03:02.768067 IP 10.0.2.15.53108 > 151.101.117.140.443: Flags [.], ack 177449, win 65535, length 0
20:03:02.770528 IP 151.101.117.140.443 > 10.0.2.15.53108: Flags [P.], seq 177449:184476, ack 821, win 65535, length 7027
20:03:02.770531 IP 151.101.117.140.443 > 10.0.2.15.53108: Flags [P.], seq 184476:189972, ack 821, win 65535, length 5496
20:03:02.770560 IP 10.0.2.15.53108 > 151.101.117.140.443: Flags [.], ack 184476, win 65535, length 0
20:03:02.770703 IP 10.0.2.15.53108 > 151.101.117.140.443: Flags [.], ack 189972, win 65535, length 0
20:03:02.770774 IP 151.101.117.140.443 > 10.0.2.15.53108: Flags [P.], seq 189972:192720, ack 821, win 65535, length 2748
20:03:02.770776 IP 151.101.117.140.443 > 10.0.2.15.53108: Flags [P.], seq 192720:197896, ack 821, win 65535, length 5176
20:03:02.770786 IP 10.0.2.15.53108 > 151.101.117.140.443: Flags [.], ack 192720, win 65535, length 0
20:03:02.770870 IP 10.0.2.15.53108 > 151.101.117.140.443: Flags [.], ack 197896, win 65535, length 0
20:03:03.836152 IP 151.101.117.140.443 > 10.0.2.15.53108: Flags [P.], seq 197896:199270, ack 821, win 65535, length 1374
20:03:03.836176 IP 10.0.2.15.53108 > 151.101.117.140.443: Flags [.], ack 199270, win 65535, length 0
20:03:03.838533 IP 151.101.117.140.443 > 10.0.2.15.53108: Flags [P.], seq 199270:199367, ack 821, win 65535, length 97
20:03:03.838556 IP 10.0.2.15.53108 > 151.101.117.140.443: Flags [.], ack 199367, win 65535, length 0
20:03:03.882854 IP 151.101.117.140.443 > 10.0.2.15.53108: Flags [P.], seq 199367:203489, ack 821, win 65535, length 4122
20:03:03.882891 IP 10.0.2.15.53108 > 151.101.117.140.443: Flags [.], ack 203489, win 65535, length 0
20:03:03.885570 IP 151.101.117.140.443 > 10.0.2.15.53108: Flags [P.], seq 203489:226847, ack 821, win 65535, length 23358
20:03:03.885613 IP 10.0.2.15.53108 > 151.101.117.140.443: Flags [.], ack 226847, win 65535, length 0
20:03:03.887053 IP 151.101.117.140.443 > 10.0.2.15.53108: Flags [.], seq 226847:239987, ack 821, win 65535, length 13140
20:03:03.887076 IP 10.0.2.15.53108 > 151.101.117.140.443: Flags [.], ack 239987, win 65535, length 0
20:03:03.887194 IP 151.101.117.140.443 > 10.0.2.15.53108: Flags [P.], seq 239987:240413, ack 821, win 65535, length 426
20:03:03.887240 IP 10.0.2.15.53108 > 151.101.117.140.443: Flags [.], ack 240413, win 65535, length 0
20:03:03.898150 IP 151.101.117.140.443 > 10.0.2.15.53108: Flags [P.], seq 240413:292588, ack 821, win 65535, length 52175
20:03:03.898179 IP 10.0.2.15.53108 > 151.101.117.140.443: Flags [.], ack 292588, win 65535, length 0
20:03:03.898493 IP 151.101.117.140.443 > 10.0.2.15.53108: Flags [P.], seq 292588:294076, ack 821, win 65535, length 1488
20:03:03.898506 IP 10.0.2.15.53108 > 151.101.117.140.443: Flags [.], ack 294076, win 65535, length 0
20:03:03.904766 IP 151.101.117.140.443 > 10.0.2.15.53108: Flags [P.], seq 294076:295450, ack 821, win 65535, length 1374
20:03:03.904783 IP 10.0.2.15.53108 > 151.101.117.140.443: Flags [.], ack 295450, win 65535, length 0
20:03:03.905798 IP 151.101.117.140.443 > 10.0.2.15.53108: Flags [P.], seq 295450:303694, ack 821, win 65535, length 8244
20:03:03.905800 IP 151.101.117.140.443 > 10.0.2.15.53108: Flags [.], seq 303694:305154, ack 821, win 65535, length 1460
20:03:03.905820 IP 10.0.2.15.53108 > 151.101.117.140.443: Flags [.], ack 303694, win 65535, length 0
20:03:03.905889 IP 10.0.2.15.53108 > 151.101.117.140.443: Flags [.], ack 305154, win 65535, length 0
20:03:03.906141 IP 151.101.117.140.443 > 10.0.2.15.53108: Flags [P.], seq 305154:309190, ack 821, win 65535, length 4036
20:03:03.906143 IP 151.101.117.140.443 > 10.0.2.15.53108: Flags [P.], seq 309190:310507, ack 821, win 65535, length 1317
20:03:03.906155 IP 10.0.2.15.53108 > 151.101.117.140.443: Flags [.], ack 309190, win 65535, length 0
20:03:03.906264 IP 10.0.2.15.53108 > 151.101.117.140.443: Flags [.], ack 310507, win 65535, length 0
20:03:03.906443 IP 151.101.117.140.443 > 10.0.2.15.53108: Flags [P.], seq 310507:317482, ack 821, win 65535, length 6975
20:03:03.906451 IP 10.0.2.15.53108 > 151.101.117.140.443: Flags [.], ack 317482, win 65535, length 0
20:03:03.906587 IP 151.101.117.140.443 > 10.0.2.15.53108: Flags [P.], seq 317482:324352, ack 821, win 65535, length 6870
20:03:03.906594 IP 10.0.2.15.53108 > 151.101.117.140.443: Flags [.], ack 324352, win 65535, length 0
20:03:03.907045 IP 151.101.117.140.443 > 10.0.2.15.53108: Flags [P.], seq 324352:326945, ack 821, win 65535, length 2593
20:03:03.907047 IP 151.101.117.140.443 > 10.0.2.15.53108: Flags [P.], seq 326945:328319, ack 821, win 65535, length 1374
20:03:03.907048 IP 151.101.117.140.443 > 10.0.2.15.53108: Flags [P.], seq 328319:331248, ack 821, win 65535, length 2929
20:03:03.907067 IP 10.0.2.15.53108 > 151.101.117.140.443: Flags [.], ack 326945, win 65535, length 0
20:03:03.907089 IP 10.0.2.15.53108 > 151.101.117.140.443: Flags [.], ack 328319, win 65535, length 0
20:03:03.907098 IP 10.0.2.15.53108 > 151.101.117.140.443: Flags [.], ack 331248, win 65535, length 0
20:03:03.907235 IP 151.101.117.140.443 > 10.0.2.15.53108: Flags [P.], seq 331248:335370, ack 821, win 65535, length 4122
20:03:03.907244 IP 10.0.2.15.53108 > 151.101.117.140.443: Flags [.], ack 335370, win 65535, length 0
20:03:03.909935 IP 151.101.117.140.443 > 10.0.2.15.53108: Flags [P.], seq 335370:339492, ack 821, win 65535, length 4122
20:03:03.909938 IP 151.101.117.140.443 > 10.0.2.15.53108: Flags [P.], seq 339492:347505, ack 821, win 65535, length 8013
20:03:03.911221 IP 10.0.2.15.53108 > 151.101.117.140.443: Flags [.], ack 339492, win 65535, length 0
20:03:03.911333 IP 10.0.2.15.53108 > 151.101.117.140.443: Flags [.], ack 347505, win 65535, length 0
20:03:03.911434 IP 151.101.117.140.443 > 10.0.2.15.53108: Flags [.], seq 347505:359185, ack 821, win 65535, length 11680
20:03:03.911443 IP 10.0.2.15.53108 > 151.101.117.140.443: Flags [.], ack 359185, win 65535, length 0
20:03:03.911905 IP 151.101.117.140.443 > 10.0.2.15.53108: Flags [P.], seq 359185:359812, ack 821, win 65535, length 627
20:03:03.911916 IP 10.0.2.15.53108 > 151.101.117.140.443: Flags [.], ack 359812, win 65535, length 0
20:03:03.918612 IP 151.101.117.140.443 > 10.0.2.15.53108: Flags [P.], seq 359812:365308, ack 821, win 65535, length 5496
20:03:03.918618 IP 151.101.117.140.443 > 10.0.2.15.53108: Flags [P.], seq 365308:377623, ack 821, win 65535, length 12315
20:03:03.918712 IP 10.0.2.15.53108 > 151.101.117.140.443: Flags [.], ack 365308, win 65535, length 0
20:03:03.918766 IP 10.0.2.15.53108 > 151.101.117.140.443: Flags [.], ack 377623, win 65535, length 0
20:03:03.918807 IP 151.101.117.140.443 > 10.0.2.15.53108: Flags [P.], seq 377623:389989, ack 821, win 65535, length 12366
20:03:03.918813 IP 10.0.2.15.53108 > 151.101.117.140.443: Flags [.], ack 389989, win 65535, length 0
20:03:03.918838 IP 151.101.117.140.443 > 10.0.2.15.53108: Flags [P.], seq 389989:392648, ack 821, win 65535, length 2659
20:03:03.918839 IP 151.101.117.140.443 > 10.0.2.15.53108: Flags [P.], seq 392648:395396, ack 821, win 65535, length 2748
20:03:03.918846 IP 10.0.2.15.53108 > 151.101.117.140.443: Flags [.], ack 392648, win 65535, length 0
20:03:03.918860 IP 10.0.2.15.53108 > 151.101.117.140.443: Flags [.], ack 395396, win 65535, length 0
20:03:03.919164 IP 151.101.117.140.443 > 10.0.2.15.53108: Flags [P.], seq 395396:400892, ack 821, win 65535, length 5496
20:03:03.919176 IP 10.0.2.15.53108 > 151.101.117.140.443: Flags [.], ack 400892, win 65535, length 0
20:03:03.920416 IP 151.101.117.140.443 > 10.0.2.15.53108: Flags [P.], seq 400892:402266, ack 821, win 65535, length 1374
20:03:03.920437 IP 10.0.2.15.53108 > 151.101.117.140.443: Flags [.], ack 402266, win 65535, length 0
20:03:03.922722 IP 151.101.117.140.443 > 10.0.2.15.53108: Flags [P.], seq 402266:424155, ack 821, win 65535, length 21889
20:03:03.922745 IP 10.0.2.15.53108 > 151.101.117.140.443: Flags [.], ack 424155, win 65535, length 0
20:03:03.923026 IP 151.101.117.140.443 > 10.0.2.15.53108: Flags [P.], seq 424155:425470, ack 821, win 65535, length 1315
20:03:03.923043 IP 10.0.2.15.53108 > 151.101.117.140.443: Flags [.], ack 425470, win 65535, length 0
20:03:03.930635 IP 151.101.117.140.443 > 10.0.2.15.53108: Flags [P.], seq 425470:433617, ack 821, win 65535, length 8147
20:03:03.930638 IP 151.101.117.140.443 > 10.0.2.15.53108: Flags [P.], seq 433617:436365, ack 821, win 65535, length 2748
20:03:03.930664 IP 10.0.2.15.53108 > 151.101.117.140.443: Flags [.], ack 433617, win 65535, length 0
20:03:03.930750 IP 10.0.2.15.53108 > 151.101.117.140.443: Flags [.], ack 436365, win 65535, length 0
20:03:03.930769 IP 151.101.117.140.443 > 10.0.2.15.53108: Flags [P.], seq 436365:437739, ack 821, win 65535, length 1374
20:03:03.930771 IP 151.101.117.140.443 > 10.0.2.15.53108: Flags [P.], seq 437739:447404, ack 821, win 65535, length 9665
20:03:03.930779 IP 10.0.2.15.53108 > 151.101.117.140.443: Flags [.], ack 437739, win 65535, length 0
20:03:03.930791 IP 10.0.2.15.53108 > 151.101.117.140.443: Flags [.], ack 447404, win 65535, length 0
20:03:03.934806 IP 151.101.117.140.443 > 10.0.2.15.53108: Flags [.], seq 447404:457624, ack 821, win 65535, length 10220
20:03:03.934835 IP 10.0.2.15.53108 > 151.101.117.140.443: Flags [.], ack 457624, win 65535, length 0
20:03:03.935340 IP 151.101.117.140.443 > 10.0.2.15.53108: Flags [P.], seq 457624:458611, ack 821, win 65535, length 987
20:03:03.935343 IP 151.101.117.140.443 > 10.0.2.15.53108: Flags [P.], seq 458611:465481, ack 821, win 65535, length 6870
20:03:03.935344 IP 151.101.117.140.443 > 10.0.2.15.53108: Flags [P.], seq 465481:470977, ack 821, win 65535, length 5496
20:03:03.935365 IP 10.0.2.15.53108 > 151.101.117.140.443: Flags [.], ack 458611, win 65535, length 0
20:03:03.936250 IP 10.0.2.15.53108 > 151.101.117.140.443: Flags [.], ack 465481, win 65535, length 0
20:03:03.936269 IP 10.0.2.15.53108 > 151.101.117.140.443: Flags [.], ack 470977, win 65535, length 0
20:03:03.936315 IP 151.101.117.140.443 > 10.0.2.15.53108: Flags [P.], seq 470977:491245, ack 821, win 65535, length 20268
20:03:03.936321 IP 10.0.2.15.53108 > 151.101.117.140.443: Flags [.], ack 491245, win 65535, length 0
20:03:03.941754 IP 151.101.117.140.443 > 10.0.2.15.53108: Flags [.], seq 491245:495625, ack 821, win 65535, length 4380
20:03:03.942033 IP 10.0.2.15.53108 > 151.101.117.140.443: Flags [.], ack 495625, win 65535, length 0
20:03:03.942712 IP 151.101.117.140.443 > 10.0.2.15.53108: Flags [P.], seq 495625:499489, ack 821, win 65535, length 3864
20:03:03.942716 IP 151.101.117.140.443 > 10.0.2.15.53108: Flags [P.], seq 499489:503611, ack 821, win 65535, length 4122
20:03:03.942718 IP 151.101.117.140.443 > 10.0.2.15.53108: Flags [P.], seq 503611:514932, ack 821, win 65535, length 11321
20:03:03.942745 IP 10.0.2.15.53108 > 151.101.117.140.443: Flags [.], ack 499489, win 65535, length 0
20:03:03.942775 IP 10.0.2.15.53108 > 151.101.117.140.443: Flags [.], ack 503611, win 65535, length 0
20:03:03.942788 IP 10.0.2.15.53108 > 151.101.117.140.443: Flags [.], ack 514932, win 65535, length 0
20:03:03.942830 IP 151.101.117.140.443 > 10.0.2.15.53108: Flags [P.], seq 514932:519054, ack 821, win 65535, length 4122
20:03:03.942832 IP 151.101.117.140.443 > 10.0.2.15.53108: Flags [P.], seq 519054:524495, ack 821, win 65535, length 5441
20:03:03.942839 IP 10.0.2.15.53108 > 151.101.117.140.443: Flags [.], ack 519054, win 65535, length 0
20:03:03.942853 IP 10.0.2.15.53108 > 151.101.117.140.443: Flags [.], ack 524495, win 65535, length 0
20:03:03.944844 IP 151.101.117.140.443 > 10.0.2.15.53108: Flags [P.], seq 524495:534113, ack 821, win 65535, length 9618
20:03:03.944847 IP 151.101.117.140.443 > 10.0.2.15.53108: Flags [P.], seq 534113:543306, ack 821, win 65535, length 9193
20:03:03.944871 IP 10.0.2.15.53108 > 151.101.117.140.443: Flags [.], ack 534113, win 65535, length 0
20:03:03.944939 IP 10.0.2.15.53108 > 151.101.117.140.443: Flags [.], ack 543306, win 65535, length 0
20:03:03.945112 IP 151.101.117.140.443 > 10.0.2.15.53108: Flags [P.], seq 543306:548802, ack 821, win 65535, length 5496
20:03:03.945114 IP 151.101.117.140.443 > 10.0.2.15.53108: Flags [P.], seq 548802:550176, ack 821, win 65535, length 1374
20:03:03.945115 IP 151.101.117.140.443 > 10.0.2.15.53108: Flags [P.], seq 550176:552924, ack 821, win 65535, length 2748
20:03:03.945130 IP 10.0.2.15.53108 > 151.101.117.140.443: Flags [.], ack 548802, win 65535, length 0
20:03:03.945304 IP 10.0.2.15.53108 > 151.101.117.140.443: Flags [.], ack 552924, win 65535, length 0
20:03:03.945420 IP 151.101.117.140.443 > 10.0.2.15.53108: Flags [P.], seq 552924:556987, ack 821, win 65535, length 4063
20:03:03.945447 IP 10.0.2.15.53108 > 151.101.117.140.443: Flags [.], ack 556987, win 65535, length 0
20:03:03.954494 IP 151.101.117.140.443 > 10.0.2.15.53108: Flags [P.], seq 556987:565622, ack 821, win 65535, length 8635
20:03:03.954497 IP 151.101.117.140.443 > 10.0.2.15.53108: Flags [P.], seq 565622:573425, ack 821, win 65535, length 7803
20:03:03.954519 IP 10.0.2.15.53108 > 151.101.117.140.443: Flags [.], ack 565622, win 65535, length 0
20:03:03.954610 IP 151.101.117.140.443 > 10.0.2.15.53108: Flags [P.], seq 573425:578921, ack 821, win 65535, length 5496
20:03:03.954611 IP 151.101.117.140.443 > 10.0.2.15.53108: Flags [P.], seq 578921:580295, ack 821, win 65535, length 1374
20:03:03.954612 IP 151.101.117.140.443 > 10.0.2.15.53108: Flags [.], seq 580295:586135, ack 821, win 65535, length 5840
20:03:03.954625 IP 151.101.117.140.443 > 10.0.2.15.53108: Flags [P.], seq 586135:586138, ack 821, win 65535, length 3
20:03:03.954626 IP 151.101.117.140.443 > 10.0.2.15.53108: Flags [P.], seq 586138:589862, ack 821, win 65535, length 3724
20:03:03.954707 IP 10.0.2.15.53108 > 151.101.117.140.443: Flags [.], ack 589862, win 65535, length 0
20:03:03.954817 IP 151.101.117.140.443 > 10.0.2.15.53108: Flags [P.], seq 589862:593984, ack 821, win 65535, length 4122
20:03:03.954905 IP 10.0.2.15.53108 > 151.101.117.140.443: Flags [.], ack 593984, win 65535, length 0
20:03:03.955988 IP 151.101.117.140.443 > 10.0.2.15.53108: Flags [P.], seq 593984:599480, ack 821, win 65535, length 5496
20:03:03.956005 IP 10.0.2.15.53108 > 151.101.117.140.443: Flags [.], ack 599480, win 65535, length 0
20:03:03.957245 IP 151.101.117.140.443 > 10.0.2.15.53108: Flags [P.], seq 599480:607673, ack 821, win 65535, length 8193
20:03:03.957247 IP 151.101.117.140.443 > 10.0.2.15.53108: Flags [P.], seq 607673:610421, ack 821, win 65535, length 2748
20:03:03.957288 IP 151.101.117.140.443 > 10.0.2.15.53108: Flags [P.], seq 610421:613169, ack 821, win 65535, length 2748
20:03:03.957290 IP 151.101.117.140.443 > 10.0.2.15.53108: Flags [P.], seq 613169:620039, ack 821, win 65535, length 6870
20:03:03.957448 IP 10.0.2.15.53108 > 151.101.117.140.443: Flags [.], ack 620039, win 65535, length 0
20:03:03.961035 IP 151.101.117.140.443 > 10.0.2.15.53108: Flags [P.], seq 620039:622736, ack 821, win 65535, length 2697
20:03:03.961054 IP 10.0.2.15.53108 > 151.101.117.140.443: Flags [.], ack 622736, win 65535, length 0
20:03:03.964773 IP 151.101.117.140.443 > 10.0.2.15.53108: Flags [P.], seq 622736:628232, ack 821, win 65535, length 5496
20:03:03.964777 IP 151.101.117.140.443 > 10.0.2.15.53108: Flags [P.], seq 628232:633728, ack 821, win 65535, length 5496
20:03:03.964835 IP 151.101.117.140.443 > 10.0.2.15.53108: Flags [P.], seq 633728:637850, ack 821, win 65535, length 4122
20:03:03.965212 IP 10.0.2.15.53108 > 151.101.117.140.443: Flags [.], ack 637850, win 65535, length 0
20:03:03.966421 IP 151.101.117.140.443 > 10.0.2.15.53108: Flags [P.], seq 637850:644669, ack 821, win 65535, length 6819
20:03:03.966424 IP 151.101.117.140.443 > 10.0.2.15.53108: Flags [P.], seq 644669:651539, ack 821, win 65535, length 6870
20:03:03.966446 IP 10.0.2.15.53108 > 151.101.117.140.443: Flags [.], ack 644669, win 65535, length 0
20:03:03.966641 IP 10.0.2.15.53108 > 151.101.117.140.443: Flags [.], ack 651539, win 65535, length 0
20:03:03.967063 IP 151.101.117.140.443 > 10.0.2.15.53108: Flags [P.], seq 651539:656976, ack 821, win 65535, length 5437
20:03:03.967066 IP 151.101.117.140.443 > 10.0.2.15.53108: Flags [P.], seq 656976:658350, ack 821, win 65535, length 1374
20:03:03.967067 IP 151.101.117.140.443 > 10.0.2.15.53108: Flags [P.], seq 658350:662472, ack 821, win 65535, length 4122
20:03:03.967092 IP 151.101.117.140.443 > 10.0.2.15.53108: Flags [P.], seq 662472:666594, ack 821, win 65535, length 4122
20:03:03.967233 IP 151.101.117.140.443 > 10.0.2.15.53108: Flags [P.], seq 666594:669342, ack 821, win 65535, length 2748
20:03:03.967333 IP 10.0.2.15.53108 > 151.101.117.140.443: Flags [.], ack 669342, win 65535, length 0
20:03:03.968785 IP 151.101.117.140.443 > 10.0.2.15.53108: Flags [P.], seq 669342:677527, ack 821, win 65535, length 8185
20:03:03.968811 IP 10.0.2.15.53108 > 151.101.117.140.443: Flags [.], ack 677527, win 65535, length 0
20:03:03.969370 IP 151.101.117.140.443 > 10.0.2.15.53108: Flags [P.], seq 677527:683023, ack 821, win 65535, length 5496
20:03:03.969372 IP 151.101.117.140.443 > 10.0.2.15.53108: Flags [P.], seq 683023:685771, ack 821, win 65535, length 2748
20:03:03.969374 IP 151.101.117.140.443 > 10.0.2.15.53108: Flags [P.], seq 685771:691216, ack 821, win 65535, length 5445
20:03:03.969472 IP 151.101.117.140.443 > 10.0.2.15.53108: Flags [P.], seq 691216:696712, ack 821, win 65535, length 5496

