20:00:29.401891 IP 10.0.2.15.47409 > 140.233.253.2.53: 62423+ A? www.reddit.com. (32)
20:00:29.401934 IP 10.0.2.15.47409 > 140.233.253.2.53: 28629+ AAAA? www.reddit.com. (32)
20:00:29.407594 IP 140.233.253.2.53 > 10.0.2.15.47409: 62423 2/0/0 CNAME reddit.map.fastly.net., A 151.101.117.140 (83)
20:00:29.421613 IP 140.233.253.2.53 > 10.0.2.15.47409: 28629 1/1/0 CNAME reddit.map.fastly.net. (125)
20:00:29.421996 IP 10.0.2.15.53064 > 151.101.117.140.443: Flags [S], seq 2136117783, win 64240, options [mss 1460,sackOK,TS val 3623518606 ecr 0,nop,wscale 6], length 0
20:00:29.436680 IP 151.101.117.140.443 > 10.0.2.15.53064: Flags [S.], seq 215424001, ack 2136117784, win 65535, options [mss 1460], length 0
20:00:29.436725 IP 10.0.2.15.53064 > 151.101.117.140.443: Flags [.], ack 1, win 64240, length 0
20:00:29.448075 IP 10.0.2.15.53064 > 151.101.117.140.443: Flags [P.], seq 1:518, ack 1, win 64240, length 517
20:00:29.448425 IP 151.101.117.140.443 > 10.0.2.15.53064: Flags [.], ack 518, win 65535, length 0
20:00:29.465587 IP 151.101.117.140.443 > 10.0.2.15.53064: Flags [P.], seq 1:2749, ack 518, win 65535, length 2748
20:00:29.465605 IP 10.0.2.15.53064 > 151.101.117.140.443: Flags [.], ack 2749, win 62780, length 0
20:00:29.467845 IP 151.101.117.140.443 > 10.0.2.15.53064: Flags [P.], seq 2749:3722, ack 518, win 65535, length 973
20:00:29.467863 IP 10.0.2.15.53064 > 151.101.117.140.443: Flags [.], ack 3722, win 62780, length 0
20:00:29.468618 IP 10.0.2.15.53064 > 151.101.117.140.443: Flags [P.], seq 518:598, ack 3722, win 62780, length 80
20:00:29.468779 IP 10.0.2.15.53064 > 151.101.117.140.443: Flags [P.], seq 598:693, ack 3722, win 62780, length 95
20:00:29.469154 IP 10.0.2.15.53064 > 151.101.117.140.443: Flags [P.], seq 693:790, ack 3722, win 62780, length 97
20:00:29.469310 IP 151.101.117.140.443 > 10.0.2.15.53064: Flags [.], ack 598, win 65535, length 0
20:00:29.469311 IP 151.101.117.140.443 > 10.0.2.15.53064: Flags [.], ack 693, win 65535, length 0
20:00:29.469664 IP 151.101.117.140.443 > 10.0.2.15.53064: Flags [.], ack 790, win 65535, length 0
20:00:29.482448 IP 151.101.117.140.443 > 10.0.2.15.53064: Flags [P.], seq 3722:3781, ack 790, win 65535, length 59
20:00:29.482468 IP 10.0.2.15.53064 > 151.101.117.140.443: Flags [.], ack 3781, win 62780, length 0
20:00:29.482713 IP 10.0.2.15.53064 > 151.101.117.140.443: Flags [P.], seq 790:821, ack 3781, win 62780, length 31
20:00:29.482965 IP 151.101.117.140.443 > 10.0.2.15.53064: Flags [.], ack 821, win 65535, length 0
20:00:29.810168 IP 151.101.117.140.443 > 10.0.2.15.53064: Flags [P.], seq 3781:6529, ack 821, win 65535, length 2748
20:00:29.810266 IP 10.0.2.15.53064 > 151.101.117.140.443: Flags [.], ack 6529, win 62780, length 0
20:00:29.811595 IP 151.101.117.140.443 > 10.0.2.15.53064: Flags [.], seq 6529:15289, ack 821, win 65535, length 8760
20:00:29.811623 IP 10.0.2.15.53064 > 151.101.117.140.443: Flags [.], ack 15289, win 56940, length 0
20:00:29.811910 IP 151.101.117.140.443 > 10.0.2.15.53064: Flags [P.], seq 15289:23296, ack 821, win 65535, length 8007
20:00:29.811932 IP 10.0.2.15.53064 > 151.101.117.140.443: Flags [.], ack 23296, win 51100, length 0
20:00:29.812169 IP 151.101.117.140.443 > 10.0.2.15.53064: Flags [P.], seq 23296:27418, ack 821, win 65535, length 4122
20:00:29.812196 IP 10.0.2.15.53064 > 151.101.117.140.443: Flags [.], ack 27418, win 46978, length 0
20:00:29.813049 IP 151.101.117.140.443 > 10.0.2.15.53064: Flags [P.], seq 27418:31540, ack 821, win 65535, length 4122
20:00:29.813114 IP 10.0.2.15.53064 > 151.101.117.140.443: Flags [.], ack 31540, win 61320, length 0
20:00:29.814563 IP 151.101.117.140.443 > 10.0.2.15.53064: Flags [P.], seq 31540:34288, ack 821, win 65535, length 2748
20:00:29.814585 IP 10.0.2.15.53064 > 151.101.117.140.443: Flags [.], ack 34288, win 62780, length 0
20:00:29.816670 IP 151.101.117.140.443 > 10.0.2.15.53064: Flags [P.], seq 34288:42532, ack 821, win 65535, length 8244
20:00:29.816692 IP 10.0.2.15.53064 > 151.101.117.140.443: Flags [.], ack 42532, win 58400, length 0
20:00:29.817458 IP 151.101.117.140.443 > 10.0.2.15.53064: Flags [P.], seq 42532:43906, ack 821, win 65535, length 1374
20:00:29.817472 IP 10.0.2.15.53064 > 151.101.117.140.443: Flags [.], ack 43906, win 62780, length 0
20:00:29.824430 IP 151.101.117.140.443 > 10.0.2.15.53064: Flags [P.], seq 43906:45280, ack 821, win 65535, length 1374
20:00:29.824449 IP 10.0.2.15.53064 > 151.101.117.140.443: Flags [.], ack 45280, win 62780, length 0
20:00:29.825590 IP 151.101.117.140.443 > 10.0.2.15.53064: Flags [P.], seq 45280:52150, ack 821, win 65535, length 6870
20:00:29.825592 IP 151.101.117.140.443 > 10.0.2.15.53064: Flags [P.], seq 52150:56272, ack 821, win 65535, length 4122
20:00:29.825614 IP 10.0.2.15.53064 > 151.101.117.140.443: Flags [.], ack 52150, win 59860, length 0
20:00:29.825658 IP 10.0.2.15.53064 > 151.101.117.140.443: Flags [.], ack 56272, win 56940, length 0
20:00:29.825679 IP 151.101.117.140.443 > 10.0.2.15.53064: Flags [P.], seq 56272:57646, ack 821, win 65535, length 1374
20:00:29.825725 IP 10.0.2.15.53064 > 151.101.117.140.443: Flags [.], ack 57646, win 55566, length 0
20:00:29.825933 IP 151.101.117.140.443 > 10.0.2.15.53064: Flags [P.], seq 57646:60394, ack 821, win 65535, length 2748
20:00:29.825940 IP 10.0.2.15.53064 > 151.101.117.140.443: Flags [.], ack 60394, win 54020, length 0
20:00:29.827556 IP 151.101.117.140.443 > 10.0.2.15.53064: Flags [P.], seq 60394:64516, ack 821, win 65535, length 4122
20:00:29.827577 IP 10.0.2.15.53064 > 151.101.117.140.443: Flags [.], ack 64516, win 61320, length 0
20:00:29.827839 IP 151.101.117.140.443 > 10.0.2.15.53064: Flags [P.], seq 64516:68638, ack 821, win 65535, length 4122
20:00:29.827841 IP 151.101.117.140.443 > 10.0.2.15.53064: Flags [P.], seq 68638:71386, ack 821, win 65535, length 2748
20:00:29.827909 IP 10.0.2.15.53064 > 151.101.117.140.443: Flags [.], ack 68638, win 58400, length 0
20:00:29.827928 IP 10.0.2.15.53064 > 151.101.117.140.443: Flags [.], ack 71386, win 56940, length 0
20:00:29.828006 IP 151.101.117.140.443 > 10.0.2.15.53064: Flags [P.], seq 71386:74134, ack 821, win 65535, length 2748
20:00:29.828006 IP 151.101.117.140.443 > 10.0.2.15.53064: Flags [P.], seq 74134:75508, ack 821, win 65535, length 1374
20:00:29.828089 IP 10.0.2.15.53064 > 151.101.117.140.443: Flags [.], ack 75508, win 62780, length 0
20:00:29.830341 IP 151.101.117.140.443 > 10.0.2.15.53064: Flags [P.], seq 75508:82378, ack 821, win 65535, length 6870
20:00:29.830344 IP 151.101.117.140.443 > 10.0.2.15.53064: Flags [P.], seq 82378:86500, ack 821, win 65535, length 4122
20:00:29.830371 IP 10.0.2.15.53064 > 151.101.117.140.443: Flags [.], ack 82378, win 65535, length 0
20:00:29.830414 IP 10.0.2.15.53064 > 151.101.117.140.443: Flags [.], ack 86500, win 65535, length 0
20:00:29.830453 IP 151.101.117.140.443 > 10.0.2.15.53064: Flags [P.], seq 86500:91996, ack 821, win 65535, length 5496
20:00:29.830454 IP 151.101.117.140.443 > 10.0.2.15.53064: Flags [P.], seq 91996:93370, ack 821, win 65535, length 1374
20:00:29.830462 IP 10.0.2.15.53064 > 151.101.117.140.443: Flags [.], ack 91996, win 65535, length 0
20:00:29.830479 IP 10.0.2.15.53064 > 151.101.117.140.443: Flags [.], ack 93370, win 65535, length 0
20:00:29.831239 IP 151.101.117.140.443 > 10.0.2.15.53064: Flags [P.], seq 93370:95303, ack 821, win 65535, length 1933
20:00:29.831261 IP 10.0.2.15.53064 > 151.101.117.140.443: Flags [.], ack 95303, win 65535, length 0
20:00:29.832362 IP 151.101.117.140.443 > 10.0.2.15.53064: Flags [P.], seq 95303:103547, ack 821, win 65535, length 8244
20:00:29.832435 IP 10.0.2.15.53064 > 151.101.117.140.443: Flags [.], ack 103547, win 65535, length 0
20:00:29.832699 IP 151.101.117.140.443 > 10.0.2.15.53064: Flags [P.], seq 103547:107669, ack 821, win 65535, length 4122
20:00:29.832701 IP 151.101.117.140.443 > 10.0.2.15.53064: Flags [P.], seq 107669:109043, ack 821, win 65535, length 1374
20:00:29.832735 IP 10.0.2.15.53064 > 151.101.117.140.443: Flags [.], ack 109043, win 65535, length 0
20:00:29.834374 IP 151.101.117.140.443 > 10.0.2.15.53064: Flags [P.], seq 109043:117287, ack 821, win 65535, length 8244
20:00:29.834526 IP 10.0.2.15.53064 > 151.101.117.140.443: Flags [.], ack 117287, win 65535, length 0
20:00:29.834660 IP 151.101.117.140.443 > 10.0.2.15.53064: Flags [P.], seq 117287:120035, ack 821, win 65535, length 2748
20:00:29.834661 IP 151.101.117.140.443 > 10.0.2.15.53064: Flags [P.], seq 120035:122783, ack 821, win 65535, length 2748
20:00:29.834675 IP 10.0.2.15.53064 > 151.101.117.140.443: Flags [.], ack 120035, win 65535, length 0
20:00:29.834692 IP 10.0.2.15.53064 > 151.101.117.140.443: Flags [.], ack 122783, win 65535, length 0
20:00:29.835374 IP 151.101.117.140.443 > 10.0.2.15.53064: Flags [P.], seq 122783:124157, ack 821, win 65535, length 1374
20:00:29.835386 IP 10.0.2.15.53064 > 151.101.117.140.443: Flags [.], ack 124157, win 65535, length 0
20:00:29.837681 IP 151.101.117.140.443 > 10.0.2.15.53064: Flags [P.], seq 124157:128279, ack 821, win 65535, length 4122
20:00:29.837702 IP 10.0.2.15.53064 > 151.101.117.140.443: Flags [.], ack 128279, win 65535, length 0
20:00:29.838693 IP 151.101.117.140.443 > 10.0.2.15.53064: Flags [P.], seq 128279:135149, ack 821, win 65535, length 6870
20:00:29.838711 IP 10.0.2.15.53064 > 151.101.117.140.443: Flags [.], ack 135149, win 65535, length 0
20:00:29.838839 IP 151.101.117.140.443 > 10.0.2.15.53064: Flags [P.], seq 135149:136523, ack 821, win 65535, length 1374
20:00:29.838846 IP 10.0.2.15.53064 > 151.101.117.140.443: Flags [.], ack 136523, win 65535, length 0
20:00:29.839625 IP 151.101.117.140.443 > 10.0.2.15.53064: Flags [P.], seq 136523:139271, ack 821, win 65535, length 2748
20:00:29.839640 IP 10.0.2.15.53064 > 151.101.117.140.443: Flags [.], ack 139271, win 65535, length 0
20:00:29.844768 IP 151.101.117.140.443 > 10.0.2.15.53064: Flags [.], seq 139271:149491, ack 821, win 65535, length 10220
20:00:29.844873 IP 10.0.2.15.53064 > 151.101.117.140.443: Flags [.], ack 149491, win 65535, length 0
20:00:29.845098 IP 151.101.117.140.443 > 10.0.2.15.53064: Flags [P.], seq 149491:150263, ack 821, win 65535, length 772
20:00:29.845100 IP 151.101.117.140.443 > 10.0.2.15.53064: Flags [P.], seq 150263:155759, ack 821, win 65535, length 5496
20:00:29.845114 IP 10.0.2.15.53064 > 151.101.117.140.443: Flags [.], ack 150263, win 65535, length 0
20:00:29.845139 IP 10.0.2.15.53064 > 151.101.117.140.443: Flags [.], ack 155759, win 65535, length 0
20:00:29.845409 IP 151.101.117.140.443 > 10.0.2.15.53064: Flags [P.], seq 155759:158507, ack 821, win 65535, length 2748
20:00:29.845419 IP 10.0.2.15.53064 > 151.101.117.140.443: Flags [.], ack 158507, win 65535, length 0
20:00:29.845670 IP 151.101.117.140.443 > 10.0.2.15.53064: Flags [P.], seq 158507:165045, ack 821, win 65535, length 6538
20:00:29.846018 IP 151.101.117.140.443 > 10.0.2.15.53064: Flags [P.], seq 165045:167793, ack 821, win 65535, length 2748
20:00:29.846021 IP 151.101.117.140.443 > 10.0.2.15.53064: Flags [P.], seq 167793:171915, ack 821, win 65535, length 4122
20:00:29.846063 IP 10.0.2.15.53064 > 151.101.117.140.443: Flags [.], ack 171915, win 65535, length 0
20:00:29.846385 IP 151.101.117.140.443 > 10.0.2.15.53064: Flags [P.], seq 171915:177411, ack 821, win 65535, length 5496
20:00:29.846387 IP 151.101.117.140.443 > 10.0.2.15.53064: Flags [P.], seq 177411:178785, ack 821, win 65535, length 1374
20:00:29.846401 IP 10.0.2.15.53064 > 151.101.117.140.443: Flags [.], ack 177411, win 65535, length 0
20:00:29.846424 IP 10.0.2.15.53064 > 151.101.117.140.443: Flags [.], ack 178785, win 65535, length 0
20:00:29.847122 IP 151.101.117.140.443 > 10.0.2.15.53064: Flags [P.], seq 178785:181533, ack 821, win 65535, length 2748
20:00:29.847126 IP 151.101.117.140.443 > 10.0.2.15.53064: Flags [P.], seq 181533:184281, ack 821, win 65535, length 2748
20:00:29.847127 IP 151.101.117.140.443 > 10.0.2.15.53064: Flags [P.], seq 184281:185655, ack 821, win 65535, length 1374
20:00:29.847127 IP 151.101.117.140.443 > 10.0.2.15.53064: Flags [P.], seq 185655:187029, ack 821, win 65535, length 1374
20:00:29.847150 IP 10.0.2.15.53064 > 151.101.117.140.443: Flags [.], ack 181533, win 65535, length 0
20:00:29.847179 IP 10.0.2.15.53064 > 151.101.117.140.443: Flags [.], ack 184281, win 65535, length 0
20:00:29.847196 IP 10.0.2.15.53064 > 151.101.117.140.443: Flags [.], ack 185655, win 65535, length 0
20:00:29.847210 IP 10.0.2.15.53064 > 151.101.117.140.443: Flags [.], ack 187029, win 65535, length 0
20:00:29.847970 IP 151.101.117.140.443 > 10.0.2.15.53064: Flags [P.], seq 187029:191151, ack 821, win 65535, length 4122
20:00:29.847972 IP 151.101.117.140.443 > 10.0.2.15.53064: Flags [P.], seq 191151:193899, ack 821, win 65535, length 2748
20:00:29.847974 IP 151.101.117.140.443 > 10.0.2.15.53064: Flags [P.], seq 193899:195273, ack 821, win 65535, length 1374
20:00:29.848089 IP 10.0.2.15.53064 > 151.101.117.140.443: Flags [.], ack 191151, win 65535, length 0
20:00:29.848161 IP 10.0.2.15.53064 > 151.101.117.140.443: Flags [.], ack 193899, win 65535, length 0
20:00:29.848175 IP 10.0.2.15.53064 > 151.101.117.140.443: Flags [.], ack 195273, win 65535, length 0
20:00:29.848781 IP 151.101.117.140.443 > 10.0.2.15.53064: Flags [P.], seq 195273:197704, ack 821, win 65535, length 2431
20:00:29.848794 IP 10.0.2.15.53064 > 151.101.117.140.443: Flags [.], ack 197704, win 65535, length 0
20:00:30.719034 IP 151.101.117.140.443 > 10.0.2.15.53064: Flags [P.], seq 197704:199175, ack 821, win 65535, length 1471
20:00:30.719055 IP 10.0.2.15.53064 > 151.101.117.140.443: Flags [.], ack 199175, win 65535, length 0
20:00:30.791993 IP 151.101.117.140.443 > 10.0.2.15.53064: Flags [P.], seq 199175:200549, ack 821, win 65535, length 1374
20:00:30.792016 IP 10.0.2.15.53064 > 151.101.117.140.443: Flags [.], ack 200549, win 65535, length 0
20:00:30.792848 IP 151.101.117.140.443 > 10.0.2.15.53064: Flags [P.], seq 200549:207391, ack 821, win 65535, length 6842
20:00:30.792871 IP 10.0.2.15.53064 > 151.101.117.140.443: Flags [.], ack 207391, win 65535, length 0
20:00:30.793090 IP 151.101.117.140.443 > 10.0.2.15.53064: Flags [P.], seq 207391:211513, ack 821, win 65535, length 4122
20:00:30.793099 IP 10.0.2.15.53064 > 151.101.117.140.443: Flags [.], ack 211513, win 65535, length 0
20:00:30.793337 IP 151.101.117.140.443 > 10.0.2.15.53064: Flags [P.], seq 211513:215635, ack 821, win 65535, length 4122
20:00:30.793339 IP 151.101.117.140.443 > 10.0.2.15.53064: Flags [P.], seq 215635:217009, ack 821, win 65535, length 1374
20:00:30.793356 IP 10.0.2.15.53064 > 151.101.117.140.443: Flags [.], ack 215635, win 65535, length 0
20:00:30.793566 IP 10.0.2.15.53064 > 151.101.117.140.443: Flags [.], ack 217009, win 65535, length 0
20:00:30.793933 IP 151.101.117.140.443 > 10.0.2.15.53064: Flags [P.], seq 217009:219757, ack 821, win 65535, length 2748
20:00:30.793935 IP 151.101.117.140.443 > 10.0.2.15.53064: Flags [P.], seq 219757:223879, ack 821, win 65535, length 4122
20:00:30.793936 IP 151.101.117.140.443 > 10.0.2.15.53064: Flags [P.], seq 223879:225253, ack 821, win 65535, length 1374
20:00:30.793937 IP 151.101.117.140.443 > 10.0.2.15.53064: Flags [P.], seq 225253:226627, ack 821, win 65535, length 1374
20:00:30.793954 IP 10.0.2.15.53064 > 151.101.117.140.443: Flags [.], ack 219757, win 65535, length 0
20:00:30.794032 IP 10.0.2.15.53064 > 151.101.117.140.443: Flags [.], ack 223879, win 65535, length 0
20:00:30.794048 IP 10.0.2.15.53064 > 151.101.117.140.443: Flags [.], ack 225253, win 65535, length 0
20:00:30.794057 IP 10.0.2.15.53064 > 151.101.117.140.443: Flags [.], ack 226627, win 65535, length 0
20:00:30.794378 IP 151.101.117.140.443 > 10.0.2.15.53064: Flags [P.], seq 226627:230681, ack 821, win 65535, length 4054
20:00:30.794380 IP 151.101.117.140.443 > 10.0.2.15.53064: Flags [P.], seq 230681:232055, ack 821, win 65535, length 1374
20:00:30.794380 IP 151.101.117.140.443 > 10.0.2.15.53064: Flags [P.], seq 232055:234803, ack 821, win 65535, length 2748
20:00:30.794391 IP 10.0.2.15.53064 > 151.101.117.140.443: Flags [.], ack 230681, win 65535, length 0
20:00:30.794405 IP 10.0.2.15.53064 > 151.101.117.140.443: Flags [.], ack 232055, win 65535, length 0
20:00:30.794419 IP 10.0.2.15.53064 > 151.101.117.140.443: Flags [.], ack 234803, win 65535, length 0
20:00:30.796180 IP 151.101.117.140.443 > 10.0.2.15.53064: Flags [P.], seq 234803:244374, ack 821, win 65535, length 9571
20:00:30.796203 IP 10.0.2.15.53064 > 151.101.117.140.443: Flags [.], ack 244374, win 65535, length 0
20:00:30.796868 IP 151.101.117.140.443 > 10.0.2.15.53064: Flags [P.], seq 244374:248496, ack 821, win 65535, length 4122
20:00:30.796875 IP 151.101.117.140.443 > 10.0.2.15.53064: Flags [P.], seq 248496:252618, ack 821, win 65535, length 4122
20:00:30.796901 IP 10.0.2.15.53064 > 151.101.117.140.443: Flags [.], ack 248496, win 65535, length 0
20:00:30.796935 IP 10.0.2.15.53064 > 151.101.117.140.443: Flags [.], ack 252618, win 65535, length 0
20:00:30.797072 IP 151.101.117.140.443 > 10.0.2.15.53064: Flags [P.], seq 252618:255366, ack 821, win 65535, length 2748
20:00:30.797073 IP 151.101.117.140.443 > 10.0.2.15.53064: Flags [P.], seq 255366:256683, ack 821, win 65535, length 1317
20:00:30.797080 IP 10.0.2.15.53064 > 151.101.117.140.443: Flags [.], ack 255366, win 65535, length 0
20:00:30.797090 IP 10.0.2.15.53064 > 151.101.117.140.443: Flags [.], ack 256683, win 65535, length 0
20:00:30.805869 IP 151.101.117.140.443 > 10.0.2.15.53064: Flags [P.], seq 256683:264927, ack 821, win 65535, length 8244
20:00:30.806062 IP 151.101.117.140.443 > 10.0.2.15.53064: Flags [.], seq 264927:266387, ack 821, win 65535, length 1460
20:00:30.806094 IP 10.0.2.15.53064 > 151.101.117.140.443: Flags [.], ack 264927, win 65535, length 0
20:00:30.806145 IP 10.0.2.15.53064 > 151.101.117.140.443: Flags [.], ack 266387, win 65535, length 0
20:00:30.806772 IP 151.101.117.140.443 > 10.0.2.15.53064: Flags [P.], seq 266387:271797, ack 821, win 65535, length 5410
20:00:30.806774 IP 151.101.117.140.443 > 10.0.2.15.53064: Flags [P.], seq 271797:277387, ack 821, win 65535, length 5590
20:00:30.806846 IP 10.0.2.15.53064 > 151.101.117.140.443: Flags [.], ack 271797, win 65535, length 0
20:00:30.806892 IP 10.0.2.15.53064 > 151.101.117.140.443: Flags [.], ack 277387, win 65535, length 0
20:00:30.806918 IP 151.101.117.140.443 > 10.0.2.15.53064: Flags [P.], seq 277387:284257, ack 821, win 65535, length 6870
20:00:30.806919 IP 151.101.117.140.443 > 10.0.2.15.53064: Flags [P.], seq 284257:285631, ack 821, win 65535, length 1374
20:00:30.806924 IP 10.0.2.15.53064 > 151.101.117.140.443: Flags [.], ack 284257, win 65535, length 0
20:00:30.806935 IP 10.0.2.15.53064 > 151.101.117.140.443: Flags [.], ack 285631, win 65535, length 0
20:00:30.807661 IP 151.101.117.140.443 > 10.0.2.15.53064: Flags [P.], seq 285631:289753, ack 821, win 65535, length 4122
20:00:30.807664 IP 151.101.117.140.443 > 10.0.2.15.53064: Flags [P.], seq 289753:293894, ack 821, win 65535, length 4141
20:00:30.807682 IP 10.0.2.15.53064 > 151.101.117.140.443: Flags [.], ack 289753, win 65535, length 0
20:00:30.807759 IP 10.0.2.15.53064 > 151.101.117.140.443: Flags [.], ack 293894, win 65535, length 0
20:00:30.808148 IP 151.101.117.140.443 > 10.0.2.15.53064: Flags [P.], seq 293894:298016, ack 821, win 65535, length 4122
20:00:30.808150 IP 151.101.117.140.443 > 10.0.2.15.53064: Flags [P.], seq 298016:300764, ack 821, win 65535, length 2748
20:00:30.808162 IP 10.0.2.15.53064 > 151.101.117.140.443: Flags [.], ack 298016, win 65535, length 0
20:00:30.808179 IP 10.0.2.15.53064 > 151.101.117.140.443: Flags [.], ack 300764, win 65535, length 0
20:00:30.810319 IP 151.101.117.140.443 > 10.0.2.15.53064: Flags [P.], seq 300764:309008, ack 821, win 65535, length 8244
20:00:30.810322 IP 151.101.117.140.443 > 10.0.2.15.53064: Flags [P.], seq 309008:313130, ack 821, win 65535, length 4122
20:00:30.810350 IP 10.0.2.15.53064 > 151.101.117.140.443: Flags [.], ack 309008, win 65535, length 0
20:00:30.810625 IP 10.0.2.15.53064 > 151.101.117.140.443: Flags [.], ack 313130, win 65535, length 0
20:00:30.810761 IP 151.101.117.140.443 > 10.0.2.15.53064: Flags [P.], seq 313130:318626, ack 821, win 65535, length 5496
20:00:30.810763 IP 151.101.117.140.443 > 10.0.2.15.53064: Flags [P.], seq 318626:322748, ack 821, win 65535, length 4122
20:00:30.810773 IP 10.0.2.15.53064 > 151.101.117.140.443: Flags [.], ack 318626, win 65535, length 0
20:00:30.810795 IP 10.0.2.15.53064 > 151.101.117.140.443: Flags [.], ack 322748, win 65535, length 0
20:00:30.810971 IP 151.101.117.140.443 > 10.0.2.15.53064: Flags [P.], seq 322748:326437, ack 821, win 65535, length 3689
20:00:30.810976 IP 10.0.2.15.53064 > 151.101.117.140.443: Flags [.], ack 326437, win 65535, length 0
20:00:30.816729 IP 151.101.117.140.443 > 10.0.2.15.53064: Flags [P.], seq 326437:336055, ack 821, win 65535, length 9618
20:00:30.816733 IP 151.101.117.140.443 > 10.0.2.15.53064: Flags [P.], seq 336055:338803, ack 821, win 65535, length 2748
20:00:30.816961 IP 10.0.2.15.53064 > 151.101.117.140.443: Flags [.], ack 336055, win 65535, length 0
20:00:30.817027 IP 10.0.2.15.53064 > 151.101.117.140.443: Flags [.], ack 338803, win 65535, length 0
20:00:30.817077 IP 151.101.117.140.443 > 10.0.2.15.53064: Flags [P.], seq 338803:342874, ack 821, win 65535, length 4071
20:00:30.817078 IP 151.101.117.140.443 > 10.0.2.15.53064: Flags [P.], seq 342874:344248, ack 821, win 65535, length 1374
20:00:30.817193 IP 10.0.2.15.53064 > 151.101.117.140.443: Flags [.], ack 342874, win 65535, length 0
20:00:30.817240 IP 10.0.2.15.53064 > 151.101.117.140.443: Flags [.], ack 344248, win 65535, length 0
20:00:30.819816 IP 151.101.117.140.443 > 10.0.2.15.53064: Flags [P.], seq 344248:355240, ack 821, win 65535, length 10992
20:00:30.820087 IP 10.0.2.15.53064 > 151.101.117.140.443: Flags [.], ack 355240, win 65535, length 0
20:00:30.820286 IP 151.101.117.140.443 > 10.0.2.15.53064: Flags [P.], seq 355240:360685, ack 821, win 65535, length 5445
20:00:30.820288 IP 151.101.117.140.443 > 10.0.2.15.53064: Flags [P.], seq 360685:364807, ack 821, win 65535, length 4122
20:00:30.820290 IP 151.101.117.140.443 > 10.0.2.15.53064: Flags [P.], seq 364807:371677, ack 821, win 65535, length 6870
20:00:30.820307 IP 10.0.2.15.53064 > 151.101.117.140.443: Flags [.], ack 360685, win 65535, length 0
20:00:30.820419 IP 10.0.2.15.53064 > 151.101.117.140.443: Flags [.], ack 364807, win 65535, length 0
20:00:30.820442 IP 10.0.2.15.53064 > 151.101.117.140.443: Flags [.], ack 371677, win 65535, length 0
20:00:30.820650 IP 151.101.117.140.443 > 10.0.2.15.53064: Flags [P.], seq 371677:373051, ack 821, win 65535, length 1374
20:00:30.820661 IP 10.0.2.15.53064 > 151.101.117.140.443: Flags [.], ack 373051, win 65535, length 0
20:00:30.821931 IP 151.101.117.140.443 > 10.0.2.15.53064: Flags [P.], seq 373051:379870, ack 821, win 65535, length 6819
20:00:30.822286 IP 10.0.2.15.53064 > 151.101.117.140.443: Flags [.], ack 379870, win 65535, length 0
20:00:30.822875 IP 151.101.117.140.443 > 10.0.2.15.53064: Flags [P.], seq 379870:383992, ack 821, win 65535, length 4122
20:00:30.822878 IP 151.101.117.140.443 > 10.0.2.15.53064: Flags [P.], seq 383992:389498, ack 821, win 65535, length 5506
20:00:30.822879 IP 151.101.117.140.443 > 10.0.2.15.53064: Flags [P.], seq 389498:392186, ack 821, win 65535, length 2688
20:00:30.822902 IP 10.0.2.15.53064 > 151.101.117.140.443: Flags [.], ack 383992, win 65535, length 0
20:00:30.822920 IP 10.0.2.15.53064 > 151.101.117.140.443: Flags [.], ack 389498, win 65535, length 0
20:00:30.822930 IP 10.0.2.15.53064 > 151.101.117.140.443: Flags [.], ack 392186, win 65535, length 0
20:00:30.831221 IP 151.101.117.140.443 > 10.0.2.15.53064: Flags [P.], seq 392186:403178, ack 821, win 65535, length 10992
20:00:30.831252 IP 10.0.2.15.53064 > 151.101.117.140.443: Flags [.], ack 403178, win 65535, length 0
20:00:30.831520 IP 151.101.117.140.443 > 10.0.2.15.53064: Flags [P.], seq 403178:408674, ack 821, win 65535, length 5496
20:00:30.831524 IP 151.101.117.140.443 > 10.0.2.15.53064: Flags [P.], seq 408674:414170, ack 821, win 65535, length 5496
20:00:30.831543 IP 10.0.2.15.53064 > 151.101.117.140.443: Flags [.], ack 408674, win 65535, length 0
20:00:30.831580 IP 10.0.2.15.53064 > 151.101.117.140.443: Flags [.], ack 414170, win 65535, length 0
20:00:30.831702 IP 151.101.117.140.443 > 10.0.2.15.53064: Flags [.], seq 414170:415630, ack 821, win 65535, length 1460
20:00:30.831712 IP 10.0.2.15.53064 > 151.101.117.140.443: Flags [.], ack 415630, win 65535, length 0
20:00:30.832075 IP 151.101.117.140.443 > 10.0.2.15.53064: Flags [P.], seq 415630:418292, ack 821, win 65535, length 2662
20:00:30.832077 IP 151.101.117.140.443 > 10.0.2.15.53064: Flags [P.], seq 418292:422414, ack 821, win 65535, length 4122
20:00:30.832094 IP 10.0.2.15.53064 > 151.101.117.140.443: Flags [.], ack 418292, win 65535, length 0
20:00:30.832118 IP 10.0.2.15.53064 > 151.101.117.140.443: Flags [.], ack 422414, win 65535, length 0
20:00:30.833417 IP 151.101.117.140.443 > 10.0.2.15.53064: Flags [P.], seq 422414:426536, ack 821, win 65535, length 4122
20:00:30.833420 IP 151.101.117.140.443 > 10.0.2.15.53064: Flags [P.], seq 426536:433406, ack 821, win 65535, length 6870
20:00:30.833511 IP 10.0.2.15.53064 > 151.101.117.140.443: Flags [.], ack 426536, win 65535, length 0
20:00:30.833621 IP 10.0.2.15.53064 > 151.101.117.140.443: Flags [.], ack 433406, win 65535, length 0
20:00:30.833663 IP 151.101.117.140.443 > 10.0.2.15.53064: Flags [P.], seq 433406:434780, ack 821, win 65535, length 1374
20:00:30.833664 IP 151.101.117.140.443 > 10.0.2.15.53064: Flags [P.], seq 434780:438902, ack 821, win 65535, length 4122
20:00:30.833674 IP 10.0.2.15.53064 > 151.101.117.140.443: Flags [.], ack 434780, win 65535, length 0
20:00:30.833769 IP 10.0.2.15.53064 > 151.101.117.140.443: Flags [.], ack 438902, win 65535, length 0
20:00:30.833960 IP 151.101.117.140.443 > 10.0.2.15.53064: Flags [P.], seq 438902:441650, ack 821, win 65535, length 2748
20:00:30.833969 IP 10.0.2.15.53064 > 151.101.117.140.443: Flags [.], ack 441650, win 65535, length 0
20:00:30.834100 IP 151.101.117.140.443 > 10.0.2.15.53064: Flags [P.], seq 441650:444398, ack 821, win 65535, length 2748
20:00:30.834107 IP 10.0.2.15.53064 > 151.101.117.140.443: Flags [.], ack 444398, win 65535, length 0
20:00:30.837183 IP 151.101.117.140.443 > 10.0.2.15.53064: Flags [P.], seq 444398:457808, ack 821, win 65535, length 13410
20:00:30.837204 IP 10.0.2.15.53064 > 151.101.117.140.443: Flags [.], ack 457808, win 65535, length 0
20:00:30.840967 IP 151.101.117.140.443 > 10.0.2.15.53064: Flags [P.], seq 457808:464678, ack 821, win 65535, length 6870
20:00:30.840971 IP 151.101.117.140.443 > 10.0.2.15.53064: Flags [P.], seq 464678:468800, ack 821, win 65535, length 4122
20:00:30.840998 IP 10.0.2.15.53064 > 151.101.117.140.443: Flags [.], ack 464678, win 65535, length 0
20:00:30.841179 IP 10.0.2.15.53064 > 151.101.117.140.443: Flags [.], ack 468800, win 65535, length 0
20:00:30.841535 IP 151.101.117.140.443 > 10.0.2.15.53064: Flags [P.], seq 468800:471548, ack 821, win 65535, length 2748
20:00:30.841537 IP 151.101.117.140.443 > 10.0.2.15.53064: Flags [P.], seq 471548:474237, ack 821, win 65535, length 2689
20:00:30.841538 IP 151.101.117.140.443 > 10.0.2.15.53064: Flags [P.], seq 474237:475611, ack 821, win 65535, length 1374
20:00:30.841592 IP 10.0.2.15.53064 > 151.101.117.140.443: Flags [.], ack 471548, win 65535, length 0
20:00:30.841657 IP 10.0.2.15.53064 > 151.101.117.140.443: Flags [.], ack 474237, win 65535, length 0
20:00:30.842631 IP 10.0.2.15.53064 > 151.101.117.140.443: Flags [.], ack 475611, win 65535, length 0
20:00:30.843056 IP 151.101.117.140.443 > 10.0.2.15.53064: Flags [P.], seq 475611:479733, ack 821, win 65535, length 4122
20:00:30.843058 IP 151.101.117.140.443 > 10.0.2.15.53064: Flags [P.], seq 479733:482481, ack 821, win 65535, length 2748
20:00:30.843058 IP 151.101.117.140.443 > 10.0.2.15.53064: Flags [P.], seq 482481:483855, ack 821, win 65535, length 1374
20:00:30.843059 IP 151.101.117.140.443 > 10.0.2.15.53064: Flags [P.], seq 483855:487977, ack 821, win 65535, length 4122
20:00:30.843080 IP 10.0.2.15.53064 > 151.101.117.140.443: Flags [.], ack 479733, win 65535, length 0
20:00:30.843109 IP 10.0.2.15.53064 > 151.101.117.140.443: Flags [.], ack 482481, win 65535, length 0
20:00:30.843121 IP 10.0.2.15.53064 > 151.101.117.140.443: Flags [.], ack 483855, win 65535, length 0
20:00:30.843133 IP 10.0.2.15.53064 > 151.101.117.140.443: Flags [.], ack 487977, win 65535, length 0
20:00:30.843164 IP 151.101.117.140.443 > 10.0.2.15.53064: Flags [P.], seq 487977:491203, ack 821, win 65535, length 3226
20:00:30.843166 IP 151.101.117.140.443 > 10.0.2.15.53064: Flags [P.], seq 491203:493951, ack 821, win 65535, length 2748
20:00:30.843518 IP 151.101.117.140.443 > 10.0.2.15.53064: Flags [P.], seq 493951:495325, ack 821, win 65535, length 1374
20:00:30.843522 IP 151.101.117.140.443 > 10.0.2.15.53064: Flags [P.], seq 495325:499447, ack 821, win 65535, length 4122
20:00:30.843624 IP 10.0.2.15.53064 > 151.101.117.140.443: Flags [.], ack 491203, win 65535, length 0
20:00:30.843718 IP 10.0.2.15.53064 > 151.101.117.140.443: Flags [.], ack 493951, win 65535, length 0
20:00:30.843739 IP 10.0.2.15.53064 > 151.101.117.140.443: Flags [.], ack 495325, win 65535, length 0
20:00:30.843752 IP 10.0.2.15.53064 > 151.101.117.140.443: Flags [.], ack 499447, win 65535, length 0
20:00:30.843779 IP 151.101.117.140.443 > 10.0.2.15.53064: Flags [P.], seq 499447:507104, ack 821, win 65535, length 7657
20:00:30.843785 IP 10.0.2.15.53064 > 151.101.117.140.443: Flags [.], ack 507104, win 65535, length 0
20:00:30.844932 IP 151.101.117.140.443 > 10.0.2.15.53064: Flags [P.], seq 507104:511226, ack 821, win 65535, length 4122
20:00:30.844938 IP 151.101.117.140.443 > 10.0.2.15.53064: Flags [P.], seq 511226:513974, ack 821, win 65535, length 2748
20:00:30.844939 IP 151.101.117.140.443 > 10.0.2.15.53064: Flags [P.], seq 513974:515348, ack 821, win 65535, length 1374
20:00:30.845090 IP 10.0.2.15.53064 > 151.101.117.140.443: Flags [.], ack 511226, win 65535, length 0
20:00:30.845136 IP 10.0.2.15.53064 > 151.101.117.140.443: Flags [.], ack 513974, win 65535, length 0
20:00:30.845148 IP 10.0.2.15.53064 > 151.101.117.140.443: Flags [.], ack 515348, win 65535, length 0
20:00:30.845616 IP 151.101.117.140.443 > 10.0.2.15.53064: Flags [P.], seq 515348:518096, ack 821, win 65535, length 2748
20:00:30.845618 IP 151.101.117.140.443 > 10.0.2.15.53064: Flags [P.], seq 518096:520844, ack 821, win 65535, length 2748
20:00:30.845620 IP 151.101.117.140.443 > 10.0.2.15.53064: Flags [P.], seq 520844:526282, ack 821, win 65535, length 5438
20:00:30.845647 IP 10.0.2.15.53064 > 151.101.117.140.443: Flags [.], ack 518096, win 65535, length 0
20:00:30.845710 IP 10.0.2.15.53064 > 151.101.117.140.443: Flags [.], ack 520844, win 65535, length 0
20:00:30.845723 IP 10.0.2.15.53064 > 151.101.117.140.443: Flags [.], ack 526282, win 65535, length 0
20:00:30.845752 IP 151.101.117.140.443 > 10.0.2.15.53064: Flags [P.], seq 526282:527656, ack 821, win 65535, length 1374
20:00:30.845753 IP 151.101.117.140.443 > 10.0.2.15.53064: Flags [P.], seq 527656:530404, ack 821, win 65535, length 2748
20:00:30.845754 IP 151.101.117.140.443 > 10.0.2.15.53064: Flags [P.], seq 530404:533152, ack 821, win 65535, length 2748
20:00:30.845762 IP 10.0.2.15.53064 > 151.101.117.140.443: Flags [.], ack 527656, win 65535, length 0
20:00:30.845774 IP 10.0.2.15.53064 > 151.101.117.140.443: Flags [.], ack 530404, win 65535, length 0
20:00:30.845785 IP 10.0.2.15.53064 > 151.101.117.140.443: Flags [.], ack 533152, win 65535, length 0
20:00:30.846470 IP 151.101.117.140.443 > 10.0.2.15.53064: Flags [P.], seq 533152:538648, ack 821, win 65535, length 5496
20:00:30.846472 IP 151.101.117.140.443 > 10.0.2.15.53064: Flags [P.], seq 538648:539963, ack 821, win 65535, length 1315
20:00:30.846495 IP 10.0.2.15.53064 > 151.101.117.140.443: Flags [.], ack 538648, win 65535, length 0
20:00:30.846519 IP 10.0.2.15.53064 > 151.101.117.140.443: Flags [.], ack 539963, win 65535, length 0
20:00:30.852138 IP 151.101.117.140.443 > 10.0.2.15.53064: Flags [P.], seq 539963:546833, ack 821, win 65535, length 6870
20:00:30.852140 IP 151.101.117.140.443 > 10.0.2.15.53064: Flags [P.], seq 546833:548207, ack 821, win 65535, length 1374
20:00:30.852163 IP 10.0.2.15.53064 > 151.101.117.140.443: Flags [.], ack 546833, win 65535, length 0
20:00:30.852201 IP 10.0.2.15.53064 > 151.101.117.140.443: Flags [.], ack 548207, win 65535, length 0
20:00:30.858353 IP 151.101.117.140.443 > 10.0.2.15.53064: Flags [P.], seq 548207:578376, ack 821, win 65535, length 30169
20:00:30.858495 IP 10.0.2.15.53064 > 151.101.117.140.443: Flags [.], ack 578376, win 65535, length 0
20:00:30.858687 IP 151.101.117.140.443 > 10.0.2.15.53064: Flags [P.], seq 578376:582498, ack 821, win 65535, length 4122
20:00:30.858776 IP 10.0.2.15.53064 > 151.101.117.140.443: Flags [.], ack 582498, win 65535, length 0
20:00:30.859346 IP 151.101.117.140.443 > 10.0.2.15.53064: Flags [P.], seq 582498:595378, ack 821, win 65535, length 12880
20:00:30.859358 IP 10.0.2.15.53064 > 151.101.117.140.443: Flags [.], ack 595378, win 65535, length 0
20:00:30.859404 IP 151.101.117.140.443 > 10.0.2.15.53064: Flags [P.], seq 595378:602248, ack 821, win 65535, length 6870
20:00:30.859406 IP 151.101.117.140.443 > 10.0.2.15.53064: Flags [P.], seq 602248:604996, ack 821, win 65535, length 2748
20:00:30.859416 IP 10.0.2.15.53064 > 151.101.117.140.443: Flags [.], ack 602248, win 65535, length 0
20:00:30.859433 IP 10.0.2.15.53064 > 151.101.117.140.443: Flags [.], ack 604996, win 65535, length 0
20:00:30.862223 IP 151.101.117.140.443 > 10.0.2.15.53064: Flags [P.], seq 604996:612506, ack 821, win 65535, length 7510
20:00:30.862225 IP 151.101.117.140.443 > 10.0.2.15.53064: Flags [P.], seq 612506:615254, ack 821, win 65535, length 2748
20:00:30.862247 IP 10.0.2.15.53064 > 151.101.117.140.443: Flags [.], ack 612506, win 65535, length 0
20:00:30.862285 IP 10.0.2.15.53064 > 151.101.117.140.443: Flags [.], ack 615254, win 65535, length 0
20:00:30.863115 IP 151.101.117.140.443 > 10.0.2.15.53064: Flags [P.], seq 615254:622074, ack 821, win 65535, length 6820
20:00:30.863128 IP 10.0.2.15.53064 > 151.101.117.140.443: Flags [.], ack 622074, win 65535, length 0
20:00:30.864295 IP 151.101.117.140.443 > 10.0.2.15.53064: Flags [P.], seq 622074:627570, ack 821, win 65535, length 5496
20:00:30.864298 IP 151.101.117.140.443 > 10.0.2.15.53064: Flags [P.], seq 627570:631692, ack 821, win 65535, length 4122
20:00:30.864320 IP 10.0.2.15.53064 > 151.101.117.140.443: Flags [.], ack 627570, win 65535, length 0
20:00:30.864354 IP 10.0.2.15.53064 > 151.101.117.140.443: Flags [.], ack 631692, win 65535, length 0
20:00:30.864513 IP 151.101.117.140.443 > 10.0.2.15.53064: Flags [P.], seq 631692:634440, ack 821, win 65535, length 2748
20:00:30.864524 IP 10.0.2.15.53064 > 151.101.117.140.443: Flags [.], ack 634440, win 65535, length 0
20:00:30.865192 IP 151.101.117.140.443 > 10.0.2.15.53064: Flags [P.], seq 634440:637188, ack 821, win 65535, length 2748
20:00:30.865212 IP 10.0.2.15.53064 > 151.101.117.140.443: Flags [.], ack 637188, win 65535, length 0
20:00:30.865493 IP 151.101.117.140.443 > 10.0.2.15.53064: Flags [P.], seq 637188:642625, ack 821, win 65535, length 5437
20:00:30.865496 IP 151.101.117.140.443 > 10.0.2.15.53064: Flags [P.], seq 642625:645373, ack 821, win 65535, length 2748
20:00:30.865497 IP 151.101.117.140.443 > 10.0.2.15.53064: Flags [P.], seq 645373:648121, ack 821, win 65535, length 2748
20:00:30.865514 IP 10.0.2.15.53064 > 151.101.117.140.443: Flags [.], ack 642625, win 65535, length 0
20:00:30.865633 IP 10.0.2.15.53064 > 151.101.117.140.443: Flags [.], ack 645373, win 65535, length 0
20:00:30.865657 IP 10.0.2.15.53064 > 151.101.117.140.443: Flags [.], ack 648121, win 65535, length 0
20:00:30.865684 IP 151.101.117.140.443 > 10.0.2.15.53064: Flags [P.], seq 648121:649495, ack 821, win 65535, length 1374
20:00:30.865690 IP 10.0.2.15.53064 > 151.101.117.140.443: Flags [.], ack 649495, win 65535, length 0
20:00:30.866199 IP 151.101.117.140.443 > 10.0.2.15.53064: Flags [P.], seq 649495:651655, ack 821, win 65535, length 2160
20:00:30.866521 IP 151.101.117.140.443 > 10.0.2.15.53064: Flags [P.], seq 651655:656315, ack 821, win 65535, length 4660
20:00:30.866523 IP 151.101.117.140.443 > 10.0.2.15.53064: Flags [P.], seq 656315:657689, ack 821, win 65535, length 1374
20:00:30.866524 IP 151.101.117.140.443 > 10.0.2.15.53064: Flags [P.], seq 657689:660437, ack 821, win 65535, length 2748
20:00:30.866743 IP 151.101.117.140.443 > 10.0.2.15.53064: Flags [P.], seq 660437:663185, ack 821, win 65535, length 2748
20:00:30.867181 IP 151.101.117.140.443 > 10.0.2.15.53064: Flags [P.], seq 663185:664559, ack 821, win 65535, length 1374
20:00:30.867183 IP 151.101.117.140.443 > 10.0.2.15.53064: Flags [P.], seq 664559:667307, ack 821, win 65535, length 2748
20:00:30.867184 IP 151.101.117.140.443 > 10.0.2.15.53064: Flags [P.], seq 667307:670055, ack 821, win 65535, length 2748
20:00:30.867244 IP 10.0.2.15.53064 > 151.101.117.140.443: Flags [.], ack 670055, win 65535, length 0
20:00:30.867539 IP 151.101.117.140.443 > 10.0.2.15.53064: Flags [P.], seq 670055:672744, ack 821, win 65535, length 2689
20:00:30.867541 IP 151.101.117.140.443 > 10.0.2.15.53064: Flags [P.], seq 672744:674118, ack 821, win 65535, length 1374
20:00:30.867541 IP 151.101.117.140.443 > 10.0.2.15.53064: Flags [P.], seq 674118:676866, ack 821, win 65535, length 2748
20:00:30.867574 IP 10.0.2.15.53064 > 151.101.117.140.443: Flags [.], ack 676866, win 65535, length 0
20:00:30.867720 IP 151.101.117.140.443 > 10.0.2.15.53064: Flags [P.], seq 676866:678240, ack 821, win 65535, length 1374
20:00:30.867729 IP 10.0.2.15.53064 > 151.101.117.140.443: Flags [.], ack 678240, win 65535, length 0
20:00:30.868561 IP 151.101.117.140.443 > 10.0.2.15.53064: Flags [P.], seq 678240:685110, ack 821, win 65535, length 6870
20:00:30.868581 IP 10.0.2.15.53064 > 151.101.117.140.443: Flags [.], ack 685110, win 65535, length 0

