20:03:16.385244 IP 10.0.2.15.42917 > 140.233.253.2.53: 8513+ A? www.reddit.com. (32)
20:03:16.385282 IP 10.0.2.15.42917 > 140.233.253.2.53: 5725+ AAAA? www.reddit.com. (32)
20:03:16.403162 IP 140.233.253.2.53 > 10.0.2.15.42917: 5725 1/1/0 CNAME reddit.map.fastly.net. (125)
20:03:16.403589 IP 140.233.253.2.53 > 10.0.2.15.42917: 8513 2/0/0 CNAME reddit.map.fastly.net., A 151.101.117.140 (83)
20:03:16.404029 IP 10.0.2.15.53114 > 151.101.117.140.443: Flags [S], seq 3502645461, win 64240, options [mss 1460,sackOK,TS val 3623685588 ecr 0,nop,wscale 6], length 0
20:03:16.420665 IP 151.101.117.140.443 > 10.0.2.15.53114: Flags [S.], seq 221504001, ack 3502645462, win 65535, options [mss 1460], length 0
20:03:16.420713 IP 10.0.2.15.53114 > 151.101.117.140.443: Flags [.], ack 1, win 64240, length 0
20:03:16.432657 IP 10.0.2.15.53114 > 151.101.117.140.443: Flags [P.], seq 1:518, ack 1, win 64240, length 517
20:03:16.432895 IP 151.101.117.140.443 > 10.0.2.15.53114: Flags [.], ack 518, win 65535, length 0
20:03:16.448430 IP 151.101.117.140.443 > 10.0.2.15.53114: Flags [P.], seq 1:2749, ack 518, win 65535, length 2748
20:03:16.448449 IP 10.0.2.15.53114 > 151.101.117.140.443: Flags [.], ack 2749, win 62780, length 0
20:03:16.453372 IP 151.101.117.140.443 > 10.0.2.15.53114: Flags [P.], seq 2749:3722, ack 518, win 65535, length 973
20:03:16.453393 IP 10.0.2.15.53114 > 151.101.117.140.443: Flags [.], ack 3722, win 62780, length 0
20:03:16.458859 IP 10.0.2.15.53114 > 151.101.117.140.443: Flags [P.], seq 518:598, ack 3722, win 62780, length 80
20:03:16.459434 IP 151.101.117.140.443 > 10.0.2.15.53114: Flags [.], ack 598, win 65535, length 0
20:03:16.459505 IP 10.0.2.15.53114 > 151.101.117.140.443: Flags [P.], seq 598:644, ack 3722, win 62780, length 46
20:03:16.459962 IP 151.101.117.140.443 > 10.0.2.15.53114: Flags [.], ack 644, win 65535, length 0
20:03:16.459998 IP 10.0.2.15.53114 > 151.101.117.140.443: Flags [P.], seq 644:693, ack 3722, win 62780, length 49
20:03:16.460362 IP 10.0.2.15.53114 > 151.101.117.140.443: Flags [P.], seq 693:728, ack 3722, win 62780, length 35
20:03:16.460504 IP 151.101.117.140.443 > 10.0.2.15.53114: Flags [.], ack 693, win 65535, length 0
20:03:16.460650 IP 10.0.2.15.53114 > 151.101.117.140.443: Flags [P.], seq 728:790, ack 3722, win 62780, length 62
20:03:16.460713 IP 151.101.117.140.443 > 10.0.2.15.53114: Flags [.], ack 728, win 65535, length 0
20:03:16.460902 IP 151.101.117.140.443 > 10.0.2.15.53114: Flags [.], ack 790, win 65535, length 0
20:03:16.473372 IP 151.101.117.140.443 > 10.0.2.15.53114: Flags [P.], seq 3722:3803, ack 790, win 65535, length 81
20:03:16.473390 IP 10.0.2.15.53114 > 151.101.117.140.443: Flags [.], ack 3803, win 62780, length 0
20:03:16.473709 IP 10.0.2.15.53114 > 151.101.117.140.443: Flags [P.], seq 790:821, ack 3803, win 62780, length 31
20:03:16.473962 IP 151.101.117.140.443 > 10.0.2.15.53114: Flags [.], ack 821, win 65535, length 0
20:03:16.799057 IP 151.101.117.140.443 > 10.0.2.15.53114: Flags [P.], seq 3803:9577, ack 821, win 65535, length 5774
20:03:16.799082 IP 10.0.2.15.53114 > 151.101.117.140.443: Flags [.], ack 9577, win 61320, length 0
20:03:16.802481 IP 151.101.117.140.443 > 10.0.2.15.53114: Flags [P.], seq 9577:15073, ack 821, win 65535, length 5496
20:03:16.802500 IP 10.0.2.15.53114 > 151.101.117.140.443: Flags [.], ack 15073, win 61320, length 0
20:03:16.805338 IP 151.101.117.140.443 > 10.0.2.15.53114: Flags [P.], seq 15073:21943, ack 821, win 65535, length 6870
20:03:16.805341 IP 151.101.117.140.443 > 10.0.2.15.53114: Flags [.], seq 21943:24863, ack 821, win 65535, length 2920
20:03:16.805397 IP 10.0.2.15.53114 > 151.101.117.140.443: Flags [.], ack 24863, win 51530, length 0
20:03:16.812630 IP 151.101.117.140.443 > 10.0.2.15.53114: Flags [.], seq 24863:27783, ack 821, win 65535, length 2920
20:03:16.812653 IP 10.0.2.15.53114 > 151.101.117.140.443: Flags [.], ack 27783, win 62780, length 0
20:03:16.813341 IP 151.101.117.140.443 > 10.0.2.15.53114: Flags [.], seq 27783:36543, ack 821, win 65535, length 8760
20:03:16.813689 IP 10.0.2.15.53114 > 151.101.117.140.443: Flags [.], ack 36543, win 56940, length 0
20:03:16.819055 IP 151.101.117.140.443 > 10.0.2.15.53114: Flags [.], seq 36543:51143, ack 821, win 65535, length 14600
20:03:16.819263 IP 10.0.2.15.53114 > 151.101.117.140.443: Flags [.], ack 51143, win 55480, length 0
20:03:16.823802 IP 151.101.117.140.443 > 10.0.2.15.53114: Flags [.], seq 51143:67203, ack 821, win 65535, length 16060
20:03:16.823825 IP 10.0.2.15.53114 > 151.101.117.140.443: Flags [.], ack 67203, win 54020, length 0
20:03:16.825811 IP 151.101.117.140.443 > 10.0.2.15.53114: Flags [.], seq 67203:70123, ack 821, win 65535, length 2920
20:03:16.825902 IP 10.0.2.15.53114 > 151.101.117.140.443: Flags [.], ack 70123, win 65535, length 0
20:03:16.826215 IP 151.101.117.140.443 > 10.0.2.15.53114: Flags [.], seq 70123:71583, ack 821, win 65535, length 1460
20:03:16.826234 IP 10.0.2.15.53114 > 151.101.117.140.443: Flags [.], ack 71583, win 65535, length 0
20:03:16.826477 IP 151.101.117.140.443 > 10.0.2.15.53114: Flags [.], seq 71583:84723, ack 821, win 65535, length 13140
20:03:16.826594 IP 10.0.2.15.53114 > 151.101.117.140.443: Flags [.], ack 84723, win 65535, length 0
20:03:16.828272 IP 151.101.117.140.443 > 10.0.2.15.53114: Flags [P.], seq 84723:101635, ack 821, win 65535, length 16912
20:03:16.828297 IP 10.0.2.15.53114 > 151.101.117.140.443: Flags [.], ack 101635, win 65535, length 0
20:03:16.828353 IP 151.101.117.140.443 > 10.0.2.15.53114: Flags [.], seq 101635:106015, ack 821, win 65535, length 4380
20:03:16.828363 IP 10.0.2.15.53114 > 151.101.117.140.443: Flags [.], ack 106015, win 65535, length 0
20:03:16.830778 IP 151.101.117.140.443 > 10.0.2.15.53114: Flags [.], seq 106015:130835, ack 821, win 65535, length 24820
20:03:16.830807 IP 10.0.2.15.53114 > 151.101.117.140.443: Flags [.], ack 130835, win 65535, length 0
20:03:16.831684 IP 151.101.117.140.443 > 10.0.2.15.53114: Flags [P.], seq 130835:149725, ack 821, win 65535, length 18890
20:03:16.831703 IP 10.0.2.15.53114 > 151.101.117.140.443: Flags [.], ack 149725, win 65535, length 0
20:03:16.831759 IP 151.101.117.140.443 > 10.0.2.15.53114: Flags [.], seq 149725:157025, ack 821, win 65535, length 7300
20:03:16.831766 IP 10.0.2.15.53114 > 151.101.117.140.443: Flags [.], ack 157025, win 65535, length 0
20:03:16.832487 IP 151.101.117.140.443 > 10.0.2.15.53114: Flags [.], seq 157025:164325, ack 821, win 65535, length 7300
20:03:16.832511 IP 10.0.2.15.53114 > 151.101.117.140.443: Flags [.], ack 164325, win 65535, length 0
20:03:16.834689 IP 151.101.117.140.443 > 10.0.2.15.53114: Flags [.], seq 164325:183305, ack 821, win 65535, length 18980
20:03:16.834709 IP 10.0.2.15.53114 > 151.101.117.140.443: Flags [.], ack 183305, win 65535, length 0
20:03:16.838305 IP 151.101.117.140.443 > 10.0.2.15.53114: Flags [P.], seq 183305:192319, ack 821, win 65535, length 9014
20:03:16.838308 IP 151.101.117.140.443 > 10.0.2.15.53114: Flags [P.], seq 192319:197782, ack 821, win 65535, length 5463
20:03:16.838333 IP 10.0.2.15.53114 > 151.101.117.140.443: Flags [.], ack 192319, win 65535, length 0
20:03:16.838361 IP 10.0.2.15.53114 > 151.101.117.140.443: Flags [.], ack 197782, win 65535, length 0
20:03:17.530610 IP 151.101.117.140.443 > 10.0.2.15.53114: Flags [P.], seq 197782:199156, ack 821, win 65535, length 1374
20:03:17.530635 IP 10.0.2.15.53114 > 151.101.117.140.443: Flags [.], ack 199156, win 65535, length 0
20:03:17.537107 IP 151.101.117.140.443 > 10.0.2.15.53114: Flags [P.], seq 199156:199253, ack 821, win 65535, length 97
20:03:17.537126 IP 10.0.2.15.53114 > 151.101.117.140.443: Flags [.], ack 199253, win 65535, length 0
20:03:17.570391 IP 151.101.117.140.443 > 10.0.2.15.53114: Flags [P.], seq 199253:207497, ack 821, win 65535, length 8244
20:03:17.570432 IP 10.0.2.15.53114 > 151.101.117.140.443: Flags [.], ack 207497, win 65535, length 0
20:03:17.574424 IP 151.101.117.140.443 > 10.0.2.15.53114: Flags [P.], seq 207497:211565, ack 821, win 65535, length 4068
20:03:17.574426 IP 151.101.117.140.443 > 10.0.2.15.53114: Flags [P.], seq 211565:214313, ack 821, win 65535, length 2748
20:03:17.574448 IP 10.0.2.15.53114 > 151.101.117.140.443: Flags [.], ack 211565, win 65535, length 0
20:03:17.574481 IP 10.0.2.15.53114 > 151.101.117.140.443: Flags [.], ack 214313, win 65535, length 0
20:03:17.578012 IP 151.101.117.140.443 > 10.0.2.15.53114: Flags [.], seq 214313:256653, ack 821, win 65535, length 42340
20:03:17.578050 IP 10.0.2.15.53114 > 151.101.117.140.443: Flags [.], ack 256653, win 65535, length 0
20:03:17.579822 IP 151.101.117.140.443 > 10.0.2.15.53114: Flags [P.], seq 256653:263953, ack 821, win 65535, length 7300
20:03:17.579826 IP 151.101.117.140.443 > 10.0.2.15.53114: Flags [P.], seq 263953:272017, ack 821, win 65535, length 8064
20:03:17.579847 IP 10.0.2.15.53114 > 151.101.117.140.443: Flags [.], ack 263953, win 65535, length 0
20:03:17.579877 IP 10.0.2.15.53114 > 151.101.117.140.443: Flags [.], ack 272017, win 65535, length 0
20:03:17.583648 IP 151.101.117.140.443 > 10.0.2.15.53114: Flags [P.], seq 272017:277513, ack 821, win 65535, length 5496
20:03:17.583668 IP 10.0.2.15.53114 > 151.101.117.140.443: Flags [.], ack 277513, win 65535, length 0
20:03:17.584140 IP 151.101.117.140.443 > 10.0.2.15.53114: Flags [P.], seq 277513:281635, ack 821, win 65535, length 4122
20:03:17.584158 IP 10.0.2.15.53114 > 151.101.117.140.443: Flags [.], ack 281635, win 65535, length 0
20:03:17.586268 IP 151.101.117.140.443 > 10.0.2.15.53114: Flags [P.], seq 281635:283009, ack 821, win 65535, length 1374
20:03:17.586287 IP 10.0.2.15.53114 > 151.101.117.140.443: Flags [.], ack 283009, win 65535, length 0
20:03:17.589777 IP 151.101.117.140.443 > 10.0.2.15.53114: Flags [P.], seq 283009:316742, ack 821, win 65535, length 33733
20:03:17.589801 IP 10.0.2.15.53114 > 151.101.117.140.443: Flags [.], ack 316742, win 65535, length 0
20:03:17.593963 IP 151.101.117.140.443 > 10.0.2.15.53114: Flags [P.], seq 316742:358554, ack 821, win 65535, length 41812
20:03:17.593986 IP 10.0.2.15.53114 > 151.101.117.140.443: Flags [.], ack 358554, win 65535, length 0
20:03:17.600439 IP 151.101.117.140.443 > 10.0.2.15.53114: Flags [P.], seq 358554:401039, ack 821, win 65535, length 42485
20:03:17.600460 IP 10.0.2.15.53114 > 151.101.117.140.443: Flags [.], ack 401039, win 65535, length 0
20:03:17.602992 IP 151.101.117.140.443 > 10.0.2.15.53114: Flags [P.], seq 401039:418483, ack 821, win 65535, length 17444
20:03:17.603077 IP 10.0.2.15.53114 > 151.101.117.140.443: Flags [.], ack 418483, win 65535, length 0
20:03:17.603547 IP 151.101.117.140.443 > 10.0.2.15.53114: Flags [.], seq 418483:425783, ack 821, win 65535, length 7300
20:03:17.603563 IP 10.0.2.15.53114 > 151.101.117.140.443: Flags [.], ack 425783, win 65535, length 0
20:03:17.604101 IP 151.101.117.140.443 > 10.0.2.15.53114: Flags [P.], seq 425783:436656, ack 821, win 65535, length 10873
20:03:17.604116 IP 10.0.2.15.53114 > 151.101.117.140.443: Flags [.], ack 436656, win 65535, length 0
20:03:17.607656 IP 151.101.117.140.443 > 10.0.2.15.53114: Flags [P.], seq 436656:440727, ack 821, win 65535, length 4071
20:03:17.607737 IP 10.0.2.15.53114 > 151.101.117.140.443: Flags [.], ack 440727, win 65535, length 0
20:03:17.609885 IP 151.101.117.140.443 > 10.0.2.15.53114: Flags [P.], seq 440727:447597, ack 821, win 65535, length 6870
20:03:17.609888 IP 151.101.117.140.443 > 10.0.2.15.53114: Flags [P.], seq 447597:453093, ack 821, win 65535, length 5496
20:03:17.609912 IP 10.0.2.15.53114 > 151.101.117.140.443: Flags [.], ack 447597, win 65535, length 0
20:03:17.609938 IP 10.0.2.15.53114 > 151.101.117.140.443: Flags [.], ack 453093, win 65535, length 0
20:03:17.610055 IP 151.101.117.140.443 > 10.0.2.15.53114: Flags [P.], seq 453093:458538, ack 821, win 65535, length 5445
20:03:17.610064 IP 10.0.2.15.53114 > 151.101.117.140.443: Flags [.], ack 458538, win 65535, length 0
20:03:17.612963 IP 151.101.117.140.443 > 10.0.2.15.53114: Flags [P.], seq 458538:470904, ack 821, win 65535, length 12366
20:03:17.613195 IP 10.0.2.15.53114 > 151.101.117.140.443: Flags [.], ack 470904, win 65535, length 0
20:03:17.613405 IP 151.101.117.140.443 > 10.0.2.15.53114: Flags [P.], seq 470904:474968, ack 821, win 65535, length 4064
20:03:17.613771 IP 151.101.117.140.443 > 10.0.2.15.53114: Flags [P.], seq 474968:486000, ack 821, win 65535, length 11032
20:03:17.613809 IP 10.0.2.15.53114 > 151.101.117.140.443: Flags [.], ack 474968, win 65535, length 0
20:03:17.613849 IP 10.0.2.15.53114 > 151.101.117.140.443: Flags [.], ack 486000, win 65535, length 0
20:03:17.613893 IP 151.101.117.140.443 > 10.0.2.15.53114: Flags [P.], seq 486000:503772, ack 821, win 65535, length 17772
20:03:17.613898 IP 10.0.2.15.53114 > 151.101.117.140.443: Flags [.], ack 503772, win 65535, length 0
20:03:17.614755 IP 151.101.117.140.443 > 10.0.2.15.53114: Flags [P.], seq 503772:506469, ack 821, win 65535, length 2697
20:03:17.614776 IP 10.0.2.15.53114 > 151.101.117.140.443: Flags [.], ack 506469, win 65535, length 0
20:03:17.616655 IP 151.101.117.140.443 > 10.0.2.15.53114: Flags [P.], seq 506469:513339, ack 821, win 65535, length 6870
20:03:17.616658 IP 151.101.117.140.443 > 10.0.2.15.53114: Flags [P.], seq 513339:518835, ack 821, win 65535, length 5496
20:03:17.616683 IP 10.0.2.15.53114 > 151.101.117.140.443: Flags [.], ack 513339, win 65535, length 0
20:03:17.616720 IP 10.0.2.15.53114 > 151.101.117.140.443: Flags [.], ack 518835, win 65535, length 0
20:03:17.619432 IP 151.101.117.140.443 > 10.0.2.15.53114: Flags [.], seq 518835:520295, ack 821, win 65535, length 1460
20:03:17.619453 IP 10.0.2.15.53114 > 151.101.117.140.443: Flags [.], ack 520295, win 65535, length 0
20:03:17.623296 IP 151.101.117.140.443 > 10.0.2.15.53114: Flags [P.], seq 520295:522907, ack 821, win 65535, length 2612
20:03:17.623470 IP 10.0.2.15.53114 > 151.101.117.140.443: Flags [.], ack 522907, win 65535, length 0
20:03:17.623645 IP 151.101.117.140.443 > 10.0.2.15.53114: Flags [P.], seq 522907:533899, ack 821, win 65535, length 10992
20:03:17.623656 IP 10.0.2.15.53114 > 151.101.117.140.443: Flags [.], ack 533899, win 65535, length 0
20:03:17.623687 IP 151.101.117.140.443 > 10.0.2.15.53114: Flags [P.], seq 533899:546214, ack 821, win 65535, length 12315
20:03:17.623786 IP 151.101.117.140.443 > 10.0.2.15.53114: Flags [P.], seq 546214:566765, ack 821, win 65535, length 20551
20:03:17.624487 IP 10.0.2.15.53114 > 151.101.117.140.443: Flags [.], ack 566765, win 65535, length 0
20:03:17.627649 IP 151.101.117.140.443 > 10.0.2.15.53114: Flags [P.], seq 566765:590064, ack 821, win 65535, length 23299
20:03:17.627671 IP 10.0.2.15.53114 > 151.101.117.140.443: Flags [.], ack 590064, win 65535, length 0
20:03:17.627729 IP 151.101.117.140.443 > 10.0.2.15.53114: Flags [P.], seq 590064:609300, ack 821, win 65535, length 19236
20:03:17.627810 IP 10.0.2.15.53114 > 151.101.117.140.443: Flags [.], ack 609300, win 65535, length 0
20:03:17.630215 IP 151.101.117.140.443 > 10.0.2.15.53114: Flags [P.], seq 609300:621445, ack 821, win 65535, length 12145
20:03:17.630360 IP 10.0.2.15.53114 > 151.101.117.140.443: Flags [.], ack 621445, win 65535, length 0
20:03:17.633567 IP 151.101.117.140.443 > 10.0.2.15.53114: Flags [P.], seq 621445:628315, ack 821, win 65535, length 6870
20:03:17.633570 IP 151.101.117.140.443 > 10.0.2.15.53114: Flags [P.], seq 628315:632437, ack 821, win 65535, length 4122
20:03:17.633651 IP 10.0.2.15.53114 > 151.101.117.140.443: Flags [.], ack 628315, win 65535, length 0
20:03:17.633697 IP 151.101.117.140.443 > 10.0.2.15.53114: Flags [P.], seq 632437:635185, ack 821, win 65535, length 2748
20:03:17.633698 IP 151.101.117.140.443 > 10.0.2.15.53114: Flags [P.], seq 635185:640630, ack 821, win 65535, length 5445
20:03:17.634226 IP 151.101.117.140.443 > 10.0.2.15.53114: Flags [P.], seq 640630:646126, ack 821, win 65535, length 5496
20:03:17.634228 IP 151.101.117.140.443 > 10.0.2.15.53114: Flags [P.], seq 646126:648874, ack 821, win 65535, length 2748
20:03:17.634391 IP 151.101.117.140.443 > 10.0.2.15.53114: Flags [P.], seq 648874:652996, ack 821, win 65535, length 4122
20:03:17.634526 IP 151.101.117.140.443 > 10.0.2.15.53114: Flags [P.], seq 652996:655656, ack 821, win 65535, length 2660
20:03:17.634616 IP 10.0.2.15.53114 > 151.101.117.140.443: Flags [.], ack 655656, win 65535, length 0
20:03:17.634800 IP 151.101.117.140.443 > 10.0.2.15.53114: Flags [P.], seq 655656:657030, ack 821, win 65535, length 1374
20:03:17.634902 IP 10.0.2.15.53114 > 151.101.117.140.443: Flags [.], ack 657030, win 65535, length 0
20:03:17.635480 IP 151.101.117.140.443 > 10.0.2.15.53114: Flags [P.], seq 657030:662526, ack 821, win 65535, length 5496
20:03:17.635483 IP 151.101.117.140.443 > 10.0.2.15.53114: Flags [P.], seq 662526:665274, ack 821, win 65535, length 2748
20:03:17.635796 IP 151.101.117.140.443 > 10.0.2.15.53114: Flags [P.], seq 665274:668022, ack 821, win 65535, length 2748
20:03:17.635838 IP 10.0.2.15.53114 > 151.101.117.140.443: Flags [.], ack 668022, win 65535, length 0
20:03:17.636677 IP 151.101.117.140.443 > 10.0.2.15.53114: Flags [P.], seq 668022:674841, ack 821, win 65535, length 6819
20:03:17.636680 IP 151.101.117.140.443 > 10.0.2.15.53114: Flags [P.], seq 674841:678963, ack 821, win 65535, length 4122
20:03:17.636728 IP 151.101.117.140.443 > 10.0.2.15.53114: Flags [P.], seq 678963:681711, ack 821, win 65535, length 2748
20:03:17.637036 IP 151.101.117.140.443 > 10.0.2.15.53114: Flags [P.], seq 681711:684459, ack 821, win 65535, length 2748
20:03:17.637038 IP 151.101.117.140.443 > 10.0.2.15.53114: Flags [P.], seq 684459:685833, ack 821, win 65535, length 1374
20:03:17.637342 IP 151.101.117.140.443 > 10.0.2.15.53114: Flags [P.], seq 685833:689904, ack 821, win 65535, length 4071
20:03:17.637344 IP 151.101.117.140.443 > 10.0.2.15.53114: Flags [P.], seq 689904:691278, ack 821, win 65535, length 1374
20:03:17.637344 IP 151.101.117.140.443 > 10.0.2.15.53114: Flags [P.], seq 691278:695400, ack 821, win 65535, length 4122
20:03:17.637537 IP 10.0.2.15.53114 > 151.101.117.140.443: Flags [.], ack 695400, win 65535, length 0
20:03:17.637701 IP 151.101.117.140.443 > 10.0.2.15.53114: Flags [P.], seq 695400:699522, ack 821, win 65535, length 4122
20:03:17.637702 IP 151.101.117.140.443 > 10.0.2.15.53114: Flags [P.], seq 699522:702270, ack 821, win 65535, length 2748
20:03:17.638210 IP 151.101.117.140.443 > 10.0.2.15.53114: Flags [P.], seq 702270:703644, ack 821, win 65535, length 1374
20:03:17.638299 IP 10.0.2.15.53114 > 151.101.117.140.443: Flags [.], ack 703644, win 65535, length 0
20:03:17.639399 IP 151.101.117.140.443 > 10.0.2.15.53114: Flags [P.], seq 703644:710514, ack 821, win 65535, length 6870
20:03:17.639420 IP 10.0.2.15.53114 > 151.101.117.140.443: Flags [.], ack 710514, win 65535, length 0
20:03:17.639830 IP 151.101.117.140.443 > 10.0.2.15.53114: Flags [P.], seq 710514:717384, ack 821, win 65535, length 6870
20:03:17.639833 IP 151.101.117.140.443 > 10.0.2.15.53114: Flags [P.], seq 717384:718758, ack 821, win 65535, length 1374
20:03:17.639849 IP 10.0.2.15.53114 > 151.101.117.140.443: Flags [.], ack 717384, win 65535, length 0
20:03:17.639972 IP 10.0.2.15.53114 > 151.101.117.140.443: Flags [.], ack 718758, win 65535, length 0
20:03:17.640548 IP 151.101.117.140.443 > 10.0.2.15.53114: Flags [P.], seq 718758:720022, ack 821, win 65535, length 1264
20:03:17.640656 IP 10.0.2.15.53114 > 151.101.117.140.443: Flags [.], ack 720022, win 65535, length 0
20:03:17.646079 IP 151.101.117.140.443 > 10.0.2.15.53114: Flags [P.], seq 720022:729869, ack 821, win 65535, length 9847
20:03:17.646081 IP 151.101.117.140.443 > 10.0.2.15.53114: Flags [P.], seq 729869:732617, ack 821, win 65535, length 2748
20:03:17.646232 IP 151.101.117.140.443 > 10.0.2.15.53114: Flags [P.], seq 732617:736460, ack 821, win 65535, length 3843
20:03:17.646520 IP 151.101.117.140.443 > 10.0.2.15.53114: Flags [P.], seq 736460:738731, ack 821, win 65535, length 2271
20:03:17.646522 IP 151.101.117.140.443 > 10.0.2.15.53114: Flags [P.], seq 738731:741479, ack 821, win 65535, length 2748
20:03:17.646522 IP 151.101.117.140.443 > 10.0.2.15.53114: Flags [P.], seq 741479:745601, ack 821, win 65535, length 4122
20:03:17.647478 IP 151.101.117.140.443 > 10.0.2.15.53114: Flags [P.], seq 745601:751797, ack 821, win 65535, length 6196
20:03:17.647480 IP 151.101.117.140.443 > 10.0.2.15.53114: Flags [P.], seq 751797:752921, ack 821, win 65535, length 1124
20:03:17.647616 IP 10.0.2.15.53114 > 151.101.117.140.443: Flags [.], ack 752921, win 65535, length 0

