13:21:19.849635 IP 10.0.2.15.43338 > 151.101.117.140.443: Flags [P.], seq 2294738196:2294738713, ack 83776002, win 64240, length 517
13:21:19.850234 IP 151.101.117.140.443 > 10.0.2.15.43338: Flags [.], ack 517, win 65535, length 0
13:21:19.871339 IP 151.101.117.140.443 > 10.0.2.15.43338: Flags [.], seq 1:2921, ack 517, win 65535, length 2920
13:21:19.871360 IP 10.0.2.15.43338 > 151.101.117.140.443: Flags [.], ack 2921, win 62780, length 0
13:21:19.872625 IP 151.101.117.140.443 > 10.0.2.15.43338: Flags [P.], seq 2921:3722, ack 517, win 65535, length 801
13:21:19.872644 IP 10.0.2.15.43338 > 151.101.117.140.443: Flags [.], ack 3722, win 62780, length 0
13:21:19.873466 IP 10.0.2.15.43338 > 151.101.117.140.443: Flags [P.], seq 517:597, ack 3722, win 62780, length 80
13:21:19.873822 IP 10.0.2.15.43338 > 151.101.117.140.443: Flags [P.], seq 597:643, ack 3722, win 62780, length 46
13:21:19.873851 IP 10.0.2.15.43338 > 151.101.117.140.443: Flags [P.], seq 643:692, ack 3722, win 62780, length 49
13:21:19.873978 IP 151.101.117.140.443 > 10.0.2.15.43338: Flags [.], ack 597, win 65535, length 0
13:21:19.873979 IP 151.101.117.140.443 > 10.0.2.15.43338: Flags [.], ack 643, win 65535, length 0
13:21:19.874037 IP 10.0.2.15.43338 > 151.101.117.140.443: Flags [P.], seq 692:727, ack 3722, win 62780, length 35
13:21:19.874085 IP 10.0.2.15.43338 > 151.101.117.140.443: Flags [P.], seq 727:789, ack 3722, win 62780, length 62
13:21:19.874144 IP 151.101.117.140.443 > 10.0.2.15.43338: Flags [.], ack 692, win 65535, length 0
13:21:19.874272 IP 151.101.117.140.443 > 10.0.2.15.43338: Flags [.], ack 727, win 65535, length 0
13:21:19.874273 IP 151.101.117.140.443 > 10.0.2.15.43338: Flags [.], ack 789, win 65535, length 0
13:21:19.888099 IP 151.101.117.140.443 > 10.0.2.15.43338: Flags [P.], seq 3722:3803, ack 789, win 65535, length 81
13:21:19.888117 IP 10.0.2.15.43338 > 151.101.117.140.443: Flags [.], ack 3803, win 62780, length 0
13:21:19.888373 IP 10.0.2.15.43338 > 151.101.117.140.443: Flags [P.], seq 789:820, ack 3803, win 62780, length 31
13:21:19.888713 IP 151.101.117.140.443 > 10.0.2.15.43338: Flags [.], ack 820, win 65535, length 0
13:21:20.429196 IP 151.101.117.140.443 > 10.0.2.15.43338: Flags [.], seq 3803:11103, ack 820, win 65535, length 7300
13:21:20.429227 IP 10.0.2.15.43338 > 151.101.117.140.443: Flags [.], ack 11103, win 59860, length 0
13:21:20.429594 IP 151.101.117.140.443 > 10.0.2.15.43338: Flags [.], seq 11103:19863, ack 820, win 65535, length 8760
13:21:20.429619 IP 10.0.2.15.43338 > 151.101.117.140.443: Flags [.], ack 19863, win 54020, length 0
13:21:20.429765 IP 151.101.117.140.443 > 10.0.2.15.43338: Flags [P.], seq 19863:29000, ack 820, win 65535, length 9137
13:21:20.429774 IP 10.0.2.15.43338 > 151.101.117.140.443: Flags [.], ack 29000, win 46720, length 0
13:21:20.435084 IP 151.101.117.140.443 > 10.0.2.15.43338: Flags [P.], seq 29000:38618, ack 820, win 65535, length 9618
13:21:20.435206 IP 10.0.2.15.43338 > 151.101.117.140.443: Flags [.], ack 38618, win 58400, length 0
13:21:20.435669 IP 151.101.117.140.443 > 10.0.2.15.43338: Flags [P.], seq 38618:41366, ack 820, win 65535, length 2748
13:21:20.435683 IP 10.0.2.15.43338 > 151.101.117.140.443: Flags [.], ack 41366, win 62780, length 0
13:21:20.437869 IP 151.101.117.140.443 > 10.0.2.15.43338: Flags [P.], seq 41366:42740, ack 820, win 65535, length 1374
13:21:20.437884 IP 10.0.2.15.43338 > 151.101.117.140.443: Flags [.], ack 42740, win 62780, length 0
13:21:20.443757 IP 151.101.117.140.443 > 10.0.2.15.43338: Flags [P.], seq 42740:53732, ack 820, win 65535, length 10992
13:21:20.443778 IP 10.0.2.15.43338 > 151.101.117.140.443: Flags [.], ack 53732, win 56940, length 0
13:21:20.447052 IP 151.101.117.140.443 > 10.0.2.15.43338: Flags [P.], seq 53732:66098, ack 820, win 65535, length 12366
13:21:20.447078 IP 10.0.2.15.43338 > 151.101.117.140.443: Flags [.], ack 66098, win 55480, length 0
13:21:20.447268 IP 151.101.117.140.443 > 10.0.2.15.43338: Flags [P.], seq 66098:72968, ack 820, win 65535, length 6870
13:21:20.447280 IP 10.0.2.15.43338 > 151.101.117.140.443: Flags [.], ack 72968, win 51100, length 0
13:21:20.449807 IP 151.101.117.140.443 > 10.0.2.15.43338: Flags [P.], seq 72968:82586, ack 820, win 65535, length 9618
13:21:20.449850 IP 10.0.2.15.43338 > 151.101.117.140.443: Flags [.], ack 82586, win 65535, length 0
13:21:20.450048 IP 151.101.117.140.443 > 10.0.2.15.43338: Flags [P.], seq 82586:89456, ack 820, win 65535, length 6870
13:21:20.450057 IP 10.0.2.15.43338 > 151.101.117.140.443: Flags [.], ack 89456, win 65535, length 0
13:21:20.453042 IP 151.101.117.140.443 > 10.0.2.15.43338: Flags [P.], seq 89456:97700, ack 820, win 65535, length 8244
13:21:20.453045 IP 151.101.117.140.443 > 10.0.2.15.43338: Flags [P.], seq 97700:103196, ack 820, win 65535, length 5496
13:21:20.453410 IP 10.0.2.15.43338 > 151.101.117.140.443: Flags [.], ack 97700, win 65535, length 0
13:21:20.453489 IP 10.0.2.15.43338 > 151.101.117.140.443: Flags [.], ack 103196, win 65535, length 0
13:21:20.453512 IP 151.101.117.140.443 > 10.0.2.15.43338: Flags [P.], seq 103196:105944, ack 820, win 65535, length 2748
13:21:20.453518 IP 10.0.2.15.43338 > 151.101.117.140.443: Flags [.], ack 105944, win 65535, length 0
13:21:20.453850 IP 151.101.117.140.443 > 10.0.2.15.43338: Flags [P.], seq 105944:118310, ack 820, win 65535, length 12366
13:21:20.453863 IP 10.0.2.15.43338 > 151.101.117.140.443: Flags [.], ack 118310, win 65535, length 0
13:21:20.454229 IP 151.101.117.140.443 > 10.0.2.15.43338: Flags [P.], seq 118310:121058, ack 820, win 65535, length 2748
13:21:20.454242 IP 10.0.2.15.43338 > 151.101.117.140.443: Flags [.], ack 121058, win 65535, length 0
13:21:20.456103 IP 151.101.117.140.443 > 10.0.2.15.43338: Flags [P.], seq 121058:132050, ack 820, win 65535, length 10992
13:21:20.456117 IP 10.0.2.15.43338 > 151.101.117.140.443: Flags [.], ack 132050, win 65535, length 0
13:21:20.457180 IP 151.101.117.140.443 > 10.0.2.15.43338: Flags [P.], seq 132050:138920, ack 820, win 65535, length 6870
13:21:20.457195 IP 10.0.2.15.43338 > 151.101.117.140.443: Flags [.], ack 138920, win 65535, length 0
13:21:20.457483 IP 151.101.117.140.443 > 10.0.2.15.43338: Flags [P.], seq 138920:141668, ack 820, win 65535, length 2748
13:21:20.457509 IP 10.0.2.15.43338 > 151.101.117.140.443: Flags [.], ack 141668, win 65535, length 0
13:21:20.459306 IP 151.101.117.140.443 > 10.0.2.15.43338: Flags [P.], seq 141668:143042, ack 820, win 65535, length 1374
13:21:20.459323 IP 10.0.2.15.43338 > 151.101.117.140.443: Flags [.], ack 143042, win 65535, length 0
13:21:20.459588 IP 151.101.117.140.443 > 10.0.2.15.43338: Flags [.], seq 143042:147422, ack 820, win 65535, length 4380
13:21:20.459602 IP 10.0.2.15.43338 > 151.101.117.140.443: Flags [.], ack 147422, win 65535, length 0
13:21:20.459789 IP 151.101.117.140.443 > 10.0.2.15.43338: Flags [P.], seq 147422:152660, ack 820, win 65535, length 5238
13:21:20.459797 IP 10.0.2.15.43338 > 151.101.117.140.443: Flags [.], ack 152660, win 65535, length 0
13:21:20.462833 IP 151.101.117.140.443 > 10.0.2.15.43338: Flags [P.], seq 152660:162278, ack 820, win 65535, length 9618
13:21:20.462899 IP 10.0.2.15.43338 > 151.101.117.140.443: Flags [.], ack 162278, win 65535, length 0
13:21:20.463154 IP 151.101.117.140.443 > 10.0.2.15.43338: Flags [P.], seq 162278:167774, ack 820, win 65535, length 5496
13:21:20.463156 IP 151.101.117.140.443 > 10.0.2.15.43338: Flags [P.], seq 167774:174644, ack 820, win 65535, length 6870
13:21:20.463377 IP 10.0.2.15.43338 > 151.101.117.140.443: Flags [.], ack 167774, win 65535, length 0
13:21:20.463405 IP 10.0.2.15.43338 > 151.101.117.140.443: Flags [.], ack 174644, win 65535, length 0
13:21:20.463678 IP 151.101.117.140.443 > 10.0.2.15.43338: Flags [P.], seq 174644:182888, ack 820, win 65535, length 8244
13:21:20.463735 IP 10.0.2.15.43338 > 151.101.117.140.443: Flags [.], ack 182888, win 65535, length 0
13:21:20.463919 IP 151.101.117.140.443 > 10.0.2.15.43338: Flags [P.], seq 182888:184262, ack 820, win 65535, length 1374
13:21:20.463928 IP 10.0.2.15.43338 > 151.101.117.140.443: Flags [.], ack 184262, win 65535, length 0
13:21:20.465095 IP 151.101.117.140.443 > 10.0.2.15.43338: Flags [P.], seq 184262:191132, ack 820, win 65535, length 6870
13:21:20.465112 IP 10.0.2.15.43338 > 151.101.117.140.443: Flags [.], ack 191132, win 65535, length 0
13:21:20.465280 IP 151.101.117.140.443 > 10.0.2.15.43338: Flags [P.], seq 191132:197729, ack 820, win 65535, length 6597
13:21:20.465287 IP 10.0.2.15.43338 > 151.101.117.140.443: Flags [.], ack 197729, win 65535, length 0
13:21:21.717999 IP 151.101.117.140.443 > 10.0.2.15.43338: Flags [P.], seq 197729:214260, ack 820, win 65535, length 16531
13:21:21.718067 IP 10.0.2.15.43338 > 151.101.117.140.443: Flags [.], ack 214260, win 65535, length 0
13:21:21.718169 IP 151.101.117.140.443 > 10.0.2.15.43338: Flags [P.], seq 214260:234818, ack 820, win 65535, length 20558
13:21:21.718186 IP 10.0.2.15.43338 > 151.101.117.140.443: Flags [.], ack 234818, win 65535, length 0
13:21:21.718733 IP 151.101.117.140.443 > 10.0.2.15.43338: Flags [P.], seq 234818:249917, ack 820, win 65535, length 15099
13:21:21.718745 IP 10.0.2.15.43338 > 151.101.117.140.443: Flags [.], ack 249917, win 65535, length 0
13:21:21.719759 IP 151.101.117.140.443 > 10.0.2.15.43338: Flags [P.], seq 249917:263600, ack 820, win 65535, length 13683
13:21:21.719812 IP 10.0.2.15.43338 > 151.101.117.140.443: Flags [.], ack 263600, win 65535, length 0
13:21:21.719994 IP 151.101.117.140.443 > 10.0.2.15.43338: Flags [P.], seq 263600:270470, ack 820, win 65535, length 6870
13:21:21.720003 IP 10.0.2.15.43338 > 151.101.117.140.443: Flags [.], ack 270470, win 65535, length 0
13:21:21.720225 IP 151.101.117.140.443 > 10.0.2.15.43338: Flags [P.], seq 270470:278674, ack 820, win 65535, length 8204
13:21:21.720236 IP 10.0.2.15.43338 > 151.101.117.140.443: Flags [.], ack 278674, win 65535, length 0
13:21:21.721327 IP 151.101.117.140.443 > 10.0.2.15.43338: Flags [P.], seq 278674:288292, ack 820, win 65535, length 9618
13:21:21.721330 IP 151.101.117.140.443 > 10.0.2.15.43338: Flags [P.], seq 288292:296479, ack 820, win 65535, length 8187
13:21:21.721351 IP 10.0.2.15.43338 > 151.101.117.140.443: Flags [.], ack 288292, win 65535, length 0
13:21:21.721376 IP 10.0.2.15.43338 > 151.101.117.140.443: Flags [.], ack 296479, win 65535, length 0
13:21:21.721400 IP 151.101.117.140.443 > 10.0.2.15.43338: Flags [P.], seq 296479:303349, ack 820, win 65535, length 6870
13:21:21.721404 IP 10.0.2.15.43338 > 151.101.117.140.443: Flags [.], ack 303349, win 65535, length 0
13:21:21.721944 IP 151.101.117.140.443 > 10.0.2.15.43338: Flags [P.], seq 303349:312916, ack 820, win 65535, length 9567
13:21:21.721960 IP 10.0.2.15.43338 > 151.101.117.140.443: Flags [.], ack 312916, win 65535, length 0
13:21:21.722154 IP 151.101.117.140.443 > 10.0.2.15.43338: Flags [P.], seq 312916:319786, ack 820, win 65535, length 6870
13:21:21.722170 IP 10.0.2.15.43338 > 151.101.117.140.443: Flags [.], ack 319786, win 65535, length 0
13:21:21.722379 IP 151.101.117.140.443 > 10.0.2.15.43338: Flags [P.], seq 319786:324898, ack 820, win 65535, length 5112
13:21:21.722435 IP 10.0.2.15.43338 > 151.101.117.140.443: Flags [.], ack 324898, win 65535, length 0
13:21:21.722717 IP 151.101.117.140.443 > 10.0.2.15.43338: Flags [P.], seq 324898:337207, ack 820, win 65535, length 12309
13:21:21.722728 IP 10.0.2.15.43338 > 151.101.117.140.443: Flags [.], ack 337207, win 65535, length 0
13:21:21.723714 IP 151.101.117.140.443 > 10.0.2.15.43338: Flags [P.], seq 337207:345451, ack 820, win 65535, length 8244
13:21:21.723948 IP 10.0.2.15.43338 > 151.101.117.140.443: Flags [.], ack 345451, win 65535, length 0
13:21:21.724190 IP 151.101.117.140.443 > 10.0.2.15.43338: Flags [P.], seq 345451:349573, ack 820, win 65535, length 4122
13:21:21.724193 IP 151.101.117.140.443 > 10.0.2.15.43338: Flags [P.], seq 349573:357817, ack 820, win 65535, length 8244
13:21:21.724207 IP 10.0.2.15.43338 > 151.101.117.140.443: Flags [.], ack 349573, win 65535, length 0
13:21:21.724224 IP 10.0.2.15.43338 > 151.101.117.140.443: Flags [.], ack 357817, win 65535, length 0
13:21:21.724577 IP 151.101.117.140.443 > 10.0.2.15.43338: Flags [P.], seq 357817:366061, ack 820, win 65535, length 8244
13:21:21.724588 IP 10.0.2.15.43338 > 151.101.117.140.443: Flags [.], ack 366061, win 65535, length 0
13:21:21.724850 IP 151.101.117.140.443 > 10.0.2.15.43338: Flags [P.], seq 366061:374203, ack 820, win 65535, length 8142
13:21:21.724860 IP 10.0.2.15.43338 > 151.101.117.140.443: Flags [.], ack 374203, win 65535, length 0
13:21:21.725180 IP 151.101.117.140.443 > 10.0.2.15.43338: Flags [P.], seq 374203:379699, ack 820, win 65535, length 5496
13:21:21.725190 IP 10.0.2.15.43338 > 151.101.117.140.443: Flags [.], ack 379699, win 65535, length 0
13:21:21.725601 IP 151.101.117.140.443 > 10.0.2.15.43338: Flags [P.], seq 379699:387884, ack 820, win 65535, length 8185
13:21:21.725615 IP 10.0.2.15.43338 > 151.101.117.140.443: Flags [.], ack 387884, win 65535, length 0
13:21:21.725937 IP 151.101.117.140.443 > 10.0.2.15.43338: Flags [P.], seq 387884:396097, ack 820, win 65535, length 8213
13:21:21.725950 IP 10.0.2.15.43338 > 151.101.117.140.443: Flags [.], ack 396097, win 65535, length 0
13:21:21.726318 IP 151.101.117.140.443 > 10.0.2.15.43338: Flags [.], seq 396097:401937, ack 820, win 65535, length 5840
13:21:21.726330 IP 10.0.2.15.43338 > 151.101.117.140.443: Flags [.], ack 401937, win 65535, length 0
13:21:21.726599 IP 151.101.117.140.443 > 10.0.2.15.43338: Flags [P.], seq 401937:404322, ack 820, win 65535, length 2385
13:21:21.726601 IP 151.101.117.140.443 > 10.0.2.15.43338: Flags [P.], seq 404322:412566, ack 820, win 65535, length 8244
13:21:21.726617 IP 10.0.2.15.43338 > 151.101.117.140.443: Flags [.], ack 404322, win 65535, length 0
13:21:21.726681 IP 10.0.2.15.43338 > 151.101.117.140.443: Flags [.], ack 412566, win 65535, length 0
13:21:21.726984 IP 151.101.117.140.443 > 10.0.2.15.43338: Flags [P.], seq 412566:418062, ack 820, win 65535, length 5496
13:21:21.726996 IP 10.0.2.15.43338 > 151.101.117.140.443: Flags [.], ack 418062, win 65535, length 0
13:21:21.727402 IP 151.101.117.140.443 > 10.0.2.15.43338: Flags [P.], seq 418062:424932, ack 820, win 65535, length 6870
13:21:21.727414 IP 10.0.2.15.43338 > 151.101.117.140.443: Flags [.], ack 424932, win 65535, length 0
13:21:21.728221 IP 151.101.117.140.443 > 10.0.2.15.43338: Flags [P.], seq 424932:430428, ack 820, win 65535, length 5496
13:21:21.728234 IP 10.0.2.15.43338 > 151.101.117.140.443: Flags [.], ack 430428, win 65535, length 0
13:21:21.733833 IP 151.101.117.140.443 > 10.0.2.15.43338: Flags [P.], seq 430428:441420, ack 820, win 65535, length 10992
13:21:21.733851 IP 10.0.2.15.43338 > 151.101.117.140.443: Flags [.], ack 441420, win 65535, length 0
13:21:21.734419 IP 151.101.117.140.443 > 10.0.2.15.43338: Flags [P.], seq 441420:449664, ack 820, win 65535, length 8244
13:21:21.734476 IP 151.101.117.140.443 > 10.0.2.15.43338: Flags [P.], seq 449664:456534, ack 820, win 65535, length 6870
13:21:21.734495 IP 10.0.2.15.43338 > 151.101.117.140.443: Flags [.], ack 449664, win 65535, length 0
13:21:21.734545 IP 10.0.2.15.43338 > 151.101.117.140.443: Flags [.], ack 456534, win 65535, length 0
13:21:21.734800 IP 151.101.117.140.443 > 10.0.2.15.43338: Flags [P.], seq 456534:466152, ack 820, win 65535, length 9618
13:21:21.734809 IP 10.0.2.15.43338 > 151.101.117.140.443: Flags [.], ack 466152, win 65535, length 0
13:21:21.736814 IP 151.101.117.140.443 > 10.0.2.15.43338: Flags [P.], seq 466152:473022, ack 820, win 65535, length 6870
13:21:21.736831 IP 10.0.2.15.43338 > 151.101.117.140.443: Flags [.], ack 473022, win 65535, length 0
13:21:21.737219 IP 151.101.117.140.443 > 10.0.2.15.43338: Flags [P.], seq 473022:482640, ack 820, win 65535, length 9618
13:21:21.737234 IP 10.0.2.15.43338 > 151.101.117.140.443: Flags [.], ack 482640, win 65535, length 0
13:21:21.737469 IP 151.101.117.140.443 > 10.0.2.15.43338: Flags [P.], seq 482640:488136, ack 820, win 65535, length 5496
13:21:21.737479 IP 10.0.2.15.43338 > 151.101.117.140.443: Flags [.], ack 488136, win 65535, length 0
13:21:21.737971 IP 151.101.117.140.443 > 10.0.2.15.43338: Flags [P.], seq 488136:497754, ack 820, win 65535, length 9618
13:21:21.737983 IP 10.0.2.15.43338 > 151.101.117.140.443: Flags [.], ack 497754, win 65535, length 0
13:21:21.739992 IP 151.101.117.140.443 > 10.0.2.15.43338: Flags [P.], seq 497754:508746, ack 820, win 65535, length 10992
13:21:21.740009 IP 10.0.2.15.43338 > 151.101.117.140.443: Flags [.], ack 508746, win 65535, length 0
13:21:21.740173 IP 151.101.117.140.443 > 10.0.2.15.43338: Flags [P.], seq 508746:516990, ack 820, win 65535, length 8244
13:21:21.740175 IP 151.101.117.140.443 > 10.0.2.15.43338: Flags [P.], seq 516990:522486, ack 820, win 65535, length 5496
13:21:21.740191 IP 10.0.2.15.43338 > 151.101.117.140.443: Flags [.], ack 516990, win 65535, length 0
13:21:21.740211 IP 10.0.2.15.43338 > 151.101.117.140.443: Flags [.], ack 522486, win 65535, length 0
13:21:21.740230 IP 151.101.117.140.443 > 10.0.2.15.43338: Flags [P.], seq 522486:527982, ack 820, win 65535, length 5496
13:21:21.740233 IP 10.0.2.15.43338 > 151.101.117.140.443: Flags [.], ack 527982, win 65535, length 0
13:21:21.740598 IP 151.101.117.140.443 > 10.0.2.15.43338: Flags [P.], seq 527982:530730, ack 820, win 65535, length 2748
13:21:21.740610 IP 10.0.2.15.43338 > 151.101.117.140.443: Flags [.], ack 530730, win 65535, length 0
13:21:21.742982 IP 151.101.117.140.443 > 10.0.2.15.43338: Flags [P.], seq 530730:540348, ack 820, win 65535, length 9618
13:21:21.742986 IP 151.101.117.140.443 > 10.0.2.15.43338: Flags [P.], seq 540348:545844, ack 820, win 65535, length 5496
13:21:21.743010 IP 10.0.2.15.43338 > 151.101.117.140.443: Flags [.], ack 540348, win 65535, length 0
13:21:21.743040 IP 10.0.2.15.43338 > 151.101.117.140.443: Flags [.], ack 545844, win 65535, length 0
13:21:21.743064 IP 151.101.117.140.443 > 10.0.2.15.43338: Flags [P.], seq 545844:556836, ack 820, win 65535, length 10992
13:21:21.743068 IP 10.0.2.15.43338 > 151.101.117.140.443: Flags [.], ack 556836, win 65535, length 0
13:21:21.743435 IP 151.101.117.140.443 > 10.0.2.15.43338: Flags [P.], seq 556836:562332, ack 820, win 65535, length 5496
13:21:21.743446 IP 10.0.2.15.43338 > 151.101.117.140.443: Flags [.], ack 562332, win 65535, length 0
13:21:21.743739 IP 151.101.117.140.443 > 10.0.2.15.43338: Flags [P.], seq 562332:566454, ack 820, win 65535, length 4122
13:21:21.743751 IP 10.0.2.15.43338 > 151.101.117.140.443: Flags [.], ack 566454, win 65535, length 0
13:21:21.744947 IP 151.101.117.140.443 > 10.0.2.15.43338: Flags [P.], seq 566454:571950, ack 820, win 65535, length 5496
13:21:21.744963 IP 10.0.2.15.43338 > 151.101.117.140.443: Flags [.], ack 571950, win 65535, length 0
13:21:21.745156 IP 151.101.117.140.443 > 10.0.2.15.43338: Flags [P.], seq 571950:577446, ack 820, win 65535, length 5496
13:21:21.745167 IP 10.0.2.15.43338 > 151.101.117.140.443: Flags [.], ack 577446, win 65535, length 0
13:21:21.746853 IP 151.101.117.140.443 > 10.0.2.15.43338: Flags [P.], seq 577446:596682, ack 820, win 65535, length 19236
13:21:21.746953 IP 10.0.2.15.43338 > 151.101.117.140.443: Flags [.], ack 596682, win 65535, length 0
13:21:21.747013 IP 151.101.117.140.443 > 10.0.2.15.43338: Flags [P.], seq 596682:604926, ack 820, win 65535, length 8244
13:21:21.747020 IP 10.0.2.15.43338 > 151.101.117.140.443: Flags [.], ack 604926, win 65535, length 0
13:21:21.747120 IP 151.101.117.140.443 > 10.0.2.15.43338: Flags [P.], seq 604926:606300, ack 820, win 65535, length 1374
13:21:21.747125 IP 10.0.2.15.43338 > 151.101.117.140.443: Flags [.], ack 606300, win 65535, length 0
13:21:21.749330 IP 151.101.117.140.443 > 10.0.2.15.43338: Flags [P.], seq 606300:614544, ack 820, win 65535, length 8244
13:21:21.749344 IP 10.0.2.15.43338 > 151.101.117.140.443: Flags [.], ack 614544, win 65535, length 0
13:21:21.749756 IP 151.101.117.140.443 > 10.0.2.15.43338: Flags [P.], seq 614544:626910, ack 820, win 65535, length 12366
13:21:21.749801 IP 10.0.2.15.43338 > 151.101.117.140.443: Flags [.], ack 626910, win 65535, length 0
13:21:21.750043 IP 151.101.117.140.443 > 10.0.2.15.43338: Flags [P.], seq 626910:632406, ack 820, win 65535, length 5496
13:21:21.750055 IP 10.0.2.15.43338 > 151.101.117.140.443: Flags [.], ack 632406, win 65535, length 0
13:21:21.750332 IP 151.101.117.140.443 > 10.0.2.15.43338: Flags [P.], seq 632406:642024, ack 820, win 65535, length 9618
13:21:21.750341 IP 10.0.2.15.43338 > 151.101.117.140.443: Flags [.], ack 642024, win 65535, length 0
13:21:21.752411 IP 151.101.117.140.443 > 10.0.2.15.43338: Flags [P.], seq 642024:646146, ack 820, win 65535, length 4122
13:21:21.752425 IP 10.0.2.15.43338 > 151.101.117.140.443: Flags [.], ack 646146, win 65535, length 0
13:21:21.752588 IP 151.101.117.140.443 > 10.0.2.15.43338: Flags [.], seq 646146:647606, ack 820, win 65535, length 1460
13:21:21.752601 IP 10.0.2.15.43338 > 151.101.117.140.443: Flags [.], ack 647606, win 65535, length 0
13:21:21.753038 IP 151.101.117.140.443 > 10.0.2.15.43338: Flags [P.], seq 647606:651642, ack 820, win 65535, length 4036
13:21:21.753041 IP 151.101.117.140.443 > 10.0.2.15.43338: Flags [P.], seq 651642:664008, ack 820, win 65535, length 12366
13:21:21.753076 IP 10.0.2.15.43338 > 151.101.117.140.443: Flags [.], ack 664008, win 65535, length 0
13:21:21.753573 IP 151.101.117.140.443 > 10.0.2.15.43338: Flags [P.], seq 664008:670878, ack 820, win 65535, length 6870
13:21:21.753732 IP 10.0.2.15.43338 > 151.101.117.140.443: Flags [.], ack 670878, win 65535, length 0
13:21:21.753856 IP 151.101.117.140.443 > 10.0.2.15.43338: Flags [P.], seq 670878:680496, ack 820, win 65535, length 9618
13:21:21.753863 IP 10.0.2.15.43338 > 151.101.117.140.443: Flags [.], ack 680496, win 65535, length 0
13:21:21.753981 IP 151.101.117.140.443 > 10.0.2.15.43338: Flags [P.], seq 680496:681870, ack 820, win 65535, length 1374
13:21:21.753986 IP 10.0.2.15.43338 > 151.101.117.140.443: Flags [.], ack 681870, win 65535, length 0
13:21:21.754712 IP 151.101.117.140.443 > 10.0.2.15.43338: Flags [.], seq 681870:693550, ack 820, win 65535, length 11680
13:21:21.754771 IP 10.0.2.15.43338 > 151.101.117.140.443: Flags [.], ack 693550, win 65535, length 0
13:21:21.755033 IP 151.101.117.140.443 > 10.0.2.15.43338: Flags [P.], seq 693550:694236, ack 820, win 65535, length 686
13:21:21.755035 IP 151.101.117.140.443 > 10.0.2.15.43338: Flags [P.], seq 694236:698358, ack 820, win 65535, length 4122
13:21:21.755100 IP 10.0.2.15.43338 > 151.101.117.140.443: Flags [.], ack 694236, win 65535, length 0
13:21:21.755130 IP 10.0.2.15.43338 > 151.101.117.140.443: Flags [.], ack 698358, win 65535, length 0
13:21:21.755265 IP 151.101.117.140.443 > 10.0.2.15.43338: Flags [P.], seq 698358:701106, ack 820, win 65535, length 2748
13:21:21.755271 IP 10.0.2.15.43338 > 151.101.117.140.443: Flags [.], ack 701106, win 65535, length 0

