00:15:22.977896 IP 151.101.117.140.443 > 10.0.2.15.52986: Flags [.], seq 82432002:82434922, ack 1852743332, win 65535, length 2920
00:15:22.977921 IP 10.0.2.15.52986 > 151.101.117.140.443: Flags [.], ack 2920, win 62780, length 0
00:15:22.978073 IP 151.101.117.140.443 > 10.0.2.15.52986: Flags [P.], seq 2920:3721, ack 1, win 65535, length 801
00:15:22.978086 IP 10.0.2.15.52986 > 151.101.117.140.443: Flags [.], ack 3721, win 61979, length 0
00:15:22.978925 IP 10.0.2.15.52986 > 151.101.117.140.443: Flags [P.], seq 1:81, ack 3721, win 61979, length 80
00:15:22.979318 IP 151.101.117.140.443 > 10.0.2.15.52986: Flags [.], ack 81, win 65535, length 0
00:15:22.979504 IP 10.0.2.15.52986 > 151.101.117.140.443: Flags [P.], seq 81:127, ack 3721, win 61979, length 46
00:15:22.979543 IP 10.0.2.15.52986 > 151.101.117.140.443: Flags [P.], seq 127:176, ack 3721, win 61979, length 49
00:15:22.979733 IP 10.0.2.15.52986 > 151.101.117.140.443: Flags [P.], seq 176:211, ack 3721, win 61979, length 35
00:15:22.979868 IP 151.101.117.140.443 > 10.0.2.15.52986: Flags [.], ack 127, win 65535, length 0
00:15:22.979869 IP 151.101.117.140.443 > 10.0.2.15.52986: Flags [.], ack 176, win 65535, length 0
00:15:22.979920 IP 151.101.117.140.443 > 10.0.2.15.52986: Flags [.], ack 211, win 65535, length 0
00:15:22.979999 IP 10.0.2.15.52986 > 151.101.117.140.443: Flags [P.], seq 211:273, ack 3721, win 61979, length 62
00:15:22.980484 IP 151.101.117.140.443 > 10.0.2.15.52986: Flags [.], ack 273, win 65535, length 0
00:15:22.992554 IP 151.101.117.140.443 > 10.0.2.15.52986: Flags [P.], seq 3721:3802, ack 273, win 65535, length 81
00:15:22.992576 IP 10.0.2.15.52986 > 151.101.117.140.443: Flags [.], ack 3802, win 62780, length 0
00:15:22.992886 IP 10.0.2.15.52986 > 151.101.117.140.443: Flags [P.], seq 273:304, ack 3802, win 62780, length 31
00:15:22.993252 IP 151.101.117.140.443 > 10.0.2.15.52986: Flags [.], ack 304, win 65535, length 0
00:15:23.375670 IP 151.101.117.140.443 > 10.0.2.15.52986: Flags [.], seq 3802:11102, ack 304, win 65535, length 7300
00:15:23.375706 IP 10.0.2.15.52986 > 151.101.117.140.443: Flags [.], ack 11102, win 59860, length 0
00:15:23.375907 IP 151.101.117.140.443 > 10.0.2.15.52986: Flags [P.], seq 11102:12046, ack 304, win 65535, length 944
00:15:23.375915 IP 10.0.2.15.52986 > 151.101.117.140.443: Flags [.], ack 12046, win 58916, length 0
00:15:23.377967 IP 151.101.117.140.443 > 10.0.2.15.52986: Flags [P.], seq 12046:20290, ack 304, win 65535, length 8244
00:15:23.377990 IP 10.0.2.15.52986 > 151.101.117.140.443: Flags [.], ack 20290, win 58916, length 0
00:15:23.378847 IP 151.101.117.140.443 > 10.0.2.15.52986: Flags [P.], seq 20290:23038, ack 304, win 65535, length 2748
00:15:23.378866 IP 10.0.2.15.52986 > 151.101.117.140.443: Flags [.], ack 23038, win 62780, length 0
00:15:23.379841 IP 151.101.117.140.443 > 10.0.2.15.52986: Flags [P.], seq 23038:28534, ack 304, win 65535, length 5496
00:15:23.379860 IP 10.0.2.15.52986 > 151.101.117.140.443: Flags [.], ack 28534, win 61320, length 0
00:15:23.380932 IP 151.101.117.140.443 > 10.0.2.15.52986: Flags [P.], seq 28534:31282, ack 304, win 65535, length 2748
00:15:23.380949 IP 10.0.2.15.52986 > 151.101.117.140.443: Flags [.], ack 31282, win 62780, length 0
00:15:23.382087 IP 151.101.117.140.443 > 10.0.2.15.52986: Flags [P.], seq 31282:34030, ack 304, win 65535, length 2748
00:15:23.382106 IP 10.0.2.15.52986 > 151.101.117.140.443: Flags [.], ack 34030, win 62780, length 0
00:15:23.383110 IP 151.101.117.140.443 > 10.0.2.15.52986: Flags [P.], seq 34030:39526, ack 304, win 65535, length 5496
00:15:23.383133 IP 10.0.2.15.52986 > 151.101.117.140.443: Flags [.], ack 39526, win 61320, length 0
00:15:23.384168 IP 151.101.117.140.443 > 10.0.2.15.52986: Flags [P.], seq 39526:42274, ack 304, win 65535, length 2748
00:15:23.384189 IP 10.0.2.15.52986 > 151.101.117.140.443: Flags [.], ack 42274, win 62780, length 0
00:15:23.385436 IP 151.101.117.140.443 > 10.0.2.15.52986: Flags [P.], seq 42274:45022, ack 304, win 65535, length 2748
00:15:23.385461 IP 10.0.2.15.52986 > 151.101.117.140.443: Flags [.], ack 45022, win 62780, length 0
00:15:23.388927 IP 151.101.117.140.443 > 10.0.2.15.52986: Flags [P.], seq 45022:50518, ack 304, win 65535, length 5496
00:15:23.388951 IP 10.0.2.15.52986 > 151.101.117.140.443: Flags [.], ack 50518, win 61320, length 0
00:15:23.389776 IP 151.101.117.140.443 > 10.0.2.15.52986: Flags [P.], seq 50518:56014, ack 304, win 65535, length 5496
00:15:23.389792 IP 10.0.2.15.52986 > 151.101.117.140.443: Flags [.], ack 56014, win 61320, length 0
00:15:23.391144 IP 151.101.117.140.443 > 10.0.2.15.52986: Flags [P.], seq 56014:60136, ack 304, win 65535, length 4122
00:15:23.391166 IP 10.0.2.15.52986 > 151.101.117.140.443: Flags [.], ack 60136, win 61320, length 0
00:15:23.392057 IP 151.101.117.140.443 > 10.0.2.15.52986: Flags [P.], seq 60136:64258, ack 304, win 65535, length 4122
00:15:23.392073 IP 10.0.2.15.52986 > 151.101.117.140.443: Flags [.], ack 64258, win 61320, length 0
00:15:23.393734 IP 151.101.117.140.443 > 10.0.2.15.52986: Flags [P.], seq 64258:69754, ack 304, win 65535, length 5496
00:15:23.393758 IP 10.0.2.15.52986 > 151.101.117.140.443: Flags [.], ack 69754, win 61320, length 0
00:15:23.394424 IP 151.101.117.140.443 > 10.0.2.15.52986: Flags [P.], seq 69754:72502, ack 304, win 65535, length 2748
00:15:23.394439 IP 10.0.2.15.52986 > 151.101.117.140.443: Flags [.], ack 72502, win 65535, length 0
00:15:23.394686 IP 151.101.117.140.443 > 10.0.2.15.52986: Flags [.], seq 72502:75422, ack 304, win 65535, length 2920
00:15:23.394866 IP 10.0.2.15.52986 > 151.101.117.140.443: Flags [.], ack 75422, win 65535, length 0
00:15:23.394980 IP 151.101.117.140.443 > 10.0.2.15.52986: Flags [P.], seq 75422:77998, ack 304, win 65535, length 2576
00:15:23.394982 IP 151.101.117.140.443 > 10.0.2.15.52986: Flags [P.], seq 77998:78851, ack 304, win 65535, length 853
00:15:23.395018 IP 10.0.2.15.52986 > 151.101.117.140.443: Flags [.], ack 78851, win 65535, length 0
00:15:23.399317 IP 151.101.117.140.443 > 10.0.2.15.52986: Flags [P.], seq 78851:84347, ack 304, win 65535, length 5496
00:15:23.399322 IP 151.101.117.140.443 > 10.0.2.15.52986: Flags [P.], seq 84347:88469, ack 304, win 65535, length 4122
00:15:23.399323 IP 151.101.117.140.443 > 10.0.2.15.52986: Flags [P.], seq 88469:92591, ack 304, win 65535, length 4122
00:15:23.399446 IP 10.0.2.15.52986 > 151.101.117.140.443: Flags [.], ack 84347, win 65535, length 0
00:15:23.399503 IP 10.0.2.15.52986 > 151.101.117.140.443: Flags [.], ack 88469, win 65535, length 0
00:15:23.399524 IP 10.0.2.15.52986 > 151.101.117.140.443: Flags [.], ack 92591, win 65535, length 0
00:15:23.400703 IP 151.101.117.140.443 > 10.0.2.15.52986: Flags [P.], seq 92591:93965, ack 304, win 65535, length 1374
00:15:23.400802 IP 10.0.2.15.52986 > 151.101.117.140.443: Flags [.], ack 93965, win 65535, length 0
00:15:23.401918 IP 151.101.117.140.443 > 10.0.2.15.52986: Flags [P.], seq 93965:98087, ack 304, win 65535, length 4122
00:15:23.402142 IP 10.0.2.15.52986 > 151.101.117.140.443: Flags [.], ack 98087, win 65535, length 0
00:15:23.402819 IP 151.101.117.140.443 > 10.0.2.15.52986: Flags [P.], seq 98087:114575, ack 304, win 65535, length 16488
00:15:23.402848 IP 151.101.117.140.443 > 10.0.2.15.52986: Flags [P.], seq 114575:117323, ack 304, win 65535, length 2748
00:15:23.402998 IP 10.0.2.15.52986 > 151.101.117.140.443: Flags [.], ack 117323, win 65535, length 0
00:15:23.403427 IP 151.101.117.140.443 > 10.0.2.15.52986: Flags [P.], seq 117323:124193, ack 304, win 65535, length 6870
00:15:23.403440 IP 10.0.2.15.52986 > 151.101.117.140.443: Flags [.], ack 124193, win 65535, length 0
00:15:23.403657 IP 151.101.117.140.443 > 10.0.2.15.52986: Flags [P.], seq 124193:125567, ack 304, win 65535, length 1374
00:15:23.403667 IP 10.0.2.15.52986 > 151.101.117.140.443: Flags [.], ack 125567, win 65535, length 0
00:15:23.403863 IP 151.101.117.140.443 > 10.0.2.15.52986: Flags [P.], seq 125567:129689, ack 304, win 65535, length 4122
00:15:23.403939 IP 151.101.117.140.443 > 10.0.2.15.52986: Flags [P.], seq 129689:131063, ack 304, win 65535, length 1374
00:15:23.403960 IP 10.0.2.15.52986 > 151.101.117.140.443: Flags [.], ack 131063, win 65535, length 0
00:15:23.404308 IP 151.101.117.140.443 > 10.0.2.15.52986: Flags [P.], seq 131063:132437, ack 304, win 65535, length 1374
00:15:23.404310 IP 151.101.117.140.443 > 10.0.2.15.52986: Flags [P.], seq 132437:135185, ack 304, win 65535, length 2748
00:15:23.404323 IP 10.0.2.15.52986 > 151.101.117.140.443: Flags [.], ack 132437, win 65535, length 0
00:15:23.404418 IP 10.0.2.15.52986 > 151.101.117.140.443: Flags [.], ack 135185, win 65535, length 0
00:15:23.404527 IP 151.101.117.140.443 > 10.0.2.15.52986: Flags [P.], seq 135185:137933, ack 304, win 65535, length 2748
00:15:23.404533 IP 10.0.2.15.52986 > 151.101.117.140.443: Flags [.], ack 137933, win 65535, length 0
00:15:23.405343 IP 151.101.117.140.443 > 10.0.2.15.52986: Flags [P.], seq 137933:142055, ack 304, win 65535, length 4122
00:15:23.405353 IP 10.0.2.15.52986 > 151.101.117.140.443: Flags [.], ack 142055, win 65535, length 0
00:15:23.405495 IP 151.101.117.140.443 > 10.0.2.15.52986: Flags [P.], seq 142055:144803, ack 304, win 65535, length 2748
00:15:23.405502 IP 10.0.2.15.52986 > 151.101.117.140.443: Flags [.], ack 144803, win 65535, length 0
00:15:23.405771 IP 151.101.117.140.443 > 10.0.2.15.52986: Flags [P.], seq 144803:147551, ack 304, win 65535, length 2748
00:15:23.405783 IP 10.0.2.15.52986 > 151.101.117.140.443: Flags [.], ack 147551, win 65535, length 0
00:15:23.406011 IP 151.101.117.140.443 > 10.0.2.15.52986: Flags [P.], seq 147551:150299, ack 304, win 65535, length 2748
00:15:23.406018 IP 10.0.2.15.52986 > 151.101.117.140.443: Flags [.], ack 150299, win 65535, length 0
00:15:23.406249 IP 151.101.117.140.443 > 10.0.2.15.52986: Flags [P.], seq 150299:154421, ack 304, win 65535, length 4122
00:15:23.406250 IP 151.101.117.140.443 > 10.0.2.15.52986: Flags [P.], seq 154421:155795, ack 304, win 65535, length 1374
00:15:23.406260 IP 10.0.2.15.52986 > 151.101.117.140.443: Flags [.], ack 154421, win 65535, length 0
00:15:23.406319 IP 10.0.2.15.52986 > 151.101.117.140.443: Flags [.], ack 155795, win 65535, length 0
00:15:23.407188 IP 151.101.117.140.443 > 10.0.2.15.52986: Flags [P.], seq 155795:158543, ack 304, win 65535, length 2748
00:15:23.407189 IP 151.101.117.140.443 > 10.0.2.15.52986: Flags [P.], seq 158543:159917, ack 304, win 65535, length 1374
00:15:23.407190 IP 151.101.117.140.443 > 10.0.2.15.52986: Flags [P.], seq 159917:162665, ack 304, win 65535, length 2748
00:15:23.407190 IP 151.101.117.140.443 > 10.0.2.15.52986: Flags [P.], seq 162665:164039, ack 304, win 65535, length 1374
00:15:23.407204 IP 10.0.2.15.52986 > 151.101.117.140.443: Flags [.], ack 158543, win 65535, length 0
00:15:23.407226 IP 10.0.2.15.52986 > 151.101.117.140.443: Flags [.], ack 159917, win 65535, length 0
00:15:23.407240 IP 10.0.2.15.52986 > 151.101.117.140.443: Flags [.], ack 162665, win 65535, length 0
00:15:23.407251 IP 10.0.2.15.52986 > 151.101.117.140.443: Flags [.], ack 164039, win 65535, length 0
00:15:23.408374 IP 151.101.117.140.443 > 10.0.2.15.52986: Flags [P.], seq 164039:166787, ack 304, win 65535, length 2748
00:15:23.408386 IP 10.0.2.15.52986 > 151.101.117.140.443: Flags [.], ack 166787, win 65535, length 0
00:15:23.408652 IP 151.101.117.140.443 > 10.0.2.15.52986: Flags [P.], seq 166787:172283, ack 304, win 65535, length 5496
00:15:23.408701 IP 10.0.2.15.52986 > 151.101.117.140.443: Flags [.], ack 172283, win 65535, length 0
00:15:23.409099 IP 151.101.117.140.443 > 10.0.2.15.52986: Flags [P.], seq 172283:176405, ack 304, win 65535, length 4122
00:15:23.409102 IP 151.101.117.140.443 > 10.0.2.15.52986: Flags [.], seq 176405:177865, ack 304, win 65535, length 1460
00:15:23.409115 IP 10.0.2.15.52986 > 151.101.117.140.443: Flags [.], ack 176405, win 65535, length 0
00:15:23.409136 IP 10.0.2.15.52986 > 151.101.117.140.443: Flags [.], ack 177865, win 65535, length 0
00:15:23.409697 IP 151.101.117.140.443 > 10.0.2.15.52986: Flags [P.], seq 177865:179153, ack 304, win 65535, length 1288
00:15:23.409701 IP 151.101.117.140.443 > 10.0.2.15.52986: Flags [P.], seq 179153:180527, ack 304, win 65535, length 1374
00:15:23.409802 IP 10.0.2.15.52986 > 151.101.117.140.443: Flags [.], ack 179153, win 65535, length 0
00:15:23.409836 IP 10.0.2.15.52986 > 151.101.117.140.443: Flags [.], ack 180527, win 65535, length 0
00:15:23.410130 IP 151.101.117.140.443 > 10.0.2.15.52986: Flags [P.], seq 180527:181901, ack 304, win 65535, length 1374
00:15:23.410132 IP 151.101.117.140.443 > 10.0.2.15.52986: Flags [P.], seq 181901:184649, ack 304, win 65535, length 2748
00:15:23.410145 IP 10.0.2.15.52986 > 151.101.117.140.443: Flags [.], ack 181901, win 65535, length 0
00:15:23.410203 IP 10.0.2.15.52986 > 151.101.117.140.443: Flags [.], ack 184649, win 65535, length 0
00:15:23.410775 IP 151.101.117.140.443 > 10.0.2.15.52986: Flags [P.], seq 184649:187397, ack 304, win 65535, length 2748
00:15:23.410788 IP 10.0.2.15.52986 > 151.101.117.140.443: Flags [.], ack 187397, win 65535, length 0
00:15:23.411210 IP 151.101.117.140.443 > 10.0.2.15.52986: Flags [P.], seq 187397:188771, ack 304, win 65535, length 1374
00:15:23.411220 IP 10.0.2.15.52986 > 151.101.117.140.443: Flags [.], ack 188771, win 65535, length 0
00:15:23.415231 IP 151.101.117.140.443 > 10.0.2.15.52986: Flags [.], seq 188771:194611, ack 304, win 65535, length 5840
00:15:23.415252 IP 10.0.2.15.52986 > 151.101.117.140.443: Flags [.], ack 194611, win 65535, length 0
00:15:23.415352 IP 151.101.117.140.443 > 10.0.2.15.52986: Flags [P.], seq 194611:197015, ack 304, win 65535, length 2404
00:15:23.415353 IP 151.101.117.140.443 > 10.0.2.15.52986: Flags [P.], seq 197015:197607, ack 304, win 65535, length 592
00:15:23.415363 IP 10.0.2.15.52986 > 151.101.117.140.443: Flags [.], ack 197015, win 65535, length 0
00:15:23.415375 IP 10.0.2.15.52986 > 151.101.117.140.443: Flags [.], ack 197607, win 65535, length 0
00:15:24.632741 IP 151.101.117.140.443 > 10.0.2.15.52986: Flags [P.], seq 197607:208668, ack 304, win 65535, length 11061
00:15:24.632798 IP 10.0.2.15.52986 > 151.101.117.140.443: Flags [.], ack 208668, win 65535, length 0
00:15:24.633118 IP 151.101.117.140.443 > 10.0.2.15.52986: Flags [P.], seq 208668:215538, ack 304, win 65535, length 6870
00:15:24.633121 IP 151.101.117.140.443 > 10.0.2.15.52986: Flags [P.], seq 215538:223725, ack 304, win 65535, length 8187
00:15:24.633193 IP 10.0.2.15.52986 > 151.101.117.140.443: Flags [.], ack 215538, win 65535, length 0
00:15:24.633351 IP 10.0.2.15.52986 > 151.101.117.140.443: Flags [.], ack 223725, win 65535, length 0
00:15:24.633398 IP 151.101.117.140.443 > 10.0.2.15.52986: Flags [P.], seq 223725:230595, ack 304, win 65535, length 6870
00:15:24.633414 IP 10.0.2.15.52986 > 151.101.117.140.443: Flags [.], ack 230595, win 65535, length 0
00:15:24.633710 IP 151.101.117.140.443 > 10.0.2.15.52986: Flags [P.], seq 230595:234717, ack 304, win 65535, length 4122
00:15:24.633722 IP 10.0.2.15.52986 > 151.101.117.140.443: Flags [.], ack 234717, win 65535, length 0
00:15:24.634393 IP 151.101.117.140.443 > 10.0.2.15.52986: Flags [P.], seq 234717:238798, ack 304, win 65535, length 4081
00:15:24.634395 IP 151.101.117.140.443 > 10.0.2.15.52986: Flags [P.], seq 238798:242920, ack 304, win 65535, length 4122
00:15:24.634417 IP 10.0.2.15.52986 > 151.101.117.140.443: Flags [.], ack 238798, win 65535, length 0
00:15:24.634439 IP 10.0.2.15.52986 > 151.101.117.140.443: Flags [.], ack 242920, win 65535, length 0
00:15:24.636535 IP 151.101.117.140.443 > 10.0.2.15.52986: Flags [P.], seq 242920:248416, ack 304, win 65535, length 5496
00:15:24.636667 IP 10.0.2.15.52986 > 151.101.117.140.443: Flags [.], ack 248416, win 65535, length 0
00:15:24.639174 IP 151.101.117.140.443 > 10.0.2.15.52986: Flags [P.], seq 248416:251164, ack 304, win 65535, length 2748
00:15:24.639287 IP 10.0.2.15.52986 > 151.101.117.140.443: Flags [.], ack 251164, win 65535, length 0
00:15:24.639569 IP 151.101.117.140.443 > 10.0.2.15.52986: Flags [P.], seq 251164:257977, ack 304, win 65535, length 6813
00:15:24.639575 IP 151.101.117.140.443 > 10.0.2.15.52986: Flags [P.], seq 257977:274559, ack 304, win 65535, length 16582
00:15:24.639598 IP 10.0.2.15.52986 > 151.101.117.140.443: Flags [.], ack 257977, win 65535, length 0
00:15:24.639621 IP 10.0.2.15.52986 > 151.101.117.140.443: Flags [.], ack 274559, win 65535, length 0
00:15:24.639643 IP 151.101.117.140.443 > 10.0.2.15.52986: Flags [P.], seq 274559:281429, ack 304, win 65535, length 6870
00:15:24.639650 IP 10.0.2.15.52986 > 151.101.117.140.443: Flags [.], ack 281429, win 65535, length 0
00:15:24.645334 IP 151.101.117.140.443 > 10.0.2.15.52986: Flags [P.], seq 281429:295112, ack 304, win 65535, length 13683
00:15:24.645362 IP 10.0.2.15.52986 > 151.101.117.140.443: Flags [.], ack 295112, win 65535, length 0
00:15:24.647484 IP 151.101.117.140.443 > 10.0.2.15.52986: Flags [P.], seq 295112:301982, ack 304, win 65535, length 6870
00:15:24.647488 IP 151.101.117.140.443 > 10.0.2.15.52986: Flags [P.], seq 301982:306053, ack 304, win 65535, length 4071
00:15:24.647517 IP 10.0.2.15.52986 > 151.101.117.140.443: Flags [.], ack 301982, win 65535, length 0
00:15:24.647546 IP 10.0.2.15.52986 > 151.101.117.140.443: Flags [.], ack 306053, win 65535, length 0
00:15:24.647564 IP 151.101.117.140.443 > 10.0.2.15.52986: Flags [P.], seq 306053:308801, ack 304, win 65535, length 2748
00:15:24.647564 IP 151.101.117.140.443 > 10.0.2.15.52986: Flags [P.], seq 308801:311549, ack 304, win 65535, length 2748
00:15:24.647566 IP 151.101.117.140.443 > 10.0.2.15.52986: Flags [P.], seq 311549:317045, ack 304, win 65535, length 5496
00:15:24.647667 IP 10.0.2.15.52986 > 151.101.117.140.443: Flags [.], ack 308801, win 65535, length 0
00:15:24.647691 IP 10.0.2.15.52986 > 151.101.117.140.443: Flags [.], ack 311549, win 65535, length 0
00:15:24.647704 IP 10.0.2.15.52986 > 151.101.117.140.443: Flags [.], ack 317045, win 65535, length 0
00:15:24.650303 IP 151.101.117.140.443 > 10.0.2.15.52986: Flags [P.], seq 317045:359385, ack 304, win 65535, length 42340
00:15:24.650321 IP 10.0.2.15.52986 > 151.101.117.140.443: Flags [.], ack 359385, win 65535, length 0
00:15:24.651441 IP 151.101.117.140.443 > 10.0.2.15.52986: Flags [.], seq 359385:414865, ack 304, win 65535, length 55480
00:15:24.651476 IP 10.0.2.15.52986 > 151.101.117.140.443: Flags [.], ack 414865, win 65535, length 0
00:15:24.651630 IP 151.101.117.140.443 > 10.0.2.15.52986: Flags [P.], seq 414865:425085, ack 304, win 65535, length 10220
00:15:24.651638 IP 10.0.2.15.52986 > 151.101.117.140.443: Flags [.], ack 425085, win 65535, length 0
00:15:24.651781 IP 151.101.117.140.443 > 10.0.2.15.52986: Flags [P.], seq 425085:436161, ack 304, win 65535, length 11076
00:15:24.651803 IP 10.0.2.15.52986 > 151.101.117.140.443: Flags [.], ack 436161, win 65535, length 0
00:15:24.652007 IP 151.101.117.140.443 > 10.0.2.15.52986: Flags [P.], seq 436161:438909, ack 304, win 65535, length 2748
00:15:24.652019 IP 10.0.2.15.52986 > 151.101.117.140.443: Flags [.], ack 438909, win 65535, length 0
00:15:24.652128 IP 151.101.117.140.443 > 10.0.2.15.52986: Flags [P.], seq 438909:440283, ack 304, win 65535, length 1374
00:15:24.652134 IP 10.0.2.15.52986 > 151.101.117.140.443: Flags [.], ack 440283, win 65535, length 0
00:15:24.652417 IP 151.101.117.140.443 > 10.0.2.15.52986: Flags [P.], seq 440283:443031, ack 304, win 65535, length 2748
00:15:24.652418 IP 151.101.117.140.443 > 10.0.2.15.52986: Flags [P.], seq 443031:444405, ack 304, win 65535, length 1374
00:15:24.652429 IP 10.0.2.15.52986 > 151.101.117.140.443: Flags [.], ack 443031, win 65535, length 0
00:15:24.652443 IP 10.0.2.15.52986 > 151.101.117.140.443: Flags [.], ack 444405, win 65535, length 0
00:15:24.653449 IP 151.101.117.140.443 > 10.0.2.15.52986: Flags [P.], seq 444405:447153, ack 304, win 65535, length 2748
00:15:24.653451 IP 151.101.117.140.443 > 10.0.2.15.52986: Flags [P.], seq 447153:451275, ack 304, win 65535, length 4122
00:15:24.653461 IP 151.101.117.140.443 > 10.0.2.15.52986: Flags [P.], seq 451275:452649, ack 304, win 65535, length 1374
00:15:24.653462 IP 151.101.117.140.443 > 10.0.2.15.52986: Flags [P.], seq 452649:454023, ack 304, win 65535, length 1374
00:15:24.653479 IP 10.0.2.15.52986 > 151.101.117.140.443: Flags [.], ack 447153, win 65535, length 0
00:15:24.653499 IP 10.0.2.15.52986 > 151.101.117.140.443: Flags [.], ack 451275, win 65535, length 0
00:15:24.653512 IP 10.0.2.15.52986 > 151.101.117.140.443: Flags [.], ack 452649, win 65535, length 0
00:15:24.653624 IP 10.0.2.15.52986 > 151.101.117.140.443: Flags [.], ack 454023, win 65535, length 0
00:15:24.654115 IP 151.101.117.140.443 > 10.0.2.15.52986: Flags [P.], seq 454023:459519, ack 304, win 65535, length 5496
00:15:24.654268 IP 10.0.2.15.52986 > 151.101.117.140.443: Flags [.], ack 459519, win 65535, length 0
00:15:24.654445 IP 151.101.117.140.443 > 10.0.2.15.52986: Flags [P.], seq 459519:462267, ack 304, win 65535, length 2748
00:15:24.654447 IP 151.101.117.140.443 > 10.0.2.15.52986: Flags [P.], seq 462267:467763, ack 304, win 65535, length 5496
00:15:24.654466 IP 10.0.2.15.52986 > 151.101.117.140.443: Flags [.], ack 462267, win 65535, length 0
00:15:24.654544 IP 10.0.2.15.52986 > 151.101.117.140.443: Flags [.], ack 467763, win 65535, length 0
00:15:24.655201 IP 151.101.117.140.443 > 10.0.2.15.52986: Flags [P.], seq 467763:470511, ack 304, win 65535, length 2748
00:15:24.655206 IP 151.101.117.140.443 > 10.0.2.15.52986: Flags [P.], seq 470511:477381, ack 304, win 65535, length 6870
00:15:24.655226 IP 10.0.2.15.52986 > 151.101.117.140.443: Flags [.], ack 470511, win 65535, length 0
00:15:24.655250 IP 10.0.2.15.52986 > 151.101.117.140.443: Flags [.], ack 477381, win 65535, length 0
00:15:24.655707 IP 151.101.117.140.443 > 10.0.2.15.52986: Flags [P.], seq 477381:480129, ack 304, win 65535, length 2748
00:15:24.655723 IP 10.0.2.15.52986 > 151.101.117.140.443: Flags [.], ack 480129, win 65535, length 0
00:15:24.659408 IP 151.101.117.140.443 > 10.0.2.15.52986: Flags [P.], seq 480129:510357, ack 304, win 65535, length 30228
00:15:24.659595 IP 10.0.2.15.52986 > 151.101.117.140.443: Flags [.], ack 510357, win 65535, length 0
00:15:24.659641 IP 151.101.117.140.443 > 10.0.2.15.52986: Flags [P.], seq 510357:514479, ack 304, win 65535, length 4122
00:15:24.659649 IP 10.0.2.15.52986 > 151.101.117.140.443: Flags [.], ack 514479, win 65535, length 0
00:15:24.660247 IP 151.101.117.140.443 > 10.0.2.15.52986: Flags [P.], seq 514479:529593, ack 304, win 65535, length 15114
00:15:24.660265 IP 10.0.2.15.52986 > 151.101.117.140.443: Flags [.], ack 529593, win 65535, length 0
00:15:24.660365 IP 151.101.117.140.443 > 10.0.2.15.52986: Flags [P.], seq 529593:530967, ack 304, win 65535, length 1374
00:15:24.660373 IP 10.0.2.15.52986 > 151.101.117.140.443: Flags [.], ack 530967, win 65535, length 0
00:15:24.661213 IP 151.101.117.140.443 > 10.0.2.15.52986: Flags [P.], seq 530967:535089, ack 304, win 65535, length 4122
00:15:24.661481 IP 10.0.2.15.52986 > 151.101.117.140.443: Flags [.], ack 535089, win 65535, length 0
00:15:24.661708 IP 151.101.117.140.443 > 10.0.2.15.52986: Flags [P.], seq 535089:540585, ack 304, win 65535, length 5496
00:15:24.661711 IP 151.101.117.140.443 > 10.0.2.15.52986: Flags [P.], seq 540585:544707, ack 304, win 65535, length 4122
00:15:24.661727 IP 10.0.2.15.52986 > 151.101.117.140.443: Flags [.], ack 540585, win 65535, length 0
00:15:24.661997 IP 10.0.2.15.52986 > 151.101.117.140.443: Flags [.], ack 544707, win 65535, length 0
00:15:24.662581 IP 151.101.117.140.443 > 10.0.2.15.52986: Flags [P.], seq 544707:546081, ack 304, win 65535, length 1374
00:15:24.662584 IP 151.101.117.140.443 > 10.0.2.15.52986: Flags [P.], seq 546081:550203, ack 304, win 65535, length 4122
00:15:24.662585 IP 151.101.117.140.443 > 10.0.2.15.52986: Flags [P.], seq 550203:552951, ack 304, win 65535, length 2748
00:15:24.662602 IP 10.0.2.15.52986 > 151.101.117.140.443: Flags [.], ack 546081, win 65535, length 0
00:15:24.662617 IP 10.0.2.15.52986 > 151.101.117.140.443: Flags [.], ack 550203, win 65535, length 0
00:15:24.662629 IP 10.0.2.15.52986 > 151.101.117.140.443: Flags [.], ack 552951, win 65535, length 0
00:15:24.663555 IP 151.101.117.140.443 > 10.0.2.15.52986: Flags [P.], seq 552951:558447, ack 304, win 65535, length 5496
00:15:24.663557 IP 151.101.117.140.443 > 10.0.2.15.52986: Flags [P.], seq 558447:561195, ack 304, win 65535, length 2748
00:15:24.663581 IP 10.0.2.15.52986 > 151.101.117.140.443: Flags [.], ack 558447, win 65535, length 0
00:15:24.663656 IP 10.0.2.15.52986 > 151.101.117.140.443: Flags [.], ack 561195, win 65535, length 0
00:15:24.663935 IP 151.101.117.140.443 > 10.0.2.15.52986: Flags [P.], seq 561195:566691, ack 304, win 65535, length 5496
00:15:24.663946 IP 10.0.2.15.52986 > 151.101.117.140.443: Flags [.], ack 566691, win 65535, length 0
00:15:24.664136 IP 151.101.117.140.443 > 10.0.2.15.52986: Flags [P.], seq 566691:569439, ack 304, win 65535, length 2748
00:15:24.664145 IP 10.0.2.15.52986 > 151.101.117.140.443: Flags [.], ack 569439, win 65535, length 0
00:15:24.664351 IP 151.101.117.140.443 > 10.0.2.15.52986: Flags [P.], seq 569439:572187, ack 304, win 65535, length 2748
00:15:24.664365 IP 10.0.2.15.52986 > 151.101.117.140.443: Flags [.], ack 572187, win 65535, length 0
00:15:24.664482 IP 151.101.117.140.443 > 10.0.2.15.52986: Flags [P.], seq 572187:574935, ack 304, win 65535, length 2748
00:15:24.664490 IP 10.0.2.15.52986 > 151.101.117.140.443: Flags [.], ack 574935, win 65535, length 0
00:15:24.665448 IP 151.101.117.140.443 > 10.0.2.15.52986: Flags [P.], seq 574935:581805, ack 304, win 65535, length 6870
00:15:24.665472 IP 10.0.2.15.52986 > 151.101.117.140.443: Flags [.], ack 581805, win 65535, length 0
00:15:24.665760 IP 151.101.117.140.443 > 10.0.2.15.52986: Flags [P.], seq 581805:583179, ack 304, win 65535, length 1374
00:15:24.665763 IP 151.101.117.140.443 > 10.0.2.15.52986: Flags [P.], seq 583179:585927, ack 304, win 65535, length 2748
00:15:24.665785 IP 10.0.2.15.52986 > 151.101.117.140.443: Flags [.], ack 583179, win 65535, length 0
00:15:24.665807 IP 10.0.2.15.52986 > 151.101.117.140.443: Flags [.], ack 585927, win 65535, length 0
00:15:24.665955 IP 151.101.117.140.443 > 10.0.2.15.52986: Flags [P.], seq 585927:587301, ack 304, win 65535, length 1374
00:15:24.665963 IP 10.0.2.15.52986 > 151.101.117.140.443: Flags [.], ack 587301, win 65535, length 0
00:15:24.666841 IP 151.101.117.140.443 > 10.0.2.15.52986: Flags [P.], seq 587301:588675, ack 304, win 65535, length 1374
00:15:24.666898 IP 10.0.2.15.52986 > 151.101.117.140.443: Flags [.], ack 588675, win 65535, length 0
00:15:24.668022 IP 151.101.117.140.443 > 10.0.2.15.52986: Flags [P.], seq 588675:598293, ack 304, win 65535, length 9618
00:15:24.668134 IP 10.0.2.15.52986 > 151.101.117.140.443: Flags [.], ack 598293, win 65535, length 0
00:15:24.668599 IP 151.101.117.140.443 > 10.0.2.15.52986: Flags [P.], seq 598293:599667, ack 304, win 65535, length 1374
00:15:24.668602 IP 151.101.117.140.443 > 10.0.2.15.52986: Flags [P.], seq 599667:603789, ack 304, win 65535, length 4122
00:15:24.668654 IP 10.0.2.15.52986 > 151.101.117.140.443: Flags [.], ack 599667, win 65535, length 0
00:15:24.668748 IP 10.0.2.15.52986 > 151.101.117.140.443: Flags [.], ack 603789, win 65535, length 0
00:15:24.670107 IP 151.101.117.140.443 > 10.0.2.15.52986: Flags [P.], seq 603789:607911, ack 304, win 65535, length 4122
00:15:24.670132 IP 10.0.2.15.52986 > 151.101.117.140.443: Flags [.], ack 607911, win 65535, length 0
00:15:24.672579 IP 151.101.117.140.443 > 10.0.2.15.52986: Flags [P.], seq 607911:612033, ack 304, win 65535, length 4122
00:15:24.672583 IP 151.101.117.140.443 > 10.0.2.15.52986: Flags [P.], seq 612033:614781, ack 304, win 65535, length 2748
00:15:24.672607 IP 10.0.2.15.52986 > 151.101.117.140.443: Flags [.], ack 612033, win 65535, length 0
00:15:24.672634 IP 10.0.2.15.52986 > 151.101.117.140.443: Flags [.], ack 614781, win 65535, length 0
00:15:24.672943 IP 151.101.117.140.443 > 10.0.2.15.52986: Flags [P.], seq 614781:627147, ack 304, win 65535, length 12366
00:15:24.672954 IP 10.0.2.15.52986 > 151.101.117.140.443: Flags [.], ack 627147, win 65535, length 0
00:15:24.674436 IP 151.101.117.140.443 > 10.0.2.15.52986: Flags [P.], seq 627147:632643, ack 304, win 65535, length 5496
00:15:24.674464 IP 10.0.2.15.52986 > 151.101.117.140.443: Flags [.], ack 632643, win 65535, length 0
00:15:24.674725 IP 151.101.117.140.443 > 10.0.2.15.52986: Flags [P.], seq 632643:640887, ack 304, win 65535, length 8244
00:15:24.674738 IP 10.0.2.15.52986 > 151.101.117.140.443: Flags [.], ack 640887, win 65535, length 0
00:15:24.674986 IP 151.101.117.140.443 > 10.0.2.15.52986: Flags [P.], seq 640887:645009, ack 304, win 65535, length 4122
00:15:24.674998 IP 10.0.2.15.52986 > 151.101.117.140.443: Flags [.], ack 645009, win 65535, length 0
00:15:24.675266 IP 151.101.117.140.443 > 10.0.2.15.52986: Flags [P.], seq 645009:647757, ack 304, win 65535, length 2748
00:15:24.675281 IP 10.0.2.15.52986 > 151.101.117.140.443: Flags [.], ack 647757, win 65535, length 0
00:15:24.676584 IP 151.101.117.140.443 > 10.0.2.15.52986: Flags [P.], seq 647757:650505, ack 304, win 65535, length 2748
00:15:24.676588 IP 151.101.117.140.443 > 10.0.2.15.52986: Flags [P.], seq 650505:653253, ack 304, win 65535, length 2748
00:15:24.676589 IP 151.101.117.140.443 > 10.0.2.15.52986: Flags [P.], seq 653253:654627, ack 304, win 65535, length 1374
00:15:24.676616 IP 10.0.2.15.52986 > 151.101.117.140.443: Flags [.], ack 650505, win 65535, length 0
00:15:24.677712 IP 10.0.2.15.52986 > 151.101.117.140.443: Flags [.], ack 653253, win 65535, length 0
00:15:24.677769 IP 10.0.2.15.52986 > 151.101.117.140.443: Flags [.], ack 654627, win 65535, length 0
00:15:24.679344 IP 151.101.117.140.443 > 10.0.2.15.52986: Flags [P.], seq 654627:658749, ack 304, win 65535, length 4122
00:15:24.679348 IP 151.101.117.140.443 > 10.0.2.15.52986: Flags [P.], seq 658749:662871, ack 304, win 65535, length 4122
00:15:24.679350 IP 151.101.117.140.443 > 10.0.2.15.52986: Flags [.], seq 662871:667251, ack 304, win 65535, length 4380
00:15:24.679494 IP 10.0.2.15.52986 > 151.101.117.140.443: Flags [.], ack 658749, win 65535, length 0
00:15:24.679530 IP 10.0.2.15.52986 > 151.101.117.140.443: Flags [.], ack 662871, win 65535, length 0
00:15:24.679543 IP 10.0.2.15.52986 > 151.101.117.140.443: Flags [.], ack 667251, win 65535, length 0
00:15:24.679876 IP 151.101.117.140.443 > 10.0.2.15.52986: Flags [P.], seq 667251:669741, ack 304, win 65535, length 2490
00:15:24.679879 IP 151.101.117.140.443 > 10.0.2.15.52986: Flags [P.], seq 669741:682107, ack 304, win 65535, length 12366
00:15:24.679893 IP 10.0.2.15.52986 > 151.101.117.140.443: Flags [.], ack 669741, win 65535, length 0
00:15:24.679909 IP 10.0.2.15.52986 > 151.101.117.140.443: Flags [.], ack 682107, win 65535, length 0
00:15:24.679937 IP 151.101.117.140.443 > 10.0.2.15.52986: Flags [P.], seq 682107:684855, ack 304, win 65535, length 2748
00:15:24.679938 IP 151.101.117.140.443 > 10.0.2.15.52986: Flags [P.], seq 684855:688977, ack 304, win 65535, length 4122
00:15:24.679943 IP 10.0.2.15.52986 > 151.101.117.140.443: Flags [.], ack 684855, win 65535, length 0
00:15:24.679955 IP 10.0.2.15.52986 > 151.101.117.140.443: Flags [.], ack 688977, win 65535, length 0
00:15:24.680104 IP 151.101.117.140.443 > 10.0.2.15.52986: Flags [P.], seq 688977:691725, ack 304, win 65535, length 2748
00:15:24.680111 IP 10.0.2.15.52986 > 151.101.117.140.443: Flags [.], ack 691725, win 65535, length 0

