00:16:30.520278 IP 10.0.2.15.51489 > 140.233.253.2.53: 58683+ A? www.wikipedia.com. (35)
00:16:30.520321 IP 10.0.2.15.51489 > 140.233.253.2.53: 35900+ AAAA? www.wikipedia.com. (35)
00:16:30.525241 IP 140.233.253.2.53 > 10.0.2.15.51489: 58683 2/0/0 CNAME ncredir-lb.wikimedia.org., A 208.80.154.232 (89)
00:16:30.525740 IP 140.233.253.2.53 > 10.0.2.15.51489: 35900 2/0/0 CNAME ncredir-lb.wikimedia.org., AAAA 2620:0:861:ed1a::9 (101)
00:16:30.527404 IP 10.0.2.15.46050 > 208.80.154.232.443: Flags [S], seq 3863783250, win 64240, options [mss 1460,sackOK,TS val 507299470 ecr 0,nop,wscale 6], length 0
00:16:30.567657 IP 208.80.154.232.443 > 10.0.2.15.46050: Flags [S.], seq 84800001, ack 3863783251, win 65535, options [mss 1460], length 0
00:16:30.567698 IP 10.0.2.15.46050 > 208.80.154.232.443: Flags [.], ack 1, win 64240, length 0
00:16:30.577898 IP 10.0.2.15.46050 > 208.80.154.232.443: Flags [P.], seq 1:518, ack 1, win 64240, length 517
00:16:30.578276 IP 208.80.154.232.443 > 10.0.2.15.46050: Flags [.], ack 518, win 65535, length 0

