20:10:55.520458 IP 10.0.2.15.58265 > 140.233.253.2.53: 59348+ A? www.wikipedia.com. (35)
20:10:55.520501 IP 10.0.2.15.58265 > 140.233.253.2.53: 30423+ AAAA? www.wikipedia.com. (35)
20:10:55.525394 IP 140.233.253.2.53 > 10.0.2.15.58265: 59348 2/0/0 CNAME ncredir-lb.wikimedia.org., A 208.80.154.232 (89)
20:10:55.525396 IP 140.233.253.2.53 > 10.0.2.15.58265: 30423 2/0/0 CNAME ncredir-lb.wikimedia.org., AAAA 2620:0:861:ed1a::9 (101)
20:10:55.526474 IP 10.0.2.15.46178 > 208.80.154.232.443: Flags [S], seq 645974064, win 64240, options [mss 1460,sackOK,TS val 560114380 ecr 0,nop,wscale 6], length 0
20:10:55.547432 IP 208.80.154.232.443 > 10.0.2.15.46178: Flags [S.], seq 236160001, ack 645974065, win 65535, options [mss 1460], length 0
20:10:55.547479 IP 10.0.2.15.46178 > 208.80.154.232.443: Flags [.], ack 1, win 64240, length 0
20:10:55.555084 IP 10.0.2.15.46178 > 208.80.154.232.443: Flags [P.], seq 1:518, ack 1, win 64240, length 517
20:10:55.555422 IP 208.80.154.232.443 > 10.0.2.15.46178: Flags [.], ack 518, win 65535, length 0
20:10:55.575845 IP 208.80.154.232.443 > 10.0.2.15.46178: Flags [.], seq 1:2921, ack 518, win 65535, length 2920
20:10:55.575871 IP 10.0.2.15.46178 > 208.80.154.232.443: Flags [.], ack 2921, win 62780, length 0
20:10:55.576108 IP 208.80.154.232.443 > 10.0.2.15.46178: Flags [P.], seq 2921:4097, ack 518, win 65535, length 1176
20:10:55.576123 IP 10.0.2.15.46178 > 208.80.154.232.443: Flags [.], ack 4097, win 61604, length 0
20:10:55.577669 IP 208.80.154.232.443 > 10.0.2.15.46178: Flags [P.], seq 4097:4661, ack 518, win 65535, length 564
20:10:55.577691 IP 10.0.2.15.46178 > 208.80.154.232.443: Flags [.], ack 4661, win 62780, length 0
20:10:55.579426 IP 10.0.2.15.46178 > 208.80.154.232.443: Flags [P.], seq 518:598, ack 4661, win 62780, length 80
20:10:55.579695 IP 10.0.2.15.46178 > 208.80.154.232.443: Flags [P.], seq 598:644, ack 4661, win 62780, length 46
20:10:55.579758 IP 208.80.154.232.443 > 10.0.2.15.46178: Flags [.], ack 598, win 65535, length 0
20:10:55.579808 IP 10.0.2.15.46178 > 208.80.154.232.443: Flags [P.], seq 644:693, ack 4661, win 62780, length 49
20:10:55.580231 IP 208.80.154.232.443 > 10.0.2.15.46178: Flags [.], ack 644, win 65535, length 0
20:10:55.580233 IP 208.80.154.232.443 > 10.0.2.15.46178: Flags [.], ack 693, win 65535, length 0
20:10:55.580253 IP 10.0.2.15.46178 > 208.80.154.232.443: Flags [P.], seq 693:728, ack 4661, win 62780, length 35
20:10:55.580474 IP 208.80.154.232.443 > 10.0.2.15.46178: Flags [.], ack 728, win 65535, length 0
20:10:55.580671 IP 10.0.2.15.46178 > 208.80.154.232.443: Flags [P.], seq 728:792, ack 4661, win 62780, length 64
20:10:55.581138 IP 208.80.154.232.443 > 10.0.2.15.46178: Flags [.], ack 792, win 65535, length 0
20:10:55.598216 IP 208.80.154.232.443 > 10.0.2.15.46178: Flags [P.], seq 4661:4948, ack 792, win 65535, length 287
20:10:55.598241 IP 10.0.2.15.46178 > 208.80.154.232.443: Flags [.], ack 4948, win 62780, length 0
20:10:55.600220 IP 208.80.154.232.443 > 10.0.2.15.46178: Flags [P.], seq 4948:5661, ack 792, win 65535, length 713
20:10:55.600242 IP 10.0.2.15.46178 > 208.80.154.232.443: Flags [.], ack 5661, win 62780, length 0
20:10:55.600567 IP 10.0.2.15.46178 > 208.80.154.232.443: Flags [P.], seq 792:823, ack 5661, win 62780, length 31
20:10:55.601136 IP 208.80.154.232.443 > 10.0.2.15.46178: Flags [.], ack 823, win 65535, length 0
20:10:55.601542 IP 10.0.2.15.46178 > 208.80.154.232.443: Flags [P.], seq 823:847, ack 5661, win 62780, length 24

