20:12:32.628391 IP 10.0.2.15.47924 > 140.233.253.2.53: 9327+ A? www.wikipedia.com. (35)
20:12:32.628431 IP 10.0.2.15.47924 > 140.233.253.2.53: 5228+ AAAA? www.wikipedia.com. (35)
20:12:32.635187 IP 140.233.253.2.53 > 10.0.2.15.47924: 9327 2/0/0 CNAME ncredir-lb.wikimedia.org., A 208.80.154.232 (89)
20:12:32.635189 IP 140.233.253.2.53 > 10.0.2.15.47924: 5228 2/0/0 CNAME ncredir-lb.wikimedia.org., AAAA 2620:0:861:ed1a::9 (101)
20:12:32.635746 IP 10.0.2.15.46224 > 208.80.154.232.443: Flags [S], seq 2029044095, win 64240, options [mss 1460,sackOK,TS val 560211489 ecr 0,nop,wscale 6], length 0
20:12:32.655247 IP 208.80.154.232.443 > 10.0.2.15.46224: Flags [S.], seq 238464001, ack 2029044096, win 65535, options [mss 1460], length 0
20:12:32.655283 IP 10.0.2.15.46224 > 208.80.154.232.443: Flags [.], ack 1, win 64240, length 0
20:12:32.663502 IP 10.0.2.15.46224 > 208.80.154.232.443: Flags [P.], seq 1:518, ack 1, win 64240, length 517
20:12:32.663774 IP 208.80.154.232.443 > 10.0.2.15.46224: Flags [.], ack 518, win 65535, length 0
20:12:32.687675 IP 208.80.154.232.443 > 10.0.2.15.46224: Flags [.], seq 1:2921, ack 518, win 65535, length 2920
20:12:32.687695 IP 10.0.2.15.46224 > 208.80.154.232.443: Flags [.], ack 2921, win 62780, length 0
20:12:32.687849 IP 208.80.154.232.443 > 10.0.2.15.46224: Flags [P.], seq 2921:4660, ack 518, win 65535, length 1739
20:12:32.687863 IP 10.0.2.15.46224 > 208.80.154.232.443: Flags [.], ack 4660, win 61320, length 0
20:12:32.690663 IP 10.0.2.15.46224 > 208.80.154.232.443: Flags [P.], seq 518:598, ack 4660, win 62780, length 80
20:12:32.691493 IP 208.80.154.232.443 > 10.0.2.15.46224: Flags [.], ack 598, win 65535, length 0
20:12:32.691538 IP 10.0.2.15.46224 > 208.80.154.232.443: Flags [P.], seq 598:644, ack 4660, win 62780, length 46
20:12:32.691573 IP 10.0.2.15.46224 > 208.80.154.232.443: Flags [P.], seq 644:693, ack 4660, win 62780, length 49
20:12:32.691797 IP 10.0.2.15.46224 > 208.80.154.232.443: Flags [P.], seq 693:792, ack 4660, win 62780, length 99
20:12:32.691919 IP 208.80.154.232.443 > 10.0.2.15.46224: Flags [.], ack 644, win 65535, length 0
20:12:32.691920 IP 208.80.154.232.443 > 10.0.2.15.46224: Flags [.], ack 693, win 65535, length 0
20:12:32.692097 IP 208.80.154.232.443 > 10.0.2.15.46224: Flags [.], ack 792, win 65535, length 0
20:12:32.710063 IP 208.80.154.232.443 > 10.0.2.15.46224: Flags [P.], seq 4660:5305, ack 792, win 65535, length 645
20:12:32.710096 IP 10.0.2.15.46224 > 208.80.154.232.443: Flags [.], ack 5305, win 62780, length 0
20:12:32.710715 IP 10.0.2.15.46224 > 208.80.154.232.443: Flags [P.], seq 792:823, ack 5305, win 62780, length 31
20:12:32.712648 IP 208.80.154.232.443 > 10.0.2.15.46224: Flags [.], ack 823, win 65535, length 0
20:12:32.713017 IP 208.80.154.232.443 > 10.0.2.15.46224: Flags [P.], seq 5305:5660, ack 823, win 65535, length 355
20:12:32.713032 IP 10.0.2.15.46224 > 208.80.154.232.443: Flags [.], ack 5660, win 62780, length 0
20:12:32.713605 IP 10.0.2.15.46224 > 208.80.154.232.443: Flags [P.], seq 823:847, ack 5660, win 62780, length 24
20:12:32.713883 IP 208.80.154.232.443 > 10.0.2.15.46224: Flags [.], ack 847, win 65535, length 0
20:12:32.714446 IP 10.0.2.15.46224 > 208.80.154.232.443: Flags [F.], seq 847, ack 5660, win 62780, length 0
20:12:32.714808 IP 208.80.154.232.443 > 10.0.2.15.46224: Flags [.], ack 848, win 65535, length 0

