20:09:20.037445 IP 10.0.2.15.55753 > 140.233.253.2.53: 43141+ A? www.wikipedia.com. (35)
20:09:20.037480 IP 10.0.2.15.55753 > 140.233.253.2.53: 62872+ AAAA? www.wikipedia.com. (35)
20:09:20.046254 IP 140.233.253.2.53 > 10.0.2.15.55753: 43141 2/0/0 CNAME ncredir-lb.wikimedia.org., A 208.80.154.232 (89)
20:09:20.046255 IP 140.233.253.2.53 > 10.0.2.15.55753: 62872 2/0/0 CNAME ncredir-lb.wikimedia.org., AAAA 2620:0:861:ed1a::9 (101)
20:09:20.046638 IP 10.0.2.15.46140 > 208.80.154.232.443: Flags [S], seq 1489030654, win 64240, options [mss 1460,sackOK,TS val 560018900 ecr 0,nop,wscale 6], length 0
20:09:20.066019 IP 208.80.154.232.443 > 10.0.2.15.46140: Flags [S.], seq 233856001, ack 1489030655, win 65535, options [mss 1460], length 0
20:09:20.066076 IP 10.0.2.15.46140 > 208.80.154.232.443: Flags [.], ack 1, win 64240, length 0
20:09:20.077894 IP 10.0.2.15.46140 > 208.80.154.232.443: Flags [P.], seq 1:518, ack 1, win 64240, length 517
20:09:20.078198 IP 208.80.154.232.443 > 10.0.2.15.46140: Flags [.], ack 518, win 65535, length 0

