20:10:18.448812 IP 10.0.2.15.44300 > 140.233.253.2.53: 14321+ A? www.wikipedia.com. (35)
20:10:18.448860 IP 10.0.2.15.44300 > 140.233.253.2.53: 46590+ AAAA? www.wikipedia.com. (35)
20:10:18.454629 IP 140.233.253.2.53 > 10.0.2.15.44300: 14321 2/0/0 CNAME ncredir-lb.wikimedia.org., A 208.80.154.232 (89)
20:10:18.455993 IP 140.233.253.2.53 > 10.0.2.15.44300: 46590 2/0/0 CNAME ncredir-lb.wikimedia.org., AAAA 2620:0:861:ed1a::9 (101)
20:10:18.456431 IP 10.0.2.15.46164 > 208.80.154.232.443: Flags [S], seq 65308623, win 64240, options [mss 1460,sackOK,TS val 560077310 ecr 0,nop,wscale 6], length 0
20:10:18.475292 IP 208.80.154.232.443 > 10.0.2.15.46164: Flags [S.], seq 235264001, ack 65308624, win 65535, options [mss 1460], length 0
20:10:18.475338 IP 10.0.2.15.46164 > 208.80.154.232.443: Flags [.], ack 1, win 64240, length 0
20:10:18.487090 IP 10.0.2.15.46164 > 208.80.154.232.443: Flags [P.], seq 1:518, ack 1, win 64240, length 517
20:10:18.487455 IP 208.80.154.232.443 > 10.0.2.15.46164: Flags [.], ack 518, win 65535, length 0
20:10:18.507940 IP 208.80.154.232.443 > 10.0.2.15.46164: Flags [.], seq 1:2921, ack 518, win 65535, length 2920
20:10:18.507962 IP 10.0.2.15.46164 > 208.80.154.232.443: Flags [.], ack 2921, win 62780, length 0
20:10:18.508440 IP 208.80.154.232.443 > 10.0.2.15.46164: Flags [P.], seq 2921:4097, ack 518, win 65535, length 1176
20:10:18.508466 IP 10.0.2.15.46164 > 208.80.154.232.443: Flags [.], ack 4097, win 61604, length 0
20:10:18.508717 IP 208.80.154.232.443 > 10.0.2.15.46164: Flags [P.], seq 4097:4661, ack 518, win 65535, length 564
20:10:18.508730 IP 10.0.2.15.46164 > 208.80.154.232.443: Flags [.], ack 4661, win 61320, length 0
20:10:18.510144 IP 10.0.2.15.46164 > 208.80.154.232.443: Flags [P.], seq 518:598, ack 4661, win 62780, length 80
20:10:18.510624 IP 208.80.154.232.443 > 10.0.2.15.46164: Flags [.], ack 598, win 65535, length 0
20:10:18.510788 IP 10.0.2.15.46164 > 208.80.154.232.443: Flags [P.], seq 598:644, ack 4661, win 62780, length 46
20:10:18.510816 IP 10.0.2.15.46164 > 208.80.154.232.443: Flags [P.], seq 644:693, ack 4661, win 62780, length 49
20:10:18.511040 IP 208.80.154.232.443 > 10.0.2.15.46164: Flags [.], ack 644, win 65535, length 0
20:10:18.511041 IP 208.80.154.232.443 > 10.0.2.15.46164: Flags [.], ack 693, win 65535, length 0
20:10:18.511055 IP 10.0.2.15.46164 > 208.80.154.232.443: Flags [P.], seq 693:792, ack 4661, win 62780, length 99
20:10:18.511192 IP 208.80.154.232.443 > 10.0.2.15.46164: Flags [.], ack 792, win 65535, length 0
20:10:18.528081 IP 208.80.154.232.443 > 10.0.2.15.46164: Flags [P.], seq 4661:5297, ack 792, win 65535, length 636
20:10:18.528189 IP 10.0.2.15.46164 > 208.80.154.232.443: Flags [.], ack 5297, win 62780, length 0
20:10:18.528924 IP 208.80.154.232.443 > 10.0.2.15.46164: Flags [P.], seq 5297:5683, ack 792, win 65535, length 386
20:10:18.528943 IP 10.0.2.15.46164 > 208.80.154.232.443: Flags [.], ack 5683, win 62780, length 0
20:10:18.529435 IP 10.0.2.15.46164 > 208.80.154.232.443: Flags [P.], seq 792:823, ack 5683, win 62780, length 31
20:10:18.529744 IP 208.80.154.232.443 > 10.0.2.15.46164: Flags [.], ack 823, win 65535, length 0
20:10:18.530234 IP 10.0.2.15.46164 > 208.80.154.232.443: Flags [P.], seq 823:847, ack 5683, win 62780, length 24
20:10:18.530512 IP 208.80.154.232.443 > 10.0.2.15.46164: Flags [.], ack 847, win 65535, length 0
20:10:18.531023 IP 10.0.2.15.46164 > 208.80.154.232.443: Flags [F.], seq 847, ack 5683, win 62780, length 0
20:10:18.531239 IP 208.80.154.232.443 > 10.0.2.15.46164: Flags [.], ack 848, win 65535, length 0
20:10:18.549550 IP 208.80.154.232.443 > 10.0.2.15.46164: Flags [F.], seq 5683, ack 848, win 65535, length 0
20:10:18.549582 IP 10.0.2.15.46164 > 208.80.154.232.443: Flags [.], ack 5684, win 62780, length 0

