21:45:05.276967 IP 10.0.2.15.56339 > 140.233.253.2.53: 53443+ A? www.zillow.com. (32)
21:45:05.277010 IP 10.0.2.15.56339 > 140.233.253.2.53: 17407+ AAAA? www.zillow.com. (32)
21:45:05.288145 IP 140.233.253.2.53 > 10.0.2.15.56339: 53443 4/0/0 A 99.86.100.42, A 99.86.100.93, A 99.86.100.112, A 99.86.100.89 (96)
21:45:05.288148 IP 140.233.253.2.53 > 10.0.2.15.56339: 17407 0/1/0 (97)
21:45:05.289055 IP 10.0.2.15.60150 > 99.86.100.42.443: Flags [S], seq 2853340485, win 64240, options [mss 1460,sackOK,TS val 4202419074 ecr 0,nop,wscale 6], length 0
21:45:05.336144 IP 99.86.100.42.443 > 10.0.2.15.60150: Flags [S.], seq 266496001, ack 2853340486, win 65535, options [mss 1460], length 0
21:45:05.336184 IP 10.0.2.15.60150 > 99.86.100.42.443: Flags [.], ack 1, win 64240, length 0
21:45:05.342944 IP 10.0.2.15.60150 > 99.86.100.42.443: Flags [P.], seq 1:518, ack 1, win 64240, length 517
21:45:05.343305 IP 99.86.100.42.443 > 10.0.2.15.60150: Flags [.], ack 518, win 65535, length 0
21:45:05.391853 IP 99.86.100.42.443 > 10.0.2.15.60150: Flags [.], seq 1:2921, ack 518, win 65535, length 2920
21:45:05.391870 IP 10.0.2.15.60150 > 99.86.100.42.443: Flags [.], ack 2921, win 62780, length 0
21:45:05.392113 IP 99.86.100.42.443 > 10.0.2.15.60150: Flags [P.], seq 2921:4123, ack 518, win 65535, length 1202
21:45:05.392124 IP 10.0.2.15.60150 > 99.86.100.42.443: Flags [.], ack 4123, win 61578, length 0
21:45:05.392710 IP 99.86.100.42.443 > 10.0.2.15.60150: Flags [P.], seq 4123:5490, ack 518, win 65535, length 1367
21:45:05.392720 IP 10.0.2.15.60150 > 99.86.100.42.443: Flags [.], ack 5490, win 61320, length 0
21:45:05.393535 IP 10.0.2.15.60150 > 99.86.100.42.443: Flags [P.], seq 518:582, ack 5490, win 62780, length 64
21:45:05.393754 IP 99.86.100.42.443 > 10.0.2.15.60150: Flags [.], ack 582, win 65535, length 0
21:45:05.393939 IP 10.0.2.15.60150 > 99.86.100.42.443: Flags [P.], seq 582:628, ack 5490, win 62780, length 46
21:45:05.393972 IP 10.0.2.15.60150 > 99.86.100.42.443: Flags [P.], seq 628:677, ack 5490, win 62780, length 49
21:45:05.394158 IP 99.86.100.42.443 > 10.0.2.15.60150: Flags [.], ack 628, win 65535, length 0
21:45:05.394159 IP 99.86.100.42.443 > 10.0.2.15.60150: Flags [.], ack 677, win 65535, length 0
21:45:05.394177 IP 10.0.2.15.60150 > 99.86.100.42.443: Flags [P.], seq 677:774, ack 5490, win 62780, length 97
21:45:05.394352 IP 99.86.100.42.443 > 10.0.2.15.60150: Flags [.], ack 774, win 65535, length 0

