21:40:52.666865 IP 10.0.2.15.37138 > 140.233.253.2.53: 25362+ A? www.zillow.com. (32)
21:40:52.666908 IP 10.0.2.15.37138 > 140.233.253.2.53: 45335+ AAAA? www.zillow.com. (32)
21:40:52.672328 IP 140.233.253.2.53 > 10.0.2.15.37138: 45335 0/1/0 (97)
21:40:52.672330 IP 140.233.253.2.53 > 10.0.2.15.37138: 25362 4/0/0 A 99.86.100.89, A 99.86.100.112, A 99.86.100.42, A 99.86.100.93 (96)
21:40:52.672766 IP 10.0.2.15.38560 > 99.86.100.89.443: Flags [S], seq 337293201, win 64240, options [mss 1460,sackOK,TS val 1673981549 ecr 0,nop,wscale 6], length 0
21:40:52.719669 IP 99.86.100.89.443 > 10.0.2.15.38560: Flags [S.], seq 260288001, ack 337293202, win 65535, options [mss 1460], length 0
21:40:52.719720 IP 10.0.2.15.38560 > 99.86.100.89.443: Flags [.], ack 1, win 64240, length 0
21:40:52.731516 IP 10.0.2.15.38560 > 99.86.100.89.443: Flags [P.], seq 1:518, ack 1, win 64240, length 517
21:40:52.731912 IP 99.86.100.89.443 > 10.0.2.15.38560: Flags [.], ack 518, win 65535, length 0

