21:41:31.440750 IP 10.0.2.15.45654 > 140.233.253.2.53: 46117+ A? www.zillow.com. (32)
21:41:31.440789 IP 10.0.2.15.45654 > 140.233.253.2.53: 44377+ AAAA? www.zillow.com. (32)
21:41:31.446632 IP 140.233.253.2.53 > 10.0.2.15.45654: 46117 4/0/0 A 99.86.100.93, A 99.86.100.89, A 99.86.100.112, A 99.86.100.42 (96)
21:41:31.446634 IP 140.233.253.2.53 > 10.0.2.15.45654: 44377 0/1/0 (97)
21:41:31.447089 IP 10.0.2.15.50224 > 99.86.100.93.443: Flags [S], seq 3529784059, win 64240, options [mss 1460,sackOK,TS val 1999117989 ecr 0,nop,wscale 6], length 0
21:41:31.494620 IP 99.86.100.93.443 > 10.0.2.15.50224: Flags [S.], seq 261184001, ack 3529784060, win 65535, options [mss 1460], length 0
21:41:31.494678 IP 10.0.2.15.50224 > 99.86.100.93.443: Flags [.], ack 1, win 64240, length 0
21:41:31.504473 IP 10.0.2.15.50224 > 99.86.100.93.443: Flags [P.], seq 1:518, ack 1, win 64240, length 517
21:41:31.504891 IP 99.86.100.93.443 > 10.0.2.15.50224: Flags [.], ack 518, win 65535, length 0

