21:42:27.823804 IP 10.0.2.15.53671 > 140.233.253.2.53: 15111+ A? www.zillow.com. (32)
21:42:27.823849 IP 10.0.2.15.53671 > 140.233.253.2.53: 16896+ AAAA? www.zillow.com. (32)
21:42:27.829532 IP 140.233.253.2.53 > 10.0.2.15.53671: 15111 4/0/0 A 99.86.100.42, A 99.86.100.89, A 99.86.100.93, A 99.86.100.112 (96)
21:42:27.829534 IP 140.233.253.2.53 > 10.0.2.15.53671: 16896 0/1/0 (97)
21:42:27.829893 IP 10.0.2.15.60134 > 99.86.100.42.443: Flags [S], seq 2952875230, win 64240, options [mss 1460,sackOK,TS val 4202261615 ecr 0,nop,wscale 6], length 0
21:42:27.875345 IP 99.86.100.42.443 > 10.0.2.15.60134: Flags [S.], seq 262592001, ack 2952875231, win 65535, options [mss 1460], length 0
21:42:27.875392 IP 10.0.2.15.60134 > 99.86.100.42.443: Flags [.], ack 1, win 64240, length 0
21:42:27.884182 IP 10.0.2.15.60134 > 99.86.100.42.443: Flags [P.], seq 1:518, ack 1, win 64240, length 517
21:42:27.884521 IP 99.86.100.42.443 > 10.0.2.15.60134: Flags [.], ack 518, win 65535, length 0
21:42:27.940468 IP 99.86.100.42.443 > 10.0.2.15.60134: Flags [.], seq 1:2921, ack 518, win 65535, length 2920
21:42:27.940488 IP 10.0.2.15.60134 > 99.86.100.42.443: Flags [.], ack 2921, win 62780, length 0
21:42:27.940685 IP 99.86.100.42.443 > 10.0.2.15.60134: Flags [P.], seq 2921:4123, ack 518, win 65535, length 1202
21:42:27.940697 IP 10.0.2.15.60134 > 99.86.100.42.443: Flags [.], ack 4123, win 61578, length 0
21:42:27.943509 IP 99.86.100.42.443 > 10.0.2.15.60134: Flags [P.], seq 4123:5490, ack 518, win 65535, length 1367
21:42:27.943528 IP 10.0.2.15.60134 > 99.86.100.42.443: Flags [.], ack 5490, win 62780, length 0
21:42:27.944788 IP 10.0.2.15.60134 > 99.86.100.42.443: Flags [P.], seq 518:582, ack 5490, win 62780, length 64
21:42:27.945628 IP 10.0.2.15.60134 > 99.86.100.42.443: Flags [P.], seq 582:628, ack 5490, win 62780, length 46
21:42:27.945667 IP 10.0.2.15.60134 > 99.86.100.42.443: Flags [P.], seq 628:677, ack 5490, win 62780, length 49
21:42:27.946017 IP 99.86.100.42.443 > 10.0.2.15.60134: Flags [.], ack 582, win 65535, length 0
21:42:27.946038 IP 10.0.2.15.60134 > 99.86.100.42.443: Flags [P.], seq 677:774, ack 5490, win 62780, length 97
21:42:27.946630 IP 99.86.100.42.443 > 10.0.2.15.60134: Flags [.], ack 628, win 65535, length 0
21:42:27.946631 IP 99.86.100.42.443 > 10.0.2.15.60134: Flags [.], ack 677, win 65535, length 0
21:42:27.946631 IP 99.86.100.42.443 > 10.0.2.15.60134: Flags [.], ack 774, win 65535, length 0

