21:39:33.619006 IP 10.0.2.15.39208 > 140.233.253.2.53: 41598+ A? www.zillow.com. (32)
21:39:33.619036 IP 10.0.2.15.39208 > 140.233.253.2.53: 59505+ AAAA? www.zillow.com. (32)
21:39:33.643649 IP 140.233.253.2.53 > 10.0.2.15.39208: 59505 0/1/0 (97)
21:39:33.643651 IP 140.233.253.2.53 > 10.0.2.15.39208: 41598 4/0/0 A 99.86.100.93, A 99.86.100.42, A 99.86.100.112, A 99.86.100.89 (96)
21:39:33.646922 IP 10.0.2.15.50212 > 99.86.100.93.443: Flags [S], seq 3165556185, win 64240, options [mss 1460,sackOK,TS val 1999000189 ecr 0,nop,wscale 6], length 0

