21:44:02.896728 IP 10.0.2.15.52934 > 140.233.253.2.53: 14633+ A? www.zillow.com. (32)
21:44:02.896768 IP 10.0.2.15.52934 > 140.233.253.2.53: 14884+ AAAA? www.zillow.com. (32)
21:44:02.902538 IP 140.233.253.2.53 > 10.0.2.15.52934: 14633 4/0/0 A 99.86.100.42, A 99.86.100.89, A 99.86.100.93, A 99.86.100.112 (96)
21:44:02.902540 IP 140.233.253.2.53 > 10.0.2.15.52934: 14884 0/1/0 (97)
21:44:02.902875 IP 10.0.2.15.60142 > 99.86.100.42.443: Flags [S], seq 3119202501, win 64240, options [mss 1460,sackOK,TS val 4202356688 ecr 0,nop,wscale 6], length 0
21:44:02.950263 IP 99.86.100.42.443 > 10.0.2.15.60142: Flags [S.], seq 264832001, ack 3119202502, win 65535, options [mss 1460], length 0
21:44:02.950309 IP 10.0.2.15.60142 > 99.86.100.42.443: Flags [.], ack 1, win 64240, length 0
21:44:02.960197 IP 10.0.2.15.60142 > 99.86.100.42.443: Flags [P.], seq 1:518, ack 1, win 64240, length 517
21:44:02.960664 IP 99.86.100.42.443 > 10.0.2.15.60142: Flags [.], ack 518, win 65535, length 0

