21:43:01.452216 IP 10.0.2.15.45846 > 140.233.253.2.53: 43198+ A? www.zillow.com. (32)
21:43:01.452247 IP 10.0.2.15.45846 > 140.233.253.2.53: 61371+ AAAA? www.zillow.com. (32)
21:43:01.457009 IP 140.233.253.2.53 > 10.0.2.15.45846: 43198 4/0/0 A 99.86.100.93, A 99.86.100.89, A 99.86.100.112, A 99.86.100.42 (96)
21:43:01.457189 IP 140.233.253.2.53 > 10.0.2.15.45846: 61371 0/1/0 (97)
21:43:01.457548 IP 10.0.2.15.50232 > 99.86.100.93.443: Flags [S], seq 524808964, win 64240, options [mss 1460,sackOK,TS val 1999207999 ecr 0,nop,wscale 6], length 0
21:43:01.505852 IP 99.86.100.93.443 > 10.0.2.15.50232: Flags [S.], seq 263360001, ack 524808965, win 65535, options [mss 1460], length 0
21:43:01.505897 IP 10.0.2.15.50232 > 99.86.100.93.443: Flags [.], ack 1, win 64240, length 0

