21:41:25.954367 IP 10.0.2.15.52128 > 140.233.253.2.53: 58893+ A? www.zillow.com. (32)
21:41:25.954410 IP 10.0.2.15.52128 > 140.233.253.2.53: 6414+ AAAA? www.zillow.com. (32)
21:41:25.960960 IP 140.233.253.2.53 > 10.0.2.15.52128: 6414 0/1/0 (97)
21:41:25.960962 IP 140.233.253.2.53 > 10.0.2.15.52128: 58893 4/0/0 A 99.86.100.42, A 99.86.100.93, A 99.86.100.89, A 99.86.100.112 (96)
21:41:25.961329 IP 10.0.2.15.60128 > 99.86.100.42.443: Flags [S], seq 2177638186, win 64240, options [mss 1460,sackOK,TS val 4202199746 ecr 0,nop,wscale 6], length 0
21:41:26.011184 IP 99.86.100.42.443 > 10.0.2.15.60128: Flags [S.], seq 261056001, ack 2177638187, win 65535, options [mss 1460], length 0
21:41:26.011230 IP 10.0.2.15.60128 > 99.86.100.42.443: Flags [.], ack 1, win 64240, length 0
21:41:26.018602 IP 10.0.2.15.60128 > 99.86.100.42.443: Flags [P.], seq 1:518, ack 1, win 64240, length 517
21:41:26.018812 IP 99.86.100.42.443 > 10.0.2.15.60128: Flags [.], ack 518, win 65535, length 0
21:41:26.067979 IP 99.86.100.42.443 > 10.0.2.15.60128: Flags [.], seq 1:2921, ack 518, win 65535, length 2920
21:41:26.068002 IP 10.0.2.15.60128 > 99.86.100.42.443: Flags [.], ack 2921, win 62780, length 0
21:41:26.068324 IP 99.86.100.42.443 > 10.0.2.15.60128: Flags [P.], seq 2921:4123, ack 518, win 65535, length 1202
21:41:26.068340 IP 10.0.2.15.60128 > 99.86.100.42.443: Flags [.], ack 4123, win 61578, length 0

