21:44:36.859557 IP 10.0.2.15.35681 > 140.233.253.2.53: 14219+ A? www.zillow.com. (32)
21:44:36.859591 IP 10.0.2.15.35681 > 140.233.253.2.53: 64948+ AAAA? www.zillow.com. (32)
21:44:36.865306 IP 140.233.253.2.53 > 10.0.2.15.35681: 64948 0/1/0 (97)
21:44:36.885691 IP 140.233.253.2.53 > 10.0.2.15.35681: 14219 4/0/0 A 99.86.100.112, A 99.86.100.89, A 99.86.100.42, A 99.86.100.93 (96)
21:44:36.886184 IP 10.0.2.15.42638 > 99.86.100.112.443: Flags [S], seq 737900504, win 64240, options [mss 1460,sackOK,TS val 1858056528 ecr 0,nop,wscale 6], length 0
21:44:36.933723 IP 99.86.100.112.443 > 10.0.2.15.42638: Flags [S.], seq 265728001, ack 737900505, win 65535, options [mss 1460], length 0
21:44:36.933867 IP 10.0.2.15.42638 > 99.86.100.112.443: Flags [.], ack 1, win 64240, length 0
21:44:36.947896 IP 10.0.2.15.42638 > 99.86.100.112.443: Flags [P.], seq 1:518, ack 1, win 64240, length 517
21:44:36.948628 IP 99.86.100.112.443 > 10.0.2.15.42638: Flags [.], ack 518, win 65535, length 0

