21:57:42.377903 IP 10.0.2.15.36686 > 140.233.253.2.53: 16873+ A? www.paypal.com. (32)
21:57:42.377946 IP 10.0.2.15.36686 > 140.233.253.2.53: 19946+ AAAA? www.paypal.com. (32)
21:57:42.439625 IP 140.233.253.2.53 > 10.0.2.15.36686: 16873 3/0/0 CNAME www.glb.paypal.com., CNAME www-fastly.glb.paypal.com., A 151.101.193.21 (95)
21:57:42.439627 IP 140.233.253.2.53 > 10.0.2.15.36686: 19946 2/1/0 CNAME www.glb.paypal.com., CNAME www-fastly.glb.paypal.com. (144)
21:57:42.439842 IP 10.0.2.15.39672 > 151.101.193.21.443: Flags [S], seq 131212941, win 64240, options [mss 1460,sackOK,TS val 4286605874 ecr 0,nop,wscale 6], length 0
21:57:42.454798 IP 151.101.193.21.443 > 10.0.2.15.39672: Flags [S.], seq 283968001, ack 131212942, win 65535, options [mss 1460], length 0
21:57:42.454838 IP 10.0.2.15.39672 > 151.101.193.21.443: Flags [.], ack 1, win 64240, length 0
21:57:42.463942 IP 10.0.2.15.39672 > 151.101.193.21.443: Flags [P.], seq 1:518, ack 1, win 64240, length 517
21:57:42.464295 IP 151.101.193.21.443 > 10.0.2.15.39672: Flags [.], ack 518, win 65535, length 0

