21:56:53.288017 IP 10.0.2.15.47976 > 140.233.253.2.53: 50099+ A? www.paypal.com. (32)
21:56:53.288059 IP 10.0.2.15.47976 > 140.233.253.2.53: 61628+ AAAA? www.paypal.com. (32)
21:56:53.296112 IP 140.233.253.2.53 > 10.0.2.15.47976: 50099 3/0/0 CNAME www.glb.paypal.com., CNAME www-fastly.glb.paypal.com., A 151.101.193.21 (95)
21:56:53.296114 IP 140.233.253.2.53 > 10.0.2.15.47976: 61628 2/1/0 CNAME www.glb.paypal.com., CNAME www-fastly.glb.paypal.com. (144)
21:56:53.296386 IP 10.0.2.15.39654 > 151.101.193.21.443: Flags [S], seq 3887133792, win 64240, options [mss 1460,sackOK,TS val 4286556730 ecr 0,nop,wscale 6], length 0
21:56:53.310401 IP 151.101.193.21.443 > 10.0.2.15.39654: Flags [S.], seq 282752001, ack 3887133793, win 65535, options [mss 1460], length 0
21:56:53.310445 IP 10.0.2.15.39654 > 151.101.193.21.443: Flags [.], ack 1, win 64240, length 0
21:56:53.322544 IP 10.0.2.15.39654 > 151.101.193.21.443: Flags [P.], seq 1:518, ack 1, win 64240, length 517
21:56:53.322949 IP 151.101.193.21.443 > 10.0.2.15.39654: Flags [.], ack 518, win 65535, length 0
21:56:53.340024 IP 151.101.193.21.443 > 10.0.2.15.39654: Flags [.], seq 1:1461, ack 518, win 65535, length 1460
21:56:53.340284 IP 10.0.2.15.39654 > 151.101.193.21.443: Flags [.], ack 1461, win 62780, length 0
21:56:53.341067 IP 151.101.193.21.443 > 10.0.2.15.39654: Flags [P.], seq 1461:4123, ack 518, win 65535, length 2662
21:56:53.341096 IP 10.0.2.15.39654 > 151.101.193.21.443: Flags [.], ack 4123, win 61320, length 0
21:56:53.342971 IP 151.101.193.21.443 > 10.0.2.15.39654: Flags [P.], seq 4123:4493, ack 518, win 65535, length 370
21:56:53.342988 IP 10.0.2.15.39654 > 151.101.193.21.443: Flags [.], ack 4493, win 62780, length 0
21:56:53.343364 IP 10.0.2.15.39654 > 151.101.193.21.443: Flags [P.], seq 518:598, ack 4493, win 62780, length 80
21:56:53.343561 IP 151.101.193.21.443 > 10.0.2.15.39654: Flags [.], ack 598, win 65535, length 0
21:56:53.343660 IP 10.0.2.15.39654 > 151.101.193.21.443: Flags [P.], seq 598:644, ack 4493, win 62780, length 46
21:56:53.343687 IP 10.0.2.15.39654 > 151.101.193.21.443: Flags [P.], seq 644:693, ack 4493, win 62780, length 49
21:56:53.343832 IP 10.0.2.15.39654 > 151.101.193.21.443: Flags [P.], seq 693:790, ack 4493, win 62780, length 97
21:56:53.343902 IP 151.101.193.21.443 > 10.0.2.15.39654: Flags [.], ack 644, win 65535, length 0
21:56:53.344399 IP 151.101.193.21.443 > 10.0.2.15.39654: Flags [.], ack 693, win 65535, length 0
21:56:53.344400 IP 151.101.193.21.443 > 10.0.2.15.39654: Flags [.], ack 790, win 65535, length 0
21:56:53.357065 IP 151.101.193.21.443 > 10.0.2.15.39654: Flags [P.], seq 4493:4574, ack 790, win 65535, length 81
21:56:53.357090 IP 10.0.2.15.39654 > 151.101.193.21.443: Flags [.], ack 4574, win 62780, length 0
21:56:53.357393 IP 10.0.2.15.39654 > 151.101.193.21.443: Flags [P.], seq 790:821, ack 4574, win 62780, length 31
21:56:53.357694 IP 151.101.193.21.443 > 10.0.2.15.39654: Flags [.], ack 821, win 65535, length 0
21:56:53.362018 IP 151.101.193.21.443 > 10.0.2.15.39654: Flags [P.], seq 4574:4816, ack 821, win 65535, length 242
21:56:53.362163 IP 10.0.2.15.39654 > 151.101.193.21.443: Flags [.], ack 4816, win 62780, length 0
21:56:53.363325 IP 10.0.2.15.39654 > 151.101.193.21.443: Flags [P.], seq 821:845, ack 4816, win 62780, length 24
21:56:53.363714 IP 151.101.193.21.443 > 10.0.2.15.39654: Flags [.], ack 845, win 65535, length 0
21:56:53.364616 IP 10.0.2.15.39654 > 151.101.193.21.443: Flags [F.], seq 845, ack 4816, win 62780, length 0
21:56:53.364960 IP 151.101.193.21.443 > 10.0.2.15.39654: Flags [.], ack 846, win 65535, length 0
21:56:53.376224 IP 151.101.193.21.443 > 10.0.2.15.39654: Flags [P.], seq 4816:4840, ack 846, win 65535, length 24
21:56:53.376243 IP 10.0.2.15.39654 > 151.101.193.21.443: Flags [R], seq 3887134638, win 0, length 0

