21:58:51.304457 IP 10.0.2.15.44762 > 140.233.253.2.53: 43705+ A? www.paypal.com. (32)
21:58:51.304508 IP 10.0.2.15.44762 > 140.233.253.2.53: 22459+ AAAA? www.paypal.com. (32)
21:58:51.310270 IP 140.233.253.2.53 > 10.0.2.15.44762: 22459 2/1/0 CNAME www.glb.paypal.com., CNAME www-fastly.glb.paypal.com. (144)
21:58:51.310272 IP 140.233.253.2.53 > 10.0.2.15.44762: 43705 3/0/0 CNAME www.glb.paypal.com., CNAME www-fastly.glb.paypal.com., A 151.101.193.21 (95)
21:58:51.310533 IP 10.0.2.15.39698 > 151.101.193.21.443: Flags [S], seq 3963590414, win 64240, options [mss 1460,sackOK,TS val 4286674744 ecr 0,nop,wscale 6], length 0
21:58:51.325711 IP 151.101.193.21.443 > 10.0.2.15.39698: Flags [S.], seq 285632001, ack 3963590415, win 65535, options [mss 1460], length 0
21:58:51.325756 IP 10.0.2.15.39698 > 151.101.193.21.443: Flags [.], ack 1, win 64240, length 0
21:58:51.335115 IP 10.0.2.15.39698 > 151.101.193.21.443: Flags [P.], seq 1:518, ack 1, win 64240, length 517
21:58:51.335403 IP 151.101.193.21.443 > 10.0.2.15.39698: Flags [.], ack 518, win 65535, length 0
21:58:51.352970 IP 151.101.193.21.443 > 10.0.2.15.39698: Flags [.], seq 1:2921, ack 518, win 65535, length 2920
21:58:51.352992 IP 10.0.2.15.39698 > 151.101.193.21.443: Flags [.], ack 2921, win 62780, length 0
21:58:51.353286 IP 151.101.193.21.443 > 10.0.2.15.39698: Flags [P.], seq 2921:4493, ack 518, win 65535, length 1572
21:58:51.353304 IP 10.0.2.15.39698 > 151.101.193.21.443: Flags [.], ack 4493, win 61320, length 0
21:58:51.354404 IP 10.0.2.15.39698 > 151.101.193.21.443: Flags [P.], seq 518:598, ack 4493, win 62780, length 80
21:58:51.354655 IP 151.101.193.21.443 > 10.0.2.15.39698: Flags [.], ack 598, win 65535, length 0
21:58:51.354785 IP 10.0.2.15.39698 > 151.101.193.21.443: Flags [P.], seq 598:644, ack 4493, win 62780, length 46
21:58:51.354820 IP 10.0.2.15.39698 > 151.101.193.21.443: Flags [P.], seq 644:693, ack 4493, win 62780, length 49
21:58:51.355023 IP 151.101.193.21.443 > 10.0.2.15.39698: Flags [.], ack 644, win 65535, length 0
21:58:51.355024 IP 151.101.193.21.443 > 10.0.2.15.39698: Flags [.], ack 693, win 65535, length 0
21:58:51.355122 IP 10.0.2.15.39698 > 151.101.193.21.443: Flags [P.], seq 693:728, ack 4493, win 62780, length 35
21:58:51.355178 IP 10.0.2.15.39698 > 151.101.193.21.443: Flags [P.], seq 728:790, ack 4493, win 62780, length 62
21:58:51.355439 IP 151.101.193.21.443 > 10.0.2.15.39698: Flags [.], ack 728, win 65535, length 0
21:58:51.355440 IP 151.101.193.21.443 > 10.0.2.15.39698: Flags [.], ack 790, win 65535, length 0
21:58:51.368760 IP 151.101.193.21.443 > 10.0.2.15.39698: Flags [P.], seq 4493:4574, ack 790, win 65535, length 81
21:58:51.368781 IP 10.0.2.15.39698 > 151.101.193.21.443: Flags [.], ack 4574, win 62780, length 0
21:58:51.369272 IP 10.0.2.15.39698 > 151.101.193.21.443: Flags [P.], seq 790:821, ack 4574, win 62780, length 31
21:58:51.369724 IP 151.101.193.21.443 > 10.0.2.15.39698: Flags [.], ack 821, win 65535, length 0
21:58:51.371697 IP 151.101.193.21.443 > 10.0.2.15.39698: Flags [P.], seq 4574:4816, ack 821, win 65535, length 242
21:58:51.371722 IP 10.0.2.15.39698 > 151.101.193.21.443: Flags [.], ack 4816, win 62780, length 0
21:58:51.372395 IP 10.0.2.15.39698 > 151.101.193.21.443: Flags [P.], seq 821:845, ack 4816, win 62780, length 24
21:58:51.373572 IP 151.101.193.21.443 > 10.0.2.15.39698: Flags [.], ack 845, win 65535, length 0
21:58:51.374382 IP 10.0.2.15.39698 > 151.101.193.21.443: Flags [F.], seq 845, ack 4816, win 62780, length 0
21:58:51.374661 IP 151.101.193.21.443 > 10.0.2.15.39698: Flags [.], ack 846, win 65535, length 0
21:58:51.386636 IP 151.101.193.21.443 > 10.0.2.15.39698: Flags [P.], seq 4816:4840, ack 846, win 65535, length 24
21:58:51.386758 IP 10.0.2.15.39698 > 151.101.193.21.443: Flags [R], seq 3963591260, win 0, length 0

