21:57:03.941062 IP 10.0.2.15.58325 > 140.233.253.2.53: 3149+ A? www.paypal.com. (32)
21:57:03.941099 IP 10.0.2.15.58325 > 140.233.253.2.53: 20046+ AAAA? www.paypal.com. (32)
21:57:03.948046 IP 140.233.253.2.53 > 10.0.2.15.58325: 20046 2/1/0 CNAME www.glb.paypal.com., CNAME www-fastly.glb.paypal.com. (144)
21:57:03.948048 IP 140.233.253.2.53 > 10.0.2.15.58325: 3149 3/0/0 CNAME www.glb.paypal.com., CNAME www-fastly.glb.paypal.com., A 151.101.193.21 (95)
21:57:03.948347 IP 10.0.2.15.39658 > 151.101.193.21.443: Flags [S], seq 1722767806, win 64240, options [mss 1460,sackOK,TS val 4286567382 ecr 0,nop,wscale 6], length 0
21:57:03.962672 IP 151.101.193.21.443 > 10.0.2.15.39658: Flags [S.], seq 283008001, ack 1722767807, win 65535, options [mss 1460], length 0
21:57:03.962718 IP 10.0.2.15.39658 > 151.101.193.21.443: Flags [.], ack 1, win 64240, length 0
21:57:03.992185 IP 10.0.2.15.39658 > 151.101.193.21.443: Flags [P.], seq 1:518, ack 1, win 64240, length 517
21:57:03.993165 IP 151.101.193.21.443 > 10.0.2.15.39658: Flags [.], ack 518, win 65535, length 0
21:57:04.014024 IP 151.101.193.21.443 > 10.0.2.15.39658: Flags [.], seq 1:2921, ack 518, win 65535, length 2920
21:57:04.014053 IP 10.0.2.15.39658 > 151.101.193.21.443: Flags [.], ack 2921, win 62780, length 0

