21:57:14.667323 IP 10.0.2.15.53306 > 140.233.253.2.53: 751+ A? www.paypal.com. (32)
21:57:14.667353 IP 10.0.2.15.53306 > 140.233.253.2.53: 61923+ AAAA? www.paypal.com. (32)
21:57:14.673769 IP 140.233.253.2.53 > 10.0.2.15.53306: 751 3/0/0 CNAME www.glb.paypal.com., CNAME www-fastly.glb.paypal.com., A 151.101.193.21 (95)
21:57:14.673771 IP 140.233.253.2.53 > 10.0.2.15.53306: 61923 2/1/0 CNAME www.glb.paypal.com., CNAME www-fastly.glb.paypal.com. (144)
21:57:14.674041 IP 10.0.2.15.39662 > 151.101.193.21.443: Flags [S], seq 3207543606, win 64240, options [mss 1460,sackOK,TS val 4286578108 ecr 0,nop,wscale 6], length 0
21:57:14.692088 IP 151.101.193.21.443 > 10.0.2.15.39662: Flags [S.], seq 283264001, ack 3207543607, win 65535, options [mss 1460], length 0
21:57:14.692133 IP 10.0.2.15.39662 > 151.101.193.21.443: Flags [.], ack 1, win 64240, length 0
21:57:14.701983 IP 10.0.2.15.39662 > 151.101.193.21.443: Flags [P.], seq 1:518, ack 1, win 64240, length 517
21:57:14.702315 IP 151.101.193.21.443 > 10.0.2.15.39662: Flags [.], ack 518, win 65535, length 0
21:57:14.725582 IP 151.101.193.21.443 > 10.0.2.15.39662: Flags [.], seq 1:2921, ack 518, win 65535, length 2920
21:57:14.725610 IP 10.0.2.15.39662 > 151.101.193.21.443: Flags [.], ack 2921, win 62780, length 0
21:57:14.725845 IP 151.101.193.21.443 > 10.0.2.15.39662: Flags [P.], seq 2921:4493, ack 518, win 65535, length 1572
21:57:14.725863 IP 10.0.2.15.39662 > 151.101.193.21.443: Flags [.], ack 4493, win 61320, length 0
21:57:14.727050 IP 10.0.2.15.39662 > 151.101.193.21.443: Flags [P.], seq 518:598, ack 4493, win 62780, length 80
21:57:14.727569 IP 151.101.193.21.443 > 10.0.2.15.39662: Flags [.], ack 598, win 65535, length 0
21:57:14.727679 IP 10.0.2.15.39662 > 151.101.193.21.443: Flags [P.], seq 598:644, ack 4493, win 62780, length 46
21:57:14.727715 IP 10.0.2.15.39662 > 151.101.193.21.443: Flags [P.], seq 644:693, ack 4493, win 62780, length 49
21:57:14.727879 IP 10.0.2.15.39662 > 151.101.193.21.443: Flags [P.], seq 693:728, ack 4493, win 62780, length 35
21:57:14.727924 IP 10.0.2.15.39662 > 151.101.193.21.443: Flags [P.], seq 728:790, ack 4493, win 62780, length 62
21:57:14.728132 IP 151.101.193.21.443 > 10.0.2.15.39662: Flags [.], ack 644, win 65535, length 0
21:57:14.728532 IP 151.101.193.21.443 > 10.0.2.15.39662: Flags [.], ack 693, win 65535, length 0
21:57:14.728534 IP 151.101.193.21.443 > 10.0.2.15.39662: Flags [.], ack 728, win 65535, length 0
21:57:14.728534 IP 151.101.193.21.443 > 10.0.2.15.39662: Flags [.], ack 790, win 65535, length 0
21:57:14.741658 IP 151.101.193.21.443 > 10.0.2.15.39662: Flags [P.], seq 4493:4574, ack 790, win 65535, length 81
21:57:14.741680 IP 10.0.2.15.39662 > 151.101.193.21.443: Flags [.], ack 4574, win 62780, length 0
21:57:14.741936 IP 10.0.2.15.39662 > 151.101.193.21.443: Flags [P.], seq 790:821, ack 4574, win 62780, length 31
21:57:14.742295 IP 151.101.193.21.443 > 10.0.2.15.39662: Flags [.], ack 821, win 65535, length 0
21:57:14.745546 IP 151.101.193.21.443 > 10.0.2.15.39662: Flags [P.], seq 4574:4816, ack 821, win 65535, length 242
21:57:14.745570 IP 10.0.2.15.39662 > 151.101.193.21.443: Flags [.], ack 4816, win 62780, length 0
21:57:14.746160 IP 10.0.2.15.39662 > 151.101.193.21.443: Flags [P.], seq 821:845, ack 4816, win 62780, length 24
21:57:14.746589 IP 151.101.193.21.443 > 10.0.2.15.39662: Flags [.], ack 845, win 65535, length 0
21:57:14.747626 IP 10.0.2.15.39662 > 151.101.193.21.443: Flags [F.], seq 845, ack 4816, win 62780, length 0
21:57:14.748003 IP 151.101.193.21.443 > 10.0.2.15.39662: Flags [.], ack 846, win 65535, length 0
21:57:14.760555 IP 151.101.193.21.443 > 10.0.2.15.39662: Flags [P.], seq 4816:4840, ack 846, win 65535, length 24
21:57:14.760556 IP 151.101.193.21.443 > 10.0.2.15.39662: Flags [F.], seq 4840, ack 846, win 65535, length 0
21:57:14.760573 IP 10.0.2.15.39662 > 151.101.193.21.443: Flags [R], seq 3207544452, win 0, length 0
21:57:14.760664 IP 10.0.2.15.39662 > 151.101.193.21.443: Flags [R], seq 3207544452, win 0, length 0
21:57:14.760886 IP 151.101.193.21.443 > 10.0.2.15.39662: Flags [R.], seq 4011703295, ack 846, win 0, length 0

