21:59:07.323211 IP 10.0.2.15.53432 > 140.233.253.2.53: 56531+ A? www.paypal.com. (32)
21:59:07.323245 IP 10.0.2.15.53432 > 140.233.253.2.53: 57552+ AAAA? www.paypal.com. (32)
21:59:07.329087 IP 140.233.253.2.53 > 10.0.2.15.53432: 56531 3/0/0 CNAME www.glb.paypal.com., CNAME www-fastly.glb.paypal.com., A 151.101.193.21 (95)
21:59:07.332910 IP 140.233.253.2.53 > 10.0.2.15.53432: 57552 2/1/0 CNAME www.glb.paypal.com., CNAME www-fastly.glb.paypal.com. (144)
21:59:07.333186 IP 10.0.2.15.39704 > 151.101.193.21.443: Flags [S], seq 304037084, win 64240, options [mss 1460,sackOK,TS val 4286690767 ecr 0,nop,wscale 6], length 0
21:59:07.348209 IP 151.101.193.21.443 > 10.0.2.15.39704: Flags [S.], seq 286016001, ack 304037085, win 65535, options [mss 1460], length 0
21:59:07.348251 IP 10.0.2.15.39704 > 151.101.193.21.443: Flags [.], ack 1, win 64240, length 0
21:59:07.357391 IP 10.0.2.15.39704 > 151.101.193.21.443: Flags [P.], seq 1:518, ack 1, win 64240, length 517
21:59:07.357644 IP 151.101.193.21.443 > 10.0.2.15.39704: Flags [.], ack 518, win 65535, length 0
21:59:07.374705 IP 151.101.193.21.443 > 10.0.2.15.39704: Flags [.], seq 1:2921, ack 518, win 65535, length 2920
21:59:07.374729 IP 10.0.2.15.39704 > 151.101.193.21.443: Flags [.], ack 2921, win 62780, length 0
21:59:07.375037 IP 151.101.193.21.443 > 10.0.2.15.39704: Flags [P.], seq 2921:4123, ack 518, win 65535, length 1202
21:59:07.375050 IP 10.0.2.15.39704 > 151.101.193.21.443: Flags [.], ack 4123, win 61578, length 0
21:59:07.375579 IP 151.101.193.21.443 > 10.0.2.15.39704: Flags [P.], seq 4123:4493, ack 518, win 65535, length 370
21:59:07.375590 IP 10.0.2.15.39704 > 151.101.193.21.443: Flags [.], ack 4493, win 61320, length 0
21:59:07.376578 IP 10.0.2.15.39704 > 151.101.193.21.443: Flags [P.], seq 518:598, ack 4493, win 61320, length 80
21:59:07.376926 IP 10.0.2.15.39704 > 151.101.193.21.443: Flags [P.], seq 598:644, ack 4493, win 61320, length 46
21:59:07.376977 IP 151.101.193.21.443 > 10.0.2.15.39704: Flags [.], ack 598, win 65535, length 0
21:59:07.377064 IP 10.0.2.15.39704 > 151.101.193.21.443: Flags [P.], seq 644:693, ack 4493, win 61320, length 49
21:59:07.377151 IP 151.101.193.21.443 > 10.0.2.15.39704: Flags [.], ack 644, win 65535, length 0
21:59:07.377261 IP 151.101.193.21.443 > 10.0.2.15.39704: Flags [.], ack 693, win 65535, length 0
21:59:07.377283 IP 10.0.2.15.39704 > 151.101.193.21.443: Flags [P.], seq 693:728, ack 4493, win 61320, length 35
21:59:07.377341 IP 10.0.2.15.39704 > 151.101.193.21.443: Flags [P.], seq 728:790, ack 4493, win 61320, length 62
21:59:07.377589 IP 151.101.193.21.443 > 10.0.2.15.39704: Flags [.], ack 728, win 65535, length 0
21:59:07.377591 IP 151.101.193.21.443 > 10.0.2.15.39704: Flags [.], ack 790, win 65535, length 0
21:59:07.390792 IP 151.101.193.21.443 > 10.0.2.15.39704: Flags [P.], seq 4493:4543, ack 790, win 65535, length 50
21:59:07.390814 IP 10.0.2.15.39704 > 151.101.193.21.443: Flags [.], ack 4543, win 62780, length 0
21:59:07.391082 IP 10.0.2.15.39704 > 151.101.193.21.443: Flags [P.], seq 790:821, ack 4543, win 62780, length 31
21:59:07.391449 IP 151.101.193.21.443 > 10.0.2.15.39704: Flags [.], ack 821, win 65535, length 0
21:59:07.392834 IP 151.101.193.21.443 > 10.0.2.15.39704: Flags [P.], seq 4543:4574, ack 821, win 65535, length 31
21:59:07.392880 IP 10.0.2.15.39704 > 151.101.193.21.443: Flags [.], ack 4574, win 62780, length 0
21:59:07.394934 IP 151.101.193.21.443 > 10.0.2.15.39704: Flags [P.], seq 4574:4816, ack 821, win 65535, length 242
21:59:07.394954 IP 10.0.2.15.39704 > 151.101.193.21.443: Flags [.], ack 4816, win 62780, length 0
21:59:07.395487 IP 10.0.2.15.39704 > 151.101.193.21.443: Flags [P.], seq 821:845, ack 4816, win 62780, length 24
21:59:07.395785 IP 151.101.193.21.443 > 10.0.2.15.39704: Flags [.], ack 845, win 65535, length 0
21:59:07.396518 IP 10.0.2.15.39704 > 151.101.193.21.443: Flags [F.], seq 845, ack 4816, win 62780, length 0
21:59:07.396802 IP 151.101.193.21.443 > 10.0.2.15.39704: Flags [.], ack 846, win 65535, length 0
21:59:07.411079 IP 151.101.193.21.443 > 10.0.2.15.39704: Flags [P.], seq 4816:4840, ack 846, win 65535, length 24
21:59:07.411081 IP 151.101.193.21.443 > 10.0.2.15.39704: Flags [F.], seq 4840, ack 846, win 65535, length 0
21:59:07.411107 IP 10.0.2.15.39704 > 151.101.193.21.443: Flags [R], seq 304037930, win 0, length 0
21:59:07.411137 IP 10.0.2.15.39704 > 151.101.193.21.443: Flags [R], seq 304037930, win 0, length 0
21:59:07.411436 IP 151.101.193.21.443 > 10.0.2.15.39704: Flags [R.], seq 4008951295, ack 846, win 0, length 0

