22:01:10.351388 IP 10.0.2.15.41526 > 140.233.253.2.53: 14068+ A? www.paypal.com. (32)
22:01:10.351429 IP 10.0.2.15.41526 > 140.233.253.2.53: 51446+ AAAA? www.paypal.com. (32)
22:01:10.355895 IP 140.233.253.2.53 > 10.0.2.15.41526: 51446 2/1/0 CNAME www.glb.paypal.com., CNAME www-fastly.glb.paypal.com. (144)
22:01:10.355897 IP 140.233.253.2.53 > 10.0.2.15.41526: 14068 3/0/0 CNAME www.glb.paypal.com., CNAME www-fastly.glb.paypal.com., A 151.101.65.21 (95)
22:01:10.356097 IP 10.0.2.15.36826 > 151.101.65.21.443: Flags [S], seq 3820233350, win 64240, options [mss 1460,sackOK,TS val 3324599114 ecr 0,nop,wscale 6], length 0
22:01:10.370643 IP 151.101.65.21.443 > 10.0.2.15.36826: Flags [S.], seq 288960001, ack 3820233351, win 65535, options [mss 1460], length 0
22:01:10.370705 IP 10.0.2.15.36826 > 151.101.65.21.443: Flags [.], ack 1, win 64240, length 0
22:01:10.387222 IP 10.0.2.15.36826 > 151.101.65.21.443: Flags [P.], seq 1:518, ack 1, win 64240, length 517
22:01:10.387675 IP 151.101.65.21.443 > 10.0.2.15.36826: Flags [.], ack 518, win 65535, length 0
22:01:10.406911 IP 151.101.65.21.443 > 10.0.2.15.36826: Flags [.], seq 1:2921, ack 518, win 65535, length 2920
22:01:10.406929 IP 10.0.2.15.36826 > 151.101.65.21.443: Flags [.], ack 2921, win 62780, length 0
22:01:10.407081 IP 151.101.65.21.443 > 10.0.2.15.36826: Flags [P.], seq 2921:4123, ack 518, win 65535, length 1202
22:01:10.407096 IP 10.0.2.15.36826 > 151.101.65.21.443: Flags [.], ack 4123, win 61578, length 0
22:01:10.407576 IP 151.101.65.21.443 > 10.0.2.15.36826: Flags [P.], seq 4123:4493, ack 518, win 65535, length 370
22:01:10.407597 IP 10.0.2.15.36826 > 151.101.65.21.443: Flags [.], ack 4493, win 61320, length 0
22:01:10.408660 IP 10.0.2.15.36826 > 151.101.65.21.443: Flags [P.], seq 518:598, ack 4493, win 61320, length 80
22:01:10.409200 IP 151.101.65.21.443 > 10.0.2.15.36826: Flags [.], ack 598, win 65535, length 0
22:01:10.409750 IP 10.0.2.15.36826 > 151.101.65.21.443: Flags [P.], seq 598:644, ack 4493, win 61320, length 46
22:01:10.409898 IP 10.0.2.15.36826 > 151.101.65.21.443: Flags [P.], seq 644:693, ack 4493, win 61320, length 49
22:01:10.414668 IP 10.0.2.15.36826 > 151.101.65.21.443: Flags [P.], seq 693:790, ack 4493, win 62780, length 97
22:01:10.415095 IP 151.101.65.21.443 > 10.0.2.15.36826: Flags [.], ack 644, win 65535, length 0
22:01:10.415097 IP 151.101.65.21.443 > 10.0.2.15.36826: Flags [.], ack 693, win 65535, length 0

