21:57:47.745695 IP 10.0.2.15.50916 > 140.233.253.2.53: 14297+ A? www.paypal.com. (32)
21:57:47.745727 IP 10.0.2.15.50916 > 140.233.253.2.53: 62938+ AAAA? www.paypal.com. (32)
21:57:47.751141 IP 140.233.253.2.53 > 10.0.2.15.50916: 14297 3/0/0 CNAME www.glb.paypal.com., CNAME www-fastly.glb.paypal.com., A 151.101.193.21 (95)
21:57:47.751143 IP 140.233.253.2.53 > 10.0.2.15.50916: 62938 2/1/0 CNAME www.glb.paypal.com., CNAME www-fastly.glb.paypal.com. (144)
21:57:47.751420 IP 10.0.2.15.39674 > 151.101.193.21.443: Flags [S], seq 3879376336, win 64240, options [mss 1460,sackOK,TS val 4286611185 ecr 0,nop,wscale 6], length 0
21:57:47.765225 IP 151.101.193.21.443 > 10.0.2.15.39674: Flags [S.], seq 284096001, ack 3879376337, win 65535, options [mss 1460], length 0
21:57:47.765272 IP 10.0.2.15.39674 > 151.101.193.21.443: Flags [.], ack 1, win 64240, length 0
21:57:47.776012 IP 10.0.2.15.39674 > 151.101.193.21.443: Flags [P.], seq 1:518, ack 1, win 64240, length 517
21:57:47.776465 IP 151.101.193.21.443 > 10.0.2.15.39674: Flags [.], ack 518, win 65535, length 0
21:57:47.793323 IP 151.101.193.21.443 > 10.0.2.15.39674: Flags [.], seq 1:2921, ack 518, win 65535, length 2920
21:57:47.793344 IP 10.0.2.15.39674 > 151.101.193.21.443: Flags [.], ack 2921, win 62780, length 0
21:57:47.793521 IP 151.101.193.21.443 > 10.0.2.15.39674: Flags [P.], seq 2921:4123, ack 518, win 65535, length 1202
21:57:47.793533 IP 10.0.2.15.39674 > 151.101.193.21.443: Flags [.], ack 4123, win 61578, length 0
21:57:47.795017 IP 151.101.193.21.443 > 10.0.2.15.39674: Flags [P.], seq 4123:4493, ack 518, win 65535, length 370
21:57:47.795033 IP 10.0.2.15.39674 > 151.101.193.21.443: Flags [.], ack 4493, win 62780, length 0
21:57:47.795496 IP 10.0.2.15.39674 > 151.101.193.21.443: Flags [P.], seq 518:598, ack 4493, win 62780, length 80
21:57:47.795799 IP 151.101.193.21.443 > 10.0.2.15.39674: Flags [.], ack 598, win 65535, length 0
21:57:47.795855 IP 10.0.2.15.39674 > 151.101.193.21.443: Flags [P.], seq 598:644, ack 4493, win 62780, length 46
21:57:47.795885 IP 10.0.2.15.39674 > 151.101.193.21.443: Flags [P.], seq 644:693, ack 4493, win 62780, length 49
21:57:47.796123 IP 10.0.2.15.39674 > 151.101.193.21.443: Flags [P.], seq 693:790, ack 4493, win 62780, length 97
21:57:47.796445 IP 151.101.193.21.443 > 10.0.2.15.39674: Flags [.], ack 644, win 65535, length 0
21:57:47.796446 IP 151.101.193.21.443 > 10.0.2.15.39674: Flags [.], ack 693, win 65535, length 0
21:57:47.796447 IP 151.101.193.21.443 > 10.0.2.15.39674: Flags [.], ack 790, win 65535, length 0
21:57:47.809153 IP 151.101.193.21.443 > 10.0.2.15.39674: Flags [P.], seq 4493:4574, ack 790, win 65535, length 81
21:57:47.809175 IP 10.0.2.15.39674 > 151.101.193.21.443: Flags [.], ack 4574, win 62780, length 0
21:57:47.809437 IP 10.0.2.15.39674 > 151.101.193.21.443: Flags [P.], seq 790:821, ack 4574, win 62780, length 31
21:57:47.809729 IP 151.101.193.21.443 > 10.0.2.15.39674: Flags [.], ack 821, win 65535, length 0
21:57:47.812314 IP 151.101.193.21.443 > 10.0.2.15.39674: Flags [P.], seq 4574:4816, ack 821, win 65535, length 242
21:57:47.812338 IP 10.0.2.15.39674 > 151.101.193.21.443: Flags [.], ack 4816, win 62780, length 0
21:57:47.812833 IP 10.0.2.15.39674 > 151.101.193.21.443: Flags [P.], seq 821:845, ack 4816, win 62780, length 24
21:57:47.813136 IP 151.101.193.21.443 > 10.0.2.15.39674: Flags [.], ack 845, win 65535, length 0
21:57:47.813815 IP 10.0.2.15.39674 > 151.101.193.21.443: Flags [F.], seq 845, ack 4816, win 62780, length 0
21:57:47.814032 IP 151.101.193.21.443 > 10.0.2.15.39674: Flags [.], ack 846, win 65535, length 0
21:57:47.826932 IP 151.101.193.21.443 > 10.0.2.15.39674: Flags [P.], seq 4816:4840, ack 846, win 65535, length 24
21:57:47.826934 IP 151.101.193.21.443 > 10.0.2.15.39674: Flags [F.], seq 4840, ack 846, win 65535, length 0
21:57:47.826958 IP 10.0.2.15.39674 > 151.101.193.21.443: Flags [R], seq 3879377182, win 0, length 0
21:57:47.826983 IP 10.0.2.15.39674 > 151.101.193.21.443: Flags [R], seq 3879377182, win 0, length 0
21:57:47.827285 IP 151.101.193.21.443 > 10.0.2.15.39674: Flags [R.], seq 4010871295, ack 846, win 0, length 0

