21:57:58.403344 IP 10.0.2.15.45618 > 140.233.253.2.53: 51319+ A? www.paypal.com. (32)
21:57:58.403378 IP 10.0.2.15.45618 > 140.233.253.2.53: 41035+ AAAA? www.paypal.com. (32)
21:57:58.408739 IP 140.233.253.2.53 > 10.0.2.15.45618: 51319 3/0/0 CNAME www.glb.paypal.com., CNAME www-fastly.glb.paypal.com., A 151.101.193.21 (95)
21:57:58.408741 IP 140.233.253.2.53 > 10.0.2.15.45618: 41035 2/1/0 CNAME www.glb.paypal.com., CNAME www-fastly.glb.paypal.com. (144)
21:57:58.409321 IP 10.0.2.15.39678 > 151.101.193.21.443: Flags [S], seq 1931696261, win 64240, options [mss 1460,sackOK,TS val 4286621843 ecr 0,nop,wscale 6], length 0
21:57:58.424801 IP 151.101.193.21.443 > 10.0.2.15.39678: Flags [S.], seq 284352001, ack 1931696262, win 65535, options [mss 1460], length 0
21:57:58.424849 IP 10.0.2.15.39678 > 151.101.193.21.443: Flags [.], ack 1, win 64240, length 0
21:57:58.435343 IP 10.0.2.15.39678 > 151.101.193.21.443: Flags [P.], seq 1:518, ack 1, win 64240, length 517
21:57:58.435826 IP 151.101.193.21.443 > 10.0.2.15.39678: Flags [.], ack 518, win 65535, length 0

