22:01:37.121464 IP 10.0.2.15.43512 > 140.233.253.2.53: 16167+ A? www.paypal.com. (32)
22:01:37.121499 IP 10.0.2.15.43512 > 140.233.253.2.53: 31779+ AAAA? www.paypal.com. (32)
22:01:37.127485 IP 140.233.253.2.53 > 10.0.2.15.43512: 16167 3/0/0 CNAME www.glb.paypal.com., CNAME www-fastly.glb.paypal.com., A 151.101.65.21 (95)
22:01:37.129237 IP 140.233.253.2.53 > 10.0.2.15.43512: 31779 2/1/0 CNAME www.glb.paypal.com., CNAME www-fastly.glb.paypal.com. (144)
22:01:37.129553 IP 10.0.2.15.36838 > 151.101.65.21.443: Flags [S], seq 3172692578, win 64240, options [mss 1460,sackOK,TS val 3324625887 ecr 0,nop,wscale 6], length 0
22:01:37.144370 IP 151.101.65.21.443 > 10.0.2.15.36838: Flags [S.], seq 289600001, ack 3172692579, win 65535, options [mss 1460], length 0
22:01:37.144417 IP 10.0.2.15.36838 > 151.101.65.21.443: Flags [.], ack 1, win 64240, length 0
22:01:37.152842 IP 10.0.2.15.36838 > 151.101.65.21.443: Flags [P.], seq 1:518, ack 1, win 64240, length 517
22:01:37.153161 IP 151.101.65.21.443 > 10.0.2.15.36838: Flags [.], ack 518, win 65535, length 0
22:01:37.170645 IP 151.101.65.21.443 > 10.0.2.15.36838: Flags [.], seq 1:2921, ack 518, win 65535, length 2920
22:01:37.170691 IP 10.0.2.15.36838 > 151.101.65.21.443: Flags [.], ack 2921, win 62780, length 0
22:01:37.171035 IP 151.101.65.21.443 > 10.0.2.15.36838: Flags [P.], seq 2921:4493, ack 518, win 65535, length 1572
22:01:37.171057 IP 10.0.2.15.36838 > 151.101.65.21.443: Flags [.], ack 4493, win 61320, length 0
22:01:37.172532 IP 10.0.2.15.36838 > 151.101.65.21.443: Flags [P.], seq 518:598, ack 4493, win 62780, length 80
22:01:37.172954 IP 151.101.65.21.443 > 10.0.2.15.36838: Flags [.], ack 598, win 65535, length 0
22:01:37.173058 IP 10.0.2.15.36838 > 151.101.65.21.443: Flags [P.], seq 598:644, ack 4493, win 62780, length 46
22:01:37.173091 IP 10.0.2.15.36838 > 151.101.65.21.443: Flags [P.], seq 644:693, ack 4493, win 62780, length 49
22:01:37.173387 IP 151.101.65.21.443 > 10.0.2.15.36838: Flags [.], ack 644, win 65535, length 0
22:01:37.173389 IP 151.101.65.21.443 > 10.0.2.15.36838: Flags [.], ack 693, win 65535, length 0
22:01:37.173406 IP 10.0.2.15.36838 > 151.101.65.21.443: Flags [P.], seq 693:790, ack 4493, win 62780, length 97
22:01:37.173649 IP 151.101.65.21.443 > 10.0.2.15.36838: Flags [.], ack 790, win 65535, length 0
22:01:37.187573 IP 151.101.65.21.443 > 10.0.2.15.36838: Flags [P.], seq 4493:4552, ack 790, win 65535, length 59
22:01:37.187596 IP 10.0.2.15.36838 > 151.101.65.21.443: Flags [.], ack 4552, win 62780, length 0
22:01:37.187846 IP 10.0.2.15.36838 > 151.101.65.21.443: Flags [P.], seq 790:821, ack 4552, win 62780, length 31
22:01:37.188250 IP 151.101.65.21.443 > 10.0.2.15.36838: Flags [.], ack 821, win 65535, length 0

