22:01:42.391036 IP 10.0.2.15.58035 > 140.233.253.2.53: 64905+ A? www.paypal.com. (32)
22:01:42.391067 IP 10.0.2.15.58035 > 140.233.253.2.53: 44677+ AAAA? www.paypal.com. (32)
22:01:42.396952 IP 140.233.253.2.53 > 10.0.2.15.58035: 64905 3/0/0 CNAME www.glb.paypal.com., CNAME www-fastly.glb.paypal.com., A 151.101.65.21 (95)
22:01:42.398782 IP 140.233.253.2.53 > 10.0.2.15.58035: 44677 2/1/0 CNAME www.glb.paypal.com., CNAME www-fastly.glb.paypal.com. (144)
22:01:42.399160 IP 10.0.2.15.36840 > 151.101.65.21.443: Flags [S], seq 2812294559, win 64240, options [mss 1460,sackOK,TS val 3324631157 ecr 0,nop,wscale 6], length 0
22:01:42.414075 IP 151.101.65.21.443 > 10.0.2.15.36840: Flags [S.], seq 289728001, ack 2812294560, win 65535, options [mss 1460], length 0
22:01:42.414156 IP 10.0.2.15.36840 > 151.101.65.21.443: Flags [.], ack 1, win 64240, length 0
22:01:42.422159 IP 10.0.2.15.36840 > 151.101.65.21.443: Flags [P.], seq 1:518, ack 1, win 64240, length 517
22:01:42.422542 IP 151.101.65.21.443 > 10.0.2.15.36840: Flags [.], ack 518, win 65535, length 0
22:01:42.439569 IP 151.101.65.21.443 > 10.0.2.15.36840: Flags [P.], seq 1:1375, ack 518, win 65535, length 1374
22:01:42.439591 IP 10.0.2.15.36840 > 151.101.65.21.443: Flags [.], ack 1375, win 63204, length 0
22:01:42.440344 IP 151.101.65.21.443 > 10.0.2.15.36840: Flags [P.], seq 1375:4493, ack 518, win 65535, length 3118
22:01:42.440470 IP 10.0.2.15.36840 > 151.101.65.21.443: Flags [.], ack 4493, win 61320, length 0
22:01:42.442075 IP 10.0.2.15.36840 > 151.101.65.21.443: Flags [P.], seq 518:598, ack 4493, win 62780, length 80
22:01:42.442330 IP 10.0.2.15.36840 > 151.101.65.21.443: Flags [P.], seq 598:644, ack 4493, win 62780, length 46
22:01:42.442379 IP 151.101.65.21.443 > 10.0.2.15.36840: Flags [.], ack 598, win 65535, length 0
22:01:42.442418 IP 10.0.2.15.36840 > 151.101.65.21.443: Flags [P.], seq 644:693, ack 4493, win 62780, length 49
22:01:42.442564 IP 151.101.65.21.443 > 10.0.2.15.36840: Flags [.], ack 644, win 65535, length 0
22:01:42.442565 IP 151.101.65.21.443 > 10.0.2.15.36840: Flags [.], ack 693, win 65535, length 0
22:01:42.442576 IP 10.0.2.15.36840 > 151.101.65.21.443: Flags [P.], seq 693:790, ack 4493, win 62780, length 97
22:01:42.442731 IP 151.101.65.21.443 > 10.0.2.15.36840: Flags [.], ack 790, win 65535, length 0
22:01:42.456435 IP 151.101.65.21.443 > 10.0.2.15.36840: Flags [P.], seq 4493:4574, ack 790, win 65535, length 81
22:01:42.456457 IP 10.0.2.15.36840 > 151.101.65.21.443: Flags [.], ack 4574, win 62780, length 0
22:01:42.456722 IP 10.0.2.15.36840 > 151.101.65.21.443: Flags [P.], seq 790:821, ack 4574, win 62780, length 31
22:01:42.456989 IP 151.101.65.21.443 > 10.0.2.15.36840: Flags [.], ack 821, win 65535, length 0
22:01:42.460040 IP 151.101.65.21.443 > 10.0.2.15.36840: Flags [P.], seq 4574:4816, ack 821, win 65535, length 242
22:01:42.460064 IP 10.0.2.15.36840 > 151.101.65.21.443: Flags [.], ack 4816, win 62780, length 0
22:01:42.460647 IP 10.0.2.15.36840 > 151.101.65.21.443: Flags [P.], seq 821:845, ack 4816, win 62780, length 24
22:01:42.461008 IP 151.101.65.21.443 > 10.0.2.15.36840: Flags [.], ack 845, win 65535, length 0
22:01:42.462149 IP 10.0.2.15.36840 > 151.101.65.21.443: Flags [F.], seq 845, ack 4816, win 62780, length 0
22:01:42.462621 IP 151.101.65.21.443 > 10.0.2.15.36840: Flags [.], ack 846, win 65535, length 0

