21:59:55.028661 IP 10.0.2.15.34107 > 140.233.253.2.53: 7233+ A? www.paypal.com. (32)
21:59:55.028700 IP 10.0.2.15.34107 > 140.233.253.2.53: 41566+ AAAA? www.paypal.com. (32)
21:59:55.045218 IP 140.233.253.2.53 > 10.0.2.15.34107: 41566 2/1/0 CNAME www.glb.paypal.com., CNAME www-fastly.glb.paypal.com. (144)
21:59:55.055993 IP 140.233.253.2.53 > 10.0.2.15.34107: 7233 3/0/0 CNAME www.glb.paypal.com., CNAME www-fastly.glb.paypal.com., A 151.101.65.21 (95)
21:59:55.056275 IP 10.0.2.15.36798 > 151.101.65.21.443: Flags [S], seq 48498830, win 64240, options [mss 1460,sackOK,TS val 3324523814 ecr 0,nop,wscale 6], length 0
21:59:55.071337 IP 151.101.65.21.443 > 10.0.2.15.36798: Flags [S.], seq 287168001, ack 48498831, win 65535, options [mss 1460], length 0
21:59:55.071423 IP 10.0.2.15.36798 > 151.101.65.21.443: Flags [.], ack 1, win 64240, length 0
21:59:55.084358 IP 10.0.2.15.36798 > 151.101.65.21.443: Flags [P.], seq 1:518, ack 1, win 64240, length 517
21:59:55.084735 IP 151.101.65.21.443 > 10.0.2.15.36798: Flags [.], ack 518, win 65535, length 0
21:59:55.102577 IP 151.101.65.21.443 > 10.0.2.15.36798: Flags [.], seq 1:2921, ack 518, win 65535, length 2920
21:59:55.102598 IP 10.0.2.15.36798 > 151.101.65.21.443: Flags [.], ack 2921, win 62780, length 0
21:59:55.102781 IP 151.101.65.21.443 > 10.0.2.15.36798: Flags [P.], seq 2921:4493, ack 518, win 65535, length 1572
21:59:55.102794 IP 10.0.2.15.36798 > 151.101.65.21.443: Flags [.], ack 4493, win 61320, length 0
21:59:55.103789 IP 10.0.2.15.36798 > 151.101.65.21.443: Flags [P.], seq 518:598, ack 4493, win 62780, length 80
21:59:55.104131 IP 151.101.65.21.443 > 10.0.2.15.36798: Flags [.], ack 598, win 65535, length 0
21:59:55.104227 IP 10.0.2.15.36798 > 151.101.65.21.443: Flags [P.], seq 598:644, ack 4493, win 62780, length 46
21:59:55.104260 IP 10.0.2.15.36798 > 151.101.65.21.443: Flags [P.], seq 644:693, ack 4493, win 62780, length 49
21:59:55.104428 IP 151.101.65.21.443 > 10.0.2.15.36798: Flags [.], ack 644, win 65535, length 0
21:59:55.104429 IP 151.101.65.21.443 > 10.0.2.15.36798: Flags [.], ack 693, win 65535, length 0
21:59:55.104445 IP 10.0.2.15.36798 > 151.101.65.21.443: Flags [P.], seq 693:790, ack 4493, win 62780, length 97
21:59:55.104572 IP 151.101.65.21.443 > 10.0.2.15.36798: Flags [.], ack 790, win 65535, length 0
21:59:55.123453 IP 151.101.65.21.443 > 10.0.2.15.36798: Flags [P.], seq 4493:4552, ack 790, win 65535, length 59
21:59:55.123476 IP 10.0.2.15.36798 > 151.101.65.21.443: Flags [.], ack 4552, win 62780, length 0
21:59:55.123798 IP 10.0.2.15.36798 > 151.101.65.21.443: Flags [P.], seq 790:821, ack 4552, win 62780, length 31
21:59:55.124032 IP 151.101.65.21.443 > 10.0.2.15.36798: Flags [.], ack 821, win 65535, length 0
21:59:55.127756 IP 151.101.65.21.443 > 10.0.2.15.36798: Flags [P.], seq 4552:4794, ack 821, win 65535, length 242
21:59:55.127782 IP 10.0.2.15.36798 > 151.101.65.21.443: Flags [.], ack 4794, win 62780, length 0
21:59:55.128799 IP 10.0.2.15.36798 > 151.101.65.21.443: Flags [P.], seq 821:845, ack 4794, win 62780, length 24
21:59:55.129346 IP 151.101.65.21.443 > 10.0.2.15.36798: Flags [.], ack 845, win 65535, length 0
21:59:55.130491 IP 10.0.2.15.36798 > 151.101.65.21.443: Flags [F.], seq 845, ack 4794, win 62780, length 0
21:59:55.131342 IP 151.101.65.21.443 > 10.0.2.15.36798: Flags [.], ack 846, win 65535, length 0

