22:00:05.925565 IP 10.0.2.15.42388 > 140.233.253.2.53: 59118+ A? www.paypal.com. (32)
22:00:05.925610 IP 10.0.2.15.42388 > 140.233.253.2.53: 27629+ AAAA? www.paypal.com. (32)
22:00:05.932216 IP 140.233.253.2.53 > 10.0.2.15.42388: 59118 3/0/0 CNAME www.glb.paypal.com., CNAME www-fastly.glb.paypal.com., A 151.101.65.21 (95)
22:00:05.932218 IP 140.233.253.2.53 > 10.0.2.15.42388: 27629 2/1/0 CNAME www.glb.paypal.com., CNAME www-fastly.glb.paypal.com. (144)
22:00:05.932516 IP 10.0.2.15.36802 > 151.101.65.21.443: Flags [S], seq 1386616233, win 64240, options [mss 1460,sackOK,TS val 3324534690 ecr 0,nop,wscale 6], length 0
22:00:05.947048 IP 151.101.65.21.443 > 10.0.2.15.36802: Flags [S.], seq 287424001, ack 1386616234, win 65535, options [mss 1460], length 0
22:00:05.947094 IP 10.0.2.15.36802 > 151.101.65.21.443: Flags [.], ack 1, win 64240, length 0
22:00:05.955685 IP 10.0.2.15.36802 > 151.101.65.21.443: Flags [P.], seq 1:518, ack 1, win 64240, length 517
22:00:05.956110 IP 151.101.65.21.443 > 10.0.2.15.36802: Flags [.], ack 518, win 65535, length 0
22:00:05.973540 IP 151.101.65.21.443 > 10.0.2.15.36802: Flags [P.], seq 1:1375, ack 518, win 65535, length 1374
22:00:05.973562 IP 10.0.2.15.36802 > 151.101.65.21.443: Flags [.], ack 1375, win 63204, length 0
22:00:05.975793 IP 151.101.65.21.443 > 10.0.2.15.36802: Flags [P.], seq 1375:4493, ack 518, win 65535, length 3118
22:00:05.975844 IP 10.0.2.15.36802 > 151.101.65.21.443: Flags [.], ack 4493, win 62780, length 0
22:00:05.977163 IP 10.0.2.15.36802 > 151.101.65.21.443: Flags [P.], seq 518:598, ack 4493, win 62780, length 80
22:00:05.977573 IP 151.101.65.21.443 > 10.0.2.15.36802: Flags [.], ack 598, win 65535, length 0
22:00:05.977743 IP 10.0.2.15.36802 > 151.101.65.21.443: Flags [P.], seq 598:644, ack 4493, win 62780, length 46
22:00:05.977780 IP 10.0.2.15.36802 > 151.101.65.21.443: Flags [P.], seq 644:693, ack 4493, win 62780, length 49
22:00:05.977929 IP 10.0.2.15.36802 > 151.101.65.21.443: Flags [P.], seq 693:728, ack 4493, win 62780, length 35
22:00:05.978031 IP 151.101.65.21.443 > 10.0.2.15.36802: Flags [.], ack 644, win 65535, length 0
22:00:05.978033 IP 151.101.65.21.443 > 10.0.2.15.36802: Flags [.], ack 693, win 65535, length 0
22:00:05.978098 IP 10.0.2.15.36802 > 151.101.65.21.443: Flags [P.], seq 728:790, ack 4493, win 62780, length 62
22:00:05.978372 IP 151.101.65.21.443 > 10.0.2.15.36802: Flags [.], ack 728, win 65535, length 0
22:00:05.978374 IP 151.101.65.21.443 > 10.0.2.15.36802: Flags [.], ack 790, win 65535, length 0
22:00:05.991977 IP 151.101.65.21.443 > 10.0.2.15.36802: Flags [P.], seq 4493:4552, ack 790, win 65535, length 59
22:00:05.992132 IP 10.0.2.15.36802 > 151.101.65.21.443: Flags [.], ack 4552, win 62780, length 0
22:00:05.993498 IP 151.101.65.21.443 > 10.0.2.15.36802: Flags [P.], seq 4552:4794, ack 790, win 65535, length 242
22:00:05.993525 IP 10.0.2.15.36802 > 151.101.65.21.443: Flags [.], ack 4794, win 62780, length 0
22:00:05.993702 IP 10.0.2.15.36802 > 151.101.65.21.443: Flags [P.], seq 790:821, ack 4794, win 62780, length 31
22:00:05.993935 IP 151.101.65.21.443 > 10.0.2.15.36802: Flags [.], ack 821, win 65535, length 0
22:00:05.994167 IP 10.0.2.15.36802 > 151.101.65.21.443: Flags [P.], seq 821:845, ack 4794, win 62780, length 24
22:00:05.994307 IP 151.101.65.21.443 > 10.0.2.15.36802: Flags [.], ack 845, win 65535, length 0
22:00:05.994945 IP 10.0.2.15.36802 > 151.101.65.21.443: Flags [F.], seq 845, ack 4794, win 62780, length 0
22:00:05.995165 IP 151.101.65.21.443 > 10.0.2.15.36802: Flags [.], ack 846, win 65535, length 0
22:00:06.008338 IP 151.101.65.21.443 > 10.0.2.15.36802: Flags [P.], seq 4794:4818, ack 846, win 65535, length 24
22:00:06.008340 IP 151.101.65.21.443 > 10.0.2.15.36802: Flags [F.], seq 4818, ack 846, win 65535, length 0
22:00:06.008364 IP 10.0.2.15.36802 > 151.101.65.21.443: Flags [R], seq 1386617079, win 0, length 0
22:00:06.008393 IP 10.0.2.15.36802 > 151.101.65.21.443: Flags [R], seq 1386617079, win 0, length 0
22:00:06.008737 IP 151.101.65.21.443 > 10.0.2.15.36802: Flags [R.], seq 4007543295, ack 846, win 0, length 0

