23:02:19.046358 IP 10.0.2.15.58155 > 140.233.253.2.53: 35889+ A? www.live.com. (30)
23:02:19.046410 IP 10.0.2.15.58155 > 140.233.253.2.53: 47925+ AAAA? www.live.com. (30)
23:02:19.064521 IP 140.233.253.2.53 > 10.0.2.15.58155: 47925 3/0/0 CNAME outlook-fd-0010.live.com., CNAME a-0010.a-msedge.net., AAAA 2620:1ec:c11::212 (121)
23:02:19.064524 IP 140.233.253.2.53 > 10.0.2.15.58155: 35889 3/0/0 CNAME outlook-fd-0010.live.com., CNAME a-0010.a-msedge.net., A 204.79.197.212 (109)
23:02:19.065519 IP 10.0.2.15.36164 > 204.79.197.212.443: Flags [S], seq 786059275, win 64240, options [mss 1460,sackOK,TS val 2022045080 ecr 0,nop,wscale 6], length 0
23:02:19.081642 IP 204.79.197.212.443 > 10.0.2.15.36164: Flags [S.], seq 397568001, ack 786059276, win 65535, options [mss 1460], length 0
23:02:19.081681 IP 10.0.2.15.36164 > 204.79.197.212.443: Flags [.], ack 1, win 64240, length 0
23:02:19.096757 IP 10.0.2.15.36164 > 204.79.197.212.443: Flags [P.], seq 1:518, ack 1, win 64240, length 517
23:02:19.097106 IP 204.79.197.212.443 > 10.0.2.15.36164: Flags [.], ack 518, win 65535, length 0
23:02:19.115248 IP 204.79.197.212.443 > 10.0.2.15.36164: Flags [P.], seq 1:2773, ack 518, win 65535, length 2772
23:02:19.115268 IP 10.0.2.15.36164 > 204.79.197.212.443: Flags [.], ack 2773, win 62780, length 0
23:02:19.117047 IP 204.79.197.212.443 > 10.0.2.15.36164: Flags [P.], seq 2773:3656, ack 518, win 65535, length 883
23:02:19.117066 IP 10.0.2.15.36164 > 204.79.197.212.443: Flags [.], ack 3656, win 62780, length 0
23:02:19.120883 IP 10.0.2.15.36164 > 204.79.197.212.443: Flags [P.], seq 518:676, ack 3656, win 62780, length 158
23:02:19.121238 IP 204.79.197.212.443 > 10.0.2.15.36164: Flags [.], ack 676, win 65535, length 0

