23:03:16.667615 IP 10.0.2.15.55865 > 140.233.253.2.53: 41635+ A? www.live.com. (30)
23:03:16.667654 IP 10.0.2.15.55865 > 140.233.253.2.53: 11439+ AAAA? www.live.com. (30)
23:03:16.673079 IP 140.233.253.2.53 > 10.0.2.15.55865: 41635 3/0/0 CNAME outlook-fd-0010.live.com., CNAME a-0010.a-msedge.net., A 204.79.197.212 (109)
23:03:16.673082 IP 140.233.253.2.53 > 10.0.2.15.55865: 11439 3/0/0 CNAME outlook-fd-0010.live.com., CNAME a-0010.a-msedge.net., AAAA 2620:1ec:c11::212 (121)
23:03:16.673680 IP 10.0.2.15.36188 > 204.79.197.212.443: Flags [S], seq 1544836607, win 64240, options [mss 1460,sackOK,TS val 2022102688 ecr 0,nop,wscale 6], length 0
23:03:16.689047 IP 204.79.197.212.443 > 10.0.2.15.36188: Flags [S.], seq 398976001, ack 1544836608, win 65535, options [mss 1460], length 0
23:03:16.689093 IP 10.0.2.15.36188 > 204.79.197.212.443: Flags [.], ack 1, win 64240, length 0
23:03:16.699559 IP 10.0.2.15.36188 > 204.79.197.212.443: Flags [P.], seq 1:518, ack 1, win 64240, length 517
23:03:16.699903 IP 204.79.197.212.443 > 10.0.2.15.36188: Flags [.], ack 518, win 65535, length 0
23:03:16.720831 IP 204.79.197.212.443 > 10.0.2.15.36188: Flags [.], seq 1:2921, ack 518, win 65535, length 2920
23:03:16.720854 IP 10.0.2.15.36188 > 204.79.197.212.443: Flags [.], ack 2921, win 62780, length 0
23:03:16.721281 IP 204.79.197.212.443 > 10.0.2.15.36188: Flags [P.], seq 2921:3740, ack 518, win 65535, length 819
23:03:16.721293 IP 10.0.2.15.36188 > 204.79.197.212.443: Flags [.], ack 3740, win 62780, length 0
23:03:16.726224 IP 10.0.2.15.36188 > 204.79.197.212.443: Flags [P.], seq 518:676, ack 3740, win 62780, length 158
23:03:16.726725 IP 204.79.197.212.443 > 10.0.2.15.36188: Flags [.], ack 676, win 65535, length 0

