23:03:42.845394 IP 10.0.2.15.36604 > 140.233.253.2.53: 43887+ A? www.live.com. (30)
23:03:42.845429 IP 10.0.2.15.36604 > 140.233.253.2.53: 34411+ AAAA? www.live.com. (30)
23:03:42.851093 IP 140.233.253.2.53 > 10.0.2.15.36604: 43887 3/0/0 CNAME outlook-fd-0010.live.com., CNAME a-0010.a-msedge.net., A 204.79.197.212 (109)
23:03:42.851096 IP 140.233.253.2.53 > 10.0.2.15.36604: 34411 3/0/0 CNAME outlook-fd-0010.live.com., CNAME a-0010.a-msedge.net., AAAA 2620:1ec:c11::212 (121)
23:03:42.851441 IP 10.0.2.15.36198 > 204.79.197.212.443: Flags [S], seq 1609567902, win 64240, options [mss 1460,sackOK,TS val 2022128866 ecr 0,nop,wscale 6], length 0
23:03:42.865853 IP 204.79.197.212.443 > 10.0.2.15.36198: Flags [S.], seq 399616001, ack 1609567903, win 65535, options [mss 1460], length 0
23:03:42.865899 IP 10.0.2.15.36198 > 204.79.197.212.443: Flags [.], ack 1, win 64240, length 0
23:03:42.873702 IP 10.0.2.15.36198 > 204.79.197.212.443: Flags [P.], seq 1:518, ack 1, win 64240, length 517
23:03:42.874029 IP 204.79.197.212.443 > 10.0.2.15.36198: Flags [.], ack 518, win 65535, length 0
23:03:42.889406 IP 204.79.197.212.443 > 10.0.2.15.36198: Flags [P.], seq 1:2773, ack 518, win 65535, length 2772
23:03:42.889430 IP 10.0.2.15.36198 > 204.79.197.212.443: Flags [.], ack 2773, win 62780, length 0
23:03:42.890917 IP 204.79.197.212.443 > 10.0.2.15.36198: Flags [P.], seq 2773:3656, ack 518, win 65535, length 883
23:03:42.890937 IP 10.0.2.15.36198 > 204.79.197.212.443: Flags [.], ack 3656, win 62780, length 0
23:03:42.894865 IP 10.0.2.15.36198 > 204.79.197.212.443: Flags [P.], seq 518:676, ack 3656, win 62780, length 158
23:03:42.895256 IP 204.79.197.212.443 > 10.0.2.15.36198: Flags [.], ack 676, win 65535, length 0
23:03:42.909104 IP 204.79.197.212.443 > 10.0.2.15.36198: Flags [P.], seq 3656:3776, ack 676, win 65535, length 120
23:03:42.909125 IP 10.0.2.15.36198 > 204.79.197.212.443: Flags [.], ack 3776, win 62780, length 0
23:03:42.909497 IP 10.0.2.15.36198 > 204.79.197.212.443: Flags [P.], seq 676:729, ack 3776, win 62780, length 53
23:03:42.909528 IP 10.0.2.15.36198 > 204.79.197.212.443: Flags [P.], seq 729:785, ack 3776, win 62780, length 56
23:03:42.909688 IP 10.0.2.15.36198 > 204.79.197.212.443: Flags [P.], seq 785:932, ack 3776, win 62780, length 147
23:03:42.909809 IP 204.79.197.212.443 > 10.0.2.15.36198: Flags [.], ack 729, win 65535, length 0
23:03:42.909811 IP 204.79.197.212.443 > 10.0.2.15.36198: Flags [.], ack 785, win 65535, length 0
23:03:42.909954 IP 204.79.197.212.443 > 10.0.2.15.36198: Flags [.], ack 932, win 65535, length 0

