23:03:21.901815 IP 10.0.2.15.47865 > 140.233.253.2.53: 64004+ A? www.live.com. (30)
23:03:21.901865 IP 10.0.2.15.47865 > 140.233.253.2.53: 1281+ AAAA? www.live.com. (30)
23:03:21.908903 IP 140.233.253.2.53 > 10.0.2.15.47865: 1281 3/0/0 CNAME outlook-fd-0010.live.com., CNAME a-0010.a-msedge.net., AAAA 2620:1ec:c11::212 (121)
23:03:21.908905 IP 140.233.253.2.53 > 10.0.2.15.47865: 64004 3/0/0 CNAME outlook-fd-0010.live.com., CNAME a-0010.a-msedge.net., A 204.79.197.212 (109)
23:03:21.909298 IP 10.0.2.15.36190 > 204.79.197.212.443: Flags [S], seq 3622414527, win 64240, options [mss 1460,sackOK,TS val 2022107924 ecr 0,nop,wscale 6], length 0
23:03:21.923569 IP 204.79.197.212.443 > 10.0.2.15.36190: Flags [S.], seq 399104001, ack 3622414528, win 65535, options [mss 1460], length 0
23:03:21.923609 IP 10.0.2.15.36190 > 204.79.197.212.443: Flags [.], ack 1, win 64240, length 0
23:03:21.931494 IP 10.0.2.15.36190 > 204.79.197.212.443: Flags [P.], seq 1:518, ack 1, win 64240, length 517
23:03:21.931800 IP 204.79.197.212.443 > 10.0.2.15.36190: Flags [.], ack 518, win 65535, length 0
23:03:21.951864 IP 204.79.197.212.443 > 10.0.2.15.36190: Flags [.], seq 1:2921, ack 518, win 65535, length 2920
23:03:21.951886 IP 10.0.2.15.36190 > 204.79.197.212.443: Flags [.], ack 2921, win 62780, length 0
23:03:21.952177 IP 204.79.197.212.443 > 10.0.2.15.36190: Flags [P.], seq 2921:3656, ack 518, win 65535, length 735
23:03:21.952189 IP 10.0.2.15.36190 > 204.79.197.212.443: Flags [.], ack 3656, win 62780, length 0
23:03:21.956794 IP 10.0.2.15.36190 > 204.79.197.212.443: Flags [P.], seq 518:676, ack 3656, win 62780, length 158
23:03:21.957111 IP 204.79.197.212.443 > 10.0.2.15.36190: Flags [.], ack 676, win 65535, length 0
23:03:21.972121 IP 204.79.197.212.443 > 10.0.2.15.36190: Flags [P.], seq 3656:3776, ack 676, win 65535, length 120
23:03:21.972142 IP 10.0.2.15.36190 > 204.79.197.212.443: Flags [.], ack 3776, win 62780, length 0
23:03:21.972607 IP 10.0.2.15.36190 > 204.79.197.212.443: Flags [P.], seq 676:729, ack 3776, win 62780, length 53
23:03:21.972646 IP 10.0.2.15.36190 > 204.79.197.212.443: Flags [P.], seq 729:785, ack 3776, win 62780, length 56
23:03:21.972920 IP 204.79.197.212.443 > 10.0.2.15.36190: Flags [.], ack 729, win 65535, length 0
23:03:21.972921 IP 204.79.197.212.443 > 10.0.2.15.36190: Flags [.], ack 785, win 65535, length 0
23:03:21.972943 IP 10.0.2.15.36190 > 204.79.197.212.443: Flags [P.], seq 785:894, ack 3776, win 62780, length 109
23:03:21.973106 IP 204.79.197.212.443 > 10.0.2.15.36190: Flags [.], ack 894, win 65535, length 0
23:03:21.973141 IP 10.0.2.15.36190 > 204.79.197.212.443: Flags [P.], seq 894:932, ack 3776, win 62780, length 38
23:03:21.973393 IP 204.79.197.212.443 > 10.0.2.15.36190: Flags [.], ack 932, win 65535, length 0
23:03:21.985842 IP 204.79.197.212.443 > 10.0.2.15.36190: Flags [P.], seq 3776:3814, ack 932, win 65535, length 38
23:03:21.985924 IP 10.0.2.15.36190 > 204.79.197.212.443: Flags [.], ack 3814, win 62780, length 0
23:03:21.987972 IP 204.79.197.212.443 > 10.0.2.15.36190: Flags [P.], seq 3814:3995, ack 932, win 65535, length 181
23:03:21.987991 IP 10.0.2.15.36190 > 204.79.197.212.443: Flags [.], ack 3995, win 62780, length 0

