23:06:04.712279 IP 10.0.2.15.33489 > 140.233.253.2.53: 932+ A? www.live.com. (30)
23:06:04.712318 IP 10.0.2.15.33489 > 140.233.253.2.53: 35753+ AAAA? www.live.com. (30)
23:06:04.718619 IP 140.233.253.2.53 > 10.0.2.15.33489: 35753 3/0/0 CNAME outlook-fd-0010.live.com., CNAME a-0010.a-msedge.net., AAAA 2620:1ec:c11::212 (121)
23:06:04.718621 IP 140.233.253.2.53 > 10.0.2.15.33489: 932 3/0/0 CNAME outlook-fd-0010.live.com., CNAME a-0010.a-msedge.net., A 204.79.197.212 (109)
23:06:04.719064 IP 10.0.2.15.36254 > 204.79.197.212.443: Flags [S], seq 952505726, win 64240, options [mss 1460,sackOK,TS val 2022270734 ecr 0,nop,wscale 6], length 0
23:06:04.735447 IP 204.79.197.212.443 > 10.0.2.15.36254: Flags [S.], seq 403072001, ack 952505727, win 65535, options [mss 1460], length 0
23:06:04.735487 IP 10.0.2.15.36254 > 204.79.197.212.443: Flags [.], ack 1, win 64240, length 0
23:06:04.746938 IP 10.0.2.15.36254 > 204.79.197.212.443: Flags [P.], seq 1:518, ack 1, win 64240, length 517
23:06:04.747235 IP 204.79.197.212.443 > 10.0.2.15.36254: Flags [.], ack 518, win 65535, length 0
23:06:04.765149 IP 204.79.197.212.443 > 10.0.2.15.36254: Flags [P.], seq 1:2773, ack 518, win 65535, length 2772
23:06:04.765167 IP 10.0.2.15.36254 > 204.79.197.212.443: Flags [.], ack 2773, win 62780, length 0
23:06:04.766659 IP 204.79.197.212.443 > 10.0.2.15.36254: Flags [P.], seq 2773:3656, ack 518, win 65535, length 883
23:06:04.766678 IP 10.0.2.15.36254 > 204.79.197.212.443: Flags [.], ack 3656, win 62780, length 0
23:06:04.770256 IP 10.0.2.15.36254 > 204.79.197.212.443: Flags [P.], seq 518:676, ack 3656, win 62780, length 158
23:06:04.770758 IP 204.79.197.212.443 > 10.0.2.15.36254: Flags [.], ack 676, win 65535, length 0
23:06:04.785727 IP 204.79.197.212.443 > 10.0.2.15.36254: Flags [P.], seq 3656:3776, ack 676, win 65535, length 120
23:06:04.785746 IP 10.0.2.15.36254 > 204.79.197.212.443: Flags [.], ack 3776, win 62780, length 0
23:06:04.786114 IP 10.0.2.15.36254 > 204.79.197.212.443: Flags [P.], seq 676:729, ack 3776, win 62780, length 53
23:06:04.786145 IP 10.0.2.15.36254 > 204.79.197.212.443: Flags [P.], seq 729:785, ack 3776, win 62780, length 56
23:06:04.786299 IP 10.0.2.15.36254 > 204.79.197.212.443: Flags [P.], seq 785:932, ack 3776, win 62780, length 147
23:06:04.786360 IP 204.79.197.212.443 > 10.0.2.15.36254: Flags [.], ack 729, win 65535, length 0
23:06:04.786483 IP 204.79.197.212.443 > 10.0.2.15.36254: Flags [.], ack 785, win 65535, length 0
23:06:04.786484 IP 204.79.197.212.443 > 10.0.2.15.36254: Flags [.], ack 932, win 65535, length 0

