23:03:27.128565 IP 10.0.2.15.40239 > 140.233.253.2.53: 33855+ A? www.live.com. (30)
23:03:27.128596 IP 10.0.2.15.40239 > 140.233.253.2.53: 38714+ AAAA? www.live.com. (30)
23:03:27.134499 IP 140.233.253.2.53 > 10.0.2.15.40239: 33855 3/0/0 CNAME outlook-fd-0010.live.com., CNAME a-0010.a-msedge.net., A 204.79.197.212 (109)
23:03:27.135505 IP 140.233.253.2.53 > 10.0.2.15.40239: 38714 3/0/0 CNAME outlook-fd-0010.live.com., CNAME a-0010.a-msedge.net., AAAA 2620:1ec:c11::212 (121)
23:03:27.136458 IP 10.0.2.15.36192 > 204.79.197.212.443: Flags [S], seq 1640612879, win 64240, options [mss 1460,sackOK,TS val 2022113151 ecr 0,nop,wscale 6], length 0
23:03:27.151714 IP 204.79.197.212.443 > 10.0.2.15.36192: Flags [S.], seq 399232001, ack 1640612880, win 65535, options [mss 1460], length 0
23:03:27.151760 IP 10.0.2.15.36192 > 204.79.197.212.443: Flags [.], ack 1, win 64240, length 0
23:03:27.160075 IP 10.0.2.15.36192 > 204.79.197.212.443: Flags [P.], seq 1:518, ack 1, win 64240, length 517
23:03:27.160447 IP 204.79.197.212.443 > 10.0.2.15.36192: Flags [.], ack 518, win 65535, length 0
23:03:27.179606 IP 204.79.197.212.443 > 10.0.2.15.36192: Flags [.], seq 1:2921, ack 518, win 65535, length 2920
23:03:27.179635 IP 10.0.2.15.36192 > 204.79.197.212.443: Flags [.], ack 2921, win 62780, length 0
23:03:27.179912 IP 204.79.197.212.443 > 10.0.2.15.36192: Flags [P.], seq 2921:3656, ack 518, win 65535, length 735
23:03:27.179922 IP 10.0.2.15.36192 > 204.79.197.212.443: Flags [.], ack 3656, win 62780, length 0
23:03:27.184969 IP 10.0.2.15.36192 > 204.79.197.212.443: Flags [P.], seq 518:676, ack 3656, win 62780, length 158
23:03:27.185291 IP 204.79.197.212.443 > 10.0.2.15.36192: Flags [.], ack 676, win 65535, length 0
23:03:27.200036 IP 204.79.197.212.443 > 10.0.2.15.36192: Flags [P.], seq 3656:3776, ack 676, win 65535, length 120
23:03:27.200086 IP 10.0.2.15.36192 > 204.79.197.212.443: Flags [.], ack 3776, win 62780, length 0
23:03:27.200678 IP 10.0.2.15.36192 > 204.79.197.212.443: Flags [P.], seq 676:729, ack 3776, win 62780, length 53
23:03:27.200716 IP 10.0.2.15.36192 > 204.79.197.212.443: Flags [P.], seq 729:785, ack 3776, win 62780, length 56
23:03:27.200839 IP 10.0.2.15.36192 > 204.79.197.212.443: Flags [P.], seq 785:894, ack 3776, win 62780, length 109
23:03:27.201135 IP 204.79.197.212.443 > 10.0.2.15.36192: Flags [.], ack 729, win 65535, length 0
23:03:27.201137 IP 204.79.197.212.443 > 10.0.2.15.36192: Flags [.], ack 785, win 65535, length 0
23:03:27.201137 IP 204.79.197.212.443 > 10.0.2.15.36192: Flags [.], ack 894, win 65535, length 0
23:03:27.201154 IP 10.0.2.15.36192 > 204.79.197.212.443: Flags [P.], seq 894:932, ack 3776, win 62780, length 38
23:03:27.201337 IP 204.79.197.212.443 > 10.0.2.15.36192: Flags [.], ack 932, win 65535, length 0
23:03:27.213930 IP 204.79.197.212.443 > 10.0.2.15.36192: Flags [P.], seq 3776:3814, ack 932, win 65535, length 38
23:03:27.213951 IP 10.0.2.15.36192 > 204.79.197.212.443: Flags [.], ack 3814, win 62780, length 0

