13:06:37.981802 IP 10.0.2.15.35854 > 142.250.65.238.443: Flags [P.], seq 1508299899:1508300416, ack 34560002, win 64240, length 517
13:06:37.982462 IP 142.250.65.238.443 > 10.0.2.15.35854: Flags [.], ack 517, win 65535, length 0
13:06:38.006321 IP 142.250.65.238.443 > 10.0.2.15.35854: Flags [.], seq 1:2921, ack 517, win 65535, length 2920
13:06:38.006341 IP 10.0.2.15.35854 > 142.250.65.238.443: Flags [.], ack 2921, win 62780, length 0
13:06:38.006941 IP 142.250.65.238.443 > 10.0.2.15.35854: Flags [P.], seq 2921:6651, ack 517, win 65535, length 3730
13:06:38.006957 IP 10.0.2.15.35854 > 142.250.65.238.443: Flags [.], ack 6651, win 59860, length 0
13:06:38.008136 IP 10.0.2.15.35854 > 142.250.65.238.443: Flags [P.], seq 517:597, ack 6651, win 62780, length 80
13:06:38.008656 IP 142.250.65.238.443 > 10.0.2.15.35854: Flags [.], ack 597, win 65535, length 0
13:06:38.008726 IP 10.0.2.15.35854 > 142.250.65.238.443: Flags [P.], seq 597:643, ack 6651, win 62780, length 46
13:06:38.008755 IP 10.0.2.15.35854 > 142.250.65.238.443: Flags [P.], seq 643:692, ack 6651, win 62780, length 49
13:06:38.008914 IP 10.0.2.15.35854 > 142.250.65.238.443: Flags [P.], seq 692:727, ack 6651, win 62780, length 35
13:06:38.008946 IP 10.0.2.15.35854 > 142.250.65.238.443: Flags [P.], seq 727:790, ack 6651, win 62780, length 63
13:06:38.009121 IP 142.250.65.238.443 > 10.0.2.15.35854: Flags [.], ack 643, win 65535, length 0
13:06:38.009122 IP 142.250.65.238.443 > 10.0.2.15.35854: Flags [.], ack 692, win 65535, length 0
13:06:38.009123 IP 142.250.65.238.443 > 10.0.2.15.35854: Flags [.], ack 727, win 65535, length 0
13:06:38.009123 IP 142.250.65.238.443 > 10.0.2.15.35854: Flags [.], ack 790, win 65535, length 0
13:06:38.022531 IP 142.250.65.238.443 > 10.0.2.15.35854: Flags [P.], seq 6651:7324, ack 790, win 65535, length 673
13:06:38.022560 IP 10.0.2.15.35854 > 142.250.65.238.443: Flags [.], ack 7324, win 62780, length 0
13:06:38.023342 IP 10.0.2.15.35854 > 142.250.65.238.443: Flags [P.], seq 790:821, ack 7324, win 62780, length 31
13:06:38.023968 IP 142.250.65.238.443 > 10.0.2.15.35854: Flags [.], ack 821, win 65535, length 0
13:06:38.059241 IP 142.250.65.238.443 > 10.0.2.15.35854: Flags [.], seq 7324:14624, ack 821, win 65535, length 7300
13:06:38.059264 IP 10.0.2.15.35854 > 142.250.65.238.443: Flags [.], ack 14624, win 59860, length 0
13:06:38.059762 IP 142.250.65.238.443 > 10.0.2.15.35854: Flags [P.], seq 14624:15237, ack 821, win 65535, length 613
13:06:38.059776 IP 10.0.2.15.35854 > 142.250.65.238.443: Flags [.], ack 15237, win 59247, length 0
13:06:38.060741 IP 142.250.65.238.443 > 10.0.2.15.35854: Flags [P.], seq 15237:17186, ack 821, win 65535, length 1949
13:06:38.060760 IP 10.0.2.15.35854 > 142.250.65.238.443: Flags [.], ack 17186, win 62780, length 0
13:06:38.061610 IP 142.250.65.238.443 > 10.0.2.15.35854: Flags [P.], seq 17186:19934, ack 821, win 65535, length 2748
13:06:38.061630 IP 10.0.2.15.35854 > 142.250.65.238.443: Flags [.], ack 19934, win 62780, length 0
13:06:38.062836 IP 142.250.65.238.443 > 10.0.2.15.35854: Flags [P.], seq 19934:22682, ack 821, win 65535, length 2748
13:06:38.062860 IP 10.0.2.15.35854 > 142.250.65.238.443: Flags [.], ack 22682, win 62780, length 0
13:06:38.064154 IP 142.250.65.238.443 > 10.0.2.15.35854: Flags [P.], seq 22682:25430, ack 821, win 65535, length 2748
13:06:38.064177 IP 10.0.2.15.35854 > 142.250.65.238.443: Flags [.], ack 25430, win 62780, length 0
13:06:38.064708 IP 142.250.65.238.443 > 10.0.2.15.35854: Flags [P.], seq 25430:28178, ack 821, win 65535, length 2748
13:06:38.064722 IP 10.0.2.15.35854 > 142.250.65.238.443: Flags [.], ack 28178, win 61320, length 0
13:06:38.065659 IP 142.250.65.238.443 > 10.0.2.15.35854: Flags [P.], seq 28178:29552, ack 821, win 65535, length 1374
13:06:38.065785 IP 10.0.2.15.35854 > 142.250.65.238.443: Flags [.], ack 29552, win 62780, length 0
13:06:38.071494 IP 142.250.65.238.443 > 10.0.2.15.35854: Flags [P.], seq 29552:30926, ack 821, win 65535, length 1374
13:06:38.072303 IP 142.250.65.238.443 > 10.0.2.15.35854: Flags [P.], seq 30926:35048, ack 821, win 65535, length 4122
13:06:38.072430 IP 10.0.2.15.35854 > 142.250.65.238.443: Flags [.], ack 35048, win 61320, length 0
13:06:38.073468 IP 142.250.65.238.443 > 10.0.2.15.35854: Flags [P.], seq 35048:36422, ack 821, win 65535, length 1374
13:06:38.073544 IP 10.0.2.15.35854 > 142.250.65.238.443: Flags [.], ack 36422, win 62780, length 0
13:06:38.074321 IP 142.250.65.238.443 > 10.0.2.15.35854: Flags [P.], seq 36422:41918, ack 821, win 65535, length 5496
13:06:38.074392 IP 10.0.2.15.35854 > 142.250.65.238.443: Flags [.], ack 41918, win 61320, length 0
13:06:38.075393 IP 142.250.65.238.443 > 10.0.2.15.35854: Flags [P.], seq 41918:44666, ack 821, win 65535, length 2748
13:06:38.075408 IP 10.0.2.15.35854 > 142.250.65.238.443: Flags [.], ack 44666, win 62780, length 0
13:06:38.076461 IP 142.250.65.238.443 > 10.0.2.15.35854: Flags [P.], seq 44666:47414, ack 821, win 65535, length 2748
13:06:38.076475 IP 10.0.2.15.35854 > 142.250.65.238.443: Flags [.], ack 47414, win 62780, length 0
13:06:38.077606 IP 142.250.65.238.443 > 10.0.2.15.35854: Flags [P.], seq 47414:51536, ack 821, win 65535, length 4122
13:06:38.077692 IP 10.0.2.15.35854 > 142.250.65.238.443: Flags [.], ack 51536, win 61320, length 0
13:06:38.078590 IP 142.250.65.238.443 > 10.0.2.15.35854: Flags [P.], seq 51536:52910, ack 821, win 65535, length 1374
13:06:38.078724 IP 10.0.2.15.35854 > 142.250.65.238.443: Flags [.], ack 52910, win 62780, length 0
13:06:38.081473 IP 142.250.65.238.443 > 10.0.2.15.35854: Flags [P.], seq 52910:58406, ack 821, win 65535, length 5496
13:06:38.081476 IP 142.250.65.238.443 > 10.0.2.15.35854: Flags [P.], seq 58406:61154, ack 821, win 65535, length 2748
13:06:38.081574 IP 10.0.2.15.35854 > 142.250.65.238.443: Flags [.], ack 61154, win 58400, length 0
13:06:38.081993 IP 142.250.65.238.443 > 10.0.2.15.35854: Flags [P.], seq 61154:65276, ack 821, win 65535, length 4122
13:06:38.082002 IP 10.0.2.15.35854 > 142.250.65.238.443: Flags [.], ack 65276, win 61320, length 0
13:06:38.082779 IP 142.250.65.238.443 > 10.0.2.15.35854: Flags [P.], seq 65276:66650, ack 821, win 65535, length 1374
13:06:38.082855 IP 10.0.2.15.35854 > 142.250.65.238.443: Flags [.], ack 66650, win 62780, length 0
13:06:38.083792 IP 142.250.65.238.443 > 10.0.2.15.35854: Flags [P.], seq 66650:72146, ack 821, win 65535, length 5496
13:06:38.083858 IP 10.0.2.15.35854 > 142.250.65.238.443: Flags [.], ack 72146, win 62780, length 0
13:06:38.084950 IP 142.250.65.238.443 > 10.0.2.15.35854: Flags [P.], seq 72146:74894, ack 821, win 65535, length 2748
13:06:38.084967 IP 10.0.2.15.35854 > 142.250.65.238.443: Flags [.], ack 74894, win 65535, length 0
13:06:38.086010 IP 142.250.65.238.443 > 10.0.2.15.35854: Flags [P.], seq 74894:79016, ack 821, win 65535, length 4122
13:06:38.086027 IP 10.0.2.15.35854 > 142.250.65.238.443: Flags [.], ack 79016, win 65535, length 0
13:06:38.087202 IP 142.250.65.238.443 > 10.0.2.15.35854: Flags [P.], seq 79016:87260, ack 821, win 65535, length 8244
13:06:38.087220 IP 10.0.2.15.35854 > 142.250.65.238.443: Flags [.], ack 87260, win 65535, length 0
13:06:38.088517 IP 142.250.65.238.443 > 10.0.2.15.35854: Flags [P.], seq 87260:91382, ack 821, win 65535, length 4122
13:06:38.088536 IP 10.0.2.15.35854 > 142.250.65.238.443: Flags [.], ack 91382, win 65535, length 0
13:06:38.089455 IP 142.250.65.238.443 > 10.0.2.15.35854: Flags [P.], seq 91382:96878, ack 821, win 65535, length 5496
13:06:38.089471 IP 10.0.2.15.35854 > 142.250.65.238.443: Flags [.], ack 96878, win 65535, length 0
13:06:38.090860 IP 142.250.65.238.443 > 10.0.2.15.35854: Flags [P.], seq 96878:105122, ack 821, win 65535, length 8244
13:06:38.090877 IP 10.0.2.15.35854 > 142.250.65.238.443: Flags [.], ack 105122, win 65535, length 0
13:06:38.091883 IP 142.250.65.238.443 > 10.0.2.15.35854: Flags [P.], seq 105122:107870, ack 821, win 65535, length 2748
13:06:38.091899 IP 10.0.2.15.35854 > 142.250.65.238.443: Flags [.], ack 107870, win 65535, length 0
13:06:38.093518 IP 142.250.65.238.443 > 10.0.2.15.35854: Flags [P.], seq 107870:117488, ack 821, win 65535, length 9618
13:06:38.093547 IP 10.0.2.15.35854 > 142.250.65.238.443: Flags [.], ack 117488, win 65535, length 0
13:06:38.094568 IP 142.250.65.238.443 > 10.0.2.15.35854: Flags [P.], seq 117488:121610, ack 821, win 65535, length 4122
13:06:38.094587 IP 10.0.2.15.35854 > 142.250.65.238.443: Flags [.], ack 121610, win 65535, length 0
13:06:38.095674 IP 142.250.65.238.443 > 10.0.2.15.35854: Flags [P.], seq 121610:131228, ack 821, win 65535, length 9618
13:06:38.095697 IP 10.0.2.15.35854 > 142.250.65.238.443: Flags [.], ack 131228, win 65535, length 0
13:06:38.096535 IP 142.250.65.238.443 > 10.0.2.15.35854: Flags [P.], seq 131228:132602, ack 821, win 65535, length 1374
13:06:38.096552 IP 10.0.2.15.35854 > 142.250.65.238.443: Flags [.], ack 132602, win 65535, length 0
13:06:38.097806 IP 142.250.65.238.443 > 10.0.2.15.35854: Flags [P.], seq 132602:142220, ack 821, win 65535, length 9618
13:06:38.097823 IP 10.0.2.15.35854 > 142.250.65.238.443: Flags [.], ack 142220, win 65535, length 0
13:06:38.098799 IP 142.250.65.238.443 > 10.0.2.15.35854: Flags [P.], seq 142220:147716, ack 821, win 65535, length 5496
13:06:38.098815 IP 10.0.2.15.35854 > 142.250.65.238.443: Flags [.], ack 147716, win 65535, length 0
13:06:38.100831 IP 142.250.65.238.443 > 10.0.2.15.35854: Flags [P.], seq 147716:165578, ack 821, win 65535, length 17862
13:06:38.100848 IP 10.0.2.15.35854 > 142.250.65.238.443: Flags [.], ack 165578, win 65535, length 0
13:06:38.101092 IP 142.250.65.238.443 > 10.0.2.15.35854: Flags [P.], seq 165578:166952, ack 821, win 65535, length 1374
13:06:38.101105 IP 10.0.2.15.35854 > 142.250.65.238.443: Flags [.], ack 166952, win 65535, length 0
13:06:38.102067 IP 142.250.65.238.443 > 10.0.2.15.35854: Flags [P.], seq 166952:175196, ack 821, win 65535, length 8244
13:06:38.102083 IP 10.0.2.15.35854 > 142.250.65.238.443: Flags [.], ack 175196, win 65535, length 0
13:06:38.102402 IP 142.250.65.238.443 > 10.0.2.15.35854: Flags [P.], seq 175196:182066, ack 821, win 65535, length 6870
13:06:38.102413 IP 10.0.2.15.35854 > 142.250.65.238.443: Flags [.], ack 182066, win 65535, length 0
13:06:38.103438 IP 142.250.65.238.443 > 10.0.2.15.35854: Flags [P.], seq 182066:191684, ack 821, win 65535, length 9618
13:06:38.103455 IP 10.0.2.15.35854 > 142.250.65.238.443: Flags [.], ack 191684, win 65535, length 0
13:06:38.105022 IP 142.250.65.238.443 > 10.0.2.15.35854: Flags [P.], seq 191684:192339, ack 821, win 65535, length 655
13:06:38.105037 IP 10.0.2.15.35854 > 142.250.65.238.443: Flags [.], ack 192339, win 65535, length 0
13:06:38.228999 IP 142.250.65.238.443 > 10.0.2.15.35854: Flags [P.], seq 192339:192532, ack 821, win 65535, length 193
13:06:38.229029 IP 10.0.2.15.35854 > 142.250.65.238.443: Flags [.], ack 192532, win 65535, length 0
13:06:38.247919 IP 142.250.65.238.443 > 10.0.2.15.35854: Flags [P.], seq 192532:206272, ack 821, win 65535, length 13740
13:06:38.247958 IP 10.0.2.15.35854 > 142.250.65.238.443: Flags [.], ack 206272, win 65535, length 0
13:06:38.248001 IP 142.250.65.238.443 > 10.0.2.15.35854: Flags [P.], seq 206272:207646, ack 821, win 65535, length 1374
13:06:38.248012 IP 10.0.2.15.35854 > 142.250.65.238.443: Flags [.], ack 207646, win 65535, length 0
13:06:38.248886 IP 142.250.65.238.443 > 10.0.2.15.35854: Flags [P.], seq 207646:221386, ack 821, win 65535, length 13740
13:06:38.248911 IP 10.0.2.15.35854 > 142.250.65.238.443: Flags [.], ack 221386, win 65535, length 0
13:06:38.249575 IP 142.250.65.238.443 > 10.0.2.15.35854: Flags [P.], seq 221386:225508, ack 821, win 65535, length 4122
13:06:38.249595 IP 10.0.2.15.35854 > 142.250.65.238.443: Flags [.], ack 225508, win 65535, length 0
13:06:38.250694 IP 142.250.65.238.443 > 10.0.2.15.35854: Flags [P.], seq 225508:242356, ack 821, win 65535, length 16848
13:06:38.250712 IP 10.0.2.15.35854 > 142.250.65.238.443: Flags [.], ack 242356, win 65535, length 0
13:06:38.250819 IP 142.250.65.238.443 > 10.0.2.15.35854: Flags [P.], seq 242356:253348, ack 821, win 65535, length 10992
13:06:38.250825 IP 10.0.2.15.35854 > 142.250.65.238.443: Flags [.], ack 253348, win 65535, length 0
13:06:38.251131 IP 142.250.65.238.443 > 10.0.2.15.35854: Flags [P.], seq 253348:261592, ack 821, win 65535, length 8244
13:06:38.251148 IP 10.0.2.15.35854 > 142.250.65.238.443: Flags [.], ack 261592, win 65535, length 0
13:06:38.251560 IP 142.250.65.238.443 > 10.0.2.15.35854: Flags [P.], seq 261592:264340, ack 821, win 65535, length 2748
13:06:38.251809 IP 10.0.2.15.35854 > 142.250.65.238.443: Flags [.], ack 264340, win 65535, length 0
13:06:38.252428 IP 142.250.65.238.443 > 10.0.2.15.35854: Flags [P.], seq 264340:275332, ack 821, win 65535, length 10992
13:06:38.252447 IP 10.0.2.15.35854 > 142.250.65.238.443: Flags [.], ack 275332, win 65535, length 0
13:06:38.252900 IP 142.250.65.238.443 > 10.0.2.15.35854: Flags [P.], seq 275332:284950, ack 821, win 65535, length 9618
13:06:38.252917 IP 10.0.2.15.35854 > 142.250.65.238.443: Flags [.], ack 284950, win 65535, length 0
13:06:38.253551 IP 142.250.65.238.443 > 10.0.2.15.35854: Flags [P.], seq 284950:291820, ack 821, win 65535, length 6870
13:06:38.253574 IP 10.0.2.15.35854 > 142.250.65.238.443: Flags [.], ack 291820, win 65535, length 0
13:06:38.253741 IP 142.250.65.238.443 > 10.0.2.15.35854: Flags [P.], seq 291820:302812, ack 821, win 65535, length 10992
13:06:38.253750 IP 10.0.2.15.35854 > 142.250.65.238.443: Flags [.], ack 302812, win 65535, length 0
13:06:38.254091 IP 142.250.65.238.443 > 10.0.2.15.35854: Flags [P.], seq 302812:309682, ack 821, win 65535, length 6870
13:06:38.254114 IP 10.0.2.15.35854 > 142.250.65.238.443: Flags [.], ack 309682, win 65535, length 0
13:06:38.255005 IP 142.250.65.238.443 > 10.0.2.15.35854: Flags [P.], seq 309682:311056, ack 821, win 65535, length 1374
13:06:38.255030 IP 10.0.2.15.35854 > 142.250.65.238.443: Flags [.], ack 311056, win 65535, length 0
13:06:38.256375 IP 142.250.65.238.443 > 10.0.2.15.35854: Flags [P.], seq 311056:319300, ack 821, win 65535, length 8244
13:06:38.256381 IP 142.250.65.238.443 > 10.0.2.15.35854: Flags [P.], seq 319300:333040, ack 821, win 65535, length 13740
13:06:38.256441 IP 10.0.2.15.35854 > 142.250.65.238.443: Flags [.], ack 319300, win 65535, length 0
13:06:38.256474 IP 10.0.2.15.35854 > 142.250.65.238.443: Flags [.], ack 333040, win 65535, length 0
13:06:38.257232 IP 142.250.65.238.443 > 10.0.2.15.35854: Flags [P.], seq 333040:350902, ack 821, win 65535, length 17862
13:06:38.257250 IP 10.0.2.15.35854 > 142.250.65.238.443: Flags [.], ack 350902, win 65535, length 0
13:06:38.257664 IP 142.250.65.238.443 > 10.0.2.15.35854: Flags [P.], seq 350902:356398, ack 821, win 65535, length 5496
13:06:38.257677 IP 10.0.2.15.35854 > 142.250.65.238.443: Flags [.], ack 356398, win 65535, length 0
13:06:38.258520 IP 142.250.65.238.443 > 10.0.2.15.35854: Flags [P.], seq 356398:371512, ack 821, win 65535, length 15114
13:06:38.258533 IP 10.0.2.15.35854 > 142.250.65.238.443: Flags [.], ack 371512, win 65535, length 0
13:06:38.258919 IP 142.250.65.238.443 > 10.0.2.15.35854: Flags [P.], seq 371512:379756, ack 821, win 65535, length 8244
13:06:38.258979 IP 10.0.2.15.35854 > 142.250.65.238.443: Flags [.], ack 379756, win 65535, length 0
13:06:38.259278 IP 142.250.65.238.443 > 10.0.2.15.35854: Flags [P.], seq 379756:388000, ack 821, win 65535, length 8244
13:06:38.259289 IP 10.0.2.15.35854 > 142.250.65.238.443: Flags [.], ack 388000, win 65535, length 0
13:06:38.260023 IP 142.250.65.238.443 > 10.0.2.15.35854: Flags [P.], seq 388000:390748, ack 821, win 65535, length 2748
13:06:38.260039 IP 10.0.2.15.35854 > 142.250.65.238.443: Flags [.], ack 390748, win 65535, length 0
13:06:38.261405 IP 142.250.65.238.443 > 10.0.2.15.35854: Flags [P.], seq 390748:407236, ack 821, win 65535, length 16488
13:06:38.261422 IP 10.0.2.15.35854 > 142.250.65.238.443: Flags [.], ack 407236, win 65535, length 0
13:06:38.262047 IP 142.250.65.238.443 > 10.0.2.15.35854: Flags [P.], seq 407236:416854, ack 821, win 65535, length 9618
13:06:38.262072 IP 10.0.2.15.35854 > 142.250.65.238.443: Flags [.], ack 416854, win 65535, length 0
13:06:38.262258 IP 142.250.65.238.443 > 10.0.2.15.35854: Flags [P.], seq 416854:425098, ack 821, win 65535, length 8244
13:06:38.262273 IP 10.0.2.15.35854 > 142.250.65.238.443: Flags [.], ack 425098, win 65535, length 0
13:06:38.263596 IP 142.250.65.238.443 > 10.0.2.15.35854: Flags [P.], seq 425098:426472, ack 821, win 65535, length 1374
13:06:38.263619 IP 10.0.2.15.35854 > 142.250.65.238.443: Flags [.], ack 426472, win 65535, length 0
13:06:38.265385 IP 142.250.65.238.443 > 10.0.2.15.35854: Flags [P.], seq 426472:459448, ack 821, win 65535, length 32976
13:06:38.265402 IP 10.0.2.15.35854 > 142.250.65.238.443: Flags [.], ack 459448, win 65535, length 0
13:06:38.265891 IP 142.250.65.238.443 > 10.0.2.15.35854: Flags [P.], seq 459448:471814, ack 821, win 65535, length 12366
13:06:38.265904 IP 10.0.2.15.35854 > 142.250.65.238.443: Flags [.], ack 471814, win 65535, length 0

