00:18:14.183778 IP 10.0.2.15.34512 > 142.250.64.78.443: Flags [P.], seq 898621609:898622126, ack 87296002, win 64240, length 517
00:18:14.184230 IP 142.250.64.78.443 > 10.0.2.15.34512: Flags [.], ack 517, win 65535, length 0
00:18:14.206873 IP 142.250.64.78.443 > 10.0.2.15.34512: Flags [.], seq 1:2921, ack 517, win 65535, length 2920
00:18:14.207066 IP 10.0.2.15.34512 > 142.250.64.78.443: Flags [.], ack 2921, win 62780, length 0
00:18:14.207695 IP 142.250.64.78.443 > 10.0.2.15.34512: Flags [P.], seq 2921:6650, ack 517, win 65535, length 3729
00:18:14.207721 IP 10.0.2.15.34512 > 142.250.64.78.443: Flags [.], ack 6650, win 59860, length 0
00:18:14.209769 IP 10.0.2.15.34512 > 142.250.64.78.443: Flags [P.], seq 517:597, ack 6650, win 62780, length 80
00:18:14.210143 IP 142.250.64.78.443 > 10.0.2.15.34512: Flags [.], ack 597, win 65535, length 0
00:18:14.210309 IP 10.0.2.15.34512 > 142.250.64.78.443: Flags [P.], seq 597:643, ack 6650, win 62780, length 46
00:18:14.210339 IP 10.0.2.15.34512 > 142.250.64.78.443: Flags [P.], seq 643:692, ack 6650, win 62780, length 49
00:18:14.210462 IP 10.0.2.15.34512 > 142.250.64.78.443: Flags [P.], seq 692:727, ack 6650, win 62780, length 35
00:18:14.210490 IP 10.0.2.15.34512 > 142.250.64.78.443: Flags [P.], seq 727:790, ack 6650, win 62780, length 63
00:18:14.210720 IP 142.250.64.78.443 > 10.0.2.15.34512: Flags [.], ack 643, win 65535, length 0
00:18:14.210722 IP 142.250.64.78.443 > 10.0.2.15.34512: Flags [.], ack 692, win 65535, length 0
00:18:14.210722 IP 142.250.64.78.443 > 10.0.2.15.34512: Flags [.], ack 727, win 65535, length 0
00:18:14.210722 IP 142.250.64.78.443 > 10.0.2.15.34512: Flags [.], ack 790, win 65535, length 0
00:18:14.222605 IP 142.250.64.78.443 > 10.0.2.15.34512: Flags [P.], seq 6650:7323, ack 790, win 65535, length 673
00:18:14.222628 IP 10.0.2.15.34512 > 142.250.64.78.443: Flags [.], ack 7323, win 62780, length 0
00:18:14.225505 IP 10.0.2.15.34512 > 142.250.64.78.443: Flags [P.], seq 790:821, ack 7323, win 62780, length 31
00:18:14.225927 IP 142.250.64.78.443 > 10.0.2.15.34512: Flags [.], ack 821, win 65535, length 0
00:18:14.258196 IP 142.250.64.78.443 > 10.0.2.15.34512: Flags [P.], seq 7323:12488, ack 821, win 65535, length 5165
00:18:14.258229 IP 10.0.2.15.34512 > 142.250.64.78.443: Flags [.], ack 12488, win 61320, length 0
00:18:14.259318 IP 142.250.64.78.443 > 10.0.2.15.34512: Flags [P.], seq 12488:15236, ack 821, win 65535, length 2748
00:18:14.259436 IP 10.0.2.15.34512 > 142.250.64.78.443: Flags [.], ack 15236, win 58572, length 0
00:18:14.263984 IP 142.250.64.78.443 > 10.0.2.15.34512: Flags [P.], seq 15236:22846, ack 821, win 65535, length 7610
00:18:14.264009 IP 10.0.2.15.34512 > 142.250.64.78.443: Flags [.], ack 22846, win 58572, length 0
00:18:14.264699 IP 142.250.64.78.443 > 10.0.2.15.34512: Flags [P.], seq 22846:29716, ack 821, win 65535, length 6870
00:18:14.264717 IP 10.0.2.15.34512 > 142.250.64.78.443: Flags [.], ack 29716, win 59860, length 0
00:18:14.274191 IP 142.250.64.78.443 > 10.0.2.15.34512: Flags [P.], seq 29716:35212, ack 821, win 65535, length 5496
00:18:14.274196 IP 142.250.64.78.443 > 10.0.2.15.34512: Flags [P.], seq 35212:37960, ack 821, win 65535, length 2748
00:18:14.274198 IP 142.250.64.78.443 > 10.0.2.15.34512: Flags [.], seq 37960:42340, ack 821, win 65535, length 4380
00:18:14.274227 IP 10.0.2.15.34512 > 142.250.64.78.443: Flags [.], ack 35212, win 61320, length 0
00:18:14.274511 IP 10.0.2.15.34512 > 142.250.64.78.443: Flags [.], ack 37960, win 58572, length 0
00:18:14.274541 IP 10.0.2.15.34512 > 142.250.64.78.443: Flags [.], ack 42340, win 55480, length 0
00:18:14.279082 IP 142.250.64.78.443 > 10.0.2.15.34512: Flags [.], seq 42340:59860, ack 821, win 65535, length 17520
00:18:14.279165 IP 10.0.2.15.34512 > 142.250.64.78.443: Flags [.], ack 59860, win 52560, length 0
00:18:14.279309 IP 142.250.64.78.443 > 10.0.2.15.34512: Flags [P.], seq 59860:59944, ack 821, win 65535, length 84
00:18:14.279486 IP 10.0.2.15.34512 > 142.250.64.78.443: Flags [.], ack 59944, win 62780, length 0
00:18:14.280075 IP 142.250.64.78.443 > 10.0.2.15.34512: Flags [P.], seq 59944:68188, ack 821, win 65535, length 8244
00:18:14.280133 IP 10.0.2.15.34512 > 142.250.64.78.443: Flags [.], ack 68188, win 62780, length 0
00:18:14.282386 IP 142.250.64.78.443 > 10.0.2.15.34512: Flags [P.], seq 68188:73684, ack 821, win 65535, length 5496
00:18:14.282412 IP 10.0.2.15.34512 > 142.250.64.78.443: Flags [.], ack 73684, win 65535, length 0
00:18:14.284161 IP 142.250.64.78.443 > 10.0.2.15.34512: Flags [P.], seq 73684:80554, ack 821, win 65535, length 6870
00:18:14.284165 IP 142.250.64.78.443 > 10.0.2.15.34512: Flags [P.], seq 80554:84676, ack 821, win 65535, length 4122
00:18:14.284193 IP 10.0.2.15.34512 > 142.250.64.78.443: Flags [.], ack 80554, win 65535, length 0
00:18:14.284235 IP 10.0.2.15.34512 > 142.250.64.78.443: Flags [.], ack 84676, win 65535, length 0
00:18:14.284254 IP 142.250.64.78.443 > 10.0.2.15.34512: Flags [P.], seq 84676:86050, ack 821, win 65535, length 1374
00:18:14.284259 IP 10.0.2.15.34512 > 142.250.64.78.443: Flags [.], ack 86050, win 65535, length 0
00:18:14.292413 IP 142.250.64.78.443 > 10.0.2.15.34512: Flags [P.], seq 86050:112156, ack 821, win 65535, length 26106
00:18:14.292437 IP 10.0.2.15.34512 > 142.250.64.78.443: Flags [.], ack 112156, win 65535, length 0
00:18:14.292609 IP 142.250.64.78.443 > 10.0.2.15.34512: Flags [.], seq 112156:113616, ack 821, win 65535, length 1460
00:18:14.292620 IP 10.0.2.15.34512 > 142.250.64.78.443: Flags [.], ack 113616, win 65535, length 0
00:18:14.293811 IP 142.250.64.78.443 > 10.0.2.15.34512: Flags [P.], seq 113616:128644, ack 821, win 65535, length 15028
00:18:14.293840 IP 10.0.2.15.34512 > 142.250.64.78.443: Flags [.], ack 128644, win 65535, length 0
00:18:14.293960 IP 142.250.64.78.443 > 10.0.2.15.34512: Flags [P.], seq 128644:139636, ack 821, win 65535, length 10992
00:18:14.293976 IP 10.0.2.15.34512 > 142.250.64.78.443: Flags [.], ack 139636, win 65535, length 0
00:18:14.294046 IP 142.250.64.78.443 > 10.0.2.15.34512: Flags [P.], seq 139636:145132, ack 821, win 65535, length 5496
00:18:14.294054 IP 10.0.2.15.34512 > 142.250.64.78.443: Flags [.], ack 145132, win 65535, length 0
00:18:14.294496 IP 142.250.64.78.443 > 10.0.2.15.34512: Flags [P.], seq 145132:150628, ack 821, win 65535, length 5496
00:18:14.294508 IP 10.0.2.15.34512 > 142.250.64.78.443: Flags [.], ack 150628, win 65535, length 0
00:18:14.295848 IP 142.250.64.78.443 > 10.0.2.15.34512: Flags [P.], seq 150628:156124, ack 821, win 65535, length 5496
00:18:14.295863 IP 10.0.2.15.34512 > 142.250.64.78.443: Flags [.], ack 156124, win 65535, length 0
00:18:14.296398 IP 142.250.64.78.443 > 10.0.2.15.34512: Flags [P.], seq 156124:158872, ack 821, win 65535, length 2748
00:18:14.296400 IP 142.250.64.78.443 > 10.0.2.15.34512: Flags [P.], seq 158872:160246, ack 821, win 65535, length 1374
00:18:14.296414 IP 10.0.2.15.34512 > 142.250.64.78.443: Flags [.], ack 158872, win 65535, length 0
00:18:14.296438 IP 10.0.2.15.34512 > 142.250.64.78.443: Flags [.], ack 160246, win 65535, length 0
00:18:14.297278 IP 142.250.64.78.443 > 10.0.2.15.34512: Flags [P.], seq 160246:162994, ack 821, win 65535, length 2748
00:18:14.297281 IP 142.250.64.78.443 > 10.0.2.15.34512: Flags [P.], seq 162994:167116, ack 821, win 65535, length 4122
00:18:14.297300 IP 10.0.2.15.34512 > 142.250.64.78.443: Flags [.], ack 162994, win 65535, length 0
00:18:14.297331 IP 10.0.2.15.34512 > 142.250.64.78.443: Flags [.], ack 167116, win 65535, length 0
00:18:14.297597 IP 142.250.64.78.443 > 10.0.2.15.34512: Flags [P.], seq 167116:171238, ack 821, win 65535, length 4122
00:18:14.297608 IP 10.0.2.15.34512 > 142.250.64.78.443: Flags [.], ack 171238, win 65535, length 0
00:18:14.297813 IP 142.250.64.78.443 > 10.0.2.15.34512: Flags [.], seq 171238:172698, ack 821, win 65535, length 1460
00:18:14.297824 IP 10.0.2.15.34512 > 142.250.64.78.443: Flags [.], ack 172698, win 65535, length 0
00:18:14.298068 IP 142.250.64.78.443 > 10.0.2.15.34512: Flags [P.], seq 172698:173986, ack 821, win 65535, length 1288
00:18:14.298070 IP 142.250.64.78.443 > 10.0.2.15.34512: Flags [P.], seq 173986:178108, ack 821, win 65535, length 4122
00:18:14.298082 IP 10.0.2.15.34512 > 142.250.64.78.443: Flags [.], ack 173986, win 65535, length 0
00:18:14.298098 IP 10.0.2.15.34512 > 142.250.64.78.443: Flags [.], ack 178108, win 65535, length 0
00:18:14.299744 IP 142.250.64.78.443 > 10.0.2.15.34512: Flags [P.], seq 178108:183604, ack 821, win 65535, length 5496
00:18:14.299746 IP 142.250.64.78.443 > 10.0.2.15.34512: Flags [P.], seq 183604:186352, ack 821, win 65535, length 2748
00:18:14.299769 IP 10.0.2.15.34512 > 142.250.64.78.443: Flags [.], ack 183604, win 65535, length 0
00:18:14.299804 IP 10.0.2.15.34512 > 142.250.64.78.443: Flags [.], ack 186352, win 65535, length 0
00:18:14.300058 IP 142.250.64.78.443 > 10.0.2.15.34512: Flags [P.], seq 186352:189100, ack 821, win 65535, length 2748
00:18:14.300060 IP 142.250.64.78.443 > 10.0.2.15.34512: Flags [P.], seq 189100:191848, ack 821, win 65535, length 2748
00:18:14.300073 IP 10.0.2.15.34512 > 142.250.64.78.443: Flags [.], ack 189100, win 65535, length 0
00:18:14.300091 IP 10.0.2.15.34512 > 142.250.64.78.443: Flags [.], ack 191848, win 65535, length 0
00:18:14.300264 IP 142.250.64.78.443 > 10.0.2.15.34512: Flags [P.], seq 191848:194596, ack 821, win 65535, length 2748
00:18:14.300277 IP 10.0.2.15.34512 > 142.250.64.78.443: Flags [.], ack 194596, win 65535, length 0
00:18:14.300504 IP 142.250.64.78.443 > 10.0.2.15.34512: Flags [P.], seq 194596:197344, ack 821, win 65535, length 2748
00:18:14.300516 IP 10.0.2.15.34512 > 142.250.64.78.443: Flags [.], ack 197344, win 65535, length 0
00:18:14.302072 IP 142.250.64.78.443 > 10.0.2.15.34512: Flags [P.], seq 197344:202840, ack 821, win 65535, length 5496
00:18:14.302076 IP 142.250.64.78.443 > 10.0.2.15.34512: Flags [P.], seq 202840:206962, ack 821, win 65535, length 4122
00:18:14.302108 IP 10.0.2.15.34512 > 142.250.64.78.443: Flags [.], ack 202840, win 65535, length 0
00:18:14.302149 IP 10.0.2.15.34512 > 142.250.64.78.443: Flags [.], ack 206962, win 65535, length 0
00:18:14.302503 IP 142.250.64.78.443 > 10.0.2.15.34512: Flags [P.], seq 206962:209710, ack 821, win 65535, length 2748
00:18:14.302506 IP 142.250.64.78.443 > 10.0.2.15.34512: Flags [P.], seq 209710:212458, ack 821, win 65535, length 2748
00:18:14.302522 IP 10.0.2.15.34512 > 142.250.64.78.443: Flags [.], ack 209710, win 65535, length 0
00:18:14.302540 IP 10.0.2.15.34512 > 142.250.64.78.443: Flags [.], ack 212458, win 65535, length 0
00:18:14.302653 IP 142.250.64.78.443 > 10.0.2.15.34512: Flags [P.], seq 212458:216580, ack 821, win 65535, length 4122
00:18:14.302658 IP 10.0.2.15.34512 > 142.250.64.78.443: Flags [.], ack 216580, win 65535, length 0
00:18:14.304894 IP 142.250.64.78.443 > 10.0.2.15.34512: Flags [P.], seq 216580:222034, ack 821, win 65535, length 5454
00:18:14.304914 IP 10.0.2.15.34512 > 142.250.64.78.443: Flags [.], ack 222034, win 65535, length 0
00:18:14.425707 IP 142.250.64.78.443 > 10.0.2.15.34512: Flags [P.], seq 222034:222227, ack 821, win 65535, length 193
00:18:14.425730 IP 10.0.2.15.34512 > 142.250.64.78.443: Flags [.], ack 222227, win 65535, length 0
00:18:14.437145 IP 142.250.64.78.443 > 10.0.2.15.34512: Flags [P.], seq 222227:227723, ack 821, win 65535, length 5496
00:18:14.437148 IP 142.250.64.78.443 > 10.0.2.15.34512: Flags [.], seq 227723:229183, ack 821, win 65535, length 1460
00:18:14.437224 IP 10.0.2.15.34512 > 142.250.64.78.443: Flags [.], ack 227723, win 65535, length 0
00:18:14.437255 IP 10.0.2.15.34512 > 142.250.64.78.443: Flags [.], ack 229183, win 65535, length 0
00:18:14.438216 IP 142.250.64.78.443 > 10.0.2.15.34512: Flags [P.], seq 229183:231845, ack 821, win 65535, length 2662
00:18:14.438220 IP 142.250.64.78.443 > 10.0.2.15.34512: Flags [P.], seq 231845:233219, ack 821, win 65535, length 1374
00:18:14.438221 IP 142.250.64.78.443 > 10.0.2.15.34512: Flags [P.], seq 233219:235967, ack 821, win 65535, length 2748
00:18:14.438222 IP 142.250.64.78.443 > 10.0.2.15.34512: Flags [P.], seq 235967:237341, ack 821, win 65535, length 1374
00:18:14.438223 IP 142.250.64.78.443 > 10.0.2.15.34512: Flags [P.], seq 237341:240089, ack 821, win 65535, length 2748
00:18:14.438250 IP 10.0.2.15.34512 > 142.250.64.78.443: Flags [.], ack 231845, win 65535, length 0
00:18:14.438307 IP 10.0.2.15.34512 > 142.250.64.78.443: Flags [.], ack 233219, win 65535, length 0
00:18:14.438319 IP 10.0.2.15.34512 > 142.250.64.78.443: Flags [.], ack 235967, win 65535, length 0
00:18:14.438335 IP 10.0.2.15.34512 > 142.250.64.78.443: Flags [.], ack 237341, win 65535, length 0
00:18:14.438347 IP 10.0.2.15.34512 > 142.250.64.78.443: Flags [.], ack 240089, win 65535, length 0
00:18:14.438375 IP 142.250.64.78.443 > 10.0.2.15.34512: Flags [P.], seq 240089:241463, ack 821, win 65535, length 1374
00:18:14.438387 IP 142.250.64.78.443 > 10.0.2.15.34512: Flags [P.], seq 241463:244211, ack 821, win 65535, length 2748
00:18:14.438389 IP 142.250.64.78.443 > 10.0.2.15.34512: Flags [P.], seq 244211:246959, ack 821, win 65535, length 2748
00:18:14.438397 IP 10.0.2.15.34512 > 142.250.64.78.443: Flags [.], ack 241463, win 65535, length 0
00:18:14.438412 IP 10.0.2.15.34512 > 142.250.64.78.443: Flags [.], ack 244211, win 65535, length 0
00:18:14.438426 IP 10.0.2.15.34512 > 142.250.64.78.443: Flags [.], ack 246959, win 65535, length 0
00:18:14.439028 IP 142.250.64.78.443 > 10.0.2.15.34512: Flags [P.], seq 246959:248333, ack 821, win 65535, length 1374
00:18:14.439051 IP 10.0.2.15.34512 > 142.250.64.78.443: Flags [.], ack 248333, win 65535, length 0
00:18:14.439646 IP 142.250.64.78.443 > 10.0.2.15.34512: Flags [P.], seq 248333:252455, ack 821, win 65535, length 4122
00:18:14.439670 IP 10.0.2.15.34512 > 142.250.64.78.443: Flags [.], ack 252455, win 65535, length 0
00:18:14.439823 IP 142.250.64.78.443 > 10.0.2.15.34512: Flags [P.], seq 252455:258311, ack 821, win 65535, length 5856
00:18:14.439834 IP 10.0.2.15.34512 > 142.250.64.78.443: Flags [.], ack 258311, win 65535, length 0
00:18:14.440346 IP 142.250.64.78.443 > 10.0.2.15.34512: Flags [P.], seq 258311:262433, ack 821, win 65535, length 4122
00:18:14.440348 IP 142.250.64.78.443 > 10.0.2.15.34512: Flags [P.], seq 262433:263807, ack 821, win 65535, length 1374
00:18:14.440349 IP 142.250.64.78.443 > 10.0.2.15.34512: Flags [P.], seq 263807:266555, ack 821, win 65535, length 2748
00:18:14.440370 IP 10.0.2.15.34512 > 142.250.64.78.443: Flags [.], ack 262433, win 65535, length 0
00:18:14.440395 IP 10.0.2.15.34512 > 142.250.64.78.443: Flags [.], ack 263807, win 65535, length 0
00:18:14.440494 IP 10.0.2.15.34512 > 142.250.64.78.443: Flags [.], ack 266555, win 65535, length 0
00:18:14.440656 IP 142.250.64.78.443 > 10.0.2.15.34512: Flags [P.], seq 266555:269303, ack 821, win 65535, length 2748
00:18:14.440668 IP 10.0.2.15.34512 > 142.250.64.78.443: Flags [.], ack 269303, win 65535, length 0
00:18:14.440918 IP 142.250.64.78.443 > 10.0.2.15.34512: Flags [P.], seq 269303:272863, ack 821, win 65535, length 3560
00:18:14.440930 IP 10.0.2.15.34512 > 142.250.64.78.443: Flags [.], ack 272863, win 65535, length 0
00:18:14.441357 IP 142.250.64.78.443 > 10.0.2.15.34512: Flags [P.], seq 272863:276985, ack 821, win 65535, length 4122
00:18:14.441377 IP 10.0.2.15.34512 > 142.250.64.78.443: Flags [.], ack 276985, win 65535, length 0
00:18:14.441586 IP 142.250.64.78.443 > 10.0.2.15.34512: Flags [P.], seq 276985:281107, ack 821, win 65535, length 4122
00:18:14.441636 IP 10.0.2.15.34512 > 142.250.64.78.443: Flags [.], ack 281107, win 65535, length 0
00:18:14.441749 IP 142.250.64.78.443 > 10.0.2.15.34512: Flags [P.], seq 281107:282481, ack 821, win 65535, length 1374
00:18:14.441886 IP 10.0.2.15.34512 > 142.250.64.78.443: Flags [.], ack 282481, win 65535, length 0
00:18:14.442122 IP 142.250.64.78.443 > 10.0.2.15.34512: Flags [P.], seq 282481:285229, ack 821, win 65535, length 2748
00:18:14.442207 IP 142.250.64.78.443 > 10.0.2.15.34512: Flags [P.], seq 285229:286603, ack 821, win 65535, length 1374
00:18:14.442232 IP 10.0.2.15.34512 > 142.250.64.78.443: Flags [.], ack 285229, win 65535, length 0
00:18:14.442257 IP 10.0.2.15.34512 > 142.250.64.78.443: Flags [.], ack 286603, win 65535, length 0
00:18:14.442912 IP 142.250.64.78.443 > 10.0.2.15.34512: Flags [P.], seq 286603:289351, ack 821, win 65535, length 2748
00:18:14.442914 IP 142.250.64.78.443 > 10.0.2.15.34512: Flags [P.], seq 289351:293473, ack 821, win 65535, length 4122
00:18:14.442915 IP 142.250.64.78.443 > 10.0.2.15.34512: Flags [P.], seq 293473:294847, ack 821, win 65535, length 1374
00:18:14.442940 IP 10.0.2.15.34512 > 142.250.64.78.443: Flags [.], ack 289351, win 65535, length 0
00:18:14.442960 IP 10.0.2.15.34512 > 142.250.64.78.443: Flags [.], ack 293473, win 65535, length 0
00:18:14.442973 IP 10.0.2.15.34512 > 142.250.64.78.443: Flags [.], ack 294847, win 65535, length 0
00:18:14.443545 IP 142.250.64.78.443 > 10.0.2.15.34512: Flags [P.], seq 294847:300343, ack 821, win 65535, length 5496
00:18:14.443547 IP 142.250.64.78.443 > 10.0.2.15.34512: Flags [P.], seq 300343:301717, ack 821, win 65535, length 1374
00:18:14.443648 IP 10.0.2.15.34512 > 142.250.64.78.443: Flags [.], ack 300343, win 65535, length 0
00:18:14.443725 IP 10.0.2.15.34512 > 142.250.64.78.443: Flags [.], ack 301717, win 65535, length 0
00:18:14.443881 IP 142.250.64.78.443 > 10.0.2.15.34512: Flags [P.], seq 301717:303091, ack 821, win 65535, length 1374
00:18:14.443883 IP 142.250.64.78.443 > 10.0.2.15.34512: Flags [P.], seq 303091:305839, ack 821, win 65535, length 2748
00:18:14.443883 IP 142.250.64.78.443 > 10.0.2.15.34512: Flags [P.], seq 305839:307213, ack 821, win 65535, length 1374
00:18:14.443895 IP 10.0.2.15.34512 > 142.250.64.78.443: Flags [.], ack 303091, win 65535, length 0
00:18:14.443910 IP 10.0.2.15.34512 > 142.250.64.78.443: Flags [.], ack 305839, win 65535, length 0
00:18:14.444125 IP 10.0.2.15.34512 > 142.250.64.78.443: Flags [.], ack 307213, win 65535, length 0
00:18:14.444261 IP 142.250.64.78.443 > 10.0.2.15.34512: Flags [P.], seq 307213:309961, ack 821, win 65535, length 2748
00:18:14.444262 IP 142.250.64.78.443 > 10.0.2.15.34512: Flags [P.], seq 309961:311335, ack 821, win 65535, length 1374
00:18:14.444274 IP 10.0.2.15.34512 > 142.250.64.78.443: Flags [.], ack 309961, win 65535, length 0
00:18:14.444288 IP 10.0.2.15.34512 > 142.250.64.78.443: Flags [.], ack 311335, win 65535, length 0
00:18:14.444463 IP 142.250.64.78.443 > 10.0.2.15.34512: Flags [P.], seq 311335:314083, ack 821, win 65535, length 2748
00:18:14.444513 IP 10.0.2.15.34512 > 142.250.64.78.443: Flags [.], ack 314083, win 65535, length 0
00:18:14.444626 IP 142.250.64.78.443 > 10.0.2.15.34512: Flags [P.], seq 314083:315457, ack 821, win 65535, length 1374
00:18:14.444632 IP 10.0.2.15.34512 > 142.250.64.78.443: Flags [.], ack 315457, win 65535, length 0
00:18:14.444910 IP 142.250.64.78.443 > 10.0.2.15.34512: Flags [P.], seq 315457:318205, ack 821, win 65535, length 2748
00:18:14.444911 IP 142.250.64.78.443 > 10.0.2.15.34512: Flags [P.], seq 318205:319579, ack 821, win 65535, length 1374
00:18:14.444925 IP 10.0.2.15.34512 > 142.250.64.78.443: Flags [.], ack 318205, win 65535, length 0
00:18:14.444993 IP 10.0.2.15.34512 > 142.250.64.78.443: Flags [.], ack 319579, win 65535, length 0
00:18:14.445587 IP 142.250.64.78.443 > 10.0.2.15.34512: Flags [P.], seq 319579:322327, ack 821, win 65535, length 2748
00:18:14.445589 IP 142.250.64.78.443 > 10.0.2.15.34512: Flags [P.], seq 322327:325075, ack 821, win 65535, length 2748
00:18:14.445591 IP 142.250.64.78.443 > 10.0.2.15.34512: Flags [P.], seq 325075:329197, ack 821, win 65535, length 4122
00:18:14.445611 IP 10.0.2.15.34512 > 142.250.64.78.443: Flags [.], ack 322327, win 65535, length 0
00:18:14.445630 IP 10.0.2.15.34512 > 142.250.64.78.443: Flags [.], ack 325075, win 65535, length 0
00:18:14.445643 IP 10.0.2.15.34512 > 142.250.64.78.443: Flags [.], ack 329197, win 65535, length 0
00:18:14.446073 IP 142.250.64.78.443 > 10.0.2.15.34512: Flags [P.], seq 329197:333319, ack 821, win 65535, length 4122
00:18:14.446087 IP 10.0.2.15.34512 > 142.250.64.78.443: Flags [.], ack 333319, win 65535, length 0
00:18:14.446753 IP 142.250.64.78.443 > 10.0.2.15.34512: Flags [P.], seq 333319:338815, ack 821, win 65535, length 5496
00:18:14.446770 IP 10.0.2.15.34512 > 142.250.64.78.443: Flags [.], ack 338815, win 65535, length 0
00:18:14.447151 IP 142.250.64.78.443 > 10.0.2.15.34512: Flags [P.], seq 338815:340189, ack 821, win 65535, length 1374
00:18:14.447154 IP 142.250.64.78.443 > 10.0.2.15.34512: Flags [P.], seq 340189:342937, ack 821, win 65535, length 2748
00:18:14.447176 IP 10.0.2.15.34512 > 142.250.64.78.443: Flags [.], ack 340189, win 65535, length 0
00:18:14.447247 IP 10.0.2.15.34512 > 142.250.64.78.443: Flags [.], ack 342937, win 65535, length 0
00:18:14.447372 IP 142.250.64.78.443 > 10.0.2.15.34512: Flags [P.], seq 342937:344311, ack 821, win 65535, length 1374
00:18:14.447382 IP 10.0.2.15.34512 > 142.250.64.78.443: Flags [.], ack 344311, win 65535, length 0
00:18:14.447667 IP 142.250.64.78.443 > 10.0.2.15.34512: Flags [P.], seq 344311:347059, ack 821, win 65535, length 2748
00:18:14.447670 IP 142.250.64.78.443 > 10.0.2.15.34512: Flags [P.], seq 347059:351181, ack 821, win 65535, length 4122
00:18:14.447717 IP 10.0.2.15.34512 > 142.250.64.78.443: Flags [.], ack 347059, win 65535, length 0
00:18:14.447765 IP 10.0.2.15.34512 > 142.250.64.78.443: Flags [.], ack 351181, win 65535, length 0
00:18:14.447943 IP 142.250.64.78.443 > 10.0.2.15.34512: Flags [P.], seq 351181:352555, ack 821, win 65535, length 1374
00:18:14.447944 IP 142.250.64.78.443 > 10.0.2.15.34512: Flags [P.], seq 352555:353929, ack 821, win 65535, length 1374
00:18:14.447953 IP 10.0.2.15.34512 > 142.250.64.78.443: Flags [.], ack 352555, win 65535, length 0
00:18:14.447966 IP 10.0.2.15.34512 > 142.250.64.78.443: Flags [.], ack 353929, win 65535, length 0
00:18:14.448125 IP 142.250.64.78.443 > 10.0.2.15.34512: Flags [P.], seq 353929:356677, ack 821, win 65535, length 2748
00:18:14.448181 IP 10.0.2.15.34512 > 142.250.64.78.443: Flags [.], ack 356677, win 65535, length 0
00:18:14.448551 IP 142.250.64.78.443 > 10.0.2.15.34512: Flags [P.], seq 356677:358051, ack 821, win 65535, length 1374
00:18:14.448553 IP 142.250.64.78.443 > 10.0.2.15.34512: Flags [P.], seq 358051:360799, ack 821, win 65535, length 2748
00:18:14.448569 IP 10.0.2.15.34512 > 142.250.64.78.443: Flags [.], ack 358051, win 65535, length 0
00:18:14.448586 IP 10.0.2.15.34512 > 142.250.64.78.443: Flags [.], ack 360799, win 65535, length 0
00:18:14.448673 IP 142.250.64.78.443 > 10.0.2.15.34512: Flags [P.], seq 360799:364921, ack 821, win 65535, length 4122
00:18:14.448679 IP 10.0.2.15.34512 > 142.250.64.78.443: Flags [.], ack 364921, win 65535, length 0
00:18:14.448786 IP 142.250.64.78.443 > 10.0.2.15.34512: Flags [P.], seq 364921:366295, ack 821, win 65535, length 1374
00:18:14.448791 IP 10.0.2.15.34512 > 142.250.64.78.443: Flags [.], ack 366295, win 65535, length 0
00:18:14.449035 IP 142.250.64.78.443 > 10.0.2.15.34512: Flags [P.], seq 366295:369043, ack 821, win 65535, length 2748
00:18:14.449043 IP 10.0.2.15.34512 > 142.250.64.78.443: Flags [.], ack 369043, win 65535, length 0
00:18:14.449385 IP 142.250.64.78.443 > 10.0.2.15.34512: Flags [P.], seq 369043:370417, ack 821, win 65535, length 1374
00:18:14.449404 IP 10.0.2.15.34512 > 142.250.64.78.443: Flags [.], ack 370417, win 65535, length 0
00:18:14.449621 IP 142.250.64.78.443 > 10.0.2.15.34512: Flags [P.], seq 370417:371791, ack 821, win 65535, length 1374
00:18:14.449631 IP 10.0.2.15.34512 > 142.250.64.78.443: Flags [.], ack 371791, win 65535, length 0
00:18:14.450071 IP 142.250.64.78.443 > 10.0.2.15.34512: Flags [P.], seq 371791:377287, ack 821, win 65535, length 5496
00:18:14.450104 IP 10.0.2.15.34512 > 142.250.64.78.443: Flags [.], ack 377287, win 65535, length 0
00:18:14.450374 IP 142.250.64.78.443 > 10.0.2.15.34512: Flags [P.], seq 377287:378661, ack 821, win 65535, length 1374
00:18:14.450376 IP 142.250.64.78.443 > 10.0.2.15.34512: Flags [P.], seq 378661:380035, ack 821, win 65535, length 1374
00:18:14.450422 IP 10.0.2.15.34512 > 142.250.64.78.443: Flags [.], ack 378661, win 65535, length 0
00:18:14.450438 IP 10.0.2.15.34512 > 142.250.64.78.443: Flags [.], ack 380035, win 65535, length 0
00:18:14.450864 IP 142.250.64.78.443 > 10.0.2.15.34512: Flags [P.], seq 380035:382783, ack 821, win 65535, length 2748
00:18:14.450966 IP 142.250.64.78.443 > 10.0.2.15.34512: Flags [P.], seq 382783:385531, ack 821, win 65535, length 2748
00:18:14.451051 IP 10.0.2.15.34512 > 142.250.64.78.443: Flags [.], ack 382783, win 65535, length 0
00:18:14.451216 IP 10.0.2.15.34512 > 142.250.64.78.443: Flags [.], ack 385531, win 65535, length 0
00:18:14.451411 IP 142.250.64.78.443 > 10.0.2.15.34512: Flags [P.], seq 385531:388279, ack 821, win 65535, length 2748
00:18:14.451412 IP 142.250.64.78.443 > 10.0.2.15.34512: Flags [P.], seq 388279:391027, ack 821, win 65535, length 2748
00:18:14.451413 IP 142.250.64.78.443 > 10.0.2.15.34512: Flags [P.], seq 391027:392401, ack 821, win 65535, length 1374
00:18:14.451414 IP 142.250.64.78.443 > 10.0.2.15.34512: Flags [P.], seq 392401:395149, ack 821, win 65535, length 2748
00:18:14.451430 IP 10.0.2.15.34512 > 142.250.64.78.443: Flags [.], ack 388279, win 65535, length 0
00:18:14.451445 IP 10.0.2.15.34512 > 142.250.64.78.443: Flags [.], ack 391027, win 65535, length 0
00:18:14.451456 IP 10.0.2.15.34512 > 142.250.64.78.443: Flags [.], ack 392401, win 65535, length 0
00:18:14.451468 IP 10.0.2.15.34512 > 142.250.64.78.443: Flags [.], ack 395149, win 65535, length 0
00:18:14.451586 IP 142.250.64.78.443 > 10.0.2.15.34512: Flags [P.], seq 395149:396523, ack 821, win 65535, length 1374
00:18:14.451593 IP 10.0.2.15.34512 > 142.250.64.78.443: Flags [.], ack 396523, win 65535, length 0
00:18:14.451771 IP 142.250.64.78.443 > 10.0.2.15.34512: Flags [P.], seq 396523:399271, ack 821, win 65535, length 2748
00:18:14.451779 IP 10.0.2.15.34512 > 142.250.64.78.443: Flags [.], ack 399271, win 65535, length 0
00:18:14.451936 IP 142.250.64.78.443 > 10.0.2.15.34512: Flags [P.], seq 399271:400645, ack 821, win 65535, length 1374
00:18:14.451944 IP 10.0.2.15.34512 > 142.250.64.78.443: Flags [.], ack 400645, win 65535, length 0
00:18:14.452283 IP 142.250.64.78.443 > 10.0.2.15.34512: Flags [P.], seq 400645:403393, ack 821, win 65535, length 2748
00:18:14.452284 IP 142.250.64.78.443 > 10.0.2.15.34512: Flags [P.], seq 403393:406141, ack 821, win 65535, length 2748
00:18:14.452298 IP 10.0.2.15.34512 > 142.250.64.78.443: Flags [.], ack 403393, win 65535, length 0
00:18:14.452345 IP 10.0.2.15.34512 > 142.250.64.78.443: Flags [.], ack 406141, win 65535, length 0
00:18:14.452545 IP 142.250.64.78.443 > 10.0.2.15.34512: Flags [P.], seq 406141:408889, ack 821, win 65535, length 2748
00:18:14.452558 IP 10.0.2.15.34512 > 142.250.64.78.443: Flags [.], ack 408889, win 65535, length 0
00:18:14.452655 IP 142.250.64.78.443 > 10.0.2.15.34512: Flags [P.], seq 408889:410263, ack 821, win 65535, length 1374
00:18:14.452661 IP 10.0.2.15.34512 > 142.250.64.78.443: Flags [.], ack 410263, win 65535, length 0
00:18:14.453364 IP 142.250.64.78.443 > 10.0.2.15.34512: Flags [P.], seq 410263:413011, ack 821, win 65535, length 2748
00:18:14.453380 IP 10.0.2.15.34512 > 142.250.64.78.443: Flags [.], ack 413011, win 65535, length 0
00:18:14.453594 IP 142.250.64.78.443 > 10.0.2.15.34512: Flags [P.], seq 413011:415759, ack 821, win 65535, length 2748
00:18:14.453602 IP 10.0.2.15.34512 > 142.250.64.78.443: Flags [.], ack 415759, win 65535, length 0
00:18:14.453875 IP 142.250.64.78.443 > 10.0.2.15.34512: Flags [P.], seq 415759:417133, ack 821, win 65535, length 1374
00:18:14.453877 IP 142.250.64.78.443 > 10.0.2.15.34512: Flags [P.], seq 417133:418507, ack 821, win 65535, length 1374
00:18:14.453889 IP 10.0.2.15.34512 > 142.250.64.78.443: Flags [.], ack 417133, win 65535, length 0
00:18:14.453903 IP 10.0.2.15.34512 > 142.250.64.78.443: Flags [.], ack 418507, win 65535, length 0
00:18:14.454092 IP 142.250.64.78.443 > 10.0.2.15.34512: Flags [P.], seq 418507:422629, ack 821, win 65535, length 4122
00:18:14.454111 IP 10.0.2.15.34512 > 142.250.64.78.443: Flags [.], ack 422629, win 65535, length 0
00:18:14.454508 IP 142.250.64.78.443 > 10.0.2.15.34512: Flags [P.], seq 422629:425377, ack 821, win 65535, length 2748
00:18:14.454525 IP 10.0.2.15.34512 > 142.250.64.78.443: Flags [.], ack 425377, win 65535, length 0
00:18:14.454754 IP 142.250.64.78.443 > 10.0.2.15.34512: Flags [P.], seq 425377:428125, ack 821, win 65535, length 2748
00:18:14.454756 IP 142.250.64.78.443 > 10.0.2.15.34512: Flags [P.], seq 428125:430873, ack 821, win 65535, length 2748
00:18:14.454771 IP 10.0.2.15.34512 > 142.250.64.78.443: Flags [.], ack 428125, win 65535, length 0
00:18:14.454801 IP 10.0.2.15.34512 > 142.250.64.78.443: Flags [.], ack 430873, win 65535, length 0
00:18:14.455060 IP 142.250.64.78.443 > 10.0.2.15.34512: Flags [P.], seq 430873:433621, ack 821, win 65535, length 2748
00:18:14.455094 IP 10.0.2.15.34512 > 142.250.64.78.443: Flags [.], ack 433621, win 65535, length 0
00:18:14.455431 IP 142.250.64.78.443 > 10.0.2.15.34512: Flags [P.], seq 433621:439117, ack 821, win 65535, length 5496
00:18:14.455444 IP 10.0.2.15.34512 > 142.250.64.78.443: Flags [.], ack 439117, win 65535, length 0
00:18:14.455721 IP 142.250.64.78.443 > 10.0.2.15.34512: Flags [P.], seq 439117:441865, ack 821, win 65535, length 2748
00:18:14.455723 IP 142.250.64.78.443 > 10.0.2.15.34512: Flags [P.], seq 441865:445987, ack 821, win 65535, length 4122
00:18:14.455735 IP 10.0.2.15.34512 > 142.250.64.78.443: Flags [.], ack 441865, win 65535, length 0
00:18:14.455750 IP 10.0.2.15.34512 > 142.250.64.78.443: Flags [.], ack 445987, win 65535, length 0
00:18:14.455957 IP 142.250.64.78.443 > 10.0.2.15.34512: Flags [P.], seq 445987:447361, ack 821, win 65535, length 1374
00:18:14.455963 IP 10.0.2.15.34512 > 142.250.64.78.443: Flags [.], ack 447361, win 65535, length 0
00:18:14.456283 IP 142.250.64.78.443 > 10.0.2.15.34512: Flags [P.], seq 447361:448735, ack 821, win 65535, length 1374
00:18:14.456293 IP 10.0.2.15.34512 > 142.250.64.78.443: Flags [.], ack 448735, win 65535, length 0
00:18:14.457045 IP 142.250.64.78.443 > 10.0.2.15.34512: Flags [P.], seq 448735:451483, ack 821, win 65535, length 2748
00:18:14.457062 IP 10.0.2.15.34512 > 142.250.64.78.443: Flags [.], ack 451483, win 65535, length 0
00:18:14.457497 IP 142.250.64.78.443 > 10.0.2.15.34512: Flags [P.], seq 451483:454231, ack 821, win 65535, length 2748
00:18:14.457499 IP 142.250.64.78.443 > 10.0.2.15.34512: Flags [P.], seq 454231:455605, ack 821, win 65535, length 1374
00:18:14.457499 IP 142.250.64.78.443 > 10.0.2.15.34512: Flags [P.], seq 455605:458353, ack 821, win 65535, length 2748
00:18:14.457514 IP 10.0.2.15.34512 > 142.250.64.78.443: Flags [.], ack 454231, win 65535, length 0
00:18:14.457529 IP 10.0.2.15.34512 > 142.250.64.78.443: Flags [.], ack 455605, win 65535, length 0
00:18:14.457536 IP 10.0.2.15.34512 > 142.250.64.78.443: Flags [.], ack 458353, win 65535, length 0
00:18:14.457635 IP 142.250.64.78.443 > 10.0.2.15.34512: Flags [P.], seq 458353:461101, ack 821, win 65535, length 2748
00:18:14.457644 IP 10.0.2.15.34512 > 142.250.64.78.443: Flags [.], ack 461101, win 65535, length 0
00:18:14.458065 IP 142.250.64.78.443 > 10.0.2.15.34512: Flags [P.], seq 461101:463849, ack 821, win 65535, length 2748
00:18:14.458076 IP 10.0.2.15.34512 > 142.250.64.78.443: Flags [.], ack 463849, win 65535, length 0
00:18:14.458335 IP 142.250.64.78.443 > 10.0.2.15.34512: Flags [P.], seq 463849:466597, ack 821, win 65535, length 2748
00:18:14.458345 IP 10.0.2.15.34512 > 142.250.64.78.443: Flags [.], ack 466597, win 65535, length 0
00:18:14.458507 IP 142.250.64.78.443 > 10.0.2.15.34512: Flags [P.], seq 466597:469345, ack 821, win 65535, length 2748
00:18:14.458514 IP 10.0.2.15.34512 > 142.250.64.78.443: Flags [.], ack 469345, win 65535, length 0
00:18:14.458631 IP 142.250.64.78.443 > 10.0.2.15.34512: Flags [P.], seq 469345:470719, ack 821, win 65535, length 1374
00:18:14.458637 IP 10.0.2.15.34512 > 142.250.64.78.443: Flags [.], ack 470719, win 65535, length 0
00:18:14.459139 IP 142.250.64.78.443 > 10.0.2.15.34512: Flags [P.], seq 470719:473467, ack 821, win 65535, length 2748
00:18:14.459140 IP 142.250.64.78.443 > 10.0.2.15.34512: Flags [P.], seq 473467:474841, ack 821, win 65535, length 1374
00:18:14.459141 IP 142.250.64.78.443 > 10.0.2.15.34512: Flags [P.], seq 474841:477589, ack 821, win 65535, length 2748
00:18:14.459153 IP 10.0.2.15.34512 > 142.250.64.78.443: Flags [.], ack 473467, win 65535, length 0

