13:06:45.816234 IP 142.250.80.110.443 > 10.0.2.15.59590: Flags [S.], seq 36544001, ack 2325113011, win 65535, options [mss 1460], length 0
13:06:45.816287 IP 10.0.2.15.59590 > 142.250.80.110.443: Flags [.], ack 1, win 64240, length 0
13:06:45.825249 IP 10.0.2.15.59590 > 142.250.80.110.443: Flags [P.], seq 1:518, ack 1, win 64240, length 517
13:06:45.825900 IP 142.250.80.110.443 > 10.0.2.15.59590: Flags [.], ack 518, win 65535, length 0
13:06:45.849032 IP 142.250.80.110.443 > 10.0.2.15.59590: Flags [.], seq 1:2921, ack 518, win 65535, length 2920
13:06:45.849057 IP 10.0.2.15.59590 > 142.250.80.110.443: Flags [.], ack 2921, win 62780, length 0
13:06:45.849420 IP 142.250.80.110.443 > 10.0.2.15.59590: Flags [P.], seq 2921:4123, ack 518, win 65535, length 1202
13:06:45.849438 IP 10.0.2.15.59590 > 142.250.80.110.443: Flags [.], ack 4123, win 61578, length 0
13:06:45.851332 IP 142.250.80.110.443 > 10.0.2.15.59590: Flags [P.], seq 4123:6650, ack 518, win 65535, length 2527
13:06:45.851347 IP 10.0.2.15.59590 > 142.250.80.110.443: Flags [.], ack 6650, win 62780, length 0
13:06:45.852320 IP 10.0.2.15.59590 > 142.250.80.110.443: Flags [P.], seq 518:598, ack 6650, win 62780, length 80
13:06:45.852705 IP 142.250.80.110.443 > 10.0.2.15.59590: Flags [.], ack 598, win 65535, length 0
13:06:45.852769 IP 10.0.2.15.59590 > 142.250.80.110.443: Flags [P.], seq 598:644, ack 6650, win 62780, length 46
13:06:45.852796 IP 10.0.2.15.59590 > 142.250.80.110.443: Flags [P.], seq 644:693, ack 6650, win 62780, length 49
13:06:45.852983 IP 142.250.80.110.443 > 10.0.2.15.59590: Flags [.], ack 644, win 65535, length 0
13:06:45.852984 IP 142.250.80.110.443 > 10.0.2.15.59590: Flags [.], ack 693, win 65535, length 0
13:06:45.852997 IP 10.0.2.15.59590 > 142.250.80.110.443: Flags [P.], seq 693:791, ack 6650, win 62780, length 98
13:06:45.853393 IP 142.250.80.110.443 > 10.0.2.15.59590: Flags [.], ack 791, win 65535, length 0
13:06:45.872679 IP 142.250.80.110.443 > 10.0.2.15.59590: Flags [P.], seq 6650:7323, ack 791, win 65535, length 673
13:06:45.872704 IP 10.0.2.15.59590 > 142.250.80.110.443: Flags [.], ack 7323, win 62780, length 0
13:06:45.873288 IP 10.0.2.15.59590 > 142.250.80.110.443: Flags [P.], seq 791:822, ack 7323, win 62780, length 31
13:06:45.873882 IP 142.250.80.110.443 > 10.0.2.15.59590: Flags [.], ack 822, win 65535, length 0
13:06:45.951069 IP 142.250.80.110.443 > 10.0.2.15.59590: Flags [P.], seq 7323:13861, ack 822, win 65535, length 6538
13:06:45.951100 IP 10.0.2.15.59590 > 142.250.80.110.443: Flags [.], ack 13861, win 59860, length 0
13:06:45.956174 IP 142.250.80.110.443 > 10.0.2.15.59590: Flags [P.], seq 13861:17199, ack 822, win 65535, length 3338
13:06:45.956197 IP 10.0.2.15.59590 > 142.250.80.110.443: Flags [.], ack 17199, win 61320, length 0
13:06:45.973659 IP 142.250.80.110.443 > 10.0.2.15.59590: Flags [P.], seq 17199:26817, ack 822, win 65535, length 9618
13:06:45.973678 IP 10.0.2.15.59590 > 142.250.80.110.443: Flags [.], ack 26817, win 58400, length 0
13:06:45.974555 IP 142.250.80.110.443 > 10.0.2.15.59590: Flags [P.], seq 26817:33687, ack 822, win 65535, length 6870
13:06:45.974574 IP 10.0.2.15.59590 > 142.250.80.110.443: Flags [.], ack 33687, win 59860, length 0
13:06:45.975759 IP 142.250.80.110.443 > 10.0.2.15.59590: Flags [P.], seq 33687:37809, ack 822, win 65535, length 4122
13:06:45.975775 IP 10.0.2.15.59590 > 142.250.80.110.443: Flags [.], ack 37809, win 61320, length 0
13:06:45.976749 IP 142.250.80.110.443 > 10.0.2.15.59590: Flags [P.], seq 37809:39183, ack 822, win 65535, length 1374
13:06:45.976765 IP 10.0.2.15.59590 > 142.250.80.110.443: Flags [.], ack 39183, win 62780, length 0
13:06:45.978958 IP 142.250.80.110.443 > 10.0.2.15.59590: Flags [P.], seq 39183:43305, ack 822, win 65535, length 4122
13:06:45.978974 IP 10.0.2.15.59590 > 142.250.80.110.443: Flags [.], ack 43305, win 61320, length 0
13:06:45.980118 IP 142.250.80.110.443 > 10.0.2.15.59590: Flags [P.], seq 43305:44679, ack 822, win 65535, length 1374
13:06:45.980265 IP 10.0.2.15.59590 > 142.250.80.110.443: Flags [.], ack 44679, win 62780, length 0
13:06:45.985622 IP 142.250.80.110.443 > 10.0.2.15.59590: Flags [P.], seq 44679:46053, ack 822, win 65535, length 1374
13:06:45.987050 IP 142.250.80.110.443 > 10.0.2.15.59590: Flags [P.], seq 46053:51549, ack 822, win 65535, length 5496
13:06:45.987154 IP 10.0.2.15.59590 > 142.250.80.110.443: Flags [.], ack 51549, win 61320, length 0
13:06:45.987617 IP 142.250.80.110.443 > 10.0.2.15.59590: Flags [P.], seq 51549:55671, ack 822, win 65535, length 4122
13:06:45.987634 IP 10.0.2.15.59590 > 142.250.80.110.443: Flags [.], ack 55671, win 61320, length 0
13:06:45.988856 IP 142.250.80.110.443 > 10.0.2.15.59590: Flags [P.], seq 55671:57045, ack 822, win 65535, length 1374
13:06:45.988975 IP 10.0.2.15.59590 > 142.250.80.110.443: Flags [.], ack 57045, win 62780, length 0
13:06:45.989917 IP 142.250.80.110.443 > 10.0.2.15.59590: Flags [P.], seq 57045:62541, ack 822, win 65535, length 5496
13:06:45.990444 IP 10.0.2.15.59590 > 142.250.80.110.443: Flags [.], ack 62541, win 61320, length 0
13:06:45.990904 IP 142.250.80.110.443 > 10.0.2.15.59590: Flags [P.], seq 62541:65289, ack 822, win 65535, length 2748
13:06:45.990916 IP 10.0.2.15.59590 > 142.250.80.110.443: Flags [.], ack 65289, win 62780, length 0
13:06:45.994374 IP 142.250.80.110.443 > 10.0.2.15.59590: Flags [P.], seq 65289:76281, ack 822, win 65535, length 10992
13:06:45.994545 IP 10.0.2.15.59590 > 142.250.80.110.443: Flags [.], ack 76281, win 62780, length 0
13:06:45.995332 IP 142.250.80.110.443 > 10.0.2.15.59590: Flags [P.], seq 76281:77655, ack 822, win 65535, length 1374
13:06:45.995346 IP 10.0.2.15.59590 > 142.250.80.110.443: Flags [.], ack 77655, win 65535, length 0
13:06:45.999572 IP 142.250.80.110.443 > 10.0.2.15.59590: Flags [P.], seq 77655:91395, ack 822, win 65535, length 13740
13:06:45.999593 IP 10.0.2.15.59590 > 142.250.80.110.443: Flags [.], ack 91395, win 65535, length 0
13:06:46.001142 IP 142.250.80.110.443 > 10.0.2.15.59590: Flags [P.], seq 91395:94143, ack 822, win 65535, length 2748
13:06:46.001162 IP 10.0.2.15.59590 > 142.250.80.110.443: Flags [.], ack 94143, win 65535, length 0
13:06:46.002855 IP 142.250.80.110.443 > 10.0.2.15.59590: Flags [P.], seq 94143:106509, ack 822, win 65535, length 12366
13:06:46.002874 IP 10.0.2.15.59590 > 142.250.80.110.443: Flags [.], ack 106509, win 65535, length 0
13:06:46.004169 IP 142.250.80.110.443 > 10.0.2.15.59590: Flags [P.], seq 106509:113379, ack 822, win 65535, length 6870
13:06:46.004187 IP 10.0.2.15.59590 > 142.250.80.110.443: Flags [.], ack 113379, win 65535, length 0
13:06:46.004445 IP 142.250.80.110.443 > 10.0.2.15.59590: Flags [P.], seq 113379:116127, ack 822, win 65535, length 2748
13:06:46.004455 IP 10.0.2.15.59590 > 142.250.80.110.443: Flags [.], ack 116127, win 65535, length 0
13:06:46.005172 IP 142.250.80.110.443 > 10.0.2.15.59590: Flags [P.], seq 116127:117501, ack 822, win 65535, length 1374
13:06:46.005184 IP 10.0.2.15.59590 > 142.250.80.110.443: Flags [.], ack 117501, win 65535, length 0
13:06:46.006439 IP 142.250.80.110.443 > 10.0.2.15.59590: Flags [P.], seq 117501:125745, ack 822, win 65535, length 8244
13:06:46.006454 IP 10.0.2.15.59590 > 142.250.80.110.443: Flags [.], ack 125745, win 65535, length 0
13:06:46.007621 IP 142.250.80.110.443 > 10.0.2.15.59590: Flags [P.], seq 125745:136737, ack 822, win 65535, length 10992
13:06:46.007637 IP 10.0.2.15.59590 > 142.250.80.110.443: Flags [.], ack 136737, win 65535, length 0
13:06:46.008793 IP 142.250.80.110.443 > 10.0.2.15.59590: Flags [P.], seq 136737:142233, ack 822, win 65535, length 5496
13:06:46.008814 IP 10.0.2.15.59590 > 142.250.80.110.443: Flags [.], ack 142233, win 65535, length 0
13:06:46.009943 IP 142.250.80.110.443 > 10.0.2.15.59590: Flags [P.], seq 142233:147729, ack 822, win 65535, length 5496
13:06:46.009960 IP 10.0.2.15.59590 > 142.250.80.110.443: Flags [.], ack 147729, win 65535, length 0
13:06:46.013241 IP 142.250.80.110.443 > 10.0.2.15.59590: Flags [P.], seq 147729:160095, ack 822, win 65535, length 12366
13:06:46.013259 IP 10.0.2.15.59590 > 142.250.80.110.443: Flags [.], ack 160095, win 65535, length 0
13:06:46.013472 IP 142.250.80.110.443 > 10.0.2.15.59590: Flags [P.], seq 160095:172461, ack 822, win 65535, length 12366
13:06:46.013489 IP 10.0.2.15.59590 > 142.250.80.110.443: Flags [.], ack 172461, win 65535, length 0
13:06:46.015671 IP 142.250.80.110.443 > 10.0.2.15.59590: Flags [P.], seq 172461:180705, ack 822, win 65535, length 8244
13:06:46.015725 IP 10.0.2.15.59590 > 142.250.80.110.443: Flags [.], ack 180705, win 65535, length 0
13:06:46.015904 IP 142.250.80.110.443 > 10.0.2.15.59590: Flags [P.], seq 180705:191697, ack 822, win 65535, length 10992
13:06:46.015912 IP 10.0.2.15.59590 > 142.250.80.110.443: Flags [.], ack 191697, win 65535, length 0
13:06:46.017063 IP 142.250.80.110.443 > 10.0.2.15.59590: Flags [P.], seq 191697:192669, ack 822, win 65535, length 972
13:06:46.017127 IP 10.0.2.15.59590 > 142.250.80.110.443: Flags [.], ack 192669, win 65535, length 0
13:06:46.115594 IP 142.250.80.110.443 > 10.0.2.15.59590: Flags [P.], seq 192669:192862, ack 822, win 65535, length 193
13:06:46.115629 IP 10.0.2.15.59590 > 142.250.80.110.443: Flags [.], ack 192862, win 65535, length 0
13:06:46.167032 IP 142.250.80.110.443 > 10.0.2.15.59590: Flags [P.], seq 192862:214846, ack 822, win 65535, length 21984
13:06:46.167075 IP 10.0.2.15.59590 > 142.250.80.110.443: Flags [.], ack 214846, win 65535, length 0
13:06:46.168912 IP 142.250.80.110.443 > 10.0.2.15.59590: Flags [P.], seq 214846:231694, ack 822, win 65535, length 16848
13:06:46.168931 IP 10.0.2.15.59590 > 142.250.80.110.443: Flags [.], ack 231694, win 65535, length 0
13:06:46.171975 IP 142.250.80.110.443 > 10.0.2.15.59590: Flags [P.], seq 231694:259351, ack 822, win 65535, length 27657
13:06:46.172003 IP 10.0.2.15.59590 > 142.250.80.110.443: Flags [.], ack 259351, win 65535, length 0
13:06:46.180653 IP 142.250.80.110.443 > 10.0.2.15.59590: Flags [P.], seq 259351:262099, ack 822, win 65535, length 2748
13:06:46.180672 IP 10.0.2.15.59590 > 142.250.80.110.443: Flags [.], ack 262099, win 65535, length 0
13:06:46.181151 IP 142.250.80.110.443 > 10.0.2.15.59590: Flags [P.], seq 262099:264847, ack 822, win 65535, length 2748
13:06:46.181162 IP 10.0.2.15.59590 > 142.250.80.110.443: Flags [.], ack 264847, win 65535, length 0
13:06:46.182551 IP 142.250.80.110.443 > 10.0.2.15.59590: Flags [P.], seq 264847:285457, ack 822, win 65535, length 20610
13:06:46.182571 IP 10.0.2.15.59590 > 142.250.80.110.443: Flags [.], ack 285457, win 65535, length 0
13:06:46.183699 IP 142.250.80.110.443 > 10.0.2.15.59590: Flags [P.], seq 285457:292673, ack 822, win 65535, length 7216
13:06:46.183714 IP 10.0.2.15.59590 > 142.250.80.110.443: Flags [.], ack 292673, win 65535, length 0
13:06:46.187096 IP 142.250.80.110.443 > 10.0.2.15.59590: Flags [P.], seq 292673:300917, ack 822, win 65535, length 8244
13:06:46.187113 IP 10.0.2.15.59590 > 142.250.80.110.443: Flags [.], ack 300917, win 65535, length 0
13:06:46.188264 IP 142.250.80.110.443 > 10.0.2.15.59590: Flags [P.], seq 300917:311909, ack 822, win 65535, length 10992
13:06:46.188280 IP 10.0.2.15.59590 > 142.250.80.110.443: Flags [.], ack 311909, win 65535, length 0
13:06:46.188761 IP 142.250.80.110.443 > 10.0.2.15.59590: Flags [P.], seq 311909:320153, ack 822, win 65535, length 8244
13:06:46.188781 IP 10.0.2.15.59590 > 142.250.80.110.443: Flags [.], ack 320153, win 65535, length 0
13:06:46.189127 IP 142.250.80.110.443 > 10.0.2.15.59590: Flags [P.], seq 320153:325649, ack 822, win 65535, length 5496
13:06:46.189141 IP 10.0.2.15.59590 > 142.250.80.110.443: Flags [.], ack 325649, win 65535, length 0
13:06:46.190512 IP 142.250.80.110.443 > 10.0.2.15.59590: Flags [P.], seq 325649:327369, ack 822, win 65535, length 1720
13:06:46.190535 IP 10.0.2.15.59590 > 142.250.80.110.443: Flags [.], ack 327369, win 65535, length 0
13:06:46.192823 IP 142.250.80.110.443 > 10.0.2.15.59590: Flags [P.], seq 327369:357597, ack 822, win 65535, length 30228
13:06:46.192846 IP 10.0.2.15.59590 > 142.250.80.110.443: Flags [.], ack 357597, win 65535, length 0
13:06:46.193201 IP 142.250.80.110.443 > 10.0.2.15.59590: Flags [P.], seq 357597:359327, ack 822, win 65535, length 1730
13:06:46.193214 IP 10.0.2.15.59590 > 142.250.80.110.443: Flags [.], ack 359327, win 65535, length 0
13:06:46.196941 IP 142.250.80.110.443 > 10.0.2.15.59590: Flags [P.], seq 359327:368945, ack 822, win 65535, length 9618
13:06:46.196962 IP 10.0.2.15.59590 > 142.250.80.110.443: Flags [.], ack 368945, win 65535, length 0
13:06:46.197124 IP 142.250.80.110.443 > 10.0.2.15.59590: Flags [.], seq 368945:374785, ack 822, win 65535, length 5840
13:06:46.197137 IP 10.0.2.15.59590 > 142.250.80.110.443: Flags [.], ack 374785, win 65535, length 0
13:06:46.197289 IP 142.250.80.110.443 > 10.0.2.15.59590: Flags [P.], seq 374785:375815, ack 822, win 65535, length 1030
13:06:46.197312 IP 10.0.2.15.59590 > 142.250.80.110.443: Flags [.], ack 375815, win 65535, length 0
13:06:46.198726 IP 142.250.80.110.443 > 10.0.2.15.59590: Flags [P.], seq 375815:396425, ack 822, win 65535, length 20610
13:06:46.198751 IP 10.0.2.15.59590 > 142.250.80.110.443: Flags [.], ack 396425, win 65535, length 0
13:06:46.199151 IP 142.250.80.110.443 > 10.0.2.15.59590: Flags [P.], seq 396425:404669, ack 822, win 65535, length 8244
13:06:46.199167 IP 10.0.2.15.59590 > 142.250.80.110.443: Flags [.], ack 404669, win 65535, length 0
13:06:46.200740 IP 142.250.80.110.443 > 10.0.2.15.59590: Flags [.], seq 404669:413429, ack 822, win 65535, length 8760
13:06:46.200765 IP 10.0.2.15.59590 > 142.250.80.110.443: Flags [.], ack 413429, win 65535, length 0
13:06:46.200899 IP 142.250.80.110.443 > 10.0.2.15.59590: Flags [P.], seq 413429:422531, ack 822, win 65535, length 9102
13:06:46.200909 IP 10.0.2.15.59590 > 142.250.80.110.443: Flags [.], ack 422531, win 65535, length 0
13:06:46.201321 IP 142.250.80.110.443 > 10.0.2.15.59590: Flags [P.], seq 422531:425981, ack 822, win 65535, length 3450
13:06:46.201336 IP 10.0.2.15.59590 > 142.250.80.110.443: Flags [.], ack 425981, win 65535, length 0
13:06:46.209884 IP 142.250.80.110.443 > 10.0.2.15.59590: Flags [P.], seq 425981:442469, ack 822, win 65535, length 16488
13:06:46.209966 IP 10.0.2.15.59590 > 142.250.80.110.443: Flags [.], ack 442469, win 65535, length 0
13:06:46.210034 IP 142.250.80.110.443 > 10.0.2.15.59590: Flags [P.], seq 442469:454835, ack 822, win 65535, length 12366
13:06:46.210045 IP 10.0.2.15.59590 > 142.250.80.110.443: Flags [.], ack 454835, win 65535, length 0
13:06:46.210276 IP 142.250.80.110.443 > 10.0.2.15.59590: Flags [P.], seq 454835:456209, ack 822, win 65535, length 1374
13:06:46.210288 IP 10.0.2.15.59590 > 142.250.80.110.443: Flags [.], ack 456209, win 65535, length 0
13:06:46.211570 IP 142.250.80.110.443 > 10.0.2.15.59590: Flags [P.], seq 456209:467201, ack 822, win 65535, length 10992
13:06:46.211585 IP 10.0.2.15.59590 > 142.250.80.110.443: Flags [.], ack 467201, win 65535, length 0
13:06:46.212046 IP 142.250.80.110.443 > 10.0.2.15.59590: Flags [P.], seq 467201:476819, ack 822, win 65535, length 9618
13:06:46.212061 IP 10.0.2.15.59590 > 142.250.80.110.443: Flags [.], ack 476819, win 65535, length 0
13:06:46.212312 IP 142.250.80.110.443 > 10.0.2.15.59590: Flags [P.], seq 476819:478193, ack 822, win 65535, length 1374
13:06:46.212321 IP 10.0.2.15.59590 > 142.250.80.110.443: Flags [.], ack 478193, win 65535, length 0

