13:21:56.375565 IP 142.250.80.110.443 > 10.0.2.15.59594: Flags [S.], seq 91136001, ack 735708609, win 65535, options [mss 1460], length 0
13:21:56.375607 IP 10.0.2.15.59594 > 142.250.80.110.443: Flags [.], ack 1, win 64240, length 0
13:21:56.383386 IP 10.0.2.15.59594 > 142.250.80.110.443: Flags [P.], seq 1:518, ack 1, win 64240, length 517
13:21:56.383968 IP 142.250.80.110.443 > 10.0.2.15.59594: Flags [.], ack 518, win 65535, length 0
13:21:56.406052 IP 142.250.80.110.443 > 10.0.2.15.59594: Flags [.], seq 1:2921, ack 518, win 65535, length 2920
13:21:56.406079 IP 10.0.2.15.59594 > 142.250.80.110.443: Flags [.], ack 2921, win 62780, length 0
13:21:56.407183 IP 142.250.80.110.443 > 10.0.2.15.59594: Flags [P.], seq 2921:4123, ack 518, win 65535, length 1202
13:21:56.407213 IP 10.0.2.15.59594 > 142.250.80.110.443: Flags [.], ack 4123, win 61578, length 0
13:21:56.407739 IP 142.250.80.110.443 > 10.0.2.15.59594: Flags [P.], seq 4123:6651, ack 518, win 65535, length 2528
13:21:56.407754 IP 10.0.2.15.59594 > 142.250.80.110.443: Flags [.], ack 6651, win 62780, length 0
13:21:56.408736 IP 10.0.2.15.59594 > 142.250.80.110.443: Flags [P.], seq 518:598, ack 6651, win 62780, length 80
13:21:56.408924 IP 142.250.80.110.443 > 10.0.2.15.59594: Flags [.], ack 598, win 65535, length 0
13:21:56.409053 IP 10.0.2.15.59594 > 142.250.80.110.443: Flags [P.], seq 598:644, ack 6651, win 62780, length 46
13:21:56.409074 IP 10.0.2.15.59594 > 142.250.80.110.443: Flags [P.], seq 644:693, ack 6651, win 62780, length 49
13:21:56.409172 IP 10.0.2.15.59594 > 142.250.80.110.443: Flags [P.], seq 693:791, ack 6651, win 62780, length 98
13:21:56.409287 IP 142.250.80.110.443 > 10.0.2.15.59594: Flags [.], ack 644, win 65535, length 0
13:21:56.409288 IP 142.250.80.110.443 > 10.0.2.15.59594: Flags [.], ack 693, win 65535, length 0
13:21:56.409289 IP 142.250.80.110.443 > 10.0.2.15.59594: Flags [.], ack 791, win 65535, length 0
13:21:56.422766 IP 142.250.80.110.443 > 10.0.2.15.59594: Flags [P.], seq 6651:7293, ack 791, win 65535, length 642
13:21:56.423087 IP 10.0.2.15.59594 > 142.250.80.110.443: Flags [.], ack 7293, win 62780, length 0
13:21:56.423330 IP 142.250.80.110.443 > 10.0.2.15.59594: Flags [P.], seq 7293:7324, ack 791, win 65535, length 31
13:21:56.423389 IP 10.0.2.15.59594 > 142.250.80.110.443: Flags [.], ack 7324, win 62780, length 0
13:21:56.423710 IP 10.0.2.15.59594 > 142.250.80.110.443: Flags [P.], seq 791:822, ack 7324, win 62780, length 31
13:21:56.424391 IP 142.250.80.110.443 > 10.0.2.15.59594: Flags [.], ack 822, win 65535, length 0
13:21:56.456815 IP 142.250.80.110.443 > 10.0.2.15.59594: Flags [P.], seq 7324:13863, ack 822, win 65535, length 6539
13:21:56.456843 IP 10.0.2.15.59594 > 142.250.80.110.443: Flags [.], ack 13863, win 59860, length 0
13:21:56.458336 IP 142.250.80.110.443 > 10.0.2.15.59594: Flags [P.], seq 13863:19934, ack 822, win 65535, length 6071
13:21:56.458358 IP 10.0.2.15.59594 > 142.250.80.110.443: Flags [.], ack 19934, win 59860, length 0
13:21:56.460693 IP 142.250.80.110.443 > 10.0.2.15.59594: Flags [P.], seq 19934:24056, ack 822, win 65535, length 4122
13:21:56.460748 IP 10.0.2.15.59594 > 142.250.80.110.443: Flags [.], ack 24056, win 61320, length 0
13:21:56.463473 IP 142.250.80.110.443 > 10.0.2.15.59594: Flags [P.], seq 24056:28178, ack 822, win 65535, length 4122
13:21:56.463492 IP 10.0.2.15.59594 > 142.250.80.110.443: Flags [.], ack 28178, win 61320, length 0
13:21:56.464521 IP 142.250.80.110.443 > 10.0.2.15.59594: Flags [P.], seq 28178:29552, ack 822, win 65535, length 1374
13:21:56.464538 IP 10.0.2.15.59594 > 142.250.80.110.443: Flags [.], ack 29552, win 62780, length 0
13:21:56.469349 IP 142.250.80.110.443 > 10.0.2.15.59594: Flags [P.], seq 29552:33674, ack 822, win 65535, length 4122
13:21:56.469375 IP 10.0.2.15.59594 > 142.250.80.110.443: Flags [.], ack 33674, win 61320, length 0
13:21:56.470558 IP 142.250.80.110.443 > 10.0.2.15.59594: Flags [P.], seq 33674:36422, ack 822, win 65535, length 2748
13:21:56.470574 IP 10.0.2.15.59594 > 142.250.80.110.443: Flags [.], ack 36422, win 62780, length 0
13:21:56.470873 IP 142.250.80.110.443 > 10.0.2.15.59594: Flags [P.], seq 36422:41918, ack 822, win 65535, length 5496
13:21:56.470919 IP 10.0.2.15.59594 > 142.250.80.110.443: Flags [.], ack 41918, win 58400, length 0
13:21:56.471944 IP 142.250.80.110.443 > 10.0.2.15.59594: Flags [P.], seq 41918:44666, ack 822, win 65535, length 2748
13:21:56.471959 IP 10.0.2.15.59594 > 142.250.80.110.443: Flags [.], ack 44666, win 62780, length 0
13:21:56.472992 IP 142.250.80.110.443 > 10.0.2.15.59594: Flags [P.], seq 44666:48788, ack 822, win 65535, length 4122
13:21:56.473053 IP 10.0.2.15.59594 > 142.250.80.110.443: Flags [.], ack 48788, win 61320, length 0
13:21:56.474036 IP 142.250.80.110.443 > 10.0.2.15.59594: Flags [P.], seq 48788:50162, ack 822, win 65535, length 1374
13:21:56.474099 IP 10.0.2.15.59594 > 142.250.80.110.443: Flags [.], ack 50162, win 62780, length 0
13:21:56.475068 IP 142.250.80.110.443 > 10.0.2.15.59594: Flags [P.], seq 50162:55658, ack 822, win 65535, length 5496
13:21:56.475129 IP 10.0.2.15.59594 > 142.250.80.110.443: Flags [.], ack 55658, win 61320, length 0
13:21:56.476236 IP 142.250.80.110.443 > 10.0.2.15.59594: Flags [P.], seq 55658:58406, ack 822, win 65535, length 2748
13:21:56.476251 IP 10.0.2.15.59594 > 142.250.80.110.443: Flags [.], ack 58406, win 62780, length 0
13:21:56.478683 IP 142.250.80.110.443 > 10.0.2.15.59594: Flags [P.], seq 58406:66650, ack 822, win 65535, length 8244
13:21:56.478847 IP 10.0.2.15.59594 > 142.250.80.110.443: Flags [.], ack 66650, win 58400, length 0
13:21:56.479325 IP 142.250.80.110.443 > 10.0.2.15.59594: Flags [P.], seq 66650:69398, ack 822, win 65535, length 2748
13:21:56.479337 IP 10.0.2.15.59594 > 142.250.80.110.443: Flags [.], ack 69398, win 62780, length 0
13:21:56.480092 IP 142.250.80.110.443 > 10.0.2.15.59594: Flags [P.], seq 69398:72146, ack 822, win 65535, length 2748
13:21:56.480107 IP 10.0.2.15.59594 > 142.250.80.110.443: Flags [.], ack 72146, win 65535, length 0
13:21:56.481369 IP 142.250.80.110.443 > 10.0.2.15.59594: Flags [P.], seq 72146:79016, ack 822, win 65535, length 6870
13:21:56.481383 IP 10.0.2.15.59594 > 142.250.80.110.443: Flags [.], ack 79016, win 65535, length 0
13:21:56.481497 IP 142.250.80.110.443 > 10.0.2.15.59594: Flags [P.], seq 79016:80390, ack 822, win 65535, length 1374
13:21:56.481503 IP 10.0.2.15.59594 > 142.250.80.110.443: Flags [.], ack 80390, win 65535, length 0
13:21:56.482413 IP 142.250.80.110.443 > 10.0.2.15.59594: Flags [P.], seq 80390:85886, ack 822, win 65535, length 5496
13:21:56.482457 IP 10.0.2.15.59594 > 142.250.80.110.443: Flags [.], ack 85886, win 65535, length 0
13:21:56.483775 IP 142.250.80.110.443 > 10.0.2.15.59594: Flags [P.], seq 85886:91382, ack 822, win 65535, length 5496
13:21:56.483881 IP 10.0.2.15.59594 > 142.250.80.110.443: Flags [.], ack 91382, win 65535, length 0
13:21:56.485045 IP 142.250.80.110.443 > 10.0.2.15.59594: Flags [P.], seq 91382:99626, ack 822, win 65535, length 8244
13:21:56.485069 IP 10.0.2.15.59594 > 142.250.80.110.443: Flags [.], ack 99626, win 65535, length 0
13:21:56.486271 IP 142.250.80.110.443 > 10.0.2.15.59594: Flags [P.], seq 99626:103748, ack 822, win 65535, length 4122
13:21:56.486325 IP 10.0.2.15.59594 > 142.250.80.110.443: Flags [.], ack 103748, win 65535, length 0
13:21:56.487613 IP 142.250.80.110.443 > 10.0.2.15.59594: Flags [P.], seq 103748:113366, ack 822, win 65535, length 9618
13:21:56.487615 IP 142.250.80.110.443 > 10.0.2.15.59594: Flags [P.], seq 113366:114740, ack 822, win 65535, length 1374
13:21:56.487633 IP 10.0.2.15.59594 > 142.250.80.110.443: Flags [.], ack 113366, win 65535, length 0
13:21:56.487658 IP 10.0.2.15.59594 > 142.250.80.110.443: Flags [.], ack 114740, win 65535, length 0
13:21:56.488697 IP 142.250.80.110.443 > 10.0.2.15.59594: Flags [P.], seq 114740:120236, ack 822, win 65535, length 5496
13:21:56.488716 IP 10.0.2.15.59594 > 142.250.80.110.443: Flags [.], ack 120236, win 65535, length 0
13:21:56.489289 IP 142.250.80.110.443 > 10.0.2.15.59594: Flags [P.], seq 120236:125732, ack 822, win 65535, length 5496
13:21:56.489308 IP 10.0.2.15.59594 > 142.250.80.110.443: Flags [.], ack 125732, win 65535, length 0
13:21:56.490474 IP 142.250.80.110.443 > 10.0.2.15.59594: Flags [P.], seq 125732:132602, ack 822, win 65535, length 6870
13:21:56.490489 IP 10.0.2.15.59594 > 142.250.80.110.443: Flags [.], ack 132602, win 65535, length 0
13:21:56.491828 IP 142.250.80.110.443 > 10.0.2.15.59594: Flags [P.], seq 132602:136724, ack 822, win 65535, length 4122
13:21:56.491845 IP 10.0.2.15.59594 > 142.250.80.110.443: Flags [.], ack 136724, win 65535, length 0
13:21:56.492693 IP 142.250.80.110.443 > 10.0.2.15.59594: Flags [P.], seq 136724:147716, ack 822, win 65535, length 10992
13:21:56.492709 IP 10.0.2.15.59594 > 142.250.80.110.443: Flags [.], ack 147716, win 65535, length 0
13:21:56.493952 IP 142.250.80.110.443 > 10.0.2.15.59594: Flags [P.], seq 147716:153212, ack 822, win 65535, length 5496
13:21:56.493967 IP 10.0.2.15.59594 > 142.250.80.110.443: Flags [.], ack 153212, win 65535, length 0
13:21:56.495183 IP 142.250.80.110.443 > 10.0.2.15.59594: Flags [P.], seq 153212:154586, ack 822, win 65535, length 1374
13:21:56.495199 IP 10.0.2.15.59594 > 142.250.80.110.443: Flags [.], ack 154586, win 65535, length 0
13:21:56.496376 IP 142.250.80.110.443 > 10.0.2.15.59594: Flags [P.], seq 154586:173822, ack 822, win 65535, length 19236
13:21:56.496403 IP 10.0.2.15.59594 > 142.250.80.110.443: Flags [.], ack 173822, win 65535, length 0
13:21:56.497151 IP 142.250.80.110.443 > 10.0.2.15.59594: Flags [P.], seq 173822:176570, ack 822, win 65535, length 2748
13:21:56.497167 IP 10.0.2.15.59594 > 142.250.80.110.443: Flags [.], ack 176570, win 65535, length 0
13:21:56.497582 IP 142.250.80.110.443 > 10.0.2.15.59594: Flags [P.], seq 176570:186188, ack 822, win 65535, length 9618
13:21:56.497610 IP 10.0.2.15.59594 > 142.250.80.110.443: Flags [.], ack 186188, win 65535, length 0
13:21:56.498778 IP 142.250.80.110.443 > 10.0.2.15.59594: Flags [P.], seq 186188:190897, ack 822, win 65535, length 4709
13:21:56.498801 IP 10.0.2.15.59594 > 142.250.80.110.443: Flags [.], ack 190897, win 65535, length 0
13:21:56.595713 IP 142.250.80.110.443 > 10.0.2.15.59594: Flags [P.], seq 190897:191090, ack 822, win 65535, length 193
13:21:56.595781 IP 10.0.2.15.59594 > 142.250.80.110.443: Flags [.], ack 191090, win 65535, length 0
13:21:56.607247 IP 142.250.80.110.443 > 10.0.2.15.59594: Flags [P.], seq 191090:196586, ack 822, win 65535, length 5496
13:21:56.607279 IP 10.0.2.15.59594 > 142.250.80.110.443: Flags [.], ack 196586, win 65535, length 0
13:21:56.608711 IP 142.250.80.110.443 > 10.0.2.15.59594: Flags [P.], seq 196586:211700, ack 822, win 65535, length 15114
13:21:56.608761 IP 10.0.2.15.59594 > 142.250.80.110.443: Flags [.], ack 211700, win 65535, length 0
13:21:56.608915 IP 142.250.80.110.443 > 10.0.2.15.59594: Flags [P.], seq 211700:219944, ack 822, win 65535, length 8244
13:21:56.608924 IP 10.0.2.15.59594 > 142.250.80.110.443: Flags [.], ack 219944, win 65535, length 0
13:21:56.610696 IP 142.250.80.110.443 > 10.0.2.15.59594: Flags [P.], seq 219944:229922, ack 822, win 65535, length 9978
13:21:56.610712 IP 10.0.2.15.59594 > 142.250.80.110.443: Flags [.], ack 229922, win 65535, length 0
13:21:56.611216 IP 142.250.80.110.443 > 10.0.2.15.59594: Flags [P.], seq 229922:239540, ack 822, win 65535, length 9618
13:21:56.611244 IP 10.0.2.15.59594 > 142.250.80.110.443: Flags [.], ack 239540, win 65535, length 0
13:21:56.612278 IP 142.250.80.110.443 > 10.0.2.15.59594: Flags [P.], seq 239540:250532, ack 822, win 65535, length 10992
13:21:56.612300 IP 10.0.2.15.59594 > 142.250.80.110.443: Flags [.], ack 250532, win 65535, length 0
13:21:56.612560 IP 142.250.80.110.443 > 10.0.2.15.59594: Flags [P.], seq 250532:258776, ack 822, win 65535, length 8244
13:21:56.612574 IP 10.0.2.15.59594 > 142.250.80.110.443: Flags [.], ack 258776, win 65535, length 0
13:21:56.613352 IP 142.250.80.110.443 > 10.0.2.15.59594: Flags [P.], seq 258776:268394, ack 822, win 65535, length 9618
13:21:56.613452 IP 10.0.2.15.59594 > 142.250.80.110.443: Flags [.], ack 268394, win 65535, length 0
13:21:56.613695 IP 142.250.80.110.443 > 10.0.2.15.59594: Flags [P.], seq 268394:275264, ack 822, win 65535, length 6870
13:21:56.613705 IP 10.0.2.15.59594 > 142.250.80.110.443: Flags [.], ack 275264, win 65535, length 0
13:21:56.614497 IP 142.250.80.110.443 > 10.0.2.15.59594: Flags [P.], seq 275264:286256, ack 822, win 65535, length 10992
13:21:56.614516 IP 10.0.2.15.59594 > 142.250.80.110.443: Flags [.], ack 286256, win 65535, length 0
13:21:56.619641 IP 142.250.80.110.443 > 10.0.2.15.59594: Flags [P.], seq 286256:313736, ack 822, win 65535, length 27480
13:21:56.619663 IP 10.0.2.15.59594 > 142.250.80.110.443: Flags [.], ack 313736, win 65535, length 0
13:21:56.624258 IP 142.250.80.110.443 > 10.0.2.15.59594: Flags [.], seq 313736:351696, ack 822, win 65535, length 37960
13:21:56.624280 IP 10.0.2.15.59594 > 142.250.80.110.443: Flags [.], ack 351696, win 65535, length 0
13:21:56.624412 IP 142.250.80.110.443 > 10.0.2.15.59594: Flags [.], seq 351696:369216, ack 822, win 65535, length 17520
13:21:56.624425 IP 10.0.2.15.59594 > 142.250.80.110.443: Flags [.], ack 369216, win 65535, length 0
13:21:56.625443 IP 142.250.80.110.443 > 10.0.2.15.59594: Flags [P.], seq 369216:379436, ack 822, win 65535, length 10220
13:21:56.625465 IP 10.0.2.15.59594 > 142.250.80.110.443: Flags [.], ack 379436, win 65535, length 0
13:21:56.626542 IP 142.250.80.110.443 > 10.0.2.15.59594: Flags [.], seq 379436:380896, ack 822, win 65535, length 1460
13:21:56.626668 IP 10.0.2.15.59594 > 142.250.80.110.443: Flags [.], ack 380896, win 65535, length 0
13:21:56.627095 IP 142.250.80.110.443 > 10.0.2.15.59594: Flags [.], seq 380896:382356, ack 822, win 65535, length 1460
13:21:56.627111 IP 10.0.2.15.59594 > 142.250.80.110.443: Flags [.], ack 382356, win 65535, length 0
13:21:56.627359 IP 142.250.80.110.443 > 10.0.2.15.59594: Flags [.], seq 382356:383816, ack 822, win 65535, length 1460
13:21:56.627373 IP 10.0.2.15.59594 > 142.250.80.110.443: Flags [.], ack 383816, win 65535, length 0
13:21:56.627756 IP 142.250.80.110.443 > 10.0.2.15.59594: Flags [.], seq 383816:385276, ack 822, win 65535, length 1460
13:21:56.627893 IP 142.250.80.110.443 > 10.0.2.15.59594: Flags [.], seq 385276:386736, ack 822, win 65535, length 1460
13:21:56.627922 IP 10.0.2.15.59594 > 142.250.80.110.443: Flags [.], ack 386736, win 65535, length 0
13:21:56.628075 IP 142.250.80.110.443 > 10.0.2.15.59594: Flags [.], seq 386736:388196, ack 822, win 65535, length 1460
13:21:56.628088 IP 10.0.2.15.59594 > 142.250.80.110.443: Flags [.], ack 388196, win 65535, length 0
13:21:56.631042 IP 142.250.80.110.443 > 10.0.2.15.59594: Flags [.], seq 388196:389656, ack 822, win 65535, length 1460
13:21:56.631066 IP 10.0.2.15.59594 > 142.250.80.110.443: Flags [.], ack 389656, win 65535, length 0
13:21:56.631566 IP 142.250.80.110.443 > 10.0.2.15.59594: Flags [.], seq 389656:391116, ack 822, win 65535, length 1460
13:21:56.631586 IP 10.0.2.15.59594 > 142.250.80.110.443: Flags [.], ack 391116, win 65535, length 0
13:21:56.633005 IP 142.250.80.110.443 > 10.0.2.15.59594: Flags [.], seq 391116:392576, ack 822, win 65535, length 1460
13:21:56.633027 IP 10.0.2.15.59594 > 142.250.80.110.443: Flags [.], ack 392576, win 65535, length 0
13:21:56.633314 IP 142.250.80.110.443 > 10.0.2.15.59594: Flags [.], seq 392576:396956, ack 822, win 65535, length 4380
13:21:56.633327 IP 10.0.2.15.59594 > 142.250.80.110.443: Flags [.], ack 396956, win 65535, length 0
13:21:56.633758 IP 142.250.80.110.443 > 10.0.2.15.59594: Flags [.], seq 396956:398416, ack 822, win 65535, length 1460
13:21:56.633778 IP 10.0.2.15.59594 > 142.250.80.110.443: Flags [.], ack 398416, win 65535, length 0
13:21:56.634646 IP 142.250.80.110.443 > 10.0.2.15.59594: Flags [.], seq 398416:399876, ack 822, win 65535, length 1460
13:21:56.634671 IP 10.0.2.15.59594 > 142.250.80.110.443: Flags [.], ack 399876, win 65535, length 0
13:21:56.635613 IP 142.250.80.110.443 > 10.0.2.15.59594: Flags [.], seq 399876:401336, ack 822, win 65535, length 1460
13:21:56.635633 IP 10.0.2.15.59594 > 142.250.80.110.443: Flags [.], ack 401336, win 65535, length 0
13:21:56.636026 IP 142.250.80.110.443 > 10.0.2.15.59594: Flags [.], seq 401336:402796, ack 822, win 65535, length 1460
13:21:56.636046 IP 10.0.2.15.59594 > 142.250.80.110.443: Flags [.], ack 402796, win 65535, length 0
13:21:56.637434 IP 142.250.80.110.443 > 10.0.2.15.59594: Flags [.], seq 402796:405716, ack 822, win 65535, length 2920
13:21:56.637457 IP 10.0.2.15.59594 > 142.250.80.110.443: Flags [.], ack 405716, win 65535, length 0
13:21:56.637933 IP 142.250.80.110.443 > 10.0.2.15.59594: Flags [.], seq 405716:407176, ack 822, win 65535, length 1460
13:21:56.637952 IP 10.0.2.15.59594 > 142.250.80.110.443: Flags [.], ack 407176, win 65535, length 0
13:21:56.638114 IP 142.250.80.110.443 > 10.0.2.15.59594: Flags [.], seq 407176:408636, ack 822, win 65535, length 1460
13:21:56.638122 IP 10.0.2.15.59594 > 142.250.80.110.443: Flags [.], ack 408636, win 65535, length 0
13:21:56.638248 IP 142.250.80.110.443 > 10.0.2.15.59594: Flags [.], seq 408636:413016, ack 822, win 65535, length 4380
13:21:56.638255 IP 10.0.2.15.59594 > 142.250.80.110.443: Flags [.], ack 413016, win 65535, length 0
13:21:56.638764 IP 142.250.80.110.443 > 10.0.2.15.59594: Flags [P.], seq 413016:434916, ack 822, win 65535, length 21900
13:21:56.638782 IP 10.0.2.15.59594 > 142.250.80.110.443: Flags [.], ack 434916, win 65535, length 0
13:21:56.639106 IP 142.250.80.110.443 > 10.0.2.15.59594: Flags [P.], seq 434916:468496, ack 822, win 65535, length 33580
13:21:56.639117 IP 10.0.2.15.59594 > 142.250.80.110.443: Flags [.], ack 468496, win 65535, length 0
13:21:56.639776 IP 142.250.80.110.443 > 10.0.2.15.59594: Flags [.], seq 468496:478716, ack 822, win 65535, length 10220
13:21:56.639789 IP 10.0.2.15.59594 > 142.250.80.110.443: Flags [.], ack 478716, win 65535, length 0
13:21:56.639972 IP 142.250.80.110.443 > 10.0.2.15.59594: Flags [.], seq 478716:483096, ack 822, win 65535, length 4380
13:21:56.639980 IP 10.0.2.15.59594 > 142.250.80.110.443: Flags [.], ack 483096, win 65535, length 0
13:21:56.640294 IP 142.250.80.110.443 > 10.0.2.15.59594: Flags [.], seq 483096:486016, ack 822, win 65535, length 2920
13:21:56.640306 IP 10.0.2.15.59594 > 142.250.80.110.443: Flags [.], ack 486016, win 65535, length 0
13:21:56.640499 IP 142.250.80.110.443 > 10.0.2.15.59594: Flags [.], seq 486016:488936, ack 822, win 65535, length 2920
13:21:56.640507 IP 10.0.2.15.59594 > 142.250.80.110.443: Flags [.], ack 488936, win 65535, length 0
13:21:56.640732 IP 142.250.80.110.443 > 10.0.2.15.59594: Flags [.], seq 488936:490396, ack 822, win 65535, length 1460
13:21:56.640741 IP 10.0.2.15.59594 > 142.250.80.110.443: Flags [.], ack 490396, win 65535, length 0

