13:22:05.007107 IP 142.250.72.110.443 > 10.0.2.15.54436: Flags [S.], seq 93312001, ack 2042388859, win 65535, options [mss 1460], length 0
13:22:05.007149 IP 10.0.2.15.54436 > 142.250.72.110.443: Flags [.], ack 1, win 64240, length 0
13:22:05.016855 IP 10.0.2.15.54436 > 142.250.72.110.443: Flags [P.], seq 1:518, ack 1, win 64240, length 517
13:22:05.017697 IP 142.250.72.110.443 > 10.0.2.15.54436: Flags [.], ack 518, win 65535, length 0
13:22:05.040525 IP 142.250.72.110.443 > 10.0.2.15.54436: Flags [.], seq 1:2921, ack 518, win 65535, length 2920
13:22:05.040563 IP 10.0.2.15.54436 > 142.250.72.110.443: Flags [.], ack 2921, win 62780, length 0
13:22:05.040995 IP 142.250.72.110.443 > 10.0.2.15.54436: Flags [P.], seq 2921:6651, ack 518, win 65535, length 3730
13:22:05.041028 IP 10.0.2.15.54436 > 142.250.72.110.443: Flags [.], ack 6651, win 59050, length 0
13:22:05.043778 IP 10.0.2.15.54436 > 142.250.72.110.443: Flags [P.], seq 518:598, ack 6651, win 62780, length 80
13:22:05.044180 IP 142.250.72.110.443 > 10.0.2.15.54436: Flags [.], ack 598, win 65535, length 0
13:22:05.044242 IP 10.0.2.15.54436 > 142.250.72.110.443: Flags [P.], seq 598:644, ack 6651, win 62780, length 46
13:22:05.044270 IP 10.0.2.15.54436 > 142.250.72.110.443: Flags [P.], seq 644:693, ack 6651, win 62780, length 49
13:22:05.044376 IP 10.0.2.15.54436 > 142.250.72.110.443: Flags [P.], seq 693:728, ack 6651, win 62780, length 35
13:22:05.044453 IP 142.250.72.110.443 > 10.0.2.15.54436: Flags [.], ack 644, win 65535, length 0
13:22:05.044499 IP 10.0.2.15.54436 > 142.250.72.110.443: Flags [P.], seq 728:791, ack 6651, win 62780, length 63
13:22:05.044638 IP 142.250.72.110.443 > 10.0.2.15.54436: Flags [.], ack 693, win 65535, length 0
13:22:05.044639 IP 142.250.72.110.443 > 10.0.2.15.54436: Flags [.], ack 728, win 65535, length 0
13:22:05.044952 IP 142.250.72.110.443 > 10.0.2.15.54436: Flags [.], ack 791, win 65535, length 0
13:22:05.057323 IP 142.250.72.110.443 > 10.0.2.15.54436: Flags [P.], seq 6651:7324, ack 791, win 65535, length 673
13:22:05.057346 IP 10.0.2.15.54436 > 142.250.72.110.443: Flags [.], ack 7324, win 62780, length 0
13:22:05.057778 IP 10.0.2.15.54436 > 142.250.72.110.443: Flags [P.], seq 791:822, ack 7324, win 62780, length 31
13:22:05.058323 IP 142.250.72.110.443 > 10.0.2.15.54436: Flags [.], ack 822, win 65535, length 0
13:22:05.090277 IP 142.250.72.110.443 > 10.0.2.15.54436: Flags [P.], seq 7324:13862, ack 822, win 65535, length 6538
13:22:05.090297 IP 10.0.2.15.54436 > 142.250.72.110.443: Flags [.], ack 13862, win 59860, length 0
13:22:05.092800 IP 142.250.72.110.443 > 10.0.2.15.54436: Flags [P.], seq 13862:21307, ack 822, win 65535, length 7445
13:22:05.092819 IP 10.0.2.15.54436 > 142.250.72.110.443: Flags [.], ack 21307, win 59860, length 0
13:22:05.093084 IP 142.250.72.110.443 > 10.0.2.15.54436: Flags [P.], seq 21307:22681, ack 822, win 65535, length 1374
13:22:05.093097 IP 10.0.2.15.54436 > 142.250.72.110.443: Flags [.], ack 22681, win 58486, length 0
13:22:05.095431 IP 142.250.72.110.443 > 10.0.2.15.54436: Flags [P.], seq 22681:28177, ack 822, win 65535, length 5496
13:22:05.095451 IP 10.0.2.15.54436 > 142.250.72.110.443: Flags [.], ack 28177, win 61320, length 0
13:22:05.096149 IP 142.250.72.110.443 > 10.0.2.15.54436: Flags [P.], seq 28177:29551, ack 822, win 65535, length 1374
13:22:05.096171 IP 10.0.2.15.54436 > 142.250.72.110.443: Flags [.], ack 29551, win 62780, length 0
13:22:05.103430 IP 142.250.72.110.443 > 10.0.2.15.54436: Flags [P.], seq 29551:39169, ack 822, win 65535, length 9618
13:22:05.103450 IP 10.0.2.15.54436 > 142.250.72.110.443: Flags [.], ack 39169, win 58400, length 0
13:22:05.106204 IP 142.250.72.110.443 > 10.0.2.15.54436: Flags [P.], seq 39169:46039, ack 822, win 65535, length 6870
13:22:05.106222 IP 10.0.2.15.54436 > 142.250.72.110.443: Flags [.], ack 46039, win 59860, length 0
13:22:05.107455 IP 142.250.72.110.443 > 10.0.2.15.54436: Flags [P.], seq 46039:47413, ack 822, win 65535, length 1374
13:22:05.107522 IP 10.0.2.15.54436 > 142.250.72.110.443: Flags [.], ack 47413, win 62780, length 0
13:22:05.110166 IP 142.250.72.110.443 > 10.0.2.15.54436: Flags [P.], seq 47413:55657, ack 822, win 65535, length 8244
13:22:05.110240 IP 10.0.2.15.54436 > 142.250.72.110.443: Flags [.], ack 55657, win 58400, length 0
13:22:05.113488 IP 142.250.72.110.443 > 10.0.2.15.54436: Flags [P.], seq 55657:59779, ack 822, win 65535, length 4122
13:22:05.113510 IP 10.0.2.15.54436 > 142.250.72.110.443: Flags [.], ack 59779, win 61320, length 0
13:22:05.114303 IP 142.250.72.110.443 > 10.0.2.15.54436: Flags [P.], seq 59779:66649, ack 822, win 65535, length 6870
13:22:05.114360 IP 10.0.2.15.54436 > 142.250.72.110.443: Flags [.], ack 66649, win 59860, length 0
13:22:05.119108 IP 142.250.72.110.443 > 10.0.2.15.54436: Flags [P.], seq 66649:84511, ack 822, win 65535, length 17862
13:22:05.119245 IP 10.0.2.15.54436 > 142.250.72.110.443: Flags [.], ack 84511, win 62780, length 0
13:22:05.120752 IP 142.250.72.110.443 > 10.0.2.15.54436: Flags [P.], seq 84511:85885, ack 822, win 65535, length 1374
13:22:05.120774 IP 10.0.2.15.54436 > 142.250.72.110.443: Flags [.], ack 85885, win 65535, length 0
13:22:05.121452 IP 142.250.72.110.443 > 10.0.2.15.54436: Flags [P.], seq 85885:96877, ack 822, win 65535, length 10992
13:22:05.121467 IP 10.0.2.15.54436 > 142.250.72.110.443: Flags [.], ack 96877, win 65535, length 0
13:22:05.123037 IP 142.250.72.110.443 > 10.0.2.15.54436: Flags [P.], seq 96877:111991, ack 822, win 65535, length 15114
13:22:05.123055 IP 10.0.2.15.54436 > 142.250.72.110.443: Flags [.], ack 111991, win 65535, length 0
13:22:05.123315 IP 142.250.72.110.443 > 10.0.2.15.54436: Flags [P.], seq 111991:113365, ack 822, win 65535, length 1374
13:22:05.123337 IP 10.0.2.15.54436 > 142.250.72.110.443: Flags [.], ack 113365, win 65535, length 0
13:22:05.128152 IP 142.250.72.110.443 > 10.0.2.15.54436: Flags [P.], seq 113365:129853, ack 822, win 65535, length 16488
13:22:05.128177 IP 10.0.2.15.54436 > 142.250.72.110.443: Flags [.], ack 129853, win 65535, length 0
13:22:05.129250 IP 142.250.72.110.443 > 10.0.2.15.54436: Flags [P.], seq 129853:144967, ack 822, win 65535, length 15114
13:22:05.129267 IP 10.0.2.15.54436 > 142.250.72.110.443: Flags [.], ack 144967, win 65535, length 0
13:22:05.131508 IP 142.250.72.110.443 > 10.0.2.15.54436: Flags [P.], seq 144967:151837, ack 822, win 65535, length 6870
13:22:05.131529 IP 10.0.2.15.54436 > 142.250.72.110.443: Flags [.], ack 151837, win 65535, length 0
13:22:05.132088 IP 142.250.72.110.443 > 10.0.2.15.54436: Flags [P.], seq 151837:157333, ack 822, win 65535, length 5496
13:22:05.132124 IP 10.0.2.15.54436 > 142.250.72.110.443: Flags [.], ack 157333, win 65535, length 0
13:22:05.132693 IP 142.250.72.110.443 > 10.0.2.15.54436: Flags [P.], seq 157333:164203, ack 822, win 65535, length 6870
13:22:05.132707 IP 10.0.2.15.54436 > 142.250.72.110.443: Flags [.], ack 164203, win 65535, length 0
13:22:05.134933 IP 142.250.72.110.443 > 10.0.2.15.54436: Flags [P.], seq 164203:175195, ack 822, win 65535, length 10992
13:22:05.134948 IP 10.0.2.15.54436 > 142.250.72.110.443: Flags [.], ack 175195, win 65535, length 0
13:22:05.135336 IP 142.250.72.110.443 > 10.0.2.15.54436: Flags [P.], seq 175195:183439, ack 822, win 65535, length 8244
13:22:05.135351 IP 10.0.2.15.54436 > 142.250.72.110.443: Flags [.], ack 183439, win 65535, length 0
13:22:05.135788 IP 142.250.72.110.443 > 10.0.2.15.54436: Flags [P.], seq 183439:186187, ack 822, win 65535, length 2748
13:22:05.135801 IP 10.0.2.15.54436 > 142.250.72.110.443: Flags [.], ack 186187, win 65535, length 0
13:22:05.138303 IP 142.250.72.110.443 > 10.0.2.15.54436: Flags [P.], seq 186187:198553, ack 822, win 65535, length 12366
13:22:05.138415 IP 10.0.2.15.54436 > 142.250.72.110.443: Flags [.], ack 198553, win 65535, length 0
13:22:05.138655 IP 142.250.72.110.443 > 10.0.2.15.54436: Flags [P.], seq 198553:206797, ack 822, win 65535, length 8244
13:22:05.138672 IP 10.0.2.15.54436 > 142.250.72.110.443: Flags [.], ack 206797, win 65535, length 0
13:22:05.139023 IP 142.250.72.110.443 > 10.0.2.15.54436: Flags [P.], seq 206797:210919, ack 822, win 65535, length 4122
13:22:05.139037 IP 10.0.2.15.54436 > 142.250.72.110.443: Flags [.], ack 210919, win 65535, length 0
13:22:05.140207 IP 142.250.72.110.443 > 10.0.2.15.54436: Flags [P.], seq 210919:215041, ack 822, win 65535, length 4122
13:22:05.140233 IP 10.0.2.15.54436 > 142.250.72.110.443: Flags [.], ack 215041, win 65535, length 0
13:22:05.142052 IP 142.250.72.110.443 > 10.0.2.15.54436: Flags [P.], seq 215041:215539, ack 822, win 65535, length 498
13:22:05.142072 IP 10.0.2.15.54436 > 142.250.72.110.443: Flags [.], ack 215539, win 65535, length 0
13:22:05.253010 IP 142.250.72.110.443 > 10.0.2.15.54436: Flags [P.], seq 215539:215732, ack 822, win 65535, length 193
13:22:05.253033 IP 10.0.2.15.54436 > 142.250.72.110.443: Flags [.], ack 215732, win 65535, length 0
13:22:05.266373 IP 142.250.72.110.443 > 10.0.2.15.54436: Flags [P.], seq 215732:226724, ack 822, win 65535, length 10992
13:22:05.266409 IP 10.0.2.15.54436 > 142.250.72.110.443: Flags [.], ack 226724, win 65535, length 0
13:22:05.266713 IP 142.250.72.110.443 > 10.0.2.15.54436: Flags [P.], seq 226724:230846, ack 822, win 65535, length 4122
13:22:05.266728 IP 10.0.2.15.54436 > 142.250.72.110.443: Flags [.], ack 230846, win 65535, length 0
13:22:05.270266 IP 142.250.72.110.443 > 10.0.2.15.54436: Flags [P.], seq 230846:243212, ack 822, win 65535, length 12366
13:22:05.270300 IP 10.0.2.15.54436 > 142.250.72.110.443: Flags [.], ack 243212, win 65535, length 0
13:22:05.270653 IP 142.250.72.110.443 > 10.0.2.15.54436: Flags [P.], seq 243212:259700, ack 822, win 65535, length 16488
13:22:05.270670 IP 10.0.2.15.54436 > 142.250.72.110.443: Flags [.], ack 259700, win 65535, length 0
13:22:05.271245 IP 142.250.72.110.443 > 10.0.2.15.54436: Flags [P.], seq 259700:269318, ack 822, win 65535, length 9618
13:22:05.271264 IP 10.0.2.15.54436 > 142.250.72.110.443: Flags [.], ack 269318, win 65535, length 0
13:22:05.271562 IP 142.250.72.110.443 > 10.0.2.15.54436: Flags [P.], seq 269318:273440, ack 822, win 65535, length 4122
13:22:05.271574 IP 10.0.2.15.54436 > 142.250.72.110.443: Flags [.], ack 273440, win 65535, length 0
13:22:05.272832 IP 142.250.72.110.443 > 10.0.2.15.54436: Flags [P.], seq 273440:289928, ack 822, win 65535, length 16488
13:22:05.272857 IP 10.0.2.15.54436 > 142.250.72.110.443: Flags [.], ack 289928, win 65535, length 0
13:22:05.273255 IP 142.250.72.110.443 > 10.0.2.15.54436: Flags [P.], seq 289928:296798, ack 822, win 65535, length 6870
13:22:05.273271 IP 10.0.2.15.54436 > 142.250.72.110.443: Flags [.], ack 296798, win 65535, length 0
13:22:05.273660 IP 142.250.72.110.443 > 10.0.2.15.54436: Flags [P.], seq 296798:305042, ack 822, win 65535, length 8244
13:22:05.273676 IP 10.0.2.15.54436 > 142.250.72.110.443: Flags [.], ack 305042, win 65535, length 0
13:22:05.274219 IP 142.250.72.110.443 > 10.0.2.15.54436: Flags [P.], seq 305042:309164, ack 822, win 65535, length 4122
13:22:05.274237 IP 10.0.2.15.54436 > 142.250.72.110.443: Flags [.], ack 309164, win 65535, length 0
13:22:05.274512 IP 142.250.72.110.443 > 10.0.2.15.54436: Flags [.], seq 309164:315004, ack 822, win 65535, length 5840
13:22:05.274530 IP 10.0.2.15.54436 > 142.250.72.110.443: Flags [.], ack 315004, win 65535, length 0
13:22:05.274808 IP 142.250.72.110.443 > 10.0.2.15.54436: Flags [P.], seq 315004:321530, ack 822, win 65535, length 6526
13:22:05.274822 IP 10.0.2.15.54436 > 142.250.72.110.443: Flags [.], ack 321530, win 65535, length 0
13:22:05.274961 IP 142.250.72.110.443 > 10.0.2.15.54436: Flags [P.], seq 321530:329774, ack 822, win 65535, length 8244
13:22:05.274971 IP 10.0.2.15.54436 > 142.250.72.110.443: Flags [.], ack 329774, win 65535, length 0
13:22:05.275466 IP 142.250.72.110.443 > 10.0.2.15.54436: Flags [P.], seq 329774:336644, ack 822, win 65535, length 6870
13:22:05.275482 IP 10.0.2.15.54436 > 142.250.72.110.443: Flags [.], ack 336644, win 65535, length 0
13:22:05.275870 IP 142.250.72.110.443 > 10.0.2.15.54436: Flags [P.], seq 336644:344888, ack 822, win 65535, length 8244
13:22:05.275884 IP 10.0.2.15.54436 > 142.250.72.110.443: Flags [.], ack 344888, win 65535, length 0
13:22:05.280949 IP 142.250.72.110.443 > 10.0.2.15.54436: Flags [P.], seq 344888:360002, ack 822, win 65535, length 15114
13:22:05.280966 IP 10.0.2.15.54436 > 142.250.72.110.443: Flags [.], ack 360002, win 65535, length 0
13:22:05.281004 IP 142.250.72.110.443 > 10.0.2.15.54436: Flags [P.], seq 360002:366872, ack 822, win 65535, length 6870
13:22:05.281008 IP 10.0.2.15.54436 > 142.250.72.110.443: Flags [.], ack 366872, win 65535, length 0
13:22:05.281472 IP 142.250.72.110.443 > 10.0.2.15.54436: Flags [P.], seq 366872:377864, ack 822, win 65535, length 10992
13:22:05.281486 IP 10.0.2.15.54436 > 142.250.72.110.443: Flags [.], ack 377864, win 65535, length 0
13:22:05.281876 IP 142.250.72.110.443 > 10.0.2.15.54436: Flags [P.], seq 377864:380612, ack 822, win 65535, length 2748
13:22:05.281888 IP 10.0.2.15.54436 > 142.250.72.110.443: Flags [.], ack 380612, win 65535, length 0
13:22:05.282863 IP 142.250.72.110.443 > 10.0.2.15.54436: Flags [P.], seq 380612:387482, ack 822, win 65535, length 6870
13:22:05.282883 IP 10.0.2.15.54436 > 142.250.72.110.443: Flags [.], ack 387482, win 65535, length 0
13:22:05.283122 IP 142.250.72.110.443 > 10.0.2.15.54436: Flags [P.], seq 387482:397100, ack 822, win 65535, length 9618
13:22:05.283133 IP 10.0.2.15.54436 > 142.250.72.110.443: Flags [.], ack 397100, win 65535, length 0
13:22:05.283402 IP 142.250.72.110.443 > 10.0.2.15.54436: Flags [.], seq 397100:404400, ack 822, win 65535, length 7300
13:22:05.283414 IP 10.0.2.15.54436 > 142.250.72.110.443: Flags [.], ack 404400, win 65535, length 0
13:22:05.283532 IP 142.250.72.110.443 > 10.0.2.15.54436: Flags [P.], seq 404400:406718, ack 822, win 65535, length 2318
13:22:05.283537 IP 10.0.2.15.54436 > 142.250.72.110.443: Flags [.], ack 406718, win 65535, length 0
13:22:05.283808 IP 142.250.72.110.443 > 10.0.2.15.54436: Flags [.], seq 406718:409638, ack 822, win 65535, length 2920
13:22:05.283819 IP 10.0.2.15.54436 > 142.250.72.110.443: Flags [.], ack 409638, win 65535, length 0
13:22:05.283925 IP 142.250.72.110.443 > 10.0.2.15.54436: Flags [P.], seq 409638:416336, ack 822, win 65535, length 6698
13:22:05.283930 IP 10.0.2.15.54436 > 142.250.72.110.443: Flags [.], ack 416336, win 65535, length 0
13:22:05.288067 IP 142.250.72.110.443 > 10.0.2.15.54436: Flags [P.], seq 416336:428702, ack 822, win 65535, length 12366
13:22:05.288140 IP 10.0.2.15.54436 > 142.250.72.110.443: Flags [.], ack 428702, win 65535, length 0
13:22:05.288250 IP 142.250.72.110.443 > 10.0.2.15.54436: Flags [P.], seq 428702:434198, ack 822, win 65535, length 5496
13:22:05.288261 IP 10.0.2.15.54436 > 142.250.72.110.443: Flags [.], ack 434198, win 65535, length 0
13:22:05.288652 IP 142.250.72.110.443 > 10.0.2.15.54436: Flags [P.], seq 434198:438320, ack 822, win 65535, length 4122
13:22:05.288705 IP 10.0.2.15.54436 > 142.250.72.110.443: Flags [.], ack 438320, win 65535, length 0
13:22:05.303013 IP 142.250.72.110.443 > 10.0.2.15.54436: Flags [P.], seq 438320:449312, ack 822, win 65535, length 10992
13:22:05.303031 IP 10.0.2.15.54436 > 142.250.72.110.443: Flags [.], ack 449312, win 65535, length 0
13:22:05.303357 IP 142.250.72.110.443 > 10.0.2.15.54436: Flags [P.], seq 449312:457556, ack 822, win 65535, length 8244
13:22:05.303367 IP 10.0.2.15.54436 > 142.250.72.110.443: Flags [.], ack 457556, win 65535, length 0
13:22:05.303658 IP 142.250.72.110.443 > 10.0.2.15.54436: Flags [P.], seq 457556:465800, ack 822, win 65535, length 8244
13:22:05.303672 IP 10.0.2.15.54436 > 142.250.72.110.443: Flags [.], ack 465800, win 65535, length 0
13:22:05.304104 IP 142.250.72.110.443 > 10.0.2.15.54436: Flags [P.], seq 465800:474044, ack 822, win 65535, length 8244
13:22:05.304126 IP 10.0.2.15.54436 > 142.250.72.110.443: Flags [.], ack 474044, win 65535, length 0
13:22:05.306868 IP 142.250.72.110.443 > 10.0.2.15.54436: Flags [P.], seq 474044:490532, ack 822, win 65535, length 16488
13:22:05.306894 IP 10.0.2.15.54436 > 142.250.72.110.443: Flags [.], ack 490532, win 65535, length 0

