20:13:17.101233 IP 10.0.2.15.53740 > 140.233.253.2.53: 24377+ A? www.youtube.com. (33)
20:13:17.101278 IP 10.0.2.15.53740 > 140.233.253.2.53: 10815+ AAAA? www.youtube.com. (33)
20:13:17.107605 IP 140.233.253.2.53 > 10.0.2.15.53740: 10815 5/0/0 CNAME youtube-ui.l.google.com., AAAA 2607:f8b0:4006:822::200e, AAAA 2607:f8b0:4006:823::200e, AAAA 2607:f8b0:4006:81d::200e, AAAA 2607:f8b0:4006:81e::200e (179)
20:13:17.107607 IP 140.233.253.2.53 > 10.0.2.15.53740: 24377 17/0/0 CNAME youtube-ui.l.google.com., A 142.250.65.206, A 142.251.32.110, A 142.251.35.174, A 142.251.40.206, A 142.251.40.238, A 142.251.41.14, A 142.250.176.206, A 142.250.64.78, A 142.250.64.110, A 142.250.72.110, A 142.250.80.14, A 142.250.80.46, A 142.250.80.78, A 142.250.80.110, A 172.217.165.142, A 142.250.65.174 (323)
20:13:17.108068 IP 10.0.2.15.45048 > 142.250.65.206.443: Flags [S], seq 4119915977, win 64240, options [mss 1460,sackOK,TS val 3507606535 ecr 0,nop,wscale 6], length 0
20:13:17.123735 IP 142.250.65.206.443 > 10.0.2.15.45048: Flags [S.], seq 239488001, ack 4119915978, win 65535, options [mss 1460], length 0
20:13:17.123774 IP 10.0.2.15.45048 > 142.250.65.206.443: Flags [.], ack 1, win 64240, length 0
20:13:17.137907 IP 10.0.2.15.45048 > 142.250.65.206.443: Flags [P.], seq 1:518, ack 1, win 64240, length 517
20:13:17.138325 IP 142.250.65.206.443 > 10.0.2.15.45048: Flags [.], ack 518, win 65535, length 0
20:13:17.163702 IP 142.250.65.206.443 > 10.0.2.15.45048: Flags [.], seq 1:2921, ack 518, win 65535, length 2920
20:13:17.163728 IP 10.0.2.15.45048 > 142.250.65.206.443: Flags [.], ack 2921, win 62780, length 0
20:13:17.164104 IP 142.250.65.206.443 > 10.0.2.15.45048: Flags [P.], seq 2921:6650, ack 518, win 65535, length 3729
20:13:17.164123 IP 10.0.2.15.45048 > 142.250.65.206.443: Flags [.], ack 6650, win 59860, length 0
20:13:17.165921 IP 10.0.2.15.45048 > 142.250.65.206.443: Flags [P.], seq 518:598, ack 6650, win 62780, length 80
20:13:17.166553 IP 142.250.65.206.443 > 10.0.2.15.45048: Flags [.], ack 598, win 65535, length 0
20:13:17.166881 IP 10.0.2.15.45048 > 142.250.65.206.443: Flags [P.], seq 598:644, ack 6650, win 62780, length 46
20:13:17.166915 IP 10.0.2.15.45048 > 142.250.65.206.443: Flags [P.], seq 644:693, ack 6650, win 62780, length 49
20:13:17.167043 IP 10.0.2.15.45048 > 142.250.65.206.443: Flags [P.], seq 693:728, ack 6650, win 62780, length 35
20:13:17.167294 IP 142.250.65.206.443 > 10.0.2.15.45048: Flags [.], ack 644, win 65535, length 0
20:13:17.167295 IP 142.250.65.206.443 > 10.0.2.15.45048: Flags [.], ack 693, win 65535, length 0
20:13:17.167295 IP 142.250.65.206.443 > 10.0.2.15.45048: Flags [.], ack 728, win 65535, length 0
20:13:17.167359 IP 10.0.2.15.45048 > 142.250.65.206.443: Flags [P.], seq 728:791, ack 6650, win 62780, length 63
20:13:17.167671 IP 142.250.65.206.443 > 10.0.2.15.45048: Flags [.], ack 791, win 65535, length 0
20:13:17.179952 IP 142.250.65.206.443 > 10.0.2.15.45048: Flags [P.], seq 6650:7323, ack 791, win 65535, length 673
20:13:17.179975 IP 10.0.2.15.45048 > 142.250.65.206.443: Flags [.], ack 7323, win 62780, length 0
20:13:17.180491 IP 10.0.2.15.45048 > 142.250.65.206.443: Flags [P.], seq 791:822, ack 7323, win 62780, length 31
20:13:17.180750 IP 142.250.65.206.443 > 10.0.2.15.45048: Flags [.], ack 822, win 65535, length 0
20:13:17.216345 IP 142.250.65.206.443 > 10.0.2.15.45048: Flags [P.], seq 7323:11113, ack 822, win 65535, length 3790
20:13:17.216364 IP 10.0.2.15.45048 > 142.250.65.206.443: Flags [.], ack 11113, win 61320, length 0
20:13:17.217036 IP 142.250.65.206.443 > 10.0.2.15.45048: Flags [P.], seq 11113:15235, ack 822, win 65535, length 4122
20:13:17.217053 IP 10.0.2.15.45048 > 142.250.65.206.443: Flags [.], ack 15235, win 58400, length 0
20:13:17.218736 IP 142.250.65.206.443 > 10.0.2.15.45048: Flags [P.], seq 15235:16609, ack 822, win 65535, length 1374
20:13:17.218757 IP 10.0.2.15.45048 > 142.250.65.206.443: Flags [.], ack 16609, win 62780, length 0
20:13:17.218934 IP 142.250.65.206.443 > 10.0.2.15.45048: Flags [P.], seq 16609:20097, ack 822, win 65535, length 3488
20:13:17.218942 IP 10.0.2.15.45048 > 142.250.65.206.443: Flags [.], ack 20097, win 61320, length 0
20:13:17.220366 IP 142.250.65.206.443 > 10.0.2.15.45048: Flags [P.], seq 20097:24219, ack 822, win 65535, length 4122
20:13:17.220382 IP 10.0.2.15.45048 > 142.250.65.206.443: Flags [.], ack 24219, win 61320, length 0
20:13:17.221217 IP 142.250.65.206.443 > 10.0.2.15.45048: Flags [P.], seq 24219:25593, ack 822, win 65535, length 1374
20:13:17.221238 IP 10.0.2.15.45048 > 142.250.65.206.443: Flags [.], ack 25593, win 62780, length 0
20:13:17.222802 IP 142.250.65.206.443 > 10.0.2.15.45048: Flags [P.], seq 25593:26967, ack 822, win 65535, length 1374
20:13:17.222822 IP 10.0.2.15.45048 > 142.250.65.206.443: Flags [.], ack 26967, win 62780, length 0
20:13:17.226951 IP 142.250.65.206.443 > 10.0.2.15.45048: Flags [P.], seq 26967:29715, ack 822, win 65535, length 2748
20:13:17.226970 IP 10.0.2.15.45048 > 142.250.65.206.443: Flags [.], ack 29715, win 62780, length 0
20:13:17.227527 IP 142.250.65.206.443 > 10.0.2.15.45048: Flags [P.], seq 29715:31089, ack 822, win 65535, length 1374
20:13:17.227630 IP 10.0.2.15.45048 > 142.250.65.206.443: Flags [.], ack 31089, win 62780, length 0
20:13:17.228957 IP 142.250.65.206.443 > 10.0.2.15.45048: Flags [P.], seq 31089:33837, ack 822, win 65535, length 2748
20:13:17.228976 IP 10.0.2.15.45048 > 142.250.65.206.443: Flags [.], ack 33837, win 62780, length 0
20:13:17.229869 IP 142.250.65.206.443 > 10.0.2.15.45048: Flags [P.], seq 33837:37959, ack 822, win 65535, length 4122
20:13:17.230177 IP 10.0.2.15.45048 > 142.250.65.206.443: Flags [.], ack 37959, win 61320, length 0
20:13:17.230899 IP 142.250.65.206.443 > 10.0.2.15.45048: Flags [P.], seq 37959:39333, ack 822, win 65535, length 1374
20:13:17.230966 IP 10.0.2.15.45048 > 142.250.65.206.443: Flags [.], ack 39333, win 62780, length 0
20:13:17.232379 IP 142.250.65.206.443 > 10.0.2.15.45048: Flags [P.], seq 39333:43455, ack 822, win 65535, length 4122
20:13:17.232457 IP 10.0.2.15.45048 > 142.250.65.206.443: Flags [.], ack 43455, win 61320, length 0
20:13:17.232851 IP 142.250.65.206.443 > 10.0.2.15.45048: Flags [P.], seq 43455:44829, ack 822, win 65535, length 1374
20:13:17.232900 IP 10.0.2.15.45048 > 142.250.65.206.443: Flags [.], ack 44829, win 62780, length 0
20:13:17.234233 IP 142.250.65.206.443 > 10.0.2.15.45048: Flags [P.], seq 44829:48951, ack 822, win 65535, length 4122
20:13:17.234497 IP 10.0.2.15.45048 > 142.250.65.206.443: Flags [.], ack 48951, win 61320, length 0
20:13:17.235029 IP 142.250.65.206.443 > 10.0.2.15.45048: Flags [P.], seq 48951:50325, ack 822, win 65535, length 1374
20:13:17.235087 IP 10.0.2.15.45048 > 142.250.65.206.443: Flags [.], ack 50325, win 62780, length 0
20:13:17.236523 IP 142.250.65.206.443 > 10.0.2.15.45048: Flags [P.], seq 50325:55821, ack 822, win 65535, length 5496
20:13:17.236579 IP 10.0.2.15.45048 > 142.250.65.206.443: Flags [.], ack 55821, win 61320, length 0
20:13:17.237144 IP 142.250.65.206.443 > 10.0.2.15.45048: Flags [P.], seq 55821:58569, ack 822, win 65535, length 2748
20:13:17.237157 IP 10.0.2.15.45048 > 142.250.65.206.443: Flags [.], ack 58569, win 62780, length 0
20:13:17.238378 IP 142.250.65.206.443 > 10.0.2.15.45048: Flags [P.], seq 58569:61317, ack 822, win 65535, length 2748
20:13:17.238390 IP 10.0.2.15.45048 > 142.250.65.206.443: Flags [.], ack 61317, win 62780, length 0
20:13:17.239461 IP 142.250.65.206.443 > 10.0.2.15.45048: Flags [P.], seq 61317:64065, ack 822, win 65535, length 2748
20:13:17.239474 IP 10.0.2.15.45048 > 142.250.65.206.443: Flags [.], ack 64065, win 62780, length 0
20:13:17.240527 IP 142.250.65.206.443 > 10.0.2.15.45048: Flags [P.], seq 64065:66813, ack 822, win 65535, length 2748
20:13:17.240540 IP 10.0.2.15.45048 > 142.250.65.206.443: Flags [.], ack 66813, win 62780, length 0
20:13:17.241522 IP 142.250.65.206.443 > 10.0.2.15.45048: Flags [P.], seq 66813:72309, ack 822, win 65535, length 5496
20:13:17.241587 IP 10.0.2.15.45048 > 142.250.65.206.443: Flags [.], ack 72309, win 62780, length 0
20:13:17.243222 IP 142.250.65.206.443 > 10.0.2.15.45048: Flags [.], seq 72309:73769, ack 822, win 65535, length 1460
20:13:17.243245 IP 10.0.2.15.45048 > 142.250.65.206.443: Flags [.], ack 73769, win 65535, length 0
20:13:17.243484 IP 142.250.65.206.443 > 10.0.2.15.45048: Flags [P.], seq 73769:76431, ack 822, win 65535, length 2662
20:13:17.243496 IP 10.0.2.15.45048 > 142.250.65.206.443: Flags [.], ack 76431, win 65535, length 0
20:13:17.243840 IP 142.250.65.206.443 > 10.0.2.15.45048: Flags [P.], seq 76431:81927, ack 822, win 65535, length 5496
20:13:17.243855 IP 10.0.2.15.45048 > 142.250.65.206.443: Flags [.], ack 81927, win 65535, length 0
20:13:17.244961 IP 142.250.65.206.443 > 10.0.2.15.45048: Flags [P.], seq 81927:90171, ack 822, win 65535, length 8244
20:13:17.244976 IP 10.0.2.15.45048 > 142.250.65.206.443: Flags [.], ack 90171, win 65535, length 0
20:13:17.245943 IP 142.250.65.206.443 > 10.0.2.15.45048: Flags [P.], seq 90171:95667, ack 822, win 65535, length 5496
20:13:17.245954 IP 10.0.2.15.45048 > 142.250.65.206.443: Flags [.], ack 95667, win 65535, length 0
20:13:17.247051 IP 142.250.65.206.443 > 10.0.2.15.45048: Flags [P.], seq 95667:101163, ack 822, win 65535, length 5496
20:13:17.247067 IP 10.0.2.15.45048 > 142.250.65.206.443: Flags [.], ack 101163, win 65535, length 0
20:13:17.250143 IP 142.250.65.206.443 > 10.0.2.15.45048: Flags [P.], seq 101163:108033, ack 822, win 65535, length 6870
20:13:17.250145 IP 142.250.65.206.443 > 10.0.2.15.45048: Flags [P.], seq 108033:113529, ack 822, win 65535, length 5496
20:13:17.250167 IP 10.0.2.15.45048 > 142.250.65.206.443: Flags [.], ack 108033, win 65535, length 0
20:13:17.250205 IP 10.0.2.15.45048 > 142.250.65.206.443: Flags [.], ack 113529, win 65535, length 0
20:13:17.250241 IP 142.250.65.206.443 > 10.0.2.15.45048: Flags [P.], seq 113529:117651, ack 822, win 65535, length 4122
20:13:17.250252 IP 10.0.2.15.45048 > 142.250.65.206.443: Flags [.], ack 117651, win 65535, length 0
20:13:17.252719 IP 142.250.65.206.443 > 10.0.2.15.45048: Flags [P.], seq 117651:127269, ack 822, win 65535, length 9618
20:13:17.252722 IP 142.250.65.206.443 > 10.0.2.15.45048: Flags [P.], seq 127269:132765, ack 822, win 65535, length 5496
20:13:17.252743 IP 10.0.2.15.45048 > 142.250.65.206.443: Flags [.], ack 127269, win 65535, length 0
20:13:17.252783 IP 10.0.2.15.45048 > 142.250.65.206.443: Flags [.], ack 132765, win 65535, length 0
20:13:17.252814 IP 142.250.65.206.443 > 10.0.2.15.45048: Flags [P.], seq 132765:134139, ack 822, win 65535, length 1374
20:13:17.252820 IP 10.0.2.15.45048 > 142.250.65.206.443: Flags [.], ack 134139, win 65535, length 0
20:13:17.255137 IP 142.250.65.206.443 > 10.0.2.15.45048: Flags [P.], seq 134139:145131, ack 822, win 65535, length 10992
20:13:17.255158 IP 10.0.2.15.45048 > 142.250.65.206.443: Flags [.], ack 145131, win 65535, length 0
20:13:17.257743 IP 142.250.65.206.443 > 10.0.2.15.45048: Flags [P.], seq 145131:157497, ack 822, win 65535, length 12366
20:13:17.257769 IP 10.0.2.15.45048 > 142.250.65.206.443: Flags [.], ack 157497, win 65535, length 0
20:13:17.257827 IP 142.250.65.206.443 > 10.0.2.15.45048: Flags [P.], seq 157497:161619, ack 822, win 65535, length 4122
20:13:17.257829 IP 142.250.65.206.443 > 10.0.2.15.45048: Flags [P.], seq 161619:165741, ack 822, win 65535, length 4122
20:13:17.257839 IP 10.0.2.15.45048 > 142.250.65.206.443: Flags [.], ack 161619, win 65535, length 0
20:13:17.258010 IP 10.0.2.15.45048 > 142.250.65.206.443: Flags [.], ack 165741, win 65535, length 0
20:13:17.258929 IP 142.250.65.206.443 > 10.0.2.15.45048: Flags [P.], seq 165741:168489, ack 822, win 65535, length 2748
20:13:17.258931 IP 142.250.65.206.443 > 10.0.2.15.45048: Flags [P.], seq 168489:171237, ack 822, win 65535, length 2748
20:13:17.258949 IP 10.0.2.15.45048 > 142.250.65.206.443: Flags [.], ack 168489, win 65535, length 0
20:13:17.258972 IP 10.0.2.15.45048 > 142.250.65.206.443: Flags [.], ack 171237, win 65535, length 0
20:13:17.259495 IP 142.250.65.206.443 > 10.0.2.15.45048: Flags [P.], seq 171237:178107, ack 822, win 65535, length 6870
20:13:17.259516 IP 10.0.2.15.45048 > 142.250.65.206.443: Flags [.], ack 178107, win 65535, length 0
20:13:17.259768 IP 142.250.65.206.443 > 10.0.2.15.45048: Flags [P.], seq 178107:182229, ack 822, win 65535, length 4122
20:13:17.259778 IP 10.0.2.15.45048 > 142.250.65.206.443: Flags [.], ack 182229, win 65535, length 0
20:13:17.260072 IP 142.250.65.206.443 > 10.0.2.15.45048: Flags [P.], seq 182229:184977, ack 822, win 65535, length 2748
20:13:17.260074 IP 142.250.65.206.443 > 10.0.2.15.45048: Flags [P.], seq 184977:189099, ack 822, win 65535, length 4122
20:13:17.260129 IP 10.0.2.15.45048 > 142.250.65.206.443: Flags [.], ack 184977, win 65535, length 0
20:13:17.260153 IP 10.0.2.15.45048 > 142.250.65.206.443: Flags [.], ack 189099, win 65535, length 0
20:13:17.262318 IP 142.250.65.206.443 > 10.0.2.15.45048: Flags [P.], seq 189099:198717, ack 822, win 65535, length 9618
20:13:17.262321 IP 142.250.65.206.443 > 10.0.2.15.45048: Flags [.], seq 198717:201637, ack 822, win 65535, length 2920
20:13:17.262341 IP 10.0.2.15.45048 > 142.250.65.206.443: Flags [.], ack 198717, win 65535, length 0
20:13:17.262465 IP 10.0.2.15.45048 > 142.250.65.206.443: Flags [.], ack 201637, win 65535, length 0
20:13:17.262591 IP 142.250.65.206.443 > 10.0.2.15.45048: Flags [P.], seq 201637:206961, ack 822, win 65535, length 5324
20:13:17.262592 IP 142.250.65.206.443 > 10.0.2.15.45048: Flags [P.], seq 206961:209709, ack 822, win 65535, length 2748
20:13:17.262593 IP 142.250.65.206.443 > 10.0.2.15.45048: Flags [P.], seq 209709:212457, ack 822, win 65535, length 2748
20:13:17.262600 IP 10.0.2.15.45048 > 142.250.65.206.443: Flags [.], ack 206961, win 65535, length 0
20:13:17.262614 IP 10.0.2.15.45048 > 142.250.65.206.443: Flags [.], ack 209709, win 65535, length 0
20:13:17.262627 IP 10.0.2.15.45048 > 142.250.65.206.443: Flags [.], ack 212457, win 65535, length 0
20:13:17.262650 IP 142.250.65.206.443 > 10.0.2.15.45048: Flags [P.], seq 212457:213831, ack 822, win 65535, length 1374
20:13:17.262650 IP 142.250.65.206.443 > 10.0.2.15.45048: Flags [P.], seq 213831:216579, ack 822, win 65535, length 2748
20:13:17.262657 IP 10.0.2.15.45048 > 142.250.65.206.443: Flags [.], ack 213831, win 65535, length 0
20:13:17.262668 IP 10.0.2.15.45048 > 142.250.65.206.443: Flags [.], ack 216579, win 65535, length 0
20:13:17.263916 IP 142.250.65.206.443 > 10.0.2.15.45048: Flags [P.], seq 216579:222902, ack 822, win 65535, length 6323
20:13:17.263930 IP 10.0.2.15.45048 > 142.250.65.206.443: Flags [.], ack 222902, win 65535, length 0
20:13:17.377226 IP 142.250.65.206.443 > 10.0.2.15.45048: Flags [P.], seq 222902:223095, ack 822, win 65535, length 193
20:13:17.377250 IP 10.0.2.15.45048 > 142.250.65.206.443: Flags [.], ack 223095, win 65535, length 0
20:13:17.422688 IP 142.250.65.206.443 > 10.0.2.15.45048: Flags [P.], seq 223095:256071, ack 822, win 65535, length 32976
20:13:17.422719 IP 10.0.2.15.45048 > 142.250.65.206.443: Flags [.], ack 256071, win 65535, length 0
20:13:17.436226 IP 142.250.65.206.443 > 10.0.2.15.45048: Flags [.], seq 256071:269211, ack 822, win 65535, length 13140
20:13:17.436243 IP 10.0.2.15.45048 > 142.250.65.206.443: Flags [.], ack 269211, win 65535, length 0
20:13:17.448720 IP 142.250.65.206.443 > 10.0.2.15.45048: Flags [.], seq 269211:270671, ack 822, win 65535, length 1460
20:13:17.448741 IP 10.0.2.15.45048 > 142.250.65.206.443: Flags [.], ack 270671, win 65535, length 0
20:13:17.463896 IP 142.250.65.206.443 > 10.0.2.15.45048: Flags [.], seq 270671:272131, ack 822, win 65535, length 1460
20:13:17.463919 IP 10.0.2.15.45048 > 142.250.65.206.443: Flags [.], ack 272131, win 65535, length 0
20:13:17.472449 IP 142.250.65.206.443 > 10.0.2.15.45048: Flags [.], seq 272131:273591, ack 822, win 65535, length 1460
20:13:17.472476 IP 10.0.2.15.45048 > 142.250.65.206.443: Flags [.], ack 273591, win 65535, length 0
20:13:17.482538 IP 142.250.65.206.443 > 10.0.2.15.45048: Flags [.], seq 273591:275051, ack 822, win 65535, length 1460
20:13:17.482565 IP 10.0.2.15.45048 > 142.250.65.206.443: Flags [.], ack 275051, win 65535, length 0
20:13:17.487736 IP 142.250.65.206.443 > 10.0.2.15.45048: Flags [.], seq 275051:276511, ack 822, win 65535, length 1460
20:13:17.487759 IP 10.0.2.15.45048 > 142.250.65.206.443: Flags [.], ack 276511, win 65535, length 0
20:13:17.491067 IP 142.250.65.206.443 > 10.0.2.15.45048: Flags [.], seq 276511:277971, ack 822, win 65535, length 1460
20:13:17.491123 IP 10.0.2.15.45048 > 142.250.65.206.443: Flags [.], ack 277971, win 65535, length 0
20:13:17.496588 IP 142.250.65.206.443 > 10.0.2.15.45048: Flags [.], seq 277971:279431, ack 822, win 65535, length 1460
20:13:17.496795 IP 10.0.2.15.45048 > 142.250.65.206.443: Flags [.], ack 279431, win 65535, length 0
20:13:17.498045 IP 142.250.65.206.443 > 10.0.2.15.45048: Flags [.], seq 279431:280891, ack 822, win 65535, length 1460
20:13:17.498069 IP 10.0.2.15.45048 > 142.250.65.206.443: Flags [.], ack 280891, win 65535, length 0
20:13:17.498228 IP 142.250.65.206.443 > 10.0.2.15.45048: Flags [.], seq 280891:282351, ack 822, win 65535, length 1460
20:13:17.498240 IP 10.0.2.15.45048 > 142.250.65.206.443: Flags [.], ack 282351, win 65535, length 0
20:13:17.498416 IP 142.250.65.206.443 > 10.0.2.15.45048: Flags [.], seq 282351:291111, ack 822, win 65535, length 8760
20:13:17.498432 IP 10.0.2.15.45048 > 142.250.65.206.443: Flags [.], ack 291111, win 65535, length 0
20:13:17.502349 IP 142.250.65.206.443 > 10.0.2.15.45048: Flags [P.], seq 291111:321771, ack 822, win 65535, length 30660
20:13:17.502369 IP 10.0.2.15.45048 > 142.250.65.206.443: Flags [.], ack 321771, win 65535, length 0
20:13:17.502530 IP 142.250.65.206.443 > 10.0.2.15.45048: Flags [.], seq 321771:355351, ack 822, win 65535, length 33580
20:13:17.502549 IP 10.0.2.15.45048 > 142.250.65.206.443: Flags [.], ack 355351, win 65535, length 0
20:13:17.503598 IP 142.250.65.206.443 > 10.0.2.15.45048: Flags [P.], seq 355351:356811, ack 822, win 65535, length 1460
20:13:17.503622 IP 10.0.2.15.45048 > 142.250.65.206.443: Flags [.], ack 356811, win 65535, length 0
20:13:17.503802 IP 142.250.65.206.443 > 10.0.2.15.45048: Flags [.], seq 356811:375791, ack 822, win 65535, length 18980
20:13:17.503816 IP 10.0.2.15.45048 > 142.250.65.206.443: Flags [.], ack 375791, win 65535, length 0
20:13:17.504700 IP 142.250.65.206.443 > 10.0.2.15.45048: Flags [P.], seq 375791:421051, ack 822, win 65535, length 45260
20:13:17.504716 IP 10.0.2.15.45048 > 142.250.65.206.443: Flags [.], ack 421051, win 65535, length 0
20:13:17.506065 IP 142.250.65.206.443 > 10.0.2.15.45048: Flags [.], seq 421051:441491, ack 822, win 65535, length 20440
20:13:17.506087 IP 10.0.2.15.45048 > 142.250.65.206.443: Flags [.], ack 441491, win 65535, length 0
20:13:17.506916 IP 142.250.65.206.443 > 10.0.2.15.45048: Flags [.], seq 441491:477991, ack 822, win 65535, length 36500
20:13:17.506978 IP 10.0.2.15.45048 > 142.250.65.206.443: Flags [.], ack 477991, win 65535, length 0

