13:06:51.419538 IP 10.0.2.15.42338 > 142.250.81.238.443: Flags [P.], seq 194440751:194441268, ack 37952002, win 64240, length 517
13:06:51.420860 IP 142.250.81.238.443 > 10.0.2.15.42338: Flags [.], ack 517, win 65535, length 0
13:06:51.442370 IP 142.250.81.238.443 > 10.0.2.15.42338: Flags [.], seq 1:2921, ack 517, win 65535, length 2920
13:06:51.442394 IP 10.0.2.15.42338 > 142.250.81.238.443: Flags [.], ack 2921, win 62780, length 0
13:06:51.442856 IP 142.250.81.238.443 > 10.0.2.15.42338: Flags [P.], seq 2921:5497, ack 517, win 65535, length 2576
13:06:51.442873 IP 10.0.2.15.42338 > 142.250.81.238.443: Flags [.], ack 5497, win 61320, length 0
13:06:51.443777 IP 142.250.81.238.443 > 10.0.2.15.42338: Flags [P.], seq 5497:6650, ack 517, win 65535, length 1153
13:06:51.443792 IP 10.0.2.15.42338 > 142.250.81.238.443: Flags [.], ack 6650, win 62780, length 0
13:06:51.445212 IP 10.0.2.15.42338 > 142.250.81.238.443: Flags [P.], seq 517:597, ack 6650, win 62780, length 80
13:06:51.445834 IP 142.250.81.238.443 > 10.0.2.15.42338: Flags [.], ack 597, win 65535, length 0
13:06:51.446075 IP 10.0.2.15.42338 > 142.250.81.238.443: Flags [P.], seq 597:643, ack 6650, win 62780, length 46
13:06:51.446264 IP 10.0.2.15.42338 > 142.250.81.238.443: Flags [P.], seq 643:692, ack 6650, win 62780, length 49
13:06:51.446379 IP 142.250.81.238.443 > 10.0.2.15.42338: Flags [.], ack 643, win 65535, length 0
13:06:51.446390 IP 10.0.2.15.42338 > 142.250.81.238.443: Flags [P.], seq 692:727, ack 6650, win 62780, length 35
13:06:51.446424 IP 10.0.2.15.42338 > 142.250.81.238.443: Flags [P.], seq 727:790, ack 6650, win 62780, length 63
13:06:51.446817 IP 142.250.81.238.443 > 10.0.2.15.42338: Flags [.], ack 692, win 65535, length 0
13:06:51.446818 IP 142.250.81.238.443 > 10.0.2.15.42338: Flags [.], ack 727, win 65535, length 0
13:06:51.447048 IP 142.250.81.238.443 > 10.0.2.15.42338: Flags [.], ack 790, win 65535, length 0
13:06:51.459716 IP 142.250.81.238.443 > 10.0.2.15.42338: Flags [P.], seq 6650:7323, ack 790, win 65535, length 673
13:06:51.459792 IP 10.0.2.15.42338 > 142.250.81.238.443: Flags [.], ack 7323, win 62780, length 0
13:06:51.460446 IP 10.0.2.15.42338 > 142.250.81.238.443: Flags [P.], seq 790:821, ack 7323, win 62780, length 31
13:06:51.461098 IP 142.250.81.238.443 > 10.0.2.15.42338: Flags [.], ack 821, win 65535, length 0
13:06:51.495373 IP 142.250.81.238.443 > 10.0.2.15.42338: Flags [P.], seq 7323:11114, ack 821, win 65535, length 3791
13:06:51.495393 IP 10.0.2.15.42338 > 142.250.81.238.443: Flags [.], ack 11114, win 61320, length 0
13:06:51.495739 IP 142.250.81.238.443 > 10.0.2.15.42338: Flags [P.], seq 11114:13862, ack 821, win 65535, length 2748
13:06:51.495760 IP 10.0.2.15.42338 > 142.250.81.238.443: Flags [.], ack 13862, win 61320, length 0
13:06:51.497206 IP 142.250.81.238.443 > 10.0.2.15.42338: Flags [P.], seq 13862:16610, ack 821, win 65535, length 2748
13:06:51.497223 IP 10.0.2.15.42338 > 142.250.81.238.443: Flags [.], ack 16610, win 62780, length 0
13:06:51.497854 IP 142.250.81.238.443 > 10.0.2.15.42338: Flags [P.], seq 16610:17185, ack 821, win 65535, length 575
13:06:51.497868 IP 10.0.2.15.42338 > 142.250.81.238.443: Flags [.], ack 17185, win 62780, length 0
13:06:51.498794 IP 142.250.81.238.443 > 10.0.2.15.42338: Flags [P.], seq 17185:19933, ack 821, win 65535, length 2748
13:06:51.498807 IP 10.0.2.15.42338 > 142.250.81.238.443: Flags [.], ack 19933, win 62780, length 0
13:06:51.499854 IP 142.250.81.238.443 > 10.0.2.15.42338: Flags [P.], seq 19933:24055, ack 821, win 65535, length 4122
13:06:51.499868 IP 10.0.2.15.42338 > 142.250.81.238.443: Flags [.], ack 24055, win 61320, length 0
13:06:51.500937 IP 142.250.81.238.443 > 10.0.2.15.42338: Flags [P.], seq 24055:25429, ack 821, win 65535, length 1374
13:06:51.501005 IP 10.0.2.15.42338 > 142.250.81.238.443: Flags [.], ack 25429, win 62780, length 0
13:06:51.502126 IP 142.250.81.238.443 > 10.0.2.15.42338: Flags [P.], seq 25429:29551, ack 821, win 65535, length 4122
13:06:51.502227 IP 10.0.2.15.42338 > 142.250.81.238.443: Flags [.], ack 29551, win 61320, length 0
13:06:51.507897 IP 142.250.81.238.443 > 10.0.2.15.42338: Flags [P.], seq 29551:32299, ack 821, win 65535, length 2748
13:06:51.507923 IP 10.0.2.15.42338 > 142.250.81.238.443: Flags [.], ack 32299, win 62780, length 0
13:06:51.508879 IP 142.250.81.238.443 > 10.0.2.15.42338: Flags [P.], seq 32299:33673, ack 821, win 65535, length 1374
13:06:51.508963 IP 10.0.2.15.42338 > 142.250.81.238.443: Flags [.], ack 33673, win 62780, length 0
13:06:51.509768 IP 142.250.81.238.443 > 10.0.2.15.42338: Flags [P.], seq 33673:36421, ack 821, win 65535, length 2748
13:06:51.509783 IP 10.0.2.15.42338 > 142.250.81.238.443: Flags [.], ack 36421, win 62780, length 0
13:06:51.510807 IP 142.250.81.238.443 > 10.0.2.15.42338: Flags [P.], seq 36421:41917, ack 821, win 65535, length 5496
13:06:51.510896 IP 10.0.2.15.42338 > 142.250.81.238.443: Flags [.], ack 41917, win 61320, length 0
13:06:51.511966 IP 142.250.81.238.443 > 10.0.2.15.42338: Flags [P.], seq 41917:44665, ack 821, win 65535, length 2748
13:06:51.511982 IP 10.0.2.15.42338 > 142.250.81.238.443: Flags [.], ack 44665, win 62780, length 0
13:06:51.512714 IP 142.250.81.238.443 > 10.0.2.15.42338: Flags [P.], seq 44665:47413, ack 821, win 65535, length 2748
13:06:51.512730 IP 10.0.2.15.42338 > 142.250.81.238.443: Flags [.], ack 47413, win 62780, length 0
13:06:51.514889 IP 142.250.81.238.443 > 10.0.2.15.42338: Flags [P.], seq 47413:52909, ack 821, win 65535, length 5496
13:06:51.514959 IP 10.0.2.15.42338 > 142.250.81.238.443: Flags [.], ack 52909, win 61320, length 0
13:06:51.516015 IP 142.250.81.238.443 > 10.0.2.15.42338: Flags [P.], seq 52909:55657, ack 821, win 65535, length 2748
13:06:51.516030 IP 10.0.2.15.42338 > 142.250.81.238.443: Flags [.], ack 55657, win 62780, length 0
13:06:51.517238 IP 142.250.81.238.443 > 10.0.2.15.42338: Flags [P.], seq 55657:58405, ack 821, win 65535, length 2748
13:06:51.517263 IP 10.0.2.15.42338 > 142.250.81.238.443: Flags [.], ack 58405, win 62780, length 0
13:06:51.518405 IP 142.250.81.238.443 > 10.0.2.15.42338: Flags [P.], seq 58405:63901, ack 821, win 65535, length 5496
13:06:51.518483 IP 10.0.2.15.42338 > 142.250.81.238.443: Flags [.], ack 63901, win 61320, length 0
13:06:51.519122 IP 142.250.81.238.443 > 10.0.2.15.42338: Flags [P.], seq 63901:66649, ack 821, win 65535, length 2748
13:06:51.519139 IP 10.0.2.15.42338 > 142.250.81.238.443: Flags [.], ack 66649, win 62780, length 0
13:06:51.520219 IP 142.250.81.238.443 > 10.0.2.15.42338: Flags [P.], seq 66649:72145, ack 821, win 65535, length 5496
13:06:51.520290 IP 10.0.2.15.42338 > 142.250.81.238.443: Flags [.], ack 72145, win 62780, length 0
13:06:51.521393 IP 142.250.81.238.443 > 10.0.2.15.42338: Flags [P.], seq 72145:76267, ack 821, win 65535, length 4122
13:06:51.521410 IP 10.0.2.15.42338 > 142.250.81.238.443: Flags [.], ack 76267, win 65535, length 0
13:06:51.522465 IP 142.250.81.238.443 > 10.0.2.15.42338: Flags [P.], seq 76267:80389, ack 821, win 65535, length 4122
13:06:51.522481 IP 10.0.2.15.42338 > 142.250.81.238.443: Flags [.], ack 80389, win 65535, length 0
13:06:51.523691 IP 142.250.81.238.443 > 10.0.2.15.42338: Flags [P.], seq 80389:85885, ack 821, win 65535, length 5496
13:06:51.523708 IP 10.0.2.15.42338 > 142.250.81.238.443: Flags [.], ack 85885, win 65535, length 0
13:06:51.524440 IP 142.250.81.238.443 > 10.0.2.15.42338: Flags [P.], seq 85885:92755, ack 821, win 65535, length 6870
13:06:51.524466 IP 10.0.2.15.42338 > 142.250.81.238.443: Flags [.], ack 92755, win 65535, length 0
13:06:51.525759 IP 142.250.81.238.443 > 10.0.2.15.42338: Flags [P.], seq 92755:96877, ack 821, win 65535, length 4122
13:06:51.525776 IP 10.0.2.15.42338 > 142.250.81.238.443: Flags [.], ack 96877, win 65535, length 0
13:06:51.526786 IP 142.250.81.238.443 > 10.0.2.15.42338: Flags [P.], seq 96877:103747, ack 821, win 65535, length 6870
13:06:51.526803 IP 10.0.2.15.42338 > 142.250.81.238.443: Flags [.], ack 103747, win 65535, length 0
13:06:51.527697 IP 142.250.81.238.443 > 10.0.2.15.42338: Flags [P.], seq 103747:109243, ack 821, win 65535, length 5496
13:06:51.527773 IP 10.0.2.15.42338 > 142.250.81.238.443: Flags [.], ack 109243, win 65535, length 0
13:06:51.528791 IP 142.250.81.238.443 > 10.0.2.15.42338: Flags [P.], seq 109243:114739, ack 821, win 65535, length 5496
13:06:51.528809 IP 10.0.2.15.42338 > 142.250.81.238.443: Flags [.], ack 114739, win 65535, length 0
13:06:51.531506 IP 142.250.81.238.443 > 10.0.2.15.42338: Flags [P.], seq 114739:128479, ack 821, win 65535, length 13740
13:06:51.531524 IP 10.0.2.15.42338 > 142.250.81.238.443: Flags [.], ack 128479, win 65535, length 0
13:06:51.531560 IP 142.250.81.238.443 > 10.0.2.15.42338: Flags [P.], seq 128479:129853, ack 821, win 65535, length 1374
13:06:51.531573 IP 10.0.2.15.42338 > 142.250.81.238.443: Flags [.], ack 129853, win 65535, length 0
13:06:51.532617 IP 142.250.81.238.443 > 10.0.2.15.42338: Flags [P.], seq 129853:139471, ack 821, win 65535, length 9618
13:06:51.532634 IP 10.0.2.15.42338 > 142.250.81.238.443: Flags [.], ack 139471, win 65535, length 0
13:06:51.533796 IP 142.250.81.238.443 > 10.0.2.15.42338: Flags [P.], seq 139471:144967, ack 821, win 65535, length 5496
13:06:51.533812 IP 10.0.2.15.42338 > 142.250.81.238.443: Flags [.], ack 144967, win 65535, length 0
13:06:51.534925 IP 142.250.81.238.443 > 10.0.2.15.42338: Flags [P.], seq 144967:151837, ack 821, win 65535, length 6870
13:06:51.534946 IP 10.0.2.15.42338 > 142.250.81.238.443: Flags [.], ack 151837, win 65535, length 0
13:06:51.535777 IP 142.250.81.238.443 > 10.0.2.15.42338: Flags [P.], seq 151837:155959, ack 821, win 65535, length 4122
13:06:51.535800 IP 10.0.2.15.42338 > 142.250.81.238.443: Flags [.], ack 155959, win 65535, length 0
13:06:51.537507 IP 142.250.81.238.443 > 10.0.2.15.42338: Flags [.], seq 155959:157419, ack 821, win 65535, length 1460
13:06:51.537732 IP 10.0.2.15.42338 > 142.250.81.238.443: Flags [.], ack 157419, win 65535, length 0
13:06:51.538174 IP 142.250.81.238.443 > 10.0.2.15.42338: Flags [P.], seq 157419:166951, ack 821, win 65535, length 9532
13:06:51.538191 IP 10.0.2.15.42338 > 142.250.81.238.443: Flags [.], ack 166951, win 65535, length 0
13:06:51.538712 IP 142.250.81.238.443 > 10.0.2.15.42338: Flags [P.], seq 166951:179317, ack 821, win 65535, length 12366
13:06:51.538735 IP 10.0.2.15.42338 > 142.250.81.238.443: Flags [.], ack 179317, win 65535, length 0
13:06:51.539361 IP 142.250.81.238.443 > 10.0.2.15.42338: Flags [P.], seq 179317:184813, ack 821, win 65535, length 5496
13:06:51.539376 IP 10.0.2.15.42338 > 142.250.81.238.443: Flags [.], ack 184813, win 65535, length 0
13:06:51.540955 IP 142.250.81.238.443 > 10.0.2.15.42338: Flags [P.], seq 184813:194013, ack 821, win 65535, length 9200
13:06:51.540971 IP 10.0.2.15.42338 > 142.250.81.238.443: Flags [.], ack 194013, win 65535, length 0
13:06:51.645418 IP 142.250.81.238.443 > 10.0.2.15.42338: Flags [P.], seq 194013:194206, ack 821, win 65535, length 193
13:06:51.645493 IP 10.0.2.15.42338 > 142.250.81.238.443: Flags [.], ack 194206, win 65535, length 0
13:06:51.669726 IP 142.250.81.238.443 > 10.0.2.15.42338: Flags [P.], seq 194206:210694, ack 821, win 65535, length 16488
13:06:51.669918 IP 10.0.2.15.42338 > 142.250.81.238.443: Flags [.], ack 210694, win 65535, length 0
13:06:51.670046 IP 142.250.81.238.443 > 10.0.2.15.42338: Flags [P.], seq 210694:220312, ack 821, win 65535, length 9618
13:06:51.670058 IP 10.0.2.15.42338 > 142.250.81.238.443: Flags [.], ack 220312, win 65535, length 0
13:06:51.670553 IP 142.250.81.238.443 > 10.0.2.15.42338: Flags [P.], seq 220312:227182, ack 821, win 65535, length 6870
13:06:51.670569 IP 10.0.2.15.42338 > 142.250.81.238.443: Flags [.], ack 227182, win 65535, length 0
13:06:51.671789 IP 142.250.81.238.443 > 10.0.2.15.42338: Flags [P.], seq 227182:234412, ack 821, win 65535, length 7230
13:06:51.671813 IP 10.0.2.15.42338 > 142.250.81.238.443: Flags [.], ack 234412, win 65535, length 0
13:06:51.672653 IP 142.250.81.238.443 > 10.0.2.15.42338: Flags [P.], seq 234412:241282, ack 821, win 65535, length 6870
13:06:51.672704 IP 142.250.81.238.443 > 10.0.2.15.42338: Flags [P.], seq 241282:255022, ack 821, win 65535, length 13740
13:06:51.672725 IP 10.0.2.15.42338 > 142.250.81.238.443: Flags [.], ack 241282, win 65535, length 0
13:06:51.672751 IP 10.0.2.15.42338 > 142.250.81.238.443: Flags [.], ack 255022, win 65535, length 0
13:06:51.672905 IP 142.250.81.238.443 > 10.0.2.15.42338: Flags [P.], seq 255022:256396, ack 821, win 65535, length 1374
13:06:51.672913 IP 10.0.2.15.42338 > 142.250.81.238.443: Flags [.], ack 256396, win 65535, length 0
13:06:51.676056 IP 142.250.81.238.443 > 10.0.2.15.42338: Flags [P.], seq 256396:268762, ack 821, win 65535, length 12366
13:06:51.676114 IP 10.0.2.15.42338 > 142.250.81.238.443: Flags [.], ack 268762, win 65535, length 0
13:06:51.676479 IP 142.250.81.238.443 > 10.0.2.15.42338: Flags [P.], seq 268762:303112, ack 821, win 65535, length 34350
13:06:51.676493 IP 10.0.2.15.42338 > 142.250.81.238.443: Flags [.], ack 303112, win 65535, length 0
13:06:51.680115 IP 142.250.81.238.443 > 10.0.2.15.42338: Flags [P.], seq 303112:352576, ack 821, win 65535, length 49464
13:06:51.680219 IP 10.0.2.15.42338 > 142.250.81.238.443: Flags [.], ack 352576, win 65535, length 0
13:06:51.681824 IP 142.250.81.238.443 > 10.0.2.15.42338: Flags [P.], seq 352576:380056, ack 821, win 65535, length 27480
13:06:51.681846 IP 10.0.2.15.42338 > 142.250.81.238.443: Flags [.], ack 380056, win 65535, length 0
13:06:51.681872 IP 142.250.81.238.443 > 10.0.2.15.42338: Flags [P.], seq 380056:391048, ack 821, win 65535, length 10992
13:06:51.681879 IP 10.0.2.15.42338 > 142.250.81.238.443: Flags [.], ack 391048, win 65535, length 0
13:06:51.682857 IP 142.250.81.238.443 > 10.0.2.15.42338: Flags [P.], seq 391048:399292, ack 821, win 65535, length 8244
13:06:51.682873 IP 10.0.2.15.42338 > 142.250.81.238.443: Flags [.], ack 399292, win 65535, length 0
13:06:51.683129 IP 142.250.81.238.443 > 10.0.2.15.42338: Flags [P.], seq 399292:408910, ack 821, win 65535, length 9618
13:06:51.683140 IP 10.0.2.15.42338 > 142.250.81.238.443: Flags [.], ack 408910, win 65535, length 0
13:06:51.683649 IP 142.250.81.238.443 > 10.0.2.15.42338: Flags [P.], seq 408910:410284, ack 821, win 65535, length 1374
13:06:51.683661 IP 10.0.2.15.42338 > 142.250.81.238.443: Flags [.], ack 410284, win 65535, length 0
13:06:51.684548 IP 142.250.81.238.443 > 10.0.2.15.42338: Flags [P.], seq 410284:414406, ack 821, win 65535, length 4122
13:06:51.684573 IP 10.0.2.15.42338 > 142.250.81.238.443: Flags [.], ack 414406, win 65535, length 0
13:06:51.686726 IP 142.250.81.238.443 > 10.0.2.15.42338: Flags [P.], seq 414406:450130, ack 821, win 65535, length 35724
13:06:51.686747 IP 10.0.2.15.42338 > 142.250.81.238.443: Flags [.], ack 450130, win 65535, length 0
13:06:51.687618 IP 142.250.81.238.443 > 10.0.2.15.42338: Flags [P.], seq 450130:477610, ack 821, win 65535, length 27480
13:06:51.687634 IP 10.0.2.15.42338 > 142.250.81.238.443: Flags [.], ack 477610, win 65535, length 0
13:06:51.688134 IP 142.250.81.238.443 > 10.0.2.15.42338: Flags [P.], seq 477610:489976, ack 821, win 65535, length 12366
13:06:51.688150 IP 10.0.2.15.42338 > 142.250.81.238.443: Flags [.], ack 489976, win 65535, length 0

