20:13:57.350817 IP 10.0.2.15.33018 > 140.233.253.2.53: 19048+ A? www.youtube.com. (33)
20:13:57.350860 IP 10.0.2.15.33018 > 140.233.253.2.53: 10603+ AAAA? www.youtube.com. (33)
20:13:57.357277 IP 140.233.253.2.53 > 10.0.2.15.33018: 10603 5/0/0 CNAME youtube-ui.l.google.com., AAAA 2607:f8b0:4006:823::200e, AAAA 2607:f8b0:4006:81d::200e, AAAA 2607:f8b0:4006:81e::200e, AAAA 2607:f8b0:4006:822::200e (179)
20:13:57.357279 IP 140.233.253.2.53 > 10.0.2.15.33018: 19048 17/0/0 CNAME youtube-ui.l.google.com., A 142.250.65.174, A 142.250.65.206, A 142.251.32.110, A 142.251.35.174, A 142.251.40.206, A 142.251.40.238, A 142.251.41.14, A 142.250.176.206, A 142.250.64.78, A 142.250.64.110, A 142.250.72.110, A 142.250.80.14, A 142.250.80.46, A 142.250.80.78, A 142.250.80.110, A 172.217.165.142 (323)
20:13:57.357962 IP 10.0.2.15.44576 > 142.250.65.174.443: Flags [S], seq 3635055070, win 64240, options [mss 1460,sackOK,TS val 3195955226 ecr 0,nop,wscale 6], length 0
20:13:57.371369 IP 142.250.65.174.443 > 10.0.2.15.44576: Flags [S.], seq 240384001, ack 3635055071, win 65535, options [mss 1460], length 0
20:13:57.371409 IP 10.0.2.15.44576 > 142.250.65.174.443: Flags [.], ack 1, win 64240, length 0
20:13:57.380069 IP 10.0.2.15.44576 > 142.250.65.174.443: Flags [P.], seq 1:518, ack 1, win 64240, length 517
20:13:57.380367 IP 142.250.65.174.443 > 10.0.2.15.44576: Flags [.], ack 518, win 65535, length 0
20:13:57.401750 IP 142.250.65.174.443 > 10.0.2.15.44576: Flags [P.], seq 1:1375, ack 518, win 65535, length 1374
20:13:57.401772 IP 10.0.2.15.44576 > 142.250.65.174.443: Flags [.], ack 1375, win 63204, length 0
20:13:57.402437 IP 142.250.65.174.443 > 10.0.2.15.44576: Flags [P.], seq 1375:2749, ack 518, win 65535, length 1374
20:13:57.402464 IP 10.0.2.15.44576 > 142.250.65.174.443: Flags [.], ack 2749, win 63204, length 0
20:13:57.405050 IP 142.250.65.174.443 > 10.0.2.15.44576: Flags [P.], seq 2749:6651, ack 518, win 65535, length 3902
20:13:57.405075 IP 10.0.2.15.44576 > 142.250.65.174.443: Flags [.], ack 6651, win 61320, length 0
20:13:57.407643 IP 10.0.2.15.44576 > 142.250.65.174.443: Flags [P.], seq 518:598, ack 6651, win 62780, length 80
20:13:57.408071 IP 142.250.65.174.443 > 10.0.2.15.44576: Flags [.], ack 598, win 65535, length 0
20:13:57.408326 IP 10.0.2.15.44576 > 142.250.65.174.443: Flags [P.], seq 598:644, ack 6651, win 62780, length 46
20:13:57.408385 IP 10.0.2.15.44576 > 142.250.65.174.443: Flags [P.], seq 644:693, ack 6651, win 62780, length 49
20:13:57.408715 IP 142.250.65.174.443 > 10.0.2.15.44576: Flags [.], ack 644, win 65535, length 0
20:13:57.408717 IP 142.250.65.174.443 > 10.0.2.15.44576: Flags [.], ack 693, win 65535, length 0
20:13:57.408800 IP 10.0.2.15.44576 > 142.250.65.174.443: Flags [P.], seq 693:728, ack 6651, win 62780, length 35
20:13:57.409163 IP 142.250.65.174.443 > 10.0.2.15.44576: Flags [.], ack 728, win 65535, length 0
20:13:57.409271 IP 10.0.2.15.44576 > 142.250.65.174.443: Flags [P.], seq 728:791, ack 6651, win 62780, length 63
20:13:57.409651 IP 142.250.65.174.443 > 10.0.2.15.44576: Flags [.], ack 791, win 65535, length 0
20:13:57.420919 IP 142.250.65.174.443 > 10.0.2.15.44576: Flags [P.], seq 6651:7293, ack 791, win 65535, length 642
20:13:57.420937 IP 10.0.2.15.44576 > 142.250.65.174.443: Flags [.], ack 7293, win 62780, length 0
20:13:57.421384 IP 10.0.2.15.44576 > 142.250.65.174.443: Flags [P.], seq 791:822, ack 7293, win 62780, length 31
20:13:57.421667 IP 142.250.65.174.443 > 10.0.2.15.44576: Flags [.], ack 822, win 65535, length 0
20:13:57.421772 IP 142.250.65.174.443 > 10.0.2.15.44576: Flags [P.], seq 7293:7324, ack 822, win 65535, length 31
20:13:57.421780 IP 10.0.2.15.44576 > 142.250.65.174.443: Flags [.], ack 7324, win 62780, length 0
20:13:57.460392 IP 142.250.65.174.443 > 10.0.2.15.44576: Flags [P.], seq 7324:11113, ack 822, win 65535, length 3789
20:13:57.460412 IP 10.0.2.15.44576 > 142.250.65.174.443: Flags [.], ack 11113, win 61320, length 0
20:13:57.461425 IP 142.250.65.174.443 > 10.0.2.15.44576: Flags [P.], seq 11113:15235, ack 822, win 65535, length 4122
20:13:57.461441 IP 10.0.2.15.44576 > 142.250.65.174.443: Flags [.], ack 15235, win 61320, length 0
20:13:57.462846 IP 142.250.65.174.443 > 10.0.2.15.44576: Flags [P.], seq 15235:16609, ack 822, win 65535, length 1374
20:13:57.462862 IP 10.0.2.15.44576 > 142.250.65.174.443: Flags [.], ack 16609, win 62780, length 0
20:13:57.463638 IP 142.250.65.174.443 > 10.0.2.15.44576: Flags [P.], seq 16609:17349, ack 822, win 65535, length 740
20:13:57.463648 IP 10.0.2.15.44576 > 142.250.65.174.443: Flags [.], ack 17349, win 62780, length 0
20:13:57.465064 IP 142.250.65.174.443 > 10.0.2.15.44576: Flags [P.], seq 17349:22845, ack 822, win 65535, length 5496
20:13:57.465172 IP 10.0.2.15.44576 > 142.250.65.174.443: Flags [.], ack 22845, win 61320, length 0
20:13:57.465768 IP 142.250.65.174.443 > 10.0.2.15.44576: Flags [P.], seq 22845:25593, ack 822, win 65535, length 2748
20:13:57.465778 IP 10.0.2.15.44576 > 142.250.65.174.443: Flags [.], ack 25593, win 62780, length 0
20:13:57.466866 IP 142.250.65.174.443 > 10.0.2.15.44576: Flags [P.], seq 25593:29715, ack 822, win 65535, length 4122
20:13:57.466981 IP 10.0.2.15.44576 > 142.250.65.174.443: Flags [.], ack 29715, win 61320, length 0
20:13:57.472290 IP 142.250.65.174.443 > 10.0.2.15.44576: Flags [P.], seq 29715:31089, ack 822, win 65535, length 1374
20:13:57.472383 IP 10.0.2.15.44576 > 142.250.65.174.443: Flags [.], ack 31089, win 62780, length 0
20:13:57.473636 IP 142.250.65.174.443 > 10.0.2.15.44576: Flags [P.], seq 31089:36585, ack 822, win 65535, length 5496
20:13:57.473737 IP 10.0.2.15.44576 > 142.250.65.174.443: Flags [.], ack 36585, win 61320, length 0
20:13:57.474376 IP 142.250.65.174.443 > 10.0.2.15.44576: Flags [P.], seq 36585:39333, ack 822, win 65535, length 2748
20:13:57.474392 IP 10.0.2.15.44576 > 142.250.65.174.443: Flags [.], ack 39333, win 62780, length 0
20:13:57.475397 IP 142.250.65.174.443 > 10.0.2.15.44576: Flags [P.], seq 39333:42081, ack 822, win 65535, length 2748
20:13:57.475410 IP 10.0.2.15.44576 > 142.250.65.174.443: Flags [.], ack 42081, win 62780, length 0
20:13:57.476559 IP 142.250.65.174.443 > 10.0.2.15.44576: Flags [P.], seq 42081:44829, ack 822, win 65535, length 2748
20:13:57.476570 IP 10.0.2.15.44576 > 142.250.65.174.443: Flags [.], ack 44829, win 62780, length 0
20:13:57.477535 IP 142.250.65.174.443 > 10.0.2.15.44576: Flags [P.], seq 44829:47577, ack 822, win 65535, length 2748
20:13:57.477552 IP 10.0.2.15.44576 > 142.250.65.174.443: Flags [.], ack 47577, win 62780, length 0
20:13:57.478741 IP 142.250.65.174.443 > 10.0.2.15.44576: Flags [P.], seq 47577:51699, ack 822, win 65535, length 4122
20:13:57.478882 IP 10.0.2.15.44576 > 142.250.65.174.443: Flags [.], ack 51699, win 61320, length 0
20:13:57.479713 IP 142.250.65.174.443 > 10.0.2.15.44576: Flags [P.], seq 51699:57195, ack 822, win 65535, length 5496
20:13:57.479734 IP 10.0.2.15.44576 > 142.250.65.174.443: Flags [.], ack 57195, win 61320, length 0
20:13:57.480741 IP 142.250.65.174.443 > 10.0.2.15.44576: Flags [P.], seq 57195:59943, ack 822, win 65535, length 2748
20:13:57.480798 IP 10.0.2.15.44576 > 142.250.65.174.443: Flags [.], ack 59943, win 62780, length 0
20:13:57.482090 IP 142.250.65.174.443 > 10.0.2.15.44576: Flags [P.], seq 59943:61317, ack 822, win 65535, length 1374
20:13:57.482214 IP 10.0.2.15.44576 > 142.250.65.174.443: Flags [.], ack 61317, win 62780, length 0
20:13:57.483341 IP 142.250.65.174.443 > 10.0.2.15.44576: Flags [.], seq 61317:65697, ack 822, win 65535, length 4380
20:13:57.483704 IP 142.250.65.174.443 > 10.0.2.15.44576: Flags [P.], seq 65697:66813, ack 822, win 65535, length 1116
20:13:57.483778 IP 10.0.2.15.44576 > 142.250.65.174.443: Flags [.], ack 66813, win 62780, length 0
20:13:57.483876 IP 142.250.65.174.443 > 10.0.2.15.44576: Flags [P.], seq 66813:68187, ack 822, win 65535, length 1374
20:13:57.483897 IP 10.0.2.15.44576 > 142.250.65.174.443: Flags [.], ack 68187, win 65535, length 0
20:13:57.485402 IP 142.250.65.174.443 > 10.0.2.15.44576: Flags [P.], seq 68187:75057, ack 822, win 65535, length 6870
20:13:57.485423 IP 10.0.2.15.44576 > 142.250.65.174.443: Flags [.], ack 75057, win 65535, length 0
20:13:57.486667 IP 142.250.65.174.443 > 10.0.2.15.44576: Flags [P.], seq 75057:80553, ack 822, win 65535, length 5496
20:13:57.486683 IP 10.0.2.15.44576 > 142.250.65.174.443: Flags [.], ack 80553, win 65535, length 0
20:13:57.487172 IP 142.250.65.174.443 > 10.0.2.15.44576: Flags [P.], seq 80553:86049, ack 822, win 65535, length 5496
20:13:57.487187 IP 10.0.2.15.44576 > 142.250.65.174.443: Flags [.], ack 86049, win 65535, length 0
20:13:57.488497 IP 142.250.65.174.443 > 10.0.2.15.44576: Flags [P.], seq 86049:91545, ack 822, win 65535, length 5496
20:13:57.488516 IP 10.0.2.15.44576 > 142.250.65.174.443: Flags [.], ack 91545, win 65535, length 0
20:13:57.489627 IP 142.250.65.174.443 > 10.0.2.15.44576: Flags [P.], seq 91545:98415, ack 822, win 65535, length 6870
20:13:57.489654 IP 10.0.2.15.44576 > 142.250.65.174.443: Flags [.], ack 98415, win 65535, length 0
20:13:57.490678 IP 142.250.65.174.443 > 10.0.2.15.44576: Flags [P.], seq 98415:105285, ack 822, win 65535, length 6870
20:13:57.490698 IP 10.0.2.15.44576 > 142.250.65.174.443: Flags [.], ack 105285, win 65535, length 0
20:13:57.491484 IP 142.250.65.174.443 > 10.0.2.15.44576: Flags [P.], seq 105285:109407, ack 822, win 65535, length 4122
20:13:57.491496 IP 10.0.2.15.44576 > 142.250.65.174.443: Flags [.], ack 109407, win 65535, length 0
20:13:57.492861 IP 142.250.65.174.443 > 10.0.2.15.44576: Flags [P.], seq 109407:113529, ack 822, win 65535, length 4122
20:13:57.492864 IP 142.250.65.174.443 > 10.0.2.15.44576: Flags [P.], seq 113529:116277, ack 822, win 65535, length 2748
20:13:57.492919 IP 10.0.2.15.44576 > 142.250.65.174.443: Flags [.], ack 113529, win 65535, length 0
20:13:57.492955 IP 10.0.2.15.44576 > 142.250.65.174.443: Flags [.], ack 116277, win 65535, length 0
20:13:57.493988 IP 142.250.65.174.443 > 10.0.2.15.44576: Flags [P.], seq 116277:123147, ack 822, win 65535, length 6870
20:13:57.493991 IP 142.250.65.174.443 > 10.0.2.15.44576: Flags [P.], seq 123147:124521, ack 822, win 65535, length 1374
20:13:57.494012 IP 10.0.2.15.44576 > 142.250.65.174.443: Flags [.], ack 123147, win 65535, length 0
20:13:57.494092 IP 10.0.2.15.44576 > 142.250.65.174.443: Flags [.], ack 124521, win 65535, length 0
20:13:57.494773 IP 142.250.65.174.443 > 10.0.2.15.44576: Flags [P.], seq 124521:131391, ack 822, win 65535, length 6870
20:13:57.494791 IP 10.0.2.15.44576 > 142.250.65.174.443: Flags [.], ack 131391, win 65535, length 0
20:13:57.496266 IP 142.250.65.174.443 > 10.0.2.15.44576: Flags [P.], seq 131391:136887, ack 822, win 65535, length 5496
20:13:57.496341 IP 10.0.2.15.44576 > 142.250.65.174.443: Flags [.], ack 136887, win 65535, length 0
20:13:57.496963 IP 142.250.65.174.443 > 10.0.2.15.44576: Flags [P.], seq 136887:143757, ack 822, win 65535, length 6870
20:13:57.496974 IP 10.0.2.15.44576 > 142.250.65.174.443: Flags [.], ack 143757, win 65535, length 0
20:13:57.498237 IP 142.250.65.174.443 > 10.0.2.15.44576: Flags [P.], seq 143757:152001, ack 822, win 65535, length 8244
20:13:57.498258 IP 10.0.2.15.44576 > 142.250.65.174.443: Flags [.], ack 152001, win 65535, length 0
20:13:57.499094 IP 142.250.65.174.443 > 10.0.2.15.44576: Flags [P.], seq 152001:157497, ack 822, win 65535, length 5496
20:13:57.499107 IP 10.0.2.15.44576 > 142.250.65.174.443: Flags [.], ack 157497, win 65535, length 0
20:13:57.500436 IP 142.250.65.174.443 > 10.0.2.15.44576: Flags [P.], seq 157497:165741, ack 822, win 65535, length 8244
20:13:57.500454 IP 10.0.2.15.44576 > 142.250.65.174.443: Flags [.], ack 165741, win 65535, length 0
20:13:57.501058 IP 142.250.65.174.443 > 10.0.2.15.44576: Flags [P.], seq 165741:172611, ack 822, win 65535, length 6870
20:13:57.501076 IP 10.0.2.15.44576 > 142.250.65.174.443: Flags [.], ack 172611, win 65535, length 0
20:13:57.501281 IP 142.250.65.174.443 > 10.0.2.15.44576: Flags [P.], seq 172611:179481, ack 822, win 65535, length 6870
20:13:57.501300 IP 10.0.2.15.44576 > 142.250.65.174.443: Flags [.], ack 179481, win 65535, length 0
20:13:57.502597 IP 142.250.65.174.443 > 10.0.2.15.44576: Flags [P.], seq 179481:189099, ack 822, win 65535, length 9618
20:13:57.502620 IP 10.0.2.15.44576 > 142.250.65.174.443: Flags [.], ack 189099, win 65535, length 0
20:13:57.503527 IP 142.250.65.174.443 > 10.0.2.15.44576: Flags [P.], seq 189099:194595, ack 822, win 65535, length 5496
20:13:57.503529 IP 142.250.65.174.443 > 10.0.2.15.44576: Flags [P.], seq 194595:198717, ack 822, win 65535, length 4122
20:13:57.503530 IP 142.250.65.174.443 > 10.0.2.15.44576: Flags [P.], seq 198717:201465, ack 822, win 65535, length 2748
20:13:57.503552 IP 10.0.2.15.44576 > 142.250.65.174.443: Flags [.], ack 194595, win 65535, length 0
20:13:57.503587 IP 10.0.2.15.44576 > 142.250.65.174.443: Flags [.], ack 198717, win 65535, length 0
20:13:57.503600 IP 10.0.2.15.44576 > 142.250.65.174.443: Flags [.], ack 201465, win 65535, length 0
20:13:57.504429 IP 142.250.65.174.443 > 10.0.2.15.44576: Flags [P.], seq 201465:208335, ack 822, win 65535, length 6870
20:13:57.504467 IP 10.0.2.15.44576 > 142.250.65.174.443: Flags [.], ack 208335, win 65535, length 0
20:13:57.504644 IP 142.250.65.174.443 > 10.0.2.15.44576: Flags [P.], seq 208335:211083, ack 822, win 65535, length 2748
20:13:57.504645 IP 142.250.65.174.443 > 10.0.2.15.44576: Flags [P.], seq 211083:212457, ack 822, win 65535, length 1374
20:13:57.504658 IP 10.0.2.15.44576 > 142.250.65.174.443: Flags [.], ack 211083, win 65535, length 0
20:13:57.504675 IP 10.0.2.15.44576 > 142.250.65.174.443: Flags [.], ack 212457, win 65535, length 0
20:13:57.505643 IP 142.250.65.174.443 > 10.0.2.15.44576: Flags [P.], seq 212457:217953, ack 822, win 65535, length 5496
20:13:57.505657 IP 10.0.2.15.44576 > 142.250.65.174.443: Flags [.], ack 217953, win 65535, length 0
20:13:57.506734 IP 142.250.65.174.443 > 10.0.2.15.44576: Flags [P.], seq 217953:218817, ack 822, win 65535, length 864
20:13:57.506753 IP 10.0.2.15.44576 > 142.250.65.174.443: Flags [.], ack 218817, win 65535, length 0
20:13:57.655375 IP 142.250.65.174.443 > 10.0.2.15.44576: Flags [P.], seq 218817:219010, ack 822, win 65535, length 193
20:13:57.655407 IP 10.0.2.15.44576 > 142.250.65.174.443: Flags [.], ack 219010, win 65535, length 0
20:13:57.680481 IP 142.250.65.174.443 > 10.0.2.15.44576: Flags [P.], seq 219010:225880, ack 822, win 65535, length 6870
20:13:57.680486 IP 142.250.65.174.443 > 10.0.2.15.44576: Flags [P.], seq 225880:232750, ack 822, win 65535, length 6870
20:13:57.680534 IP 10.0.2.15.44576 > 142.250.65.174.443: Flags [.], ack 225880, win 65535, length 0
20:13:57.680911 IP 10.0.2.15.44576 > 142.250.65.174.443: Flags [.], ack 232750, win 65535, length 0
20:13:57.681121 IP 142.250.65.174.443 > 10.0.2.15.44576: Flags [P.], seq 232750:238246, ack 822, win 65535, length 5496
20:13:57.681124 IP 142.250.65.174.443 > 10.0.2.15.44576: Flags [P.], seq 238246:242368, ack 822, win 65535, length 4122
20:13:57.681125 IP 142.250.65.174.443 > 10.0.2.15.44576: Flags [P.], seq 242368:245116, ack 822, win 65535, length 2748
20:13:57.681145 IP 10.0.2.15.44576 > 142.250.65.174.443: Flags [.], ack 238246, win 65535, length 0
20:13:57.681171 IP 10.0.2.15.44576 > 142.250.65.174.443: Flags [.], ack 242368, win 65535, length 0
20:13:57.681195 IP 10.0.2.15.44576 > 142.250.65.174.443: Flags [.], ack 245116, win 65535, length 0
20:13:57.681404 IP 142.250.65.174.443 > 10.0.2.15.44576: Flags [P.], seq 245116:250612, ack 822, win 65535, length 5496
20:13:57.681406 IP 142.250.65.174.443 > 10.0.2.15.44576: Flags [P.], seq 250612:251986, ack 822, win 65535, length 1374
20:13:57.681429 IP 10.0.2.15.44576 > 142.250.65.174.443: Flags [.], ack 250612, win 65535, length 0
20:13:57.681794 IP 10.0.2.15.44576 > 142.250.65.174.443: Flags [.], ack 251986, win 65535, length 0
20:13:57.682184 IP 142.250.65.174.443 > 10.0.2.15.44576: Flags [P.], seq 251986:256468, ack 822, win 65535, length 4482
20:13:57.682186 IP 142.250.65.174.443 > 10.0.2.15.44576: Flags [.], seq 256468:257928, ack 822, win 65535, length 1460
20:13:57.682481 IP 142.250.65.174.443 > 10.0.2.15.44576: Flags [P.], seq 257928:264712, ack 822, win 65535, length 6784
20:13:57.683088 IP 10.0.2.15.44576 > 142.250.65.174.443: Flags [.], ack 256468, win 65535, length 0
20:13:57.683875 IP 10.0.2.15.44576 > 142.250.65.174.443: Flags [.], ack 264712, win 65535, length 0
20:13:57.684457 IP 142.250.65.174.443 > 10.0.2.15.44576: Flags [.], seq 264712:269092, ack 822, win 65535, length 4380
20:13:57.684476 IP 10.0.2.15.44576 > 142.250.65.174.443: Flags [.], ack 269092, win 65535, length 0
20:13:57.684643 IP 142.250.65.174.443 > 10.0.2.15.44576: Flags [P.], seq 269092:270208, ack 822, win 65535, length 1116
20:13:57.684650 IP 10.0.2.15.44576 > 142.250.65.174.443: Flags [.], ack 270208, win 65535, length 0
20:13:57.684971 IP 142.250.65.174.443 > 10.0.2.15.44576: Flags [.], seq 270208:273128, ack 822, win 65535, length 2920
20:13:57.684988 IP 10.0.2.15.44576 > 142.250.65.174.443: Flags [.], ack 273128, win 65535, length 0
20:13:57.685172 IP 142.250.65.174.443 > 10.0.2.15.44576: Flags [P.], seq 273128:278360, ack 822, win 65535, length 5232
20:13:57.685174 IP 142.250.65.174.443 > 10.0.2.15.44576: Flags [.], seq 278360:279820, ack 822, win 65535, length 1460
20:13:57.685194 IP 10.0.2.15.44576 > 142.250.65.174.443: Flags [.], ack 278360, win 65535, length 0
20:13:57.685463 IP 10.0.2.15.44576 > 142.250.65.174.443: Flags [.], ack 279820, win 65535, length 0
20:13:57.685709 IP 142.250.65.174.443 > 10.0.2.15.44576: Flags [P.], seq 279820:281108, ack 822, win 65535, length 1288
20:13:57.685712 IP 142.250.65.174.443 > 10.0.2.15.44576: Flags [P.], seq 281108:286604, ack 822, win 65535, length 5496
20:13:57.685713 IP 142.250.65.174.443 > 10.0.2.15.44576: Flags [P.], seq 286604:289352, ack 822, win 65535, length 2748
20:13:57.685728 IP 10.0.2.15.44576 > 142.250.65.174.443: Flags [.], ack 281108, win 65535, length 0
20:13:57.685754 IP 10.0.2.15.44576 > 142.250.65.174.443: Flags [.], ack 286604, win 65535, length 0
20:13:57.685884 IP 10.0.2.15.44576 > 142.250.65.174.443: Flags [.], ack 289352, win 65535, length 0
20:13:57.685999 IP 142.250.65.174.443 > 10.0.2.15.44576: Flags [P.], seq 289352:294848, ack 822, win 65535, length 5496
20:13:57.686010 IP 10.0.2.15.44576 > 142.250.65.174.443: Flags [.], ack 294848, win 65535, length 0
20:13:57.686355 IP 142.250.65.174.443 > 10.0.2.15.44576: Flags [P.], seq 294848:297596, ack 822, win 65535, length 2748
20:13:57.686357 IP 142.250.65.174.443 > 10.0.2.15.44576: Flags [P.], seq 297596:300344, ack 822, win 65535, length 2748
20:13:57.686429 IP 10.0.2.15.44576 > 142.250.65.174.443: Flags [.], ack 297596, win 65535, length 0
20:13:57.686456 IP 10.0.2.15.44576 > 142.250.65.174.443: Flags [.], ack 300344, win 65535, length 0
20:13:57.686790 IP 142.250.65.174.443 > 10.0.2.15.44576: Flags [P.], seq 300344:305840, ack 822, win 65535, length 5496
20:13:57.686802 IP 10.0.2.15.44576 > 142.250.65.174.443: Flags [.], ack 305840, win 65535, length 0
20:13:57.687187 IP 142.250.65.174.443 > 10.0.2.15.44576: Flags [P.], seq 305840:314084, ack 822, win 65535, length 8244
20:13:57.687241 IP 10.0.2.15.44576 > 142.250.65.174.443: Flags [.], ack 314084, win 65535, length 0
20:13:57.687417 IP 142.250.65.174.443 > 10.0.2.15.44576: Flags [.], seq 314084:315544, ack 822, win 65535, length 1460
20:13:57.687426 IP 10.0.2.15.44576 > 142.250.65.174.443: Flags [.], ack 315544, win 65535, length 0
20:13:57.687534 IP 142.250.65.174.443 > 10.0.2.15.44576: Flags [P.], seq 315544:319580, ack 822, win 65535, length 4036
20:13:57.687542 IP 10.0.2.15.44576 > 142.250.65.174.443: Flags [.], ack 319580, win 65535, length 0
20:13:57.687730 IP 142.250.65.174.443 > 10.0.2.15.44576: Flags [P.], seq 319580:322328, ack 822, win 65535, length 2748
20:13:57.687740 IP 10.0.2.15.44576 > 142.250.65.174.443: Flags [.], ack 322328, win 65535, length 0
20:13:57.688589 IP 142.250.65.174.443 > 10.0.2.15.44576: Flags [P.], seq 322328:327824, ack 822, win 65535, length 5496
20:13:57.688591 IP 142.250.65.174.443 > 10.0.2.15.44576: Flags [P.], seq 327824:330572, ack 822, win 65535, length 2748
20:13:57.688592 IP 142.250.65.174.443 > 10.0.2.15.44576: Flags [P.], seq 330572:331946, ack 822, win 65535, length 1374
20:13:57.688593 IP 142.250.65.174.443 > 10.0.2.15.44576: Flags [P.], seq 331946:336068, ack 822, win 65535, length 4122
20:13:57.688611 IP 10.0.2.15.44576 > 142.250.65.174.443: Flags [.], ack 327824, win 65535, length 0
20:13:57.688629 IP 10.0.2.15.44576 > 142.250.65.174.443: Flags [.], ack 330572, win 65535, length 0
20:13:57.688641 IP 10.0.2.15.44576 > 142.250.65.174.443: Flags [.], ack 331946, win 65535, length 0
20:13:57.688652 IP 10.0.2.15.44576 > 142.250.65.174.443: Flags [.], ack 336068, win 65535, length 0
20:13:57.688678 IP 142.250.65.174.443 > 10.0.2.15.44576: Flags [P.], seq 336068:337442, ack 822, win 65535, length 1374
20:13:57.688679 IP 142.250.65.174.443 > 10.0.2.15.44576: Flags [P.], seq 337442:340190, ack 822, win 65535, length 2748
20:13:57.688680 IP 142.250.65.174.443 > 10.0.2.15.44576: Flags [P.], seq 340190:341564, ack 822, win 65535, length 1374
20:13:57.688686 IP 10.0.2.15.44576 > 142.250.65.174.443: Flags [.], ack 337442, win 65535, length 0
20:13:57.688698 IP 10.0.2.15.44576 > 142.250.65.174.443: Flags [.], ack 340190, win 65535, length 0
20:13:57.688709 IP 10.0.2.15.44576 > 142.250.65.174.443: Flags [.], ack 341564, win 65535, length 0
20:13:57.690712 IP 142.250.65.174.443 > 10.0.2.15.44576: Flags [P.], seq 341564:351182, ack 822, win 65535, length 9618
20:13:57.690716 IP 142.250.65.174.443 > 10.0.2.15.44576: Flags [P.], seq 351182:353930, ack 822, win 65535, length 2748
20:13:57.690950 IP 10.0.2.15.44576 > 142.250.65.174.443: Flags [.], ack 351182, win 65535, length 0
20:13:57.691022 IP 10.0.2.15.44576 > 142.250.65.174.443: Flags [.], ack 353930, win 65535, length 0
20:13:57.692408 IP 142.250.65.174.443 > 10.0.2.15.44576: Flags [P.], seq 353930:356678, ack 822, win 65535, length 2748
20:13:57.692412 IP 142.250.65.174.443 > 10.0.2.15.44576: Flags [P.], seq 356678:363548, ack 822, win 65535, length 6870
20:13:57.692413 IP 142.250.65.174.443 > 10.0.2.15.44576: Flags [P.], seq 363548:369044, ack 822, win 65535, length 5496
20:13:57.692609 IP 10.0.2.15.44576 > 142.250.65.174.443: Flags [.], ack 356678, win 65535, length 0
20:13:57.692635 IP 10.0.2.15.44576 > 142.250.65.174.443: Flags [.], ack 363548, win 65535, length 0
20:13:57.692647 IP 10.0.2.15.44576 > 142.250.65.174.443: Flags [.], ack 369044, win 65535, length 0
20:13:57.692717 IP 142.250.65.174.443 > 10.0.2.15.44576: Flags [P.], seq 369044:371792, ack 822, win 65535, length 2748
20:13:57.692717 IP 142.250.65.174.443 > 10.0.2.15.44576: Flags [P.], seq 371792:373166, ack 822, win 65535, length 1374
20:13:57.692719 IP 142.250.65.174.443 > 10.0.2.15.44576: Flags [P.], seq 373166:378662, ack 822, win 65535, length 5496
20:13:57.692720 IP 142.250.65.174.443 > 10.0.2.15.44576: Flags [P.], seq 378662:385532, ack 822, win 65535, length 6870
20:13:57.692727 IP 10.0.2.15.44576 > 142.250.65.174.443: Flags [.], ack 371792, win 65535, length 0
20:13:57.692741 IP 10.0.2.15.44576 > 142.250.65.174.443: Flags [.], ack 373166, win 65535, length 0
20:13:57.692753 IP 10.0.2.15.44576 > 142.250.65.174.443: Flags [.], ack 378662, win 65535, length 0
20:13:57.692768 IP 10.0.2.15.44576 > 142.250.65.174.443: Flags [.], ack 385532, win 65535, length 0
20:13:57.692796 IP 142.250.65.174.443 > 10.0.2.15.44576: Flags [P.], seq 385532:388280, ack 822, win 65535, length 2748
20:13:57.692797 IP 142.250.65.174.443 > 10.0.2.15.44576: Flags [.], seq 388280:389740, ack 822, win 65535, length 1460
20:13:57.692803 IP 10.0.2.15.44576 > 142.250.65.174.443: Flags [.], ack 388280, win 65535, length 0
20:13:57.692816 IP 10.0.2.15.44576 > 142.250.65.174.443: Flags [.], ack 389740, win 65535, length 0
20:13:57.693210 IP 142.250.65.174.443 > 10.0.2.15.44576: Flags [P.], seq 389740:399272, ack 822, win 65535, length 9532
20:13:57.693220 IP 10.0.2.15.44576 > 142.250.65.174.443: Flags [.], ack 399272, win 65535, length 0
20:13:57.696172 IP 142.250.65.174.443 > 10.0.2.15.44576: Flags [P.], seq 399272:411638, ack 822, win 65535, length 12366
20:13:57.696312 IP 10.0.2.15.44576 > 142.250.65.174.443: Flags [.], ack 411638, win 65535, length 0
20:13:57.696578 IP 142.250.65.174.443 > 10.0.2.15.44576: Flags [P.], seq 411638:419882, ack 822, win 65535, length 8244
20:13:57.696581 IP 142.250.65.174.443 > 10.0.2.15.44576: Flags [P.], seq 419882:424004, ack 822, win 65535, length 4122
20:13:57.696641 IP 10.0.2.15.44576 > 142.250.65.174.443: Flags [.], ack 419882, win 65535, length 0
20:13:57.696670 IP 10.0.2.15.44576 > 142.250.65.174.443: Flags [.], ack 424004, win 65535, length 0
20:13:57.696696 IP 142.250.65.174.443 > 10.0.2.15.44576: Flags [P.], seq 424004:428126, ack 822, win 65535, length 4122
20:13:57.696847 IP 10.0.2.15.44576 > 142.250.65.174.443: Flags [.], ack 428126, win 65535, length 0
20:13:57.697311 IP 142.250.65.174.443 > 10.0.2.15.44576: Flags [P.], seq 428126:434996, ack 822, win 65535, length 6870
20:13:57.697315 IP 142.250.65.174.443 > 10.0.2.15.44576: Flags [P.], seq 434996:439118, ack 822, win 65535, length 4122
20:13:57.697332 IP 10.0.2.15.44576 > 142.250.65.174.443: Flags [.], ack 434996, win 65535, length 0
20:13:57.697404 IP 10.0.2.15.44576 > 142.250.65.174.443: Flags [.], ack 439118, win 65535, length 0
20:13:57.697476 IP 142.250.65.174.443 > 10.0.2.15.44576: Flags [P.], seq 439118:443240, ack 822, win 65535, length 4122
20:13:57.697477 IP 142.250.65.174.443 > 10.0.2.15.44576: Flags [.], seq 443240:444700, ack 822, win 65535, length 1460
20:13:57.697486 IP 10.0.2.15.44576 > 142.250.65.174.443: Flags [.], ack 443240, win 65535, length 0
20:13:57.697500 IP 10.0.2.15.44576 > 142.250.65.174.443: Flags [.], ack 444700, win 65535, length 0
20:13:57.697646 IP 142.250.65.174.443 > 10.0.2.15.44576: Flags [P.], seq 444700:445988, ack 822, win 65535, length 1288
20:13:57.697770 IP 10.0.2.15.44576 > 142.250.65.174.443: Flags [.], ack 445988, win 65535, length 0
20:13:57.697960 IP 142.250.65.174.443 > 10.0.2.15.44576: Flags [P.], seq 445988:448736, ack 822, win 65535, length 2748
20:13:57.697962 IP 142.250.65.174.443 > 10.0.2.15.44576: Flags [P.], seq 448736:451484, ack 822, win 65535, length 2748
20:13:57.698186 IP 10.0.2.15.44576 > 142.250.65.174.443: Flags [.], ack 448736, win 65535, length 0
20:13:57.698215 IP 10.0.2.15.44576 > 142.250.65.174.443: Flags [.], ack 451484, win 65535, length 0
20:13:57.698515 IP 142.250.65.174.443 > 10.0.2.15.44576: Flags [P.], seq 451484:455606, ack 822, win 65535, length 4122
20:13:57.698517 IP 142.250.65.174.443 > 10.0.2.15.44576: Flags [P.], seq 455606:456980, ack 822, win 65535, length 1374
20:13:57.698612 IP 10.0.2.15.44576 > 142.250.65.174.443: Flags [.], ack 455606, win 65535, length 0
20:13:57.698631 IP 10.0.2.15.44576 > 142.250.65.174.443: Flags [.], ack 456980, win 65535, length 0
20:13:57.698769 IP 142.250.65.174.443 > 10.0.2.15.44576: Flags [P.], seq 456980:462476, ack 822, win 65535, length 5496
20:13:57.698769 IP 142.250.65.174.443 > 10.0.2.15.44576: Flags [P.], seq 462476:463850, ack 822, win 65535, length 1374
20:13:57.698776 IP 10.0.2.15.44576 > 142.250.65.174.443: Flags [.], ack 462476, win 65535, length 0
20:13:57.698788 IP 10.0.2.15.44576 > 142.250.65.174.443: Flags [.], ack 463850, win 65535, length 0
20:13:57.699420 IP 142.250.65.174.443 > 10.0.2.15.44576: Flags [P.], seq 463850:467972, ack 822, win 65535, length 4122
20:13:57.699422 IP 142.250.65.174.443 > 10.0.2.15.44576: Flags [P.], seq 467972:469346, ack 822, win 65535, length 1374
20:13:57.699502 IP 10.0.2.15.44576 > 142.250.65.174.443: Flags [.], ack 467972, win 65535, length 0
20:13:57.699518 IP 10.0.2.15.44576 > 142.250.65.174.443: Flags [.], ack 469346, win 65535, length 0
20:13:57.699645 IP 142.250.65.174.443 > 10.0.2.15.44576: Flags [P.], seq 469346:474842, ack 822, win 65535, length 5496
20:13:57.699650 IP 10.0.2.15.44576 > 142.250.65.174.443: Flags [.], ack 474842, win 65535, length 0
20:13:57.699787 IP 142.250.65.174.443 > 10.0.2.15.44576: Flags [P.], seq 474842:477590, ack 822, win 65535, length 2748
20:13:57.699792 IP 10.0.2.15.44576 > 142.250.65.174.443: Flags [.], ack 477590, win 65535, length 0
20:13:57.700225 IP 142.250.65.174.443 > 10.0.2.15.44576: Flags [P.], seq 477590:480338, ack 822, win 65535, length 2748
20:13:57.700226 IP 142.250.65.174.443 > 10.0.2.15.44576: Flags [P.], seq 480338:484460, ack 822, win 65535, length 4122
20:13:57.700240 IP 10.0.2.15.44576 > 142.250.65.174.443: Flags [.], ack 480338, win 65535, length 0
20:13:57.700287 IP 10.0.2.15.44576 > 142.250.65.174.443: Flags [.], ack 484460, win 65535, length 0
20:13:57.700469 IP 142.250.65.174.443 > 10.0.2.15.44576: Flags [P.], seq 484460:488582, ack 822, win 65535, length 4122
20:13:57.700470 IP 142.250.65.174.443 > 10.0.2.15.44576: Flags [P.], seq 488582:491330, ack 822, win 65535, length 2748
20:13:57.700477 IP 10.0.2.15.44576 > 142.250.65.174.443: Flags [.], ack 488582, win 65535, length 0
20:13:57.700487 IP 10.0.2.15.44576 > 142.250.65.174.443: Flags [.], ack 491330, win 65535, length 0
20:13:57.700601 IP 142.250.65.174.443 > 10.0.2.15.44576: Flags [P.], seq 491330:494078, ack 822, win 65535, length 2748
20:13:57.700609 IP 10.0.2.15.44576 > 142.250.65.174.443: Flags [.], ack 494078, win 65535, length 0

