20:14:54.096996 IP 10.0.2.15.54919 > 140.233.253.2.53: 64984+ A? www.youtube.com. (33)
20:14:54.097034 IP 10.0.2.15.54919 > 140.233.253.2.53: 26334+ AAAA? www.youtube.com. (33)
20:14:54.168643 IP 140.233.253.2.53 > 10.0.2.15.54919: 64984 17/0/0 CNAME youtube-ui.l.google.com., A 142.251.40.238, A 142.251.41.14, A 142.250.176.206, A 142.250.64.78, A 142.250.64.110, A 142.250.72.110, A 142.250.80.14, A 142.250.80.46, A 142.250.80.78, A 142.250.80.110, A 172.217.165.142, A 142.250.65.174, A 142.250.65.206, A 142.251.32.110, A 142.251.35.174, A 142.251.40.206 (323)
20:14:54.168646 IP 140.233.253.2.53 > 10.0.2.15.54919: 26334 5/0/0 CNAME youtube-ui.l.google.com., AAAA 2607:f8b0:4006:822::200e, AAAA 2607:f8b0:4006:823::200e, AAAA 2607:f8b0:4006:81d::200e, AAAA 2607:f8b0:4006:81e::200e (179)
20:14:54.169207 IP 10.0.2.15.54912 > 142.251.40.238.443: Flags [S], seq 2222369416, win 64240, options [mss 1460,sackOK,TS val 4272150884 ecr 0,nop,wscale 6], length 0
20:14:54.182620 IP 142.251.40.238.443 > 10.0.2.15.54912: Flags [S.], seq 241728001, ack 2222369417, win 65535, options [mss 1460], length 0
20:14:54.182669 IP 10.0.2.15.54912 > 142.251.40.238.443: Flags [.], ack 1, win 64240, length 0
20:14:54.195182 IP 10.0.2.15.54912 > 142.251.40.238.443: Flags [P.], seq 1:518, ack 1, win 64240, length 517
20:14:54.195520 IP 142.251.40.238.443 > 10.0.2.15.54912: Flags [.], ack 518, win 65535, length 0
20:14:54.217048 IP 142.251.40.238.443 > 10.0.2.15.54912: Flags [P.], seq 1:2749, ack 518, win 65535, length 2748
20:14:54.217190 IP 10.0.2.15.54912 > 142.251.40.238.443: Flags [.], ack 2749, win 62780, length 0
20:14:54.219035 IP 142.251.40.238.443 > 10.0.2.15.54912: Flags [P.], seq 2749:6651, ack 518, win 65535, length 3902
20:14:54.219137 IP 10.0.2.15.54912 > 142.251.40.238.443: Flags [.], ack 6651, win 61320, length 0
20:14:54.220399 IP 10.0.2.15.54912 > 142.251.40.238.443: Flags [P.], seq 518:598, ack 6651, win 62780, length 80
20:14:54.220696 IP 142.251.40.238.443 > 10.0.2.15.54912: Flags [.], ack 598, win 65535, length 0
20:14:54.220833 IP 10.0.2.15.54912 > 142.251.40.238.443: Flags [P.], seq 598:644, ack 6651, win 62780, length 46
20:14:54.220864 IP 10.0.2.15.54912 > 142.251.40.238.443: Flags [P.], seq 644:693, ack 6651, win 62780, length 49
20:14:54.221254 IP 142.251.40.238.443 > 10.0.2.15.54912: Flags [.], ack 644, win 65535, length 0
20:14:54.221255 IP 142.251.40.238.443 > 10.0.2.15.54912: Flags [.], ack 693, win 65535, length 0
20:14:54.221275 IP 10.0.2.15.54912 > 142.251.40.238.443: Flags [P.], seq 693:728, ack 6651, win 62780, length 35
20:14:54.221360 IP 10.0.2.15.54912 > 142.251.40.238.443: Flags [P.], seq 728:791, ack 6651, win 62780, length 63
20:14:54.221599 IP 142.251.40.238.443 > 10.0.2.15.54912: Flags [.], ack 728, win 65535, length 0
20:14:54.221600 IP 142.251.40.238.443 > 10.0.2.15.54912: Flags [.], ack 791, win 65535, length 0
20:14:54.233739 IP 142.251.40.238.443 > 10.0.2.15.54912: Flags [P.], seq 6651:7324, ack 791, win 65535, length 673
20:14:54.233770 IP 10.0.2.15.54912 > 142.251.40.238.443: Flags [.], ack 7324, win 62780, length 0
20:14:54.234647 IP 10.0.2.15.54912 > 142.251.40.238.443: Flags [P.], seq 791:822, ack 7324, win 62780, length 31
20:14:54.235187 IP 142.251.40.238.443 > 10.0.2.15.54912: Flags [.], ack 822, win 65535, length 0
20:14:54.268385 IP 142.251.40.238.443 > 10.0.2.15.54912: Flags [P.], seq 7324:11114, ack 822, win 65535, length 3790
20:14:54.268408 IP 10.0.2.15.54912 > 142.251.40.238.443: Flags [.], ack 11114, win 61320, length 0
20:14:54.269009 IP 142.251.40.238.443 > 10.0.2.15.54912: Flags [P.], seq 11114:13862, ack 822, win 65535, length 2748
20:14:54.269023 IP 10.0.2.15.54912 > 142.251.40.238.443: Flags [.], ack 13862, win 62780, length 0
20:14:54.270511 IP 142.251.40.238.443 > 10.0.2.15.54912: Flags [P.], seq 13862:17350, ack 822, win 65535, length 3488
20:14:54.270534 IP 10.0.2.15.54912 > 142.251.40.238.443: Flags [.], ack 17350, win 61320, length 0
20:14:54.274786 IP 142.251.40.238.443 > 10.0.2.15.54912: Flags [P.], seq 17350:22846, ack 822, win 65535, length 5496
20:14:54.274892 IP 10.0.2.15.54912 > 142.251.40.238.443: Flags [.], ack 22846, win 61320, length 0
20:14:54.275483 IP 142.251.40.238.443 > 10.0.2.15.54912: Flags [P.], seq 22846:25594, ack 822, win 65535, length 2748
20:14:54.275494 IP 10.0.2.15.54912 > 142.251.40.238.443: Flags [.], ack 25594, win 62780, length 0
20:14:54.276820 IP 142.251.40.238.443 > 10.0.2.15.54912: Flags [P.], seq 25594:28342, ack 822, win 65535, length 2748
20:14:54.276839 IP 10.0.2.15.54912 > 142.251.40.238.443: Flags [.], ack 28342, win 62780, length 0
20:14:54.277868 IP 142.251.40.238.443 > 10.0.2.15.54912: Flags [P.], seq 28342:29716, ack 822, win 65535, length 1374
20:14:54.277882 IP 10.0.2.15.54912 > 142.251.40.238.443: Flags [.], ack 29716, win 62780, length 0
20:14:54.280375 IP 142.251.40.238.443 > 10.0.2.15.54912: Flags [P.], seq 29716:33838, ack 822, win 65535, length 4122
20:14:54.280465 IP 10.0.2.15.54912 > 142.251.40.238.443: Flags [.], ack 33838, win 61320, length 0
20:14:54.281054 IP 142.251.40.238.443 > 10.0.2.15.54912: Flags [P.], seq 33838:36586, ack 822, win 65535, length 2748
20:14:54.281069 IP 10.0.2.15.54912 > 142.251.40.238.443: Flags [.], ack 36586, win 62780, length 0
20:14:54.282336 IP 142.251.40.238.443 > 10.0.2.15.54912: Flags [P.], seq 36586:40708, ack 822, win 65535, length 4122
20:14:54.282438 IP 10.0.2.15.54912 > 142.251.40.238.443: Flags [.], ack 40708, win 61320, length 0
20:14:54.283221 IP 142.251.40.238.443 > 10.0.2.15.54912: Flags [P.], seq 40708:44830, ack 822, win 65535, length 4122
20:14:54.283235 IP 10.0.2.15.54912 > 142.251.40.238.443: Flags [.], ack 44830, win 61320, length 0
20:14:54.284092 IP 142.251.40.238.443 > 10.0.2.15.54912: Flags [P.], seq 44830:47578, ack 822, win 65535, length 2748
20:14:54.284106 IP 10.0.2.15.54912 > 142.251.40.238.443: Flags [.], ack 47578, win 62780, length 0
20:14:54.286931 IP 142.251.40.238.443 > 10.0.2.15.54912: Flags [P.], seq 47578:53074, ack 822, win 65535, length 5496
20:14:54.287018 IP 10.0.2.15.54912 > 142.251.40.238.443: Flags [.], ack 53074, win 61320, length 0
20:14:54.287533 IP 142.251.40.238.443 > 10.0.2.15.54912: Flags [P.], seq 53074:55822, ack 822, win 65535, length 2748
20:14:54.287546 IP 10.0.2.15.54912 > 142.251.40.238.443: Flags [.], ack 55822, win 62780, length 0
20:14:54.289023 IP 142.251.40.238.443 > 10.0.2.15.54912: Flags [P.], seq 55822:58570, ack 822, win 65535, length 2748
20:14:54.289042 IP 10.0.2.15.54912 > 142.251.40.238.443: Flags [.], ack 58570, win 62780, length 0
20:14:54.290229 IP 142.251.40.238.443 > 10.0.2.15.54912: Flags [P.], seq 58570:64066, ack 822, win 65535, length 5496
20:14:54.290302 IP 10.0.2.15.54912 > 142.251.40.238.443: Flags [.], ack 64066, win 61320, length 0
20:14:54.291297 IP 142.251.40.238.443 > 10.0.2.15.54912: Flags [P.], seq 64066:66814, ack 822, win 65535, length 2748
20:14:54.291312 IP 10.0.2.15.54912 > 142.251.40.238.443: Flags [.], ack 66814, win 62780, length 0
20:14:54.292346 IP 142.251.40.238.443 > 10.0.2.15.54912: Flags [P.], seq 66814:70936, ack 822, win 65535, length 4122
20:14:54.292478 IP 10.0.2.15.54912 > 142.251.40.238.443: Flags [.], ack 70936, win 62780, length 0
20:14:54.293689 IP 142.251.40.238.443 > 10.0.2.15.54912: Flags [P.], seq 70936:76432, ack 822, win 65535, length 5496
20:14:54.293710 IP 10.0.2.15.54912 > 142.251.40.238.443: Flags [.], ack 76432, win 65535, length 0
20:14:54.294515 IP 142.251.40.238.443 > 10.0.2.15.54912: Flags [P.], seq 76432:80554, ack 822, win 65535, length 4122
20:14:54.294527 IP 10.0.2.15.54912 > 142.251.40.238.443: Flags [.], ack 80554, win 65535, length 0
20:14:54.295825 IP 142.251.40.238.443 > 10.0.2.15.54912: Flags [P.], seq 80554:90172, ack 822, win 65535, length 9618
20:14:54.295894 IP 10.0.2.15.54912 > 142.251.40.238.443: Flags [.], ack 90172, win 65535, length 0
20:14:54.296729 IP 142.251.40.238.443 > 10.0.2.15.54912: Flags [P.], seq 90172:92920, ack 822, win 65535, length 2748
20:14:54.296819 IP 10.0.2.15.54912 > 142.251.40.238.443: Flags [.], ack 92920, win 65535, length 0
20:14:54.298014 IP 142.251.40.238.443 > 10.0.2.15.54912: Flags [P.], seq 92920:99790, ack 822, win 65535, length 6870
20:14:54.298016 IP 142.251.40.238.443 > 10.0.2.15.54912: Flags [P.], seq 99790:102538, ack 822, win 65535, length 2748
20:14:54.298038 IP 10.0.2.15.54912 > 142.251.40.238.443: Flags [.], ack 99790, win 65535, length 0
20:14:54.298066 IP 10.0.2.15.54912 > 142.251.40.238.443: Flags [.], ack 102538, win 65535, length 0
20:14:54.298146 IP 142.251.40.238.443 > 10.0.2.15.54912: Flags [P.], seq 102538:103912, ack 822, win 65535, length 1374
20:14:54.298150 IP 10.0.2.15.54912 > 142.251.40.238.443: Flags [.], ack 103912, win 65535, length 0
20:14:54.298788 IP 142.251.40.238.443 > 10.0.2.15.54912: Flags [P.], seq 103912:109408, ack 822, win 65535, length 5496
20:14:54.298800 IP 10.0.2.15.54912 > 142.251.40.238.443: Flags [.], ack 109408, win 65535, length 0
20:14:54.299952 IP 142.251.40.238.443 > 10.0.2.15.54912: Flags [P.], seq 109408:114904, ack 822, win 65535, length 5496
20:14:54.299969 IP 10.0.2.15.54912 > 142.251.40.238.443: Flags [.], ack 114904, win 65535, length 0
20:14:54.301070 IP 142.251.40.238.443 > 10.0.2.15.54912: Flags [P.], seq 114904:121774, ack 822, win 65535, length 6870
20:14:54.301089 IP 10.0.2.15.54912 > 142.251.40.238.443: Flags [.], ack 121774, win 65535, length 0
20:14:54.302049 IP 142.251.40.238.443 > 10.0.2.15.54912: Flags [P.], seq 121774:128644, ack 822, win 65535, length 6870
20:14:54.302051 IP 142.251.40.238.443 > 10.0.2.15.54912: Flags [P.], seq 128644:130018, ack 822, win 65535, length 1374
20:14:54.302075 IP 10.0.2.15.54912 > 142.251.40.238.443: Flags [.], ack 128644, win 65535, length 0
20:14:54.302107 IP 10.0.2.15.54912 > 142.251.40.238.443: Flags [.], ack 130018, win 65535, length 0
20:14:54.303174 IP 142.251.40.238.443 > 10.0.2.15.54912: Flags [P.], seq 130018:134140, ack 822, win 65535, length 4122
20:14:54.303176 IP 142.251.40.238.443 > 10.0.2.15.54912: Flags [P.], seq 134140:138262, ack 822, win 65535, length 4122
20:14:54.303178 IP 142.251.40.238.443 > 10.0.2.15.54912: Flags [P.], seq 138262:142384, ack 822, win 65535, length 4122
20:14:54.303194 IP 10.0.2.15.54912 > 142.251.40.238.443: Flags [.], ack 134140, win 65535, length 0
20:14:54.303226 IP 10.0.2.15.54912 > 142.251.40.238.443: Flags [.], ack 138262, win 65535, length 0
20:14:54.303240 IP 10.0.2.15.54912 > 142.251.40.238.443: Flags [.], ack 142384, win 65535, length 0
20:14:54.304343 IP 142.251.40.238.443 > 10.0.2.15.54912: Flags [P.], seq 142384:149254, ack 822, win 65535, length 6870
20:14:54.304358 IP 10.0.2.15.54912 > 142.251.40.238.443: Flags [.], ack 149254, win 65535, length 0
20:14:54.305780 IP 142.251.40.238.443 > 10.0.2.15.54912: Flags [P.], seq 149254:158872, ack 822, win 65535, length 9618
20:14:54.305799 IP 10.0.2.15.54912 > 142.251.40.238.443: Flags [.], ack 158872, win 65535, length 0
20:14:54.306624 IP 142.251.40.238.443 > 10.0.2.15.54912: Flags [P.], seq 158872:167116, ack 822, win 65535, length 8244
20:14:54.306640 IP 10.0.2.15.54912 > 142.251.40.238.443: Flags [.], ack 167116, win 65535, length 0
20:14:54.307781 IP 142.251.40.238.443 > 10.0.2.15.54912: Flags [P.], seq 167116:172612, ack 822, win 65535, length 5496
20:14:54.307800 IP 10.0.2.15.54912 > 142.251.40.238.443: Flags [.], ack 172612, win 65535, length 0
20:14:54.309949 IP 142.251.40.238.443 > 10.0.2.15.54912: Flags [.], seq 172612:178452, ack 822, win 65535, length 5840
20:14:54.309972 IP 10.0.2.15.54912 > 142.251.40.238.443: Flags [.], ack 178452, win 65535, length 0
20:14:54.310326 IP 142.251.40.238.443 > 10.0.2.15.54912: Flags [P.], seq 178452:183604, ack 822, win 65535, length 5152
20:14:54.310330 IP 142.251.40.238.443 > 10.0.2.15.54912: Flags [P.], seq 183604:197344, ack 822, win 65535, length 13740
20:14:54.310345 IP 10.0.2.15.54912 > 142.251.40.238.443: Flags [.], ack 183604, win 65535, length 0
20:14:54.310372 IP 10.0.2.15.54912 > 142.251.40.238.443: Flags [.], ack 197344, win 65535, length 0
20:14:54.310411 IP 142.251.40.238.443 > 10.0.2.15.54912: Flags [P.], seq 197344:201466, ack 822, win 65535, length 4122
20:14:54.310419 IP 10.0.2.15.54912 > 142.251.40.238.443: Flags [.], ack 201466, win 65535, length 0
20:14:54.312720 IP 142.251.40.238.443 > 10.0.2.15.54912: Flags [P.], seq 201466:209710, ack 822, win 65535, length 8244
20:14:54.312723 IP 142.251.40.238.443 > 10.0.2.15.54912: Flags [P.], seq 209710:215206, ack 822, win 65535, length 5496
20:14:54.312746 IP 10.0.2.15.54912 > 142.251.40.238.443: Flags [.], ack 209710, win 65535, length 0
20:14:54.312777 IP 10.0.2.15.54912 > 142.251.40.238.443: Flags [.], ack 215206, win 65535, length 0
20:14:54.312803 IP 142.251.40.238.443 > 10.0.2.15.54912: Flags [P.], seq 215206:220702, ack 822, win 65535, length 5496
20:14:54.312808 IP 10.0.2.15.54912 > 142.251.40.238.443: Flags [.], ack 220702, win 65535, length 0
20:14:54.314119 IP 142.251.40.238.443 > 10.0.2.15.54912: Flags [P.], seq 220702:221557, ack 822, win 65535, length 855
20:14:54.314138 IP 10.0.2.15.54912 > 142.251.40.238.443: Flags [.], ack 221557, win 65535, length 0
20:14:54.449933 IP 142.251.40.238.443 > 10.0.2.15.54912: Flags [P.], seq 221557:221750, ack 822, win 65535, length 193
20:14:54.449963 IP 10.0.2.15.54912 > 142.251.40.238.443: Flags [.], ack 221750, win 65535, length 0
20:14:54.466574 IP 142.251.40.238.443 > 10.0.2.15.54912: Flags [P.], seq 221750:229994, ack 822, win 65535, length 8244
20:14:54.466576 IP 142.251.40.238.443 > 10.0.2.15.54912: Flags [P.], seq 229994:234116, ack 822, win 65535, length 4122
20:14:54.466615 IP 10.0.2.15.54912 > 142.251.40.238.443: Flags [.], ack 229994, win 65535, length 0
20:14:54.466868 IP 10.0.2.15.54912 > 142.251.40.238.443: Flags [.], ack 234116, win 65535, length 0
20:14:54.466902 IP 142.251.40.238.443 > 10.0.2.15.54912: Flags [P.], seq 234116:238238, ack 822, win 65535, length 4122
20:14:54.466903 IP 142.251.40.238.443 > 10.0.2.15.54912: Flags [P.], seq 238238:240986, ack 822, win 65535, length 2748
20:14:54.466914 IP 10.0.2.15.54912 > 142.251.40.238.443: Flags [.], ack 238238, win 65535, length 0
20:14:54.466931 IP 10.0.2.15.54912 > 142.251.40.238.443: Flags [.], ack 240986, win 65535, length 0
20:14:54.467267 IP 142.251.40.238.443 > 10.0.2.15.54912: Flags [P.], seq 240986:242360, ack 822, win 65535, length 1374
20:14:54.467280 IP 10.0.2.15.54912 > 142.251.40.238.443: Flags [.], ack 242360, win 65535, length 0
20:14:54.468718 IP 142.251.40.238.443 > 10.0.2.15.54912: Flags [P.], seq 242360:251978, ack 822, win 65535, length 9618
20:14:54.468721 IP 142.251.40.238.443 > 10.0.2.15.54912: Flags [P.], seq 251978:253352, ack 822, win 65535, length 1374
20:14:54.468947 IP 10.0.2.15.54912 > 142.251.40.238.443: Flags [.], ack 251978, win 65535, length 0
20:14:54.468999 IP 10.0.2.15.54912 > 142.251.40.238.443: Flags [.], ack 253352, win 65535, length 0
20:14:54.469029 IP 142.251.40.238.443 > 10.0.2.15.54912: Flags [.], seq 253352:254812, ack 822, win 65535, length 1460
20:14:54.469036 IP 10.0.2.15.54912 > 142.251.40.238.443: Flags [.], ack 254812, win 65535, length 0
20:14:54.469249 IP 142.251.40.238.443 > 10.0.2.15.54912: Flags [P.], seq 254812:259208, ack 822, win 65535, length 4396
20:14:54.469251 IP 142.251.40.238.443 > 10.0.2.15.54912: Flags [P.], seq 259208:264704, ack 822, win 65535, length 5496
20:14:54.469304 IP 10.0.2.15.54912 > 142.251.40.238.443: Flags [.], ack 259208, win 65535, length 0
20:14:54.469444 IP 10.0.2.15.54912 > 142.251.40.238.443: Flags [.], ack 264704, win 65535, length 0
20:14:54.469489 IP 142.251.40.238.443 > 10.0.2.15.54912: Flags [P.], seq 264704:267452, ack 822, win 65535, length 2748
20:14:54.469499 IP 10.0.2.15.54912 > 142.251.40.238.443: Flags [.], ack 267452, win 65535, length 0
20:14:54.469857 IP 142.251.40.238.443 > 10.0.2.15.54912: Flags [P.], seq 267452:271574, ack 822, win 65535, length 4122
20:14:54.469875 IP 10.0.2.15.54912 > 142.251.40.238.443: Flags [.], ack 271574, win 65535, length 0
20:14:54.470457 IP 142.251.40.238.443 > 10.0.2.15.54912: Flags [P.], seq 271574:274322, ack 822, win 65535, length 2748
20:14:54.470460 IP 142.251.40.238.443 > 10.0.2.15.54912: Flags [P.], seq 274322:279818, ack 822, win 65535, length 5496
20:14:54.470462 IP 142.251.40.238.443 > 10.0.2.15.54912: Flags [P.], seq 279818:285314, ack 822, win 65535, length 5496
20:14:54.470528 IP 10.0.2.15.54912 > 142.251.40.238.443: Flags [.], ack 274322, win 65535, length 0
20:14:54.470559 IP 10.0.2.15.54912 > 142.251.40.238.443: Flags [.], ack 279818, win 65535, length 0
20:14:54.470625 IP 10.0.2.15.54912 > 142.251.40.238.443: Flags [.], ack 285314, win 65535, length 0
20:14:54.470650 IP 142.251.40.238.443 > 10.0.2.15.54912: Flags [P.], seq 285314:288062, ack 822, win 65535, length 2748
20:14:54.470656 IP 10.0.2.15.54912 > 142.251.40.238.443: Flags [.], ack 288062, win 65535, length 0
20:14:54.470943 IP 142.251.40.238.443 > 10.0.2.15.54912: Flags [P.], seq 288062:292184, ack 822, win 65535, length 4122
20:14:54.470945 IP 142.251.40.238.443 > 10.0.2.15.54912: Flags [P.], seq 292184:293558, ack 822, win 65535, length 1374
20:14:54.470965 IP 10.0.2.15.54912 > 142.251.40.238.443: Flags [.], ack 292184, win 65535, length 0
20:14:54.471052 IP 10.0.2.15.54912 > 142.251.40.238.443: Flags [.], ack 293558, win 65535, length 0
20:14:54.471219 IP 142.251.40.238.443 > 10.0.2.15.54912: Flags [P.], seq 293558:297680, ack 822, win 65535, length 4122
20:14:54.471231 IP 10.0.2.15.54912 > 142.251.40.238.443: Flags [.], ack 297680, win 65535, length 0
20:14:54.471402 IP 142.251.40.238.443 > 10.0.2.15.54912: Flags [P.], seq 297680:303176, ack 822, win 65535, length 5496
20:14:54.471412 IP 10.0.2.15.54912 > 142.251.40.238.443: Flags [.], ack 303176, win 65535, length 0
20:14:54.472575 IP 142.251.40.238.443 > 10.0.2.15.54912: Flags [P.], seq 303176:310046, ack 822, win 65535, length 6870
20:14:54.472579 IP 142.251.40.238.443 > 10.0.2.15.54912: Flags [P.], seq 310046:314168, ack 822, win 65535, length 4122
20:14:54.472610 IP 10.0.2.15.54912 > 142.251.40.238.443: Flags [.], ack 310046, win 65535, length 0
20:14:54.472646 IP 10.0.2.15.54912 > 142.251.40.238.443: Flags [.], ack 314168, win 65535, length 0
20:14:54.475263 IP 142.251.40.238.443 > 10.0.2.15.54912: Flags [P.], seq 314168:318290, ack 822, win 65535, length 4122
20:14:54.475274 IP 142.251.40.238.443 > 10.0.2.15.54912: Flags [P.], seq 318290:326534, ack 822, win 65535, length 8244
20:14:54.475812 IP 142.251.40.238.443 > 10.0.2.15.54912: Flags [P.], seq 326534:332030, ack 822, win 65535, length 5496
20:14:54.475815 IP 142.251.40.238.443 > 10.0.2.15.54912: Flags [P.], seq 332030:334778, ack 822, win 65535, length 2748
20:14:54.475816 IP 142.251.40.238.443 > 10.0.2.15.54912: Flags [P.], seq 334778:337526, ack 822, win 65535, length 2748
20:14:54.476236 IP 142.251.40.238.443 > 10.0.2.15.54912: Flags [P.], seq 337526:338900, ack 822, win 65535, length 1374
20:14:54.476521 IP 142.251.40.238.443 > 10.0.2.15.54912: Flags [P.], seq 338900:344396, ack 822, win 65535, length 5496
20:14:54.478032 IP 10.0.2.15.54912 > 142.251.40.238.443: Flags [.], ack 338900, win 65535, length 0
20:14:54.478061 IP 10.0.2.15.54912 > 142.251.40.238.443: Flags [.], ack 344396, win 65535, length 0
20:14:54.482211 IP 142.251.40.238.443 > 10.0.2.15.54912: Flags [P.], seq 344396:354014, ack 822, win 65535, length 9618
20:14:54.482215 IP 142.251.40.238.443 > 10.0.2.15.54912: Flags [.], seq 354014:355474, ack 822, win 65535, length 1460
20:14:54.482243 IP 10.0.2.15.54912 > 142.251.40.238.443: Flags [.], ack 354014, win 65535, length 0
20:14:54.482455 IP 10.0.2.15.54912 > 142.251.40.238.443: Flags [.], ack 355474, win 65535, length 0
20:14:54.482772 IP 142.251.40.238.443 > 10.0.2.15.54912: Flags [P.], seq 355474:359510, ack 822, win 65535, length 4036
20:14:54.482775 IP 142.251.40.238.443 > 10.0.2.15.54912: Flags [P.], seq 359510:366380, ack 822, win 65535, length 6870
20:14:54.482790 IP 10.0.2.15.54912 > 142.251.40.238.443: Flags [.], ack 359510, win 65535, length 0
20:14:54.482816 IP 10.0.2.15.54912 > 142.251.40.238.443: Flags [.], ack 366380, win 65535, length 0
20:14:54.482836 IP 142.251.40.238.443 > 10.0.2.15.54912: Flags [P.], seq 366380:369128, ack 822, win 65535, length 2748
20:14:54.482837 IP 142.251.40.238.443 > 10.0.2.15.54912: Flags [P.], seq 369128:371876, ack 822, win 65535, length 2748
20:14:54.482838 IP 142.251.40.238.443 > 10.0.2.15.54912: Flags [P.], seq 371876:374624, ack 822, win 65535, length 2748
20:14:54.482839 IP 142.251.40.238.443 > 10.0.2.15.54912: Flags [P.], seq 374624:377372, ack 822, win 65535, length 2748
20:14:54.482847 IP 10.0.2.15.54912 > 142.251.40.238.443: Flags [.], ack 369128, win 65535, length 0
20:14:54.482864 IP 10.0.2.15.54912 > 142.251.40.238.443: Flags [.], ack 371876, win 65535, length 0
20:14:54.482879 IP 10.0.2.15.54912 > 142.251.40.238.443: Flags [.], ack 374624, win 65535, length 0
20:14:54.482892 IP 10.0.2.15.54912 > 142.251.40.238.443: Flags [.], ack 377372, win 65535, length 0
20:14:54.483845 IP 142.251.40.238.443 > 10.0.2.15.54912: Flags [P.], seq 377372:382868, ack 822, win 65535, length 5496
20:14:54.483909 IP 142.251.40.238.443 > 10.0.2.15.54912: Flags [P.], seq 382868:396608, ack 822, win 65535, length 13740
20:14:54.484081 IP 10.0.2.15.54912 > 142.251.40.238.443: Flags [.], ack 382868, win 65535, length 0
20:14:54.484104 IP 10.0.2.15.54912 > 142.251.40.238.443: Flags [.], ack 396608, win 65535, length 0
20:14:54.484134 IP 142.251.40.238.443 > 10.0.2.15.54912: Flags [P.], seq 396608:397982, ack 822, win 65535, length 1374
20:14:54.484136 IP 142.251.40.238.443 > 10.0.2.15.54912: Flags [P.], seq 397982:403478, ack 822, win 65535, length 5496
20:14:54.484137 IP 142.251.40.238.443 > 10.0.2.15.54912: Flags [P.], seq 403478:407600, ack 822, win 65535, length 4122
20:14:54.484143 IP 10.0.2.15.54912 > 142.251.40.238.443: Flags [.], ack 397982, win 65535, length 0
20:14:54.484154 IP 10.0.2.15.54912 > 142.251.40.238.443: Flags [.], ack 403478, win 65535, length 0
20:14:54.484195 IP 10.0.2.15.54912 > 142.251.40.238.443: Flags [.], ack 407600, win 65535, length 0
20:14:54.484213 IP 142.251.40.238.443 > 10.0.2.15.54912: Flags [P.], seq 407600:410348, ack 822, win 65535, length 2748
20:14:54.484216 IP 10.0.2.15.54912 > 142.251.40.238.443: Flags [.], ack 410348, win 65535, length 0
20:14:54.484796 IP 142.251.40.238.443 > 10.0.2.15.54912: Flags [P.], seq 410348:415844, ack 822, win 65535, length 5496
20:14:54.484807 IP 10.0.2.15.54912 > 142.251.40.238.443: Flags [.], ack 415844, win 65535, length 0
20:14:54.484939 IP 142.251.40.238.443 > 10.0.2.15.54912: Flags [P.], seq 415844:417218, ack 822, win 65535, length 1374
20:14:54.484940 IP 142.251.40.238.443 > 10.0.2.15.54912: Flags [P.], seq 417218:421340, ack 822, win 65535, length 4122
20:14:54.484948 IP 10.0.2.15.54912 > 142.251.40.238.443: Flags [.], ack 417218, win 65535, length 0
20:14:54.485004 IP 10.0.2.15.54912 > 142.251.40.238.443: Flags [.], ack 421340, win 65535, length 0
20:14:54.485079 IP 142.251.40.238.443 > 10.0.2.15.54912: Flags [P.], seq 421340:422714, ack 822, win 65535, length 1374
20:14:54.485162 IP 10.0.2.15.54912 > 142.251.40.238.443: Flags [.], ack 422714, win 65535, length 0
20:14:54.486011 IP 142.251.40.238.443 > 10.0.2.15.54912: Flags [P.], seq 422714:425462, ack 822, win 65535, length 2748
20:14:54.486014 IP 142.251.40.238.443 > 10.0.2.15.54912: Flags [P.], seq 425462:430958, ack 822, win 65535, length 5496
20:14:54.486035 IP 10.0.2.15.54912 > 142.251.40.238.443: Flags [.], ack 425462, win 65535, length 0
20:14:54.486068 IP 10.0.2.15.54912 > 142.251.40.238.443: Flags [.], ack 430958, win 65535, length 0
20:14:54.486272 IP 142.251.40.238.443 > 10.0.2.15.54912: Flags [P.], seq 430958:436454, ack 822, win 65535, length 5496
20:14:54.486274 IP 142.251.40.238.443 > 10.0.2.15.54912: Flags [P.], seq 436454:439202, ack 822, win 65535, length 2748
20:14:54.486275 IP 142.251.40.238.443 > 10.0.2.15.54912: Flags [P.], seq 439202:443324, ack 822, win 65535, length 4122
20:14:54.486331 IP 10.0.2.15.54912 > 142.251.40.238.443: Flags [.], ack 436454, win 65535, length 0
20:14:54.486400 IP 10.0.2.15.54912 > 142.251.40.238.443: Flags [.], ack 439202, win 65535, length 0
20:14:54.486433 IP 10.0.2.15.54912 > 142.251.40.238.443: Flags [.], ack 443324, win 65535, length 0
20:14:54.486932 IP 142.251.40.238.443 > 10.0.2.15.54912: Flags [P.], seq 443324:450194, ack 822, win 65535, length 6870
20:14:54.486934 IP 142.251.40.238.443 > 10.0.2.15.54912: Flags [P.], seq 450194:454316, ack 822, win 65535, length 4122
20:14:54.486945 IP 10.0.2.15.54912 > 142.251.40.238.443: Flags [.], ack 450194, win 65535, length 0
20:14:54.486959 IP 10.0.2.15.54912 > 142.251.40.238.443: Flags [.], ack 454316, win 65535, length 0
20:14:54.486983 IP 142.251.40.238.443 > 10.0.2.15.54912: Flags [P.], seq 454316:459812, ack 822, win 65535, length 5496
20:14:54.486988 IP 10.0.2.15.54912 > 142.251.40.238.443: Flags [.], ack 459812, win 65535, length 0
20:14:54.487227 IP 142.251.40.238.443 > 10.0.2.15.54912: Flags [P.], seq 459812:465308, ack 822, win 65535, length 5496
20:14:54.487237 IP 10.0.2.15.54912 > 142.251.40.238.443: Flags [.], ack 465308, win 65535, length 0
20:14:54.487433 IP 142.251.40.238.443 > 10.0.2.15.54912: Flags [P.], seq 465308:468056, ack 822, win 65535, length 2748
20:14:54.487440 IP 10.0.2.15.54912 > 142.251.40.238.443: Flags [.], ack 468056, win 65535, length 0
20:14:54.488416 IP 142.251.40.238.443 > 10.0.2.15.54912: Flags [P.], seq 468056:474926, ack 822, win 65535, length 6870
20:14:54.488418 IP 142.251.40.238.443 > 10.0.2.15.54912: Flags [P.], seq 474926:477674, ack 822, win 65535, length 2748
20:14:54.488419 IP 142.251.40.238.443 > 10.0.2.15.54912: Flags [P.], seq 477674:480422, ack 822, win 65535, length 2748
20:14:54.488605 IP 10.0.2.15.54912 > 142.251.40.238.443: Flags [.], ack 474926, win 65535, length 0
20:14:54.488718 IP 10.0.2.15.54912 > 142.251.40.238.443: Flags [.], ack 477674, win 65535, length 0
20:14:54.488738 IP 10.0.2.15.54912 > 142.251.40.238.443: Flags [.], ack 480422, win 65535, length 0
20:14:54.488766 IP 142.251.40.238.443 > 10.0.2.15.54912: Flags [P.], seq 480422:485918, ack 822, win 65535, length 5496
20:14:54.488767 IP 142.251.40.238.443 > 10.0.2.15.54912: Flags [P.], seq 485918:488666, ack 822, win 65535, length 2748
20:14:54.488776 IP 10.0.2.15.54912 > 142.251.40.238.443: Flags [.], ack 485918, win 65535, length 0
20:14:54.488790 IP 10.0.2.15.54912 > 142.251.40.238.443: Flags [.], ack 488666, win 65535, length 0

