23:16:26.916890 IP 10.0.2.15.51260 > 140.233.253.2.53: 24021+ A? www.walmart.com. (33)
23:16:26.916939 IP 10.0.2.15.51260 > 140.233.253.2.53: 6609+ AAAA? www.walmart.com. (33)
23:16:26.922690 IP 140.233.253.2.53 > 10.0.2.15.51260: 6609 2/1/0 CNAME www.walmart.com.edgekey.net., CNAME e4373.x.akamaiedge.net. (165)
23:16:26.934428 IP 140.233.253.2.53 > 10.0.2.15.51260: 24021 3/0/0 CNAME www.walmart.com.edgekey.net., CNAME e4373.x.akamaiedge.net., A 23.33.252.28 (123)
23:16:26.934876 IP 10.0.2.15.40810 > 23.33.252.28.443: Flags [S], seq 3703086312, win 64240, options [mss 1460,sackOK,TS val 4055033016 ecr 0,nop,wscale 6], length 0
23:16:26.950767 IP 23.33.252.28.443 > 10.0.2.15.40810: Flags [S.], seq 417920001, ack 3703086313, win 65535, options [mss 1460], length 0
23:16:26.950818 IP 10.0.2.15.40810 > 23.33.252.28.443: Flags [.], ack 1, win 64240, length 0
23:16:26.959076 IP 10.0.2.15.40810 > 23.33.252.28.443: Flags [P.], seq 1:518, ack 1, win 64240, length 517
23:16:26.959539 IP 23.33.252.28.443 > 10.0.2.15.40810: Flags [.], ack 518, win 65535, length 0
23:16:26.978097 IP 23.33.252.28.443 > 10.0.2.15.40810: Flags [.], seq 1:2921, ack 518, win 65535, length 2920
23:16:26.978176 IP 10.0.2.15.40810 > 23.33.252.28.443: Flags [.], ack 2921, win 62780, length 0
23:16:26.978541 IP 23.33.252.28.443 > 10.0.2.15.40810: Flags [P.], seq 2921:4232, ack 518, win 65535, length 1311
23:16:26.978558 IP 10.0.2.15.40810 > 23.33.252.28.443: Flags [.], ack 4232, win 61469, length 0
23:16:26.980315 IP 10.0.2.15.40810 > 23.33.252.28.443: Flags [P.], seq 518:598, ack 4232, win 62780, length 80
23:16:26.980498 IP 10.0.2.15.40810 > 23.33.252.28.443: Flags [P.], seq 598:693, ack 4232, win 62780, length 95
23:16:26.980572 IP 10.0.2.15.40810 > 23.33.252.28.443: Flags [P.], seq 693:728, ack 4232, win 62780, length 35
23:16:26.980792 IP 23.33.252.28.443 > 10.0.2.15.40810: Flags [.], ack 598, win 65535, length 0
23:16:26.980794 IP 23.33.252.28.443 > 10.0.2.15.40810: Flags [.], ack 693, win 65535, length 0
23:16:26.980794 IP 23.33.252.28.443 > 10.0.2.15.40810: Flags [.], ack 728, win 65535, length 0
23:16:26.980872 IP 10.0.2.15.40810 > 23.33.252.28.443: Flags [P.], seq 728:791, ack 4232, win 62780, length 63
23:16:26.981055 IP 23.33.252.28.443 > 10.0.2.15.40810: Flags [.], ack 791, win 65535, length 0
23:16:26.995139 IP 23.33.252.28.443 > 10.0.2.15.40810: Flags [P.], seq 4232:4844, ack 791, win 65535, length 612
23:16:26.995159 IP 10.0.2.15.40810 > 23.33.252.28.443: Flags [.], ack 4844, win 62780, length 0
23:16:26.995526 IP 10.0.2.15.40810 > 23.33.252.28.443: Flags [P.], seq 791:822, ack 4844, win 62780, length 31
23:16:26.995812 IP 23.33.252.28.443 > 10.0.2.15.40810: Flags [.], ack 822, win 65535, length 0

