23:13:53.755681 IP 10.0.2.15.42329 > 140.233.253.2.53: 58443+ A? www.walmart.com. (33)
23:13:53.755723 IP 10.0.2.15.42329 > 140.233.253.2.53: 38991+ AAAA? www.walmart.com. (33)
23:13:53.763109 IP 140.233.253.2.53 > 10.0.2.15.42329: 38991 2/1/0 CNAME www.walmart.com.edgekey.net., CNAME e4373.x.akamaiedge.net. (165)
23:13:53.774596 IP 140.233.253.2.53 > 10.0.2.15.42329: 58443 3/0/0 CNAME www.walmart.com.edgekey.net., CNAME e4373.x.akamaiedge.net., A 23.33.252.28 (123)
23:13:53.774887 IP 10.0.2.15.40754 > 23.33.252.28.443: Flags [S], seq 2135500355, win 64240, options [mss 1460,sackOK,TS val 4054879856 ecr 0,nop,wscale 6], length 0
23:13:53.790125 IP 23.33.252.28.443 > 10.0.2.15.40754: Flags [S.], seq 414464001, ack 2135500356, win 65535, options [mss 1460], length 0
23:13:53.790171 IP 10.0.2.15.40754 > 23.33.252.28.443: Flags [.], ack 1, win 64240, length 0
23:13:53.803384 IP 10.0.2.15.40754 > 23.33.252.28.443: Flags [P.], seq 1:518, ack 1, win 64240, length 517
23:13:53.803984 IP 23.33.252.28.443 > 10.0.2.15.40754: Flags [.], ack 518, win 65535, length 0
23:13:53.822472 IP 23.33.252.28.443 > 10.0.2.15.40754: Flags [.], seq 1:2921, ack 518, win 65535, length 2920
23:13:53.822498 IP 10.0.2.15.40754 > 23.33.252.28.443: Flags [.], ack 2921, win 62780, length 0
23:13:53.822976 IP 23.33.252.28.443 > 10.0.2.15.40754: Flags [P.], seq 2921:4232, ack 518, win 65535, length 1311
23:13:53.823001 IP 10.0.2.15.40754 > 23.33.252.28.443: Flags [.], ack 4232, win 61469, length 0
23:13:53.824743 IP 10.0.2.15.40754 > 23.33.252.28.443: Flags [P.], seq 518:598, ack 4232, win 62780, length 80
23:13:53.825288 IP 23.33.252.28.443 > 10.0.2.15.40754: Flags [.], ack 598, win 65535, length 0
23:13:53.825477 IP 10.0.2.15.40754 > 23.33.252.28.443: Flags [P.], seq 598:644, ack 4232, win 62780, length 46
23:13:53.825515 IP 10.0.2.15.40754 > 23.33.252.28.443: Flags [P.], seq 644:693, ack 4232, win 62780, length 49
23:13:53.825935 IP 23.33.252.28.443 > 10.0.2.15.40754: Flags [.], ack 644, win 65535, length 0
23:13:53.825936 IP 23.33.252.28.443 > 10.0.2.15.40754: Flags [.], ack 693, win 65535, length 0
23:13:53.825957 IP 10.0.2.15.40754 > 23.33.252.28.443: Flags [P.], seq 693:791, ack 4232, win 62780, length 98
23:13:53.826354 IP 23.33.252.28.443 > 10.0.2.15.40754: Flags [.], ack 791, win 65535, length 0
23:13:53.840634 IP 23.33.252.28.443 > 10.0.2.15.40754: Flags [P.], seq 4232:4866, ack 791, win 65535, length 634
23:13:53.840661 IP 10.0.2.15.40754 > 23.33.252.28.443: Flags [.], ack 4866, win 62780, length 0
23:13:53.841181 IP 10.0.2.15.40754 > 23.33.252.28.443: Flags [P.], seq 791:822, ack 4866, win 62780, length 31
23:13:53.841608 IP 23.33.252.28.443 > 10.0.2.15.40754: Flags [.], ack 822, win 65535, length 0

