23:15:16.434215 IP 10.0.2.15.45700 > 140.233.253.2.53: 7214+ A? www.walmart.com. (33)
23:15:16.434261 IP 10.0.2.15.45700 > 140.233.253.2.53: 63538+ AAAA? www.walmart.com. (33)
23:15:16.439328 IP 140.233.253.2.53 > 10.0.2.15.45700: 7214 3/0/0 CNAME www.walmart.com.edgekey.net., CNAME e4373.x.akamaiedge.net., A 23.33.252.28 (123)
23:15:21.438843 IP 10.0.2.15.45700 > 140.233.253.2.53: 7214+ A? www.walmart.com. (33)
23:15:21.457049 IP 140.233.253.2.53 > 10.0.2.15.45700: 7214 3/0/0 CNAME www.walmart.com.edgekey.net., CNAME e4373.x.akamaiedge.net., A 23.33.252.28 (123)
23:15:21.457145 IP 10.0.2.15.45700 > 140.233.253.2.53: 63538+ AAAA? www.walmart.com. (33)
23:15:21.462758 IP 140.233.253.2.53 > 10.0.2.15.45700: 63538 2/1/0 CNAME www.walmart.com.edgekey.net., CNAME e4373.x.akamaiedge.net. (165)
23:15:21.463005 IP 10.0.2.15.40784 > 23.33.252.28.443: Flags [S], seq 631502531, win 64240, options [mss 1460,sackOK,TS val 4054967544 ecr 0,nop,wscale 6], length 0
23:15:21.480999 IP 23.33.252.28.443 > 10.0.2.15.40784: Flags [S.], seq 416384001, ack 631502532, win 65535, options [mss 1460], length 0
23:15:21.481118 IP 10.0.2.15.40784 > 23.33.252.28.443: Flags [.], ack 1, win 64240, length 0
23:15:21.492803 IP 10.0.2.15.40784 > 23.33.252.28.443: Flags [P.], seq 1:518, ack 1, win 64240, length 517
23:15:21.493908 IP 23.33.252.28.443 > 10.0.2.15.40784: Flags [.], ack 518, win 65535, length 0
23:15:21.511955 IP 23.33.252.28.443 > 10.0.2.15.40784: Flags [.], seq 1:2921, ack 518, win 65535, length 2920
23:15:21.512430 IP 10.0.2.15.40784 > 23.33.252.28.443: Flags [.], ack 2921, win 62780, length 0
23:15:21.513130 IP 23.33.252.28.443 > 10.0.2.15.40784: Flags [P.], seq 2921:4232, ack 518, win 65535, length 1311
23:15:21.513159 IP 10.0.2.15.40784 > 23.33.252.28.443: Flags [.], ack 4232, win 61469, length 0
23:15:21.515598 IP 10.0.2.15.40784 > 23.33.252.28.443: Flags [P.], seq 518:598, ack 4232, win 62780, length 80
23:15:21.516605 IP 23.33.252.28.443 > 10.0.2.15.40784: Flags [.], ack 598, win 65535, length 0
23:15:21.517014 IP 10.0.2.15.40784 > 23.33.252.28.443: Flags [P.], seq 598:644, ack 4232, win 62780, length 46
23:15:21.517084 IP 10.0.2.15.40784 > 23.33.252.28.443: Flags [P.], seq 644:693, ack 4232, win 62780, length 49
23:15:21.517802 IP 10.0.2.15.40784 > 23.33.252.28.443: Flags [P.], seq 693:728, ack 4232, win 62780, length 35
23:15:21.517839 IP 23.33.252.28.443 > 10.0.2.15.40784: Flags [.], ack 644, win 65535, length 0
23:15:21.517840 IP 23.33.252.28.443 > 10.0.2.15.40784: Flags [.], ack 693, win 65535, length 0
23:15:21.518137 IP 23.33.252.28.443 > 10.0.2.15.40784: Flags [.], ack 728, win 65535, length 0
23:15:21.518406 IP 10.0.2.15.40784 > 23.33.252.28.443: Flags [P.], seq 728:791, ack 4232, win 62780, length 63
23:15:21.518866 IP 23.33.252.28.443 > 10.0.2.15.40784: Flags [.], ack 791, win 65535, length 0
23:15:21.530669 IP 23.33.252.28.443 > 10.0.2.15.40784: Flags [P.], seq 4232:4774, ack 791, win 65535, length 542
23:15:21.530692 IP 10.0.2.15.40784 > 23.33.252.28.443: Flags [.], ack 4774, win 62780, length 0
23:15:21.531272 IP 23.33.252.28.443 > 10.0.2.15.40784: Flags [P.], seq 4774:4866, ack 791, win 65535, length 92
23:15:21.531290 IP 10.0.2.15.40784 > 23.33.252.28.443: Flags [.], ack 4866, win 62780, length 0
23:15:21.531657 IP 10.0.2.15.40784 > 23.33.252.28.443: Flags [P.], seq 791:822, ack 4866, win 62780, length 31
23:15:21.532127 IP 23.33.252.28.443 > 10.0.2.15.40784: Flags [.], ack 822, win 65535, length 0

