23:17:36.091755 IP 10.0.2.15.45933 > 140.233.253.2.53: 38563+ A? www.walmart.com. (33)
23:17:36.091801 IP 10.0.2.15.45933 > 140.233.253.2.53: 3496+ AAAA? www.walmart.com. (33)
23:17:36.098799 IP 140.233.253.2.53 > 10.0.2.15.45933: 38563 3/0/0 CNAME www.walmart.com.edgekey.net., CNAME e4373.x.akamaiedge.net., A 23.33.252.28 (123)
23:17:36.098801 IP 140.233.253.2.53 > 10.0.2.15.45933: 3496 2/1/0 CNAME www.walmart.com.edgekey.net., CNAME e4373.x.akamaiedge.net. (165)
23:17:36.099114 IP 10.0.2.15.40840 > 23.33.252.28.443: Flags [S], seq 2958775576, win 64240, options [mss 1460,sackOK,TS val 4055102180 ecr 0,nop,wscale 6], length 0
23:17:36.115430 IP 23.33.252.28.443 > 10.0.2.15.40840: Flags [S.], seq 419584001, ack 2958775577, win 65535, options [mss 1460], length 0
23:17:36.115469 IP 10.0.2.15.40840 > 23.33.252.28.443: Flags [.], ack 1, win 64240, length 0
23:17:36.127538 IP 10.0.2.15.40840 > 23.33.252.28.443: Flags [P.], seq 1:518, ack 1, win 64240, length 517
23:17:36.128112 IP 23.33.252.28.443 > 10.0.2.15.40840: Flags [.], ack 518, win 65535, length 0
23:17:36.146564 IP 23.33.252.28.443 > 10.0.2.15.40840: Flags [P.], seq 1:1375, ack 518, win 65535, length 1374
23:17:36.146590 IP 10.0.2.15.40840 > 23.33.252.28.443: Flags [.], ack 1375, win 63204, length 0
23:17:36.147348 IP 23.33.252.28.443 > 10.0.2.15.40840: Flags [P.], seq 1375:4232, ack 518, win 65535, length 2857
23:17:36.147495 IP 10.0.2.15.40840 > 23.33.252.28.443: Flags [.], ack 4232, win 61320, length 0
23:17:36.149155 IP 10.0.2.15.40840 > 23.33.252.28.443: Flags [P.], seq 518:598, ack 4232, win 62780, length 80
23:17:36.149577 IP 23.33.252.28.443 > 10.0.2.15.40840: Flags [.], ack 598, win 65535, length 0
23:17:36.149677 IP 10.0.2.15.40840 > 23.33.252.28.443: Flags [P.], seq 598:644, ack 4232, win 62780, length 46
23:17:36.149720 IP 10.0.2.15.40840 > 23.33.252.28.443: Flags [P.], seq 644:693, ack 4232, win 62780, length 49
23:17:36.149976 IP 10.0.2.15.40840 > 23.33.252.28.443: Flags [P.], seq 693:791, ack 4232, win 62780, length 98
23:17:36.150165 IP 23.33.252.28.443 > 10.0.2.15.40840: Flags [.], ack 644, win 65535, length 0
23:17:36.150427 IP 23.33.252.28.443 > 10.0.2.15.40840: Flags [.], ack 693, win 65535, length 0
23:17:36.150430 IP 23.33.252.28.443 > 10.0.2.15.40840: Flags [.], ack 791, win 65535, length 0
23:17:36.165200 IP 23.33.252.28.443 > 10.0.2.15.40840: Flags [P.], seq 4232:4866, ack 791, win 65535, length 634
23:17:36.165223 IP 10.0.2.15.40840 > 23.33.252.28.443: Flags [.], ack 4866, win 62780, length 0
23:17:36.165660 IP 10.0.2.15.40840 > 23.33.252.28.443: Flags [P.], seq 791:822, ack 4866, win 62780, length 31
23:17:36.166020 IP 23.33.252.28.443 > 10.0.2.15.40840: Flags [.], ack 822, win 65535, length 0

