23:17:14.981876 IP 10.0.2.15.41870 > 140.233.253.2.53: 2793+ A? www.walmart.com. (33)
23:17:14.981917 IP 10.0.2.15.41870 > 140.233.253.2.53: 63221+ AAAA? www.walmart.com. (33)
23:17:14.989846 IP 140.233.253.2.53 > 10.0.2.15.41870: 2793 3/0/0 CNAME www.walmart.com.edgekey.net., CNAME e4373.x.akamaiedge.net., A 23.33.252.28 (123)
23:17:14.989849 IP 140.233.253.2.53 > 10.0.2.15.41870: 63221 2/1/0 CNAME www.walmart.com.edgekey.net., CNAME e4373.x.akamaiedge.net. (165)
23:17:14.990270 IP 10.0.2.15.40830 > 23.33.252.28.443: Flags [S], seq 4014414075, win 64240, options [mss 1460,sackOK,TS val 4055081071 ecr 0,nop,wscale 6], length 0
23:17:15.004735 IP 23.33.252.28.443 > 10.0.2.15.40830: Flags [S.], seq 419072001, ack 4014414076, win 65535, options [mss 1460], length 0
23:17:15.004775 IP 10.0.2.15.40830 > 23.33.252.28.443: Flags [.], ack 1, win 64240, length 0
23:17:15.012197 IP 10.0.2.15.40830 > 23.33.252.28.443: Flags [P.], seq 1:518, ack 1, win 64240, length 517
23:17:15.012559 IP 23.33.252.28.443 > 10.0.2.15.40830: Flags [.], ack 518, win 65535, length 0
23:17:15.031200 IP 23.33.252.28.443 > 10.0.2.15.40830: Flags [.], seq 1:2921, ack 518, win 65535, length 2920
23:17:15.031226 IP 10.0.2.15.40830 > 23.33.252.28.443: Flags [.], ack 2921, win 62780, length 0
23:17:15.031640 IP 23.33.252.28.443 > 10.0.2.15.40830: Flags [P.], seq 2921:4097, ack 518, win 65535, length 1176
23:17:15.031861 IP 10.0.2.15.40830 > 23.33.252.28.443: Flags [.], ack 4097, win 61604, length 0
23:17:15.032685 IP 23.33.252.28.443 > 10.0.2.15.40830: Flags [P.], seq 4097:4232, ack 518, win 65535, length 135
23:17:15.032708 IP 10.0.2.15.40830 > 23.33.252.28.443: Flags [.], ack 4232, win 61604, length 0
23:17:15.034116 IP 10.0.2.15.40830 > 23.33.252.28.443: Flags [P.], seq 518:598, ack 4232, win 62780, length 80
23:17:15.034660 IP 23.33.252.28.443 > 10.0.2.15.40830: Flags [.], ack 598, win 65535, length 0
23:17:15.034725 IP 10.0.2.15.40830 > 23.33.252.28.443: Flags [P.], seq 598:644, ack 4232, win 62780, length 46
23:17:15.034760 IP 10.0.2.15.40830 > 23.33.252.28.443: Flags [P.], seq 644:693, ack 4232, win 62780, length 49
23:17:15.035025 IP 23.33.252.28.443 > 10.0.2.15.40830: Flags [.], ack 644, win 65535, length 0
23:17:15.035135 IP 10.0.2.15.40830 > 23.33.252.28.443: Flags [P.], seq 693:728, ack 4232, win 62780, length 35
23:17:15.035223 IP 10.0.2.15.40830 > 23.33.252.28.443: Flags [P.], seq 728:791, ack 4232, win 62780, length 63
23:17:15.035420 IP 23.33.252.28.443 > 10.0.2.15.40830: Flags [.], ack 693, win 65535, length 0
23:17:15.035422 IP 23.33.252.28.443 > 10.0.2.15.40830: Flags [.], ack 728, win 65535, length 0
23:17:15.035676 IP 23.33.252.28.443 > 10.0.2.15.40830: Flags [.], ack 791, win 65535, length 0
23:17:15.048915 IP 23.33.252.28.443 > 10.0.2.15.40830: Flags [P.], seq 4232:4503, ack 791, win 65535, length 271
23:17:15.048937 IP 10.0.2.15.40830 > 23.33.252.28.443: Flags [.], ack 4503, win 62780, length 0
23:17:15.050851 IP 23.33.252.28.443 > 10.0.2.15.40830: Flags [P.], seq 4503:4844, ack 791, win 65535, length 341
23:17:15.050911 IP 10.0.2.15.40830 > 23.33.252.28.443: Flags [.], ack 4844, win 62780, length 0
23:17:15.051528 IP 10.0.2.15.40830 > 23.33.252.28.443: Flags [P.], seq 791:822, ack 4844, win 62780, length 31
23:17:15.051914 IP 23.33.252.28.443 > 10.0.2.15.40830: Flags [.], ack 822, win 65535, length 0

