23:16:37.568694 IP 10.0.2.15.52953 > 140.233.253.2.53: 19180+ A? www.walmart.com. (33)
23:16:37.568737 IP 10.0.2.15.52953 > 140.233.253.2.53: 52970+ AAAA? www.walmart.com. (33)
23:16:37.574848 IP 140.233.253.2.53 > 10.0.2.15.52953: 19180 3/0/0 CNAME www.walmart.com.edgekey.net., CNAME e4373.x.akamaiedge.net., A 23.33.252.28 (123)
23:16:37.574850 IP 140.233.253.2.53 > 10.0.2.15.52953: 52970 2/1/0 CNAME www.walmart.com.edgekey.net., CNAME e4373.x.akamaiedge.net. (165)
23:16:37.575190 IP 10.0.2.15.40814 > 23.33.252.28.443: Flags [S], seq 3094475874, win 64240, options [mss 1460,sackOK,TS val 4055043656 ecr 0,nop,wscale 6], length 0
23:16:37.590878 IP 23.33.252.28.443 > 10.0.2.15.40814: Flags [S.], seq 418176001, ack 3094475875, win 65535, options [mss 1460], length 0
23:16:37.590931 IP 10.0.2.15.40814 > 23.33.252.28.443: Flags [.], ack 1, win 64240, length 0
23:16:37.598844 IP 10.0.2.15.40814 > 23.33.252.28.443: Flags [P.], seq 1:518, ack 1, win 64240, length 517
23:16:37.599287 IP 23.33.252.28.443 > 10.0.2.15.40814: Flags [.], ack 518, win 65535, length 0
23:16:37.617031 IP 23.33.252.28.443 > 10.0.2.15.40814: Flags [P.], seq 1:2749, ack 518, win 65535, length 2748
23:16:37.617054 IP 10.0.2.15.40814 > 23.33.252.28.443: Flags [.], ack 2749, win 62780, length 0
23:16:37.617589 IP 23.33.252.28.443 > 10.0.2.15.40814: Flags [P.], seq 2749:4232, ack 518, win 65535, length 1483
23:16:37.617603 IP 10.0.2.15.40814 > 23.33.252.28.443: Flags [.], ack 4232, win 61320, length 0
23:16:37.618807 IP 10.0.2.15.40814 > 23.33.252.28.443: Flags [P.], seq 518:598, ack 4232, win 62780, length 80
23:16:37.619166 IP 23.33.252.28.443 > 10.0.2.15.40814: Flags [.], ack 598, win 65535, length 0
23:16:37.619288 IP 10.0.2.15.40814 > 23.33.252.28.443: Flags [P.], seq 598:644, ack 4232, win 62780, length 46
23:16:37.619320 IP 10.0.2.15.40814 > 23.33.252.28.443: Flags [P.], seq 644:693, ack 4232, win 62780, length 49
23:16:37.619473 IP 10.0.2.15.40814 > 23.33.252.28.443: Flags [P.], seq 693:728, ack 4232, win 62780, length 35
23:16:37.619604 IP 23.33.252.28.443 > 10.0.2.15.40814: Flags [.], ack 644, win 65535, length 0
23:16:37.619606 IP 23.33.252.28.443 > 10.0.2.15.40814: Flags [.], ack 693, win 65535, length 0
23:16:37.619606 IP 23.33.252.28.443 > 10.0.2.15.40814: Flags [.], ack 728, win 65535, length 0
23:16:37.619694 IP 10.0.2.15.40814 > 23.33.252.28.443: Flags [P.], seq 728:791, ack 4232, win 62780, length 63
23:16:37.619909 IP 23.33.252.28.443 > 10.0.2.15.40814: Flags [.], ack 791, win 65535, length 0
23:16:37.632827 IP 23.33.252.28.443 > 10.0.2.15.40814: Flags [P.], seq 4232:4774, ack 791, win 65535, length 542
23:16:37.632849 IP 10.0.2.15.40814 > 23.33.252.28.443: Flags [.], ack 4774, win 62780, length 0
23:16:37.633622 IP 23.33.252.28.443 > 10.0.2.15.40814: Flags [P.], seq 4774:4866, ack 791, win 65535, length 92
23:16:37.633640 IP 10.0.2.15.40814 > 23.33.252.28.443: Flags [.], ack 4866, win 62780, length 0
23:16:37.634007 IP 10.0.2.15.40814 > 23.33.252.28.443: Flags [P.], seq 791:822, ack 4866, win 62780, length 31
23:16:37.634387 IP 23.33.252.28.443 > 10.0.2.15.40814: Flags [.], ack 822, win 65535, length 0

