23:14:21.493845 IP 10.0.2.15.38226 > 140.233.253.2.53: 54771+ A? www.walmart.com. (33)
23:14:21.493891 IP 10.0.2.15.38226 > 140.233.253.2.53: 43503+ AAAA? www.walmart.com. (33)
23:14:21.499449 IP 140.233.253.2.53 > 10.0.2.15.38226: 54771 3/0/0 CNAME www.walmart.com.edgekey.net., CNAME e4373.x.akamaiedge.net., A 23.33.252.28 (123)
23:14:21.499452 IP 140.233.253.2.53 > 10.0.2.15.38226: 43503 2/1/0 CNAME www.walmart.com.edgekey.net., CNAME e4373.x.akamaiedge.net. (165)
23:14:21.499791 IP 10.0.2.15.40764 > 23.33.252.28.443: Flags [S], seq 25008251, win 64240, options [mss 1460,sackOK,TS val 4054907581 ecr 0,nop,wscale 6], length 0
23:14:21.516426 IP 23.33.252.28.443 > 10.0.2.15.40764: Flags [S.], seq 415104001, ack 25008252, win 65535, options [mss 1460], length 0
23:14:21.516482 IP 10.0.2.15.40764 > 23.33.252.28.443: Flags [.], ack 1, win 64240, length 0
23:14:21.531293 IP 10.0.2.15.40764 > 23.33.252.28.443: Flags [P.], seq 1:518, ack 1, win 64240, length 517
23:14:21.531879 IP 23.33.252.28.443 > 10.0.2.15.40764: Flags [.], ack 518, win 65535, length 0
23:14:21.552428 IP 23.33.252.28.443 > 10.0.2.15.40764: Flags [.], seq 1:2921, ack 518, win 65535, length 2920
23:14:21.552450 IP 10.0.2.15.40764 > 23.33.252.28.443: Flags [.], ack 2921, win 62780, length 0
23:14:21.552837 IP 23.33.252.28.443 > 10.0.2.15.40764: Flags [P.], seq 2921:4097, ack 518, win 65535, length 1176
23:14:21.552858 IP 10.0.2.15.40764 > 23.33.252.28.443: Flags [.], ack 4097, win 61604, length 0
23:14:21.553062 IP 23.33.252.28.443 > 10.0.2.15.40764: Flags [P.], seq 4097:4232, ack 518, win 65535, length 135
23:14:21.553073 IP 10.0.2.15.40764 > 23.33.252.28.443: Flags [.], ack 4232, win 61604, length 0
23:14:21.554552 IP 10.0.2.15.40764 > 23.33.252.28.443: Flags [P.], seq 518:598, ack 4232, win 62780, length 80
23:14:21.554903 IP 23.33.252.28.443 > 10.0.2.15.40764: Flags [.], ack 598, win 65535, length 0
23:14:21.555108 IP 10.0.2.15.40764 > 23.33.252.28.443: Flags [P.], seq 598:644, ack 4232, win 62780, length 46
23:14:21.555295 IP 10.0.2.15.40764 > 23.33.252.28.443: Flags [P.], seq 644:693, ack 4232, win 62780, length 49
23:14:21.555513 IP 23.33.252.28.443 > 10.0.2.15.40764: Flags [.], ack 644, win 65535, length 0
23:14:21.555703 IP 23.33.252.28.443 > 10.0.2.15.40764: Flags [.], ack 693, win 65535, length 0
23:14:21.555848 IP 10.0.2.15.40764 > 23.33.252.28.443: Flags [P.], seq 693:728, ack 4232, win 62780, length 35
23:14:21.555925 IP 10.0.2.15.40764 > 23.33.252.28.443: Flags [P.], seq 728:791, ack 4232, win 62780, length 63
23:14:21.556264 IP 23.33.252.28.443 > 10.0.2.15.40764: Flags [.], ack 728, win 65535, length 0
23:14:21.556266 IP 23.33.252.28.443 > 10.0.2.15.40764: Flags [.], ack 791, win 65535, length 0
23:14:21.569284 IP 23.33.252.28.443 > 10.0.2.15.40764: Flags [P.], seq 4232:4835, ack 791, win 65535, length 603
23:14:21.569306 IP 10.0.2.15.40764 > 23.33.252.28.443: Flags [.], ack 4835, win 62780, length 0
23:14:21.569703 IP 10.0.2.15.40764 > 23.33.252.28.443: Flags [P.], seq 791:822, ack 4835, win 62780, length 31
23:14:21.570056 IP 23.33.252.28.443 > 10.0.2.15.40764: Flags [.], ack 822, win 65535, length 0
23:14:21.570185 IP 23.33.252.28.443 > 10.0.2.15.40764: Flags [P.], seq 4835:4866, ack 822, win 65535, length 31
23:14:21.570195 IP 10.0.2.15.40764 > 23.33.252.28.443: Flags [.], ack 4866, win 62780, length 0

