22:40:00.480136 IP 10.0.2.15.55470 > 140.233.253.2.53: 15768+ A? www.roblox.com. (32)
22:40:00.480181 IP 10.0.2.15.55470 > 140.233.253.2.53: 15077+ AAAA? www.roblox.com. (32)
22:40:00.486449 IP 140.233.253.2.53 > 10.0.2.15.55470: 15077 2/1/0 CNAME gold.roblox.com., CNAME golden.roblox.com. (137)
22:40:00.486451 IP 140.233.253.2.53 > 10.0.2.15.55470: 15768 3/0/0 CNAME gold.roblox.com., CNAME golden.roblox.com., A 128.116.126.3 (88)
22:40:00.486683 IP 10.0.2.15.36666 > 128.116.126.3.443: Flags [S], seq 2337085988, win 64240, options [mss 1460,sackOK,TS val 4001205016 ecr 0,nop,wscale 6], length 0
22:40:00.499068 IP 128.116.126.3.443 > 10.0.2.15.36666: Flags [S.], seq 375808001, ack 2337085989, win 65535, options [mss 1460], length 0
22:40:00.499114 IP 10.0.2.15.36666 > 128.116.126.3.443: Flags [.], ack 1, win 64240, length 0
22:40:00.507765 IP 10.0.2.15.36666 > 128.116.126.3.443: Flags [P.], seq 1:518, ack 1, win 64240, length 517
22:40:00.508195 IP 128.116.126.3.443 > 10.0.2.15.36666: Flags [.], ack 518, win 65535, length 0
22:40:00.520585 IP 128.116.126.3.443 > 10.0.2.15.36666: Flags [.], seq 1:2921, ack 518, win 65535, length 2920
22:40:00.520607 IP 10.0.2.15.36666 > 128.116.126.3.443: Flags [.], ack 2921, win 62780, length 0
22:40:00.520839 IP 128.116.126.3.443 > 10.0.2.15.36666: Flags [P.], seq 2921:4445, ack 518, win 65535, length 1524
22:40:00.520854 IP 10.0.2.15.36666 > 128.116.126.3.443: Flags [.], ack 4445, win 61320, length 0
22:40:00.522217 IP 10.0.2.15.36666 > 128.116.126.3.443: Flags [P.], seq 518:582, ack 4445, win 62780, length 64
22:40:00.522777 IP 128.116.126.3.443 > 10.0.2.15.36666: Flags [.], ack 582, win 65535, length 0
22:40:00.523088 IP 10.0.2.15.36666 > 128.116.126.3.443: Flags [P.], seq 582:628, ack 4445, win 62780, length 46
22:40:00.523317 IP 10.0.2.15.36666 > 128.116.126.3.443: Flags [P.], seq 628:677, ack 4445, win 62780, length 49
22:40:00.523471 IP 128.116.126.3.443 > 10.0.2.15.36666: Flags [.], ack 628, win 65535, length 0
22:40:00.523558 IP 10.0.2.15.36666 > 128.116.126.3.443: Flags [P.], seq 677:712, ack 4445, win 62780, length 35
22:40:00.523613 IP 10.0.2.15.36666 > 128.116.126.3.443: Flags [P.], seq 712:774, ack 4445, win 62780, length 62
22:40:00.523800 IP 128.116.126.3.443 > 10.0.2.15.36666: Flags [.], ack 677, win 65535, length 0
22:40:00.523802 IP 128.116.126.3.443 > 10.0.2.15.36666: Flags [.], ack 712, win 65535, length 0
22:40:00.523802 IP 128.116.126.3.443 > 10.0.2.15.36666: Flags [.], ack 774, win 65535, length 0
22:40:00.533361 IP 128.116.126.3.443 > 10.0.2.15.36666: Flags [P.], seq 4445:5035, ack 774, win 65535, length 590
22:40:00.533384 IP 10.0.2.15.36666 > 128.116.126.3.443: Flags [.], ack 5035, win 62780, length 0
22:40:00.533908 IP 10.0.2.15.36666 > 128.116.126.3.443: Flags [P.], seq 774:805, ack 5035, win 62780, length 31
22:40:00.534340 IP 128.116.126.3.443 > 10.0.2.15.36666: Flags [.], ack 805, win 65535, length 0

