22:43:46.151433 IP 10.0.2.15.55161 > 140.233.253.2.53: 41001+ A? www.roblox.com. (32)
22:43:46.151479 IP 10.0.2.15.55161 > 140.233.253.2.53: 21541+ AAAA? www.roblox.com. (32)
22:43:46.158073 IP 140.233.253.2.53 > 10.0.2.15.55161: 41001 3/0/0 CNAME gold.roblox.com., CNAME golden.roblox.com., A 128.116.126.3 (88)
22:43:46.158075 IP 140.233.253.2.53 > 10.0.2.15.55161: 21541 2/1/0 CNAME gold.roblox.com., CNAME golden.roblox.com. (137)
22:43:46.158348 IP 10.0.2.15.36756 > 128.116.126.3.443: Flags [S], seq 1352379145, win 64240, options [mss 1460,sackOK,TS val 4001430688 ecr 0,nop,wscale 6], length 0
22:43:46.170481 IP 128.116.126.3.443 > 10.0.2.15.36756: Flags [S.], seq 381184001, ack 1352379146, win 65535, options [mss 1460], length 0
22:43:46.170525 IP 10.0.2.15.36756 > 128.116.126.3.443: Flags [.], ack 1, win 64240, length 0
22:43:46.182972 IP 10.0.2.15.36756 > 128.116.126.3.443: Flags [P.], seq 1:518, ack 1, win 64240, length 517
22:43:46.183467 IP 128.116.126.3.443 > 10.0.2.15.36756: Flags [.], ack 518, win 65535, length 0
22:43:46.195873 IP 128.116.126.3.443 > 10.0.2.15.36756: Flags [.], seq 1:2921, ack 518, win 65535, length 2920
22:43:46.195895 IP 10.0.2.15.36756 > 128.116.126.3.443: Flags [.], ack 2921, win 62780, length 0
22:43:46.196132 IP 128.116.126.3.443 > 10.0.2.15.36756: Flags [P.], seq 2921:4097, ack 518, win 65535, length 1176
22:43:46.196147 IP 10.0.2.15.36756 > 128.116.126.3.443: Flags [.], ack 4097, win 61604, length 0
22:43:46.196727 IP 128.116.126.3.443 > 10.0.2.15.36756: Flags [P.], seq 4097:4445, ack 518, win 65535, length 348
22:43:46.196738 IP 10.0.2.15.36756 > 128.116.126.3.443: Flags [.], ack 4445, win 62780, length 0
22:43:46.197989 IP 10.0.2.15.36756 > 128.116.126.3.443: Flags [P.], seq 518:582, ack 4445, win 62780, length 64
22:43:46.198371 IP 128.116.126.3.443 > 10.0.2.15.36756: Flags [.], ack 582, win 65535, length 0
22:43:46.198559 IP 10.0.2.15.36756 > 128.116.126.3.443: Flags [P.], seq 582:628, ack 4445, win 62780, length 46
22:43:46.198609 IP 10.0.2.15.36756 > 128.116.126.3.443: Flags [P.], seq 628:677, ack 4445, win 62780, length 49
22:43:46.198705 IP 10.0.2.15.36756 > 128.116.126.3.443: Flags [P.], seq 677:712, ack 4445, win 62780, length 35
22:43:46.198911 IP 128.116.126.3.443 > 10.0.2.15.36756: Flags [.], ack 628, win 65535, length 0
22:43:46.198913 IP 128.116.126.3.443 > 10.0.2.15.36756: Flags [.], ack 677, win 65535, length 0
22:43:46.198913 IP 128.116.126.3.443 > 10.0.2.15.36756: Flags [.], ack 712, win 65535, length 0
22:43:46.198976 IP 10.0.2.15.36756 > 128.116.126.3.443: Flags [P.], seq 712:774, ack 4445, win 62780, length 62
22:43:46.199176 IP 128.116.126.3.443 > 10.0.2.15.36756: Flags [.], ack 774, win 65535, length 0
22:43:46.208771 IP 128.116.126.3.443 > 10.0.2.15.36756: Flags [P.], seq 4445:4955, ack 774, win 65535, length 510
22:43:46.208843 IP 10.0.2.15.36756 > 128.116.126.3.443: Flags [.], ack 4955, win 62780, length 0
22:43:46.209609 IP 128.116.126.3.443 > 10.0.2.15.36756: Flags [P.], seq 4955:5004, ack 774, win 65535, length 49
22:43:46.209630 IP 10.0.2.15.36756 > 128.116.126.3.443: Flags [.], ack 5004, win 62780, length 0
22:43:46.209987 IP 10.0.2.15.36756 > 128.116.126.3.443: Flags [P.], seq 774:805, ack 5004, win 62780, length 31
22:43:46.210385 IP 128.116.126.3.443 > 10.0.2.15.36756: Flags [.], ack 805, win 65535, length 0
22:43:46.210549 IP 128.116.126.3.443 > 10.0.2.15.36756: Flags [P.], seq 5004:5035, ack 805, win 65535, length 31
22:43:46.210561 IP 10.0.2.15.36756 > 128.116.126.3.443: Flags [.], ack 5035, win 62780, length 0
22:43:46.243583 IP 128.116.126.3.443 > 10.0.2.15.36756: Flags [P.], seq 5035:14838, ack 805, win 65535, length 9803
22:43:46.243586 IP 128.116.126.3.443 > 10.0.2.15.36756: Flags [.], seq 14838:16298, ack 805, win 65535, length 1460
22:43:46.243647 IP 10.0.2.15.36756 > 128.116.126.3.443: Flags [.], ack 14838, win 58400, length 0
22:43:46.243680 IP 10.0.2.15.36756 > 128.116.126.3.443: Flags [.], ack 16298, win 56940, length 0
22:43:46.244045 IP 128.116.126.3.443 > 10.0.2.15.36756: Flags [P.], seq 16298:27204, ack 805, win 65535, length 10906
22:43:46.244064 IP 10.0.2.15.36756 > 128.116.126.3.443: Flags [.], ack 27204, win 49640, length 0
22:43:46.244808 IP 128.116.126.3.443 > 10.0.2.15.36756: Flags [P.], seq 27204:28578, ack 805, win 65535, length 1374
22:43:46.244824 IP 10.0.2.15.36756 > 128.116.126.3.443: Flags [.], ack 28578, win 48266, length 0
22:43:46.254242 IP 128.116.126.3.443 > 10.0.2.15.36756: Flags [P.], seq 28578:40944, ack 805, win 65535, length 12366
22:43:46.254265 IP 10.0.2.15.36756 > 128.116.126.3.443: Flags [.], ack 40944, win 55480, length 0
22:43:46.254320 IP 128.116.126.3.443 > 10.0.2.15.36756: Flags [P.], seq 40944:45066, ack 805, win 65535, length 4122
22:43:46.254412 IP 10.0.2.15.36756 > 128.116.126.3.443: Flags [.], ack 45066, win 52560, length 0

