22:39:02.836962 IP 10.0.2.15.39114 > 140.233.253.2.53: 10385+ A? www.roblox.com. (32)
22:39:02.837003 IP 10.0.2.15.39114 > 140.233.253.2.53: 61847+ AAAA? www.roblox.com. (32)
22:39:02.864599 IP 140.233.253.2.53 > 10.0.2.15.39114: 61847 2/1/0 CNAME gold.roblox.com., CNAME golden.roblox.com. (137)
22:39:02.864600 IP 140.233.253.2.53 > 10.0.2.15.39114: 10385 3/0/0 CNAME gold.roblox.com., CNAME golden.roblox.com., A 128.116.126.3 (88)
22:39:02.865181 IP 10.0.2.15.36646 > 128.116.126.3.443: Flags [S], seq 466146550, win 64240, options [mss 1460,sackOK,TS val 4001147395 ecr 0,nop,wscale 6], length 0
22:39:02.877569 IP 128.116.126.3.443 > 10.0.2.15.36646: Flags [S.], seq 373952001, ack 466146551, win 65535, options [mss 1460], length 0
22:39:02.877646 IP 10.0.2.15.36646 > 128.116.126.3.443: Flags [.], ack 1, win 64240, length 0
22:39:02.886417 IP 10.0.2.15.36646 > 128.116.126.3.443: Flags [P.], seq 1:518, ack 1, win 64240, length 517
22:39:02.886769 IP 128.116.126.3.443 > 10.0.2.15.36646: Flags [.], ack 518, win 65535, length 0
22:39:02.898762 IP 128.116.126.3.443 > 10.0.2.15.36646: Flags [.], seq 1:2921, ack 518, win 65535, length 2920
22:39:02.898784 IP 10.0.2.15.36646 > 128.116.126.3.443: Flags [.], ack 2921, win 62780, length 0
22:39:02.899536 IP 128.116.126.3.443 > 10.0.2.15.36646: Flags [P.], seq 2921:4097, ack 518, win 65535, length 1176
22:39:02.899558 IP 10.0.2.15.36646 > 128.116.126.3.443: Flags [.], ack 4097, win 62780, length 0
22:39:02.900073 IP 128.116.126.3.443 > 10.0.2.15.36646: Flags [P.], seq 4097:4445, ack 518, win 65535, length 348
22:39:02.900087 IP 10.0.2.15.36646 > 128.116.126.3.443: Flags [.], ack 4445, win 62780, length 0
22:39:02.901182 IP 10.0.2.15.36646 > 128.116.126.3.443: Flags [P.], seq 518:582, ack 4445, win 62780, length 64
22:39:02.901560 IP 128.116.126.3.443 > 10.0.2.15.36646: Flags [.], ack 582, win 65535, length 0
22:39:02.901619 IP 10.0.2.15.36646 > 128.116.126.3.443: Flags [P.], seq 582:628, ack 4445, win 62780, length 46
22:39:02.901903 IP 128.116.126.3.443 > 10.0.2.15.36646: Flags [.], ack 628, win 65535, length 0
22:39:02.901953 IP 10.0.2.15.36646 > 128.116.126.3.443: Flags [P.], seq 628:677, ack 4445, win 62780, length 49
22:39:02.902011 IP 10.0.2.15.36646 > 128.116.126.3.443: Flags [P.], seq 677:774, ack 4445, win 62780, length 97
22:39:02.902233 IP 128.116.126.3.443 > 10.0.2.15.36646: Flags [.], ack 677, win 65535, length 0
22:39:02.902234 IP 128.116.126.3.443 > 10.0.2.15.36646: Flags [.], ack 774, win 65535, length 0
22:39:02.912040 IP 128.116.126.3.443 > 10.0.2.15.36646: Flags [P.], seq 4445:4955, ack 774, win 65535, length 510
22:39:02.912069 IP 10.0.2.15.36646 > 128.116.126.3.443: Flags [.], ack 4955, win 62780, length 0
22:39:02.912584 IP 128.116.126.3.443 > 10.0.2.15.36646: Flags [P.], seq 4955:5035, ack 774, win 65535, length 80
22:39:02.912598 IP 10.0.2.15.36646 > 128.116.126.3.443: Flags [.], ack 5035, win 62780, length 0
22:39:02.913008 IP 10.0.2.15.36646 > 128.116.126.3.443: Flags [P.], seq 774:805, ack 5035, win 62780, length 31
22:39:02.913276 IP 128.116.126.3.443 > 10.0.2.15.36646: Flags [.], ack 805, win 65535, length 0

