22:43:24.655031 IP 10.0.2.15.44421 > 140.233.253.2.53: 58264+ A? www.roblox.com. (32)
22:43:24.655073 IP 10.0.2.15.44421 > 140.233.253.2.53: 58268+ AAAA? www.roblox.com. (32)
22:43:24.660722 IP 140.233.253.2.53 > 10.0.2.15.44421: 58264 3/0/0 CNAME gold.roblox.com., CNAME golden.roblox.com., A 128.116.126.3 (88)
22:43:24.660725 IP 140.233.253.2.53 > 10.0.2.15.44421: 58268 2/1/0 CNAME gold.roblox.com., CNAME golden.roblox.com. (137)
22:43:24.661022 IP 10.0.2.15.36748 > 128.116.126.3.443: Flags [S], seq 3619988326, win 64240, options [mss 1460,sackOK,TS val 4001409191 ecr 0,nop,wscale 6], length 0
22:43:24.673110 IP 128.116.126.3.443 > 10.0.2.15.36748: Flags [S.], seq 380672001, ack 3619988327, win 65535, options [mss 1460], length 0
22:43:24.673164 IP 10.0.2.15.36748 > 128.116.126.3.443: Flags [.], ack 1, win 64240, length 0
22:43:24.688250 IP 10.0.2.15.36748 > 128.116.126.3.443: Flags [P.], seq 1:518, ack 1, win 64240, length 517
22:43:24.688774 IP 128.116.126.3.443 > 10.0.2.15.36748: Flags [.], ack 518, win 65535, length 0
22:43:24.701140 IP 128.116.126.3.443 > 10.0.2.15.36748: Flags [P.], seq 1:2749, ack 518, win 65535, length 2748
22:43:24.701166 IP 10.0.2.15.36748 > 128.116.126.3.443: Flags [.], ack 2749, win 62780, length 0
22:43:24.701866 IP 128.116.126.3.443 > 10.0.2.15.36748: Flags [P.], seq 2749:4445, ack 518, win 65535, length 1696
22:43:24.701991 IP 10.0.2.15.36748 > 128.116.126.3.443: Flags [.], ack 4445, win 61320, length 0
22:43:24.703873 IP 10.0.2.15.36748 > 128.116.126.3.443: Flags [P.], seq 518:582, ack 4445, win 62780, length 64
22:43:24.704287 IP 10.0.2.15.36748 > 128.116.126.3.443: Flags [P.], seq 582:628, ack 4445, win 62780, length 46
22:43:24.704328 IP 10.0.2.15.36748 > 128.116.126.3.443: Flags [P.], seq 628:677, ack 4445, win 62780, length 49
22:43:24.704602 IP 128.116.126.3.443 > 10.0.2.15.36748: Flags [.], ack 582, win 65535, length 0
22:43:24.704604 IP 128.116.126.3.443 > 10.0.2.15.36748: Flags [.], ack 628, win 65535, length 0
22:43:24.704605 IP 128.116.126.3.443 > 10.0.2.15.36748: Flags [.], ack 677, win 65535, length 0
22:43:24.704634 IP 10.0.2.15.36748 > 128.116.126.3.443: Flags [P.], seq 677:712, ack 4445, win 62780, length 35
22:43:24.704840 IP 128.116.126.3.443 > 10.0.2.15.36748: Flags [.], ack 712, win 65535, length 0
22:43:24.704910 IP 10.0.2.15.36748 > 128.116.126.3.443: Flags [P.], seq 712:774, ack 4445, win 62780, length 62
22:43:24.705360 IP 128.116.126.3.443 > 10.0.2.15.36748: Flags [.], ack 774, win 65535, length 0
22:43:24.715246 IP 128.116.126.3.443 > 10.0.2.15.36748: Flags [P.], seq 4445:5035, ack 774, win 65535, length 590
22:43:24.715274 IP 10.0.2.15.36748 > 128.116.126.3.443: Flags [.], ack 5035, win 62780, length 0
22:43:24.715752 IP 10.0.2.15.36748 > 128.116.126.3.443: Flags [P.], seq 774:805, ack 5035, win 62780, length 31
22:43:24.716240 IP 128.116.126.3.443 > 10.0.2.15.36748: Flags [.], ack 805, win 65535, length 0

