22:39:13.343188 IP 10.0.2.15.56239 > 140.233.253.2.53: 34180+ A? www.roblox.com. (32)
22:39:13.343221 IP 10.0.2.15.56239 > 140.233.253.2.53: 16058+ AAAA? www.roblox.com. (32)
22:39:13.349441 IP 140.233.253.2.53 > 10.0.2.15.56239: 16058 2/1/0 CNAME gold.roblox.com., CNAME golden.roblox.com. (137)
22:39:13.349443 IP 140.233.253.2.53 > 10.0.2.15.56239: 34180 3/0/0 CNAME gold.roblox.com., CNAME golden.roblox.com., A 128.116.126.3 (88)
22:39:13.349718 IP 10.0.2.15.36650 > 128.116.126.3.443: Flags [S], seq 583467162, win 64240, options [mss 1460,sackOK,TS val 4001157879 ecr 0,nop,wscale 6], length 0
22:39:13.362831 IP 128.116.126.3.443 > 10.0.2.15.36650: Flags [S.], seq 374784001, ack 583467163, win 65535, options [mss 1460], length 0
22:39:13.362876 IP 10.0.2.15.36650 > 128.116.126.3.443: Flags [.], ack 1, win 64240, length 0
22:39:13.372050 IP 10.0.2.15.36650 > 128.116.126.3.443: Flags [P.], seq 1:518, ack 1, win 64240, length 517
22:39:13.372321 IP 128.116.126.3.443 > 10.0.2.15.36650: Flags [.], ack 518, win 65535, length 0
22:39:13.384792 IP 128.116.126.3.443 > 10.0.2.15.36650: Flags [.], seq 1:2921, ack 518, win 65535, length 2920
22:39:13.384882 IP 10.0.2.15.36650 > 128.116.126.3.443: Flags [.], ack 2921, win 62780, length 0
22:39:13.385186 IP 128.116.126.3.443 > 10.0.2.15.36650: Flags [P.], seq 2921:4097, ack 518, win 65535, length 1176
22:39:13.385199 IP 10.0.2.15.36650 > 128.116.126.3.443: Flags [.], ack 4097, win 61604, length 0
22:39:13.385550 IP 128.116.126.3.443 > 10.0.2.15.36650: Flags [P.], seq 4097:4445, ack 518, win 65535, length 348
22:39:13.385560 IP 10.0.2.15.36650 > 128.116.126.3.443: Flags [.], ack 4445, win 61320, length 0
22:39:13.386666 IP 10.0.2.15.36650 > 128.116.126.3.443: Flags [P.], seq 518:582, ack 4445, win 62780, length 64
22:39:13.387050 IP 128.116.126.3.443 > 10.0.2.15.36650: Flags [.], ack 582, win 65535, length 0
22:39:13.387185 IP 10.0.2.15.36650 > 128.116.126.3.443: Flags [P.], seq 582:628, ack 4445, win 62780, length 46
22:39:13.387264 IP 10.0.2.15.36650 > 128.116.126.3.443: Flags [P.], seq 628:677, ack 4445, win 62780, length 49
22:39:13.387494 IP 128.116.126.3.443 > 10.0.2.15.36650: Flags [.], ack 628, win 65535, length 0
22:39:13.387495 IP 128.116.126.3.443 > 10.0.2.15.36650: Flags [.], ack 677, win 65535, length 0
22:39:13.387512 IP 10.0.2.15.36650 > 128.116.126.3.443: Flags [P.], seq 677:712, ack 4445, win 62780, length 35
22:39:13.387731 IP 128.116.126.3.443 > 10.0.2.15.36650: Flags [.], ack 712, win 65535, length 0
22:39:13.387764 IP 10.0.2.15.36650 > 128.116.126.3.443: Flags [P.], seq 712:774, ack 4445, win 62780, length 62
22:39:13.388164 IP 128.116.126.3.443 > 10.0.2.15.36650: Flags [.], ack 774, win 65535, length 0
22:39:13.396919 IP 128.116.126.3.443 > 10.0.2.15.36650: Flags [P.], seq 4445:4955, ack 774, win 65535, length 510
22:39:13.396945 IP 10.0.2.15.36650 > 128.116.126.3.443: Flags [.], ack 4955, win 62780, length 0
22:39:13.398052 IP 128.116.126.3.443 > 10.0.2.15.36650: Flags [P.], seq 4955:5035, ack 774, win 65535, length 80
22:39:13.398069 IP 10.0.2.15.36650 > 128.116.126.3.443: Flags [.], ack 5035, win 62780, length 0
22:39:13.398209 IP 10.0.2.15.36650 > 128.116.126.3.443: Flags [P.], seq 774:805, ack 5035, win 62780, length 31
22:39:13.398551 IP 128.116.126.3.443 > 10.0.2.15.36650: Flags [.], ack 805, win 65535, length 0

