22:40:21.451887 IP 10.0.2.15.50824 > 140.233.253.2.53: 46401+ A? www.roblox.com. (32)
22:40:21.451928 IP 10.0.2.15.50824 > 140.233.253.2.53: 36428+ AAAA? www.roblox.com. (32)
22:40:21.460221 IP 140.233.253.2.53 > 10.0.2.15.50824: 46401 3/0/0 CNAME gold.roblox.com., CNAME golden.roblox.com., A 128.116.126.3 (88)
22:40:21.460223 IP 140.233.253.2.53 > 10.0.2.15.50824: 36428 2/1/0 CNAME gold.roblox.com., CNAME golden.roblox.com. (137)
22:40:21.460558 IP 10.0.2.15.36674 > 128.116.126.3.443: Flags [S], seq 1754036947, win 64240, options [mss 1460,sackOK,TS val 4001225990 ecr 0,nop,wscale 6], length 0
22:40:21.472639 IP 128.116.126.3.443 > 10.0.2.15.36674: Flags [S.], seq 376320001, ack 1754036948, win 65535, options [mss 1460], length 0
22:40:21.472684 IP 10.0.2.15.36674 > 128.116.126.3.443: Flags [.], ack 1, win 64240, length 0
22:40:21.480405 IP 10.0.2.15.36674 > 128.116.126.3.443: Flags [P.], seq 1:518, ack 1, win 64240, length 517
22:40:21.480750 IP 128.116.126.3.443 > 10.0.2.15.36674: Flags [.], ack 518, win 65535, length 0
22:40:21.492088 IP 128.116.126.3.443 > 10.0.2.15.36674: Flags [P.], seq 1:2749, ack 518, win 65535, length 2748
22:40:21.492116 IP 10.0.2.15.36674 > 128.116.126.3.443: Flags [.], ack 2749, win 62780, length 0
22:40:21.492696 IP 128.116.126.3.443 > 10.0.2.15.36674: Flags [P.], seq 2749:4097, ack 518, win 65535, length 1348
22:40:21.492715 IP 10.0.2.15.36674 > 128.116.126.3.443: Flags [.], ack 4097, win 61432, length 0
22:40:21.493882 IP 128.116.126.3.443 > 10.0.2.15.36674: Flags [P.], seq 4097:4445, ack 518, win 65535, length 348
22:40:21.493900 IP 10.0.2.15.36674 > 128.116.126.3.443: Flags [.], ack 4445, win 62780, length 0
22:40:21.495127 IP 10.0.2.15.36674 > 128.116.126.3.443: Flags [P.], seq 518:582, ack 4445, win 62780, length 64
22:40:21.495652 IP 128.116.126.3.443 > 10.0.2.15.36674: Flags [.], ack 582, win 65535, length 0
22:40:21.495725 IP 10.0.2.15.36674 > 128.116.126.3.443: Flags [P.], seq 582:628, ack 4445, win 62780, length 46
22:40:21.495758 IP 10.0.2.15.36674 > 128.116.126.3.443: Flags [P.], seq 628:677, ack 4445, win 62780, length 49
22:40:21.496001 IP 128.116.126.3.443 > 10.0.2.15.36674: Flags [.], ack 628, win 65535, length 0
22:40:21.496002 IP 128.116.126.3.443 > 10.0.2.15.36674: Flags [.], ack 677, win 65535, length 0
22:40:21.496021 IP 10.0.2.15.36674 > 128.116.126.3.443: Flags [P.], seq 677:774, ack 4445, win 62780, length 97
22:40:21.496206 IP 128.116.126.3.443 > 10.0.2.15.36674: Flags [.], ack 774, win 65535, length 0
22:40:21.505733 IP 128.116.126.3.443 > 10.0.2.15.36674: Flags [P.], seq 4445:5013, ack 774, win 65535, length 568
22:40:21.505755 IP 10.0.2.15.36674 > 128.116.126.3.443: Flags [.], ack 5013, win 62780, length 0
22:40:21.506257 IP 10.0.2.15.36674 > 128.116.126.3.443: Flags [P.], seq 774:805, ack 5013, win 62780, length 31
22:40:21.506710 IP 128.116.126.3.443 > 10.0.2.15.36674: Flags [.], ack 805, win 65535, length 0

