22:41:14.901870 IP 10.0.2.15.55632 > 140.233.253.2.53: 5513+ A? www.roblox.com. (32)
22:41:14.902005 IP 10.0.2.15.55632 > 140.233.253.2.53: 56213+ AAAA? www.roblox.com. (32)
22:41:14.908539 IP 140.233.253.2.53 > 10.0.2.15.55632: 5513 3/0/0 CNAME gold.roblox.com., CNAME golden.roblox.com., A 128.116.126.3 (88)
22:41:14.908541 IP 140.233.253.2.53 > 10.0.2.15.55632: 56213 2/1/0 CNAME gold.roblox.com., CNAME golden.roblox.com. (137)
22:41:14.908803 IP 10.0.2.15.36694 > 128.116.126.3.443: Flags [S], seq 378387808, win 64240, options [mss 1460,sackOK,TS val 4001279439 ecr 0,nop,wscale 6], length 0
22:41:14.919922 IP 128.116.126.3.443 > 10.0.2.15.36694: Flags [S.], seq 377600001, ack 378387809, win 65535, options [mss 1460], length 0
22:41:14.919975 IP 10.0.2.15.36694 > 128.116.126.3.443: Flags [.], ack 1, win 64240, length 0
22:41:14.934430 IP 10.0.2.15.36694 > 128.116.126.3.443: Flags [P.], seq 1:518, ack 1, win 64240, length 517
22:41:14.935378 IP 128.116.126.3.443 > 10.0.2.15.36694: Flags [.], ack 518, win 65535, length 0
22:41:14.946805 IP 128.116.126.3.443 > 10.0.2.15.36694: Flags [.], seq 1:2921, ack 518, win 65535, length 2920
22:41:14.946829 IP 10.0.2.15.36694 > 128.116.126.3.443: Flags [.], ack 2921, win 62780, length 0
22:41:14.947409 IP 128.116.126.3.443 > 10.0.2.15.36694: Flags [P.], seq 2921:4097, ack 518, win 65535, length 1176
22:41:14.947439 IP 10.0.2.15.36694 > 128.116.126.3.443: Flags [.], ack 4097, win 61604, length 0
22:41:14.948792 IP 128.116.126.3.443 > 10.0.2.15.36694: Flags [P.], seq 4097:4445, ack 518, win 65535, length 348
22:41:14.948818 IP 10.0.2.15.36694 > 128.116.126.3.443: Flags [.], ack 4445, win 61320, length 0
22:41:14.950473 IP 10.0.2.15.36694 > 128.116.126.3.443: Flags [P.], seq 518:582, ack 4445, win 62780, length 64
22:41:14.950900 IP 128.116.126.3.443 > 10.0.2.15.36694: Flags [.], ack 582, win 65535, length 0
22:41:14.950970 IP 10.0.2.15.36694 > 128.116.126.3.443: Flags [P.], seq 582:628, ack 4445, win 62780, length 46
22:41:14.951005 IP 10.0.2.15.36694 > 128.116.126.3.443: Flags [P.], seq 628:677, ack 4445, win 62780, length 49
22:41:14.951386 IP 128.116.126.3.443 > 10.0.2.15.36694: Flags [.], ack 628, win 65535, length 0
22:41:14.951387 IP 128.116.126.3.443 > 10.0.2.15.36694: Flags [.], ack 677, win 65535, length 0
22:41:14.951405 IP 10.0.2.15.36694 > 128.116.126.3.443: Flags [P.], seq 677:712, ack 4445, win 62780, length 35
22:41:14.951475 IP 10.0.2.15.36694 > 128.116.126.3.443: Flags [P.], seq 712:774, ack 4445, win 62780, length 62
22:41:14.951801 IP 128.116.126.3.443 > 10.0.2.15.36694: Flags [.], ack 712, win 65535, length 0
22:41:14.951802 IP 128.116.126.3.443 > 10.0.2.15.36694: Flags [.], ack 774, win 65535, length 0
22:41:14.960450 IP 128.116.126.3.443 > 10.0.2.15.36694: Flags [P.], seq 4445:4955, ack 774, win 65535, length 510
22:41:14.960476 IP 10.0.2.15.36694 > 128.116.126.3.443: Flags [.], ack 4955, win 62780, length 0
22:41:14.961283 IP 128.116.126.3.443 > 10.0.2.15.36694: Flags [P.], seq 4955:5035, ack 774, win 65535, length 80
22:41:14.961300 IP 10.0.2.15.36694 > 128.116.126.3.443: Flags [.], ack 5035, win 62780, length 0
22:41:14.961809 IP 10.0.2.15.36694 > 128.116.126.3.443: Flags [P.], seq 774:805, ack 5035, win 62780, length 31
22:41:14.962457 IP 128.116.126.3.443 > 10.0.2.15.36694: Flags [.], ack 805, win 65535, length 0

